_ws.col.Time,_ws.col.Source,_ws.col.Destination,_ws.col.Protocol,_ws.col.Length,_ws.col.Info
"0.000000","172.18.0.2","54.38.73.16","TLSv1.2","611","Application Data"
"0.063100","54.38.73.16","172.18.0.2","TCP","68","21002 → 36876 [ACK] Seq=1 Ack=544 Win=1452 Len=0 TSval=2674000516 TSecr=1079405405"
"0.423410","54.38.73.16","172.18.0.2","TLSv1.2","611","Application Data"
"0.424545","172.18.0.2","54.38.73.16","TCP","1516","[TCP segment of a reassembled PDU]"
"0.424632","172.18.0.2","54.38.73.16","TLSv1.2","705","Application Data"
"0.451854","54.38.73.16","172.18.0.2","TCP","68","21002 → 36876 [ACK] Seq=544 Ack=1992 Win=1452 Len=0 TSval=2674000613 TSecr=1079405830"
"0.458954","54.38.73.16","172.18.0.2","TCP","68","21002 → 36876 [ACK] Seq=544 Ack=2629 Win=1452 Len=0 TSval=2674000614 TSecr=1079405830"
"0.833637","54.38.73.16","172.18.0.2","TLSv1.2","611","Application Data"
"0.877569","172.18.0.2","54.38.73.16","TCP","68","36876 → 21002 [ACK] Seq=2629 Ack=1087 Win=5612 Len=0 TSval=1079406283 TSecr=2674000697"
"0.903404","54.38.73.16","172.18.0.2","TLSv1.2","1125","Application Data"
"0.903449","172.18.0.2","54.38.73.16","TCP","68","36876 → 21002 [ACK] Seq=2629 Ack=2144 Win=5604 Len=0 TSval=1079406309 TSecr=2674000726"
"0.910896","172.18.0.2","54.38.73.16","TLSv1.2","611","Application Data"
"0.935007","54.38.73.16","172.18.0.2","TCP","68","21002 → 36876 [ACK] Seq=2144 Ack=3172 Win=1452 Len=0 TSval=2674000734 TSecr=1079406316"
"1.344700","54.38.73.16","172.18.0.2","TLSv1.2","611","Application Data"
"1.344744","172.18.0.2","54.38.73.16","TCP","68","36876 → 21002 [ACK] Seq=3172 Ack=2687 Win=5608 Len=0 TSval=1079406750 TSecr=2674000827"
"1.345919","172.18.0.2","54.38.73.16","TLSv1.2","611","Application Data"
"1.370275","54.38.73.16","172.18.0.2","TCP","68","21002 → 36876 [ACK] Seq=2687 Ack=3715 Win=1452 Len=0 TSval=2674000842 TSecr=1079406751"
"1.856697","54.38.73.16","172.18.0.2","TLSv1.2","611","Application Data"
"1.856740","172.18.0.2","54.38.73.16","TCP","68","36876 → 21002 [ACK] Seq=3715 Ack=3230 Win=5608 Len=0 TSval=1079407262 TSecr=2674000942"
"1.857182","54.38.73.16","172.18.0.2","TCP","2964","[TCP segment of a reassembled PDU]"
"1.857209","172.18.0.2","54.38.73.16","TCP","68","36876 → 21002 [ACK] Seq=3715 Ack=6126 Win=5595 Len=0 TSval=1079407262 TSecr=2674000947"
"1.857233","54.38.73.16","172.18.0.2","TLSv1.2","4412","Application Data [TCP segment of a reassembled PDU]"
"1.857251","172.18.0.2","54.38.73.16","TCP","68","36876 → 21002 [ACK] Seq=3715 Ack=10470 Win=5571 Len=0 TSval=1079407262 TSecr=2674000955"
"1.857256","54.38.73.16","172.18.0.2","TLSv1.2","2964","Application Data [TCP segment of a reassembled PDU]"
"1.857268","172.18.0.2","54.38.73.16","TCP","68","36876 → 21002 [ACK] Seq=3715 Ack=13366 Win=5555 Len=0 TSval=1079407262 TSecr=2674000957"
"1.857273","54.38.73.16","172.18.0.2","TLSv1.2","2964","Application Data, Application Data"
"1.857291","172.18.0.2","54.38.73.16","TCP","68","36876 → 21002 [ACK] Seq=3715 Ack=16262 Win=5533 Len=0 TSval=1079407262 TSecr=2674000963"
"1.882872","54.38.73.16","172.18.0.2","TLSv1.2","14025","Application Data, Application Data, Application Data, Application Data, Application Data"
"1.882897","172.18.0.2","54.38.73.16","TCP","68","36876 → 21002 [ACK] Seq=3715 Ack=30219 Win=5537 Len=0 TSval=1079407288 TSecr=2674000970"
"1.883401","172.18.0.2","54.38.73.16","TLSv1.2","611","Application Data"
"1.894283","172.18.0.2","54.38.73.16","TCP","1516","[TCP segment of a reassembled PDU]"
"1.906215","54.38.73.16","172.18.0.2","TLSv1.2","611","Application Data"
"1.907034","54.38.73.16","172.18.0.2","TCP","68","21002 → 36876 [ACK] Seq=30762 Ack=4258 Win=1452 Len=0 TSval=2674000977 TSecr=1079407289"
"1.907047","172.18.0.2","54.38.73.16","TLSv1.2","191","Application Data"
"1.918187","54.38.73.16","172.18.0.2","TCP","68","21002 → 36876 [ACK] Seq=30762 Ack=5706 Win=1452 Len=0 TSval=2674000979 TSecr=1079407299"
"1.931154","54.38.73.16","172.18.0.2","TCP","68","21002 → 36876 [ACK] Seq=30762 Ack=5829 Win=1452 Len=0 TSval=2674000983 TSecr=1079407312"
"2.369159","54.38.73.16","172.18.0.2","TLSv1.2","611","Application Data"
"2.370272","172.18.0.2","54.38.73.16","TLSv1.2","611","Application Data"
"2.394313","54.38.73.16","172.18.0.2","TCP","68","21002 → 36876 [ACK] Seq=31305 Ack=6372 Win=1452 Len=0 TSval=2674001098 TSecr=1079407775"
"2.778762","54.38.73.16","172.18.0.2","TLSv1.2","3695","Application Data"
"2.778942","172.18.0.2","54.38.73.16","TCP","68","36876 → 21002 [ACK] Seq=6372 Ack=34932 Win=5584 Len=0 TSval=1079408184 TSecr=2674001188"
"2.795220","54.38.73.16","172.18.0.2","TLSv1.2","2964","Application Data"
"2.795245","172.18.0.2","54.38.73.16","TCP","68","36876 → 21002 [ACK] Seq=6372 Ack=37828 Win=5595 Len=0 TSval=1079408200 TSecr=2674001198"
"2.804061","54.38.73.16","172.18.0.2","TLSv1.2","1342","Application Data"
"2.805335","54.38.73.16","172.18.0.2","TLSv1.2","7308","Application Data"
"2.805513","172.18.0.2","54.38.73.16","TCP","68","36876 → 21002 [ACK] Seq=6372 Ack=46342 Win=5564 Len=0 TSval=1079408211 TSecr=2674001201"
"2.817574","54.38.73.16","172.18.0.2","TLSv1.2","2964","Application Data [TCP segment of a reassembled PDU]"
"2.817602","172.18.0.2","54.38.73.16","TCP","68","36876 → 21002 [ACK] Seq=6372 Ack=49238 Win=5595 Len=0 TSval=1079408223 TSecr=2674001204"
"2.820706","54.38.73.16","172.18.0.2","TLSv1.2","2964","Application Data [TCP segment of a reassembled PDU]"
"2.820730","172.18.0.2","54.38.73.16","TCP","68","36876 → 21002 [ACK] Seq=6372 Ack=52134 Win=5595 Len=0 TSval=1079408226 TSecr=2674001205"
"2.831452","54.38.73.16","172.18.0.2","TLSv1.2","8756","Application Data, Application Data"
"2.831624","172.18.0.2","54.38.73.16","TCP","68","36876 → 21002 [ACK] Seq=6372 Ack=60822 Win=5565 Len=0 TSval=1079408237 TSecr=2674001207"
"2.832430","172.18.0.2","54.38.73.16","TLSv1.2","611","Application Data"
"2.842377","54.38.73.16","172.18.0.2","TLSv1.2","2964","Application Data, Application Data"
"2.842402","172.18.0.2","54.38.73.16","TCP","68","36876 → 21002 [ACK] Seq=6915 Ack=63718 Win=5595 Len=0 TSval=1079408248 TSecr=2674001210"
"2.845657","54.38.73.16","172.18.0.2","TCP","2964","21002 → 36876 [ACK] Seq=63718 Ack=6372 Win=1452 Len=2896 TSval=2674001211 TSecr=1079408226 [TCP segment of a reassembled PDU]"
"2.845682","172.18.0.2","54.38.73.16","TCP","68","36876 → 21002 [ACK] Seq=6915 Ack=66614 Win=5595 Len=0 TSval=1079408251 TSecr=2674001211"
"2.856585","54.38.73.16","172.18.0.2","TLSv1.2","6256","Application Data, Application Data, Application Data"
"2.856730","172.18.0.2","54.38.73.16","TCP","68","36876 → 21002 [ACK] Seq=6915 Ack=72802 Win=5564 Len=0 TSval=1079408262 TSecr=2674001214"
"2.857520","54.38.73.16","172.18.0.2","TCP","68","21002 → 36876 [ACK] Seq=72802 Ack=6915 Win=1452 Len=0 TSval=2674001214 TSecr=1079408238"
"2.857656","172.18.0.2","54.38.73.16","TLSv1.2","611","Application Data"
"2.859770","54.38.73.16","172.18.0.2","TCP","2964","[TCP segment of a reassembled PDU]"
"2.859795","172.18.0.2","54.38.73.16","TCP","68","36876 → 21002 [ACK] Seq=7458 Ack=75698 Win=5595 Len=0 TSval=1079408265 TSecr=2674001214"
"2.869105","54.38.73.16","172.18.0.2","TLSv1.2","2964","Application Data, Application Data"
"2.869130","172.18.0.2","54.38.73.16","TCP","68","36876 → 21002 [ACK] Seq=7458 Ack=78594 Win=5595 Len=0 TSval=1079408274 TSecr=2674001217"
"2.870212","54.38.73.16","172.18.0.2","TLSv1.2","2964","Application Data [TCP segment of a reassembled PDU]"
"2.870234","172.18.0.2","54.38.73.16","TCP","68","36876 → 21002 [ACK] Seq=7458 Ack=81490 Win=5595 Len=0 TSval=1079408275 TSecr=2674001217"
"2.881597","54.38.73.16","172.18.0.2","TLSv1.2","6431","Application Data, Application Data"
"2.881736","172.18.0.2","54.38.73.16","TCP","68","36876 → 21002 [ACK] Seq=7458 Ack=87853 Win=5564 Len=0 TSval=1079408287 TSecr=2674001220"
"2.919524","54.38.73.16","172.18.0.2","TCP","68","21002 → 36876 [ACK] Seq=87853 Ack=7458 Win=1452 Len=0 TSval=2674001230 TSecr=1079408263"
"2.919557","172.18.0.2","54.38.73.16","TLSv1.2","611","Application Data"
"2.921351","54.38.73.16","172.18.0.2","TLSv1.2","2667","Application Data"
"2.921548","172.18.0.2","54.38.73.16","TCP","68","36876 → 21002 [ACK] Seq=8001 Ack=90452 Win=5596 Len=0 TSval=1079408327 TSecr=2674001230"
"2.945108","54.38.73.16","172.18.0.2","TCP","68","21002 → 36876 [ACK] Seq=90452 Ack=8001 Win=1452 Len=0 TSval=2674001236 TSecr=1079408325"
"2.945125","172.18.0.2","54.38.73.16","TLSv1.2","611","Application Data"
"3.007438","54.38.73.16","172.18.0.2","TCP","68","21002 → 36876 [ACK] Seq=90452 Ack=8544 Win=1452 Len=0 TSval=2674001252 TSecr=1079408350"
"3.392886","54.38.73.16","172.18.0.2","TLSv1.2","611","Application Data"
"3.393954","172.18.0.2","54.38.73.16","TLSv1.2","611","Application Data"
"3.418452","54.38.73.16","172.18.0.2","TCP","68","21002 → 36876 [ACK] Seq=90995 Ack=9087 Win=1452 Len=0 TSval=2674001354 TSecr=1079408799"
"3.736956","54.38.73.16","172.18.0.2","TLSv1.2","3695","Application Data"
"3.737095","172.18.0.2","54.38.73.16","TCP","68","36876 → 21002 [ACK] Seq=9087 Ack=94622 Win=5584 Len=0 TSval=1079409142 TSecr=2674001434"
"3.787308","54.38.73.16","172.18.0.2","TLSv1.2","3695","Application Data"
"3.787497","172.18.0.2","54.38.73.16","TCP","68","36876 → 21002 [ACK] Seq=9087 Ack=98249 Win=5579 Len=0 TSval=1079409193 TSecr=2674001446"
"3.796243","54.38.73.16","172.18.0.2","TLSv1.2","7308","Application Data"
"3.796417","172.18.0.2","54.38.73.16","TCP","68","36876 → 21002 [ACK] Seq=9087 Ack=105489 Win=5564 Len=0 TSval=1079409202 TSecr=2674001449"
"3.812098","54.38.73.16","172.18.0.2","TLSv1.2","596","Application Data"
"3.816999","54.38.73.16","172.18.0.2","TLSv1.2","5860","Application Data"
"3.817025","172.18.0.2","54.38.73.16","TCP","68","36876 → 21002 [ACK] Seq=9087 Ack=111809 Win=5580 Len=0 TSval=1079409222 TSecr=2674001453"
"3.821285","54.38.73.16","172.18.0.2","TLSv1.2","2964","Application Data [TCP segment of a reassembled PDU]"
"3.821310","172.18.0.2","54.38.73.16","TCP","68","36876 → 21002 [ACK] Seq=9087 Ack=114705 Win=5595 Len=0 TSval=1079409226 TSecr=2674001455"
"3.827298","54.38.73.16","172.18.0.2","TLSv1.2","2964","Application Data [TCP segment of a reassembled PDU]"
"3.827323","172.18.0.2","54.38.73.16","TCP","68","36876 → 21002 [ACK] Seq=9087 Ack=117601 Win=5595 Len=0 TSval=1079409232 TSecr=2674001457"
"3.837674","54.38.73.16","172.18.0.2","TCP","1516","21002 → 36876 [ACK] Seq=117601 Ack=9087 Win=1452 Len=1448 TSval=2674001459 TSecr=1079409202 [TCP segment of a reassembled PDU]"
"3.841442","54.38.73.16","172.18.0.2","TLSv1.2","4686","Application Data, Application Data, Application Data"
"3.841609","172.18.0.2","54.38.73.16","TCP","68","36876 → 21002 [ACK] Seq=9087 Ack=123667 Win=5585 Len=0 TSval=1079409247 TSecr=2674001459"
"3.842025","172.18.0.2","54.38.73.16","TLSv1.2","611","Application Data"
"3.847785","54.38.73.16","172.18.0.2","TCP","2964","[TCP segment of a reassembled PDU]"
"3.847810","172.18.0.2","54.38.73.16","TCP","68","36876 → 21002 [ACK] Seq=9630 Ack=126563 Win=5595 Len=0 TSval=1079409253 TSecr=2674001462"
"3.865870","54.38.73.16","172.18.0.2","TLSv1.2","1342","Application Data, Application Data"
"3.865899","54.38.73.16","172.18.0.2","TCP","68","21002 → 36876 [ACK] Seq=127837 Ack=9630 Win=1452 Len=0 TSval=2674001466 TSecr=1079409247"
"3.865923","172.18.0.2","54.38.73.16","TLSv1.2","611","Application Data"
"3.868431","54.38.73.16","172.18.0.2","TCP","2964","[TCP segment of a reassembled PDU]"
"3.868601","172.18.0.2","54.38.73.16","TCP","68","36876 → 21002 [ACK] Seq=10173 Ack=130733 Win=5595 Len=0 TSval=1079409274 TSecr=2674001467"
"3.890694","54.38.73.16","172.18.0.2","TLSv1.2","285","Application Data"
"3.897170","172.18.0.2","54.38.73.16","TLSv1.2","611","Application Data"
"3.959469","54.38.73.16","172.18.0.2","TCP","68","21002 → 36876 [ACK] Seq=130950 Ack=10716 Win=1452 Len=0 TSval=2674001490 TSecr=1079409302"
"4.314362","54.38.73.16","172.18.0.2","TLSv1.2","611","Application Data"
"4.315460","172.18.0.2","54.38.73.16","TLSv1.2","611","Application Data"
"4.339275","54.38.73.16","172.18.0.2","TCP","68","21002 → 36876 [ACK] Seq=131493 Ack=11259 Win=1452 Len=0 TSval=2674001585 TSecr=1079409721"
"4.724542","54.38.73.16","172.18.0.2","TLSv1.2","611","Application Data"
"4.724579","54.38.73.16","172.18.0.2","TCP","2964","[TCP segment of a reassembled PDU]"
"4.724720","172.18.0.2","54.38.73.16","TCP","68","36876 → 21002 [ACK] Seq=11259 Ack=134932 Win=5586 Len=0 TSval=1079410130 TSecr=2674001675"
"4.733677","54.38.73.16","172.18.0.2","TLSv1.2","4412","Application Data [TCP segment of a reassembled PDU]"
"4.733841","172.18.0.2","54.38.73.16","TCP","68","36876 → 21002 [ACK] Seq=11259 Ack=139276 Win=5579 Len=0 TSval=1079410139 TSecr=2674001683"
"4.748964","54.38.73.16","172.18.0.2","TLSv1.2","82","Application Data"
"4.789582","172.18.0.2","54.38.73.16","TCP","68","36876 → 21002 [ACK] Seq=11259 Ack=139290 Win=5612 Len=0 TSval=1079410195 TSecr=2674001687"
"4.798806","54.38.73.16","172.18.0.2","TCP","2964","[TCP segment of a reassembled PDU]"
"4.798850","172.18.0.2","54.38.73.16","TCP","68","36876 → 21002 [ACK] Seq=11259 Ack=142186 Win=5595 Len=0 TSval=1079410204 TSecr=2674001699"
"4.810096","54.38.73.16","172.18.0.2","TLSv1.2","8756","Application Data, Application Data"
"4.810121","172.18.0.2","54.38.73.16","TCP","68","36876 → 21002 [ACK] Seq=11259 Ack=150874 Win=5565 Len=0 TSval=1079410215 TSecr=2674001702"
"4.814358","54.38.73.16","172.18.0.2","TLSv1.2","422","Application Data, Application Data"
"4.814382","172.18.0.2","54.38.73.16","TCP","68","36876 → 21002 [ACK] Seq=11259 Ack=151228 Win=5593 Len=0 TSval=1079410220 TSecr=2674001703"
"4.831218","54.38.73.16","172.18.0.2","TCP","2964","[TCP segment of a reassembled PDU]"
"4.831243","172.18.0.2","54.38.73.16","TCP","68","36876 → 21002 [ACK] Seq=11259 Ack=154124 Win=5595 Len=0 TSval=1079410236 TSecr=2674001707"
"4.838710","54.38.73.16","172.18.0.2","TLSv1.2","1342","Application Data, Application Data"
"4.838734","172.18.0.2","54.38.73.16","TCP","68","36876 → 21002 [ACK] Seq=11259 Ack=155398 Win=5593 Len=0 TSval=1079410244 TSecr=2674001709"
"4.852449","54.38.73.16","172.18.0.2","TCP","2964","[TCP segment of a reassembled PDU]"
"4.852474","172.18.0.2","54.38.73.16","TCP","68","36876 → 21002 [ACK] Seq=11259 Ack=158294 Win=5595 Len=0 TSval=1079410258 TSecr=2674001713"
"4.862316","54.38.73.16","172.18.0.2","TLSv1.2","285","Application Data"
"4.862341","172.18.0.2","54.38.73.16","TCP","68","36876 → 21002 [ACK] Seq=11259 Ack=158511 Win=5594 Len=0 TSval=1079410267 TSecr=2674001715"
"4.863064","172.18.0.2","54.38.73.16","TLSv1.2","611","Application Data"
"4.886131","54.38.73.16","172.18.0.2","TCP","68","21002 → 36876 [ACK] Seq=158511 Ack=11802 Win=1452 Len=0 TSval=2674001721 TSecr=1079410268"
"4.886174","172.18.0.2","54.38.73.16","TLSv1.2","611","Application Data"
"4.909621","54.38.73.16","172.18.0.2","TCP","68","21002 → 36876 [ACK] Seq=158511 Ack=12345 Win=1452 Len=0 TSval=2674001727 TSecr=1079410291"
"5.236166","54.38.73.16","172.18.0.2","TLSv1.2","611","Application Data"
"5.236186","172.18.0.2","54.38.73.16","TCP","68","36876 → 21002 [ACK] Seq=12345 Ack=159054 Win=5608 Len=0 TSval=1079410641 TSecr=2674001805"
"5.236703","172.18.0.2","54.38.73.16","TLSv1.2","611","Application Data"
"5.260478","54.38.73.16","172.18.0.2","TCP","68","21002 → 36876 [ACK] Seq=159054 Ack=12888 Win=1452 Len=0 TSval=2674001815 TSecr=1079410642"
"5.602924","54.38.73.16","172.18.0.2","TLSv1.2","3695","Application Data"
"5.602966","172.18.0.2","54.38.73.16","TCP","68","36876 → 21002 [ACK] Seq=12888 Ack=162681 Win=5584 Len=0 TSval=1079411008 TSecr=2674001900"
"5.622169","54.38.73.16","172.18.0.2","TLSv1.2","7308","Application Data"
"5.622195","172.18.0.2","54.38.73.16","TCP","68","36876 → 21002 [ACK] Seq=12888 Ack=169921 Win=5564 Len=0 TSval=1079411027 TSecr=2674001905"
"5.626700","54.38.73.16","172.18.0.2","TLSv1.2","596","Application Data"
"5.626725","172.18.0.2","54.38.73.16","TCP","68","36876 → 21002 [ACK] Seq=12888 Ack=170449 Win=5593 Len=0 TSval=1079411032 TSecr=2674001906"
"5.651849","54.38.73.16","172.18.0.2","TLSv1.2","1125","Application Data"
"5.651875","172.18.0.2","54.38.73.16","TCP","68","36876 → 21002 [ACK] Seq=12888 Ack=171506 Win=5593 Len=0 TSval=1079411057 TSecr=2674001913"
"5.654874","54.38.73.16","172.18.0.2","TCP","2964","[TCP segment of a reassembled PDU]"
"5.654898","172.18.0.2","54.38.73.16","TCP","68","36876 → 21002 [ACK] Seq=12888 Ack=174402 Win=5595 Len=0 TSval=1079411060 TSecr=2674001913"
"5.675517","54.38.73.16","172.18.0.2","TLSv1.2","2964","Application Data [TCP segment of a reassembled PDU]"
"5.675543","172.18.0.2","54.38.73.16","TCP","68","36876 → 21002 [ACK] Seq=12888 Ack=177298 Win=5595 Len=0 TSval=1079411081 TSecr=2674001919"
"5.675751","54.38.73.16","172.18.0.2","TCP","82","[TCP Previous segment not captured] 21002 → 36876 [PSH, ACK] Seq=178746 Ack=12888 Win=1452 Len=14 TSval=2674001919 TSecr=1079411057 [TCP segment of a reassembled PDU]"
"5.675772","172.18.0.2","54.38.73.16","TCP","80","[TCP Dup ACK 150#1] 36876 → 21002 [ACK] Seq=12888 Ack=177298 Win=5595 Len=0 TSval=1079411081 TSecr=2674001919 SLE=178746 SRE=178760"
"5.675774","54.38.73.16","172.18.0.2","TCP","1516","[TCP Out-Of-Order] 21002 → 36876 [ACK] Seq=177298 Ack=12888 Win=1452 Len=1448 TSval=2674001919 TSecr=1079411032"
"5.675788","172.18.0.2","54.38.73.16","TCP","68","36876 → 21002 [ACK] Seq=12888 Ack=178760 Win=5586 Len=0 TSval=1079411081 TSecr=2674001919"
"5.676473","172.18.0.2","54.38.73.16","TLSv1.2","611","Application Data"
"5.685597","54.38.73.16","172.18.0.2","TCP","2964","[TCP segment of a reassembled PDU]"
"5.685768","172.18.0.2","54.38.73.16","TCP","68","36876 → 21002 [ACK] Seq=13431 Ack=181656 Win=5595 Len=0 TSval=1079411091 TSecr=2674001921"
"5.685909","54.38.73.16","172.18.0.2","TLSv1.2","4412","Application Data [TCP segment of a reassembled PDU]"
"5.686002","172.18.0.2","54.38.73.16","TCP","68","36876 → 21002 [ACK] Seq=13431 Ack=186000 Win=5579 Len=0 TSval=1079411091 TSecr=2674001921"
"5.697496","54.38.73.16","172.18.0.2","TLSv1.2","1516","Application Data [TCP segment of a reassembled PDU]"
"5.700122","54.38.73.16","172.18.0.2","TLSv1.2","3318","Application Data, Application Data"
"5.700148","172.18.0.2","54.38.73.16","TCP","68","36876 → 21002 [ACK] Seq=13431 Ack=190698 Win=5579 Len=0 TSval=1079411105 TSecr=2674001924"
"5.700746","54.38.73.16","172.18.0.2","TCP","68","21002 → 36876 [ACK] Seq=190698 Ack=13431 Win=1452 Len=0 TSval=2674001925 TSecr=1079411082"
"5.700777","172.18.0.2","54.38.73.16","TLSv1.2","611","Application Data"
"5.706256","54.38.73.16","172.18.0.2","TCP","1516","[TCP segment of a reassembled PDU]"
"5.710819","54.38.73.16","172.18.0.2","TLSv1.2","4412","Application Data [TCP segment of a reassembled PDU]"
"5.710981","172.18.0.2","54.38.73.16","TCP","68","36876 → 21002 [ACK] Seq=13974 Ack=196490 Win=5579 Len=0 TSval=1079411116 TSecr=2674001926"
"5.724458","54.38.73.16","172.18.0.2","TLSv1.2","502","Application Data"
"5.728658","54.38.73.16","172.18.0.2","TCP","2964","[TCP segment of a reassembled PDU]"
"5.728688","172.18.0.2","54.38.73.16","TCP","68","36876 → 21002 [ACK] Seq=13974 Ack=199820 Win=5595 Len=0 TSval=1079411134 TSecr=2674001931"
"5.750319","54.38.73.16","172.18.0.2","TLSv1.2","2964","Application Data, Application Data"
"5.750344","172.18.0.2","54.38.73.16","TCP","68","36876 → 21002 [ACK] Seq=13974 Ack=202716 Win=5595 Len=0 TSval=1079411155 TSecr=2674001937"
"5.754019","54.38.73.16","172.18.0.2","TLSv1.2","1045","Application Data"
"5.762739","172.18.0.2","54.38.73.16","TLSv1.2","611","Application Data"
"5.823081","54.38.73.16","172.18.0.2","TCP","68","21002 → 36876 [ACK] Seq=203693 Ack=14517 Win=1452 Len=0 TSval=2674001956 TSecr=1079411168"
"6.157572","54.38.73.16","172.18.0.2","TLSv1.2","611","Application Data"
"6.158666","172.18.0.2","54.38.73.16","TLSv1.2","611","Application Data"
"6.183444","54.38.73.16","172.18.0.2","TCP","68","21002 → 36876 [ACK] Seq=204236 Ack=15060 Win=1452 Len=0 TSval=2674002045 TSecr=1079411564"
"6.910886","54.38.73.16","172.18.0.2","TLSv1.2","611","Application Data"
"6.942616","54.38.73.16","172.18.0.2","TCP","2964","[TCP segment of a reassembled PDU]"
"6.942639","172.18.0.2","54.38.73.16","TCP","68","36876 → 21002 [ACK] Seq=15060 Ack=207675 Win=5595 Len=0 TSval=1079412348 TSecr=2674002227"
"6.963195","54.38.73.16","172.18.0.2","TLSv1.2","7308","Application Data, Application Data"
"6.963358","172.18.0.2","54.38.73.16","TCP","68","36876 → 21002 [ACK] Seq=15060 Ack=214915 Win=5564 Len=0 TSval=1079412368 TSecr=2674002240"
"6.966840","54.38.73.16","172.18.0.2","TLSv1.2","813","Application Data"
"6.974072","54.38.73.16","172.18.0.2","TCP","2964","[TCP segment of a reassembled PDU]"
"6.974097","172.18.0.2","54.38.73.16","TCP","68","36876 → 21002 [ACK] Seq=15060 Ack=218556 Win=5595 Len=0 TSval=1079412379 TSecr=2674002241"
"6.983543","54.38.73.16","172.18.0.2","TLSv1.2","2964","Application Data [TCP segment of a reassembled PDU]"
"6.983567","172.18.0.2","54.38.73.16","TCP","68","36876 → 21002 [ACK] Seq=15060 Ack=221452 Win=5595 Len=0 TSval=1079412389 TSecr=2674002246"
"6.988081","54.38.73.16","172.18.0.2","TLSv1.2","2964","Application Data [TCP segment of a reassembled PDU]"
"6.988105","172.18.0.2","54.38.73.16","TCP","68","36876 → 21002 [ACK] Seq=15060 Ack=224348 Win=5595 Len=0 TSval=1079412393 TSecr=2674002247"
"6.994557","54.38.73.16","172.18.0.2","TLSv1.2","2964","Application Data [TCP segment of a reassembled PDU]"
"6.994582","172.18.0.2","54.38.73.16","TCP","68","36876 → 21002 [ACK] Seq=15060 Ack=227244 Win=5595 Len=0 TSval=1079412400 TSecr=2674002248"
"6.994753","54.38.73.16","172.18.0.2","TLSv1.2","1516","Application Data [TCP segment of a reassembled PDU]"
"6.999312","54.38.73.16","172.18.0.2","TLSv1.2","3629","Application Data"
"6.999464","172.18.0.2","54.38.73.16","TCP","68","36876 → 21002 [ACK] Seq=15060 Ack=232253 Win=5612 Len=0 TSval=1079412405 TSecr=2674002248"
"6.999996","172.18.0.2","54.38.73.16","TLSv1.2","1125","Application Data"
"7.009272","54.38.73.16","172.18.0.2","TCP","2964","[TCP segment of a reassembled PDU]"
"7.009485","172.18.0.2","54.38.73.16","TCP","68","36876 → 21002 [ACK] Seq=16117 Ack=235149 Win=5595 Len=0 TSval=1079412415 TSecr=2674002252"
"7.016789","54.38.73.16","172.18.0.2","TLSv1.2","4412","Application Data, Application Data"
"7.016963","172.18.0.2","54.38.73.16","TCP","68","36876 → 21002 [ACK] Seq=16117 Ack=239493 Win=5579 Len=0 TSval=1079412422 TSecr=2674002254"
"7.019928","54.38.73.16","172.18.0.2","TLSv1.2","1516","Application Data [TCP segment of a reassembled PDU]"
"7.024569","54.38.73.16","172.18.0.2","TLSv1.2","234","Application Data"
"7.024593","172.18.0.2","54.38.73.16","TCP","68","36876 → 21002 [ACK] Seq=16117 Ack=241107 Win=5607 Len=0 TSval=1079412430 TSecr=2674002255"
"7.024609","54.38.73.16","172.18.0.2","TCP","68","21002 → 36876 [ACK] Seq=241107 Ack=16117 Win=1452 Len=0 TSval=2674002256 TSecr=1079412405"
"7.026818","54.38.73.16","172.18.0.2","TLSv1.2","5860","Application Data"
"7.026960","172.18.0.2","54.38.73.16","TCP","68","36876 → 21002 [ACK] Seq=16117 Ack=246899 Win=5580 Len=0 TSval=1079412432 TSecr=2674002256"
"7.034233","54.38.73.16","172.18.0.2","TLSv1.2","2964","Application Data [TCP segment of a reassembled PDU]"
"7.034257","172.18.0.2","54.38.73.16","TCP","68","36876 → 21002 [ACK] Seq=16117 Ack=249795 Win=5595 Len=0 TSval=1079412439 TSecr=2674002258"
"7.042273","54.38.73.16","172.18.0.2","TCP","2964","21002 → 36876 [ACK] Seq=249795 Ack=16117 Win=1452 Len=2896 TSval=2674002260 TSecr=1079412422 [TCP segment of a reassembled PDU]"
"7.042298","172.18.0.2","54.38.73.16","TCP","68","36876 → 21002 [ACK] Seq=16117 Ack=252691 Win=5595 Len=0 TSval=1079412447 TSecr=2674002260"
"7.048721","54.38.73.16","172.18.0.2","TLSv1.2","1516","Application Data [TCP segment of a reassembled PDU]"
"7.049458","54.38.73.16","172.18.0.2","TCP","1516","21002 → 36876 [ACK] Seq=254139 Ack=16117 Win=1452 Len=1448 TSval=2674002262 TSecr=1079412430 [TCP segment of a reassembled PDU]"
"7.049609","172.18.0.2","54.38.73.16","TCP","68","36876 → 21002 [ACK] Seq=16117 Ack=255587 Win=5612 Len=0 TSval=1079412455 TSecr=2674002262"
"7.051580","54.38.73.16","172.18.0.2","TCP","1516","21002 → 36876 [ACK] Seq=255587 Ack=16117 Win=1452 Len=1448 TSval=2674002263 TSecr=1079412432 [TCP segment of a reassembled PDU]"
"7.051737","54.38.73.16","172.18.0.2","TLSv1.2","3846","Application Data, Application Data, Application Data"
"7.051800","172.18.0.2","54.38.73.16","TCP","68","36876 → 21002 [ACK] Seq=16117 Ack=260813 Win=5579 Len=0 TSval=1079412457 TSecr=2674002263"
"7.052205","172.18.0.2","54.38.73.16","TLSv1.2","611","Application Data"
"7.104722","54.38.73.16","172.18.0.2","TLSv1.2","2153","Application Data"
"7.104772","172.18.0.2","54.38.73.16","TCP","68","36876 → 21002 [ACK] Seq=16660 Ack=262898 Win=5598 Len=0 TSval=1079412510 TSecr=2674002276"
"7.114144","172.18.0.2","54.38.73.16","TLSv1.2","611","Application Data"
"7.179948","54.38.73.16","172.18.0.2","TCP","68","21002 → 36876 [ACK] Seq=262898 Ack=17203 Win=1452 Len=0 TSval=2674002295 TSecr=1079412519"
"7.488772","54.38.73.16","172.18.0.2","TLSv1.2","611","Application Data"
"7.489915","172.18.0.2","54.38.73.16","TLSv1.2","611","Application Data"
"7.513583","54.38.73.16","172.18.0.2","TCP","68","21002 → 36876 [ACK] Seq=263441 Ack=17746 Win=1452 Len=0 TSval=2674002378 TSecr=1079412895"
"7.825732","54.38.73.16","172.18.0.2","TLSv1.2","611","Application Data"
"7.857607","54.38.73.16","172.18.0.2","TCP","2964","[TCP segment of a reassembled PDU]"
"7.857633","172.18.0.2","54.38.73.16","TCP","68","36876 → 21002 [ACK] Seq=17746 Ack=266880 Win=5595 Len=0 TSval=1079413263 TSecr=2674002456"
"7.882246","54.38.73.16","172.18.0.2","TLSv1.2","799","Application Data"
"7.890468","54.38.73.16","172.18.0.2","TCP","2964","[TCP segment of a reassembled PDU]"
"7.890493","172.18.0.2","54.38.73.16","TCP","68","36876 → 21002 [ACK] Seq=17746 Ack=270507 Win=5595 Len=0 TSval=1079413296 TSecr=2674002470"
"7.912015","54.38.73.16","172.18.0.2","TLSv1.2","4412","Application Data [TCP segment of a reassembled PDU]"
"7.912185","172.18.0.2","54.38.73.16","TCP","68","36876 → 21002 [ACK] Seq=17746 Ack=274851 Win=5579 Len=0 TSval=1079413317 TSecr=2674002478"
"7.915262","54.38.73.16","172.18.0.2","TLSv1.2","82","Application Data"
"7.944419","54.38.73.16","172.18.0.2","TLSv1.2","7308","Application Data, Application Data"
"7.944568","172.18.0.2","54.38.73.16","TCP","68","36876 → 21002 [ACK] Seq=17746 Ack=282105 Win=5563 Len=0 TSval=1079413350 TSecr=2674002479"
"7.969036","54.38.73.16","172.18.0.2","TLSv1.2","625","Application Data"
"7.969769","172.18.0.2","54.38.73.16","TLSv1.2","611","Application Data"
"7.994693","54.38.73.16","172.18.0.2","TCP","68","21002 → 36876 [ACK] Seq=282662 Ack=18289 Win=1452 Len=0 TSval=2674002498 TSecr=1079413375"
"7.994709","172.18.0.2","54.38.73.16","TLSv1.2","611","Application Data"
"8.019420","54.38.73.16","172.18.0.2","TCP","68","21002 → 36876 [ACK] Seq=282662 Ack=18832 Win=1452 Len=0 TSval=2674002504 TSecr=1079413400"
"8.615874","54.38.73.16","172.18.0.2","TLSv1.2","611","Application Data"
"8.616909","172.18.0.2","54.38.73.16","TLSv1.2","611","Application Data"
"8.641363","54.38.73.16","172.18.0.2","TCP","68","21002 → 36876 [ACK] Seq=283205 Ack=19375 Win=1452 Len=0 TSval=2674002660 TSecr=1079414022"
"9.025585","54.38.73.16","172.18.0.2","TLSv1.2","611","Application Data"
"9.025619","54.38.73.16","172.18.0.2","TCP","2964","[TCP segment of a reassembled PDU]"
"9.025759","172.18.0.2","54.38.73.16","TCP","68","36876 → 21002 [ACK] Seq=19375 Ack=286644 Win=5586 Len=0 TSval=1079414431 TSecr=2674002751"
"9.047366","54.38.73.16","172.18.0.2","TLSv1.2","4412","Application Data [TCP segment of a reassembled PDU]"
"9.047531","172.18.0.2","54.38.73.16","TCP","68","36876 → 21002 [ACK] Seq=19375 Ack=290988 Win=5579 Len=0 TSval=1079414453 TSecr=2674002761"
"9.050100","54.38.73.16","172.18.0.2","TLSv1.2","625","Application Data, Application Data"
"9.093576","172.18.0.2","54.38.73.16","TCP","68","36876 → 21002 [ACK] Seq=19375 Ack=291545 Win=5612 Len=0 TSval=1079414499 TSecr=2674002762"
"9.099475","54.38.73.16","172.18.0.2","TCP","2964","[TCP segment of a reassembled PDU]"
"9.099519","172.18.0.2","54.38.73.16","TCP","68","36876 → 21002 [ACK] Seq=19375 Ack=294441 Win=5595 Len=0 TSval=1079414505 TSecr=2674002774"
"9.110139","54.38.73.16","172.18.0.2","TLSv1.2","4412","Application Data [TCP segment of a reassembled PDU]"
"9.110165","172.18.0.2","54.38.73.16","TCP","68","36876 → 21002 [ACK] Seq=19375 Ack=298785 Win=5579 Len=0 TSval=1079414515 TSecr=2674002777"
"9.117294","54.38.73.16","172.18.0.2","TLSv1.2","82","Application Data"
"9.117319","172.18.0.2","54.38.73.16","TCP","68","36876 → 21002 [ACK] Seq=19375 Ack=298799 Win=5609 Len=0 TSval=1079414522 TSecr=2674002779"
"9.120416","54.38.73.16","172.18.0.2","TCP","2964","[TCP segment of a reassembled PDU]"
"9.120440","172.18.0.2","54.38.73.16","TCP","68","36876 → 21002 [ACK] Seq=19375 Ack=301695 Win=5595 Len=0 TSval=1079414526 TSecr=2674002780"
"9.131124","54.38.73.16","172.18.0.2","TLSv1.2","4412","Application Data, Application Data"
"9.131149","172.18.0.2","54.38.73.16","TCP","68","36876 → 21002 [ACK] Seq=19375 Ack=306039 Win=5579 Len=0 TSval=1079414536 TSecr=2674002782"
"9.132081","54.38.73.16","172.18.0.2","TLSv1.2","2964","Application Data [TCP segment of a reassembled PDU]"
"9.132105","172.18.0.2","54.38.73.16","TCP","68","36876 → 21002 [ACK] Seq=19375 Ack=308935 Win=5595 Len=0 TSval=1079414537 TSecr=2674002782"
"9.134276","54.38.73.16","172.18.0.2","TCP","1516","21002 → 36876 [ACK] Seq=308935 Ack=19375 Win=1452 Len=1448 TSval=2674002783 TSecr=1079414515 [TCP segment of a reassembled PDU]"
"9.134301","172.18.0.2","54.38.73.16","TCP","68","36876 → 21002 [ACK] Seq=19375 Ack=310383 Win=5593 Len=0 TSval=1079414539 TSecr=2674002783"
"9.140820","54.38.73.16","172.18.0.2","TLSv1.2","422","Application Data"
"9.140845","172.18.0.2","54.38.73.16","TCP","68","36876 → 21002 [ACK] Seq=19375 Ack=310737 Win=5593 Len=0 TSval=1079414546 TSecr=2674002785"
"9.141428","172.18.0.2","54.38.73.16","TLSv1.2","611","Application Data"
"9.141821","54.38.73.16","172.18.0.2","TCP","2964","[TCP segment of a reassembled PDU]"
"9.141844","172.18.0.2","54.38.73.16","TCP","68","36876 → 21002 [ACK] Seq=19918 Ack=313633 Win=5595 Len=0 TSval=1079414547 TSecr=2674002785"
"9.153132","54.38.73.16","172.18.0.2","TLSv1.2","2964","Application Data, Application Data"
"9.153157","172.18.0.2","54.38.73.16","TCP","68","36876 → 21002 [ACK] Seq=19918 Ack=316529 Win=5595 Len=0 TSval=1079414558 TSecr=2674002788"
"9.155283","54.38.73.16","172.18.0.2","TCP","1516","21002 → 36876 [ACK] Seq=316529 Ack=19375 Win=1452 Len=1448 TSval=2674002789 TSecr=1079414536 [TCP segment of a reassembled PDU]"
"9.155308","172.18.0.2","54.38.73.16","TCP","68","36876 → 21002 [ACK] Seq=19918 Ack=317977 Win=5593 Len=0 TSval=1079414560 TSecr=2674002789"
"9.162949","54.38.73.16","172.18.0.2","TLSv1.2","2964","Application Data [TCP segment of a reassembled PDU]"
"9.162973","172.18.0.2","54.38.73.16","TCP","68","36876 → 21002 [ACK] Seq=19918 Ack=320873 Win=5595 Len=0 TSval=1079414568 TSecr=2674002791"
"9.163244","54.38.73.16","172.18.0.2","TCP","1516","21002 → 36876 [ACK] Seq=320873 Ack=19375 Win=1452 Len=1448 TSval=2674002791 TSecr=1079414539 [TCP segment of a reassembled PDU]"
"9.164156","54.38.73.16","172.18.0.2","TLSv1.2","451","Application Data, Application Data"
"9.164290","172.18.0.2","54.38.73.16","TCP","68","36876 → 21002 [ACK] Seq=19918 Ack=322704 Win=5593 Len=0 TSval=1079414569 TSecr=2674002791"
"9.165193","54.38.73.16","172.18.0.2","TCP","68","21002 → 36876 [ACK] Seq=322704 Ack=19918 Win=1452 Len=0 TSval=2674002791 TSecr=1079414547"
"9.184890","54.38.73.16","172.18.0.2","TCP","1516","[TCP segment of a reassembled PDU]"
"9.185214","54.38.73.16","172.18.0.2","TCP","1516","21002 → 36876 [ACK] Seq=324152 Ack=19918 Win=1452 Len=1448 TSval=2674002796 TSecr=1079414560 [TCP segment of a reassembled PDU]"
"9.185235","172.18.0.2","54.38.73.16","TCP","68","36876 → 21002 [ACK] Seq=19918 Ack=325600 Win=5593 Len=0 TSval=1079414590 TSecr=2674002796"
"9.188352","54.38.73.16","172.18.0.2","TLSv1.2","285","Application Data"
"9.188530","172.18.0.2","54.38.73.16","TCP","68","36876 → 21002 [ACK] Seq=19918 Ack=325817 Win=5612 Len=0 TSval=1079414594 TSecr=2674002797"
"9.207570","54.38.73.16","172.18.0.2","TLSv1.2","7308","Application Data"
"9.207744","172.18.0.2","54.38.73.16","TCP","68","36876 → 21002 [ACK] Seq=19918 Ack=333057 Win=5564 Len=0 TSval=1079414613 TSecr=2674002801"
"9.212400","54.38.73.16","172.18.0.2","TLSv1.2","82","Application Data"
"9.212597","172.18.0.2","54.38.73.16","TCP","68","36876 → 21002 [ACK] Seq=19918 Ack=333071 Win=5612 Len=0 TSval=1079414618 TSecr=2674002803"
"9.217654","54.38.73.16","172.18.0.2","TCP","1516","[TCP segment of a reassembled PDU]"
"9.236512","54.38.73.16","172.18.0.2","TLSv1.2","191","Application Data"
"9.236687","172.18.0.2","54.38.73.16","TCP","68","36876 → 21002 [ACK] Seq=19918 Ack=334642 Win=5612 Len=0 TSval=1079414642 TSecr=2674002804"
"9.243605","172.18.0.2","54.38.73.16","TLSv1.2","611","Application Data"
"9.307332","54.38.73.16","172.18.0.2","TCP","68","21002 → 36876 [ACK] Seq=334642 Ack=20461 Win=1452 Len=0 TSval=2674002827 TSecr=1079414649"
"9.639163","54.38.73.16","172.18.0.2","TLSv1.2","611","Application Data"
"9.639206","172.18.0.2","54.38.73.16","TCP","68","36876 → 21002 [ACK] Seq=20461 Ack=335185 Win=5608 Len=0 TSval=1079415044 TSecr=2674002894"
"9.640201","172.18.0.2","54.38.73.16","TLSv1.2","611","Application Data"
"9.664888","54.38.73.16","172.18.0.2","TCP","68","21002 → 36876 [ACK] Seq=335185 Ack=21004 Win=1452 Len=0 TSval=2674002916 TSecr=1079415045"
"10.048781","54.38.73.16","172.18.0.2","TCP","1516","[TCP segment of a reassembled PDU]"
"10.048928","54.38.73.16","172.18.0.2","TLSv1.2","2247","Application Data"
"10.048941","54.38.73.16","172.18.0.2","TCP","2964","[TCP segment of a reassembled PDU]"
"10.048981","172.18.0.2","54.38.73.16","TCP","68","36876 → 21002 [ACK] Seq=21004 Ack=341708 Win=5563 Len=0 TSval=1079415454 TSecr=2674002998"
"10.049522","172.18.0.2","54.38.73.16","TLSv1.2","611","Application Data"
"10.066446","54.38.73.16","172.18.0.2","TLSv1.2","4412","Application Data [TCP segment of a reassembled PDU]"
"10.066613","172.18.0.2","54.38.73.16","TCP","68","36876 → 21002 [ACK] Seq=21547 Ack=346052 Win=5579 Len=0 TSval=1079415472 TSecr=2674003016"
"10.072034","54.38.73.16","172.18.0.2","TLSv1.2","625","Application Data, Application Data"
"10.073522","54.38.73.16","172.18.0.2","TCP","68","21002 → 36876 [ACK] Seq=346609 Ack=21547 Win=1452 Len=0 TSval=2674003018 TSecr=1079415455"
"10.075761","54.38.73.16","172.18.0.2","TLSv1.2","4412","Application Data"
"10.075786","172.18.0.2","54.38.73.16","TCP","68","36876 → 21002 [ACK] Seq=21547 Ack=350953 Win=5579 Len=0 TSval=1079415481 TSecr=2674003018"
"10.087870","54.38.73.16","172.18.0.2","TLSv1.2","2964","Application Data [TCP segment of a reassembled PDU]"
"10.087895","172.18.0.2","54.38.73.16","TCP","68","36876 → 21002 [ACK] Seq=21547 Ack=353849 Win=5595 Len=0 TSval=1079415493 TSecr=2674003022"
"10.088234","54.38.73.16","172.18.0.2","TLSv1.2","2964","Application Data [TCP segment of a reassembled PDU]"
"10.088257","172.18.0.2","54.38.73.16","TCP","68","36876 → 21002 [ACK] Seq=21547 Ack=356745 Win=5595 Len=0 TSval=1079415493 TSecr=2674003022"
"10.090647","54.38.73.16","172.18.0.2","TCP","1516","21002 → 36876 [ACK] Seq=356745 Ack=21547 Win=1452 Len=1448 TSval=2674003022 TSecr=1079415472 [TCP segment of a reassembled PDU]"
"10.100738","54.38.73.16","172.18.0.2","TLSv1.2","936","Application Data"
"10.100912","172.18.0.2","54.38.73.16","TCP","68","36876 → 21002 [ACK] Seq=21547 Ack=359061 Win=5612 Len=0 TSval=1079415506 TSecr=2674003022"
"10.108884","54.38.73.16","172.18.0.2","TCP","2964","[TCP segment of a reassembled PDU]"
"10.109097","172.18.0.2","54.38.73.16","TCP","68","36876 → 21002 [ACK] Seq=21547 Ack=361957 Win=5595 Len=0 TSval=1079415514 TSecr=2674003027"
"10.124347","54.38.73.16","172.18.0.2","TLSv1.2","1342","Application Data, Application Data"
"10.124855","172.18.0.2","54.38.73.16","TLSv1.2","611","Application Data"
"10.161558","54.38.73.16","172.18.0.2","TLSv1.2","1125","Application Data"
"10.168309","172.18.0.2","54.38.73.16","TLSv1.2","611","Application Data"
"10.231304","54.38.73.16","172.18.0.2","TCP","68","21002 → 36876 [ACK] Seq=364288 Ack=22633 Win=1452 Len=0 TSval=2674003058 TSecr=1079415573"
"10.765177","54.38.73.16","172.18.0.2","TLSv1.2","611","Application Data"
"10.766284","172.18.0.2","54.38.73.16","TLSv1.2","611","Application Data"
"10.791431","54.38.73.16","172.18.0.2","TCP","68","21002 → 36876 [ACK] Seq=364831 Ack=23176 Win=1452 Len=0 TSval=2674003198 TSecr=1079416171"
"11.121401","54.38.73.16","172.18.0.2","TLSv1.2","611","Application Data"
"11.163554","54.38.73.16","172.18.0.2","TCP","2964","[TCP segment of a reassembled PDU]"
"11.163579","172.18.0.2","54.38.73.16","TCP","68","36876 → 21002 [ACK] Seq=23176 Ack=368270 Win=5595 Len=0 TSval=1079416569 TSecr=2674003280"
"11.174347","54.38.73.16","172.18.0.2","TLSv1.2","7308","Application Data, Application Data"
"11.174516","172.18.0.2","54.38.73.16","TCP","68","36876 → 21002 [ACK] Seq=23176 Ack=375510 Win=5564 Len=0 TSval=1079416580 TSecr=2674003293"
"11.187482","54.38.73.16","172.18.0.2","TLSv1.2","813","Application Data"
"11.207632","54.38.73.16","172.18.0.2","TLSv1.2","4412","Application Data"
"11.207656","172.18.0.2","54.38.73.16","TCP","68","36876 → 21002 [ACK] Seq=23176 Ack=380599 Win=5579 Len=0 TSval=1079416613 TSecr=2674003297"
"11.218215","54.38.73.16","172.18.0.2","TLSv1.2","2964","Application Data [TCP segment of a reassembled PDU]"
"11.218241","172.18.0.2","54.38.73.16","TCP","68","36876 → 21002 [ACK] Seq=23176 Ack=383495 Win=5595 Len=0 TSval=1079416623 TSecr=2674003304"
"11.228487","54.38.73.16","172.18.0.2","TLSv1.2","7308","Application Data, Application Data"
"11.228695","172.18.0.2","54.38.73.16","TCP","68","36876 → 21002 [ACK] Seq=23176 Ack=390735 Win=5564 Len=0 TSval=1079416634 TSecr=2674003307"
"11.232793","54.38.73.16","172.18.0.2","TLSv1.2","5808","Application Data, Application Data"
"11.232818","172.18.0.2","54.38.73.16","TCP","68","36876 → 21002 [ACK] Seq=23176 Ack=396475 Win=5581 Len=0 TSval=1079416638 TSecr=2674003308"
"11.233415","172.18.0.2","54.38.73.16","TLSv1.2","1125","Application Data"
"11.250737","54.38.73.16","172.18.0.2","TCP","2964","[TCP segment of a reassembled PDU]"
"11.250762","172.18.0.2","54.38.73.16","TCP","68","36876 → 21002 [ACK] Seq=24233 Ack=399371 Win=5595 Len=0 TSval=1079416656 TSecr=2674003312"
"11.257106","54.38.73.16","172.18.0.2","TLSv1.2","799","Application Data"
"11.257139","54.38.73.16","172.18.0.2","TCP","68","21002 → 36876 [ACK] Seq=400102 Ack=24233 Win=1452 Len=0 TSval=2674003314 TSecr=1079416639"
"11.260221","54.38.73.16","172.18.0.2","TCP","1516","[TCP segment of a reassembled PDU]"
"11.260402","172.18.0.2","54.38.73.16","TCP","68","36876 → 21002 [ACK] Seq=24233 Ack=401550 Win=5593 Len=0 TSval=1079416666 TSecr=2674003314"
"11.270467","54.38.73.16","172.18.0.2","TLSv1.2","7308","Application Data, Application Data"
"11.270672","172.18.0.2","54.38.73.16","TCP","68","36876 → 21002 [ACK] Seq=24233 Ack=408790 Win=5564 Len=0 TSval=1079416676 TSecr=2674003317"
"11.282042","54.38.73.16","172.18.0.2","TLSv1.2","5860","Application Data, Application Data"
"11.282066","172.18.0.2","54.38.73.16","TCP","68","36876 → 21002 [ACK] Seq=24233 Ack=414582 Win=5580 Len=0 TSval=1079416687 TSecr=2674003320"
"11.284693","54.38.73.16","172.18.0.2","TCP","2964","21002 → 36876 [ACK] Seq=414582 Ack=24233 Win=1452 Len=2896 TSval=2674003321 TSecr=1079416666 [TCP segment of a reassembled PDU]"
"11.284720","172.18.0.2","54.38.73.16","TCP","68","36876 → 21002 [ACK] Seq=24233 Ack=417478 Win=5595 Len=0 TSval=1079416690 TSecr=2674003321"
"11.294316","54.38.73.16","172.18.0.2","TLSv1.2","5540","Application Data, Application Data, Application Data, Application Data"
"11.294483","172.18.0.2","54.38.73.16","TCP","68","36876 → 21002 [ACK] Seq=24233 Ack=422950 Win=5582 Len=0 TSval=1079416700 TSecr=2674003323"
"11.294906","172.18.0.2","54.38.73.16","TLSv1.2","611","Application Data"
"11.314588","54.38.73.16","172.18.0.2","TCP","1516","[TCP segment of a reassembled PDU]"
"11.318313","54.38.73.16","172.18.0.2","TLSv1.2","191","Application Data"
"11.318321","172.18.0.2","54.38.73.16","TCP","68","36876 → 21002 [ACK] Seq=24776 Ack=424521 Win=5593 Len=0 TSval=1079416723 TSecr=2674003328"
"11.355448","54.38.73.16","172.18.0.2","TCP","68","21002 → 36876 [ACK] Seq=424521 Ack=24776 Win=1452 Len=0 TSval=2674003339 TSecr=1079416700"
"11.371086","54.38.73.16","172.18.0.2","TLSv1.2","3181","Application Data"
"11.371231","172.18.0.2","54.38.73.16","TCP","68","36876 → 21002 [ACK] Seq=24776 Ack=427634 Win=5579 Len=0 TSval=1079416776 TSecr=2674003342"
"11.381302","172.18.0.2","54.38.73.16","TLSv1.2","611","Application Data"
"11.443607","54.38.73.16","172.18.0.2","TCP","68","21002 → 36876 [ACK] Seq=427634 Ack=25319 Win=1452 Len=0 TSval=2674003361 TSecr=1079416786"
"11.892713","54.38.73.16","172.18.0.2","TLSv1.2","611","Application Data"
"11.893942","172.18.0.2","54.38.73.16","TLSv1.2","611","Application Data"
"11.917344","54.38.73.16","172.18.0.2","TCP","68","21002 → 36876 [ACK] Seq=428177 Ack=25862 Win=1452 Len=0 TSval=2674003479 TSecr=1079417299"
"12.303534","54.38.73.16","172.18.0.2","TLSv1.2","3695","Application Data"
"12.303566","54.38.73.16","172.18.0.2","TLSv1.2","7308","Application Data"
"12.303769","172.18.0.2","54.38.73.16","TCP","68","36876 → 21002 [ACK] Seq=25862 Ack=439044 Win=5533 Len=0 TSval=1079417709 TSecr=2674003567"
"12.314266","54.38.73.16","172.18.0.2","TLSv1.2","2964","Application Data [TCP segment of a reassembled PDU]"
"12.314291","172.18.0.2","54.38.73.16","TCP","68","36876 → 21002 [ACK] Seq=25862 Ack=441940 Win=5595 Len=0 TSval=1079417719 TSecr=2674003578"
"12.327329","54.38.73.16","172.18.0.2","TLSv1.2","4440","Application Data, Application Data"
"12.327507","172.18.0.2","54.38.73.16","TCP","68","36876 → 21002 [ACK] Seq=25862 Ack=446312 Win=5586 Len=0 TSval=1079417733 TSecr=2674003582"
"12.327916","172.18.0.2","54.38.73.16","TLSv1.2","611","Application Data"
"12.352129","54.38.73.16","172.18.0.2","TCP","68","21002 → 36876 [ACK] Seq=446312 Ack=26405 Win=1452 Len=0 TSval=2674003588 TSecr=1079417733"
"12.352161","172.18.0.2","54.38.73.16","TLSv1.2","611","Application Data"
"12.376654","54.38.73.16","172.18.0.2","TCP","68","21002 → 36876 [ACK] Seq=446312 Ack=26948 Win=1452 Len=0 TSval=2674003594 TSecr=1079417757"
"12.916600","54.38.73.16","172.18.0.2","TLSv1.2","611","Application Data"
"12.917687","172.18.0.2","54.38.73.16","TLSv1.2","611","Application Data"
"12.941896","54.38.73.16","172.18.0.2","TCP","68","21002 → 36876 [ACK] Seq=446855 Ack=27491 Win=1452 Len=0 TSval=2674003735 TSecr=1079418323"
"13.428481","54.38.73.16","172.18.0.2","TLSv1.2","611","Application Data"
"13.469530","172.18.0.2","54.38.73.16","TCP","68","36876 → 21002 [ACK] Seq=27491 Ack=447398 Win=5612 Len=0 TSval=1079418875 TSecr=2674003849"
"13.508837","54.38.73.16","172.18.0.2","TLSv1.2","4145","Application Data"
"13.508878","172.18.0.2","54.38.73.16","TCP","68","36876 → 21002 [ACK] Seq=27491 Ack=451475 Win=5589 Len=0 TSval=1079418914 TSecr=2674003877"
"13.508881","54.38.73.16","172.18.0.2","TCP","2964","[TCP segment of a reassembled PDU]"
"13.508889","172.18.0.2","54.38.73.16","TCP","68","36876 → 21002 [ACK] Seq=27491 Ack=454371 Win=5567 Len=0 TSval=1079418914 TSecr=2674003877"
"13.534115","54.38.73.16","172.18.0.2","TLSv1.2","349","Application Data"
"13.534140","172.18.0.2","54.38.73.16","TCP","68","36876 → 21002 [ACK] Seq=27491 Ack=454652 Win=5593 Len=0 TSval=1079418939 TSecr=2674003883"
"13.563196","54.38.73.16","172.18.0.2","TLSv1.2","4145","Application Data"
"13.563220","172.18.0.2","54.38.73.16","TCP","68","36876 → 21002 [ACK] Seq=27491 Ack=458729 Win=5579 Len=0 TSval=1079418968 TSecr=2674003890"
"13.588827","54.38.73.16","172.18.0.2","TLSv1.2","704","Application Data, Application Data"
"13.588852","172.18.0.2","54.38.73.16","TCP","68","36876 → 21002 [ACK] Seq=27491 Ack=459365 Win=5593 Len=0 TSval=1079418994 TSecr=2674003897"
"13.595693","54.38.73.16","172.18.0.2","TCP","1516","[TCP segment of a reassembled PDU]"
"13.595717","172.18.0.2","54.38.73.16","TCP","68","36876 → 21002 [ACK] Seq=27491 Ack=460813 Win=5593 Len=0 TSval=1079419001 TSecr=2674003899"
"13.596068","54.38.73.16","172.18.0.2","TCP","1516","21002 → 36876 [ACK] Seq=460813 Ack=27491 Win=1452 Len=1448 TSval=2674003899 TSecr=1079418968 [TCP segment of a reassembled PDU]"
"13.596088","172.18.0.2","54.38.73.16","TCP","68","36876 → 21002 [ACK] Seq=27491 Ack=462261 Win=5593 Len=0 TSval=1079419001 TSecr=2674003899"
"13.614235","54.38.73.16","172.18.0.2","TLSv1.2","799","Application Data"
"13.614259","172.18.0.2","54.38.73.16","TCP","68","36876 → 21002 [ACK] Seq=27491 Ack=462992 Win=5593 Len=0 TSval=1079419019 TSecr=2674003903"
"13.638949","54.38.73.16","172.18.0.2","TLSv1.2","13100","Application Data, Application Data, Application Data"
"13.638992","172.18.0.2","54.38.73.16","TCP","68","36876 → 21002 [ACK] Seq=27491 Ack=476024 Win=5534 Len=0 TSval=1079419044 TSecr=2674003909"
"13.638996","54.38.73.16","172.18.0.2","TCP","2964","21002 → 36876 [ACK] Seq=476024 Ack=27491 Win=1452 Len=2896 TSval=2674003910 TSecr=1079419019 [TCP segment of a reassembled PDU]"
"13.639005","172.18.0.2","54.38.73.16","TCP","68","36876 → 21002 [ACK] Seq=27491 Ack=478920 Win=5518 Len=0 TSval=1079419044 TSecr=2674003910"
"13.640030","172.18.0.2","54.38.73.16","TLSv1.2","611","Application Data"
"13.663416","54.38.73.16","172.18.0.2","TLSv1.2","11652","Application Data, Application Data, Application Data, Application Data, Application Data"
"13.663441","172.18.0.2","54.38.73.16","TCP","68","36876 → 21002 [ACK] Seq=28034 Ack=490504 Win=5550 Len=0 TSval=1079419069 TSecr=2674003915"
"13.664586","54.38.73.16","172.18.0.2","TCP","68","[TCP Previous segment not captured] 21002 → 36876 [ACK] Seq=493094 Ack=28034 Win=1452 Len=0 TSval=2674003916 TSecr=1079419045"
"13.664602","54.38.73.16","172.18.0.2","TCP","2658","[TCP Retransmission] 21002 → 36876 [PSH, ACK] Seq=490504 Ack=27491 Win=1452 Len=2590 TSval=2674003916 TSecr=1079419044"
"13.664617","172.18.0.2","54.38.73.16","TCP","68","36876 → 21002 [ACK] Seq=28034 Ack=493094 Win=5535 Len=0 TSval=1079419070 TSecr=2674003916"
"13.682603","54.38.73.16","172.18.0.2","TCP","2964","[TCP segment of a reassembled PDU]"
"13.682627","172.18.0.2","54.38.73.16","TCP","68","36876 → 21002 [ACK] Seq=28034 Ack=495990 Win=5595 Len=0 TSval=1079419088 TSecr=2674003920"
"13.688419","54.38.73.16","172.18.0.2","TLSv1.2","285","Application Data"
"13.688445","172.18.0.2","54.38.73.16","TCP","68","36876 → 21002 [ACK] Seq=28034 Ack=496207 Win=5594 Len=0 TSval=1079419094 TSecr=2674003922"
"13.689064","172.18.0.2","54.38.73.16","TLSv1.2","611","Application Data"
"13.751217","54.38.73.16","172.18.0.2","TCP","68","21002 → 36876 [ACK] Seq=496207 Ack=28577 Win=1452 Len=0 TSval=2674003938 TSecr=1079419094"
"13.751246","172.18.0.2","54.38.73.16","TLSv1.2","611","Application Data"
"13.775181","54.38.73.16","172.18.0.2","TCP","68","21002 → 36876 [ACK] Seq=496207 Ack=29120 Win=1452 Len=0 TSval=2674003944 TSecr=1079419156"
"13.869467","02:42:09:5f:bf:77","","ARP","44","Who has 172.18.0.2? Tell 172.18.0.1"
"13.869479","02:42:ac:12:00:02","","ARP","44","172.18.0.2 is at 02:42:ac:12:00:02"
"14.145578","54.38.73.16","172.18.0.2","TLSv1.2","611","Application Data"
"14.145619","172.18.0.2","54.38.73.16","TCP","68","36876 → 21002 [ACK] Seq=29120 Ack=496750 Win=5608 Len=0 TSval=1079419551 TSecr=2674004020"
"14.146647","172.18.0.2","54.38.73.16","TLSv1.2","611","Application Data"
"14.170476","54.38.73.16","172.18.0.2","TCP","68","21002 → 36876 [ACK] Seq=496750 Ack=29663 Win=1452 Len=0 TSval=2674004042 TSecr=1079419552"
"14.760318","54.38.73.16","172.18.0.2","TLSv1.2","3695","Application Data"
"14.760349","54.38.73.16","172.18.0.2","TCP","2964","[TCP segment of a reassembled PDU]"
"14.760357","54.38.73.16","172.18.0.2","TLSv1.2","4412","Application Data [TCP segment of a reassembled PDU]"
"14.760361","54.38.73.16","172.18.0.2","TLSv1.2","2964","Application Data, Application Data"
"14.760365","54.38.73.16","172.18.0.2","TCP","1516","21002 → 36876 [ACK] Seq=510513 Ack=29663 Win=1452 Len=1448 TSval=2674004184 TSecr=1079419552 [TCP segment of a reassembled PDU]"
"14.760489","172.18.0.2","54.38.73.16","TCP","68","36876 → 21002 [ACK] Seq=29663 Ack=511961 Win=5515 Len=0 TSval=1079420166 TSecr=2674004148"
"14.785471","54.38.73.16","172.18.0.2","TLSv1.2","7308","Application Data, Application Data"
"14.785498","172.18.0.2","54.38.73.16","TCP","68","36876 → 21002 [ACK] Seq=29663 Ack=519201 Win=5564 Len=0 TSval=1079420191 TSecr=2674004196"
"14.785965","54.38.73.16","172.18.0.2","TLSv1.2","7205","Application Data, Application Data, Application Data, Application Data"
"14.786315","172.18.0.2","54.38.73.16","TCP","68","36876 → 21002 [ACK] Seq=29663 Ack=526338 Win=5517 Len=0 TSval=1079420191 TSecr=2674004196"
"14.787047","172.18.0.2","54.38.73.16","TLSv1.2","611","Application Data"
"14.796254","54.38.73.16","172.18.0.2","TCP","1516","[TCP segment of a reassembled PDU]"
"14.811099","54.38.73.16","172.18.0.2","TCP","68","[TCP Previous segment not captured] 21002 → 36876 [ACK] Seq=542266 Ack=30206 Win=1452 Len=0 TSval=2674004202 TSecr=1079420192"
"14.811126","54.38.73.16","172.18.0.2","TCP","14548","[TCP Retransmission] 21002 → 36876 [ACK] Seq=527786 Ack=29663 Win=1452 Len=14480 TSval=2674004202 TSecr=1079420191"
"14.811293","172.18.0.2","54.38.73.16","TCP","68","36876 → 21002 [ACK] Seq=30206 Ack=542266 Win=5535 Len=0 TSval=1079420216 TSecr=2674004199"
"14.836678","54.38.73.16","172.18.0.2","TLSv1.2","6988","Ignored Unknown Record"
"14.836703","172.18.0.2","54.38.73.16","TCP","68","36876 → 21002 [ACK] Seq=30206 Ack=549186 Win=5564 Len=0 TSval=1079420242 TSecr=2674004209"
"14.838321","172.18.0.2","54.38.73.16","TLSv1.2","1125","Application Data"
"14.900430","54.38.73.16","172.18.0.2","TCP","68","21002 → 36876 [ACK] Seq=549186 Ack=31263 Win=1452 Len=0 TSval=2674004225 TSecr=1079420243"
"14.900454","172.18.0.2","54.38.73.16","TLSv1.2","611","Application Data"
"14.925094","54.38.73.16","172.18.0.2","TCP","68","21002 → 36876 [ACK] Seq=549186 Ack=31806 Win=1452 Len=0 TSval=2674004231 TSecr=1079420306"
"15.272810","54.38.73.16","172.18.0.2","TLSv1.2","611","Application Data"
"15.273783","172.18.0.2","54.38.73.16","TLSv1.2","611","Application Data"
"15.298487","54.38.73.16","172.18.0.2","TCP","68","21002 → 36876 [ACK] Seq=549729 Ack=32349 Win=1452 Len=0 TSval=2674004324 TSecr=1079420679"
"15.988142","54.38.73.16","172.18.0.2","TCP","1516","[TCP segment of a reassembled PDU]"
"15.988674","54.38.73.16","172.18.0.2","TLSv1.2","2247","Application Data"
"15.988699","54.38.73.16","172.18.0.2","TCP","2964","[TCP segment of a reassembled PDU]"
"15.988707","54.38.73.16","172.18.0.2","TLSv1.2","7308","Application Data, Application Data, Application Data"
"15.988714","54.38.73.16","172.18.0.2","TLSv1.2","1516","Application Data [TCP segment of a reassembled PDU]"
"15.988815","172.18.0.2","54.38.73.16","TCP","68","36876 → 21002 [ACK] Seq=32349 Ack=564940 Win=5547 Len=0 TSval=1079421394 TSecr=2674004448"
"16.013240","54.38.73.16","172.18.0.2","TLSv1.2","14532","Application Data, Application Data, Application Data, Application Data, Application Data, Application Data, Application Data, Application Data"
"16.013467","172.18.0.2","54.38.73.16","TCP","68","36876 → 21002 [ACK] Seq=32349 Ack=579404 Win=5535 Len=0 TSval=1079421419 TSecr=2674004503"
"16.014606","172.18.0.2","54.38.73.16","TLSv1.2","611","Application Data"
"16.015420","54.38.73.16","172.18.0.2","TCP","1516","[TCP segment of a reassembled PDU]"
"16.037764","54.38.73.16","172.18.0.2","TLSv1.2","14548","Application Data, Application Data, Application Data"
"16.037790","172.18.0.2","54.38.73.16","TCP","68","36876 → 21002 [ACK] Seq=32892 Ack=595332 Win=5535 Len=0 TSval=1079421443 TSecr=2674004504"
"16.037914","54.38.73.16","172.18.0.2","TCP","68","21002 → 36876 [ACK] Seq=595332 Ack=32892 Win=1452 Len=0 TSval=2674004509 TSecr=1079421420"
"16.062257","54.38.73.16","172.18.0.2","TLSv1.2","10101","Application Data, Application Data, Application Data, Application Data, Application Data, Application Data"
"16.062302","172.18.0.2","54.38.73.16","TCP","68","36876 → 21002 [ACK] Seq=32892 Ack=605365 Win=5549 Len=0 TSval=1079421467 TSecr=2674004515"
"16.063721","172.18.0.2","54.38.73.16","TLSv1.2","1125","Application Data"
"16.127104","54.38.73.16","172.18.0.2","TCP","68","21002 → 36876 [ACK] Seq=605365 Ack=33949 Win=1452 Len=0 TSval=2674004532 TSecr=1079421469"
"16.127128","172.18.0.2","54.38.73.16","TLSv1.2","611","Application Data"
"16.150932","54.38.73.16","172.18.0.2","TCP","68","21002 → 36876 [ACK] Seq=605365 Ack=34492 Win=1452 Len=0 TSval=2674004538 TSecr=1079421532"
"16.910124","54.38.73.16","172.18.0.2","TLSv1.2","611","Application Data"
"16.910155","54.38.73.16","172.18.0.2","TCP","611","[TCP Retransmission] 21002 → 36876 [PSH, ACK] Seq=605365 Ack=34492 Win=1452 Len=543 TSval=2674004719 TSecr=1079421532"
"16.910170","172.18.0.2","54.38.73.16","TCP","80","36876 → 21002 [ACK] Seq=34492 Ack=605908 Win=5608 Len=0 TSval=1079422315 TSecr=2674004719 SLE=605365 SRE=605908"
"16.911074","172.18.0.2","54.38.73.16","TLSv1.2","611","Application Data"
"16.935480","54.38.73.16","172.18.0.2","TCP","68","21002 → 36876 [ACK] Seq=605908 Ack=35035 Win=1452 Len=0 TSval=2674004733 TSecr=1079422316"
