_ws.col.Time,_ws.col.Source,_ws.col.Destination,_ws.col.Protocol,_ws.col.Length,_ws.col.Info
"0.000000","172.18.0.2","54.38.73.16","TLSv1.2","611","Application Data"
"0.023946","54.38.73.16","172.18.0.2","TCP","68","21002 → 36876 [ACK] Seq=1 Ack=544 Win=1452 Len=0 TSval=2673943595 TSecr=1079177764"
"0.426673","54.38.73.16","172.18.0.2","TLSv1.2","611","Application Data"
"0.427847","172.18.0.2","54.38.73.16","TCP","1516","[TCP segment of a reassembled PDU]"
"0.427935","172.18.0.2","54.38.73.16","TLSv1.2","705","Application Data"
"0.452235","54.38.73.16","172.18.0.2","TCP","68","21002 → 36876 [ACK] Seq=544 Ack=2629 Win=1448 Len=0 TSval=2673943702 TSecr=1079178192"
"0.949655","54.38.73.16","172.18.0.2","TLSv1.2","611","Application Data"
"0.990580","172.18.0.2","54.38.73.16","TCP","68","36876 → 21002 [ACK] Seq=2629 Ack=1087 Win=5612 Len=0 TSval=1079178755 TSecr=2673943808"
"1.019208","54.38.73.16","172.18.0.2","TLSv1.2","1125","Application Data"
"1.019266","172.18.0.2","54.38.73.16","TCP","68","36876 → 21002 [ACK] Seq=2629 Ack=2144 Win=5604 Len=0 TSval=1079178783 TSecr=2673943844"
"1.025579","172.18.0.2","54.38.73.16","TLSv1.2","611","Application Data"
"1.049229","54.38.73.16","172.18.0.2","TCP","68","21002 → 36876 [ACK] Seq=2144 Ack=3172 Win=1452 Len=0 TSval=2673943851 TSecr=1079178790"
"1.450523","54.38.73.16","172.18.0.2","TLSv1.2","611","Application Data"
"1.450579","172.18.0.2","54.38.73.16","TCP","68","36876 → 21002 [ACK] Seq=3172 Ack=2687 Win=5608 Len=0 TSval=1079179215 TSecr=2673943940"
"1.451556","172.18.0.2","54.38.73.16","TLSv1.2","611","Application Data"
"1.474554","54.38.73.16","172.18.0.2","TCP","68","21002 → 36876 [ACK] Seq=2687 Ack=3715 Win=1452 Len=0 TSval=2673943958 TSecr=1079179216"
"1.808293","54.38.73.16","172.18.0.2","TLSv1.2","611","Application Data"
"1.808353","172.18.0.2","54.38.73.16","TCP","68","36876 → 21002 [ACK] Seq=3715 Ack=3230 Win=5608 Len=0 TSval=1079179572 TSecr=2673944041"
"1.844443","54.38.73.16","172.18.0.2","TLSv1.2","4145","Application Data"
"1.844500","172.18.0.2","54.38.73.16","TCP","68","36876 → 21002 [ACK] Seq=3715 Ack=7307 Win=5579 Len=0 TSval=1079179609 TSecr=2673944049"
"1.851797","54.38.73.16","172.18.0.2","TLSv1.2","5860","Application Data, Application Data"
"1.851835","172.18.0.2","54.38.73.16","TCP","68","36876 → 21002 [ACK] Seq=3715 Ack=13099 Win=5580 Len=0 TSval=1079179616 TSecr=2673944051"
"1.876613","54.38.73.16","172.18.0.2","TLSv1.2","1109","Application Data"
"1.876652","172.18.0.2","54.38.73.16","TCP","68","36876 → 21002 [ACK] Seq=3715 Ack=14140 Win=5593 Len=0 TSval=1079179641 TSecr=2673944058"
"1.889613","54.38.73.16","172.18.0.2","TLSv1.2","4412","Application Data"
"1.889649","172.18.0.2","54.38.73.16","TCP","68","36876 → 21002 [ACK] Seq=3715 Ack=18484 Win=5579 Len=0 TSval=1079179654 TSecr=2673944061"
"1.899618","54.38.73.16","172.18.0.2","TLSv1.2","2964","Application Data [TCP segment of a reassembled PDU]"
"1.899653","172.18.0.2","54.38.73.16","TCP","68","36876 → 21002 [ACK] Seq=3715 Ack=21380 Win=5595 Len=0 TSval=1079179664 TSecr=2673944064"
"1.899810","54.38.73.16","172.18.0.2","TLSv1.2","1139","Application Data"
"1.899844","172.18.0.2","54.38.73.16","TCP","68","36876 → 21002 [ACK] Seq=3715 Ack=22451 Win=5587 Len=0 TSval=1079179664 TSecr=2673944064"
"1.911786","54.38.73.16","172.18.0.2","TCP","2964","[TCP segment of a reassembled PDU]"
"1.911822","172.18.0.2","54.38.73.16","TCP","68","36876 → 21002 [ACK] Seq=3715 Ack=25347 Win=5595 Len=0 TSval=1079179676 TSecr=2673944067"
"1.920380","54.38.73.16","172.18.0.2","TLSv1.2","1516","Application Data, Application Data"
"1.920454","172.18.0.2","54.38.73.16","TCP","68","36876 → 21002 [ACK] Seq=3715 Ack=26795 Win=5593 Len=0 TSval=1079179685 TSecr=2673944069"
"1.924144","54.38.73.16","172.18.0.2","TLSv1.2","951","Application Data"
"1.924183","172.18.0.2","54.38.73.16","TCP","68","36876 → 21002 [ACK] Seq=3715 Ack=27678 Win=5593 Len=0 TSval=1079179688 TSecr=2673944070"
"2.007071","54.38.73.16","172.18.0.2","TLSv1.2","3181","Application Data"
"2.007090","172.18.0.2","54.38.73.16","TCP","68","36876 → 21002 [ACK] Seq=3715 Ack=30791 Win=5579 Len=0 TSval=1079179771 TSecr=2673944091"
"2.007420","172.18.0.2","54.38.73.16","TLSv1.2","611","Application Data"
"2.034177","54.38.73.16","172.18.0.2","TCP","68","21002 → 36876 [ACK] Seq=30791 Ack=4258 Win=1452 Len=0 TSval=2673944098 TSecr=1079179772"
"2.034200","172.18.0.2","54.38.73.16","TLSv1.2","611","Application Data"
"2.058191","54.38.73.16","172.18.0.2","TCP","68","21002 → 36876 [ACK] Seq=30791 Ack=4801 Win=1452 Len=0 TSval=2673944104 TSecr=1079179798"
"2.371738","54.38.73.16","172.18.0.2","TLSv1.2","611","Application Data"
"2.372634","172.18.0.2","54.38.73.16","TLSv1.2","611","Application Data"
"2.395915","54.38.73.16","172.18.0.2","TCP","68","21002 → 36876 [ACK] Seq=31334 Ack=5344 Win=1452 Len=0 TSval=2673944188 TSecr=1079180137"
"3.088720","54.38.73.16","172.18.0.2","TCP","1516","[TCP segment of a reassembled PDU]"
"3.089068","54.38.73.16","172.18.0.2","TLSv1.2","2697","Application Data"
"3.089078","54.38.73.16","172.18.0.2","TLSv1.2","2964","Application Data"
"3.089086","54.38.73.16","172.18.0.2","TLSv1.2","7308","Application Data, Application Data, Application Data"
"3.089093","54.38.73.16","172.18.0.2","TCP","1516","21002 → 36876 [ACK] Seq=45547 Ack=5344 Win=1452 Len=1448 TSval=2673944324 TSecr=1079180137 [TCP segment of a reassembled PDU]"
"3.089201","172.18.0.2","54.38.73.16","TCP","68","36876 → 21002 [ACK] Seq=5344 Ack=46995 Win=5547 Len=0 TSval=1079180853 TSecr=2673944286"
"3.090344","172.18.0.2","54.38.73.16","TLSv1.2","611","Application Data"
"3.113575","54.38.73.16","172.18.0.2","TLSv1.2","14082","Application Data, Application Data, Application Data, Application Data, Application Data, Application Data, Application Data, Application Data"
"3.113726","172.18.0.2","54.38.73.16","TCP","68","36876 → 21002 [ACK] Seq=5887 Ack=61009 Win=5537 Len=0 TSval=1079180878 TSecr=2673944367"
"3.114064","54.38.73.16","172.18.0.2","TCP","68","21002 → 36876 [ACK] Seq=61009 Ack=5887 Win=1452 Len=0 TSval=2673944368 TSecr=1079180854"
"3.114997","172.18.0.2","54.38.73.16","TLSv1.2","611","Application Data"
"3.138577","54.38.73.16","172.18.0.2","TLSv1.2","14091","Application Data, Application Data, Application Data, Application Data, Application Data"
"3.138624","172.18.0.2","54.38.73.16","TCP","68","36876 → 21002 [ACK] Seq=6430 Ack=75032 Win=5537 Len=0 TSval=1079180903 TSecr=2673944374"
"3.167589","54.38.73.16","172.18.0.2","TLSv1.2","14091","Application Data, Application Data, Application Data, Application Data, Application Data"
"3.167658","172.18.0.2","54.38.73.16","TCP","68","36876 → 21002 [ACK] Seq=6430 Ack=89055 Win=5537 Len=0 TSval=1079180932 TSecr=2673944381"
"3.168684","172.18.0.2","54.38.73.16","TLSv1.2","611","Application Data"
"3.192507","54.38.73.16","172.18.0.2","TLSv1.2","1639","Application Data"
"3.192545","172.18.0.2","54.38.73.16","TCP","68","36876 → 21002 [ACK] Seq=6973 Ack=90626 Win=5600 Len=0 TSval=1079180957 TSecr=2673944387"
"3.229937","54.38.73.16","172.18.0.2","TCP","68","21002 → 36876 [ACK] Seq=90626 Ack=6973 Win=1452 Len=0 TSval=2673944397 TSecr=1079180933"
"3.230025","172.18.0.2","54.38.73.16","TLSv1.2","611","Application Data"
"3.293537","54.38.73.16","172.18.0.2","TCP","68","21002 → 36876 [ACK] Seq=90626 Ack=7516 Win=1452 Len=0 TSval=2673944413 TSecr=1079180994"
"3.907874","54.38.73.16","172.18.0.2","TLSv1.2","611","Application Data"
"3.908885","172.18.0.2","54.38.73.16","TLSv1.2","611","Application Data"
"3.932578","54.38.73.16","172.18.0.2","TCP","68","21002 → 36876 [ACK] Seq=91169 Ack=8059 Win=1452 Len=0 TSval=2673944572 TSecr=1079181673"
"4.870501","54.38.73.16","172.18.0.2","TLSv1.2","611","Application Data"
"4.902283","54.38.73.16","172.18.0.2","TCP","2964","[TCP segment of a reassembled PDU]"
"4.902470","172.18.0.2","54.38.73.16","TCP","68","36876 → 21002 [ACK] Seq=8059 Ack=94608 Win=5595 Len=0 TSval=1079182667 TSecr=2673944807"
"4.923694","54.38.73.16","172.18.0.2","TLSv1.2","4412","Application Data [TCP segment of a reassembled PDU]"
"4.923842","172.18.0.2","54.38.73.16","TCP","68","36876 → 21002 [ACK] Seq=8059 Ack=98952 Win=5579 Len=0 TSval=1079182688 TSecr=2673944820"
"4.923897","54.38.73.16","172.18.0.2","TLSv1.2","1516","Application Data, Application Data"
"4.924353","172.18.0.2","54.38.73.16","TLSv1.2","611","Application Data"
"4.924390","54.38.73.16","172.18.0.2","TCP","1516","21002 → 36876 [ACK] Seq=100400 Ack=8059 Win=1452 Len=1448 TSval=2673944820 TSecr=1079181673 [TCP segment of a reassembled PDU]"
"4.925823","54.38.73.16","172.18.0.2","TLSv1.2","1356","Application Data"
"4.925851","172.18.0.2","54.38.73.16","TCP","68","36876 → 21002 [ACK] Seq=8602 Ack=103136 Win=5593 Len=0 TSval=1079182690 TSecr=2673944820"
"4.947418","54.38.73.16","172.18.0.2","TCP","68","21002 → 36876 [ACK] Seq=103136 Ack=8602 Win=1452 Len=0 TSval=2673944826 TSecr=1079182688"
"5.008832","54.38.73.16","172.18.0.2","TLSv1.2","4145","Application Data"
"5.008836","54.38.73.16","172.18.0.2","TCP","2964","[TCP segment of a reassembled PDU]"
"5.008902","172.18.0.2","54.38.73.16","TCP","68","36876 → 21002 [ACK] Seq=8602 Ack=110109 Win=5564 Len=0 TSval=1079182773 TSecr=2673944841"
"5.019346","54.38.73.16","172.18.0.2","TLSv1.2","4412","Application Data, Application Data"
"5.019366","172.18.0.2","54.38.73.16","TCP","68","36876 → 21002 [ACK] Seq=8602 Ack=114453 Win=5579 Len=0 TSval=1079182783 TSecr=2673944844"
"5.029288","54.38.73.16","172.18.0.2","TLSv1.2","2964","Application Data [TCP segment of a reassembled PDU]"
"5.029312","172.18.0.2","54.38.73.16","TCP","68","36876 → 21002 [ACK] Seq=8602 Ack=117349 Win=5595 Len=0 TSval=1079182793 TSecr=2673944846"
"5.032700","54.38.73.16","172.18.0.2","TLSv1.2","1963","Application Data, Application Data"
"5.032725","172.18.0.2","54.38.73.16","TCP","68","36876 → 21002 [ACK] Seq=8602 Ack=119244 Win=5599 Len=0 TSval=1079182797 TSecr=2673944847"
"5.033041","172.18.0.2","54.38.73.16","TLSv1.2","611","Application Data"
"5.051531","54.38.73.16","172.18.0.2","TCP","2964","[TCP segment of a reassembled PDU]"
"5.051602","172.18.0.2","54.38.73.16","TCP","68","36876 → 21002 [ACK] Seq=9145 Ack=122140 Win=5595 Len=0 TSval=1079182816 TSecr=2673944852"
"5.057185","54.38.73.16","172.18.0.2","TLSv1.2","1342","Application Data, Application Data"
"5.072049","54.38.73.16","172.18.0.2","TLSv1.2","7308","Application Data"
"5.072135","172.18.0.2","54.38.73.16","TCP","68","36876 → 21002 [ACK] Seq=9145 Ack=130654 Win=5564 Len=0 TSval=1079182836 TSecr=2673944853"
"5.096364","54.38.73.16","172.18.0.2","TLSv1.2","596","Application Data"
"5.105032","172.18.0.2","54.38.73.16","TLSv1.2","611","Application Data"
"5.165843","54.38.73.16","172.18.0.2","TCP","68","21002 → 36876 [ACK] Seq=131182 Ack=9688 Win=1452 Len=0 TSval=2673944881 TSecr=1079182869"
"5.546369","54.38.73.16","172.18.0.2","TLSv1.2","611","Application Data"
"5.547455","172.18.0.2","54.38.73.16","TLSv1.2","611","Application Data"
"5.572949","54.38.73.16","172.18.0.2","TCP","68","21002 → 36876 [ACK] Seq=131725 Ack=10231 Win=1452 Len=0 TSval=2673944982 TSecr=1079183312"
"5.956724","54.38.73.16","172.18.0.2","TLSv1.2","611","Application Data"
"5.956773","54.38.73.16","172.18.0.2","TLSv1.2","7308","Application Data"
"5.956933","172.18.0.2","54.38.73.16","TCP","68","36876 → 21002 [ACK] Seq=10231 Ack=139508 Win=5552 Len=0 TSval=1079183721 TSecr=2673945067"
"5.982236","54.38.73.16","172.18.0.2","TLSv1.2","82","Application Data"
"6.022573","172.18.0.2","54.38.73.16","TCP","68","36876 → 21002 [ACK] Seq=10231 Ack=139522 Win=5612 Len=0 TSval=1079183787 TSecr=2673945085"
"6.048916","54.38.73.16","172.18.0.2","TLSv1.2","4145","Application Data"
"6.048984","172.18.0.2","54.38.73.16","TCP","68","36876 → 21002 [ACK] Seq=10231 Ack=143599 Win=5589 Len=0 TSval=1079183813 TSecr=2673945101"
"6.048928","54.38.73.16","172.18.0.2","TCP","2964","[TCP segment of a reassembled PDU]"
"6.049003","172.18.0.2","54.38.73.16","TCP","68","36876 → 21002 [ACK] Seq=10231 Ack=146495 Win=5567 Len=0 TSval=1079183813 TSecr=2673945101"
"6.059919","54.38.73.16","172.18.0.2","TLSv1.2","4412","Application Data [TCP segment of a reassembled PDU]"
"6.059944","172.18.0.2","54.38.73.16","TCP","68","36876 → 21002 [ACK] Seq=10231 Ack=150839 Win=5579 Len=0 TSval=1079183824 TSecr=2673945104"
"6.060308","172.18.0.2","54.38.73.16","TLSv1.2","611","Application Data"
"6.070986","54.38.73.16","172.18.0.2","TLSv1.2","2964","Application Data, Application Data"
"6.071022","172.18.0.2","54.38.73.16","TCP","68","36876 → 21002 [ACK] Seq=10774 Ack=153735 Win=5595 Len=0 TSval=1079183835 TSecr=2673945107"
"6.073246","54.38.73.16","172.18.0.2","TLSv1.2","1449","Application Data, Application Data"
"6.073285","172.18.0.2","54.38.73.16","TCP","68","36876 → 21002 [ACK] Seq=10774 Ack=155116 Win=5593 Len=0 TSval=1079183837 TSecr=2673945108"
"6.081601","54.38.73.16","172.18.0.2","TCP","2964","[TCP segment of a reassembled PDU]"
"6.081634","172.18.0.2","54.38.73.16","TCP","68","36876 → 21002 [ACK] Seq=10774 Ack=158012 Win=5595 Len=0 TSval=1079183846 TSecr=2673945109"
"6.084206","54.38.73.16","172.18.0.2","TCP","68","21002 → 36876 [ACK] Seq=158012 Ack=10774 Win=1452 Len=0 TSval=2673945110 TSecr=1079183824"
"6.097601","54.38.73.16","172.18.0.2","TLSv1.2","799","Application Data"
"6.097640","172.18.0.2","54.38.73.16","TCP","68","36876 → 21002 [ACK] Seq=10774 Ack=158743 Win=5593 Len=0 TSval=1079183862 TSecr=2673945113"
"6.098297","172.18.0.2","54.38.73.16","TLSv1.2","611","Application Data"
"6.163239","54.38.73.16","172.18.0.2","TCP","68","21002 → 36876 [ACK] Seq=158743 Ack=11317 Win=1452 Len=0 TSval=2673945130 TSecr=1079183862"
"6.163285","172.18.0.2","54.38.73.16","TLSv1.2","611","Application Data"
"6.188146","54.38.73.16","172.18.0.2","TCP","68","21002 → 36876 [ACK] Seq=158743 Ack=11860 Win=1452 Len=0 TSval=2673945136 TSecr=1079183927"
"6.980028","54.38.73.16","172.18.0.2","TLSv1.2","611","Application Data"
"6.980089","172.18.0.2","54.38.73.16","TCP","68","36876 → 21002 [ACK] Seq=11860 Ack=159286 Win=5608 Len=0 TSval=1079184744 TSecr=2673945319"
"6.981058","172.18.0.2","54.38.73.16","TLSv1.2","611","Application Data"
"7.005173","54.38.73.16","172.18.0.2","TCP","68","21002 → 36876 [ACK] Seq=159286 Ack=12403 Win=1452 Len=0 TSval=2673945340 TSecr=1079184745"
"7.331766","54.38.73.16","172.18.0.2","TLSv1.2","611","Application Data"
"7.364072","54.38.73.16","172.18.0.2","TCP","2964","[TCP segment of a reassembled PDU]"
"7.364103","172.18.0.2","54.38.73.16","TCP","68","36876 → 21002 [ACK] Seq=12403 Ack=162725 Win=5595 Len=0 TSval=1079185128 TSecr=2673945422"
"7.385972","54.38.73.16","172.18.0.2","TLSv1.2","4412","Application Data [TCP segment of a reassembled PDU]"
"7.386130","172.18.0.2","54.38.73.16","TCP","68","36876 → 21002 [ACK] Seq=12403 Ack=167069 Win=5579 Len=0 TSval=1079185150 TSecr=2673945435"
"7.387746","54.38.73.16","172.18.0.2","TLSv1.2","82","Application Data"
"7.396173","54.38.73.16","172.18.0.2","TCP","2964","[TCP segment of a reassembled PDU]"
"7.396211","172.18.0.2","54.38.73.16","TCP","68","36876 → 21002 [ACK] Seq=12403 Ack=169979 Win=5595 Len=0 TSval=1079185160 TSecr=2673945436"
"7.419754","54.38.73.16","172.18.0.2","TLSv1.2","4412","Application Data, Application Data"
"7.419901","172.18.0.2","54.38.73.16","TCP","68","36876 → 21002 [ACK] Seq=12403 Ack=174323 Win=5579 Len=0 TSval=1079185184 TSecr=2673945444"
"7.420555","54.38.73.16","172.18.0.2","TLSv1.2","1168","Application Data, Application Data"
"7.462499","172.18.0.2","54.38.73.16","TCP","68","36876 → 21002 [ACK] Seq=12403 Ack=175423 Win=5612 Len=0 TSval=1079185227 TSecr=2673945444"
"7.466221","54.38.73.16","172.18.0.2","TLSv1.2","7308","Application Data"
"7.466286","172.18.0.2","54.38.73.16","TCP","68","36876 → 21002 [ACK] Seq=12403 Ack=182663 Win=5564 Len=0 TSval=1079185230 TSecr=2673945455"
"7.477890","54.38.73.16","172.18.0.2","TLSv1.2","2964","Application Data [TCP segment of a reassembled PDU]"
"7.477926","172.18.0.2","54.38.73.16","TCP","68","36876 → 21002 [ACK] Seq=12403 Ack=185559 Win=5595 Len=0 TSval=1079185242 TSecr=2673945458"
"7.488256","54.38.73.16","172.18.0.2","TLSv1.2","2964","Application Data [TCP segment of a reassembled PDU]"
"7.488293","172.18.0.2","54.38.73.16","TCP","68","36876 → 21002 [ACK] Seq=12403 Ack=188455 Win=5595 Len=0 TSval=1079185252 TSecr=2673945461"
"7.488735","172.18.0.2","54.38.73.16","TLSv1.2","611","Application Data"
"7.491129","54.38.73.16","172.18.0.2","TLSv1.2","2087","Application Data, Application Data"
"7.491164","172.18.0.2","54.38.73.16","TCP","68","36876 → 21002 [ACK] Seq=12946 Ack=190474 Win=5599 Len=0 TSval=1079185255 TSecr=2673945462"
"7.496293","54.38.73.16","172.18.0.2","TLSv1.2","5860","Application Data"
"7.496331","172.18.0.2","54.38.73.16","TCP","68","36876 → 21002 [ACK] Seq=12946 Ack=196266 Win=5580 Len=0 TSval=1079185260 TSecr=2673945463"
"7.507365","54.38.73.16","172.18.0.2","TLSv1.2","2964","Application Data [TCP segment of a reassembled PDU]"
"7.507438","172.18.0.2","54.38.73.16","TCP","68","36876 → 21002 [ACK] Seq=12946 Ack=199162 Win=5595 Len=0 TSval=1079185272 TSecr=2673945466"
"7.513429","54.38.73.16","172.18.0.2","TCP","68","[TCP Previous segment not captured] 21002 → 36876 [ACK] Seq=202058 Ack=12946 Win=1452 Len=0 TSval=2673945467 TSecr=1079185253"
"7.513452","54.38.73.16","172.18.0.2","TCP","2964","[TCP Retransmission] 21002 → 36876 [ACK] Seq=199162 Ack=12403 Win=1452 Len=2896 TSval=2673945467 TSecr=1079185252"
"7.513495","172.18.0.2","54.38.73.16","TCP","68","36876 → 21002 [ACK] Seq=12946 Ack=202058 Win=5595 Len=0 TSval=1079185278 TSecr=2673945467"
"7.514017","172.18.0.2","54.38.73.16","TLSv1.2","611","Application Data"
"7.516095","54.38.73.16","172.18.0.2","TLSv1.2","1964","Ignored Unknown Record"
"7.516129","172.18.0.2","54.38.73.16","TCP","68","36876 → 21002 [ACK] Seq=13489 Ack=203954 Win=5599 Len=0 TSval=1079185280 TSecr=2673945468"
"7.578078","54.38.73.16","172.18.0.2","TCP","68","21002 → 36876 [ACK] Seq=203954 Ack=13489 Win=1452 Len=0 TSval=2673945484 TSecr=1079185278"
"7.578126","172.18.0.2","54.38.73.16","TLSv1.2","611","Application Data"
"7.602520","54.38.73.16","172.18.0.2","TCP","68","21002 → 36876 [ACK] Seq=203954 Ack=14032 Win=1452 Len=0 TSval=2673945490 TSecr=1079185342"
"7.901938","54.38.73.16","172.18.0.2","TLSv1.2","611","Application Data"
"7.902008","172.18.0.2","54.38.73.16","TCP","68","36876 → 21002 [ACK] Seq=14032 Ack=204497 Win=5608 Len=0 TSval=1079185666 TSecr=2673945561"
"7.903066","172.18.0.2","54.38.73.16","TLSv1.2","611","Application Data"
"7.927262","54.38.73.16","172.18.0.2","TCP","68","21002 → 36876 [ACK] Seq=204497 Ack=14575 Win=1452 Len=0 TSval=2673945571 TSecr=1079185667"
"8.486681","54.38.73.16","172.18.0.2","TLSv1.2","611","Application Data"
"8.530586","172.18.0.2","54.38.73.16","TCP","68","36876 → 21002 [ACK] Seq=14575 Ack=205040 Win=5612 Len=0 TSval=1079186295 TSecr=2673945710"
"8.538313","54.38.73.16","172.18.0.2","TCP","2964","[TCP segment of a reassembled PDU]"
"8.538389","172.18.0.2","54.38.73.16","TCP","68","36876 → 21002 [ACK] Seq=14575 Ack=207936 Win=5590 Len=0 TSval=1079186302 TSecr=2673945713"
"8.538327","54.38.73.16","172.18.0.2","TLSv1.2","4412","Application Data [TCP segment of a reassembled PDU]"
"8.538428","172.18.0.2","54.38.73.16","TCP","68","36876 → 21002 [ACK] Seq=14575 Ack=212280 Win=5561 Len=0 TSval=1079186303 TSecr=2673945715"
"8.538335","54.38.73.16","172.18.0.2","TLSv1.2","5860","Application Data, Application Data"
"8.538447","172.18.0.2","54.38.73.16","TCP","68","36876 → 21002 [ACK] Seq=14575 Ack=218072 Win=5530 Len=0 TSval=1079186303 TSecr=2673945718"
"8.568766","54.38.73.16","172.18.0.2","TLSv1.2","2964","Application Data, Application Data"
"8.568816","172.18.0.2","54.38.73.16","TCP","68","36876 → 21002 [ACK] Seq=14575 Ack=220968 Win=5595 Len=0 TSval=1079186333 TSecr=2673945731"
"8.568778","54.38.73.16","172.18.0.2","TLSv1.2","10072","Application Data, Application Data, Application Data"
"8.568864","172.18.0.2","54.38.73.16","TCP","68","36876 → 21002 [ACK] Seq=14575 Ack=230972 Win=5533 Len=0 TSval=1079186333 TSecr=2673945731"
"8.570147","172.18.0.2","54.38.73.16","TLSv1.2","611","Application Data"
"8.572361","54.38.73.16","172.18.0.2","TCP","1516","[TCP segment of a reassembled PDU]"
"8.572397","172.18.0.2","54.38.73.16","TCP","68","36876 → 21002 [ACK] Seq=15118 Ack=232420 Win=5601 Len=0 TSval=1079186337 TSecr=2673945732"
"8.593859","54.38.73.16","172.18.0.2","TCP","68","[TCP Previous segment not captured] 21002 → 36876 [ACK] Seq=244004 Ack=15118 Win=1452 Len=0 TSval=2673945738 TSecr=1079186334"
"8.593883","54.38.73.16","172.18.0.2","TCP","11652","[TCP Retransmission] 21002 → 36876 [ACK] Seq=232420 Ack=14575 Win=1452 Len=11584 TSval=2673945737 TSecr=1079186333"
"8.593929","172.18.0.2","54.38.73.16","TCP","68","36876 → 21002 [ACK] Seq=15118 Ack=244004 Win=5550 Len=0 TSval=1079186358 TSecr=2673945737"
"8.594246","54.38.73.16","172.18.0.2","TLSv1.2","1516","Ignored Unknown Record"
"8.594280","172.18.0.2","54.38.73.16","TCP","68","36876 → 21002 [ACK] Seq=15118 Ack=245452 Win=5539 Len=0 TSval=1079186358 TSecr=2673945738"
"8.607496","54.38.73.16","172.18.0.2","TLSv1.2","1516","Ignored Unknown Record"
"8.607531","172.18.0.2","54.38.73.16","TCP","68","36876 → 21002 [ACK] Seq=15118 Ack=246900 Win=5593 Len=0 TSval=1079186372 TSecr=2673945741"
"8.618349","54.38.73.16","172.18.0.2","TLSv1.2","10204","Ignored Unknown Record"
"8.618394","172.18.0.2","54.38.73.16","TCP","68","36876 → 21002 [ACK] Seq=15118 Ack=257036 Win=5549 Len=0 TSval=1079186383 TSecr=2673945744"
"8.618597","54.38.73.16","172.18.0.2","TLSv1.2","4077","Ignored Unknown Record"
"8.618640","172.18.0.2","54.38.73.16","TCP","68","36876 → 21002 [ACK] Seq=15118 Ack=261045 Win=5520 Len=0 TSval=1079186383 TSecr=2673945744"
"8.619362","172.18.0.2","54.38.73.16","TLSv1.2","611","Application Data"
"8.642883","54.38.73.16","172.18.0.2","TCP","1516","[TCP segment of a reassembled PDU]"
"8.642917","172.18.0.2","54.38.73.16","TCP","68","36876 → 21002 [ACK] Seq=15661 Ack=262493 Win=5593 Len=0 TSval=1079186407 TSecr=2673945750"
"8.643902","54.38.73.16","172.18.0.2","TLSv1.2","705","Application Data"
"8.643941","172.18.0.2","54.38.73.16","TCP","68","36876 → 21002 [ACK] Seq=15661 Ack=263130 Win=5593 Len=0 TSval=1079186408 TSecr=2673945750"
"8.685479","54.38.73.16","172.18.0.2","TCP","68","21002 → 36876 [ACK] Seq=263130 Ack=15661 Win=1452 Len=0 TSval=2673945761 TSecr=1079186383"
"8.685521","172.18.0.2","54.38.73.16","TLSv1.2","1154","Application Data, Application Data"
"8.745190","54.38.73.16","172.18.0.2","TCP","68","21002 → 36876 [ACK] Seq=263130 Ack=16747 Win=1452 Len=0 TSval=2673945776 TSecr=1079186450"
"9.231726","54.38.73.16","172.18.0.2","TLSv1.2","611","Application Data"
"9.231790","172.18.0.2","54.38.73.16","TCP","68","36876 → 21002 [ACK] Seq=16747 Ack=263673 Win=5608 Len=0 TSval=1079186996 TSecr=2673945849"
"9.232795","172.18.0.2","54.38.73.16","TLSv1.2","611","Application Data"
"9.256757","54.38.73.16","172.18.0.2","TCP","68","21002 → 36876 [ACK] Seq=263673 Ack=17290 Win=1452 Len=0 TSval=2673945903 TSecr=1079186997"
"9.744998","54.38.73.16","172.18.0.2","TCP","1516","[TCP segment of a reassembled PDU]"
"9.745285","54.38.73.16","172.18.0.2","TLSv1.2","2247","Application Data"
"9.745299","54.38.73.16","172.18.0.2","TCP","2964","[TCP segment of a reassembled PDU]"
"9.745309","54.38.73.16","172.18.0.2","TLSv1.2","5860","Application Data, Application Data"
"9.745318","54.38.73.16","172.18.0.2","TLSv1.2","1516","Application Data [TCP segment of a reassembled PDU]"
"9.745427","172.18.0.2","54.38.73.16","TCP","68","36876 → 21002 [ACK] Seq=17290 Ack=277436 Win=5548 Len=0 TSval=1079187510 TSecr=2673946006"
"9.769310","54.38.73.16","172.18.0.2","TLSv1.2","2384","Application Data"
"9.769344","172.18.0.2","54.38.73.16","TCP","68","36876 → 21002 [ACK] Seq=17290 Ack=279752 Win=5598 Len=0 TSval=1079187533 TSecr=2673946031"
"9.793492","54.38.73.16","172.18.0.2","TLSv1.2","314","[TCP Previous segment not captured] , Ignored Unknown Record"
"9.793545","172.18.0.2","54.38.73.16","TCP","80","[TCP Dup ACK 214#1] 36876 → 21002 [ACK] Seq=17290 Ack=279752 Win=5598 Len=0 TSval=1079187558 TSecr=2673946031 SLE=282648 SRE=282894"
"9.793513","54.38.73.16","172.18.0.2","TCP","2964","[TCP Out-Of-Order] 21002 → 36876 [ACK] Seq=279752 Ack=17290 Win=1452 Len=2896 TSval=2673946037 TSecr=1079187510"
"9.793581","172.18.0.2","54.38.73.16","TCP","68","36876 → 21002 [ACK] Seq=17290 Ack=282894 Win=5579 Len=0 TSval=1079187558 TSecr=2673946037"
"9.799831","172.18.0.2","54.38.73.16","TLSv1.2","611","Application Data"
"9.824307","54.38.73.16","172.18.0.2","TCP","68","21002 → 36876 [ACK] Seq=282894 Ack=17833 Win=1452 Len=0 TSval=2673946045 TSecr=1079187564"
"10.359173","54.38.73.16","172.18.0.2","TLSv1.2","611","Application Data"
"10.360259","172.18.0.2","54.38.73.16","TLSv1.2","611","Application Data"
"10.384684","54.38.73.16","172.18.0.2","TCP","68","21002 → 36876 [ACK] Seq=283437 Ack=18376 Win=1452 Len=0 TSval=2673946185 TSecr=1079188124"
"10.726633","54.38.73.16","172.18.0.2","TLSv1.2","611","Application Data"
"10.758174","54.38.73.16","172.18.0.2","TLSv1.2","7308","Application Data"
"10.758330","172.18.0.2","54.38.73.16","TCP","68","36876 → 21002 [ACK] Seq=18376 Ack=291220 Win=5564 Len=0 TSval=1079188522 TSecr=2673946271"
"10.779401","54.38.73.16","172.18.0.2","TLSv1.2","4412","Application Data [TCP segment of a reassembled PDU]"
"10.779466","172.18.0.2","54.38.73.16","TCP","68","36876 → 21002 [ACK] Seq=18376 Ack=295564 Win=5579 Len=0 TSval=1079188544 TSecr=2673946284"
"10.782194","54.38.73.16","172.18.0.2","TLSv1.2","422","Application Data, Application Data"
"10.801086","54.38.73.16","172.18.0.2","TCP","2964","[TCP segment of a reassembled PDU]"
"10.801122","172.18.0.2","54.38.73.16","TCP","68","36876 → 21002 [ACK] Seq=18376 Ack=298814 Win=5595 Len=0 TSval=1079188565 TSecr=2673946285"
"10.812387","54.38.73.16","172.18.0.2","TLSv1.2","4412","Application Data [TCP segment of a reassembled PDU]"
"10.812539","172.18.0.2","54.38.73.16","TCP","68","36876 → 21002 [ACK] Seq=18376 Ack=303158 Win=5579 Len=0 TSval=1079188577 TSecr=2673946292"
"10.823884","54.38.73.16","172.18.0.2","TLSv1.2","2964","Application Data [TCP segment of a reassembled PDU]"
"10.823955","172.18.0.2","54.38.73.16","TCP","68","36876 → 21002 [ACK] Seq=18376 Ack=306054 Win=5595 Len=0 TSval=1079188588 TSecr=2673946295"
"10.825913","54.38.73.16","172.18.0.2","TLSv1.2","1356","Application Data, Application Data"
"10.826386","172.18.0.2","54.38.73.16","TLSv1.2","611","Application Data"
"10.846755","54.38.73.16","172.18.0.2","TLSv1.2","10204","Application Data, Application Data"
"10.846918","172.18.0.2","54.38.73.16","TCP","68","36876 → 21002 [ACK] Seq=18919 Ack=317478 Win=5549 Len=0 TSval=1079188611 TSecr=2673946301"
"10.847957","54.38.73.16","172.18.0.2","TCP","1516","21002 → 36876 [ACK] Seq=317478 Ack=18376 Win=1452 Len=1448 TSval=2673946301 TSecr=1079188588 [TCP segment of a reassembled PDU]"
"10.850431","54.38.73.16","172.18.0.2","TLSv1.2","393","Application Data"
"10.850504","172.18.0.2","54.38.73.16","TLSv1.2","611","Application Data"
"10.857463","54.38.73.16","172.18.0.2","TCP","1516","[TCP segment of a reassembled PDU]"
"10.871875","54.38.73.16","172.18.0.2","TLSv1.2","8756","Application Data, Application Data"
"10.872027","172.18.0.2","54.38.73.16","TCP","68","36876 → 21002 [ACK] Seq=19462 Ack=329387 Win=5565 Len=0 TSval=1079188636 TSecr=2673946303"
"10.875455","54.38.73.16","172.18.0.2","TLSv1.2","2898","Application Data, Application Data"
"10.875496","172.18.0.2","54.38.73.16","TCP","68","36876 → 21002 [ACK] Seq=19462 Ack=332217 Win=5596 Len=0 TSval=1079188640 TSecr=2673946308"
"10.902723","54.38.73.16","172.18.0.2","TLSv1.2","2667","Application Data"
"10.902759","172.18.0.2","54.38.73.16","TCP","68","36876 → 21002 [ACK] Seq=19462 Ack=334816 Win=5596 Len=0 TSval=1079188667 TSecr=2673946315"
"10.909858","172.18.0.2","54.38.73.16","TLSv1.2","611","Application Data"
"10.974014","54.38.73.16","172.18.0.2","TCP","68","21002 → 36876 [ACK] Seq=334816 Ack=20005 Win=1452 Len=0 TSval=2673946333 TSecr=1079188674"
"11.381215","54.38.73.16","172.18.0.2","TLSv1.2","611","Application Data"
"11.382234","172.18.0.2","54.38.73.16","TLSv1.2","611","Application Data"
"11.408172","54.38.73.16","172.18.0.2","TCP","68","21002 → 36876 [ACK] Seq=335359 Ack=20548 Win=1452 Len=0 TSval=2673946441 TSecr=1079189146"
"11.735184","54.38.73.16","172.18.0.2","TLSv1.2","611","Application Data"
"11.768437","54.38.73.16","172.18.0.2","TCP","2964","[TCP segment of a reassembled PDU]"
"11.768473","172.18.0.2","54.38.73.16","TCP","68","36876 → 21002 [ACK] Seq=20548 Ack=338798 Win=5595 Len=0 TSval=1079189533 TSecr=2673946523"
"11.779256","54.38.73.16","172.18.0.2","TLSv1.2","8756","Application Data, Application Data"
"11.779409","172.18.0.2","54.38.73.16","TCP","68","36876 → 21002 [ACK] Seq=20548 Ack=347486 Win=5565 Len=0 TSval=1079189544 TSecr=2673946534"
"11.794115","54.38.73.16","172.18.0.2","TLSv1.2","422","Application Data, Application Data"
"11.814828","54.38.73.16","172.18.0.2","TLSv1.2","7308","Application Data"
"11.814988","172.18.0.2","54.38.73.16","TCP","68","36876 → 21002 [ACK] Seq=20548 Ack=355080 Win=5564 Len=0 TSval=1079189579 TSecr=2673946537"
"11.827553","54.38.73.16","172.18.0.2","TLSv1.2","4412","Application Data, Application Data"
"11.827590","172.18.0.2","54.38.73.16","TCP","68","36876 → 21002 [ACK] Seq=20548 Ack=359424 Win=5579 Len=0 TSval=1079189592 TSecr=2673946546"
"11.838990","54.38.73.16","172.18.0.2","TLSv1.2","965","Application Data, Application Data"
"11.839463","172.18.0.2","54.38.73.16","TLSv1.2","611","Application Data"
"11.851949","54.38.73.16","172.18.0.2","TCP","2964","[TCP segment of a reassembled PDU]"
"11.851985","172.18.0.2","54.38.73.16","TCP","68","36876 → 21002 [ACK] Seq=21091 Ack=363217 Win=5595 Len=0 TSval=1079189616 TSecr=2673946552"
"11.863010","54.38.73.16","172.18.0.2","TLSv1.2","1342","Application Data, Application Data"
"11.863495","172.18.0.2","54.38.73.16","TLSv1.2","611","Application Data"
"11.925875","54.38.73.16","172.18.0.2","TCP","68","21002 → 36876 [ACK] Seq=364491 Ack=21634 Win=1452 Len=0 TSval=2673946571 TSecr=1079189628"
"11.925923","172.18.0.2","54.38.73.16","TLSv1.2","611","Application Data"
"11.950046","54.38.73.16","172.18.0.2","TCP","68","21002 → 36876 [ACK] Seq=364491 Ack=22177 Win=1452 Len=0 TSval=2673946577 TSecr=1079189690"
"12.407610","54.38.73.16","172.18.0.2","TLSv1.2","611","Application Data"
"12.408614","172.18.0.2","54.38.73.16","TLSv1.2","611","Application Data"
"12.432628","54.38.73.16","172.18.0.2","TCP","68","21002 → 36876 [ACK] Seq=365034 Ack=22720 Win=1452 Len=0 TSval=2673946697 TSecr=1079190173"
"12.802363","54.38.73.16","172.18.0.2","TLSv1.2","3695","Application Data"
"12.802539","172.18.0.2","54.38.73.16","TCP","68","36876 → 21002 [ACK] Seq=22720 Ack=368661 Win=5584 Len=0 TSval=1079190567 TSecr=2673946790"
"12.836984","54.38.73.16","172.18.0.2","TCP","2964","[TCP segment of a reassembled PDU]"
"12.837021","172.18.0.2","54.38.73.16","TCP","68","36876 → 21002 [ACK] Seq=22720 Ack=371557 Win=5595 Len=0 TSval=1079190601 TSecr=2673946798"
"12.837225","54.38.73.16","172.18.0.2","TLSv1.2","799","Application Data"
"12.845680","54.38.73.16","172.18.0.2","TLSv1.2","7308","Application Data"
"12.845836","172.18.0.2","54.38.73.16","TCP","68","36876 → 21002 [ACK] Seq=22720 Ack=379528 Win=5564 Len=0 TSval=1079190610 TSecr=2673946798"
"12.857652","54.38.73.16","172.18.0.2","TLSv1.2","2964","Application Data, Application Data"
"12.857689","172.18.0.2","54.38.73.16","TCP","68","36876 → 21002 [ACK] Seq=22720 Ack=382424 Win=5595 Len=0 TSval=1079190622 TSecr=2673946803"
"12.861016","54.38.73.16","172.18.0.2","TLSv1.2","2964","Application Data [TCP segment of a reassembled PDU]"
"12.861053","172.18.0.2","54.38.73.16","TCP","68","36876 → 21002 [ACK] Seq=22720 Ack=385320 Win=5595 Len=0 TSval=1079190625 TSecr=2673946804"
"12.870329","54.38.73.16","172.18.0.2","TLSv1.2","7799","Application Data, Application Data, Application Data"
"12.870512","172.18.0.2","54.38.73.16","TCP","68","36876 → 21002 [ACK] Seq=22720 Ack=393051 Win=5569 Len=0 TSval=1079190635 TSecr=2673946807"
"12.871302","172.18.0.2","54.38.73.16","TLSv1.2","611","Application Data"
"12.891207","54.38.73.16","172.18.0.2","TCP","2964","[TCP segment of a reassembled PDU]"
"12.891242","172.18.0.2","54.38.73.16","TCP","68","36876 → 21002 [ACK] Seq=23263 Ack=395947 Win=5595 Len=0 TSval=1079190655 TSecr=2673946812"
"12.894052","54.38.73.16","172.18.0.2","TLSv1.2","799","Application Data"
"12.895454","54.38.73.16","172.18.0.2","TCP","68","21002 → 36876 [ACK] Seq=396678 Ack=23263 Win=1452 Len=0 TSval=2673946813 TSecr=1079190635"
"12.903190","54.38.73.16","172.18.0.2","TCP","2964","[TCP segment of a reassembled PDU]"
"12.903227","172.18.0.2","54.38.73.16","TCP","68","36876 → 21002 [ACK] Seq=23263 Ack=399574 Win=5595 Len=0 TSval=1079190667 TSecr=2673946813"
"12.914200","54.38.73.16","172.18.0.2","TLSv1.2","4412","Application Data [TCP segment of a reassembled PDU]"
"12.914352","172.18.0.2","54.38.73.16","TCP","68","36876 → 21002 [ACK] Seq=23263 Ack=403918 Win=5579 Len=0 TSval=1079190678 TSecr=2673946817"
"12.927570","54.38.73.16","172.18.0.2","TLSv1.2","82","Application Data"
"12.970593","172.18.0.2","54.38.73.16","TCP","68","36876 → 21002 [ACK] Seq=23263 Ack=403932 Win=5612 Len=0 TSval=1079190735 TSecr=2673946821"
"12.995000","54.38.73.16","172.18.0.2","TLSv1.2","1125","Application Data"
"12.995063","172.18.0.2","54.38.73.16","TCP","68","36876 → 21002 [ACK] Seq=23263 Ack=404989 Win=5604 Len=0 TSval=1079190759 TSecr=2673946838"
"13.014802","54.38.73.16","172.18.0.2","TCP","2964","[TCP segment of a reassembled PDU]"
"13.014838","172.18.0.2","54.38.73.16","TCP","68","36876 → 21002 [ACK] Seq=23263 Ack=407885 Win=5595 Len=0 TSval=1079190779 TSecr=2673946843"
"13.019228","54.38.73.16","172.18.0.2","TLSv1.2","799","Application Data"
"13.019266","172.18.0.2","54.38.73.16","TCP","68","36876 → 21002 [ACK] Seq=23263 Ack=408616 Win=5593 Len=0 TSval=1079190783 TSecr=2673946844"
"13.038057","54.38.73.16","172.18.0.2","TCP","2964","[TCP segment of a reassembled PDU]"
"13.038092","172.18.0.2","54.38.73.16","TCP","68","36876 → 21002 [ACK] Seq=23263 Ack=411512 Win=5595 Len=0 TSval=1079190802 TSecr=2673946849"
"13.042731","54.38.73.16","172.18.0.2","TLSv1.2","799","Application Data"
"13.042770","172.18.0.2","54.38.73.16","TCP","68","36876 → 21002 [ACK] Seq=23263 Ack=412243 Win=5593 Len=0 TSval=1079190807 TSecr=2673946850"
"13.043300","172.18.0.2","54.38.73.16","TLSv1.2","611","Application Data"
"13.051140","54.38.73.16","172.18.0.2","TCP","2964","[TCP segment of a reassembled PDU]"
"13.051289","172.18.0.2","54.38.73.16","TCP","68","36876 → 21002 [ACK] Seq=23806 Ack=415139 Win=5595 Len=0 TSval=1079190815 TSecr=2673946852"
"13.059908","54.38.73.16","172.18.0.2","TLSv1.2","2964","Application Data, Application Data"
"13.059945","172.18.0.2","54.38.73.16","TCP","68","36876 → 21002 [ACK] Seq=23806 Ack=418035 Win=5595 Len=0 TSval=1079190824 TSecr=2673946854"
"13.060275","54.38.73.16","172.18.0.2","TLSv1.2","2964","Application Data [TCP segment of a reassembled PDU]"
"13.060413","172.18.0.2","54.38.73.16","TCP","68","36876 → 21002 [ACK] Seq=23806 Ack=420931 Win=5579 Len=0 TSval=1079190825 TSecr=2673946854"
"13.061778","54.38.73.16","172.18.0.2","TLSv1.2","1516","Application Data [TCP segment of a reassembled PDU]"
"13.062123","54.38.73.16","172.18.0.2","TCP","1516","21002 → 36876 [ACK] Seq=422379 Ack=23263 Win=1452 Len=1448 TSval=2673946855 TSecr=1079190802 [TCP segment of a reassembled PDU]"
"13.062157","172.18.0.2","54.38.73.16","TCP","68","36876 → 21002 [ACK] Seq=23806 Ack=423827 Win=5593 Len=0 TSval=1079190826 TSecr=2673946855"
"13.067279","54.38.73.16","172.18.0.2","TLSv1.2","451","Application Data"
"13.067433","172.18.0.2","54.38.73.16","TCP","68","36876 → 21002 [ACK] Seq=23806 Ack=424210 Win=5612 Len=0 TSval=1079190832 TSecr=2673946856"
"13.073854","54.38.73.16","172.18.0.2","TCP","1516","[TCP segment of a reassembled PDU]"
"13.073899","172.18.0.2","54.38.73.16","TLSv1.2","611","Application Data"
"13.075369","54.38.73.16","172.18.0.2","TCP","1516","21002 → 36876 [ACK] Seq=425658 Ack=23806 Win=1452 Len=1448 TSval=2673946858 TSecr=1079190815 [TCP segment of a reassembled PDU]"
"13.092462","54.38.73.16","172.18.0.2","TLSv1.2","799","Application Data"
"13.092617","172.18.0.2","54.38.73.16","TCP","68","36876 → 21002 [ACK] Seq=24349 Ack=427837 Win=5612 Len=0 TSval=1079190857 TSecr=2673946858"
"13.137828","54.38.73.16","172.18.0.2","TCP","68","21002 → 36876 [ACK] Seq=427837 Ack=24349 Win=1452 Len=0 TSval=2673946874 TSecr=1079190838"
"13.137855","172.18.0.2","54.38.73.16","TLSv1.2","611","Application Data"
"13.202089","54.38.73.16","172.18.0.2","TCP","68","21002 → 36876 [ACK] Seq=427837 Ack=24892 Win=1452 Len=0 TSval=2673946890 TSecr=1079190902"
"13.738479","54.38.73.16","172.18.0.2","TLSv1.2","611","Application Data"
"13.738550","172.18.0.2","54.38.73.16","TCP","68","36876 → 21002 [ACK] Seq=24892 Ack=428380 Win=5608 Len=0 TSval=1079191503 TSecr=2673947007"
"13.739625","172.18.0.2","54.38.73.16","TLSv1.2","611","Application Data"
"13.763233","54.38.73.16","172.18.0.2","TCP","68","21002 → 36876 [ACK] Seq=428380 Ack=25435 Win=1452 Len=0 TSval=2673947030 TSecr=1079191504"
"14.148271","54.38.73.16","172.18.0.2","TLSv1.2","3695","Application Data"
"14.148429","172.18.0.2","54.38.73.16","TCP","68","36876 → 21002 [ACK] Seq=25435 Ack=432007 Win=5584 Len=0 TSval=1079191913 TSecr=2673947112"
"14.154213","54.38.73.16","172.18.0.2","TCP","2964","[TCP segment of a reassembled PDU]"
"14.154245","172.18.0.2","54.38.73.16","TCP","68","36876 → 21002 [ACK] Seq=25435 Ack=434903 Win=5595 Len=0 TSval=1079191918 TSecr=2673947128"
"14.164295","54.38.73.16","172.18.0.2","TLSv1.2","5860","Application Data, Application Data"
"14.164416","54.38.73.16","172.18.0.2","TCP","1516","21002 → 36876 [ACK] Seq=440695 Ack=25435 Win=1452 Len=1448 TSval=2673947130 TSecr=1079191504 [TCP segment of a reassembled PDU]"
"14.164443","172.18.0.2","54.38.73.16","TCP","68","36876 → 21002 [ACK] Seq=25435 Ack=440695 Win=5580 Len=0 TSval=1079191929 TSecr=2673947130"
"14.172380","54.38.73.16","172.18.0.2","TLSv1.2","1327","Application Data"
"14.172406","172.18.0.2","54.38.73.16","TCP","68","36876 → 21002 [ACK] Seq=25435 Ack=443402 Win=5593 Len=0 TSval=1079191937 TSecr=2673947130"
"14.197106","54.38.73.16","172.18.0.2","TLSv1.2","1125","Application Data"
"14.205640","54.38.73.16","172.18.0.2","TCP","1516","[TCP segment of a reassembled PDU]"
"14.205672","172.18.0.2","54.38.73.16","TCP","68","36876 → 21002 [ACK] Seq=25435 Ack=445907 Win=5593 Len=0 TSval=1079191970 TSecr=2673947138"
"14.230726","54.38.73.16","172.18.0.2","TLSv1.2","705","Application Data"
"14.238226","172.18.0.2","54.38.73.16","TLSv1.2","611","Application Data"
"14.262553","54.38.73.16","172.18.0.2","TCP","68","21002 → 36876 [ACK] Seq=446544 Ack=25978 Win=1452 Len=0 TSval=2673947155 TSecr=1079192002"
"14.660423","54.38.73.16","172.18.0.2","TLSv1.2","611","Application Data"
"14.661529","172.18.0.2","54.38.73.16","TLSv1.2","611","Application Data"
"14.685136","54.38.73.16","172.18.0.2","TCP","68","21002 → 36876 [ACK] Seq=447087 Ack=26521 Win=1452 Len=0 TSval=2673947260 TSecr=1079192426"
"15.018605","54.38.73.16","172.18.0.2","TLSv1.2","611","Application Data"
"15.049768","54.38.73.16","172.18.0.2","TLSv1.2","7308","Application Data"
"15.049921","172.18.0.2","54.38.73.16","TCP","68","36876 → 21002 [ACK] Seq=26521 Ack=454870 Win=5564 Len=0 TSval=1079192814 TSecr=2673947344"
"15.060098","54.38.73.16","172.18.0.2","TLSv1.2","4412","Application Data, Application Data"
"15.060134","172.18.0.2","54.38.73.16","TCP","68","36876 → 21002 [ACK] Seq=26521 Ack=459214 Win=5579 Len=0 TSval=1079192824 TSecr=2673947354"
"15.074234","54.38.73.16","172.18.0.2","TLSv1.2","422","Application Data"
"15.080348","54.38.73.16","172.18.0.2","TLSv1.2","8756","Application Data, Application Data"
"15.080545","172.18.0.2","54.38.73.16","TCP","68","36876 → 21002 [ACK] Seq=26521 Ack=468256 Win=5565 Len=0 TSval=1079192845 TSecr=2673947358"
"15.081345","172.18.0.2","54.38.73.16","TLSv1.2","611","Application Data"
"15.084025","54.38.73.16","172.18.0.2","TCP","2964","21002 → 36876 [ACK] Seq=468256 Ack=26521 Win=1452 Len=2896 TSval=2673947360 TSecr=1079192824 [TCP segment of a reassembled PDU]"
"15.084061","172.18.0.2","54.38.73.16","TCP","68","36876 → 21002 [ACK] Seq=27064 Ack=471152 Win=5595 Len=0 TSval=1079192848 TSecr=2673947360"
"15.089926","54.38.73.16","172.18.0.2","TLSv1.2","1516","Application Data [TCP segment of a reassembled PDU]"
"15.104370","54.38.73.16","172.18.0.2","TLSv1.2","10204","Application Data, Application Data"
"15.104523","172.18.0.2","54.38.73.16","TCP","68","36876 → 21002 [ACK] Seq=27064 Ack=482736 Win=5549 Len=0 TSval=1079192869 TSecr=2673947362"
"15.104748","54.38.73.16","172.18.0.2","TCP","68","21002 → 36876 [ACK] Seq=482736 Ack=27064 Win=1452 Len=0 TSval=2673947365 TSecr=1079192845"
"15.105029","172.18.0.2","54.38.73.16","TLSv1.2","611","Application Data"
"15.108202","54.38.73.16","172.18.0.2","TLSv1.2","4374","Application Data, Application Data, Application Data"
"15.108243","172.18.0.2","54.38.73.16","TCP","68","36876 → 21002 [ACK] Seq=27607 Ack=487042 Win=5579 Len=0 TSval=1079192872 TSecr=2673947366"
"15.129348","54.38.73.16","172.18.0.2","TLSv1.2","4412","Application Data"
"15.129385","172.18.0.2","54.38.73.16","TCP","68","36876 → 21002 [ACK] Seq=27607 Ack=491386 Win=5579 Len=0 TSval=1079192893 TSecr=2673947371"
"15.131420","54.38.73.16","172.18.0.2","TLSv1.2","922","Application Data"
"15.132586","54.38.73.16","172.18.0.2","TCP","2964","[TCP segment of a reassembled PDU]"
"15.132620","172.18.0.2","54.38.73.16","TCP","68","36876 → 21002 [ACK] Seq=27607 Ack=495136 Win=5595 Len=0 TSval=1079192897 TSecr=2673947372"
"15.153150","54.38.73.16","172.18.0.2","TLSv1.2","1516","Application Data [TCP segment of a reassembled PDU]"
"15.156504","54.38.73.16","172.18.0.2","TLSv1.2","408","Application Data"
"15.156657","172.18.0.2","54.38.73.16","TCP","68","36876 → 21002 [ACK] Seq=27607 Ack=496924 Win=5612 Len=0 TSval=1079192921 TSecr=2673947377"
"15.165588","172.18.0.2","54.38.73.16","TLSv1.2","611","Application Data"
"15.229751","54.38.73.16","172.18.0.2","TCP","68","21002 → 36876 [ACK] Seq=496924 Ack=28150 Win=1452 Len=0 TSval=2673947397 TSecr=1079192930"
"15.444033","54.38.73.16","172.18.0.2","TLSv1.2","611","Application Data"
"15.445148","172.18.0.2","54.38.73.16","TLSv1.2","611","Application Data"
"15.469721","54.38.73.16","172.18.0.2","TCP","68","21002 → 36876 [ACK] Seq=497467 Ack=28693 Win=1452 Len=0 TSval=2673947457 TSecr=1079193209"
"15.848602","54.38.73.16","172.18.0.2","TLSv1.2","4145","Application Data"
"15.848614","54.38.73.16","172.18.0.2","TCP","2964","[TCP segment of a reassembled PDU]"
"15.848780","172.18.0.2","54.38.73.16","TCP","68","36876 → 21002 [ACK] Seq=28693 Ack=504440 Win=5564 Len=0 TSval=1079193613 TSecr=2673947551"
"15.857793","54.38.73.16","172.18.0.2","TLSv1.2","4412","Application Data [TCP segment of a reassembled PDU]"
"15.857828","172.18.0.2","54.38.73.16","TCP","68","36876 → 21002 [ACK] Seq=28693 Ack=508784 Win=5579 Len=0 TSval=1079193622 TSecr=2673947553"
"15.868473","54.38.73.16","172.18.0.2","TLSv1.2","2964","Application Data, Application Data"
"15.868510","172.18.0.2","54.38.73.16","TCP","68","36876 → 21002 [ACK] Seq=28693 Ack=511680 Win=5595 Len=0 TSval=1079193633 TSecr=2673947556"
"15.873971","54.38.73.16","172.18.0.2","TLSv1.2","2477","Application Data, Application Data"
"15.874007","172.18.0.2","54.38.73.16","TCP","68","36876 → 21002 [ACK] Seq=28693 Ack=514089 Win=5597 Len=0 TSval=1079193638 TSecr=2673947558"
"15.877277","54.38.73.16","172.18.0.2","TLSv1.2","4412","Application Data"
"15.877428","172.18.0.2","54.38.73.16","TCP","68","36876 → 21002 [ACK] Seq=28693 Ack=518433 Win=5579 Len=0 TSval=1079193642 TSecr=2673947558"
"15.882664","54.38.73.16","172.18.0.2","TCP","2964","21002 → 36876 [ACK] Seq=518433 Ack=28693 Win=1452 Len=2896 TSval=2673947560 TSecr=1079193622 [TCP segment of a reassembled PDU]"
"15.882700","172.18.0.2","54.38.73.16","TCP","68","36876 → 21002 [ACK] Seq=28693 Ack=521329 Win=5595 Len=0 TSval=1079193647 TSecr=2673947560"
"15.888975","54.38.73.16","172.18.0.2","TLSv1.2","1516","Application Data [TCP segment of a reassembled PDU]"
"15.889457","172.18.0.2","54.38.73.16","TLSv1.2","611","Application Data"
"15.892082","54.38.73.16","172.18.0.2","TCP","1516","21002 → 36876 [ACK] Seq=522777 Ack=28693 Win=1452 Len=1448 TSval=2673947562 TSecr=1079193633 [TCP segment of a reassembled PDU]"
"15.898339","54.38.73.16","172.18.0.2","TLSv1.2","1327","Application Data"
"15.898379","172.18.0.2","54.38.73.16","TCP","68","36876 → 21002 [ACK] Seq=29236 Ack=525484 Win=5593 Len=0 TSval=1079193662 TSecr=2673947562"
"15.899054","54.38.73.16","172.18.0.2","TCP","2964","[TCP segment of a reassembled PDU]"
"15.899085","172.18.0.2","54.38.73.16","TCP","68","36876 → 21002 [ACK] Seq=29236 Ack=528380 Win=5595 Len=0 TSval=1079193663 TSecr=2673947564"
"15.900620","54.38.73.16","172.18.0.2","TLSv1.2","2964","Application Data [TCP segment of a reassembled PDU]"
"15.900655","172.18.0.2","54.38.73.16","TCP","68","36876 → 21002 [ACK] Seq=29236 Ack=531276 Win=5595 Len=0 TSval=1079193665 TSecr=2673947564"
"15.906609","54.38.73.16","172.18.0.2","TLSv1.2","2964","Application Data [TCP segment of a reassembled PDU]"
"15.906647","172.18.0.2","54.38.73.16","TCP","68","36876 → 21002 [ACK] Seq=29236 Ack=534172 Win=5595 Len=0 TSval=1079193671 TSecr=2673947566"
"15.909526","54.38.73.16","172.18.0.2","TLSv1.2","1516","Application Data [TCP segment of a reassembled PDU]"
"15.913492","54.38.73.16","172.18.0.2","TCP","68","21002 → 36876 [ACK] Seq=535620 Ack=29236 Win=1452 Len=0 TSval=2673947567 TSecr=1079193654"
"15.913538","172.18.0.2","54.38.73.16","TLSv1.2","611","Application Data"
"15.920513","54.38.73.16","172.18.0.2","TCP","1516","21002 → 36876 [ACK] Seq=535620 Ack=29236 Win=1452 Len=1448 TSval=2673947569 TSecr=1079193654 [TCP segment of a reassembled PDU]"
"15.923697","54.38.73.16","172.18.0.2","TCP","1516","21002 → 36876 [ACK] Seq=537068 Ack=29236 Win=1452 Len=1448 TSval=2673947570 TSecr=1079193662 [TCP segment of a reassembled PDU]"
"15.923711","54.38.73.16","172.18.0.2","TLSv1.2","2964","Application Data, Application Data"
"15.923854","172.18.0.2","54.38.73.16","TCP","68","36876 → 21002 [ACK] Seq=29779 Ack=541412 Win=5587 Len=0 TSval=1079193688 TSecr=2673947569"
"15.924463","54.38.73.16","172.18.0.2","TLSv1.2","2304","Application Data"
"15.924503","172.18.0.2","54.38.73.16","TCP","68","36876 → 21002 [ACK] Seq=29779 Ack=543648 Win=5598 Len=0 TSval=1079193689 TSecr=2673947570"
"15.929974","54.38.73.16","172.18.0.2","TCP","1516","[TCP segment of a reassembled PDU]"
"15.939871","54.38.73.16","172.18.0.2","TLSv1.2","2964","Application Data [TCP segment of a reassembled PDU]"
"15.940016","172.18.0.2","54.38.73.16","TCP","68","36876 → 21002 [ACK] Seq=29779 Ack=547992 Win=5595 Len=0 TSval=1079193704 TSecr=2673947572"
"15.949508","54.38.73.16","172.18.0.2","TLSv1.2","531","[TCP Previous segment not captured] , Ignored Unknown Record"
"15.949590","172.18.0.2","54.38.73.16","TCP","80","[TCP Window Update] 36876 → 21002 [ACK] Seq=29779 Ack=547992 Win=5607 Len=0 TSval=1079193714 TSecr=2673947572 SLE=549440 SRE=549903"
"15.949547","54.38.73.16","172.18.0.2","TCP","1516","[TCP Out-Of-Order] 21002 → 36876 [ACK] Seq=547992 Ack=29779 Win=1452 Len=1448 TSval=2673947576 TSecr=1079193678"
"15.949620","172.18.0.2","54.38.73.16","TCP","68","36876 → 21002 [ACK] Seq=29779 Ack=549903 Win=5598 Len=0 TSval=1079193714 TSecr=2673947576"
"15.950268","172.18.0.2","54.38.73.16","TLSv1.2","611","Application Data"
"15.978586","02:42:09:5f:bf:77","","ARP","44","Who has 172.18.0.2? Tell 172.18.0.1"
"15.978626","02:42:ac:12:00:02","","ARP","44","172.18.0.2 is at 02:42:ac:12:00:02"
"16.014316","54.38.73.16","172.18.0.2","TCP","68","21002 → 36876 [ACK] Seq=549903 Ack=30322 Win=1452 Len=0 TSval=2673947593 TSecr=1079193714"
"16.014361","172.18.0.2","54.38.73.16","TLSv1.2","611","Application Data"
"16.042235","54.38.73.16","172.18.0.2","TCP","68","21002 → 36876 [ACK] Seq=549903 Ack=30865 Win=1452 Len=0 TSval=2673947599 TSecr=1079193778"
"16.606058","54.38.73.16","172.18.0.2","TLSv1.2","611","Application Data"
"16.606078","54.38.73.16","172.18.0.2","TCP","611","[TCP Retransmission] 21002 → 36876 [PSH, ACK] Seq=549903 Ack=30865 Win=1452 Len=543 TSval=2673947724 TSecr=1079193778"
"16.606155","172.18.0.2","54.38.73.16","TCP","80","36876 → 21002 [ACK] Seq=30865 Ack=550446 Win=5608 Len=0 TSval=1079194370 TSecr=2673947724 SLE=549903 SRE=550446"
"16.607158","172.18.0.2","54.38.73.16","TLSv1.2","611","Application Data"
"16.632119","54.38.73.16","172.18.0.2","TCP","68","21002 → 36876 [ACK] Seq=550446 Ack=31408 Win=1452 Len=0 TSval=2673947747 TSecr=1079194371"
"17.094500","54.38.73.16","172.18.0.2","TLSv1.2","611","Application Data"
"17.094555","172.18.0.2","54.38.73.16","TCP","68","36876 → 21002 [ACK] Seq=31408 Ack=550989 Win=5608 Len=0 TSval=1079194859 TSecr=2673947863"
"17.126728","54.38.73.16","172.18.0.2","TLSv1.2","4145","Application Data"
"17.126788","172.18.0.2","54.38.73.16","TCP","68","36876 → 21002 [ACK] Seq=31408 Ack=555066 Win=5579 Len=0 TSval=1079194891 TSecr=2673947871"
"17.138271","54.38.73.16","172.18.0.2","TLSv1.2","4412","Application Data"
"17.138310","172.18.0.2","54.38.73.16","TCP","68","36876 → 21002 [ACK] Seq=31408 Ack=559410 Win=5579 Len=0 TSval=1079194902 TSecr=2673947874"
"17.138513","54.38.73.16","172.18.0.2","TLSv1.2","1516","Application Data [TCP segment of a reassembled PDU]"
"17.138544","172.18.0.2","54.38.73.16","TCP","68","36876 → 21002 [ACK] Seq=31408 Ack=560858 Win=5568 Len=0 TSval=1079194903 TSecr=2673947874"
"17.153505","54.38.73.16","172.18.0.2","TLSv1.2","1623","Application Data"
"17.153540","172.18.0.2","54.38.73.16","TCP","68","36876 → 21002 [ACK] Seq=31408 Ack=562413 Win=5601 Len=0 TSval=1079194918 TSecr=2673947877"
"17.159702","54.38.73.16","172.18.0.2","TCP","2964","[TCP segment of a reassembled PDU]"
"17.159738","172.18.0.2","54.38.73.16","TCP","68","36876 → 21002 [ACK] Seq=31408 Ack=565309 Win=5595 Len=0 TSval=1079194924 TSecr=2673947879"
"17.164057","54.38.73.16","172.18.0.2","TLSv1.2","1516","Application Data [TCP segment of a reassembled PDU]"
"17.164092","172.18.0.2","54.38.73.16","TCP","68","36876 → 21002 [ACK] Seq=31408 Ack=566757 Win=5593 Len=0 TSval=1079194928 TSecr=2673947880"
"17.178543","54.38.73.16","172.18.0.2","TLSv1.2","408","Application Data"
"17.178596","172.18.0.2","54.38.73.16","TCP","68","36876 → 21002 [ACK] Seq=31408 Ack=567097 Win=5593 Len=0 TSval=1079194943 TSecr=2673947884"
"17.180686","54.38.73.16","172.18.0.2","TLSv1.2","5860","Application Data"
"17.180709","172.18.0.2","54.38.73.16","TCP","68","36876 → 21002 [ACK] Seq=31408 Ack=572889 Win=5580 Len=0 TSval=1079194945 TSecr=2673947884"
"17.185394","54.38.73.16","172.18.0.2","TCP","1516","21002 → 36876 [ACK] Seq=572889 Ack=31408 Win=1452 Len=1448 TSval=2673947885 TSecr=1079194924 [TCP segment of a reassembled PDU]"
"17.185411","172.18.0.2","54.38.73.16","TCP","68","36876 → 21002 [ACK] Seq=31408 Ack=574337 Win=5593 Len=0 TSval=1079194950 TSecr=2673947885"
"17.203714","54.38.73.16","172.18.0.2","TLSv1.2","596","Application Data"
"17.203750","172.18.0.2","54.38.73.16","TCP","68","36876 → 21002 [ACK] Seq=31408 Ack=574865 Win=5593 Len=0 TSval=1079194968 TSecr=2673947890"
"17.204230","172.18.0.2","54.38.73.16","TLSv1.2","611","Application Data"
"17.214852","54.38.73.16","172.18.0.2","TLSv1.2","4412","Application Data"
"17.214882","172.18.0.2","54.38.73.16","TCP","68","36876 → 21002 [ACK] Seq=31951 Ack=579209 Win=5579 Len=0 TSval=1079194979 TSecr=2673947893"
"17.227050","54.38.73.16","172.18.0.2","TLSv1.2","5860","Application Data, Application Data"
"17.227085","172.18.0.2","54.38.73.16","TCP","68","36876 → 21002 [ACK] Seq=31951 Ack=585001 Win=5580 Len=0 TSval=1079194991 TSecr=2673947896"
"17.228517","54.38.73.16","172.18.0.2","TCP","68","21002 → 36876 [ACK] Seq=585001 Ack=31951 Win=1452 Len=0 TSval=2673947896 TSecr=1079194968"
"17.228558","172.18.0.2","54.38.73.16","TLSv1.2","611","Application Data"
"17.238831","54.38.73.16","172.18.0.2","TCP","1516","21002 → 36876 [ACK] Seq=585001 Ack=31951 Win=1452 Len=1448 TSval=2673947899 TSecr=1079194968 [TCP segment of a reassembled PDU]"
"17.239796","54.38.73.16","172.18.0.2","TLSv1.2","2964","Application Data [TCP segment of a reassembled PDU]"
"17.239927","172.18.0.2","54.38.73.16","TCP","68","36876 → 21002 [ACK] Seq=32494 Ack=589345 Win=5595 Len=0 TSval=1079195004 TSecr=2673947899"
"17.251336","54.38.73.16","172.18.0.2","TCP","1516","21002 → 36876 [ACK] Seq=589345 Ack=31951 Win=1452 Len=1448 TSval=2673947902 TSecr=1079194979 [TCP segment of a reassembled PDU]"
"17.251347","54.38.73.16","172.18.0.2","TLSv1.2","1516","Application Data [TCP segment of a reassembled PDU]"
"17.251492","172.18.0.2","54.38.73.16","TCP","68","36876 → 21002 [ACK] Seq=32494 Ack=592241 Win=5603 Len=0 TSval=1079195016 TSecr=2673947902"
"17.251820","54.38.73.16","172.18.0.2","TCP","2964","21002 → 36876 [ACK] Seq=592241 Ack=31951 Win=1452 Len=2896 TSval=2673947902 TSecr=1079194991 [TCP segment of a reassembled PDU]"
"17.251876","172.18.0.2","54.38.73.16","TCP","68","36876 → 21002 [ACK] Seq=32494 Ack=595137 Win=5612 Len=0 TSval=1079195016 TSecr=2673947902"
"17.262115","54.38.73.16","172.18.0.2","TLSv1.2","1516","Application Data, Application Data"
"17.264366","54.38.73.16","172.18.0.2","TLSv1.2","2964","Application Data [TCP segment of a reassembled PDU]"
"17.264547","172.18.0.2","54.38.73.16","TCP","68","36876 → 21002 [ACK] Seq=32494 Ack=599481 Win=5595 Len=0 TSval=1079195029 TSecr=2673947905"
"17.276444","54.38.73.16","172.18.0.2","TLSv1.2","1927","Application Data"
"17.276479","172.18.0.2","54.38.73.16","TCP","68","36876 → 21002 [ACK] Seq=32494 Ack=601340 Win=5599 Len=0 TSval=1079195041 TSecr=2673947908"
"17.300388","54.38.73.16","172.18.0.2","TLSv1.2","611","Application Data"
"17.318387","54.38.73.16","172.18.0.2","TCP","2964","[TCP segment of a reassembled PDU]"
"17.318570","172.18.0.2","54.38.73.16","TCP","68","36876 → 21002 [ACK] Seq=32494 Ack=604779 Win=5595 Len=0 TSval=1079195083 TSecr=2673947914"
"17.343954","54.38.73.16","172.18.0.2","TLSv1.2","799","Application Data"
"17.344590","172.18.0.2","54.38.73.16","TLSv1.2","611","Application Data"
"17.406136","54.38.73.16","172.18.0.2","TCP","68","21002 → 36876 [ACK] Seq=605510 Ack=33037 Win=1452 Len=0 TSval=2673947941 TSecr=1079195109"
"17.406187","172.18.0.2","54.38.73.16","TLSv1.2","611","Application Data"
"17.469675","54.38.73.16","172.18.0.2","TCP","68","21002 → 36876 [ACK] Seq=605510 Ack=33580 Win=1452 Len=0 TSval=2673947957 TSecr=1079195170"
"18.142907","54.38.73.16","172.18.0.2","TLSv1.2","611","Application Data"
"18.142926","54.38.73.16","172.18.0.2","TCP","611","[TCP Retransmission] 21002 → 36876 [PSH, ACK] Seq=605510 Ack=33580 Win=1452 Len=543 TSval=2673948119 TSecr=1079195170"
"18.143036","172.18.0.2","54.38.73.16","TCP","80","36876 → 21002 [ACK] Seq=33580 Ack=606053 Win=5608 Len=0 TSval=1079195907 TSecr=2673948119 SLE=605510 SRE=606053"
"18.144039","172.18.0.2","54.38.73.16","TLSv1.2","611","Application Data"
"18.168319","54.38.73.16","172.18.0.2","TCP","68","21002 → 36876 [ACK] Seq=606053 Ack=34123 Win=1452 Len=0 TSval=2673948131 TSecr=1079195908"
