_ws.col.Time,_ws.col.Source,_ws.col.Destination,_ws.col.Protocol,_ws.col.Length,_ws.col.Info
"0.000000","172.19.0.3","5.9.29.183","TLSv1.2","599","Application Data"
"0.000317","5.9.29.183","172.19.0.3","TCP","56","9002 → 43520 [ACK] Seq=1 Ack=544 Win=65535 Len=0"
"0.288067","5.9.29.183","172.19.0.3","TLSv1.2","599","Application Data"
"0.288768","172.19.0.3","5.9.29.183","TLSv1.2","2141","Application Data"
"0.289001","5.9.29.183","172.19.0.3","TCP","56","9002 → 43520 [ACK] Seq=544 Ack=2629 Win=65535 Len=0"
"0.890737","5.9.29.183","172.19.0.3","TLSv1.2","599","Application Data"
"0.932673","172.19.0.3","5.9.29.183","TCP","56","43520 → 9002 [ACK] Seq=2629 Ack=1087 Win=11911 Len=0"
"0.983599","5.9.29.183","172.19.0.3","TCP","1516","[TCP segment of a reassembled PDU]"
"0.983628","172.19.0.3","5.9.29.183","TCP","56","43520 → 9002 [ACK] Seq=2629 Ack=2547 Win=11911 Len=0"
"0.983659","5.9.29.183","172.19.0.3","TLSv1.2","167","Application Data"
"0.983670","172.19.0.3","5.9.29.183","TCP","56","43520 → 9002 [ACK] Seq=2629 Ack=2658 Win=11911 Len=0"
"0.986594","172.19.0.3","5.9.29.183","TLSv1.2","599","Application Data"
"0.986783","5.9.29.183","172.19.0.3","TCP","56","9002 → 43520 [ACK] Seq=2658 Ack=3172 Win=65535 Len=0"
"1.308716","5.9.29.183","172.19.0.3","TLSv1.2","599","Application Data"
"1.309276","172.19.0.3","5.9.29.183","TLSv1.2","599","Application Data"
"1.309502","5.9.29.183","172.19.0.3","TCP","56","9002 → 43520 [ACK] Seq=3201 Ack=3715 Win=65535 Len=0"
"1.621377","5.9.29.183","172.19.0.3","TCP","1516","[TCP segment of a reassembled PDU]"
"1.621443","5.9.29.183","172.19.0.3","TCP","1516","9002 → 43520 [PSH, ACK] Seq=4661 Ack=3715 Win=65535 Len=1460 [TCP segment of a reassembled PDU]"
"1.621449","5.9.29.183","172.19.0.3","TLSv1.2","763","Application Data"
"1.621567","172.19.0.3","5.9.29.183","TCP","56","43520 → 9002 [ACK] Seq=3715 Ack=6828 Win=11893 Len=0"
"1.649637","5.9.29.183","172.19.0.3","TCP","1516","[TCP segment of a reassembled PDU]"
"1.649696","5.9.29.183","172.19.0.3","TCP","1516","9002 → 43520 [PSH, ACK] Seq=8288 Ack=3715 Win=65535 Len=1460 [TCP segment of a reassembled PDU]"
"1.649709","172.19.0.3","5.9.29.183","TCP","56","43520 → 9002 [ACK] Seq=3715 Ack=9748 Win=11903 Len=0"
"1.649710","5.9.29.183","172.19.0.3","TLSv1.2","763","Application Data"
"1.665212","5.9.29.183","172.19.0.3","TLSv1.2","599","Application Data"
"1.665469","172.19.0.3","5.9.29.183","TCP","56","43520 → 9002 [ACK] Seq=3715 Ack=10998 Win=11911 Len=0"
"1.674360","5.9.29.183","172.19.0.3","TCP","1516","[TCP segment of a reassembled PDU]"
"1.674408","5.9.29.183","172.19.0.3","TCP","1492","9002 → 43520 [PSH, ACK] Seq=12458 Ack=3715 Win=65535 Len=1436 [TCP segment of a reassembled PDU]"
"1.674414","5.9.29.183","172.19.0.3","TLSv1.2","1516","Application Data [TCP segment of a reassembled PDU]"
"1.674416","5.9.29.183","172.19.0.3","TCP","1516","9002 → 43520 [PSH, ACK] Seq=15354 Ack=3715 Win=65535 Len=1460 [TCP segment of a reassembled PDU]"
"1.674421","5.9.29.183","172.19.0.3","TCP","1516","9002 → 43520 [PSH, ACK] Seq=16814 Ack=3715 Win=65535 Len=1460 [TCP segment of a reassembled PDU]"
"1.674423","5.9.29.183","172.19.0.3","TLSv1.2","1516","Application Data [TCP segment of a reassembled PDU]"
"1.674435","5.9.29.183","172.19.0.3","TCP","1456","9002 → 43520 [PSH, ACK] Seq=19734 Ack=3715 Win=65535 Len=1400 [TCP segment of a reassembled PDU]"
"1.674527","172.19.0.3","5.9.29.183","TCP","56","43520 → 9002 [ACK] Seq=3715 Ack=21134 Win=11863 Len=0"
"1.681381","5.9.29.183","172.19.0.3","TLSv1.2","1315","Application Data"
"1.686674","5.9.29.183","172.19.0.3","TCP","1516","[TCP segment of a reassembled PDU]"
"1.686690","172.19.0.3","5.9.29.183","TCP","56","43520 → 9002 [ACK] Seq=3715 Ack=23853 Win=11911 Len=0"
"1.686720","5.9.29.183","172.19.0.3","TCP","1492","9002 → 43520 [PSH, ACK] Seq=23853 Ack=3715 Win=65535 Len=1436 [TCP segment of a reassembled PDU]"
"1.692461","5.9.29.183","172.19.0.3","TLSv1.2","1504","Application Data [TCP segment of a reassembled PDU]"
"1.692471","172.19.0.3","5.9.29.183","TCP","56","43520 → 9002 [ACK] Seq=3715 Ack=26737 Win=11911 Len=0"
"1.698562","5.9.29.183","172.19.0.3","TLSv1.2","396","Application Data"
"1.740105","5.9.29.183","172.19.0.3","TCP","1504","[TCP segment of a reassembled PDU]"
"1.740124","172.19.0.3","5.9.29.183","TCP","56","43520 → 9002 [ACK] Seq=3715 Ack=28525 Win=11911 Len=0"
"1.740158","5.9.29.183","172.19.0.3","TLSv1.2","1207","Application Data"
"1.740505","172.19.0.3","5.9.29.183","TLSv1.2","599","Application Data"
"1.740669","5.9.29.183","172.19.0.3","TCP","56","9002 → 43520 [ACK] Seq=29676 Ack=4258 Win=65535 Len=0"
"1.750318","172.19.0.3","5.9.29.183","TLSv1.2","599","Application Data"
"1.750719","5.9.29.183","172.19.0.3","TCP","56","9002 → 43520 [ACK] Seq=29676 Ack=4801 Win=65535 Len=0"
"2.243181","5.9.29.183","172.19.0.3","TLSv1.2","599","Application Data"
"2.243805","172.19.0.3","5.9.29.183","TLSv1.2","599","Application Data"
"2.244013","5.9.29.183","172.19.0.3","TCP","56","9002 → 43520 [ACK] Seq=30219 Ack=5344 Win=65535 Len=0"
"2.570876","5.9.29.183","172.19.0.3","TLSv1.2","599","Application Data"
"2.609319","5.9.29.183","172.19.0.3","TCP","1516","[TCP segment of a reassembled PDU]"
"2.609338","172.19.0.3","5.9.29.183","TCP","56","43520 → 9002 [ACK] Seq=5344 Ack=32222 Win=11911 Len=0"
"2.609389","5.9.29.183","172.19.0.3","TCP","1516","9002 → 43520 [PSH, ACK] Seq=32222 Ack=5344 Win=65535 Len=1460 [TCP segment of a reassembled PDU]"
"2.609647","5.9.29.183","172.19.0.3","TLSv1.2","763","Application Data"
"2.609660","172.19.0.3","5.9.29.183","TCP","56","43520 → 9002 [ACK] Seq=5344 Ack=34389 Win=11911 Len=0"
"2.637235","5.9.29.183","172.19.0.3","TCP","1516","[TCP segment of a reassembled PDU]"
"2.637282","5.9.29.183","172.19.0.3","TCP","1516","9002 → 43520 [PSH, ACK] Seq=35849 Ack=5344 Win=65535 Len=1460 [TCP segment of a reassembled PDU]"
"2.637288","5.9.29.183","172.19.0.3","TLSv1.2","763","Application Data"
"2.637468","172.19.0.3","5.9.29.183","TCP","56","43520 → 9002 [ACK] Seq=5344 Ack=38016 Win=11895 Len=0"
"2.656039","5.9.29.183","172.19.0.3","TLSv1.2","599","Application Data"
"2.679324","5.9.29.183","172.19.0.3","TCP","1516","[TCP segment of a reassembled PDU]"
"2.679342","172.19.0.3","5.9.29.183","TCP","56","43520 → 9002 [ACK] Seq=5344 Ack=40019 Win=11909 Len=0"
"2.679377","5.9.29.183","172.19.0.3","TCP","1492","9002 → 43520 [PSH, ACK] Seq=40019 Ack=5344 Win=65535 Len=1436 [TCP segment of a reassembled PDU]"
"2.679407","5.9.29.183","172.19.0.3","TLSv1.2","787","Application Data"
"2.679536","172.19.0.3","5.9.29.183","TCP","56","43520 → 9002 [ACK] Seq=5344 Ack=42186 Win=11893 Len=0"
"2.679748","172.19.0.3","5.9.29.183","TLSv1.2","599","Application Data"
"2.679887","5.9.29.183","172.19.0.3","TCP","56","9002 → 43520 [ACK] Seq=42186 Ack=5887 Win=65535 Len=0"
"2.689702","5.9.29.183","172.19.0.3","TCP","1516","[TCP segment of a reassembled PDU]"
"2.689760","5.9.29.183","172.19.0.3","TCP","1492","9002 → 43520 [PSH, ACK] Seq=43646 Ack=5887 Win=65535 Len=1436 [TCP segment of a reassembled PDU]"
"2.689876","172.19.0.3","5.9.29.183","TCP","56","43520 → 9002 [ACK] Seq=5887 Ack=45082 Win=11903 Len=0"
"2.699571","5.9.29.183","172.19.0.3","TLSv1.2","1330","Application Data, Application Data"
"2.716955","5.9.29.183","172.19.0.3","TCP","1516","[TCP segment of a reassembled PDU]"
"2.716973","172.19.0.3","5.9.29.183","TCP","56","43520 → 9002 [ACK] Seq=5887 Ack=47816 Win=11911 Len=0"
"2.717007","5.9.29.183","172.19.0.3","TCP","1492","9002 → 43520 [PSH, ACK] Seq=47816 Ack=5887 Win=65535 Len=1436 [TCP segment of a reassembled PDU]"
"2.717035","5.9.29.183","172.19.0.3","TLSv1.2","1330","Application Data, Application Data"
"2.717155","172.19.0.3","5.9.29.183","TCP","56","43520 → 9002 [ACK] Seq=5887 Ack=50526 Win=11895 Len=0"
"2.737503","5.9.29.183","172.19.0.3","TCP","1504","[TCP segment of a reassembled PDU]"
"2.737556","5.9.29.183","172.19.0.3","TCP","1516","9002 → 43520 [PSH, ACK] Seq=51974 Ack=5887 Win=65535 Len=1460 [TCP segment of a reassembled PDU]"
"2.737577","172.19.0.3","5.9.29.183","TCP","56","43520 → 9002 [ACK] Seq=5887 Ack=53434 Win=11903 Len=0"
"2.737581","5.9.29.183","172.19.0.3","TLSv1.2","1225","Application Data"
"2.737667","5.9.29.183","172.19.0.3","TCP","1504","[TCP segment of a reassembled PDU]"
"2.737707","172.19.0.3","5.9.29.183","TCP","56","43520 → 9002 [ACK] Seq=5887 Ack=56051 Win=11887 Len=0"
"2.753713","5.9.29.183","172.19.0.3","TLSv1.2","1504","Application Data [TCP segment of a reassembled PDU]"
"2.753761","5.9.29.183","172.19.0.3","TLSv1.2","1394","Application Data"
"2.753774","172.19.0.3","5.9.29.183","TCP","56","43520 → 9002 [ACK] Seq=5887 Ack=58837 Win=11903 Len=0"
"2.754009","172.19.0.3","5.9.29.183","TLSv1.2","599","Application Data"
"2.754184","5.9.29.183","172.19.0.3","TCP","56","9002 → 43520 [ACK] Seq=58837 Ack=6430 Win=65535 Len=0"
"2.790994","5.9.29.183","172.19.0.3","TCP","1516","[TCP segment of a reassembled PDU]"
"2.791042","5.9.29.183","172.19.0.3","TLSv1.2","167","Application Data"
"2.791054","172.19.0.3","5.9.29.183","TCP","56","43520 → 9002 [ACK] Seq=6430 Ack=60408 Win=11903 Len=0"
"2.794745","172.19.0.3","5.9.29.183","TLSv1.2","599","Application Data"
"2.795131","5.9.29.183","172.19.0.3","TCP","56","9002 → 43520 [ACK] Seq=60408 Ack=6973 Win=65535 Len=0"
"3.223149","5.9.29.183","172.19.0.3","TCP","495","[TCP segment of a reassembled PDU]"
"3.223226","5.9.29.183","172.19.0.3","TLSv1.2","160","Application Data"
"3.223351","172.19.0.3","5.9.29.183","TCP","56","43520 → 9002 [ACK] Seq=6973 Ack=60951 Win=11911 Len=0"
"3.223829","172.19.0.3","5.9.29.183","TLSv1.2","599","Application Data"
"3.224005","5.9.29.183","172.19.0.3","TCP","56","9002 → 43520 [ACK] Seq=60951 Ack=7516 Win=65535 Len=0"
"3.536849","5.9.29.183","172.19.0.3","TLSv1.2","599","Application Data"
"3.549761","5.9.29.183","172.19.0.3","TCP","1516","[TCP segment of a reassembled PDU]"
"3.549802","172.19.0.3","5.9.29.183","TCP","56","43520 → 9002 [ACK] Seq=7516 Ack=62954 Win=11911 Len=0"
"3.549842","5.9.29.183","172.19.0.3","TCP","1492","9002 → 43520 [PSH, ACK] Seq=62954 Ack=7516 Win=65535 Len=1436 [TCP segment of a reassembled PDU]"
"3.534284","5.9.29.183","172.19.0.3","TLSv1.2","787","Application Data"
"3.534317","172.19.0.3","5.9.29.183","TCP","56","43520 → 9002 [ACK] Seq=7516 Ack=65121 Win=11911 Len=0"
"3.564644","5.9.29.183","172.19.0.3","TCP","1504","[TCP segment of a reassembled PDU]"
"3.564735","5.9.29.183","172.19.0.3","TCP","1504","9002 → 43520 [PSH, ACK] Seq=66569 Ack=7516 Win=65535 Len=1448 [TCP segment of a reassembled PDU]"
"3.564741","5.9.29.183","172.19.0.3","TLSv1.2","1237","Application Data"
"3.564862","172.19.0.3","5.9.29.183","TCP","56","43520 → 9002 [ACK] Seq=7516 Ack=69198 Win=11895 Len=0"
"3.576758","5.9.29.183","172.19.0.3","TLSv1.2","1516","Application Data"
"3.576840","5.9.29.183","172.19.0.3","TCP","1516","9002 → 43520 [PSH, ACK] Seq=70658 Ack=7516 Win=65535 Len=1460 [TCP segment of a reassembled PDU]"
"3.576864","172.19.0.3","5.9.29.183","TCP","56","43520 → 9002 [ACK] Seq=7516 Ack=72118 Win=11903 Len=0"
"3.576867","5.9.29.183","172.19.0.3","TLSv1.2","1480","Application Data [TCP segment of a reassembled PDU]"
"3.576871","5.9.29.183","172.19.0.3","TCP","1516","9002 → 43520 [PSH, ACK] Seq=73542 Ack=7516 Win=65535 Len=1460 [TCP segment of a reassembled PDU]"
"3.576881","5.9.29.183","172.19.0.3","TCP","1516","9002 → 43520 [PSH, ACK] Seq=75002 Ack=7516 Win=65535 Len=1460 [TCP segment of a reassembled PDU]"
"3.576884","5.9.29.183","172.19.0.3","TLSv1.2","1516","Application Data [TCP segment of a reassembled PDU]"
"3.576886","5.9.29.183","172.19.0.3","TCP","1468","9002 → 43520 [PSH, ACK] Seq=77922 Ack=7516 Win=65535 Len=1412 [TCP segment of a reassembled PDU]"
"3.577056","172.19.0.3","5.9.29.183","TCP","56","43520 → 9002 [ACK] Seq=7516 Ack=79334 Win=11863 Len=0"
"3.580865","5.9.29.183","172.19.0.3","TCP","1504","9002 → 43520 [PSH, ACK] Seq=79334 Ack=7516 Win=65535 Len=1448 [TCP segment of a reassembled PDU]"
"3.585349","5.9.29.183","172.19.0.3","TLSv1.2","1516","Application Data [TCP segment of a reassembled PDU]"
"3.585367","172.19.0.3","5.9.29.183","TCP","56","43520 → 9002 [ACK] Seq=7516 Ack=82242 Win=11911 Len=0"
"3.585399","5.9.29.183","172.19.0.3","TCP","1516","9002 → 43520 [PSH, ACK] Seq=82242 Ack=7516 Win=65535 Len=1460 [TCP segment of a reassembled PDU]"
"3.585429","5.9.29.183","172.19.0.3","TCP","450","9002 → 43520 [PSH, ACK] Seq=83702 Ack=7516 Win=65535 Len=394 [TCP segment of a reassembled PDU]"
"3.585434","5.9.29.183","172.19.0.3","TLSv1.2","1504","Application Data [TCP segment of a reassembled PDU]"
"3.585544","172.19.0.3","5.9.29.183","TCP","56","43520 → 9002 [ACK] Seq=7516 Ack=85544 Win=11887 Len=0"
"3.598926","5.9.29.183","172.19.0.3","TLSv1.2","1504","Application Data [TCP segment of a reassembled PDU]"
"3.606582","5.9.29.183","172.19.0.3","TLSv1.2","1516","Application Data [TCP segment of a reassembled PDU]"
"3.606599","172.19.0.3","5.9.29.183","TCP","56","43520 → 9002 [ACK] Seq=7516 Ack=88452 Win=11911 Len=0"
"3.606633","5.9.29.183","172.19.0.3","TCP","1021","9002 → 43520 [PSH, ACK] Seq=88452 Ack=7516 Win=65535 Len=965 [TCP segment of a reassembled PDU]"
"3.606660","5.9.29.183","172.19.0.3","TCP","1504","9002 → 43520 [PSH, ACK] Seq=89417 Ack=7516 Win=65535 Len=1448 [TCP segment of a reassembled PDU]"
"3.606784","172.19.0.3","5.9.29.183","TCP","56","43520 → 9002 [ACK] Seq=7516 Ack=90865 Win=11893 Len=0"
"3.606981","172.19.0.3","5.9.29.183","TLSv1.2","599","Application Data"
"3.607131","5.9.29.183","172.19.0.3","TCP","56","9002 → 43520 [ACK] Seq=90865 Ack=8059 Win=65535 Len=0"
"3.621876","5.9.29.183","172.19.0.3","TLSv1.2","787","Application Data"
"3.629509","5.9.29.183","172.19.0.3","TCP","1516","[TCP segment of a reassembled PDU]"
"3.629528","172.19.0.3","5.9.29.183","TCP","56","43520 → 9002 [ACK] Seq=8059 Ack=93056 Win=11911 Len=0"
"3.629598","5.9.29.183","172.19.0.3","TCP","1492","9002 → 43520 [PSH, ACK] Seq=93056 Ack=8059 Win=65535 Len=1436 [TCP segment of a reassembled PDU]"
"3.629688","5.9.29.183","172.19.0.3","TLSv1.2","1504","Application Data [TCP segment of a reassembled PDU]"
"3.629737","172.19.0.3","5.9.29.183","TCP","56","43520 → 9002 [ACK] Seq=8059 Ack=95940 Win=11895 Len=0"
"3.629977","172.19.0.3","5.9.29.183","TLSv1.2","599","Application Data"
"3.630154","5.9.29.183","172.19.0.3","TCP","56","9002 → 43520 [ACK] Seq=95940 Ack=8602 Win=65535 Len=0"
"3.641849","5.9.29.183","172.19.0.3","TLSv1.2","396","Application Data"
"3.650698","5.9.29.183","172.19.0.3","TCP","1504","[TCP segment of a reassembled PDU]"
"3.650717","172.19.0.3","5.9.29.183","TCP","56","43520 → 9002 [ACK] Seq=8602 Ack=97728 Win=11911 Len=0"
"3.650753","5.9.29.183","172.19.0.3","TCP","1516","9002 → 43520 [PSH, ACK] Seq=97728 Ack=8602 Win=65535 Len=1460 [TCP segment of a reassembled PDU]"
"3.650823","5.9.29.183","172.19.0.3","TLSv1.2","1516","Application Data [TCP segment of a reassembled PDU]"
"3.650832","5.9.29.183","172.19.0.3","TCP","1516","9002 → 43520 [PSH, ACK] Seq=100648 Ack=8602 Win=65535 Len=1460 [TCP segment of a reassembled PDU]"
"3.650836","5.9.29.183","172.19.0.3","TCP","1468","9002 → 43520 [PSH, ACK] Seq=102108 Ack=8602 Win=65535 Len=1412 [TCP segment of a reassembled PDU]"
"3.650902","172.19.0.3","5.9.29.183","TCP","56","43520 → 9002 [ACK] Seq=8602 Ack=103520 Win=11879 Len=0"
"3.659568","5.9.29.183","172.19.0.3","TLSv1.2","70","Application Data"
"3.659613","5.9.29.183","172.19.0.3","TCP","1516","[TCP segment of a reassembled PDU]"
"3.659625","172.19.0.3","5.9.29.183","TCP","56","43520 → 9002 [ACK] Seq=8602 Ack=104994 Win=11909 Len=0"
"3.659627","5.9.29.183","172.19.0.3","TCP","1516","9002 → 43520 [PSH, ACK] Seq=104994 Ack=8602 Win=65535 Len=1460 [TCP segment of a reassembled PDU]"
"3.659629","5.9.29.183","172.19.0.3","TLSv1.2","1480","Application Data [TCP segment of a reassembled PDU]"
"3.659728","172.19.0.3","5.9.29.183","TCP","56","43520 → 9002 [ACK] Seq=8602 Ack=107878 Win=11893 Len=0"
"3.679221","5.9.29.183","172.19.0.3","TLSv1.2","1424","Application Data"
"3.687901","5.9.29.183","172.19.0.3","TCP","1504","[TCP segment of a reassembled PDU]"
"3.687925","172.19.0.3","5.9.29.183","TCP","56","43520 → 9002 [ACK] Seq=8602 Ack=110694 Win=11911 Len=0"
"3.695795","5.9.29.183","172.19.0.3","TLSv1.2","693","Application Data"
"3.699791","172.19.0.3","5.9.29.183","TLSv1.2","599","Application Data"
"3.700023","5.9.29.183","172.19.0.3","TCP","56","9002 → 43520 [ACK] Seq=111331 Ack=9145 Win=65535 Len=0"
"4.054618","5.9.29.183","172.19.0.3","TLSv1.2","599","Application Data"
"4.055251","172.19.0.3","5.9.29.183","TLSv1.2","599","Application Data"
"4.055449","5.9.29.183","172.19.0.3","TCP","56","9002 → 43520 [ACK] Seq=111874 Ack=9688 Win=65535 Len=0"
"4.360043","5.9.29.183","172.19.0.3","TLSv1.2","599","Application Data"
"4.387341","5.9.29.183","172.19.0.3","TCP","1516","[TCP segment of a reassembled PDU]"
"4.387378","5.9.29.183","172.19.0.3","TCP","1516","9002 → 43520 [PSH, ACK] Seq=113877 Ack=9688 Win=65535 Len=1460 [TCP segment of a reassembled PDU]"
"4.387385","5.9.29.183","172.19.0.3","TLSv1.2","763","Application Data"
"4.387459","172.19.0.3","5.9.29.183","TCP","56","43520 → 9002 [ACK] Seq=9688 Ack=116044 Win=11893 Len=0"
"4.414738","5.9.29.183","172.19.0.3","TCP","1516","[TCP segment of a reassembled PDU]"
"4.414785","5.9.29.183","172.19.0.3","TCP","1492","9002 → 43520 [PSH, ACK] Seq=117504 Ack=9688 Win=65535 Len=1436 [TCP segment of a reassembled PDU]"
"4.414800","172.19.0.3","5.9.29.183","TCP","56","43520 → 9002 [ACK] Seq=9688 Ack=118940 Win=11903 Len=0"
"4.414802","5.9.29.183","172.19.0.3","TLSv1.2","1237","Application Data"
"4.425196","5.9.29.183","172.19.0.3","TLSv1.2","1504","Application Data"
"4.425220","172.19.0.3","5.9.29.183","TCP","56","43520 → 9002 [ACK] Seq=9688 Ack=121569 Win=11911 Len=0"
"4.425349","5.9.29.183","172.19.0.3","TCP","1516","9002 → 43520 [PSH, ACK] Seq=121569 Ack=9688 Win=65535 Len=1460 [TCP segment of a reassembled PDU]"
"4.425359","5.9.29.183","172.19.0.3","TLSv1.2","1516","Application Data [TCP segment of a reassembled PDU]"
"4.425395","5.9.29.183","172.19.0.3","TCP","1516","9002 → 43520 [PSH, ACK] Seq=124489 Ack=9688 Win=65535 Len=1460 [TCP segment of a reassembled PDU]"
"4.425426","172.19.0.3","5.9.29.183","TCP","56","43520 → 9002 [ACK] Seq=9688 Ack=125949 Win=11887 Len=0"
"4.425473","5.9.29.183","172.19.0.3","TCP","490","9002 → 43520 [PSH, ACK] Seq=125949 Ack=9688 Win=65535 Len=434 [TCP segment of a reassembled PDU]"
"4.425557","5.9.29.183","172.19.0.3","TCP","1516","9002 → 43520 [PSH, ACK] Seq=126383 Ack=9688 Win=65535 Len=1460 [TCP segment of a reassembled PDU]"
"4.425562","5.9.29.183","172.19.0.3","TLSv1.2","1516","Application Data [TCP segment of a reassembled PDU]"
"4.425571","172.19.0.3","5.9.29.183","TCP","56","43520 → 9002 [ACK] Seq=9688 Ack=127843 Win=11873 Len=0"
"4.425650","5.9.29.183","172.19.0.3","TCP","1010","9002 → 43520 [PSH, ACK] Seq=129303 Ack=9688 Win=65535 Len=954 [TCP segment of a reassembled PDU]"
"4.425733","172.19.0.3","5.9.29.183","TCP","56","43520 → 9002 [ACK] Seq=9688 Ack=130257 Win=11855 Len=0"
"4.430759","5.9.29.183","172.19.0.3","TCP","1516","9002 → 43520 [PSH, ACK] Seq=130257 Ack=9688 Win=65535 Len=1460 [TCP segment of a reassembled PDU]"
"4.430808","5.9.29.183","172.19.0.3","TLSv1.2","1516","Application Data [TCP segment of a reassembled PDU]"
"4.430821","172.19.0.3","5.9.29.183","TCP","56","43520 → 9002 [ACK] Seq=9688 Ack=133177 Win=11903 Len=0"
"4.430831","5.9.29.183","172.19.0.3","TCP","1480","9002 → 43520 [PSH, ACK] Seq=133177 Ack=9688 Win=65535 Len=1424 [TCP segment of a reassembled PDU]"
"4.430835","5.9.29.183","172.19.0.3","TCP","1504","9002 → 43520 [PSH, ACK] Seq=134601 Ack=9688 Win=65535 Len=1448 [TCP segment of a reassembled PDU]"
"4.430915","172.19.0.3","5.9.29.183","TCP","56","43520 → 9002 [ACK] Seq=9688 Ack=136049 Win=11887 Len=0"
"4.436777","5.9.29.183","172.19.0.3","TLSv1.2","814","Application Data, Application Data"
"4.440675","5.9.29.183","172.19.0.3","TCP","1516","[TCP segment of a reassembled PDU]"
"4.440684","172.19.0.3","5.9.29.183","TCP","56","43520 → 9002 [ACK] Seq=9688 Ack=138267 Win=11911 Len=0"
"4.440788","5.9.29.183","172.19.0.3","TCP","1492","9002 → 43520 [PSH, ACK] Seq=138267 Ack=9688 Win=65535 Len=1436 [TCP segment of a reassembled PDU]"
"4.440792","5.9.29.183","172.19.0.3","TLSv1.2","1504","Application Data [TCP segment of a reassembled PDU]"
"4.440830","172.19.0.3","5.9.29.183","TCP","56","43520 → 9002 [ACK] Seq=9688 Ack=141151 Win=11901 Len=0"
"4.440981","172.19.0.3","5.9.29.183","TLSv1.2","599","Application Data"
"4.441153","5.9.29.183","172.19.0.3","TCP","56","9002 → 43520 [ACK] Seq=141151 Ack=10231 Win=65535 Len=0"
"4.453580","5.9.29.183","172.19.0.3","TLSv1.2","1424","Application Data"
"4.463347","5.9.29.183","172.19.0.3","TCP","1516","[TCP segment of a reassembled PDU]"
"4.463365","172.19.0.3","5.9.29.183","TCP","56","43520 → 9002 [ACK] Seq=10231 Ack=143979 Win=11911 Len=0"
"4.463399","5.9.29.183","172.19.0.3","TCP","1516","9002 → 43520 [PSH, ACK] Seq=143979 Ack=10231 Win=65535 Len=1460 [TCP segment of a reassembled PDU]"
"4.463428","5.9.29.183","172.19.0.3","TLSv1.2","1480","Application Data [TCP segment of a reassembled PDU]"
"4.463434","5.9.29.183","172.19.0.3","TLSv1.2","1516","Application Data [TCP segment of a reassembled PDU]"
"4.463487","5.9.29.183","172.19.0.3","TCP","1516","9002 → 43520 [PSH, ACK] Seq=148323 Ack=10231 Win=65535 Len=1460 [TCP segment of a reassembled PDU]"
"4.463491","5.9.29.183","172.19.0.3","TCP","1480","9002 → 43520 [PSH, ACK] Seq=149783 Ack=10231 Win=65535 Len=1424 [TCP segment of a reassembled PDU]"
"4.463533","172.19.0.3","5.9.29.183","TCP","56","43520 → 9002 [ACK] Seq=10231 Ack=151207 Win=11871 Len=0"
"4.463814","172.19.0.3","5.9.29.183","TLSv1.2","599","Application Data"
"4.464009","5.9.29.183","172.19.0.3","TCP","56","9002 → 43520 [ACK] Seq=151207 Ack=10774 Win=65535 Len=0"
"4.468356","5.9.29.183","172.19.0.3","TLSv1.2","1516","Application Data, Application Data"
"4.468403","5.9.29.183","172.19.0.3","TCP","1492","9002 → 43520 [PSH, ACK] Seq=152667 Ack=10774 Win=65535 Len=1436 [TCP segment of a reassembled PDU]"
"4.468418","172.19.0.3","5.9.29.183","TCP","56","43520 → 9002 [ACK] Seq=10774 Ack=154103 Win=11903 Len=0"
"4.470035","5.9.29.183","172.19.0.3","TLSv1.2","439","Application Data"
"4.479177","5.9.29.183","172.19.0.3","TCP","1504","[TCP segment of a reassembled PDU]"
"4.479195","172.19.0.3","5.9.29.183","TCP","56","43520 → 9002 [ACK] Seq=10774 Ack=155934 Win=11911 Len=0"
"4.479255","5.9.29.183","172.19.0.3","TCP","1516","9002 → 43520 [PSH, ACK] Seq=155934 Ack=10774 Win=65535 Len=1460 [TCP segment of a reassembled PDU]"
"4.479263","5.9.29.183","172.19.0.3","TLSv1.2","1492","Application Data [TCP segment of a reassembled PDU]"
"4.479313","5.9.29.183","172.19.0.3","TCP","1516","9002 → 43520 [PSH, ACK] Seq=158830 Ack=10774 Win=65535 Len=1460 [TCP segment of a reassembled PDU]"
"4.479317","5.9.29.183","172.19.0.3","TCP","1492","9002 → 43520 [PSH, ACK] Seq=160290 Ack=10774 Win=65535 Len=1436 [TCP segment of a reassembled PDU]"
"4.479362","172.19.0.3","5.9.29.183","TCP","56","43520 → 9002 [ACK] Seq=10774 Ack=161726 Win=11879 Len=0"
"4.484921","5.9.29.183","172.19.0.3","TLSv1.2","584","Application Data"
"4.494902","5.9.29.183","172.19.0.3","TCP","1516","[TCP segment of a reassembled PDU]"
"4.494919","172.19.0.3","5.9.29.183","TCP","56","43520 → 9002 [ACK] Seq=10774 Ack=163714 Win=11911 Len=0"
"4.494954","5.9.29.183","172.19.0.3","TCP","1492","9002 → 43520 [PSH, ACK] Seq=163714 Ack=10774 Win=65535 Len=1436 [TCP segment of a reassembled PDU]"
"4.494982","5.9.29.183","172.19.0.3","TLSv1.2","1504","Application Data [TCP segment of a reassembled PDU]"
"4.495102","172.19.0.3","5.9.29.183","TCP","56","43520 → 9002 [ACK] Seq=10774 Ack=166598 Win=11893 Len=0"
"4.495348","172.19.0.3","5.9.29.183","TLSv1.2","599","Application Data"
"4.495590","5.9.29.183","172.19.0.3","TCP","56","9002 → 43520 [ACK] Seq=166598 Ack=11317 Win=65535 Len=0"
"4.503128","5.9.29.183","172.19.0.3","TLSv1.2","910","Application Data"
"4.508934","5.9.29.183","172.19.0.3","TCP","1504","[TCP segment of a reassembled PDU]"
"4.508952","172.19.0.3","5.9.29.183","TCP","56","43520 → 9002 [ACK] Seq=11317 Ack=168900 Win=11911 Len=0"
"4.508987","5.9.29.183","172.19.0.3","TCP","1504","9002 → 43520 [PSH, ACK] Seq=168900 Ack=11317 Win=65535 Len=1448 [TCP segment of a reassembled PDU]"
"4.509131","5.9.29.183","172.19.0.3","TLSv1.2","1516","Application Data [TCP segment of a reassembled PDU]"
"4.509165","172.19.0.3","5.9.29.183","TCP","56","43520 → 9002 [ACK] Seq=11317 Ack=171808 Win=11911 Len=0"
"4.509192","5.9.29.183","172.19.0.3","TCP","1516","9002 → 43520 [PSH, ACK] Seq=171808 Ack=11317 Win=65535 Len=1460 [TCP segment of a reassembled PDU]"
"4.509234","5.9.29.183","172.19.0.3","TCP","1480","9002 → 43520 [PSH, ACK] Seq=173268 Ack=11317 Win=65535 Len=1424 [TCP segment of a reassembled PDU]"
"4.509249","172.19.0.3","5.9.29.183","TCP","56","43520 → 9002 [ACK] Seq=11317 Ack=174692 Win=11895 Len=0"
"4.519656","5.9.29.183","172.19.0.3","TLSv1.2","584","Application Data"
"4.525065","5.9.29.183","172.19.0.3","TCP","1516","[TCP segment of a reassembled PDU]"
"4.525084","172.19.0.3","5.9.29.183","TCP","56","43520 → 9002 [ACK] Seq=11317 Ack=176680 Win=11911 Len=0"
"4.525119","5.9.29.183","172.19.0.3","TCP","1516","9002 → 43520 [PSH, ACK] Seq=176680 Ack=11317 Win=65535 Len=1460 [TCP segment of a reassembled PDU]"
"4.525127","5.9.29.183","172.19.0.3","TLSv1.2","1516","Application Data [TCP segment of a reassembled PDU]"
"4.525129","5.9.29.183","172.19.0.3","TCP","1516","9002 → 43520 [PSH, ACK] Seq=179600 Ack=11317 Win=65535 Len=1460 [TCP segment of a reassembled PDU]"
"4.525131","5.9.29.183","172.19.0.3","TCP","1456","9002 → 43520 [PSH, ACK] Seq=181060 Ack=11317 Win=65535 Len=1400 [TCP segment of a reassembled PDU]"
"4.525236","172.19.0.3","5.9.29.183","TCP","56","43520 → 9002 [ACK] Seq=11317 Ack=182460 Win=11879 Len=0"
"4.534412","5.9.29.183","172.19.0.3","TLSv1.2","70","Application Data"
"4.552376","5.9.29.183","172.19.0.3","TCP","1504","[TCP segment of a reassembled PDU]"
"4.552393","172.19.0.3","5.9.29.183","TCP","56","43520 → 9002 [ACK] Seq=11317 Ack=183922 Win=11911 Len=0"
"4.552427","5.9.29.183","172.19.0.3","TCP","1516","9002 → 43520 [PSH, ACK] Seq=183922 Ack=11317 Win=65535 Len=1460 [TCP segment of a reassembled PDU]"
"4.552435","5.9.29.183","172.19.0.3","TLSv1.2","1225","Application Data"
"4.552437","5.9.29.183","172.19.0.3","TCP","1504","[TCP segment of a reassembled PDU]"
"4.552565","172.19.0.3","5.9.29.183","TCP","56","43520 → 9002 [ACK] Seq=11317 Ack=187999 Win=11887 Len=0"
"4.567566","5.9.29.183","172.19.0.3","TLSv1.2","1271","Application Data"
"4.571459","172.19.0.3","5.9.29.183","TLSv1.2","599","Application Data"
"4.571762","5.9.29.183","172.19.0.3","TCP","56","9002 → 43520 [ACK] Seq=189214 Ack=11860 Win=65535 Len=0"
"4.996985","5.9.29.183","172.19.0.3","TLSv1.2","599","Application Data"
"4.997571","172.19.0.3","5.9.29.183","TLSv1.2","599","Application Data"
"4.997777","5.9.29.183","172.19.0.3","TCP","56","9002 → 43520 [ACK] Seq=189757 Ack=12403 Win=65535 Len=0"
"5.343214","5.9.29.183","172.19.0.3","TCP","1516","[TCP segment of a reassembled PDU]"
"5.343283","5.9.29.183","172.19.0.3","TCP","758","9002 → 43520 [PSH, ACK] Seq=191217 Ack=12403 Win=65535 Len=702 [TCP segment of a reassembled PDU]"
"5.343292","5.9.29.183","172.19.0.3","TCP","1516","9002 → 43520 [PSH, ACK] Seq=191919 Ack=12403 Win=65535 Len=1460 [TCP segment of a reassembled PDU]"
"5.343295","5.9.29.183","172.19.0.3","TLSv1.2","61","Application Data"
"5.343395","172.19.0.3","5.9.29.183","TCP","56","43520 → 9002 [ACK] Seq=12403 Ack=193384 Win=11893 Len=0"
"5.369458","5.9.29.183","172.19.0.3","TCP","1504","[TCP segment of a reassembled PDU]"
"5.369506","5.9.29.183","172.19.0.3","TCP","1516","9002 → 43520 [PSH, ACK] Seq=194832 Ack=12403 Win=65535 Len=1460 [TCP segment of a reassembled PDU]"
"5.369518","172.19.0.3","5.9.29.183","TCP","56","43520 → 9002 [ACK] Seq=12403 Ack=196292 Win=11903 Len=0"
"5.369521","5.9.29.183","172.19.0.3","TLSv1.2","775","Application Data"
"5.388747","5.9.29.183","172.19.0.3","TLSv1.2","599","Application Data"
"5.388941","172.19.0.3","5.9.29.183","TCP","56","43520 → 9002 [ACK] Seq=12403 Ack=197554 Win=11911 Len=0"
"5.398824","5.9.29.183","172.19.0.3","TCP","1516","[TCP segment of a reassembled PDU]"
"5.398895","5.9.29.183","172.19.0.3","TCP","1516","9002 → 43520 [PSH, ACK] Seq=199014 Ack=12403 Win=65535 Len=1460 [TCP segment of a reassembled PDU]"
"5.398901","5.9.29.183","172.19.0.3","TLSv1.2","1516","Application Data [TCP segment of a reassembled PDU]"
"5.398903","5.9.29.183","172.19.0.3","TCP","1516","9002 → 43520 [PSH, ACK] Seq=201934 Ack=12403 Win=65535 Len=1460 [TCP segment of a reassembled PDU]"
"5.398907","5.9.29.183","172.19.0.3","TCP","1516","9002 → 43520 [PSH, ACK] Seq=203394 Ack=12403 Win=65535 Len=1460 [TCP segment of a reassembled PDU]"
"5.398909","5.9.29.183","172.19.0.3","TLSv1.2","1444","Application Data [TCP segment of a reassembled PDU]"
"5.398921","5.9.29.183","172.19.0.3","TCP","1504","9002 → 43520 [PSH, ACK] Seq=206242 Ack=12403 Win=65535 Len=1448 [TCP segment of a reassembled PDU]"
"5.399010","172.19.0.3","5.9.29.183","TCP","56","43520 → 9002 [ACK] Seq=12403 Ack=207690 Win=11861 Len=0"
"5.399306","172.19.0.3","5.9.29.183","TLSv1.2","599","Application Data"
"5.399450","5.9.29.183","172.19.0.3","TCP","56","9002 → 43520 [ACK] Seq=207690 Ack=12946 Win=65535 Len=0"
"5.408333","5.9.29.183","172.19.0.3","TLSv1.2","1315","Application Data"
"5.447796","5.9.29.183","172.19.0.3","TCP","1504","[TCP segment of a reassembled PDU]"
"5.447813","172.19.0.3","5.9.29.183","TCP","56","43520 → 9002 [ACK] Seq=12946 Ack=210397 Win=11911 Len=0"
"5.447848","5.9.29.183","172.19.0.3","TCP","1516","9002 → 43520 [PSH, ACK] Seq=210397 Ack=12946 Win=65535 Len=1460 [TCP segment of a reassembled PDU]"
"5.447880","5.9.29.183","172.19.0.3","TLSv1.2","775","Application Data"
"5.447991","172.19.0.3","5.9.29.183","TCP","56","43520 → 9002 [ACK] Seq=12946 Ack=212576 Win=11895 Len=0"
"5.451165","172.19.0.3","5.9.29.183","TLSv1.2","599","Application Data"
"5.451349","5.9.29.183","172.19.0.3","TCP","56","9002 → 43520 [ACK] Seq=212576 Ack=13489 Win=65535 Len=0"
"5.800722","5.9.29.183","172.19.0.3","TLSv1.2","599","Application Data"
"5.801329","172.19.0.3","5.9.29.183","TLSv1.2","599","Application Data"
"5.801524","5.9.29.183","172.19.0.3","TCP","56","9002 → 43520 [ACK] Seq=213119 Ack=14032 Win=65535 Len=0"
"6.150893","5.9.29.183","172.19.0.3","TLSv1.2","599","Application Data"
"6.174543","5.9.29.183","172.19.0.3","TCP","1516","[TCP segment of a reassembled PDU]"
"6.174571","172.19.0.3","5.9.29.183","TCP","56","43520 → 9002 [ACK] Seq=14032 Ack=215122 Win=11911 Len=0"
"6.174664","5.9.29.183","172.19.0.3","TCP","1492","9002 → 43520 [PSH, ACK] Seq=215122 Ack=14032 Win=65535 Len=1436 [TCP segment of a reassembled PDU]"
"6.174683","5.9.29.183","172.19.0.3","TLSv1.2","787","Application Data"
"6.174861","172.19.0.3","5.9.29.183","TCP","56","43520 → 9002 [ACK] Seq=14032 Ack=217289 Win=11895 Len=0"
"6.213053","5.9.29.183","172.19.0.3","TCP","1504","[TCP segment of a reassembled PDU]"
"6.213099","5.9.29.183","172.19.0.3","TCP","1516","9002 → 43520 [PSH, ACK] Seq=218737 Ack=14032 Win=65535 Len=1460 [TCP segment of a reassembled PDU]"
"6.213111","172.19.0.3","5.9.29.183","TCP","56","43520 → 9002 [ACK] Seq=14032 Ack=220197 Win=11903 Len=0"
"6.213113","5.9.29.183","172.19.0.3","TLSv1.2","775","Application Data"
"6.222966","5.9.29.183","172.19.0.3","TCP","1504","[TCP segment of a reassembled PDU]"
"6.222985","172.19.0.3","5.9.29.183","TCP","56","43520 → 9002 [ACK] Seq=14032 Ack=222364 Win=11911 Len=0"
"6.223032","5.9.29.183","172.19.0.3","TCP","1504","9002 → 43520 [PSH, ACK] Seq=222364 Ack=14032 Win=65535 Len=1448 [TCP segment of a reassembled PDU]"
"6.232403","5.9.29.183","172.19.0.3","TLSv1.2","787","Application Data"
"6.232422","172.19.0.3","5.9.29.183","TCP","56","43520 → 9002 [ACK] Seq=14032 Ack=224543 Win=11911 Len=0"
"6.245417","5.9.29.183","172.19.0.3","TCP","1516","[TCP segment of a reassembled PDU]"
"6.245469","5.9.29.183","172.19.0.3","TCP","1516","9002 → 43520 [PSH, ACK] Seq=226003 Ack=14032 Win=65535 Len=1460 [TCP segment of a reassembled PDU]"
"6.245478","5.9.29.183","172.19.0.3","TLSv1.2","1516","Application Data [TCP segment of a reassembled PDU]"
"6.245483","5.9.29.183","172.19.0.3","TCP","1516","9002 → 43520 [PSH, ACK] Seq=228923 Ack=14032 Win=65535 Len=1460 [TCP segment of a reassembled PDU]"
"6.245490","5.9.29.183","172.19.0.3","TCP","1456","9002 → 43520 [PSH, ACK] Seq=230383 Ack=14032 Win=65535 Len=1400 [TCP segment of a reassembled PDU]"
"6.245608","5.9.29.183","172.19.0.3","TLSv1.2","1516","Application Data [TCP segment of a reassembled PDU]"
"6.245612","5.9.29.183","172.19.0.3","TCP","1492","9002 → 43520 [PSH, ACK] Seq=233243 Ack=14032 Win=65535 Len=1436 [TCP segment of a reassembled PDU]"
"6.245621","172.19.0.3","5.9.29.183","TCP","56","43520 → 9002 [ACK] Seq=14032 Ack=231783 Win=11877 Len=0"
"6.245684","172.19.0.3","5.9.29.183","TCP","56","43520 → 9002 [ACK] Seq=14032 Ack=234679 Win=11861 Len=0"
"6.247133","5.9.29.183","172.19.0.3","TCP","1504","9002 → 43520 [PSH, ACK] Seq=234679 Ack=14032 Win=65535 Len=1448 [TCP segment of a reassembled PDU]"
"6.247231","5.9.29.183","172.19.0.3","TLSv1.2","1504","Application Data [TCP segment of a reassembled PDU]"
"6.247238","172.19.0.3","5.9.29.183","TCP","56","43520 → 9002 [ACK] Seq=14032 Ack=237575 Win=11911 Len=0"
"6.247240","5.9.29.183","172.19.0.3","TCP","1504","9002 → 43520 [PSH, ACK] Seq=237575 Ack=14032 Win=65535 Len=1448 [TCP segment of a reassembled PDU]"
"6.247391","5.9.29.183","172.19.0.3","TLSv1.2","1112","Application Data"
"6.247396","172.19.0.3","5.9.29.183","TCP","56","43520 → 9002 [ACK] Seq=14032 Ack=240079 Win=11911 Len=0"
"6.247583","172.19.0.3","5.9.29.183","TLSv1.2","599","Application Data"
"6.247729","5.9.29.183","172.19.0.3","TCP","56","9002 → 43520 [ACK] Seq=240079 Ack=14575 Win=65535 Len=0"
"6.265681","5.9.29.183","172.19.0.3","TLSv1.2","1113","Application Data"
"6.279858","5.9.29.183","172.19.0.3","TCP","1516","[TCP segment of a reassembled PDU]"
"6.279876","172.19.0.3","5.9.29.183","TCP","56","43520 → 9002 [ACK] Seq=14575 Ack=242596 Win=11911 Len=0"
"6.279935","5.9.29.183","172.19.0.3","TCP","1516","9002 → 43520 [PSH, ACK] Seq=242596 Ack=14575 Win=65535 Len=1460 [TCP segment of a reassembled PDU]"
"6.279971","5.9.29.183","172.19.0.3","TLSv1.2","1516","Application Data [TCP segment of a reassembled PDU]"
"6.279978","5.9.29.183","172.19.0.3","TCP","1468","9002 → 43520 [PSH, ACK] Seq=245516 Ack=14575 Win=65535 Len=1412 [TCP segment of a reassembled PDU]"
"6.280077","172.19.0.3","5.9.29.183","TCP","56","43520 → 9002 [ACK] Seq=14575 Ack=246928 Win=11887 Len=0"
"6.280088","5.9.29.183","172.19.0.3","TCP","1516","9002 → 43520 [PSH, ACK] Seq=246928 Ack=14575 Win=65535 Len=1460 [TCP segment of a reassembled PDU]"
"6.280090","5.9.29.183","172.19.0.3","TLSv1.2","1516","Application Data [TCP segment of a reassembled PDU]"
"6.280092","5.9.29.183","172.19.0.3","TCP","1516","9002 → 43520 [PSH, ACK] Seq=249848 Ack=14575 Win=65535 Len=1460 [TCP segment of a reassembled PDU]"
"6.280093","5.9.29.183","172.19.0.3","TCP","1516","9002 → 43520 [PSH, ACK] Seq=251308 Ack=14575 Win=65535 Len=1460 [TCP segment of a reassembled PDU]"
"6.280094","5.9.29.183","172.19.0.3","TLSv1.2","1516","Application Data [TCP segment of a reassembled PDU]"
"6.280095","5.9.29.183","172.19.0.3","TCP","1516","9002 → 43520 [PSH, ACK] Seq=254228 Ack=14575 Win=65535 Len=1460 [TCP segment of a reassembled PDU]"
"6.280096","5.9.29.183","172.19.0.3","TCP","1432","9002 → 43520 [PSH, ACK] Seq=255688 Ack=14575 Win=65535 Len=1376 [TCP segment of a reassembled PDU]"
"6.280131","172.19.0.3","5.9.29.183","TCP","56","43520 → 9002 [ACK] Seq=14575 Ack=257064 Win=11830 Len=0"
"6.280566","172.19.0.3","5.9.29.183","TLSv1.2","599","Application Data"
"6.280737","5.9.29.183","172.19.0.3","TCP","56","9002 → 43520 [ACK] Seq=257064 Ack=15118 Win=65535 Len=0"
"6.286063","5.9.29.183","172.19.0.3","TLSv1.2","447","Application Data [TCP segment of a reassembled PDU]"
"6.286123","5.9.29.183","172.19.0.3","TLSv1.2","1516","Application Data [TCP segment of a reassembled PDU]"
"6.286135","172.19.0.3","5.9.29.183","TCP","56","43520 → 9002 [ACK] Seq=15118 Ack=258915 Win=11901 Len=0"
"6.286137","5.9.29.183","172.19.0.3","TCP","1516","9002 → 43520 [PSH, ACK] Seq=258915 Ack=15118 Win=65535 Len=1460 [TCP segment of a reassembled PDU]"
"6.286140","5.9.29.183","172.19.0.3","TLSv1.2","1516","Application Data [TCP segment of a reassembled PDU]"
"6.286142","5.9.29.183","172.19.0.3","TCP","294","9002 → 43520 [PSH, ACK] Seq=261835 Ack=15118 Win=65535 Len=238 [TCP segment of a reassembled PDU]"
"6.286233","172.19.0.3","5.9.29.183","TCP","56","43520 → 9002 [ACK] Seq=15118 Ack=262073 Win=11877 Len=0"
"6.295620","5.9.29.183","172.19.0.3","TLSv1.2","1504","Application Data [TCP segment of a reassembled PDU]"
"6.295667","5.9.29.183","172.19.0.3","TCP","1504","9002 → 43520 [PSH, ACK] Seq=263521 Ack=15118 Win=65535 Len=1448 [TCP segment of a reassembled PDU]"
"6.295679","172.19.0.3","5.9.29.183","TCP","56","43520 → 9002 [ACK] Seq=15118 Ack=264969 Win=11903 Len=0"
"6.301577","5.9.29.183","172.19.0.3","TLSv1.2","613","Application Data"
"6.301979","172.19.0.3","5.9.29.183","TLSv1.2","599","Application Data"
"6.302245","5.9.29.183","172.19.0.3","TCP","56","9002 → 43520 [ACK] Seq=265526 Ack=15661 Win=65535 Len=0"
"6.354415","5.9.29.183","172.19.0.3","TCP","1516","[TCP segment of a reassembled PDU]"
"6.354551","5.9.29.183","172.19.0.3","TCP","1516","9002 → 43520 [PSH, ACK] Seq=266986 Ack=15661 Win=65535 Len=1460 [TCP segment of a reassembled PDU]"
"6.354597","5.9.29.183","172.19.0.3","TLSv1.2","249","Application Data"
"6.354686","172.19.0.3","5.9.29.183","TCP","56","43520 → 9002 [ACK] Seq=15661 Ack=268639 Win=11895 Len=0"
"6.358779","172.19.0.3","5.9.29.183","TLSv1.2","599","Application Data"
"6.358994","5.9.29.183","172.19.0.3","TCP","56","9002 → 43520 [ACK] Seq=268639 Ack=16204 Win=65535 Len=0"
"6.758077","5.9.29.183","172.19.0.3","TLSv1.2","599","Application Data"
"6.758712","172.19.0.3","5.9.29.183","TLSv1.2","599","Application Data"
"6.758996","5.9.29.183","172.19.0.3","TCP","56","9002 → 43520 [ACK] Seq=269182 Ack=16747 Win=65535 Len=0"
"7.069890","5.9.29.183","172.19.0.3","TCP","1516","[TCP segment of a reassembled PDU]"
"7.070122","5.9.29.183","172.19.0.3","TCP","1492","9002 → 43520 [PSH, ACK] Seq=270642 Ack=16747 Win=65535 Len=1436 [TCP segment of a reassembled PDU]"
"7.070157","172.19.0.3","5.9.29.183","TCP","56","43520 → 9002 [ACK] Seq=16747 Ack=272078 Win=11911 Len=0"
"7.070203","5.9.29.183","172.19.0.3","TLSv1.2","787","Application Data"
"7.082871","5.9.29.183","172.19.0.3","TCP","1504","[TCP segment of a reassembled PDU]"
"7.082896","172.19.0.3","5.9.29.183","TCP","56","43520 → 9002 [ACK] Seq=16747 Ack=274257 Win=11911 Len=0"
"7.082949","5.9.29.183","172.19.0.3","TCP","1516","9002 → 43520 [PSH, ACK] Seq=274257 Ack=16747 Win=65535 Len=1460 [TCP segment of a reassembled PDU]"
"7.082960","5.9.29.183","172.19.0.3","TLSv1.2","1492","Application Data [TCP segment of a reassembled PDU]"
"7.083107","172.19.0.3","5.9.29.183","TCP","56","43520 → 9002 [ACK] Seq=16747 Ack=277153 Win=11895 Len=0"
"7.085038","5.9.29.183","172.19.0.3","TLSv1.2","396","Application Data"
"7.104134","5.9.29.183","172.19.0.3","TCP","1516","[TCP segment of a reassembled PDU]"
"7.104154","172.19.0.3","5.9.29.183","TCP","56","43520 → 9002 [ACK] Seq=16747 Ack=278953 Win=11911 Len=0"
"7.104196","5.9.29.183","172.19.0.3","TCP","1492","9002 → 43520 [PSH, ACK] Seq=278953 Ack=16747 Win=65535 Len=1436 [TCP segment of a reassembled PDU]"
"7.104205","5.9.29.183","172.19.0.3","TLSv1.2","787","Application Data"
"7.104332","172.19.0.3","5.9.29.183","TCP","56","43520 → 9002 [ACK] Seq=16747 Ack=281120 Win=11895 Len=0"
"7.120854","5.9.29.183","172.19.0.3","TCP","1516","[TCP segment of a reassembled PDU]"
"7.120902","5.9.29.183","172.19.0.3","TCP","1492","9002 → 43520 [PSH, ACK] Seq=282580 Ack=16747 Win=65535 Len=1436 [TCP segment of a reassembled PDU]"
"7.120914","172.19.0.3","5.9.29.183","TCP","56","43520 → 9002 [ACK] Seq=16747 Ack=284016 Win=11903 Len=0"
"7.120916","5.9.29.183","172.19.0.3","TLSv1.2","787","Application Data"
"7.139133","5.9.29.183","172.19.0.3","TLSv1.2","599","Application Data"
"7.139323","172.19.0.3","5.9.29.183","TCP","56","43520 → 9002 [ACK] Seq=16747 Ack=285290 Win=11911 Len=0"
"7.167850","5.9.29.183","172.19.0.3","TCP","1504","[TCP segment of a reassembled PDU]"
"7.167894","5.9.29.183","172.19.0.3","TLSv1.2","1207","Application Data"
"7.168019","172.19.0.3","5.9.29.183","TCP","56","43520 → 9002 [ACK] Seq=16747 Ack=287889 Win=11903 Len=0"
"7.171088","172.19.0.3","5.9.29.183","TLSv1.2","599","Application Data"
"7.171285","5.9.29.183","172.19.0.3","TCP","56","9002 → 43520 [ACK] Seq=287889 Ack=17290 Win=65535 Len=0"
"7.453338","5.9.29.183","172.19.0.3","TLSv1.2","599","Application Data"
"7.454009","172.19.0.3","5.9.29.183","TLSv1.2","599","Application Data"
"7.454222","5.9.29.183","172.19.0.3","TCP","56","9002 → 43520 [ACK] Seq=288432 Ack=17833 Win=65535 Len=0"
"7.781266","5.9.29.183","172.19.0.3","TLSv1.2","599","Application Data"
"7.813101","5.9.29.183","172.19.0.3","TCP","1516","[TCP segment of a reassembled PDU]"
"7.813120","172.19.0.3","5.9.29.183","TCP","56","43520 → 9002 [ACK] Seq=17833 Ack=290435 Win=11911 Len=0"
"7.813160","5.9.29.183","172.19.0.3","TCP","1492","9002 → 43520 [PSH, ACK] Seq=290435 Ack=17833 Win=65535 Len=1436 [TCP segment of a reassembled PDU]"
"7.813170","5.9.29.183","172.19.0.3","TLSv1.2","787","Application Data"
"7.813296","172.19.0.3","5.9.29.183","TCP","56","43520 → 9002 [ACK] Seq=17833 Ack=292602 Win=11895 Len=0"
"7.868723","5.9.29.183","172.19.0.3","TCP","1516","[TCP segment of a reassembled PDU]"
"7.868762","5.9.29.183","172.19.0.3","TCP","1492","9002 → 43520 [PSH, ACK] Seq=294062 Ack=17833 Win=65535 Len=1436 [TCP segment of a reassembled PDU]"
"7.868777","172.19.0.3","5.9.29.183","TCP","56","43520 → 9002 [ACK] Seq=17833 Ack=295498 Win=11903 Len=0"
"7.868887","5.9.29.183","172.19.0.3","TLSv1.2","787","Application Data"
"7.880354","5.9.29.183","172.19.0.3","TCP","1504","[TCP segment of a reassembled PDU]"
"7.880373","172.19.0.3","5.9.29.183","TCP","56","43520 → 9002 [ACK] Seq=17833 Ack=297677 Win=11911 Len=0"
"7.894344","5.9.29.183","172.19.0.3","TLSv1.2","179","Application Data"
"7.898835","172.19.0.3","5.9.29.183","TLSv1.2","599","Application Data"
"7.899132","5.9.29.183","172.19.0.3","TCP","56","9002 → 43520 [ACK] Seq=297800 Ack=18376 Win=65535 Len=0"
"8.212162","5.9.29.183","172.19.0.3","TLSv1.2","599","Application Data"
"8.212720","172.19.0.3","5.9.29.183","TLSv1.2","599","Application Data"
"8.212926","5.9.29.183","172.19.0.3","TCP","56","9002 → 43520 [ACK] Seq=298343 Ack=18919 Win=65535 Len=0"
"8.597277","5.9.29.183","172.19.0.3","TLSv1.2","599","Application Data"
"8.611981","5.9.29.183","172.19.0.3","TCP","1504","[TCP segment of a reassembled PDU]"
"8.612010","172.19.0.3","5.9.29.183","TCP","56","43520 → 9002 [ACK] Seq=18919 Ack=300334 Win=11911 Len=0"
"8.612073","5.9.29.183","172.19.0.3","TCP","1504","9002 → 43520 [PSH, ACK] Seq=300334 Ack=18919 Win=65535 Len=1448 [TCP segment of a reassembled PDU]"
"8.616701","5.9.29.183","172.19.0.3","TLSv1.2","787","Application Data"
"8.616719","172.19.0.3","5.9.29.183","TCP","56","43520 → 9002 [ACK] Seq=18919 Ack=302513 Win=11911 Len=0"
"8.622077","5.9.29.183","172.19.0.3","TCP","1516","[TCP segment of a reassembled PDU]"
"8.622125","5.9.29.183","172.19.0.3","TCP","1492","9002 → 43520 [PSH, ACK] Seq=303973 Ack=18919 Win=65535 Len=1436 [TCP segment of a reassembled PDU]"
"8.622255","172.19.0.3","5.9.29.183","TCP","56","43520 → 9002 [ACK] Seq=18919 Ack=305409 Win=11903 Len=0"
"8.632985","5.9.29.183","172.19.0.3","TLSv1.2","1516","Application Data, Application Data"
"8.633035","5.9.29.183","172.19.0.3","TCP","1516","9002 → 43520 [PSH, ACK] Seq=306869 Ack=18919 Win=65535 Len=1460 [TCP segment of a reassembled PDU]"
"8.633047","172.19.0.3","5.9.29.183","TCP","56","43520 → 9002 [ACK] Seq=18919 Ack=308329 Win=11903 Len=0"
"8.633049","5.9.29.183","172.19.0.3","TCP","1306","9002 → 43520 [PSH, ACK] Seq=308329 Ack=18919 Win=65535 Len=1250 [TCP segment of a reassembled PDU]"
"8.649109","5.9.29.183","172.19.0.3","TLSv1.2","787","Application Data"
"8.649126","172.19.0.3","5.9.29.183","TCP","56","43520 → 9002 [ACK] Seq=18919 Ack=310310 Win=11911 Len=0"
"8.649435","172.19.0.3","5.9.29.183","TLSv1.2","599","Application Data"
"8.649620","5.9.29.183","172.19.0.3","TCP","56","9002 → 43520 [ACK] Seq=310310 Ack=19462 Win=65535 Len=0"
"8.657520","5.9.29.183","172.19.0.3","TCP","1516","[TCP segment of a reassembled PDU]"
"8.657565","5.9.29.183","172.19.0.3","TCP","1492","9002 → 43520 [PSH, ACK] Seq=311770 Ack=19462 Win=65535 Len=1436 [TCP segment of a reassembled PDU]"
"8.657696","172.19.0.3","5.9.29.183","TCP","56","43520 → 9002 [ACK] Seq=19462 Ack=313206 Win=11903 Len=0"
"8.665412","5.9.29.183","172.19.0.3","TLSv1.2","787","Application Data"
"8.686441","5.9.29.183","172.19.0.3","TLSv1.2","1113","Application Data"
"8.686469","172.19.0.3","5.9.29.183","TCP","56","43520 → 9002 [ACK] Seq=19462 Ack=314994 Win=11909 Len=0"
"8.689419","172.19.0.3","5.9.29.183","TLSv1.2","599","Application Data"
"8.689774","5.9.29.183","172.19.0.3","TCP","56","9002 → 43520 [ACK] Seq=314994 Ack=20005 Win=65535 Len=0"
"9.095453","5.9.29.183","172.19.0.3","TLSv1.2","599","Application Data"
"9.096024","172.19.0.3","5.9.29.183","TLSv1.2","599","Application Data"
"9.096247","5.9.29.183","172.19.0.3","TCP","56","9002 → 43520 [ACK] Seq=315537 Ack=20548 Win=65535 Len=0"
"9.408077","5.9.29.183","172.19.0.3","TLSv1.2","599","Application Data"
"9.422095","5.9.29.183","172.19.0.3","TCP","1516","[TCP segment of a reassembled PDU]"
"9.422113","172.19.0.3","5.9.29.183","TCP","56","43520 → 9002 [ACK] Seq=20548 Ack=317540 Win=11911 Len=0"
"9.422146","5.9.29.183","172.19.0.3","TCP","1492","9002 → 43520 [PSH, ACK] Seq=317540 Ack=20548 Win=65535 Len=1436 [TCP segment of a reassembled PDU]"
"9.426442","5.9.29.183","172.19.0.3","TLSv1.2","787","Application Data"
"9.426459","172.19.0.3","5.9.29.183","TCP","56","43520 → 9002 [ACK] Seq=20548 Ack=319707 Win=11911 Len=0"
"9.450768","5.9.29.183","172.19.0.3","TCP","1516","[TCP segment of a reassembled PDU]"
"9.450818","5.9.29.183","172.19.0.3","TCP","1516","9002 → 43520 [PSH, ACK] Seq=321167 Ack=20548 Win=65535 Len=1460 [TCP segment of a reassembled PDU]"
"9.450824","5.9.29.183","172.19.0.3","TCP","420","9002 → 43520 [PSH, ACK] Seq=322627 Ack=20548 Win=65535 Len=364 [TCP segment of a reassembled PDU]"
"9.450827","5.9.29.183","172.19.0.3","TLSv1.2","399","Application Data"
"9.450941","172.19.0.3","5.9.29.183","TCP","56","43520 → 9002 [ACK] Seq=20548 Ack=323334 Win=11885 Len=0"
"9.475578","5.9.29.183","172.19.0.3","TCP","1516","[TCP segment of a reassembled PDU]"
"9.475618","5.9.29.183","172.19.0.3","TCP","1492","9002 → 43520 [PSH, ACK] Seq=324794 Ack=20548 Win=65535 Len=1436 [TCP segment of a reassembled PDU]"
"9.475630","172.19.0.3","5.9.29.183","TCP","56","43520 → 9002 [ACK] Seq=20548 Ack=326230 Win=11903 Len=0"
"9.475673","5.9.29.183","172.19.0.3","TLSv1.2","1330","Application Data, Application Data"
"9.496539","5.9.29.183","172.19.0.3","TLSv1.2","599","Application Data"
"9.496556","172.19.0.3","5.9.29.183","TCP","56","43520 → 9002 [ACK] Seq=20548 Ack=328047 Win=11911 Len=0"
"9.496589","5.9.29.183","172.19.0.3","TCP","1516","[TCP segment of a reassembled PDU]"
"9.496620","5.9.29.183","172.19.0.3","TCP","1492","9002 → 43520 [PSH, ACK] Seq=329507 Ack=20548 Win=65535 Len=1436 [TCP segment of a reassembled PDU]"
"9.496735","172.19.0.3","5.9.29.183","TCP","56","43520 → 9002 [ACK] Seq=20548 Ack=330943 Win=11895 Len=0"
"9.513638","5.9.29.183","172.19.0.3","TLSv1.2","787","Application Data"
"9.521910","5.9.29.183","172.19.0.3","TCP","1504","[TCP segment of a reassembled PDU]"
"9.521927","172.19.0.3","5.9.29.183","TCP","56","43520 → 9002 [ACK] Seq=20548 Ack=333122 Win=11911 Len=0"
"9.521961","5.9.29.183","172.19.0.3","TCP","1516","9002 → 43520 [PSH, ACK] Seq=333122 Ack=20548 Win=65535 Len=1460 [TCP segment of a reassembled PDU]"
"9.521989","5.9.29.183","172.19.0.3","TLSv1.2","1516","Application Data [TCP segment of a reassembled PDU]"
"9.521995","5.9.29.183","172.19.0.3","TCP","1480","9002 → 43520 [PSH, ACK] Seq=336042 Ack=20548 Win=65535 Len=1424 [TCP segment of a reassembled PDU]"
"9.521999","5.9.29.183","172.19.0.3","TCP","1504","9002 → 43520 [PSH, ACK] Seq=337466 Ack=20548 Win=65535 Len=1448 [TCP segment of a reassembled PDU]"
"9.522102","172.19.0.3","5.9.29.183","TCP","56","43520 → 9002 [ACK] Seq=20548 Ack=338914 Win=11879 Len=0"
"9.535713","5.9.29.183","172.19.0.3","TLSv1.2","70","Application Data"
"9.540257","5.9.29.183","172.19.0.3","TCP","1516","[TCP segment of a reassembled PDU]"
"9.540276","172.19.0.3","5.9.29.183","TCP","56","43520 → 9002 [ACK] Seq=20548 Ack=340388 Win=11911 Len=0"
"9.540314","5.9.29.183","172.19.0.3","TCP","1492","9002 → 43520 [PSH, ACK] Seq=340388 Ack=20548 Win=65535 Len=1436 [TCP segment of a reassembled PDU]"
"9.540371","5.9.29.183","172.19.0.3","TLSv1.2","1504","Application Data [TCP segment of a reassembled PDU]"
"9.540473","172.19.0.3","5.9.29.183","TCP","56","43520 → 9002 [ACK] Seq=20548 Ack=343272 Win=11895 Len=0"
"9.540682","172.19.0.3","5.9.29.183","TLSv1.2","599","Application Data"
"9.540870","5.9.29.183","172.19.0.3","TCP","56","9002 → 43520 [ACK] Seq=343272 Ack=21091 Win=65535 Len=0"
"9.552973","5.9.29.183","172.19.0.3","TLSv1.2","1424","Application Data"
"9.556228","172.19.0.3","5.9.29.183","TLSv1.2","599","Application Data"
"9.556476","5.9.29.183","172.19.0.3","TCP","56","9002 → 43520 [ACK] Seq=344640 Ack=21634 Win=65535 Len=0"
"9.958081","5.9.29.183","172.19.0.3","TLSv1.2","599","Application Data"
"9.958638","172.19.0.3","5.9.29.183","TLSv1.2","599","Application Data"
"9.958932","5.9.29.183","172.19.0.3","TCP","56","9002 → 43520 [ACK] Seq=345183 Ack=22177 Win=65535 Len=0"
"10.297368","5.9.29.183","172.19.0.3","TLSv1.2","599","Application Data"
"10.321041","5.9.29.183","172.19.0.3","TCP","1504","[TCP segment of a reassembled PDU]"
"10.321059","172.19.0.3","5.9.29.183","TCP","56","43520 → 9002 [ACK] Seq=22177 Ack=347174 Win=11911 Len=0"
"10.321093","5.9.29.183","172.19.0.3","TCP","1516","9002 → 43520 [PSH, ACK] Seq=347174 Ack=22177 Win=65535 Len=1460 [TCP segment of a reassembled PDU]"
"10.321102","5.9.29.183","172.19.0.3","TLSv1.2","775","Application Data"
"10.321260","172.19.0.3","5.9.29.183","TCP","56","43520 → 9002 [ACK] Seq=22177 Ack=349353 Win=11895 Len=0"
"10.330978","5.9.29.183","172.19.0.3","TCP","1504","[TCP segment of a reassembled PDU]"
"10.331306","5.9.29.183","172.19.0.3","TCP","1516","9002 → 43520 [PSH, ACK] Seq=350801 Ack=22177 Win=65535 Len=1460 [TCP segment of a reassembled PDU]"
"10.331317","172.19.0.3","5.9.29.183","TCP","56","43520 → 9002 [ACK] Seq=22177 Ack=352261 Win=11911 Len=0"
"10.331319","5.9.29.183","172.19.0.3","TLSv1.2","1516","Application Data [TCP segment of a reassembled PDU]"
"10.331323","5.9.29.183","172.19.0.3","TCP","1480","9002 → 43520 [PSH, ACK] Seq=353721 Ack=22177 Win=65535 Len=1424 [TCP segment of a reassembled PDU]"
"10.331385","5.9.29.183","172.19.0.3","TCP","1504","9002 → 43520 [PSH, ACK] Seq=355145 Ack=22177 Win=65535 Len=1448 [TCP segment of a reassembled PDU]"
"10.331464","172.19.0.3","5.9.29.183","TCP","56","43520 → 9002 [ACK] Seq=22177 Ack=356593 Win=11885 Len=0"
"10.339531","5.9.29.183","172.19.0.3","TLSv1.2","584","Application Data"
"10.344316","5.9.29.183","172.19.0.3","TCP","1516","[TCP segment of a reassembled PDU]"
"10.344334","172.19.0.3","5.9.29.183","TCP","56","43520 → 9002 [ACK] Seq=22177 Ack=358581 Win=11911 Len=0"
"10.344347","5.9.29.183","172.19.0.3","TCP","1492","9002 → 43520 [PSH, ACK] Seq=358581 Ack=22177 Win=65535 Len=1436 [TCP segment of a reassembled PDU]"
"10.354616","5.9.29.183","172.19.0.3","TLSv1.2","273","Application Data"
"10.354635","172.19.0.3","5.9.29.183","TCP","56","43520 → 9002 [ACK] Seq=22177 Ack=360234 Win=11911 Len=0"
"10.358729","5.9.29.183","172.19.0.3","TCP","1504","[TCP segment of a reassembled PDU]"
"10.358753","5.9.29.183","172.19.0.3","TCP","1504","9002 → 43520 [PSH, ACK] Seq=361682 Ack=22177 Win=65535 Len=1448 [TCP segment of a reassembled PDU]"
"10.358855","172.19.0.3","5.9.29.183","TCP","56","43520 → 9002 [ACK] Seq=22177 Ack=363130 Win=11903 Len=0"
"10.367170","5.9.29.183","172.19.0.3","TLSv1.2","1516","Application Data [TCP segment of a reassembled PDU]"
"10.367204","5.9.29.183","172.19.0.3","TCP","1516","9002 → 43520 [PSH, ACK] Seq=364590 Ack=22177 Win=65535 Len=1460 [TCP segment of a reassembled PDU]"
"10.367215","172.19.0.3","5.9.29.183","TCP","56","43520 → 9002 [ACK] Seq=22177 Ack=366050 Win=11903 Len=0"
"10.367216","5.9.29.183","172.19.0.3","TCP","1516","9002 → 43520 [PSH, ACK] Seq=366050 Ack=22177 Win=65535 Len=1460 [TCP segment of a reassembled PDU]"
"10.367219","5.9.29.183","172.19.0.3","TLSv1.2","1516","Application Data [TCP segment of a reassembled PDU]"
"10.367221","5.9.29.183","172.19.0.3","TCP","1516","9002 → 43520 [PSH, ACK] Seq=368970 Ack=22177 Win=65535 Len=1460 [TCP segment of a reassembled PDU]"
"10.367223","5.9.29.183","172.19.0.3","TCP","1444","9002 → 43520 [PSH, ACK] Seq=370430 Ack=22177 Win=65535 Len=1388 [TCP segment of a reassembled PDU]"
"10.367366","172.19.0.3","5.9.29.183","TCP","56","43520 → 9002 [ACK] Seq=22177 Ack=371818 Win=11871 Len=0"
"10.367554","172.19.0.3","5.9.29.183","TLSv1.2","599","Application Data"
"10.367698","5.9.29.183","172.19.0.3","TCP","56","9002 → 43520 [ACK] Seq=371818 Ack=22720 Win=65535 Len=0"
"10.371960","5.9.29.183","172.19.0.3","TLSv1.2","1438","Application Data, Application Data"
"10.378452","172.19.0.3","5.9.29.183","TLSv1.2","599","Application Data"
"10.378768","5.9.29.183","172.19.0.3","TCP","56","9002 → 43520 [ACK] Seq=373200 Ack=23263 Win=65535 Len=0"
"10.381823","5.9.29.183","172.19.0.3","TCP","1504","[TCP segment of a reassembled PDU]"
"10.388242","5.9.29.183","172.19.0.3","TLSv1.2","1207","Application Data"
"10.388261","172.19.0.3","5.9.29.183","TCP","56","43520 → 9002 [ACK] Seq=23263 Ack=375799 Win=11911 Len=0"
"10.430408","5.9.29.183","172.19.0.3","TCP","1516","[TCP segment of a reassembled PDU]"
"10.430431","5.9.29.183","172.19.0.3","TLSv1.2","167","Application Data"
"10.430502","172.19.0.3","5.9.29.183","TCP","56","43520 → 9002 [ACK] Seq=23263 Ack=377370 Win=11903 Len=0"
"10.507966","5.9.29.183","172.19.0.3","TLSv1.2","1113","Application Data"
"10.511259","172.19.0.3","5.9.29.183","TLSv1.2","599","Application Data"
"10.511543","5.9.29.183","172.19.0.3","TCP","56","9002 → 43520 [ACK] Seq=378427 Ack=23806 Win=65535 Len=0"
"10.810298","5.9.29.183","172.19.0.3","TLSv1.2","599","Application Data"
"10.810852","172.19.0.3","5.9.29.183","TLSv1.2","599","Application Data"
"10.811115","5.9.29.183","172.19.0.3","TCP","56","9002 → 43520 [ACK] Seq=378970 Ack=24349 Win=65535 Len=0"
"11.161599","5.9.29.183","172.19.0.3","TLSv1.2","599","Application Data"
"11.194596","5.9.29.183","172.19.0.3","TCP","1504","[TCP segment of a reassembled PDU]"
"11.194614","172.19.0.3","5.9.29.183","TCP","56","43520 → 9002 [ACK] Seq=24349 Ack=380961 Win=11911 Len=0"
"11.194622","5.9.29.183","172.19.0.3","TCP","1504","9002 → 43520 [PSH, ACK] Seq=380961 Ack=24349 Win=65535 Len=1448 [TCP segment of a reassembled PDU]"
"11.194628","5.9.29.183","172.19.0.3","TLSv1.2","787","Application Data"
"11.194750","172.19.0.3","5.9.29.183","TCP","56","43520 → 9002 [ACK] Seq=24349 Ack=383140 Win=11894 Len=0"
"11.209082","5.9.29.183","172.19.0.3","TCP","1504","[TCP segment of a reassembled PDU]"
"11.217120","5.9.29.183","172.19.0.3","TLSv1.2","179","Application Data"
"11.217137","172.19.0.3","5.9.29.183","TCP","56","43520 → 9002 [ACK] Seq=24349 Ack=384711 Win=11911 Len=0"
"11.246617","5.9.29.183","172.19.0.3","TCP","1516","[TCP segment of a reassembled PDU]"
"11.246647","5.9.29.183","172.19.0.3","TCP","1516","9002 → 43520 [PSH, ACK] Seq=386171 Ack=24349 Win=65535 Len=1460 [TCP segment of a reassembled PDU]"
"11.246674","5.9.29.183","172.19.0.3","TCP","952","9002 → 43520 [PSH, ACK] Seq=387631 Ack=24349 Win=65535 Len=896 [TCP segment of a reassembled PDU]"
"11.246745","5.9.29.183","172.19.0.3","TLSv1.2","1516","Application Data, Application Data"
"11.246762","5.9.29.183","172.19.0.3","TCP","305","9002 → 43520 [PSH, ACK] Seq=389987 Ack=24349 Win=65535 Len=249 [TCP segment of a reassembled PDU]"
"11.246829","172.19.0.3","5.9.29.183","TCP","56","43520 → 9002 [ACK] Seq=24349 Ack=390236 Win=11879 Len=0"
"11.275723","5.9.29.183","172.19.0.3","TLSv1.2","1516","Application Data [TCP segment of a reassembled PDU]"
"11.275767","5.9.29.183","172.19.0.3","TCP","1492","9002 → 43520 [PSH, ACK] Seq=391696 Ack=24349 Win=65535 Len=1436 [TCP segment of a reassembled PDU]"
"11.275779","172.19.0.3","5.9.29.183","TCP","56","43520 → 9002 [ACK] Seq=24349 Ack=393132 Win=11903 Len=0"
"11.275782","5.9.29.183","172.19.0.3","TCP","1516","9002 → 43520 [PSH, ACK] Seq=393132 Ack=24349 Win=65535 Len=1460 [TCP segment of a reassembled PDU]"
"11.275866","5.9.29.183","172.19.0.3","TLSv1.2","1492","Application Data [TCP segment of a reassembled PDU]"
"11.275870","5.9.29.183","172.19.0.3","TLSv1.2","1504","Application Data [TCP segment of a reassembled PDU]"
"11.275872","5.9.29.183","172.19.0.3","TCP","1504","9002 → 43520 [PSH, ACK] Seq=397476 Ack=24349 Win=65535 Len=1448 [TCP segment of a reassembled PDU]"
"11.276004","5.9.29.183","172.19.0.3","TLSv1.2","1504","Application Data [TCP segment of a reassembled PDU]"
"11.276014","172.19.0.3","5.9.29.183","TCP","56","43520 → 9002 [ACK] Seq=24349 Ack=398924 Win=11871 Len=0"
"11.276344","5.9.29.183","172.19.0.3","TCP","1504","9002 → 43520 [PSH, ACK] Seq=400372 Ack=24349 Win=65535 Len=1448 [TCP segment of a reassembled PDU]"
"11.276354","172.19.0.3","5.9.29.183","TCP","56","43520 → 9002 [ACK] Seq=24349 Ack=401820 Win=11855 Len=0"
"11.293345","5.9.29.183","172.19.0.3","TCP","1516","9002 → 43520 [PSH, ACK] Seq=401820 Ack=24349 Win=65535 Len=1460 [TCP segment of a reassembled PDU]"
"11.293374","5.9.29.183","172.19.0.3","TLSv1.2","1516","Application Data [TCP segment of a reassembled PDU]"
"11.293388","172.19.0.3","5.9.29.183","TCP","56","43520 → 9002 [ACK] Seq=24349 Ack=404740 Win=11903 Len=0"
"11.293390","5.9.29.183","172.19.0.3","TCP","1480","9002 → 43520 [PSH, ACK] Seq=404740 Ack=24349 Win=65535 Len=1424 [TCP segment of a reassembled PDU]"
"11.293394","5.9.29.183","172.19.0.3","TLSv1.2","1504","Application Data [TCP segment of a reassembled PDU]"
"11.293556","172.19.0.3","5.9.29.183","TCP","56","43520 → 9002 [ACK] Seq=24349 Ack=407612 Win=11887 Len=0"
"11.294043","172.19.0.3","5.9.29.183","TLSv1.2","599","Application Data"
"11.294252","5.9.29.183","172.19.0.3","TCP","56","9002 → 43520 [ACK] Seq=407612 Ack=24892 Win=65535 Len=0"
"11.298570","5.9.29.183","172.19.0.3","TCP","1504","9002 → 43520 [PSH, ACK] Seq=407612 Ack=24892 Win=65535 Len=1448 [TCP segment of a reassembled PDU]"
"11.298589","5.9.29.183","172.19.0.3","TLSv1.2","1154","Application Data"
"11.298599","172.19.0.3","5.9.29.183","TCP","56","43520 → 9002 [ACK] Seq=24892 Ack=410158 Win=11903 Len=0"
"11.308643","5.9.29.183","172.19.0.3","TCP","1516","[TCP segment of a reassembled PDU]"
"11.308683","5.9.29.183","172.19.0.3","TCP","1516","9002 → 43520 [PSH, ACK] Seq=411618 Ack=24892 Win=65535 Len=1460 [TCP segment of a reassembled PDU]"
"11.308695","172.19.0.3","5.9.29.183","TCP","56","43520 → 9002 [ACK] Seq=24892 Ack=413078 Win=11903 Len=0"
"11.308697","5.9.29.183","172.19.0.3","TLSv1.2","1516","Application Data [TCP segment of a reassembled PDU]"
"11.308700","5.9.29.183","172.19.0.3","TCP","1516","9002 → 43520 [PSH, ACK] Seq=414538 Ack=24892 Win=65535 Len=1460 [TCP segment of a reassembled PDU]"
"11.308702","5.9.29.183","172.19.0.3","TCP","1516","9002 → 43520 [PSH, ACK] Seq=415998 Ack=24892 Win=65535 Len=1460 [TCP segment of a reassembled PDU]"
"11.308703","5.9.29.183","172.19.0.3","TLSv1.2","1516","Application Data [TCP segment of a reassembled PDU]"
"11.308805","5.9.29.183","172.19.0.3","TCP","1516","9002 → 43520 [PSH, ACK] Seq=418918 Ack=24892 Win=65535 Len=1460 [TCP segment of a reassembled PDU]"
"11.308811","5.9.29.183","172.19.0.3","TCP","1420","9002 → 43520 [PSH, ACK] Seq=420378 Ack=24892 Win=65535 Len=1364 [TCP segment of a reassembled PDU]"
"11.308813","5.9.29.183","172.19.0.3","TLSv1.2","1516","Application Data [TCP segment of a reassembled PDU]"
"11.308815","5.9.29.183","172.19.0.3","TCP","1516","9002 → 43520 [PSH, ACK] Seq=423202 Ack=24892 Win=65535 Len=1460 [TCP segment of a reassembled PDU]"
"11.308819","5.9.29.183","172.19.0.3","TCP","1480","9002 → 43520 [PSH, ACK] Seq=424662 Ack=24892 Win=65535 Len=1424 [TCP segment of a reassembled PDU]"
"11.308880","172.19.0.3","5.9.29.183","TCP","56","43520 → 9002 [ACK] Seq=24892 Ack=426086 Win=11830 Len=0"
"11.309362","172.19.0.3","5.9.29.183","TLSv1.2","599","Application Data"
"11.309567","5.9.29.183","172.19.0.3","TCP","56","9002 → 43520 [ACK] Seq=426086 Ack=25435 Win=65535 Len=0"
"11.318666","5.9.29.183","172.19.0.3","TLSv1.2","721","Application Data, Application Data"
"11.361503","172.19.0.3","5.9.29.183","TCP","56","43520 → 9002 [ACK] Seq=25435 Ack=426751 Win=11911 Len=0"
"11.393770","5.9.29.183","172.19.0.3","TCP","1516","[TCP segment of a reassembled PDU]"
"11.393791","172.19.0.3","5.9.29.183","TCP","56","43520 → 9002 [ACK] Seq=25435 Ack=428211 Win=11911 Len=0"
"11.393804","5.9.29.183","172.19.0.3","TLSv1.2","1195","Application Data"
"11.393933","172.19.0.3","5.9.29.183","TCP","56","43520 → 9002 [ACK] Seq=25435 Ack=429350 Win=11911 Len=0"
"11.397127","172.19.0.3","5.9.29.183","TLSv1.2","599","Application Data"
"11.397354","5.9.29.183","172.19.0.3","TCP","56","9002 → 43520 [ACK] Seq=429350 Ack=25978 Win=65535 Len=0"
"11.763131","5.9.29.183","172.19.0.3","TLSv1.2","599","Application Data"
"11.763802","172.19.0.3","5.9.29.183","TLSv1.2","599","Application Data"
"11.764006","5.9.29.183","172.19.0.3","TCP","56","9002 → 43520 [ACK] Seq=429893 Ack=26521 Win=65535 Len=0"
"12.080410","5.9.29.183","172.19.0.3","TLSv1.2","599","Application Data"
"12.113795","5.9.29.183","172.19.0.3","TCP","1516","[TCP segment of a reassembled PDU]"
"12.113813","172.19.0.3","5.9.29.183","TCP","56","43520 → 9002 [ACK] Seq=26521 Ack=431896 Win=11911 Len=0"
"12.113826","5.9.29.183","172.19.0.3","TCP","1516","9002 → 43520 [PSH, ACK] Seq=431896 Ack=26521 Win=65535 Len=1460 [TCP segment of a reassembled PDU]"
"12.113833","5.9.29.183","172.19.0.3","TLSv1.2","763","Application Data"
"12.113958","172.19.0.3","5.9.29.183","TCP","56","43520 → 9002 [ACK] Seq=26521 Ack=434063 Win=11895 Len=0"
"12.125537","5.9.29.183","172.19.0.3","TCP","1516","[TCP segment of a reassembled PDU]"
"12.125561","5.9.29.183","172.19.0.3","TCP","1492","9002 → 43520 [PSH, ACK] Seq=435523 Ack=26521 Win=65535 Len=1436 [TCP segment of a reassembled PDU]"
"12.125571","172.19.0.3","5.9.29.183","TCP","56","43520 → 9002 [ACK] Seq=26521 Ack=436959 Win=11903 Len=0"
"12.140222","5.9.29.183","172.19.0.3","TLSv1.2","1516","Application Data [TCP segment of a reassembled PDU]"
"12.140246","5.9.29.183","172.19.0.3","TCP","1516","9002 → 43520 [PSH, ACK] Seq=438419 Ack=26521 Win=65535 Len=1460 [TCP segment of a reassembled PDU]"
"12.140257","172.19.0.3","5.9.29.183","TCP","56","43520 → 9002 [ACK] Seq=26521 Ack=439879 Win=11903 Len=0"
"12.140258","5.9.29.183","172.19.0.3","TCP","1516","9002 → 43520 [PSH, ACK] Seq=439879 Ack=26521 Win=65535 Len=1460 [TCP segment of a reassembled PDU]"
"12.140260","5.9.29.183","172.19.0.3","TLSv1.2","577","Application Data, Application Data"
"12.140390","172.19.0.3","5.9.29.183","TCP","56","43520 → 9002 [ACK] Seq=26521 Ack=441860 Win=11888 Len=0"
"12.154518","5.9.29.183","172.19.0.3","TCP","1516","[TCP segment of a reassembled PDU]"
"12.154544","5.9.29.183","172.19.0.3","TCP","1492","9002 → 43520 [PSH, ACK] Seq=443320 Ack=26521 Win=65535 Len=1436 [TCP segment of a reassembled PDU]"
"12.154554","172.19.0.3","5.9.29.183","TCP","56","43520 → 9002 [ACK] Seq=26521 Ack=444756 Win=11903 Len=0"
"12.163215","5.9.29.183","172.19.0.3","TLSv1.2","1330","Application Data, Application Data"
"12.171641","5.9.29.183","172.19.0.3","TCP","1516","[TCP segment of a reassembled PDU]"
"12.171659","172.19.0.3","5.9.29.183","TCP","56","43520 → 9002 [ACK] Seq=26521 Ack=447490 Win=11911 Len=0"
"12.171671","5.9.29.183","172.19.0.3","TCP","1492","9002 → 43520 [PSH, ACK] Seq=447490 Ack=26521 Win=65535 Len=1436 [TCP segment of a reassembled PDU]"
"12.179867","5.9.29.183","172.19.0.3","TLSv1.2","787","Application Data"
"12.179913","172.19.0.3","5.9.29.183","TCP","56","43520 → 9002 [ACK] Seq=26521 Ack=449657 Win=11911 Len=0"
"12.186873","5.9.29.183","172.19.0.3","TCP","1516","[TCP segment of a reassembled PDU]"
"12.186976","5.9.29.183","172.19.0.3","TCP","1516","9002 → 43520 [PSH, ACK] Seq=451117 Ack=26521 Win=65535 Len=1460 [TCP segment of a reassembled PDU]"
"12.186981","5.9.29.183","172.19.0.3","TLSv1.2","1480","Application Data [TCP segment of a reassembled PDU]"
"12.187075","5.9.29.183","172.19.0.3","TCP","118","9002 → 43520 [PSH, ACK] Seq=454001 Ack=26521 Win=65535 Len=62 [TCP segment of a reassembled PDU]"
"12.187081","172.19.0.3","5.9.29.183","TCP","56","43520 → 9002 [ACK] Seq=26521 Ack=454001 Win=11895 Len=0"
"12.187211","5.9.29.183","172.19.0.3","TLSv1.2","1516","Application Data [TCP segment of a reassembled PDU]"
"12.187215","5.9.29.183","172.19.0.3","TCP","1516","9002 → 43520 [PSH, ACK] Seq=455523 Ack=26521 Win=65535 Len=1460 [TCP segment of a reassembled PDU]"
"12.187217","5.9.29.183","172.19.0.3","TCP","1418","9002 → 43520 [PSH, ACK] Seq=456983 Ack=26521 Win=65535 Len=1362 [TCP segment of a reassembled PDU]"
"12.187339","172.19.0.3","5.9.29.183","TCP","56","43520 → 9002 [ACK] Seq=26521 Ack=458345 Win=11869 Len=0"
"12.197047","5.9.29.183","172.19.0.3","TLSv1.2","222","Application Data, Application Data"
"12.197361","172.19.0.3","5.9.29.183","TLSv1.2","599","Application Data"
"12.197576","5.9.29.183","172.19.0.3","TCP","56","9002 → 43520 [ACK] Seq=458511 Ack=27064 Win=65535 Len=0"
"12.220198","5.9.29.183","172.19.0.3","TCP","1516","[TCP segment of a reassembled PDU]"
"12.220223","5.9.29.183","172.19.0.3","TCP","1492","9002 → 43520 [PSH, ACK] Seq=459971 Ack=27064 Win=65535 Len=1436 [TCP segment of a reassembled PDU]"
"12.220226","5.9.29.183","172.19.0.3","TLSv1.2","1330","Application Data, Application Data"
"12.220318","172.19.0.3","5.9.29.183","TCP","56","43520 → 9002 [ACK] Seq=27064 Ack=462681 Win=11895 Len=0"
"12.245378","5.9.29.183","172.19.0.3","TCP","1504","[TCP segment of a reassembled PDU]"
"12.245426","5.9.29.183","172.19.0.3","TCP","1516","9002 → 43520 [PSH, ACK] Seq=464129 Ack=27064 Win=65535 Len=1460 [TCP segment of a reassembled PDU]"
"12.245445","172.19.0.3","5.9.29.183","TCP","56","43520 → 9002 [ACK] Seq=27064 Ack=465589 Win=11901 Len=0"
"12.245447","5.9.29.183","172.19.0.3","TLSv1.2","775","Application Data"
"12.273535","5.9.29.183","172.19.0.3","TCP","1504","[TCP segment of a reassembled PDU]"
"12.273554","172.19.0.3","5.9.29.183","TCP","56","43520 → 9002 [ACK] Seq=27064 Ack=467756 Win=11911 Len=0"
"12.273856","5.9.29.183","172.19.0.3","TLSv1.2","1207","Application Data"
"12.274276","172.19.0.3","5.9.29.183","TLSv1.2","599","Application Data"
"12.274474","5.9.29.183","172.19.0.3","TCP","56","9002 → 43520 [ACK] Seq=468907 Ack=27607 Win=65535 Len=0"
"12.283604","172.19.0.3","5.9.29.183","TLSv1.2","599","Application Data"
"12.283983","5.9.29.183","172.19.0.3","TCP","56","9002 → 43520 [ACK] Seq=468907 Ack=28150 Win=65535 Len=0"
"12.732704","5.9.29.183","172.19.0.3","TLSv1.2","599","Application Data"
"12.733313","172.19.0.3","5.9.29.183","TLSv1.2","599","Application Data"
"12.733501","5.9.29.183","172.19.0.3","TCP","56","9002 → 43520 [ACK] Seq=469450 Ack=28693 Win=65535 Len=0"
"13.313822","5.9.29.183","172.19.0.3","TCP","1516","[TCP segment of a reassembled PDU]"
"13.313850","5.9.29.183","172.19.0.3","TCP","1492","9002 → 43520 [PSH, ACK] Seq=470910 Ack=28693 Win=65535 Len=1436 [TCP segment of a reassembled PDU]"
"13.313855","5.9.29.183","172.19.0.3","TLSv1.2","787","Application Data"
"13.313965","172.19.0.3","5.9.29.183","TCP","56","43520 → 9002 [ACK] Seq=28693 Ack=473077 Win=11895 Len=0"
"13.344977","5.9.29.183","172.19.0.3","TCP","1504","[TCP segment of a reassembled PDU]"
"13.345003","5.9.29.183","172.19.0.3","TCP","1516","9002 → 43520 [PSH, ACK] Seq=474525 Ack=28693 Win=65535 Len=1460 [TCP segment of a reassembled PDU]"
"13.345013","172.19.0.3","5.9.29.183","TCP","56","43520 → 9002 [ACK] Seq=28693 Ack=475985 Win=11903 Len=0"
"13.345015","5.9.29.183","172.19.0.3","TLSv1.2","775","Application Data"
"13.376597","5.9.29.183","172.19.0.3","TCP","1516","[TCP segment of a reassembled PDU]"
"13.376636","172.19.0.3","5.9.29.183","TCP","56","43520 → 9002 [ACK] Seq=28693 Ack=478164 Win=11911 Len=0"
"13.376648","5.9.29.183","172.19.0.3","TCP","1516","9002 → 43520 [PSH, ACK] Seq=478164 Ack=28693 Win=65535 Len=1460 [TCP segment of a reassembled PDU]"
"13.376654","5.9.29.183","172.19.0.3","TLSv1.2","1213","Application Data"
"13.376656","5.9.29.183","172.19.0.3","TCP","1516","[TCP segment of a reassembled PDU]"
"13.376758","5.9.29.183","172.19.0.3","TCP","1516","9002 → 43520 [PSH, ACK] Seq=482241 Ack=28693 Win=65535 Len=1460 [TCP segment of a reassembled PDU]"
"13.376762","5.9.29.183","172.19.0.3","TLSv1.2","1516","Application Data [TCP segment of a reassembled PDU]"
"13.376765","5.9.29.183","172.19.0.3","TCP","1516","9002 → 43520 [PSH, ACK] Seq=485161 Ack=28693 Win=65535 Len=1460 [TCP segment of a reassembled PDU]"
"13.376767","5.9.29.183","172.19.0.3","TCP","1456","9002 → 43520 [PSH, ACK] Seq=486621 Ack=28693 Win=65535 Len=1400 [TCP segment of a reassembled PDU]"
"13.376828","172.19.0.3","5.9.29.183","TCP","56","43520 → 9002 [ACK] Seq=28693 Ack=488021 Win=11855 Len=0"
"13.392319","5.9.29.183","172.19.0.3","TLSv1.2","1191","Application Data, Application Data"
"13.392431","5.9.29.183","172.19.0.3","TCP","1504","[TCP segment of a reassembled PDU]"
"13.392469","172.19.0.3","5.9.29.183","TCP","56","43520 → 9002 [ACK] Seq=28693 Ack=490604 Win=11903 Len=0"
"13.392514","5.9.29.183","172.19.0.3","TCP","1504","9002 → 43520 [PSH, ACK] Seq=490604 Ack=28693 Win=65535 Len=1448 [TCP segment of a reassembled PDU]"
"13.410224","5.9.29.183","172.19.0.3","TLSv1.2","1330","Application Data, Application Data"
"13.410247","172.19.0.3","5.9.29.183","TCP","56","43520 → 9002 [ACK] Seq=28693 Ack=493326 Win=11911 Len=0"
"13.427889","5.9.29.183","172.19.0.3","TCP","1516","[TCP segment of a reassembled PDU]"
"13.427916","5.9.29.183","172.19.0.3","TCP","1516","9002 → 43520 [PSH, ACK] Seq=494786 Ack=28693 Win=65535 Len=1460 [TCP segment of a reassembled PDU]"
"13.427920","5.9.29.183","172.19.0.3","TLSv1.2","763","Application Data"
"13.428025","172.19.0.3","5.9.29.183","TCP","56","43520 → 9002 [ACK] Seq=28693 Ack=496953 Win=11893 Len=0"
"13.428355","172.19.0.3","5.9.29.183","TLSv1.2","599","Application Data"
"13.428538","5.9.29.183","172.19.0.3","TCP","56","9002 → 43520 [ACK] Seq=496953 Ack=29236 Win=65535 Len=0"
"13.457048","5.9.29.183","172.19.0.3","TCP","1516","[TCP segment of a reassembled PDU]"
"13.457074","5.9.29.183","172.19.0.3","TCP","1516","9002 → 43520 [PSH, ACK] Seq=498413 Ack=29236 Win=65535 Len=1460 [TCP segment of a reassembled PDU]"
"13.457077","5.9.29.183","172.19.0.3","TLSv1.2","763","Application Data"
"13.457331","172.19.0.3","5.9.29.183","TCP","56","43520 → 9002 [ACK] Seq=29236 Ack=500580 Win=11895 Len=0"
"13.473390","5.9.29.183","172.19.0.3","TLSv1.2","1113","Application Data"
"13.500165","5.9.29.183","172.19.0.3","TCP","1504","[TCP segment of a reassembled PDU]"
"13.500184","172.19.0.3","5.9.29.183","TCP","56","43520 → 9002 [ACK] Seq=29236 Ack=503085 Win=11911 Len=0"
"13.500196","5.9.29.183","172.19.0.3","TLSv1.2","1207","Application Data"
"13.540234","172.19.0.3","5.9.29.183","TCP","56","43520 → 9002 [ACK] Seq=29236 Ack=504236 Win=11911 Len=0"
