_ws.col.Time,_ws.col.Source,_ws.col.Destination,_ws.col.Protocol,_ws.col.Length,_ws.col.Info
"0.000000","172.19.0.3","5.9.29.183","TLSv1.2","599","Application Data"
"0.000291","5.9.29.183","172.19.0.3","TCP","56","9002 → 43520 [ACK] Seq=1 Ack=544 Win=65535 Len=0"
"0.405880","5.9.29.183","172.19.0.3","TLSv1.2","599","Application Data"
"0.405940","172.19.0.3","5.9.29.183","TCP","56","43520 → 9002 [ACK] Seq=544 Ack=544 Win=8466 Len=0"
"0.406639","172.19.0.3","5.9.29.183","TLSv1.2","2141","Application Data"
"0.406879","5.9.29.183","172.19.0.3","TCP","56","9002 → 43520 [ACK] Seq=544 Ack=2629 Win=65535 Len=0"
"1.062671","5.9.29.183","172.19.0.3","TLSv1.2","599","Application Data"
"1.103051","172.19.0.3","5.9.29.183","TCP","56","43520 → 9002 [ACK] Seq=2629 Ack=1087 Win=8466 Len=0"
"1.176761","5.9.29.183","172.19.0.3","TLSv1.2","1113","Application Data"
"1.176779","172.19.0.3","5.9.29.183","TCP","56","43520 → 9002 [ACK] Seq=2629 Ack=2144 Win=8466 Len=0"
"1.179901","172.19.0.3","5.9.29.183","TLSv1.2","599","Application Data"
"1.180088","5.9.29.183","172.19.0.3","TCP","56","9002 → 43520 [ACK] Seq=2144 Ack=3172 Win=65535 Len=0"
"1.621301","5.9.29.183","172.19.0.3","TLSv1.2","599","Application Data"
"1.621833","172.19.0.3","5.9.29.183","TLSv1.2","599","Application Data"
"1.622078","5.9.29.183","172.19.0.3","TCP","56","9002 → 43520 [ACK] Seq=2687 Ack=3715 Win=65535 Len=0"
"2.043676","5.9.29.183","172.19.0.3","TLSv1.2","599","Application Data"
"2.060625","5.9.29.183","172.19.0.3","TCP","423","[TCP segment of a reassembled PDU]"
"2.060669","5.9.29.183","172.19.0.3","TCP","1516","9002 → 43520 [PSH, ACK] Seq=3597 Ack=3715 Win=65535 Len=1460 [TCP segment of a reassembled PDU]"
"2.060677","5.9.29.183","172.19.0.3","TCP","1516","9002 → 43520 [PSH, ACK] Seq=5057 Ack=3715 Win=65535 Len=1460 [TCP segment of a reassembled PDU]"
"2.060679","5.9.29.183","172.19.0.3","TLSv1.2","396","Application Data"
"2.060824","172.19.0.3","5.9.29.183","TCP","56","43520 → 9002 [ACK] Seq=3715 Ack=6857 Win=8440 Len=0"
"2.076389","5.9.29.183","172.19.0.3","TCP","1504","[TCP segment of a reassembled PDU]"
"2.076452","5.9.29.183","172.19.0.3","TCP","1516","9002 → 43520 [PSH, ACK] Seq=8305 Ack=3715 Win=65535 Len=1460 [TCP segment of a reassembled PDU]"
"2.076469","172.19.0.3","5.9.29.183","TCP","56","43520 → 9002 [ACK] Seq=3715 Ack=9765 Win=8458 Len=0"
"2.076472","5.9.29.183","172.19.0.3","TLSv1.2","261","Application Data"
"2.076809","172.19.0.3","5.9.29.183","TLSv1.2","599","Application Data"
"2.077077","5.9.29.183","172.19.0.3","TCP","56","9002 → 43520 [ACK] Seq=9970 Ack=4258 Win=65535 Len=0"
"2.135301","172.19.0.3","5.9.29.183","TLSv1.2","1113","Application Data"
"2.135892","5.9.29.183","172.19.0.3","TCP","56","9002 → 43520 [ACK] Seq=9970 Ack=5315 Win=65535 Len=0"
"2.157918","5.9.29.183","172.19.0.3","TCP","1516","[TCP segment of a reassembled PDU]"
"2.157963","5.9.29.183","172.19.0.3","TLSv1.2","1195","Application Data"
"2.158090","172.19.0.3","5.9.29.183","TCP","56","43520 → 9002 [ACK] Seq=5315 Ack=12569 Win=8458 Len=0"
"2.161071","172.19.0.3","5.9.29.183","TLSv1.2","599","Application Data"
"2.161291","5.9.29.183","172.19.0.3","TCP","56","9002 → 43520 [ACK] Seq=12569 Ack=5858 Win=65535 Len=0"
"2.174320","5.9.29.183","172.19.0.3","TLSv1.2","599","Application Data"
"2.174855","172.19.0.3","5.9.29.183","TLSv1.2","599","Application Data"
"2.175192","5.9.29.183","172.19.0.3","TCP","56","9002 → 43520 [ACK] Seq=13112 Ack=6401 Win=65535 Len=0"
"2.275760","5.9.29.183","172.19.0.3","TLSv1.2","599","Application Data"
"2.276509","172.19.0.3","5.9.29.183","TLSv1.2","599","Application Data"
"2.276945","5.9.29.183","172.19.0.3","TCP","56","9002 → 43520 [ACK] Seq=13655 Ack=6944 Win=65535 Len=0"
"2.506478","5.9.29.183","172.19.0.3","TLSv1.2","599","Application Data"
"2.540517","5.9.29.183","172.19.0.3","TLSv1.2","599","Application Data"
"2.540536","172.19.0.3","5.9.29.183","TCP","56","43520 → 9002 [ACK] Seq=6944 Ack=14741 Win=8466 Len=0"
"2.541204","172.19.0.3","5.9.29.183","TLSv1.2","599","Application Data"
"2.541675","5.9.29.183","172.19.0.3","TCP","56","9002 → 43520 [ACK] Seq=14741 Ack=7487 Win=65535 Len=0"
"2.982808","5.9.29.183","172.19.0.3","TLSv1.2","599","Application Data"
"3.024550","172.19.0.3","5.9.29.183","TCP","56","43520 → 9002 [ACK] Seq=7487 Ack=15284 Win=8466 Len=0"
"3.031766","5.9.29.183","172.19.0.3","TCP","1504","[TCP segment of a reassembled PDU]"
"3.031787","172.19.0.3","5.9.29.183","TCP","56","43520 → 9002 [ACK] Seq=7487 Ack=16732 Win=8466 Len=0"
"3.031819","5.9.29.183","172.19.0.3","TCP","1504","9002 → 43520 [PSH, ACK] Seq=16732 Ack=7487 Win=65535 Len=1448 [TCP segment of a reassembled PDU]"
"3.031830","172.19.0.3","5.9.29.183","TCP","56","43520 → 9002 [ACK] Seq=7487 Ack=18180 Win=8458 Len=0"
"3.031884","5.9.29.183","172.19.0.3","TLSv1.2","787","Application Data"
"3.031901","172.19.0.3","5.9.29.183","TCP","56","43520 → 9002 [ACK] Seq=7487 Ack=18911 Win=8453 Len=0"
"3.118106","5.9.29.183","172.19.0.3","TCP","1504","[TCP segment of a reassembled PDU]"
"3.118124","172.19.0.3","5.9.29.183","TCP","56","43520 → 9002 [ACK] Seq=7487 Ack=20359 Win=8466 Len=0"
"3.118157","5.9.29.183","172.19.0.3","TCP","1516","9002 → 43520 [PSH, ACK] Seq=20359 Ack=7487 Win=65535 Len=1460 [TCP segment of a reassembled PDU]"
"3.118164","172.19.0.3","5.9.29.183","TCP","56","43520 → 9002 [ACK] Seq=7487 Ack=21819 Win=8458 Len=0"
"3.118166","5.9.29.183","172.19.0.3","TLSv1.2","775","Application Data"
"3.118169","172.19.0.3","5.9.29.183","TCP","56","43520 → 9002 [ACK] Seq=7487 Ack=22538 Win=8453 Len=0"
"3.121104","172.19.0.3","5.9.29.183","TLSv1.2","599","Application Data"
"3.121402","5.9.29.183","172.19.0.3","TCP","56","9002 → 43520 [ACK] Seq=22538 Ack=8030 Win=65535 Len=0"
"3.551177","5.9.29.183","172.19.0.3","TLSv1.2","599","Application Data"
"3.551768","172.19.0.3","5.9.29.183","TLSv1.2","599","Application Data"
"3.552011","5.9.29.183","172.19.0.3","TCP","56","9002 → 43520 [ACK] Seq=23081 Ack=8573 Win=65535 Len=0"
"3.973331","5.9.29.183","172.19.0.3","TLSv1.2","599","Application Data"
"3.988618","5.9.29.183","172.19.0.3","TCP","1516","[TCP segment of a reassembled PDU]"
"3.988639","172.19.0.3","5.9.29.183","TCP","56","43520 → 9002 [ACK] Seq=8573 Ack=25084 Win=8466 Len=0"
"3.988652","5.9.29.183","172.19.0.3","TCP","1516","9002 → 43520 [PSH, ACK] Seq=25084 Ack=8573 Win=65535 Len=1460 [TCP segment of a reassembled PDU]"
"3.988660","5.9.29.183","172.19.0.3","TLSv1.2","1516","Application Data [TCP segment of a reassembled PDU]"
"3.988662","5.9.29.183","172.19.0.3","TCP","1516","9002 → 43520 [PSH, ACK] Seq=28004 Ack=8573 Win=65535 Len=1460 [TCP segment of a reassembled PDU]"
"3.988664","5.9.29.183","172.19.0.3","TCP","1456","9002 → 43520 [PSH, ACK] Seq=29464 Ack=8573 Win=65535 Len=1400 [TCP segment of a reassembled PDU]"
"3.988779","172.19.0.3","5.9.29.183","TCP","56","43520 → 9002 [ACK] Seq=8573 Ack=30864 Win=8434 Len=0"
"4.001161","5.9.29.183","172.19.0.3","TLSv1.2","70","Application Data"
"4.012686","5.9.29.183","172.19.0.3","TCP","1516","[TCP segment of a reassembled PDU]"
"4.012704","172.19.0.3","5.9.29.183","TCP","56","43520 → 9002 [ACK] Seq=8573 Ack=32338 Win=8466 Len=0"
"4.012712","5.9.29.183","172.19.0.3","TCP","1492","9002 → 43520 [PSH, ACK] Seq=32338 Ack=8573 Win=65535 Len=1436 [TCP segment of a reassembled PDU]"
"4.013002","5.9.29.183","172.19.0.3","TLSv1.2","1516","Application Data [TCP segment of a reassembled PDU]"
"4.013008","172.19.0.3","5.9.29.183","TCP","56","43520 → 9002 [ACK] Seq=8573 Ack=35234 Win=8466 Len=0"
"4.013011","5.9.29.183","172.19.0.3","TCP","1516","9002 → 43520 [PSH, ACK] Seq=35234 Ack=8573 Win=65535 Len=1460 [TCP segment of a reassembled PDU]"
"4.013014","5.9.29.183","172.19.0.3","TCP","1480","9002 → 43520 [PSH, ACK] Seq=36694 Ack=8573 Win=65535 Len=1424 [TCP segment of a reassembled PDU]"
"4.013056","172.19.0.3","5.9.29.183","TCP","56","43520 → 9002 [ACK] Seq=8573 Ack=38118 Win=8450 Len=0"
"4.028102","5.9.29.183","172.19.0.3","TLSv1.2","1127","Application Data, Application Data"
"4.034649","5.9.29.183","172.19.0.3","TCP","1504","[TCP segment of a reassembled PDU]"
"4.034667","172.19.0.3","5.9.29.183","TCP","56","43520 → 9002 [ACK] Seq=8573 Ack=40637 Win=8466 Len=0"
"4.034681","5.9.29.183","172.19.0.3","TCP","1504","9002 → 43520 [PSH, ACK] Seq=40637 Ack=8573 Win=65535 Len=1448 [TCP segment of a reassembled PDU]"
"4.045640","5.9.29.183","172.19.0.3","TLSv1.2","787","Application Data"
"4.045684","172.19.0.3","5.9.29.183","TCP","56","43520 → 9002 [ACK] Seq=8573 Ack=42816 Win=8466 Len=0"
"4.045699","5.9.29.183","172.19.0.3","TCP","1516","[TCP segment of a reassembled PDU]"
"4.045705","5.9.29.183","172.19.0.3","TCP","1516","9002 → 43520 [PSH, ACK] Seq=44276 Ack=8573 Win=65535 Len=1460 [TCP segment of a reassembled PDU]"
"4.045806","5.9.29.183","172.19.0.3","TLSv1.2","1516","Application Data [TCP segment of a reassembled PDU]"
"4.045812","5.9.29.183","172.19.0.3","TLSv1.2","1516","Application Data [TCP segment of a reassembled PDU]"
"4.045815","5.9.29.183","172.19.0.3","TCP","1456","9002 → 43520 [PSH, ACK] Seq=48656 Ack=8573 Win=65535 Len=1400 [TCP segment of a reassembled PDU]"
"4.045819","5.9.29.183","172.19.0.3","TCP","1504","9002 → 43520 [PSH, ACK] Seq=50056 Ack=8573 Win=65535 Len=1448 [TCP segment of a reassembled PDU]"
"4.045876","172.19.0.3","5.9.29.183","TCP","56","43520 → 9002 [ACK] Seq=8573 Ack=51504 Win=8416 Len=0"
"4.071316","5.9.29.183","172.19.0.3","TLSv1.2","736","Application Data, Application Data"
"4.071580","172.19.0.3","5.9.29.183","TLSv1.2","599","Application Data"
"4.071777","5.9.29.183","172.19.0.3","TCP","56","9002 → 43520 [ACK] Seq=52184 Ack=9116 Win=65535 Len=0"
"4.081581","172.19.0.3","5.9.29.183","TLSv1.2","599","Application Data"
"4.081918","5.9.29.183","172.19.0.3","TCP","56","9002 → 43520 [ACK] Seq=52184 Ack=9659 Win=65535 Len=0"
"4.544462","5.9.29.183","172.19.0.3","TLSv1.2","599","Application Data"
"4.545126","172.19.0.3","5.9.29.183","TLSv1.2","599","Application Data"
"4.545487","5.9.29.183","172.19.0.3","TCP","56","9002 → 43520 [ACK] Seq=52727 Ack=10202 Win=65535 Len=0"
"4.975047","5.9.29.183","172.19.0.3","TCP","1516","[TCP segment of a reassembled PDU]"
"4.975080","5.9.29.183","172.19.0.3","TCP","1492","9002 → 43520 [PSH, ACK] Seq=54187 Ack=10202 Win=65535 Len=1436 [TCP segment of a reassembled PDU]"
"4.975085","5.9.29.183","172.19.0.3","TLSv1.2","787","Application Data"
"4.975195","172.19.0.3","5.9.29.183","TCP","56","43520 → 9002 [ACK] Seq=10202 Ack=56354 Win=8450 Len=0"
"4.984654","5.9.29.183","172.19.0.3","TCP","1504","[TCP segment of a reassembled PDU]"
"4.984670","5.9.29.183","172.19.0.3","TCP","1504","9002 → 43520 [PSH, ACK] Seq=57802 Ack=10202 Win=65535 Len=1448 [TCP segment of a reassembled PDU]"
"4.984679","172.19.0.3","5.9.29.183","TCP","56","43520 → 9002 [ACK] Seq=10202 Ack=59250 Win=8458 Len=0"
"4.984680","5.9.29.183","172.19.0.3","TLSv1.2","1504","Application Data [TCP segment of a reassembled PDU]"
"4.984683","5.9.29.183","172.19.0.3","TCP","1504","9002 → 43520 [PSH, ACK] Seq=60698 Ack=10202 Win=65535 Len=1448 [TCP segment of a reassembled PDU]"
"4.984747","5.9.29.183","172.19.0.3","TCP","1504","9002 → 43520 [PSH, ACK] Seq=62146 Ack=10202 Win=65535 Len=1448 [TCP segment of a reassembled PDU]"
"4.984819","172.19.0.3","5.9.29.183","TCP","56","43520 → 9002 [ACK] Seq=10202 Ack=63594 Win=8434 Len=0"
"4.990682","5.9.29.183","172.19.0.3","TLSv1.2","1127","Application Data, Application Data"
"5.031415","172.19.0.3","5.9.29.183","TCP","56","43520 → 9002 [ACK] Seq=10202 Ack=64665 Win=8466 Len=0"
"5.032634","5.9.29.183","172.19.0.3","TCP","1504","[TCP segment of a reassembled PDU]"
"5.032648","172.19.0.3","5.9.29.183","TCP","56","43520 → 9002 [ACK] Seq=10202 Ack=66113 Win=8466 Len=0"
"5.032660","5.9.29.183","172.19.0.3","TCP","1516","9002 → 43520 [PSH, ACK] Seq=66113 Ack=10202 Win=65535 Len=1460 [TCP segment of a reassembled PDU]"
"5.032668","172.19.0.3","5.9.29.183","TCP","56","43520 → 9002 [ACK] Seq=10202 Ack=67573 Win=8458 Len=0"
"5.032770","5.9.29.183","172.19.0.3","TLSv1.2","1516","Application Data [TCP segment of a reassembled PDU]"
"5.032775","172.19.0.3","5.9.29.183","TCP","56","43520 → 9002 [ACK] Seq=10202 Ack=69033 Win=8450 Len=0"
"5.032777","5.9.29.183","172.19.0.3","TCP","156","9002 → 43520 [PSH, ACK] Seq=69033 Ack=10202 Win=65535 Len=100 [TCP segment of a reassembled PDU]"
"5.032781","172.19.0.3","5.9.29.183","TCP","56","43520 → 9002 [ACK] Seq=10202 Ack=69133 Win=8450 Len=0"
"5.032852","5.9.29.183","172.19.0.3","TCP","1516","9002 → 43520 [PSH, ACK] Seq=69133 Ack=10202 Win=65535 Len=1460 [TCP segment of a reassembled PDU]"
"5.032858","172.19.0.3","5.9.29.183","TCP","56","43520 → 9002 [ACK] Seq=10202 Ack=70593 Win=8439 Len=0"
"5.032859","5.9.29.183","172.19.0.3","TCP","1101","9002 → 43520 [PSH, ACK] Seq=70593 Ack=10202 Win=65535 Len=1045 [TCP segment of a reassembled PDU]"
"5.032863","172.19.0.3","5.9.29.183","TCP","56","43520 → 9002 [ACK] Seq=10202 Ack=71638 Win=8431 Len=0"
"5.033154","172.19.0.3","5.9.29.183","TLSv1.2","599","Application Data"
"5.033297","5.9.29.183","172.19.0.3","TCP","56","9002 → 43520 [ACK] Seq=71638 Ack=10745 Win=65535 Len=0"
"5.047364","5.9.29.183","172.19.0.3","TLSv1.2","1504","Application Data [TCP segment of a reassembled PDU]"
"5.047446","5.9.29.183","172.19.0.3","TCP","1504","9002 → 43520 [PSH, ACK] Seq=73086 Ack=10745 Win=65535 Len=1448 [TCP segment of a reassembled PDU]"
"5.047460","172.19.0.3","5.9.29.183","TCP","56","43520 → 9002 [ACK] Seq=10745 Ack=74534 Win=8458 Len=0"
"5.047463","5.9.29.183","172.19.0.3","TCP","1504","9002 → 43520 [PSH, ACK] Seq=74534 Ack=10745 Win=65535 Len=1448 [TCP segment of a reassembled PDU]"
"5.047553","5.9.29.183","172.19.0.3","TLSv1.2","1504","Application Data [TCP segment of a reassembled PDU]"
"5.047558","5.9.29.183","172.19.0.3","TCP","1504","9002 → 43520 [PSH, ACK] Seq=77430 Ack=10745 Win=65535 Len=1448 [TCP segment of a reassembled PDU]"
"5.047560","5.9.29.183","172.19.0.3","TCP","1504","9002 → 43520 [PSH, ACK] Seq=78878 Ack=10745 Win=65535 Len=1448 [TCP segment of a reassembled PDU]"
"5.047615","172.19.0.3","5.9.29.183","TCP","56","43520 → 9002 [ACK] Seq=10745 Ack=80326 Win=8426 Len=0"
"5.047668","5.9.29.183","172.19.0.3","TLSv1.2","988","Application Data, Application Data"
"5.048106","172.19.0.3","5.9.29.183","TLSv1.2","599","Application Data"
"5.048243","5.9.29.183","172.19.0.3","TCP","56","9002 → 43520 [ACK] Seq=81258 Ack=11288 Win=65535 Len=0"
"5.064409","5.9.29.183","172.19.0.3","TCP","1504","[TCP segment of a reassembled PDU]"
"5.064463","5.9.29.183","172.19.0.3","TCP","1504","9002 → 43520 [PSH, ACK] Seq=82706 Ack=11288 Win=65535 Len=1448 [TCP segment of a reassembled PDU]"
"5.064480","172.19.0.3","5.9.29.183","TCP","56","43520 → 9002 [ACK] Seq=11288 Ack=84154 Win=8458 Len=0"
"5.064483","5.9.29.183","172.19.0.3","TLSv1.2","1237","Application Data"
"5.064651","5.9.29.183","172.19.0.3","TCP","1504","[TCP segment of a reassembled PDU]"
"5.064658","5.9.29.183","172.19.0.3","TCP","1504","9002 → 43520 [PSH, ACK] Seq=86783 Ack=11288 Win=65535 Len=1448 [TCP segment of a reassembled PDU]"
"5.064661","5.9.29.183","172.19.0.3","TLSv1.2","1504","Application Data [TCP segment of a reassembled PDU]"
"5.064710","5.9.29.183","172.19.0.3","TCP","1516","9002 → 43520 [PSH, ACK] Seq=89679 Ack=11288 Win=65535 Len=1460 [TCP segment of a reassembled PDU]"
"5.064713","5.9.29.183","172.19.0.3","TCP","1492","9002 → 43520 [PSH, ACK] Seq=91139 Ack=11288 Win=65535 Len=1436 [TCP segment of a reassembled PDU]"
"5.064775","172.19.0.3","5.9.29.183","TCP","56","43520 → 9002 [ACK] Seq=11288 Ack=92575 Win=8410 Len=0"
"5.080586","5.9.29.183","172.19.0.3","TLSv1.2","648","Application Data"
"5.123426","172.19.0.3","5.9.29.183","TCP","56","43520 → 9002 [ACK] Seq=11288 Ack=93167 Win=8466 Len=0"
"5.126331","5.9.29.183","172.19.0.3","TCP","1504","[TCP segment of a reassembled PDU]"
"5.126456","172.19.0.3","5.9.29.183","TCP","56","43520 → 9002 [ACK] Seq=11288 Ack=94615 Win=8466 Len=0"
"5.126659","5.9.29.183","172.19.0.3","TCP","1516","9002 → 43520 [PSH, ACK] Seq=94615 Ack=11288 Win=65535 Len=1460 [TCP segment of a reassembled PDU]"
"5.126667","5.9.29.183","172.19.0.3","TLSv1.2","1225","Application Data"
"5.126693","172.19.0.3","5.9.29.183","TCP","56","43520 → 9002 [ACK] Seq=11288 Ack=97244 Win=8466 Len=0"
"5.126753","5.9.29.183","172.19.0.3","TCP","1516","[TCP segment of a reassembled PDU]"
"5.126755","5.9.29.183","172.19.0.3","TCP","1516","9002 → 43520 [PSH, ACK] Seq=98704 Ack=11288 Win=65535 Len=1460 [TCP segment of a reassembled PDU]"
"5.126798","5.9.29.183","172.19.0.3","TLSv1.2","1516","Application Data [TCP segment of a reassembled PDU]"
"5.126853","5.9.29.183","172.19.0.3","TCP","1516","9002 → 43520 [PSH, ACK] Seq=101624 Ack=11288 Win=65535 Len=1460 [TCP segment of a reassembled PDU]"
"5.126893","5.9.29.183","172.19.0.3","TCP","1456","9002 → 43520 [PSH, ACK] Seq=103084 Ack=11288 Win=65535 Len=1400 [TCP segment of a reassembled PDU]"
"5.127043","172.19.0.3","5.9.29.183","TCP","56","43520 → 9002 [ACK] Seq=11288 Ack=104484 Win=8432 Len=0"
"5.141751","5.9.29.183","172.19.0.3","TLSv1.2","648","Application Data"
"5.141874","172.19.0.3","5.9.29.183","TCP","56","43520 → 9002 [ACK] Seq=11288 Ack=105076 Win=8466 Len=0"
"5.142224","172.19.0.3","5.9.29.183","TLSv1.2","599","Application Data"
"5.142417","5.9.29.183","172.19.0.3","TCP","56","9002 → 43520 [ACK] Seq=105076 Ack=11831 Win=65535 Len=0"
"5.169073","5.9.29.183","172.19.0.3","TCP","1504","[TCP segment of a reassembled PDU]"
"5.169089","5.9.29.183","172.19.0.3","TCP","1504","9002 → 43520 [PSH, ACK] Seq=106524 Ack=11831 Win=65535 Len=1448 [TCP segment of a reassembled PDU]"
"5.169092","5.9.29.183","172.19.0.3","TLSv1.2","1516","Application Data [TCP segment of a reassembled PDU]"
"5.169094","5.9.29.183","172.19.0.3","TCP","1225","9002 → 43520 [PSH, ACK] Seq=109432 Ack=11831 Win=65535 Len=1169 [TCP segment of a reassembled PDU]"
"5.169149","172.19.0.3","5.9.29.183","TCP","56","43520 → 9002 [ACK] Seq=11831 Ack=110601 Win=8442 Len=0"
"5.184309","5.9.29.183","172.19.0.3","TLSv1.2","757","Application Data"
"5.188228","172.19.0.3","5.9.29.183","TLSv1.2","599","Application Data"
"5.188445","5.9.29.183","172.19.0.3","TCP","56","9002 → 43520 [ACK] Seq=111302 Ack=12374 Win=65535 Len=0"
"5.609944","5.9.29.183","172.19.0.3","TLSv1.2","599","Application Data"
"5.610554","172.19.0.3","5.9.29.183","TLSv1.2","599","Application Data"
"5.610859","5.9.29.183","172.19.0.3","TCP","56","9002 → 43520 [ACK] Seq=111845 Ack=12917 Win=65535 Len=0"
"5.995452","5.9.29.183","172.19.0.3","TLSv1.2","599","Application Data"
"6.025628","5.9.29.183","172.19.0.3","TCP","1504","[TCP segment of a reassembled PDU]"
"6.025645","172.19.0.3","5.9.29.183","TCP","56","43520 → 9002 [ACK] Seq=12917 Ack=113836 Win=8466 Len=0"
"6.025657","5.9.29.183","172.19.0.3","TCP","1516","9002 → 43520 [PSH, ACK] Seq=113836 Ack=12917 Win=65535 Len=1460 [TCP segment of a reassembled PDU]"
"6.025664","5.9.29.183","172.19.0.3","TLSv1.2","775","Application Data"
"6.025791","172.19.0.3","5.9.29.183","TCP","56","43520 → 9002 [ACK] Seq=12917 Ack=116015 Win=8450 Len=0"
"6.040746","5.9.29.183","172.19.0.3","TCP","1504","[TCP segment of a reassembled PDU]"
"6.040769","5.9.29.183","172.19.0.3","TCP","1504","9002 → 43520 [PSH, ACK] Seq=117463 Ack=12917 Win=65535 Len=1448 [TCP segment of a reassembled PDU]"
"6.040779","172.19.0.3","5.9.29.183","TCP","56","43520 → 9002 [ACK] Seq=12917 Ack=118911 Win=8458 Len=0"
"6.040781","5.9.29.183","172.19.0.3","TLSv1.2","1330","Application Data, Application Data"
"6.041171","172.19.0.3","5.9.29.183","TLSv1.2","599","Application Data"
"6.041353","5.9.29.183","172.19.0.3","TCP","56","9002 → 43520 [ACK] Seq=120185 Ack=13460 Win=65535 Len=0"
"6.069871","5.9.29.183","172.19.0.3","TCP","1504","[TCP segment of a reassembled PDU]"
"6.069915","5.9.29.183","172.19.0.3","TCP","1504","9002 → 43520 [PSH, ACK] Seq=121633 Ack=13460 Win=65535 Len=1448 [TCP segment of a reassembled PDU]"
"6.069927","172.19.0.3","5.9.29.183","TCP","56","43520 → 9002 [ACK] Seq=13460 Ack=123081 Win=8458 Len=0"
"6.070026","5.9.29.183","172.19.0.3","TLSv1.2","1237","Application Data"
"6.085886","5.9.29.183","172.19.0.3","TLSv1.2","149","Application Data"
"6.086042","172.19.0.3","5.9.29.183","TCP","56","43520 → 9002 [ACK] Seq=13460 Ack=124355 Win=8466 Len=0"
"6.095438","5.9.29.183","172.19.0.3","TCP","1504","[TCP segment of a reassembled PDU]"
"6.095485","5.9.29.183","172.19.0.3","TCP","1516","9002 → 43520 [PSH, ACK] Seq=125803 Ack=13460 Win=65535 Len=1460 [TCP segment of a reassembled PDU]"
"6.095489","5.9.29.183","172.19.0.3","TLSv1.2","1516","Application Data [TCP segment of a reassembled PDU]"
"6.095492","5.9.29.183","172.19.0.3","TCP","1480","9002 → 43520 [PSH, ACK] Seq=128723 Ack=13460 Win=65535 Len=1424 [TCP segment of a reassembled PDU]"
"6.095547","5.9.29.183","172.19.0.3","TCP","1516","9002 → 43520 [PSH, ACK] Seq=130147 Ack=13460 Win=65535 Len=1460 [TCP segment of a reassembled PDU]"
"6.095551","5.9.29.183","172.19.0.3","TLSv1.2","1492","Application Data [TCP segment of a reassembled PDU]"
"6.095555","5.9.29.183","172.19.0.3","TCP","1504","9002 → 43520 [PSH, ACK] Seq=133043 Ack=13460 Win=65535 Len=1448 [TCP segment of a reassembled PDU]"
"6.095622","172.19.0.3","5.9.29.183","TCP","56","43520 → 9002 [ACK] Seq=13460 Ack=134491 Win=8416 Len=0"
"6.101232","5.9.29.183","172.19.0.3","TCP","234","9002 → 43520 [PSH, ACK] Seq=134491 Ack=13460 Win=65535 Len=178 [TCP segment of a reassembled PDU]"
"6.101253","5.9.29.183","172.19.0.3","TLSv1.2","1137","Application Data"
"6.101328","172.19.0.3","5.9.29.183","TCP","56","43520 → 9002 [ACK] Seq=13460 Ack=135750 Win=8466 Len=0"
"6.113680","5.9.29.183","172.19.0.3","TCP","1504","[TCP segment of a reassembled PDU]"
"6.113703","5.9.29.183","172.19.0.3","TCP","1504","9002 → 43520 [PSH, ACK] Seq=137198 Ack=13460 Win=65535 Len=1448 [TCP segment of a reassembled PDU]"
"6.113796","172.19.0.3","5.9.29.183","TCP","56","43520 → 9002 [ACK] Seq=13460 Ack=138646 Win=8458 Len=0"
"6.116612","5.9.29.183","172.19.0.3","TLSv1.2","1330","Application Data, Application Data"
"6.116819","172.19.0.3","5.9.29.183","TLSv1.2","599","Application Data"
"6.117040","5.9.29.183","172.19.0.3","TCP","56","9002 → 43520 [ACK] Seq=139920 Ack=14003 Win=65535 Len=0"
"6.124953","5.9.29.183","172.19.0.3","TCP","1504","[TCP segment of a reassembled PDU]"
"6.124981","5.9.29.183","172.19.0.3","TCP","1504","9002 → 43520 [PSH, ACK] Seq=141368 Ack=14003 Win=65535 Len=1448 [TCP segment of a reassembled PDU]"
"6.124986","5.9.29.183","172.19.0.3","TLSv1.2","1504","Application Data [TCP segment of a reassembled PDU]"
"6.124988","5.9.29.183","172.19.0.3","TCP","1516","9002 → 43520 [PSH, ACK] Seq=144264 Ack=14003 Win=65535 Len=1460 [TCP segment of a reassembled PDU]"
"6.125070","5.9.29.183","172.19.0.3","TLSv1.2","1492","Application Data [TCP segment of a reassembled PDU]"
"6.125092","5.9.29.183","172.19.0.3","TCP","1516","9002 → 43520 [PSH, ACK] Seq=147160 Ack=14003 Win=65535 Len=1460 [TCP segment of a reassembled PDU]"
"6.125095","5.9.29.183","172.19.0.3","TCP","1516","9002 → 43520 [PSH, ACK] Seq=148620 Ack=14003 Win=65535 Len=1460 [TCP segment of a reassembled PDU]"
"6.125143","5.9.29.183","172.19.0.3","TLSv1.2","1516","Application Data [TCP segment of a reassembled PDU]"
"6.125150","5.9.29.183","172.19.0.3","TCP","1468","9002 → 43520 [PSH, ACK] Seq=151540 Ack=14003 Win=65535 Len=1412 [TCP segment of a reassembled PDU]"
"6.125206","172.19.0.3","5.9.29.183","TCP","56","43520 → 9002 [ACK] Seq=14003 Ack=152952 Win=8402 Len=0"
"6.131602","5.9.29.183","172.19.0.3","TLSv1.2","1018","Application Data"
"6.146850","5.9.29.183","172.19.0.3","TLSv1.2","1113","Application Data"
"6.146871","172.19.0.3","5.9.29.183","TCP","56","43520 → 9002 [ACK] Seq=14003 Ack=154971 Win=8466 Len=0"
"6.150631","172.19.0.3","5.9.29.183","TLSv1.2","599","Application Data"
"6.150832","5.9.29.183","172.19.0.3","TCP","56","9002 → 43520 [ACK] Seq=154971 Ack=14546 Win=65535 Len=0"
"6.619371","5.9.29.183","172.19.0.3","TLSv1.2","599","Application Data"
"6.619842","172.19.0.3","5.9.29.183","TLSv1.2","599","Application Data"
"6.620256","5.9.29.183","172.19.0.3","TCP","56","9002 → 43520 [ACK] Seq=155514 Ack=15089 Win=65535 Len=0"
"7.022135","5.9.29.183","172.19.0.3","TLSv1.2","599","Application Data"
"7.037887","5.9.29.183","172.19.0.3","TCP","1516","[TCP segment of a reassembled PDU]"
"7.037907","172.19.0.3","5.9.29.183","TCP","56","43520 → 9002 [ACK] Seq=15089 Ack=157517 Win=8466 Len=0"
"7.037927","5.9.29.183","172.19.0.3","TCP","1492","9002 → 43520 [PSH, ACK] Seq=157517 Ack=15089 Win=65535 Len=1436 [TCP segment of a reassembled PDU]"
"7.037936","5.9.29.183","172.19.0.3","TLSv1.2","787","Application Data"
"7.038090","172.19.0.3","5.9.29.183","TCP","56","43520 → 9002 [ACK] Seq=15089 Ack=159684 Win=8450 Len=0"
"7.078622","5.9.29.183","172.19.0.3","TCP","1504","[TCP segment of a reassembled PDU]"
"7.078646","5.9.29.183","172.19.0.3","TCP","1516","9002 → 43520 [PSH, ACK] Seq=161132 Ack=15089 Win=65535 Len=1460 [TCP segment of a reassembled PDU]"
"7.078656","172.19.0.3","5.9.29.183","TCP","56","43520 → 9002 [ACK] Seq=15089 Ack=162592 Win=8458 Len=0"
"7.078658","5.9.29.183","172.19.0.3","TLSv1.2","775","Application Data"
"7.095379","5.9.29.183","172.19.0.3","TCP","1504","[TCP segment of a reassembled PDU]"
"7.095409","172.19.0.3","5.9.29.183","TCP","56","43520 → 9002 [ACK] Seq=15089 Ack=164759 Win=8466 Len=0"
"7.095459","5.9.29.183","172.19.0.3","TCP","1516","9002 → 43520 [PSH, ACK] Seq=164759 Ack=15089 Win=65535 Len=1460 [TCP segment of a reassembled PDU]"
"7.095590","5.9.29.183","172.19.0.3","TLSv1.2","1225","Application Data"
"7.095668","172.19.0.3","5.9.29.183","TCP","56","43520 → 9002 [ACK] Seq=15089 Ack=167388 Win=8450 Len=0"
"7.106561","5.9.29.183","172.19.0.3","TLSv1.2","1504","Application Data"
"7.106661","5.9.29.183","172.19.0.3","TCP","1504","9002 → 43520 [PSH, ACK] Seq=168836 Ack=15089 Win=65535 Len=1448 [TCP segment of a reassembled PDU]"
"7.106677","172.19.0.3","5.9.29.183","TCP","56","43520 → 9002 [ACK] Seq=15089 Ack=170284 Win=8458 Len=0"
"7.106768","5.9.29.183","172.19.0.3","TLSv1.2","1516","Application Data [TCP segment of a reassembled PDU]"
"7.106772","5.9.29.183","172.19.0.3","TCP","1492","9002 → 43520 [PSH, ACK] Seq=171744 Ack=15089 Win=65535 Len=1436 [TCP segment of a reassembled PDU]"
"7.106777","5.9.29.183","172.19.0.3","TCP","1504","9002 → 43520 [PSH, ACK] Seq=173180 Ack=15089 Win=65535 Len=1448 [TCP segment of a reassembled PDU]"
"7.106838","172.19.0.3","5.9.29.183","TCP","56","43520 → 9002 [ACK] Seq=15089 Ack=174628 Win=8434 Len=0"
"7.112914","5.9.29.183","172.19.0.3","TLSv1.2","1516","Application Data [TCP segment of a reassembled PDU]"
"7.112937","5.9.29.183","172.19.0.3","TCP","1492","9002 → 43520 [PSH, ACK] Seq=176088 Ack=15089 Win=65535 Len=1436 [TCP segment of a reassembled PDU]"
"7.112947","172.19.0.3","5.9.29.183","TCP","56","43520 → 9002 [ACK] Seq=15089 Ack=177524 Win=8458 Len=0"
"7.113236","172.19.0.3","5.9.29.183","TLSv1.2","599","Application Data"
"7.113473","5.9.29.183","172.19.0.3","TCP","56","9002 → 43520 [ACK] Seq=177524 Ack=15632 Win=65535 Len=0"
"7.118280","5.9.29.183","172.19.0.3","TLSv1.2","1408","Application Data"
"7.128104","5.9.29.183","172.19.0.3","TCP","1516","[TCP segment of a reassembled PDU]"
"7.128123","172.19.0.3","5.9.29.183","TCP","56","43520 → 9002 [ACK] Seq=15632 Ack=180336 Win=8466 Len=0"
"7.128136","5.9.29.183","172.19.0.3","TCP","1492","9002 → 43520 [PSH, ACK] Seq=180336 Ack=15632 Win=65535 Len=1436 [TCP segment of a reassembled PDU]"
"7.133427","5.9.29.183","172.19.0.3","TLSv1.2","1330","Application Data, Application Data"
"7.133445","172.19.0.3","5.9.29.183","TCP","56","43520 → 9002 [ACK] Seq=15632 Ack=183046 Win=8466 Len=0"
"7.133738","172.19.0.3","5.9.29.183","TLSv1.2","599","Application Data"
"7.133971","5.9.29.183","172.19.0.3","TCP","56","9002 → 43520 [ACK] Seq=183046 Ack=16175 Win=65535 Len=0"
"7.145841","5.9.29.183","172.19.0.3","TCP","1504","[TCP segment of a reassembled PDU]"
"7.145868","5.9.29.183","172.19.0.3","TCP","1504","9002 → 43520 [PSH, ACK] Seq=184494 Ack=16175 Win=65535 Len=1448 [TCP segment of a reassembled PDU]"
"7.145965","172.19.0.3","5.9.29.183","TCP","56","43520 → 9002 [ACK] Seq=16175 Ack=185942 Win=8458 Len=0"
"7.148916","5.9.29.183","172.19.0.3","TLSv1.2","787","Application Data"
"7.189505","172.19.0.3","5.9.29.183","TCP","56","43520 → 9002 [ACK] Seq=16175 Ack=186673 Win=8466 Len=0"
"7.189738","5.9.29.183","172.19.0.3","TCP","1516","[TCP segment of a reassembled PDU]"
"7.189750","172.19.0.3","5.9.29.183","TCP","56","43520 → 9002 [ACK] Seq=16175 Ack=188133 Win=8466 Len=0"
"7.189757","5.9.29.183","172.19.0.3","TCP","1492","9002 → 43520 [PSH, ACK] Seq=188133 Ack=16175 Win=65535 Len=1436 [TCP segment of a reassembled PDU]"
"7.189766","172.19.0.3","5.9.29.183","TCP","56","43520 → 9002 [ACK] Seq=16175 Ack=189569 Win=8458 Len=0"
"7.189839","5.9.29.183","172.19.0.3","TLSv1.2","1237","Application Data"
"7.189958","172.19.0.3","5.9.29.183","TCP","56","43520 → 9002 [ACK] Seq=16175 Ack=190750 Win=8466 Len=0"
"7.205032","5.9.29.183","172.19.0.3","TLSv1.2","149","Application Data"
"7.205147","172.19.0.3","5.9.29.183","TCP","56","43520 → 9002 [ACK] Seq=16175 Ack=190843 Win=8466 Len=0"
"7.205891","5.9.29.183","172.19.0.3","TCP","1504","[TCP segment of a reassembled PDU]"
"7.205987","5.9.29.183","172.19.0.3","TCP","1516","9002 → 43520 [PSH, ACK] Seq=192291 Ack=16175 Win=65535 Len=1460 [TCP segment of a reassembled PDU]"
"7.206030","5.9.29.183","172.19.0.3","TLSv1.2","1492","Application Data [TCP segment of a reassembled PDU]"
"7.206077","5.9.29.183","172.19.0.3","TCP","1516","9002 → 43520 [PSH, ACK] Seq=195187 Ack=16175 Win=65535 Len=1460 [TCP segment of a reassembled PDU]"
"7.206112","5.9.29.183","172.19.0.3","TCP","1516","9002 → 43520 [PSH, ACK] Seq=196647 Ack=16175 Win=65535 Len=1460 [TCP segment of a reassembled PDU]"
"7.206144","5.9.29.183","172.19.0.3","TLSv1.2","1516","Application Data [TCP segment of a reassembled PDU]"
"7.206180","5.9.29.183","172.19.0.3","TCP","694","9002 → 43520 [PSH, ACK] Seq=199567 Ack=16175 Win=65535 Len=638 [TCP segment of a reassembled PDU]"
"7.206228","5.9.29.183","172.19.0.3","TCP","1516","9002 → 43520 [PSH, ACK] Seq=200205 Ack=16175 Win=65535 Len=1460 [TCP segment of a reassembled PDU]"
"7.206260","5.9.29.183","172.19.0.3","TCP","818","9002 → 43520 [PSH, ACK] Seq=201665 Ack=16175 Win=65535 Len=762 [TCP segment of a reassembled PDU]"
"7.206264","172.19.0.3","5.9.29.183","TCP","56","43520 → 9002 [ACK] Seq=16175 Ack=200205 Win=8418 Len=0"
"7.206312","172.19.0.3","5.9.29.183","TCP","56","43520 → 9002 [ACK] Seq=16175 Ack=202427 Win=8402 Len=0"
"7.220545","5.9.29.183","172.19.0.3","TLSv1.2","381","Application Data"
"7.220649","172.19.0.3","5.9.29.183","TCP","56","43520 → 9002 [ACK] Seq=16175 Ack=202752 Win=8466 Len=0"
"7.230070","5.9.29.183","172.19.0.3","TCP","1516","[TCP segment of a reassembled PDU]"
"7.230084","5.9.29.183","172.19.0.3","TCP","1492","9002 → 43520 [PSH, ACK] Seq=204212 Ack=16175 Win=65535 Len=1436 [TCP segment of a reassembled PDU]"
"7.230156","5.9.29.183","172.19.0.3","TLSv1.2","1516","Application Data [TCP segment of a reassembled PDU]"
"7.230207","5.9.29.183","172.19.0.3","TLSv1.2","1516","Application Data [TCP segment of a reassembled PDU]"
"7.230250","5.9.29.183","172.19.0.3","TCP","1516","9002 → 43520 [PSH, ACK] Seq=208568 Ack=16175 Win=65535 Len=1460 [TCP segment of a reassembled PDU]"
"7.230291","5.9.29.183","172.19.0.3","TCP","1468","9002 → 43520 [PSH, ACK] Seq=210028 Ack=16175 Win=65535 Len=1412 [TCP segment of a reassembled PDU]"
"7.230321","172.19.0.3","5.9.29.183","TCP","56","43520 → 9002 [ACK] Seq=16175 Ack=211440 Win=8424 Len=0"
"7.230410","5.9.29.183","172.19.0.3","TLSv1.2","1516","Application Data [TCP segment of a reassembled PDU]"
"7.230489","5.9.29.183","172.19.0.3","TCP","1492","9002 → 43520 [PSH, ACK] Seq=212900 Ack=16175 Win=65535 Len=1436 [TCP segment of a reassembled PDU]"
"7.230549","5.9.29.183","172.19.0.3","TLSv1.2","1504","Application Data [TCP segment of a reassembled PDU]"
"7.230711","172.19.0.3","5.9.29.183","TCP","56","43520 → 9002 [ACK] Seq=16175 Ack=215784 Win=8400 Len=0"
"7.230863","172.19.0.3","5.9.29.183","TLSv1.2","599","Application Data"
"7.231071","5.9.29.183","172.19.0.3","TCP","56","9002 → 43520 [ACK] Seq=215784 Ack=16718 Win=65535 Len=0"
"7.241459","5.9.29.183","172.19.0.3","TLSv1.2","533","Application Data"
"7.245652","172.19.0.3","5.9.29.183","TLSv1.2","599","Application Data"
"7.246025","5.9.29.183","172.19.0.3","TCP","56","9002 → 43520 [ACK] Seq=216261 Ack=17261 Win=65535 Len=0"
"7.725078","5.9.29.183","172.19.0.3","TLSv1.2","599","Application Data"
"7.725853","172.19.0.3","5.9.29.183","TLSv1.2","599","Application Data"
"7.726432","5.9.29.183","172.19.0.3","TCP","56","9002 → 43520 [ACK] Seq=216804 Ack=17804 Win=65535 Len=0"
"8.190188","5.9.29.183","172.19.0.3","TCP","1504","[TCP segment of a reassembled PDU]"
"8.190266","5.9.29.183","172.19.0.3","TCP","1516","9002 → 43520 [PSH, ACK] Seq=218252 Ack=17804 Win=65535 Len=1460 [TCP segment of a reassembled PDU]"
"8.190276","5.9.29.183","172.19.0.3","TLSv1.2","1225","Application Data"
"8.190340","172.19.0.3","5.9.29.183","TCP","56","43520 → 9002 [ACK] Seq=17804 Ack=220881 Win=8450 Len=0"
"8.190416","5.9.29.183","172.19.0.3","TCP","1516","[TCP segment of a reassembled PDU]"
"8.190420","5.9.29.183","172.19.0.3","TCP","1492","9002 → 43520 [PSH, ACK] Seq=222341 Ack=17804 Win=65535 Len=1436 [TCP segment of a reassembled PDU]"
"8.190439","172.19.0.3","5.9.29.183","TCP","56","43520 → 9002 [ACK] Seq=17804 Ack=223777 Win=8434 Len=0"
"8.205515","5.9.29.183","172.19.0.3","TLSv1.2","337","Application Data"
"8.207417","5.9.29.183","172.19.0.3","TCP","1516","[TCP segment of a reassembled PDU]"
"8.207429","172.19.0.3","5.9.29.183","TCP","56","43520 → 9002 [ACK] Seq=17804 Ack=225518 Win=8466 Len=0"
"8.207436","5.9.29.183","172.19.0.3","TCP","1516","9002 → 43520 [PSH, ACK] Seq=225518 Ack=17804 Win=65535 Len=1460 [TCP segment of a reassembled PDU]"
"8.207441","5.9.29.183","172.19.0.3","TLSv1.2","1516","Application Data [TCP segment of a reassembled PDU]"
"8.207443","5.9.29.183","172.19.0.3","TCP","1468","9002 → 43520 [PSH, ACK] Seq=228438 Ack=17804 Win=65535 Len=1412 [TCP segment of a reassembled PDU]"
"8.207538","5.9.29.183","172.19.0.3","TCP","1504","9002 → 43520 [PSH, ACK] Seq=229850 Ack=17804 Win=65535 Len=1448 [TCP segment of a reassembled PDU]"
"8.207586","172.19.0.3","5.9.29.183","TCP","56","43520 → 9002 [ACK] Seq=17804 Ack=231298 Win=8434 Len=0"
"8.207798","172.19.0.3","5.9.29.183","TLSv1.2","599","Application Data"
"8.208022","5.9.29.183","172.19.0.3","TCP","56","9002 → 43520 [ACK] Seq=231298 Ack=18347 Win=65535 Len=0"
"8.221604","5.9.29.183","172.19.0.3","TLSv1.2","584","Application Data"
"8.244831","5.9.29.183","172.19.0.3","TCP","1504","[TCP segment of a reassembled PDU]"
"8.244858","172.19.0.3","5.9.29.183","TCP","56","43520 → 9002 [ACK] Seq=18347 Ack=233274 Win=8464 Len=0"
"8.244881","5.9.29.183","172.19.0.3","TCP","1516","9002 → 43520 [PSH, ACK] Seq=233274 Ack=18347 Win=65535 Len=1460 [TCP segment of a reassembled PDU]"
"8.244892","5.9.29.183","172.19.0.3","TLSv1.2","775","Application Data"
"8.245085","172.19.0.3","5.9.29.183","TCP","56","43520 → 9002 [ACK] Seq=18347 Ack=235453 Win=8448 Len=0"
"8.255456","5.9.29.183","172.19.0.3","TCP","1504","[TCP segment of a reassembled PDU]"
"8.255511","5.9.29.183","172.19.0.3","TCP","1516","9002 → 43520 [PSH, ACK] Seq=236901 Ack=18347 Win=65535 Len=1460 [TCP segment of a reassembled PDU]"
"8.255525","172.19.0.3","5.9.29.183","TCP","56","43520 → 9002 [ACK] Seq=18347 Ack=238361 Win=8458 Len=0"
"8.255528","5.9.29.183","172.19.0.3","TLSv1.2","1492","Application Data [TCP segment of a reassembled PDU]"
"8.255530","5.9.29.183","172.19.0.3","TCP","1516","9002 → 43520 [PSH, ACK] Seq=239797 Ack=18347 Win=65535 Len=1460 [TCP segment of a reassembled PDU]"
"8.255678","5.9.29.183","172.19.0.3","TCP","1516","9002 → 43520 [PSH, ACK] Seq=241257 Ack=18347 Win=65535 Len=1460 [TCP segment of a reassembled PDU]"
"8.255686","5.9.29.183","172.19.0.3","TLSv1.2","1480","Application Data [TCP segment of a reassembled PDU]"
"8.255690","5.9.29.183","172.19.0.3","TCP","1516","9002 → 43520 [PSH, ACK] Seq=244141 Ack=18347 Win=65535 Len=1460 [TCP segment of a reassembled PDU]"
"8.255714","5.9.29.183","172.19.0.3","TCP","1516","9002 → 43520 [PSH, ACK] Seq=245601 Ack=18347 Win=65535 Len=1460 [TCP segment of a reassembled PDU]"
"8.255726","5.9.29.183","172.19.0.3","TLSv1.2","1480","Application Data [TCP segment of a reassembled PDU]"
"8.255805","172.19.0.3","5.9.29.183","TCP","56","43520 → 9002 [ACK] Seq=18347 Ack=248485 Win=8402 Len=0"
"8.256224","172.19.0.3","5.9.29.183","TLSv1.2","599","Application Data"
"8.256379","5.9.29.183","172.19.0.3","TCP","56","9002 → 43520 [ACK] Seq=248485 Ack=18890 Win=65535 Len=0"
"8.259781","5.9.29.183","172.19.0.3","TCP","1504","9002 → 43520 [PSH, ACK] Seq=248485 Ack=18890 Win=65535 Len=1448 [TCP segment of a reassembled PDU]"
"8.259881","5.9.29.183","172.19.0.3","TCP","1504","9002 → 43520 [PSH, ACK] Seq=249933 Ack=18890 Win=65535 Len=1448 [TCP segment of a reassembled PDU]"
"8.259974","172.19.0.3","5.9.29.183","TCP","56","43520 → 9002 [ACK] Seq=18890 Ack=251381 Win=8458 Len=0"
"8.260034","5.9.29.183","172.19.0.3","TLSv1.2","721","Application Data, Application Data"
"8.262169","5.9.29.183","172.19.0.3","TCP","1504","[TCP segment of a reassembled PDU]"
"8.262180","172.19.0.3","5.9.29.183","TCP","56","43520 → 9002 [ACK] Seq=18890 Ack=253494 Win=8466 Len=0"
"8.262186","5.9.29.183","172.19.0.3","TCP","1504","9002 → 43520 [PSH, ACK] Seq=253494 Ack=18890 Win=65535 Len=1448 [TCP segment of a reassembled PDU]"
"8.275055","5.9.29.183","172.19.0.3","TLSv1.2","1330","Application Data, Application Data"
"8.275083","172.19.0.3","5.9.29.183","TCP","56","43520 → 9002 [ACK] Seq=18890 Ack=256216 Win=8466 Len=0"
"8.290316","5.9.29.183","172.19.0.3","TLSv1.2","1113","Application Data"
"8.291226","5.9.29.183","172.19.0.3","TCP","1516","[TCP segment of a reassembled PDU]"
"8.291234","172.19.0.3","5.9.29.183","TCP","56","43520 → 9002 [ACK] Seq=18890 Ack=258733 Win=8466 Len=0"
"8.291239","5.9.29.183","172.19.0.3","TCP","1516","9002 → 43520 [PSH, ACK] Seq=258733 Ack=18890 Win=65535 Len=1460 [TCP segment of a reassembled PDU]"
"8.291243","5.9.29.183","172.19.0.3","TLSv1.2","1516","Application Data [TCP segment of a reassembled PDU]"
"8.291319","5.9.29.183","172.19.0.3","TCP","1468","9002 → 43520 [PSH, ACK] Seq=261653 Ack=18890 Win=65535 Len=1412 [TCP segment of a reassembled PDU]"
"8.291325","5.9.29.183","172.19.0.3","TCP","1504","9002 → 43520 [PSH, ACK] Seq=263065 Ack=18890 Win=65535 Len=1448 [TCP segment of a reassembled PDU]"
"8.291352","172.19.0.3","5.9.29.183","TCP","56","43520 → 9002 [ACK] Seq=18890 Ack=264513 Win=8432 Len=0"
"8.305221","5.9.29.183","172.19.0.3","TLSv1.2","584","Application Data"
"8.312562","5.9.29.183","172.19.0.3","TCP","756","[TCP segment of a reassembled PDU]"
"8.312677","5.9.29.183","172.19.0.3","TCP","1516","9002 → 43520 [PSH, ACK] Seq=265741 Ack=18890 Win=65535 Len=1460 [TCP segment of a reassembled PDU]"
"8.312688","172.19.0.3","5.9.29.183","TCP","56","43520 → 9002 [ACK] Seq=18890 Ack=267201 Win=8458 Len=0"
"8.312690","5.9.29.183","172.19.0.3","TCP","792","9002 → 43520 [PSH, ACK] Seq=267201 Ack=18890 Win=65535 Len=736 [TCP segment of a reassembled PDU]"
"8.320880","5.9.29.183","172.19.0.3","TLSv1.2","1330","Application Data, Application Data"
"8.320893","172.19.0.3","5.9.29.183","TCP","56","43520 → 9002 [ACK] Seq=18890 Ack=269211 Win=8466 Len=0"
"8.321147","172.19.0.3","5.9.29.183","TLSv1.2","599","Application Data"
"8.321312","5.9.29.183","172.19.0.3","TCP","56","9002 → 43520 [ACK] Seq=269211 Ack=19433 Win=65535 Len=0"
"8.323927","5.9.29.183","172.19.0.3","TCP","1504","[TCP segment of a reassembled PDU]"
"8.323944","5.9.29.183","172.19.0.3","TCP","1516","9002 → 43520 [PSH, ACK] Seq=270659 Ack=19433 Win=65535 Len=1460 [TCP segment of a reassembled PDU]"
"8.323986","5.9.29.183","172.19.0.3","TLSv1.2","1492","Application Data [TCP segment of a reassembled PDU]"
"8.324035","5.9.29.183","172.19.0.3","TCP","1516","9002 → 43520 [PSH, ACK] Seq=273555 Ack=19433 Win=65535 Len=1460 [TCP segment of a reassembled PDU]"
"8.324039","5.9.29.183","172.19.0.3","TCP","1492","9002 → 43520 [PSH, ACK] Seq=275015 Ack=19433 Win=65535 Len=1436 [TCP segment of a reassembled PDU]"
"8.324077","172.19.0.3","5.9.29.183","TCP","56","43520 → 9002 [ACK] Seq=19433 Ack=276451 Win=8434 Len=0"
"8.335878","5.9.29.183","172.19.0.3","TLSv1.2","70","Application Data"
"8.345915","5.9.29.183","172.19.0.3","TCP","1504","[TCP segment of a reassembled PDU]"
"8.345941","172.19.0.3","5.9.29.183","TCP","56","43520 → 9002 [ACK] Seq=19433 Ack=277913 Win=8466 Len=0"
"8.345962","5.9.29.183","172.19.0.3","TCP","1504","9002 → 43520 [PSH, ACK] Seq=277913 Ack=19433 Win=65535 Len=1448 [TCP segment of a reassembled PDU]"
"8.350903","5.9.29.183","172.19.0.3","TLSv1.2","1330","Application Data, Application Data"
"8.350991","172.19.0.3","5.9.29.183","TCP","56","43520 → 9002 [ACK] Seq=19433 Ack=280635 Win=8466 Len=0"
"8.351314","172.19.0.3","5.9.29.183","TLSv1.2","599","Application Data"
"8.351464","5.9.29.183","172.19.0.3","TCP","56","9002 → 43520 [ACK] Seq=280635 Ack=19976 Win=65535 Len=0"
"8.361637","172.19.0.3","5.9.29.183","TLSv1.2","599","Application Data"
"8.362031","5.9.29.183","172.19.0.3","TCP","56","9002 → 43520 [ACK] Seq=280635 Ack=20519 Win=65535 Len=0"
"8.881851","5.9.29.183","172.19.0.3","TLSv1.2","599","Application Data"
"8.882407","172.19.0.3","5.9.29.183","TLSv1.2","599","Application Data"
"8.882653","5.9.29.183","172.19.0.3","TCP","56","9002 → 43520 [ACK] Seq=281178 Ack=21062 Win=65535 Len=0"
"9.348520","5.9.29.183","172.19.0.3","TLSv1.2","599","Application Data"
"9.383446","5.9.29.183","172.19.0.3","TCP","1504","[TCP segment of a reassembled PDU]"
"9.383497","172.19.0.3","5.9.29.183","TCP","56","43520 → 9002 [ACK] Seq=21062 Ack=283169 Win=8466 Len=0"
"9.383611","5.9.29.183","172.19.0.3","TCP","1504","9002 → 43520 [PSH, ACK] Seq=283169 Ack=21062 Win=65535 Len=1448 [TCP segment of a reassembled PDU]"
"9.383619","5.9.29.183","172.19.0.3","TLSv1.2","787","Application Data"
"9.383676","172.19.0.3","5.9.29.183","TCP","56","43520 → 9002 [ACK] Seq=21062 Ack=285348 Win=8450 Len=0"
"9.417884","5.9.29.183","172.19.0.3","TCP","1504","[TCP segment of a reassembled PDU]"
"9.417911","5.9.29.183","172.19.0.3","TCP","1516","9002 → 43520 [PSH, ACK] Seq=286796 Ack=21062 Win=65535 Len=1460 [TCP segment of a reassembled PDU]"
"9.417921","172.19.0.3","5.9.29.183","TCP","56","43520 → 9002 [ACK] Seq=21062 Ack=288256 Win=8458 Len=0"
"9.417923","5.9.29.183","172.19.0.3","TLSv1.2","775","Application Data"
"9.451573","5.9.29.183","172.19.0.3","TLSv1.2","599","Application Data"
"9.451593","172.19.0.3","5.9.29.183","TCP","56","43520 → 9002 [ACK] Seq=21062 Ack=289518 Win=8466 Len=0"
"9.521020","5.9.29.183","172.19.0.3","TCP","1504","[TCP segment of a reassembled PDU]"
"9.521044","5.9.29.183","172.19.0.3","TCP","1516","9002 → 43520 [PSH, ACK] Seq=290966 Ack=21062 Win=65535 Len=1460 [TCP segment of a reassembled PDU]"
"9.521050","5.9.29.183","172.19.0.3","TLSv1.2","775","Application Data"
"9.521137","172.19.0.3","5.9.29.183","TCP","56","43520 → 9002 [ACK] Seq=21062 Ack=293145 Win=8448 Len=0"
"9.521966","172.19.0.3","5.9.29.183","TLSv1.2","599","Application Data"
"9.522186","5.9.29.183","172.19.0.3","TCP","56","9002 → 43520 [ACK] Seq=293145 Ack=21605 Win=65535 Len=0"
"9.531305","172.19.0.3","5.9.29.183","TLSv1.2","599","Application Data"
"9.531564","5.9.29.183","172.19.0.3","TCP","56","9002 → 43520 [ACK] Seq=293145 Ack=22148 Win=65535 Len=0"
"9.536984","5.9.29.183","172.19.0.3","TLSv1.2","599","Application Data"
"9.581463","172.19.0.3","5.9.29.183","TCP","56","43520 → 9002 [ACK] Seq=22148 Ack=293688 Win=8466 Len=0"
"10.147875","5.9.29.183","172.19.0.3","TLSv1.2","599","Application Data"
"10.147915","172.19.0.3","5.9.29.183","TCP","56","43520 → 9002 [ACK] Seq=22148 Ack=294231 Win=8466 Len=0"
"10.148606","172.19.0.3","5.9.29.183","TLSv1.2","599","Application Data"
"10.148986","5.9.29.183","172.19.0.3","TCP","56","9002 → 43520 [ACK] Seq=294231 Ack=22691 Win=65535 Len=0"
"10.600022","5.9.29.183","172.19.0.3","TLSv1.2","599","Application Data"
"10.641886","172.19.0.3","5.9.29.183","TCP","56","43520 → 9002 [ACK] Seq=22691 Ack=294774 Win=8466 Len=0"
"10.712662","5.9.29.183","172.19.0.3","TCP","1516","[TCP segment of a reassembled PDU]"
"10.712681","172.19.0.3","5.9.29.183","TCP","56","43520 → 9002 [ACK] Seq=22691 Ack=296234 Win=8466 Len=0"
"10.712688","5.9.29.183","172.19.0.3","TLSv1.2","167","Application Data"
"10.712696","172.19.0.3","5.9.29.183","TCP","56","43520 → 9002 [ACK] Seq=22691 Ack=296345 Win=8466 Len=0"
"10.716156","172.19.0.3","5.9.29.183","TLSv1.2","599","Application Data"
"10.716453","5.9.29.183","172.19.0.3","TCP","56","9002 → 43520 [ACK] Seq=296345 Ack=23234 Win=65535 Len=0"
"11.122528","5.9.29.183","172.19.0.3","TLSv1.2","599","Application Data"
"11.124636","172.19.0.3","5.9.29.183","TLSv1.2","599","Application Data"
"11.125203","5.9.29.183","172.19.0.3","TCP","56","9002 → 43520 [ACK] Seq=296888 Ack=23777 Win=65535 Len=0"
"11.575522","5.9.29.183","172.19.0.3","TCP","1504","[TCP segment of a reassembled PDU]"
"11.575550","5.9.29.183","172.19.0.3","TCP","1516","9002 → 43520 [PSH, ACK] Seq=298336 Ack=23777 Win=65535 Len=1460 [TCP segment of a reassembled PDU]"
"11.575556","5.9.29.183","172.19.0.3","TLSv1.2","775","Application Data"
"11.575653","172.19.0.3","5.9.29.183","TCP","56","43520 → 9002 [ACK] Seq=23777 Ack=300515 Win=8450 Len=0"
"11.595115","5.9.29.183","172.19.0.3","TLSv1.2","599","Application Data"
"11.606983","5.9.29.183","172.19.0.3","TCP","1504","[TCP segment of a reassembled PDU]"
"11.607004","172.19.0.3","5.9.29.183","TCP","56","43520 → 9002 [ACK] Seq=23777 Ack=302506 Win=8466 Len=0"
"11.607020","5.9.29.183","172.19.0.3","TCP","1504","9002 → 43520 [PSH, ACK] Seq=302506 Ack=23777 Win=65535 Len=1448 [TCP segment of a reassembled PDU]"
"11.607027","5.9.29.183","172.19.0.3","TLSv1.2","1504","Application Data [TCP segment of a reassembled PDU]"
"11.607142","5.9.29.183","172.19.0.3","TCP","1516","9002 → 43520 [PSH, ACK] Seq=305402 Ack=23777 Win=65535 Len=1460 [TCP segment of a reassembled PDU]"
"11.607188","5.9.29.183","172.19.0.3","TCP","1492","9002 → 43520 [PSH, ACK] Seq=306862 Ack=23777 Win=65535 Len=1436 [TCP segment of a reassembled PDU]"
"11.607255","172.19.0.3","5.9.29.183","TCP","56","43520 → 9002 [ACK] Seq=23777 Ack=308298 Win=8434 Len=0"
"11.619036","5.9.29.183","172.19.0.3","TLSv1.2","70","Application Data"
"11.619060","5.9.29.183","172.19.0.3","TCP","1504","[TCP segment of a reassembled PDU]"
"11.619069","172.19.0.3","5.9.29.183","TCP","56","43520 → 9002 [ACK] Seq=23777 Ack=309760 Win=8464 Len=0"
"11.619071","5.9.29.183","172.19.0.3","TCP","1516","9002 → 43520 [PSH, ACK] Seq=309760 Ack=23777 Win=65535 Len=1460 [TCP segment of a reassembled PDU]"
"11.619073","5.9.29.183","172.19.0.3","TLSv1.2","1516","Application Data [TCP segment of a reassembled PDU]"
"11.619075","5.9.29.183","172.19.0.3","TCP","1480","9002 → 43520 [PSH, ACK] Seq=312680 Ack=23777 Win=65535 Len=1424 [TCP segment of a reassembled PDU]"
"11.619193","172.19.0.3","5.9.29.183","TCP","56","43520 → 9002 [ACK] Seq=23777 Ack=314104 Win=8438 Len=0"
"11.631538","5.9.29.183","172.19.0.3","TCP","1504","9002 → 43520 [PSH, ACK] Seq=314104 Ack=23777 Win=65535 Len=1448 [TCP segment of a reassembled PDU]"
"11.654564","5.9.29.183","172.19.0.3","TLSv1.2","1156","Application Data, Application Data, Application Data"
"11.654583","172.19.0.3","5.9.29.183","TCP","56","43520 → 9002 [ACK] Seq=23777 Ack=316652 Win=8466 Len=0"
"11.698151","5.9.29.183","172.19.0.3","TCP","1504","[TCP segment of a reassembled PDU]"
"11.698179","5.9.29.183","172.19.0.3","TCP","1516","9002 → 43520 [PSH, ACK] Seq=318100 Ack=23777 Win=65535 Len=1460 [TCP segment of a reassembled PDU]"
"11.698185","5.9.29.183","172.19.0.3","TLSv1.2","775","Application Data"
"11.698293","172.19.0.3","5.9.29.183","TCP","56","43520 → 9002 [ACK] Seq=23777 Ack=320279 Win=8450 Len=0"
"11.701650","5.9.29.183","172.19.0.3","TCP","1504","[TCP segment of a reassembled PDU]"
"11.701714","5.9.29.183","172.19.0.3","TCP","1516","9002 → 43520 [PSH, ACK] Seq=321727 Ack=23777 Win=65535 Len=1460 [TCP segment of a reassembled PDU]"
"11.701732","172.19.0.3","5.9.29.183","TCP","56","43520 → 9002 [ACK] Seq=23777 Ack=323187 Win=8458 Len=0"
"11.701735","5.9.29.183","172.19.0.3","TLSv1.2","1516","Application Data [TCP segment of a reassembled PDU]"
"11.701738","5.9.29.183","172.19.0.3","TCP","1480","9002 → 43520 [PSH, ACK] Seq=324647 Ack=23777 Win=65535 Len=1424 [TCP segment of a reassembled PDU]"
"11.701743","5.9.29.183","172.19.0.3","TCP","1516","9002 → 43520 [PSH, ACK] Seq=326071 Ack=23777 Win=65535 Len=1460 [TCP segment of a reassembled PDU]"
"11.701745","5.9.29.183","172.19.0.3","TLSv1.2","1516","Application Data [TCP segment of a reassembled PDU]"
"11.701747","5.9.29.183","172.19.0.3","TCP","1516","9002 → 43520 [PSH, ACK] Seq=328991 Ack=23777 Win=65535 Len=1460 [TCP segment of a reassembled PDU]"
"11.701870","5.9.29.183","172.19.0.3","TCP","882","9002 → 43520 [PSH, ACK] Seq=330451 Ack=23777 Win=65535 Len=826 [TCP segment of a reassembled PDU]"
"11.701880","5.9.29.183","172.19.0.3","TLSv1.2","1516","Application Data [TCP segment of a reassembled PDU]"
"11.702041","5.9.29.183","172.19.0.3","TCP","1516","9002 → 43520 [PSH, ACK] Seq=332737 Ack=23777 Win=65535 Len=1460 [TCP segment of a reassembled PDU]"
"11.702047","5.9.29.183","172.19.0.3","TCP","618","9002 → 43520 [PSH, ACK] Seq=334197 Ack=23777 Win=65535 Len=562 [TCP segment of a reassembled PDU]"
"11.702098","172.19.0.3","5.9.29.183","TCP","56","43520 → 9002 [ACK] Seq=23777 Ack=334759 Win=8385 Len=0"
"11.702285","172.19.0.3","5.9.29.183","TLSv1.2","599","Application Data"
"11.702475","5.9.29.183","172.19.0.3","TCP","56","9002 → 43520 [ACK] Seq=334759 Ack=24320 Win=65535 Len=0"
"11.713485","172.19.0.3","5.9.29.183","TLSv1.2","599","Application Data"
"11.713849","5.9.29.183","172.19.0.3","TCP","56","9002 → 43520 [ACK] Seq=334759 Ack=24863 Win=65535 Len=0"
"11.727770","5.9.29.183","172.19.0.3","TLSv1.2","1516","Application Data [TCP segment of a reassembled PDU]"
"11.727794","5.9.29.183","172.19.0.3","TCP","1516","9002 → 43520 [PSH, ACK] Seq=336219 Ack=24863 Win=65535 Len=1460 [TCP segment of a reassembled PDU]"
"11.727802","5.9.29.183","172.19.0.3","TCP","1516","9002 → 43520 [PSH, ACK] Seq=337679 Ack=24863 Win=65535 Len=1460 [TCP segment of a reassembled PDU]"
"11.727806","5.9.29.183","172.19.0.3","TLSv1.2","562","Application Data [TCP segment of a reassembled PDU]"
"11.727811","5.9.29.183","172.19.0.3","TCP","1516","9002 → 43520 [PSH, ACK] Seq=339645 Ack=24863 Win=65535 Len=1460 [TCP segment of a reassembled PDU]"
"11.727815","5.9.29.183","172.19.0.3","TCP","1492","9002 → 43520 [PSH, ACK] Seq=341105 Ack=24863 Win=65535 Len=1436 [TCP segment of a reassembled PDU]"
"11.727967","5.9.29.183","172.19.0.3","TLSv1.2","1504","Application Data [TCP segment of a reassembled PDU]"
"11.728048","172.19.0.3","5.9.29.183","TCP","56","43520 → 9002 [ACK] Seq=24863 Ack=343989 Win=8416 Len=0"
"11.751238","5.9.29.183","172.19.0.3","TLSv1.2","193","Application Data"
"11.755244","172.19.0.3","5.9.29.183","TLSv1.2","599","Application Data"
"11.755608","5.9.29.183","172.19.0.3","TCP","56","9002 → 43520 [ACK] Seq=344126 Ack=25406 Win=65535 Len=0"
"12.278652","5.9.29.183","172.19.0.3","TLSv1.2","599","Application Data"
"12.279279","172.19.0.3","5.9.29.183","TLSv1.2","599","Application Data"
"12.279483","5.9.29.183","172.19.0.3","TCP","56","9002 → 43520 [ACK] Seq=344669 Ack=25949 Win=65535 Len=0"
"12.689588","5.9.29.183","172.19.0.3","TCP","1516","[TCP segment of a reassembled PDU]"
"12.689626","5.9.29.183","172.19.0.3","TCP","1492","9002 → 43520 [PSH, ACK] Seq=346129 Ack=25949 Win=65535 Len=1436 [TCP segment of a reassembled PDU]"
"12.689632","5.9.29.183","172.19.0.3","TLSv1.2","787","Application Data"
"12.689741","172.19.0.3","5.9.29.183","TCP","56","43520 → 9002 [ACK] Seq=25949 Ack=348296 Win=8450 Len=0"
"12.721906","5.9.29.183","172.19.0.3","TCP","1504","[TCP segment of a reassembled PDU]"
"12.721925","5.9.29.183","172.19.0.3","TCP","1516","9002 → 43520 [PSH, ACK] Seq=349744 Ack=25949 Win=65535 Len=1460 [TCP segment of a reassembled PDU]"
"12.721934","172.19.0.3","5.9.29.183","TCP","56","43520 → 9002 [ACK] Seq=25949 Ack=351204 Win=8458 Len=0"
"12.721936","5.9.29.183","172.19.0.3","TLSv1.2","775","Application Data"
"12.736918","5.9.29.183","172.19.0.3","TCP","1516","[TCP segment of a reassembled PDU]"
"12.736938","172.19.0.3","5.9.29.183","TCP","56","43520 → 9002 [ACK] Seq=25949 Ack=353383 Win=8466 Len=0"
"12.736975","5.9.29.183","172.19.0.3","TCP","1492","9002 → 43520 [PSH, ACK] Seq=353383 Ack=25949 Win=65535 Len=1436 [TCP segment of a reassembled PDU]"
"12.737060","5.9.29.183","172.19.0.3","TLSv1.2","1330","Application Data, Application Data"
"12.737121","172.19.0.3","5.9.29.183","TCP","56","43520 → 9002 [ACK] Seq=25949 Ack=356093 Win=8450 Len=0"
"12.765470","5.9.29.183","172.19.0.3","TCP","1516","[TCP segment of a reassembled PDU]"
"12.765517","5.9.29.183","172.19.0.3","TCP","1492","9002 → 43520 [PSH, ACK] Seq=357553 Ack=25949 Win=65535 Len=1436 [TCP segment of a reassembled PDU]"
"12.765529","172.19.0.3","5.9.29.183","TCP","56","43520 → 9002 [ACK] Seq=25949 Ack=358989 Win=8458 Len=0"
"12.765531","5.9.29.183","172.19.0.3","TLSv1.2","1516","Application Data [TCP segment of a reassembled PDU]"
"12.765533","5.9.29.183","172.19.0.3","TCP","1516","9002 → 43520 [PSH, ACK] Seq=360449 Ack=25949 Win=65535 Len=1460 [TCP segment of a reassembled PDU]"
"12.765538","5.9.29.183","172.19.0.3","TCP","1213","9002 → 43520 [PSH, ACK] Seq=361909 Ack=25949 Win=65535 Len=1157 [TCP segment of a reassembled PDU]"
"12.765621","5.9.29.183","172.19.0.3","TLSv1.2","1516","Application Data [TCP segment of a reassembled PDU]"
"12.765625","5.9.29.183","172.19.0.3","TCP","1492","9002 → 43520 [PSH, ACK] Seq=364526 Ack=25949 Win=65535 Len=1436 [TCP segment of a reassembled PDU]"
"12.765628","5.9.29.183","172.19.0.3","TCP","1504","9002 → 43520 [PSH, ACK] Seq=365962 Ack=25949 Win=65535 Len=1448 [TCP segment of a reassembled PDU]"
"12.765684","172.19.0.3","5.9.29.183","TCP","56","43520 → 9002 [ACK] Seq=25949 Ack=367410 Win=8410 Len=0"
"12.781728","5.9.29.183","172.19.0.3","TLSv1.2","648","Application Data"
"12.781747","5.9.29.183","172.19.0.3","TCP","1516","[TCP segment of a reassembled PDU]"
"12.781757","172.19.0.3","5.9.29.183","TCP","56","43520 → 9002 [ACK] Seq=25949 Ack=369462 Win=8458 Len=0"
"12.781758","5.9.29.183","172.19.0.3","TCP","1516","9002 → 43520 [PSH, ACK] Seq=369462 Ack=25949 Win=65535 Len=1460 [TCP segment of a reassembled PDU]"
"12.781761","5.9.29.183","172.19.0.3","TLSv1.2","1480","Application Data [TCP segment of a reassembled PDU]"
"12.781871","172.19.0.3","5.9.29.183","TCP","56","43520 → 9002 [ACK] Seq=25949 Ack=372346 Win=8440 Len=0"
"12.782233","172.19.0.3","5.9.29.183","TLSv1.2","599","Application Data"
"12.782402","5.9.29.183","172.19.0.3","TCP","56","9002 → 43520 [ACK] Seq=372346 Ack=26492 Win=65535 Len=0"
"12.796530","5.9.29.183","172.19.0.3","TLSv1.2","396","Application Data"
"12.802874","5.9.29.183","172.19.0.3","TCP","1504","[TCP segment of a reassembled PDU]"
"12.802892","172.19.0.3","5.9.29.183","TCP","56","43520 → 9002 [ACK] Seq=26492 Ack=374134 Win=8466 Len=0"
"12.811969","5.9.29.183","172.19.0.3","TLSv1.2","1207","Application Data"
"12.812987","5.9.29.183","172.19.0.3","TCP","1504","[TCP segment of a reassembled PDU]"
"12.813028","172.19.0.3","5.9.29.183","TCP","56","43520 → 9002 [ACK] Seq=26492 Ack=376733 Win=8466 Len=0"
"12.813156","5.9.29.183","172.19.0.3","TCP","1504","9002 → 43520 [PSH, ACK] Seq=376733 Ack=26492 Win=65535 Len=1448 [TCP segment of a reassembled PDU]"
"12.813163","5.9.29.183","172.19.0.3","TLSv1.2","1504","Application Data [TCP segment of a reassembled PDU]"
"12.813191","172.19.0.3","5.9.29.183","TCP","56","43520 → 9002 [ACK] Seq=26492 Ack=379629 Win=8450 Len=0"
"12.827210","5.9.29.183","172.19.0.3","TLSv1.2","1424","Application Data"
"12.830358","172.19.0.3","5.9.29.183","TLSv1.2","599","Application Data"
"12.830568","5.9.29.183","172.19.0.3","TCP","56","9002 → 43520 [ACK] Seq=380997 Ack=27035 Win=65535 Len=0"
"13.328558","5.9.29.183","172.19.0.3","TLSv1.2","599","Application Data"
"13.329201","172.19.0.3","5.9.29.183","TLSv1.2","599","Application Data"
"13.329433","5.9.29.183","172.19.0.3","TCP","56","9002 → 43520 [ACK] Seq=381540 Ack=27578 Win=65535 Len=0"
"13.773705","5.9.29.183","172.19.0.3","TCP","1516","[TCP segment of a reassembled PDU]"
"13.773730","5.9.29.183","172.19.0.3","TCP","1492","9002 → 43520 [PSH, ACK] Seq=383000 Ack=27578 Win=65535 Len=1436 [TCP segment of a reassembled PDU]"
"13.773734","5.9.29.183","172.19.0.3","TLSv1.2","787","Application Data"
"13.773851","172.19.0.3","5.9.29.183","TCP","56","43520 → 9002 [ACK] Seq=27578 Ack=385167 Win=8450 Len=0"
"13.789536","5.9.29.183","172.19.0.3","TCP","1504","[TCP segment of a reassembled PDU]"
"13.789558","5.9.29.183","172.19.0.3","TCP","1504","9002 → 43520 [PSH, ACK] Seq=386615 Ack=27578 Win=65535 Len=1448 [TCP segment of a reassembled PDU]"
"13.789568","172.19.0.3","5.9.29.183","TCP","56","43520 → 9002 [ACK] Seq=27578 Ack=388063 Win=8458 Len=0"
"13.789569","5.9.29.183","172.19.0.3","TLSv1.2","1237","Application Data"
"13.789848","172.19.0.3","5.9.29.183","TLSv1.2","599","Application Data"
"13.790008","5.9.29.183","172.19.0.3","TCP","56","9002 → 43520 [ACK] Seq=389244 Ack=28121 Win=65535 Len=0"
"13.805003","5.9.29.183","172.19.0.3","TLSv1.2","149","Application Data"
"13.805661","5.9.29.183","172.19.0.3","TCP","1504","[TCP segment of a reassembled PDU]"
"13.805679","172.19.0.3","5.9.29.183","TCP","56","43520 → 9002 [ACK] Seq=28121 Ack=390785 Win=8466 Len=0"
"13.805871","5.9.29.183","172.19.0.3","TCP","1504","9002 → 43520 [PSH, ACK] Seq=390785 Ack=28121 Win=65535 Len=1448 [TCP segment of a reassembled PDU]"
"13.822285","5.9.29.183","172.19.0.3","TLSv1.2","787","Application Data"
"13.822303","172.19.0.3","5.9.29.183","TCP","56","43520 → 9002 [ACK] Seq=28121 Ack=392964 Win=8466 Len=0"
"13.837251","5.9.29.183","172.19.0.3","TCP","1504","[TCP segment of a reassembled PDU]"
"13.837271","5.9.29.183","172.19.0.3","TCP","1516","9002 → 43520 [PSH, ACK] Seq=394412 Ack=28121 Win=65535 Len=1460 [TCP segment of a reassembled PDU]"
"13.837275","5.9.29.183","172.19.0.3","TLSv1.2","775","Application Data"
"13.837361","172.19.0.3","5.9.29.183","TCP","56","43520 → 9002 [ACK] Seq=28121 Ack=396591 Win=8450 Len=0"
"13.853413","5.9.29.183","172.19.0.3","TCP","278","[TCP segment of a reassembled PDU]"
"13.853480","5.9.29.183","172.19.0.3","TCP","1516","9002 → 43520 [PSH, ACK] Seq=396813 Ack=28121 Win=65535 Len=1460 [TCP segment of a reassembled PDU]"
"13.853499","172.19.0.3","5.9.29.183","TCP","56","43520 → 9002 [ACK] Seq=28121 Ack=398273 Win=8458 Len=0"
"13.853502","5.9.29.183","172.19.0.3","TCP","1516","9002 → 43520 [PSH, ACK] Seq=398273 Ack=28121 Win=65535 Len=1460 [TCP segment of a reassembled PDU]"
"13.853624","5.9.29.183","172.19.0.3","TLSv1.2","991","Application Data"
"13.853716","172.19.0.3","5.9.29.183","TCP","56","43520 → 9002 [ACK] Seq=28121 Ack=400668 Win=8442 Len=0"
"13.868976","5.9.29.183","172.19.0.3","TLSv1.2","149","Application Data"
"13.869313","5.9.29.183","172.19.0.3","TCP","1504","[TCP segment of a reassembled PDU]"
"13.869322","172.19.0.3","5.9.29.183","TCP","56","43520 → 9002 [ACK] Seq=28121 Ack=402209 Win=8466 Len=0"
"13.869436","5.9.29.183","172.19.0.3","TCP","1504","9002 → 43520 [PSH, ACK] Seq=402209 Ack=28121 Win=65535 Len=1448 [TCP segment of a reassembled PDU]"
"13.885004","5.9.29.183","172.19.0.3","TLSv1.2","1330","Application Data, Application Data"
"13.885022","172.19.0.3","5.9.29.183","TCP","56","43520 → 9002 [ACK] Seq=28121 Ack=404931 Win=8466 Len=0"
"13.983604","5.9.29.183","172.19.0.3","TCP","1504","[TCP segment of a reassembled PDU]"
"13.983627","5.9.29.183","172.19.0.3","TCP","1516","9002 → 43520 [PSH, ACK] Seq=406379 Ack=28121 Win=65535 Len=1460 [TCP segment of a reassembled PDU]"
"13.983633","5.9.29.183","172.19.0.3","TLSv1.2","775","Application Data"
"13.983721","172.19.0.3","5.9.29.183","TCP","56","43520 → 9002 [ACK] Seq=28121 Ack=408558 Win=8450 Len=0"
"13.984001","172.19.0.3","5.9.29.183","TLSv1.2","599","Application Data"
"13.984174","5.9.29.183","172.19.0.3","TCP","56","9002 → 43520 [ACK] Seq=408558 Ack=28664 Win=65535 Len=0"
"13.993560","172.19.0.3","5.9.29.183","TLSv1.2","1113","Application Data"
"13.993863","5.9.29.183","172.19.0.3","TCP","56","9002 → 43520 [ACK] Seq=408558 Ack=29721 Win=65535 Len=0"
"14.016123","5.9.29.183","172.19.0.3","TLSv1.2","599","Application Data"
"14.057043","172.19.0.3","5.9.29.183","TCP","56","43520 → 9002 [ACK] Seq=29721 Ack=409101 Win=8466 Len=0"
"14.626238","5.9.29.183","172.19.0.3","TLSv1.2","599","Application Data"
"14.626308","172.19.0.3","5.9.29.183","TCP","56","43520 → 9002 [ACK] Seq=29721 Ack=409644 Win=8466 Len=0"
"14.627063","172.19.0.3","5.9.29.183","TLSv1.2","599","Application Data"
"14.627285","5.9.29.183","172.19.0.3","TCP","56","9002 → 43520 [ACK] Seq=409644 Ack=30264 Win=65535 Len=0"
"15.072032","5.9.29.183","172.19.0.3","TCP","1516","[TCP segment of a reassembled PDU]"
"15.072182","5.9.29.183","172.19.0.3","TCP","1516","9002 → 43520 [PSH, ACK] Seq=411104 Ack=30264 Win=65535 Len=1460 [TCP segment of a reassembled PDU]"
"15.072191","5.9.29.183","172.19.0.3","TLSv1.2","763","Application Data"
"15.072252","172.19.0.3","5.9.29.183","TCP","56","43520 → 9002 [ACK] Seq=30264 Ack=413271 Win=8448 Len=0"
"15.101717","5.9.29.183","172.19.0.3","TLSv1.2","599","Application Data"
"15.103362","5.9.29.183","172.19.0.3","TCP","1516","[TCP segment of a reassembled PDU]"
"15.103370","172.19.0.3","5.9.29.183","TCP","56","43520 → 9002 [ACK] Seq=30264 Ack=415274 Win=8466 Len=0"
"15.103376","5.9.29.183","172.19.0.3","TCP","1492","9002 → 43520 [PSH, ACK] Seq=415274 Ack=30264 Win=65535 Len=1436 [TCP segment of a reassembled PDU]"
"15.118004","5.9.29.183","172.19.0.3","TLSv1.2","1330","Application Data, Application Data"
"15.118022","172.19.0.3","5.9.29.183","TCP","56","43520 → 9002 [ACK] Seq=30264 Ack=417984 Win=8466 Len=0"
"15.120423","5.9.29.183","172.19.0.3","TCP","1516","[TCP segment of a reassembled PDU]"
"15.120442","5.9.29.183","172.19.0.3","TCP","1492","9002 → 43520 [PSH, ACK] Seq=419444 Ack=30264 Win=65535 Len=1436 [TCP segment of a reassembled PDU]"
"15.120507","172.19.0.3","5.9.29.183","TCP","56","43520 → 9002 [ACK] Seq=30264 Ack=420880 Win=8458 Len=0"
"15.147879","5.9.29.183","172.19.0.3","TLSv1.2","787","Application Data"
"15.151425","172.19.0.3","5.9.29.183","TLSv1.2","599","Application Data"
"15.152053","5.9.29.183","172.19.0.3","TCP","56","9002 → 43520 [ACK] Seq=421611 Ack=30807 Win=65535 Len=0"
"15.578382","5.9.29.183","172.19.0.3","TLSv1.2","599","Application Data"
"15.579111","172.19.0.3","5.9.29.183","TLSv1.2","599","Application Data"
"15.579374","5.9.29.183","172.19.0.3","TCP","56","9002 → 43520 [ACK] Seq=422154 Ack=31350 Win=65535 Len=0"
"15.996776","5.9.29.183","172.19.0.3","TLSv1.2","599","Application Data"
"16.013941","5.9.29.183","172.19.0.3","TCP","1516","[TCP segment of a reassembled PDU]"
"16.013958","172.19.0.3","5.9.29.183","TCP","56","43520 → 9002 [ACK] Seq=31350 Ack=424157 Win=8466 Len=0"
"16.013991","5.9.29.183","172.19.0.3","TCP","1516","9002 → 43520 [PSH, ACK] Seq=424157 Ack=31350 Win=65535 Len=1460 [TCP segment of a reassembled PDU]"
"16.014002","5.9.29.183","172.19.0.3","TLSv1.2","763","Application Data"
"16.014113","172.19.0.3","5.9.29.183","TCP","56","43520 → 9002 [ACK] Seq=31350 Ack=426324 Win=8450 Len=0"
"16.024545","5.9.29.183","172.19.0.3","TCP","1504","[TCP segment of a reassembled PDU]"
"16.025297","5.9.29.183","172.19.0.3","TCP","1504","9002 → 43520 [PSH, ACK] Seq=427772 Ack=31350 Win=65535 Len=1448 [TCP segment of a reassembled PDU]"
"16.025328","172.19.0.3","5.9.29.183","TCP","56","43520 → 9002 [ACK] Seq=31350 Ack=429220 Win=8466 Len=0"
"16.025400","5.9.29.183","172.19.0.3","TLSv1.2","1504","Application Data [TCP segment of a reassembled PDU]"
"16.029658","5.9.29.183","172.19.0.3","TLSv1.2","1504","Application Data [TCP segment of a reassembled PDU]"
"16.029672","172.19.0.3","5.9.29.183","TCP","56","43520 → 9002 [ACK] Seq=31350 Ack=432116 Win=8466 Len=0"
"16.029704","5.9.29.183","172.19.0.3","TCP","1504","9002 → 43520 [PSH, ACK] Seq=432116 Ack=31350 Win=65535 Len=1448 [TCP segment of a reassembled PDU]"
"16.031193","5.9.29.183","172.19.0.3","TLSv1.2","613","Application Data"
"16.031203","172.19.0.3","5.9.29.183","TCP","56","43520 → 9002 [ACK] Seq=31350 Ack=434121 Win=8466 Len=0"
"16.061697","5.9.29.183","172.19.0.3","TCP","1504","[TCP segment of a reassembled PDU]"
"16.061745","5.9.29.183","172.19.0.3","TCP","1516","9002 → 43520 [PSH, ACK] Seq=435569 Ack=31350 Win=65535 Len=1460 [TCP segment of a reassembled PDU]"
"16.061751","5.9.29.183","172.19.0.3","TLSv1.2","775","Application Data"
"16.061881","172.19.0.3","5.9.29.183","TCP","56","43520 → 9002 [ACK] Seq=31350 Ack=437748 Win=8450 Len=0"
"16.076898","5.9.29.183","172.19.0.3","TCP","1504","[TCP segment of a reassembled PDU]"
"16.076954","5.9.29.183","172.19.0.3","TCP","1516","9002 → 43520 [PSH, ACK] Seq=439196 Ack=31350 Win=65535 Len=1460 [TCP segment of a reassembled PDU]"
"16.076967","172.19.0.3","5.9.29.183","TCP","56","43520 → 9002 [ACK] Seq=31350 Ack=440656 Win=8458 Len=0"
"16.076979","5.9.29.183","172.19.0.3","TLSv1.2","1318","Application Data, Application Data"
"16.077294","172.19.0.3","5.9.29.183","TLSv1.2","599","Application Data"
"16.077497","5.9.29.183","172.19.0.3","TCP","56","9002 → 43520 [ACK] Seq=441918 Ack=31893 Win=65535 Len=0"
"16.089598","5.9.29.183","172.19.0.3","TCP","1504","[TCP segment of a reassembled PDU]"
"16.089650","5.9.29.183","172.19.0.3","TCP","1516","9002 → 43520 [PSH, ACK] Seq=443366 Ack=31893 Win=65535 Len=1460 [TCP segment of a reassembled PDU]"
"16.089663","172.19.0.3","5.9.29.183","TCP","56","43520 → 9002 [ACK] Seq=31893 Ack=444826 Win=8458 Len=0"
"16.089665","5.9.29.183","172.19.0.3","TLSv1.2","1516","Application Data [TCP segment of a reassembled PDU]"
"16.089668","5.9.29.183","172.19.0.3","TCP","1480","9002 → 43520 [PSH, ACK] Seq=446286 Ack=31893 Win=65535 Len=1424 [TCP segment of a reassembled PDU]"
"16.089718","5.9.29.183","172.19.0.3","TCP","1504","9002 → 43520 [PSH, ACK] Seq=447710 Ack=31893 Win=65535 Len=1448 [TCP segment of a reassembled PDU]"
"16.089790","172.19.0.3","5.9.29.183","TCP","56","43520 → 9002 [ACK] Seq=31893 Ack=449158 Win=8432 Len=0"
"16.093306","5.9.29.183","172.19.0.3","TLSv1.2","70","Application Data"
"16.093671","172.19.0.3","5.9.29.183","TLSv1.2","599","Application Data"
"16.093858","5.9.29.183","172.19.0.3","TCP","56","9002 → 43520 [ACK] Seq=449172 Ack=32436 Win=65535 Len=0"
"16.104901","5.9.29.183","172.19.0.3","TLSv1.2","1516","Application Data"
"16.104953","5.9.29.183","172.19.0.3","TCP","1516","9002 → 43520 [PSH, ACK] Seq=450632 Ack=32436 Win=65535 Len=1460 [TCP segment of a reassembled PDU]"
"16.104962","5.9.29.183","172.19.0.3","TCP","1516","9002 → 43520 [PSH, ACK] Seq=452092 Ack=32436 Win=65535 Len=1460 [TCP segment of a reassembled PDU]"
"16.104967","5.9.29.183","172.19.0.3","TLSv1.2","1468","Application Data [TCP segment of a reassembled PDU]"
"16.105070","172.19.0.3","5.9.29.183","TCP","56","43520 → 9002 [ACK] Seq=32436 Ack=454964 Win=8442 Len=0"
"16.105194","5.9.29.183","172.19.0.3","TCP","1504","9002 → 43520 [PSH, ACK] Seq=454964 Ack=32436 Win=65535 Len=1448 [TCP segment of a reassembled PDU]"
"16.108756","5.9.29.183","172.19.0.3","TLSv1.2","1127","Application Data"
"16.108777","172.19.0.3","5.9.29.183","TCP","56","43520 → 9002 [ACK] Seq=32436 Ack=457483 Win=8466 Len=0"
"16.124374","5.9.29.183","172.19.0.3","TCP","1516","[TCP segment of a reassembled PDU]"
"16.124422","5.9.29.183","172.19.0.3","TLSv1.2","681","Application Data"
"16.124562","172.19.0.3","5.9.29.183","TCP","56","43520 → 9002 [ACK] Seq=32436 Ack=459568 Win=8458 Len=0"
