_ws.col.Time,_ws.col.Source,_ws.col.Destination,_ws.col.Protocol,_ws.col.Length,_ws.col.Info
"0.000000","172.19.0.3","5.9.29.183","TLSv1.2","599","Application Data"
"0.000324","5.9.29.183","172.19.0.3","TCP","56","9002 → 43520 [ACK] Seq=1 Ack=544 Win=65535 Len=0"
"1.275853","5.9.29.183","172.19.0.3","TLSv1.2","599","Application Data"
"1.275954","172.19.0.3","5.9.29.183","TCP","56","43520 → 9002 [ACK] Seq=544 Ack=544 Win=11911 Len=0"
"1.276784","172.19.0.3","5.9.29.183","TLSv1.2","2141","Application Data"
"1.277154","5.9.29.183","172.19.0.3","TCP","56","9002 → 43520 [ACK] Seq=544 Ack=2629 Win=65535 Len=0"
"1.925016","5.9.29.183","172.19.0.3","TLSv1.2","599","Application Data"
"1.971233","172.19.0.3","5.9.29.183","TCP","56","43520 → 9002 [ACK] Seq=2629 Ack=1087 Win=11911 Len=0"
"5.130189","02:42:7b:11:31:3d","","ARP","44","Who has 172.19.0.3? Tell 172.19.0.1"
"5.130204","02:42:ac:13:00:03","","ARP","44","172.19.0.3 is at 02:42:ac:13:00:03"
"8.482344","5.9.29.183","172.19.0.3","TLSv1.2","599","Application Data"
"8.482370","172.19.0.3","5.9.29.183","TCP","56","43520 → 9002 [ACK] Seq=2629 Ack=1630 Win=11911 Len=0"
"12.052762","5.9.29.183","172.19.0.3","TLSv1.2","1113","Application Data"
"12.052790","172.19.0.3","5.9.29.183","TCP","56","43520 → 9002 [ACK] Seq=2629 Ack=2687 Win=11911 Len=0"
"12.057007","172.19.0.3","5.9.29.183","TLSv1.2","599","Application Data"
"12.057349","5.9.29.183","172.19.0.3","TCP","56","9002 → 43520 [ACK] Seq=2687 Ack=3172 Win=65535 Len=0"
"12.495812","5.9.29.183","172.19.0.3","TLSv1.2","599","Application Data"
"12.496531","172.19.0.3","5.9.29.183","TLSv1.2","599","Application Data"
"12.496979","5.9.29.183","172.19.0.3","TCP","56","9002 → 43520 [ACK] Seq=3230 Ack=3715 Win=65535 Len=0"
"12.961863","5.9.29.183","172.19.0.3","TCP","1516","[TCP segment of a reassembled PDU]"
"12.961965","5.9.29.183","172.19.0.3","TCP","1492","9002 → 43520 [PSH, ACK] Seq=4690 Ack=3715 Win=65535 Len=1436 [TCP segment of a reassembled PDU]"
"12.962001","5.9.29.183","172.19.0.3","TLSv1.2","787","Application Data"
"12.962106","172.19.0.3","5.9.29.183","TCP","56","43520 → 9002 [ACK] Seq=3715 Ack=6857 Win=11893 Len=0"
"12.977558","5.9.29.183","172.19.0.3","TLSv1.2","599","Application Data"
"13.018619","172.19.0.3","5.9.29.183","TCP","56","43520 → 9002 [ACK] Seq=3715 Ack=7400 Win=11911 Len=0"
"13.051464","5.9.29.183","172.19.0.3","TCP","1516","[TCP segment of a reassembled PDU]"
"13.051491","172.19.0.3","5.9.29.183","TCP","56","43520 → 9002 [ACK] Seq=3715 Ack=8860 Win=11911 Len=0"
"13.051599","5.9.29.183","172.19.0.3","TCP","1492","9002 → 43520 [PSH, ACK] Seq=8860 Ack=3715 Win=65535 Len=1436 [TCP segment of a reassembled PDU]"
"13.051619","172.19.0.3","5.9.29.183","TCP","56","43520 → 9002 [ACK] Seq=3715 Ack=10296 Win=11903 Len=0"
"13.051720","5.9.29.183","172.19.0.3","TLSv1.2","787","Application Data"
"13.051729","172.19.0.3","5.9.29.183","TCP","56","43520 → 9002 [ACK] Seq=3715 Ack=11027 Win=11911 Len=0"
"13.061302","5.9.29.183","172.19.0.3","TCP","1504","[TCP segment of a reassembled PDU]"
"13.061330","172.19.0.3","5.9.29.183","TCP","56","43520 → 9002 [ACK] Seq=3715 Ack=12475 Win=11911 Len=0"
"13.061553","5.9.29.183","172.19.0.3","TCP","1504","9002 → 43520 [PSH, ACK] Seq=12475 Ack=3715 Win=65535 Len=1448 [TCP segment of a reassembled PDU]"
"13.061595","172.19.0.3","5.9.29.183","TCP","56","43520 → 9002 [ACK] Seq=3715 Ack=13923 Win=11903 Len=0"
"13.061599","5.9.29.183","172.19.0.3","TCP","664","9002 → 43520 [PSH, ACK] Seq=13923 Ack=3715 Win=65535 Len=608 [TCP segment of a reassembled PDU]"
"13.061607","172.19.0.3","5.9.29.183","TCP","56","43520 → 9002 [ACK] Seq=3715 Ack=14531 Win=11899 Len=0"
"13.061608","5.9.29.183","172.19.0.3","TLSv1.2","1516","Application Data [TCP segment of a reassembled PDU]"
"13.061617","172.19.0.3","5.9.29.183","TCP","56","43520 → 9002 [ACK] Seq=3715 Ack=15991 Win=11888 Len=0"
"13.061731","5.9.29.183","172.19.0.3","TCP","1516","9002 → 43520 [PSH, ACK] Seq=15991 Ack=3715 Win=65535 Len=1460 [TCP segment of a reassembled PDU]"
"13.061740","172.19.0.3","5.9.29.183","TCP","56","43520 → 9002 [ACK] Seq=3715 Ack=17451 Win=11879 Len=0"
"13.061742","5.9.29.183","172.19.0.3","TCP","872","9002 → 43520 [PSH, ACK] Seq=17451 Ack=3715 Win=65535 Len=816 [TCP segment of a reassembled PDU]"
"13.061748","172.19.0.3","5.9.29.183","TCP","56","43520 → 9002 [ACK] Seq=3715 Ack=18267 Win=11873 Len=0"
"13.067220","5.9.29.183","172.19.0.3","TLSv1.2","1127","Application Data, Application Data"
"13.067246","172.19.0.3","5.9.29.183","TCP","56","43520 → 9002 [ACK] Seq=3715 Ack=19338 Win=11911 Len=0"
"13.077492","5.9.29.183","172.19.0.3","TCP","1516","[TCP segment of a reassembled PDU]"
"13.077516","172.19.0.3","5.9.29.183","TCP","56","43520 → 9002 [ACK] Seq=3715 Ack=20798 Win=11911 Len=0"
"13.077573","5.9.29.183","172.19.0.3","TCP","1492","9002 → 43520 [PSH, ACK] Seq=20798 Ack=3715 Win=65535 Len=1436 [TCP segment of a reassembled PDU]"
"13.077585","172.19.0.3","5.9.29.183","TCP","56","43520 → 9002 [ACK] Seq=3715 Ack=22234 Win=11903 Len=0"
"13.082628","5.9.29.183","172.19.0.3","TLSv1.2","1330","Application Data, Application Data"
"13.082654","172.19.0.3","5.9.29.183","TCP","56","43520 → 9002 [ACK] Seq=3715 Ack=23508 Win=11911 Len=0"
"13.083053","172.19.0.3","5.9.29.183","TLSv1.2","599","Application Data"
"13.083325","5.9.29.183","172.19.0.3","TCP","56","9002 → 43520 [ACK] Seq=23508 Ack=4258 Win=65535 Len=0"
"13.145672","5.9.29.183","172.19.0.3","TCP","1516","[TCP segment of a reassembled PDU]"
"13.145786","5.9.29.183","172.19.0.3","TCP","1492","9002 → 43520 [PSH, ACK] Seq=24968 Ack=4258 Win=65535 Len=1436 [TCP segment of a reassembled PDU]"
"13.145827","5.9.29.183","172.19.0.3","TLSv1.2","1237","Application Data"
"13.145831","5.9.29.183","172.19.0.3","TCP","1516","[TCP segment of a reassembled PDU]"
"13.145945","172.19.0.3","5.9.29.183","TCP","56","43520 → 9002 [ACK] Seq=4258 Ack=29045 Win=11887 Len=0"
"13.145947","5.9.29.183","172.19.0.3","TCP","1492","9002 → 43520 [PSH, ACK] Seq=29045 Ack=4258 Win=65535 Len=1436 [TCP segment of a reassembled PDU]"
"13.157670","5.9.29.183","172.19.0.3","TLSv1.2","1516","Application Data [TCP segment of a reassembled PDU]"
"13.157691","172.19.0.3","5.9.29.183","TCP","56","43520 → 9002 [ACK] Seq=4258 Ack=31941 Win=11911 Len=0"
"13.157747","5.9.29.183","172.19.0.3","TCP","1516","9002 → 43520 [PSH, ACK] Seq=31941 Ack=4258 Win=65535 Len=1460 [TCP segment of a reassembled PDU]"
"13.157793","5.9.29.183","172.19.0.3","TCP","1516","9002 → 43520 [PSH, ACK] Seq=33401 Ack=4258 Win=65535 Len=1460 [TCP segment of a reassembled PDU]"
"13.157802","5.9.29.183","172.19.0.3","TLSv1.2","1468","Application Data [TCP segment of a reassembled PDU]"
"13.157959","172.19.0.3","5.9.29.183","TCP","56","43520 → 9002 [ACK] Seq=4258 Ack=36273 Win=11887 Len=0"
"13.158090","5.9.29.183","172.19.0.3","TCP","1504","9002 → 43520 [PSH, ACK] Seq=36273 Ack=4258 Win=65535 Len=1448 [TCP segment of a reassembled PDU]"
"13.158223","172.19.0.3","5.9.29.183","TLSv1.2","599","Application Data"
"13.158480","5.9.29.183","172.19.0.3","TCP","56","9002 → 43520 [ACK] Seq=37721 Ack=4801 Win=65535 Len=0"
"13.161541","5.9.29.183","172.19.0.3","TCP","1516","9002 → 43520 [PSH, ACK] Seq=37721 Ack=4801 Win=65535 Len=1460 [TCP segment of a reassembled PDU]"
"13.161613","5.9.29.183","172.19.0.3","TLSv1.2","1516","Application Data [TCP segment of a reassembled PDU]"
"13.161631","172.19.0.3","5.9.29.183","TCP","56","43520 → 9002 [ACK] Seq=4801 Ack=40641 Win=11903 Len=0"
"13.161634","5.9.29.183","172.19.0.3","TCP","1516","9002 → 43520 [PSH, ACK] Seq=40641 Ack=4801 Win=65535 Len=1460 [TCP segment of a reassembled PDU]"
"13.161638","5.9.29.183","172.19.0.3","TLSv1.2","1468","Application Data [TCP segment of a reassembled PDU]"
"13.161707","5.9.29.183","172.19.0.3","TLSv1.2","1299","Application Data"
"13.161774","172.19.0.3","5.9.29.183","TCP","56","43520 → 9002 [ACK] Seq=4801 Ack=44756 Win=11879 Len=0"
"13.170746","5.9.29.183","172.19.0.3","TCP","1504","[TCP segment of a reassembled PDU]"
"13.170907","5.9.29.183","172.19.0.3","TCP","1504","9002 → 43520 [PSH, ACK] Seq=46204 Ack=4801 Win=65535 Len=1448 [TCP segment of a reassembled PDU]"
"13.170923","172.19.0.3","5.9.29.183","TCP","56","43520 → 9002 [ACK] Seq=4801 Ack=47652 Win=11903 Len=0"
"13.172875","5.9.29.183","172.19.0.3","TLSv1.2","1504","Application Data [TCP segment of a reassembled PDU]"
"13.173328","5.9.29.183","172.19.0.3","TCP","1504","9002 → 43520 [PSH, ACK] Seq=49100 Ack=4801 Win=65535 Len=1448 [TCP segment of a reassembled PDU]"
"13.173341","172.19.0.3","5.9.29.183","TCP","56","43520 → 9002 [ACK] Seq=4801 Ack=50548 Win=11911 Len=0"
"13.177170","5.9.29.183","172.19.0.3","TLSv1.2","490","Application Data"
"13.222526","172.19.0.3","5.9.29.183","TCP","56","43520 → 9002 [ACK] Seq=4801 Ack=50982 Win=11911 Len=0"
"13.268010","5.9.29.183","172.19.0.3","TCP","1516","[TCP segment of a reassembled PDU]"
"13.268101","5.9.29.183","172.19.0.3","TCP","1492","9002 → 43520 [PSH, ACK] Seq=52442 Ack=4801 Win=65535 Len=1436 [TCP segment of a reassembled PDU]"
"13.268117","5.9.29.183","172.19.0.3","TLSv1.2","273","Application Data"
"13.268275","172.19.0.3","5.9.29.183","TCP","56","43520 → 9002 [ACK] Seq=4801 Ack=54095 Win=11895 Len=0"
"13.273159","172.19.0.3","5.9.29.183","TLSv1.2","599","Application Data"
"13.273409","5.9.29.183","172.19.0.3","TCP","56","9002 → 43520 [ACK] Seq=54095 Ack=5344 Win=65535 Len=0"
"14.488807","5.9.29.183","172.19.0.3","TLSv1.2","599","Application Data"
"14.489698","172.19.0.3","5.9.29.183","TLSv1.2","599","Application Data"
"14.490055","5.9.29.183","172.19.0.3","TCP","56","9002 → 43520 [ACK] Seq=54638 Ack=5887 Win=65535 Len=0"
"15.541357","5.9.29.183","172.19.0.3","TLSv1.2","599","Application Data"
"15.588266","172.19.0.3","5.9.29.183","TCP","56","43520 → 9002 [ACK] Seq=5887 Ack=55181 Win=11911 Len=0"
"15.810064","5.9.29.183","172.19.0.3","TCP","1516","[TCP segment of a reassembled PDU]"
"15.810091","172.19.0.3","5.9.29.183","TCP","56","43520 → 9002 [ACK] Seq=5887 Ack=56641 Win=11911 Len=0"
"15.810215","5.9.29.183","172.19.0.3","TCP","1492","9002 → 43520 [PSH, ACK] Seq=56641 Ack=5887 Win=65535 Len=1436 [TCP segment of a reassembled PDU]"
"15.810241","172.19.0.3","5.9.29.183","TCP","56","43520 → 9002 [ACK] Seq=5887 Ack=58077 Win=11903 Len=0"
"15.810348","5.9.29.183","172.19.0.3","TLSv1.2","787","Application Data"
"15.810356","172.19.0.3","5.9.29.183","TCP","56","43520 → 9002 [ACK] Seq=5887 Ack=58808 Win=11911 Len=0"
"15.810360","5.9.29.183","172.19.0.3","TCP","1516","[TCP segment of a reassembled PDU]"
"15.810365","172.19.0.3","5.9.29.183","TCP","56","43520 → 9002 [ACK] Seq=5887 Ack=60268 Win=11903 Len=0"
"15.810367","5.9.29.183","172.19.0.3","TCP","1492","9002 → 43520 [PSH, ACK] Seq=60268 Ack=5887 Win=65535 Len=1436 [TCP segment of a reassembled PDU]"
"15.810372","172.19.0.3","5.9.29.183","TCP","56","43520 → 9002 [ACK] Seq=5887 Ack=61704 Win=11895 Len=0"
"15.825844","5.9.29.183","172.19.0.3","TLSv1.2","273","Application Data"
"15.825868","172.19.0.3","5.9.29.183","TCP","56","43520 → 9002 [ACK] Seq=5887 Ack=61921 Win=11911 Len=0"
"15.830792","172.19.0.3","5.9.29.183","TLSv1.2","599","Application Data"
"15.831019","5.9.29.183","172.19.0.3","TCP","56","9002 → 43520 [ACK] Seq=61921 Ack=6430 Win=65535 Len=0"
"16.439204","5.9.29.183","172.19.0.3","TLSv1.2","599","Application Data"
"16.440181","172.19.0.3","5.9.29.183","TLSv1.2","599","Application Data"
"16.440478","5.9.29.183","172.19.0.3","TCP","56","9002 → 43520 [ACK] Seq=62464 Ack=6973 Win=65535 Len=0"
"16.992608","5.9.29.183","172.19.0.3","TCP","1516","[TCP segment of a reassembled PDU]"
"16.992691","5.9.29.183","172.19.0.3","TCP","1516","9002 → 43520 [PSH, ACK] Seq=63924 Ack=6973 Win=65535 Len=1460 [TCP segment of a reassembled PDU]"
"16.992705","5.9.29.183","172.19.0.3","TLSv1.2","249","Application Data"
"16.992865","172.19.0.3","5.9.29.183","TCP","56","43520 → 9002 [ACK] Seq=6973 Ack=65577 Win=11895 Len=0"
"17.014341","5.9.29.183","172.19.0.3","TCP","1516","[TCP segment of a reassembled PDU]"
"17.014414","5.9.29.183","172.19.0.3","TCP","1492","9002 → 43520 [PSH, ACK] Seq=67037 Ack=6973 Win=65535 Len=1436 [TCP segment of a reassembled PDU]"
"17.014436","172.19.0.3","5.9.29.183","TCP","56","43520 → 9002 [ACK] Seq=6973 Ack=68473 Win=11903 Len=0"
"17.018805","5.9.29.183","172.19.0.3","TLSv1.2","1237","Application Data"
"17.034868","5.9.29.183","172.19.0.3","TLSv1.2","663","Application Data"
"17.034895","172.19.0.3","5.9.29.183","TCP","56","43520 → 9002 [ACK] Seq=6973 Ack=70261 Win=11911 Len=0"
"17.054042","5.9.29.183","172.19.0.3","TCP","1516","[TCP segment of a reassembled PDU]"
"17.054161","5.9.29.183","172.19.0.3","TCP","1492","9002 → 43520 [PSH, ACK] Seq=71721 Ack=6973 Win=65535 Len=1436 [TCP segment of a reassembled PDU]"
"17.054197","5.9.29.183","172.19.0.3","TLSv1.2","787","Application Data"
"17.054305","172.19.0.3","5.9.29.183","TCP","56","43520 → 9002 [ACK] Seq=6973 Ack=73888 Win=11893 Len=0"
"17.076704","5.9.29.183","172.19.0.3","TCP","1516","[TCP segment of a reassembled PDU]"
"17.076773","5.9.29.183","172.19.0.3","TCP","1492","9002 → 43520 [PSH, ACK] Seq=75348 Ack=6973 Win=65535 Len=1436 [TCP segment of a reassembled PDU]"
"17.076790","172.19.0.3","5.9.29.183","TCP","56","43520 → 9002 [ACK] Seq=6973 Ack=76784 Win=11903 Len=0"
"17.076793","5.9.29.183","172.19.0.3","TLSv1.2","1237","Application Data"
"17.077131","172.19.0.3","5.9.29.183","TLSv1.2","599","Application Data"
"17.077429","5.9.29.183","172.19.0.3","TCP","56","9002 → 43520 [ACK] Seq=77965 Ack=7516 Win=65535 Len=0"
"17.092501","5.9.29.183","172.19.0.3","TLSv1.2","149","Application Data"
"17.133792","172.19.0.3","5.9.29.183","TCP","56","43520 → 9002 [ACK] Seq=7516 Ack=78058 Win=11911 Len=0"
"19.169774","5.9.29.183","172.19.0.3","TCP","1516","[TCP segment of a reassembled PDU]"
"19.169815","172.19.0.3","5.9.29.183","TCP","56","43520 → 9002 [ACK] Seq=7516 Ack=79518 Win=11911 Len=0"
"19.169818","5.9.29.183","172.19.0.3","TCP","605","9002 → 43520 [PSH, ACK] Seq=79518 Ack=7516 Win=65535 Len=549 [TCP segment of a reassembled PDU]"
"19.169828","172.19.0.3","5.9.29.183","TCP","56","43520 → 9002 [ACK] Seq=7516 Ack=80067 Win=11907 Len=0"
"19.169829","5.9.29.183","172.19.0.3","TCP","943","9002 → 43520 [PSH, ACK] Seq=80067 Ack=7516 Win=65535 Len=887 [TCP segment of a reassembled PDU]"
"19.169835","172.19.0.3","5.9.29.183","TCP","56","43520 → 9002 [ACK] Seq=7516 Ack=80954 Win=11901 Len=0"
"19.170373","5.9.29.183","172.19.0.3","TLSv1.2","1237","Application Data"
"19.170384","172.19.0.3","5.9.29.183","TCP","56","43520 → 9002 [ACK] Seq=7516 Ack=82135 Win=11911 Len=0"
"19.170390","5.9.29.183","172.19.0.3","TCP","1516","[TCP segment of a reassembled PDU]"
"19.170432","172.19.0.3","5.9.29.183","TCP","56","43520 → 9002 [ACK] Seq=7516 Ack=83595 Win=11903 Len=0"
"19.170570","5.9.29.183","172.19.0.3","TCP","1516","9002 → 43520 [PSH, ACK] Seq=83595 Ack=7516 Win=65535 Len=1460 [TCP segment of a reassembled PDU]"
"19.170579","172.19.0.3","5.9.29.183","TCP","56","43520 → 9002 [ACK] Seq=7516 Ack=85055 Win=11895 Len=0"
"19.170581","5.9.29.183","172.19.0.3","TLSv1.2","1516","Application Data [TCP segment of a reassembled PDU]"
"19.170588","172.19.0.3","5.9.29.183","TCP","56","43520 → 9002 [ACK] Seq=7516 Ack=86515 Win=11887 Len=0"
"19.170590","5.9.29.183","172.19.0.3","TLSv1.2","1516","Application Data [TCP segment of a reassembled PDU]"
"19.170594","172.19.0.3","5.9.29.183","TCP","56","43520 → 9002 [ACK] Seq=7516 Ack=87975 Win=11879 Len=0"
"19.170806","5.9.29.183","172.19.0.3","TCP","1516","9002 → 43520 [PSH, ACK] Seq=87975 Ack=7516 Win=65535 Len=1460 [TCP segment of a reassembled PDU]"
"19.170817","172.19.0.3","5.9.29.183","TCP","56","43520 → 9002 [ACK] Seq=7516 Ack=89435 Win=11871 Len=0"
"19.170818","5.9.29.183","172.19.0.3","TLSv1.2","1516","Application Data, Application Data"
"19.170823","172.19.0.3","5.9.29.183","TCP","56","43520 → 9002 [ACK] Seq=7516 Ack=90895 Win=11863 Len=0"
"19.170955","5.9.29.183","172.19.0.3","TCP","91","9002 → 43520 [PSH, ACK] Seq=90895 Ack=7516 Win=65535 Len=35 [TCP segment of a reassembled PDU]"
"19.170964","172.19.0.3","5.9.29.183","TCP","56","43520 → 9002 [ACK] Seq=7516 Ack=90930 Win=11863 Len=0"
"19.171594","172.19.0.3","5.9.29.183","TLSv1.2","599","Application Data"
"19.171877","5.9.29.183","172.19.0.3","TCP","56","9002 → 43520 [ACK] Seq=90930 Ack=8059 Win=65535 Len=0"
"19.175191","5.9.29.183","172.19.0.3","TLSv1.2","722","Application Data"
"19.217132","172.19.0.3","5.9.29.183","TCP","56","43520 → 9002 [ACK] Seq=8059 Ack=91596 Win=11911 Len=0"
"19.217578","5.9.29.183","172.19.0.3","TCP","1516","[TCP segment of a reassembled PDU]"
"19.217597","172.19.0.3","5.9.29.183","TCP","56","43520 → 9002 [ACK] Seq=8059 Ack=93056 Win=11909 Len=0"
"19.217609","5.9.29.183","172.19.0.3","TLSv1.2","681","Application Data"
"19.217619","172.19.0.3","5.9.29.183","TCP","56","43520 → 9002 [ACK] Seq=8059 Ack=93681 Win=11905 Len=0"
"20.460839","5.9.29.183","172.19.0.3","TLSv1.2","599","Application Data"
"20.460879","172.19.0.3","5.9.29.183","TCP","56","43520 → 9002 [ACK] Seq=8059 Ack=94224 Win=11911 Len=0"
"20.461794","172.19.0.3","5.9.29.183","TLSv1.2","599","Application Data"
"20.462064","5.9.29.183","172.19.0.3","TCP","56","9002 → 43520 [ACK] Seq=94224 Ack=8602 Win=65535 Len=0"
"20.470605","172.19.0.3","5.9.29.183","TLSv1.2","599","Application Data"
"20.470823","5.9.29.183","172.19.0.3","TCP","56","9002 → 43520 [ACK] Seq=94224 Ack=9145 Win=65535 Len=0"
"20.483354","5.9.29.183","172.19.0.3","TLSv1.2","599","Application Data"
"20.527088","172.19.0.3","5.9.29.183","TCP","56","43520 → 9002 [ACK] Seq=9145 Ack=94767 Win=11911 Len=0"
"27.538261","5.9.29.183","172.19.0.3","TLSv1.2","599","Application Data"
"27.538298","172.19.0.3","5.9.29.183","TCP","56","43520 → 9002 [ACK] Seq=9145 Ack=95310 Win=11911 Len=0"
"27.539009","172.19.0.3","5.9.29.183","TLSv1.2","599","Application Data"
"27.539266","5.9.29.183","172.19.0.3","TCP","56","9002 → 43520 [ACK] Seq=95310 Ack=9688 Win=65535 Len=0"
"28.005325","5.9.29.183","172.19.0.3","TCP","1516","[TCP segment of a reassembled PDU]"
"28.005359","5.9.29.183","172.19.0.3","TCP","1516","9002 → 43520 [PSH, ACK] Seq=96770 Ack=9688 Win=65535 Len=1460 [TCP segment of a reassembled PDU]"
"28.005369","5.9.29.183","172.19.0.3","TLSv1.2","249","Application Data"
"28.005502","172.19.0.3","5.9.29.183","TCP","56","43520 → 9002 [ACK] Seq=9688 Ack=98423 Win=11895 Len=0"
"28.037842","5.9.29.183","172.19.0.3","TLSv1.2","1113","Application Data"
"28.078849","172.19.0.3","5.9.29.183","TCP","56","43520 → 9002 [ACK] Seq=9688 Ack=99480 Win=11911 Len=0"
"28.112403","5.9.29.183","172.19.0.3","TCP","1516","[TCP segment of a reassembled PDU]"
"28.112428","172.19.0.3","5.9.29.183","TCP","56","43520 → 9002 [ACK] Seq=9688 Ack=100940 Win=11911 Len=0"
"28.112444","5.9.29.183","172.19.0.3","TCP","1516","9002 → 43520 [PSH, ACK] Seq=100940 Ack=9688 Win=65535 Len=1460 [TCP segment of a reassembled PDU]"
"28.112458","172.19.0.3","5.9.29.183","TCP","56","43520 → 9002 [ACK] Seq=9688 Ack=102400 Win=11903 Len=0"
"28.112459","5.9.29.183","172.19.0.3","TLSv1.2","763","Application Data"
"28.112465","172.19.0.3","5.9.29.183","TCP","56","43520 → 9002 [ACK] Seq=9688 Ack=103107 Win=11898 Len=0"
"28.135798","5.9.29.183","172.19.0.3","TCP","1516","[TCP segment of a reassembled PDU]"
"28.135820","172.19.0.3","5.9.29.183","TCP","56","43520 → 9002 [ACK] Seq=9688 Ack=104567 Win=11911 Len=0"
"28.135832","5.9.29.183","172.19.0.3","TCP","1516","9002 → 43520 [PSH, ACK] Seq=104567 Ack=9688 Win=65535 Len=1460 [TCP segment of a reassembled PDU]"
"28.135839","172.19.0.3","5.9.29.183","TCP","56","43520 → 9002 [ACK] Seq=9688 Ack=106027 Win=11903 Len=0"
"28.135841","5.9.29.183","172.19.0.3","TLSv1.2","1213","Application Data"
"28.135846","172.19.0.3","5.9.29.183","TCP","56","43520 → 9002 [ACK] Seq=9688 Ack=107184 Win=11895 Len=0"
"28.135848","5.9.29.183","172.19.0.3","TCP","1516","[TCP segment of a reassembled PDU]"
"28.135856","172.19.0.3","5.9.29.183","TCP","56","43520 → 9002 [ACK] Seq=9688 Ack=108644 Win=11887 Len=0"
"28.135857","5.9.29.183","172.19.0.3","TCP","1516","9002 → 43520 [PSH, ACK] Seq=108644 Ack=9688 Win=65535 Len=1460 [TCP segment of a reassembled PDU]"
"28.135861","172.19.0.3","5.9.29.183","TCP","56","43520 → 9002 [ACK] Seq=9688 Ack=110104 Win=11879 Len=0"
"28.136049","5.9.29.183","172.19.0.3","TLSv1.2","1516","Application Data [TCP segment of a reassembled PDU]"
"28.136064","172.19.0.3","5.9.29.183","TCP","56","43520 → 9002 [ACK] Seq=9688 Ack=111564 Win=11871 Len=0"
"28.136066","5.9.29.183","172.19.0.3","TCP","1516","9002 → 43520 [PSH, ACK] Seq=111564 Ack=9688 Win=65535 Len=1460 [TCP segment of a reassembled PDU]"
"28.136072","172.19.0.3","5.9.29.183","TCP","56","43520 → 9002 [ACK] Seq=9688 Ack=113024 Win=11863 Len=0"
"28.136073","5.9.29.183","172.19.0.3","TLSv1.2","1456","Application Data [TCP segment of a reassembled PDU]"
"28.136080","172.19.0.3","5.9.29.183","TCP","56","43520 → 9002 [ACK] Seq=9688 Ack=114424 Win=11853 Len=0"
"28.136193","5.9.29.183","172.19.0.3","TCP","1516","9002 → 43520 [PSH, ACK] Seq=114424 Ack=9688 Win=65535 Len=1460 [TCP segment of a reassembled PDU]"
"28.136202","172.19.0.3","5.9.29.183","TCP","56","43520 → 9002 [ACK] Seq=9688 Ack=115884 Win=11845 Len=0"
"28.136204","5.9.29.183","172.19.0.3","TCP","1492","9002 → 43520 [PSH, ACK] Seq=115884 Ack=9688 Win=65535 Len=1436 [TCP segment of a reassembled PDU]"
"28.136210","172.19.0.3","5.9.29.183","TCP","56","43520 → 9002 [ACK] Seq=9688 Ack=117320 Win=11836 Len=0"
"28.151422","5.9.29.183","172.19.0.3","TLSv1.2","1516","Application Data [TCP segment of a reassembled PDU]"
"28.151451","172.19.0.3","5.9.29.183","TCP","56","43520 → 9002 [ACK] Seq=9688 Ack=118780 Win=11911 Len=0"
"28.151463","5.9.29.183","172.19.0.3","TCP","1492","9002 → 43520 [PSH, ACK] Seq=118780 Ack=9688 Win=65535 Len=1436 [TCP segment of a reassembled PDU]"
"28.151651","5.9.29.183","172.19.0.3","TLSv1.2","1516","Application Data [TCP segment of a reassembled PDU]"
"28.151661","5.9.29.183","172.19.0.3","TCP","1492","9002 → 43520 [PSH, ACK] Seq=121676 Ack=9688 Win=65535 Len=1436 [TCP segment of a reassembled PDU]"
"28.151665","5.9.29.183","172.19.0.3","TLSv1.2","1516","Application Data [TCP segment of a reassembled PDU]"
"28.151668","5.9.29.183","172.19.0.3","TCP","1516","9002 → 43520 [PSH, ACK] Seq=124572 Ack=9688 Win=65535 Len=1460 [TCP segment of a reassembled PDU]"
"28.151671","5.9.29.183","172.19.0.3","TCP","1516","9002 → 43520 [PSH, ACK] Seq=126032 Ack=9688 Win=65535 Len=1460 [TCP segment of a reassembled PDU]"
"28.151689","5.9.29.183","172.19.0.3","TLSv1.2","546","Application Data"
"28.151754","172.19.0.3","5.9.29.183","TCP","56","43520 → 9002 [ACK] Seq=9688 Ack=127982 Win=11855 Len=0"
"28.152216","172.19.0.3","5.9.29.183","TLSv1.2","599","Application Data"
"28.152506","5.9.29.183","172.19.0.3","TCP","56","9002 → 43520 [ACK] Seq=127982 Ack=10231 Win=65535 Len=0"
"28.167029","172.19.0.3","5.9.29.183","TLSv1.2","599","Application Data"
"28.167527","5.9.29.183","172.19.0.3","TCP","56","9002 → 43520 [ACK] Seq=127982 Ack=10774 Win=65535 Len=0"
"28.199438","5.9.29.183","172.19.0.3","TCP","1516","[TCP segment of a reassembled PDU]"
"28.199473","5.9.29.183","172.19.0.3","TCP","1492","9002 → 43520 [PSH, ACK] Seq=129442 Ack=10774 Win=65535 Len=1436 [TCP segment of a reassembled PDU]"
"28.199484","5.9.29.183","172.19.0.3","TLSv1.2","787","Application Data"
"28.199638","172.19.0.3","5.9.29.183","TCP","56","43520 → 9002 [ACK] Seq=10774 Ack=131609 Win=11895 Len=0"
"28.212988","5.9.29.183","172.19.0.3","TCP","1504","[TCP segment of a reassembled PDU]"
"28.213188","5.9.29.183","172.19.0.3","TCP","1504","9002 → 43520 [PSH, ACK] Seq=133057 Ack=10774 Win=65535 Len=1448 [TCP segment of a reassembled PDU]"
"28.213208","172.19.0.3","5.9.29.183","TCP","56","43520 → 9002 [ACK] Seq=10774 Ack=134505 Win=11903 Len=0"
"28.214412","5.9.29.183","172.19.0.3","TLSv1.2","787","Application Data"
"28.223793","5.9.29.183","172.19.0.3","TCP","1516","[TCP segment of a reassembled PDU]"
"28.223860","172.19.0.3","5.9.29.183","TCP","56","43520 → 9002 [ACK] Seq=10774 Ack=136696 Win=11911 Len=0"
"28.223877","5.9.29.183","172.19.0.3","TCP","1492","9002 → 43520 [PSH, ACK] Seq=136696 Ack=10774 Win=65535 Len=1436 [TCP segment of a reassembled PDU]"
"28.224078","5.9.29.183","172.19.0.3","TLSv1.2","1516","Application Data [TCP segment of a reassembled PDU]"
"28.224085","5.9.29.183","172.19.0.3","TCP","1516","9002 → 43520 [PSH, ACK] Seq=139592 Ack=10774 Win=65535 Len=1460 [TCP segment of a reassembled PDU]"
"28.224136","5.9.29.183","172.19.0.3","TCP","1516","9002 → 43520 [PSH, ACK] Seq=141052 Ack=10774 Win=65535 Len=1460 [TCP segment of a reassembled PDU]"
"28.224140","5.9.29.183","172.19.0.3","TLSv1.2","1468","Application Data [TCP segment of a reassembled PDU]"
"28.224144","5.9.29.183","172.19.0.3","TCP","1516","9002 → 43520 [PSH, ACK] Seq=143924 Ack=10774 Win=65535 Len=1460 [TCP segment of a reassembled PDU]"
"28.224174","5.9.29.183","172.19.0.3","TCP","275","9002 → 43520 [PSH, ACK] Seq=145384 Ack=10774 Win=65535 Len=219 [TCP segment of a reassembled PDU]"
"28.224179","5.9.29.183","172.19.0.3","TCP","1516","9002 → 43520 [PSH, ACK] Seq=145603 Ack=10774 Win=65535 Len=1460 [TCP segment of a reassembled PDU]"
"28.224229","5.9.29.183","172.19.0.3","TLSv1.2","1516","Application Data [TCP segment of a reassembled PDU]"
"28.224402","5.9.29.183","172.19.0.3","TCP","1516","9002 → 43520 [PSH, ACK] Seq=148523 Ack=10774 Win=65535 Len=1460 [TCP segment of a reassembled PDU]"
"28.224409","5.9.29.183","172.19.0.3","TCP","1237","9002 → 43520 [PSH, ACK] Seq=149983 Ack=10774 Win=65535 Len=1181 [TCP segment of a reassembled PDU]"
"28.224504","172.19.0.3","5.9.29.183","TCP","56","43520 → 9002 [ACK] Seq=10774 Ack=151164 Win=11820 Len=0"
"28.225082","172.19.0.3","5.9.29.183","TLSv1.2","599","Application Data"
"28.225299","5.9.29.183","172.19.0.3","TCP","56","9002 → 43520 [ACK] Seq=151164 Ack=11317 Win=65535 Len=0"
"28.229526","5.9.29.183","172.19.0.3","TLSv1.2","1504","Application Data, Application Data"
"28.229736","5.9.29.183","172.19.0.3","TCP","1504","9002 → 43520 [PSH, ACK] Seq=152612 Ack=11317 Win=65535 Len=1448 [TCP segment of a reassembled PDU]"
"28.229751","172.19.0.3","5.9.29.183","TCP","56","43520 → 9002 [ACK] Seq=11317 Ack=154060 Win=11903 Len=0"
"28.229844","5.9.29.183","172.19.0.3","TLSv1.2","1452","Application Data"
"28.239735","5.9.29.183","172.19.0.3","TCP","1516","[TCP segment of a reassembled PDU]"
"28.239758","172.19.0.3","5.9.29.183","TCP","56","43520 → 9002 [ACK] Seq=11317 Ack=156916 Win=11911 Len=0"
"28.239775","5.9.29.183","172.19.0.3","TCP","1492","9002 → 43520 [PSH, ACK] Seq=156916 Ack=11317 Win=65535 Len=1436 [TCP segment of a reassembled PDU]"
"28.245361","5.9.29.183","172.19.0.3","TLSv1.2","1330","Application Data, Application Data"
"28.245386","172.19.0.3","5.9.29.183","TCP","56","43520 → 9002 [ACK] Seq=11317 Ack=159626 Win=11911 Len=0"
"28.246633","5.9.29.183","172.19.0.3","TCP","1504","[TCP segment of a reassembled PDU]"
"28.247137","5.9.29.183","172.19.0.3","TCP","1516","9002 → 43520 [PSH, ACK] Seq=161074 Ack=11317 Win=65535 Len=1460 [TCP segment of a reassembled PDU]"
"28.247146","172.19.0.3","5.9.29.183","TCP","56","43520 → 9002 [ACK] Seq=11317 Ack=162534 Win=11911 Len=0"
"28.247153","5.9.29.183","172.19.0.3","TLSv1.2","1492","Application Data [TCP segment of a reassembled PDU]"
"28.247442","5.9.29.183","172.19.0.3","TCP","1516","9002 → 43520 [PSH, ACK] Seq=163970 Ack=11317 Win=65535 Len=1460 [TCP segment of a reassembled PDU]"
"28.247449","5.9.29.183","172.19.0.3","TCP","1516","9002 → 43520 [PSH, ACK] Seq=165430 Ack=11317 Win=65535 Len=1460 [TCP segment of a reassembled PDU]"
"28.247453","5.9.29.183","172.19.0.3","TLSv1.2","1516","Application Data [TCP segment of a reassembled PDU]"
"28.247456","5.9.29.183","172.19.0.3","TCP","1468","9002 → 43520 [PSH, ACK] Seq=168350 Ack=11317 Win=65535 Len=1412 [TCP segment of a reassembled PDU]"
"28.247459","5.9.29.183","172.19.0.3","TCP","1504","9002 → 43520 [PSH, ACK] Seq=169762 Ack=11317 Win=65535 Len=1448 [TCP segment of a reassembled PDU]"
"28.247498","172.19.0.3","5.9.29.183","TCP","56","43520 → 9002 [ACK] Seq=11317 Ack=171210 Win=11861 Len=0"
"28.260563","5.9.29.183","172.19.0.3","TLSv1.2","924","Application Data, Application Data"
"28.301562","172.19.0.3","5.9.29.183","TCP","56","43520 → 9002 [ACK] Seq=11317 Ack=172078 Win=11911 Len=0"
"28.437257","5.9.29.183","172.19.0.3","TCP","1516","[TCP segment of a reassembled PDU]"
"28.437289","5.9.29.183","172.19.0.3","TCP","1516","9002 → 43520 [PSH, ACK] Seq=173538 Ack=11317 Win=65535 Len=1460 [TCP segment of a reassembled PDU]"
"28.437298","5.9.29.183","172.19.0.3","TLSv1.2","249","Application Data"
"28.437444","172.19.0.3","5.9.29.183","TCP","56","43520 → 9002 [ACK] Seq=11317 Ack=175191 Win=11895 Len=0"
"28.439087","172.19.0.3","5.9.29.183","TLSv1.2","599","Application Data"
"28.439474","5.9.29.183","172.19.0.3","TCP","56","9002 → 43520 [ACK] Seq=175191 Ack=11860 Win=65535 Len=0"
"28.449118","172.19.0.3","5.9.29.183","TLSv1.2","599","Application Data"
"28.449457","5.9.29.183","172.19.0.3","TCP","56","9002 → 43520 [ACK] Seq=175191 Ack=12403 Win=65535 Len=0"
"29.562215","5.9.29.183","172.19.0.3","TLSv1.2","599","Application Data"
"29.563184","172.19.0.3","5.9.29.183","TLSv1.2","599","Application Data"
"29.563612","5.9.29.183","172.19.0.3","TCP","56","9002 → 43520 [ACK] Seq=175734 Ack=12946 Win=65535 Len=0"
"30.916628","5.9.29.183","172.19.0.3","TCP","1516","[TCP segment of a reassembled PDU]"
"30.916709","5.9.29.183","172.19.0.3","TCP","1492","9002 → 43520 [PSH, ACK] Seq=177194 Ack=12946 Win=65535 Len=1436 [TCP segment of a reassembled PDU]"
"30.916877","172.19.0.3","5.9.29.183","TCP","56","43520 → 9002 [ACK] Seq=12946 Ack=178630 Win=11903 Len=0"
"30.916888","5.9.29.183","172.19.0.3","TLSv1.2","787","Application Data"
"30.932691","5.9.29.183","172.19.0.3","TLSv1.2","599","Application Data"
"30.932924","172.19.0.3","5.9.29.183","TCP","56","43520 → 9002 [ACK] Seq=12946 Ack=179904 Win=11911 Len=0"
"30.943178","5.9.29.183","172.19.0.3","TCP","1516","[TCP segment of a reassembled PDU]"
"30.943249","5.9.29.183","172.19.0.3","TCP","1492","9002 → 43520 [PSH, ACK] Seq=181364 Ack=12946 Win=65535 Len=1436 [TCP segment of a reassembled PDU]"
"30.943420","172.19.0.3","5.9.29.183","TCP","56","43520 → 9002 [ACK] Seq=12946 Ack=182800 Win=11903 Len=0"
"30.947959","5.9.29.183","172.19.0.3","TLSv1.2","787","Application Data"
"30.948569","172.19.0.3","5.9.29.183","TLSv1.2","599","Application Data"
"30.948923","5.9.29.183","172.19.0.3","TCP","56","9002 → 43520 [ACK] Seq=183531 Ack=13489 Win=65535 Len=0"
"30.956331","5.9.29.183","172.19.0.3","TCP","1504","[TCP segment of a reassembled PDU]"
"30.956462","5.9.29.183","172.19.0.3","TCP","1504","9002 → 43520 [PSH, ACK] Seq=184979 Ack=13489 Win=65535 Len=1448 [TCP segment of a reassembled PDU]"
"30.956579","172.19.0.3","5.9.29.183","TCP","56","43520 → 9002 [ACK] Seq=13489 Ack=186427 Win=11903 Len=0"
"30.963365","5.9.29.183","172.19.0.3","TLSv1.2","1330","Application Data, Application Data"
"30.966327","5.9.29.183","172.19.0.3","TCP","1504","[TCP segment of a reassembled PDU]"
"30.966355","172.19.0.3","5.9.29.183","TCP","56","43520 → 9002 [ACK] Seq=13489 Ack=189149 Win=11911 Len=0"
"30.966612","5.9.29.183","172.19.0.3","TCP","1516","9002 → 43520 [PSH, ACK] Seq=189149 Ack=13489 Win=65535 Len=1460 [TCP segment of a reassembled PDU]"
"30.966619","5.9.29.183","172.19.0.3","TLSv1.2","1516","Application Data [TCP segment of a reassembled PDU]"
"30.966621","5.9.29.183","172.19.0.3","TCP","1480","9002 → 43520 [PSH, ACK] Seq=192069 Ack=13489 Win=65535 Len=1424 [TCP segment of a reassembled PDU]"
"30.966647","172.19.0.3","5.9.29.183","TCP","56","43520 → 9002 [ACK] Seq=13489 Ack=193493 Win=11893 Len=0"
"30.972119","5.9.29.183","172.19.0.3","TCP","1504","9002 → 43520 [PSH, ACK] Seq=193493 Ack=13489 Win=65535 Len=1448 [TCP segment of a reassembled PDU]"
"30.978383","5.9.29.183","172.19.0.3","TLSv1.2","584","Application Data"
"30.978407","172.19.0.3","5.9.29.183","TCP","56","43520 → 9002 [ACK] Seq=13489 Ack=195469 Win=11911 Len=0"
"30.979280","5.9.29.183","172.19.0.3","TCP","1504","[TCP segment of a reassembled PDU]"
"30.994128","5.9.29.183","172.19.0.3","TCP","1516","9002 → 43520 [PSH, ACK] Seq=196917 Ack=13489 Win=65535 Len=1460 [TCP segment of a reassembled PDU]"
"30.994152","172.19.0.3","5.9.29.183","TCP","56","43520 → 9002 [ACK] Seq=13489 Ack=198377 Win=11911 Len=0"
"30.994217","5.9.29.183","172.19.0.3","TLSv1.2","1516","Application Data [TCP segment of a reassembled PDU]"
"30.994269","5.9.29.183","172.19.0.3","TLSv1.2","886","Application Data"
"30.994433","172.19.0.3","5.9.29.183","TCP","56","43520 → 9002 [ACK] Seq=13489 Ack=200667 Win=11895 Len=0"
"31.027500","5.9.29.183","172.19.0.3","TCP","1516","[TCP segment of a reassembled PDU]"
"31.027525","5.9.29.183","172.19.0.3","TCP","1492","9002 → 43520 [PSH, ACK] Seq=202127 Ack=13489 Win=65535 Len=1436 [TCP segment of a reassembled PDU]"
"31.027538","172.19.0.3","5.9.29.183","TCP","56","43520 → 9002 [ACK] Seq=13489 Ack=203563 Win=11903 Len=0"
"31.027540","5.9.29.183","172.19.0.3","TLSv1.2","787","Application Data"
"31.027897","172.19.0.3","5.9.29.183","TLSv1.2","599","Application Data"
"31.028229","5.9.29.183","172.19.0.3","TCP","56","9002 → 43520 [ACK] Seq=204294 Ack=14032 Win=65535 Len=0"
"31.038602","5.9.29.183","172.19.0.3","TCP","1516","[TCP segment of a reassembled PDU]"
"31.038631","5.9.29.183","172.19.0.3","TCP","1492","9002 → 43520 [PSH, ACK] Seq=205754 Ack=14032 Win=65535 Len=1436 [TCP segment of a reassembled PDU]"
"31.038724","5.9.29.183","172.19.0.3","TLSv1.2","1516","Application Data [TCP segment of a reassembled PDU]"
"31.038753","5.9.29.183","172.19.0.3","TCP","1492","9002 → 43520 [PSH, ACK] Seq=208650 Ack=14032 Win=65535 Len=1436 [TCP segment of a reassembled PDU]"
"31.038774","5.9.29.183","172.19.0.3","TCP","1109","9002 → 43520 [PSH, ACK] Seq=210086 Ack=14032 Win=65535 Len=1053 [TCP segment of a reassembled PDU]"
"31.038867","172.19.0.3","5.9.29.183","TCP","56","43520 → 9002 [ACK] Seq=14032 Ack=211139 Win=11879 Len=0"
"31.039021","5.9.29.183","172.19.0.3","TCP","451","9002 → 43520 [PSH, ACK] Seq=211139 Ack=14032 Win=65535 Len=395 [TCP segment of a reassembled PDU]"
"31.043299","5.9.29.183","172.19.0.3","TLSv1.2","1516","Application Data [TCP segment of a reassembled PDU]"
"31.043326","172.19.0.3","5.9.29.183","TCP","56","43520 → 9002 [ACK] Seq=14032 Ack=212994 Win=11911 Len=0"
"31.043341","5.9.29.183","172.19.0.3","TCP","1492","9002 → 43520 [PSH, ACK] Seq=212994 Ack=14032 Win=65535 Len=1436 [TCP segment of a reassembled PDU]"
"31.043485","5.9.29.183","172.19.0.3","TLSv1.2","801","Application Data"
"31.043550","172.19.0.3","5.9.29.183","TCP","56","43520 → 9002 [ACK] Seq=14032 Ack=215175 Win=11895 Len=0"
"31.074181","5.9.29.183","172.19.0.3","TLSv1.2","1113","Application Data"
"31.085263","5.9.29.183","172.19.0.3","TCP","1516","[TCP segment of a reassembled PDU]"
"31.085285","172.19.0.3","5.9.29.183","TCP","56","43520 → 9002 [ACK] Seq=14032 Ack=217692 Win=11909 Len=0"
"31.085336","5.9.29.183","172.19.0.3","TCP","1516","9002 → 43520 [PSH, ACK] Seq=217692 Ack=14032 Win=65535 Len=1460 [TCP segment of a reassembled PDU]"
"31.085348","5.9.29.183","172.19.0.3","TLSv1.2","1516","Application Data [TCP segment of a reassembled PDU]"
"31.085489","5.9.29.183","172.19.0.3","TCP","1516","9002 → 43520 [PSH, ACK] Seq=220612 Ack=14032 Win=65535 Len=1460 [TCP segment of a reassembled PDU]"
"31.085495","5.9.29.183","172.19.0.3","TCP","1516","9002 → 43520 [PSH, ACK] Seq=222072 Ack=14032 Win=65535 Len=1460 [TCP segment of a reassembled PDU]"
"31.085499","5.9.29.183","172.19.0.3","TLSv1.2","1516","Application Data, Application Data"
"31.085502","5.9.29.183","172.19.0.3","TCP","1432","9002 → 43520 [PSH, ACK] Seq=224992 Ack=14032 Win=65535 Len=1376 [TCP segment of a reassembled PDU]"
"31.085539","172.19.0.3","5.9.29.183","TCP","56","43520 → 9002 [ACK] Seq=14032 Ack=226368 Win=11861 Len=0"
"31.089524","5.9.29.183","172.19.0.3","TCP","1504","9002 → 43520 [PSH, ACK] Seq=226368 Ack=14032 Win=65535 Len=1448 [TCP segment of a reassembled PDU]"
"31.105326","5.9.29.183","172.19.0.3","TLSv1.2","1504","Application Data [TCP segment of a reassembled PDU]"
"31.105352","172.19.0.3","5.9.29.183","TCP","56","43520 → 9002 [ACK] Seq=14032 Ack=229264 Win=11911 Len=0"
"31.105399","5.9.29.183","172.19.0.3","TCP","1516","9002 → 43520 [PSH, ACK] Seq=229264 Ack=14032 Win=65535 Len=1460 [TCP segment of a reassembled PDU]"
"31.105409","5.9.29.183","172.19.0.3","TLSv1.2","1516","Application Data [TCP segment of a reassembled PDU]"
"31.105489","5.9.29.183","172.19.0.3","TCP","1516","9002 → 43520 [PSH, ACK] Seq=232184 Ack=14032 Win=65535 Len=1460 [TCP segment of a reassembled PDU]"
"31.105493","5.9.29.183","172.19.0.3","TCP","1468","9002 → 43520 [PSH, ACK] Seq=233644 Ack=14032 Win=65535 Len=1412 [TCP segment of a reassembled PDU]"
"31.105495","5.9.29.183","172.19.0.3","TLSv1.2","424","Application Data"
"31.105509","172.19.0.3","5.9.29.183","TCP","56","43520 → 9002 [ACK] Seq=14032 Ack=232184 Win=11895 Len=0"
"31.105779","172.19.0.3","5.9.29.183","TLSv1.2","599","Application Data"
"31.106029","5.9.29.183","172.19.0.3","TCP","56","9002 → 43520 [ACK] Seq=235424 Ack=14575 Win=65535 Len=0"
"31.120522","172.19.0.3","5.9.29.183","TLSv1.2","599","Application Data"
"31.121050","5.9.29.183","172.19.0.3","TCP","56","9002 → 43520 [ACK] Seq=235424 Ack=15118 Win=65535 Len=0"
"31.131364","5.9.29.183","172.19.0.3","TCP","1516","[TCP segment of a reassembled PDU]"
"31.131452","5.9.29.183","172.19.0.3","TLSv1.2","681","Application Data"
"31.131644","172.19.0.3","5.9.29.183","TCP","56","43520 → 9002 [ACK] Seq=15118 Ack=237509 Win=11903 Len=0"
"31.166885","5.9.29.183","172.19.0.3","TCP","1516","[TCP segment of a reassembled PDU]"
"31.166959","5.9.29.183","172.19.0.3","TLSv1.2","167","Application Data"
"31.166980","172.19.0.3","5.9.29.183","TCP","56","43520 → 9002 [ACK] Seq=15118 Ack=239080 Win=11903 Len=0"
"31.172160","172.19.0.3","5.9.29.183","TLSv1.2","599","Application Data"
"31.172705","5.9.29.183","172.19.0.3","TCP","56","9002 → 43520 [ACK] Seq=239080 Ack=15661 Win=65535 Len=0"
"34.457389","5.9.29.183","172.19.0.3","TLSv1.2","599","Application Data"
"34.458300","172.19.0.3","5.9.29.183","TLSv1.2","599","Application Data"
"34.458688","5.9.29.183","172.19.0.3","TCP","56","9002 → 43520 [ACK] Seq=239623 Ack=16204 Win=65535 Len=0"
"35.076501","5.9.29.183","172.19.0.3","TCP","1516","[TCP segment of a reassembled PDU]"
"35.076604","5.9.29.183","172.19.0.3","TCP","1516","9002 → 43520 [PSH, ACK] Seq=241083 Ack=16204 Win=65535 Len=1460 [TCP segment of a reassembled PDU]"
"35.076618","5.9.29.183","172.19.0.3","TLSv1.2","763","Application Data"
"35.076786","172.19.0.3","5.9.29.183","TCP","56","43520 → 9002 [ACK] Seq=16204 Ack=243250 Win=11893 Len=0"
"35.102918","5.9.29.183","172.19.0.3","TLSv1.2","599","Application Data"
"35.143467","172.19.0.3","5.9.29.183","TCP","56","43520 → 9002 [ACK] Seq=16204 Ack=243793 Win=11911 Len=0"
"35.150212","5.9.29.183","172.19.0.3","TCP","1516","[TCP segment of a reassembled PDU]"
"35.150243","172.19.0.3","5.9.29.183","TCP","56","43520 → 9002 [ACK] Seq=16204 Ack=245253 Win=11911 Len=0"
"35.150308","5.9.29.183","172.19.0.3","TCP","1516","9002 → 43520 [PSH, ACK] Seq=245253 Ack=16204 Win=65535 Len=1460 [TCP segment of a reassembled PDU]"
"35.150333","172.19.0.3","5.9.29.183","TCP","56","43520 → 9002 [ACK] Seq=16204 Ack=246713 Win=11903 Len=0"
"35.150465","5.9.29.183","172.19.0.3","TLSv1.2","1213","Application Data"
"35.150476","172.19.0.3","5.9.29.183","TCP","56","43520 → 9002 [ACK] Seq=16204 Ack=247870 Win=11895 Len=0"
"35.165583","5.9.29.183","172.19.0.3","TLSv1.2","149","Application Data"
"35.165606","172.19.0.3","5.9.29.183","TCP","56","43520 → 9002 [ACK] Seq=16204 Ack=247963 Win=11911 Len=0"
"35.196223","5.9.29.183","172.19.0.3","TCP","1504","[TCP segment of a reassembled PDU]"
"35.196245","172.19.0.3","5.9.29.183","TCP","56","43520 → 9002 [ACK] Seq=16204 Ack=249411 Win=11911 Len=0"
"35.196363","5.9.29.183","172.19.0.3","TCP","1504","9002 → 43520 [PSH, ACK] Seq=249411 Ack=16204 Win=65535 Len=1448 [TCP segment of a reassembled PDU]"
"35.196377","172.19.0.3","5.9.29.183","TCP","56","43520 → 9002 [ACK] Seq=16204 Ack=250859 Win=11903 Len=0"
"35.196494","5.9.29.183","172.19.0.3","TLSv1.2","1516","Application Data [TCP segment of a reassembled PDU]"
"35.196499","5.9.29.183","172.19.0.3","TLSv1.2","1516","Application Data [TCP segment of a reassembled PDU]"
"35.196501","5.9.29.183","172.19.0.3","TCP","1213","9002 → 43520 [PSH, ACK] Seq=253779 Ack=16204 Win=65535 Len=1157 [TCP segment of a reassembled PDU]"
"35.196518","172.19.0.3","5.9.29.183","TCP","56","43520 → 9002 [ACK] Seq=16204 Ack=252319 Win=11911 Len=0"
"35.196576","172.19.0.3","5.9.29.183","TCP","56","43520 → 9002 [ACK] Seq=16204 Ack=253779 Win=11903 Len=0"
"35.196638","172.19.0.3","5.9.29.183","TCP","56","43520 → 9002 [ACK] Seq=16204 Ack=254936 Win=11895 Len=0"
"35.196679","5.9.29.183","172.19.0.3","TCP","1516","9002 → 43520 [PSH, ACK] Seq=254936 Ack=16204 Win=65535 Len=1460 [TCP segment of a reassembled PDU]"
"35.196692","172.19.0.3","5.9.29.183","TCP","56","43520 → 9002 [ACK] Seq=16204 Ack=256396 Win=11887 Len=0"
"35.196694","5.9.29.183","172.19.0.3","TLSv1.2","1516","Application Data [TCP segment of a reassembled PDU]"
"35.196700","172.19.0.3","5.9.29.183","TCP","56","43520 → 9002 [ACK] Seq=16204 Ack=257856 Win=11879 Len=0"
"35.196701","5.9.29.183","172.19.0.3","TCP","1480","9002 → 43520 [PSH, ACK] Seq=257856 Ack=16204 Win=65535 Len=1424 [TCP segment of a reassembled PDU]"
"35.196707","172.19.0.3","5.9.29.183","TCP","56","43520 → 9002 [ACK] Seq=16204 Ack=259280 Win=11871 Len=0"
"35.212153","5.9.29.183","172.19.0.3","TLSv1.2","1516","Application Data [TCP segment of a reassembled PDU]"
"35.212180","172.19.0.3","5.9.29.183","TCP","56","43520 → 9002 [ACK] Seq=16204 Ack=260740 Win=11911 Len=0"
"35.212291","5.9.29.183","172.19.0.3","TCP","1492","9002 → 43520 [PSH, ACK] Seq=260740 Ack=16204 Win=65535 Len=1436 [TCP segment of a reassembled PDU]"
"35.212311","172.19.0.3","5.9.29.183","TCP","56","43520 → 9002 [ACK] Seq=16204 Ack=262176 Win=11903 Len=0"
"35.212403","5.9.29.183","172.19.0.3","TLSv1.2","1504","Application Data [TCP segment of a reassembled PDU]"
"35.212411","5.9.29.183","172.19.0.3","TLSv1.2","503","Application Data"
"35.212541","172.19.0.3","5.9.29.183","TCP","56","43520 → 9002 [ACK] Seq=16204 Ack=264071 Win=11889 Len=0"
"35.221925","5.9.29.183","172.19.0.3","TCP","1504","[TCP segment of a reassembled PDU]"
"35.221981","5.9.29.183","172.19.0.3","TCP","1504","9002 → 43520 [PSH, ACK] Seq=265519 Ack=16204 Win=65535 Len=1448 [TCP segment of a reassembled PDU]"
"35.221997","172.19.0.3","5.9.29.183","TCP","56","43520 → 9002 [ACK] Seq=16204 Ack=266967 Win=11903 Len=0"
"35.228392","5.9.29.183","172.19.0.3","TLSv1.2","787","Application Data"
"35.228622","172.19.0.3","5.9.29.183","TCP","56","43520 → 9002 [ACK] Seq=16204 Ack=267698 Win=11911 Len=0"
"35.228923","172.19.0.3","5.9.29.183","TLSv1.2","599","Application Data"
"35.229240","5.9.29.183","172.19.0.3","TCP","56","9002 → 43520 [ACK] Seq=267698 Ack=16747 Win=65535 Len=0"
"35.233809","5.9.29.183","172.19.0.3","TCP","1504","[TCP segment of a reassembled PDU]"
"35.233948","5.9.29.183","172.19.0.3","TCP","1504","9002 → 43520 [PSH, ACK] Seq=269146 Ack=16747 Win=65535 Len=1448 [TCP segment of a reassembled PDU]"
"35.234002","172.19.0.3","5.9.29.183","TCP","56","43520 → 9002 [ACK] Seq=16747 Ack=270594 Win=11903 Len=0"
"35.243887","5.9.29.183","172.19.0.3","TLSv1.2","1330","Application Data, Application Data"
"35.246288","5.9.29.183","172.19.0.3","TCP","1516","[TCP segment of a reassembled PDU]"
"35.246312","172.19.0.3","5.9.29.183","TCP","56","43520 → 9002 [ACK] Seq=16747 Ack=273328 Win=11911 Len=0"
"35.246371","5.9.29.183","172.19.0.3","TCP","1492","9002 → 43520 [PSH, ACK] Seq=273328 Ack=16747 Win=65535 Len=1436 [TCP segment of a reassembled PDU]"
"35.259409","5.9.29.183","172.19.0.3","TLSv1.2","787","Application Data"
"35.259433","172.19.0.3","5.9.29.183","TCP","56","43520 → 9002 [ACK] Seq=16747 Ack=275495 Win=11911 Len=0"
"35.295670","5.9.29.183","172.19.0.3","TCP","1236","[TCP segment of a reassembled PDU]"
"35.295808","5.9.29.183","172.19.0.3","TCP","1516","9002 → 43520 [PSH, ACK] Seq=276675 Ack=16747 Win=65535 Len=1460 [TCP segment of a reassembled PDU]"
"35.295823","5.9.29.183","172.19.0.3","TCP","312","9002 → 43520 [PSH, ACK] Seq=278135 Ack=16747 Win=65535 Len=256 [TCP segment of a reassembled PDU]"
"35.295827","5.9.29.183","172.19.0.3","TLSv1.2","787","Application Data"
"35.295947","172.19.0.3","5.9.29.183","TCP","56","43520 → 9002 [ACK] Seq=16747 Ack=279122 Win=11887 Len=0"
"35.356855","5.9.29.183","172.19.0.3","TCP","1516","[TCP segment of a reassembled PDU]"
"35.356926","5.9.29.183","172.19.0.3","TLSv1.2","167","Application Data"
"35.356950","172.19.0.3","5.9.29.183","TCP","56","43520 → 9002 [ACK] Seq=16747 Ack=280693 Win=11903 Len=0"
"36.771624","5.9.29.183","172.19.0.3","TCP","1504","[TCP segment of a reassembled PDU]"
"36.771792","5.9.29.183","172.19.0.3","TCP","1504","9002 → 43520 [PSH, ACK] Seq=282141 Ack=16747 Win=65535 Len=1448 [TCP segment of a reassembled PDU]"
"36.771821","172.19.0.3","5.9.29.183","TCP","56","43520 → 9002 [ACK] Seq=16747 Ack=283589 Win=11903 Len=0"
"36.771987","5.9.29.183","172.19.0.3","TLSv1.2","1516","Application Data [TCP segment of a reassembled PDU]"
"36.772034","5.9.29.183","172.19.0.3","TCP","1516","9002 → 43520 [PSH, ACK] Seq=285049 Ack=16747 Win=65535 Len=1460 [TCP segment of a reassembled PDU]"
"36.772046","172.19.0.3","5.9.29.183","TCP","56","43520 → 9002 [ACK] Seq=16747 Ack=286509 Win=11903 Len=0"
"36.772048","5.9.29.183","172.19.0.3","TCP","1516","9002 → 43520 [PSH, ACK] Seq=286509 Ack=16747 Win=65535 Len=1460 [TCP segment of a reassembled PDU]"
"36.772052","5.9.29.183","172.19.0.3","TLSv1.2","1516","Application Data [TCP segment of a reassembled PDU]"
"36.772057","5.9.29.183","172.19.0.3","TCP","1516","9002 → 43520 [PSH, ACK] Seq=289429 Ack=16747 Win=65535 Len=1460 [TCP segment of a reassembled PDU]"
"36.772060","5.9.29.183","172.19.0.3","TCP","1177","9002 → 43520 [PSH, ACK] Seq=290889 Ack=16747 Win=65535 Len=1121 [TCP segment of a reassembled PDU]"
"36.772116","172.19.0.3","5.9.29.183","TCP","56","43520 → 9002 [ACK] Seq=16747 Ack=292010 Win=11869 Len=0"
"36.772677","172.19.0.3","5.9.29.183","TLSv1.2","599","Application Data"
"36.772909","5.9.29.183","172.19.0.3","TCP","56","9002 → 43520 [ACK] Seq=292010 Ack=17290 Win=65535 Len=0"
"36.787513","5.9.29.183","172.19.0.3","TLSv1.2","648","Application Data"
"36.788037","172.19.0.3","5.9.29.183","TLSv1.2","599","Application Data"
"36.788433","5.9.29.183","172.19.0.3","TCP","56","9002 → 43520 [ACK] Seq=292602 Ack=17833 Win=65535 Len=0"
"36.793465","5.9.29.183","172.19.0.3","TCP","1504","[TCP segment of a reassembled PDU]"
"36.793677","5.9.29.183","172.19.0.3","TCP","1516","9002 → 43520 [PSH, ACK] Seq=294050 Ack=17833 Win=65535 Len=1460 [TCP segment of a reassembled PDU]"
"36.793685","5.9.29.183","172.19.0.3","TLSv1.2","1516","Application Data [TCP segment of a reassembled PDU]"
"36.793688","5.9.29.183","172.19.0.3","TCP","1480","9002 → 43520 [PSH, ACK] Seq=296970 Ack=17833 Win=65535 Len=1424 [TCP segment of a reassembled PDU]"
"36.793742","172.19.0.3","5.9.29.183","TCP","56","43520 → 9002 [ACK] Seq=17833 Ack=298394 Win=11887 Len=0"
"36.793786","5.9.29.183","172.19.0.3","TCP","1516","9002 → 43520 [PSH, ACK] Seq=298394 Ack=17833 Win=65535 Len=1460 [TCP segment of a reassembled PDU]"
"36.793791","5.9.29.183","172.19.0.3","TLSv1.2","1492","Application Data [TCP segment of a reassembled PDU]"
"36.793825","172.19.0.3","5.9.29.183","TCP","56","43520 → 9002 [ACK] Seq=17833 Ack=301290 Win=11871 Len=0"
"36.802804","5.9.29.183","172.19.0.3","TLSv1.2","193","Application Data"
"36.809610","172.19.0.3","5.9.29.183","TLSv1.2","599","Application Data"
"36.809927","5.9.29.183","172.19.0.3","TCP","56","9002 → 43520 [ACK] Seq=301427 Ack=18376 Win=65535 Len=0"
"37.299906","5.9.29.183","172.19.0.3","TLSv1.2","599","Application Data"
"37.301031","172.19.0.3","5.9.29.183","TLSv1.2","599","Application Data"
"37.301376","5.9.29.183","172.19.0.3","TCP","56","9002 → 43520 [ACK] Seq=301970 Ack=18919 Win=65535 Len=0"
"38.448271","5.9.29.183","172.19.0.3","TLSv1.2","599","Application Data"
"38.486568","5.9.29.183","172.19.0.3","TCP","1516","[TCP segment of a reassembled PDU]"
"38.486589","172.19.0.3","5.9.29.183","TCP","56","43520 → 9002 [ACK] Seq=18919 Ack=303973 Win=11911 Len=0"
"38.486643","5.9.29.183","172.19.0.3","TCP","1492","9002 → 43520 [PSH, ACK] Seq=303973 Ack=18919 Win=65535 Len=1436 [TCP segment of a reassembled PDU]"
"38.486657","5.9.29.183","172.19.0.3","TLSv1.2","787","Application Data"
"38.486796","172.19.0.3","5.9.29.183","TCP","56","43520 → 9002 [ACK] Seq=18919 Ack=306140 Win=11895 Len=0"
"38.541393","5.9.29.183","172.19.0.3","TCP","1504","[TCP segment of a reassembled PDU]"
"38.541499","5.9.29.183","172.19.0.3","TCP","1504","9002 → 43520 [PSH, ACK] Seq=307588 Ack=18919 Win=65535 Len=1448 [TCP segment of a reassembled PDU]"
"38.541521","172.19.0.3","5.9.29.183","TCP","56","43520 → 9002 [ACK] Seq=18919 Ack=309036 Win=11903 Len=0"
"38.541586","5.9.29.183","172.19.0.3","TLSv1.2","787","Application Data"
"38.566341","5.9.29.183","172.19.0.3","TCP","1516","[TCP segment of a reassembled PDU]"
"38.566364","172.19.0.3","5.9.29.183","TCP","56","43520 → 9002 [ACK] Seq=18919 Ack=311227 Win=11911 Len=0"
"38.566422","5.9.29.183","172.19.0.3","TCP","1516","9002 → 43520 [PSH, ACK] Seq=311227 Ack=18919 Win=65535 Len=1460 [TCP segment of a reassembled PDU]"
"38.566474","5.9.29.183","172.19.0.3","TLSv1.2","1213","Application Data"
"38.566627","172.19.0.3","5.9.29.183","TCP","56","43520 → 9002 [ACK] Seq=18919 Ack=313844 Win=11895 Len=0"
"38.574772","5.9.29.183","172.19.0.3","TLSv1.2","1516","Application Data"
"38.574843","5.9.29.183","172.19.0.3","TCP","1492","9002 → 43520 [PSH, ACK] Seq=315304 Ack=18919 Win=65535 Len=1436 [TCP segment of a reassembled PDU]"
"38.574859","172.19.0.3","5.9.29.183","TCP","56","43520 → 9002 [ACK] Seq=18919 Ack=316740 Win=11901 Len=0"
"38.574862","5.9.29.183","172.19.0.3","TLSv1.2","1516","Application Data [TCP segment of a reassembled PDU]"
"38.574866","5.9.29.183","172.19.0.3","TCP","1516","9002 → 43520 [PSH, ACK] Seq=318200 Ack=18919 Win=65535 Len=1460 [TCP segment of a reassembled PDU]"
"38.574934","5.9.29.183","172.19.0.3","TCP","1516","9002 → 43520 [PSH, ACK] Seq=319660 Ack=18919 Win=65535 Len=1460 [TCP segment of a reassembled PDU]"
"38.575031","172.19.0.3","5.9.29.183","TCP","56","43520 → 9002 [ACK] Seq=18919 Ack=321120 Win=11877 Len=0"
"38.575198","5.9.29.183","172.19.0.3","TLSv1.2","1516","Application Data [TCP segment of a reassembled PDU]"
"38.575208","5.9.29.183","172.19.0.3","TCP","1456","9002 → 43520 [PSH, ACK] Seq=322580 Ack=18919 Win=65535 Len=1400 [TCP segment of a reassembled PDU]"
"38.575337","172.19.0.3","5.9.29.183","TCP","56","43520 → 9002 [ACK] Seq=18919 Ack=323980 Win=11861 Len=0"
"38.581458","5.9.29.183","172.19.0.3","TCP","1516","9002 → 43520 [PSH, ACK] Seq=323980 Ack=18919 Win=65535 Len=1460 [TCP segment of a reassembled PDU]"
"38.581540","5.9.29.183","172.19.0.3","TLSv1.2","1492","Application Data [TCP segment of a reassembled PDU]"
"38.581609","172.19.0.3","5.9.29.183","TCP","56","43520 → 9002 [ACK] Seq=18919 Ack=326876 Win=11903 Len=0"
"38.581696","5.9.29.183","172.19.0.3","TCP","1504","9002 → 43520 [PSH, ACK] Seq=326876 Ack=18919 Win=65535 Len=1448 [TCP segment of a reassembled PDU]"
"38.590199","5.9.29.183","172.19.0.3","TLSv1.2","1516","Application Data [TCP segment of a reassembled PDU]"
"38.590243","172.19.0.3","5.9.29.183","TCP","56","43520 → 9002 [ACK] Seq=18919 Ack=329784 Win=11911 Len=0"
"38.590364","5.9.29.183","172.19.0.3","TCP","1492","9002 → 43520 [PSH, ACK] Seq=329784 Ack=18919 Win=65535 Len=1436 [TCP segment of a reassembled PDU]"
"38.590565","5.9.29.183","172.19.0.3","TCP","1516","9002 → 43520 [PSH, ACK] Seq=331220 Ack=18919 Win=65535 Len=1460 [TCP segment of a reassembled PDU]"
"38.590572","5.9.29.183","172.19.0.3","TLSv1.2","1516","Application Data [TCP segment of a reassembled PDU]"
"38.590575","5.9.29.183","172.19.0.3","TCP","1480","9002 → 43520 [PSH, ACK] Seq=334140 Ack=18919 Win=65535 Len=1424 [TCP segment of a reassembled PDU]"
"38.590578","5.9.29.183","172.19.0.3","TLSv1.2","1219","Application Data"
"38.590717","172.19.0.3","5.9.29.183","TLSv1.2","599","Application Data"
"38.590966","5.9.29.183","172.19.0.3","TCP","56","9002 → 43520 [ACK] Seq=336727 Ack=19462 Win=65535 Len=0"
"38.606002","5.9.29.183","172.19.0.3","TCP","1504","[TCP segment of a reassembled PDU]"
"38.606158","5.9.29.183","172.19.0.3","TLSv1.2","693","Application Data"
"38.606174","172.19.0.3","5.9.29.183","TCP","56","43520 → 9002 [ACK] Seq=19462 Ack=338812 Win=11903 Len=0"
"38.606596","172.19.0.3","5.9.29.183","TLSv1.2","599","Application Data"
"38.606878","5.9.29.183","172.19.0.3","TCP","56","9002 → 43520 [ACK] Seq=338812 Ack=20005 Win=65535 Len=0"
"38.696880","5.9.29.183","172.19.0.3","TCP","1516","[TCP segment of a reassembled PDU]"
"38.696947","5.9.29.183","172.19.0.3","TCP","1492","9002 → 43520 [PSH, ACK] Seq=340272 Ack=20005 Win=65535 Len=1436 [TCP segment of a reassembled PDU]"
"38.696958","5.9.29.183","172.19.0.3","TCP","559","9002 → 43520 [PSH, ACK] Seq=341708 Ack=20005 Win=65535 Len=503 [TCP segment of a reassembled PDU]"
"38.696962","5.9.29.183","172.19.0.3","TLSv1.2","734","Application Data"
"38.697009","5.9.29.183","172.19.0.3","TCP","1516","[TCP segment of a reassembled PDU]"
"38.697034","5.9.29.183","172.19.0.3","TCP","1516","9002 → 43520 [PSH, ACK] Seq=344349 Ack=20005 Win=65535 Len=1460 [TCP segment of a reassembled PDU]"
"38.697047","5.9.29.183","172.19.0.3","TLSv1.2","1516","Application Data [TCP segment of a reassembled PDU]"
"38.697055","5.9.29.183","172.19.0.3","TCP","1516","9002 → 43520 [PSH, ACK] Seq=347269 Ack=20005 Win=65535 Len=1460 [TCP segment of a reassembled PDU]"
"38.697062","5.9.29.183","172.19.0.3","TCP","1516","9002 → 43520 [PSH, ACK] Seq=348729 Ack=20005 Win=65535 Len=1460 [TCP segment of a reassembled PDU]"
"38.697109","172.19.0.3","5.9.29.183","TCP","56","43520 → 9002 [ACK] Seq=20005 Ack=348729 Win=11853 Len=0"
"38.697169","5.9.29.183","172.19.0.3","TLSv1.2","1516","Application Data [TCP segment of a reassembled PDU]"
"38.697173","5.9.29.183","172.19.0.3","TCP","1432","9002 → 43520 [PSH, ACK] Seq=351649 Ack=20005 Win=65535 Len=1376 [TCP segment of a reassembled PDU]"
"38.697194","172.19.0.3","5.9.29.183","TCP","56","43520 → 9002 [ACK] Seq=20005 Ack=353025 Win=11828 Len=0"
"38.712535","5.9.29.183","172.19.0.3","TCP","1516","9002 → 43520 [PSH, ACK] Seq=353025 Ack=20005 Win=65535 Len=1460 [TCP segment of a reassembled PDU]"
"38.712884","5.9.29.183","172.19.0.3","TLSv1.2","1492","Application Data, Application Data"
"38.712899","172.19.0.3","5.9.29.183","TCP","56","43520 → 9002 [ACK] Seq=20005 Ack=355921 Win=11911 Len=0"
"38.713065","5.9.29.183","172.19.0.3","TCP","1516","9002 → 43520 [PSH, ACK] Seq=355921 Ack=20005 Win=65535 Len=1460 [TCP segment of a reassembled PDU]"
"38.713072","5.9.29.183","172.19.0.3","TCP","1516","9002 → 43520 [PSH, ACK] Seq=357381 Ack=20005 Win=65535 Len=1460 [TCP segment of a reassembled PDU]"
"38.713075","5.9.29.183","172.19.0.3","TLSv1.2","247","Application Data"
"38.713300","172.19.0.3","5.9.29.183","TLSv1.2","599","Application Data"
"38.713543","5.9.29.183","172.19.0.3","TCP","56","9002 → 43520 [ACK] Seq=359032 Ack=20548 Win=65535 Len=0"
"38.713899","5.9.29.183","172.19.0.3","TCP","1516","[TCP segment of a reassembled PDU]"
"38.713944","5.9.29.183","172.19.0.3","TCP","1492","9002 → 43520 [PSH, ACK] Seq=360492 Ack=20548 Win=65535 Len=1436 [TCP segment of a reassembled PDU]"
"38.713960","172.19.0.3","5.9.29.183","TCP","56","43520 → 9002 [ACK] Seq=20548 Ack=361928 Win=11903 Len=0"
"38.728354","5.9.29.183","172.19.0.3","TLSv1.2","787","Application Data"
"38.769174","172.19.0.3","5.9.29.183","TCP","56","43520 → 9002 [ACK] Seq=20548 Ack=362659 Win=11911 Len=0"
"38.778879","5.9.29.183","172.19.0.3","TCP","1516","[TCP segment of a reassembled PDU]"
"38.778944","5.9.29.183","172.19.0.3","TLSv1.2","1195","Application Data"
"38.779098","172.19.0.3","5.9.29.183","TCP","56","43520 → 9002 [ACK] Seq=20548 Ack=365258 Win=11903 Len=0"
"38.784015","172.19.0.3","5.9.29.183","TLSv1.2","599","Application Data"
"38.784291","5.9.29.183","172.19.0.3","TCP","56","9002 → 43520 [ACK] Seq=365258 Ack=21091 Win=65535 Len=0"
"39.387291","5.9.29.183","172.19.0.3","TLSv1.2","599","Application Data"
"39.388349","172.19.0.3","5.9.29.183","TLSv1.2","599","Application Data"
"39.388846","5.9.29.183","172.19.0.3","TCP","56","9002 → 43520 [ACK] Seq=365801 Ack=21634 Win=65535 Len=0"
"40.075990","5.9.29.183","172.19.0.3","TCP","1504","[TCP segment of a reassembled PDU]"
"40.076087","5.9.29.183","172.19.0.3","TLSv1.2","693","Application Data"
"40.076229","172.19.0.3","5.9.29.183","TCP","56","43520 → 9002 [ACK] Seq=21634 Ack=367886 Win=11901 Len=0"
"40.114064","5.9.29.183","172.19.0.3","TCP","1516","[TCP segment of a reassembled PDU]"
"40.114136","5.9.29.183","172.19.0.3","TCP","1516","9002 → 43520 [PSH, ACK] Seq=369346 Ack=21634 Win=65535 Len=1460 [TCP segment of a reassembled PDU]"
"40.114153","172.19.0.3","5.9.29.183","TCP","56","43520 → 9002 [ACK] Seq=21634 Ack=370806 Win=11903 Len=0"
"40.114156","5.9.29.183","172.19.0.3","TLSv1.2","1213","Application Data"
"40.114238","5.9.29.183","172.19.0.3","TCP","1516","[TCP segment of a reassembled PDU]"
"40.114247","5.9.29.183","172.19.0.3","TCP","1516","9002 → 43520 [PSH, ACK] Seq=373423 Ack=21634 Win=65535 Len=1460 [TCP segment of a reassembled PDU]"
"40.114251","5.9.29.183","172.19.0.3","TLSv1.2","1480","Application Data [TCP segment of a reassembled PDU]"
"40.114296","172.19.0.3","5.9.29.183","TCP","56","43520 → 9002 [ACK] Seq=21634 Ack=376307 Win=11871 Len=0"
"40.129651","5.9.29.183","172.19.0.3","TLSv1.2","1488","Application Data"
"40.143884","5.9.29.183","172.19.0.3","TCP","1504","[TCP segment of a reassembled PDU]"
"40.143932","172.19.0.3","5.9.29.183","TCP","56","43520 → 9002 [ACK] Seq=21634 Ack=379187 Win=11911 Len=0"
"40.144371","5.9.29.183","172.19.0.3","TCP","1516","9002 → 43520 [PSH, ACK] Seq=379187 Ack=21634 Win=65535 Len=1460 [TCP segment of a reassembled PDU]"
"40.144427","5.9.29.183","172.19.0.3","TLSv1.2","1516","Application Data [TCP segment of a reassembled PDU]"
"40.144437","5.9.29.183","172.19.0.3","TCP","1516","9002 → 43520 [PSH, ACK] Seq=382107 Ack=21634 Win=65535 Len=1460 [TCP segment of a reassembled PDU]"
"40.144477","5.9.29.183","172.19.0.3","TCP","1516","9002 → 43520 [PSH, ACK] Seq=383567 Ack=21634 Win=65535 Len=1460 [TCP segment of a reassembled PDU]"
"40.144481","5.9.29.183","172.19.0.3","TLSv1.2","1456","Application Data [TCP segment of a reassembled PDU]"
"40.144484","5.9.29.183","172.19.0.3","TCP","1516","9002 → 43520 [PSH, ACK] Seq=386427 Ack=21634 Win=65535 Len=1460 [TCP segment of a reassembled PDU]"
"40.144521","5.9.29.183","172.19.0.3","TCP","1516","9002 → 43520 [PSH, ACK] Seq=387887 Ack=21634 Win=65535 Len=1460 [TCP segment of a reassembled PDU]"
"40.144523","172.19.0.3","5.9.29.183","TCP","56","43520 → 9002 [ACK] Seq=21634 Ack=387887 Win=11871 Len=0"
"40.144543","5.9.29.183","172.19.0.3","TLSv1.2","1480","Application Data [TCP segment of a reassembled PDU]"
"40.144746","172.19.0.3","5.9.29.183","TCP","56","43520 → 9002 [ACK] Seq=21634 Ack=390771 Win=11855 Len=0"
"40.145166","5.9.29.183","172.19.0.3","TCP","1516","9002 → 43520 [PSH, ACK] Seq=390771 Ack=21634 Win=65535 Len=1460 [TCP segment of a reassembled PDU]"
"40.145180","5.9.29.183","172.19.0.3","TCP","1492","9002 → 43520 [PSH, ACK] Seq=392231 Ack=21634 Win=65535 Len=1436 [TCP segment of a reassembled PDU]"
"40.145189","172.19.0.3","5.9.29.183","TCP","56","43520 → 9002 [ACK] Seq=21634 Ack=393667 Win=11903 Len=0"
"40.159542","5.9.29.183","172.19.0.3","TLSv1.2","1516","Application Data, Application Data"
"40.159561","5.9.29.183","172.19.0.3","TCP","1492","9002 → 43520 [PSH, ACK] Seq=395127 Ack=21634 Win=65535 Len=1436 [TCP segment of a reassembled PDU]"
"40.159574","172.19.0.3","5.9.29.183","TCP","56","43520 → 9002 [ACK] Seq=21634 Ack=396563 Win=11903 Len=0"
"40.159901","5.9.29.183","172.19.0.3","TCP","1516","9002 → 43520 [PSH, ACK] Seq=396563 Ack=21634 Win=65535 Len=1460 [TCP segment of a reassembled PDU]"
"40.159910","5.9.29.183","172.19.0.3","TLSv1.2","1492","Application Data [TCP segment of a reassembled PDU]"
"40.159913","5.9.29.183","172.19.0.3","TLSv1.2","127","Application Data"
"40.160138","172.19.0.3","5.9.29.183","TLSv1.2","1113","Application Data"
"40.160425","5.9.29.183","172.19.0.3","TCP","56","9002 → 43520 [ACK] Seq=399530 Ack=22691 Win=65535 Len=0"
"40.180838","5.9.29.183","172.19.0.3","TCP","1516","[TCP segment of a reassembled PDU]"
"40.180870","5.9.29.183","172.19.0.3","TLSv1.2","1195","Application Data"
"40.180887","172.19.0.3","5.9.29.183","TCP","56","43520 → 9002 [ACK] Seq=22691 Ack=402129 Win=11903 Len=0"
"40.217782","5.9.29.183","172.19.0.3","TCP","1516","[TCP segment of a reassembled PDU]"
"40.217820","5.9.29.183","172.19.0.3","TCP","1492","9002 → 43520 [PSH, ACK] Seq=403589 Ack=22691 Win=65535 Len=1436 [TCP segment of a reassembled PDU]"
"40.217844","172.19.0.3","5.9.29.183","TCP","56","43520 → 9002 [ACK] Seq=22691 Ack=405025 Win=11903 Len=0"
"40.218027","5.9.29.183","172.19.0.3","TLSv1.2","273","Application Data"
"40.231652","5.9.29.183","172.19.0.3","TCP","1516","[TCP segment of a reassembled PDU]"
"40.231675","172.19.0.3","5.9.29.183","TCP","56","43520 → 9002 [ACK] Seq=22691 Ack=406702 Win=11911 Len=0"
"40.231679","5.9.29.183","172.19.0.3","TCP","1101","9002 → 43520 [PSH, ACK] Seq=406702 Ack=22691 Win=65535 Len=1045 [TCP segment of a reassembled PDU]"
"40.231779","5.9.29.183","172.19.0.3","TCP","447","9002 → 43520 [PSH, ACK] Seq=407747 Ack=22691 Win=65535 Len=391 [TCP segment of a reassembled PDU]"
"40.231942","172.19.0.3","5.9.29.183","TCP","56","43520 → 9002 [ACK] Seq=22691 Ack=408138 Win=11911 Len=0"
"40.233139","5.9.29.183","172.19.0.3","TLSv1.2","1330","Application Data, Application Data"
"40.241593","5.9.29.183","172.19.0.3","TCP","1504","[TCP segment of a reassembled PDU]"
"40.241628","172.19.0.3","5.9.29.183","TCP","56","43520 → 9002 [ACK] Seq=22691 Ack=410860 Win=11911 Len=0"
"40.241881","5.9.29.183","172.19.0.3","TCP","1516","9002 → 43520 [PSH, ACK] Seq=410860 Ack=22691 Win=65535 Len=1460 [TCP segment of a reassembled PDU]"
"40.242204","5.9.29.183","172.19.0.3","TLSv1.2","1516","Application Data [TCP segment of a reassembled PDU]"
"40.242215","172.19.0.3","5.9.29.183","TCP","56","43520 → 9002 [ACK] Seq=22691 Ack=413780 Win=11911 Len=0"
"40.242221","5.9.29.183","172.19.0.3","TCP","1516","9002 → 43520 [PSH, ACK] Seq=413780 Ack=22691 Win=65535 Len=1460 [TCP segment of a reassembled PDU]"
"40.242225","5.9.29.183","172.19.0.3","TCP","1516","9002 → 43520 [PSH, ACK] Seq=415240 Ack=22691 Win=65535 Len=1460 [TCP segment of a reassembled PDU]"
"40.242360","5.9.29.183","172.19.0.3","TLSv1.2","1456","Application Data [TCP segment of a reassembled PDU]"
"40.242369","5.9.29.183","172.19.0.3","TLSv1.2","1516","Application Data [TCP segment of a reassembled PDU]"
"40.242388","5.9.29.183","172.19.0.3","TCP","1492","9002 → 43520 [PSH, ACK] Seq=419560 Ack=22691 Win=65535 Len=1436 [TCP segment of a reassembled PDU]"
"40.242419","172.19.0.3","5.9.29.183","TCP","56","43520 → 9002 [ACK] Seq=22691 Ack=420996 Win=11871 Len=0"
"40.242899","172.19.0.3","5.9.29.183","TLSv1.2","599","Application Data"
"40.243111","5.9.29.183","172.19.0.3","TCP","56","9002 → 43520 [ACK] Seq=420996 Ack=23234 Win=65535 Len=0"
"40.246574","5.9.29.183","172.19.0.3","TCP","1504","9002 → 43520 [PSH, ACK] Seq=420996 Ack=23234 Win=65535 Len=1448 [TCP segment of a reassembled PDU]"
"40.246763","5.9.29.183","172.19.0.3","TLSv1.2","1504","Application Data [TCP segment of a reassembled PDU]"
"40.246777","172.19.0.3","5.9.29.183","TCP","56","43520 → 9002 [ACK] Seq=23234 Ack=423892 Win=11911 Len=0"
"40.247071","5.9.29.183","172.19.0.3","TCP","1504","9002 → 43520 [PSH, ACK] Seq=423892 Ack=23234 Win=65535 Len=1448 [TCP segment of a reassembled PDU]"
"40.248271","5.9.29.183","172.19.0.3","TCP","1504","9002 → 43520 [PSH, ACK] Seq=425340 Ack=23234 Win=65535 Len=1448 [TCP segment of a reassembled PDU]"
"40.248281","172.19.0.3","5.9.29.183","TCP","56","43520 → 9002 [ACK] Seq=23234 Ack=426788 Win=11911 Len=0"
"40.257664","5.9.29.183","172.19.0.3","TLSv1.2","1504","Application Data [TCP segment of a reassembled PDU]"
"40.257843","5.9.29.183","172.19.0.3","TCP","1516","9002 → 43520 [PSH, ACK] Seq=428236 Ack=23234 Win=65535 Len=1460 [TCP segment of a reassembled PDU]"
"40.257854","5.9.29.183","172.19.0.3","TLSv1.2","1492","Application Data [TCP segment of a reassembled PDU]"
"40.257966","5.9.29.183","172.19.0.3","TCP","1516","9002 → 43520 [PSH, ACK] Seq=431132 Ack=23234 Win=65535 Len=1460 [TCP segment of a reassembled PDU]"
"40.257972","5.9.29.183","172.19.0.3","TCP","1516","9002 → 43520 [PSH, ACK] Seq=432592 Ack=23234 Win=65535 Len=1460 [TCP segment of a reassembled PDU]"
"40.257975","5.9.29.183","172.19.0.3","TLSv1.2","1516","Application Data [TCP segment of a reassembled PDU]"
"40.257987","5.9.29.183","172.19.0.3","TLSv1.2","402","Application Data"
"40.258004","172.19.0.3","5.9.29.183","TCP","56","43520 → 9002 [ACK] Seq=23234 Ack=435858 Win=11863 Len=0"
"40.262620","172.19.0.3","5.9.29.183","TLSv1.2","599","Application Data"
"40.262833","5.9.29.183","172.19.0.3","TCP","56","9002 → 43520 [ACK] Seq=435858 Ack=23777 Win=65535 Len=0"
"40.997150","5.9.29.183","172.19.0.3","TLSv1.2","599","Application Data"
"40.998097","172.19.0.3","5.9.29.183","TLSv1.2","599","Application Data"
"40.998676","5.9.29.183","172.19.0.3","TCP","56","9002 → 43520 [ACK] Seq=436401 Ack=24320 Win=65535 Len=0"
"41.525160","5.9.29.183","172.19.0.3","TCP","1516","[TCP segment of a reassembled PDU]"
"41.525237","5.9.29.183","172.19.0.3","TCP","1516","9002 → 43520 [PSH, ACK] Seq=437861 Ack=24320 Win=65535 Len=1460 [TCP segment of a reassembled PDU]"
"41.525251","5.9.29.183","172.19.0.3","TLSv1.2","763","Application Data"
"41.525392","172.19.0.3","5.9.29.183","TCP","56","43520 → 9002 [ACK] Seq=24320 Ack=440028 Win=11895 Len=0"
"41.644193","5.9.29.183","172.19.0.3","TCP","1516","[TCP segment of a reassembled PDU]"
"41.644261","5.9.29.183","172.19.0.3","TCP","1492","9002 → 43520 [PSH, ACK] Seq=441488 Ack=24320 Win=65535 Len=1436 [TCP segment of a reassembled PDU]"
"41.644282","172.19.0.3","5.9.29.183","TCP","56","43520 → 9002 [ACK] Seq=24320 Ack=442924 Win=11903 Len=0"
"41.644283","5.9.29.183","172.19.0.3","TLSv1.2","787","Application Data"
"41.656377","5.9.29.183","172.19.0.3","TCP","1504","[TCP segment of a reassembled PDU]"
"41.656404","172.19.0.3","5.9.29.183","TCP","56","43520 → 9002 [ACK] Seq=24320 Ack=445103 Win=11911 Len=0"
"41.656599","5.9.29.183","172.19.0.3","TCP","1504","9002 → 43520 [PSH, ACK] Seq=445103 Ack=24320 Win=65535 Len=1448 [TCP segment of a reassembled PDU]"
"41.659715","5.9.29.183","172.19.0.3","TLSv1.2","273","Application Data"
"41.659738","172.19.0.3","5.9.29.183","TCP","56","43520 → 9002 [ACK] Seq=24320 Ack=446768 Win=11911 Len=0"
"41.660191","172.19.0.3","5.9.29.183","TLSv1.2","599","Application Data"
"41.660523","5.9.29.183","172.19.0.3","TCP","56","9002 → 43520 [ACK] Seq=446768 Ack=24863 Win=65535 Len=0"
"41.670960","5.9.29.183","172.19.0.3","TCP","1504","[TCP segment of a reassembled PDU]"
"41.675069","5.9.29.183","172.19.0.3","TLSv1.2","179","Application Data"
"41.675093","172.19.0.3","5.9.29.183","TCP","56","43520 → 9002 [ACK] Seq=24863 Ack=448339 Win=11911 Len=0"
"41.680254","172.19.0.3","5.9.29.183","TLSv1.2","599","Application Data"
"41.680795","5.9.29.183","172.19.0.3","TCP","56","9002 → 43520 [ACK] Seq=448339 Ack=25406 Win=65535 Len=0"
"42.534170","5.9.29.183","172.19.0.3","TLSv1.2","599","Application Data"
"42.534973","172.19.0.3","5.9.29.183","TLSv1.2","599","Application Data"
"42.535297","5.9.29.183","172.19.0.3","TCP","56","9002 → 43520 [ACK] Seq=448882 Ack=25949 Win=65535 Len=0"
"43.149187","5.9.29.183","172.19.0.3","TLSv1.2","1516","Application Data"
"43.149304","5.9.29.183","172.19.0.3","TCP","587","9002 → 43520 [PSH, ACK] Seq=450342 Ack=25949 Win=65535 Len=531 [TCP segment of a reassembled PDU]"
"43.149445","172.19.0.3","5.9.29.183","TCP","56","43520 → 9002 [ACK] Seq=25949 Ack=450873 Win=11903 Len=0"
"43.164286","5.9.29.183","172.19.0.3","TLSv1.2","693","Application Data"
"43.168780","5.9.29.183","172.19.0.3","TCP","1504","[TCP segment of a reassembled PDU]"
"43.168804","172.19.0.3","5.9.29.183","TCP","56","43520 → 9002 [ACK] Seq=25949 Ack=452958 Win=11911 Len=0"
"43.179620","5.9.29.183","172.19.0.3","TLSv1.2","179","Application Data"
"43.208830","5.9.29.183","172.19.0.3","TCP","1516","[TCP segment of a reassembled PDU]"
"43.208857","172.19.0.3","5.9.29.183","TCP","56","43520 → 9002 [ACK] Seq=25949 Ack=454541 Win=11911 Len=0"
"43.208918","5.9.29.183","172.19.0.3","TLSv1.2","1195","Application Data"
"43.212935","172.19.0.3","5.9.29.183","TLSv1.2","599","Application Data"
"43.213173","5.9.29.183","172.19.0.3","TCP","56","9002 → 43520 [ACK] Seq=455680 Ack=26492 Win=65535 Len=0"
"44.321540","5.9.29.183","172.19.0.3","TLSv1.2","599","Application Data"
"44.322394","172.19.0.3","5.9.29.183","TLSv1.2","599","Application Data"
"44.322845","5.9.29.183","172.19.0.3","TCP","56","9002 → 43520 [ACK] Seq=456223 Ack=27035 Win=65535 Len=0"
"45.301197","5.9.29.183","172.19.0.3","TCP","1516","[TCP segment of a reassembled PDU]"
"45.301373","5.9.29.183","172.19.0.3","TCP","1492","9002 → 43520 [PSH, ACK] Seq=457683 Ack=27035 Win=65535 Len=1436 [TCP segment of a reassembled PDU]"
"45.301466","5.9.29.183","172.19.0.3","TLSv1.2","1237","Application Data"
"45.301473","5.9.29.183","172.19.0.3","TCP","1516","[TCP segment of a reassembled PDU]"
"45.301477","5.9.29.183","172.19.0.3","TCP","1492","9002 → 43520 [PSH, ACK] Seq=461760 Ack=27035 Win=65535 Len=1436 [TCP segment of a reassembled PDU]"
"45.301503","172.19.0.3","5.9.29.183","TCP","56","43520 → 9002 [ACK] Seq=27035 Ack=463196 Win=11879 Len=0"
"45.316867","5.9.29.183","172.19.0.3","TLSv1.2","1516","Application Data [TCP segment of a reassembled PDU]"
"45.316944","5.9.29.183","172.19.0.3","TCP","1492","9002 → 43520 [PSH, ACK] Seq=464656 Ack=27035 Win=65535 Len=1436 [TCP segment of a reassembled PDU]"
"45.316961","172.19.0.3","5.9.29.183","TCP","56","43520 → 9002 [ACK] Seq=27035 Ack=466092 Win=11903 Len=0"
"45.316964","5.9.29.183","172.19.0.3","TLSv1.2","1504","Application Data [TCP segment of a reassembled PDU]"
"45.317066","5.9.29.183","172.19.0.3","TLSv1.2","1191","Application Data"
"45.317111","172.19.0.3","5.9.29.183","TCP","56","43520 → 9002 [ACK] Seq=27035 Ack=468675 Win=11887 Len=0"
"45.328719","5.9.29.183","172.19.0.3","TCP","1504","[TCP segment of a reassembled PDU]"
"45.332240","5.9.29.183","172.19.0.3","TCP","1504","9002 → 43520 [PSH, ACK] Seq=470123 Ack=27035 Win=65535 Len=1448 [TCP segment of a reassembled PDU]"
"45.332270","172.19.0.3","5.9.29.183","TCP","56","43520 → 9002 [ACK] Seq=27035 Ack=471571 Win=11911 Len=0"
"45.332478","5.9.29.183","172.19.0.3","TLSv1.2","1504","Application Data [TCP segment of a reassembled PDU]"
"45.332483","5.9.29.183","172.19.0.3","TCP","320","9002 → 43520 [PSH, ACK] Seq=473019 Ack=27035 Win=65535 Len=264 [TCP segment of a reassembled PDU]"
"45.332532","172.19.0.3","5.9.29.183","TCP","56","43520 → 9002 [ACK] Seq=27035 Ack=473283 Win=11903 Len=0"
"45.332549","5.9.29.183","172.19.0.3","TLSv1.2","1240","Application Data [TCP segment of a reassembled PDU]"
"45.332946","5.9.29.183","172.19.0.3","TCP","1504","9002 → 43520 [PSH, ACK] Seq=474467 Ack=27035 Win=65535 Len=1448 [TCP segment of a reassembled PDU]"
"45.332956","172.19.0.3","5.9.29.183","TCP","56","43520 → 9002 [ACK] Seq=27035 Ack=475915 Win=11909 Len=0"
"45.446873","5.9.29.183","172.19.0.3","TLSv1.2","1516","Application Data [TCP segment of a reassembled PDU]"
"45.446988","5.9.29.183","172.19.0.3","TCP","1492","9002 → 43520 [PSH, ACK] Seq=477375 Ack=27035 Win=65535 Len=1436 [TCP segment of a reassembled PDU]"
"45.447000","5.9.29.183","172.19.0.3","TCP","1516","9002 → 43520 [PSH, ACK] Seq=478811 Ack=27035 Win=65535 Len=1460 [TCP segment of a reassembled PDU]"
"45.447028","5.9.29.183","172.19.0.3","TLSv1.2","1492","Application Data, Application Data"
"45.447033","5.9.29.183","172.19.0.3","TLSv1.2","1076","Application Data"
"45.447103","172.19.0.3","5.9.29.183","TCP","56","43520 → 9002 [ACK] Seq=27035 Ack=482727 Win=11879 Len=0"
"45.447764","172.19.0.3","5.9.29.183","TLSv1.2","599","Application Data"
"45.448017","5.9.29.183","172.19.0.3","TCP","56","9002 → 43520 [ACK] Seq=482727 Ack=27578 Win=65535 Len=0"
"45.462443","5.9.29.183","172.19.0.3","TCP","1504","[TCP segment of a reassembled PDU]"
"45.462616","5.9.29.183","172.19.0.3","TCP","1504","9002 → 43520 [PSH, ACK] Seq=484175 Ack=27578 Win=65535 Len=1448 [TCP segment of a reassembled PDU]"
"45.462689","172.19.0.3","5.9.29.183","TCP","56","43520 → 9002 [ACK] Seq=27578 Ack=485623 Win=11903 Len=0"
"45.462828","5.9.29.183","172.19.0.3","TLSv1.2","1516","Application Data [TCP segment of a reassembled PDU]"
"45.463079","5.9.29.183","172.19.0.3","TCP","1492","9002 → 43520 [PSH, ACK] Seq=487083 Ack=27578 Win=65535 Len=1436 [TCP segment of a reassembled PDU]"
"45.463091","172.19.0.3","5.9.29.183","TCP","56","43520 → 9002 [ACK] Seq=27578 Ack=488519 Win=11903 Len=0"
"45.463094","5.9.29.183","172.19.0.3","TLSv1.2","1004","Application Data"
"45.478564","5.9.29.183","172.19.0.3","TLSv1.2","1113","Application Data"
"45.478588","172.19.0.3","5.9.29.183","TCP","56","43520 → 9002 [ACK] Seq=27578 Ack=490524 Win=11911 Len=0"
"45.483112","172.19.0.3","5.9.29.183","TLSv1.2","599","Application Data"
"45.483399","5.9.29.183","172.19.0.3","TCP","56","9002 → 43520 [ACK] Seq=490524 Ack=28121 Win=65535 Len=0"
"45.892462","5.9.29.183","172.19.0.3","TLSv1.2","599","Application Data"
"45.893270","172.19.0.3","5.9.29.183","TLSv1.2","599","Application Data"
"45.893709","5.9.29.183","172.19.0.3","TCP","56","9002 → 43520 [ACK] Seq=491067 Ack=28664 Win=65535 Len=0"
"46.070038","02:42:7b:11:31:3d","","ARP","44","Who has 172.19.0.3? Tell 172.19.0.1"
"46.070083","02:42:ac:13:00:03","","ARP","44","172.19.0.3 is at 02:42:ac:13:00:03"
"46.838326","5.9.29.183","172.19.0.3","TLSv1.2","599","Application Data"
"46.838389","5.9.29.183","172.19.0.3","TCP","1516","[TCP segment of a reassembled PDU]"
"46.838405","5.9.29.183","172.19.0.3","TCP","1492","9002 → 43520 [PSH, ACK] Seq=493070 Ack=28664 Win=65535 Len=1436 [TCP segment of a reassembled PDU]"
"46.838466","5.9.29.183","172.19.0.3","TLSv1.2","273","Application Data"
"46.838587","172.19.0.3","5.9.29.183","TCP","56","43520 → 9002 [ACK] Seq=28664 Ack=494723 Win=11885 Len=0"
"46.842806","172.19.0.3","5.9.29.183","TLSv1.2","599","Application Data"
"46.843026","5.9.29.183","172.19.0.3","TCP","56","9002 → 43520 [ACK] Seq=494723 Ack=29207 Win=65535 Len=0"
"47.478654","5.9.29.183","172.19.0.3","TLSv1.2","599","Application Data"
"47.479605","172.19.0.3","5.9.29.183","TLSv1.2","599","Application Data"
"47.479959","5.9.29.183","172.19.0.3","TCP","56","9002 → 43520 [ACK] Seq=495266 Ack=29750 Win=65535 Len=0"
"48.301928","5.9.29.183","172.19.0.3","TCP","1516","[TCP segment of a reassembled PDU]"
"48.302004","5.9.29.183","172.19.0.3","TCP","1516","9002 → 43520 [PSH, ACK] Seq=496726 Ack=29750 Win=65535 Len=1460 [TCP segment of a reassembled PDU]"
"48.302016","5.9.29.183","172.19.0.3","TLSv1.2","763","Application Data"
"48.302198","172.19.0.3","5.9.29.183","TCP","56","43520 → 9002 [ACK] Seq=29750 Ack=498893 Win=11895 Len=0"
"48.361103","5.9.29.183","172.19.0.3","TLSv1.2","599","Application Data"
"48.373887","5.9.29.183","172.19.0.3","TCP","1516","[TCP segment of a reassembled PDU]"
"48.373911","172.19.0.3","5.9.29.183","TCP","56","43520 → 9002 [ACK] Seq=29750 Ack=500896 Win=11911 Len=0"
"48.373973","5.9.29.183","172.19.0.3","TCP","1492","9002 → 43520 [PSH, ACK] Seq=500896 Ack=29750 Win=65535 Len=1436 [TCP segment of a reassembled PDU]"
"48.376098","5.9.29.183","172.19.0.3","TLSv1.2","787","Application Data"
"48.376113","172.19.0.3","5.9.29.183","TCP","56","43520 → 9002 [ACK] Seq=29750 Ack=503063 Win=11911 Len=0"
"48.376481","172.19.0.3","5.9.29.183","TLSv1.2","599","Application Data"
"48.376776","5.9.29.183","172.19.0.3","TCP","56","9002 → 43520 [ACK] Seq=503063 Ack=30293 Win=65535 Len=0"
"48.385763","5.9.29.183","172.19.0.3","TCP","1516","[TCP segment of a reassembled PDU]"
"48.385815","5.9.29.183","172.19.0.3","TCP","1492","9002 → 43520 [PSH, ACK] Seq=504523 Ack=30293 Win=65535 Len=1436 [TCP segment of a reassembled PDU]"
"48.385939","172.19.0.3","5.9.29.183","TCP","56","43520 → 9002 [ACK] Seq=30293 Ack=505959 Win=11903 Len=0"
"48.391494","5.9.29.183","172.19.0.3","TLSv1.2","1330","Application Data, Application Data"
"48.397633","5.9.29.183","172.19.0.3","TCP","1516","[TCP segment of a reassembled PDU]"
"48.397657","172.19.0.3","5.9.29.183","TCP","56","43520 → 9002 [ACK] Seq=30293 Ack=508693 Win=11911 Len=0"
"48.397715","5.9.29.183","172.19.0.3","TCP","1492","9002 → 43520 [PSH, ACK] Seq=508693 Ack=30293 Win=65535 Len=1436 [TCP segment of a reassembled PDU]"
"48.407342","5.9.29.183","172.19.0.3","TLSv1.2","273","Application Data"
"48.407366","172.19.0.3","5.9.29.183","TCP","56","43520 → 9002 [ACK] Seq=30293 Ack=510346 Win=11911 Len=0"
"48.420599","5.9.29.183","172.19.0.3","TCP","1504","[TCP segment of a reassembled PDU]"
"48.420788","5.9.29.183","172.19.0.3","TCP","1504","9002 → 43520 [PSH, ACK] Seq=511794 Ack=30293 Win=65535 Len=1448 [TCP segment of a reassembled PDU]"
"48.420874","172.19.0.3","5.9.29.183","TCP","56","43520 → 9002 [ACK] Seq=30293 Ack=513242 Win=11903 Len=0"
"48.420896","5.9.29.183","172.19.0.3","TLSv1.2","1504","Application Data [TCP segment of a reassembled PDU]"
"48.422174","5.9.29.183","172.19.0.3","TLSv1.2","1424","Application Data"
"48.422185","172.19.0.3","5.9.29.183","TCP","56","43520 → 9002 [ACK] Seq=30293 Ack=516058 Win=11911 Len=0"
"48.563790","5.9.29.183","172.19.0.3","TCP","1516","[TCP segment of a reassembled PDU]"
"48.563863","5.9.29.183","172.19.0.3","TCP","1516","9002 → 43520 [PSH, ACK] Seq=517518 Ack=30293 Win=65535 Len=1460 [TCP segment of a reassembled PDU]"
"48.563878","5.9.29.183","172.19.0.3","TLSv1.2","763","Application Data"
"48.564033","172.19.0.3","5.9.29.183","TCP","56","43520 → 9002 [ACK] Seq=30293 Ack=519685 Win=11893 Len=0"
"48.590625","5.9.29.183","172.19.0.3","TLSv1.2","1113","Application Data"
"48.631618","172.19.0.3","5.9.29.183","TCP","56","43520 → 9002 [ACK] Seq=30293 Ack=520742 Win=11911 Len=0"
