_ws.col.Time,_ws.col.Source,_ws.col.Destination,_ws.col.Protocol,_ws.col.Length,_ws.col.Info
"0.000000","172.19.0.3","5.9.29.183","TLSv1.2","599","Application Data"
"0.000366","5.9.29.183","172.19.0.3","TCP","56","9002 → 43520 [ACK] Seq=1 Ack=544 Win=65535 Len=0"
"0.506801","5.9.29.183","172.19.0.3","TLSv1.2","599","Application Data"
"0.507565","172.19.0.3","5.9.29.183","TLSv1.2","2141","Application Data"
"0.507802","5.9.29.183","172.19.0.3","TCP","56","9002 → 43520 [ACK] Seq=544 Ack=2004 Win=65535 Len=0"
"0.507880","5.9.29.183","172.19.0.3","TCP","56","9002 → 43520 [ACK] Seq=544 Ack=2629 Win=65535 Len=0"
"1.630953","5.9.29.183","172.19.0.3","TLSv1.2","599","Application Data"
"1.641762","5.9.29.183","172.19.0.3","TCP","1504","[TCP segment of a reassembled PDU]"
"1.641787","172.19.0.3","5.9.29.183","TCP","56","43520 → 9002 [ACK] Seq=2629 Ack=2535 Win=11911 Len=0"
"1.646703","5.9.29.183","172.19.0.3","TLSv1.2","179","Application Data"
"1.650388","172.19.0.3","5.9.29.183","TLSv1.2","599","Application Data"
"1.650700","5.9.29.183","172.19.0.3","TCP","56","9002 → 43520 [ACK] Seq=2658 Ack=3172 Win=65535 Len=0"
"2.207200","5.9.29.183","172.19.0.3","TLSv1.2","599","Application Data"
"2.207903","172.19.0.3","5.9.29.183","TLSv1.2","599","Application Data"
"2.208217","5.9.29.183","172.19.0.3","TCP","56","9002 → 43520 [ACK] Seq=3201 Ack=3715 Win=65535 Len=0"
"2.879322","5.9.29.183","172.19.0.3","TLSv1.2","599","Application Data"
"2.879427","5.9.29.183","172.19.0.3","TCP","1516","[TCP segment of a reassembled PDU]"
"2.879442","5.9.29.183","172.19.0.3","TCP","1492","9002 → 43520 [PSH, ACK] Seq=5204 Ack=3715 Win=65535 Len=1436 [TCP segment of a reassembled PDU]"
"2.879609","172.19.0.3","5.9.29.183","TCP","56","43520 → 9002 [ACK] Seq=3715 Ack=6640 Win=11895 Len=0"
"2.880091","5.9.29.183","172.19.0.3","TLSv1.2","1504","Application Data [TCP segment of a reassembled PDU]"
"2.880444","5.9.29.183","172.19.0.3","TCP","1504","9002 → 43520 [PSH, ACK] Seq=8088 Ack=3715 Win=65535 Len=1448 [TCP segment of a reassembled PDU]"
"2.880458","172.19.0.3","5.9.29.183","TCP","56","43520 → 9002 [ACK] Seq=3715 Ack=9536 Win=11911 Len=0"
"2.880505","5.9.29.183","172.19.0.3","TCP","1504","9002 → 43520 [PSH, ACK] Seq=9536 Ack=3715 Win=65535 Len=1448 [TCP segment of a reassembled PDU]"
"2.880943","5.9.29.183","172.19.0.3","TLSv1.2","1504","Application Data, Application Data"
"2.880955","172.19.0.3","5.9.29.183","TCP","56","43520 → 9002 [ACK] Seq=3715 Ack=12432 Win=11911 Len=0"
"2.881114","5.9.29.183","172.19.0.3","TCP","1516","9002 → 43520 [PSH, ACK] Seq=12432 Ack=3715 Win=65535 Len=1460 [TCP segment of a reassembled PDU]"
"2.881122","5.9.29.183","172.19.0.3","TLSv1.2","1492","Application Data [TCP segment of a reassembled PDU]"
"2.881125","5.9.29.183","172.19.0.3","TCP","1504","9002 → 43520 [PSH, ACK] Seq=15328 Ack=3715 Win=65535 Len=1448 [TCP segment of a reassembled PDU]"
"2.881172","172.19.0.3","5.9.29.183","TCP","56","43520 → 9002 [ACK] Seq=3715 Ack=16776 Win=11887 Len=0"
"2.881498","172.19.0.3","5.9.29.183","TLSv1.2","599","Application Data"
"2.881692","5.9.29.183","172.19.0.3","TCP","56","9002 → 43520 [ACK] Seq=16776 Ack=4258 Win=65535 Len=0"
"2.894764","5.9.29.183","172.19.0.3","TCP","1516","9002 → 43520 [PSH, ACK] Seq=16776 Ack=4258 Win=65535 Len=1460 [TCP segment of a reassembled PDU]"
"2.894819","5.9.29.183","172.19.0.3","TLSv1.2","1492","Application Data [TCP segment of a reassembled PDU]"
"2.894832","172.19.0.3","5.9.29.183","TCP","56","43520 → 9002 [ACK] Seq=4258 Ack=19672 Win=11903 Len=0"
"2.896029","5.9.29.183","172.19.0.3","TCP","1504","9002 → 43520 [PSH, ACK] Seq=19672 Ack=4258 Win=65535 Len=1448 [TCP segment of a reassembled PDU]"
"2.896069","5.9.29.183","172.19.0.3","TLSv1.2","1358","Application Data"
"2.896076","172.19.0.3","5.9.29.183","TCP","56","43520 → 9002 [ACK] Seq=4258 Ack=22422 Win=11903 Len=0"
"2.899160","172.19.0.3","5.9.29.183","TLSv1.2","599","Application Data"
"2.899391","5.9.29.183","172.19.0.3","TCP","56","9002 → 43520 [ACK] Seq=22422 Ack=4801 Win=65535 Len=0"
"3.391747","5.9.29.183","172.19.0.3","TLSv1.2","599","Application Data"
"3.392394","172.19.0.3","5.9.29.183","TLSv1.2","599","Application Data"
"3.392653","5.9.29.183","172.19.0.3","TCP","56","9002 → 43520 [ACK] Seq=22965 Ack=5344 Win=65535 Len=0"
"4.519599","5.9.29.183","172.19.0.3","TLSv1.2","599","Application Data"
"4.531696","5.9.29.183","172.19.0.3","TCP","1504","[TCP segment of a reassembled PDU]"
"4.531717","172.19.0.3","5.9.29.183","TCP","56","43520 → 9002 [ACK] Seq=5344 Ack=24956 Win=11911 Len=0"
"4.532205","5.9.29.183","172.19.0.3","TCP","1504","9002 → 43520 [PSH, ACK] Seq=24956 Ack=5344 Win=65535 Len=1448 [TCP segment of a reassembled PDU]"
"4.532417","5.9.29.183","172.19.0.3","TLSv1.2","1516","Application Data [TCP segment of a reassembled PDU]"
"4.532429","172.19.0.3","5.9.29.183","TCP","56","43520 → 9002 [ACK] Seq=5344 Ack=27864 Win=11911 Len=0"
"4.532463","5.9.29.183","172.19.0.3","TCP","1492","9002 → 43520 [PSH, ACK] Seq=27864 Ack=5344 Win=65535 Len=1436 [TCP segment of a reassembled PDU]"
"4.532519","5.9.29.183","172.19.0.3","TCP","1504","9002 → 43520 [PSH, ACK] Seq=29300 Ack=5344 Win=65535 Len=1448 [TCP segment of a reassembled PDU]"
"4.532639","172.19.0.3","5.9.29.183","TCP","56","43520 → 9002 [ACK] Seq=5344 Ack=30748 Win=11893 Len=0"
"4.535277","5.9.29.183","172.19.0.3","TLSv1.2","584","Application Data"
"4.550548","5.9.29.183","172.19.0.3","TCP","1516","[TCP segment of a reassembled PDU]"
"4.550567","172.19.0.3","5.9.29.183","TCP","56","43520 → 9002 [ACK] Seq=5344 Ack=32736 Win=11911 Len=0"
"4.550614","5.9.29.183","172.19.0.3","TCP","1516","9002 → 43520 [PSH, ACK] Seq=32736 Ack=5344 Win=65535 Len=1460 [TCP segment of a reassembled PDU]"
"4.550623","5.9.29.183","172.19.0.3","TLSv1.2","1516","Application Data [TCP segment of a reassembled PDU]"
"4.550718","5.9.29.183","172.19.0.3","TCP","1468","9002 → 43520 [PSH, ACK] Seq=35656 Ack=5344 Win=65535 Len=1412 [TCP segment of a reassembled PDU]"
"4.550727","5.9.29.183","172.19.0.3","TCP","1516","9002 → 43520 [PSH, ACK] Seq=37068 Ack=5344 Win=65535 Len=1460 [TCP segment of a reassembled PDU]"
"4.550732","5.9.29.183","172.19.0.3","TLSv1.2","1492","Application Data [TCP segment of a reassembled PDU]"
"4.550736","5.9.29.183","172.19.0.3","TCP","1516","9002 → 43520 [PSH, ACK] Seq=39964 Ack=5344 Win=65535 Len=1460 [TCP segment of a reassembled PDU]"
"4.550738","5.9.29.183","172.19.0.3","TCP","1492","9002 → 43520 [PSH, ACK] Seq=41424 Ack=5344 Win=65535 Len=1436 [TCP segment of a reassembled PDU]"
"4.550752","172.19.0.3","5.9.29.183","TCP","56","43520 → 9002 [ACK] Seq=5344 Ack=39964 Win=11871 Len=0"
"4.550819","172.19.0.3","5.9.29.183","TCP","56","43520 → 9002 [ACK] Seq=5344 Ack=42860 Win=11855 Len=0"
"4.551239","5.9.29.183","172.19.0.3","TLSv1.2","381","Application Data"
"4.569485","5.9.29.183","172.19.0.3","TCP","1504","[TCP segment of a reassembled PDU]"
"4.569505","172.19.0.3","5.9.29.183","TCP","56","43520 → 9002 [ACK] Seq=5344 Ack=44633 Win=11911 Len=0"
"4.569917","5.9.29.183","172.19.0.3","TCP","1504","9002 → 43520 [PSH, ACK] Seq=44633 Ack=5344 Win=65535 Len=1448 [TCP segment of a reassembled PDU]"
"4.570197","5.9.29.183","172.19.0.3","TLSv1.2","1237","Application Data"
"4.570207","172.19.0.3","5.9.29.183","TCP","56","43520 → 9002 [ACK] Seq=5344 Ack=47262 Win=11911 Len=0"
"4.570236","5.9.29.183","172.19.0.3","TCP","979","[TCP segment of a reassembled PDU]"
"4.570320","5.9.29.183","172.19.0.3","TCP","1516","9002 → 43520 [PSH, ACK] Seq=48185 Ack=5344 Win=65535 Len=1460 [TCP segment of a reassembled PDU]"
"4.570441","172.19.0.3","5.9.29.183","TCP","56","43520 → 9002 [ACK] Seq=5344 Ack=49645 Win=11895 Len=0"
"4.570451","5.9.29.183","172.19.0.3","TCP","569","9002 → 43520 [PSH, ACK] Seq=49645 Ack=5344 Win=65535 Len=513 [TCP segment of a reassembled PDU]"
"4.570487","5.9.29.183","172.19.0.3","TLSv1.2","1516","Application Data [TCP segment of a reassembled PDU]"
"4.570494","172.19.0.3","5.9.29.183","TCP","56","43520 → 9002 [ACK] Seq=5344 Ack=51618 Win=11911 Len=0"
"4.570563","5.9.29.183","172.19.0.3","TCP","1516","9002 → 43520 [PSH, ACK] Seq=51618 Ack=5344 Win=65535 Len=1460 [TCP segment of a reassembled PDU]"
"4.570567","5.9.29.183","172.19.0.3","TCP","1480","9002 → 43520 [PSH, ACK] Seq=53078 Ack=5344 Win=65535 Len=1424 [TCP segment of a reassembled PDU]"
"4.570675","172.19.0.3","5.9.29.183","TLSv1.2","599","Application Data"
"4.570834","5.9.29.183","172.19.0.3","TCP","56","9002 → 43520 [ACK] Seq=54502 Ack=5887 Win=65535 Len=0"
"4.586935","5.9.29.183","172.19.0.3","TLSv1.2","1516","Application Data, Application Data"
"4.587005","5.9.29.183","172.19.0.3","TCP","1516","9002 → 43520 [PSH, ACK] Seq=55962 Ack=5887 Win=65535 Len=1460 [TCP segment of a reassembled PDU]"
"4.587018","172.19.0.3","5.9.29.183","TCP","56","43520 → 9002 [ACK] Seq=5887 Ack=57422 Win=11901 Len=0"
"4.587020","5.9.29.183","172.19.0.3","TCP","1516","9002 → 43520 [PSH, ACK] Seq=57422 Ack=5887 Win=65535 Len=1460 [TCP segment of a reassembled PDU]"
"4.587023","5.9.29.183","172.19.0.3","TLSv1.2","1155","Application Data [TCP segment of a reassembled PDU]"
"4.587025","5.9.29.183","172.19.0.3","TCP","1516","9002 → 43520 [PSH, ACK] Seq=59981 Ack=5887 Win=65535 Len=1460 [TCP segment of a reassembled PDU]"
"4.587027","5.9.29.183","172.19.0.3","TCP","1492","9002 → 43520 [PSH, ACK] Seq=61441 Ack=5887 Win=65535 Len=1436 [TCP segment of a reassembled PDU]"
"4.587225","172.19.0.3","5.9.29.183","TCP","56","43520 → 9002 [ACK] Seq=5887 Ack=62877 Win=11869 Len=0"
"4.587555","5.9.29.183","172.19.0.3","TLSv1.2","1504","Application Data [TCP segment of a reassembled PDU]"
"4.601843","5.9.29.183","172.19.0.3","TLSv1.2","193","Application Data"
"4.601861","172.19.0.3","5.9.29.183","TCP","56","43520 → 9002 [ACK] Seq=5887 Ack=64462 Win=11911 Len=0"
"4.603003","5.9.29.183","172.19.0.3","TCP","1504","[TCP segment of a reassembled PDU]"
"4.603623","5.9.29.183","172.19.0.3","TCP","1504","9002 → 43520 [PSH, ACK] Seq=65910 Ack=5887 Win=65535 Len=1448 [TCP segment of a reassembled PDU]"
"4.603630","172.19.0.3","5.9.29.183","TCP","56","43520 → 9002 [ACK] Seq=5887 Ack=67358 Win=11911 Len=0"
"4.603862","5.9.29.183","172.19.0.3","TLSv1.2","1516","Application Data [TCP segment of a reassembled PDU]"
"4.603890","5.9.29.183","172.19.0.3","TCP","1492","9002 → 43520 [PSH, ACK] Seq=68818 Ack=5887 Win=65535 Len=1436 [TCP segment of a reassembled PDU]"
"4.603895","5.9.29.183","172.19.0.3","TCP","1504","9002 → 43520 [PSH, ACK] Seq=70254 Ack=5887 Win=65535 Len=1448 [TCP segment of a reassembled PDU]"
"4.603934","172.19.0.3","5.9.29.183","TCP","56","43520 → 9002 [ACK] Seq=5887 Ack=71702 Win=11895 Len=0"
"4.604078","172.19.0.3","5.9.29.183","TLSv1.2","599","Application Data"
"4.604244","5.9.29.183","172.19.0.3","TCP","56","9002 → 43520 [ACK] Seq=71702 Ack=6430 Win=65535 Len=0"
"4.617389","5.9.29.183","172.19.0.3","TLSv1.2","1127","Application Data, Application Data"
"4.625291","5.9.29.183","172.19.0.3","TCP","1504","[TCP segment of a reassembled PDU]"
"4.625308","172.19.0.3","5.9.29.183","TCP","56","43520 → 9002 [ACK] Seq=6430 Ack=74221 Win=11911 Len=0"
"4.625668","5.9.29.183","172.19.0.3","TCP","1516","9002 → 43520 [PSH, ACK] Seq=74221 Ack=6430 Win=65535 Len=1460 [TCP segment of a reassembled PDU]"
"4.625698","5.9.29.183","172.19.0.3","TLSv1.2","1492","Application Data [TCP segment of a reassembled PDU]"
"4.625755","172.19.0.3","5.9.29.183","TCP","56","43520 → 9002 [ACK] Seq=6430 Ack=77117 Win=11903 Len=0"
"4.625922","172.19.0.3","5.9.29.183","TLSv1.2","599","Application Data"
"4.626063","5.9.29.183","172.19.0.3","TCP","1504","9002 → 43520 [PSH, ACK] Seq=77117 Ack=6430 Win=65535 Len=1448 [TCP segment of a reassembled PDU]"
"4.626363","5.9.29.183","172.19.0.3","TCP","1516","9002 → 43520 [PSH, ACK] Seq=78565 Ack=6430 Win=65535 Len=1460 [TCP segment of a reassembled PDU]"
"4.626370","172.19.0.3","5.9.29.183","TCP","56","43520 → 9002 [ACK] Seq=6973 Ack=80025 Win=11911 Len=0"
"4.626395","5.9.29.183","172.19.0.3","TLSv1.2","1492","Application Data [TCP segment of a reassembled PDU]"
"4.626476","5.9.29.183","172.19.0.3","TCP","56","9002 → 43520 [ACK] Seq=81461 Ack=6973 Win=65535 Len=0"
"4.626819","5.9.29.183","172.19.0.3","TCP","1504","9002 → 43520 [PSH, ACK] Seq=81461 Ack=6973 Win=65535 Len=1448 [TCP segment of a reassembled PDU]"
"4.626828","172.19.0.3","5.9.29.183","TCP","56","43520 → 9002 [ACK] Seq=6973 Ack=82909 Win=11911 Len=0"
"4.626925","5.9.29.183","172.19.0.3","TCP","1504","9002 → 43520 [PSH, ACK] Seq=82909 Ack=6973 Win=65535 Len=1448 [TCP segment of a reassembled PDU]"
"4.626973","5.9.29.183","172.19.0.3","TLSv1.2","1504","Application Data [TCP segment of a reassembled PDU]"
"4.626978","172.19.0.3","5.9.29.183","TCP","56","43520 → 9002 [ACK] Seq=6973 Ack=85805 Win=11911 Len=0"
"4.627003","5.9.29.183","172.19.0.3","TCP","1504","9002 → 43520 [PSH, ACK] Seq=85805 Ack=6973 Win=65535 Len=1448 [TCP segment of a reassembled PDU]"
"4.627008","5.9.29.183","172.19.0.3","TCP","1504","9002 → 43520 [PSH, ACK] Seq=87253 Ack=6973 Win=65535 Len=1448 [TCP segment of a reassembled PDU]"
"4.627059","172.19.0.3","5.9.29.183","TCP","56","43520 → 9002 [ACK] Seq=6973 Ack=88701 Win=11895 Len=0"
"4.633566","5.9.29.183","172.19.0.3","TLSv1.2","721","Application Data, Application Data"
"4.646361","5.9.29.183","172.19.0.3","TCP","1504","[TCP segment of a reassembled PDU]"
"4.646387","172.19.0.3","5.9.29.183","TCP","56","43520 → 9002 [ACK] Seq=6973 Ack=90814 Win=11911 Len=0"
"4.646624","5.9.29.183","172.19.0.3","TCP","1516","9002 → 43520 [PSH, ACK] Seq=90814 Ack=6973 Win=65535 Len=1460 [TCP segment of a reassembled PDU]"
"4.646655","5.9.29.183","172.19.0.3","TLSv1.2","1492","Application Data [TCP segment of a reassembled PDU]"
"4.646757","5.9.29.183","172.19.0.3","TCP","1504","9002 → 43520 [PSH, ACK] Seq=93710 Ack=6973 Win=65535 Len=1448 [TCP segment of a reassembled PDU]"
"4.646762","172.19.0.3","5.9.29.183","TCP","56","43520 → 9002 [ACK] Seq=6973 Ack=93710 Win=11895 Len=0"
"4.646827","5.9.29.183","172.19.0.3","TCP","1504","9002 → 43520 [PSH, ACK] Seq=95158 Ack=6973 Win=65535 Len=1448 [TCP segment of a reassembled PDU]"
"4.646851","172.19.0.3","5.9.29.183","TCP","56","43520 → 9002 [ACK] Seq=6973 Ack=96606 Win=11879 Len=0"
"4.646985","5.9.29.183","172.19.0.3","TLSv1.2","1504","Application Data [TCP segment of a reassembled PDU]"
"4.649051","5.9.29.183","172.19.0.3","TLSv1.2","1221","Application Data"
"4.649058","172.19.0.3","5.9.29.183","TCP","56","43520 → 9002 [ACK] Seq=6973 Ack=99219 Win=11911 Len=0"
"4.663839","5.9.29.183","172.19.0.3","TCP","1516","[TCP segment of a reassembled PDU]"
"4.663871","5.9.29.183","172.19.0.3","TCP","1492","9002 → 43520 [PSH, ACK] Seq=100679 Ack=6973 Win=65535 Len=1436 [TCP segment of a reassembled PDU]"
"4.663970","172.19.0.3","5.9.29.183","TCP","56","43520 → 9002 [ACK] Seq=6973 Ack=102115 Win=11903 Len=0"
"4.664452","5.9.29.183","172.19.0.3","TLSv1.2","1516","Application Data [TCP segment of a reassembled PDU]"
"4.664466","5.9.29.183","172.19.0.3","TLSv1.2","898","Application Data"
"4.664475","172.19.0.3","5.9.29.183","TCP","56","43520 → 9002 [ACK] Seq=6973 Ack=104417 Win=11903 Len=0"
"4.664771","172.19.0.3","5.9.29.183","TLSv1.2","599","Application Data"
"4.665035","5.9.29.183","172.19.0.3","TCP","56","9002 → 43520 [ACK] Seq=104417 Ack=7516 Win=65535 Len=0"
"4.674829","172.19.0.3","5.9.29.183","TLSv1.2","599","Application Data"
"4.675202","5.9.29.183","172.19.0.3","TCP","56","9002 → 43520 [ACK] Seq=104417 Ack=8059 Win=65535 Len=0"
"5.413613","5.9.29.183","172.19.0.3","TLSv1.2","599","Application Data"
"5.414298","172.19.0.3","5.9.29.183","TLSv1.2","599","Application Data"
"5.414524","5.9.29.183","172.19.0.3","TCP","56","9002 → 43520 [ACK] Seq=104960 Ack=8602 Win=65535 Len=0"
"5.929221","5.9.29.183","172.19.0.3","TCP","1516","[TCP segment of a reassembled PDU]"
"5.929261","5.9.29.183","172.19.0.3","TCP","1516","9002 → 43520 [PSH, ACK] Seq=106420 Ack=8602 Win=65535 Len=1460 [TCP segment of a reassembled PDU]"
"5.929273","5.9.29.183","172.19.0.3","TLSv1.2","763","Application Data"
"5.929403","172.19.0.3","5.9.29.183","TCP","56","43520 → 9002 [ACK] Seq=8602 Ack=108587 Win=11895 Len=0"
"5.984939","5.9.29.183","172.19.0.3","TCP","1516","[TCP segment of a reassembled PDU]"
"5.984958","5.9.29.183","172.19.0.3","TCP","1492","9002 → 43520 [PSH, ACK] Seq=110047 Ack=8602 Win=65535 Len=1436 [TCP segment of a reassembled PDU]"
"5.984971","172.19.0.3","5.9.29.183","TCP","56","43520 → 9002 [ACK] Seq=8602 Ack=111483 Win=11901 Len=0"
"5.984972","5.9.29.183","172.19.0.3","TLSv1.2","787","Application Data"
"6.002314","5.9.29.183","172.19.0.3","TCP","1516","[TCP segment of a reassembled PDU]"
"6.002331","172.19.0.3","5.9.29.183","TCP","56","43520 → 9002 [ACK] Seq=8602 Ack=113674 Win=11911 Len=0"
"6.002387","5.9.29.183","172.19.0.3","TCP","103","9002 → 43520 [PSH, ACK] Seq=113674 Ack=8602 Win=65535 Len=47 [TCP segment of a reassembled PDU]"
"6.002473","5.9.29.183","172.19.0.3","TCP","1516","9002 → 43520 [PSH, ACK] Seq=113721 Ack=8602 Win=65535 Len=1460 [TCP segment of a reassembled PDU]"
"6.002478","5.9.29.183","172.19.0.3","TLSv1.2","716","Application Data"
"6.002533","172.19.0.3","5.9.29.183","TCP","56","43520 → 9002 [ACK] Seq=8602 Ack=115841 Win=11895 Len=0"
"6.031450","5.9.29.183","172.19.0.3","TCP","1504","[TCP segment of a reassembled PDU]"
"6.031478","5.9.29.183","172.19.0.3","TCP","1504","9002 → 43520 [PSH, ACK] Seq=117289 Ack=8602 Win=65535 Len=1448 [TCP segment of a reassembled PDU]"
"6.031491","172.19.0.3","5.9.29.183","TCP","56","43520 → 9002 [ACK] Seq=8602 Ack=118737 Win=11903 Len=0"
"6.031832","5.9.29.183","172.19.0.3","TLSv1.2","1516","Application Data [TCP segment of a reassembled PDU]"
"6.031842","5.9.29.183","172.19.0.3","TCP","1225","9002 → 43520 [PSH, ACK] Seq=120197 Ack=8602 Win=65535 Len=1169 [TCP segment of a reassembled PDU]"
"6.031849","172.19.0.3","5.9.29.183","TCP","56","43520 → 9002 [ACK] Seq=8602 Ack=121366 Win=11903 Len=0"
"6.047617","5.9.29.183","172.19.0.3","TLSv1.2","1271","Application Data"
"6.047942","172.19.0.3","5.9.29.183","TLSv1.2","599","Application Data"
"6.048258","5.9.29.183","172.19.0.3","TCP","56","9002 → 43520 [ACK] Seq=122581 Ack=9145 Win=65535 Len=0"
"6.055833","5.9.29.183","172.19.0.3","TCP","1504","[TCP segment of a reassembled PDU]"
"6.056055","5.9.29.183","172.19.0.3","TCP","1504","9002 → 43520 [PSH, ACK] Seq=124029 Ack=9145 Win=65535 Len=1448 [TCP segment of a reassembled PDU]"
"6.056065","172.19.0.3","5.9.29.183","TCP","56","43520 → 9002 [ACK] Seq=9145 Ack=125477 Win=11911 Len=0"
"6.062676","5.9.29.183","172.19.0.3","TLSv1.2","787","Application Data"
"6.066665","5.9.29.183","172.19.0.3","TCP","1504","[TCP segment of a reassembled PDU]"
"6.066691","172.19.0.3","5.9.29.183","TCP","56","43520 → 9002 [ACK] Seq=9145 Ack=127656 Win=11911 Len=0"
"6.067056","5.9.29.183","172.19.0.3","TCP","1516","9002 → 43520 [PSH, ACK] Seq=127656 Ack=9145 Win=65535 Len=1460 [TCP segment of a reassembled PDU]"
"6.067071","5.9.29.183","172.19.0.3","TLSv1.2","1516","Application Data [TCP segment of a reassembled PDU]"
"6.067074","5.9.29.183","172.19.0.3","TCP","1480","9002 → 43520 [PSH, ACK] Seq=130576 Ack=9145 Win=65535 Len=1424 [TCP segment of a reassembled PDU]"
"6.067093","172.19.0.3","5.9.29.183","TCP","56","43520 → 9002 [ACK] Seq=9145 Ack=132000 Win=11887 Len=0"
"6.071581","5.9.29.183","172.19.0.3","TLSv1.2","1504","Application Data [TCP segment of a reassembled PDU]"
"6.071876","172.19.0.3","5.9.29.183","TLSv1.2","599","Application Data"
"6.072186","5.9.29.183","172.19.0.3","TCP","56","9002 → 43520 [ACK] Seq=133448 Ack=9688 Win=65535 Len=0"
"6.082883","5.9.29.183","172.19.0.3","TLSv1.2","1127","Application Data"
"6.102352","5.9.29.183","172.19.0.3","TCP","1504","[TCP segment of a reassembled PDU]"
"6.102372","172.19.0.3","5.9.29.183","TCP","56","43520 → 9002 [ACK] Seq=9688 Ack=135967 Win=11911 Len=0"
"6.102384","5.9.29.183","172.19.0.3","TCP","1516","9002 → 43520 [PSH, ACK] Seq=135967 Ack=9688 Win=65535 Len=1460 [TCP segment of a reassembled PDU]"
"6.102390","5.9.29.183","172.19.0.3","TLSv1.2","1516","Application Data [TCP segment of a reassembled PDU]"
"6.102393","5.9.29.183","172.19.0.3","TCP","1213","9002 → 43520 [PSH, ACK] Seq=138887 Ack=9688 Win=65535 Len=1157 [TCP segment of a reassembled PDU]"
"6.102508","5.9.29.183","172.19.0.3","TCP","1504","9002 → 43520 [PSH, ACK] Seq=140044 Ack=9688 Win=65535 Len=1448 [TCP segment of a reassembled PDU]"
"6.102574","172.19.0.3","5.9.29.183","TCP","56","43520 → 9002 [ACK] Seq=9688 Ack=141492 Win=11879 Len=0"
"6.118292","5.9.29.183","172.19.0.3","TLSv1.2","851","Application Data"
"6.126175","5.9.29.183","172.19.0.3","TCP","1516","[TCP segment of a reassembled PDU]"
"6.126199","172.19.0.3","5.9.29.183","TCP","56","43520 → 9002 [ACK] Seq=9688 Ack=143747 Win=11911 Len=0"
"6.126216","5.9.29.183","172.19.0.3","TCP","1492","9002 → 43520 [PSH, ACK] Seq=143747 Ack=9688 Win=65535 Len=1436 [TCP segment of a reassembled PDU]"
"6.134011","5.9.29.183","172.19.0.3","TLSv1.2","1330","Application Data, Application Data"
"6.134041","172.19.0.3","5.9.29.183","TCP","56","43520 → 9002 [ACK] Seq=9688 Ack=146457 Win=11911 Len=0"
"6.143288","5.9.29.183","172.19.0.3","TCP","1504","[TCP segment of a reassembled PDU]"
"6.143395","5.9.29.183","172.19.0.3","TCP","1504","9002 → 43520 [PSH, ACK] Seq=147905 Ack=9688 Win=65535 Len=1448 [TCP segment of a reassembled PDU]"
"6.143432","172.19.0.3","5.9.29.183","TCP","56","43520 → 9002 [ACK] Seq=9688 Ack=149353 Win=11903 Len=0"
"6.149130","5.9.29.183","172.19.0.3","TLSv1.2","787","Application Data"
"6.190179","172.19.0.3","5.9.29.183","TCP","56","43520 → 9002 [ACK] Seq=9688 Ack=150084 Win=11911 Len=0"
"6.198517","5.9.29.183","172.19.0.3","TLSv1.2","1113","Application Data"
"6.198668","172.19.0.3","5.9.29.183","TCP","56","43520 → 9002 [ACK] Seq=9688 Ack=151141 Win=11911 Len=0"
"6.203198","172.19.0.3","5.9.29.183","TLSv1.2","599","Application Data"
"6.203402","5.9.29.183","172.19.0.3","TCP","56","9002 → 43520 [ACK] Seq=151141 Ack=10231 Win=65535 Len=0"
"6.726718","5.9.29.183","172.19.0.3","TLSv1.2","599","Application Data"
"6.727356","172.19.0.3","5.9.29.183","TLSv1.2","599","Application Data"
"6.727567","5.9.29.183","172.19.0.3","TCP","56","9002 → 43520 [ACK] Seq=151684 Ack=10774 Win=65535 Len=0"
"7.493610","5.9.29.183","172.19.0.3","TCP","1516","[TCP segment of a reassembled PDU]"
"7.493635","5.9.29.183","172.19.0.3","TCP","1516","9002 → 43520 [PSH, ACK] Seq=153144 Ack=10774 Win=65535 Len=1460 [TCP segment of a reassembled PDU]"
"7.493640","5.9.29.183","172.19.0.3","TLSv1.2","763","Application Data"
"7.493750","172.19.0.3","5.9.29.183","TCP","56","43520 → 9002 [ACK] Seq=10774 Ack=155311 Win=11895 Len=0"
"7.503399","5.9.29.183","172.19.0.3","TLSv1.2","1504","Application Data"
"7.503690","5.9.29.183","172.19.0.3","TCP","1516","9002 → 43520 [PSH, ACK] Seq=156759 Ack=10774 Win=65535 Len=1460 [TCP segment of a reassembled PDU]"
"7.503697","172.19.0.3","5.9.29.183","TCP","56","43520 → 9002 [ACK] Seq=10774 Ack=158219 Win=11911 Len=0"
"7.503701","5.9.29.183","172.19.0.3","TCP","1492","9002 → 43520 [PSH, ACK] Seq=158219 Ack=10774 Win=65535 Len=1436 [TCP segment of a reassembled PDU]"
"7.509282","5.9.29.183","172.19.0.3","TLSv1.2","425","Application Data, Application Data"
"7.509303","172.19.0.3","5.9.29.183","TCP","56","43520 → 9002 [ACK] Seq=10774 Ack=160024 Win=11911 Len=0"
"7.538017","5.9.29.183","172.19.0.3","TCP","1504","[TCP segment of a reassembled PDU]"
"7.538608","5.9.29.183","172.19.0.3","TCP","1504","9002 → 43520 [PSH, ACK] Seq=161472 Ack=10774 Win=65535 Len=1448 [TCP segment of a reassembled PDU]"
"7.538619","172.19.0.3","5.9.29.183","TCP","56","43520 → 9002 [ACK] Seq=10774 Ack=162920 Win=11911 Len=0"
"7.538624","5.9.29.183","172.19.0.3","TLSv1.2","787","Application Data"
"7.552150","5.9.29.183","172.19.0.3","TCP","1516","[TCP segment of a reassembled PDU]"
"7.552184","172.19.0.3","5.9.29.183","TCP","56","43520 → 9002 [ACK] Seq=10774 Ack=165111 Win=11911 Len=0"
"7.552198","5.9.29.183","172.19.0.3","TCP","1492","9002 → 43520 [PSH, ACK] Seq=165111 Ack=10774 Win=65535 Len=1436 [TCP segment of a reassembled PDU]"
"7.552204","5.9.29.183","172.19.0.3","TLSv1.2","1516","Application Data [TCP segment of a reassembled PDU]"
"7.552207","5.9.29.183","172.19.0.3","TCP","1492","9002 → 43520 [PSH, ACK] Seq=168007 Ack=10774 Win=65535 Len=1436 [TCP segment of a reassembled PDU]"
"7.552296","5.9.29.183","172.19.0.3","TCP","1504","9002 → 43520 [PSH, ACK] Seq=169443 Ack=10774 Win=65535 Len=1448 [TCP segment of a reassembled PDU]"
"7.552361","172.19.0.3","5.9.29.183","TCP","56","43520 → 9002 [ACK] Seq=10774 Ack=170891 Win=11879 Len=0"
"7.554238","5.9.29.183","172.19.0.3","TLSv1.2","1127","Application Data, Application Data"
"7.577999","5.9.29.183","172.19.0.3","TCP","1516","[TCP segment of a reassembled PDU]"
"7.578021","172.19.0.3","5.9.29.183","TCP","56","43520 → 9002 [ACK] Seq=10774 Ack=173422 Win=11911 Len=0"
"7.578035","5.9.29.183","172.19.0.3","TCP","1516","9002 → 43520 [PSH, ACK] Seq=173422 Ack=10774 Win=65535 Len=1460 [TCP segment of a reassembled PDU]"
"7.578042","5.9.29.183","172.19.0.3","TLSv1.2","1213","Application Data"
"7.578219","172.19.0.3","5.9.29.183","TCP","56","43520 → 9002 [ACK] Seq=10774 Ack=176039 Win=11895 Len=0"
"7.578475","172.19.0.3","5.9.29.183","TLSv1.2","599","Application Data"
"7.578731","5.9.29.183","172.19.0.3","TCP","56","9002 → 43520 [ACK] Seq=176039 Ack=11317 Win=65535 Len=0"
"7.592299","5.9.29.183","172.19.0.3","TLSv1.2","1504","Application Data"
"7.593205","5.9.29.183","172.19.0.3","TCP","1516","9002 → 43520 [PSH, ACK] Seq=177487 Ack=11317 Win=65535 Len=1460 [TCP segment of a reassembled PDU]"
"7.593216","172.19.0.3","5.9.29.183","TCP","56","43520 → 9002 [ACK] Seq=11317 Ack=178947 Win=11911 Len=0"
"7.593222","5.9.29.183","172.19.0.3","TCP","366","9002 → 43520 [PSH, ACK] Seq=178947 Ack=11317 Win=65535 Len=310 [TCP segment of a reassembled PDU]"
"7.593405","5.9.29.183","172.19.0.3","TLSv1.2","1516","Application Data [TCP segment of a reassembled PDU]"
"7.593435","172.19.0.3","5.9.29.183","TCP","56","43520 → 9002 [ACK] Seq=11317 Ack=180717 Win=11911 Len=0"
"7.593442","5.9.29.183","172.19.0.3","TCP","1516","9002 → 43520 [PSH, ACK] Seq=180717 Ack=11317 Win=65535 Len=1460 [TCP segment of a reassembled PDU]"
"7.593492","5.9.29.183","172.19.0.3","TLSv1.2","1265","Application Data"
"7.593519","172.19.0.3","5.9.29.183","TCP","56","43520 → 9002 [ACK] Seq=11317 Ack=183386 Win=11895 Len=0"
"7.593694","172.19.0.3","5.9.29.183","TLSv1.2","599","Application Data"
"7.593852","5.9.29.183","172.19.0.3","TCP","56","9002 → 43520 [ACK] Seq=183386 Ack=11860 Win=65535 Len=0"
"7.617236","5.9.29.183","172.19.0.3","TCP","1516","[TCP segment of a reassembled PDU]"
"7.617265","5.9.29.183","172.19.0.3","TCP","1516","9002 → 43520 [PSH, ACK] Seq=184846 Ack=11860 Win=65535 Len=1460 [TCP segment of a reassembled PDU]"
"7.617281","172.19.0.3","5.9.29.183","TCP","56","43520 → 9002 [ACK] Seq=11860 Ack=186306 Win=11903 Len=0"
"7.617284","5.9.29.183","172.19.0.3","TLSv1.2","1213","Application Data"
"7.632967","5.9.29.183","172.19.0.3","TLSv1.2","149","Application Data"
"7.633195","172.19.0.3","5.9.29.183","TCP","56","43520 → 9002 [ACK] Seq=11860 Ack=187556 Win=11911 Len=0"
"7.649836","5.9.29.183","172.19.0.3","TCP","1504","[TCP segment of a reassembled PDU]"
"7.649860","5.9.29.183","172.19.0.3","TCP","1504","9002 → 43520 [PSH, ACK] Seq=189004 Ack=11860 Win=65535 Len=1448 [TCP segment of a reassembled PDU]"
"7.649864","5.9.29.183","172.19.0.3","TLSv1.2","1237","Application Data"
"7.649958","172.19.0.3","5.9.29.183","TCP","56","43520 → 9002 [ACK] Seq=11860 Ack=191633 Win=11895 Len=0"
"7.650186","5.9.29.183","172.19.0.3","TCP","1516","[TCP segment of a reassembled PDU]"
"7.650190","5.9.29.183","172.19.0.3","TCP","1516","9002 → 43520 [PSH, ACK] Seq=193093 Ack=11860 Win=65535 Len=1460 [TCP segment of a reassembled PDU]"
"7.650196","172.19.0.3","5.9.29.183","TCP","56","43520 → 9002 [ACK] Seq=11860 Ack=194553 Win=11903 Len=0"
"7.650197","5.9.29.183","172.19.0.3","TLSv1.2","1480","Application Data [TCP segment of a reassembled PDU]"
"7.650277","5.9.29.183","172.19.0.3","TCP","1504","9002 → 43520 [PSH, ACK] Seq=195977 Ack=11860 Win=65535 Len=1448 [TCP segment of a reassembled PDU]"
"7.650313","5.9.29.183","172.19.0.3","TCP","1504","9002 → 43520 [PSH, ACK] Seq=197425 Ack=11860 Win=65535 Len=1448 [TCP segment of a reassembled PDU]"
"7.650352","172.19.0.3","5.9.29.183","TCP","56","43520 → 9002 [ACK] Seq=11860 Ack=198873 Win=11879 Len=0"
"7.665839","5.9.29.183","172.19.0.3","TLSv1.2","134","Application Data"
"7.670016","5.9.29.183","172.19.0.3","TCP","1504","[TCP segment of a reassembled PDU]"
"7.670073","172.19.0.3","5.9.29.183","TCP","56","43520 → 9002 [ACK] Seq=11860 Ack=200399 Win=11911 Len=0"
"7.670085","5.9.29.183","172.19.0.3","TCP","1516","9002 → 43520 [PSH, ACK] Seq=200399 Ack=11860 Win=65535 Len=1460 [TCP segment of a reassembled PDU]"
"7.670094","5.9.29.183","172.19.0.3","TLSv1.2","1516","Application Data [TCP segment of a reassembled PDU]"
"7.670097","5.9.29.183","172.19.0.3","TCP","1516","9002 → 43520 [PSH, ACK] Seq=203319 Ack=11860 Win=65535 Len=1460 [TCP segment of a reassembled PDU]"
"7.670208","5.9.29.183","172.19.0.3","TCP","1468","9002 → 43520 [PSH, ACK] Seq=204779 Ack=11860 Win=65535 Len=1412 [TCP segment of a reassembled PDU]"
"7.670285","172.19.0.3","5.9.29.183","TCP","56","43520 → 9002 [ACK] Seq=11860 Ack=206191 Win=11879 Len=0"
"7.680979","5.9.29.183","172.19.0.3","TLSv1.2","584","Application Data"
"7.681337","172.19.0.3","5.9.29.183","TLSv1.2","599","Application Data"
"7.681575","5.9.29.183","172.19.0.3","TCP","56","9002 → 43520 [ACK] Seq=206719 Ack=12403 Win=65535 Len=0"
"7.696729","5.9.29.183","172.19.0.3","TLSv1.2","1113","Application Data"
"7.743659","172.19.0.3","5.9.29.183","TCP","56","43520 → 9002 [ACK] Seq=12403 Ack=207776 Win=11911 Len=0"
"7.749881","5.9.29.183","172.19.0.3","TCP","1504","[TCP segment of a reassembled PDU]"
"7.749902","5.9.29.183","172.19.0.3","TCP","1516","9002 → 43520 [PSH, ACK] Seq=209224 Ack=12403 Win=65535 Len=1460 [TCP segment of a reassembled PDU]"
"7.749908","5.9.29.183","172.19.0.3","TLSv1.2","261","Application Data"
"7.750010","172.19.0.3","5.9.29.183","TCP","56","43520 → 9002 [ACK] Seq=12403 Ack=210889 Win=11895 Len=0"
"7.753335","172.19.0.3","5.9.29.183","TLSv1.2","599","Application Data"
"7.753543","5.9.29.183","172.19.0.3","TCP","56","9002 → 43520 [ACK] Seq=210889 Ack=12946 Win=65535 Len=0"
"8.415975","5.9.29.183","172.19.0.3","TLSv1.2","599","Application Data"
"8.416639","172.19.0.3","5.9.29.183","TLSv1.2","599","Application Data"
"8.416846","5.9.29.183","172.19.0.3","TCP","56","9002 → 43520 [ACK] Seq=211432 Ack=13489 Win=65535 Len=0"
"8.971392","5.9.29.183","172.19.0.3","TLSv1.2","599","Application Data"
"8.994379","5.9.29.183","172.19.0.3","TCP","1504","[TCP segment of a reassembled PDU]"
"8.994402","172.19.0.3","5.9.29.183","TCP","56","43520 → 9002 [ACK] Seq=13489 Ack=213423 Win=11911 Len=0"
"8.994598","5.9.29.183","172.19.0.3","TCP","1504","9002 → 43520 [PSH, ACK] Seq=213423 Ack=13489 Win=65535 Len=1448 [TCP segment of a reassembled PDU]"
"8.995780","5.9.29.183","172.19.0.3","TLSv1.2","787","Application Data"
"8.995792","172.19.0.3","5.9.29.183","TCP","56","43520 → 9002 [ACK] Seq=13489 Ack=215602 Win=11911 Len=0"
"9.013241","5.9.29.183","172.19.0.3","TCP","1516","[TCP segment of a reassembled PDU]"
"9.013308","5.9.29.183","172.19.0.3","TCP","1492","9002 → 43520 [PSH, ACK] Seq=217062 Ack=13489 Win=65535 Len=1436 [TCP segment of a reassembled PDU]"
"9.013316","5.9.29.183","172.19.0.3","TLSv1.2","787","Application Data"
"9.013480","172.19.0.3","5.9.29.183","TCP","56","43520 → 9002 [ACK] Seq=13489 Ack=219229 Win=11895 Len=0"
"9.034207","5.9.29.183","172.19.0.3","TLSv1.2","599","Application Data"
"9.068583","5.9.29.183","172.19.0.3","TCP","1504","[TCP segment of a reassembled PDU]"
"9.068602","172.19.0.3","5.9.29.183","TCP","56","43520 → 9002 [ACK] Seq=13489 Ack=221220 Win=11911 Len=0"
"9.068644","5.9.29.183","172.19.0.3","TCP","1504","9002 → 43520 [PSH, ACK] Seq=221220 Ack=13489 Win=65535 Len=1448 [TCP segment of a reassembled PDU]"
"9.069280","5.9.29.183","172.19.0.3","TLSv1.2","787","Application Data"
"9.069299","172.19.0.3","5.9.29.183","TCP","56","43520 → 9002 [ACK] Seq=13489 Ack=223399 Win=11911 Len=0"
"9.081316","5.9.29.183","172.19.0.3","TCP","1504","[TCP segment of a reassembled PDU]"
"9.081579","5.9.29.183","172.19.0.3","TCP","1504","9002 → 43520 [PSH, ACK] Seq=224847 Ack=13489 Win=65535 Len=1448 [TCP segment of a reassembled PDU]"
"9.081594","172.19.0.3","5.9.29.183","TCP","56","43520 → 9002 [ACK] Seq=13489 Ack=226295 Win=11911 Len=0"
"9.081713","5.9.29.183","172.19.0.3","TLSv1.2","1504","Application Data [TCP segment of a reassembled PDU]"
"9.081972","5.9.29.183","172.19.0.3","TCP","1516","9002 → 43520 [PSH, ACK] Seq=227743 Ack=13489 Win=65535 Len=1460 [TCP segment of a reassembled PDU]"
"9.081978","5.9.29.183","172.19.0.3","TCP","1492","9002 → 43520 [PSH, ACK] Seq=229203 Ack=13489 Win=65535 Len=1436 [TCP segment of a reassembled PDU]"
"9.082033","172.19.0.3","5.9.29.183","TLSv1.2","599","Application Data"
"9.082121","5.9.29.183","172.19.0.3","TLSv1.2","1504","Application Data [TCP segment of a reassembled PDU]"
"9.082127","5.9.29.183","172.19.0.3","TCP","1504","9002 → 43520 [PSH, ACK] Seq=232087 Ack=13489 Win=65535 Len=1448 [TCP segment of a reassembled PDU]"
"9.082132","172.19.0.3","5.9.29.183","TCP","56","43520 → 9002 [ACK] Seq=14032 Ack=233535 Win=11903 Len=0"
"9.082224","5.9.29.183","172.19.0.3","TCP","56","9002 → 43520 [ACK] Seq=233535 Ack=14032 Win=65535 Len=0"
"9.084435","5.9.29.183","172.19.0.3","TCP","1504","9002 → 43520 [PSH, ACK] Seq=233535 Ack=14032 Win=65535 Len=1448 [TCP segment of a reassembled PDU]"
"9.085078","5.9.29.183","172.19.0.3","TLSv1.2","924","Application Data, Application Data"
"9.085086","172.19.0.3","5.9.29.183","TCP","56","43520 → 9002 [ACK] Seq=14032 Ack=235851 Win=11911 Len=0"
"9.121302","5.9.29.183","172.19.0.3","TCP","1504","[TCP segment of a reassembled PDU]"
"9.121493","5.9.29.183","172.19.0.3","TCP","1504","9002 → 43520 [PSH, ACK] Seq=237299 Ack=14032 Win=65535 Len=1448 [TCP segment of a reassembled PDU]"
"9.121548","172.19.0.3","5.9.29.183","TCP","56","43520 → 9002 [ACK] Seq=14032 Ack=238747 Win=11901 Len=0"
"9.122235","5.9.29.183","172.19.0.3","TLSv1.2","787","Application Data"
"9.122600","172.19.0.3","5.9.29.183","TLSv1.2","599","Application Data"
"9.122839","5.9.29.183","172.19.0.3","TCP","56","9002 → 43520 [ACK] Seq=239478 Ack=14575 Win=65535 Len=0"
"9.133489","5.9.29.183","172.19.0.3","TCP","1504","[TCP segment of a reassembled PDU]"
"9.133554","5.9.29.183","172.19.0.3","TCP","1504","9002 → 43520 [PSH, ACK] Seq=240926 Ack=14575 Win=65535 Len=1448 [TCP segment of a reassembled PDU]"
"9.133565","5.9.29.183","172.19.0.3","TLSv1.2","1504","Application Data [TCP segment of a reassembled PDU]"
"9.133599","5.9.29.183","172.19.0.3","TCP","1027","9002 → 43520 [PSH, ACK] Seq=243822 Ack=14575 Win=65535 Len=971 [TCP segment of a reassembled PDU]"
"9.133718","172.19.0.3","5.9.29.183","TCP","56","43520 → 9002 [ACK] Seq=14575 Ack=244793 Win=11887 Len=0"
"9.133831","5.9.29.183","172.19.0.3","TCP","533","9002 → 43520 [PSH, ACK] Seq=244793 Ack=14575 Win=65535 Len=477 [TCP segment of a reassembled PDU]"
"9.133839","5.9.29.183","172.19.0.3","TCP","1504","9002 → 43520 [PSH, ACK] Seq=245270 Ack=14575 Win=65535 Len=1448 [TCP segment of a reassembled PDU]"
"9.133974","172.19.0.3","5.9.29.183","TCP","56","43520 → 9002 [ACK] Seq=14575 Ack=246718 Win=11872 Len=0"
"9.138303","5.9.29.183","172.19.0.3","TLSv1.2","1127","Application Data, Application Data"
"9.156493","5.9.29.183","172.19.0.3","TCP","1516","[TCP segment of a reassembled PDU]"
"9.156512","172.19.0.3","5.9.29.183","TCP","56","43520 → 9002 [ACK] Seq=14575 Ack=249249 Win=11911 Len=0"
"9.156554","5.9.29.183","172.19.0.3","TLSv1.2","167","Application Data"
"9.177152","5.9.29.183","172.19.0.3","TCP","1516","[TCP segment of a reassembled PDU]"
"9.177175","172.19.0.3","5.9.29.183","TCP","56","43520 → 9002 [ACK] Seq=14575 Ack=250820 Win=11911 Len=0"
"9.177239","5.9.29.183","172.19.0.3","TCP","1492","9002 → 43520 [PSH, ACK] Seq=250820 Ack=14575 Win=65535 Len=1436 [TCP segment of a reassembled PDU]"
"9.177476","5.9.29.183","172.19.0.3","TLSv1.2","787","Application Data"
"9.177488","172.19.0.3","5.9.29.183","TCP","56","43520 → 9002 [ACK] Seq=14575 Ack=252987 Win=11911 Len=0"
"9.187576","5.9.29.183","172.19.0.3","TCP","1504","[TCP segment of a reassembled PDU]"
"9.187942","5.9.29.183","172.19.0.3","TCP","1504","9002 → 43520 [PSH, ACK] Seq=254435 Ack=14575 Win=65535 Len=1448 [TCP segment of a reassembled PDU]"
"9.187954","172.19.0.3","5.9.29.183","TCP","56","43520 → 9002 [ACK] Seq=14575 Ack=255883 Win=11911 Len=0"
"9.188293","5.9.29.183","172.19.0.3","TLSv1.2","1504","Application Data [TCP segment of a reassembled PDU]"
"9.188330","5.9.29.183","172.19.0.3","TCP","1504","9002 → 43520 [PSH, ACK] Seq=257331 Ack=14575 Win=65535 Len=1448 [TCP segment of a reassembled PDU]"
"9.188407","172.19.0.3","5.9.29.183","TCP","56","43520 → 9002 [ACK] Seq=14575 Ack=258779 Win=11903 Len=0"
"9.188733","5.9.29.183","172.19.0.3","TCP","1516","9002 → 43520 [PSH, ACK] Seq=258779 Ack=14575 Win=65535 Len=1460 [TCP segment of a reassembled PDU]"
"9.188740","5.9.29.183","172.19.0.3","TLSv1.2","1516","Application Data [TCP segment of a reassembled PDU]"
"9.188743","5.9.29.183","172.19.0.3","TCP","1480","9002 → 43520 [PSH, ACK] Seq=261699 Ack=14575 Win=65535 Len=1424 [TCP segment of a reassembled PDU]"
"9.188820","5.9.29.183","172.19.0.3","TCP","1504","9002 → 43520 [PSH, ACK] Seq=263123 Ack=14575 Win=65535 Len=1448 [TCP segment of a reassembled PDU]"
"9.188911","172.19.0.3","5.9.29.183","TCP","56","43520 → 9002 [ACK] Seq=14575 Ack=264571 Win=11885 Len=0"
"9.193029","5.9.29.183","172.19.0.3","TLSv1.2","381","Application Data"
"9.193339","172.19.0.3","5.9.29.183","TLSv1.2","599","Application Data"
"9.193683","5.9.29.183","172.19.0.3","TCP","56","9002 → 43520 [ACK] Seq=264896 Ack=15118 Win=65535 Len=0"
"9.208752","5.9.29.183","172.19.0.3","TCP","1504","[TCP segment of a reassembled PDU]"
"9.209172","5.9.29.183","172.19.0.3","TCP","1504","9002 → 43520 [PSH, ACK] Seq=266344 Ack=15118 Win=65535 Len=1448 [TCP segment of a reassembled PDU]"
"9.209187","172.19.0.3","5.9.29.183","TCP","56","43520 → 9002 [ACK] Seq=15118 Ack=267792 Win=11911 Len=0"
"9.209678","5.9.29.183","172.19.0.3","TLSv1.2","1504","Application Data [TCP segment of a reassembled PDU]"
"9.209762","5.9.29.183","172.19.0.3","TCP","1516","9002 → 43520 [PSH, ACK] Seq=269240 Ack=15118 Win=65535 Len=1460 [TCP segment of a reassembled PDU]"
"9.209787","5.9.29.183","172.19.0.3","TCP","1492","9002 → 43520 [PSH, ACK] Seq=270700 Ack=15118 Win=65535 Len=1436 [TCP segment of a reassembled PDU]"
"9.209882","172.19.0.3","5.9.29.183","TCP","56","43520 → 9002 [ACK] Seq=15118 Ack=272136 Win=11895 Len=0"
"9.210087","5.9.29.183","172.19.0.3","TLSv1.2","1516","Application Data [TCP segment of a reassembled PDU]"
"9.210107","5.9.29.183","172.19.0.3","TCP","1516","9002 → 43520 [PSH, ACK] Seq=273596 Ack=15118 Win=65535 Len=1460 [TCP segment of a reassembled PDU]"
"9.210183","5.9.29.183","172.19.0.3","TCP","1480","9002 → 43520 [PSH, ACK] Seq=275056 Ack=15118 Win=65535 Len=1424 [TCP segment of a reassembled PDU]"
"9.210197","172.19.0.3","5.9.29.183","TCP","56","43520 → 9002 [ACK] Seq=15118 Ack=275056 Win=11879 Len=0"
"9.210277","5.9.29.183","172.19.0.3","TLSv1.2","924","Application Data, Application Data"
"9.210649","172.19.0.3","5.9.29.183","TCP","56","43520 → 9002 [ACK] Seq=15118 Ack=277348 Win=11863 Len=0"
"9.234107","5.9.29.183","172.19.0.3","TCP","1504","[TCP segment of a reassembled PDU]"
"9.234165","5.9.29.183","172.19.0.3","TCP","1516","9002 → 43520 [PSH, ACK] Seq=278796 Ack=15118 Win=65535 Len=1460 [TCP segment of a reassembled PDU]"
"9.234179","172.19.0.3","5.9.29.183","TCP","56","43520 → 9002 [ACK] Seq=15118 Ack=280256 Win=11903 Len=0"
"9.234182","5.9.29.183","172.19.0.3","TLSv1.2","1225","Application Data"
"9.234463","172.19.0.3","5.9.29.183","TLSv1.2","599","Application Data"
"9.234670","5.9.29.183","172.19.0.3","TCP","56","9002 → 43520 [ACK] Seq=281425 Ack=15661 Win=65535 Len=0"
"9.249873","5.9.29.183","172.19.0.3","TLSv1.2","149","Application Data"
"9.252008","172.19.0.3","5.9.29.183","TLSv1.2","599","Application Data"
"9.252324","5.9.29.183","172.19.0.3","TCP","56","9002 → 43520 [ACK] Seq=281518 Ack=16204 Win=65535 Len=0"
"9.261901","172.19.0.3","5.9.29.183","TLSv1.2","599","Application Data"
"9.262131","5.9.29.183","172.19.0.3","TCP","56","9002 → 43520 [ACK] Seq=281518 Ack=16747 Win=65535 Len=0"
"9.288638","5.9.29.183","172.19.0.3","TLSv1.2","599","Application Data"
"9.334175","172.19.0.3","5.9.29.183","TCP","56","43520 → 9002 [ACK] Seq=16747 Ack=282061 Win=11911 Len=0"
"9.952892","5.9.29.183","172.19.0.3","TLSv1.2","599","Application Data"
"9.952945","172.19.0.3","5.9.29.183","TCP","56","43520 → 9002 [ACK] Seq=16747 Ack=282604 Win=11911 Len=0"
"9.953643","172.19.0.3","5.9.29.183","TLSv1.2","599","Application Data"
"9.953827","5.9.29.183","172.19.0.3","TCP","56","9002 → 43520 [ACK] Seq=282604 Ack=17290 Win=65535 Len=0"
"10.451035","5.9.29.183","172.19.0.3","TLSv1.2","599","Application Data"
"10.492403","5.9.29.183","172.19.0.3","TCP","1504","[TCP segment of a reassembled PDU]"
"10.492426","172.19.0.3","5.9.29.183","TCP","56","43520 → 9002 [ACK] Seq=17290 Ack=284595 Win=11911 Len=0"
"10.492585","5.9.29.183","172.19.0.3","TCP","1504","9002 → 43520 [PSH, ACK] Seq=284595 Ack=17290 Win=65535 Len=1448 [TCP segment of a reassembled PDU]"
"10.492596","5.9.29.183","172.19.0.3","TLSv1.2","787","Application Data"
"10.492615","172.19.0.3","5.9.29.183","TCP","56","43520 → 9002 [ACK] Seq=17290 Ack=286774 Win=11895 Len=0"
"10.530929","5.9.29.183","172.19.0.3","TCP","1504","[TCP segment of a reassembled PDU]"
"10.530972","5.9.29.183","172.19.0.3","TCP","1516","9002 → 43520 [PSH, ACK] Seq=288222 Ack=17290 Win=65535 Len=1460 [TCP segment of a reassembled PDU]"
"10.530984","172.19.0.3","5.9.29.183","TCP","56","43520 → 9002 [ACK] Seq=17290 Ack=289682 Win=11903 Len=0"
"10.530986","5.9.29.183","172.19.0.3","TLSv1.2","775","Application Data"
"10.548343","5.9.29.183","172.19.0.3","TLSv1.2","599","Application Data"
"10.548575","172.19.0.3","5.9.29.183","TCP","56","43520 → 9002 [ACK] Seq=17290 Ack=290944 Win=11911 Len=0"
"10.568608","5.9.29.183","172.19.0.3","TCP","1504","[TCP segment of a reassembled PDU]"
"10.568979","5.9.29.183","172.19.0.3","TCP","1504","9002 → 43520 [PSH, ACK] Seq=292392 Ack=17290 Win=65535 Len=1448 [TCP segment of a reassembled PDU]"
"10.568993","172.19.0.3","5.9.29.183","TCP","56","43520 → 9002 [ACK] Seq=17290 Ack=293840 Win=11911 Len=0"
"10.569025","5.9.29.183","172.19.0.3","TLSv1.2","787","Application Data"
"10.580728","5.9.29.183","172.19.0.3","TCP","1516","[TCP segment of a reassembled PDU]"
"10.580757","172.19.0.3","5.9.29.183","TCP","56","43520 → 9002 [ACK] Seq=17290 Ack=296031 Win=11911 Len=0"
"10.580785","5.9.29.183","172.19.0.3","TCP","1492","9002 → 43520 [PSH, ACK] Seq=296031 Ack=17290 Win=65535 Len=1436 [TCP segment of a reassembled PDU]"
"10.580792","5.9.29.183","172.19.0.3","TLSv1.2","1516","Application Data [TCP segment of a reassembled PDU]"
"10.580854","5.9.29.183","172.19.0.3","TCP","1516","9002 → 43520 [PSH, ACK] Seq=298927 Ack=17290 Win=65535 Len=1460 [TCP segment of a reassembled PDU]"
"10.580863","5.9.29.183","172.19.0.3","TCP","1480","9002 → 43520 [PSH, ACK] Seq=300387 Ack=17290 Win=65535 Len=1424 [TCP segment of a reassembled PDU]"
"10.580880","172.19.0.3","5.9.29.183","TCP","56","43520 → 9002 [ACK] Seq=17290 Ack=300387 Win=11887 Len=0"
"10.581001","5.9.29.183","172.19.0.3","TLSv1.2","1516","Application Data [TCP segment of a reassembled PDU]"
"10.581006","5.9.29.183","172.19.0.3","TCP","1492","9002 → 43520 [PSH, ACK] Seq=303271 Ack=17290 Win=65535 Len=1436 [TCP segment of a reassembled PDU]"
"10.581057","172.19.0.3","5.9.29.183","TCP","56","43520 → 9002 [ACK] Seq=17290 Ack=304707 Win=11863 Len=0"
"10.584347","5.9.29.183","172.19.0.3","TCP","1504","9002 → 43520 [PSH, ACK] Seq=304707 Ack=17290 Win=65535 Len=1448 [TCP segment of a reassembled PDU]"
"10.584527","5.9.29.183","172.19.0.3","TLSv1.2","381","Application Data"
"10.584538","172.19.0.3","5.9.29.183","TCP","56","43520 → 9002 [ACK] Seq=17290 Ack=306480 Win=11911 Len=0"
"10.598047","5.9.29.183","172.19.0.3","TCP","1516","[TCP segment of a reassembled PDU]"
"10.598090","5.9.29.183","172.19.0.3","TCP","1516","9002 → 43520 [PSH, ACK] Seq=307940 Ack=17290 Win=65535 Len=1460 [TCP segment of a reassembled PDU]"
"10.598095","5.9.29.183","172.19.0.3","TCP","985","9002 → 43520 [PSH, ACK] Seq=309400 Ack=17290 Win=65535 Len=929 [TCP segment of a reassembled PDU]"
"10.598098","5.9.29.183","172.19.0.3","TLSv1.2","1516","Application Data [TCP segment of a reassembled PDU]"
"10.598114","5.9.29.183","172.19.0.3","TCP","1516","9002 → 43520 [PSH, ACK] Seq=311789 Ack=17290 Win=65535 Len=1460 [TCP segment of a reassembled PDU]"
"10.598116","5.9.29.183","172.19.0.3","TCP","527","9002 → 43520 [PSH, ACK] Seq=313249 Ack=17290 Win=65535 Len=471 [TCP segment of a reassembled PDU]"
"10.598195","172.19.0.3","5.9.29.183","TCP","56","43520 → 9002 [ACK] Seq=17290 Ack=313720 Win=11869 Len=0"
"10.598386","172.19.0.3","5.9.29.183","TLSv1.2","599","Application Data"
"10.598558","5.9.29.183","172.19.0.3","TCP","56","9002 → 43520 [ACK] Seq=313720 Ack=17833 Win=65535 Len=0"
"10.599539","5.9.29.183","172.19.0.3","TLSv1.2","584","Application Data"
"10.625275","5.9.29.183","172.19.0.3","TCP","1504","[TCP segment of a reassembled PDU]"
"10.625294","172.19.0.3","5.9.29.183","TCP","56","43520 → 9002 [ACK] Seq=17833 Ack=315696 Win=11911 Len=0"
"10.625433","5.9.29.183","172.19.0.3","TCP","1504","9002 → 43520 [PSH, ACK] Seq=315696 Ack=17833 Win=65535 Len=1448 [TCP segment of a reassembled PDU]"
"10.625437","5.9.29.183","172.19.0.3","TLSv1.2","1237","Application Data"
"10.625457","172.19.0.3","5.9.29.183","TCP","56","43520 → 9002 [ACK] Seq=17833 Ack=318325 Win=11911 Len=0"
"10.641134","5.9.29.183","172.19.0.3","TLSv1.2","149","Application Data"
"10.641814","5.9.29.183","172.19.0.3","TCP","1504","[TCP segment of a reassembled PDU]"
"10.641824","172.19.0.3","5.9.29.183","TCP","56","43520 → 9002 [ACK] Seq=17833 Ack=319866 Win=11911 Len=0"
"10.642226","5.9.29.183","172.19.0.3","TCP","1504","9002 → 43520 [PSH, ACK] Seq=319866 Ack=17833 Win=65535 Len=1448 [TCP segment of a reassembled PDU]"
"10.656476","5.9.29.183","172.19.0.3","TLSv1.2","1330","Application Data, Application Data"
"10.656495","172.19.0.3","5.9.29.183","TCP","56","43520 → 9002 [ACK] Seq=17833 Ack=322588 Win=11911 Len=0"
"10.656833","5.9.29.183","172.19.0.3","TCP","1516","[TCP segment of a reassembled PDU]"
"10.656841","5.9.29.183","172.19.0.3","TCP","1516","9002 → 43520 [PSH, ACK] Seq=324048 Ack=17833 Win=65535 Len=1460 [TCP segment of a reassembled PDU]"
"10.656844","5.9.29.183","172.19.0.3","TLSv1.2","1480","Application Data [TCP segment of a reassembled PDU]"
"10.656905","172.19.0.3","5.9.29.183","TCP","56","43520 → 9002 [ACK] Seq=17833 Ack=326932 Win=11895 Len=0"
"10.657073","5.9.29.183","172.19.0.3","TCP","1504","9002 → 43520 [PSH, ACK] Seq=326932 Ack=17833 Win=65535 Len=1448 [TCP segment of a reassembled PDU]"
"10.657168","5.9.29.183","172.19.0.3","TCP","1516","9002 → 43520 [PSH, ACK] Seq=328380 Ack=17833 Win=65535 Len=1460 [TCP segment of a reassembled PDU]"
"10.657179","172.19.0.3","5.9.29.183","TCP","56","43520 → 9002 [ACK] Seq=17833 Ack=329840 Win=11911 Len=0"
"10.657208","5.9.29.183","172.19.0.3","TLSv1.2","1516","Application Data [TCP segment of a reassembled PDU]"
"10.657214","5.9.29.183","172.19.0.3","TCP","1480","9002 → 43520 [PSH, ACK] Seq=331300 Ack=17833 Win=65535 Len=1424 [TCP segment of a reassembled PDU]"
"10.657293","172.19.0.3","5.9.29.183","TCP","56","43520 → 9002 [ACK] Seq=17833 Ack=332724 Win=11893 Len=0"
"10.672535","5.9.29.183","172.19.0.3","TLSv1.2","1315","Application Data"
"10.672944","172.19.0.3","5.9.29.183","TLSv1.2","599","Application Data"
"10.673251","5.9.29.183","172.19.0.3","TCP","56","9002 → 43520 [ACK] Seq=333983 Ack=18376 Win=65535 Len=0"
"10.675816","5.9.29.183","172.19.0.3","TCP","1504","[TCP segment of a reassembled PDU]"
"10.676652","5.9.29.183","172.19.0.3","TCP","1504","9002 → 43520 [PSH, ACK] Seq=335431 Ack=18376 Win=65535 Len=1448 [TCP segment of a reassembled PDU]"
"10.676693","172.19.0.3","5.9.29.183","TCP","56","43520 → 9002 [ACK] Seq=18376 Ack=336879 Win=11911 Len=0"
"10.676731","5.9.29.183","172.19.0.3","TLSv1.2","1516","Application Data [TCP segment of a reassembled PDU]"
"10.676836","5.9.29.183","172.19.0.3","TCP","1492","9002 → 43520 [PSH, ACK] Seq=338339 Ack=18376 Win=65535 Len=1436 [TCP segment of a reassembled PDU]"
"10.676841","5.9.29.183","172.19.0.3","TCP","1516","9002 → 43520 [PSH, ACK] Seq=339775 Ack=18376 Win=65535 Len=1460 [TCP segment of a reassembled PDU]"
"10.676843","5.9.29.183","172.19.0.3","TLSv1.2","1492","Application Data [TCP segment of a reassembled PDU]"
"10.676992","172.19.0.3","5.9.29.183","TCP","56","43520 → 9002 [ACK] Seq=18376 Ack=342671 Win=11879 Len=0"
"10.683065","172.19.0.3","5.9.29.183","TLSv1.2","599","Application Data"
"10.683574","5.9.29.183","172.19.0.3","TCP","56","9002 → 43520 [ACK] Seq=342671 Ack=18919 Win=65535 Len=0"
"10.687419","5.9.29.183","172.19.0.3","TLSv1.2","193","Application Data"
"10.697125","5.9.29.183","172.19.0.3","TCP","1504","[TCP segment of a reassembled PDU]"
"10.697143","172.19.0.3","5.9.29.183","TCP","56","43520 → 9002 [ACK] Seq=18919 Ack=344256 Win=11911 Len=0"
"10.697344","5.9.29.183","172.19.0.3","TCP","1516","9002 → 43520 [PSH, ACK] Seq=344256 Ack=18919 Win=65535 Len=1460 [TCP segment of a reassembled PDU]"
"10.697449","5.9.29.183","172.19.0.3","TLSv1.2","1516","Application Data [TCP segment of a reassembled PDU]"
"10.697459","172.19.0.3","5.9.29.183","TCP","56","43520 → 9002 [ACK] Seq=18919 Ack=347176 Win=11911 Len=0"
"10.697492","5.9.29.183","172.19.0.3","TCP","1480","9002 → 43520 [PSH, ACK] Seq=347176 Ack=18919 Win=65535 Len=1424 [TCP segment of a reassembled PDU]"
"10.697592","5.9.29.183","172.19.0.3","TCP","1516","9002 → 43520 [PSH, ACK] Seq=348600 Ack=18919 Win=65535 Len=1460 [TCP segment of a reassembled PDU]"
"10.697599","5.9.29.183","172.19.0.3","TLSv1.2","1492","Application Data [TCP segment of a reassembled PDU]"
"10.697652","172.19.0.3","5.9.29.183","TCP","56","43520 → 9002 [ACK] Seq=18919 Ack=351496 Win=11887 Len=0"
"10.703237","5.9.29.183","172.19.0.3","TLSv1.2","193","Application Data"
"10.705794","5.9.29.183","172.19.0.3","TCP","1504","[TCP segment of a reassembled PDU]"
"10.705812","172.19.0.3","5.9.29.183","TCP","56","43520 → 9002 [ACK] Seq=18919 Ack=353081 Win=11911 Len=0"
"10.718816","5.9.29.183","172.19.0.3","TLSv1.2","179","Application Data"
"10.741016","5.9.29.183","172.19.0.3","TLSv1.2","1113","Application Data"
"10.741218","172.19.0.3","5.9.29.183","TCP","56","43520 → 9002 [ACK] Seq=18919 Ack=354261 Win=11911 Len=0"
"10.745204","172.19.0.3","5.9.29.183","TLSv1.2","599","Application Data"
"10.745422","5.9.29.183","172.19.0.3","TCP","56","9002 → 43520 [ACK] Seq=354261 Ack=19462 Win=65535 Len=0"
"11.490171","5.9.29.183","172.19.0.3","TLSv1.2","599","Application Data"
"11.490888","172.19.0.3","5.9.29.183","TLSv1.2","599","Application Data"
"11.491129","5.9.29.183","172.19.0.3","TCP","56","9002 → 43520 [ACK] Seq=354804 Ack=20005 Win=65535 Len=0"
"12.104951","5.9.29.183","172.19.0.3","TCP","1504","[TCP segment of a reassembled PDU]"
"12.105077","5.9.29.183","172.19.0.3","TCP","1504","9002 → 43520 [PSH, ACK] Seq=356252 Ack=20005 Win=65535 Len=1448 [TCP segment of a reassembled PDU]"
"12.105183","172.19.0.3","5.9.29.183","TCP","56","43520 → 9002 [ACK] Seq=20005 Ack=357700 Win=11903 Len=0"
"12.106037","5.9.29.183","172.19.0.3","TLSv1.2","787","Application Data"
"12.106358","5.9.29.183","172.19.0.3","TCP","1516","[TCP segment of a reassembled PDU]"
"12.106380","172.19.0.3","5.9.29.183","TCP","56","43520 → 9002 [ACK] Seq=20005 Ack=359891 Win=11903 Len=0"
"12.106384","5.9.29.183","172.19.0.3","TCP","1492","9002 → 43520 [PSH, ACK] Seq=359891 Ack=20005 Win=65535 Len=1436 [TCP segment of a reassembled PDU]"
"12.106511","5.9.29.183","172.19.0.3","TLSv1.2","1504","Application Data [TCP segment of a reassembled PDU]"
"12.106714","172.19.0.3","5.9.29.183","TCP","56","43520 → 9002 [ACK] Seq=20005 Ack=362775 Win=11885 Len=0"
"12.106792","5.9.29.183","172.19.0.3","TCP","1504","9002 → 43520 [PSH, ACK] Seq=362775 Ack=20005 Win=65535 Len=1448 [TCP segment of a reassembled PDU]"
"12.106900","5.9.29.183","172.19.0.3","TCP","1504","9002 → 43520 [PSH, ACK] Seq=364223 Ack=20005 Win=65535 Len=1448 [TCP segment of a reassembled PDU]"
"12.107100","172.19.0.3","5.9.29.183","TCP","56","43520 → 9002 [ACK] Seq=20005 Ack=365671 Win=11869 Len=0"
"12.121853","5.9.29.183","172.19.0.3","TLSv1.2","1127","Application Data, Application Data"
"12.142241","5.9.29.183","172.19.0.3","TCP","1504","[TCP segment of a reassembled PDU]"
"12.142262","172.19.0.3","5.9.29.183","TCP","56","43520 → 9002 [ACK] Seq=20005 Ack=368190 Win=11911 Len=0"
"12.142640","5.9.29.183","172.19.0.3","TCP","1516","9002 → 43520 [PSH, ACK] Seq=368190 Ack=20005 Win=65535 Len=1460 [TCP segment of a reassembled PDU]"
"12.142680","5.9.29.183","172.19.0.3","TLSv1.2","1225","Application Data"
"12.142686","5.9.29.183","172.19.0.3","TCP","1504","[TCP segment of a reassembled PDU]"
"12.142737","172.19.0.3","5.9.29.183","TCP","56","43520 → 9002 [ACK] Seq=20005 Ack=372267 Win=11895 Len=0"
"12.142797","5.9.29.183","172.19.0.3","TCP","1504","9002 → 43520 [PSH, ACK] Seq=372267 Ack=20005 Win=65535 Len=1448 [TCP segment of a reassembled PDU]"
"12.158234","5.9.29.183","172.19.0.3","TLSv1.2","851","Application Data"
"12.158255","172.19.0.3","5.9.29.183","TCP","56","43520 → 9002 [ACK] Seq=20005 Ack=374510 Win=11911 Len=0"
"12.159175","5.9.29.183","172.19.0.3","TCP","1411","[TCP segment of a reassembled PDU]"
"12.159330","5.9.29.183","172.19.0.3","TCP","1516","9002 → 43520 [PSH, ACK] Seq=375865 Ack=20005 Win=65535 Len=1460 [TCP segment of a reassembled PDU]"
"12.159338","172.19.0.3","5.9.29.183","TCP","56","43520 → 9002 [ACK] Seq=20005 Ack=377325 Win=11911 Len=0"
"12.159341","5.9.29.183","172.19.0.3","TLSv1.2","1516","Application Data [TCP segment of a reassembled PDU]"
"12.159344","5.9.29.183","172.19.0.3","TCP","125","9002 → 43520 [PSH, ACK] Seq=378785 Ack=20005 Win=65535 Len=69 [TCP segment of a reassembled PDU]"
"12.159401","172.19.0.3","5.9.29.183","TCP","56","43520 → 9002 [ACK] Seq=20005 Ack=378854 Win=11901 Len=0"
"12.159411","5.9.29.183","172.19.0.3","TCP","1504","9002 → 43520 [PSH, ACK] Seq=378854 Ack=20005 Win=65535 Len=1448 [TCP segment of a reassembled PDU]"
"12.159414","5.9.29.183","172.19.0.3","TCP","1504","9002 → 43520 [PSH, ACK] Seq=380302 Ack=20005 Win=65535 Len=1448 [TCP segment of a reassembled PDU]"
"12.159517","172.19.0.3","5.9.29.183","TCP","56","43520 → 9002 [ACK] Seq=20005 Ack=381750 Win=11885 Len=0"
"12.173387","5.9.29.183","172.19.0.3","TLSv1.2","584","Application Data"
"12.173724","172.19.0.3","5.9.29.183","TLSv1.2","599","Application Data"
"12.173934","5.9.29.183","172.19.0.3","TCP","56","9002 → 43520 [ACK] Seq=382278 Ack=20548 Win=65535 Len=0"
"12.189101","5.9.29.183","172.19.0.3","TLSv1.2","1113","Application Data"
"12.230506","172.19.0.3","5.9.29.183","TCP","56","43520 → 9002 [ACK] Seq=20548 Ack=383335 Win=11911 Len=0"
"12.253704","5.9.29.183","172.19.0.3","TCP","1516","[TCP segment of a reassembled PDU]"
"12.253726","172.19.0.3","5.9.29.183","TCP","56","43520 → 9002 [ACK] Seq=20548 Ack=384795 Win=11911 Len=0"
"12.253778","5.9.29.183","172.19.0.3","TCP","1492","9002 → 43520 [PSH, ACK] Seq=384795 Ack=20548 Win=65535 Len=1436 [TCP segment of a reassembled PDU]"
"12.253816","172.19.0.3","5.9.29.183","TCP","56","43520 → 9002 [ACK] Seq=20548 Ack=386231 Win=11903 Len=0"
"12.253819","5.9.29.183","172.19.0.3","TLSv1.2","787","Application Data"
"12.253829","172.19.0.3","5.9.29.183","TCP","56","43520 → 9002 [ACK] Seq=20548 Ack=386962 Win=11898 Len=0"
"12.254427","172.19.0.3","5.9.29.183","TLSv1.2","599","Application Data"
"12.254766","5.9.29.183","172.19.0.3","TCP","56","9002 → 43520 [ACK] Seq=386962 Ack=21091 Win=65535 Len=0"
"12.290928","5.9.29.183","172.19.0.3","TLSv1.2","1113","Application Data"
"12.294165","172.19.0.3","5.9.29.183","TLSv1.2","599","Application Data"
"12.294403","5.9.29.183","172.19.0.3","TCP","56","9002 → 43520 [ACK] Seq=388019 Ack=21634 Win=65535 Len=0"
"12.889196","5.9.29.183","172.19.0.3","TLSv1.2","599","Application Data"
"12.889895","172.19.0.3","5.9.29.183","TLSv1.2","599","Application Data"
"12.890137","5.9.29.183","172.19.0.3","TCP","56","9002 → 43520 [ACK] Seq=388562 Ack=22177 Win=65535 Len=0"
"13.394352","5.9.29.183","172.19.0.3","TLSv1.2","599","Application Data"
"13.429023","5.9.29.183","172.19.0.3","TCP","1516","[TCP segment of a reassembled PDU]"
"13.429041","172.19.0.3","5.9.29.183","TCP","56","43520 → 9002 [ACK] Seq=22177 Ack=390565 Win=11911 Len=0"
"13.429092","5.9.29.183","172.19.0.3","TCP","1492","9002 → 43520 [PSH, ACK] Seq=390565 Ack=22177 Win=65535 Len=1436 [TCP segment of a reassembled PDU]"
"13.429903","5.9.29.183","172.19.0.3","TLSv1.2","787","Application Data"
"13.429912","172.19.0.3","5.9.29.183","TCP","56","43520 → 9002 [ACK] Seq=22177 Ack=392732 Win=11911 Len=0"
"13.449326","5.9.29.183","172.19.0.3","TCP","1504","[TCP segment of a reassembled PDU]"
"13.449415","5.9.29.183","172.19.0.3","TCP","1504","9002 → 43520 [PSH, ACK] Seq=394180 Ack=22177 Win=65535 Len=1448 [TCP segment of a reassembled PDU]"
"13.449509","5.9.29.183","172.19.0.3","TLSv1.2","1237","Application Data"
"13.449513","172.19.0.3","5.9.29.183","TCP","56","43520 → 9002 [ACK] Seq=22177 Ack=395628 Win=11903 Len=0"
"13.465253","5.9.29.183","172.19.0.3","TLSv1.2","149","Application Data"
"13.465414","172.19.0.3","5.9.29.183","TCP","56","43520 → 9002 [ACK] Seq=22177 Ack=396902 Win=11911 Len=0"
"13.496105","5.9.29.183","172.19.0.3","TCP","1516","[TCP segment of a reassembled PDU]"
"13.496143","5.9.29.183","172.19.0.3","TCP","1492","9002 → 43520 [PSH, ACK] Seq=398362 Ack=22177 Win=65535 Len=1436 [TCP segment of a reassembled PDU]"
"13.496257","172.19.0.3","5.9.29.183","TCP","56","43520 → 9002 [ACK] Seq=22177 Ack=399798 Win=11903 Len=0"
"13.496327","5.9.29.183","172.19.0.3","TLSv1.2","1237","Application Data"
"13.511756","5.9.29.183","172.19.0.3","TLSv1.2","663","Application Data"
"13.511775","172.19.0.3","5.9.29.183","TCP","56","43520 → 9002 [ACK] Seq=22177 Ack=401586 Win=11911 Len=0"
"13.513666","5.9.29.183","172.19.0.3","TCP","1516","[TCP segment of a reassembled PDU]"
"13.513710","5.9.29.183","172.19.0.3","TCP","1516","9002 → 43520 [PSH, ACK] Seq=403046 Ack=22177 Win=65535 Len=1460 [TCP segment of a reassembled PDU]"
"13.513716","5.9.29.183","172.19.0.3","TLSv1.2","1516","Application Data [TCP segment of a reassembled PDU]"
"13.513732","5.9.29.183","172.19.0.3","TCP","1468","9002 → 43520 [PSH, ACK] Seq=405966 Ack=22177 Win=65535 Len=1412 [TCP segment of a reassembled PDU]"
"13.513737","5.9.29.183","172.19.0.3","TCP","1504","9002 → 43520 [PSH, ACK] Seq=407378 Ack=22177 Win=65535 Len=1448 [TCP segment of a reassembled PDU]"
"13.513812","172.19.0.3","5.9.29.183","TCP","56","43520 → 9002 [ACK] Seq=22177 Ack=408826 Win=11879 Len=0"
"13.526898","5.9.29.183","172.19.0.3","TLSv1.2","70","Application Data"
"13.533115","5.9.29.183","172.19.0.3","TCP","1516","[TCP segment of a reassembled PDU]"
"13.533131","172.19.0.3","5.9.29.183","TCP","56","43520 → 9002 [ACK] Seq=22177 Ack=410300 Win=11911 Len=0"
"13.533162","5.9.29.183","172.19.0.3","TCP","1492","9002 → 43520 [PSH, ACK] Seq=410300 Ack=22177 Win=65535 Len=1436 [TCP segment of a reassembled PDU]"
"13.533191","5.9.29.183","172.19.0.3","TLSv1.2","1516","Application Data [TCP segment of a reassembled PDU]"
"13.533198","5.9.29.183","172.19.0.3","TCP","1516","9002 → 43520 [PSH, ACK] Seq=413196 Ack=22177 Win=65535 Len=1460 [TCP segment of a reassembled PDU]"
"13.533202","5.9.29.183","172.19.0.3","TCP","1516","9002 → 43520 [PSH, ACK] Seq=414656 Ack=22177 Win=65535 Len=1460 [TCP segment of a reassembled PDU]"
"13.533205","5.9.29.183","172.19.0.3","TLSv1.2","1516","Application Data [TCP segment of a reassembled PDU]"
"13.533255","5.9.29.183","172.19.0.3","TCP","1456","9002 → 43520 [PSH, ACK] Seq=417576 Ack=22177 Win=65535 Len=1400 [TCP segment of a reassembled PDU]"
"13.533300","172.19.0.3","5.9.29.183","TCP","56","43520 → 9002 [ACK] Seq=22177 Ack=418976 Win=11861 Len=0"
"13.533628","172.19.0.3","5.9.29.183","TLSv1.2","599","Application Data"
"13.533846","5.9.29.183","172.19.0.3","TCP","56","9002 → 43520 [ACK] Seq=418976 Ack=22720 Win=65535 Len=0"
"13.542333","5.9.29.183","172.19.0.3","TLSv1.2","287","Application Data"
"13.552189","5.9.29.183","172.19.0.3","TCP","1504","[TCP segment of a reassembled PDU]"
"13.552205","172.19.0.3","5.9.29.183","TCP","56","43520 → 9002 [ACK] Seq=22720 Ack=420655 Win=11911 Len=0"
"13.552237","5.9.29.183","172.19.0.3","TCP","1516","9002 → 43520 [PSH, ACK] Seq=420655 Ack=22720 Win=65535 Len=1460 [TCP segment of a reassembled PDU]"
"13.552266","5.9.29.183","172.19.0.3","TLSv1.2","1492","Application Data [TCP segment of a reassembled PDU]"
"13.552363","172.19.0.3","5.9.29.183","TCP","56","43520 → 9002 [ACK] Seq=22720 Ack=423551 Win=11895 Len=0"
"13.557797","5.9.29.183","172.19.0.3","TLSv1.2","910","Application Data"
"13.604011","172.19.0.3","5.9.29.183","TCP","56","43520 → 9002 [ACK] Seq=22720 Ack=424405 Win=11911 Len=0"
"13.609288","5.9.29.183","172.19.0.3","TCP","1504","[TCP segment of a reassembled PDU]"
"13.609311","172.19.0.3","5.9.29.183","TCP","56","43520 → 9002 [ACK] Seq=22720 Ack=425853 Win=11911 Len=0"
"13.609808","5.9.29.183","172.19.0.3","TCP","1504","9002 → 43520 [PSH, ACK] Seq=425853 Ack=22720 Win=65535 Len=1448 [TCP segment of a reassembled PDU]"
"13.609818","172.19.0.3","5.9.29.183","TCP","56","43520 → 9002 [ACK] Seq=22720 Ack=427301 Win=11911 Len=0"
"13.609943","5.9.29.183","172.19.0.3","TLSv1.2","787","Application Data"
"13.609954","172.19.0.3","5.9.29.183","TCP","56","43520 → 9002 [ACK] Seq=22720 Ack=428032 Win=11911 Len=0"
"13.620893","5.9.29.183","172.19.0.3","TCP","1516","[TCP segment of a reassembled PDU]"
"13.620952","5.9.29.183","172.19.0.3","TCP","1516","9002 → 43520 [PSH, ACK] Seq=429492 Ack=22720 Win=65535 Len=1460 [TCP segment of a reassembled PDU]"
"13.620962","5.9.29.183","172.19.0.3","TLSv1.2","1516","Application Data [TCP segment of a reassembled PDU]"
"13.620965","5.9.29.183","172.19.0.3","TCP","1468","9002 → 43520 [PSH, ACK] Seq=432412 Ack=22720 Win=65535 Len=1412 [TCP segment of a reassembled PDU]"
"13.620989","5.9.29.183","172.19.0.3","TCP","1516","9002 → 43520 [PSH, ACK] Seq=433824 Ack=22720 Win=65535 Len=1460 [TCP segment of a reassembled PDU]"
"13.621014","5.9.29.183","172.19.0.3","TLSv1.2","1516","Application Data [TCP segment of a reassembled PDU]"
"13.621038","5.9.29.183","172.19.0.3","TCP","1480","9002 → 43520 [PSH, ACK] Seq=436744 Ack=22720 Win=65535 Len=1424 [TCP segment of a reassembled PDU]"
"13.621270","172.19.0.3","5.9.29.183","TCP","56","43520 → 9002 [ACK] Seq=22720 Ack=438168 Win=11863 Len=0"
"13.626255","5.9.29.183","172.19.0.3","TCP","1516","9002 → 43520 [PSH, ACK] Seq=438168 Ack=22720 Win=65535 Len=1460 [TCP segment of a reassembled PDU]"
"13.626300","5.9.29.183","172.19.0.3","TLSv1.2","369","Application Data"
"13.626312","172.19.0.3","5.9.29.183","TCP","56","43520 → 9002 [ACK] Seq=22720 Ack=439941 Win=11901 Len=0"
"13.626619","172.19.0.3","5.9.29.183","TLSv1.2","599","Application Data"
"13.627069","5.9.29.183","172.19.0.3","TCP","56","9002 → 43520 [ACK] Seq=439941 Ack=23263 Win=65535 Len=0"
"13.643890","5.9.29.183","172.19.0.3","TCP","1516","[TCP segment of a reassembled PDU]"
"13.643983","5.9.29.183","172.19.0.3","TCP","1516","9002 → 43520 [PSH, ACK] Seq=441401 Ack=23263 Win=65535 Len=1460 [TCP segment of a reassembled PDU]"
"13.643990","5.9.29.183","172.19.0.3","TLSv1.2","763","Application Data"
"13.644095","172.19.0.3","5.9.29.183","TCP","56","43520 → 9002 [ACK] Seq=23263 Ack=443568 Win=11895 Len=0"
"13.644372","172.19.0.3","5.9.29.183","TLSv1.2","599","Application Data"
"13.644680","5.9.29.183","172.19.0.3","TCP","56","9002 → 43520 [ACK] Seq=443568 Ack=23806 Win=65535 Len=0"
"13.661198","5.9.29.183","172.19.0.3","TCP","1516","[TCP segment of a reassembled PDU]"
"13.661240","5.9.29.183","172.19.0.3","TCP","1492","9002 → 43520 [PSH, ACK] Seq=445028 Ack=23806 Win=65535 Len=1436 [TCP segment of a reassembled PDU]"
"13.661251","5.9.29.183","172.19.0.3","TLSv1.2","1237","Application Data"
"13.661336","172.19.0.3","5.9.29.183","TCP","56","43520 → 9002 [ACK] Seq=23806 Ack=447645 Win=11895 Len=0"
"13.676499","5.9.29.183","172.19.0.3","TLSv1.2","149","Application Data"
"13.698610","5.9.29.183","172.19.0.3","TCP","1516","[TCP segment of a reassembled PDU]"
"13.698629","172.19.0.3","5.9.29.183","TCP","56","43520 → 9002 [ACK] Seq=23806 Ack=449198 Win=11911 Len=0"
"13.698669","5.9.29.183","172.19.0.3","TCP","1492","9002 → 43520 [PSH, ACK] Seq=449198 Ack=23806 Win=65535 Len=1436 [TCP segment of a reassembled PDU]"
"13.698950","5.9.29.183","172.19.0.3","TLSv1.2","1237","Application Data"
"13.698959","172.19.0.3","5.9.29.183","TCP","56","43520 → 9002 [ACK] Seq=23806 Ack=451815 Win=11911 Len=0"
"13.699661","172.19.0.3","5.9.29.183","TLSv1.2","599","Application Data"
"13.699901","5.9.29.183","172.19.0.3","TCP","56","9002 → 43520 [ACK] Seq=451815 Ack=24349 Win=65535 Len=0"
"13.709249","172.19.0.3","5.9.29.183","TLSv1.2","599","Application Data"
"13.709507","5.9.29.183","172.19.0.3","TCP","56","9002 → 43520 [ACK] Seq=451815 Ack=24892 Win=65535 Len=0"
"13.713954","5.9.29.183","172.19.0.3","TLSv1.2","149","Application Data"
"13.754737","172.19.0.3","5.9.29.183","TCP","56","43520 → 9002 [ACK] Seq=24892 Ack=451908 Win=11911 Len=0"
"14.405681","02:42:7b:11:31:3d","","ARP","44","Who has 172.19.0.3? Tell 172.19.0.1"
"14.405692","02:42:ac:13:00:03","","ARP","44","172.19.0.3 is at 02:42:ac:13:00:03"
"14.562636","5.9.29.183","172.19.0.3","TLSv1.2","599","Application Data"
"14.562697","172.19.0.3","5.9.29.183","TCP","56","43520 → 9002 [ACK] Seq=24892 Ack=452451 Win=11909 Len=0"
"14.563544","172.19.0.3","5.9.29.183","TLSv1.2","599","Application Data"
"14.563760","5.9.29.183","172.19.0.3","TCP","56","9002 → 43520 [ACK] Seq=452451 Ack=25435 Win=65535 Len=0"
"15.726448","5.9.29.183","172.19.0.3","TLSv1.2","599","Application Data"
"15.741201","5.9.29.183","172.19.0.3","TCP","1516","[TCP segment of a reassembled PDU]"
"15.741231","172.19.0.3","5.9.29.183","TCP","56","43520 → 9002 [ACK] Seq=25435 Ack=454454 Win=11911 Len=0"
"15.741273","5.9.29.183","172.19.0.3","TCP","1492","9002 → 43520 [PSH, ACK] Seq=454454 Ack=25435 Win=65535 Len=1436 [TCP segment of a reassembled PDU]"
"15.742599","5.9.29.183","172.19.0.3","TLSv1.2","1516","Application Data [TCP segment of a reassembled PDU]"
"15.742609","172.19.0.3","5.9.29.183","TCP","56","43520 → 9002 [ACK] Seq=25435 Ack=457350 Win=11911 Len=0"
"15.742644","5.9.29.183","172.19.0.3","TCP","1492","9002 → 43520 [PSH, ACK] Seq=457350 Ack=25435 Win=65535 Len=1436 [TCP segment of a reassembled PDU]"
"15.742652","5.9.29.183","172.19.0.3","TCP","1504","9002 → 43520 [PSH, ACK] Seq=458786 Ack=25435 Win=65535 Len=1448 [TCP segment of a reassembled PDU]"
"15.742758","172.19.0.3","5.9.29.183","TCP","56","43520 → 9002 [ACK] Seq=25435 Ack=460234 Win=11895 Len=0"
"15.742832","5.9.29.183","172.19.0.3","TLSv1.2","1504","Application Data [TCP segment of a reassembled PDU]"
"15.742903","5.9.29.183","172.19.0.3","TCP","1516","9002 → 43520 [PSH, ACK] Seq=461682 Ack=25435 Win=65535 Len=1460 [TCP segment of a reassembled PDU]"
"15.742945","5.9.29.183","172.19.0.3","TLSv1.2","1303","Application Data"
"15.742997","172.19.0.3","5.9.29.183","TCP","56","43520 → 9002 [ACK] Seq=25435 Ack=464389 Win=11869 Len=0"
"15.761761","5.9.29.183","172.19.0.3","TCP","1516","[TCP segment of a reassembled PDU]"
"15.761815","5.9.29.183","172.19.0.3","TCP","1516","9002 → 43520 [PSH, ACK] Seq=465849 Ack=25435 Win=65535 Len=1460 [TCP segment of a reassembled PDU]"
"15.761828","172.19.0.3","5.9.29.183","TCP","56","43520 → 9002 [ACK] Seq=25435 Ack=467309 Win=11903 Len=0"
"15.761831","5.9.29.183","172.19.0.3","TLSv1.2","1516","Application Data [TCP segment of a reassembled PDU]"
"15.761833","5.9.29.183","172.19.0.3","TCP","1516","9002 → 43520 [PSH, ACK] Seq=468769 Ack=25435 Win=65535 Len=1460 [TCP segment of a reassembled PDU]"
"15.761835","5.9.29.183","172.19.0.3","TCP","1189","9002 → 43520 [PSH, ACK] Seq=470229 Ack=25435 Win=65535 Len=1133 [TCP segment of a reassembled PDU]"
"15.761882","5.9.29.183","172.19.0.3","TLSv1.2","1504","Application Data [TCP segment of a reassembled PDU]"
"15.761912","172.19.0.3","5.9.29.183","TCP","56","43520 → 9002 [ACK] Seq=25435 Ack=472810 Win=11871 Len=0"
"15.776674","5.9.29.183","172.19.0.3","TLSv1.2","460","Application Data"
"15.781783","5.9.29.183","172.19.0.3","TCP","1516","[TCP segment of a reassembled PDU]"
"15.781801","172.19.0.3","5.9.29.183","TCP","56","43520 → 9002 [ACK] Seq=25435 Ack=474674 Win=11911 Len=0"
"15.781838","5.9.29.183","172.19.0.3","TCP","1492","9002 → 43520 [PSH, ACK] Seq=474674 Ack=25435 Win=65535 Len=1436 [TCP segment of a reassembled PDU]"
"15.782256","5.9.29.183","172.19.0.3","TLSv1.2","1504","Application Data [TCP segment of a reassembled PDU]"
"15.782263","172.19.0.3","5.9.29.183","TCP","56","43520 → 9002 [ACK] Seq=25435 Ack=477558 Win=11911 Len=0"
"15.782290","5.9.29.183","172.19.0.3","TCP","1516","9002 → 43520 [PSH, ACK] Seq=477558 Ack=25435 Win=65535 Len=1460 [TCP segment of a reassembled PDU]"
"15.782295","5.9.29.183","172.19.0.3","TCP","1492","9002 → 43520 [PSH, ACK] Seq=479018 Ack=25435 Win=65535 Len=1436 [TCP segment of a reassembled PDU]"
"15.782355","172.19.0.3","5.9.29.183","TCP","56","43520 → 9002 [ACK] Seq=25435 Ack=480454 Win=11895 Len=0"
"15.788212","5.9.29.183","172.19.0.3","TLSv1.2","1504","Application Data, Application Data"
"15.788538","172.19.0.3","5.9.29.183","TLSv1.2","599","Application Data"
"15.788787","5.9.29.183","172.19.0.3","TCP","56","9002 → 43520 [ACK] Seq=481902 Ack=25978 Win=65535 Len=0"
"15.791806","5.9.29.183","172.19.0.3","TLSv1.2","222","Application Data"
"15.802321","5.9.29.183","172.19.0.3","TCP","1516","[TCP segment of a reassembled PDU]"
"15.802338","172.19.0.3","5.9.29.183","TCP","56","43520 → 9002 [ACK] Seq=25978 Ack=483528 Win=11911 Len=0"
"15.802372","5.9.29.183","172.19.0.3","TCP","1492","9002 → 43520 [PSH, ACK] Seq=483528 Ack=25978 Win=65535 Len=1436 [TCP segment of a reassembled PDU]"
"15.803274","5.9.29.183","172.19.0.3","TLSv1.2","1516","Application Data [TCP segment of a reassembled PDU]"
"15.803281","172.19.0.3","5.9.29.183","TCP","56","43520 → 9002 [ACK] Seq=25978 Ack=486424 Win=11911 Len=0"
"15.803307","5.9.29.183","172.19.0.3","TCP","1492","9002 → 43520 [PSH, ACK] Seq=486424 Ack=25978 Win=65535 Len=1436 [TCP segment of a reassembled PDU]"
"15.803313","5.9.29.183","172.19.0.3","TCP","1504","9002 → 43520 [PSH, ACK] Seq=487860 Ack=25978 Win=65535 Len=1448 [TCP segment of a reassembled PDU]"
"15.803373","172.19.0.3","5.9.29.183","TCP","56","43520 → 9002 [ACK] Seq=25978 Ack=489308 Win=11893 Len=0"
"15.805155","5.9.29.183","172.19.0.3","TLSv1.2","1504","Application Data [TCP segment of a reassembled PDU]"
"15.807777","5.9.29.183","172.19.0.3","TLSv1.2","193","Application Data"
"15.807796","172.19.0.3","5.9.29.183","TCP","56","43520 → 9002 [ACK] Seq=25978 Ack=490893 Win=11911 Len=0"
"15.808115","172.19.0.3","5.9.29.183","TLSv1.2","599","Application Data"
"15.808307","5.9.29.183","172.19.0.3","TCP","56","9002 → 43520 [ACK] Seq=490893 Ack=26521 Win=65535 Len=0"
"15.821473","5.9.29.183","172.19.0.3","TCP","1516","[TCP segment of a reassembled PDU]"
"15.821572","5.9.29.183","172.19.0.3","TCP","1492","9002 → 43520 [PSH, ACK] Seq=492353 Ack=26521 Win=65535 Len=1436 [TCP segment of a reassembled PDU]"
"15.821727","172.19.0.3","5.9.29.183","TCP","56","43520 → 9002 [ACK] Seq=26521 Ack=493789 Win=11903 Len=0"
"15.821778","5.9.29.183","172.19.0.3","TLSv1.2","1516","Application Data [TCP segment of a reassembled PDU]"
"15.821786","5.9.29.183","172.19.0.3","TCP","1492","9002 → 43520 [PSH, ACK] Seq=495249 Ack=26521 Win=65535 Len=1436 [TCP segment of a reassembled PDU]"
"15.821841","172.19.0.3","5.9.29.183","TCP","56","43520 → 9002 [ACK] Seq=26521 Ack=496685 Win=11887 Len=0"
"15.821857","5.9.29.183","172.19.0.3","TCP","1504","9002 → 43520 [PSH, ACK] Seq=496685 Ack=26521 Win=65535 Len=1448 [TCP segment of a reassembled PDU]"
"15.822968","5.9.29.183","172.19.0.3","TLSv1.2","1127","Application Data, Application Data"
"15.822980","172.19.0.3","5.9.29.183","TCP","56","43520 → 9002 [ACK] Seq=26521 Ack=499204 Win=11911 Len=0"
"15.840802","5.9.29.183","172.19.0.3","TCP","1516","[TCP segment of a reassembled PDU]"
"15.840883","5.9.29.183","172.19.0.3","TCP","1492","9002 → 43520 [PSH, ACK] Seq=500664 Ack=26521 Win=65535 Len=1436 [TCP segment of a reassembled PDU]"
"15.840942","5.9.29.183","172.19.0.3","TLSv1.2","1237","Application Data"
"15.841009","5.9.29.183","172.19.0.3","TCP","1504","[TCP segment of a reassembled PDU]"
"15.841013","5.9.29.183","172.19.0.3","TCP","1516","9002 → 43520 [PSH, ACK] Seq=504729 Ack=26521 Win=65535 Len=1460 [TCP segment of a reassembled PDU]"
"15.841015","5.9.29.183","172.19.0.3","TCP","804","9002 → 43520 [PSH, ACK] Seq=506189 Ack=26521 Win=65535 Len=748 [TCP segment of a reassembled PDU]"
"15.841042","172.19.0.3","5.9.29.183","TCP","56","43520 → 9002 [ACK] Seq=26521 Ack=506937 Win=11871 Len=0"
"15.841182","5.9.29.183","172.19.0.3","TLSv1.2","744","Application Data [TCP segment of a reassembled PDU]"
"15.841827","172.19.0.3","5.9.29.183","TLSv1.2","599","Application Data"
"15.842080","5.9.29.183","172.19.0.3","TCP","56","9002 → 43520 [ACK] Seq=507625 Ack=27064 Win=65535 Len=0"
"15.856707","5.9.29.183","172.19.0.3","TLSv1.2","460","Application Data"
"15.858848","5.9.29.183","172.19.0.3","TCP","1504","[TCP segment of a reassembled PDU]"
"15.858861","172.19.0.3","5.9.29.183","TCP","56","43520 → 9002 [ACK] Seq=27064 Ack=509477 Win=11911 Len=0"
"15.859639","5.9.29.183","172.19.0.3","TCP","1504","9002 → 43520 [PSH, ACK] Seq=509477 Ack=27064 Win=65535 Len=1448 [TCP segment of a reassembled PDU]"
"15.859683","5.9.29.183","172.19.0.3","TLSv1.2","1504","Application Data [TCP segment of a reassembled PDU]"
"15.859698","5.9.29.183","172.19.0.3","TCP","1504","9002 → 43520 [PSH, ACK] Seq=512373 Ack=27064 Win=65535 Len=1448 [TCP segment of a reassembled PDU]"
"15.859721","172.19.0.3","5.9.29.183","TCP","56","43520 → 9002 [ACK] Seq=27064 Ack=513821 Win=11893 Len=0"
"15.859962","5.9.29.183","172.19.0.3","TCP","1504","9002 → 43520 [PSH, ACK] Seq=513821 Ack=27064 Win=65535 Len=1448 [TCP segment of a reassembled PDU]"
"15.860027","5.9.29.183","172.19.0.3","TLSv1.2","1504","Application Data [TCP segment of a reassembled PDU]"
"15.860036","172.19.0.3","5.9.29.183","TCP","56","43520 → 9002 [ACK] Seq=27064 Ack=516717 Win=11903 Len=0"
"15.860039","5.9.29.183","172.19.0.3","TCP","1516","9002 → 43520 [PSH, ACK] Seq=516717 Ack=27064 Win=65535 Len=1460 [TCP segment of a reassembled PDU]"
"15.860118","5.9.29.183","172.19.0.3","TCP","1492","9002 → 43520 [PSH, ACK] Seq=518177 Ack=27064 Win=65535 Len=1436 [TCP segment of a reassembled PDU]"
"15.860180","172.19.0.3","5.9.29.183","TCP","56","43520 → 9002 [ACK] Seq=27064 Ack=519613 Win=11887 Len=0"
"15.871905","5.9.29.183","172.19.0.3","TLSv1.2","381","Application Data"
"15.906918","5.9.29.183","172.19.0.3","TCP","1504","[TCP segment of a reassembled PDU]"
"15.906936","172.19.0.3","5.9.29.183","TCP","56","43520 → 9002 [ACK] Seq=27064 Ack=521386 Win=11911 Len=0"
"15.907376","5.9.29.183","172.19.0.3","TCP","1504","9002 → 43520 [PSH, ACK] Seq=521386 Ack=27064 Win=65535 Len=1448 [TCP segment of a reassembled PDU]"
"15.907552","5.9.29.183","172.19.0.3","TLSv1.2","1237","Application Data"
"15.907585","172.19.0.3","5.9.29.183","TCP","56","43520 → 9002 [ACK] Seq=27064 Ack=524015 Win=11911 Len=0"
"15.922650","5.9.29.183","172.19.0.3","TLSv1.2","663","Application Data"
"15.927561","172.19.0.3","5.9.29.183","TLSv1.2","599","Application Data"
"15.927831","5.9.29.183","172.19.0.3","TCP","56","9002 → 43520 [ACK] Seq=524622 Ack=27607 Win=65535 Len=0"
"16.514527","5.9.29.183","172.19.0.3","TLSv1.2","599","Application Data"
"16.515576","172.19.0.3","5.9.29.183","TLSv1.2","599","Application Data"
"16.515925","5.9.29.183","172.19.0.3","TCP","56","9002 → 43520 [ACK] Seq=525165 Ack=28150 Win=65535 Len=0"
"17.007202","5.9.29.183","172.19.0.3","TLSv1.2","599","Application Data"
"17.025137","5.9.29.183","172.19.0.3","TCP","1516","[TCP segment of a reassembled PDU]"
"17.025156","172.19.0.3","5.9.29.183","TCP","56","43520 → 9002 [ACK] Seq=28150 Ack=527168 Win=11911 Len=0"
"17.025203","5.9.29.183","172.19.0.3","TCP","1492","9002 → 43520 [PSH, ACK] Seq=527168 Ack=28150 Win=65535 Len=1436 [TCP segment of a reassembled PDU]"
"17.025395","5.9.29.183","172.19.0.3","TLSv1.2","787","Application Data"
"17.025405","172.19.0.3","5.9.29.183","TCP","56","43520 → 9002 [ACK] Seq=28150 Ack=529335 Win=11911 Len=0"
"17.077052","5.9.29.183","172.19.0.3","TCP","1516","[TCP segment of a reassembled PDU]"
"17.077107","5.9.29.183","172.19.0.3","TCP","1516","9002 → 43520 [PSH, ACK] Seq=530795 Ack=28150 Win=65535 Len=1460 [TCP segment of a reassembled PDU]"
"17.077117","5.9.29.183","172.19.0.3","TLSv1.2","763","Application Data"
"17.077266","172.19.0.3","5.9.29.183","TCP","56","43520 → 9002 [ACK] Seq=28150 Ack=532962 Win=11893 Len=0"
"17.111898","5.9.29.183","172.19.0.3","TLSv1.2","599","Application Data"
"17.124423","5.9.29.183","172.19.0.3","TCP","1504","[TCP segment of a reassembled PDU]"
"17.124445","172.19.0.3","5.9.29.183","TCP","56","43520 → 9002 [ACK] Seq=28150 Ack=534953 Win=11911 Len=0"
"17.124843","5.9.29.183","172.19.0.3","TCP","1516","9002 → 43520 [PSH, ACK] Seq=534953 Ack=28150 Win=65535 Len=1460 [TCP segment of a reassembled PDU]"
"17.124886","5.9.29.183","172.19.0.3","TLSv1.2","1492","Application Data [TCP segment of a reassembled PDU]"
"17.125038","172.19.0.3","5.9.29.183","TCP","56","43520 → 9002 [ACK] Seq=28150 Ack=537849 Win=11903 Len=0"
"17.125061","5.9.29.183","172.19.0.3","TCP","1504","9002 → 43520 [PSH, ACK] Seq=537849 Ack=28150 Win=65535 Len=1448 [TCP segment of a reassembled PDU]"
"17.125168","5.9.29.183","172.19.0.3","TCP","1516","9002 → 43520 [PSH, ACK] Seq=539297 Ack=28150 Win=65535 Len=1460 [TCP segment of a reassembled PDU]"
"17.125176","5.9.29.183","172.19.0.3","TLSv1.2","1516","Application Data [TCP segment of a reassembled PDU]"
"17.125179","5.9.29.183","172.19.0.3","TCP","1480","9002 → 43520 [PSH, ACK] Seq=542217 Ack=28150 Win=65535 Len=1424 [TCP segment of a reassembled PDU]"
"17.125256","172.19.0.3","5.9.29.183","TCP","56","43520 → 9002 [ACK] Seq=28150 Ack=543641 Win=11871 Len=0"
"17.126760","5.9.29.183","172.19.0.3","TLSv1.2","1315","Application Data"
"17.127193","172.19.0.3","5.9.29.183","TLSv1.2","599","Application Data"
"17.127558","5.9.29.183","172.19.0.3","TCP","56","9002 → 43520 [ACK] Seq=544900 Ack=28693 Win=65535 Len=0"
"17.142089","5.9.29.183","172.19.0.3","TLSv1.2","599","Application Data"
"17.142988","5.9.29.183","172.19.0.3","TCP","1504","[TCP segment of a reassembled PDU]"
"17.142996","172.19.0.3","5.9.29.183","TCP","56","43520 → 9002 [ACK] Seq=28693 Ack=546891 Win=11911 Len=0"
"17.143130","5.9.29.183","172.19.0.3","TCP","1504","9002 → 43520 [PSH, ACK] Seq=546891 Ack=28693 Win=65535 Len=1448 [TCP segment of a reassembled PDU]"
"17.143210","5.9.29.183","172.19.0.3","TLSv1.2","1504","Application Data [TCP segment of a reassembled PDU]"
"17.143216","172.19.0.3","5.9.29.183","TCP","56","43520 → 9002 [ACK] Seq=28693 Ack=549787 Win=11911 Len=0"
"17.148894","5.9.29.183","172.19.0.3","TLSv1.2","1516","Application Data [TCP segment of a reassembled PDU]"
"17.148947","5.9.29.183","172.19.0.3","TCP","1492","9002 → 43520 [PSH, ACK] Seq=551247 Ack=28693 Win=65535 Len=1436 [TCP segment of a reassembled PDU]"
"17.149094","172.19.0.3","5.9.29.183","TCP","56","43520 → 9002 [ACK] Seq=28693 Ack=552683 Win=11903 Len=0"
"17.157936","5.9.29.183","172.19.0.3","TLSv1.2","99","Application Data"
"17.158222","172.19.0.3","5.9.29.183","TLSv1.2","599","Application Data"
"17.158484","5.9.29.183","172.19.0.3","TCP","56","9002 → 43520 [ACK] Seq=552726 Ack=29236 Win=65535 Len=0"
"17.168399","5.9.29.183","172.19.0.3","TCP","1504","[TCP segment of a reassembled PDU]"
"17.168723","5.9.29.183","172.19.0.3","TCP","1504","9002 → 43520 [PSH, ACK] Seq=554174 Ack=29236 Win=65535 Len=1448 [TCP segment of a reassembled PDU]"
"17.168740","172.19.0.3","5.9.29.183","TCP","56","43520 → 9002 [ACK] Seq=29236 Ack=555622 Win=11911 Len=0"
"17.173076","5.9.29.183","172.19.0.3","TLSv1.2","1330","Application Data, Application Data"
"17.188976","5.9.29.183","172.19.0.3","TLSv1.2","1113","Application Data"
"17.188993","172.19.0.3","5.9.29.183","TCP","56","43520 → 9002 [ACK] Seq=29236 Ack=557953 Win=11911 Len=0"
"17.200845","5.9.29.183","172.19.0.3","TCP","1516","[TCP segment of a reassembled PDU]"
"17.200872","5.9.29.183","172.19.0.3","TCP","1492","9002 → 43520 [PSH, ACK] Seq=559413 Ack=29236 Win=65535 Len=1436 [TCP segment of a reassembled PDU]"
"17.201072","172.19.0.3","5.9.29.183","TCP","56","43520 → 9002 [ACK] Seq=29236 Ack=560849 Win=11903 Len=0"
"17.204078","5.9.29.183","172.19.0.3","TLSv1.2","273","Application Data"
"17.217555","5.9.29.183","172.19.0.3","TCP","1504","[TCP segment of a reassembled PDU]"
"17.217632","172.19.0.3","5.9.29.183","TCP","56","43520 → 9002 [ACK] Seq=29236 Ack=562514 Win=11911 Len=0"
"17.217805","5.9.29.183","172.19.0.3","TCP","1504","9002 → 43520 [PSH, ACK] Seq=562514 Ack=29236 Win=65535 Len=1448 [TCP segment of a reassembled PDU]"
"17.219117","5.9.29.183","172.19.0.3","TLSv1.2","787","Application Data"
"17.219126","172.19.0.3","5.9.29.183","TCP","56","43520 → 9002 [ACK] Seq=29236 Ack=564693 Win=11911 Len=0"
"17.228922","5.9.29.183","172.19.0.3","TCP","1504","[TCP segment of a reassembled PDU]"
"17.228985","5.9.29.183","172.19.0.3","TCP","1516","9002 → 43520 [PSH, ACK] Seq=566141 Ack=29236 Win=65535 Len=1460 [TCP segment of a reassembled PDU]"
"17.228994","5.9.29.183","172.19.0.3","TLSv1.2","1492","Application Data [TCP segment of a reassembled PDU]"
"17.229138","172.19.0.3","5.9.29.183","TCP","56","43520 → 9002 [ACK] Seq=29236 Ack=569037 Win=11895 Len=0"
"17.229164","5.9.29.183","172.19.0.3","TCP","1516","9002 → 43520 [PSH, ACK] Seq=569037 Ack=29236 Win=65535 Len=1460 [TCP segment of a reassembled PDU]"
"17.229276","5.9.29.183","172.19.0.3","TCP","1492","9002 → 43520 [PSH, ACK] Seq=570497 Ack=29236 Win=65535 Len=1436 [TCP segment of a reassembled PDU]"
"17.229281","5.9.29.183","172.19.0.3","TCP","596","9002 → 43520 [PSH, ACK] Seq=571933 Ack=29236 Win=65535 Len=540 [TCP segment of a reassembled PDU]"
"17.229312","172.19.0.3","5.9.29.183","TCP","56","43520 → 9002 [ACK] Seq=29236 Ack=572473 Win=11871 Len=0"
"17.229373","5.9.29.183","172.19.0.3","TLSv1.2","1516","Application Data [TCP segment of a reassembled PDU]"
"17.229465","5.9.29.183","172.19.0.3","TCP","1516","9002 → 43520 [PSH, ACK] Seq=573933 Ack=29236 Win=65535 Len=1460 [TCP segment of a reassembled PDU]"
"17.229473","5.9.29.183","172.19.0.3","TCP","940","9002 → 43520 [PSH, ACK] Seq=575393 Ack=29236 Win=65535 Len=884 [TCP segment of a reassembled PDU]"
"17.229551","172.19.0.3","5.9.29.183","TCP","56","43520 → 9002 [ACK] Seq=29236 Ack=576277 Win=11847 Len=0"
"17.234504","5.9.29.183","172.19.0.3","TLSv1.2","381","Application Data"
"17.245526","5.9.29.183","172.19.0.3","TCP","1504","[TCP segment of a reassembled PDU]"
"17.245548","172.19.0.3","5.9.29.183","TCP","56","43520 → 9002 [ACK] Seq=29236 Ack=578050 Win=11911 Len=0"
"17.245937","5.9.29.183","172.19.0.3","TCP","1516","9002 → 43520 [PSH, ACK] Seq=578050 Ack=29236 Win=65535 Len=1460 [TCP segment of a reassembled PDU]"
"17.245983","5.9.29.183","172.19.0.3","TLSv1.2","1492","Application Data [TCP segment of a reassembled PDU]"
"17.246071","172.19.0.3","5.9.29.183","TCP","56","43520 → 9002 [ACK] Seq=29236 Ack=580946 Win=11903 Len=0"
"17.246236","5.9.29.183","172.19.0.3","TCP","1516","9002 → 43520 [PSH, ACK] Seq=580946 Ack=29236 Win=65535 Len=1460 [TCP segment of a reassembled PDU]"
"17.246242","5.9.29.183","172.19.0.3","TCP","1516","9002 → 43520 [PSH, ACK] Seq=582406 Ack=29236 Win=65535 Len=1460 [TCP segment of a reassembled PDU]"
"17.246245","5.9.29.183","172.19.0.3","TLSv1.2","1516","Application Data [TCP segment of a reassembled PDU]"
"17.246247","5.9.29.183","172.19.0.3","TCP","1468","9002 → 43520 [PSH, ACK] Seq=585326 Ack=29236 Win=65535 Len=1412 [TCP segment of a reassembled PDU]"
"17.246250","5.9.29.183","172.19.0.3","TCP","1504","9002 → 43520 [PSH, ACK] Seq=586738 Ack=29236 Win=65535 Len=1448 [TCP segment of a reassembled PDU]"
"17.246312","172.19.0.3","5.9.29.183","TLSv1.2","599","Application Data"
"17.246489","5.9.29.183","172.19.0.3","TCP","56","9002 → 43520 [ACK] Seq=588186 Ack=29779 Win=65535 Len=0"
"17.250222","5.9.29.183","172.19.0.3","TLSv1.2","381","Application Data"
"17.289952","5.9.29.183","172.19.0.3","TCP","1516","[TCP segment of a reassembled PDU]"
"17.289969","172.19.0.3","5.9.29.183","TCP","56","43520 → 9002 [ACK] Seq=29779 Ack=589971 Win=11911 Len=0"
"17.290002","5.9.29.183","172.19.0.3","TCP","1516","9002 → 43520 [PSH, ACK] Seq=589971 Ack=29779 Win=65535 Len=1460 [TCP segment of a reassembled PDU]"
"17.290009","5.9.29.183","172.19.0.3","TLSv1.2","763","Application Data"
"17.290152","172.19.0.3","5.9.29.183","TCP","56","43520 → 9002 [ACK] Seq=29779 Ack=592138 Win=11895 Len=0"
"17.309395","5.9.29.183","172.19.0.3","TLSv1.2","1113","Application Data"
"17.351549","172.19.0.3","5.9.29.183","TCP","56","43520 → 9002 [ACK] Seq=29779 Ack=593195 Win=11911 Len=0"
"17.381432","5.9.29.183","172.19.0.3","TCP","1516","[TCP segment of a reassembled PDU]"
"17.381508","5.9.29.183","172.19.0.3","TLSv1.2","1195","Application Data"
"17.381668","172.19.0.3","5.9.29.183","TCP","56","43520 → 9002 [ACK] Seq=29779 Ack=595794 Win=11903 Len=0"
"17.381909","172.19.0.3","5.9.29.183","TLSv1.2","599","Application Data"
"17.382169","5.9.29.183","172.19.0.3","TCP","56","9002 → 43520 [ACK] Seq=595794 Ack=30322 Win=65535 Len=0"
"17.397902","5.9.29.183","172.19.0.3","TLSv1.2","1113","Application Data"
"17.404125","172.19.0.3","5.9.29.183","TLSv1.2","599","Application Data"
"17.404390","5.9.29.183","172.19.0.3","TCP","56","9002 → 43520 [ACK] Seq=596851 Ack=30865 Win=65535 Len=0"
"18.019694","5.9.29.183","172.19.0.3","TLSv1.2","599","Application Data"
"18.020370","172.19.0.3","5.9.29.183","TLSv1.2","599","Application Data"
"18.020594","5.9.29.183","172.19.0.3","TCP","56","9002 → 43520 [ACK] Seq=597394 Ack=31408 Win=65535 Len=0"
"18.507940","5.9.29.183","172.19.0.3","TLSv1.2","599","Application Data"
"18.548411","172.19.0.3","5.9.29.183","TCP","56","43520 → 9002 [ACK] Seq=31408 Ack=597937 Win=11911 Len=0"
"18.548676","5.9.29.183","172.19.0.3","TCP","1516","[TCP segment of a reassembled PDU]"
"18.548690","172.19.0.3","5.9.29.183","TCP","56","43520 → 9002 [ACK] Seq=31408 Ack=599397 Win=11911 Len=0"
"18.548701","5.9.29.183","172.19.0.3","TCP","1492","9002 → 43520 [PSH, ACK] Seq=599397 Ack=31408 Win=65535 Len=1436 [TCP segment of a reassembled PDU]"
"18.548708","172.19.0.3","5.9.29.183","TCP","56","43520 → 9002 [ACK] Seq=31408 Ack=600833 Win=11903 Len=0"
"18.548775","5.9.29.183","172.19.0.3","TLSv1.2","787","Application Data"
"18.548783","172.19.0.3","5.9.29.183","TCP","56","43520 → 9002 [ACK] Seq=31408 Ack=601564 Win=11898 Len=0"
"18.568781","5.9.29.183","172.19.0.3","TCP","1504","[TCP segment of a reassembled PDU]"
"18.568803","172.19.0.3","5.9.29.183","TCP","56","43520 → 9002 [ACK] Seq=31408 Ack=603012 Win=11911 Len=0"
"18.569096","5.9.29.183","172.19.0.3","TCP","1516","9002 → 43520 [PSH, ACK] Seq=603012 Ack=31408 Win=65535 Len=1460 [TCP segment of a reassembled PDU]"
"18.569126","172.19.0.3","5.9.29.183","TCP","56","43520 → 9002 [ACK] Seq=31408 Ack=604472 Win=11901 Len=0"
"18.569210","5.9.29.183","172.19.0.3","TLSv1.2","775","Application Data"
"18.569221","172.19.0.3","5.9.29.183","TCP","56","43520 → 9002 [ACK] Seq=31408 Ack=605191 Win=11896 Len=0"
"18.586847","5.9.29.183","172.19.0.3","TLSv1.2","599","Application Data"
"18.586870","172.19.0.3","5.9.29.183","TCP","56","43520 → 9002 [ACK] Seq=31408 Ack=605734 Win=11911 Len=0"
"18.618353","5.9.29.183","172.19.0.3","TCP","1516","[TCP segment of a reassembled PDU]"
"18.618378","172.19.0.3","5.9.29.183","TCP","56","43520 → 9002 [ACK] Seq=31408 Ack=607194 Win=11911 Len=0"
"18.618394","5.9.29.183","172.19.0.3","TCP","1492","9002 → 43520 [PSH, ACK] Seq=607194 Ack=31408 Win=65535 Len=1436 [TCP segment of a reassembled PDU]"
"18.618401","172.19.0.3","5.9.29.183","TCP","56","43520 → 9002 [ACK] Seq=31408 Ack=608630 Win=11903 Len=0"
"18.618608","5.9.29.183","172.19.0.3","TLSv1.2","1237","Application Data"
"18.618617","172.19.0.3","5.9.29.183","TCP","56","43520 → 9002 [ACK] Seq=31408 Ack=609811 Win=11895 Len=0"
"18.618826","5.9.29.183","172.19.0.3","TCP","1516","[TCP segment of a reassembled PDU]"
"18.618842","172.19.0.3","5.9.29.183","TCP","56","43520 → 9002 [ACK] Seq=31408 Ack=611271 Win=11887 Len=0"
"18.618844","5.9.29.183","172.19.0.3","TCP","1492","9002 → 43520 [PSH, ACK] Seq=611271 Ack=31408 Win=65535 Len=1436 [TCP segment of a reassembled PDU]"
"18.618850","172.19.0.3","5.9.29.183","TCP","56","43520 → 9002 [ACK] Seq=31408 Ack=612707 Win=11879 Len=0"
"18.618992","5.9.29.183","172.19.0.3","TLSv1.2","1516","Application Data [TCP segment of a reassembled PDU]"
"18.619007","172.19.0.3","5.9.29.183","TCP","56","43520 → 9002 [ACK] Seq=31408 Ack=614167 Win=11871 Len=0"
"18.619008","5.9.29.183","172.19.0.3","TCP","1492","9002 → 43520 [PSH, ACK] Seq=614167 Ack=31408 Win=65535 Len=1436 [TCP segment of a reassembled PDU]"
"18.619014","172.19.0.3","5.9.29.183","TCP","56","43520 → 9002 [ACK] Seq=31408 Ack=615603 Win=11863 Len=0"
"18.619121","5.9.29.183","172.19.0.3","TCP","1504","9002 → 43520 [PSH, ACK] Seq=615603 Ack=31408 Win=65535 Len=1448 [TCP segment of a reassembled PDU]"
"18.619132","172.19.0.3","5.9.29.183","TCP","56","43520 → 9002 [ACK] Seq=31408 Ack=617051 Win=11855 Len=0"
"18.634777","5.9.29.183","172.19.0.3","TLSv1.2","648","Application Data"
"18.635000","172.19.0.3","5.9.29.183","TCP","56","43520 → 9002 [ACK] Seq=31408 Ack=617643 Win=11911 Len=0"
"18.642614","5.9.29.183","172.19.0.3","TCP","1504","[TCP segment of a reassembled PDU]"
"18.642639","5.9.29.183","172.19.0.3","TCP","1504","9002 → 43520 [PSH, ACK] Seq=619091 Ack=31408 Win=65535 Len=1448 [TCP segment of a reassembled PDU]"
"18.642734","172.19.0.3","5.9.29.183","TCP","56","43520 → 9002 [ACK] Seq=31408 Ack=620539 Win=11903 Len=0"
"18.650515","5.9.29.183","172.19.0.3","TLSv1.2","787","Application Data"
"18.650649","172.19.0.3","5.9.29.183","TCP","56","43520 → 9002 [ACK] Seq=31408 Ack=621270 Win=11911 Len=0"
"18.666183","5.9.29.183","172.19.0.3","TLSv1.2","599","Application Data"
"18.666318","172.19.0.3","5.9.29.183","TCP","56","43520 → 9002 [ACK] Seq=31408 Ack=621813 Win=11911 Len=0"
"18.672703","5.9.29.183","172.19.0.3","TCP","1516","[TCP segment of a reassembled PDU]"
"18.672734","5.9.29.183","172.19.0.3","TCP","1516","9002 → 43520 [PSH, ACK] Seq=623273 Ack=31408 Win=65535 Len=1460 [TCP segment of a reassembled PDU]"
"18.672741","5.9.29.183","172.19.0.3","TLSv1.2","1480","Application Data [TCP segment of a reassembled PDU]"
"18.672744","5.9.29.183","172.19.0.3","TCP","1516","9002 → 43520 [PSH, ACK] Seq=626157 Ack=31408 Win=65535 Len=1460 [TCP segment of a reassembled PDU]"
"18.672748","5.9.29.183","172.19.0.3","TCP","1492","9002 → 43520 [PSH, ACK] Seq=627617 Ack=31408 Win=65535 Len=1436 [TCP segment of a reassembled PDU]"
"18.672881","172.19.0.3","5.9.29.183","TCP","56","43520 → 9002 [ACK] Seq=31408 Ack=629053 Win=11879 Len=0"
"18.673299","172.19.0.3","5.9.29.183","TLSv1.2","599","Application Data"
"18.673676","5.9.29.183","172.19.0.3","TCP","56","9002 → 43520 [ACK] Seq=629053 Ack=31951 Win=65535 Len=0"
"18.681276","5.9.29.183","172.19.0.3","TLSv1.2","70","Application Data"
"18.697982","5.9.29.183","172.19.0.3","TCP","1516","[TCP segment of a reassembled PDU]"
"18.698000","172.19.0.3","5.9.29.183","TCP","56","43520 → 9002 [ACK] Seq=31951 Ack=630527 Win=11911 Len=0"
"18.698007","5.9.29.183","172.19.0.3","TCP","1492","9002 → 43520 [PSH, ACK] Seq=630527 Ack=31951 Win=65535 Len=1436 [TCP segment of a reassembled PDU]"
"18.698212","5.9.29.183","172.19.0.3","TLSv1.2","1237","Application Data"
"18.698220","172.19.0.3","5.9.29.183","TCP","56","43520 → 9002 [ACK] Seq=31951 Ack=633144 Win=11911 Len=0"
"18.713851","5.9.29.183","172.19.0.3","TLSv1.2","149","Application Data"
"18.718078","5.9.29.183","172.19.0.3","TCP","1516","[TCP segment of a reassembled PDU]"
"18.718107","172.19.0.3","5.9.29.183","TCP","56","43520 → 9002 [ACK] Seq=31951 Ack=634697 Win=11911 Len=0"
"18.718332","5.9.29.183","172.19.0.3","TCP","1492","9002 → 43520 [PSH, ACK] Seq=634697 Ack=31951 Win=65535 Len=1436 [TCP segment of a reassembled PDU]"
"18.729038","5.9.29.183","172.19.0.3","TLSv1.2","787","Application Data"
"18.729056","172.19.0.3","5.9.29.183","TCP","56","43520 → 9002 [ACK] Seq=31951 Ack=636864 Win=11911 Len=0"
"18.732036","5.9.29.183","172.19.0.3","TCP","1201","[TCP segment of a reassembled PDU]"
"18.732069","5.9.29.183","172.19.0.3","TCP","359","9002 → 43520 [PSH, ACK] Seq=638009 Ack=31951 Win=65535 Len=303 [TCP segment of a reassembled PDU]"
"18.732135","172.19.0.3","5.9.29.183","TCP","56","43520 → 9002 [ACK] Seq=31951 Ack=638312 Win=11911 Len=0"
"18.732684","5.9.29.183","172.19.0.3","TCP","1504","9002 → 43520 [PSH, ACK] Seq=638312 Ack=31951 Win=65535 Len=1448 [TCP segment of a reassembled PDU]"
"18.732934","5.9.29.183","172.19.0.3","TLSv1.2","1516","Application Data [TCP segment of a reassembled PDU]"
"18.732942","172.19.0.3","5.9.29.183","TCP","56","43520 → 9002 [ACK] Seq=31951 Ack=641220 Win=11911 Len=0"
"18.732970","5.9.29.183","172.19.0.3","TCP","1492","9002 → 43520 [PSH, ACK] Seq=641220 Ack=31951 Win=65535 Len=1436 [TCP segment of a reassembled PDU]"
"18.733104","5.9.29.183","172.19.0.3","TCP","1504","9002 → 43520 [PSH, ACK] Seq=642656 Ack=31951 Win=65535 Len=1448 [TCP segment of a reassembled PDU]"
"18.733128","172.19.0.3","5.9.29.183","TCP","56","43520 → 9002 [ACK] Seq=31951 Ack=644104 Win=11895 Len=0"
"18.743958","5.9.29.183","172.19.0.3","TLSv1.2","584","Application Data"
"18.752992","5.9.29.183","172.19.0.3","TCP","1516","[TCP segment of a reassembled PDU]"
"18.753010","172.19.0.3","5.9.29.183","TCP","56","43520 → 9002 [ACK] Seq=31951 Ack=646092 Win=11911 Len=0"
"18.753044","5.9.29.183","172.19.0.3","TCP","1492","9002 → 43520 [PSH, ACK] Seq=646092 Ack=31951 Win=65535 Len=1436 [TCP segment of a reassembled PDU]"
"18.753072","5.9.29.183","172.19.0.3","TLSv1.2","1504","Application Data [TCP segment of a reassembled PDU]"
"18.753206","172.19.0.3","5.9.29.183","TCP","56","43520 → 9002 [ACK] Seq=31951 Ack=648976 Win=11895 Len=0"
"18.753209","5.9.29.183","172.19.0.3","TCP","1516","9002 → 43520 [PSH, ACK] Seq=648976 Ack=31951 Win=65535 Len=1460 [TCP segment of a reassembled PDU]"
"18.753280","5.9.29.183","172.19.0.3","TCP","1516","9002 → 43520 [PSH, ACK] Seq=650436 Ack=31951 Win=65535 Len=1460 [TCP segment of a reassembled PDU]"
"18.753284","5.9.29.183","172.19.0.3","TLSv1.2","1516","Application Data [TCP segment of a reassembled PDU]"
"18.753286","5.9.29.183","172.19.0.3","TCP","1468","9002 → 43520 [PSH, ACK] Seq=653356 Ack=31951 Win=65535 Len=1412 [TCP segment of a reassembled PDU]"
"18.753385","172.19.0.3","5.9.29.183","TCP","56","43520 → 9002 [ACK] Seq=31951 Ack=654768 Win=11861 Len=0"
"18.753664","172.19.0.3","5.9.29.183","TLSv1.2","1113","Application Data"
"18.753854","5.9.29.183","172.19.0.3","TCP","56","9002 → 43520 [ACK] Seq=654768 Ack=33008 Win=65535 Len=0"
"18.759196","5.9.29.183","172.19.0.3","TLSv1.2","287","Application Data"
"18.779169","5.9.29.183","172.19.0.3","TCP","1504","[TCP segment of a reassembled PDU]"
"18.779186","172.19.0.3","5.9.29.183","TCP","56","43520 → 9002 [ACK] Seq=33008 Ack=656447 Win=11911 Len=0"
"18.779422","5.9.29.183","172.19.0.3","TCP","1504","9002 → 43520 [PSH, ACK] Seq=656447 Ack=33008 Win=65535 Len=1448 [TCP segment of a reassembled PDU]"
"18.779564","5.9.29.183","172.19.0.3","TLSv1.2","1237","Application Data"
"18.779572","172.19.0.3","5.9.29.183","TCP","56","43520 → 9002 [ACK] Seq=33008 Ack=659076 Win=11911 Len=0"
"18.780316","172.19.0.3","5.9.29.183","TLSv1.2","599","Application Data"
"18.780477","5.9.29.183","172.19.0.3","TCP","56","9002 → 43520 [ACK] Seq=659076 Ack=33551 Win=65535 Len=0"
"18.795115","5.9.29.183","172.19.0.3","TLSv1.2","149","Application Data"
"18.837762","172.19.0.3","5.9.29.183","TCP","56","43520 → 9002 [ACK] Seq=33551 Ack=659169 Win=11911 Len=0"
