_ws.col.Time,_ws.col.Source,_ws.col.Destination,_ws.col.Protocol,_ws.col.Length,_ws.col.Info
"0.000000","172.19.0.3","5.9.29.183","TLSv1.2","599","Application Data"
"0.000344","5.9.29.183","172.19.0.3","TCP","56","9002 → 43520 [ACK] Seq=1 Ack=544 Win=65535 Len=0"
"0.614439","5.9.29.183","172.19.0.3","TLSv1.2","599","Application Data"
"0.614487","172.19.0.3","5.9.29.183","TCP","56","43520 → 9002 [ACK] Seq=544 Ack=544 Win=11911 Len=0"
"0.615051","172.19.0.3","5.9.29.183","TLSv1.2","2141","Application Data"
"0.615267","5.9.29.183","172.19.0.3","TCP","56","9002 → 43520 [ACK] Seq=544 Ack=2629 Win=65535 Len=0"
"1.714698","5.9.29.183","172.19.0.3","TLSv1.2","599","Application Data"
"1.729774","5.9.29.183","172.19.0.3","TLSv1.2","1113","Application Data"
"1.729795","172.19.0.3","5.9.29.183","TCP","56","43520 → 9002 [ACK] Seq=2629 Ack=2144 Win=11911 Len=0"
"1.733703","172.19.0.3","5.9.29.183","TLSv1.2","599","Application Data"
"1.733986","5.9.29.183","172.19.0.3","TCP","56","9002 → 43520 [ACK] Seq=2144 Ack=3172 Win=65535 Len=0"
"2.385230","5.9.29.183","172.19.0.3","TLSv1.2","599","Application Data"
"2.385839","172.19.0.3","5.9.29.183","TLSv1.2","599","Application Data"
"2.386078","5.9.29.183","172.19.0.3","TCP","56","9002 → 43520 [ACK] Seq=2687 Ack=3715 Win=65535 Len=0"
"2.926653","5.9.29.183","172.19.0.3","TCP","1516","[TCP segment of a reassembled PDU]"
"2.926755","5.9.29.183","172.19.0.3","TCP","1516","9002 → 43520 [PSH, ACK] Seq=4147 Ack=3715 Win=65535 Len=1460 [TCP segment of a reassembled PDU]"
"2.926769","5.9.29.183","172.19.0.3","TLSv1.2","763","Application Data"
"2.926908","172.19.0.3","5.9.29.183","TCP","56","43520 → 9002 [ACK] Seq=3715 Ack=6314 Win=11895 Len=0"
"2.960767","5.9.29.183","172.19.0.3","TLSv1.2","599","Application Data"
"2.980369","5.9.29.183","172.19.0.3","TCP","1516","[TCP segment of a reassembled PDU]"
"2.980442","172.19.0.3","5.9.29.183","TCP","56","43520 → 9002 [ACK] Seq=3715 Ack=8317 Win=11909 Len=0"
"2.980507","5.9.29.183","172.19.0.3","TCP","1492","9002 → 43520 [PSH, ACK] Seq=8317 Ack=3715 Win=65535 Len=1436 [TCP segment of a reassembled PDU]"
"2.980522","5.9.29.183","172.19.0.3","TLSv1.2","787","Application Data"
"2.980626","172.19.0.3","5.9.29.183","TCP","56","43520 → 9002 [ACK] Seq=3715 Ack=10484 Win=11893 Len=0"
"2.997524","5.9.29.183","172.19.0.3","TLSv1.2","599","Application Data"
"3.032376","5.9.29.183","172.19.0.3","TCP","1504","[TCP segment of a reassembled PDU]"
"3.032395","172.19.0.3","5.9.29.183","TCP","56","43520 → 9002 [ACK] Seq=3715 Ack=12475 Win=11911 Len=0"
"3.032432","5.9.29.183","172.19.0.3","TCP","1516","9002 → 43520 [PSH, ACK] Seq=12475 Ack=3715 Win=65535 Len=1460 [TCP segment of a reassembled PDU]"
"3.032469","5.9.29.183","172.19.0.3","TLSv1.2","775","Application Data"
"3.032601","172.19.0.3","5.9.29.183","TCP","56","43520 → 9002 [ACK] Seq=3715 Ack=14654 Win=11895 Len=0"
"3.050866","5.9.29.183","172.19.0.3","TCP","1516","[TCP segment of a reassembled PDU]"
"3.050920","5.9.29.183","172.19.0.3","TCP","1492","9002 → 43520 [PSH, ACK] Seq=16114 Ack=3715 Win=65535 Len=1436 [TCP segment of a reassembled PDU]"
"3.050936","172.19.0.3","5.9.29.183","TCP","56","43520 → 9002 [ACK] Seq=3715 Ack=17550 Win=11903 Len=0"
"3.050939","5.9.29.183","172.19.0.3","TLSv1.2","787","Application Data"
"3.068439","5.9.29.183","172.19.0.3","TLSv1.2","599","Application Data"
"3.068628","172.19.0.3","5.9.29.183","TCP","56","43520 → 9002 [ACK] Seq=3715 Ack=18824 Win=11911 Len=0"
"3.087316","5.9.29.183","172.19.0.3","TCP","1516","[TCP segment of a reassembled PDU]"
"3.087386","5.9.29.183","172.19.0.3","TCP","1492","9002 → 43520 [PSH, ACK] Seq=20284 Ack=3715 Win=65535 Len=1436 [TCP segment of a reassembled PDU]"
"3.087532","172.19.0.3","5.9.29.183","TCP","56","43520 → 9002 [ACK] Seq=3715 Ack=21720 Win=11903 Len=0"
"3.088118","5.9.29.183","172.19.0.3","TLSv1.2","273","Application Data"
"3.091837","172.19.0.3","5.9.29.183","TLSv1.2","599","Application Data"
"3.092078","5.9.29.183","172.19.0.3","TCP","56","9002 → 43520 [ACK] Seq=21937 Ack=4258 Win=65535 Len=0"
"3.688580","5.9.29.183","172.19.0.3","TLSv1.2","599","Application Data"
"3.689340","172.19.0.3","5.9.29.183","TLSv1.2","599","Application Data"
"3.689651","5.9.29.183","172.19.0.3","TCP","56","9002 → 43520 [ACK] Seq=22480 Ack=4801 Win=65535 Len=0"
"4.236197","5.9.29.183","172.19.0.3","TLSv1.2","599","Application Data"
"4.273960","5.9.29.183","172.19.0.3","TCP","1516","[TCP segment of a reassembled PDU]"
"4.273977","172.19.0.3","5.9.29.183","TCP","56","43520 → 9002 [ACK] Seq=4801 Ack=24483 Win=11909 Len=0"
"4.274014","5.9.29.183","172.19.0.3","TCP","1516","9002 → 43520 [PSH, ACK] Seq=24483 Ack=4801 Win=65535 Len=1460 [TCP segment of a reassembled PDU]"
"4.274032","5.9.29.183","172.19.0.3","TLSv1.2","763","Application Data"
"4.274195","172.19.0.3","5.9.29.183","TCP","56","43520 → 9002 [ACK] Seq=4801 Ack=26650 Win=11893 Len=0"
"4.309400","5.9.29.183","172.19.0.3","TCP","1516","[TCP segment of a reassembled PDU]"
"4.309482","5.9.29.183","172.19.0.3","TCP","1492","9002 → 43520 [PSH, ACK] Seq=28110 Ack=4801 Win=65535 Len=1436 [TCP segment of a reassembled PDU]"
"4.309498","172.19.0.3","5.9.29.183","TCP","56","43520 → 9002 [ACK] Seq=4801 Ack=29546 Win=11903 Len=0"
"4.309556","5.9.29.183","172.19.0.3","TLSv1.2","787","Application Data"
"4.326155","5.9.29.183","172.19.0.3","TLSv1.2","599","Application Data"
"4.326386","172.19.0.3","5.9.29.183","TCP","56","43520 → 9002 [ACK] Seq=4801 Ack=30820 Win=11911 Len=0"
"4.359319","5.9.29.183","172.19.0.3","TCP","1504","[TCP segment of a reassembled PDU]"
"4.359371","5.9.29.183","172.19.0.3","TCP","1516","9002 → 43520 [PSH, ACK] Seq=32268 Ack=4801 Win=65535 Len=1460 [TCP segment of a reassembled PDU]"
"4.359529","172.19.0.3","5.9.29.183","TCP","56","43520 → 9002 [ACK] Seq=4801 Ack=33728 Win=11903 Len=0"
"4.359532","5.9.29.183","172.19.0.3","TLSv1.2","775","Application Data"
"4.371749","5.9.29.183","172.19.0.3","TCP","1504","[TCP segment of a reassembled PDU]"
"4.371769","172.19.0.3","5.9.29.183","TCP","56","43520 → 9002 [ACK] Seq=4801 Ack=35895 Win=11911 Len=0"
"4.371805","5.9.29.183","172.19.0.3","TCP","1516","9002 → 43520 [PSH, ACK] Seq=35895 Ack=4801 Win=65535 Len=1460 [TCP segment of a reassembled PDU]"
"4.371890","5.9.29.183","172.19.0.3","TLSv1.2","1516","Application Data [TCP segment of a reassembled PDU]"
"4.371897","5.9.29.183","172.19.0.3","TCP","1516","9002 → 43520 [PSH, ACK] Seq=38815 Ack=4801 Win=65535 Len=1460 [TCP segment of a reassembled PDU]"
"4.371903","5.9.29.183","172.19.0.3","TCP","1468","9002 → 43520 [PSH, ACK] Seq=40275 Ack=4801 Win=65535 Len=1412 [TCP segment of a reassembled PDU]"
"4.371968","172.19.0.3","5.9.29.183","TCP","56","43520 → 9002 [ACK] Seq=4801 Ack=41687 Win=11879 Len=0"
"4.372156","172.19.0.3","5.9.29.183","TLSv1.2","599","Application Data"
"4.372327","5.9.29.183","172.19.0.3","TCP","56","9002 → 43520 [ACK] Seq=41687 Ack=5344 Win=65535 Len=0"
"4.375477","5.9.29.183","172.19.0.3","TLSv1.2","1127","Application Data, Application Data"
"4.390290","5.9.29.183","172.19.0.3","TCP","1516","[TCP segment of a reassembled PDU]"
"4.390307","172.19.0.3","5.9.29.183","TCP","56","43520 → 9002 [ACK] Seq=5344 Ack=44218 Win=11911 Len=0"
"4.390346","5.9.29.183","172.19.0.3","TCP","1516","9002 → 43520 [PSH, ACK] Seq=44218 Ack=5344 Win=65535 Len=1460 [TCP segment of a reassembled PDU]"
"4.390375","5.9.29.183","172.19.0.3","TLSv1.2","1480","Application Data [TCP segment of a reassembled PDU]"
"4.390453","5.9.29.183","172.19.0.3","TLSv1.2","396","Application Data"
"4.390493","172.19.0.3","5.9.29.183","TCP","56","43520 → 9002 [ACK] Seq=5344 Ack=47442 Win=11887 Len=0"
"4.408731","5.9.29.183","172.19.0.3","TCP","1516","[TCP segment of a reassembled PDU]"
"4.408784","5.9.29.183","172.19.0.3","TCP","946","9002 → 43520 [PSH, ACK] Seq=48902 Ack=5344 Win=65535 Len=890 [TCP segment of a reassembled PDU]"
"4.408797","172.19.0.3","5.9.29.183","TCP","56","43520 → 9002 [ACK] Seq=5344 Ack=49792 Win=11901 Len=0"
"4.408799","5.9.29.183","172.19.0.3","TCP","602","9002 → 43520 [PSH, ACK] Seq=49792 Ack=5344 Win=65535 Len=546 [TCP segment of a reassembled PDU]"
"4.409290","5.9.29.183","172.19.0.3","TLSv1.2","1237","Application Data"
"4.409301","172.19.0.3","5.9.29.183","TCP","56","43520 → 9002 [ACK] Seq=5344 Ack=51519 Win=11911 Len=0"
"4.409331","5.9.29.183","172.19.0.3","TCP","1504","[TCP segment of a reassembled PDU]"
"4.409391","5.9.29.183","172.19.0.3","TCP","1504","9002 → 43520 [PSH, ACK] Seq=52967 Ack=5344 Win=65535 Len=1448 [TCP segment of a reassembled PDU]"
"4.409530","172.19.0.3","5.9.29.183","TLSv1.2","599","Application Data"
"4.409698","5.9.29.183","172.19.0.3","TCP","56","9002 → 43520 [ACK] Seq=54415 Ack=5887 Win=65535 Len=0"
"4.424905","5.9.29.183","172.19.0.3","TLSv1.2","851","Application Data"
"4.431990","5.9.29.183","172.19.0.3","TCP","1516","[TCP segment of a reassembled PDU]"
"4.432009","172.19.0.3","5.9.29.183","TCP","56","43520 → 9002 [ACK] Seq=5887 Ack=56670 Win=11911 Len=0"
"4.432050","5.9.29.183","172.19.0.3","TCP","1492","9002 → 43520 [PSH, ACK] Seq=56670 Ack=5887 Win=65535 Len=1436 [TCP segment of a reassembled PDU]"
"4.440437","5.9.29.183","172.19.0.3","TLSv1.2","787","Application Data"
"4.440455","172.19.0.3","5.9.29.183","TCP","56","43520 → 9002 [ACK] Seq=5887 Ack=58837 Win=11911 Len=0"
"4.450059","5.9.29.183","172.19.0.3","TCP","1504","[TCP segment of a reassembled PDU]"
"4.455434","5.9.29.183","172.19.0.3","TLSv1.2","693","Application Data"
"4.455446","172.19.0.3","5.9.29.183","TCP","56","43520 → 9002 [ACK] Seq=5887 Ack=60922 Win=11911 Len=0"
"4.467078","5.9.29.183","172.19.0.3","TCP","1504","[TCP segment of a reassembled PDU]"
"4.467196","5.9.29.183","172.19.0.3","TCP","1504","9002 → 43520 [PSH, ACK] Seq=62370 Ack=5887 Win=65535 Len=1448 [TCP segment of a reassembled PDU]"
"4.467350","172.19.0.3","5.9.29.183","TCP","56","43520 → 9002 [ACK] Seq=5887 Ack=63818 Win=11903 Len=0"
"4.470432","5.9.29.183","172.19.0.3","TLSv1.2","787","Application Data"
"4.511433","172.19.0.3","5.9.29.183","TCP","56","43520 → 9002 [ACK] Seq=5887 Ack=64549 Win=11911 Len=0"
"4.536695","5.9.29.183","172.19.0.3","TLSv1.2","1113","Application Data"
"4.536948","172.19.0.3","5.9.29.183","TCP","56","43520 → 9002 [ACK] Seq=5887 Ack=65606 Win=11911 Len=0"
"4.549805","5.9.29.183","172.19.0.3","TCP","1504","[TCP segment of a reassembled PDU]"
"4.549942","5.9.29.183","172.19.0.3","TCP","1504","9002 → 43520 [PSH, ACK] Seq=67054 Ack=5887 Win=65535 Len=1448 [TCP segment of a reassembled PDU]"
"4.550022","5.9.29.183","172.19.0.3","TLSv1.2","1516","Application Data [TCP segment of a reassembled PDU]"
"4.550029","5.9.29.183","172.19.0.3","TCP","1516","9002 → 43520 [PSH, ACK] Seq=69962 Ack=5887 Win=65535 Len=1460 [TCP segment of a reassembled PDU]"
"4.550052","172.19.0.3","5.9.29.183","TCP","56","43520 → 9002 [ACK] Seq=5887 Ack=69962 Win=11895 Len=0"
"4.550111","5.9.29.183","172.19.0.3","TCP","1480","9002 → 43520 [PSH, ACK] Seq=71422 Ack=5887 Win=65535 Len=1424 [TCP segment of a reassembled PDU]"
"4.550142","172.19.0.3","5.9.29.183","TCP","56","43520 → 9002 [ACK] Seq=5887 Ack=72846 Win=11877 Len=0"
"4.551819","5.9.29.183","172.19.0.3","TLSv1.2","1127","Application Data, Application Data"
"4.552088","172.19.0.3","5.9.29.183","TCP","56","43520 → 9002 [ACK] Seq=5887 Ack=73917 Win=11911 Len=0"
"4.568061","5.9.29.183","172.19.0.3","TCP","1516","[TCP segment of a reassembled PDU]"
"4.568113","5.9.29.183","172.19.0.3","TCP","1492","9002 → 43520 [PSH, ACK] Seq=75377 Ack=5887 Win=65535 Len=1436 [TCP segment of a reassembled PDU]"
"4.568257","172.19.0.3","5.9.29.183","TCP","56","43520 → 9002 [ACK] Seq=5887 Ack=76813 Win=11903 Len=0"
"4.569080","5.9.29.183","172.19.0.3","TLSv1.2","1237","Application Data"
"4.569234","172.19.0.3","5.9.29.183","TCP","56","43520 → 9002 [ACK] Seq=5887 Ack=77994 Win=11911 Len=0"
"4.569272","5.9.29.183","172.19.0.3","TCP","1516","[TCP segment of a reassembled PDU]"
"4.569466","5.9.29.183","172.19.0.3","TCP","1516","9002 → 43520 [PSH, ACK] Seq=79454 Ack=5887 Win=65535 Len=1460 [TCP segment of a reassembled PDU]"
"4.569520","5.9.29.183","172.19.0.3","TLSv1.2","1480","Application Data [TCP segment of a reassembled PDU]"
"4.569540","5.9.29.183","172.19.0.3","TCP","1504","9002 → 43520 [PSH, ACK] Seq=82338 Ack=5887 Win=65535 Len=1448 [TCP segment of a reassembled PDU]"
"4.569672","172.19.0.3","5.9.29.183","TLSv1.2","599","Application Data"
"4.569957","5.9.29.183","172.19.0.3","TCP","56","9002 → 43520 [ACK] Seq=83786 Ack=6430 Win=65535 Len=0"
"4.573573","5.9.29.183","172.19.0.3","TLSv1.2","1504","Application Data [TCP segment of a reassembled PDU]"
"4.574218","5.9.29.183","172.19.0.3","TCP","1504","9002 → 43520 [PSH, ACK] Seq=85234 Ack=6430 Win=65535 Len=1448 [TCP segment of a reassembled PDU]"
"4.574231","172.19.0.3","5.9.29.183","TCP","56","43520 → 9002 [ACK] Seq=6430 Ack=86682 Win=11911 Len=0"
"4.584805","5.9.29.183","172.19.0.3","TLSv1.2","1504","Application Data [TCP segment of a reassembled PDU]"
"4.585197","5.9.29.183","172.19.0.3","TCP","1516","9002 → 43520 [PSH, ACK] Seq=88130 Ack=6430 Win=65535 Len=1460 [TCP segment of a reassembled PDU]"
"4.585236","172.19.0.3","5.9.29.183","TCP","56","43520 → 9002 [ACK] Seq=6430 Ack=89590 Win=11911 Len=0"
"4.585283","5.9.29.183","172.19.0.3","TCP","1492","9002 → 43520 [PSH, ACK] Seq=89590 Ack=6430 Win=65535 Len=1436 [TCP segment of a reassembled PDU]"
"4.585359","5.9.29.183","172.19.0.3","TLSv1.2","1504","Application Data [TCP segment of a reassembled PDU]"
"4.585365","172.19.0.3","5.9.29.183","TCP","56","43520 → 9002 [ACK] Seq=6430 Ack=92474 Win=11911 Len=0"
"4.585392","5.9.29.183","172.19.0.3","TLSv1.2","177","Application Data"
"4.585579","172.19.0.3","5.9.29.183","TLSv1.2","599","Application Data"
"4.586501","5.9.29.183","172.19.0.3","TCP","56","9002 → 43520 [ACK] Seq=92595 Ack=6973 Win=65535 Len=0"
"4.591391","5.9.29.183","172.19.0.3","TCP","1504","[TCP segment of a reassembled PDU]"
"4.591792","5.9.29.183","172.19.0.3","TCP","1504","9002 → 43520 [PSH, ACK] Seq=94043 Ack=6973 Win=65535 Len=1448 [TCP segment of a reassembled PDU]"
"4.591806","172.19.0.3","5.9.29.183","TCP","56","43520 → 9002 [ACK] Seq=6973 Ack=95491 Win=11911 Len=0"
"4.601355","5.9.29.183","172.19.0.3","TLSv1.2","273","Application Data"
"4.603568","5.9.29.183","172.19.0.3","TCP","1504","[TCP segment of a reassembled PDU]"
"4.603632","5.9.29.183","172.19.0.3","TCP","1516","9002 → 43520 [PSH, ACK] Seq=97156 Ack=6973 Win=65535 Len=1460 [TCP segment of a reassembled PDU]"
"4.603640","5.9.29.183","172.19.0.3","TLSv1.2","1492","Application Data [TCP segment of a reassembled PDU]"
"4.603786","172.19.0.3","5.9.29.183","TCP","56","43520 → 9002 [ACK] Seq=6973 Ack=100052 Win=11893 Len=0"
"4.616562","5.9.29.183","172.19.0.3","TLSv1.2","396","Application Data"
"4.616859","172.19.0.3","5.9.29.183","TLSv1.2","599","Application Data"
"4.617124","5.9.29.183","172.19.0.3","TCP","56","9002 → 43520 [ACK] Seq=100392 Ack=7516 Win=65535 Len=0"
"4.627007","5.9.29.183","172.19.0.3","TCP","1504","[TCP segment of a reassembled PDU]"
"4.634337","5.9.29.183","172.19.0.3","TLSv1.2","179","Application Data"
"4.634357","172.19.0.3","5.9.29.183","TCP","56","43520 → 9002 [ACK] Seq=7516 Ack=101963 Win=11911 Len=0"
"4.647629","5.9.29.183","172.19.0.3","TCP","1504","[TCP segment of a reassembled PDU]"
"4.650084","5.9.29.183","172.19.0.3","TLSv1.2","693","Application Data"
"4.650130","172.19.0.3","5.9.29.183","TCP","56","43520 → 9002 [ACK] Seq=7516 Ack=104048 Win=11911 Len=0"
"4.656325","172.19.0.3","5.9.29.183","TLSv1.2","599","Application Data"
"4.656645","5.9.29.183","172.19.0.3","TCP","56","9002 → 43520 [ACK] Seq=104048 Ack=8059 Win=65535 Len=0"
"5.402630","02:42:7b:11:31:3d","","ARP","44","Who has 172.19.0.3? Tell 172.19.0.1"
"5.402641","02:42:ac:13:00:03","","ARP","44","172.19.0.3 is at 02:42:ac:13:00:03"
"5.534366","5.9.29.183","172.19.0.3","TLSv1.2","599","Application Data"
"5.534921","172.19.0.3","5.9.29.183","TLSv1.2","599","Application Data"
"5.535141","5.9.29.183","172.19.0.3","TCP","56","9002 → 43520 [ACK] Seq=104591 Ack=8602 Win=65535 Len=0"
"5.993534","5.9.29.183","172.19.0.3","TCP","1516","[TCP segment of a reassembled PDU]"
"5.993771","5.9.29.183","172.19.0.3","TCP","1492","9002 → 43520 [PSH, ACK] Seq=106051 Ack=8602 Win=65535 Len=1436 [TCP segment of a reassembled PDU]"
"5.993776","5.9.29.183","172.19.0.3","TLSv1.2","787","Application Data"
"5.993861","172.19.0.3","5.9.29.183","TCP","56","43520 → 9002 [ACK] Seq=8602 Ack=108218 Win=11911 Len=0"
"6.063984","5.9.29.183","172.19.0.3","TCP","1516","[TCP segment of a reassembled PDU]"
"6.064044","5.9.29.183","172.19.0.3","TCP","1492","9002 → 43520 [PSH, ACK] Seq=109678 Ack=8602 Win=65535 Len=1436 [TCP segment of a reassembled PDU]"
"6.064293","172.19.0.3","5.9.29.183","TCP","56","43520 → 9002 [ACK] Seq=8602 Ack=111114 Win=11903 Len=0"
"6.064831","5.9.29.183","172.19.0.3","TLSv1.2","787","Application Data"
"6.093316","5.9.29.183","172.19.0.3","TCP","1516","[TCP segment of a reassembled PDU]"
"6.093337","172.19.0.3","5.9.29.183","TCP","56","43520 → 9002 [ACK] Seq=8602 Ack=113305 Win=11911 Len=0"
"6.093386","5.9.29.183","172.19.0.3","TCP","1492","9002 → 43520 [PSH, ACK] Seq=113305 Ack=8602 Win=65535 Len=1436 [TCP segment of a reassembled PDU]"
"6.093750","5.9.29.183","172.19.0.3","TCP","643","9002 → 43520 [PSH, ACK] Seq=114741 Ack=8602 Win=65535 Len=587 [TCP segment of a reassembled PDU]"
"6.093758","172.19.0.3","5.9.29.183","TCP","56","43520 → 9002 [ACK] Seq=8602 Ack=115328 Win=11911 Len=0"
"6.093903","5.9.29.183","172.19.0.3","TLSv1.2","1516","Application Data [TCP segment of a reassembled PDU]"
"6.093912","5.9.29.183","172.19.0.3","TCP","1516","9002 → 43520 [PSH, ACK] Seq=116788 Ack=8602 Win=65535 Len=1460 [TCP segment of a reassembled PDU]"
"6.093916","5.9.29.183","172.19.0.3","TCP","626","9002 → 43520 [PSH, ACK] Seq=118248 Ack=8602 Win=65535 Len=570 [TCP segment of a reassembled PDU]"
"6.093971","172.19.0.3","5.9.29.183","TCP","56","43520 → 9002 [ACK] Seq=8602 Ack=118818 Win=11895 Len=0"
"6.109273","5.9.29.183","172.19.0.3","TLSv1.2","337","Application Data"
"6.110687","5.9.29.183","172.19.0.3","TCP","1504","[TCP segment of a reassembled PDU]"
"6.110700","172.19.0.3","5.9.29.183","TCP","56","43520 → 9002 [ACK] Seq=8602 Ack=120547 Win=11911 Len=0"
"6.111414","5.9.29.183","172.19.0.3","TCP","1516","9002 → 43520 [PSH, ACK] Seq=120547 Ack=8602 Win=65535 Len=1460 [TCP segment of a reassembled PDU]"
"6.111427","5.9.29.183","172.19.0.3","TLSv1.2","1492","Application Data [TCP segment of a reassembled PDU]"
"6.111495","172.19.0.3","5.9.29.183","TCP","56","43520 → 9002 [ACK] Seq=8602 Ack=123443 Win=11901 Len=0"
"6.124457","5.9.29.183","172.19.0.3","TLSv1.2","396","Application Data"
"6.133594","5.9.29.183","172.19.0.3","TCP","1504","[TCP segment of a reassembled PDU]"
"6.133611","172.19.0.3","5.9.29.183","TCP","56","43520 → 9002 [ACK] Seq=8602 Ack=125231 Win=11911 Len=0"
"6.139511","5.9.29.183","172.19.0.3","TLSv1.2","179","Application Data"
"6.161478","5.9.29.183","172.19.0.3","TCP","1504","[TCP segment of a reassembled PDU]"
"6.161510","172.19.0.3","5.9.29.183","TCP","56","43520 → 9002 [ACK] Seq=8602 Ack=126802 Win=11911 Len=0"
"6.161721","5.9.29.183","172.19.0.3","TCP","1504","9002 → 43520 [PSH, ACK] Seq=126802 Ack=8602 Win=65535 Len=1448 [TCP segment of a reassembled PDU]"
"6.161845","5.9.29.183","172.19.0.3","TLSv1.2","1237","Application Data"
"6.161852","172.19.0.3","5.9.29.183","TCP","56","43520 → 9002 [ACK] Seq=8602 Ack=129431 Win=11911 Len=0"
"6.167505","5.9.29.183","172.19.0.3","TLSv1.2","1516","Application Data"
"6.167535","5.9.29.183","172.19.0.3","TCP","1492","9002 → 43520 [PSH, ACK] Seq=130891 Ack=8602 Win=65535 Len=1436 [TCP segment of a reassembled PDU]"
"6.167617","172.19.0.3","5.9.29.183","TCP","56","43520 → 9002 [ACK] Seq=8602 Ack=132327 Win=11903 Len=0"
"6.177176","5.9.29.183","172.19.0.3","TLSv1.2","880","Application Data"
"6.177453","172.19.0.3","5.9.29.183","TLSv1.2","599","Application Data"
"6.177686","5.9.29.183","172.19.0.3","TCP","56","9002 → 43520 [ACK] Seq=133151 Ack=9145 Win=65535 Len=0"
"6.179966","5.9.29.183","172.19.0.3","TCP","1504","[TCP segment of a reassembled PDU]"
"6.180255","5.9.29.183","172.19.0.3","TCP","1504","9002 → 43520 [PSH, ACK] Seq=134599 Ack=9145 Win=65535 Len=1448 [TCP segment of a reassembled PDU]"
"6.180266","172.19.0.3","5.9.29.183","TCP","56","43520 → 9002 [ACK] Seq=9145 Ack=136047 Win=11911 Len=0"
"6.180319","5.9.29.183","172.19.0.3","TLSv1.2","1516","Application Data [TCP segment of a reassembled PDU]"
"6.180369","5.9.29.183","172.19.0.3","TCP","1492","9002 → 43520 [PSH, ACK] Seq=137507 Ack=9145 Win=65535 Len=1436 [TCP segment of a reassembled PDU]"
"6.180480","172.19.0.3","5.9.29.183","TCP","56","43520 → 9002 [ACK] Seq=9145 Ack=138943 Win=11895 Len=0"
"6.193322","5.9.29.183","172.19.0.3","TLSv1.2","1004","Application Data"
"6.201813","5.9.29.183","172.19.0.3","TCP","1504","[TCP segment of a reassembled PDU]"
"6.201830","172.19.0.3","5.9.29.183","TCP","56","43520 → 9002 [ACK] Seq=9145 Ack=141339 Win=11911 Len=0"
"6.201871","5.9.29.183","172.19.0.3","TCP","1504","9002 → 43520 [PSH, ACK] Seq=141339 Ack=9145 Win=65535 Len=1448 [TCP segment of a reassembled PDU]"
"6.208669","5.9.29.183","172.19.0.3","TLSv1.2","787","Application Data"
"6.208687","172.19.0.3","5.9.29.183","TCP","56","43520 → 9002 [ACK] Seq=9145 Ack=143518 Win=11911 Len=0"
"6.209062","172.19.0.3","5.9.29.183","TLSv1.2","599","Application Data"
"6.209334","5.9.29.183","172.19.0.3","TCP","56","9002 → 43520 [ACK] Seq=143518 Ack=9688 Win=65535 Len=0"
"6.219360","5.9.29.183","172.19.0.3","TCP","1504","[TCP segment of a reassembled PDU]"
"6.223671","5.9.29.183","172.19.0.3","TLSv1.2","693","Application Data"
"6.223688","172.19.0.3","5.9.29.183","TCP","56","43520 → 9002 [ACK] Seq=9688 Ack=145603 Win=11911 Len=0"
"6.235690","5.9.29.183","172.19.0.3","TCP","1504","[TCP segment of a reassembled PDU]"
"6.236138","5.9.29.183","172.19.0.3","TCP","1504","9002 → 43520 [PSH, ACK] Seq=147051 Ack=9688 Win=65535 Len=1448 [TCP segment of a reassembled PDU]"
"6.236159","172.19.0.3","5.9.29.183","TCP","56","43520 → 9002 [ACK] Seq=9688 Ack=148499 Win=11911 Len=0"
"6.239796","5.9.29.183","172.19.0.3","TLSv1.2","787","Application Data"
"6.267879","5.9.29.183","172.19.0.3","TCP","1516","[TCP segment of a reassembled PDU]"
"6.267895","172.19.0.3","5.9.29.183","TCP","56","43520 → 9002 [ACK] Seq=9688 Ack=150690 Win=11911 Len=0"
"6.267929","5.9.29.183","172.19.0.3","TLSv1.2","681","Application Data"
"6.271371","172.19.0.3","5.9.29.183","TLSv1.2","599","Application Data"
"6.271591","5.9.29.183","172.19.0.3","TCP","56","9002 → 43520 [ACK] Seq=151315 Ack=10231 Win=65535 Len=0"
"7.048474","5.9.29.183","172.19.0.3","TLSv1.2","599","Application Data"
"7.049556","172.19.0.3","5.9.29.183","TLSv1.2","599","Application Data"
"7.049900","5.9.29.183","172.19.0.3","TCP","56","9002 → 43520 [ACK] Seq=151858 Ack=10774 Win=65535 Len=0"
"7.544000","5.9.29.183","172.19.0.3","TCP","1516","[TCP segment of a reassembled PDU]"
"7.544154","5.9.29.183","172.19.0.3","TCP","1492","9002 → 43520 [PSH, ACK] Seq=153318 Ack=10774 Win=65535 Len=1436 [TCP segment of a reassembled PDU]"
"7.544201","5.9.29.183","172.19.0.3","TLSv1.2","787","Application Data"
"7.544300","172.19.0.3","5.9.29.183","TCP","56","43520 → 9002 [ACK] Seq=10774 Ack=155485 Win=11895 Len=0"
"7.578472","5.9.29.183","172.19.0.3","TCP","1516","[TCP segment of a reassembled PDU]"
"7.578524","5.9.29.183","172.19.0.3","TCP","1492","9002 → 43520 [PSH, ACK] Seq=156945 Ack=10774 Win=65535 Len=1436 [TCP segment of a reassembled PDU]"
"7.578545","172.19.0.3","5.9.29.183","TCP","56","43520 → 9002 [ACK] Seq=10774 Ack=158381 Win=11903 Len=0"
"7.578762","5.9.29.183","172.19.0.3","TLSv1.2","787","Application Data"
"7.614310","5.9.29.183","172.19.0.3","TCP","1504","[TCP segment of a reassembled PDU]"
"7.614326","172.19.0.3","5.9.29.183","TCP","56","43520 → 9002 [ACK] Seq=10774 Ack=160560 Win=11911 Len=0"
"7.615364","5.9.29.183","172.19.0.3","TCP","1504","9002 → 43520 [PSH, ACK] Seq=160560 Ack=10774 Win=65535 Len=1448 [TCP segment of a reassembled PDU]"
"7.615373","5.9.29.183","172.19.0.3","TLSv1.2","787","Application Data"
"7.615415","172.19.0.3","5.9.29.183","TCP","56","43520 → 9002 [ACK] Seq=10774 Ack=162739 Win=11911 Len=0"
"7.627029","5.9.29.183","172.19.0.3","TCP","1516","[TCP segment of a reassembled PDU]"
"7.627102","5.9.29.183","172.19.0.3","TCP","1492","9002 → 43520 [PSH, ACK] Seq=164199 Ack=10774 Win=65535 Len=1436 [TCP segment of a reassembled PDU]"
"7.627193","172.19.0.3","5.9.29.183","TCP","56","43520 → 9002 [ACK] Seq=10774 Ack=165635 Win=11903 Len=0"
"7.631262","5.9.29.183","172.19.0.3","TLSv1.2","1516","Application Data [TCP segment of a reassembled PDU]"
"7.631286","5.9.29.183","172.19.0.3","TCP","1492","9002 → 43520 [PSH, ACK] Seq=167095 Ack=10774 Win=65535 Len=1436 [TCP segment of a reassembled PDU]"
"7.631369","172.19.0.3","5.9.29.183","TCP","56","43520 → 9002 [ACK] Seq=10774 Ack=168531 Win=11901 Len=0"
"7.631674","5.9.29.183","172.19.0.3","TCP","1504","9002 → 43520 [PSH, ACK] Seq=168531 Ack=10774 Win=65535 Len=1448 [TCP segment of a reassembled PDU]"
"7.641786","5.9.29.183","172.19.0.3","TLSv1.2","1516","Application Data [TCP segment of a reassembled PDU]"
"7.641811","172.19.0.3","5.9.29.183","TCP","56","43520 → 9002 [ACK] Seq=10774 Ack=171439 Win=11911 Len=0"
"7.641828","5.9.29.183","172.19.0.3","TLSv1.2","695","Application Data"
"7.657472","5.9.29.183","172.19.0.3","TLSv1.2","599","Application Data"
"7.657592","172.19.0.3","5.9.29.183","TCP","56","43520 → 9002 [ACK] Seq=10774 Ack=172621 Win=11911 Len=0"
"7.671679","5.9.29.183","172.19.0.3","TCP","1516","[TCP segment of a reassembled PDU]"
"7.671697","5.9.29.183","172.19.0.3","TCP","1492","9002 → 43520 [PSH, ACK] Seq=174081 Ack=10774 Win=65535 Len=1436 [TCP segment of a reassembled PDU]"
"7.671779","172.19.0.3","5.9.29.183","TCP","56","43520 → 9002 [ACK] Seq=10774 Ack=175517 Win=11903 Len=0"
"7.673223","5.9.29.183","172.19.0.3","TLSv1.2","787","Application Data"
"7.683977","5.9.29.183","172.19.0.3","TCP","1504","[TCP segment of a reassembled PDU]"
"7.683995","172.19.0.3","5.9.29.183","TCP","56","43520 → 9002 [ACK] Seq=10774 Ack=177696 Win=11911 Len=0"
"7.684412","5.9.29.183","172.19.0.3","TCP","1504","9002 → 43520 [PSH, ACK] Seq=177696 Ack=10774 Win=65535 Len=1448 [TCP segment of a reassembled PDU]"
"7.686885","5.9.29.183","172.19.0.3","TLSv1.2","1504","Application Data [TCP segment of a reassembled PDU]"
"7.686902","172.19.0.3","5.9.29.183","TCP","56","43520 → 9002 [ACK] Seq=10774 Ack=180592 Win=11911 Len=0"
"7.687166","172.19.0.3","5.9.29.183","TLSv1.2","599","Application Data"
"7.687324","5.9.29.183","172.19.0.3","TCP","56","9002 → 43520 [ACK] Seq=180592 Ack=11317 Win=65535 Len=0"
"7.688102","5.9.29.183","172.19.0.3","TCP","328","9002 → 43520 [PSH, ACK] Seq=180592 Ack=11317 Win=65535 Len=272 [TCP segment of a reassembled PDU]"
"7.688164","5.9.29.183","172.19.0.3","TCP","1232","9002 → 43520 [PSH, ACK] Seq=180864 Ack=11317 Win=65535 Len=1176 [TCP segment of a reassembled PDU]"
"7.688189","172.19.0.3","5.9.29.183","TCP","56","43520 → 9002 [ACK] Seq=11317 Ack=182040 Win=11911 Len=0"
"7.688412","5.9.29.183","172.19.0.3","TCP","1504","9002 → 43520 [PSH, ACK] Seq=182040 Ack=11317 Win=65535 Len=1448 [TCP segment of a reassembled PDU]"
"7.688518","5.9.29.183","172.19.0.3","TLSv1.2","584","Application Data"
"7.688524","172.19.0.3","5.9.29.183","TCP","56","43520 → 9002 [ACK] Seq=11317 Ack=184016 Win=11911 Len=0"
"7.707338","5.9.29.183","172.19.0.3","TCP","1516","[TCP segment of a reassembled PDU]"
"7.707360","5.9.29.183","172.19.0.3","TCP","1492","9002 → 43520 [PSH, ACK] Seq=185476 Ack=11317 Win=65535 Len=1436 [TCP segment of a reassembled PDU]"
"7.707364","5.9.29.183","172.19.0.3","TLSv1.2","273","Application Data"
"7.707452","172.19.0.3","5.9.29.183","TCP","56","43520 → 9002 [ACK] Seq=11317 Ack=187129 Win=11895 Len=0"
"7.719234","5.9.29.183","172.19.0.3","TCP","1504","[TCP segment of a reassembled PDU]"
"7.719496","5.9.29.183","172.19.0.3","TCP","1504","9002 → 43520 [PSH, ACK] Seq=188577 Ack=11317 Win=65535 Len=1448 [TCP segment of a reassembled PDU]"
"7.719506","172.19.0.3","5.9.29.183","TCP","56","43520 → 9002 [ACK] Seq=11317 Ack=190025 Win=11911 Len=0"
"7.722575","5.9.29.183","172.19.0.3","TLSv1.2","1504","Application Data [TCP segment of a reassembled PDU]"
"7.722909","5.9.29.183","172.19.0.3","TCP","1516","9002 → 43520 [PSH, ACK] Seq=191473 Ack=11317 Win=65535 Len=1460 [TCP segment of a reassembled PDU]"
"7.722916","172.19.0.3","5.9.29.183","TCP","56","43520 → 9002 [ACK] Seq=11317 Ack=192933 Win=11911 Len=0"
"7.722920","5.9.29.183","172.19.0.3","TCP","1492","9002 → 43520 [PSH, ACK] Seq=192933 Ack=11317 Win=65535 Len=1436 [TCP segment of a reassembled PDU]"
"7.722983","5.9.29.183","172.19.0.3","TLSv1.2","1504","Application Data [TCP segment of a reassembled PDU]"
"7.723025","172.19.0.3","5.9.29.183","TCP","56","43520 → 9002 [ACK] Seq=11317 Ack=195817 Win=11895 Len=0"
"7.734930","5.9.29.183","172.19.0.3","TCP","1504","9002 → 43520 [PSH, ACK] Seq=195817 Ack=11317 Win=65535 Len=1448 [TCP segment of a reassembled PDU]"
"7.734953","5.9.29.183","172.19.0.3","TLSv1.2","1315","Application Data"
"7.734963","172.19.0.3","5.9.29.183","TCP","56","43520 → 9002 [ACK] Seq=11317 Ack=198524 Win=11903 Len=0"
"7.735272","172.19.0.3","5.9.29.183","TLSv1.2","599","Application Data"
"7.735515","5.9.29.183","172.19.0.3","TCP","56","9002 → 43520 [ACK] Seq=198524 Ack=11860 Win=65535 Len=0"
"7.738916","5.9.29.183","172.19.0.3","TCP","1516","[TCP segment of a reassembled PDU]"
"7.738933","5.9.29.183","172.19.0.3","TCP","1492","9002 → 43520 [PSH, ACK] Seq=199984 Ack=11860 Win=65535 Len=1436 [TCP segment of a reassembled PDU]"
"7.739006","172.19.0.3","5.9.29.183","TCP","56","43520 → 9002 [ACK] Seq=11860 Ack=201420 Win=11903 Len=0"
"7.750903","5.9.29.183","172.19.0.3","TLSv1.2","1516","Application Data [TCP segment of a reassembled PDU]"
"7.750926","5.9.29.183","172.19.0.3","TCP","1492","9002 → 43520 [PSH, ACK] Seq=202880 Ack=11860 Win=65535 Len=1436 [TCP segment of a reassembled PDU]"
"7.750936","172.19.0.3","5.9.29.183","TCP","56","43520 → 9002 [ACK] Seq=11860 Ack=204316 Win=11903 Len=0"
"7.751328","5.9.29.183","172.19.0.3","TCP","1516","9002 → 43520 [PSH, ACK] Seq=204316 Ack=11860 Win=65535 Len=1460 [TCP segment of a reassembled PDU]"
"7.751335","5.9.29.183","172.19.0.3","TLSv1.2","1115","Application Data, Application Data"
"7.751340","172.19.0.3","5.9.29.183","TCP","56","43520 → 9002 [ACK] Seq=11860 Ack=206835 Win=11903 Len=0"
"7.751532","172.19.0.3","5.9.29.183","TLSv1.2","599","Application Data"
"7.751676","5.9.29.183","172.19.0.3","TCP","56","9002 → 43520 [ACK] Seq=206835 Ack=12403 Win=65535 Len=0"
"7.764370","5.9.29.183","172.19.0.3","TCP","1504","[TCP segment of a reassembled PDU]"
"7.767016","5.9.29.183","172.19.0.3","TLSv1.2","1207","Application Data"
"7.767033","172.19.0.3","5.9.29.183","TCP","56","43520 → 9002 [ACK] Seq=12403 Ack=209434 Win=11911 Len=0"
"7.801614","5.9.29.183","172.19.0.3","TLSv1.2","1113","Application Data"
"7.805818","172.19.0.3","5.9.29.183","TLSv1.2","599","Application Data"
"7.806168","5.9.29.183","172.19.0.3","TCP","56","9002 → 43520 [ACK] Seq=210491 Ack=12946 Win=65535 Len=0"
"8.344133","5.9.29.183","172.19.0.3","TLSv1.2","599","Application Data"
"8.344603","172.19.0.3","5.9.29.183","TLSv1.2","599","Application Data"
"8.344921","5.9.29.183","172.19.0.3","TCP","56","9002 → 43520 [ACK] Seq=211034 Ack=13489 Win=65535 Len=0"
"8.845892","5.9.29.183","172.19.0.3","TLSv1.2","599","Application Data"
"8.887294","5.9.29.183","172.19.0.3","TCP","1504","[TCP segment of a reassembled PDU]"
"8.887313","172.19.0.3","5.9.29.183","TCP","56","43520 → 9002 [ACK] Seq=13489 Ack=213025 Win=11911 Len=0"
"8.887325","5.9.29.183","172.19.0.3","TCP","1516","9002 → 43520 [PSH, ACK] Seq=213025 Ack=13489 Win=65535 Len=1460 [TCP segment of a reassembled PDU]"
"8.887334","5.9.29.183","172.19.0.3","TLSv1.2","775","Application Data"
"8.887508","172.19.0.3","5.9.29.183","TCP","56","43520 → 9002 [ACK] Seq=13489 Ack=215204 Win=11895 Len=0"
"8.910058","5.9.29.183","172.19.0.3","TCP","1504","[TCP segment of a reassembled PDU]"
"8.910160","5.9.29.183","172.19.0.3","TCP","1504","9002 → 43520 [PSH, ACK] Seq=216652 Ack=13489 Win=65535 Len=1448 [TCP segment of a reassembled PDU]"
"8.910173","172.19.0.3","5.9.29.183","TCP","56","43520 → 9002 [ACK] Seq=13489 Ack=218100 Win=11901 Len=0"
"8.910176","5.9.29.183","172.19.0.3","TLSv1.2","787","Application Data"
"8.944632","5.9.29.183","172.19.0.3","TCP","1516","[TCP segment of a reassembled PDU]"
"8.944652","172.19.0.3","5.9.29.183","TCP","56","43520 → 9002 [ACK] Seq=13489 Ack=220291 Win=11911 Len=0"
"8.944700","5.9.29.183","172.19.0.3","TCP","1492","9002 → 43520 [PSH, ACK] Seq=220291 Ack=13489 Win=65535 Len=1436 [TCP segment of a reassembled PDU]"
"8.945243","5.9.29.183","172.19.0.3","TLSv1.2","1237","Application Data"
"8.945253","172.19.0.3","5.9.29.183","TCP","56","43520 → 9002 [ACK] Seq=13489 Ack=222908 Win=11911 Len=0"
"8.959440","5.9.29.183","172.19.0.3","TLSv1.2","1504","Application Data"
"8.959692","5.9.29.183","172.19.0.3","TCP","1504","9002 → 43520 [PSH, ACK] Seq=224356 Ack=13489 Win=65535 Len=1448 [TCP segment of a reassembled PDU]"
"8.959703","5.9.29.183","172.19.0.3","TLSv1.2","1516","Application Data [TCP segment of a reassembled PDU]"
"8.959706","5.9.29.183","172.19.0.3","TCP","1492","9002 → 43520 [PSH, ACK] Seq=227264 Ack=13489 Win=65535 Len=1436 [TCP segment of a reassembled PDU]"
"8.959727","172.19.0.3","5.9.29.183","TCP","56","43520 → 9002 [ACK] Seq=13489 Ack=225804 Win=11903 Len=0"
"8.959808","172.19.0.3","5.9.29.183","TCP","56","43520 → 9002 [ACK] Seq=13489 Ack=228700 Win=11887 Len=0"
"8.959887","5.9.29.183","172.19.0.3","TCP","1504","9002 → 43520 [PSH, ACK] Seq=228700 Ack=13489 Win=65535 Len=1448 [TCP segment of a reassembled PDU]"
"8.961189","5.9.29.183","172.19.0.3","TLSv1.2","1220","Application Data, Application Data"
"8.961201","172.19.0.3","5.9.29.183","TCP","56","43520 → 9002 [ACK] Seq=13489 Ack=231312 Win=11911 Len=0"
"8.976753","5.9.29.183","172.19.0.3","TCP","1516","[TCP segment of a reassembled PDU]"
"8.976812","5.9.29.183","172.19.0.3","TCP","1492","9002 → 43520 [PSH, ACK] Seq=232772 Ack=13489 Win=65535 Len=1436 [TCP segment of a reassembled PDU]"
"8.976819","5.9.29.183","172.19.0.3","TLSv1.2","1516","Application Data [TCP segment of a reassembled PDU]"
"8.976822","5.9.29.183","172.19.0.3","TCP","1492","9002 → 43520 [PSH, ACK] Seq=235668 Ack=13489 Win=65535 Len=1436 [TCP segment of a reassembled PDU]"
"8.976964","172.19.0.3","5.9.29.183","TCP","56","43520 → 9002 [ACK] Seq=13489 Ack=237104 Win=11887 Len=0"
"8.977868","5.9.29.183","172.19.0.3","TCP","1516","9002 → 43520 [PSH, ACK] Seq=237104 Ack=13489 Win=65535 Len=1460 [TCP segment of a reassembled PDU]"
"8.977905","5.9.29.183","172.19.0.3","TLSv1.2","58","Application Data"
"8.977916","172.19.0.3","5.9.29.183","TCP","56","43520 → 9002 [ACK] Seq=13489 Ack=238566 Win=11909 Len=0"
"8.978165","172.19.0.3","5.9.29.183","TLSv1.2","599","Application Data"
"8.978347","5.9.29.183","172.19.0.3","TCP","56","9002 → 43520 [ACK] Seq=238566 Ack=14032 Win=65535 Len=0"
"8.999003","5.9.29.183","172.19.0.3","TCP","1504","[TCP segment of a reassembled PDU]"
"8.999125","5.9.29.183","172.19.0.3","TCP","1504","9002 → 43520 [PSH, ACK] Seq=240014 Ack=14032 Win=65535 Len=1448 [TCP segment of a reassembled PDU]"
"8.999203","5.9.29.183","172.19.0.3","TLSv1.2","787","Application Data"
"8.999231","172.19.0.3","5.9.29.183","TCP","56","43520 → 9002 [ACK] Seq=14032 Ack=242193 Win=11893 Len=0"
"9.017052","5.9.29.183","172.19.0.3","TCP","1516","[TCP segment of a reassembled PDU]"
"9.017110","5.9.29.183","172.19.0.3","TCP","1492","9002 → 43520 [PSH, ACK] Seq=243653 Ack=14032 Win=65535 Len=1436 [TCP segment of a reassembled PDU]"
"9.017125","172.19.0.3","5.9.29.183","TCP","56","43520 → 9002 [ACK] Seq=14032 Ack=245089 Win=11903 Len=0"
"9.017971","5.9.29.183","172.19.0.3","TLSv1.2","787","Application Data"
"9.034193","5.9.29.183","172.19.0.3","TCP","636","[TCP segment of a reassembled PDU]"
"9.034257","5.9.29.183","172.19.0.3","TCP","924","9002 → 43520 [PSH, ACK] Seq=246400 Ack=14032 Win=65535 Len=868 [TCP segment of a reassembled PDU]"
"9.034280","172.19.0.3","5.9.29.183","TCP","56","43520 → 9002 [ACK] Seq=14032 Ack=247268 Win=11903 Len=0"
"9.034456","5.9.29.183","172.19.0.3","TCP","1504","9002 → 43520 [PSH, ACK] Seq=247268 Ack=14032 Win=65535 Len=1448 [TCP segment of a reassembled PDU]"
"9.034535","5.9.29.183","172.19.0.3","TLSv1.2","787","Application Data"
"9.034545","172.19.0.3","5.9.29.183","TCP","56","43520 → 9002 [ACK] Seq=14032 Ack=249447 Win=11911 Len=0"
"9.034879","172.19.0.3","5.9.29.183","TLSv1.2","599","Application Data"
"9.035168","5.9.29.183","172.19.0.3","TCP","56","9002 → 43520 [ACK] Seq=249447 Ack=14575 Win=65535 Len=0"
"9.048121","5.9.29.183","172.19.0.3","TCP","1516","[TCP segment of a reassembled PDU]"
"9.048272","5.9.29.183","172.19.0.3","TCP","1516","9002 → 43520 [PSH, ACK] Seq=250907 Ack=14575 Win=65535 Len=1460 [TCP segment of a reassembled PDU]"
"9.048323","5.9.29.183","172.19.0.3","TLSv1.2","1516","Application Data [TCP segment of a reassembled PDU]"
"9.048432","172.19.0.3","5.9.29.183","TCP","56","43520 → 9002 [ACK] Seq=14575 Ack=253827 Win=11895 Len=0"
"9.048884","5.9.29.183","172.19.0.3","TCP","1468","9002 → 43520 [PSH, ACK] Seq=253827 Ack=14575 Win=65535 Len=1412 [TCP segment of a reassembled PDU]"
"9.049869","5.9.29.183","172.19.0.3","TCP","1504","9002 → 43520 [PSH, ACK] Seq=255239 Ack=14575 Win=65535 Len=1448 [TCP segment of a reassembled PDU]"
"9.049889","172.19.0.3","5.9.29.183","TCP","56","43520 → 9002 [ACK] Seq=14575 Ack=256687 Win=11911 Len=0"
"9.049937","5.9.29.183","172.19.0.3","TLSv1.2","1127","Application Data, Application Data"
"9.065934","5.9.29.183","172.19.0.3","TCP","1516","[TCP segment of a reassembled PDU]"
"9.065953","172.19.0.3","5.9.29.183","TCP","56","43520 → 9002 [ACK] Seq=14575 Ack=259218 Win=11911 Len=0"
"9.065992","5.9.29.183","172.19.0.3","TCP","1492","9002 → 43520 [PSH, ACK] Seq=259218 Ack=14575 Win=65535 Len=1436 [TCP segment of a reassembled PDU]"
"9.066803","5.9.29.183","172.19.0.3","TLSv1.2","1237","Application Data"
"9.066889","172.19.0.3","5.9.29.183","TCP","56","43520 → 9002 [ACK] Seq=14575 Ack=261835 Win=11911 Len=0"
"9.066973","5.9.29.183","172.19.0.3","TCP","1516","[TCP segment of a reassembled PDU]"
"9.066978","5.9.29.183","172.19.0.3","TCP","1492","9002 → 43520 [PSH, ACK] Seq=263295 Ack=14575 Win=65535 Len=1436 [TCP segment of a reassembled PDU]"
"9.067158","172.19.0.3","5.9.29.183","TCP","56","43520 → 9002 [ACK] Seq=14575 Ack=264731 Win=11903 Len=0"
"9.071455","5.9.29.183","172.19.0.3","TLSv1.2","1504","Application Data, Application Data"
"9.071708","172.19.0.3","5.9.29.183","TLSv1.2","599","Application Data"
"9.071939","5.9.29.183","172.19.0.3","TCP","56","9002 → 43520 [ACK] Seq=266179 Ack=15118 Win=65535 Len=0"
"9.082731","5.9.29.183","172.19.0.3","TLSv1.2","489","Application Data"
"9.083058","5.9.29.183","172.19.0.3","TCP","1516","[TCP segment of a reassembled PDU]"
"9.083077","172.19.0.3","5.9.29.183","TCP","56","43520 → 9002 [ACK] Seq=15118 Ack=268072 Win=11911 Len=0"
"9.083081","5.9.29.183","172.19.0.3","TCP","1492","9002 → 43520 [PSH, ACK] Seq=268072 Ack=15118 Win=65535 Len=1436 [TCP segment of a reassembled PDU]"
"9.083298","5.9.29.183","172.19.0.3","TLSv1.2","1516","Application Data [TCP segment of a reassembled PDU]"
"9.083309","5.9.29.183","172.19.0.3","TCP","1516","9002 → 43520 [PSH, ACK] Seq=270968 Ack=15118 Win=65535 Len=1460 [TCP segment of a reassembled PDU]"
"9.083313","5.9.29.183","172.19.0.3","TCP","1480","9002 → 43520 [PSH, ACK] Seq=272428 Ack=15118 Win=65535 Len=1424 [TCP segment of a reassembled PDU]"
"9.083333","172.19.0.3","5.9.29.183","TCP","56","43520 → 9002 [ACK] Seq=15118 Ack=273852 Win=11879 Len=0"
"9.088280","5.9.29.183","172.19.0.3","TLSv1.2","1516","Application Data, Application Data"
"9.088353","5.9.29.183","172.19.0.3","TCP","1492","9002 → 43520 [PSH, ACK] Seq=275312 Ack=15118 Win=65535 Len=1436 [TCP segment of a reassembled PDU]"
"9.088371","172.19.0.3","5.9.29.183","TCP","56","43520 → 9002 [ACK] Seq=15118 Ack=276748 Win=11903 Len=0"
"9.098104","5.9.29.183","172.19.0.3","TLSv1.2","1344","Application Data"
"9.105313","5.9.29.183","172.19.0.3","TCP","1516","[TCP segment of a reassembled PDU]"
"9.105330","172.19.0.3","5.9.29.183","TCP","56","43520 → 9002 [ACK] Seq=15118 Ack=279496 Win=11911 Len=0"
"9.105368","5.9.29.183","172.19.0.3","TCP","1492","9002 → 43520 [PSH, ACK] Seq=279496 Ack=15118 Win=65535 Len=1436 [TCP segment of a reassembled PDU]"
"9.113448","5.9.29.183","172.19.0.3","TLSv1.2","273","Application Data"
"9.113464","172.19.0.3","5.9.29.183","TCP","56","43520 → 9002 [ACK] Seq=15118 Ack=281149 Win=11911 Len=0"
"9.117150","172.19.0.3","5.9.29.183","TLSv1.2","599","Application Data"
"9.117353","5.9.29.183","172.19.0.3","TCP","56","9002 → 43520 [ACK] Seq=281149 Ack=15661 Win=65535 Len=0"
"9.815833","5.9.29.183","172.19.0.3","TLSv1.2","599","Application Data"
"9.816560","172.19.0.3","5.9.29.183","TLSv1.2","599","Application Data"
"9.816822","5.9.29.183","172.19.0.3","TCP","56","9002 → 43520 [ACK] Seq=281692 Ack=16204 Win=65535 Len=0"
"10.388142","5.9.29.183","172.19.0.3","TLSv1.2","599","Application Data"
"10.430040","5.9.29.183","172.19.0.3","TCP","1516","[TCP segment of a reassembled PDU]"
"10.430060","172.19.0.3","5.9.29.183","TCP","56","43520 → 9002 [ACK] Seq=16204 Ack=283695 Win=11911 Len=0"
"10.430100","5.9.29.183","172.19.0.3","TCP","1492","9002 → 43520 [PSH, ACK] Seq=283695 Ack=16204 Win=65535 Len=1436 [TCP segment of a reassembled PDU]"
"10.430111","5.9.29.183","172.19.0.3","TLSv1.2","787","Application Data"
"10.430245","172.19.0.3","5.9.29.183","TCP","56","43520 → 9002 [ACK] Seq=16204 Ack=285862 Win=11895 Len=0"
"10.501720","5.9.29.183","172.19.0.3","TCP","1516","[TCP segment of a reassembled PDU]"
"10.501784","5.9.29.183","172.19.0.3","TCP","1492","9002 → 43520 [PSH, ACK] Seq=287322 Ack=16204 Win=65535 Len=1436 [TCP segment of a reassembled PDU]"
"10.501804","172.19.0.3","5.9.29.183","TCP","56","43520 → 9002 [ACK] Seq=16204 Ack=288758 Win=11901 Len=0"
"10.501806","5.9.29.183","172.19.0.3","TLSv1.2","1237","Application Data"
"10.517005","5.9.29.183","172.19.0.3","TLSv1.2","663","Application Data"
"10.517024","172.19.0.3","5.9.29.183","TCP","56","43520 → 9002 [ACK] Seq=16204 Ack=290546 Win=11911 Len=0"
"10.526466","5.9.29.183","172.19.0.3","TCP","1516","[TCP segment of a reassembled PDU]"
"10.526512","5.9.29.183","172.19.0.3","TCP","1492","9002 → 43520 [PSH, ACK] Seq=292006 Ack=16204 Win=65535 Len=1436 [TCP segment of a reassembled PDU]"
"10.526659","172.19.0.3","5.9.29.183","TCP","56","43520 → 9002 [ACK] Seq=16204 Ack=293442 Win=11903 Len=0"
"10.531978","5.9.29.183","172.19.0.3","TLSv1.2","273","Application Data"
"10.547037","5.9.29.183","172.19.0.3","TCP","1516","[TCP segment of a reassembled PDU]"
"10.547055","172.19.0.3","5.9.29.183","TCP","56","43520 → 9002 [ACK] Seq=16204 Ack=295119 Win=11911 Len=0"
"10.547093","5.9.29.183","172.19.0.3","TCP","1492","9002 → 43520 [PSH, ACK] Seq=295119 Ack=16204 Win=65535 Len=1436 [TCP segment of a reassembled PDU]"
"10.547675","5.9.29.183","172.19.0.3","TLSv1.2","1330","Application Data, Application Data"
"10.547683","172.19.0.3","5.9.29.183","TCP","56","43520 → 9002 [ACK] Seq=16204 Ack=297829 Win=11911 Len=0"
"10.563027","5.9.29.183","172.19.0.3","TCP","1504","[TCP segment of a reassembled PDU]"
"10.563304","5.9.29.183","172.19.0.3","TCP","1516","9002 → 43520 [PSH, ACK] Seq=299277 Ack=16204 Win=65535 Len=1460 [TCP segment of a reassembled PDU]"
"10.563317","5.9.29.183","172.19.0.3","TLSv1.2","1516","Application Data [TCP segment of a reassembled PDU]"
"10.563383","172.19.0.3","5.9.29.183","TCP","56","43520 → 9002 [ACK] Seq=16204 Ack=302197 Win=11895 Len=0"
"10.563384","5.9.29.183","172.19.0.3","TCP","1480","9002 → 43520 [PSH, ACK] Seq=302197 Ack=16204 Win=65535 Len=1424 [TCP segment of a reassembled PDU]"
"10.563481","5.9.29.183","172.19.0.3","TCP","1516","9002 → 43520 [PSH, ACK] Seq=303621 Ack=16204 Win=65535 Len=1460 [TCP segment of a reassembled PDU]"
"10.563692","172.19.0.3","5.9.29.183","TLSv1.2","599","Application Data"
"10.563786","5.9.29.183","172.19.0.3","TLSv1.2","1516","Application Data [TCP segment of a reassembled PDU]"
"10.563792","5.9.29.183","172.19.0.3","TCP","1516","9002 → 43520 [PSH, ACK] Seq=306541 Ack=16204 Win=65535 Len=1460 [TCP segment of a reassembled PDU]"
"10.563800","172.19.0.3","5.9.29.183","TCP","56","43520 → 9002 [ACK] Seq=16747 Ack=308001 Win=11903 Len=0"
"10.563947","5.9.29.183","172.19.0.3","TCP","1468","9002 → 43520 [PSH, ACK] Seq=308001 Ack=16204 Win=65535 Len=1412 [TCP segment of a reassembled PDU]"
"10.563953","5.9.29.183","172.19.0.3","TLSv1.2","1504","Application Data [TCP segment of a reassembled PDU]"
"10.564111","172.19.0.3","5.9.29.183","TCP","56","43520 → 9002 [ACK] Seq=16747 Ack=310861 Win=11887 Len=0"
"10.564134","5.9.29.183","172.19.0.3","TCP","56","9002 → 43520 [ACK] Seq=310861 Ack=16747 Win=65535 Len=0"
"10.574357","172.19.0.3","5.9.29.183","TLSv1.2","599","Application Data"
"10.574732","5.9.29.183","172.19.0.3","TCP","56","9002 → 43520 [ACK] Seq=310861 Ack=17290 Win=65535 Len=0"
"10.579036","5.9.29.183","172.19.0.3","TCP","1131","9002 → 43520 [PSH, ACK] Seq=310861 Ack=17290 Win=65535 Len=1075 [TCP segment of a reassembled PDU]"
"10.579095","5.9.29.183","172.19.0.3","TCP","429","9002 → 43520 [PSH, ACK] Seq=311936 Ack=17290 Win=65535 Len=373 [TCP segment of a reassembled PDU]"
"10.579310","172.19.0.3","5.9.29.183","TCP","56","43520 → 9002 [ACK] Seq=17290 Ack=312309 Win=11911 Len=0"
"10.579535","5.9.29.183","172.19.0.3","TCP","1504","9002 → 43520 [PSH, ACK] Seq=312309 Ack=17290 Win=65535 Len=1448 [TCP segment of a reassembled PDU]"
"10.579655","5.9.29.183","172.19.0.3","TLSv1.2","178","Application Data"
"10.579749","172.19.0.3","5.9.29.183","TCP","56","43520 → 9002 [ACK] Seq=17290 Ack=313879 Win=11911 Len=0"
"10.588101","5.9.29.183","172.19.0.3","TCP","1504","[TCP segment of a reassembled PDU]"
"10.595264","5.9.29.183","172.19.0.3","TLSv1.2","1207","Application Data"
"10.595284","172.19.0.3","5.9.29.183","TCP","56","43520 → 9002 [ACK] Seq=17290 Ack=316478 Win=11911 Len=0"
"10.610414","5.9.29.183","172.19.0.3","TCP","1504","[TCP segment of a reassembled PDU]"
"10.610660","5.9.29.183","172.19.0.3","TCP","1504","9002 → 43520 [PSH, ACK] Seq=317926 Ack=17290 Win=65535 Len=1448 [TCP segment of a reassembled PDU]"
"10.610681","172.19.0.3","5.9.29.183","TCP","56","43520 → 9002 [ACK] Seq=17290 Ack=319374 Win=11911 Len=0"
"10.610707","5.9.29.183","172.19.0.3","TLSv1.2","273","Application Data"
"10.631235","5.9.29.183","172.19.0.3","TCP","1516","[TCP segment of a reassembled PDU]"
"10.631259","172.19.0.3","5.9.29.183","TCP","56","43520 → 9002 [ACK] Seq=17290 Ack=321051 Win=11911 Len=0"
"10.631319","5.9.29.183","172.19.0.3","TLSv1.2","681","Application Data"
"10.644808","5.9.29.183","172.19.0.3","TCP","1504","[TCP segment of a reassembled PDU]"
"10.644825","172.19.0.3","5.9.29.183","TCP","56","43520 → 9002 [ACK] Seq=17290 Ack=323124 Win=11911 Len=0"
"10.644859","5.9.29.183","172.19.0.3","TCP","1516","9002 → 43520 [PSH, ACK] Seq=323124 Ack=17290 Win=65535 Len=1460 [TCP segment of a reassembled PDU]"
"10.644867","5.9.29.183","172.19.0.3","TLSv1.2","1516","Application Data [TCP segment of a reassembled PDU]"
"10.644869","5.9.29.183","172.19.0.3","TCP","1516","9002 → 43520 [PSH, ACK] Seq=326044 Ack=17290 Win=65535 Len=1460 [TCP segment of a reassembled PDU]"
"10.644872","5.9.29.183","172.19.0.3","TCP","1468","9002 → 43520 [PSH, ACK] Seq=327504 Ack=17290 Win=65535 Len=1412 [TCP segment of a reassembled PDU]"
"10.644981","172.19.0.3","5.9.29.183","TCP","56","43520 → 9002 [ACK] Seq=17290 Ack=328916 Win=11879 Len=0"
"10.646580","5.9.29.183","172.19.0.3","TLSv1.2","584","Application Data"
"10.665434","5.9.29.183","172.19.0.3","TCP","1516","[TCP segment of a reassembled PDU]"
"10.665449","172.19.0.3","5.9.29.183","TCP","56","43520 → 9002 [ACK] Seq=17290 Ack=330904 Win=11911 Len=0"
"10.665476","5.9.29.183","172.19.0.3","TCP","1492","9002 → 43520 [PSH, ACK] Seq=330904 Ack=17290 Win=65535 Len=1436 [TCP segment of a reassembled PDU]"
"10.666169","5.9.29.183","172.19.0.3","TLSv1.2","1237","Application Data"
"10.666175","172.19.0.3","5.9.29.183","TCP","56","43520 → 9002 [ACK] Seq=17290 Ack=333521 Win=11911 Len=0"
"10.666236","5.9.29.183","172.19.0.3","TCP","1516","[TCP segment of a reassembled PDU]"
"10.666241","5.9.29.183","172.19.0.3","TCP","1492","9002 → 43520 [PSH, ACK] Seq=334981 Ack=17290 Win=65535 Len=1436 [TCP segment of a reassembled PDU]"
"10.666269","172.19.0.3","5.9.29.183","TCP","56","43520 → 9002 [ACK] Seq=17290 Ack=336417 Win=11895 Len=0"
"10.666273","5.9.29.183","172.19.0.3","TLSv1.2","1504","Application Data [TCP segment of a reassembled PDU]"
"10.666599","172.19.0.3","5.9.29.183","TLSv1.2","599","Application Data"
"10.666774","5.9.29.183","172.19.0.3","TCP","56","9002 → 43520 [ACK] Seq=337865 Ack=17833 Win=65535 Len=0"
"10.681335","5.9.29.183","172.19.0.3","TLSv1.2","460","Application Data"
"10.686708","5.9.29.183","172.19.0.3","TCP","1504","[TCP segment of a reassembled PDU]"
"10.686731","172.19.0.3","5.9.29.183","TCP","56","43520 → 9002 [ACK] Seq=17833 Ack=339717 Win=11911 Len=0"
"10.687052","5.9.29.183","172.19.0.3","TCP","1516","9002 → 43520 [PSH, ACK] Seq=339717 Ack=17833 Win=65535 Len=1460 [TCP segment of a reassembled PDU]"
"10.687176","5.9.29.183","172.19.0.3","TLSv1.2","1516","Application Data [TCP segment of a reassembled PDU]"
"10.687252","5.9.29.183","172.19.0.3","TCP","1480","9002 → 43520 [PSH, ACK] Seq=342637 Ack=17833 Win=65535 Len=1424 [TCP segment of a reassembled PDU]"
"10.687288","172.19.0.3","5.9.29.183","TCP","56","43520 → 9002 [ACK] Seq=17833 Ack=342637 Win=11903 Len=0"
"10.687572","5.9.29.183","172.19.0.3","TCP","1516","9002 → 43520 [PSH, ACK] Seq=344061 Ack=17833 Win=65535 Len=1460 [TCP segment of a reassembled PDU]"
"10.687579","5.9.29.183","172.19.0.3","TLSv1.2","1492","Application Data [TCP segment of a reassembled PDU]"
"10.687583","5.9.29.183","172.19.0.3","TCP","1516","9002 → 43520 [PSH, ACK] Seq=346957 Ack=17833 Win=65535 Len=1460 [TCP segment of a reassembled PDU]"
"10.687587","5.9.29.183","172.19.0.3","TCP","1492","9002 → 43520 [PSH, ACK] Seq=348417 Ack=17833 Win=65535 Len=1436 [TCP segment of a reassembled PDU]"
"10.687629","172.19.0.3","5.9.29.183","TCP","56","43520 → 9002 [ACK] Seq=17833 Ack=349853 Win=11863 Len=0"
"10.696537","5.9.29.183","172.19.0.3","TLSv1.2","381","Application Data"
"10.714277","5.9.29.183","172.19.0.3","TCP","1504","[TCP segment of a reassembled PDU]"
"10.714294","172.19.0.3","5.9.29.183","TCP","56","43520 → 9002 [ACK] Seq=17833 Ack=351626 Win=11911 Len=0"
"10.714560","5.9.29.183","172.19.0.3","TCP","1504","9002 → 43520 [PSH, ACK] Seq=351626 Ack=17833 Win=65535 Len=1448 [TCP segment of a reassembled PDU]"
"10.714625","5.9.29.183","172.19.0.3","TLSv1.2","273","Application Data"
"10.714675","172.19.0.3","5.9.29.183","TCP","56","43520 → 9002 [ACK] Seq=17833 Ack=353291 Win=11911 Len=0"
"10.718062","172.19.0.3","5.9.29.183","TLSv1.2","599","Application Data"
"10.718232","5.9.29.183","172.19.0.3","TCP","56","9002 → 43520 [ACK] Seq=353291 Ack=18376 Win=65535 Len=0"
"11.349819","5.9.29.183","172.19.0.3","TLSv1.2","599","Application Data"
"11.350469","172.19.0.3","5.9.29.183","TLSv1.2","599","Application Data"
"11.350699","5.9.29.183","172.19.0.3","TCP","56","9002 → 43520 [ACK] Seq=353834 Ack=18919 Win=65535 Len=0"
"11.967372","5.9.29.183","172.19.0.3","TCP","1516","[TCP segment of a reassembled PDU]"
"11.967436","5.9.29.183","172.19.0.3","TCP","1516","9002 → 43520 [PSH, ACK] Seq=355294 Ack=18919 Win=65535 Len=1460 [TCP segment of a reassembled PDU]"
"11.967444","5.9.29.183","172.19.0.3","TLSv1.2","1213","Application Data"
"11.967494","5.9.29.183","172.19.0.3","TLSv1.2","1516","Application Data"
"11.967499","5.9.29.183","172.19.0.3","TCP","1492","9002 → 43520 [PSH, ACK] Seq=359371 Ack=18919 Win=65535 Len=1436 [TCP segment of a reassembled PDU]"
"11.967558","172.19.0.3","5.9.29.183","TCP","56","43520 → 9002 [ACK] Seq=18919 Ack=360807 Win=11879 Len=0"
"11.967793","172.19.0.3","5.9.29.183","TLSv1.2","599","Application Data"
"11.967985","5.9.29.183","172.19.0.3","TCP","56","9002 → 43520 [ACK] Seq=360807 Ack=19462 Win=65535 Len=0"
"11.983493","5.9.29.183","172.19.0.3","TLSv1.2","1423","Application Data, Application Data"
"12.008943","5.9.29.183","172.19.0.3","TCP","1516","[TCP segment of a reassembled PDU]"
"12.008969","172.19.0.3","5.9.29.183","TCP","56","43520 → 9002 [ACK] Seq=19462 Ack=363634 Win=11911 Len=0"
"12.009026","5.9.29.183","172.19.0.3","TCP","1516","9002 → 43520 [PSH, ACK] Seq=363634 Ack=19462 Win=65535 Len=1460 [TCP segment of a reassembled PDU]"
"12.009038","5.9.29.183","172.19.0.3","TLSv1.2","1213","Application Data"
"12.009043","5.9.29.183","172.19.0.3","TCP","1516","[TCP segment of a reassembled PDU]"
"12.009046","5.9.29.183","172.19.0.3","TCP","1516","9002 → 43520 [PSH, ACK] Seq=367711 Ack=19462 Win=65535 Len=1460 [TCP segment of a reassembled PDU]"
"12.009126","5.9.29.183","172.19.0.3","TLSv1.2","1480","Application Data [TCP segment of a reassembled PDU]"
"12.009214","172.19.0.3","5.9.29.183","TCP","56","43520 → 9002 [ACK] Seq=19462 Ack=370595 Win=11869 Len=0"
"12.024180","5.9.29.183","172.19.0.3","TLSv1.2","1488","Application Data"
"12.037185","5.9.29.183","172.19.0.3","TCP","1504","[TCP segment of a reassembled PDU]"
"12.037203","172.19.0.3","5.9.29.183","TCP","56","43520 → 9002 [ACK] Seq=19462 Ack=373475 Win=11911 Len=0"
"12.037956","5.9.29.183","172.19.0.3","TCP","1504","9002 → 43520 [PSH, ACK] Seq=373475 Ack=19462 Win=65535 Len=1448 [TCP segment of a reassembled PDU]"
"12.039436","5.9.29.183","172.19.0.3","TLSv1.2","787","Application Data"
"12.039464","172.19.0.3","5.9.29.183","TCP","56","43520 → 9002 [ACK] Seq=19462 Ack=375654 Win=11911 Len=0"
"12.057896","5.9.29.183","172.19.0.3","TLSv1.2","599","Application Data"
"12.099177","172.19.0.3","5.9.29.183","TCP","56","43520 → 9002 [ACK] Seq=19462 Ack=376197 Win=11911 Len=0"
"12.100271","5.9.29.183","172.19.0.3","TCP","1331","[TCP segment of a reassembled PDU]"
"12.100287","172.19.0.3","5.9.29.183","TCP","56","43520 → 9002 [ACK] Seq=19462 Ack=377472 Win=11911 Len=0"
"12.100328","5.9.29.183","172.19.0.3","TCP","1516","9002 → 43520 [PSH, ACK] Seq=377472 Ack=19462 Win=65535 Len=1460 [TCP segment of a reassembled PDU]"
"12.100351","172.19.0.3","5.9.29.183","TCP","56","43520 → 9002 [ACK] Seq=19462 Ack=378932 Win=11903 Len=0"
"12.100354","5.9.29.183","172.19.0.3","TLSv1.2","1398","Application Data"
"12.100367","172.19.0.3","5.9.29.183","TCP","56","43520 → 9002 [ACK] Seq=19462 Ack=380274 Win=11895 Len=0"
"12.100658","172.19.0.3","5.9.29.183","TLSv1.2","599","Application Data"
"12.100967","5.9.29.183","172.19.0.3","TCP","56","9002 → 43520 [ACK] Seq=380274 Ack=20005 Win=65535 Len=0"
"12.115925","5.9.29.183","172.19.0.3","TLSv1.2","149","Application Data"
"12.122272","5.9.29.183","172.19.0.3","TCP","1504","[TCP segment of a reassembled PDU]"
"12.122290","172.19.0.3","5.9.29.183","TCP","56","43520 → 9002 [ACK] Seq=20005 Ack=381815 Win=11911 Len=0"
"12.122821","5.9.29.183","172.19.0.3","TCP","1504","9002 → 43520 [PSH, ACK] Seq=381815 Ack=20005 Win=65535 Len=1448 [TCP segment of a reassembled PDU]"
"12.134641","5.9.29.183","172.19.0.3","TLSv1.2","787","Application Data"
"12.134666","172.19.0.3","5.9.29.183","TCP","56","43520 → 9002 [ACK] Seq=20005 Ack=383994 Win=11911 Len=0"
"12.145579","5.9.29.183","172.19.0.3","TCP","1504","[TCP segment of a reassembled PDU]"
"12.145632","5.9.29.183","172.19.0.3","TCP","1504","9002 → 43520 [PSH, ACK] Seq=385442 Ack=20005 Win=65535 Len=1448 [TCP segment of a reassembled PDU]"
"12.145782","172.19.0.3","5.9.29.183","TCP","56","43520 → 9002 [ACK] Seq=20005 Ack=386890 Win=11903 Len=0"
"12.155546","5.9.29.183","172.19.0.3","TLSv1.2","273","Application Data"
"12.160383","172.19.0.3","5.9.29.183","TLSv1.2","599","Application Data"
"12.160638","5.9.29.183","172.19.0.3","TCP","56","9002 → 43520 [ACK] Seq=387107 Ack=20548 Win=65535 Len=0"
"12.651270","5.9.29.183","172.19.0.3","TLSv1.2","599","Application Data"
"12.652002","172.19.0.3","5.9.29.183","TLSv1.2","599","Application Data"
"12.652314","5.9.29.183","172.19.0.3","TCP","56","9002 → 43520 [ACK] Seq=387650 Ack=21091 Win=65535 Len=0"
"13.102151","5.9.29.183","172.19.0.3","TCP","1516","[TCP segment of a reassembled PDU]"
"13.102224","5.9.29.183","172.19.0.3","TCP","1492","9002 → 43520 [PSH, ACK] Seq=389110 Ack=21091 Win=65535 Len=1436 [TCP segment of a reassembled PDU]"
"13.102318","5.9.29.183","172.19.0.3","TLSv1.2","273","Application Data"
"13.102384","172.19.0.3","5.9.29.183","TCP","56","43520 → 9002 [ACK] Seq=21091 Ack=390763 Win=11893 Len=0"
"13.137727","5.9.29.183","172.19.0.3","TLSv1.2","1113","Application Data"
"13.187285","172.19.0.3","5.9.29.183","TCP","56","43520 → 9002 [ACK] Seq=21091 Ack=391820 Win=11911 Len=0"
"13.195134","5.9.29.183","172.19.0.3","TCP","1516","[TCP segment of a reassembled PDU]"
"13.195152","172.19.0.3","5.9.29.183","TCP","56","43520 → 9002 [ACK] Seq=21091 Ack=393280 Win=11911 Len=0"
"13.195188","5.9.29.183","172.19.0.3","TCP","1492","9002 → 43520 [PSH, ACK] Seq=393280 Ack=21091 Win=65535 Len=1436 [TCP segment of a reassembled PDU]"
"13.195199","172.19.0.3","5.9.29.183","TCP","56","43520 → 9002 [ACK] Seq=21091 Ack=394716 Win=11903 Len=0"
"13.196010","5.9.29.183","172.19.0.3","TLSv1.2","787","Application Data"
"13.196017","172.19.0.3","5.9.29.183","TCP","56","43520 → 9002 [ACK] Seq=21091 Ack=395447 Win=11911 Len=0"
"13.222411","5.9.29.183","172.19.0.3","TCP","1516","[TCP segment of a reassembled PDU]"
"13.222429","172.19.0.3","5.9.29.183","TCP","56","43520 → 9002 [ACK] Seq=21091 Ack=396907 Win=11911 Len=0"
"13.222469","5.9.29.183","172.19.0.3","TCP","1492","9002 → 43520 [PSH, ACK] Seq=396907 Ack=21091 Win=65535 Len=1436 [TCP segment of a reassembled PDU]"
"13.222481","172.19.0.3","5.9.29.183","TCP","56","43520 → 9002 [ACK] Seq=21091 Ack=398343 Win=11903 Len=0"
"13.223194","5.9.29.183","172.19.0.3","TLSv1.2","1237","Application Data"
"13.223223","172.19.0.3","5.9.29.183","TCP","56","43520 → 9002 [ACK] Seq=21091 Ack=399524 Win=11911 Len=0"
"13.223338","5.9.29.183","172.19.0.3","TCP","1516","[TCP segment of a reassembled PDU]"
"13.223353","172.19.0.3","5.9.29.183","TCP","56","43520 → 9002 [ACK] Seq=21091 Ack=400984 Win=11911 Len=0"
"13.223356","5.9.29.183","172.19.0.3","TCP","1492","9002 → 43520 [PSH, ACK] Seq=400984 Ack=21091 Win=65535 Len=1436 [TCP segment of a reassembled PDU]"
"13.223364","172.19.0.3","5.9.29.183","TCP","56","43520 → 9002 [ACK] Seq=21091 Ack=402420 Win=11903 Len=0"
"13.238718","5.9.29.183","172.19.0.3","TLSv1.2","337","Application Data"
"13.238736","172.19.0.3","5.9.29.183","TCP","56","43520 → 9002 [ACK] Seq=21091 Ack=402701 Win=11911 Len=0"
"13.239642","5.9.29.183","172.19.0.3","TCP","1504","[TCP segment of a reassembled PDU]"
"13.239649","172.19.0.3","5.9.29.183","TCP","56","43520 → 9002 [ACK] Seq=21091 Ack=404149 Win=11911 Len=0"
"13.240184","5.9.29.183","172.19.0.3","TCP","1504","9002 → 43520 [PSH, ACK] Seq=404149 Ack=21091 Win=65535 Len=1448 [TCP segment of a reassembled PDU]"
"13.240211","172.19.0.3","5.9.29.183","TCP","56","43520 → 9002 [ACK] Seq=21091 Ack=405597 Win=11911 Len=0"
"13.240241","5.9.29.183","172.19.0.3","TLSv1.2","1516","Application Data [TCP segment of a reassembled PDU]"
"13.240249","172.19.0.3","5.9.29.183","TCP","56","43520 → 9002 [ACK] Seq=21091 Ack=407057 Win=11903 Len=0"
"13.240288","5.9.29.183","172.19.0.3","TCP","1492","9002 → 43520 [PSH, ACK] Seq=407057 Ack=21091 Win=65535 Len=1436 [TCP segment of a reassembled PDU]"
"13.240294","172.19.0.3","5.9.29.183","TCP","56","43520 → 9002 [ACK] Seq=21091 Ack=408493 Win=11895 Len=0"
"13.240366","5.9.29.183","172.19.0.3","TCP","1504","9002 → 43520 [PSH, ACK] Seq=408493 Ack=21091 Win=65535 Len=1448 [TCP segment of a reassembled PDU]"
"13.240373","172.19.0.3","5.9.29.183","TCP","56","43520 → 9002 [ACK] Seq=21091 Ack=409941 Win=11911 Len=0"
"13.253591","5.9.29.183","172.19.0.3","TLSv1.2","70","Application Data"
"13.253758","172.19.0.3","5.9.29.183","TCP","56","43520 → 9002 [ACK] Seq=21091 Ack=409955 Win=11911 Len=0"
"13.253956","172.19.0.3","5.9.29.183","TLSv1.2","599","Application Data"
"13.254131","5.9.29.183","172.19.0.3","TCP","56","9002 → 43520 [ACK] Seq=409955 Ack=21634 Win=65535 Len=0"
"13.258853","5.9.29.183","172.19.0.3","TCP","1504","[TCP segment of a reassembled PDU]"
"13.259007","5.9.29.183","172.19.0.3","TCP","1516","9002 → 43520 [PSH, ACK] Seq=411403 Ack=21634 Win=65535 Len=1460 [TCP segment of a reassembled PDU]"
"13.259014","5.9.29.183","172.19.0.3","TLSv1.2","1516","Application Data [TCP segment of a reassembled PDU]"
"13.259017","5.9.29.183","172.19.0.3","TCP","1480","9002 → 43520 [PSH, ACK] Seq=414323 Ack=21634 Win=65535 Len=1424 [TCP segment of a reassembled PDU]"
"13.259086","172.19.0.3","5.9.29.183","TCP","56","43520 → 9002 [ACK] Seq=21634 Ack=415747 Win=11885 Len=0"
"13.259157","5.9.29.183","172.19.0.3","TCP","1504","9002 → 43520 [PSH, ACK] Seq=415747 Ack=21634 Win=65535 Len=1448 [TCP segment of a reassembled PDU]"
"13.265983","172.19.0.3","5.9.29.183","TLSv1.2","599","Application Data"
"13.266378","5.9.29.183","172.19.0.3","TCP","56","9002 → 43520 [ACK] Seq=417195 Ack=22177 Win=65535 Len=0"
"13.268526","5.9.29.183","172.19.0.3","TLSv1.2","584","Application Data"
"13.278148","5.9.29.183","172.19.0.3","TCP","1516","[TCP segment of a reassembled PDU]"
"13.278229","172.19.0.3","5.9.29.183","TCP","56","43520 → 9002 [ACK] Seq=22177 Ack=419183 Win=11911 Len=0"
"13.278272","5.9.29.183","172.19.0.3","TCP","1492","9002 → 43520 [PSH, ACK] Seq=419183 Ack=22177 Win=65535 Len=1436 [TCP segment of a reassembled PDU]"
"13.278383","5.9.29.183","172.19.0.3","TLSv1.2","1504","Application Data [TCP segment of a reassembled PDU]"
"13.278444","172.19.0.3","5.9.29.183","TCP","56","43520 → 9002 [ACK] Seq=22177 Ack=422067 Win=11895 Len=0"
"13.284454","5.9.29.183","172.19.0.3","TLSv1.2","396","Application Data"
"13.297520","5.9.29.183","172.19.0.3","TCP","1516","[TCP segment of a reassembled PDU]"
"13.297536","172.19.0.3","5.9.29.183","TCP","56","43520 → 9002 [ACK] Seq=22177 Ack=423867 Win=11911 Len=0"
"13.297568","5.9.29.183","172.19.0.3","TCP","1516","9002 → 43520 [PSH, ACK] Seq=423867 Ack=22177 Win=65535 Len=1460 [TCP segment of a reassembled PDU]"
"13.297575","5.9.29.183","172.19.0.3","TLSv1.2","1516","Application Data [TCP segment of a reassembled PDU]"
"13.297578","5.9.29.183","172.19.0.3","TCP","1468","9002 → 43520 [PSH, ACK] Seq=426787 Ack=22177 Win=65535 Len=1412 [TCP segment of a reassembled PDU]"
"13.297580","5.9.29.183","172.19.0.3","TCP","1504","9002 → 43520 [PSH, ACK] Seq=428199 Ack=22177 Win=65535 Len=1448 [TCP segment of a reassembled PDU]"
"13.297671","172.19.0.3","5.9.29.183","TCP","56","43520 → 9002 [ACK] Seq=22177 Ack=429647 Win=11879 Len=0"
"13.299530","5.9.29.183","172.19.0.3","TLSv1.2","70","Application Data"
"13.317198","5.9.29.183","172.19.0.3","TCP","1516","[TCP segment of a reassembled PDU]"
"13.317291","172.19.0.3","5.9.29.183","TCP","56","43520 → 9002 [ACK] Seq=22177 Ack=431121 Win=11911 Len=0"
"13.317333","5.9.29.183","172.19.0.3","TCP","1492","9002 → 43520 [PSH, ACK] Seq=431121 Ack=22177 Win=65535 Len=1436 [TCP segment of a reassembled PDU]"
"13.317504","5.9.29.183","172.19.0.3","TLSv1.2","1237","Application Data"
"13.317559","172.19.0.3","5.9.29.183","TCP","56","43520 → 9002 [ACK] Seq=22177 Ack=433738 Win=11911 Len=0"
"13.317736","5.9.29.183","172.19.0.3","TCP","1516","[TCP segment of a reassembled PDU]"
"13.317743","5.9.29.183","172.19.0.3","TCP","1516","9002 → 43520 [PSH, ACK] Seq=435198 Ack=22177 Win=65535 Len=1460 [TCP segment of a reassembled PDU]"
"13.317764","5.9.29.183","172.19.0.3","TLSv1.2","1480","Application Data [TCP segment of a reassembled PDU]"
"13.317958","172.19.0.3","5.9.29.183","TCP","56","43520 → 9002 [ACK] Seq=22177 Ack=438082 Win=11895 Len=0"
"13.317971","5.9.29.183","172.19.0.3","TCP","1516","9002 → 43520 [PSH, ACK] Seq=438082 Ack=22177 Win=65535 Len=1460 [TCP segment of a reassembled PDU]"
"13.317976","5.9.29.183","172.19.0.3","TCP","1492","9002 → 43520 [PSH, ACK] Seq=439542 Ack=22177 Win=65535 Len=1436 [TCP segment of a reassembled PDU]"
"13.317990","5.9.29.183","172.19.0.3","TLSv1.2","1504","Application Data [TCP segment of a reassembled PDU]"
"13.318131","172.19.0.3","5.9.29.183","TCP","56","43520 → 9002 [ACK] Seq=22177 Ack=442426 Win=11869 Len=0"
"13.318573","172.19.0.3","5.9.29.183","TLSv1.2","599","Application Data"
"13.318813","5.9.29.183","172.19.0.3","TCP","56","9002 → 43520 [ACK] Seq=442426 Ack=22720 Win=65535 Len=0"
"13.333554","5.9.29.183","172.19.0.3","TLSv1.2","257","Application Data"
"13.343784","5.9.29.183","172.19.0.3","TCP","437","[TCP segment of a reassembled PDU]"
"13.343802","5.9.29.183","172.19.0.3","TCP","1516","9002 → 43520 [PSH, ACK] Seq=443008 Ack=22720 Win=65535 Len=1460 [TCP segment of a reassembled PDU]"
"13.343815","172.19.0.3","5.9.29.183","TCP","56","43520 → 9002 [ACK] Seq=22720 Ack=444468 Win=11903 Len=0"
"13.343817","5.9.29.183","172.19.0.3","TCP","1111","9002 → 43520 [PSH, ACK] Seq=444468 Ack=22720 Win=65535 Len=1055 [TCP segment of a reassembled PDU]"
"13.349135","5.9.29.183","172.19.0.3","TLSv1.2","273","Application Data"
"13.349462","172.19.0.3","5.9.29.183","TCP","56","43520 → 9002 [ACK] Seq=22720 Ack=445740 Win=11911 Len=0"
"13.381738","5.9.29.183","172.19.0.3","TCP","1516","[TCP segment of a reassembled PDU]"
"13.381791","5.9.29.183","172.19.0.3","TCP","1492","9002 → 43520 [PSH, ACK] Seq=447200 Ack=22720 Win=65535 Len=1436 [TCP segment of a reassembled PDU]"
"13.381962","5.9.29.183","172.19.0.3","TLSv1.2","1237","Application Data"
"13.381984","172.19.0.3","5.9.29.183","TCP","56","43520 → 9002 [ACK] Seq=22720 Ack=448636 Win=11903 Len=0"
"13.383716","172.19.0.3","5.9.29.183","TLSv1.2","599","Application Data"
"13.383990","5.9.29.183","172.19.0.3","TCP","56","9002 → 43520 [ACK] Seq=449817 Ack=23263 Win=65535 Len=0"
"13.393627","172.19.0.3","5.9.29.183","TLSv1.2","599","Application Data"
"13.393933","5.9.29.183","172.19.0.3","TCP","56","9002 → 43520 [ACK] Seq=449817 Ack=23806 Win=65535 Len=0"
"13.397925","5.9.29.183","172.19.0.3","TLSv1.2","149","Application Data"
"13.438114","172.19.0.3","5.9.29.183","TCP","56","43520 → 9002 [ACK] Seq=23806 Ack=449910 Win=11911 Len=0"
"14.119285","5.9.29.183","172.19.0.3","TLSv1.2","599","Application Data"
"14.119323","172.19.0.3","5.9.29.183","TCP","56","43520 → 9002 [ACK] Seq=23806 Ack=450453 Win=11911 Len=0"
"14.120107","172.19.0.3","5.9.29.183","TLSv1.2","599","Application Data"
"14.120459","5.9.29.183","172.19.0.3","TCP","56","9002 → 43520 [ACK] Seq=450453 Ack=24349 Win=65535 Len=0"
"14.632279","5.9.29.183","172.19.0.3","TCP","1516","[TCP segment of a reassembled PDU]"
"14.632303","5.9.29.183","172.19.0.3","TCP","1492","9002 → 43520 [PSH, ACK] Seq=451913 Ack=24349 Win=65535 Len=1436 [TCP segment of a reassembled PDU]"
"14.632465","172.19.0.3","5.9.29.183","TCP","56","43520 → 9002 [ACK] Seq=24349 Ack=453349 Win=11903 Len=0"
"14.632916","5.9.29.183","172.19.0.3","TLSv1.2","787","Application Data"
"14.681742","172.19.0.3","5.9.29.183","TCP","56","43520 → 9002 [ACK] Seq=24349 Ack=454080 Win=11911 Len=0"
"14.683780","5.9.29.183","172.19.0.3","TCP","1516","[TCP segment of a reassembled PDU]"
"14.683790","172.19.0.3","5.9.29.183","TCP","56","43520 → 9002 [ACK] Seq=24349 Ack=455540 Win=11911 Len=0"
"14.683798","5.9.29.183","172.19.0.3","TCP","1492","9002 → 43520 [PSH, ACK] Seq=455540 Ack=24349 Win=65535 Len=1436 [TCP segment of a reassembled PDU]"
"14.683805","172.19.0.3","5.9.29.183","TCP","56","43520 → 9002 [ACK] Seq=24349 Ack=456976 Win=11903 Len=0"
"14.684353","5.9.29.183","172.19.0.3","TLSv1.2","787","Application Data"
"14.684360","172.19.0.3","5.9.29.183","TCP","56","43520 → 9002 [ACK] Seq=24349 Ack=457707 Win=11911 Len=0"
"14.741837","5.9.29.183","172.19.0.3","TCP","1516","[TCP segment of a reassembled PDU]"
"14.741864","172.19.0.3","5.9.29.183","TCP","56","43520 → 9002 [ACK] Seq=24349 Ack=459167 Win=11911 Len=0"
"14.741873","5.9.29.183","172.19.0.3","TCP","1492","9002 → 43520 [PSH, ACK] Seq=459167 Ack=24349 Win=65535 Len=1436 [TCP segment of a reassembled PDU]"
"14.741877","172.19.0.3","5.9.29.183","TCP","56","43520 → 9002 [ACK] Seq=24349 Ack=460603 Win=11901 Len=0"
"14.742080","5.9.29.183","172.19.0.3","TLSv1.2","787","Application Data"
"14.742086","172.19.0.3","5.9.29.183","TCP","56","43520 → 9002 [ACK] Seq=24349 Ack=461334 Win=11896 Len=0"
"14.742277","172.19.0.3","5.9.29.183","TLSv1.2","599","Application Data"
"14.742461","5.9.29.183","172.19.0.3","TCP","56","9002 → 43520 [ACK] Seq=461334 Ack=24892 Win=65535 Len=0"
"14.755442","5.9.29.183","172.19.0.3","TCP","1504","[TCP segment of a reassembled PDU]"
"14.755833","5.9.29.183","172.19.0.3","TCP","1504","9002 → 43520 [PSH, ACK] Seq=462782 Ack=24892 Win=65535 Len=1448 [TCP segment of a reassembled PDU]"
"14.755847","172.19.0.3","5.9.29.183","TCP","56","43520 → 9002 [ACK] Seq=24892 Ack=464230 Win=11911 Len=0"
"14.755853","5.9.29.183","172.19.0.3","TLSv1.2","1504","Application Data [TCP segment of a reassembled PDU]"
"14.757479","5.9.29.183","172.19.0.3","TLSv1.2","396","Application Data"
"14.757491","172.19.0.3","5.9.29.183","TCP","56","43520 → 9002 [ACK] Seq=24892 Ack=466018 Win=11911 Len=0"
"14.776485","5.9.29.183","172.19.0.3","TCP","1516","[TCP segment of a reassembled PDU]"
"14.776510","5.9.29.183","172.19.0.3","TCP","1492","9002 → 43520 [PSH, ACK] Seq=467478 Ack=24892 Win=65535 Len=1436 [TCP segment of a reassembled PDU]"
"14.776603","172.19.0.3","5.9.29.183","TCP","56","43520 → 9002 [ACK] Seq=24892 Ack=468914 Win=11903 Len=0"
"14.776924","5.9.29.183","172.19.0.3","TLSv1.2","1237","Application Data"
"14.776932","5.9.29.183","172.19.0.3","TCP","1516","[TCP segment of a reassembled PDU]"
"14.776938","172.19.0.3","5.9.29.183","TCP","56","43520 → 9002 [ACK] Seq=24892 Ack=471555 Win=11903 Len=0"
"14.776939","5.9.29.183","172.19.0.3","TCP","1492","9002 → 43520 [PSH, ACK] Seq=471555 Ack=24892 Win=65535 Len=1436 [TCP segment of a reassembled PDU]"
"14.792705","5.9.29.183","172.19.0.3","TLSv1.2","851","Application Data"
"14.792725","172.19.0.3","5.9.29.183","TCP","56","43520 → 9002 [ACK] Seq=24892 Ack=473786 Win=11911 Len=0"
"14.794924","5.9.29.183","172.19.0.3","TCP","1504","[TCP segment of a reassembled PDU]"
"14.795266","5.9.29.183","172.19.0.3","TCP","1504","9002 → 43520 [PSH, ACK] Seq=475234 Ack=24892 Win=65535 Len=1448 [TCP segment of a reassembled PDU]"
"14.795278","172.19.0.3","5.9.29.183","TCP","56","43520 → 9002 [ACK] Seq=24892 Ack=476682 Win=11911 Len=0"
"14.795409","5.9.29.183","172.19.0.3","TLSv1.2","1516","Application Data [TCP segment of a reassembled PDU]"
"14.795416","5.9.29.183","172.19.0.3","TCP","1516","9002 → 43520 [PSH, ACK] Seq=478142 Ack=24892 Win=65535 Len=1460 [TCP segment of a reassembled PDU]"
"14.795452","5.9.29.183","172.19.0.3","TCP","1480","9002 → 43520 [PSH, ACK] Seq=479602 Ack=24892 Win=65535 Len=1424 [TCP segment of a reassembled PDU]"
"14.795472","172.19.0.3","5.9.29.183","TCP","56","43520 → 9002 [ACK] Seq=24892 Ack=481026 Win=11895 Len=0"
"14.795644","172.19.0.3","5.9.29.183","TLSv1.2","599","Application Data"
"14.795808","5.9.29.183","172.19.0.3","TCP","56","9002 → 43520 [ACK] Seq=481026 Ack=25435 Win=65535 Len=0"
"14.808384","5.9.29.183","172.19.0.3","TLSv1.2","1127","Application Data, Application Data"
"14.824273","5.9.29.183","172.19.0.3","TCP","1516","[TCP segment of a reassembled PDU]"
"14.824291","172.19.0.3","5.9.29.183","TCP","56","43520 → 9002 [ACK] Seq=25435 Ack=483557 Win=11911 Len=0"
"14.824304","5.9.29.183","172.19.0.3","TCP","1492","9002 → 43520 [PSH, ACK] Seq=483557 Ack=25435 Win=65535 Len=1436 [TCP segment of a reassembled PDU]"
"14.824735","5.9.29.183","172.19.0.3","TLSv1.2","1330","Application Data, Application Data"
"14.824746","172.19.0.3","5.9.29.183","TCP","56","43520 → 9002 [ACK] Seq=25435 Ack=486267 Win=11911 Len=0"
"14.839374","5.9.29.183","172.19.0.3","TCP","1504","[TCP segment of a reassembled PDU]"
"14.840170","5.9.29.183","172.19.0.3","TCP","1504","9002 → 43520 [PSH, ACK] Seq=487715 Ack=25435 Win=65535 Len=1448 [TCP segment of a reassembled PDU]"
"14.840213","172.19.0.3","5.9.29.183","TCP","56","43520 → 9002 [ACK] Seq=25435 Ack=489163 Win=11911 Len=0"
"14.840219","5.9.29.183","172.19.0.3","TLSv1.2","1516","Application Data [TCP segment of a reassembled PDU]"
"14.840299","5.9.29.183","172.19.0.3","TCP","1492","9002 → 43520 [PSH, ACK] Seq=490623 Ack=25435 Win=65535 Len=1436 [TCP segment of a reassembled PDU]"
"14.840370","172.19.0.3","5.9.29.183","TCP","56","43520 → 9002 [ACK] Seq=25435 Ack=492059 Win=11895 Len=0"
"14.840481","5.9.29.183","172.19.0.3","TCP","1516","9002 → 43520 [PSH, ACK] Seq=492059 Ack=25435 Win=65535 Len=1460 [TCP segment of a reassembled PDU]"
"14.840485","5.9.29.183","172.19.0.3","TLSv1.2","1516","Application Data [TCP segment of a reassembled PDU]"
"14.840487","5.9.29.183","172.19.0.3","TCP","1480","9002 → 43520 [PSH, ACK] Seq=494979 Ack=25435 Win=65535 Len=1424 [TCP segment of a reassembled PDU]"
"14.840569","172.19.0.3","5.9.29.183","TCP","56","43520 → 9002 [ACK] Seq=25435 Ack=496403 Win=11871 Len=0"
"14.840925","5.9.29.183","172.19.0.3","TCP","1504","9002 → 43520 [PSH, ACK] Seq=496403 Ack=25435 Win=65535 Len=1448 [TCP segment of a reassembled PDU]"
"14.841061","5.9.29.183","172.19.0.3","TLSv1.2","381","Application Data"
"14.841066","172.19.0.3","5.9.29.183","TCP","56","43520 → 9002 [ACK] Seq=25435 Ack=498176 Win=11911 Len=0"
"14.865289","5.9.29.183","172.19.0.3","TCP","1516","[TCP segment of a reassembled PDU]"
"14.865514","5.9.29.183","172.19.0.3","TCP","1492","9002 → 43520 [PSH, ACK] Seq=499636 Ack=25435 Win=65535 Len=1436 [TCP segment of a reassembled PDU]"
"14.865524","172.19.0.3","5.9.29.183","TCP","56","43520 → 9002 [ACK] Seq=25435 Ack=501072 Win=11911 Len=0"
"14.866216","5.9.29.183","172.19.0.3","TLSv1.2","1237","Application Data"
"14.866225","5.9.29.183","172.19.0.3","TCP","1516","[TCP segment of a reassembled PDU]"
"14.866228","5.9.29.183","172.19.0.3","TCP","1492","9002 → 43520 [PSH, ACK] Seq=503713 Ack=25435 Win=65535 Len=1436 [TCP segment of a reassembled PDU]"
"14.866280","172.19.0.3","5.9.29.183","TCP","56","43520 → 9002 [ACK] Seq=25435 Ack=505149 Win=11895 Len=0"
"14.866554","5.9.29.183","172.19.0.3","TLSv1.2","1516","Application Data [TCP segment of a reassembled PDU]"
"14.866558","5.9.29.183","172.19.0.3","TCP","1516","9002 → 43520 [PSH, ACK] Seq=506609 Ack=25435 Win=65535 Len=1460 [TCP segment of a reassembled PDU]"
"14.866563","172.19.0.3","5.9.29.183","TCP","56","43520 → 9002 [ACK] Seq=25435 Ack=508069 Win=11903 Len=0"
"14.866564","5.9.29.183","172.19.0.3","TCP","531","9002 → 43520 [PSH, ACK] Seq=508069 Ack=25435 Win=65535 Len=475 [TCP segment of a reassembled PDU]"
"14.866566","5.9.29.183","172.19.0.3","TCP","1516","9002 → 43520 [PSH, ACK] Seq=508544 Ack=25435 Win=65535 Len=1460 [TCP segment of a reassembled PDU]"
"14.866603","5.9.29.183","172.19.0.3","TLSv1.2","1516","Application Data [TCP segment of a reassembled PDU]"
"14.866607","5.9.29.183","172.19.0.3","TCP","981","9002 → 43520 [PSH, ACK] Seq=511464 Ack=25435 Win=65535 Len=925 [TCP segment of a reassembled PDU]"
"14.866673","172.19.0.3","5.9.29.183","TCP","56","43520 → 9002 [ACK] Seq=25435 Ack=512389 Win=11870 Len=0"
"14.866822","172.19.0.3","5.9.29.183","TLSv1.2","599","Application Data"
"14.866962","5.9.29.183","172.19.0.3","TCP","56","9002 → 43520 [ACK] Seq=512389 Ack=25978 Win=65535 Len=0"
"14.880578","5.9.29.183","172.19.0.3","TCP","1504","9002 → 43520 [PSH, ACK] Seq=512389 Ack=25978 Win=65535 Len=1448 [TCP segment of a reassembled PDU]"
"14.881991","5.9.29.183","172.19.0.3","TLSv1.2","445","Application Data"
"14.882011","172.19.0.3","5.9.29.183","TCP","56","43520 → 9002 [ACK] Seq=25978 Ack=514226 Win=11911 Len=0"
"14.882375","172.19.0.3","5.9.29.183","TLSv1.2","599","Application Data"
"14.882644","5.9.29.183","172.19.0.3","TCP","56","9002 → 43520 [ACK] Seq=514226 Ack=26521 Win=65535 Len=0"
"14.910484","5.9.29.183","172.19.0.3","TCP","1516","[TCP segment of a reassembled PDU]"
"14.910532","5.9.29.183","172.19.0.3","TCP","1492","9002 → 43520 [PSH, ACK] Seq=515686 Ack=26521 Win=65535 Len=1436 [TCP segment of a reassembled PDU]"
"14.910665","172.19.0.3","5.9.29.183","TCP","56","43520 → 9002 [ACK] Seq=26521 Ack=517122 Win=11903 Len=0"
"14.910745","5.9.29.183","172.19.0.3","TLSv1.2","1516","Application Data [TCP segment of a reassembled PDU]"
"14.910752","5.9.29.183","172.19.0.3","TCP","1516","9002 → 43520 [PSH, ACK] Seq=518582 Ack=26521 Win=65535 Len=1460 [TCP segment of a reassembled PDU]"
"14.910754","5.9.29.183","172.19.0.3","TCP","1213","9002 → 43520 [PSH, ACK] Seq=520042 Ack=26521 Win=65535 Len=1157 [TCP segment of a reassembled PDU]"
"14.910777","172.19.0.3","5.9.29.183","TCP","56","43520 → 9002 [ACK] Seq=26521 Ack=521199 Win=11879 Len=0"
"14.926248","5.9.29.183","172.19.0.3","TLSv1.2","851","Application Data"
"14.927195","172.19.0.3","5.9.29.183","TLSv1.2","599","Application Data"
"14.927463","5.9.29.183","172.19.0.3","TCP","56","9002 → 43520 [ACK] Seq=521994 Ack=27064 Win=65535 Len=0"
"14.935552","172.19.0.3","5.9.29.183","TLSv1.2","599","Application Data"
"14.935909","5.9.29.183","172.19.0.3","TCP","56","9002 → 43520 [ACK] Seq=521994 Ack=27607 Win=65535 Len=0"
"14.974828","5.9.29.183","172.19.0.3","TLSv1.2","599","Application Data"
"15.023334","172.19.0.3","5.9.29.183","TCP","56","43520 → 9002 [ACK] Seq=27607 Ack=522537 Win=11911 Len=0"
"15.569934","5.9.29.183","172.19.0.3","TLSv1.2","599","Application Data"
"15.569977","172.19.0.3","5.9.29.183","TCP","56","43520 → 9002 [ACK] Seq=27607 Ack=523080 Win=11911 Len=0"
"15.570746","172.19.0.3","5.9.29.183","TLSv1.2","599","Application Data"
"15.571028","5.9.29.183","172.19.0.3","TCP","56","9002 → 43520 [ACK] Seq=523080 Ack=28150 Win=65535 Len=0"
"16.060861","5.9.29.183","172.19.0.3","TCP","1516","[TCP segment of a reassembled PDU]"
"16.060915","5.9.29.183","172.19.0.3","TCP","1492","9002 → 43520 [PSH, ACK] Seq=524540 Ack=28150 Win=65535 Len=1436 [TCP segment of a reassembled PDU]"
"16.061123","5.9.29.183","172.19.0.3","TLSv1.2","1237","Application Data"
"16.061209","172.19.0.3","5.9.29.183","TCP","56","43520 → 9002 [ACK] Seq=28150 Ack=527157 Win=11895 Len=0"
"16.076647","5.9.29.183","172.19.0.3","TLSv1.2","149","Application Data"
"16.080130","5.9.29.183","172.19.0.3","TCP","1516","[TCP segment of a reassembled PDU]"
"16.080141","172.19.0.3","5.9.29.183","TCP","56","43520 → 9002 [ACK] Seq=28150 Ack=528710 Win=11911 Len=0"
"16.080148","5.9.29.183","172.19.0.3","TCP","1492","9002 → 43520 [PSH, ACK] Seq=528710 Ack=28150 Win=65535 Len=1436 [TCP segment of a reassembled PDU]"
"16.092235","5.9.29.183","172.19.0.3","TLSv1.2","787","Application Data"
"16.092258","172.19.0.3","5.9.29.183","TCP","56","43520 → 9002 [ACK] Seq=28150 Ack=530877 Win=11911 Len=0"
"16.136702","5.9.29.183","172.19.0.3","TCP","1504","[TCP segment of a reassembled PDU]"
"16.136882","5.9.29.183","172.19.0.3","TCP","1504","9002 → 43520 [PSH, ACK] Seq=532325 Ack=28150 Win=65535 Len=1448 [TCP segment of a reassembled PDU]"
"16.136919","172.19.0.3","5.9.29.183","TCP","56","43520 → 9002 [ACK] Seq=28150 Ack=533773 Win=11911 Len=0"
"16.136974","5.9.29.183","172.19.0.3","TLSv1.2","787","Application Data"
"16.150190","5.9.29.183","172.19.0.3","TCP","1516","[TCP segment of a reassembled PDU]"
"16.150210","172.19.0.3","5.9.29.183","TCP","56","43520 → 9002 [ACK] Seq=28150 Ack=535964 Win=11911 Len=0"
"16.150222","5.9.29.183","172.19.0.3","TCP","1492","9002 → 43520 [PSH, ACK] Seq=535964 Ack=28150 Win=65535 Len=1436 [TCP segment of a reassembled PDU]"
"16.150644","5.9.29.183","172.19.0.3","TLSv1.2","1516","Application Data [TCP segment of a reassembled PDU]"
"16.150653","172.19.0.3","5.9.29.183","TCP","56","43520 → 9002 [ACK] Seq=28150 Ack=538860 Win=11911 Len=0"
"16.150658","5.9.29.183","172.19.0.3","TCP","1516","9002 → 43520 [PSH, ACK] Seq=538860 Ack=28150 Win=65535 Len=1460 [TCP segment of a reassembled PDU]"
"16.150662","5.9.29.183","172.19.0.3","TCP","1480","9002 → 43520 [PSH, ACK] Seq=540320 Ack=28150 Win=65535 Len=1424 [TCP segment of a reassembled PDU]"
"16.150751","172.19.0.3","5.9.29.183","TCP","56","43520 → 9002 [ACK] Seq=28150 Ack=541744 Win=11895 Len=0"
"16.152277","5.9.29.183","172.19.0.3","TLSv1.2","584","Application Data"
"16.176892","5.9.29.183","172.19.0.3","TCP","1516","[TCP segment of a reassembled PDU]"
"16.176909","172.19.0.3","5.9.29.183","TCP","56","43520 → 9002 [ACK] Seq=28150 Ack=543732 Win=11911 Len=0"
"16.176921","5.9.29.183","172.19.0.3","TCP","1492","9002 → 43520 [PSH, ACK] Seq=543732 Ack=28150 Win=65535 Len=1436 [TCP segment of a reassembled PDU]"
"16.177318","5.9.29.183","172.19.0.3","TLSv1.2","787","Application Data"
"16.177325","172.19.0.3","5.9.29.183","TCP","56","43520 → 9002 [ACK] Seq=28150 Ack=545899 Win=11911 Len=0"
"16.189415","5.9.29.183","172.19.0.3","TCP","1516","[TCP segment of a reassembled PDU]"
"16.189443","5.9.29.183","172.19.0.3","TCP","1492","9002 → 43520 [PSH, ACK] Seq=547359 Ack=28150 Win=65535 Len=1436 [TCP segment of a reassembled PDU]"
"16.189620","172.19.0.3","5.9.29.183","TCP","56","43520 → 9002 [ACK] Seq=28150 Ack=548795 Win=11903 Len=0"
"16.189716","5.9.29.183","172.19.0.3","TLSv1.2","1516","Application Data [TCP segment of a reassembled PDU]"
"16.189768","5.9.29.183","172.19.0.3","TCP","1492","9002 → 43520 [PSH, ACK] Seq=550255 Ack=28150 Win=65535 Len=1436 [TCP segment of a reassembled PDU]"
"16.189797","172.19.0.3","5.9.29.183","TCP","56","43520 → 9002 [ACK] Seq=28150 Ack=551691 Win=11887 Len=0"
"16.190003","5.9.29.183","172.19.0.3","TCP","1516","9002 → 43520 [PSH, ACK] Seq=551691 Ack=28150 Win=65535 Len=1460 [TCP segment of a reassembled PDU]"
"16.190010","5.9.29.183","172.19.0.3","TLSv1.2","1516","Application Data [TCP segment of a reassembled PDU]"
"16.190070","5.9.29.183","172.19.0.3","TCP","1480","9002 → 43520 [PSH, ACK] Seq=554611 Ack=28150 Win=65535 Len=1424 [TCP segment of a reassembled PDU]"
"16.190183","172.19.0.3","5.9.29.183","TLSv1.2","599","Application Data"
"16.190400","5.9.29.183","172.19.0.3","TCP","56","9002 → 43520 [ACK] Seq=556035 Ack=28693 Win=65535 Len=0"
"16.192279","5.9.29.183","172.19.0.3","TCP","1504","9002 → 43520 [PSH, ACK] Seq=556035 Ack=28693 Win=65535 Len=1448 [TCP segment of a reassembled PDU]"
"16.192871","5.9.29.183","172.19.0.3","TLSv1.2","381","Application Data"
"16.192886","172.19.0.3","5.9.29.183","TCP","56","43520 → 9002 [ACK] Seq=28693 Ack=557808 Win=11909 Len=0"
"16.220458","5.9.29.183","172.19.0.3","TLSv1.2","1113","Application Data"
"16.242256","5.9.29.183","172.19.0.3","TCP","1516","[TCP segment of a reassembled PDU]"
"16.242275","172.19.0.3","5.9.29.183","TCP","56","43520 → 9002 [ACK] Seq=28693 Ack=560325 Win=11911 Len=0"
"16.242289","5.9.29.183","172.19.0.3","TCP","1516","9002 → 43520 [PSH, ACK] Seq=560325 Ack=28693 Win=65535 Len=1460 [TCP segment of a reassembled PDU]"
"16.242297","5.9.29.183","172.19.0.3","TLSv1.2","763","Application Data"
"16.242473","172.19.0.3","5.9.29.183","TCP","56","43520 → 9002 [ACK] Seq=28693 Ack=562492 Win=11895 Len=0"
"16.258039","5.9.29.183","172.19.0.3","TCP","1504","[TCP segment of a reassembled PDU]"
"16.258076","5.9.29.183","172.19.0.3","TCP","1516","9002 → 43520 [PSH, ACK] Seq=563940 Ack=28693 Win=65535 Len=1460 [TCP segment of a reassembled PDU]"
"16.258086","172.19.0.3","5.9.29.183","TCP","56","43520 → 9002 [ACK] Seq=28693 Ack=565400 Win=11903 Len=0"
"16.258163","5.9.29.183","172.19.0.3","TLSv1.2","1225","Application Data"
"16.258169","5.9.29.183","172.19.0.3","TCP","1504","[TCP segment of a reassembled PDU]"
"16.258221","172.19.0.3","5.9.29.183","TCP","56","43520 → 9002 [ACK] Seq=28693 Ack=568017 Win=11887 Len=0"
"16.258327","5.9.29.183","172.19.0.3","TLSv1.2","1516","Application Data [TCP segment of a reassembled PDU]"
"16.258374","5.9.29.183","172.19.0.3","TCP","1516","9002 → 43520 [PSH, ACK] Seq=569477 Ack=28693 Win=65535 Len=1460 [TCP segment of a reassembled PDU]"
"16.258378","5.9.29.183","172.19.0.3","TCP","1516","9002 → 43520 [PSH, ACK] Seq=570937 Ack=28693 Win=65535 Len=1460 [TCP segment of a reassembled PDU]"
"16.258412","5.9.29.183","172.19.0.3","TLSv1.2","1468","Application Data [TCP segment of a reassembled PDU]"
"16.258537","172.19.0.3","5.9.29.183","TLSv1.2","599","Application Data"
"16.258711","5.9.29.183","172.19.0.3","TCP","56","9002 → 43520 [ACK] Seq=573809 Ack=29236 Win=65535 Len=0"
"16.259564","5.9.29.183","172.19.0.3","TCP","327","9002 → 43520 [PSH, ACK] Seq=573809 Ack=29236 Win=65535 Len=271 [TCP segment of a reassembled PDU]"
"16.259666","5.9.29.183","172.19.0.3","TCP","1516","9002 → 43520 [PSH, ACK] Seq=574080 Ack=29236 Win=65535 Len=1460 [TCP segment of a reassembled PDU]"
"16.259679","172.19.0.3","5.9.29.183","TCP","56","43520 → 9002 [ACK] Seq=29236 Ack=575540 Win=11903 Len=0"
"16.259682","5.9.29.183","172.19.0.3","TCP","1221","9002 → 43520 [PSH, ACK] Seq=575540 Ack=29236 Win=65535 Len=1165 [TCP segment of a reassembled PDU]"
"16.274504","5.9.29.183","172.19.0.3","TLSv1.2","1408","Application Data, Application Data"
"16.274522","172.19.0.3","5.9.29.183","TCP","56","43520 → 9002 [ACK] Seq=29236 Ack=578057 Win=11911 Len=0"
"16.274846","172.19.0.3","5.9.29.183","TLSv1.2","599","Application Data"
"16.275091","5.9.29.183","172.19.0.3","TCP","56","9002 → 43520 [ACK] Seq=578057 Ack=29779 Win=65535 Len=0"
"16.279682","5.9.29.183","172.19.0.3","TCP","1516","[TCP segment of a reassembled PDU]"
"16.279702","5.9.29.183","172.19.0.3","TCP","1492","9002 → 43520 [PSH, ACK] Seq=579517 Ack=29779 Win=65535 Len=1436 [TCP segment of a reassembled PDU]"
"16.279783","172.19.0.3","5.9.29.183","TCP","56","43520 → 9002 [ACK] Seq=29779 Ack=580953 Win=11903 Len=0"
"16.280043","5.9.29.183","172.19.0.3","TLSv1.2","1516","Application Data [TCP segment of a reassembled PDU]"
"16.280051","5.9.29.183","172.19.0.3","TCP","1492","9002 → 43520 [PSH, ACK] Seq=582413 Ack=29779 Win=65535 Len=1436 [TCP segment of a reassembled PDU]"
"16.280054","5.9.29.183","172.19.0.3","TCP","1504","9002 → 43520 [PSH, ACK] Seq=583849 Ack=29779 Win=65535 Len=1448 [TCP segment of a reassembled PDU]"
"16.280090","172.19.0.3","5.9.29.183","TCP","56","43520 → 9002 [ACK] Seq=29779 Ack=585297 Win=11893 Len=0"
"16.280297","5.9.29.183","172.19.0.3","TLSv1.2","1516","Application Data [TCP segment of a reassembled PDU]"
"16.280300","5.9.29.183","172.19.0.3","TCP","1492","9002 → 43520 [PSH, ACK] Seq=586757 Ack=29779 Win=65535 Len=1436 [TCP segment of a reassembled PDU]"
"16.280304","172.19.0.3","5.9.29.183","TCP","56","43520 → 9002 [ACK] Seq=29779 Ack=588193 Win=11903 Len=0"
"16.290177","5.9.29.183","172.19.0.3","TCP","1504","9002 → 43520 [PSH, ACK] Seq=588193 Ack=29779 Win=65535 Len=1448 [TCP segment of a reassembled PDU]"
"16.290199","5.9.29.183","172.19.0.3","TLSv1.2","1516","Application Data [TCP segment of a reassembled PDU]"
"16.290209","172.19.0.3","5.9.29.183","TCP","56","43520 → 9002 [ACK] Seq=29779 Ack=591101 Win=11903 Len=0"
"16.290211","5.9.29.183","172.19.0.3","TCP","1516","9002 → 43520 [PSH, ACK] Seq=591101 Ack=29779 Win=65535 Len=1460 [TCP segment of a reassembled PDU]"
"16.290213","5.9.29.183","172.19.0.3","TCP","1480","9002 → 43520 [PSH, ACK] Seq=592561 Ack=29779 Win=65535 Len=1424 [TCP segment of a reassembled PDU]"
"16.290320","172.19.0.3","5.9.29.183","TCP","56","43520 → 9002 [ACK] Seq=29779 Ack=593985 Win=11887 Len=0"
"16.305270","5.9.29.183","172.19.0.3","TLSv1.2","178","Application Data"
"16.334909","172.19.0.3","5.9.29.183","TLSv1.2","599","Application Data"
"16.335250","5.9.29.183","172.19.0.3","TCP","56","9002 → 43520 [ACK] Seq=594107 Ack=30322 Win=65535 Len=0"
"16.344191","172.19.0.3","5.9.29.183","TLSv1.2","599","Application Data"
"16.344382","5.9.29.183","172.19.0.3","TCP","56","9002 → 43520 [ACK] Seq=594107 Ack=30865 Win=65535 Len=0"
"16.416131","5.9.29.183","172.19.0.3","TLSv1.2","599","Application Data"
"16.457161","172.19.0.3","5.9.29.183","TCP","56","43520 → 9002 [ACK] Seq=30865 Ack=594650 Win=11911 Len=0"
"16.968697","5.9.29.183","172.19.0.3","TLSv1.2","599","Application Data"
"16.968777","172.19.0.3","5.9.29.183","TCP","56","43520 → 9002 [ACK] Seq=30865 Ack=595193 Win=11911 Len=0"
"16.969715","172.19.0.3","5.9.29.183","TLSv1.2","599","Application Data"
"16.970017","5.9.29.183","172.19.0.3","TCP","56","9002 → 43520 [ACK] Seq=595193 Ack=31408 Win=65535 Len=0"
"17.808670","5.9.29.183","172.19.0.3","TCP","1516","[TCP segment of a reassembled PDU]"
"17.808754","5.9.29.183","172.19.0.3","TCP","1516","9002 → 43520 [PSH, ACK] Seq=596653 Ack=31408 Win=65535 Len=1460 [TCP segment of a reassembled PDU]"
"17.808766","5.9.29.183","172.19.0.3","TLSv1.2","763","Application Data"
"17.808804","5.9.29.183","172.19.0.3","TLSv1.2","1516","Application Data"
"17.808877","5.9.29.183","172.19.0.3","TCP","1492","9002 → 43520 [PSH, ACK] Seq=600280 Ack=31408 Win=65535 Len=1436 [TCP segment of a reassembled PDU]"
"17.808897","172.19.0.3","5.9.29.183","TCP","56","43520 → 9002 [ACK] Seq=31408 Ack=600280 Win=11887 Len=0"
"17.808950","5.9.29.183","172.19.0.3","TCP","1516","9002 → 43520 [PSH, ACK] Seq=601716 Ack=31408 Win=65535 Len=1460 [TCP segment of a reassembled PDU]"
"17.808954","5.9.29.183","172.19.0.3","TLSv1.2","1516","Application Data [TCP segment of a reassembled PDU]"
"17.808956","5.9.29.183","172.19.0.3","TCP","1480","9002 → 43520 [PSH, ACK] Seq=604636 Ack=31408 Win=65535 Len=1424 [TCP segment of a reassembled PDU]"
"17.809021","172.19.0.3","5.9.29.183","TCP","56","43520 → 9002 [ACK] Seq=31408 Ack=606060 Win=11855 Len=0"
"17.809033","5.9.29.183","172.19.0.3","TLSv1.2","1516","Application Data [TCP segment of a reassembled PDU]"
"17.809366","5.9.29.183","172.19.0.3","TCP","1492","9002 → 43520 [PSH, ACK] Seq=607520 Ack=31408 Win=65535 Len=1436 [TCP segment of a reassembled PDU]"
"17.809376","5.9.29.183","172.19.0.3","TCP","1504","9002 → 43520 [PSH, ACK] Seq=608956 Ack=31408 Win=65535 Len=1448 [TCP segment of a reassembled PDU]"
"17.809385","172.19.0.3","5.9.29.183","TCP","56","43520 → 9002 [ACK] Seq=31408 Ack=608956 Win=11838 Len=0"
"17.825320","5.9.29.183","172.19.0.3","TLSv1.2","1516","Application Data [TCP segment of a reassembled PDU]"
"17.825338","172.19.0.3","5.9.29.183","TCP","56","43520 → 9002 [ACK] Seq=31408 Ack=611864 Win=11911 Len=0"
"17.825372","5.9.29.183","172.19.0.3","TCP","1492","9002 → 43520 [PSH, ACK] Seq=611864 Ack=31408 Win=65535 Len=1436 [TCP segment of a reassembled PDU]"
"17.825648","5.9.29.183","172.19.0.3","TCP","1504","9002 → 43520 [PSH, ACK] Seq=613300 Ack=31408 Win=65535 Len=1448 [TCP segment of a reassembled PDU]"
"17.825652","5.9.29.183","172.19.0.3","TLSv1.2","1516","Application Data, Application Data"
"17.825662","172.19.0.3","5.9.29.183","TCP","56","43520 → 9002 [ACK] Seq=31408 Ack=614748 Win=11911 Len=0"
"17.825733","5.9.29.183","172.19.0.3","TCP","1492","9002 → 43520 [PSH, ACK] Seq=616208 Ack=31408 Win=65535 Len=1436 [TCP segment of a reassembled PDU]"
"17.825740","5.9.29.183","172.19.0.3","TCP","1504","9002 → 43520 [PSH, ACK] Seq=617644 Ack=31408 Win=65535 Len=1448 [TCP segment of a reassembled PDU]"
"17.825796","172.19.0.3","5.9.29.183","TCP","56","43520 → 9002 [ACK] Seq=31408 Ack=619092 Win=11887 Len=0"
"17.826093","5.9.29.183","172.19.0.3","TLSv1.2","1504","Application Data [TCP segment of a reassembled PDU]"
"17.826220","5.9.29.183","172.19.0.3","TCP","1516","9002 → 43520 [PSH, ACK] Seq=620540 Ack=31408 Win=65535 Len=1460 [TCP segment of a reassembled PDU]"
"17.826231","172.19.0.3","5.9.29.183","TCP","56","43520 → 9002 [ACK] Seq=31408 Ack=622000 Win=11903 Len=0"
"17.826234","5.9.29.183","172.19.0.3","TLSv1.2","1516","Application Data, Application Data"
"17.826314","5.9.29.183","172.19.0.3","TLSv1.2","1406","Application Data"
"17.826377","172.19.0.3","5.9.29.183","TLSv1.2","599","Application Data"
"17.826567","5.9.29.183","172.19.0.3","TCP","56","9002 → 43520 [ACK] Seq=624810 Ack=31951 Win=65535 Len=0"
"17.836703","172.19.0.3","5.9.29.183","TLSv1.2","599","Application Data"
"17.837087","5.9.29.183","172.19.0.3","TCP","56","9002 → 43520 [ACK] Seq=624810 Ack=32494 Win=65535 Len=0"
"17.842185","5.9.29.183","172.19.0.3","TCP","1504","[TCP segment of a reassembled PDU]"
"17.842803","5.9.29.183","172.19.0.3","TCP","1516","9002 → 43520 [PSH, ACK] Seq=626258 Ack=32494 Win=65535 Len=1460 [TCP segment of a reassembled PDU]"
"17.842813","172.19.0.3","5.9.29.183","TCP","56","43520 → 9002 [ACK] Seq=32494 Ack=627718 Win=11911 Len=0"
"17.842838","5.9.29.183","172.19.0.3","TLSv1.2","1492","Application Data [TCP segment of a reassembled PDU]"
"17.842887","5.9.29.183","172.19.0.3","TCP","1504","9002 → 43520 [PSH, ACK] Seq=629154 Ack=32494 Win=65535 Len=1448 [TCP segment of a reassembled PDU]"
"17.842901","172.19.0.3","5.9.29.183","TCP","56","43520 → 9002 [ACK] Seq=32494 Ack=630602 Win=11895 Len=0"
"17.843493","5.9.29.183","172.19.0.3","TCP","1516","9002 → 43520 [PSH, ACK] Seq=630602 Ack=32494 Win=65535 Len=1460 [TCP segment of a reassembled PDU]"
"17.843524","5.9.29.183","172.19.0.3","TLSv1.2","1516","Application Data [TCP segment of a reassembled PDU]"
"17.843562","172.19.0.3","5.9.29.183","TCP","56","43520 → 9002 [ACK] Seq=32494 Ack=633522 Win=11903 Len=0"
"17.843565","5.9.29.183","172.19.0.3","TCP","1516","9002 → 43520 [PSH, ACK] Seq=633522 Ack=32494 Win=65535 Len=1460 [TCP segment of a reassembled PDU]"
"17.843568","5.9.29.183","172.19.0.3","TCP","1468","9002 → 43520 [PSH, ACK] Seq=634982 Ack=32494 Win=65535 Len=1412 [TCP segment of a reassembled PDU]"
"17.843584","172.19.0.3","5.9.29.183","TCP","56","43520 → 9002 [ACK] Seq=32494 Ack=636394 Win=11887 Len=0"
"17.843662","5.9.29.183","172.19.0.3","TLSv1.2","1504","Application Data [TCP segment of a reassembled PDU]"
"17.843739","5.9.29.183","172.19.0.3","TCP","1504","9002 → 43520 [PSH, ACK] Seq=637842 Ack=32494 Win=65535 Len=1448 [TCP segment of a reassembled PDU]"
"17.843763","172.19.0.3","5.9.29.183","TCP","56","43520 → 9002 [ACK] Seq=32494 Ack=639290 Win=11869 Len=0"
"17.843908","5.9.29.183","172.19.0.3","TCP","382","9002 → 43520 [PSH, ACK] Seq=639290 Ack=32494 Win=65535 Len=326 [TCP segment of a reassembled PDU]"
"17.843935","5.9.29.183","172.19.0.3","TCP","1516","9002 → 43520 [PSH, ACK] Seq=639616 Ack=32494 Win=65535 Len=1460 [TCP segment of a reassembled PDU]"
"17.843943","172.19.0.3","5.9.29.183","TCP","56","43520 → 9002 [ACK] Seq=32494 Ack=641076 Win=11903 Len=0"
"17.843944","5.9.29.183","172.19.0.3","TLSv1.2","383","Application Data, Application Data"
"17.853229","5.9.29.183","172.19.0.3","TLSv1.2","1504","Application Data"
"17.853243","172.19.0.3","5.9.29.183","TCP","56","43520 → 9002 [ACK] Seq=32494 Ack=642851 Win=11911 Len=0"
"17.859520","5.9.29.183","172.19.0.3","TCP","1504","9002 → 43520 [PSH, ACK] Seq=642851 Ack=32494 Win=65535 Len=1448 [TCP segment of a reassembled PDU]"
"17.859909","5.9.29.183","172.19.0.3","TCP","1516","9002 → 43520 [PSH, ACK] Seq=644299 Ack=32494 Win=65535 Len=1460 [TCP segment of a reassembled PDU]"
"17.859982","172.19.0.3","5.9.29.183","TCP","56","43520 → 9002 [ACK] Seq=32494 Ack=645759 Win=11911 Len=0"
"17.860185","5.9.29.183","172.19.0.3","TLSv1.2","1492","Application Data [TCP segment of a reassembled PDU]"
"17.860199","5.9.29.183","172.19.0.3","TCP","1504","9002 → 43520 [PSH, ACK] Seq=647195 Ack=32494 Win=65535 Len=1448 [TCP segment of a reassembled PDU]"
"17.860231","172.19.0.3","5.9.29.183","TCP","56","43520 → 9002 [ACK] Seq=32494 Ack=648643 Win=11895 Len=0"
"17.860401","5.9.29.183","172.19.0.3","TCP","1516","9002 → 43520 [PSH, ACK] Seq=648643 Ack=32494 Win=65535 Len=1460 [TCP segment of a reassembled PDU]"
"17.860410","5.9.29.183","172.19.0.3","TLSv1.2","1516","Application Data [TCP segment of a reassembled PDU]"
"17.860500","5.9.29.183","172.19.0.3","TCP","1516","9002 → 43520 [PSH, ACK] Seq=651563 Ack=32494 Win=65535 Len=1460 [TCP segment of a reassembled PDU]"
"17.860513","172.19.0.3","5.9.29.183","TCP","56","43520 → 9002 [ACK] Seq=32494 Ack=651563 Win=11879 Len=0"
"17.860566","5.9.29.183","172.19.0.3","TCP","1516","9002 → 43520 [PSH, ACK] Seq=653023 Ack=32494 Win=65535 Len=1460 [TCP segment of a reassembled PDU]"
"17.860575","5.9.29.183","172.19.0.3","TLSv1.2","1456","Application Data [TCP segment of a reassembled PDU]"
"17.860586","172.19.0.3","5.9.29.183","TCP","56","43520 → 9002 [ACK] Seq=32494 Ack=654483 Win=11863 Len=0"
"17.860691","5.9.29.183","172.19.0.3","TLSv1.2","1141","Application Data"
"17.860975","172.19.0.3","5.9.29.183","TLSv1.2","599","Application Data"
"17.861242","5.9.29.183","172.19.0.3","TCP","56","9002 → 43520 [ACK] Seq=656968 Ack=33037 Win=65535 Len=0"
