_ws.col.Time,_ws.col.Source,_ws.col.Destination,_ws.col.Protocol,_ws.col.Length,_ws.col.Info
"0.000000","172.19.0.3","5.9.29.183","TLSv1.2","599","Application Data"
"0.000357","5.9.29.183","172.19.0.3","TCP","56","9002 → 43520 [ACK] Seq=1 Ack=544 Win=65535 Len=0"
"0.255259","5.9.29.183","172.19.0.3","TLSv1.2","599","Application Data"
"0.256232","172.19.0.3","5.9.29.183","TLSv1.2","2141","Application Data"
"0.256717","5.9.29.183","172.19.0.3","TCP","56","9002 → 43520 [ACK] Seq=544 Ack=2629 Win=65535 Len=0"
"0.758345","5.9.29.183","172.19.0.3","TCP","1213","[TCP segment of a reassembled PDU]"
"0.758449","5.9.29.183","172.19.0.3","TLSv1.2","470","Application Data"
"0.758608","172.19.0.3","5.9.29.183","TCP","56","43520 → 9002 [ACK] Seq=2629 Ack=2115 Win=11903 Len=0"
"0.762397","172.19.0.3","5.9.29.183","TLSv1.2","599","Application Data"
"0.762679","5.9.29.183","172.19.0.3","TCP","56","9002 → 43520 [ACK] Seq=2115 Ack=3172 Win=65535 Len=0"
"1.013751","5.9.29.183","172.19.0.3","TLSv1.2","599","Application Data"
"1.014611","172.19.0.3","5.9.29.183","TLSv1.2","599","Application Data"
"1.015018","5.9.29.183","172.19.0.3","TCP","56","9002 → 43520 [ACK] Seq=2658 Ack=3715 Win=65535 Len=0"
"1.307839","5.9.29.183","172.19.0.3","TLSv1.2","599","Application Data"
"1.355178","172.19.0.3","5.9.29.183","TCP","56","43520 → 9002 [ACK] Seq=3715 Ack=3201 Win=11911 Len=0"
"1.357264","5.9.29.183","172.19.0.3","TCP","1504","[TCP segment of a reassembled PDU]"
"1.357289","172.19.0.3","5.9.29.183","TCP","56","43520 → 9002 [ACK] Seq=3715 Ack=4649 Win=11911 Len=0"
"1.357420","5.9.29.183","172.19.0.3","TCP","1504","9002 → 43520 [PSH, ACK] Seq=4649 Ack=3715 Win=65535 Len=1448 [TCP segment of a reassembled PDU]"
"1.357450","172.19.0.3","5.9.29.183","TCP","56","43520 → 9002 [ACK] Seq=3715 Ack=6097 Win=11903 Len=0"
"1.357456","5.9.29.183","172.19.0.3","TLSv1.2","787","Application Data"
"1.357464","172.19.0.3","5.9.29.183","TCP","56","43520 → 9002 [ACK] Seq=3715 Ack=6828 Win=11898 Len=0"
"1.369257","5.9.29.183","172.19.0.3","TCP","1504","[TCP segment of a reassembled PDU]"
"1.369287","172.19.0.3","5.9.29.183","TCP","56","43520 → 9002 [ACK] Seq=3715 Ack=8276 Win=11911 Len=0"
"1.369530","5.9.29.183","172.19.0.3","TCP","1504","9002 → 43520 [PSH, ACK] Seq=8276 Ack=3715 Win=65535 Len=1448 [TCP segment of a reassembled PDU]"
"1.369557","172.19.0.3","5.9.29.183","TCP","56","43520 → 9002 [ACK] Seq=3715 Ack=9724 Win=11911 Len=0"
"1.372956","5.9.29.183","172.19.0.3","TLSv1.2","787","Application Data"
"1.372981","172.19.0.3","5.9.29.183","TCP","56","43520 → 9002 [ACK] Seq=3715 Ack=10455 Win=11911 Len=0"
"1.388768","5.9.29.183","172.19.0.3","TLSv1.2","1113","Application Data"
"1.388795","172.19.0.3","5.9.29.183","TCP","56","43520 → 9002 [ACK] Seq=3715 Ack=11512 Win=11911 Len=0"
"1.408875","5.9.29.183","172.19.0.3","TCP","1516","[TCP segment of a reassembled PDU]"
"1.408896","172.19.0.3","5.9.29.183","TCP","56","43520 → 9002 [ACK] Seq=3715 Ack=12972 Win=11911 Len=0"
"1.408943","5.9.29.183","172.19.0.3","TLSv1.2","1195","Application Data"
"1.408957","172.19.0.3","5.9.29.183","TCP","56","43520 → 9002 [ACK] Seq=3715 Ack=14111 Win=11903 Len=0"
"1.423428","5.9.29.183","172.19.0.3","TCP","1504","[TCP segment of a reassembled PDU]"
"1.423480","172.19.0.3","5.9.29.183","TCP","56","43520 → 9002 [ACK] Seq=3715 Ack=15559 Win=11911 Len=0"
"1.423649","5.9.29.183","172.19.0.3","TLSv1.2","1207","Application Data"
"1.423662","172.19.0.3","5.9.29.183","TCP","56","43520 → 9002 [ACK] Seq=3715 Ack=16710 Win=11903 Len=0"
"1.454264","5.9.29.183","172.19.0.3","TCP","1516","[TCP segment of a reassembled PDU]"
"1.454290","172.19.0.3","5.9.29.183","TCP","56","43520 → 9002 [ACK] Seq=3715 Ack=18170 Win=11911 Len=0"
"1.454353","5.9.29.183","172.19.0.3","TLSv1.2","1195","Application Data"
"1.454373","172.19.0.3","5.9.29.183","TCP","56","43520 → 9002 [ACK] Seq=3715 Ack=19309 Win=11903 Len=0"
"2.004599","5.9.29.183","172.19.0.3","TCP","1516","[TCP segment of a reassembled PDU]"
"2.004624","172.19.0.3","5.9.29.183","TCP","56","43520 → 9002 [ACK] Seq=3715 Ack=20769 Win=11911 Len=0"
"2.004743","5.9.29.183","172.19.0.3","TCP","1516","9002 → 43520 [PSH, ACK] Seq=20769 Ack=3715 Win=65535 Len=1460 [TCP segment of a reassembled PDU]"
"2.004761","172.19.0.3","5.9.29.183","TCP","56","43520 → 9002 [ACK] Seq=3715 Ack=22229 Win=11901 Len=0"
"2.004763","5.9.29.183","172.19.0.3","TLSv1.2","1516","Application Data [TCP segment of a reassembled PDU]"
"2.004769","172.19.0.3","5.9.29.183","TCP","56","43520 → 9002 [ACK] Seq=3715 Ack=23689 Win=11893 Len=0"
"2.004770","5.9.29.183","172.19.0.3","TCP","751","9002 → 43520 [PSH, ACK] Seq=23689 Ack=3715 Win=65535 Len=695 [TCP segment of a reassembled PDU]"
"2.004777","172.19.0.3","5.9.29.183","TCP","56","43520 → 9002 [ACK] Seq=3715 Ack=24384 Win=11888 Len=0"
"2.005036","5.9.29.183","172.19.0.3","TCP","1516","9002 → 43520 [PSH, ACK] Seq=24384 Ack=3715 Win=65535 Len=1460 [TCP segment of a reassembled PDU]"
"2.005045","172.19.0.3","5.9.29.183","TCP","56","43520 → 9002 [ACK] Seq=3715 Ack=25844 Win=11877 Len=0"
"2.005048","5.9.29.183","172.19.0.3","TLSv1.2","1516","Application Data [TCP segment of a reassembled PDU]"
"2.005054","172.19.0.3","5.9.29.183","TCP","56","43520 → 9002 [ACK] Seq=3715 Ack=27304 Win=11869 Len=0"
"2.005056","5.9.29.183","172.19.0.3","TLSv1.2","1516","Application Data [TCP segment of a reassembled PDU]"
"2.005061","172.19.0.3","5.9.29.183","TCP","56","43520 → 9002 [ACK] Seq=3715 Ack=28764 Win=11861 Len=0"
"2.005062","5.9.29.183","172.19.0.3","TCP","1516","9002 → 43520 [PSH, ACK] Seq=28764 Ack=3715 Win=65535 Len=1460 [TCP segment of a reassembled PDU]"
"2.005068","172.19.0.3","5.9.29.183","TCP","56","43520 → 9002 [ACK] Seq=3715 Ack=30224 Win=11853 Len=0"
"2.005069","5.9.29.183","172.19.0.3","TLSv1.2","1516","Application Data [TCP segment of a reassembled PDU]"
"2.005073","172.19.0.3","5.9.29.183","TCP","56","43520 → 9002 [ACK] Seq=3715 Ack=31684 Win=11845 Len=0"
"2.005075","5.9.29.183","172.19.0.3","TLSv1.2","1516","Application Data [TCP segment of a reassembled PDU]"
"2.005080","172.19.0.3","5.9.29.183","TCP","56","43520 → 9002 [ACK] Seq=3715 Ack=33144 Win=11836 Len=0"
"2.005081","5.9.29.183","172.19.0.3","TLSv1.2","787","Application Data"
"2.005086","172.19.0.3","5.9.29.183","TCP","56","43520 → 9002 [ACK] Seq=3715 Ack=33875 Win=11831 Len=0"
"2.005519","172.19.0.3","5.9.29.183","TLSv1.2","599","Application Data"
"2.005766","5.9.29.183","172.19.0.3","TCP","56","9002 → 43520 [ACK] Seq=33875 Ack=4258 Win=65535 Len=0"
"2.014857","172.19.0.3","5.9.29.183","TLSv1.2","1113","Application Data"
"2.015088","5.9.29.183","172.19.0.3","TCP","56","9002 → 43520 [ACK] Seq=33875 Ack=5315 Win=65535 Len=0"
"2.377565","5.9.29.183","172.19.0.3","TLSv1.2","599","Application Data"
"2.378510","172.19.0.3","5.9.29.183","TLSv1.2","599","Application Data"
"2.378875","5.9.29.183","172.19.0.3","TCP","56","9002 → 43520 [ACK] Seq=34418 Ack=5858 Win=65535 Len=0"
"2.613326","5.9.29.183","172.19.0.3","TLSv1.2","599","Application Data"
"2.657477","172.19.0.3","5.9.29.183","TCP","56","43520 → 9002 [ACK] Seq=5858 Ack=34961 Win=11911 Len=0"
"2.929200","5.9.29.183","172.19.0.3","TCP","1516","[TCP segment of a reassembled PDU]"
"2.929223","172.19.0.3","5.9.29.183","TCP","56","43520 → 9002 [ACK] Seq=5858 Ack=36421 Win=11911 Len=0"
"2.929283","5.9.29.183","172.19.0.3","TCP","1516","9002 → 43520 [PSH, ACK] Seq=36421 Ack=5858 Win=65535 Len=1460 [TCP segment of a reassembled PDU]"
"2.929303","172.19.0.3","5.9.29.183","TCP","56","43520 → 9002 [ACK] Seq=5858 Ack=37881 Win=11903 Len=0"
"2.929305","5.9.29.183","172.19.0.3","TLSv1.2","1516","Application Data [TCP segment of a reassembled PDU]"
"2.929313","172.19.0.3","5.9.29.183","TCP","56","43520 → 9002 [ACK] Seq=5858 Ack=39341 Win=11895 Len=0"
"2.929315","5.9.29.183","172.19.0.3","TCP","237","9002 → 43520 [PSH, ACK] Seq=39341 Ack=5858 Win=65535 Len=181 [TCP segment of a reassembled PDU]"
"2.929323","172.19.0.3","5.9.29.183","TCP","56","43520 → 9002 [ACK] Seq=5858 Ack=39522 Win=11894 Len=0"
"2.931618","5.9.29.183","172.19.0.3","TLSv1.2","1504","Application Data [TCP segment of a reassembled PDU]"
"2.931630","172.19.0.3","5.9.29.183","TCP","56","43520 → 9002 [ACK] Seq=5858 Ack=40970 Win=11911 Len=0"
"2.931762","5.9.29.183","172.19.0.3","TCP","1504","9002 → 43520 [PSH, ACK] Seq=40970 Ack=5858 Win=65535 Len=1448 [TCP segment of a reassembled PDU]"
"2.931771","172.19.0.3","5.9.29.183","TCP","56","43520 → 9002 [ACK] Seq=5858 Ack=42418 Win=11903 Len=0"
"2.931833","5.9.29.183","172.19.0.3","TCP","1504","9002 → 43520 [PSH, ACK] Seq=42418 Ack=5858 Win=65535 Len=1448 [TCP segment of a reassembled PDU]"
"2.931841","172.19.0.3","5.9.29.183","TCP","56","43520 → 9002 [ACK] Seq=5858 Ack=43866 Win=11895 Len=0"
"2.948870","5.9.29.183","172.19.0.3","TLSv1.2","490","Application Data"
"2.948898","172.19.0.3","5.9.29.183","TCP","56","43520 → 9002 [ACK] Seq=5858 Ack=44300 Win=11911 Len=0"
"2.964150","5.9.29.183","172.19.0.3","TLSv1.2","599","Application Data"
"2.964174","172.19.0.3","5.9.29.183","TCP","56","43520 → 9002 [ACK] Seq=5858 Ack=44843 Win=11909 Len=0"
"2.978516","5.9.29.183","172.19.0.3","TCP","1504","[TCP segment of a reassembled PDU]"
"2.978571","172.19.0.3","5.9.29.183","TCP","56","43520 → 9002 [ACK] Seq=5858 Ack=46291 Win=11911 Len=0"
"2.978621","5.9.29.183","172.19.0.3","TCP","1516","9002 → 43520 [PSH, ACK] Seq=46291 Ack=5858 Win=65535 Len=1460 [TCP segment of a reassembled PDU]"
"2.978633","172.19.0.3","5.9.29.183","TCP","56","43520 → 9002 [ACK] Seq=5858 Ack=47751 Win=11903 Len=0"
"2.978636","5.9.29.183","172.19.0.3","TLSv1.2","1492","Application Data [TCP segment of a reassembled PDU]"
"2.978642","172.19.0.3","5.9.29.183","TCP","56","43520 → 9002 [ACK] Seq=5858 Ack=49187 Win=11895 Len=0"
"2.978772","5.9.29.183","172.19.0.3","TCP","1516","9002 → 43520 [PSH, ACK] Seq=49187 Ack=5858 Win=65535 Len=1460 [TCP segment of a reassembled PDU]"
"2.978780","172.19.0.3","5.9.29.183","TCP","56","43520 → 9002 [ACK] Seq=5858 Ack=50647 Win=11887 Len=0"
"2.978783","5.9.29.183","172.19.0.3","TCP","1492","9002 → 43520 [PSH, ACK] Seq=50647 Ack=5858 Win=65535 Len=1436 [TCP segment of a reassembled PDU]"
"2.978788","172.19.0.3","5.9.29.183","TCP","56","43520 → 9002 [ACK] Seq=5858 Ack=52083 Win=11879 Len=0"
"2.979748","5.9.29.183","172.19.0.3","TLSv1.2","70","Application Data"
"2.979759","172.19.0.3","5.9.29.183","TCP","56","43520 → 9002 [ACK] Seq=5858 Ack=52097 Win=11911 Len=0"
"3.013885","5.9.29.183","172.19.0.3","TLSv1.2","1113","Application Data"
"3.013910","172.19.0.3","5.9.29.183","TCP","56","43520 → 9002 [ACK] Seq=5858 Ack=53154 Win=11911 Len=0"
"3.046744","5.9.29.183","172.19.0.3","TCP","1516","[TCP segment of a reassembled PDU]"
"3.046816","5.9.29.183","172.19.0.3","TCP","1516","9002 → 43520 [PSH, ACK] Seq=54614 Ack=5858 Win=65535 Len=1460 [TCP segment of a reassembled PDU]"
"3.046827","5.9.29.183","172.19.0.3","TLSv1.2","763","Application Data"
"3.047134","172.19.0.3","5.9.29.183","TCP","56","43520 → 9002 [ACK] Seq=5858 Ack=56781 Win=11895 Len=0"
"3.058052","5.9.29.183","172.19.0.3","TCP","1516","[TCP segment of a reassembled PDU]"
"3.058121","5.9.29.183","172.19.0.3","TCP","1516","9002 → 43520 [PSH, ACK] Seq=58241 Ack=5858 Win=65535 Len=1460 [TCP segment of a reassembled PDU]"
"3.058139","172.19.0.3","5.9.29.183","TCP","56","43520 → 9002 [ACK] Seq=5858 Ack=59701 Win=11903 Len=0"
"3.058142","5.9.29.183","172.19.0.3","TLSv1.2","1516","Application Data [TCP segment of a reassembled PDU]"
"3.058146","5.9.29.183","172.19.0.3","TCP","1468","9002 → 43520 [PSH, ACK] Seq=61161 Ack=5858 Win=65535 Len=1412 [TCP segment of a reassembled PDU]"
"3.058218","5.9.29.183","172.19.0.3","TCP","1516","9002 → 43520 [PSH, ACK] Seq=62573 Ack=5858 Win=65535 Len=1460 [TCP segment of a reassembled PDU]"
"3.058225","5.9.29.183","172.19.0.3","TLSv1.2","1492","Application Data [TCP segment of a reassembled PDU]"
"3.058270","172.19.0.3","5.9.29.183","TCP","56","43520 → 9002 [ACK] Seq=5858 Ack=65469 Win=11871 Len=0"
"3.058552","172.19.0.3","5.9.29.183","TLSv1.2","599","Application Data"
"3.058942","5.9.29.183","172.19.0.3","TCP","56","9002 → 43520 [ACK] Seq=65469 Ack=6401 Win=65535 Len=0"
"3.069556","5.9.29.183","172.19.0.3","TLSv1.2","193","Application Data"
"3.073900","5.9.29.183","172.19.0.3","TCP","1504","[TCP segment of a reassembled PDU]"
"3.073931","172.19.0.3","5.9.29.183","TCP","56","43520 → 9002 [ACK] Seq=6401 Ack=67054 Win=11911 Len=0"
"3.074026","5.9.29.183","172.19.0.3","TCP","239","9002 → 43520 [PSH, ACK] Seq=67054 Ack=6401 Win=65535 Len=183 [TCP segment of a reassembled PDU]"
"3.074038","5.9.29.183","172.19.0.3","TCP","1516","9002 → 43520 [PSH, ACK] Seq=67237 Ack=6401 Win=65535 Len=1460 [TCP segment of a reassembled PDU]"
"3.074123","5.9.29.183","172.19.0.3","TLSv1.2","1516","Application Data [TCP segment of a reassembled PDU]"
"3.074127","5.9.29.183","172.19.0.3","TCP","1516","9002 → 43520 [PSH, ACK] Seq=70157 Ack=6401 Win=65535 Len=1460 [TCP segment of a reassembled PDU]"
"3.074129","5.9.29.183","172.19.0.3","TCP","1285","9002 → 43520 [PSH, ACK] Seq=71617 Ack=6401 Win=65535 Len=1229 [TCP segment of a reassembled PDU]"
"3.074136","172.19.0.3","5.9.29.183","TCP","56","43520 → 9002 [ACK] Seq=6401 Ack=68697 Win=11899 Len=0"
"3.074216","172.19.0.3","5.9.29.183","TCP","56","43520 → 9002 [ACK] Seq=6401 Ack=72846 Win=11869 Len=0"
"3.085209","5.9.29.183","172.19.0.3","TLSv1.2","1127","Application Data, Application Data"
"3.114198","5.9.29.183","172.19.0.3","TCP","1516","[TCP segment of a reassembled PDU]"
"3.114237","172.19.0.3","5.9.29.183","TCP","56","43520 → 9002 [ACK] Seq=6401 Ack=75377 Win=11911 Len=0"
"3.114287","5.9.29.183","172.19.0.3","TCP","1516","9002 → 43520 [PSH, ACK] Seq=75377 Ack=6401 Win=65535 Len=1460 [TCP segment of a reassembled PDU]"
"3.114298","5.9.29.183","172.19.0.3","TLSv1.2","763","Application Data"
"3.114450","172.19.0.3","5.9.29.183","TCP","56","43520 → 9002 [ACK] Seq=6401 Ack=77544 Win=11895 Len=0"
"3.135681","5.9.29.183","172.19.0.3","TCP","1516","[TCP segment of a reassembled PDU]"
"3.135744","5.9.29.183","172.19.0.3","TCP","1516","9002 → 43520 [PSH, ACK] Seq=79004 Ack=6401 Win=65535 Len=1460 [TCP segment of a reassembled PDU]"
"3.135767","172.19.0.3","5.9.29.183","TCP","56","43520 → 9002 [ACK] Seq=6401 Ack=80464 Win=11903 Len=0"
"3.135771","5.9.29.183","172.19.0.3","TLSv1.2","763","Application Data"
"3.151813","5.9.29.183","172.19.0.3","TCP","1516","[TCP segment of a reassembled PDU]"
"3.151835","172.19.0.3","5.9.29.183","TCP","56","43520 → 9002 [ACK] Seq=6401 Ack=82631 Win=11911 Len=0"
"3.151893","5.9.29.183","172.19.0.3","TCP","1516","9002 → 43520 [PSH, ACK] Seq=82631 Ack=6401 Win=65535 Len=1460 [TCP segment of a reassembled PDU]"
"3.151907","5.9.29.183","172.19.0.3","TLSv1.2","1213","Application Data"
"3.152091","172.19.0.3","5.9.29.183","TCP","56","43520 → 9002 [ACK] Seq=6401 Ack=85248 Win=11895 Len=0"
"3.152368","172.19.0.3","5.9.29.183","TLSv1.2","599","Application Data"
"3.152652","5.9.29.183","172.19.0.3","TCP","56","9002 → 43520 [ACK] Seq=85248 Ack=6944 Win=65535 Len=0"
"3.167887","5.9.29.183","172.19.0.3","TLSv1.2","1206","Application Data, Application Data"
"3.168402","172.19.0.3","5.9.29.183","TLSv1.2","599","Application Data"
"3.168798","5.9.29.183","172.19.0.3","TCP","56","9002 → 43520 [ACK] Seq=86398 Ack=7487 Win=65535 Len=0"
"3.183129","5.9.29.183","172.19.0.3","TCP","1516","[TCP segment of a reassembled PDU]"
"3.183200","5.9.29.183","172.19.0.3","TCP","1516","9002 → 43520 [PSH, ACK] Seq=87858 Ack=7487 Win=65535 Len=1460 [TCP segment of a reassembled PDU]"
"3.183210","5.9.29.183","172.19.0.3","TLSv1.2","763","Application Data"
"3.183363","172.19.0.3","5.9.29.183","TCP","56","43520 → 9002 [ACK] Seq=7487 Ack=90025 Win=11895 Len=0"
"3.199788","5.9.29.183","172.19.0.3","TLSv1.2","1113","Application Data"
"3.215786","5.9.29.183","172.19.0.3","TCP","1516","[TCP segment of a reassembled PDU]"
"3.215809","172.19.0.3","5.9.29.183","TCP","56","43520 → 9002 [ACK] Seq=7487 Ack=92542 Win=11911 Len=0"
"3.215867","5.9.29.183","172.19.0.3","TLSv1.2","681","Application Data"
"3.232378","5.9.29.183","172.19.0.3","TCP","1516","[TCP segment of a reassembled PDU]"
"3.232400","172.19.0.3","5.9.29.183","TCP","56","43520 → 9002 [ACK] Seq=7487 Ack=94627 Win=11911 Len=0"
"3.232449","5.9.29.183","172.19.0.3","TCP","1516","9002 → 43520 [PSH, ACK] Seq=94627 Ack=7487 Win=65535 Len=1460 [TCP segment of a reassembled PDU]"
"3.232460","5.9.29.183","172.19.0.3","TLSv1.2","763","Application Data"
"3.232607","172.19.0.3","5.9.29.183","TCP","56","43520 → 9002 [ACK] Seq=7487 Ack=96794 Win=11895 Len=0"
"3.248280","5.9.29.183","172.19.0.3","TCP","1516","[TCP segment of a reassembled PDU]"
"3.248356","5.9.29.183","172.19.0.3","TLSv1.2","1195","Application Data"
"3.248378","172.19.0.3","5.9.29.183","TCP","56","43520 → 9002 [ACK] Seq=7487 Ack=99393 Win=11903 Len=0"
"3.261493","5.9.29.183","172.19.0.3","TCP","1516","[TCP segment of a reassembled PDU]"
"3.261568","5.9.29.183","172.19.0.3","TCP","1516","9002 → 43520 [PSH, ACK] Seq=100853 Ack=7487 Win=65535 Len=1460 [TCP segment of a reassembled PDU]"
"3.261587","172.19.0.3","5.9.29.183","TCP","56","43520 → 9002 [ACK] Seq=7487 Ack=102313 Win=11903 Len=0"
"3.261591","5.9.29.183","172.19.0.3","TLSv1.2","1516","Application Data [TCP segment of a reassembled PDU]"
"3.261595","5.9.29.183","172.19.0.3","TCP","1468","9002 → 43520 [PSH, ACK] Seq=103773 Ack=7487 Win=65535 Len=1412 [TCP segment of a reassembled PDU]"
"3.261731","172.19.0.3","5.9.29.183","TCP","56","43520 → 9002 [ACK] Seq=7487 Ack=105185 Win=11887 Len=0"
"3.264396","5.9.29.183","172.19.0.3","TLSv1.2","490","Application Data"
"3.305479","172.19.0.3","5.9.29.183","TCP","56","43520 → 9002 [ACK] Seq=7487 Ack=105619 Win=11911 Len=0"
"3.310761","5.9.29.183","172.19.0.3","TCP","1516","[TCP segment of a reassembled PDU]"
"3.310831","5.9.29.183","172.19.0.3","TCP","1516","9002 → 43520 [PSH, ACK] Seq=107079 Ack=7487 Win=65535 Len=1460 [TCP segment of a reassembled PDU]"
"3.310845","5.9.29.183","172.19.0.3","TLSv1.2","763","Application Data"
"3.311115","172.19.0.3","5.9.29.183","TCP","56","43520 → 9002 [ACK] Seq=7487 Ack=109246 Win=11895 Len=0"
"3.322132","5.9.29.183","172.19.0.3","TCP","1516","[TCP segment of a reassembled PDU]"
"3.322217","5.9.29.183","172.19.0.3","TCP","1492","9002 → 43520 [PSH, ACK] Seq=110706 Ack=7487 Win=65535 Len=1436 [TCP segment of a reassembled PDU]"
"3.322234","172.19.0.3","5.9.29.183","TCP","56","43520 → 9002 [ACK] Seq=7487 Ack=112142 Win=11903 Len=0"
"3.322293","5.9.29.183","172.19.0.3","TLSv1.2","1504","Application Data [TCP segment of a reassembled PDU]"
"3.322524","172.19.0.3","5.9.29.183","TLSv1.2","599","Application Data"
"3.322773","5.9.29.183","172.19.0.3","TCP","56","9002 → 43520 [ACK] Seq=113590 Ack=8030 Win=65535 Len=0"
"3.328737","5.9.29.183","172.19.0.3","TLSv1.2","396","Application Data"
"3.371500","172.19.0.3","5.9.29.183","TCP","56","43520 → 9002 [ACK] Seq=8030 Ack=113930 Win=11911 Len=0"
"3.371846","5.9.29.183","172.19.0.3","TCP","1516","[TCP segment of a reassembled PDU]"
"3.371955","5.9.29.183","172.19.0.3","TLSv1.2","1195","Application Data"
"3.372105","172.19.0.3","5.9.29.183","TCP","56","43520 → 9002 [ACK] Seq=8030 Ack=116529 Win=11903 Len=0"
"3.377111","172.19.0.3","5.9.29.183","TLSv1.2","599","Application Data"
"3.377414","5.9.29.183","172.19.0.3","TCP","56","9002 → 43520 [ACK] Seq=116529 Ack=8573 Win=65535 Len=0"
"3.623201","5.9.29.183","172.19.0.3","TLSv1.2","599","Application Data"
"3.624005","172.19.0.3","5.9.29.183","TLSv1.2","599","Application Data"
"3.624535","5.9.29.183","172.19.0.3","TCP","56","9002 → 43520 [ACK] Seq=117072 Ack=9116 Win=65535 Len=0"
"3.919701","5.9.29.183","172.19.0.3","TCP","1516","[TCP segment of a reassembled PDU]"
"3.919808","5.9.29.183","172.19.0.3","TCP","1516","9002 → 43520 [PSH, ACK] Seq=118532 Ack=9116 Win=65535 Len=1460 [TCP segment of a reassembled PDU]"
"3.919821","5.9.29.183","172.19.0.3","TLSv1.2","763","Application Data"
"3.919957","172.19.0.3","5.9.29.183","TCP","56","43520 → 9002 [ACK] Seq=9116 Ack=120699 Win=11895 Len=0"
"3.931239","5.9.29.183","172.19.0.3","TCP","1504","[TCP segment of a reassembled PDU]"
"3.931404","5.9.29.183","172.19.0.3","TCP","1504","9002 → 43520 [PSH, ACK] Seq=122147 Ack=9116 Win=65535 Len=1448 [TCP segment of a reassembled PDU]"
"3.931420","172.19.0.3","5.9.29.183","TCP","56","43520 → 9002 [ACK] Seq=9116 Ack=123595 Win=11903 Len=0"
"3.931422","5.9.29.183","172.19.0.3","TLSv1.2","1504","Application Data [TCP segment of a reassembled PDU]"
"3.935594","5.9.29.183","172.19.0.3","TLSv1.2","1424","Application Data"
"3.935618","172.19.0.3","5.9.29.183","TCP","56","43520 → 9002 [ACK] Seq=9116 Ack=126411 Win=11911 Len=0"
"4.462789","5.9.29.183","172.19.0.3","TCP","1516","[TCP segment of a reassembled PDU]"
"4.462885","5.9.29.183","172.19.0.3","TCP","1492","9002 → 43520 [PSH, ACK] Seq=127871 Ack=9116 Win=65535 Len=1436 [TCP segment of a reassembled PDU]"
"4.462897","5.9.29.183","172.19.0.3","TLSv1.2","1516","Application Data [TCP segment of a reassembled PDU]"
"4.462931","5.9.29.183","172.19.0.3","TCP","1516","9002 → 43520 [PSH, ACK] Seq=130767 Ack=9116 Win=65535 Len=1460 [TCP segment of a reassembled PDU]"
"4.462936","5.9.29.183","172.19.0.3","TCP","602","9002 → 43520 [PSH, ACK] Seq=132227 Ack=9116 Win=65535 Len=546 [TCP segment of a reassembled PDU]"
"4.462939","5.9.29.183","172.19.0.3","TLSv1.2","977","Application Data, Application Data"
"4.463158","172.19.0.3","5.9.29.183","TCP","56","43520 → 9002 [ACK] Seq=9116 Ack=133694 Win=11871 Len=0"
"4.467442","172.19.0.3","5.9.29.183","TLSv1.2","599","Application Data"
"4.467667","5.9.29.183","172.19.0.3","TCP","56","9002 → 43520 [ACK] Seq=133694 Ack=9659 Win=65535 Len=0"
"4.740300","5.9.29.183","172.19.0.3","TLSv1.2","599","Application Data"
"4.741251","172.19.0.3","5.9.29.183","TLSv1.2","599","Application Data"
"4.741558","5.9.29.183","172.19.0.3","TCP","56","9002 → 43520 [ACK] Seq=134237 Ack=10202 Win=65535 Len=0"
"5.003395","5.9.29.183","172.19.0.3","TLSv1.2","599","Application Data"
"5.031806","5.9.29.183","172.19.0.3","TCP","1504","[TCP segment of a reassembled PDU]"
"5.031861","172.19.0.3","5.9.29.183","TCP","56","43520 → 9002 [ACK] Seq=10202 Ack=136228 Win=11911 Len=0"
"5.031998","5.9.29.183","172.19.0.3","TCP","1504","9002 → 43520 [PSH, ACK] Seq=136228 Ack=10202 Win=65535 Len=1448 [TCP segment of a reassembled PDU]"
"5.032010","5.9.29.183","172.19.0.3","TLSv1.2","1516","Application Data [TCP segment of a reassembled PDU]"
"5.032014","5.9.29.183","172.19.0.3","TCP","1225","9002 → 43520 [PSH, ACK] Seq=139136 Ack=10202 Win=65535 Len=1169 [TCP segment of a reassembled PDU]"
"5.032075","172.19.0.3","5.9.29.183","TCP","56","43520 → 9002 [ACK] Seq=10202 Ack=140305 Win=11887 Len=0"
"5.032357","172.19.0.3","5.9.29.183","TLSv1.2","599","Application Data"
"5.032593","5.9.29.183","172.19.0.3","TCP","56","9002 → 43520 [ACK] Seq=140305 Ack=10745 Win=65535 Len=0"
"5.047974","5.9.29.183","172.19.0.3","TLSv1.2","243","Application Data"
"5.061891","5.9.29.183","172.19.0.3","TCP","1516","[TCP segment of a reassembled PDU]"
"5.061915","172.19.0.3","5.9.29.183","TCP","56","43520 → 9002 [ACK] Seq=10745 Ack=141952 Win=11911 Len=0"
"5.061973","5.9.29.183","172.19.0.3","TCP","1492","9002 → 43520 [PSH, ACK] Seq=141952 Ack=10745 Win=65535 Len=1436 [TCP segment of a reassembled PDU]"
"5.063097","5.9.29.183","172.19.0.3","TLSv1.2","787","Application Data"
"5.063114","172.19.0.3","5.9.29.183","TCP","56","43520 → 9002 [ACK] Seq=10745 Ack=144119 Win=11911 Len=0"
"5.076062","5.9.29.183","172.19.0.3","TCP","1504","[TCP segment of a reassembled PDU]"
"5.076729","5.9.29.183","172.19.0.3","TCP","1504","9002 → 43520 [PSH, ACK] Seq=145567 Ack=10745 Win=65535 Len=1448 [TCP segment of a reassembled PDU]"
"5.076749","172.19.0.3","5.9.29.183","TCP","56","43520 → 9002 [ACK] Seq=10745 Ack=147015 Win=11911 Len=0"
"5.078737","5.9.29.183","172.19.0.3","TLSv1.2","1330","Application Data, Application Data"
"5.091448","5.9.29.183","172.19.0.3","TCP","1516","[TCP segment of a reassembled PDU]"
"5.091472","172.19.0.3","5.9.29.183","TCP","56","43520 → 9002 [ACK] Seq=10745 Ack=149749 Win=11911 Len=0"
"5.091529","5.9.29.183","172.19.0.3","TCP","1492","9002 → 43520 [PSH, ACK] Seq=149749 Ack=10745 Win=65535 Len=1436 [TCP segment of a reassembled PDU]"
"5.094777","5.9.29.183","172.19.0.3","TLSv1.2","787","Application Data"
"5.095130","172.19.0.3","5.9.29.183","TCP","56","43520 → 9002 [ACK] Seq=10745 Ack=151916 Win=11911 Len=0"
"5.105966","5.9.29.183","172.19.0.3","TCP","1516","[TCP segment of a reassembled PDU]"
"5.106036","5.9.29.183","172.19.0.3","TCP","1492","9002 → 43520 [PSH, ACK] Seq=153376 Ack=10745 Win=65535 Len=1436 [TCP segment of a reassembled PDU]"
"5.106240","172.19.0.3","5.9.29.183","TCP","56","43520 → 9002 [ACK] Seq=10745 Ack=154812 Win=11903 Len=0"
"5.110055","5.9.29.183","172.19.0.3","TLSv1.2","273","Application Data"
"5.118025","5.9.29.183","172.19.0.3","TCP","1516","[TCP segment of a reassembled PDU]"
"5.118046","172.19.0.3","5.9.29.183","TCP","56","43520 → 9002 [ACK] Seq=10745 Ack=156489 Win=11911 Len=0"
"5.118097","5.9.29.183","172.19.0.3","TCP","1516","9002 → 43520 [PSH, ACK] Seq=156489 Ack=10745 Win=65535 Len=1460 [TCP segment of a reassembled PDU]"
"5.118144","5.9.29.183","172.19.0.3","TLSv1.2","1516","Application Data [TCP segment of a reassembled PDU]"
"5.118153","5.9.29.183","172.19.0.3","TCP","1468","9002 → 43520 [PSH, ACK] Seq=159409 Ack=10745 Win=65535 Len=1412 [TCP segment of a reassembled PDU]"
"5.118159","5.9.29.183","172.19.0.3","TCP","1504","9002 → 43520 [PSH, ACK] Seq=160821 Ack=10745 Win=65535 Len=1448 [TCP segment of a reassembled PDU]"
"5.118296","172.19.0.3","5.9.29.183","TCP","56","43520 → 9002 [ACK] Seq=10745 Ack=162269 Win=11879 Len=0"
"5.125901","5.9.29.183","172.19.0.3","TLSv1.2","584","Application Data"
"5.126424","172.19.0.3","5.9.29.183","TLSv1.2","599","Application Data"
"5.126836","5.9.29.183","172.19.0.3","TCP","56","9002 → 43520 [ACK] Seq=162797 Ack=11288 Win=65535 Len=0"
"5.148693","5.9.29.183","172.19.0.3","TCP","1516","[TCP segment of a reassembled PDU]"
"5.148755","5.9.29.183","172.19.0.3","TCP","1516","9002 → 43520 [PSH, ACK] Seq=164257 Ack=11288 Win=65535 Len=1460 [TCP segment of a reassembled PDU]"
"5.148766","5.9.29.183","172.19.0.3","TLSv1.2","1213","Application Data"
"5.148927","172.19.0.3","5.9.29.183","TCP","56","43520 → 9002 [ACK] Seq=11288 Ack=166874 Win=11895 Len=0"
"5.164098","5.9.29.183","172.19.0.3","TLSv1.2","663","Application Data"
"5.182128","5.9.29.183","172.19.0.3","TCP","1516","[TCP segment of a reassembled PDU]"
"5.182151","172.19.0.3","5.9.29.183","TCP","56","43520 → 9002 [ACK] Seq=11288 Ack=168941 Win=11911 Len=0"
"5.182201","5.9.29.183","172.19.0.3","TCP","1516","9002 → 43520 [PSH, ACK] Seq=168941 Ack=11288 Win=65535 Len=1460 [TCP segment of a reassembled PDU]"
"5.182247","5.9.29.183","172.19.0.3","TLSv1.2","763","Application Data"
"5.182384","172.19.0.3","5.9.29.183","TCP","56","43520 → 9002 [ACK] Seq=11288 Ack=171108 Win=11895 Len=0"
"5.692688","5.9.29.183","172.19.0.3","TCP","1516","[TCP segment of a reassembled PDU]"
"5.692745","5.9.29.183","172.19.0.3","TCP","1516","9002 → 43520 [PSH, ACK] Seq=172568 Ack=11288 Win=65535 Len=1460 [TCP segment of a reassembled PDU]"
"5.692761","172.19.0.3","5.9.29.183","TCP","56","43520 → 9002 [ACK] Seq=11288 Ack=174028 Win=11901 Len=0"
"5.692764","5.9.29.183","172.19.0.3","TLSv1.2","763","Application Data"
"5.692768","5.9.29.183","172.19.0.3","TCP","1516","[TCP segment of a reassembled PDU]"
"5.692771","5.9.29.183","172.19.0.3","TCP","1516","9002 → 43520 [PSH, ACK] Seq=176195 Ack=11288 Win=65535 Len=1460 [TCP segment of a reassembled PDU]"
"5.692884","172.19.0.3","5.9.29.183","TCP","56","43520 → 9002 [ACK] Seq=11288 Ack=177655 Win=11877 Len=0"
"5.692906","5.9.29.183","172.19.0.3","TLSv1.2","1516","Application Data [TCP segment of a reassembled PDU]"
"5.692912","5.9.29.183","172.19.0.3","TCP","1468","9002 → 43520 [PSH, ACK] Seq=179115 Ack=11288 Win=65535 Len=1412 [TCP segment of a reassembled PDU]"
"5.692914","5.9.29.183","172.19.0.3","TCP","1504","9002 → 43520 [PSH, ACK] Seq=180527 Ack=11288 Win=65535 Len=1448 [TCP segment of a reassembled PDU]"
"5.692956","172.19.0.3","5.9.29.183","TCP","56","43520 → 9002 [ACK] Seq=11288 Ack=181975 Win=11853 Len=0"
"5.708548","5.9.29.183","172.19.0.3","TLSv1.2","613","Application Data, Application Data"
"5.750493","172.19.0.3","5.9.29.183","TCP","56","43520 → 9002 [ACK] Seq=11288 Ack=182532 Win=11911 Len=0"
"5.950239","5.9.29.183","172.19.0.3","TCP","1516","[TCP segment of a reassembled PDU]"
"5.950265","172.19.0.3","5.9.29.183","TCP","56","43520 → 9002 [ACK] Seq=11288 Ack=183992 Win=11911 Len=0"
"5.950326","5.9.29.183","172.19.0.3","TLSv1.2","1195","Application Data"
"5.950352","172.19.0.3","5.9.29.183","TCP","56","43520 → 9002 [ACK] Seq=11288 Ack=185131 Win=11903 Len=0"
"6.025790","5.9.29.183","172.19.0.3","TLSv1.2","1113","Application Data"
"6.025814","172.19.0.3","5.9.29.183","TCP","56","43520 → 9002 [ACK] Seq=11288 Ack=186188 Win=11911 Len=0"
"6.026262","172.19.0.3","5.9.29.183","TLSv1.2","599","Application Data"
"6.026652","5.9.29.183","172.19.0.3","TCP","56","9002 → 43520 [ACK] Seq=186188 Ack=11831 Win=65535 Len=0"
"6.040258","5.9.29.183","172.19.0.3","TCP","1516","[TCP segment of a reassembled PDU]"
"6.040340","5.9.29.183","172.19.0.3","TCP","1492","9002 → 43520 [PSH, ACK] Seq=187648 Ack=11831 Win=65535 Len=1436 [TCP segment of a reassembled PDU]"
"6.040505","172.19.0.3","5.9.29.183","TCP","56","43520 → 9002 [ACK] Seq=11831 Ack=189084 Win=11903 Len=0"
"6.040737","5.9.29.183","172.19.0.3","TLSv1.2","787","Application Data"
"6.054962","5.9.29.183","172.19.0.3","TCP","1516","[TCP segment of a reassembled PDU]"
"6.054984","172.19.0.3","5.9.29.183","TCP","56","43520 → 9002 [ACK] Seq=11831 Ack=191275 Win=11911 Len=0"
"6.055038","5.9.29.183","172.19.0.3","TCP","1492","9002 → 43520 [PSH, ACK] Seq=191275 Ack=11831 Win=65535 Len=1436 [TCP segment of a reassembled PDU]"
"6.056656","5.9.29.183","172.19.0.3","TLSv1.2","273","Application Data"
"6.056680","172.19.0.3","5.9.29.183","TCP","56","43520 → 9002 [ACK] Seq=11831 Ack=192928 Win=11911 Len=0"
"6.057229","172.19.0.3","5.9.29.183","TLSv1.2","599","Application Data"
"6.057545","5.9.29.183","172.19.0.3","TCP","56","9002 → 43520 [ACK] Seq=192928 Ack=12374 Win=65535 Len=0"
"6.269266","5.9.29.183","172.19.0.3","TCP","1516","[TCP segment of a reassembled PDU]"
"6.269375","5.9.29.183","172.19.0.3","TLSv1.2","167","Application Data"
"6.269532","172.19.0.3","5.9.29.183","TCP","56","43520 → 9002 [ACK] Seq=12374 Ack=194499 Win=11901 Len=0"
"6.306089","5.9.29.183","172.19.0.3","TCP","1516","[TCP segment of a reassembled PDU]"
"6.306168","5.9.29.183","172.19.0.3","TLSv1.2","167","Application Data"
"6.306192","172.19.0.3","5.9.29.183","TCP","56","43520 → 9002 [ACK] Seq=12374 Ack=196070 Win=11903 Len=0"
"6.310695","172.19.0.3","5.9.29.183","TLSv1.2","599","Application Data"
"6.311025","5.9.29.183","172.19.0.3","TCP","56","9002 → 43520 [ACK] Seq=196070 Ack=12917 Win=65535 Len=0"
"6.539358","5.9.29.183","172.19.0.3","TLSv1.2","599","Application Data"
"6.540421","172.19.0.3","5.9.29.183","TLSv1.2","599","Application Data"
"6.540841","5.9.29.183","172.19.0.3","TCP","56","9002 → 43520 [ACK] Seq=196613 Ack=13460 Win=65535 Len=0"
"6.797002","5.9.29.183","172.19.0.3","TCP","1516","[TCP segment of a reassembled PDU]"
"6.797113","5.9.29.183","172.19.0.3","TCP","292","9002 → 43520 [PSH, ACK] Seq=198073 Ack=13460 Win=65535 Len=236 [TCP segment of a reassembled PDU]"
"6.797126","5.9.29.183","172.19.0.3","TCP","1516","9002 → 43520 [PSH, ACK] Seq=198309 Ack=13460 Win=65535 Len=1460 [TCP segment of a reassembled PDU]"
"6.797132","5.9.29.183","172.19.0.3","TLSv1.2","527","Application Data"
"6.797285","172.19.0.3","5.9.29.183","TCP","56","43520 → 9002 [ACK] Seq=13460 Ack=200240 Win=11885 Len=0"
"6.811471","5.9.29.183","172.19.0.3","TCP","1504","[TCP segment of a reassembled PDU]"
"6.812279","5.9.29.183","172.19.0.3","TLSv1.2","693","Application Data"
"6.812298","172.19.0.3","5.9.29.183","TCP","56","43520 → 9002 [ACK] Seq=13460 Ack=202325 Win=11911 Len=0"
"6.838275","5.9.29.183","172.19.0.3","TCP","1504","[TCP segment of a reassembled PDU]"
"6.838893","5.9.29.183","172.19.0.3","TCP","1516","9002 → 43520 [PSH, ACK] Seq=203773 Ack=13460 Win=65535 Len=1460 [TCP segment of a reassembled PDU]"
"6.838908","172.19.0.3","5.9.29.183","TCP","56","43520 → 9002 [ACK] Seq=13460 Ack=205233 Win=11911 Len=0"
"6.838952","5.9.29.183","172.19.0.3","TLSv1.2","775","Application Data"
"6.875016","5.9.29.183","172.19.0.3","TCP","1516","[TCP segment of a reassembled PDU]"
"6.875038","172.19.0.3","5.9.29.183","TCP","56","43520 → 9002 [ACK] Seq=13460 Ack=207412 Win=11911 Len=0"
"6.875091","5.9.29.183","172.19.0.3","TLSv1.2","167","Application Data"
"6.893269","5.9.29.183","172.19.0.3","TCP","1516","[TCP segment of a reassembled PDU]"
"6.893293","172.19.0.3","5.9.29.183","TCP","56","43520 → 9002 [ACK] Seq=13460 Ack=208983 Win=11911 Len=0"
"6.893355","5.9.29.183","172.19.0.3","TCP","1516","9002 → 43520 [PSH, ACK] Seq=208983 Ack=13460 Win=65535 Len=1460 [TCP segment of a reassembled PDU]"
"6.893370","5.9.29.183","172.19.0.3","TLSv1.2","763","Application Data"
"6.893559","172.19.0.3","5.9.29.183","TCP","56","43520 → 9002 [ACK] Seq=13460 Ack=211150 Win=11895 Len=0"
"6.910403","5.9.29.183","172.19.0.3","TCP","1516","[TCP segment of a reassembled PDU]"
"6.910477","5.9.29.183","172.19.0.3","TCP","1516","9002 → 43520 [PSH, ACK] Seq=212610 Ack=13460 Win=65535 Len=1460 [TCP segment of a reassembled PDU]"
"6.910498","172.19.0.3","5.9.29.183","TCP","56","43520 → 9002 [ACK] Seq=13460 Ack=214070 Win=11903 Len=0"
"6.910502","5.9.29.183","172.19.0.3","TLSv1.2","763","Application Data"
"6.922390","5.9.29.183","172.19.0.3","TCP","1516","[TCP segment of a reassembled PDU]"
"6.922408","172.19.0.3","5.9.29.183","TCP","56","43520 → 9002 [ACK] Seq=13460 Ack=216237 Win=11911 Len=0"
"6.922444","5.9.29.183","172.19.0.3","TCP","1492","9002 → 43520 [PSH, ACK] Seq=216237 Ack=13460 Win=65535 Len=1436 [TCP segment of a reassembled PDU]"
"6.922452","5.9.29.183","172.19.0.3","TLSv1.2","1516","Application Data [TCP segment of a reassembled PDU]"
"6.922455","5.9.29.183","172.19.0.3","TCP","1492","9002 → 43520 [PSH, ACK] Seq=219133 Ack=13460 Win=65535 Len=1436 [TCP segment of a reassembled PDU]"
"6.922568","172.19.0.3","5.9.29.183","TCP","56","43520 → 9002 [ACK] Seq=13460 Ack=220569 Win=11887 Len=0"
"6.926165","5.9.29.183","172.19.0.3","TLSv1.2","1004","Application Data"
"6.954894","5.9.29.183","172.19.0.3","TCP","1516","[TCP segment of a reassembled PDU]"
"6.954920","172.19.0.3","5.9.29.183","TCP","56","43520 → 9002 [ACK] Seq=13460 Ack=222977 Win=11911 Len=0"
"6.954936","5.9.29.183","172.19.0.3","TCP","1516","9002 → 43520 [PSH, ACK] Seq=222977 Ack=13460 Win=65535 Len=1460 [TCP segment of a reassembled PDU]"
"6.954944","5.9.29.183","172.19.0.3","TLSv1.2","1516","Application Data [TCP segment of a reassembled PDU]"
"6.954948","5.9.29.183","172.19.0.3","TCP","1516","9002 → 43520 [PSH, ACK] Seq=225897 Ack=13460 Win=65535 Len=1460 [TCP segment of a reassembled PDU]"
"6.954951","5.9.29.183","172.19.0.3","TCP","1189","9002 → 43520 [PSH, ACK] Seq=227357 Ack=13460 Win=65535 Len=1133 [TCP segment of a reassembled PDU]"
"6.955138","172.19.0.3","5.9.29.183","TCP","56","43520 → 9002 [ACK] Seq=13460 Ack=228490 Win=11877 Len=0"
"6.955395","172.19.0.3","5.9.29.183","TLSv1.2","599","Application Data"
"6.955738","5.9.29.183","172.19.0.3","TCP","56","9002 → 43520 [ACK] Seq=228490 Ack=14003 Win=65535 Len=0"
"6.971302","5.9.29.183","172.19.0.3","TLSv1.2","1394","Application Data, Application Data"
"6.987865","5.9.29.183","172.19.0.3","TCP","1516","[TCP segment of a reassembled PDU]"
"6.987890","172.19.0.3","5.9.29.183","TCP","56","43520 → 9002 [ACK] Seq=14003 Ack=231288 Win=11911 Len=0"
"6.987906","5.9.29.183","172.19.0.3","TLSv1.2","681","Application Data"
"7.006467","5.9.29.183","172.19.0.3","TCP","1516","[TCP segment of a reassembled PDU]"
"7.006492","172.19.0.3","5.9.29.183","TCP","56","43520 → 9002 [ACK] Seq=14003 Ack=233373 Win=11911 Len=0"
"7.006509","5.9.29.183","172.19.0.3","TLSv1.2","167","Application Data"
"7.011647","172.19.0.3","5.9.29.183","TLSv1.2","599","Application Data"
"7.012295","5.9.29.183","172.19.0.3","TCP","56","9002 → 43520 [ACK] Seq=233484 Ack=14546 Win=65535 Len=0"
"7.308384","5.9.29.183","172.19.0.3","TLSv1.2","599","Application Data"
"7.309301","172.19.0.3","5.9.29.183","TLSv1.2","599","Application Data"
"7.309687","5.9.29.183","172.19.0.3","TCP","56","9002 → 43520 [ACK] Seq=234027 Ack=15089 Win=65535 Len=0"
"7.575421","5.9.29.183","172.19.0.3","TCP","1504","[TCP segment of a reassembled PDU]"
"7.576132","5.9.29.183","172.19.0.3","TCP","1504","9002 → 43520 [PSH, ACK] Seq=235475 Ack=15089 Win=65535 Len=1448 [TCP segment of a reassembled PDU]"
"7.576144","172.19.0.3","5.9.29.183","TCP","56","43520 → 9002 [ACK] Seq=15089 Ack=236923 Win=11911 Len=0"
"7.576150","5.9.29.183","172.19.0.3","TLSv1.2","787","Application Data"
"7.600248","5.9.29.183","172.19.0.3","TCP","1516","[TCP segment of a reassembled PDU]"
"7.600271","172.19.0.3","5.9.29.183","TCP","56","43520 → 9002 [ACK] Seq=15089 Ack=239114 Win=11911 Len=0"
"7.600286","5.9.29.183","172.19.0.3","TCP","1492","9002 → 43520 [PSH, ACK] Seq=239114 Ack=15089 Win=65535 Len=1436 [TCP segment of a reassembled PDU]"
"7.600438","5.9.29.183","172.19.0.3","TLSv1.2","1237","Application Data"
"7.600445","5.9.29.183","172.19.0.3","TCP","1504","[TCP segment of a reassembled PDU]"
"7.600529","172.19.0.3","5.9.29.183","TCP","56","43520 → 9002 [ACK] Seq=15089 Ack=243179 Win=11887 Len=0"
"7.616081","5.9.29.183","172.19.0.3","TLSv1.2","243","Application Data"
"7.658339","172.19.0.3","5.9.29.183","TCP","56","43520 → 9002 [ACK] Seq=15089 Ack=243366 Win=11911 Len=0"
"7.703000","5.9.29.183","172.19.0.3","TCP","1504","[TCP segment of a reassembled PDU]"
"7.703053","172.19.0.3","5.9.29.183","TCP","56","43520 → 9002 [ACK] Seq=15089 Ack=244814 Win=11911 Len=0"
"7.703072","5.9.29.183","172.19.0.3","TCP","1504","9002 → 43520 [PSH, ACK] Seq=244814 Ack=15089 Win=65535 Len=1448 [TCP segment of a reassembled PDU]"
"7.703088","172.19.0.3","5.9.29.183","TCP","56","43520 → 9002 [ACK] Seq=15089 Ack=246262 Win=11903 Len=0"
"7.703218","5.9.29.183","172.19.0.3","TLSv1.2","787","Application Data"
"7.703228","172.19.0.3","5.9.29.183","TCP","56","43520 → 9002 [ACK] Seq=15089 Ack=246993 Win=11898 Len=0"
"7.703555","172.19.0.3","5.9.29.183","TLSv1.2","599","Application Data"
"7.703774","5.9.29.183","172.19.0.3","TCP","56","9002 → 43520 [ACK] Seq=246993 Ack=15632 Win=65535 Len=0"
"7.714845","5.9.29.183","172.19.0.3","TCP","1516","[TCP segment of a reassembled PDU]"
"7.714877","5.9.29.183","172.19.0.3","TCP","1516","9002 → 43520 [PSH, ACK] Seq=248453 Ack=15632 Win=65535 Len=1460 [TCP segment of a reassembled PDU]"
"7.714885","5.9.29.183","172.19.0.3","TLSv1.2","1480","Application Data [TCP segment of a reassembled PDU]"
"7.715119","172.19.0.3","5.9.29.183","TCP","56","43520 → 9002 [ACK] Seq=15632 Ack=251337 Win=11895 Len=0"
"7.716956","5.9.29.183","172.19.0.3","TLSv1.2","1516","Application Data [TCP segment of a reassembled PDU]"
"7.716970","5.9.29.183","172.19.0.3","TCP","1492","9002 → 43520 [PSH, ACK] Seq=252797 Ack=15632 Win=65535 Len=1436 [TCP segment of a reassembled PDU]"
"7.716979","172.19.0.3","5.9.29.183","TCP","56","43520 → 9002 [ACK] Seq=15632 Ack=254233 Win=11901 Len=0"
"7.719123","5.9.29.183","172.19.0.3","TLSv1.2","613","Application Data"
"7.747851","5.9.29.183","172.19.0.3","TLSv1.2","1113","Application Data"
"7.747878","172.19.0.3","5.9.29.183","TCP","56","43520 → 9002 [ACK] Seq=15632 Ack=255847 Win=11911 Len=0"
"7.781685","5.9.29.183","172.19.0.3","TCP","1516","[TCP segment of a reassembled PDU]"
"7.781720","5.9.29.183","172.19.0.3","TCP","1492","9002 → 43520 [PSH, ACK] Seq=257307 Ack=15632 Win=65535 Len=1436 [TCP segment of a reassembled PDU]"
"7.781732","5.9.29.183","172.19.0.3","TLSv1.2","787","Application Data"
"7.781874","172.19.0.3","5.9.29.183","TCP","56","43520 → 9002 [ACK] Seq=15632 Ack=259474 Win=11895 Len=0"
"7.794406","5.9.29.183","172.19.0.3","TCP","1504","[TCP segment of a reassembled PDU]"
"7.796912","5.9.29.183","172.19.0.3","TLSv1.2","693","Application Data"
"7.796939","172.19.0.3","5.9.29.183","TCP","56","43520 → 9002 [ACK] Seq=15632 Ack=261559 Win=11911 Len=0"
"7.797315","172.19.0.3","5.9.29.183","TLSv1.2","599","Application Data"
"7.797664","5.9.29.183","172.19.0.3","TCP","56","9002 → 43520 [ACK] Seq=261559 Ack=16175 Win=65535 Len=0"
"7.808835","5.9.29.183","172.19.0.3","TCP","1504","[TCP segment of a reassembled PDU]"
"7.812250","5.9.29.183","172.19.0.3","TCP","894","9002 → 43520 [PSH, ACK] Seq=263007 Ack=16175 Win=65535 Len=838 [TCP segment of a reassembled PDU]"
"7.812275","172.19.0.3","5.9.29.183","TCP","56","43520 → 9002 [ACK] Seq=16175 Ack=263845 Win=11911 Len=0"
"7.812292","5.9.29.183","172.19.0.3","TLSv1.2","369","Application Data"
"7.834054","5.9.29.183","172.19.0.3","TCP","1504","[TCP segment of a reassembled PDU]"
"7.834080","172.19.0.3","5.9.29.183","TCP","56","43520 → 9002 [ACK] Seq=16175 Ack=265606 Win=11911 Len=0"
"7.834801","5.9.29.183","172.19.0.3","TCP","1504","9002 → 43520 [PSH, ACK] Seq=265606 Ack=16175 Win=65535 Len=1448 [TCP segment of a reassembled PDU]"
"7.834820","5.9.29.183","172.19.0.3","TLSv1.2","787","Application Data"
"7.834901","172.19.0.3","5.9.29.183","TCP","56","43520 → 9002 [ACK] Seq=16175 Ack=267785 Win=11911 Len=0"
"7.846339","5.9.29.183","172.19.0.3","TCP","1516","[TCP segment of a reassembled PDU]"
"7.846372","5.9.29.183","172.19.0.3","TCP","1492","9002 → 43520 [PSH, ACK] Seq=269245 Ack=16175 Win=65535 Len=1436 [TCP segment of a reassembled PDU]"
"7.846519","172.19.0.3","5.9.29.183","TCP","56","43520 → 9002 [ACK] Seq=16175 Ack=270681 Win=11903 Len=0"
"7.850418","5.9.29.183","172.19.0.3","TLSv1.2","787","Application Data"
"7.851578","172.19.0.3","5.9.29.183","TLSv1.2","599","Application Data"
"7.851938","5.9.29.183","172.19.0.3","TCP","56","9002 → 43520 [ACK] Seq=271412 Ack=16718 Win=65535 Len=0"
"7.860329","172.19.0.3","5.9.29.183","TLSv1.2","599","Application Data"
"7.860559","5.9.29.183","172.19.0.3","TCP","56","9002 → 43520 [ACK] Seq=271412 Ack=17261 Win=65535 Len=0"
"7.885364","5.9.29.183","172.19.0.3","TLSv1.2","599","Application Data"
"7.926851","172.19.0.3","5.9.29.183","TCP","56","43520 → 9002 [ACK] Seq=17261 Ack=271955 Win=11911 Len=0"
"8.117463","5.9.29.183","172.19.0.3","TLSv1.2","599","Application Data"
"8.117554","172.19.0.3","5.9.29.183","TCP","56","43520 → 9002 [ACK] Seq=17261 Ack=272498 Win=11911 Len=0"
"8.118420","172.19.0.3","5.9.29.183","TLSv1.2","599","Application Data"
"8.118780","5.9.29.183","172.19.0.3","TCP","56","9002 → 43520 [ACK] Seq=272498 Ack=17804 Win=65535 Len=0"
"8.408964","5.9.29.183","172.19.0.3","TCP","1516","[TCP segment of a reassembled PDU]"
"8.409039","5.9.29.183","172.19.0.3","TCP","1516","9002 → 43520 [PSH, ACK] Seq=273958 Ack=17804 Win=65535 Len=1460 [TCP segment of a reassembled PDU]"
"8.409052","5.9.29.183","172.19.0.3","TLSv1.2","763","Application Data"
"8.409279","172.19.0.3","5.9.29.183","TCP","56","43520 → 9002 [ACK] Seq=17804 Ack=276125 Win=11893 Len=0"
"8.439512","5.9.29.183","172.19.0.3","TCP","1516","[TCP segment of a reassembled PDU]"
"8.439573","5.9.29.183","172.19.0.3","TCP","1492","9002 → 43520 [PSH, ACK] Seq=277585 Ack=17804 Win=65535 Len=1436 [TCP segment of a reassembled PDU]"
"8.439591","172.19.0.3","5.9.29.183","TCP","56","43520 → 9002 [ACK] Seq=17804 Ack=279021 Win=11903 Len=0"
"8.439594","5.9.29.183","172.19.0.3","TLSv1.2","1237","Application Data"
"8.451748","5.9.29.183","172.19.0.3","TLSv1.2","1516","Application Data"
"8.451772","172.19.0.3","5.9.29.183","TCP","56","43520 → 9002 [ACK] Seq=17804 Ack=281662 Win=11911 Len=0"
"8.451830","5.9.29.183","172.19.0.3","TCP","1492","9002 → 43520 [PSH, ACK] Seq=281662 Ack=17804 Win=65535 Len=1436 [TCP segment of a reassembled PDU]"
"8.454854","5.9.29.183","172.19.0.3","TLSv1.2","880","Application Data"
"8.454880","172.19.0.3","5.9.29.183","TCP","56","43520 → 9002 [ACK] Seq=17804 Ack=283922 Win=11911 Len=0"
"8.466804","5.9.29.183","172.19.0.3","TCP","1516","[TCP segment of a reassembled PDU]"
"8.466877","5.9.29.183","172.19.0.3","TCP","1492","9002 → 43520 [PSH, ACK] Seq=285382 Ack=17804 Win=65535 Len=1436 [TCP segment of a reassembled PDU]"
"8.467138","172.19.0.3","5.9.29.183","TCP","56","43520 → 9002 [ACK] Seq=17804 Ack=286818 Win=11903 Len=0"
"8.470107","5.9.29.183","172.19.0.3","TLSv1.2","787","Application Data"
"8.477532","5.9.29.183","172.19.0.3","TCP","1516","[TCP segment of a reassembled PDU]"
"8.477553","172.19.0.3","5.9.29.183","TCP","56","43520 → 9002 [ACK] Seq=17804 Ack=289009 Win=11911 Len=0"
"8.477600","5.9.29.183","172.19.0.3","TCP","1516","9002 → 43520 [PSH, ACK] Seq=289009 Ack=17804 Win=65535 Len=1460 [TCP segment of a reassembled PDU]"
"8.477612","5.9.29.183","172.19.0.3","TLSv1.2","1480","Application Data [TCP segment of a reassembled PDU]"
"8.477788","172.19.0.3","5.9.29.183","TCP","56","43520 → 9002 [ACK] Seq=17804 Ack=291893 Win=11895 Len=0"
"8.485208","5.9.29.183","172.19.0.3","TLSv1.2","396","Application Data"
"8.494841","5.9.29.183","172.19.0.3","TCP","1516","[TCP segment of a reassembled PDU]"
"8.494866","172.19.0.3","5.9.29.183","TCP","56","43520 → 9002 [ACK] Seq=17804 Ack=293693 Win=11911 Len=0"
"8.494921","5.9.29.183","172.19.0.3","TCP","1492","9002 → 43520 [PSH, ACK] Seq=293693 Ack=17804 Win=65535 Len=1436 [TCP segment of a reassembled PDU]"
"8.501285","5.9.29.183","172.19.0.3","TLSv1.2","787","Application Data"
"8.501309","172.19.0.3","5.9.29.183","TCP","56","43520 → 9002 [ACK] Seq=17804 Ack=295860 Win=11911 Len=0"
"8.520363","5.9.29.183","172.19.0.3","TCP","1504","[TCP segment of a reassembled PDU]"
"8.520421","5.9.29.183","172.19.0.3","TLSv1.2","1207","Application Data"
"8.520546","172.19.0.3","5.9.29.183","TCP","56","43520 → 9002 [ACK] Seq=17804 Ack=298459 Win=11903 Len=0"
"8.520830","172.19.0.3","5.9.29.183","TLSv1.2","1113","Application Data"
"8.521100","5.9.29.183","172.19.0.3","TCP","56","9002 → 43520 [ACK] Seq=298459 Ack=18861 Win=65535 Len=0"
"8.577087","5.9.29.183","172.19.0.3","TCP","1516","[TCP segment of a reassembled PDU]"
"8.577162","5.9.29.183","172.19.0.3","TCP","1516","9002 → 43520 [PSH, ACK] Seq=299919 Ack=18861 Win=65535 Len=1460 [TCP segment of a reassembled PDU]"
"8.577176","5.9.29.183","172.19.0.3","TLSv1.2","763","Application Data"
"8.577380","172.19.0.3","5.9.29.183","TCP","56","43520 → 9002 [ACK] Seq=18861 Ack=302086 Win=11895 Len=0"
"8.587342","5.9.29.183","172.19.0.3","TCP","1516","[TCP segment of a reassembled PDU]"
"8.587408","5.9.29.183","172.19.0.3","TCP","1492","9002 → 43520 [PSH, ACK] Seq=303546 Ack=18861 Win=65535 Len=1436 [TCP segment of a reassembled PDU]"
"8.587425","172.19.0.3","5.9.29.183","TCP","56","43520 → 9002 [ACK] Seq=18861 Ack=304982 Win=11903 Len=0"
"8.592372","5.9.29.183","172.19.0.3","TLSv1.2","1330","Application Data, Application Data"
"8.610878","5.9.29.183","172.19.0.3","TCP","1516","[TCP segment of a reassembled PDU]"
"8.610901","172.19.0.3","5.9.29.183","TCP","56","43520 → 9002 [ACK] Seq=18861 Ack=307716 Win=11911 Len=0"
"8.610955","5.9.29.183","172.19.0.3","TCP","1516","9002 → 43520 [PSH, ACK] Seq=307716 Ack=18861 Win=65535 Len=1460 [TCP segment of a reassembled PDU]"
"8.611003","5.9.29.183","172.19.0.3","TLSv1.2","1516","Application Data [TCP segment of a reassembled PDU]"
"8.611012","5.9.29.183","172.19.0.3","TCP","1201","9002 → 43520 [PSH, ACK] Seq=310636 Ack=18861 Win=65535 Len=1145 [TCP segment of a reassembled PDU]"
"8.611181","172.19.0.3","5.9.29.183","TCP","56","43520 → 9002 [ACK] Seq=18861 Ack=311781 Win=11887 Len=0"
"8.625875","5.9.29.183","172.19.0.3","TLSv1.2","243","Application Data"
"8.668802","172.19.0.3","5.9.29.183","TCP","56","43520 → 9002 [ACK] Seq=18861 Ack=311968 Win=11911 Len=0"
"9.074190","5.9.29.183","172.19.0.3","TCP","1516","[TCP segment of a reassembled PDU]"
"9.074304","172.19.0.3","5.9.29.183","TCP","56","43520 → 9002 [ACK] Seq=18861 Ack=313428 Win=11911 Len=0"
"9.074386","5.9.29.183","172.19.0.3","TLSv1.2","167","Application Data"
"9.074430","172.19.0.3","5.9.29.183","TCP","56","43520 → 9002 [ACK] Seq=18861 Ack=313539 Win=11911 Len=0"
"9.074432","5.9.29.183","172.19.0.3","TCP","1516","[TCP segment of a reassembled PDU]"
"9.074440","172.19.0.3","5.9.29.183","TCP","56","43520 → 9002 [ACK] Seq=18861 Ack=314999 Win=11900 Len=0"
"9.074441","5.9.29.183","172.19.0.3","TCP","1516","9002 → 43520 [PSH, ACK] Seq=314999 Ack=18861 Win=65535 Len=1460 [TCP segment of a reassembled PDU]"
"9.074448","172.19.0.3","5.9.29.183","TCP","56","43520 → 9002 [ACK] Seq=18861 Ack=316459 Win=11889 Len=0"
"9.074533","5.9.29.183","172.19.0.3","TLSv1.2","1516","Application Data, Application Data"
"9.074541","172.19.0.3","5.9.29.183","TCP","56","43520 → 9002 [ACK] Seq=18861 Ack=317919 Win=11879 Len=0"
"9.074571","5.9.29.183","172.19.0.3","TCP","1516","9002 → 43520 [PSH, ACK] Seq=317919 Ack=18861 Win=65535 Len=1460 [TCP segment of a reassembled PDU]"
"9.074586","172.19.0.3","5.9.29.183","TCP","56","43520 → 9002 [ACK] Seq=18861 Ack=319379 Win=11871 Len=0"
"9.074588","5.9.29.183","172.19.0.3","TCP","1516","9002 → 43520 [PSH, ACK] Seq=319379 Ack=18861 Win=65535 Len=1460 [TCP segment of a reassembled PDU]"
"9.074594","172.19.0.3","5.9.29.183","TCP","56","43520 → 9002 [ACK] Seq=18861 Ack=320839 Win=11863 Len=0"
"9.074714","5.9.29.183","172.19.0.3","TLSv1.2","1516","Application Data, Application Data"
"9.074724","172.19.0.3","5.9.29.183","TCP","56","43520 → 9002 [ACK] Seq=18861 Ack=322299 Win=11855 Len=0"
"9.074726","5.9.29.183","172.19.0.3","TCP","1516","9002 → 43520 [PSH, ACK] Seq=322299 Ack=18861 Win=65535 Len=1460 [TCP segment of a reassembled PDU]"
"9.074731","172.19.0.3","5.9.29.183","TCP","56","43520 → 9002 [ACK] Seq=18861 Ack=323759 Win=11845 Len=0"
"9.074732","5.9.29.183","172.19.0.3","TCP","1420","9002 → 43520 [PSH, ACK] Seq=323759 Ack=18861 Win=65535 Len=1364 [TCP segment of a reassembled PDU]"
"9.074738","172.19.0.3","5.9.29.183","TCP","56","43520 → 9002 [ACK] Seq=18861 Ack=325123 Win=11836 Len=0"
"9.090695","5.9.29.183","172.19.0.3","TLSv1.2","1516","Application Data [TCP segment of a reassembled PDU]"
"9.090719","172.19.0.3","5.9.29.183","TCP","56","43520 → 9002 [ACK] Seq=18861 Ack=326583 Win=11911 Len=0"
"9.090787","5.9.29.183","172.19.0.3","TCP","1516","9002 → 43520 [PSH, ACK] Seq=326583 Ack=18861 Win=65535 Len=1460 [TCP segment of a reassembled PDU]"
"9.090806","172.19.0.3","5.9.29.183","TCP","56","43520 → 9002 [ACK] Seq=18861 Ack=328043 Win=11903 Len=0"
"9.090810","5.9.29.183","172.19.0.3","TLSv1.2","118","Application Data"
"9.090817","172.19.0.3","5.9.29.183","TCP","56","43520 → 9002 [ACK] Seq=18861 Ack=328105 Win=11903 Len=0"
"9.091202","172.19.0.3","5.9.29.183","TLSv1.2","599","Application Data"
"9.091451","5.9.29.183","172.19.0.3","TCP","56","9002 → 43520 [ACK] Seq=328105 Ack=19404 Win=65535 Len=0"
"9.301473","5.9.29.183","172.19.0.3","TCP","1332","[TCP segment of a reassembled PDU]"
"9.301567","5.9.29.183","172.19.0.3","TCP","1516","9002 → 43520 [PSH, ACK] Seq=329381 Ack=19404 Win=65535 Len=1460 [TCP segment of a reassembled PDU]"
"9.301587","172.19.0.3","5.9.29.183","TCP","56","43520 → 9002 [ACK] Seq=19404 Ack=330841 Win=11903 Len=0"
"9.301588","5.9.29.183","172.19.0.3","TLSv1.2","947","Application Data"
"9.314815","5.9.29.183","172.19.0.3","TCP","1504","[TCP segment of a reassembled PDU]"
"9.314836","172.19.0.3","5.9.29.183","TCP","56","43520 → 9002 [ACK] Seq=19404 Ack=333180 Win=11911 Len=0"
"9.314884","5.9.29.183","172.19.0.3","TCP","1504","9002 → 43520 [PSH, ACK] Seq=333180 Ack=19404 Win=65535 Len=1448 [TCP segment of a reassembled PDU]"
"9.317824","5.9.29.183","172.19.0.3","TLSv1.2","1330","Application Data, Application Data"
"9.317874","172.19.0.3","5.9.29.183","TCP","56","43520 → 9002 [ACK] Seq=19404 Ack=335902 Win=11911 Len=0"
"9.328346","5.9.29.183","172.19.0.3","TCP","1504","[TCP segment of a reassembled PDU]"
"9.332865","5.9.29.183","172.19.0.3","TLSv1.2","179","Application Data"
"9.332889","172.19.0.3","5.9.29.183","TCP","56","43520 → 9002 [ACK] Seq=19404 Ack=337473 Win=11911 Len=0"
"9.367583","5.9.29.183","172.19.0.3","TCP","1516","[TCP segment of a reassembled PDU]"
"9.367654","5.9.29.183","172.19.0.3","TCP","1516","9002 → 43520 [PSH, ACK] Seq=338933 Ack=19404 Win=65535 Len=1460 [TCP segment of a reassembled PDU]"
"9.367663","5.9.29.183","172.19.0.3","TLSv1.2","763","Application Data"
"9.367799","172.19.0.3","5.9.29.183","TCP","56","43520 → 9002 [ACK] Seq=19404 Ack=341100 Win=11895 Len=0"
"9.379310","5.9.29.183","172.19.0.3","TCP","1504","[TCP segment of a reassembled PDU]"
"9.383076","5.9.29.183","172.19.0.3","TLSv1.2","179","Application Data"
"9.383102","172.19.0.3","5.9.29.183","TCP","56","43520 → 9002 [ACK] Seq=19404 Ack=342671 Win=11911 Len=0"
"9.419698","5.9.29.183","172.19.0.3","TCP","1516","[TCP segment of a reassembled PDU]"
"9.419774","5.9.29.183","172.19.0.3","TLSv1.2","1195","Application Data"
"9.419962","172.19.0.3","5.9.29.183","TCP","56","43520 → 9002 [ACK] Seq=19404 Ack=345270 Win=11901 Len=0"
"9.424802","172.19.0.3","5.9.29.183","TLSv1.2","599","Application Data"
"9.425105","5.9.29.183","172.19.0.3","TCP","56","9002 → 43520 [ACK] Seq=345270 Ack=19947 Win=65535 Len=0"
"9.711544","5.9.29.183","172.19.0.3","TLSv1.2","599","Application Data"
"9.712126","172.19.0.3","5.9.29.183","TLSv1.2","599","Application Data"
"9.712428","5.9.29.183","172.19.0.3","TCP","56","9002 → 43520 [ACK] Seq=345813 Ack=20490 Win=65535 Len=0"
"9.959491","5.9.29.183","172.19.0.3","TLSv1.2","599","Application Data"
"10.001575","172.19.0.3","5.9.29.183","TCP","56","43520 → 9002 [ACK] Seq=20490 Ack=346356 Win=11911 Len=0"
"10.005946","5.9.29.183","172.19.0.3","TCP","1504","[TCP segment of a reassembled PDU]"
"10.005964","172.19.0.3","5.9.29.183","TCP","56","43520 → 9002 [ACK] Seq=20490 Ack=347804 Win=11911 Len=0"
"10.006151","5.9.29.183","172.19.0.3","TCP","1504","9002 → 43520 [PSH, ACK] Seq=347804 Ack=20490 Win=65535 Len=1448 [TCP segment of a reassembled PDU]"
"10.006166","172.19.0.3","5.9.29.183","TCP","56","43520 → 9002 [ACK] Seq=20490 Ack=349252 Win=11903 Len=0"
"10.006168","5.9.29.183","172.19.0.3","TLSv1.2","787","Application Data"
"10.006174","172.19.0.3","5.9.29.183","TCP","56","43520 → 9002 [ACK] Seq=20490 Ack=349983 Win=11898 Len=0"
"10.018190","5.9.29.183","172.19.0.3","TCP","1504","[TCP segment of a reassembled PDU]"
"10.018202","172.19.0.3","5.9.29.183","TCP","56","43520 → 9002 [ACK] Seq=20490 Ack=351431 Win=11909 Len=0"
"10.018329","5.9.29.183","172.19.0.3","TCP","1504","9002 → 43520 [PSH, ACK] Seq=351431 Ack=20490 Win=65535 Len=1448 [TCP segment of a reassembled PDU]"
"10.018337","172.19.0.3","5.9.29.183","TCP","56","43520 → 9002 [ACK] Seq=20490 Ack=352879 Win=11901 Len=0"
"10.018339","5.9.29.183","172.19.0.3","TLSv1.2","1504","Application Data [TCP segment of a reassembled PDU]"
"10.018343","172.19.0.3","5.9.29.183","TCP","56","43520 → 9002 [ACK] Seq=20490 Ack=354327 Win=11893 Len=0"
"10.018425","5.9.29.183","172.19.0.3","TCP","1516","9002 → 43520 [PSH, ACK] Seq=354327 Ack=20490 Win=65535 Len=1460 [TCP segment of a reassembled PDU]"
"10.018433","172.19.0.3","5.9.29.183","TCP","56","43520 → 9002 [ACK] Seq=20490 Ack=355787 Win=11885 Len=0"
"10.018434","5.9.29.183","172.19.0.3","TCP","1492","9002 → 43520 [PSH, ACK] Seq=355787 Ack=20490 Win=65535 Len=1436 [TCP segment of a reassembled PDU]"
"10.018438","172.19.0.3","5.9.29.183","TCP","56","43520 → 9002 [ACK] Seq=20490 Ack=357223 Win=11877 Len=0"
"10.018632","172.19.0.3","5.9.29.183","TLSv1.2","599","Application Data"
"10.018783","5.9.29.183","172.19.0.3","TCP","56","9002 → 43520 [ACK] Seq=357223 Ack=21033 Win=65535 Len=0"
"10.021199","5.9.29.183","172.19.0.3","TLSv1.2","70","Application Data"
"10.063459","172.19.0.3","5.9.29.183","TCP","56","43520 → 9002 [ACK] Seq=21033 Ack=357237 Win=11911 Len=0"
"10.070018","5.9.29.183","172.19.0.3","TCP","1516","[TCP segment of a reassembled PDU]"
"10.070071","172.19.0.3","5.9.29.183","TCP","56","43520 → 9002 [ACK] Seq=21033 Ack=358697 Win=11911 Len=0"
"10.070104","5.9.29.183","172.19.0.3","TCP","1492","9002 → 43520 [PSH, ACK] Seq=358697 Ack=21033 Win=65535 Len=1436 [TCP segment of a reassembled PDU]"
"10.070126","172.19.0.3","5.9.29.183","TCP","56","43520 → 9002 [ACK] Seq=21033 Ack=360133 Win=11903 Len=0"
"10.070128","5.9.29.183","172.19.0.3","TLSv1.2","787","Application Data"
"10.070134","172.19.0.3","5.9.29.183","TCP","56","43520 → 9002 [ACK] Seq=21033 Ack=360864 Win=11898 Len=0"
"10.082699","5.9.29.183","172.19.0.3","TCP","1516","[TCP segment of a reassembled PDU]"
"10.082723","172.19.0.3","5.9.29.183","TCP","56","43520 → 9002 [ACK] Seq=21033 Ack=362324 Win=11911 Len=0"
"10.082738","5.9.29.183","172.19.0.3","TCP","1516","9002 → 43520 [PSH, ACK] Seq=362324 Ack=21033 Win=65535 Len=1460 [TCP segment of a reassembled PDU]"
"10.082748","172.19.0.3","5.9.29.183","TCP","56","43520 → 9002 [ACK] Seq=21033 Ack=363784 Win=11903 Len=0"
"10.082751","5.9.29.183","172.19.0.3","TLSv1.2","1480","Application Data [TCP segment of a reassembled PDU]"
"10.083199","172.19.0.3","5.9.29.183","TCP","56","43520 → 9002 [ACK] Seq=21033 Ack=365208 Win=11911 Len=0"
"10.085710","5.9.29.183","172.19.0.3","TLSv1.2","910","Application Data"
"10.085870","172.19.0.3","5.9.29.183","TCP","56","43520 → 9002 [ACK] Seq=21033 Ack=366062 Win=11911 Len=0"
"10.101619","5.9.29.183","172.19.0.3","TCP","1516","[TCP segment of a reassembled PDU]"
"10.101657","5.9.29.183","172.19.0.3","TLSv1.2","167","Application Data"
"10.101817","172.19.0.3","5.9.29.183","TCP","56","43520 → 9002 [ACK] Seq=21033 Ack=367633 Win=11903 Len=0"
"10.118053","5.9.29.183","172.19.0.3","TCP","1516","[TCP segment of a reassembled PDU]"
"10.118082","5.9.29.183","172.19.0.3","TCP","1516","9002 → 43520 [PSH, ACK] Seq=369093 Ack=21033 Win=65535 Len=1460 [TCP segment of a reassembled PDU]"
"10.118097","172.19.0.3","5.9.29.183","TCP","56","43520 → 9002 [ACK] Seq=21033 Ack=370553 Win=11903 Len=0"
"10.118099","5.9.29.183","172.19.0.3","TLSv1.2","249","Application Data"
"10.118280","172.19.0.3","5.9.29.183","TCP","56","43520 → 9002 [ACK] Seq=21033 Ack=370746 Win=11911 Len=0"
"10.129570","5.9.29.183","172.19.0.3","TCP","1516","[TCP segment of a reassembled PDU]"
"10.129598","5.9.29.183","172.19.0.3","TCP","1516","9002 → 43520 [PSH, ACK] Seq=372206 Ack=21033 Win=65535 Len=1460 [TCP segment of a reassembled PDU]"
"10.129604","5.9.29.183","172.19.0.3","TLSv1.2","1480","Application Data [TCP segment of a reassembled PDU]"
"10.129725","172.19.0.3","5.9.29.183","TCP","56","43520 → 9002 [ACK] Seq=21033 Ack=375090 Win=11893 Len=0"
"10.130001","172.19.0.3","5.9.29.183","TLSv1.2","599","Application Data"
"10.130289","5.9.29.183","172.19.0.3","TCP","56","9002 → 43520 [ACK] Seq=375090 Ack=21576 Win=65535 Len=0"
"10.133150","5.9.29.183","172.19.0.3","TLSv1.2","910","Application Data"
"10.148189","5.9.29.183","172.19.0.3","TCP","1516","[TCP segment of a reassembled PDU]"
"10.148215","172.19.0.3","5.9.29.183","TCP","56","43520 → 9002 [ACK] Seq=21576 Ack=377404 Win=11911 Len=0"
"10.148233","5.9.29.183","172.19.0.3","TCP","1492","9002 → 43520 [PSH, ACK] Seq=377404 Ack=21576 Win=65535 Len=1436 [TCP segment of a reassembled PDU]"
"10.148242","5.9.29.183","172.19.0.3","TLSv1.2","273","Application Data"
"10.148447","172.19.0.3","5.9.29.183","TCP","56","43520 → 9002 [ACK] Seq=21576 Ack=379057 Win=11899 Len=0"
"10.193368","5.9.29.183","172.19.0.3","TCP","1516","[TCP segment of a reassembled PDU]"
"10.193395","5.9.29.183","172.19.0.3","TCP","1516","9002 → 43520 [PSH, ACK] Seq=380517 Ack=21576 Win=65535 Len=1460 [TCP segment of a reassembled PDU]"
"10.193412","172.19.0.3","5.9.29.183","TCP","56","43520 → 9002 [ACK] Seq=21576 Ack=381977 Win=11903 Len=0"
"10.193413","5.9.29.183","172.19.0.3","TLSv1.2","763","Application Data"
"10.208881","5.9.29.183","172.19.0.3","TLSv1.2","599","Application Data"
"10.209118","172.19.0.3","5.9.29.183","TCP","56","43520 → 9002 [ACK] Seq=21576 Ack=383227 Win=11911 Len=0"
"10.215477","5.9.29.183","172.19.0.3","TCP","1516","[TCP segment of a reassembled PDU]"
"10.215529","5.9.29.183","172.19.0.3","TCP","1492","9002 → 43520 [PSH, ACK] Seq=384687 Ack=21576 Win=65535 Len=1436 [TCP segment of a reassembled PDU]"
"10.215536","5.9.29.183","172.19.0.3","TLSv1.2","1516","Application Data [TCP segment of a reassembled PDU]"
"10.215563","5.9.29.183","172.19.0.3","TCP","1516","9002 → 43520 [PSH, ACK] Seq=387583 Ack=21576 Win=65535 Len=1460 [TCP segment of a reassembled PDU]"
"10.215570","5.9.29.183","172.19.0.3","TCP","1480","9002 → 43520 [PSH, ACK] Seq=389043 Ack=21576 Win=65535 Len=1424 [TCP segment of a reassembled PDU]"
"10.215686","172.19.0.3","5.9.29.183","TCP","56","43520 → 9002 [ACK] Seq=21576 Ack=390467 Win=11879 Len=0"
"10.223839","5.9.29.183","172.19.0.3","TLSv1.2","70","Application Data"
"10.246590","5.9.29.183","172.19.0.3","TCP","1516","[TCP segment of a reassembled PDU]"
"10.246616","172.19.0.3","5.9.29.183","TCP","56","43520 → 9002 [ACK] Seq=21576 Ack=391941 Win=11911 Len=0"
"10.246631","5.9.29.183","172.19.0.3","TCP","1516","9002 → 43520 [PSH, ACK] Seq=391941 Ack=21576 Win=65535 Len=1460 [TCP segment of a reassembled PDU]"
"10.246639","5.9.29.183","172.19.0.3","TLSv1.2","1516","Application Data [TCP segment of a reassembled PDU]"
"10.246642","5.9.29.183","172.19.0.3","TCP","112","9002 → 43520 [PSH, ACK] Seq=394861 Ack=21576 Win=65535 Len=56 [TCP segment of a reassembled PDU]"
"10.246645","5.9.29.183","172.19.0.3","TCP","1145","9002 → 43520 [PSH, ACK] Seq=394917 Ack=21576 Win=65535 Len=1089 [TCP segment of a reassembled PDU]"
"10.246823","172.19.0.3","5.9.29.183","TCP","56","43520 → 9002 [ACK] Seq=21576 Ack=396006 Win=11883 Len=0"
"10.261585","5.9.29.183","172.19.0.3","TLSv1.2","1271","Application Data"
"10.276994","5.9.29.183","172.19.0.3","TCP","1504","[TCP segment of a reassembled PDU]"
"10.277018","172.19.0.3","5.9.29.183","TCP","56","43520 → 9002 [ACK] Seq=21576 Ack=398669 Win=11911 Len=0"
"10.277184","5.9.29.183","172.19.0.3","TLSv1.2","179","Application Data"
"10.278437","172.19.0.3","5.9.29.183","TLSv1.2","599","Application Data"
"10.278762","5.9.29.183","172.19.0.3","TCP","56","9002 → 43520 [ACK] Seq=398792 Ack=22119 Win=65535 Len=0"
"10.288585","172.19.0.3","5.9.29.183","TLSv1.2","599","Application Data"
"10.288799","5.9.29.183","172.19.0.3","TCP","56","9002 → 43520 [ACK] Seq=398792 Ack=22662 Win=65535 Len=0"
"10.573657","5.9.29.183","172.19.0.3","TLSv1.2","599","Application Data"
"10.574656","172.19.0.3","5.9.29.183","TLSv1.2","599","Application Data"
"10.574995","5.9.29.183","172.19.0.3","TCP","56","9002 → 43520 [ACK] Seq=399335 Ack=23205 Win=65535 Len=0"
"10.816372","5.9.29.183","172.19.0.3","TCP","1516","[TCP segment of a reassembled PDU]"
"10.816447","5.9.29.183","172.19.0.3","TCP","1516","9002 → 43520 [PSH, ACK] Seq=400795 Ack=23205 Win=65535 Len=1460 [TCP segment of a reassembled PDU]"
"10.816462","5.9.29.183","172.19.0.3","TLSv1.2","763","Application Data"
"10.816636","172.19.0.3","5.9.29.183","TCP","56","43520 → 9002 [ACK] Seq=23205 Ack=402962 Win=11895 Len=0"
"10.831352","5.9.29.183","172.19.0.3","TCP","1516","[TCP segment of a reassembled PDU]"
"10.831416","5.9.29.183","172.19.0.3","TCP","1492","9002 → 43520 [PSH, ACK] Seq=404422 Ack=23205 Win=65535 Len=1436 [TCP segment of a reassembled PDU]"
"10.831433","172.19.0.3","5.9.29.183","TCP","56","43520 → 9002 [ACK] Seq=23205 Ack=405858 Win=11901 Len=0"
"10.832431","5.9.29.183","172.19.0.3","TLSv1.2","787","Application Data"
"10.832791","172.19.0.3","5.9.29.183","TLSv1.2","599","Application Data"
"10.833100","5.9.29.183","172.19.0.3","TCP","56","9002 → 43520 [ACK] Seq=406589 Ack=23748 Win=65535 Len=0"
"10.848323","5.9.29.183","172.19.0.3","TLSv1.2","1113","Application Data"
"10.858001","5.9.29.183","172.19.0.3","TCP","1516","[TCP segment of a reassembled PDU]"
"10.858023","172.19.0.3","5.9.29.183","TCP","56","43520 → 9002 [ACK] Seq=23748 Ack=409106 Win=11911 Len=0"
"10.858072","5.9.29.183","172.19.0.3","TCP","1492","9002 → 43520 [PSH, ACK] Seq=409106 Ack=23748 Win=65535 Len=1436 [TCP segment of a reassembled PDU]"
"10.863351","5.9.29.183","172.19.0.3","TLSv1.2","787","Application Data"
"10.863372","172.19.0.3","5.9.29.183","TCP","56","43520 → 9002 [ACK] Seq=23748 Ack=411273 Win=11911 Len=0"
"10.901742","5.9.29.183","172.19.0.3","TLSv1.2","599","Application Data"
"10.945478","172.19.0.3","5.9.29.183","TCP","56","43520 → 9002 [ACK] Seq=23748 Ack=411816 Win=11911 Len=0"
"11.098167","5.9.29.183","172.19.0.3","TCP","1516","[TCP segment of a reassembled PDU]"
"11.098258","172.19.0.3","5.9.29.183","TCP","56","43520 → 9002 [ACK] Seq=23748 Ack=413276 Win=11911 Len=0"
"11.098262","5.9.29.183","172.19.0.3","TCP","1516","9002 → 43520 [PSH, ACK] Seq=413276 Ack=23748 Win=65535 Len=1460 [TCP segment of a reassembled PDU]"
"11.098277","172.19.0.3","5.9.29.183","TCP","56","43520 → 9002 [ACK] Seq=23748 Ack=414736 Win=11903 Len=0"
"11.098279","5.9.29.183","172.19.0.3","TLSv1.2","763","Application Data"
"11.098287","172.19.0.3","5.9.29.183","TCP","56","43520 → 9002 [ACK] Seq=23748 Ack=415443 Win=11898 Len=0"
"11.167062","5.9.29.183","172.19.0.3","TLSv1.2","1113","Application Data"
"11.167088","172.19.0.3","5.9.29.183","TCP","56","43520 → 9002 [ACK] Seq=23748 Ack=416500 Win=11911 Len=0"
"11.171833","172.19.0.3","5.9.29.183","TLSv1.2","599","Application Data"
"11.172104","5.9.29.183","172.19.0.3","TCP","56","9002 → 43520 [ACK] Seq=416500 Ack=24291 Win=65535 Len=0"
"11.397076","5.9.29.183","172.19.0.3","TLSv1.2","599","Application Data"
"11.398004","172.19.0.3","5.9.29.183","TLSv1.2","599","Application Data"
"11.398356","5.9.29.183","172.19.0.3","TCP","56","9002 → 43520 [ACK] Seq=417043 Ack=24834 Win=65535 Len=0"
"11.616304","5.9.29.183","172.19.0.3","TLSv1.2","599","Application Data"
"11.657323","172.19.0.3","5.9.29.183","TCP","56","43520 → 9002 [ACK] Seq=24834 Ack=417586 Win=11911 Len=0"
"11.693667","5.9.29.183","172.19.0.3","TCP","1516","[TCP segment of a reassembled PDU]"
"11.693692","172.19.0.3","5.9.29.183","TCP","56","43520 → 9002 [ACK] Seq=24834 Ack=419046 Win=11911 Len=0"
"11.693753","5.9.29.183","172.19.0.3","TCP","1516","9002 → 43520 [PSH, ACK] Seq=419046 Ack=24834 Win=65535 Len=1460 [TCP segment of a reassembled PDU]"
"11.693774","172.19.0.3","5.9.29.183","TCP","56","43520 → 9002 [ACK] Seq=24834 Ack=420506 Win=11903 Len=0"
"11.693777","5.9.29.183","172.19.0.3","TLSv1.2","763","Application Data"
"11.693785","172.19.0.3","5.9.29.183","TCP","56","43520 → 9002 [ACK] Seq=24834 Ack=421213 Win=11898 Len=0"
"11.705427","5.9.29.183","172.19.0.3","TCP","1516","[TCP segment of a reassembled PDU]"
"11.705454","172.19.0.3","5.9.29.183","TCP","56","43520 → 9002 [ACK] Seq=24834 Ack=422673 Win=11911 Len=0"
"11.705519","5.9.29.183","172.19.0.3","TCP","1492","9002 → 43520 [PSH, ACK] Seq=422673 Ack=24834 Win=65535 Len=1436 [TCP segment of a reassembled PDU]"
"11.705537","172.19.0.3","5.9.29.183","TCP","56","43520 → 9002 [ACK] Seq=24834 Ack=424109 Win=11903 Len=0"
"11.709332","5.9.29.183","172.19.0.3","TLSv1.2","1330","Application Data, Application Data"
"11.709357","172.19.0.3","5.9.29.183","TCP","56","43520 → 9002 [ACK] Seq=24834 Ack=425383 Win=11911 Len=0"
"11.716860","5.9.29.183","172.19.0.3","TCP","1504","[TCP segment of a reassembled PDU]"
"11.716884","172.19.0.3","5.9.29.183","TCP","56","43520 → 9002 [ACK] Seq=24834 Ack=426831 Win=11909 Len=0"
"11.717045","5.9.29.183","172.19.0.3","TCP","1504","9002 → 43520 [PSH, ACK] Seq=426831 Ack=24834 Win=65535 Len=1448 [TCP segment of a reassembled PDU]"
"11.717060","172.19.0.3","5.9.29.183","TCP","56","43520 → 9002 [ACK] Seq=24834 Ack=428279 Win=11901 Len=0"
"11.724500","5.9.29.183","172.19.0.3","TLSv1.2","787","Application Data"
"11.724525","172.19.0.3","5.9.29.183","TCP","56","43520 → 9002 [ACK] Seq=24834 Ack=429010 Win=11911 Len=0"
"11.739368","5.9.29.183","172.19.0.3","TLSv1.2","1113","Application Data"
"11.739386","172.19.0.3","5.9.29.183","TCP","56","43520 → 9002 [ACK] Seq=24834 Ack=430067 Win=11911 Len=0"
"11.758835","5.9.29.183","172.19.0.3","TCP","1516","[TCP segment of a reassembled PDU]"
"11.758859","172.19.0.3","5.9.29.183","TCP","56","43520 → 9002 [ACK] Seq=24834 Ack=431527 Win=11911 Len=0"
"11.758920","5.9.29.183","172.19.0.3","TLSv1.2","1195","Application Data"
"11.758938","172.19.0.3","5.9.29.183","TCP","56","43520 → 9002 [ACK] Seq=24834 Ack=432666 Win=11903 Len=0"
"11.827850","5.9.29.183","172.19.0.3","TCP","1504","[TCP segment of a reassembled PDU]"
"11.827875","172.19.0.3","5.9.29.183","TCP","56","43520 → 9002 [ACK] Seq=24834 Ack=434114 Win=11911 Len=0"
"11.828624","5.9.29.183","172.19.0.3","TCP","1516","9002 → 43520 [PSH, ACK] Seq=434114 Ack=24834 Win=65535 Len=1460 [TCP segment of a reassembled PDU]"
"11.828641","172.19.0.3","5.9.29.183","TCP","56","43520 → 9002 [ACK] Seq=24834 Ack=435574 Win=11911 Len=0"
"11.828687","5.9.29.183","172.19.0.3","TLSv1.2","775","Application Data"
"11.828699","172.19.0.3","5.9.29.183","TCP","56","43520 → 9002 [ACK] Seq=24834 Ack=436293 Win=11906 Len=0"
"11.856027","5.9.29.183","172.19.0.3","TCP","1516","[TCP segment of a reassembled PDU]"
"11.856113","5.9.29.183","172.19.0.3","TCP","1516","9002 → 43520 [PSH, ACK] Seq=437753 Ack=24834 Win=65535 Len=1460 [TCP segment of a reassembled PDU]"
"11.856123","5.9.29.183","172.19.0.3","TLSv1.2","763","Application Data"
"11.856252","172.19.0.3","5.9.29.183","TCP","56","43520 → 9002 [ACK] Seq=24834 Ack=439920 Win=11895 Len=0"
"11.872368","5.9.29.183","172.19.0.3","TLSv1.2","1113","Application Data"
"11.872641","172.19.0.3","5.9.29.183","TCP","56","43520 → 9002 [ACK] Seq=24834 Ack=440977 Win=11911 Len=0"
"11.905595","5.9.29.183","172.19.0.3","TCP","1516","[TCP segment of a reassembled PDU]"
"11.905671","5.9.29.183","172.19.0.3","TCP","1516","9002 → 43520 [PSH, ACK] Seq=442437 Ack=24834 Win=65535 Len=1460 [TCP segment of a reassembled PDU]"
"11.905683","5.9.29.183","172.19.0.3","TLSv1.2","763","Application Data"
"11.905879","172.19.0.3","5.9.29.183","TCP","56","43520 → 9002 [ACK] Seq=24834 Ack=444604 Win=11895 Len=0"
"11.906302","172.19.0.3","5.9.29.183","TLSv1.2","599","Application Data"
"11.906569","5.9.29.183","172.19.0.3","TCP","56","9002 → 43520 [ACK] Seq=444604 Ack=25377 Win=65535 Len=0"
"11.922129","5.9.29.183","172.19.0.3","TCP","1516","[TCP segment of a reassembled PDU]"
"11.922197","5.9.29.183","172.19.0.3","TCP","1492","9002 → 43520 [PSH, ACK] Seq=446064 Ack=25377 Win=65535 Len=1436 [TCP segment of a reassembled PDU]"
"11.922382","5.9.29.183","172.19.0.3","TLSv1.2","1330","Application Data, Application Data"
"11.922393","172.19.0.3","5.9.29.183","TCP","56","43520 → 9002 [ACK] Seq=25377 Ack=447500 Win=11903 Len=0"
"11.938618","5.9.29.183","172.19.0.3","TCP","1516","[TCP segment of a reassembled PDU]"
"11.938640","172.19.0.3","5.9.29.183","TCP","56","43520 → 9002 [ACK] Seq=25377 Ack=450234 Win=11911 Len=0"
"11.938691","5.9.29.183","172.19.0.3","TLSv1.2","681","Application Data"
"11.970121","5.9.29.183","172.19.0.3","TCP","1516","[TCP segment of a reassembled PDU]"
"11.970146","172.19.0.3","5.9.29.183","TCP","56","43520 → 9002 [ACK] Seq=25377 Ack=452319 Win=11911 Len=0"
"11.970209","5.9.29.183","172.19.0.3","TCP","1516","9002 → 43520 [PSH, ACK] Seq=452319 Ack=25377 Win=65535 Len=1460 [TCP segment of a reassembled PDU]"
"11.970224","5.9.29.183","172.19.0.3","TLSv1.2","763","Application Data"
"11.970439","172.19.0.3","5.9.29.183","TCP","56","43520 → 9002 [ACK] Seq=25377 Ack=454486 Win=11895 Len=0"
"11.985093","5.9.29.183","172.19.0.3","TCP","1516","[TCP segment of a reassembled PDU]"
"11.985160","5.9.29.183","172.19.0.3","TCP","1492","9002 → 43520 [PSH, ACK] Seq=455946 Ack=25377 Win=65535 Len=1436 [TCP segment of a reassembled PDU]"
"11.985177","172.19.0.3","5.9.29.183","TCP","56","43520 → 9002 [ACK] Seq=25377 Ack=457382 Win=11903 Len=0"
"11.985180","5.9.29.183","172.19.0.3","TLSv1.2","787","Application Data"
"11.985596","172.19.0.3","5.9.29.183","TLSv1.2","599","Application Data"
"11.985873","5.9.29.183","172.19.0.3","TCP","56","9002 → 43520 [ACK] Seq=458113 Ack=25920 Win=65535 Len=0"
"11.999340","5.9.29.183","172.19.0.3","TCP","1504","[TCP segment of a reassembled PDU]"
"12.000439","5.9.29.183","172.19.0.3","TLSv1.2","693","Application Data"
"12.000458","172.19.0.3","5.9.29.183","TCP","56","43520 → 9002 [ACK] Seq=25920 Ack=460198 Win=11911 Len=0"
"12.023050","5.9.29.183","172.19.0.3","TCP","311","[TCP segment of a reassembled PDU]"
"12.023170","5.9.29.183","172.19.0.3","TCP","1516","9002 → 43520 [PSH, ACK] Seq=460453 Ack=25920 Win=65535 Len=1460 [TCP segment of a reassembled PDU]"
"12.023218","5.9.29.183","172.19.0.3","TCP","1516","9002 → 43520 [PSH, ACK] Seq=461913 Ack=25920 Win=65535 Len=1460 [TCP segment of a reassembled PDU]"
"12.023223","5.9.29.183","172.19.0.3","TLSv1.2","508","Application Data"
"12.023307","172.19.0.3","5.9.29.183","TCP","56","43520 → 9002 [ACK] Seq=25920 Ack=463825 Win=11887 Len=0"
"12.054161","5.9.29.183","172.19.0.3","TCP","1516","[TCP segment of a reassembled PDU]"
"12.054241","5.9.29.183","172.19.0.3","TCP","1516","9002 → 43520 [PSH, ACK] Seq=465285 Ack=25920 Win=65535 Len=1460 [TCP segment of a reassembled PDU]"
"12.054262","172.19.0.3","5.9.29.183","TCP","56","43520 → 9002 [ACK] Seq=25920 Ack=466745 Win=11903 Len=0"
"12.054265","5.9.29.183","172.19.0.3","TLSv1.2","763","Application Data"
"12.100371","172.19.0.3","5.9.29.183","TCP","56","43520 → 9002 [ACK] Seq=25920 Ack=467452 Win=11911 Len=0"
"12.249392","5.9.29.183","172.19.0.3","TCP","1504","[TCP segment of a reassembled PDU]"
"12.249438","5.9.29.183","172.19.0.3","TLSv1.2","1207","Application Data"
"12.249536","172.19.0.3","5.9.29.183","TCP","56","43520 → 9002 [ACK] Seq=25920 Ack=470051 Win=11903 Len=0"
"12.249773","172.19.0.3","5.9.29.183","TLSv1.2","599","Application Data"
"12.249973","5.9.29.183","172.19.0.3","TCP","56","9002 → 43520 [ACK] Seq=470051 Ack=26463 Win=65535 Len=0"
"12.280754","5.9.29.183","172.19.0.3","TCP","1516","[TCP segment of a reassembled PDU]"
"12.280829","5.9.29.183","172.19.0.3","TCP","1516","9002 → 43520 [PSH, ACK] Seq=471511 Ack=26463 Win=65535 Len=1460 [TCP segment of a reassembled PDU]"
"12.280841","5.9.29.183","172.19.0.3","TLSv1.2","763","Application Data"
"12.281102","172.19.0.3","5.9.29.183","TCP","56","43520 → 9002 [ACK] Seq=26463 Ack=473678 Win=11895 Len=0"
"12.296187","5.9.29.183","172.19.0.3","TCP","1516","[TCP segment of a reassembled PDU]"
"12.296267","5.9.29.183","172.19.0.3","TLSv1.2","681","Application Data"
"12.296287","172.19.0.3","5.9.29.183","TCP","56","43520 → 9002 [ACK] Seq=26463 Ack=475763 Win=11903 Len=0"
"12.374014","5.9.29.183","172.19.0.3","TCP","1516","[TCP segment of a reassembled PDU]"
"12.374081","5.9.29.183","172.19.0.3","TCP","1492","9002 → 43520 [PSH, ACK] Seq=477223 Ack=26463 Win=65535 Len=1436 [TCP segment of a reassembled PDU]"
"12.374113","172.19.0.3","5.9.29.183","TCP","56","43520 → 9002 [ACK] Seq=26463 Ack=478659 Win=11903 Len=0"
"12.374116","5.9.29.183","172.19.0.3","TLSv1.2","787","Application Data"
"12.404425","5.9.29.183","172.19.0.3","TLSv1.2","599","Application Data"
"12.404449","172.19.0.3","5.9.29.183","TCP","56","43520 → 9002 [ACK] Seq=26463 Ack=479933 Win=11911 Len=0"
"12.585091","5.9.29.183","172.19.0.3","TCP","1516","[TCP segment of a reassembled PDU]"
"12.585202","5.9.29.183","172.19.0.3","TLSv1.2","167","Application Data"
"12.585369","172.19.0.3","5.9.29.183","TCP","56","43520 → 9002 [ACK] Seq=26463 Ack=481504 Win=11903 Len=0"
"12.613713","5.9.29.183","172.19.0.3","TCP","1516","[TCP segment of a reassembled PDU]"
"12.613779","5.9.29.183","172.19.0.3","TLSv1.2","167","Application Data"
"12.613796","172.19.0.3","5.9.29.183","TCP","56","43520 → 9002 [ACK] Seq=26463 Ack=483075 Win=11903 Len=0"
"12.649766","5.9.29.183","172.19.0.3","TCP","1516","[TCP segment of a reassembled PDU]"
"12.649843","5.9.29.183","172.19.0.3","TCP","1516","9002 → 43520 [PSH, ACK] Seq=484535 Ack=26463 Win=65535 Len=1460 [TCP segment of a reassembled PDU]"
"12.649866","172.19.0.3","5.9.29.183","TCP","56","43520 → 9002 [ACK] Seq=26463 Ack=485995 Win=11903 Len=0"
"12.649870","5.9.29.183","172.19.0.3","TLSv1.2","763","Application Data"
"12.662274","5.9.29.183","172.19.0.3","TCP","1504","[TCP segment of a reassembled PDU]"
"12.662298","172.19.0.3","5.9.29.183","TCP","56","43520 → 9002 [ACK] Seq=26463 Ack=488150 Win=11911 Len=0"
"12.665159","5.9.29.183","172.19.0.3","TLSv1.2","693","Application Data"
"12.707214","172.19.0.3","5.9.29.183","TCP","56","43520 → 9002 [ACK] Seq=26463 Ack=488787 Win=11911 Len=0"
"12.745102","5.9.29.183","172.19.0.3","TCP","1516","[TCP segment of a reassembled PDU]"
"12.745169","5.9.29.183","172.19.0.3","TCP","1516","9002 → 43520 [PSH, ACK] Seq=490247 Ack=26463 Win=65535 Len=1460 [TCP segment of a reassembled PDU]"
"12.745181","5.9.29.183","172.19.0.3","TLSv1.2","763","Application Data"
"12.745356","172.19.0.3","5.9.29.183","TCP","56","43520 → 9002 [ACK] Seq=26463 Ack=492414 Win=11893 Len=0"
"12.761010","5.9.29.183","172.19.0.3","TCP","1504","[TCP segment of a reassembled PDU]"
"12.761057","5.9.29.183","172.19.0.3","TCP","1516","9002 → 43520 [PSH, ACK] Seq=493862 Ack=26463 Win=65535 Len=1460 [TCP segment of a reassembled PDU]"
"12.761070","172.19.0.3","5.9.29.183","TCP","56","43520 → 9002 [ACK] Seq=26463 Ack=495322 Win=11903 Len=0"
"12.761073","5.9.29.183","172.19.0.3","TLSv1.2","261","Application Data"
"12.761184","172.19.0.3","5.9.29.183","TCP","56","43520 → 9002 [ACK] Seq=26463 Ack=495527 Win=11911 Len=0"
"12.761398","172.19.0.3","5.9.29.183","TLSv1.2","599","Application Data"
"12.761621","5.9.29.183","172.19.0.3","TCP","56","9002 → 43520 [ACK] Seq=495527 Ack=27006 Win=65535 Len=0"
"13.042793","5.9.29.183","172.19.0.3","TCP","1516","[TCP segment of a reassembled PDU]"
"13.042858","5.9.29.183","172.19.0.3","TCP","1492","9002 → 43520 [PSH, ACK] Seq=496987 Ack=27006 Win=65535 Len=1436 [TCP segment of a reassembled PDU]"
"13.042868","5.9.29.183","172.19.0.3","TLSv1.2","787","Application Data"
"13.043038","172.19.0.3","5.9.29.183","TCP","56","43520 → 9002 [ACK] Seq=27006 Ack=499154 Win=11895 Len=0"
"13.045941","172.19.0.3","5.9.29.183","TLSv1.2","599","Application Data"
"13.046324","5.9.29.183","172.19.0.3","TCP","56","9002 → 43520 [ACK] Seq=499154 Ack=27549 Win=65535 Len=0"
"13.054529","172.19.0.3","5.9.29.183","TLSv1.2","599","Application Data"
"13.054742","5.9.29.183","172.19.0.3","TCP","56","9002 → 43520 [ACK] Seq=499154 Ack=28092 Win=65535 Len=0"
"13.075277","5.9.29.183","172.19.0.3","TLSv1.2","599","Application Data"
"13.126241","172.19.0.3","5.9.29.183","TCP","56","43520 → 9002 [ACK] Seq=28092 Ack=499697 Win=11911 Len=0"
"13.384643","5.9.29.183","172.19.0.3","TLSv1.2","599","Application Data"
"13.384685","172.19.0.3","5.9.29.183","TCP","56","43520 → 9002 [ACK] Seq=28092 Ack=500240 Win=11911 Len=0"
"13.385577","172.19.0.3","5.9.29.183","TLSv1.2","599","Application Data"
"13.385899","5.9.29.183","172.19.0.3","TCP","56","9002 → 43520 [ACK] Seq=500240 Ack=28635 Win=65535 Len=0"
"13.625825","5.9.29.183","172.19.0.3","TLSv1.2","599","Application Data"
"13.673209","172.19.0.3","5.9.29.183","TCP","56","43520 → 9002 [ACK] Seq=28635 Ack=500783 Win=11911 Len=0"
"13.676103","5.9.29.183","172.19.0.3","TCP","1516","[TCP segment of a reassembled PDU]"
"13.676126","172.19.0.3","5.9.29.183","TCP","56","43520 → 9002 [ACK] Seq=28635 Ack=502243 Win=11911 Len=0"
"13.676141","5.9.29.183","172.19.0.3","TCP","1492","9002 → 43520 [PSH, ACK] Seq=502243 Ack=28635 Win=65535 Len=1436 [TCP segment of a reassembled PDU]"
"13.676152","172.19.0.3","5.9.29.183","TCP","56","43520 → 9002 [ACK] Seq=28635 Ack=503679 Win=11903 Len=0"
"13.676153","5.9.29.183","172.19.0.3","TLSv1.2","787","Application Data"
"13.676158","172.19.0.3","5.9.29.183","TCP","56","43520 → 9002 [ACK] Seq=28635 Ack=504410 Win=11898 Len=0"
"13.693300","5.9.29.183","172.19.0.3","TCP","1504","[TCP segment of a reassembled PDU]"
"13.693334","172.19.0.3","5.9.29.183","TCP","56","43520 → 9002 [ACK] Seq=28635 Ack=505858 Win=11911 Len=0"
"13.693345","5.9.29.183","172.19.0.3","TCP","1516","9002 → 43520 [PSH, ACK] Seq=505858 Ack=28635 Win=65535 Len=1460 [TCP segment of a reassembled PDU]"
"13.693352","172.19.0.3","5.9.29.183","TCP","56","43520 → 9002 [ACK] Seq=28635 Ack=507318 Win=11903 Len=0"
"13.693353","5.9.29.183","172.19.0.3","TLSv1.2","775","Application Data"
"13.693358","172.19.0.3","5.9.29.183","TCP","56","43520 → 9002 [ACK] Seq=28635 Ack=508037 Win=11898 Len=0"
"13.710291","5.9.29.183","172.19.0.3","TCP","1516","[TCP segment of a reassembled PDU]"
"13.710315","172.19.0.3","5.9.29.183","TCP","56","43520 → 9002 [ACK] Seq=28635 Ack=509497 Win=11911 Len=0"
"13.710331","5.9.29.183","172.19.0.3","TLSv1.2","1195","Application Data"
"13.710342","172.19.0.3","5.9.29.183","TCP","56","43520 → 9002 [ACK] Seq=28635 Ack=510636 Win=11903 Len=0"
"13.710761","172.19.0.3","5.9.29.183","TLSv1.2","599","Application Data"
"13.711175","5.9.29.183","172.19.0.3","TCP","56","9002 → 43520 [ACK] Seq=510636 Ack=29178 Win=65535 Len=0"
"13.965069","5.9.29.183","172.19.0.3","TCP","1516","[TCP segment of a reassembled PDU]"
"13.965102","5.9.29.183","172.19.0.3","TCP","1516","9002 → 43520 [PSH, ACK] Seq=512096 Ack=29178 Win=65535 Len=1460 [TCP segment of a reassembled PDU]"
"13.965108","5.9.29.183","172.19.0.3","TLSv1.2","1213","Application Data"
"13.965265","172.19.0.3","5.9.29.183","TCP","56","43520 → 9002 [ACK] Seq=29178 Ack=514713 Win=11895 Len=0"
"13.965332","5.9.29.183","172.19.0.3","TCP","1516","[TCP segment of a reassembled PDU]"
"13.965574","5.9.29.183","172.19.0.3","TCP","1492","9002 → 43520 [PSH, ACK] Seq=516173 Ack=29178 Win=65535 Len=1436 [TCP segment of a reassembled PDU]"
"13.965600","172.19.0.3","5.9.29.183","TCP","56","43520 → 9002 [ACK] Seq=29178 Ack=517609 Win=11911 Len=0"
"13.981086","5.9.29.183","172.19.0.3","TLSv1.2","337","Application Data"
"13.987518","5.9.29.183","172.19.0.3","TCP","1516","[TCP segment of a reassembled PDU]"
"13.987541","172.19.0.3","5.9.29.183","TCP","56","43520 → 9002 [ACK] Seq=29178 Ack=519350 Win=11911 Len=0"
"13.987556","5.9.29.183","172.19.0.3","TCP","1492","9002 → 43520 [PSH, ACK] Seq=519350 Ack=29178 Win=65535 Len=1436 [TCP segment of a reassembled PDU]"
"13.996452","5.9.29.183","172.19.0.3","TLSv1.2","787","Application Data"
"13.996477","172.19.0.3","5.9.29.183","TCP","56","43520 → 9002 [ACK] Seq=29178 Ack=521517 Win=11911 Len=0"
"14.307290","5.9.29.183","172.19.0.3","TCP","1516","[TCP segment of a reassembled PDU]"
"14.307322","5.9.29.183","172.19.0.3","TLSv1.2","167","Application Data"
"14.307460","172.19.0.3","5.9.29.183","TCP","56","43520 → 9002 [ACK] Seq=29178 Ack=523088 Win=11903 Len=0"
"14.337872","5.9.29.183","172.19.0.3","TCP","1516","[TCP segment of a reassembled PDU]"
"14.337901","5.9.29.183","172.19.0.3","TCP","1492","9002 → 43520 [PSH, ACK] Seq=524548 Ack=29178 Win=65535 Len=1436 [TCP segment of a reassembled PDU]"
"14.337914","172.19.0.3","5.9.29.183","TCP","56","43520 → 9002 [ACK] Seq=29178 Ack=525984 Win=11903 Len=0"
"14.337916","5.9.29.183","172.19.0.3","TCP","61","9002 → 43520 [PSH, ACK] Seq=525984 Ack=29178 Win=65535 Len=5 [TCP segment of a reassembled PDU]"
"14.337920","5.9.29.183","172.19.0.3","TLSv1.2","268","Application Data"
"14.338093","172.19.0.3","5.9.29.183","TCP","56","43520 → 9002 [ACK] Seq=29178 Ack=526201 Win=11911 Len=0"
"14.338331","172.19.0.3","5.9.29.183","TLSv1.2","599","Application Data"
"14.338573","5.9.29.183","172.19.0.3","TCP","56","9002 → 43520 [ACK] Seq=526201 Ack=29721 Win=65535 Len=0"
"14.369541","5.9.29.183","172.19.0.3","TCP","1516","[TCP segment of a reassembled PDU]"
"14.369575","5.9.29.183","172.19.0.3","TLSv1.2","681","Application Data"
"14.369720","172.19.0.3","5.9.29.183","TCP","56","43520 → 9002 [ACK] Seq=29721 Ack=528286 Win=11903 Len=0"
"14.384772","5.9.29.183","172.19.0.3","TCP","1504","[TCP segment of a reassembled PDU]"
"14.384801","5.9.29.183","172.19.0.3","TLSv1.2","693","Application Data"
"14.384815","172.19.0.3","5.9.29.183","TCP","56","43520 → 9002 [ACK] Seq=29721 Ack=530371 Win=11903 Len=0"
"15.979093","5.9.29.183","172.19.0.3","TCP","1516","[TCP segment of a reassembled PDU]"
"15.979125","5.9.29.183","172.19.0.3","TCP","1492","9002 → 43520 [PSH, ACK] Seq=531831 Ack=29721 Win=65535 Len=1436 [TCP segment of a reassembled PDU]"
"15.979140","172.19.0.3","5.9.29.183","TCP","56","43520 → 9002 [ACK] Seq=29721 Ack=533267 Win=11903 Len=0"
"15.979142","5.9.29.183","172.19.0.3","TLSv1.2","787","Application Data"
"16.020368","172.19.0.3","5.9.29.183","TCP","56","43520 → 9002 [ACK] Seq=29721 Ack=533998 Win=11911 Len=0"
