_ws.col.Time,_ws.col.Source,_ws.col.Destination,_ws.col.Protocol,_ws.col.Length,_ws.col.Info
"0.000000","172.19.0.3","5.9.29.183","TLSv1.2","599","Application Data"
"0.000378","5.9.29.183","172.19.0.3","TCP","56","9002 → 43520 [ACK] Seq=1 Ack=544 Win=65535 Len=0"
"0.523009","5.9.29.183","172.19.0.3","TLSv1.2","599","Application Data"
"0.524071","172.19.0.3","5.9.29.183","TLSv1.2","2141","Application Data"
"0.524432","5.9.29.183","172.19.0.3","TCP","56","9002 → 43520 [ACK] Seq=544 Ack=2629 Win=65535 Len=0"
"1.547952","5.9.29.183","172.19.0.3","TLSv1.2","599","Application Data"
"1.589552","172.19.0.3","5.9.29.183","TCP","56","43520 → 9002 [ACK] Seq=2629 Ack=1087 Win=8466 Len=0"
"1.664315","5.9.29.183","172.19.0.3","TCP","1516","[TCP segment of a reassembled PDU]"
"1.664333","172.19.0.3","5.9.29.183","TCP","56","43520 → 9002 [ACK] Seq=2629 Ack=2547 Win=8466 Len=0"
"1.664366","5.9.29.183","172.19.0.3","TLSv1.2","167","Application Data"
"1.664377","172.19.0.3","5.9.29.183","TCP","56","43520 → 9002 [ACK] Seq=2629 Ack=2658 Win=8466 Len=0"
"1.667411","172.19.0.3","5.9.29.183","TLSv1.2","599","Application Data"
"1.667580","5.9.29.183","172.19.0.3","TCP","56","9002 → 43520 [ACK] Seq=2658 Ack=3172 Win=65535 Len=0"
"2.180750","5.9.29.183","172.19.0.3","TLSv1.2","599","Application Data"
"2.181630","172.19.0.3","5.9.29.183","TLSv1.2","599","Application Data"
"2.181936","5.9.29.183","172.19.0.3","TCP","56","9002 → 43520 [ACK] Seq=3201 Ack=3715 Win=65535 Len=0"
"2.561712","5.9.29.183","172.19.0.3","TLSv1.2","599","Application Data"
"2.603606","172.19.0.3","5.9.29.183","TCP","56","43520 → 9002 [ACK] Seq=3715 Ack=3744 Win=8466 Len=0"
"2.643614","5.9.29.183","172.19.0.3","TCP","1504","[TCP segment of a reassembled PDU]"
"2.643634","172.19.0.3","5.9.29.183","TCP","56","43520 → 9002 [ACK] Seq=3715 Ack=5192 Win=8466 Len=0"
"2.643696","5.9.29.183","172.19.0.3","TCP","1516","9002 → 43520 [PSH, ACK] Seq=5192 Ack=3715 Win=65535 Len=1460 [TCP segment of a reassembled PDU]"
"2.643709","172.19.0.3","5.9.29.183","TCP","56","43520 → 9002 [ACK] Seq=3715 Ack=6652 Win=8458 Len=0"
"2.643711","5.9.29.183","172.19.0.3","TLSv1.2","1516","Application Data [TCP segment of a reassembled PDU]"
"2.643715","172.19.0.3","5.9.29.183","TCP","56","43520 → 9002 [ACK] Seq=3715 Ack=8112 Win=8450 Len=0"
"2.643716","5.9.29.183","172.19.0.3","TCP","1516","9002 → 43520 [PSH, ACK] Seq=8112 Ack=3715 Win=65535 Len=1460 [TCP segment of a reassembled PDU]"
"2.643721","172.19.0.3","5.9.29.183","TCP","56","43520 → 9002 [ACK] Seq=3715 Ack=9572 Win=8442 Len=0"
"2.643827","5.9.29.183","172.19.0.3","TCP","1201","9002 → 43520 [PSH, ACK] Seq=9572 Ack=3715 Win=65535 Len=1145 [TCP segment of a reassembled PDU]"
"2.643834","172.19.0.3","5.9.29.183","TCP","56","43520 → 9002 [ACK] Seq=3715 Ack=10717 Win=8434 Len=0"
"2.668073","5.9.29.183","172.19.0.3","TLSv1.2","1394","Application Data, Application Data"
"2.668091","172.19.0.3","5.9.29.183","TCP","56","43520 → 9002 [ACK] Seq=3715 Ack=12055 Win=8466 Len=0"
"2.668414","172.19.0.3","5.9.29.183","TLSv1.2","599","Application Data"
"2.668775","5.9.29.183","172.19.0.3","TCP","56","9002 → 43520 [ACK] Seq=12055 Ack=4258 Win=65535 Len=0"
"2.759300","5.9.29.183","172.19.0.3","TLSv1.2","1113","Application Data"
"2.764044","172.19.0.3","5.9.29.183","TLSv1.2","599","Application Data"
"2.764342","5.9.29.183","172.19.0.3","TCP","56","9002 → 43520 [ACK] Seq=13112 Ack=4801 Win=65535 Len=0"
"2.832174","172.19.0.3","5.9.29.183","TLSv1.2","1627","Application Data"
"2.832509","5.9.29.183","172.19.0.3","TCP","56","9002 → 43520 [ACK] Seq=13112 Ack=6372 Win=65535 Len=0"
"2.877652","5.9.29.183","172.19.0.3","TLSv1.2","599","Application Data"
"2.878222","172.19.0.3","5.9.29.183","TLSv1.2","599","Application Data"
"2.878571","5.9.29.183","172.19.0.3","TCP","56","9002 → 43520 [ACK] Seq=13655 Ack=6915 Win=65535 Len=0"
"3.036497","5.9.29.183","172.19.0.3","TLSv1.2","599","Application Data"
"3.036996","172.19.0.3","5.9.29.183","TLSv1.2","599","Application Data"
"3.037243","5.9.29.183","172.19.0.3","TCP","56","9002 → 43520 [ACK] Seq=14198 Ack=7458 Win=65535 Len=0"
"3.193956","5.9.29.183","172.19.0.3","TLSv1.2","599","Application Data"
"3.194807","172.19.0.3","5.9.29.183","TLSv1.2","599","Application Data"
"3.195070","5.9.29.183","172.19.0.3","TCP","56","9002 → 43520 [ACK] Seq=14741 Ack=8001 Win=65535 Len=0"
"3.337377","5.9.29.183","172.19.0.3","TLSv1.2","599","Application Data"
"3.377954","172.19.0.3","5.9.29.183","TCP","56","43520 → 9002 [ACK] Seq=8001 Ack=15284 Win=8466 Len=0"
"3.746633","5.9.29.183","172.19.0.3","TLSv1.2","599","Application Data"
"3.746685","172.19.0.3","5.9.29.183","TCP","56","43520 → 9002 [ACK] Seq=8001 Ack=15827 Win=8466 Len=0"
"3.772089","5.9.29.183","172.19.0.3","TCP","1516","[TCP segment of a reassembled PDU]"
"3.772106","172.19.0.3","5.9.29.183","TCP","56","43520 → 9002 [ACK] Seq=8001 Ack=17287 Win=8466 Len=0"
"3.772138","5.9.29.183","172.19.0.3","TCP","1492","9002 → 43520 [PSH, ACK] Seq=17287 Ack=8001 Win=65535 Len=1436 [TCP segment of a reassembled PDU]"
"3.772148","172.19.0.3","5.9.29.183","TCP","56","43520 → 9002 [ACK] Seq=8001 Ack=18723 Win=8458 Len=0"
"3.772150","5.9.29.183","172.19.0.3","TLSv1.2","273","Application Data"
"3.772153","172.19.0.3","5.9.29.183","TCP","56","43520 → 9002 [ACK] Seq=8001 Ack=18940 Win=8457 Len=0"
"3.793752","5.9.29.183","172.19.0.3","TCP","1516","[TCP segment of a reassembled PDU]"
"3.793780","172.19.0.3","5.9.29.183","TCP","56","43520 → 9002 [ACK] Seq=8001 Ack=20400 Win=8466 Len=0"
"3.793831","5.9.29.183","172.19.0.3","TCP","1516","9002 → 43520 [PSH, ACK] Seq=20400 Ack=8001 Win=65535 Len=1460 [TCP segment of a reassembled PDU]"
"3.793843","172.19.0.3","5.9.29.183","TCP","56","43520 → 9002 [ACK] Seq=8001 Ack=21860 Win=8458 Len=0"
"3.793846","5.9.29.183","172.19.0.3","TLSv1.2","1480","Application Data [TCP segment of a reassembled PDU]"
"3.793856","172.19.0.3","5.9.29.183","TCP","56","43520 → 9002 [ACK] Seq=8001 Ack=23284 Win=8450 Len=0"
"3.796221","5.9.29.183","172.19.0.3","TLSv1.2","396","Application Data"
"3.796246","172.19.0.3","5.9.29.183","TCP","56","43520 → 9002 [ACK] Seq=8001 Ack=23624 Win=8466 Len=0"
"3.800228","172.19.0.3","5.9.29.183","TLSv1.2","599","Application Data"
"3.800489","5.9.29.183","172.19.0.3","TCP","56","9002 → 43520 [ACK] Seq=23624 Ack=8544 Win=65535 Len=0"
"3.831921","172.19.0.3","5.9.29.183","TLSv1.2","599","Application Data"
"3.832259","5.9.29.183","172.19.0.3","TCP","56","9002 → 43520 [ACK] Seq=23624 Ack=9087 Win=65535 Len=0"
"3.876765","5.9.29.183","172.19.0.3","TLSv1.2","599","Application Data"
"3.877259","172.19.0.3","5.9.29.183","TLSv1.2","599","Application Data"
"3.877444","5.9.29.183","172.19.0.3","TCP","56","9002 → 43520 [ACK] Seq=24167 Ack=9630 Win=65535 Len=0"
"3.975660","5.9.29.183","172.19.0.3","TLSv1.2","599","Application Data"
"3.976316","172.19.0.3","5.9.29.183","TLSv1.2","599","Application Data"
"3.976604","5.9.29.183","172.19.0.3","TCP","56","9002 → 43520 [ACK] Seq=24710 Ack=10173 Win=65535 Len=0"
"4.054242","5.9.29.183","172.19.0.3","TLSv1.2","599","Application Data"
"4.095335","172.19.0.3","5.9.29.183","TCP","56","43520 → 9002 [ACK] Seq=10173 Ack=25253 Win=8466 Len=0"
"4.211897","5.9.29.183","172.19.0.3","TLSv1.2","599","Application Data"
"4.211949","172.19.0.3","5.9.29.183","TCP","56","43520 → 9002 [ACK] Seq=10173 Ack=25796 Win=8466 Len=0"
"4.212635","172.19.0.3","5.9.29.183","TLSv1.2","599","Application Data"
"4.212790","5.9.29.183","172.19.0.3","TCP","56","9002 → 43520 [ACK] Seq=25796 Ack=10716 Win=65535 Len=0"
"4.729519","5.9.29.183","172.19.0.3","TCP","1516","[TCP segment of a reassembled PDU]"
"4.729586","5.9.29.183","172.19.0.3","TCP","1492","9002 → 43520 [PSH, ACK] Seq=27256 Ack=10716 Win=65535 Len=1436 [TCP segment of a reassembled PDU]"
"4.729595","5.9.29.183","172.19.0.3","TLSv1.2","1237","Application Data"
"4.729704","172.19.0.3","5.9.29.183","TCP","56","43520 → 9002 [ACK] Seq=10716 Ack=29873 Win=8450 Len=0"
"4.747499","5.9.29.183","172.19.0.3","TLSv1.2","1516","Application Data"
"4.747540","5.9.29.183","172.19.0.3","TCP","1492","9002 → 43520 [PSH, ACK] Seq=31333 Ack=10716 Win=65535 Len=1436 [TCP segment of a reassembled PDU]"
"4.747552","172.19.0.3","5.9.29.183","TCP","56","43520 → 9002 [ACK] Seq=10716 Ack=32769 Win=8458 Len=0"
"4.748703","5.9.29.183","172.19.0.3","TLSv1.2","1423","Application Data, Application Data"
"4.787935","5.9.29.183","172.19.0.3","TCP","1504","[TCP segment of a reassembled PDU]"
"4.787952","172.19.0.3","5.9.29.183","TCP","56","43520 → 9002 [ACK] Seq=10716 Ack=35584 Win=8466 Len=0"
"4.787984","5.9.29.183","172.19.0.3","TCP","1516","9002 → 43520 [PSH, ACK] Seq=35584 Ack=10716 Win=65535 Len=1460 [TCP segment of a reassembled PDU]"
"4.787991","5.9.29.183","172.19.0.3","TLSv1.2","775","Application Data"
"4.788098","172.19.0.3","5.9.29.183","TCP","56","43520 → 9002 [ACK] Seq=10716 Ack=37763 Win=8450 Len=0"
"4.804640","5.9.29.183","172.19.0.3","TCP","1516","[TCP segment of a reassembled PDU]"
"4.804704","5.9.29.183","172.19.0.3","TCP","1492","9002 → 43520 [PSH, ACK] Seq=39223 Ack=10716 Win=65535 Len=1436 [TCP segment of a reassembled PDU]"
"4.804722","172.19.0.3","5.9.29.183","TCP","56","43520 → 9002 [ACK] Seq=10716 Ack=40659 Win=8458 Len=0"
"4.807949","5.9.29.183","172.19.0.3","TLSv1.2","1330","Application Data, Application Data"
"4.842327","5.9.29.183","172.19.0.3","TCP","1504","[TCP segment of a reassembled PDU]"
"4.842348","172.19.0.3","5.9.29.183","TCP","56","43520 → 9002 [ACK] Seq=10716 Ack=43381 Win=8464 Len=0"
"4.842466","5.9.29.183","172.19.0.3","TCP","1336","9002 → 43520 [PSH, ACK] Seq=43381 Ack=10716 Win=65535 Len=1280 [TCP segment of a reassembled PDU]"
"4.842513","5.9.29.183","172.19.0.3","TLSv1.2","955","Application Data"
"4.842625","172.19.0.3","5.9.29.183","TCP","56","43520 → 9002 [ACK] Seq=10716 Ack=45560 Win=8466 Len=0"
"4.859559","5.9.29.183","172.19.0.3","TCP","1516","[TCP segment of a reassembled PDU]"
"4.859622","5.9.29.183","172.19.0.3","TCP","1516","9002 → 43520 [PSH, ACK] Seq=47020 Ack=10716 Win=65535 Len=1460 [TCP segment of a reassembled PDU]"
"4.859630","5.9.29.183","172.19.0.3","TLSv1.2","1480","Application Data [TCP segment of a reassembled PDU]"
"4.859649","5.9.29.183","172.19.0.3","TCP","1516","9002 → 43520 [PSH, ACK] Seq=49904 Ack=10716 Win=65535 Len=1460 [TCP segment of a reassembled PDU]"
"4.859734","5.9.29.183","172.19.0.3","TCP","1492","9002 → 43520 [PSH, ACK] Seq=51364 Ack=10716 Win=65535 Len=1436 [TCP segment of a reassembled PDU]"
"4.859797","172.19.0.3","5.9.29.183","TCP","56","43520 → 9002 [ACK] Seq=10716 Ack=52800 Win=8434 Len=0"
"4.876041","5.9.29.183","172.19.0.3","TLSv1.2","584","Application Data"
"4.876473","172.19.0.3","5.9.29.183","TLSv1.2","599","Application Data"
"4.876785","5.9.29.183","172.19.0.3","TCP","56","9002 → 43520 [ACK] Seq=53328 Ack=11259 Win=65535 Len=0"
"4.879193","5.9.29.183","172.19.0.3","TCP","1504","[TCP segment of a reassembled PDU]"
"4.892520","5.9.29.183","172.19.0.3","TLSv1.2","179","Application Data"
"4.892540","172.19.0.3","5.9.29.183","TCP","56","43520 → 9002 [ACK] Seq=11259 Ack=54899 Win=8466 Len=0"
"4.896603","172.19.0.3","5.9.29.183","TLSv1.2","599","Application Data"
"4.897048","5.9.29.183","172.19.0.3","TCP","56","9002 → 43520 [ACK] Seq=54899 Ack=11802 Win=65535 Len=0"
"5.578703","5.9.29.183","172.19.0.3","TLSv1.2","599","Application Data"
"5.579331","172.19.0.3","5.9.29.183","TLSv1.2","599","Application Data"
"5.579556","5.9.29.183","172.19.0.3","TCP","56","9002 → 43520 [ACK] Seq=55442 Ack=12345 Win=65535 Len=0"
"6.046809","5.9.29.183","172.19.0.3","TCP","1516","[TCP segment of a reassembled PDU]"
"6.046879","5.9.29.183","172.19.0.3","TCP","1492","9002 → 43520 [PSH, ACK] Seq=56902 Ack=12345 Win=65535 Len=1436 [TCP segment of a reassembled PDU]"
"6.046903","5.9.29.183","172.19.0.3","TLSv1.2","787","Application Data"
"6.047002","172.19.0.3","5.9.29.183","TCP","56","43520 → 9002 [ACK] Seq=12345 Ack=59069 Win=8450 Len=0"
"6.080037","5.9.29.183","172.19.0.3","TCP","1516","[TCP segment of a reassembled PDU]"
"6.080082","5.9.29.183","172.19.0.3","TCP","1492","9002 → 43520 [PSH, ACK] Seq=60529 Ack=12345 Win=65535 Len=1436 [TCP segment of a reassembled PDU]"
"6.080094","172.19.0.3","5.9.29.183","TCP","56","43520 → 9002 [ACK] Seq=12345 Ack=61965 Win=8458 Len=0"
"6.080096","5.9.29.183","172.19.0.3","TLSv1.2","273","Application Data"
"6.109119","5.9.29.183","172.19.0.3","TCP","1516","[TCP segment of a reassembled PDU]"
"6.109135","172.19.0.3","5.9.29.183","TCP","56","43520 → 9002 [ACK] Seq=12345 Ack=63642 Win=8466 Len=0"
"6.109167","5.9.29.183","172.19.0.3","TCP","1516","9002 → 43520 [PSH, ACK] Seq=63642 Ack=12345 Win=65535 Len=1460 [TCP segment of a reassembled PDU]"
"6.109175","5.9.29.183","172.19.0.3","TLSv1.2","763","Application Data"
"6.109287","172.19.0.3","5.9.29.183","TCP","56","43520 → 9002 [ACK] Seq=12345 Ack=65809 Win=8450 Len=0"
"6.126868","5.9.29.183","172.19.0.3","TCP","1504","[TCP segment of a reassembled PDU]"
"6.126913","5.9.29.183","172.19.0.3","TLSv1.2","693","Application Data"
"6.126925","172.19.0.3","5.9.29.183","TCP","56","43520 → 9002 [ACK] Seq=12345 Ack=67894 Win=8458 Len=0"
"6.127161","172.19.0.3","5.9.29.183","TLSv1.2","599","Application Data"
"6.127356","5.9.29.183","172.19.0.3","TCP","56","9002 → 43520 [ACK] Seq=67894 Ack=12888 Win=65535 Len=0"
"6.202840","5.9.29.183","172.19.0.3","TCP","1516","[TCP segment of a reassembled PDU]"
"6.202885","5.9.29.183","172.19.0.3","TCP","1492","9002 → 43520 [PSH, ACK] Seq=69354 Ack=12888 Win=65535 Len=1436 [TCP segment of a reassembled PDU]"
"6.202892","5.9.29.183","172.19.0.3","TLSv1.2","1516","Application Data [TCP segment of a reassembled PDU]"
"6.202895","5.9.29.183","172.19.0.3","TCP","1516","9002 → 43520 [PSH, ACK] Seq=72250 Ack=12888 Win=65535 Len=1460 [TCP segment of a reassembled PDU]"
"6.202897","5.9.29.183","172.19.0.3","TCP","1213","9002 → 43520 [PSH, ACK] Seq=73710 Ack=12888 Win=65535 Len=1157 [TCP segment of a reassembled PDU]"
"6.202993","172.19.0.3","5.9.29.183","TCP","56","43520 → 9002 [ACK] Seq=12888 Ack=74867 Win=8434 Len=0"
"6.215081","5.9.29.183","172.19.0.3","TLSv1.2","1504","Application Data [TCP segment of a reassembled PDU]"
"6.215128","5.9.29.183","172.19.0.3","TCP","1516","9002 → 43520 [PSH, ACK] Seq=76315 Ack=12888 Win=65535 Len=1460 [TCP segment of a reassembled PDU]"
"6.215140","172.19.0.3","5.9.29.183","TCP","56","43520 → 9002 [ACK] Seq=12888 Ack=77775 Win=8458 Len=0"
"6.215142","5.9.29.183","172.19.0.3","TCP","1516","9002 → 43520 [PSH, ACK] Seq=77775 Ack=12888 Win=65535 Len=1460 [TCP segment of a reassembled PDU]"
"6.215145","5.9.29.183","172.19.0.3","TLSv1.2","1480","Application Data [TCP segment of a reassembled PDU]"
"6.215264","172.19.0.3","5.9.29.183","TCP","56","43520 → 9002 [ACK] Seq=12888 Ack=80659 Win=8442 Len=0"
"6.215283","5.9.29.183","172.19.0.3","TCP","1504","9002 → 43520 [PSH, ACK] Seq=80659 Ack=12888 Win=65535 Len=1448 [TCP segment of a reassembled PDU]"
"6.221572","5.9.29.183","172.19.0.3","TCP","1504","9002 → 43520 [PSH, ACK] Seq=82107 Ack=12888 Win=65535 Len=1448 [TCP segment of a reassembled PDU]"
"6.221589","172.19.0.3","5.9.29.183","TCP","56","43520 → 9002 [ACK] Seq=12888 Ack=83555 Win=8466 Len=0"
"6.226608","5.9.29.183","172.19.0.3","TLSv1.2","474","Application Data, Application Data"
"6.226950","172.19.0.3","5.9.29.183","TLSv1.2","599","Application Data"
"6.227187","5.9.29.183","172.19.0.3","TCP","56","9002 → 43520 [ACK] Seq=83973 Ack=13431 Win=65535 Len=0"
"6.265988","5.9.29.183","172.19.0.3","TCP","1516","[TCP segment of a reassembled PDU]"
"6.266031","5.9.29.183","172.19.0.3","TCP","1516","9002 → 43520 [PSH, ACK] Seq=85433 Ack=13431 Win=65535 Len=1460 [TCP segment of a reassembled PDU]"
"6.266036","5.9.29.183","172.19.0.3","TLSv1.2","763","Application Data"
"6.266146","172.19.0.3","5.9.29.183","TCP","56","43520 → 9002 [ACK] Seq=13431 Ack=87600 Win=8450 Len=0"
"6.308034","5.9.29.183","172.19.0.3","TCP","1516","[TCP segment of a reassembled PDU]"
"6.308090","5.9.29.183","172.19.0.3","TCP","1516","9002 → 43520 [PSH, ACK] Seq=89060 Ack=13431 Win=65535 Len=1460 [TCP segment of a reassembled PDU]"
"6.308103","172.19.0.3","5.9.29.183","TCP","56","43520 → 9002 [ACK] Seq=13431 Ack=90520 Win=8458 Len=0"
"6.308105","5.9.29.183","172.19.0.3","TLSv1.2","763","Application Data"
"6.308108","5.9.29.183","172.19.0.3","TCP","1516","[TCP segment of a reassembled PDU]"
"6.308110","5.9.29.183","172.19.0.3","TCP","1516","9002 → 43520 [PSH, ACK] Seq=92687 Ack=13431 Win=65535 Len=1460 [TCP segment of a reassembled PDU]"
"6.308112","5.9.29.183","172.19.0.3","TLSv1.2","1480","Application Data [TCP segment of a reassembled PDU]"
"6.308215","172.19.0.3","5.9.29.183","TCP","56","43520 → 9002 [ACK] Seq=13431 Ack=95571 Win=8424 Len=0"
"6.329825","5.9.29.183","172.19.0.3","TLSv1.2","1504","Application Data [TCP segment of a reassembled PDU]"
"6.329861","5.9.29.183","172.19.0.3","TCP","1504","9002 → 43520 [PSH, ACK] Seq=97019 Ack=13431 Win=65535 Len=1448 [TCP segment of a reassembled PDU]"
"6.329873","172.19.0.3","5.9.29.183","TCP","56","43520 → 9002 [ACK] Seq=13431 Ack=98467 Win=8458 Len=0"
"6.332502","5.9.29.183","172.19.0.3","TLSv1.2","1127","Application Data"
"6.353691","5.9.29.183","172.19.0.3","TLSv1.2","1516","Application Data"
"6.353707","172.19.0.3","5.9.29.183","TCP","56","43520 → 9002 [ACK] Seq=13431 Ack=100998 Win=8466 Len=0"
"6.353734","5.9.29.183","172.19.0.3","TCP","1516","9002 → 43520 [PSH, ACK] Seq=100998 Ack=13431 Win=65535 Len=1460 [TCP segment of a reassembled PDU]"
"6.353741","5.9.29.183","172.19.0.3","TCP","1089","9002 → 43520 [PSH, ACK] Seq=102458 Ack=13431 Win=65535 Len=1033 [TCP segment of a reassembled PDU]"
"6.353819","172.19.0.3","5.9.29.183","TCP","56","43520 → 9002 [ACK] Seq=13431 Ack=103491 Win=8450 Len=0"
"6.385010","5.9.29.183","172.19.0.3","TLSv1.2","787","Application Data"
"6.385053","5.9.29.183","172.19.0.3","TCP","1516","[TCP segment of a reassembled PDU]"
"6.385067","172.19.0.3","5.9.29.183","TCP","56","43520 → 9002 [ACK] Seq=13431 Ack=105682 Win=8458 Len=0"
"6.385069","5.9.29.183","172.19.0.3","TCP","1492","9002 → 43520 [PSH, ACK] Seq=105682 Ack=13431 Win=65535 Len=1436 [TCP segment of a reassembled PDU]"
"6.402395","5.9.29.183","172.19.0.3","TLSv1.2","1330","Application Data, Application Data"
"6.402412","172.19.0.3","5.9.29.183","TCP","56","43520 → 9002 [ACK] Seq=13431 Ack=108392 Win=8466 Len=0"
"6.402854","172.19.0.3","5.9.29.183","TLSv1.2","599","Application Data"
"6.403016","5.9.29.183","172.19.0.3","TCP","56","9002 → 43520 [ACK] Seq=108392 Ack=13974 Win=65535 Len=0"
"6.406301","5.9.29.183","172.19.0.3","TCP","1516","[TCP segment of a reassembled PDU]"
"6.406345","5.9.29.183","172.19.0.3","TCP","401","9002 → 43520 [PSH, ACK] Seq=109852 Ack=13974 Win=65535 Len=345 [TCP segment of a reassembled PDU]"
"6.406351","5.9.29.183","172.19.0.3","TCP","1147","9002 → 43520 [PSH, ACK] Seq=110197 Ack=13974 Win=65535 Len=1091 [TCP segment of a reassembled PDU]"
"6.406495","172.19.0.3","5.9.29.183","TCP","56","43520 → 9002 [ACK] Seq=13974 Ack=111288 Win=8450 Len=0"
"6.422861","5.9.29.183","172.19.0.3","TLSv1.2","1330","Application Data, Application Data"
"6.431905","5.9.29.183","172.19.0.3","TCP","1504","[TCP segment of a reassembled PDU]"
"6.431917","172.19.0.3","5.9.29.183","TCP","56","43520 → 9002 [ACK] Seq=13974 Ack=114010 Win=8466 Len=0"
"6.444777","5.9.29.183","172.19.0.3","TLSv1.2","693","Application Data"
"6.448683","172.19.0.3","5.9.29.183","TLSv1.2","599","Application Data"
"6.448958","5.9.29.183","172.19.0.3","TCP","56","9002 → 43520 [ACK] Seq=114647 Ack=14517 Win=65535 Len=0"
"7.075944","5.9.29.183","172.19.0.3","TLSv1.2","599","Application Data"
"7.076838","172.19.0.3","5.9.29.183","TLSv1.2","599","Application Data"
"7.077181","5.9.29.183","172.19.0.3","TCP","56","9002 → 43520 [ACK] Seq=115190 Ack=15060 Win=65535 Len=0"
"7.502735","5.9.29.183","172.19.0.3","TLSv1.2","599","Application Data"
"7.545870","172.19.0.3","5.9.29.183","TCP","56","43520 → 9002 [ACK] Seq=15060 Ack=115733 Win=8466 Len=0"
"7.572074","5.9.29.183","172.19.0.3","TCP","1516","[TCP segment of a reassembled PDU]"
"7.572097","172.19.0.3","5.9.29.183","TCP","56","43520 → 9002 [ACK] Seq=15060 Ack=117193 Win=8466 Len=0"
"7.572146","5.9.29.183","172.19.0.3","TCP","1516","9002 → 43520 [PSH, ACK] Seq=117193 Ack=15060 Win=65535 Len=1460 [TCP segment of a reassembled PDU]"
"7.572162","172.19.0.3","5.9.29.183","TCP","56","43520 → 9002 [ACK] Seq=15060 Ack=118653 Win=8458 Len=0"
"7.572164","5.9.29.183","172.19.0.3","TLSv1.2","763","Application Data"
"7.572170","172.19.0.3","5.9.29.183","TCP","56","43520 → 9002 [ACK] Seq=15060 Ack=119360 Win=8453 Len=0"
"7.572517","172.19.0.3","5.9.29.183","TLSv1.2","599","Application Data"
"7.572883","5.9.29.183","172.19.0.3","TCP","56","9002 → 43520 [ACK] Seq=119360 Ack=15603 Win=65535 Len=0"
"7.587505","5.9.29.183","172.19.0.3","TCP","1516","[TCP segment of a reassembled PDU]"
"7.587559","5.9.29.183","172.19.0.3","TCP","1492","9002 → 43520 [PSH, ACK] Seq=120820 Ack=15603 Win=65535 Len=1436 [TCP segment of a reassembled PDU]"
"7.587689","172.19.0.3","5.9.29.183","TCP","56","43520 → 9002 [ACK] Seq=15603 Ack=122256 Win=8458 Len=0"
"7.602636","5.9.29.183","172.19.0.3","TLSv1.2","787","Application Data"
"7.602728","5.9.29.183","172.19.0.3","TCP","1504","[TCP segment of a reassembled PDU]"
"7.602739","172.19.0.3","5.9.29.183","TCP","56","43520 → 9002 [ACK] Seq=15603 Ack=124435 Win=8458 Len=0"
"7.602950","5.9.29.183","172.19.0.3","TCP","1504","9002 → 43520 [PSH, ACK] Seq=124435 Ack=15603 Win=65535 Len=1448 [TCP segment of a reassembled PDU]"
"7.618194","5.9.29.183","172.19.0.3","TLSv1.2","787","Application Data"
"7.618214","172.19.0.3","5.9.29.183","TCP","56","43520 → 9002 [ACK] Seq=15603 Ack=126614 Win=8466 Len=0"
"7.693717","5.9.29.183","172.19.0.3","TLSv1.2","1113","Application Data"
"7.709740","5.9.29.183","172.19.0.3","TCP","1504","[TCP segment of a reassembled PDU]"
"7.709759","172.19.0.3","5.9.29.183","TCP","56","43520 → 9002 [ACK] Seq=15603 Ack=129119 Win=8466 Len=0"
"7.709800","5.9.29.183","172.19.0.3","TCP","1516","9002 → 43520 [PSH, ACK] Seq=129119 Ack=15603 Win=65535 Len=1460 [TCP segment of a reassembled PDU]"
"7.709838","5.9.29.183","172.19.0.3","TLSv1.2","1516","Application Data [TCP segment of a reassembled PDU]"
"7.709846","5.9.29.183","172.19.0.3","TCP","1516","9002 → 43520 [PSH, ACK] Seq=132039 Ack=15603 Win=65535 Len=1460 [TCP segment of a reassembled PDU]"
"7.709851","5.9.29.183","172.19.0.3","TCP","1516","9002 → 43520 [PSH, ACK] Seq=133499 Ack=15603 Win=65535 Len=1460 [TCP segment of a reassembled PDU]"
"7.709939","5.9.29.183","172.19.0.3","TLSv1.2","1456","Application Data [TCP segment of a reassembled PDU]"
"7.710028","5.9.29.183","172.19.0.3","TCP","1516","9002 → 43520 [PSH, ACK] Seq=136359 Ack=15603 Win=65535 Len=1460 [TCP segment of a reassembled PDU]"
"7.710082","5.9.29.183","172.19.0.3","TCP","1492","9002 → 43520 [PSH, ACK] Seq=137819 Ack=15603 Win=65535 Len=1436 [TCP segment of a reassembled PDU]"
"7.710121","172.19.0.3","5.9.29.183","TCP","56","43520 → 9002 [ACK] Seq=15603 Ack=137819 Win=8418 Len=0"
"7.710126","5.9.29.183","172.19.0.3","TLSv1.2","924","Application Data, Application Data"
"7.710186","172.19.0.3","5.9.29.183","TCP","56","43520 → 9002 [ACK] Seq=15603 Ack=140123 Win=8402 Len=0"
"7.751566","5.9.29.183","172.19.0.3","TCP","1504","[TCP segment of a reassembled PDU]"
"7.751671","5.9.29.183","172.19.0.3","TCP","1504","9002 → 43520 [PSH, ACK] Seq=141571 Ack=15603 Win=65535 Len=1448 [TCP segment of a reassembled PDU]"
"7.751689","172.19.0.3","5.9.29.183","TCP","56","43520 → 9002 [ACK] Seq=15603 Ack=143019 Win=8458 Len=0"
"7.751755","5.9.29.183","172.19.0.3","TLSv1.2","787","Application Data"
"7.752003","172.19.0.3","5.9.29.183","TLSv1.2","599","Application Data"
"7.752239","5.9.29.183","172.19.0.3","TCP","56","9002 → 43520 [ACK] Seq=143750 Ack=16146 Win=65535 Len=0"
"7.767508","5.9.29.183","172.19.0.3","TCP","1504","[TCP segment of a reassembled PDU]"
"7.767595","5.9.29.183","172.19.0.3","TCP","1516","9002 → 43520 [PSH, ACK] Seq=145198 Ack=16146 Win=65535 Len=1460 [TCP segment of a reassembled PDU]"
"7.767644","5.9.29.183","172.19.0.3","TLSv1.2","1516","Application Data [TCP segment of a reassembled PDU]"
"7.767737","5.9.29.183","172.19.0.3","TCP","1516","9002 → 43520 [PSH, ACK] Seq=148118 Ack=16146 Win=65535 Len=1460 [TCP segment of a reassembled PDU]"
"7.767790","172.19.0.3","5.9.29.183","TCP","56","43520 → 9002 [ACK] Seq=16146 Ack=149578 Win=8440 Len=0"
"7.767841","5.9.29.183","172.19.0.3","TCP","1516","9002 → 43520 [PSH, ACK] Seq=149578 Ack=16146 Win=65535 Len=1460 [TCP segment of a reassembled PDU]"
"7.767847","5.9.29.183","172.19.0.3","TLSv1.2","1456","Application Data [TCP segment of a reassembled PDU]"
"7.767874","172.19.0.3","5.9.29.183","TCP","56","43520 → 9002 [ACK] Seq=16146 Ack=152438 Win=8424 Len=0"
"7.767987","5.9.29.183","172.19.0.3","TCP","1504","9002 → 43520 [PSH, ACK] Seq=152438 Ack=16146 Win=65535 Len=1448 [TCP segment of a reassembled PDU]"
"7.783113","5.9.29.183","172.19.0.3","TLSv1.2","1504","Application Data [TCP segment of a reassembled PDU]"
"7.783135","172.19.0.3","5.9.29.183","TCP","56","43520 → 9002 [ACK] Seq=16146 Ack=155334 Win=8466 Len=0"
"7.783200","5.9.29.183","172.19.0.3","TCP","1516","9002 → 43520 [PSH, ACK] Seq=155334 Ack=16146 Win=65535 Len=1460 [TCP segment of a reassembled PDU]"
"7.783219","5.9.29.183","172.19.0.3","TCP","1492","9002 → 43520 [PSH, ACK] Seq=156794 Ack=16146 Win=65535 Len=1436 [TCP segment of a reassembled PDU]"
"7.783282","5.9.29.183","172.19.0.3","TLSv1.2","1141","Application Data, Application Data"
"7.783337","172.19.0.3","5.9.29.183","TCP","56","43520 → 9002 [ACK] Seq=16146 Ack=159315 Win=8442 Len=0"
"7.787587","172.19.0.3","5.9.29.183","TLSv1.2","599","Application Data"
"7.787783","5.9.29.183","172.19.0.3","TCP","56","9002 → 43520 [ACK] Seq=159315 Ack=16689 Win=65535 Len=0"
"8.306595","5.9.29.183","172.19.0.3","TLSv1.2","599","Application Data"
"8.307219","172.19.0.3","5.9.29.183","TLSv1.2","599","Application Data"
"8.307412","5.9.29.183","172.19.0.3","TCP","56","9002 → 43520 [ACK] Seq=159858 Ack=17232 Win=65535 Len=0"
"8.743702","5.9.29.183","172.19.0.3","TLSv1.2","599","Application Data"
"8.777528","5.9.29.183","172.19.0.3","TCP","1504","[TCP segment of a reassembled PDU]"
"8.777582","172.19.0.3","5.9.29.183","TCP","56","43520 → 9002 [ACK] Seq=17232 Ack=161849 Win=8466 Len=0"
"8.777683","5.9.29.183","172.19.0.3","TCP","1516","9002 → 43520 [PSH, ACK] Seq=161849 Ack=17232 Win=65535 Len=1460 [TCP segment of a reassembled PDU]"
"8.777691","5.9.29.183","172.19.0.3","TLSv1.2","1516","Application Data [TCP segment of a reassembled PDU]"
"8.777693","5.9.29.183","172.19.0.3","TCP","1516","9002 → 43520 [PSH, ACK] Seq=164769 Ack=17232 Win=65535 Len=1460 [TCP segment of a reassembled PDU]"
"8.777694","5.9.29.183","172.19.0.3","TCP","1201","9002 → 43520 [PSH, ACK] Seq=166229 Ack=17232 Win=65535 Len=1145 [TCP segment of a reassembled PDU]"
"8.777711","172.19.0.3","5.9.29.183","TCP","56","43520 → 9002 [ACK] Seq=17232 Ack=167374 Win=8434 Len=0"
"8.799152","5.9.29.183","172.19.0.3","TLSv1.2","1504","Application Data [TCP segment of a reassembled PDU]"
"8.799198","5.9.29.183","172.19.0.3","TCP","1516","9002 → 43520 [PSH, ACK] Seq=168822 Ack=17232 Win=65535 Len=1460 [TCP segment of a reassembled PDU]"
"8.799210","172.19.0.3","5.9.29.183","TCP","56","43520 → 9002 [ACK] Seq=17232 Ack=170282 Win=8458 Len=0"
"8.799212","5.9.29.183","172.19.0.3","TCP","1492","9002 → 43520 [PSH, ACK] Seq=170282 Ack=17232 Win=65535 Len=1436 [TCP segment of a reassembled PDU]"
"8.801896","5.9.29.183","172.19.0.3","TLSv1.2","134","Application Data"
"8.801903","172.19.0.3","5.9.29.183","TCP","56","43520 → 9002 [ACK] Seq=17232 Ack=171796 Win=8466 Len=0"
"8.820532","5.9.29.183","172.19.0.3","TCP","1516","[TCP segment of a reassembled PDU]"
"8.820580","5.9.29.183","172.19.0.3","TCP","1516","9002 → 43520 [PSH, ACK] Seq=173256 Ack=17232 Win=65535 Len=1460 [TCP segment of a reassembled PDU]"
"8.820586","5.9.29.183","172.19.0.3","TCP","1073","9002 → 43520 [PSH, ACK] Seq=174716 Ack=17232 Win=65535 Len=1017 [TCP segment of a reassembled PDU]"
"8.820589","5.9.29.183","172.19.0.3","TLSv1.2","196","Application Data"
"8.820703","172.19.0.3","5.9.29.183","TCP","56","43520 → 9002 [ACK] Seq=17232 Ack=175873 Win=8440 Len=0"
"8.820911","172.19.0.3","5.9.29.183","TLSv1.2","599","Application Data"
"8.821070","5.9.29.183","172.19.0.3","TCP","56","9002 → 43520 [ACK] Seq=175873 Ack=17775 Win=65535 Len=0"
"8.846418","5.9.29.183","172.19.0.3","TLSv1.2","1516","Application Data"
"8.846463","5.9.29.183","172.19.0.3","TCP","1516","9002 → 43520 [PSH, ACK] Seq=177333 Ack=17775 Win=65535 Len=1460 [TCP segment of a reassembled PDU]"
"8.846469","5.9.29.183","172.19.0.3","TLSv1.2","1480","Application Data [TCP segment of a reassembled PDU]"
"8.846471","5.9.29.183","172.19.0.3","TLSv1.2","489","Application Data"
"8.846657","172.19.0.3","5.9.29.183","TCP","56","43520 → 9002 [ACK] Seq=17775 Ack=180650 Win=8442 Len=0"
"8.854126","5.9.29.183","172.19.0.3","TCP","1516","[TCP segment of a reassembled PDU]"
"8.854220","5.9.29.183","172.19.0.3","TCP","1492","9002 → 43520 [PSH, ACK] Seq=182110 Ack=17775 Win=65535 Len=1436 [TCP segment of a reassembled PDU]"
"8.854235","172.19.0.3","5.9.29.183","TCP","56","43520 → 9002 [ACK] Seq=17775 Ack=183546 Win=8458 Len=0"
"8.854293","5.9.29.183","172.19.0.3","TLSv1.2","1516","Application Data [TCP segment of a reassembled PDU]"
"8.854297","5.9.29.183","172.19.0.3","TCP","1516","9002 → 43520 [PSH, ACK] Seq=185006 Ack=17775 Win=65535 Len=1460 [TCP segment of a reassembled PDU]"
"8.854299","5.9.29.183","172.19.0.3","TCP","1480","9002 → 43520 [PSH, ACK] Seq=186466 Ack=17775 Win=65535 Len=1424 [TCP segment of a reassembled PDU]"
"8.854332","172.19.0.3","5.9.29.183","TCP","56","43520 → 9002 [ACK] Seq=17775 Ack=187890 Win=8434 Len=0"
"8.867328","5.9.29.183","172.19.0.3","TLSv1.2","70","Application Data"
"8.867764","172.19.0.3","5.9.29.183","TLSv1.2","599","Application Data"
"8.867994","5.9.29.183","172.19.0.3","TCP","56","9002 → 43520 [ACK] Seq=187904 Ack=18318 Win=65535 Len=0"
"8.902725","5.9.29.183","172.19.0.3","TLSv1.2","1516","Application Data"
"8.902774","5.9.29.183","172.19.0.3","TCP","1492","9002 → 43520 [PSH, ACK] Seq=189364 Ack=18318 Win=65535 Len=1436 [TCP segment of a reassembled PDU]"
"8.902781","5.9.29.183","172.19.0.3","TCP","1516","9002 → 43520 [PSH, ACK] Seq=190800 Ack=18318 Win=65535 Len=1460 [TCP segment of a reassembled PDU]"
"8.902784","5.9.29.183","172.19.0.3","TLSv1.2","1516","Application Data [TCP segment of a reassembled PDU]"
"8.902798","5.9.29.183","172.19.0.3","TCP","1480","9002 → 43520 [PSH, ACK] Seq=193720 Ack=18318 Win=65535 Len=1424 [TCP segment of a reassembled PDU]"
"8.902867","5.9.29.183","172.19.0.3","TLSv1.2","1127","Application Data"
"8.902900","172.19.0.3","5.9.29.183","TCP","56","43520 → 9002 [ACK] Seq=18318 Ack=196215 Win=8426 Len=0"
"8.902959","5.9.29.183","172.19.0.3","TCP","1516","[TCP segment of a reassembled PDU]"
"8.902963","5.9.29.183","172.19.0.3","TCP","1516","9002 → 43520 [PSH, ACK] Seq=197675 Ack=18318 Win=65535 Len=1460 [TCP segment of a reassembled PDU]"
"8.902965","5.9.29.183","172.19.0.3","TLSv1.2","1480","Application Data [TCP segment of a reassembled PDU]"
"8.903030","172.19.0.3","5.9.29.183","TCP","56","43520 → 9002 [ACK] Seq=18318 Ack=200559 Win=8400 Len=0"
"8.903033","5.9.29.183","172.19.0.3","TCP","1516","9002 → 43520 [PSH, ACK] Seq=200559 Ack=18318 Win=65535 Len=1460 [TCP segment of a reassembled PDU]"
"8.903036","5.9.29.183","172.19.0.3","TCP","1492","9002 → 43520 [PSH, ACK] Seq=202019 Ack=18318 Win=65535 Len=1436 [TCP segment of a reassembled PDU]"
"8.903066","172.19.0.3","5.9.29.183","TCP","56","43520 → 9002 [ACK] Seq=18318 Ack=203455 Win=8383 Len=0"
"8.931737","5.9.29.183","172.19.0.3","TLSv1.2","1127","Application Data, Application Data"
"8.931840","5.9.29.183","172.19.0.3","TCP","1516","[TCP segment of a reassembled PDU]"
"8.931851","172.19.0.3","5.9.29.183","TCP","56","43520 → 9002 [ACK] Seq=18318 Ack=205986 Win=8458 Len=0"
"8.931853","5.9.29.183","172.19.0.3","TCP","1516","9002 → 43520 [PSH, ACK] Seq=205986 Ack=18318 Win=65535 Len=1460 [TCP segment of a reassembled PDU]"
"8.931878","5.9.29.183","172.19.0.3","TLSv1.2","1516","Application Data [TCP segment of a reassembled PDU]"
"8.931912","172.19.0.3","5.9.29.183","TCP","56","43520 → 9002 [ACK] Seq=18318 Ack=208906 Win=8442 Len=0"
"8.931937","5.9.29.183","172.19.0.3","TCP","1516","9002 → 43520 [PSH, ACK] Seq=208906 Ack=18318 Win=65535 Len=1460 [TCP segment of a reassembled PDU]"
"8.931942","5.9.29.183","172.19.0.3","TCP","1456","9002 → 43520 [PSH, ACK] Seq=210366 Ack=18318 Win=65535 Len=1400 [TCP segment of a reassembled PDU]"
"8.932065","172.19.0.3","5.9.29.183","TCP","56","43520 → 9002 [ACK] Seq=18318 Ack=211766 Win=8426 Len=0"
"8.959698","5.9.29.183","172.19.0.3","TLSv1.2","1516","Application Data, Application Data"
"8.959747","5.9.29.183","172.19.0.3","TCP","1516","9002 → 43520 [PSH, ACK] Seq=213226 Ack=18318 Win=65535 Len=1460 [TCP segment of a reassembled PDU]"
"8.959781","172.19.0.3","5.9.29.183","TCP","56","43520 → 9002 [ACK] Seq=18318 Ack=214686 Win=8458 Len=0"
"8.959784","5.9.29.183","172.19.0.3","TCP","1516","9002 → 43520 [PSH, ACK] Seq=214686 Ack=18318 Win=65535 Len=1460 [TCP segment of a reassembled PDU]"
"8.959788","5.9.29.183","172.19.0.3","TLSv1.2","577","Application Data [TCP segment of a reassembled PDU]"
"8.959790","5.9.29.183","172.19.0.3","TCP","1516","9002 → 43520 [PSH, ACK] Seq=216667 Ack=18318 Win=65535 Len=1460 [TCP segment of a reassembled PDU]"
"8.959792","5.9.29.183","172.19.0.3","TCP","1492","9002 → 43520 [PSH, ACK] Seq=218127 Ack=18318 Win=65535 Len=1436 [TCP segment of a reassembled PDU]"
"8.959860","172.19.0.3","5.9.29.183","TCP","56","43520 → 9002 [ACK] Seq=18318 Ack=219563 Win=8426 Len=0"
"8.960060","172.19.0.3","5.9.29.183","TLSv1.2","599","Application Data"
"8.960214","5.9.29.183","172.19.0.3","TCP","56","9002 → 43520 [ACK] Seq=219563 Ack=18861 Win=65535 Len=0"
"8.976741","5.9.29.183","172.19.0.3","TLSv1.2","1504","Application Data [TCP segment of a reassembled PDU]"
"8.976977","5.9.29.183","172.19.0.3","TLSv1.2","193","Application Data"
"8.976987","172.19.0.3","5.9.29.183","TCP","56","43520 → 9002 [ACK] Seq=18861 Ack=221148 Win=8458 Len=0"
"8.980187","172.19.0.3","5.9.29.183","TLSv1.2","599","Application Data"
"8.980484","5.9.29.183","172.19.0.3","TCP","56","9002 → 43520 [ACK] Seq=221148 Ack=19404 Win=65535 Len=0"
"9.503873","5.9.29.183","172.19.0.3","TLSv1.2","599","Application Data"
"9.504663","172.19.0.3","5.9.29.183","TLSv1.2","599","Application Data"
"9.504971","5.9.29.183","172.19.0.3","TCP","56","9002 → 43520 [ACK] Seq=221691 Ack=19947 Win=65535 Len=0"
"9.955662","5.9.29.183","172.19.0.3","TCP","1516","[TCP segment of a reassembled PDU]"
"9.955733","5.9.29.183","172.19.0.3","TCP","1516","9002 → 43520 [PSH, ACK] Seq=223151 Ack=19947 Win=65535 Len=1460 [TCP segment of a reassembled PDU]"
"9.955741","5.9.29.183","172.19.0.3","TLSv1.2","763","Application Data"
"9.955841","172.19.0.3","5.9.29.183","TCP","56","43520 → 9002 [ACK] Seq=19947 Ack=225318 Win=8448 Len=0"
"9.956056","172.19.0.3","5.9.29.183","TLSv1.2","599","Application Data"
"9.956211","5.9.29.183","172.19.0.3","TCP","56","9002 → 43520 [ACK] Seq=225318 Ack=20490 Win=65535 Len=0"
"9.973451","5.9.29.183","172.19.0.3","TCP","1516","[TCP segment of a reassembled PDU]"
"9.973494","5.9.29.183","172.19.0.3","TCP","1492","9002 → 43520 [PSH, ACK] Seq=226778 Ack=20490 Win=65535 Len=1436 [TCP segment of a reassembled PDU]"
"9.973668","172.19.0.3","5.9.29.183","TCP","56","43520 → 9002 [ACK] Seq=20490 Ack=228214 Win=8458 Len=0"
"9.981531","5.9.29.183","172.19.0.3","TLSv1.2","787","Application Data"
"10.018540","5.9.29.183","172.19.0.3","TLSv1.2","1113","Application Data"
"10.018557","172.19.0.3","5.9.29.183","TCP","56","43520 → 9002 [ACK] Seq=20490 Ack=230002 Win=8466 Len=0"
"10.038712","5.9.29.183","172.19.0.3","TCP","1516","[TCP segment of a reassembled PDU]"
"10.038766","5.9.29.183","172.19.0.3","TCP","1516","9002 → 43520 [PSH, ACK] Seq=231462 Ack=20490 Win=65535 Len=1460 [TCP segment of a reassembled PDU]"
"10.038779","5.9.29.183","172.19.0.3","TLSv1.2","1480","Application Data [TCP segment of a reassembled PDU]"
"10.038913","172.19.0.3","5.9.29.183","TCP","56","43520 → 9002 [ACK] Seq=20490 Ack=234346 Win=8450 Len=0"
"10.038944","5.9.29.183","172.19.0.3","TLSv1.2","1424","Application Data"
"10.050246","5.9.29.183","172.19.0.3","TCP","1516","[TCP segment of a reassembled PDU]"
"10.050263","172.19.0.3","5.9.29.183","TCP","56","43520 → 9002 [ACK] Seq=20490 Ack=237174 Win=8466 Len=0"
"10.050303","5.9.29.183","172.19.0.3","TCP","1492","9002 → 43520 [PSH, ACK] Seq=237174 Ack=20490 Win=65535 Len=1436 [TCP segment of a reassembled PDU]"
"10.050332","5.9.29.183","172.19.0.3","TLSv1.2","1516","Application Data [TCP segment of a reassembled PDU]"
"10.050338","5.9.29.183","172.19.0.3","TCP","1255","9002 → 43520 [PSH, ACK] Seq=240070 Ack=20490 Win=65535 Len=1199 [TCP segment of a reassembled PDU]"
"10.050342","5.9.29.183","172.19.0.3","TCP","293","9002 → 43520 [PSH, ACK] Seq=241269 Ack=20490 Win=65535 Len=237 [TCP segment of a reassembled PDU]"
"10.050426","172.19.0.3","5.9.29.183","TCP","56","43520 → 9002 [ACK] Seq=20490 Ack=241506 Win=8434 Len=0"
"10.059607","5.9.29.183","172.19.0.3","TLSv1.2","490","Application Data"
"10.064991","5.9.29.183","172.19.0.3","TCP","1516","[TCP segment of a reassembled PDU]"
"10.065007","172.19.0.3","5.9.29.183","TCP","56","43520 → 9002 [ACK] Seq=20490 Ack=243400 Win=8466 Len=0"
"10.065039","5.9.29.183","172.19.0.3","TCP","1516","9002 → 43520 [PSH, ACK] Seq=243400 Ack=20490 Win=65535 Len=1460 [TCP segment of a reassembled PDU]"
"10.065068","5.9.29.183","172.19.0.3","TLSv1.2","1516","Application Data [TCP segment of a reassembled PDU]"
"10.065073","5.9.29.183","172.19.0.3","TCP","1468","9002 → 43520 [PSH, ACK] Seq=246320 Ack=20490 Win=65535 Len=1412 [TCP segment of a reassembled PDU]"
"10.065076","5.9.29.183","172.19.0.3","TCP","1504","9002 → 43520 [PSH, ACK] Seq=247732 Ack=20490 Win=65535 Len=1448 [TCP segment of a reassembled PDU]"
"10.065180","172.19.0.3","5.9.29.183","TCP","56","43520 → 9002 [ACK] Seq=20490 Ack=249180 Win=8432 Len=0"
"10.098795","5.9.29.183","172.19.0.3","TLSv1.2","1127","Application Data, Application Data"
"10.098991","5.9.29.183","172.19.0.3","TCP","1516","[TCP segment of a reassembled PDU]"
"10.099017","172.19.0.3","5.9.29.183","TCP","56","43520 → 9002 [ACK] Seq=20490 Ack=251711 Win=8458 Len=0"
"10.099046","5.9.29.183","172.19.0.3","TCP","1516","9002 → 43520 [PSH, ACK] Seq=251711 Ack=20490 Win=65535 Len=1460 [TCP segment of a reassembled PDU]"
"10.099049","5.9.29.183","172.19.0.3","TLSv1.2","1516","Application Data [TCP segment of a reassembled PDU]"
"10.099156","5.9.29.183","172.19.0.3","TCP","1516","9002 → 43520 [PSH, ACK] Seq=254631 Ack=20490 Win=65535 Len=1460 [TCP segment of a reassembled PDU]"
"10.099160","5.9.29.183","172.19.0.3","TCP","1516","9002 → 43520 [PSH, ACK] Seq=256091 Ack=20490 Win=65535 Len=1460 [TCP segment of a reassembled PDU]"
"10.099165","5.9.29.183","172.19.0.3","TLSv1.2","1516","Application Data [TCP segment of a reassembled PDU]"
"10.099172","5.9.29.183","172.19.0.3","TCP","1432","9002 → 43520 [PSH, ACK] Seq=259011 Ack=20490 Win=65535 Len=1376 [TCP segment of a reassembled PDU]"
"10.099255","172.19.0.3","5.9.29.183","TLSv1.2","599","Application Data"
"10.099397","5.9.29.183","172.19.0.3","TCP","56","9002 → 43520 [ACK] Seq=260387 Ack=21033 Win=65535 Len=0"
"10.114898","5.9.29.183","172.19.0.3","TLSv1.2","801","Application Data"
"10.114943","5.9.29.183","172.19.0.3","TCP","1504","[TCP segment of a reassembled PDU]"
"10.114954","172.19.0.3","5.9.29.183","TCP","56","43520 → 9002 [ACK] Seq=21033 Ack=262580 Win=8458 Len=0"
"10.115651","5.9.29.183","172.19.0.3","TCP","1504","9002 → 43520 [PSH, ACK] Seq=262580 Ack=21033 Win=65535 Len=1448 [TCP segment of a reassembled PDU]"
"10.126727","5.9.29.183","172.19.0.3","TLSv1.2","1516","Application Data, Application Data"
"10.126744","172.19.0.3","5.9.29.183","TCP","56","43520 → 9002 [ACK] Seq=21033 Ack=265488 Win=8466 Len=0"
"10.126777","5.9.29.183","172.19.0.3","TCP","1516","9002 → 43520 [PSH, ACK] Seq=265488 Ack=21033 Win=65535 Len=1460 [TCP segment of a reassembled PDU]"
"10.126806","5.9.29.183","172.19.0.3","TCP","1516","9002 → 43520 [PSH, ACK] Seq=266948 Ack=21033 Win=65535 Len=1460 [TCP segment of a reassembled PDU]"
"10.126811","5.9.29.183","172.19.0.3","TLSv1.2","1516","Application Data [TCP segment of a reassembled PDU]"
"10.126815","5.9.29.183","172.19.0.3","TCP","1456","9002 → 43520 [PSH, ACK] Seq=269868 Ack=21033 Win=65535 Len=1400 [TCP segment of a reassembled PDU]"
"10.126899","172.19.0.3","5.9.29.183","TCP","56","43520 → 9002 [ACK] Seq=21033 Ack=271268 Win=8434 Len=0"
"10.131577","5.9.29.183","172.19.0.3","TLSv1.2","830","Application Data"
"10.151393","5.9.29.183","172.19.0.3","TCP","1516","[TCP segment of a reassembled PDU]"
"10.151410","172.19.0.3","5.9.29.183","TCP","56","43520 → 9002 [ACK] Seq=21033 Ack=273502 Win=8466 Len=0"
"10.151442","5.9.29.183","172.19.0.3","TCP","1492","9002 → 43520 [PSH, ACK] Seq=273502 Ack=21033 Win=65535 Len=1436 [TCP segment of a reassembled PDU]"
"10.151449","5.9.29.183","172.19.0.3","TLSv1.2","1516","Application Data [TCP segment of a reassembled PDU]"
"10.151452","5.9.29.183","172.19.0.3","TCP","1516","9002 → 43520 [PSH, ACK] Seq=276398 Ack=21033 Win=65535 Len=1460 [TCP segment of a reassembled PDU]"
"10.151454","5.9.29.183","172.19.0.3","TCP","1516","9002 → 43520 [PSH, ACK] Seq=277858 Ack=21033 Win=65535 Len=1460 [TCP segment of a reassembled PDU]"
"10.151456","5.9.29.183","172.19.0.3","TLSv1.2","548","Application Data"
"10.151641","172.19.0.3","5.9.29.183","TCP","56","43520 → 9002 [ACK] Seq=21033 Ack=279810 Win=8424 Len=0"
"10.151823","172.19.0.3","5.9.29.183","TLSv1.2","599","Application Data"
"10.151970","5.9.29.183","172.19.0.3","TCP","56","9002 → 43520 [ACK] Seq=279810 Ack=21576 Win=65535 Len=0"
"10.162789","172.19.0.3","5.9.29.183","TLSv1.2","599","Application Data"
"10.163166","5.9.29.183","172.19.0.3","TCP","56","9002 → 43520 [ACK] Seq=279810 Ack=22119 Win=65535 Len=0"
"10.163865","5.9.29.183","172.19.0.3","TCP","1516","[TCP segment of a reassembled PDU]"
"10.163895","5.9.29.183","172.19.0.3","TCP","1492","9002 → 43520 [PSH, ACK] Seq=281270 Ack=22119 Win=65535 Len=1436 [TCP segment of a reassembled PDU]"
"10.163952","172.19.0.3","5.9.29.183","TCP","56","43520 → 9002 [ACK] Seq=22119 Ack=282706 Win=8458 Len=0"
"10.172353","5.9.29.183","172.19.0.3","TLSv1.2","1330","Application Data, Application Data"
"10.212722","172.19.0.3","5.9.29.183","TCP","56","43520 → 9002 [ACK] Seq=22119 Ack=283980 Win=8466 Len=0"
"10.231986","5.9.29.183","172.19.0.3","TCP","1516","[TCP segment of a reassembled PDU]"
"10.232028","5.9.29.183","172.19.0.3","TLSv1.2","1195","Application Data"
"10.232143","172.19.0.3","5.9.29.183","TCP","56","43520 → 9002 [ACK] Seq=22119 Ack=286579 Win=8458 Len=0"
"10.235794","172.19.0.3","5.9.29.183","TLSv1.2","599","Application Data"
"10.236083","5.9.29.183","172.19.0.3","TCP","56","9002 → 43520 [ACK] Seq=286579 Ack=22662 Win=65535 Len=0"
"10.766225","5.9.29.183","172.19.0.3","TLSv1.2","599","Application Data"
"10.766968","172.19.0.3","5.9.29.183","TLSv1.2","599","Application Data"
"10.767184","5.9.29.183","172.19.0.3","TCP","56","9002 → 43520 [ACK] Seq=287122 Ack=23205 Win=65535 Len=0"
"11.242642","5.9.29.183","172.19.0.3","TLSv1.2","599","Application Data"
"11.283612","172.19.0.3","5.9.29.183","TCP","56","43520 → 9002 [ACK] Seq=23205 Ack=287665 Win=8466 Len=0"
"11.300108","5.9.29.183","172.19.0.3","TCP","1516","[TCP segment of a reassembled PDU]"
"11.300125","172.19.0.3","5.9.29.183","TCP","56","43520 → 9002 [ACK] Seq=23205 Ack=289125 Win=8466 Len=0"
"11.300158","5.9.29.183","172.19.0.3","TCP","1516","9002 → 43520 [PSH, ACK] Seq=289125 Ack=23205 Win=65535 Len=1460 [TCP segment of a reassembled PDU]"
"11.300169","172.19.0.3","5.9.29.183","TCP","56","43520 → 9002 [ACK] Seq=23205 Ack=290585 Win=8458 Len=0"
"11.300170","5.9.29.183","172.19.0.3","TLSv1.2","1213","Application Data"
"11.300174","172.19.0.3","5.9.29.183","TCP","56","43520 → 9002 [ACK] Seq=23205 Ack=291742 Win=8450 Len=0"
"11.300175","5.9.29.183","172.19.0.3","TCP","1516","[TCP segment of a reassembled PDU]"
"11.300179","172.19.0.3","5.9.29.183","TCP","56","43520 → 9002 [ACK] Seq=23205 Ack=293202 Win=8442 Len=0"
"11.300179","5.9.29.183","172.19.0.3","TCP","1492","9002 → 43520 [PSH, ACK] Seq=293202 Ack=23205 Win=65535 Len=1436 [TCP segment of a reassembled PDU]"
"11.300183","172.19.0.3","5.9.29.183","TCP","56","43520 → 9002 [ACK] Seq=23205 Ack=294638 Win=8434 Len=0"
"11.333022","5.9.29.183","172.19.0.3","TLSv1.2","1516","Application Data, Application Data"
"11.333039","172.19.0.3","5.9.29.183","TCP","56","43520 → 9002 [ACK] Seq=23205 Ack=296098 Win=8466 Len=0"
"11.333072","5.9.29.183","172.19.0.3","TCP","1516","9002 → 43520 [PSH, ACK] Seq=296098 Ack=23205 Win=65535 Len=1460 [TCP segment of a reassembled PDU]"
"11.333079","172.19.0.3","5.9.29.183","TCP","56","43520 → 9002 [ACK] Seq=23205 Ack=297558 Win=8458 Len=0"
"11.333081","5.9.29.183","172.19.0.3","TCP","1480","9002 → 43520 [PSH, ACK] Seq=297558 Ack=23205 Win=65535 Len=1424 [TCP segment of a reassembled PDU]"
"11.333085","172.19.0.3","5.9.29.183","TCP","56","43520 → 9002 [ACK] Seq=23205 Ack=298982 Win=8450 Len=0"
"11.333085","5.9.29.183","172.19.0.3","TLSv1.2","163","Application Data"
"11.333089","172.19.0.3","5.9.29.183","TCP","56","43520 → 9002 [ACK] Seq=23205 Ack=299089 Win=8450 Len=0"
"11.386288","5.9.29.183","172.19.0.3","TLSv1.2","1113","Application Data"
"11.386308","172.19.0.3","5.9.29.183","TCP","56","43520 → 9002 [ACK] Seq=23205 Ack=300146 Win=8466 Len=0"
"11.389797","172.19.0.3","5.9.29.183","TLSv1.2","599","Application Data"
"11.390035","5.9.29.183","172.19.0.3","TCP","56","9002 → 43520 [ACK] Seq=300146 Ack=23748 Win=65535 Len=0"
"11.850594","5.9.29.183","172.19.0.3","TLSv1.2","599","Application Data"
"11.851372","172.19.0.3","5.9.29.183","TLSv1.2","599","Application Data"
"11.851601","5.9.29.183","172.19.0.3","TCP","56","9002 → 43520 [ACK] Seq=300689 Ack=24291 Win=65535 Len=0"
"12.267967","5.9.29.183","172.19.0.3","TLSv1.2","599","Application Data"
"12.308720","172.19.0.3","5.9.29.183","TCP","56","43520 → 9002 [ACK] Seq=24291 Ack=301232 Win=8466 Len=0"
"12.350122","5.9.29.183","172.19.0.3","TCP","1516","[TCP segment of a reassembled PDU]"
"12.350140","172.19.0.3","5.9.29.183","TCP","56","43520 → 9002 [ACK] Seq=24291 Ack=302692 Win=8466 Len=0"
"12.350152","5.9.29.183","172.19.0.3","TLSv1.2","167","Application Data"
"12.350159","172.19.0.3","5.9.29.183","TCP","56","43520 → 9002 [ACK] Seq=24291 Ack=302803 Win=8466 Len=0"
"12.353683","172.19.0.3","5.9.29.183","TLSv1.2","599","Application Data"
"12.353872","5.9.29.183","172.19.0.3","TCP","56","9002 → 43520 [ACK] Seq=302803 Ack=24834 Win=65535 Len=0"
"12.883038","5.9.29.183","172.19.0.3","TLSv1.2","599","Application Data"
"12.883618","172.19.0.3","5.9.29.183","TLSv1.2","599","Application Data"
"12.883813","5.9.29.183","172.19.0.3","TCP","56","9002 → 43520 [ACK] Seq=303346 Ack=25377 Win=65535 Len=0"
"13.349800","5.9.29.183","172.19.0.3","TLSv1.2","599","Application Data"
"13.380868","5.9.29.183","172.19.0.3","TCP","1516","[TCP segment of a reassembled PDU]"
"13.380885","172.19.0.3","5.9.29.183","TCP","56","43520 → 9002 [ACK] Seq=25377 Ack=305349 Win=8466 Len=0"
"13.380897","5.9.29.183","172.19.0.3","TCP","1512","9002 → 43520 [PSH, ACK] Seq=305349 Ack=25377 Win=65535 Len=1456 [TCP segment of a reassembled PDU]"
"13.380904","5.9.29.183","172.19.0.3","TLSv1.2","767","Application Data"
"13.381026","172.19.0.3","5.9.29.183","TCP","56","43520 → 9002 [ACK] Seq=25377 Ack=307516 Win=8450 Len=0"
"13.381139","5.9.29.183","172.19.0.3","TCP","1516","[TCP segment of a reassembled PDU]"
"13.381158","5.9.29.183","172.19.0.3","TCP","1492","9002 → 43520 [PSH, ACK] Seq=308976 Ack=25377 Win=65535 Len=1436 [TCP segment of a reassembled PDU]"
"13.381166","172.19.0.3","5.9.29.183","TCP","56","43520 → 9002 [ACK] Seq=25377 Ack=310412 Win=8458 Len=0"
"13.381376","5.9.29.183","172.19.0.3","TLSv1.2","1330","Application Data, Application Data"
"13.386347","5.9.29.183","172.19.0.3","TCP","1516","[TCP segment of a reassembled PDU]"
"13.386371","172.19.0.3","5.9.29.183","TCP","56","43520 → 9002 [ACK] Seq=25377 Ack=313146 Win=8466 Len=0"
"13.386385","5.9.29.183","172.19.0.3","TCP","1492","9002 → 43520 [PSH, ACK] Seq=313146 Ack=25377 Win=65535 Len=1436 [TCP segment of a reassembled PDU]"
"13.386391","5.9.29.183","172.19.0.3","TLSv1.2","1504","Application Data [TCP segment of a reassembled PDU]"
"13.386587","172.19.0.3","5.9.29.183","TCP","56","43520 → 9002 [ACK] Seq=25377 Ack=316030 Win=8450 Len=0"
"13.389979","5.9.29.183","172.19.0.3","TLSv1.2","1504","Application Data [TCP segment of a reassembled PDU]"
"13.390004","5.9.29.183","172.19.0.3","TCP","1504","9002 → 43520 [PSH, ACK] Seq=317478 Ack=25377 Win=65535 Len=1448 [TCP segment of a reassembled PDU]"
"13.390014","172.19.0.3","5.9.29.183","TCP","56","43520 → 9002 [ACK] Seq=25377 Ack=318926 Win=8458 Len=0"
"13.401242","5.9.29.183","172.19.0.3","TLSv1.2","613","Application Data"
"13.403413","5.9.29.183","172.19.0.3","TCP","1516","[TCP segment of a reassembled PDU]"
"13.403431","172.19.0.3","5.9.29.183","TCP","56","43520 → 9002 [ACK] Seq=25377 Ack=320943 Win=8466 Len=0"
"13.403444","5.9.29.183","172.19.0.3","TCP","1492","9002 → 43520 [PSH, ACK] Seq=320943 Ack=25377 Win=65535 Len=1436 [TCP segment of a reassembled PDU]"
"13.416700","5.9.29.183","172.19.0.3","TLSv1.2","1330","Application Data, Application Data"
"13.416719","172.19.0.3","5.9.29.183","TCP","56","43520 → 9002 [ACK] Seq=25377 Ack=323653 Win=8466 Len=0"
"13.419579","5.9.29.183","172.19.0.3","TCP","1504","[TCP segment of a reassembled PDU]"
"13.419609","5.9.29.183","172.19.0.3","TCP","1504","9002 → 43520 [PSH, ACK] Seq=325101 Ack=25377 Win=65535 Len=1448 [TCP segment of a reassembled PDU]"
"13.419710","172.19.0.3","5.9.29.183","TCP","56","43520 → 9002 [ACK] Seq=25377 Ack=326549 Win=8456 Len=0"
"13.431735","5.9.29.183","172.19.0.3","TLSv1.2","1504","Application Data [TCP segment of a reassembled PDU]"
"13.431758","5.9.29.183","172.19.0.3","TCP","1516","9002 → 43520 [PSH, ACK] Seq=327997 Ack=25377 Win=65535 Len=1460 [TCP segment of a reassembled PDU]"
"13.431768","172.19.0.3","5.9.29.183","TCP","56","43520 → 9002 [ACK] Seq=25377 Ack=329457 Win=8458 Len=0"
"13.431770","5.9.29.183","172.19.0.3","TCP","1516","9002 → 43520 [PSH, ACK] Seq=329457 Ack=25377 Win=65535 Len=1460 [TCP segment of a reassembled PDU]"
"13.431772","5.9.29.183","172.19.0.3","TLSv1.2","1480","Application Data [TCP segment of a reassembled PDU]"
"13.431776","5.9.29.183","172.19.0.3","TCP","1516","9002 → 43520 [PSH, ACK] Seq=332341 Ack=25377 Win=65535 Len=1460 [TCP segment of a reassembled PDU]"
"13.431778","5.9.29.183","172.19.0.3","TCP","1516","9002 → 43520 [PSH, ACK] Seq=333801 Ack=25377 Win=65535 Len=1460 [TCP segment of a reassembled PDU]"
"13.431846","5.9.29.183","172.19.0.3","TLSv1.2","386","Application Data, Application Data"
"13.431914","172.19.0.3","5.9.29.183","TCP","56","43520 → 9002 [ACK] Seq=25377 Ack=335591 Win=8418 Len=0"
"13.432340","172.19.0.3","5.9.29.183","TLSv1.2","599","Application Data"
"13.432514","5.9.29.183","172.19.0.3","TCP","56","9002 → 43520 [ACK] Seq=335591 Ack=25920 Win=65535 Len=0"
"13.442990","172.19.0.3","5.9.29.183","TLSv1.2","599","Application Data"
"13.443516","5.9.29.183","172.19.0.3","TCP","56","9002 → 43520 [ACK] Seq=335591 Ack=26463 Win=65535 Len=0"
"13.455057","5.9.29.183","172.19.0.3","TCP","1516","[TCP segment of a reassembled PDU]"
"13.455073","5.9.29.183","172.19.0.3","TCP","1492","9002 → 43520 [PSH, ACK] Seq=337051 Ack=26463 Win=65535 Len=1436 [TCP segment of a reassembled PDU]"
"13.455077","5.9.29.183","172.19.0.3","TLSv1.2","1237","Application Data"
"13.455159","172.19.0.3","5.9.29.183","TCP","56","43520 → 9002 [ACK] Seq=26463 Ack=339668 Win=8450 Len=0"
"13.471484","5.9.29.183","172.19.0.3","TLSv1.2","1516","Application Data"
"13.471524","5.9.29.183","172.19.0.3","TCP","1516","9002 → 43520 [PSH, ACK] Seq=341128 Ack=26463 Win=65535 Len=1460 [TCP segment of a reassembled PDU]"
"13.471540","172.19.0.3","5.9.29.183","TCP","56","43520 → 9002 [ACK] Seq=26463 Ack=342588 Win=8458 Len=0"
"13.471543","5.9.29.183","172.19.0.3","TLSv1.2","1516","Application Data [TCP segment of a reassembled PDU]"
"13.471547","5.9.29.183","172.19.0.3","TCP","1468","9002 → 43520 [PSH, ACK] Seq=344048 Ack=26463 Win=65535 Len=1412 [TCP segment of a reassembled PDU]"
"13.471631","5.9.29.183","172.19.0.3","TCP","1504","9002 → 43520 [PSH, ACK] Seq=345460 Ack=26463 Win=65535 Len=1448 [TCP segment of a reassembled PDU]"
"13.471635","5.9.29.183","172.19.0.3","TLSv1.2","677","Application Data"
"13.471692","172.19.0.3","5.9.29.183","TCP","56","43520 → 9002 [ACK] Seq=26463 Ack=347529 Win=8426 Len=0"
"13.517578","5.9.29.183","172.19.0.3","TCP","1504","[TCP segment of a reassembled PDU]"
"13.517608","5.9.29.183","172.19.0.3","TCP","1516","9002 → 43520 [PSH, ACK] Seq=348977 Ack=26463 Win=65535 Len=1460 [TCP segment of a reassembled PDU]"
"13.517627","172.19.0.3","5.9.29.183","TCP","56","43520 → 9002 [ACK] Seq=26463 Ack=350437 Win=8458 Len=0"
"13.517629","5.9.29.183","172.19.0.3","TLSv1.2","775","Application Data"
"13.521338","172.19.0.3","5.9.29.183","TLSv1.2","599","Application Data"
"13.521717","5.9.29.183","172.19.0.3","TCP","56","9002 → 43520 [ACK] Seq=351156 Ack=27006 Win=65535 Len=0"
"13.959542","5.9.29.183","172.19.0.3","TLSv1.2","599","Application Data"
"13.960113","172.19.0.3","5.9.29.183","TLSv1.2","599","Application Data"
"13.960308","5.9.29.183","172.19.0.3","TCP","56","9002 → 43520 [ACK] Seq=351699 Ack=27549 Win=65535 Len=0"
"14.354256","5.9.29.183","172.19.0.3","TLSv1.2","599","Application Data"
"14.395726","172.19.0.3","5.9.29.183","TCP","56","43520 → 9002 [ACK] Seq=27549 Ack=352242 Win=8466 Len=0"
"14.395993","5.9.29.183","172.19.0.3","TCP","1516","[TCP segment of a reassembled PDU]"
"14.396002","172.19.0.3","5.9.29.183","TCP","56","43520 → 9002 [ACK] Seq=27549 Ack=353702 Win=8466 Len=0"
"14.396012","5.9.29.183","172.19.0.3","TCP","1516","9002 → 43520 [PSH, ACK] Seq=353702 Ack=27549 Win=65535 Len=1460 [TCP segment of a reassembled PDU]"
"14.396019","172.19.0.3","5.9.29.183","TCP","56","43520 → 9002 [ACK] Seq=27549 Ack=355162 Win=8458 Len=0"
"14.396019","5.9.29.183","172.19.0.3","TLSv1.2","1213","Application Data"
"14.396023","172.19.0.3","5.9.29.183","TCP","56","43520 → 9002 [ACK] Seq=27549 Ack=356319 Win=8450 Len=0"
"14.396089","5.9.29.183","172.19.0.3","TCP","1516","[TCP segment of a reassembled PDU]"
"14.396098","172.19.0.3","5.9.29.183","TCP","56","43520 → 9002 [ACK] Seq=27549 Ack=357779 Win=8440 Len=0"
"14.396099","5.9.29.183","172.19.0.3","TCP","1492","9002 → 43520 [PSH, ACK] Seq=357779 Ack=27549 Win=65535 Len=1436 [TCP segment of a reassembled PDU]"
"14.396103","172.19.0.3","5.9.29.183","TCP","56","43520 → 9002 [ACK] Seq=27549 Ack=359215 Win=8432 Len=0"
"14.411560","5.9.29.183","172.19.0.3","TLSv1.2","851","Application Data"
"14.411580","172.19.0.3","5.9.29.183","TCP","56","43520 → 9002 [ACK] Seq=27549 Ack=360010 Win=8466 Len=0"
"14.415939","5.9.29.183","172.19.0.3","TCP","1516","[TCP segment of a reassembled PDU]"
"14.415953","172.19.0.3","5.9.29.183","TCP","56","43520 → 9002 [ACK] Seq=27549 Ack=361470 Win=8466 Len=0"
"14.415962","5.9.29.183","172.19.0.3","TCP","1492","9002 → 43520 [PSH, ACK] Seq=361470 Ack=27549 Win=65535 Len=1436 [TCP segment of a reassembled PDU]"
"14.415967","172.19.0.3","5.9.29.183","TCP","56","43520 → 9002 [ACK] Seq=27549 Ack=362906 Win=8458 Len=0"
"14.426490","5.9.29.183","172.19.0.3","TLSv1.2","787","Application Data"
"14.426513","172.19.0.3","5.9.29.183","TCP","56","43520 → 9002 [ACK] Seq=27549 Ack=363637 Win=8466 Len=0"
"14.426616","5.9.29.183","172.19.0.3","TCP","1504","[TCP segment of a reassembled PDU]"
"14.426623","172.19.0.3","5.9.29.183","TCP","56","43520 → 9002 [ACK] Seq=27549 Ack=365085 Win=8458 Len=0"
"14.427029","5.9.29.183","172.19.0.3","TCP","1516","9002 → 43520 [PSH, ACK] Seq=365085 Ack=27549 Win=65535 Len=1460 [TCP segment of a reassembled PDU]"
"14.427035","172.19.0.3","5.9.29.183","TCP","56","43520 → 9002 [ACK] Seq=27549 Ack=366545 Win=8466 Len=0"
"14.427056","5.9.29.183","172.19.0.3","TLSv1.2","1516","Application Data [TCP segment of a reassembled PDU]"
"14.427065","172.19.0.3","5.9.29.183","TCP","56","43520 → 9002 [ACK] Seq=27549 Ack=368005 Win=8458 Len=0"
"14.427122","5.9.29.183","172.19.0.3","TCP","1516","9002 → 43520 [PSH, ACK] Seq=368005 Ack=27549 Win=65535 Len=1460 [TCP segment of a reassembled PDU]"
"14.427128","172.19.0.3","5.9.29.183","TCP","56","43520 → 9002 [ACK] Seq=27549 Ack=369465 Win=8450 Len=0"
"14.427129","5.9.29.183","172.19.0.3","TCP","1468","9002 → 43520 [PSH, ACK] Seq=369465 Ack=27549 Win=65535 Len=1412 [TCP segment of a reassembled PDU]"
"14.427133","172.19.0.3","5.9.29.183","TCP","56","43520 → 9002 [ACK] Seq=27549 Ack=370877 Win=8442 Len=0"
"14.442216","5.9.29.183","172.19.0.3","TLSv1.2","1127","Application Data, Application Data"
"14.442235","172.19.0.3","5.9.29.183","TCP","56","43520 → 9002 [ACK] Seq=27549 Ack=371948 Win=8466 Len=0"
"14.460740","5.9.29.183","172.19.0.3","TCP","449","[TCP segment of a reassembled PDU]"
"14.460796","5.9.29.183","172.19.0.3","TCP","1516","9002 → 43520 [PSH, ACK] Seq=372341 Ack=27549 Win=65535 Len=1460 [TCP segment of a reassembled PDU]"
"14.460824","5.9.29.183","172.19.0.3","TCP","1516","9002 → 43520 [PSH, ACK] Seq=373801 Ack=27549 Win=65535 Len=1460 [TCP segment of a reassembled PDU]"
"14.460827","5.9.29.183","172.19.0.3","TLSv1.2","820","Application Data"
"14.460886","172.19.0.3","5.9.29.183","TCP","56","43520 → 9002 [ACK] Seq=27549 Ack=376025 Win=8442 Len=0"
"14.476186","5.9.29.183","172.19.0.3","TLSv1.2","1516","Application Data"
"14.476202","5.9.29.183","172.19.0.3","TCP","1492","9002 → 43520 [PSH, ACK] Seq=377485 Ack=27549 Win=65535 Len=1436 [TCP segment of a reassembled PDU]"
"14.476220","172.19.0.3","5.9.29.183","TCP","56","43520 → 9002 [ACK] Seq=27549 Ack=378921 Win=8458 Len=0"
"14.476222","5.9.29.183","172.19.0.3","TLSv1.2","880","Application Data"
"14.476454","172.19.0.3","5.9.29.183","TCP","56","43520 → 9002 [ACK] Seq=27549 Ack=379745 Win=8466 Len=0"
"14.476624","172.19.0.3","5.9.29.183","TLSv1.2","599","Application Data"
"14.476795","5.9.29.183","172.19.0.3","TCP","56","9002 → 43520 [ACK] Seq=379745 Ack=28092 Win=65535 Len=0"
"14.487272","5.9.29.183","172.19.0.3","TCP","1516","[TCP segment of a reassembled PDU]"
"14.487294","5.9.29.183","172.19.0.3","TCP","1492","9002 → 43520 [PSH, ACK] Seq=381205 Ack=28092 Win=65535 Len=1436 [TCP segment of a reassembled PDU]"
"14.487298","5.9.29.183","172.19.0.3","TLSv1.2","1516","Application Data [TCP segment of a reassembled PDU]"
"14.487300","5.9.29.183","172.19.0.3","TCP","1516","9002 → 43520 [PSH, ACK] Seq=384101 Ack=28092 Win=65535 Len=1460 [TCP segment of a reassembled PDU]"
"14.487302","5.9.29.183","172.19.0.3","TCP","1516","9002 → 43520 [PSH, ACK] Seq=385561 Ack=28092 Win=65535 Len=1460 [TCP segment of a reassembled PDU]"
"14.487304","5.9.29.183","172.19.0.3","TLSv1.2","1468","Application Data [TCP segment of a reassembled PDU]"
"14.487463","172.19.0.3","5.9.29.183","TCP","56","43520 → 9002 [ACK] Seq=28092 Ack=388433 Win=8424 Len=0"
"14.487795","172.19.0.3","5.9.29.183","TLSv1.2","599","Application Data"
"14.487983","5.9.29.183","172.19.0.3","TCP","56","9002 → 43520 [ACK] Seq=388433 Ack=28635 Win=65535 Len=0"
"14.492012","5.9.29.183","172.19.0.3","TLSv1.2","193","Application Data"
"14.496589","172.19.0.3","5.9.29.183","TLSv1.2","599","Application Data"
"14.496837","5.9.29.183","172.19.0.3","TCP","56","9002 → 43520 [ACK] Seq=388570 Ack=29178 Win=65535 Len=0"
"14.979218","5.9.29.183","172.19.0.3","TLSv1.2","599","Application Data"
"14.979825","172.19.0.3","5.9.29.183","TLSv1.2","599","Application Data"
"14.980129","5.9.29.183","172.19.0.3","TCP","56","9002 → 43520 [ACK] Seq=389113 Ack=29721 Win=65535 Len=0"
"15.443815","5.9.29.183","172.19.0.3","TLSv1.2","599","Application Data"
"15.474669","5.9.29.183","172.19.0.3","TCP","1504","[TCP segment of a reassembled PDU]"
"15.474685","172.19.0.3","5.9.29.183","TCP","56","43520 → 9002 [ACK] Seq=29721 Ack=391104 Win=8464 Len=0"
"15.474697","5.9.29.183","172.19.0.3","TCP","1516","9002 → 43520 [PSH, ACK] Seq=391104 Ack=29721 Win=65535 Len=1460 [TCP segment of a reassembled PDU]"
"15.474704","5.9.29.183","172.19.0.3","TLSv1.2","775","Application Data"
"15.474819","172.19.0.3","5.9.29.183","TCP","56","43520 → 9002 [ACK] Seq=29721 Ack=393283 Win=8448 Len=0"
"15.485510","5.9.29.183","172.19.0.3","TCP","1504","[TCP segment of a reassembled PDU]"
"15.485524","5.9.29.183","172.19.0.3","TCP","1504","9002 → 43520 [PSH, ACK] Seq=394731 Ack=29721 Win=65535 Len=1448 [TCP segment of a reassembled PDU]"
"15.485551","172.19.0.3","5.9.29.183","TCP","56","43520 → 9002 [ACK] Seq=29721 Ack=396179 Win=8458 Len=0"
"15.485614","5.9.29.183","172.19.0.3","TLSv1.2","1516","Application Data [TCP segment of a reassembled PDU]"
"15.485620","5.9.29.183","172.19.0.3","TCP","1516","9002 → 43520 [PSH, ACK] Seq=397639 Ack=29721 Win=65535 Len=1460 [TCP segment of a reassembled PDU]"
"15.485625","5.9.29.183","172.19.0.3","TCP","1480","9002 → 43520 [PSH, ACK] Seq=399099 Ack=29721 Win=65535 Len=1424 [TCP segment of a reassembled PDU]"
"15.485782","172.19.0.3","5.9.29.183","TCP","56","43520 → 9002 [ACK] Seq=29721 Ack=400523 Win=8434 Len=0"
"15.491017","5.9.29.183","172.19.0.3","TLSv1.2","584","Application Data"
"15.520797","5.9.29.183","172.19.0.3","TCP","1516","[TCP segment of a reassembled PDU]"
"15.520814","172.19.0.3","5.9.29.183","TCP","56","43520 → 9002 [ACK] Seq=29721 Ack=402511 Win=8466 Len=0"
"15.520826","5.9.29.183","172.19.0.3","TCP","1492","9002 → 43520 [PSH, ACK] Seq=402511 Ack=29721 Win=65535 Len=1436 [TCP segment of a reassembled PDU]"
"15.520831","5.9.29.183","172.19.0.3","TLSv1.2","787","Application Data"
"15.520952","172.19.0.3","5.9.29.183","TCP","56","43520 → 9002 [ACK] Seq=29721 Ack=404678 Win=8450 Len=0"
"15.546978","5.9.29.183","172.19.0.3","TCP","1516","[TCP segment of a reassembled PDU]"
"15.547003","5.9.29.183","172.19.0.3","TCP","1492","9002 → 43520 [PSH, ACK] Seq=406138 Ack=29721 Win=65535 Len=1436 [TCP segment of a reassembled PDU]"
"15.547012","172.19.0.3","5.9.29.183","TCP","56","43520 → 9002 [ACK] Seq=29721 Ack=407574 Win=8458 Len=0"
"15.547014","5.9.29.183","172.19.0.3","TLSv1.2","1516","Application Data [TCP segment of a reassembled PDU]"
"15.547105","5.9.29.183","172.19.0.3","TCP","1225","9002 → 43520 [PSH, ACK] Seq=409034 Ack=29721 Win=65535 Len=1169 [TCP segment of a reassembled PDU]"
"15.547109","5.9.29.183","172.19.0.3","TCP","1504","9002 → 43520 [PSH, ACK] Seq=410203 Ack=29721 Win=65535 Len=1448 [TCP segment of a reassembled PDU]"
"15.547167","172.19.0.3","5.9.29.183","TCP","56","43520 → 9002 [ACK] Seq=29721 Ack=411651 Win=8434 Len=0"
"15.562256","5.9.29.183","172.19.0.3","TLSv1.2","1394","Application Data, Application Data"
"15.565678","5.9.29.183","172.19.0.3","TCP","1504","[TCP segment of a reassembled PDU]"
"15.565686","172.19.0.3","5.9.29.183","TCP","56","43520 → 9002 [ACK] Seq=29721 Ack=414437 Win=8466 Len=0"
"15.565691","5.9.29.183","172.19.0.3","TCP","1504","9002 → 43520 [PSH, ACK] Seq=414437 Ack=29721 Win=65535 Len=1448 [TCP segment of a reassembled PDU]"
"15.577257","5.9.29.183","172.19.0.3","TLSv1.2","787","Application Data"
"15.577276","172.19.0.3","5.9.29.183","TCP","56","43520 → 9002 [ACK] Seq=29721 Ack=416616 Win=8466 Len=0"
"15.577763","172.19.0.3","5.9.29.183","TLSv1.2","599","Application Data"
"15.577965","5.9.29.183","172.19.0.3","TCP","56","9002 → 43520 [ACK] Seq=416616 Ack=30264 Win=65535 Len=0"
"15.587282","172.19.0.3","5.9.29.183","TLSv1.2","599","Application Data"
"15.587542","5.9.29.183","172.19.0.3","TCP","56","9002 → 43520 [ACK] Seq=416616 Ack=30807 Win=65535 Len=0"
"16.056237","5.9.29.183","172.19.0.3","TLSv1.2","599","Application Data"
"16.057107","172.19.0.3","5.9.29.183","TLSv1.2","599","Application Data"
"16.057508","5.9.29.183","172.19.0.3","TCP","56","9002 → 43520 [ACK] Seq=417159 Ack=31350 Win=65535 Len=0"
"16.524018","5.9.29.183","172.19.0.3","TLSv1.2","599","Application Data"
"16.539532","5.9.29.183","172.19.0.3","TCP","1504","[TCP segment of a reassembled PDU]"
"16.539600","172.19.0.3","5.9.29.183","TCP","56","43520 → 9002 [ACK] Seq=31350 Ack=419150 Win=8466 Len=0"
"16.539656","5.9.29.183","172.19.0.3","TCP","1516","9002 → 43520 [PSH, ACK] Seq=419150 Ack=31350 Win=65535 Len=1460 [TCP segment of a reassembled PDU]"
"16.539674","5.9.29.183","172.19.0.3","TLSv1.2","775","Application Data"
"16.539904","172.19.0.3","5.9.29.183","TCP","56","43520 → 9002 [ACK] Seq=31350 Ack=421329 Win=8450 Len=0"
"16.571729","5.9.29.183","172.19.0.3","TCP","1516","[TCP segment of a reassembled PDU]"
"16.571790","5.9.29.183","172.19.0.3","TCP","1492","9002 → 43520 [PSH, ACK] Seq=422789 Ack=31350 Win=65535 Len=1436 [TCP segment of a reassembled PDU]"
"16.571817","172.19.0.3","5.9.29.183","TCP","56","43520 → 9002 [ACK] Seq=31350 Ack=424225 Win=8458 Len=0"
"16.571822","5.9.29.183","172.19.0.3","TLSv1.2","787","Application Data"
"16.586688","5.9.29.183","172.19.0.3","TLSv1.2","599","Application Data"
"16.586901","172.19.0.3","5.9.29.183","TCP","56","43520 → 9002 [ACK] Seq=31350 Ack=425499 Win=8466 Len=0"
"16.693541","5.9.29.183","172.19.0.3","TCP","1504","[TCP segment of a reassembled PDU]"
"16.693568","5.9.29.183","172.19.0.3","TCP","1504","9002 → 43520 [PSH, ACK] Seq=426947 Ack=31350 Win=65535 Len=1448 [TCP segment of a reassembled PDU]"
"16.693574","5.9.29.183","172.19.0.3","TLSv1.2","787","Application Data"
"16.693668","172.19.0.3","5.9.29.183","TCP","56","43520 → 9002 [ACK] Seq=31350 Ack=429126 Win=8448 Len=0"
"16.708274","172.19.0.3","5.9.29.183","TLSv1.2","599","Application Data"
"16.709277","5.9.29.183","172.19.0.3","TCP","56","9002 → 43520 [ACK] Seq=429126 Ack=31893 Win=65535 Len=0"
"17.137356","5.9.29.183","172.19.0.3","TLSv1.2","599","Application Data"
"17.138196","172.19.0.3","5.9.29.183","TLSv1.2","599","Application Data"
"17.139134","5.9.29.183","172.19.0.3","TCP","56","9002 → 43520 [ACK] Seq=429669 Ack=32436 Win=65535 Len=0"
"17.519803","5.9.29.183","172.19.0.3","TLSv1.2","599","Application Data"
"17.562294","5.9.29.183","172.19.0.3","TCP","1516","[TCP segment of a reassembled PDU]"
"17.562311","172.19.0.3","5.9.29.183","TCP","56","43520 → 9002 [ACK] Seq=32436 Ack=431672 Win=8466 Len=0"
"17.562344","5.9.29.183","172.19.0.3","TCP","1516","9002 → 43520 [PSH, ACK] Seq=431672 Ack=32436 Win=65535 Len=1460 [TCP segment of a reassembled PDU]"
"17.562354","5.9.29.183","172.19.0.3","TLSv1.2","763","Application Data"
"17.562569","172.19.0.3","5.9.29.183","TCP","56","43520 → 9002 [ACK] Seq=32436 Ack=433839 Win=8450 Len=0"
"17.575483","5.9.29.183","172.19.0.3","TCP","1504","[TCP segment of a reassembled PDU]"
"17.575537","5.9.29.183","172.19.0.3","TCP","1504","9002 → 43520 [PSH, ACK] Seq=435287 Ack=32436 Win=65535 Len=1448 [TCP segment of a reassembled PDU]"
"17.575553","172.19.0.3","5.9.29.183","TCP","56","43520 → 9002 [ACK] Seq=32436 Ack=436735 Win=8458 Len=0"
"17.580239","5.9.29.183","172.19.0.3","TCP","1198","9002 → 43520 [PSH, ACK] Seq=436735 Ack=32436 Win=65535 Len=1142 [TCP segment of a reassembled PDU]"
"17.580375","5.9.29.183","172.19.0.3","TLSv1.2","188","Application Data, Application Data"
"17.580689","172.19.0.3","5.9.29.183","TCP","56","43520 → 9002 [ACK] Seq=32436 Ack=438009 Win=8466 Len=0"
"17.587092","5.9.29.183","172.19.0.3","TCP","1504","[TCP segment of a reassembled PDU]"
"17.588158","5.9.29.183","172.19.0.3","TCP","1516","9002 → 43520 [PSH, ACK] Seq=439457 Ack=32436 Win=65535 Len=1460 [TCP segment of a reassembled PDU]"
"17.588180","172.19.0.3","5.9.29.183","TCP","56","43520 → 9002 [ACK] Seq=32436 Ack=440917 Win=8466 Len=0"
"17.588216","5.9.29.183","172.19.0.3","TLSv1.2","1516","Application Data [TCP segment of a reassembled PDU]"
"17.588252","5.9.29.183","172.19.0.3","TCP","1516","9002 → 43520 [PSH, ACK] Seq=442377 Ack=32436 Win=65535 Len=1460 [TCP segment of a reassembled PDU]"
"17.588259","5.9.29.183","172.19.0.3","TCP","1516","9002 → 43520 [PSH, ACK] Seq=443837 Ack=32436 Win=65535 Len=1460 [TCP segment of a reassembled PDU]"
"17.588267","5.9.29.183","172.19.0.3","TLSv1.2","1516","Application Data [TCP segment of a reassembled PDU]"
"17.588271","5.9.29.183","172.19.0.3","TCP","1444","9002 → 43520 [PSH, ACK] Seq=446757 Ack=32436 Win=65535 Len=1388 [TCP segment of a reassembled PDU]"
"17.588316","172.19.0.3","5.9.29.183","TCP","56","43520 → 9002 [ACK] Seq=32436 Ack=448145 Win=8426 Len=0"
"17.588763","172.19.0.3","5.9.29.183","TLSv1.2","599","Application Data"
"17.589592","5.9.29.183","172.19.0.3","TCP","56","9002 → 43520 [ACK] Seq=448145 Ack=32979 Win=65535 Len=0"
"17.596139","5.9.29.183","172.19.0.3","TLSv1.2","1315","Application Data"
"17.638345","172.19.0.3","5.9.29.183","TCP","56","43520 → 9002 [ACK] Seq=32979 Ack=449404 Win=8466 Len=0"
"17.688682","5.9.29.183","172.19.0.3","TCP","1516","[TCP segment of a reassembled PDU]"
"17.688720","172.19.0.3","5.9.29.183","TCP","56","43520 → 9002 [ACK] Seq=32979 Ack=450864 Win=8466 Len=0"
"17.688869","5.9.29.183","172.19.0.3","TCP","1516","9002 → 43520 [PSH, ACK] Seq=450864 Ack=32979 Win=65535 Len=1460 [TCP segment of a reassembled PDU]"
"17.688914","172.19.0.3","5.9.29.183","TCP","56","43520 → 9002 [ACK] Seq=32979 Ack=452324 Win=8458 Len=0"
"17.688916","5.9.29.183","172.19.0.3","TLSv1.2","763","Application Data"
"17.688930","172.19.0.3","5.9.29.183","TCP","56","43520 → 9002 [ACK] Seq=32979 Ack=453031 Win=8453 Len=0"
"17.694840","5.9.29.183","172.19.0.3","TCP","1516","[TCP segment of a reassembled PDU]"
"17.694865","172.19.0.3","5.9.29.183","TCP","56","43520 → 9002 [ACK] Seq=32979 Ack=454491 Win=8466 Len=0"
"17.694937","5.9.29.183","172.19.0.3","TCP","1516","9002 → 43520 [PSH, ACK] Seq=454491 Ack=32979 Win=65535 Len=1460 [TCP segment of a reassembled PDU]"
"17.694954","172.19.0.3","5.9.29.183","TCP","56","43520 → 9002 [ACK] Seq=32979 Ack=455951 Win=8458 Len=0"
"17.694958","5.9.29.183","172.19.0.3","TLSv1.2","1516","Application Data [TCP segment of a reassembled PDU]"
"17.694967","172.19.0.3","5.9.29.183","TCP","56","43520 → 9002 [ACK] Seq=32979 Ack=457411 Win=8450 Len=0"
"17.694969","5.9.29.183","172.19.0.3","TCP","1468","9002 → 43520 [PSH, ACK] Seq=457411 Ack=32979 Win=65535 Len=1412 [TCP segment of a reassembled PDU]"
"17.695009","172.19.0.3","5.9.29.183","TCP","56","43520 → 9002 [ACK] Seq=32979 Ack=458823 Win=8442 Len=0"
"17.695012","5.9.29.183","172.19.0.3","TCP","1516","9002 → 43520 [PSH, ACK] Seq=458823 Ack=32979 Win=65535 Len=1460 [TCP segment of a reassembled PDU]"
"17.695024","172.19.0.3","5.9.29.183","TCP","56","43520 → 9002 [ACK] Seq=32979 Ack=460283 Win=8432 Len=0"
"17.695026","5.9.29.183","172.19.0.3","TLSv1.2","1516","Application Data [TCP segment of a reassembled PDU]"
"17.695035","5.9.29.183","172.19.0.3","TCP","1516","9002 → 43520 [PSH, ACK] Seq=461743 Ack=32979 Win=65535 Len=1460 [TCP segment of a reassembled PDU]"
"17.695039","5.9.29.183","172.19.0.3","TCP","1468","9002 → 43520 [PSH, ACK] Seq=463203 Ack=32979 Win=65535 Len=1412 [TCP segment of a reassembled PDU]"
"17.695087","172.19.0.3","5.9.29.183","TCP","56","43520 → 9002 [ACK] Seq=32979 Ack=464615 Win=8408 Len=0"
"17.695463","172.19.0.3","5.9.29.183","TLSv1.2","599","Application Data"
"17.697405","5.9.29.183","172.19.0.3","TCP","56","9002 → 43520 [ACK] Seq=464615 Ack=33522 Win=65535 Len=0"
"17.698911","5.9.29.183","172.19.0.3","TLSv1.2","924","Application Data, Application Data"
"17.741954","172.19.0.3","5.9.29.183","TCP","56","43520 → 9002 [ACK] Seq=33522 Ack=465483 Win=8466 Len=0"
"17.769023","5.9.29.183","172.19.0.3","TCP","1516","[TCP segment of a reassembled PDU]"
"17.769150","5.9.29.183","172.19.0.3","TLSv1.2","167","Application Data"
"17.769220","172.19.0.3","5.9.29.183","TCP","56","43520 → 9002 [ACK] Seq=33522 Ack=467054 Win=8458 Len=0"
