_ws.col.Time,_ws.col.Source,_ws.col.Destination,_ws.col.Protocol,_ws.col.Length,_ws.col.Info
"0.000000","54.38.73.16","172.18.0.2","TCP","68","21002 → 36876 [ACK] Seq=1 Ack=1 Win=1452 Len=0 TSval=2675285448 TSecr=1084545099"
"0.168047","172.18.0.2","54.38.73.16","TLSv1.2","611","Application Data"
"0.193898","54.38.73.16","172.18.0.2","TCP","68","21002 → 36876 [ACK] Seq=1 Ack=544 Win=1452 Len=0 TSval=2675285496 TSecr=1084545328"
"1.000422","54.38.73.16","172.18.0.2","TLSv1.2","611","Application Data"
"1.000470","172.18.0.2","54.38.73.16","TCP","68","36876 → 21002 [ACK] Seq=544 Ack=544 Win=5608 Len=0 TSval=1084546160 TSecr=2675285654"
"1.001558","172.18.0.2","54.38.73.16","TLSv1.2","2153","Application Data"
"1.025585","54.38.73.16","172.18.0.2","TCP","68","21002 → 36876 [ACK] Seq=544 Ack=2629 Win=1448 Len=0 TSval=2675285704 TSecr=1084546161"
"1.921634","54.38.73.16","172.18.0.2","TLSv1.2","611","Application Data"
"1.921708","172.18.0.2","54.38.73.16","TCP","68","36876 → 21002 [ACK] Seq=2629 Ack=1087 Win=5608 Len=0 TSval=1084547081 TSecr=2675285858"
"1.925512","54.38.73.16","172.18.0.2","TLSv1.2","1125","Application Data"
"1.925544","172.18.0.2","54.38.73.16","TCP","68","36876 → 21002 [ACK] Seq=2629 Ack=2144 Win=5600 Len=0 TSval=1084547085 TSecr=2675285929"
"1.933690","172.18.0.2","54.38.73.16","TLSv1.2","611","Application Data"
"1.960504","54.38.73.16","172.18.0.2","TCP","68","21002 → 36876 [ACK] Seq=2144 Ack=3172 Win=1452 Len=0 TSval=2675285938 TSecr=1084547093"
"2.844072","54.38.73.16","172.18.0.2","TLSv1.2","611","Application Data"
"2.845109","172.18.0.2","54.38.73.16","TLSv1.2","611","Application Data"
"2.868997","54.38.73.16","172.18.0.2","TCP","68","21002 → 36876 [ACK] Seq=2687 Ack=3715 Win=1452 Len=0 TSval=2675286165 TSecr=1084548005"
"4.072224","54.38.73.16","172.18.0.2","TCP","1516","[TCP segment of a reassembled PDU]"
"4.072540","54.38.73.16","172.18.0.2","TLSv1.2","2247","Application Data"
"4.072545","54.38.73.16","172.18.0.2","TLSv1.2","2964","Application Data"
"4.072549","54.38.73.16","172.18.0.2","TLSv1.2","2964","Application Data [TCP segment of a reassembled PDU]"
"4.072553","54.38.73.16","172.18.0.2","TCP","1516","21002 → 36876 [ACK] Seq=12106 Ack=3715 Win=1452 Len=1448 TSval=2675286462 TSecr=1084548005 [TCP segment of a reassembled PDU]"
"4.072635","172.18.0.2","54.38.73.16","TCP","68","36876 → 21002 [ACK] Seq=3715 Ack=13554 Win=5553 Len=0 TSval=1084549232 TSecr=2675286390"
"4.097645","54.38.73.16","172.18.0.2","TLSv1.2","10022","Application Data, Application Data, Application Data, Application Data, Application Data, Application Data"
"4.097775","172.18.0.2","54.38.73.16","TCP","68","36876 → 21002 [ACK] Seq=3715 Ack=23508 Win=5550 Len=0 TSval=1084549257 TSecr=2675286472"
"4.098164","172.18.0.2","54.38.73.16","TLSv1.2","611","Application Data"
"4.122374","54.38.73.16","172.18.0.2","TCP","68","[TCP Previous segment not captured] 21002 → 36876 [ACK] Seq=26107 Ack=4258 Win=1452 Len=0 TSval=2675286478 TSecr=1084549258"
"4.122408","54.38.73.16","172.18.0.2","TCP","2667","[TCP Retransmission] 21002 → 36876 [PSH, ACK] Seq=23508 Ack=3715 Win=1452 Len=2599 TSval=2675286478 TSecr=1084549257"
"4.122448","172.18.0.2","54.38.73.16","TCP","68","36876 → 21002 [ACK] Seq=4258 Ack=26107 Win=5597 Len=0 TSval=1084549282 TSecr=2675286478"
"4.130608","172.18.0.2","54.38.73.16","TLSv1.2","611","Application Data"
"4.155214","54.38.73.16","172.18.0.2","TCP","68","21002 → 36876 [ACK] Seq=26107 Ack=4801 Win=1452 Len=0 TSval=2675286486 TSecr=1084549290"
"4.994001","54.38.73.16","172.18.0.2","TLSv1.2","611","Application Data"
"4.994882","172.18.0.2","54.38.73.16","TLSv1.2","611","Application Data"
"5.019611","54.38.73.16","172.18.0.2","TCP","68","21002 → 36876 [ACK] Seq=26650 Ack=5344 Win=1452 Len=0 TSval=2675286702 TSecr=1084550154"
"5.608166","54.38.73.16","172.18.0.2","TLSv1.2","611","Application Data"
"5.651183","172.18.0.2","54.38.73.16","TCP","68","36876 → 21002 [ACK] Seq=5344 Ack=27193 Win=5612 Len=0 TSval=1084550811 TSecr=2675286840"
"5.813142","54.38.73.16","172.18.0.2","TLSv1.2","3181","Application Data"
"5.813197","172.18.0.2","54.38.73.16","TCP","68","36876 → 21002 [ACK] Seq=5344 Ack=30306 Win=5588 Len=0 TSval=1084550973 TSecr=2675286889"
"5.837466","54.38.73.16","172.18.0.2","TLSv1.2","611","Application Data"
"5.837505","172.18.0.2","54.38.73.16","TCP","68","36876 → 21002 [ACK] Seq=5344 Ack=30849 Win=5593 Len=0 TSval=1084550997 TSecr=2675286907"
"5.851709","54.38.73.16","172.18.0.2","TCP","2964","[TCP segment of a reassembled PDU]"
"5.851742","172.18.0.2","54.38.73.16","TCP","68","36876 → 21002 [ACK] Seq=5344 Ack=33745 Win=5596 Len=0 TSval=1084551011 TSecr=2675286910"
"5.862943","54.38.73.16","172.18.0.2","TLSv1.2","1342","Application Data, Application Data"
"5.863000","172.18.0.2","54.38.73.16","TCP","68","36876 → 21002 [ACK] Seq=5344 Ack=35019 Win=5593 Len=0 TSval=1084551023 TSecr=2675286913"
"6.223150","54.38.73.16","172.18.0.2","TLSv1.2","3695","Application Data"
"6.223196","172.18.0.2","54.38.73.16","TCP","68","36876 → 21002 [ACK] Seq=5344 Ack=38646 Win=5581 Len=0 TSval=1084551383 TSecr=2675286965"
"6.223157","54.38.73.16","172.18.0.2","TCP","2964","[TCP segment of a reassembled PDU]"
"6.223252","172.18.0.2","54.38.73.16","TCP","68","36876 → 21002 [ACK] Seq=5344 Ack=41542 Win=5566 Len=0 TSval=1084551383 TSecr=2675286968"
"6.223162","54.38.73.16","172.18.0.2","TLSv1.2","1516","Application Data, Application Data"
"6.223273","172.18.0.2","54.38.73.16","TCP","68","36876 → 21002 [ACK] Seq=5344 Ack=42990 Win=5555 Len=0 TSval=1084551383 TSecr=2675286986"
"6.240719","54.38.73.16","172.18.0.2","TLSv1.2","1516","Application Data [TCP segment of a reassembled PDU]"
"6.240751","172.18.0.2","54.38.73.16","TCP","68","36876 → 21002 [ACK] Seq=5344 Ack=44438 Win=5593 Len=0 TSval=1084551400 TSecr=2675287007"
"6.246849","54.38.73.16","172.18.0.2","TLSv1.2","3130","Application Data"
"6.246885","172.18.0.2","54.38.73.16","TCP","68","36876 → 21002 [ACK] Seq=5344 Ack=47500 Win=5580 Len=0 TSval=1084551406 TSecr=2675287009"
"6.254907","172.18.0.2","54.38.73.16","TLSv1.2","611","Application Data"
"6.279730","54.38.73.16","172.18.0.2","TCP","68","21002 → 36876 [ACK] Seq=47500 Ack=5887 Win=1452 Len=0 TSval=2675287017 TSecr=1084551414"
"6.836991","54.38.73.16","172.18.0.2","TLSv1.2","611","Application Data"
"6.837068","172.18.0.2","54.38.73.16","TCP","68","36876 → 21002 [ACK] Seq=5887 Ack=48043 Win=5608 Len=0 TSval=1084551997 TSecr=2675287142"
"6.838007","172.18.0.2","54.38.73.16","TLSv1.2","611","Application Data"
"6.861665","54.38.73.16","172.18.0.2","TCP","68","21002 → 36876 [ACK] Seq=48043 Ack=6430 Win=1452 Len=0 TSval=2675287163 TSecr=1084551998"
"7.451393","54.38.73.16","172.18.0.2","TLSv1.2","611","Application Data"
"7.451462","172.18.0.2","54.38.73.16","TCP","68","36876 → 21002 [ACK] Seq=6430 Ack=48586 Win=5608 Len=0 TSval=1084552611 TSecr=2675287307"
"7.451586","54.38.73.16","172.18.0.2","TLSv1.2","7308","Application Data"
"7.451605","172.18.0.2","54.38.73.16","TCP","68","36876 → 21002 [ACK] Seq=6430 Ack=55826 Win=5565 Len=0 TSval=1084552611 TSecr=2675287310"
"7.476153","54.38.73.16","172.18.0.2","TLSv1.2","82","Application Data"
"7.476178","172.18.0.2","54.38.73.16","TCP","68","36876 → 21002 [ACK] Seq=6430 Ack=55840 Win=5609 Len=0 TSval=1084552636 TSecr=2675287316"
"7.499988","54.38.73.16","172.18.0.2","TLSv1.2","611","Application Data"
"7.500012","172.18.0.2","54.38.73.16","TCP","68","36876 → 21002 [ACK] Seq=6430 Ack=56383 Win=5605 Len=0 TSval=1084552660 TSecr=2675287323"
"7.585296","54.38.73.16","172.18.0.2","TLSv1.2","4145","Application Data"
"7.585335","172.18.0.2","54.38.73.16","TCP","68","36876 → 21002 [ACK] Seq=6430 Ack=60460 Win=5589 Len=0 TSval=1084552745 TSecr=2675287343"
"7.585302","54.38.73.16","172.18.0.2","TCP","2964","[TCP segment of a reassembled PDU]"
"7.585367","172.18.0.2","54.38.73.16","TCP","68","36876 → 21002 [ACK] Seq=6430 Ack=63356 Win=5567 Len=0 TSval=1084552745 TSecr=2675287343"
"7.597310","54.38.73.16","172.18.0.2","TLSv1.2","2964","Application Data [TCP segment of a reassembled PDU]"
"7.597348","172.18.0.2","54.38.73.16","TCP","68","36876 → 21002 [ACK] Seq=6430 Ack=66252 Win=5596 Len=0 TSval=1084552757 TSecr=2675287346"
"7.610365","54.38.73.16","172.18.0.2","TLSv1.2","1594","Application Data"
"7.610397","172.18.0.2","54.38.73.16","TCP","68","36876 → 21002 [ACK] Seq=6430 Ack=67778 Win=5601 Len=0 TSval=1084552770 TSecr=2675287350"
"7.671593","54.38.73.16","172.18.0.2","TLSv1.2","1125","Application Data"
"7.671630","172.18.0.2","54.38.73.16","TCP","68","36876 → 21002 [ACK] Seq=6430 Ack=68835 Win=5593 Len=0 TSval=1084552831 TSecr=2675287365"
"7.672050","172.18.0.2","54.38.73.16","TLSv1.2","611","Application Data"
"7.695574","54.38.73.16","172.18.0.2","TCP","68","21002 → 36876 [ACK] Seq=68835 Ack=6973 Win=1452 Len=0 TSval=2675287371 TSecr=1084552832"
"7.753690","54.38.73.16","172.18.0.2","TLSv1.2","4145","Application Data"
"7.753696","54.38.73.16","172.18.0.2","TCP","2964","[TCP segment of a reassembled PDU]"
"7.753882","172.18.0.2","54.38.73.16","TCP","68","36876 → 21002 [ACK] Seq=6973 Ack=75808 Win=5566 Len=0 TSval=1084552913 TSecr=2675287386"
"7.776407","54.38.73.16","172.18.0.2","TLSv1.2","2964","Application Data [TCP segment of a reassembled PDU]"
"7.776450","172.18.0.2","54.38.73.16","TCP","68","36876 → 21002 [ACK] Seq=6973 Ack=78704 Win=5596 Len=0 TSval=1084552936 TSecr=2675287392"
"7.776929","172.18.0.2","54.38.73.16","TLSv1.2","611","Application Data"
"7.777713","54.38.73.16","172.18.0.2","TLSv1.2","2137","Application Data, Application Data"
"7.777745","172.18.0.2","54.38.73.16","TCP","68","36876 → 21002 [ACK] Seq=7516 Ack=80773 Win=5599 Len=0 TSval=1084552937 TSecr=2675287392"
"7.800726","54.38.73.16","172.18.0.2","TCP","68","21002 → 36876 [ACK] Seq=80773 Ack=7516 Win=1452 Len=0 TSval=2675287398 TSecr=1084552936"
"7.849255","54.38.73.16","172.18.0.2","TLSv1.2","1125","Application Data"
"7.891173","172.18.0.2","54.38.73.16","TCP","68","36876 → 21002 [ACK] Seq=7516 Ack=81830 Win=5612 Len=0 TSval=1084553051 TSecr=2675287410"
"7.956198","54.38.73.16","172.18.0.2","TLSv1.2","3695","Application Data"
"7.956250","172.18.0.2","54.38.73.16","TCP","68","36876 → 21002 [ACK] Seq=7516 Ack=85457 Win=5584 Len=0 TSval=1084553116 TSecr=2675287436"
"7.963729","54.38.73.16","172.18.0.2","TCP","2964","[TCP segment of a reassembled PDU]"
"7.963765","172.18.0.2","54.38.73.16","TCP","68","36876 → 21002 [ACK] Seq=7516 Ack=88353 Win=5596 Len=0 TSval=1084553123 TSecr=2675287438"
"7.964439","54.38.73.16","172.18.0.2","TLSv1.2","2964","Application Data [TCP segment of a reassembled PDU]"
"7.964474","172.18.0.2","54.38.73.16","TCP","68","36876 → 21002 [ACK] Seq=7516 Ack=91249 Win=5596 Len=0 TSval=1084553124 TSecr=2675287438"
"7.980736","54.38.73.16","172.18.0.2","TLSv1.2","2044","Application Data"
"7.980774","172.18.0.2","54.38.73.16","TCP","68","36876 → 21002 [ACK] Seq=7516 Ack=93225 Win=5599 Len=0 TSval=1084553140 TSecr=2675287443"
"8.046704","54.38.73.16","172.18.0.2","TLSv1.2","1639","Application Data"
"8.046757","172.18.0.2","54.38.73.16","TCP","68","36876 → 21002 [ACK] Seq=7516 Ack=94796 Win=5601 Len=0 TSval=1084553206 TSecr=2675287459"
"8.168543","54.38.73.16","172.18.0.2","TLSv1.2","1125","Application Data"
"8.168780","172.18.0.2","54.38.73.16","TCP","68","36876 → 21002 [ACK] Seq=7516 Ack=95853 Win=5612 Len=0 TSval=1084553328 TSecr=2675287485"
"8.685332","54.38.73.16","172.18.0.2","TCP","1516","[TCP segment of a reassembled PDU]"
"8.685383","172.18.0.2","54.38.73.16","TCP","68","36876 → 21002 [ACK] Seq=7516 Ack=97301 Win=5601 Len=0 TSval=1084553845 TSecr=2675287562"
"8.685533","54.38.73.16","172.18.0.2","TLSv1.2","2247","Application Data"
"8.685557","172.18.0.2","54.38.73.16","TCP","68","36876 → 21002 [ACK] Seq=7516 Ack=99480 Win=5599 Len=0 TSval=1084553845 TSecr=2675287562"
"8.685537","54.38.73.16","172.18.0.2","TCP","2964","[TCP segment of a reassembled PDU]"
"8.685578","172.18.0.2","54.38.73.16","TCP","68","36876 → 21002 [ACK] Seq=7516 Ack=102376 Win=5584 Len=0 TSval=1084553845 TSecr=2675287565"
"8.685541","54.38.73.16","172.18.0.2","TLSv1.2","1516","Application Data, Application Data"
"8.685591","172.18.0.2","54.38.73.16","TCP","68","36876 → 21002 [ACK] Seq=7516 Ack=103824 Win=5573 Len=0 TSval=1084553845 TSecr=2675287571"
"8.686477","172.18.0.2","54.38.73.16","TLSv1.2","611","Application Data"
"8.696662","54.38.73.16","172.18.0.2","TCP","1516","[TCP Spurious Retransmission] 21002 → 36876 [ACK] Seq=95853 Ack=7516 Win=1452 Len=1448 TSval=2675287622 TSecr=1084553328"
"8.696698","172.18.0.2","54.38.73.16","TCP","80","[TCP Window Update] 36876 → 21002 [ACK] Seq=8059 Ack=103824 Win=5612 Len=0 TSval=1084553856 TSecr=2675287571 SLE=95853 SRE=97301"
"8.710523","54.38.73.16","172.18.0.2","TLSv1.2","1465","Application Data"
"8.710584","172.18.0.2","54.38.73.16","TCP","68","36876 → 21002 [ACK] Seq=8059 Ack=105221 Win=5603 Len=0 TSval=1084553870 TSecr=2675287625"
"8.710542","54.38.73.16","172.18.0.2","TCP","68","21002 → 36876 [ACK] Seq=105221 Ack=8059 Win=1452 Len=0 TSval=2675287625 TSecr=1084553846"
"8.720518","172.18.0.2","54.38.73.16","TLSv1.2","611","Application Data"
"8.744912","54.38.73.16","172.18.0.2","TCP","68","21002 → 36876 [ACK] Seq=105221 Ack=8602 Win=1452 Len=0 TSval=2675287634 TSecr=1084553880"
"9.909777","54.38.73.16","172.18.0.2","TLSv1.2","611","Application Data"
"9.909827","172.18.0.2","54.38.73.16","TCP","68","36876 → 21002 [ACK] Seq=8602 Ack=105764 Win=5608 Len=0 TSval=1084555069 TSecr=2675287910"
"9.910735","172.18.0.2","54.38.73.16","TLSv1.2","611","Application Data"
"9.935289","54.38.73.16","172.18.0.2","TCP","68","21002 → 36876 [ACK] Seq=105764 Ack=9145 Win=1452 Len=0 TSval=2675287931 TSecr=1084555070"
"10.829514","54.38.73.16","172.18.0.2","TLSv1.2","611","Application Data"
"10.829563","172.18.0.2","54.38.73.16","TCP","68","36876 → 21002 [ACK] Seq=9145 Ack=106307 Win=5608 Len=0 TSval=1084555989 TSecr=2675288133"
"10.829893","54.38.73.16","172.18.0.2","TCP","2964","[TCP segment of a reassembled PDU]"
"10.829946","172.18.0.2","54.38.73.16","TCP","68","36876 → 21002 [ACK] Seq=9145 Ack=109203 Win=5596 Len=0 TSval=1084555989 TSecr=2675288138"
"10.829911","54.38.73.16","172.18.0.2","TLSv1.2","4412","Application Data [TCP segment of a reassembled PDU]"
"10.829984","172.18.0.2","54.38.73.16","TCP","68","36876 → 21002 [ACK] Seq=9145 Ack=113547 Win=5573 Len=0 TSval=1084555989 TSecr=2675288141"
"10.829918","54.38.73.16","172.18.0.2","TLSv1.2","1516","Application Data, Application Data"
"10.829997","172.18.0.2","54.38.73.16","TCP","68","36876 → 21002 [ACK] Seq=9145 Ack=114995 Win=5566 Len=0 TSval=1084555990 TSecr=2675288151"
"10.854722","54.38.73.16","172.18.0.2","TLSv1.2","2804","Application Data"
"10.854754","172.18.0.2","54.38.73.16","TCP","68","36876 → 21002 [ACK] Seq=9145 Ack=117731 Win=5596 Len=0 TSval=1084556014 TSecr=2675288161"
"10.889607","54.38.73.16","172.18.0.2","TLSv1.2","3695","Application Data"
"10.889652","172.18.0.2","54.38.73.16","TCP","68","36876 → 21002 [ACK] Seq=9145 Ack=121358 Win=5580 Len=0 TSval=1084556049 TSecr=2675288170"
"10.890190","172.18.0.2","54.38.73.16","TLSv1.2","611","Application Data"
"10.914047","54.38.73.16","172.18.0.2","TLSv1.2","1125","Application Data"
"10.914064","54.38.73.16","172.18.0.2","TCP","68","21002 → 36876 [ACK] Seq=122415 Ack=9688 Win=1452 Len=0 TSval=2675288176 TSecr=1084556050"
"10.955092","172.18.0.2","54.38.73.16","TCP","68","36876 → 21002 [ACK] Seq=9688 Ack=122415 Win=5612 Len=0 TSval=1084556115 TSecr=2675288176"
"11.035347","54.38.73.16","172.18.0.2","TLSv1.2","3695","Application Data"
"11.035397","172.18.0.2","54.38.73.16","TCP","68","36876 → 21002 [ACK] Seq=9688 Ack=126042 Win=5584 Len=0 TSval=1084556195 TSecr=2675288206"
"11.078136","54.38.73.16","172.18.0.2","TLSv1.2","3181","Application Data"
"11.078169","172.18.0.2","54.38.73.16","TCP","68","36876 → 21002 [ACK] Seq=9688 Ack=129155 Win=5580 Len=0 TSval=1084556238 TSecr=2675288217"
"11.131629","54.38.73.16","172.18.0.2","TLSv1.2","1639","Application Data"
"11.131677","172.18.0.2","54.38.73.16","TCP","68","36876 → 21002 [ACK] Seq=9688 Ack=130726 Win=5601 Len=0 TSval=1084556291 TSecr=2675288230"
"11.229545","54.38.73.16","172.18.0.2","TLSv1.2","3695","Application Data"
"11.229592","172.18.0.2","54.38.73.16","TCP","68","36876 → 21002 [ACK] Seq=9688 Ack=134353 Win=5581 Len=0 TSval=1084556389 TSecr=2675288255"
"11.230044","172.18.0.2","54.38.73.16","TLSv1.2","611","Application Data"
"11.254604","54.38.73.16","172.18.0.2","TCP","68","21002 → 36876 [ACK] Seq=134353 Ack=10231 Win=1452 Len=0 TSval=2675288261 TSecr=1084556390"
"11.270115","54.38.73.16","172.18.0.2","TCP","1516","[TCP segment of a reassembled PDU]"
"11.270148","172.18.0.2","54.38.73.16","TCP","68","36876 → 21002 [ACK] Seq=10231 Ack=135801 Win=5601 Len=0 TSval=1084556430 TSecr=2675288265"
"11.270634","54.38.73.16","172.18.0.2","TLSv1.2","705","Application Data"
"11.270659","172.18.0.2","54.38.73.16","TCP","68","36876 → 21002 [ACK] Seq=10231 Ack=136438 Win=5597 Len=0 TSval=1084556430 TSecr=2675288265"
"11.324192","54.38.73.16","172.18.0.2","TLSv1.2","1639","Application Data"
"11.324222","172.18.0.2","54.38.73.16","TCP","68","36876 → 21002 [ACK] Seq=10231 Ack=138009 Win=5601 Len=0 TSval=1084556484 TSecr=2675288278"
"11.444476","54.38.73.16","172.18.0.2","TLSv1.2","1639","Application Data"
"11.444686","172.18.0.2","54.38.73.16","TCP","68","36876 → 21002 [ACK] Seq=10231 Ack=139580 Win=5590 Len=0 TSval=1084556604 TSecr=2675288306"
"11.497755","54.38.73.16","172.18.0.2","TLSv1.2","3695","Application Data"
"11.497936","172.18.0.2","54.38.73.16","TCP","68","36876 → 21002 [ACK] Seq=10231 Ack=143207 Win=5580 Len=0 TSval=1084556657 TSecr=2675288322"
"11.507577","54.38.73.16","172.18.0.2","TCP","1516","[TCP segment of a reassembled PDU]"
"11.522144","54.38.73.16","172.18.0.2","TLSv1.2","705","Application Data"
"11.522178","172.18.0.2","54.38.73.16","TCP","68","36876 → 21002 [ACK] Seq=10231 Ack=145292 Win=5593 Len=0 TSval=1084556682 TSecr=2675288324"
"11.592086","54.38.73.16","172.18.0.2","TLSv1.2","3695","Application Data"
"11.592280","172.18.0.2","54.38.73.16","TCP","68","36876 → 21002 [ACK] Seq=10231 Ack=148919 Win=5580 Len=0 TSval=1084556752 TSecr=2675288345"
"11.667405","54.38.73.16","172.18.0.2","TLSv1.2","2153","Application Data"
"11.667465","172.18.0.2","54.38.73.16","TCP","68","36876 → 21002 [ACK] Seq=10231 Ack=151004 Win=5599 Len=0 TSval=1084556827 TSecr=2675288364"
"11.759274","54.38.73.16","172.18.0.2","TLSv1.2","1639","Application Data"
"11.759305","172.18.0.2","54.38.73.16","TCP","68","36876 → 21002 [ACK] Seq=10231 Ack=152575 Win=5601 Len=0 TSval=1084556919 TSecr=2675288387"
"11.957000","54.38.73.16","172.18.0.2","TCP","1516","[TCP segment of a reassembled PDU]"
"11.957243","54.38.73.16","172.18.0.2","TLSv1.2","2697","Application Data"
"11.957248","54.38.73.16","172.18.0.2","TLSv1.2","4412","Application Data"
"11.957343","172.18.0.2","54.38.73.16","TCP","68","36876 → 21002 [ACK] Seq=10231 Ack=160996 Win=5566 Len=0 TSval=1084557117 TSecr=2675288426"
"11.981736","54.38.73.16","172.18.0.2","TLSv1.2","1529","Application Data, Application Data"
"11.981770","172.18.0.2","54.38.73.16","TCP","68","36876 → 21002 [ACK] Seq=10231 Ack=162457 Win=5601 Len=0 TSval=1084557141 TSecr=2675288443"
"11.982256","172.18.0.2","54.38.73.16","TLSv1.2","611","Application Data"
"12.045211","54.38.73.16","172.18.0.2","TCP","68","21002 → 36876 [ACK] Seq=162457 Ack=10774 Win=1452 Len=0 TSval=2675288459 TSecr=1084557142"
"12.064890","54.38.73.16","172.18.0.2","TLSv1.2","3695","Application Data"
"12.065061","172.18.0.2","54.38.73.16","TCP","68","36876 → 21002 [ACK] Seq=10774 Ack=166084 Win=5580 Len=0 TSval=1084557225 TSecr=2675288464"
"12.150184","54.38.73.16","172.18.0.2","TLSv1.2","1639","Application Data"
"12.150216","172.18.0.2","54.38.73.16","TCP","68","36876 → 21002 [ACK] Seq=10774 Ack=167655 Win=5601 Len=0 TSval=1084557310 TSecr=2675288485"
"12.211993","54.38.73.16","172.18.0.2","TLSv1.2","1639","Application Data"
"12.212047","172.18.0.2","54.38.73.16","TCP","68","36876 → 21002 [ACK] Seq=10774 Ack=169226 Win=5601 Len=0 TSval=1084557372 TSecr=2675288500"
"12.244777","54.38.73.16","172.18.0.2","TLSv1.2","3695","Application Data"
"12.244879","172.18.0.2","54.38.73.16","TCP","68","36876 → 21002 [ACK] Seq=10774 Ack=172853 Win=5580 Len=0 TSval=1084557404 TSecr=2675288509"
"12.328877","54.38.73.16","172.18.0.2","TLSv1.2","2153","Application Data"
"12.328913","172.18.0.2","54.38.73.16","TCP","68","36876 → 21002 [ACK] Seq=10774 Ack=174938 Win=5599 Len=0 TSval=1084557488 TSecr=2675288530"
"12.329367","172.18.0.2","54.38.73.16","TLSv1.2","611","Application Data"
"12.353928","54.38.73.16","172.18.0.2","TCP","68","21002 → 36876 [ACK] Seq=174938 Ack=11317 Win=1452 Len=0 TSval=2675288536 TSecr=1084557489"
"12.672825","54.38.73.16","172.18.0.2","TLSv1.2","799","[TCP Previous segment not captured] , Ignored Unknown Record"
"12.672919","172.18.0.2","54.38.73.16","TCP","80","[TCP Dup ACK 185#1] 36876 → 21002 [ACK] Seq=11317 Ack=174938 Win=5612 Len=0 TSval=1084557832 TSecr=2675288536 SLE=177834 SRE=178565"
"12.672846","54.38.73.16","172.18.0.2","TCP","3695","[TCP Retransmission] 21002 → 36876 [PSH, ACK] Seq=174938 Ack=11317 Win=1452 Len=3627 TSval=2675288599 TSecr=1084557489"
"12.672956","172.18.0.2","54.38.73.16","TCP","80","36876 → 21002 [ACK] Seq=11317 Ack=178565 Win=5591 Len=0 TSval=1084557832 TSecr=2675288599 SLE=177834 SRE=178565"
"12.691607","54.38.73.16","172.18.0.2","TCP","2964","[TCP segment of a reassembled PDU]"
"12.691638","172.18.0.2","54.38.73.16","TCP","68","36876 → 21002 [ACK] Seq=11317 Ack=181461 Win=5596 Len=0 TSval=1084557851 TSecr=2675288620"
"12.698434","54.38.73.16","172.18.0.2","TLSv1.2","799","Application Data"
"12.710882","172.18.0.2","54.38.73.16","TLSv1.2","611","Application Data"
"12.735546","54.38.73.16","172.18.0.2","TCP","68","21002 → 36876 [ACK] Seq=182192 Ack=11860 Win=1452 Len=0 TSval=2675288631 TSecr=1084557870"
"13.903274","54.38.73.16","172.18.0.2","TLSv1.2","611","Application Data"
"13.903291","54.38.73.16","172.18.0.2","TCP","611","[TCP Retransmission] 21002 → 36876 [PSH, ACK] Seq=182192 Ack=11860 Win=1452 Len=543 TSval=2675288919 TSecr=1084557870"
"13.903378","172.18.0.2","54.38.73.16","TCP","80","36876 → 21002 [ACK] Seq=11860 Ack=182735 Win=5608 Len=0 TSval=1084559063 TSecr=2675288919 SLE=182192 SRE=182735"
"13.904330","172.18.0.2","54.38.73.16","TLSv1.2","611","Application Data"
"13.932687","54.38.73.16","172.18.0.2","TCP","68","21002 → 36876 [ACK] Seq=182735 Ack=12403 Win=1452 Len=0 TSval=2675288931 TSecr=1084559064"
"14.522757","54.38.73.16","172.18.0.2","TLSv1.2","611","Application Data"
"14.522843","172.18.0.2","54.38.73.16","TCP","68","36876 → 21002 [ACK] Seq=12403 Ack=183278 Win=5608 Len=0 TSval=1084559682 TSecr=2675289037"
"14.522798","54.38.73.16","172.18.0.2","TCP","2964","[TCP segment of a reassembled PDU]"
"14.522858","172.18.0.2","54.38.73.16","TCP","68","36876 → 21002 [ACK] Seq=12403 Ack=186174 Win=5586 Len=0 TSval=1084559682 TSecr=2675289063"
"14.540252","54.38.73.16","172.18.0.2","TLSv1.2","799","Application Data"
"14.540285","172.18.0.2","54.38.73.16","TCP","68","36876 → 21002 [ACK] Seq=12403 Ack=186905 Win=5593 Len=0 TSval=1084559700 TSecr=2675289083"
"14.824322","54.38.73.16","172.18.0.2","TCP","1516","[TCP segment of a reassembled PDU]"
"14.824389","172.18.0.2","54.38.73.16","TCP","68","36876 → 21002 [ACK] Seq=12403 Ack=188353 Win=5593 Len=0 TSval=1084559984 TSecr=2675289145"
"14.824523","54.38.73.16","172.18.0.2","TLSv1.2","2247","Application Data"
"14.824546","172.18.0.2","54.38.73.16","TCP","68","36876 → 21002 [ACK] Seq=12403 Ack=190532 Win=5581 Len=0 TSval=1084559984 TSecr=2675289145"
"14.858247","54.38.73.16","172.18.0.2","TLSv1.2","1125","Application Data"
"14.858321","172.18.0.2","54.38.73.16","TCP","68","36876 → 21002 [ACK] Seq=12403 Ack=191589 Win=5593 Len=0 TSval=1084560018 TSecr=2675289161"
"14.865389","172.18.0.2","54.38.73.16","TLSv1.2","611","Application Data"
"14.891580","54.38.73.16","172.18.0.2","TCP","68","21002 → 36876 [ACK] Seq=191589 Ack=12946 Win=1452 Len=0 TSval=2675289170 TSecr=1084560025"
"15.111084","02:42:09:5f:bf:77","","ARP","44","Who has 172.18.0.2? Tell 172.18.0.1"
"15.111121","02:42:ac:12:00:02","","ARP","44","172.18.0.2 is at 02:42:ac:12:00:02"
"15.437326","54.38.73.16","172.18.0.2","TLSv1.2","611","Application Data"
"15.437411","172.18.0.2","54.38.73.16","TCP","68","36876 → 21002 [ACK] Seq=12946 Ack=192132 Win=5608 Len=0 TSval=1084560597 TSecr=2675289289"
"15.438229","172.18.0.2","54.38.73.16","TLSv1.2","611","Application Data"
"15.462527","54.38.73.16","172.18.0.2","TCP","68","21002 → 36876 [ACK] Seq=192132 Ack=13489 Win=1452 Len=0 TSval=2675289313 TSecr=1084560598"
"16.053561","54.38.73.16","172.18.0.2","TLSv1.2","611","Application Data"
"16.086965","54.38.73.16","172.18.0.2","TCP","2964","[TCP segment of a reassembled PDU]"
"16.086998","172.18.0.2","54.38.73.16","TCP","68","36876 → 21002 [ACK] Seq=13489 Ack=195571 Win=5596 Len=0 TSval=1084561247 TSecr=2675289423"
"16.112388","54.38.73.16","172.18.0.2","TLSv1.2","799","Application Data"
"16.155186","172.18.0.2","54.38.73.16","TCP","68","36876 → 21002 [ACK] Seq=13489 Ack=196302 Win=5612 Len=0 TSval=1084561315 TSecr=2675289476"
"16.181701","54.38.73.16","172.18.0.2","TLSv1.2","611","Application Data"
"16.181757","172.18.0.2","54.38.73.16","TCP","68","36876 → 21002 [ACK] Seq=13489 Ack=196845 Win=5608 Len=0 TSval=1084561341 TSecr=2675289493"
"16.264826","54.38.73.16","172.18.0.2","TLSv1.2","3695","Application Data"
"16.264861","172.18.0.2","54.38.73.16","TCP","68","36876 → 21002 [ACK] Seq=13489 Ack=200472 Win=5580 Len=0 TSval=1084561424 TSecr=2675289513"
"16.343758","54.38.73.16","172.18.0.2","TLSv1.2","2153","Application Data"
"16.343792","172.18.0.2","54.38.73.16","TCP","68","36876 → 21002 [ACK] Seq=13489 Ack=202557 Win=5599 Len=0 TSval=1084561503 TSecr=2675289533"
"16.673122","54.38.73.16","172.18.0.2","TLSv1.2","2667","Application Data"
"16.673160","172.18.0.2","54.38.73.16","TCP","68","36876 → 21002 [ACK] Seq=13489 Ack=205156 Win=5586 Len=0 TSval=1084561833 TSecr=2675289562"
"16.673128","54.38.73.16","172.18.0.2","TCP","1516","[TCP segment of a reassembled PDU]"
"16.673193","172.18.0.2","54.38.73.16","TCP","68","36876 → 21002 [ACK] Seq=13489 Ack=206604 Win=5579 Len=0 TSval=1084561833 TSecr=2675289579"
"16.697700","54.38.73.16","172.18.0.2","TLSv1.2","705","Application Data"
"16.697736","172.18.0.2","54.38.73.16","TCP","68","36876 → 21002 [ACK] Seq=13489 Ack=207241 Win=5593 Len=0 TSval=1084561857 TSecr=2675289622"
"16.704965","172.18.0.2","54.38.73.16","TLSv1.2","611","Application Data"
"16.729997","54.38.73.16","172.18.0.2","TCP","68","21002 → 36876 [ACK] Seq=207241 Ack=14032 Win=1452 Len=0 TSval=2675289630 TSecr=1084561864"
"17.282102","54.38.73.16","172.18.0.2","TLSv1.2","611","Application Data"
"17.282158","172.18.0.2","54.38.73.16","TCP","68","36876 → 21002 [ACK] Seq=14032 Ack=207784 Win=5608 Len=0 TSval=1084562442 TSecr=2675289754"
"17.283260","172.18.0.2","54.38.73.16","TLSv1.2","611","Application Data"
"17.307925","54.38.73.16","172.18.0.2","TCP","68","21002 → 36876 [ACK] Seq=207784 Ack=14575 Win=1452 Len=0 TSval=2675289774 TSecr=1084562443"
"17.896517","54.38.73.16","172.18.0.2","TLSv1.2","611","Application Data"
"17.896570","172.18.0.2","54.38.73.16","TCP","68","36876 → 21002 [ACK] Seq=14575 Ack=208327 Win=5608 Len=0 TSval=1084563056 TSecr=2675289913"
"17.979265","54.38.73.16","172.18.0.2","TLSv1.2","3695","Application Data"
"17.979300","172.18.0.2","54.38.73.16","TCP","68","36876 → 21002 [ACK] Seq=14575 Ack=211954 Win=5580 Len=0 TSval=1084563139 TSecr=2675289942"
"18.044491","54.38.73.16","172.18.0.2","TLSv1.2","3695","Application Data"
"18.044569","172.18.0.2","54.38.73.16","TCP","68","36876 → 21002 [ACK] Seq=14575 Ack=215581 Win=5580 Len=0 TSval=1084563204 TSecr=2675289958"
"18.070945","54.38.73.16","172.18.0.2","TLSv1.2","1125","Application Data"
"18.070980","172.18.0.2","54.38.73.16","TCP","68","36876 → 21002 [ACK] Seq=14575 Ack=216638 Win=5593 Len=0 TSval=1084563230 TSecr=2675289965"
"18.077873","172.18.0.2","54.38.73.16","TLSv1.2","611","Application Data"
"18.102213","54.38.73.16","172.18.0.2","TCP","68","21002 → 36876 [ACK] Seq=216638 Ack=15118 Win=1452 Len=0 TSval=2675289973 TSecr=1084563237"
"18.817936","54.38.73.16","172.18.0.2","TLSv1.2","611","Application Data"
"18.819022","172.18.0.2","54.38.73.16","TLSv1.2","611","Application Data"
"18.843950","54.38.73.16","172.18.0.2","TCP","68","21002 → 36876 [ACK] Seq=217181 Ack=15661 Win=1452 Len=0 TSval=2675290158 TSecr=1084563979"
"19.432574","54.38.73.16","172.18.0.2","TLSv1.2","3695","Application Data"
"19.432718","172.18.0.2","54.38.73.16","TCP","68","36876 → 21002 [ACK] Seq=15661 Ack=220808 Win=5584 Len=0 TSval=1084564592 TSecr=2675290295"
"19.637777","54.38.73.16","172.18.0.2","TLSv1.2","3695","Application Data"
"19.637783","54.38.73.16","172.18.0.2","TCP","1516","[TCP segment of a reassembled PDU]"
"19.637968","172.18.0.2","54.38.73.16","TCP","68","36876 → 21002 [ACK] Seq=15661 Ack=225883 Win=5565 Len=0 TSval=1084564797 TSecr=2675290334"
"19.661778","54.38.73.16","172.18.0.2","TLSv1.2","4846","Application Data, Application Data"
"19.661811","172.18.0.2","54.38.73.16","TCP","68","36876 → 21002 [ACK] Seq=15661 Ack=230661 Win=5585 Len=0 TSval=1084564821 TSecr=2675290363"
"19.662537","172.18.0.2","54.38.73.16","TLSv1.2","611","Application Data"
"19.688911","54.38.73.16","172.18.0.2","TCP","68","21002 → 36876 [ACK] Seq=230661 Ack=16204 Win=1452 Len=0 TSval=2675290369 TSecr=1084564822"
"19.754837","54.38.73.16","172.18.0.2","TLSv1.2","3695","Application Data"
"19.755060","172.18.0.2","54.38.73.16","TCP","68","36876 → 21002 [ACK] Seq=16204 Ack=234288 Win=5584 Len=0 TSval=1084564915 TSecr=2675290386"
"19.778756","54.38.73.16","172.18.0.2","TLSv1.2","1639","Application Data"
"19.778786","172.18.0.2","54.38.73.16","TCP","68","36876 → 21002 [ACK] Seq=16204 Ack=235859 Win=5601 Len=0 TSval=1084564938 TSecr=2675290392"
"19.786169","54.38.73.16","172.18.0.2","TCP","1516","[TCP segment of a reassembled PDU]"
"19.804789","54.38.73.16","172.18.0.2","TLSv1.2","705","Application Data"
"19.804965","172.18.0.2","54.38.73.16","TCP","68","36876 → 21002 [ACK] Seq=16204 Ack=237944 Win=5612 Len=0 TSval=1084564964 TSecr=2675290394"
"19.829155","54.38.73.16","172.18.0.2","TCP","2964","[TCP segment of a reassembled PDU]"
"19.829338","172.18.0.2","54.38.73.16","TCP","68","36876 → 21002 [ACK] Seq=16204 Ack=240840 Win=5596 Len=0 TSval=1084564989 TSecr=2675290405"
"19.829865","54.38.73.16","172.18.0.2","TLSv1.2","799","Application Data"
"19.871089","172.18.0.2","54.38.73.16","TCP","68","36876 → 21002 [ACK] Seq=16204 Ack=241571 Win=5612 Len=0 TSval=1084565031 TSecr=2675290405"
"19.905818","54.38.73.16","172.18.0.2","TLSv1.2","3181","Application Data"
"19.905864","172.18.0.2","54.38.73.16","TCP","68","36876 → 21002 [ACK] Seq=16204 Ack=244684 Win=5588 Len=0 TSval=1084565065 TSecr=2675290424"
"19.906267","172.18.0.2","54.38.73.16","TLSv1.2","611","Application Data"
"19.930421","54.38.73.16","172.18.0.2","TCP","68","21002 → 36876 [ACK] Seq=244684 Ack=16747 Win=1452 Len=0 TSval=2675290430 TSecr=1084565066"
"20.003443","54.38.73.16","172.18.0.2","TLSv1.2","3695","Application Data"
"20.003473","172.18.0.2","54.38.73.16","TCP","68","36876 → 21002 [ACK] Seq=16747 Ack=248311 Win=5584 Len=0 TSval=1084565163 TSecr=2675290448"
"20.024854","54.38.73.16","172.18.0.2","TCP","1516","[TCP segment of a reassembled PDU]"
"20.024883","172.18.0.2","54.38.73.16","TCP","68","36876 → 21002 [ACK] Seq=16747 Ack=249759 Win=5593 Len=0 TSval=1084565184 TSecr=2675290454"
"20.029287","54.38.73.16","172.18.0.2","TLSv1.2","2247","Application Data"
"20.029319","172.18.0.2","54.38.73.16","TCP","68","36876 → 21002 [ACK] Seq=16747 Ack=251938 Win=5599 Len=0 TSval=1084565189 TSecr=2675290455"
"20.081717","54.38.73.16","172.18.0.2","TLSv1.2","3181","Application Data"
"20.081747","172.18.0.2","54.38.73.16","TCP","68","36876 → 21002 [ACK] Seq=16747 Ack=255051 Win=5580 Len=0 TSval=1084565241 TSecr=2675290468"
"20.169631","54.38.73.16","172.18.0.2","TLSv1.2","2667","Application Data"
"20.169676","172.18.0.2","54.38.73.16","TCP","68","36876 → 21002 [ACK] Seq=16747 Ack=257650 Win=5597 Len=0 TSval=1084565329 TSecr=2675290490"
"20.214099","54.38.73.16","172.18.0.2","TLSv1.2","3695","Application Data"
"20.214286","172.18.0.2","54.38.73.16","TCP","68","36876 → 21002 [ACK] Seq=16747 Ack=261277 Win=5580 Len=0 TSval=1084565374 TSecr=2675290501"
"20.258207","54.38.73.16","172.18.0.2","TLSv1.2","2667","Application Data"
"20.258236","172.18.0.2","54.38.73.16","TCP","68","36876 → 21002 [ACK] Seq=16747 Ack=263876 Win=5597 Len=0 TSval=1084565418 TSecr=2675290512"
"20.343908","54.38.73.16","172.18.0.2","TLSv1.2","4145","Application Data"
"20.343918","54.38.73.16","172.18.0.2","TCP","1516","[TCP segment of a reassembled PDU]"
"20.344087","172.18.0.2","54.38.73.16","TCP","68","36876 → 21002 [ACK] Seq=16747 Ack=269401 Win=5582 Len=0 TSval=1084565504 TSecr=2675290533"
"20.369265","54.38.73.16","172.18.0.2","TLSv1.2","5424","Application Data, Application Data"
"20.369295","172.18.0.2","54.38.73.16","TCP","68","36876 → 21002 [ACK] Seq=16747 Ack=274757 Win=5583 Len=0 TSval=1084565529 TSecr=2675290540"
"20.369674","172.18.0.2","54.38.73.16","TLSv1.2","611","Application Data"
"20.394574","54.38.73.16","172.18.0.2","TLSv1.2","611","Application Data"
"20.394584","54.38.73.16","172.18.0.2","TCP","68","21002 → 36876 [ACK] Seq=275300 Ack=17290 Win=1452 Len=0 TSval=2675290546 TSecr=1084565529"
"20.394775","172.18.0.2","54.38.73.16","TCP","68","36876 → 21002 [ACK] Seq=17290 Ack=275300 Win=5612 Len=0 TSval=1084565554 TSecr=2675290546"
"20.411773","172.18.0.2","54.38.73.16","TLSv1.2","611","Application Data"
"20.435558","54.38.73.16","172.18.0.2","TCP","68","21002 → 36876 [ACK] Seq=275300 Ack=17833 Win=1452 Len=0 TSval=2675290556 TSecr=1084565571"
"20.435594","172.18.0.2","54.38.73.16","TLSv1.2","611","Application Data"
"20.461212","54.38.73.16","172.18.0.2","TCP","68","21002 → 36876 [ACK] Seq=275300 Ack=18376 Win=1452 Len=0 TSval=2675290563 TSecr=1084565595"
"20.494125","54.38.73.16","172.18.0.2","TLSv1.2","611","Application Data"
"20.535051","172.18.0.2","54.38.73.16","TCP","68","36876 → 21002 [ACK] Seq=18376 Ack=275843 Win=5612 Len=0 TSval=1084565695 TSecr=2675290571"
"21.590913","54.38.73.16","172.18.0.2","TLSv1.2","611","Application Data"
"21.590965","172.18.0.2","54.38.73.16","TCP","68","36876 → 21002 [ACK] Seq=18376 Ack=276386 Win=5608 Len=0 TSval=1084566750 TSecr=2675290773"
"21.590924","54.38.73.16","172.18.0.2","TLSv1.2","611","[TCP Spurious Retransmission] , Application Data"
"21.590978","172.18.0.2","54.38.73.16","TCP","80","[TCP Dup ACK 312#1] 36876 → 21002 [ACK] Seq=18376 Ack=276386 Win=5608 Len=0 TSval=1084566750 TSecr=2675290833 SLE=275843 SRE=276386"
"21.591762","172.18.0.2","54.38.73.16","TLSv1.2","611","Application Data"
"21.696728","54.38.73.16","172.18.0.2","TCP","68","21002 → 36876 [ACK] Seq=276386 Ack=18919 Win=1452 Len=0 TSval=2675290872 TSecr=1084566751"
"22.507258","54.38.73.16","172.18.0.2","TCP","1516","[TCP segment of a reassembled PDU]"
"22.507307","172.18.0.2","54.38.73.16","TCP","68","36876 → 21002 [ACK] Seq=18919 Ack=277834 Win=5601 Len=0 TSval=1084567667 TSecr=2675290995"
"22.507440","54.38.73.16","172.18.0.2","TLSv1.2","2247","Application Data"
"22.507468","172.18.0.2","54.38.73.16","TCP","68","36876 → 21002 [ACK] Seq=18919 Ack=280013 Win=5599 Len=0 TSval=1084567667 TSecr=2675290995"
"22.507446","54.38.73.16","172.18.0.2","TCP","1516","[TCP segment of a reassembled PDU]"
"22.507482","172.18.0.2","54.38.73.16","TCP","68","36876 → 21002 [ACK] Seq=18919 Ack=281461 Win=5591 Len=0 TSval=1084567667 TSecr=2675291004"
"22.507450","54.38.73.16","172.18.0.2","TCP","1516","21002 → 36876 [ACK] Seq=281461 Ack=18919 Win=1452 Len=1448 TSval=2675291042 TSecr=1084566751 [TCP segment of a reassembled PDU]"
"22.507494","172.18.0.2","54.38.73.16","TCP","68","36876 → 21002 [ACK] Seq=18919 Ack=282909 Win=5584 Len=0 TSval=1084567667 TSecr=2675291042"
"22.534261","54.38.73.16","172.18.0.2","TLSv1.2","5512","Application Data, Application Data, Application Data, Application Data"
"22.534295","172.18.0.2","54.38.73.16","TCP","68","36876 → 21002 [ACK] Seq=18919 Ack=288353 Win=5582 Len=0 TSval=1084567694 TSecr=2675291081"
"22.534744","172.18.0.2","54.38.73.16","TLSv1.2","611","Application Data"
"22.559827","54.38.73.16","172.18.0.2","TCP","68","[TCP Previous segment not captured] 21002 → 36876 [ACK] Seq=294094 Ack=19462 Win=1452 Len=0 TSval=2675291087 TSecr=1084567694"
"22.559849","54.38.73.16","172.18.0.2","TCP","5809","[TCP Retransmission] 21002 → 36876 [PSH, ACK] Seq=288353 Ack=18919 Win=1452 Len=5741 TSval=2675291087 TSecr=1084567694"
"22.559903","172.18.0.2","54.38.73.16","TCP","68","36876 → 21002 [ACK] Seq=19462 Ack=294094 Win=5581 Len=0 TSval=1084567719 TSecr=2675291087"
"22.584858","54.38.73.16","172.18.0.2","TCP","2964","[TCP segment of a reassembled PDU]"
"22.584895","172.18.0.2","54.38.73.16","TCP","68","36876 → 21002 [ACK] Seq=19462 Ack=296990 Win=5596 Len=0 TSval=1084567744 TSecr=2675291093"
"22.584864","54.38.73.16","172.18.0.2","TLSv1.2","2913","Application Data, Application Data, Application Data"
"22.584922","172.18.0.2","54.38.73.16","TCP","68","36876 → 21002 [ACK] Seq=19462 Ack=299835 Win=5581 Len=0 TSval=1084567744 TSecr=2675291094"
"22.611101","54.38.73.16","172.18.0.2","TLSv1.2","5809","Application Data, Application Data, Application Data"
"22.611133","172.18.0.2","54.38.73.16","TCP","68","36876 → 21002 [ACK] Seq=19462 Ack=305576 Win=5581 Len=0 TSval=1084567771 TSecr=2675291100"
"22.611750","172.18.0.2","54.38.73.16","TLSv1.2","611","Application Data"
"22.642345","54.38.73.16","172.18.0.2","TLSv1.2","4752","Application Data, Application Data"
"22.642380","172.18.0.2","54.38.73.16","TCP","68","36876 → 21002 [ACK] Seq=20005 Ack=310260 Win=5585 Len=0 TSval=1084567802 TSecr=2675291108"
"22.677129","54.38.73.16","172.18.0.2","TLSv1.2","3695","Application Data"
"22.677271","172.18.0.2","54.38.73.16","TCP","68","36876 → 21002 [ACK] Seq=20005 Ack=313887 Win=5580 Len=0 TSval=1084567837 TSecr=2675291117"
"22.699480","54.38.73.16","172.18.0.2","TCP","1516","[TCP segment of a reassembled PDU]"
"22.703139","54.38.73.16","172.18.0.2","TLSv1.2","2964","Application Data [TCP segment of a reassembled PDU]"
"22.703173","172.18.0.2","54.38.73.16","TCP","68","36876 → 21002 [ACK] Seq=20005 Ack=318231 Win=5596 Len=0 TSval=1084567863 TSecr=2675291122"
"22.711132","54.38.73.16","172.18.0.2","TCP","1516","21002 → 36876 [ACK] Seq=318231 Ack=20005 Win=1452 Len=1448 TSval=2675291125 TSecr=1084567837 [TCP segment of a reassembled PDU]"
"22.727046","54.38.73.16","172.18.0.2","TLSv1.2","2073","Application Data, Application Data"
"22.727079","172.18.0.2","54.38.73.16","TCP","68","36876 → 21002 [ACK] Seq=20005 Ack=321684 Win=5599 Len=0 TSval=1084567887 TSecr=2675291125"
"22.781985","54.38.73.16","172.18.0.2","TLSv1.2","3181","Application Data"
"22.782245","172.18.0.2","54.38.73.16","TCP","68","36876 → 21002 [ACK] Seq=20005 Ack=324797 Win=5580 Len=0 TSval=1084567942 TSecr=2675291143"
"22.863303","54.38.73.16","172.18.0.2","TLSv1.2","3695","Application Data"
"22.863353","172.18.0.2","54.38.73.16","TCP","68","36876 → 21002 [ACK] Seq=20005 Ack=328424 Win=5580 Len=0 TSval=1084568023 TSecr=2675291163"
"22.863807","172.18.0.2","54.38.73.16","TLSv1.2","611","Application Data"
"22.884691","54.38.73.16","172.18.0.2","TCP","1516","[TCP segment of a reassembled PDU]"
"22.887578","54.38.73.16","172.18.0.2","TLSv1.2","3304","Application Data, Application Data"
"22.887693","172.18.0.2","54.38.73.16","TCP","68","36876 → 21002 [ACK] Seq=20548 Ack=333108 Win=5580 Len=0 TSval=1084568047 TSecr=2675291169"
"22.924604","54.38.73.16","172.18.0.2","TCP","68","21002 → 36876 [ACK] Seq=333108 Ack=20548 Win=1452 Len=0 TSval=2675291179 TSecr=1084568023"
"23.131627","54.38.73.16","172.18.0.2","TLSv1.2","3695","Application Data"
"23.131683","172.18.0.2","54.38.73.16","TCP","68","36876 → 21002 [ACK] Seq=20548 Ack=336735 Win=5580 Len=0 TSval=1084568291 TSecr=2675291230"
"23.132191","172.18.0.2","54.38.73.16","TLSv1.2","611","Application Data"
"23.143480","54.38.73.16","172.18.0.2","TCP","1516","[TCP segment of a reassembled PDU]"
"23.155644","54.38.73.16","172.18.0.2","TLSv1.2","2247","Application Data"
"23.155837","172.18.0.2","54.38.73.16","TCP","68","36876 → 21002 [ACK] Seq=21091 Ack=340362 Win=5612 Len=0 TSval=1084568315 TSecr=2675291233"
"23.192286","54.38.73.16","172.18.0.2","TCP","68","21002 → 36876 [ACK] Seq=340362 Ack=21091 Win=1452 Len=0 TSval=2675291246 TSecr=1084568292"
"23.231815","54.38.73.16","172.18.0.2","TLSv1.2","3695","Application Data"
"23.231996","172.18.0.2","54.38.73.16","TCP","68","36876 → 21002 [ACK] Seq=21091 Ack=343989 Win=5584 Len=0 TSval=1084568391 TSecr=2675291255"
"23.243954","54.38.73.16","172.18.0.2","TCP","1516","[TCP segment of a reassembled PDU]"
"23.259859","54.38.73.16","172.18.0.2","TLSv1.2","3847","Application Data, Application Data, Application Data"
"23.260062","172.18.0.2","54.38.73.16","TCP","68","36876 → 21002 [ACK] Seq=21091 Ack=349216 Win=5580 Len=0 TSval=1084568420 TSecr=2675291258"
"23.308459","54.38.73.16","172.18.0.2","TLSv1.2","3181","Application Data"
"23.308513","172.18.0.2","54.38.73.16","TCP","68","36876 → 21002 [ACK] Seq=21091 Ack=352329 Win=5580 Len=0 TSval=1084568468 TSecr=2675291274"
"23.735035","54.38.73.16","172.18.0.2","TLSv1.2","3695","Application Data"
"23.735101","172.18.0.2","54.38.73.16","TCP","68","36876 → 21002 [ACK] Seq=21091 Ack=355956 Win=5581 Len=0 TSval=1084568895 TSecr=2675291308"
"23.735297","54.38.73.16","172.18.0.2","TCP","1516","[TCP segment of a reassembled PDU]"
"23.735303","54.38.73.16","172.18.0.2","TCP","1516","21002 → 36876 [ACK] Seq=357404 Ack=21091 Win=1452 Len=1448 TSval=2675291344 TSecr=1084568468 [TCP segment of a reassembled PDU]"
"23.735338","172.18.0.2","54.38.73.16","TCP","68","36876 → 21002 [ACK] Seq=21091 Ack=358852 Win=5596 Len=0 TSval=1084568895 TSecr=2675291322"
"23.735625","172.18.0.2","54.38.73.16","TLSv1.2","611","Application Data"
"23.758897","54.38.73.16","172.18.0.2","TLSv1.2","2884","Application Data, Application Data"
"23.758929","172.18.0.2","54.38.73.16","TCP","68","36876 → 21002 [ACK] Seq=21634 Ack=361668 Win=5596 Len=0 TSval=1084568918 TSecr=2675291387"
"23.836406","54.38.73.16","172.18.0.2","TCP","68","21002 → 36876 [ACK] Seq=361668 Ack=21634 Win=1452 Len=0 TSval=2675291407 TSecr=1084568895"
"23.836471","172.18.0.2","54.38.73.16","TLSv1.2","611","Application Data"
"23.861089","54.38.73.16","172.18.0.2","TCP","68","21002 → 36876 [ACK] Seq=361668 Ack=22177 Win=1452 Len=0 TSval=2675291413 TSecr=1084568996"
"24.961556","54.38.73.16","172.18.0.2","TLSv1.2","611","Application Data"
"24.962693","172.18.0.2","54.38.73.16","TLSv1.2","611","Application Data"
"24.987136","54.38.73.16","172.18.0.2","TCP","68","21002 → 36876 [ACK] Seq=362211 Ack=22720 Win=1452 Len=0 TSval=2675291694 TSecr=1084570122"
"25.882556","54.38.73.16","172.18.0.2","TLSv1.2","611","Application Data"
"25.884034","54.38.73.16","172.18.0.2","TCP","2964","[TCP segment of a reassembled PDU]"
"25.884132","172.18.0.2","54.38.73.16","TCP","68","36876 → 21002 [ACK] Seq=22720 Ack=365650 Win=5596 Len=0 TSval=1084571044 TSecr=2675291895"
"25.907401","54.38.73.16","172.18.0.2","TLSv1.2","799","Application Data"
"25.955094","172.18.0.2","54.38.73.16","TCP","68","36876 → 21002 [ACK] Seq=22720 Ack=366381 Win=5612 Len=0 TSval=1084571115 TSecr=2675291924"
"25.960162","54.38.73.16","172.18.0.2","TCP","2964","[TCP segment of a reassembled PDU]"
"25.960187","172.18.0.2","54.38.73.16","TCP","68","36876 → 21002 [ACK] Seq=22720 Ack=369277 Win=5596 Len=0 TSval=1084571120 TSecr=2675291937"
"25.972634","54.38.73.16","172.18.0.2","TLSv1.2","1516","Application Data [TCP segment of a reassembled PDU]"
"25.972681","172.18.0.2","54.38.73.16","TCP","68","36876 → 21002 [ACK] Seq=22720 Ack=370725 Win=5593 Len=0 TSval=1084571132 TSecr=2675291940"
"25.986274","54.38.73.16","172.18.0.2","TLSv1.2","1950","Application Data"
"25.986313","172.18.0.2","54.38.73.16","TCP","68","36876 → 21002 [ACK] Seq=22720 Ack=372607 Win=5600 Len=0 TSval=1084571146 TSecr=2675291944"
"26.189502","54.38.73.16","172.18.0.2","TCP","1516","[TCP segment of a reassembled PDU]"
"26.189532","172.18.0.2","54.38.73.16","TCP","68","36876 → 21002 [ACK] Seq=22720 Ack=374055 Win=5593 Len=0 TSval=1084571349 TSecr=2675291973"
"26.189683","54.38.73.16","172.18.0.2","TLSv1.2","2247","Application Data"
"26.189705","172.18.0.2","54.38.73.16","TCP","68","36876 → 21002 [ACK] Seq=22720 Ack=376234 Win=5599 Len=0 TSval=1084571349 TSecr=2675291973"
"26.214700","54.38.73.16","172.18.0.2","TLSv1.2","611","Application Data"
"26.214753","172.18.0.2","54.38.73.16","TCP","68","36876 → 21002 [ACK] Seq=22720 Ack=376777 Win=5595 Len=0 TSval=1084571374 TSecr=2675292001"
"26.291184","54.38.73.16","172.18.0.2","TLSv1.2","3695","Application Data"
"26.291217","172.18.0.2","54.38.73.16","TCP","68","36876 → 21002 [ACK] Seq=22720 Ack=380404 Win=5580 Len=0 TSval=1084571451 TSecr=2675292020"
"26.315885","54.38.73.16","172.18.0.2","TLSv1.2","611","Application Data"
"26.315931","172.18.0.2","54.38.73.16","TCP","68","36876 → 21002 [ACK] Seq=22720 Ack=380947 Win=5593 Len=0 TSval=1084571475 TSecr=2675292026"
"26.804086","54.38.73.16","172.18.0.2","TCP","1516","[TCP segment of a reassembled PDU]"
"26.804120","172.18.0.2","54.38.73.16","TCP","68","36876 → 21002 [ACK] Seq=22720 Ack=382395 Win=5593 Len=0 TSval=1084571964 TSecr=2675292082"
"26.804275","54.38.73.16","172.18.0.2","TLSv1.2","1733","Application Data"
"26.804306","172.18.0.2","54.38.73.16","TCP","68","36876 → 21002 [ACK] Seq=22720 Ack=384060 Win=5601 Len=0 TSval=1084571964 TSecr=2675292082"
"26.804280","54.38.73.16","172.18.0.2","TLSv1.2","1516","Application Data"
"26.804321","172.18.0.2","54.38.73.16","TCP","68","36876 → 21002 [ACK] Seq=22720 Ack=385508 Win=5593 Len=0 TSval=1084571964 TSecr=2675292111"
"26.804284","54.38.73.16","172.18.0.2","TCP","1516","21002 → 36876 [ACK] Seq=385508 Ack=22720 Win=1452 Len=1448 TSval=2675292147 TSecr=1084571475 [TCP segment of a reassembled PDU]"
"26.804332","172.18.0.2","54.38.73.16","TCP","68","36876 → 21002 [ACK] Seq=22720 Ack=386956 Win=5586 Len=0 TSval=1084571964 TSecr=2675292147"
"27.010803","54.38.73.16","172.18.0.2","TCP","1516","21002 → 36876 [ACK] Seq=386956 Ack=22720 Win=1452 Len=1448 TSval=2675292181 TSecr=1084571964 [TCP segment of a reassembled PDU]"
"27.010839","172.18.0.2","54.38.73.16","TCP","68","36876 → 21002 [ACK] Seq=22720 Ack=388404 Win=5593 Len=0 TSval=1084572170 TSecr=2675292181"
"27.011071","54.38.73.16","172.18.0.2","TLSv1.2","4064","Application Data, Application Data, Application Data"
"27.011112","172.18.0.2","54.38.73.16","TCP","68","36876 → 21002 [ACK] Seq=22720 Ack=392400 Win=5590 Len=0 TSval=1084572171 TSecr=2675292181"
"27.011083","54.38.73.16","172.18.0.2","TCP","2964","[TCP segment of a reassembled PDU]"
"27.011142","172.18.0.2","54.38.73.16","TCP","68","36876 → 21002 [ACK] Seq=22720 Ack=395296 Win=5568 Len=0 TSval=1084572171 TSecr=2675292182"
"27.011629","172.18.0.2","54.38.73.16","TLSv1.2","1125","Application Data"
"27.036135","54.38.73.16","172.18.0.2","TLSv1.2","8596","Application Data, Application Data, Application Data, Application Data"
"27.036170","172.18.0.2","54.38.73.16","TCP","68","36876 → 21002 [ACK] Seq=23777 Ack=403824 Win=5566 Len=0 TSval=1084572196 TSecr=2675292206"
"27.039281","54.38.73.16","172.18.0.2","TCP","68","21002 → 36876 [ACK] Seq=403824 Ack=23777 Win=1452 Len=0 TSval=2675292207 TSecr=1084572171"
"27.060949","54.38.73.16","172.18.0.2","TLSv1.2","1639","Application Data"
"27.060983","172.18.0.2","54.38.73.16","TCP","68","36876 → 21002 [ACK] Seq=23777 Ack=405395 Win=5601 Len=0 TSval=1084572220 TSecr=2675292213"
"27.110732","54.38.73.16","172.18.0.2","TLSv1.2","3695","Application Data"
"27.110767","172.18.0.2","54.38.73.16","TCP","68","36876 → 21002 [ACK] Seq=23777 Ack=409022 Win=5580 Len=0 TSval=1084572270 TSecr=2675292225"
"27.315168","54.38.73.16","172.18.0.2","TLSv1.2","3695","Application Data"
"27.315219","172.18.0.2","54.38.73.16","TCP","68","36876 → 21002 [ACK] Seq=23777 Ack=412649 Win=5581 Len=0 TSval=1084572475 TSecr=2675292276"
"27.522224","54.38.73.16","172.18.0.2","TCP","1516","[TCP segment of a reassembled PDU]"
"27.522255","172.18.0.2","54.38.73.16","TCP","68","36876 → 21002 [ACK] Seq=23777 Ack=414097 Win=5593 Len=0 TSval=1084572682 TSecr=2675292316"
"27.522433","54.38.73.16","172.18.0.2","TLSv1.2","2697","Application Data"
"27.522462","172.18.0.2","54.38.73.16","TCP","68","36876 → 21002 [ACK] Seq=23777 Ack=416726 Win=5597 Len=0 TSval=1084572682 TSecr=2675292316"
"27.522440","54.38.73.16","172.18.0.2","TLSv1.2","4412","Application Data, Application Data"
"27.522486","172.18.0.2","54.38.73.16","TCP","68","36876 → 21002 [ACK] Seq=23777 Ack=421070 Win=5566 Len=0 TSval=1084572682 TSecr=2675292319"
"27.522842","172.18.0.2","54.38.73.16","TLSv1.2","611","Application Data"
"27.547337","54.38.73.16","172.18.0.2","TLSv1.2","2557","Application Data"
"27.547380","172.18.0.2","54.38.73.16","TCP","68","36876 → 21002 [ACK] Seq=24320 Ack=423559 Win=5597 Len=0 TSval=1084572707 TSecr=2675292334"
"27.571190","54.38.73.16","172.18.0.2","TCP","2964","[TCP segment of a reassembled PDU]"
"27.571303","54.38.73.16","172.18.0.2","TLSv1.2","799","Application Data"
"27.571369","172.18.0.2","54.38.73.16","TCP","68","36876 → 21002 [ACK] Seq=24320 Ack=427186 Win=5580 Len=0 TSval=1084572731 TSecr=2675292340"
"27.581920","54.38.73.16","172.18.0.2","TCP","2964","[TCP segment of a reassembled PDU]"
"27.581949","172.18.0.2","54.38.73.16","TCP","68","36876 → 21002 [ACK] Seq=24320 Ack=430082 Win=5596 Len=0 TSval=1084572741 TSecr=2675292343"
"27.595566","54.38.73.16","172.18.0.2","TLSv1.2","285","Application Data"
"27.595753","172.18.0.2","54.38.73.16","TCP","68","36876 → 21002 [ACK] Seq=24320 Ack=430299 Win=5612 Len=0 TSval=1084572755 TSecr=2675292346"
"27.664591","54.38.73.16","172.18.0.2","TLSv1.2","3181","Application Data"
"27.664786","172.18.0.2","54.38.73.16","TCP","68","36876 → 21002 [ACK] Seq=24320 Ack=433412 Win=5588 Len=0 TSval=1084572824 TSecr=2675292363"
"27.799670","54.38.73.16","172.18.0.2","TLSv1.2","3181","Application Data"
"27.799819","172.18.0.2","54.38.73.16","TCP","68","36876 → 21002 [ACK] Seq=24320 Ack=436525 Win=5580 Len=0 TSval=1084572959 TSecr=2675292397"
"27.878673","54.38.73.16","172.18.0.2","TLSv1.2","3695","Application Data"
"27.878736","172.18.0.2","54.38.73.16","TCP","68","36876 → 21002 [ACK] Seq=24320 Ack=440152 Win=5580 Len=0 TSval=1084573038 TSecr=2675292417"
"27.879287","172.18.0.2","54.38.73.16","TLSv1.2","1125","Application Data"
"27.888468","54.38.73.16","172.18.0.2","TCP","1516","[TCP segment of a reassembled PDU]"
"27.902979","54.38.73.16","172.18.0.2","TLSv1.2","191","Application Data"
"27.903183","172.18.0.2","54.38.73.16","TCP","68","36876 → 21002 [ACK] Seq=25377 Ack=441723 Win=5612 Len=0 TSval=1084573063 TSecr=2675292420"
"27.940227","54.38.73.16","172.18.0.2","TCP","68","21002 → 36876 [ACK] Seq=441723 Ack=25377 Win=1452 Len=0 TSval=2675292433 TSecr=1084573039"
"27.940270","172.18.0.2","54.38.73.16","TLSv1.2","611","Application Data"
"27.964592","54.38.73.16","172.18.0.2","TCP","68","21002 → 36876 [ACK] Seq=441723 Ack=25920 Win=1452 Len=0 TSval=2675292439 TSecr=1084573100"
"28.650836","54.38.73.16","172.18.0.2","TLSv1.2","611","Application Data"
"28.651863","172.18.0.2","54.38.73.16","TLSv1.2","611","Application Data"
"28.677873","54.38.73.16","172.18.0.2","TCP","68","21002 → 36876 [ACK] Seq=442266 Ack=26463 Win=1452 Len=0 TSval=2675292617 TSecr=1084573811"
"29.569538","54.38.73.16","172.18.0.2","TLSv1.2","611","Application Data"
"29.569603","54.38.73.16","172.18.0.2","TCP","2964","[TCP segment of a reassembled PDU]"
"29.569607","54.38.73.16","172.18.0.2","TLSv1.2","2964","Application Data [TCP segment of a reassembled PDU]"
"29.569611","54.38.73.16","172.18.0.2","TCP","1516","21002 → 36876 [ACK] Seq=448601 Ack=26463 Win=1452 Len=1448 TSval=2675292796 TSecr=1084573811 [TCP segment of a reassembled PDU]"
"29.569614","54.38.73.16","172.18.0.2","TLSv1.2","1516","Application Data [TCP segment of a reassembled PDU]"
"29.569800","172.18.0.2","54.38.73.16","TCP","68","36876 → 21002 [ACK] Seq=26463 Ack=451497 Win=5548 Len=0 TSval=1084574729 TSecr=2675292763"
"29.594712","54.38.73.16","172.18.0.2","TLSv1.2","5860","Application Data, Application Data"
"29.594746","172.18.0.2","54.38.73.16","TCP","68","36876 → 21002 [ACK] Seq=26463 Ack=457289 Win=5581 Len=0 TSval=1084574754 TSecr=2675292846"
"29.595043","54.38.73.16","172.18.0.2","TLSv1.2","2724","Application Data, Application Data"
"29.595258","172.18.0.2","54.38.73.16","TCP","68","36876 → 21002 [ACK] Seq=26463 Ack=459945 Win=5567 Len=0 TSval=1084574755 TSecr=2675292846"
"29.667735","54.38.73.16","172.18.0.2","TLSv1.2","3695","Application Data"
"29.667792","172.18.0.2","54.38.73.16","TCP","68","36876 → 21002 [ACK] Seq=26463 Ack=463572 Win=5580 Len=0 TSval=1084574827 TSecr=2675292864"
"29.691648","54.38.73.16","172.18.0.2","TLSv1.2","611","Application Data"
"29.710771","54.38.73.16","172.18.0.2","TCP","2964","[TCP segment of a reassembled PDU]"
"29.710802","172.18.0.2","54.38.73.16","TCP","68","36876 → 21002 [ACK] Seq=26463 Ack=467011 Win=5596 Len=0 TSval=1084574870 TSecr=2675292870"
"29.736165","54.38.73.16","172.18.0.2","TLSv1.2","285","Application Data"
"29.769931","54.38.73.16","172.18.0.2","TCP","2964","[TCP segment of a reassembled PDU]"
"29.769962","172.18.0.2","54.38.73.16","TCP","68","36876 → 21002 [ACK] Seq=26463 Ack=470124 Win=5596 Len=0 TSval=1084574929 TSecr=2675292881"
"29.792591","54.38.73.16","172.18.0.2","TLSv1.2","2964","Application Data [TCP segment of a reassembled PDU]"
"29.792621","172.18.0.2","54.38.73.16","TCP","68","36876 → 21002 [ACK] Seq=26463 Ack=473020 Win=5596 Len=0 TSval=1084574952 TSecr=2675292895"
"29.793088","172.18.0.2","54.38.73.16","TLSv1.2","611","Application Data"
"29.793991","54.38.73.16","172.18.0.2","TLSv1.2","1016","Application Data"
"29.816297","54.38.73.16","172.18.0.2","TCP","68","21002 → 36876 [ACK] Seq=473968 Ack=27006 Win=1452 Len=0 TSval=2675292902 TSecr=1084574953"
"29.839096","172.18.0.2","54.38.73.16","TCP","68","36876 → 21002 [ACK] Seq=27006 Ack=473968 Win=5612 Len=0 TSval=1084574999 TSecr=2675292896"
"29.859952","54.38.73.16","172.18.0.2","TCP","2964","[TCP segment of a reassembled PDU]"
"29.859986","172.18.0.2","54.38.73.16","TCP","68","36876 → 21002 [ACK] Seq=27006 Ack=476864 Win=5596 Len=0 TSval=1084575019 TSecr=2675292912"
"29.863349","54.38.73.16","172.18.0.2","TLSv1.2","799","Application Data"
"29.863428","172.18.0.2","54.38.73.16","TCP","68","36876 → 21002 [ACK] Seq=27006 Ack=477595 Win=5593 Len=0 TSval=1084575023 TSecr=2675292913"
"29.869577","54.38.73.16","172.18.0.2","TLSv1.2","4412","Application Data"
"29.869603","172.18.0.2","54.38.73.16","TCP","68","36876 → 21002 [ACK] Seq=27006 Ack=481939 Win=5580 Len=0 TSval=1084575029 TSecr=2675292915"
"29.887091","54.38.73.16","172.18.0.2","TLSv1.2","922","Application Data"
"29.887127","172.18.0.2","54.38.73.16","TCP","68","36876 → 21002 [ACK] Seq=27006 Ack=482793 Win=5593 Len=0 TSval=1084575047 TSecr=2675292919"
"29.978566","54.38.73.16","172.18.0.2","TLSv1.2","2667","Application Data"
"29.978609","172.18.0.2","54.38.73.16","TCP","68","36876 → 21002 [ACK] Seq=27006 Ack=485392 Win=5597 Len=0 TSval=1084575138 TSecr=2675292942"
"30.019555","54.38.73.16","172.18.0.2","TLSv1.2","3695","Application Data"
"30.019591","172.18.0.2","54.38.73.16","TCP","68","36876 → 21002 [ACK] Seq=27006 Ack=489019 Win=5580 Len=0 TSval=1084575179 TSecr=2675292952"
"30.066870","54.38.73.16","172.18.0.2","TLSv1.2","2153","Application Data"
"30.066916","172.18.0.2","54.38.73.16","TCP","68","36876 → 21002 [ACK] Seq=27006 Ack=491104 Win=5599 Len=0 TSval=1084575226 TSecr=2675292964"
"30.076282","172.18.0.2","54.38.73.16","TLSv1.2","611","Application Data"
"30.101815","54.38.73.16","172.18.0.2","TCP","68","21002 → 36876 [ACK] Seq=491104 Ack=27549 Win=1452 Len=0 TSval=2675292973 TSecr=1084575236"
"30.799121","54.38.73.16","172.18.0.2","TLSv1.2","611","Application Data"
"30.799170","172.18.0.2","54.38.73.16","TCP","68","36876 → 21002 [ACK] Seq=27549 Ack=491647 Win=5608 Len=0 TSval=1084575959 TSecr=2675293085"
"30.800118","172.18.0.2","54.38.73.16","TLSv1.2","611","Application Data"
"30.807800","54.38.73.16","172.18.0.2","TLSv1.2","611","[TCP Spurious Retransmission] , Application Data"
"30.807830","172.18.0.2","54.38.73.16","TCP","80","[TCP Dup ACK 503#1] 36876 → 21002 [ACK] Seq=28092 Ack=491647 Win=5612 Len=0 TSval=1084575967 TSecr=2675293150 SLE=491104 SRE=491647"
"30.824415","54.38.73.16","172.18.0.2","TCP","68","21002 → 36876 [ACK] Seq=491647 Ack=28092 Win=1452 Len=0 TSval=2675293154 TSecr=1084575960"
"31.413890","54.38.73.16","172.18.0.2","TLSv1.2","611","Application Data"
"31.413943","172.18.0.2","54.38.73.16","TCP","68","36876 → 21002 [ACK] Seq=28092 Ack=492190 Win=5608 Len=0 TSval=1084576573 TSecr=2675293287"
"31.501488","54.38.73.16","172.18.0.2","TLSv1.2","3695","Application Data"
"31.501522","172.18.0.2","54.38.73.16","TCP","68","36876 → 21002 [ACK] Seq=28092 Ack=495817 Win=5580 Len=0 TSval=1084576661 TSecr=2675293323"
"31.501993","172.18.0.2","54.38.73.16","TLSv1.2","611","Application Data"
"31.525817","54.38.73.16","172.18.0.2","TCP","68","21002 → 36876 [ACK] Seq=495817 Ack=28635 Win=1452 Len=0 TSval=2675293329 TSecr=1084576661"
"31.528443","54.38.73.16","172.18.0.2","TLSv1.2","4145","Application Data"
"31.528481","172.18.0.2","54.38.73.16","TCP","68","36876 → 21002 [ACK] Seq=28635 Ack=499894 Win=5589 Len=0 TSval=1084576688 TSecr=2675293330"
"31.528450","54.38.73.16","172.18.0.2","TCP","2964","[TCP segment of a reassembled PDU]"
"31.528524","172.18.0.2","54.38.73.16","TCP","68","36876 → 21002 [ACK] Seq=28635 Ack=502790 Win=5567 Len=0 TSval=1084576688 TSecr=2675293330"
"31.553880","54.38.73.16","172.18.0.2","TLSv1.2","5004","Application Data, Application Data"
"31.553914","172.18.0.2","54.38.73.16","TCP","68","36876 → 21002 [ACK] Seq=28635 Ack=507726 Win=5584 Len=0 TSval=1084576713 TSecr=2675293336"
"31.636835","54.38.73.16","172.18.0.2","TLSv1.2","3695","Application Data"
"31.636871","172.18.0.2","54.38.73.16","TCP","68","36876 → 21002 [ACK] Seq=28635 Ack=511353 Win=5580 Len=0 TSval=1084576796 TSecr=2675293357"
"31.691350","54.38.73.16","172.18.0.2","TLSv1.2","1639","Application Data"
"31.691383","172.18.0.2","54.38.73.16","TCP","68","36876 → 21002 [ACK] Seq=28635 Ack=512924 Win=5601 Len=0 TSval=1084576851 TSecr=2675293370"
"31.774478","54.38.73.16","172.18.0.2","TLSv1.2","3695","Application Data"
"31.774529","172.18.0.2","54.38.73.16","TCP","68","36876 → 21002 [ACK] Seq=28635 Ack=516551 Win=5580 Len=0 TSval=1084576934 TSecr=2675293391"
"31.816016","54.38.73.16","172.18.0.2","TLSv1.2","3695","Application Data"
"31.816039","172.18.0.2","54.38.73.16","TCP","68","36876 → 21002 [ACK] Seq=28635 Ack=520178 Win=5580 Len=0 TSval=1084576976 TSecr=2675293401"
"31.816313","172.18.0.2","54.38.73.16","TLSv1.2","611","Application Data"
"31.826008","54.38.73.16","172.18.0.2","TCP","2964","[TCP segment of a reassembled PDU]"
"31.826034","172.18.0.2","54.38.73.16","TCP","68","36876 → 21002 [ACK] Seq=29178 Ack=523074 Win=5596 Len=0 TSval=1084576986 TSecr=2675293404"
"31.841280","54.38.73.16","172.18.0.2","TLSv1.2","2964","Application Data [TCP segment of a reassembled PDU]"
"31.841303","172.18.0.2","54.38.73.16","TCP","68","36876 → 21002 [ACK] Seq=29178 Ack=525970 Win=5596 Len=0 TSval=1084577001 TSecr=2675293408"
"31.850451","54.38.73.16","172.18.0.2","TLSv1.2","2044","Application Data"
"31.850477","172.18.0.2","54.38.73.16","TCP","68","36876 → 21002 [ACK] Seq=29178 Ack=527946 Win=5599 Len=0 TSval=1084577010 TSecr=2675293410"
"32.027552","54.38.73.16","172.18.0.2","TCP","1516","[TCP segment of a reassembled PDU]"
"32.027590","172.18.0.2","54.38.73.16","TCP","68","36876 → 21002 [ACK] Seq=29178 Ack=529394 Win=5593 Len=0 TSval=1084577187 TSecr=2675293436"
"32.027785","54.38.73.16","172.18.0.2","TLSv1.2","1733","Application Data"
"32.027856","172.18.0.2","54.38.73.16","TCP","68","36876 → 21002 [ACK] Seq=29178 Ack=531059 Win=5601 Len=0 TSval=1084577187 TSecr=2675293436"
"32.027792","54.38.73.16","172.18.0.2","TCP","1516","[TCP segment of a reassembled PDU]"
"32.027798","54.38.73.16","172.18.0.2","TLSv1.2","1516","Application Data [TCP segment of a reassembled PDU]"
"32.027926","172.18.0.2","54.38.73.16","TCP","68","36876 → 21002 [ACK] Seq=29178 Ack=533955 Win=5579 Len=0 TSval=1084577187 TSecr=2675293449"
"32.052093","54.38.73.16","172.18.0.2","TLSv1.2","4969","Application Data, Application Data"
"32.052124","172.18.0.2","54.38.73.16","TCP","68","36876 → 21002 [ACK] Seq=29178 Ack=538856 Win=5584 Len=0 TSval=1084577212 TSecr=2675293460"
"32.062220","172.18.0.2","54.38.73.16","TLSv1.2","611","Application Data"
"32.123976","54.38.73.16","172.18.0.2","TCP","68","21002 → 36876 [ACK] Seq=538856 Ack=29721 Win=1452 Len=0 TSval=2675293479 TSecr=1084577222"
"32.954313","54.38.73.16","172.18.0.2","TLSv1.2","611","Application Data"
"32.955429","172.18.0.2","54.38.73.16","TLSv1.2","611","Application Data"
"32.982504","54.38.73.16","172.18.0.2","TCP","68","21002 → 36876 [ACK] Seq=539399 Ack=30264 Win=1452 Len=0 TSval=2675293693 TSecr=1084578115"
"33.569426","54.38.73.16","172.18.0.2","TLSv1.2","611","Application Data"
"33.569493","54.38.73.16","172.18.0.2","TCP","2964","[TCP segment of a reassembled PDU]"
"33.569497","54.38.73.16","172.18.0.2","TLSv1.2","2964","Application Data [TCP segment of a reassembled PDU]"
"33.569647","172.18.0.2","54.38.73.16","TCP","68","36876 → 21002 [ACK] Seq=30264 Ack=545734 Win=5563 Len=0 TSval=1084578729 TSecr=2675293811"
"33.596637","54.38.73.16","172.18.0.2","TLSv1.2","5700","Application Data, Application Data, Application Data"
"33.596675","172.18.0.2","54.38.73.16","TCP","68","36876 → 21002 [ACK] Seq=30264 Ack=551366 Win=5581 Len=0 TSval=1084578756 TSecr=2675293846"
"33.596643","54.38.73.16","172.18.0.2","TCP","1516","[TCP segment of a reassembled PDU]"
"33.597205","172.18.0.2","54.38.73.16","TLSv1.2","611","Application Data"
"33.622132","54.38.73.16","172.18.0.2","TLSv1.2","5860","Application Data [TCP segment of a reassembled PDU]"
"33.622168","172.18.0.2","54.38.73.16","TCP","68","36876 → 21002 [ACK] Seq=30807 Ack=558606 Win=5581 Len=0 TSval=1084578782 TSecr=2675293853"
"33.623499","54.38.73.16","172.18.0.2","TLSv1.2","596","Application Data"
"33.667121","172.18.0.2","54.38.73.16","TCP","68","36876 → 21002 [ACK] Seq=30807 Ack=559134 Win=5612 Len=0 TSval=1084578827 TSecr=2675293853"
"33.680836","54.38.73.16","172.18.0.2","TCP","1516","[TCP segment of a reassembled PDU]"
"33.680887","172.18.0.2","54.38.73.16","TCP","68","36876 → 21002 [ACK] Seq=30807 Ack=560582 Win=5601 Len=0 TSval=1084578840 TSecr=2675293867"
"33.692585","54.38.73.16","172.18.0.2","TLSv1.2","705","Application Data"
"33.692621","172.18.0.2","54.38.73.16","TCP","68","36876 → 21002 [ACK] Seq=30807 Ack=561219 Win=5597 Len=0 TSval=1084578852 TSecr=2675293871"
"33.786230","54.38.73.16","172.18.0.2","TLSv1.2","2153","Application Data"
"33.786263","172.18.0.2","54.38.73.16","TCP","68","36876 → 21002 [ACK] Seq=30807 Ack=563304 Win=5599 Len=0 TSval=1084578946 TSecr=2675293894"
"33.792325","172.18.0.2","54.38.73.16","TLSv1.2","611","Application Data"
"33.856225","54.38.73.16","172.18.0.2","TCP","68","21002 → 36876 [ACK] Seq=563304 Ack=31350 Win=1452 Len=0 TSval=2675293912 TSecr=1084578952"
"35.100180","54.38.73.16","172.18.0.2","TLSv1.2","611","Application Data"
"35.100248","172.18.0.2","54.38.73.16","TCP","68","36876 → 21002 [ACK] Seq=31350 Ack=563847 Win=5608 Len=0 TSval=1084580260 TSecr=2675294144"
"35.100196","54.38.73.16","172.18.0.2","TLSv1.2","611","[TCP Spurious Retransmission] , Application Data"
"35.100261","172.18.0.2","54.38.73.16","TCP","80","[TCP Dup ACK 570#1] 36876 → 21002 [ACK] Seq=31350 Ack=563847 Win=5608 Len=0 TSval=1084580260 TSecr=2675294206 SLE=563304 SRE=563847"
"35.101269","172.18.0.2","54.38.73.16","TLSv1.2","611","Application Data"
"35.125068","54.38.73.16","172.18.0.2","TCP","68","21002 → 36876 [ACK] Seq=563847 Ack=31893 Win=1452 Len=0 TSval=2675294229 TSecr=1084580261"
"35.714528","54.38.73.16","172.18.0.2","TCP","1516","[TCP segment of a reassembled PDU]"
"35.714573","172.18.0.2","54.38.73.16","TCP","68","36876 → 21002 [ACK] Seq=31893 Ack=565295 Win=5601 Len=0 TSval=1084580874 TSecr=2675294359"
"35.714684","54.38.73.16","172.18.0.2","TLSv1.2","2247","Application Data"
"35.714722","172.18.0.2","54.38.73.16","TCP","68","36876 → 21002 [ACK] Seq=31893 Ack=567474 Win=5585 Len=0 TSval=1084580874 TSecr=2675294359"
"35.738841","54.38.73.16","172.18.0.2","TLSv1.2","611","Application Data"
"35.738877","172.18.0.2","54.38.73.16","TCP","68","36876 → 21002 [ACK] Seq=31893 Ack=568017 Win=5593 Len=0 TSval=1084580898 TSecr=2675294382"
"35.919507","54.38.73.16","172.18.0.2","TLSv1.2","3695","Application Data"
"35.919542","172.18.0.2","54.38.73.16","TCP","68","36876 → 21002 [ACK] Seq=31893 Ack=571644 Win=5581 Len=0 TSval=1084581079 TSecr=2675294407"
"35.919512","54.38.73.16","172.18.0.2","TCP","2964","[TCP segment of a reassembled PDU]"
"35.919572","172.18.0.2","54.38.73.16","TCP","68","36876 → 21002 [ACK] Seq=31893 Ack=574540 Win=5566 Len=0 TSval=1084581079 TSecr=2675294412"
"35.943505","54.38.73.16","172.18.0.2","TLSv1.2","7054","Application Data, Application Data, Application Data, Application Data"
"35.943537","172.18.0.2","54.38.73.16","TCP","68","36876 → 21002 [ACK] Seq=31893 Ack=581526 Win=5565 Len=0 TSval=1084581103 TSecr=2675294433"
"35.967271","54.38.73.16","172.18.0.2","TCP","2964","[TCP segment of a reassembled PDU]"
"35.967301","172.18.0.2","54.38.73.16","TCP","68","36876 → 21002 [ACK] Seq=31893 Ack=584422 Win=5596 Len=0 TSval=1084581127 TSecr=2675294439"
"35.967715","54.38.73.16","172.18.0.2","TLSv1.2","3912","Application Data, Application Data"
"35.967732","172.18.0.2","54.38.73.16","TCP","68","36876 → 21002 [ACK] Seq=31893 Ack=588266 Win=5580 Len=0 TSval=1084581127 TSecr=2675294439"
"35.993010","54.38.73.16","172.18.0.2","TLSv1.2","6808","Application Data, Application Data"
"35.993040","172.18.0.2","54.38.73.16","TCP","68","36876 → 21002 [ACK] Seq=31893 Ack=595006 Win=5565 Len=0 TSval=1084581153 TSecr=2675294446"
"35.993542","172.18.0.2","54.38.73.16","TLSv1.2","611","Application Data"
"36.018445","54.38.73.16","172.18.0.2","TLSv1.2","611","Application Data"
"36.018470","172.18.0.2","54.38.73.16","TCP","68","36876 → 21002 [ACK] Seq=32436 Ack=595549 Win=5607 Len=0 TSval=1084581178 TSecr=2675294452"
"36.018450","54.38.73.16","172.18.0.2","TCP","68","21002 → 36876 [ACK] Seq=595549 Ack=32436 Win=1452 Len=0 TSval=2675294452 TSecr=1084581153"
"36.043766","54.38.73.16","172.18.0.2","TLSv1.2","611","Application Data"
"36.043799","172.18.0.2","54.38.73.16","TCP","68","36876 → 21002 [ACK] Seq=32436 Ack=596092 Win=5603 Len=0 TSval=1084581203 TSecr=2675294458"
"36.074704","54.38.73.16","172.18.0.2","TLSv1.2","3695","Application Data"
"36.074736","172.18.0.2","54.38.73.16","TCP","68","36876 → 21002 [ACK] Seq=32436 Ack=599719 Win=5580 Len=0 TSval=1084581234 TSecr=2675294466"
"36.075358","172.18.0.2","54.38.73.16","TLSv1.2","611","Application Data"
"36.113463","54.38.73.16","172.18.0.2","TLSv1.2","1125","Application Data"
"36.115055","54.38.73.16","172.18.0.2","TCP","2964","[TCP segment of a reassembled PDU]"
"36.115144","172.18.0.2","54.38.73.16","TCP","68","36876 → 21002 [ACK] Seq=32979 Ack=603672 Win=5596 Len=0 TSval=1084581275 TSecr=2675294474"
"36.140818","54.38.73.16","172.18.0.2","TLSv1.2","1342","Application Data, Application Data"
"36.183124","172.18.0.2","54.38.73.16","TCP","68","36876 → 21002 [ACK] Seq=32979 Ack=604946 Win=5612 Len=0 TSval=1084581343 TSecr=2675294483"
"36.188686","54.38.73.16","172.18.0.2","TCP","2964","[TCP segment of a reassembled PDU]"
"36.188861","172.18.0.2","54.38.73.16","TCP","68","36876 → 21002 [ACK] Seq=32979 Ack=607842 Win=5596 Len=0 TSval=1084581348 TSecr=2675294495"
"36.207276","54.38.73.16","172.18.0.2","TLSv1.2","1342","Application Data, Application Data"
"36.207677","172.18.0.2","54.38.73.16","TCP","68","36876 → 21002 [ACK] Seq=32979 Ack=609116 Win=5612 Len=0 TSval=1084581367 TSecr=2675294499"
"36.274795","54.38.73.16","172.18.0.2","TLSv1.2","3695","Application Data"
"36.275018","172.18.0.2","54.38.73.16","TCP","68","36876 → 21002 [ACK] Seq=32979 Ack=612743 Win=5584 Len=0 TSval=1084581435 TSecr=2675294516"
"36.284019","172.18.0.2","54.38.73.16","TLSv1.2","611","Application Data"
"36.348691","54.38.73.16","172.18.0.2","TCP","68","21002 → 36876 [ACK] Seq=612743 Ack=33522 Win=1452 Len=0 TSval=2675294535 TSecr=1084581444"
"36.944396","54.38.73.16","172.18.0.2","TLSv1.2","611","Application Data"
"36.944442","172.18.0.2","54.38.73.16","TCP","68","36876 → 21002 [ACK] Seq=33522 Ack=613286 Win=5608 Len=0 TSval=1084582104 TSecr=2675294669"
"36.945246","172.18.0.2","54.38.73.16","TLSv1.2","611","Application Data"
"36.970757","54.38.73.16","172.18.0.2","TCP","68","21002 → 36876 [ACK] Seq=613286 Ack=34065 Win=1452 Len=0 TSval=2675294690 TSecr=1084582105"
"37.558400","54.38.73.16","172.18.0.2","TLSv1.2","2153","Application Data"
"37.558448","172.18.0.2","54.38.73.16","TCP","68","36876 → 21002 [ACK] Seq=34065 Ack=615371 Win=5596 Len=0 TSval=1084582718 TSecr=2675294811"
"37.558405","54.38.73.16","172.18.0.2","TCP","2964","[TCP segment of a reassembled PDU]"
"37.558462","172.18.0.2","54.38.73.16","TCP","68","36876 → 21002 [ACK] Seq=34065 Ack=618267 Win=5574 Len=0 TSval=1084582718 TSecr=2675294814"
"37.558409","54.38.73.16","172.18.0.2","TLSv1.2","1516","Application Data [TCP segment of a reassembled PDU]"
"37.558469","172.18.0.2","54.38.73.16","TCP","68","36876 → 21002 [ACK] Seq=34065 Ack=619715 Win=5566 Len=0 TSval=1084582718 TSecr=2675294825"
"37.583778","54.38.73.16","172.18.0.2","TLSv1.2","7177","Application Data, Application Data, Application Data, Application Data"
"37.583801","172.18.0.2","54.38.73.16","TCP","68","36876 → 21002 [ACK] Seq=34065 Ack=626824 Win=5565 Len=0 TSval=1084582743 TSecr=2675294843"
"37.588377","54.38.73.16","172.18.0.2","TCP","1516","[TCP segment of a reassembled PDU]"
"37.588401","172.18.0.2","54.38.73.16","TCP","68","36876 → 21002 [ACK] Seq=34065 Ack=628272 Win=5593 Len=0 TSval=1084582748 TSecr=2675294844"
"37.608658","54.38.73.16","172.18.0.2","TLSv1.2","5860","Application Data [TCP segment of a reassembled PDU]"
"37.608679","172.18.0.2","54.38.73.16","TCP","68","36876 → 21002 [ACK] Seq=34065 Ack=634064 Win=5581 Len=0 TSval=1084582768 TSecr=2675294850"
"37.612946","54.38.73.16","172.18.0.2","TLSv1.2","2710","Application Data, Application Data, Application Data"
"37.612965","172.18.0.2","54.38.73.16","TCP","68","36876 → 21002 [ACK] Seq=34065 Ack=636706 Win=5597 Len=0 TSval=1084582772 TSecr=2675294851"
"37.675518","54.38.73.16","172.18.0.2","TLSv1.2","1125","Application Data"
"37.675542","172.18.0.2","54.38.73.16","TCP","68","36876 → 21002 [ACK] Seq=34065 Ack=637763 Win=5593 Len=0 TSval=1084582835 TSecr=2675294866"
"37.858111","54.38.73.16","172.18.0.2","TCP","1516","[TCP segment of a reassembled PDU]"
"37.858136","172.18.0.2","54.38.73.16","TCP","68","36876 → 21002 [ACK] Seq=34065 Ack=639211 Win=5593 Len=0 TSval=1084583018 TSecr=2675294895"
"37.858412","54.38.73.16","172.18.0.2","TLSv1.2","2247","Application Data"
"37.858439","172.18.0.2","54.38.73.16","TCP","68","36876 → 21002 [ACK] Seq=34065 Ack=641390 Win=5599 Len=0 TSval=1084583018 TSecr=2675294895"
"37.858418","54.38.73.16","172.18.0.2","TLSv1.2","4412","Application Data"
"37.858461","172.18.0.2","54.38.73.16","TCP","68","36876 → 21002 [ACK] Seq=34065 Ack=645734 Win=5568 Len=0 TSval=1084583018 TSecr=2675294898"
"37.858926","172.18.0.2","54.38.73.16","TLSv1.2","611","Application Data"
