_ws.col.Time,_ws.col.Source,_ws.col.Destination,_ws.col.Protocol,_ws.col.Length,_ws.col.Info
"0.000000","172.19.0.3","5.9.29.183","TLSv1.2","599","Application Data"
"0.000302","5.9.29.183","172.19.0.3","TCP","56","9002 → 43520 [ACK] Seq=1 Ack=544 Win=65535 Len=0"
"0.317039","5.9.29.183","172.19.0.3","TLSv1.2","599","Application Data"
"0.317103","172.19.0.3","5.9.29.183","TCP","56","43520 → 9002 [ACK] Seq=544 Ack=544 Win=11909 Len=0"
"0.317820","172.19.0.3","5.9.29.183","TLSv1.2","2141","Application Data"
"0.318067","5.9.29.183","172.19.0.3","TCP","56","9002 → 43520 [ACK] Seq=544 Ack=2629 Win=65535 Len=0"
"0.963367","5.9.29.183","172.19.0.3","TLSv1.2","599","Application Data"
"1.004603","172.19.0.3","5.9.29.183","TCP","56","43520 → 9002 [ACK] Seq=2629 Ack=1087 Win=11911 Len=0"
"1.043234","5.9.29.183","172.19.0.3","TCP","1516","[TCP segment of a reassembled PDU]"
"1.043251","172.19.0.3","5.9.29.183","TCP","56","43520 → 9002 [ACK] Seq=2629 Ack=2547 Win=11911 Len=0"
"1.043282","5.9.29.183","172.19.0.3","TLSv1.2","167","Application Data"
"1.043292","172.19.0.3","5.9.29.183","TCP","56","43520 → 9002 [ACK] Seq=2629 Ack=2658 Win=11911 Len=0"
"1.046297","172.19.0.3","5.9.29.183","TLSv1.2","599","Application Data"
"1.046504","5.9.29.183","172.19.0.3","TCP","56","9002 → 43520 [ACK] Seq=2658 Ack=3172 Win=65535 Len=0"
"1.478394","5.9.29.183","172.19.0.3","TLSv1.2","599","Application Data"
"1.479575","172.19.0.3","5.9.29.183","TLSv1.2","599","Application Data"
"1.479928","5.9.29.183","172.19.0.3","TCP","56","9002 → 43520 [ACK] Seq=3201 Ack=3715 Win=65535 Len=0"
"1.845449","5.9.29.183","172.19.0.3","TLSv1.2","599","Application Data"
"1.879980","5.9.29.183","172.19.0.3","TCP","1317","[TCP segment of a reassembled PDU]"
"1.880009","172.19.0.3","5.9.29.183","TCP","56","43520 → 9002 [ACK] Seq=3715 Ack=5005 Win=11911 Len=0"
"1.880237","5.9.29.183","172.19.0.3","TCP","1516","9002 → 43520 [PSH, ACK] Seq=5005 Ack=3715 Win=65535 Len=1460 [TCP segment of a reassembled PDU]"
"1.880250","5.9.29.183","172.19.0.3","TCP","231","9002 → 43520 [PSH, ACK] Seq=6465 Ack=3715 Win=65535 Len=175 [TCP segment of a reassembled PDU]"
"1.880254","5.9.29.183","172.19.0.3","TLSv1.2","787","Application Data"
"1.880359","172.19.0.3","5.9.29.183","TCP","56","43520 → 9002 [ACK] Seq=3715 Ack=7371 Win=11893 Len=0"
"1.891952","5.9.29.183","172.19.0.3","TCP","1504","[TCP segment of a reassembled PDU]"
"1.892456","5.9.29.183","172.19.0.3","TCP","1504","9002 → 43520 [PSH, ACK] Seq=8819 Ack=3715 Win=65535 Len=1448 [TCP segment of a reassembled PDU]"
"1.892473","172.19.0.3","5.9.29.183","TCP","56","43520 → 9002 [ACK] Seq=3715 Ack=10267 Win=11911 Len=0"
"1.892520","5.9.29.183","172.19.0.3","TLSv1.2","1504","Application Data [TCP segment of a reassembled PDU]"
"1.892561","5.9.29.183","172.19.0.3","TCP","1504","9002 → 43520 [PSH, ACK] Seq=11715 Ack=3715 Win=65535 Len=1448 [TCP segment of a reassembled PDU]"
"1.892613","172.19.0.3","5.9.29.183","TCP","56","43520 → 9002 [ACK] Seq=3715 Ack=13163 Win=11895 Len=0"
"1.895708","5.9.29.183","172.19.0.3","TLSv1.2","1004","Application Data"
"1.910966","5.9.29.183","172.19.0.3","TLSv1.2","599","Application Data"
"1.910986","172.19.0.3","5.9.29.183","TCP","56","43520 → 9002 [ACK] Seq=3715 Ack=14654 Win=11911 Len=0"
"1.926295","5.9.29.183","172.19.0.3","TLSv1.2","1113","Application Data"
"1.932293","5.9.29.183","172.19.0.3","TCP","1504","[TCP segment of a reassembled PDU]"
"1.932319","172.19.0.3","5.9.29.183","TCP","56","43520 → 9002 [ACK] Seq=3715 Ack=17159 Win=11911 Len=0"
"1.932654","5.9.29.183","172.19.0.3","TCP","1516","9002 → 43520 [PSH, ACK] Seq=17159 Ack=3715 Win=65535 Len=1460 [TCP segment of a reassembled PDU]"
"1.932672","5.9.29.183","172.19.0.3","TLSv1.2","1516","Application Data [TCP segment of a reassembled PDU]"
"1.932710","5.9.29.183","172.19.0.3","TCP","1516","9002 → 43520 [PSH, ACK] Seq=20079 Ack=3715 Win=65535 Len=1460 [TCP segment of a reassembled PDU]"
"1.932720","5.9.29.183","172.19.0.3","TCP","1516","9002 → 43520 [PSH, ACK] Seq=21539 Ack=3715 Win=65535 Len=1460 [TCP segment of a reassembled PDU]"
"1.932739","5.9.29.183","172.19.0.3","TLSv1.2","1456","Application Data [TCP segment of a reassembled PDU]"
"1.932739","172.19.0.3","5.9.29.183","TCP","56","43520 → 9002 [ACK] Seq=3715 Ack=21539 Win=11893 Len=0"
"1.932939","172.19.0.3","5.9.29.183","TCP","56","43520 → 9002 [ACK] Seq=3715 Ack=24399 Win=11877 Len=0"
"1.941676","5.9.29.183","172.19.0.3","TLSv1.2","1221","Application Data"
"1.948930","5.9.29.183","172.19.0.3","TCP","1504","[TCP segment of a reassembled PDU]"
"1.948955","172.19.0.3","5.9.29.183","TCP","56","43520 → 9002 [ACK] Seq=3715 Ack=27012 Win=11911 Len=0"
"1.949126","5.9.29.183","172.19.0.3","TCP","1516","9002 → 43520 [PSH, ACK] Seq=27012 Ack=3715 Win=65535 Len=1460 [TCP segment of a reassembled PDU]"
"1.949371","5.9.29.183","172.19.0.3","TLSv1.2","1516","Application Data [TCP segment of a reassembled PDU]"
"1.949384","172.19.0.3","5.9.29.183","TCP","56","43520 → 9002 [ACK] Seq=3715 Ack=29932 Win=11911 Len=0"
"1.949429","5.9.29.183","172.19.0.3","TCP","1480","9002 → 43520 [PSH, ACK] Seq=29932 Ack=3715 Win=65535 Len=1424 [TCP segment of a reassembled PDU]"
"1.949438","5.9.29.183","172.19.0.3","TCP","1516","9002 → 43520 [PSH, ACK] Seq=31356 Ack=3715 Win=65535 Len=1460 [TCP segment of a reassembled PDU]"
"1.949494","5.9.29.183","172.19.0.3","TLSv1.2","1492","Application Data [TCP segment of a reassembled PDU]"
"1.949526","172.19.0.3","5.9.29.183","TCP","56","43520 → 9002 [ACK] Seq=3715 Ack=34252 Win=11887 Len=0"
"1.949774","172.19.0.3","5.9.29.183","TLSv1.2","599","Application Data"
"1.950027","5.9.29.183","172.19.0.3","TCP","56","9002 → 43520 [ACK] Seq=34252 Ack=4258 Win=65535 Len=0"
"1.956963","5.9.29.183","172.19.0.3","TLSv1.2","1221","Application Data"
"1.967563","5.9.29.183","172.19.0.3","TCP","1516","[TCP segment of a reassembled PDU]"
"1.967585","172.19.0.3","5.9.29.183","TCP","56","43520 → 9002 [ACK] Seq=4258 Ack=36877 Win=11911 Len=0"
"1.967667","5.9.29.183","172.19.0.3","TCP","1516","9002 → 43520 [PSH, ACK] Seq=36877 Ack=4258 Win=65535 Len=1460 [TCP segment of a reassembled PDU]"
"1.967712","5.9.29.183","172.19.0.3","TLSv1.2","1516","Application Data [TCP segment of a reassembled PDU]"
"1.967720","5.9.29.183","172.19.0.3","TCP","1516","9002 → 43520 [PSH, ACK] Seq=39797 Ack=4258 Win=65535 Len=1460 [TCP segment of a reassembled PDU]"
"1.967723","5.9.29.183","172.19.0.3","TCP","1456","9002 → 43520 [PSH, ACK] Seq=41257 Ack=4258 Win=65535 Len=1400 [TCP segment of a reassembled PDU]"
"1.967817","172.19.0.3","5.9.29.183","TCP","56","43520 → 9002 [ACK] Seq=4258 Ack=42657 Win=11879 Len=0"
"1.967822","5.9.29.183","172.19.0.3","TLSv1.2","1516","Application Data [TCP segment of a reassembled PDU]"
"1.967830","5.9.29.183","172.19.0.3","TCP","1516","9002 → 43520 [PSH, ACK] Seq=44117 Ack=4258 Win=65535 Len=1460 [TCP segment of a reassembled PDU]"
"1.967833","5.9.29.183","172.19.0.3","TCP","1480","9002 → 43520 [PSH, ACK] Seq=45577 Ack=4258 Win=65535 Len=1424 [TCP segment of a reassembled PDU]"
"1.967889","172.19.0.3","5.9.29.183","TCP","56","43520 → 9002 [ACK] Seq=4258 Ack=47001 Win=11853 Len=0"
"1.972544","5.9.29.183","172.19.0.3","TLSv1.2","924","Application Data, Application Data"
"1.972945","172.19.0.3","5.9.29.183","TLSv1.2","599","Application Data"
"1.973225","5.9.29.183","172.19.0.3","TCP","56","9002 → 43520 [ACK] Seq=47869 Ack=4801 Win=65535 Len=0"
"1.986065","5.9.29.183","172.19.0.3","TCP","1516","[TCP segment of a reassembled PDU]"
"1.986116","5.9.29.183","172.19.0.3","TCP","1516","9002 → 43520 [PSH, ACK] Seq=49329 Ack=4801 Win=65535 Len=1460 [TCP segment of a reassembled PDU]"
"1.986123","5.9.29.183","172.19.0.3","TLSv1.2","1480","Application Data [TCP segment of a reassembled PDU]"
"1.986365","172.19.0.3","5.9.29.183","TCP","56","43520 → 9002 [ACK] Seq=4801 Ack=52213 Win=11895 Len=0"
"1.986509","5.9.29.183","172.19.0.3","TCP","1516","9002 → 43520 [PSH, ACK] Seq=52213 Ack=4801 Win=65535 Len=1460 [TCP segment of a reassembled PDU]"
"1.986517","5.9.29.183","172.19.0.3","TCP","1516","9002 → 43520 [PSH, ACK] Seq=53673 Ack=4801 Win=65535 Len=1460 [TCP segment of a reassembled PDU]"
"1.986520","5.9.29.183","172.19.0.3","TLSv1.2","1480","Application Data [TCP segment of a reassembled PDU]"
"1.986612","172.19.0.3","5.9.29.183","TCP","56","43520 → 9002 [ACK] Seq=4801 Ack=56557 Win=11871 Len=0"
"1.986892","172.19.0.3","5.9.29.183","TLSv1.2","599","Application Data"
"1.987078","5.9.29.183","172.19.0.3","TCP","56","9002 → 43520 [ACK] Seq=56557 Ack=5344 Win=65535 Len=0"
"1.987945","5.9.29.183","172.19.0.3","TLSv1.2","193","Application Data"
"2.004946","5.9.29.183","172.19.0.3","TCP","1516","[TCP segment of a reassembled PDU]"
"2.004964","172.19.0.3","5.9.29.183","TCP","56","43520 → 9002 [ACK] Seq=5344 Ack=58154 Win=11911 Len=0"
"2.004998","5.9.29.183","172.19.0.3","TCP","1492","9002 → 43520 [PSH, ACK] Seq=58154 Ack=5344 Win=65535 Len=1436 [TCP segment of a reassembled PDU]"
"2.005029","5.9.29.183","172.19.0.3","TLSv1.2","1516","Application Data [TCP segment of a reassembled PDU]"
"2.005035","5.9.29.183","172.19.0.3","TCP","1225","9002 → 43520 [PSH, ACK] Seq=61050 Ack=5344 Win=65535 Len=1169 [TCP segment of a reassembled PDU]"
"2.005039","5.9.29.183","172.19.0.3","TCP","1516","9002 → 43520 [PSH, ACK] Seq=62219 Ack=5344 Win=65535 Len=1460 [TCP segment of a reassembled PDU]"
"2.005043","5.9.29.183","172.19.0.3","TLSv1.2","1516","Application Data [TCP segment of a reassembled PDU]"
"2.005046","5.9.29.183","172.19.0.3","TCP","1480","9002 → 43520 [PSH, ACK] Seq=65139 Ack=5344 Win=65535 Len=1424 [TCP segment of a reassembled PDU]"
"2.005051","5.9.29.183","172.19.0.3","TCP","1516","9002 → 43520 [PSH, ACK] Seq=66563 Ack=5344 Win=65535 Len=1460 [TCP segment of a reassembled PDU]"
"2.005098","5.9.29.183","172.19.0.3","TLSv1.2","1492","Application Data [TCP segment of a reassembled PDU]"
"2.005122","172.19.0.3","5.9.29.183","TCP","56","43520 → 9002 [ACK] Seq=5344 Ack=69459 Win=11847 Len=0"
"2.020489","5.9.29.183","172.19.0.3","TCP","1138","9002 → 43520 [PSH, ACK] Seq=69459 Ack=5344 Win=65535 Len=1082 [TCP segment of a reassembled PDU]"
"2.020559","5.9.29.183","172.19.0.3","TLSv1.2","203","Application Data"
"2.020711","172.19.0.3","5.9.29.183","TCP","56","43520 → 9002 [ACK] Seq=5344 Ack=70688 Win=11911 Len=0"
"2.025173","5.9.29.183","172.19.0.3","TCP","1516","[TCP segment of a reassembled PDU]"
"2.025225","5.9.29.183","172.19.0.3","TCP","1516","9002 → 43520 [PSH, ACK] Seq=72148 Ack=5344 Win=65535 Len=1460 [TCP segment of a reassembled PDU]"
"2.025230","5.9.29.183","172.19.0.3","TLSv1.2","1516","Application Data [TCP segment of a reassembled PDU]"
"2.025233","5.9.29.183","172.19.0.3","TCP","1516","9002 → 43520 [PSH, ACK] Seq=75068 Ack=5344 Win=65535 Len=1460 [TCP segment of a reassembled PDU]"
"2.025235","5.9.29.183","172.19.0.3","TCP","1516","9002 → 43520 [PSH, ACK] Seq=76528 Ack=5344 Win=65535 Len=1460 [TCP segment of a reassembled PDU]"
"2.025237","5.9.29.183","172.19.0.3","TLSv1.2","1444","Application Data [TCP segment of a reassembled PDU]"
"2.025342","172.19.0.3","5.9.29.183","TCP","56","43520 → 9002 [ACK] Seq=5344 Ack=79376 Win=11871 Len=0"
"2.035454","5.9.29.183","172.19.0.3","TLSv1.2","1221","Application Data"
"2.051302","5.9.29.183","172.19.0.3","TCP","1516","[TCP segment of a reassembled PDU]"
"2.051325","172.19.0.3","5.9.29.183","TCP","56","43520 → 9002 [ACK] Seq=5344 Ack=82001 Win=11911 Len=0"
"2.051389","5.9.29.183","172.19.0.3","TCP","1492","9002 → 43520 [PSH, ACK] Seq=82001 Ack=5344 Win=65535 Len=1436 [TCP segment of a reassembled PDU]"
"2.051403","5.9.29.183","172.19.0.3","TLSv1.2","787","Application Data"
"2.051552","172.19.0.3","5.9.29.183","TCP","56","43520 → 9002 [ACK] Seq=5344 Ack=84168 Win=11895 Len=0"
"2.051815","172.19.0.3","5.9.29.183","TLSv1.2","599","Application Data"
"2.052125","5.9.29.183","172.19.0.3","TCP","56","9002 → 43520 [ACK] Seq=84168 Ack=5887 Win=65535 Len=0"
"2.067174","172.19.0.3","5.9.29.183","TLSv1.2","599","Application Data"
"2.067473","5.9.29.183","172.19.0.3","TCP","56","9002 → 43520 [ACK] Seq=84168 Ack=6430 Win=65535 Len=0"
"2.071126","5.9.29.183","172.19.0.3","TLSv1.2","599","Application Data"
"2.076999","172.19.0.3","5.9.29.183","TLSv1.2","599","Application Data"
"2.077312","5.9.29.183","172.19.0.3","TCP","56","9002 → 43520 [ACK] Seq=84711 Ack=6973 Win=65535 Len=0"
"2.542060","5.9.29.183","172.19.0.3","TLSv1.2","599","Application Data"
"2.543008","172.19.0.3","5.9.29.183","TLSv1.2","599","Application Data"
"2.543203","5.9.29.183","172.19.0.3","TCP","56","9002 → 43520 [ACK] Seq=85254 Ack=7516 Win=65535 Len=0"
"2.884281","5.9.29.183","172.19.0.3","TCP","1516","[TCP segment of a reassembled PDU]"
"2.884335","5.9.29.183","172.19.0.3","TCP","1492","9002 → 43520 [PSH, ACK] Seq=86714 Ack=7516 Win=65535 Len=1436 [TCP segment of a reassembled PDU]"
"2.884528","172.19.0.3","5.9.29.183","TCP","56","43520 → 9002 [ACK] Seq=7516 Ack=88150 Win=11903 Len=0"
"2.886470","5.9.29.183","172.19.0.3","TLSv1.2","273","Application Data"
"2.896962","5.9.29.183","172.19.0.3","TCP","1504","[TCP segment of a reassembled PDU]"
"2.896978","172.19.0.3","5.9.29.183","TCP","56","43520 → 9002 [ACK] Seq=7516 Ack=89815 Win=11911 Len=0"
"2.897010","5.9.29.183","172.19.0.3","TCP","1504","9002 → 43520 [PSH, ACK] Seq=89815 Ack=7516 Win=65535 Len=1448 [TCP segment of a reassembled PDU]"
"2.901599","5.9.29.183","172.19.0.3","TLSv1.2","1330","Application Data, Application Data"
"2.901618","172.19.0.3","5.9.29.183","TCP","56","43520 → 9002 [ACK] Seq=7516 Ack=92537 Win=11911 Len=0"
"2.909186","5.9.29.183","172.19.0.3","TCP","1516","[TCP segment of a reassembled PDU]"
"2.909253","5.9.29.183","172.19.0.3","TCP","1492","9002 → 43520 [PSH, ACK] Seq=93997 Ack=7516 Win=65535 Len=1436 [TCP segment of a reassembled PDU]"
"2.909262","5.9.29.183","172.19.0.3","TLSv1.2","1504","Application Data [TCP segment of a reassembled PDU]"
"2.909322","172.19.0.3","5.9.29.183","TCP","56","43520 → 9002 [ACK] Seq=7516 Ack=96881 Win=11895 Len=0"
"2.916565","5.9.29.183","172.19.0.3","TLSv1.2","396","Application Data"
"2.916741","172.19.0.3","5.9.29.183","TLSv1.2","599","Application Data"
"2.916898","5.9.29.183","172.19.0.3","TCP","56","9002 → 43520 [ACK] Seq=97221 Ack=8059 Win=65535 Len=0"
"2.927641","5.9.29.183","172.19.0.3","TCP","1516","[TCP segment of a reassembled PDU]"
"2.927685","5.9.29.183","172.19.0.3","TCP","1492","9002 → 43520 [PSH, ACK] Seq=98681 Ack=8059 Win=65535 Len=1436 [TCP segment of a reassembled PDU]"
"2.927690","5.9.29.183","172.19.0.3","TLSv1.2","1516","Application Data [TCP segment of a reassembled PDU]"
"2.927693","5.9.29.183","172.19.0.3","TCP","1492","9002 → 43520 [PSH, ACK] Seq=101577 Ack=8059 Win=65535 Len=1436 [TCP segment of a reassembled PDU]"
"2.927807","172.19.0.3","5.9.29.183","TCP","56","43520 → 9002 [ACK] Seq=8059 Ack=103013 Win=11887 Len=0"
"2.933216","5.9.29.183","172.19.0.3","TLSv1.2","490","Application Data"
"2.943133","5.9.29.183","172.19.0.3","TCP","1504","[TCP segment of a reassembled PDU]"
"2.943146","172.19.0.3","5.9.29.183","TCP","56","43520 → 9002 [ACK] Seq=8059 Ack=104895 Win=11911 Len=0"
"2.944923","5.9.29.183","172.19.0.3","TCP","1516","9002 → 43520 [PSH, ACK] Seq=104895 Ack=8059 Win=65535 Len=1460 [TCP segment of a reassembled PDU]"
"2.944972","5.9.29.183","172.19.0.3","TLSv1.2","1516","Application Data [TCP segment of a reassembled PDU]"
"2.944978","5.9.29.183","172.19.0.3","TCP","1516","9002 → 43520 [PSH, ACK] Seq=107815 Ack=8059 Win=65535 Len=1460 [TCP segment of a reassembled PDU]"
"2.944980","5.9.29.183","172.19.0.3","TCP","1468","9002 → 43520 [PSH, ACK] Seq=109275 Ack=8059 Win=65535 Len=1412 [TCP segment of a reassembled PDU]"
"2.945109","172.19.0.3","5.9.29.183","TCP","56","43520 → 9002 [ACK] Seq=8059 Ack=110687 Win=11887 Len=0"
"2.950391","5.9.29.183","172.19.0.3","TLSv1.2","1127","Application Data, Application Data"
"2.950974","172.19.0.3","5.9.29.183","TLSv1.2","599","Application Data"
"2.951407","5.9.29.183","172.19.0.3","TCP","56","9002 → 43520 [ACK] Seq=111758 Ack=8602 Win=65535 Len=0"
"2.968613","5.9.29.183","172.19.0.3","TCP","1504","[TCP segment of a reassembled PDU]"
"2.968669","5.9.29.183","172.19.0.3","TLSv1.2","693","Application Data"
"2.968823","172.19.0.3","5.9.29.183","TCP","56","43520 → 9002 [ACK] Seq=8602 Ack=113843 Win=11903 Len=0"
"2.985277","5.9.29.183","172.19.0.3","TCP","1516","[TCP segment of a reassembled PDU]"
"2.985333","5.9.29.183","172.19.0.3","TCP","1492","9002 → 43520 [PSH, ACK] Seq=115303 Ack=8602 Win=65535 Len=1436 [TCP segment of a reassembled PDU]"
"2.985347","172.19.0.3","5.9.29.183","TCP","56","43520 → 9002 [ACK] Seq=8602 Ack=116739 Win=11903 Len=0"
"2.986017","5.9.29.183","172.19.0.3","TLSv1.2","787","Application Data"
"3.026448","172.19.0.3","5.9.29.183","TCP","56","43520 → 9002 [ACK] Seq=8602 Ack=117470 Win=11911 Len=0"
"3.041877","5.9.29.183","172.19.0.3","TCP","1516","[TCP segment of a reassembled PDU]"
"3.041893","172.19.0.3","5.9.29.183","TCP","56","43520 → 9002 [ACK] Seq=8602 Ack=118930 Win=11911 Len=0"
"3.041925","5.9.29.183","172.19.0.3","TLSv1.2","1195","Application Data"
"3.041936","172.19.0.3","5.9.29.183","TCP","56","43520 → 9002 [ACK] Seq=8602 Ack=120069 Win=11903 Len=0"
"3.045366","172.19.0.3","5.9.29.183","TLSv1.2","599","Application Data"
"3.045556","5.9.29.183","172.19.0.3","TCP","56","9002 → 43520 [ACK] Seq=120069 Ack=9145 Win=65535 Len=0"
"3.445503","5.9.29.183","172.19.0.3","TLSv1.2","599","Application Data"
"3.446471","172.19.0.3","5.9.29.183","TLSv1.2","599","Application Data"
"3.446810","5.9.29.183","172.19.0.3","TCP","56","9002 → 43520 [ACK] Seq=120612 Ack=9688 Win=65535 Len=0"
"3.773954","5.9.29.183","172.19.0.3","TCP","1516","[TCP segment of a reassembled PDU]"
"3.774060","5.9.29.183","172.19.0.3","TCP","1492","9002 → 43520 [PSH, ACK] Seq=122072 Ack=9688 Win=65535 Len=1436 [TCP segment of a reassembled PDU]"
"3.774333","172.19.0.3","5.9.29.183","TCP","56","43520 → 9002 [ACK] Seq=9688 Ack=123508 Win=11901 Len=0"
"3.775362","5.9.29.183","172.19.0.3","TLSv1.2","273","Application Data"
"3.816677","172.19.0.3","5.9.29.183","TCP","56","43520 → 9002 [ACK] Seq=9688 Ack=123725 Win=11911 Len=0"
"3.816912","5.9.29.183","172.19.0.3","TLSv1.2","599","Application Data"
"3.816927","172.19.0.3","5.9.29.183","TCP","56","43520 → 9002 [ACK] Seq=9688 Ack=124268 Win=11911 Len=0"
"3.831620","5.9.29.183","172.19.0.3","TCP","1516","[TCP segment of a reassembled PDU]"
"3.831642","172.19.0.3","5.9.29.183","TCP","56","43520 → 9002 [ACK] Seq=9688 Ack=125728 Win=11911 Len=0"
"3.831697","5.9.29.183","172.19.0.3","TCP","1516","9002 → 43520 [PSH, ACK] Seq=125728 Ack=9688 Win=65535 Len=1460 [TCP segment of a reassembled PDU]"
"3.831714","172.19.0.3","5.9.29.183","TCP","56","43520 → 9002 [ACK] Seq=9688 Ack=127188 Win=11903 Len=0"
"3.831716","5.9.29.183","172.19.0.3","TLSv1.2","1516","Application Data [TCP segment of a reassembled PDU]"
"3.831721","172.19.0.3","5.9.29.183","TCP","56","43520 → 9002 [ACK] Seq=9688 Ack=128648 Win=11895 Len=0"
"3.831723","5.9.29.183","172.19.0.3","TCP","1468","9002 → 43520 [PSH, ACK] Seq=128648 Ack=9688 Win=65535 Len=1412 [TCP segment of a reassembled PDU]"
"3.831730","172.19.0.3","5.9.29.183","TCP","56","43520 → 9002 [ACK] Seq=9688 Ack=130060 Win=11887 Len=0"
"3.831818","5.9.29.183","172.19.0.3","TCP","1504","9002 → 43520 [PSH, ACK] Seq=130060 Ack=9688 Win=65535 Len=1448 [TCP segment of a reassembled PDU]"
"3.831827","172.19.0.3","5.9.29.183","TCP","56","43520 → 9002 [ACK] Seq=9688 Ack=131508 Win=11879 Len=0"
"3.832136","5.9.29.183","172.19.0.3","TLSv1.2","70","Application Data"
"3.832147","172.19.0.3","5.9.29.183","TCP","56","43520 → 9002 [ACK] Seq=9688 Ack=131522 Win=11911 Len=0"
"3.849127","5.9.29.183","172.19.0.3","TCP","1504","[TCP segment of a reassembled PDU]"
"3.849183","172.19.0.3","5.9.29.183","TCP","56","43520 → 9002 [ACK] Seq=9688 Ack=132970 Win=11911 Len=0"
"3.849230","5.9.29.183","172.19.0.3","TCP","1516","9002 → 43520 [PSH, ACK] Seq=132970 Ack=9688 Win=65535 Len=1460 [TCP segment of a reassembled PDU]"
"3.849242","172.19.0.3","5.9.29.183","TCP","56","43520 → 9002 [ACK] Seq=9688 Ack=134430 Win=11903 Len=0"
"3.849354","5.9.29.183","172.19.0.3","TLSv1.2","1516","Application Data [TCP segment of a reassembled PDU]"
"3.849366","172.19.0.3","5.9.29.183","TCP","56","43520 → 9002 [ACK] Seq=9688 Ack=135890 Win=11911 Len=0"
"3.849370","5.9.29.183","172.19.0.3","TCP","243","9002 → 43520 [PSH, ACK] Seq=135890 Ack=9688 Win=65535 Len=187 [TCP segment of a reassembled PDU]"
"3.849377","172.19.0.3","5.9.29.183","TCP","56","43520 → 9002 [ACK] Seq=9688 Ack=136077 Win=11910 Len=0"
"3.849378","5.9.29.183","172.19.0.3","TCP","1516","9002 → 43520 [PSH, ACK] Seq=136077 Ack=9688 Win=65535 Len=1460 [TCP segment of a reassembled PDU]"
"3.849383","172.19.0.3","5.9.29.183","TCP","56","43520 → 9002 [ACK] Seq=9688 Ack=137537 Win=11899 Len=0"
"3.849515","5.9.29.183","172.19.0.3","TCP","1516","9002 → 43520 [PSH, ACK] Seq=137537 Ack=9688 Win=65535 Len=1460 [TCP segment of a reassembled PDU]"
"3.849552","172.19.0.3","5.9.29.183","TCP","56","43520 → 9002 [ACK] Seq=9688 Ack=138997 Win=11888 Len=0"
"3.849557","5.9.29.183","172.19.0.3","TLSv1.2","1516","Application Data [TCP segment of a reassembled PDU]"
"3.849563","5.9.29.183","172.19.0.3","TCP","1516","9002 → 43520 [PSH, ACK] Seq=140457 Ack=9688 Win=65535 Len=1460 [TCP segment of a reassembled PDU]"
"3.849578","172.19.0.3","5.9.29.183","TCP","56","43520 → 9002 [ACK] Seq=9688 Ack=140457 Win=11911 Len=0"
"3.849612","5.9.29.183","172.19.0.3","TCP","978","9002 → 43520 [PSH, ACK] Seq=141917 Ack=9688 Win=65535 Len=922 [TCP segment of a reassembled PDU]"
"3.849644","172.19.0.3","5.9.29.183","TCP","56","43520 → 9002 [ACK] Seq=9688 Ack=142839 Win=11895 Len=0"
"3.866345","5.9.29.183","172.19.0.3","TLSv1.2","1191","Application Data, Application Data"
"3.866734","172.19.0.3","5.9.29.183","TCP","56","43520 → 9002 [ACK] Seq=9688 Ack=143974 Win=11911 Len=0"
"3.869191","5.9.29.183","172.19.0.3","TCP","1516","[TCP segment of a reassembled PDU]"
"3.869427","5.9.29.183","172.19.0.3","TCP","1516","9002 → 43520 [PSH, ACK] Seq=145434 Ack=9688 Win=65535 Len=1460 [TCP segment of a reassembled PDU]"
"3.869434","5.9.29.183","172.19.0.3","TLSv1.2","1516","Application Data [TCP segment of a reassembled PDU]"
"3.869437","5.9.29.183","172.19.0.3","TCP","1516","9002 → 43520 [PSH, ACK] Seq=148354 Ack=9688 Win=65535 Len=1460 [TCP segment of a reassembled PDU]"
"3.869440","5.9.29.183","172.19.0.3","TCP","1516","9002 → 43520 [PSH, ACK] Seq=149814 Ack=9688 Win=65535 Len=1460 [TCP segment of a reassembled PDU]"
"3.869450","5.9.29.183","172.19.0.3","TLSv1.2","1516","Application Data [TCP segment of a reassembled PDU]"
"3.869463","172.19.0.3","5.9.29.183","TCP","56","43520 → 9002 [ACK] Seq=9688 Ack=151274 Win=11885 Len=0"
"3.869508","5.9.29.183","172.19.0.3","TCP","1432","9002 → 43520 [PSH, ACK] Seq=152734 Ack=9688 Win=65535 Len=1376 [TCP segment of a reassembled PDU]"
"3.869604","5.9.29.183","172.19.0.3","TCP","1516","9002 → 43520 [PSH, ACK] Seq=154110 Ack=9688 Win=65535 Len=1460 [TCP segment of a reassembled PDU]"
"3.869609","5.9.29.183","172.19.0.3","TLSv1.2","1492","Application Data [TCP segment of a reassembled PDU]"
"3.869712","172.19.0.3","5.9.29.183","TLSv1.2","599","Application Data"
"3.869919","5.9.29.183","172.19.0.3","TCP","56","9002 → 43520 [ACK] Seq=157006 Ack=10231 Win=65535 Len=0"
"3.881685","172.19.0.3","5.9.29.183","TLSv1.2","599","Application Data"
"3.881810","5.9.29.183","172.19.0.3","TCP","1516","9002 → 43520 [PSH, ACK] Seq=157006 Ack=10231 Win=65535 Len=1460 [TCP segment of a reassembled PDU]"
"3.881854","5.9.29.183","172.19.0.3","TCP","1516","9002 → 43520 [PSH, ACK] Seq=158466 Ack=10231 Win=65535 Len=1460 [TCP segment of a reassembled PDU]"
"3.881865","5.9.29.183","172.19.0.3","TLSv1.2","154","Application Data"
"3.881947","172.19.0.3","5.9.29.183","TCP","56","43520 → 9002 [ACK] Seq=10774 Ack=160024 Win=11911 Len=0"
"3.882073","5.9.29.183","172.19.0.3","TCP","56","9002 → 43520 [ACK] Seq=160024 Ack=10774 Win=65535 Len=0"
"3.890283","5.9.29.183","172.19.0.3","TCP","1516","[TCP segment of a reassembled PDU]"
"3.890347","5.9.29.183","172.19.0.3","TCP","1516","9002 → 43520 [PSH, ACK] Seq=161484 Ack=10774 Win=65535 Len=1460 [TCP segment of a reassembled PDU]"
"3.890356","5.9.29.183","172.19.0.3","TLSv1.2","1516","Application Data [TCP segment of a reassembled PDU]"
"3.890360","5.9.29.183","172.19.0.3","TCP","1516","9002 → 43520 [PSH, ACK] Seq=164404 Ack=10774 Win=65535 Len=1460 [TCP segment of a reassembled PDU]"
"3.890363","5.9.29.183","172.19.0.3","TCP","1516","9002 → 43520 [PSH, ACK] Seq=165864 Ack=10774 Win=65535 Len=1460 [TCP segment of a reassembled PDU]"
"3.890367","5.9.29.183","172.19.0.3","TLSv1.2","1516","Application Data [TCP segment of a reassembled PDU]"
"3.890370","5.9.29.183","172.19.0.3","TCP","1432","9002 → 43520 [PSH, ACK] Seq=168784 Ack=10774 Win=65535 Len=1376 [TCP segment of a reassembled PDU]"
"3.890373","5.9.29.183","172.19.0.3","TCP","1504","9002 → 43520 [PSH, ACK] Seq=170160 Ack=10774 Win=65535 Len=1448 [TCP segment of a reassembled PDU]"
"3.890503","172.19.0.3","5.9.29.183","TCP","56","43520 → 9002 [ACK] Seq=10774 Ack=171608 Win=11855 Len=0"
"3.897269","5.9.29.183","172.19.0.3","TLSv1.2","381","Application Data"
"3.908441","5.9.29.183","172.19.0.3","TCP","1516","[TCP segment of a reassembled PDU]"
"3.908496","172.19.0.3","5.9.29.183","TCP","56","43520 → 9002 [ACK] Seq=10774 Ack=173393 Win=11911 Len=0"
"3.908545","5.9.29.183","172.19.0.3","TCP","1516","9002 → 43520 [PSH, ACK] Seq=173393 Ack=10774 Win=65535 Len=1460 [TCP segment of a reassembled PDU]"
"3.908557","5.9.29.183","172.19.0.3","TLSv1.2","1480","Application Data [TCP segment of a reassembled PDU]"
"3.908681","5.9.29.183","172.19.0.3","TCP","1516","9002 → 43520 [PSH, ACK] Seq=176277 Ack=10774 Win=65535 Len=1460 [TCP segment of a reassembled PDU]"
"3.908688","5.9.29.183","172.19.0.3","TCP","1516","9002 → 43520 [PSH, ACK] Seq=177737 Ack=10774 Win=65535 Len=1460 [TCP segment of a reassembled PDU]"
"3.908691","5.9.29.183","172.19.0.3","TLSv1.2","1516","Application Data [TCP segment of a reassembled PDU]"
"3.908693","5.9.29.183","172.19.0.3","TCP","1516","9002 → 43520 [PSH, ACK] Seq=180657 Ack=10774 Win=65535 Len=1460 [TCP segment of a reassembled PDU]"
"3.908695","5.9.29.183","172.19.0.3","TCP","1516","9002 → 43520 [PSH, ACK] Seq=182117 Ack=10774 Win=65535 Len=1460 [TCP segment of a reassembled PDU]"
"3.908697","5.9.29.183","172.19.0.3","TLSv1.2","1444","Application Data [TCP segment of a reassembled PDU]"
"3.908720","172.19.0.3","5.9.29.183","TCP","56","43520 → 9002 [ACK] Seq=10774 Ack=177737 Win=11887 Len=0"
"3.908813","5.9.29.183","172.19.0.3","TCP","1516","9002 → 43520 [PSH, ACK] Seq=184965 Ack=10774 Win=65535 Len=1460 [TCP segment of a reassembled PDU]"
"3.908813","172.19.0.3","5.9.29.183","TCP","56","43520 → 9002 [ACK] Seq=10774 Ack=184965 Win=11847 Len=0"
"3.908817","5.9.29.183","172.19.0.3","TCP","1492","9002 → 43520 [PSH, ACK] Seq=186425 Ack=10774 Win=65535 Len=1436 [TCP segment of a reassembled PDU]"
"3.909067","172.19.0.3","5.9.29.183","TLSv1.2","599","Application Data"
"3.909288","5.9.29.183","172.19.0.3","TCP","56","9002 → 43520 [ACK] Seq=187861 Ack=11317 Win=65535 Len=0"
"3.913171","5.9.29.183","172.19.0.3","TLSv1.2","721","Application Data, Application Data"
"3.925170","5.9.29.183","172.19.0.3","TCP","1516","[TCP segment of a reassembled PDU]"
"3.925181","172.19.0.3","5.9.29.183","TCP","56","43520 → 9002 [ACK] Seq=11317 Ack=189986 Win=11911 Len=0"
"3.925249","5.9.29.183","172.19.0.3","TCP","1492","9002 → 43520 [PSH, ACK] Seq=189986 Ack=11317 Win=65535 Len=1436 [TCP segment of a reassembled PDU]"
"3.925571","5.9.29.183","172.19.0.3","TLSv1.2","1516","Application Data [TCP segment of a reassembled PDU]"
"3.925578","172.19.0.3","5.9.29.183","TCP","56","43520 → 9002 [ACK] Seq=11317 Ack=192882 Win=11911 Len=0"
"3.925581","5.9.29.183","172.19.0.3","TCP","1492","9002 → 43520 [PSH, ACK] Seq=192882 Ack=11317 Win=65535 Len=1436 [TCP segment of a reassembled PDU]"
"3.930059","5.9.29.183","172.19.0.3","TLSv1.2","490","Application Data"
"3.930079","172.19.0.3","5.9.29.183","TCP","56","43520 → 9002 [ACK] Seq=11317 Ack=194752 Win=11911 Len=0"
"3.947734","5.9.29.183","172.19.0.3","TCP","1504","[TCP segment of a reassembled PDU]"
"3.947783","5.9.29.183","172.19.0.3","TCP","1516","9002 → 43520 [PSH, ACK] Seq=196200 Ack=11317 Win=65535 Len=1460 [TCP segment of a reassembled PDU]"
"3.947789","5.9.29.183","172.19.0.3","TLSv1.2","1225","Application Data"
"3.947907","172.19.0.3","5.9.29.183","TCP","56","43520 → 9002 [ACK] Seq=11317 Ack=198829 Win=11893 Len=0"
"3.948134","172.19.0.3","5.9.29.183","TLSv1.2","599","Application Data"
"3.948336","5.9.29.183","172.19.0.3","TCP","56","9002 → 43520 [ACK] Seq=198829 Ack=11860 Win=65535 Len=0"
"3.963662","5.9.29.183","172.19.0.3","TLSv1.2","149","Application Data"
"3.982316","5.9.29.183","172.19.0.3","TCP","1516","[TCP segment of a reassembled PDU]"
"3.982340","172.19.0.3","5.9.29.183","TCP","56","43520 → 9002 [ACK] Seq=11860 Ack=200382 Win=11911 Len=0"
"3.982412","5.9.29.183","172.19.0.3","TLSv1.2","167","Application Data"
"3.987987","172.19.0.3","5.9.29.183","TLSv1.2","599","Application Data"
"3.988276","5.9.29.183","172.19.0.3","TCP","56","9002 → 43520 [ACK] Seq=200493 Ack=12403 Win=65535 Len=0"
"4.361529","5.9.29.183","172.19.0.3","TLSv1.2","599","Application Data"
"4.362460","172.19.0.3","5.9.29.183","TLSv1.2","599","Application Data"
"4.362742","5.9.29.183","172.19.0.3","TCP","56","9002 → 43520 [ACK] Seq=201036 Ack=12946 Win=65535 Len=0"
"4.766154","5.9.29.183","172.19.0.3","TCP","633","[TCP segment of a reassembled PDU]"
"4.766257","5.9.29.183","172.19.0.3","TCP","1516","9002 → 43520 [PSH, ACK] Seq=201613 Ack=12946 Win=65535 Len=1460 [TCP segment of a reassembled PDU]"
"4.766271","5.9.29.183","172.19.0.3","TCP","1516","9002 → 43520 [PSH, ACK] Seq=203073 Ack=12946 Win=65535 Len=1460 [TCP segment of a reassembled PDU]"
"4.766276","5.9.29.183","172.19.0.3","TLSv1.2","186","Application Data"
"4.766409","172.19.0.3","5.9.29.183","TCP","56","43520 → 9002 [ACK] Seq=12946 Ack=204663 Win=11887 Len=0"
"4.766704","172.19.0.3","5.9.29.183","TLSv1.2","599","Application Data"
"4.767141","5.9.29.183","172.19.0.3","TCP","56","9002 → 43520 [ACK] Seq=204663 Ack=13489 Win=65535 Len=0"
"4.817706","5.9.29.183","172.19.0.3","TCP","1516","[TCP segment of a reassembled PDU]"
"4.817780","5.9.29.183","172.19.0.3","TCP","1492","9002 → 43520 [PSH, ACK] Seq=206123 Ack=13489 Win=65535 Len=1436 [TCP segment of a reassembled PDU]"
"4.817811","5.9.29.183","172.19.0.3","TLSv1.2","1516","Application Data [TCP segment of a reassembled PDU]"
"4.817966","5.9.29.183","172.19.0.3","TCP","1516","9002 → 43520 [PSH, ACK] Seq=209019 Ack=13489 Win=65535 Len=1460 [TCP segment of a reassembled PDU]"
"4.817972","5.9.29.183","172.19.0.3","TCP","1213","9002 → 43520 [PSH, ACK] Seq=210479 Ack=13489 Win=65535 Len=1157 [TCP segment of a reassembled PDU]"
"4.817978","172.19.0.3","5.9.29.183","TCP","56","43520 → 9002 [ACK] Seq=13489 Ack=209019 Win=11895 Len=0"
"4.818061","172.19.0.3","5.9.29.183","TCP","56","43520 → 9002 [ACK] Seq=13489 Ack=211636 Win=11879 Len=0"
"4.833452","5.9.29.183","172.19.0.3","TLSv1.2","337","Application Data"
"4.835645","5.9.29.183","172.19.0.3","TCP","1516","[TCP segment of a reassembled PDU]"
"4.835661","172.19.0.3","5.9.29.183","TCP","56","43520 → 9002 [ACK] Seq=13489 Ack=213377 Win=11911 Len=0"
"4.835697","5.9.29.183","172.19.0.3","TCP","1492","9002 → 43520 [PSH, ACK] Seq=213377 Ack=13489 Win=65535 Len=1436 [TCP segment of a reassembled PDU]"
"4.835706","5.9.29.183","172.19.0.3","TLSv1.2","1516","Application Data [TCP segment of a reassembled PDU]"
"4.835709","5.9.29.183","172.19.0.3","TCP","1516","9002 → 43520 [PSH, ACK] Seq=216273 Ack=13489 Win=65535 Len=1460 [TCP segment of a reassembled PDU]"
"4.835712","5.9.29.183","172.19.0.3","TCP","1516","9002 → 43520 [PSH, ACK] Seq=217733 Ack=13489 Win=65535 Len=1460 [TCP segment of a reassembled PDU]"
"4.835778","5.9.29.183","172.19.0.3","TLSv1.2","1516","Application Data [TCP segment of a reassembled PDU]"
"4.835785","5.9.29.183","172.19.0.3","TCP","1456","9002 → 43520 [PSH, ACK] Seq=220653 Ack=13489 Win=65535 Len=1400 [TCP segment of a reassembled PDU]"
"4.835787","5.9.29.183","172.19.0.3","TCP","1504","9002 → 43520 [PSH, ACK] Seq=222053 Ack=13489 Win=65535 Len=1448 [TCP segment of a reassembled PDU]"
"4.835799","172.19.0.3","5.9.29.183","TCP","56","43520 → 9002 [ACK] Seq=13489 Ack=220653 Win=11869 Len=0"
"4.835855","172.19.0.3","5.9.29.183","TCP","56","43520 → 9002 [ACK] Seq=13489 Ack=223501 Win=11853 Len=0"
"4.849215","5.9.29.183","172.19.0.3","TLSv1.2","1438","Application Data, Application Data"
"4.853102","5.9.29.183","172.19.0.3","TCP","1504","[TCP segment of a reassembled PDU]"
"4.853126","172.19.0.3","5.9.29.183","TCP","56","43520 → 9002 [ACK] Seq=13489 Ack=226331 Win=11911 Len=0"
"4.854338","5.9.29.183","172.19.0.3","TCP","1516","9002 → 43520 [PSH, ACK] Seq=226331 Ack=13489 Win=65535 Len=1460 [TCP segment of a reassembled PDU]"
"4.854425","5.9.29.183","172.19.0.3","TLSv1.2","1492","Application Data [TCP segment of a reassembled PDU]"
"4.854435","5.9.29.183","172.19.0.3","TCP","1516","9002 → 43520 [PSH, ACK] Seq=229227 Ack=13489 Win=65535 Len=1460 [TCP segment of a reassembled PDU]"
"4.854439","5.9.29.183","172.19.0.3","TCP","1516","9002 → 43520 [PSH, ACK] Seq=230687 Ack=13489 Win=65535 Len=1460 [TCP segment of a reassembled PDU]"
"4.854464","5.9.29.183","172.19.0.3","TLSv1.2","1516","Application Data [TCP segment of a reassembled PDU]"
"4.854469","5.9.29.183","172.19.0.3","TCP","1468","9002 → 43520 [PSH, ACK] Seq=233607 Ack=13489 Win=65535 Len=1412 [TCP segment of a reassembled PDU]"
"4.854516","172.19.0.3","5.9.29.183","TCP","56","43520 → 9002 [ACK] Seq=13489 Ack=235019 Win=11871 Len=0"
"4.854794","172.19.0.3","5.9.29.183","TLSv1.2","599","Application Data"
"4.855008","5.9.29.183","172.19.0.3","TCP","56","9002 → 43520 [ACK] Seq=235019 Ack=14032 Win=65535 Len=0"
"4.864498","5.9.29.183","172.19.0.3","TLSv1.2","1315","Application Data"
"4.871558","5.9.29.183","172.19.0.3","TCP","1516","[TCP segment of a reassembled PDU]"
"4.871578","172.19.0.3","5.9.29.183","TCP","56","43520 → 9002 [ACK] Seq=14032 Ack=237738 Win=11911 Len=0"
"4.871620","5.9.29.183","172.19.0.3","TCP","1516","9002 → 43520 [PSH, ACK] Seq=237738 Ack=14032 Win=65535 Len=1460 [TCP segment of a reassembled PDU]"
"4.871658","5.9.29.183","172.19.0.3","TLSv1.2","1516","Application Data [TCP segment of a reassembled PDU]"
"4.871810","172.19.0.3","5.9.29.183","TCP","56","43520 → 9002 [ACK] Seq=14032 Ack=240658 Win=11895 Len=0"
"4.871851","5.9.29.183","172.19.0.3","TCP","1516","9002 → 43520 [PSH, ACK] Seq=240658 Ack=14032 Win=65535 Len=1460 [TCP segment of a reassembled PDU]"
"4.871856","5.9.29.183","172.19.0.3","TCP","1516","9002 → 43520 [PSH, ACK] Seq=242118 Ack=14032 Win=65535 Len=1460 [TCP segment of a reassembled PDU]"
"4.871858","5.9.29.183","172.19.0.3","TLSv1.2","1516","Application Data [TCP segment of a reassembled PDU]"
"4.871859","5.9.29.183","172.19.0.3","TCP","1432","9002 → 43520 [PSH, ACK] Seq=245038 Ack=14032 Win=65535 Len=1376 [TCP segment of a reassembled PDU]"
"4.871867","5.9.29.183","172.19.0.3","TCP","1516","9002 → 43520 [PSH, ACK] Seq=246414 Ack=14032 Win=65535 Len=1460 [TCP segment of a reassembled PDU]"
"4.871927","5.9.29.183","172.19.0.3","TLSv1.2","1492","Application Data [TCP segment of a reassembled PDU]"
"4.871991","5.9.29.183","172.19.0.3","TCP","1516","9002 → 43520 [PSH, ACK] Seq=249310 Ack=14032 Win=65535 Len=1460 [TCP segment of a reassembled PDU]"
"4.871998","5.9.29.183","172.19.0.3","TCP","1492","9002 → 43520 [PSH, ACK] Seq=250770 Ack=14032 Win=65535 Len=1436 [TCP segment of a reassembled PDU]"
"4.872008","172.19.0.3","5.9.29.183","TCP","56","43520 → 9002 [ACK] Seq=14032 Ack=250770 Win=11836 Len=0"
"4.879935","5.9.29.183","172.19.0.3","TLSv1.2","721","Application Data, Application Data"
"4.879953","172.19.0.3","5.9.29.183","TCP","56","43520 → 9002 [ACK] Seq=14032 Ack=252871 Win=11911 Len=0"
"4.879959","5.9.29.183","172.19.0.3","TCP","1516","[TCP segment of a reassembled PDU]"
"4.879964","5.9.29.183","172.19.0.3","TCP","1492","9002 → 43520 [PSH, ACK] Seq=254331 Ack=14032 Win=65535 Len=1436 [TCP segment of a reassembled PDU]"
"4.880298","172.19.0.3","5.9.29.183","TCP","56","43520 → 9002 [ACK] Seq=14032 Ack=255767 Win=11895 Len=0"
"4.880668","172.19.0.3","5.9.29.183","TLSv1.2","599","Application Data"
"4.880883","5.9.29.183","172.19.0.3","TCP","56","9002 → 43520 [ACK] Seq=255767 Ack=14575 Win=65535 Len=0"
"4.888572","5.9.29.183","172.19.0.3","TLSv1.2","1504","Application Data [TCP segment of a reassembled PDU]"
"4.888722","5.9.29.183","172.19.0.3","TCP","1504","9002 → 43520 [PSH, ACK] Seq=257215 Ack=14575 Win=65535 Len=1448 [TCP segment of a reassembled PDU]"
"4.888735","172.19.0.3","5.9.29.183","TCP","56","43520 → 9002 [ACK] Seq=14575 Ack=258663 Win=11903 Len=0"
"4.888861","5.9.29.183","172.19.0.3","TLSv1.2","1516","Application Data [TCP segment of a reassembled PDU]"
"4.888875","5.9.29.183","172.19.0.3","TCP","1492","9002 → 43520 [PSH, ACK] Seq=260123 Ack=14575 Win=65535 Len=1436 [TCP segment of a reassembled PDU]"
"4.888954","5.9.29.183","172.19.0.3","TCP","1516","9002 → 43520 [PSH, ACK] Seq=261559 Ack=14575 Win=65535 Len=1460 [TCP segment of a reassembled PDU]"
"4.888960","5.9.29.183","172.19.0.3","TLSv1.2","1492","Application Data [TCP segment of a reassembled PDU]"
"4.889109","172.19.0.3","5.9.29.183","TCP","56","43520 → 9002 [ACK] Seq=14575 Ack=264455 Win=11871 Len=0"
"4.889534","172.19.0.3","5.9.29.183","TLSv1.2","599","Application Data"
"4.889709","5.9.29.183","172.19.0.3","TCP","56","9002 → 43520 [ACK] Seq=264455 Ack=15118 Win=65535 Len=0"
"4.895979","5.9.29.183","172.19.0.3","TLSv1.2","1438","Application Data"
"4.936831","172.19.0.3","5.9.29.183","TCP","56","43520 → 9002 [ACK] Seq=15118 Ack=265837 Win=11911 Len=0"
"4.946447","5.9.29.183","172.19.0.3","TCP","1368","[TCP segment of a reassembled PDU]"
"4.946489","5.9.29.183","172.19.0.3","TLSv1.2","829","Application Data"
"4.946583","172.19.0.3","5.9.29.183","TCP","56","43520 → 9002 [ACK] Seq=15118 Ack=267922 Win=11903 Len=0"
"4.982435","5.9.29.183","172.19.0.3","TCP","1516","[TCP segment of a reassembled PDU]"
"4.982496","5.9.29.183","172.19.0.3","TLSv1.2","167","Application Data"
"4.982512","172.19.0.3","5.9.29.183","TCP","56","43520 → 9002 [ACK] Seq=15118 Ack=269493 Win=11903 Len=0"
"4.987555","172.19.0.3","5.9.29.183","TLSv1.2","599","Application Data"
"4.987855","5.9.29.183","172.19.0.3","TCP","56","9002 → 43520 [ACK] Seq=269493 Ack=15661 Win=65535 Len=0"
"5.362358","5.9.29.183","172.19.0.3","TLSv1.2","599","Application Data"
"5.363133","172.19.0.3","5.9.29.183","TLSv1.2","599","Application Data"
"5.363425","5.9.29.183","172.19.0.3","TCP","56","9002 → 43520 [ACK] Seq=270036 Ack=16204 Win=65535 Len=0"
"5.749842","5.9.29.183","172.19.0.3","TCP","1504","[TCP segment of a reassembled PDU]"
"5.750023","5.9.29.183","172.19.0.3","TCP","1504","9002 → 43520 [PSH, ACK] Seq=271484 Ack=16204 Win=65535 Len=1448 [TCP segment of a reassembled PDU]"
"5.750032","5.9.29.183","172.19.0.3","TLSv1.2","1237","Application Data"
"5.750138","172.19.0.3","5.9.29.183","TCP","56","43520 → 9002 [ACK] Seq=16204 Ack=274113 Win=11895 Len=0"
"5.765666","5.9.29.183","172.19.0.3","TLSv1.2","149","Application Data"
"5.778119","5.9.29.183","172.19.0.3","TCP","1516","[TCP segment of a reassembled PDU]"
"5.778140","172.19.0.3","5.9.29.183","TCP","56","43520 → 9002 [ACK] Seq=16204 Ack=275666 Win=11911 Len=0"
"5.778188","5.9.29.183","172.19.0.3","TCP","1516","9002 → 43520 [PSH, ACK] Seq=275666 Ack=16204 Win=65535 Len=1460 [TCP segment of a reassembled PDU]"
"5.778199","5.9.29.183","172.19.0.3","TLSv1.2","1516","Application Data [TCP segment of a reassembled PDU]"
"5.778203","5.9.29.183","172.19.0.3","TCP","1516","9002 → 43520 [PSH, ACK] Seq=278586 Ack=16204 Win=65535 Len=1460 [TCP segment of a reassembled PDU]"
"5.778209","5.9.29.183","172.19.0.3","TCP","1516","9002 → 43520 [PSH, ACK] Seq=280046 Ack=16204 Win=65535 Len=1460 [TCP segment of a reassembled PDU]"
"5.778213","5.9.29.183","172.19.0.3","TLSv1.2","1516","Application Data [TCP segment of a reassembled PDU]"
"5.778216","5.9.29.183","172.19.0.3","TCP","1516","9002 → 43520 [PSH, ACK] Seq=282966 Ack=16204 Win=65535 Len=1460 [TCP segment of a reassembled PDU]"
"5.778219","5.9.29.183","172.19.0.3","TCP","1420","9002 → 43520 [PSH, ACK] Seq=284426 Ack=16204 Win=65535 Len=1364 [TCP segment of a reassembled PDU]"
"5.778285","5.9.29.183","172.19.0.3","TLSv1.2","1504","Application Data, Application Data"
"5.778338","172.19.0.3","5.9.29.183","TCP","56","43520 → 9002 [ACK] Seq=16204 Ack=287238 Win=11847 Len=0"
"5.781289","5.9.29.183","172.19.0.3","TCP","1516","9002 → 43520 [PSH, ACK] Seq=287238 Ack=16204 Win=65535 Len=1460 [TCP segment of a reassembled PDU]"
"5.781362","5.9.29.183","172.19.0.3","TCP","1492","9002 → 43520 [PSH, ACK] Seq=288698 Ack=16204 Win=65535 Len=1436 [TCP segment of a reassembled PDU]"
"5.781384","172.19.0.3","5.9.29.183","TCP","56","43520 → 9002 [ACK] Seq=16204 Ack=290134 Win=11903 Len=0"
"5.793571","5.9.29.183","172.19.0.3","TLSv1.2","1516","Application Data [TCP segment of a reassembled PDU]"
"5.793644","5.9.29.183","172.19.0.3","TLSv1.2","1346","Application Data"
"5.793667","172.19.0.3","5.9.29.183","TCP","56","43520 → 9002 [ACK] Seq=16204 Ack=292884 Win=11903 Len=0"
"5.821466","5.9.29.183","172.19.0.3","TCP","1504","[TCP segment of a reassembled PDU]"
"5.822488","5.9.29.183","172.19.0.3","TCP","1516","9002 → 43520 [PSH, ACK] Seq=294332 Ack=16204 Win=65535 Len=1460 [TCP segment of a reassembled PDU]"
"5.822509","172.19.0.3","5.9.29.183","TCP","56","43520 → 9002 [ACK] Seq=16204 Ack=295792 Win=11911 Len=0"
"5.822553","5.9.29.183","172.19.0.3","TLSv1.2","1225","Application Data"
"5.822944","172.19.0.3","5.9.29.183","TLSv1.2","599","Application Data"
"5.823368","5.9.29.183","172.19.0.3","TCP","56","9002 → 43520 [ACK] Seq=296961 Ack=16747 Win=65535 Len=0"
"5.837972","5.9.29.183","172.19.0.3","TLSv1.2","1177","Application Data"
"5.841252","5.9.29.183","172.19.0.3","TCP","1516","[TCP segment of a reassembled PDU]"
"5.841262","172.19.0.3","5.9.29.183","TCP","56","43520 → 9002 [ACK] Seq=16747 Ack=299542 Win=11911 Len=0"
"5.841320","5.9.29.183","172.19.0.3","TCP","1516","9002 → 43520 [PSH, ACK] Seq=299542 Ack=16747 Win=65535 Len=1460 [TCP segment of a reassembled PDU]"
"5.841329","5.9.29.183","172.19.0.3","TLSv1.2","1516","Application Data [TCP segment of a reassembled PDU]"
"5.841370","172.19.0.3","5.9.29.183","TCP","56","43520 → 9002 [ACK] Seq=16747 Ack=302462 Win=11895 Len=0"
"5.841396","5.9.29.183","172.19.0.3","TCP","1468","9002 → 43520 [PSH, ACK] Seq=302462 Ack=16747 Win=65535 Len=1412 [TCP segment of a reassembled PDU]"
"5.841399","5.9.29.183","172.19.0.3","TCP","1516","9002 → 43520 [PSH, ACK] Seq=303874 Ack=16747 Win=65535 Len=1460 [TCP segment of a reassembled PDU]"
"5.841401","5.9.29.183","172.19.0.3","TLSv1.2","1516","Application Data [TCP segment of a reassembled PDU]"
"5.841441","172.19.0.3","5.9.29.183","TCP","56","43520 → 9002 [ACK] Seq=16747 Ack=306794 Win=11871 Len=0"
"5.841452","5.9.29.183","172.19.0.3","TCP","1516","9002 → 43520 [PSH, ACK] Seq=306794 Ack=16747 Win=65535 Len=1460 [TCP segment of a reassembled PDU]"
"5.841455","5.9.29.183","172.19.0.3","TCP","1468","9002 → 43520 [PSH, ACK] Seq=308254 Ack=16747 Win=65535 Len=1412 [TCP segment of a reassembled PDU]"
"5.841584","172.19.0.3","5.9.29.183","TCP","56","43520 → 9002 [ACK] Seq=16747 Ack=309666 Win=11855 Len=0"
"5.853318","5.9.29.183","172.19.0.3","TLSv1.2","381","Application Data"
"5.853739","172.19.0.3","5.9.29.183","TLSv1.2","599","Application Data"
"5.853987","5.9.29.183","172.19.0.3","TCP","56","9002 → 43520 [ACK] Seq=309991 Ack=17290 Win=65535 Len=0"
"5.859597","5.9.29.183","172.19.0.3","TCP","1516","[TCP segment of a reassembled PDU]"
"5.859657","5.9.29.183","172.19.0.3","TCP","1516","9002 → 43520 [PSH, ACK] Seq=311451 Ack=17290 Win=65535 Len=1460 [TCP segment of a reassembled PDU]"
"5.859664","5.9.29.183","172.19.0.3","TLSv1.2","1516","Application Data [TCP segment of a reassembled PDU]"
"5.859667","5.9.29.183","172.19.0.3","TCP","1516","9002 → 43520 [PSH, ACK] Seq=314371 Ack=17290 Win=65535 Len=1460 [TCP segment of a reassembled PDU]"
"5.859669","5.9.29.183","172.19.0.3","TCP","1516","9002 → 43520 [PSH, ACK] Seq=315831 Ack=17290 Win=65535 Len=1460 [TCP segment of a reassembled PDU]"
"5.859672","5.9.29.183","172.19.0.3","TLSv1.2","1516","Application Data [TCP segment of a reassembled PDU]"
"5.859675","5.9.29.183","172.19.0.3","TCP","1432","9002 → 43520 [PSH, ACK] Seq=318751 Ack=17290 Win=65535 Len=1376 [TCP segment of a reassembled PDU]"
"5.859813","172.19.0.3","5.9.29.183","TCP","56","43520 → 9002 [ACK] Seq=17290 Ack=320127 Win=11863 Len=0"
"5.865899","5.9.29.183","172.19.0.3","TLSv1.2","1504","Application Data [TCP segment of a reassembled PDU]"
"5.865965","5.9.29.183","172.19.0.3","TCP","1516","9002 → 43520 [PSH, ACK] Seq=321575 Ack=17290 Win=65535 Len=1460 [TCP segment of a reassembled PDU]"
"5.865983","172.19.0.3","5.9.29.183","TCP","56","43520 → 9002 [ACK] Seq=17290 Ack=323035 Win=11903 Len=0"
"5.865986","5.9.29.183","172.19.0.3","TCP","1492","9002 → 43520 [PSH, ACK] Seq=323035 Ack=17290 Win=65535 Len=1436 [TCP segment of a reassembled PDU]"
"5.868956","5.9.29.183","172.19.0.3","TLSv1.2","598","Application Data"
"5.868981","172.19.0.3","5.9.29.183","TCP","56","43520 → 9002 [ACK] Seq=17290 Ack=325013 Win=11911 Len=0"
"5.869504","172.19.0.3","5.9.29.183","TLSv1.2","599","Application Data"
"5.869834","5.9.29.183","172.19.0.3","TCP","56","9002 → 43520 [ACK] Seq=325013 Ack=17833 Win=65535 Len=0"
"5.878682","5.9.29.183","172.19.0.3","TCP","1504","[TCP segment of a reassembled PDU]"
"5.878964","5.9.29.183","172.19.0.3","TCP","1516","9002 → 43520 [PSH, ACK] Seq=326461 Ack=17833 Win=65535 Len=1460 [TCP segment of a reassembled PDU]"
"5.878980","172.19.0.3","5.9.29.183","TCP","56","43520 → 9002 [ACK] Seq=17833 Ack=327921 Win=11911 Len=0"
"5.879035","5.9.29.183","172.19.0.3","TLSv1.2","1516","Application Data [TCP segment of a reassembled PDU]"
"5.879145","5.9.29.183","172.19.0.3","TCP","1480","9002 → 43520 [PSH, ACK] Seq=329381 Ack=17833 Win=65535 Len=1424 [TCP segment of a reassembled PDU]"
"5.879156","5.9.29.183","172.19.0.3","TCP","1516","9002 → 43520 [PSH, ACK] Seq=330805 Ack=17833 Win=65535 Len=1460 [TCP segment of a reassembled PDU]"
"5.879375","172.19.0.3","5.9.29.183","TCP","56","43520 → 9002 [ACK] Seq=17833 Ack=332265 Win=11887 Len=0"
"5.879605","5.9.29.183","172.19.0.3","TCP","476","9002 → 43520 [PSH, ACK] Seq=332265 Ack=17833 Win=65535 Len=420 [TCP segment of a reassembled PDU]"
"5.879736","5.9.29.183","172.19.0.3","TLSv1.2","1516","Application Data [TCP segment of a reassembled PDU]"
"5.879746","172.19.0.3","5.9.29.183","TCP","56","43520 → 9002 [ACK] Seq=17833 Ack=334145 Win=11903 Len=0"
"5.879749","5.9.29.183","172.19.0.3","TCP","1516","9002 → 43520 [PSH, ACK] Seq=334145 Ack=17833 Win=65535 Len=1460 [TCP segment of a reassembled PDU]"
"5.879753","5.9.29.183","172.19.0.3","TCP","1048","9002 → 43520 [PSH, ACK] Seq=335605 Ack=17833 Win=65535 Len=992 [TCP segment of a reassembled PDU]"
"5.880055","172.19.0.3","5.9.29.183","TCP","56","43520 → 9002 [ACK] Seq=17833 Ack=336597 Win=11887 Len=0"
"5.884640","5.9.29.183","172.19.0.3","TLSv1.2","924","Application Data, Application Data"
"5.903911","5.9.29.183","172.19.0.3","TCP","1516","[TCP segment of a reassembled PDU]"
"5.903932","172.19.0.3","5.9.29.183","TCP","56","43520 → 9002 [ACK] Seq=17833 Ack=338925 Win=11911 Len=0"
"5.903939","5.9.29.183","172.19.0.3","TLSv1.2","681","Application Data"
"5.908933","172.19.0.3","5.9.29.183","TLSv1.2","599","Application Data"
"5.909289","5.9.29.183","172.19.0.3","TCP","56","9002 → 43520 [ACK] Seq=339550 Ack=18376 Win=65535 Len=0"
"6.358125","5.9.29.183","172.19.0.3","TLSv1.2","599","Application Data"
"6.359029","172.19.0.3","5.9.29.183","TLSv1.2","599","Application Data"
"6.359353","5.9.29.183","172.19.0.3","TCP","56","9002 → 43520 [ACK] Seq=340093 Ack=18919 Win=65535 Len=0"
"6.754342","5.9.29.183","172.19.0.3","TCP","1516","[TCP segment of a reassembled PDU]"
"6.754450","5.9.29.183","172.19.0.3","TCP","1516","9002 → 43520 [PSH, ACK] Seq=341553 Ack=18919 Win=65535 Len=1460 [TCP segment of a reassembled PDU]"
"6.754467","5.9.29.183","172.19.0.3","TLSv1.2","763","Application Data"
"6.754606","172.19.0.3","5.9.29.183","TCP","56","43520 → 9002 [ACK] Seq=18919 Ack=343720 Win=11895 Len=0"
"6.780105","5.9.29.183","172.19.0.3","TCP","1504","[TCP segment of a reassembled PDU]"
"6.780213","5.9.29.183","172.19.0.3","TCP","1504","9002 → 43520 [PSH, ACK] Seq=345168 Ack=18919 Win=65535 Len=1448 [TCP segment of a reassembled PDU]"
"6.780229","172.19.0.3","5.9.29.183","TCP","56","43520 → 9002 [ACK] Seq=18919 Ack=346616 Win=11903 Len=0"
"6.780346","5.9.29.183","172.19.0.3","TLSv1.2","1516","Application Data [TCP segment of a reassembled PDU]"
"6.780352","5.9.29.183","172.19.0.3","TLSv1.2","1516","Application Data [TCP segment of a reassembled PDU]"
"6.780357","172.19.0.3","5.9.29.183","TCP","56","43520 → 9002 [ACK] Seq=18919 Ack=349536 Win=11903 Len=0"
"6.780359","5.9.29.183","172.19.0.3","TCP","1516","9002 → 43520 [PSH, ACK] Seq=349536 Ack=18919 Win=65535 Len=1460 [TCP segment of a reassembled PDU]"
"6.780362","5.9.29.183","172.19.0.3","TCP","1516","9002 → 43520 [PSH, ACK] Seq=350996 Ack=18919 Win=65535 Len=1460 [TCP segment of a reassembled PDU]"
"6.780366","5.9.29.183","172.19.0.3","TLSv1.2","1189","Application Data [TCP segment of a reassembled PDU]"
"6.780369","5.9.29.183","172.19.0.3","TCP","1516","9002 → 43520 [PSH, ACK] Seq=353589 Ack=18919 Win=65535 Len=1460 [TCP segment of a reassembled PDU]"
"6.780372","5.9.29.183","172.19.0.3","TCP","1516","9002 → 43520 [PSH, ACK] Seq=355049 Ack=18919 Win=65535 Len=1460 [TCP segment of a reassembled PDU]"
"6.780385","5.9.29.183","172.19.0.3","TLSv1.2","1480","Application Data [TCP segment of a reassembled PDU]"
"6.780482","172.19.0.3","5.9.29.183","TCP","56","43520 → 9002 [ACK] Seq=18919 Ack=357933 Win=11853 Len=0"
"6.796838","5.9.29.183","172.19.0.3","TLSv1.2","1408","Application Data"
"6.824283","5.9.29.183","172.19.0.3","TCP","1504","[TCP segment of a reassembled PDU]"
"6.824303","172.19.0.3","5.9.29.183","TCP","56","43520 → 9002 [ACK] Seq=18919 Ack=360733 Win=11911 Len=0"
"6.824490","5.9.29.183","172.19.0.3","TCP","1504","9002 → 43520 [PSH, ACK] Seq=360733 Ack=18919 Win=65535 Len=1448 [TCP segment of a reassembled PDU]"
"6.824499","5.9.29.183","172.19.0.3","TLSv1.2","1516","Application Data [TCP segment of a reassembled PDU]"
"6.824503","5.9.29.183","172.19.0.3","TCP","1225","9002 → 43520 [PSH, ACK] Seq=363641 Ack=18919 Win=65535 Len=1169 [TCP segment of a reassembled PDU]"
"6.824524","172.19.0.3","5.9.29.183","TCP","56","43520 → 9002 [ACK] Seq=18919 Ack=364810 Win=11895 Len=0"
"6.824785","172.19.0.3","5.9.29.183","TLSv1.2","599","Application Data"
"6.825217","5.9.29.183","172.19.0.3","TCP","56","9002 → 43520 [ACK] Seq=364810 Ack=19462 Win=65535 Len=0"
"6.839476","5.9.29.183","172.19.0.3","TLSv1.2","243","Application Data"
"6.842644","5.9.29.183","172.19.0.3","TCP","1504","[TCP segment of a reassembled PDU]"
"6.842667","172.19.0.3","5.9.29.183","TCP","56","43520 → 9002 [ACK] Seq=19462 Ack=366445 Win=11911 Len=0"
"6.843027","5.9.29.183","172.19.0.3","TCP","1516","9002 → 43520 [PSH, ACK] Seq=366445 Ack=19462 Win=65535 Len=1460 [TCP segment of a reassembled PDU]"
"6.843078","5.9.29.183","172.19.0.3","TLSv1.2","1516","Application Data [TCP segment of a reassembled PDU]"
"6.843088","5.9.29.183","172.19.0.3","TCP","1516","9002 → 43520 [PSH, ACK] Seq=369365 Ack=19462 Win=65535 Len=1460 [TCP segment of a reassembled PDU]"
"6.843093","5.9.29.183","172.19.0.3","TCP","1516","9002 → 43520 [PSH, ACK] Seq=370825 Ack=19462 Win=65535 Len=1460 [TCP segment of a reassembled PDU]"
"6.843097","5.9.29.183","172.19.0.3","TLSv1.2","1516","Application Data [TCP segment of a reassembled PDU]"
"6.843129","5.9.29.183","172.19.0.3","TCP","1444","9002 → 43520 [PSH, ACK] Seq=373745 Ack=19462 Win=65535 Len=1388 [TCP segment of a reassembled PDU]"
"6.843133","5.9.29.183","172.19.0.3","TCP","1504","9002 → 43520 [PSH, ACK] Seq=375133 Ack=19462 Win=65535 Len=1448 [TCP segment of a reassembled PDU]"
"6.843145","172.19.0.3","5.9.29.183","TCP","56","43520 → 9002 [ACK] Seq=19462 Ack=373745 Win=11879 Len=0"
"6.843491","172.19.0.3","5.9.29.183","TLSv1.2","599","Application Data"
"6.843691","5.9.29.183","172.19.0.3","TCP","56","9002 → 43520 [ACK] Seq=376581 Ack=20005 Win=65535 Len=0"
"6.855625","5.9.29.183","172.19.0.3","TLSv1.2","924","Application Data, Application Data"
"6.860581","5.9.29.183","172.19.0.3","TCP","1504","[TCP segment of a reassembled PDU]"
"6.860606","172.19.0.3","5.9.29.183","TCP","56","43520 → 9002 [ACK] Seq=20005 Ack=378897 Win=11911 Len=0"
"6.861037","5.9.29.183","172.19.0.3","TCP","1516","9002 → 43520 [PSH, ACK] Seq=378897 Ack=20005 Win=65535 Len=1460 [TCP segment of a reassembled PDU]"
"6.861128","5.9.29.183","172.19.0.3","TLSv1.2","1516","Application Data [TCP segment of a reassembled PDU]"
"6.861137","5.9.29.183","172.19.0.3","TCP","1516","9002 → 43520 [PSH, ACK] Seq=381817 Ack=20005 Win=65535 Len=1460 [TCP segment of a reassembled PDU]"
"6.861141","5.9.29.183","172.19.0.3","TCP","1516","9002 → 43520 [PSH, ACK] Seq=383277 Ack=20005 Win=65535 Len=1460 [TCP segment of a reassembled PDU]"
"6.861174","5.9.29.183","172.19.0.3","TLSv1.2","1516","Application Data [TCP segment of a reassembled PDU]"
"6.861178","5.9.29.183","172.19.0.3","TCP","1516","9002 → 43520 [PSH, ACK] Seq=386197 Ack=20005 Win=65535 Len=1460 [TCP segment of a reassembled PDU]"
"6.861182","5.9.29.183","172.19.0.3","TCP","1432","9002 → 43520 [PSH, ACK] Seq=387657 Ack=20005 Win=65535 Len=1376 [TCP segment of a reassembled PDU]"
"6.861239","172.19.0.3","5.9.29.183","TCP","56","43520 → 9002 [ACK] Seq=20005 Ack=389033 Win=11863 Len=0"
"6.861337","5.9.29.183","172.19.0.3","TLSv1.2","1516","Application Data [TCP segment of a reassembled PDU]"
"6.861341","5.9.29.183","172.19.0.3","TCP","1516","9002 → 43520 [PSH, ACK] Seq=390493 Ack=20005 Win=65535 Len=1460 [TCP segment of a reassembled PDU]"
"6.861343","5.9.29.183","172.19.0.3","TCP","1480","9002 → 43520 [PSH, ACK] Seq=391953 Ack=20005 Win=65535 Len=1424 [TCP segment of a reassembled PDU]"
"6.861507","172.19.0.3","5.9.29.183","TCP","56","43520 → 9002 [ACK] Seq=20005 Ack=393377 Win=11838 Len=0"
"6.868477","5.9.29.183","172.19.0.3","TLSv1.2","1504","Application Data, Application Data"
"6.868953","172.19.0.3","5.9.29.183","TLSv1.2","599","Application Data"
"6.869371","5.9.29.183","172.19.0.3","TCP","56","9002 → 43520 [ACK] Seq=394825 Ack=20548 Win=65535 Len=0"
"6.870795","5.9.29.183","172.19.0.3","TLSv1.2","844","Application Data"
"6.883521","5.9.29.183","172.19.0.3","TCP","1504","[TCP segment of a reassembled PDU]"
"6.883542","172.19.0.3","5.9.29.183","TCP","56","43520 → 9002 [ACK] Seq=20548 Ack=397061 Win=11911 Len=0"
"6.884098","5.9.29.183","172.19.0.3","TCP","1216","9002 → 43520 [PSH, ACK] Seq=397061 Ack=20548 Win=65535 Len=1160 [TCP segment of a reassembled PDU]"
"6.884138","5.9.29.183","172.19.0.3","TCP","344","9002 → 43520 [PSH, ACK] Seq=398221 Ack=20548 Win=65535 Len=288 [TCP segment of a reassembled PDU]"
"6.884285","172.19.0.3","5.9.29.183","TCP","56","43520 → 9002 [ACK] Seq=20548 Ack=398509 Win=11911 Len=0"
"6.885678","5.9.29.183","172.19.0.3","TLSv1.2","787","Application Data"
"6.901281","5.9.29.183","172.19.0.3","TLSv1.2","1113","Application Data"
"6.901305","172.19.0.3","5.9.29.183","TCP","56","43520 → 9002 [ACK] Seq=20548 Ack=400297 Win=11911 Len=0"
"6.906929","172.19.0.3","5.9.29.183","TLSv1.2","599","Application Data"
"6.907341","5.9.29.183","172.19.0.3","TCP","56","9002 → 43520 [ACK] Seq=400297 Ack=21091 Win=65535 Len=0"
"7.290856","5.9.29.183","172.19.0.3","TLSv1.2","599","Application Data"
"7.291879","172.19.0.3","5.9.29.183","TLSv1.2","599","Application Data"
"7.292212","5.9.29.183","172.19.0.3","TCP","56","9002 → 43520 [ACK] Seq=400840 Ack=21634 Win=65535 Len=0"
"7.620212","5.9.29.183","172.19.0.3","TCP","1504","[TCP segment of a reassembled PDU]"
"7.620521","5.9.29.183","172.19.0.3","TCP","1516","9002 → 43520 [PSH, ACK] Seq=402288 Ack=21634 Win=65535 Len=1460 [TCP segment of a reassembled PDU]"
"7.620536","172.19.0.3","5.9.29.183","TCP","56","43520 → 9002 [ACK] Seq=21634 Ack=403748 Win=11911 Len=0"
"7.620579","5.9.29.183","172.19.0.3","TLSv1.2","775","Application Data"
"7.651753","5.9.29.183","172.19.0.3","TCP","1504","[TCP segment of a reassembled PDU]"
"7.651775","172.19.0.3","5.9.29.183","TCP","56","43520 → 9002 [ACK] Seq=21634 Ack=405915 Win=11911 Len=0"
"7.651946","5.9.29.183","172.19.0.3","TCP","1504","9002 → 43520 [PSH, ACK] Seq=405915 Ack=21634 Win=65535 Len=1448 [TCP segment of a reassembled PDU]"
"7.651955","5.9.29.183","172.19.0.3","TLSv1.2","787","Application Data"
"7.651992","172.19.0.3","5.9.29.183","TCP","56","43520 → 9002 [ACK] Seq=21634 Ack=408094 Win=11895 Len=0"
"7.662930","5.9.29.183","172.19.0.3","TCP","1516","[TCP segment of a reassembled PDU]"
"7.663004","5.9.29.183","172.19.0.3","TCP","1516","9002 → 43520 [PSH, ACK] Seq=409554 Ack=21634 Win=65535 Len=1460 [TCP segment of a reassembled PDU]"
"7.663027","172.19.0.3","5.9.29.183","TCP","56","43520 → 9002 [ACK] Seq=21634 Ack=411014 Win=11903 Len=0"
"7.663032","5.9.29.183","172.19.0.3","TLSv1.2","1516","Application Data [TCP segment of a reassembled PDU]"
"7.663038","5.9.29.183","172.19.0.3","TCP","1468","9002 → 43520 [PSH, ACK] Seq=412474 Ack=21634 Win=65535 Len=1412 [TCP segment of a reassembled PDU]"
"7.663293","172.19.0.3","5.9.29.183","TCP","56","43520 → 9002 [ACK] Seq=21634 Ack=413886 Win=11885 Len=0"
"7.667180","5.9.29.183","172.19.0.3","TLSv1.2","1504","Application Data [TCP segment of a reassembled PDU]"
"7.667246","5.9.29.183","172.19.0.3","TLSv1.2","613","Application Data"
"7.667263","172.19.0.3","5.9.29.183","TCP","56","43520 → 9002 [ACK] Seq=21634 Ack=415891 Win=11903 Len=0"
"7.667582","172.19.0.3","5.9.29.183","TLSv1.2","599","Application Data"
"7.667847","5.9.29.183","172.19.0.3","TCP","56","9002 → 43520 [ACK] Seq=415891 Ack=22177 Win=65535 Len=0"
"7.677389","5.9.29.183","172.19.0.3","TCP","1516","[TCP segment of a reassembled PDU]"
"7.677449","5.9.29.183","172.19.0.3","TCP","1492","9002 → 43520 [PSH, ACK] Seq=417351 Ack=22177 Win=65535 Len=1436 [TCP segment of a reassembled PDU]"
"7.677467","172.19.0.3","5.9.29.183","TCP","56","43520 → 9002 [ACK] Seq=22177 Ack=418787 Win=11903 Len=0"
"7.677811","5.9.29.183","172.19.0.3","TLSv1.2","1516","Application Data [TCP segment of a reassembled PDU]"
"7.677869","5.9.29.183","172.19.0.3","TCP","1492","9002 → 43520 [PSH, ACK] Seq=420247 Ack=22177 Win=65535 Len=1436 [TCP segment of a reassembled PDU]"
"7.677880","172.19.0.3","5.9.29.183","TCP","56","43520 → 9002 [ACK] Seq=22177 Ack=421683 Win=11903 Len=0"
"7.677923","5.9.29.183","172.19.0.3","TCP","1504","9002 → 43520 [PSH, ACK] Seq=421683 Ack=22177 Win=65535 Len=1448 [TCP segment of a reassembled PDU]"
"7.678176","5.9.29.183","172.19.0.3","TLSv1.2","1516","Application Data [TCP segment of a reassembled PDU]"
"7.678183","172.19.0.3","5.9.29.183","TCP","56","43520 → 9002 [ACK] Seq=22177 Ack=424591 Win=11911 Len=0"
"7.678215","5.9.29.183","172.19.0.3","TCP","1492","9002 → 43520 [PSH, ACK] Seq=424591 Ack=22177 Win=65535 Len=1436 [TCP segment of a reassembled PDU]"
"7.682435","5.9.29.183","172.19.0.3","TLSv1.2","1315","Application Data"
"7.682461","172.19.0.3","5.9.29.183","TCP","56","43520 → 9002 [ACK] Seq=22177 Ack=427286 Win=11911 Len=0"
"7.682819","172.19.0.3","5.9.29.183","TLSv1.2","599","Application Data"
"7.683039","5.9.29.183","172.19.0.3","TCP","56","9002 → 43520 [ACK] Seq=427286 Ack=22720 Win=65535 Len=0"
"7.729716","5.9.29.183","172.19.0.3","TCP","1516","[TCP segment of a reassembled PDU]"
"7.729785","5.9.29.183","172.19.0.3","TLSv1.2","167","Application Data"
"7.729969","172.19.0.3","5.9.29.183","TCP","56","43520 → 9002 [ACK] Seq=22720 Ack=428857 Win=11903 Len=0"
"7.734429","172.19.0.3","5.9.29.183","TLSv1.2","599","Application Data"
"7.734695","5.9.29.183","172.19.0.3","TCP","56","9002 → 43520 [ACK] Seq=428857 Ack=23263 Win=65535 Len=0"
"8.137914","5.9.29.183","172.19.0.3","TLSv1.2","599","Application Data"
"8.138681","172.19.0.3","5.9.29.183","TLSv1.2","599","Application Data"
"8.138906","5.9.29.183","172.19.0.3","TCP","56","9002 → 43520 [ACK] Seq=429400 Ack=23806 Win=65535 Len=0"
"8.474784","5.9.29.183","172.19.0.3","TCP","1516","[TCP segment of a reassembled PDU]"
"8.475140","5.9.29.183","172.19.0.3","TCP","1492","9002 → 43520 [PSH, ACK] Seq=430860 Ack=23806 Win=65535 Len=1436 [TCP segment of a reassembled PDU]"
"8.475154","172.19.0.3","5.9.29.183","TCP","56","43520 → 9002 [ACK] Seq=23806 Ack=432296 Win=11911 Len=0"
"8.475195","5.9.29.183","172.19.0.3","TLSv1.2","787","Application Data"
"8.521633","172.19.0.3","5.9.29.183","TCP","56","43520 → 9002 [ACK] Seq=23806 Ack=433027 Win=11911 Len=0"
"8.541041","5.9.29.183","172.19.0.3","TCP","1504","[TCP segment of a reassembled PDU]"
"8.541062","172.19.0.3","5.9.29.183","TCP","56","43520 → 9002 [ACK] Seq=23806 Ack=434475 Win=11911 Len=0"
"8.541278","5.9.29.183","172.19.0.3","TLSv1.2","1207","Application Data"
"8.541292","172.19.0.3","5.9.29.183","TCP","56","43520 → 9002 [ACK] Seq=23806 Ack=435626 Win=11911 Len=0"
"8.544482","172.19.0.3","5.9.29.183","TLSv1.2","599","Application Data"
"8.544788","5.9.29.183","172.19.0.3","TCP","56","9002 → 43520 [ACK] Seq=435626 Ack=24349 Win=65535 Len=0"
"8.924538","5.9.29.183","172.19.0.3","TLSv1.2","599","Application Data"
"8.925450","172.19.0.3","5.9.29.183","TLSv1.2","599","Application Data"
"8.925749","5.9.29.183","172.19.0.3","TCP","56","9002 → 43520 [ACK] Seq=436169 Ack=24892 Win=65535 Len=0"
"9.285462","5.9.29.183","172.19.0.3","TCP","1504","[TCP segment of a reassembled PDU]"
"9.285783","5.9.29.183","172.19.0.3","TCP","1504","9002 → 43520 [PSH, ACK] Seq=437617 Ack=24892 Win=65535 Len=1448 [TCP segment of a reassembled PDU]"
"9.285797","5.9.29.183","172.19.0.3","TLSv1.2","787","Application Data"
"9.285825","172.19.0.3","5.9.29.183","TCP","56","43520 → 9002 [ACK] Seq=24892 Ack=439796 Win=11895 Len=0"
"9.303291","5.9.29.183","172.19.0.3","TLSv1.2","599","Application Data"
"9.314950","5.9.29.183","172.19.0.3","TCP","1516","[TCP segment of a reassembled PDU]"
"9.314970","172.19.0.3","5.9.29.183","TCP","56","43520 → 9002 [ACK] Seq=24892 Ack=441799 Win=11911 Len=0"
"9.315019","5.9.29.183","172.19.0.3","TCP","1516","9002 → 43520 [PSH, ACK] Seq=441799 Ack=24892 Win=65535 Len=1460 [TCP segment of a reassembled PDU]"
"9.315030","5.9.29.183","172.19.0.3","TLSv1.2","1480","Application Data [TCP segment of a reassembled PDU]"
"9.315034","5.9.29.183","172.19.0.3","TCP","1516","9002 → 43520 [PSH, ACK] Seq=444683 Ack=24892 Win=65535 Len=1460 [TCP segment of a reassembled PDU]"
"9.315174","172.19.0.3","5.9.29.183","TCP","56","43520 → 9002 [ACK] Seq=24892 Ack=446143 Win=11887 Len=0"
"9.315418","5.9.29.183","172.19.0.3","TCP","1516","9002 → 43520 [PSH, ACK] Seq=446143 Ack=24892 Win=65535 Len=1460 [TCP segment of a reassembled PDU]"
"9.315427","5.9.29.183","172.19.0.3","TLSv1.2","1516","Application Data [TCP segment of a reassembled PDU]"
"9.315432","5.9.29.183","172.19.0.3","TCP","1516","9002 → 43520 [PSH, ACK] Seq=449063 Ack=24892 Win=65535 Len=1460 [TCP segment of a reassembled PDU]"
"9.315449","5.9.29.183","172.19.0.3","TCP","1516","9002 → 43520 [PSH, ACK] Seq=450523 Ack=24892 Win=65535 Len=1460 [TCP segment of a reassembled PDU]"
"9.315548","5.9.29.183","172.19.0.3","TLSv1.2","1444","Application Data [TCP segment of a reassembled PDU]"
"9.315564","172.19.0.3","5.9.29.183","TCP","56","43520 → 9002 [ACK] Seq=24892 Ack=451983 Win=11855 Len=0"
"9.324728","5.9.29.183","172.19.0.3","TLSv1.2","504","Application Data"
"9.324748","172.19.0.3","5.9.29.183","TCP","56","43520 → 9002 [ACK] Seq=24892 Ack=453819 Win=11911 Len=0"
"9.337005","5.9.29.183","172.19.0.3","TCP","1516","[TCP segment of a reassembled PDU]"
"9.337064","5.9.29.183","172.19.0.3","TCP","1492","9002 → 43520 [PSH, ACK] Seq=455279 Ack=24892 Win=65535 Len=1436 [TCP segment of a reassembled PDU]"
"9.337186","172.19.0.3","5.9.29.183","TCP","56","43520 → 9002 [ACK] Seq=24892 Ack=456715 Win=11903 Len=0"
"9.340126","5.9.29.183","172.19.0.3","TLSv1.2","1330","Application Data, Application Data"
"9.347939","5.9.29.183","172.19.0.3","TCP","1504","[TCP segment of a reassembled PDU]"
"9.347981","172.19.0.3","5.9.29.183","TCP","56","43520 → 9002 [ACK] Seq=24892 Ack=459437 Win=11911 Len=0"
"9.348270","5.9.29.183","172.19.0.3","TCP","1516","9002 → 43520 [PSH, ACK] Seq=459437 Ack=24892 Win=65535 Len=1460 [TCP segment of a reassembled PDU]"
"9.348325","5.9.29.183","172.19.0.3","TLSv1.2","1516","Application Data [TCP segment of a reassembled PDU]"
"9.348338","172.19.0.3","5.9.29.183","TCP","56","43520 → 9002 [ACK] Seq=24892 Ack=462357 Win=11911 Len=0"
"9.348439","5.9.29.183","172.19.0.3","TCP","1456","9002 → 43520 [PSH, ACK] Seq=462357 Ack=24892 Win=65535 Len=1400 [TCP segment of a reassembled PDU]"
"9.348479","5.9.29.183","172.19.0.3","TCP","1516","9002 → 43520 [PSH, ACK] Seq=463757 Ack=24892 Win=65535 Len=1460 [TCP segment of a reassembled PDU]"
"9.348484","5.9.29.183","172.19.0.3","TLSv1.2","1516","Application Data [TCP segment of a reassembled PDU]"
"9.348487","5.9.29.183","172.19.0.3","TCP","1516","9002 → 43520 [PSH, ACK] Seq=466677 Ack=24892 Win=65535 Len=1460 [TCP segment of a reassembled PDU]"
"9.348505","5.9.29.183","172.19.0.3","TCP","1492","9002 → 43520 [PSH, ACK] Seq=468137 Ack=24892 Win=65535 Len=1436 [TCP segment of a reassembled PDU]"
"9.348522","172.19.0.3","5.9.29.183","TCP","56","43520 → 9002 [ACK] Seq=24892 Ack=468137 Win=11879 Len=0"
"9.348829","172.19.0.3","5.9.29.183","TLSv1.2","599","Application Data"
"9.349058","5.9.29.183","172.19.0.3","TCP","56","9002 → 43520 [ACK] Seq=469573 Ack=25435 Win=65535 Len=0"
"9.355217","5.9.29.183","172.19.0.3","TLSv1.2","1438","Application Data, Application Data"
"9.359376","172.19.0.3","5.9.29.183","TLSv1.2","599","Application Data"
"9.359737","5.9.29.183","172.19.0.3","TCP","56","9002 → 43520 [ACK] Seq=470955 Ack=25978 Win=65535 Len=0"
"9.368579","5.9.29.183","172.19.0.3","TCP","1516","[TCP segment of a reassembled PDU]"
"9.368631","5.9.29.183","172.19.0.3","TCP","1492","9002 → 43520 [PSH, ACK] Seq=472415 Ack=25978 Win=65535 Len=1436 [TCP segment of a reassembled PDU]"
"9.368745","172.19.0.3","5.9.29.183","TCP","56","43520 → 9002 [ACK] Seq=25978 Ack=473851 Win=11903 Len=0"
"9.370132","5.9.29.183","172.19.0.3","TLSv1.2","1330","Application Data, Application Data"
"9.379243","5.9.29.183","172.19.0.3","TCP","1516","[TCP segment of a reassembled PDU]"
"9.379269","172.19.0.3","5.9.29.183","TCP","56","43520 → 9002 [ACK] Seq=25978 Ack=476585 Win=11911 Len=0"
"9.379330","5.9.29.183","172.19.0.3","TCP","1492","9002 → 43520 [PSH, ACK] Seq=476585 Ack=25978 Win=65535 Len=1436 [TCP segment of a reassembled PDU]"
"9.379521","5.9.29.183","172.19.0.3","TLSv1.2","1516","Application Data [TCP segment of a reassembled PDU]"
"9.379533","172.19.0.3","5.9.29.183","TCP","56","43520 → 9002 [ACK] Seq=25978 Ack=479481 Win=11911 Len=0"
"9.379766","5.9.29.183","172.19.0.3","TCP","1516","9002 → 43520 [PSH, ACK] Seq=479481 Ack=25978 Win=65535 Len=1460 [TCP segment of a reassembled PDU]"
"9.379813","5.9.29.183","172.19.0.3","TCP","1480","9002 → 43520 [PSH, ACK] Seq=480941 Ack=25978 Win=65535 Len=1424 [TCP segment of a reassembled PDU]"
"9.379873","172.19.0.3","5.9.29.183","TCP","56","43520 → 9002 [ACK] Seq=25978 Ack=482365 Win=11911 Len=0"
"9.386579","5.9.29.183","172.19.0.3","TLSv1.2","584","Application Data"
"9.417940","5.9.29.183","172.19.0.3","TCP","1516","[TCP segment of a reassembled PDU]"
"9.417964","172.19.0.3","5.9.29.183","TCP","56","43520 → 9002 [ACK] Seq=25978 Ack=484353 Win=11909 Len=0"
"9.418024","5.9.29.183","172.19.0.3","TLSv1.2","681","Application Data"
"9.422752","172.19.0.3","5.9.29.183","TLSv1.2","599","Application Data"
"9.423020","5.9.29.183","172.19.0.3","TCP","56","9002 → 43520 [ACK] Seq=484978 Ack=26521 Win=65535 Len=0"
"9.752317","5.9.29.183","172.19.0.3","TLSv1.2","599","Application Data"
"9.753056","172.19.0.3","5.9.29.183","TLSv1.2","599","Application Data"
"9.753321","5.9.29.183","172.19.0.3","TCP","56","9002 → 43520 [ACK] Seq=485521 Ack=27064 Win=65535 Len=0"
"10.087546","5.9.29.183","172.19.0.3","TCP","1504","[TCP segment of a reassembled PDU]"
"10.087846","5.9.29.183","172.19.0.3","TCP","1504","9002 → 43520 [PSH, ACK] Seq=486969 Ack=27064 Win=65535 Len=1448 [TCP segment of a reassembled PDU]"
"10.087879","172.19.0.3","5.9.29.183","TCP","56","43520 → 9002 [ACK] Seq=27064 Ack=488417 Win=11911 Len=0"
"10.087882","5.9.29.183","172.19.0.3","TLSv1.2","787","Application Data"
"10.115326","5.9.29.183","172.19.0.3","TCP","1516","[TCP segment of a reassembled PDU]"
"10.115346","172.19.0.3","5.9.29.183","TCP","56","43520 → 9002 [ACK] Seq=27064 Ack=490608 Win=11911 Len=0"
"10.115384","5.9.29.183","172.19.0.3","TCP","1492","9002 → 43520 [PSH, ACK] Seq=490608 Ack=27064 Win=65535 Len=1436 [TCP segment of a reassembled PDU]"
"10.115396","5.9.29.183","172.19.0.3","TLSv1.2","1516","Application Data [TCP segment of a reassembled PDU]"
"10.115399","5.9.29.183","172.19.0.3","TCP","1225","9002 → 43520 [PSH, ACK] Seq=493504 Ack=27064 Win=65535 Len=1169 [TCP segment of a reassembled PDU]"
"10.115483","5.9.29.183","172.19.0.3","TCP","1504","9002 → 43520 [PSH, ACK] Seq=494673 Ack=27064 Win=65535 Len=1448 [TCP segment of a reassembled PDU]"
"10.115516","172.19.0.3","5.9.29.183","TCP","56","43520 → 9002 [ACK] Seq=27064 Ack=496121 Win=11879 Len=0"
"10.131680","5.9.29.183","172.19.0.3","TLSv1.2","851","Application Data"
"10.149077","5.9.29.183","172.19.0.3","TCP","1504","[TCP segment of a reassembled PDU]"
"10.149096","172.19.0.3","5.9.29.183","TCP","56","43520 → 9002 [ACK] Seq=27064 Ack=498364 Win=11911 Len=0"
"10.149416","5.9.29.183","172.19.0.3","TCP","1504","9002 → 43520 [PSH, ACK] Seq=498364 Ack=27064 Win=65535 Len=1448 [TCP segment of a reassembled PDU]"
"10.149500","5.9.29.183","172.19.0.3","TLSv1.2","1237","Application Data"
"10.149541","172.19.0.3","5.9.29.183","TCP","56","43520 → 9002 [ACK] Seq=27064 Ack=500993 Win=11911 Len=0"
"10.165213","5.9.29.183","172.19.0.3","TLSv1.2","663","Application Data"
"10.169389","172.19.0.3","5.9.29.183","TLSv1.2","599","Application Data"
"10.169796","5.9.29.183","172.19.0.3","TCP","56","9002 → 43520 [ACK] Seq=501600 Ack=27607 Win=65535 Len=0"
"10.559182","5.9.29.183","172.19.0.3","TLSv1.2","599","Application Data"
"10.559946","172.19.0.3","5.9.29.183","TLSv1.2","599","Application Data"
"10.560381","5.9.29.183","172.19.0.3","TCP","56","9002 → 43520 [ACK] Seq=502143 Ack=28150 Win=65535 Len=0"
"10.898757","5.9.29.183","172.19.0.3","TLSv1.2","599","Application Data"
"10.917986","5.9.29.183","172.19.0.3","TCP","1516","[TCP segment of a reassembled PDU]"
"10.918010","172.19.0.3","5.9.29.183","TCP","56","43520 → 9002 [ACK] Seq=28150 Ack=504146 Win=11911 Len=0"
"10.918070","5.9.29.183","172.19.0.3","TCP","1516","9002 → 43520 [PSH, ACK] Seq=504146 Ack=28150 Win=65535 Len=1460 [TCP segment of a reassembled PDU]"
"10.918088","5.9.29.183","172.19.0.3","TLSv1.2","763","Application Data"
"10.918320","172.19.0.3","5.9.29.183","TCP","56","43520 → 9002 [ACK] Seq=28150 Ack=506313 Win=11895 Len=0"
"10.933874","5.9.29.183","172.19.0.3","TCP","1516","[TCP segment of a reassembled PDU]"
"10.933933","5.9.29.183","172.19.0.3","TCP","1492","9002 → 43520 [PSH, ACK] Seq=507773 Ack=28150 Win=65535 Len=1436 [TCP segment of a reassembled PDU]"
"10.933949","172.19.0.3","5.9.29.183","TCP","56","43520 → 9002 [ACK] Seq=28150 Ack=509209 Win=11903 Len=0"
"10.934014","5.9.29.183","172.19.0.3","TLSv1.2","787","Application Data"
"10.947496","5.9.29.183","172.19.0.3","TCP","1516","[TCP segment of a reassembled PDU]"
"10.947518","172.19.0.3","5.9.29.183","TCP","56","43520 → 9002 [ACK] Seq=28150 Ack=511400 Win=11911 Len=0"
"10.947576","5.9.29.183","172.19.0.3","TCP","1516","9002 → 43520 [PSH, ACK] Seq=511400 Ack=28150 Win=65535 Len=1460 [TCP segment of a reassembled PDU]"
"10.947589","5.9.29.183","172.19.0.3","TLSv1.2","1480","Application Data [TCP segment of a reassembled PDU]"
"10.947781","172.19.0.3","5.9.29.183","TCP","56","43520 → 9002 [ACK] Seq=28150 Ack=514284 Win=11895 Len=0"
"10.949981","5.9.29.183","172.19.0.3","TLSv1.2","396","Application Data"
"10.964733","5.9.29.183","172.19.0.3","TCP","1504","[TCP segment of a reassembled PDU]"
"10.964756","172.19.0.3","5.9.29.183","TCP","56","43520 → 9002 [ACK] Seq=28150 Ack=516072 Win=11911 Len=0"
"10.965137","5.9.29.183","172.19.0.3","TCP","1516","9002 → 43520 [PSH, ACK] Seq=516072 Ack=28150 Win=65535 Len=1460 [TCP segment of a reassembled PDU]"
"10.965179","5.9.29.183","172.19.0.3","TLSv1.2","1516","Application Data [TCP segment of a reassembled PDU]"
"10.965186","5.9.29.183","172.19.0.3","TCP","1516","9002 → 43520 [PSH, ACK] Seq=518992 Ack=28150 Win=65535 Len=1460 [TCP segment of a reassembled PDU]"
"10.965200","5.9.29.183","172.19.0.3","TCP","1468","9002 → 43520 [PSH, ACK] Seq=520452 Ack=28150 Win=65535 Len=1412 [TCP segment of a reassembled PDU]"
"10.965333","5.9.29.183","172.19.0.3","TLSv1.2","1516","Application Data [TCP segment of a reassembled PDU]"
"10.965337","5.9.29.183","172.19.0.3","TCP","1516","9002 → 43520 [PSH, ACK] Seq=523324 Ack=28150 Win=65535 Len=1460 [TCP segment of a reassembled PDU]"
"10.965338","5.9.29.183","172.19.0.3","TCP","1516","9002 → 43520 [PSH, ACK] Seq=524784 Ack=28150 Win=65535 Len=1460 [TCP segment of a reassembled PDU]"
"10.965340","5.9.29.183","172.19.0.3","TLSv1.2","1516","Application Data [TCP segment of a reassembled PDU]"
"10.965341","5.9.29.183","172.19.0.3","TCP","1516","9002 → 43520 [PSH, ACK] Seq=527704 Ack=28150 Win=65535 Len=1460 [TCP segment of a reassembled PDU]"
"10.965349","172.19.0.3","5.9.29.183","TCP","56","43520 → 9002 [ACK] Seq=28150 Ack=521864 Win=11887 Len=0"
"10.965350","5.9.29.183","172.19.0.3","TCP","185","9002 → 43520 [PSH, ACK] Seq=529164 Ack=28150 Win=65535 Len=129 [TCP segment of a reassembled PDU]"
"10.965434","5.9.29.183","172.19.0.3","TCP","1315","9002 → 43520 [PSH, ACK] Seq=529293 Ack=28150 Win=65535 Len=1259 [TCP segment of a reassembled PDU]"
"10.965520","172.19.0.3","5.9.29.183","TCP","56","43520 → 9002 [ACK] Seq=28150 Ack=530552 Win=11828 Len=0"
"10.965764","172.19.0.3","5.9.29.183","TLSv1.2","599","Application Data"
"10.965910","5.9.29.183","172.19.0.3","TLSv1.2","178","Application Data"
"10.965994","5.9.29.183","172.19.0.3","TCP","56","9002 → 43520 [ACK] Seq=530674 Ack=28693 Win=65535 Len=0"
"10.975748","172.19.0.3","5.9.29.183","TLSv1.2","599","Application Data"
"10.976195","5.9.29.183","172.19.0.3","TCP","56","9002 → 43520 [ACK] Seq=530674 Ack=29236 Win=65535 Len=0"
"10.981266","5.9.29.183","172.19.0.3","TCP","1516","[TCP segment of a reassembled PDU]"
"10.981334","5.9.29.183","172.19.0.3","TCP","1492","9002 → 43520 [PSH, ACK] Seq=532134 Ack=29236 Win=65535 Len=1436 [TCP segment of a reassembled PDU]"
"10.981343","5.9.29.183","172.19.0.3","TLSv1.2","1516","Application Data [TCP segment of a reassembled PDU]"
"10.981377","5.9.29.183","172.19.0.3","TCP","1516","9002 → 43520 [PSH, ACK] Seq=535030 Ack=29236 Win=65535 Len=1460 [TCP segment of a reassembled PDU]"
"10.981381","5.9.29.183","172.19.0.3","TCP","1480","9002 → 43520 [PSH, ACK] Seq=536490 Ack=29236 Win=65535 Len=1424 [TCP segment of a reassembled PDU]"
"10.981384","5.9.29.183","172.19.0.3","TLSv1.2","70","Application Data"
"10.981460","172.19.0.3","5.9.29.183","TCP","56","43520 → 9002 [ACK] Seq=29236 Ack=537928 Win=11877 Len=0"
"10.998343","5.9.29.183","172.19.0.3","TCP","1504","[TCP segment of a reassembled PDU]"
"10.998452","5.9.29.183","172.19.0.3","TCP","1504","9002 → 43520 [PSH, ACK] Seq=539376 Ack=29236 Win=65535 Len=1448 [TCP segment of a reassembled PDU]"
"10.998470","172.19.0.3","5.9.29.183","TCP","56","43520 → 9002 [ACK] Seq=29236 Ack=540824 Win=11903 Len=0"
"10.998545","5.9.29.183","172.19.0.3","TLSv1.2","1237","Application Data"
"10.998552","5.9.29.183","172.19.0.3","TCP","1516","[TCP segment of a reassembled PDU]"
"10.998577","172.19.0.3","5.9.29.183","TCP","56","43520 → 9002 [ACK] Seq=29236 Ack=543465 Win=11887 Len=0"
"10.998865","5.9.29.183","172.19.0.3","TCP","1516","9002 → 43520 [PSH, ACK] Seq=543465 Ack=29236 Win=65535 Len=1460 [TCP segment of a reassembled PDU]"
"10.998876","5.9.29.183","172.19.0.3","TLSv1.2","1516","Application Data [TCP segment of a reassembled PDU]"
"10.998887","172.19.0.3","5.9.29.183","TCP","56","43520 → 9002 [ACK] Seq=29236 Ack=546385 Win=11903 Len=0"
"10.998890","5.9.29.183","172.19.0.3","TCP","1516","9002 → 43520 [PSH, ACK] Seq=546385 Ack=29236 Win=65535 Len=1460 [TCP segment of a reassembled PDU]"
"10.998928","5.9.29.183","172.19.0.3","TCP","1456","9002 → 43520 [PSH, ACK] Seq=547845 Ack=29236 Win=65535 Len=1400 [TCP segment of a reassembled PDU]"
"10.998956","172.19.0.3","5.9.29.183","TCP","56","43520 → 9002 [ACK] Seq=29236 Ack=549245 Win=11885 Len=0"
"11.014360","5.9.29.183","172.19.0.3","TLSv1.2","648","Application Data"
"11.015189","5.9.29.183","172.19.0.3","TCP","1516","[TCP segment of a reassembled PDU]"
"11.015199","172.19.0.3","5.9.29.183","TCP","56","43520 → 9002 [ACK] Seq=29236 Ack=551297 Win=11911 Len=0"
"11.015235","5.9.29.183","172.19.0.3","TCP","1516","9002 → 43520 [PSH, ACK] Seq=551297 Ack=29236 Win=65535 Len=1460 [TCP segment of a reassembled PDU]"
"11.015319","5.9.29.183","172.19.0.3","TLSv1.2","1480","Application Data [TCP segment of a reassembled PDU]"
"11.015324","5.9.29.183","172.19.0.3","TCP","1516","9002 → 43520 [PSH, ACK] Seq=554181 Ack=29236 Win=65535 Len=1460 [TCP segment of a reassembled PDU]"
"11.015327","5.9.29.183","172.19.0.3","TCP","1516","9002 → 43520 [PSH, ACK] Seq=555641 Ack=29236 Win=65535 Len=1460 [TCP segment of a reassembled PDU]"
"11.015349","172.19.0.3","5.9.29.183","TCP","56","43520 → 9002 [ACK] Seq=29236 Ack=557101 Win=11879 Len=0"
"11.015389","5.9.29.183","172.19.0.3","TLSv1.2","1516","Application Data [TCP segment of a reassembled PDU]"
"11.015395","5.9.29.183","172.19.0.3","TCP","1516","9002 → 43520 [PSH, ACK] Seq=558561 Ack=29236 Win=65535 Len=1460 [TCP segment of a reassembled PDU]"
"11.015473","5.9.29.183","172.19.0.3","TCP","1516","9002 → 43520 [PSH, ACK] Seq=560021 Ack=29236 Win=65535 Len=1460 [TCP segment of a reassembled PDU]"
"11.015501","5.9.29.183","172.19.0.3","TLSv1.2","1516","Application Data [TCP segment of a reassembled PDU]"
"11.015502","172.19.0.3","5.9.29.183","TCP","56","43520 → 9002 [ACK] Seq=29236 Ack=560021 Win=11863 Len=0"
"11.015522","5.9.29.183","172.19.0.3","TCP","1516","9002 → 43520 [PSH, ACK] Seq=562941 Ack=29236 Win=65535 Len=1460 [TCP segment of a reassembled PDU]"
"11.015525","5.9.29.183","172.19.0.3","TCP","1420","9002 → 43520 [PSH, ACK] Seq=564401 Ack=29236 Win=65535 Len=1364 [TCP segment of a reassembled PDU]"
"11.015549","172.19.0.3","5.9.29.183","TCP","56","43520 → 9002 [ACK] Seq=29236 Ack=565765 Win=11830 Len=0"
"11.015764","172.19.0.3","5.9.29.183","TLSv1.2","599","Application Data"
"11.015922","5.9.29.183","172.19.0.3","TCP","56","9002 → 43520 [ACK] Seq=565765 Ack=29779 Win=65535 Len=0"
"11.023603","5.9.29.183","172.19.0.3","TLSv1.2","1504","Application Data, Application Data"
"11.030417","5.9.29.183","172.19.0.3","TLSv1.2","330","Application Data"
"11.030454","172.19.0.3","5.9.29.183","TCP","56","43520 → 9002 [ACK] Seq=29779 Ack=567487 Win=11911 Len=0"
"11.031147","5.9.29.183","172.19.0.3","TCP","1516","[TCP segment of a reassembled PDU]"
"11.031162","5.9.29.183","172.19.0.3","TCP","1492","9002 → 43520 [PSH, ACK] Seq=568947 Ack=29779 Win=65535 Len=1436 [TCP segment of a reassembled PDU]"
"11.031217","172.19.0.3","5.9.29.183","TCP","56","43520 → 9002 [ACK] Seq=29779 Ack=570383 Win=11903 Len=0"
"11.032206","5.9.29.183","172.19.0.3","TLSv1.2","1516","Application Data [TCP segment of a reassembled PDU]"
"11.032241","5.9.29.183","172.19.0.3","TCP","1492","9002 → 43520 [PSH, ACK] Seq=571843 Ack=29779 Win=65535 Len=1436 [TCP segment of a reassembled PDU]"
"11.032256","172.19.0.3","5.9.29.183","TCP","56","43520 → 9002 [ACK] Seq=29779 Ack=573279 Win=11903 Len=0"
"11.032325","5.9.29.183","172.19.0.3","TCP","1516","9002 → 43520 [PSH, ACK] Seq=573279 Ack=29779 Win=65535 Len=1460 [TCP segment of a reassembled PDU]"
"11.032330","5.9.29.183","172.19.0.3","TLSv1.2","1492","Application Data [TCP segment of a reassembled PDU]"
"11.032398","172.19.0.3","5.9.29.183","TCP","56","43520 → 9002 [ACK] Seq=29779 Ack=576175 Win=11885 Len=0"
"11.032800","172.19.0.3","5.9.29.183","TLSv1.2","599","Application Data"
"11.033016","5.9.29.183","172.19.0.3","TCP","56","9002 → 43520 [ACK] Seq=576175 Ack=30322 Win=65535 Len=0"
"11.045986","5.9.29.183","172.19.0.3","TLSv1.2","193","Application Data"
"11.054751","5.9.29.183","172.19.0.3","TCP","1516","[TCP segment of a reassembled PDU]"
"11.054775","172.19.0.3","5.9.29.183","TCP","56","43520 → 9002 [ACK] Seq=30322 Ack=577772 Win=11911 Len=0"
"11.054836","5.9.29.183","172.19.0.3","TCP","1492","9002 → 43520 [PSH, ACK] Seq=577772 Ack=30322 Win=65535 Len=1436 [TCP segment of a reassembled PDU]"
"11.061400","5.9.29.183","172.19.0.3","TLSv1.2","273","Application Data"
"11.061423","172.19.0.3","5.9.29.183","TCP","56","43520 → 9002 [ACK] Seq=30322 Ack=579425 Win=11911 Len=0"
