_ws.col.Time,_ws.col.Source,_ws.col.Destination,_ws.col.Protocol,_ws.col.Length,_ws.col.Info
"0.000000","172.19.0.3","5.9.29.183","TLSv1.2","599","Application Data"
"0.000304","5.9.29.183","172.19.0.3","TCP","56","9002 → 43520 [ACK] Seq=1 Ack=544 Win=65535 Len=0"
"0.316148","5.9.29.183","172.19.0.3","TLSv1.2","599","Application Data"
"0.317003","172.19.0.3","5.9.29.183","TLSv1.2","2141","Application Data"
"0.317700","5.9.29.183","172.19.0.3","TCP","56","9002 → 43520 [ACK] Seq=544 Ack=2629 Win=65535 Len=0"
"0.884415","5.9.29.183","172.19.0.3","TCP","1516","[TCP segment of a reassembled PDU]"
"0.884447","5.9.29.183","172.19.0.3","TLSv1.2","167","Application Data"
"0.884586","172.19.0.3","5.9.29.183","TCP","56","43520 → 9002 [ACK] Seq=2629 Ack=2115 Win=11901 Len=0"
"0.888989","172.19.0.3","5.9.29.183","TLSv1.2","599","Application Data"
"0.889301","5.9.29.183","172.19.0.3","TCP","56","9002 → 43520 [ACK] Seq=2115 Ack=3172 Win=65535 Len=0"
"1.237514","5.9.29.183","172.19.0.3","TLSv1.2","599","Application Data"
"1.238377","172.19.0.3","5.9.29.183","TLSv1.2","599","Application Data"
"1.238774","5.9.29.183","172.19.0.3","TCP","56","9002 → 43520 [ACK] Seq=2658 Ack=3715 Win=65535 Len=0"
"1.619534","5.9.29.183","172.19.0.3","TCP","1504","[TCP segment of a reassembled PDU]"
"1.619810","5.9.29.183","172.19.0.3","TCP","1504","9002 → 43520 [PSH, ACK] Seq=4106 Ack=3715 Win=65535 Len=1448 [TCP segment of a reassembled PDU]"
"1.619823","172.19.0.3","5.9.29.183","TCP","56","43520 → 9002 [ACK] Seq=3715 Ack=5554 Win=11911 Len=0"
"1.619988","5.9.29.183","172.19.0.3","TLSv1.2","787","Application Data"
"1.647023","5.9.29.183","172.19.0.3","TCP","1516","[TCP segment of a reassembled PDU]"
"1.647050","172.19.0.3","5.9.29.183","TCP","56","43520 → 9002 [ACK] Seq=3715 Ack=7745 Win=11911 Len=0"
"1.647062","5.9.29.183","172.19.0.3","TCP","1516","9002 → 43520 [PSH, ACK] Seq=7745 Ack=3715 Win=65535 Len=1460 [TCP segment of a reassembled PDU]"
"1.647069","5.9.29.183","172.19.0.3","TLSv1.2","1213","Application Data"
"1.647071","5.9.29.183","172.19.0.3","TCP","1516","[TCP segment of a reassembled PDU]"
"1.647073","5.9.29.183","172.19.0.3","TCP","1492","9002 → 43520 [PSH, ACK] Seq=11822 Ack=3715 Win=65535 Len=1436 [TCP segment of a reassembled PDU]"
"1.647201","172.19.0.3","5.9.29.183","TCP","56","43520 → 9002 [ACK] Seq=3715 Ack=13258 Win=11879 Len=0"
"1.647399","172.19.0.3","5.9.29.183","TLSv1.2","599","Application Data"
"1.647622","5.9.29.183","172.19.0.3","TCP","56","9002 → 43520 [ACK] Seq=13258 Ack=4258 Win=65535 Len=0"
"1.662886","5.9.29.183","172.19.0.3","TLSv1.2","851","Application Data"
"1.679320","5.9.29.183","172.19.0.3","TCP","1516","[TCP segment of a reassembled PDU]"
"1.679342","172.19.0.3","5.9.29.183","TCP","56","43520 → 9002 [ACK] Seq=4258 Ack=15513 Win=11911 Len=0"
"1.679357","5.9.29.183","172.19.0.3","TCP","1516","9002 → 43520 [PSH, ACK] Seq=15513 Ack=4258 Win=65535 Len=1460 [TCP segment of a reassembled PDU]"
"1.679364","5.9.29.183","172.19.0.3","TLSv1.2","1213","Application Data"
"1.679538","172.19.0.3","5.9.29.183","TCP","56","43520 → 9002 [ACK] Seq=4258 Ack=18130 Win=11895 Len=0"
"1.694607","5.9.29.183","172.19.0.3","TLSv1.2","663","Application Data"
"1.695344","5.9.29.183","172.19.0.3","TCP","1516","[TCP segment of a reassembled PDU]"
"1.695362","172.19.0.3","5.9.29.183","TCP","56","43520 → 9002 [ACK] Seq=4258 Ack=20197 Win=11911 Len=0"
"1.695373","5.9.29.183","172.19.0.3","TCP","1492","9002 → 43520 [PSH, ACK] Seq=20197 Ack=4258 Win=65535 Len=1436 [TCP segment of a reassembled PDU]"
"1.695591","5.9.29.183","172.19.0.3","TLSv1.2","1516","Application Data [TCP segment of a reassembled PDU]"
"1.695601","5.9.29.183","172.19.0.3","TCP","1516","9002 → 43520 [PSH, ACK] Seq=23093 Ack=4258 Win=65535 Len=1460 [TCP segment of a reassembled PDU]"
"1.695605","5.9.29.183","172.19.0.3","TCP","1480","9002 → 43520 [PSH, ACK] Seq=24553 Ack=4258 Win=65535 Len=1424 [TCP segment of a reassembled PDU]"
"1.695646","172.19.0.3","5.9.29.183","TCP","56","43520 → 9002 [ACK] Seq=4258 Ack=25977 Win=11879 Len=0"
"1.696181","5.9.29.183","172.19.0.3","TLSv1.2","1516","Application Data [TCP segment of a reassembled PDU]"
"1.696192","5.9.29.183","172.19.0.3","TCP","1492","9002 → 43520 [PSH, ACK] Seq=27437 Ack=4258 Win=65535 Len=1436 [TCP segment of a reassembled PDU]"
"1.696200","172.19.0.3","5.9.29.183","TCP","56","43520 → 9002 [ACK] Seq=4258 Ack=28873 Win=11901 Len=0"
"1.709783","5.9.29.183","172.19.0.3","TLSv1.2","1315","Application Data"
"1.710264","172.19.0.3","5.9.29.183","TLSv1.2","599","Application Data"
"1.710621","5.9.29.183","172.19.0.3","TCP","56","9002 → 43520 [ACK] Seq=30132 Ack=4801 Win=65535 Len=0"
"1.711335","5.9.29.183","172.19.0.3","TCP","1516","[TCP segment of a reassembled PDU]"
"1.711349","5.9.29.183","172.19.0.3","TCP","1492","9002 → 43520 [PSH, ACK] Seq=31592 Ack=4801 Win=65535 Len=1436 [TCP segment of a reassembled PDU]"
"1.711518","172.19.0.3","5.9.29.183","TCP","56","43520 → 9002 [ACK] Seq=4801 Ack=33028 Win=11903 Len=0"
"1.725529","5.9.29.183","172.19.0.3","TLSv1.2","1504","Application Data [TCP segment of a reassembled PDU]"
"1.725688","5.9.29.183","172.19.0.3","TCP","1516","9002 → 43520 [PSH, ACK] Seq=34476 Ack=4801 Win=65535 Len=1460 [TCP segment of a reassembled PDU]"
"1.725703","172.19.0.3","5.9.29.183","TCP","56","43520 → 9002 [ACK] Seq=4801 Ack=35936 Win=11903 Len=0"
"1.725706","5.9.29.183","172.19.0.3","TCP","1516","9002 → 43520 [PSH, ACK] Seq=35936 Ack=4801 Win=65535 Len=1460 [TCP segment of a reassembled PDU]"
"1.725710","5.9.29.183","172.19.0.3","TLSv1.2","1480","Application Data [TCP segment of a reassembled PDU]"
"1.725713","5.9.29.183","172.19.0.3","TLSv1.2","707","Application Data"
"1.725830","172.19.0.3","5.9.29.183","TCP","56","43520 → 9002 [ACK] Seq=4801 Ack=39471 Win=11879 Len=0"
"1.727804","5.9.29.183","172.19.0.3","TCP","1504","[TCP segment of a reassembled PDU]"
"1.728418","5.9.29.183","172.19.0.3","TCP","1516","9002 → 43520 [PSH, ACK] Seq=40919 Ack=4801 Win=65535 Len=1460 [TCP segment of a reassembled PDU]"
"1.728432","172.19.0.3","5.9.29.183","TCP","56","43520 → 9002 [ACK] Seq=4801 Ack=42379 Win=11911 Len=0"
"1.728440","5.9.29.183","172.19.0.3","TLSv1.2","1516","Application Data [TCP segment of a reassembled PDU]"
"1.728446","5.9.29.183","172.19.0.3","TCP","1480","9002 → 43520 [PSH, ACK] Seq=43839 Ack=4801 Win=65535 Len=1424 [TCP segment of a reassembled PDU]"
"1.728449","5.9.29.183","172.19.0.3","TCP","623","9002 → 43520 [PSH, ACK] Seq=45263 Ack=4801 Win=65535 Len=567 [TCP segment of a reassembled PDU]"
"1.728551","5.9.29.183","172.19.0.3","TCP","1516","9002 → 43520 [PSH, ACK] Seq=45830 Ack=4801 Win=65535 Len=1460 [TCP segment of a reassembled PDU]"
"1.728561","5.9.29.183","172.19.0.3","TLSv1.2","1516","Application Data [TCP segment of a reassembled PDU]"
"1.728564","5.9.29.183","172.19.0.3","TCP","1516","9002 → 43520 [PSH, ACK] Seq=48750 Ack=4801 Win=65535 Len=1460 [TCP segment of a reassembled PDU]"
"1.728606","172.19.0.3","5.9.29.183","TCP","56","43520 → 9002 [ACK] Seq=4801 Ack=50210 Win=11863 Len=0"
"1.728840","5.9.29.183","172.19.0.3","TCP","901","9002 → 43520 [PSH, ACK] Seq=50210 Ack=4801 Win=65535 Len=845 [TCP segment of a reassembled PDU]"
"1.744734","5.9.29.183","172.19.0.3","TLSv1.2","381","Application Data"
"1.744852","172.19.0.3","5.9.29.183","TCP","56","43520 → 9002 [ACK] Seq=4801 Ack=51380 Win=11911 Len=0"
"1.759294","5.9.29.183","172.19.0.3","TCP","1504","[TCP segment of a reassembled PDU]"
"1.759703","5.9.29.183","172.19.0.3","TCP","1504","9002 → 43520 [PSH, ACK] Seq=52828 Ack=4801 Win=65535 Len=1448 [TCP segment of a reassembled PDU]"
"1.759713","5.9.29.183","172.19.0.3","TLSv1.2","1516","Application Data [TCP segment of a reassembled PDU]"
"1.759724","5.9.29.183","172.19.0.3","TCP","1516","9002 → 43520 [PSH, ACK] Seq=55736 Ack=4801 Win=65535 Len=1460 [TCP segment of a reassembled PDU]"
"1.759777","5.9.29.183","172.19.0.3","TCP","1516","9002 → 43520 [PSH, ACK] Seq=57196 Ack=4801 Win=65535 Len=1460 [TCP segment of a reassembled PDU]"
"1.759782","5.9.29.183","172.19.0.3","TLSv1.2","1516","Application Data [TCP segment of a reassembled PDU]"
"1.759828","5.9.29.183","172.19.0.3","TCP","1456","9002 → 43520 [PSH, ACK] Seq=60116 Ack=4801 Win=65535 Len=1400 [TCP segment of a reassembled PDU]"
"1.759886","5.9.29.183","172.19.0.3","TCP","1516","9002 → 43520 [PSH, ACK] Seq=61516 Ack=4801 Win=65535 Len=1460 [TCP segment of a reassembled PDU]"
"1.759891","5.9.29.183","172.19.0.3","TLSv1.2","1516","Application Data [TCP segment of a reassembled PDU]"
"1.759938","5.9.29.183","172.19.0.3","TCP","1516","9002 → 43520 [PSH, ACK] Seq=64436 Ack=4801 Win=65535 Len=1460 [TCP segment of a reassembled PDU]"
"1.759978","5.9.29.183","172.19.0.3","TCP","1468","9002 → 43520 [PSH, ACK] Seq=65896 Ack=4801 Win=65535 Len=1412 [TCP segment of a reassembled PDU]"
"1.759989","172.19.0.3","5.9.29.183","TCP","56","43520 → 9002 [ACK] Seq=4801 Ack=64436 Win=11853 Len=0"
"1.760204","172.19.0.3","5.9.29.183","TLSv1.2","599","Application Data"
"1.760393","5.9.29.183","172.19.0.3","TCP","56","9002 → 43520 [ACK] Seq=67308 Ack=5344 Win=65535 Len=0"
"1.760448","5.9.29.183","172.19.0.3","TLSv1.2","721","Application Data, Application Data"
"1.765978","5.9.29.183","172.19.0.3","TCP","1504","[TCP segment of a reassembled PDU]"
"1.766004","172.19.0.3","5.9.29.183","TCP","56","43520 → 9002 [ACK] Seq=5344 Ack=69421 Win=11911 Len=0"
"1.766181","5.9.29.183","172.19.0.3","TCP","1504","9002 → 43520 [PSH, ACK] Seq=69421 Ack=5344 Win=65535 Len=1448 [TCP segment of a reassembled PDU]"
"1.771347","172.19.0.3","5.9.29.183","TLSv1.2","599","Application Data"
"1.771856","5.9.29.183","172.19.0.3","TCP","56","9002 → 43520 [ACK] Seq=70869 Ack=5887 Win=65535 Len=0"
"1.775727","5.9.29.183","172.19.0.3","TLSv1.2","1504","Application Data, Application Data"
"1.776248","5.9.29.183","172.19.0.3","TCP","1516","9002 → 43520 [PSH, ACK] Seq=72317 Ack=5887 Win=65535 Len=1460 [TCP segment of a reassembled PDU]"
"1.776262","5.9.29.183","172.19.0.3","TCP","1492","9002 → 43520 [PSH, ACK] Seq=73777 Ack=5887 Win=65535 Len=1436 [TCP segment of a reassembled PDU]"
"1.776405","172.19.0.3","5.9.29.183","TCP","56","43520 → 9002 [ACK] Seq=5887 Ack=75213 Win=11895 Len=0"
"1.776489","5.9.29.183","172.19.0.3","TLSv1.2","1516","Application Data [TCP segment of a reassembled PDU]"
"1.776499","5.9.29.183","172.19.0.3","TCP","1516","9002 → 43520 [PSH, ACK] Seq=76673 Ack=5887 Win=65535 Len=1460 [TCP segment of a reassembled PDU]"
"1.776503","5.9.29.183","172.19.0.3","TCP","1480","9002 → 43520 [PSH, ACK] Seq=78133 Ack=5887 Win=65535 Len=1424 [TCP segment of a reassembled PDU]"
"1.776583","172.19.0.3","5.9.29.183","TCP","56","43520 → 9002 [ACK] Seq=5887 Ack=79557 Win=11871 Len=0"
"1.776591","5.9.29.183","172.19.0.3","TLSv1.2","410","Application Data"
"1.817514","172.19.0.3","5.9.29.183","TCP","56","43520 → 9002 [ACK] Seq=5887 Ack=79911 Win=11911 Len=0"
"1.819608","5.9.29.183","172.19.0.3","TCP","1516","[TCP segment of a reassembled PDU]"
"1.819698","5.9.29.183","172.19.0.3","TCP","1492","9002 → 43520 [PSH, ACK] Seq=81371 Ack=5887 Win=65535 Len=1436 [TCP segment of a reassembled PDU]"
"1.819760","172.19.0.3","5.9.29.183","TCP","56","43520 → 9002 [ACK] Seq=5887 Ack=82807 Win=11903 Len=0"
"1.820212","5.9.29.183","172.19.0.3","TLSv1.2","1237","Application Data"
"1.820293","172.19.0.3","5.9.29.183","TCP","56","43520 → 9002 [ACK] Seq=5887 Ack=83988 Win=11911 Len=0"
"1.820488","172.19.0.3","5.9.29.183","TLSv1.2","599","Application Data"
"1.820650","5.9.29.183","172.19.0.3","TCP","56","9002 → 43520 [ACK] Seq=83988 Ack=6430 Win=65535 Len=0"
"1.830415","172.19.0.3","5.9.29.183","TLSv1.2","1113","Application Data"
"1.830622","5.9.29.183","172.19.0.3","TCP","56","9002 → 43520 [ACK] Seq=83988 Ack=7487 Win=65535 Len=0"
"1.835717","5.9.29.183","172.19.0.3","TLSv1.2","149","Application Data"
"1.876858","172.19.0.3","5.9.29.183","TCP","56","43520 → 9002 [ACK] Seq=7487 Ack=84081 Win=11911 Len=0"
"2.209700","5.9.29.183","172.19.0.3","TLSv1.2","599","Application Data"
"2.209760","172.19.0.3","5.9.29.183","TCP","56","43520 → 9002 [ACK] Seq=7487 Ack=84624 Win=11911 Len=0"
"2.210669","172.19.0.3","5.9.29.183","TLSv1.2","599","Application Data"
"2.210872","5.9.29.183","172.19.0.3","TCP","56","9002 → 43520 [ACK] Seq=84624 Ack=8030 Win=65535 Len=0"
"2.574889","5.9.29.183","172.19.0.3","TCP","1516","[TCP segment of a reassembled PDU]"
"2.574956","5.9.29.183","172.19.0.3","TCP","1492","9002 → 43520 [PSH, ACK] Seq=86084 Ack=8030 Win=65535 Len=1436 [TCP segment of a reassembled PDU]"
"2.574965","5.9.29.183","172.19.0.3","TLSv1.2","787","Application Data"
"2.575066","172.19.0.3","5.9.29.183","TCP","56","43520 → 9002 [ACK] Seq=8030 Ack=88251 Win=11895 Len=0"
"2.607532","5.9.29.183","172.19.0.3","TCP","1504","[TCP segment of a reassembled PDU]"
"2.607654","5.9.29.183","172.19.0.3","TCP","1516","9002 → 43520 [PSH, ACK] Seq=89699 Ack=8030 Win=65535 Len=1460 [TCP segment of a reassembled PDU]"
"2.607683","172.19.0.3","5.9.29.183","TCP","56","43520 → 9002 [ACK] Seq=8030 Ack=91159 Win=11903 Len=0"
"2.607689","5.9.29.183","172.19.0.3","TLSv1.2","775","Application Data"
"2.619046","5.9.29.183","172.19.0.3","TCP","1516","[TCP segment of a reassembled PDU]"
"2.619063","172.19.0.3","5.9.29.183","TCP","56","43520 → 9002 [ACK] Seq=8030 Ack=93338 Win=11911 Len=0"
"2.619233","5.9.29.183","172.19.0.3","TCP","1516","9002 → 43520 [PSH, ACK] Seq=93338 Ack=8030 Win=65535 Len=1460 [TCP segment of a reassembled PDU]"
"2.619239","5.9.29.183","172.19.0.3","TLSv1.2","1516","Application Data [TCP segment of a reassembled PDU]"
"2.619242","5.9.29.183","172.19.0.3","TCP","1468","9002 → 43520 [PSH, ACK] Seq=96258 Ack=8030 Win=65535 Len=1412 [TCP segment of a reassembled PDU]"
"2.619246","5.9.29.183","172.19.0.3","TCP","1504","9002 → 43520 [PSH, ACK] Seq=97670 Ack=8030 Win=65535 Len=1448 [TCP segment of a reassembled PDU]"
"2.619259","172.19.0.3","5.9.29.183","TCP","56","43520 → 9002 [ACK] Seq=8030 Ack=97670 Win=11887 Len=0"
"2.623294","5.9.29.183","172.19.0.3","TLSv1.2","1127","Application Data, Application Data"
"2.623301","172.19.0.3","5.9.29.183","TCP","56","43520 → 9002 [ACK] Seq=8030 Ack=100189 Win=11911 Len=0"
"2.635565","5.9.29.183","172.19.0.3","TCP","1516","[TCP segment of a reassembled PDU]"
"2.635608","5.9.29.183","172.19.0.3","TCP","1516","9002 → 43520 [PSH, ACK] Seq=101649 Ack=8030 Win=65535 Len=1460 [TCP segment of a reassembled PDU]"
"2.635614","5.9.29.183","172.19.0.3","TLSv1.2","1480","Application Data [TCP segment of a reassembled PDU]"
"2.635760","172.19.0.3","5.9.29.183","TCP","56","43520 → 9002 [ACK] Seq=8030 Ack=104533 Win=11895 Len=0"
"2.638998","5.9.29.183","172.19.0.3","TLSv1.2","396","Application Data"
"2.657702","5.9.29.183","172.19.0.3","TCP","1504","[TCP segment of a reassembled PDU]"
"2.657724","172.19.0.3","5.9.29.183","TCP","56","43520 → 9002 [ACK] Seq=8030 Ack=106321 Win=11911 Len=0"
"2.658239","5.9.29.183","172.19.0.3","TCP","1516","9002 → 43520 [PSH, ACK] Seq=106321 Ack=8030 Win=65535 Len=1460 [TCP segment of a reassembled PDU]"
"2.658286","5.9.29.183","172.19.0.3","TLSv1.2","775","Application Data"
"2.658461","172.19.0.3","5.9.29.183","TCP","56","43520 → 9002 [ACK] Seq=8030 Ack=108500 Win=11911 Len=0"
"2.668935","5.9.29.183","172.19.0.3","TCP","1516","[TCP segment of a reassembled PDU]"
"2.668985","5.9.29.183","172.19.0.3","TCP","1462","9002 → 43520 [PSH, ACK] Seq=109960 Ack=8030 Win=65535 Len=1406 [TCP segment of a reassembled PDU]"
"2.668993","5.9.29.183","172.19.0.3","TLSv1.2","1516","Application Data [TCP segment of a reassembled PDU]"
"2.668995","5.9.29.183","172.19.0.3","TCP","1516","9002 → 43520 [PSH, ACK] Seq=112826 Ack=8030 Win=65535 Len=1460 [TCP segment of a reassembled PDU]"
"2.668998","5.9.29.183","172.19.0.3","TCP","1516","9002 → 43520 [PSH, ACK] Seq=114286 Ack=8030 Win=65535 Len=1460 [TCP segment of a reassembled PDU]"
"2.669001","5.9.29.183","172.19.0.3","TLSv1.2","1498","Application Data [TCP segment of a reassembled PDU]"
"2.669112","172.19.0.3","5.9.29.183","TCP","56","43520 → 9002 [ACK] Seq=8030 Ack=117188 Win=11871 Len=0"
"2.669337","172.19.0.3","5.9.29.183","TLSv1.2","599","Application Data"
"2.669549","5.9.29.183","172.19.0.3","TCP","56","9002 → 43520 [ACK] Seq=117188 Ack=8573 Win=65535 Len=0"
"2.673889","5.9.29.183","172.19.0.3","TLSv1.2","193","Application Data"
"2.680523","172.19.0.3","5.9.29.183","TLSv1.2","599","Application Data"
"2.681005","5.9.29.183","172.19.0.3","TCP","56","9002 → 43520 [ACK] Seq=117325 Ack=9116 Win=65535 Len=0"
"2.706006","5.9.29.183","172.19.0.3","TCP","1504","[TCP segment of a reassembled PDU]"
"2.706188","5.9.29.183","172.19.0.3","TCP","1504","9002 → 43520 [PSH, ACK] Seq=118773 Ack=9116 Win=65535 Len=1448 [TCP segment of a reassembled PDU]"
"2.706228","172.19.0.3","5.9.29.183","TCP","56","43520 → 9002 [ACK] Seq=9116 Ack=120221 Win=11903 Len=0"
"2.706284","5.9.29.183","172.19.0.3","TLSv1.2","273","Application Data"
"2.710583","172.19.0.3","5.9.29.183","TLSv1.2","599","Application Data"
"2.710790","5.9.29.183","172.19.0.3","TCP","56","9002 → 43520 [ACK] Seq=120438 Ack=9659 Win=65535 Len=0"
"3.113199","5.9.29.183","172.19.0.3","TLSv1.2","599","Application Data"
"3.113996","172.19.0.3","5.9.29.183","TLSv1.2","599","Application Data"
"3.114213","5.9.29.183","172.19.0.3","TCP","56","9002 → 43520 [ACK] Seq=120981 Ack=10202 Win=65535 Len=0"
"3.484114","5.9.29.183","172.19.0.3","TCP","1504","[TCP segment of a reassembled PDU]"
"3.484380","5.9.29.183","172.19.0.3","TCP","1504","9002 → 43520 [PSH, ACK] Seq=122429 Ack=10202 Win=65535 Len=1448 [TCP segment of a reassembled PDU]"
"3.484393","172.19.0.3","5.9.29.183","TCP","56","43520 → 9002 [ACK] Seq=10202 Ack=123877 Win=11911 Len=0"
"3.484430","5.9.29.183","172.19.0.3","TLSv1.2","787","Application Data"
"3.495475","5.9.29.183","172.19.0.3","TCP","1516","[TCP segment of a reassembled PDU]"
"3.495497","172.19.0.3","5.9.29.183","TCP","56","43520 → 9002 [ACK] Seq=10202 Ack=126068 Win=11911 Len=0"
"3.495538","5.9.29.183","172.19.0.3","TCP","1492","9002 → 43520 [PSH, ACK] Seq=126068 Ack=10202 Win=65535 Len=1436 [TCP segment of a reassembled PDU]"
"3.495547","5.9.29.183","172.19.0.3","TLSv1.2","1516","Application Data [TCP segment of a reassembled PDU]"
"3.495550","5.9.29.183","172.19.0.3","TCP","1516","9002 → 43520 [PSH, ACK] Seq=128964 Ack=10202 Win=65535 Len=1460 [TCP segment of a reassembled PDU]"
"3.495556","5.9.29.183","172.19.0.3","TCP","1480","9002 → 43520 [PSH, ACK] Seq=130424 Ack=10202 Win=65535 Len=1424 [TCP segment of a reassembled PDU]"
"3.495680","172.19.0.3","5.9.29.183","TCP","56","43520 → 9002 [ACK] Seq=10202 Ack=131848 Win=11877 Len=0"
"3.500451","5.9.29.183","172.19.0.3","TLSv1.2","70","Application Data"
"3.511338","5.9.29.183","172.19.0.3","TCP","1504","[TCP segment of a reassembled PDU]"
"3.511357","172.19.0.3","5.9.29.183","TCP","56","43520 → 9002 [ACK] Seq=10202 Ack=133310 Win=11911 Len=0"
"3.511777","5.9.29.183","172.19.0.3","TCP","1504","9002 → 43520 [PSH, ACK] Seq=133310 Ack=10202 Win=65535 Len=1448 [TCP segment of a reassembled PDU]"
"3.511845","5.9.29.183","172.19.0.3","TLSv1.2","1516","Application Data [TCP segment of a reassembled PDU]"
"3.511851","5.9.29.183","172.19.0.3","TCP","1516","9002 → 43520 [PSH, ACK] Seq=136218 Ack=10202 Win=65535 Len=1460 [TCP segment of a reassembled PDU]"
"3.511877","5.9.29.183","172.19.0.3","TCP","1480","9002 → 43520 [PSH, ACK] Seq=137678 Ack=10202 Win=65535 Len=1424 [TCP segment of a reassembled PDU]"
"3.511881","5.9.29.183","172.19.0.3","TLSv1.2","1504","Application Data [TCP segment of a reassembled PDU]"
"3.511892","172.19.0.3","5.9.29.183","TCP","56","43520 → 9002 [ACK] Seq=10202 Ack=139102 Win=11887 Len=0"
"3.515801","5.9.29.183","172.19.0.3","TLSv1.2","707","Application Data"
"3.515819","172.19.0.3","5.9.29.183","TCP","56","43520 → 9002 [ACK] Seq=10202 Ack=141201 Win=11911 Len=0"
"3.516864","5.9.29.183","172.19.0.3","TCP","1516","[TCP segment of a reassembled PDU]"
"3.516895","5.9.29.183","172.19.0.3","TCP","1492","9002 → 43520 [PSH, ACK] Seq=142661 Ack=10202 Win=65535 Len=1436 [TCP segment of a reassembled PDU]"
"3.516960","172.19.0.3","5.9.29.183","TCP","56","43520 → 9002 [ACK] Seq=10202 Ack=144097 Win=11903 Len=0"
"3.531311","5.9.29.183","172.19.0.3","TLSv1.2","787","Application Data"
"3.547953","5.9.29.183","172.19.0.3","TLSv1.2","1113","Application Data"
"3.547971","172.19.0.3","5.9.29.183","TCP","56","43520 → 9002 [ACK] Seq=10202 Ack=145885 Win=11911 Len=0"
"3.579425","5.9.29.183","172.19.0.3","TCP","1516","[TCP segment of a reassembled PDU]"
"3.579469","5.9.29.183","172.19.0.3","TCP","1492","9002 → 43520 [PSH, ACK] Seq=147345 Ack=10202 Win=65535 Len=1436 [TCP segment of a reassembled PDU]"
"3.579477","5.9.29.183","172.19.0.3","TLSv1.2","787","Application Data"
"3.579625","172.19.0.3","5.9.29.183","TCP","56","43520 → 9002 [ACK] Seq=10202 Ack=149512 Win=11895 Len=0"
"3.579827","172.19.0.3","5.9.29.183","TLSv1.2","599","Application Data"
"3.579976","5.9.29.183","172.19.0.3","TCP","56","9002 → 43520 [ACK] Seq=149512 Ack=10745 Win=65535 Len=0"
"3.606083","5.9.29.183","172.19.0.3","TCP","1516","[TCP segment of a reassembled PDU]"
"3.606129","5.9.29.183","172.19.0.3","TCP","1516","9002 → 43520 [PSH, ACK] Seq=150972 Ack=10745 Win=65535 Len=1460 [TCP segment of a reassembled PDU]"
"3.606135","5.9.29.183","172.19.0.3","TLSv1.2","1213","Application Data"
"3.606137","5.9.29.183","172.19.0.3","TCP","1516","[TCP segment of a reassembled PDU]"
"3.606141","5.9.29.183","172.19.0.3","TLSv1.2","1516","Application Data [TCP segment of a reassembled PDU]"
"3.606171","5.9.29.183","172.19.0.3","TCP","1516","9002 → 43520 [PSH, ACK] Seq=156509 Ack=10745 Win=65535 Len=1460 [TCP segment of a reassembled PDU]"
"3.606174","5.9.29.183","172.19.0.3","TLSv1.2","1516","Application Data [TCP segment of a reassembled PDU]"
"3.606176","5.9.29.183","172.19.0.3","TCP","1516","9002 → 43520 [PSH, ACK] Seq=159429 Ack=10745 Win=65535 Len=1460 [TCP segment of a reassembled PDU]"
"3.606179","5.9.29.183","172.19.0.3","TCP","1516","9002 → 43520 [PSH, ACK] Seq=160889 Ack=10745 Win=65535 Len=1460 [TCP segment of a reassembled PDU]"
"3.606181","5.9.29.183","172.19.0.3","TLSv1.2","1432","Application Data [TCP segment of a reassembled PDU]"
"3.606261","172.19.0.3","5.9.29.183","TCP","56","43520 → 9002 [ACK] Seq=10745 Ack=163725 Win=11836 Len=0"
"3.621242","5.9.29.183","172.19.0.3","TLSv1.2","1408","Application Data"
"3.636099","5.9.29.183","172.19.0.3","TLSv1.2","1113","Application Data"
"3.636119","172.19.0.3","5.9.29.183","TCP","56","43520 → 9002 [ACK] Seq=10745 Ack=166134 Win=11911 Len=0"
"3.638921","5.9.29.183","172.19.0.3","TCP","1516","[TCP segment of a reassembled PDU]"
"3.638929","5.9.29.183","172.19.0.3","TCP","1516","9002 → 43520 [PSH, ACK] Seq=167594 Ack=10745 Win=65535 Len=1460 [TCP segment of a reassembled PDU]"
"3.638933","5.9.29.183","172.19.0.3","TLSv1.2","1516","Application Data [TCP segment of a reassembled PDU]"
"3.638935","5.9.29.183","172.19.0.3","TCP","1468","9002 → 43520 [PSH, ACK] Seq=170514 Ack=10745 Win=65535 Len=1412 [TCP segment of a reassembled PDU]"
"3.638966","172.19.0.3","5.9.29.183","TCP","56","43520 → 9002 [ACK] Seq=10745 Ack=171926 Win=11887 Len=0"
"3.638996","5.9.29.183","172.19.0.3","TCP","1516","9002 → 43520 [PSH, ACK] Seq=171926 Ack=10745 Win=65535 Len=1460 [TCP segment of a reassembled PDU]"
"3.638999","5.9.29.183","172.19.0.3","TLSv1.2","1516","Application Data [TCP segment of a reassembled PDU]"
"3.639039","5.9.29.183","172.19.0.3","TCP","1480","9002 → 43520 [PSH, ACK] Seq=174846 Ack=10745 Win=65535 Len=1424 [TCP segment of a reassembled PDU]"
"3.639073","172.19.0.3","5.9.29.183","TCP","56","43520 → 9002 [ACK] Seq=10745 Ack=176270 Win=11863 Len=0"
"3.639257","172.19.0.3","5.9.29.183","TLSv1.2","599","Application Data"
"3.639428","5.9.29.183","172.19.0.3","TCP","56","9002 → 43520 [ACK] Seq=176270 Ack=11288 Win=65535 Len=0"
"3.648511","172.19.0.3","5.9.29.183","TLSv1.2","599","Application Data"
"3.648836","5.9.29.183","172.19.0.3","TCP","56","9002 → 43520 [ACK] Seq=176270 Ack=11831 Win=65535 Len=0"
"3.651704","5.9.29.183","172.19.0.3","TLSv1.2","287","Application Data"
"3.656530","5.9.29.183","172.19.0.3","TCP","457","[TCP segment of a reassembled PDU]"
"3.656590","5.9.29.183","172.19.0.3","TCP","1516","9002 → 43520 [PSH, ACK] Seq=176902 Ack=11831 Win=65535 Len=1460 [TCP segment of a reassembled PDU]"
"3.656597","5.9.29.183","172.19.0.3","TCP","1516","9002 → 43520 [PSH, ACK] Seq=178362 Ack=11831 Win=65535 Len=1460 [TCP segment of a reassembled PDU]"
"3.656619","5.9.29.183","172.19.0.3","TLSv1.2","1516","Application Data [TCP segment of a reassembled PDU]"
"3.656622","5.9.29.183","172.19.0.3","TCP","1516","9002 → 43520 [PSH, ACK] Seq=181282 Ack=11831 Win=65535 Len=1460 [TCP segment of a reassembled PDU]"
"3.656625","5.9.29.183","172.19.0.3","TCP","1516","9002 → 43520 [PSH, ACK] Seq=182742 Ack=11831 Win=65535 Len=1460 [TCP segment of a reassembled PDU]"
"3.656705","5.9.29.183","172.19.0.3","TLSv1.2","1516","Application Data [TCP segment of a reassembled PDU]"
"3.656708","5.9.29.183","172.19.0.3","TCP","1516","9002 → 43520 [PSH, ACK] Seq=185662 Ack=11831 Win=65535 Len=1460 [TCP segment of a reassembled PDU]"
"3.656709","172.19.0.3","5.9.29.183","TCP","56","43520 → 9002 [ACK] Seq=11831 Ack=184202 Win=11869 Len=0"
"3.656709","5.9.29.183","172.19.0.3","TCP","1019","9002 → 43520 [PSH, ACK] Seq=187122 Ack=11831 Win=65535 Len=963 [TCP segment of a reassembled PDU]"
"3.656770","172.19.0.3","5.9.29.183","TCP","56","43520 → 9002 [ACK] Seq=11831 Ack=188085 Win=11845 Len=0"
"3.666983","5.9.29.183","172.19.0.3","TLSv1.2","381","Application Data"
"3.672573","5.9.29.183","172.19.0.3","TCP","1516","[TCP segment of a reassembled PDU]"
"3.672581","172.19.0.3","5.9.29.183","TCP","56","43520 → 9002 [ACK] Seq=11831 Ack=189870 Win=11911 Len=0"
"3.672627","5.9.29.183","172.19.0.3","TCP","1516","9002 → 43520 [PSH, ACK] Seq=189870 Ack=11831 Win=65535 Len=1460 [TCP segment of a reassembled PDU]"
"3.672633","5.9.29.183","172.19.0.3","TLSv1.2","1516","Application Data [TCP segment of a reassembled PDU]"
"3.672636","5.9.29.183","172.19.0.3","TCP","1516","9002 → 43520 [PSH, ACK] Seq=192790 Ack=11831 Win=65535 Len=1460 [TCP segment of a reassembled PDU]"
"3.672638","5.9.29.183","172.19.0.3","TCP","1456","9002 → 43520 [PSH, ACK] Seq=194250 Ack=11831 Win=65535 Len=1400 [TCP segment of a reassembled PDU]"
"3.672688","5.9.29.183","172.19.0.3","TLSv1.2","1504","Application Data [TCP segment of a reassembled PDU]"
"3.672699","172.19.0.3","5.9.29.183","TCP","56","43520 → 9002 [ACK] Seq=11831 Ack=195650 Win=11879 Len=0"
"3.682996","5.9.29.183","172.19.0.3","TLSv1.2","1221","Application Data"
"3.683013","172.19.0.3","5.9.29.183","TCP","56","43520 → 9002 [ACK] Seq=11831 Ack=198263 Win=11911 Len=0"
"3.693745","5.9.29.183","172.19.0.3","TCP","1504","[TCP segment of a reassembled PDU]"
"3.698340","5.9.29.183","172.19.0.3","TLSv1.2","693","Application Data"
"3.698368","172.19.0.3","5.9.29.183","TCP","56","43520 → 9002 [ACK] Seq=11831 Ack=200348 Win=11911 Len=0"
"3.699062","172.19.0.3","5.9.29.183","TLSv1.2","599","Application Data"
"3.699409","5.9.29.183","172.19.0.3","TCP","56","9002 → 43520 [ACK] Seq=200348 Ack=12374 Win=65535 Len=0"
"3.707664","172.19.0.3","5.9.29.183","TLSv1.2","599","Application Data"
"3.707888","5.9.29.183","172.19.0.3","TCP","56","9002 → 43520 [ACK] Seq=200348 Ack=12917 Win=65535 Len=0"
"4.084923","5.9.29.183","172.19.0.3","TLSv1.2","599","Application Data"
"4.085944","172.19.0.3","5.9.29.183","TLSv1.2","599","Application Data"
"4.086320","5.9.29.183","172.19.0.3","TCP","56","9002 → 43520 [ACK] Seq=200891 Ack=13460 Win=65535 Len=0"
"4.460247","5.9.29.183","172.19.0.3","TCP","1504","[TCP segment of a reassembled PDU]"
"4.460368","5.9.29.183","172.19.0.3","TCP","1504","9002 → 43520 [PSH, ACK] Seq=202339 Ack=13460 Win=65535 Len=1448 [TCP segment of a reassembled PDU]"
"4.460554","5.9.29.183","172.19.0.3","TLSv1.2","787","Application Data"
"4.460583","172.19.0.3","5.9.29.183","TCP","56","43520 → 9002 [ACK] Seq=13460 Ack=204518 Win=11893 Len=0"
"4.486792","5.9.29.183","172.19.0.3","TCP","1516","[TCP segment of a reassembled PDU]"
"4.486857","5.9.29.183","172.19.0.3","TCP","1516","9002 → 43520 [PSH, ACK] Seq=205978 Ack=13460 Win=65535 Len=1460 [TCP segment of a reassembled PDU]"
"4.486875","172.19.0.3","5.9.29.183","TCP","56","43520 → 9002 [ACK] Seq=13460 Ack=207438 Win=11903 Len=0"
"4.486878","5.9.29.183","172.19.0.3","TLSv1.2","1213","Application Data"
"4.504643","5.9.29.183","172.19.0.3","TLSv1.2","663","Application Data"
"4.504668","172.19.0.3","5.9.29.183","TCP","56","43520 → 9002 [ACK] Seq=13460 Ack=209202 Win=11911 Len=0"
"4.520621","5.9.29.183","172.19.0.3","TLSv1.2","599","Application Data"
"4.537021","5.9.29.183","172.19.0.3","TCP","1504","[TCP segment of a reassembled PDU]"
"4.537053","172.19.0.3","5.9.29.183","TCP","56","43520 → 9002 [ACK] Seq=13460 Ack=211193 Win=11911 Len=0"
"4.537243","5.9.29.183","172.19.0.3","TCP","1504","9002 → 43520 [PSH, ACK] Seq=211193 Ack=13460 Win=65535 Len=1448 [TCP segment of a reassembled PDU]"
"4.537256","5.9.29.183","172.19.0.3","TLSv1.2","787","Application Data"
"4.537286","172.19.0.3","5.9.29.183","TCP","56","43520 → 9002 [ACK] Seq=13460 Ack=213372 Win=11895 Len=0"
"4.547475","5.9.29.183","172.19.0.3","TCP","1516","[TCP segment of a reassembled PDU]"
"4.547541","5.9.29.183","172.19.0.3","TCP","1492","9002 → 43520 [PSH, ACK] Seq=214832 Ack=13460 Win=65535 Len=1436 [TCP segment of a reassembled PDU]"
"4.547559","172.19.0.3","5.9.29.183","TCP","56","43520 → 9002 [ACK] Seq=13460 Ack=216268 Win=11903 Len=0"
"4.547773","5.9.29.183","172.19.0.3","TLSv1.2","1516","Application Data [TCP segment of a reassembled PDU]"
"4.547781","5.9.29.183","172.19.0.3","TCP","1516","9002 → 43520 [PSH, ACK] Seq=217728 Ack=13460 Win=65535 Len=1460 [TCP segment of a reassembled PDU]"
"4.547789","172.19.0.3","5.9.29.183","TCP","56","43520 → 9002 [ACK] Seq=13460 Ack=219188 Win=11903 Len=0"
"4.547791","5.9.29.183","172.19.0.3","TCP","1516","9002 → 43520 [PSH, ACK] Seq=219188 Ack=13460 Win=65535 Len=1460 [TCP segment of a reassembled PDU]"
"4.547794","5.9.29.183","172.19.0.3","TLSv1.2","1516","Application Data [TCP segment of a reassembled PDU]"
"4.547800","5.9.29.183","172.19.0.3","TCP","1456","9002 → 43520 [PSH, ACK] Seq=222108 Ack=13460 Win=65535 Len=1400 [TCP segment of a reassembled PDU]"
"4.547936","172.19.0.3","5.9.29.183","TCP","56","43520 → 9002 [ACK] Seq=13460 Ack=223508 Win=11879 Len=0"
"4.548315","172.19.0.3","5.9.29.183","TLSv1.2","599","Application Data"
"4.548565","5.9.29.183","172.19.0.3","TCP","56","9002 → 43520 [ACK] Seq=223508 Ack=14003 Win=65535 Len=0"
"4.552319","5.9.29.183","172.19.0.3","TCP","1504","9002 → 43520 [PSH, ACK] Seq=223508 Ack=14003 Win=65535 Len=1448 [TCP segment of a reassembled PDU]"
"4.553185","5.9.29.183","172.19.0.3","TLSv1.2","381","Application Data"
"4.553196","172.19.0.3","5.9.29.183","TCP","56","43520 → 9002 [ACK] Seq=14003 Ack=225281 Win=11911 Len=0"
"4.581736","5.9.29.183","172.19.0.3","TLSv1.2","1113","Application Data"
"4.597324","5.9.29.183","172.19.0.3","TCP","1516","[TCP segment of a reassembled PDU]"
"4.597357","172.19.0.3","5.9.29.183","TCP","56","43520 → 9002 [ACK] Seq=14003 Ack=227798 Win=11911 Len=0"
"4.597427","5.9.29.183","172.19.0.3","TCP","1492","9002 → 43520 [PSH, ACK] Seq=227798 Ack=14003 Win=65535 Len=1436 [TCP segment of a reassembled PDU]"
"4.597594","5.9.29.183","172.19.0.3","TLSv1.2","273","Application Data"
"4.597631","172.19.0.3","5.9.29.183","TCP","56","43520 → 9002 [ACK] Seq=14003 Ack=229451 Win=11899 Len=0"
"4.597860","172.19.0.3","5.9.29.183","TLSv1.2","599","Application Data"
"4.598085","5.9.29.183","172.19.0.3","TCP","56","9002 → 43520 [ACK] Seq=229451 Ack=14546 Win=65535 Len=0"
"4.608505","5.9.29.183","172.19.0.3","TCP","1516","[TCP segment of a reassembled PDU]"
"4.608559","5.9.29.183","172.19.0.3","TCP","1516","9002 → 43520 [PSH, ACK] Seq=230911 Ack=14546 Win=65535 Len=1460 [TCP segment of a reassembled PDU]"
"4.608566","5.9.29.183","172.19.0.3","TLSv1.2","1516","Application Data [TCP segment of a reassembled PDU]"
"4.608569","5.9.29.183","172.19.0.3","TCP","1468","9002 → 43520 [PSH, ACK] Seq=233831 Ack=14546 Win=65535 Len=1412 [TCP segment of a reassembled PDU]"
"4.608572","5.9.29.183","172.19.0.3","TCP","1516","9002 → 43520 [PSH, ACK] Seq=235243 Ack=14546 Win=65535 Len=1460 [TCP segment of a reassembled PDU]"
"4.608621","5.9.29.183","172.19.0.3","TLSv1.2","1516","Application Data [TCP segment of a reassembled PDU]"
"4.608629","5.9.29.183","172.19.0.3","TCP","1516","9002 → 43520 [PSH, ACK] Seq=238163 Ack=14546 Win=65535 Len=1460 [TCP segment of a reassembled PDU]"
"4.608635","5.9.29.183","172.19.0.3","TCP","1516","9002 → 43520 [PSH, ACK] Seq=239623 Ack=14546 Win=65535 Len=1460 [TCP segment of a reassembled PDU]"
"4.608643","5.9.29.183","172.19.0.3","TLSv1.2","1411","Application Data [TCP segment of a reassembled PDU]"
"4.608710","172.19.0.3","5.9.29.183","TCP","56","43520 → 9002 [ACK] Seq=14546 Ack=242438 Win=11847 Len=0"
"4.608715","5.9.29.183","172.19.0.3","TCP","1516","9002 → 43520 [PSH, ACK] Seq=242438 Ack=14546 Win=65535 Len=1460 [TCP segment of a reassembled PDU]"
"4.608718","5.9.29.183","172.19.0.3","TCP","1516","9002 → 43520 [PSH, ACK] Seq=243898 Ack=14546 Win=65535 Len=1460 [TCP segment of a reassembled PDU]"
"4.608720","5.9.29.183","172.19.0.3","TCP","77","9002 → 43520 [PSH, ACK] Seq=245358 Ack=14546 Win=65535 Len=21 [TCP segment of a reassembled PDU]"
"4.608779","172.19.0.3","5.9.29.183","TCP","56","43520 → 9002 [ACK] Seq=14546 Ack=245379 Win=11828 Len=0"
"4.613047","5.9.29.183","172.19.0.3","TLSv1.2","721","Application Data, Application Data"
"4.628396","5.9.29.183","172.19.0.3","TLSv1.2","1113","Application Data"
"4.628416","172.19.0.3","5.9.29.183","TCP","56","43520 → 9002 [ACK] Seq=14546 Ack=247101 Win=11911 Len=0"
"4.640021","5.9.29.183","172.19.0.3","TCP","1516","[TCP segment of a reassembled PDU]"
"4.640190","5.9.29.183","172.19.0.3","TCP","1516","9002 → 43520 [PSH, ACK] Seq=248561 Ack=14546 Win=65535 Len=1460 [TCP segment of a reassembled PDU]"
"4.640204","5.9.29.183","172.19.0.3","TLSv1.2","1516","Application Data [TCP segment of a reassembled PDU]"
"4.640211","5.9.29.183","172.19.0.3","TCP","1516","9002 → 43520 [PSH, ACK] Seq=251481 Ack=14546 Win=65535 Len=1460 [TCP segment of a reassembled PDU]"
"4.640292","5.9.29.183","172.19.0.3","TCP","1516","9002 → 43520 [PSH, ACK] Seq=252941 Ack=14546 Win=65535 Len=1460 [TCP segment of a reassembled PDU]"
"4.640303","5.9.29.183","172.19.0.3","TLSv1.2","1444","Application Data [TCP segment of a reassembled PDU]"
"4.640575","172.19.0.3","5.9.29.183","TCP","56","43520 → 9002 [ACK] Seq=14546 Ack=255789 Win=11869 Len=0"
"4.641185","172.19.0.3","5.9.29.183","TLSv1.2","599","Application Data"
"4.641656","5.9.29.183","172.19.0.3","TCP","56","9002 → 43520 [ACK] Seq=255789 Ack=15089 Win=65535 Len=0"
"4.643538","5.9.29.183","172.19.0.3","TLSv1.2","1221","Application Data"
"4.654693","5.9.29.183","172.19.0.3","TCP","1504","[TCP segment of a reassembled PDU]"
"4.654702","172.19.0.3","5.9.29.183","TCP","56","43520 → 9002 [ACK] Seq=15089 Ack=258402 Win=11911 Len=0"
"4.654856","5.9.29.183","172.19.0.3","TCP","1504","9002 → 43520 [PSH, ACK] Seq=258402 Ack=15089 Win=65535 Len=1448 [TCP segment of a reassembled PDU]"
"4.654863","5.9.29.183","172.19.0.3","TLSv1.2","1516","Application Data [TCP segment of a reassembled PDU]"
"4.654865","5.9.29.183","172.19.0.3","TCP","1516","9002 → 43520 [PSH, ACK] Seq=261310 Ack=15089 Win=65535 Len=1460 [TCP segment of a reassembled PDU]"
"4.654891","172.19.0.3","5.9.29.183","TCP","56","43520 → 9002 [ACK] Seq=15089 Ack=262770 Win=11887 Len=0"
"4.654975","5.9.29.183","172.19.0.3","TCP","1480","9002 → 43520 [PSH, ACK] Seq=262770 Ack=15089 Win=65535 Len=1424 [TCP segment of a reassembled PDU]"
"4.654981","5.9.29.183","172.19.0.3","TLSv1.2","1516","Application Data [TCP segment of a reassembled PDU]"
"4.654983","5.9.29.183","172.19.0.3","TCP","1516","9002 → 43520 [PSH, ACK] Seq=265654 Ack=15089 Win=65535 Len=1460 [TCP segment of a reassembled PDU]"
"4.654993","5.9.29.183","172.19.0.3","TCP","1480","9002 → 43520 [PSH, ACK] Seq=267114 Ack=15089 Win=65535 Len=1424 [TCP segment of a reassembled PDU]"
"4.655039","172.19.0.3","5.9.29.183","TCP","56","43520 → 9002 [ACK] Seq=15089 Ack=268538 Win=11855 Len=0"
"4.659142","5.9.29.183","172.19.0.3","TLSv1.2","924","Application Data, Application Data"
"4.690089","5.9.29.183","172.19.0.3","TCP","1504","[TCP segment of a reassembled PDU]"
"4.690108","172.19.0.3","5.9.29.183","TCP","56","43520 → 9002 [ACK] Seq=15089 Ack=270854 Win=11911 Len=0"
"4.690147","5.9.29.183","172.19.0.3","TLSv1.2","693","Application Data"
"4.694321","172.19.0.3","5.9.29.183","TLSv1.2","599","Application Data"
"4.694575","5.9.29.183","172.19.0.3","TCP","56","9002 → 43520 [ACK] Seq=271491 Ack=15632 Win=65535 Len=0"
"5.116077","5.9.29.183","172.19.0.3","TLSv1.2","599","Application Data"
"5.116932","172.19.0.3","5.9.29.183","TLSv1.2","599","Application Data"
"5.117209","5.9.29.183","172.19.0.3","TCP","56","9002 → 43520 [ACK] Seq=272034 Ack=16175 Win=65535 Len=0"
"5.464351","5.9.29.183","172.19.0.3","TCP","1504","[TCP segment of a reassembled PDU]"
"5.464661","5.9.29.183","172.19.0.3","TCP","1504","9002 → 43520 [PSH, ACK] Seq=273482 Ack=16175 Win=65535 Len=1448 [TCP segment of a reassembled PDU]"
"5.464679","172.19.0.3","5.9.29.183","TCP","56","43520 → 9002 [ACK] Seq=16175 Ack=274930 Win=11911 Len=0"
"5.464684","5.9.29.183","172.19.0.3","TLSv1.2","787","Application Data"
"5.465001","172.19.0.3","5.9.29.183","TLSv1.2","599","Application Data"
"5.465222","5.9.29.183","172.19.0.3","TCP","56","9002 → 43520 [ACK] Seq=275661 Ack=16718 Win=65535 Len=0"
"5.491606","5.9.29.183","172.19.0.3","TCP","1504","[TCP segment of a reassembled PDU]"
"5.492169","5.9.29.183","172.19.0.3","TCP","1504","9002 → 43520 [PSH, ACK] Seq=277109 Ack=16718 Win=65535 Len=1448 [TCP segment of a reassembled PDU]"
"5.492218","172.19.0.3","5.9.29.183","TCP","56","43520 → 9002 [ACK] Seq=16718 Ack=278557 Win=11911 Len=0"
"5.492266","5.9.29.183","172.19.0.3","TLSv1.2","1516","Application Data [TCP segment of a reassembled PDU]"
"5.492358","5.9.29.183","172.19.0.3","TCP","1516","9002 → 43520 [PSH, ACK] Seq=280017 Ack=16718 Win=65535 Len=1460 [TCP segment of a reassembled PDU]"
"5.492368","5.9.29.183","172.19.0.3","TCP","1213","9002 → 43520 [PSH, ACK] Seq=281477 Ack=16718 Win=65535 Len=1157 [TCP segment of a reassembled PDU]"
"5.492627","172.19.0.3","5.9.29.183","TCP","56","43520 → 9002 [ACK] Seq=16718 Ack=282634 Win=11887 Len=0"
"5.507654","5.9.29.183","172.19.0.3","TLSv1.2","1516","Application Data [TCP segment of a reassembled PDU]"
"5.507821","5.9.29.183","172.19.0.3","TCP","1492","9002 → 43520 [PSH, ACK] Seq=284094 Ack=16718 Win=65535 Len=1436 [TCP segment of a reassembled PDU]"
"5.507849","172.19.0.3","5.9.29.183","TCP","56","43520 → 9002 [ACK] Seq=16718 Ack=285530 Win=11903 Len=0"
"5.507952","5.9.29.183","172.19.0.3","TCP","1516","9002 → 43520 [PSH, ACK] Seq=285530 Ack=16718 Win=65535 Len=1460 [TCP segment of a reassembled PDU]"
"5.507958","5.9.29.183","172.19.0.3","TLSv1.2","1516","Application Data [TCP segment of a reassembled PDU]"
"5.507962","5.9.29.183","172.19.0.3","TCP","1480","9002 → 43520 [PSH, ACK] Seq=288450 Ack=16718 Win=65535 Len=1424 [TCP segment of a reassembled PDU]"
"5.507965","5.9.29.183","172.19.0.3","TLSv1.2","1379","Application Data"
"5.508128","172.19.0.3","5.9.29.183","TCP","56","43520 → 9002 [ACK] Seq=16718 Ack=291197 Win=11871 Len=0"
"5.529204","5.9.29.183","172.19.0.3","TCP","1516","[TCP segment of a reassembled PDU]"
"5.529355","5.9.29.183","172.19.0.3","TLSv1.2","167","Application Data"
"5.529369","172.19.0.3","5.9.29.183","TCP","56","43520 → 9002 [ACK] Seq=16718 Ack=292768 Win=11903 Len=0"
"5.558679","5.9.29.183","172.19.0.3","TCP","1504","[TCP segment of a reassembled PDU]"
"5.558747","5.9.29.183","172.19.0.3","TCP","1504","9002 → 43520 [PSH, ACK] Seq=294216 Ack=16718 Win=65535 Len=1448 [TCP segment of a reassembled PDU]"
"5.558764","172.19.0.3","5.9.29.183","TCP","56","43520 → 9002 [ACK] Seq=16718 Ack=295664 Win=11903 Len=0"
"5.558864","5.9.29.183","172.19.0.3","TLSv1.2","1237","Application Data"
"5.558872","5.9.29.183","172.19.0.3","TCP","1516","[TCP segment of a reassembled PDU]"
"5.558875","5.9.29.183","172.19.0.3","TCP","1492","9002 → 43520 [PSH, ACK] Seq=298305 Ack=16718 Win=65535 Len=1436 [TCP segment of a reassembled PDU]"
"5.558902","172.19.0.3","5.9.29.183","TCP","56","43520 → 9002 [ACK] Seq=16718 Ack=299741 Win=11879 Len=0"
"5.574666","5.9.29.183","172.19.0.3","TLSv1.2","1394","Application Data, Application Data"
"5.575136","172.19.0.3","5.9.29.183","TLSv1.2","599","Application Data"
"5.575495","5.9.29.183","172.19.0.3","TCP","56","9002 → 43520 [ACK] Seq=301079 Ack=17261 Win=65535 Len=0"
"5.579668","5.9.29.183","172.19.0.3","TCP","1504","[TCP segment of a reassembled PDU]"
"5.580001","5.9.29.183","172.19.0.3","TCP","1504","9002 → 43520 [PSH, ACK] Seq=302527 Ack=17261 Win=65535 Len=1448 [TCP segment of a reassembled PDU]"
"5.580097","172.19.0.3","5.9.29.183","TCP","56","43520 → 9002 [ACK] Seq=17261 Ack=303975 Win=11911 Len=0"
"5.589916","5.9.29.183","172.19.0.3","TLSv1.2","1516","Application Data [TCP segment of a reassembled PDU]"
"5.589973","5.9.29.183","172.19.0.3","TCP","261","9002 → 43520 [PSH, ACK] Seq=305435 Ack=17261 Win=65535 Len=205 [TCP segment of a reassembled PDU]"
"5.590155","172.19.0.3","5.9.29.183","TCP","56","43520 → 9002 [ACK] Seq=17261 Ack=305640 Win=11903 Len=0"
"5.590352","5.9.29.183","172.19.0.3","TCP","1504","9002 → 43520 [PSH, ACK] Seq=305640 Ack=17261 Win=65535 Len=1448 [TCP segment of a reassembled PDU]"
"5.590363","5.9.29.183","172.19.0.3","TCP","942","9002 → 43520 [PSH, ACK] Seq=307088 Ack=17261 Win=65535 Len=886 [TCP segment of a reassembled PDU]"
"5.590393","5.9.29.183","172.19.0.3","TLSv1.2","1516","Application Data [TCP segment of a reassembled PDU]"
"5.590397","5.9.29.183","172.19.0.3","TCP","1516","9002 → 43520 [PSH, ACK] Seq=309434 Ack=17261 Win=65535 Len=1460 [TCP segment of a reassembled PDU]"
"5.590419","172.19.0.3","5.9.29.183","TCP","56","43520 → 9002 [ACK] Seq=17261 Ack=310894 Win=11871 Len=0"
"5.590560","5.9.29.183","172.19.0.3","TCP","594","9002 → 43520 [PSH, ACK] Seq=310894 Ack=17261 Win=65535 Len=538 [TCP segment of a reassembled PDU]"
"5.605723","5.9.29.183","172.19.0.3","TLSv1.2","1127","Application Data, Application Data"
"5.605745","172.19.0.3","5.9.29.183","TCP","56","43520 → 9002 [ACK] Seq=17261 Ack=312503 Win=11911 Len=0"
"5.606296","5.9.29.183","172.19.0.3","TCP","1504","[TCP segment of a reassembled PDU]"
"5.606624","5.9.29.183","172.19.0.3","TCP","1504","9002 → 43520 [PSH, ACK] Seq=313951 Ack=17261 Win=65535 Len=1448 [TCP segment of a reassembled PDU]"
"5.606666","172.19.0.3","5.9.29.183","TCP","56","43520 → 9002 [ACK] Seq=17261 Ack=315399 Win=11911 Len=0"
"5.606771","5.9.29.183","172.19.0.3","TLSv1.2","1516","Application Data [TCP segment of a reassembled PDU]"
"5.606779","5.9.29.183","172.19.0.3","TCP","1492","9002 → 43520 [PSH, ACK] Seq=316859 Ack=17261 Win=65535 Len=1436 [TCP segment of a reassembled PDU]"
"5.606802","172.19.0.3","5.9.29.183","TCP","56","43520 → 9002 [ACK] Seq=17261 Ack=318295 Win=11895 Len=0"
"5.620848","5.9.29.183","172.19.0.3","TLSv1.2","490","Application Data"
"5.626383","5.9.29.183","172.19.0.3","TCP","1516","[TCP segment of a reassembled PDU]"
"5.626405","172.19.0.3","5.9.29.183","TCP","56","43520 → 9002 [ACK] Seq=17261 Ack=320189 Win=11911 Len=0"
"5.626455","5.9.29.183","172.19.0.3","TCP","1492","9002 → 43520 [PSH, ACK] Seq=320189 Ack=17261 Win=65535 Len=1436 [TCP segment of a reassembled PDU]"
"5.636758","5.9.29.183","172.19.0.3","TLSv1.2","1330","Application Data, Application Data"
"5.636782","172.19.0.3","5.9.29.183","TCP","56","43520 → 9002 [ACK] Seq=17261 Ack=322899 Win=11911 Len=0"
"5.637644","5.9.29.183","172.19.0.3","TCP","1516","[TCP segment of a reassembled PDU]"
"5.637695","5.9.29.183","172.19.0.3","TCP","1516","9002 → 43520 [PSH, ACK] Seq=324359 Ack=17261 Win=65535 Len=1460 [TCP segment of a reassembled PDU]"
"5.637703","5.9.29.183","172.19.0.3","TLSv1.2","1480","Application Data [TCP segment of a reassembled PDU]"
"5.637797","172.19.0.3","5.9.29.183","TCP","56","43520 → 9002 [ACK] Seq=17261 Ack=327243 Win=11895 Len=0"
"5.638048","172.19.0.3","5.9.29.183","TLSv1.2","1113","Application Data"
"5.638313","5.9.29.183","172.19.0.3","TCP","56","9002 → 43520 [ACK] Seq=327243 Ack=18318 Win=65535 Len=0"
"5.651982","5.9.29.183","172.19.0.3","TLSv1.2","910","Application Data"
"5.658138","5.9.29.183","172.19.0.3","TCP","1516","[TCP segment of a reassembled PDU]"
"5.658156","172.19.0.3","5.9.29.183","TCP","56","43520 → 9002 [ACK] Seq=18318 Ack=329557 Win=11911 Len=0"
"5.658195","5.9.29.183","172.19.0.3","TCP","1492","9002 → 43520 [PSH, ACK] Seq=329557 Ack=18318 Win=65535 Len=1436 [TCP segment of a reassembled PDU]"
"5.667098","5.9.29.183","172.19.0.3","TLSv1.2","787","Application Data"
"5.667116","172.19.0.3","5.9.29.183","TCP","56","43520 → 9002 [ACK] Seq=18318 Ack=331724 Win=11911 Len=0"
"5.669678","5.9.29.183","172.19.0.3","TCP","1516","[TCP segment of a reassembled PDU]"
"5.669723","5.9.29.183","172.19.0.3","TCP","1516","9002 → 43520 [PSH, ACK] Seq=333184 Ack=18318 Win=65535 Len=1460 [TCP segment of a reassembled PDU]"
"5.669730","5.9.29.183","172.19.0.3","TLSv1.2","1480","Application Data [TCP segment of a reassembled PDU]"
"5.669839","172.19.0.3","5.9.29.183","TCP","56","43520 → 9002 [ACK] Seq=18318 Ack=336068 Win=11895 Len=0"
"5.684415","5.9.29.183","172.19.0.3","TLSv1.2","910","Application Data"
"5.722075","5.9.29.183","172.19.0.3","TCP","1516","[TCP segment of a reassembled PDU]"
"5.722097","172.19.0.3","5.9.29.183","TCP","56","43520 → 9002 [ACK] Seq=18318 Ack=338382 Win=11911 Len=0"
"5.722154","5.9.29.183","172.19.0.3","TCP","1516","9002 → 43520 [PSH, ACK] Seq=338382 Ack=18318 Win=65535 Len=1460 [TCP segment of a reassembled PDU]"
"5.722205","5.9.29.183","172.19.0.3","TLSv1.2","1213","Application Data"
"5.722374","172.19.0.3","5.9.29.183","TCP","56","43520 → 9002 [ACK] Seq=18318 Ack=340999 Win=11895 Len=0"
"5.737862","5.9.29.183","172.19.0.3","TLSv1.2","149","Application Data"
"5.778580","172.19.0.3","5.9.29.183","TCP","56","43520 → 9002 [ACK] Seq=18318 Ack=341092 Win=11911 Len=0"
"5.799108","5.9.29.183","172.19.0.3","TLSv1.2","1113","Application Data"
"5.799359","172.19.0.3","5.9.29.183","TCP","56","43520 → 9002 [ACK] Seq=18318 Ack=342149 Win=11911 Len=0"
"5.804529","172.19.0.3","5.9.29.183","TLSv1.2","599","Application Data"
"5.804763","5.9.29.183","172.19.0.3","TCP","56","9002 → 43520 [ACK] Seq=342149 Ack=18861 Win=65535 Len=0"
"6.185102","5.9.29.183","172.19.0.3","TLSv1.2","599","Application Data"
"6.185784","172.19.0.3","5.9.29.183","TLSv1.2","599","Application Data"
"6.186031","5.9.29.183","172.19.0.3","TCP","56","9002 → 43520 [ACK] Seq=342692 Ack=19404 Win=65535 Len=0"
"6.564664","5.9.29.183","172.19.0.3","TLSv1.2","599","Application Data"
"6.596021","5.9.29.183","172.19.0.3","TCP","1516","[TCP segment of a reassembled PDU]"
"6.596043","172.19.0.3","5.9.29.183","TCP","56","43520 → 9002 [ACK] Seq=19404 Ack=344695 Win=11911 Len=0"
"6.596058","5.9.29.183","172.19.0.3","TCP","1516","9002 → 43520 [PSH, ACK] Seq=344695 Ack=19404 Win=65535 Len=1460 [TCP segment of a reassembled PDU]"
"6.596067","5.9.29.183","172.19.0.3","TLSv1.2","763","Application Data"
"6.596242","172.19.0.3","5.9.29.183","TCP","56","43520 → 9002 [ACK] Seq=19404 Ack=346862 Win=11895 Len=0"
"6.606955","5.9.29.183","172.19.0.3","TCP","1516","[TCP segment of a reassembled PDU]"
"6.606967","5.9.29.183","172.19.0.3","TCP","1492","9002 → 43520 [PSH, ACK] Seq=348322 Ack=19404 Win=65535 Len=1436 [TCP segment of a reassembled PDU]"
"6.606976","172.19.0.3","5.9.29.183","TCP","56","43520 → 9002 [ACK] Seq=19404 Ack=349758 Win=11903 Len=0"
"6.607150","5.9.29.183","172.19.0.3","TLSv1.2","1516","Application Data [TCP segment of a reassembled PDU]"
"6.607215","5.9.29.183","172.19.0.3","TCP","1516","9002 → 43520 [PSH, ACK] Seq=351218 Ack=19404 Win=65535 Len=1460 [TCP segment of a reassembled PDU]"
"6.607221","5.9.29.183","172.19.0.3","TCP","1480","9002 → 43520 [PSH, ACK] Seq=352678 Ack=19404 Win=65535 Len=1424 [TCP segment of a reassembled PDU]"
"6.607234","172.19.0.3","5.9.29.183","TCP","56","43520 → 9002 [ACK] Seq=19404 Ack=354102 Win=11877 Len=0"
"6.613830","5.9.29.183","172.19.0.3","TLSv1.2","584","Application Data"
"6.622548","5.9.29.183","172.19.0.3","TCP","1516","[TCP segment of a reassembled PDU]"
"6.622566","172.19.0.3","5.9.29.183","TCP","56","43520 → 9002 [ACK] Seq=19404 Ack=356090 Win=11911 Len=0"
"6.622577","5.9.29.183","172.19.0.3","TCP","1516","9002 → 43520 [PSH, ACK] Seq=356090 Ack=19404 Win=65535 Len=1460 [TCP segment of a reassembled PDU]"
"6.622582","5.9.29.183","172.19.0.3","TLSv1.2","1516","Application Data [TCP segment of a reassembled PDU]"
"6.622585","5.9.29.183","172.19.0.3","TCP","1468","9002 → 43520 [PSH, ACK] Seq=359010 Ack=19404 Win=65535 Len=1412 [TCP segment of a reassembled PDU]"
"6.622587","5.9.29.183","172.19.0.3","TCP","1504","9002 → 43520 [PSH, ACK] Seq=360422 Ack=19404 Win=65535 Len=1448 [TCP segment of a reassembled PDU]"
"6.622716","172.19.0.3","5.9.29.183","TCP","56","43520 → 9002 [ACK] Seq=19404 Ack=361870 Win=11879 Len=0"
"6.629510","5.9.29.183","172.19.0.3","TLSv1.2","70","Application Data"
"6.637044","5.9.29.183","172.19.0.3","TCP","1516","[TCP segment of a reassembled PDU]"
"6.637088","172.19.0.3","5.9.29.183","TCP","56","43520 → 9002 [ACK] Seq=19404 Ack=363344 Win=11911 Len=0"
"6.637102","5.9.29.183","172.19.0.3","TCP","1516","9002 → 43520 [PSH, ACK] Seq=363344 Ack=19404 Win=65535 Len=1460 [TCP segment of a reassembled PDU]"
"6.637109","5.9.29.183","172.19.0.3","TLSv1.2","1516","Application Data [TCP segment of a reassembled PDU]"
"6.637111","5.9.29.183","172.19.0.3","TCP","1516","9002 → 43520 [PSH, ACK] Seq=366264 Ack=19404 Win=65535 Len=1460 [TCP segment of a reassembled PDU]"
"6.637113","5.9.29.183","172.19.0.3","TCP","1516","9002 → 43520 [PSH, ACK] Seq=367724 Ack=19404 Win=65535 Len=1460 [TCP segment of a reassembled PDU]"
"6.637115","5.9.29.183","172.19.0.3","TLSv1.2","1516","Application Data [TCP segment of a reassembled PDU]"
"6.637119","5.9.29.183","172.19.0.3","TCP","1516","9002 → 43520 [PSH, ACK] Seq=370644 Ack=19404 Win=65535 Len=1460 [TCP segment of a reassembled PDU]"
"6.637221","5.9.29.183","172.19.0.3","TCP","1420","9002 → 43520 [PSH, ACK] Seq=372104 Ack=19404 Win=65535 Len=1364 [TCP segment of a reassembled PDU]"
"6.637295","172.19.0.3","5.9.29.183","TCP","56","43520 → 9002 [ACK] Seq=19404 Ack=373468 Win=11855 Len=0"
"6.637733","172.19.0.3","5.9.29.183","TLSv1.2","599","Application Data"
"6.637885","5.9.29.183","172.19.0.3","TCP","56","9002 → 43520 [ACK] Seq=373468 Ack=19947 Win=65535 Len=0"
"6.644773","5.9.29.183","172.19.0.3","TCP","98","9002 → 43520 [PSH, ACK] Seq=373468 Ack=19947 Win=65535 Len=42 [TCP segment of a reassembled PDU]"
"6.644797","5.9.29.183","172.19.0.3","TLSv1.2","882","Application Data, Application Data"
"6.644999","172.19.0.3","5.9.29.183","TCP","56","43520 → 9002 [ACK] Seq=19947 Ack=374336 Win=11911 Len=0"
"6.667354","5.9.29.183","172.19.0.3","TCP","1516","[TCP segment of a reassembled PDU]"
"6.667411","5.9.29.183","172.19.0.3","TCP","1516","9002 → 43520 [PSH, ACK] Seq=375796 Ack=19947 Win=65535 Len=1460 [TCP segment of a reassembled PDU]"
"6.667423","5.9.29.183","172.19.0.3","TLSv1.2","1213","Application Data"
"6.667503","5.9.29.183","172.19.0.3","TCP","1516","[TCP segment of a reassembled PDU]"
"6.667527","5.9.29.183","172.19.0.3","TCP","1516","9002 → 43520 [PSH, ACK] Seq=379873 Ack=19947 Win=65535 Len=1460 [TCP segment of a reassembled PDU]"
"6.667532","5.9.29.183","172.19.0.3","TLSv1.2","1516","Application Data [TCP segment of a reassembled PDU]"
"6.667536","5.9.29.183","172.19.0.3","TCP","1516","9002 → 43520 [PSH, ACK] Seq=382793 Ack=19947 Win=65535 Len=1460 [TCP segment of a reassembled PDU]"
"6.667538","5.9.29.183","172.19.0.3","TCP","1516","9002 → 43520 [PSH, ACK] Seq=384253 Ack=19947 Win=65535 Len=1460 [TCP segment of a reassembled PDU]"
"6.667550","5.9.29.183","172.19.0.3","TLSv1.2","1444","Application Data [TCP segment of a reassembled PDU]"
"6.667606","172.19.0.3","5.9.29.183","TCP","56","43520 → 9002 [ACK] Seq=19947 Ack=387101 Win=11845 Len=0"
"6.667762","5.9.29.183","172.19.0.3","TCP","1516","9002 → 43520 [PSH, ACK] Seq=387101 Ack=19947 Win=65535 Len=1460 [TCP segment of a reassembled PDU]"
"6.667770","5.9.29.183","172.19.0.3","TCP","1492","9002 → 43520 [PSH, ACK] Seq=388561 Ack=19947 Win=65535 Len=1436 [TCP segment of a reassembled PDU]"
"6.667820","172.19.0.3","5.9.29.183","TCP","56","43520 → 9002 [ACK] Seq=19947 Ack=389997 Win=11828 Len=0"
"6.668044","172.19.0.3","5.9.29.183","TLSv1.2","599","Application Data"
"6.668192","5.9.29.183","172.19.0.3","TCP","56","9002 → 43520 [ACK] Seq=389997 Ack=20490 Win=65535 Len=0"
"6.673313","5.9.29.183","172.19.0.3","TLSv1.2","1516","Application Data, Application Data"
"6.673346","5.9.29.183","172.19.0.3","TCP","1492","9002 → 43520 [PSH, ACK] Seq=391457 Ack=20490 Win=65535 Len=1436 [TCP segment of a reassembled PDU]"
"6.673355","172.19.0.3","5.9.29.183","TCP","56","43520 → 9002 [ACK] Seq=20490 Ack=392893 Win=11903 Len=0"
"6.682095","5.9.29.183","172.19.0.3","TLSv1.2","1516","Application Data [TCP segment of a reassembled PDU]"
"6.682118","5.9.29.183","172.19.0.3","TCP","1492","9002 → 43520 [PSH, ACK] Seq=394353 Ack=20490 Win=65535 Len=1436 [TCP segment of a reassembled PDU]"
"6.682127","172.19.0.3","5.9.29.183","TCP","56","43520 → 9002 [ACK] Seq=20490 Ack=395789 Win=11903 Len=0"
"6.682129","5.9.29.183","172.19.0.3","TCP","1504","9002 → 43520 [PSH, ACK] Seq=395789 Ack=20490 Win=65535 Len=1448 [TCP segment of a reassembled PDU]"
"6.682672","5.9.29.183","172.19.0.3","TLSv1.2","1031","Application Data, Application Data"
"6.682678","172.19.0.3","5.9.29.183","TCP","56","43520 → 9002 [ACK] Seq=20490 Ack=398212 Win=11911 Len=0"
"6.682841","172.19.0.3","5.9.29.183","TLSv1.2","599","Application Data"
"6.682984","5.9.29.183","172.19.0.3","TCP","56","9002 → 43520 [ACK] Seq=398212 Ack=21033 Win=65535 Len=0"
"6.703565","5.9.29.183","172.19.0.3","TCP","1516","[TCP segment of a reassembled PDU]"
"6.703588","5.9.29.183","172.19.0.3","TCP","1492","9002 → 43520 [PSH, ACK] Seq=399672 Ack=21033 Win=65535 Len=1436 [TCP segment of a reassembled PDU]"
"6.703591","5.9.29.183","172.19.0.3","TLSv1.2","787","Application Data"
"6.703692","172.19.0.3","5.9.29.183","TCP","56","43520 → 9002 [ACK] Seq=21033 Ack=401839 Win=11895 Len=0"
"6.707178","172.19.0.3","5.9.29.183","TLSv1.2","599","Application Data"
"6.707346","5.9.29.183","172.19.0.3","TCP","56","9002 → 43520 [ACK] Seq=401839 Ack=21576 Win=65535 Len=0"
"7.122577","5.9.29.183","172.19.0.3","TLSv1.2","599","Application Data"
"7.123398","172.19.0.3","5.9.29.183","TLSv1.2","599","Application Data"
"7.123765","5.9.29.183","172.19.0.3","TCP","56","9002 → 43520 [ACK] Seq=402382 Ack=22119 Win=65535 Len=0"
"7.504577","5.9.29.183","172.19.0.3","TLSv1.2","599","Application Data"
"7.545836","172.19.0.3","5.9.29.183","TCP","56","43520 → 9002 [ACK] Seq=22119 Ack=402925 Win=11911 Len=0"
"7.551618","5.9.29.183","172.19.0.3","TCP","1504","[TCP segment of a reassembled PDU]"
"7.551638","172.19.0.3","5.9.29.183","TCP","56","43520 → 9002 [ACK] Seq=22119 Ack=404373 Win=11911 Len=0"
"7.551805","5.9.29.183","172.19.0.3","TCP","1504","9002 → 43520 [PSH, ACK] Seq=404373 Ack=22119 Win=65535 Len=1448 [TCP segment of a reassembled PDU]"
"7.551820","172.19.0.3","5.9.29.183","TCP","56","43520 → 9002 [ACK] Seq=22119 Ack=405821 Win=11903 Len=0"
"7.551911","5.9.29.183","172.19.0.3","TLSv1.2","787","Application Data"
"7.551919","172.19.0.3","5.9.29.183","TCP","56","43520 → 9002 [ACK] Seq=22119 Ack=406552 Win=11898 Len=0"
"7.582290","5.9.29.183","172.19.0.3","TCP","1516","[TCP segment of a reassembled PDU]"
"7.582312","172.19.0.3","5.9.29.183","TCP","56","43520 → 9002 [ACK] Seq=22119 Ack=408012 Win=11911 Len=0"
"7.582327","5.9.29.183","172.19.0.3","TCP","1516","9002 → 43520 [PSH, ACK] Seq=408012 Ack=22119 Win=65535 Len=1460 [TCP segment of a reassembled PDU]"
"7.582335","172.19.0.3","5.9.29.183","TCP","56","43520 → 9002 [ACK] Seq=22119 Ack=409472 Win=11903 Len=0"
"7.582568","5.9.29.183","172.19.0.3","TLSv1.2","763","Application Data"
"7.582578","172.19.0.3","5.9.29.183","TCP","56","43520 → 9002 [ACK] Seq=22119 Ack=410179 Win=11898 Len=0"
"7.596908","5.9.29.183","172.19.0.3","TCP","1516","[TCP segment of a reassembled PDU]"
"7.596933","172.19.0.3","5.9.29.183","TCP","56","43520 → 9002 [ACK] Seq=22119 Ack=411639 Win=11911 Len=0"
"7.596948","5.9.29.183","172.19.0.3","TCP","1492","9002 → 43520 [PSH, ACK] Seq=411639 Ack=22119 Win=65535 Len=1436 [TCP segment of a reassembled PDU]"
"7.596956","172.19.0.3","5.9.29.183","TCP","56","43520 → 9002 [ACK] Seq=22119 Ack=413075 Win=11901 Len=0"
"7.598033","5.9.29.183","172.19.0.3","TLSv1.2","787","Application Data"
"7.598043","172.19.0.3","5.9.29.183","TCP","56","43520 → 9002 [ACK] Seq=22119 Ack=413806 Win=11911 Len=0"
"7.607021","5.9.29.183","172.19.0.3","TCP","1504","[TCP segment of a reassembled PDU]"
"7.607044","172.19.0.3","5.9.29.183","TCP","56","43520 → 9002 [ACK] Seq=22119 Ack=415254 Win=11911 Len=0"
"7.607284","5.9.29.183","172.19.0.3","TCP","1516","9002 → 43520 [PSH, ACK] Seq=415254 Ack=22119 Win=65535 Len=1460 [TCP segment of a reassembled PDU]"
"7.607290","5.9.29.183","172.19.0.3","TLSv1.2","1516","Application Data [TCP segment of a reassembled PDU]"
"7.607329","5.9.29.183","172.19.0.3","TCP","1516","9002 → 43520 [PSH, ACK] Seq=418174 Ack=22119 Win=65535 Len=1460 [TCP segment of a reassembled PDU]"
"7.607372","5.9.29.183","172.19.0.3","TCP","1516","9002 → 43520 [PSH, ACK] Seq=419634 Ack=22119 Win=65535 Len=1460 [TCP segment of a reassembled PDU]"
"7.607385","172.19.0.3","5.9.29.183","TCP","56","43520 → 9002 [ACK] Seq=22119 Ack=416714 Win=11903 Len=0"
"7.607505","5.9.29.183","172.19.0.3","TLSv1.2","1456","Application Data [TCP segment of a reassembled PDU]"
"7.607508","5.9.29.183","172.19.0.3","TCP","1504","9002 → 43520 [PSH, ACK] Seq=422494 Ack=22119 Win=65535 Len=1448 [TCP segment of a reassembled PDU]"
"7.607516","172.19.0.3","5.9.29.183","TCP","56","43520 → 9002 [ACK] Seq=22119 Ack=418174 Win=11895 Len=0"
"7.607550","172.19.0.3","5.9.29.183","TCP","56","43520 → 9002 [ACK] Seq=22119 Ack=419634 Win=11887 Len=0"
"7.607582","172.19.0.3","5.9.29.183","TCP","56","43520 → 9002 [ACK] Seq=22119 Ack=421094 Win=11879 Len=0"
"7.607615","172.19.0.3","5.9.29.183","TCP","56","43520 → 9002 [ACK] Seq=22119 Ack=422494 Win=11871 Len=0"
"7.607981","172.19.0.3","5.9.29.183","TCP","56","43520 → 9002 [ACK] Seq=22119 Ack=423942 Win=11911 Len=0"
"7.612328","5.9.29.183","172.19.0.3","TCP","1504","9002 → 43520 [PSH, ACK] Seq=423942 Ack=22119 Win=65535 Len=1448 [TCP segment of a reassembled PDU]"
"7.613711","5.9.29.183","172.19.0.3","TLSv1.2","924","Application Data, Application Data"
"7.613732","172.19.0.3","5.9.29.183","TCP","56","43520 → 9002 [ACK] Seq=22119 Ack=426258 Win=11911 Len=0"
"7.637168","5.9.29.183","172.19.0.3","TCP","1516","[TCP segment of a reassembled PDU]"
"7.637194","5.9.29.183","172.19.0.3","TCP","1516","9002 → 43520 [PSH, ACK] Seq=427718 Ack=22119 Win=65535 Len=1460 [TCP segment of a reassembled PDU]"
"7.637198","5.9.29.183","172.19.0.3","TLSv1.2","249","Application Data"
"7.637296","172.19.0.3","5.9.29.183","TCP","56","43520 → 9002 [ACK] Seq=22119 Ack=429371 Win=11895 Len=0"
"7.637698","172.19.0.3","5.9.29.183","TLSv1.2","599","Application Data"
"7.637869","5.9.29.183","172.19.0.3","TCP","56","9002 → 43520 [ACK] Seq=429371 Ack=22662 Win=65535 Len=0"
"7.647431","172.19.0.3","5.9.29.183","TLSv1.2","599","Application Data"
"7.647622","5.9.29.183","172.19.0.3","TCP","56","9002 → 43520 [ACK] Seq=429371 Ack=23205 Win=65535 Len=0"
"7.976794","5.9.29.183","172.19.0.3","TLSv1.2","599","Application Data"
"7.977810","172.19.0.3","5.9.29.183","TLSv1.2","599","Application Data"
"7.978203","5.9.29.183","172.19.0.3","TCP","56","9002 → 43520 [ACK] Seq=429914 Ack=23748 Win=65535 Len=0"
"8.385415","5.9.29.183","172.19.0.3","TCP","1516","[TCP segment of a reassembled PDU]"
"8.385443","5.9.29.183","172.19.0.3","TCP","1516","9002 → 43520 [PSH, ACK] Seq=431374 Ack=23748 Win=65535 Len=1460 [TCP segment of a reassembled PDU]"
"8.385448","5.9.29.183","172.19.0.3","TLSv1.2","763","Application Data"
"8.385554","172.19.0.3","5.9.29.183","TCP","56","43520 → 9002 [ACK] Seq=23748 Ack=433541 Win=11895 Len=0"
"8.385802","172.19.0.3","5.9.29.183","TLSv1.2","599","Application Data"
"8.386015","5.9.29.183","172.19.0.3","TCP","56","9002 → 43520 [ACK] Seq=433541 Ack=24291 Win=65535 Len=0"
"8.465636","5.9.29.183","172.19.0.3","TCP","1516","[TCP segment of a reassembled PDU]"
"8.465663","5.9.29.183","172.19.0.3","TLSv1.2","1195","Application Data"
"8.465785","172.19.0.3","5.9.29.183","TCP","56","43520 → 9002 [ACK] Seq=24291 Ack=436140 Win=11903 Len=0"
"8.469565","172.19.0.3","5.9.29.183","TLSv1.2","599","Application Data"
"8.469896","5.9.29.183","172.19.0.3","TCP","56","9002 → 43520 [ACK] Seq=436140 Ack=24834 Win=65535 Len=0"
"8.861380","5.9.29.183","172.19.0.3","TLSv1.2","599","Application Data"
"8.861957","172.19.0.3","5.9.29.183","TLSv1.2","599","Application Data"
"8.862137","5.9.29.183","172.19.0.3","TCP","56","9002 → 43520 [ACK] Seq=436683 Ack=25377 Win=65535 Len=0"
"9.210127","5.9.29.183","172.19.0.3","TCP","1504","[TCP segment of a reassembled PDU]"
"9.211805","5.9.29.183","172.19.0.3","TCP","971","9002 → 43520 [PSH, ACK] Seq=438131 Ack=25377 Win=65535 Len=915 [TCP segment of a reassembled PDU]"
"9.211855","172.19.0.3","5.9.29.183","TCP","56","43520 → 9002 [ACK] Seq=25377 Ack=439046 Win=11911 Len=0"
"9.211943","5.9.29.183","172.19.0.3","TLSv1.2","1320","Application Data"
"9.227125","5.9.29.183","172.19.0.3","TCP","1504","[TCP segment of a reassembled PDU]"
"9.227146","172.19.0.3","5.9.29.183","TCP","56","43520 → 9002 [ACK] Seq=25377 Ack=441758 Win=11911 Len=0"
"9.227316","5.9.29.183","172.19.0.3","TCP","1504","9002 → 43520 [PSH, ACK] Seq=441758 Ack=25377 Win=65535 Len=1448 [TCP segment of a reassembled PDU]"
"9.227481","5.9.29.183","172.19.0.3","TLSv1.2","787","Application Data"
"9.227526","172.19.0.3","5.9.29.183","TCP","56","43520 → 9002 [ACK] Seq=25377 Ack=443937 Win=11911 Len=0"
"9.243897","5.9.29.183","172.19.0.3","TCP","1504","[TCP segment of a reassembled PDU]"
"9.244260","5.9.29.183","172.19.0.3","TCP","1504","9002 → 43520 [PSH, ACK] Seq=445385 Ack=25377 Win=65535 Len=1448 [TCP segment of a reassembled PDU]"
"9.244275","172.19.0.3","5.9.29.183","TCP","56","43520 → 9002 [ACK] Seq=25377 Ack=446833 Win=11911 Len=0"
"9.244431","5.9.29.183","172.19.0.3","TLSv1.2","787","Application Data"
"9.254910","5.9.29.183","172.19.0.3","TCP","1516","[TCP segment of a reassembled PDU]"
"9.254928","172.19.0.3","5.9.29.183","TCP","56","43520 → 9002 [ACK] Seq=25377 Ack=449024 Win=11911 Len=0"
"9.254940","5.9.29.183","172.19.0.3","TCP","1516","9002 → 43520 [PSH, ACK] Seq=449024 Ack=25377 Win=65535 Len=1460 [TCP segment of a reassembled PDU]"
"9.254945","5.9.29.183","172.19.0.3","TLSv1.2","1516","Application Data [TCP segment of a reassembled PDU]"
"9.254948","5.9.29.183","172.19.0.3","TCP","1468","9002 → 43520 [PSH, ACK] Seq=451944 Ack=25377 Win=65535 Len=1412 [TCP segment of a reassembled PDU]"
"9.255088","172.19.0.3","5.9.29.183","TCP","56","43520 → 9002 [ACK] Seq=25377 Ack=453356 Win=11887 Len=0"
"9.256538","5.9.29.183","172.19.0.3","TCP","1516","9002 → 43520 [PSH, ACK] Seq=453356 Ack=25377 Win=65535 Len=1460 [TCP segment of a reassembled PDU]"
"9.256548","5.9.29.183","172.19.0.3","TLSv1.2","1516","Application Data [TCP segment of a reassembled PDU]"
"9.256555","172.19.0.3","5.9.29.183","TCP","56","43520 → 9002 [ACK] Seq=25377 Ack=456276 Win=11903 Len=0"
"9.256556","5.9.29.183","172.19.0.3","TCP","1480","9002 → 43520 [PSH, ACK] Seq=456276 Ack=25377 Win=65535 Len=1424 [TCP segment of a reassembled PDU]"
"9.261307","5.9.29.183","172.19.0.3","TCP","1516","9002 → 43520 [PSH, ACK] Seq=457700 Ack=25377 Win=65535 Len=1460 [TCP segment of a reassembled PDU]"
"9.261328","172.19.0.3","5.9.29.183","TCP","56","43520 → 9002 [ACK] Seq=25377 Ack=459160 Win=11911 Len=0"
"9.261341","5.9.29.183","172.19.0.3","TLSv1.2","912","Application Data, Application Data"
"9.271215","5.9.29.183","172.19.0.3","TCP","1516","[TCP segment of a reassembled PDU]"
"9.271232","172.19.0.3","5.9.29.183","TCP","56","43520 → 9002 [ACK] Seq=25377 Ack=461476 Win=11911 Len=0"
"9.271244","5.9.29.183","172.19.0.3","TCP","1516","9002 → 43520 [PSH, ACK] Seq=461476 Ack=25377 Win=65535 Len=1460 [TCP segment of a reassembled PDU]"
"9.271249","5.9.29.183","172.19.0.3","TLSv1.2","1480","Application Data [TCP segment of a reassembled PDU]"
"9.271379","172.19.0.3","5.9.29.183","TCP","56","43520 → 9002 [ACK] Seq=25377 Ack=464360 Win=11895 Len=0"
"9.271609","172.19.0.3","5.9.29.183","TLSv1.2","599","Application Data"
"9.271851","5.9.29.183","172.19.0.3","TCP","56","9002 → 43520 [ACK] Seq=464360 Ack=25920 Win=65535 Len=0"
"9.276808","5.9.29.183","172.19.0.3","TLSv1.2","910","Application Data"
"9.287458","5.9.29.183","172.19.0.3","TCP","1504","[TCP segment of a reassembled PDU]"
"9.287481","172.19.0.3","5.9.29.183","TCP","56","43520 → 9002 [ACK] Seq=25920 Ack=466662 Win=11911 Len=0"
"9.287873","5.9.29.183","172.19.0.3","TCP","1516","9002 → 43520 [PSH, ACK] Seq=466662 Ack=25920 Win=65535 Len=1460 [TCP segment of a reassembled PDU]"
"9.287885","5.9.29.183","172.19.0.3","TLSv1.2","1516","Application Data [TCP segment of a reassembled PDU]"
"9.287890","5.9.29.183","172.19.0.3","TCP","1516","9002 → 43520 [PSH, ACK] Seq=469582 Ack=25920 Win=65535 Len=1460 [TCP segment of a reassembled PDU]"
"9.287986","5.9.29.183","172.19.0.3","TCP","1468","9002 → 43520 [PSH, ACK] Seq=471042 Ack=25920 Win=65535 Len=1412 [TCP segment of a reassembled PDU]"
"9.288021","172.19.0.3","5.9.29.183","TCP","56","43520 → 9002 [ACK] Seq=25920 Ack=472454 Win=11887 Len=0"
"9.292177","5.9.29.183","172.19.0.3","TLSv1.2","584","Application Data"
"9.304702","5.9.29.183","172.19.0.3","TCP","1516","[TCP segment of a reassembled PDU]"
"9.304735","172.19.0.3","5.9.29.183","TCP","56","43520 → 9002 [ACK] Seq=25920 Ack=474442 Win=11911 Len=0"
"9.304751","5.9.29.183","172.19.0.3","TCP","1492","9002 → 43520 [PSH, ACK] Seq=474442 Ack=25920 Win=65535 Len=1436 [TCP segment of a reassembled PDU]"
"9.305236","5.9.29.183","172.19.0.3","TLSv1.2","1516","Application Data [TCP segment of a reassembled PDU]"
"9.305244","172.19.0.3","5.9.29.183","TCP","56","43520 → 9002 [ACK] Seq=25920 Ack=477338 Win=11911 Len=0"
"9.305249","5.9.29.183","172.19.0.3","TCP","1492","9002 → 43520 [PSH, ACK] Seq=477338 Ack=25920 Win=65535 Len=1436 [TCP segment of a reassembled PDU]"
"9.305253","5.9.29.183","172.19.0.3","TCP","1516","9002 → 43520 [PSH, ACK] Seq=478774 Ack=25920 Win=65535 Len=1460 [TCP segment of a reassembled PDU]"
"9.305355","5.9.29.183","172.19.0.3","TLSv1.2","1516","Application Data [TCP segment of a reassembled PDU]"
"9.305360","5.9.29.183","172.19.0.3","TCP","1480","9002 → 43520 [PSH, ACK] Seq=481694 Ack=25920 Win=65535 Len=1424 [TCP segment of a reassembled PDU]"
"9.305363","5.9.29.183","172.19.0.3","TCP","1504","9002 → 43520 [PSH, ACK] Seq=483118 Ack=25920 Win=65535 Len=1448 [TCP segment of a reassembled PDU]"
"9.305390","172.19.0.3","5.9.29.183","TCP","56","43520 → 9002 [ACK] Seq=25920 Ack=484566 Win=11871 Len=0"
"9.307498","5.9.29.183","172.19.0.3","TLSv1.2","924","Application Data, Application Data"
"9.311293","172.19.0.3","5.9.29.183","TLSv1.2","599","Application Data"
"9.311539","5.9.29.183","172.19.0.3","TCP","56","9002 → 43520 [ACK] Seq=485434 Ack=26463 Win=65535 Len=0"
"9.711549","5.9.29.183","172.19.0.3","TLSv1.2","599","Application Data"
"9.712232","172.19.0.3","5.9.29.183","TLSv1.2","599","Application Data"
"9.712481","5.9.29.183","172.19.0.3","TCP","56","9002 → 43520 [ACK] Seq=485977 Ack=27006 Win=65535 Len=0"
"10.011693","5.9.29.183","172.19.0.3","TCP","1504","[TCP segment of a reassembled PDU]"
"10.012000","5.9.29.183","172.19.0.3","TCP","1504","9002 → 43520 [PSH, ACK] Seq=487425 Ack=27006 Win=65535 Len=1448 [TCP segment of a reassembled PDU]"
"10.012038","172.19.0.3","5.9.29.183","TCP","56","43520 → 9002 [ACK] Seq=27006 Ack=488873 Win=11911 Len=0"
"10.012097","5.9.29.183","172.19.0.3","TLSv1.2","787","Application Data"
"10.012297","172.19.0.3","5.9.29.183","TLSv1.2","599","Application Data"
"10.012548","5.9.29.183","172.19.0.3","TCP","56","9002 → 43520 [ACK] Seq=489604 Ack=27549 Win=65535 Len=0"
"10.044194","5.9.29.183","172.19.0.3","TCP","1504","[TCP segment of a reassembled PDU]"
"10.044220","5.9.29.183","172.19.0.3","TCP","1516","9002 → 43520 [PSH, ACK] Seq=491052 Ack=27549 Win=65535 Len=1460 [TCP segment of a reassembled PDU]"
"10.044224","5.9.29.183","172.19.0.3","TLSv1.2","775","Application Data"
"10.044330","172.19.0.3","5.9.29.183","TCP","56","43520 → 9002 [ACK] Seq=27549 Ack=493231 Win=11895 Len=0"
"10.061203","5.9.29.183","172.19.0.3","TCP","1516","[TCP segment of a reassembled PDU]"
"10.061251","5.9.29.183","172.19.0.3","TCP","1516","9002 → 43520 [PSH, ACK] Seq=494691 Ack=27549 Win=65535 Len=1460 [TCP segment of a reassembled PDU]"
"10.061271","172.19.0.3","5.9.29.183","TCP","56","43520 → 9002 [ACK] Seq=27549 Ack=496151 Win=11903 Len=0"
"10.061275","5.9.29.183","172.19.0.3","TLSv1.2","763","Application Data"
"10.092923","5.9.29.183","172.19.0.3","TCP","1516","[TCP segment of a reassembled PDU]"
"10.092945","172.19.0.3","5.9.29.183","TCP","56","43520 → 9002 [ACK] Seq=27549 Ack=498318 Win=11911 Len=0"
"10.092959","5.9.29.183","172.19.0.3","TLSv1.2","167","Application Data"
"10.123175","5.9.29.183","172.19.0.3","TCP","1516","[TCP segment of a reassembled PDU]"
"10.123197","172.19.0.3","5.9.29.183","TCP","56","43520 → 9002 [ACK] Seq=27549 Ack=499889 Win=11911 Len=0"
"10.123213","5.9.29.183","172.19.0.3","TCP","1516","9002 → 43520 [PSH, ACK] Seq=499889 Ack=27549 Win=65535 Len=1460 [TCP segment of a reassembled PDU]"
"10.123221","5.9.29.183","172.19.0.3","TLSv1.2","763","Application Data"
"10.123490","172.19.0.3","5.9.29.183","TCP","56","43520 → 9002 [ACK] Seq=27549 Ack=502056 Win=11895 Len=0"
"10.127278","172.19.0.3","5.9.29.183","TLSv1.2","599","Application Data"
"10.127519","5.9.29.183","172.19.0.3","TCP","56","9002 → 43520 [ACK] Seq=502056 Ack=28092 Win=65535 Len=0"
"10.415599","5.9.29.183","172.19.0.3","TLSv1.2","599","Application Data"
"10.416335","172.19.0.3","5.9.29.183","TLSv1.2","599","Application Data"
"10.416674","5.9.29.183","172.19.0.3","TCP","56","9002 → 43520 [ACK] Seq=502599 Ack=28635 Win=65535 Len=0"
"10.730097","5.9.29.183","172.19.0.3","TLSv1.2","599","Application Data"
"10.749295","5.9.29.183","172.19.0.3","TCP","1496","[TCP segment of a reassembled PDU]"
"10.749317","172.19.0.3","5.9.29.183","TCP","56","43520 → 9002 [ACK] Seq=28635 Ack=504582 Win=11911 Len=0"
"10.749331","5.9.29.183","172.19.0.3","TCP","1516","9002 → 43520 [PSH, ACK] Seq=504582 Ack=28635 Win=65535 Len=1460 [TCP segment of a reassembled PDU]"
"10.749340","5.9.29.183","172.19.0.3","TLSv1.2","783","Application Data"
"10.749504","172.19.0.3","5.9.29.183","TCP","56","43520 → 9002 [ACK] Seq=28635 Ack=506769 Win=11895 Len=0"
"10.762975","5.9.29.183","172.19.0.3","TCP","1504","[TCP segment of a reassembled PDU]"
"10.763263","5.9.29.183","172.19.0.3","TCP","1504","9002 → 43520 [PSH, ACK] Seq=508217 Ack=28635 Win=65535 Len=1448 [TCP segment of a reassembled PDU]"
"10.763275","172.19.0.3","5.9.29.183","TCP","56","43520 → 9002 [ACK] Seq=28635 Ack=509665 Win=11911 Len=0"
"10.766486","5.9.29.183","172.19.0.3","TLSv1.2","1330","Application Data, Application Data"
"10.774306","5.9.29.183","172.19.0.3","TCP","1516","[TCP segment of a reassembled PDU]"
"10.774317","172.19.0.3","5.9.29.183","TCP","56","43520 → 9002 [ACK] Seq=28635 Ack=512399 Win=11911 Len=0"
"10.774323","5.9.29.183","172.19.0.3","TCP","1516","9002 → 43520 [PSH, ACK] Seq=512399 Ack=28635 Win=65535 Len=1460 [TCP segment of a reassembled PDU]"
"10.774328","5.9.29.183","172.19.0.3","TLSv1.2","1480","Application Data [TCP segment of a reassembled PDU]"
"10.774459","5.9.29.183","172.19.0.3","TCP","1516","9002 → 43520 [PSH, ACK] Seq=515283 Ack=28635 Win=65535 Len=1460 [TCP segment of a reassembled PDU]"
"10.774539","5.9.29.183","172.19.0.3","TCP","1492","9002 → 43520 [PSH, ACK] Seq=516743 Ack=28635 Win=65535 Len=1436 [TCP segment of a reassembled PDU]"
"10.774543","172.19.0.3","5.9.29.183","TCP","56","43520 → 9002 [ACK] Seq=28635 Ack=516743 Win=11887 Len=0"
"10.781976","5.9.29.183","172.19.0.3","TLSv1.2","584","Application Data"
"10.781994","172.19.0.3","5.9.29.183","TCP","56","43520 → 9002 [ACK] Seq=28635 Ack=518707 Win=11911 Len=0"
"10.794297","5.9.29.183","172.19.0.3","TCP","1504","[TCP segment of a reassembled PDU]"
"10.794556","5.9.29.183","172.19.0.3","TCP","1504","9002 → 43520 [PSH, ACK] Seq=520155 Ack=28635 Win=65535 Len=1448 [TCP segment of a reassembled PDU]"
"10.794567","172.19.0.3","5.9.29.183","TCP","56","43520 → 9002 [ACK] Seq=28635 Ack=521603 Win=11911 Len=0"
"10.797082","5.9.29.183","172.19.0.3","TLSv1.2","1330","Application Data, Application Data"
"10.805479","5.9.29.183","172.19.0.3","TCP","1516","[TCP segment of a reassembled PDU]"
"10.805502","172.19.0.3","5.9.29.183","TCP","56","43520 → 9002 [ACK] Seq=28635 Ack=524337 Win=11911 Len=0"
"10.805517","5.9.29.183","172.19.0.3","TCP","1516","9002 → 43520 [PSH, ACK] Seq=524337 Ack=28635 Win=65535 Len=1460 [TCP segment of a reassembled PDU]"
"10.805525","5.9.29.183","172.19.0.3","TLSv1.2","1516","Application Data [TCP segment of a reassembled PDU]"
"10.805529","5.9.29.183","172.19.0.3","TCP","1516","9002 → 43520 [PSH, ACK] Seq=527257 Ack=28635 Win=65535 Len=1460 [TCP segment of a reassembled PDU]"
"10.805534","5.9.29.183","172.19.0.3","TCP","1456","9002 → 43520 [PSH, ACK] Seq=528717 Ack=28635 Win=65535 Len=1400 [TCP segment of a reassembled PDU]"
"10.805730","172.19.0.3","5.9.29.183","TCP","56","43520 → 9002 [ACK] Seq=28635 Ack=530117 Win=11879 Len=0"
"10.812696","5.9.29.183","172.19.0.3","TLSv1.2","584","Application Data"
"10.813052","172.19.0.3","5.9.29.183","TLSv1.2","599","Application Data"
"10.813422","5.9.29.183","172.19.0.3","TCP","56","9002 → 43520 [ACK] Seq=530645 Ack=29178 Win=65535 Len=0"
"10.820918","5.9.29.183","172.19.0.3","TCP","1504","[TCP segment of a reassembled PDU]"
"10.820970","5.9.29.183","172.19.0.3","TCP","1516","9002 → 43520 [PSH, ACK] Seq=532093 Ack=29178 Win=65535 Len=1460 [TCP segment of a reassembled PDU]"
"10.820977","5.9.29.183","172.19.0.3","TLSv1.2","1492","Application Data [TCP segment of a reassembled PDU]"
"10.820979","5.9.29.183","172.19.0.3","TCP","1516","9002 → 43520 [PSH, ACK] Seq=534989 Ack=29178 Win=65535 Len=1460 [TCP segment of a reassembled PDU]"
"10.821051","5.9.29.183","172.19.0.3","TCP","1516","9002 → 43520 [PSH, ACK] Seq=536449 Ack=29178 Win=65535 Len=1460 [TCP segment of a reassembled PDU]"
"10.821056","5.9.29.183","172.19.0.3","TLSv1.2","1516","Application Data [TCP segment of a reassembled PDU]"
"10.821085","5.9.29.183","172.19.0.3","TCP","1516","9002 → 43520 [PSH, ACK] Seq=539369 Ack=29178 Win=65535 Len=1460 [TCP segment of a reassembled PDU]"
"10.821092","5.9.29.183","172.19.0.3","TCP","1456","9002 → 43520 [PSH, ACK] Seq=540829 Ack=29178 Win=65535 Len=1400 [TCP segment of a reassembled PDU]"
"10.821107","5.9.29.183","172.19.0.3","TLSv1.2","1504","Application Data [TCP segment of a reassembled PDU]"
"10.821179","172.19.0.3","5.9.29.183","TCP","56","43520 → 9002 [ACK] Seq=29178 Ack=543677 Win=11847 Len=0"
"10.821790","172.19.0.3","5.9.29.183","TLSv1.2","599","Application Data"
"10.821998","5.9.29.183","172.19.0.3","TCP","56","9002 → 43520 [ACK] Seq=543677 Ack=29721 Win=65535 Len=0"
"10.827892","5.9.29.183","172.19.0.3","TCP","1504","9002 → 43520 [PSH, ACK] Seq=543677 Ack=29721 Win=65535 Len=1448 [TCP segment of a reassembled PDU]"
"10.827915","5.9.29.183","172.19.0.3","TLSv1.2","1112","Application Data"
"10.828018","172.19.0.3","5.9.29.183","TCP","56","43520 → 9002 [ACK] Seq=29721 Ack=546181 Win=11911 Len=0"
"10.865243","5.9.29.183","172.19.0.3","TCP","1504","[TCP segment of a reassembled PDU]"
"10.865323","5.9.29.183","172.19.0.3","TCP","1504","9002 → 43520 [PSH, ACK] Seq=547629 Ack=29721 Win=65535 Len=1448 [TCP segment of a reassembled PDU]"
"10.865552","5.9.29.183","172.19.0.3","TLSv1.2","1516","Application Data [TCP segment of a reassembled PDU]"
"10.865562","5.9.29.183","172.19.0.3","TCP","1516","9002 → 43520 [PSH, ACK] Seq=550537 Ack=29721 Win=65535 Len=1460 [TCP segment of a reassembled PDU]"
"10.865566","5.9.29.183","172.19.0.3","TCP","1213","9002 → 43520 [PSH, ACK] Seq=551997 Ack=29721 Win=65535 Len=1157 [TCP segment of a reassembled PDU]"
"10.865660","172.19.0.3","5.9.29.183","TCP","56","43520 → 9002 [ACK] Seq=29721 Ack=553154 Win=11879 Len=0"
"10.880898","5.9.29.183","172.19.0.3","TLSv1.2","851","Application Data"
"10.884295","5.9.29.183","172.19.0.3","TCP","1504","[TCP segment of a reassembled PDU]"
"10.884316","172.19.0.3","5.9.29.183","TCP","56","43520 → 9002 [ACK] Seq=29721 Ack=555397 Win=11911 Len=0"
"10.884942","5.9.29.183","172.19.0.3","TCP","1516","9002 → 43520 [PSH, ACK] Seq=555397 Ack=29721 Win=65535 Len=1460 [TCP segment of a reassembled PDU]"
"10.884956","5.9.29.183","172.19.0.3","TLSv1.2","1516","Application Data [TCP segment of a reassembled PDU]"
"10.884961","5.9.29.183","172.19.0.3","TCP","1516","9002 → 43520 [PSH, ACK] Seq=558317 Ack=29721 Win=65535 Len=1460 [TCP segment of a reassembled PDU]"
"10.885044","5.9.29.183","172.19.0.3","TCP","1468","9002 → 43520 [PSH, ACK] Seq=559777 Ack=29721 Win=65535 Len=1412 [TCP segment of a reassembled PDU]"
"10.885077","5.9.29.183","172.19.0.3","TLSv1.2","1516","Application Data [TCP segment of a reassembled PDU]"
"10.885082","5.9.29.183","172.19.0.3","TCP","1492","9002 → 43520 [PSH, ACK] Seq=562649 Ack=29721 Win=65535 Len=1436 [TCP segment of a reassembled PDU]"
"10.885121","172.19.0.3","5.9.29.183","TCP","56","43520 → 9002 [ACK] Seq=29721 Ack=564085 Win=11871 Len=0"
"10.885390","172.19.0.3","5.9.29.183","TLSv1.2","599","Application Data"
"10.885667","5.9.29.183","172.19.0.3","TCP","56","9002 → 43520 [ACK] Seq=564085 Ack=30264 Win=65535 Len=0"
"10.897394","5.9.29.183","172.19.0.3","TLSv1.2","801","Application Data"
"10.901301","5.9.29.183","172.19.0.3","TCP","1504","[TCP segment of a reassembled PDU]"
"10.901322","172.19.0.3","5.9.29.183","TCP","56","43520 → 9002 [ACK] Seq=30264 Ack=566278 Win=11911 Len=0"
"10.901734","5.9.29.183","172.19.0.3","TCP","1516","9002 → 43520 [PSH, ACK] Seq=566278 Ack=30264 Win=65535 Len=1460 [TCP segment of a reassembled PDU]"
"10.901746","5.9.29.183","172.19.0.3","TLSv1.2","1516","Application Data [TCP segment of a reassembled PDU]"
"10.901751","5.9.29.183","172.19.0.3","TCP","976","9002 → 43520 [PSH, ACK] Seq=569198 Ack=30264 Win=65535 Len=920 [TCP segment of a reassembled PDU]"
"10.901845","5.9.29.183","172.19.0.3","TCP","1516","9002 → 43520 [PSH, ACK] Seq=570118 Ack=30264 Win=65535 Len=1460 [TCP segment of a reassembled PDU]"
"10.901852","5.9.29.183","172.19.0.3","TLSv1.2","1516","Application Data [TCP segment of a reassembled PDU]"
"10.901912","5.9.29.183","172.19.0.3","TCP","1516","9002 → 43520 [PSH, ACK] Seq=573038 Ack=30264 Win=65535 Len=1460 [TCP segment of a reassembled PDU]"
"10.901918","5.9.29.183","172.19.0.3","TCP","1516","9002 → 43520 [PSH, ACK] Seq=574498 Ack=30264 Win=65535 Len=1460 [TCP segment of a reassembled PDU]"
"10.901987","5.9.29.183","172.19.0.3","TLSv1.2","1516","Application Data [TCP segment of a reassembled PDU]"
"10.901993","5.9.29.183","172.19.0.3","TCP","500","9002 → 43520 [PSH, ACK] Seq=577418 Ack=30264 Win=65535 Len=444 [TCP segment of a reassembled PDU]"
"10.902010","172.19.0.3","5.9.29.183","TCP","56","43520 → 9002 [ACK] Seq=30264 Ack=577862 Win=11845 Len=0"
"10.912709","5.9.29.183","172.19.0.3","TLSv1.2","504","Application Data"
"10.938457","5.9.29.183","172.19.0.3","TCP","1516","[TCP segment of a reassembled PDU]"
"10.938476","172.19.0.3","5.9.29.183","TCP","56","43520 → 9002 [ACK] Seq=30264 Ack=579770 Win=11911 Len=0"
"10.938483","5.9.29.183","172.19.0.3","TLSv1.2","167","Application Data"
"10.979566","172.19.0.3","5.9.29.183","TCP","56","43520 → 9002 [ACK] Seq=30264 Ack=579881 Win=11911 Len=0"
