_ws.col.Time,_ws.col.Source,_ws.col.Destination,_ws.col.Protocol,_ws.col.Length,_ws.col.Info
"0.000000","172.19.0.3","5.9.29.183","TLSv1.2","599","Application Data"
"0.000378","5.9.29.183","172.19.0.3","TCP","56","9002 → 43520 [ACK] Seq=1 Ack=544 Win=65535 Len=0"
"0.293435","5.9.29.183","172.19.0.3","TLSv1.2","599","Application Data"
"0.294114","172.19.0.3","5.9.29.183","TLSv1.2","2141","Application Data"
"0.294637","5.9.29.183","172.19.0.3","TCP","56","9002 → 43520 [ACK] Seq=544 Ack=2629 Win=65535 Len=0"
"0.570557","5.9.29.183","172.19.0.3","TLSv1.2","599","Application Data"
"0.611593","172.19.0.3","5.9.29.183","TCP","56","43520 → 9002 [ACK] Seq=2629 Ack=1087 Win=11911 Len=0"
"1.178580","5.9.29.183","172.19.0.3","TLSv1.2","599","Application Data"
"1.178604","172.19.0.3","5.9.29.183","TCP","56","43520 → 9002 [ACK] Seq=2629 Ack=1630 Win=11911 Len=0"
"1.215359","5.9.29.183","172.19.0.3","TLSv1.2","1113","Application Data"
"1.215383","172.19.0.3","5.9.29.183","TCP","56","43520 → 9002 [ACK] Seq=2629 Ack=2687 Win=11911 Len=0"
"1.219415","172.19.0.3","5.9.29.183","TLSv1.2","599","Application Data"
"1.219727","5.9.29.183","172.19.0.3","TCP","56","9002 → 43520 [ACK] Seq=2687 Ack=3172 Win=65535 Len=0"
"1.502579","5.9.29.183","172.19.0.3","TLSv1.2","599","Application Data"
"1.503349","172.19.0.3","5.9.29.183","TLSv1.2","599","Application Data"
"1.503641","5.9.29.183","172.19.0.3","TCP","56","9002 → 43520 [ACK] Seq=3230 Ack=3715 Win=65535 Len=0"
"1.820290","5.9.29.183","172.19.0.3","TCP","1516","[TCP segment of a reassembled PDU]"
"1.820323","5.9.29.183","172.19.0.3","TCP","1516","9002 → 43520 [PSH, ACK] Seq=4690 Ack=3715 Win=65535 Len=1460 [TCP segment of a reassembled PDU]"
"1.820332","5.9.29.183","172.19.0.3","TLSv1.2","763","Application Data"
"1.820472","172.19.0.3","5.9.29.183","TCP","56","43520 → 9002 [ACK] Seq=3715 Ack=6857 Win=11895 Len=0"
"1.857028","5.9.29.183","172.19.0.3","TCP","1516","[TCP segment of a reassembled PDU]"
"1.857056","5.9.29.183","172.19.0.3","TCP","1516","9002 → 43520 [PSH, ACK] Seq=8317 Ack=3715 Win=65535 Len=1460 [TCP segment of a reassembled PDU]"
"1.857070","172.19.0.3","5.9.29.183","TCP","56","43520 → 9002 [ACK] Seq=3715 Ack=9777 Win=11903 Len=0"
"1.857072","5.9.29.183","172.19.0.3","TLSv1.2","763","Application Data"
"1.861077","172.19.0.3","5.9.29.183","TLSv1.2","599","Application Data"
"1.861335","5.9.29.183","172.19.0.3","TCP","56","9002 → 43520 [ACK] Seq=10484 Ack=4258 Win=65535 Len=0"
"2.146922","5.9.29.183","172.19.0.3","TLSv1.2","599","Application Data"
"2.147532","172.19.0.3","5.9.29.183","TLSv1.2","599","Application Data"
"2.147756","5.9.29.183","172.19.0.3","TCP","56","9002 → 43520 [ACK] Seq=11027 Ack=4801 Win=65535 Len=0"
"2.487900","5.9.29.183","172.19.0.3","TCP","1516","[TCP segment of a reassembled PDU]"
"2.487934","5.9.29.183","172.19.0.3","TCP","1516","9002 → 43520 [PSH, ACK] Seq=12487 Ack=4801 Win=65535 Len=1460 [TCP segment of a reassembled PDU]"
"2.487943","5.9.29.183","172.19.0.3","TLSv1.2","763","Application Data"
"2.488088","172.19.0.3","5.9.29.183","TCP","56","43520 → 9002 [ACK] Seq=4801 Ack=14654 Win=11895 Len=0"
"2.515268","5.9.29.183","172.19.0.3","TLSv1.2","1113","Application Data"
"2.556679","172.19.0.3","5.9.29.183","TCP","56","43520 → 9002 [ACK] Seq=4801 Ack=15711 Win=11911 Len=0"
"2.558289","5.9.29.183","172.19.0.3","TCP","1504","[TCP segment of a reassembled PDU]"
"2.558302","172.19.0.3","5.9.29.183","TCP","56","43520 → 9002 [ACK] Seq=4801 Ack=17159 Win=11911 Len=0"
"2.558456","5.9.29.183","172.19.0.3","TCP","1516","9002 → 43520 [PSH, ACK] Seq=17159 Ack=4801 Win=65535 Len=1460 [TCP segment of a reassembled PDU]"
"2.558468","172.19.0.3","5.9.29.183","TCP","56","43520 → 9002 [ACK] Seq=4801 Ack=18619 Win=11903 Len=0"
"2.558470","5.9.29.183","172.19.0.3","TLSv1.2","775","Application Data"
"2.558475","172.19.0.3","5.9.29.183","TCP","56","43520 → 9002 [ACK] Seq=4801 Ack=19338 Win=11898 Len=0"
"2.561971","172.19.0.3","5.9.29.183","TLSv1.2","599","Application Data"
"2.562201","5.9.29.183","172.19.0.3","TCP","56","9002 → 43520 [ACK] Seq=19338 Ack=5344 Win=65535 Len=0"
"2.846562","5.9.29.183","172.19.0.3","TLSv1.2","599","Application Data"
"2.847168","172.19.0.3","5.9.29.183","TLSv1.2","599","Application Data"
"2.847420","5.9.29.183","172.19.0.3","TCP","56","9002 → 43520 [ACK] Seq=19881 Ack=5887 Win=65535 Len=0"
"3.171093","5.9.29.183","172.19.0.3","TCP","1516","[TCP segment of a reassembled PDU]"
"3.171208","5.9.29.183","172.19.0.3","TCP","1516","9002 → 43520 [PSH, ACK] Seq=21341 Ack=5887 Win=65535 Len=1460 [TCP segment of a reassembled PDU]"
"3.171229","5.9.29.183","172.19.0.3","TLSv1.2","763","Application Data"
"3.171396","172.19.0.3","5.9.29.183","TCP","56","43520 → 9002 [ACK] Seq=5887 Ack=23508 Win=11895 Len=0"
"3.186598","5.9.29.183","172.19.0.3","TLSv1.2","599","Application Data"
"3.195138","5.9.29.183","172.19.0.3","TCP","1516","[TCP segment of a reassembled PDU]"
"3.195163","172.19.0.3","5.9.29.183","TCP","56","43520 → 9002 [ACK] Seq=5887 Ack=25511 Win=11911 Len=0"
"3.195221","5.9.29.183","172.19.0.3","TCP","1492","9002 → 43520 [PSH, ACK] Seq=25511 Ack=5887 Win=65535 Len=1436 [TCP segment of a reassembled PDU]"
"3.201516","5.9.29.183","172.19.0.3","TLSv1.2","1330","Application Data, Application Data"
"3.201581","172.19.0.3","5.9.29.183","TCP","56","43520 → 9002 [ACK] Seq=5887 Ack=28221 Win=11911 Len=0"
"3.204901","5.9.29.183","172.19.0.3","TCP","1516","[TCP segment of a reassembled PDU]"
"3.205025","5.9.29.183","172.19.0.3","TCP","1492","9002 → 43520 [PSH, ACK] Seq=29681 Ack=5887 Win=65535 Len=1436 [TCP segment of a reassembled PDU]"
"3.205067","5.9.29.183","172.19.0.3","TLSv1.2","1516","Application Data [TCP segment of a reassembled PDU]"
"3.205071","5.9.29.183","172.19.0.3","TCP","1516","9002 → 43520 [PSH, ACK] Seq=32577 Ack=5887 Win=65535 Len=1460 [TCP segment of a reassembled PDU]"
"3.205077","5.9.29.183","172.19.0.3","TCP","1480","9002 → 43520 [PSH, ACK] Seq=34037 Ack=5887 Win=65535 Len=1424 [TCP segment of a reassembled PDU]"
"3.205268","172.19.0.3","5.9.29.183","TCP","56","43520 → 9002 [ACK] Seq=5887 Ack=35461 Win=11877 Len=0"
"3.216556","5.9.29.183","172.19.0.3","TLSv1.2","70","Application Data"
"3.218070","5.9.29.183","172.19.0.3","TCP","1504","[TCP segment of a reassembled PDU]"
"3.218112","172.19.0.3","5.9.29.183","TCP","56","43520 → 9002 [ACK] Seq=5887 Ack=36923 Win=11911 Len=0"
"3.218149","5.9.29.183","172.19.0.3","TCP","1516","9002 → 43520 [PSH, ACK] Seq=36923 Ack=5887 Win=65535 Len=1460 [TCP segment of a reassembled PDU]"
"3.218227","5.9.29.183","172.19.0.3","TLSv1.2","1516","Application Data [TCP segment of a reassembled PDU]"
"3.218230","5.9.29.183","172.19.0.3","TCP","1480","9002 → 43520 [PSH, ACK] Seq=39843 Ack=5887 Win=65535 Len=1424 [TCP segment of a reassembled PDU]"
"3.218232","5.9.29.183","172.19.0.3","TCP","1504","9002 → 43520 [PSH, ACK] Seq=41267 Ack=5887 Win=65535 Len=1448 [TCP segment of a reassembled PDU]"
"3.218253","172.19.0.3","5.9.29.183","TCP","56","43520 → 9002 [ACK] Seq=5887 Ack=42715 Win=11879 Len=0"
"3.218443","172.19.0.3","5.9.29.183","TLSv1.2","599","Application Data"
"3.218656","5.9.29.183","172.19.0.3","TCP","56","9002 → 43520 [ACK] Seq=42715 Ack=6430 Win=65535 Len=0"
"3.228865","5.9.29.183","172.19.0.3","TLSv1.2","1516","Application Data, Application Data"
"3.228936","5.9.29.183","172.19.0.3","TCP","1386","9002 → 43520 [PSH, ACK] Seq=44175 Ack=6430 Win=65535 Len=1330 [TCP segment of a reassembled PDU]"
"3.228949","172.19.0.3","5.9.29.183","TCP","56","43520 → 9002 [ACK] Seq=6430 Ack=45505 Win=11903 Len=0"
"3.229026","5.9.29.183","172.19.0.3","TCP","1516","9002 → 43520 [PSH, ACK] Seq=45505 Ack=6430 Win=65535 Len=1460 [TCP segment of a reassembled PDU]"
"3.229031","5.9.29.183","172.19.0.3","TLSv1.2","1516","Application Data [TCP segment of a reassembled PDU]"
"3.229033","5.9.29.183","172.19.0.3","TCP","1516","9002 → 43520 [PSH, ACK] Seq=48425 Ack=6430 Win=65535 Len=1460 [TCP segment of a reassembled PDU]"
"3.229036","5.9.29.183","172.19.0.3","TCP","126","9002 → 43520 [PSH, ACK] Seq=49885 Ack=6430 Win=65535 Len=70 [TCP segment of a reassembled PDU]"
"3.229128","172.19.0.3","5.9.29.183","TCP","56","43520 → 9002 [ACK] Seq=6430 Ack=49955 Win=11877 Len=0"
"3.229473","172.19.0.3","5.9.29.183","TLSv1.2","599","Application Data"
"3.229667","5.9.29.183","172.19.0.3","TCP","56","9002 → 43520 [ACK] Seq=49955 Ack=6973 Win=65535 Len=0"
"3.232210","5.9.29.183","172.19.0.3","TCP","1516","9002 → 43520 [PSH, ACK] Seq=49955 Ack=6973 Win=65535 Len=1460 [TCP segment of a reassembled PDU]"
"3.232276","5.9.29.183","172.19.0.3","TLSv1.2","195","Application Data"
"3.232296","172.19.0.3","5.9.29.183","TCP","56","43520 → 9002 [ACK] Seq=6973 Ack=51554 Win=11903 Len=0"
"3.240535","5.9.29.183","172.19.0.3","TCP","1516","[TCP segment of a reassembled PDU]"
"3.240644","5.9.29.183","172.19.0.3","TCP","1516","9002 → 43520 [PSH, ACK] Seq=53014 Ack=6973 Win=65535 Len=1460 [TCP segment of a reassembled PDU]"
"3.240659","172.19.0.3","5.9.29.183","TCP","56","43520 → 9002 [ACK] Seq=6973 Ack=54474 Win=11903 Len=0"
"3.240662","5.9.29.183","172.19.0.3","TLSv1.2","1516","Application Data [TCP segment of a reassembled PDU]"
"3.240728","5.9.29.183","172.19.0.3","TCP","1516","9002 → 43520 [PSH, ACK] Seq=55934 Ack=6973 Win=65535 Len=1460 [TCP segment of a reassembled PDU]"
"3.240733","5.9.29.183","172.19.0.3","TCP","1456","9002 → 43520 [PSH, ACK] Seq=57394 Ack=6973 Win=65535 Len=1400 [TCP segment of a reassembled PDU]"
"3.240736","5.9.29.183","172.19.0.3","TLSv1.2","1504","Application Data [TCP segment of a reassembled PDU]"
"3.240770","172.19.0.3","5.9.29.183","TCP","56","43520 → 9002 [ACK] Seq=6973 Ack=60242 Win=11869 Len=0"
"3.247224","5.9.29.183","172.19.0.3","TLSv1.2","193","Application Data"
"3.252718","5.9.29.183","172.19.0.3","TCP","1516","[TCP segment of a reassembled PDU]"
"3.252743","172.19.0.3","5.9.29.183","TCP","56","43520 → 9002 [ACK] Seq=6973 Ack=61839 Win=11911 Len=0"
"3.252805","5.9.29.183","172.19.0.3","TCP","1516","9002 → 43520 [PSH, ACK] Seq=61839 Ack=6973 Win=65535 Len=1460 [TCP segment of a reassembled PDU]"
"3.252820","5.9.29.183","172.19.0.3","TLSv1.2","1516","Application Data [TCP segment of a reassembled PDU]"
"3.252825","5.9.29.183","172.19.0.3","TCP","1468","9002 → 43520 [PSH, ACK] Seq=64759 Ack=6973 Win=65535 Len=1412 [TCP segment of a reassembled PDU]"
"3.252957","172.19.0.3","5.9.29.183","TCP","56","43520 → 9002 [ACK] Seq=6973 Ack=66171 Win=11887 Len=0"
"3.262379","5.9.29.183","172.19.0.3","TLSv1.2","1004","Application Data"
"3.303661","172.19.0.3","5.9.29.183","TCP","56","43520 → 9002 [ACK] Seq=6973 Ack=67119 Win=11911 Len=0"
"3.328350","5.9.29.183","172.19.0.3","TLSv1.2","1113","Application Data"
"3.328619","172.19.0.3","5.9.29.183","TCP","56","43520 → 9002 [ACK] Seq=6973 Ack=68176 Win=11911 Len=0"
"3.333276","172.19.0.3","5.9.29.183","TLSv1.2","599","Application Data"
"3.333559","5.9.29.183","172.19.0.3","TCP","56","9002 → 43520 [ACK] Seq=68176 Ack=7516 Win=65535 Len=0"
"3.594994","5.9.29.183","172.19.0.3","TLSv1.2","599","Application Data"
"3.595673","172.19.0.3","5.9.29.183","TLSv1.2","599","Application Data"
"3.595937","5.9.29.183","172.19.0.3","TCP","56","9002 → 43520 [ACK] Seq=68719 Ack=8059 Win=65535 Len=0"
"3.885615","5.9.29.183","172.19.0.3","TCP","1504","[TCP segment of a reassembled PDU]"
"3.885701","5.9.29.183","172.19.0.3","TCP","1504","9002 → 43520 [PSH, ACK] Seq=70167 Ack=8059 Win=65535 Len=1448 [TCP segment of a reassembled PDU]"
"3.885711","5.9.29.183","172.19.0.3","TLSv1.2","787","Application Data"
"3.885828","172.19.0.3","5.9.29.183","TCP","56","43520 → 9002 [ACK] Seq=8059 Ack=72346 Win=11895 Len=0"
"3.937302","5.9.29.183","172.19.0.3","TCP","1516","[TCP segment of a reassembled PDU]"
"3.937352","5.9.29.183","172.19.0.3","TCP","1492","9002 → 43520 [PSH, ACK] Seq=73806 Ack=8059 Win=65535 Len=1436 [TCP segment of a reassembled PDU]"
"3.937373","172.19.0.3","5.9.29.183","TCP","56","43520 → 9002 [ACK] Seq=8059 Ack=75242 Win=11903 Len=0"
"3.937385","5.9.29.183","172.19.0.3","TLSv1.2","787","Application Data"
"3.951734","5.9.29.183","172.19.0.3","TCP","1504","[TCP segment of a reassembled PDU]"
"3.951748","172.19.0.3","5.9.29.183","TCP","56","43520 → 9002 [ACK] Seq=8059 Ack=77421 Win=11911 Len=0"
"3.951887","5.9.29.183","172.19.0.3","TCP","1504","9002 → 43520 [PSH, ACK] Seq=77421 Ack=8059 Win=65535 Len=1448 [TCP segment of a reassembled PDU]"
"3.952738","5.9.29.183","172.19.0.3","TLSv1.2","787","Application Data"
"3.952748","172.19.0.3","5.9.29.183","TCP","56","43520 → 9002 [ACK] Seq=8059 Ack=79600 Win=11911 Len=0"
"3.964496","5.9.29.183","172.19.0.3","TCP","1504","[TCP segment of a reassembled PDU]"
"3.964534","5.9.29.183","172.19.0.3","TCP","1504","9002 → 43520 [PSH, ACK] Seq=81048 Ack=8059 Win=65535 Len=1448 [TCP segment of a reassembled PDU]"
"3.964625","172.19.0.3","5.9.29.183","TCP","56","43520 → 9002 [ACK] Seq=8059 Ack=82496 Win=11901 Len=0"
"3.967779","5.9.29.183","172.19.0.3","TLSv1.2","1330","Application Data, Application Data"
"3.975233","5.9.29.183","172.19.0.3","TCP","1516","[TCP segment of a reassembled PDU]"
"3.975252","172.19.0.3","5.9.29.183","TCP","56","43520 → 9002 [ACK] Seq=8059 Ack=85230 Win=11911 Len=0"
"3.975293","5.9.29.183","172.19.0.3","TCP","1492","9002 → 43520 [PSH, ACK] Seq=85230 Ack=8059 Win=65535 Len=1436 [TCP segment of a reassembled PDU]"
"3.983031","5.9.29.183","172.19.0.3","TLSv1.2","787","Application Data"
"3.983049","172.19.0.3","5.9.29.183","TCP","56","43520 → 9002 [ACK] Seq=8059 Ack=87397 Win=11911 Len=0"
"3.984746","5.9.29.183","172.19.0.3","TCP","1516","[TCP segment of a reassembled PDU]"
"3.984790","5.9.29.183","172.19.0.3","TCP","1516","9002 → 43520 [PSH, ACK] Seq=88857 Ack=8059 Win=65535 Len=1460 [TCP segment of a reassembled PDU]"
"3.984796","5.9.29.183","172.19.0.3","TLSv1.2","1480","Application Data [TCP segment of a reassembled PDU]"
"3.984913","5.9.29.183","172.19.0.3","TLSv1.2","1516","Application Data [TCP segment of a reassembled PDU]"
"3.984920","5.9.29.183","172.19.0.3","TCP","1516","9002 → 43520 [PSH, ACK] Seq=93201 Ack=8059 Win=65535 Len=1460 [TCP segment of a reassembled PDU]"
"3.984923","5.9.29.183","172.19.0.3","TCP","1480","9002 → 43520 [PSH, ACK] Seq=94661 Ack=8059 Win=65535 Len=1424 [TCP segment of a reassembled PDU]"
"3.984956","172.19.0.3","5.9.29.183","TCP","56","43520 → 9002 [ACK] Seq=8059 Ack=96085 Win=11871 Len=0"
"3.985290","172.19.0.3","5.9.29.183","TLSv1.2","599","Application Data"
"3.985472","5.9.29.183","172.19.0.3","TCP","56","9002 → 43520 [ACK] Seq=96085 Ack=8602 Win=65535 Len=0"
"3.998390","5.9.29.183","172.19.0.3","TLSv1.2","1516","Application Data [TCP segment of a reassembled PDU]"
"3.998437","5.9.29.183","172.19.0.3","TCP","1516","9002 → 43520 [PSH, ACK] Seq=97545 Ack=8602 Win=65535 Len=1460 [TCP segment of a reassembled PDU]"
"3.998462","172.19.0.3","5.9.29.183","TCP","56","43520 → 9002 [ACK] Seq=8602 Ack=99005 Win=11903 Len=0"
"3.998464","5.9.29.183","172.19.0.3","TLSv1.2","386","Application Data"
"3.998744","172.19.0.3","5.9.29.183","TLSv1.2","599","Application Data"
"3.998947","5.9.29.183","172.19.0.3","TCP","56","9002 → 43520 [ACK] Seq=99335 Ack=9145 Win=65535 Len=0"
"3.998954","5.9.29.183","172.19.0.3","TCP","1504","[TCP segment of a reassembled PDU]"
"3.999070","5.9.29.183","172.19.0.3","TCP","1504","9002 → 43520 [PSH, ACK] Seq=100783 Ack=9145 Win=65535 Len=1448 [TCP segment of a reassembled PDU]"
"3.999078","172.19.0.3","5.9.29.183","TCP","56","43520 → 9002 [ACK] Seq=9145 Ack=102231 Win=11911 Len=0"
"4.011775","5.9.29.183","172.19.0.3","TLSv1.2","1516","Application Data, Application Data"
"4.011838","5.9.29.183","172.19.0.3","TCP","1492","9002 → 43520 [PSH, ACK] Seq=103691 Ack=9145 Win=65535 Len=1436 [TCP segment of a reassembled PDU]"
"4.011986","172.19.0.3","5.9.29.183","TCP","56","43520 → 9002 [ACK] Seq=9145 Ack=105127 Win=11903 Len=0"
"4.013975","5.9.29.183","172.19.0.3","TLSv1.2","519","Application Data"
"4.022496","5.9.29.183","172.19.0.3","TCP","1504","[TCP segment of a reassembled PDU]"
"4.022548","172.19.0.3","5.9.29.183","TCP","56","43520 → 9002 [ACK] Seq=9145 Ack=107038 Win=11909 Len=0"
"4.022747","5.9.29.183","172.19.0.3","TCP","1516","9002 → 43520 [PSH, ACK] Seq=107038 Ack=9145 Win=65535 Len=1460 [TCP segment of a reassembled PDU]"
"4.022758","5.9.29.183","172.19.0.3","TLSv1.2","1516","Application Data [TCP segment of a reassembled PDU]"
"4.022761","5.9.29.183","172.19.0.3","TCP","1139","9002 → 43520 [PSH, ACK] Seq=109958 Ack=9145 Win=65535 Len=1083 [TCP segment of a reassembled PDU]"
"4.022814","172.19.0.3","5.9.29.183","TCP","56","43520 → 9002 [ACK] Seq=9145 Ack=111041 Win=11885 Len=0"
"4.022956","5.9.29.183","172.19.0.3","TCP","1516","9002 → 43520 [PSH, ACK] Seq=111041 Ack=9145 Win=65535 Len=1460 [TCP segment of a reassembled PDU]"
"4.022962","5.9.29.183","172.19.0.3","TLSv1.2","1516","Application Data [TCP segment of a reassembled PDU]"
"4.023030","172.19.0.3","5.9.29.183","TCP","56","43520 → 9002 [ACK] Seq=9145 Ack=113961 Win=11869 Len=0"
"4.023127","5.9.29.183","172.19.0.3","TCP","1516","9002 → 43520 [PSH, ACK] Seq=113961 Ack=9145 Win=65535 Len=1460 [TCP segment of a reassembled PDU]"
"4.023135","5.9.29.183","172.19.0.3","TCP","1516","9002 → 43520 [PSH, ACK] Seq=115421 Ack=9145 Win=65535 Len=1460 [TCP segment of a reassembled PDU]"
"4.023141","5.9.29.183","172.19.0.3","TLSv1.2","1516","Application Data [TCP segment of a reassembled PDU]"
"4.023334","5.9.29.183","172.19.0.3","TCP","1516","9002 → 43520 [PSH, ACK] Seq=118341 Ack=9145 Win=65535 Len=1460 [TCP segment of a reassembled PDU]"
"4.023342","5.9.29.183","172.19.0.3","TCP","1516","9002 → 43520 [PSH, ACK] Seq=119801 Ack=9145 Win=65535 Len=1460 [TCP segment of a reassembled PDU]"
"4.023425","172.19.0.3","5.9.29.183","TCP","56","43520 → 9002 [ACK] Seq=9145 Ack=121261 Win=11828 Len=0"
"4.023431","5.9.29.183","172.19.0.3","TCP","313","9002 → 43520 [PSH, ACK] Seq=121261 Ack=9145 Win=65535 Len=257 [TCP segment of a reassembled PDU]"
"4.026548","5.9.29.183","172.19.0.3","TLSv1.2","1504","Application Data, Application Data"
"4.026574","172.19.0.3","5.9.29.183","TCP","56","43520 → 9002 [ACK] Seq=9145 Ack=122966 Win=11911 Len=0"
"4.027046","172.19.0.3","5.9.29.183","TLSv1.2","599","Application Data"
"4.027438","5.9.29.183","172.19.0.3","TCP","56","9002 → 43520 [ACK] Seq=122966 Ack=9688 Win=65535 Len=0"
"4.028769","5.9.29.183","172.19.0.3","TLSv1.2","330","Application Data"
"4.062741","5.9.29.183","172.19.0.3","TCP","1504","[TCP segment of a reassembled PDU]"
"4.062803","172.19.0.3","5.9.29.183","TCP","56","43520 → 9002 [ACK] Seq=9688 Ack=124688 Win=11911 Len=0"
"4.062854","5.9.29.183","172.19.0.3","TCP","1516","9002 → 43520 [PSH, ACK] Seq=124688 Ack=9688 Win=65535 Len=1460 [TCP segment of a reassembled PDU]"
"4.062997","5.9.29.183","172.19.0.3","TLSv1.2","1225","Application Data"
"4.063004","5.9.29.183","172.19.0.3","TCP","1516","[TCP segment of a reassembled PDU]"
"4.063008","5.9.29.183","172.19.0.3","TCP","1516","9002 → 43520 [PSH, ACK] Seq=128777 Ack=9688 Win=65535 Len=1460 [TCP segment of a reassembled PDU]"
"4.063011","5.9.29.183","172.19.0.3","TLSv1.2","1480","Application Data [TCP segment of a reassembled PDU]"
"4.063074","172.19.0.3","5.9.29.183","TCP","56","43520 → 9002 [ACK] Seq=9688 Ack=131661 Win=11871 Len=0"
"4.078382","5.9.29.183","172.19.0.3","TLSv1.2","974","Application Data"
"4.078552","5.9.29.183","172.19.0.3","TCP","1504","[TCP segment of a reassembled PDU]"
"4.078567","172.19.0.3","5.9.29.183","TCP","56","43520 → 9002 [ACK] Seq=9688 Ack=134027 Win=11901 Len=0"
"4.078674","5.9.29.183","172.19.0.3","TCP","1516","9002 → 43520 [PSH, ACK] Seq=134027 Ack=9688 Win=65535 Len=1460 [TCP segment of a reassembled PDU]"
"4.078710","5.9.29.183","172.19.0.3","TLSv1.2","1516","Application Data [TCP segment of a reassembled PDU]"
"4.078730","5.9.29.183","172.19.0.3","TCP","1480","9002 → 43520 [PSH, ACK] Seq=136947 Ack=9688 Win=65535 Len=1424 [TCP segment of a reassembled PDU]"
"4.078767","172.19.0.3","5.9.29.183","TCP","56","43520 → 9002 [ACK] Seq=9688 Ack=138371 Win=11877 Len=0"
"4.078819","5.9.29.183","172.19.0.3","TCP","1516","9002 → 43520 [PSH, ACK] Seq=138371 Ack=9688 Win=65535 Len=1460 [TCP segment of a reassembled PDU]"
"4.078828","5.9.29.183","172.19.0.3","TLSv1.2","1516","Application Data [TCP segment of a reassembled PDU]"
"4.078898","5.9.29.183","172.19.0.3","TCP","1480","9002 → 43520 [PSH, ACK] Seq=141291 Ack=9688 Win=65535 Len=1424 [TCP segment of a reassembled PDU]"
"4.078985","172.19.0.3","5.9.29.183","TCP","56","43520 → 9002 [ACK] Seq=9688 Ack=142715 Win=11853 Len=0"
"4.093822","5.9.29.183","172.19.0.3","TLSv1.2","287","Application Data"
"4.099851","172.19.0.3","5.9.29.183","TLSv1.2","599","Application Data"
"4.100156","5.9.29.183","172.19.0.3","TCP","56","9002 → 43520 [ACK] Seq=142946 Ack=10231 Win=65535 Len=0"
"4.457711","5.9.29.183","172.19.0.3","TLSv1.2","599","Application Data"
"4.458515","172.19.0.3","5.9.29.183","TLSv1.2","599","Application Data"
"4.458861","5.9.29.183","172.19.0.3","TCP","56","9002 → 43520 [ACK] Seq=143489 Ack=10774 Win=65535 Len=0"
"4.761068","5.9.29.183","172.19.0.3","TCP","1516","[TCP segment of a reassembled PDU]"
"4.761165","5.9.29.183","172.19.0.3","TCP","1516","9002 → 43520 [PSH, ACK] Seq=144949 Ack=10774 Win=65535 Len=1460 [TCP segment of a reassembled PDU]"
"4.761176","5.9.29.183","172.19.0.3","TLSv1.2","763","Application Data"
"4.761350","172.19.0.3","5.9.29.183","TCP","56","43520 → 9002 [ACK] Seq=10774 Ack=147116 Win=11895 Len=0"
"4.761763","172.19.0.3","5.9.29.183","TLSv1.2","599","Application Data"
"4.762069","5.9.29.183","172.19.0.3","TCP","56","9002 → 43520 [ACK] Seq=147116 Ack=11317 Win=65535 Len=0"
"4.790515","5.9.29.183","172.19.0.3","TCP","1516","[TCP segment of a reassembled PDU]"
"4.790592","5.9.29.183","172.19.0.3","TCP","1516","9002 → 43520 [PSH, ACK] Seq=148576 Ack=11317 Win=65535 Len=1460 [TCP segment of a reassembled PDU]"
"4.790604","5.9.29.183","172.19.0.3","TLSv1.2","763","Application Data"
"4.790805","172.19.0.3","5.9.29.183","TCP","56","43520 → 9002 [ACK] Seq=11317 Ack=150743 Win=11895 Len=0"
"4.805604","5.9.29.183","172.19.0.3","TLSv1.2","1113","Application Data"
"4.822491","5.9.29.183","172.19.0.3","TCP","1516","[TCP segment of a reassembled PDU]"
"4.822513","172.19.0.3","5.9.29.183","TCP","56","43520 → 9002 [ACK] Seq=11317 Ack=153260 Win=11911 Len=0"
"4.822547","5.9.29.183","172.19.0.3","TCP","1492","9002 → 43520 [PSH, ACK] Seq=153260 Ack=11317 Win=65535 Len=1436 [TCP segment of a reassembled PDU]"
"4.822555","5.9.29.183","172.19.0.3","TLSv1.2","1516","Application Data [TCP segment of a reassembled PDU]"
"4.822557","5.9.29.183","172.19.0.3","TCP","1516","9002 → 43520 [PSH, ACK] Seq=156156 Ack=11317 Win=65535 Len=1460 [TCP segment of a reassembled PDU]"
"4.822561","5.9.29.183","172.19.0.3","TCP","1213","9002 → 43520 [PSH, ACK] Seq=157616 Ack=11317 Win=65535 Len=1157 [TCP segment of a reassembled PDU]"
"4.822723","172.19.0.3","5.9.29.183","TCP","56","43520 → 9002 [ACK] Seq=11317 Ack=158773 Win=11879 Len=0"
"4.838075","5.9.29.183","172.19.0.3","TLSv1.2","851","Application Data"
"4.838250","5.9.29.183","172.19.0.3","TCP","1504","[TCP segment of a reassembled PDU]"
"4.838260","172.19.0.3","5.9.29.183","TCP","56","43520 → 9002 [ACK] Seq=11317 Ack=161016 Win=11901 Len=0"
"4.838262","5.9.29.183","172.19.0.3","TCP","1504","9002 → 43520 [PSH, ACK] Seq=161016 Ack=11317 Win=65535 Len=1448 [TCP segment of a reassembled PDU]"
"4.853867","5.9.29.183","172.19.0.3","TLSv1.2","1330","Application Data, Application Data"
"4.853892","172.19.0.3","5.9.29.183","TCP","56","43520 → 9002 [ACK] Seq=11317 Ack=163738 Win=11911 Len=0"
"4.863873","5.9.29.183","172.19.0.3","TCP","1516","[TCP segment of a reassembled PDU]"
"4.863946","5.9.29.183","172.19.0.3","TCP","1516","9002 → 43520 [PSH, ACK] Seq=165198 Ack=11317 Win=65535 Len=1460 [TCP segment of a reassembled PDU]"
"4.863955","5.9.29.183","172.19.0.3","TLSv1.2","1516","Application Data [TCP segment of a reassembled PDU]"
"4.863958","5.9.29.183","172.19.0.3","TCP","1516","9002 → 43520 [PSH, ACK] Seq=168118 Ack=11317 Win=65535 Len=1460 [TCP segment of a reassembled PDU]"
"4.863962","5.9.29.183","172.19.0.3","TCP","1516","9002 → 43520 [PSH, ACK] Seq=169578 Ack=11317 Win=65535 Len=1460 [TCP segment of a reassembled PDU]"
"4.863965","5.9.29.183","172.19.0.3","TLSv1.2","1516","Application Data [TCP segment of a reassembled PDU]"
"4.863971","5.9.29.183","172.19.0.3","TCP","1432","9002 → 43520 [PSH, ACK] Seq=172498 Ack=11317 Win=65535 Len=1376 [TCP segment of a reassembled PDU]"
"4.864092","172.19.0.3","5.9.29.183","TCP","56","43520 → 9002 [ACK] Seq=11317 Ack=173874 Win=11863 Len=0"
"4.864610","172.19.0.3","5.9.29.183","TLSv1.2","599","Application Data"
"4.864889","5.9.29.183","172.19.0.3","TCP","56","9002 → 43520 [ACK] Seq=173874 Ack=11860 Win=65535 Len=0"
"4.869530","5.9.29.183","172.19.0.3","TCP","1516","9002 → 43520 [PSH, ACK] Seq=173874 Ack=11860 Win=65535 Len=1460 [TCP segment of a reassembled PDU]"
"4.869605","5.9.29.183","172.19.0.3","TLSv1.2","1299","Application Data [TCP segment of a reassembled PDU]"
"4.869629","172.19.0.3","5.9.29.183","TCP","56","43520 → 9002 [ACK] Seq=11860 Ack=176577 Win=11903 Len=0"
"4.869637","5.9.29.183","172.19.0.3","TCP","1516","9002 → 43520 [PSH, ACK] Seq=176577 Ack=11860 Win=65535 Len=1460 [TCP segment of a reassembled PDU]"
"4.869648","5.9.29.183","172.19.0.3","TCP","1516","9002 → 43520 [PSH, ACK] Seq=178037 Ack=11860 Win=65535 Len=1460 [TCP segment of a reassembled PDU]"
"4.869764","172.19.0.3","5.9.29.183","TCP","56","43520 → 9002 [ACK] Seq=11860 Ack=179497 Win=11887 Len=0"
"4.869810","5.9.29.183","172.19.0.3","TLSv1.2","1516","Application Data, Application Data"
"4.869814","5.9.29.183","172.19.0.3","TCP","1516","9002 → 43520 [PSH, ACK] Seq=180957 Ack=11860 Win=65535 Len=1460 [TCP segment of a reassembled PDU]"
"4.869909","5.9.29.183","172.19.0.3","TCP","201","9002 → 43520 [PSH, ACK] Seq=182417 Ack=11860 Win=65535 Len=145 [TCP segment of a reassembled PDU]"
"4.869994","172.19.0.3","5.9.29.183","TCP","56","43520 → 9002 [ACK] Seq=11860 Ack=182562 Win=11864 Len=0"
"4.880715","5.9.29.183","172.19.0.3","TLSv1.2","938","Application Data"
"4.890089","5.9.29.183","172.19.0.3","TCP","1516","[TCP segment of a reassembled PDU]"
"4.890169","172.19.0.3","5.9.29.183","TCP","56","43520 → 9002 [ACK] Seq=11860 Ack=184904 Win=11911 Len=0"
"4.890231","5.9.29.183","172.19.0.3","TCP","1516","9002 → 43520 [PSH, ACK] Seq=184904 Ack=11860 Win=65535 Len=1460 [TCP segment of a reassembled PDU]"
"4.890277","5.9.29.183","172.19.0.3","TLSv1.2","1480","Application Data [TCP segment of a reassembled PDU]"
"4.890286","5.9.29.183","172.19.0.3","TCP","1516","9002 → 43520 [PSH, ACK] Seq=187788 Ack=11860 Win=65535 Len=1460 [TCP segment of a reassembled PDU]"
"4.890291","5.9.29.183","172.19.0.3","TCP","1516","9002 → 43520 [PSH, ACK] Seq=189248 Ack=11860 Win=65535 Len=1460 [TCP segment of a reassembled PDU]"
"4.890296","5.9.29.183","172.19.0.3","TLSv1.2","1516","Application Data [TCP segment of a reassembled PDU]"
"4.890385","5.9.29.183","172.19.0.3","TCP","1516","9002 → 43520 [PSH, ACK] Seq=192168 Ack=11860 Win=65535 Len=1460 [TCP segment of a reassembled PDU]"
"4.890391","5.9.29.183","172.19.0.3","TCP","1516","9002 → 43520 [PSH, ACK] Seq=193628 Ack=11860 Win=65535 Len=1460 [TCP segment of a reassembled PDU]"
"4.890395","5.9.29.183","172.19.0.3","TLSv1.2","1444","Application Data [TCP segment of a reassembled PDU]"
"4.890418","172.19.0.3","5.9.29.183","TCP","56","43520 → 9002 [ACK] Seq=11860 Ack=196476 Win=11845 Len=0"
"4.890978","172.19.0.3","5.9.29.183","TLSv1.2","599","Application Data"
"4.891270","5.9.29.183","172.19.0.3","TCP","56","9002 → 43520 [ACK] Seq=196476 Ack=12403 Win=65535 Len=0"
"4.895804","5.9.29.183","172.19.0.3","TLSv1.2","1018","Application Data"
"4.900680","172.19.0.3","5.9.29.183","TLSv1.2","599","Application Data"
"4.901030","5.9.29.183","172.19.0.3","TCP","56","9002 → 43520 [ACK] Seq=197438 Ack=12946 Win=65535 Len=0"
"4.903252","5.9.29.183","172.19.0.3","TCP","1516","[TCP segment of a reassembled PDU]"
"4.903279","5.9.29.183","172.19.0.3","TCP","1516","9002 → 43520 [PSH, ACK] Seq=198898 Ack=12946 Win=65535 Len=1460 [TCP segment of a reassembled PDU]"
"4.903286","5.9.29.183","172.19.0.3","TLSv1.2","1516","Application Data [TCP segment of a reassembled PDU]"
"4.903289","5.9.29.183","172.19.0.3","TCP","1468","9002 → 43520 [PSH, ACK] Seq=201818 Ack=12946 Win=65535 Len=1412 [TCP segment of a reassembled PDU]"
"4.903405","172.19.0.3","5.9.29.183","TCP","56","43520 → 9002 [ACK] Seq=12946 Ack=203230 Win=11887 Len=0"
"4.911034","5.9.29.183","172.19.0.3","TLSv1.2","490","Application Data"
"4.930504","5.9.29.183","172.19.0.3","TCP","1504","[TCP segment of a reassembled PDU]"
"4.930525","172.19.0.3","5.9.29.183","TCP","56","43520 → 9002 [ACK] Seq=12946 Ack=205112 Win=11911 Len=0"
"4.930539","5.9.29.183","172.19.0.3","TCP","1516","9002 → 43520 [PSH, ACK] Seq=205112 Ack=12946 Win=65535 Len=1460 [TCP segment of a reassembled PDU]"
"4.930545","5.9.29.183","172.19.0.3","TLSv1.2","1225","Application Data"
"4.930710","172.19.0.3","5.9.29.183","TCP","56","43520 → 9002 [ACK] Seq=12946 Ack=207741 Win=11895 Len=0"
"4.931570","172.19.0.3","5.9.29.183","TLSv1.2","599","Application Data"
"4.931832","5.9.29.183","172.19.0.3","TCP","56","9002 → 43520 [ACK] Seq=207741 Ack=13489 Win=65535 Len=0"
"4.941363","172.19.0.3","5.9.29.183","TLSv1.2","599","Application Data"
"4.941911","5.9.29.183","172.19.0.3","TCP","56","9002 → 43520 [ACK] Seq=207741 Ack=14032 Win=65535 Len=0"
"4.945563","5.9.29.183","172.19.0.3","TLSv1.2","149","Application Data"
"4.987094","172.19.0.3","5.9.29.183","TCP","56","43520 → 9002 [ACK] Seq=14032 Ack=207834 Win=11911 Len=0"
"5.287955","5.9.29.183","172.19.0.3","TLSv1.2","599","Application Data"
"5.287994","172.19.0.3","5.9.29.183","TCP","56","43520 → 9002 [ACK] Seq=14032 Ack=208377 Win=11911 Len=0"
"5.288894","172.19.0.3","5.9.29.183","TLSv1.2","599","Application Data"
"5.289160","5.9.29.183","172.19.0.3","TCP","56","9002 → 43520 [ACK] Seq=208377 Ack=14575 Win=65535 Len=0"
"5.599994","5.9.29.183","172.19.0.3","TCP","1504","[TCP segment of a reassembled PDU]"
"5.600019","5.9.29.183","172.19.0.3","TCP","1516","9002 → 43520 [PSH, ACK] Seq=209825 Ack=14575 Win=65535 Len=1460 [TCP segment of a reassembled PDU]"
"5.600323","5.9.29.183","172.19.0.3","TLSv1.2","775","Application Data"
"5.600409","172.19.0.3","5.9.29.183","TCP","56","43520 → 9002 [ACK] Seq=14575 Ack=212004 Win=11893 Len=0"
"5.611749","5.9.29.183","172.19.0.3","TCP","1516","[TCP segment of a reassembled PDU]"
"5.611776","5.9.29.183","172.19.0.3","TCP","1492","9002 → 43520 [PSH, ACK] Seq=213464 Ack=14575 Win=65535 Len=1436 [TCP segment of a reassembled PDU]"
"5.611790","172.19.0.3","5.9.29.183","TCP","56","43520 → 9002 [ACK] Seq=14575 Ack=214900 Win=11903 Len=0"
"5.615437","5.9.29.183","172.19.0.3","TLSv1.2","273","Application Data"
"5.623936","5.9.29.183","172.19.0.3","TCP","1516","[TCP segment of a reassembled PDU]"
"5.623962","172.19.0.3","5.9.29.183","TCP","56","43520 → 9002 [ACK] Seq=14575 Ack=216577 Win=11911 Len=0"
"5.623980","5.9.29.183","172.19.0.3","TCP","1492","9002 → 43520 [PSH, ACK] Seq=216577 Ack=14575 Win=65535 Len=1436 [TCP segment of a reassembled PDU]"
"5.630757","5.9.29.183","172.19.0.3","TLSv1.2","1330","Application Data, Application Data"
"5.630783","172.19.0.3","5.9.29.183","TCP","56","43520 → 9002 [ACK] Seq=14575 Ack=219287 Win=11911 Len=0"
"5.633965","5.9.29.183","172.19.0.3","TCP","1504","[TCP segment of a reassembled PDU]"
"5.634018","5.9.29.183","172.19.0.3","TCP","1516","9002 → 43520 [PSH, ACK] Seq=220735 Ack=14575 Win=65535 Len=1460 [TCP segment of a reassembled PDU]"
"5.634026","5.9.29.183","172.19.0.3","TLSv1.2","1516","Application Data [TCP segment of a reassembled PDU]"
"5.634097","5.9.29.183","172.19.0.3","TCP","1516","9002 → 43520 [PSH, ACK] Seq=223655 Ack=14575 Win=65535 Len=1460 [TCP segment of a reassembled PDU]"
"5.634106","5.9.29.183","172.19.0.3","TCP","1468","9002 → 43520 [PSH, ACK] Seq=225115 Ack=14575 Win=65535 Len=1412 [TCP segment of a reassembled PDU]"
"5.634222","172.19.0.3","5.9.29.183","TCP","56","43520 → 9002 [ACK] Seq=14575 Ack=226527 Win=11879 Len=0"
"5.646161","5.9.29.183","172.19.0.3","TLSv1.2","1516","Application Data [TCP segment of a reassembled PDU]"
"5.646190","5.9.29.183","172.19.0.3","TCP","1516","9002 → 43520 [PSH, ACK] Seq=227987 Ack=14575 Win=65535 Len=1460 [TCP segment of a reassembled PDU]"
"5.646205","172.19.0.3","5.9.29.183","TCP","56","43520 → 9002 [ACK] Seq=14575 Ack=229447 Win=11903 Len=0"
"5.646207","5.9.29.183","172.19.0.3","TCP","1516","9002 → 43520 [PSH, ACK] Seq=229447 Ack=14575 Win=65535 Len=1460 [TCP segment of a reassembled PDU]"
"5.646211","5.9.29.183","172.19.0.3","TLSv1.2","548","Application Data [TCP segment of a reassembled PDU]"
"5.646379","172.19.0.3","5.9.29.183","TCP","56","43520 → 9002 [ACK] Seq=14575 Ack=231399 Win=11888 Len=0"
"5.658199","5.9.29.183","172.19.0.3","TLSv1.2","1504","Application Data [TCP segment of a reassembled PDU]"
"5.658231","5.9.29.183","172.19.0.3","TCP","1516","9002 → 43520 [PSH, ACK] Seq=232847 Ack=14575 Win=65535 Len=1460 [TCP segment of a reassembled PDU]"
"5.658247","172.19.0.3","5.9.29.183","TCP","56","43520 → 9002 [ACK] Seq=14575 Ack=234307 Win=11903 Len=0"
"5.658250","5.9.29.183","172.19.0.3","TCP","1492","9002 → 43520 [PSH, ACK] Seq=234307 Ack=14575 Win=65535 Len=1436 [TCP segment of a reassembled PDU]"
"5.661464","5.9.29.183","172.19.0.3","TLSv1.2","1516","Application Data [TCP segment of a reassembled PDU]"
"5.661489","172.19.0.3","5.9.29.183","TCP","56","43520 → 9002 [ACK] Seq=14575 Ack=237203 Win=11911 Len=0"
"5.661507","5.9.29.183","172.19.0.3","TLSv1.2","1332","Application Data"
"5.661922","172.19.0.3","5.9.29.183","TLSv1.2","599","Application Data"
"5.662308","5.9.29.183","172.19.0.3","TCP","56","9002 → 43520 [ACK] Seq=238479 Ack=15118 Win=65535 Len=0"
"5.670928","5.9.29.183","172.19.0.3","TCP","1516","[TCP segment of a reassembled PDU]"
"5.670956","5.9.29.183","172.19.0.3","TCP","1516","9002 → 43520 [PSH, ACK] Seq=239939 Ack=15118 Win=65535 Len=1460 [TCP segment of a reassembled PDU]"
"5.670971","172.19.0.3","5.9.29.183","TCP","56","43520 → 9002 [ACK] Seq=15118 Ack=241399 Win=11903 Len=0"
"5.670973","5.9.29.183","172.19.0.3","TCP","770","9002 → 43520 [PSH, ACK] Seq=241399 Ack=15118 Win=65535 Len=714 [TCP segment of a reassembled PDU]"
"5.670977","5.9.29.183","172.19.0.3","TLSv1.2","766","Application Data [TCP segment of a reassembled PDU]"
"5.671350","172.19.0.3","5.9.29.183","TCP","56","43520 → 9002 [ACK] Seq=15118 Ack=242823 Win=11911 Len=0"
"5.676291","5.9.29.183","172.19.0.3","TLSv1.2","910","Application Data"
"5.708428","5.9.29.183","172.19.0.3","TCP","1516","[TCP segment of a reassembled PDU]"
"5.708451","172.19.0.3","5.9.29.183","TCP","56","43520 → 9002 [ACK] Seq=15118 Ack=245137 Win=11911 Len=0"
"5.708462","5.9.29.183","172.19.0.3","TCP","1516","9002 → 43520 [PSH, ACK] Seq=245137 Ack=15118 Win=65535 Len=1460 [TCP segment of a reassembled PDU]"
"5.708468","5.9.29.183","172.19.0.3","TLSv1.2","249","Application Data"
"5.708629","172.19.0.3","5.9.29.183","TCP","56","43520 → 9002 [ACK] Seq=15118 Ack=246790 Win=11899 Len=0"
"5.712959","172.19.0.3","5.9.29.183","TLSv1.2","599","Application Data"
"5.713282","5.9.29.183","172.19.0.3","TCP","56","9002 → 43520 [ACK] Seq=246790 Ack=15661 Win=65535 Len=0"
"6.021565","5.9.29.183","172.19.0.3","TLSv1.2","599","Application Data"
"6.022432","172.19.0.3","5.9.29.183","TLSv1.2","599","Application Data"
"6.022717","5.9.29.183","172.19.0.3","TCP","56","9002 → 43520 [ACK] Seq=247333 Ack=16204 Win=65535 Len=0"
"6.320031","5.9.29.183","172.19.0.3","TLSv1.2","599","Application Data"
"6.361487","172.19.0.3","5.9.29.183","TCP","56","43520 → 9002 [ACK] Seq=16204 Ack=247876 Win=11911 Len=0"
"6.407245","5.9.29.183","172.19.0.3","TCP","1516","[TCP segment of a reassembled PDU]"
"6.407268","172.19.0.3","5.9.29.183","TCP","56","43520 → 9002 [ACK] Seq=16204 Ack=249336 Win=11911 Len=0"
"6.407281","5.9.29.183","172.19.0.3","TCP","1516","9002 → 43520 [PSH, ACK] Seq=249336 Ack=16204 Win=65535 Len=1460 [TCP segment of a reassembled PDU]"
"6.407291","172.19.0.3","5.9.29.183","TCP","56","43520 → 9002 [ACK] Seq=16204 Ack=250796 Win=11903 Len=0"
"6.407293","5.9.29.183","172.19.0.3","TLSv1.2","763","Application Data"
"6.407298","172.19.0.3","5.9.29.183","TCP","56","43520 → 9002 [ACK] Seq=16204 Ack=251503 Win=11898 Len=0"
"6.407707","172.19.0.3","5.9.29.183","TLSv1.2","599","Application Data"
"6.408029","5.9.29.183","172.19.0.3","TCP","56","9002 → 43520 [ACK] Seq=251503 Ack=16747 Win=65535 Len=0"
"6.421086","5.9.29.183","172.19.0.3","TCP","1504","[TCP segment of a reassembled PDU]"
"6.421115","5.9.29.183","172.19.0.3","TCP","1504","9002 → 43520 [PSH, ACK] Seq=252951 Ack=16747 Win=65535 Len=1448 [TCP segment of a reassembled PDU]"
"6.421235","172.19.0.3","5.9.29.183","TCP","56","43520 → 9002 [ACK] Seq=16747 Ack=254399 Win=11903 Len=0"
"6.422611","5.9.29.183","172.19.0.3","TLSv1.2","787","Application Data"
"6.430580","5.9.29.183","172.19.0.3","TCP","1504","[TCP segment of a reassembled PDU]"
"6.430599","172.19.0.3","5.9.29.183","TCP","56","43520 → 9002 [ACK] Seq=16747 Ack=256578 Win=11911 Len=0"
"6.430717","5.9.29.183","172.19.0.3","TCP","1516","9002 → 43520 [PSH, ACK] Seq=256578 Ack=16747 Win=65535 Len=1460 [TCP segment of a reassembled PDU]"
"6.430744","5.9.29.183","172.19.0.3","TLSv1.2","1492","Application Data [TCP segment of a reassembled PDU]"
"6.430764","5.9.29.183","172.19.0.3","TCP","1516","9002 → 43520 [PSH, ACK] Seq=259474 Ack=16747 Win=65535 Len=1460 [TCP segment of a reassembled PDU]"
"6.430768","5.9.29.183","172.19.0.3","TCP","1492","9002 → 43520 [PSH, ACK] Seq=260934 Ack=16747 Win=65535 Len=1436 [TCP segment of a reassembled PDU]"
"6.430811","172.19.0.3","5.9.29.183","TCP","56","43520 → 9002 [ACK] Seq=16747 Ack=262370 Win=11879 Len=0"
"6.437674","5.9.29.183","172.19.0.3","TLSv1.2","584","Application Data"
"6.442748","5.9.29.183","172.19.0.3","TCP","1504","[TCP segment of a reassembled PDU]"
"6.442765","172.19.0.3","5.9.29.183","TCP","56","43520 → 9002 [ACK] Seq=16747 Ack=264346 Win=11911 Len=0"
"6.442777","5.9.29.183","172.19.0.3","TCP","1516","9002 → 43520 [PSH, ACK] Seq=264346 Ack=16747 Win=65535 Len=1460 [TCP segment of a reassembled PDU]"
"6.442781","5.9.29.183","172.19.0.3","TLSv1.2","1492","Application Data [TCP segment of a reassembled PDU]"
"6.442915","172.19.0.3","5.9.29.183","TCP","56","43520 → 9002 [ACK] Seq=16747 Ack=267242 Win=11895 Len=0"
"6.452929","5.9.29.183","172.19.0.3","TLSv1.2","396","Application Data"
"6.473129","5.9.29.183","172.19.0.3","TCP","1516","[TCP segment of a reassembled PDU]"
"6.473151","172.19.0.3","5.9.29.183","TCP","56","43520 → 9002 [ACK] Seq=16747 Ack=269042 Win=11911 Len=0"
"6.473161","5.9.29.183","172.19.0.3","TCP","1516","9002 → 43520 [PSH, ACK] Seq=269042 Ack=16747 Win=65535 Len=1460 [TCP segment of a reassembled PDU]"
"6.473170","5.9.29.183","172.19.0.3","TLSv1.2","763","Application Data"
"6.473306","172.19.0.3","5.9.29.183","TCP","56","43520 → 9002 [ACK] Seq=16747 Ack=271209 Win=11895 Len=0"
"6.487815","5.9.29.183","172.19.0.3","TCP","1516","[TCP segment of a reassembled PDU]"
"6.487843","5.9.29.183","172.19.0.3","TCP","1492","9002 → 43520 [PSH, ACK] Seq=272669 Ack=16747 Win=65535 Len=1436 [TCP segment of a reassembled PDU]"
"6.487854","172.19.0.3","5.9.29.183","TCP","56","43520 → 9002 [ACK] Seq=16747 Ack=274105 Win=11903 Len=0"
"6.487969","5.9.29.183","172.19.0.3","TLSv1.2","273","Application Data"
"6.488482","172.19.0.3","5.9.29.183","TLSv1.2","599","Application Data"
"6.488639","5.9.29.183","172.19.0.3","TCP","56","9002 → 43520 [ACK] Seq=274322 Ack=17290 Win=65535 Len=0"
"6.497487","172.19.0.3","5.9.29.183","TLSv1.2","599","Application Data"
"6.497662","5.9.29.183","172.19.0.3","TCP","56","9002 → 43520 [ACK] Seq=274322 Ack=17833 Win=65535 Len=0"
"6.860901","5.9.29.183","172.19.0.3","TLSv1.2","599","Application Data"
"6.861661","172.19.0.3","5.9.29.183","TLSv1.2","599","Application Data"
"6.861907","5.9.29.183","172.19.0.3","TCP","56","9002 → 43520 [ACK] Seq=274865 Ack=18376 Win=65535 Len=0"
"7.162202","5.9.29.183","172.19.0.3","TLSv1.2","599","Application Data"
"7.204191","172.19.0.3","5.9.29.183","TCP","56","43520 → 9002 [ACK] Seq=18376 Ack=275408 Win=11911 Len=0"
"7.217197","5.9.29.183","172.19.0.3","TCP","1516","[TCP segment of a reassembled PDU]"
"7.217222","172.19.0.3","5.9.29.183","TCP","56","43520 → 9002 [ACK] Seq=18376 Ack=276868 Win=11911 Len=0"
"7.217235","5.9.29.183","172.19.0.3","TCP","1516","9002 → 43520 [PSH, ACK] Seq=276868 Ack=18376 Win=65535 Len=1460 [TCP segment of a reassembled PDU]"
"7.217246","172.19.0.3","5.9.29.183","TCP","56","43520 → 9002 [ACK] Seq=18376 Ack=278328 Win=11901 Len=0"
"7.217248","5.9.29.183","172.19.0.3","TLSv1.2","1213","Application Data"
"7.217253","172.19.0.3","5.9.29.183","TCP","56","43520 → 9002 [ACK] Seq=18376 Ack=279485 Win=11893 Len=0"
"7.233456","5.9.29.183","172.19.0.3","TLSv1.2","1177","Application Data"
"7.233476","172.19.0.3","5.9.29.183","TCP","56","43520 → 9002 [ACK] Seq=18376 Ack=280606 Win=11911 Len=0"
"7.237083","172.19.0.3","5.9.29.183","TLSv1.2","599","Application Data"
"7.237488","5.9.29.183","172.19.0.3","TCP","56","9002 → 43520 [ACK] Seq=280606 Ack=18919 Win=65535 Len=0"
"7.529584","5.9.29.183","172.19.0.3","TLSv1.2","599","Application Data"
"7.530506","172.19.0.3","5.9.29.183","TLSv1.2","599","Application Data"
"7.530962","5.9.29.183","172.19.0.3","TCP","56","9002 → 43520 [ACK] Seq=281149 Ack=19462 Win=65535 Len=0"
"7.822734","5.9.29.183","172.19.0.3","TCP","1516","[TCP segment of a reassembled PDU]"
"7.822780","5.9.29.183","172.19.0.3","TCP","1492","9002 → 43520 [PSH, ACK] Seq=282609 Ack=19462 Win=65535 Len=1436 [TCP segment of a reassembled PDU]"
"7.822789","5.9.29.183","172.19.0.3","TLSv1.2","787","Application Data"
"7.822909","172.19.0.3","5.9.29.183","TCP","56","43520 → 9002 [ACK] Seq=19462 Ack=284776 Win=11893 Len=0"
"7.846627","5.9.29.183","172.19.0.3","TCP","1504","[TCP segment of a reassembled PDU]"
"7.846674","5.9.29.183","172.19.0.3","TCP","1516","9002 → 43520 [PSH, ACK] Seq=286224 Ack=19462 Win=65535 Len=1460 [TCP segment of a reassembled PDU]"
"7.846691","172.19.0.3","5.9.29.183","TCP","56","43520 → 9002 [ACK] Seq=19462 Ack=287684 Win=11903 Len=0"
"7.846694","5.9.29.183","172.19.0.3","TLSv1.2","775","Application Data"
"7.857035","5.9.29.183","172.19.0.3","TCP","1504","[TCP segment of a reassembled PDU]"
"7.857059","172.19.0.3","5.9.29.183","TCP","56","43520 → 9002 [ACK] Seq=19462 Ack=289851 Win=11911 Len=0"
"7.857075","5.9.29.183","172.19.0.3","TCP","1516","9002 → 43520 [PSH, ACK] Seq=289851 Ack=19462 Win=65535 Len=1460 [TCP segment of a reassembled PDU]"
"7.857082","5.9.29.183","172.19.0.3","TLSv1.2","1492","Application Data [TCP segment of a reassembled PDU]"
"7.857261","172.19.0.3","5.9.29.183","TCP","56","43520 → 9002 [ACK] Seq=19462 Ack=292747 Win=11895 Len=0"
"7.862241","5.9.29.183","172.19.0.3","TLSv1.2","396","Application Data"
"7.873714","5.9.29.183","172.19.0.3","TCP","1516","[TCP segment of a reassembled PDU]"
"7.873738","172.19.0.3","5.9.29.183","TCP","56","43520 → 9002 [ACK] Seq=19462 Ack=294547 Win=11911 Len=0"
"7.873755","5.9.29.183","172.19.0.3","TCP","1492","9002 → 43520 [PSH, ACK] Seq=294547 Ack=19462 Win=65535 Len=1436 [TCP segment of a reassembled PDU]"
"7.877789","5.9.29.183","172.19.0.3","TLSv1.2","787","Application Data"
"7.877815","172.19.0.3","5.9.29.183","TCP","56","43520 → 9002 [ACK] Seq=19462 Ack=296714 Win=11911 Len=0"
"7.882027","5.9.29.183","172.19.0.3","TCP","1504","[TCP segment of a reassembled PDU]"
"7.882039","5.9.29.183","172.19.0.3","TCP","1504","9002 → 43520 [PSH, ACK] Seq=298162 Ack=19462 Win=65535 Len=1448 [TCP segment of a reassembled PDU]"
"7.882095","172.19.0.3","5.9.29.183","TCP","56","43520 → 9002 [ACK] Seq=19462 Ack=299610 Win=11903 Len=0"
"7.892883","5.9.29.183","172.19.0.3","TLSv1.2","1330","Application Data, Application Data"
"7.893478","5.9.29.183","172.19.0.3","TCP","1504","[TCP segment of a reassembled PDU]"
"7.893489","172.19.0.3","5.9.29.183","TCP","56","43520 → 9002 [ACK] Seq=19462 Ack=302332 Win=11911 Len=0"
"7.893601","5.9.29.183","172.19.0.3","TCP","1504","9002 → 43520 [PSH, ACK] Seq=302332 Ack=19462 Win=65535 Len=1448 [TCP segment of a reassembled PDU]"
"7.893607","5.9.29.183","172.19.0.3","TLSv1.2","1504","Application Data [TCP segment of a reassembled PDU]"
"7.893635","172.19.0.3","5.9.29.183","TCP","56","43520 → 9002 [ACK] Seq=19462 Ack=305228 Win=11895 Len=0"
"7.893826","172.19.0.3","5.9.29.183","TLSv1.2","599","Application Data"
"7.894002","5.9.29.183","172.19.0.3","TCP","56","9002 → 43520 [ACK] Seq=305228 Ack=20005 Win=65535 Len=0"
"7.908056","5.9.29.183","172.19.0.3","TLSv1.2","1504","Application Data [TCP segment of a reassembled PDU]"
"7.908582","5.9.29.183","172.19.0.3","TCP","1029","9002 → 43520 [PSH, ACK] Seq=306676 Ack=20005 Win=65535 Len=973 [TCP segment of a reassembled PDU]"
"7.908592","172.19.0.3","5.9.29.183","TCP","56","43520 → 9002 [ACK] Seq=20005 Ack=307649 Win=11911 Len=0"
"7.908595","5.9.29.183","172.19.0.3","TCP","1516","9002 → 43520 [PSH, ACK] Seq=307649 Ack=20005 Win=65535 Len=1460 [TCP segment of a reassembled PDU]"
"7.908631","5.9.29.183","172.19.0.3","TLSv1.2","1516","Application Data [TCP segment of a reassembled PDU]"
"7.908638","5.9.29.183","172.19.0.3","TLSv1.2","1516","Application Data [TCP segment of a reassembled PDU]"
"7.908641","5.9.29.183","172.19.0.3","TCP","1516","9002 → 43520 [PSH, ACK] Seq=312029 Ack=20005 Win=65535 Len=1460 [TCP segment of a reassembled PDU]"
"7.908644","5.9.29.183","172.19.0.3","TCP","1516","9002 → 43520 [PSH, ACK] Seq=313489 Ack=20005 Win=65535 Len=1460 [TCP segment of a reassembled PDU]"
"7.908732","5.9.29.183","172.19.0.3","TLSv1.2","1516","Application Data [TCP segment of a reassembled PDU]"
"7.908738","5.9.29.183","172.19.0.3","TCP","1516","9002 → 43520 [PSH, ACK] Seq=316409 Ack=20005 Win=65535 Len=1460 [TCP segment of a reassembled PDU]"
"7.908743","5.9.29.183","172.19.0.3","TLSv1.2","207","Application Data"
"7.908785","172.19.0.3","5.9.29.183","TCP","56","43520 → 9002 [ACK] Seq=20005 Ack=318020 Win=11845 Len=0"
"7.908983","172.19.0.3","5.9.29.183","TLSv1.2","599","Application Data"
"7.909295","5.9.29.183","172.19.0.3","TCP","56","9002 → 43520 [ACK] Seq=318020 Ack=20548 Win=65535 Len=0"
"7.922523","5.9.29.183","172.19.0.3","TCP","1504","[TCP segment of a reassembled PDU]"
"7.922672","5.9.29.183","172.19.0.3","TCP","1504","9002 → 43520 [PSH, ACK] Seq=319468 Ack=20548 Win=65535 Len=1448 [TCP segment of a reassembled PDU]"
"7.922687","172.19.0.3","5.9.29.183","TCP","56","43520 → 9002 [ACK] Seq=20548 Ack=320916 Win=11903 Len=0"
"7.924823","5.9.29.183","172.19.0.3","TLSv1.2","787","Application Data"
"7.933111","5.9.29.183","172.19.0.3","TCP","1504","[TCP segment of a reassembled PDU]"
"7.933123","172.19.0.3","5.9.29.183","TCP","56","43520 → 9002 [ACK] Seq=20548 Ack=323095 Win=11911 Len=0"
"7.933717","5.9.29.183","172.19.0.3","TCP","1516","9002 → 43520 [PSH, ACK] Seq=323095 Ack=20548 Win=65535 Len=1460 [TCP segment of a reassembled PDU]"
"7.933726","5.9.29.183","172.19.0.3","TLSv1.2","1516","Application Data [TCP segment of a reassembled PDU]"
"7.933730","5.9.29.183","172.19.0.3","TCP","1480","9002 → 43520 [PSH, ACK] Seq=326015 Ack=20548 Win=65535 Len=1424 [TCP segment of a reassembled PDU]"
"7.933784","5.9.29.183","172.19.0.3","TCP","1504","9002 → 43520 [PSH, ACK] Seq=327439 Ack=20548 Win=65535 Len=1448 [TCP segment of a reassembled PDU]"
"7.933809","172.19.0.3","5.9.29.183","TCP","56","43520 → 9002 [ACK] Seq=20548 Ack=328887 Win=11887 Len=0"
"7.939768","5.9.29.183","172.19.0.3","TLSv1.2","584","Application Data"
"7.951066","5.9.29.183","172.19.0.3","TCP","1516","[TCP segment of a reassembled PDU]"
"7.951090","172.19.0.3","5.9.29.183","TCP","56","43520 → 9002 [ACK] Seq=20548 Ack=330875 Win=11911 Len=0"
"7.951107","5.9.29.183","172.19.0.3","TCP","1492","9002 → 43520 [PSH, ACK] Seq=330875 Ack=20548 Win=65535 Len=1436 [TCP segment of a reassembled PDU]"
"7.955174","5.9.29.183","172.19.0.3","TLSv1.2","273","Application Data"
"7.955202","172.19.0.3","5.9.29.183","TCP","56","43520 → 9002 [ACK] Seq=20548 Ack=332528 Win=11911 Len=0"
"7.981215","5.9.29.183","172.19.0.3","TLSv1.2","1113","Application Data"
"7.981591","172.19.0.3","5.9.29.183","TLSv1.2","599","Application Data"
"7.981819","5.9.29.183","172.19.0.3","TCP","56","9002 → 43520 [ACK] Seq=333585 Ack=21091 Win=65535 Len=0"
"7.991271","172.19.0.3","5.9.29.183","TLSv1.2","599","Application Data"
"7.991515","5.9.29.183","172.19.0.3","TCP","56","9002 → 43520 [ACK] Seq=333585 Ack=21634 Win=65535 Len=0"
"8.281071","5.9.29.183","172.19.0.3","TLSv1.2","599","Application Data"
"8.281972","172.19.0.3","5.9.29.183","TLSv1.2","599","Application Data"
"8.282439","5.9.29.183","172.19.0.3","TCP","56","9002 → 43520 [ACK] Seq=334128 Ack=22177 Win=65535 Len=0"
"8.560829","5.9.29.183","172.19.0.3","TLSv1.2","599","Application Data"
"8.606133","172.19.0.3","5.9.29.183","TCP","56","43520 → 9002 [ACK] Seq=22177 Ack=334671 Win=11911 Len=0"
"8.622764","5.9.29.183","172.19.0.3","TCP","1516","[TCP segment of a reassembled PDU]"
"8.622788","172.19.0.3","5.9.29.183","TCP","56","43520 → 9002 [ACK] Seq=22177 Ack=336131 Win=11911 Len=0"
"8.622804","5.9.29.183","172.19.0.3","TCP","1492","9002 → 43520 [PSH, ACK] Seq=336131 Ack=22177 Win=65535 Len=1436 [TCP segment of a reassembled PDU]"
"8.622815","172.19.0.3","5.9.29.183","TCP","56","43520 → 9002 [ACK] Seq=22177 Ack=337567 Win=11903 Len=0"
"8.622816","5.9.29.183","172.19.0.3","TLSv1.2","787","Application Data"
"8.622822","172.19.0.3","5.9.29.183","TCP","56","43520 → 9002 [ACK] Seq=22177 Ack=338298 Win=11898 Len=0"
"8.659847","5.9.29.183","172.19.0.3","TCP","1516","[TCP segment of a reassembled PDU]"
"8.659869","172.19.0.3","5.9.29.183","TCP","56","43520 → 9002 [ACK] Seq=22177 Ack=339758 Win=11911 Len=0"
"8.659884","5.9.29.183","172.19.0.3","TCP","1492","9002 → 43520 [PSH, ACK] Seq=339758 Ack=22177 Win=65535 Len=1436 [TCP segment of a reassembled PDU]"
"8.659891","172.19.0.3","5.9.29.183","TCP","56","43520 → 9002 [ACK] Seq=22177 Ack=341194 Win=11903 Len=0"
"8.660303","5.9.29.183","172.19.0.3","TLSv1.2","273","Application Data"
"8.660314","172.19.0.3","5.9.29.183","TCP","56","43520 → 9002 [ACK] Seq=22177 Ack=341411 Win=11911 Len=0"
"8.663435","172.19.0.3","5.9.29.183","TLSv1.2","599","Application Data"
"8.663678","5.9.29.183","172.19.0.3","TCP","56","9002 → 43520 [ACK] Seq=341411 Ack=22720 Win=65535 Len=0"
"8.967793","5.9.29.183","172.19.0.3","TLSv1.2","599","Application Data"
"8.968495","172.19.0.3","5.9.29.183","TLSv1.2","599","Application Data"
"8.968740","5.9.29.183","172.19.0.3","TCP","56","9002 → 43520 [ACK] Seq=341954 Ack=23263 Win=65535 Len=0"
"9.246288","5.9.29.183","172.19.0.3","TLSv1.2","599","Application Data"
"9.267654","5.9.29.183","172.19.0.3","TCP","1504","[TCP segment of a reassembled PDU]"
"9.267678","172.19.0.3","5.9.29.183","TCP","56","43520 → 9002 [ACK] Seq=23263 Ack=343945 Win=11911 Len=0"
"9.267693","5.9.29.183","172.19.0.3","TCP","1516","9002 → 43520 [PSH, ACK] Seq=343945 Ack=23263 Win=65535 Len=1460 [TCP segment of a reassembled PDU]"
"9.267703","5.9.29.183","172.19.0.3","TLSv1.2","775","Application Data"
"9.267890","172.19.0.3","5.9.29.183","TCP","56","43520 → 9002 [ACK] Seq=23263 Ack=346124 Win=11895 Len=0"
"9.288946","5.9.29.183","172.19.0.3","TCP","1504","[TCP segment of a reassembled PDU]"
"9.289014","5.9.29.183","172.19.0.3","TCP","1516","9002 → 43520 [PSH, ACK] Seq=347572 Ack=23263 Win=65535 Len=1460 [TCP segment of a reassembled PDU]"
"9.289032","172.19.0.3","5.9.29.183","TCP","56","43520 → 9002 [ACK] Seq=23263 Ack=349032 Win=11903 Len=0"
"9.289035","5.9.29.183","172.19.0.3","TLSv1.2","1516","Application Data [TCP segment of a reassembled PDU]"
"9.289039","5.9.29.183","172.19.0.3","TCP","1516","9002 → 43520 [PSH, ACK] Seq=350492 Ack=23263 Win=65535 Len=1460 [TCP segment of a reassembled PDU]"
"9.289269","5.9.29.183","172.19.0.3","TCP","1516","9002 → 43520 [PSH, ACK] Seq=351952 Ack=23263 Win=65535 Len=1460 [TCP segment of a reassembled PDU]"
"9.289276","5.9.29.183","172.19.0.3","TLSv1.2","1516","Application Data [TCP segment of a reassembled PDU]"
"9.289281","5.9.29.183","172.19.0.3","TCP","1516","9002 → 43520 [PSH, ACK] Seq=354872 Ack=23263 Win=65535 Len=1460 [TCP segment of a reassembled PDU]"
"9.289284","5.9.29.183","172.19.0.3","TCP","1165","9002 → 43520 [PSH, ACK] Seq=356332 Ack=23263 Win=65535 Len=1109 [TCP segment of a reassembled PDU]"
"9.289359","172.19.0.3","5.9.29.183","TCP","56","43520 → 9002 [ACK] Seq=23263 Ack=357441 Win=11853 Len=0"
"9.301593","5.9.29.183","172.19.0.3","TLSv1.2","1504","Application Data [TCP segment of a reassembled PDU]"
"9.301619","5.9.29.183","172.19.0.3","TCP","1504","9002 → 43520 [PSH, ACK] Seq=358889 Ack=23263 Win=65535 Len=1448 [TCP segment of a reassembled PDU]"
"9.301634","172.19.0.3","5.9.29.183","TCP","56","43520 → 9002 [ACK] Seq=23263 Ack=360337 Win=11903 Len=0"
"9.304240","5.9.29.183","172.19.0.3","TLSv1.2","1516","Application Data [TCP segment of a reassembled PDU]"
"9.304271","5.9.29.183","172.19.0.3","TCP","1492","9002 → 43520 [PSH, ACK] Seq=361797 Ack=23263 Win=65535 Len=1436 [TCP segment of a reassembled PDU]"
"9.304290","172.19.0.3","5.9.29.183","TCP","56","43520 → 9002 [ACK] Seq=23263 Ack=363233 Win=11903 Len=0"
"9.304517","5.9.29.183","172.19.0.3","TCP","1504","9002 → 43520 [PSH, ACK] Seq=363233 Ack=23263 Win=65535 Len=1448 [TCP segment of a reassembled PDU]"
"9.304527","5.9.29.183","172.19.0.3","TLSv1.2","1205","Application Data, Application Data"
"9.304590","172.19.0.3","5.9.29.183","TCP","56","43520 → 9002 [ACK] Seq=23263 Ack=365830 Win=11887 Len=0"
"9.304819","172.19.0.3","5.9.29.183","TLSv1.2","599","Application Data"
"9.304997","5.9.29.183","172.19.0.3","TCP","56","9002 → 43520 [ACK] Seq=365830 Ack=23806 Win=65535 Len=0"
"9.327895","5.9.29.183","172.19.0.3","TCP","1516","[TCP segment of a reassembled PDU]"
"9.327923","5.9.29.183","172.19.0.3","TCP","1516","9002 → 43520 [PSH, ACK] Seq=367290 Ack=23806 Win=65535 Len=1460 [TCP segment of a reassembled PDU]"
"9.327936","172.19.0.3","5.9.29.183","TCP","56","43520 → 9002 [ACK] Seq=23806 Ack=368750 Win=11903 Len=0"
"9.327938","5.9.29.183","172.19.0.3","TLSv1.2","1213","Application Data"
"9.327941","5.9.29.183","172.19.0.3","TCP","1516","[TCP segment of a reassembled PDU]"
"9.327945","5.9.29.183","172.19.0.3","TCP","1516","9002 → 43520 [PSH, ACK] Seq=371367 Ack=23806 Win=65535 Len=1460 [TCP segment of a reassembled PDU]"
"9.327947","5.9.29.183","172.19.0.3","TCP","414","9002 → 43520 [PSH, ACK] Seq=372827 Ack=23806 Win=65535 Len=358 [TCP segment of a reassembled PDU]"
"9.328109","5.9.29.183","172.19.0.3","TLSv1.2","1516","Application Data [TCP segment of a reassembled PDU]"
"9.328120","5.9.29.183","172.19.0.3","TCP","1516","9002 → 43520 [PSH, ACK] Seq=374645 Ack=23806 Win=65535 Len=1460 [TCP segment of a reassembled PDU]"
"9.328123","5.9.29.183","172.19.0.3","TCP","1516","9002 → 43520 [PSH, ACK] Seq=376105 Ack=23806 Win=65535 Len=1460 [TCP segment of a reassembled PDU]"
"9.328127","5.9.29.183","172.19.0.3","TLSv1.2","1516","Application Data [TCP segment of a reassembled PDU]"
"9.328240","5.9.29.183","172.19.0.3","TCP","1074","9002 → 43520 [PSH, ACK] Seq=379025 Ack=23806 Win=65535 Len=1018 [TCP segment of a reassembled PDU]"
"9.328338","172.19.0.3","5.9.29.183","TCP","56","43520 → 9002 [ACK] Seq=23806 Ack=380043 Win=11828 Len=0"
"9.328589","172.19.0.3","5.9.29.183","TLSv1.2","599","Application Data"
"9.328802","5.9.29.183","172.19.0.3","TCP","56","9002 → 43520 [ACK] Seq=380043 Ack=24349 Win=65535 Len=0"
"9.343423","5.9.29.183","172.19.0.3","TLSv1.2","1379","Application Data"
"9.367834","5.9.29.183","172.19.0.3","TCP","1516","[TCP segment of a reassembled PDU]"
"9.367858","172.19.0.3","5.9.29.183","TCP","56","43520 → 9002 [ACK] Seq=24349 Ack=382826 Win=11911 Len=0"
"9.367876","5.9.29.183","172.19.0.3","TLSv1.2","1195","Application Data"
"9.372064","172.19.0.3","5.9.29.183","TLSv1.2","599","Application Data"
"9.372399","5.9.29.183","172.19.0.3","TCP","56","9002 → 43520 [ACK] Seq=383965 Ack=24892 Win=65535 Len=0"
"9.687979","5.9.29.183","172.19.0.3","TLSv1.2","599","Application Data"
"9.688713","172.19.0.3","5.9.29.183","TLSv1.2","599","Application Data"
"9.689090","5.9.29.183","172.19.0.3","TCP","56","9002 → 43520 [ACK] Seq=384508 Ack=25435 Win=65535 Len=0"
"9.975960","5.9.29.183","172.19.0.3","TCP","1516","[TCP segment of a reassembled PDU]"
"9.975993","5.9.29.183","172.19.0.3","TCP","1516","9002 → 43520 [PSH, ACK] Seq=385968 Ack=25435 Win=65535 Len=1460 [TCP segment of a reassembled PDU]"
"9.976002","5.9.29.183","172.19.0.3","TLSv1.2","763","Application Data"
"9.976127","172.19.0.3","5.9.29.183","TCP","56","43520 → 9002 [ACK] Seq=25435 Ack=388135 Win=11895 Len=0"
"10.002802","5.9.29.183","172.19.0.3","TCP","1504","[TCP segment of a reassembled PDU]"
"10.002822","5.9.29.183","172.19.0.3","TCP","1516","9002 → 43520 [PSH, ACK] Seq=389583 Ack=25435 Win=65535 Len=1460 [TCP segment of a reassembled PDU]"
"10.002833","172.19.0.3","5.9.29.183","TCP","56","43520 → 9002 [ACK] Seq=25435 Ack=391043 Win=11903 Len=0"
"10.002835","5.9.29.183","172.19.0.3","TLSv1.2","775","Application Data"
"10.014209","5.9.29.183","172.19.0.3","TCP","1504","[TCP segment of a reassembled PDU]"
"10.014265","172.19.0.3","5.9.29.183","TCP","56","43520 → 9002 [ACK] Seq=25435 Ack=393210 Win=11911 Len=0"
"10.014284","5.9.29.183","172.19.0.3","TCP","1516","9002 → 43520 [PSH, ACK] Seq=393210 Ack=25435 Win=65535 Len=1460 [TCP segment of a reassembled PDU]"
"10.014294","5.9.29.183","172.19.0.3","TLSv1.2","1516","Application Data [TCP segment of a reassembled PDU]"
"10.014433","5.9.29.183","172.19.0.3","TCP","1516","9002 → 43520 [PSH, ACK] Seq=396130 Ack=25435 Win=65535 Len=1460 [TCP segment of a reassembled PDU]"
"10.014445","5.9.29.183","172.19.0.3","TCP","1516","9002 → 43520 [PSH, ACK] Seq=397590 Ack=25435 Win=65535 Len=1460 [TCP segment of a reassembled PDU]"
"10.014451","5.9.29.183","172.19.0.3","TLSv1.2","1456","Application Data [TCP segment of a reassembled PDU]"
"10.014525","172.19.0.3","5.9.29.183","TCP","56","43520 → 9002 [ACK] Seq=25435 Ack=400450 Win=11871 Len=0"
"10.018109","5.9.29.183","172.19.0.3","TLSv1.2","193","Application Data"
"10.028181","5.9.29.183","172.19.0.3","TCP","1516","[TCP segment of a reassembled PDU]"
"10.028201","172.19.0.3","5.9.29.183","TCP","56","43520 → 9002 [ACK] Seq=25435 Ack=402047 Win=11911 Len=0"
"10.028215","5.9.29.183","172.19.0.3","TCP","1492","9002 → 43520 [PSH, ACK] Seq=402047 Ack=25435 Win=65535 Len=1436 [TCP segment of a reassembled PDU]"
"10.011021","5.9.29.183","172.19.0.3","TLSv1.2","1330","Application Data, Application Data"
"10.011037","172.19.0.3","5.9.29.183","TCP","56","43520 → 9002 [ACK] Seq=25435 Ack=404757 Win=11911 Len=0"
"10.027668","5.9.29.183","172.19.0.3","TCP","1504","[TCP segment of a reassembled PDU]"
"10.027740","5.9.29.183","172.19.0.3","TCP","1516","9002 → 43520 [PSH, ACK] Seq=406205 Ack=25435 Win=65535 Len=1460 [TCP segment of a reassembled PDU]"
"10.027776","5.9.29.183","172.19.0.3","TLSv1.2","1516","Application Data [TCP segment of a reassembled PDU]"
"10.027781","5.9.29.183","172.19.0.3","TCP","1516","9002 → 43520 [PSH, ACK] Seq=409125 Ack=25435 Win=65535 Len=1460 [TCP segment of a reassembled PDU]"
"10.027785","5.9.29.183","172.19.0.3","TCP","1201","9002 → 43520 [PSH, ACK] Seq=410585 Ack=25435 Win=65535 Len=1145 [TCP segment of a reassembled PDU]"
"10.027832","172.19.0.3","5.9.29.183","TCP","56","43520 → 9002 [ACK] Seq=25435 Ack=411730 Win=11879 Len=0"
"10.027835","5.9.29.183","172.19.0.3","TLSv1.2","1516","Application Data [TCP segment of a reassembled PDU]"
"10.027840","5.9.29.183","172.19.0.3","TCP","1516","9002 → 43520 [PSH, ACK] Seq=413190 Ack=25435 Win=65535 Len=1460 [TCP segment of a reassembled PDU]"
"10.027886","5.9.29.183","172.19.0.3","TCP","1516","9002 → 43520 [PSH, ACK] Seq=414650 Ack=25435 Win=65535 Len=1460 [TCP segment of a reassembled PDU]"
"10.027890","5.9.29.183","172.19.0.3","TLSv1.2","1516","Application Data [TCP segment of a reassembled PDU]"
"10.027893","172.19.0.3","5.9.29.183","TCP","56","43520 → 9002 [ACK] Seq=25435 Ack=414650 Win=11863 Len=0"
"10.027963","5.9.29.183","172.19.0.3","TCP","1516","9002 → 43520 [PSH, ACK] Seq=417570 Ack=25435 Win=65535 Len=1460 [TCP segment of a reassembled PDU]"
"10.027970","5.9.29.183","172.19.0.3","TCP","1444","9002 → 43520 [PSH, ACK] Seq=419030 Ack=25435 Win=65535 Len=1388 [TCP segment of a reassembled PDU]"
"10.028099","172.19.0.3","5.9.29.183","TCP","56","43520 → 9002 [ACK] Seq=25435 Ack=420418 Win=11830 Len=0"
"10.028364","172.19.0.3","5.9.29.183","TLSv1.2","1113","Application Data"
"10.028594","5.9.29.183","172.19.0.3","TCP","56","9002 → 43520 [ACK] Seq=420418 Ack=26492 Win=65535 Len=0"
"10.042793","5.9.29.183","172.19.0.3","TLSv1.2","988","Application Data, Application Data"
"10.074823","5.9.29.183","172.19.0.3","TCP","1504","[TCP segment of a reassembled PDU]"
"10.074841","172.19.0.3","5.9.29.183","TCP","56","43520 → 9002 [ACK] Seq=26492 Ack=422798 Win=11911 Len=0"
"10.076176","5.9.29.183","172.19.0.3","TCP","1504","9002 → 43520 [PSH, ACK] Seq=422798 Ack=26492 Win=65535 Len=1448 [TCP segment of a reassembled PDU]"
"10.076209","5.9.29.183","172.19.0.3","TLSv1.2","787","Application Data"
"10.076275","172.19.0.3","5.9.29.183","TCP","56","43520 → 9002 [ACK] Seq=26492 Ack=424977 Win=11911 Len=0"
"10.088457","5.9.29.183","172.19.0.3","TCP","1504","[TCP segment of a reassembled PDU]"
"10.088515","5.9.29.183","172.19.0.3","TCP","1504","9002 → 43520 [PSH, ACK] Seq=426425 Ack=26492 Win=65535 Len=1448 [TCP segment of a reassembled PDU]"
"10.088694","172.19.0.3","5.9.29.183","TCP","56","43520 → 9002 [ACK] Seq=26492 Ack=427873 Win=11903 Len=0"
"10.088732","5.9.29.183","172.19.0.3","TLSv1.2","1516","Application Data [TCP segment of a reassembled PDU]"
"10.088789","5.9.29.183","172.19.0.3","TCP","1492","9002 → 43520 [PSH, ACK] Seq=429333 Ack=26492 Win=65535 Len=1436 [TCP segment of a reassembled PDU]"
"10.088858","5.9.29.183","172.19.0.3","TCP","1516","9002 → 43520 [PSH, ACK] Seq=430769 Ack=26492 Win=65535 Len=1460 [TCP segment of a reassembled PDU]"
"10.088944","5.9.29.183","172.19.0.3","TLSv1.2","1516","Application Data [TCP segment of a reassembled PDU]"
"10.088952","5.9.29.183","172.19.0.3","TCP","1516","9002 → 43520 [PSH, ACK] Seq=433689 Ack=26492 Win=65535 Len=1460 [TCP segment of a reassembled PDU]"
"10.088985","172.19.0.3","5.9.29.183","TCP","56","43520 → 9002 [ACK] Seq=26492 Ack=435149 Win=11861 Len=0"
"10.089084","5.9.29.183","172.19.0.3","TCP","1516","9002 → 43520 [PSH, ACK] Seq=435149 Ack=26492 Win=65535 Len=1460 [TCP segment of a reassembled PDU]"
"10.089089","5.9.29.183","172.19.0.3","TLSv1.2","1456","Application Data [TCP segment of a reassembled PDU]"
"10.089132","172.19.0.3","5.9.29.183","TCP","56","43520 → 9002 [ACK] Seq=26492 Ack=438009 Win=11845 Len=0"
"10.089617","172.19.0.3","5.9.29.183","TLSv1.2","599","Application Data"
"10.089824","5.9.29.183","172.19.0.3","TCP","56","9002 → 43520 [ACK] Seq=438009 Ack=27035 Win=65535 Len=0"
"10.091572","5.9.29.183","172.19.0.3","TLSv1.2","504","Application Data"
"10.099632","172.19.0.3","5.9.29.183","TLSv1.2","599","Application Data"
"10.099902","5.9.29.183","172.19.0.3","TCP","56","9002 → 43520 [ACK] Seq=438457 Ack=27578 Win=65535 Len=0"
"10.417415","5.9.29.183","172.19.0.3","TCP","320","[TCP segment of a reassembled PDU]"
"10.417512","5.9.29.183","172.19.0.3","TLSv1.2","335","Application Data"
"10.417598","172.19.0.3","5.9.29.183","TCP","56","43520 → 9002 [ACK] Seq=27578 Ack=439000 Win=11911 Len=0"
"10.418281","172.19.0.3","5.9.29.183","TLSv1.2","599","Application Data"
"10.418647","5.9.29.183","172.19.0.3","TCP","56","9002 → 43520 [ACK] Seq=439000 Ack=28121 Win=65535 Len=0"
"10.698337","5.9.29.183","172.19.0.3","TLSv1.2","599","Application Data"
"10.735028","5.9.29.183","172.19.0.3","TCP","1516","[TCP segment of a reassembled PDU]"
"10.735051","172.19.0.3","5.9.29.183","TCP","56","43520 → 9002 [ACK] Seq=28121 Ack=441003 Win=11911 Len=0"
"10.735100","5.9.29.183","172.19.0.3","TCP","1492","9002 → 43520 [PSH, ACK] Seq=441003 Ack=28121 Win=65535 Len=1436 [TCP segment of a reassembled PDU]"
"10.735327","5.9.29.183","172.19.0.3","TLSv1.2","787","Application Data"
"10.735356","172.19.0.3","5.9.29.183","TCP","56","43520 → 9002 [ACK] Seq=28121 Ack=443170 Win=11895 Len=0"
"10.746517","5.9.29.183","172.19.0.3","TCP","1504","[TCP segment of a reassembled PDU]"
"10.746569","5.9.29.183","172.19.0.3","TCP","1504","9002 → 43520 [PSH, ACK] Seq=444618 Ack=28121 Win=65535 Len=1448 [TCP segment of a reassembled PDU]"
"10.746583","172.19.0.3","5.9.29.183","TCP","56","43520 → 9002 [ACK] Seq=28121 Ack=446066 Win=11903 Len=0"
"10.750268","5.9.29.183","172.19.0.3","TLSv1.2","1330","Application Data, Application Data"
"10.757256","5.9.29.183","172.19.0.3","TCP","1516","[TCP segment of a reassembled PDU]"
"10.757273","172.19.0.3","5.9.29.183","TCP","56","43520 → 9002 [ACK] Seq=28121 Ack=448800 Win=11911 Len=0"
"10.757313","5.9.29.183","172.19.0.3","TCP","1516","9002 → 43520 [PSH, ACK] Seq=448800 Ack=28121 Win=65535 Len=1460 [TCP segment of a reassembled PDU]"
"10.757321","5.9.29.183","172.19.0.3","TLSv1.2","1516","Application Data [TCP segment of a reassembled PDU]"
"10.757324","5.9.29.183","172.19.0.3","TCP","1516","9002 → 43520 [PSH, ACK] Seq=451720 Ack=28121 Win=65535 Len=1460 [TCP segment of a reassembled PDU]"
"10.757328","5.9.29.183","172.19.0.3","TCP","1516","9002 → 43520 [PSH, ACK] Seq=453180 Ack=28121 Win=65535 Len=1460 [TCP segment of a reassembled PDU]"
"10.757330","5.9.29.183","172.19.0.3","TLSv1.2","1516","Application Data [TCP segment of a reassembled PDU]"
"10.757387","5.9.29.183","172.19.0.3","TCP","1432","9002 → 43520 [PSH, ACK] Seq=456100 Ack=28121 Win=65535 Len=1376 [TCP segment of a reassembled PDU]"
"10.757424","172.19.0.3","5.9.29.183","TCP","56","43520 → 9002 [ACK] Seq=28121 Ack=457476 Win=11863 Len=0"
"10.761799","5.9.29.183","172.19.0.3","TCP","1504","9002 → 43520 [PSH, ACK] Seq=457476 Ack=28121 Win=65535 Len=1448 [TCP segment of a reassembled PDU]"
"10.765429","5.9.29.183","172.19.0.3","TLSv1.2","381","Application Data"
"10.765452","172.19.0.3","5.9.29.183","TCP","56","43520 → 9002 [ACK] Seq=28121 Ack=459249 Win=11911 Len=0"
"10.774077","5.9.29.183","172.19.0.3","TCP","1504","[TCP segment of a reassembled PDU]"
"10.780606","5.9.29.183","172.19.0.3","TLSv1.2","693","Application Data"
"10.780624","172.19.0.3","5.9.29.183","TCP","56","43520 → 9002 [ACK] Seq=28121 Ack=461334 Win=11911 Len=0"
"10.804600","5.9.29.183","172.19.0.3","TCP","1516","[TCP segment of a reassembled PDU]"
"10.804668","5.9.29.183","172.19.0.3","TCP","1492","9002 → 43520 [PSH, ACK] Seq=462794 Ack=28121 Win=65535 Len=1436 [TCP segment of a reassembled PDU]"
"10.804677","5.9.29.183","172.19.0.3","TLSv1.2","1237","Application Data"
"10.804805","172.19.0.3","5.9.29.183","TCP","56","43520 → 9002 [ACK] Seq=28121 Ack=465411 Win=11893 Len=0"
"10.805213","172.19.0.3","5.9.29.183","TLSv1.2","1113","Application Data"
"10.805529","5.9.29.183","172.19.0.3","TCP","56","9002 → 43520 [ACK] Seq=465411 Ack=29178 Win=65535 Len=0"
"10.820856","5.9.29.183","172.19.0.3","TLSv1.2","1177","Application Data"
"10.843911","5.9.29.183","172.19.0.3","TCP","1516","[TCP segment of a reassembled PDU]"
"10.843933","172.19.0.3","5.9.29.183","TCP","56","43520 → 9002 [ACK] Seq=29178 Ack=467992 Win=11911 Len=0"
"10.843985","5.9.29.183","172.19.0.3","TLSv1.2","1195","Application Data"
"10.847982","172.19.0.3","5.9.29.183","TLSv1.2","599","Application Data"
"10.848445","5.9.29.183","172.19.0.3","TCP","56","9002 → 43520 [ACK] Seq=469131 Ack=29721 Win=65535 Len=0"
"11.157673","5.9.29.183","172.19.0.3","TLSv1.2","599","Application Data"
"11.158560","172.19.0.3","5.9.29.183","TLSv1.2","599","Application Data"
"11.158966","5.9.29.183","172.19.0.3","TCP","56","9002 → 43520 [ACK] Seq=469674 Ack=30264 Win=65535 Len=0"
"11.448112","5.9.29.183","172.19.0.3","TCP","1516","[TCP segment of a reassembled PDU]"
"11.448226","5.9.29.183","172.19.0.3","TCP","1516","9002 → 43520 [PSH, ACK] Seq=471134 Ack=30264 Win=65535 Len=1460 [TCP segment of a reassembled PDU]"
"11.448247","5.9.29.183","172.19.0.3","TLSv1.2","763","Application Data"
"11.448387","172.19.0.3","5.9.29.183","TCP","56","43520 → 9002 [ACK] Seq=30264 Ack=473301 Win=11895 Len=0"
"11.474221","5.9.29.183","172.19.0.3","TLSv1.2","599","Application Data"
"11.485426","5.9.29.183","172.19.0.3","TCP","1504","[TCP segment of a reassembled PDU]"
"11.485477","172.19.0.3","5.9.29.183","TCP","56","43520 → 9002 [ACK] Seq=30264 Ack=475292 Win=11911 Len=0"
"11.485517","5.9.29.183","172.19.0.3","TCP","1516","9002 → 43520 [PSH, ACK] Seq=475292 Ack=30264 Win=65535 Len=1460 [TCP segment of a reassembled PDU]"
"11.485638","5.9.29.183","172.19.0.3","TLSv1.2","1516","Application Data [TCP segment of a reassembled PDU]"
"11.485648","5.9.29.183","172.19.0.3","TCP","1480","9002 → 43520 [PSH, ACK] Seq=478212 Ack=30264 Win=65535 Len=1424 [TCP segment of a reassembled PDU]"
"11.485656","5.9.29.183","172.19.0.3","TCP","1516","9002 → 43520 [PSH, ACK] Seq=479636 Ack=30264 Win=65535 Len=1460 [TCP segment of a reassembled PDU]"
"11.485660","5.9.29.183","172.19.0.3","TLSv1.2","1516","Application Data [TCP segment of a reassembled PDU]"
"11.485664","5.9.29.183","172.19.0.3","TCP","1480","9002 → 43520 [PSH, ACK] Seq=482556 Ack=30264 Win=65535 Len=1424 [TCP segment of a reassembled PDU]"
"11.485678","172.19.0.3","5.9.29.183","TCP","56","43520 → 9002 [ACK] Seq=30264 Ack=481096 Win=11879 Len=0"
"11.485747","172.19.0.3","5.9.29.183","TCP","56","43520 → 9002 [ACK] Seq=30264 Ack=483980 Win=11863 Len=0"
"11.489019","5.9.29.183","172.19.0.3","TLSv1.2","1315","Application Data"
"11.498607","5.9.29.183","172.19.0.3","TCP","1516","[TCP segment of a reassembled PDU]"
"11.498625","172.19.0.3","5.9.29.183","TCP","56","43520 → 9002 [ACK] Seq=30264 Ack=486699 Win=11911 Len=0"
"11.498667","5.9.29.183","172.19.0.3","TCP","1492","9002 → 43520 [PSH, ACK] Seq=486699 Ack=30264 Win=65535 Len=1436 [TCP segment of a reassembled PDU]"
"11.500797","5.9.29.183","172.19.0.3","TLSv1.2","1516","Application Data [TCP segment of a reassembled PDU]"
"11.500817","172.19.0.3","5.9.29.183","TCP","56","43520 → 9002 [ACK] Seq=30264 Ack=489595 Win=11911 Len=0"
"11.500862","5.9.29.183","172.19.0.3","TCP","1516","9002 → 43520 [PSH, ACK] Seq=489595 Ack=30264 Win=65535 Len=1460 [TCP segment of a reassembled PDU]"
"11.500873","5.9.29.183","172.19.0.3","TCP","1516","9002 → 43520 [PSH, ACK] Seq=491055 Ack=30264 Win=65535 Len=1460 [TCP segment of a reassembled PDU]"
"11.500877","5.9.29.183","172.19.0.3","TLSv1.2","1468","Application Data [TCP segment of a reassembled PDU]"
"11.501023","172.19.0.3","5.9.29.183","TCP","56","43520 → 9002 [ACK] Seq=30264 Ack=493927 Win=11887 Len=0"
"11.504181","5.9.29.183","172.19.0.3","TLSv1.2","193","Application Data"
"11.508317","5.9.29.183","172.19.0.3","TCP","1504","[TCP segment of a reassembled PDU]"
"11.508356","172.19.0.3","5.9.29.183","TCP","56","43520 → 9002 [ACK] Seq=30264 Ack=495512 Win=11909 Len=0"
"11.508388","5.9.29.183","172.19.0.3","TCP","1516","9002 → 43520 [PSH, ACK] Seq=495512 Ack=30264 Win=65535 Len=1460 [TCP segment of a reassembled PDU]"
"11.508395","5.9.29.183","172.19.0.3","TLSv1.2","1492","Application Data [TCP segment of a reassembled PDU]"
"11.508398","5.9.29.183","172.19.0.3","TCP","1516","9002 → 43520 [PSH, ACK] Seq=498408 Ack=30264 Win=65535 Len=1460 [TCP segment of a reassembled PDU]"
"11.508443","5.9.29.183","172.19.0.3","TCP","1492","9002 → 43520 [PSH, ACK] Seq=499868 Ack=30264 Win=65535 Len=1436 [TCP segment of a reassembled PDU]"
"11.508504","172.19.0.3","5.9.29.183","TCP","56","43520 → 9002 [ACK] Seq=30264 Ack=501304 Win=11877 Len=0"
"11.508687","172.19.0.3","5.9.29.183","TLSv1.2","599","Application Data"
"11.508849","5.9.29.183","172.19.0.3","TCP","56","9002 → 43520 [ACK] Seq=501304 Ack=30807 Win=65535 Len=0"
"11.519219","5.9.29.183","172.19.0.3","TLSv1.2","1127","Application Data, Application Data"
"11.533261","5.9.29.183","172.19.0.3","TCP","1504","[TCP segment of a reassembled PDU]"
"11.533282","172.19.0.3","5.9.29.183","TCP","56","43520 → 9002 [ACK] Seq=30807 Ack=503823 Win=11911 Len=0"
"11.533321","5.9.29.183","172.19.0.3","TCP","490","9002 → 43520 [PSH, ACK] Seq=503823 Ack=30807 Win=65535 Len=434 [TCP segment of a reassembled PDU]"
"11.533358","5.9.29.183","172.19.0.3","TCP","1516","9002 → 43520 [PSH, ACK] Seq=504257 Ack=30807 Win=65535 Len=1460 [TCP segment of a reassembled PDU]"
"11.533365","5.9.29.183","172.19.0.3","TLSv1.2","1516","Application Data [TCP segment of a reassembled PDU]"
"11.533471","5.9.29.183","172.19.0.3","TCP","1516","9002 → 43520 [PSH, ACK] Seq=507177 Ack=30807 Win=65535 Len=1460 [TCP segment of a reassembled PDU]"
"11.533477","5.9.29.183","172.19.0.3","TCP","1034","9002 → 43520 [PSH, ACK] Seq=508637 Ack=30807 Win=65535 Len=978 [TCP segment of a reassembled PDU]"
"11.533480","5.9.29.183","172.19.0.3","TLSv1.2","1516","Application Data [TCP segment of a reassembled PDU]"
"11.533482","5.9.29.183","172.19.0.3","TCP","1516","9002 → 43520 [PSH, ACK] Seq=511075 Ack=30807 Win=65535 Len=1460 [TCP segment of a reassembled PDU]"
"11.533487","5.9.29.183","172.19.0.3","TCP","1480","9002 → 43520 [PSH, ACK] Seq=512535 Ack=30807 Win=65535 Len=1424 [TCP segment of a reassembled PDU]"
"11.533503","172.19.0.3","5.9.29.183","TCP","56","43520 → 9002 [ACK] Seq=30807 Ack=512535 Win=11855 Len=0"
"11.534502","5.9.29.183","172.19.0.3","TLSv1.2","924","Application Data, Application Data"
"11.534511","172.19.0.3","5.9.29.183","TCP","56","43520 → 9002 [ACK] Seq=30807 Ack=514827 Win=11911 Len=0"
"11.580628","5.9.29.183","172.19.0.3","TCP","1516","[TCP segment of a reassembled PDU]"
"11.580688","5.9.29.183","172.19.0.3","TCP","1516","9002 → 43520 [PSH, ACK] Seq=516287 Ack=30807 Win=65535 Len=1460 [TCP segment of a reassembled PDU]"
"11.580698","5.9.29.183","172.19.0.3","TLSv1.2","1213","Application Data"
"11.580850","172.19.0.3","5.9.29.183","TCP","56","43520 → 9002 [ACK] Seq=30807 Ack=518904 Win=11895 Len=0"
"11.581098","172.19.0.3","5.9.29.183","TLSv1.2","599","Application Data"
"11.581303","5.9.29.183","172.19.0.3","TCP","56","9002 → 43520 [ACK] Seq=518904 Ack=31350 Win=65535 Len=0"
"11.591177","172.19.0.3","5.9.29.183","TLSv1.2","1113","Application Data"
"11.591777","5.9.29.183","172.19.0.3","TCP","56","9002 → 43520 [ACK] Seq=518904 Ack=32407 Win=65535 Len=0"
"11.595948","5.9.29.183","172.19.0.3","TLSv1.2","149","Application Data"
"11.636086","172.19.0.3","5.9.29.183","TCP","56","43520 → 9002 [ACK] Seq=32407 Ack=518997 Win=11911 Len=0"
"11.949839","5.9.29.183","172.19.0.3","TLSv1.2","599","Application Data"
"11.949923","172.19.0.3","5.9.29.183","TCP","56","43520 → 9002 [ACK] Seq=32407 Ack=519540 Win=11911 Len=0"
"11.950783","172.19.0.3","5.9.29.183","TLSv1.2","599","Application Data"
"11.951094","5.9.29.183","172.19.0.3","TCP","56","9002 → 43520 [ACK] Seq=519540 Ack=32950 Win=65535 Len=0"
"12.265438","5.9.29.183","172.19.0.3","TCP","1504","[TCP segment of a reassembled PDU]"
"12.265518","5.9.29.183","172.19.0.3","TCP","1516","9002 → 43520 [PSH, ACK] Seq=520988 Ack=32950 Win=65535 Len=1460 [TCP segment of a reassembled PDU]"
"12.265529","5.9.29.183","172.19.0.3","TLSv1.2","1516","Application Data [TCP segment of a reassembled PDU]"
"12.265533","5.9.29.183","172.19.0.3","TCP","1516","9002 → 43520 [PSH, ACK] Seq=523908 Ack=32950 Win=65535 Len=1460 [TCP segment of a reassembled PDU]"
"12.265536","5.9.29.183","172.19.0.3","TCP","1201","9002 → 43520 [PSH, ACK] Seq=525368 Ack=32950 Win=65535 Len=1145 [TCP segment of a reassembled PDU]"
"12.265670","172.19.0.3","5.9.29.183","TCP","56","43520 → 9002 [ACK] Seq=32950 Ack=526513 Win=11877 Len=0"
"12.281930","5.9.29.183","172.19.0.3","TLSv1.2","851","Application Data"
"12.290913","5.9.29.183","172.19.0.3","TCP","1504","[TCP segment of a reassembled PDU]"
"12.290934","172.19.0.3","5.9.29.183","TCP","56","43520 → 9002 [ACK] Seq=32950 Ack=528756 Win=11911 Len=0"
"12.291047","5.9.29.183","172.19.0.3","TCP","1516","9002 → 43520 [PSH, ACK] Seq=528756 Ack=32950 Win=65535 Len=1460 [TCP segment of a reassembled PDU]"
"12.291067","5.9.29.183","172.19.0.3","TLSv1.2","1492","Application Data [TCP segment of a reassembled PDU]"
"12.291204","5.9.29.183","172.19.0.3","TCP","1516","9002 → 43520 [PSH, ACK] Seq=531652 Ack=32950 Win=65535 Len=1460 [TCP segment of a reassembled PDU]"
"12.291213","5.9.29.183","172.19.0.3","TCP","1516","9002 → 43520 [PSH, ACK] Seq=533112 Ack=32950 Win=65535 Len=1460 [TCP segment of a reassembled PDU]"
"12.291217","5.9.29.183","172.19.0.3","TLSv1.2","1516","Application Data [TCP segment of a reassembled PDU]"
"12.291225","5.9.29.183","172.19.0.3","TCP","1516","9002 → 43520 [PSH, ACK] Seq=536032 Ack=32950 Win=65535 Len=1460 [TCP segment of a reassembled PDU]"
"12.291229","5.9.29.183","172.19.0.3","TCP","1456","9002 → 43520 [PSH, ACK] Seq=537492 Ack=32950 Win=65535 Len=1400 [TCP segment of a reassembled PDU]"
"12.291266","172.19.0.3","5.9.29.183","TCP","56","43520 → 9002 [ACK] Seq=32950 Ack=538892 Win=11855 Len=0"
"12.300019","5.9.29.183","172.19.0.3","TLSv1.2","924","Application Data, Application Data"
"12.304254","5.9.29.183","172.19.0.3","TCP","1516","[TCP segment of a reassembled PDU]"
"12.304278","172.19.0.3","5.9.29.183","TCP","56","43520 → 9002 [ACK] Seq=32950 Ack=541220 Win=11911 Len=0"
"12.304334","5.9.29.183","172.19.0.3","TCP","1492","9002 → 43520 [PSH, ACK] Seq=541220 Ack=32950 Win=65535 Len=1436 [TCP segment of a reassembled PDU]"
"12.306672","5.9.29.183","172.19.0.3","TLSv1.2","1516","Application Data [TCP segment of a reassembled PDU]"
"12.306694","172.19.0.3","5.9.29.183","TCP","56","43520 → 9002 [ACK] Seq=32950 Ack=544116 Win=11911 Len=0"
"12.306752","5.9.29.183","172.19.0.3","TCP","1516","9002 → 43520 [PSH, ACK] Seq=544116 Ack=32950 Win=65535 Len=1460 [TCP segment of a reassembled PDU]"
"12.306767","5.9.29.183","172.19.0.3","TCP","1480","9002 → 43520 [PSH, ACK] Seq=545576 Ack=32950 Win=65535 Len=1424 [TCP segment of a reassembled PDU]"
"12.306908","172.19.0.3","5.9.29.183","TCP","56","43520 → 9002 [ACK] Seq=32950 Ack=547000 Win=11895 Len=0"
"12.315011","5.9.29.183","172.19.0.3","TLSv1.2","70","Application Data"
"12.315439","172.19.0.3","5.9.29.183","TLSv1.2","599","Application Data"
"12.315673","5.9.29.183","172.19.0.3","TCP","56","9002 → 43520 [ACK] Seq=547014 Ack=33493 Win=65535 Len=0"
"12.329822","5.9.29.183","172.19.0.3","TCP","1516","[TCP segment of a reassembled PDU]"
"12.329874","5.9.29.183","172.19.0.3","TCP","1516","9002 → 43520 [PSH, ACK] Seq=548474 Ack=33493 Win=65535 Len=1460 [TCP segment of a reassembled PDU]"
"12.329881","5.9.29.183","172.19.0.3","TLSv1.2","1516","Application Data [TCP segment of a reassembled PDU]"
"12.329884","5.9.29.183","172.19.0.3","TCP","1516","9002 → 43520 [PSH, ACK] Seq=551394 Ack=33493 Win=65535 Len=1460 [TCP segment of a reassembled PDU]"
"12.329886","5.9.29.183","172.19.0.3","TCP","1516","9002 → 43520 [PSH, ACK] Seq=552854 Ack=33493 Win=65535 Len=1460 [TCP segment of a reassembled PDU]"
"12.329889","5.9.29.183","172.19.0.3","TLSv1.2","1444","Application Data [TCP segment of a reassembled PDU]"
"12.329903","5.9.29.183","172.19.0.3","TCP","1516","9002 → 43520 [PSH, ACK] Seq=555702 Ack=33493 Win=65535 Len=1460 [TCP segment of a reassembled PDU]"
"12.330038","172.19.0.3","5.9.29.183","TCP","56","43520 → 9002 [ACK] Seq=33493 Ack=557162 Win=11863 Len=0"
"12.330096","5.9.29.183","172.19.0.3","TCP","1516","9002 → 43520 [PSH, ACK] Seq=557162 Ack=33493 Win=65535 Len=1460 [TCP segment of a reassembled PDU]"
"12.330175","5.9.29.183","172.19.0.3","TLSv1.2","1516","Application Data [TCP segment of a reassembled PDU]"
"12.330179","5.9.29.183","172.19.0.3","TCP","1468","9002 → 43520 [PSH, ACK] Seq=560082 Ack=33493 Win=65535 Len=1412 [TCP segment of a reassembled PDU]"
"12.330256","172.19.0.3","5.9.29.183","TCP","56","43520 → 9002 [ACK] Seq=33493 Ack=561494 Win=11838 Len=0"
"12.330575","5.9.29.183","172.19.0.3","TLSv1.2","1112","Application Data"
"12.341157","5.9.29.183","172.19.0.3","TCP","1516","[TCP segment of a reassembled PDU]"
"12.341176","172.19.0.3","5.9.29.183","TCP","56","43520 → 9002 [ACK] Seq=33493 Ack=564010 Win=11911 Len=0"
"12.341217","5.9.29.183","172.19.0.3","TCP","1516","9002 → 43520 [PSH, ACK] Seq=564010 Ack=33493 Win=65535 Len=1460 [TCP segment of a reassembled PDU]"
"12.341227","5.9.29.183","172.19.0.3","TLSv1.2","1480","Application Data [TCP segment of a reassembled PDU]"
"12.341380","172.19.0.3","5.9.29.183","TCP","56","43520 → 9002 [ACK] Seq=33493 Ack=566894 Win=11895 Len=0"
"12.343069","5.9.29.183","172.19.0.3","TLSv1.2","1504","Application Data [TCP segment of a reassembled PDU]"
"12.343103","5.9.29.183","172.19.0.3","TCP","1504","9002 → 43520 [PSH, ACK] Seq=568342 Ack=33493 Win=65535 Len=1448 [TCP segment of a reassembled PDU]"
"12.343111","172.19.0.3","5.9.29.183","TCP","56","43520 → 9002 [ACK] Seq=33493 Ack=569790 Win=11903 Len=0"
"12.346400","5.9.29.183","172.19.0.3","TCP","59","9002 → 43520 [PSH, ACK] Seq=569790 Ack=33493 Win=65535 Len=3 [TCP segment of a reassembled PDU]"
"12.346455","5.9.29.183","172.19.0.3","TLSv1.2","1124","Application Data"
"12.346593","172.19.0.3","5.9.29.183","TCP","56","43520 → 9002 [ACK] Seq=33493 Ack=570861 Win=11911 Len=0"
"12.346809","172.19.0.3","5.9.29.183","TLSv1.2","599","Application Data"
"12.347046","5.9.29.183","172.19.0.3","TCP","56","9002 → 43520 [ACK] Seq=570861 Ack=34036 Win=65535 Len=0"
"12.365230","5.9.29.183","172.19.0.3","TCP","1516","[TCP segment of a reassembled PDU]"
"12.365299","5.9.29.183","172.19.0.3","TCP","1516","9002 → 43520 [PSH, ACK] Seq=572321 Ack=34036 Win=65535 Len=1460 [TCP segment of a reassembled PDU]"
"12.365309","5.9.29.183","172.19.0.3","TLSv1.2","1213","Application Data"
"12.365312","5.9.29.183","172.19.0.3","TCP","1516","[TCP segment of a reassembled PDU]"
"12.365331","5.9.29.183","172.19.0.3","TCP","1492","9002 → 43520 [PSH, ACK] Seq=576398 Ack=34036 Win=65535 Len=1436 [TCP segment of a reassembled PDU]"
"12.365456","172.19.0.3","5.9.29.183","TCP","56","43520 → 9002 [ACK] Seq=34036 Ack=577834 Win=11877 Len=0"
"12.365728","172.19.0.3","5.9.29.183","TLSv1.2","599","Application Data"
"12.366066","5.9.29.183","172.19.0.3","TCP","56","9002 → 43520 [ACK] Seq=577834 Ack=34579 Win=65535 Len=0"
"12.380563","5.9.29.183","172.19.0.3","TLSv1.2","1394","Application Data, Application Data"
"12.421269","172.19.0.3","5.9.29.183","TCP","56","43520 → 9002 [ACK] Seq=34579 Ack=579172 Win=11911 Len=0"
