_ws.col.Time,_ws.col.Source,_ws.col.Destination,_ws.col.Protocol,_ws.col.Length,_ws.col.Info
"0.000000","172.18.0.2","54.38.73.16","TLSv1.2","611","Application Data"
"0.062552","54.38.73.16","172.18.0.2","TCP","68","21002 → 36876 [ACK] Seq=1 Ack=544 Win=1452 Len=0 TSval=2678251005 TSecr=1096407239"
"0.453885","54.38.73.16","172.18.0.2","TLSv1.2","611","Application Data"
"0.455011","172.18.0.2","54.38.73.16","TCP","1516","[TCP segment of a reassembled PDU]"
"0.455134","172.18.0.2","54.38.73.16","TLSv1.2","705","Application Data"
"0.478687","54.38.73.16","172.18.0.2","TCP","68","21002 → 36876 [ACK] Seq=544 Ack=2629 Win=1448 Len=0 TSval=2678251109 TSecr=1096407694"
"0.724953","54.38.73.16","172.18.0.2","TLSv1.2","1639","Application Data"
"0.725139","172.18.0.2","54.38.73.16","TCP","68","36876 → 21002 [ACK] Seq=2629 Ack=2115 Win=5601 Len=0 TSval=1096407965 TSecr=2678251170"
"0.732631","172.18.0.2","54.38.73.16","TLSv1.2","611","Application Data"
"0.757201","54.38.73.16","172.18.0.2","TCP","68","21002 → 36876 [ACK] Seq=2115 Ack=3172 Win=1452 Len=0 TSval=2678251178 TSecr=1096407972"
"1.169387","54.38.73.16","172.18.0.2","TLSv1.2","611","Application Data"
"1.170387","172.18.0.2","54.38.73.16","TLSv1.2","611","Application Data"
"1.194400","54.38.73.16","172.18.0.2","TCP","68","21002 → 36876 [ACK] Seq=2658 Ack=3715 Win=1452 Len=0 TSval=2678251288 TSecr=1096408410"
"1.416747","54.38.73.16","172.18.0.2","TLSv1.2","611","Application Data"
"1.459227","172.18.0.2","54.38.73.16","TCP","68","36876 → 21002 [ACK] Seq=3715 Ack=3201 Win=5612 Len=0 TSval=1096408699 TSecr=2678251343"
"1.459410","54.38.73.16","172.18.0.2","TCP","2964","[TCP segment of a reassembled PDU]"
"1.459429","172.18.0.2","54.38.73.16","TCP","68","36876 → 21002 [ACK] Seq=3715 Ack=6097 Win=5596 Len=0 TSval=1096408699 TSecr=2678251354"
"1.484246","54.38.73.16","172.18.0.2","TLSv1.2","799","Application Data"
"1.484288","172.18.0.2","54.38.73.16","TCP","68","36876 → 21002 [ACK] Seq=3715 Ack=6828 Win=5593 Len=0 TSval=1096408724 TSecr=2678251360"
"1.501826","54.38.73.16","172.18.0.2","TCP","2964","[TCP segment of a reassembled PDU]"
"1.501851","172.18.0.2","54.38.73.16","TCP","68","36876 → 21002 [ACK] Seq=3715 Ack=9724 Win=5596 Len=0 TSval=1096408741 TSecr=2678251364"
"1.508869","54.38.73.16","172.18.0.2","TLSv1.2","799","Application Data"
"1.508893","172.18.0.2","54.38.73.16","TCP","68","36876 → 21002 [ACK] Seq=3715 Ack=10455 Win=5593 Len=0 TSval=1096408748 TSecr=2678251366"
"1.515792","172.18.0.2","54.38.73.16","TLSv1.2","611","Application Data"
"1.540692","54.38.73.16","172.18.0.2","TCP","68","21002 → 36876 [ACK] Seq=10455 Ack=4258 Win=1452 Len=0 TSval=2678251374 TSecr=1096408755"
"1.886207","54.38.73.16","172.18.0.2","TLSv1.2","611","Application Data"
"1.886252","172.18.0.2","54.38.73.16","TCP","68","36876 → 21002 [ACK] Seq=4258 Ack=10998 Win=5608 Len=0 TSval=1096409126 TSecr=2678251434"
"1.887321","172.18.0.2","54.38.73.16","TLSv1.2","611","Application Data"
"1.910516","54.38.73.16","172.18.0.2","TCP","68","21002 → 36876 [ACK] Seq=10998 Ack=4801 Win=1452 Len=0 TSval=2678251467 TSecr=1096409127"
"2.250548","54.38.73.16","172.18.0.2","TLSv1.2","3695","Application Data"
"2.250594","172.18.0.2","54.38.73.16","TCP","68","36876 → 21002 [ACK] Seq=4801 Ack=14625 Win=5584 Len=0 TSval=1096409490 TSecr=2678251551"
"2.261472","54.38.73.16","172.18.0.2","TCP","2964","[TCP segment of a reassembled PDU]"
"2.261505","172.18.0.2","54.38.73.16","TCP","68","36876 → 21002 [ACK] Seq=4801 Ack=17521 Win=5596 Len=0 TSval=1096409501 TSecr=2678251554"
"2.270618","54.38.73.16","172.18.0.2","TLSv1.2","7308","Application Data, Application Data"
"2.270663","172.18.0.2","54.38.73.16","TCP","68","36876 → 21002 [ACK] Seq=4801 Ack=24761 Win=5565 Len=0 TSval=1096409510 TSecr=2678251557"
"2.274831","54.38.73.16","172.18.0.2","TLSv1.2","2964","Application Data [TCP segment of a reassembled PDU]"
"2.274855","172.18.0.2","54.38.73.16","TCP","68","36876 → 21002 [ACK] Seq=4801 Ack=27657 Win=5596 Len=0 TSval=1096409514 TSecr=2678251558"
"2.286501","54.38.73.16","172.18.0.2","TLSv1.2","2964","Application Data [TCP segment of a reassembled PDU]"
"2.286528","172.18.0.2","54.38.73.16","TCP","68","36876 → 21002 [ACK] Seq=4801 Ack=30553 Win=5596 Len=0 TSval=1096409526 TSecr=2678251561"
"2.295038","54.38.73.16","172.18.0.2","TLSv1.2","7308","Application Data, Application Data, Application Data"
"2.295088","172.18.0.2","54.38.73.16","TCP","68","36876 → 21002 [ACK] Seq=4801 Ack=37793 Win=5565 Len=0 TSval=1096409535 TSecr=2678251563"
"2.295244","54.38.73.16","172.18.0.2","TCP","1516","21002 → 36876 [ACK] Seq=37793 Ack=4801 Win=1452 Len=1448 TSval=2678251563 TSecr=1096409510 [TCP segment of a reassembled PDU]"
"2.295262","172.18.0.2","54.38.73.16","TCP","68","36876 → 21002 [ACK] Seq=4801 Ack=39241 Win=5554 Len=0 TSval=1096409535 TSecr=2678251563"
"2.299325","54.38.73.16","172.18.0.2","TLSv1.2","1927","Application Data, Application Data"
"2.299350","172.18.0.2","54.38.73.16","TCP","68","36876 → 21002 [ACK] Seq=4801 Ack=41100 Win=5600 Len=0 TSval=1096409539 TSecr=2678251564"
"2.299818","172.18.0.2","54.38.73.16","TLSv1.2","611","Application Data"
"2.303939","54.38.73.16","172.18.0.2","TCP","1516","[TCP segment of a reassembled PDU]"
"2.310951","54.38.73.16","172.18.0.2","TLSv1.2","2964","Application Data [TCP segment of a reassembled PDU]"
"2.311150","172.18.0.2","54.38.73.16","TCP","68","36876 → 21002 [ACK] Seq=5344 Ack=45444 Win=5596 Len=0 TSval=1096409551 TSecr=2678251565"
"2.319747","54.38.73.16","172.18.0.2","TLSv1.2","8756","Application Data, Application Data, Application Data"
"2.319917","172.18.0.2","54.38.73.16","TCP","68","36876 → 21002 [ACK] Seq=5344 Ack=54132 Win=5566 Len=0 TSval=1096409559 TSecr=2678251569"
"2.323302","54.38.73.16","172.18.0.2","TCP","2964","21002 → 36876 [ACK] Seq=54132 Ack=4801 Win=1452 Len=2896 TSval=2678251570 TSecr=1096409539 [TCP segment of a reassembled PDU]"
"2.323327","172.18.0.2","54.38.73.16","TCP","68","36876 → 21002 [ACK] Seq=5344 Ack=57028 Win=5596 Len=0 TSval=1096409563 TSecr=2678251570"
"2.324709","54.38.73.16","172.18.0.2","TCP","68","21002 → 36876 [ACK] Seq=57028 Ack=5344 Win=1452 Len=0 TSval=2678251570 TSecr=1096409539"
"2.324742","172.18.0.2","54.38.73.16","TLSv1.2","611","Application Data"
"2.335962","54.38.73.16","172.18.0.2","TLSv1.2","1516","Application Data [TCP segment of a reassembled PDU]"
"2.336065","54.38.73.16","172.18.0.2","TCP","1516","21002 → 36876 [ACK] Seq=58476 Ack=5344 Win=1452 Len=1448 TSval=2678251573 TSecr=1096409551 [TCP segment of a reassembled PDU]"
"2.336140","172.18.0.2","54.38.73.16","TCP","68","36876 → 21002 [ACK] Seq=5887 Ack=59924 Win=5590 Len=0 TSval=1096409576 TSecr=2678251573"
"2.344495","54.38.73.16","172.18.0.2","TLSv1.2","2964","Application Data [TCP segment of a reassembled PDU]"
"2.344519","172.18.0.2","54.38.73.16","TCP","68","36876 → 21002 [ACK] Seq=5887 Ack=62820 Win=5596 Len=0 TSval=1096409584 TSecr=2678251575"
"2.344825","54.38.73.16","172.18.0.2","TLSv1.2","5860","Application Data [TCP segment of a reassembled PDU]"
"2.344948","172.18.0.2","54.38.73.16","TCP","68","36876 → 21002 [ACK] Seq=5887 Ack=68612 Win=5566 Len=0 TSval=1096409584 TSecr=2678251575"
"2.347644","54.38.73.16","172.18.0.2","TLSv1.2","5860","Application Data, Application Data, Application Data, Application Data"
"2.347669","172.18.0.2","54.38.73.16","TCP","68","36876 → 21002 [ACK] Seq=5887 Ack=74404 Win=5581 Len=0 TSval=1096409587 TSecr=2678251576"
"2.361283","54.38.73.16","172.18.0.2","TLSv1.2","2964","Application Data [TCP segment of a reassembled PDU]"
"2.361316","172.18.0.2","54.38.73.16","TLSv1.2","611","Application Data"
"2.369453","54.38.73.16","172.18.0.2","TLSv1.2","225","Application Data"
"2.411135","172.18.0.2","54.38.73.16","TCP","68","36876 → 21002 [ACK] Seq=6430 Ack=77457 Win=5612 Len=0 TSval=1096409651 TSecr=2678251581"
"2.427643","54.38.73.16","172.18.0.2","TCP","68","21002 → 36876 [ACK] Seq=77457 Ack=6430 Win=1452 Len=0 TSval=2678251596 TSecr=1096409601"
"2.427680","172.18.0.2","54.38.73.16","TLSv1.2","611","Application Data"
"2.491088","54.38.73.16","172.18.0.2","TCP","68","21002 → 36876 [ACK] Seq=77457 Ack=6973 Win=1452 Len=0 TSval=2678251612 TSecr=1096409667"
"2.807714","54.38.73.16","172.18.0.2","TLSv1.2","611","Application Data"
"2.807768","172.18.0.2","54.38.73.16","TCP","68","36876 → 21002 [ACK] Seq=6973 Ack=78000 Win=5608 Len=0 TSval=1096410047 TSecr=2678251665"
"2.808764","172.18.0.2","54.38.73.16","TLSv1.2","611","Application Data"
"2.833194","54.38.73.16","172.18.0.2","TCP","68","21002 → 36876 [ACK] Seq=78000 Ack=7516 Win=1452 Len=0 TSval=2678251697 TSecr=1096410048"
"3.065327","54.38.73.16","172.18.0.2","TLSv1.2","611","Application Data"
"3.065372","172.18.0.2","54.38.73.16","TCP","68","36876 → 21002 [ACK] Seq=7516 Ack=78543 Win=5608 Len=0 TSval=1096410305 TSecr=2678251755"
"3.098131","54.38.73.16","172.18.0.2","TLSv1.2","3695","Application Data"
"3.098158","172.18.0.2","54.38.73.16","TCP","68","36876 → 21002 [ACK] Seq=7516 Ack=82170 Win=5580 Len=0 TSval=1096410338 TSecr=2678251763"
"3.108776","54.38.73.16","172.18.0.2","TCP","2964","[TCP segment of a reassembled PDU]"
"3.108802","172.18.0.2","54.38.73.16","TCP","68","36876 → 21002 [ACK] Seq=7516 Ack=85066 Win=5596 Len=0 TSval=1096410348 TSecr=2678251766"
"3.117076","54.38.73.16","172.18.0.2","TLSv1.2","2964","Application Data [TCP segment of a reassembled PDU]"
"3.117101","172.18.0.2","54.38.73.16","TCP","68","36876 → 21002 [ACK] Seq=7516 Ack=87962 Win=5596 Len=0 TSval=1096410357 TSecr=2678251768"
"3.117591","54.38.73.16","172.18.0.2","TLSv1.2","4412","Application Data [TCP segment of a reassembled PDU]"
"3.117611","172.18.0.2","54.38.73.16","TCP","68","36876 → 21002 [ACK] Seq=7516 Ack=92306 Win=5580 Len=0 TSval=1096410357 TSecr=2678251768"
"3.123078","54.38.73.16","172.18.0.2","TLSv1.2","2964","Application Data [TCP segment of a reassembled PDU]"
"3.123103","172.18.0.2","54.38.73.16","TCP","68","36876 → 21002 [ACK] Seq=7516 Ack=95202 Win=5596 Len=0 TSval=1096410363 TSecr=2678251770"
"3.123312","54.38.73.16","172.18.0.2","TLSv1.2","2058","Application Data"
"3.123332","172.18.0.2","54.38.73.16","TCP","68","36876 → 21002 [ACK] Seq=7516 Ack=97192 Win=5584 Len=0 TSval=1096410363 TSecr=2678251770"
"3.123996","172.18.0.2","54.38.73.16","TLSv1.2","611","Application Data"
"3.133121","54.38.73.16","172.18.0.2","TCP","2964","[TCP segment of a reassembled PDU]"
"3.133147","172.18.0.2","54.38.73.16","TCP","68","36876 → 21002 [ACK] Seq=8059 Ack=100088 Win=5596 Len=0 TSval=1096410373 TSecr=2678251772"
"3.141719","54.38.73.16","172.18.0.2","TLSv1.2","2964","Application Data, Application Data"
"3.141744","172.18.0.2","54.38.73.16","TCP","68","36876 → 21002 [ACK] Seq=8059 Ack=102984 Win=5596 Len=0 TSval=1096410381 TSecr=2678251774"
"3.141912","54.38.73.16","172.18.0.2","TCP","1516","21002 → 36876 [ACK] Seq=102984 Ack=7516 Win=1452 Len=1448 TSval=2678251775 TSecr=1096410357 [TCP segment of a reassembled PDU]"
"3.141942","172.18.0.2","54.38.73.16","TCP","68","36876 → 21002 [ACK] Seq=8059 Ack=104432 Win=5585 Len=0 TSval=1096410381 TSecr=2678251775"
"3.143093","54.38.73.16","172.18.0.2","TCP","1516","21002 → 36876 [ACK] Seq=104432 Ack=7516 Win=1452 Len=1448 TSval=2678251775 TSecr=1096410357 [TCP segment of a reassembled PDU]"
"3.143117","172.18.0.2","54.38.73.16","TCP","68","36876 → 21002 [ACK] Seq=8059 Ack=105880 Win=5593 Len=0 TSval=1096410383 TSecr=2678251775"
"3.147733","54.38.73.16","172.18.0.2","TLSv1.2","4860","Application Data, Application Data"
"3.147758","172.18.0.2","54.38.73.16","TCP","68","36876 → 21002 [ACK] Seq=8059 Ack=110672 Win=5585 Len=0 TSval=1096410387 TSecr=2678251776"
"3.148675","54.38.73.16","172.18.0.2","TCP","68","21002 → 36876 [ACK] Seq=110672 Ack=8059 Win=1452 Len=0 TSval=2678251776 TSecr=1096410363"
"3.148704","172.18.0.2","54.38.73.16","TLSv1.2","611","Application Data"
"3.162735","54.38.73.16","172.18.0.2","TLSv1.2","2964","Application Data"
"3.162908","172.18.0.2","54.38.73.16","TCP","68","36876 → 21002 [ACK] Seq=8602 Ack=113568 Win=5596 Len=0 TSval=1096410402 TSecr=2678251779"
"3.165996","54.38.73.16","172.18.0.2","TCP","1516","21002 → 36876 [ACK] Seq=113568 Ack=8059 Win=1452 Len=1448 TSval=2678251780 TSecr=1096410381 [TCP segment of a reassembled PDU]"
"3.171360","54.38.73.16","172.18.0.2","TLSv1.2","408","Application Data"
"3.171537","172.18.0.2","54.38.73.16","TCP","68","36876 → 21002 [ACK] Seq=8602 Ack=115356 Win=5612 Len=0 TSval=1096410411 TSecr=2678251780"
"3.172576","54.38.73.16","172.18.0.2","TCP","2964","[TCP segment of a reassembled PDU]"
"3.172745","172.18.0.2","54.38.73.16","TCP","68","36876 → 21002 [ACK] Seq=8602 Ack=118252 Win=5596 Len=0 TSval=1096410412 TSecr=2678251782"
"3.195596","54.38.73.16","172.18.0.2","TLSv1.2","285","Application Data"
"3.215605","54.38.73.16","172.18.0.2","TCP","2964","[TCP segment of a reassembled PDU]"
"3.215629","172.18.0.2","54.38.73.16","TCP","68","36876 → 21002 [ACK] Seq=8602 Ack=121365 Win=5596 Len=0 TSval=1096410455 TSecr=2678251788"
"3.240707","54.38.73.16","172.18.0.2","TLSv1.2","799","Application Data"
"3.267623","54.38.73.16","172.18.0.2","TCP","2964","[TCP segment of a reassembled PDU]"
"3.267648","172.18.0.2","54.38.73.16","TCP","68","36876 → 21002 [ACK] Seq=8602 Ack=124992 Win=5596 Len=0 TSval=1096410507 TSecr=2678251799"
"3.291748","54.38.73.16","172.18.0.2","TLSv1.2","1342","Application Data, Application Data"
"3.301456","172.18.0.2","54.38.73.16","TLSv1.2","611","Application Data"
"3.367079","54.38.73.16","172.18.0.2","TCP","68","21002 → 36876 [ACK] Seq=126266 Ack=9145 Win=1452 Len=0 TSval=2678251831 TSecr=1096410541"
"3.730014","54.38.73.16","172.18.0.2","TLSv1.2","611","Application Data"
"3.731106","172.18.0.2","54.38.73.16","TLSv1.2","611","Application Data"
"3.754741","54.38.73.16","172.18.0.2","TCP","68","21002 → 36876 [ACK] Seq=126809 Ack=9688 Win=1452 Len=0 TSval=2678251928 TSecr=1096410971"
"4.058051","54.38.73.16","172.18.0.2","TLSv1.2","611","Application Data"
"4.099185","172.18.0.2","54.38.73.16","TCP","68","36876 → 21002 [ACK] Seq=9688 Ack=127352 Win=5612 Len=0 TSval=1096411339 TSecr=2678252003"
"4.101119","54.38.73.16","172.18.0.2","TCP","2964","[TCP segment of a reassembled PDU]"
"4.101145","172.18.0.2","54.38.73.16","TCP","68","36876 → 21002 [ACK] Seq=9688 Ack=130248 Win=5596 Len=0 TSval=1096411341 TSecr=2678252014"
"4.101319","54.38.73.16","172.18.0.2","TLSv1.2","4412","Application Data [TCP segment of a reassembled PDU]"
"4.101340","172.18.0.2","54.38.73.16","TCP","68","36876 → 21002 [ACK] Seq=9688 Ack=134592 Win=5580 Len=0 TSval=1096411341 TSecr=2678252014"
"4.112694","54.38.73.16","172.18.0.2","TLSv1.2","2964","Application Data [TCP segment of a reassembled PDU]"
"4.112719","172.18.0.2","54.38.73.16","TCP","68","36876 → 21002 [ACK] Seq=9688 Ack=137488 Win=5596 Len=0 TSval=1096411352 TSecr=2678252017"
"4.121167","54.38.73.16","172.18.0.2","TLSv1.2","2964","Application Data, Application Data"
"4.121191","172.18.0.2","54.38.73.16","TCP","68","36876 → 21002 [ACK] Seq=9688 Ack=140384 Win=5596 Len=0 TSval=1096411361 TSecr=2678252019"
"4.123016","54.38.73.16","172.18.0.2","TLSv1.2","2964","Application Data [TCP segment of a reassembled PDU]"
"4.123041","172.18.0.2","54.38.73.16","TCP","68","36876 → 21002 [ACK] Seq=9688 Ack=143280 Win=5596 Len=0 TSval=1096411362 TSecr=2678252020"
"4.125135","54.38.73.16","172.18.0.2","TLSv1.2","3332","Application Data"
"4.125159","172.18.0.2","54.38.73.16","TCP","68","36876 → 21002 [ACK] Seq=9688 Ack=146544 Win=5580 Len=0 TSval=1096411365 TSecr=2678252020"
"4.131730","54.38.73.16","172.18.0.2","TLSv1.2","4412","Application Data"
"4.131756","172.18.0.2","54.38.73.16","TCP","68","36876 → 21002 [ACK] Seq=9688 Ack=150888 Win=5580 Len=0 TSval=1096411371 TSecr=2678252022"
"4.132263","172.18.0.2","54.38.73.16","TLSv1.2","611","Application Data"
"4.139147","54.38.73.16","172.18.0.2","TCP","2964","21002 → 36876 [ACK] Seq=150888 Ack=9688 Win=1452 Len=2896 TSval=2678252023 TSecr=1096411352 [TCP segment of a reassembled PDU]"
"4.139172","172.18.0.2","54.38.73.16","TCP","68","36876 → 21002 [ACK] Seq=10231 Ack=153784 Win=5596 Len=0 TSval=1096411379 TSecr=2678252023"
"4.144579","54.38.73.16","172.18.0.2","TLSv1.2","2964","Application Data [TCP segment of a reassembled PDU]"
"4.144603","172.18.0.2","54.38.73.16","TCP","68","36876 → 21002 [ACK] Seq=10231 Ack=156680 Win=5596 Len=0 TSval=1096411384 TSecr=2678252025"
"4.147161","54.38.73.16","172.18.0.2","TLSv1.2","2964","Application Data [TCP segment of a reassembled PDU]"
"4.147185","172.18.0.2","54.38.73.16","TCP","68","36876 → 21002 [ACK] Seq=10231 Ack=159576 Win=5596 Len=0 TSval=1096411387 TSecr=2678252026"
"4.149083","54.38.73.16","172.18.0.2","TCP","2964","21002 → 36876 [ACK] Seq=159576 Ack=9688 Win=1452 Len=2896 TSval=2678252026 TSecr=1096411365 [TCP segment of a reassembled PDU]"
"4.149108","172.18.0.2","54.38.73.16","TCP","68","36876 → 21002 [ACK] Seq=10231 Ack=162472 Win=5596 Len=0 TSval=1096411389 TSecr=2678252026"
"4.156293","54.38.73.16","172.18.0.2","TCP","68","[TCP Previous segment not captured] 21002 → 36876 [ACK] Seq=168264 Ack=10231 Win=1452 Len=0 TSval=2678252028 TSecr=1096411372"
"4.156326","172.18.0.2","54.38.73.16","TLSv1.2","611","Application Data"
"4.156334","54.38.73.16","172.18.0.2","TCP","5860","[TCP Retransmission] 21002 → 36876 [ACK] Seq=162472 Ack=9688 Win=1452 Len=5792 TSval=2678252028 TSecr=1096411371"
"4.156344","172.18.0.2","54.38.73.16","TCP","68","36876 → 21002 [ACK] Seq=10774 Ack=168264 Win=5581 Len=0 TSval=1096411396 TSecr=2678252028"
"4.163549","54.38.73.16","172.18.0.2","TLSv1.2","2964","Ignored Unknown Record"
"4.163575","172.18.0.2","54.38.73.16","TCP","68","36876 → 21002 [ACK] Seq=10774 Ack=171160 Win=5596 Len=0 TSval=1096411403 TSecr=2678252030"
"4.169156","54.38.73.16","172.18.0.2","TLSv1.2","2964","Ignored Unknown Record"
"4.169181","172.18.0.2","54.38.73.16","TCP","68","36876 → 21002 [ACK] Seq=10774 Ack=174056 Win=5596 Len=0 TSval=1096411409 TSecr=2678252031"
"4.170589","54.38.73.16","172.18.0.2","TLSv1.2","2964","Ignored Unknown Record"
"4.170613","172.18.0.2","54.38.73.16","TCP","68","36876 → 21002 [ACK] Seq=10774 Ack=176952 Win=5596 Len=0 TSval=1096411410 TSecr=2678252032"
"4.172756","54.38.73.16","172.18.0.2","TLSv1.2","5860","Ignored Unknown Record"
"4.172916","172.18.0.2","54.38.73.16","TCP","68","36876 → 21002 [ACK] Seq=10774 Ack=182744 Win=5581 Len=0 TSval=1096411412 TSecr=2678252032"
"4.180349","54.38.73.16","172.18.0.2","TLSv1.2","5860","Ignored Unknown Record"
"4.180384","172.18.0.2","54.38.73.16","TLSv1.2","611","Application Data"
"4.188210","54.38.73.16","172.18.0.2","TLSv1.2","2964","Ignored Unknown Record"
"4.188234","172.18.0.2","54.38.73.16","TCP","68","36876 → 21002 [ACK] Seq=11317 Ack=191432 Win=5596 Len=0 TSval=1096411428 TSecr=2678252036"
"4.193156","54.38.73.16","172.18.0.2","TLSv1.2","2964","Ignored Unknown Record"
"4.193182","172.18.0.2","54.38.73.16","TCP","68","36876 → 21002 [ACK] Seq=11317 Ack=194328 Win=5596 Len=0 TSval=1096411433 TSecr=2678252037"
"4.195238","54.38.73.16","172.18.0.2","TLSv1.2","5860","Ignored Unknown Record"
"4.195400","172.18.0.2","54.38.73.16","TCP","68","36876 → 21002 [ACK] Seq=11317 Ack=200120 Win=5581 Len=0 TSval=1096411435 TSecr=2678252038"
"4.198812","54.38.73.16","172.18.0.2","TLSv1.2","5860","Ignored Unknown Record"
"4.198837","172.18.0.2","54.38.73.16","TCP","68","36876 → 21002 [ACK] Seq=11317 Ack=205912 Win=5581 Len=0 TSval=1096411438 TSecr=2678252038"
"4.203800","54.38.73.16","172.18.0.2","TLSv1.2","4444","Ignored Unknown Record"
"4.203832","172.18.0.2","54.38.73.16","TLSv1.2","611","Application Data"
"4.266273","54.38.73.16","172.18.0.2","TCP","68","21002 → 36876 [ACK] Seq=210288 Ack=11860 Win=1452 Len=0 TSval=2678252056 TSecr=1096411443"
"4.266307","172.18.0.2","54.38.73.16","TLSv1.2","1154","Application Data, Application Data"
"4.329907","54.38.73.16","172.18.0.2","TCP","68","21002 → 36876 [ACK] Seq=210288 Ack=12946 Win=1452 Len=0 TSval=2678252072 TSecr=1096411506"
"4.549200","54.38.73.16","172.18.0.2","TLSv1.2","611","Application Data"
"4.550229","172.18.0.2","54.38.73.16","TLSv1.2","611","Application Data"
"4.573650","54.38.73.16","172.18.0.2","TCP","68","21002 → 36876 [ACK] Seq=210831 Ack=13489 Win=1452 Len=0 TSval=2678252132 TSecr=1096411790"
"4.923847","54.38.73.16","172.18.0.2","TLSv1.2","3695","Application Data"
"4.924029","172.18.0.2","54.38.73.16","TCP","68","36876 → 21002 [ACK] Seq=13489 Ack=214458 Win=5584 Len=0 TSval=1096412163 TSecr=2678252220"
"4.942917","54.38.73.16","172.18.0.2","TLSv1.2","4412","Application Data"
"4.943131","172.18.0.2","54.38.73.16","TCP","68","36876 → 21002 [ACK] Seq=13489 Ack=218802 Win=5580 Len=0 TSval=1096412183 TSecr=2678252225"
"4.949465","54.38.73.16","172.18.0.2","TLSv1.2","408","Application Data"
"4.953819","54.38.73.16","172.18.0.2","TCP","2964","[TCP segment of a reassembled PDU]"
"4.953844","172.18.0.2","54.38.73.16","TCP","68","36876 → 21002 [ACK] Seq=13489 Ack=222038 Win=5596 Len=0 TSval=1096412193 TSecr=2678252226"
"4.954020","54.38.73.16","172.18.0.2","TLSv1.2","7308","Application Data, Application Data"
"4.954072","172.18.0.2","54.38.73.16","TCP","68","36876 → 21002 [ACK] Seq=13489 Ack=229278 Win=5565 Len=0 TSval=1096412194 TSecr=2678252227"
"4.976884","54.38.73.16","172.18.0.2","TLSv1.2","5860","Application Data, Application Data"
"4.976910","172.18.0.2","54.38.73.16","TCP","68","36876 → 21002 [ACK] Seq=13489 Ack=235070 Win=5581 Len=0 TSval=1096412216 TSecr=2678252233"
"4.979552","54.38.73.16","172.18.0.2","TLSv1.2","219","Application Data"
"4.987554","54.38.73.16","172.18.0.2","TLSv1.2","7308","Application Data"
"4.987730","172.18.0.2","54.38.73.16","TCP","68","36876 → 21002 [ACK] Seq=13489 Ack=242461 Win=5565 Len=0 TSval=1096412227 TSecr=2678252234"
"4.988137","172.18.0.2","54.38.73.16","TLSv1.2","611","Application Data"
"4.999367","54.38.73.16","172.18.0.2","TLSv1.2","2964","Application Data [TCP segment of a reassembled PDU]"
"4.999391","172.18.0.2","54.38.73.16","TCP","68","36876 → 21002 [ACK] Seq=14032 Ack=245357 Win=5596 Len=0 TSval=1096412239 TSecr=2678252239"
"5.012777","54.38.73.16","172.18.0.2","TLSv1.2","1356","Application Data, Application Data"
"5.012810","54.38.73.16","172.18.0.2","TCP","68","21002 → 36876 [ACK] Seq=246645 Ack=14032 Win=1452 Len=0 TSval=2678252242 TSecr=1096412228"
"5.031273","54.38.73.16","172.18.0.2","TCP","2964","[TCP segment of a reassembled PDU]"
"5.031298","172.18.0.2","54.38.73.16","TCP","68","36876 → 21002 [ACK] Seq=14032 Ack=249541 Win=5596 Len=0 TSval=1096412271 TSecr=2678252242"
"5.054706","54.38.73.16","172.18.0.2","TLSv1.2","1342","Application Data, Application Data"
"5.063484","172.18.0.2","54.38.73.16","TLSv1.2","611","Application Data"
"5.125917","54.38.73.16","172.18.0.2","TCP","68","21002 → 36876 [ACK] Seq=250815 Ack=14575 Win=1452 Len=0 TSval=2678252271 TSecr=1096412303"
"5.367778","54.38.73.16","172.18.0.2","TLSv1.2","611","Application Data"
"5.368772","172.18.0.2","54.38.73.16","TLSv1.2","611","Application Data"
"5.393017","54.38.73.16","172.18.0.2","TCP","68","21002 → 36876 [ACK] Seq=251358 Ack=15118 Win=1452 Len=0 TSval=2678252337 TSecr=1096412608"
"5.608885","54.38.73.16","172.18.0.2","TLSv1.2","611","Application Data"
"5.651149","172.18.0.2","54.38.73.16","TCP","68","36876 → 21002 [ACK] Seq=15118 Ack=251901 Win=5612 Len=0 TSval=1096412891 TSecr=2678252391"
"5.651362","54.38.73.16","172.18.0.2","TLSv1.2","7308","Application Data"
"5.651400","172.18.0.2","54.38.73.16","TCP","68","36876 → 21002 [ACK] Seq=15118 Ack=259141 Win=5565 Len=0 TSval=1096412891 TSecr=2678252402"
"5.651844","172.18.0.2","54.38.73.16","TLSv1.2","611","Application Data"
"5.674912","54.38.73.16","172.18.0.2","TLSv1.2","5860","Application Data, Application Data"
"5.674939","172.18.0.2","54.38.73.16","TCP","68","36876 → 21002 [ACK] Seq=15661 Ack=264933 Win=5581 Len=0 TSval=1096412914 TSecr=2678252407"
"5.676759","54.38.73.16","172.18.0.2","TLSv1.2","2964","Application Data [TCP segment of a reassembled PDU]"
"5.676783","172.18.0.2","54.38.73.16","TCP","68","36876 → 21002 [ACK] Seq=15661 Ack=267829 Win=5596 Len=0 TSval=1096412916 TSecr=2678252408"
"5.676970","54.38.73.16","172.18.0.2","TCP","68","[TCP Previous segment not captured] 21002 → 36876 [ACK] Seq=271578 Ack=15661 Win=1452 Len=0 TSval=2678252408 TSecr=1096412891"
"5.676991","54.38.73.16","172.18.0.2","TCP","3817","[TCP Retransmission] 21002 → 36876 [PSH, ACK] Seq=267829 Ack=15118 Win=1452 Len=3749 TSval=2678252408 TSecr=1096412891"
"5.677008","172.18.0.2","54.38.73.16","TCP","68","36876 → 21002 [ACK] Seq=15661 Ack=271578 Win=5576 Len=0 TSval=1096412916 TSecr=2678252408"
"5.707809","54.38.73.16","172.18.0.2","TLSv1.2","3695","Application Data"
"5.707834","172.18.0.2","54.38.73.16","TCP","68","36876 → 21002 [ACK] Seq=15661 Ack=275205 Win=5580 Len=0 TSval=1096412947 TSecr=2678252416"
"5.773093","54.38.73.16","172.18.0.2","TLSv1.2","1125","Application Data"
"5.773118","172.18.0.2","54.38.73.16","TCP","68","36876 → 21002 [ACK] Seq=15661 Ack=276262 Win=5593 Len=0 TSval=1096413013 TSecr=2678252432"
"5.780812","172.18.0.2","54.38.73.16","TLSv1.2","611","Application Data"
"5.842802","54.38.73.16","172.18.0.2","TCP","68","21002 → 36876 [ACK] Seq=276262 Ack=16204 Win=1452 Len=0 TSval=2678252450 TSecr=1096413020"
"6.084944","54.38.73.16","172.18.0.2","TLSv1.2","611","Application Data"
"6.084998","172.18.0.2","54.38.73.16","TCP","68","36876 → 21002 [ACK] Seq=16204 Ack=276805 Win=5608 Len=0 TSval=1096413324 TSecr=2678252501"
"6.085977","172.18.0.2","54.38.73.16","TLSv1.2","611","Application Data"
"6.109653","54.38.73.16","172.18.0.2","TCP","68","21002 → 36876 [ACK] Seq=276805 Ack=16747 Win=1452 Len=0 TSval=2678252516 TSecr=1096413325"
"6.327734","54.38.73.16","172.18.0.2","TLSv1.2","611","Application Data"
"6.361737","54.38.73.16","172.18.0.2","TCP","2964","[TCP segment of a reassembled PDU]"
"6.361762","172.18.0.2","54.38.73.16","TCP","68","36876 → 21002 [ACK] Seq=16747 Ack=280244 Win=5596 Len=0 TSval=1096413601 TSecr=2678252571"
"6.362090","54.38.73.16","172.18.0.2","TLSv1.2","4412","Application Data [TCP segment of a reassembled PDU]"
"6.362188","172.18.0.2","54.38.73.16","TCP","68","36876 → 21002 [ACK] Seq=16747 Ack=284588 Win=5580 Len=0 TSval=1096413602 TSecr=2678252579"
"6.374730","54.38.73.16","172.18.0.2","TLSv1.2","2964","Application Data [TCP segment of a reassembled PDU]"
"6.374755","172.18.0.2","54.38.73.16","TCP","68","36876 → 21002 [ACK] Seq=16747 Ack=287484 Win=5596 Len=0 TSval=1096413614 TSecr=2678252582"
"6.384317","54.38.73.16","172.18.0.2","TLSv1.2","2964","Application Data [TCP segment of a reassembled PDU]"
"6.384341","172.18.0.2","54.38.73.16","TCP","68","36876 → 21002 [ACK] Seq=16747 Ack=290380 Win=5596 Len=0 TSval=1096413624 TSecr=2678252585"
"6.386372","54.38.73.16","172.18.0.2","TLSv1.2","8756","Application Data, Application Data"
"6.386503","172.18.0.2","54.38.73.16","TCP","68","36876 → 21002 [ACK] Seq=16747 Ack=299068 Win=5566 Len=0 TSval=1096413626 TSecr=2678252585"
"6.386511","54.38.73.16","172.18.0.2","TLSv1.2","4765","Application Data, Application Data"
"6.386863","172.18.0.2","54.38.73.16","TCP","68","36876 → 21002 [ACK] Seq=16747 Ack=303765 Win=5530 Len=0 TSval=1096413626 TSecr=2678252585"
"6.387896","172.18.0.2","54.38.73.16","TLSv1.2","611","Application Data"
"6.400226","54.38.73.16","172.18.0.2","TCP","2964","[TCP segment of a reassembled PDU]"
"6.400368","172.18.0.2","54.38.73.16","TCP","68","36876 → 21002 [ACK] Seq=17290 Ack=306661 Win=5596 Len=0 TSval=1096413640 TSecr=2678252589"
"6.408392","54.38.73.16","172.18.0.2","TLSv1.2","2964","Application Data [TCP segment of a reassembled PDU]"
"6.408418","172.18.0.2","54.38.73.16","TCP","68","36876 → 21002 [ACK] Seq=17290 Ack=309557 Win=5596 Len=0 TSval=1096413648 TSecr=2678252591"
"6.410728","54.38.73.16","172.18.0.2","TLSv1.2","2964","Application Data [TCP segment of a reassembled PDU]"
"6.410752","172.18.0.2","54.38.73.16","TCP","68","36876 → 21002 [ACK] Seq=17290 Ack=312453 Win=5596 Len=0 TSval=1096413650 TSecr=2678252592"
"6.411398","54.38.73.16","172.18.0.2","TLSv1.2","11652","Application Data, Application Data, Application Data"
"6.411510","172.18.0.2","54.38.73.16","TCP","68","36876 → 21002 [ACK] Seq=17290 Ack=324037 Win=5551 Len=0 TSval=1096413651 TSecr=2678252592"
"6.412009","54.38.73.16","172.18.0.2","TCP","68","21002 → 36876 [ACK] Seq=324037 Ack=17290 Win=1452 Len=0 TSval=2678252592 TSecr=1096413627"
"6.412032","172.18.0.2","54.38.73.16","TLSv1.2","611","Application Data"
"6.425423","54.38.73.16","172.18.0.2","TLSv1.2","2964","Application Data, Application Data"
"6.425449","172.18.0.2","54.38.73.16","TCP","68","36876 → 21002 [ACK] Seq=17833 Ack=326933 Win=5596 Len=0 TSval=1096413665 TSecr=2678252595"
"6.434234","54.38.73.16","172.18.0.2","TCP","2964","21002 → 36876 [ACK] Seq=326933 Ack=17290 Win=1452 Len=2896 TSval=2678252597 TSecr=1096413648 [TCP segment of a reassembled PDU]"
"6.434260","172.18.0.2","54.38.73.16","TCP","68","36876 → 21002 [ACK] Seq=17833 Ack=329829 Win=5596 Len=0 TSval=1096413674 TSecr=2678252597"
"6.436536","54.38.73.16","172.18.0.2","TLSv1.2","2964","Application Data [TCP segment of a reassembled PDU]"
"6.436561","172.18.0.2","54.38.73.16","TCP","68","36876 → 21002 [ACK] Seq=17833 Ack=332725 Win=5596 Len=0 TSval=1096413676 TSecr=2678252598"
"6.436582","54.38.73.16","172.18.0.2","TLSv1.2","8756","Application Data, Application Data"
"6.436691","172.18.0.2","54.38.73.16","TCP","68","36876 → 21002 [ACK] Seq=17833 Ack=341413 Win=5551 Len=0 TSval=1096413676 TSecr=2678252598"
"6.436746","54.38.73.16","172.18.0.2","TLSv1.2","4974","Application Data, Application Data, Application Data, Application Data"
"6.437237","172.18.0.2","54.38.73.16","TCP","68","36876 → 21002 [ACK] Seq=17833 Ack=346319 Win=5524 Len=0 TSval=1096413677 TSecr=2678252598"
"6.449948","54.38.73.16","172.18.0.2","TCP","2964","[TCP segment of a reassembled PDU]"
"6.449981","172.18.0.2","54.38.73.16","TLSv1.2","611","Application Data"
"6.458123","54.38.73.16","172.18.0.2","TLSv1.2","2964","Application Data, Application Data"
"6.458149","172.18.0.2","54.38.73.16","TCP","68","36876 → 21002 [ACK] Seq=18376 Ack=352111 Win=5596 Len=0 TSval=1096413698 TSecr=2678252603"
"6.462986","54.38.73.16","172.18.0.2","TLSv1.2","1045","Application Data"
"6.503128","172.18.0.2","54.38.73.16","TCP","68","36876 → 21002 [ACK] Seq=18376 Ack=353088 Win=5612 Len=0 TSval=1096413743 TSecr=2678252605"
"6.510785","54.38.73.16","172.18.0.2","TCP","68","21002 → 36876 [ACK] Seq=353088 Ack=18376 Win=1452 Len=0 TSval=2678252617 TSecr=1096413689"
"6.510819","172.18.0.2","54.38.73.16","TLSv1.2","611","Application Data"
"6.574935","54.38.73.16","172.18.0.2","TCP","68","21002 → 36876 [ACK] Seq=353088 Ack=18919 Win=1452 Len=0 TSval=2678252633 TSecr=1096413750"
"7.109086","54.38.73.16","172.18.0.2","TLSv1.2","611","Application Data"
"7.109138","172.18.0.2","54.38.73.16","TCP","68","36876 → 21002 [ACK] Seq=18919 Ack=353631 Win=5608 Len=0 TSval=1096414349 TSecr=2678252705"
"7.109146","54.38.73.16","172.18.0.2","TLSv1.2","611","[TCP Spurious Retransmission] , Application Data"
"7.109166","172.18.0.2","54.38.73.16","TCP","80","[TCP Dup ACK 270#1] 36876 → 21002 [ACK] Seq=18919 Ack=353631 Win=5608 Len=0 TSval=1096414349 TSecr=2678252763 SLE=353088 SRE=353631"
"7.110178","172.18.0.2","54.38.73.16","TLSv1.2","611","Application Data"
"7.133618","54.38.73.16","172.18.0.2","TCP","68","21002 → 36876 [ACK] Seq=353631 Ack=19462 Win=1452 Len=0 TSval=2678252772 TSecr=1096414350"
"7.449469","54.38.73.16","172.18.0.2","TLSv1.2","611","Application Data"
"7.449524","172.18.0.2","54.38.73.16","TCP","68","36876 → 21002 [ACK] Seq=19462 Ack=354174 Win=5608 Len=0 TSval=1096414689 TSecr=2678252851"
"7.470629","54.38.73.16","172.18.0.2","TLSv1.2","7308","Application Data"
"7.470678","172.18.0.2","54.38.73.16","TCP","68","36876 → 21002 [ACK] Seq=19462 Ack=361414 Win=5565 Len=0 TSval=1096414710 TSecr=2678252857"
"7.474077","54.38.73.16","172.18.0.2","TLSv1.2","82","Application Data"
"7.474102","172.18.0.2","54.38.73.16","TCP","68","36876 → 21002 [ACK] Seq=19462 Ack=361428 Win=5609 Len=0 TSval=1096414714 TSecr=2678252858"
"7.474586","172.18.0.2","54.38.73.16","TLSv1.2","611","Application Data"
"7.483564","54.38.73.16","172.18.0.2","TLSv1.2","5860","Application Data"
"7.483589","172.18.0.2","54.38.73.16","TCP","68","36876 → 21002 [ACK] Seq=20005 Ack=367220 Win=5581 Len=0 TSval=1096414723 TSecr=2678252860"
"7.494638","54.38.73.16","172.18.0.2","TCP","1516","21002 → 36876 [ACK] Seq=367220 Ack=19462 Win=1452 Len=1448 TSval=2678252863 TSecr=1096414710 [TCP segment of a reassembled PDU]"
"7.494662","172.18.0.2","54.38.73.16","TCP","68","36876 → 21002 [ACK] Seq=20005 Ack=368668 Win=5593 Len=0 TSval=1096414734 TSecr=2678252863"
"7.496046","54.38.73.16","172.18.0.2","TLSv1.2","7308","Application Data, Application Data, Application Data"
"7.496072","172.18.0.2","54.38.73.16","TCP","68","36876 → 21002 [ACK] Seq=20005 Ack=375908 Win=5565 Len=0 TSval=1096414736 TSecr=2678252863"
"7.496260","54.38.73.16","172.18.0.2","TLSv1.2","4412","Application Data [TCP segment of a reassembled PDU]"
"7.496295","172.18.0.2","54.38.73.16","TCP","68","36876 → 21002 [ACK] Seq=20005 Ack=380252 Win=5534 Len=0 TSval=1096414736 TSecr=2678252863"
"7.499992","54.38.73.16","172.18.0.2","TLSv1.2","436","Application Data"
"7.500016","172.18.0.2","54.38.73.16","TCP","68","36876 → 21002 [ACK] Seq=20005 Ack=380620 Win=5593 Len=0 TSval=1096414739 TSecr=2678252863"
"7.500037","54.38.73.16","172.18.0.2","TCP","68","21002 → 36876 [ACK] Seq=380620 Ack=20005 Win=1452 Len=0 TSval=2678252864 TSecr=1096414714"
"7.500480","172.18.0.2","54.38.73.16","TLSv1.2","611","Application Data"
"7.520275","54.38.73.16","172.18.0.2","TCP","1516","[TCP segment of a reassembled PDU]"
"7.523595","54.38.73.16","172.18.0.2","TLSv1.2","191","Application Data"
"7.523737","172.18.0.2","54.38.73.16","TCP","68","36876 → 21002 [ACK] Seq=20548 Ack=382191 Win=5612 Len=0 TSval=1096414763 TSecr=2678252869"
"7.561962","54.38.73.16","172.18.0.2","TCP","68","21002 → 36876 [ACK] Seq=382191 Ack=20548 Win=1452 Len=0 TSval=2678252880 TSecr=1096414740"
"7.561994","172.18.0.2","54.38.73.16","TLSv1.2","611","Application Data"
"7.586425","54.38.73.16","172.18.0.2","TCP","68","21002 → 36876 [ACK] Seq=382191 Ack=21091 Win=1452 Len=0 TSval=2678252886 TSecr=1096414801"
