_ws.col.Time,_ws.col.Source,_ws.col.Destination,_ws.col.Protocol,_ws.col.Length,_ws.col.Info
"0.000000","172.18.0.2","54.38.73.16","TLSv1.2","611","Application Data"
"0.028368","54.38.73.16","172.18.0.2","TCP","68","21002 → 36876 [ACK] Seq=1 Ack=544 Win=1452 Len=0 TSval=2670072895 TSecr=1063695076"
"1.193171","54.38.73.16","172.18.0.2","TLSv1.2","611","Application Data"
"1.193215","172.18.0.2","54.38.73.16","TCP","68","36876 → 21002 [ACK] Seq=544 Ack=544 Win=5608 Len=0 TSval=1063696270 TSecr=2670073135"
"1.194418","172.18.0.2","54.38.73.16","TCP","1516","[TCP segment of a reassembled PDU]"
"1.194502","172.18.0.2","54.38.73.16","TLSv1.2","705","Application Data"
"1.218323","54.38.73.16","172.18.0.2","TCP","68","21002 → 36876 [ACK] Seq=544 Ack=2629 Win=1448 Len=0 TSval=2670073193 TSecr=1063696271"
"1.808752","54.38.73.16","172.18.0.2","TLSv1.2","611","Application Data"
"1.808787","172.18.0.2","54.38.73.16","TCP","68","36876 → 21002 [ACK] Seq=2629 Ack=1087 Win=5608 Len=0 TSval=1063696885 TSecr=2670073315"
"1.867428","54.38.73.16","172.18.0.2","TLSv1.2","1125","Application Data"
"1.867457","172.18.0.2","54.38.73.16","TCP","68","36876 → 21002 [ACK] Seq=2629 Ack=2144 Win=5600 Len=0 TSval=1063696944 TSecr=2670073355"
"1.874867","172.18.0.2","54.38.73.16","TLSv1.2","611","Application Data"
"1.900456","54.38.73.16","172.18.0.2","TCP","68","21002 → 36876 [ACK] Seq=2144 Ack=3172 Win=1452 Len=0 TSval=2670073363 TSecr=1063696951"
"2.422659","54.38.73.16","172.18.0.2","TLSv1.2","611","Application Data"
"2.422697","172.18.0.2","54.38.73.16","TCP","68","36876 → 21002 [ACK] Seq=3172 Ack=2687 Win=5608 Len=0 TSval=1063697499 TSecr=2670073468"
"2.423523","172.18.0.2","54.38.73.16","TLSv1.2","611","Application Data"
"2.446806","54.38.73.16","172.18.0.2","TCP","68","21002 → 36876 [ACK] Seq=2687 Ack=3715 Win=1452 Len=0 TSval=2670073500 TSecr=1063697500"
"3.037122","54.38.73.16","172.18.0.2","TLSv1.2","611","Application Data"
"3.037327","54.38.73.16","172.18.0.2","TLSv1.2","5860","Application Data"
"3.037338","54.38.73.16","172.18.0.2","TCP","1516","21002 → 36876 [ACK] Seq=9022 Ack=3715 Win=1452 Len=1448 TSval=2670073633 TSecr=1063697500 [TCP segment of a reassembled PDU]"
"3.037407","172.18.0.2","54.38.73.16","TCP","68","36876 → 21002 [ACK] Seq=3715 Ack=10470 Win=5564 Len=0 TSval=1063698114 TSecr=2670073625"
"3.037868","172.18.0.2","54.38.73.16","TLSv1.2","611","Application Data"
"3.061492","54.38.73.16","172.18.0.2","TLSv1.2","625","Application Data, Application Data"
"3.061620","54.38.73.16","172.18.0.2","TCP","68","21002 → 36876 [ACK] Seq=11027 Ack=4258 Win=1452 Len=0 TSval=2670073654 TSecr=1063698114"
"3.084579","54.38.73.16","172.18.0.2","TCP","2964","[TCP segment of a reassembled PDU]"
"3.084612","172.18.0.2","54.38.73.16","TCP","68","36876 → 21002 [ACK] Seq=4258 Ack=13923 Win=5595 Len=0 TSval=1063698161 TSecr=2670073653"
"3.106362","54.38.73.16","172.18.0.2","TLSv1.2","5860","Application Data, Application Data, Application Data"
"3.106488","172.18.0.2","54.38.73.16","TCP","68","36876 → 21002 [ACK] Seq=4258 Ack=19715 Win=5580 Len=0 TSval=1063698183 TSecr=2670073664"
"3.109499","54.38.73.16","172.18.0.2","TCP","2964","21002 → 36876 [ACK] Seq=19715 Ack=4258 Win=1452 Len=2896 TSval=2670073665 TSecr=1063698161 [TCP segment of a reassembled PDU]"
"3.109522","172.18.0.2","54.38.73.16","TCP","68","36876 → 21002 [ACK] Seq=4258 Ack=22611 Win=5595 Len=0 TSval=1063698186 TSecr=2670073665"
"3.116348","54.38.73.16","172.18.0.2","TLSv1.2","1516","Application Data, Application Data"
"3.131237","54.38.73.16","172.18.0.2","TLSv1.2","4412","Application Data [TCP segment of a reassembled PDU]"
"3.131354","172.18.0.2","54.38.73.16","TCP","68","36876 → 21002 [ACK] Seq=4258 Ack=28403 Win=5579 Len=0 TSval=1063698208 TSecr=2670073667"
"3.133015","54.38.73.16","172.18.0.2","TLSv1.2","2964","Application Data [TCP segment of a reassembled PDU]"
"3.133033","172.18.0.2","54.38.73.16","TCP","68","36876 → 21002 [ACK] Seq=4258 Ack=31299 Win=5595 Len=0 TSval=1063698209 TSecr=2670073671"
"3.133296","172.18.0.2","54.38.73.16","TLSv1.2","611","Application Data"
"3.154645","54.38.73.16","172.18.0.2","TLSv1.2","2673","Application Data, Application Data"
"3.154662","172.18.0.2","54.38.73.16","TCP","68","36876 → 21002 [ACK] Seq=4801 Ack=33904 Win=5596 Len=0 TSval=1063698231 TSecr=2670073677"
"3.157401","54.38.73.16","172.18.0.2","TLSv1.2","5860","Application Data"
"3.157422","54.38.73.16","172.18.0.2","TCP","1516","21002 → 36876 [ACK] Seq=39696 Ack=4258 Win=1452 Len=1448 TSval=2670073677 TSecr=1063698209 [TCP segment of a reassembled PDU]"
"3.157489","172.18.0.2","54.38.73.16","TCP","68","36876 → 21002 [ACK] Seq=4801 Ack=41144 Win=5564 Len=0 TSval=1063698234 TSecr=2670073677"
"3.179189","54.38.73.16","172.18.0.2","TLSv1.2","596","Application Data"
"3.201506","54.38.73.16","172.18.0.2","TCP","2964","[TCP segment of a reassembled PDU]"
"3.201531","172.18.0.2","54.38.73.16","TCP","68","36876 → 21002 [ACK] Seq=4801 Ack=44568 Win=5595 Len=0 TSval=1063698278 TSecr=2670073683"
"3.212804","54.38.73.16","172.18.0.2","TLSv1.2","7308","Application Data, Application Data"
"3.212944","172.18.0.2","54.38.73.16","TCP","68","36876 → 21002 [ACK] Seq=4801 Ack=51808 Win=5564 Len=0 TSval=1063698289 TSecr=2670073691"
"3.226111","54.38.73.16","172.18.0.2","TLSv1.2","2964","Application Data [TCP segment of a reassembled PDU]"
"3.226136","172.18.0.2","54.38.73.16","TCP","68","36876 → 21002 [ACK] Seq=4801 Ack=54704 Win=5595 Len=0 TSval=1063698302 TSecr=2670073695"
"3.235036","54.38.73.16","172.18.0.2","TCP","1516","21002 → 36876 [ACK] Seq=54704 Ack=4801 Win=1452 Len=1448 TSval=2670073697 TSecr=1063698278 [TCP segment of a reassembled PDU]"
"3.237167","54.38.73.16","172.18.0.2","TLSv1.2","7308","Application Data, Application Data, Application Data"
"3.237297","172.18.0.2","54.38.73.16","TCP","68","36876 → 21002 [ACK] Seq=4801 Ack=63392 Win=5564 Len=0 TSval=1063698314 TSecr=2670073697"
"3.237843","172.18.0.2","54.38.73.16","TLSv1.2","1125","Application Data"
"3.250320","54.38.73.16","172.18.0.2","TLSv1.2","139","Application Data"
"3.294269","172.18.0.2","54.38.73.16","TCP","68","36876 → 21002 [ACK] Seq=5858 Ack=63463 Win=5612 Len=0 TSval=1063698371 TSecr=2670073701"
"3.302457","54.38.73.16","172.18.0.2","TCP","68","21002 → 36876 [ACK] Seq=63463 Ack=5858 Win=1452 Len=0 TSval=2670073714 TSecr=1063698314"
"3.302486","172.18.0.2","54.38.73.16","TLSv1.2","611","Application Data"
"3.325989","54.38.73.16","172.18.0.2","TCP","68","21002 → 36876 [ACK] Seq=63463 Ack=6401 Win=1452 Len=0 TSval=2670073720 TSecr=1063698379"
"3.959767","54.38.73.16","172.18.0.2","TLSv1.2","611","Application Data"
"3.959828","172.18.0.2","54.38.73.16","TCP","68","36876 → 21002 [ACK] Seq=6401 Ack=64006 Win=5608 Len=0 TSval=1063699036 TSecr=2670073851"
"3.960704","172.18.0.2","54.38.73.16","TLSv1.2","611","Application Data"
"3.985679","54.38.73.16","172.18.0.2","TCP","68","21002 → 36876 [ACK] Seq=64006 Ack=6944 Win=1452 Len=0 TSval=2670073884 TSecr=1063699037"
"4.573195","54.38.73.16","172.18.0.2","TLSv1.2","611","Application Data"
"4.573245","172.18.0.2","54.38.73.16","TCP","68","36876 → 21002 [ACK] Seq=6944 Ack=64549 Win=5608 Len=0 TSval=1063699650 TSecr=2670074011"
"4.574183","54.38.73.16","172.18.0.2","TCP","2964","[TCP segment of a reassembled PDU]"
"4.574205","172.18.0.2","54.38.73.16","TCP","68","36876 → 21002 [ACK] Seq=6944 Ack=67445 Win=5595 Len=0 TSval=1063699651 TSecr=2670074017"
"4.574224","54.38.73.16","172.18.0.2","TLSv1.2","4412","Application Data [TCP segment of a reassembled PDU]"
"4.574242","172.18.0.2","54.38.73.16","TCP","68","36876 → 21002 [ACK] Seq=6944 Ack=71789 Win=5563 Len=0 TSval=1063699651 TSecr=2670074020"
"4.597606","54.38.73.16","172.18.0.2","TLSv1.2","625","Application Data, Application Data"
"4.597631","172.18.0.2","54.38.73.16","TCP","68","36876 → 21002 [ACK] Seq=6944 Ack=72346 Win=5593 Len=0 TSval=1063699674 TSecr=2670074037"
"4.613325","54.38.73.16","172.18.0.2","TCP","2964","[TCP segment of a reassembled PDU]"
"4.613350","172.18.0.2","54.38.73.16","TCP","68","36876 → 21002 [ACK] Seq=6944 Ack=75242 Win=5595 Len=0 TSval=1063699690 TSecr=2670074041"
"4.623783","54.38.73.16","172.18.0.2","TLSv1.2","799","Application Data"
"4.623807","172.18.0.2","54.38.73.16","TCP","68","36876 → 21002 [ACK] Seq=6944 Ack=75973 Win=5593 Len=0 TSval=1063699700 TSecr=2670074044"
"4.624426","54.38.73.16","172.18.0.2","TLSv1.2","7308","Application Data"
"4.624451","172.18.0.2","54.38.73.16","TCP","68","36876 → 21002 [ACK] Seq=6944 Ack=83213 Win=5564 Len=0 TSval=1063699701 TSecr=2670074044"
"4.636628","54.38.73.16","172.18.0.2","TLSv1.2","1516","Application Data, Application Data"
"4.636653","172.18.0.2","54.38.73.16","TCP","68","36876 → 21002 [ACK] Seq=6944 Ack=84661 Win=5593 Len=0 TSval=1063699713 TSecr=2670074047"
"4.638591","54.38.73.16","172.18.0.2","TCP","2964","21002 → 36876 [ACK] Seq=84661 Ack=6944 Win=1452 Len=2896 TSval=2670074048 TSecr=1063699690 [TCP segment of a reassembled PDU]"
"4.638616","172.18.0.2","54.38.73.16","TCP","68","36876 → 21002 [ACK] Seq=6944 Ack=87557 Win=5595 Len=0 TSval=1063699715 TSecr=2670074048"
"4.650365","54.38.73.16","172.18.0.2","TLSv1.2","8733","Application Data, Application Data, Application Data, Application Data"
"4.650389","172.18.0.2","54.38.73.16","TCP","68","36876 → 21002 [ACK] Seq=6944 Ack=96222 Win=5565 Len=0 TSval=1063699727 TSecr=2670074050"
"4.651322","172.18.0.2","54.38.73.16","TLSv1.2","611","Application Data"
"4.676327","54.38.73.16","172.18.0.2","TCP","68","21002 → 36876 [ACK] Seq=96222 Ack=7487 Win=1452 Len=0 TSval=2670074057 TSecr=1063699728"
"4.734284","54.38.73.16","172.18.0.2","TLSv1.2","3695","Application Data"
"4.734312","172.18.0.2","54.38.73.16","TCP","68","36876 → 21002 [ACK] Seq=7487 Ack=99849 Win=5579 Len=0 TSval=1063699811 TSecr=2670074071"
"4.756087","54.38.73.16","172.18.0.2","TCP","2964","[TCP segment of a reassembled PDU]"
"4.756115","172.18.0.2","54.38.73.16","TCP","68","36876 → 21002 [ACK] Seq=7487 Ack=102745 Win=5595 Len=0 TSval=1063699832 TSecr=2670074077"
"4.758940","54.38.73.16","172.18.0.2","TLSv1.2","799","Application Data"
"4.758968","172.18.0.2","54.38.73.16","TCP","68","36876 → 21002 [ACK] Seq=7487 Ack=103476 Win=5593 Len=0 TSval=1063699835 TSecr=2670074078"
"4.765960","172.18.0.2","54.38.73.16","TLSv1.2","611","Application Data"
"4.791426","54.38.73.16","172.18.0.2","TCP","68","21002 → 36876 [ACK] Seq=103476 Ack=8030 Win=1452 Len=0 TSval=2670074086 TSecr=1063699842"
"5.495588","54.38.73.16","172.18.0.2","TLSv1.2","611","Application Data"
"5.496599","172.18.0.2","54.38.73.16","TLSv1.2","611","Application Data"
"5.521461","54.38.73.16","172.18.0.2","TCP","68","21002 → 36876 [ACK] Seq=104019 Ack=8573 Win=1452 Len=0 TSval=2670074268 TSecr=1063700573"
"6.416443","54.38.73.16","172.18.0.2","TLSv1.2","611","Application Data"
"6.416667","54.38.73.16","172.18.0.2","TCP","2964","[TCP segment of a reassembled PDU]"
"6.416683","54.38.73.16","172.18.0.2","TLSv1.2","4412","Application Data [TCP segment of a reassembled PDU]"
"6.416778","172.18.0.2","54.38.73.16","TCP","68","36876 → 21002 [ACK] Seq=8573 Ack=111802 Win=5563 Len=0 TSval=1063701493 TSecr=2670074473"
"6.433428","54.38.73.16","172.18.0.2","TLSv1.2","2964","Application Data, Application Data"
"6.433452","172.18.0.2","54.38.73.16","TCP","68","36876 → 21002 [ACK] Seq=8573 Ack=114698 Win=5595 Len=0 TSval=1063701510 TSecr=2670074496"
"6.433933","172.18.0.2","54.38.73.16","TLSv1.2","611","Application Data"
"6.441716","54.38.73.16","172.18.0.2","TLSv1.2","1356","Application Data"
"6.443030","54.38.73.16","172.18.0.2","TLSv1.2","7308","Application Data"
"6.443169","172.18.0.2","54.38.73.16","TCP","68","36876 → 21002 [ACK] Seq=9116 Ack=123226 Win=5564 Len=0 TSval=1063701520 TSecr=2670074498"
"6.452993","54.38.73.16","172.18.0.2","TLSv1.2","1516","Application Data [TCP segment of a reassembled PDU]"
"6.458463","54.38.73.16","172.18.0.2","TCP","68","[TCP Previous segment not captured] 21002 → 36876 [ACK] Seq=127570 Ack=9116 Win=1452 Len=0 TSval=2670074502 TSecr=1063701510"
"6.458485","54.38.73.16","172.18.0.2","TCP","2964","[TCP Retransmission] 21002 → 36876 [ACK] Seq=124674 Ack=8573 Win=1452 Len=2896 TSval=2670074502 TSecr=1063701510"
"6.458532","172.18.0.2","54.38.73.16","TCP","68","36876 → 21002 [ACK] Seq=9116 Ack=127570 Win=5595 Len=0 TSval=1063701535 TSecr=2670074501"
"6.468140","54.38.73.16","172.18.0.2","TCP","4020","21002 → 36876 [PSH, ACK] Seq=127570 Ack=9116 Win=1452 Len=3952 TSval=2670074505 TSecr=1063701520 [TCP segment of a reassembled PDU], Application Data"
"6.468274","172.18.0.2","54.38.73.16","TCP","68","36876 → 21002 [ACK] Seq=9116 Ack=131522 Win=5579 Len=0 TSval=1063701545 TSecr=2670074505"
"6.469052","172.18.0.2","54.38.73.16","TLSv1.2","611","Application Data"
"6.474276","54.38.73.16","172.18.0.2","TCP","2964","[TCP segment of a reassembled PDU]"
"6.474426","172.18.0.2","54.38.73.16","TCP","68","36876 → 21002 [ACK] Seq=9659 Ack=134418 Win=5595 Len=0 TSval=1063701551 TSecr=2670074506"
"6.485084","54.38.73.16","172.18.0.2","TLSv1.2","1516","Application Data [TCP segment of a reassembled PDU]"
"6.485299","54.38.73.16","172.18.0.2","TLSv1.2","2964","Application Data [TCP segment of a reassembled PDU]"
"6.485494","172.18.0.2","54.38.73.16","TCP","68","36876 → 21002 [ACK] Seq=9659 Ack=138762 Win=5576 Len=0 TSval=1063701562 TSecr=2670074509"
"6.494449","54.38.73.16","172.18.0.2","TLSv1.2","1139","Application Data"
"6.534488","54.38.73.16","172.18.0.2","TCP","68","21002 → 36876 [ACK] Seq=139833 Ack=9659 Win=1452 Len=0 TSval=2670074522 TSecr=1063701545"
"6.538330","172.18.0.2","54.38.73.16","TCP","68","36876 → 21002 [ACK] Seq=9659 Ack=139833 Win=5612 Len=0 TSval=1063701615 TSecr=2670074511"
"6.549289","54.38.73.16","172.18.0.2","TCP","2964","[TCP segment of a reassembled PDU]"
"6.549338","172.18.0.2","54.38.73.16","TCP","68","36876 → 21002 [ACK] Seq=9659 Ack=142729 Win=5590 Len=0 TSval=1063701626 TSecr=2670074525"
"6.558580","54.38.73.16","172.18.0.2","TLSv1.2","4412","Application Data [TCP segment of a reassembled PDU]"
"6.558608","172.18.0.2","54.38.73.16","TCP","68","36876 → 21002 [ACK] Seq=9659 Ack=147073 Win=5579 Len=0 TSval=1063701635 TSecr=2670074528"
"6.558785","54.38.73.16","172.18.0.2","TLSv1.2","4412","Application Data [TCP segment of a reassembled PDU]"
"6.558810","172.18.0.2","54.38.73.16","TCP","68","36876 → 21002 [ACK] Seq=9659 Ack=151417 Win=5547 Len=0 TSval=1063701635 TSecr=2670074528"
"6.570400","54.38.73.16","172.18.0.2","TLSv1.2","1516","Application Data [TCP segment of a reassembled PDU]"
"6.570425","172.18.0.2","54.38.73.16","TCP","68","36876 → 21002 [ACK] Seq=9659 Ack=152865 Win=5593 Len=0 TSval=1063701647 TSecr=2670074530"
"6.573188","54.38.73.16","172.18.0.2","TCP","1516","21002 → 36876 [ACK] Seq=152865 Ack=9659 Win=1452 Len=1448 TSval=2670074531 TSecr=1063701626 [TCP segment of a reassembled PDU]"
"6.573211","172.18.0.2","54.38.73.16","TCP","68","36876 → 21002 [ACK] Seq=9659 Ack=154313 Win=5593 Len=0 TSval=1063701650 TSecr=2670074531"
"6.579516","54.38.73.16","172.18.0.2","TLSv1.2","1516","Application Data [TCP segment of a reassembled PDU]"
"6.579540","172.18.0.2","54.38.73.16","TCP","68","36876 → 21002 [ACK] Seq=9659 Ack=155761 Win=5593 Len=0 TSval=1063701656 TSecr=2670074533"
"6.583385","54.38.73.16","172.18.0.2","TLSv1.2","7308","Application Data, Application Data"
"6.583521","172.18.0.2","54.38.73.16","TCP","68","36876 → 21002 [ACK] Seq=9659 Ack=163001 Win=5564 Len=0 TSval=1063701660 TSecr=2670074534"
"6.583996","172.18.0.2","54.38.73.16","TLSv1.2","611","Application Data"
"6.594971","54.38.73.16","172.18.0.2","TLSv1.2","2964","Application Data, Application Data"
"6.594995","172.18.0.2","54.38.73.16","TCP","68","36876 → 21002 [ACK] Seq=10202 Ack=165897 Win=5595 Len=0 TSval=1063701671 TSecr=2670074537"
"6.597165","54.38.73.16","172.18.0.2","TLSv1.2","2964","Application Data [TCP segment of a reassembled PDU]"
"6.597190","172.18.0.2","54.38.73.16","TCP","68","36876 → 21002 [ACK] Seq=10202 Ack=168793 Win=5595 Len=0 TSval=1063701674 TSecr=2670074537"
"6.603149","54.38.73.16","172.18.0.2","TCP","2964","21002 → 36876 [ACK] Seq=168793 Ack=9659 Win=1452 Len=2896 TSval=2670074539 TSecr=1063701656 [TCP segment of a reassembled PDU]"
"6.603173","172.18.0.2","54.38.73.16","TCP","68","36876 → 21002 [ACK] Seq=10202 Ack=171689 Win=5595 Len=0 TSval=1063701680 TSecr=2670074539"
"6.607454","54.38.73.16","172.18.0.2","TLSv1.2","3997","Application Data, Application Data"
"6.607588","172.18.0.2","54.38.73.16","TCP","68","36876 → 21002 [ACK] Seq=10202 Ack=175618 Win=5579 Len=0 TSval=1063701684 TSecr=2670074540"
"6.646154","54.38.73.16","172.18.0.2","TCP","68","21002 → 36876 [ACK] Seq=175618 Ack=10202 Win=1452 Len=0 TSval=2670074550 TSecr=1063701660"
"6.646199","172.18.0.2","54.38.73.16","TLSv1.2","1154","Application Data, Application Data"
"6.706946","54.38.73.16","172.18.0.2","TCP","68","21002 → 36876 [ACK] Seq=175618 Ack=11288 Win=1452 Len=0 TSval=2670074565 TSecr=1063701723"
"7.646024","54.38.73.16","172.18.0.2","TLSv1.2","611","Application Data"
"7.646076","172.18.0.2","54.38.73.16","TCP","68","36876 → 21002 [ACK] Seq=11288 Ack=176161 Win=5608 Len=0 TSval=1063702722 TSecr=2670074749"
"7.647128","172.18.0.2","54.38.73.16","TLSv1.2","611","Application Data"
"7.671831","54.38.73.16","172.18.0.2","TCP","68","21002 → 36876 [ACK] Seq=176161 Ack=11831 Win=1452 Len=0 TSval=2670074806 TSecr=1063702723"
"8.874753","54.38.73.16","172.18.0.2","TLSv1.2","611","Application Data"
"8.874801","172.18.0.2","54.38.73.16","TCP","68","36876 → 21002 [ACK] Seq=11831 Ack=176704 Win=5608 Len=0 TSval=1063703951 TSecr=2670075031"
"8.874808","54.38.73.16","172.18.0.2","TCP","2964","[TCP segment of a reassembled PDU]"
"8.874827","172.18.0.2","54.38.73.16","TCP","68","36876 → 21002 [ACK] Seq=11831 Ack=179600 Win=5586 Len=0 TSval=1063703951 TSecr=2670075037"
"8.874830","54.38.73.16","172.18.0.2","TLSv1.2","2964","Application Data [TCP segment of a reassembled PDU]"
"8.874838","172.18.0.2","54.38.73.16","TCP","68","36876 → 21002 [ACK] Seq=11831 Ack=182496 Win=5564 Len=0 TSval=1063703951 TSecr=2670075039"
"8.875100","54.38.73.16","172.18.0.2","TLSv1.2","1516","Application Data [TCP segment of a reassembled PDU]"
"8.875120","172.18.0.2","54.38.73.16","TCP","68","36876 → 21002 [ACK] Seq=11831 Ack=183944 Win=5586 Len=0 TSval=1063703951 TSecr=2670075042"
"8.875125","54.38.73.16","172.18.0.2","TLSv1.2","2964","Application Data [TCP segment of a reassembled PDU]"
"8.875134","172.18.0.2","54.38.73.16","TCP","68","36876 → 21002 [ACK] Seq=11831 Ack=186840 Win=5570 Len=0 TSval=1063703951 TSecr=2670075061"
"8.875137","54.38.73.16","172.18.0.2","TLSv1.2","1516","Application Data [TCP segment of a reassembled PDU]"
"8.875146","172.18.0.2","54.38.73.16","TCP","68","36876 → 21002 [ACK] Seq=11831 Ack=188288 Win=5561 Len=0 TSval=1063703952 TSecr=2670075063"
"8.875148","54.38.73.16","172.18.0.2","TLSv1.2","1516","Application Data [TCP segment of a reassembled PDU]"
"8.875158","172.18.0.2","54.38.73.16","TCP","68","36876 → 21002 [ACK] Seq=11831 Ack=189736 Win=5552 Len=0 TSval=1063703952 TSecr=2670075068"
"8.875160","54.38.73.16","172.18.0.2","TCP","1516","21002 → 36876 [ACK] Seq=189736 Ack=11831 Win=1452 Len=1448 TSval=2670075096 TSecr=1063702723 [TCP segment of a reassembled PDU]"
"8.875171","172.18.0.2","54.38.73.16","TCP","68","36876 → 21002 [ACK] Seq=11831 Ack=191184 Win=5543 Len=0 TSval=1063703952 TSecr=2670075096"
"8.901240","54.38.73.16","172.18.0.2","TLSv1.2","668","Application Data"
"8.901261","172.18.0.2","54.38.73.16","TCP","68","36876 → 21002 [ACK] Seq=11831 Ack=191784 Win=5593 Len=0 TSval=1063703978 TSecr=2670075113"
"8.907812","172.18.0.2","54.38.73.16","TLSv1.2","611","Application Data"
"8.933519","54.38.73.16","172.18.0.2","TCP","68","21002 → 36876 [ACK] Seq=191784 Ack=12374 Win=1452 Len=0 TSval=2670075121 TSecr=1063703984"
"9.796331","54.38.73.16","172.18.0.2","TLSv1.2","611","Application Data"
"9.797171","172.18.0.2","54.38.73.16","TLSv1.2","611","Application Data"
"9.821450","54.38.73.16","172.18.0.2","TCP","68","21002 → 36876 [ACK] Seq=192327 Ack=12917 Win=1452 Len=0 TSval=2670075343 TSecr=1063704874"
"10.410144","54.38.73.16","172.18.0.2","TLSv1.2","611","Application Data"
"10.410396","54.38.73.16","172.18.0.2","TCP","2964","[TCP segment of a reassembled PDU]"
"10.410412","54.38.73.16","172.18.0.2","TLSv1.2","4412","Application Data [TCP segment of a reassembled PDU]"
"10.410495","172.18.0.2","54.38.73.16","TCP","68","36876 → 21002 [ACK] Seq=12917 Ack=200110 Win=5563 Len=0 TSval=1063705487 TSecr=2670075466"
"10.434282","54.38.73.16","172.18.0.2","TLSv1.2","625","Application Data, Application Data"
"10.444551","54.38.73.16","172.18.0.2","TCP","2964","[TCP segment of a reassembled PDU]"
"10.444575","172.18.0.2","54.38.73.16","TCP","68","36876 → 21002 [ACK] Seq=12917 Ack=203563 Win=5595 Len=0 TSval=1063705521 TSecr=2670075497"
"10.452306","54.38.73.16","172.18.0.2","TLSv1.2","7308","Application Data, Application Data"
"10.452441","172.18.0.2","54.38.73.16","TCP","68","36876 → 21002 [ACK] Seq=12917 Ack=210803 Win=5564 Len=0 TSval=1063705529 TSecr=2670075501"
"10.462557","54.38.73.16","172.18.0.2","TLSv1.2","4412","Application Data [TCP segment of a reassembled PDU]"
"10.462584","172.18.0.2","54.38.73.16","TCP","68","36876 → 21002 [ACK] Seq=12917 Ack=215147 Win=5579 Len=0 TSval=1063705539 TSecr=2670075504"
"10.470298","54.38.73.16","172.18.0.2","TLSv1.2","2964","Application Data [TCP segment of a reassembled PDU]"
"10.470324","172.18.0.2","54.38.73.16","TCP","68","36876 → 21002 [ACK] Seq=12917 Ack=218043 Win=5595 Len=0 TSval=1063705547 TSecr=2670075505"
"10.470801","172.18.0.2","54.38.73.16","TLSv1.2","611","Application Data"
"10.474467","54.38.73.16","172.18.0.2","TCP","1516","21002 → 36876 [ACK] Seq=218043 Ack=12917 Win=1452 Len=1448 TSval=2670075506 TSecr=1063705521 [TCP segment of a reassembled PDU]"
"10.481107","54.38.73.16","172.18.0.2","TLSv1.2","4577","Application Data, Application Data, Application Data"
"10.481248","172.18.0.2","54.38.73.16","TCP","68","36876 → 21002 [ACK] Seq=13460 Ack=224000 Win=5585 Len=0 TSval=1063705558 TSecr=2670075506"
"10.494386","54.38.73.16","172.18.0.2","TCP","68","21002 → 36876 [ACK] Seq=224000 Ack=13460 Win=1452 Len=0 TSval=2670075512 TSecr=1063705547"
"10.494418","172.18.0.2","54.38.73.16","TLSv1.2","611","Application Data"
"10.522074","54.38.73.16","172.18.0.2","TCP","68","21002 → 36876 [ACK] Seq=224000 Ack=14003 Win=1452 Len=0 TSval=2670075518 TSecr=1063705571"
"10.561267","54.38.73.16","172.18.0.2","TLSv1.2","3695","Application Data"
"10.561409","172.18.0.2","54.38.73.16","TCP","68","36876 → 21002 [ACK] Seq=14003 Ack=227627 Win=5584 Len=0 TSval=1063705638 TSecr=2670075528"
"10.587460","54.38.73.16","172.18.0.2","TLSv1.2","611","Application Data"
"10.604979","54.38.73.16","172.18.0.2","TCP","1516","[TCP segment of a reassembled PDU]"
"10.605004","172.18.0.2","54.38.73.16","TCP","68","36876 → 21002 [ACK] Seq=14003 Ack=229618 Win=5593 Len=0 TSval=1063705681 TSecr=2670075535"
"10.629535","54.38.73.16","172.18.0.2","TLSv1.2","1219","Application Data"
"10.636531","172.18.0.2","54.38.73.16","TLSv1.2","611","Application Data"
"10.701868","54.38.73.16","172.18.0.2","TCP","68","21002 → 36876 [ACK] Seq=230769 Ack=14546 Win=1452 Len=0 TSval=2670075564 TSecr=1063705713"
"11.333204","54.38.73.16","172.18.0.2","TLSv1.2","611","Application Data"
"11.334313","172.18.0.2","54.38.73.16","TLSv1.2","611","Application Data"
"11.359024","54.38.73.16","172.18.0.2","TCP","68","21002 → 36876 [ACK] Seq=231312 Ack=15089 Win=1452 Len=0 TSval=2670075727 TSecr=1063706411"
"11.900995","54.38.73.16","172.18.0.2","TLSv1.2","611","Application Data"
"11.942366","172.18.0.2","54.38.73.16","TCP","68","36876 → 21002 [ACK] Seq=15089 Ack=231855 Win=5612 Len=0 TSval=1063707019 TSecr=2670075863"
"11.980544","54.38.73.16","172.18.0.2","TLSv1.2","3695","Application Data"
"11.980590","172.18.0.2","54.38.73.16","TCP","68","36876 → 21002 [ACK] Seq=15089 Ack=235482 Win=5584 Len=0 TSval=1063707057 TSecr=2670075883"
"12.036977","54.38.73.16","172.18.0.2","TLSv1.2","3181","Application Data"
"12.037002","172.18.0.2","54.38.73.16","TCP","68","36876 → 21002 [ACK] Seq=15089 Ack=238595 Win=5579 Len=0 TSval=1063707113 TSecr=2670075897"
"12.046081","54.38.73.16","172.18.0.2","TCP","2964","[TCP segment of a reassembled PDU]"
"12.046107","172.18.0.2","54.38.73.16","TCP","68","36876 → 21002 [ACK] Seq=15089 Ack=241491 Win=5595 Len=0 TSval=1063707122 TSecr=2670075900"
"12.061641","54.38.73.16","172.18.0.2","TLSv1.2","799","Application Data"
"12.061664","172.18.0.2","54.38.73.16","TCP","68","36876 → 21002 [ACK] Seq=15089 Ack=242222 Win=5593 Len=0 TSval=1063707138 TSecr=2670075903"
"12.068764","54.38.73.16","172.18.0.2","TCP","1516","[TCP segment of a reassembled PDU]"
"12.068787","172.18.0.2","54.38.73.16","TCP","68","36876 → 21002 [ACK] Seq=15089 Ack=243670 Win=5593 Len=0 TSval=1063707145 TSecr=2670075905"
"12.086641","54.38.73.16","172.18.0.2","TLSv1.2","191","Application Data"
"12.086665","172.18.0.2","54.38.73.16","TCP","68","36876 → 21002 [ACK] Seq=15089 Ack=243793 Win=5593 Len=0 TSval=1063707163 TSecr=2670075910"
"12.103245","54.38.73.16","172.18.0.2","TCP","2964","[TCP segment of a reassembled PDU]"
"12.103269","172.18.0.2","54.38.73.16","TCP","68","36876 → 21002 [ACK] Seq=15089 Ack=246689 Win=5595 Len=0 TSval=1063707180 TSecr=2670075914"
"12.111171","54.38.73.16","172.18.0.2","TLSv1.2","285","Application Data"
"12.111196","172.18.0.2","54.38.73.16","TCP","68","36876 → 21002 [ACK] Seq=15089 Ack=246906 Win=5594 Len=0 TSval=1063707188 TSecr=2670075916"
"12.115598","54.38.73.16","172.18.0.2","TCP","1516","[TCP segment of a reassembled PDU]"
"12.115624","172.18.0.2","54.38.73.16","TCP","68","36876 → 21002 [ACK] Seq=15089 Ack=248354 Win=5593 Len=0 TSval=1063707192 TSecr=2670075917"
"12.127928","54.38.73.16","172.18.0.2","TLSv1.2","2964","Application Data [TCP segment of a reassembled PDU]"
"12.127958","172.18.0.2","54.38.73.16","TCP","68","36876 → 21002 [ACK] Seq=15089 Ack=251250 Win=5595 Len=0 TSval=1063707204 TSecr=2670075920"
"12.135050","54.38.73.16","172.18.0.2","TLSv1.2","922","Application Data"
"12.135075","172.18.0.2","54.38.73.16","TCP","68","36876 → 21002 [ACK] Seq=15089 Ack=252104 Win=5593 Len=0 TSval=1063707211 TSecr=2670075922"
"12.138625","54.38.73.16","172.18.0.2","TLSv1.2","8756","Application Data, Application Data"
"12.138650","172.18.0.2","54.38.73.16","TCP","68","36876 → 21002 [ACK] Seq=15089 Ack=260792 Win=5565 Len=0 TSval=1063707215 TSecr=2670075922"
"12.139485","172.18.0.2","54.38.73.16","TLSv1.2","611","Application Data"
"12.140998","54.38.73.16","172.18.0.2","TCP","2964","21002 → 36876 [ACK] Seq=260792 Ack=15089 Win=1452 Len=2896 TSval=2670075923 TSecr=1063707192 [TCP segment of a reassembled PDU]"
"12.141023","172.18.0.2","54.38.73.16","TCP","68","36876 → 21002 [ACK] Seq=15632 Ack=263688 Win=5595 Len=0 TSval=1063707217 TSecr=2670075923"
"12.159498","54.38.73.16","172.18.0.2","TLSv1.2","393","Application Data"
"12.159523","172.18.0.2","54.38.73.16","TCP","68","36876 → 21002 [ACK] Seq=15632 Ack=264013 Win=5593 Len=0 TSval=1063707236 TSecr=2670075928"
"12.163125","54.38.73.16","172.18.0.2","TCP","68","21002 → 36876 [ACK] Seq=264013 Ack=15632 Win=1452 Len=0 TSval=2670075929 TSecr=1063707216"
"12.207858","54.38.73.16","172.18.0.2","TLSv1.2","4145","Application Data"
"12.207891","54.38.73.16","172.18.0.2","TCP","2964","[TCP segment of a reassembled PDU]"
"12.208030","172.18.0.2","54.38.73.16","TCP","68","36876 → 21002 [ACK] Seq=15632 Ack=270986 Win=5564 Len=0 TSval=1063707284 TSecr=2670075940"
"12.222220","54.38.73.16","172.18.0.2","TLSv1.2","5860","Application Data, Application Data"
"12.222248","172.18.0.2","54.38.73.16","TCP","68","36876 → 21002 [ACK] Seq=15632 Ack=276778 Win=5580 Len=0 TSval=1063707299 TSecr=2670075943"
"12.222739","172.18.0.2","54.38.73.16","TLSv1.2","611","Application Data"
"12.232973","54.38.73.16","172.18.0.2","TLSv1.2","783","Application Data"
"12.233144","172.18.0.2","54.38.73.16","TCP","68","36876 → 21002 [ACK] Seq=16175 Ack=277493 Win=5612 Len=0 TSval=1063707309 TSecr=2670075946"
"12.237615","54.38.73.16","172.18.0.2","TCP","2964","[TCP segment of a reassembled PDU]"
"12.237756","54.38.73.16","172.18.0.2","TLSv1.2","4412","Application Data [TCP segment of a reassembled PDU]"
"12.237791","172.18.0.2","54.38.73.16","TCP","68","36876 → 21002 [ACK] Seq=16175 Ack=280389 Win=5590 Len=0 TSval=1063707314 TSecr=2670075947"
"12.237886","172.18.0.2","54.38.73.16","TCP","68","36876 → 21002 [ACK] Seq=16175 Ack=284733 Win=5579 Len=0 TSval=1063707314 TSecr=2670075947"
"12.257623","54.38.73.16","172.18.0.2","TLSv1.2","596","Application Data"
"12.257808","172.18.0.2","54.38.73.16","TCP","68","36876 → 21002 [ACK] Seq=16175 Ack=285261 Win=5612 Len=0 TSval=1063707334 TSecr=2670075952"
"12.258331","172.18.0.2","54.38.73.16","TLSv1.2","611","Application Data"
"12.296707","54.38.73.16","172.18.0.2","TLSv1.2","3695","Application Data"
"12.296896","172.18.0.2","54.38.73.16","TCP","68","36876 → 21002 [ACK] Seq=16718 Ack=288888 Win=5584 Len=0 TSval=1063707373 TSecr=2670075962"
"12.298086","172.18.0.2","54.38.73.16","TLSv1.2","611","Application Data"
"12.322837","54.38.73.16","172.18.0.2","TLSv1.2","611","Application Data"
"12.361641","54.38.73.16","172.18.0.2","TCP","68","21002 → 36876 [ACK] Seq=289431 Ack=17261 Win=1452 Len=0 TSval=2670075979 TSecr=1063707374"
"12.361673","172.18.0.2","54.38.73.16","TLSv1.2","611","Application Data"
"12.426797","54.38.73.16","172.18.0.2","TCP","68","21002 → 36876 [ACK] Seq=289431 Ack=17804 Win=1452 Len=0 TSval=2670075995 TSecr=1063707438"
"13.482595","54.38.73.16","172.18.0.2","TLSv1.2","611","Application Data"
"13.483556","172.18.0.2","54.38.73.16","TLSv1.2","611","Application Data"
"13.507962","54.38.73.16","172.18.0.2","TCP","68","21002 → 36876 [ACK] Seq=289974 Ack=18347 Win=1452 Len=0 TSval=2670076265 TSecr=1063708560"
"14.711080","54.38.73.16","172.18.0.2","TCP","1516","[TCP segment of a reassembled PDU]"
"14.711177","54.38.73.16","172.18.0.2","TLSv1.2","2697","Application Data"
"14.711185","54.38.73.16","172.18.0.2","TLSv1.2","2964","Application Data"
"14.711188","54.38.73.16","172.18.0.2","TLSv1.2","5860","Application Data, Application Data, Application Data"
"14.711199","172.18.0.2","54.38.73.16","TCP","68","36876 → 21002 [ACK] Seq=18347 Ack=294051 Win=5595 Len=0 TSval=1063709788 TSecr=2670076549"
"14.711422","172.18.0.2","54.38.73.16","TCP","68","36876 → 21002 [ACK] Seq=18347 Ack=302739 Win=5564 Len=0 TSval=1063709788 TSecr=2670076551"
"14.735293","54.38.73.16","172.18.0.2","TLSv1.2","1355","Application Data"
"14.741716","172.18.0.2","54.38.73.16","TLSv1.2","611","Application Data"
"14.767076","54.38.73.16","172.18.0.2","TCP","68","21002 → 36876 [ACK] Seq=304026 Ack=18890 Win=1452 Len=0 TSval=2670076579 TSecr=1063709818"
"15.325391","54.38.73.16","172.18.0.2","TLSv1.2","611","Application Data"
"15.326151","172.18.0.2","54.38.73.16","TLSv1.2","611","Application Data"
"15.350595","54.38.73.16","172.18.0.2","TCP","68","21002 → 36876 [ACK] Seq=304569 Ack=19433 Win=1452 Len=0 TSval=2670076725 TSecr=1063710402"
"16.247833","54.38.73.16","172.18.0.2","TCP","1516","[TCP segment of a reassembled PDU]"
"16.247987","54.38.73.16","172.18.0.2","TLSv1.2","2697","Application Data"
"16.248000","54.38.73.16","172.18.0.2","TLSv1.2","2964","Application Data"
"16.248032","172.18.0.2","54.38.73.16","TCP","68","36876 → 21002 [ACK] Seq=19433 Ack=308646 Win=5595 Len=0 TSval=1063711324 TSecr=2670076934"
"16.248359","172.18.0.2","54.38.73.16","TCP","68","36876 → 21002 [ACK] Seq=19433 Ack=311542 Win=5595 Len=0 TSval=1063711325 TSecr=2670076937"
"16.273917","54.38.73.16","172.18.0.2","TLSv1.2","892","Application Data"
"16.314379","172.18.0.2","54.38.73.16","TCP","68","36876 → 21002 [ACK] Seq=19433 Ack=312366 Win=5612 Len=0 TSval=1063711391 TSecr=2670076956"
"16.324851","54.38.73.16","172.18.0.2","TCP","1516","[TCP segment of a reassembled PDU]"
"16.324896","172.18.0.2","54.38.73.16","TCP","68","36876 → 21002 [ACK] Seq=19433 Ack=313814 Win=5601 Len=0 TSval=1063711401 TSecr=2670076969"
"16.338646","54.38.73.16","172.18.0.2","TLSv1.2","705","Application Data"
"16.338672","172.18.0.2","54.38.73.16","TCP","68","36876 → 21002 [ACK] Seq=19433 Ack=314451 Win=5597 Len=0 TSval=1063711415 TSecr=2670076973"
"16.345182","172.18.0.2","54.38.73.16","TLSv1.2","611","Application Data"
"16.369545","54.38.73.16","172.18.0.2","TCP","68","21002 → 36876 [ACK] Seq=314451 Ack=19976 Win=1452 Len=0 TSval=2670076980 TSecr=1063711422"
"17.476333","54.38.73.16","172.18.0.2","TLSv1.2","611","Application Data"
"17.476377","172.18.0.2","54.38.73.16","TCP","68","36876 → 21002 [ACK] Seq=19976 Ack=314994 Win=5608 Len=0 TSval=1063712553 TSecr=2670077188"
"17.476381","54.38.73.16","172.18.0.2","TLSv1.2","611","[TCP Spurious Retransmission] , Application Data"
"17.476390","172.18.0.2","54.38.73.16","TCP","80","[TCP Dup ACK 287#1] 36876 → 21002 [ACK] Seq=19976 Ack=314994 Win=5608 Len=0 TSval=1063712553 TSecr=2670077252 SLE=314451 SRE=314994"
"17.477362","172.18.0.2","54.38.73.16","TLSv1.2","611","Application Data"
"17.500571","54.38.73.16","172.18.0.2","TCP","68","21002 → 36876 [ACK] Seq=314994 Ack=20519 Win=1452 Len=0 TSval=2670077263 TSecr=1063712554"
"18.091213","54.38.73.16","172.18.0.2","TLSv1.2","3695","Application Data"
"18.091252","172.18.0.2","54.38.73.16","TCP","68","36876 → 21002 [ACK] Seq=20519 Ack=318621 Win=5584 Len=0 TSval=1063713168 TSecr=2670077403"
"18.091255","54.38.73.16","172.18.0.2","TCP","2964","[TCP segment of a reassembled PDU]"
"18.091265","172.18.0.2","54.38.73.16","TCP","68","36876 → 21002 [ACK] Seq=20519 Ack=321517 Win=5564 Len=0 TSval=1063713168 TSecr=2670077406"
"18.104928","54.38.73.16","172.18.0.2","TLSv1.2","2964","Application Data, Application Data"
"18.104950","172.18.0.2","54.38.73.16","TCP","68","36876 → 21002 [ACK] Seq=20519 Ack=324413 Win=5595 Len=0 TSval=1063713181 TSecr=2670077414"
"18.105101","54.38.73.16","172.18.0.2","TCP","1516","21002 → 36876 [ACK] Seq=324413 Ack=20519 Win=1452 Len=1448 TSval=2670077414 TSecr=1063712554 [TCP segment of a reassembled PDU]"
"18.105118","172.18.0.2","54.38.73.16","TCP","68","36876 → 21002 [ACK] Seq=20519 Ack=325861 Win=5584 Len=0 TSval=1063713181 TSecr=2670077414"
"18.114778","54.38.73.16","172.18.0.2","TLSv1.2","625","Application Data"
"18.114801","172.18.0.2","54.38.73.16","TCP","68","36876 → 21002 [ACK] Seq=20519 Ack=326418 Win=5593 Len=0 TSval=1063713191 TSecr=2670077417"
"18.115231","172.18.0.2","54.38.73.16","TLSv1.2","611","Application Data"
"18.126340","54.38.73.16","172.18.0.2","TLSv1.2","7308","Application Data, Application Data"
"18.126362","172.18.0.2","54.38.73.16","TCP","68","36876 → 21002 [ACK] Seq=21062 Ack=333658 Win=5564 Len=0 TSval=1063713203 TSecr=2670077419"
"18.136288","54.38.73.16","172.18.0.2","TLSv1.2","7308","Application Data, Application Data"
"18.136311","172.18.0.2","54.38.73.16","TCP","68","36876 → 21002 [ACK] Seq=21062 Ack=340898 Win=5564 Len=0 TSval=1063713213 TSecr=2670077422"
"18.139686","54.38.73.16","172.18.0.2","TCP","68","21002 → 36876 [ACK] Seq=340898 Ack=21062 Win=1452 Len=0 TSval=2670077423 TSecr=1063713192"
"18.146764","54.38.73.16","172.18.0.2","TCP","1516","21002 → 36876 [ACK] Seq=340898 Ack=21062 Win=1452 Len=1448 TSval=2670077425 TSecr=1063713192 [TCP segment of a reassembled PDU]"
"18.146785","172.18.0.2","54.38.73.16","TCP","68","36876 → 21002 [ACK] Seq=21062 Ack=342346 Win=5593 Len=0 TSval=1063713223 TSecr=2670077425"
"18.151317","54.38.73.16","172.18.0.2","TLSv1.2","5860","Application Data, Application Data, Application Data"
"18.151339","172.18.0.2","54.38.73.16","TCP","68","36876 → 21002 [ACK] Seq=21062 Ack=348138 Win=5580 Len=0 TSval=1063713228 TSecr=2670077426"
"18.151777","172.18.0.2","54.38.73.16","TLSv1.2","611","Application Data"
"18.160913","54.38.73.16","172.18.0.2","TLSv1.2","2738","Application Data"
"18.160936","172.18.0.2","54.38.73.16","TCP","68","36876 → 21002 [ACK] Seq=21605 Ack=350808 Win=5596 Len=0 TSval=1063713237 TSecr=2670077428"
"18.222612","54.38.73.16","172.18.0.2","TCP","68","21002 → 36876 [ACK] Seq=350808 Ack=21605 Win=1452 Len=0 TSval=2670077444 TSecr=1063713228"
"18.224101","54.38.73.16","172.18.0.2","TLSv1.2","3695","Application Data"
"18.224266","172.18.0.2","54.38.73.16","TCP","68","36876 → 21002 [ACK] Seq=21605 Ack=354435 Win=5579 Len=0 TSval=1063713301 TSecr=2670077444"
"18.234127","54.38.73.16","172.18.0.2","TLSv1.2","7308","Application Data"
"18.234289","172.18.0.2","54.38.73.16","TCP","68","36876 → 21002 [ACK] Seq=21605 Ack=361675 Win=5564 Len=0 TSval=1063713311 TSecr=2670077446"
"18.244024","54.38.73.16","172.18.0.2","TLSv1.2","1516","Application Data [TCP segment of a reassembled PDU]"
"18.247320","54.38.73.16","172.18.0.2","TLSv1.2","205","Application Data"
"18.247342","172.18.0.2","54.38.73.16","TCP","68","36876 → 21002 [ACK] Seq=21605 Ack=363260 Win=5593 Len=0 TSval=1063713324 TSecr=2670077449"
"18.371992","54.38.73.16","172.18.0.2","TLSv1.2","3695","Application Data"
"18.372152","172.18.0.2","54.38.73.16","TCP","68","36876 → 21002 [ACK] Seq=21605 Ack=366887 Win=5579 Len=0 TSval=1063713448 TSecr=2670077481"
"18.372518","172.18.0.2","54.38.73.16","TLSv1.2","611","Application Data"
"18.396486","54.38.73.16","172.18.0.2","TLSv1.2","1125","Application Data"
"18.433707","54.38.73.16","172.18.0.2","TCP","68","21002 → 36876 [ACK] Seq=367944 Ack=22148 Win=1452 Len=0 TSval=2670077497 TSecr=1063713449"
"18.433729","172.18.0.2","54.38.73.16","TLSv1.2","611","Application Data"
"18.497419","54.38.73.16","172.18.0.2","TCP","68","21002 → 36876 [ACK] Seq=367944 Ack=22691 Win=1452 Len=0 TSval=2670077513 TSecr=1063713510"
"19.319055","54.38.73.16","172.18.0.2","TLSv1.2","611","Application Data"
"19.320026","172.18.0.2","54.38.73.16","TLSv1.2","611","Application Data"
"19.344210","54.38.73.16","172.18.0.2","TCP","68","21002 → 36876 [ACK] Seq=368487 Ack=23234 Win=1452 Len=0 TSval=2670077724 TSecr=1063714396"
"19.878300","02:42:09:5f:bf:77","","ARP","44","Who has 172.18.0.2? Tell 172.18.0.1"
"19.878312","02:42:ac:12:00:02","","ARP","44","172.18.0.2 is at 02:42:ac:12:00:02"
"19.934133","54.38.73.16","172.18.0.2","TLSv1.2","3695","Application Data"
"19.934184","54.38.73.16","172.18.0.2","TLSv1.2","4412","Application Data"
"19.934192","54.38.73.16","172.18.0.2","TLSv1.2","2964","Application Data [TCP segment of a reassembled PDU]"
"19.934197","54.38.73.16","172.18.0.2","TLSv1.2","1516","Application Data [TCP segment of a reassembled PDU]"
"19.934315","172.18.0.2","54.38.73.16","TCP","68","36876 → 21002 [ACK] Seq=23234 Ack=380802 Win=5531 Len=0 TSval=1063715011 TSecr=2670077853"
"19.935251","172.18.0.2","54.38.73.16","TLSv1.2","611","Application Data"
"19.958844","54.38.73.16","172.18.0.2","TLSv1.2","234","Application Data"
"19.959198","54.38.73.16","172.18.0.2","TCP","68","21002 → 36876 [ACK] Seq=380968 Ack=23777 Win=1452 Len=0 TSval=2670077878 TSecr=1063715012"
"19.984955","54.38.73.16","172.18.0.2","TCP","2964","[TCP segment of a reassembled PDU]"
"19.984976","172.18.0.2","54.38.73.16","TCP","68","36876 → 21002 [ACK] Seq=23777 Ack=383864 Win=5595 Len=0 TSval=1063715061 TSecr=2670077878"
"19.994766","54.38.73.16","172.18.0.2","TLSv1.2","4412","Application Data [TCP segment of a reassembled PDU]"
"19.994918","172.18.0.2","54.38.73.16","TCP","68","36876 → 21002 [ACK] Seq=23777 Ack=388208 Win=5579 Len=0 TSval=1063715071 TSecr=2670077887"
"20.005144","54.38.73.16","172.18.0.2","TLSv1.2","2964","Application Data, Application Data"
"20.005166","172.18.0.2","54.38.73.16","TCP","68","36876 → 21002 [ACK] Seq=23777 Ack=391104 Win=5595 Len=0 TSval=1063715082 TSecr=2670077889"
"20.010550","54.38.73.16","172.18.0.2","TLSv1.2","1356","Application Data"
"20.054362","172.18.0.2","54.38.73.16","TCP","68","36876 → 21002 [ACK] Seq=23777 Ack=392392 Win=5612 Len=0 TSval=1063715131 TSecr=2670077891"
"20.057844","54.38.73.16","172.18.0.2","TCP","2964","[TCP segment of a reassembled PDU]"
"20.057884","172.18.0.2","54.38.73.16","TCP","68","36876 → 21002 [ACK] Seq=23777 Ack=395288 Win=5595 Len=0 TSval=1063715134 TSecr=2670077902"
"20.078123","54.38.73.16","172.18.0.2","TLSv1.2","799","Application Data"
"20.078147","172.18.0.2","54.38.73.16","TCP","68","36876 → 21002 [ACK] Seq=23777 Ack=396019 Win=5593 Len=0 TSval=1063715154 TSecr=2670077907"
"20.078581","172.18.0.2","54.38.73.16","TLSv1.2","611","Application Data"
"20.106204","54.38.73.16","172.18.0.2","TLSv1.2","611","Application Data"
"20.106215","172.18.0.2","54.38.73.16","TCP","68","36876 → 21002 [ACK] Seq=24320 Ack=396562 Win=5608 Len=0 TSval=1063715183 TSecr=2670077914"
"20.129979","54.38.73.16","172.18.0.2","TLSv1.2","1125","Application Data"
"20.129995","172.18.0.2","54.38.73.16","TCP","68","36876 → 21002 [ACK] Seq=24320 Ack=397619 Win=5600 Len=0 TSval=1063715206 TSecr=2670077920"
"20.133276","172.18.0.2","54.38.73.16","TLSv1.2","611","Application Data"
"20.193764","54.38.73.16","172.18.0.2","TCP","68","21002 → 36876 [ACK] Seq=397619 Ack=24863 Win=1452 Len=0 TSval=2670077937 TSecr=1063715210"
"21.163419","54.38.73.16","172.18.0.2","TLSv1.2","611","Application Data"
"21.163441","172.18.0.2","54.38.73.16","TCP","68","36876 → 21002 [ACK] Seq=24863 Ack=398162 Win=5608 Len=0 TSval=1063716240 TSecr=2670078117"
"21.163443","54.38.73.16","172.18.0.2","TLSv1.2","611","[TCP Spurious Retransmission] , Application Data"
"21.163446","172.18.0.2","54.38.73.16","TCP","80","[TCP Dup ACK 363#1] 36876 → 21002 [ACK] Seq=24863 Ack=398162 Win=5608 Len=0 TSval=1063716240 TSecr=2670078178 SLE=397619 SRE=398162"
"21.164002","172.18.0.2","54.38.73.16","TLSv1.2","611","Application Data"
"21.188702","54.38.73.16","172.18.0.2","TCP","68","21002 → 36876 [ACK] Seq=398162 Ack=25406 Win=1452 Len=0 TSval=2670078185 TSecr=1063716240"
"21.700913","54.38.73.16","172.18.0.2","TLSv1.2","3695","Application Data"
"21.700952","172.18.0.2","54.38.73.16","TCP","68","36876 → 21002 [ACK] Seq=25406 Ack=401789 Win=5584 Len=0 TSval=1063716777 TSecr=2670078313"
"21.725500","54.38.73.16","172.18.0.2","TLSv1.2","611","Application Data"
"21.725523","172.18.0.2","54.38.73.16","TCP","68","36876 → 21002 [ACK] Seq=25406 Ack=402332 Win=5593 Len=0 TSval=1063716802 TSecr=2670078319"
"21.744290","54.38.73.16","172.18.0.2","TCP","2964","[TCP segment of a reassembled PDU]"
"21.744314","172.18.0.2","54.38.73.16","TCP","68","36876 → 21002 [ACK] Seq=25406 Ack=405228 Win=5595 Len=0 TSval=1063716821 TSecr=2670078324"
"21.749486","54.38.73.16","172.18.0.2","TLSv1.2","799","Application Data"
"21.749509","172.18.0.2","54.38.73.16","TCP","68","36876 → 21002 [ACK] Seq=25406 Ack=405959 Win=5593 Len=0 TSval=1063716826 TSecr=2670078325"
"21.775135","54.38.73.16","172.18.0.2","TLSv1.2","611","Application Data"
"21.775158","172.18.0.2","54.38.73.16","TCP","68","36876 → 21002 [ACK] Seq=25406 Ack=406502 Win=5593 Len=0 TSval=1063716852 TSecr=2670078331"
"21.812095","54.38.73.16","172.18.0.2","TLSv1.2","4145","Application Data"
"21.812117","172.18.0.2","54.38.73.16","TCP","68","36876 → 21002 [ACK] Seq=25406 Ack=410579 Win=5589 Len=0 TSval=1063716888 TSecr=2670078341"
"21.812134","54.38.73.16","172.18.0.2","TCP","2964","[TCP segment of a reassembled PDU]"
"21.812142","172.18.0.2","54.38.73.16","TCP","68","36876 → 21002 [ACK] Seq=25406 Ack=413475 Win=5567 Len=0 TSval=1063716888 TSecr=2670078341"
"21.825043","54.38.73.16","172.18.0.2","TLSv1.2","4412","Application Data [TCP segment of a reassembled PDU]"
"21.825066","172.18.0.2","54.38.73.16","TCP","68","36876 → 21002 [ACK] Seq=25406 Ack=417819 Win=5578 Len=0 TSval=1063716901 TSecr=2670078344"
"21.836748","54.38.73.16","172.18.0.2","TLSv1.2","1232","Application Data, Application Data, Application Data"
"21.836771","172.18.0.2","54.38.73.16","TCP","68","36876 → 21002 [ACK] Seq=25406 Ack=418983 Win=5593 Len=0 TSval=1063716913 TSecr=2670078347"
"21.858132","54.38.73.16","172.18.0.2","TCP","2964","[TCP segment of a reassembled PDU]"
"21.858155","172.18.0.2","54.38.73.16","TCP","68","36876 → 21002 [ACK] Seq=25406 Ack=421879 Win=5595 Len=0 TSval=1063716935 TSecr=2670078352"
"21.860697","54.38.73.16","172.18.0.2","TLSv1.2","799","Application Data"
"21.860719","172.18.0.2","54.38.73.16","TCP","68","36876 → 21002 [ACK] Seq=25406 Ack=422610 Win=5593 Len=0 TSval=1063716937 TSecr=2670078353"
"21.868181","54.38.73.16","172.18.0.2","TCP","2964","[TCP segment of a reassembled PDU]"
"21.868205","172.18.0.2","54.38.73.16","TCP","68","36876 → 21002 [ACK] Seq=25406 Ack=425506 Win=5595 Len=0 TSval=1063716945 TSecr=2670078355"
"21.885493","54.38.73.16","172.18.0.2","TLSv1.2","1342","Application Data, Application Data"
"21.885515","172.18.0.2","54.38.73.16","TCP","68","36876 → 21002 [ACK] Seq=25406 Ack=426780 Win=5593 Len=0 TSval=1063716962 TSecr=2670078359"
"21.885945","172.18.0.2","54.38.73.16","TLSv1.2","611","Application Data"
"21.887880","54.38.73.16","172.18.0.2","TCP","2964","[TCP segment of a reassembled PDU]"
"21.887902","172.18.0.2","54.38.73.16","TCP","68","36876 → 21002 [ACK] Seq=25949 Ack=429676 Win=5595 Len=0 TSval=1063716964 TSecr=2670078360"
"21.899486","54.38.73.16","172.18.0.2","TLSv1.2","1516","Application Data [TCP segment of a reassembled PDU]"
"21.899508","172.18.0.2","54.38.73.16","TCP","68","36876 → 21002 [ACK] Seq=25949 Ack=431124 Win=5593 Len=0 TSval=1063716976 TSecr=2670078363"
"21.910283","54.38.73.16","172.18.0.2","TLSv1.2","1045","[TCP Previous segment not captured] , Ignored Unknown Record"
"21.910311","172.18.0.2","54.38.73.16","TCP","80","[TCP Window Update] 36876 → 21002 [ACK] Seq=25949 Ack=431124 Win=5603 Len=0 TSval=1063716987 TSecr=2670078363 SLE=432572 SRE=433549"
"21.910314","54.38.73.16","172.18.0.2","TCP","1516","[TCP Out-Of-Order] 21002 → 36876 [ACK] Seq=431124 Ack=25406 Win=1452 Len=1448 TSval=2670078365 TSecr=1063716945"
"21.910341","172.18.0.2","54.38.73.16","TCP","68","36876 → 21002 [ACK] Seq=25949 Ack=433549 Win=5594 Len=0 TSval=1063716987 TSecr=2670078365"
"21.910592","54.38.73.16","172.18.0.2","TCP","68","21002 → 36876 [ACK] Seq=433549 Ack=25949 Win=1452 Len=0 TSval=2670078366 TSecr=1063716962"
"21.910618","172.18.0.2","54.38.73.16","TLSv1.2","611","Application Data"
"21.929567","54.38.73.16","172.18.0.2","TCP","2964","[TCP segment of a reassembled PDU]"
"21.929589","172.18.0.2","54.38.73.16","TCP","68","36876 → 21002 [ACK] Seq=26492 Ack=436445 Win=5595 Len=0 TSval=1063717006 TSecr=2670078368"
"21.933693","54.38.73.16","172.18.0.2","TLSv1.2","4412","Application Data [TCP segment of a reassembled PDU]"
"21.933845","172.18.0.2","54.38.73.16","TCP","68","36876 → 21002 [ACK] Seq=26492 Ack=440789 Win=5579 Len=0 TSval=1063717010 TSecr=2670078371"
"21.935410","54.38.73.16","172.18.0.2","TLSv1.2","82","Application Data"
"21.943127","54.38.73.16","172.18.0.2","TCP","2964","[TCP segment of a reassembled PDU]"
"21.943157","172.18.0.2","54.38.73.16","TCP","68","36876 → 21002 [ACK] Seq=26492 Ack=443699 Win=5595 Len=0 TSval=1063717019 TSecr=2670078372"
"21.965175","54.38.73.16","172.18.0.2","TLSv1.2","1516","Application Data [TCP segment of a reassembled PDU]"
"21.966336","54.38.73.16","172.18.0.2","TLSv1.2","922","Application Data"
"21.966484","172.18.0.2","54.38.73.16","TCP","68","36876 → 21002 [ACK] Seq=26492 Ack=446001 Win=5612 Len=0 TSval=1063717043 TSecr=2670078379"
"22.056568","54.38.73.16","172.18.0.2","TLSv1.2","3695","Application Data"
"22.056733","172.18.0.2","54.38.73.16","TCP","68","36876 → 21002 [ACK] Seq=26492 Ack=449628 Win=5584 Len=0 TSval=1063717133 TSecr=2670078402"
"22.082097","54.38.73.16","172.18.0.2","TLSv1.2","611","Application Data"
"22.082451","172.18.0.2","54.38.73.16","TLSv1.2","611","Application Data"
"22.111980","54.38.73.16","172.18.0.2","TLSv1.2","3695","Application Data"
"22.112126","172.18.0.2","54.38.73.16","TCP","68","36876 → 21002 [ACK] Seq=27035 Ack=453798 Win=5584 Len=0 TSval=1063717188 TSecr=2670078416"
"22.134829","54.38.73.16","172.18.0.2","TCP","2964","[TCP segment of a reassembled PDU]"
"22.134840","172.18.0.2","54.38.73.16","TCP","68","36876 → 21002 [ACK] Seq=27035 Ack=456694 Win=5595 Len=0 TSval=1063717211 TSecr=2670078422"
"22.138496","54.38.73.16","172.18.0.2","TLSv1.2","1342","Application Data, Application Data"
"22.182337","172.18.0.2","54.38.73.16","TCP","68","36876 → 21002 [ACK] Seq=27035 Ack=457968 Win=5612 Len=0 TSval=1063717259 TSecr=2670078422"
"22.189683","54.38.73.16","172.18.0.2","TLSv1.2","2964","Application Data"
"22.189802","172.18.0.2","54.38.73.16","TCP","68","36876 → 21002 [ACK] Seq=27035 Ack=460864 Win=5595 Len=0 TSval=1063717266 TSecr=2670078435"
"22.207923","54.38.73.16","172.18.0.2","TLSv1.2","1342","Application Data"
"22.208058","172.18.0.2","54.38.73.16","TCP","68","36876 → 21002 [ACK] Seq=27035 Ack=462138 Win=5612 Len=0 TSval=1063717284 TSecr=2670078440"
"22.245241","54.38.73.16","172.18.0.2","TLSv1.2","1125","Application Data"
"22.245382","172.18.0.2","54.38.73.16","TCP","68","36876 → 21002 [ACK] Seq=27035 Ack=463195 Win=5612 Len=0 TSval=1063717322 TSecr=2670078449"
