_ws.col.Time,_ws.col.Source,_ws.col.Destination,_ws.col.Protocol,_ws.col.Length,_ws.col.Info
"0.000000","172.18.0.2","54.38.73.16","TLSv1.2","611","Application Data"
"0.063527","54.38.73.16","172.18.0.2","TCP","68","21002 → 36876 [ACK] Seq=1 Ack=544 Win=1452 Len=0 TSval=2670333617 TSecr=1064737925"
"0.385191","54.38.73.16","172.18.0.2","TLSv1.2","611","Application Data"
"0.385231","172.18.0.2","54.38.73.16","TCP","68","36876 → 21002 [ACK] Seq=544 Ack=544 Win=5608 Len=0 TSval=1064738310 TSecr=2670333674"
"0.386423","172.18.0.2","54.38.73.16","TCP","1516","[TCP segment of a reassembled PDU]"
"0.386505","172.18.0.2","54.38.73.16","TLSv1.2","705","Application Data"
"0.409869","54.38.73.16","172.18.0.2","TCP","68","21002 → 36876 [ACK] Seq=544 Ack=2629 Win=1450 Len=0 TSval=2670333704 TSecr=1064738311"
"0.995249","54.38.73.16","172.18.0.2","TCP","191","[TCP Previous segment not captured] 21002 → 36876 [PSH, ACK] Seq=1992 Ack=2629 Win=1452 Len=123 TSval=2670333823 TSecr=1064738311"
"0.995276","172.18.0.2","54.38.73.16","TCP","80","[TCP Dup ACK 4#1] 36876 → 21002 [ACK] Seq=2629 Ack=544 Win=5612 Len=0 TSval=1064738920 TSecr=2670333704 SLE=1992 SRE=2115"
"0.995279","54.38.73.16","172.18.0.2","TCP","1639","[TCP Retransmission] 21002 → 36876 [PSH, ACK] Seq=544 Ack=2629 Win=1452 Len=1571 TSval=2670333799 TSecr=1064738311"
"0.995304","172.18.0.2","54.38.73.16","TCP","80","36876 → 21002 [ACK] Seq=2629 Ack=2115 Win=5600 Len=0 TSval=1064738920 TSecr=2670333799 SLE=1992 SRE=2115"
"1.003054","172.18.0.2","54.38.73.16","TLSv1.2","611","Application Data"
"1.027271","54.38.73.16","172.18.0.2","TCP","68","21002 → 36876 [ACK] Seq=2115 Ack=3172 Win=1452 Len=0 TSval=2670333858 TSecr=1064738928"
"1.406351","54.38.73.16","172.18.0.2","TLSv1.2","611","Application Data"
"1.406394","172.18.0.2","54.38.73.16","TCP","68","36876 → 21002 [ACK] Seq=3172 Ack=2658 Win=5608 Len=0 TSval=1064739331 TSecr=2670333941"
"1.407387","172.18.0.2","54.38.73.16","TLSv1.2","611","Application Data"
"1.430684","54.38.73.16","172.18.0.2","TCP","68","21002 → 36876 [ACK] Seq=2658 Ack=3715 Win=1452 Len=0 TSval=2670333959 TSecr=1064739332"
"1.918738","54.38.73.16","172.18.0.2","TCP","1516","[TCP segment of a reassembled PDU]"
"1.918869","54.38.73.16","172.18.0.2","TLSv1.2","2247","Application Data"
"1.918884","54.38.73.16","172.18.0.2","TLSv1.2","5860","Application Data"
"1.918925","172.18.0.2","54.38.73.16","TCP","68","36876 → 21002 [ACK] Seq=3715 Ack=12077 Win=5548 Len=0 TSval=1064739843 TSecr=2670334057"
"1.942785","54.38.73.16","172.18.0.2","TLSv1.2","9812","Application Data, Application Data, Application Data"
"1.942812","172.18.0.2","54.38.73.16","TCP","68","36876 → 21002 [ACK] Seq=3715 Ack=21821 Win=5549 Len=0 TSval=1064739867 TSecr=2670334087"
"1.943912","172.18.0.2","54.38.73.16","TLSv1.2","611","Application Data"
"1.945488","54.38.73.16","172.18.0.2","TCP","1516","[TCP segment of a reassembled PDU]"
"1.967163","54.38.73.16","172.18.0.2","TLSv1.2","7308","Application Data, Application Data"
"1.967334","172.18.0.2","54.38.73.16","TCP","68","36876 → 21002 [ACK] Seq=4258 Ack=30509 Win=5564 Len=0 TSval=1064739892 TSecr=2670334088"
"1.967838","54.38.73.16","172.18.0.2","TCP","1516","21002 → 36876 [ACK] Seq=30509 Ack=3715 Win=1452 Len=1448 TSval=2670334093 TSecr=1064739867 [TCP segment of a reassembled PDU]"
"1.968176","54.38.73.16","172.18.0.2","TCP","68","21002 → 36876 [ACK] Seq=31957 Ack=4258 Win=1452 Len=0 TSval=2670334093 TSecr=1064739868"
"1.968217","172.18.0.2","54.38.73.16","TLSv1.2","611","Application Data"
"1.975859","54.38.73.16","172.18.0.2","TCP","1516","21002 → 36876 [ACK] Seq=31957 Ack=4258 Win=1452 Len=1448 TSval=2670334095 TSecr=1064739868 [TCP segment of a reassembled PDU]"
"1.993370","54.38.73.16","172.18.0.2","TLSv1.2","8756","Application Data, Application Data, Application Data, Application Data"
"1.993549","172.18.0.2","54.38.73.16","TCP","68","36876 → 21002 [ACK] Seq=4801 Ack=42093 Win=5565 Len=0 TSval=1064739918 TSecr=2670334095"
"2.009833","54.38.73.16","172.18.0.2","TLSv1.2","1516","Application Data [TCP segment of a reassembled PDU]"
"2.018853","54.38.73.16","172.18.0.2","TLSv1.2","8756","Application Data, Application Data, Application Data"
"2.018878","172.18.0.2","54.38.73.16","TCP","68","36876 → 21002 [ACK] Seq=4801 Ack=52229 Win=5565 Len=0 TSval=1064739943 TSecr=2670334104"
"2.020828","54.38.73.16","172.18.0.2","TLSv1.2","1516","Application Data [TCP segment of a reassembled PDU]"
"2.043205","54.38.73.16","172.18.0.2","TLSv1.2","5860","Application Data, Application Data"
"2.043241","172.18.0.2","54.38.73.16","TCP","68","36876 → 21002 [ACK] Seq=4801 Ack=59469 Win=5580 Len=0 TSval=1064739968 TSecr=2670334106"
"2.043519","54.38.73.16","172.18.0.2","TLSv1.2","3975","Application Data, Application Data"
"2.043769","172.18.0.2","54.38.73.16","TLSv1.2","611","Application Data"
"2.104927","54.38.73.16","172.18.0.2","TCP","68","21002 → 36876 [ACK] Seq=63376 Ack=5344 Win=1452 Len=0 TSval=2670334128 TSecr=1064739968"
"2.104945","172.18.0.2","54.38.73.16","TLSv1.2","611","Application Data"
"2.165734","54.38.73.16","172.18.0.2","TCP","68","21002 → 36876 [ACK] Seq=63376 Ack=5887 Win=1452 Len=0 TSval=2670334143 TSecr=1064740029"
"2.838901","54.38.73.16","172.18.0.2","TLSv1.2","611","Application Data"
"2.840284","172.18.0.2","54.38.73.16","TLSv1.2","611","Application Data"
"2.863594","54.38.73.16","172.18.0.2","TCP","68","21002 → 36876 [ACK] Seq=63919 Ack=6430 Win=1452 Len=0 TSval=2670334317 TSecr=1064740765"
"3.215600","54.38.73.16","172.18.0.2","TLSv1.2","3695","Application Data"
"3.215787","172.18.0.2","54.38.73.16","TCP","68","36876 → 21002 [ACK] Seq=6430 Ack=67546 Win=5584 Len=0 TSval=1064741140 TSecr=2670334405"
"3.235590","54.38.73.16","172.18.0.2","TCP","2964","[TCP segment of a reassembled PDU]"
"3.235654","172.18.0.2","54.38.73.16","TCP","68","36876 → 21002 [ACK] Seq=6430 Ack=70442 Win=5595 Len=0 TSval=1064741160 TSecr=2670334410"
"3.239763","54.38.73.16","172.18.0.2","TLSv1.2","1342","Application Data, Application Data"
"3.255047","54.38.73.16","172.18.0.2","TLSv1.2","5860","Application Data"
"3.255234","172.18.0.2","54.38.73.16","TCP","68","36876 → 21002 [ACK] Seq=6430 Ack=77508 Win=5580 Len=0 TSval=1064741180 TSecr=2670334411"
"3.255633","172.18.0.2","54.38.73.16","TLSv1.2","611","Application Data"
"3.260211","54.38.73.16","172.18.0.2","TCP","1516","21002 → 36876 [ACK] Seq=77508 Ack=6430 Win=1452 Len=1448 TSval=2670334416 TSecr=1064741160 [TCP segment of a reassembled PDU]"
"3.265446","54.38.73.16","172.18.0.2","TLSv1.2","2964","Application Data [TCP segment of a reassembled PDU]"
"3.265469","172.18.0.2","54.38.73.16","TCP","68","36876 → 21002 [ACK] Seq=6973 Ack=81852 Win=5595 Len=0 TSval=1064741190 TSecr=2670334416"
"3.279322","54.38.73.16","172.18.0.2","TLSv1.2","5860","Application Data, Application Data"
"3.279496","172.18.0.2","54.38.73.16","TCP","68","36876 → 21002 [ACK] Seq=6973 Ack=87644 Win=5580 Len=0 TSval=1064741204 TSecr=2670334421"
"3.279830","54.38.73.16","172.18.0.2","TCP","68","21002 → 36876 [ACK] Seq=87644 Ack=6973 Win=1452 Len=0 TSval=2670334421 TSecr=1064741180"
"3.288839","54.38.73.16","172.18.0.2","TCP","1516","21002 → 36876 [ACK] Seq=87644 Ack=6973 Win=1452 Len=1448 TSval=2670334423 TSecr=1064741180 [TCP segment of a reassembled PDU]"
"3.289650","54.38.73.16","172.18.0.2","TLSv1.2","4412","Application Data, Application Data"
"3.289823","172.18.0.2","54.38.73.16","TCP","68","36876 → 21002 [ACK] Seq=6973 Ack=93436 Win=5579 Len=0 TSval=1064741214 TSecr=2670334423"
"3.290277","172.18.0.2","54.38.73.16","TLSv1.2","611","Application Data"
"3.303652","54.38.73.16","172.18.0.2","TLSv1.2","2964","Application Data, Application Data"
"3.303676","172.18.0.2","54.38.73.16","TCP","68","36876 → 21002 [ACK] Seq=7516 Ack=96332 Win=5595 Len=0 TSval=1064741228 TSecr=2670334427"
"3.304027","54.38.73.16","172.18.0.2","TLSv1.2","3498","Application Data, Application Data"
"3.304162","172.18.0.2","54.38.73.16","TCP","68","36876 → 21002 [ACK] Seq=7516 Ack=99762 Win=5569 Len=0 TSval=1064741229 TSecr=2670334427"
"3.325935","54.38.73.16","172.18.0.2","TCP","1516","[TCP segment of a reassembled PDU]"
"3.331278","54.38.73.16","172.18.0.2","TLSv1.2","1516","Application Data [TCP segment of a reassembled PDU]"
"3.331308","172.18.0.2","54.38.73.16","TCP","68","36876 → 21002 [ACK] Seq=7516 Ack=102658 Win=5593 Len=0 TSval=1064741256 TSecr=2670334431"
"3.333554","54.38.73.16","172.18.0.2","TLSv1.2","828","Application Data"
"3.342790","172.18.0.2","54.38.73.16","TLSv1.2","611","Application Data"
"3.409203","54.38.73.16","172.18.0.2","TCP","68","21002 → 36876 [ACK] Seq=103418 Ack=8059 Win=1452 Len=0 TSval=2670334454 TSecr=1064741267"
"3.762030","54.38.73.16","172.18.0.2","TLSv1.2","611","Application Data"
"3.763194","172.18.0.2","54.38.73.16","TLSv1.2","611","Application Data"
"3.789839","54.38.73.16","172.18.0.2","TCP","68","21002 → 36876 [ACK] Seq=103961 Ack=8602 Win=1452 Len=0 TSval=2670334548 TSecr=1064741688"
"4.095112","54.38.73.16","172.18.0.2","TLSv1.2","611","Application Data"
"4.137414","54.38.73.16","172.18.0.2","TCP","2964","[TCP segment of a reassembled PDU]"
"4.137439","172.18.0.2","54.38.73.16","TCP","68","36876 → 21002 [ACK] Seq=8602 Ack=107400 Win=5595 Len=0 TSval=1064742062 TSecr=2670334625"
"4.158764","54.38.73.16","172.18.0.2","TLSv1.2","4412","Application Data [TCP segment of a reassembled PDU]"
"4.158935","172.18.0.2","54.38.73.16","TCP","68","36876 → 21002 [ACK] Seq=8602 Ack=111744 Win=5579 Len=0 TSval=1064742083 TSecr=2670334641"
"4.162266","54.38.73.16","172.18.0.2","TLSv1.2","82","Application Data"
"4.168317","54.38.73.16","172.18.0.2","TCP","1516","[TCP segment of a reassembled PDU]"
"4.168343","172.18.0.2","54.38.73.16","TCP","68","36876 → 21002 [ACK] Seq=8602 Ack=113206 Win=5593 Len=0 TSval=1064742093 TSecr=2670334642"
"4.168503","54.38.73.16","172.18.0.2","TCP","1516","21002 → 36876 [ACK] Seq=113206 Ack=8602 Win=1452 Len=1448 TSval=2670334643 TSecr=1064742062 [TCP segment of a reassembled PDU]"
"4.179810","54.38.73.16","172.18.0.2","TLSv1.2","1516","Application Data [TCP segment of a reassembled PDU]"
"4.179834","172.18.0.2","54.38.73.16","TCP","68","36876 → 21002 [ACK] Seq=8602 Ack=116102 Win=5593 Len=0 TSval=1064742104 TSecr=2670334643"
"4.191035","54.38.73.16","172.18.0.2","TLSv1.2","2964","Application Data [TCP segment of a reassembled PDU]"
"4.191060","172.18.0.2","54.38.73.16","TCP","68","36876 → 21002 [ACK] Seq=8602 Ack=118998 Win=5595 Len=0 TSval=1064742116 TSecr=2670334649"
"4.192644","54.38.73.16","172.18.0.2","TLSv1.2","1139","Application Data"
"4.200023","54.38.73.16","172.18.0.2","TLSv1.2","4412","Application Data"
"4.200147","54.38.73.16","172.18.0.2","TCP","1516","21002 → 36876 [ACK] Seq=124413 Ack=8602 Win=1452 Len=1448 TSval=2670334651 TSecr=1064742093 [TCP segment of a reassembled PDU]"
"4.200196","172.18.0.2","54.38.73.16","TCP","68","36876 → 21002 [ACK] Seq=8602 Ack=125861 Win=5563 Len=0 TSval=1064742125 TSecr=2670334649"
"4.204285","54.38.73.16","172.18.0.2","TCP","1516","21002 → 36876 [ACK] Seq=125861 Ack=8602 Win=1452 Len=1448 TSval=2670334652 TSecr=1064742104 [TCP segment of a reassembled PDU]"
"4.210238","54.38.73.16","172.18.0.2","TLSv1.2","1516","Application Data [TCP segment of a reassembled PDU]"
"4.210265","172.18.0.2","54.38.73.16","TCP","68","36876 → 21002 [ACK] Seq=8602 Ack=128757 Win=5593 Len=0 TSval=1064742135 TSecr=2670334652"
"4.210765","172.18.0.2","54.38.73.16","TLSv1.2","611","Application Data"
"4.215483","54.38.73.16","172.18.0.2","TCP","2964","21002 → 36876 [ACK] Seq=128757 Ack=8602 Win=1452 Len=2896 TSval=2670334655 TSecr=1064742116 [TCP segment of a reassembled PDU]"
"4.215508","172.18.0.2","54.38.73.16","TCP","68","36876 → 21002 [ACK] Seq=9145 Ack=131653 Win=5595 Len=0 TSval=1064742140 TSecr=2670334655"
"4.224251","54.38.73.16","172.18.0.2","TLSv1.2","5860","Application Data, Application Data, Application Data"
"4.224424","172.18.0.2","54.38.73.16","TCP","68","36876 → 21002 [ACK] Seq=9145 Ack=137445 Win=5580 Len=0 TSval=1064742149 TSecr=2670334657"
"4.230955","54.38.73.16","172.18.0.2","TCP","1516","21002 → 36876 [ACK] Seq=137445 Ack=8602 Win=1452 Len=1448 TSval=2670334659 TSecr=1064742125 [TCP segment of a reassembled PDU]"
"4.237505","54.38.73.16","172.18.0.2","TCP","1516","21002 → 36876 [ACK] Seq=138893 Ack=8602 Win=1452 Len=1448 TSval=2670334661 TSecr=1064742135 [TCP segment of a reassembled PDU]"
"4.237531","172.18.0.2","54.38.73.16","TCP","68","36876 → 21002 [ACK] Seq=9145 Ack=140341 Win=5593 Len=0 TSval=1064742162 TSecr=2670334659"
"4.238280","54.38.73.16","172.18.0.2","TCP","68","21002 → 36876 [ACK] Seq=140341 Ack=9145 Win=1452 Len=0 TSval=2670334661 TSecr=1064742135"
"4.238311","172.18.0.2","54.38.73.16","TLSv1.2","611","Application Data"
"4.239499","54.38.73.16","172.18.0.2","TLSv1.2","2964","Application Data [TCP segment of a reassembled PDU]"
"4.239668","172.18.0.2","54.38.73.16","TCP","68","36876 → 21002 [ACK] Seq=9688 Ack=143237 Win=5595 Len=0 TSval=1064742164 TSecr=2670334661"
"4.241407","54.38.73.16","172.18.0.2","TLSv1.2","1516","Application Data [TCP segment of a reassembled PDU]"
"4.249168","54.38.73.16","172.18.0.2","TLSv1.2","5860","Application Data, Application Data"
"4.249332","172.18.0.2","54.38.73.16","TCP","68","36876 → 21002 [ACK] Seq=9688 Ack=150477 Win=5580 Len=0 TSval=1064742174 TSecr=2670334661"
"4.262629","54.38.73.16","172.18.0.2","TCP","2964","21002 → 36876 [ACK] Seq=150477 Ack=9145 Win=1452 Len=2896 TSval=2670334667 TSecr=1064742162 [TCP segment of a reassembled PDU]"
"4.262654","172.18.0.2","54.38.73.16","TCP","68","36876 → 21002 [ACK] Seq=9688 Ack=153373 Win=5595 Len=0 TSval=1064742187 TSecr=2670334667"
"4.265116","54.38.73.16","172.18.0.2","TLSv1.2","2964","Application Data [TCP segment of a reassembled PDU]"
"4.265147","172.18.0.2","54.38.73.16","TCP","68","36876 → 21002 [ACK] Seq=9688 Ack=156269 Win=5595 Len=0 TSval=1064742190 TSecr=2670334667"
"4.272697","54.38.73.16","172.18.0.2","TLSv1.2","5860","Application Data, Application Data"
"4.272870","172.18.0.2","54.38.73.16","TCP","68","36876 → 21002 [ACK] Seq=9688 Ack=162061 Win=5580 Len=0 TSval=1064742197 TSecr=2670334669"
"4.272985","54.38.73.16","172.18.0.2","TLSv1.2","2964","Application Data [TCP segment of a reassembled PDU]"
"4.273226","172.18.0.2","54.38.73.16","TLSv1.2","611","Application Data"
"4.287000","54.38.73.16","172.18.0.2","TLSv1.2","2964","Application Data [TCP segment of a reassembled PDU]"
"4.287023","172.18.0.2","54.38.73.16","TCP","68","36876 → 21002 [ACK] Seq=10231 Ack=167853 Win=5595 Len=0 TSval=1064742212 TSecr=2670334673"
"4.288892","54.38.73.16","172.18.0.2","TLSv1.2","2964","Application Data [TCP segment of a reassembled PDU]"
"4.288912","172.18.0.2","54.38.73.16","TCP","68","36876 → 21002 [ACK] Seq=10231 Ack=170749 Win=5595 Len=0 TSval=1064742213 TSecr=2670334673"
"4.296571","54.38.73.16","172.18.0.2","TLSv1.2","1516","Application Data [TCP segment of a reassembled PDU]"
"4.296812","54.38.73.16","172.18.0.2","TLSv1.2","861","Application Data"
"4.296957","172.18.0.2","54.38.73.16","TCP","68","36876 → 21002 [ACK] Seq=10231 Ack=172990 Win=5578 Len=0 TSval=1064742221 TSecr=2670334675"
"4.333791","54.38.73.16","172.18.0.2","TCP","68","21002 → 36876 [ACK] Seq=172990 Ack=10231 Win=1452 Len=0 TSval=2670334685 TSecr=1064742198"
"4.370910","54.38.73.16","172.18.0.2","TLSv1.2","3181","Application Data"
"4.370955","172.18.0.2","54.38.73.16","TCP","68","36876 → 21002 [ACK] Seq=10231 Ack=176103 Win=5579 Len=0 TSval=1064742295 TSecr=2670334694"
"4.382194","172.18.0.2","54.38.73.16","TLSv1.2","611","Application Data"
"4.444846","54.38.73.16","172.18.0.2","TCP","68","21002 → 36876 [ACK] Seq=176103 Ack=10774 Win=1452 Len=0 TSval=2670334713 TSecr=1064742307"
"4.752058","54.38.73.16","172.18.0.2","TLSv1.2","611","Application Data"
"4.753078","172.18.0.2","54.38.73.16","TLSv1.2","611","Application Data"
"4.776577","54.38.73.16","172.18.0.2","TCP","68","21002 → 36876 [ACK] Seq=176646 Ack=11317 Win=1452 Len=0 TSval=2670334795 TSecr=1064742678"
"5.194779","54.38.73.16","172.18.0.2","TCP","1516","[TCP segment of a reassembled PDU]"
"5.195055","54.38.73.16","172.18.0.2","TLSv1.2","2247","Application Data"
"5.195077","54.38.73.16","172.18.0.2","TCP","2964","[TCP segment of a reassembled PDU]"
"5.195085","54.38.73.16","172.18.0.2","TLSv1.2","4412","Application Data [TCP segment of a reassembled PDU]"
"5.195201","172.18.0.2","54.38.73.16","TCP","68","36876 → 21002 [ACK] Seq=11317 Ack=187513 Win=5563 Len=0 TSval=1064743120 TSecr=2670334892"
"5.195628","172.18.0.2","54.38.73.16","TLSv1.2","611","Application Data"
"5.218521","54.38.73.16","172.18.0.2","TLSv1.2","1139","Application Data, Application Data"
"5.219138","54.38.73.16","172.18.0.2","TCP","68","21002 → 36876 [ACK] Seq=188584 Ack=11860 Win=1452 Len=0 TSval=2670334906 TSecr=1064743120"
"5.228291","54.38.73.16","172.18.0.2","TCP","2964","[TCP segment of a reassembled PDU]"
"5.228316","172.18.0.2","54.38.73.16","TCP","68","36876 → 21002 [ACK] Seq=11860 Ack=191480 Win=5595 Len=0 TSval=1064743153 TSecr=2670334906"
"5.252115","54.38.73.16","172.18.0.2","TLSv1.2","799","Application Data"
"5.256778","172.18.0.2","54.38.73.16","TLSv1.2","611","Application Data"
"5.317397","54.38.73.16","172.18.0.2","TCP","68","21002 → 36876 [ACK] Seq=192211 Ack=12403 Win=1452 Len=0 TSval=2670334931 TSecr=1064743181"
"5.605053","54.38.73.16","172.18.0.2","TLSv1.2","611","Application Data"
"5.606163","172.18.0.2","54.38.73.16","TLSv1.2","611","Application Data"
"5.630197","54.38.73.16","172.18.0.2","TCP","68","21002 → 36876 [ACK] Seq=192754 Ack=12946 Win=1452 Len=0 TSval=2670335009 TSecr=1064743531"
"5.968580","54.38.73.16","172.18.0.2","TLSv1.2","3695","Application Data"
"5.968766","172.18.0.2","54.38.73.16","TCP","68","36876 → 21002 [ACK] Seq=12946 Ack=196381 Win=5584 Len=0 TSval=1064743893 TSecr=2670335093"
"5.986679","54.38.73.16","172.18.0.2","TCP","2964","[TCP segment of a reassembled PDU]"
"5.986703","172.18.0.2","54.38.73.16","TCP","68","36876 → 21002 [ACK] Seq=12946 Ack=199277 Win=5595 Len=0 TSval=1064743911 TSecr=2670335098"
"5.987044","54.38.73.16","172.18.0.2","TLSv1.2","7308","Application Data, Application Data"
"5.987183","172.18.0.2","54.38.73.16","TCP","68","36876 → 21002 [ACK] Seq=12946 Ack=206517 Win=5564 Len=0 TSval=1064743912 TSecr=2670335098"
"5.993337","54.38.73.16","172.18.0.2","TLSv1.2","1841","Application Data"
"5.993362","172.18.0.2","54.38.73.16","TCP","68","36876 → 21002 [ACK] Seq=12946 Ack=208290 Win=5600 Len=0 TSval=1064743918 TSecr=2670335099"
"6.009327","54.38.73.16","172.18.0.2","TCP","1516","[TCP segment of a reassembled PDU]"
"6.011715","54.38.73.16","172.18.0.2","TLSv1.2","2964","Application Data [TCP segment of a reassembled PDU]"
"6.011888","172.18.0.2","54.38.73.16","TCP","68","36876 → 21002 [ACK] Seq=12946 Ack=212634 Win=5595 Len=0 TSval=1064743936 TSecr=2670335104"
"6.016738","54.38.73.16","172.18.0.2","TLSv1.2","922","Application Data"
"6.021294","54.38.73.16","172.18.0.2","TLSv1.2","8756","Application Data, Application Data"
"6.021471","172.18.0.2","54.38.73.16","TCP","68","36876 → 21002 [ACK] Seq=12946 Ack=222176 Win=5565 Len=0 TSval=1064743946 TSecr=2670335105"
"6.022290","172.18.0.2","54.38.73.16","TLSv1.2","611","Application Data"
"6.037137","54.38.73.16","172.18.0.2","TLSv1.2","2964","Application Data [TCP segment of a reassembled PDU]"
"6.037161","172.18.0.2","54.38.73.16","TCP","68","36876 → 21002 [ACK] Seq=13489 Ack=225072 Win=5595 Len=0 TSval=1064743962 TSecr=2670335110"
"6.042356","54.38.73.16","172.18.0.2","TCP","1516","21002 → 36876 [ACK] Seq=225072 Ack=12946 Win=1452 Len=1448 TSval=2670335112 TSecr=1064743936 [TCP segment of a reassembled PDU]"
"6.044968","54.38.73.16","172.18.0.2","TLSv1.2","4657","Application Data, Application Data"
"6.045136","172.18.0.2","54.38.73.16","TCP","68","36876 → 21002 [ACK] Seq=13489 Ack=231109 Win=5585 Len=0 TSval=1064743970 TSecr=2670335112"
"6.046791","54.38.73.16","172.18.0.2","TCP","68","21002 → 36876 [ACK] Seq=231109 Ack=13489 Win=1452 Len=0 TSval=2670335113 TSecr=1064743947"
"6.050610","172.18.0.2","54.38.73.16","TLSv1.2","611","Application Data"
"6.080086","54.38.73.16","172.18.0.2","TCP","68","21002 → 36876 [ACK] Seq=231109 Ack=14032 Win=1452 Len=0 TSval=2670335121 TSecr=1064743975"
"6.315127","54.38.73.16","172.18.0.2","TLSv1.2","611","Application Data"
"6.316043","172.18.0.2","54.38.73.16","TLSv1.2","611","Application Data"
"6.339601","54.38.73.16","172.18.0.2","TCP","68","21002 → 36876 [ACK] Seq=231652 Ack=14575 Win=1452 Len=0 TSval=2670335186 TSecr=1064744241"
"6.667964","54.38.73.16","172.18.0.2","TLSv1.2","3695","Application Data"
"6.668154","172.18.0.2","54.38.73.16","TCP","68","36876 → 21002 [ACK] Seq=14575 Ack=235279 Win=5584 Len=0 TSval=1064744593 TSecr=2670335268"
"6.668575","172.18.0.2","54.38.73.16","TLSv1.2","611","Application Data"
"6.690334","54.38.73.16","172.18.0.2","TCP","2964","[TCP segment of a reassembled PDU]"
"6.690507","172.18.0.2","54.38.73.16","TCP","68","36876 → 21002 [ACK] Seq=15118 Ack=238175 Win=5595 Len=0 TSval=1064744615 TSecr=2670335274"
"6.693619","54.38.73.16","172.18.0.2","TLSv1.2","1342","Application Data, Application Data"
"6.693650","54.38.73.16","172.18.0.2","TCP","68","21002 → 36876 [ACK] Seq=239449 Ack=15118 Win=1452 Len=0 TSval=2670335274 TSecr=1064744593"
"6.710579","54.38.73.16","172.18.0.2","TLSv1.2","8756","Application Data, Application Data"
"6.710689","54.38.73.16","172.18.0.2","TCP","1516","21002 → 36876 [ACK] Seq=248137 Ack=15118 Win=1452 Len=1448 TSval=2670335279 TSecr=1064744593 [TCP segment of a reassembled PDU]"
"6.710755","172.18.0.2","54.38.73.16","TCP","68","36876 → 21002 [ACK] Seq=15118 Ack=249585 Win=5549 Len=0 TSval=1064744635 TSecr=2670335274"
"6.718588","54.38.73.16","172.18.0.2","TCP","1516","21002 → 36876 [ACK] Seq=249585 Ack=15118 Win=1452 Len=1448 TSval=2670335280 TSecr=1064744615 [TCP segment of a reassembled PDU]"
"6.724387","54.38.73.16","172.18.0.2","TLSv1.2","1516","Application Data [TCP segment of a reassembled PDU]"
"6.724412","172.18.0.2","54.38.73.16","TCP","68","36876 → 21002 [ACK] Seq=15118 Ack=252481 Win=5593 Len=0 TSval=1064744649 TSecr=2670335280"
"6.735208","54.38.73.16","172.18.0.2","TLSv1.2","11652","Application Data, Application Data, Application Data"
"6.735377","172.18.0.2","54.38.73.16","TCP","68","36876 → 21002 [ACK] Seq=15118 Ack=264065 Win=5550 Len=0 TSval=1064744660 TSecr=2670335285"
"6.736194","172.18.0.2","54.38.73.16","TLSv1.2","611","Application Data"
"6.748270","54.38.73.16","172.18.0.2","TLSv1.2","2964","Application Data [TCP segment of a reassembled PDU]"
"6.748295","172.18.0.2","54.38.73.16","TCP","68","36876 → 21002 [ACK] Seq=15661 Ack=266961 Win=5595 Len=0 TSval=1064744673 TSecr=2670335288"
"6.759473","54.38.73.16","172.18.0.2","TLSv1.2","11652","Application Data, Application Data, Application Data"
"6.759642","172.18.0.2","54.38.73.16","TCP","68","36876 → 21002 [ACK] Seq=15661 Ack=278545 Win=5550 Len=0 TSval=1064744684 TSecr=2670335291"
"6.773076","54.38.73.16","172.18.0.2","TLSv1.2","5860","Application Data, Application Data"
"6.773107","172.18.0.2","54.38.73.16","TCP","68","36876 → 21002 [ACK] Seq=15661 Ack=284337 Win=5580 Len=0 TSval=1064744698 TSecr=2670335294"
"6.784098","54.38.73.16","172.18.0.2","TLSv1.2","275","Application Data"
"6.784553","172.18.0.2","54.38.73.16","TLSv1.2","1125","Application Data"
"6.785931","54.38.73.16","172.18.0.2","TCP","1516","[TCP segment of a reassembled PDU]"
"6.808490","54.38.73.16","172.18.0.2","TLSv1.2","1219","Application Data"
"6.808680","172.18.0.2","54.38.73.16","TCP","68","36876 → 21002 [ACK] Seq=16718 Ack=287143 Win=5612 Len=0 TSval=1064744733 TSecr=2670335298"
"6.818030","54.38.73.16","172.18.0.2","TCP","1516","[TCP segment of a reassembled PDU]"
"6.833612","54.38.73.16","172.18.0.2","TLSv1.2","1219","Application Data"
"6.833786","172.18.0.2","54.38.73.16","TCP","68","36876 → 21002 [ACK] Seq=16718 Ack=289742 Win=5612 Len=0 TSval=1064744758 TSecr=2670335306"
"6.843428","172.18.0.2","54.38.73.16","TLSv1.2","611","Application Data"
"6.906194","54.38.73.16","172.18.0.2","TCP","68","21002 → 36876 [ACK] Seq=289742 Ack=17261 Win=1452 Len=0 TSval=2670335328 TSecr=1064744768"
"7.345664","54.38.73.16","172.18.0.2","TLSv1.2","611","Application Data"
"7.346165","172.18.0.2","54.38.73.16","TLSv1.2","611","Application Data"
"7.369688","54.38.73.16","172.18.0.2","TCP","68","21002 → 36876 [ACK] Seq=290285 Ack=17804 Win=1452 Len=0 TSval=2670335444 TSecr=1064745271"
"7.960180","54.38.73.16","172.18.0.2","TLSv1.2","611","Application Data"
"7.960216","54.38.73.16","172.18.0.2","TCP","2964","[TCP segment of a reassembled PDU]"
"7.960371","172.18.0.2","54.38.73.16","TCP","68","36876 → 21002 [ACK] Seq=17804 Ack=293724 Win=5586 Len=0 TSval=1064745885 TSecr=2670335577"
"7.966539","54.38.73.16","172.18.0.2","TLSv1.2","4412","Application Data [TCP segment of a reassembled PDU]"
"7.966702","172.18.0.2","54.38.73.16","TCP","68","36876 → 21002 [ACK] Seq=17804 Ack=298068 Win=5579 Len=0 TSval=1064745891 TSecr=2670335593"
"7.978090","54.38.73.16","172.18.0.2","TLSv1.2","2964","Application Data [TCP segment of a reassembled PDU]"
"7.978117","172.18.0.2","54.38.73.16","TCP","68","36876 → 21002 [ACK] Seq=17804 Ack=300964 Win=5595 Len=0 TSval=1064745903 TSecr=2670335596"
"7.985605","54.38.73.16","172.18.0.2","TLSv1.2","1356","Application Data, Application Data"
"8.013734","54.38.73.16","172.18.0.2","TCP","1516","[TCP segment of a reassembled PDU]"
"8.013911","172.18.0.2","54.38.73.16","TCP","68","36876 → 21002 [ACK] Seq=17804 Ack=303700 Win=5593 Len=0 TSval=1064745938 TSecr=2670335598"
"8.038545","54.38.73.16","172.18.0.2","TLSv1.2","705","Application Data"
"8.045697","172.18.0.2","54.38.73.16","TLSv1.2","611","Application Data"
"8.071089","54.38.73.16","172.18.0.2","TCP","68","21002 → 36876 [ACK] Seq=304337 Ack=18347 Win=1452 Len=0 TSval=2670335619 TSecr=1064745970"
"8.471852","54.38.73.16","172.18.0.2","TLSv1.2","611","Application Data"
"8.472697","172.18.0.2","54.38.73.16","TLSv1.2","611","Application Data"
"8.496535","54.38.73.16","172.18.0.2","TCP","68","21002 → 36876 [ACK] Seq=304880 Ack=18890 Win=1452 Len=0 TSval=2670335725 TSecr=1064746397"
"8.881725","54.38.73.16","172.18.0.2","TLSv1.2","611","Application Data"
"8.881762","54.38.73.16","172.18.0.2","TCP","2964","[TCP segment of a reassembled PDU]"
"8.881911","172.18.0.2","54.38.73.16","TCP","68","36876 → 21002 [ACK] Seq=18890 Ack=308319 Win=5586 Len=0 TSval=1064746806 TSecr=2670335810"
"8.905688","54.38.73.16","172.18.0.2","TLSv1.2","799","Application Data"
"8.910883","54.38.73.16","172.18.0.2","TCP","2964","[TCP segment of a reassembled PDU]"
"8.910908","172.18.0.2","54.38.73.16","TCP","68","36876 → 21002 [ACK] Seq=18890 Ack=311946 Win=5595 Len=0 TSval=1064746835 TSecr=2670335828"
"8.935012","54.38.73.16","172.18.0.2","TLSv1.2","799","Application Data"
"8.978052","172.18.0.2","54.38.73.16","TCP","68","36876 → 21002 [ACK] Seq=18890 Ack=312677 Win=5612 Len=0 TSval=1064746903 TSecr=2670335835"
"9.042196","54.38.73.16","172.18.0.2","TLSv1.2","2153","Application Data"
"9.042220","172.18.0.2","54.38.73.16","TCP","68","36876 → 21002 [ACK] Seq=18890 Ack=314762 Win=5598 Len=0 TSval=1064746967 TSecr=2670335862"
"9.049050","172.18.0.2","54.38.73.16","TLSv1.2","611","Application Data"
"9.073318","54.38.73.16","172.18.0.2","TCP","68","21002 → 36876 [ACK] Seq=314762 Ack=19433 Win=1452 Len=0 TSval=2670335869 TSecr=1064746974"
"9.496054","54.38.73.16","172.18.0.2","TLSv1.2","611","Application Data"
"9.496097","172.18.0.2","54.38.73.16","TCP","68","36876 → 21002 [ACK] Seq=19433 Ack=315305 Win=5608 Len=0 TSval=1064747421 TSecr=2670335967"
"9.497077","172.18.0.2","54.38.73.16","TLSv1.2","611","Application Data"
"9.521557","54.38.73.16","172.18.0.2","TCP","68","21002 → 36876 [ACK] Seq=315305 Ack=19976 Win=1452 Len=0 TSval=2670335982 TSecr=1064747422"
"9.845327","54.38.73.16","172.18.0.2","TLSv1.2","611","Application Data"
"9.845371","172.18.0.2","54.38.73.16","TCP","68","36876 → 21002 [ACK] Seq=19976 Ack=315848 Win=5608 Len=0 TSval=1064747770 TSecr=2670336062"
"9.867402","54.38.73.16","172.18.0.2","TCP","2964","[TCP segment of a reassembled PDU]"
"9.867427","172.18.0.2","54.38.73.16","TCP","68","36876 → 21002 [ACK] Seq=19976 Ack=318744 Win=5595 Len=0 TSval=1064747792 TSecr=2670336068"
"9.869652","54.38.73.16","172.18.0.2","TLSv1.2","799","Application Data"
"9.869678","172.18.0.2","54.38.73.16","TCP","68","36876 → 21002 [ACK] Seq=19976 Ack=319475 Win=5593 Len=0 TSval=1064747794 TSecr=2670336069"
"9.889345","54.38.73.16","172.18.0.2","TCP","2964","[TCP segment of a reassembled PDU]"
"9.889369","172.18.0.2","54.38.73.16","TCP","68","36876 → 21002 [ACK] Seq=19976 Ack=322371 Win=5595 Len=0 TSval=1064747814 TSecr=2670336074"
"9.893673","54.38.73.16","172.18.0.2","TLSv1.2","799","Application Data"
"9.893697","172.18.0.2","54.38.73.16","TCP","68","36876 → 21002 [ACK] Seq=19976 Ack=323102 Win=5593 Len=0 TSval=1064747818 TSecr=2670336075"
"9.911467","54.38.73.16","172.18.0.2","TCP","2964","[TCP segment of a reassembled PDU]"
"9.911491","172.18.0.2","54.38.73.16","TCP","68","36876 → 21002 [ACK] Seq=19976 Ack=325998 Win=5595 Len=0 TSval=1064747836 TSecr=2670336079"
"9.911858","54.38.73.16","172.18.0.2","TLSv1.2","7308","Application Data, Application Data"
"9.911893","172.18.0.2","54.38.73.16","TCP","68","36876 → 21002 [ACK] Seq=19976 Ack=333238 Win=5564 Len=0 TSval=1064747836 TSecr=2670336079"
"9.913721","54.38.73.16","172.18.0.2","TCP","1516","21002 → 36876 [ACK] Seq=333238 Ack=19976 Win=1452 Len=1448 TSval=2670336080 TSecr=1064747814 [TCP segment of a reassembled PDU]"
"9.913746","172.18.0.2","54.38.73.16","TCP","68","36876 → 21002 [ACK] Seq=19976 Ack=334686 Win=5593 Len=0 TSval=1064747838 TSecr=2670336080"
"9.918261","54.38.73.16","172.18.0.2","TLSv1.2","393","Application Data"
"9.918286","172.18.0.2","54.38.73.16","TCP","68","36876 → 21002 [ACK] Seq=19976 Ack=335011 Win=5593 Len=0 TSval=1064747843 TSecr=2670336081"
"9.954334","54.38.73.16","172.18.0.2","TLSv1.2","4145","Application Data"
"9.954359","172.18.0.2","54.38.73.16","TCP","68","36876 → 21002 [ACK] Seq=19976 Ack=339088 Win=5589 Len=0 TSval=1064747879 TSecr=2670336090"
"9.954380","54.38.73.16","172.18.0.2","TCP","2964","[TCP segment of a reassembled PDU]"
"9.954389","172.18.0.2","54.38.73.16","TCP","68","36876 → 21002 [ACK] Seq=19976 Ack=341984 Win=5567 Len=0 TSval=1064747879 TSecr=2670336090"
"9.965263","54.38.73.16","172.18.0.2","TLSv1.2","7308","Application Data, Application Data"
"9.965289","172.18.0.2","54.38.73.16","TCP","68","36876 → 21002 [ACK] Seq=19976 Ack=349224 Win=5564 Len=0 TSval=1064747890 TSecr=2670336092"
"9.965813","172.18.0.2","54.38.73.16","TLSv1.2","1125","Application Data"
"9.978822","54.38.73.16","172.18.0.2","TLSv1.2","4412","Application Data [TCP segment of a reassembled PDU]"
"9.978847","172.18.0.2","54.38.73.16","TCP","68","36876 → 21002 [ACK] Seq=21033 Ack=353568 Win=5579 Len=0 TSval=1064747903 TSecr=2670336096"
"9.979014","54.38.73.16","172.18.0.2","TLSv1.2","2245","Application Data, Application Data"
"9.979277","172.18.0.2","54.38.73.16","TCP","68","36876 → 21002 [ACK] Seq=21033 Ack=355745 Win=5566 Len=0 TSval=1064747904 TSecr=2670336096"
"9.989384","54.38.73.16","172.18.0.2","TCP","68","21002 → 36876 [ACK] Seq=355745 Ack=21033 Win=1452 Len=0 TSval=2670336099 TSecr=1064747890"
"9.990078","54.38.73.16","172.18.0.2","TLSv1.2","5860","Application Data"
"9.990100","172.18.0.2","54.38.73.16","TCP","68","36876 → 21002 [ACK] Seq=21033 Ack=361537 Win=5580 Len=0 TSval=1064747915 TSecr=2670336099"
"10.003074","54.38.73.16","172.18.0.2","TCP","596","[TCP Previous segment not captured] 21002 → 36876 [PSH, ACK] Seq=362985 Ack=21033 Win=1452 Len=528 TSval=2670336102 TSecr=1064747904 [TCP segment of a reassembled PDU]"
"10.003108","172.18.0.2","54.38.73.16","TCP","80","[TCP Window Update] 36876 → 21002 [ACK] Seq=21033 Ack=361537 Win=5607 Len=0 TSval=1064747928 TSecr=2670336099 SLE=362985 SRE=363513"
"10.003113","54.38.73.16","172.18.0.2","TCP","1516","[TCP Out-Of-Order] 21002 → 36876 [ACK] Seq=361537 Ack=21033 Win=1452 Len=1448 TSval=2670336102 TSecr=1064747903"
"10.003144","172.18.0.2","54.38.73.16","TCP","68","36876 → 21002 [ACK] Seq=21033 Ack=363513 Win=5598 Len=0 TSval=1064747928 TSecr=2670336102"
"10.027458","54.38.73.16","172.18.0.2","TLSv1.2","611","Application Data"
"10.028633","54.38.73.16","172.18.0.2","TCP","2964","[TCP segment of a reassembled PDU]"
"10.028839","172.18.0.2","54.38.73.16","TCP","68","36876 → 21002 [ACK] Seq=21033 Ack=366952 Win=5595 Len=0 TSval=1064747953 TSecr=2670336108"
"10.053089","54.38.73.16","172.18.0.2","TLSv1.2","799","Application Data"
"10.053812","172.18.0.2","54.38.73.16","TLSv1.2","611","Application Data"
"10.117672","54.38.73.16","172.18.0.2","TCP","68","21002 → 36876 [ACK] Seq=367683 Ack=21576 Win=1452 Len=0 TSval=2670336131 TSecr=1064747978"
"10.117704","172.18.0.2","54.38.73.16","TLSv1.2","611","Application Data"
"10.141768","54.38.73.16","172.18.0.2","TCP","68","21002 → 36876 [ACK] Seq=367683 Ack=22119 Win=1452 Len=0 TSval=2670336137 TSecr=1064748042"
"10.518226","54.38.73.16","172.18.0.2","TLSv1.2","611","Application Data"
"10.519207","172.18.0.2","54.38.73.16","TLSv1.2","611","Application Data"
"10.543071","54.38.73.16","172.18.0.2","TCP","68","21002 → 36876 [ACK] Seq=368226 Ack=22662 Win=1452 Len=0 TSval=2670336237 TSecr=1064748444"
"10.930133","54.38.73.16","172.18.0.2","TLSv1.2","611","Application Data"
"10.974125","172.18.0.2","54.38.73.16","TCP","68","36876 → 21002 [ACK] Seq=22662 Ack=368769 Win=5612 Len=0 TSval=1064748899 TSecr=2670336327"
"11.011382","54.38.73.16","172.18.0.2","TLSv1.2","3695","Application Data"
"11.011427","172.18.0.2","54.38.73.16","TCP","68","36876 → 21002 [ACK] Seq=22662 Ack=372396 Win=5584 Len=0 TSval=1064748936 TSecr=2670336354"
"11.020993","54.38.73.16","172.18.0.2","TLSv1.2","10204","Application Data, Application Data"
"11.021019","172.18.0.2","54.38.73.16","TCP","68","36876 → 21002 [ACK] Seq=22662 Ack=382532 Win=5549 Len=0 TSval=1064748946 TSecr=2670336356"
"11.035617","54.38.73.16","172.18.0.2","TLSv1.2","2964","Application Data [TCP segment of a reassembled PDU]"
"11.035641","172.18.0.2","54.38.73.16","TCP","68","36876 → 21002 [ACK] Seq=22662 Ack=385428 Win=5595 Len=0 TSval=1064748960 TSecr=2670336360"
"11.045529","54.38.73.16","172.18.0.2","TLSv1.2","10369","Application Data, Application Data, Application Data, Application Data"
"11.045556","172.18.0.2","54.38.73.16","TCP","68","36876 → 21002 [ACK] Seq=22662 Ack=395729 Win=5555 Len=0 TSval=1064748970 TSecr=2670336362"
"11.046926","172.18.0.2","54.38.73.16","TLSv1.2","1125","Application Data"
"11.060176","54.38.73.16","172.18.0.2","TCP","1516","[TCP segment of a reassembled PDU]"
"11.060199","172.18.0.2","54.38.73.16","TCP","68","36876 → 21002 [ACK] Seq=23719 Ack=397177 Win=5593 Len=0 TSval=1064748985 TSecr=2670336366"
"11.070057","54.38.73.16","172.18.0.2","TLSv1.2","191","Application Data"
"11.070082","172.18.0.2","54.38.73.16","TCP","68","36876 → 21002 [ACK] Seq=23719 Ack=397300 Win=5593 Len=0 TSval=1064748995 TSecr=2670336369"
"11.070390","54.38.73.16","172.18.0.2","TCP","68","21002 → 36876 [ACK] Seq=397300 Ack=23719 Win=1452 Len=0 TSval=2670336369 TSecr=1064748971"
"11.078496","172.18.0.2","54.38.73.16","TLSv1.2","611","Application Data"
"11.102511","54.38.73.16","172.18.0.2","TCP","68","21002 → 36876 [ACK] Seq=397300 Ack=24262 Win=1452 Len=0 TSval=2670336377 TSecr=1064749003"
"11.748505","54.38.73.16","172.18.0.2","TLSv1.2","611","Application Data"
"11.748549","172.18.0.2","54.38.73.16","TCP","68","36876 → 21002 [ACK] Seq=24262 Ack=397843 Win=5608 Len=0 TSval=1064749673 TSecr=2670336480"
"11.748678","54.38.73.16","172.18.0.2","TLSv1.2","611","[TCP Spurious Retransmission] , Application Data"
"11.748699","172.18.0.2","54.38.73.16","TCP","80","[TCP Window Update] 36876 → 21002 [ACK] Seq=24262 Ack=397843 Win=5612 Len=0 TSval=1064749673 TSecr=2670336539 SLE=397300 SRE=397843"
"11.749589","172.18.0.2","54.38.73.16","TLSv1.2","611","Application Data"
"11.773759","54.38.73.16","172.18.0.2","TCP","68","21002 → 36876 [ACK] Seq=397843 Ack=24805 Win=1452 Len=0 TSval=2670336545 TSecr=1064749674"
"12.074715","54.38.73.16","172.18.0.2","TLSv1.2","611","Application Data"
"12.074754","172.18.0.2","54.38.73.16","TCP","68","36876 → 21002 [ACK] Seq=24805 Ack=398386 Win=5608 Len=0 TSval=1064749999 TSecr=2670336620"
"12.117856","54.38.73.16","172.18.0.2","TLSv1.2","4145","Application Data"
"12.117900","172.18.0.2","54.38.73.16","TCP","68","36876 → 21002 [ACK] Seq=24805 Ack=402463 Win=5589 Len=0 TSval=1064750042 TSecr=2670336630"
"12.117905","54.38.73.16","172.18.0.2","TCP","2964","[TCP segment of a reassembled PDU]"
"12.117915","172.18.0.2","54.38.73.16","TCP","68","36876 → 21002 [ACK] Seq=24805 Ack=405359 Win=5567 Len=0 TSval=1064750042 TSecr=2670336630"
"12.138500","54.38.73.16","172.18.0.2","TLSv1.2","2964","Application Data [TCP segment of a reassembled PDU]"
"12.138525","172.18.0.2","54.38.73.16","TCP","68","36876 → 21002 [ACK] Seq=24805 Ack=408255 Win=5595 Len=0 TSval=1064750063 TSecr=2670336636"
"12.142212","54.38.73.16","172.18.0.2","TLSv1.2","1623","Application Data, Application Data"
"12.142236","172.18.0.2","54.38.73.16","TCP","68","36876 → 21002 [ACK] Seq=24805 Ack=409810 Win=5601 Len=0 TSval=1064750067 TSecr=2670336637"
"12.161002","54.38.73.16","172.18.0.2","TCP","2964","[TCP segment of a reassembled PDU]"
"12.161025","172.18.0.2","54.38.73.16","TCP","68","36876 → 21002 [ACK] Seq=24805 Ack=412706 Win=5595 Len=0 TSval=1064750086 TSecr=2670336641"
"12.166110","54.38.73.16","172.18.0.2","TLSv1.2","799","Application Data"
"12.166134","172.18.0.2","54.38.73.16","TCP","68","36876 → 21002 [ACK] Seq=24805 Ack=413437 Win=5593 Len=0 TSval=1064750091 TSecr=2670336643"
"12.173133","54.38.73.16","172.18.0.2","TCP","2964","[TCP segment of a reassembled PDU]"
"12.173158","172.18.0.2","54.38.73.16","TCP","68","36876 → 21002 [ACK] Seq=24805 Ack=416333 Win=5577 Len=0 TSval=1064750098 TSecr=2670336644"
"12.184630","54.38.73.16","172.18.0.2","TLSv1.2","2964","Application Data, Application Data"
"12.184654","172.18.0.2","54.38.73.16","TCP","68","36876 → 21002 [ACK] Seq=24805 Ack=419229 Win=5595 Len=0 TSval=1064750109 TSecr=2670336647"
"12.186111","54.38.73.16","172.18.0.2","TCP","1516","21002 → 36876 [ACK] Seq=419229 Ack=24805 Win=1452 Len=1448 TSval=2670336648 TSecr=1064750086 [TCP segment of a reassembled PDU]"
"12.186137","172.18.0.2","54.38.73.16","TCP","68","36876 → 21002 [ACK] Seq=24805 Ack=420677 Win=5593 Len=0 TSval=1064750111 TSecr=2670336648"
"12.190834","54.38.73.16","172.18.0.2","TLSv1.2","625","Application Data"
"12.190860","172.18.0.2","54.38.73.16","TCP","68","36876 → 21002 [ACK] Seq=24805 Ack=421234 Win=5593 Len=0 TSval=1064750115 TSecr=2670336649"
"12.205282","54.38.73.16","172.18.0.2","TLSv1.2","5860","Application Data"
"12.205308","172.18.0.2","54.38.73.16","TCP","68","36876 → 21002 [ACK] Seq=24805 Ack=427026 Win=5580 Len=0 TSval=1064750130 TSecr=2670336652"
"12.205794","172.18.0.2","54.38.73.16","TLSv1.2","611","Application Data"
"12.209331","54.38.73.16","172.18.0.2","TCP","1516","21002 → 36876 [ACK] Seq=427026 Ack=24805 Win=1452 Len=1448 TSval=2670336654 TSecr=1064750109 [TCP segment of a reassembled PDU]"
"12.209355","172.18.0.2","54.38.73.16","TCP","68","36876 → 21002 [ACK] Seq=25348 Ack=428474 Win=5593 Len=0 TSval=1064750134 TSecr=2670336654"
"12.215011","54.38.73.16","172.18.0.2","TLSv1.2","2964","Application Data [TCP segment of a reassembled PDU]"
"12.215036","172.18.0.2","54.38.73.16","TCP","68","36876 → 21002 [ACK] Seq=25348 Ack=431370 Win=5595 Len=0 TSval=1064750140 TSecr=2670336655"
"12.235469","54.38.73.16","172.18.0.2","TCP","68","[TCP Previous segment not captured] 21002 → 36876 [ACK] Seq=438610 Ack=25348 Win=1452 Len=0 TSval=2670336659 TSecr=1064750130"
"12.235491","54.38.73.16","172.18.0.2","TCP","1516","[TCP Out-Of-Order] 21002 → 36876 [ACK] Seq=431370 Ack=24805 Win=1452 Len=1448 TSval=2670336658 TSecr=1064750115 [TCP segment of a reassembled PDU]"
"12.235505","172.18.0.2","54.38.73.16","TCP","68","36876 → 21002 [ACK] Seq=25348 Ack=432818 Win=5603 Len=0 TSval=1064750160 TSecr=2670336658"
"12.235526","54.38.73.16","172.18.0.2","TCP","5860","[TCP Retransmission] 21002 → 36876 [ACK] Seq=432818 Ack=24805 Win=1452 Len=5792 TSval=2670336659 TSecr=1064750130"
"12.235669","172.18.0.2","54.38.73.16","TCP","68","36876 → 21002 [ACK] Seq=25348 Ack=438610 Win=5580 Len=0 TSval=1064750160 TSecr=2670336659"
"12.240265","54.38.73.16","172.18.0.2","TLSv1.2","2964","Ignored Unknown Record"
"12.240289","172.18.0.2","54.38.73.16","TCP","68","36876 → 21002 [ACK] Seq=25348 Ack=441506 Win=5595 Len=0 TSval=1064750165 TSecr=2670336661"
"12.247576","54.38.73.16","172.18.0.2","TLSv1.2","1516","Ignored Unknown Record"
"12.260401","54.38.73.16","172.18.0.2","TLSv1.2","7308","Ignored Unknown Record"
"12.260571","172.18.0.2","54.38.73.16","TCP","68","36876 → 21002 [ACK] Seq=25348 Ack=450194 Win=5564 Len=0 TSval=1064750185 TSecr=2670336663"
"12.261264","172.18.0.2","54.38.73.16","TLSv1.2","611","Application Data"
"12.264720","54.38.73.16","172.18.0.2","TLSv1.2","4323","Ignored Unknown Record"
"12.264745","172.18.0.2","54.38.73.16","TCP","68","36876 → 21002 [ACK] Seq=25891 Ack=454449 Win=5579 Len=0 TSval=1064750189 TSecr=2670336667"
"12.285462","54.38.73.16","172.18.0.2","TLSv1.2","7308","Application Data"
"12.285637","172.18.0.2","54.38.73.16","TCP","68","36876 → 21002 [ACK] Seq=25891 Ack=461689 Win=5564 Len=0 TSval=1064750210 TSecr=2670336672"
"12.288534","54.38.73.16","172.18.0.2","TLSv1.2","1139","Application Data, Application Data"
"12.288567","172.18.0.2","54.38.73.16","TLSv1.2","611","Application Data"
"12.349053","54.38.73.16","172.18.0.2","TCP","68","21002 → 36876 [ACK] Seq=462760 Ack=26434 Win=1452 Len=0 TSval=2670336689 TSecr=1064750213"
