_ws.col.Time,_ws.col.Source,_ws.col.Destination,_ws.col.Protocol,_ws.col.Length,_ws.col.Info
"0.000000","172.18.0.2","54.38.73.16","TLSv1.2","611","Application Data"
"0.063166","54.38.73.16","172.18.0.2","TCP","68","21002 → 36876 [ACK] Seq=1 Ack=544 Win=1452 Len=0 TSval=2670379797 TSecr=1064922641"
"0.300095","54.38.73.16","172.18.0.2","TLSv1.2","611","Application Data"
"0.300136","172.18.0.2","54.38.73.16","TCP","68","36876 → 21002 [ACK] Seq=544 Ack=544 Win=5608 Len=0 TSval=1064922942 TSecr=2670379851"
"0.301105","172.18.0.2","54.38.73.16","TCP","1516","[TCP segment of a reassembled PDU]"
"0.301169","172.18.0.2","54.38.73.16","TLSv1.2","705","Application Data"
"0.325187","54.38.73.16","172.18.0.2","TCP","68","21002 → 36876 [ACK] Seq=544 Ack=2629 Win=1448 Len=0 TSval=2670379862 TSecr=1064922943"
"0.909312","54.38.73.16","172.18.0.2","TLSv1.2","611","Application Data"
"0.909353","172.18.0.2","54.38.73.16","TCP","68","36876 → 21002 [ACK] Seq=2629 Ack=1087 Win=5608 Len=0 TSval=1064923551 TSecr=2670379959"
"0.933478","54.38.73.16","172.18.0.2","TLSv1.2","1125","Application Data"
"0.933503","172.18.0.2","54.38.73.16","TCP","68","36876 → 21002 [ACK] Seq=2629 Ack=2144 Win=5600 Len=0 TSval=1064923575 TSecr=2670380014"
"0.941185","172.18.0.2","54.38.73.16","TLSv1.2","611","Application Data"
"0.965258","54.38.73.16","172.18.0.2","TCP","68","21002 → 36876 [ACK] Seq=2144 Ack=3172 Win=1452 Len=0 TSval=2670380022 TSecr=1064923583"
"1.318455","54.38.73.16","172.18.0.2","TLSv1.2","611","Application Data"
"1.318496","172.18.0.2","54.38.73.16","TCP","68","36876 → 21002 [ACK] Seq=3172 Ack=2687 Win=5608 Len=0 TSval=1064923960 TSecr=2670380093"
"1.319363","172.18.0.2","54.38.73.16","TLSv1.2","611","Application Data"
"1.343769","54.38.73.16","172.18.0.2","TCP","68","21002 → 36876 [ACK] Seq=2687 Ack=3715 Win=1452 Len=0 TSval=2670380117 TSecr=1064923961"
"1.829556","54.38.73.16","172.18.0.2","TCP","1516","[TCP segment of a reassembled PDU]"
"1.830051","54.38.73.16","172.18.0.2","TLSv1.2","2247","Application Data"
"1.830074","54.38.73.16","172.18.0.2","TLSv1.2","10204","Application Data, Application Data"
"1.830179","172.18.0.2","54.38.73.16","TCP","68","36876 → 21002 [ACK] Seq=3715 Ack=16450 Win=5549 Len=0 TSval=1064924472 TSecr=2670380216"
"1.853921","54.38.73.16","172.18.0.2","TLSv1.2","4412","Application Data [TCP segment of a reassembled PDU]"
"1.853938","172.18.0.2","54.38.73.16","TCP","68","36876 → 21002 [ACK] Seq=3715 Ack=20794 Win=5579 Len=0 TSval=1064924495 TSecr=2670380244"
"1.854366","172.18.0.2","54.38.73.16","TLSv1.2","611","Application Data"
"1.854654","54.38.73.16","172.18.0.2","TLSv1.2","9978","Application Data, Application Data, Application Data, Application Data, Application Data"
"1.854778","172.18.0.2","54.38.73.16","TCP","68","36876 → 21002 [ACK] Seq=4258 Ack=30704 Win=5549 Len=0 TSval=1064924496 TSecr=2670380244"
"1.879100","54.38.73.16","172.18.0.2","TCP","68","[TCP Previous segment not captured] 21002 → 36876 [ACK] Seq=33600 Ack=4258 Win=1452 Len=0 TSval=2670380250 TSecr=1064924496"
"1.879146","172.18.0.2","54.38.73.16","TLSv1.2","611","Application Data"
"1.879158","54.38.73.16","172.18.0.2","TCP","2964","[TCP Retransmission] 21002 → 36876 [ACK] Seq=30704 Ack=3715 Win=1452 Len=2896 TSval=2670380250 TSecr=1064924495"
"1.879346","172.18.0.2","54.38.73.16","TCP","68","36876 → 21002 [ACK] Seq=4801 Ack=33600 Win=5595 Len=0 TSval=1064924521 TSecr=2670380250"
"1.880285","54.38.73.16","172.18.0.2","TCP","11195","[TCP segment of a reassembled PDU]"
"1.880447","172.18.0.2","54.38.73.16","TCP","68","36876 → 21002 [ACK] Seq=4801 Ack=44727 Win=5552 Len=0 TSval=1064924522 TSecr=2670380251"
"1.903935","54.38.73.16","172.18.0.2","TCP","1516","21002 → 36876 [ACK] Seq=44727 Ack=4801 Win=1452 Len=1448 TSval=2670380257 TSecr=1064924521 [TCP segment of a reassembled PDU]"
"1.904842","54.38.73.16","172.18.0.2","TCP","191","21002 → 36876 [PSH, ACK] Seq=46175 Ack=4801 Win=1452 Len=123 TSval=2670380257 TSecr=1064924522 [TCP segment of a reassembled PDU]"
"1.904861","172.18.0.2","54.38.73.16","TCP","68","36876 → 21002 [ACK] Seq=4801 Ack=46298 Win=5593 Len=0 TSval=1064924546 TSecr=2670380257"
"1.910719","54.38.73.16","172.18.0.2","TCP","2964","21002 → 36876 [ACK] Seq=46298 Ack=4801 Win=1452 Len=2896 TSval=2670380258 TSecr=1064924522 [TCP segment of a reassembled PDU]"
"1.910735","172.18.0.2","54.38.73.16","TCP","68","36876 → 21002 [ACK] Seq=4801 Ack=49194 Win=5595 Len=0 TSval=1064924552 TSecr=2670380258"
"1.928695","54.38.73.16","172.18.0.2","TCP","799","21002 → 36876 [PSH, ACK] Seq=49194 Ack=4801 Win=1452 Len=731 TSval=2670380263 TSecr=1064924546 [TCP segment of a reassembled PDU]"
"1.957540","54.38.73.16","172.18.0.2","TCP","7308","21002 → 36876 [ACK] Seq=49925 Ack=4801 Win=1452 Len=7240 TSval=2670380270 TSecr=1064924552 [TCP segment of a reassembled PDU]"
"1.957565","172.18.0.2","54.38.73.16","TCP","68","36876 → 21002 [ACK] Seq=4801 Ack=57165 Win=5564 Len=0 TSval=1064924599 TSecr=2670380263"
"1.979930","54.38.73.16","172.18.0.2","TCP","4412","21002 → 36876 [ACK] Seq=57165 Ack=4801 Win=1452 Len=4344 TSval=2670380276 TSecr=1064924552 [TCP segment of a reassembled PDU]"
"1.979973","172.18.0.2","54.38.73.16","TCP","68","36876 → 21002 [ACK] Seq=4801 Ack=61509 Win=5579 Len=0 TSval=1064924621 TSecr=2670380276"
"1.980404","172.18.0.2","54.38.73.16","TLSv1.2","611","Application Data"
"1.983145","54.38.73.16","172.18.0.2","TCP","1993","21002 → 36876 [PSH, ACK] Seq=61509 Ack=4801 Win=1452 Len=1925 TSval=2670380276 TSecr=1064924599 [TCP segment of a reassembled PDU]"
"1.983169","172.18.0.2","54.38.73.16","TCP","68","36876 → 21002 [ACK] Seq=5344 Ack=63434 Win=5599 Len=0 TSval=1064924625 TSecr=2670380276"
"2.043470","54.38.73.16","172.18.0.2","TCP","68","21002 → 36876 [ACK] Seq=63434 Ack=5344 Win=1452 Len=0 TSval=2670380292 TSecr=1064924622"
"2.043494","172.18.0.2","54.38.73.16","TLSv1.2","611","Application Data"
"2.106741","54.38.73.16","172.18.0.2","TCP","68","21002 → 36876 [ACK] Seq=63434 Ack=5887 Win=1452 Len=0 TSval=2670380308 TSecr=1064924685"
"2.443980","54.38.73.16","172.18.0.2","TCP","611","21002 → 36876 [PSH, ACK] Seq=63434 Ack=5887 Win=1452 Len=543 TSval=2670380377 TSecr=1064924685 [TCP segment of a reassembled PDU]"
"2.445081","172.18.0.2","54.38.73.16","TLSv1.2","611","Application Data"
"2.468225","54.38.73.16","172.18.0.2","TCP","68","21002 → 36876 [ACK] Seq=63977 Ack=6430 Win=1452 Len=0 TSval=2670380398 TSecr=1064925087"
"2.809537","54.38.73.16","172.18.0.2","TCP","3181","21002 → 36876 [PSH, ACK] Seq=63977 Ack=6430 Win=1452 Len=3113 TSval=2670380483 TSecr=1064925087 [TCP segment of a reassembled PDU]"
"2.809722","172.18.0.2","54.38.73.16","TCP","68","36876 → 21002 [ACK] Seq=6430 Ack=67090 Win=5588 Len=0 TSval=1064925451 TSecr=2670380483"
"2.819902","54.38.73.16","172.18.0.2","TCP","2964","21002 → 36876 [ACK] Seq=67090 Ack=6430 Win=1452 Len=2896 TSval=2670380486 TSecr=1064925087 [TCP segment of a reassembled PDU]"
"2.819927","172.18.0.2","54.38.73.16","TCP","68","36876 → 21002 [ACK] Seq=6430 Ack=69986 Win=5595 Len=0 TSval=1064925461 TSecr=2670380486"
"2.829241","54.38.73.16","172.18.0.2","TCP","1516","21002 → 36876 [ACK] Seq=69986 Ack=6430 Win=1452 Len=1448 TSval=2670380488 TSecr=1064925087 [TCP segment of a reassembled PDU]"
"2.829915","54.38.73.16","172.18.0.2","TCP","5860","21002 → 36876 [ACK] Seq=71434 Ack=6430 Win=1452 Len=5792 TSval=2670380488 TSecr=1064925087 [TCP segment of a reassembled PDU]"
"2.830063","172.18.0.2","54.38.73.16","TCP","68","36876 → 21002 [ACK] Seq=6430 Ack=77226 Win=5580 Len=0 TSval=1064925472 TSecr=2670380488"
"2.830462","172.18.0.2","54.38.73.16","TLSv1.2","611","Application Data"
"2.834628","54.38.73.16","172.18.0.2","TCP","813","21002 → 36876 [PSH, ACK] Seq=77226 Ack=6430 Win=1452 Len=745 TSval=2670380489 TSecr=1064925451 [TCP segment of a reassembled PDU]"
"2.840937","54.38.73.16","172.18.0.2","TCP","2964","21002 → 36876 [ACK] Seq=77971 Ack=6430 Win=1452 Len=2896 TSval=2670380491 TSecr=1064925451 [TCP segment of a reassembled PDU]"
"2.840973","172.18.0.2","54.38.73.16","TCP","68","36876 → 21002 [ACK] Seq=6973 Ack=80867 Win=5595 Len=0 TSval=1064925482 TSecr=2670380489"
"2.844467","54.38.73.16","172.18.0.2","TCP","1516","21002 → 36876 [ACK] Seq=80867 Ack=6430 Win=1452 Len=1448 TSval=2670380492 TSecr=1064925461 [TCP segment of a reassembled PDU]"
"2.857583","54.38.73.16","172.18.0.2","TCP","68","21002 → 36876 [ACK] Seq=82315 Ack=6973 Win=1452 Len=0 TSval=2670380495 TSecr=1064925472"
"2.865309","54.38.73.16","172.18.0.2","TCP","408","21002 → 36876 [PSH, ACK] Seq=82315 Ack=6973 Win=1452 Len=340 TSval=2670380497 TSecr=1064925482 [TCP segment of a reassembled PDU]"
"2.865479","172.18.0.2","54.38.73.16","TCP","68","36876 → 21002 [ACK] Seq=6973 Ack=82655 Win=5612 Len=0 TSval=1064925507 TSecr=2670380492"
"2.880148","54.38.73.16","172.18.0.2","TLSv1.2","2964","Encrypted Alert, Ignored Unknown Record"
"2.880326","172.18.0.2","54.38.73.16","TCP","68","36876 → 21002 [ACK] Seq=6973 Ack=85551 Win=5595 Len=0 TSval=1064925522 TSecr=2670380500"
"2.889361","54.38.73.16","172.18.0.2","TLSv1.2","799","Ignored Unknown Record"
"2.912093","54.38.73.16","172.18.0.2","TLSv1.2","13100","Application Data, Application Data, Application Data"
"2.912270","172.18.0.2","54.38.73.16","TCP","68","36876 → 21002 [ACK] Seq=6973 Ack=99314 Win=5534 Len=0 TSval=1064925554 TSecr=2670380503"
"2.912973","172.18.0.2","54.38.73.16","TLSv1.2","611","Application Data"
"2.936410","54.38.73.16","172.18.0.2","TLSv1.2","4143","Application Data, Application Data"
"2.936435","172.18.0.2","54.38.73.16","TCP","68","36876 → 21002 [ACK] Seq=7516 Ack=103389 Win=5579 Len=0 TSval=1064925578 TSecr=2670380515"
"2.976546","54.38.73.16","172.18.0.2","TCP","68","21002 → 36876 [ACK] Seq=103389 Ack=7516 Win=1452 Len=0 TSval=2670380525 TSecr=1064925554"
"2.976578","172.18.0.2","54.38.73.16","TLSv1.2","611","Application Data"
"3.041196","54.38.73.16","172.18.0.2","TCP","68","21002 → 36876 [ACK] Seq=103389 Ack=8059 Win=1452 Len=0 TSval=2670380541 TSecr=1064925618"
"3.364883","54.38.73.16","172.18.0.2","TLSv1.2","611","Application Data"
"3.365952","172.18.0.2","54.38.73.16","TLSv1.2","611","Application Data"
"3.390043","54.38.73.16","172.18.0.2","TCP","68","21002 → 36876 [ACK] Seq=103932 Ack=8602 Win=1452 Len=0 TSval=2670380628 TSecr=1064926007"
"3.746363","54.38.73.16","172.18.0.2","TLSv1.2","611","Application Data"
"3.789146","172.18.0.2","54.38.73.16","TCP","68","36876 → 21002 [ACK] Seq=8602 Ack=104475 Win=5612 Len=0 TSval=1064926431 TSecr=2670380717"
"3.798907","54.38.73.16","172.18.0.2","TCP","2964","[TCP segment of a reassembled PDU]"
"3.798953","172.18.0.2","54.38.73.16","TCP","68","36876 → 21002 [ACK] Seq=8602 Ack=107371 Win=5595 Len=0 TSval=1064926440 TSecr=2670380730"
"3.813793","54.38.73.16","172.18.0.2","TLSv1.2","799","Application Data"
"3.813817","172.18.0.2","54.38.73.16","TCP","68","36876 → 21002 [ACK] Seq=8602 Ack=108102 Win=5593 Len=0 TSval=1064926455 TSecr=2670380734"
"3.818051","54.38.73.16","172.18.0.2","TLSv1.2","4412","Application Data"
"3.818075","172.18.0.2","54.38.73.16","TCP","68","36876 → 21002 [ACK] Seq=8602 Ack=112446 Win=5579 Len=0 TSval=1064926460 TSecr=2670380735"
"3.838714","54.38.73.16","172.18.0.2","TLSv1.2","408","Application Data"
"3.838738","172.18.0.2","54.38.73.16","TCP","68","36876 → 21002 [ACK] Seq=8602 Ack=112786 Win=5593 Len=0 TSval=1064926480 TSecr=2670380740"
"3.862765","54.38.73.16","172.18.0.2","TLSv1.2","1125","Application Data"
"3.862791","172.18.0.2","54.38.73.16","TCP","68","36876 → 21002 [ACK] Seq=8602 Ack=113843 Win=5593 Len=0 TSval=1064926504 TSecr=2670380746"
"3.885547","54.38.73.16","172.18.0.2","TCP","1516","[TCP segment of a reassembled PDU]"
"3.885575","172.18.0.2","54.38.73.16","TCP","68","36876 → 21002 [ACK] Seq=8602 Ack=115291 Win=5593 Len=0 TSval=1064926527 TSecr=2670380752"
"3.886742","54.38.73.16","172.18.0.2","TLSv1.2","1219","Application Data"
"3.886767","172.18.0.2","54.38.73.16","TCP","68","36876 → 21002 [ACK] Seq=8602 Ack=116442 Win=5593 Len=0 TSval=1064926528 TSecr=2670380752"
"3.918656","54.38.73.16","172.18.0.2","TLSv1.2","3695","Application Data"
"3.918681","172.18.0.2","54.38.73.16","TCP","68","36876 → 21002 [ACK] Seq=8602 Ack=120069 Win=5579 Len=0 TSval=1064926560 TSecr=2670380760"
"3.992745","54.38.73.16","172.18.0.2","TLSv1.2","611","Application Data"
"3.992770","172.18.0.2","54.38.73.16","TCP","68","36876 → 21002 [ACK] Seq=8602 Ack=120612 Win=5593 Len=0 TSval=1064926634 TSecr=2670380779"
"4.057451","54.38.73.16","172.18.0.2","TLSv1.2","3695","Application Data"
"4.057476","172.18.0.2","54.38.73.16","TCP","68","36876 → 21002 [ACK] Seq=8602 Ack=124239 Win=5579 Len=0 TSval=1064926699 TSecr=2670380795"
"4.057990","172.18.0.2","54.38.73.16","TLSv1.2","611","Application Data"
"4.081054","54.38.73.16","172.18.0.2","TCP","2964","[TCP segment of a reassembled PDU]"
"4.081079","172.18.0.2","54.38.73.16","TCP","68","36876 → 21002 [ACK] Seq=9145 Ack=127135 Win=5595 Len=0 TSval=1064926723 TSecr=2670380801"
"4.081233","54.38.73.16","172.18.0.2","TLSv1.2","799","Application Data"
"4.081242","54.38.73.16","172.18.0.2","TCP","68","21002 → 36876 [ACK] Seq=127866 Ack=9145 Win=1452 Len=0 TSval=2670380801 TSecr=1064926699"
"4.081269","172.18.0.2","54.38.73.16","TCP","68","36876 → 21002 [ACK] Seq=9145 Ack=127866 Win=5591 Len=0 TSval=1064926723 TSecr=2670380801"
"4.156976","54.38.73.16","172.18.0.2","TLSv1.2","611","Application Data"
"4.157001","172.18.0.2","54.38.73.16","TCP","68","36876 → 21002 [ACK] Seq=9145 Ack=128409 Win=5593 Len=0 TSval=1064926798 TSecr=2670380820"
"4.211459","54.38.73.16","172.18.0.2","TLSv1.2","4145","Application Data"
"4.211485","172.18.0.2","54.38.73.16","TCP","68","36876 → 21002 [ACK] Seq=9145 Ack=132486 Win=5589 Len=0 TSval=1064926853 TSecr=2670380833"
"4.211507","54.38.73.16","172.18.0.2","TCP","2964","[TCP segment of a reassembled PDU]"
"4.211658","172.18.0.2","54.38.73.16","TCP","68","36876 → 21002 [ACK] Seq=9145 Ack=135382 Win=5567 Len=0 TSval=1064926853 TSecr=2670380833"
"4.212057","172.18.0.2","54.38.73.16","TLSv1.2","611","Application Data"
"4.223852","54.38.73.16","172.18.0.2","TLSv1.2","4412","Application Data [TCP segment of a reassembled PDU]"
"4.224030","172.18.0.2","54.38.73.16","TCP","68","36876 → 21002 [ACK] Seq=9688 Ack=139726 Win=5579 Len=0 TSval=1064926866 TSecr=2670380836"
"4.235529","54.38.73.16","172.18.0.2","TLSv1.2","689","Application Data, Application Data"
"4.235915","172.18.0.2","54.38.73.16","TCP","68","36876 → 21002 [ACK] Seq=9688 Ack=140347 Win=5612 Len=0 TSval=1064926877 TSecr=2670380840"
"4.236392","54.38.73.16","172.18.0.2","TCP","68","21002 → 36876 [ACK] Seq=140347 Ack=9688 Win=1452 Len=0 TSval=2670380840 TSecr=1064926854"
"4.256411","54.38.73.16","172.18.0.2","TCP","2964","[TCP segment of a reassembled PDU]"
"4.256567","172.18.0.2","54.38.73.16","TCP","68","36876 → 21002 [ACK] Seq=9688 Ack=143243 Win=5595 Len=0 TSval=1064926898 TSecr=2670380845"
"4.259718","54.38.73.16","172.18.0.2","TLSv1.2","799","Application Data"
"4.259931","172.18.0.2","54.38.73.16","TCP","68","36876 → 21002 [ACK] Seq=9688 Ack=143974 Win=5612 Len=0 TSval=1064926901 TSecr=2670380846"
"4.268932","54.38.73.16","172.18.0.2","TCP","2964","[TCP segment of a reassembled PDU]"
"4.269142","172.18.0.2","54.38.73.16","TCP","68","36876 → 21002 [ACK] Seq=9688 Ack=146870 Win=5595 Len=0 TSval=1064926911 TSecr=2670380848"
"4.284264","54.38.73.16","172.18.0.2","TLSv1.2","1342","Application Data, Application Data"
"4.284688","172.18.0.2","54.38.73.16","TCP","68","36876 → 21002 [ACK] Seq=9688 Ack=148144 Win=5612 Len=0 TSval=1064926926 TSecr=2670380852"
"4.326914","54.38.73.16","172.18.0.2","TLSv1.2","3181","Application Data"
"4.327101","172.18.0.2","54.38.73.16","TCP","68","36876 → 21002 [ACK] Seq=9688 Ack=151257 Win=5588 Len=0 TSval=1064926969 TSecr=2670380862"
"4.340674","54.38.73.16","172.18.0.2","TCP","2964","[TCP segment of a reassembled PDU]"
"4.340702","172.18.0.2","54.38.73.16","TCP","68","36876 → 21002 [ACK] Seq=9688 Ack=154153 Win=5595 Len=0 TSval=1064926982 TSecr=2670380865"
"4.350497","54.38.73.16","172.18.0.2","TLSv1.2","1516","Application Data [TCP segment of a reassembled PDU]"
"4.351845","54.38.73.16","172.18.0.2","TLSv1.2","408","Application Data"
"4.352022","172.18.0.2","54.38.73.16","TCP","68","36876 → 21002 [ACK] Seq=9688 Ack=155941 Win=5612 Len=0 TSval=1064926993 TSecr=2670380868"
"4.352331","172.18.0.2","54.38.73.16","TLSv1.2","611","Application Data"
"4.373015","54.38.73.16","172.18.0.2","TCP","1516","[TCP segment of a reassembled PDU]"
"4.375986","54.38.73.16","172.18.0.2","TLSv1.2","1219","Application Data"
"4.376161","172.18.0.2","54.38.73.16","TCP","68","36876 → 21002 [ACK] Seq=10231 Ack=158540 Win=5612 Len=0 TSval=1064927018 TSecr=2670380874"
"4.406131","54.38.73.16","172.18.0.2","TCP","2964","[TCP segment of a reassembled PDU]"
"4.406317","172.18.0.2","54.38.73.16","TCP","68","36876 → 21002 [ACK] Seq=10231 Ack=161436 Win=5595 Len=0 TSval=1064927048 TSecr=2670380881"
"4.406441","54.38.73.16","172.18.0.2","TLSv1.2","799","Application Data"
"4.435380","54.38.73.16","172.18.0.2","TCP","2964","[TCP segment of a reassembled PDU]"
"4.435406","172.18.0.2","54.38.73.16","TCP","68","36876 → 21002 [ACK] Seq=10231 Ack=165063 Win=5595 Len=0 TSval=1064927077 TSecr=2670380881"
"4.457112","54.38.73.16","172.18.0.2","TLSv1.2","5860","Application Data, Application Data, Application Data"
"4.457291","172.18.0.2","54.38.73.16","TCP","68","36876 → 21002 [ACK] Seq=10231 Ack=170855 Win=5580 Len=0 TSval=1064927099 TSecr=2670380895"
"4.460178","54.38.73.16","172.18.0.2","TLSv1.2","234","Application Data"
"4.468137","54.38.73.16","172.18.0.2","TCP","1516","[TCP segment of a reassembled PDU]"
"4.468161","172.18.0.2","54.38.73.16","TCP","68","36876 → 21002 [ACK] Seq=10231 Ack=172469 Win=5593 Len=0 TSval=1064927110 TSecr=2670380896"
"4.468677","54.38.73.16","172.18.0.2","TCP","1516","21002 → 36876 [ACK] Seq=172469 Ack=10231 Win=1452 Len=1448 TSval=2670380898 TSecr=1064927077 [TCP segment of a reassembled PDU]"
"4.492132","54.38.73.16","172.18.0.2","TLSv1.2","799","Application Data"
"4.492157","172.18.0.2","54.38.73.16","TCP","68","36876 → 21002 [ACK] Seq=10231 Ack=174648 Win=5593 Len=0 TSval=1064927134 TSecr=2670380898"
"4.534848","54.38.73.16","172.18.0.2","TLSv1.2","1125","Application Data"
"4.541347","172.18.0.2","54.38.73.16","TLSv1.2","611","Application Data"
"4.603444","54.38.73.16","172.18.0.2","TCP","68","21002 → 36876 [ACK] Seq=175705 Ack=10774 Win=1452 Len=0 TSval=2670380932 TSecr=1064927183"
"4.905659","54.38.73.16","172.18.0.2","TLSv1.2","611","Application Data"
"4.906649","172.18.0.2","54.38.73.16","TLSv1.2","611","Application Data"
"4.930722","54.38.73.16","172.18.0.2","TCP","68","21002 → 36876 [ACK] Seq=176248 Ack=11317 Win=1452 Len=0 TSval=2670381013 TSecr=1064927548"
"5.414614","54.38.73.16","172.18.0.2","TCP","1516","[TCP segment of a reassembled PDU]"
"5.414832","54.38.73.16","172.18.0.2","TLSv1.2","2247","Application Data"
"5.414850","54.38.73.16","172.18.0.2","TCP","2964","[TCP segment of a reassembled PDU]"
"5.414857","54.38.73.16","172.18.0.2","TLSv1.2","4412","Application Data [TCP segment of a reassembled PDU]"
"5.414900","172.18.0.2","54.38.73.16","TCP","68","36876 → 21002 [ACK] Seq=11317 Ack=187115 Win=5563 Len=0 TSval=1064928056 TSecr=2670381123"
"5.415327","172.18.0.2","54.38.73.16","TLSv1.2","611","Application Data"
"5.433758","54.38.73.16","172.18.0.2","TLSv1.2","2964","Application Data, Application Data"
"5.433784","172.18.0.2","54.38.73.16","TCP","68","36876 → 21002 [ACK] Seq=11860 Ack=190011 Win=5595 Len=0 TSval=1064928075 TSecr=2670381139"
"5.438541","54.38.73.16","172.18.0.2","TLSv1.2","1356","Application Data"
"5.439344","54.38.73.16","172.18.0.2","TCP","68","21002 → 36876 [ACK] Seq=191299 Ack=11860 Win=1452 Len=0 TSval=2670381141 TSecr=1064928057"
"5.439612","172.18.0.2","54.38.73.16","TLSv1.2","611","Application Data"
"5.463770","54.38.73.16","172.18.0.2","TLSv1.2","611","Application Data"
"5.463811","172.18.0.2","54.38.73.16","TLSv1.2","611","Application Data"
"5.527324","54.38.73.16","172.18.0.2","TCP","68","21002 → 36876 [ACK] Seq=191842 Ack=12946 Win=1452 Len=0 TSval=2670381163 TSecr=1064928105"
"5.824587","54.38.73.16","172.18.0.2","TLSv1.2","611","Application Data"
"5.825630","172.18.0.2","54.38.73.16","TLSv1.2","611","Application Data"
"5.849347","54.38.73.16","172.18.0.2","TCP","68","21002 → 36876 [ACK] Seq=192385 Ack=13489 Win=1452 Len=0 TSval=2670381243 TSecr=1064928467"
"6.173689","54.38.73.16","172.18.0.2","TLSv1.2","3695","Application Data"
"6.173873","172.18.0.2","54.38.73.16","TCP","68","36876 → 21002 [ACK] Seq=13489 Ack=196012 Win=5584 Len=0 TSval=1064928815 TSecr=2670381324"
"6.193775","54.38.73.16","172.18.0.2","TCP","2964","[TCP segment of a reassembled PDU]"
"6.193800","172.18.0.2","54.38.73.16","TCP","68","36876 → 21002 [ACK] Seq=13489 Ack=198908 Win=5595 Len=0 TSval=1064928835 TSecr=2670381329"
"6.198534","54.38.73.16","172.18.0.2","TLSv1.2","799","Application Data"
"6.204444","54.38.73.16","172.18.0.2","TCP","2964","[TCP segment of a reassembled PDU]"
"6.204469","172.18.0.2","54.38.73.16","TCP","68","36876 → 21002 [ACK] Seq=13489 Ack=202535 Win=5595 Len=0 TSval=1064928846 TSecr=2670381331"
"6.213761","54.38.73.16","172.18.0.2","TLSv1.2","2964","Application Data, Application Data"
"6.213786","172.18.0.2","54.38.73.16","TCP","68","36876 → 21002 [ACK] Seq=13489 Ack=205431 Win=5595 Len=0 TSval=1064928855 TSecr=2670381334"
"6.214035","54.38.73.16","172.18.0.2","TLSv1.2","2964","Application Data [TCP segment of a reassembled PDU]"
"6.214165","172.18.0.2","54.38.73.16","TCP","68","36876 → 21002 [ACK] Seq=13489 Ack=208327 Win=5579 Len=0 TSval=1064928856 TSecr=2670381334"
"6.225977","54.38.73.16","172.18.0.2","TLSv1.2","2964","Application Data [TCP segment of a reassembled PDU]"
"6.226001","172.18.0.2","54.38.73.16","TCP","68","36876 → 21002 [ACK] Seq=13489 Ack=211223 Win=5595 Len=0 TSval=1064928867 TSecr=2670381337"
"6.229502","54.38.73.16","172.18.0.2","TLSv1.2","1508","Application Data, Application Data"
"6.234637","54.38.73.16","172.18.0.2","TLSv1.2","4412","Application Data"
"6.234804","172.18.0.2","54.38.73.16","TCP","68","36876 → 21002 [ACK] Seq=13489 Ack=217007 Win=5579 Len=0 TSval=1064928876 TSecr=2670381338"
"6.239267","54.38.73.16","172.18.0.2","TCP","2964","21002 → 36876 [ACK] Seq=217007 Ack=13489 Win=1452 Len=2896 TSval=2670381341 TSecr=1064928855 [TCP segment of a reassembled PDU]"
"6.239291","172.18.0.2","54.38.73.16","TCP","68","36876 → 21002 [ACK] Seq=13489 Ack=219903 Win=5595 Len=0 TSval=1064928881 TSecr=2670381341"
"6.257534","54.38.73.16","172.18.0.2","TLSv1.2","4412","Application Data, Application Data"
"6.257705","172.18.0.2","54.38.73.16","TCP","68","36876 → 21002 [ACK] Seq=13489 Ack=224247 Win=5579 Len=0 TSval=1064928899 TSecr=2670381345"
"6.258142","172.18.0.2","54.38.73.16","TLSv1.2","611","Application Data"
"6.258743","54.38.73.16","172.18.0.2","TLSv1.2","422","Application Data"
"6.284160","54.38.73.16","172.18.0.2","TCP","68","21002 → 36876 [ACK] Seq=224601 Ack=14032 Win=1452 Len=0 TSval=2670381351 TSecr=1064928900"
"6.288853","54.38.73.16","172.18.0.2","TCP","2964","[TCP segment of a reassembled PDU]"
"6.288876","172.18.0.2","54.38.73.16","TCP","68","36876 → 21002 [ACK] Seq=14032 Ack=227497 Win=5595 Len=0 TSval=1064928930 TSecr=2670381346"
"6.314339","54.38.73.16","172.18.0.2","TLSv1.2","285","Application Data"
"6.327052","54.38.73.16","172.18.0.2","TCP","2964","[TCP segment of a reassembled PDU]"
"6.327077","172.18.0.2","54.38.73.16","TCP","68","36876 → 21002 [ACK] Seq=14032 Ack=230610 Win=5595 Len=0 TSval=1064928969 TSecr=2670381359"
"6.351873","54.38.73.16","172.18.0.2","TLSv1.2","285","Application Data"
"6.352582","172.18.0.2","54.38.73.16","TLSv1.2","611","Application Data"
"6.415297","54.38.73.16","172.18.0.2","TCP","68","21002 → 36876 [ACK] Seq=230827 Ack=14575 Win=1452 Len=0 TSval=2670381385 TSecr=1064928994"
"6.415329","172.18.0.2","54.38.73.16","TLSv1.2","611","Application Data"
"6.438924","54.38.73.16","172.18.0.2","TCP","68","21002 → 36876 [ACK] Seq=230827 Ack=15118 Win=1452 Len=0 TSval=2670381391 TSecr=1064929057"
"6.746784","54.38.73.16","172.18.0.2","TLSv1.2","611","Application Data"
"6.747785","172.18.0.2","54.38.73.16","TLSv1.2","611","Application Data"
"6.771286","54.38.73.16","172.18.0.2","TCP","68","21002 → 36876 [ACK] Seq=231370 Ack=15661 Win=1452 Len=0 TSval=2670381474 TSecr=1064929389"
"7.097060","54.38.73.16","172.18.0.2","TLSv1.2","3695","Application Data"
"7.097222","172.18.0.2","54.38.73.16","TCP","68","36876 → 21002 [ACK] Seq=15661 Ack=234997 Win=5584 Len=0 TSval=1064929739 TSecr=2670381555"
"7.128667","54.38.73.16","172.18.0.2","TCP","2964","[TCP segment of a reassembled PDU]"
"7.128692","172.18.0.2","54.38.73.16","TCP","68","36876 → 21002 [ACK] Seq=15661 Ack=237893 Win=5595 Len=0 TSval=1064929770 TSecr=2670381563"
"7.128849","54.38.73.16","172.18.0.2","TLSv1.2","799","Application Data"
"7.137761","54.38.73.16","172.18.0.2","TCP","2964","[TCP segment of a reassembled PDU]"
"7.137785","172.18.0.2","54.38.73.16","TCP","68","36876 → 21002 [ACK] Seq=15661 Ack=241520 Win=5595 Len=0 TSval=1064929779 TSecr=2670381563"
"7.138141","54.38.73.16","172.18.0.2","TLSv1.2","2964","Application Data [TCP segment of a reassembled PDU]"
"7.138161","172.18.0.2","54.38.73.16","TCP","68","36876 → 21002 [ACK] Seq=15661 Ack=244416 Win=5595 Len=0 TSval=1064929780 TSecr=2670381565"
"7.138776","54.38.73.16","172.18.0.2","TLSv1.2","1516","Application Data [TCP segment of a reassembled PDU]"
"7.149800","54.38.73.16","172.18.0.2","TLSv1.2","2964","Application Data [TCP segment of a reassembled PDU]"
"7.149825","172.18.0.2","54.38.73.16","TCP","68","36876 → 21002 [ACK] Seq=15661 Ack=248760 Win=5595 Len=0 TSval=1064929791 TSecr=2670381565"
"7.152491","54.38.73.16","172.18.0.2","TCP","1516","21002 → 36876 [ACK] Seq=248760 Ack=15661 Win=1452 Len=1448 TSval=2670381569 TSecr=1064929770 [TCP segment of a reassembled PDU]"
"7.161635","54.38.73.16","172.18.0.2","TLSv1.2","965","Application Data, Application Data"
"7.161808","172.18.0.2","54.38.73.16","TCP","68","36876 → 21002 [ACK] Seq=15661 Ack=251105 Win=5593 Len=0 TSval=1064929803 TSecr=2670381569"
"7.170234","54.38.73.16","172.18.0.2","TLSv1.2","5860","Application Data"
"7.170411","172.18.0.2","54.38.73.16","TCP","68","36876 → 21002 [ACK] Seq=15661 Ack=256897 Win=5580 Len=0 TSval=1064929812 TSecr=2670381573"
"7.173565","54.38.73.16","172.18.0.2","TCP","1516","21002 → 36876 [ACK] Seq=256897 Ack=15661 Win=1452 Len=1448 TSval=2670381574 TSecr=1064929791 [TCP segment of a reassembled PDU]"
"7.181139","54.38.73.16","172.18.0.2","TLSv1.2","4412","Application Data [TCP segment of a reassembled PDU]"
"7.181309","172.18.0.2","54.38.73.16","TCP","68","36876 → 21002 [ACK] Seq=15661 Ack=262689 Win=5579 Len=0 TSval=1064929823 TSecr=2670381574"
"7.181733","172.18.0.2","54.38.73.16","TLSv1.2","611","Application Data"
"7.185349","54.38.73.16","172.18.0.2","TLSv1.2","2964","Application Data, Application Data"
"7.185373","172.18.0.2","54.38.73.16","TCP","68","36876 → 21002 [ACK] Seq=16204 Ack=265585 Win=5595 Len=0 TSval=1064929827 TSecr=2670381577"
"7.194973","54.38.73.16","172.18.0.2","TLSv1.2","5860","Application Data, Application Data"
"7.195140","172.18.0.2","54.38.73.16","TCP","68","36876 → 21002 [ACK] Seq=16204 Ack=271377 Win=5580 Len=0 TSval=1064929837 TSecr=2670381579"
"7.205665","54.38.73.16","172.18.0.2","TCP","68","[TCP Previous segment not captured] 21002 → 36876 [ACK] Seq=277169 Ack=16204 Win=1452 Len=0 TSval=2670381582 TSecr=1064929823"
"7.205688","54.38.73.16","172.18.0.2","TCP","5860","[TCP Retransmission] 21002 → 36876 [ACK] Seq=271377 Ack=15661 Win=1452 Len=5792 TSval=2670381582 TSecr=1064929823"
"7.205702","172.18.0.2","54.38.73.16","TCP","68","36876 → 21002 [ACK] Seq=16204 Ack=277169 Win=5580 Len=0 TSval=1064929847 TSecr=2670381582"
"7.209947","54.38.73.16","172.18.0.2","TLSv1.2","2964","Ignored Unknown Record"
"7.209972","172.18.0.2","54.38.73.16","TCP","68","36876 → 21002 [ACK] Seq=16204 Ack=280065 Win=5595 Len=0 TSval=1064929851 TSecr=2670381583"
"7.223693","54.38.73.16","172.18.0.2","TLSv1.2","1516","Ignored Unknown Record"
"7.234999","54.38.73.16","172.18.0.2","TCP","5445","[TCP segment of a reassembled PDU]"
"7.235170","172.18.0.2","54.38.73.16","TCP","68","36876 → 21002 [ACK] Seq=16204 Ack=286890 Win=5582 Len=0 TSval=1064929877 TSecr=2670381587"
"7.235860","172.18.0.2","54.38.73.16","TLSv1.2","1125","Application Data"
"7.267232","54.38.73.16","172.18.0.2","TCP","2667","21002 → 36876 [PSH, ACK] Seq=286890 Ack=17261 Win=1452 Len=2599 TSval=2670381597 TSecr=1064929877 [TCP segment of a reassembled PDU]"
"7.267282","172.18.0.2","54.38.73.16","TCP","68","36876 → 21002 [ACK] Seq=17261 Ack=289489 Win=5596 Len=0 TSval=1064929909 TSecr=2670381597"
"7.276827","172.18.0.2","54.38.73.16","TLSv1.2","611","Application Data"
"7.343620","54.38.73.16","172.18.0.2","TCP","68","21002 → 36876 [ACK] Seq=289489 Ack=17804 Win=1452 Len=0 TSval=2670381617 TSecr=1064929918"
"7.565290","54.38.73.16","172.18.0.2","TCP","611","21002 → 36876 [PSH, ACK] Seq=289489 Ack=17804 Win=1452 Len=543 TSval=2670381670 TSecr=1064929918 [TCP segment of a reassembled PDU]"
"7.566199","172.18.0.2","54.38.73.16","TLSv1.2","611","Application Data"
"7.590638","54.38.73.16","172.18.0.2","TCP","68","21002 → 36876 [ACK] Seq=290032 Ack=18347 Win=1452 Len=0 TSval=2670381678 TSecr=1064930208"
"7.975971","54.38.73.16","172.18.0.2","TCP","3695","21002 → 36876 [PSH, ACK] Seq=290032 Ack=18347 Win=1452 Len=3627 TSval=2670381766 TSecr=1064930208 [TCP segment of a reassembled PDU]"
"7.976008","54.38.73.16","172.18.0.2","TCP","8756","21002 → 36876 [ACK] Seq=293659 Ack=18347 Win=1452 Len=8688 TSval=2670381771 TSecr=1064930208 [TCP segment of a reassembled PDU]"
"7.976152","172.18.0.2","54.38.73.16","TCP","68","36876 → 21002 [ACK] Seq=18347 Ack=302347 Win=5534 Len=0 TSval=1064930618 TSecr=2670381766"
"8.000288","54.38.73.16","172.18.0.2","TCP","1776","21002 → 36876 [PSH, ACK] Seq=302347 Ack=18347 Win=1452 Len=1708 TSval=2670381781 TSecr=1064930618 [TCP segment of a reassembled PDU]"
"8.000313","172.18.0.2","54.38.73.16","TCP","68","36876 → 21002 [ACK] Seq=18347 Ack=304055 Win=5600 Len=0 TSval=1064930642 TSecr=2670381781"
"8.005629","172.18.0.2","54.38.73.16","TLSv1.2","611","Application Data"
"8.030733","54.38.73.16","172.18.0.2","TCP","68","21002 → 36876 [ACK] Seq=304055 Ack=18890 Win=1452 Len=0 TSval=2670381788 TSecr=1064930647"
"8.298443","54.38.73.16","172.18.0.2","TCP","611","21002 → 36876 [PSH, ACK] Seq=304055 Ack=18890 Win=1452 Len=543 TSval=2670381855 TSecr=1064930647 [TCP segment of a reassembled PDU]"
"8.299436","172.18.0.2","54.38.73.16","TLSv1.2","611","Application Data"
"8.323865","54.38.73.16","172.18.0.2","TCP","68","21002 → 36876 [ACK] Seq=304598 Ack=19433 Win=1452 Len=0 TSval=2670381862 TSecr=1064930941"
"8.619225","54.38.73.16","172.18.0.2","TLSv1.2","611","Encrypted Alert, Ignored Unknown Record"
"8.661163","172.18.0.2","54.38.73.16","TCP","68","36876 → 21002 [ACK] Seq=19433 Ack=305141 Win=5612 Len=0 TSval=1064931303 TSecr=2670381935"
"8.677586","54.38.73.16","172.18.0.2","TCP","2964","[TCP segment of a reassembled PDU]"
"8.677629","172.18.0.2","54.38.73.16","TCP","68","36876 → 21002 [ACK] Seq=19433 Ack=308037 Win=5595 Len=0 TSval=1064931319 TSecr=2670381950"
"8.687599","54.38.73.16","172.18.0.2","TLSv1.2","799","Application Data"
"8.687623","172.18.0.2","54.38.73.16","TCP","68","36876 → 21002 [ACK] Seq=19433 Ack=308768 Win=5593 Len=0 TSval=1064931329 TSecr=2670381952"
"8.696379","54.38.73.16","172.18.0.2","TCP","2964","[TCP segment of a reassembled PDU]"
"8.696404","172.18.0.2","54.38.73.16","TCP","68","36876 → 21002 [ACK] Seq=19433 Ack=311664 Win=5595 Len=0 TSval=1064931338 TSecr=2670381955"
"8.711332","54.38.73.16","172.18.0.2","TLSv1.2","799","Application Data"
"8.711357","172.18.0.2","54.38.73.16","TCP","68","36876 → 21002 [ACK] Seq=19433 Ack=312395 Win=5593 Len=0 TSval=1064931353 TSecr=2670381959"
"8.738886","54.38.73.16","172.18.0.2","TLSv1.2","611","Application Data"
"8.738911","172.18.0.2","54.38.73.16","TCP","68","36876 → 21002 [ACK] Seq=19433 Ack=312938 Win=5593 Len=0 TSval=1064931380 TSecr=2670381965"
"8.897150","54.38.73.16","172.18.0.2","TLSv1.2","1639","Application Data"
"8.897180","172.18.0.2","54.38.73.16","TCP","68","36876 → 21002 [ACK] Seq=19433 Ack=314509 Win=5581 Len=0 TSval=1064931539 TSecr=2670382001"
"8.903942","172.18.0.2","54.38.73.16","TLSv1.2","611","Application Data"
"8.927560","54.38.73.16","172.18.0.2","TCP","68","21002 → 36876 [ACK] Seq=314509 Ack=19976 Win=1452 Len=0 TSval=2670382013 TSecr=1064931545"
"9.306362","54.38.73.16","172.18.0.2","TLSv1.2","611","Application Data"
"9.306406","172.18.0.2","54.38.73.16","TCP","68","36876 → 21002 [ACK] Seq=19976 Ack=315052 Win=5608 Len=0 TSval=1064931948 TSecr=2670382085"
"9.307380","172.18.0.2","54.38.73.16","TLSv1.2","611","Application Data"
"9.331308","54.38.73.16","172.18.0.2","TCP","68","21002 → 36876 [ACK] Seq=315052 Ack=20519 Win=1452 Len=0 TSval=2670382114 TSecr=1064931949"
"9.681358","54.38.73.16","172.18.0.2","TLSv1.2","3695","Application Data"
"9.681402","172.18.0.2","54.38.73.16","TCP","68","36876 → 21002 [ACK] Seq=20519 Ack=318679 Win=5584 Len=0 TSval=1064932323 TSecr=2670382201"
"9.700426","54.38.73.16","172.18.0.2","TCP","2964","[TCP segment of a reassembled PDU]"
"9.700451","172.18.0.2","54.38.73.16","TCP","68","36876 → 21002 [ACK] Seq=20519 Ack=321575 Win=5595 Len=0 TSval=1064932342 TSecr=2670382206"
"9.706300","54.38.73.16","172.18.0.2","TLSv1.2","799","Application Data"
"9.706324","172.18.0.2","54.38.73.16","TCP","68","36876 → 21002 [ACK] Seq=20519 Ack=322306 Win=5593 Len=0 TSval=1064932348 TSecr=2670382207"
"9.710403","54.38.73.16","172.18.0.2","TLSv1.2","7308","Application Data"
"9.710468","172.18.0.2","54.38.73.16","TCP","68","36876 → 21002 [ACK] Seq=20519 Ack=329546 Win=5564 Len=0 TSval=1064932352 TSecr=2670382208"
"9.722336","54.38.73.16","172.18.0.2","TLSv1.2","2964","Application Data, Application Data"
"9.722370","172.18.0.2","54.38.73.16","TCP","68","36876 → 21002 [ACK] Seq=20519 Ack=332442 Win=5595 Len=0 TSval=1064932364 TSecr=2670382211"
"9.724658","54.38.73.16","172.18.0.2","TCP","1516","21002 → 36876 [ACK] Seq=332442 Ack=20519 Win=1452 Len=1448 TSval=2670382212 TSecr=1064932342 [TCP segment of a reassembled PDU]"
"9.724686","172.18.0.2","54.38.73.16","TCP","68","36876 → 21002 [ACK] Seq=20519 Ack=333890 Win=5593 Len=0 TSval=1064932366 TSecr=2670382212"
"9.731654","54.38.73.16","172.18.0.2","TLSv1.2","965","Application Data, Application Data"
"9.731682","172.18.0.2","54.38.73.16","TCP","68","36876 → 21002 [ACK] Seq=20519 Ack=334787 Win=5593 Len=0 TSval=1064932373 TSecr=2670382213"
"9.732047","54.38.73.16","172.18.0.2","TCP","1516","[TCP segment of a reassembled PDU]"
"9.732073","172.18.0.2","54.38.73.16","TCP","68","36876 → 21002 [ACK] Seq=20519 Ack=336235 Win=5582 Len=0 TSval=1064932374 TSecr=2670382214"
"9.738166","54.38.73.16","172.18.0.2","TLSv1.2","5860","Application Data [TCP segment of a reassembled PDU]"
"9.738192","172.18.0.2","54.38.73.16","TCP","68","36876 → 21002 [ACK] Seq=20519 Ack=342027 Win=5580 Len=0 TSval=1064932380 TSecr=2670382215"
"9.738752","172.18.0.2","54.38.73.16","TLSv1.2","611","Application Data"
"9.745043","54.38.73.16","172.18.0.2","TLSv1.2","1516","Application Data [TCP segment of a reassembled PDU]"
"9.746876","54.38.73.16","172.18.0.2","TCP","1516","21002 → 36876 [ACK] Seq=343475 Ack=20519 Win=1452 Len=1448 TSval=2670382217 TSecr=1064932364 [TCP segment of a reassembled PDU]"
"9.746904","172.18.0.2","54.38.73.16","TCP","68","36876 → 21002 [ACK] Seq=21062 Ack=344923 Win=5593 Len=0 TSval=1064932388 TSecr=2670382217"
"9.749167","54.38.73.16","172.18.0.2","TLSv1.2","2964","Application Data [TCP segment of a reassembled PDU]"
"9.749199","172.18.0.2","54.38.73.16","TCP","68","36876 → 21002 [ACK] Seq=21062 Ack=347819 Win=5595 Len=0 TSval=1064932391 TSecr=2670382218"
"9.756915","54.38.73.16","172.18.0.2","TLSv1.2","2964","Application Data [TCP segment of a reassembled PDU]"
"9.756944","172.18.0.2","54.38.73.16","TCP","68","36876 → 21002 [ACK] Seq=21062 Ack=350715 Win=5595 Len=0 TSval=1064932398 TSecr=2670382220"
"9.765583","54.38.73.16","172.18.0.2","TCP","68","[TCP Previous segment not captured] 21002 → 36876 [ACK] Seq=359403 Ack=21062 Win=1452 Len=0 TSval=2670382222 TSecr=1064932380"
"9.765620","172.18.0.2","54.38.73.16","TLSv1.2","611","Application Data"
"9.765631","54.38.73.16","172.18.0.2","TCP","8756","[TCP Retransmission] 21002 → 36876 [ACK] Seq=350715 Ack=20519 Win=1452 Len=8688 TSval=2670382221 TSecr=1064932380"
"9.765812","172.18.0.2","54.38.73.16","TCP","68","36876 → 21002 [ACK] Seq=21605 Ack=359403 Win=5565 Len=0 TSval=1064932407 TSecr=2670382220"
"9.773201","54.38.73.16","172.18.0.2","TLSv1.2","2955","Ignored Unknown Record"
"9.773228","172.18.0.2","54.38.73.16","TCP","68","36876 → 21002 [ACK] Seq=21605 Ack=362290 Win=5595 Len=0 TSval=1064932415 TSecr=2670382224"
"9.778313","54.38.73.16","172.18.0.2","TCP","1516","[TCP segment of a reassembled PDU]"
"9.799147","54.38.73.16","172.18.0.2","TLSv1.2","191","Application Data"
"9.799356","172.18.0.2","54.38.73.16","TCP","68","36876 → 21002 [ACK] Seq=21605 Ack=363861 Win=5612 Len=0 TSval=1064932441 TSecr=2670382225"
"9.818675","54.38.73.16","172.18.0.2","TCP","2964","[TCP segment of a reassembled PDU]"
"9.818856","172.18.0.2","54.38.73.16","TCP","68","36876 → 21002 [ACK] Seq=21605 Ack=366757 Win=5595 Len=0 TSval=1064932460 TSecr=2670382235"
"9.823991","54.38.73.16","172.18.0.2","TLSv1.2","1342","Application Data, Application Data"
"9.824486","172.18.0.2","54.38.73.16","TLSv1.2","611","Application Data"
"9.886417","54.38.73.16","172.18.0.2","TCP","68","21002 → 36876 [ACK] Seq=368031 Ack=22148 Win=1452 Len=0 TSval=2670382253 TSecr=1064932466"
"9.886466","172.18.0.2","54.38.73.16","TLSv1.2","611","Application Data"
"9.911219","54.38.73.16","172.18.0.2","TCP","68","21002 → 36876 [ACK] Seq=368031 Ack=22691 Win=1452 Len=0 TSval=2670382258 TSecr=1064932528"
"10.228085","54.38.73.16","172.18.0.2","TLSv1.2","611","Application Data"
"10.229241","172.18.0.2","54.38.73.16","TLSv1.2","611","Application Data"
"10.252804","54.38.73.16","172.18.0.2","TCP","68","21002 → 36876 [ACK] Seq=368574 Ack=23234 Win=1452 Len=0 TSval=2670382344 TSecr=1064932871"
"10.561960","54.38.73.16","172.18.0.2","TLSv1.2","611","Application Data"
"10.584849","54.38.73.16","172.18.0.2","TCP","2964","[TCP segment of a reassembled PDU]"
"10.585102","172.18.0.2","54.38.73.16","TCP","68","36876 → 21002 [ACK] Seq=23234 Ack=372013 Win=5595 Len=0 TSval=1064933227 TSecr=2670382421"
"10.606674","54.38.73.16","172.18.0.2","TLSv1.2","4412","Application Data [TCP segment of a reassembled PDU]"
"10.606867","172.18.0.2","54.38.73.16","TCP","68","36876 → 21002 [ACK] Seq=23234 Ack=376357 Win=5579 Len=0 TSval=1064933248 TSecr=2670382432"
"10.609097","54.38.73.16","172.18.0.2","TLSv1.2","1139","Application Data, Application Data"
"10.618760","54.38.73.16","172.18.0.2","TLSv1.2","10204","Application Data, Application Data"
"10.619000","172.18.0.2","54.38.73.16","TCP","68","36876 → 21002 [ACK] Seq=23234 Ack=387564 Win=5549 Len=0 TSval=1064933260 TSecr=2670382433"
"10.630807","54.38.73.16","172.18.0.2","TLSv1.2","2964","Application Data [TCP segment of a reassembled PDU]"
"10.630834","172.18.0.2","54.38.73.16","TCP","68","36876 → 21002 [ACK] Seq=23234 Ack=390460 Win=5595 Len=0 TSval=1064933272 TSecr=2670382438"
"10.631546","54.38.73.16","172.18.0.2","TCP","1516","21002 → 36876 [ACK] Seq=390460 Ack=23234 Win=1452 Len=1448 TSval=2670382439 TSecr=1064933248 [TCP segment of a reassembled PDU]"
"10.644632","54.38.73.16","172.18.0.2","TLSv1.2","4751","Application Data, Application Data"
"10.644824","172.18.0.2","54.38.73.16","TCP","68","36876 → 21002 [ACK] Seq=23234 Ack=396591 Win=5585 Len=0 TSval=1064933286 TSecr=2670382439"
"10.645364","172.18.0.2","54.38.73.16","TLSv1.2","611","Application Data"
"10.670465","54.38.73.16","172.18.0.2","TLSv1.2","1125","Application Data"
"10.670505","54.38.73.16","172.18.0.2","TCP","68","21002 → 36876 [ACK] Seq=397648 Ack=23777 Win=1452 Len=0 TSval=2670382448 TSecr=1064933287"
"10.670531","172.18.0.2","54.38.73.16","TLSv1.2","611","Application Data"
"10.695424","54.38.73.16","172.18.0.2","TCP","68","21002 → 36876 [ACK] Seq=397648 Ack=24320 Win=1452 Len=0 TSval=2670382454 TSecr=1064933312"
"10.695470","172.18.0.2","54.38.73.16","TLSv1.2","611","Application Data"
"10.720675","54.38.73.16","172.18.0.2","TCP","68","21002 → 36876 [ACK] Seq=397648 Ack=24863 Win=1452 Len=0 TSval=2670382461 TSecr=1064933337"
"11.049474","54.38.73.16","172.18.0.2","TLSv1.2","611","Application Data"
"11.050083","172.18.0.2","54.38.73.16","TLSv1.2","611","Application Data"
"11.073335","54.38.73.16","172.18.0.2","TCP","68","21002 → 36876 [ACK] Seq=398191 Ack=25406 Win=1452 Len=0 TSval=2670382549 TSecr=1064933692"
"11.383105","54.38.73.16","172.18.0.2","TLSv1.2","1125","Application Data"
"11.393593","54.38.73.16","172.18.0.2","TCP","2964","[TCP segment of a reassembled PDU]"
"11.393778","172.18.0.2","54.38.73.16","TCP","68","36876 → 21002 [ACK] Seq=25406 Ack=402144 Win=5595 Len=0 TSval=1064934035 TSecr=2670382626"
"11.404471","54.38.73.16","172.18.0.2","TLSv1.2","4412","Application Data [TCP segment of a reassembled PDU]"
"11.404671","172.18.0.2","54.38.73.16","TCP","68","36876 → 21002 [ACK] Seq=25406 Ack=406488 Win=5579 Len=0 TSval=1064934046 TSecr=2670382632"
"11.418335","54.38.73.16","172.18.0.2","TLSv1.2","625","Application Data, Application Data"
"11.426303","54.38.73.16","172.18.0.2","TCP","2964","[TCP segment of a reassembled PDU]"
"11.426331","172.18.0.2","54.38.73.16","TCP","68","36876 → 21002 [ACK] Seq=25406 Ack=409941 Win=5595 Len=0 TSval=1064934068 TSecr=2670382635"
"11.450865","54.38.73.16","172.18.0.2","TLSv1.2","4412","Application Data [TCP segment of a reassembled PDU]"
"11.451064","172.18.0.2","54.38.73.16","TCP","68","36876 → 21002 [ACK] Seq=25406 Ack=414285 Win=5579 Len=0 TSval=1064934093 TSecr=2670382643"
"11.453228","54.38.73.16","172.18.0.2","TLSv1.2","625","Application Data, Application Data"
"11.459501","54.38.73.16","172.18.0.2","TLSv1.2","4412","Application Data"
"11.459698","172.18.0.2","54.38.73.16","TCP","68","36876 → 21002 [ACK] Seq=25406 Ack=419186 Win=5578 Len=0 TSval=1064934101 TSecr=2670382644"
"11.461394","54.38.73.16","172.18.0.2","TLSv1.2","2964","Application Data [TCP segment of a reassembled PDU]"
"11.461425","172.18.0.2","54.38.73.16","TCP","68","36876 → 21002 [ACK] Seq=25406 Ack=422082 Win=5595 Len=0 TSval=1064934103 TSecr=2670382646"
"11.471236","54.38.73.16","172.18.0.2","TLSv1.2","2964","Application Data [TCP segment of a reassembled PDU]"
"11.471263","172.18.0.2","54.38.73.16","TCP","68","36876 → 21002 [ACK] Seq=25406 Ack=424978 Win=5595 Len=0 TSval=1064934113 TSecr=2670382648"
"11.477983","54.38.73.16","172.18.0.2","TLSv1.2","1516","Application Data [TCP segment of a reassembled PDU]"
"11.478072","54.38.73.16","172.18.0.2","TCP","1516","21002 → 36876 [ACK] Seq=426426 Ack=25406 Win=1452 Len=1448 TSval=2670382650 TSecr=1064934093 [TCP segment of a reassembled PDU]"
"11.478183","172.18.0.2","54.38.73.16","TCP","68","36876 → 21002 [ACK] Seq=25406 Ack=427874 Win=5577 Len=0 TSval=1064934120 TSecr=2670382650"
"11.478659","172.18.0.2","54.38.73.16","TLSv1.2","611","Application Data"
"11.482438","54.38.73.16","172.18.0.2","TCP","1516","21002 → 36876 [ACK] Seq=427874 Ack=25406 Win=1452 Len=1448 TSval=2670382651 TSecr=1064934093 [TCP segment of a reassembled PDU]"
"11.485637","54.38.73.16","172.18.0.2","TLSv1.2","5837","Application Data, Application Data, Application Data"
"11.485664","172.18.0.2","54.38.73.16","TCP","68","36876 → 21002 [ACK] Seq=25949 Ack=435091 Win=5580 Len=0 TSval=1064934127 TSecr=2670382651"
"11.492943","54.38.73.16","172.18.0.2","TCP","2964","[TCP segment of a reassembled PDU]"
"11.492970","172.18.0.2","54.38.73.16","TCP","68","36876 → 21002 [ACK] Seq=25949 Ack=437987 Win=5595 Len=0 TSval=1064934134 TSecr=2670382654"
"11.495974","54.38.73.16","172.18.0.2","TLSv1.2","1516","Application Data [TCP segment of a reassembled PDU]"
"11.504169","54.38.73.16","172.18.0.2","TCP","68","21002 → 36876 [ACK] Seq=439435 Ack=25949 Win=1452 Len=0 TSval=2670382657 TSecr=1064934120"
"11.504304","54.38.73.16","172.18.0.2","TLSv1.2","4412","Application Data [TCP segment of a reassembled PDU]"
"11.504492","172.18.0.2","54.38.73.16","TCP","68","36876 → 21002 [ACK] Seq=25949 Ack=443779 Win=5579 Len=0 TSval=1064934146 TSecr=2670382655"
"11.512132","54.38.73.16","172.18.0.2","TLSv1.2","2290","Application Data, Application Data"
"11.512161","172.18.0.2","54.38.73.16","TCP","68","36876 → 21002 [ACK] Seq=25949 Ack=446001 Win=5598 Len=0 TSval=1064934154 TSecr=2670382658"
"11.513085","172.18.0.2","54.38.73.16","TLSv1.2","611","Application Data"
"11.518217","54.38.73.16","172.18.0.2","TCP","2964","[TCP segment of a reassembled PDU]"
"11.518257","54.38.73.16","172.18.0.2","TLSv1.2","1516","Application Data [TCP segment of a reassembled PDU]"
"11.518418","172.18.0.2","54.38.73.16","TCP","68","36876 → 21002 [ACK] Seq=26492 Ack=450345 Win=5579 Len=0 TSval=1064934160 TSecr=2670382660"
"11.527718","54.38.73.16","172.18.0.2","TLSv1.2","2964","Application Data [TCP segment of a reassembled PDU]"
"11.527745","172.18.0.2","54.38.73.16","TCP","68","36876 → 21002 [ACK] Seq=26492 Ack=453241 Win=5595 Len=0 TSval=1064934169 TSecr=2670382662"
"11.528689","54.38.73.16","172.18.0.2","TLSv1.2","5860","Application Data [TCP segment of a reassembled PDU]"
"11.528845","172.18.0.2","54.38.73.16","TCP","68","36876 → 21002 [ACK] Seq=26492 Ack=459033 Win=5580 Len=0 TSval=1064934170 TSecr=2670382663"
"11.537097","54.38.73.16","172.18.0.2","TLSv1.2","516","Application Data"
"11.563969","54.38.73.16","172.18.0.2","TCP","2964","[TCP segment of a reassembled PDU]"
"11.564007","172.18.0.2","54.38.73.16","TLSv1.2","611","Application Data"
"11.588398","54.38.73.16","172.18.0.2","TLSv1.2","1342","Application Data, Application Data"
"11.629051","172.18.0.2","54.38.73.16","TCP","68","36876 → 21002 [ACK] Seq=27035 Ack=463651 Win=5612 Len=0 TSval=1064934271 TSecr=2670382678"
