_ws.col.Time,_ws.col.Source,_ws.col.Destination,_ws.col.Protocol,_ws.col.Length,_ws.col.Info
"0.000000","172.19.0.3","5.9.29.183","TLSv1.2","599","Application Data"
"0.000289","5.9.29.183","172.19.0.3","TCP","56","9002 → 43520 [ACK] Seq=1 Ack=544 Win=65535 Len=0"
"0.251827","5.9.29.183","172.19.0.3","TLSv1.2","599","Application Data"
"0.251906","172.19.0.3","5.9.29.183","TCP","56","43520 → 9002 [ACK] Seq=544 Ack=544 Win=11911 Len=0"
"0.252669","172.19.0.3","5.9.29.183","TLSv1.2","2141","Application Data"
"0.252906","5.9.29.183","172.19.0.3","TCP","56","9002 → 43520 [ACK] Seq=544 Ack=2004 Win=65535 Len=0"
"0.252970","5.9.29.183","172.19.0.3","TCP","56","9002 → 43520 [ACK] Seq=544 Ack=2629 Win=65535 Len=0"
"0.769898","5.9.29.183","172.19.0.3","TCP","1504","[TCP segment of a reassembled PDU]"
"0.770005","5.9.29.183","172.19.0.3","TLSv1.2","179","Application Data"
"0.770151","172.19.0.3","5.9.29.183","TCP","56","43520 → 9002 [ACK] Seq=2629 Ack=2115 Win=11903 Len=0"
"0.774321","172.19.0.3","5.9.29.183","TLSv1.2","599","Application Data"
"0.774606","5.9.29.183","172.19.0.3","TCP","56","9002 → 43520 [ACK] Seq=2115 Ack=3172 Win=65535 Len=0"
"1.002407","5.9.29.183","172.19.0.3","TLSv1.2","599","Application Data"
"1.003182","172.19.0.3","5.9.29.183","TLSv1.2","599","Application Data"
"1.003595","5.9.29.183","172.19.0.3","TCP","56","9002 → 43520 [ACK] Seq=2658 Ack=3715 Win=65535 Len=0"
"1.299495","5.9.29.183","172.19.0.3","TCP","1504","[TCP segment of a reassembled PDU]"
"1.299742","5.9.29.183","172.19.0.3","TCP","1504","9002 → 43520 [PSH, ACK] Seq=4106 Ack=3715 Win=65535 Len=1448 [TCP segment of a reassembled PDU]"
"1.299752","5.9.29.183","172.19.0.3","TLSv1.2","787","Application Data"
"1.299814","172.19.0.3","5.9.29.183","TCP","56","43520 → 9002 [ACK] Seq=3715 Ack=6285 Win=11895 Len=0"
"1.317679","5.9.29.183","172.19.0.3","TCP","1516","[TCP segment of a reassembled PDU]"
"1.317744","5.9.29.183","172.19.0.3","TCP","1516","9002 → 43520 [PSH, ACK] Seq=7745 Ack=3715 Win=65535 Len=1460 [TCP segment of a reassembled PDU]"
"1.317762","172.19.0.3","5.9.29.183","TCP","56","43520 → 9002 [ACK] Seq=3715 Ack=9205 Win=11903 Len=0"
"1.317765","5.9.29.183","172.19.0.3","TLSv1.2","763","Application Data"
"1.329731","5.9.29.183","172.19.0.3","TCP","1516","[TCP segment of a reassembled PDU]"
"1.329751","172.19.0.3","5.9.29.183","TCP","56","43520 → 9002 [ACK] Seq=3715 Ack=11372 Win=11911 Len=0"
"1.329794","5.9.29.183","172.19.0.3","TCP","1492","9002 → 43520 [PSH, ACK] Seq=11372 Ack=3715 Win=65535 Len=1436 [TCP segment of a reassembled PDU]"
"1.329803","5.9.29.183","172.19.0.3","TLSv1.2","1516","Application Data [TCP segment of a reassembled PDU]"
"1.329806","5.9.29.183","172.19.0.3","TCP","1516","9002 → 43520 [PSH, ACK] Seq=14268 Ack=3715 Win=65535 Len=1460 [TCP segment of a reassembled PDU]"
"1.329812","5.9.29.183","172.19.0.3","TCP","1480","9002 → 43520 [PSH, ACK] Seq=15728 Ack=3715 Win=65535 Len=1424 [TCP segment of a reassembled PDU]"
"1.329932","172.19.0.3","5.9.29.183","TCP","56","43520 → 9002 [ACK] Seq=3715 Ack=17152 Win=11879 Len=0"
"1.336588","5.9.29.183","172.19.0.3","TLSv1.2","584","Application Data"
"1.346998","5.9.29.183","172.19.0.3","TCP","1504","[TCP segment of a reassembled PDU]"
"1.347025","172.19.0.3","5.9.29.183","TCP","56","43520 → 9002 [ACK] Seq=3715 Ack=19128 Win=11911 Len=0"
"1.347454","5.9.29.183","172.19.0.3","TCP","1516","9002 → 43520 [PSH, ACK] Seq=19128 Ack=3715 Win=65535 Len=1460 [TCP segment of a reassembled PDU]"
"1.347505","5.9.29.183","172.19.0.3","TLSv1.2","1516","Application Data [TCP segment of a reassembled PDU]"
"1.347514","5.9.29.183","172.19.0.3","TCP","1516","9002 → 43520 [PSH, ACK] Seq=22048 Ack=3715 Win=65535 Len=1460 [TCP segment of a reassembled PDU]"
"1.347518","5.9.29.183","172.19.0.3","TCP","1516","9002 → 43520 [PSH, ACK] Seq=23508 Ack=3715 Win=65535 Len=1460 [TCP segment of a reassembled PDU]"
"1.347550","5.9.29.183","172.19.0.3","TLSv1.2","1516","Application Data [TCP segment of a reassembled PDU]"
"1.347554","5.9.29.183","172.19.0.3","TCP","1516","9002 → 43520 [PSH, ACK] Seq=26428 Ack=3715 Win=65535 Len=1460 [TCP segment of a reassembled PDU]"
"1.347560","5.9.29.183","172.19.0.3","TCP","1432","9002 → 43520 [PSH, ACK] Seq=27888 Ack=3715 Win=65535 Len=1376 [TCP segment of a reassembled PDU]"
"1.347625","172.19.0.3","5.9.29.183","TCP","56","43520 → 9002 [ACK] Seq=3715 Ack=29264 Win=11863 Len=0"
"1.347773","5.9.29.183","172.19.0.3","TLSv1.2","1516","Application Data [TCP segment of a reassembled PDU]"
"1.347787","5.9.29.183","172.19.0.3","TCP","1516","9002 → 43520 [PSH, ACK] Seq=30724 Ack=3715 Win=65535 Len=1460 [TCP segment of a reassembled PDU]"
"1.347881","5.9.29.183","172.19.0.3","TCP","1480","9002 → 43520 [PSH, ACK] Seq=32184 Ack=3715 Win=65535 Len=1424 [TCP segment of a reassembled PDU]"
"1.347940","172.19.0.3","5.9.29.183","TLSv1.2","599","Application Data"
"1.348180","5.9.29.183","172.19.0.3","TCP","56","9002 → 43520 [ACK] Seq=33608 Ack=4258 Win=65535 Len=0"
"1.352934","5.9.29.183","172.19.0.3","TLSv1.2","178","Application Data"
"1.358865","172.19.0.3","5.9.29.183","TLSv1.2","599","Application Data"
"1.359343","5.9.29.183","172.19.0.3","TCP","56","9002 → 43520 [ACK] Seq=33730 Ack=4801 Win=65535 Len=0"
"1.365827","5.9.29.183","172.19.0.3","TCP","1516","[TCP segment of a reassembled PDU]"
"1.365881","5.9.29.183","172.19.0.3","TCP","1516","9002 → 43520 [PSH, ACK] Seq=35190 Ack=4801 Win=65535 Len=1460 [TCP segment of a reassembled PDU]"
"1.365888","5.9.29.183","172.19.0.3","TLSv1.2","1516","Application Data [TCP segment of a reassembled PDU]"
"1.365891","5.9.29.183","172.19.0.3","TCP","1516","9002 → 43520 [PSH, ACK] Seq=38110 Ack=4801 Win=65535 Len=1460 [TCP segment of a reassembled PDU]"
"1.365894","5.9.29.183","172.19.0.3","TCP","1516","9002 → 43520 [PSH, ACK] Seq=39570 Ack=4801 Win=65535 Len=1460 [TCP segment of a reassembled PDU]"
"1.365897","5.9.29.183","172.19.0.3","TLSv1.2","1516","Application Data [TCP segment of a reassembled PDU]"
"1.365899","5.9.29.183","172.19.0.3","TCP","1516","9002 → 43520 [PSH, ACK] Seq=42490 Ack=4801 Win=65535 Len=1460 [TCP segment of a reassembled PDU]"
"1.365902","5.9.29.183","172.19.0.3","TCP","300","9002 → 43520 [PSH, ACK] Seq=43950 Ack=4801 Win=65535 Len=244 [TCP segment of a reassembled PDU]"
"1.365978","5.9.29.183","172.19.0.3","TCP","1176","9002 → 43520 [PSH, ACK] Seq=44194 Ack=4801 Win=65535 Len=1120 [TCP segment of a reassembled PDU]"
"1.366015","172.19.0.3","5.9.29.183","TCP","56","43520 → 9002 [ACK] Seq=4801 Ack=45314 Win=11847 Len=0"
"1.369183","5.9.29.183","172.19.0.3","TLSv1.2","381","Application Data"
"1.381447","5.9.29.183","172.19.0.3","TCP","1516","[TCP segment of a reassembled PDU]"
"1.381466","172.19.0.3","5.9.29.183","TCP","56","43520 → 9002 [ACK] Seq=4801 Ack=47099 Win=11911 Len=0"
"1.381513","5.9.29.183","172.19.0.3","TCP","1516","9002 → 43520 [PSH, ACK] Seq=47099 Ack=4801 Win=65535 Len=1460 [TCP segment of a reassembled PDU]"
"1.381550","5.9.29.183","172.19.0.3","TLSv1.2","1516","Application Data [TCP segment of a reassembled PDU]"
"1.381557","5.9.29.183","172.19.0.3","TCP","1516","9002 → 43520 [PSH, ACK] Seq=50019 Ack=4801 Win=65535 Len=1460 [TCP segment of a reassembled PDU]"
"1.381562","5.9.29.183","172.19.0.3","TCP","1516","9002 → 43520 [PSH, ACK] Seq=51479 Ack=4801 Win=65535 Len=1460 [TCP segment of a reassembled PDU]"
"1.381672","5.9.29.183","172.19.0.3","TLSv1.2","1444","Application Data [TCP segment of a reassembled PDU]"
"1.381677","5.9.29.183","172.19.0.3","TCP","1516","9002 → 43520 [PSH, ACK] Seq=54327 Ack=4801 Win=65535 Len=1460 [TCP segment of a reassembled PDU]"
"1.381678","172.19.0.3","5.9.29.183","TCP","56","43520 → 9002 [ACK] Seq=4801 Ack=52939 Win=11879 Len=0"
"1.381679","5.9.29.183","172.19.0.3","TCP","1492","9002 → 43520 [PSH, ACK] Seq=55787 Ack=4801 Win=65535 Len=1436 [TCP segment of a reassembled PDU]"
"1.381733","172.19.0.3","5.9.29.183","TCP","56","43520 → 9002 [ACK] Seq=4801 Ack=57223 Win=11853 Len=0"
"1.386001","5.9.29.183","172.19.0.3","TLSv1.2","381","Application Data"
"1.386358","172.19.0.3","5.9.29.183","TLSv1.2","599","Application Data"
"1.386655","5.9.29.183","172.19.0.3","TCP","56","9002 → 43520 [ACK] Seq=57548 Ack=5344 Win=65535 Len=0"
"1.398929","5.9.29.183","172.19.0.3","TCP","1516","[TCP segment of a reassembled PDU]"
"1.399037","5.9.29.183","172.19.0.3","TCP","1516","9002 → 43520 [PSH, ACK] Seq=59008 Ack=5344 Win=65535 Len=1460 [TCP segment of a reassembled PDU]"
"1.399048","5.9.29.183","172.19.0.3","TLSv1.2","1516","Application Data [TCP segment of a reassembled PDU]"
"1.399051","5.9.29.183","172.19.0.3","TCP","1516","9002 → 43520 [PSH, ACK] Seq=61928 Ack=5344 Win=65535 Len=1460 [TCP segment of a reassembled PDU]"
"1.399054","5.9.29.183","172.19.0.3","TCP","1516","9002 → 43520 [PSH, ACK] Seq=63388 Ack=5344 Win=65535 Len=1460 [TCP segment of a reassembled PDU]"
"1.399092","5.9.29.183","172.19.0.3","TLSv1.2","1516","Application Data [TCP segment of a reassembled PDU]"
"1.399101","5.9.29.183","172.19.0.3","TCP","1516","9002 → 43520 [PSH, ACK] Seq=66308 Ack=5344 Win=65535 Len=1460 [TCP segment of a reassembled PDU]"
"1.399171","5.9.29.183","172.19.0.3","TCP","1420","9002 → 43520 [PSH, ACK] Seq=67768 Ack=5344 Win=65535 Len=1364 [TCP segment of a reassembled PDU]"
"1.399178","172.19.0.3","5.9.29.183","TCP","56","43520 → 9002 [ACK] Seq=5344 Ack=67768 Win=11863 Len=0"
"1.402656","5.9.29.183","172.19.0.3","TLSv1.2","1438","Application Data, Application Data"
"1.402681","172.19.0.3","5.9.29.183","TCP","56","43520 → 9002 [ACK] Seq=5344 Ack=70514 Win=11911 Len=0"
"1.416110","5.9.29.183","172.19.0.3","TCP","1516","[TCP segment of a reassembled PDU]"
"1.416223","5.9.29.183","172.19.0.3","TCP","1516","9002 → 43520 [PSH, ACK] Seq=71974 Ack=5344 Win=65535 Len=1460 [TCP segment of a reassembled PDU]"
"1.416231","5.9.29.183","172.19.0.3","TLSv1.2","1516","Application Data [TCP segment of a reassembled PDU]"
"1.416234","5.9.29.183","172.19.0.3","TCP","1516","9002 → 43520 [PSH, ACK] Seq=74894 Ack=5344 Win=65535 Len=1460 [TCP segment of a reassembled PDU]"
"1.416237","5.9.29.183","172.19.0.3","TCP","1456","9002 → 43520 [PSH, ACK] Seq=76354 Ack=5344 Win=65535 Len=1400 [TCP segment of a reassembled PDU]"
"1.416319","5.9.29.183","172.19.0.3","TLSv1.2","1516","Application Data [TCP segment of a reassembled PDU]"
"1.416325","5.9.29.183","172.19.0.3","TCP","1516","9002 → 43520 [PSH, ACK] Seq=79214 Ack=5344 Win=65535 Len=1460 [TCP segment of a reassembled PDU]"
"1.416328","5.9.29.183","172.19.0.3","TCP","1516","9002 → 43520 [PSH, ACK] Seq=80674 Ack=5344 Win=65535 Len=1460 [TCP segment of a reassembled PDU]"
"1.416351","172.19.0.3","5.9.29.183","TCP","56","43520 → 9002 [ACK] Seq=5344 Ack=77754 Win=11879 Len=0"
"1.416352","5.9.29.183","172.19.0.3","TLSv1.2","1516","Application Data [TCP segment of a reassembled PDU]"
"1.416358","5.9.29.183","172.19.0.3","TCP","1516","9002 → 43520 [PSH, ACK] Seq=83594 Ack=5344 Win=65535 Len=1460 [TCP segment of a reassembled PDU]"
"1.416373","5.9.29.183","172.19.0.3","TCP","1444","9002 → 43520 [PSH, ACK] Seq=85054 Ack=5344 Win=65535 Len=1388 [TCP segment of a reassembled PDU]"
"1.416421","172.19.0.3","5.9.29.183","TCP","56","43520 → 9002 [ACK] Seq=5344 Ack=86442 Win=11828 Len=0"
"1.416715","172.19.0.3","5.9.29.183","TLSv1.2","599","Application Data"
"1.416912","5.9.29.183","172.19.0.3","TCP","56","9002 → 43520 [ACK] Seq=86442 Ack=5887 Win=65535 Len=0"
"1.419205","5.9.29.183","172.19.0.3","TLSv1.2","721","Application Data, Application Data"
"1.426296","172.19.0.3","5.9.29.183","TLSv1.2","1113","Application Data"
"1.426611","5.9.29.183","172.19.0.3","TCP","56","9002 → 43520 [ACK] Seq=87107 Ack=6944 Win=65535 Len=0"
"1.777862","5.9.29.183","172.19.0.3","TLSv1.2","599","Application Data"
"1.778751","172.19.0.3","5.9.29.183","TLSv1.2","599","Application Data"
"1.779035","5.9.29.183","172.19.0.3","TCP","56","9002 → 43520 [ACK] Seq=87650 Ack=7487 Win=65535 Len=0"
"2.039302","5.9.29.183","172.19.0.3","TLSv1.2","599","Application Data"
"2.049002","5.9.29.183","172.19.0.3","TCP","1516","[TCP segment of a reassembled PDU]"
"2.049027","172.19.0.3","5.9.29.183","TCP","56","43520 → 9002 [ACK] Seq=7487 Ack=89653 Win=11911 Len=0"
"2.049092","5.9.29.183","172.19.0.3","TCP","1516","9002 → 43520 [PSH, ACK] Seq=89653 Ack=7487 Win=65535 Len=1460 [TCP segment of a reassembled PDU]"
"2.049111","5.9.29.183","172.19.0.3","TLSv1.2","1480","Application Data [TCP segment of a reassembled PDU]"
"2.049252","172.19.0.3","5.9.29.183","TCP","56","43520 → 9002 [ACK] Seq=7487 Ack=92537 Win=11893 Len=0"
"2.050830","5.9.29.183","172.19.0.3","TLSv1.2","1516","Application Data [TCP segment of a reassembled PDU]"
"2.050871","5.9.29.183","172.19.0.3","TCP","1492","9002 → 43520 [PSH, ACK] Seq=93997 Ack=7487 Win=65535 Len=1436 [TCP segment of a reassembled PDU]"
"2.050881","172.19.0.3","5.9.29.183","TCP","56","43520 → 9002 [ACK] Seq=7487 Ack=95433 Win=11903 Len=0"
"2.054546","5.9.29.183","172.19.0.3","TLSv1.2","99","Application Data"
"2.069703","5.9.29.183","172.19.0.3","TLSv1.2","599","Application Data"
"2.069961","172.19.0.3","5.9.29.183","TCP","56","43520 → 9002 [ACK] Seq=7487 Ack=96019 Win=11911 Len=0"
"2.090411","5.9.29.183","172.19.0.3","TCP","1516","[TCP segment of a reassembled PDU]"
"2.090485","5.9.29.183","172.19.0.3","TLSv1.2","681","Application Data"
"2.090648","172.19.0.3","5.9.29.183","TCP","56","43520 → 9002 [ACK] Seq=7487 Ack=98104 Win=11903 Len=0"
"2.094647","172.19.0.3","5.9.29.183","TLSv1.2","599","Application Data"
"2.094937","5.9.29.183","172.19.0.3","TCP","56","9002 → 43520 [ACK] Seq=98104 Ack=8030 Win=65535 Len=0"
"2.336096","5.9.29.183","172.19.0.3","TLSv1.2","599","Application Data"
"2.336966","172.19.0.3","5.9.29.183","TLSv1.2","599","Application Data"
"2.337328","5.9.29.183","172.19.0.3","TCP","56","9002 → 43520 [ACK] Seq=98647 Ack=8573 Win=65535 Len=0"
"2.675305","5.9.29.183","172.19.0.3","TCP","1504","[TCP segment of a reassembled PDU]"
"2.675507","5.9.29.183","172.19.0.3","TCP","1504","9002 → 43520 [PSH, ACK] Seq=100095 Ack=8573 Win=65535 Len=1448 [TCP segment of a reassembled PDU]"
"2.675528","5.9.29.183","172.19.0.3","TLSv1.2","273","Application Data"
"2.675673","172.19.0.3","5.9.29.183","TCP","56","43520 → 9002 [ACK] Seq=8573 Ack=101760 Win=11895 Len=0"
"2.692001","5.9.29.183","172.19.0.3","TLSv1.2","599","Application Data"
"2.703933","5.9.29.183","172.19.0.3","TCP","1516","[TCP segment of a reassembled PDU]"
"2.703951","172.19.0.3","5.9.29.183","TCP","56","43520 → 9002 [ACK] Seq=8573 Ack=103763 Win=11911 Len=0"
"2.703994","5.9.29.183","172.19.0.3","TCP","1516","9002 → 43520 [PSH, ACK] Seq=103763 Ack=8573 Win=65535 Len=1460 [TCP segment of a reassembled PDU]"
"2.704034","5.9.29.183","172.19.0.3","TLSv1.2","1516","Application Data [TCP segment of a reassembled PDU]"
"2.704042","5.9.29.183","172.19.0.3","TCP","1516","9002 → 43520 [PSH, ACK] Seq=106683 Ack=8573 Win=65535 Len=1460 [TCP segment of a reassembled PDU]"
"2.704050","5.9.29.183","172.19.0.3","TCP","1516","9002 → 43520 [PSH, ACK] Seq=108143 Ack=8573 Win=65535 Len=1460 [TCP segment of a reassembled PDU]"
"2.704054","5.9.29.183","172.19.0.3","TCP","183","9002 → 43520 [PSH, ACK] Seq=109603 Ack=8573 Win=65535 Len=127 [TCP segment of a reassembled PDU]"
"2.704141","5.9.29.183","172.19.0.3","TLSv1.2","1516","Application Data [TCP segment of a reassembled PDU]"
"2.704146","5.9.29.183","172.19.0.3","TCP","1516","9002 → 43520 [PSH, ACK] Seq=111190 Ack=8573 Win=65535 Len=1460 [TCP segment of a reassembled PDU]"
"2.704149","5.9.29.183","172.19.0.3","TCP","1516","9002 → 43520 [PSH, ACK] Seq=112650 Ack=8573 Win=65535 Len=1460 [TCP segment of a reassembled PDU]"
"2.704151","5.9.29.183","172.19.0.3","TLSv1.2","1281","Application Data [TCP segment of a reassembled PDU]"
"2.704166","172.19.0.3","5.9.29.183","TCP","56","43520 → 9002 [ACK] Seq=8573 Ack=114110 Win=11847 Len=0"
"2.707385","5.9.29.183","172.19.0.3","TCP","1516","9002 → 43520 [PSH, ACK] Seq=115335 Ack=8573 Win=65535 Len=1460 [TCP segment of a reassembled PDU]"
"2.707405","172.19.0.3","5.9.29.183","TCP","56","43520 → 9002 [ACK] Seq=8573 Ack=116795 Win=11911 Len=0"
"2.707449","5.9.29.183","172.19.0.3","TCP","1492","9002 → 43520 [PSH, ACK] Seq=116795 Ack=8573 Win=65535 Len=1436 [TCP segment of a reassembled PDU]"
"2.718906","5.9.29.183","172.19.0.3","TLSv1.2","721","Application Data, Application Data"
"2.718929","172.19.0.3","5.9.29.183","TCP","56","43520 → 9002 [ACK] Seq=8573 Ack=118896 Win=11911 Len=0"
"2.719971","5.9.29.183","172.19.0.3","TCP","1504","[TCP segment of a reassembled PDU]"
"2.720087","5.9.29.183","172.19.0.3","TCP","1516","9002 → 43520 [PSH, ACK] Seq=120344 Ack=8573 Win=65535 Len=1460 [TCP segment of a reassembled PDU]"
"2.720097","5.9.29.183","172.19.0.3","TLSv1.2","1516","Application Data [TCP segment of a reassembled PDU]"
"2.720130","5.9.29.183","172.19.0.3","TCP","1516","9002 → 43520 [PSH, ACK] Seq=123264 Ack=8573 Win=65535 Len=1460 [TCP segment of a reassembled PDU]"
"2.720135","5.9.29.183","172.19.0.3","TCP","1516","9002 → 43520 [PSH, ACK] Seq=124724 Ack=8573 Win=65535 Len=1460 [TCP segment of a reassembled PDU]"
"2.720138","5.9.29.183","172.19.0.3","TLSv1.2","1456","Application Data [TCP segment of a reassembled PDU]"
"2.720160","172.19.0.3","5.9.29.183","TCP","56","43520 → 9002 [ACK] Seq=8573 Ack=127584 Win=11869 Len=0"
"2.720292","5.9.29.183","172.19.0.3","TCP","1516","9002 → 43520 [PSH, ACK] Seq=127584 Ack=8573 Win=65535 Len=1460 [TCP segment of a reassembled PDU]"
"2.720298","5.9.29.183","172.19.0.3","TCP","1492","9002 → 43520 [PSH, ACK] Seq=129044 Ack=8573 Win=65535 Len=1436 [TCP segment of a reassembled PDU]"
"2.720334","172.19.0.3","5.9.29.183","TCP","56","43520 → 9002 [ACK] Seq=8573 Ack=130480 Win=11853 Len=0"
"2.720364","5.9.29.183","172.19.0.3","TLSv1.2","1516","Application Data [TCP segment of a reassembled PDU]"
"2.720425","5.9.29.183","172.19.0.3","TCP","1492","9002 → 43520 [PSH, ACK] Seq=131940 Ack=8573 Win=65535 Len=1436 [TCP segment of a reassembled PDU]"
"2.720662","172.19.0.3","5.9.29.183","TLSv1.2","1113","Application Data"
"2.720907","5.9.29.183","172.19.0.3","TCP","56","9002 → 43520 [ACK] Seq=133376 Ack=9630 Win=65535 Len=0"
"2.734037","5.9.29.183","172.19.0.3","TLSv1.2","84","Application Data"
"2.735843","5.9.29.183","172.19.0.3","TCP","1504","[TCP segment of a reassembled PDU]"
"2.735873","172.19.0.3","5.9.29.183","TCP","56","43520 → 9002 [ACK] Seq=9630 Ack=134852 Win=11911 Len=0"
"2.736799","5.9.29.183","172.19.0.3","TCP","1516","9002 → 43520 [PSH, ACK] Seq=134852 Ack=9630 Win=65535 Len=1460 [TCP segment of a reassembled PDU]"
"2.736860","5.9.29.183","172.19.0.3","TLSv1.2","1516","Application Data [TCP segment of a reassembled PDU]"
"2.736874","5.9.29.183","172.19.0.3","TCP","1516","9002 → 43520 [PSH, ACK] Seq=137772 Ack=9630 Win=65535 Len=1460 [TCP segment of a reassembled PDU]"
"2.736883","5.9.29.183","172.19.0.3","TCP","1516","9002 → 43520 [PSH, ACK] Seq=139232 Ack=9630 Win=65535 Len=1460 [TCP segment of a reassembled PDU]"
"2.736922","5.9.29.183","172.19.0.3","TLSv1.2","1516","Application Data [TCP segment of a reassembled PDU]"
"2.736992","5.9.29.183","172.19.0.3","TCP","1516","9002 → 43520 [PSH, ACK] Seq=142152 Ack=9630 Win=65535 Len=1460 [TCP segment of a reassembled PDU]"
"2.736997","5.9.29.183","172.19.0.3","TCP","1516","9002 → 43520 [PSH, ACK] Seq=143612 Ack=9630 Win=65535 Len=1460 [TCP segment of a reassembled PDU]"
"2.736999","5.9.29.183","172.19.0.3","TLSv1.2","1420","Application Data [TCP segment of a reassembled PDU]"
"2.737001","5.9.29.183","172.19.0.3","TCP","1516","9002 → 43520 [PSH, ACK] Seq=146436 Ack=9630 Win=65535 Len=1460 [TCP segment of a reassembled PDU]"
"2.737002","172.19.0.3","5.9.29.183","TCP","56","43520 → 9002 [ACK] Seq=9630 Ack=142152 Win=11879 Len=0"
"2.737090","5.9.29.183","172.19.0.3","TCP","1492","9002 → 43520 [PSH, ACK] Seq=147896 Ack=9630 Win=65535 Len=1436 [TCP segment of a reassembled PDU]"
"2.737206","172.19.0.3","5.9.29.183","TCP","56","43520 → 9002 [ACK] Seq=9630 Ack=149332 Win=11836 Len=0"
"2.749032","5.9.29.183","172.19.0.3","TLSv1.2","178","Application Data"
"2.753366","172.19.0.3","5.9.29.183","TLSv1.2","599","Application Data"
"2.753676","5.9.29.183","172.19.0.3","TCP","56","9002 → 43520 [ACK] Seq=149454 Ack=10173 Win=65535 Len=0"
"3.112861","5.9.29.183","172.19.0.3","TLSv1.2","599","Application Data"
"3.114077","172.19.0.3","5.9.29.183","TLSv1.2","599","Application Data"
"3.114394","5.9.29.183","172.19.0.3","TCP","56","9002 → 43520 [ACK] Seq=149997 Ack=10716 Win=65535 Len=0"
"3.367916","5.9.29.183","172.19.0.3","TCP","1504","[TCP segment of a reassembled PDU]"
"3.368350","5.9.29.183","172.19.0.3","TCP","1504","9002 → 43520 [PSH, ACK] Seq=151445 Ack=10716 Win=65535 Len=1448 [TCP segment of a reassembled PDU]"
"3.368365","172.19.0.3","5.9.29.183","TCP","56","43520 → 9002 [ACK] Seq=10716 Ack=152893 Win=11911 Len=0"
"3.368408","5.9.29.183","172.19.0.3","TLSv1.2","1237","Application Data"
"3.384348","5.9.29.183","172.19.0.3","TLSv1.2","149","Application Data"
"3.384667","172.19.0.3","5.9.29.183","TCP","56","43520 → 9002 [ACK] Seq=10716 Ack=154167 Win=11911 Len=0"
"3.384744","5.9.29.183","172.19.0.3","TCP","1504","[TCP segment of a reassembled PDU]"
"3.385039","5.9.29.183","172.19.0.3","TCP","1504","9002 → 43520 [PSH, ACK] Seq=155615 Ack=10716 Win=65535 Len=1448 [TCP segment of a reassembled PDU]"
"3.385050","172.19.0.3","5.9.29.183","TCP","56","43520 → 9002 [ACK] Seq=10716 Ack=157063 Win=11911 Len=0"
"3.397775","5.9.29.183","172.19.0.3","TLSv1.2","1504","Application Data, Application Data"
"3.397870","5.9.29.183","172.19.0.3","TCP","1516","9002 → 43520 [PSH, ACK] Seq=158511 Ack=10716 Win=65535 Len=1460 [TCP segment of a reassembled PDU]"
"3.397879","5.9.29.183","172.19.0.3","TCP","1516","9002 → 43520 [PSH, ACK] Seq=159971 Ack=10716 Win=65535 Len=1460 [TCP segment of a reassembled PDU]"
"3.397883","5.9.29.183","172.19.0.3","TLSv1.2","1516","Application Data [TCP segment of a reassembled PDU]"
"3.397919","5.9.29.183","172.19.0.3","TCP","1516","9002 → 43520 [PSH, ACK] Seq=162891 Ack=10716 Win=65535 Len=1460 [TCP segment of a reassembled PDU]"
"3.397924","5.9.29.183","172.19.0.3","TCP","1516","9002 → 43520 [PSH, ACK] Seq=164351 Ack=10716 Win=65535 Len=1460 [TCP segment of a reassembled PDU]"
"3.397927","5.9.29.183","172.19.0.3","TLSv1.2","1444","Application Data [TCP segment of a reassembled PDU]"
"3.398023","172.19.0.3","5.9.29.183","TCP","56","43520 → 9002 [ACK] Seq=10716 Ack=167199 Win=11863 Len=0"
"3.402146","5.9.29.183","172.19.0.3","TCP","1516","9002 → 43520 [PSH, ACK] Seq=167199 Ack=10716 Win=65535 Len=1460 [TCP segment of a reassembled PDU]"
"3.402216","5.9.29.183","172.19.0.3","TCP","1516","9002 → 43520 [PSH, ACK] Seq=168659 Ack=10716 Win=65535 Len=1460 [TCP segment of a reassembled PDU]"
"3.402234","172.19.0.3","5.9.29.183","TCP","56","43520 → 9002 [ACK] Seq=10716 Ack=170119 Win=11903 Len=0"
"3.402237","5.9.29.183","172.19.0.3","TLSv1.2","1516","Application Data [TCP segment of a reassembled PDU]"
"3.402242","5.9.29.183","172.19.0.3","TCP","1516","9002 → 43520 [PSH, ACK] Seq=171579 Ack=10716 Win=65535 Len=1460 [TCP segment of a reassembled PDU]"
"3.402245","5.9.29.183","172.19.0.3","TLSv1.2","890","Application Data"
"3.402367","172.19.0.3","5.9.29.183","TCP","56","43520 → 9002 [ACK] Seq=10716 Ack=173873 Win=11879 Len=0"
"3.412911","5.9.29.183","172.19.0.3","TCP","1449","[TCP segment of a reassembled PDU]"
"3.413011","5.9.29.183","172.19.0.3","TCP","1516","9002 → 43520 [PSH, ACK] Seq=175266 Ack=10716 Win=65535 Len=1460 [TCP segment of a reassembled PDU]"
"3.413075","172.19.0.3","5.9.29.183","TCP","56","43520 → 9002 [ACK] Seq=10716 Ack=176726 Win=11903 Len=0"
"3.413171","5.9.29.183","172.19.0.3","TLSv1.2","1516","Application Data [TCP segment of a reassembled PDU]"
"3.413174","5.9.29.183","172.19.0.3","TCP","87","9002 → 43520 [PSH, ACK] Seq=178186 Ack=10716 Win=65535 Len=31 [TCP segment of a reassembled PDU]"
"3.413176","5.9.29.183","172.19.0.3","TCP","1516","9002 → 43520 [PSH, ACK] Seq=178217 Ack=10716 Win=65535 Len=1460 [TCP segment of a reassembled PDU]"
"3.413178","5.9.29.183","172.19.0.3","TCP","1516","9002 → 43520 [PSH, ACK] Seq=179677 Ack=10716 Win=65535 Len=1460 [TCP segment of a reassembled PDU]"
"3.413179","5.9.29.183","172.19.0.3","TLSv1.2","1480","Application Data [TCP segment of a reassembled PDU]"
"3.413190","172.19.0.3","5.9.29.183","TCP","56","43520 → 9002 [ACK] Seq=10716 Ack=178217 Win=11909 Len=0"
"3.413243","172.19.0.3","5.9.29.183","TCP","56","43520 → 9002 [ACK] Seq=10716 Ack=182561 Win=11883 Len=0"
"3.413448","172.19.0.3","5.9.29.183","TLSv1.2","599","Application Data"
"3.413660","5.9.29.183","172.19.0.3","TCP","56","9002 → 43520 [ACK] Seq=182561 Ack=11259 Win=65535 Len=0"
"3.417768","5.9.29.183","172.19.0.3","TLSv1.2","193","Application Data"
"3.422694","172.19.0.3","5.9.29.183","TLSv1.2","599","Application Data"
"3.423201","5.9.29.183","172.19.0.3","TCP","56","9002 → 43520 [ACK] Seq=182698 Ack=11802 Win=65535 Len=0"
"3.431116","5.9.29.183","172.19.0.3","TCP","1516","[TCP segment of a reassembled PDU]"
"3.431202","5.9.29.183","172.19.0.3","TCP","1516","9002 → 43520 [PSH, ACK] Seq=184158 Ack=11802 Win=65535 Len=1460 [TCP segment of a reassembled PDU]"
"3.431209","5.9.29.183","172.19.0.3","TLSv1.2","1516","Application Data [TCP segment of a reassembled PDU]"
"3.431212","5.9.29.183","172.19.0.3","TCP","1468","9002 → 43520 [PSH, ACK] Seq=187078 Ack=11802 Win=65535 Len=1412 [TCP segment of a reassembled PDU]"
"3.431215","5.9.29.183","172.19.0.3","TCP","1516","9002 → 43520 [PSH, ACK] Seq=188490 Ack=11802 Win=65535 Len=1460 [TCP segment of a reassembled PDU]"
"3.431217","5.9.29.183","172.19.0.3","TLSv1.2","1516","Application Data [TCP segment of a reassembled PDU]"
"3.431220","5.9.29.183","172.19.0.3","TCP","1516","9002 → 43520 [PSH, ACK] Seq=191410 Ack=11802 Win=65535 Len=1460 [TCP segment of a reassembled PDU]"
"3.431240","5.9.29.183","172.19.0.3","TCP","1468","9002 → 43520 [PSH, ACK] Seq=192870 Ack=11802 Win=65535 Len=1412 [TCP segment of a reassembled PDU]"
"3.431246","5.9.29.183","172.19.0.3","TLSv1.2","1504","Application Data [TCP segment of a reassembled PDU]"
"3.431339","172.19.0.3","5.9.29.183","TCP","56","43520 → 9002 [ACK] Seq=11802 Ack=195730 Win=11847 Len=0"
"3.434418","5.9.29.183","172.19.0.3","TLSv1.2","1018","Application Data"
"3.451760","5.9.29.183","172.19.0.3","TCP","1516","[TCP segment of a reassembled PDU]"
"3.451781","172.19.0.3","5.9.29.183","TCP","56","43520 → 9002 [ACK] Seq=11802 Ack=198152 Win=11911 Len=0"
"3.451823","5.9.29.183","172.19.0.3","TLSv1.2","681","Application Data"
"3.455815","172.19.0.3","5.9.29.183","TLSv1.2","599","Application Data"
"3.456057","5.9.29.183","172.19.0.3","TCP","56","9002 → 43520 [ACK] Seq=198777 Ack=12345 Win=65535 Len=0"
"3.758272","5.9.29.183","172.19.0.3","TLSv1.2","599","Application Data"
"3.759119","172.19.0.3","5.9.29.183","TLSv1.2","599","Application Data"
"3.759484","5.9.29.183","172.19.0.3","TCP","56","9002 → 43520 [ACK] Seq=199320 Ack=12888 Win=65535 Len=0"
"3.998644","5.9.29.183","172.19.0.3","TCP","1504","[TCP segment of a reassembled PDU]"
"3.998722","5.9.29.183","172.19.0.3","TCP","1516","9002 → 43520 [PSH, ACK] Seq=200768 Ack=12888 Win=65535 Len=1460 [TCP segment of a reassembled PDU]"
"3.998730","5.9.29.183","172.19.0.3","TLSv1.2","775","Application Data"
"3.998845","172.19.0.3","5.9.29.183","TCP","56","43520 → 9002 [ACK] Seq=12888 Ack=202947 Win=11895 Len=0"
"4.009540","5.9.29.183","172.19.0.3","TCP","1516","[TCP segment of a reassembled PDU]"
"4.009586","5.9.29.183","172.19.0.3","TCP","1492","9002 → 43520 [PSH, ACK] Seq=204407 Ack=12888 Win=65535 Len=1436 [TCP segment of a reassembled PDU]"
"4.009599","172.19.0.3","5.9.29.183","TCP","56","43520 → 9002 [ACK] Seq=12888 Ack=205843 Win=11903 Len=0"
"4.009601","5.9.29.183","172.19.0.3","TLSv1.2","1504","Application Data [TCP segment of a reassembled PDU]"
"4.014092","5.9.29.183","172.19.0.3","TLSv1.2","396","Application Data"
"4.014113","172.19.0.3","5.9.29.183","TCP","56","43520 → 9002 [ACK] Seq=12888 Ack=207631 Win=11911 Len=0"
"4.030815","5.9.29.183","172.19.0.3","TCP","1516","[TCP segment of a reassembled PDU]"
"4.030890","5.9.29.183","172.19.0.3","TCP","1516","9002 → 43520 [PSH, ACK] Seq=209091 Ack=12888 Win=65535 Len=1460 [TCP segment of a reassembled PDU]"
"4.030900","5.9.29.183","172.19.0.3","TLSv1.2","763","Application Data"
"4.031041","172.19.0.3","5.9.29.183","TCP","56","43520 → 9002 [ACK] Seq=12888 Ack=211258 Win=11895 Len=0"
"4.046860","5.9.29.183","172.19.0.3","TCP","1516","[TCP segment of a reassembled PDU]"
"4.046931","5.9.29.183","172.19.0.3","TLSv1.2","1195","Application Data"
"4.046952","172.19.0.3","5.9.29.183","TCP","56","43520 → 9002 [ACK] Seq=12888 Ack=213857 Win=11903 Len=0"
"4.051055","172.19.0.3","5.9.29.183","TLSv1.2","599","Application Data"
"4.051319","5.9.29.183","172.19.0.3","TCP","56","9002 → 43520 [ACK] Seq=213857 Ack=13431 Win=65535 Len=0"
"4.283458","5.9.29.183","172.19.0.3","TLSv1.2","599","Application Data"
"4.284110","172.19.0.3","5.9.29.183","TLSv1.2","599","Application Data"
"4.284413","5.9.29.183","172.19.0.3","TCP","56","9002 → 43520 [ACK] Seq=214400 Ack=13974 Win=65535 Len=0"
"4.509975","5.9.29.183","172.19.0.3","TLSv1.2","599","Application Data"
"4.552556","172.19.0.3","5.9.29.183","TCP","56","43520 → 9002 [ACK] Seq=13974 Ack=214943 Win=11911 Len=0"
"4.592410","5.9.29.183","172.19.0.3","TCP","1504","[TCP segment of a reassembled PDU]"
"4.592432","172.19.0.3","5.9.29.183","TCP","56","43520 → 9002 [ACK] Seq=13974 Ack=216391 Win=11911 Len=0"
"4.592482","5.9.29.183","172.19.0.3","TCP","1504","9002 → 43520 [PSH, ACK] Seq=216391 Ack=13974 Win=65535 Len=1448 [TCP segment of a reassembled PDU]"
"4.592498","172.19.0.3","5.9.29.183","TCP","56","43520 → 9002 [ACK] Seq=13974 Ack=217839 Win=11903 Len=0"
"4.592500","5.9.29.183","172.19.0.3","TLSv1.2","787","Application Data"
"4.592506","172.19.0.3","5.9.29.183","TCP","56","43520 → 9002 [ACK] Seq=13974 Ack=218570 Win=11898 Len=0"
"4.677268","5.9.29.183","172.19.0.3","TCP","1516","[TCP segment of a reassembled PDU]"
"4.677290","172.19.0.3","5.9.29.183","TCP","56","43520 → 9002 [ACK] Seq=13974 Ack=220030 Win=11911 Len=0"
"4.677337","5.9.29.183","172.19.0.3","TCP","1492","9002 → 43520 [PSH, ACK] Seq=220030 Ack=13974 Win=65535 Len=1436 [TCP segment of a reassembled PDU]"
"4.677349","172.19.0.3","5.9.29.183","TCP","56","43520 → 9002 [ACK] Seq=13974 Ack=221466 Win=11903 Len=0"
"4.677352","5.9.29.183","172.19.0.3","TLSv1.2","787","Application Data"
"4.677358","172.19.0.3","5.9.29.183","TCP","56","43520 → 9002 [ACK] Seq=13974 Ack=222197 Win=11898 Len=0"
"4.693491","5.9.29.183","172.19.0.3","TCP","1516","[TCP segment of a reassembled PDU]"
"4.693516","172.19.0.3","5.9.29.183","TCP","56","43520 → 9002 [ACK] Seq=13974 Ack=223657 Win=11911 Len=0"
"4.693574","5.9.29.183","172.19.0.3","TCP","1492","9002 → 43520 [PSH, ACK] Seq=223657 Ack=13974 Win=65535 Len=1436 [TCP segment of a reassembled PDU]"
"4.693590","172.19.0.3","5.9.29.183","TCP","56","43520 → 9002 [ACK] Seq=13974 Ack=225093 Win=11903 Len=0"
"4.694079","5.9.29.183","172.19.0.3","TLSv1.2","787","Application Data"
"4.694087","172.19.0.3","5.9.29.183","TCP","56","43520 → 9002 [ACK] Seq=13974 Ack=225824 Win=11911 Len=0"
"4.705819","5.9.29.183","172.19.0.3","TCP","1504","[TCP segment of a reassembled PDU]"
"4.705841","172.19.0.3","5.9.29.183","TCP","56","43520 → 9002 [ACK] Seq=13974 Ack=227272 Win=11911 Len=0"
"4.706566","5.9.29.183","172.19.0.3","TCP","1504","9002 → 43520 [PSH, ACK] Seq=227272 Ack=13974 Win=65535 Len=1448 [TCP segment of a reassembled PDU]"
"4.706575","172.19.0.3","5.9.29.183","TCP","56","43520 → 9002 [ACK] Seq=13974 Ack=228720 Win=11911 Len=0"
"4.706636","5.9.29.183","172.19.0.3","TLSv1.2","1516","Application Data [TCP segment of a reassembled PDU]"
"4.706650","172.19.0.3","5.9.29.183","TCP","56","43520 → 9002 [ACK] Seq=13974 Ack=230180 Win=11903 Len=0"
"4.706718","5.9.29.183","172.19.0.3","TCP","1516","9002 → 43520 [PSH, ACK] Seq=230180 Ack=13974 Win=65535 Len=1460 [TCP segment of a reassembled PDU]"
"4.706725","172.19.0.3","5.9.29.183","TCP","56","43520 → 9002 [ACK] Seq=13974 Ack=231640 Win=11895 Len=0"
"4.706727","5.9.29.183","172.19.0.3","TCP","1516","9002 → 43520 [PSH, ACK] Seq=231640 Ack=13974 Win=65535 Len=1460 [TCP segment of a reassembled PDU]"
"4.706734","172.19.0.3","5.9.29.183","TCP","56","43520 → 9002 [ACK] Seq=13974 Ack=233100 Win=11887 Len=0"
"4.706735","5.9.29.183","172.19.0.3","TLSv1.2","1516","Application Data [TCP segment of a reassembled PDU]"
"4.706739","172.19.0.3","5.9.29.183","TCP","56","43520 → 9002 [ACK] Seq=13974 Ack=234560 Win=11879 Len=0"
"4.706740","5.9.29.183","172.19.0.3","TCP","1456","9002 → 43520 [PSH, ACK] Seq=234560 Ack=13974 Win=65535 Len=1400 [TCP segment of a reassembled PDU]"
"4.707010","172.19.0.3","5.9.29.183","TLSv1.2","599","Application Data"
"4.707198","5.9.29.183","172.19.0.3","TCP","56","9002 → 43520 [ACK] Seq=235960 Ack=14517 Win=65535 Len=0"
"4.709333","5.9.29.183","172.19.0.3","TCP","1516","9002 → 43520 [PSH, ACK] Seq=235960 Ack=14517 Win=65535 Len=1460 [TCP segment of a reassembled PDU]"
"4.709373","5.9.29.183","172.19.0.3","TLSv1.2","1516","Application Data [TCP segment of a reassembled PDU]"
"4.709383","172.19.0.3","5.9.29.183","TCP","56","43520 → 9002 [ACK] Seq=14517 Ack=238880 Win=11903 Len=0"
"4.709385","5.9.29.183","172.19.0.3","TCP","1480","9002 → 43520 [PSH, ACK] Seq=238880 Ack=14517 Win=65535 Len=1424 [TCP segment of a reassembled PDU]"
"4.709428","5.9.29.183","172.19.0.3","TCP","554","9002 → 43520 [PSH, ACK] Seq=240304 Ack=14517 Win=65535 Len=498 [TCP segment of a reassembled PDU]"
"4.709460","172.19.0.3","5.9.29.183","TCP","56","43520 → 9002 [ACK] Seq=14517 Ack=240802 Win=11888 Len=0"
"4.709501","5.9.29.183","172.19.0.3","TCP","1006","9002 → 43520 [PSH, ACK] Seq=240802 Ack=14517 Win=65535 Len=950 [TCP segment of a reassembled PDU]"
"4.709846","5.9.29.183","172.19.0.3","TLSv1.2","721","Application Data, Application Data"
"4.709855","172.19.0.3","5.9.29.183","TCP","56","43520 → 9002 [ACK] Seq=14517 Ack=242417 Win=11911 Len=0"
"4.719406","172.19.0.3","5.9.29.183","TLSv1.2","599","Application Data"
"4.719955","5.9.29.183","172.19.0.3","TCP","56","9002 → 43520 [ACK] Seq=242417 Ack=15060 Win=65535 Len=0"
"4.722318","5.9.29.183","172.19.0.3","TLSv1.2","1516","Application Data"
"4.722392","5.9.29.183","172.19.0.3","TCP","1516","9002 → 43520 [PSH, ACK] Seq=243877 Ack=15060 Win=65535 Len=1460 [TCP segment of a reassembled PDU]"
"4.722402","5.9.29.183","172.19.0.3","TCP","1516","9002 → 43520 [PSH, ACK] Seq=245337 Ack=15060 Win=65535 Len=1460 [TCP segment of a reassembled PDU]"
"4.722405","5.9.29.183","172.19.0.3","TLSv1.2","1468","Application Data [TCP segment of a reassembled PDU]"
"4.722408","5.9.29.183","172.19.0.3","TCP","1504","9002 → 43520 [PSH, ACK] Seq=248209 Ack=15060 Win=65535 Len=1448 [TCP segment of a reassembled PDU]"
"4.722624","172.19.0.3","5.9.29.183","TCP","56","43520 → 9002 [ACK] Seq=15060 Ack=249657 Win=11879 Len=0"
"4.723516","5.9.29.183","172.19.0.3","TCP","1504","9002 → 43520 [PSH, ACK] Seq=249657 Ack=15060 Win=65535 Len=1448 [TCP segment of a reassembled PDU]"
"4.723626","5.9.29.183","172.19.0.3","TLSv1.2","1516","Application Data [TCP segment of a reassembled PDU]"
"4.723636","172.19.0.3","5.9.29.183","TCP","56","43520 → 9002 [ACK] Seq=15060 Ack=252565 Win=11903 Len=0"
"4.723638","5.9.29.183","172.19.0.3","TCP","1492","9002 → 43520 [PSH, ACK] Seq=252565 Ack=15060 Win=65535 Len=1436 [TCP segment of a reassembled PDU]"
"4.726316","5.9.29.183","172.19.0.3","TLSv1.2","1467","Application Data, Application Data"
"4.726342","172.19.0.3","5.9.29.183","TCP","56","43520 → 9002 [ACK] Seq=15060 Ack=255412 Win=11911 Len=0"
"4.738371","5.9.29.183","172.19.0.3","TCP","1504","[TCP segment of a reassembled PDU]"
"4.738876","5.9.29.183","172.19.0.3","TCP","1516","9002 → 43520 [PSH, ACK] Seq=256860 Ack=15060 Win=65535 Len=1460 [TCP segment of a reassembled PDU]"
"4.738887","172.19.0.3","5.9.29.183","TCP","56","43520 → 9002 [ACK] Seq=15060 Ack=258320 Win=11911 Len=0"
"4.738991","5.9.29.183","172.19.0.3","TLSv1.2","1516","Application Data [TCP segment of a reassembled PDU]"
"4.739081","5.9.29.183","172.19.0.3","TCP","1480","9002 → 43520 [PSH, ACK] Seq=259780 Ack=15060 Win=65535 Len=1424 [TCP segment of a reassembled PDU]"
"4.739087","5.9.29.183","172.19.0.3","TCP","1516","9002 → 43520 [PSH, ACK] Seq=261204 Ack=15060 Win=65535 Len=1460 [TCP segment of a reassembled PDU]"
"4.739089","5.9.29.183","172.19.0.3","TLSv1.2","1516","Application Data [TCP segment of a reassembled PDU]"
"4.739092","5.9.29.183","172.19.0.3","TCP","1516","9002 → 43520 [PSH, ACK] Seq=264124 Ack=15060 Win=65535 Len=1460 [TCP segment of a reassembled PDU]"
"4.739094","5.9.29.183","172.19.0.3","TCP","1516","9002 → 43520 [PSH, ACK] Seq=265584 Ack=15060 Win=65535 Len=1460 [TCP segment of a reassembled PDU]"
"4.739096","5.9.29.183","172.19.0.3","TLSv1.2","1456","Application Data [TCP segment of a reassembled PDU]"
"4.739149","172.19.0.3","5.9.29.183","TCP","56","43520 → 9002 [ACK] Seq=15060 Ack=268444 Win=11863 Len=0"
"4.739157","5.9.29.183","172.19.0.3","TCP","1516","9002 → 43520 [PSH, ACK] Seq=268444 Ack=15060 Win=65535 Len=1460 [TCP segment of a reassembled PDU]"
"4.739161","5.9.29.183","172.19.0.3","TCP","1492","9002 → 43520 [PSH, ACK] Seq=269904 Ack=15060 Win=65535 Len=1436 [TCP segment of a reassembled PDU]"
"4.739204","172.19.0.3","5.9.29.183","TCP","56","43520 → 9002 [ACK] Seq=15060 Ack=271340 Win=11847 Len=0"
"4.739524","172.19.0.3","5.9.29.183","TLSv1.2","599","Application Data"
"4.739703","5.9.29.183","172.19.0.3","TCP","56","9002 → 43520 [ACK] Seq=271340 Ack=15603 Win=65535 Len=0"
"4.742313","5.9.29.183","172.19.0.3","TLSv1.2","721","Application Data, Application Data"
"4.744307","5.9.29.183","172.19.0.3","TCP","1504","[TCP segment of a reassembled PDU]"
"4.744318","172.19.0.3","5.9.29.183","TCP","56","43520 → 9002 [ACK] Seq=15603 Ack=273453 Win=11911 Len=0"
"4.754637","5.9.29.183","172.19.0.3","TLSv1.2","1516","Application Data [TCP segment of a reassembled PDU]"
"4.754740","5.9.29.183","172.19.0.3","TCP","1516","9002 → 43520 [PSH, ACK] Seq=274913 Ack=15603 Win=65535 Len=1460 [TCP segment of a reassembled PDU]"
"4.754746","5.9.29.183","172.19.0.3","TCP","1480","9002 → 43520 [PSH, ACK] Seq=276373 Ack=15603 Win=65535 Len=1424 [TCP segment of a reassembled PDU]"
"4.754781","5.9.29.183","172.19.0.3","TLSv1.2","1516","Application Data [TCP segment of a reassembled PDU]"
"4.754784","5.9.29.183","172.19.0.3","TCP","1516","9002 → 43520 [PSH, ACK] Seq=279257 Ack=15603 Win=65535 Len=1460 [TCP segment of a reassembled PDU]"
"4.754786","5.9.29.183","172.19.0.3","TCP","1516","9002 → 43520 [PSH, ACK] Seq=280717 Ack=15603 Win=65535 Len=1460 [TCP segment of a reassembled PDU]"
"4.754788","5.9.29.183","172.19.0.3","TLSv1.2","1516","Application Data [TCP segment of a reassembled PDU]"
"4.754790","5.9.29.183","172.19.0.3","TCP","1456","9002 → 43520 [PSH, ACK] Seq=283637 Ack=15603 Win=65535 Len=1400 [TCP segment of a reassembled PDU]"
"4.754846","172.19.0.3","5.9.29.183","TCP","56","43520 → 9002 [ACK] Seq=15603 Ack=285037 Win=11855 Len=0"
"4.757239","5.9.29.183","172.19.0.3","TLSv1.2","504","Application Data"
"4.757612","172.19.0.3","5.9.29.183","TLSv1.2","599","Application Data"
"4.757791","5.9.29.183","172.19.0.3","TCP","56","9002 → 43520 [ACK] Seq=285485 Ack=16146 Win=65535 Len=0"
"4.767313","172.19.0.3","5.9.29.183","TLSv1.2","599","Application Data"
"4.767585","5.9.29.183","172.19.0.3","TCP","56","9002 → 43520 [ACK] Seq=285485 Ack=16689 Win=65535 Len=0"
"5.014775","5.9.29.183","172.19.0.3","TLSv1.2","599","Application Data"
"5.015891","172.19.0.3","5.9.29.183","TLSv1.2","599","Application Data"
"5.016264","5.9.29.183","172.19.0.3","TCP","56","9002 → 43520 [ACK] Seq=286028 Ack=17232 Win=65535 Len=0"
"5.259955","5.9.29.183","172.19.0.3","TLSv1.2","599","Application Data"
"5.271480","5.9.29.183","172.19.0.3","TCP","1516","[TCP segment of a reassembled PDU]"
"5.271502","172.19.0.3","5.9.29.183","TCP","56","43520 → 9002 [ACK] Seq=17232 Ack=288031 Win=11911 Len=0"
"5.271629","5.9.29.183","172.19.0.3","TCP","1516","9002 → 43520 [PSH, ACK] Seq=288031 Ack=17232 Win=65535 Len=1460 [TCP segment of a reassembled PDU]"
"5.271652","5.9.29.183","172.19.0.3","TLSv1.2","1480","Application Data [TCP segment of a reassembled PDU]"
"5.271750","5.9.29.183","172.19.0.3","TCP","1516","9002 → 43520 [PSH, ACK] Seq=290915 Ack=17232 Win=65535 Len=1460 [TCP segment of a reassembled PDU]"
"5.271755","5.9.29.183","172.19.0.3","TCP","1492","9002 → 43520 [PSH, ACK] Seq=292375 Ack=17232 Win=65535 Len=1436 [TCP segment of a reassembled PDU]"
"5.271769","172.19.0.3","5.9.29.183","TCP","56","43520 → 9002 [ACK] Seq=17232 Ack=290915 Win=11895 Len=0"
"5.271839","172.19.0.3","5.9.29.183","TCP","56","43520 → 9002 [ACK] Seq=17232 Ack=293811 Win=11879 Len=0"
"5.276229","5.9.29.183","172.19.0.3","TLSv1.2","584","Application Data"
"5.305552","5.9.29.183","172.19.0.3","TCP","1504","[TCP segment of a reassembled PDU]"
"5.305573","172.19.0.3","5.9.29.183","TCP","56","43520 → 9002 [ACK] Seq=17232 Ack=295787 Win=11911 Len=0"
"5.306271","5.9.29.183","172.19.0.3","TCP","1504","9002 → 43520 [PSH, ACK] Seq=295787 Ack=17232 Win=65535 Len=1448 [TCP segment of a reassembled PDU]"
"5.306384","5.9.29.183","172.19.0.3","TLSv1.2","1516","Application Data [TCP segment of a reassembled PDU]"
"5.306391","5.9.29.183","172.19.0.3","TCP","1516","9002 → 43520 [PSH, ACK] Seq=298695 Ack=17232 Win=65535 Len=1460 [TCP segment of a reassembled PDU]"
"5.306393","5.9.29.183","172.19.0.3","TCP","1516","9002 → 43520 [PSH, ACK] Seq=300155 Ack=17232 Win=65535 Len=1460 [TCP segment of a reassembled PDU]"
"5.306488","172.19.0.3","5.9.29.183","TCP","56","43520 → 9002 [ACK] Seq=17232 Ack=301615 Win=11885 Len=0"
"5.306521","5.9.29.183","172.19.0.3","TLSv1.2","1516","Application Data [TCP segment of a reassembled PDU]"
"5.306536","5.9.29.183","172.19.0.3","TCP","1516","9002 → 43520 [PSH, ACK] Seq=303075 Ack=17232 Win=65535 Len=1460 [TCP segment of a reassembled PDU]"
"5.306539","5.9.29.183","172.19.0.3","TCP","1516","9002 → 43520 [PSH, ACK] Seq=304535 Ack=17232 Win=65535 Len=1460 [TCP segment of a reassembled PDU]"
"5.306541","5.9.29.183","172.19.0.3","TCP","399","9002 → 43520 [PSH, ACK] Seq=305995 Ack=17232 Win=65535 Len=343 [TCP segment of a reassembled PDU]"
"5.306625","5.9.29.183","172.19.0.3","TLSv1.2","1516","Application Data [TCP segment of a reassembled PDU]"
"5.306770","5.9.29.183","172.19.0.3","TCP","1516","9002 → 43520 [PSH, ACK] Seq=307798 Ack=17232 Win=65535 Len=1460 [TCP segment of a reassembled PDU]"
"5.306778","5.9.29.183","172.19.0.3","TCP","798","9002 → 43520 [PSH, ACK] Seq=309258 Ack=17232 Win=65535 Len=742 [TCP segment of a reassembled PDU]"
"5.306824","172.19.0.3","5.9.29.183","TCP","56","43520 → 9002 [ACK] Seq=17232 Ack=310000 Win=11828 Len=0"
"5.322050","5.9.29.183","172.19.0.3","TLSv1.2","1516","Application Data [TCP segment of a reassembled PDU]"
"5.322114","5.9.29.183","172.19.0.3","TCP","1516","9002 → 43520 [PSH, ACK] Seq=311460 Ack=17232 Win=65535 Len=1460 [TCP segment of a reassembled PDU]"
"5.322132","172.19.0.3","5.9.29.183","TCP","56","43520 → 9002 [ACK] Seq=17232 Ack=312920 Win=11903 Len=0"
"5.322136","5.9.29.183","172.19.0.3","TCP","1516","9002 → 43520 [PSH, ACK] Seq=312920 Ack=17232 Win=65535 Len=1460 [TCP segment of a reassembled PDU]"
"5.322140","5.9.29.183","172.19.0.3","TLSv1.2","1516","Application Data [TCP segment of a reassembled PDU]"
"5.322143","5.9.29.183","172.19.0.3","TCP","1456","9002 → 43520 [PSH, ACK] Seq=315840 Ack=17232 Win=65535 Len=1400 [TCP segment of a reassembled PDU]"
"5.322146","5.9.29.183","172.19.0.3","TLSv1.2","1504","Application Data [TCP segment of a reassembled PDU]"
"5.322291","172.19.0.3","5.9.29.183","TCP","56","43520 → 9002 [ACK] Seq=17232 Ack=318688 Win=11871 Len=0"
"5.322481","5.9.29.183","172.19.0.3","TCP","1516","9002 → 43520 [PSH, ACK] Seq=318688 Ack=17232 Win=65535 Len=1460 [TCP segment of a reassembled PDU]"
"5.322489","5.9.29.183","172.19.0.3","TCP","1516","9002 → 43520 [PSH, ACK] Seq=320148 Ack=17232 Win=65535 Len=1460 [TCP segment of a reassembled PDU]"
"5.322492","5.9.29.183","172.19.0.3","TLSv1.2","1516","Application Data [TCP segment of a reassembled PDU]"
"5.322609","5.9.29.183","172.19.0.3","TLSv1.2","343","Application Data"
"5.322741","172.19.0.3","5.9.29.183","TCP","56","43520 → 9002 [ACK] Seq=17232 Ack=323355 Win=11838 Len=0"
"5.323102","172.19.0.3","5.9.29.183","TLSv1.2","599","Application Data"
"5.323341","5.9.29.183","172.19.0.3","TCP","56","9002 → 43520 [ACK] Seq=323355 Ack=17775 Win=65535 Len=0"
"5.338268","5.9.29.183","172.19.0.3","TCP","1504","[TCP segment of a reassembled PDU]"
"5.338443","5.9.29.183","172.19.0.3","TCP","1504","9002 → 43520 [PSH, ACK] Seq=324803 Ack=17775 Win=65535 Len=1448 [TCP segment of a reassembled PDU]"
"5.338456","172.19.0.3","5.9.29.183","TCP","56","43520 → 9002 [ACK] Seq=17775 Ack=326251 Win=11901 Len=0"
"5.339050","5.9.29.183","172.19.0.3","TLSv1.2","1237","Application Data"
"5.339088","5.9.29.183","172.19.0.3","TCP","1516","[TCP segment of a reassembled PDU]"
"5.339099","172.19.0.3","5.9.29.183","TCP","56","43520 → 9002 [ACK] Seq=17775 Ack=328892 Win=11903 Len=0"
"5.339101","5.9.29.183","172.19.0.3","TCP","1492","9002 → 43520 [PSH, ACK] Seq=328892 Ack=17775 Win=65535 Len=1436 [TCP segment of a reassembled PDU]"
"5.354111","5.9.29.183","172.19.0.3","TLSv1.2","1504","Application Data [TCP segment of a reassembled PDU]"
"5.354156","172.19.0.3","5.9.29.183","TCP","56","43520 → 9002 [ACK] Seq=17775 Ack=331776 Win=11911 Len=0"
"5.354210","5.9.29.183","172.19.0.3","TCP","1504","9002 → 43520 [PSH, ACK] Seq=331776 Ack=17775 Win=65535 Len=1448 [TCP segment of a reassembled PDU]"
"5.354252","5.9.29.183","172.19.0.3","TCP","1516","9002 → 43520 [PSH, ACK] Seq=333224 Ack=17775 Win=65535 Len=1460 [TCP segment of a reassembled PDU]"
"5.354363","172.19.0.3","5.9.29.183","TCP","56","43520 → 9002 [ACK] Seq=17775 Ack=334684 Win=11895 Len=0"
"5.354363","5.9.29.183","172.19.0.3","TLSv1.2","1492","Application Data [TCP segment of a reassembled PDU]"
"5.354425","5.9.29.183","172.19.0.3","TCP","1504","9002 → 43520 [PSH, ACK] Seq=336120 Ack=17775 Win=65535 Len=1448 [TCP segment of a reassembled PDU]"
"5.354436","5.9.29.183","172.19.0.3","TCP","1504","9002 → 43520 [PSH, ACK] Seq=337568 Ack=17775 Win=65535 Len=1448 [TCP segment of a reassembled PDU]"
"5.354441","5.9.29.183","172.19.0.3","TLSv1.2","1504","Application Data [TCP segment of a reassembled PDU]"
"5.354577","5.9.29.183","172.19.0.3","TCP","1516","9002 → 43520 [PSH, ACK] Seq=340464 Ack=17775 Win=65535 Len=1460 [TCP segment of a reassembled PDU]"
"5.354582","5.9.29.183","172.19.0.3","TLSv1.2","1492","Application Data [TCP segment of a reassembled PDU]"
"5.354585","5.9.29.183","172.19.0.3","TCP","1516","9002 → 43520 [PSH, ACK] Seq=343360 Ack=17775 Win=65535 Len=1460 [TCP segment of a reassembled PDU]"
"5.354587","5.9.29.183","172.19.0.3","TCP","1492","9002 → 43520 [PSH, ACK] Seq=344820 Ack=17775 Win=65535 Len=1436 [TCP segment of a reassembled PDU]"
"5.354699","172.19.0.3","5.9.29.183","TCP","56","43520 → 9002 [ACK] Seq=17775 Ack=346256 Win=11830 Len=0"
"5.355210","5.9.29.183","172.19.0.3","TLSv1.2","1516","Application Data, Application Data"
"5.355348","172.19.0.3","5.9.29.183","TLSv1.2","1113","Application Data"
"5.355674","5.9.29.183","172.19.0.3","TCP","56","9002 → 43520 [ACK] Seq=347716 Ack=18832 Win=65535 Len=0"
"5.368853","5.9.29.183","172.19.0.3","TCP","1504","[TCP segment of a reassembled PDU]"
"5.368894","5.9.29.183","172.19.0.3","TCP","1516","9002 → 43520 [PSH, ACK] Seq=349164 Ack=18832 Win=65535 Len=1460 [TCP segment of a reassembled PDU]"
"5.368906","172.19.0.3","5.9.29.183","TCP","56","43520 → 9002 [ACK] Seq=18832 Ack=350624 Win=11903 Len=0"
"5.368909","5.9.29.183","172.19.0.3","TLSv1.2","1492","Application Data [TCP segment of a reassembled PDU]"
"5.369823","5.9.29.183","172.19.0.3","TLSv1.2","910","Application Data"
"5.369830","172.19.0.3","5.9.29.183","TCP","56","43520 → 9002 [ACK] Seq=18832 Ack=352914 Win=11909 Len=0"
"5.373251","172.19.0.3","5.9.29.183","TLSv1.2","599","Application Data"
"5.373452","5.9.29.183","172.19.0.3","TCP","56","9002 → 43520 [ACK] Seq=352914 Ack=19375 Win=65535 Len=0"
"5.674638","5.9.29.183","172.19.0.3","TLSv1.2","599","Application Data"
"5.675532","172.19.0.3","5.9.29.183","TLSv1.2","599","Application Data"
"5.675822","5.9.29.183","172.19.0.3","TCP","56","9002 → 43520 [ACK] Seq=353457 Ack=19918 Win=65535 Len=0"
"5.945075","5.9.29.183","172.19.0.3","TLSv1.2","599","Application Data"
"5.973364","5.9.29.183","172.19.0.3","TCP","1504","[TCP segment of a reassembled PDU]"
"5.973392","172.19.0.3","5.9.29.183","TCP","56","43520 → 9002 [ACK] Seq=19918 Ack=355448 Win=11911 Len=0"
"5.973572","5.9.29.183","172.19.0.3","TCP","1516","9002 → 43520 [PSH, ACK] Seq=355448 Ack=19918 Win=65535 Len=1460 [TCP segment of a reassembled PDU]"
"5.973588","5.9.29.183","172.19.0.3","TLSv1.2","1225","Application Data"
"5.973644","172.19.0.3","5.9.29.183","TCP","56","43520 → 9002 [ACK] Seq=19918 Ack=358077 Win=11895 Len=0"
"5.973750","5.9.29.183","172.19.0.3","TCP","1516","[TCP segment of a reassembled PDU]"
"5.973790","5.9.29.183","172.19.0.3","TCP","1492","9002 → 43520 [PSH, ACK] Seq=359537 Ack=19918 Win=65535 Len=1436 [TCP segment of a reassembled PDU]"
"5.973800","172.19.0.3","5.9.29.183","TCP","56","43520 → 9002 [ACK] Seq=19918 Ack=360973 Win=11903 Len=0"
"5.989283","5.9.29.183","172.19.0.3","TLSv1.2","851","Application Data"
"6.005858","5.9.29.183","172.19.0.3","TCP","1516","[TCP segment of a reassembled PDU]"
"6.005880","172.19.0.3","5.9.29.183","TCP","56","43520 → 9002 [ACK] Seq=19918 Ack=363228 Win=11911 Len=0"
"6.005931","5.9.29.183","172.19.0.3","TCP","1516","9002 → 43520 [PSH, ACK] Seq=363228 Ack=19918 Win=65535 Len=1460 [TCP segment of a reassembled PDU]"
"6.005978","5.9.29.183","172.19.0.3","TLSv1.2","1213","Application Data"
"6.005987","5.9.29.183","172.19.0.3","TCP","1516","[TCP segment of a reassembled PDU]"
"6.005996","5.9.29.183","172.19.0.3","TCP","1492","9002 → 43520 [PSH, ACK] Seq=367305 Ack=19918 Win=65535 Len=1436 [TCP segment of a reassembled PDU]"
"6.006126","172.19.0.3","5.9.29.183","TCP","56","43520 → 9002 [ACK] Seq=19918 Ack=368741 Win=11879 Len=0"
"6.021109","5.9.29.183","172.19.0.3","TLSv1.2","337","Application Data"
"6.021772","5.9.29.183","172.19.0.3","TCP","1504","[TCP segment of a reassembled PDU]"
"6.021790","172.19.0.3","5.9.29.183","TCP","56","43520 → 9002 [ACK] Seq=19918 Ack=370470 Win=11911 Len=0"
"6.021971","5.9.29.183","172.19.0.3","TCP","1460","9002 → 43520 [PSH, ACK] Seq=370470 Ack=19918 Win=65535 Len=1404 [TCP segment of a reassembled PDU]"
"6.022021","5.9.29.183","172.19.0.3","TLSv1.2","1516","Application Data [TCP segment of a reassembled PDU]"
"6.022093","172.19.0.3","5.9.29.183","TCP","56","43520 → 9002 [ACK] Seq=19918 Ack=373334 Win=11903 Len=0"
"6.022279","5.9.29.183","172.19.0.3","TCP","1516","9002 → 43520 [PSH, ACK] Seq=373334 Ack=19918 Win=65535 Len=1460 [TCP segment of a reassembled PDU]"
"6.022312","5.9.29.183","172.19.0.3","TCP","76","9002 → 43520 [PSH, ACK] Seq=374794 Ack=19918 Win=65535 Len=20 [TCP segment of a reassembled PDU]"
"6.022347","172.19.0.3","5.9.29.183","TCP","56","43520 → 9002 [ACK] Seq=19918 Ack=374814 Win=11909 Len=0"
"6.022398","5.9.29.183","172.19.0.3","TCP","1516","9002 → 43520 [PSH, ACK] Seq=374814 Ack=19918 Win=65535 Len=1460 [TCP segment of a reassembled PDU]"
"6.022432","5.9.29.183","172.19.0.3","TLSv1.2","1492","Application Data [TCP segment of a reassembled PDU]"
"6.022484","172.19.0.3","5.9.29.183","TCP","56","43520 → 9002 [ACK] Seq=19918 Ack=377710 Win=11903 Len=0"
"6.035911","5.9.29.183","172.19.0.3","TLSv1.2","193","Application Data"
"6.041608","5.9.29.183","172.19.0.3","TCP","1504","[TCP segment of a reassembled PDU]"
"6.041624","172.19.0.3","5.9.29.183","TCP","56","43520 → 9002 [ACK] Seq=19918 Ack=379295 Win=11911 Len=0"
"6.050874","5.9.29.183","172.19.0.3","TLSv1.2","179","Application Data"
"6.054374","172.19.0.3","5.9.29.183","TLSv1.2","599","Application Data"
"6.054583","5.9.29.183","172.19.0.3","TCP","56","9002 → 43520 [ACK] Seq=379418 Ack=20461 Win=65535 Len=0"
"6.295829","5.9.29.183","172.19.0.3","TLSv1.2","599","Application Data"
"6.296850","172.19.0.3","5.9.29.183","TLSv1.2","599","Application Data"
"6.297236","5.9.29.183","172.19.0.3","TCP","56","9002 → 43520 [ACK] Seq=379961 Ack=21004 Win=65535 Len=0"
"6.675765","5.9.29.183","172.19.0.3","TLSv1.2","599","Application Data"
"6.708533","5.9.29.183","172.19.0.3","TCP","1516","[TCP segment of a reassembled PDU]"
"6.708558","172.19.0.3","5.9.29.183","TCP","56","43520 → 9002 [ACK] Seq=21004 Ack=381964 Win=11911 Len=0"
"6.708617","5.9.29.183","172.19.0.3","TCP","1516","9002 → 43520 [PSH, ACK] Seq=381964 Ack=21004 Win=65535 Len=1460 [TCP segment of a reassembled PDU]"
"6.708636","5.9.29.183","172.19.0.3","TLSv1.2","763","Application Data"
"6.708783","172.19.0.3","5.9.29.183","TCP","56","43520 → 9002 [ACK] Seq=21004 Ack=384131 Win=11895 Len=0"
"6.719896","5.9.29.183","172.19.0.3","TCP","1504","[TCP segment of a reassembled PDU]"
"6.719978","5.9.29.183","172.19.0.3","TCP","1516","9002 → 43520 [PSH, ACK] Seq=385579 Ack=21004 Win=65535 Len=1460 [TCP segment of a reassembled PDU]"
"6.719993","172.19.0.3","5.9.29.183","TCP","56","43520 → 9002 [ACK] Seq=21004 Ack=387039 Win=11903 Len=0"
"6.720094","5.9.29.183","172.19.0.3","TLSv1.2","1492","Application Data [TCP segment of a reassembled PDU]"
"6.720099","5.9.29.183","172.19.0.3","TCP","1516","9002 → 43520 [PSH, ACK] Seq=388475 Ack=21004 Win=65535 Len=1460 [TCP segment of a reassembled PDU]"
"6.720105","172.19.0.3","5.9.29.183","TCP","56","43520 → 9002 [ACK] Seq=21004 Ack=389935 Win=11903 Len=0"
"6.720107","5.9.29.183","172.19.0.3","TCP","1516","9002 → 43520 [PSH, ACK] Seq=389935 Ack=21004 Win=65535 Len=1460 [TCP segment of a reassembled PDU]"
"6.720109","5.9.29.183","172.19.0.3","TLSv1.2","1480","Application Data [TCP segment of a reassembled PDU]"
"6.720114","5.9.29.183","172.19.0.3","TCP","1504","9002 → 43520 [PSH, ACK] Seq=392819 Ack=21004 Win=65535 Len=1448 [TCP segment of a reassembled PDU]"
"6.720245","172.19.0.3","5.9.29.183","TCP","56","43520 → 9002 [ACK] Seq=21004 Ack=394267 Win=11879 Len=0"
"6.720528","172.19.0.3","5.9.29.183","TLSv1.2","599","Application Data"
"6.720719","5.9.29.183","172.19.0.3","TCP","56","9002 → 43520 [ACK] Seq=394267 Ack=21547 Win=65535 Len=0"
"6.724627","5.9.29.183","172.19.0.3","TLSv1.2","1315","Application Data"
"6.740796","5.9.29.183","172.19.0.3","TCP","1516","[TCP segment of a reassembled PDU]"
"6.740821","172.19.0.3","5.9.29.183","TCP","56","43520 → 9002 [ACK] Seq=21547 Ack=396986 Win=11911 Len=0"
"6.740889","5.9.29.183","172.19.0.3","TLSv1.2","167","Application Data"
"6.783352","172.19.0.3","5.9.29.183","TCP","56","43520 → 9002 [ACK] Seq=21547 Ack=397097 Win=11911 Len=0"
"6.851429","5.9.29.183","172.19.0.3","TLSv1.2","1113","Application Data"
"6.851456","172.19.0.3","5.9.29.183","TCP","56","43520 → 9002 [ACK] Seq=21547 Ack=398154 Win=11911 Len=0"
"6.855464","172.19.0.3","5.9.29.183","TLSv1.2","599","Application Data"
"6.855825","5.9.29.183","172.19.0.3","TCP","56","9002 → 43520 [ACK] Seq=398154 Ack=22090 Win=65535 Len=0"
"7.116533","5.9.29.183","172.19.0.3","TLSv1.2","599","Application Data"
"7.117415","172.19.0.3","5.9.29.183","TLSv1.2","599","Application Data"
"7.117838","5.9.29.183","172.19.0.3","TCP","56","9002 → 43520 [ACK] Seq=398697 Ack=22633 Win=65535 Len=0"
"7.376041","5.9.29.183","172.19.0.3","TCP","1516","[TCP segment of a reassembled PDU]"
"7.376151","5.9.29.183","172.19.0.3","TCP","1516","9002 → 43520 [PSH, ACK] Seq=400157 Ack=22633 Win=65535 Len=1460 [TCP segment of a reassembled PDU]"
"7.376165","5.9.29.183","172.19.0.3","TLSv1.2","763","Application Data"
"7.376307","172.19.0.3","5.9.29.183","TCP","56","43520 → 9002 [ACK] Seq=22633 Ack=402324 Win=11895 Len=0"
"7.403024","5.9.29.183","172.19.0.3","TCP","1504","[TCP segment of a reassembled PDU]"
"7.403103","5.9.29.183","172.19.0.3","TCP","1516","9002 → 43520 [PSH, ACK] Seq=403772 Ack=22633 Win=65535 Len=1460 [TCP segment of a reassembled PDU]"
"7.403123","172.19.0.3","5.9.29.183","TCP","56","43520 → 9002 [ACK] Seq=22633 Ack=405232 Win=11903 Len=0"
"7.403126","5.9.29.183","172.19.0.3","TLSv1.2","1225","Application Data"
"7.403305","5.9.29.183","172.19.0.3","TCP","1516","[TCP segment of a reassembled PDU]"
"7.403314","172.19.0.3","5.9.29.183","TCP","56","43520 → 9002 [ACK] Seq=22633 Ack=407861 Win=11911 Len=0"
"7.403316","5.9.29.183","172.19.0.3","TCP","1492","9002 → 43520 [PSH, ACK] Seq=407861 Ack=22633 Win=65535 Len=1436 [TCP segment of a reassembled PDU]"
"7.403601","5.9.29.183","172.19.0.3","TLSv1.2","1516","Application Data [TCP segment of a reassembled PDU]"
"7.403613","172.19.0.3","5.9.29.183","TCP","56","43520 → 9002 [ACK] Seq=22633 Ack=410757 Win=11911 Len=0"
"7.403615","5.9.29.183","172.19.0.3","TCP","1516","9002 → 43520 [PSH, ACK] Seq=410757 Ack=22633 Win=65535 Len=1460 [TCP segment of a reassembled PDU]"
"7.403620","5.9.29.183","172.19.0.3","TCP","1480","9002 → 43520 [PSH, ACK] Seq=412217 Ack=22633 Win=65535 Len=1424 [TCP segment of a reassembled PDU]"
"7.403649","172.19.0.3","5.9.29.183","TCP","56","43520 → 9002 [ACK] Seq=22633 Ack=413641 Win=11895 Len=0"
"7.418955","5.9.29.183","172.19.0.3","TLSv1.2","648","Application Data"
"7.420060","5.9.29.183","172.19.0.3","TCP","1516","[TCP segment of a reassembled PDU]"
"7.420075","172.19.0.3","5.9.29.183","TCP","56","43520 → 9002 [ACK] Seq=22633 Ack=415693 Win=11911 Len=0"
"7.420118","5.9.29.183","172.19.0.3","TCP","1492","9002 → 43520 [PSH, ACK] Seq=415693 Ack=22633 Win=65535 Len=1436 [TCP segment of a reassembled PDU]"
"7.420367","5.9.29.183","172.19.0.3","TLSv1.2","1516","Application Data [TCP segment of a reassembled PDU]"
"7.420378","172.19.0.3","5.9.29.183","TCP","56","43520 → 9002 [ACK] Seq=22633 Ack=418589 Win=11911 Len=0"
"7.420422","5.9.29.183","172.19.0.3","TCP","1516","9002 → 43520 [PSH, ACK] Seq=418589 Ack=22633 Win=65535 Len=1460 [TCP segment of a reassembled PDU]"
"7.420430","5.9.29.183","172.19.0.3","TCP","1480","9002 → 43520 [PSH, ACK] Seq=420049 Ack=22633 Win=65535 Len=1424 [TCP segment of a reassembled PDU]"
"7.420588","172.19.0.3","5.9.29.183","TCP","56","43520 → 9002 [ACK] Seq=22633 Ack=421473 Win=11895 Len=0"
"7.434113","5.9.29.183","172.19.0.3","TLSv1.2","584","Application Data"
"7.438454","172.19.0.3","5.9.29.183","TLSv1.2","599","Application Data"
"7.438768","5.9.29.183","172.19.0.3","TCP","56","9002 → 43520 [ACK] Seq=422001 Ack=23176 Win=65535 Len=0"
"7.697221","5.9.29.183","172.19.0.3","TLSv1.2","599","Application Data"
"7.698017","172.19.0.3","5.9.29.183","TLSv1.2","599","Application Data"
"7.698332","5.9.29.183","172.19.0.3","TCP","56","9002 → 43520 [ACK] Seq=422544 Ack=23719 Win=65535 Len=0"
"7.962835","5.9.29.183","172.19.0.3","TLSv1.2","599","Application Data"
"7.975551","5.9.29.183","172.19.0.3","TCP","1516","[TCP segment of a reassembled PDU]"
"7.975571","172.19.0.3","5.9.29.183","TCP","56","43520 → 9002 [ACK] Seq=23719 Ack=424547 Win=11911 Len=0"
"7.975614","5.9.29.183","172.19.0.3","TCP","1516","9002 → 43520 [PSH, ACK] Seq=424547 Ack=23719 Win=65535 Len=1460 [TCP segment of a reassembled PDU]"
"7.975625","5.9.29.183","172.19.0.3","TLSv1.2","1480","Application Data [TCP segment of a reassembled PDU]"
"7.975628","5.9.29.183","172.19.0.3","TCP","1516","9002 → 43520 [PSH, ACK] Seq=427431 Ack=23719 Win=65535 Len=1460 [TCP segment of a reassembled PDU]"
"7.975631","5.9.29.183","172.19.0.3","TCP","1492","9002 → 43520 [PSH, ACK] Seq=428891 Ack=23719 Win=65535 Len=1436 [TCP segment of a reassembled PDU]"
"7.975771","172.19.0.3","5.9.29.183","TCP","56","43520 → 9002 [ACK] Seq=23719 Ack=430327 Win=11879 Len=0"
"7.978667","5.9.29.183","172.19.0.3","TLSv1.2","70","Application Data"
"7.993224","5.9.29.183","172.19.0.3","TCP","1516","[TCP segment of a reassembled PDU]"
"7.993242","172.19.0.3","5.9.29.183","TCP","56","43520 → 9002 [ACK] Seq=23719 Ack=431801 Win=11911 Len=0"
"7.993309","5.9.29.183","172.19.0.3","TCP","1516","9002 → 43520 [PSH, ACK] Seq=431801 Ack=23719 Win=65535 Len=1460 [TCP segment of a reassembled PDU]"
"7.993318","5.9.29.183","172.19.0.3","TLSv1.2","1516","Application Data [TCP segment of a reassembled PDU]"
"7.993321","5.9.29.183","172.19.0.3","TCP","1516","9002 → 43520 [PSH, ACK] Seq=434721 Ack=23719 Win=65535 Len=1460 [TCP segment of a reassembled PDU]"
"7.993323","5.9.29.183","172.19.0.3","TCP","1285","9002 → 43520 [PSH, ACK] Seq=436181 Ack=23719 Win=65535 Len=1229 [TCP segment of a reassembled PDU]"
"7.993375","172.19.0.3","5.9.29.183","TCP","56","43520 → 9002 [ACK] Seq=23719 Ack=437410 Win=11877 Len=0"
"7.993377","5.9.29.183","172.19.0.3","TCP","227","9002 → 43520 [PSH, ACK] Seq=437410 Ack=23719 Win=65535 Len=171 [TCP segment of a reassembled PDU]"
"7.993959","5.9.29.183","172.19.0.3","TLSv1.2","584","Application Data"
"7.994047","172.19.0.3","5.9.29.183","TCP","56","43520 → 9002 [ACK] Seq=23719 Ack=438109 Win=11911 Len=0"
"8.009544","5.9.29.183","172.19.0.3","TCP","1504","[TCP segment of a reassembled PDU]"
"8.009792","5.9.29.183","172.19.0.3","TCP","1516","9002 → 43520 [PSH, ACK] Seq=439557 Ack=23719 Win=65535 Len=1460 [TCP segment of a reassembled PDU]"
"8.009803","172.19.0.3","5.9.29.183","TCP","56","43520 → 9002 [ACK] Seq=23719 Ack=441017 Win=11911 Len=0"
"8.009807","5.9.29.183","172.19.0.3","TLSv1.2","1516","Application Data [TCP segment of a reassembled PDU]"
"8.009832","5.9.29.183","172.19.0.3","TCP","1516","9002 → 43520 [PSH, ACK] Seq=442477 Ack=23719 Win=65535 Len=1460 [TCP segment of a reassembled PDU]"
"8.009860","172.19.0.3","5.9.29.183","TCP","56","43520 → 9002 [ACK] Seq=23719 Ack=443937 Win=11895 Len=0"
"8.009924","5.9.29.183","172.19.0.3","TCP","1516","9002 → 43520 [PSH, ACK] Seq=443937 Ack=23719 Win=65535 Len=1460 [TCP segment of a reassembled PDU]"
"8.009930","5.9.29.183","172.19.0.3","TLSv1.2","1189","Application Data [TCP segment of a reassembled PDU]"
"8.009932","5.9.29.183","172.19.0.3","TCP","1516","9002 → 43520 [PSH, ACK] Seq=446530 Ack=23719 Win=65535 Len=1460 [TCP segment of a reassembled PDU]"
"8.009934","5.9.29.183","172.19.0.3","TCP","1492","9002 → 43520 [PSH, ACK] Seq=447990 Ack=23719 Win=65535 Len=1436 [TCP segment of a reassembled PDU]"
"8.009984","172.19.0.3","5.9.29.183","TCP","56","43520 → 9002 [ACK] Seq=23719 Ack=449426 Win=11863 Len=0"
"8.010208","172.19.0.3","5.9.29.183","TLSv1.2","599","Application Data"
"8.010358","5.9.29.183","172.19.0.3","TCP","56","9002 → 43520 [ACK] Seq=449426 Ack=24262 Win=65535 Len=0"
"8.025718","5.9.29.183","172.19.0.3","TLSv1.2","1191","Application Data, Application Data"
"8.026069","172.19.0.3","5.9.29.183","TLSv1.2","599","Application Data"
"8.026335","5.9.29.183","172.19.0.3","TCP","56","9002 → 43520 [ACK] Seq=450561 Ack=24805 Win=65535 Len=0"
"8.026385","5.9.29.183","172.19.0.3","TCP","1516","[TCP segment of a reassembled PDU]"
"8.026475","5.9.29.183","172.19.0.3","TCP","1516","9002 → 43520 [PSH, ACK] Seq=452021 Ack=24805 Win=65535 Len=1460 [TCP segment of a reassembled PDU]"
"8.026479","5.9.29.183","172.19.0.3","TLSv1.2","1480","Application Data [TCP segment of a reassembled PDU]"
"8.026486","5.9.29.183","172.19.0.3","TCP","1504","9002 → 43520 [PSH, ACK] Seq=454905 Ack=24805 Win=65535 Len=1448 [TCP segment of a reassembled PDU]"
"8.026488","172.19.0.3","5.9.29.183","TCP","56","43520 → 9002 [ACK] Seq=24805 Ack=453481 Win=11911 Len=0"
"8.026561","172.19.0.3","5.9.29.183","TCP","56","43520 → 9002 [ACK] Seq=24805 Ack=456353 Win=11903 Len=0"
"8.026640","5.9.29.183","172.19.0.3","TCP","1516","9002 → 43520 [PSH, ACK] Seq=456353 Ack=24805 Win=65535 Len=1460 [TCP segment of a reassembled PDU]"
"8.026644","5.9.29.183","172.19.0.3","TLSv1.2","1516","Application Data [TCP segment of a reassembled PDU]"
"8.026672","172.19.0.3","5.9.29.183","TCP","56","43520 → 9002 [ACK] Seq=24805 Ack=459273 Win=11887 Len=0"
"8.026678","5.9.29.183","172.19.0.3","TCP","1480","9002 → 43520 [PSH, ACK] Seq=459273 Ack=24805 Win=65535 Len=1424 [TCP segment of a reassembled PDU]"
"8.026724","5.9.29.183","172.19.0.3","TCP","1504","9002 → 43520 [PSH, ACK] Seq=460697 Ack=24805 Win=65535 Len=1448 [TCP segment of a reassembled PDU]"
"8.026819","172.19.0.3","5.9.29.183","TCP","56","43520 → 9002 [ACK] Seq=24805 Ack=462145 Win=11869 Len=0"
"8.041202","5.9.29.183","172.19.0.3","TLSv1.2","381","Application Data"
"8.047439","5.9.29.183","172.19.0.3","TCP","1516","[TCP segment of a reassembled PDU]"
"8.047466","172.19.0.3","5.9.29.183","TCP","56","43520 → 9002 [ACK] Seq=24805 Ack=463930 Win=11911 Len=0"
"8.047528","5.9.29.183","172.19.0.3","TCP","1492","9002 → 43520 [PSH, ACK] Seq=463930 Ack=24805 Win=65535 Len=1436 [TCP segment of a reassembled PDU]"
"8.056430","5.9.29.183","172.19.0.3","TLSv1.2","1330","Application Data, Application Data"
"8.056456","172.19.0.3","5.9.29.183","TCP","56","43520 → 9002 [ACK] Seq=24805 Ack=466640 Win=11911 Len=0"
"8.058617","5.9.29.183","172.19.0.3","TCP","1504","[TCP segment of a reassembled PDU]"
"8.058740","5.9.29.183","172.19.0.3","TCP","1516","9002 → 43520 [PSH, ACK] Seq=468088 Ack=24805 Win=65535 Len=1460 [TCP segment of a reassembled PDU]"
"8.058746","5.9.29.183","172.19.0.3","TLSv1.2","1492","Application Data [TCP segment of a reassembled PDU]"
"8.058748","5.9.29.183","172.19.0.3","TCP","1504","9002 → 43520 [PSH, ACK] Seq=470984 Ack=24805 Win=65535 Len=1448 [TCP segment of a reassembled PDU]"
"8.058770","172.19.0.3","5.9.29.183","TCP","56","43520 → 9002 [ACK] Seq=24805 Ack=472432 Win=11887 Len=0"
"8.059057","5.9.29.183","172.19.0.3","TCP","1516","9002 → 43520 [PSH, ACK] Seq=472432 Ack=24805 Win=65535 Len=1460 [TCP segment of a reassembled PDU]"
"8.059094","5.9.29.183","172.19.0.3","TLSv1.2","1492","Application Data [TCP segment of a reassembled PDU]"
"8.059104","172.19.0.3","5.9.29.183","TCP","56","43520 → 9002 [ACK] Seq=24805 Ack=475328 Win=11903 Len=0"
"8.059107","5.9.29.183","172.19.0.3","TCP","1516","9002 → 43520 [PSH, ACK] Seq=475328 Ack=24805 Win=65535 Len=1460 [TCP segment of a reassembled PDU]"
"8.059150","5.9.29.183","172.19.0.3","TCP","1492","9002 → 43520 [PSH, ACK] Seq=476788 Ack=24805 Win=65535 Len=1436 [TCP segment of a reassembled PDU]"
"8.059286","172.19.0.3","5.9.29.183","TLSv1.2","599","Application Data"
"8.059455","5.9.29.183","172.19.0.3","TCP","56","9002 → 43520 [ACK] Seq=478224 Ack=25348 Win=65535 Len=0"
"8.071354","5.9.29.183","172.19.0.3","TLSv1.2","381","Application Data"
"8.074752","5.9.29.183","172.19.0.3","TCP","1504","[TCP segment of a reassembled PDU]"
"8.074772","172.19.0.3","5.9.29.183","TCP","56","43520 → 9002 [ACK] Seq=25348 Ack=479997 Win=11911 Len=0"
"8.075354","5.9.29.183","172.19.0.3","TCP","1504","9002 → 43520 [PSH, ACK] Seq=479997 Ack=25348 Win=65535 Len=1448 [TCP segment of a reassembled PDU]"
"8.075434","5.9.29.183","172.19.0.3","TLSv1.2","1516","Application Data [TCP segment of a reassembled PDU]"
"8.075472","172.19.0.3","5.9.29.183","TCP","56","43520 → 9002 [ACK] Seq=25348 Ack=482905 Win=11903 Len=0"
"8.075472","5.9.29.183","172.19.0.3","TCP","1516","9002 → 43520 [PSH, ACK] Seq=482905 Ack=25348 Win=65535 Len=1460 [TCP segment of a reassembled PDU]"
"8.075475","5.9.29.183","172.19.0.3","TCP","1516","9002 → 43520 [PSH, ACK] Seq=484365 Ack=25348 Win=65535 Len=1460 [TCP segment of a reassembled PDU]"
"8.075476","5.9.29.183","172.19.0.3","TLSv1.2","1516","Application Data [TCP segment of a reassembled PDU]"
"8.075478","5.9.29.183","172.19.0.3","TCP","1516","9002 → 43520 [PSH, ACK] Seq=487285 Ack=25348 Win=65535 Len=1460 [TCP segment of a reassembled PDU]"
"8.075552","5.9.29.183","172.19.0.3","TCP","1516","9002 → 43520 [PSH, ACK] Seq=488745 Ack=25348 Win=65535 Len=1460 [TCP segment of a reassembled PDU]"
"8.075632","5.9.29.183","172.19.0.3","TLSv1.2","1516","Application Data [TCP segment of a reassembled PDU]"
"8.075637","5.9.29.183","172.19.0.3","TCP","1516","9002 → 43520 [PSH, ACK] Seq=491665 Ack=25348 Win=65535 Len=1460 [TCP segment of a reassembled PDU]"
"8.075640","5.9.29.183","172.19.0.3","TCP","1408","9002 → 43520 [PSH, ACK] Seq=493125 Ack=25348 Win=65535 Len=1352 [TCP segment of a reassembled PDU]"
"8.075734","172.19.0.3","5.9.29.183","TCP","56","43520 → 9002 [ACK] Seq=25348 Ack=494477 Win=11836 Len=0"
"8.086790","5.9.29.183","172.19.0.3","TLSv1.2","178","Application Data"
"8.093223","5.9.29.183","172.19.0.3","TCP","1504","[TCP segment of a reassembled PDU]"
"8.093277","172.19.0.3","5.9.29.183","TCP","56","43520 → 9002 [ACK] Seq=25348 Ack=496047 Win=11911 Len=0"
"8.093452","5.9.29.183","172.19.0.3","TCP","1504","9002 → 43520 [PSH, ACK] Seq=496047 Ack=25348 Win=65535 Len=1448 [TCP segment of a reassembled PDU]"
"8.093743","5.9.29.183","172.19.0.3","TLSv1.2","1516","Application Data [TCP segment of a reassembled PDU]"
"8.093755","172.19.0.3","5.9.29.183","TCP","56","43520 → 9002 [ACK] Seq=25348 Ack=498955 Win=11911 Len=0"
"8.093805","5.9.29.183","172.19.0.3","TCP","1516","9002 → 43520 [PSH, ACK] Seq=498955 Ack=25348 Win=65535 Len=1460 [TCP segment of a reassembled PDU]"
"8.093814","5.9.29.183","172.19.0.3","TCP","1516","9002 → 43520 [PSH, ACK] Seq=500415 Ack=25348 Win=65535 Len=1460 [TCP segment of a reassembled PDU]"
"8.093818","5.9.29.183","172.19.0.3","TLSv1.2","1127","Application Data [TCP segment of a reassembled PDU]"
"8.093879","5.9.29.183","172.19.0.3","TCP","397","9002 → 43520 [PSH, ACK] Seq=502946 Ack=25348 Win=65535 Len=341 [TCP segment of a reassembled PDU]"
"8.093905","172.19.0.3","5.9.29.183","TCP","56","43520 → 9002 [ACK] Seq=25348 Ack=503287 Win=11879 Len=0"
"8.094178","172.19.0.3","5.9.29.183","TLSv1.2","599","Application Data"
"8.094420","5.9.29.183","172.19.0.3","TCP","56","9002 → 43520 [ACK] Seq=503287 Ack=25891 Win=65535 Len=0"
"8.101687","5.9.29.183","172.19.0.3","TLSv1.2","1221","Application Data"
"8.104227","172.19.0.3","5.9.29.183","TLSv1.2","599","Application Data"
"8.104650","5.9.29.183","172.19.0.3","TCP","56","9002 → 43520 [ACK] Seq=504452 Ack=26434 Win=65535 Len=0"
