_ws.col.Time,_ws.col.Source,_ws.col.Destination,_ws.col.Protocol,_ws.col.Length,_ws.col.Info
"0.000000","172.19.0.3","5.9.29.183","TLSv1.2","599","Application Data"
"0.000317","5.9.29.183","172.19.0.3","TCP","56","9002 → 43520 [ACK] Seq=1 Ack=544 Win=65535 Len=0"
"0.968432","5.9.29.183","172.19.0.3","TLSv1.2","599","Application Data"
"0.968475","172.19.0.3","5.9.29.183","TCP","56","43520 → 9002 [ACK] Seq=544 Ack=544 Win=12738 Len=0"
"0.969539","172.19.0.3","5.9.29.183","TLSv1.2","2141","Application Data"
"0.969850","5.9.29.183","172.19.0.3","TCP","56","9002 → 43520 [ACK] Seq=544 Ack=2004 Win=65535 Len=0"
"0.969931","5.9.29.183","172.19.0.3","TCP","56","9002 → 43520 [ACK] Seq=544 Ack=2629 Win=65535 Len=0"
"1.890755","5.9.29.183","172.19.0.3","TLSv1.2","599","Application Data"
"1.934668","172.19.0.3","5.9.29.183","TCP","56","43520 → 9002 [ACK] Seq=2629 Ack=1087 Win=12738 Len=0"
"2.004837","5.9.29.183","172.19.0.3","TLSv1.2","1113","Application Data"
"2.004864","172.19.0.3","5.9.29.183","TCP","56","43520 → 9002 [ACK] Seq=2629 Ack=2144 Win=12738 Len=0"
"2.008837","172.19.0.3","5.9.29.183","TLSv1.2","599","Application Data"
"2.009122","5.9.29.183","172.19.0.3","TCP","56","9002 → 43520 [ACK] Seq=2144 Ack=3172 Win=65535 Len=0"
"2.811255","5.9.29.183","172.19.0.3","TLSv1.2","599","Application Data"
"2.811960","172.19.0.3","5.9.29.183","TLSv1.2","599","Application Data"
"2.812458","5.9.29.183","172.19.0.3","TCP","56","9002 → 43520 [ACK] Seq=2687 Ack=3715 Win=65535 Len=0"
"3.463716","5.9.29.183","172.19.0.3","TLSv1.2","599","Application Data"
"3.474564","5.9.29.183","172.19.0.3","TCP","1516","[TCP segment of a reassembled PDU]"
"3.474662","172.19.0.3","5.9.29.183","TCP","56","43520 → 9002 [ACK] Seq=3715 Ack=4690 Win=12738 Len=0"
"3.474884","5.9.29.183","172.19.0.3","TCP","1492","9002 → 43520 [PSH, ACK] Seq=4690 Ack=3715 Win=65535 Len=1436 [TCP segment of a reassembled PDU]"
"3.474903","5.9.29.183","172.19.0.3","TLSv1.2","1516","Application Data [TCP segment of a reassembled PDU]"
"3.474910","5.9.29.183","172.19.0.3","TCP","1516","9002 → 43520 [PSH, ACK] Seq=7586 Ack=3715 Win=65535 Len=1460 [TCP segment of a reassembled PDU]"
"3.474950","5.9.29.183","172.19.0.3","TCP","1480","9002 → 43520 [PSH, ACK] Seq=9046 Ack=3715 Win=65535 Len=1424 [TCP segment of a reassembled PDU]"
"3.475023","172.19.0.3","5.9.29.183","TCP","56","43520 → 9002 [ACK] Seq=3715 Ack=10470 Win=12706 Len=0"
"3.479431","5.9.29.183","172.19.0.3","TLSv1.2","1127","Application Data, Application Data"
"3.520014","172.19.0.3","5.9.29.183","TCP","56","43520 → 9002 [ACK] Seq=3715 Ack=11541 Win=12738 Len=0"
"3.611475","5.9.29.183","172.19.0.3","TCP","1516","[TCP segment of a reassembled PDU]"
"3.611497","172.19.0.3","5.9.29.183","TCP","56","43520 → 9002 [ACK] Seq=3715 Ack=13001 Win=12738 Len=0"
"3.611507","5.9.29.183","172.19.0.3","TCP","1516","9002 → 43520 [PSH, ACK] Seq=13001 Ack=3715 Win=65535 Len=1460 [TCP segment of a reassembled PDU]"
"3.611518","172.19.0.3","5.9.29.183","TCP","56","43520 → 9002 [ACK] Seq=3715 Ack=14461 Win=12730 Len=0"
"3.611519","5.9.29.183","172.19.0.3","TLSv1.2","763","Application Data"
"3.611525","172.19.0.3","5.9.29.183","TCP","56","43520 → 9002 [ACK] Seq=3715 Ack=15168 Win=12725 Len=0"
"3.693206","5.9.29.183","172.19.0.3","TCP","1516","[TCP segment of a reassembled PDU]"
"3.693221","172.19.0.3","5.9.29.183","TCP","56","43520 → 9002 [ACK] Seq=3715 Ack=16628 Win=12738 Len=0"
"3.693228","5.9.29.183","172.19.0.3","TCP","1492","9002 → 43520 [PSH, ACK] Seq=16628 Ack=3715 Win=65535 Len=1436 [TCP segment of a reassembled PDU]"
"3.693233","172.19.0.3","5.9.29.183","TCP","56","43520 → 9002 [ACK] Seq=3715 Ack=18064 Win=12730 Len=0"
"3.693857","5.9.29.183","172.19.0.3","TLSv1.2","1237","Application Data"
"3.693886","172.19.0.3","5.9.29.183","TCP","56","43520 → 9002 [ACK] Seq=3715 Ack=19245 Win=12738 Len=0"
"3.693959","5.9.29.183","172.19.0.3","TCP","1516","[TCP segment of a reassembled PDU]"
"3.693965","172.19.0.3","5.9.29.183","TCP","56","43520 → 9002 [ACK] Seq=3715 Ack=20705 Win=12730 Len=0"
"3.693967","5.9.29.183","172.19.0.3","TCP","1492","9002 → 43520 [PSH, ACK] Seq=20705 Ack=3715 Win=65535 Len=1436 [TCP segment of a reassembled PDU]"
"3.693970","172.19.0.3","5.9.29.183","TCP","56","43520 → 9002 [ACK] Seq=3715 Ack=22141 Win=12722 Len=0"
"3.705494","5.9.29.183","172.19.0.3","TLSv1.2","1516","Application Data [TCP segment of a reassembled PDU]"
"3.705520","172.19.0.3","5.9.29.183","TCP","56","43520 → 9002 [ACK] Seq=3715 Ack=23601 Win=12738 Len=0"
"3.705539","5.9.29.183","172.19.0.3","TCP","1492","9002 → 43520 [PSH, ACK] Seq=23601 Ack=3715 Win=65535 Len=1436 [TCP segment of a reassembled PDU]"
"3.705555","172.19.0.3","5.9.29.183","TCP","56","43520 → 9002 [ACK] Seq=3715 Ack=25037 Win=12730 Len=0"
"3.705804","5.9.29.183","172.19.0.3","TCP","1516","9002 → 43520 [PSH, ACK] Seq=25037 Ack=3715 Win=65535 Len=1460 [TCP segment of a reassembled PDU]"
"3.705819","172.19.0.3","5.9.29.183","TCP","56","43520 → 9002 [ACK] Seq=3715 Ack=26497 Win=12722 Len=0"
"3.705822","5.9.29.183","172.19.0.3","TLSv1.2","1516","Application Data [TCP segment of a reassembled PDU]"
"3.705831","172.19.0.3","5.9.29.183","TCP","56","43520 → 9002 [ACK] Seq=3715 Ack=27957 Win=12714 Len=0"
"3.705832","5.9.29.183","172.19.0.3","TCP","1480","9002 → 43520 [PSH, ACK] Seq=27957 Ack=3715 Win=65535 Len=1424 [TCP segment of a reassembled PDU]"
"3.705837","172.19.0.3","5.9.29.183","TCP","56","43520 → 9002 [ACK] Seq=3715 Ack=29381 Win=12706 Len=0"
"3.708576","5.9.29.183","172.19.0.3","TLSv1.2","1516","Application Data [TCP segment of a reassembled PDU]"
"3.708808","5.9.29.183","172.19.0.3","TCP","1492","9002 → 43520 [PSH, ACK] Seq=30841 Ack=3715 Win=65535 Len=1436 [TCP segment of a reassembled PDU]"
"3.708827","172.19.0.3","5.9.29.183","TCP","56","43520 → 9002 [ACK] Seq=3715 Ack=32277 Win=12728 Len=0"
"3.709107","172.19.0.3","5.9.29.183","TLSv1.2","599","Application Data"
"3.709338","5.9.29.183","172.19.0.3","TCP","1504","9002 → 43520 [PSH, ACK] Seq=32277 Ack=3715 Win=65535 Len=1448 [TCP segment of a reassembled PDU]"
"3.709428","5.9.29.183","172.19.0.3","TLSv1.2","1516","Application Data [TCP segment of a reassembled PDU]"
"3.709453","5.9.29.183","172.19.0.3","TLSv1.2","1287","Application Data"
"3.709512","172.19.0.3","5.9.29.183","TCP","56","43520 → 9002 [ACK] Seq=4258 Ack=36416 Win=12704 Len=0"
"3.709590","5.9.29.183","172.19.0.3","TCP","56","9002 → 43520 [ACK] Seq=36416 Ack=4258 Win=65535 Len=0"
"3.729673","5.9.29.183","172.19.0.3","TCP","1504","[TCP segment of a reassembled PDU]"
"3.729846","5.9.29.183","172.19.0.3","TCP","1504","9002 → 43520 [PSH, ACK] Seq=37864 Ack=4258 Win=65535 Len=1448 [TCP segment of a reassembled PDU]"
"3.729861","172.19.0.3","5.9.29.183","TCP","56","43520 → 9002 [ACK] Seq=4258 Ack=39312 Win=12730 Len=0"
"3.729864","5.9.29.183","172.19.0.3","TLSv1.2","1237","Application Data"
"3.731128","5.9.29.183","172.19.0.3","TLSv1.2","1504","Application Data"
"3.731139","172.19.0.3","5.9.29.183","TCP","56","43520 → 9002 [ACK] Seq=4258 Ack=41941 Win=12738 Len=0"
"3.746196","5.9.29.183","172.19.0.3","TLSv1.2","1300","Application Data"
"3.788660","172.19.0.3","5.9.29.183","TCP","56","43520 → 9002 [ACK] Seq=4258 Ack=43185 Win=12738 Len=0"
"3.828621","5.9.29.183","172.19.0.3","TCP","1516","[TCP segment of a reassembled PDU]"
"3.828653","5.9.29.183","172.19.0.3","TCP","1492","9002 → 43520 [PSH, ACK] Seq=44645 Ack=4258 Win=65535 Len=1436 [TCP segment of a reassembled PDU]"
"3.828663","5.9.29.183","172.19.0.3","TLSv1.2","787","Application Data"
"3.828797","172.19.0.3","5.9.29.183","TCP","56","43520 → 9002 [ACK] Seq=4258 Ack=46812 Win=12722 Len=0"
"3.887085","5.9.29.183","172.19.0.3","TCP","1516","[TCP segment of a reassembled PDU]"
"3.887233","5.9.29.183","172.19.0.3","TCP","1492","9002 → 43520 [PSH, ACK] Seq=48272 Ack=4258 Win=65535 Len=1436 [TCP segment of a reassembled PDU]"
"3.887304","172.19.0.3","5.9.29.183","TCP","56","43520 → 9002 [ACK] Seq=4258 Ack=49708 Win=12730 Len=0"
"3.887513","5.9.29.183","172.19.0.3","TLSv1.2","1237","Application Data"
"3.887549","5.9.29.183","172.19.0.3","TCP","1516","[TCP segment of a reassembled PDU]"
"3.887560","5.9.29.183","172.19.0.3","TCP","1516","9002 → 43520 [PSH, ACK] Seq=52349 Ack=4258 Win=65535 Len=1460 [TCP segment of a reassembled PDU]"
"3.887565","5.9.29.183","172.19.0.3","TLSv1.2","1516","Application Data [TCP segment of a reassembled PDU]"
"3.887569","5.9.29.183","172.19.0.3","TCP","1516","9002 → 43520 [PSH, ACK] Seq=55269 Ack=4258 Win=65535 Len=1460 [TCP segment of a reassembled PDU]"
"3.887572","5.9.29.183","172.19.0.3","TCP","1516","9002 → 43520 [PSH, ACK] Seq=56729 Ack=4258 Win=65535 Len=1460 [TCP segment of a reassembled PDU]"
"3.887598","5.9.29.183","172.19.0.3","TLSv1.2","1444","Application Data [TCP segment of a reassembled PDU]"
"3.887602","5.9.29.183","172.19.0.3","TCP","1516","9002 → 43520 [PSH, ACK] Seq=59577 Ack=4258 Win=65535 Len=1460 [TCP segment of a reassembled PDU]"
"3.887774","5.9.29.183","172.19.0.3","TCP","787","9002 → 43520 [PSH, ACK] Seq=61037 Ack=4258 Win=65535 Len=731 [TCP segment of a reassembled PDU]"
"3.887781","5.9.29.183","172.19.0.3","TCP","761","9002 → 43520 [PSH, ACK] Seq=61768 Ack=4258 Win=65535 Len=705 [TCP segment of a reassembled PDU]"
"3.887853","172.19.0.3","5.9.29.183","TCP","56","43520 → 9002 [ACK] Seq=4258 Ack=62473 Win=12647 Len=0"
"3.888137","172.19.0.3","5.9.29.183","TLSv1.2","599","Application Data"
"3.888354","5.9.29.183","172.19.0.3","TCP","56","9002 → 43520 [ACK] Seq=62473 Ack=4801 Win=65535 Len=0"
"3.890729","5.9.29.183","172.19.0.3","TLSv1.2","1504","Application Data, Application Data"
"3.899608","172.19.0.3","5.9.29.183","TLSv1.2","599","Application Data"
"3.900190","5.9.29.183","172.19.0.3","TCP","56","9002 → 43520 [ACK] Seq=63921 Ack=5344 Win=65535 Len=0"
"3.902864","5.9.29.183","172.19.0.3","TCP","1504","9002 → 43520 [PSH, ACK] Seq=63921 Ack=5344 Win=65535 Len=1448 [TCP segment of a reassembled PDU]"
"3.903236","5.9.29.183","172.19.0.3","TCP","1516","9002 → 43520 [PSH, ACK] Seq=65369 Ack=5344 Win=65535 Len=1460 [TCP segment of a reassembled PDU]"
"3.903252","172.19.0.3","5.9.29.183","TCP","56","43520 → 9002 [ACK] Seq=5344 Ack=66829 Win=12738 Len=0"
"3.903259","5.9.29.183","172.19.0.3","TLSv1.2","1516","Application Data [TCP segment of a reassembled PDU]"
"3.903265","5.9.29.183","172.19.0.3","TCP","1516","9002 → 43520 [PSH, ACK] Seq=68289 Ack=5344 Win=65535 Len=1460 [TCP segment of a reassembled PDU]"
"3.903268","5.9.29.183","172.19.0.3","TCP","1516","9002 → 43520 [PSH, ACK] Seq=69749 Ack=5344 Win=65535 Len=1460 [TCP segment of a reassembled PDU]"
"3.903271","5.9.29.183","172.19.0.3","TLSv1.2","1456","Application Data [TCP segment of a reassembled PDU]"
"3.903419","5.9.29.183","172.19.0.3","TCP","1516","9002 → 43520 [PSH, ACK] Seq=72609 Ack=5344 Win=65535 Len=1460 [TCP segment of a reassembled PDU]"
"3.903426","5.9.29.183","172.19.0.3","TLSv1.2","1492","Application Data [TCP segment of a reassembled PDU]"
"3.903513","5.9.29.183","172.19.0.3","TCP","1516","9002 → 43520 [PSH, ACK] Seq=75505 Ack=5344 Win=65535 Len=1460 [TCP segment of a reassembled PDU]"
"3.903518","5.9.29.183","172.19.0.3","TCP","1492","9002 → 43520 [PSH, ACK] Seq=76965 Ack=5344 Win=65535 Len=1436 [TCP segment of a reassembled PDU]"
"3.903526","172.19.0.3","5.9.29.183","TCP","56","43520 → 9002 [ACK] Seq=5344 Ack=75505 Win=12690 Len=0"
"3.903780","172.19.0.3","5.9.29.183","TCP","56","43520 → 9002 [ACK] Seq=5344 Ack=78401 Win=12674 Len=0"
"3.904179","5.9.29.183","172.19.0.3","TLSv1.2","1516","Application Data [TCP segment of a reassembled PDU]"
"3.904186","5.9.29.183","172.19.0.3","TLSv1.2","736","Application Data, Application Data"
"3.904193","172.19.0.3","5.9.29.183","TCP","56","43520 → 9002 [ACK] Seq=5344 Ack=80541 Win=12730 Len=0"
"3.910170","172.19.0.3","5.9.29.183","TLSv1.2","599","Application Data"
"3.910731","5.9.29.183","172.19.0.3","TCP","56","9002 → 43520 [ACK] Seq=80541 Ack=5887 Win=65535 Len=0"
"3.915692","5.9.29.183","172.19.0.3","TCP","1504","[TCP segment of a reassembled PDU]"
"3.919578","5.9.29.183","172.19.0.3","TLSv1.2","179","Application Data"
"3.919729","172.19.0.3","5.9.29.183","TCP","56","43520 → 9002 [ACK] Seq=5887 Ack=82112 Win=12738 Len=0"
"3.924217","172.19.0.3","5.9.29.183","TLSv1.2","599","Application Data"
"3.924443","5.9.29.183","172.19.0.3","TCP","56","9002 → 43520 [ACK] Seq=82112 Ack=6430 Win=65535 Len=0"
"4.986336","5.9.29.183","172.19.0.3","TLSv1.2","599","Application Data"
"4.987123","172.19.0.3","5.9.29.183","TLSv1.2","599","Application Data"
"4.987481","5.9.29.183","172.19.0.3","TCP","56","9002 → 43520 [ACK] Seq=82655 Ack=6973 Win=65535 Len=0"
"5.597724","5.9.29.183","172.19.0.3","TLSv1.2","599","Application Data"
"5.629456","5.9.29.183","172.19.0.3","TCP","1516","[TCP segment of a reassembled PDU]"
"5.629478","172.19.0.3","5.9.29.183","TCP","56","43520 → 9002 [ACK] Seq=6973 Ack=84658 Win=12738 Len=0"
"5.629495","5.9.29.183","172.19.0.3","TCP","1516","9002 → 43520 [PSH, ACK] Seq=84658 Ack=6973 Win=65535 Len=1460 [TCP segment of a reassembled PDU]"
"5.629507","5.9.29.183","172.19.0.3","TLSv1.2","763","Application Data"
"5.629781","172.19.0.3","5.9.29.183","TCP","56","43520 → 9002 [ACK] Seq=6973 Ack=86825 Win=12722 Len=0"
"5.644202","5.9.29.183","172.19.0.3","TCP","1516","[TCP segment of a reassembled PDU]"
"5.644225","5.9.29.183","172.19.0.3","TCP","1492","9002 → 43520 [PSH, ACK] Seq=88285 Ack=6973 Win=65535 Len=1436 [TCP segment of a reassembled PDU]"
"5.644238","172.19.0.3","5.9.29.183","TCP","56","43520 → 9002 [ACK] Seq=6973 Ack=89721 Win=12730 Len=0"
"5.646409","5.9.29.183","172.19.0.3","TLSv1.2","1330","Application Data, Application Data"
"5.696887","172.19.0.3","5.9.29.183","TCP","56","43520 → 9002 [ACK] Seq=6973 Ack=90995 Win=12738 Len=0"
"5.765690","5.9.29.183","172.19.0.3","TCP","1516","[TCP segment of a reassembled PDU]"
"5.765712","172.19.0.3","5.9.29.183","TCP","56","43520 → 9002 [ACK] Seq=6973 Ack=92455 Win=12738 Len=0"
"5.765726","5.9.29.183","172.19.0.3","TCP","1492","9002 → 43520 [PSH, ACK] Seq=92455 Ack=6973 Win=65535 Len=1436 [TCP segment of a reassembled PDU]"
"5.765736","172.19.0.3","5.9.29.183","TCP","56","43520 → 9002 [ACK] Seq=6973 Ack=93891 Win=12730 Len=0"
"5.765737","5.9.29.183","172.19.0.3","TLSv1.2","1237","Application Data"
"5.765743","172.19.0.3","5.9.29.183","TCP","56","43520 → 9002 [ACK] Seq=6973 Ack=95072 Win=12722 Len=0"
"5.775201","5.9.29.183","172.19.0.3","TLSv1.2","1504","Application Data"
"5.775226","172.19.0.3","5.9.29.183","TCP","56","43520 → 9002 [ACK] Seq=6973 Ack=96520 Win=12738 Len=0"
"5.776033","5.9.29.183","172.19.0.3","TCP","1504","9002 → 43520 [PSH, ACK] Seq=96520 Ack=6973 Win=65535 Len=1448 [TCP segment of a reassembled PDU]"
"5.776046","172.19.0.3","5.9.29.183","TCP","56","43520 → 9002 [ACK] Seq=6973 Ack=97968 Win=12738 Len=0"
"5.776054","5.9.29.183","172.19.0.3","TLSv1.2","1516","Application Data [TCP segment of a reassembled PDU]"
"5.776126","172.19.0.3","5.9.29.183","TCP","56","43520 → 9002 [ACK] Seq=6973 Ack=99428 Win=12730 Len=0"
"5.776267","5.9.29.183","172.19.0.3","TCP","1516","9002 → 43520 [PSH, ACK] Seq=99428 Ack=6973 Win=65535 Len=1460 [TCP segment of a reassembled PDU]"
"5.776277","172.19.0.3","5.9.29.183","TCP","56","43520 → 9002 [ACK] Seq=6973 Ack=100888 Win=12722 Len=0"
"5.776279","5.9.29.183","172.19.0.3","TCP","1516","9002 → 43520 [PSH, ACK] Seq=100888 Ack=6973 Win=65535 Len=1460 [TCP segment of a reassembled PDU]"
"5.776287","172.19.0.3","5.9.29.183","TCP","56","43520 → 9002 [ACK] Seq=6973 Ack=102348 Win=12714 Len=0"
"5.776288","5.9.29.183","172.19.0.3","TLSv1.2","1516","Application Data [TCP segment of a reassembled PDU]"
"5.776293","172.19.0.3","5.9.29.183","TCP","56","43520 → 9002 [ACK] Seq=6973 Ack=103808 Win=12704 Len=0"
"5.776294","5.9.29.183","172.19.0.3","TCP","1456","9002 → 43520 [PSH, ACK] Seq=103808 Ack=6973 Win=65535 Len=1400 [TCP segment of a reassembled PDU]"
"5.776300","172.19.0.3","5.9.29.183","TCP","56","43520 → 9002 [ACK] Seq=6973 Ack=105208 Win=12696 Len=0"
"5.776893","172.19.0.3","5.9.29.183","TLSv1.2","599","Application Data"
"5.777138","5.9.29.183","172.19.0.3","TCP","56","9002 → 43520 [ACK] Seq=105208 Ack=7516 Win=65535 Len=0"
"5.781189","5.9.29.183","172.19.0.3","TCP","1516","9002 → 43520 [PSH, ACK] Seq=105208 Ack=7516 Win=65535 Len=1460 [TCP segment of a reassembled PDU]"
"5.781227","5.9.29.183","172.19.0.3","TLSv1.2","1516","Application Data [TCP segment of a reassembled PDU]"
"5.781243","172.19.0.3","5.9.29.183","TCP","56","43520 → 9002 [ACK] Seq=7516 Ack=108128 Win=12730 Len=0"
"5.781246","5.9.29.183","172.19.0.3","TCP","1480","9002 → 43520 [PSH, ACK] Seq=108128 Ack=7516 Win=65535 Len=1424 [TCP segment of a reassembled PDU]"
"5.781763","5.9.29.183","172.19.0.3","TLSv1.2","177","Application Data"
"5.781772","172.19.0.3","5.9.29.183","TCP","56","43520 → 9002 [ACK] Seq=7516 Ack=109673 Win=12738 Len=0"
"5.788298","5.9.29.183","172.19.0.3","TCP","1504","[TCP segment of a reassembled PDU]"
"5.788550","172.19.0.3","5.9.29.183","TLSv1.2","599","Application Data"
"5.788982","5.9.29.183","172.19.0.3","TCP","56","9002 → 43520 [ACK] Seq=111121 Ack=8059 Win=65535 Len=0"
"5.792307","5.9.29.183","172.19.0.3","TCP","1516","9002 → 43520 [PSH, ACK] Seq=111121 Ack=8059 Win=65535 Len=1460 [TCP segment of a reassembled PDU]"
"5.792338","5.9.29.183","172.19.0.3","TLSv1.2","1492","Application Data [TCP segment of a reassembled PDU]"
"5.792486","5.9.29.183","172.19.0.3","TCP","1516","9002 → 43520 [PSH, ACK] Seq=114017 Ack=8059 Win=65535 Len=1460 [TCP segment of a reassembled PDU]"
"5.792493","5.9.29.183","172.19.0.3","TCP","1516","9002 → 43520 [PSH, ACK] Seq=115477 Ack=8059 Win=65535 Len=1460 [TCP segment of a reassembled PDU]"
"5.792495","5.9.29.183","172.19.0.3","TLSv1.2","1480","Application Data [TCP segment of a reassembled PDU]"
"5.792526","172.19.0.3","5.9.29.183","TCP","56","43520 → 9002 [ACK] Seq=8059 Ack=118361 Win=12706 Len=0"
"5.797349","5.9.29.183","172.19.0.3","TLSv1.2","193","Application Data"
"5.839033","172.19.0.3","5.9.29.183","TCP","56","43520 → 9002 [ACK] Seq=8059 Ack=118498 Win=12738 Len=0"
"5.954220","5.9.29.183","172.19.0.3","TCP","1516","[TCP segment of a reassembled PDU]"
"5.954252","5.9.29.183","172.19.0.3","TCP","1492","9002 → 43520 [PSH, ACK] Seq=119958 Ack=8059 Win=65535 Len=1436 [TCP segment of a reassembled PDU]"
"5.954403","172.19.0.3","5.9.29.183","TCP","56","43520 → 9002 [ACK] Seq=8059 Ack=121394 Win=12730 Len=0"
"5.956154","5.9.29.183","172.19.0.3","TLSv1.2","1237","Application Data"
"5.956212","5.9.29.183","172.19.0.3","TCP","1516","[TCP segment of a reassembled PDU]"
"5.956229","172.19.0.3","5.9.29.183","TCP","56","43520 → 9002 [ACK] Seq=8059 Ack=124035 Win=12730 Len=0"
"5.956233","5.9.29.183","172.19.0.3","TCP","1516","9002 → 43520 [PSH, ACK] Seq=124035 Ack=8059 Win=65535 Len=1460 [TCP segment of a reassembled PDU]"
"5.956367","5.9.29.183","172.19.0.3","TLSv1.2","1516","Application Data [TCP segment of a reassembled PDU]"
"5.956407","5.9.29.183","172.19.0.3","TCP","405","9002 → 43520 [PSH, ACK] Seq=126955 Ack=8059 Win=65535 Len=349 [TCP segment of a reassembled PDU]"
"5.956412","5.9.29.183","172.19.0.3","TCP","1516","9002 → 43520 [PSH, ACK] Seq=127304 Ack=8059 Win=65535 Len=1460 [TCP segment of a reassembled PDU]"
"5.956441","5.9.29.183","172.19.0.3","TCP","1516","9002 → 43520 [PSH, ACK] Seq=128764 Ack=8059 Win=65535 Len=1460 [TCP segment of a reassembled PDU]"
"5.956445","5.9.29.183","172.19.0.3","TLSv1.2","1516","Application Data [TCP segment of a reassembled PDU]"
"5.956520","5.9.29.183","172.19.0.3","TCP","1516","9002 → 43520 [PSH, ACK] Seq=131684 Ack=8059 Win=65535 Len=1460 [TCP segment of a reassembled PDU]"
"5.956527","5.9.29.183","172.19.0.3","TCP","1071","9002 → 43520 [PSH, ACK] Seq=133144 Ack=8059 Win=65535 Len=1015 [TCP segment of a reassembled PDU]"
"5.956585","172.19.0.3","5.9.29.183","TCP","56","43520 → 9002 [ACK] Seq=8059 Ack=134159 Win=12663 Len=0"
"5.960500","5.9.29.183","172.19.0.3","TLSv1.2","1504","Application Data, Application Data"
"5.960863","5.9.29.183","172.19.0.3","TCP","1516","9002 → 43520 [PSH, ACK] Seq=135607 Ack=8059 Win=65535 Len=1460 [TCP segment of a reassembled PDU]"
"5.960882","172.19.0.3","5.9.29.183","TCP","56","43520 → 9002 [ACK] Seq=8059 Ack=137067 Win=12730 Len=0"
"5.960886","5.9.29.183","172.19.0.3","TCP","1492","9002 → 43520 [PSH, ACK] Seq=137067 Ack=8059 Win=65535 Len=1436 [TCP segment of a reassembled PDU]"
"5.961144","172.19.0.3","5.9.29.183","TLSv1.2","599","Application Data"
"5.961431","5.9.29.183","172.19.0.3","TCP","56","9002 → 43520 [ACK] Seq=138503 Ack=8602 Win=65535 Len=0"
"5.970674","5.9.29.183","172.19.0.3","TLSv1.2","1516","Application Data [TCP segment of a reassembled PDU]"
"5.970701","5.9.29.183","172.19.0.3","TCP","1492","9002 → 43520 [PSH, ACK] Seq=139963 Ack=8602 Win=65535 Len=1436 [TCP segment of a reassembled PDU]"
"5.970714","172.19.0.3","5.9.29.183","TCP","56","43520 → 9002 [ACK] Seq=8602 Ack=141399 Win=12730 Len=0"
"5.972227","5.9.29.183","172.19.0.3","TCP","1516","9002 → 43520 [PSH, ACK] Seq=141399 Ack=8602 Win=65535 Len=1460 [TCP segment of a reassembled PDU]"
"5.972259","5.9.29.183","172.19.0.3","TLSv1.2","1516","Application Data [TCP segment of a reassembled PDU]"
"5.972275","172.19.0.3","5.9.29.183","TCP","56","43520 → 9002 [ACK] Seq=8602 Ack=144319 Win=12730 Len=0"
"5.972278","5.9.29.183","172.19.0.3","TCP","1516","9002 → 43520 [PSH, ACK] Seq=144319 Ack=8602 Win=65535 Len=1460 [TCP segment of a reassembled PDU]"
"5.972283","5.9.29.183","172.19.0.3","TLSv1.2","1468","Application Data [TCP segment of a reassembled PDU]"
"5.972476","172.19.0.3","5.9.29.183","TCP","56","43520 → 9002 [ACK] Seq=8602 Ack=147191 Win=12714 Len=0"
"5.972705","5.9.29.183","172.19.0.3","TCP","1516","9002 → 43520 [PSH, ACK] Seq=147191 Ack=8602 Win=65535 Len=1460 [TCP segment of a reassembled PDU]"
"5.972743","5.9.29.183","172.19.0.3","TCP","1516","9002 → 43520 [PSH, ACK] Seq=148651 Ack=8602 Win=65535 Len=1460 [TCP segment of a reassembled PDU]"
"5.972750","5.9.29.183","172.19.0.3","TLSv1.2","1516","Application Data [TCP segment of a reassembled PDU]"
"5.972790","5.9.29.183","172.19.0.3","TLSv1.2","1468","Application Data, Application Data"
"5.972932","172.19.0.3","5.9.29.183","TCP","56","43520 → 9002 [ACK] Seq=8602 Ack=152983 Win=12682 Len=0"
"5.977533","5.9.29.183","172.19.0.3","TCP","1516","9002 → 43520 [PSH, ACK] Seq=152983 Ack=8602 Win=65535 Len=1460 [TCP segment of a reassembled PDU]"
"5.977563","5.9.29.183","172.19.0.3","TCP","1516","9002 → 43520 [PSH, ACK] Seq=154443 Ack=8602 Win=65535 Len=1460 [TCP segment of a reassembled PDU]"
"5.977579","172.19.0.3","5.9.29.183","TCP","56","43520 → 9002 [ACK] Seq=8602 Ack=155903 Win=12728 Len=0"
"5.977581","5.9.29.183","172.19.0.3","TLSv1.2","1516","Application Data [TCP segment of a reassembled PDU]"
"5.977585","5.9.29.183","172.19.0.3","TLSv1.2","1146","Application Data"
"5.977754","172.19.0.3","5.9.29.183","TCP","56","43520 → 9002 [ACK] Seq=8602 Ack=158453 Win=12712 Len=0"
"5.978021","172.19.0.3","5.9.29.183","TLSv1.2","599","Application Data"
"5.978320","5.9.29.183","172.19.0.3","TCP","56","9002 → 43520 [ACK] Seq=158453 Ack=9145 Win=65535 Len=0"
"5.986759","5.9.29.183","172.19.0.3","TCP","1504","[TCP segment of a reassembled PDU]"
"5.988310","5.9.29.183","172.19.0.3","TCP","1504","9002 → 43520 [PSH, ACK] Seq=159901 Ack=9145 Win=65535 Len=1448 [TCP segment of a reassembled PDU]"
"5.988330","172.19.0.3","5.9.29.183","TCP","56","43520 → 9002 [ACK] Seq=9145 Ack=161349 Win=12738 Len=0"
"5.993569","5.9.29.183","172.19.0.3","TLSv1.2","273","Application Data"
"5.993947","172.19.0.3","5.9.29.183","TLSv1.2","599","Application Data"
"5.994366","5.9.29.183","172.19.0.3","TCP","56","9002 → 43520 [ACK] Seq=161566 Ack=9688 Win=65535 Len=0"
"6.147421","5.9.29.183","172.19.0.3","TCP","1516","[TCP segment of a reassembled PDU]"
"6.147454","5.9.29.183","172.19.0.3","TLSv1.2","167","Application Data"
"6.147714","172.19.0.3","5.9.29.183","TCP","56","43520 → 9002 [ACK] Seq=9688 Ack=163137 Win=12730 Len=0"
"6.153488","172.19.0.3","5.9.29.183","TLSv1.2","599","Application Data"
"6.153748","5.9.29.183","172.19.0.3","TCP","56","9002 → 43520 [ACK] Seq=163137 Ack=10231 Win=65535 Len=0"
"7.114738","5.9.29.183","172.19.0.3","TLSv1.2","599","Application Data"
"7.115411","172.19.0.3","5.9.29.183","TLSv1.2","599","Application Data"
"7.115903","5.9.29.183","172.19.0.3","TCP","56","9002 → 43520 [ACK] Seq=163680 Ack=10774 Win=65535 Len=0"
"8.039593","5.9.29.183","172.19.0.3","TCP","1516","[TCP segment of a reassembled PDU]"
"8.039622","5.9.29.183","172.19.0.3","TCP","1492","9002 → 43520 [PSH, ACK] Seq=165140 Ack=10774 Win=65535 Len=1436 [TCP segment of a reassembled PDU]"
"8.039741","5.9.29.183","172.19.0.3","TLSv1.2","787","Application Data"
"8.039823","172.19.0.3","5.9.29.183","TCP","56","43520 → 9002 [ACK] Seq=10774 Ack=167307 Win=12722 Len=0"
"8.044935","5.9.29.183","172.19.0.3","TCP","1504","[TCP segment of a reassembled PDU]"
"8.045142","5.9.29.183","172.19.0.3","TCP","1516","9002 → 43520 [PSH, ACK] Seq=168755 Ack=10774 Win=65535 Len=1460 [TCP segment of a reassembled PDU]"
"8.045156","172.19.0.3","5.9.29.183","TCP","56","43520 → 9002 [ACK] Seq=10774 Ack=170215 Win=12730 Len=0"
"8.045159","5.9.29.183","172.19.0.3","TLSv1.2","1516","Application Data [TCP segment of a reassembled PDU]"
"8.045288","5.9.29.183","172.19.0.3","TCP","1516","9002 → 43520 [PSH, ACK] Seq=171675 Ack=10774 Win=65535 Len=1460 [TCP segment of a reassembled PDU]"
"8.045297","5.9.29.183","172.19.0.3","TCP","1468","9002 → 43520 [PSH, ACK] Seq=173135 Ack=10774 Win=65535 Len=1412 [TCP segment of a reassembled PDU]"
"8.045446","172.19.0.3","5.9.29.183","TCP","56","43520 → 9002 [ACK] Seq=10774 Ack=174547 Win=12706 Len=0"
"8.055539","5.9.29.183","172.19.0.3","TLSv1.2","584","Application Data"
"8.097261","172.19.0.3","5.9.29.183","TCP","56","43520 → 9002 [ACK] Seq=10774 Ack=175075 Win=12738 Len=0"
"8.198293","5.9.29.183","172.19.0.3","TCP","1516","[TCP segment of a reassembled PDU]"
"8.198357","172.19.0.3","5.9.29.183","TCP","56","43520 → 9002 [ACK] Seq=10774 Ack=176535 Win=12738 Len=0"
"8.198374","5.9.29.183","172.19.0.3","TCP","1492","9002 → 43520 [PSH, ACK] Seq=176535 Ack=10774 Win=65535 Len=1436 [TCP segment of a reassembled PDU]"
"8.198386","172.19.0.3","5.9.29.183","TCP","56","43520 → 9002 [ACK] Seq=10774 Ack=177971 Win=12730 Len=0"
"8.198388","5.9.29.183","172.19.0.3","TLSv1.2","1516","Application Data [TCP segment of a reassembled PDU]"
"8.198393","172.19.0.3","5.9.29.183","TCP","56","43520 → 9002 [ACK] Seq=10774 Ack=179431 Win=12720 Len=0"
"8.198551","5.9.29.183","172.19.0.3","TCP","1516","9002 → 43520 [PSH, ACK] Seq=179431 Ack=10774 Win=65535 Len=1460 [TCP segment of a reassembled PDU]"
"8.198562","172.19.0.3","5.9.29.183","TCP","56","43520 → 9002 [ACK] Seq=10774 Ack=180891 Win=12712 Len=0"
"8.198563","5.9.29.183","172.19.0.3","TCP","1213","9002 → 43520 [PSH, ACK] Seq=180891 Ack=10774 Win=65535 Len=1157 [TCP segment of a reassembled PDU]"
"8.198568","172.19.0.3","5.9.29.183","TCP","56","43520 → 9002 [ACK] Seq=10774 Ack=182048 Win=12704 Len=0"
"8.198570","5.9.29.183","172.19.0.3","TLSv1.2","1504","Application Data [TCP segment of a reassembled PDU]"
"8.198576","172.19.0.3","5.9.29.183","TCP","56","43520 → 9002 [ACK] Seq=10774 Ack=183496 Win=12696 Len=0"
"8.208864","5.9.29.183","172.19.0.3","TLSv1.2","1516","Application Data [TCP segment of a reassembled PDU]"
"8.208887","172.19.0.3","5.9.29.183","TCP","56","43520 → 9002 [ACK] Seq=10774 Ack=184956 Win=12738 Len=0"
"8.208903","5.9.29.183","172.19.0.3","TCP","1492","9002 → 43520 [PSH, ACK] Seq=184956 Ack=10774 Win=65535 Len=1436 [TCP segment of a reassembled PDU]"
"8.208910","172.19.0.3","5.9.29.183","TCP","56","43520 → 9002 [ACK] Seq=10774 Ack=186392 Win=12730 Len=0"
"8.209138","5.9.29.183","172.19.0.3","TCP","1516","9002 → 43520 [PSH, ACK] Seq=186392 Ack=10774 Win=65535 Len=1460 [TCP segment of a reassembled PDU]"
"8.209154","172.19.0.3","5.9.29.183","TCP","56","43520 → 9002 [ACK] Seq=10774 Ack=187852 Win=12722 Len=0"
"8.209158","5.9.29.183","172.19.0.3","TLSv1.2","1492","Application Data [TCP segment of a reassembled PDU]"
"8.209170","172.19.0.3","5.9.29.183","TCP","56","43520 → 9002 [ACK] Seq=10774 Ack=189288 Win=12714 Len=0"
"8.214148","5.9.29.183","172.19.0.3","TCP","1516","9002 → 43520 [PSH, ACK] Seq=189288 Ack=10774 Win=65535 Len=1460 [TCP segment of a reassembled PDU]"
"8.214202","172.19.0.3","5.9.29.183","TCP","56","43520 → 9002 [ACK] Seq=10774 Ack=190748 Win=12738 Len=0"
"8.214231","5.9.29.183","172.19.0.3","TLSv1.2","1516","Application Data [TCP segment of a reassembled PDU]"
"8.214239","172.19.0.3","5.9.29.183","TCP","56","43520 → 9002 [ACK] Seq=10774 Ack=192208 Win=12730 Len=0"
"8.214240","5.9.29.183","172.19.0.3","TCP","688","9002 → 43520 [PSH, ACK] Seq=192208 Ack=10774 Win=65535 Len=632 [TCP segment of a reassembled PDU]"
"8.214374","5.9.29.183","172.19.0.3","TCP","1516","9002 → 43520 [PSH, ACK] Seq=192840 Ack=10774 Win=65535 Len=1460 [TCP segment of a reassembled PDU]"
"8.214382","5.9.29.183","172.19.0.3","TCP","836","9002 → 43520 [PSH, ACK] Seq=194300 Ack=10774 Win=65535 Len=780 [TCP segment of a reassembled PDU]"
"8.214385","5.9.29.183","172.19.0.3","TLSv1.2","1516","Application Data [TCP segment of a reassembled PDU]"
"8.214387","5.9.29.183","172.19.0.3","TCP","1516","9002 → 43520 [PSH, ACK] Seq=196540 Ack=10774 Win=65535 Len=1460 [TCP segment of a reassembled PDU]"
"8.214408","5.9.29.183","172.19.0.3","TCP","1516","9002 → 43520 [PSH, ACK] Seq=198000 Ack=10774 Win=65535 Len=1460 [TCP segment of a reassembled PDU]"
"8.214413","5.9.29.183","172.19.0.3","TLSv1.2","1468","Application Data, Application Data"
"8.214475","172.19.0.3","5.9.29.183","TCP","56","43520 → 9002 [ACK] Seq=10774 Ack=200872 Win=12674 Len=0"
"8.214698","172.19.0.3","5.9.29.183","TLSv1.2","599","Application Data"
"8.214899","5.9.29.183","172.19.0.3","TCP","56","9002 → 43520 [ACK] Seq=200872 Ack=11317 Win=65535 Len=0"
"8.224472","5.9.29.183","172.19.0.3","TCP","1516","9002 → 43520 [PSH, ACK] Seq=200872 Ack=11317 Win=65535 Len=1460 [TCP segment of a reassembled PDU]"
"8.224504","5.9.29.183","172.19.0.3","TLSv1.2","845","Application Data, Application Data"
"8.224524","172.19.0.3","5.9.29.183","TCP","56","43520 → 9002 [ACK] Seq=11317 Ack=203121 Win=12730 Len=0"
"8.360114","5.9.29.183","172.19.0.3","TCP","1516","[TCP segment of a reassembled PDU]"
"8.360146","5.9.29.183","172.19.0.3","TCP","1492","9002 → 43520 [PSH, ACK] Seq=204581 Ack=11317 Win=65535 Len=1436 [TCP segment of a reassembled PDU]"
"8.360155","5.9.29.183","172.19.0.3","TLSv1.2","273","Application Data"
"8.360274","172.19.0.3","5.9.29.183","TCP","56","43520 → 9002 [ACK] Seq=11317 Ack=206234 Win=12720 Len=0"
"8.364926","172.19.0.3","5.9.29.183","TLSv1.2","599","Application Data"
"8.365136","5.9.29.183","172.19.0.3","TCP","56","9002 → 43520 [ACK] Seq=206234 Ack=11860 Win=65535 Len=0"
"9.576535","5.9.29.183","172.19.0.3","TLSv1.2","599","Application Data"
"9.577395","172.19.0.3","5.9.29.183","TLSv1.2","599","Application Data"
"9.577861","5.9.29.183","172.19.0.3","TCP","56","9002 → 43520 [ACK] Seq=206777 Ack=12403 Win=65535 Len=0"
"10.191575","5.9.29.183","172.19.0.3","TCP","1516","[TCP segment of a reassembled PDU]"
"10.191615","5.9.29.183","172.19.0.3","TCP","1492","9002 → 43520 [PSH, ACK] Seq=208237 Ack=12403 Win=65535 Len=1436 [TCP segment of a reassembled PDU]"
"10.191770","172.19.0.3","5.9.29.183","TCP","56","43520 → 9002 [ACK] Seq=12403 Ack=209673 Win=12730 Len=0"
"10.191972","5.9.29.183","172.19.0.3","TLSv1.2","787","Application Data"
"10.192254","172.19.0.3","5.9.29.183","TLSv1.2","599","Application Data"
"10.192503","5.9.29.183","172.19.0.3","TCP","56","9002 → 43520 [ACK] Seq=210404 Ack=12946 Win=65535 Len=0"
"10.212779","5.9.29.183","172.19.0.3","TCP","1516","[TCP segment of a reassembled PDU]"
"10.212811","5.9.29.183","172.19.0.3","TCP","1492","9002 → 43520 [PSH, ACK] Seq=211864 Ack=12946 Win=65535 Len=1436 [TCP segment of a reassembled PDU]"
"10.212817","5.9.29.183","172.19.0.3","TLSv1.2","1237","Application Data"
"10.212934","172.19.0.3","5.9.29.183","TCP","56","43520 → 9002 [ACK] Seq=12946 Ack=214481 Win=12722 Len=0"
"10.228851","5.9.29.183","172.19.0.3","TLSv1.2","149","Application Data"
"10.272122","172.19.0.3","5.9.29.183","TCP","56","43520 → 9002 [ACK] Seq=12946 Ack=214574 Win=12738 Len=0"
"10.330977","5.9.29.183","172.19.0.3","TCP","1516","[TCP segment of a reassembled PDU]"
"10.331038","172.19.0.3","5.9.29.183","TCP","56","43520 → 9002 [ACK] Seq=12946 Ack=216034 Win=12738 Len=0"
"10.331056","5.9.29.183","172.19.0.3","TCP","1492","9002 → 43520 [PSH, ACK] Seq=216034 Ack=12946 Win=65535 Len=1436 [TCP segment of a reassembled PDU]"
"10.331070","172.19.0.3","5.9.29.183","TCP","56","43520 → 9002 [ACK] Seq=12946 Ack=217470 Win=12730 Len=0"
"10.331072","5.9.29.183","172.19.0.3","TLSv1.2","1237","Application Data"
"10.331077","172.19.0.3","5.9.29.183","TCP","56","43520 → 9002 [ACK] Seq=12946 Ack=218651 Win=12722 Len=0"
"10.331079","5.9.29.183","172.19.0.3","TCP","1516","[TCP segment of a reassembled PDU]"
"10.331085","172.19.0.3","5.9.29.183","TCP","56","43520 → 9002 [ACK] Seq=12946 Ack=220111 Win=12714 Len=0"
"10.331086","5.9.29.183","172.19.0.3","TCP","1516","9002 → 43520 [PSH, ACK] Seq=220111 Ack=12946 Win=65535 Len=1460 [TCP segment of a reassembled PDU]"
"10.331092","172.19.0.3","5.9.29.183","TCP","56","43520 → 9002 [ACK] Seq=12946 Ack=221571 Win=12706 Len=0"
"10.331250","5.9.29.183","172.19.0.3","TLSv1.2","1516","Application Data [TCP segment of a reassembled PDU]"
"10.331261","172.19.0.3","5.9.29.183","TCP","56","43520 → 9002 [ACK] Seq=12946 Ack=223031 Win=12698 Len=0"
"10.331263","5.9.29.183","172.19.0.3","TCP","1468","9002 → 43520 [PSH, ACK] Seq=223031 Ack=12946 Win=65535 Len=1412 [TCP segment of a reassembled PDU]"
"10.331268","172.19.0.3","5.9.29.183","TCP","56","43520 → 9002 [ACK] Seq=12946 Ack=224443 Win=12690 Len=0"
"10.331270","5.9.29.183","172.19.0.3","TCP","1504","9002 → 43520 [PSH, ACK] Seq=224443 Ack=12946 Win=65535 Len=1448 [TCP segment of a reassembled PDU]"
"10.331276","172.19.0.3","5.9.29.183","TCP","56","43520 → 9002 [ACK] Seq=12946 Ack=225891 Win=12682 Len=0"
"10.346940","5.9.29.183","172.19.0.3","TLSv1.2","648","Application Data"
"10.346966","172.19.0.3","5.9.29.183","TCP","56","43520 → 9002 [ACK] Seq=12946 Ack=226483 Win=12738 Len=0"
"10.355378","5.9.29.183","172.19.0.3","TCP","1516","[TCP segment of a reassembled PDU]"
"10.355403","172.19.0.3","5.9.29.183","TCP","56","43520 → 9002 [ACK] Seq=12946 Ack=227943 Win=12738 Len=0"
"10.355420","5.9.29.183","172.19.0.3","TCP","1492","9002 → 43520 [PSH, ACK] Seq=227943 Ack=12946 Win=65535 Len=1436 [TCP segment of a reassembled PDU]"
"10.355431","172.19.0.3","5.9.29.183","TCP","56","43520 → 9002 [ACK] Seq=12946 Ack=229379 Win=12730 Len=0"
"10.355434","5.9.29.183","172.19.0.3","TLSv1.2","1504","Application Data [TCP segment of a reassembled PDU]"
"10.355441","172.19.0.3","5.9.29.183","TCP","56","43520 → 9002 [ACK] Seq=12946 Ack=230827 Win=12722 Len=0"
"10.362663","5.9.29.183","172.19.0.3","TLSv1.2","1424","Application Data"
"10.362832","172.19.0.3","5.9.29.183","TCP","56","43520 → 9002 [ACK] Seq=12946 Ack=232195 Win=12738 Len=0"
"10.380699","5.9.29.183","172.19.0.3","TCP","1516","[TCP segment of a reassembled PDU]"
"10.380731","5.9.29.183","172.19.0.3","TCP","1516","9002 → 43520 [PSH, ACK] Seq=233655 Ack=12946 Win=65535 Len=1460 [TCP segment of a reassembled PDU]"
"10.380738","5.9.29.183","172.19.0.3","TLSv1.2","1213","Application Data"
"10.380836","172.19.0.3","5.9.29.183","TCP","56","43520 → 9002 [ACK] Seq=12946 Ack=236272 Win=12720 Len=0"
"10.381189","172.19.0.3","5.9.29.183","TLSv1.2","599","Application Data"
"10.381659","5.9.29.183","172.19.0.3","TCP","56","9002 → 43520 [ACK] Seq=236272 Ack=13489 Win=65535 Len=0"
"10.384236","5.9.29.183","172.19.0.3","TLSv1.2","1504","Application Data"
"10.397500","5.9.29.183","172.19.0.3","TLSv1.2","1300","Application Data"
"10.397526","172.19.0.3","5.9.29.183","TCP","56","43520 → 9002 [ACK] Seq=13489 Ack=238964 Win=12738 Len=0"
"10.543821","5.9.29.183","172.19.0.3","TCP","1516","[TCP segment of a reassembled PDU]"
"10.543859","5.9.29.183","172.19.0.3","TCP","1492","9002 → 43520 [PSH, ACK] Seq=240424 Ack=13489 Win=65535 Len=1436 [TCP segment of a reassembled PDU]"
"10.544027","5.9.29.183","172.19.0.3","TLSv1.2","1237","Application Data"
"10.544087","172.19.0.3","5.9.29.183","TCP","56","43520 → 9002 [ACK] Seq=13489 Ack=243041 Win=12722 Len=0"
"10.559859","5.9.29.183","172.19.0.3","TLSv1.2","149","Application Data"
"10.566622","5.9.29.183","172.19.0.3","TCP","1516","[TCP segment of a reassembled PDU]"
"10.566643","172.19.0.3","5.9.29.183","TCP","56","43520 → 9002 [ACK] Seq=13489 Ack=244594 Win=12738 Len=0"
"10.566658","5.9.29.183","172.19.0.3","TCP","1516","9002 → 43520 [PSH, ACK] Seq=244594 Ack=13489 Win=65535 Len=1460 [TCP segment of a reassembled PDU]"
"10.566664","5.9.29.183","172.19.0.3","TLSv1.2","1480","Application Data [TCP segment of a reassembled PDU]"
"10.566865","5.9.29.183","172.19.0.3","TCP","1516","9002 → 43520 [PSH, ACK] Seq=247478 Ack=13489 Win=65535 Len=1460 [TCP segment of a reassembled PDU]"
"10.566874","5.9.29.183","172.19.0.3","TCP","1516","9002 → 43520 [PSH, ACK] Seq=248938 Ack=13489 Win=65535 Len=1460 [TCP segment of a reassembled PDU]"
"10.566878","5.9.29.183","172.19.0.3","TLSv1.2","1516","Application Data [TCP segment of a reassembled PDU]"
"10.566882","5.9.29.183","172.19.0.3","TCP","1468","9002 → 43520 [PSH, ACK] Seq=251858 Ack=13489 Win=65535 Len=1412 [TCP segment of a reassembled PDU]"
"10.566956","172.19.0.3","5.9.29.183","TCP","56","43520 → 9002 [ACK] Seq=13489 Ack=253270 Win=12690 Len=0"
"10.567302","5.9.29.183","172.19.0.3","TCP","1504","9002 → 43520 [PSH, ACK] Seq=253270 Ack=13489 Win=65535 Len=1448 [TCP segment of a reassembled PDU]"
"10.575167","5.9.29.183","172.19.0.3","TLSv1.2","381","Application Data"
"10.575192","172.19.0.3","5.9.29.183","TCP","56","43520 → 9002 [ACK] Seq=13489 Ack=255043 Win=12738 Len=0"
"10.579774","172.19.0.3","5.9.29.183","TLSv1.2","599","Application Data"
"10.580044","5.9.29.183","172.19.0.3","TCP","56","9002 → 43520 [ACK] Seq=255043 Ack=14032 Win=65535 Len=0"
"11.421501","5.9.29.183","172.19.0.3","TLSv1.2","599","Application Data"
"11.422319","172.19.0.3","5.9.29.183","TLSv1.2","599","Application Data"
"11.422738","5.9.29.183","172.19.0.3","TCP","56","9002 → 43520 [ACK] Seq=255586 Ack=14575 Win=65535 Len=0"
"12.343678","5.9.29.183","172.19.0.3","TCP","1516","[TCP segment of a reassembled PDU]"
"12.343834","5.9.29.183","172.19.0.3","TCP","1386","9002 → 43520 [PSH, ACK] Seq=257046 Ack=14575 Win=65535 Len=1330 [TCP segment of a reassembled PDU]"
"12.343968","5.9.29.183","172.19.0.3","TCP","162","9002 → 43520 [PSH, ACK] Seq=258376 Ack=14575 Win=65535 Len=106 [TCP segment of a reassembled PDU]"
"12.343975","5.9.29.183","172.19.0.3","TLSv1.2","787","Application Data"
"12.343980","5.9.29.183","172.19.0.3","TCP","1516","[TCP segment of a reassembled PDU]"
"12.344048","5.9.29.183","172.19.0.3","TCP","1492","9002 → 43520 [PSH, ACK] Seq=260673 Ack=14575 Win=65535 Len=1436 [TCP segment of a reassembled PDU]"
"12.344110","5.9.29.183","172.19.0.3","TLSv1.2","1516","Application Data, Application Data"
"12.344125","5.9.29.183","172.19.0.3","TCP","1516","9002 → 43520 [PSH, ACK] Seq=263569 Ack=14575 Win=65535 Len=1460 [TCP segment of a reassembled PDU]"
"12.344220","5.9.29.183","172.19.0.3","TCP","1516","9002 → 43520 [PSH, ACK] Seq=265029 Ack=14575 Win=65535 Len=1460 [TCP segment of a reassembled PDU]"
"12.344227","5.9.29.183","172.19.0.3","TLSv1.2","1516","Application Data, Application Data"
"12.344303","5.9.29.183","172.19.0.3","TCP","1516","9002 → 43520 [PSH, ACK] Seq=267949 Ack=14575 Win=65535 Len=1460 [TCP segment of a reassembled PDU]"
"12.344328","5.9.29.183","172.19.0.3","TCP","1270","9002 → 43520 [PSH, ACK] Seq=269409 Ack=14575 Win=65535 Len=1214 [TCP segment of a reassembled PDU]"
"12.344356","172.19.0.3","5.9.29.183","TCP","56","43520 → 9002 [ACK] Seq=14575 Ack=270623 Win=12649 Len=0"
"12.344784","172.19.0.3","5.9.29.183","TLSv1.2","599","Application Data"
"12.345149","5.9.29.183","172.19.0.3","TCP","56","9002 → 43520 [ACK] Seq=270623 Ack=15118 Win=65535 Len=0"
"12.359791","5.9.29.183","172.19.0.3","TLSv1.2","1516","Application Data [TCP segment of a reassembled PDU]"
"12.359818","5.9.29.183","172.19.0.3","TCP","1492","9002 → 43520 [PSH, ACK] Seq=272083 Ack=15118 Win=65535 Len=1436 [TCP segment of a reassembled PDU]"
"12.359832","172.19.0.3","5.9.29.183","TCP","56","43520 → 9002 [ACK] Seq=15118 Ack=273519 Win=12730 Len=0"
"12.359834","5.9.29.183","172.19.0.3","TLSv1.2","1344","Application Data"
"12.363997","172.19.0.3","5.9.29.183","TLSv1.2","599","Application Data"
"12.364216","5.9.29.183","172.19.0.3","TCP","56","9002 → 43520 [ACK] Seq=274807 Ack=15661 Win=65535 Len=0"
"13.265916","5.9.29.183","172.19.0.3","TLSv1.2","599","Application Data"
"13.266714","172.19.0.3","5.9.29.183","TLSv1.2","599","Application Data"
"13.267145","5.9.29.183","172.19.0.3","TCP","56","9002 → 43520 [ACK] Seq=275350 Ack=16204 Win=65535 Len=0"
"14.188206","5.9.29.183","172.19.0.3","TCP","1516","[TCP segment of a reassembled PDU]"
"14.188239","5.9.29.183","172.19.0.3","TCP","1492","9002 → 43520 [PSH, ACK] Seq=276810 Ack=16204 Win=65535 Len=1436 [TCP segment of a reassembled PDU]"
"14.188405","172.19.0.3","5.9.29.183","TCP","56","43520 → 9002 [ACK] Seq=16204 Ack=278246 Win=12730 Len=0"
"14.188531","5.9.29.183","172.19.0.3","TLSv1.2","787","Application Data"
"14.188600","5.9.29.183","172.19.0.3","TCP","1516","[TCP segment of a reassembled PDU]"
"14.188839","5.9.29.183","172.19.0.3","TCP","1516","9002 → 43520 [PSH, ACK] Seq=280437 Ack=16204 Win=65535 Len=1460 [TCP segment of a reassembled PDU]"
"14.188849","5.9.29.183","172.19.0.3","TLSv1.2","1516","Application Data [TCP segment of a reassembled PDU]"
"14.188854","5.9.29.183","172.19.0.3","TCP","1516","9002 → 43520 [PSH, ACK] Seq=283357 Ack=16204 Win=65535 Len=1460 [TCP segment of a reassembled PDU]"
"14.188857","5.9.29.183","172.19.0.3","TCP","1516","9002 → 43520 [PSH, ACK] Seq=284817 Ack=16204 Win=65535 Len=1460 [TCP segment of a reassembled PDU]"
"14.188883","5.9.29.183","172.19.0.3","TLSv1.2","1516","Application Data [TCP segment of a reassembled PDU]"
"14.188888","5.9.29.183","172.19.0.3","TCP","1432","9002 → 43520 [PSH, ACK] Seq=287737 Ack=16204 Win=65535 Len=1376 [TCP segment of a reassembled PDU]"
"14.188904","172.19.0.3","5.9.29.183","TCP","56","43520 → 9002 [ACK] Seq=16204 Ack=289113 Win=12680 Len=0"
"14.203979","5.9.29.183","172.19.0.3","TCP","1516","9002 → 43520 [PSH, ACK] Seq=289113 Ack=16204 Win=65535 Len=1460 [TCP segment of a reassembled PDU]"
"14.204036","5.9.29.183","172.19.0.3","TLSv1.2","1492","Application Data [TCP segment of a reassembled PDU]"
"14.204072","172.19.0.3","5.9.29.183","TCP","56","43520 → 9002 [ACK] Seq=16204 Ack=292009 Win=12730 Len=0"
"14.204338","5.9.29.183","172.19.0.3","TCP","1516","9002 → 43520 [PSH, ACK] Seq=292009 Ack=16204 Win=65535 Len=1460 [TCP segment of a reassembled PDU]"
"14.204347","5.9.29.183","172.19.0.3","TLSv1.2","1516","Application Data [TCP segment of a reassembled PDU]"
"14.204350","5.9.29.183","172.19.0.3","TCP","1516","9002 → 43520 [PSH, ACK] Seq=294929 Ack=16204 Win=65535 Len=1460 [TCP segment of a reassembled PDU]"
"14.204353","5.9.29.183","172.19.0.3","TCP","1516","9002 → 43520 [PSH, ACK] Seq=296389 Ack=16204 Win=65535 Len=1460 [TCP segment of a reassembled PDU]"
"14.204356","5.9.29.183","172.19.0.3","TLSv1.2","1456","Application Data, Application Data"
"14.204451","5.9.29.183","172.19.0.3","TCP","1516","9002 → 43520 [PSH, ACK] Seq=299249 Ack=16204 Win=65535 Len=1460 [TCP segment of a reassembled PDU]"
"14.204541","5.9.29.183","172.19.0.3","TCP","1516","9002 → 43520 [PSH, ACK] Seq=300709 Ack=16204 Win=65535 Len=1460 [TCP segment of a reassembled PDU]"
"14.204548","5.9.29.183","172.19.0.3","TLSv1.2","1254","Application Data, Application Data"
"14.204579","172.19.0.3","5.9.29.183","TCP","56","43520 → 9002 [ACK] Seq=16204 Ack=303367 Win=12665 Len=0"
"14.205289","172.19.0.3","5.9.29.183","TLSv1.2","599","Application Data"
"14.205603","5.9.29.183","172.19.0.3","TCP","56","9002 → 43520 [ACK] Seq=303367 Ack=16747 Win=65535 Len=0"
"14.254138","5.9.29.183","172.19.0.3","TCP","1516","[TCP segment of a reassembled PDU]"
"14.254172","5.9.29.183","172.19.0.3","TCP","1492","9002 → 43520 [PSH, ACK] Seq=304827 Ack=16747 Win=65535 Len=1436 [TCP segment of a reassembled PDU]"
"14.254180","5.9.29.183","172.19.0.3","TLSv1.2","787","Application Data"
"14.254311","172.19.0.3","5.9.29.183","TCP","56","43520 → 9002 [ACK] Seq=16747 Ack=306994 Win=12720 Len=0"
"14.258718","172.19.0.3","5.9.29.183","TLSv1.2","599","Application Data"
"14.258934","5.9.29.183","172.19.0.3","TCP","56","9002 → 43520 [ACK] Seq=306994 Ack=17290 Win=65535 Len=0"
"15.374878","5.9.29.183","172.19.0.3","TLSv1.2","599","Application Data"
"15.375527","172.19.0.3","5.9.29.183","TLSv1.2","599","Application Data"
"15.375963","5.9.29.183","172.19.0.3","TCP","56","9002 → 43520 [ACK] Seq=307537 Ack=17833 Win=65535 Len=0"
"16.340063","5.9.29.183","172.19.0.3","TCP","1516","[TCP segment of a reassembled PDU]"
"16.340096","5.9.29.183","172.19.0.3","TCP","1492","9002 → 43520 [PSH, ACK] Seq=308997 Ack=17833 Win=65535 Len=1436 [TCP segment of a reassembled PDU]"
"16.340216","172.19.0.3","5.9.29.183","TCP","56","43520 → 9002 [ACK] Seq=17833 Ack=310433 Win=12730 Len=0"
"16.340453","5.9.29.183","172.19.0.3","TLSv1.2","787","Application Data"
"16.356443","5.9.29.183","172.19.0.3","TLSv1.2","1113","Application Data"
"16.356465","172.19.0.3","5.9.29.183","TCP","56","43520 → 9002 [ACK] Seq=17833 Ack=312221 Win=12736 Len=0"
"16.367478","5.9.29.183","172.19.0.3","TCP","1516","[TCP segment of a reassembled PDU]"
"16.367511","5.9.29.183","172.19.0.3","TCP","1492","9002 → 43520 [PSH, ACK] Seq=313681 Ack=17833 Win=65535 Len=1436 [TCP segment of a reassembled PDU]"
"16.367784","172.19.0.3","5.9.29.183","TCP","56","43520 → 9002 [ACK] Seq=17833 Ack=315117 Win=12730 Len=0"
"16.371806","5.9.29.183","172.19.0.3","TLSv1.2","787","Application Data"
"16.372160","172.19.0.3","5.9.29.183","TLSv1.2","599","Application Data"
"16.372480","5.9.29.183","172.19.0.3","TCP","56","9002 → 43520 [ACK] Seq=315848 Ack=18376 Win=65535 Len=0"
"16.491383","5.9.29.183","172.19.0.3","TCP","1516","[TCP segment of a reassembled PDU]"
"16.491407","5.9.29.183","172.19.0.3","TCP","1492","9002 → 43520 [PSH, ACK] Seq=317308 Ack=18376 Win=65535 Len=1436 [TCP segment of a reassembled PDU]"
"16.491415","5.9.29.183","172.19.0.3","TLSv1.2","1237","Application Data"
"16.491533","172.19.0.3","5.9.29.183","TCP","56","43520 → 9002 [ACK] Seq=18376 Ack=319925 Win=12722 Len=0"
"16.506834","5.9.29.183","172.19.0.3","TLSv1.2","1177","Application Data"
"16.507214","5.9.29.183","172.19.0.3","TCP","1516","[TCP segment of a reassembled PDU]"
"16.507231","172.19.0.3","5.9.29.183","TCP","56","43520 → 9002 [ACK] Seq=18376 Ack=322506 Win=12738 Len=0"
"16.507235","5.9.29.183","172.19.0.3","TCP","1462","9002 → 43520 [PSH, ACK] Seq=322506 Ack=18376 Win=65535 Len=1406 [TCP segment of a reassembled PDU]"
"16.507302","5.9.29.183","172.19.0.3","TLSv1.2","1516","Application Data [TCP segment of a reassembled PDU]"
"16.507377","5.9.29.183","172.19.0.3","TCP","74","9002 → 43520 [PSH, ACK] Seq=325372 Ack=18376 Win=65535 Len=18 [TCP segment of a reassembled PDU]"
"16.507396","172.19.0.3","5.9.29.183","TCP","56","43520 → 9002 [ACK] Seq=18376 Ack=325390 Win=12720 Len=0"
"16.507769","5.9.29.183","172.19.0.3","TCP","1516","9002 → 43520 [PSH, ACK] Seq=325390 Ack=18376 Win=65535 Len=1460 [TCP segment of a reassembled PDU]"
"16.507780","5.9.29.183","172.19.0.3","TCP","1492","9002 → 43520 [PSH, ACK] Seq=326850 Ack=18376 Win=65535 Len=1436 [TCP segment of a reassembled PDU]"
"16.507787","172.19.0.3","5.9.29.183","TCP","56","43520 → 9002 [ACK] Seq=18376 Ack=328286 Win=12730 Len=0"
"16.522602","5.9.29.183","172.19.0.3","TLSv1.2","1127","Application Data, Application Data"
"16.554525","5.9.29.183","172.19.0.3","TCP","1516","[TCP segment of a reassembled PDU]"
"16.554553","172.19.0.3","5.9.29.183","TCP","56","43520 → 9002 [ACK] Seq=18376 Ack=330817 Win=12738 Len=0"
"16.554572","5.9.29.183","172.19.0.3","TCP","1492","9002 → 43520 [PSH, ACK] Seq=330817 Ack=18376 Win=65535 Len=1436 [TCP segment of a reassembled PDU]"
"16.554815","5.9.29.183","172.19.0.3","TLSv1.2","1516","Application Data [TCP segment of a reassembled PDU]"
"16.554825","5.9.29.183","172.19.0.3","TCP","1225","9002 → 43520 [PSH, ACK] Seq=333713 Ack=18376 Win=65535 Len=1169 [TCP segment of a reassembled PDU]"
"16.554831","5.9.29.183","172.19.0.3","TCP","1516","9002 → 43520 [PSH, ACK] Seq=334882 Ack=18376 Win=65535 Len=1460 [TCP segment of a reassembled PDU]"
"16.554834","5.9.29.183","172.19.0.3","TLSv1.2","1492","Application Data [TCP segment of a reassembled PDU]"
"16.554914","172.19.0.3","5.9.29.183","TCP","56","43520 → 9002 [ACK] Seq=18376 Ack=337778 Win=12696 Len=0"
"16.555343","172.19.0.3","5.9.29.183","TLSv1.2","599","Application Data"
"16.555572","5.9.29.183","172.19.0.3","TCP","56","9002 → 43520 [ACK] Seq=337778 Ack=18919 Win=65535 Len=0"
"16.570314","5.9.29.183","172.19.0.3","TLSv1.2","1488","Application Data"
"16.613361","172.19.0.3","5.9.29.183","TCP","56","43520 → 9002 [ACK] Seq=18919 Ack=339210 Win=12738 Len=0"
"16.684336","5.9.29.183","172.19.0.3","TCP","1516","[TCP segment of a reassembled PDU]"
"16.684403","172.19.0.3","5.9.29.183","TCP","56","43520 → 9002 [ACK] Seq=18919 Ack=340670 Win=12738 Len=0"
"16.684420","5.9.29.183","172.19.0.3","TCP","1492","9002 → 43520 [PSH, ACK] Seq=340670 Ack=18919 Win=65535 Len=1436 [TCP segment of a reassembled PDU]"
"16.684432","172.19.0.3","5.9.29.183","TCP","56","43520 → 9002 [ACK] Seq=18919 Ack=342106 Win=12730 Len=0"
"16.684569","5.9.29.183","172.19.0.3","TLSv1.2","1237","Application Data"
"16.684578","172.19.0.3","5.9.29.183","TCP","56","43520 → 9002 [ACK] Seq=18919 Ack=343287 Win=12722 Len=0"
"16.695768","5.9.29.183","172.19.0.3","TLSv1.2","1504","Application Data"
"16.695797","172.19.0.3","5.9.29.183","TCP","56","43520 → 9002 [ACK] Seq=18919 Ack=344735 Win=12738 Len=0"
"16.696050","5.9.29.183","172.19.0.3","TCP","1504","9002 → 43520 [PSH, ACK] Seq=344735 Ack=18919 Win=65535 Len=1448 [TCP segment of a reassembled PDU]"
"16.696191","5.9.29.183","172.19.0.3","TLSv1.2","1516","Application Data [TCP segment of a reassembled PDU]"
"16.696198","5.9.29.183","172.19.0.3","TCP","1516","9002 → 43520 [PSH, ACK] Seq=347643 Ack=18919 Win=65535 Len=1460 [TCP segment of a reassembled PDU]"
"16.696204","5.9.29.183","172.19.0.3","TCP","1516","9002 → 43520 [PSH, ACK] Seq=349103 Ack=18919 Win=65535 Len=1460 [TCP segment of a reassembled PDU]"
"16.696207","5.9.29.183","172.19.0.3","TLSv1.2","1516","Application Data [TCP segment of a reassembled PDU]"
"16.696258","5.9.29.183","172.19.0.3","TCP","1456","9002 → 43520 [PSH, ACK] Seq=352023 Ack=18919 Win=65535 Len=1400 [TCP segment of a reassembled PDU]"
"16.696288","172.19.0.3","5.9.29.183","TCP","56","43520 → 9002 [ACK] Seq=18919 Ack=353423 Win=12690 Len=0"
"16.700445","5.9.29.183","172.19.0.3","TLSv1.2","894","Application Data"
"16.700614","172.19.0.3","5.9.29.183","TCP","56","43520 → 9002 [ACK] Seq=18919 Ack=354261 Win=12738 Len=0"
