_ws.col.Time,_ws.col.Source,_ws.col.Destination,_ws.col.Protocol,_ws.col.Length,_ws.col.Info
"0.000000","172.19.0.3","5.9.29.183","TLSv1.2","599","Application Data"
"0.000292","5.9.29.183","172.19.0.3","TCP","56","9002 → 43520 [ACK] Seq=1 Ack=544 Win=65535 Len=0"
"0.218698","5.9.29.183","172.19.0.3","TLSv1.2","599","Application Data"
"0.218787","172.19.0.3","5.9.29.183","TCP","56","43520 → 9002 [ACK] Seq=544 Ack=544 Win=11911 Len=0"
"0.219701","172.19.0.3","5.9.29.183","TLSv1.2","2141","Application Data"
"0.220060","5.9.29.183","172.19.0.3","TCP","56","9002 → 43520 [ACK] Seq=544 Ack=2629 Win=65535 Len=0"
"0.876682","5.9.29.183","172.19.0.3","TCP","979","[TCP segment of a reassembled PDU]"
"0.876867","5.9.29.183","172.19.0.3","TLSv1.2","704","Application Data"
"0.877261","172.19.0.3","5.9.29.183","TCP","56","43520 → 9002 [ACK] Seq=2629 Ack=2115 Win=11901 Len=0"
"0.882534","172.19.0.3","5.9.29.183","TLSv1.2","599","Application Data"
"0.883030","5.9.29.183","172.19.0.3","TCP","56","9002 → 43520 [ACK] Seq=2115 Ack=3172 Win=65535 Len=0"
"1.095136","5.9.29.183","172.19.0.3","TLSv1.2","599","Application Data"
"1.096531","172.19.0.3","5.9.29.183","TLSv1.2","599","Application Data"
"1.096950","5.9.29.183","172.19.0.3","TCP","56","9002 → 43520 [ACK] Seq=2658 Ack=3715 Win=65535 Len=0"
"1.339333","5.9.29.183","172.19.0.3","TCP","1504","[TCP segment of a reassembled PDU]"
"1.339378","5.9.29.183","172.19.0.3","TCP","1504","9002 → 43520 [PSH, ACK] Seq=4106 Ack=3715 Win=65535 Len=1448 [TCP segment of a reassembled PDU]"
"1.339385","5.9.29.183","172.19.0.3","TLSv1.2","787","Application Data"
"1.339563","172.19.0.3","5.9.29.183","TCP","56","43520 → 9002 [ACK] Seq=3715 Ack=6285 Win=11895 Len=0"
"1.363364","5.9.29.183","172.19.0.3","TCP","1504","[TCP segment of a reassembled PDU]"
"1.363416","5.9.29.183","172.19.0.3","TCP","1516","9002 → 43520 [PSH, ACK] Seq=7733 Ack=3715 Win=65535 Len=1460 [TCP segment of a reassembled PDU]"
"1.363481","172.19.0.3","5.9.29.183","TCP","56","43520 → 9002 [ACK] Seq=3715 Ack=9193 Win=11903 Len=0"
"1.363486","5.9.29.183","172.19.0.3","TLSv1.2","1516","Application Data [TCP segment of a reassembled PDU]"
"1.363493","5.9.29.183","172.19.0.3","TCP","1213","9002 → 43520 [PSH, ACK] Seq=10653 Ack=3715 Win=65535 Len=1157 [TCP segment of a reassembled PDU]"
"1.363602","172.19.0.3","5.9.29.183","TCP","56","43520 → 9002 [ACK] Seq=3715 Ack=11810 Win=11885 Len=0"
"1.376343","5.9.29.183","172.19.0.3","TLSv1.2","1504","Application Data [TCP segment of a reassembled PDU]"
"1.376451","5.9.29.183","172.19.0.3","TCP","1516","9002 → 43520 [PSH, ACK] Seq=13258 Ack=3715 Win=65535 Len=1460 [TCP segment of a reassembled PDU]"
"1.376485","172.19.0.3","5.9.29.183","TCP","56","43520 → 9002 [ACK] Seq=3715 Ack=14718 Win=11903 Len=0"
"1.376490","5.9.29.183","172.19.0.3","TCP","1516","9002 → 43520 [PSH, ACK] Seq=14718 Ack=3715 Win=65535 Len=1460 [TCP segment of a reassembled PDU]"
"1.376495","5.9.29.183","172.19.0.3","TLSv1.2","1516","Application Data [TCP segment of a reassembled PDU]"
"1.376497","5.9.29.183","172.19.0.3","TCP","1468","9002 → 43520 [PSH, ACK] Seq=17638 Ack=3715 Win=65535 Len=1412 [TCP segment of a reassembled PDU]"
"1.376724","172.19.0.3","5.9.29.183","TCP","56","43520 → 9002 [ACK] Seq=3715 Ack=19050 Win=11879 Len=0"
"1.379257","5.9.29.183","172.19.0.3","TCP","1516","9002 → 43520 [PSH, ACK] Seq=19050 Ack=3715 Win=65535 Len=1460 [TCP segment of a reassembled PDU]"
"1.379310","5.9.29.183","172.19.0.3","TLSv1.2","339","Application Data"
"1.379332","172.19.0.3","5.9.29.183","TCP","56","43520 → 9002 [ACK] Seq=3715 Ack=20793 Win=11903 Len=0"
"1.389859","5.9.29.183","172.19.0.3","TCP","1504","[TCP segment of a reassembled PDU]"
"1.389904","5.9.29.183","172.19.0.3","TCP","1504","9002 → 43520 [PSH, ACK] Seq=22241 Ack=3715 Win=65535 Len=1448 [TCP segment of a reassembled PDU]"
"1.389916","172.19.0.3","5.9.29.183","TCP","56","43520 → 9002 [ACK] Seq=3715 Ack=23689 Win=11903 Len=0"
"1.389926","5.9.29.183","172.19.0.3","TLSv1.2","1504","Application Data [TCP segment of a reassembled PDU]"
"1.389930","5.9.29.183","172.19.0.3","TCP","1516","9002 → 43520 [PSH, ACK] Seq=25137 Ack=3715 Win=65535 Len=1460 [TCP segment of a reassembled PDU]"
"1.389933","5.9.29.183","172.19.0.3","TCP","1492","9002 → 43520 [PSH, ACK] Seq=26597 Ack=3715 Win=65535 Len=1436 [TCP segment of a reassembled PDU]"
"1.390032","172.19.0.3","5.9.29.183","TCP","56","43520 → 9002 [ACK] Seq=3715 Ack=28033 Win=11879 Len=0"
"1.390155","5.9.29.183","172.19.0.3","TLSv1.2","1516","Application Data [TCP segment of a reassembled PDU]"
"1.390163","5.9.29.183","172.19.0.3","TCP","1492","9002 → 43520 [PSH, ACK] Seq=29493 Ack=3715 Win=65535 Len=1436 [TCP segment of a reassembled PDU]"
"1.390184","172.19.0.3","5.9.29.183","TCP","56","43520 → 9002 [ACK] Seq=3715 Ack=30929 Win=11863 Len=0"
"1.390343","172.19.0.3","5.9.29.183","TLSv1.2","599","Application Data"
"1.390700","5.9.29.183","172.19.0.3","TCP","56","9002 → 43520 [ACK] Seq=30929 Ack=4258 Win=65535 Len=0"
"1.391068","5.9.29.183","172.19.0.3","TCP","1504","9002 → 43520 [PSH, ACK] Seq=30929 Ack=4258 Win=65535 Len=1448 [TCP segment of a reassembled PDU]"
"1.394555","5.9.29.183","172.19.0.3","TLSv1.2","381","Application Data"
"1.394615","172.19.0.3","5.9.29.183","TCP","56","43520 → 9002 [ACK] Seq=4258 Ack=32702 Win=11911 Len=0"
"1.409386","5.9.29.183","172.19.0.3","TLSv1.2","1113","Application Data"
"1.430082","5.9.29.183","172.19.0.3","TCP","1504","[TCP segment of a reassembled PDU]"
"1.430109","172.19.0.3","5.9.29.183","TCP","56","43520 → 9002 [ACK] Seq=4258 Ack=35207 Win=11911 Len=0"
"1.430150","5.9.29.183","172.19.0.3","TCP","1516","9002 → 43520 [PSH, ACK] Seq=35207 Ack=4258 Win=65535 Len=1460 [TCP segment of a reassembled PDU]"
"1.430186","5.9.29.183","172.19.0.3","TLSv1.2","1225","Application Data"
"1.430813","172.19.0.3","5.9.29.183","TCP","56","43520 → 9002 [ACK] Seq=4258 Ack=37836 Win=11893 Len=0"
"1.431215","172.19.0.3","5.9.29.183","TLSv1.2","599","Application Data"
"1.432688","5.9.29.183","172.19.0.3","TCP","56","9002 → 43520 [ACK] Seq=37836 Ack=4801 Win=65535 Len=0"
"1.441371","172.19.0.3","5.9.29.183","TLSv1.2","1113","Application Data"
"1.441672","5.9.29.183","172.19.0.3","TCP","56","9002 → 43520 [ACK] Seq=37836 Ack=5858 Win=65535 Len=0"
"1.444954","5.9.29.183","172.19.0.3","TLSv1.2","149","Application Data"
"1.486514","172.19.0.3","5.9.29.183","TCP","56","43520 → 9002 [ACK] Seq=5858 Ack=37929 Win=11911 Len=0"
"1.806606","5.9.29.183","172.19.0.3","TLSv1.2","599","Application Data"
"1.806661","172.19.0.3","5.9.29.183","TCP","56","43520 → 9002 [ACK] Seq=5858 Ack=38472 Win=11911 Len=0"
"1.807308","172.19.0.3","5.9.29.183","TLSv1.2","599","Application Data"
"1.807465","5.9.29.183","172.19.0.3","TCP","56","9002 → 43520 [ACK] Seq=38472 Ack=6401 Win=65535 Len=0"
"2.086041","5.9.29.183","172.19.0.3","TCP","1516","[TCP segment of a reassembled PDU]"
"2.086106","5.9.29.183","172.19.0.3","TCP","1492","9002 → 43520 [PSH, ACK] Seq=39932 Ack=6401 Win=65535 Len=1436 [TCP segment of a reassembled PDU]"
"2.086113","5.9.29.183","172.19.0.3","TLSv1.2","787","Application Data"
"2.086237","172.19.0.3","5.9.29.183","TCP","56","43520 → 9002 [ACK] Seq=6401 Ack=42099 Win=11895 Len=0"
"2.099460","5.9.29.183","172.19.0.3","TCP","1504","[TCP segment of a reassembled PDU]"
"2.099580","5.9.29.183","172.19.0.3","TCP","1504","9002 → 43520 [PSH, ACK] Seq=43547 Ack=6401 Win=65535 Len=1448 [TCP segment of a reassembled PDU]"
"2.099694","172.19.0.3","5.9.29.183","TCP","56","43520 → 9002 [ACK] Seq=6401 Ack=44995 Win=11903 Len=0"
"2.099699","5.9.29.183","172.19.0.3","TLSv1.2","1516","Application Data [TCP segment of a reassembled PDU]"
"2.099824","5.9.29.183","172.19.0.3","TLSv1.2","1516","Application Data [TCP segment of a reassembled PDU]"
"2.099833","5.9.29.183","172.19.0.3","TCP","1516","9002 → 43520 [PSH, ACK] Seq=47915 Ack=6401 Win=65535 Len=1460 [TCP segment of a reassembled PDU]"
"2.099837","5.9.29.183","172.19.0.3","TCP","1468","9002 → 43520 [PSH, ACK] Seq=49375 Ack=6401 Win=65535 Len=1412 [TCP segment of a reassembled PDU]"
"2.099950","172.19.0.3","5.9.29.183","TCP","56","43520 → 9002 [ACK] Seq=6401 Ack=50787 Win=11871 Len=0"
"2.101553","5.9.29.183","172.19.0.3","TLSv1.2","1516","Application Data, Application Data"
"2.101597","5.9.29.183","172.19.0.3","TCP","1516","9002 → 43520 [PSH, ACK] Seq=52247 Ack=6401 Win=65535 Len=1460 [TCP segment of a reassembled PDU]"
"2.101609","172.19.0.3","5.9.29.183","TCP","56","43520 → 9002 [ACK] Seq=6401 Ack=53707 Win=11903 Len=0"
"2.101611","5.9.29.183","172.19.0.3","TCP","1480","9002 → 43520 [PSH, ACK] Seq=53707 Ack=6401 Win=65535 Len=1424 [TCP segment of a reassembled PDU]"
"2.101831","5.9.29.183","172.19.0.3","TLSv1.2","1076","Application Data, Application Data"
"2.101878","172.19.0.3","5.9.29.183","TCP","56","43520 → 9002 [ACK] Seq=6401 Ack=56151 Win=11887 Len=0"
"2.103532","5.9.29.183","172.19.0.3","TCP","1504","[TCP segment of a reassembled PDU]"
"2.114508","5.9.29.183","172.19.0.3","TLSv1.2","1504","Application Data [TCP segment of a reassembled PDU]"
"2.114526","172.19.0.3","5.9.29.183","TCP","56","43520 → 9002 [ACK] Seq=6401 Ack=59047 Win=11911 Len=0"
"2.114562","5.9.29.183","172.19.0.3","TCP","1504","9002 → 43520 [PSH, ACK] Seq=59047 Ack=6401 Win=65535 Len=1448 [TCP segment of a reassembled PDU]"
"2.114858","5.9.29.183","172.19.0.3","TCP","1516","9002 → 43520 [PSH, ACK] Seq=60495 Ack=6401 Win=65535 Len=1460 [TCP segment of a reassembled PDU]"
"2.114868","5.9.29.183","172.19.0.3","TLSv1.2","1516","Application Data [TCP segment of a reassembled PDU]"
"2.114872","5.9.29.183","172.19.0.3","TLSv1.2","1516","Application Data [TCP segment of a reassembled PDU]"
"2.114912","5.9.29.183","172.19.0.3","TCP","1468","9002 → 43520 [PSH, ACK] Seq=64875 Ack=6401 Win=65535 Len=1412 [TCP segment of a reassembled PDU]"
"2.114964","172.19.0.3","5.9.29.183","TCP","56","43520 → 9002 [ACK] Seq=6401 Ack=66287 Win=11869 Len=0"
"2.115084","5.9.29.183","172.19.0.3","TCP","772","9002 → 43520 [PSH, ACK] Seq=66287 Ack=6401 Win=65535 Len=716 [TCP segment of a reassembled PDU]"
"2.115199","5.9.29.183","172.19.0.3","TLSv1.2","1516","Application Data, Application Data"
"2.115206","5.9.29.183","172.19.0.3","TCP","1516","9002 → 43520 [PSH, ACK] Seq=68463 Ack=6401 Win=65535 Len=1460 [TCP segment of a reassembled PDU]"
"2.115208","5.9.29.183","172.19.0.3","TCP","1516","9002 → 43520 [PSH, ACK] Seq=69923 Ack=6401 Win=65535 Len=1460 [TCP segment of a reassembled PDU]"
"2.115232","172.19.0.3","5.9.29.183","TCP","56","43520 → 9002 [ACK] Seq=6401 Ack=69923 Win=11845 Len=0"
"2.115299","5.9.29.183","172.19.0.3","TCP","752","9002 → 43520 [PSH, ACK] Seq=71383 Ack=6401 Win=65535 Len=696 [TCP segment of a reassembled PDU]"
"2.115431","172.19.0.3","5.9.29.183","TLSv1.2","599","Application Data"
"2.115603","5.9.29.183","172.19.0.3","TCP","56","9002 → 43520 [ACK] Seq=72079 Ack=6944 Win=65535 Len=0"
"2.117029","5.9.29.183","172.19.0.3","TLSv1.2","779","Application Data, Application Data"
"2.118244","5.9.29.183","172.19.0.3","TCP","1504","[TCP segment of a reassembled PDU]"
"2.118260","172.19.0.3","5.9.29.183","TCP","56","43520 → 9002 [ACK] Seq=6944 Ack=74250 Win=11911 Len=0"
"2.131776","5.9.29.183","172.19.0.3","TLSv1.2","1504","Application Data [TCP segment of a reassembled PDU]"
"2.131869","5.9.29.183","172.19.0.3","TCP","1516","9002 → 43520 [PSH, ACK] Seq=75698 Ack=6944 Win=65535 Len=1460 [TCP segment of a reassembled PDU]"
"2.131880","5.9.29.183","172.19.0.3","TCP","1516","9002 → 43520 [PSH, ACK] Seq=77158 Ack=6944 Win=65535 Len=1460 [TCP segment of a reassembled PDU]"
"2.131884","5.9.29.183","172.19.0.3","TLSv1.2","1516","Application Data [TCP segment of a reassembled PDU]"
"2.131934","5.9.29.183","172.19.0.3","TCP","1516","9002 → 43520 [PSH, ACK] Seq=80078 Ack=6944 Win=65535 Len=1460 [TCP segment of a reassembled PDU]"
"2.131940","5.9.29.183","172.19.0.3","TCP","1516","9002 → 43520 [PSH, ACK] Seq=81538 Ack=6944 Win=65535 Len=1460 [TCP segment of a reassembled PDU]"
"2.131945","5.9.29.183","172.19.0.3","TLSv1.2","1516","Application Data [TCP segment of a reassembled PDU]"
"2.131951","5.9.29.183","172.19.0.3","TCP","1432","9002 → 43520 [PSH, ACK] Seq=84458 Ack=6944 Win=65535 Len=1376 [TCP segment of a reassembled PDU]"
"2.132227","172.19.0.3","5.9.29.183","TCP","56","43520 → 9002 [ACK] Seq=6944 Ack=85834 Win=11855 Len=0"
"2.132345","5.9.29.183","172.19.0.3","TLSv1.2","1018","Application Data"
"2.146252","5.9.29.183","172.19.0.3","TCP","1516","[TCP segment of a reassembled PDU]"
"2.146296","172.19.0.3","5.9.29.183","TCP","56","43520 → 9002 [ACK] Seq=6944 Ack=88256 Win=11911 Len=0"
"2.146370","5.9.29.183","172.19.0.3","TCP","1516","9002 → 43520 [PSH, ACK] Seq=88256 Ack=6944 Win=65535 Len=1460 [TCP segment of a reassembled PDU]"
"2.146929","5.9.29.183","172.19.0.3","TLSv1.2","1480","Application Data [TCP segment of a reassembled PDU]"
"2.146949","172.19.0.3","5.9.29.183","TCP","56","43520 → 9002 [ACK] Seq=6944 Ack=91140 Win=11911 Len=0"
"2.147065","5.9.29.183","172.19.0.3","TCP","1516","9002 → 43520 [PSH, ACK] Seq=91140 Ack=6944 Win=65535 Len=1460 [TCP segment of a reassembled PDU]"
"2.147199","5.9.29.183","172.19.0.3","TCP","1516","9002 → 43520 [PSH, ACK] Seq=92600 Ack=6944 Win=65535 Len=1460 [TCP segment of a reassembled PDU]"
"2.147225","5.9.29.183","172.19.0.3","TLSv1.2","1516","Application Data [TCP segment of a reassembled PDU]"
"2.147708","5.9.29.183","172.19.0.3","TCP","1516","9002 → 43520 [PSH, ACK] Seq=95520 Ack=6944 Win=65535 Len=1460 [TCP segment of a reassembled PDU]"
"2.147989","172.19.0.3","5.9.29.183","TLSv1.2","1113","Application Data"
"2.148037","5.9.29.183","172.19.0.3","TCP","1516","9002 → 43520 [PSH, ACK] Seq=96980 Ack=6944 Win=65535 Len=1460 [TCP segment of a reassembled PDU]"
"2.148046","5.9.29.183","172.19.0.3","TLSv1.2","1516","Application Data [TCP segment of a reassembled PDU]"
"2.148049","5.9.29.183","172.19.0.3","TCP","1516","9002 → 43520 [PSH, ACK] Seq=99900 Ack=6944 Win=65535 Len=1460 [TCP segment of a reassembled PDU]"
"2.148052","5.9.29.183","172.19.0.3","TCP","1420","9002 → 43520 [PSH, ACK] Seq=101360 Ack=6944 Win=65535 Len=1364 [TCP segment of a reassembled PDU]"
"2.148124","5.9.29.183","172.19.0.3","TLSv1.2","721","Application Data, Application Data"
"2.148267","172.19.0.3","5.9.29.183","TCP","56","43520 → 9002 [ACK] Seq=8001 Ack=103389 Win=11838 Len=0"
"2.148340","5.9.29.183","172.19.0.3","TCP","56","9002 → 43520 [ACK] Seq=103389 Ack=8001 Win=65535 Len=0"
"2.152165","5.9.29.183","172.19.0.3","TCP","1504","[TCP segment of a reassembled PDU]"
"2.152213","5.9.29.183","172.19.0.3","TCP","1504","9002 → 43520 [PSH, ACK] Seq=104837 Ack=8001 Win=65535 Len=1448 [TCP segment of a reassembled PDU]"
"2.152236","172.19.0.3","5.9.29.183","TCP","56","43520 → 9002 [ACK] Seq=8001 Ack=106285 Win=11903 Len=0"
"2.164303","5.9.29.183","172.19.0.3","TLSv1.2","787","Application Data"
"2.164475","5.9.29.183","172.19.0.3","TCP","1504","[TCP segment of a reassembled PDU]"
"2.164515","172.19.0.3","5.9.29.183","TCP","56","43520 → 9002 [ACK] Seq=8001 Ack=108464 Win=11903 Len=0"
"2.179308","5.9.29.183","172.19.0.3","TLSv1.2","693","Application Data"
"2.186679","172.19.0.3","5.9.29.183","TLSv1.2","599","Application Data"
"2.191155","5.9.29.183","172.19.0.3","TCP","56","9002 → 43520 [ACK] Seq=109101 Ack=8544 Win=65535 Len=0"
"2.459223","5.9.29.183","172.19.0.3","TLSv1.2","599","Application Data"
"2.461328","172.19.0.3","5.9.29.183","TLSv1.2","599","Application Data"
"2.461701","5.9.29.183","172.19.0.3","TCP","56","9002 → 43520 [ACK] Seq=109644 Ack=9087 Win=65535 Len=0"
"2.718069","5.9.29.183","172.19.0.3","TCP","1504","[TCP segment of a reassembled PDU]"
"2.718133","5.9.29.183","172.19.0.3","TCP","1516","9002 → 43520 [PSH, ACK] Seq=111092 Ack=9087 Win=65535 Len=1460 [TCP segment of a reassembled PDU]"
"2.718140","5.9.29.183","172.19.0.3","TLSv1.2","775","Application Data"
"2.718265","172.19.0.3","5.9.29.183","TCP","56","43520 → 9002 [ACK] Seq=9087 Ack=113271 Win=11895 Len=0"
"2.732210","5.9.29.183","172.19.0.3","TCP","1516","[TCP segment of a reassembled PDU]"
"2.732300","5.9.29.183","172.19.0.3","TCP","1492","9002 → 43520 [PSH, ACK] Seq=114731 Ack=9087 Win=65535 Len=1436 [TCP segment of a reassembled PDU]"
"2.732325","172.19.0.3","5.9.29.183","TCP","56","43520 → 9002 [ACK] Seq=9087 Ack=116167 Win=11901 Len=0"
"2.733660","5.9.29.183","172.19.0.3","TLSv1.2","1330","Application Data, Application Data"
"2.740532","5.9.29.183","172.19.0.3","TCP","1504","[TCP segment of a reassembled PDU]"
"2.740556","172.19.0.3","5.9.29.183","TCP","56","43520 → 9002 [ACK] Seq=9087 Ack=118889 Win=11911 Len=0"
"2.740673","5.9.29.183","172.19.0.3","TCP","1516","9002 → 43520 [PSH, ACK] Seq=118889 Ack=9087 Win=65535 Len=1460 [TCP segment of a reassembled PDU]"
"2.740707","5.9.29.183","172.19.0.3","TLSv1.2","1516","Application Data [TCP segment of a reassembled PDU]"
"2.740714","5.9.29.183","172.19.0.3","TCP","1480","9002 → 43520 [PSH, ACK] Seq=121809 Ack=9087 Win=65535 Len=1424 [TCP segment of a reassembled PDU]"
"2.740722","5.9.29.183","172.19.0.3","TCP","1516","9002 → 43520 [PSH, ACK] Seq=123233 Ack=9087 Win=65535 Len=1460 [TCP segment of a reassembled PDU]"
"2.740844","172.19.0.3","5.9.29.183","TCP","56","43520 → 9002 [ACK] Seq=9087 Ack=124693 Win=11879 Len=0"
"2.740863","5.9.29.183","172.19.0.3","TLSv1.2","1516","Application Data [TCP segment of a reassembled PDU]"
"2.740869","5.9.29.183","172.19.0.3","TCP","1480","9002 → 43520 [PSH, ACK] Seq=126153 Ack=9087 Win=65535 Len=1424 [TCP segment of a reassembled PDU]"
"2.741027","172.19.0.3","5.9.29.183","TCP","56","43520 → 9002 [ACK] Seq=9087 Ack=127577 Win=11863 Len=0"
"2.746691","5.9.29.183","172.19.0.3","TCP","1504","9002 → 43520 [PSH, ACK] Seq=127577 Ack=9087 Win=65535 Len=1448 [TCP segment of a reassembled PDU]"
"2.746947","5.9.29.183","172.19.0.3","TLSv1.2","1516","Application Data [TCP segment of a reassembled PDU]"
"2.746996","172.19.0.3","5.9.29.183","TCP","56","43520 → 9002 [ACK] Seq=9087 Ack=130485 Win=11911 Len=0"
"2.747098","5.9.29.183","172.19.0.3","TCP","1492","9002 → 43520 [PSH, ACK] Seq=130485 Ack=9087 Win=65535 Len=1436 [TCP segment of a reassembled PDU]"
"2.747103","5.9.29.183","172.19.0.3","TCP","674","9002 → 43520 [PSH, ACK] Seq=131921 Ack=9087 Win=65535 Len=618 [TCP segment of a reassembled PDU]"
"2.747106","5.9.29.183","172.19.0.3","TCP","886","9002 → 43520 [PSH, ACK] Seq=132539 Ack=9087 Win=65535 Len=830 [TCP segment of a reassembled PDU]"
"2.747199","172.19.0.3","5.9.29.183","TCP","56","43520 → 9002 [ACK] Seq=9087 Ack=133369 Win=11889 Len=0"
"2.748878","5.9.29.183","172.19.0.3","TLSv1.2","1516","Application Data, Application Data"
"2.748930","5.9.29.183","172.19.0.3","TCP","1492","9002 → 43520 [PSH, ACK] Seq=134829 Ack=9087 Win=65535 Len=1436 [TCP segment of a reassembled PDU]"
"2.748947","172.19.0.3","5.9.29.183","TCP","56","43520 → 9002 [ACK] Seq=9087 Ack=136265 Win=11903 Len=0"
"2.755391","5.9.29.183","172.19.0.3","TCP","1504","9002 → 43520 [PSH, ACK] Seq=136265 Ack=9087 Win=65535 Len=1448 [TCP segment of a reassembled PDU]"
"2.755630","5.9.29.183","172.19.0.3","TLSv1.2","1516","Application Data [TCP segment of a reassembled PDU]"
"2.755641","172.19.0.3","5.9.29.183","TCP","56","43520 → 9002 [ACK] Seq=9087 Ack=139173 Win=11911 Len=0"
"2.755667","5.9.29.183","172.19.0.3","TCP","1516","9002 → 43520 [PSH, ACK] Seq=139173 Ack=9087 Win=65535 Len=1460 [TCP segment of a reassembled PDU]"
"2.755673","5.9.29.183","172.19.0.3","TLSv1.2","1480","Application Data [TCP segment of a reassembled PDU]"
"2.755719","172.19.0.3","5.9.29.183","TCP","56","43520 → 9002 [ACK] Seq=9087 Ack=142057 Win=11895 Len=0"
"2.755959","172.19.0.3","5.9.29.183","TLSv1.2","599","Application Data"
"2.756138","5.9.29.183","172.19.0.3","TCP","56","9002 → 43520 [ACK] Seq=142057 Ack=9630 Win=65535 Len=0"
"2.762120","5.9.29.183","172.19.0.3","TCP","1504","9002 → 43520 [PSH, ACK] Seq=142057 Ack=9630 Win=65535 Len=1448 [TCP segment of a reassembled PDU]"
"2.762556","5.9.29.183","172.19.0.3","TLSv1.2","1504","Application Data [TCP segment of a reassembled PDU]"
"2.762587","172.19.0.3","5.9.29.183","TCP","56","43520 → 9002 [ACK] Seq=9630 Ack=144953 Win=11911 Len=0"
"2.762672","5.9.29.183","172.19.0.3","TLSv1.2","1516","Application Data [TCP segment of a reassembled PDU]"
"2.762677","5.9.29.183","172.19.0.3","TCP","1516","9002 → 43520 [PSH, ACK] Seq=146413 Ack=9630 Win=65535 Len=1460 [TCP segment of a reassembled PDU]"
"2.762679","5.9.29.183","172.19.0.3","TCP","1516","9002 → 43520 [PSH, ACK] Seq=147873 Ack=9630 Win=65535 Len=1460 [TCP segment of a reassembled PDU]"
"2.762774","172.19.0.3","5.9.29.183","TCP","56","43520 → 9002 [ACK] Seq=9630 Ack=149333 Win=11887 Len=0"
"2.762972","5.9.29.183","172.19.0.3","TLSv1.2","1516","Application Data, Application Data"
"2.763002","5.9.29.183","172.19.0.3","TCP","1516","9002 → 43520 [PSH, ACK] Seq=150793 Ack=9630 Win=65535 Len=1460 [TCP segment of a reassembled PDU]"
"2.763010","172.19.0.3","5.9.29.183","TCP","56","43520 → 9002 [ACK] Seq=9630 Ack=152253 Win=11903 Len=0"
"2.763011","5.9.29.183","172.19.0.3","TCP","1516","9002 → 43520 [PSH, ACK] Seq=152253 Ack=9630 Win=65535 Len=1460 [TCP segment of a reassembled PDU]"
"2.763051","5.9.29.183","172.19.0.3","TLSv1.2","655","Application Data, Application Data"
"2.763126","172.19.0.3","5.9.29.183","TCP","56","43520 → 9002 [ACK] Seq=9630 Ack=154312 Win=11887 Len=0"
"2.764794","5.9.29.183","172.19.0.3","TCP","1504","[TCP segment of a reassembled PDU]"
"2.764834","5.9.29.183","172.19.0.3","TCP","1516","9002 → 43520 [PSH, ACK] Seq=155760 Ack=9630 Win=65535 Len=1460 [TCP segment of a reassembled PDU]"
"2.764854","172.19.0.3","5.9.29.183","TCP","56","43520 → 9002 [ACK] Seq=9630 Ack=157220 Win=11903 Len=0"
"2.764900","5.9.29.183","172.19.0.3","TLSv1.2","1516","Application Data [TCP segment of a reassembled PDU]"
"2.764906","5.9.29.183","172.19.0.3","TLSv1.2","1480","Application Data [TCP segment of a reassembled PDU]"
"2.764942","172.19.0.3","5.9.29.183","TCP","56","43520 → 9002 [ACK] Seq=9630 Ack=160104 Win=11887 Len=0"
"2.765029","5.9.29.183","172.19.0.3","TCP","1516","9002 → 43520 [PSH, ACK] Seq=160104 Ack=9630 Win=65535 Len=1460 [TCP segment of a reassembled PDU]"
"2.765035","5.9.29.183","172.19.0.3","TCP","1492","9002 → 43520 [PSH, ACK] Seq=161564 Ack=9630 Win=65535 Len=1436 [TCP segment of a reassembled PDU]"
"2.765097","172.19.0.3","5.9.29.183","TLSv1.2","599","Application Data"
"2.765248","5.9.29.183","172.19.0.3","TCP","56","9002 → 43520 [ACK] Seq=163000 Ack=10173 Win=65535 Len=0"
"2.771917","5.9.29.183","172.19.0.3","TLSv1.2","1516","Application Data, Application Data"
"2.771963","5.9.29.183","172.19.0.3","TCP","1516","9002 → 43520 [PSH, ACK] Seq=164460 Ack=10173 Win=65535 Len=1460 [TCP segment of a reassembled PDU]"
"2.771976","172.19.0.3","5.9.29.183","TCP","56","43520 → 9002 [ACK] Seq=10173 Ack=165920 Win=11903 Len=0"
"2.771978","5.9.29.183","172.19.0.3","TCP","1516","9002 → 43520 [PSH, ACK] Seq=165920 Ack=10173 Win=65535 Len=1460 [TCP segment of a reassembled PDU]"
"2.771980","5.9.29.183","172.19.0.3","TLSv1.2","1516","Application Data, Application Data"
"2.771982","5.9.29.183","172.19.0.3","TCP","1516","9002 → 43520 [PSH, ACK] Seq=168840 Ack=10173 Win=65535 Len=1460 [TCP segment of a reassembled PDU]"
"2.771985","5.9.29.183","172.19.0.3","TCP","1444","9002 → 43520 [PSH, ACK] Seq=170300 Ack=10173 Win=65535 Len=1388 [TCP segment of a reassembled PDU]"
"2.772083","172.19.0.3","5.9.29.183","TCP","56","43520 → 9002 [ACK] Seq=10173 Ack=171688 Win=11869 Len=0"
"2.774923","172.19.0.3","5.9.29.183","TLSv1.2","599","Application Data"
"2.775290","5.9.29.183","172.19.0.3","TCP","56","9002 → 43520 [ACK] Seq=171688 Ack=10716 Win=65535 Len=0"
"2.776562","5.9.29.183","172.19.0.3","TLSv1.2","1504","Application Data, Application Data"
"2.776634","5.9.29.183","172.19.0.3","TCP","1516","9002 → 43520 [PSH, ACK] Seq=173136 Ack=10716 Win=65535 Len=1460 [TCP segment of a reassembled PDU]"
"2.776643","5.9.29.183","172.19.0.3","TCP","1516","9002 → 43520 [PSH, ACK] Seq=174596 Ack=10716 Win=65535 Len=1460 [TCP segment of a reassembled PDU]"
"2.776664","5.9.29.183","172.19.0.3","TLSv1.2","1516","Application Data [TCP segment of a reassembled PDU]"
"2.776800","172.19.0.3","5.9.29.183","TCP","56","43520 → 9002 [ACK] Seq=10716 Ack=177516 Win=11887 Len=0"
"2.776976","5.9.29.183","172.19.0.3","TCP","1468","9002 → 43520 [PSH, ACK] Seq=177516 Ack=10716 Win=65535 Len=1412 [TCP segment of a reassembled PDU]"
"2.776986","5.9.29.183","172.19.0.3","TCP","1504","9002 → 43520 [PSH, ACK] Seq=178928 Ack=10716 Win=65535 Len=1448 [TCP segment of a reassembled PDU]"
"2.776991","5.9.29.183","172.19.0.3","TLSv1.2","1504","Application Data [TCP segment of a reassembled PDU]"
"2.777122","172.19.0.3","5.9.29.183","TCP","56","43520 → 9002 [ACK] Seq=10716 Ack=181824 Win=11863 Len=0"
"2.777867","5.9.29.183","172.19.0.3","TCP","1504","9002 → 43520 [PSH, ACK] Seq=181824 Ack=10716 Win=65535 Len=1448 [TCP segment of a reassembled PDU]"
"2.778942","5.9.29.183","172.19.0.3","TCP","1516","9002 → 43520 [PSH, ACK] Seq=183272 Ack=10716 Win=65535 Len=1460 [TCP segment of a reassembled PDU]"
"2.778980","172.19.0.3","5.9.29.183","TCP","56","43520 → 9002 [ACK] Seq=10716 Ack=184732 Win=11911 Len=0"
"2.779020","5.9.29.183","172.19.0.3","TLSv1.2","281","Application Data"
"2.815111","5.9.29.183","172.19.0.3","TCP","1516","[TCP segment of a reassembled PDU]"
"2.815155","172.19.0.3","5.9.29.183","TCP","56","43520 → 9002 [ACK] Seq=10716 Ack=186417 Win=11911 Len=0"
"2.815216","5.9.29.183","172.19.0.3","TLSv1.2","1195","Application Data"
"2.819384","172.19.0.3","5.9.29.183","TLSv1.2","599","Application Data"
"2.819597","5.9.29.183","172.19.0.3","TCP","56","9002 → 43520 [ACK] Seq=187556 Ack=11259 Win=65535 Len=0"
"3.089543","5.9.29.183","172.19.0.3","TLSv1.2","599","Application Data"
"3.090778","172.19.0.3","5.9.29.183","TLSv1.2","599","Application Data"
"3.091398","5.9.29.183","172.19.0.3","TCP","56","9002 → 43520 [ACK] Seq=188099 Ack=11802 Win=65535 Len=0"
"3.458353","5.9.29.183","172.19.0.3","TCP","1516","[TCP segment of a reassembled PDU]"
"3.458394","5.9.29.183","172.19.0.3","TCP","1492","9002 → 43520 [PSH, ACK] Seq=189559 Ack=11802 Win=65535 Len=1436 [TCP segment of a reassembled PDU]"
"3.458484","5.9.29.183","172.19.0.3","TLSv1.2","273","Application Data"
"3.458540","172.19.0.3","5.9.29.183","TCP","56","43520 → 9002 [ACK] Seq=11802 Ack=191212 Win=11895 Len=0"
"3.491620","5.9.29.183","172.19.0.3","TCP","1516","[TCP segment of a reassembled PDU]"
"3.491674","5.9.29.183","172.19.0.3","TCP","1516","9002 → 43520 [PSH, ACK] Seq=192672 Ack=11802 Win=65535 Len=1460 [TCP segment of a reassembled PDU]"
"3.491687","172.19.0.3","5.9.29.183","TCP","56","43520 → 9002 [ACK] Seq=11802 Ack=194132 Win=11903 Len=0"
"3.491689","5.9.29.183","172.19.0.3","TLSv1.2","763","Application Data"
"3.492114","172.19.0.3","5.9.29.183","TLSv1.2","599","Application Data"
"3.492333","5.9.29.183","172.19.0.3","TCP","56","9002 → 43520 [ACK] Seq=194839 Ack=12345 Win=65535 Len=0"
"3.502637","5.9.29.183","172.19.0.3","TCP","1504","[TCP segment of a reassembled PDU]"
"3.502689","5.9.29.183","172.19.0.3","TCP","1504","9002 → 43520 [PSH, ACK] Seq=196287 Ack=12345 Win=65535 Len=1448 [TCP segment of a reassembled PDU]"
"3.502812","172.19.0.3","5.9.29.183","TCP","56","43520 → 9002 [ACK] Seq=12345 Ack=197735 Win=11903 Len=0"
"3.508933","5.9.29.183","172.19.0.3","TCP","396","9002 → 43520 [PSH, ACK] Seq=197735 Ack=12345 Win=65535 Len=340 [TCP segment of a reassembled PDU]"
"3.508981","5.9.29.183","172.19.0.3","TLSv1.2","447","Application Data"
"3.509117","172.19.0.3","5.9.29.183","TCP","56","43520 → 9002 [ACK] Seq=12345 Ack=198466 Win=11911 Len=0"
"3.523873","5.9.29.183","172.19.0.3","TLSv1.2","1113","Application Data"
"3.528009","172.19.0.3","5.9.29.183","TLSv1.2","599","Application Data"
"3.528388","5.9.29.183","172.19.0.3","TCP","56","9002 → 43520 [ACK] Seq=199523 Ack=12888 Win=65535 Len=0"
"3.774706","5.9.29.183","172.19.0.3","TLSv1.2","599","Application Data"
"3.775483","172.19.0.3","5.9.29.183","TLSv1.2","599","Application Data"
"3.775711","5.9.29.183","172.19.0.3","TCP","56","9002 → 43520 [ACK] Seq=200066 Ack=13431 Win=65535 Len=0"
"4.034693","5.9.29.183","172.19.0.3","TCP","1504","[TCP segment of a reassembled PDU]"
"4.034760","5.9.29.183","172.19.0.3","TCP","1516","9002 → 43520 [PSH, ACK] Seq=201514 Ack=13431 Win=65535 Len=1460 [TCP segment of a reassembled PDU]"
"4.034768","5.9.29.183","172.19.0.3","TLSv1.2","775","Application Data"
"4.034866","172.19.0.3","5.9.29.183","TCP","56","43520 → 9002 [ACK] Seq=13431 Ack=203693 Win=11895 Len=0"
"4.088632","5.9.29.183","172.19.0.3","TCP","1516","[TCP segment of a reassembled PDU]"
"4.088677","5.9.29.183","172.19.0.3","TCP","1492","9002 → 43520 [PSH, ACK] Seq=205153 Ack=13431 Win=65535 Len=1436 [TCP segment of a reassembled PDU]"
"4.088692","172.19.0.3","5.9.29.183","TCP","56","43520 → 9002 [ACK] Seq=13431 Ack=206589 Win=11903 Len=0"
"4.088694","5.9.29.183","172.19.0.3","TLSv1.2","1237","Application Data"
"4.107483","5.9.29.183","172.19.0.3","TLSv1.2","1516","Application Data"
"4.107511","172.19.0.3","5.9.29.183","TCP","56","43520 → 9002 [ACK] Seq=13431 Ack=209230 Win=11911 Len=0"
"4.107549","5.9.29.183","172.19.0.3","TCP","1516","9002 → 43520 [PSH, ACK] Seq=209230 Ack=13431 Win=65535 Len=1460 [TCP segment of a reassembled PDU]"
"4.107557","5.9.29.183","172.19.0.3","TLSv1.2","1516","Application Data [TCP segment of a reassembled PDU]"
"4.107560","5.9.29.183","172.19.0.3","TCP","1468","9002 → 43520 [PSH, ACK] Seq=212150 Ack=13431 Win=65535 Len=1412 [TCP segment of a reassembled PDU]"
"4.107620","5.9.29.183","172.19.0.3","TCP","1516","9002 → 43520 [PSH, ACK] Seq=213562 Ack=13431 Win=65535 Len=1460 [TCP segment of a reassembled PDU]"
"4.107628","5.9.29.183","172.19.0.3","TLSv1.2","665","Application Data"
"4.107687","172.19.0.3","5.9.29.183","TCP","56","43520 → 9002 [ACK] Seq=13431 Ack=215631 Win=11871 Len=0"
"4.117772","5.9.29.183","172.19.0.3","TCP","1504","[TCP segment of a reassembled PDU]"
"4.117857","5.9.29.183","172.19.0.3","TCP","1516","9002 → 43520 [PSH, ACK] Seq=217079 Ack=13431 Win=65535 Len=1460 [TCP segment of a reassembled PDU]"
"4.117878","172.19.0.3","5.9.29.183","TCP","56","43520 → 9002 [ACK] Seq=13431 Ack=218539 Win=11903 Len=0"
"4.117882","5.9.29.183","172.19.0.3","TLSv1.2","1516","Application Data [TCP segment of a reassembled PDU]"
"4.117889","5.9.29.183","172.19.0.3","TLSv1.2","1516","Application Data [TCP segment of a reassembled PDU]"
"4.117893","5.9.29.183","172.19.0.3","TCP","1516","9002 → 43520 [PSH, ACK] Seq=221459 Ack=13431 Win=65535 Len=1460 [TCP segment of a reassembled PDU]"
"4.117974","5.9.29.183","172.19.0.3","TCP","1456","9002 → 43520 [PSH, ACK] Seq=222919 Ack=13431 Win=65535 Len=1400 [TCP segment of a reassembled PDU]"
"4.118025","172.19.0.3","5.9.29.183","TCP","56","43520 → 9002 [ACK] Seq=13431 Ack=224319 Win=11871 Len=0"
"4.122764","5.9.29.183","172.19.0.3","TLSv1.2","1504","Application Data [TCP segment of a reassembled PDU]"
"4.122824","5.9.29.183","172.19.0.3","TCP","1516","9002 → 43520 [PSH, ACK] Seq=225767 Ack=13431 Win=65535 Len=1460 [TCP segment of a reassembled PDU]"
"4.122841","172.19.0.3","5.9.29.183","TCP","56","43520 → 9002 [ACK] Seq=13431 Ack=227227 Win=11903 Len=0"
"4.122844","5.9.29.183","172.19.0.3","TCP","1516","9002 → 43520 [PSH, ACK] Seq=227227 Ack=13431 Win=65535 Len=1460 [TCP segment of a reassembled PDU]"
"4.122850","5.9.29.183","172.19.0.3","TLSv1.2","1480","Application Data [TCP segment of a reassembled PDU]"
"4.122924","5.9.29.183","172.19.0.3","TCP","1516","9002 → 43520 [PSH, ACK] Seq=230111 Ack=13431 Win=65535 Len=1460 [TCP segment of a reassembled PDU]"
"4.122931","5.9.29.183","172.19.0.3","TCP","1492","9002 → 43520 [PSH, ACK] Seq=231571 Ack=13431 Win=65535 Len=1436 [TCP segment of a reassembled PDU]"
"4.122958","172.19.0.3","5.9.29.183","TCP","56","43520 → 9002 [ACK] Seq=13431 Ack=233007 Win=11871 Len=0"
"4.122972","5.9.29.183","172.19.0.3","TLSv1.2","1516","Application Data [TCP segment of a reassembled PDU]"
"4.123011","5.9.29.183","172.19.0.3","TCP","1516","9002 → 43520 [PSH, ACK] Seq=234467 Ack=13431 Win=65535 Len=1460 [TCP segment of a reassembled PDU]"
"4.123054","5.9.29.183","172.19.0.3","TLSv1.2","1008","Application Data"
"4.123141","172.19.0.3","5.9.29.183","TCP","56","43520 → 9002 [ACK] Seq=13431 Ack=236879 Win=11845 Len=0"
"4.123310","172.19.0.3","5.9.29.183","TLSv1.2","599","Application Data"
"4.123565","5.9.29.183","172.19.0.3","TCP","56","9002 → 43520 [ACK] Seq=236879 Ack=13974 Win=65535 Len=0"
"4.134460","5.9.29.183","172.19.0.3","TCP","1516","[TCP segment of a reassembled PDU]"
"4.134501","5.9.29.183","172.19.0.3","TCP","1516","9002 → 43520 [PSH, ACK] Seq=238339 Ack=13974 Win=65535 Len=1460 [TCP segment of a reassembled PDU]"
"4.134513","172.19.0.3","5.9.29.183","TCP","56","43520 → 9002 [ACK] Seq=13974 Ack=239799 Win=11903 Len=0"
"4.134515","5.9.29.183","172.19.0.3","TLSv1.2","1516","Application Data [TCP segment of a reassembled PDU]"
"4.134517","5.9.29.183","172.19.0.3","TCP","1468","9002 → 43520 [PSH, ACK] Seq=241259 Ack=13974 Win=65535 Len=1412 [TCP segment of a reassembled PDU]"
"4.134608","172.19.0.3","5.9.29.183","TCP","56","43520 → 9002 [ACK] Seq=13974 Ack=242671 Win=11887 Len=0"
"4.138622","5.9.29.183","172.19.0.3","TCP","1516","9002 → 43520 [PSH, ACK] Seq=242671 Ack=13974 Win=65535 Len=1460 [TCP segment of a reassembled PDU]"
"4.138729","5.9.29.183","172.19.0.3","TLSv1.2","1516","Application Data [TCP segment of a reassembled PDU]"
"4.138749","172.19.0.3","5.9.29.183","TCP","56","43520 → 9002 [ACK] Seq=13974 Ack=245591 Win=11903 Len=0"
"4.138754","5.9.29.183","172.19.0.3","TCP","1516","9002 → 43520 [PSH, ACK] Seq=245591 Ack=13974 Win=65535 Len=1460 [TCP segment of a reassembled PDU]"
"4.138759","5.9.29.183","172.19.0.3","TCP","1468","9002 → 43520 [PSH, ACK] Seq=247051 Ack=13974 Win=65535 Len=1412 [TCP segment of a reassembled PDU]"
"4.138905","5.9.29.183","172.19.0.3","TLSv1.2","1516","Application Data [TCP segment of a reassembled PDU]"
"4.138909","5.9.29.183","172.19.0.3","TCP","1516","9002 → 43520 [PSH, ACK] Seq=249923 Ack=13974 Win=65535 Len=1460 [TCP segment of a reassembled PDU]"
"4.138910","5.9.29.183","172.19.0.3","TCP","1516","9002 → 43520 [PSH, ACK] Seq=251383 Ack=13974 Win=65535 Len=1460 [TCP segment of a reassembled PDU]"
"4.138911","5.9.29.183","172.19.0.3","TLSv1.2","685","Application Data, Application Data"
"4.138918","172.19.0.3","5.9.29.183","TCP","56","43520 → 9002 [ACK] Seq=13974 Ack=248463 Win=11887 Len=0"
"4.139098","172.19.0.3","5.9.29.183","TCP","56","43520 → 9002 [ACK] Seq=13974 Ack=253472 Win=11855 Len=0"
"4.139334","172.19.0.3","5.9.29.183","TLSv1.2","599","Application Data"
"4.139520","5.9.29.183","172.19.0.3","TCP","56","9002 → 43520 [ACK] Seq=253472 Ack=14517 Win=65535 Len=0"
"4.141090","5.9.29.183","172.19.0.3","TCP","1504","[TCP segment of a reassembled PDU]"
"4.141679","5.9.29.183","172.19.0.3","TCP","1504","9002 → 43520 [PSH, ACK] Seq=254920 Ack=14517 Win=65535 Len=1448 [TCP segment of a reassembled PDU]"
"4.141691","172.19.0.3","5.9.29.183","TCP","56","43520 → 9002 [ACK] Seq=14517 Ack=256368 Win=11911 Len=0"
"4.141742","5.9.29.183","172.19.0.3","TLSv1.2","1516","Application Data [TCP segment of a reassembled PDU]"
"4.141809","5.9.29.183","172.19.0.3","TCP","1516","9002 → 43520 [PSH, ACK] Seq=257828 Ack=14517 Win=65535 Len=1460 [TCP segment of a reassembled PDU]"
"4.141813","5.9.29.183","172.19.0.3","TCP","1516","9002 → 43520 [PSH, ACK] Seq=259288 Ack=14517 Win=65535 Len=1460 [TCP segment of a reassembled PDU]"
"4.141815","5.9.29.183","172.19.0.3","TLSv1.2","1516","Application Data [TCP segment of a reassembled PDU]"
"4.141817","5.9.29.183","172.19.0.3","TCP","1456","9002 → 43520 [PSH, ACK] Seq=262208 Ack=14517 Win=65535 Len=1400 [TCP segment of a reassembled PDU]"
"4.141891","172.19.0.3","5.9.29.183","TCP","56","43520 → 9002 [ACK] Seq=14517 Ack=263608 Win=11869 Len=0"
"4.149132","172.19.0.3","5.9.29.183","TLSv1.2","599","Application Data"
"4.149502","5.9.29.183","172.19.0.3","TCP","56","9002 → 43520 [ACK] Seq=263608 Ack=15060 Win=65535 Len=0"
"4.154625","5.9.29.183","172.19.0.3","TCP","59","9002 → 43520 [PSH, ACK] Seq=263608 Ack=15060 Win=65535 Len=3 [TCP segment of a reassembled PDU]"
"4.154685","5.9.29.183","172.19.0.3","TLSv1.2","1312","Application Data"
"4.154703","5.9.29.183","172.19.0.3","TCP","1504","[TCP segment of a reassembled PDU]"
"4.154848","172.19.0.3","5.9.29.183","TCP","56","43520 → 9002 [ACK] Seq=15060 Ack=266315 Win=11901 Len=0"
"4.170569","5.9.29.183","172.19.0.3","TLSv1.2","1516","Application Data [TCP segment of a reassembled PDU]"
"4.170672","5.9.29.183","172.19.0.3","TCP","1516","9002 → 43520 [PSH, ACK] Seq=267775 Ack=15060 Win=65535 Len=1460 [TCP segment of a reassembled PDU]"
"4.170714","172.19.0.3","5.9.29.183","TCP","56","43520 → 9002 [ACK] Seq=15060 Ack=269235 Win=11903 Len=0"
"4.170720","5.9.29.183","172.19.0.3","TLSv1.2","886","Application Data"
"4.177199","172.19.0.3","5.9.29.183","TLSv1.2","599","Application Data"
"4.177520","5.9.29.183","172.19.0.3","TCP","56","9002 → 43520 [ACK] Seq=270065 Ack=15603 Win=65535 Len=0"
"4.498822","5.9.29.183","172.19.0.3","TLSv1.2","599","Application Data"
"4.499553","172.19.0.3","5.9.29.183","TLSv1.2","599","Application Data"
"4.499782","5.9.29.183","172.19.0.3","TCP","56","9002 → 43520 [ACK] Seq=270608 Ack=16146 Win=65535 Len=0"
"4.770422","5.9.29.183","172.19.0.3","TCP","1504","[TCP segment of a reassembled PDU]"
"4.770597","5.9.29.183","172.19.0.3","TLSv1.2","179","Application Data"
"4.770726","172.19.0.3","5.9.29.183","TCP","56","43520 → 9002 [ACK] Seq=16146 Ack=272179 Win=11903 Len=0"
"4.779178","172.19.0.3","5.9.29.183","TLSv1.2","599","Application Data"
"4.779547","5.9.29.183","172.19.0.3","TCP","56","9002 → 43520 [ACK] Seq=272179 Ack=16689 Win=65535 Len=0"
"5.101579","5.9.29.183","172.19.0.3","TLSv1.2","599","Application Data"
"5.102708","172.19.0.3","5.9.29.183","TLSv1.2","599","Application Data"
"5.103254","5.9.29.183","172.19.0.3","TCP","56","9002 → 43520 [ACK] Seq=272722 Ack=17232 Win=65535 Len=0"
"5.385014","5.9.29.183","172.19.0.3","TLSv1.2","599","Application Data"
"5.430035","172.19.0.3","5.9.29.183","TCP","56","43520 → 9002 [ACK] Seq=17232 Ack=273265 Win=11911 Len=0"
"5.462510","5.9.29.183","172.19.0.3","TCP","1516","[TCP segment of a reassembled PDU]"
"5.462528","172.19.0.3","5.9.29.183","TCP","56","43520 → 9002 [ACK] Seq=17232 Ack=274725 Win=11911 Len=0"
"5.462560","5.9.29.183","172.19.0.3","TLSv1.2","1195","Application Data"
"5.462571","172.19.0.3","5.9.29.183","TCP","56","43520 → 9002 [ACK] Seq=17232 Ack=275864 Win=11903 Len=0"
"5.466230","172.19.0.3","5.9.29.183","TLSv1.2","599","Application Data"
"5.466486","5.9.29.183","172.19.0.3","TCP","56","9002 → 43520 [ACK] Seq=275864 Ack=17775 Win=65535 Len=0"
"5.738190","5.9.29.183","172.19.0.3","TLSv1.2","599","Application Data"
"5.739999","172.19.0.3","5.9.29.183","TLSv1.2","599","Application Data"
"5.740789","5.9.29.183","172.19.0.3","TCP","56","9002 → 43520 [ACK] Seq=276407 Ack=18318 Win=65535 Len=0"
"6.013205","5.9.29.183","172.19.0.3","TCP","1516","[TCP segment of a reassembled PDU]"
"6.013308","5.9.29.183","172.19.0.3","TCP","1492","9002 → 43520 [PSH, ACK] Seq=277867 Ack=18318 Win=65535 Len=1436 [TCP segment of a reassembled PDU]"
"6.013355","5.9.29.183","172.19.0.3","TLSv1.2","787","Application Data"
"6.013477","172.19.0.3","5.9.29.183","TCP","56","43520 → 9002 [ACK] Seq=18318 Ack=280034 Win=11893 Len=0"
"6.038906","5.9.29.183","172.19.0.3","TCP","1504","[TCP segment of a reassembled PDU]"
"6.039212","5.9.29.183","172.19.0.3","TLSv1.2","1207","Application Data"
"6.039225","172.19.0.3","5.9.29.183","TCP","56","43520 → 9002 [ACK] Seq=18318 Ack=282633 Win=11911 Len=0"
"6.043006","172.19.0.3","5.9.29.183","TLSv1.2","599","Application Data"
"6.043294","5.9.29.183","172.19.0.3","TCP","56","9002 → 43520 [ACK] Seq=282633 Ack=18861 Win=65535 Len=0"
"6.273492","5.9.29.183","172.19.0.3","TLSv1.2","599","Application Data"
"6.274190","172.19.0.3","5.9.29.183","TLSv1.2","599","Application Data"
"6.274391","5.9.29.183","172.19.0.3","TCP","56","9002 → 43520 [ACK] Seq=283176 Ack=19404 Win=65535 Len=0"
"6.551937","5.9.29.183","172.19.0.3","TCP","1504","[TCP segment of a reassembled PDU]"
"6.552777","5.9.29.183","172.19.0.3","TCP","1516","9002 → 43520 [PSH, ACK] Seq=284624 Ack=19404 Win=65535 Len=1460 [TCP segment of a reassembled PDU]"
"6.552823","172.19.0.3","5.9.29.183","TCP","56","43520 → 9002 [ACK] Seq=19404 Ack=286084 Win=11911 Len=0"
"6.552923","5.9.29.183","172.19.0.3","TLSv1.2","1516","Application Data [TCP segment of a reassembled PDU]"
"6.553070","5.9.29.183","172.19.0.3","TCP","1516","9002 → 43520 [PSH, ACK] Seq=287544 Ack=19404 Win=65535 Len=1460 [TCP segment of a reassembled PDU]"
"6.553080","5.9.29.183","172.19.0.3","TCP","1201","9002 → 43520 [PSH, ACK] Seq=289004 Ack=19404 Win=65535 Len=1145 [TCP segment of a reassembled PDU]"
"6.553280","172.19.0.3","5.9.29.183","TCP","56","43520 → 9002 [ACK] Seq=19404 Ack=290149 Win=11887 Len=0"
"6.570758","5.9.29.183","172.19.0.3","TLSv1.2","337","Application Data"
"6.587938","5.9.29.183","172.19.0.3","TLSv1.2","1113","Application Data"
"6.588202","172.19.0.3","5.9.29.183","TCP","56","43520 → 9002 [ACK] Seq=19404 Ack=291487 Win=11911 Len=0"
"6.610678","5.9.29.183","172.19.0.3","TCP","1516","[TCP segment of a reassembled PDU]"
"6.610963","5.9.29.183","172.19.0.3","TCP","1516","9002 → 43520 [PSH, ACK] Seq=292947 Ack=19404 Win=65535 Len=1460 [TCP segment of a reassembled PDU]"
"6.610990","5.9.29.183","172.19.0.3","TLSv1.2","1213","Application Data"
"6.611982","172.19.0.3","5.9.29.183","TCP","56","43520 → 9002 [ACK] Seq=19404 Ack=295564 Win=11895 Len=0"
"6.632540","5.9.29.183","172.19.0.3","TLSv1.2","149","Application Data"
"6.634572","5.9.29.183","172.19.0.3","TCP","1516","[TCP segment of a reassembled PDU]"
"6.634593","172.19.0.3","5.9.29.183","TCP","56","43520 → 9002 [ACK] Seq=19404 Ack=297117 Win=11911 Len=0"
"6.634630","5.9.29.183","172.19.0.3","TCP","1492","9002 → 43520 [PSH, ACK] Seq=297117 Ack=19404 Win=65535 Len=1436 [TCP segment of a reassembled PDU]"
"6.647620","5.9.29.183","172.19.0.3","TLSv1.2","787","Application Data"
"6.647644","172.19.0.3","5.9.29.183","TCP","56","43520 → 9002 [ACK] Seq=19404 Ack=299284 Win=11911 Len=0"
"6.653076","172.19.0.3","5.9.29.183","TLSv1.2","599","Application Data"
"6.653389","5.9.29.183","172.19.0.3","TCP","56","9002 → 43520 [ACK] Seq=299284 Ack=19947 Win=65535 Len=0"
"6.922345","5.9.29.183","172.19.0.3","TLSv1.2","599","Application Data"
"6.923074","172.19.0.3","5.9.29.183","TLSv1.2","599","Application Data"
"6.923439","5.9.29.183","172.19.0.3","TCP","56","9002 → 43520 [ACK] Seq=299827 Ack=20490 Win=65535 Len=0"
"7.203296","5.9.29.183","172.19.0.3","TCP","1504","[TCP segment of a reassembled PDU]"
"7.203416","5.9.29.183","172.19.0.3","TCP","1516","9002 → 43520 [PSH, ACK] Seq=301275 Ack=20490 Win=65535 Len=1460 [TCP segment of a reassembled PDU]"
"7.203437","5.9.29.183","172.19.0.3","TLSv1.2","1516","Application Data [TCP segment of a reassembled PDU]"
"7.203710","172.19.0.3","5.9.29.183","TCP","56","43520 → 9002 [ACK] Seq=20490 Ack=304195 Win=11895 Len=0"
"7.203991","5.9.29.183","172.19.0.3","TCP","1516","9002 → 43520 [PSH, ACK] Seq=304195 Ack=20490 Win=65535 Len=1460 [TCP segment of a reassembled PDU]"
"7.204053","5.9.29.183","172.19.0.3","TCP","1201","9002 → 43520 [PSH, ACK] Seq=305655 Ack=20490 Win=65535 Len=1145 [TCP segment of a reassembled PDU]"
"7.204343","172.19.0.3","5.9.29.183","TCP","56","43520 → 9002 [ACK] Seq=20490 Ack=306800 Win=11879 Len=0"
"7.219007","5.9.29.183","172.19.0.3","TLSv1.2","851","Application Data"
"7.219660","172.19.0.3","5.9.29.183","TLSv1.2","599","Application Data"
"7.220520","5.9.29.183","172.19.0.3","TCP","56","9002 → 43520 [ACK] Seq=307595 Ack=21033 Win=65535 Len=0"
"7.236880","5.9.29.183","172.19.0.3","TCP","1504","[TCP segment of a reassembled PDU]"
"7.237153","5.9.29.183","172.19.0.3","TCP","1516","9002 → 43520 [PSH, ACK] Seq=309043 Ack=21033 Win=65535 Len=1460 [TCP segment of a reassembled PDU]"
"7.237175","5.9.29.183","172.19.0.3","TLSv1.2","1516","Application Data [TCP segment of a reassembled PDU]"
"7.237182","5.9.29.183","172.19.0.3","TCP","1516","9002 → 43520 [PSH, ACK] Seq=311963 Ack=21033 Win=65535 Len=1460 [TCP segment of a reassembled PDU]"
"7.237189","5.9.29.183","172.19.0.3","TCP","1516","9002 → 43520 [PSH, ACK] Seq=313423 Ack=21033 Win=65535 Len=1460 [TCP segment of a reassembled PDU]"
"7.237196","5.9.29.183","172.19.0.3","TLSv1.2","1516","Application Data [TCP segment of a reassembled PDU]"
"7.237515","172.19.0.3","5.9.29.183","TCP","56","43520 → 9002 [ACK] Seq=21033 Ack=316343 Win=11871 Len=0"
"7.237523","5.9.29.183","172.19.0.3","TCP","1516","9002 → 43520 [PSH, ACK] Seq=316343 Ack=21033 Win=65535 Len=1460 [TCP segment of a reassembled PDU]"
"7.237536","5.9.29.183","172.19.0.3","TCP","1516","9002 → 43520 [PSH, ACK] Seq=317803 Ack=21033 Win=65535 Len=1460 [TCP segment of a reassembled PDU]"
"7.237540","5.9.29.183","172.19.0.3","TLSv1.2","1420","Application Data [TCP segment of a reassembled PDU]"
"7.237656","172.19.0.3","5.9.29.183","TCP","56","43520 → 9002 [ACK] Seq=21033 Ack=320627 Win=11847 Len=0"
"7.238254","5.9.29.183","172.19.0.3","TCP","1516","9002 → 43520 [PSH, ACK] Seq=320627 Ack=21033 Win=65535 Len=1460 [TCP segment of a reassembled PDU]"
"7.238285","5.9.29.183","172.19.0.3","TCP","1492","9002 → 43520 [PSH, ACK] Seq=322087 Ack=21033 Win=65535 Len=1436 [TCP segment of a reassembled PDU]"
"7.238422","172.19.0.3","5.9.29.183","TCP","56","43520 → 9002 [ACK] Seq=21033 Ack=323523 Win=11830 Len=0"
"7.250505","5.9.29.183","172.19.0.3","TLSv1.2","178","Application Data"
"7.265082","5.9.29.183","172.19.0.3","TCP","1516","[TCP segment of a reassembled PDU]"
"7.265164","172.19.0.3","5.9.29.183","TCP","56","43520 → 9002 [ACK] Seq=21033 Ack=325105 Win=11909 Len=0"
"7.265244","5.9.29.183","172.19.0.3","TCP","1516","9002 → 43520 [PSH, ACK] Seq=325105 Ack=21033 Win=65535 Len=1460 [TCP segment of a reassembled PDU]"
"7.265309","5.9.29.183","172.19.0.3","TLSv1.2","1480","Application Data [TCP segment of a reassembled PDU]"
"7.265514","172.19.0.3","5.9.29.183","TCP","56","43520 → 9002 [ACK] Seq=21033 Ack=327989 Win=11893 Len=0"
"7.266590","172.19.0.3","5.9.29.183","TLSv1.2","599","Application Data"
"7.268365","5.9.29.183","172.19.0.3","TCP","1214","9002 → 43520 [PSH, ACK] Seq=327989 Ack=21033 Win=65535 Len=1158 [TCP segment of a reassembled PDU]"
"7.268471","5.9.29.183","172.19.0.3","TLSv1.2","266","Application Data"
"7.268499","5.9.29.183","172.19.0.3","TCP","56","9002 → 43520 [ACK] Seq=329357 Ack=21576 Win=65535 Len=0"
"7.268767","172.19.0.3","5.9.29.183","TCP","56","43520 → 9002 [ACK] Seq=21576 Ack=329357 Win=11911 Len=0"
"7.279879","172.19.0.3","5.9.29.183","TLSv1.2","599","Application Data"
"7.282585","5.9.29.183","172.19.0.3","TCP","56","9002 → 43520 [ACK] Seq=329357 Ack=22119 Win=65535 Len=0"
"7.641221","5.9.29.183","172.19.0.3","TLSv1.2","599","Application Data"
"7.642065","172.19.0.3","5.9.29.183","TLSv1.2","599","Application Data"
"7.642299","5.9.29.183","172.19.0.3","TCP","56","9002 → 43520 [ACK] Seq=329900 Ack=22662 Win=65535 Len=0"
"7.895205","5.9.29.183","172.19.0.3","TCP","1504","[TCP segment of a reassembled PDU]"
"7.895325","5.9.29.183","172.19.0.3","TCP","1504","9002 → 43520 [PSH, ACK] Seq=331348 Ack=22662 Win=65535 Len=1448 [TCP segment of a reassembled PDU]"
"7.895331","5.9.29.183","172.19.0.3","TLSv1.2","787","Application Data"
"7.895401","172.19.0.3","5.9.29.183","TCP","56","43520 → 9002 [ACK] Seq=22662 Ack=333527 Win=11895 Len=0"
"7.911195","5.9.29.183","172.19.0.3","TCP","1504","[TCP segment of a reassembled PDU]"
"7.911265","5.9.29.183","172.19.0.3","TCP","1504","9002 → 43520 [PSH, ACK] Seq=334975 Ack=22662 Win=65535 Len=1448 [TCP segment of a reassembled PDU]"
"7.911284","172.19.0.3","5.9.29.183","TCP","56","43520 → 9002 [ACK] Seq=22662 Ack=336423 Win=11903 Len=0"
"7.912257","5.9.29.183","172.19.0.3","TLSv1.2","1330","Application Data, Application Data"
"7.921158","5.9.29.183","172.19.0.3","TCP","1504","[TCP segment of a reassembled PDU]"
"7.921180","172.19.0.3","5.9.29.183","TCP","56","43520 → 9002 [ACK] Seq=22662 Ack=339145 Win=11911 Len=0"
"7.921215","5.9.29.183","172.19.0.3","TCP","1516","9002 → 43520 [PSH, ACK] Seq=339145 Ack=22662 Win=65535 Len=1460 [TCP segment of a reassembled PDU]"
"7.921225","5.9.29.183","172.19.0.3","TLSv1.2","1516","Application Data [TCP segment of a reassembled PDU]"
"7.921230","5.9.29.183","172.19.0.3","TCP","1480","9002 → 43520 [PSH, ACK] Seq=342065 Ack=22662 Win=65535 Len=1424 [TCP segment of a reassembled PDU]"
"7.921307","5.9.29.183","172.19.0.3","TLSv1.2","1516","Application Data [TCP segment of a reassembled PDU]"
"7.921314","5.9.29.183","172.19.0.3","TCP","1492","9002 → 43520 [PSH, ACK] Seq=344949 Ack=22662 Win=65535 Len=1436 [TCP segment of a reassembled PDU]"
"7.921351","172.19.0.3","5.9.29.183","TCP","56","43520 → 9002 [ACK] Seq=22662 Ack=346385 Win=11871 Len=0"
"7.924105","5.9.29.183","172.19.0.3","TCP","1504","9002 → 43520 [PSH, ACK] Seq=346385 Ack=22662 Win=65535 Len=1448 [TCP segment of a reassembled PDU]"
"7.926507","5.9.29.183","172.19.0.3","TLSv1.2","1516","Application Data, Application Data"
"7.926521","172.19.0.3","5.9.29.183","TCP","56","43520 → 9002 [ACK] Seq=22662 Ack=349293 Win=11911 Len=0"
"7.926550","5.9.29.183","172.19.0.3","TCP","1516","9002 → 43520 [PSH, ACK] Seq=349293 Ack=22662 Win=65535 Len=1460 [TCP segment of a reassembled PDU]"
"7.926625","5.9.29.183","172.19.0.3","TCP","1480","9002 → 43520 [PSH, ACK] Seq=350753 Ack=22662 Win=65535 Len=1424 [TCP segment of a reassembled PDU]"
"7.926676","5.9.29.183","172.19.0.3","TLSv1.2","1504","Application Data [TCP segment of a reassembled PDU]"
"7.926767","172.19.0.3","5.9.29.183","TCP","56","43520 → 9002 [ACK] Seq=22662 Ack=353625 Win=11887 Len=0"
"7.927353","5.9.29.183","172.19.0.3","TLSv1.2","1504","Application Data [TCP segment of a reassembled PDU]"
"7.927382","5.9.29.183","172.19.0.3","TCP","1504","9002 → 43520 [PSH, ACK] Seq=355073 Ack=22662 Win=65535 Len=1448 [TCP segment of a reassembled PDU]"
"7.927389","172.19.0.3","5.9.29.183","TCP","56","43520 → 9002 [ACK] Seq=22662 Ack=356521 Win=11901 Len=0"
"7.936424","5.9.29.183","172.19.0.3","TLSv1.2","453","Application Data"
"7.936813","172.19.0.3","5.9.29.183","TLSv1.2","1113","Application Data"
"7.937184","5.9.29.183","172.19.0.3","TCP","56","9002 → 43520 [ACK] Seq=356918 Ack=23719 Win=65535 Len=0"
"7.939272","5.9.29.183","172.19.0.3","TCP","1504","[TCP segment of a reassembled PDU]"
"7.939327","5.9.29.183","172.19.0.3","TCP","1504","9002 → 43520 [PSH, ACK] Seq=358366 Ack=23719 Win=65535 Len=1448 [TCP segment of a reassembled PDU]"
"7.939433","172.19.0.3","5.9.29.183","TCP","56","43520 → 9002 [ACK] Seq=23719 Ack=359814 Win=11903 Len=0"
"7.951001","5.9.29.183","172.19.0.3","TLSv1.2","1504","Application Data [TCP segment of a reassembled PDU]"
"7.951047","5.9.29.183","172.19.0.3","TCP","1516","9002 → 43520 [PSH, ACK] Seq=361262 Ack=23719 Win=65535 Len=1460 [TCP segment of a reassembled PDU]"
"7.951058","172.19.0.3","5.9.29.183","TCP","56","43520 → 9002 [ACK] Seq=23719 Ack=362722 Win=11903 Len=0"
"7.951060","5.9.29.183","172.19.0.3","TCP","1516","9002 → 43520 [PSH, ACK] Seq=362722 Ack=23719 Win=65535 Len=1460 [TCP segment of a reassembled PDU]"
"7.951063","5.9.29.183","172.19.0.3","TLSv1.2","1480","Application Data [TCP segment of a reassembled PDU]"
"7.951065","5.9.29.183","172.19.0.3","TCP","1504","9002 → 43520 [PSH, ACK] Seq=365606 Ack=23719 Win=65535 Len=1448 [TCP segment of a reassembled PDU]"
"7.951172","172.19.0.3","5.9.29.183","TCP","56","43520 → 9002 [ACK] Seq=23719 Ack=367054 Win=11879 Len=0"
"7.951350","5.9.29.183","172.19.0.3","TCP","1504","9002 → 43520 [PSH, ACK] Seq=367054 Ack=23719 Win=65535 Len=1448 [TCP segment of a reassembled PDU]"
"7.951429","5.9.29.183","172.19.0.3","TLSv1.2","1516","Application Data [TCP segment of a reassembled PDU]"
"7.951436","5.9.29.183","172.19.0.3","TCP","1516","9002 → 43520 [PSH, ACK] Seq=369962 Ack=23719 Win=65535 Len=1460 [TCP segment of a reassembled PDU]"
"7.951443","5.9.29.183","172.19.0.3","TLSv1.2","1516","Application Data [TCP segment of a reassembled PDU]"
"7.951481","172.19.0.3","5.9.29.183","TCP","56","43520 → 9002 [ACK] Seq=23719 Ack=372882 Win=11847 Len=0"
"7.951504","5.9.29.183","172.19.0.3","TCP","1516","9002 → 43520 [PSH, ACK] Seq=372882 Ack=23719 Win=65535 Len=1460 [TCP segment of a reassembled PDU]"
"7.951509","5.9.29.183","172.19.0.3","TCP","1516","9002 → 43520 [PSH, ACK] Seq=374342 Ack=23719 Win=65535 Len=1460 [TCP segment of a reassembled PDU]"
"7.951511","5.9.29.183","172.19.0.3","TLSv1.2","1392","Application Data, Application Data"
"7.951523","172.19.0.3","5.9.29.183","TCP","56","43520 → 9002 [ACK] Seq=23719 Ack=377138 Win=11822 Len=0"
"7.953573","172.19.0.3","5.9.29.183","TLSv1.2","599","Application Data"
"7.953849","5.9.29.183","172.19.0.3","TCP","56","9002 → 43520 [ACK] Seq=377138 Ack=24262 Win=65535 Len=0"
"7.962167","172.19.0.3","5.9.29.183","TLSv1.2","599","Application Data"
"7.962516","5.9.29.183","172.19.0.3","TCP","56","9002 → 43520 [ACK] Seq=377138 Ack=24805 Win=65535 Len=0"
"7.967292","5.9.29.183","172.19.0.3","TLSv1.2","599","Application Data"
"8.008540","172.19.0.3","5.9.29.183","TCP","56","43520 → 9002 [ACK] Seq=24805 Ack=377681 Win=11911 Len=0"
"8.284035","5.9.29.183","172.19.0.3","TLSv1.2","599","Application Data"
"8.284109","172.19.0.3","5.9.29.183","TCP","56","43520 → 9002 [ACK] Seq=24805 Ack=378224 Win=11911 Len=0"
"8.284655","172.19.0.3","5.9.29.183","TLSv1.2","599","Application Data"
"8.284865","5.9.29.183","172.19.0.3","TCP","56","9002 → 43520 [ACK] Seq=378224 Ack=25348 Win=65535 Len=0"
"8.553340","5.9.29.183","172.19.0.3","TCP","1516","[TCP segment of a reassembled PDU]"
"8.553465","5.9.29.183","172.19.0.3","TCP","1516","9002 → 43520 [PSH, ACK] Seq=379684 Ack=25348 Win=65535 Len=1460 [TCP segment of a reassembled PDU]"
"8.553483","5.9.29.183","172.19.0.3","TLSv1.2","1213","Application Data"
"8.553489","5.9.29.183","172.19.0.3","TCP","1516","[TCP segment of a reassembled PDU]"
"8.553493","5.9.29.183","172.19.0.3","TCP","1516","9002 → 43520 [PSH, ACK] Seq=383761 Ack=25348 Win=65535 Len=1460 [TCP segment of a reassembled PDU]"
"8.553496","5.9.29.183","172.19.0.3","TLSv1.2","1516","Application Data [TCP segment of a reassembled PDU]"
"8.553500","5.9.29.183","172.19.0.3","TCP","1516","9002 → 43520 [PSH, ACK] Seq=386681 Ack=25348 Win=65535 Len=1460 [TCP segment of a reassembled PDU]"
"8.553503","5.9.29.183","172.19.0.3","TCP","1456","9002 → 43520 [PSH, ACK] Seq=388141 Ack=25348 Win=65535 Len=1400 [TCP segment of a reassembled PDU]"
"8.553611","172.19.0.3","5.9.29.183","TCP","56","43520 → 9002 [ACK] Seq=25348 Ack=389541 Win=11855 Len=0"
"8.568458","5.9.29.183","172.19.0.3","TLSv1.2","648","Application Data"
"8.578407","5.9.29.183","172.19.0.3","TCP","1516","[TCP segment of a reassembled PDU]"
"8.578424","172.19.0.3","5.9.29.183","TCP","56","43520 → 9002 [ACK] Seq=25348 Ack=391593 Win=11911 Len=0"
"8.578459","5.9.29.183","172.19.0.3","TCP","1516","9002 → 43520 [PSH, ACK] Seq=391593 Ack=25348 Win=65535 Len=1460 [TCP segment of a reassembled PDU]"
"8.578467","5.9.29.183","172.19.0.3","TLSv1.2","1516","Application Data [TCP segment of a reassembled PDU]"
"8.578469","5.9.29.183","172.19.0.3","TCP","226","9002 → 43520 [PSH, ACK] Seq=394513 Ack=25348 Win=65535 Len=170 [TCP segment of a reassembled PDU]"
"8.578472","5.9.29.183","172.19.0.3","TCP","1516","9002 → 43520 [PSH, ACK] Seq=394683 Ack=25348 Win=65535 Len=1460 [TCP segment of a reassembled PDU]"
"8.578474","5.9.29.183","172.19.0.3","TCP","1516","9002 → 43520 [PSH, ACK] Seq=396143 Ack=25348 Win=65535 Len=1460 [TCP segment of a reassembled PDU]"
"8.578476","5.9.29.183","172.19.0.3","TLSv1.2","1516","Application Data [TCP segment of a reassembled PDU]"
"8.578543","5.9.29.183","172.19.0.3","TCP","1516","9002 → 43520 [PSH, ACK] Seq=399063 Ack=25348 Win=65535 Len=1460 [TCP segment of a reassembled PDU]"
"8.578548","5.9.29.183","172.19.0.3","TCP","1516","9002 → 43520 [PSH, ACK] Seq=400523 Ack=25348 Win=65535 Len=1460 [TCP segment of a reassembled PDU]"
"8.578550","5.9.29.183","172.19.0.3","TLSv1.2","1516","Application Data [TCP segment of a reassembled PDU]"
"8.578554","5.9.29.183","172.19.0.3","TCP","1516","9002 → 43520 [PSH, ACK] Seq=403443 Ack=25348 Win=65535 Len=1460 [TCP segment of a reassembled PDU]"
"8.578556","5.9.29.183","172.19.0.3","TCP","1214","9002 → 43520 [PSH, ACK] Seq=404903 Ack=25348 Win=65535 Len=1158 [TCP segment of a reassembled PDU]"
"8.578598","172.19.0.3","5.9.29.183","TCP","56","43520 → 9002 [ACK] Seq=25348 Ack=406061 Win=11820 Len=0"
"8.582225","5.9.29.183","172.19.0.3","TLSv1.2","1504","Application Data, Application Data"
"8.582292","5.9.29.183","172.19.0.3","TCP","1504","9002 → 43520 [PSH, ACK] Seq=407509 Ack=25348 Win=65535 Len=1448 [TCP segment of a reassembled PDU]"
"8.582312","172.19.0.3","5.9.29.183","TCP","56","43520 → 9002 [ACK] Seq=25348 Ack=408957 Win=11903 Len=0"
"8.582723","172.19.0.3","5.9.29.183","TLSv1.2","599","Application Data"
"8.583071","5.9.29.183","172.19.0.3","TCP","56","9002 → 43520 [ACK] Seq=408957 Ack=25891 Win=65535 Len=0"
"8.583316","5.9.29.183","172.19.0.3","TLSv1.2","424","Application Data"
"8.588385","5.9.29.183","172.19.0.3","TCP","1504","[TCP segment of a reassembled PDU]"
"8.588398","172.19.0.3","5.9.29.183","TCP","56","43520 → 9002 [ACK] Seq=25891 Ack=410773 Win=11911 Len=0"
"8.588431","5.9.29.183","172.19.0.3","TCP","1504","9002 → 43520 [PSH, ACK] Seq=410773 Ack=25891 Win=65535 Len=1448 [TCP segment of a reassembled PDU]"
"8.594706","5.9.29.183","172.19.0.3","TLSv1.2","1516","Application Data [TCP segment of a reassembled PDU]"
"8.594755","172.19.0.3","5.9.29.183","TCP","56","43520 → 9002 [ACK] Seq=25891 Ack=413681 Win=11911 Len=0"
"8.594843","5.9.29.183","172.19.0.3","TCP","1516","9002 → 43520 [PSH, ACK] Seq=413681 Ack=25891 Win=65535 Len=1460 [TCP segment of a reassembled PDU]"
"8.594857","5.9.29.183","172.19.0.3","TCP","1516","9002 → 43520 [PSH, ACK] Seq=415141 Ack=25891 Win=65535 Len=1460 [TCP segment of a reassembled PDU]"
"8.594863","5.9.29.183","172.19.0.3","TLSv1.2","1516","Application Data [TCP segment of a reassembled PDU]"
"8.594867","5.9.29.183","172.19.0.3","TCP","1516","9002 → 43520 [PSH, ACK] Seq=418061 Ack=25891 Win=65535 Len=1460 [TCP segment of a reassembled PDU]"
"8.594938","5.9.29.183","172.19.0.3","TCP","1444","9002 → 43520 [PSH, ACK] Seq=419521 Ack=25891 Win=65535 Len=1388 [TCP segment of a reassembled PDU]"
"8.595122","172.19.0.3","5.9.29.183","TCP","56","43520 → 9002 [ACK] Seq=25891 Ack=420909 Win=11871 Len=0"
"8.595397","172.19.0.3","5.9.29.183","TLSv1.2","599","Application Data"
"8.595714","5.9.29.183","172.19.0.3","TCP","56","9002 → 43520 [ACK] Seq=420909 Ack=26434 Win=65535 Len=0"
"8.598687","5.9.29.183","172.19.0.3","TLSv1.2","381","Application Data"
"8.617434","5.9.29.183","172.19.0.3","TCP","1516","[TCP segment of a reassembled PDU]"
"8.617452","172.19.0.3","5.9.29.183","TCP","56","43520 → 9002 [ACK] Seq=26434 Ack=422694 Win=11911 Len=0"
"8.617485","5.9.29.183","172.19.0.3","TCP","1492","9002 → 43520 [PSH, ACK] Seq=422694 Ack=26434 Win=65535 Len=1436 [TCP segment of a reassembled PDU]"
"8.617512","5.9.29.183","172.19.0.3","TLSv1.2","1237","Application Data"
"8.617653","172.19.0.3","5.9.29.183","TCP","56","43520 → 9002 [ACK] Seq=26434 Ack=425311 Win=11895 Len=0"
"8.617728","5.9.29.183","172.19.0.3","TCP","1504","[TCP segment of a reassembled PDU]"
"8.617782","5.9.29.183","172.19.0.3","TCP","1516","9002 → 43520 [PSH, ACK] Seq=426759 Ack=26434 Win=65535 Len=1460 [TCP segment of a reassembled PDU]"
"8.617789","172.19.0.3","5.9.29.183","TCP","56","43520 → 9002 [ACK] Seq=26434 Ack=428219 Win=11903 Len=0"
"8.617857","5.9.29.183","172.19.0.3","TLSv1.2","1492","Application Data [TCP segment of a reassembled PDU]"
"8.617862","5.9.29.183","172.19.0.3","TCP","1516","9002 → 43520 [PSH, ACK] Seq=429655 Ack=26434 Win=65535 Len=1460 [TCP segment of a reassembled PDU]"
"8.617933","5.9.29.183","172.19.0.3","TCP","1516","9002 → 43520 [PSH, ACK] Seq=431115 Ack=26434 Win=65535 Len=1460 [TCP segment of a reassembled PDU]"
"8.617936","5.9.29.183","172.19.0.3","TLSv1.2","1516","Application Data [TCP segment of a reassembled PDU]"
"8.617937","5.9.29.183","172.19.0.3","TCP","1516","9002 → 43520 [PSH, ACK] Seq=434035 Ack=26434 Win=65535 Len=1460 [TCP segment of a reassembled PDU]"
"8.617949","172.19.0.3","5.9.29.183","TCP","56","43520 → 9002 [ACK] Seq=26434 Ack=431115 Win=11885 Len=0"
"8.617970","5.9.29.183","172.19.0.3","TCP","1456","9002 → 43520 [PSH, ACK] Seq=435495 Ack=26434 Win=65535 Len=1400 [TCP segment of a reassembled PDU]"
"8.617991","172.19.0.3","5.9.29.183","TCP","56","43520 → 9002 [ACK] Seq=26434 Ack=436895 Win=11853 Len=0"
"8.618285","172.19.0.3","5.9.29.183","TLSv1.2","599","Application Data"
"8.618452","5.9.29.183","172.19.0.3","TCP","56","9002 → 43520 [ACK] Seq=436895 Ack=26977 Win=65535 Len=0"
"8.621844","5.9.29.183","172.19.0.3","TLSv1.2","1504","Application Data, Application Data"
"8.633303","5.9.29.183","172.19.0.3","TLSv1.2","83","Application Data"
"8.633328","172.19.0.3","5.9.29.183","TCP","56","43520 → 9002 [ACK] Seq=26977 Ack=438370 Win=11911 Len=0"
"8.643143","5.9.29.183","172.19.0.3","TCP","1504","[TCP segment of a reassembled PDU]"
"8.643193","5.9.29.183","172.19.0.3","TCP","1504","9002 → 43520 [PSH, ACK] Seq=439818 Ack=26977 Win=65535 Len=1448 [TCP segment of a reassembled PDU]"
"8.643266","5.9.29.183","172.19.0.3","TLSv1.2","1516","Application Data [TCP segment of a reassembled PDU]"
"8.643271","5.9.29.183","172.19.0.3","TCP","1492","9002 → 43520 [PSH, ACK] Seq=442726 Ack=26977 Win=65535 Len=1436 [TCP segment of a reassembled PDU]"
"8.643343","172.19.0.3","5.9.29.183","TCP","56","43520 → 9002 [ACK] Seq=26977 Ack=444162 Win=11887 Len=0"
"8.646327","5.9.29.183","172.19.0.3","TLSv1.2","1504","Application Data [TCP segment of a reassembled PDU]"
"8.648872","5.9.29.183","172.19.0.3","TLSv1.2","613","Application Data"
"8.648937","172.19.0.3","5.9.29.183","TCP","56","43520 → 9002 [ACK] Seq=26977 Ack=446167 Win=11911 Len=0"
"8.660068","5.9.29.183","172.19.0.3","TCP","1516","[TCP segment of a reassembled PDU]"
"8.660134","5.9.29.183","172.19.0.3","TCP","1492","9002 → 43520 [PSH, ACK] Seq=447627 Ack=26977 Win=65535 Len=1436 [TCP segment of a reassembled PDU]"
"8.660286","172.19.0.3","5.9.29.183","TCP","56","43520 → 9002 [ACK] Seq=26977 Ack=449063 Win=11903 Len=0"
"8.664249","5.9.29.183","172.19.0.3","TLSv1.2","787","Application Data"
"8.671768","5.9.29.183","172.19.0.3","TCP","1516","[TCP segment of a reassembled PDU]"
"8.671826","172.19.0.3","5.9.29.183","TCP","56","43520 → 9002 [ACK] Seq=26977 Ack=451254 Win=11911 Len=0"
"8.671904","5.9.29.183","172.19.0.3","TCP","1516","9002 → 43520 [PSH, ACK] Seq=451254 Ack=26977 Win=65535 Len=1460 [TCP segment of a reassembled PDU]"
"8.671955","5.9.29.183","172.19.0.3","TLSv1.2","1480","Application Data [TCP segment of a reassembled PDU]"
"8.672871","172.19.0.3","5.9.29.183","TCP","56","43520 → 9002 [ACK] Seq=26977 Ack=454138 Win=11895 Len=0"
"8.679376","5.9.29.183","172.19.0.3","TLSv1.2","396","Application Data"
"8.686062","172.19.0.3","5.9.29.183","TLSv1.2","599","Application Data"
"8.686663","5.9.29.183","172.19.0.3","TCP","56","9002 → 43520 [ACK] Seq=454478 Ack=27520 Win=65535 Len=0"
"8.948812","5.9.29.183","172.19.0.3","TLSv1.2","599","Application Data"
"8.949464","172.19.0.3","5.9.29.183","TLSv1.2","599","Application Data"
"8.949661","5.9.29.183","172.19.0.3","TCP","56","9002 → 43520 [ACK] Seq=455021 Ack=28063 Win=65535 Len=0"
"9.186044","5.9.29.183","172.19.0.3","TCP","1504","[TCP segment of a reassembled PDU]"
"9.186116","5.9.29.183","172.19.0.3","TCP","1516","9002 → 43520 [PSH, ACK] Seq=456469 Ack=28063 Win=65535 Len=1460 [TCP segment of a reassembled PDU]"
"9.186126","5.9.29.183","172.19.0.3","TLSv1.2","775","Application Data"
"9.186236","172.19.0.3","5.9.29.183","TCP","56","43520 → 9002 [ACK] Seq=28063 Ack=458648 Win=11895 Len=0"
"9.213716","5.9.29.183","172.19.0.3","TCP","1504","[TCP segment of a reassembled PDU]"
"9.213962","5.9.29.183","172.19.0.3","TCP","179","9002 → 43520 [PSH, ACK] Seq=460096 Ack=28063 Win=65535 Len=123 [TCP segment of a reassembled PDU]"
"9.213995","172.19.0.3","5.9.29.183","TCP","56","43520 → 9002 [ACK] Seq=28063 Ack=460219 Win=11911 Len=0"
"9.214024","5.9.29.183","172.19.0.3","TCP","1516","9002 → 43520 [PSH, ACK] Seq=460219 Ack=28063 Win=65535 Len=1460 [TCP segment of a reassembled PDU]"
"9.214075","5.9.29.183","172.19.0.3","TLSv1.2","1102","Application Data"
"9.214087","172.19.0.3","5.9.29.183","TCP","56","43520 → 9002 [ACK] Seq=28063 Ack=462725 Win=11911 Len=0"
"9.236912","5.9.29.183","172.19.0.3","TLSv1.2","1177","Application Data"
"9.237643","172.19.0.3","5.9.29.183","TLSv1.2","599","Application Data"
"9.238325","5.9.29.183","172.19.0.3","TCP","56","9002 → 43520 [ACK] Seq=463846 Ack=28606 Win=65535 Len=0"
"9.247779","172.19.0.3","5.9.29.183","TLSv1.2","599","Application Data"
"9.248170","5.9.29.183","172.19.0.3","TCP","56","9002 → 43520 [ACK] Seq=463846 Ack=29149 Win=65535 Len=0"
"9.544569","5.9.29.183","172.19.0.3","TLSv1.2","599","Application Data"
"9.546979","172.19.0.3","5.9.29.183","TLSv1.2","599","Application Data"
"9.547482","5.9.29.183","172.19.0.3","TCP","56","9002 → 43520 [ACK] Seq=464389 Ack=29692 Win=65535 Len=0"
"9.835599","5.9.29.183","172.19.0.3","TCP","1504","[TCP segment of a reassembled PDU]"
"9.835707","5.9.29.183","172.19.0.3","TCP","1516","9002 → 43520 [PSH, ACK] Seq=465837 Ack=29692 Win=65535 Len=1460 [TCP segment of a reassembled PDU]"
"9.835771","5.9.29.183","172.19.0.3","TLSv1.2","1516","Application Data [TCP segment of a reassembled PDU]"
"9.835782","5.9.29.183","172.19.0.3","TCP","1213","9002 → 43520 [PSH, ACK] Seq=468757 Ack=29692 Win=65535 Len=1157 [TCP segment of a reassembled PDU]"
"9.835786","5.9.29.183","172.19.0.3","TCP","1516","9002 → 43520 [PSH, ACK] Seq=469914 Ack=29692 Win=65535 Len=1460 [TCP segment of a reassembled PDU]"
"9.835788","5.9.29.183","172.19.0.3","TLSv1.2","1516","Application Data [TCP segment of a reassembled PDU]"
"9.835790","5.9.29.183","172.19.0.3","TCP","1516","9002 → 43520 [PSH, ACK] Seq=472834 Ack=29692 Win=65535 Len=1460 [TCP segment of a reassembled PDU]"
"9.835835","5.9.29.183","172.19.0.3","TCP","1468","9002 → 43520 [PSH, ACK] Seq=474294 Ack=29692 Win=65535 Len=1412 [TCP segment of a reassembled PDU]"
"9.835847","172.19.0.3","5.9.29.183","TCP","56","43520 → 9002 [ACK] Seq=29692 Ack=467297 Win=11903 Len=0"
"9.835947","172.19.0.3","5.9.29.183","TCP","56","43520 → 9002 [ACK] Seq=29692 Ack=475706 Win=11855 Len=0"
"9.851426","5.9.29.183","172.19.0.3","TLSv1.2","648","Application Data"
"9.864315","5.9.29.183","172.19.0.3","TCP","1504","[TCP segment of a reassembled PDU]"
"9.864332","172.19.0.3","5.9.29.183","TCP","56","43520 → 9002 [ACK] Seq=29692 Ack=477746 Win=11911 Len=0"
"9.866288","5.9.29.183","172.19.0.3","TLSv1.2","179","Application Data"
"9.904716","5.9.29.183","172.19.0.3","TCP","1504","[TCP segment of a reassembled PDU]"
"9.904734","172.19.0.3","5.9.29.183","TCP","56","43520 → 9002 [ACK] Seq=29692 Ack=479317 Win=11911 Len=0"
"9.904767","5.9.29.183","172.19.0.3","TCP","1516","9002 → 43520 [PSH, ACK] Seq=479317 Ack=29692 Win=65535 Len=1460 [TCP segment of a reassembled PDU]"
"9.904793","5.9.29.183","172.19.0.3","TLSv1.2","775","Application Data"
"9.904926","172.19.0.3","5.9.29.183","TCP","56","43520 → 9002 [ACK] Seq=29692 Ack=481496 Win=11895 Len=0"
"9.932783","5.9.29.183","172.19.0.3","TCP","1504","[TCP segment of a reassembled PDU]"
"9.932828","5.9.29.183","172.19.0.3","TLSv1.2","179","Application Data"
"9.932840","172.19.0.3","5.9.29.183","TCP","56","43520 → 9002 [ACK] Seq=29692 Ack=483067 Win=11903 Len=0"
