_ws.col.Time,_ws.col.Source,_ws.col.Destination,_ws.col.Protocol,_ws.col.Length,_ws.col.Info
"0.000000","172.18.0.2","54.38.73.16","TLSv1.2","611","Application Data"
"0.025072","54.38.73.16","172.18.0.2","TCP","68","21002 → 36876 [ACK] Seq=1 Ack=544 Win=1452 Len=0 TSval=2675277345 TSecr=1084512724"
"0.874704","54.38.73.16","172.18.0.2","TLSv1.2","611","Application Data"
"0.874758","172.18.0.2","54.38.73.16","TCP","68","36876 → 21002 [ACK] Seq=544 Ack=544 Win=5608 Len=0 TSval=1084513599 TSecr=2675277537"
"0.875829","172.18.0.2","54.38.73.16","TLSv1.2","2153","Application Data"
"0.900245","54.38.73.16","172.18.0.2","TCP","68","21002 → 36876 [ACK] Seq=544 Ack=2629 Win=1450 Len=0 TSval=2675277563 TSecr=1084513600"
"1.486355","54.38.73.16","172.18.0.2","TLSv1.2","611","Application Data"
"1.486403","172.18.0.2","54.38.73.16","TCP","68","36876 → 21002 [ACK] Seq=2629 Ack=1087 Win=5608 Len=0 TSval=1084514210 TSecr=2675277700"
"1.691343","54.38.73.16","172.18.0.2","TLSv1.2","1125","Application Data"
"1.691395","172.18.0.2","54.38.73.16","TCP","68","36876 → 21002 [ACK] Seq=2629 Ack=2144 Win=5600 Len=0 TSval=1084514415 TSecr=2675277741"
"1.698275","172.18.0.2","54.38.73.16","TLSv1.2","611","Application Data"
"1.722209","54.38.73.16","172.18.0.2","TCP","68","21002 → 36876 [ACK] Seq=2144 Ack=3172 Win=1452 Len=0 TSval=2675277769 TSecr=1084514422"
"2.408063","54.38.73.16","172.18.0.2","TLSv1.2","611","Application Data"
"2.408115","172.18.0.2","54.38.73.16","TCP","68","36876 → 21002 [ACK] Seq=3172 Ack=2687 Win=5608 Len=0 TSval=1084515132 TSecr=2675277920"
"2.408905","172.18.0.2","54.38.73.16","TLSv1.2","611","Application Data"
"2.432716","54.38.73.16","172.18.0.2","TCP","68","21002 → 36876 [ACK] Seq=2687 Ack=3715 Win=1452 Len=0 TSval=2675277947 TSecr=1084515133"
"3.021354","54.38.73.16","172.18.0.2","TLSv1.2","611","Application Data"
"3.021398","54.38.73.16","172.18.0.2","TCP","2964","[TCP segment of a reassembled PDU]"
"3.021401","54.38.73.16","172.18.0.2","TLSv1.2","2964","Application Data [TCP segment of a reassembled PDU]"
"3.021405","54.38.73.16","172.18.0.2","TCP","1516","21002 → 36876 [ACK] Seq=9022 Ack=3715 Win=1452 Len=1448 TSval=2675278091 TSecr=1084515133 [TCP segment of a reassembled PDU]"
"3.021569","172.18.0.2","54.38.73.16","TCP","68","36876 → 21002 [ACK] Seq=3715 Ack=10470 Win=5552 Len=0 TSval=1084515746 TSecr=2675278056"
"3.045148","54.38.73.16","172.18.0.2","TLSv1.2","4252","Application Data, Application Data, Application Data"
"3.045171","172.18.0.2","54.38.73.16","TCP","68","36876 → 21002 [ACK] Seq=3715 Ack=14654 Win=5580 Len=0 TSval=1084515769 TSecr=2675278100"
"3.064139","54.38.73.16","172.18.0.2","TCP","2964","[TCP segment of a reassembled PDU]"
"3.064158","172.18.0.2","54.38.73.16","TCP","68","36876 → 21002 [ACK] Seq=3715 Ack=17550 Win=5596 Len=0 TSval=1084515788 TSecr=2675278104"
"3.068991","54.38.73.16","172.18.0.2","TLSv1.2","799","Application Data"
"3.110493","172.18.0.2","54.38.73.16","TCP","68","36876 → 21002 [ACK] Seq=3715 Ack=18281 Win=5612 Len=0 TSval=1084515835 TSecr=2675278106"
"3.126732","54.38.73.16","172.18.0.2","TLSv1.2","2964","Application Data"
"3.126763","172.18.0.2","54.38.73.16","TCP","68","36876 → 21002 [ACK] Seq=3715 Ack=21177 Win=5596 Len=0 TSval=1084515851 TSecr=2675278120"
"3.134590","54.38.73.16","172.18.0.2","TLSv1.2","1342","Application Data"
"3.134627","172.18.0.2","54.38.73.16","TCP","68","36876 → 21002 [ACK] Seq=3715 Ack=22451 Win=5593 Len=0 TSval=1084515859 TSecr=2675278122"
"3.158154","54.38.73.16","172.18.0.2","TLSv1.2","611","Application Data"
"3.158183","172.18.0.2","54.38.73.16","TCP","68","36876 → 21002 [ACK] Seq=3715 Ack=22994 Win=5593 Len=0 TSval=1084515882 TSecr=2675278128"
"3.211138","54.38.73.16","172.18.0.2","TLSv1.2","3695","Application Data"
"3.211160","172.18.0.2","54.38.73.16","TCP","68","36876 → 21002 [ACK] Seq=3715 Ack=26621 Win=5580 Len=0 TSval=1084515935 TSecr=2675278141"
"3.217487","172.18.0.2","54.38.73.16","TLSv1.2","611","Application Data"
"3.241332","54.38.73.16","172.18.0.2","TCP","68","21002 → 36876 [ACK] Seq=26621 Ack=4258 Win=1452 Len=0 TSval=2675278149 TSecr=1084515942"
"3.944304","54.38.73.16","172.18.0.2","TLSv1.2","611","Application Data"
"3.944372","172.18.0.2","54.38.73.16","TCP","68","36876 → 21002 [ACK] Seq=4258 Ack=27164 Win=5608 Len=0 TSval=1084516668 TSecr=2675278259"
"3.944321","54.38.73.16","172.18.0.2","TLSv1.2","611","[TCP Spurious Retransmission] , Application Data"
"3.944385","172.18.0.2","54.38.73.16","TCP","80","[TCP Dup ACK 39#1] 36876 → 21002 [ACK] Seq=4258 Ack=27164 Win=5608 Len=0 TSval=1084516668 TSecr=2675278324 SLE=26621 SRE=27164"
"3.945426","172.18.0.2","54.38.73.16","TLSv1.2","611","Application Data"
"3.972746","54.38.73.16","172.18.0.2","TCP","68","21002 → 36876 [ACK] Seq=27164 Ack=4801 Win=1452 Len=0 TSval=2675278331 TSecr=1084516669"
"4.558471","54.38.73.16","172.18.0.2","TLSv1.2","611","Application Data"
"4.558529","172.18.0.2","54.38.73.16","TCP","68","36876 → 21002 [ACK] Seq=4801 Ack=27707 Win=5608 Len=0 TSval=1084517283 TSecr=2675278462"
"4.558695","54.38.73.16","172.18.0.2","TCP","2964","[TCP segment of a reassembled PDU]"
"4.558725","172.18.0.2","54.38.73.16","TCP","68","36876 → 21002 [ACK] Seq=4801 Ack=30603 Win=5596 Len=0 TSval=1084517283 TSecr=2675278470"
"4.558702","54.38.73.16","172.18.0.2","TLSv1.2","4412","Application Data [TCP segment of a reassembled PDU]"
"4.558743","172.18.0.2","54.38.73.16","TCP","68","36876 → 21002 [ACK] Seq=4801 Ack=34947 Win=5565 Len=0 TSval=1084517283 TSecr=2675278472"
"4.582514","54.38.73.16","172.18.0.2","TLSv1.2","82","Application Data"
"4.582554","172.18.0.2","54.38.73.16","TCP","68","36876 → 21002 [ACK] Seq=4801 Ack=34961 Win=5609 Len=0 TSval=1084517307 TSecr=2675278484"
"4.583107","172.18.0.2","54.38.73.16","TLSv1.2","611","Application Data"
"4.606585","54.38.73.16","172.18.0.2","TLSv1.2","611","Application Data"
"4.606603","172.18.0.2","54.38.73.16","TCP","68","36876 → 21002 [ACK] Seq=5344 Ack=35504 Win=5608 Len=0 TSval=1084517331 TSecr=2675278490"
"4.608128","54.38.73.16","172.18.0.2","TCP","68","21002 → 36876 [ACK] Seq=35504 Ack=5344 Win=1452 Len=0 TSval=2675278491 TSecr=1084517307"
"4.693094","54.38.73.16","172.18.0.2","TLSv1.2","3695","Application Data"
"4.693130","172.18.0.2","54.38.73.16","TCP","68","36876 → 21002 [ACK] Seq=5344 Ack=39131 Win=5580 Len=0 TSval=1084517417 TSecr=2675278512"
"4.712531","54.38.73.16","172.18.0.2","TCP","2964","[TCP segment of a reassembled PDU]"
"4.712567","172.18.0.2","54.38.73.16","TCP","68","36876 → 21002 [ACK] Seq=5344 Ack=42027 Win=5596 Len=0 TSval=1084517437 TSecr=2675278517"
"4.716853","54.38.73.16","172.18.0.2","TLSv1.2","1342","Application Data, Application Data"
"4.716888","172.18.0.2","54.38.73.16","TCP","68","36876 → 21002 [ACK] Seq=5344 Ack=43301 Win=5593 Len=0 TSval=1084517441 TSecr=2675278518"
"4.786765","54.38.73.16","172.18.0.2","TLSv1.2","1125","Application Data"
"4.786800","172.18.0.2","54.38.73.16","TCP","68","36876 → 21002 [ACK] Seq=5344 Ack=44358 Win=5593 Len=0 TSval=1084517511 TSecr=2675278535"
"4.968569","54.38.73.16","172.18.0.2","TLSv1.2","3695","Application Data"
"4.968623","172.18.0.2","54.38.73.16","TCP","68","36876 → 21002 [ACK] Seq=5344 Ack=47985 Win=5581 Len=0 TSval=1084517693 TSecr=2675278567"
"4.974925","172.18.0.2","54.38.73.16","TLSv1.2","611","Application Data"
"4.999007","54.38.73.16","172.18.0.2","TCP","68","21002 → 36876 [ACK] Seq=47985 Ack=5887 Win=1452 Len=0 TSval=2675278588 TSecr=1084517699"
"5.485095","54.38.73.16","172.18.0.2","TLSv1.2","611","Application Data"
"5.486203","172.18.0.2","54.38.73.16","TLSv1.2","611","Application Data"
"5.512517","54.38.73.16","172.18.0.2","TCP","68","21002 → 36876 [ACK] Seq=48528 Ack=6430 Win=1452 Len=0 TSval=2675278716 TSecr=1084518210"
"6.094951","54.38.73.16","172.18.0.2","TLSv1.2","3695","Application Data"
"6.095148","172.18.0.2","54.38.73.16","TCP","68","36876 → 21002 [ACK] Seq=6430 Ack=52155 Win=5584 Len=0 TSval=1084518819 TSecr=2675278855"
"6.140527","54.38.73.16","172.18.0.2","TLSv1.2","611","Application Data"
"6.182592","172.18.0.2","54.38.73.16","TCP","68","36876 → 21002 [ACK] Seq=6430 Ack=52698 Win=5612 Len=0 TSval=1084518907 TSecr=2675278873"
"6.709022","54.38.73.16","172.18.0.2","TCP","1516","[TCP segment of a reassembled PDU]"
"6.709072","172.18.0.2","54.38.73.16","TCP","68","36876 → 21002 [ACK] Seq=6430 Ack=54146 Win=5601 Len=0 TSval=1084519433 TSecr=2675278942"
"6.709237","54.38.73.16","172.18.0.2","TLSv1.2","2697","Application Data"
"6.709272","172.18.0.2","54.38.73.16","TCP","68","36876 → 21002 [ACK] Seq=6430 Ack=56775 Win=5597 Len=0 TSval=1084519433 TSecr=2675278942"
"6.709242","54.38.73.16","172.18.0.2","TCP","2964","[TCP segment of a reassembled PDU]"
"6.709246","54.38.73.16","172.18.0.2","TLSv1.2","2964","Application Data [TCP segment of a reassembled PDU]"
"6.709251","54.38.73.16","172.18.0.2","TCP","1516","21002 → 36876 [ACK] Seq=62567 Ack=6430 Win=1452 Len=1448 TSval=2675278973 TSecr=1084518907 [TCP segment of a reassembled PDU]"
"6.709307","172.18.0.2","54.38.73.16","TCP","68","36876 → 21002 [ACK] Seq=6430 Ack=59671 Win=5575 Len=0 TSval=1084519433 TSecr=2675278942"
"6.709386","172.18.0.2","54.38.73.16","TCP","68","36876 → 21002 [ACK] Seq=6430 Ack=62567 Win=5553 Len=0 TSval=1084519433 TSecr=2675278945"
"6.709417","172.18.0.2","54.38.73.16","TCP","68","36876 → 21002 [ACK] Seq=6430 Ack=64015 Win=5542 Len=0 TSval=1084519434 TSecr=2675278973"
"6.735637","54.38.73.16","172.18.0.2","TLSv1.2","10057","Application Data, Application Data, Application Data, Application Data, Application Data, Application Data"
"6.735676","172.18.0.2","54.38.73.16","TCP","68","36876 → 21002 [ACK] Seq=6430 Ack=74004 Win=5550 Len=0 TSval=1084519460 TSecr=2675279022"
"6.738072","54.38.73.16","172.18.0.2","TCP","2964","[TCP segment of a reassembled PDU]"
"6.738108","172.18.0.2","54.38.73.16","TCP","68","36876 → 21002 [ACK] Seq=6430 Ack=76900 Win=5596 Len=0 TSval=1084519462 TSecr=2675279023"
"6.760518","54.38.73.16","172.18.0.2","TLSv1.2","9624","Application Data, Application Data, Application Data, Application Data"
"6.760553","172.18.0.2","54.38.73.16","TCP","68","36876 → 21002 [ACK] Seq=6430 Ack=86456 Win=5550 Len=0 TSval=1084519485 TSecr=2675279028"
"6.761045","172.18.0.2","54.38.73.16","TLSv1.2","611","Application Data"
"6.761959","54.38.73.16","172.18.0.2","TCP","2964","[TCP segment of a reassembled PDU]"
"6.761987","172.18.0.2","54.38.73.16","TCP","68","36876 → 21002 [ACK] Seq=6973 Ack=89352 Win=5596 Len=0 TSval=1084519486 TSecr=2675279029"
"6.784135","54.38.73.16","172.18.0.2","TLSv1.2","799","Application Data"
"6.784174","172.18.0.2","54.38.73.16","TCP","68","36876 → 21002 [ACK] Seq=6973 Ack=90083 Win=5593 Len=0 TSval=1084519508 TSecr=2675279035"
"6.785491","54.38.73.16","172.18.0.2","TCP","68","21002 → 36876 [ACK] Seq=90083 Ack=6973 Win=1452 Len=0 TSval=2675279035 TSecr=1084519485"
"6.785534","172.18.0.2","54.38.73.16","TLSv1.2","611","Application Data"
"6.809112","54.38.73.16","172.18.0.2","TCP","68","21002 → 36876 [ACK] Seq=90083 Ack=7516 Win=1452 Len=0 TSval=2675279041 TSecr=1084519510"
"6.812072","54.38.73.16","172.18.0.2","TLSv1.2","1125","Application Data"
"6.812108","172.18.0.2","54.38.73.16","TCP","68","36876 → 21002 [ACK] Seq=7516 Ack=91140 Win=5604 Len=0 TSval=1084519536 TSecr=2675279042"
"7.021156","54.38.73.16","172.18.0.2","TCP","1516","[TCP segment of a reassembled PDU]"
"7.021207","172.18.0.2","54.38.73.16","TCP","68","36876 → 21002 [ACK] Seq=7516 Ack=92588 Win=5593 Len=0 TSval=1084519745 TSecr=2675279071"
"7.021419","54.38.73.16","172.18.0.2","TLSv1.2","2247","Application Data"
"7.021479","172.18.0.2","54.38.73.16","TCP","68","36876 → 21002 [ACK] Seq=7516 Ack=94767 Win=5599 Len=0 TSval=1084519746 TSecr=2675279071"
"7.021423","54.38.73.16","172.18.0.2","TCP","2964","[TCP segment of a reassembled PDU]"
"7.021497","172.18.0.2","54.38.73.16","TCP","68","36876 → 21002 [ACK] Seq=7516 Ack=97663 Win=5584 Len=0 TSval=1084519746 TSecr=2675279074"
"7.021427","54.38.73.16","172.18.0.2","TLSv1.2","1516","Application Data [TCP segment of a reassembled PDU]"
"7.045948","54.38.73.16","172.18.0.2","TLSv1.2","408","Application Data"
"7.045983","172.18.0.2","54.38.73.16","TCP","68","36876 → 21002 [ACK] Seq=7516 Ack=99451 Win=5593 Len=0 TSval=1084519770 TSecr=2675279093"
"7.093018","54.38.73.16","172.18.0.2","TLSv1.2","3181","Application Data"
"7.093224","172.18.0.2","54.38.73.16","TCP","68","36876 → 21002 [ACK] Seq=7516 Ack=102564 Win=5580 Len=0 TSval=1084519817 TSecr=2675279112"
"7.093612","172.18.0.2","54.38.73.16","TLSv1.2","611","Application Data"
"7.114429","54.38.73.16","172.18.0.2","TCP","2964","[TCP segment of a reassembled PDU]"
"7.114631","172.18.0.2","54.38.73.16","TCP","68","36876 → 21002 [ACK] Seq=8059 Ack=105460 Win=5596 Len=0 TSval=1084519839 TSecr=2675279117"
"7.117058","54.38.73.16","172.18.0.2","TLSv1.2","285","Application Data"
"7.155869","54.38.73.16","172.18.0.2","TCP","68","21002 → 36876 [ACK] Seq=105677 Ack=8059 Win=1452 Len=0 TSval=2675279128 TSecr=1084519818"
"7.155909","172.18.0.2","54.38.73.16","TLSv1.2","611","Application Data"
"7.216436","54.38.73.16","172.18.0.2","TCP","68","21002 → 36876 [ACK] Seq=105677 Ack=8602 Win=1452 Len=0 TSval=2675279143 TSecr=1084519880"
"7.936371","54.38.73.16","172.18.0.2","TLSv1.2","611","Application Data"
"7.937306","172.18.0.2","54.38.73.16","TLSv1.2","611","Application Data"
"7.963149","54.38.73.16","172.18.0.2","TCP","68","21002 → 36876 [ACK] Seq=106220 Ack=9145 Win=1452 Len=0 TSval=2675279329 TSecr=1084520661"
"8.515119","54.38.73.16","172.18.0.2","TLSv1.2","611","Application Data"
"8.562507","172.18.0.2","54.38.73.16","TCP","68","36876 → 21002 [ACK] Seq=9145 Ack=106763 Win=5612 Len=0 TSval=1084521287 TSecr=2675279467"
"8.620526","54.38.73.16","172.18.0.2","TLSv1.2","3695","Application Data"
"8.620578","172.18.0.2","54.38.73.16","TCP","68","36876 → 21002 [ACK] Seq=9145 Ack=110390 Win=5584 Len=0 TSval=1084521345 TSecr=2675279493"
"8.693306","54.38.73.16","172.18.0.2","TLSv1.2","3695","Application Data"
"8.693337","172.18.0.2","54.38.73.16","TCP","68","36876 → 21002 [ACK] Seq=9145 Ack=114017 Win=5580 Len=0 TSval=1084521417 TSecr=2675279512"
"8.702977","54.38.73.16","172.18.0.2","TCP","2964","[TCP segment of a reassembled PDU]"
"8.703034","172.18.0.2","54.38.73.16","TCP","68","36876 → 21002 [ACK] Seq=9145 Ack=116913 Win=5596 Len=0 TSval=1084521427 TSecr=2675279514"
"8.717301","54.38.73.16","172.18.0.2","TLSv1.2","1342","Application Data, Application Data"
"8.717330","172.18.0.2","54.38.73.16","TCP","68","36876 → 21002 [ACK] Seq=9145 Ack=118187 Win=5593 Len=0 TSval=1084521441 TSecr=2675279518"
"8.775094","54.38.73.16","172.18.0.2","TLSv1.2","3695","Application Data"
"8.775123","172.18.0.2","54.38.73.16","TCP","68","36876 → 21002 [ACK] Seq=9145 Ack=121814 Win=5580 Len=0 TSval=1084521499 TSecr=2675279532"
"8.798995","54.38.73.16","172.18.0.2","TLSv1.2","611","Application Data"
"8.799036","172.18.0.2","54.38.73.16","TCP","68","36876 → 21002 [ACK] Seq=9145 Ack=122357 Win=5593 Len=0 TSval=1084521523 TSecr=2675279538"
"8.875569","54.38.73.16","172.18.0.2","TLSv1.2","3695","Application Data"
"8.875600","172.18.0.2","54.38.73.16","TCP","68","36876 → 21002 [ACK] Seq=9145 Ack=125984 Win=5580 Len=0 TSval=1084521600 TSecr=2675279557"
"8.885768","54.38.73.16","172.18.0.2","TLSv1.2","5860","Application Data"
"8.885806","172.18.0.2","54.38.73.16","TCP","68","36876 → 21002 [ACK] Seq=9145 Ack=131776 Win=5581 Len=0 TSval=1084521610 TSecr=2675279560"
"8.886059","54.38.73.16","172.18.0.2","TCP","1516","21002 → 36876 [ACK] Seq=131776 Ack=9145 Win=1452 Len=1448 TSval=2675279560 TSecr=1084521523 [TCP segment of a reassembled PDU]"
"8.886088","172.18.0.2","54.38.73.16","TCP","68","36876 → 21002 [ACK] Seq=9145 Ack=133224 Win=5570 Len=0 TSval=1084521610 TSecr=2675279560"
"8.900670","54.38.73.16","172.18.0.2","TLSv1.2","1139","Application Data, Application Data"
"8.900698","172.18.0.2","54.38.73.16","TCP","68","36876 → 21002 [ACK] Seq=9145 Ack=134295 Win=5593 Len=0 TSval=1084521625 TSecr=2675279564"
"8.901085","172.18.0.2","54.38.73.16","TLSv1.2","611","Application Data"
"8.926927","54.38.73.16","172.18.0.2","TCP","68","21002 → 36876 [ACK] Seq=134295 Ack=9688 Win=1452 Len=0 TSval=2675279570 TSecr=1084521625"
"9.026922","54.38.73.16","172.18.0.2","TLSv1.2","3695","Application Data"
"9.026951","172.18.0.2","54.38.73.16","TCP","68","36876 → 21002 [ACK] Seq=9688 Ack=137922 Win=5580 Len=0 TSval=1084521751 TSecr=2675279595"
"9.035488","54.38.73.16","172.18.0.2","TCP","1516","[TCP segment of a reassembled PDU]"
"9.035516","172.18.0.2","54.38.73.16","TCP","68","36876 → 21002 [ACK] Seq=9688 Ack=139370 Win=5593 Len=0 TSval=1084521760 TSecr=2675279597"
"9.051019","54.38.73.16","172.18.0.2","TLSv1.2","1219","Application Data"
"9.051050","172.18.0.2","54.38.73.16","TCP","68","36876 → 21002 [ACK] Seq=9688 Ack=140521 Win=5593 Len=0 TSval=1084521775 TSecr=2675279601"
"9.051457","172.18.0.2","54.38.73.16","TLSv1.2","611","Application Data"
"9.057386","54.38.73.16","172.18.0.2","TCP","2964","[TCP segment of a reassembled PDU]"
"9.057482","172.18.0.2","54.38.73.16","TCP","68","36876 → 21002 [ACK] Seq=10231 Ack=143417 Win=5596 Len=0 TSval=1084521782 TSecr=2675279603"
"9.066620","54.38.73.16","172.18.0.2","TLSv1.2","4412","Application Data [TCP segment of a reassembled PDU]"
"9.066717","172.18.0.2","54.38.73.16","TCP","68","36876 → 21002 [ACK] Seq=10231 Ack=147761 Win=5580 Len=0 TSval=1084521791 TSecr=2675279605"
"9.074754","54.38.73.16","172.18.0.2","TLSv1.2","82","Application Data"
"9.074883","172.18.0.2","54.38.73.16","TCP","68","36876 → 21002 [ACK] Seq=10231 Ack=147775 Win=5612 Len=0 TSval=1084521799 TSecr=2675279607"
"9.074889","54.38.73.16","172.18.0.2","TCP","68","21002 → 36876 [ACK] Seq=147775 Ack=10231 Win=1452 Len=0 TSval=2675279607 TSecr=1084521776"
"9.087192","54.38.73.16","172.18.0.2","TCP","2964","[TCP segment of a reassembled PDU]"
"9.087303","172.18.0.2","54.38.73.16","TCP","68","36876 → 21002 [ACK] Seq=10231 Ack=150671 Win=5596 Len=0 TSval=1084521811 TSecr=2675279610"
"9.102073","54.38.73.16","172.18.0.2","TLSv1.2","799","Application Data"
"9.102192","172.18.0.2","54.38.73.16","TCP","68","36876 → 21002 [ACK] Seq=10231 Ack=151402 Win=5612 Len=0 TSval=1084521826 TSecr=2675279614"
"9.107632","54.38.73.16","172.18.0.2","TCP","1516","[TCP segment of a reassembled PDU]"
"9.125070","54.38.73.16","172.18.0.2","TLSv1.2","705","Application Data"
"9.125188","172.18.0.2","54.38.73.16","TCP","68","36876 → 21002 [ACK] Seq=10231 Ack=153487 Win=5612 Len=0 TSval=1084521849 TSecr=2675279615"
"9.161495","54.38.73.16","172.18.0.2","TLSv1.2","3695","Application Data"
"9.161618","172.18.0.2","54.38.73.16","TCP","68","36876 → 21002 [ACK] Seq=10231 Ack=157114 Win=5584 Len=0 TSval=1084521886 TSecr=2675279629"
"9.205091","54.38.73.16","172.18.0.2","TLSv1.2","3695","Application Data"
"9.205207","172.18.0.2","54.38.73.16","TCP","68","36876 → 21002 [ACK] Seq=10231 Ack=160741 Win=5580 Len=0 TSval=1084521929 TSecr=2675279640"
"9.205592","172.18.0.2","54.38.73.16","TLSv1.2","611","Application Data"
"9.215089","54.38.73.16","172.18.0.2","TCP","2964","[TCP segment of a reassembled PDU]"
"9.215269","172.18.0.2","54.38.73.16","TCP","68","36876 → 21002 [ACK] Seq=10774 Ack=163637 Win=5596 Len=0 TSval=1084521939 TSecr=2675279642"
"9.229312","54.38.73.16","172.18.0.2","TLSv1.2","799","Application Data"
"9.246090","54.38.73.16","172.18.0.2","TCP","2964","[TCP segment of a reassembled PDU]"
"9.246122","172.18.0.2","54.38.73.16","TCP","68","36876 → 21002 [ACK] Seq=10774 Ack=167264 Win=5596 Len=0 TSval=1084521970 TSecr=2675279646"
"9.270568","54.38.73.16","172.18.0.2","TLSv1.2","799","Application Data"
"9.318461","172.18.0.2","54.38.73.16","TCP","68","36876 → 21002 [ACK] Seq=10774 Ack=167995 Win=5612 Len=0 TSval=1084522043 TSecr=2675279656"
"9.343736","54.38.73.16","172.18.0.2","TLSv1.2","611","Application Data"
"9.343886","172.18.0.2","54.38.73.16","TCP","68","36876 → 21002 [ACK] Seq=10774 Ack=168538 Win=5612 Len=0 TSval=1084522068 TSecr=2675279674"
"9.362778","54.38.73.16","172.18.0.2","TCP","2964","[TCP segment of a reassembled PDU]"
"9.362935","172.18.0.2","54.38.73.16","TCP","68","36876 → 21002 [ACK] Seq=10774 Ack=171434 Win=5596 Len=0 TSval=1084522087 TSecr=2675279679"
"9.367115","54.38.73.16","172.18.0.2","TLSv1.2","799","Application Data"
"9.367287","172.18.0.2","54.38.73.16","TCP","68","36876 → 21002 [ACK] Seq=10774 Ack=172165 Win=5612 Len=0 TSval=1084522091 TSecr=2675279680"
"9.372354","54.38.73.16","172.18.0.2","TLSv1.2","4412","Application Data"
"9.372502","172.18.0.2","54.38.73.16","TCP","68","36876 → 21002 [ACK] Seq=10774 Ack=176509 Win=5580 Len=0 TSval=1084522097 TSecr=2675279682"
"9.392230","54.38.73.16","172.18.0.2","TLSv1.2","1436","Application Data"
"9.392388","172.18.0.2","54.38.73.16","TCP","68","36876 → 21002 [ACK] Seq=10774 Ack=177877 Win=5612 Len=0 TSval=1084522116 TSecr=2675279687"
"9.404805","54.38.73.16","172.18.0.2","TCP","2964","[TCP segment of a reassembled PDU]"
"9.404941","172.18.0.2","54.38.73.16","TCP","68","36876 → 21002 [ACK] Seq=10774 Ack=180773 Win=5596 Len=0 TSval=1084522129 TSecr=2675279690"
"9.415192","54.38.73.16","172.18.0.2","TLSv1.2","1516","Application Data [TCP segment of a reassembled PDU]"
"9.415580","54.38.73.16","172.18.0.2","TLSv1.2","408","Application Data"
"9.415648","172.18.0.2","54.38.73.16","TCP","68","36876 → 21002 [ACK] Seq=10774 Ack=182561 Win=5612 Len=0 TSval=1084522140 TSecr=2675279692"
"9.425748","172.18.0.2","54.38.73.16","TLSv1.2","611","Application Data"
"9.487754","54.38.73.16","172.18.0.2","TCP","68","21002 → 36876 [ACK] Seq=182561 Ack=11317 Win=1452 Len=0 TSval=2675279711 TSecr=1084522150"
"10.396242","54.38.73.16","172.18.0.2","TLSv1.2","611","Application Data"
"10.396315","172.18.0.2","54.38.73.16","TCP","68","36876 → 21002 [ACK] Seq=11317 Ack=183104 Win=5608 Len=0 TSval=1084523120 TSecr=2675279920"
"10.397244","172.18.0.2","54.38.73.16","TLSv1.2","611","Application Data"
"10.421643","54.38.73.16","172.18.0.2","TCP","68","21002 → 36876 [ACK] Seq=183104 Ack=11860 Win=1452 Len=0 TSval=2675279944 TSecr=1084523121"
"11.015739","54.38.73.16","172.18.0.2","TLSv1.2","1342","[TCP Previous segment not captured] , Ignored Unknown Record"
"11.015803","172.18.0.2","54.38.73.16","TCP","80","[TCP Dup ACK 197#1] 36876 → 21002 [ACK] Seq=11860 Ack=183104 Win=5612 Len=0 TSval=1084523740 TSecr=2675279944 SLE=189627 SRE=190901"
"11.015760","54.38.73.16","172.18.0.2","TCP","3695","[TCP Out-Of-Order] 21002 → 36876 [PSH, ACK] Seq=183104 Ack=11860 Win=1452 Len=3627 TSval=2675280055 TSecr=1084523121"
"11.015834","172.18.0.2","54.38.73.16","TCP","80","36876 → 21002 [ACK] Seq=11860 Ack=186731 Win=5584 Len=0 TSval=1084523740 TSecr=2675280055 SLE=189627 SRE=190901"
"11.015764","54.38.73.16","172.18.0.2","TCP","2964","[TCP Out-Of-Order] 21002 → 36876 [ACK] Seq=186731 Ack=11860 Win=1452 Len=2896 TSval=2675280071 TSecr=1084523121"
"11.015869","172.18.0.2","54.38.73.16","TCP","68","36876 → 21002 [ACK] Seq=11860 Ack=190901 Win=5552 Len=0 TSval=1084523740 TSecr=2675280071"
"11.039977","54.38.73.16","172.18.0.2","TLSv1.2","1125","Application Data"
"11.040014","172.18.0.2","54.38.73.16","TCP","68","36876 → 21002 [ACK] Seq=11860 Ack=191958 Win=5593 Len=0 TSval=1084523764 TSecr=2675280098"
"11.047471","172.18.0.2","54.38.73.16","TLSv1.2","611","Application Data"
"11.071064","54.38.73.16","172.18.0.2","TCP","68","21002 → 36876 [ACK] Seq=191958 Ack=12403 Win=1452 Len=0 TSval=2675280106 TSecr=1084523772"
"11.931423","54.38.73.16","172.18.0.2","TLSv1.2","611","Application Data"
"11.931427","54.38.73.16","172.18.0.2","TCP","611","[TCP Retransmission] 21002 → 36876 [PSH, ACK] Seq=191958 Ack=12403 Win=1452 Len=543 TSval=2675280322 TSecr=1084523772"
"11.931451","172.18.0.2","54.38.73.16","TCP","80","36876 → 21002 [ACK] Seq=12403 Ack=192501 Win=5608 Len=0 TSval=1084524656 TSecr=2675280322 SLE=191958 SRE=192501"
"11.931833","172.18.0.2","54.38.73.16","TLSv1.2","611","Application Data"
"11.955949","54.38.73.16","172.18.0.2","TCP","68","21002 → 36876 [ACK] Seq=192501 Ack=12946 Win=1452 Len=0 TSval=2675280328 TSecr=1084524656"
"12.854912","54.38.73.16","172.18.0.2","TLSv1.2","611","Application Data"
"12.855015","172.18.0.2","54.38.73.16","TCP","68","36876 → 21002 [ACK] Seq=12946 Ack=193044 Win=5608 Len=0 TSval=1084525579 TSecr=2675280529"
"12.854963","54.38.73.16","172.18.0.2","TLSv1.2","5860","Application Data"
"12.855032","172.18.0.2","54.38.73.16","TCP","68","36876 → 21002 [ACK] Seq=12946 Ack=198836 Win=5563 Len=0 TSval=1084525579 TSecr=2675280541"
"12.855687","172.18.0.2","54.38.73.16","TLSv1.2","611","Application Data"
"12.873502","54.38.73.16","172.18.0.2","TLSv1.2","1516","Application Data [TCP segment of a reassembled PDU]"
"12.873534","172.18.0.2","54.38.73.16","TCP","68","36876 → 21002 [ACK] Seq=13489 Ack=200284 Win=5593 Len=0 TSval=1084525598 TSecr=2675280557"
"12.879288","54.38.73.16","172.18.0.2","TLSv1.2","625","Application Data"
"12.879324","172.18.0.2","54.38.73.16","TCP","68","36876 → 21002 [ACK] Seq=13489 Ack=200841 Win=5593 Len=0 TSval=1084525603 TSecr=2675280558"
"12.880196","54.38.73.16","172.18.0.2","TCP","68","21002 → 36876 [ACK] Seq=200841 Ack=13489 Win=1452 Len=0 TSval=2675280559 TSecr=1084525580"
"12.886394","54.38.73.16","172.18.0.2","TCP","2964","[TCP segment of a reassembled PDU]"
"12.886455","172.18.0.2","54.38.73.16","TCP","68","36876 → 21002 [ACK] Seq=13489 Ack=203737 Win=5596 Len=0 TSval=1084525611 TSecr=2675280560"
"12.902722","54.38.73.16","172.18.0.2","TLSv1.2","799","Application Data"
"12.902758","172.18.0.2","54.38.73.16","TCP","68","36876 → 21002 [ACK] Seq=13489 Ack=204468 Win=5593 Len=0 TSval=1084525627 TSecr=2675280564"
"12.951308","54.38.73.16","172.18.0.2","TLSv1.2","3181","Application Data"
"12.951341","172.18.0.2","54.38.73.16","TCP","68","36876 → 21002 [ACK] Seq=13489 Ack=207581 Win=5580 Len=0 TSval=1084525675 TSecr=2675280576"
"12.958848","172.18.0.2","54.38.73.16","TLSv1.2","611","Application Data"
"13.020170","54.38.73.16","172.18.0.2","TCP","68","21002 → 36876 [ACK] Seq=207581 Ack=14032 Win=1452 Len=0 TSval=2675280594 TSecr=1084525683"
"13.773715","54.38.73.16","172.18.0.2","TLSv1.2","611","Application Data"
"13.773735","54.38.73.16","172.18.0.2","TCP","611","[TCP Retransmission] 21002 → 36876 [PSH, ACK] Seq=207581 Ack=14032 Win=1452 Len=543 TSval=2675280779 TSecr=1084525683"
"13.773793","172.18.0.2","54.38.73.16","TCP","80","36876 → 21002 [ACK] Seq=14032 Ack=208124 Win=5608 Len=0 TSval=1084526498 TSecr=2675280779 SLE=207581 SRE=208124"
"13.774718","172.18.0.2","54.38.73.16","TLSv1.2","611","Application Data"
"13.798731","54.38.73.16","172.18.0.2","TCP","68","21002 → 36876 [ACK] Seq=208124 Ack=14575 Win=1452 Len=0 TSval=2675280788 TSecr=1084526499"
"14.388151","54.38.73.16","172.18.0.2","TLSv1.2","3695","Application Data"
"14.388198","172.18.0.2","54.38.73.16","TCP","68","36876 → 21002 [ACK] Seq=14575 Ack=211751 Win=5584 Len=0 TSval=1084527112 TSecr=2675280928"
"14.389331","54.38.73.16","172.18.0.2","TLSv1.2","2964","Application Data"
"14.389367","172.18.0.2","54.38.73.16","TCP","68","36876 → 21002 [ACK] Seq=14575 Ack=214647 Win=5596 Len=0 TSval=1084527113 TSecr=2675280936"
"14.411918","54.38.73.16","172.18.0.2","TLSv1.2","1342","Application Data"
"14.411937","172.18.0.2","54.38.73.16","TCP","68","36876 → 21002 [ACK] Seq=14575 Ack=215921 Win=5593 Len=0 TSval=1084527136 TSecr=2675280942"
"14.466335","54.38.73.16","172.18.0.2","TLSv1.2","1639","Application Data"
"14.466364","172.18.0.2","54.38.73.16","TCP","68","36876 → 21002 [ACK] Seq=14575 Ack=217492 Win=5601 Len=0 TSval=1084527190 TSecr=2675280955"
"14.472343","172.18.0.2","54.38.73.16","TLSv1.2","611","Application Data"
"14.496382","54.38.73.16","172.18.0.2","TCP","68","21002 → 36876 [ACK] Seq=217492 Ack=15118 Win=1452 Len=0 TSval=2675280963 TSecr=1084527196"
"14.959041","54.38.73.16","172.18.0.2","TLSv1.2","611","Application Data"
"14.959098","172.18.0.2","54.38.73.16","TCP","68","36876 → 21002 [ACK] Seq=15118 Ack=218035 Win=5608 Len=0 TSval=1084527683 TSecr=2675281077"
"14.960107","172.18.0.2","54.38.73.16","TLSv1.2","611","Application Data"
"14.983546","54.38.73.16","172.18.0.2","TCP","68","21002 → 36876 [ACK] Seq=218035 Ack=15661 Win=1452 Len=0 TSval=2675281084 TSecr=1084527684"
"15.618441","54.38.73.16","172.18.0.2","TLSv1.2","611","Application Data"
"15.662577","172.18.0.2","54.38.73.16","TCP","68","36876 → 21002 [ACK] Seq=15661 Ack=218578 Win=5612 Len=0 TSval=1084528387 TSecr=2675281236"
"15.925655","54.38.73.16","172.18.0.2","TCP","1516","[TCP segment of a reassembled PDU]"
"15.925719","172.18.0.2","54.38.73.16","TCP","68","36876 → 21002 [ACK] Seq=15661 Ack=220026 Win=5601 Len=0 TSval=1084528650 TSecr=2675281294"
"15.925906","54.38.73.16","172.18.0.2","TLSv1.2","2247","Application Data"
"15.925932","172.18.0.2","54.38.73.16","TCP","68","36876 → 21002 [ACK] Seq=15661 Ack=222205 Win=5599 Len=0 TSval=1084528650 TSecr=2675281294"
"15.925911","54.38.73.16","172.18.0.2","TCP","2964","[TCP segment of a reassembled PDU]"
"15.925957","172.18.0.2","54.38.73.16","TCP","68","36876 → 21002 [ACK] Seq=15661 Ack=225101 Win=5584 Len=0 TSval=1084528650 TSecr=2675281315"
"15.940536","54.38.73.16","172.18.0.2","TLSv1.2","1516","Application Data, Application Data"
"15.940568","172.18.0.2","54.38.73.16","TCP","68","36876 → 21002 [ACK] Seq=15661 Ack=226549 Win=5593 Len=0 TSval=1084528665 TSecr=2675281323"
"15.950644","54.38.73.16","172.18.0.2","TLSv1.2","5860","Application Data [TCP segment of a reassembled PDU]"
"15.950679","172.18.0.2","54.38.73.16","TCP","68","36876 → 21002 [ACK] Seq=15661 Ack=232341 Win=5581 Len=0 TSval=1084528675 TSecr=2675281326"
"15.960013","54.38.73.16","172.18.0.2","TCP","1516","21002 → 36876 [ACK] Seq=232341 Ack=15661 Win=1452 Len=1448 TSval=2675281329 TSecr=1084528650 [TCP segment of a reassembled PDU]"
"15.960044","172.18.0.2","54.38.73.16","TCP","68","36876 → 21002 [ACK] Seq=15661 Ack=233789 Win=5593 Len=0 TSval=1084528684 TSecr=2675281329"
"15.965161","54.38.73.16","172.18.0.2","TLSv1.2","1516","Application Data, Application Data"
"15.965193","172.18.0.2","54.38.73.16","TCP","68","36876 → 21002 [ACK] Seq=15661 Ack=235237 Win=5593 Len=0 TSval=1084528689 TSecr=2675281330"
"15.974832","54.38.73.16","172.18.0.2","TLSv1.2","3687","Application Data, Application Data"
"15.974867","172.18.0.2","54.38.73.16","TCP","68","36876 → 21002 [ACK] Seq=15661 Ack=238856 Win=5580 Len=0 TSval=1084528699 TSecr=2675281332"
"16.037573","54.38.73.16","172.18.0.2","TLSv1.2","3695","Application Data"
"16.037608","172.18.0.2","54.38.73.16","TCP","68","36876 → 21002 [ACK] Seq=15661 Ack=242483 Win=5580 Len=0 TSval=1084528762 TSecr=2675281348"
"16.048856","54.38.73.16","172.18.0.2","TCP","2964","[TCP segment of a reassembled PDU]"
"16.048889","172.18.0.2","54.38.73.16","TCP","68","36876 → 21002 [ACK] Seq=15661 Ack=245379 Win=5596 Len=0 TSval=1084528773 TSecr=2675281351"
"16.054533","02:42:09:5f:bf:77","","ARP","44","Who has 172.18.0.2? Tell 172.18.0.1"
"16.054584","02:42:ac:12:00:02","","ARP","44","172.18.0.2 is at 02:42:ac:12:00:02"
"16.062305","54.38.73.16","172.18.0.2","TLSv1.2","1342","Application Data, Application Data"
"16.062341","172.18.0.2","54.38.73.16","TCP","68","36876 → 21002 [ACK] Seq=15661 Ack=246653 Win=5593 Len=0 TSval=1084528786 TSecr=2675281354"
"16.062869","172.18.0.2","54.38.73.16","TLSv1.2","611","Application Data"
"16.081472","54.38.73.16","172.18.0.2","TCP","2964","[TCP segment of a reassembled PDU]"
"16.081507","172.18.0.2","54.38.73.16","TCP","68","36876 → 21002 [ACK] Seq=16204 Ack=249549 Win=5596 Len=0 TSval=1084528806 TSecr=2675281359"
"16.085701","54.38.73.16","172.18.0.2","TLSv1.2","799","Application Data"
"16.085737","172.18.0.2","54.38.73.16","TCP","68","36876 → 21002 [ACK] Seq=16204 Ack=250280 Win=5593 Len=0 TSval=1084528810 TSecr=2675281360"
"16.087344","54.38.73.16","172.18.0.2","TCP","68","21002 → 36876 [ACK] Seq=250280 Ack=16204 Win=1452 Len=0 TSval=2675281360 TSecr=1084528787"
"16.087388","172.18.0.2","54.38.73.16","TLSv1.2","611","Application Data"
"16.091318","54.38.73.16","172.18.0.2","TCP","2964","[TCP segment of a reassembled PDU]"
"16.091353","172.18.0.2","54.38.73.16","TCP","68","36876 → 21002 [ACK] Seq=16747 Ack=253176 Win=5596 Len=0 TSval=1084528815 TSecr=2675281361"
"16.109330","54.38.73.16","172.18.0.2","TLSv1.2","799","Application Data"
"16.109481","172.18.0.2","54.38.73.16","TCP","68","36876 → 21002 [ACK] Seq=16747 Ack=253907 Win=5612 Len=0 TSval=1084528834 TSecr=2675281366"
"16.125572","54.38.73.16","172.18.0.2","TCP","2964","[TCP segment of a reassembled PDU]"
"16.125747","172.18.0.2","54.38.73.16","TCP","68","36876 → 21002 [ACK] Seq=16747 Ack=256803 Win=5596 Len=0 TSval=1084528850 TSecr=2675281370"
"16.134028","54.38.73.16","172.18.0.2","TLSv1.2","285","Application Data"
"16.134176","172.18.0.2","54.38.73.16","TCP","68","36876 → 21002 [ACK] Seq=16747 Ack=257020 Win=5612 Len=0 TSval=1084528858 TSecr=2675281372"
"16.181056","54.38.73.16","172.18.0.2","TLSv1.2","3695","Application Data"
"16.181210","172.18.0.2","54.38.73.16","TCP","68","36876 → 21002 [ACK] Seq=16747 Ack=260647 Win=5584 Len=0 TSval=1084528905 TSecr=2675281384"
"16.213497","54.38.73.16","172.18.0.2","TLSv1.2","2153","Application Data"
"16.213531","172.18.0.2","54.38.73.16","TCP","68","36876 → 21002 [ACK] Seq=16747 Ack=262732 Win=5599 Len=0 TSval=1084528938 TSecr=2675281392"
"16.246932","54.38.73.16","172.18.0.2","TLSv1.2","3695","Application Data"
"16.247085","172.18.0.2","54.38.73.16","TCP","68","36876 → 21002 [ACK] Seq=16747 Ack=266359 Win=5580 Len=0 TSval=1084528971 TSecr=2675281400"
"16.257850","54.38.73.16","172.18.0.2","TCP","2964","[TCP segment of a reassembled PDU]"
"16.257884","172.18.0.2","54.38.73.16","TCP","68","36876 → 21002 [ACK] Seq=16747 Ack=269255 Win=5596 Len=0 TSval=1084528982 TSecr=2675281403"
"16.271735","54.38.73.16","172.18.0.2","TLSv1.2","1342","Application Data, Application Data"
"16.272193","172.18.0.2","54.38.73.16","TLSv1.2","611","Application Data"
"16.298850","54.38.73.16","172.18.0.2","TLSv1.2","1125","Application Data"
"16.342608","172.18.0.2","54.38.73.16","TCP","68","36876 → 21002 [ACK] Seq=17290 Ack=271586 Win=5612 Len=0 TSval=1084529067 TSecr=2675281413"
"16.365527","54.38.73.16","172.18.0.2","TCP","1516","[TCP segment of a reassembled PDU]"
"16.366809","54.38.73.16","172.18.0.2","TLSv1.2","1219","Application Data"
"16.366961","172.18.0.2","54.38.73.16","TCP","68","36876 → 21002 [ACK] Seq=17290 Ack=274185 Win=5612 Len=0 TSval=1084529091 TSecr=2675281430"
"16.387936","54.38.73.16","172.18.0.2","TCP","1516","[TCP segment of a reassembled PDU]"
"16.392682","54.38.73.16","172.18.0.2","TLSv1.2","1219","Application Data"
"16.392833","172.18.0.2","54.38.73.16","TCP","68","36876 → 21002 [ACK] Seq=17290 Ack=276784 Win=5612 Len=0 TSval=1084529117 TSecr=2675281435"
"16.399836","172.18.0.2","54.38.73.16","TLSv1.2","611","Application Data"
"16.460384","54.38.73.16","172.18.0.2","TCP","68","21002 → 36876 [ACK] Seq=276784 Ack=17833 Win=1452 Len=0 TSval=2675281454 TSecr=1084529124"
"17.157853","54.38.73.16","172.18.0.2","TLSv1.2","611","Application Data"
"17.157914","172.18.0.2","54.38.73.16","TCP","68","36876 → 21002 [ACK] Seq=17833 Ack=277327 Win=5608 Len=0 TSval=1084529882 TSecr=2675281596"
"17.158909","172.18.0.2","54.38.73.16","TLSv1.2","611","Application Data"
"17.183886","54.38.73.16","172.18.0.2","TCP","68","21002 → 36876 [ACK] Seq=277327 Ack=18376 Win=1452 Len=0 TSval=2675281634 TSecr=1084529883"
"17.771957","54.38.73.16","172.18.0.2","TLSv1.2","3695","Application Data"
"17.772023","172.18.0.2","54.38.73.16","TCP","68","36876 → 21002 [ACK] Seq=18376 Ack=280954 Win=5584 Len=0 TSval=1084530496 TSecr=2675281751"
"17.771962","54.38.73.16","172.18.0.2","TCP","2964","[TCP segment of a reassembled PDU]"
"17.772075","172.18.0.2","54.38.73.16","TCP","68","36876 → 21002 [ACK] Seq=18376 Ack=283850 Win=5566 Len=0 TSval=1084530496 TSecr=2675281756"
"17.771966","54.38.73.16","172.18.0.2","TLSv1.2","1516","Application Data [TCP segment of a reassembled PDU]"
"17.772089","172.18.0.2","54.38.73.16","TCP","68","36876 → 21002 [ACK] Seq=18376 Ack=285298 Win=5555 Len=0 TSval=1084530496 TSecr=2675281759"
"17.775832","54.38.73.16","172.18.0.2","TCP","1516","21002 → 36876 [ACK] Seq=285298 Ack=18376 Win=1452 Len=1448 TSval=2675281783 TSecr=1084529883 [TCP segment of a reassembled PDU]"
"17.775864","172.18.0.2","54.38.73.16","TCP","68","36876 → 21002 [ACK] Seq=18376 Ack=286746 Win=5593 Len=0 TSval=1084530500 TSecr=2675281783"
"17.798203","54.38.73.16","172.18.0.2","TLSv1.2","3130","Application Data, Application Data, Application Data"
"17.798235","172.18.0.2","54.38.73.16","TCP","68","36876 → 21002 [ACK] Seq=18376 Ack=289808 Win=5580 Len=0 TSval=1084530522 TSecr=2675281788"
"17.810038","54.38.73.16","172.18.0.2","TCP","2964","[TCP segment of a reassembled PDU]"
"17.810071","172.18.0.2","54.38.73.16","TCP","68","36876 → 21002 [ACK] Seq=18376 Ack=292704 Win=5596 Len=0 TSval=1084530534 TSecr=2675281791"
"17.817901","54.38.73.16","172.18.0.2","TLSv1.2","2964","Application Data [TCP segment of a reassembled PDU]"
"17.817934","172.18.0.2","54.38.73.16","TCP","68","36876 → 21002 [ACK] Seq=18376 Ack=295600 Win=5596 Len=0 TSval=1084530542 TSecr=2675281793"
"17.823791","54.38.73.16","172.18.0.2","TLSv1.2","2587","Application Data, Application Data"
"17.823825","172.18.0.2","54.38.73.16","TCP","68","36876 → 21002 [ACK] Seq=18376 Ack=298119 Win=5597 Len=0 TSval=1084530548 TSecr=2675281794"
"17.882221","54.38.73.16","172.18.0.2","TLSv1.2","3695","Application Data"
"17.882255","172.18.0.2","54.38.73.16","TCP","68","36876 → 21002 [ACK] Seq=18376 Ack=301746 Win=5580 Len=0 TSval=1084530606 TSecr=2675281809"
"17.882762","172.18.0.2","54.38.73.16","TLSv1.2","611","Application Data"
"17.894076","54.38.73.16","172.18.0.2","TCP","2964","[TCP segment of a reassembled PDU]"
"17.894227","172.18.0.2","54.38.73.16","TCP","68","36876 → 21002 [ACK] Seq=18919 Ack=304642 Win=5596 Len=0 TSval=1084530618 TSecr=2675281812"
"17.909178","54.38.73.16","172.18.0.2","TLSv1.2","799","Application Data"
"17.909188","54.38.73.16","172.18.0.2","TCP","68","21002 → 36876 [ACK] Seq=305373 Ack=18919 Win=1452 Len=0 TSval=2675281816 TSecr=1084530607"
"17.909644","172.18.0.2","54.38.73.16","TLSv1.2","611","Application Data"
"17.934979","54.38.73.16","172.18.0.2","TCP","68","21002 → 36876 [ACK] Seq=305373 Ack=19462 Win=1452 Len=0 TSval=2675281822 TSecr=1084530634"
"18.031057","54.38.73.16","172.18.0.2","TLSv1.2","3695","Application Data"
"18.031218","172.18.0.2","54.38.73.16","TCP","68","36876 → 21002 [ACK] Seq=19462 Ack=309000 Win=5584 Len=0 TSval=1084530755 TSecr=2675281846"
"18.040860","54.38.73.16","172.18.0.2","TCP","2964","[TCP segment of a reassembled PDU]"
"18.040892","172.18.0.2","54.38.73.16","TCP","68","36876 → 21002 [ACK] Seq=19462 Ack=311896 Win=5596 Len=0 TSval=1084530765 TSecr=2675281849"
"18.050833","54.38.73.16","172.18.0.2","TLSv1.2","2964","Application Data [TCP segment of a reassembled PDU]"
"18.050865","172.18.0.2","54.38.73.16","TCP","68","36876 → 21002 [ACK] Seq=19462 Ack=314792 Win=5596 Len=0 TSval=1084530775 TSecr=2675281851"
"18.055805","54.38.73.16","172.18.0.2","TLSv1.2","3615","Application Data, Application Data"
"18.055954","172.18.0.2","54.38.73.16","TCP","68","36876 → 21002 [ACK] Seq=19462 Ack=318339 Win=5580 Len=0 TSval=1084530780 TSecr=2675281852"
"18.123163","54.38.73.16","172.18.0.2","TLSv1.2","1639","Application Data"
"18.123198","172.18.0.2","54.38.73.16","TCP","68","36876 → 21002 [ACK] Seq=19462 Ack=319910 Win=5601 Len=0 TSval=1084530847 TSecr=2675281869"
"18.380388","54.38.73.16","172.18.0.2","TLSv1.2","3695","Application Data"
"18.380532","172.18.0.2","54.38.73.16","TCP","68","36876 → 21002 [ACK] Seq=19462 Ack=323537 Win=5580 Len=0 TSval=1084531105 TSecr=2675281933"
"18.434157","54.38.73.16","172.18.0.2","TLSv1.2","611","Application Data"
"18.465047","54.38.73.16","172.18.0.2","TCP","1516","[TCP segment of a reassembled PDU]"
"18.465064","172.18.0.2","54.38.73.16","TCP","68","36876 → 21002 [ACK] Seq=19462 Ack=325528 Win=5593 Len=0 TSval=1084531189 TSecr=2675281947"
"18.489390","54.38.73.16","172.18.0.2","TLSv1.2","1219","Application Data"
"18.530572","172.18.0.2","54.38.73.16","TCP","68","36876 → 21002 [ACK] Seq=19462 Ack=326679 Win=5612 Len=0 TSval=1084531255 TSecr=2675281961"
"18.543845","54.38.73.16","172.18.0.2","TLSv1.2","7308","Application Data"
"18.543898","172.18.0.2","54.38.73.16","TCP","68","36876 → 21002 [ACK] Seq=19462 Ack=333919 Win=5565 Len=0 TSval=1084531268 TSecr=2675281974"
"18.544282","172.18.0.2","54.38.73.16","TLSv1.2","611","Application Data"
"18.554700","54.38.73.16","172.18.0.2","TLSv1.2","1516","Application Data [TCP segment of a reassembled PDU]"
"18.554729","172.18.0.2","54.38.73.16","TCP","68","36876 → 21002 [ACK] Seq=20005 Ack=335367 Win=5593 Len=0 TSval=1084531279 TSecr=2675281977"
"18.568405","54.38.73.16","172.18.0.2","TLSv1.2","3318","Application Data, Application Data"
"18.568434","172.18.0.2","54.38.73.16","TCP","68","36876 → 21002 [ACK] Seq=20005 Ack=338617 Win=5580 Len=0 TSval=1084531293 TSecr=2675281981"
"18.568983","54.38.73.16","172.18.0.2","TCP","68","21002 → 36876 [ACK] Seq=338617 Ack=20005 Win=1452 Len=0 TSval=2675281981 TSecr=1084531268"
"18.639841","54.38.73.16","172.18.0.2","TLSv1.2","2667","Application Data"
"18.639871","172.18.0.2","54.38.73.16","TCP","68","36876 → 21002 [ACK] Seq=20005 Ack=341216 Win=5597 Len=0 TSval=1084531364 TSecr=2675281998"
"18.764500","54.38.73.16","172.18.0.2","TLSv1.2","3695","Application Data"
"18.764532","172.18.0.2","54.38.73.16","TCP","68","36876 → 21002 [ACK] Seq=20005 Ack=344843 Win=5580 Len=0 TSval=1084531489 TSecr=2675282030"
"18.776831","54.38.73.16","172.18.0.2","TCP","2964","[TCP segment of a reassembled PDU]"
"18.776862","172.18.0.2","54.38.73.16","TCP","68","36876 → 21002 [ACK] Seq=20005 Ack=347739 Win=5596 Len=0 TSval=1084531501 TSecr=2675282032"
"18.790162","54.38.73.16","172.18.0.2","TLSv1.2","1342","Application Data, Application Data"
"18.790218","172.18.0.2","54.38.73.16","TCP","68","36876 → 21002 [ACK] Seq=20005 Ack=349013 Win=5593 Len=0 TSval=1084531514 TSecr=2675282036"
"18.797943","54.38.73.16","172.18.0.2","TCP","2964","[TCP segment of a reassembled PDU]"
"18.798019","172.18.0.2","54.38.73.16","TCP","68","36876 → 21002 [ACK] Seq=20005 Ack=351909 Win=5596 Len=0 TSval=1084531522 TSecr=2675282038"
"18.815082","54.38.73.16","172.18.0.2","TLSv1.2","1342","Application Data, Application Data"
"18.815132","172.18.0.2","54.38.73.16","TCP","68","36876 → 21002 [ACK] Seq=20005 Ack=353183 Win=5593 Len=0 TSval=1084531539 TSecr=2675282042"
"18.815736","172.18.0.2","54.38.73.16","TLSv1.2","611","Application Data"
"18.840602","54.38.73.16","172.18.0.2","TCP","68","21002 → 36876 [ACK] Seq=353183 Ack=20548 Win=1452 Len=0 TSval=2675282049 TSecr=1084531540"
"18.900880","54.38.73.16","172.18.0.2","TLSv1.2","3181","Application Data"
"18.900908","172.18.0.2","54.38.73.16","TCP","68","36876 → 21002 [ACK] Seq=20548 Ack=356296 Win=5580 Len=0 TSval=1084531625 TSecr=2675282063"
"18.901312","172.18.0.2","54.38.73.16","TLSv1.2","611","Application Data"
"18.926312","54.38.73.16","172.18.0.2","TCP","68","21002 → 36876 [ACK] Seq=356296 Ack=21091 Win=1452 Len=0 TSval=2675282070 TSecr=1084531625"
"18.947366","54.38.73.16","172.18.0.2","TLSv1.2","2667","Application Data"
"18.947504","172.18.0.2","54.38.73.16","TCP","68","36876 → 21002 [ACK] Seq=21091 Ack=358895 Win=5597 Len=0 TSval=1084531672 TSecr=2675282075"
"19.104635","54.38.73.16","172.18.0.2","TLSv1.2","3695","Application Data"
"19.104790","172.18.0.2","54.38.73.16","TCP","68","36876 → 21002 [ACK] Seq=21091 Ack=362522 Win=5580 Len=0 TSval=1084531829 TSecr=2675282103"
"19.115799","172.18.0.2","54.38.73.16","TLSv1.2","611","Application Data"
"19.119660","54.38.73.16","172.18.0.2","TLSv1.2","799","[TCP Spurious Retransmission] , Ignored Unknown Record"
"19.119688","172.18.0.2","54.38.73.16","TCP","80","[TCP Dup ACK 388#1] 36876 → 21002 [ACK] Seq=21634 Ack=362522 Win=5612 Len=0 TSval=1084531844 TSecr=2675282119 SLE=361791 SRE=362522"
"19.179206","54.38.73.16","172.18.0.2","TCP","68","21002 → 36876 [ACK] Seq=362522 Ack=21634 Win=1452 Len=0 TSval=2675282134 TSecr=1084531840"
"19.918452","54.38.73.16","172.18.0.2","TLSv1.2","611","Application Data"
"19.918504","172.18.0.2","54.38.73.16","TCP","68","36876 → 21002 [ACK] Seq=21634 Ack=363065 Win=5608 Len=0 TSval=1084532643 TSecr=2675282308"
"19.919264","172.18.0.2","54.38.73.16","TLSv1.2","611","Application Data"
"19.944138","54.38.73.16","172.18.0.2","TCP","68","21002 → 36876 [ACK] Seq=363065 Ack=22177 Win=1452 Len=0 TSval=2675282324 TSecr=1084532643"
"20.540631","54.38.73.16","172.18.0.2","TLSv1.2","799","[TCP Previous segment not captured] , Ignored Unknown Record"
"20.540682","172.18.0.2","54.38.73.16","TCP","80","[TCP Dup ACK 394#1] 36876 → 21002 [ACK] Seq=22177 Ack=363065 Win=5612 Len=0 TSval=1084533265 TSecr=2675282324 SLE=365961 SRE=366692"
"20.540649","54.38.73.16","172.18.0.2","TCP","3695","[TCP Retransmission] 21002 → 36876 [PSH, ACK] Seq=363065 Ack=22177 Win=1452 Len=3627 TSval=2675282453 TSecr=1084532643"
"20.540713","172.18.0.2","54.38.73.16","TCP","80","36876 → 21002 [ACK] Seq=22177 Ack=366692 Win=5584 Len=0 TSval=1084533265 TSecr=2675282453 SLE=365961 SRE=366692"
"20.600357","54.38.73.16","172.18.0.2","TLSv1.2","3695","Application Data"
"20.600390","172.18.0.2","54.38.73.16","TCP","68","36876 → 21002 [ACK] Seq=22177 Ack=370319 Win=5580 Len=0 TSval=1084533324 TSecr=2675282488"
"20.610329","54.38.73.16","172.18.0.2","TCP","2964","[TCP segment of a reassembled PDU]"
"20.610361","172.18.0.2","54.38.73.16","TCP","68","36876 → 21002 [ACK] Seq=22177 Ack=373215 Win=5596 Len=0 TSval=1084533334 TSecr=2675282491"
"20.623763","54.38.73.16","172.18.0.2","TLSv1.2","1342","Application Data, Application Data"
"20.623796","172.18.0.2","54.38.73.16","TCP","68","36876 → 21002 [ACK] Seq=22177 Ack=374489 Win=5593 Len=0 TSval=1084533348 TSecr=2675282495"
"20.641266","54.38.73.16","172.18.0.2","TCP","1516","[TCP segment of a reassembled PDU]"
"20.641295","172.18.0.2","54.38.73.16","TCP","68","36876 → 21002 [ACK] Seq=22177 Ack=375937 Win=5593 Len=0 TSval=1084533365 TSecr=2675282499"
"20.647742","54.38.73.16","172.18.0.2","TLSv1.2","705","Application Data"
"20.647774","172.18.0.2","54.38.73.16","TCP","68","36876 → 21002 [ACK] Seq=22177 Ack=376574 Win=5593 Len=0 TSval=1084533372 TSecr=2675282501"
"20.746111","54.38.73.16","172.18.0.2","TLSv1.2","3695","Application Data"
"20.746143","172.18.0.2","54.38.73.16","TCP","68","36876 → 21002 [ACK] Seq=22177 Ack=380201 Win=5580 Len=0 TSval=1084533470 TSecr=2675282525"
"20.791155","54.38.73.16","172.18.0.2","TLSv1.2","611","Application Data"
"20.791191","172.18.0.2","54.38.73.16","TCP","68","36876 → 21002 [ACK] Seq=22177 Ack=380744 Win=5593 Len=0 TSval=1084533515 TSecr=2675282536"
"20.881566","54.38.73.16","172.18.0.2","TLSv1.2","3181","Application Data"
"20.881598","172.18.0.2","54.38.73.16","TCP","68","36876 → 21002 [ACK] Seq=22177 Ack=383857 Win=5580 Len=0 TSval=1084533606 TSecr=2675282559"
"20.904969","54.38.73.16","172.18.0.2","TCP","1516","[TCP segment of a reassembled PDU]"
"20.905001","172.18.0.2","54.38.73.16","TCP","68","36876 → 21002 [ACK] Seq=22177 Ack=385305 Win=5593 Len=0 TSval=1084533629 TSecr=2675282565"
"20.905163","54.38.73.16","172.18.0.2","TLSv1.2","1219","Application Data"
"20.905192","172.18.0.2","54.38.73.16","TCP","68","36876 → 21002 [ACK] Seq=22177 Ack=386456 Win=5593 Len=0 TSval=1084533629 TSecr=2675282565"
"20.967937","54.38.73.16","172.18.0.2","TLSv1.2","1639","Application Data"
"20.967967","172.18.0.2","54.38.73.16","TCP","68","36876 → 21002 [ACK] Seq=22177 Ack=388027 Win=5601 Len=0 TSval=1084533692 TSecr=2675282580"
"21.039804","54.38.73.16","172.18.0.2","TLSv1.2","3181","Application Data"
"21.039845","172.18.0.2","54.38.73.16","TCP","68","36876 → 21002 [ACK] Seq=22177 Ack=391140 Win=5580 Len=0 TSval=1084533764 TSecr=2675282598"
"21.040385","172.18.0.2","54.38.73.16","TLSv1.2","611","Application Data"
"21.063689","54.38.73.16","172.18.0.2","TCP","68","21002 → 36876 [ACK] Seq=391140 Ack=22720 Win=1452 Len=0 TSval=2675282605 TSecr=1084533764"
"21.123291","54.38.73.16","172.18.0.2","TLSv1.2","3695","Application Data"
"21.123328","172.18.0.2","54.38.73.16","TCP","68","36876 → 21002 [ACK] Seq=22720 Ack=394767 Win=5584 Len=0 TSval=1084533847 TSecr=2675282619"
"21.174263","54.38.73.16","172.18.0.2","TLSv1.2","611","Application Data"
"21.174309","172.18.0.2","54.38.73.16","TCP","68","36876 → 21002 [ACK] Seq=22720 Ack=395310 Win=5593 Len=0 TSval=1084533898 TSecr=2675282632"
"21.205791","54.38.73.16","172.18.0.2","TLSv1.2","3181","Application Data"
"21.205945","172.18.0.2","54.38.73.16","TCP","68","36876 → 21002 [ACK] Seq=22720 Ack=398423 Win=5580 Len=0 TSval=1084533930 TSecr=2675282640"
"21.271943","54.38.73.16","172.18.0.2","TLSv1.2","3695","Application Data"
"21.272001","172.18.0.2","54.38.73.16","TCP","68","36876 → 21002 [ACK] Seq=22720 Ack=402050 Win=5580 Len=0 TSval=1084533996 TSecr=2675282655"
"21.300536","54.38.73.16","172.18.0.2","TLSv1.2","2153","Application Data"
"21.300594","172.18.0.2","54.38.73.16","TCP","68","36876 → 21002 [ACK] Seq=22720 Ack=404135 Win=5599 Len=0 TSval=1084534025 TSecr=2675282664"
"21.396371","54.38.73.16","172.18.0.2","TLSv1.2","1639","Application Data"
"21.396414","172.18.0.2","54.38.73.16","TCP","68","36876 → 21002 [ACK] Seq=22720 Ack=405706 Win=5601 Len=0 TSval=1084534121 TSecr=2675282687"
"21.396827","172.18.0.2","54.38.73.16","TLSv1.2","611","Application Data"
"21.405033","54.38.73.16","172.18.0.2","TLSv1.2","4412","Application Data"
"21.405164","172.18.0.2","54.38.73.16","TCP","68","36876 → 21002 [ACK] Seq=23263 Ack=410050 Win=5580 Len=0 TSval=1084534129 TSecr=2675282690"
"21.420177","54.38.73.16","172.18.0.2","TCP","68","[TCP Previous segment not captured] 21002 → 36876 [ACK] Seq=412946 Ack=23263 Win=1452 Len=0 TSval=2675282694 TSecr=1084534121"
"21.420194","54.38.73.16","172.18.0.2","TCP","2964","[TCP Retransmission] 21002 → 36876 [ACK] Seq=410050 Ack=22720 Win=1452 Len=2896 TSval=2675282694 TSecr=1084534121"
"21.420237","172.18.0.2","54.38.73.16","TCP","68","36876 → 21002 [ACK] Seq=23263 Ack=412946 Win=5596 Len=0 TSval=1084534144 TSecr=2675282694"
"21.428793","54.38.73.16","172.18.0.2","TCP","82","21002 → 36876 [PSH, ACK] Seq=412946 Ack=23263 Win=1452 Len=14 TSval=2675282696 TSecr=1084534129 [TCP segment of a reassembled PDU]"
"21.470581","172.18.0.2","54.38.73.16","TCP","68","36876 → 21002 [ACK] Seq=23263 Ack=412960 Win=5612 Len=0 TSval=1084534195 TSecr=2675282696"
"21.520432","54.38.73.16","172.18.0.2","TLSv1.2","2667","Application Data"
"21.520628","172.18.0.2","54.38.73.16","TCP","68","36876 → 21002 [ACK] Seq=23263 Ack=415559 Win=5597 Len=0 TSval=1084534245 TSecr=2675282719"
"21.521057","172.18.0.2","54.38.73.16","TLSv1.2","611","Application Data"
"21.583505","54.38.73.16","172.18.0.2","TCP","68","21002 → 36876 [ACK] Seq=415559 Ack=23806 Win=1452 Len=0 TSval=2675282735 TSecr=1084534245"
"21.606928","54.38.73.16","172.18.0.2","TLSv1.2","3695","Application Data"
"21.607103","172.18.0.2","54.38.73.16","TCP","68","36876 → 21002 [ACK] Seq=23806 Ack=419186 Win=5584 Len=0 TSval=1084534331 TSecr=2675282740"
"22.069179","54.38.73.16","172.18.0.2","TLSv1.2","3695","Application Data"
"22.069223","172.18.0.2","54.38.73.16","TCP","68","36876 → 21002 [ACK] Seq=23806 Ack=422813 Win=5591 Len=0 TSval=1084534793 TSecr=2675282793"
"22.069183","54.38.73.16","172.18.0.2","TCP","2964","[TCP segment of a reassembled PDU]"
"22.069238","172.18.0.2","54.38.73.16","TCP","68","36876 → 21002 [ACK] Seq=23806 Ack=425709 Win=5576 Len=0 TSval=1084534793 TSecr=2675282808"
"22.069188","54.38.73.16","172.18.0.2","TLSv1.2","1516","Application Data [TCP segment of a reassembled PDU]"
"22.069246","172.18.0.2","54.38.73.16","TCP","68","36876 → 21002 [ACK] Seq=23806 Ack=427157 Win=5569 Len=0 TSval=1084534793 TSecr=2675282824"
"22.093528","54.38.73.16","172.18.0.2","TLSv1.2","7177","Application Data, Application Data, Application Data, Application Data"
"22.093570","172.18.0.2","54.38.73.16","TCP","68","36876 → 21002 [ACK] Seq=23806 Ack=434266 Win=5565 Len=0 TSval=1084534818 TSecr=2675282862"
"22.117273","54.38.73.16","172.18.0.2","TLSv1.2","5266","Application Data, Application Data"
"22.117308","172.18.0.2","54.38.73.16","TCP","68","36876 → 21002 [ACK] Seq=23806 Ack=439464 Win=5583 Len=0 TSval=1084534841 TSecr=2675282868"
"22.127236","54.38.73.16","172.18.0.2","TCP","1516","[TCP segment of a reassembled PDU]"
"22.127264","172.18.0.2","54.38.73.16","TCP","68","36876 → 21002 [ACK] Seq=23806 Ack=440912 Win=5593 Len=0 TSval=1084534851 TSecr=2675282870"
"22.141221","54.38.73.16","172.18.0.2","TLSv1.2","1733","Application Data"
"22.141250","172.18.0.2","54.38.73.16","TCP","68","36876 → 21002 [ACK] Seq=23806 Ack=442577 Win=5601 Len=0 TSval=1084534865 TSecr=2675282874"
"22.141886","172.18.0.2","54.38.73.16","TLSv1.2","611","Application Data"
"22.166811","54.38.73.16","172.18.0.2","TCP","68","21002 → 36876 [ACK] Seq=442577 Ack=24349 Win=1452 Len=0 TSval=2675282880 TSecr=1084534866"
"22.166853","172.18.0.2","54.38.73.16","TLSv1.2","611","Application Data"
"22.190359","54.38.73.16","172.18.0.2","TCP","68","21002 → 36876 [ACK] Seq=442577 Ack=24892 Win=1452 Len=0 TSval=2675282886 TSecr=1084534891"
"23.302933","54.38.73.16","172.18.0.2","TLSv1.2","611","Application Data"
"23.302993","172.18.0.2","54.38.73.16","TCP","68","36876 → 21002 [ACK] Seq=24892 Ack=443120 Win=5608 Len=0 TSval=1084536027 TSecr=2675283147"
"23.303995","172.18.0.2","54.38.73.16","TLSv1.2","611","Application Data"
"23.328560","54.38.73.16","172.18.0.2","TCP","68","21002 → 36876 [ACK] Seq=443120 Ack=25435 Win=1452 Len=0 TSval=2675283171 TSecr=1084536028"
"23.809988","54.38.73.16","172.18.0.2","TCP","1516","[TCP segment of a reassembled PDU]"
"23.810137","54.38.73.16","172.18.0.2","TLSv1.2","2247","Application Data"
"23.810181","172.18.0.2","54.38.73.16","TCP","68","36876 → 21002 [ACK] Seq=25435 Ack=446747 Win=5612 Len=0 TSval=1084536534 TSecr=2675283273"
"23.877301","54.38.73.16","172.18.0.2","TLSv1.2","3695","Application Data"
"23.877484","172.18.0.2","54.38.73.16","TCP","68","36876 → 21002 [ACK] Seq=25435 Ack=450374 Win=5584 Len=0 TSval=1084536602 TSecr=2675283307"
"23.890242","54.38.73.16","172.18.0.2","TCP","1516","[TCP segment of a reassembled PDU]"
"23.890714","54.38.73.16","172.18.0.2","TCP","1516","21002 → 36876 [ACK] Seq=451822 Ack=25435 Win=1452 Len=1448 TSval=2675283311 TSecr=1084536534 [TCP segment of a reassembled PDU]"
"23.890737","172.18.0.2","54.38.73.16","TCP","68","36876 → 21002 [ACK] Seq=25435 Ack=453270 Win=5593 Len=0 TSval=1084536615 TSecr=2675283311"
"23.901730","54.38.73.16","172.18.0.2","TLSv1.2","2964","Application Data [TCP segment of a reassembled PDU]"
"23.901758","172.18.0.2","54.38.73.16","TCP","68","36876 → 21002 [ACK] Seq=25435 Ack=456166 Win=5596 Len=0 TSval=1084536626 TSecr=2675283314"
"23.912749","54.38.73.16","172.18.0.2","TCP","1516","21002 → 36876 [ACK] Seq=456166 Ack=25435 Win=1452 Len=1448 TSval=2675283317 TSecr=1084536602 [TCP segment of a reassembled PDU]"
"23.914275","54.38.73.16","172.18.0.2","TLSv1.2","2196","Application Data, Application Data, Application Data"
"23.914300","172.18.0.2","54.38.73.16","TCP","68","36876 → 21002 [ACK] Seq=25435 Ack=459742 Win=5599 Len=0 TSval=1084536638 TSecr=2675283317"
"23.915135","172.18.0.2","54.38.73.16","TLSv1.2","611","Application Data"
"23.941227","54.38.73.16","172.18.0.2","TCP","68","21002 → 36876 [ACK] Seq=459742 Ack=25978 Win=1452 Len=0 TSval=2675283324 TSecr=1084536639"
"24.040143","54.38.73.16","172.18.0.2","TLSv1.2","3695","Application Data"
"24.040341","172.18.0.2","54.38.73.16","TCP","68","36876 → 21002 [ACK] Seq=25978 Ack=463369 Win=5580 Len=0 TSval=1084536764 TSecr=2675283348"
"24.071492","54.38.73.16","172.18.0.2","TLSv1.2","3695","Application Data"
"24.071528","172.18.0.2","54.38.73.16","TCP","68","36876 → 21002 [ACK] Seq=25978 Ack=466996 Win=5580 Len=0 TSval=1084536796 TSecr=2675283356"
"24.124495","54.38.73.16","172.18.0.2","TLSv1.2","3695","Application Data"
"24.124542","172.18.0.2","54.38.73.16","TCP","68","36876 → 21002 [ACK] Seq=25978 Ack=470623 Win=5580 Len=0 TSval=1084536849 TSecr=2675283370"
"24.124984","172.18.0.2","54.38.73.16","TLSv1.2","611","Application Data"
"24.149589","54.38.73.16","172.18.0.2","TLSv1.2","611","Application Data"
"24.149599","54.38.73.16","172.18.0.2","TCP","68","21002 → 36876 [ACK] Seq=471166 Ack=26521 Win=1452 Len=0 TSval=2675283376 TSecr=1084536849"
"24.190501","172.18.0.2","54.38.73.16","TCP","68","36876 → 21002 [ACK] Seq=26521 Ack=471166 Win=5612 Len=0 TSval=1084536915 TSecr=2675283376"
"24.214357","54.38.73.16","172.18.0.2","TCP","2964","[TCP segment of a reassembled PDU]"
"24.214389","172.18.0.2","54.38.73.16","TCP","68","36876 → 21002 [ACK] Seq=26521 Ack=474062 Win=5596 Len=0 TSval=1084536938 TSecr=2675283392"
"24.214666","54.38.73.16","172.18.0.2","TLSv1.2","799","Application Data"
"24.214705","172.18.0.2","54.38.73.16","TCP","68","36876 → 21002 [ACK] Seq=26521 Ack=474793 Win=5593 Len=0 TSval=1084536939 TSecr=2675283392"
"24.232934","54.38.73.16","172.18.0.2","TCP","1516","[TCP segment of a reassembled PDU]"
"24.233003","172.18.0.2","54.38.73.16","TCP","68","36876 → 21002 [ACK] Seq=26521 Ack=476241 Win=5593 Len=0 TSval=1084536957 TSecr=2675283397"
"24.238829","54.38.73.16","172.18.0.2","TLSv1.2","705","Application Data"
"24.238863","172.18.0.2","54.38.73.16","TCP","68","36876 → 21002 [ACK] Seq=26521 Ack=476878 Win=5593 Len=0 TSval=1084536963 TSecr=2675283398"
"24.297104","54.38.73.16","172.18.0.2","TCP","1516","[TCP segment of a reassembled PDU]"
"24.297137","172.18.0.2","54.38.73.16","TCP","68","36876 → 21002 [ACK] Seq=26521 Ack=478326 Win=5593 Len=0 TSval=1084537021 TSecr=2675283413"
"24.298441","54.38.73.16","172.18.0.2","TLSv1.2","2247","Application Data"
"24.298472","172.18.0.2","54.38.73.16","TCP","68","36876 → 21002 [ACK] Seq=26521 Ack=480505 Win=5599 Len=0 TSval=1084537023 TSecr=2675283413"
"24.353287","54.38.73.16","172.18.0.2","TLSv1.2","611","Application Data"
"24.353434","172.18.0.2","54.38.73.16","TCP","68","36876 → 21002 [ACK] Seq=26521 Ack=481048 Win=5612 Len=0 TSval=1084537078 TSecr=2675283427"
"24.384566","54.38.73.16","172.18.0.2","TLSv1.2","3695","Application Data"
"24.384702","172.18.0.2","54.38.73.16","TCP","68","36876 → 21002 [ACK] Seq=26521 Ack=484675 Win=5584 Len=0 TSval=1084537109 TSecr=2675283435"
"24.396005","54.38.73.16","172.18.0.2","TCP","2964","[TCP segment of a reassembled PDU]"
"24.396037","172.18.0.2","54.38.73.16","TCP","68","36876 → 21002 [ACK] Seq=26521 Ack=487571 Win=5596 Len=0 TSval=1084537120 TSecr=2675283438"
"24.409699","54.38.73.16","172.18.0.2","TLSv1.2","1342","Application Data, Application Data"
"24.410157","172.18.0.2","54.38.73.16","TCP","68","36876 → 21002 [ACK] Seq=26521 Ack=488845 Win=5612 Len=0 TSval=1084537134 TSecr=2675283441"
"24.458940","54.38.73.16","172.18.0.2","TLSv1.2","1125","Application Data"
"24.459096","172.18.0.2","54.38.73.16","TCP","68","36876 → 21002 [ACK] Seq=26521 Ack=489902 Win=5612 Len=0 TSval=1084537183 TSecr=2675283453"
"24.469979","54.38.73.16","172.18.0.2","TCP","1516","[TCP segment of a reassembled PDU]"
"24.483489","54.38.73.16","172.18.0.2","TLSv1.2","1219","Application Data"
"24.483623","172.18.0.2","54.38.73.16","TCP","68","36876 → 21002 [ACK] Seq=26521 Ack=492501 Win=5612 Len=0 TSval=1084537208 TSecr=2675283456"
"24.493490","172.18.0.2","54.38.73.16","TLSv1.2","611","Application Data"
"24.517054","54.38.73.16","172.18.0.2","TCP","68","21002 → 36876 [ACK] Seq=492501 Ack=27064 Win=1452 Len=0 TSval=2675283468 TSecr=1084537218"
"25.146392","54.38.73.16","172.18.0.2","TLSv1.2","611","Application Data"
"25.146478","172.18.0.2","54.38.73.16","TCP","68","36876 → 21002 [ACK] Seq=27064 Ack=493044 Win=5608 Len=0 TSval=1084537871 TSecr=2675283605"
"25.147567","172.18.0.2","54.38.73.16","TLSv1.2","611","Application Data"
"25.170855","54.38.73.16","172.18.0.2","TCP","68","21002 → 36876 [ACK] Seq=493044 Ack=27607 Win=1452 Len=0 TSval=2675283631 TSecr=1084537872"
"25.756828","54.38.73.16","172.18.0.2","TLSv1.2","611","[TCP Previous segment not captured] , Application Data"
"25.756892","172.18.0.2","54.38.73.16","TCP","80","[TCP Dup ACK 528#1] 36876 → 21002 [ACK] Seq=27607 Ack=493044 Win=5612 Len=0 TSval=1084538481 TSecr=2675283631 SLE=496671 SRE=497214"
"25.756850","54.38.73.16","172.18.0.2","TCP","3695","[TCP Out-Of-Order] 21002 → 36876 [PSH, ACK] Seq=493044 Ack=27607 Win=1452 Len=3627 TSval=2675283753 TSecr=1084537872"
"25.756931","172.18.0.2","54.38.73.16","TCP","68","36876 → 21002 [ACK] Seq=27607 Ack=497214 Win=5580 Len=0 TSval=1084538481 TSecr=2675283753"
"25.756855","54.38.73.16","172.18.0.2","TCP","1516","[TCP segment of a reassembled PDU]"
"25.756942","172.18.0.2","54.38.73.16","TCP","68","36876 → 21002 [ACK] Seq=27607 Ack=498662 Win=5569 Len=0 TSval=1084538481 TSecr=2675283774"
"25.781150","54.38.73.16","172.18.0.2","TLSv1.2","2790","Application Data, Application Data"
"25.781187","172.18.0.2","54.38.73.16","TCP","68","36876 → 21002 [ACK] Seq=27607 Ack=501384 Win=5596 Len=0 TSval=1084538505 TSecr=2675283784"
"25.805930","54.38.73.16","172.18.0.2","TLSv1.2","2667","Application Data"
"25.805968","172.18.0.2","54.38.73.16","TCP","68","36876 → 21002 [ACK] Seq=27607 Ack=503983 Win=5597 Len=0 TSval=1084538530 TSecr=2675283790"
"25.816977","54.38.73.16","172.18.0.2","TLSv1.2","7308","Application Data"
"25.817022","172.18.0.2","54.38.73.16","TCP","68","36876 → 21002 [ACK] Seq=27607 Ack=511223 Win=5565 Len=0 TSval=1084538541 TSecr=2675283792"
"25.829258","54.38.73.16","172.18.0.2","TLSv1.2","2964","Application Data, Application Data"
"25.829294","172.18.0.2","54.38.73.16","TCP","68","36876 → 21002 [ACK] Seq=27607 Ack=514119 Win=5596 Len=0 TSval=1084538553 TSecr=2675283796"
"25.829952","172.18.0.2","54.38.73.16","TLSv1.2","611","Application Data"
"25.841544","54.38.73.16","172.18.0.2","TLSv1.2","842","Application Data"
"25.854873","54.38.73.16","172.18.0.2","TCP","68","21002 → 36876 [ACK] Seq=514893 Ack=28150 Win=1452 Len=0 TSval=2675283802 TSecr=1084538554"
"25.882596","172.18.0.2","54.38.73.16","TCP","68","36876 → 21002 [ACK] Seq=28150 Ack=514893 Win=5612 Len=0 TSval=1084538607 TSecr=2675283799"
"25.975899","54.38.73.16","172.18.0.2","TLSv1.2","3695","Application Data"
"25.975960","172.18.0.2","54.38.73.16","TCP","68","36876 → 21002 [ACK] Seq=28150 Ack=518520 Win=5584 Len=0 TSval=1084538700 TSecr=2675283832"
"25.984780","54.38.73.16","172.18.0.2","TCP","1516","[TCP segment of a reassembled PDU]"
"25.984817","172.18.0.2","54.38.73.16","TCP","68","36876 → 21002 [ACK] Seq=28150 Ack=519968 Win=5593 Len=0 TSval=1084538709 TSecr=2675283835"
"26.000062","54.38.73.16","172.18.0.2","TLSv1.2","191","Application Data"
"26.000104","172.18.0.2","54.38.73.16","TCP","68","36876 → 21002 [ACK] Seq=28150 Ack=520091 Win=5593 Len=0 TSval=1084538724 TSecr=2675283839"
"26.000540","172.18.0.2","54.38.73.16","TLSv1.2","611","Application Data"
"26.023741","54.38.73.16","172.18.0.2","TCP","68","21002 → 36876 [ACK] Seq=520091 Ack=28693 Win=1452 Len=0 TSval=2675283845 TSecr=1084538725"
"26.040179","54.38.73.16","172.18.0.2","TLSv1.2","3695","Application Data"
"26.040216","172.18.0.2","54.38.73.16","TCP","68","36876 → 21002 [ACK] Seq=28693 Ack=523718 Win=5584 Len=0 TSval=1084538764 TSecr=2675283848"
"26.060788","54.38.73.16","172.18.0.2","TLSv1.2","2964","Application Data"
"26.060825","172.18.0.2","54.38.73.16","TCP","68","36876 → 21002 [ACK] Seq=28693 Ack=526614 Win=5596 Len=0 TSval=1084538785 TSecr=2675283854"
"26.064699","54.38.73.16","172.18.0.2","TLSv1.2","314","Application Data"
"26.064741","172.18.0.2","54.38.73.16","TCP","68","36876 → 21002 [ACK] Seq=28693 Ack=526860 Win=5595 Len=0 TSval=1084538789 TSecr=2675283855"
"26.115627","54.38.73.16","172.18.0.2","TLSv1.2","1125","Application Data"
"26.115669","172.18.0.2","54.38.73.16","TCP","68","36876 → 21002 [ACK] Seq=28693 Ack=527917 Win=5593 Len=0 TSval=1084538840 TSecr=2675283867"
"26.158357","54.38.73.16","172.18.0.2","TLSv1.2","3695","Application Data"
"26.158605","172.18.0.2","54.38.73.16","TCP","68","36876 → 21002 [ACK] Seq=28693 Ack=531544 Win=5580 Len=0 TSval=1084538883 TSecr=2675283878"
"26.169442","54.38.73.16","172.18.0.2","TCP","2964","[TCP segment of a reassembled PDU]"
"26.169478","172.18.0.2","54.38.73.16","TCP","68","36876 → 21002 [ACK] Seq=28693 Ack=534440 Win=5596 Len=0 TSval=1084538894 TSecr=2675283881"
"26.182588","54.38.73.16","172.18.0.2","TLSv1.2","799","Application Data"
"26.182780","172.18.0.2","54.38.73.16","TCP","68","36876 → 21002 [ACK] Seq=28693 Ack=535171 Win=5612 Len=0 TSval=1084538907 TSecr=2675283884"
"26.200464","54.38.73.16","172.18.0.2","TCP","1516","[TCP segment of a reassembled PDU]"
"26.200843","54.38.73.16","172.18.0.2","TCP","1516","21002 → 36876 [ACK] Seq=536619 Ack=28693 Win=1452 Len=1448 TSval=2675283889 TSecr=1084538894 [TCP segment of a reassembled PDU]"
"26.200995","172.18.0.2","54.38.73.16","TCP","68","36876 → 21002 [ACK] Seq=28693 Ack=538067 Win=5612 Len=0 TSval=1084538925 TSecr=2675283889"
"26.206471","54.38.73.16","172.18.0.2","TLSv1.2","285","Application Data"
"26.206660","172.18.0.2","54.38.73.16","TCP","68","36876 → 21002 [ACK] Seq=28693 Ack=538284 Win=5612 Len=0 TSval=1084538931 TSecr=2675283890"
"26.288296","54.38.73.16","172.18.0.2","TLSv1.2","2153","Application Data"
"26.288500","172.18.0.2","54.38.73.16","TCP","68","36876 → 21002 [ACK] Seq=28693 Ack=540369 Win=5599 Len=0 TSval=1084539013 TSecr=2675283910"
"26.295389","172.18.0.2","54.38.73.16","TLSv1.2","611","Application Data"
"26.356472","54.38.73.16","172.18.0.2","TCP","68","21002 → 36876 [ACK] Seq=540369 Ack=29236 Win=1452 Len=0 TSval=2675283928 TSecr=1084539019"
"26.983115","54.38.73.16","172.18.0.2","TLSv1.2","611","Application Data"
"26.983178","172.18.0.2","54.38.73.16","TCP","68","36876 → 21002 [ACK] Seq=29236 Ack=540912 Win=5608 Len=0 TSval=1084539707 TSecr=2675284069"
"26.984302","172.18.0.2","54.38.73.16","TLSv1.2","611","Application Data"
"27.009477","54.38.73.16","172.18.0.2","TCP","68","21002 → 36876 [ACK] Seq=540912 Ack=29779 Win=1452 Len=0 TSval=2675284091 TSecr=1084539708"
"27.597429","54.38.73.16","172.18.0.2","TCP","1516","[TCP segment of a reassembled PDU]"
"27.597757","54.38.73.16","172.18.0.2","TLSv1.2","2247","Application Data"
"27.597765","54.38.73.16","172.18.0.2","TLSv1.2","5860","Application Data"
"27.597867","172.18.0.2","54.38.73.16","TCP","68","36876 → 21002 [ACK] Seq=29779 Ack=550331 Win=5569 Len=0 TSval=1084540322 TSecr=2675284229"
"27.622016","54.38.73.16","172.18.0.2","TCP","1516","21002 → 36876 [ACK] Seq=550331 Ack=29779 Win=1452 Len=1448 TSval=2675284244 TSecr=1084540322 [TCP segment of a reassembled PDU]"
"27.622566","54.38.73.16","172.18.0.2","TLSv1.2","596","Application Data"
"27.622583","172.18.0.2","54.38.73.16","TCP","68","36876 → 21002 [ACK] Seq=29779 Ack=552307 Win=5593 Len=0 TSval=1084540347 TSecr=2675284244"
"27.699308","54.38.73.16","172.18.0.2","TLSv1.2","4145","Application Data"
"27.699313","54.38.73.16","172.18.0.2","TLSv1.2","2964","Application Data"
"27.699515","172.18.0.2","54.38.73.16","TCP","68","36876 → 21002 [ACK] Seq=29779 Ack=559280 Win=5566 Len=0 TSval=1084540424 TSecr=2675284263"
"27.708998","54.38.73.16","172.18.0.2","TLSv1.2","2964","Application Data [TCP segment of a reassembled PDU]"
"27.709033","172.18.0.2","54.38.73.16","TCP","68","36876 → 21002 [ACK] Seq=29779 Ack=562176 Win=5596 Len=0 TSval=1084540433 TSecr=2675284266"
"27.723245","54.38.73.16","172.18.0.2","TLSv1.2","1623","Application Data"
"27.723278","172.18.0.2","54.38.73.16","TCP","68","36876 → 21002 [ACK] Seq=29779 Ack=563731 Win=5601 Len=0 TSval=1084540447 TSecr=2675284269"
"27.783952","54.38.73.16","172.18.0.2","TLSv1.2","1125","Application Data"
"27.792105","172.18.0.2","54.38.73.16","TLSv1.2","611","Application Data"
"27.816724","54.38.73.16","172.18.0.2","TCP","68","21002 → 36876 [ACK] Seq=564788 Ack=30322 Win=1452 Len=0 TSval=2675284293 TSecr=1084540516"
"28.520969","54.38.73.16","172.18.0.2","TLSv1.2","611","Application Data"
"28.521996","172.18.0.2","54.38.73.16","TLSv1.2","611","Application Data"
"28.546796","54.38.73.16","172.18.0.2","TCP","68","21002 → 36876 [ACK] Seq=565331 Ack=30865 Win=1452 Len=0 TSval=2675284475 TSecr=1084541246"
"29.134256","54.38.73.16","172.18.0.2","TLSv1.2","611","Application Data"
"29.134310","54.38.73.16","172.18.0.2","TCP","2964","[TCP segment of a reassembled PDU]"
"29.134314","54.38.73.16","172.18.0.2","TLSv1.2","4412","Application Data [TCP segment of a reassembled PDU]"
"29.134318","54.38.73.16","172.18.0.2","TLSv1.2","1516","Application Data, Application Data"
"29.134517","172.18.0.2","54.38.73.16","TCP","68","36876 → 21002 [ACK] Seq=30865 Ack=574562 Win=5548 Len=0 TSval=1084541859 TSecr=2675284585"
"29.134820","172.18.0.2","54.38.73.16","TLSv1.2","611","Application Data"
"29.160349","54.38.73.16","172.18.0.2","TCP","68","[TCP Previous segment not captured] 21002 → 36876 [ACK] Seq=577298 Ack=31408 Win=1452 Len=0 TSval=2675284628 TSecr=1084541859"
"29.160368","54.38.73.16","172.18.0.2","TCP","2804","[TCP Retransmission] 21002 → 36876 [PSH, ACK] Seq=574562 Ack=30865 Win=1452 Len=2736 TSval=2675284628 TSecr=1084541859"
"29.160411","172.18.0.2","54.38.73.16","TCP","68","36876 → 21002 [ACK] Seq=31408 Ack=577298 Win=5596 Len=0 TSval=1084541885 TSecr=2675284628"
"29.178290","54.38.73.16","172.18.0.2","TCP","2964","[TCP segment of a reassembled PDU]"
"29.178324","172.18.0.2","54.38.73.16","TCP","68","36876 → 21002 [ACK] Seq=31408 Ack=580194 Win=5596 Len=0 TSval=1084541902 TSecr=2675284633"
"29.184584","54.38.73.16","172.18.0.2","TLSv1.2","799","Application Data"
"29.200113","54.38.73.16","172.18.0.2","TCP","2964","[TCP segment of a reassembled PDU]"
"29.200149","172.18.0.2","54.38.73.16","TCP","68","36876 → 21002 [ACK] Seq=31408 Ack=583821 Win=5596 Len=0 TSval=1084541924 TSecr=2675284635"
"29.210634","54.38.73.16","172.18.0.2","TLSv1.2","1516","Application Data [TCP segment of a reassembled PDU]"
"29.221339","54.38.73.16","172.18.0.2","TLSv1.2","4412","Application Data [TCP segment of a reassembled PDU]"
"29.221487","172.18.0.2","54.38.73.16","TCP","68","36876 → 21002 [ACK] Seq=31408 Ack=589613 Win=5580 Len=0 TSval=1084541946 TSecr=2675284641"
"29.224742","54.38.73.16","172.18.0.2","TLSv1.2","3832","Application Data, Application Data"
"29.224775","172.18.0.2","54.38.73.16","TCP","68","36876 → 21002 [ACK] Seq=31408 Ack=593377 Win=5580 Len=0 TSval=1084541949 TSecr=2675284645"
"29.225572","172.18.0.2","54.38.73.16","TLSv1.2","611","Application Data"
"29.270390","54.38.73.16","172.18.0.2","TLSv1.2","1125","Application Data"
"29.314496","172.18.0.2","54.38.73.16","TCP","68","36876 → 21002 [ACK] Seq=31951 Ack=594434 Win=5612 Len=0 TSval=1084542039 TSecr=2675284655"
"29.357473","54.38.73.16","172.18.0.2","TLSv1.2","3181","Application Data"
"29.357534","172.18.0.2","54.38.73.16","TCP","68","36876 → 21002 [ACK] Seq=31951 Ack=597547 Win=5588 Len=0 TSval=1084542082 TSecr=2675284678"
"29.381165","54.38.73.16","172.18.0.2","TCP","2964","[TCP segment of a reassembled PDU]"
"29.381198","172.18.0.2","54.38.73.16","TCP","68","36876 → 21002 [ACK] Seq=31951 Ack=600443 Win=5596 Len=0 TSval=1084542105 TSecr=2675284684"
"29.381347","54.38.73.16","172.18.0.2","TLSv1.2","799","Application Data"
"29.381374","172.18.0.2","54.38.73.16","TCP","68","36876 → 21002 [ACK] Seq=31951 Ack=601174 Win=5593 Len=0 TSval=1084542105 TSecr=2675284684"
"29.393193","54.38.73.16","172.18.0.2","TCP","2964","[TCP segment of a reassembled PDU]"
"29.393225","172.18.0.2","54.38.73.16","TCP","68","36876 → 21002 [ACK] Seq=31951 Ack=604070 Win=5596 Len=0 TSval=1084542117 TSecr=2675284687"
"29.405469","54.38.73.16","172.18.0.2","TLSv1.2","1342","Application Data, Application Data"
"29.405505","172.18.0.2","54.38.73.16","TCP","68","36876 → 21002 [ACK] Seq=31951 Ack=605344 Win=5593 Len=0 TSval=1084542130 TSecr=2675284690"
"29.416494","54.38.73.16","172.18.0.2","TCP","1516","[TCP segment of a reassembled PDU]"
"29.416526","172.18.0.2","54.38.73.16","TCP","68","36876 → 21002 [ACK] Seq=31951 Ack=606792 Win=5593 Len=0 TSval=1084542141 TSecr=2675284692"
"29.430037","54.38.73.16","172.18.0.2","TLSv1.2","705","Application Data"
"29.430076","172.18.0.2","54.38.73.16","TCP","68","36876 → 21002 [ACK] Seq=31951 Ack=607429 Win=5593 Len=0 TSval=1084542154 TSecr=2675284696"
"29.437081","54.38.73.16","172.18.0.2","TCP","2964","[TCP segment of a reassembled PDU]"
"29.437115","172.18.0.2","54.38.73.16","TCP","68","36876 → 21002 [ACK] Seq=31951 Ack=610325 Win=5596 Len=0 TSval=1084542161 TSecr=2675284698"
"29.460549","54.38.73.16","172.18.0.2","TLSv1.2","285","Application Data"
"29.460714","172.18.0.2","54.38.73.16","TCP","68","36876 → 21002 [ACK] Seq=31951 Ack=610542 Win=5612 Len=0 TSval=1084542185 TSecr=2675284703"
"29.516949","54.38.73.16","172.18.0.2","TLSv1.2","1639","Application Data"
"29.517105","172.18.0.2","54.38.73.16","TCP","68","36876 → 21002 [ACK] Seq=31951 Ack=612113 Win=5601 Len=0 TSval=1084542241 TSecr=2675284718"
"29.528613","54.38.73.16","172.18.0.2","TCP","1516","[TCP segment of a reassembled PDU]"
"29.543477","54.38.73.16","172.18.0.2","TLSv1.2","705","Application Data"
"29.543627","172.18.0.2","54.38.73.16","TCP","68","36876 → 21002 [ACK] Seq=31951 Ack=614198 Win=5612 Len=0 TSval=1084542268 TSecr=2675284721"
"29.550301","172.18.0.2","54.38.73.16","TLSv1.2","611","Application Data"
"29.612251","54.38.73.16","172.18.0.2","TCP","68","21002 → 36876 [ACK] Seq=614198 Ack=32494 Win=1452 Len=0 TSval=2675284742 TSecr=1084542274"
"30.368545","54.38.73.16","172.18.0.2","TLSv1.2","611","Application Data"
"30.368601","172.18.0.2","54.38.73.16","TCP","68","36876 → 21002 [ACK] Seq=32494 Ack=614741 Win=5608 Len=0 TSval=1084543093 TSecr=2675284919"
"30.369518","172.18.0.2","54.38.73.16","TLSv1.2","611","Application Data"
"30.393479","54.38.73.16","172.18.0.2","TCP","68","21002 → 36876 [ACK] Seq=614741 Ack=33037 Win=1452 Len=0 TSval=2675284937 TSecr=1084543094"
