_ws.col.Time,_ws.col.Source,_ws.col.Destination,_ws.col.Protocol,_ws.col.Length,_ws.col.Info
"0.000000","172.18.0.2","54.38.73.16","TLSv1.2","611","Application Data"
"0.060797","54.38.73.16","172.18.0.2","TCP","68","21002 → 36876 [ACK] Seq=1 Ack=544 Win=1452 Len=0 TSval=2675490372 TSecr=1085364790"
"1.297196","54.38.73.16","172.18.0.2","TLSv1.2","611","Application Data"
"1.297245","172.18.0.2","54.38.73.16","TCP","68","36876 → 21002 [ACK] Seq=544 Ack=544 Win=5608 Len=0 TSval=1085366088 TSecr=2675490639"
"1.298331","172.18.0.2","54.38.73.16","TCP","1516","[TCP segment of a reassembled PDU]"
"1.298396","172.18.0.2","54.38.73.16","TLSv1.2","705","Application Data"
"1.322826","54.38.73.16","172.18.0.2","TCP","68","21002 → 36876 [ACK] Seq=544 Ack=2629 Win=1450 Len=0 TSval=2675490687 TSecr=1085366089"
"2.250162","54.38.73.16","172.18.0.2","TLSv1.2","1639","Application Data"
"2.250221","172.18.0.2","54.38.73.16","TCP","68","36876 → 21002 [ACK] Seq=2629 Ack=2115 Win=5600 Len=0 TSval=1085367041 TSecr=2675490919"
"2.259110","172.18.0.2","54.38.73.16","TLSv1.2","611","Application Data"
"2.284660","54.38.73.16","172.18.0.2","TCP","68","21002 → 36876 [ACK] Seq=2115 Ack=3172 Win=1452 Len=0 TSval=2675490928 TSecr=1085367050"
"3.446114","54.38.73.16","172.18.0.2","TLSv1.2","611","Application Data"
"3.446191","172.18.0.2","54.38.73.16","TCP","68","36876 → 21002 [ACK] Seq=3172 Ack=2658 Win=5608 Len=0 TSval=1085368237 TSecr=2675491146"
"3.447262","172.18.0.2","54.38.73.16","TLSv1.2","611","Application Data"
"3.452118","54.38.73.16","172.18.0.2","TLSv1.2","611","[TCP Spurious Retransmission] , Application Data"
"3.452169","172.18.0.2","54.38.73.16","TCP","80","[TCP Dup ACK 13#1] 36876 → 21002 [ACK] Seq=3715 Ack=2658 Win=5612 Len=0 TSval=1085368243 TSecr=2675491220 SLE=2115 SRE=2658"
"3.470918","54.38.73.16","172.18.0.2","TCP","68","21002 → 36876 [ACK] Seq=2658 Ack=3715 Win=1452 Len=0 TSval=2675491224 TSecr=1085368238"
"4.676941","54.38.73.16","172.18.0.2","TLSv1.2","2667","Application Data"
"4.677010","172.18.0.2","54.38.73.16","TCP","68","36876 → 21002 [ACK] Seq=3715 Ack=5257 Win=5592 Len=0 TSval=1085369467 TSecr=2675491456"
"4.676947","54.38.73.16","172.18.0.2","TCP","1516","[TCP segment of a reassembled PDU]"
"4.677035","172.18.0.2","54.38.73.16","TCP","68","36876 → 21002 [ACK] Seq=3715 Ack=6705 Win=5581 Len=0 TSval=1085369468 TSecr=2675491470"
"4.676952","54.38.73.16","172.18.0.2","TLSv1.2","2964","Application Data [TCP segment of a reassembled PDU]"
"4.677049","172.18.0.2","54.38.73.16","TCP","68","36876 → 21002 [ACK] Seq=3715 Ack=9601 Win=5564 Len=0 TSval=1085369468 TSecr=2675491478"
"4.676956","54.38.73.16","172.18.0.2","TLSv1.2","1516","Application Data [TCP segment of a reassembled PDU]"
"4.677061","172.18.0.2","54.38.73.16","TCP","68","36876 → 21002 [ACK] Seq=3715 Ack=11049 Win=5553 Len=0 TSval=1085369468 TSecr=2675491502"
"4.702823","54.38.73.16","172.18.0.2","TLSv1.2","5860","Application Data, Application Data"
"4.702866","172.18.0.2","54.38.73.16","TCP","68","36876 → 21002 [ACK] Seq=3715 Ack=16841 Win=5581 Len=0 TSval=1085369493 TSecr=2675491532"
"4.711615","54.38.73.16","172.18.0.2","TCP","1516","21002 → 36876 [ACK] Seq=16841 Ack=3715 Win=1452 Len=1448 TSval=2675491534 TSecr=1085369468 [TCP segment of a reassembled PDU]"
"4.711641","172.18.0.2","54.38.73.16","TCP","68","36876 → 21002 [ACK] Seq=3715 Ack=18289 Win=5593 Len=0 TSval=1085369502 TSecr=2675491534"
"4.728550","54.38.73.16","172.18.0.2","TLSv1.2","5860","Application Data, Application Data, Application Data"
"4.728584","172.18.0.2","54.38.73.16","TCP","68","36876 → 21002 [ACK] Seq=3715 Ack=24081 Win=5581 Len=0 TSval=1085369519 TSecr=2675491539"
"4.750279","54.38.73.16","172.18.0.2","TLSv1.2","1516","Application Data [TCP segment of a reassembled PDU]"
"4.750348","172.18.0.2","54.38.73.16","TCP","68","36876 → 21002 [ACK] Seq=3715 Ack=25529 Win=5593 Len=0 TSval=1085369541 TSecr=2675491543"
"4.753296","54.38.73.16","172.18.0.2","TLSv1.2","4412","Application Data [TCP segment of a reassembled PDU]"
"4.753331","172.18.0.2","54.38.73.16","TCP","68","36876 → 21002 [ACK] Seq=3715 Ack=29873 Win=5580 Len=0 TSval=1085369544 TSecr=2675491545"
"4.753763","172.18.0.2","54.38.73.16","TLSv1.2","611","Application Data"
"4.756644","54.38.73.16","172.18.0.2","TLSv1.2","1516","Application Data [TCP segment of a reassembled PDU]"
"4.756667","172.18.0.2","54.38.73.16","TCP","68","36876 → 21002 [ACK] Seq=4258 Ack=31321 Win=5593 Len=0 TSval=1085369547 TSecr=2675491546"
"4.774627","54.38.73.16","172.18.0.2","TLSv1.2","1516","Application Data [TCP segment of a reassembled PDU]"
"4.774657","172.18.0.2","54.38.73.16","TCP","68","36876 → 21002 [ACK] Seq=4258 Ack=32769 Win=5593 Len=0 TSval=1085369565 TSecr=2675491550"
"4.777415","54.38.73.16","172.18.0.2","TLSv1.2","5858","Application Data, Application Data, Application Data"
"4.777440","172.18.0.2","54.38.73.16","TCP","68","36876 → 21002 [ACK] Seq=4258 Ack=38559 Win=5581 Len=0 TSval=1085369568 TSecr=2675491551"
"4.777542","54.38.73.16","172.18.0.2","TCP","68","21002 → 36876 [ACK] Seq=38559 Ack=4258 Win=1452 Len=0 TSval=2675491551 TSecr=1085369544"
"4.802315","54.38.73.16","172.18.0.2","TLSv1.2","1125","Application Data"
"4.802363","172.18.0.2","54.38.73.16","TCP","68","36876 → 21002 [ACK] Seq=4258 Ack=39616 Win=5593 Len=0 TSval=1085369593 TSecr=2675491557"
"4.839469","54.38.73.16","172.18.0.2","TLSv1.2","3695","Application Data"
"4.839507","172.18.0.2","54.38.73.16","TCP","68","36876 → 21002 [ACK] Seq=4258 Ack=43243 Win=5580 Len=0 TSval=1085369630 TSecr=2675491566"
"4.839973","172.18.0.2","54.38.73.16","TLSv1.2","611","Application Data"
"4.904322","54.38.73.16","172.18.0.2","TCP","68","21002 → 36876 [ACK] Seq=43243 Ack=4801 Win=1452 Len=0 TSval=2675491583 TSecr=1085369630"
"4.930383","54.38.73.16","172.18.0.2","TLSv1.2","3695","Application Data"
"4.930556","172.18.0.2","54.38.73.16","TCP","68","36876 → 21002 [ACK] Seq=4801 Ack=46870 Win=5584 Len=0 TSval=1085369721 TSecr=2675491589"
"5.018377","54.38.73.16","172.18.0.2","TLSv1.2","1125","Application Data"
"5.018539","172.18.0.2","54.38.73.16","TCP","68","36876 → 21002 [ACK] Seq=4801 Ack=47927 Win=5612 Len=0 TSval=1085369809 TSecr=2675491610"
"5.027836","172.18.0.2","54.38.73.16","TLSv1.2","611","Application Data"
"5.052209","54.38.73.16","172.18.0.2","TCP","68","21002 → 36876 [ACK] Seq=47927 Ack=5344 Win=1452 Len=0 TSval=2675491619 TSecr=1085369818"
"6.519425","54.38.73.16","172.18.0.2","TLSv1.2","611","Application Data"
"6.519451","54.38.73.16","172.18.0.2","TCP","611","[TCP Retransmission] 21002 → 36876 [PSH, ACK] Seq=47927 Ack=5344 Win=1452 Len=543 TSval=2675491985 TSecr=1085369818"
"6.519526","172.18.0.2","54.38.73.16","TCP","80","36876 → 21002 [ACK] Seq=5344 Ack=48470 Win=5608 Len=0 TSval=1085371310 TSecr=2675491985 SLE=47927 SRE=48470"
"6.520472","172.18.0.2","54.38.73.16","TLSv1.2","611","Application Data"
"6.544315","54.38.73.16","172.18.0.2","TCP","68","21002 → 36876 [ACK] Seq=48470 Ack=5887 Win=1452 Len=0 TSval=2675491992 TSecr=1085371311"
"11.829272","172.18.0.2","54.38.73.16","TLSv1.2","611","Application Data"
"11.855580","54.38.73.16","172.18.0.2","TCP","68","21002 → 36876 [ACK] Seq=48470 Ack=6430 Win=1452 Len=0 TSval=2675493320 TSecr=1085376620"
"13.892330","54.38.73.16","172.18.0.2","TLSv1.2","611","Application Data"
"13.892435","172.18.0.2","54.38.73.16","TCP","68","36876 → 21002 [ACK] Seq=6430 Ack=49013 Win=5608 Len=0 TSval=1085378683 TSecr=2675493759"
"13.892384","54.38.73.16","172.18.0.2","TCP","2964","[TCP segment of a reassembled PDU]"
"13.892449","172.18.0.2","54.38.73.16","TCP","68","36876 → 21002 [ACK] Seq=6430 Ack=51909 Win=5586 Len=0 TSval=1085378683 TSecr=2675493787"
"13.892388","54.38.73.16","172.18.0.2","TLSv1.2","2964","Application Data [TCP segment of a reassembled PDU]"
"13.892458","172.18.0.2","54.38.73.16","TCP","68","36876 → 21002 [ACK] Seq=6430 Ack=54805 Win=5564 Len=0 TSval=1085378683 TSecr=2675493804"
"13.892391","54.38.73.16","172.18.0.2","TLSv1.2","1516","Application Data [TCP segment of a reassembled PDU]"
"13.892466","172.18.0.2","54.38.73.16","TCP","68","36876 → 21002 [ACK] Seq=6430 Ack=56253 Win=5553 Len=0 TSval=1085378683 TSecr=2675493828"
"13.918163","54.38.73.16","172.18.0.2","TLSv1.2","4795","Application Data, Application Data, Application Data"
"13.918195","172.18.0.2","54.38.73.16","TCP","68","36876 → 21002 [ACK] Seq=6430 Ack=60980 Win=5585 Len=0 TSval=1085378709 TSecr=2675493836"
"13.951629","54.38.73.16","172.18.0.2","TLSv1.2","1639","Application Data"
"13.951699","172.18.0.2","54.38.73.16","TCP","68","36876 → 21002 [ACK] Seq=6430 Ack=62551 Win=5601 Len=0 TSval=1085378742 TSecr=2675493843"
"13.969424","54.38.73.16","172.18.0.2","TCP","2964","[TCP segment of a reassembled PDU]"
"13.969452","172.18.0.2","54.38.73.16","TCP","68","36876 → 21002 [ACK] Seq=6430 Ack=65447 Win=5579 Len=0 TSval=1085378760 TSecr=2675493849"
"13.975087","54.38.73.16","172.18.0.2","TLSv1.2","285","Application Data"
"13.975111","172.18.0.2","54.38.73.16","TCP","68","36876 → 21002 [ACK] Seq=6430 Ack=65664 Win=5593 Len=0 TSval=1085378766 TSecr=2675493850"
"14.198620","54.38.73.16","172.18.0.2","TCP","1516","[TCP segment of a reassembled PDU]"
"14.198652","172.18.0.2","54.38.73.16","TCP","68","36876 → 21002 [ACK] Seq=6430 Ack=67112 Win=5593 Len=0 TSval=1085378989 TSecr=2675493897"
"14.198808","54.38.73.16","172.18.0.2","TLSv1.2","2247","Application Data"
"14.198829","172.18.0.2","54.38.73.16","TCP","68","36876 → 21002 [ACK] Seq=6430 Ack=69291 Win=5599 Len=0 TSval=1085378989 TSecr=2675493897"
"14.505595","54.38.73.16","172.18.0.2","TLSv1.2","1125","Application Data"
"14.505626","172.18.0.2","54.38.73.16","TCP","68","36876 → 21002 [ACK] Seq=6430 Ack=70348 Win=5593 Len=0 TSval=1085379296 TSecr=2675493939"
"14.512310","172.18.0.2","54.38.73.16","TLSv1.2","611","Application Data"
"14.538201","54.38.73.16","172.18.0.2","TCP","68","21002 → 36876 [ACK] Seq=70348 Ack=6973 Win=1452 Len=0 TSval=2675493991 TSecr=1085379303"
"15.751696","54.38.73.16","172.18.0.2","TLSv1.2","611","Application Data"
"15.751757","172.18.0.2","54.38.73.16","TCP","68","36876 → 21002 [ACK] Seq=6973 Ack=70891 Win=5608 Len=0 TSval=1085380542 TSecr=2675494214"
"15.752726","172.18.0.2","54.38.73.16","TLSv1.2","611","Application Data"
"15.752901","54.38.73.16","172.18.0.2","TLSv1.2","611","[TCP Spurious Retransmission] , Application Data"
"15.752934","172.18.0.2","54.38.73.16","TCP","80","[TCP Dup ACK 88#1] 36876 → 21002 [ACK] Seq=7516 Ack=70891 Win=5612 Len=0 TSval=1085380543 TSecr=2675494295 SLE=70348 SRE=70891"
"15.777247","54.38.73.16","172.18.0.2","TCP","68","21002 → 36876 [ACK] Seq=70891 Ack=7516 Win=1452 Len=0 TSval=2675494301 TSecr=1085380543"
"17.067409","54.38.73.16","172.18.0.2","TLSv1.2","3695","Application Data"
"17.067470","172.18.0.2","54.38.73.16","TCP","68","36876 → 21002 [ACK] Seq=7516 Ack=74518 Win=5584 Len=0 TSval=1085381858 TSecr=2675494551"
"17.067610","54.38.73.16","172.18.0.2","TLSv1.2","2964","Application Data"
"17.067632","172.18.0.2","54.38.73.16","TCP","68","36876 → 21002 [ACK] Seq=7516 Ack=77414 Win=5596 Len=0 TSval=1085381858 TSecr=2675494602"
"17.093159","54.38.73.16","172.18.0.2","TLSv1.2","5860","Application Data, Application Data"
"17.093179","172.18.0.2","54.38.73.16","TCP","68","36876 → 21002 [ACK] Seq=7516 Ack=83206 Win=5581 Len=0 TSval=1085381884 TSecr=2675494630"
"17.118579","54.38.73.16","172.18.0.2","TLSv1.2","3347","Application Data, Application Data"
"17.118600","172.18.0.2","54.38.73.16","TCP","68","36876 → 21002 [ACK] Seq=7516 Ack=86485 Win=5580 Len=0 TSval=1085381909 TSecr=2675494636"
"17.123220","54.38.73.16","172.18.0.2","TCP","1516","[TCP segment of a reassembled PDU]"
"17.123242","172.18.0.2","54.38.73.16","TCP","68","36876 → 21002 [ACK] Seq=7516 Ack=87933 Win=5593 Len=0 TSval=1085381914 TSecr=2675494637"
"17.144584","54.38.73.16","172.18.0.2","TLSv1.2","2247","Application Data"
"17.144617","172.18.0.2","54.38.73.16","TCP","68","36876 → 21002 [ACK] Seq=7516 Ack=90112 Win=5599 Len=0 TSval=1085381935 TSecr=2675494643"
"17.156390","54.38.73.16","172.18.0.2","TLSv1.2","2964","Application Data"
"17.156421","172.18.0.2","54.38.73.16","TCP","68","36876 → 21002 [ACK] Seq=7516 Ack=93008 Win=5596 Len=0 TSval=1085381947 TSecr=2675494645"
"17.170822","54.38.73.16","172.18.0.2","TLSv1.2","2913","Application Data, Application Data"
"17.170854","172.18.0.2","54.38.73.16","TCP","68","36876 → 21002 [ACK] Seq=7516 Ack=95853 Win=5596 Len=0 TSval=1085381961 TSecr=2675494649"
"17.171695","172.18.0.2","54.38.73.16","TLSv1.2","611","Application Data"
"17.195623","54.38.73.16","172.18.0.2","TCP","68","21002 → 36876 [ACK] Seq=95853 Ack=8059 Win=1452 Len=0 TSval=2675494655 TSecr=1085381962"
"17.251842","54.38.73.16","172.18.0.2","TLSv1.2","4145","Application Data"
"17.251875","172.18.0.2","54.38.73.16","TCP","68","36876 → 21002 [ACK] Seq=8059 Ack=99930 Win=5581 Len=0 TSval=1085382042 TSecr=2675494669"
"17.252376","172.18.0.2","54.38.73.16","TLSv1.2","611","Application Data"
"17.263195","54.38.73.16","172.18.0.2","TLSv1.2","1516","Application Data"
"17.263227","172.18.0.2","54.38.73.16","TCP","68","36876 → 21002 [ACK] Seq=8602 Ack=101378 Win=5601 Len=0 TSval=1085382054 TSecr=2675494672"
"17.275889","54.38.73.16","172.18.0.2","TCP","68","[TCP Previous segment not captured] 21002 → 36876 [ACK] Seq=104274 Ack=8602 Win=1452 Len=0 TSval=2675494675 TSecr=1085382043"
"17.275914","54.38.73.16","172.18.0.2","TCP","2964","[TCP Retransmission] 21002 → 36876 [ACK] Seq=101378 Ack=8059 Win=1452 Len=2896 TSval=2675494675 TSecr=1085382042"
"17.275969","172.18.0.2","54.38.73.16","TCP","68","36876 → 21002 [ACK] Seq=8602 Ack=104274 Win=5596 Len=0 TSval=1085382066 TSecr=2675494675"
"17.284752","54.38.73.16","172.18.0.2","TLSv1.2","1516","Ignored Unknown Record"
"17.284793","172.18.0.2","54.38.73.16","TCP","68","36876 → 21002 [ACK] Seq=8602 Ack=105722 Win=5593 Len=0 TSval=1085382075 TSecr=2675494678"
"17.286810","54.38.73.16","172.18.0.2","TLSv1.2","1516","Ignored Unknown Record"
"17.286833","172.18.0.2","54.38.73.16","TCP","68","36876 → 21002 [ACK] Seq=8602 Ack=107170 Win=5593 Len=0 TSval=1085382077 TSecr=2675494678"
"17.305937","54.38.73.16","172.18.0.2","TLSv1.2","4412","Ignored Unknown Record"
"17.305969","172.18.0.2","54.38.73.16","TCP","68","36876 → 21002 [ACK] Seq=8602 Ack=111514 Win=5580 Len=0 TSval=1085382096 TSecr=2675494683"
"17.310438","54.38.73.16","172.18.0.2","TLSv1.2","2964","Ignored Unknown Record"
"17.310460","172.18.0.2","54.38.73.16","TCP","68","36876 → 21002 [ACK] Seq=8602 Ack=114410 Win=5596 Len=0 TSval=1085382101 TSecr=2675494684"
"17.330728","54.38.73.16","172.18.0.2","TLSv1.2","2964","Ignored Unknown Record"
"17.330796","172.18.0.2","54.38.73.16","TCP","68","36876 → 21002 [ACK] Seq=8602 Ack=117306 Win=5596 Len=0 TSval=1085382121 TSecr=2675494689"
"17.333988","54.38.73.16","172.18.0.2","TCP","4120","21002 → 36876 [PSH, ACK] Seq=117306 Ack=8602 Win=1452 Len=4052 TSval=2675494690 TSecr=1085382101"
"17.334130","172.18.0.2","54.38.73.16","TCP","68","36876 → 21002 [ACK] Seq=8602 Ack=121358 Win=5580 Len=0 TSval=1085382125 TSecr=2675494690"
"17.355149","54.38.73.16","172.18.0.2","TCP","2964","[TCP segment of a reassembled PDU]"
"17.355182","172.18.0.2","54.38.73.16","TCP","68","36876 → 21002 [ACK] Seq=8602 Ack=124254 Win=5596 Len=0 TSval=1085382146 TSecr=2675494695"
"17.358428","54.38.73.16","172.18.0.2","TLSv1.2","1856","Application Data, Application Data"
"17.358461","172.18.0.2","54.38.73.16","TCP","68","36876 → 21002 [ACK] Seq=8602 Ack=126042 Win=5600 Len=0 TSval=1085382149 TSecr=2675494696"
"17.359057","172.18.0.2","54.38.73.16","TLSv1.2","611","Application Data"
"17.393871","54.38.73.16","172.18.0.2","TLSv1.2","3695","Application Data"
"17.394026","172.18.0.2","54.38.73.16","TCP","68","36876 → 21002 [ACK] Seq=9145 Ack=129669 Win=5580 Len=0 TSval=1085382184 TSecr=2675494705"
"17.576466","54.38.73.16","172.18.0.2","TCP","1516","[TCP segment of a reassembled PDU]"
"17.576622","54.38.73.16","172.18.0.2","TLSv1.2","191","Application Data"
"17.576696","172.18.0.2","54.38.73.16","TCP","68","36876 → 21002 [ACK] Seq=9145 Ack=131240 Win=5608 Len=0 TSval=1085382367 TSecr=2675494731"
"17.576666","54.38.73.16","172.18.0.2","TCP","2964","[TCP segment of a reassembled PDU]"
"17.576671","54.38.73.16","172.18.0.2","TLSv1.2","1516","Application Data [TCP segment of a reassembled PDU]"
"17.576779","172.18.0.2","54.38.73.16","TCP","68","36876 → 21002 [ACK] Seq=9145 Ack=135584 Win=5586 Len=0 TSval=1085382367 TSecr=2675494734"
"17.600978","54.38.73.16","172.18.0.2","TLSv1.2","1516","Application Data [TCP segment of a reassembled PDU]"
"17.601172","54.38.73.16","172.18.0.2","TLSv1.2","5700","Application Data, Application Data"
"17.601214","172.18.0.2","54.38.73.16","TCP","68","36876 → 21002 [ACK] Seq=9145 Ack=142664 Win=5546 Len=0 TSval=1085382392 TSecr=2675494757"
"17.708083","54.38.73.16","172.18.0.2","TLSv1.2","3695","Application Data"
"17.708151","172.18.0.2","54.38.73.16","TCP","68","36876 → 21002 [ACK] Seq=9145 Ack=146291 Win=5580 Len=0 TSval=1085382499 TSecr=2675494783"
"17.740914","54.38.73.16","172.18.0.2","TLSv1.2","611","Application Data"
"17.742192","172.18.0.2","54.38.73.16","TLSv1.2","611","Application Data"
"17.804140","54.38.73.16","172.18.0.2","TCP","68","21002 → 36876 [ACK] Seq=146834 Ack=9688 Win=1452 Len=0 TSval=2675494808 TSecr=1085382533"
"17.804185","172.18.0.2","54.38.73.16","TLSv1.2","611","Application Data"
"17.828320","54.38.73.16","172.18.0.2","TCP","68","21002 → 36876 [ACK] Seq=146834 Ack=10231 Win=1452 Len=0 TSval=2675494814 TSecr=1085382595"
"17.921529","54.38.73.16","172.18.0.2","TLSv1.2","611","Application Data"
"17.964094","172.18.0.2","54.38.73.16","TCP","68","36876 → 21002 [ACK] Seq=10231 Ack=147377 Win=5612 Len=0 TSval=1085382755 TSecr=2675494837"
"19.114591","54.38.73.16","172.18.0.2","TLSv1.2","611","Application Data"
"19.114646","172.18.0.2","54.38.73.16","TCP","68","36876 → 21002 [ACK] Seq=10231 Ack=147920 Win=5608 Len=0 TSval=1085383905 TSecr=2675495070"
"19.114747","54.38.73.16","172.18.0.2","TLSv1.2","611","[TCP Spurious Retransmission] , Application Data"
"19.114767","172.18.0.2","54.38.73.16","TCP","80","[TCP Window Update] 36876 → 21002 [ACK] Seq=10231 Ack=147920 Win=5612 Len=0 TSval=1085383905 TSecr=2675495135 SLE=147377 SRE=147920"
"19.115615","172.18.0.2","54.38.73.16","TLSv1.2","611","Application Data"
"19.352163","172.18.0.2","54.38.73.16","TCP","611","[TCP Retransmission] 36876 → 21002 [PSH, ACK] Seq=10231 Ack=147920 Win=5612 Len=543 TSval=1085384143 TSecr=2675495135"
"19.378953","54.38.73.16","172.18.0.2","TCP","68","21002 → 36876 [ACK] Seq=147920 Ack=10774 Win=1452 Len=0 TSval=2675495201 TSecr=1085384143"
"20.345835","54.38.73.16","172.18.0.2","TLSv1.2","611","Application Data"
"20.345887","172.18.0.2","54.38.73.16","TCP","68","36876 → 21002 [ACK] Seq=10774 Ack=148463 Win=5608 Len=0 TSval=1085385136 TSecr=2675495440"
"20.391744","54.38.73.16","172.18.0.2","TLSv1.2","3695","Application Data"
"20.391778","172.18.0.2","54.38.73.16","TCP","68","36876 → 21002 [ACK] Seq=10774 Ack=152090 Win=5580 Len=0 TSval=1085385182 TSecr=2675495454"
"20.392433","172.18.0.2","54.38.73.16","TLSv1.2","611","Application Data"
"20.417010","54.38.73.16","172.18.0.2","TLSv1.2","1125","Application Data"
"20.417054","172.18.0.2","54.38.73.16","TCP","68","36876 → 21002 [ACK] Seq=11317 Ack=153147 Win=5605 Len=0 TSval=1085385208 TSecr=2675495461"
"20.417020","54.38.73.16","172.18.0.2","TCP","68","21002 → 36876 [ACK] Seq=153147 Ack=11317 Win=1452 Len=0 TSval=2675495461 TSecr=1085385183"
"20.430291","54.38.73.16","172.18.0.2","TCP","2964","[TCP segment of a reassembled PDU]"
"20.430330","172.18.0.2","54.38.73.16","TCP","68","36876 → 21002 [ACK] Seq=11317 Ack=156043 Win=5596 Len=0 TSval=1085385221 TSecr=2675495464"
"20.441867","54.38.73.16","172.18.0.2","TLSv1.2","285","Application Data"
"20.441908","172.18.0.2","54.38.73.16","TCP","68","36876 → 21002 [ACK] Seq=11317 Ack=156260 Win=5595 Len=0 TSval=1085385232 TSecr=2675495467"
"20.451626","54.38.73.16","172.18.0.2","TCP","1516","[TCP segment of a reassembled PDU]"
"20.451657","172.18.0.2","54.38.73.16","TCP","68","36876 → 21002 [ACK] Seq=11317 Ack=157708 Win=5593 Len=0 TSval=1085385242 TSecr=2675495469"
"20.455247","54.38.73.16","172.18.0.2","TCP","1516","21002 → 36876 [ACK] Seq=157708 Ack=11317 Win=1452 Len=1448 TSval=2675495470 TSecr=1085385221 [TCP segment of a reassembled PDU]"
"20.455277","172.18.0.2","54.38.73.16","TCP","68","36876 → 21002 [ACK] Seq=11317 Ack=159156 Win=5593 Len=0 TSval=1085385246 TSecr=2675495470"
"20.467564","54.38.73.16","172.18.0.2","TLSv1.2","285","Application Data"
"20.467600","172.18.0.2","54.38.73.16","TCP","68","36876 → 21002 [ACK] Seq=11317 Ack=159373 Win=5593 Len=0 TSval=1085385258 TSecr=2675495473"
"20.514787","54.38.73.16","172.18.0.2","TLSv1.2","1125","Application Data"
"20.514842","172.18.0.2","54.38.73.16","TCP","68","36876 → 21002 [ACK] Seq=11317 Ack=160430 Win=5593 Len=0 TSval=1085385305 TSecr=2675495485"
"20.650986","54.38.73.16","172.18.0.2","TLSv1.2","3695","Application Data"
"20.651015","172.18.0.2","54.38.73.16","TCP","68","36876 → 21002 [ACK] Seq=11317 Ack=164057 Win=5581 Len=0 TSval=1085385441 TSecr=2675495516"
"20.650990","54.38.73.16","172.18.0.2","TCP","1516","[TCP segment of a reassembled PDU]"
"20.651023","172.18.0.2","54.38.73.16","TCP","68","36876 → 21002 [ACK] Seq=11317 Ack=165505 Win=5570 Len=0 TSval=1085385441 TSecr=2675495518"
"20.675819","54.38.73.16","172.18.0.2","TLSv1.2","5360","Application Data, Application Data"
"20.675838","172.18.0.2","54.38.73.16","TCP","68","36876 → 21002 [ACK] Seq=11317 Ack=170797 Win=5583 Len=0 TSval=1085385466 TSecr=2675495525"
"20.701438","54.38.73.16","172.18.0.2","TLSv1.2","5809","Application Data, Application Data, Application Data"
"20.701472","172.18.0.2","54.38.73.16","TCP","68","36876 → 21002 [ACK] Seq=11317 Ack=176538 Win=5581 Len=0 TSval=1085385492 TSecr=2675495532"
"20.701935","172.18.0.2","54.38.73.16","TLSv1.2","611","Application Data"
"20.727965","54.38.73.16","172.18.0.2","TLSv1.2","5266","Application Data, Application Data"
"20.727999","172.18.0.2","54.38.73.16","TCP","68","36876 → 21002 [ACK] Seq=11860 Ack=181736 Win=5583 Len=0 TSval=1085385518 TSecr=2675495538"
"20.753277","54.38.73.16","172.18.0.2","TLSv1.2","1639","Application Data"
"20.753315","172.18.0.2","54.38.73.16","TCP","68","36876 → 21002 [ACK] Seq=11860 Ack=183307 Win=5601 Len=0 TSval=1085385544 TSecr=2675495545"
"20.764435","54.38.73.16","172.18.0.2","TCP","2964","[TCP segment of a reassembled PDU]"
"20.764598","172.18.0.2","54.38.73.16","TCP","68","36876 → 21002 [ACK] Seq=11860 Ack=186203 Win=5596 Len=0 TSval=1085385555 TSecr=2675495548"
"20.777299","54.38.73.16","172.18.0.2","TLSv1.2","799","Application Data"
"20.820093","172.18.0.2","54.38.73.16","TCP","68","36876 → 21002 [ACK] Seq=11860 Ack=186934 Win=5612 Len=0 TSval=1085385611 TSecr=2675495551"
"20.925909","54.38.73.16","172.18.0.2","TLSv1.2","3695","Application Data"
"20.926054","172.18.0.2","54.38.73.16","TCP","68","36876 → 21002 [ACK] Seq=11860 Ack=190561 Win=5584 Len=0 TSval=1085385717 TSecr=2675495588"
"21.265411","54.38.73.16","172.18.0.2","TCP","1516","[TCP segment of a reassembled PDU]"
"21.265464","172.18.0.2","54.38.73.16","TCP","68","36876 → 21002 [ACK] Seq=11860 Ack=192009 Win=5593 Len=0 TSval=1085386056 TSecr=2675495634"
"21.265616","54.38.73.16","172.18.0.2","TLSv1.2","191","Application Data"
"21.265672","172.18.0.2","54.38.73.16","TCP","68","36876 → 21002 [ACK] Seq=11860 Ack=192132 Win=5608 Len=0 TSval=1085386056 TSecr=2675495634"
"21.265630","54.38.73.16","172.18.0.2","TCP","191","[TCP Spurious Retransmission] 21002 → 36876 [PSH, ACK] Seq=192009 Ack=11860 Win=1452 Len=123 TSval=2675495652 TSecr=1085385717[Reassembly error, protocol TCP: New fragment overlaps old data (retransmission?)]"
"21.265701","172.18.0.2","54.38.73.16","TCP","80","[TCP Dup ACK 205#1] 36876 → 21002 [ACK] Seq=11860 Ack=192132 Win=5608 Len=0 TSval=1085386056 TSecr=2675495652 SLE=192009 SRE=192132"
"21.274467","172.18.0.2","54.38.73.16","TLSv1.2","611","Application Data"
"21.336455","54.38.73.16","172.18.0.2","TCP","68","21002 → 36876 [ACK] Seq=192132 Ack=12403 Win=1452 Len=0 TSval=2675495691 TSecr=1085386065"
"22.493661","54.38.73.16","172.18.0.2","TLSv1.2","611","Application Data"
"22.493859","172.18.0.2","54.38.73.16","TCP","68","36876 → 21002 [ACK] Seq=12403 Ack=192675 Win=5608 Len=0 TSval=1085387284 TSecr=2675495917"
"22.494741","172.18.0.2","54.38.73.16","TLSv1.2","611","Application Data"
"22.519831","54.38.73.16","172.18.0.2","TCP","68","21002 → 36876 [ACK] Seq=192675 Ack=12946 Win=1452 Len=0 TSval=2675495986 TSecr=1085387285"
"23.721814","54.38.73.16","172.18.0.2","TLSv1.2","611","Application Data"
"23.721867","172.18.0.2","54.38.73.16","TCP","68","36876 → 21002 [ACK] Seq=12946 Ack=193218 Win=5608 Len=0 TSval=1085388512 TSecr=2675496213"
"23.722016","54.38.73.16","172.18.0.2","TCP","2964","[TCP segment of a reassembled PDU]"
"23.722044","172.18.0.2","54.38.73.16","TCP","68","36876 → 21002 [ACK] Seq=12946 Ack=196114 Win=5596 Len=0 TSval=1085388513 TSecr=2675496241"
"23.722023","54.38.73.16","172.18.0.2","TLSv1.2","1516","Application Data [TCP segment of a reassembled PDU]"
"23.722066","172.18.0.2","54.38.73.16","TCP","68","36876 → 21002 [ACK] Seq=12946 Ack=197562 Win=5585 Len=0 TSval=1085388513 TSecr=2675496247"
"23.746959","54.38.73.16","172.18.0.2","TLSv1.2","5577","Application Data, Application Data"
"23.746992","172.18.0.2","54.38.73.16","TCP","68","36876 → 21002 [ACK] Seq=12946 Ack=203071 Win=5582 Len=0 TSval=1085388537 TSecr=2675496293"
"23.747959","172.18.0.2","54.38.73.16","TLSv1.2","611","Application Data"
"23.771683","54.38.73.16","172.18.0.2","TLSv1.2","5809","Application Data, Application Data, Application Data"
"23.771858","172.18.0.2","54.38.73.16","TCP","68","36876 → 21002 [ACK] Seq=13489 Ack=208812 Win=5581 Len=0 TSval=1085388562 TSecr=2675496299"
"23.772299","54.38.73.16","172.18.0.2","TCP","68","21002 → 36876 [ACK] Seq=208812 Ack=13489 Win=1452 Len=0 TSval=2675496300 TSecr=1085388538"
"23.796773","54.38.73.16","172.18.0.2","TLSv1.2","4752","Application Data, Application Data"
"23.796819","172.18.0.2","54.38.73.16","TCP","68","36876 → 21002 [ACK] Seq=13489 Ack=213496 Win=5585 Len=0 TSval=1085388587 TSecr=2675496306"
"23.822143","54.38.73.16","172.18.0.2","TLSv1.2","3695","Application Data"
"23.822294","172.18.0.2","54.38.73.16","TCP","68","36876 → 21002 [ACK] Seq=13489 Ack=217123 Win=5580 Len=0 TSval=1085388613 TSecr=2675496312"
"23.824342","54.38.73.16","172.18.0.2","TCP","1516","[TCP segment of a reassembled PDU]"
"23.847319","54.38.73.16","172.18.0.2","TLSv1.2","2790","Application Data, Application Data"
"23.847350","172.18.0.2","54.38.73.16","TCP","68","36876 → 21002 [ACK] Seq=13489 Ack=221293 Win=5596 Len=0 TSval=1085388638 TSecr=2675496313"
"23.847935","172.18.0.2","54.38.73.16","TLSv1.2","611","Application Data"
"23.866624","54.38.73.16","172.18.0.2","TCP","1516","[TCP segment of a reassembled PDU]"
"23.872198","54.38.73.16","172.18.0.2","TLSv1.2","3818","Application Data, Application Data"
"23.872315","172.18.0.2","54.38.73.16","TCP","68","36876 → 21002 [ACK] Seq=14032 Ack=226491 Win=5580 Len=0 TSval=1085388663 TSecr=2675496323"
"23.915118","54.38.73.16","172.18.0.2","TCP","68","21002 → 36876 [ACK] Seq=226491 Ack=14032 Win=1452 Len=0 TSval=2675496335 TSecr=1085388638"
"23.957022","54.38.73.16","172.18.0.2","TLSv1.2","3695","Application Data"
"23.957082","172.18.0.2","54.38.73.16","TCP","68","36876 → 21002 [ACK] Seq=14032 Ack=230118 Win=5580 Len=0 TSval=1085388748 TSecr=2675496345"
"23.989652","54.38.73.16","172.18.0.2","TLSv1.2","2153","Application Data"
"23.989685","172.18.0.2","54.38.73.16","TCP","68","36876 → 21002 [ACK] Seq=14032 Ack=232203 Win=5599 Len=0 TSval=1085388780 TSecr=2675496354"
"24.000380","54.38.73.16","172.18.0.2","TCP","2964","[TCP segment of a reassembled PDU]"
"24.000597","172.18.0.2","54.38.73.16","TCP","68","36876 → 21002 [ACK] Seq=14032 Ack=235099 Win=5596 Len=0 TSval=1085388791 TSecr=2675496357"
"24.014905","54.38.73.16","172.18.0.2","TLSv1.2","285","Application Data"
"24.056141","172.18.0.2","54.38.73.16","TCP","68","36876 → 21002 [ACK] Seq=14032 Ack=235316 Win=5612 Len=0 TSval=1085388847 TSecr=2675496360"
"24.078573","54.38.73.16","172.18.0.2","TLSv1.2","4412","Application Data"
"24.078629","172.18.0.2","54.38.73.16","TCP","68","36876 → 21002 [ACK] Seq=14032 Ack=239660 Win=5580 Len=0 TSval=1085388869 TSecr=2675496376"
"24.094836","54.38.73.16","172.18.0.2","TCP","1516","21002 → 36876 [ACK] Seq=239660 Ack=14032 Win=1452 Len=1448 TSval=2675496380 TSecr=1085388847 [TCP segment of a reassembled PDU]"
"24.103163","54.38.73.16","172.18.0.2","TLSv1.2","2964","Application Data [TCP segment of a reassembled PDU]"
"24.103196","172.18.0.2","54.38.73.16","TCP","68","36876 → 21002 [ACK] Seq=14032 Ack=244004 Win=5596 Len=0 TSval=1085388894 TSecr=2675496380"
"24.105467","54.38.73.16","172.18.0.2","TCP","1516","21002 → 36876 [ACK] Seq=244004 Ack=14032 Win=1452 Len=1448 TSval=2675496383 TSecr=1085388869 [TCP segment of a reassembled PDU]"
"24.127270","54.38.73.16","172.18.0.2","TLSv1.2","2964","Application Data, Application Data"
"24.127303","172.18.0.2","54.38.73.16","TCP","68","36876 → 21002 [ACK] Seq=14032 Ack=248348 Win=5596 Len=0 TSval=1085388918 TSecr=2675496383"
"24.127870","172.18.0.2","54.38.73.16","TLSv1.2","611","Application Data"
"24.140275","54.38.73.16","172.18.0.2","TCP","1516","21002 → 36876 [ACK] Seq=248348 Ack=14032 Win=1452 Len=1448 TSval=2675496391 TSecr=1085388894 [TCP segment of a reassembled PDU]"
"24.152104","54.38.73.16","172.18.0.2","TLSv1.2","4295","Application Data, Application Data, Application Data"
"24.152242","172.18.0.2","54.38.73.16","TCP","68","36876 → 21002 [ACK] Seq=14575 Ack=254023 Win=5580 Len=0 TSval=1085388943 TSecr=2675496391"
"24.189664","54.38.73.16","172.18.0.2","TCP","68","21002 → 36876 [ACK] Seq=254023 Ack=14575 Win=1452 Len=0 TSval=2675496404 TSecr=1085388918"
"24.189693","172.18.0.2","54.38.73.16","TLSv1.2","611","Application Data"
"24.264867","54.38.73.16","172.18.0.2","TCP","68","21002 → 36876 [ACK] Seq=254023 Ack=15118 Win=1452 Len=0 TSval=2675496423 TSecr=1085388980"
"25.565753","54.38.73.16","172.18.0.2","TLSv1.2","611","Application Data"
"25.565801","172.18.0.2","54.38.73.16","TCP","68","36876 → 21002 [ACK] Seq=15118 Ack=254566 Win=5608 Len=0 TSval=1085390356 TSecr=2675496729"
"25.566703","172.18.0.2","54.38.73.16","TLSv1.2","611","Application Data"
"25.591629","54.38.73.16","172.18.0.2","TCP","68","21002 → 36876 [ACK] Seq=254566 Ack=15661 Win=1452 Len=0 TSval=2675496754 TSecr=1085390357"
"26.452124","02:42:09:5f:bf:77","","ARP","44","Who has 172.18.0.2? Tell 172.18.0.1"
"26.452185","02:42:ac:12:00:02","","ARP","44","172.18.0.2 is at 02:42:ac:12:00:02"
"26.793836","54.38.73.16","172.18.0.2","TCP","1516","[TCP segment of a reassembled PDU]"
"26.794013","54.38.73.16","172.18.0.2","TLSv1.2","2247","Application Data"
"26.794018","54.38.73.16","172.18.0.2","TLSv1.2","1516","Application Data"
"26.794021","54.38.73.16","172.18.0.2","TCP","1516","21002 → 36876 [ACK] Seq=259641 Ack=15661 Win=1452 Len=1448 TSval=2675497030 TSecr=1085390357 [TCP segment of a reassembled PDU]"
"26.794132","172.18.0.2","54.38.73.16","TCP","68","36876 → 21002 [ACK] Seq=15661 Ack=261089 Win=5584 Len=0 TSval=1085391585 TSecr=2675496987"
"26.794542","172.18.0.2","54.38.73.16","TLSv1.2","611","Application Data"
"26.819261","54.38.73.16","172.18.0.2","TCP","68","[TCP Previous segment not captured] 21002 → 36876 [ACK] Seq=266533 Ack=16204 Win=1452 Len=0 TSval=2675497061 TSecr=1085391585"
"26.819277","54.38.73.16","172.18.0.2","TCP","5512","[TCP Retransmission] 21002 → 36876 [PSH, ACK] Seq=261089 Ack=15661 Win=1452 Len=5444 TSval=2675497061 TSecr=1085391585"
"26.819479","172.18.0.2","54.38.73.16","TCP","68","36876 → 21002 [ACK] Seq=16204 Ack=266533 Win=5582 Len=0 TSval=1085391610 TSecr=2675497061"
"26.844353","54.38.73.16","172.18.0.2","TLSv1.2","5809","Application Data, Application Data, Application Data"
"26.844538","172.18.0.2","54.38.73.16","TCP","68","36876 → 21002 [ACK] Seq=16204 Ack=272274 Win=5581 Len=0 TSval=1085391635 TSecr=2675497067"
"26.873254","54.38.73.16","172.18.0.2","TLSv1.2","5809","Application Data, Application Data, Application Data"
"26.873292","172.18.0.2","54.38.73.16","TCP","68","36876 → 21002 [ACK] Seq=16204 Ack=278015 Win=5581 Len=0 TSval=1085391664 TSecr=2675497074"
"26.899125","54.38.73.16","172.18.0.2","TLSv1.2","5809","Application Data, Application Data, Application Data"
"26.899184","172.18.0.2","54.38.73.16","TCP","68","36876 → 21002 [ACK] Seq=16204 Ack=283756 Win=5581 Len=0 TSval=1085391690 TSecr=2675497081"
"26.899609","172.18.0.2","54.38.73.16","TLSv1.2","611","Application Data"
"26.923888","54.38.73.16","172.18.0.2","TLSv1.2","5809","Application Data, Application Data, Application Data"
"26.923921","172.18.0.2","54.38.73.16","TCP","68","36876 → 21002 [ACK] Seq=16747 Ack=289497 Win=5581 Len=0 TSval=1085391714 TSecr=2675497087"
"26.948077","54.38.73.16","172.18.0.2","TLSv1.2","4752","Application Data, Application Data"
"26.948123","172.18.0.2","54.38.73.16","TCP","68","36876 → 21002 [ACK] Seq=16747 Ack=294181 Win=5585 Len=0 TSval=1085391739 TSecr=2675497093"
"26.971949","54.38.73.16","172.18.0.2","TLSv1.2","1639","Application Data"
"26.971980","172.18.0.2","54.38.73.16","TCP","68","36876 → 21002 [ACK] Seq=16747 Ack=295752 Win=5601 Len=0 TSval=1085391762 TSecr=2675497099"
"27.070626","54.38.73.16","172.18.0.2","TLSv1.2","3695","Application Data"
"27.070784","172.18.0.2","54.38.73.16","TCP","68","36876 → 21002 [ACK] Seq=16747 Ack=299379 Win=5580 Len=0 TSval=1085391861 TSecr=2675497124"
"27.079164","54.38.73.16","172.18.0.2","TCP","1516","[TCP segment of a reassembled PDU]"
"27.095769","54.38.73.16","172.18.0.2","TLSv1.2","2964","Application Data [TCP segment of a reassembled PDU]"
"27.095809","172.18.0.2","54.38.73.16","TCP","68","36876 → 21002 [ACK] Seq=16747 Ack=303723 Win=5596 Len=0 TSval=1085391886 TSecr=2675497126"
"27.103399","54.38.73.16","172.18.0.2","TCP","1516","21002 → 36876 [ACK] Seq=303723 Ack=16747 Win=1452 Len=1448 TSval=2675497132 TSecr=1085391861 [TCP segment of a reassembled PDU]"
"27.121350","54.38.73.16","172.18.0.2","TLSv1.2","2964","Application Data [TCP segment of a reassembled PDU]"
"27.121383","172.18.0.2","54.38.73.16","TCP","68","36876 → 21002 [ACK] Seq=16747 Ack=308067 Win=5596 Len=0 TSval=1085391912 TSecr=2675497132"
"27.123503","54.38.73.16","172.18.0.2","TCP","1516","21002 → 36876 [ACK] Seq=308067 Ack=16747 Win=1452 Len=1448 TSval=2675497137 TSecr=1085391886 [TCP segment of a reassembled PDU]"
"27.146206","54.38.73.16","172.18.0.2","TLSv1.2","2964","Application Data, Application Data, Application Data"
"27.146271","172.18.0.2","54.38.73.16","TCP","68","36876 → 21002 [ACK] Seq=16747 Ack=312411 Win=5596 Len=0 TSval=1085391937 TSecr=2675497137"
"27.146735","172.18.0.2","54.38.73.16","TLSv1.2","1125","Application Data"
"27.155259","54.38.73.16","172.18.0.2","TCP","1516","21002 → 36876 [ACK] Seq=312411 Ack=16747 Win=1452 Len=1448 TSval=2675497145 TSecr=1085391912 [TCP segment of a reassembled PDU]"
"27.171330","54.38.73.16","172.18.0.2","TLSv1.2","2964","Application Data, Application Data"
"27.171362","172.18.0.2","54.38.73.16","TCP","68","36876 → 21002 [ACK] Seq=17804 Ack=316755 Win=5596 Len=0 TSval=1085391962 TSecr=2675497145"
"27.175571","54.38.73.16","172.18.0.2","TCP","1516","21002 → 36876 [ACK] Seq=316755 Ack=17804 Win=1452 Len=1448 TSval=2675497150 TSecr=1085391937 [TCP segment of a reassembled PDU]"
"27.195674","54.38.73.16","172.18.0.2","TLSv1.2","1516","Application Data, Application Data"
"27.195862","172.18.0.2","54.38.73.16","TCP","68","36876 → 21002 [ACK] Seq=17804 Ack=319651 Win=5593 Len=0 TSval=1085391986 TSecr=2675497150"
"27.196038","54.38.73.16","172.18.0.2","TCP","1516","21002 → 36876 [ACK] Seq=319651 Ack=17804 Win=1452 Len=1448 TSval=2675497155 TSecr=1085391962 [TCP segment of a reassembled PDU]"
"27.208023","54.38.73.16","172.18.0.2","TCP","1516","21002 → 36876 [ACK] Seq=321099 Ack=17804 Win=1452 Len=1448 TSval=2675497158 TSecr=1085391962 [TCP segment of a reassembled PDU]"
"27.208074","172.18.0.2","54.38.73.16","TCP","68","36876 → 21002 [ACK] Seq=17804 Ack=322547 Win=5593 Len=0 TSval=1085391999 TSecr=2675497155"
"27.221372","54.38.73.16","172.18.0.2","TLSv1.2","2964","Application Data, Application Data, Application Data"
"27.221405","172.18.0.2","54.38.73.16","TCP","68","36876 → 21002 [ACK] Seq=17804 Ack=325443 Win=5596 Len=0 TSval=1085392012 TSecr=2675497162"
"27.231939","54.38.73.16","172.18.0.2","TLSv1.2","2964","Application Data, Application Data"
"27.231984","172.18.0.2","54.38.73.16","TCP","68","36876 → 21002 [ACK] Seq=17804 Ack=328339 Win=5596 Len=0 TSval=1085392022 TSecr=2675497164"
"27.240402","54.38.73.16","172.18.0.2","TCP","1516","21002 → 36876 [ACK] Seq=328339 Ack=17804 Win=1452 Len=1448 TSval=2675497166 TSecr=1085391999 [TCP segment of a reassembled PDU]"
"27.244822","54.38.73.16","172.18.0.2","TLSv1.2","1478","Application Data, Application Data"
"27.244988","172.18.0.2","54.38.73.16","TCP","68","36876 → 21002 [ACK] Seq=17804 Ack=331197 Win=5593 Len=0 TSval=1085392035 TSecr=2675497166"
"27.304436","54.38.73.16","172.18.0.2","TLSv1.2","1125","Application Data"
"27.305349","172.18.0.2","54.38.73.16","TLSv1.2","611","Application Data"
"27.368259","54.38.73.16","172.18.0.2","TCP","68","21002 → 36876 [ACK] Seq=332254 Ack=18347 Win=1452 Len=0 TSval=2675497199 TSecr=1085392096"
"27.368301","172.18.0.2","54.38.73.16","TLSv1.2","611","Application Data"
"27.432559","54.38.73.16","172.18.0.2","TCP","68","21002 → 36876 [ACK] Seq=332254 Ack=18890 Win=1452 Len=0 TSval=2675497215 TSecr=1085392159"
"27.475856","54.38.73.16","172.18.0.2","TLSv1.2","611","Application Data"
"27.516145","172.18.0.2","54.38.73.16","TCP","68","36876 → 21002 [ACK] Seq=18890 Ack=332797 Win=5612 Len=0 TSval=1085392307 TSecr=2675497225"
"28.637651","54.38.73.16","172.18.0.2","TLSv1.2","611","Application Data"
"28.637718","172.18.0.2","54.38.73.16","TCP","68","36876 → 21002 [ACK] Seq=18890 Ack=333340 Win=5608 Len=0 TSval=1085393428 TSecr=2675497442"
"28.637667","54.38.73.16","172.18.0.2","TLSv1.2","611","[TCP Spurious Retransmission] , Application Data"
"28.637731","172.18.0.2","54.38.73.16","TCP","80","[TCP Dup ACK 325#1] 36876 → 21002 [ACK] Seq=18890 Ack=333340 Win=5608 Len=0 TSval=1085393428 TSecr=2675497503 SLE=332797 SRE=333340"
"28.638818","172.18.0.2","54.38.73.16","TLSv1.2","611","Application Data"
"28.663111","54.38.73.16","172.18.0.2","TCP","68","21002 → 36876 [ACK] Seq=333340 Ack=19433 Win=1452 Len=0 TSval=2675497522 TSecr=1085393429"
"29.866114","54.38.73.16","172.18.0.2","TLSv1.2","611","Application Data"
"29.866189","172.18.0.2","54.38.73.16","TCP","68","36876 → 21002 [ACK] Seq=19433 Ack=333883 Win=5608 Len=0 TSval=1085394657 TSecr=2675497794"
"30.071243","54.38.73.16","172.18.0.2","TCP","1516","[TCP segment of a reassembled PDU]"
"30.071273","172.18.0.2","54.38.73.16","TCP","68","36876 → 21002 [ACK] Seq=19433 Ack=335331 Win=5597 Len=0 TSval=1085394862 TSecr=2675497858"
"30.071455","54.38.73.16","172.18.0.2","TLSv1.2","2247","Application Data"
"30.071477","172.18.0.2","54.38.73.16","TCP","68","36876 → 21002 [ACK] Seq=19433 Ack=337510 Win=5599 Len=0 TSval=1085394862 TSecr=2675497858"
"30.095249","54.38.73.16","172.18.0.2","TLSv1.2","799","[TCP Previous segment not captured] , Ignored Unknown Record"
"30.095286","172.18.0.2","54.38.73.16","TCP","80","[TCP Dup ACK 335#1] 36876 → 21002 [ACK] Seq=19433 Ack=337510 Win=5599 Len=0 TSval=1085394886 TSecr=2675497858 SLE=340406 SRE=341137"
"30.100609","54.38.73.16","172.18.0.2","TCP","2964","[TCP segment of a reassembled PDU]"
"30.100646","172.18.0.2","54.38.73.16","TCP","80","[TCP Dup ACK 335#2] 36876 → 21002 [ACK] Seq=19433 Ack=337510 Win=5599 Len=0 TSval=1085394891 TSecr=2675497858 SLE=340406 SRE=344033"
"30.119084","54.38.73.16","172.18.0.2","TLSv1.2","1516","Application Data [TCP segment of a reassembled PDU]"
"30.119121","172.18.0.2","54.38.73.16","TCP","80","[TCP Dup ACK 335#3] 36876 → 21002 [ACK] Seq=19433 Ack=337510 Win=5599 Len=0 TSval=1085394910 TSecr=2675497858 SLE=340406 SRE=345481"
"30.125201","54.38.73.16","172.18.0.2","TCP","2964","[TCP Fast Retransmission]  [TCP segment of a reassembled PDU]"
"30.125260","172.18.0.2","54.38.73.16","TCP","68","36876 → 21002 [ACK] Seq=19433 Ack=345481 Win=5549 Len=0 TSval=1085394916 TSecr=2675497888"
"30.150508","54.38.73.16","172.18.0.2","TLSv1.2","408","Application Data"
"30.150545","172.18.0.2","54.38.73.16","TCP","68","36876 → 21002 [ACK] Seq=19433 Ack=345821 Win=5593 Len=0 TSval=1085394941 TSecr=2675497894"
"30.175770","54.38.73.16","172.18.0.2","TLSv1.2","3695","Application Data"
"30.175802","172.18.0.2","54.38.73.16","TCP","68","36876 → 21002 [ACK] Seq=19433 Ack=349448 Win=5580 Len=0 TSval=1085394966 TSecr=2675497900"
"30.195703","54.38.73.16","172.18.0.2","TCP","1516","[TCP segment of a reassembled PDU]"
"30.195736","172.18.0.2","54.38.73.16","TCP","68","36876 → 21002 [ACK] Seq=19433 Ack=350896 Win=5593 Len=0 TSval=1085394986 TSecr=2675497905"
"30.201199","54.38.73.16","172.18.0.2","TLSv1.2","3304","Application Data, Application Data"
"30.201230","172.18.0.2","54.38.73.16","TCP","68","36876 → 21002 [ACK] Seq=19433 Ack=354132 Win=5580 Len=0 TSval=1085394992 TSecr=2675497907"
"30.378777","54.38.73.16","172.18.0.2","TLSv1.2","2153","Application Data"
"30.378808","172.18.0.2","54.38.73.16","TCP","68","36876 → 21002 [ACK] Seq=19433 Ack=356217 Win=5577 Len=0 TSval=1085395169 TSecr=2675497946"
"30.386545","172.18.0.2","54.38.73.16","TLSv1.2","611","Application Data"
"30.411586","54.38.73.16","172.18.0.2","TCP","68","21002 → 36876 [ACK] Seq=356217 Ack=19976 Win=1452 Len=0 TSval=2675497959 TSecr=1085395177"
"31.709867","54.38.73.16","172.18.0.2","TLSv1.2","611","Application Data"
"31.709938","172.18.0.2","54.38.73.16","TCP","68","36876 → 21002 [ACK] Seq=19976 Ack=356760 Win=5608 Len=0 TSval=1085396500 TSecr=2675498207"
"31.710075","54.38.73.16","172.18.0.2","TLSv1.2","611","[TCP Spurious Retransmission] , Application Data"
"31.710103","172.18.0.2","54.38.73.16","TCP","80","[TCP Window Update] 36876 → 21002 [ACK] Seq=19976 Ack=356760 Win=5612 Len=0 TSval=1085396501 TSecr=2675498275 SLE=356217 SRE=356760"
"31.710851","172.18.0.2","54.38.73.16","TLSv1.2","611","Application Data"
"31.735321","54.38.73.16","172.18.0.2","TCP","68","21002 → 36876 [ACK] Seq=356760 Ack=20519 Win=1452 Len=0 TSval=2675498290 TSecr=1085396501"
