_ws.col.Time,_ws.col.Source,_ws.col.Destination,_ws.col.Protocol,_ws.col.Length,_ws.col.Info
"0.000000","172.19.0.3","5.9.29.183","TLSv1.2","599","Application Data"
"0.000324","5.9.29.183","172.19.0.3","TCP","56","9002 → 43520 [ACK] Seq=1 Ack=544 Win=65535 Len=0"
"0.209200","5.9.29.183","172.19.0.3","TLSv1.2","599","Application Data"
"0.209232","172.19.0.3","5.9.29.183","TCP","56","43520 → 9002 [ACK] Seq=544 Ack=544 Win=11911 Len=0"
"0.210082","172.19.0.3","5.9.29.183","TLSv1.2","2141","Application Data"
"0.210316","5.9.29.183","172.19.0.3","TCP","56","9002 → 43520 [ACK] Seq=544 Ack=2629 Win=65535 Len=0"
"0.666420","5.9.29.183","172.19.0.3","TLSv1.2","599","Application Data"
"0.697286","5.9.29.183","172.19.0.3","TCP","1516","[TCP segment of a reassembled PDU]"
"0.697308","172.19.0.3","5.9.29.183","TCP","56","43520 → 9002 [ACK] Seq=2629 Ack=2547 Win=11911 Len=0"
"0.697323","5.9.29.183","172.19.0.3","TLSv1.2","167","Application Data"
"0.701951","172.19.0.3","5.9.29.183","TLSv1.2","599","Application Data"
"0.702294","5.9.29.183","172.19.0.3","TCP","56","9002 → 43520 [ACK] Seq=2658 Ack=3172 Win=65535 Len=0"
"0.891678","5.9.29.183","172.19.0.3","TLSv1.2","599","Application Data"
"0.892537","172.19.0.3","5.9.29.183","TLSv1.2","599","Application Data"
"0.892854","5.9.29.183","172.19.0.3","TCP","56","9002 → 43520 [ACK] Seq=3201 Ack=3715 Win=65535 Len=0"
"1.128971","5.9.29.183","172.19.0.3","TLSv1.2","599","Application Data"
"1.143731","5.9.29.183","172.19.0.3","TCP","1504","[TCP segment of a reassembled PDU]"
"1.143780","172.19.0.3","5.9.29.183","TCP","56","43520 → 9002 [ACK] Seq=3715 Ack=5192 Win=11911 Len=0"
"1.143798","5.9.29.183","172.19.0.3","TCP","1516","9002 → 43520 [PSH, ACK] Seq=5192 Ack=3715 Win=65535 Len=1460 [TCP segment of a reassembled PDU]"
"1.143811","5.9.29.183","172.19.0.3","TLSv1.2","775","Application Data"
"1.143961","172.19.0.3","5.9.29.183","TCP","56","43520 → 9002 [ACK] Seq=3715 Ack=7371 Win=11895 Len=0"
"1.155959","5.9.29.183","172.19.0.3","TCP","1504","[TCP segment of a reassembled PDU]"
"1.156021","5.9.29.183","172.19.0.3","TCP","1516","9002 → 43520 [PSH, ACK] Seq=8819 Ack=3715 Win=65535 Len=1460 [TCP segment of a reassembled PDU]"
"1.156037","172.19.0.3","5.9.29.183","TCP","56","43520 → 9002 [ACK] Seq=3715 Ack=10279 Win=11903 Len=0"
"1.156041","5.9.29.183","172.19.0.3","TLSv1.2","1516","Application Data [TCP segment of a reassembled PDU]"
"1.156043","5.9.29.183","172.19.0.3","TCP","1516","9002 → 43520 [PSH, ACK] Seq=11739 Ack=3715 Win=65535 Len=1460 [TCP segment of a reassembled PDU]"
"1.156153","5.9.29.183","172.19.0.3","TCP","1468","9002 → 43520 [PSH, ACK] Seq=13199 Ack=3715 Win=65535 Len=1412 [TCP segment of a reassembled PDU]"
"1.156252","172.19.0.3","5.9.29.183","TCP","56","43520 → 9002 [ACK] Seq=3715 Ack=14611 Win=11879 Len=0"
"1.159413","5.9.29.183","172.19.0.3","TLSv1.2","1127","Application Data, Application Data"
"1.173776","5.9.29.183","172.19.0.3","TCP","1516","[TCP segment of a reassembled PDU]"
"1.173788","172.19.0.3","5.9.29.183","TCP","56","43520 → 9002 [ACK] Seq=3715 Ack=17142 Win=11911 Len=0"
"1.173796","5.9.29.183","172.19.0.3","TCP","1492","9002 → 43520 [PSH, ACK] Seq=17142 Ack=3715 Win=65535 Len=1436 [TCP segment of a reassembled PDU]"
"1.174249","5.9.29.183","172.19.0.3","TLSv1.2","1330","Application Data, Application Data"
"1.174298","172.19.0.3","5.9.29.183","TCP","56","43520 → 9002 [ACK] Seq=3715 Ack=19852 Win=11909 Len=0"
"1.185008","5.9.29.183","172.19.0.3","TCP","1516","[TCP segment of a reassembled PDU]"
"1.185033","5.9.29.183","172.19.0.3","TCP","1516","9002 → 43520 [PSH, ACK] Seq=21312 Ack=3715 Win=65535 Len=1460 [TCP segment of a reassembled PDU]"
"1.185038","5.9.29.183","172.19.0.3","TLSv1.2","1516","Application Data [TCP segment of a reassembled PDU]"
"1.185040","5.9.29.183","172.19.0.3","TCP","1468","9002 → 43520 [PSH, ACK] Seq=24232 Ack=3715 Win=65535 Len=1412 [TCP segment of a reassembled PDU]"
"1.185143","172.19.0.3","5.9.29.183","TCP","56","43520 → 9002 [ACK] Seq=3715 Ack=25644 Win=11887 Len=0"
"1.189457","5.9.29.183","172.19.0.3","TLSv1.2","1004","Application Data"
"1.192754","172.19.0.3","5.9.29.183","TLSv1.2","599","Application Data"
"1.193044","5.9.29.183","172.19.0.3","TCP","56","9002 → 43520 [ACK] Seq=26592 Ack=4258 Win=65535 Len=0"
"1.405562","5.9.29.183","172.19.0.3","TLSv1.2","599","Application Data"
"1.406104","172.19.0.3","5.9.29.183","TLSv1.2","599","Application Data"
"1.406456","5.9.29.183","172.19.0.3","TCP","56","9002 → 43520 [ACK] Seq=27135 Ack=4801 Win=65535 Len=0"
"1.636825","5.9.29.183","172.19.0.3","TLSv1.2","599","Application Data"
"1.649190","5.9.29.183","172.19.0.3","TCP","1504","[TCP segment of a reassembled PDU]"
"1.649209","172.19.0.3","5.9.29.183","TCP","56","43520 → 9002 [ACK] Seq=4801 Ack=29126 Win=11911 Len=0"
"1.649222","5.9.29.183","172.19.0.3","TCP","650","9002 → 43520 [PSH, ACK] Seq=29126 Ack=4801 Win=65535 Len=594 [TCP segment of a reassembled PDU]"
"1.649230","5.9.29.183","172.19.0.3","TCP","1516","9002 → 43520 [PSH, ACK] Seq=29720 Ack=4801 Win=65535 Len=1460 [TCP segment of a reassembled PDU]"
"1.649233","5.9.29.183","172.19.0.3","TLSv1.2","1516","Application Data [TCP segment of a reassembled PDU]"
"1.649236","5.9.29.183","172.19.0.3","TCP","1516","9002 → 43520 [PSH, ACK] Seq=32640 Ack=4801 Win=65535 Len=1460 [TCP segment of a reassembled PDU]"
"1.649369","5.9.29.183","172.19.0.3","TCP","1516","9002 → 43520 [PSH, ACK] Seq=34100 Ack=4801 Win=65535 Len=1460 [TCP segment of a reassembled PDU]"
"1.649378","5.9.29.183","172.19.0.3","TLSv1.2","1516","Application Data [TCP segment of a reassembled PDU]"
"1.649381","5.9.29.183","172.19.0.3","TCP","1516","9002 → 43520 [PSH, ACK] Seq=37020 Ack=4801 Win=65535 Len=1460 [TCP segment of a reassembled PDU]"
"1.649396","5.9.29.183","172.19.0.3","TCP","838","9002 → 43520 [PSH, ACK] Seq=38480 Ack=4801 Win=65535 Len=782 [TCP segment of a reassembled PDU]"
"1.649465","172.19.0.3","5.9.29.183","TCP","56","43520 → 9002 [ACK] Seq=4801 Ack=39262 Win=11845 Len=0"
"1.651986","5.9.29.183","172.19.0.3","TLSv1.2","381","Application Data"
"1.652202","172.19.0.3","5.9.29.183","TLSv1.2","599","Application Data"
"1.652479","5.9.29.183","172.19.0.3","TCP","56","9002 → 43520 [ACK] Seq=39587 Ack=5344 Win=65535 Len=0"
"1.665452","5.9.29.183","172.19.0.3","TCP","1516","[TCP segment of a reassembled PDU]"
"1.665508","5.9.29.183","172.19.0.3","TCP","1516","9002 → 43520 [PSH, ACK] Seq=41047 Ack=5344 Win=65535 Len=1460 [TCP segment of a reassembled PDU]"
"1.665514","5.9.29.183","172.19.0.3","TLSv1.2","1516","Application Data [TCP segment of a reassembled PDU]"
"1.665517","5.9.29.183","172.19.0.3","TCP","1516","9002 → 43520 [PSH, ACK] Seq=43967 Ack=5344 Win=65535 Len=1460 [TCP segment of a reassembled PDU]"
"1.665519","5.9.29.183","172.19.0.3","TCP","1456","9002 → 43520 [PSH, ACK] Seq=45427 Ack=5344 Win=65535 Len=1400 [TCP segment of a reassembled PDU]"
"1.665714","172.19.0.3","5.9.29.183","TCP","56","43520 → 9002 [ACK] Seq=5344 Ack=46827 Win=11879 Len=0"
"1.667312","5.9.29.183","172.19.0.3","TLSv1.2","1127","Application Data, Application Data"
"1.671177","172.19.0.3","5.9.29.183","TLSv1.2","599","Application Data"
"1.671584","5.9.29.183","172.19.0.3","TCP","56","9002 → 43520 [ACK] Seq=47898 Ack=5887 Win=65535 Len=0"
"1.884707","5.9.29.183","172.19.0.3","TLSv1.2","599","Application Data"
"1.885349","172.19.0.3","5.9.29.183","TLSv1.2","599","Application Data"
"1.885959","5.9.29.183","172.19.0.3","TCP","56","9002 → 43520 [ACK] Seq=48441 Ack=6430 Win=65535 Len=0"
"2.115694","5.9.29.183","172.19.0.3","TCP","1516","[TCP segment of a reassembled PDU]"
"2.115724","5.9.29.183","172.19.0.3","TCP","1492","9002 → 43520 [PSH, ACK] Seq=49901 Ack=6430 Win=65535 Len=1436 [TCP segment of a reassembled PDU]"
"2.115731","5.9.29.183","172.19.0.3","TLSv1.2","787","Application Data"
"2.115843","172.19.0.3","5.9.29.183","TCP","56","43520 → 9002 [ACK] Seq=6430 Ack=52068 Win=11895 Len=0"
"2.128489","5.9.29.183","172.19.0.3","TCP","1504","[TCP segment of a reassembled PDU]"
"2.128603","5.9.29.183","172.19.0.3","TCP","1516","9002 → 43520 [PSH, ACK] Seq=53516 Ack=6430 Win=65535 Len=1460 [TCP segment of a reassembled PDU]"
"2.128618","172.19.0.3","5.9.29.183","TCP","56","43520 → 9002 [ACK] Seq=6430 Ack=54976 Win=11903 Len=0"
"2.128621","5.9.29.183","172.19.0.3","TLSv1.2","1516","Application Data [TCP segment of a reassembled PDU]"
"2.128625","5.9.29.183","172.19.0.3","TCP","1516","9002 → 43520 [PSH, ACK] Seq=56436 Ack=6430 Win=65535 Len=1460 [TCP segment of a reassembled PDU]"
"2.128663","5.9.29.183","172.19.0.3","TCP","1468","9002 → 43520 [PSH, ACK] Seq=57896 Ack=6430 Win=65535 Len=1412 [TCP segment of a reassembled PDU]"
"2.128745","5.9.29.183","172.19.0.3","TLSv1.2","1516","Application Data [TCP segment of a reassembled PDU]"
"2.128753","5.9.29.183","172.19.0.3","TCP","1492","9002 → 43520 [PSH, ACK] Seq=60768 Ack=6430 Win=65535 Len=1436 [TCP segment of a reassembled PDU]"
"2.128835","172.19.0.3","5.9.29.183","TCP","56","43520 → 9002 [ACK] Seq=6430 Ack=62204 Win=11861 Len=0"
"2.131993","5.9.29.183","172.19.0.3","TLSv1.2","1315","Application Data"
"2.144846","5.9.29.183","172.19.0.3","TCP","1504","[TCP segment of a reassembled PDU]"
"2.144874","172.19.0.3","5.9.29.183","TCP","56","43520 → 9002 [ACK] Seq=6430 Ack=64911 Win=11911 Len=0"
"2.144893","5.9.29.183","172.19.0.3","TCP","1516","9002 → 43520 [PSH, ACK] Seq=64911 Ack=6430 Win=65535 Len=1460 [TCP segment of a reassembled PDU]"
"2.144903","5.9.29.183","172.19.0.3","TLSv1.2","1516","Application Data [TCP segment of a reassembled PDU]"
"2.144909","5.9.29.183","172.19.0.3","TCP","1516","9002 → 43520 [PSH, ACK] Seq=67831 Ack=6430 Win=65535 Len=1460 [TCP segment of a reassembled PDU]"
"2.145087","5.9.29.183","172.19.0.3","TCP","1516","9002 → 43520 [PSH, ACK] Seq=69291 Ack=6430 Win=65535 Len=1460 [TCP segment of a reassembled PDU]"
"2.145095","5.9.29.183","172.19.0.3","TLSv1.2","1516","Application Data [TCP segment of a reassembled PDU]"
"2.145102","5.9.29.183","172.19.0.3","TCP","1516","9002 → 43520 [PSH, ACK] Seq=72211 Ack=6430 Win=65535 Len=1460 [TCP segment of a reassembled PDU]"
"2.145105","5.9.29.183","172.19.0.3","TCP","1516","9002 → 43520 [PSH, ACK] Seq=73671 Ack=6430 Win=65535 Len=1460 [TCP segment of a reassembled PDU]"
"2.145110","5.9.29.183","172.19.0.3","TLSv1.2","1516","Application Data [TCP segment of a reassembled PDU]"
"2.145113","5.9.29.183","172.19.0.3","TCP","1516","9002 → 43520 [PSH, ACK] Seq=76591 Ack=6430 Win=65535 Len=1460 [TCP segment of a reassembled PDU]"
"2.145116","5.9.29.183","172.19.0.3","TCP","1396","9002 → 43520 [PSH, ACK] Seq=78051 Ack=6430 Win=65535 Len=1340 [TCP segment of a reassembled PDU]"
"2.145183","172.19.0.3","5.9.29.183","TCP","56","43520 → 9002 [ACK] Seq=6430 Ack=79391 Win=11830 Len=0"
"2.145676","172.19.0.3","5.9.29.183","TLSv1.2","599","Application Data"
"2.145880","5.9.29.183","172.19.0.3","TCP","56","9002 → 43520 [ACK] Seq=79391 Ack=6973 Win=65535 Len=0"
"2.147311","5.9.29.183","172.19.0.3","TLSv1.2","178","Application Data"
"2.161300","5.9.29.183","172.19.0.3","TCP","1516","[TCP segment of a reassembled PDU]"
"2.161317","172.19.0.3","5.9.29.183","TCP","56","43520 → 9002 [ACK] Seq=6973 Ack=80973 Win=11911 Len=0"
"2.161330","5.9.29.183","172.19.0.3","TCP","1492","9002 → 43520 [PSH, ACK] Seq=80973 Ack=6973 Win=65535 Len=1436 [TCP segment of a reassembled PDU]"
"2.161335","5.9.29.183","172.19.0.3","TLSv1.2","1516","Application Data [TCP segment of a reassembled PDU]"
"2.161458","5.9.29.183","172.19.0.3","TCP","1516","9002 → 43520 [PSH, ACK] Seq=83869 Ack=6973 Win=65535 Len=1460 [TCP segment of a reassembled PDU]"
"2.161467","5.9.29.183","172.19.0.3","TCP","1516","9002 → 43520 [PSH, ACK] Seq=85329 Ack=6973 Win=65535 Len=1460 [TCP segment of a reassembled PDU]"
"2.161471","5.9.29.183","172.19.0.3","TLSv1.2","1468","Application Data [TCP segment of a reassembled PDU]"
"2.161499","5.9.29.183","172.19.0.3","TCP","1516","9002 → 43520 [PSH, ACK] Seq=88201 Ack=6973 Win=65535 Len=1460 [TCP segment of a reassembled PDU]"
"2.161525","5.9.29.183","172.19.0.3","TCP","1516","9002 → 43520 [PSH, ACK] Seq=89661 Ack=6973 Win=65535 Len=1460 [TCP segment of a reassembled PDU]"
"2.161551","5.9.29.183","172.19.0.3","TLSv1.2","1516","Application Data [TCP segment of a reassembled PDU]"
"2.161554","5.9.29.183","172.19.0.3","TCP","1516","9002 → 43520 [PSH, ACK] Seq=92581 Ack=6973 Win=65535 Len=1460 [TCP segment of a reassembled PDU]"
"2.161602","5.9.29.183","172.19.0.3","TCP","1271","9002 → 43520 [PSH, ACK] Seq=94041 Ack=6973 Win=65535 Len=1215 [TCP segment of a reassembled PDU]"
"2.161643","5.9.29.183","172.19.0.3","TCP","241","9002 → 43520 [PSH, ACK] Seq=95256 Ack=6973 Win=65535 Len=185 [TCP segment of a reassembled PDU]"
"2.161690","172.19.0.3","5.9.29.183","TCP","56","43520 → 9002 [ACK] Seq=6973 Ack=95441 Win=11820 Len=0"
"2.162021","172.19.0.3","5.9.29.183","TLSv1.2","599","Application Data"
"2.162171","5.9.29.183","172.19.0.3","TCP","56","9002 → 43520 [ACK] Seq=95441 Ack=7516 Win=65535 Len=0"
"2.162521","5.9.29.183","172.19.0.3","TLSv1.2","721","Application Data, Application Data"
"2.178344","5.9.29.183","172.19.0.3","TLSv1.2","1516","Application Data"
"2.178380","172.19.0.3","5.9.29.183","TCP","56","43520 → 9002 [ACK] Seq=7516 Ack=97566 Win=11911 Len=0"
"2.178393","5.9.29.183","172.19.0.3","TCP","1516","9002 → 43520 [PSH, ACK] Seq=97566 Ack=7516 Win=65535 Len=1460 [TCP segment of a reassembled PDU]"
"2.178398","5.9.29.183","172.19.0.3","TCP","1480","9002 → 43520 [PSH, ACK] Seq=99026 Ack=7516 Win=65535 Len=1424 [TCP segment of a reassembled PDU]"
"2.178494","5.9.29.183","172.19.0.3","TLSv1.2","1516","Application Data [TCP segment of a reassembled PDU]"
"2.178500","5.9.29.183","172.19.0.3","TCP","1516","9002 → 43520 [PSH, ACK] Seq=101910 Ack=7516 Win=65535 Len=1460 [TCP segment of a reassembled PDU]"
"2.178502","5.9.29.183","172.19.0.3","TCP","1480","9002 → 43520 [PSH, ACK] Seq=103370 Ack=7516 Win=65535 Len=1424 [TCP segment of a reassembled PDU]"
"2.178567","5.9.29.183","172.19.0.3","TLSv1.2","736","Application Data, Application Data"
"2.178604","172.19.0.3","5.9.29.183","TCP","56","43520 → 9002 [ACK] Seq=7516 Ack=105474 Win=11863 Len=0"
"2.178891","172.19.0.3","5.9.29.183","TLSv1.2","599","Application Data"
"2.179035","5.9.29.183","172.19.0.3","TCP","56","9002 → 43520 [ACK] Seq=105474 Ack=8059 Win=65535 Len=0"
"2.188535","172.19.0.3","5.9.29.183","TLSv1.2","599","Application Data"
"2.188891","5.9.29.183","172.19.0.3","TCP","56","9002 → 43520 [ACK] Seq=105474 Ack=8602 Win=65535 Len=0"
"2.437129","5.9.29.183","172.19.0.3","TLSv1.2","599","Application Data"
"2.437624","172.19.0.3","5.9.29.183","TLSv1.2","599","Application Data"
"2.437807","5.9.29.183","172.19.0.3","TCP","56","9002 → 43520 [ACK] Seq=106017 Ack=9145 Win=65535 Len=0"
"2.722029","5.9.29.183","172.19.0.3","TCP","1516","[TCP segment of a reassembled PDU]"
"2.722059","5.9.29.183","172.19.0.3","TCP","1516","9002 → 43520 [PSH, ACK] Seq=107477 Ack=9145 Win=65535 Len=1460 [TCP segment of a reassembled PDU]"
"2.722066","5.9.29.183","172.19.0.3","TLSv1.2","763","Application Data"
"2.722187","172.19.0.3","5.9.29.183","TCP","56","43520 → 9002 [ACK] Seq=9145 Ack=109644 Win=11895 Len=0"
"2.736360","5.9.29.183","172.19.0.3","TCP","1516","[TCP segment of a reassembled PDU]"
"2.736382","5.9.29.183","172.19.0.3","TCP","1492","9002 → 43520 [PSH, ACK] Seq=111104 Ack=9145 Win=65535 Len=1436 [TCP segment of a reassembled PDU]"
"2.736395","172.19.0.3","5.9.29.183","TCP","56","43520 → 9002 [ACK] Seq=9145 Ack=112540 Win=11901 Len=0"
"2.736398","5.9.29.183","172.19.0.3","TLSv1.2","1516","Application Data [TCP segment of a reassembled PDU]"
"2.736401","5.9.29.183","172.19.0.3","TCP","1516","9002 → 43520 [PSH, ACK] Seq=114000 Ack=9145 Win=65535 Len=1460 [TCP segment of a reassembled PDU]"
"2.736522","5.9.29.183","172.19.0.3","TCP","1516","9002 → 43520 [PSH, ACK] Seq=115460 Ack=9145 Win=65535 Len=1460 [TCP segment of a reassembled PDU]"
"2.736531","5.9.29.183","172.19.0.3","TLSv1.2","1516","Application Data [TCP segment of a reassembled PDU]"
"2.736536","5.9.29.183","172.19.0.3","TCP","1456","9002 → 43520 [PSH, ACK] Seq=118380 Ack=9145 Win=65535 Len=1400 [TCP segment of a reassembled PDU]"
"2.736609","172.19.0.3","5.9.29.183","TCP","56","43520 → 9002 [ACK] Seq=9145 Ack=119780 Win=11861 Len=0"
"2.740713","5.9.29.183","172.19.0.3","TCP","1504","9002 → 43520 [PSH, ACK] Seq=119780 Ack=9145 Win=65535 Len=1448 [TCP segment of a reassembled PDU]"
"2.741124","5.9.29.183","172.19.0.3","TLSv1.2","381","Application Data"
"2.741139","172.19.0.3","5.9.29.183","TCP","56","43520 → 9002 [ACK] Seq=9145 Ack=121553 Win=11911 Len=0"
"2.752994","5.9.29.183","172.19.0.3","TCP","1516","[TCP segment of a reassembled PDU]"
"2.753021","5.9.29.183","172.19.0.3","TCP","1492","9002 → 43520 [PSH, ACK] Seq=123013 Ack=9145 Win=65535 Len=1436 [TCP segment of a reassembled PDU]"
"2.753127","172.19.0.3","5.9.29.183","TCP","56","43520 → 9002 [ACK] Seq=9145 Ack=124449 Win=11903 Len=0"
"2.765842","5.9.29.183","172.19.0.3","TLSv1.2","1516","Application Data [TCP segment of a reassembled PDU]"
"2.765863","5.9.29.183","172.19.0.3","TCP","1516","9002 → 43520 [PSH, ACK] Seq=125909 Ack=9145 Win=65535 Len=1460 [TCP segment of a reassembled PDU]"
"2.765890","172.19.0.3","5.9.29.183","TCP","56","43520 → 9002 [ACK] Seq=9145 Ack=127369 Win=11903 Len=0"
"2.765894","5.9.29.183","172.19.0.3","TCP","1516","9002 → 43520 [PSH, ACK] Seq=127369 Ack=9145 Win=65535 Len=1460 [TCP segment of a reassembled PDU]"
"2.765909","5.9.29.183","172.19.0.3","TLSv1.2","1468","Application Data [TCP segment of a reassembled PDU]"
"2.765915","5.9.29.183","172.19.0.3","TCP","1516","9002 → 43520 [PSH, ACK] Seq=130241 Ack=9145 Win=65535 Len=1460 [TCP segment of a reassembled PDU]"
"2.766092","5.9.29.183","172.19.0.3","TCP","1516","9002 → 43520 [PSH, ACK] Seq=131701 Ack=9145 Win=65535 Len=1460 [TCP segment of a reassembled PDU]"
"2.766119","5.9.29.183","172.19.0.3","TLSv1.2","1516","Application Data [TCP segment of a reassembled PDU]"
"2.766125","5.9.29.183","172.19.0.3","TCP","1516","9002 → 43520 [PSH, ACK] Seq=134621 Ack=9145 Win=65535 Len=1460 [TCP segment of a reassembled PDU]"
"2.766180","5.9.29.183","172.19.0.3","TLSv1.2","1516","Application Data [TCP segment of a reassembled PDU]"
"2.766184","5.9.29.183","172.19.0.3","TCP","1516","9002 → 43520 [PSH, ACK] Seq=137541 Ack=9145 Win=65535 Len=1460 [TCP segment of a reassembled PDU]"
"2.766312","5.9.29.183","172.19.0.3","TCP","1516","9002 → 43520 [PSH, ACK] Seq=139001 Ack=9145 Win=65535 Len=1460 [TCP segment of a reassembled PDU]"
"2.766320","5.9.29.183","172.19.0.3","TLSv1.2","1368","Application Data, Application Data"
"2.766570","172.19.0.3","5.9.29.183","TCP","56","43520 → 9002 [ACK] Seq=9145 Ack=141773 Win=11820 Len=0"
"2.767736","172.19.0.3","5.9.29.183","TLSv1.2","599","Application Data"
"2.768239","5.9.29.183","172.19.0.3","TCP","56","9002 → 43520 [ACK] Seq=141773 Ack=9688 Win=65535 Len=0"
"2.770091","5.9.29.183","172.19.0.3","TCP","1504","[TCP segment of a reassembled PDU]"
"2.770129","5.9.29.183","172.19.0.3","TCP","1516","9002 → 43520 [PSH, ACK] Seq=143221 Ack=9688 Win=65535 Len=1460 [TCP segment of a reassembled PDU]"
"2.770166","172.19.0.3","5.9.29.183","TCP","56","43520 → 9002 [ACK] Seq=9688 Ack=144681 Win=11903 Len=0"
"2.770314","5.9.29.183","172.19.0.3","TLSv1.2","1492","Application Data [TCP segment of a reassembled PDU]"
"2.778672","172.19.0.3","5.9.29.183","TLSv1.2","599","Application Data"
"2.779065","5.9.29.183","172.19.0.3","TCP","56","9002 → 43520 [ACK] Seq=146117 Ack=10231 Win=65535 Len=0"
"2.780489","5.9.29.183","172.19.0.3","TLSv1.2","1516","Application Data [TCP segment of a reassembled PDU]"
"2.780500","5.9.29.183","172.19.0.3","TCP","1492","9002 → 43520 [PSH, ACK] Seq=147577 Ack=10231 Win=65535 Len=1436 [TCP segment of a reassembled PDU]"
"2.780557","172.19.0.3","5.9.29.183","TCP","56","43520 → 9002 [ACK] Seq=10231 Ack=149013 Win=11903 Len=0"
"2.783114","5.9.29.183","172.19.0.3","TCP","1516","9002 → 43520 [PSH, ACK] Seq=149013 Ack=10231 Win=65535 Len=1460 [TCP segment of a reassembled PDU]"
"2.783123","5.9.29.183","172.19.0.3","TLSv1.2","1516","Application Data [TCP segment of a reassembled PDU]"
"2.783129","172.19.0.3","5.9.29.183","TCP","56","43520 → 9002 [ACK] Seq=10231 Ack=151933 Win=11903 Len=0"
"2.783130","5.9.29.183","172.19.0.3","TCP","1516","9002 → 43520 [PSH, ACK] Seq=151933 Ack=10231 Win=65535 Len=1460 [TCP segment of a reassembled PDU]"
"2.783228","5.9.29.183","172.19.0.3","TLSv1.2","1516","Application Data [TCP segment of a reassembled PDU]"
"2.783235","5.9.29.183","172.19.0.3","TCP","1516","9002 → 43520 [PSH, ACK] Seq=154853 Ack=10231 Win=65535 Len=1460 [TCP segment of a reassembled PDU]"
"2.783255","5.9.29.183","172.19.0.3","TCP","1444","9002 → 43520 [PSH, ACK] Seq=156313 Ack=10231 Win=65535 Len=1388 [TCP segment of a reassembled PDU]"
"2.783258","5.9.29.183","172.19.0.3","TLSv1.2","1516","Application Data [TCP segment of a reassembled PDU]"
"2.783283","5.9.29.183","172.19.0.3","TCP","1516","9002 → 43520 [PSH, ACK] Seq=159161 Ack=10231 Win=65535 Len=1460 [TCP segment of a reassembled PDU]"
"2.783298","5.9.29.183","172.19.0.3","TCP","227","9002 → 43520 [PSH, ACK] Seq=160621 Ack=10231 Win=65535 Len=171 [TCP segment of a reassembled PDU]"
"2.783381","5.9.29.183","172.19.0.3","TCP","1516","9002 → 43520 [PSH, ACK] Seq=160792 Ack=10231 Win=65535 Len=1460 [TCP segment of a reassembled PDU]"
"2.783385","5.9.29.183","172.19.0.3","TLSv1.2","854","Application Data, Application Data"
"2.783405","172.19.0.3","5.9.29.183","TCP","56","43520 → 9002 [ACK] Seq=10231 Ack=163050 Win=11830 Len=0"
"2.788018","5.9.29.183","172.19.0.3","TCP","1516","[TCP segment of a reassembled PDU]"
"2.788056","5.9.29.183","172.19.0.3","TCP","1492","9002 → 43520 [PSH, ACK] Seq=164510 Ack=10231 Win=65535 Len=1436 [TCP segment of a reassembled PDU]"
"2.788068","172.19.0.3","5.9.29.183","TCP","56","43520 → 9002 [ACK] Seq=10231 Ack=165946 Win=11903 Len=0"
"2.788070","5.9.29.183","172.19.0.3","TLSv1.2","1516","Application Data [TCP segment of a reassembled PDU]"
"2.788144","5.9.29.183","172.19.0.3","TCP","1516","9002 → 43520 [PSH, ACK] Seq=167406 Ack=10231 Win=65535 Len=1460 [TCP segment of a reassembled PDU]"
"2.788148","5.9.29.183","172.19.0.3","TCP","1516","9002 → 43520 [PSH, ACK] Seq=168866 Ack=10231 Win=65535 Len=1460 [TCP segment of a reassembled PDU]"
"2.788150","5.9.29.183","172.19.0.3","TLSv1.2","1516","Application Data [TCP segment of a reassembled PDU]"
"2.788152","5.9.29.183","172.19.0.3","TCP","1456","9002 → 43520 [PSH, ACK] Seq=171786 Ack=10231 Win=65535 Len=1400 [TCP segment of a reassembled PDU]"
"2.788190","172.19.0.3","5.9.29.183","TCP","56","43520 → 9002 [ACK] Seq=10231 Ack=173186 Win=11861 Len=0"
"2.788516","172.19.0.3","5.9.29.183","TLSv1.2","599","Application Data"
"2.788656","5.9.29.183","172.19.0.3","TCP","56","9002 → 43520 [ACK] Seq=173186 Ack=10774 Win=65535 Len=0"
"2.794724","5.9.29.183","172.19.0.3","TCP","1504","9002 → 43520 [PSH, ACK] Seq=173186 Ack=10774 Win=65535 Len=1448 [TCP segment of a reassembled PDU]"
"2.803165","5.9.29.183","172.19.0.3","TLSv1.2","1516","Application Data [TCP segment of a reassembled PDU]"
"2.803182","172.19.0.3","5.9.29.183","TCP","56","43520 → 9002 [ACK] Seq=10774 Ack=176094 Win=11911 Len=0"
"2.803195","5.9.29.183","172.19.0.3","TCP","1492","9002 → 43520 [PSH, ACK] Seq=176094 Ack=10774 Win=65535 Len=1436 [TCP segment of a reassembled PDU]"
"2.808349","5.9.29.183","172.19.0.3","TLSv1.2","1112","Application Data"
"2.808365","172.19.0.3","5.9.29.183","TCP","56","43520 → 9002 [ACK] Seq=10774 Ack=178586 Win=11911 Len=0"
"2.816806","5.9.29.183","172.19.0.3","TCP","1516","[TCP segment of a reassembled PDU]"
"2.816866","5.9.29.183","172.19.0.3","TCP","1492","9002 → 43520 [PSH, ACK] Seq=180046 Ack=10774 Win=65535 Len=1436 [TCP segment of a reassembled PDU]"
"2.817086","172.19.0.3","5.9.29.183","TCP","56","43520 → 9002 [ACK] Seq=10774 Ack=181482 Win=11903 Len=0"
"2.824727","5.9.29.183","172.19.0.3","TLSv1.2","787","Application Data"
"2.828522","172.19.0.3","5.9.29.183","TLSv1.2","599","Application Data"
"2.828754","5.9.29.183","172.19.0.3","TCP","56","9002 → 43520 [ACK] Seq=182213 Ack=11317 Win=65535 Len=0"
"3.041767","5.9.29.183","172.19.0.3","TLSv1.2","599","Application Data"
"3.042591","172.19.0.3","5.9.29.183","TLSv1.2","599","Application Data"
"3.042963","5.9.29.183","172.19.0.3","TCP","56","9002 → 43520 [ACK] Seq=182756 Ack=11860 Win=65535 Len=0"
"3.316217","5.9.29.183","172.19.0.3","TCP","1516","[TCP segment of a reassembled PDU]"
"3.316240","5.9.29.183","172.19.0.3","TCP","1492","9002 → 43520 [PSH, ACK] Seq=184216 Ack=11860 Win=65535 Len=1436 [TCP segment of a reassembled PDU]"
"3.316245","5.9.29.183","172.19.0.3","TLSv1.2","1516","Application Data [TCP segment of a reassembled PDU]"
"3.316247","5.9.29.183","172.19.0.3","TCP","1516","9002 → 43520 [PSH, ACK] Seq=187112 Ack=11860 Win=65535 Len=1460 [TCP segment of a reassembled PDU]"
"3.316278","5.9.29.183","172.19.0.3","TCP","1213","9002 → 43520 [PSH, ACK] Seq=188572 Ack=11860 Win=65535 Len=1157 [TCP segment of a reassembled PDU]"
"3.316414","172.19.0.3","5.9.29.183","TCP","56","43520 → 9002 [ACK] Seq=11860 Ack=189729 Win=11879 Len=0"
"3.331753","5.9.29.183","172.19.0.3","TLSv1.2","1394","Application Data, Application Data"
"3.346758","5.9.29.183","172.19.0.3","TLSv1.2","599","Application Data"
"3.346775","172.19.0.3","5.9.29.183","TCP","56","43520 → 9002 [ACK] Seq=11860 Ack=191610 Win=11911 Len=0"
"3.350210","172.19.0.3","5.9.29.183","TLSv1.2","599","Application Data"
"3.350520","5.9.29.183","172.19.0.3","TCP","56","9002 → 43520 [ACK] Seq=191610 Ack=12403 Win=65535 Len=0"
"3.670366","5.9.29.183","172.19.0.3","TLSv1.2","599","Application Data"
"3.670968","172.19.0.3","5.9.29.183","TLSv1.2","599","Application Data"
"3.671321","5.9.29.183","172.19.0.3","TCP","56","9002 → 43520 [ACK] Seq=192153 Ack=12946 Win=65535 Len=0"
"3.935271","5.9.29.183","172.19.0.3","TLSv1.2","599","Application Data"
"3.964253","5.9.29.183","172.19.0.3","TCP","1504","[TCP segment of a reassembled PDU]"
"3.964270","172.19.0.3","5.9.29.183","TCP","56","43520 → 9002 [ACK] Seq=12946 Ack=194144 Win=11911 Len=0"
"3.964280","5.9.29.183","172.19.0.3","TCP","1516","9002 → 43520 [PSH, ACK] Seq=194144 Ack=12946 Win=65535 Len=1460 [TCP segment of a reassembled PDU]"
"3.964286","5.9.29.183","172.19.0.3","TLSv1.2","1516","Application Data [TCP segment of a reassembled PDU]"
"3.964288","5.9.29.183","172.19.0.3","TCP","1213","9002 → 43520 [PSH, ACK] Seq=197064 Ack=12946 Win=65535 Len=1157 [TCP segment of a reassembled PDU]"
"3.964363","5.9.29.183","172.19.0.3","TCP","1504","9002 → 43520 [PSH, ACK] Seq=198221 Ack=12946 Win=65535 Len=1448 [TCP segment of a reassembled PDU]"
"3.964424","172.19.0.3","5.9.29.183","TCP","56","43520 → 9002 [ACK] Seq=12946 Ack=199669 Win=11879 Len=0"
"3.980311","5.9.29.183","172.19.0.3","TLSv1.2","1516","Application Data [TCP segment of a reassembled PDU]"
"3.980352","5.9.29.183","172.19.0.3","TCP","1516","9002 → 43520 [PSH, ACK] Seq=201129 Ack=12946 Win=65535 Len=1460 [TCP segment of a reassembled PDU]"
"3.980364","172.19.0.3","5.9.29.183","TCP","56","43520 → 9002 [ACK] Seq=12946 Ack=202589 Win=11903 Len=0"
"3.980366","5.9.29.183","172.19.0.3","TCP","1480","9002 → 43520 [PSH, ACK] Seq=202589 Ack=12946 Win=65535 Len=1424 [TCP segment of a reassembled PDU]"
"3.980368","5.9.29.183","172.19.0.3","TLSv1.2","1516","Application Data [TCP segment of a reassembled PDU]"
"3.980447","5.9.29.183","172.19.0.3","TCP","1516","9002 → 43520 [PSH, ACK] Seq=205473 Ack=12946 Win=65535 Len=1460 [TCP segment of a reassembled PDU]"
"3.980451","5.9.29.183","172.19.0.3","TLSv1.2","327","Application Data"
"3.980507","172.19.0.3","5.9.29.183","TCP","56","43520 → 9002 [ACK] Seq=12946 Ack=207204 Win=11871 Len=0"
"3.980693","172.19.0.3","5.9.29.183","TLSv1.2","599","Application Data"
"3.980832","5.9.29.183","172.19.0.3","TCP","56","9002 → 43520 [ACK] Seq=207204 Ack=13489 Win=65535 Len=0"
"3.990868","172.19.0.3","5.9.29.183","TLSv1.2","599","Application Data"
"3.991141","5.9.29.183","172.19.0.3","TCP","56","9002 → 43520 [ACK] Seq=207204 Ack=14032 Win=65535 Len=0"
"4.206827","5.9.29.183","172.19.0.3","TLSv1.2","599","Application Data"
"4.207342","172.19.0.3","5.9.29.183","TLSv1.2","599","Application Data"
"4.207572","5.9.29.183","172.19.0.3","TCP","56","9002 → 43520 [ACK] Seq=207747 Ack=14575 Win=65535 Len=0"
"4.439097","5.9.29.183","172.19.0.3","TCP","1516","[TCP segment of a reassembled PDU]"
"4.439126","5.9.29.183","172.19.0.3","TCP","1492","9002 → 43520 [PSH, ACK] Seq=209207 Ack=14575 Win=65535 Len=1436 [TCP segment of a reassembled PDU]"
"4.439132","5.9.29.183","172.19.0.3","TLSv1.2","787","Application Data"
"4.439239","172.19.0.3","5.9.29.183","TCP","56","43520 → 9002 [ACK] Seq=14575 Ack=211374 Win=11895 Len=0"
"4.468008","5.9.29.183","172.19.0.3","TCP","1516","[TCP segment of a reassembled PDU]"
"4.468037","5.9.29.183","172.19.0.3","TCP","1516","9002 → 43520 [PSH, ACK] Seq=212834 Ack=14575 Win=65535 Len=1460 [TCP segment of a reassembled PDU]"
"4.468050","172.19.0.3","5.9.29.183","TCP","56","43520 → 9002 [ACK] Seq=14575 Ack=214294 Win=11903 Len=0"
"4.468052","5.9.29.183","172.19.0.3","TLSv1.2","1213","Application Data"
"4.484137","5.9.29.183","172.19.0.3","TLSv1.2","1177","Application Data"
"4.484155","172.19.0.3","5.9.29.183","TCP","56","43520 → 9002 [ACK] Seq=14575 Ack=216572 Win=11911 Len=0"
"4.487214","172.19.0.3","5.9.29.183","TLSv1.2","599","Application Data"
"4.487424","5.9.29.183","172.19.0.3","TCP","56","9002 → 43520 [ACK] Seq=216572 Ack=15118 Win=65535 Len=0"
"4.728100","5.9.29.183","172.19.0.3","TLSv1.2","599","Application Data"
"4.728860","172.19.0.3","5.9.29.183","TLSv1.2","599","Application Data"
"4.729155","5.9.29.183","172.19.0.3","TCP","56","9002 → 43520 [ACK] Seq=217115 Ack=15661 Win=65535 Len=0"
"4.965285","5.9.29.183","172.19.0.3","TCP","1504","[TCP segment of a reassembled PDU]"
"4.965426","5.9.29.183","172.19.0.3","TCP","1504","9002 → 43520 [PSH, ACK] Seq=218563 Ack=15661 Win=65535 Len=1448 [TCP segment of a reassembled PDU]"
"4.965477","5.9.29.183","172.19.0.3","TLSv1.2","1516","Application Data [TCP segment of a reassembled PDU]"
"4.965482","5.9.29.183","172.19.0.3","TCP","1516","9002 → 43520 [PSH, ACK] Seq=221471 Ack=15661 Win=65535 Len=1460 [TCP segment of a reassembled PDU]"
"4.965535","5.9.29.183","172.19.0.3","TCP","1213","9002 → 43520 [PSH, ACK] Seq=222931 Ack=15661 Win=65535 Len=1157 [TCP segment of a reassembled PDU]"
"4.965590","172.19.0.3","5.9.29.183","TCP","56","43520 → 9002 [ACK] Seq=15661 Ack=224088 Win=11879 Len=0"
"4.981398","5.9.29.183","172.19.0.3","TLSv1.2","337","Application Data"
"4.996603","5.9.29.183","172.19.0.3","TLSv1.2","1113","Application Data"
"4.996757","172.19.0.3","5.9.29.183","TCP","56","43520 → 9002 [ACK] Seq=15661 Ack=225426 Win=11911 Len=0"
"4.997537","5.9.29.183","172.19.0.3","TCP","958","[TCP segment of a reassembled PDU]"
"4.997657","5.9.29.183","172.19.0.3","TCP","602","9002 → 43520 [PSH, ACK] Seq=226328 Ack=15661 Win=65535 Len=546 [TCP segment of a reassembled PDU]"
"4.997755","5.9.29.183","172.19.0.3","TCP","1516","9002 → 43520 [PSH, ACK] Seq=226874 Ack=15661 Win=65535 Len=1460 [TCP segment of a reassembled PDU]"
"4.997794","5.9.29.183","172.19.0.3","TLSv1.2","1516","Application Data [TCP segment of a reassembled PDU]"
"4.997836","5.9.29.183","172.19.0.3","TCP","1516","9002 → 43520 [PSH, ACK] Seq=229794 Ack=15661 Win=65535 Len=1460 [TCP segment of a reassembled PDU]"
"4.997842","5.9.29.183","172.19.0.3","TCP","1468","9002 → 43520 [PSH, ACK] Seq=231254 Ack=15661 Win=65535 Len=1412 [TCP segment of a reassembled PDU]"
"4.997887","172.19.0.3","5.9.29.183","TCP","56","43520 → 9002 [ACK] Seq=15661 Ack=232666 Win=11871 Len=0"
"5.011648","5.9.29.183","172.19.0.3","TLSv1.2","584","Application Data"
"5.013408","5.9.29.183","172.19.0.3","TCP","1504","[TCP segment of a reassembled PDU]"
"5.013463","172.19.0.3","5.9.29.183","TCP","56","43520 → 9002 [ACK] Seq=15661 Ack=234642 Win=11911 Len=0"
"5.013503","5.9.29.183","172.19.0.3","TCP","1516","9002 → 43520 [PSH, ACK] Seq=234642 Ack=15661 Win=65535 Len=1460 [TCP segment of a reassembled PDU]"
"5.013690","5.9.29.183","172.19.0.3","TLSv1.2","1492","Application Data [TCP segment of a reassembled PDU]"
"5.013737","5.9.29.183","172.19.0.3","TCP","1516","9002 → 43520 [PSH, ACK] Seq=237538 Ack=15661 Win=65535 Len=1460 [TCP segment of a reassembled PDU]"
"5.013745","5.9.29.183","172.19.0.3","TCP","1516","9002 → 43520 [PSH, ACK] Seq=238998 Ack=15661 Win=65535 Len=1460 [TCP segment of a reassembled PDU]"
"5.013748","5.9.29.183","172.19.0.3","TLSv1.2","1516","Application Data [TCP segment of a reassembled PDU]"
"5.013752","5.9.29.183","172.19.0.3","TLSv1.2","1516","Application Data [TCP segment of a reassembled PDU]"
"5.013755","5.9.29.183","172.19.0.3","TCP","1456","9002 → 43520 [PSH, ACK] Seq=243378 Ack=15661 Win=65535 Len=1400 [TCP segment of a reassembled PDU]"
"5.013843","172.19.0.3","5.9.29.183","TCP","56","43520 → 9002 [ACK] Seq=15661 Ack=244778 Win=11869 Len=0"
"5.014241","172.19.0.3","5.9.29.183","TLSv1.2","599","Application Data"
"5.014453","5.9.29.183","172.19.0.3","TCP","56","9002 → 43520 [ACK] Seq=244778 Ack=16204 Win=65535 Len=0"
"5.017841","5.9.29.183","172.19.0.3","TCP","1504","9002 → 43520 [PSH, ACK] Seq=244778 Ack=16204 Win=65535 Len=1448 [TCP segment of a reassembled PDU]"
"5.026913","5.9.29.183","172.19.0.3","TLSv1.2","1516","Application Data [TCP segment of a reassembled PDU]"
"5.026934","172.19.0.3","5.9.29.183","TCP","56","43520 → 9002 [ACK] Seq=16204 Ack=247686 Win=11911 Len=0"
"5.026973","5.9.29.183","172.19.0.3","TLSv1.2","1516","Application Data [TCP segment of a reassembled PDU]"
"5.027010","5.9.29.183","172.19.0.3","TCP","1516","9002 → 43520 [PSH, ACK] Seq=249146 Ack=16204 Win=65535 Len=1460 [TCP segment of a reassembled PDU]"
"5.027017","5.9.29.183","172.19.0.3","TLSv1.2","1468","Application Data [TCP segment of a reassembled PDU]"
"5.027021","5.9.29.183","172.19.0.3","TLSv1.2","1516","Application Data [TCP segment of a reassembled PDU]"
"5.027026","5.9.29.183","172.19.0.3","TLSv1.2","1078","Application Data"
"5.027128","172.19.0.3","5.9.29.183","TCP","56","43520 → 9002 [ACK] Seq=16204 Ack=254500 Win=11871 Len=0"
"5.027659","172.19.0.3","5.9.29.183","TLSv1.2","599","Application Data"
"5.027909","5.9.29.183","172.19.0.3","TCP","56","9002 → 43520 [ACK] Seq=254500 Ack=16747 Win=65535 Len=0"
"5.029549","5.9.29.183","172.19.0.3","TCP","1504","[TCP segment of a reassembled PDU]"
"5.030127","5.9.29.183","172.19.0.3","TCP","1516","9002 → 43520 [PSH, ACK] Seq=255948 Ack=16747 Win=65535 Len=1460 [TCP segment of a reassembled PDU]"
"5.030137","172.19.0.3","5.9.29.183","TCP","56","43520 → 9002 [ACK] Seq=16747 Ack=257408 Win=11911 Len=0"
"5.030170","5.9.29.183","172.19.0.3","TLSv1.2","1516","Application Data [TCP segment of a reassembled PDU]"
"5.030177","5.9.29.183","172.19.0.3","TCP","1516","9002 → 43520 [PSH, ACK] Seq=258868 Ack=16747 Win=65535 Len=1460 [TCP segment of a reassembled PDU]"
"5.030180","5.9.29.183","172.19.0.3","TCP","1516","9002 → 43520 [PSH, ACK] Seq=260328 Ack=16747 Win=65535 Len=1460 [TCP segment of a reassembled PDU]"
"5.030242","172.19.0.3","5.9.29.183","TCP","56","43520 → 9002 [ACK] Seq=16747 Ack=261788 Win=11887 Len=0"
"5.030268","5.9.29.183","172.19.0.3","TLSv1.2","1516","Application Data [TCP segment of a reassembled PDU]"
"5.030274","5.9.29.183","172.19.0.3","TCP","1444","9002 → 43520 [PSH, ACK] Seq=263248 Ack=16747 Win=65535 Len=1388 [TCP segment of a reassembled PDU]"
"5.030277","5.9.29.183","172.19.0.3","TCP","1516","9002 → 43520 [PSH, ACK] Seq=264636 Ack=16747 Win=65535 Len=1460 [TCP segment of a reassembled PDU]"
"5.030335","5.9.29.183","172.19.0.3","TLSv1.2","1516","Application Data [TCP segment of a reassembled PDU]"
"5.030404","5.9.29.183","172.19.0.3","TCP","1516","9002 → 43520 [PSH, ACK] Seq=267556 Ack=16747 Win=65535 Len=1460 [TCP segment of a reassembled PDU]"
"5.030411","5.9.29.183","172.19.0.3","TCP","1468","9002 → 43520 [PSH, ACK] Seq=269016 Ack=16747 Win=65535 Len=1412 [TCP segment of a reassembled PDU]"
"5.030487","172.19.0.3","5.9.29.183","TCP","56","43520 → 9002 [ACK] Seq=16747 Ack=270428 Win=11836 Len=0"
"5.035416","5.9.29.183","172.19.0.3","TLSv1.2","1504","Application Data, Application Data"
"5.037372","172.19.0.3","5.9.29.183","TLSv1.2","599","Application Data"
"5.037676","5.9.29.183","172.19.0.3","TCP","56","9002 → 43520 [ACK] Seq=271876 Ack=17290 Win=65535 Len=0"
"5.042258","5.9.29.183","172.19.0.3","TLSv1.2","330","Application Data"
"5.049043","5.9.29.183","172.19.0.3","TCP","1504","[TCP segment of a reassembled PDU]"
"5.049060","172.19.0.3","5.9.29.183","TCP","56","43520 → 9002 [ACK] Seq=17290 Ack=273598 Win=11911 Len=0"
"5.049167","5.9.29.183","172.19.0.3","TCP","1504","9002 → 43520 [PSH, ACK] Seq=273598 Ack=17290 Win=65535 Len=1448 [TCP segment of a reassembled PDU]"
"5.057374","5.9.29.183","172.19.0.3","TLSv1.2","787","Application Data"
"5.057394","172.19.0.3","5.9.29.183","TCP","56","43520 → 9002 [ACK] Seq=17290 Ack=275777 Win=11911 Len=0"
"5.061280","172.19.0.3","5.9.29.183","TLSv1.2","599","Application Data"
"5.061503","5.9.29.183","172.19.0.3","TCP","56","9002 → 43520 [ACK] Seq=275777 Ack=17833 Win=65535 Len=0"
"5.319425","5.9.29.183","172.19.0.3","TLSv1.2","599","Application Data"
"5.320228","172.19.0.3","5.9.29.183","TLSv1.2","599","Application Data"
"5.320559","5.9.29.183","172.19.0.3","TCP","56","9002 → 43520 [ACK] Seq=276320 Ack=18376 Win=65535 Len=0"
"5.597153","5.9.29.183","172.19.0.3","TCP","1504","[TCP segment of a reassembled PDU]"
"5.597244","5.9.29.183","172.19.0.3","TCP","1516","9002 → 43520 [PSH, ACK] Seq=277768 Ack=18376 Win=65535 Len=1460 [TCP segment of a reassembled PDU]"
"5.597258","5.9.29.183","172.19.0.3","TLSv1.2","775","Application Data"
"5.597513","172.19.0.3","5.9.29.183","TCP","56","43520 → 9002 [ACK] Seq=18376 Ack=279947 Win=11895 Len=0"
"5.609473","5.9.29.183","172.19.0.3","TCP","1516","[TCP segment of a reassembled PDU]"
"5.609533","5.9.29.183","172.19.0.3","TCP","1492","9002 → 43520 [PSH, ACK] Seq=281407 Ack=18376 Win=65535 Len=1436 [TCP segment of a reassembled PDU]"
"5.609556","172.19.0.3","5.9.29.183","TCP","56","43520 → 9002 [ACK] Seq=18376 Ack=282843 Win=11903 Len=0"
"5.609561","5.9.29.183","172.19.0.3","TLSv1.2","1516","Application Data [TCP segment of a reassembled PDU]"
"5.609568","5.9.29.183","172.19.0.3","TCP","1492","9002 → 43520 [PSH, ACK] Seq=284303 Ack=18376 Win=65535 Len=1436 [TCP segment of a reassembled PDU]"
"5.609662","5.9.29.183","172.19.0.3","TCP","1516","9002 → 43520 [PSH, ACK] Seq=285739 Ack=18376 Win=65535 Len=1460 [TCP segment of a reassembled PDU]"
"5.609670","5.9.29.183","172.19.0.3","TLSv1.2","1492","Application Data [TCP segment of a reassembled PDU]"
"5.609689","172.19.0.3","5.9.29.183","TCP","56","43520 → 9002 [ACK] Seq=18376 Ack=287199 Win=11879 Len=0"
"5.613054","5.9.29.183","172.19.0.3","TLSv1.2","1221","Application Data"
"5.613073","172.19.0.3","5.9.29.183","TCP","56","43520 → 9002 [ACK] Seq=18376 Ack=289800 Win=11911 Len=0"
"5.624012","5.9.29.183","172.19.0.3","TCP","1504","[TCP segment of a reassembled PDU]"
"5.624059","5.9.29.183","172.19.0.3","TCP","672","9002 → 43520 [PSH, ACK] Seq=291248 Ack=18376 Win=65535 Len=616 [TCP segment of a reassembled PDU]"
"5.624065","5.9.29.183","172.19.0.3","TCP","1516","9002 → 43520 [PSH, ACK] Seq=291864 Ack=18376 Win=65535 Len=1460 [TCP segment of a reassembled PDU]"
"5.624161","172.19.0.3","5.9.29.183","TCP","56","43520 → 9002 [ACK] Seq=18376 Ack=293324 Win=11895 Len=0"
"5.624177","5.9.29.183","172.19.0.3","TLSv1.2","876","Application Data [TCP segment of a reassembled PDU]"
"5.624224","5.9.29.183","172.19.0.3","TCP","1516","9002 → 43520 [PSH, ACK] Seq=294144 Ack=18376 Win=65535 Len=1460 [TCP segment of a reassembled PDU]"
"5.624295","5.9.29.183","172.19.0.3","TCP","1492","9002 → 43520 [PSH, ACK] Seq=295604 Ack=18376 Win=65535 Len=1436 [TCP segment of a reassembled PDU]"
"5.624365","172.19.0.3","5.9.29.183","TCP","56","43520 → 9002 [ACK] Seq=18376 Ack=297040 Win=11871 Len=0"
"5.624367","5.9.29.183","172.19.0.3","TLSv1.2","1516","Application Data [TCP segment of a reassembled PDU]"
"5.624459","5.9.29.183","172.19.0.3","TCP","1516","9002 → 43520 [PSH, ACK] Seq=298500 Ack=18376 Win=65535 Len=1460 [TCP segment of a reassembled PDU]"
"5.624469","5.9.29.183","172.19.0.3","TCP","1516","9002 → 43520 [PSH, ACK] Seq=299960 Ack=18376 Win=65535 Len=1460 [TCP segment of a reassembled PDU]"
"5.624484","5.9.29.183","172.19.0.3","TLSv1.2","1468","Application Data [TCP segment of a reassembled PDU]"
"5.624526","172.19.0.3","5.9.29.183","TCP","56","43520 → 9002 [ACK] Seq=18376 Ack=302832 Win=11838 Len=0"
"5.624583","5.9.29.183","172.19.0.3","TCP","1516","9002 → 43520 [PSH, ACK] Seq=302832 Ack=18376 Win=65535 Len=1460 [TCP segment of a reassembled PDU]"
"5.624618","5.9.29.183","172.19.0.3","TCP","1492","9002 → 43520 [PSH, ACK] Seq=304292 Ack=18376 Win=65535 Len=1436 [TCP segment of a reassembled PDU]"
"5.624625","172.19.0.3","5.9.29.183","TCP","56","43520 → 9002 [ACK] Seq=18376 Ack=305728 Win=11895 Len=0"
"5.628024","5.9.29.183","172.19.0.3","TLSv1.2","721","Application Data, Application Data"
"5.628511","172.19.0.3","5.9.29.183","TLSv1.2","1113","Application Data"
"5.628793","5.9.29.183","172.19.0.3","TCP","56","9002 → 43520 [ACK] Seq=306393 Ack=19433 Win=65535 Len=0"
"5.630263","5.9.29.183","172.19.0.3","TCP","1504","[TCP segment of a reassembled PDU]"
"5.630347","5.9.29.183","172.19.0.3","TCP","1516","9002 → 43520 [PSH, ACK] Seq=307841 Ack=19433 Win=65535 Len=1460 [TCP segment of a reassembled PDU]"
"5.630450","172.19.0.3","5.9.29.183","TCP","56","43520 → 9002 [ACK] Seq=19433 Ack=309301 Win=11903 Len=0"
"5.630470","5.9.29.183","172.19.0.3","TLSv1.2","1492","Application Data [TCP segment of a reassembled PDU]"
"5.639133","5.9.29.183","172.19.0.3","TLSv1.2","1516","Application Data [TCP segment of a reassembled PDU]"
"5.639150","172.19.0.3","5.9.29.183","TCP","56","43520 → 9002 [ACK] Seq=19433 Ack=312197 Win=11911 Len=0"
"5.639181","5.9.29.183","172.19.0.3","TCP","1516","9002 → 43520 [PSH, ACK] Seq=312197 Ack=19433 Win=65535 Len=1460 [TCP segment of a reassembled PDU]"
"5.639188","5.9.29.183","172.19.0.3","TCP","1480","9002 → 43520 [PSH, ACK] Seq=313657 Ack=19433 Win=65535 Len=1424 [TCP segment of a reassembled PDU]"
"5.639293","172.19.0.3","5.9.29.183","TCP","56","43520 → 9002 [ACK] Seq=19433 Ack=315081 Win=11893 Len=0"
"5.639841","5.9.29.183","172.19.0.3","TLSv1.2","1504","Application Data [TCP segment of a reassembled PDU]"
"5.640008","5.9.29.183","172.19.0.3","TCP","1504","9002 → 43520 [PSH, ACK] Seq=316529 Ack=19433 Win=65535 Len=1448 [TCP segment of a reassembled PDU]"
"5.640015","172.19.0.3","5.9.29.183","TCP","56","43520 → 9002 [ACK] Seq=19433 Ack=317977 Win=11903 Len=0"
"5.643252","5.9.29.183","172.19.0.3","TLSv1.2","1438","Application Data"
"5.655074","5.9.29.183","172.19.0.3","TCP","1504","[TCP segment of a reassembled PDU]"
"5.655093","172.19.0.3","5.9.29.183","TCP","56","43520 → 9002 [ACK] Seq=19433 Ack=320807 Win=11911 Len=0"
"5.655153","5.9.29.183","172.19.0.3","TCP","1516","9002 → 43520 [PSH, ACK] Seq=320807 Ack=19433 Win=65535 Len=1460 [TCP segment of a reassembled PDU]"
"5.655162","5.9.29.183","172.19.0.3","TLSv1.2","1516","Application Data [TCP segment of a reassembled PDU]"
"5.655164","5.9.29.183","172.19.0.3","TLSv1.2","1516","Application Data [TCP segment of a reassembled PDU]"
"5.655166","5.9.29.183","172.19.0.3","TCP","1516","9002 → 43520 [PSH, ACK] Seq=325187 Ack=19433 Win=65535 Len=1460 [TCP segment of a reassembled PDU]"
"5.655168","5.9.29.183","172.19.0.3","TCP","1456","9002 → 43520 [PSH, ACK] Seq=326647 Ack=19433 Win=65535 Len=1400 [TCP segment of a reassembled PDU]"
"5.655241","5.9.29.183","172.19.0.3","TLSv1.2","1516","Application Data [TCP segment of a reassembled PDU]"
"5.655247","5.9.29.183","172.19.0.3","TLSv1.2","1516","Application Data [TCP segment of a reassembled PDU]"
"5.655301","172.19.0.3","5.9.29.183","TCP","56","43520 → 9002 [ACK] Seq=19433 Ack=330967 Win=11855 Len=0"
"5.655426","5.9.29.183","172.19.0.3","TCP","1480","9002 → 43520 [PSH, ACK] Seq=330967 Ack=19433 Win=65535 Len=1424 [TCP segment of a reassembled PDU]"
"5.655497","5.9.29.183","172.19.0.3","TLSv1.2","1516","Application Data [TCP segment of a reassembled PDU]"
"5.655523","5.9.29.183","172.19.0.3","TLSv1.2","1516","Application Data [TCP segment of a reassembled PDU]"
"5.655528","5.9.29.183","172.19.0.3","TCP","1516","9002 → 43520 [PSH, ACK] Seq=335311 Ack=19433 Win=65535 Len=1460 [TCP segment of a reassembled PDU]"
"5.655530","172.19.0.3","5.9.29.183","TCP","56","43520 → 9002 [ACK] Seq=19433 Ack=333851 Win=11838 Len=0"
"5.655546","5.9.29.183","172.19.0.3","TCP","1516","9002 → 43520 [PSH, ACK] Seq=336771 Ack=19433 Win=65535 Len=1460 [TCP segment of a reassembled PDU]"
"5.655568","5.9.29.183","172.19.0.3","TLSv1.2","1516","Application Data [TCP segment of a reassembled PDU]"
"5.655574","172.19.0.3","5.9.29.183","TCP","56","43520 → 9002 [ACK] Seq=19433 Ack=338231 Win=11814 Len=0"
"5.655581","5.9.29.183","172.19.0.3","TCP","1444","9002 → 43520 [PSH, ACK] Seq=339691 Ack=19433 Win=65535 Len=1388 [TCP segment of a reassembled PDU]"
"5.655730","172.19.0.3","5.9.29.183","TCP","56","43520 → 9002 [ACK] Seq=19433 Ack=341079 Win=11798 Len=0"
"5.655863","172.19.0.3","5.9.29.183","TLSv1.2","599","Application Data"
"5.656047","5.9.29.183","172.19.0.3","TCP","56","9002 → 43520 [ACK] Seq=341079 Ack=19976 Win=65535 Len=0"
"5.658534","5.9.29.183","172.19.0.3","TLSv1.2","156","Application Data"
"5.670656","5.9.29.183","172.19.0.3","TCP","1516","[TCP segment of a reassembled PDU]"
"5.670674","172.19.0.3","5.9.29.183","TCP","56","43520 → 9002 [ACK] Seq=19976 Ack=342639 Win=11909 Len=0"
"5.670705","5.9.29.183","172.19.0.3","TCP","1492","9002 → 43520 [PSH, ACK] Seq=342639 Ack=19976 Win=65535 Len=1436 [TCP segment of a reassembled PDU]"
"5.670855","5.9.29.183","172.19.0.3","TLSv1.2","1516","Application Data [TCP segment of a reassembled PDU]"
"5.670861","5.9.29.183","172.19.0.3","TCP","1516","9002 → 43520 [PSH, ACK] Seq=345535 Ack=19976 Win=65535 Len=1460 [TCP segment of a reassembled PDU]"
"5.670883","5.9.29.183","172.19.0.3","TCP","1516","9002 → 43520 [PSH, ACK] Seq=346995 Ack=19976 Win=65535 Len=1460 [TCP segment of a reassembled PDU]"
"5.670892","172.19.0.3","5.9.29.183","TCP","56","43520 → 9002 [ACK] Seq=19976 Ack=345535 Win=11893 Len=0"
"5.670897","5.9.29.183","172.19.0.3","TLSv1.2","1468","Application Data [TCP segment of a reassembled PDU]"
"5.670938","5.9.29.183","172.19.0.3","TCP","1516","9002 → 43520 [PSH, ACK] Seq=349867 Ack=19976 Win=65535 Len=1460 [TCP segment of a reassembled PDU]"
"5.670942","5.9.29.183","172.19.0.3","TCP","1516","9002 → 43520 [PSH, ACK] Seq=351327 Ack=19976 Win=65535 Len=1460 [TCP segment of a reassembled PDU]"
"5.670953","172.19.0.3","5.9.29.183","TCP","56","43520 → 9002 [ACK] Seq=19976 Ack=352787 Win=11853 Len=0"
"5.670999","5.9.29.183","172.19.0.3","TLSv1.2","1480","Application Data [TCP segment of a reassembled PDU]"
"5.673324","5.9.29.183","172.19.0.3","TLSv1.2","1018","Application Data"
"5.673330","172.19.0.3","5.9.29.183","TCP","56","43520 → 9002 [ACK] Seq=19976 Ack=355173 Win=11911 Len=0"
"5.673540","172.19.0.3","5.9.29.183","TLSv1.2","599","Application Data"
"5.673719","5.9.29.183","172.19.0.3","TCP","56","9002 → 43520 [ACK] Seq=355173 Ack=20519 Win=65535 Len=0"
"5.749227","5.9.29.183","172.19.0.3","TCP","1504","[TCP segment of a reassembled PDU]"
"5.749437","5.9.29.183","172.19.0.3","TCP","835","9002 → 43520 [PSH, ACK] Seq=356621 Ack=20519 Win=65535 Len=779 [TCP segment of a reassembled PDU]"
"5.749449","172.19.0.3","5.9.29.183","TCP","56","43520 → 9002 [ACK] Seq=20519 Ack=357400 Win=11911 Len=0"
"5.749655","5.9.29.183","172.19.0.3","TCP","1516","9002 → 43520 [PSH, ACK] Seq=357400 Ack=20519 Win=65535 Len=1460 [TCP segment of a reassembled PDU]"
"5.749698","5.9.29.183","172.19.0.3","TLSv1.2","1516","Application Data [TCP segment of a reassembled PDU]"
"5.749726","5.9.29.183","172.19.0.3","TCP","434","9002 → 43520 [PSH, ACK] Seq=360320 Ack=20519 Win=65535 Len=378 [TCP segment of a reassembled PDU]"
"5.749817","172.19.0.3","5.9.29.183","TCP","56","43520 → 9002 [ACK] Seq=20519 Ack=360698 Win=11895 Len=0"
"5.750138","172.19.0.3","5.9.29.183","TLSv1.2","599","Application Data"
"5.750396","5.9.29.183","172.19.0.3","TCP","56","9002 → 43520 [ACK] Seq=360698 Ack=21062 Win=65535 Len=0"
"5.764945","5.9.29.183","172.19.0.3","TLSv1.2","757","Application Data"
"5.769198","172.19.0.3","5.9.29.183","TLSv1.2","599","Application Data"
"5.769500","5.9.29.183","172.19.0.3","TCP","56","9002 → 43520 [ACK] Seq=361399 Ack=21605 Win=65535 Len=0"
"6.306575","5.9.29.183","172.19.0.3","TLSv1.2","599","Application Data"
"6.307239","172.19.0.3","5.9.29.183","TLSv1.2","599","Application Data"
"6.307550","5.9.29.183","172.19.0.3","TCP","56","9002 → 43520 [ACK] Seq=361942 Ack=22148 Win=65535 Len=0"
"6.634280","5.9.29.183","172.19.0.3","TCP","1516","[TCP segment of a reassembled PDU]"
"6.634346","5.9.29.183","172.19.0.3","TCP","1516","9002 → 43520 [PSH, ACK] Seq=363402 Ack=22148 Win=65535 Len=1460 [TCP segment of a reassembled PDU]"
"6.634370","5.9.29.183","172.19.0.3","TLSv1.2","1213","Application Data"
"6.634381","5.9.29.183","172.19.0.3","TCP","1516","[TCP segment of a reassembled PDU]"
"6.634409","5.9.29.183","172.19.0.3","TCP","1492","9002 → 43520 [PSH, ACK] Seq=367479 Ack=22148 Win=65535 Len=1436 [TCP segment of a reassembled PDU]"
"6.634511","172.19.0.3","5.9.29.183","TCP","56","43520 → 9002 [ACK] Seq=22148 Ack=368915 Win=11879 Len=0"
"6.650064","5.9.29.183","172.19.0.3","TLSv1.2","1516","Application Data [TCP segment of a reassembled PDU]"
"6.650193","5.9.29.183","172.19.0.3","TCP","1516","9002 → 43520 [PSH, ACK] Seq=370375 Ack=22148 Win=65535 Len=1460 [TCP segment of a reassembled PDU]"
"6.650211","172.19.0.3","5.9.29.183","TCP","56","43520 → 9002 [ACK] Seq=22148 Ack=371835 Win=11903 Len=0"
"6.650215","5.9.29.183","172.19.0.3","TCP","1480","9002 → 43520 [PSH, ACK] Seq=371835 Ack=22148 Win=65535 Len=1424 [TCP segment of a reassembled PDU]"
"6.650304","5.9.29.183","172.19.0.3","TLSv1.2","1516","Application Data [TCP segment of a reassembled PDU]"
"6.650311","5.9.29.183","172.19.0.3","TCP","1516","9002 → 43520 [PSH, ACK] Seq=374719 Ack=22148 Win=65535 Len=1460 [TCP segment of a reassembled PDU]"
"6.650314","5.9.29.183","172.19.0.3","TCP","1516","9002 → 43520 [PSH, ACK] Seq=376179 Ack=22148 Win=65535 Len=1460 [TCP segment of a reassembled PDU]"
"6.650316","5.9.29.183","172.19.0.3","TLSv1.2","1516","Application Data [TCP segment of a reassembled PDU]"
"6.650423","172.19.0.3","5.9.29.183","TCP","56","43520 → 9002 [ACK] Seq=22148 Ack=374719 Win=11887 Len=0"
"6.650610","5.9.29.183","172.19.0.3","TCP","1516","9002 → 43520 [PSH, ACK] Seq=379099 Ack=22148 Win=65535 Len=1460 [TCP segment of a reassembled PDU]"
"6.650619","5.9.29.183","172.19.0.3","TLSv1.2","1516","Application Data [TCP segment of a reassembled PDU]"
"6.650622","5.9.29.183","172.19.0.3","TCP","1516","9002 → 43520 [PSH, ACK] Seq=382019 Ack=22148 Win=65535 Len=1460 [TCP segment of a reassembled PDU]"
"6.650694","172.19.0.3","5.9.29.183","TCP","56","43520 → 9002 [ACK] Seq=22148 Ack=383479 Win=11838 Len=0"
"6.650698","5.9.29.183","172.19.0.3","TLSv1.2","795","Application Data"
"6.667103","5.9.29.183","172.19.0.3","TCP","1516","[TCP segment of a reassembled PDU]"
"6.667127","172.19.0.3","5.9.29.183","TCP","56","43520 → 9002 [ACK] Seq=22148 Ack=385678 Win=11911 Len=0"
"6.667192","5.9.29.183","172.19.0.3","TCP","1492","9002 → 43520 [PSH, ACK] Seq=385678 Ack=22148 Win=65535 Len=1436 [TCP segment of a reassembled PDU]"
"6.667203","5.9.29.183","172.19.0.3","TLSv1.2","1516","Application Data [TCP segment of a reassembled PDU]"
"6.667207","5.9.29.183","172.19.0.3","TCP","1492","9002 → 43520 [PSH, ACK] Seq=388574 Ack=22148 Win=65535 Len=1436 [TCP segment of a reassembled PDU]"
"6.667436","172.19.0.3","5.9.29.183","TCP","56","43520 → 9002 [ACK] Seq=22148 Ack=390010 Win=11887 Len=0"
"6.667466","5.9.29.183","172.19.0.3","TCP","1516","9002 → 43520 [PSH, ACK] Seq=390010 Ack=22148 Win=65535 Len=1460 [TCP segment of a reassembled PDU]"
"6.667471","5.9.29.183","172.19.0.3","TLSv1.2","1492","Application Data [TCP segment of a reassembled PDU]"
"6.667505","172.19.0.3","5.9.29.183","TCP","56","43520 → 9002 [ACK] Seq=22148 Ack=392906 Win=11869 Len=0"
"6.667749","172.19.0.3","5.9.29.183","TLSv1.2","599","Application Data"
"6.668113","5.9.29.183","172.19.0.3","TCP","56","9002 → 43520 [ACK] Seq=392906 Ack=22691 Win=65535 Len=0"
"6.668127","5.9.29.183","172.19.0.3","TCP","1504","9002 → 43520 [PSH, ACK] Seq=392906 Ack=22691 Win=65535 Len=1448 [TCP segment of a reassembled PDU]"
"6.668247","5.9.29.183","172.19.0.3","TLSv1.2","1315","Application Data"
"6.668257","172.19.0.3","5.9.29.183","TCP","56","43520 → 9002 [ACK] Seq=22691 Ack=395613 Win=11903 Len=0"
"6.682602","5.9.29.183","172.19.0.3","TCP","1516","[TCP segment of a reassembled PDU]"
"6.682679","5.9.29.183","172.19.0.3","TCP","1516","9002 → 43520 [PSH, ACK] Seq=397073 Ack=22691 Win=65535 Len=1460 [TCP segment of a reassembled PDU]"
"6.682696","172.19.0.3","5.9.29.183","TCP","56","43520 → 9002 [ACK] Seq=22691 Ack=398533 Win=11903 Len=0"
"6.682699","5.9.29.183","172.19.0.3","TLSv1.2","1516","Application Data [TCP segment of a reassembled PDU]"
"6.682703","5.9.29.183","172.19.0.3","TCP","1516","9002 → 43520 [PSH, ACK] Seq=399993 Ack=22691 Win=65535 Len=1460 [TCP segment of a reassembled PDU]"
"6.682707","5.9.29.183","172.19.0.3","TCP","1516","9002 → 43520 [PSH, ACK] Seq=401453 Ack=22691 Win=65535 Len=1460 [TCP segment of a reassembled PDU]"
"6.682710","5.9.29.183","172.19.0.3","TLSv1.2","1516","Application Data [TCP segment of a reassembled PDU]"
"6.682790","5.9.29.183","172.19.0.3","TCP","1516","9002 → 43520 [PSH, ACK] Seq=404373 Ack=22691 Win=65535 Len=1460 [TCP segment of a reassembled PDU]"
"6.682797","5.9.29.183","172.19.0.3","TCP","1516","9002 → 43520 [PSH, ACK] Seq=405833 Ack=22691 Win=65535 Len=1460 [TCP segment of a reassembled PDU]"
"6.682800","5.9.29.183","172.19.0.3","TLSv1.2","1408","Application Data [TCP segment of a reassembled PDU]"
"6.682826","172.19.0.3","5.9.29.183","TCP","56","43520 → 9002 [ACK] Seq=22691 Ack=408645 Win=11847 Len=0"
"6.684127","5.9.29.183","172.19.0.3","TLSv1.2","504","Application Data"
"6.684404","172.19.0.3","5.9.29.183","TLSv1.2","599","Application Data"
"6.684597","5.9.29.183","172.19.0.3","TCP","56","9002 → 43520 [ACK] Seq=409093 Ack=23234 Win=65535 Len=0"
"6.698139","5.9.29.183","172.19.0.3","TCP","1504","[TCP segment of a reassembled PDU]"
"6.698198","5.9.29.183","172.19.0.3","TCP","1516","9002 → 43520 [PSH, ACK] Seq=410541 Ack=23234 Win=65535 Len=1460 [TCP segment of a reassembled PDU]"
"6.698223","5.9.29.183","172.19.0.3","TLSv1.2","1516","Application Data [TCP segment of a reassembled PDU]"
"6.698227","5.9.29.183","172.19.0.3","TCP","1516","9002 → 43520 [PSH, ACK] Seq=413461 Ack=23234 Win=65535 Len=1460 [TCP segment of a reassembled PDU]"
"6.698313","5.9.29.183","172.19.0.3","TCP","1516","9002 → 43520 [PSH, ACK] Seq=414921 Ack=23234 Win=65535 Len=1460 [TCP segment of a reassembled PDU]"
"6.698329","5.9.29.183","172.19.0.3","TLSv1.2","1516","Application Data [TCP segment of a reassembled PDU]"
"6.698356","5.9.29.183","172.19.0.3","TCP","1516","9002 → 43520 [PSH, ACK] Seq=417841 Ack=23234 Win=65535 Len=1460 [TCP segment of a reassembled PDU]"
"6.698375","5.9.29.183","172.19.0.3","TCP","1516","9002 → 43520 [PSH, ACK] Seq=419301 Ack=23234 Win=65535 Len=1460 [TCP segment of a reassembled PDU]"
"6.698419","172.19.0.3","5.9.29.183","TCP","56","43520 → 9002 [ACK] Seq=23234 Ack=420761 Win=11853 Len=0"
"6.698421","5.9.29.183","172.19.0.3","TLSv1.2","1516","Application Data [TCP segment of a reassembled PDU]"
"6.698424","5.9.29.183","172.19.0.3","TCP","771","9002 → 43520 [PSH, ACK] Seq=422221 Ack=23234 Win=65535 Len=715 [TCP segment of a reassembled PDU]"
"6.698487","172.19.0.3","5.9.29.183","TCP","56","43520 → 9002 [ACK] Seq=23234 Ack=422936 Win=11837 Len=0"
"6.698583","5.9.29.183","172.19.0.3","TCP","1516","9002 → 43520 [PSH, ACK] Seq=422936 Ack=23234 Win=65535 Len=1460 [TCP segment of a reassembled PDU]"
"6.698590","5.9.29.183","172.19.0.3","TCP","681","9002 → 43520 [PSH, ACK] Seq=424396 Ack=23234 Win=65535 Len=625 [TCP segment of a reassembled PDU]"
"6.698648","172.19.0.3","5.9.29.183","TCP","56","43520 → 9002 [ACK] Seq=23234 Ack=425021 Win=11821 Len=0"
"6.698886","172.19.0.3","5.9.29.183","TLSv1.2","599","Application Data"
"6.699068","5.9.29.183","172.19.0.3","TCP","56","9002 → 43520 [ACK] Seq=425021 Ack=23777 Win=65535 Len=0"
"6.699296","5.9.29.183","172.19.0.3","TLSv1.2","178","Application Data"
"6.715252","5.9.29.183","172.19.0.3","TCP","1516","[TCP segment of a reassembled PDU]"
"6.715275","172.19.0.3","5.9.29.183","TCP","56","43520 → 9002 [ACK] Seq=23777 Ack=426603 Win=11911 Len=0"
"6.715335","5.9.29.183","172.19.0.3","TCP","1516","9002 → 43520 [PSH, ACK] Seq=426603 Ack=23777 Win=65535 Len=1460 [TCP segment of a reassembled PDU]"
"6.715346","5.9.29.183","172.19.0.3","TLSv1.2","1516","Application Data [TCP segment of a reassembled PDU]"
"6.715349","5.9.29.183","172.19.0.3","TCP","1516","9002 → 43520 [PSH, ACK] Seq=429523 Ack=23777 Win=65535 Len=1460 [TCP segment of a reassembled PDU]"
"6.715353","5.9.29.183","172.19.0.3","TCP","1516","9002 → 43520 [PSH, ACK] Seq=430983 Ack=23777 Win=65535 Len=1460 [TCP segment of a reassembled PDU]"
"6.715497","5.9.29.183","172.19.0.3","TLSv1.2","1516","Application Data [TCP segment of a reassembled PDU]"
"6.715536","5.9.29.183","172.19.0.3","TCP","1516","9002 → 43520 [PSH, ACK] Seq=433903 Ack=23777 Win=65535 Len=1460 [TCP segment of a reassembled PDU]"
"6.715541","5.9.29.183","172.19.0.3","TCP","1420","9002 → 43520 [PSH, ACK] Seq=435363 Ack=23777 Win=65535 Len=1364 [TCP segment of a reassembled PDU]"
"6.715545","5.9.29.183","172.19.0.3","TLSv1.2","1516","Application Data [TCP segment of a reassembled PDU]"
"6.715549","172.19.0.3","5.9.29.183","TCP","56","43520 → 9002 [ACK] Seq=23777 Ack=432443 Win=11879 Len=0"
"6.715690","172.19.0.3","5.9.29.183","TCP","56","43520 → 9002 [ACK] Seq=23777 Ack=438187 Win=11847 Len=0"
"6.715698","5.9.29.183","172.19.0.3","TCP","1516","9002 → 43520 [PSH, ACK] Seq=438187 Ack=23777 Win=65535 Len=1460 [TCP segment of a reassembled PDU]"
"6.715706","5.9.29.183","172.19.0.3","TCP","1480","9002 → 43520 [PSH, ACK] Seq=439647 Ack=23777 Win=65535 Len=1424 [TCP segment of a reassembled PDU]"
"6.715955","172.19.0.3","5.9.29.183","TCP","56","43520 → 9002 [ACK] Seq=23777 Ack=441071 Win=11830 Len=0"
"6.719470","5.9.29.183","172.19.0.3","TLSv1.2","721","Application Data, Application Data"
"6.719815","172.19.0.3","5.9.29.183","TLSv1.2","599","Application Data"
"6.720083","5.9.29.183","172.19.0.3","TCP","56","9002 → 43520 [ACK] Seq=441736 Ack=24320 Win=65535 Len=0"
"6.729261","172.19.0.3","5.9.29.183","TLSv1.2","599","Application Data"
"6.729571","5.9.29.183","172.19.0.3","TCP","56","9002 → 43520 [ACK] Seq=441736 Ack=24863 Win=65535 Len=0"
"7.201784","5.9.29.183","172.19.0.3","TLSv1.2","599","Application Data"
"7.202682","172.19.0.3","5.9.29.183","TLSv1.2","599","Application Data"
"7.203000","5.9.29.183","172.19.0.3","TCP","56","9002 → 43520 [ACK] Seq=442279 Ack=25406 Win=65535 Len=0"
"7.466023","5.9.29.183","172.19.0.3","TCP","1516","[TCP segment of a reassembled PDU]"
"7.466052","5.9.29.183","172.19.0.3","TCP","1492","9002 → 43520 [PSH, ACK] Seq=443739 Ack=25406 Win=65535 Len=1436 [TCP segment of a reassembled PDU]"
"7.466158","5.9.29.183","172.19.0.3","TLSv1.2","1516","Application Data [TCP segment of a reassembled PDU]"
"7.466169","5.9.29.183","172.19.0.3","TCP","1516","9002 → 43520 [PSH, ACK] Seq=446635 Ack=25406 Win=65535 Len=1460 [TCP segment of a reassembled PDU]"
"7.466173","5.9.29.183","172.19.0.3","TCP","1516","9002 → 43520 [PSH, ACK] Seq=448095 Ack=25406 Win=65535 Len=1460 [TCP segment of a reassembled PDU]"
"7.466199","5.9.29.183","172.19.0.3","TLSv1.2","1516","Application Data [TCP segment of a reassembled PDU]"
"7.466203","5.9.29.183","172.19.0.3","TCP","1516","9002 → 43520 [PSH, ACK] Seq=451015 Ack=25406 Win=65535 Len=1460 [TCP segment of a reassembled PDU]"
"7.466205","5.9.29.183","172.19.0.3","TCP","1177","9002 → 43520 [PSH, ACK] Seq=452475 Ack=25406 Win=65535 Len=1121 [TCP segment of a reassembled PDU]"
"7.466268","172.19.0.3","5.9.29.183","TCP","56","43520 → 9002 [ACK] Seq=25406 Ack=453596 Win=11853 Len=0"
"7.482118","5.9.29.183","172.19.0.3","TLSv1.2","1504","Application Data [TCP segment of a reassembled PDU]"
"7.482236","5.9.29.183","172.19.0.3","TCP","1516","9002 → 43520 [PSH, ACK] Seq=455044 Ack=25406 Win=65535 Len=1460 [TCP segment of a reassembled PDU]"
"7.482246","172.19.0.3","5.9.29.183","TCP","56","43520 → 9002 [ACK] Seq=25406 Ack=456504 Win=11903 Len=0"
"7.482248","5.9.29.183","172.19.0.3","TCP","1516","9002 → 43520 [PSH, ACK] Seq=456504 Ack=25406 Win=65535 Len=1460 [TCP segment of a reassembled PDU]"
"7.482269","5.9.29.183","172.19.0.3","TLSv1.2","1516","Application Data [TCP segment of a reassembled PDU]"
"7.482330","5.9.29.183","172.19.0.3","TCP","1516","9002 → 43520 [PSH, ACK] Seq=459424 Ack=25406 Win=65535 Len=1460 [TCP segment of a reassembled PDU]"
"7.482334","5.9.29.183","172.19.0.3","TCP","1456","9002 → 43520 [PSH, ACK] Seq=460884 Ack=25406 Win=65535 Len=1400 [TCP segment of a reassembled PDU]"
"7.482336","5.9.29.183","172.19.0.3","TLSv1.2","785","Application Data, Application Data"
"7.482448","172.19.0.3","5.9.29.183","TCP","56","43520 → 9002 [ACK] Seq=25406 Ack=463013 Win=11863 Len=0"
"7.482783","172.19.0.3","5.9.29.183","TLSv1.2","599","Application Data"
"7.482928","5.9.29.183","172.19.0.3","TCP","56","9002 → 43520 [ACK] Seq=463013 Ack=25949 Win=65535 Len=0"
"7.573989","5.9.29.183","172.19.0.3","TCP","1504","[TCP segment of a reassembled PDU]"
"7.574013","5.9.29.183","172.19.0.3","TCP","1516","9002 → 43520 [PSH, ACK] Seq=464461 Ack=25949 Win=65535 Len=1460 [TCP segment of a reassembled PDU]"
"7.574025","172.19.0.3","5.9.29.183","TCP","56","43520 → 9002 [ACK] Seq=25949 Ack=465921 Win=11903 Len=0"
"7.574026","5.9.29.183","172.19.0.3","TLSv1.2","775","Application Data"
"7.587099","5.9.29.183","172.19.0.3","TCP","1516","[TCP segment of a reassembled PDU]"
"7.587123","172.19.0.3","5.9.29.183","TCP","56","43520 → 9002 [ACK] Seq=25949 Ack=468100 Win=11911 Len=0"
"7.587139","5.9.29.183","172.19.0.3","TCP","1516","9002 → 43520 [PSH, ACK] Seq=468100 Ack=25949 Win=65535 Len=1460 [TCP segment of a reassembled PDU]"
"7.587146","5.9.29.183","172.19.0.3","TLSv1.2","1480","Application Data [TCP segment of a reassembled PDU]"
"7.587150","5.9.29.183","172.19.0.3","TCP","1516","9002 → 43520 [PSH, ACK] Seq=470984 Ack=25949 Win=65535 Len=1460 [TCP segment of a reassembled PDU]"
"7.587156","5.9.29.183","172.19.0.3","TCP","1516","9002 → 43520 [PSH, ACK] Seq=472444 Ack=25949 Win=65535 Len=1460 [TCP segment of a reassembled PDU]"
"7.587161","5.9.29.183","172.19.0.3","TLSv1.2","1516","Application Data [TCP segment of a reassembled PDU]"
"7.587357","5.9.29.183","172.19.0.3","TCP","1516","9002 → 43520 [PSH, ACK] Seq=475364 Ack=25949 Win=65535 Len=1460 [TCP segment of a reassembled PDU]"
"7.587365","5.9.29.183","172.19.0.3","TLSv1.2","1516","Application Data [TCP segment of a reassembled PDU]"
"7.587371","5.9.29.183","172.19.0.3","TCP","1516","9002 → 43520 [PSH, ACK] Seq=478284 Ack=25949 Win=65535 Len=1460 [TCP segment of a reassembled PDU]"
"7.587375","5.9.29.183","172.19.0.3","TCP","1516","9002 → 43520 [PSH, ACK] Seq=479744 Ack=25949 Win=65535 Len=1460 [TCP segment of a reassembled PDU]"
"7.587379","5.9.29.183","172.19.0.3","TLSv1.2","1516","Application Data [TCP segment of a reassembled PDU]"
"7.587383","5.9.29.183","172.19.0.3","TCP","1516","9002 → 43520 [PSH, ACK] Seq=482664 Ack=25949 Win=65535 Len=1460 [TCP segment of a reassembled PDU]"
"7.587400","5.9.29.183","172.19.0.3","TCP","1396","9002 → 43520 [PSH, ACK] Seq=484124 Ack=25949 Win=65535 Len=1340 [TCP segment of a reassembled PDU]"
"7.587469","172.19.0.3","5.9.29.183","TCP","56","43520 → 9002 [ACK] Seq=25949 Ack=485464 Win=11812 Len=0"
"7.587669","172.19.0.3","5.9.29.183","TLSv1.2","599","Application Data"
"7.587845","5.9.29.183","172.19.0.3","TCP","56","9002 → 43520 [ACK] Seq=485464 Ack=26492 Win=65535 Len=0"
"7.589917","5.9.29.183","172.19.0.3","TLSv1.2","1452","Application Data, Application Data"
"7.607296","5.9.29.183","172.19.0.3","TCP","1504","[TCP segment of a reassembled PDU]"
"7.607314","172.19.0.3","5.9.29.183","TCP","56","43520 → 9002 [ACK] Seq=26492 Ack=488308 Win=11911 Len=0"
"7.607997","5.9.29.183","172.19.0.3","TCP","220","9002 → 43520 [PSH, ACK] Seq=488308 Ack=26492 Win=65535 Len=164 [TCP segment of a reassembled PDU]"
"7.608097","5.9.29.183","172.19.0.3","TCP","1516","9002 → 43520 [PSH, ACK] Seq=488472 Ack=26492 Win=65535 Len=1460 [TCP segment of a reassembled PDU]"
"7.608100","5.9.29.183","172.19.0.3","TLSv1.2","611","Application Data"
"7.608109","172.19.0.3","5.9.29.183","TCP","56","43520 → 9002 [ACK] Seq=26492 Ack=489932 Win=11911 Len=0"
"7.609888","172.19.0.3","5.9.29.183","TLSv1.2","599","Application Data"
"7.610151","5.9.29.183","172.19.0.3","TCP","56","9002 → 43520 [ACK] Seq=490487 Ack=27035 Win=65535 Len=0"
"7.618852","172.19.0.3","5.9.29.183","TLSv1.2","599","Application Data"
"7.619150","5.9.29.183","172.19.0.3","TCP","56","9002 → 43520 [ACK] Seq=490487 Ack=27578 Win=65535 Len=0"
"7.637963","5.9.29.183","172.19.0.3","TLSv1.2","599","Application Data"
"7.678970","172.19.0.3","5.9.29.183","TCP","56","43520 → 9002 [ACK] Seq=27578 Ack=491030 Win=11911 Len=0"
"8.430832","5.9.29.183","172.19.0.3","TLSv1.2","599","Application Data"
"8.430894","172.19.0.3","5.9.29.183","TCP","56","43520 → 9002 [ACK] Seq=27578 Ack=491573 Win=11911 Len=0"
"8.431772","172.19.0.3","5.9.29.183","TLSv1.2","599","Application Data"
"8.431953","5.9.29.183","172.19.0.3","TCP","56","9002 → 43520 [ACK] Seq=491573 Ack=28121 Win=65535 Len=0"
"8.701539","5.9.29.183","172.19.0.3","TCP","1504","[TCP segment of a reassembled PDU]"
"8.701603","5.9.29.183","172.19.0.3","TCP","1516","9002 → 43520 [PSH, ACK] Seq=493021 Ack=28121 Win=65535 Len=1460 [TCP segment of a reassembled PDU]"
"8.701610","5.9.29.183","172.19.0.3","TLSv1.2","1516","Application Data [TCP segment of a reassembled PDU]"
"8.701612","5.9.29.183","172.19.0.3","TCP","1516","9002 → 43520 [PSH, ACK] Seq=495941 Ack=28121 Win=65535 Len=1460 [TCP segment of a reassembled PDU]"
"8.701636","5.9.29.183","172.19.0.3","TCP","1201","9002 → 43520 [PSH, ACK] Seq=497401 Ack=28121 Win=65535 Len=1145 [TCP segment of a reassembled PDU]"
"8.701640","5.9.29.183","172.19.0.3","TLSv1.2","1516","Application Data [TCP segment of a reassembled PDU]"
"8.701644","5.9.29.183","172.19.0.3","TCP","1516","9002 → 43520 [PSH, ACK] Seq=500006 Ack=28121 Win=65535 Len=1460 [TCP segment of a reassembled PDU]"
"8.701702","5.9.29.183","172.19.0.3","TCP","1480","9002 → 43520 [PSH, ACK] Seq=501466 Ack=28121 Win=65535 Len=1424 [TCP segment of a reassembled PDU]"
"8.701723","172.19.0.3","5.9.29.183","TCP","56","43520 → 9002 [ACK] Seq=28121 Ack=502890 Win=11853 Len=0"
"8.716916","5.9.29.183","172.19.0.3","TLSv1.2","1191","Application Data, Application Data"
"8.720029","5.9.29.183","172.19.0.3","TCP","1504","[TCP segment of a reassembled PDU]"
"8.720050","172.19.0.3","5.9.29.183","TCP","56","43520 → 9002 [ACK] Seq=28121 Ack=505473 Win=11911 Len=0"
"8.720161","5.9.29.183","172.19.0.3","TCP","1504","9002 → 43520 [PSH, ACK] Seq=505473 Ack=28121 Win=65535 Len=1448 [TCP segment of a reassembled PDU]"
"8.732035","5.9.29.183","172.19.0.3","TLSv1.2","787","Application Data"
"8.732055","172.19.0.3","5.9.29.183","TCP","56","43520 → 9002 [ACK] Seq=28121 Ack=507652 Win=11911 Len=0"
"8.732089","5.9.29.183","172.19.0.3","TCP","1516","[TCP segment of a reassembled PDU]"
"8.732097","5.9.29.183","172.19.0.3","TCP","1516","9002 → 43520 [PSH, ACK] Seq=509112 Ack=28121 Win=65535 Len=1460 [TCP segment of a reassembled PDU]"
"8.732099","5.9.29.183","172.19.0.3","TLSv1.2","1480","Application Data [TCP segment of a reassembled PDU]"
"8.732101","5.9.29.183","172.19.0.3","TCP","1504","9002 → 43520 [PSH, ACK] Seq=511996 Ack=28121 Win=65535 Len=1448 [TCP segment of a reassembled PDU]"
"8.732199","172.19.0.3","5.9.29.183","TCP","56","43520 → 9002 [ACK] Seq=28121 Ack=513444 Win=11879 Len=0"
"8.747416","5.9.29.183","172.19.0.3","TCP","1516","9002 → 43520 [PSH, ACK] Seq=513444 Ack=28121 Win=65535 Len=1460 [TCP segment of a reassembled PDU]"
"8.747454","5.9.29.183","172.19.0.3","TLSv1.2","1516","Application Data [TCP segment of a reassembled PDU]"
"8.747464","172.19.0.3","5.9.29.183","TCP","56","43520 → 9002 [ACK] Seq=28121 Ack=516364 Win=11903 Len=0"
"8.747465","5.9.29.183","172.19.0.3","TCP","1480","9002 → 43520 [PSH, ACK] Seq=516364 Ack=28121 Win=65535 Len=1424 [TCP segment of a reassembled PDU]"
"8.747744","172.19.0.3","5.9.29.183","TLSv1.2","599","Application Data"
"8.747953","5.9.29.183","172.19.0.3","TCP","56","9002 → 43520 [ACK] Seq=517788 Ack=28664 Win=65535 Len=0"
"8.763946","5.9.29.183","172.19.0.3","TCP","1504","9002 → 43520 [PSH, ACK] Seq=517788 Ack=28664 Win=65535 Len=1448 [TCP segment of a reassembled PDU]"
"8.764000","5.9.29.183","172.19.0.3","TLSv1.2","1516","Application Data [TCP segment of a reassembled PDU]"
"8.764014","172.19.0.3","5.9.29.183","TCP","56","43520 → 9002 [ACK] Seq=28664 Ack=520696 Win=11903 Len=0"
"8.764016","5.9.29.183","172.19.0.3","TLSv1.2","1516","Application Data [TCP segment of a reassembled PDU]"
"8.764020","5.9.29.183","172.19.0.3","TLSv1.2","1117","Application Data"
"8.764159","172.19.0.3","5.9.29.183","TCP","56","43520 → 9002 [ACK] Seq=28664 Ack=523217 Win=11887 Len=0"
"8.764500","172.19.0.3","5.9.29.183","TLSv1.2","599","Application Data"
"8.764722","5.9.29.183","172.19.0.3","TCP","56","9002 → 43520 [ACK] Seq=523217 Ack=29207 Win=65535 Len=0"
"8.765148","5.9.29.183","172.19.0.3","TCP","1516","[TCP segment of a reassembled PDU]"
"8.765178","5.9.29.183","172.19.0.3","TCP","1492","9002 → 43520 [PSH, ACK] Seq=524677 Ack=29207 Win=65535 Len=1436 [TCP segment of a reassembled PDU]"
"8.765185","172.19.0.3","5.9.29.183","TCP","56","43520 → 9002 [ACK] Seq=29207 Ack=526113 Win=11903 Len=0"
"8.776691","5.9.29.183","172.19.0.3","TLSv1.2","1504","Application Data, Application Data"
"8.776735","5.9.29.183","172.19.0.3","TCP","1504","9002 → 43520 [PSH, ACK] Seq=527561 Ack=29207 Win=65535 Len=1448 [TCP segment of a reassembled PDU]"
"8.776844","172.19.0.3","5.9.29.183","TCP","56","43520 → 9002 [ACK] Seq=29207 Ack=529009 Win=11901 Len=0"
"8.779114","5.9.29.183","172.19.0.3","TCP","1504","9002 → 43520 [PSH, ACK] Seq=529009 Ack=29207 Win=65535 Len=1448 [TCP segment of a reassembled PDU]"
"8.779222","5.9.29.183","172.19.0.3","TLSv1.2","1504","Application Data [TCP segment of a reassembled PDU]"
"8.779231","172.19.0.3","5.9.29.183","TCP","56","43520 → 9002 [ACK] Seq=29207 Ack=531905 Win=11903 Len=0"
"8.779307","5.9.29.183","172.19.0.3","TCP","1516","9002 → 43520 [PSH, ACK] Seq=531905 Ack=29207 Win=65535 Len=1460 [TCP segment of a reassembled PDU]"
"8.779312","5.9.29.183","172.19.0.3","TCP","1492","9002 → 43520 [PSH, ACK] Seq=533365 Ack=29207 Win=65535 Len=1436 [TCP segment of a reassembled PDU]"
"8.779429","172.19.0.3","5.9.29.183","TCP","56","43520 → 9002 [ACK] Seq=29207 Ack=534801 Win=11887 Len=0"
"8.794813","5.9.29.183","172.19.0.3","TLSv1.2","1516","Application Data [TCP segment of a reassembled PDU]"
"8.794856","5.9.29.183","172.19.0.3","TCP","1516","9002 → 43520 [PSH, ACK] Seq=536261 Ack=29207 Win=65535 Len=1460 [TCP segment of a reassembled PDU]"
"8.794868","172.19.0.3","5.9.29.183","TCP","56","43520 → 9002 [ACK] Seq=29207 Ack=537721 Win=11903 Len=0"
"8.794870","5.9.29.183","172.19.0.3","TLSv1.2","1117","Application Data"
"8.799225","172.19.0.3","5.9.29.183","TLSv1.2","599","Application Data"
"8.799536","5.9.29.183","172.19.0.3","TCP","56","9002 → 43520 [ACK] Seq=538782 Ack=29750 Win=65535 Len=0"
"9.009532","5.9.29.183","172.19.0.3","TLSv1.2","599","Application Data"
"9.010248","172.19.0.3","5.9.29.183","TLSv1.2","599","Application Data"
"9.010535","5.9.29.183","172.19.0.3","TCP","56","9002 → 43520 [ACK] Seq=539325 Ack=30293 Win=65535 Len=0"
"9.214332","5.9.29.183","172.19.0.3","TLSv1.2","599","Application Data"
"9.241209","5.9.29.183","172.19.0.3","TCP","1504","[TCP segment of a reassembled PDU]"
"9.241304","172.19.0.3","5.9.29.183","TCP","56","43520 → 9002 [ACK] Seq=30293 Ack=541316 Win=11911 Len=0"
"9.241392","5.9.29.183","172.19.0.3","TCP","1504","9002 → 43520 [PSH, ACK] Seq=541316 Ack=30293 Win=65535 Len=1448 [TCP segment of a reassembled PDU]"
"9.241403","5.9.29.183","172.19.0.3","TLSv1.2","1516","Application Data [TCP segment of a reassembled PDU]"
"9.241406","5.9.29.183","172.19.0.3","TCP","1516","9002 → 43520 [PSH, ACK] Seq=544224 Ack=30293 Win=65535 Len=1460 [TCP segment of a reassembled PDU]"
"9.241409","5.9.29.183","172.19.0.3","TCP","1516","9002 → 43520 [PSH, ACK] Seq=545684 Ack=30293 Win=65535 Len=1460 [TCP segment of a reassembled PDU]"
"9.241434","5.9.29.183","172.19.0.3","TLSv1.2","1516","Application Data [TCP segment of a reassembled PDU]"
"9.241455","5.9.29.183","172.19.0.3","TCP","1189","9002 → 43520 [PSH, ACK] Seq=548604 Ack=30293 Win=65535 Len=1133 [TCP segment of a reassembled PDU]"
"9.241468","172.19.0.3","5.9.29.183","TCP","56","43520 → 9002 [ACK] Seq=30293 Ack=548604 Win=11871 Len=0"
"9.241538","5.9.29.183","172.19.0.3","TCP","1504","9002 → 43520 [PSH, ACK] Seq=549737 Ack=30293 Win=65535 Len=1448 [TCP segment of a reassembled PDU]"
"9.241598","172.19.0.3","5.9.29.183","TCP","56","43520 → 9002 [ACK] Seq=30293 Ack=551185 Win=11855 Len=0"
"9.256866","5.9.29.183","172.19.0.3","TLSv1.2","1516","Application Data, Application Data"
"9.256932","5.9.29.183","172.19.0.3","TCP","1419","9002 → 43520 [PSH, ACK] Seq=552645 Ack=30293 Win=65535 Len=1363 [TCP segment of a reassembled PDU]"
"9.256949","172.19.0.3","5.9.29.183","TCP","56","43520 → 9002 [ACK] Seq=30293 Ack=554008 Win=11903 Len=0"
"9.256952","5.9.29.183","172.19.0.3","TCP","129","9002 → 43520 [PSH, ACK] Seq=554008 Ack=30293 Win=65535 Len=73 [TCP segment of a reassembled PDU]"
"9.257646","5.9.29.183","172.19.0.3","TCP","1504","9002 → 43520 [PSH, ACK] Seq=554081 Ack=30293 Win=65535 Len=1448 [TCP segment of a reassembled PDU]"
"9.257656","172.19.0.3","5.9.29.183","TCP","56","43520 → 9002 [ACK] Seq=30293 Ack=555529 Win=11911 Len=0"
"9.258020","5.9.29.183","172.19.0.3","TLSv1.2","1516","Application Data [TCP segment of a reassembled PDU]"
"9.258066","5.9.29.183","172.19.0.3","TLSv1.2","1516","Application Data [TCP segment of a reassembled PDU]"
"9.258074","5.9.29.183","172.19.0.3","TLSv1.2","696","Application Data"
"9.258136","172.19.0.3","5.9.29.183","TCP","56","43520 → 9002 [ACK] Seq=30293 Ack=559089 Win=11895 Len=0"
"9.259324","5.9.29.183","172.19.0.3","TCP","1504","[TCP segment of a reassembled PDU]"
"9.273225","5.9.29.183","172.19.0.3","TCP","1516","9002 → 43520 [PSH, ACK] Seq=560537 Ack=30293 Win=65535 Len=1460 [TCP segment of a reassembled PDU]"
"9.273244","172.19.0.3","5.9.29.183","TCP","56","43520 → 9002 [ACK] Seq=30293 Ack=561997 Win=11911 Len=0"
"9.273284","5.9.29.183","172.19.0.3","TLSv1.2","261","Application Data"
"9.304019","5.9.29.183","172.19.0.3","TLSv1.2","1113","Application Data"
"9.304036","172.19.0.3","5.9.29.183","TCP","56","43520 → 9002 [ACK] Seq=30293 Ack=563259 Win=11911 Len=0"
"9.307274","172.19.0.3","5.9.29.183","TLSv1.2","599","Application Data"
"9.307516","5.9.29.183","172.19.0.3","TCP","56","9002 → 43520 [ACK] Seq=563259 Ack=30836 Win=65535 Len=0"
"9.569104","5.9.29.183","172.19.0.3","TLSv1.2","599","Application Data"
"9.569880","172.19.0.3","5.9.29.183","TLSv1.2","599","Application Data"
"9.570266","5.9.29.183","172.19.0.3","TCP","56","9002 → 43520 [ACK] Seq=563802 Ack=31379 Win=65535 Len=0"
"9.794791","5.9.29.183","172.19.0.3","TLSv1.2","599","Application Data"
"9.811279","5.9.29.183","172.19.0.3","TCP","1504","[TCP segment of a reassembled PDU]"
"9.811310","172.19.0.3","5.9.29.183","TCP","56","43520 → 9002 [ACK] Seq=31379 Ack=565793 Win=11911 Len=0"
"9.811545","5.9.29.183","172.19.0.3","TCP","1516","9002 → 43520 [PSH, ACK] Seq=565793 Ack=31379 Win=65535 Len=1460 [TCP segment of a reassembled PDU]"
"9.811555","5.9.29.183","172.19.0.3","TLSv1.2","775","Application Data"
"9.811596","172.19.0.3","5.9.29.183","TCP","56","43520 → 9002 [ACK] Seq=31379 Ack=567972 Win=11911 Len=0"
"9.824276","5.9.29.183","172.19.0.3","TCP","1516","[TCP segment of a reassembled PDU]"
"9.824338","5.9.29.183","172.19.0.3","TCP","1516","9002 → 43520 [PSH, ACK] Seq=569432 Ack=31379 Win=65535 Len=1460 [TCP segment of a reassembled PDU]"
"9.824348","5.9.29.183","172.19.0.3","TLSv1.2","1516","Application Data [TCP segment of a reassembled PDU]"
"9.824351","5.9.29.183","172.19.0.3","TCP","1468","9002 → 43520 [PSH, ACK] Seq=572352 Ack=31379 Win=65535 Len=1412 [TCP segment of a reassembled PDU]"
"9.824495","172.19.0.3","5.9.29.183","TCP","56","43520 → 9002 [ACK] Seq=31379 Ack=573764 Win=11885 Len=0"
"9.824789","172.19.0.3","5.9.29.183","TLSv1.2","599","Application Data"
"9.825062","5.9.29.183","172.19.0.3","TCP","56","9002 → 43520 [ACK] Seq=573764 Ack=31922 Win=65535 Len=0"
"9.826561","5.9.29.183","172.19.0.3","TCP","1504","9002 → 43520 [PSH, ACK] Seq=573764 Ack=31922 Win=65535 Len=1448 [TCP segment of a reassembled PDU]"
"9.826700","5.9.29.183","172.19.0.3","TLSv1.2","1516","Application Data [TCP segment of a reassembled PDU]"
"9.826709","172.19.0.3","5.9.29.183","TCP","56","43520 → 9002 [ACK] Seq=31922 Ack=576672 Win=11903 Len=0"
"9.826711","5.9.29.183","172.19.0.3","TCP","1492","9002 → 43520 [PSH, ACK] Seq=576672 Ack=31922 Win=65535 Len=1436 [TCP segment of a reassembled PDU]"
"9.826713","5.9.29.183","172.19.0.3","TCP","1504","9002 → 43520 [PSH, ACK] Seq=578108 Ack=31922 Win=65535 Len=1448 [TCP segment of a reassembled PDU]"
"9.826729","172.19.0.3","5.9.29.183","TCP","56","43520 → 9002 [ACK] Seq=31922 Ack=579556 Win=11887 Len=0"
"9.826928","5.9.29.183","172.19.0.3","TLSv1.2","381","Application Data"
"9.841438","5.9.29.183","172.19.0.3","TCP","1516","[TCP segment of a reassembled PDU]"
"9.841458","172.19.0.3","5.9.29.183","TCP","56","43520 → 9002 [ACK] Seq=31922 Ack=581341 Win=11911 Len=0"
"9.841508","5.9.29.183","172.19.0.3","TCP","1516","9002 → 43520 [PSH, ACK] Seq=581341 Ack=31922 Win=65535 Len=1460 [TCP segment of a reassembled PDU]"
"9.841549","5.9.29.183","172.19.0.3","TLSv1.2","1516","Application Data [TCP segment of a reassembled PDU]"
"9.841558","5.9.29.183","172.19.0.3","TCP","1468","9002 → 43520 [PSH, ACK] Seq=584261 Ack=31922 Win=65535 Len=1412 [TCP segment of a reassembled PDU]"
"9.841699","172.19.0.3","5.9.29.183","TCP","56","43520 → 9002 [ACK] Seq=31922 Ack=585673 Win=11887 Len=0"
"9.842263","5.9.29.183","172.19.0.3","TCP","1504","9002 → 43520 [PSH, ACK] Seq=585673 Ack=31922 Win=65535 Len=1448 [TCP segment of a reassembled PDU]"
"9.842516","5.9.29.183","172.19.0.3","TLSv1.2","1516","Application Data [TCP segment of a reassembled PDU]"
"9.842523","172.19.0.3","5.9.29.183","TCP","56","43520 → 9002 [ACK] Seq=31922 Ack=588581 Win=11911 Len=0"
"9.842556","5.9.29.183","172.19.0.3","TCP","1516","9002 → 43520 [PSH, ACK] Seq=588581 Ack=31922 Win=65535 Len=1460 [TCP segment of a reassembled PDU]"
"9.842588","5.9.29.183","172.19.0.3","TCP","1480","9002 → 43520 [PSH, ACK] Seq=590041 Ack=31922 Win=65535 Len=1424 [TCP segment of a reassembled PDU]"
"9.842627","172.19.0.3","5.9.29.183","TCP","56","43520 → 9002 [ACK] Seq=31922 Ack=591465 Win=11895 Len=0"
"9.842632","5.9.29.183","172.19.0.3","TLSv1.2","381","Application Data"
"9.842979","172.19.0.3","5.9.29.183","TLSv1.2","599","Application Data"
"9.843232","5.9.29.183","172.19.0.3","TCP","56","9002 → 43520 [ACK] Seq=591790 Ack=32465 Win=65535 Len=0"
"9.857880","5.9.29.183","172.19.0.3","TCP","1504","[TCP segment of a reassembled PDU]"
"9.858507","5.9.29.183","172.19.0.3","TCP","1516","9002 → 43520 [PSH, ACK] Seq=593238 Ack=32465 Win=65535 Len=1460 [TCP segment of a reassembled PDU]"
"9.858540","172.19.0.3","5.9.29.183","TCP","56","43520 → 9002 [ACK] Seq=32465 Ack=594698 Win=11911 Len=0"
"9.858566","5.9.29.183","172.19.0.3","TLSv1.2","1516","Application Data [TCP segment of a reassembled PDU]"
"9.858664","5.9.29.183","172.19.0.3","TCP","1516","9002 → 43520 [PSH, ACK] Seq=596158 Ack=32465 Win=65535 Len=1460 [TCP segment of a reassembled PDU]"
"9.858668","5.9.29.183","172.19.0.3","TCP","1516","9002 → 43520 [PSH, ACK] Seq=597618 Ack=32465 Win=65535 Len=1460 [TCP segment of a reassembled PDU]"
"9.858670","5.9.29.183","172.19.0.3","TLSv1.2","1516","Application Data [TCP segment of a reassembled PDU]"
"9.858672","5.9.29.183","172.19.0.3","TCP","1444","9002 → 43520 [PSH, ACK] Seq=600538 Ack=32465 Win=65535 Len=1388 [TCP segment of a reassembled PDU]"
"9.858676","5.9.29.183","172.19.0.3","TCP","1516","9002 → 43520 [PSH, ACK] Seq=601926 Ack=32465 Win=65535 Len=1460 [TCP segment of a reassembled PDU]"
"9.858678","5.9.29.183","172.19.0.3","TLSv1.2","912","Application Data, Application Data"
"9.858736","172.19.0.3","5.9.29.183","TCP","56","43520 → 9002 [ACK] Seq=32465 Ack=604242 Win=11853 Len=0"
"9.875050","5.9.29.183","172.19.0.3","TCP","1516","[TCP segment of a reassembled PDU]"
"9.875118","5.9.29.183","172.19.0.3","TCP","1516","9002 → 43520 [PSH, ACK] Seq=605702 Ack=32465 Win=65535 Len=1460 [TCP segment of a reassembled PDU]"
"9.875138","172.19.0.3","5.9.29.183","TCP","56","43520 → 9002 [ACK] Seq=32465 Ack=607162 Win=11903 Len=0"
"9.875142","5.9.29.183","172.19.0.3","TLSv1.2","1516","Application Data [TCP segment of a reassembled PDU]"
"9.875147","5.9.29.183","172.19.0.3","TCP","1516","9002 → 43520 [PSH, ACK] Seq=608622 Ack=32465 Win=65535 Len=1460 [TCP segment of a reassembled PDU]"
"9.875151","5.9.29.183","172.19.0.3","TCP","1189","9002 → 43520 [PSH, ACK] Seq=610082 Ack=32465 Win=65535 Len=1133 [TCP segment of a reassembled PDU]"
"9.875250","172.19.0.3","5.9.29.183","TCP","56","43520 → 9002 [ACK] Seq=32465 Ack=611215 Win=11879 Len=0"
"9.890410","5.9.29.183","172.19.0.3","TLSv1.2","1394","Application Data, Application Data"
"9.895642","172.19.0.3","5.9.29.183","TLSv1.2","599","Application Data"
"9.895961","5.9.29.183","172.19.0.3","TCP","56","9002 → 43520 [ACK] Seq=612553 Ack=33008 Win=65535 Len=0"
"10.113974","5.9.29.183","172.19.0.3","TLSv1.2","599","Application Data"
"10.114774","172.19.0.3","5.9.29.183","TLSv1.2","599","Application Data"
"10.115057","5.9.29.183","172.19.0.3","TCP","56","9002 → 43520 [ACK] Seq=613096 Ack=33551 Win=65535 Len=0"
"10.362894","5.9.29.183","172.19.0.3","TLSv1.2","599","Application Data"
"10.375964","5.9.29.183","172.19.0.3","TCP","1516","[TCP segment of a reassembled PDU]"
"10.375985","172.19.0.3","5.9.29.183","TCP","56","43520 → 9002 [ACK] Seq=33551 Ack=615099 Win=11911 Len=0"
"10.376028","5.9.29.183","172.19.0.3","TCP","1492","9002 → 43520 [PSH, ACK] Seq=615099 Ack=33551 Win=65535 Len=1436 [TCP segment of a reassembled PDU]"
"10.376039","5.9.29.183","172.19.0.3","TLSv1.2","1516","Application Data [TCP segment of a reassembled PDU]"
"10.376043","5.9.29.183","172.19.0.3","TCP","1516","9002 → 43520 [PSH, ACK] Seq=617995 Ack=33551 Win=65535 Len=1460 [TCP segment of a reassembled PDU]"
"10.376045","5.9.29.183","172.19.0.3","TCP","145","9002 → 43520 [PSH, ACK] Seq=619455 Ack=33551 Win=65535 Len=89 [TCP segment of a reassembled PDU]"
"10.376167","172.19.0.3","5.9.29.183","TCP","56","43520 → 9002 [ACK] Seq=33551 Ack=619544 Win=11879 Len=0"
"10.376199","5.9.29.183","172.19.0.3","TCP","1391","9002 → 43520 [PSH, ACK] Seq=619544 Ack=33551 Win=65535 Len=1335 [TCP segment of a reassembled PDU]"
"10.377660","5.9.29.183","172.19.0.3","TLSv1.2","70","Application Data"
"10.377757","172.19.0.3","5.9.29.183","TCP","56","43520 → 9002 [ACK] Seq=33551 Ack=620893 Win=11911 Len=0"
"10.394025","5.9.29.183","172.19.0.3","TCP","1516","[TCP segment of a reassembled PDU]"
"10.394077","5.9.29.183","172.19.0.3","TCP","1516","9002 → 43520 [PSH, ACK] Seq=622353 Ack=33551 Win=65535 Len=1460 [TCP segment of a reassembled PDU]"
"10.394084","5.9.29.183","172.19.0.3","TLSv1.2","1213","Application Data"
"10.394086","5.9.29.183","172.19.0.3","TCP","1516","[TCP segment of a reassembled PDU]"
"10.394088","5.9.29.183","172.19.0.3","TCP","1492","9002 → 43520 [PSH, ACK] Seq=626430 Ack=33551 Win=65535 Len=1436 [TCP segment of a reassembled PDU]"
"10.394200","172.19.0.3","5.9.29.183","TCP","56","43520 → 9002 [ACK] Seq=33551 Ack=627866 Win=11877 Len=0"
"10.394487","172.19.0.3","5.9.29.183","TLSv1.2","599","Application Data"
"10.394672","5.9.29.183","172.19.0.3","TCP","56","9002 → 43520 [ACK] Seq=627866 Ack=34094 Win=65535 Len=0"
"10.409492","5.9.29.183","172.19.0.3","TLSv1.2","851","Application Data"
"10.412376","5.9.29.183","172.19.0.3","TCP","1516","[TCP segment of a reassembled PDU]"
"10.412384","172.19.0.3","5.9.29.183","TCP","56","43520 → 9002 [ACK] Seq=34094 Ack=630121 Win=11911 Len=0"
"10.412411","5.9.29.183","172.19.0.3","TCP","1516","9002 → 43520 [PSH, ACK] Seq=630121 Ack=34094 Win=65535 Len=1460 [TCP segment of a reassembled PDU]"
"10.412441","5.9.29.183","172.19.0.3","TLSv1.2","1516","Application Data [TCP segment of a reassembled PDU]"
"10.412489","172.19.0.3","5.9.29.183","TCP","56","43520 → 9002 [ACK] Seq=34094 Ack=633041 Win=11895 Len=0"
"10.412505","5.9.29.183","172.19.0.3","TCP","1468","9002 → 43520 [PSH, ACK] Seq=633041 Ack=34094 Win=65535 Len=1412 [TCP segment of a reassembled PDU]"
"10.412508","5.9.29.183","172.19.0.3","TCP","1516","9002 → 43520 [PSH, ACK] Seq=634453 Ack=34094 Win=65535 Len=1460 [TCP segment of a reassembled PDU]"
"10.412509","5.9.29.183","172.19.0.3","TLSv1.2","1516","Application Data [TCP segment of a reassembled PDU]"
"10.412510","5.9.29.183","172.19.0.3","TCP","1516","9002 → 43520 [PSH, ACK] Seq=637373 Ack=34094 Win=65535 Len=1460 [TCP segment of a reassembled PDU]"
"10.412540","172.19.0.3","5.9.29.183","TCP","56","43520 → 9002 [ACK] Seq=34094 Ack=638833 Win=11863 Len=0"
"10.412556","5.9.29.183","172.19.0.3","TCP","1468","9002 → 43520 [PSH, ACK] Seq=638833 Ack=34094 Win=65535 Len=1412 [TCP segment of a reassembled PDU]"
"10.412662","5.9.29.183","172.19.0.3","TLSv1.2","1504","Application Data [TCP segment of a reassembled PDU]"
"10.412781","172.19.0.3","5.9.29.183","TCP","56","43520 → 9002 [ACK] Seq=34094 Ack=641693 Win=11847 Len=0"
"10.412917","172.19.0.3","5.9.29.183","TLSv1.2","599","Application Data"
"10.413078","5.9.29.183","172.19.0.3","TCP","56","9002 → 43520 [ACK] Seq=641693 Ack=34637 Win=65535 Len=0"
"10.424467","5.9.29.183","172.19.0.3","TCP","1504","9002 → 43520 [PSH, ACK] Seq=641693 Ack=34637 Win=65535 Len=1448 [TCP segment of a reassembled PDU]"
"10.428087","5.9.29.183","172.19.0.3","TCP","1516","9002 → 43520 [PSH, ACK] Seq=643141 Ack=34637 Win=65535 Len=1460 [TCP segment of a reassembled PDU]"
"10.428103","172.19.0.3","5.9.29.183","TCP","56","43520 → 9002 [ACK] Seq=34637 Ack=644601 Win=11911 Len=0"
"10.428135","5.9.29.183","172.19.0.3","TLSv1.2","1516","Application Data, Application Data"
"10.428162","5.9.29.183","172.19.0.3","TCP","1516","9002 → 43520 [PSH, ACK] Seq=646061 Ack=34637 Win=65535 Len=1460 [TCP segment of a reassembled PDU]"
"10.428166","5.9.29.183","172.19.0.3","TLSv1.2","902","Application Data"
"10.428280","172.19.0.3","5.9.29.183","TCP","56","43520 → 9002 [ACK] Seq=34637 Ack=648367 Win=11887 Len=0"
"10.429501","5.9.29.183","172.19.0.3","TCP","1504","[TCP segment of a reassembled PDU]"
"10.429642","5.9.29.183","172.19.0.3","TCP","1516","9002 → 43520 [PSH, ACK] Seq=649815 Ack=34637 Win=65535 Len=1460 [TCP segment of a reassembled PDU]"
"10.429649","172.19.0.3","5.9.29.183","TCP","56","43520 → 9002 [ACK] Seq=34637 Ack=651275 Win=11911 Len=0"
"10.429651","5.9.29.183","172.19.0.3","TLSv1.2","1492","Application Data [TCP segment of a reassembled PDU]"
"10.429654","5.9.29.183","172.19.0.3","TCP","1516","9002 → 43520 [PSH, ACK] Seq=652711 Ack=34637 Win=65535 Len=1460 [TCP segment of a reassembled PDU]"
"10.429687","5.9.29.183","172.19.0.3","TCP","1492","9002 → 43520 [PSH, ACK] Seq=654171 Ack=34637 Win=65535 Len=1436 [TCP segment of a reassembled PDU]"
"10.429715","172.19.0.3","5.9.29.183","TCP","56","43520 → 9002 [ACK] Seq=34637 Ack=655607 Win=11885 Len=0"
"10.442858","5.9.29.183","172.19.0.3","TLSv1.2","70","Application Data"
"10.469114","5.9.29.183","172.19.0.3","TCP","1516","[TCP segment of a reassembled PDU]"
"10.469134","172.19.0.3","5.9.29.183","TCP","56","43520 → 9002 [ACK] Seq=34637 Ack=657081 Win=11911 Len=0"
"10.469174","5.9.29.183","172.19.0.3","TLSv1.2","167","Application Data"
"10.510148","172.19.0.3","5.9.29.183","TCP","56","43520 → 9002 [ACK] Seq=34637 Ack=657192 Win=11911 Len=0"
