_ws.col.Time,_ws.col.Source,_ws.col.Destination,_ws.col.Protocol,_ws.col.Length,_ws.col.Info
"0.000000","172.19.0.3","5.9.29.183","TLSv1.2","599","Application Data"
"0.000301","5.9.29.183","172.19.0.3","TCP","56","9002 → 43520 [ACK] Seq=1 Ack=544 Win=65535 Len=0"
"0.982226","5.9.29.183","172.19.0.3","TLSv1.2","599","Application Data"
"0.982301","172.19.0.3","5.9.29.183","TCP","56","43520 → 9002 [ACK] Seq=544 Ack=544 Win=11911 Len=0"
"0.983247","172.19.0.3","5.9.29.183","TLSv1.2","2141","Application Data"
"0.983629","5.9.29.183","172.19.0.3","TCP","56","9002 → 43520 [ACK] Seq=544 Ack=2629 Win=65535 Len=0"
"2.334371","5.9.29.183","172.19.0.3","TCP","1504","[TCP segment of a reassembled PDU]"
"2.334443","5.9.29.183","172.19.0.3","TLSv1.2","693","Application Data"
"2.334584","172.19.0.3","5.9.29.183","TCP","56","43520 → 9002 [ACK] Seq=2629 Ack=2629 Win=11903 Len=0"
"2.339150","172.19.0.3","5.9.29.183","TLSv1.2","599","Application Data"
"2.339575","5.9.29.183","172.19.0.3","TCP","56","9002 → 43520 [ACK] Seq=2629 Ack=3172 Win=65535 Len=0"
"3.087678","5.9.29.183","172.19.0.3","TLSv1.2","599","Application Data"
"3.088624","172.19.0.3","5.9.29.183","TLSv1.2","599","Application Data"
"3.088933","5.9.29.183","172.19.0.3","TCP","56","9002 → 43520 [ACK] Seq=3172 Ack=3715 Win=65535 Len=0"
"3.378005","5.9.29.183","172.19.0.3","TCP","1516","[TCP segment of a reassembled PDU]"
"3.378108","5.9.29.183","172.19.0.3","TCP","1492","9002 → 43520 [PSH, ACK] Seq=4632 Ack=3715 Win=65535 Len=1436 [TCP segment of a reassembled PDU]"
"3.378121","5.9.29.183","172.19.0.3","TLSv1.2","787","Application Data"
"3.378241","172.19.0.3","5.9.29.183","TCP","56","43520 → 9002 [ACK] Seq=3715 Ack=6799 Win=11895 Len=0"
"3.412714","5.9.29.183","172.19.0.3","TCP","1516","[TCP segment of a reassembled PDU]"
"3.412784","5.9.29.183","172.19.0.3","TCP","1516","9002 → 43520 [PSH, ACK] Seq=8259 Ack=3715 Win=65535 Len=1460 [TCP segment of a reassembled PDU]"
"3.412801","172.19.0.3","5.9.29.183","TCP","56","43520 → 9002 [ACK] Seq=3715 Ack=9719 Win=11903 Len=0"
"3.412804","5.9.29.183","172.19.0.3","TLSv1.2","763","Application Data"
"3.427849","5.9.29.183","172.19.0.3","TLSv1.2","599","Application Data"
"3.428048","172.19.0.3","5.9.29.183","TCP","56","43520 → 9002 [ACK] Seq=3715 Ack=10969 Win=11911 Len=0"
"3.447132","5.9.29.183","172.19.0.3","TCP","1516","[TCP segment of a reassembled PDU]"
"3.447211","5.9.29.183","172.19.0.3","TCP","1516","9002 → 43520 [PSH, ACK] Seq=12429 Ack=3715 Win=65535 Len=1460 [TCP segment of a reassembled PDU]"
"3.447221","5.9.29.183","172.19.0.3","TLSv1.2","1213","Application Data"
"3.447399","172.19.0.3","5.9.29.183","TCP","56","43520 → 9002 [ACK] Seq=3715 Ack=15046 Win=11895 Len=0"
"3.447831","172.19.0.3","5.9.29.183","TLSv1.2","599","Application Data"
"3.448127","5.9.29.183","172.19.0.3","TCP","56","9002 → 43520 [ACK] Seq=15046 Ack=4258 Win=65535 Len=0"
"3.462930","5.9.29.183","172.19.0.3","TLSv1.2","663","Application Data"
"3.471206","5.9.29.183","172.19.0.3","TCP","1516","[TCP segment of a reassembled PDU]"
"3.471228","172.19.0.3","5.9.29.183","TCP","56","43520 → 9002 [ACK] Seq=4258 Ack=17113 Win=11911 Len=0"
"3.471280","5.9.29.183","172.19.0.3","TCP","1516","9002 → 43520 [PSH, ACK] Seq=17113 Ack=4258 Win=65535 Len=1460 [TCP segment of a reassembled PDU]"
"3.471321","5.9.29.183","172.19.0.3","TLSv1.2","1516","Application Data [TCP segment of a reassembled PDU]"
"3.471328","5.9.29.183","172.19.0.3","TCP","1516","9002 → 43520 [PSH, ACK] Seq=20033 Ack=4258 Win=65535 Len=1460 [TCP segment of a reassembled PDU]"
"3.471335","5.9.29.183","172.19.0.3","TCP","1456","9002 → 43520 [PSH, ACK] Seq=21493 Ack=4258 Win=65535 Len=1400 [TCP segment of a reassembled PDU]"
"3.471471","172.19.0.3","5.9.29.183","TCP","56","43520 → 9002 [ACK] Seq=4258 Ack=22893 Win=11879 Len=0"
"3.473571","5.9.29.183","172.19.0.3","TLSv1.2","1516","Application Data [TCP segment of a reassembled PDU]"
"3.473638","5.9.29.183","172.19.0.3","TCP","1492","9002 → 43520 [PSH, ACK] Seq=24353 Ack=4258 Win=65535 Len=1436 [TCP segment of a reassembled PDU]"
"3.473657","172.19.0.3","5.9.29.183","TCP","56","43520 → 9002 [ACK] Seq=4258 Ack=25789 Win=11903 Len=0"
"3.477852","5.9.29.183","172.19.0.3","TLSv1.2","801","Application Data"
"3.478593","172.19.0.3","5.9.29.183","TLSv1.2","599","Application Data"
"3.479012","5.9.29.183","172.19.0.3","TCP","56","9002 → 43520 [ACK] Seq=26534 Ack=4801 Win=65535 Len=0"
"3.488214","172.19.0.3","5.9.29.183","TLSv1.2","599","Application Data"
"3.488442","5.9.29.183","172.19.0.3","TCP","56","9002 → 43520 [ACK] Seq=26534 Ack=5344 Win=65535 Len=0"
"3.495577","5.9.29.183","172.19.0.3","TLSv1.2","599","Application Data"
"3.535704","172.19.0.3","5.9.29.183","TCP","56","43520 → 9002 [ACK] Seq=5344 Ack=27077 Win=11911 Len=0"
"3.710207","5.9.29.183","172.19.0.3","TLSv1.2","599","Application Data"
"3.710305","172.19.0.3","5.9.29.183","TCP","56","43520 → 9002 [ACK] Seq=5344 Ack=27620 Win=11911 Len=0"
"3.711059","172.19.0.3","5.9.29.183","TLSv1.2","599","Application Data"
"3.711373","5.9.29.183","172.19.0.3","TCP","56","9002 → 43520 [ACK] Seq=27620 Ack=5887 Win=65535 Len=0"
"4.049288","5.9.29.183","172.19.0.3","TCP","1516","[TCP segment of a reassembled PDU]"
"4.049372","5.9.29.183","172.19.0.3","TCP","1516","9002 → 43520 [PSH, ACK] Seq=29080 Ack=5887 Win=65535 Len=1460 [TCP segment of a reassembled PDU]"
"4.049382","5.9.29.183","172.19.0.3","TLSv1.2","1516","Application Data [TCP segment of a reassembled PDU]"
"4.049387","5.9.29.183","172.19.0.3","TCP","1516","9002 → 43520 [PSH, ACK] Seq=32000 Ack=5887 Win=65535 Len=1460 [TCP segment of a reassembled PDU]"
"4.049392","5.9.29.183","172.19.0.3","TLSv1.2","1516","Application Data [TCP segment of a reassembled PDU]"
"4.049398","5.9.29.183","172.19.0.3","TCP","1516","9002 → 43520 [PSH, ACK] Seq=34920 Ack=5887 Win=65535 Len=1460 [TCP segment of a reassembled PDU]"
"4.049402","5.9.29.183","172.19.0.3","TCP","1516","9002 → 43520 [PSH, ACK] Seq=36380 Ack=5887 Win=65535 Len=1460 [TCP segment of a reassembled PDU]"
"4.049405","5.9.29.183","172.19.0.3","TLSv1.2","1516","Application Data [TCP segment of a reassembled PDU]"
"4.049431","5.9.29.183","172.19.0.3","TLSv1.2","691","Application Data [TCP segment of a reassembled PDU]"
"4.049434","5.9.29.183","172.19.0.3","TCP","1118","9002 → 43520 [PSH, ACK] Seq=39935 Ack=5887 Win=65535 Len=1062 [TCP segment of a reassembled PDU]"
"4.049437","5.9.29.183","172.19.0.3","TCP","442","9002 → 43520 [PSH, ACK] Seq=40997 Ack=5887 Win=65535 Len=386 [TCP segment of a reassembled PDU]"
"4.049498","172.19.0.3","5.9.29.183","TCP","56","43520 → 9002 [ACK] Seq=5887 Ack=41383 Win=11828 Len=0"
"4.053576","5.9.29.183","172.19.0.3","TCP","1504","9002 → 43520 [PSH, ACK] Seq=41383 Ack=5887 Win=65535 Len=1448 [TCP segment of a reassembled PDU]"
"4.064479","5.9.29.183","172.19.0.3","TLSv1.2","1504","Application Data [TCP segment of a reassembled PDU]"
"4.064499","172.19.0.3","5.9.29.183","TCP","56","43520 → 9002 [ACK] Seq=5887 Ack=44279 Win=11911 Len=0"
"4.064542","5.9.29.183","172.19.0.3","TCP","1504","9002 → 43520 [PSH, ACK] Seq=44279 Ack=5887 Win=65535 Len=1448 [TCP segment of a reassembled PDU]"
"4.064552","5.9.29.183","172.19.0.3","TLSv1.2","1516","Application Data [TCP segment of a reassembled PDU]"
"4.064555","5.9.29.183","172.19.0.3","TLSv1.2","738","Application Data"
"4.064729","172.19.0.3","5.9.29.183","TCP","56","43520 → 9002 [ACK] Seq=5887 Ack=47869 Win=11887 Len=0"
"4.068067","172.19.0.3","5.9.29.183","TLSv1.2","599","Application Data"
"4.068260","5.9.29.183","172.19.0.3","TCP","56","9002 → 43520 [ACK] Seq=47869 Ack=6430 Win=65535 Len=0"
"4.512697","5.9.29.183","172.19.0.3","TLSv1.2","599","Application Data"
"4.513188","172.19.0.3","5.9.29.183","TLSv1.2","599","Application Data"
"4.513486","5.9.29.183","172.19.0.3","TCP","56","9002 → 43520 [ACK] Seq=48412 Ack=6973 Win=65535 Len=0"
"4.960664","5.9.29.183","172.19.0.3","TLSv1.2","599","Application Data"
"4.960782","5.9.29.183","172.19.0.3","TCP","1516","[TCP segment of a reassembled PDU]"
"4.960792","5.9.29.183","172.19.0.3","TCP","1516","9002 → 43520 [PSH, ACK] Seq=50415 Ack=6973 Win=65535 Len=1460 [TCP segment of a reassembled PDU]"
"4.960851","5.9.29.183","172.19.0.3","TLSv1.2","1516","Application Data [TCP segment of a reassembled PDU]"
"4.960856","5.9.29.183","172.19.0.3","TCP","1516","9002 → 43520 [PSH, ACK] Seq=53335 Ack=6973 Win=65535 Len=1460 [TCP segment of a reassembled PDU]"
"4.960859","5.9.29.183","172.19.0.3","TCP","1516","9002 → 43520 [PSH, ACK] Seq=54795 Ack=6973 Win=65535 Len=1460 [TCP segment of a reassembled PDU]"
"4.960862","5.9.29.183","172.19.0.3","TLSv1.2","1444","Application Data [TCP segment of a reassembled PDU]"
"4.960864","5.9.29.183","172.19.0.3","TLSv1.2","1516","Application Data [TCP segment of a reassembled PDU]"
"4.960866","5.9.29.183","172.19.0.3","TCP","1516","9002 → 43520 [PSH, ACK] Seq=59103 Ack=6973 Win=65535 Len=1460 [TCP segment of a reassembled PDU]"
"4.960891","172.19.0.3","5.9.29.183","TCP","56","43520 → 9002 [ACK] Seq=6973 Ack=60563 Win=11847 Len=0"
"4.960949","5.9.29.183","172.19.0.3","TCP","1480","9002 → 43520 [PSH, ACK] Seq=60563 Ack=6973 Win=65535 Len=1424 [TCP segment of a reassembled PDU]"
"4.979330","5.9.29.183","172.19.0.3","TLSv1.2","1516","Application Data [TCP segment of a reassembled PDU]"
"4.979349","172.19.0.3","5.9.29.183","TCP","56","43520 → 9002 [ACK] Seq=6973 Ack=63447 Win=11911 Len=0"
"4.979394","5.9.29.183","172.19.0.3","TCP","1516","9002 → 43520 [PSH, ACK] Seq=63447 Ack=6973 Win=65535 Len=1460 [TCP segment of a reassembled PDU]"
"4.979406","5.9.29.183","172.19.0.3","TCP","1516","9002 → 43520 [PSH, ACK] Seq=64907 Ack=6973 Win=65535 Len=1460 [TCP segment of a reassembled PDU]"
"4.979412","5.9.29.183","172.19.0.3","TLSv1.2","1516","Application Data [TCP segment of a reassembled PDU]"
"4.979417","5.9.29.183","172.19.0.3","TCP","1516","9002 → 43520 [PSH, ACK] Seq=67827 Ack=6973 Win=65535 Len=1460 [TCP segment of a reassembled PDU]"
"4.979421","5.9.29.183","172.19.0.3","TLSv1.2","1444","Application Data [TCP segment of a reassembled PDU]"
"4.979515","5.9.29.183","172.19.0.3","TCP","1516","9002 → 43520 [PSH, ACK] Seq=70675 Ack=6973 Win=65535 Len=1460 [TCP segment of a reassembled PDU]"
"4.979521","5.9.29.183","172.19.0.3","TLSv1.2","1516","Application Data [TCP segment of a reassembled PDU]"
"4.979523","5.9.29.183","172.19.0.3","TCP","1516","9002 → 43520 [PSH, ACK] Seq=73595 Ack=6973 Win=65535 Len=1460 [TCP segment of a reassembled PDU]"
"4.979526","5.9.29.183","172.19.0.3","TLSv1.2","402","Application Data"
"4.979545","172.19.0.3","5.9.29.183","TCP","56","43520 → 9002 [ACK] Seq=6973 Ack=75401 Win=11836 Len=0"
"4.980029","172.19.0.3","5.9.29.183","TLSv1.2","599","Application Data"
"4.980220","5.9.29.183","172.19.0.3","TCP","56","9002 → 43520 [ACK] Seq=75401 Ack=7516 Win=65535 Len=0"
"4.987062","5.9.29.183","172.19.0.3","TLSv1.2","1504","Application Data"
"4.988768","172.19.0.3","5.9.29.183","TLSv1.2","599","Application Data"
"4.989026","5.9.29.183","172.19.0.3","TCP","56","9002 → 43520 [ACK] Seq=76849 Ack=8059 Win=65535 Len=0"
"4.995690","5.9.29.183","172.19.0.3","TCP","1504","9002 → 43520 [PSH, ACK] Seq=76849 Ack=8059 Win=65535 Len=1448 [TCP segment of a reassembled PDU]"
"4.995739","5.9.29.183","172.19.0.3","TCP","1516","9002 → 43520 [PSH, ACK] Seq=78297 Ack=8059 Win=65535 Len=1460 [TCP segment of a reassembled PDU]"
"4.995746","5.9.29.183","172.19.0.3","TLSv1.2","1492","Application Data [TCP segment of a reassembled PDU]"
"4.995748","5.9.29.183","172.19.0.3","TCP","1504","9002 → 43520 [PSH, ACK] Seq=81193 Ack=8059 Win=65535 Len=1448 [TCP segment of a reassembled PDU]"
"4.995879","172.19.0.3","5.9.29.183","TCP","56","43520 → 9002 [ACK] Seq=8059 Ack=82641 Win=11887 Len=0"
"4.996030","5.9.29.183","172.19.0.3","TLSv1.2","1516","Application Data [TCP segment of a reassembled PDU]"
"4.996037","5.9.29.183","172.19.0.3","TCP","1516","[TCP segment of a reassembled PDU]"
"4.996040","5.9.29.183","172.19.0.3","TCP","1516","9002 → 43520 [PSH, ACK] Seq=85561 Ack=8059 Win=65535 Len=1460 [TCP segment of a reassembled PDU]"
"4.996048","5.9.29.183","172.19.0.3","TLSv1.2","1468","Application Data [TCP segment of a reassembled PDU]"
"4.996065","172.19.0.3","5.9.29.183","TCP","56","43520 → 9002 [ACK] Seq=8059 Ack=88433 Win=11855 Len=0"
"4.996253","5.9.29.183","172.19.0.3","TCP","1504","9002 → 43520 [PSH, ACK] Seq=88433 Ack=8059 Win=65535 Len=1448 [TCP segment of a reassembled PDU]"
"4.996408","5.9.29.183","172.19.0.3","TCP","1504","9002 → 43520 [PSH, ACK] Seq=89881 Ack=8059 Win=65535 Len=1448 [TCP segment of a reassembled PDU]"
"4.996436","172.19.0.3","5.9.29.183","TCP","56","43520 → 9002 [ACK] Seq=8059 Ack=91329 Win=11911 Len=0"
"4.996503","5.9.29.183","172.19.0.3","TLSv1.2","1504","Application Data, Application Data"
"5.004817","5.9.29.183","172.19.0.3","TLSv1.2","1504","Application Data [TCP segment of a reassembled PDU]"
"5.004832","172.19.0.3","5.9.29.183","TCP","56","43520 → 9002 [ACK] Seq=8059 Ack=94225 Win=11911 Len=0"
"5.127488","5.9.29.183","172.19.0.3","TCP","1516","9002 → 43520 [PSH, ACK] Seq=94225 Ack=8059 Win=65535 Len=1460 [TCP segment of a reassembled PDU]"
"5.127542","5.9.29.183","172.19.0.3","TCP","1516","9002 → 43520 [PSH, ACK] Seq=95685 Ack=8059 Win=65535 Len=1460 [TCP segment of a reassembled PDU]"
"5.127552","5.9.29.183","172.19.0.3","TLSv1.2","1516","Application Data [TCP segment of a reassembled PDU]"
"5.127752","172.19.0.3","5.9.29.183","TCP","56","43520 → 9002 [ACK] Seq=8059 Ack=98605 Win=11893 Len=0"
"5.127760","5.9.29.183","172.19.0.3","TCP","1516","9002 → 43520 [PSH, ACK] Seq=98605 Ack=8059 Win=65535 Len=1460 [TCP segment of a reassembled PDU]"
"5.127764","5.9.29.183","172.19.0.3","TLSv1.2","1516","Application Data [TCP segment of a reassembled PDU]"
"5.127766","5.9.29.183","172.19.0.3","TCP","827","9002 → 43520 [PSH, ACK] Seq=101525 Ack=8059 Win=65535 Len=771 [TCP segment of a reassembled PDU]"
"5.127839","5.9.29.183","172.19.0.3","TCP","1516","9002 → 43520 [PSH, ACK] Seq=102296 Ack=8059 Win=65535 Len=1460 [TCP segment of a reassembled PDU]"
"5.127846","5.9.29.183","172.19.0.3","TLSv1.2","1492","Application Data [TCP segment of a reassembled PDU]"
"5.127960","172.19.0.3","5.9.29.183","TCP","56","43520 → 9002 [ACK] Seq=8059 Ack=105192 Win=11853 Len=0"
"5.128203","172.19.0.3","5.9.29.183","TLSv1.2","599","Application Data"
"5.128392","5.9.29.183","172.19.0.3","TCP","56","9002 → 43520 [ACK] Seq=105192 Ack=8602 Win=65535 Len=0"
"5.143485","5.9.29.183","172.19.0.3","TLSv1.2","396","Application Data"
"5.147487","172.19.0.3","5.9.29.183","TLSv1.2","599","Application Data"
"5.147756","5.9.29.183","172.19.0.3","TCP","56","9002 → 43520 [ACK] Seq=105532 Ack=9145 Win=65535 Len=0"
"5.516423","5.9.29.183","172.19.0.3","TLSv1.2","599","Application Data"
"5.517266","172.19.0.3","5.9.29.183","TLSv1.2","599","Application Data"
"5.517539","5.9.29.183","172.19.0.3","TCP","56","9002 → 43520 [ACK] Seq=106075 Ack=9688 Win=65535 Len=0"
"5.853551","5.9.29.183","172.19.0.3","TCP","514","[TCP segment of a reassembled PDU]"
"5.854038","5.9.29.183","172.19.0.3","TCP","1516","9002 → 43520 [PSH, ACK] Seq=106533 Ack=9688 Win=65535 Len=1460 [TCP segment of a reassembled PDU]"
"5.854101","172.19.0.3","5.9.29.183","TCP","56","43520 → 9002 [ACK] Seq=9688 Ack=107993 Win=11911 Len=0"
"5.854148","5.9.29.183","172.19.0.3","TCP","1516","9002 → 43520 [PSH, ACK] Seq=107993 Ack=9688 Win=65535 Len=1460 [TCP segment of a reassembled PDU]"
"5.854185","5.9.29.183","172.19.0.3","TLSv1.2","1516","Application Data [TCP segment of a reassembled PDU]"
"5.854348","172.19.0.3","5.9.29.183","TCP","56","43520 → 9002 [ACK] Seq=9688 Ack=110913 Win=11895 Len=0"
"5.854625","5.9.29.183","172.19.0.3","TCP","1516","9002 → 43520 [PSH, ACK] Seq=110913 Ack=9688 Win=65535 Len=1460 [TCP segment of a reassembled PDU]"
"5.854654","5.9.29.183","172.19.0.3","TLSv1.2","1516","Application Data [TCP segment of a reassembled PDU]"
"5.854756","5.9.29.183","172.19.0.3","TCP","1516","9002 → 43520 [PSH, ACK] Seq=113833 Ack=9688 Win=65535 Len=1460 [TCP segment of a reassembled PDU]"
"5.854780","5.9.29.183","172.19.0.3","TCP","1516","9002 → 43520 [PSH, ACK] Seq=115293 Ack=9688 Win=65535 Len=1460 [TCP segment of a reassembled PDU]"
"5.854792","5.9.29.183","172.19.0.3","TLSv1.2","1516","Application Data [TCP segment of a reassembled PDU]"
"5.854803","5.9.29.183","172.19.0.3","TCP","1516","9002 → 43520 [PSH, ACK] Seq=118213 Ack=9688 Win=65535 Len=1460 [TCP segment of a reassembled PDU]"
"5.854850","5.9.29.183","172.19.0.3","TCP","221","9002 → 43520 [PSH, ACK] Seq=119673 Ack=9688 Win=65535 Len=165 [TCP segment of a reassembled PDU]"
"5.855194","172.19.0.3","5.9.29.183","TCP","56","43520 → 9002 [ACK] Seq=9688 Ack=119838 Win=11838 Len=0"
"5.869297","5.9.29.183","172.19.0.3","TCP","1504","9002 → 43520 [PSH, ACK] Seq=119838 Ack=9688 Win=65535 Len=1448 [TCP segment of a reassembled PDU]"
"5.869391","5.9.29.183","172.19.0.3","TLSv1.2","1504","Application Data [TCP segment of a reassembled PDU]"
"5.869424","172.19.0.3","5.9.29.183","TCP","56","43520 → 9002 [ACK] Seq=9688 Ack=122734 Win=11901 Len=0"
"5.869573","5.9.29.183","172.19.0.3","TCP","1516","9002 → 43520 [PSH, ACK] Seq=122734 Ack=9688 Win=65535 Len=1460 [TCP segment of a reassembled PDU]"
"5.869581","5.9.29.183","172.19.0.3","TLSv1.2","1516","Application Data [TCP segment of a reassembled PDU]"
"5.869669","5.9.29.183","172.19.0.3","TCP","1516","9002 → 43520 [PSH, ACK] Seq=125654 Ack=9688 Win=65535 Len=1460 [TCP segment of a reassembled PDU]"
"5.869683","5.9.29.183","172.19.0.3","TCP","1516","9002 → 43520 [PSH, ACK] Seq=127114 Ack=9688 Win=65535 Len=1460 [TCP segment of a reassembled PDU]"
"5.869687","5.9.29.183","172.19.0.3","TLSv1.2","1516","Application Data, Application Data"
"5.869808","5.9.29.183","172.19.0.3","TCP","1516","9002 → 43520 [PSH, ACK] Seq=130034 Ack=9688 Win=65535 Len=1460 [TCP segment of a reassembled PDU]"
"5.869828","5.9.29.183","172.19.0.3","TCP","1432","9002 → 43520 [PSH, ACK] Seq=131494 Ack=9688 Win=65535 Len=1376 [TCP segment of a reassembled PDU]"
"5.869938","5.9.29.183","172.19.0.3","TLSv1.2","1278","Application Data, Application Data"
"5.870377","172.19.0.3","5.9.29.183","TLSv1.2","599","Application Data"
"5.871419","5.9.29.183","172.19.0.3","TCP","56","9002 → 43520 [ACK] Seq=134092 Ack=10231 Win=65535 Len=0"
"5.875354","5.9.29.183","172.19.0.3","TCP","1504","[TCP segment of a reassembled PDU]"
"5.875393","5.9.29.183","172.19.0.3","TCP","1516","9002 → 43520 [PSH, ACK] Seq=135540 Ack=10231 Win=65535 Len=1460 [TCP segment of a reassembled PDU]"
"5.875408","172.19.0.3","5.9.29.183","TCP","56","43520 → 9002 [ACK] Seq=10231 Ack=137000 Win=11903 Len=0"
"5.875411","5.9.29.183","172.19.0.3","TLSv1.2","1516","Application Data [TCP segment of a reassembled PDU]"
"5.875414","5.9.29.183","172.19.0.3","TCP","1480","9002 → 43520 [PSH, ACK] Seq=138460 Ack=10231 Win=65535 Len=1424 [TCP segment of a reassembled PDU]"
"5.875525","172.19.0.3","5.9.29.183","TCP","56","43520 → 9002 [ACK] Seq=10231 Ack=139884 Win=11887 Len=0"
"5.880812","172.19.0.3","5.9.29.183","TLSv1.2","599","Application Data"
"5.881175","5.9.29.183","172.19.0.3","TCP","56","9002 → 43520 [ACK] Seq=139884 Ack=10774 Win=65535 Len=0"
"5.885493","5.9.29.183","172.19.0.3","TCP","1504","9002 → 43520 [PSH, ACK] Seq=139884 Ack=10774 Win=65535 Len=1448 [TCP segment of a reassembled PDU]"
"5.885690","5.9.29.183","172.19.0.3","TLSv1.2","1516","Application Data [TCP segment of a reassembled PDU]"
"5.885723","5.9.29.183","172.19.0.3","TCP","1516","9002 → 43520 [PSH, ACK] Seq=142792 Ack=10774 Win=65535 Len=1460 [TCP segment of a reassembled PDU]"
"5.885739","5.9.29.183","172.19.0.3","TCP","1480","9002 → 43520 [PSH, ACK] Seq=144252 Ack=10774 Win=65535 Len=1424 [TCP segment of a reassembled PDU]"
"5.885860","5.9.29.183","172.19.0.3","TLSv1.2","1516","Application Data [TCP segment of a reassembled PDU]"
"5.885870","5.9.29.183","172.19.0.3","TCP","1516","9002 → 43520 [PSH, ACK] Seq=147136 Ack=10774 Win=65535 Len=1460 [TCP segment of a reassembled PDU]"
"5.885874","5.9.29.183","172.19.0.3","TCP","1516","9002 → 43520 [PSH, ACK] Seq=148596 Ack=10774 Win=65535 Len=1460 [TCP segment of a reassembled PDU]"
"5.885880","5.9.29.183","172.19.0.3","TLSv1.2","1516","Application Data, Application Data"
"5.885886","5.9.29.183","172.19.0.3","TCP","1516","9002 → 43520 [PSH, ACK] Seq=151516 Ack=10774 Win=65535 Len=1460 [TCP segment of a reassembled PDU]"
"5.886012","5.9.29.183","172.19.0.3","TCP","1444","9002 → 43520 [PSH, ACK] Seq=152976 Ack=10774 Win=65535 Len=1388 [TCP segment of a reassembled PDU]"
"5.886022","172.19.0.3","5.9.29.183","TCP","56","43520 → 9002 [ACK] Seq=10774 Ack=152976 Win=11845 Len=0"
"5.890690","5.9.29.183","172.19.0.3","TLSv1.2","1516","Application Data [TCP segment of a reassembled PDU]"
"5.890711","172.19.0.3","5.9.29.183","TCP","56","43520 → 9002 [ACK] Seq=10774 Ack=155824 Win=11911 Len=0"
"5.890750","5.9.29.183","172.19.0.3","TCP","1492","9002 → 43520 [PSH, ACK] Seq=155824 Ack=10774 Win=65535 Len=1436 [TCP segment of a reassembled PDU]"
"5.890760","5.9.29.183","172.19.0.3","TLSv1.2","1516","Application Data [TCP segment of a reassembled PDU]"
"5.890764","5.9.29.183","172.19.0.3","TLSv1.2","1492","Application Data [TCP segment of a reassembled PDU]"
"5.890929","172.19.0.3","5.9.29.183","TCP","56","43520 → 9002 [ACK] Seq=10774 Ack=160156 Win=11887 Len=0"
"5.891563","172.19.0.3","5.9.29.183","TLSv1.2","599","Application Data"
"5.891933","5.9.29.183","172.19.0.3","TCP","56","9002 → 43520 [ACK] Seq=160156 Ack=11317 Win=65535 Len=0"
"6.022275","5.9.29.183","172.19.0.3","TCP","1516","9002 → 43520 [PSH, ACK] Seq=160156 Ack=11317 Win=65535 Len=1460 [TCP segment of a reassembled PDU]"
"6.022366","5.9.29.183","172.19.0.3","TCP","1492","9002 → 43520 [PSH, ACK] Seq=161616 Ack=11317 Win=65535 Len=1436 [TCP segment of a reassembled PDU]"
"6.022386","172.19.0.3","5.9.29.183","TCP","56","43520 → 9002 [ACK] Seq=11317 Ack=163052 Win=11903 Len=0"
"6.022388","5.9.29.183","172.19.0.3","TLSv1.2","1516","Application Data, Application Data"
"6.022392","5.9.29.183","172.19.0.3","TCP","1516","9002 → 43520 [PSH, ACK] Seq=164512 Ack=11317 Win=65535 Len=1460 [TCP segment of a reassembled PDU]"
"6.022395","5.9.29.183","172.19.0.3","TCP","1516","9002 → 43520 [PSH, ACK] Seq=165972 Ack=11317 Win=65535 Len=1460 [TCP segment of a reassembled PDU]"
"6.022468","5.9.29.183","172.19.0.3","TLSv1.2","1516","Application Data, Application Data"
"6.022470","172.19.0.3","5.9.29.183","TCP","56","43520 → 9002 [ACK] Seq=11317 Ack=167432 Win=11879 Len=0"
"6.022472","5.9.29.183","172.19.0.3","TCP","1516","9002 → 43520 [PSH, ACK] Seq=168892 Ack=11317 Win=65535 Len=1460 [TCP segment of a reassembled PDU]"
"6.022473","5.9.29.183","172.19.0.3","TCP","1516","9002 → 43520 [PSH, ACK] Seq=170352 Ack=11317 Win=65535 Len=1460 [TCP segment of a reassembled PDU]"
"6.022475","5.9.29.183","172.19.0.3","TCP","313","9002 → 43520 [PSH, ACK] Seq=171812 Ack=11317 Win=65535 Len=257 [TCP segment of a reassembled PDU]"
"6.022613","5.9.29.183","172.19.0.3","TLSv1.2","1516","Application Data, Application Data"
"6.022621","5.9.29.183","172.19.0.3","TLSv1.2","1516","Application Data [TCP segment of a reassembled PDU]"
"6.022624","5.9.29.183","172.19.0.3","TCP","1516","9002 → 43520 [PSH, ACK] Seq=174989 Ack=11317 Win=65535 Len=1460 [TCP segment of a reassembled PDU]"
"6.022664","5.9.29.183","172.19.0.3","TLSv1.2","1516","Application Data [TCP segment of a reassembled PDU]"
"6.022690","5.9.29.183","172.19.0.3","TLSv1.2","1516","Application Data [TCP segment of a reassembled PDU]"
"6.022735","5.9.29.183","172.19.0.3","TLSv1.2","1516","Application Data [TCP segment of a reassembled PDU]"
"6.022810","172.19.0.3","5.9.29.183","TCP","56","43520 → 9002 [ACK] Seq=11317 Ack=180829 Win=11796 Len=0"
"6.022817","5.9.29.183","172.19.0.3","TCP","58","9002 → 43520 [PSH, ACK] Seq=180829 Ack=11317 Win=65535 Len=2 [TCP segment of a reassembled PDU]"
"6.023321","172.19.0.3","5.9.29.183","TLSv1.2","599","Application Data"
"6.023502","5.9.29.183","172.19.0.3","TCP","56","9002 → 43520 [ACK] Seq=180831 Ack=11860 Win=65535 Len=0"
"6.038170","5.9.29.183","172.19.0.3","TLSv1.2","1156","Application Data"
"6.043483","172.19.0.3","5.9.29.183","TLSv1.2","599","Application Data"
"6.043737","5.9.29.183","172.19.0.3","TCP","56","9002 → 43520 [ACK] Seq=181931 Ack=12403 Win=65535 Len=0"
"6.482358","5.9.29.183","172.19.0.3","TLSv1.2","599","Application Data"
"6.482980","172.19.0.3","5.9.29.183","TLSv1.2","599","Application Data"
"6.483329","5.9.29.183","172.19.0.3","TCP","56","9002 → 43520 [ACK] Seq=182474 Ack=12946 Win=65535 Len=0"
"6.796902","5.9.29.183","172.19.0.3","TCP","1504","[TCP segment of a reassembled PDU]"
"6.796971","5.9.29.183","172.19.0.3","TCP","1516","9002 → 43520 [PSH, ACK] Seq=183922 Ack=12946 Win=65535 Len=1460 [TCP segment of a reassembled PDU]"
"6.796980","5.9.29.183","172.19.0.3","TLSv1.2","1225","Application Data"
"6.797082","172.19.0.3","5.9.29.183","TCP","56","43520 → 9002 [ACK] Seq=12946 Ack=186551 Win=11893 Len=0"
"6.806389","5.9.29.183","172.19.0.3","TLSv1.2","1516","Application Data"
"6.806443","5.9.29.183","172.19.0.3","TCP","1492","9002 → 43520 [PSH, ACK] Seq=188011 Ack=12946 Win=65535 Len=1436 [TCP segment of a reassembled PDU]"
"6.806456","172.19.0.3","5.9.29.183","TCP","56","43520 → 9002 [ACK] Seq=12946 Ack=189447 Win=11903 Len=0"
"6.813398","5.9.29.183","172.19.0.3","TLSv1.2","880","Application Data"
"6.853738","172.19.0.3","5.9.29.183","TCP","56","43520 → 9002 [ACK] Seq=12946 Ack=190271 Win=11911 Len=0"
"6.856378","5.9.29.183","172.19.0.3","TLSv1.2","1113","Application Data"
"6.856402","172.19.0.3","5.9.29.183","TCP","56","43520 → 9002 [ACK] Seq=12946 Ack=191328 Win=11911 Len=0"
"6.860867","172.19.0.3","5.9.29.183","TLSv1.2","599","Application Data"
"6.861270","5.9.29.183","172.19.0.3","TCP","56","9002 → 43520 [ACK] Seq=191328 Ack=13489 Win=65535 Len=0"
"7.076282","5.9.29.183","172.19.0.3","TLSv1.2","599","Application Data"
"7.077018","172.19.0.3","5.9.29.183","TLSv1.2","599","Application Data"
"7.077317","5.9.29.183","172.19.0.3","TCP","56","9002 → 43520 [ACK] Seq=191871 Ack=14032 Win=65535 Len=0"
"7.351625","5.9.29.183","172.19.0.3","TCP","1504","[TCP segment of a reassembled PDU]"
"7.351743","5.9.29.183","172.19.0.3","TCP","1516","9002 → 43520 [PSH, ACK] Seq=193319 Ack=14032 Win=65535 Len=1460 [TCP segment of a reassembled PDU]"
"7.351753","5.9.29.183","172.19.0.3","TLSv1.2","775","Application Data"
"7.351860","172.19.0.3","5.9.29.183","TCP","56","43520 → 9002 [ACK] Seq=14032 Ack=195498 Win=11895 Len=0"
"7.366956","5.9.29.183","172.19.0.3","TCP","1516","[TCP segment of a reassembled PDU]"
"7.367005","5.9.29.183","172.19.0.3","TCP","1492","9002 → 43520 [PSH, ACK] Seq=196958 Ack=14032 Win=65535 Len=1436 [TCP segment of a reassembled PDU]"
"7.367017","172.19.0.3","5.9.29.183","TCP","56","43520 → 9002 [ACK] Seq=14032 Ack=198394 Win=11903 Len=0"
"7.367638","5.9.29.183","172.19.0.3","TLSv1.2","787","Application Data"
"7.379107","5.9.29.183","172.19.0.3","TCP","1516","[TCP segment of a reassembled PDU]"
"7.379133","172.19.0.3","5.9.29.183","TCP","56","43520 → 9002 [ACK] Seq=14032 Ack=200585 Win=11909 Len=0"
"7.379171","5.9.29.183","172.19.0.3","TCP","1516","9002 → 43520 [PSH, ACK] Seq=200585 Ack=14032 Win=65535 Len=1460 [TCP segment of a reassembled PDU]"
"7.379181","5.9.29.183","172.19.0.3","TLSv1.2","1480","Application Data [TCP segment of a reassembled PDU]"
"7.379319","172.19.0.3","5.9.29.183","TCP","56","43520 → 9002 [ACK] Seq=14032 Ack=203469 Win=11893 Len=0"
"7.383210","5.9.29.183","172.19.0.3","TLSv1.2","396","Application Data"
"7.394602","5.9.29.183","172.19.0.3","TCP","1504","[TCP segment of a reassembled PDU]"
"7.394622","172.19.0.3","5.9.29.183","TCP","56","43520 → 9002 [ACK] Seq=14032 Ack=205257 Win=11911 Len=0"
"7.398667","5.9.29.183","172.19.0.3","TLSv1.2","1207","Application Data"
"7.401700","172.19.0.3","5.9.29.183","TLSv1.2","599","Application Data"
"7.401933","5.9.29.183","172.19.0.3","TCP","56","9002 → 43520 [ACK] Seq=206408 Ack=14575 Win=65535 Len=0"
"9.893519","5.9.29.183","172.19.0.3","TLSv1.2","599","Application Data"
"9.894286","172.19.0.3","5.9.29.183","TLSv1.2","599","Application Data"
"9.894654","5.9.29.183","172.19.0.3","TCP","56","9002 → 43520 [ACK] Seq=206951 Ack=15118 Win=65535 Len=0"
"10.628001","5.9.29.183","172.19.0.3","TCP","1516","[TCP segment of a reassembled PDU]"
"10.628112","5.9.29.183","172.19.0.3","TCP","1516","9002 → 43520 [PSH, ACK] Seq=208411 Ack=15118 Win=65535 Len=1460 [TCP segment of a reassembled PDU]"
"10.628127","5.9.29.183","172.19.0.3","TLSv1.2","763","Application Data"
"10.628256","172.19.0.3","5.9.29.183","TCP","56","43520 → 9002 [ACK] Seq=15118 Ack=210578 Win=11895 Len=0"
"10.810881","5.9.29.183","172.19.0.3","TCP","1516","[TCP segment of a reassembled PDU]"
"10.810933","5.9.29.183","172.19.0.3","TCP","1516","9002 → 43520 [PSH, ACK] Seq=212038 Ack=15118 Win=65535 Len=1460 [TCP segment of a reassembled PDU]"
"10.810962","172.19.0.3","5.9.29.183","TCP","56","43520 → 9002 [ACK] Seq=15118 Ack=213498 Win=11903 Len=0"
"10.810965","5.9.29.183","172.19.0.3","TLSv1.2","763","Application Data"
"10.840289","5.9.29.183","172.19.0.3","TCP","1516","[TCP segment of a reassembled PDU]"
"10.840340","172.19.0.3","5.9.29.183","TCP","56","43520 → 9002 [ACK] Seq=15118 Ack=215665 Win=11909 Len=0"
"10.840410","5.9.29.183","172.19.0.3","TLSv1.2","167","Application Data"
"10.845227","172.19.0.3","5.9.29.183","TLSv1.2","599","Application Data"
"10.845673","5.9.29.183","172.19.0.3","TCP","56","9002 → 43520 [ACK] Seq=215776 Ack=15661 Win=65535 Len=0"
"11.074911","5.9.29.183","172.19.0.3","TLSv1.2","599","Application Data"
"11.075772","172.19.0.3","5.9.29.183","TLSv1.2","599","Application Data"
"11.076255","5.9.29.183","172.19.0.3","TCP","56","9002 → 43520 [ACK] Seq=216319 Ack=16204 Win=65535 Len=0"
"11.361065","5.9.29.183","172.19.0.3","TCP","1516","[TCP segment of a reassembled PDU]"
"11.361107","5.9.29.183","172.19.0.3","TCP","1492","9002 → 43520 [PSH, ACK] Seq=217779 Ack=16204 Win=65535 Len=1436 [TCP segment of a reassembled PDU]"
"11.361114","5.9.29.183","172.19.0.3","TLSv1.2","787","Application Data"
"11.361197","172.19.0.3","5.9.29.183","TCP","56","43520 → 9002 [ACK] Seq=16204 Ack=219946 Win=11893 Len=0"
"11.384792","5.9.29.183","172.19.0.3","TCP","1516","[TCP segment of a reassembled PDU]"
"11.384859","5.9.29.183","172.19.0.3","TCP","1492","9002 → 43520 [PSH, ACK] Seq=221406 Ack=16204 Win=65535 Len=1436 [TCP segment of a reassembled PDU]"
"11.384872","172.19.0.3","5.9.29.183","TCP","56","43520 → 9002 [ACK] Seq=16204 Ack=222842 Win=11903 Len=0"
"11.384874","5.9.29.183","172.19.0.3","TLSv1.2","1516","Application Data [TCP segment of a reassembled PDU]"
"11.384876","5.9.29.183","172.19.0.3","TCP","1516","9002 → 43520 [PSH, ACK] Seq=224302 Ack=16204 Win=65535 Len=1460 [TCP segment of a reassembled PDU]"
"11.384881","5.9.29.183","172.19.0.3","TCP","1213","9002 → 43520 [PSH, ACK] Seq=225762 Ack=16204 Win=65535 Len=1157 [TCP segment of a reassembled PDU]"
"11.385013","172.19.0.3","5.9.29.183","TCP","56","43520 → 9002 [ACK] Seq=16204 Ack=226919 Win=11879 Len=0"
"11.397635","5.9.29.183","172.19.0.3","TLSv1.2","1504","Application Data [TCP segment of a reassembled PDU]"
"11.397682","5.9.29.183","172.19.0.3","TCP","1516","9002 → 43520 [PSH, ACK] Seq=228367 Ack=16204 Win=65535 Len=1460 [TCP segment of a reassembled PDU]"
"11.397695","172.19.0.3","5.9.29.183","TCP","56","43520 → 9002 [ACK] Seq=16204 Ack=229827 Win=11903 Len=0"
"11.397697","5.9.29.183","172.19.0.3","TCP","1492","9002 → 43520 [PSH, ACK] Seq=229827 Ack=16204 Win=65535 Len=1436 [TCP segment of a reassembled PDU]"
"11.400486","5.9.29.183","172.19.0.3","TLSv1.2","1191","Application Data, Application Data"
"11.400494","172.19.0.3","5.9.29.183","TCP","56","43520 → 9002 [ACK] Seq=16204 Ack=232398 Win=11911 Len=0"
"11.400799","172.19.0.3","5.9.29.183","TLSv1.2","599","Application Data"
"11.401008","5.9.29.183","172.19.0.3","TCP","56","9002 → 43520 [ACK] Seq=232398 Ack=16747 Win=65535 Len=0"
"11.424628","5.9.29.183","172.19.0.3","TCP","1516","[TCP segment of a reassembled PDU]"
"11.424693","5.9.29.183","172.19.0.3","TCP","1516","9002 → 43520 [PSH, ACK] Seq=233858 Ack=16747 Win=65535 Len=1460 [TCP segment of a reassembled PDU]"
"11.424700","5.9.29.183","172.19.0.3","TLSv1.2","1516","Application Data [TCP segment of a reassembled PDU]"
"11.424835","5.9.29.183","172.19.0.3","TCP","883","9002 → 43520 [PSH, ACK] Seq=236778 Ack=16747 Win=65535 Len=827 [TCP segment of a reassembled PDU]"
"11.424841","5.9.29.183","172.19.0.3","TCP","1516","9002 → 43520 [PSH, ACK] Seq=237605 Ack=16747 Win=65535 Len=1460 [TCP segment of a reassembled PDU]"
"11.424843","5.9.29.183","172.19.0.3","TCP","362","9002 → 43520 [PSH, ACK] Seq=239065 Ack=16747 Win=65535 Len=306 [TCP segment of a reassembled PDU]"
"11.424864","172.19.0.3","5.9.29.183","TCP","56","43520 → 9002 [ACK] Seq=16747 Ack=239371 Win=11871 Len=0"
"11.440145","5.9.29.183","172.19.0.3","TLSv1.2","337","Application Data"
"11.449572","5.9.29.183","172.19.0.3","TCP","1516","[TCP segment of a reassembled PDU]"
"11.449630","172.19.0.3","5.9.29.183","TCP","56","43520 → 9002 [ACK] Seq=16747 Ack=241112 Win=11911 Len=0"
"11.449804","5.9.29.183","172.19.0.3","TCP","1492","9002 → 43520 [PSH, ACK] Seq=241112 Ack=16747 Win=65535 Len=1436 [TCP segment of a reassembled PDU]"
"11.449903","5.9.29.183","172.19.0.3","TLSv1.2","1516","Application Data [TCP segment of a reassembled PDU]"
"11.449908","5.9.29.183","172.19.0.3","TCP","1516","9002 → 43520 [PSH, ACK] Seq=244008 Ack=16747 Win=65535 Len=1460 [TCP segment of a reassembled PDU]"
"11.449910","5.9.29.183","172.19.0.3","TCP","1480","9002 → 43520 [PSH, ACK] Seq=245468 Ack=16747 Win=65535 Len=1424 [TCP segment of a reassembled PDU]"
"11.449934","172.19.0.3","5.9.29.183","TCP","56","43520 → 9002 [ACK] Seq=16747 Ack=246892 Win=11893 Len=0"
"11.450194","172.19.0.3","5.9.29.183","TLSv1.2","599","Application Data"
"11.450445","5.9.29.183","172.19.0.3","TCP","56","9002 → 43520 [ACK] Seq=246892 Ack=17290 Win=65535 Len=0"
"11.455412","5.9.29.183","172.19.0.3","TLSv1.2","1127","Application Data, Application Data"
"11.477281","5.9.29.183","172.19.0.3","TCP","1504","[TCP segment of a reassembled PDU]"
"11.477352","172.19.0.3","5.9.29.183","TCP","56","43520 → 9002 [ACK] Seq=17290 Ack=249411 Win=11911 Len=0"
"11.477399","5.9.29.183","172.19.0.3","TCP","1516","9002 → 43520 [PSH, ACK] Seq=249411 Ack=17290 Win=65535 Len=1460 [TCP segment of a reassembled PDU]"
"11.477438","5.9.29.183","172.19.0.3","TLSv1.2","1225","Application Data"
"11.477551","172.19.0.3","5.9.29.183","TCP","56","43520 → 9002 [ACK] Seq=17290 Ack=252040 Win=11895 Len=0"
"11.492667","5.9.29.183","172.19.0.3","TLSv1.2","663","Application Data"
"11.494005","5.9.29.183","172.19.0.3","TCP","1504","[TCP segment of a reassembled PDU]"
"11.494016","172.19.0.3","5.9.29.183","TCP","56","43520 → 9002 [ACK] Seq=17290 Ack=254095 Win=11911 Len=0"
"11.494045","5.9.29.183","172.19.0.3","TCP","1504","9002 → 43520 [PSH, ACK] Seq=254095 Ack=17290 Win=65535 Len=1448 [TCP segment of a reassembled PDU]"
"11.507717","5.9.29.183","172.19.0.3","TLSv1.2","787","Application Data"
"11.507735","172.19.0.3","5.9.29.183","TCP","56","43520 → 9002 [ACK] Seq=17290 Ack=256274 Win=11911 Len=0"
"11.508055","5.9.29.183","172.19.0.3","TCP","1504","[TCP segment of a reassembled PDU]"
"11.508184","5.9.29.183","172.19.0.3","TCP","1504","9002 → 43520 [PSH, ACK] Seq=257722 Ack=17290 Win=65535 Len=1448 [TCP segment of a reassembled PDU]"
"11.508191","172.19.0.3","5.9.29.183","TCP","56","43520 → 9002 [ACK] Seq=17290 Ack=259170 Win=11911 Len=0"
"11.522338","5.9.29.183","172.19.0.3","TLSv1.2","1504","Application Data, Application Data"
"11.522383","5.9.29.183","172.19.0.3","TCP","1516","9002 → 43520 [PSH, ACK] Seq=260618 Ack=17290 Win=65535 Len=1460 [TCP segment of a reassembled PDU]"
"11.522388","5.9.29.183","172.19.0.3","TCP","1492","9002 → 43520 [PSH, ACK] Seq=262078 Ack=17290 Win=65535 Len=1436 [TCP segment of a reassembled PDU]"
"11.522504","172.19.0.3","5.9.29.183","TCP","56","43520 → 9002 [ACK] Seq=17290 Ack=263514 Win=11895 Len=0"
"11.523464","5.9.29.183","172.19.0.3","TLSv1.2","1156","Application Data, Application Data"
"11.534906","5.9.29.183","172.19.0.3","TCP","1504","[TCP segment of a reassembled PDU]"
"11.534930","172.19.0.3","5.9.29.183","TCP","56","43520 → 9002 [ACK] Seq=17290 Ack=266062 Win=11911 Len=0"
"11.534984","5.9.29.183","172.19.0.3","TCP","1504","9002 → 43520 [PSH, ACK] Seq=266062 Ack=17290 Win=65535 Len=1448 [TCP segment of a reassembled PDU]"
"11.540477","5.9.29.183","172.19.0.3","TLSv1.2","787","Application Data"
"11.540677","172.19.0.3","5.9.29.183","TCP","56","43520 → 9002 [ACK] Seq=17290 Ack=268241 Win=11911 Len=0"
"11.540969","172.19.0.3","5.9.29.183","TLSv1.2","599","Application Data"
"11.541245","5.9.29.183","172.19.0.3","TCP","56","9002 → 43520 [ACK] Seq=268241 Ack=17833 Win=65535 Len=0"
"11.545659","5.9.29.183","172.19.0.3","TCP","1504","[TCP segment of a reassembled PDU]"
"11.545725","5.9.29.183","172.19.0.3","TCP","1504","9002 → 43520 [PSH, ACK] Seq=269689 Ack=17833 Win=65535 Len=1448 [TCP segment of a reassembled PDU]"
"11.545836","172.19.0.3","5.9.29.183","TCP","56","43520 → 9002 [ACK] Seq=17833 Ack=271137 Win=11903 Len=0"
"11.555746","5.9.29.183","172.19.0.3","TLSv1.2","1330","Application Data, Application Data"
"11.559485","5.9.29.183","172.19.0.3","TCP","1504","[TCP segment of a reassembled PDU]"
"11.559503","172.19.0.3","5.9.29.183","TCP","56","43520 → 9002 [ACK] Seq=17833 Ack=273859 Win=11911 Len=0"
"11.570468","5.9.29.183","172.19.0.3","TLSv1.2","693","Application Data"
"11.574039","172.19.0.3","5.9.29.183","TLSv1.2","599","Application Data"
"11.574310","5.9.29.183","172.19.0.3","TCP","56","9002 → 43520 [ACK] Seq=274496 Ack=18376 Win=65535 Len=0"
"11.846706","5.9.29.183","172.19.0.3","TLSv1.2","599","Application Data"
"11.847475","172.19.0.3","5.9.29.183","TLSv1.2","599","Application Data"
"11.848188","5.9.29.183","172.19.0.3","TCP","56","9002 → 43520 [ACK] Seq=275039 Ack=18919 Win=65535 Len=0"
"12.106042","5.9.29.183","172.19.0.3","TLSv1.2","599","Application Data"
"12.129601","5.9.29.183","172.19.0.3","TCP","1504","[TCP segment of a reassembled PDU]"
"12.129662","172.19.0.3","5.9.29.183","TCP","56","43520 → 9002 [ACK] Seq=18919 Ack=277030 Win=11911 Len=0"
"12.129710","5.9.29.183","172.19.0.3","TCP","1516","9002 → 43520 [PSH, ACK] Seq=277030 Ack=18919 Win=65535 Len=1460 [TCP segment of a reassembled PDU]"
"12.129724","5.9.29.183","172.19.0.3","TLSv1.2","1516","Application Data [TCP segment of a reassembled PDU]"
"12.129728","5.9.29.183","172.19.0.3","TCP","1516","9002 → 43520 [PSH, ACK] Seq=279950 Ack=18919 Win=65535 Len=1460 [TCP segment of a reassembled PDU]"
"12.129801","5.9.29.183","172.19.0.3","TCP","1201","9002 → 43520 [PSH, ACK] Seq=281410 Ack=18919 Win=65535 Len=1145 [TCP segment of a reassembled PDU]"
"12.129843","172.19.0.3","5.9.29.183","TCP","56","43520 → 9002 [ACK] Seq=18919 Ack=282555 Win=11879 Len=0"
"12.140988","5.9.29.183","172.19.0.3","TLSv1.2","1516","Application Data [TCP segment of a reassembled PDU]"
"12.141055","5.9.29.183","172.19.0.3","TCP","1516","9002 → 43520 [PSH, ACK] Seq=284015 Ack=18919 Win=65535 Len=1460 [TCP segment of a reassembled PDU]"
"12.141073","172.19.0.3","5.9.29.183","TCP","56","43520 → 9002 [ACK] Seq=18919 Ack=285475 Win=11903 Len=0"
"12.141077","5.9.29.183","172.19.0.3","TCP","1480","9002 → 43520 [PSH, ACK] Seq=285475 Ack=18919 Win=65535 Len=1424 [TCP segment of a reassembled PDU]"
"12.141398","172.19.0.3","5.9.29.183","TLSv1.2","599","Application Data"
"12.141674","5.9.29.183","172.19.0.3","TCP","56","9002 → 43520 [ACK] Seq=286899 Ack=19462 Win=65535 Len=0"
"12.145745","5.9.29.183","172.19.0.3","TLSv1.2","677","Application Data, Application Data"
"12.165175","5.9.29.183","172.19.0.3","TCP","1504","[TCP segment of a reassembled PDU]"
"12.165196","172.19.0.3","5.9.29.183","TCP","56","43520 → 9002 [ACK] Seq=19462 Ack=288968 Win=11911 Len=0"
"12.165237","5.9.29.183","172.19.0.3","TCP","1504","9002 → 43520 [PSH, ACK] Seq=288968 Ack=19462 Win=65535 Len=1448 [TCP segment of a reassembled PDU]"
"12.165274","5.9.29.183","172.19.0.3","TLSv1.2","1237","Application Data"
"12.165400","172.19.0.3","5.9.29.183","TCP","56","43520 → 9002 [ACK] Seq=19462 Ack=291597 Win=11895 Len=0"
"12.181054","5.9.29.183","172.19.0.3","TLSv1.2","663","Application Data"
"12.189853","5.9.29.183","172.19.0.3","TCP","1516","[TCP segment of a reassembled PDU]"
"12.189877","172.19.0.3","5.9.29.183","TCP","56","43520 → 9002 [ACK] Seq=19462 Ack=293664 Win=11911 Len=0"
"12.189930","5.9.29.183","172.19.0.3","TCP","1492","9002 → 43520 [PSH, ACK] Seq=293664 Ack=19462 Win=65535 Len=1436 [TCP segment of a reassembled PDU]"
"12.190063","5.9.29.183","172.19.0.3","TLSv1.2","1516","Application Data [TCP segment of a reassembled PDU]"
"12.190070","5.9.29.183","172.19.0.3","TLSv1.2","1516","Application Data [TCP segment of a reassembled PDU]"
"12.190073","5.9.29.183","172.19.0.3","TCP","1516","9002 → 43520 [PSH, ACK] Seq=298020 Ack=19462 Win=65535 Len=1460 [TCP segment of a reassembled PDU]"
"12.190187","172.19.0.3","5.9.29.183","TCP","56","43520 → 9002 [ACK] Seq=19462 Ack=299480 Win=11879 Len=0"
"12.190205","5.9.29.183","172.19.0.3","TCP","1516","9002 → 43520 [PSH, ACK] Seq=299480 Ack=19462 Win=65535 Len=1460 [TCP segment of a reassembled PDU]"
"12.190209","5.9.29.183","172.19.0.3","TLSv1.2","1516","Application Data [TCP segment of a reassembled PDU]"
"12.190212","5.9.29.183","172.19.0.3","TCP","797","9002 → 43520 [PSH, ACK] Seq=302400 Ack=19462 Win=65535 Len=741 [TCP segment of a reassembled PDU]"
"12.190279","5.9.29.183","172.19.0.3","TCP","1516","9002 → 43520 [PSH, ACK] Seq=303141 Ack=19462 Win=65535 Len=1460 [TCP segment of a reassembled PDU]"
"12.190283","5.9.29.183","172.19.0.3","TLSv1.2","1516","Application Data [TCP segment of a reassembled PDU]"
"12.190298","172.19.0.3","5.9.29.183","TCP","56","43520 → 9002 [ACK] Seq=19462 Ack=303141 Win=11855 Len=0"
"12.190366","5.9.29.183","172.19.0.3","TCP","679","9002 → 43520 [PSH, ACK] Seq=306061 Ack=19462 Win=65535 Len=623 [TCP segment of a reassembled PDU]"
"12.190549","172.19.0.3","5.9.29.183","TCP","56","43520 → 9002 [ACK] Seq=19462 Ack=306684 Win=11830 Len=0"
"12.191173","172.19.0.3","5.9.29.183","TLSv1.2","599","Application Data"
"12.191509","5.9.29.183","172.19.0.3","TCP","56","9002 → 43520 [ACK] Seq=306684 Ack=20005 Win=65535 Len=0"
"12.196128","5.9.29.183","172.19.0.3","TCP","1516","9002 → 43520 [PSH, ACK] Seq=306684 Ack=20005 Win=65535 Len=1460 [TCP segment of a reassembled PDU]"
"12.196182","5.9.29.183","172.19.0.3","TLSv1.2","709","Application Data"
"12.196197","172.19.0.3","5.9.29.183","TCP","56","43520 → 9002 [ACK] Seq=20005 Ack=308797 Win=11903 Len=0"
"12.206688","5.9.29.183","172.19.0.3","TCP","1516","[TCP segment of a reassembled PDU]"
"12.206738","5.9.29.183","172.19.0.3","TCP","1492","9002 → 43520 [PSH, ACK] Seq=310257 Ack=20005 Win=65535 Len=1436 [TCP segment of a reassembled PDU]"
"12.206752","172.19.0.3","5.9.29.183","TCP","56","43520 → 9002 [ACK] Seq=20005 Ack=311693 Win=11903 Len=0"
"12.211544","5.9.29.183","172.19.0.3","TLSv1.2","1330","Application Data, Application Data"
"12.217373","5.9.29.183","172.19.0.3","TCP","1504","[TCP segment of a reassembled PDU]"
"12.217397","172.19.0.3","5.9.29.183","TCP","56","43520 → 9002 [ACK] Seq=20005 Ack=314415 Win=11911 Len=0"
"12.217825","5.9.29.183","172.19.0.3","TCP","1516","9002 → 43520 [PSH, ACK] Seq=314415 Ack=20005 Win=65535 Len=1460 [TCP segment of a reassembled PDU]"
"12.217877","5.9.29.183","172.19.0.3","TLSv1.2","1492","Application Data [TCP segment of a reassembled PDU]"
"12.217916","5.9.29.183","172.19.0.3","TCP","1516","9002 → 43520 [PSH, ACK] Seq=317311 Ack=20005 Win=65535 Len=1460 [TCP segment of a reassembled PDU]"
"12.217921","5.9.29.183","172.19.0.3","TCP","1516","9002 → 43520 [PSH, ACK] Seq=318771 Ack=20005 Win=65535 Len=1460 [TCP segment of a reassembled PDU]"
"12.217954","5.9.29.183","172.19.0.3","TLSv1.2","1516","Application Data [TCP segment of a reassembled PDU]"
"12.217973","172.19.0.3","5.9.29.183","TCP","56","43520 → 9002 [ACK] Seq=20005 Ack=320231 Win=11887 Len=0"
"12.217991","5.9.29.183","172.19.0.3","TCP","1516","9002 → 43520 [PSH, ACK] Seq=321691 Ack=20005 Win=65535 Len=1460 [TCP segment of a reassembled PDU]"
"12.217995","5.9.29.183","172.19.0.3","TCP","1456","9002 → 43520 [PSH, ACK] Seq=323151 Ack=20005 Win=65535 Len=1400 [TCP segment of a reassembled PDU]"
"12.218244","172.19.0.3","5.9.29.183","TCP","56","43520 → 9002 [ACK] Seq=20005 Ack=324551 Win=11863 Len=0"
"12.227043","5.9.29.183","172.19.0.3","TLSv1.2","924","Application Data, Application Data"
"12.233528","5.9.29.183","172.19.0.3","TCP","1516","[TCP segment of a reassembled PDU]"
"12.233553","172.19.0.3","5.9.29.183","TCP","56","43520 → 9002 [ACK] Seq=20005 Ack=326879 Win=11911 Len=0"
"12.233609","5.9.29.183","172.19.0.3","TCP","1492","9002 → 43520 [PSH, ACK] Seq=326879 Ack=20005 Win=65535 Len=1436 [TCP segment of a reassembled PDU]"
"12.242191","5.9.29.183","172.19.0.3","TLSv1.2","787","Application Data"
"12.242213","172.19.0.3","5.9.29.183","TCP","56","43520 → 9002 [ACK] Seq=20005 Ack=329046 Win=11911 Len=0"
"12.242573","172.19.0.3","5.9.29.183","TLSv1.2","599","Application Data"
"12.242819","5.9.29.183","172.19.0.3","TCP","56","9002 → 43520 [ACK] Seq=329046 Ack=20548 Win=65535 Len=0"
"12.243612","5.9.29.183","172.19.0.3","TCP","1516","[TCP segment of a reassembled PDU]"
"12.243655","5.9.29.183","172.19.0.3","TCP","1492","9002 → 43520 [PSH, ACK] Seq=330506 Ack=20548 Win=65535 Len=1436 [TCP segment of a reassembled PDU]"
"12.243737","5.9.29.183","172.19.0.3","TLSv1.2","1516","Application Data [TCP segment of a reassembled PDU]"
"12.243741","5.9.29.183","172.19.0.3","TCP","1516","9002 → 43520 [PSH, ACK] Seq=333402 Ack=20548 Win=65535 Len=1460 [TCP segment of a reassembled PDU]"
"12.243743","5.9.29.183","172.19.0.3","TCP","1516","9002 → 43520 [PSH, ACK] Seq=334862 Ack=20548 Win=65535 Len=1460 [TCP segment of a reassembled PDU]"
"12.243752","5.9.29.183","172.19.0.3","TLSv1.2","1468","Application Data [TCP segment of a reassembled PDU]"
"12.243753","172.19.0.3","5.9.29.183","TCP","56","43520 → 9002 [ACK] Seq=20548 Ack=333402 Win=11895 Len=0"
"12.243805","172.19.0.3","5.9.29.183","TCP","56","43520 → 9002 [ACK] Seq=20548 Ack=337734 Win=11871 Len=0"
"12.243888","5.9.29.183","172.19.0.3","TLSv1.2","1516","Application Data [TCP segment of a reassembled PDU]"
"12.243894","5.9.29.183","172.19.0.3","TCP","1492","9002 → 43520 [PSH, ACK] Seq=339194 Ack=20548 Win=65535 Len=1436 [TCP segment of a reassembled PDU]"
"12.243930","172.19.0.3","5.9.29.183","TCP","56","43520 → 9002 [ACK] Seq=20548 Ack=340630 Win=11853 Len=0"
"12.244283","5.9.29.183","172.19.0.3","TCP","1516","9002 → 43520 [PSH, ACK] Seq=340630 Ack=20548 Win=65535 Len=1460 [TCP segment of a reassembled PDU]"
"12.244325","5.9.29.183","172.19.0.3","TLSv1.2","1492","Application Data [TCP segment of a reassembled PDU]"
"12.244338","172.19.0.3","5.9.29.183","TCP","56","43520 → 9002 [ACK] Seq=20548 Ack=343526 Win=11903 Len=0"
"12.248895","5.9.29.183","172.19.0.3","TLSv1.2","1516","Application Data [TCP segment of a reassembled PDU]"
"12.248948","5.9.29.183","172.19.0.3","TCP","1492","9002 → 43520 [PSH, ACK] Seq=344986 Ack=20548 Win=65535 Len=1436 [TCP segment of a reassembled PDU]"
"12.248963","172.19.0.3","5.9.29.183","TCP","56","43520 → 9002 [ACK] Seq=20548 Ack=346422 Win=11903 Len=0"
"12.253350","172.19.0.3","5.9.29.183","TLSv1.2","599","Application Data"
"12.253842","5.9.29.183","172.19.0.3","TCP","56","9002 → 43520 [ACK] Seq=346422 Ack=21091 Win=65535 Len=0"
"12.257605","5.9.29.183","172.19.0.3","TLSv1.2","1504","Application Data [TCP segment of a reassembled PDU]"
"12.259131","5.9.29.183","172.19.0.3","TCP","1504","9002 → 43520 [PSH, ACK] Seq=347870 Ack=21091 Win=65535 Len=1448 [TCP segment of a reassembled PDU]"
"12.259141","172.19.0.3","5.9.29.183","TCP","56","43520 → 9002 [ACK] Seq=21091 Ack=349318 Win=11911 Len=0"
"12.259176","5.9.29.183","172.19.0.3","TLSv1.2","547","Application Data"
"12.273156","5.9.29.183","172.19.0.3","TLSv1.2","1516","Application Data"
"12.273187","172.19.0.3","5.9.29.183","TCP","56","43520 → 9002 [ACK] Seq=21091 Ack=351269 Win=11911 Len=0"
"12.273240","5.9.29.183","172.19.0.3","TCP","1492","9002 → 43520 [PSH, ACK] Seq=351269 Ack=21091 Win=65535 Len=1436 [TCP segment of a reassembled PDU]"
"12.273251","5.9.29.183","172.19.0.3","TCP","1516","9002 → 43520 [PSH, ACK] Seq=352705 Ack=21091 Win=65535 Len=1460 [TCP segment of a reassembled PDU]"
"12.273357","5.9.29.183","172.19.0.3","TLSv1.2","1516","Application Data [TCP segment of a reassembled PDU]"
"12.273366","5.9.29.183","172.19.0.3","TCP","1516","9002 → 43520 [PSH, ACK] Seq=355625 Ack=21091 Win=65535 Len=1460 [TCP segment of a reassembled PDU]"
"12.273370","5.9.29.183","172.19.0.3","TCP","1516","9002 → 43520 [PSH, ACK] Seq=357085 Ack=21091 Win=65535 Len=1460 [TCP segment of a reassembled PDU]"
"12.273373","5.9.29.183","172.19.0.3","TLSv1.2","1456","Application Data [TCP segment of a reassembled PDU]"
"12.273405","172.19.0.3","5.9.29.183","TCP","56","43520 → 9002 [ACK] Seq=21091 Ack=359945 Win=11863 Len=0"
"12.273862","172.19.0.3","5.9.29.183","TLSv1.2","599","Application Data"
"12.274103","5.9.29.183","172.19.0.3","TCP","56","9002 → 43520 [ACK] Seq=359945 Ack=21634 Win=65535 Len=0"
"12.274593","5.9.29.183","172.19.0.3","TLSv1.2","830","Application Data"
"12.283545","172.19.0.3","5.9.29.183","TLSv1.2","599","Application Data"
"12.283809","5.9.29.183","172.19.0.3","TCP","56","9002 → 43520 [ACK] Seq=360719 Ack=22177 Win=65535 Len=0"
"12.586601","5.9.29.183","172.19.0.3","TLSv1.2","599","Application Data"
"12.587192","172.19.0.3","5.9.29.183","TLSv1.2","599","Application Data"
"12.587468","5.9.29.183","172.19.0.3","TCP","56","9002 → 43520 [ACK] Seq=361262 Ack=22720 Win=65535 Len=0"
"13.372400","5.9.29.183","172.19.0.3","TCP","1516","[TCP segment of a reassembled PDU]"
"13.372451","5.9.29.183","172.19.0.3","TCP","1492","9002 → 43520 [PSH, ACK] Seq=362722 Ack=22720 Win=65535 Len=1436 [TCP segment of a reassembled PDU]"
"13.372458","5.9.29.183","172.19.0.3","TLSv1.2","787","Application Data"
"13.372573","172.19.0.3","5.9.29.183","TCP","56","43520 → 9002 [ACK] Seq=22720 Ack=364889 Win=11895 Len=0"
"13.396137","5.9.29.183","172.19.0.3","TCP","1516","[TCP segment of a reassembled PDU]"
"13.396184","5.9.29.183","172.19.0.3","TCP","1492","9002 → 43520 [PSH, ACK] Seq=366349 Ack=22720 Win=65535 Len=1436 [TCP segment of a reassembled PDU]"
"13.396197","172.19.0.3","5.9.29.183","TCP","56","43520 → 9002 [ACK] Seq=22720 Ack=367785 Win=11903 Len=0"
"13.396199","5.9.29.183","172.19.0.3","TCP","948","9002 → 43520 [PSH, ACK] Seq=367785 Ack=22720 Win=65535 Len=892 [TCP segment of a reassembled PDU]"
"13.396201","5.9.29.183","172.19.0.3","TLSv1.2","1516","Application Data [TCP segment of a reassembled PDU]"
"13.396264","5.9.29.183","172.19.0.3","TCP","1516","9002 → 43520 [PSH, ACK] Seq=370137 Ack=22720 Win=65535 Len=1460 [TCP segment of a reassembled PDU]"
"13.396267","5.9.29.183","172.19.0.3","TLSv1.2","1516","Application Data [TCP segment of a reassembled PDU]"
"13.396270","5.9.29.183","172.19.0.3","TCP","1516","9002 → 43520 [PSH, ACK] Seq=373057 Ack=22720 Win=65535 Len=1460 [TCP segment of a reassembled PDU]"
"13.396272","5.9.29.183","172.19.0.3","TCP","297","9002 → 43520 [PSH, ACK] Seq=374517 Ack=22720 Win=65535 Len=241 [TCP segment of a reassembled PDU]"
"13.396274","5.9.29.183","172.19.0.3","TCP","1504","9002 → 43520 [PSH, ACK] Seq=374758 Ack=22720 Win=65535 Len=1448 [TCP segment of a reassembled PDU]"
"13.396301","172.19.0.3","5.9.29.183","TCP","56","43520 → 9002 [ACK] Seq=22720 Ack=376206 Win=11847 Len=0"
"13.405158","5.9.29.183","172.19.0.3","TLSv1.2","1504","Application Data [TCP segment of a reassembled PDU]"
"13.405210","5.9.29.183","172.19.0.3","TCP","1504","9002 → 43520 [PSH, ACK] Seq=377654 Ack=22720 Win=65535 Len=1448 [TCP segment of a reassembled PDU]"
"13.405223","172.19.0.3","5.9.29.183","TCP","56","43520 → 9002 [ACK] Seq=22720 Ack=379102 Win=11903 Len=0"
"13.411535","5.9.29.183","172.19.0.3","TCP","1504","9002 → 43520 [PSH, ACK] Seq=379102 Ack=22720 Win=65535 Len=1448 [TCP segment of a reassembled PDU]"
"13.411583","5.9.29.183","172.19.0.3","TLSv1.2","1516","Application Data [TCP segment of a reassembled PDU]"
"13.411595","172.19.0.3","5.9.29.183","TCP","56","43520 → 9002 [ACK] Seq=22720 Ack=382010 Win=11903 Len=0"
"13.411597","5.9.29.183","172.19.0.3","TCP","1516","9002 → 43520 [PSH, ACK] Seq=382010 Ack=22720 Win=65535 Len=1460 [TCP segment of a reassembled PDU]"
"13.411600","5.9.29.183","172.19.0.3","TCP","1480","9002 → 43520 [PSH, ACK] Seq=383470 Ack=22720 Win=65535 Len=1424 [TCP segment of a reassembled PDU]"
"13.411602","5.9.29.183","172.19.0.3","TLSv1.2","1516","Application Data [TCP segment of a reassembled PDU]"
"13.411604","5.9.29.183","172.19.0.3","TCP","1492","9002 → 43520 [PSH, ACK] Seq=386354 Ack=22720 Win=65535 Len=1436 [TCP segment of a reassembled PDU]"
"13.411663","5.9.29.183","172.19.0.3","TLSv1.2","1516","Application Data [TCP segment of a reassembled PDU]"
"13.411667","5.9.29.183","172.19.0.3","TCP","1516","9002 → 43520 [PSH, ACK] Seq=389250 Ack=22720 Win=65535 Len=1460 [TCP segment of a reassembled PDU]"
"13.411669","5.9.29.183","172.19.0.3","TCP","1516","9002 → 43520 [PSH, ACK] Seq=390710 Ack=22720 Win=65535 Len=1460 [TCP segment of a reassembled PDU]"
"13.411670","5.9.29.183","172.19.0.3","TLSv1.2","220","Application Data"
"13.411708","172.19.0.3","5.9.29.183","TCP","56","43520 → 9002 [ACK] Seq=22720 Ack=392334 Win=11836 Len=0"
"13.412294","172.19.0.3","5.9.29.183","TLSv1.2","1113","Application Data"
"13.412657","5.9.29.183","172.19.0.3","TCP","56","9002 → 43520 [ACK] Seq=392334 Ack=23777 Win=65535 Len=0"
"13.417024","5.9.29.183","172.19.0.3","TCP","1504","[TCP segment of a reassembled PDU]"
"13.420473","5.9.29.183","172.19.0.3","TCP","1516","9002 → 43520 [PSH, ACK] Seq=393782 Ack=23777 Win=65535 Len=1460 [TCP segment of a reassembled PDU]"
"13.420493","172.19.0.3","5.9.29.183","TCP","56","43520 → 9002 [ACK] Seq=23777 Ack=395242 Win=11911 Len=0"
"13.420538","5.9.29.183","172.19.0.3","TLSv1.2","1492","Application Data [TCP segment of a reassembled PDU]"
"13.426807","5.9.29.183","172.19.0.3","TCP","1504","9002 → 43520 [PSH, ACK] Seq=396678 Ack=23777 Win=65535 Len=1448 [TCP segment of a reassembled PDU]"
"13.426827","172.19.0.3","5.9.29.183","TCP","56","43520 → 9002 [ACK] Seq=23777 Ack=398126 Win=11911 Len=0"
"13.426863","5.9.29.183","172.19.0.3","TCP","1516","9002 → 43520 [PSH, ACK] Seq=398126 Ack=23777 Win=65535 Len=1460 [TCP segment of a reassembled PDU]"
"13.426870","5.9.29.183","172.19.0.3","TLSv1.2","1516","Application Data [TCP segment of a reassembled PDU]"
"13.426873","5.9.29.183","172.19.0.3","TCP","1480","9002 → 43520 [PSH, ACK] Seq=401046 Ack=23777 Win=65535 Len=1424 [TCP segment of a reassembled PDU]"
"13.426993","172.19.0.3","5.9.29.183","TCP","56","43520 → 9002 [ACK] Seq=23777 Ack=402470 Win=11887 Len=0"
"13.427323","5.9.29.183","172.19.0.3","TCP","1516","9002 → 43520 [PSH, ACK] Seq=402470 Ack=23777 Win=65535 Len=1460 [TCP segment of a reassembled PDU]"
"13.427363","5.9.29.183","172.19.0.3","TLSv1.2","1492","Application Data [TCP segment of a reassembled PDU]"
"13.427395","172.19.0.3","5.9.29.183","TCP","56","43520 → 9002 [ACK] Seq=23777 Ack=405366 Win=11903 Len=0"
"13.427456","5.9.29.183","172.19.0.3","TCP","1516","9002 → 43520 [PSH, ACK] Seq=405366 Ack=23777 Win=65535 Len=1460 [TCP segment of a reassembled PDU]"
"13.427463","5.9.29.183","172.19.0.3","TCP","1516","9002 → 43520 [PSH, ACK] Seq=406826 Ack=23777 Win=65535 Len=1460 [TCP segment of a reassembled PDU]"
"13.427508","5.9.29.183","172.19.0.3","TLSv1.2","1516","Application Data, Application Data"
"13.427582","5.9.29.183","172.19.0.3","TCP","1516","9002 → 43520 [PSH, ACK] Seq=409746 Ack=23777 Win=65535 Len=1460 [TCP segment of a reassembled PDU]"
"13.427587","5.9.29.183","172.19.0.3","TCP","1516","9002 → 43520 [PSH, ACK] Seq=411206 Ack=23777 Win=65535 Len=1460 [TCP segment of a reassembled PDU]"
"13.427590","172.19.0.3","5.9.29.183","TCP","56","43520 → 9002 [ACK] Seq=23777 Ack=409746 Win=11879 Len=0"
"13.427652","5.9.29.183","172.19.0.3","TLSv1.2","487","Application Data, Application Data"
"13.427730","172.19.0.3","5.9.29.183","TCP","56","43520 → 9002 [ACK] Seq=23777 Ack=413097 Win=11855 Len=0"
"13.428060","172.19.0.3","5.9.29.183","TLSv1.2","599","Application Data"
"13.428217","5.9.29.183","172.19.0.3","TCP","56","9002 → 43520 [ACK] Seq=413097 Ack=24320 Win=65535 Len=0"
"13.436193","5.9.29.183","172.19.0.3","TCP","1504","[TCP segment of a reassembled PDU]"
"13.436292","5.9.29.183","172.19.0.3","TCP","1504","9002 → 43520 [PSH, ACK] Seq=414545 Ack=24320 Win=65535 Len=1448 [TCP segment of a reassembled PDU]"
"13.436318","5.9.29.183","172.19.0.3","TLSv1.2","1504","Application Data [TCP segment of a reassembled PDU]"
"13.436428","172.19.0.3","5.9.29.183","TCP","56","43520 → 9002 [ACK] Seq=24320 Ack=417441 Win=11893 Len=0"
"13.442785","5.9.29.183","172.19.0.3","TCP","1516","9002 → 43520 [PSH, ACK] Seq=417441 Ack=24320 Win=65535 Len=1460 [TCP segment of a reassembled PDU]"
"13.442856","5.9.29.183","172.19.0.3","TCP","1492","9002 → 43520 [PSH, ACK] Seq=418901 Ack=24320 Win=65535 Len=1436 [TCP segment of a reassembled PDU]"
"13.442912","172.19.0.3","5.9.29.183","TCP","56","43520 → 9002 [ACK] Seq=24320 Ack=420337 Win=11903 Len=0"
"13.443014","5.9.29.183","172.19.0.3","TLSv1.2","1504","Application Data, Application Data"
"13.443171","5.9.29.183","172.19.0.3","TCP","1516","9002 → 43520 [PSH, ACK] Seq=421785 Ack=24320 Win=65535 Len=1460 [TCP segment of a reassembled PDU]"
"13.443181","5.9.29.183","172.19.0.3","TCP","1516","9002 → 43520 [PSH, ACK] Seq=423245 Ack=24320 Win=65535 Len=1460 [TCP segment of a reassembled PDU]"
"13.443255","5.9.29.183","172.19.0.3","TLSv1.2","1480","Application Data [TCP segment of a reassembled PDU]"
"13.443423","5.9.29.183","172.19.0.3","TCP","1504","9002 → 43520 [PSH, ACK] Seq=426129 Ack=24320 Win=65535 Len=1448 [TCP segment of a reassembled PDU]"
"13.443520","172.19.0.3","5.9.29.183","TCP","56","43520 → 9002 [ACK] Seq=24320 Ack=427577 Win=11863 Len=0"
"13.443869","5.9.29.183","172.19.0.3","TCP","1516","9002 → 43520 [PSH, ACK] Seq=427577 Ack=24320 Win=65535 Len=1460 [TCP segment of a reassembled PDU]"
"13.443947","5.9.29.183","172.19.0.3","TLSv1.2","1516","Application Data [TCP segment of a reassembled PDU]"
"13.443981","5.9.29.183","172.19.0.3","TCP","1480","9002 → 43520 [PSH, ACK] Seq=430497 Ack=24320 Win=65535 Len=1424 [TCP segment of a reassembled PDU]"
"13.443986","5.9.29.183","172.19.0.3","TCP","1516","9002 → 43520 [PSH, ACK] Seq=431921 Ack=24320 Win=65535 Len=1460 [TCP segment of a reassembled PDU]"
"13.444043","5.9.29.183","172.19.0.3","TLSv1.2","888","Application Data, Application Data"
"13.444198","5.9.29.183","172.19.0.3","TCP","1516","9002 → 43520 [PSH, ACK] Seq=434213 Ack=24320 Win=65535 Len=1460 [TCP segment of a reassembled PDU]"
"13.444205","5.9.29.183","172.19.0.3","TCP","648","9002 → 43520 [PSH, ACK] Seq=435673 Ack=24320 Win=65535 Len=592 [TCP segment of a reassembled PDU]"
"13.444244","172.19.0.3","5.9.29.183","TCP","56","43520 → 9002 [ACK] Seq=24320 Ack=436265 Win=11806 Len=0"
"13.451554","5.9.29.183","172.19.0.3","TCP","1516","9002 → 43520 [PSH, ACK] Seq=436265 Ack=24320 Win=65535 Len=1460 [TCP segment of a reassembled PDU]"
"13.451598","5.9.29.183","172.19.0.3","TLSv1.2","875","Application Data, Application Data"
"13.451610","172.19.0.3","5.9.29.183","TCP","56","43520 → 9002 [ACK] Seq=24320 Ack=438544 Win=11903 Len=0"
"13.451940","172.19.0.3","5.9.29.183","TLSv1.2","599","Application Data"
"13.452148","5.9.29.183","172.19.0.3","TCP","56","9002 → 43520 [ACK] Seq=438544 Ack=24863 Win=65535 Len=0"
"13.454980","5.9.29.183","172.19.0.3","TCP","1504","[TCP segment of a reassembled PDU]"
"13.466612","5.9.29.183","172.19.0.3","TLSv1.2","693","Application Data"
"13.466829","172.19.0.3","5.9.29.183","TCP","56","43520 → 9002 [ACK] Seq=24863 Ack=440629 Win=11911 Len=0"
"13.467190","172.19.0.3","5.9.29.183","TLSv1.2","599","Application Data"
"13.467419","5.9.29.183","172.19.0.3","TCP","56","9002 → 43520 [ACK] Seq=440629 Ack=25406 Win=65535 Len=0"
"13.476472","172.19.0.3","5.9.29.183","TLSv1.2","599","Application Data"
"13.476745","5.9.29.183","172.19.0.3","TCP","56","9002 → 43520 [ACK] Seq=440629 Ack=25949 Win=65535 Len=0"
"13.746044","5.9.29.183","172.19.0.3","TLSv1.2","599","Application Data"
"13.747001","172.19.0.3","5.9.29.183","TLSv1.2","599","Application Data"
"13.747308","5.9.29.183","172.19.0.3","TCP","56","9002 → 43520 [ACK] Seq=441172 Ack=26492 Win=65535 Len=0"
"13.966261","5.9.29.183","172.19.0.3","TCP","1516","[TCP segment of a reassembled PDU]"
"13.966367","5.9.29.183","172.19.0.3","TCP","1516","9002 → 43520 [PSH, ACK] Seq=442632 Ack=26492 Win=65535 Len=1460 [TCP segment of a reassembled PDU]"
"13.966382","5.9.29.183","172.19.0.3","TLSv1.2","763","Application Data"
"13.966518","172.19.0.3","5.9.29.183","TCP","56","43520 → 9002 [ACK] Seq=26492 Ack=444799 Win=11893 Len=0"
"13.978137","5.9.29.183","172.19.0.3","TCP","1516","[TCP segment of a reassembled PDU]"
"13.978216","5.9.29.183","172.19.0.3","TCP","1492","9002 → 43520 [PSH, ACK] Seq=446259 Ack=26492 Win=65535 Len=1436 [TCP segment of a reassembled PDU]"
"13.978240","172.19.0.3","5.9.29.183","TCP","56","43520 → 9002 [ACK] Seq=26492 Ack=447695 Win=11903 Len=0"
"13.981669","5.9.29.183","172.19.0.3","TLSv1.2","787","Application Data"
"13.987959","5.9.29.183","172.19.0.3","TCP","1516","[TCP segment of a reassembled PDU]"
"13.987980","172.19.0.3","5.9.29.183","TCP","56","43520 → 9002 [ACK] Seq=26492 Ack=449886 Win=11911 Len=0"
"13.988034","5.9.29.183","172.19.0.3","TCP","1492","9002 → 43520 [PSH, ACK] Seq=449886 Ack=26492 Win=65535 Len=1436 [TCP segment of a reassembled PDU]"
"13.996822","5.9.29.183","172.19.0.3","TLSv1.2","1330","Application Data, Application Data"
"13.996854","172.19.0.3","5.9.29.183","TCP","56","43520 → 9002 [ACK] Seq=26492 Ack=452596 Win=11911 Len=0"
"13.998736","5.9.29.183","172.19.0.3","TCP","1516","[TCP segment of a reassembled PDU]"
"13.998800","5.9.29.183","172.19.0.3","TCP","1492","9002 → 43520 [PSH, ACK] Seq=454056 Ack=26492 Win=65535 Len=1436 [TCP segment of a reassembled PDU]"
"13.998973","172.19.0.3","5.9.29.183","TCP","56","43520 → 9002 [ACK] Seq=26492 Ack=455492 Win=11903 Len=0"
"14.009593","5.9.29.183","172.19.0.3","TLSv1.2","1516","Application Data, Application Data"
"14.009649","5.9.29.183","172.19.0.3","TCP","1516","9002 → 43520 [PSH, ACK] Seq=456952 Ack=26492 Win=65535 Len=1460 [TCP segment of a reassembled PDU]"
"14.009664","172.19.0.3","5.9.29.183","TCP","56","43520 → 9002 [ACK] Seq=26492 Ack=458412 Win=11903 Len=0"
"14.009666","5.9.29.183","172.19.0.3","TCP","1480","9002 → 43520 [PSH, ACK] Seq=458412 Ack=26492 Win=65535 Len=1424 [TCP segment of a reassembled PDU]"
"14.009669","5.9.29.183","172.19.0.3","TLSv1.2","1516","Application Data [TCP segment of a reassembled PDU]"
"14.009733","5.9.29.183","172.19.0.3","TCP","1516","9002 → 43520 [PSH, ACK] Seq=461296 Ack=26492 Win=65535 Len=1460 [TCP segment of a reassembled PDU]"
"14.009738","5.9.29.183","172.19.0.3","TCP","1480","9002 → 43520 [PSH, ACK] Seq=462756 Ack=26492 Win=65535 Len=1424 [TCP segment of a reassembled PDU]"
"14.009777","172.19.0.3","5.9.29.183","TCP","56","43520 → 9002 [ACK] Seq=26492 Ack=464180 Win=11871 Len=0"
"14.011570","5.9.29.183","172.19.0.3","TLSv1.2","953","Application Data, Application Data"
"14.021825","5.9.29.183","172.19.0.3","TCP","1516","[TCP segment of a reassembled PDU]"
"14.021921","172.19.0.3","5.9.29.183","TCP","56","43520 → 9002 [ACK] Seq=26492 Ack=466537 Win=11911 Len=0"
"14.021972","5.9.29.183","172.19.0.3","TCP","1492","9002 → 43520 [PSH, ACK] Seq=466537 Ack=26492 Win=65535 Len=1436 [TCP segment of a reassembled PDU]"
"14.022061","5.9.29.183","172.19.0.3","TLSv1.2","1516","Application Data [TCP segment of a reassembled PDU]"
"14.022068","5.9.29.183","172.19.0.3","TCP","1516","9002 → 43520 [PSH, ACK] Seq=469433 Ack=26492 Win=65535 Len=1460 [TCP segment of a reassembled PDU]"
"14.022072","5.9.29.183","172.19.0.3","TCP","1480","9002 → 43520 [PSH, ACK] Seq=470893 Ack=26492 Win=65535 Len=1424 [TCP segment of a reassembled PDU]"
"14.022155","172.19.0.3","5.9.29.183","TCP","56","43520 → 9002 [ACK] Seq=26492 Ack=472317 Win=11877 Len=0"
"14.022413","172.19.0.3","5.9.29.183","TLSv1.2","599","Application Data"
"14.022651","5.9.29.183","172.19.0.3","TCP","56","9002 → 43520 [ACK] Seq=472317 Ack=27035 Win=65535 Len=0"
"14.024609","5.9.29.183","172.19.0.3","TLSv1.2","1504","Application Data [TCP segment of a reassembled PDU]"
"14.024658","5.9.29.183","172.19.0.3","TCP","1504","9002 → 43520 [PSH, ACK] Seq=473765 Ack=27035 Win=65535 Len=1448 [TCP segment of a reassembled PDU]"
"14.024671","172.19.0.3","5.9.29.183","TCP","56","43520 → 9002 [ACK] Seq=27035 Ack=475213 Win=11903 Len=0"
"14.024674","5.9.29.183","172.19.0.3","TCP","1516","9002 → 43520 [PSH, ACK] Seq=475213 Ack=27035 Win=65535 Len=1460 [TCP segment of a reassembled PDU]"
"14.024678","5.9.29.183","172.19.0.3","TLSv1.2","1516","Application Data [TCP segment of a reassembled PDU]"
"14.024740","5.9.29.183","172.19.0.3","TCP","1516","9002 → 43520 [PSH, ACK] Seq=478133 Ack=27035 Win=65535 Len=1460 [TCP segment of a reassembled PDU]"
"14.024744","5.9.29.183","172.19.0.3","TCP","1468","9002 → 43520 [PSH, ACK] Seq=479593 Ack=27035 Win=65535 Len=1412 [TCP segment of a reassembled PDU]"
"14.024752","172.19.0.3","5.9.29.183","TCP","56","43520 → 9002 [ACK] Seq=27035 Ack=478133 Win=11887 Len=0"
"14.024961","172.19.0.3","5.9.29.183","TCP","56","43520 → 9002 [ACK] Seq=27035 Ack=481005 Win=11871 Len=0"
"14.026460","5.9.29.183","172.19.0.3","TLSv1.2","721","Application Data, Application Data"
"14.036938","5.9.29.183","172.19.0.3","TCP","1504","[TCP segment of a reassembled PDU]"
"14.036956","172.19.0.3","5.9.29.183","TCP","56","43520 → 9002 [ACK] Seq=27035 Ack=483118 Win=11911 Len=0"
"14.036992","5.9.29.183","172.19.0.3","TCP","1504","9002 → 43520 [PSH, ACK] Seq=483118 Ack=27035 Win=65535 Len=1448 [TCP segment of a reassembled PDU]"
"14.041515","5.9.29.183","172.19.0.3","TLSv1.2","787","Application Data"
"14.041524","172.19.0.3","5.9.29.183","TCP","56","43520 → 9002 [ACK] Seq=27035 Ack=485297 Win=11911 Len=0"
"14.049554","5.9.29.183","172.19.0.3","TCP","1504","[TCP segment of a reassembled PDU]"
"14.049618","5.9.29.183","172.19.0.3","TCP","1504","9002 → 43520 [PSH, ACK] Seq=486745 Ack=27035 Win=65535 Len=1448 [TCP segment of a reassembled PDU]"
"14.049738","172.19.0.3","5.9.29.183","TCP","56","43520 → 9002 [ACK] Seq=27035 Ack=488193 Win=11903 Len=0"
"14.056437","5.9.29.183","172.19.0.3","TLSv1.2","787","Application Data"
"14.058210","172.19.0.3","5.9.29.183","TLSv1.2","599","Application Data"
"14.058458","5.9.29.183","172.19.0.3","TCP","56","9002 → 43520 [ACK] Seq=488924 Ack=27578 Win=65535 Len=0"
"14.068129","172.19.0.3","5.9.29.183","TLSv1.2","599","Application Data"
"14.068344","5.9.29.183","172.19.0.3","TCP","56","9002 → 43520 [ACK] Seq=488924 Ack=28121 Win=65535 Len=0"
"14.071617","5.9.29.183","172.19.0.3","TLSv1.2","599","Application Data"
"14.111808","172.19.0.3","5.9.29.183","TCP","56","43520 → 9002 [ACK] Seq=28121 Ack=489467 Win=11911 Len=0"
"14.427552","5.9.29.183","172.19.0.3","TLSv1.2","599","Application Data"
"14.427637","172.19.0.3","5.9.29.183","TCP","56","43520 → 9002 [ACK] Seq=28121 Ack=490010 Win=11911 Len=0"
"14.428485","172.19.0.3","5.9.29.183","TLSv1.2","599","Application Data"
"14.428939","5.9.29.183","172.19.0.3","TCP","56","9002 → 43520 [ACK] Seq=490010 Ack=28664 Win=65535 Len=0"
"14.657994","5.9.29.183","172.19.0.3","TLSv1.2","599","Application Data"
"14.679611","5.9.29.183","172.19.0.3","TCP","1516","[TCP segment of a reassembled PDU]"
"14.679634","172.19.0.3","5.9.29.183","TCP","56","43520 → 9002 [ACK] Seq=28664 Ack=492013 Win=11911 Len=0"
"14.679685","5.9.29.183","172.19.0.3","TCP","1492","9002 → 43520 [PSH, ACK] Seq=492013 Ack=28664 Win=65535 Len=1436 [TCP segment of a reassembled PDU]"
"14.679700","5.9.29.183","172.19.0.3","TLSv1.2","1516","Application Data [TCP segment of a reassembled PDU]"
"14.679704","5.9.29.183","172.19.0.3","TCP","1516","9002 → 43520 [PSH, ACK] Seq=494909 Ack=28664 Win=65535 Len=1460 [TCP segment of a reassembled PDU]"
"14.679707","5.9.29.183","172.19.0.3","TCP","1516","9002 → 43520 [PSH, ACK] Seq=496369 Ack=28664 Win=65535 Len=1460 [TCP segment of a reassembled PDU]"
"14.679826","5.9.29.183","172.19.0.3","TLSv1.2","1201","Application Data [TCP segment of a reassembled PDU]"
"14.679831","5.9.29.183","172.19.0.3","TCP","831","9002 → 43520 [PSH, ACK] Seq=498974 Ack=28664 Win=65535 Len=775 [TCP segment of a reassembled PDU]"
"14.679832","5.9.29.183","172.19.0.3","TCP","1516","9002 → 43520 [PSH, ACK] Seq=499749 Ack=28664 Win=65535 Len=1460 [TCP segment of a reassembled PDU]"
"14.679834","5.9.29.183","172.19.0.3","TCP","717","9002 → 43520 [PSH, ACK] Seq=501209 Ack=28664 Win=65535 Len=661 [TCP segment of a reassembled PDU]"
"14.679849","172.19.0.3","5.9.29.183","TCP","56","43520 → 9002 [ACK] Seq=28664 Ack=497829 Win=11879 Len=0"
"14.679929","172.19.0.3","5.9.29.183","TCP","56","43520 → 9002 [ACK] Seq=28664 Ack=501870 Win=11848 Len=0"
"14.680184","172.19.0.3","5.9.29.183","TLSv1.2","599","Application Data"
"14.680436","5.9.29.183","172.19.0.3","TCP","56","9002 → 43520 [ACK] Seq=501870 Ack=29207 Win=65535 Len=0"
"14.691207","5.9.29.183","172.19.0.3","TLSv1.2","1516","Application Data [TCP segment of a reassembled PDU]"
"14.691282","5.9.29.183","172.19.0.3","TCP","1492","9002 → 43520 [PSH, ACK] Seq=503330 Ack=29207 Win=65535 Len=1436 [TCP segment of a reassembled PDU]"
"14.691303","172.19.0.3","5.9.29.183","TCP","56","43520 → 9002 [ACK] Seq=29207 Ack=504766 Win=11903 Len=0"
"14.695041","5.9.29.183","172.19.0.3","TCP","1516","9002 → 43520 [PSH, ACK] Seq=504766 Ack=29207 Win=65535 Len=1460 [TCP segment of a reassembled PDU]"
"14.695094","5.9.29.183","172.19.0.3","TLSv1.2","1516","Application Data [TCP segment of a reassembled PDU]"
"14.695161","172.19.0.3","5.9.29.183","TCP","56","43520 → 9002 [ACK] Seq=29207 Ack=507686 Win=11903 Len=0"
"14.695166","5.9.29.183","172.19.0.3","TCP","1516","9002 → 43520 [PSH, ACK] Seq=507686 Ack=29207 Win=65535 Len=1460 [TCP segment of a reassembled PDU]"
"14.695236","5.9.29.183","172.19.0.3","TCP","1468","9002 → 43520 [PSH, ACK] Seq=509146 Ack=29207 Win=65535 Len=1412 [TCP segment of a reassembled PDU]"
"14.695240","5.9.29.183","172.19.0.3","TLSv1.2","1516","Application Data [TCP segment of a reassembled PDU]"
"14.695307","5.9.29.183","172.19.0.3","TCP","1516","9002 → 43520 [PSH, ACK] Seq=512018 Ack=29207 Win=65535 Len=1460 [TCP segment of a reassembled PDU]"
"14.695312","5.9.29.183","172.19.0.3","TLSv1.2","1516","Application Data [TCP segment of a reassembled PDU]"
"14.695314","5.9.29.183","172.19.0.3","TCP","1516","9002 → 43520 [PSH, ACK] Seq=514938 Ack=29207 Win=65535 Len=1460 [TCP segment of a reassembled PDU]"
"14.695362","5.9.29.183","172.19.0.3","TCP","1516","9002 → 43520 [PSH, ACK] Seq=516398 Ack=29207 Win=65535 Len=1460 [TCP segment of a reassembled PDU]"
"14.695366","5.9.29.183","172.19.0.3","TLSv1.2","196","Application Data"
"14.695445","172.19.0.3","5.9.29.183","TCP","56","43520 → 9002 [ACK] Seq=29207 Ack=517998 Win=11838 Len=0"
"14.696012","172.19.0.3","5.9.29.183","TLSv1.2","599","Application Data"
"14.696214","5.9.29.183","172.19.0.3","TCP","56","9002 → 43520 [ACK] Seq=517998 Ack=29750 Win=65535 Len=0"
"14.703201","5.9.29.183","172.19.0.3","TCP","1516","[TCP segment of a reassembled PDU]"
"14.703265","5.9.29.183","172.19.0.3","TCP","1516","9002 → 43520 [PSH, ACK] Seq=519458 Ack=29750 Win=65535 Len=1460 [TCP segment of a reassembled PDU]"
"14.703272","5.9.29.183","172.19.0.3","TLSv1.2","1480","Application Data [TCP segment of a reassembled PDU]"
"14.703406","172.19.0.3","5.9.29.183","TCP","56","43520 → 9002 [ACK] Seq=29750 Ack=522342 Win=11895 Len=0"
"14.711156","5.9.29.183","172.19.0.3","TLSv1.2","396","Application Data"
"14.738293","5.9.29.183","172.19.0.3","TCP","1516","[TCP segment of a reassembled PDU]"
"14.738318","172.19.0.3","5.9.29.183","TCP","56","43520 → 9002 [ACK] Seq=29750 Ack=524142 Win=11911 Len=0"
"14.738403","5.9.29.183","172.19.0.3","TCP","1492","9002 → 43520 [PSH, ACK] Seq=524142 Ack=29750 Win=65535 Len=1436 [TCP segment of a reassembled PDU]"
"14.738598","5.9.29.183","172.19.0.3","TLSv1.2","1516","Application Data [TCP segment of a reassembled PDU]"
"14.738837","5.9.29.183","172.19.0.3","TCP","1516","9002 → 43520 [PSH, ACK] Seq=527038 Ack=29750 Win=65535 Len=1460 [TCP segment of a reassembled PDU]"
"14.738848","5.9.29.183","172.19.0.3","TCP","1516","9002 → 43520 [PSH, ACK] Seq=528498 Ack=29750 Win=65535 Len=1460 [TCP segment of a reassembled PDU]"
"14.738856","5.9.29.183","172.19.0.3","TLSv1.2","1516","Application Data [TCP segment of a reassembled PDU]"
"14.738862","5.9.29.183","172.19.0.3","TCP","1516","9002 → 43520 [PSH, ACK] Seq=531418 Ack=29750 Win=65535 Len=1460 [TCP segment of a reassembled PDU]"
"14.738867","5.9.29.183","172.19.0.3","TCP","1516","9002 → 43520 [PSH, ACK] Seq=532878 Ack=29750 Win=65535 Len=1460 [TCP segment of a reassembled PDU]"
"14.738929","5.9.29.183","172.19.0.3","TLSv1.2","1165","Application Data [TCP segment of a reassembled PDU]"
"14.738967","172.19.0.3","5.9.29.183","TCP","56","43520 → 9002 [ACK] Seq=29750 Ack=535447 Win=11845 Len=0"
"14.755757","5.9.29.183","172.19.0.3","TLSv1.2","1285","Application Data"
"14.760025","172.19.0.3","5.9.29.183","TLSv1.2","599","Application Data"
"14.760350","5.9.29.183","172.19.0.3","TCP","56","9002 → 43520 [ACK] Seq=536676 Ack=30293 Win=65535 Len=0"
"15.845633","5.9.29.183","172.19.0.3","TLSv1.2","599","Application Data"
"15.846398","172.19.0.3","5.9.29.183","TLSv1.2","599","Application Data"
"15.846726","5.9.29.183","172.19.0.3","TCP","56","9002 → 43520 [ACK] Seq=537219 Ack=30836 Win=65535 Len=0"
"16.083609","5.9.29.183","172.19.0.3","TCP","1516","[TCP segment of a reassembled PDU]"
"16.083748","5.9.29.183","172.19.0.3","TCP","1516","9002 → 43520 [PSH, ACK] Seq=538679 Ack=30836 Win=65535 Len=1460 [TCP segment of a reassembled PDU]"
"16.083759","5.9.29.183","172.19.0.3","TLSv1.2","763","Application Data"
"16.083826","172.19.0.3","5.9.29.183","TCP","56","43520 → 9002 [ACK] Seq=30836 Ack=540846 Win=11895 Len=0"
"16.119341","5.9.29.183","172.19.0.3","TCP","1504","[TCP segment of a reassembled PDU]"
"16.119408","5.9.29.183","172.19.0.3","TCP","1516","9002 → 43520 [PSH, ACK] Seq=542294 Ack=30836 Win=65535 Len=1460 [TCP segment of a reassembled PDU]"
"16.119426","172.19.0.3","5.9.29.183","TCP","56","43520 → 9002 [ACK] Seq=30836 Ack=543754 Win=11903 Len=0"
"16.119672","5.9.29.183","172.19.0.3","TLSv1.2","1516","Application Data [TCP segment of a reassembled PDU]"
"16.119686","5.9.29.183","172.19.0.3","TCP","1516","9002 → 43520 [PSH, ACK] Seq=545214 Ack=30836 Win=65535 Len=1460 [TCP segment of a reassembled PDU]"
"16.119697","172.19.0.3","5.9.29.183","TCP","56","43520 → 9002 [ACK] Seq=30836 Ack=546674 Win=11903 Len=0"
"16.119792","5.9.29.183","172.19.0.3","TCP","1516","9002 → 43520 [PSH, ACK] Seq=546674 Ack=30836 Win=65535 Len=1460 [TCP segment of a reassembled PDU]"
"16.119800","5.9.29.183","172.19.0.3","TLSv1.2","1189","Application Data [TCP segment of a reassembled PDU]"
"16.119904","5.9.29.183","172.19.0.3","TCP","1516","9002 → 43520 [PSH, ACK] Seq=549267 Ack=30836 Win=65535 Len=1460 [TCP segment of a reassembled PDU]"
"16.119913","5.9.29.183","172.19.0.3","TCP","1492","9002 → 43520 [PSH, ACK] Seq=550727 Ack=30836 Win=65535 Len=1436 [TCP segment of a reassembled PDU]"
"16.119943","172.19.0.3","5.9.29.183","TCP","56","43520 → 9002 [ACK] Seq=30836 Ack=552163 Win=11871 Len=0"
"16.120229","172.19.0.3","5.9.29.183","TLSv1.2","599","Application Data"
"16.120443","5.9.29.183","172.19.0.3","TCP","56","9002 → 43520 [ACK] Seq=552163 Ack=31379 Win=65535 Len=0"
"16.132663","5.9.29.183","172.19.0.3","TLSv1.2","1516","Application Data [TCP segment of a reassembled PDU]"
"16.132742","5.9.29.183","172.19.0.3","TCP","1492","9002 → 43520 [PSH, ACK] Seq=553623 Ack=31379 Win=65535 Len=1436 [TCP segment of a reassembled PDU]"
"16.132765","172.19.0.3","5.9.29.183","TCP","56","43520 → 9002 [ACK] Seq=31379 Ack=555059 Win=11903 Len=0"
"16.134595","5.9.29.183","172.19.0.3","TLSv1.2","1516","Application Data [TCP segment of a reassembled PDU]"
"16.134651","5.9.29.183","172.19.0.3","TCP","1516","9002 → 43520 [PSH, ACK] Seq=556519 Ack=31379 Win=65535 Len=1460 [TCP segment of a reassembled PDU]"
"16.134666","172.19.0.3","5.9.29.183","TCP","56","43520 → 9002 [ACK] Seq=31379 Ack=557979 Win=11903 Len=0"
"16.134669","5.9.29.183","172.19.0.3","TCP","1480","9002 → 43520 [PSH, ACK] Seq=557979 Ack=31379 Win=65535 Len=1424 [TCP segment of a reassembled PDU]"
"16.134673","5.9.29.183","172.19.0.3","TLSv1.2","1205","Application Data, Application Data"
"16.134771","172.19.0.3","5.9.29.183","TCP","56","43520 → 9002 [ACK] Seq=31379 Ack=560552 Win=11887 Len=0"
"16.138765","172.19.0.3","5.9.29.183","TLSv1.2","599","Application Data"
"16.139050","5.9.29.183","172.19.0.3","TCP","56","9002 → 43520 [ACK] Seq=560552 Ack=31922 Win=65535 Len=0"
"16.374403","5.9.29.183","172.19.0.3","TLSv1.2","599","Application Data"
"16.375136","172.19.0.3","5.9.29.183","TLSv1.2","599","Application Data"
"16.375397","5.9.29.183","172.19.0.3","TCP","56","9002 → 43520 [ACK] Seq=561095 Ack=32465 Win=65535 Len=0"
"16.586158","5.9.29.183","172.19.0.3","TCP","1516","[TCP segment of a reassembled PDU]"
"16.586277","5.9.29.183","172.19.0.3","TCP","1516","9002 → 43520 [PSH, ACK] Seq=562555 Ack=32465 Win=65535 Len=1460 [TCP segment of a reassembled PDU]"
"16.586290","5.9.29.183","172.19.0.3","TLSv1.2","1213","Application Data"
"16.586293","5.9.29.183","172.19.0.3","TCP","169","[TCP segment of a reassembled PDU]"
"16.586319","5.9.29.183","172.19.0.3","TCP","1516","9002 → 43520 [PSH, ACK] Seq=565285 Ack=32465 Win=65535 Len=1460 [TCP segment of a reassembled PDU]"
"16.586324","5.9.29.183","172.19.0.3","TCP","1379","9002 → 43520 [PSH, ACK] Seq=566745 Ack=32465 Win=65535 Len=1323 [TCP segment of a reassembled PDU]"
"16.586415","172.19.0.3","5.9.29.183","TCP","56","43520 → 9002 [ACK] Seq=32465 Ack=568068 Win=11869 Len=0"
"16.599689","5.9.29.183","172.19.0.3","TLSv1.2","1516","Application Data [TCP segment of a reassembled PDU]"
"16.599752","5.9.29.183","172.19.0.3","TCP","1492","9002 → 43520 [PSH, ACK] Seq=569528 Ack=32465 Win=65535 Len=1436 [TCP segment of a reassembled PDU]"
"16.599769","172.19.0.3","5.9.29.183","TCP","56","43520 → 9002 [ACK] Seq=32465 Ack=570964 Win=11903 Len=0"
"16.599770","5.9.29.183","172.19.0.3","TCP","1504","9002 → 43520 [PSH, ACK] Seq=570964 Ack=32465 Win=65535 Len=1448 [TCP segment of a reassembled PDU]"
"16.610804","5.9.29.183","172.19.0.3","TLSv1.2","163","Application Data, Application Data"
"16.610829","172.19.0.3","5.9.29.183","TCP","56","43520 → 9002 [ACK] Seq=32465 Ack=572519 Win=11911 Len=0"
"16.638748","5.9.29.183","172.19.0.3","TCP","1516","[TCP segment of a reassembled PDU]"
"16.638803","5.9.29.183","172.19.0.3","TCP","1516","9002 → 43520 [PSH, ACK] Seq=573979 Ack=32465 Win=65535 Len=1460 [TCP segment of a reassembled PDU]"
"16.638810","5.9.29.183","172.19.0.3","TLSv1.2","763","Application Data"
"16.638939","172.19.0.3","5.9.29.183","TCP","56","43520 → 9002 [ACK] Seq=32465 Ack=576146 Win=11895 Len=0"
"16.650745","5.9.29.183","172.19.0.3","TCP","1516","[TCP segment of a reassembled PDU]"
"16.650811","5.9.29.183","172.19.0.3","TCP","1516","9002 → 43520 [PSH, ACK] Seq=577606 Ack=32465 Win=65535 Len=1460 [TCP segment of a reassembled PDU]"
"16.650829","172.19.0.3","5.9.29.183","TCP","56","43520 → 9002 [ACK] Seq=32465 Ack=579066 Win=11903 Len=0"
"16.650832","5.9.29.183","172.19.0.3","TLSv1.2","1480","Application Data [TCP segment of a reassembled PDU]"
"16.655000","5.9.29.183","172.19.0.3","TLSv1.2","1424","Application Data"
"16.655019","172.19.0.3","5.9.29.183","TCP","56","43520 → 9002 [ACK] Seq=32465 Ack=581858 Win=11911 Len=0"
"16.664744","5.9.29.183","172.19.0.3","TCP","1516","[TCP segment of a reassembled PDU]"
"16.664796","5.9.29.183","172.19.0.3","TCP","1516","9002 → 43520 [PSH, ACK] Seq=583318 Ack=32465 Win=65535 Len=1460 [TCP segment of a reassembled PDU]"
"16.664802","5.9.29.183","172.19.0.3","TLSv1.2","1516","Application Data [TCP segment of a reassembled PDU]"
"16.664804","5.9.29.183","172.19.0.3","TCP","1516","9002 → 43520 [PSH, ACK] Seq=586238 Ack=32465 Win=65535 Len=1460 [TCP segment of a reassembled PDU]"
"16.664817","5.9.29.183","172.19.0.3","TCP","1456","9002 → 43520 [PSH, ACK] Seq=587698 Ack=32465 Win=65535 Len=1400 [TCP segment of a reassembled PDU]"
"16.664943","172.19.0.3","5.9.29.183","TCP","56","43520 → 9002 [ACK] Seq=32465 Ack=589098 Win=11879 Len=0"
"16.673398","5.9.29.183","172.19.0.3","TLSv1.2","584","Application Data"
"16.673792","172.19.0.3","5.9.29.183","TLSv1.2","599","Application Data"
"16.674005","5.9.29.183","172.19.0.3","TCP","56","9002 → 43520 [ACK] Seq=589626 Ack=33008 Win=65535 Len=0"
"16.679801","5.9.29.183","172.19.0.3","TCP","1516","[TCP segment of a reassembled PDU]"
"16.679871","5.9.29.183","172.19.0.3","TCP","1492","9002 → 43520 [PSH, ACK] Seq=591086 Ack=33008 Win=65535 Len=1436 [TCP segment of a reassembled PDU]"
"16.680060","172.19.0.3","5.9.29.183","TCP","56","43520 → 9002 [ACK] Seq=33008 Ack=592522 Win=11903 Len=0"
"16.688962","5.9.29.183","172.19.0.3","TLSv1.2","1504","Application Data, Application Data"
"16.689260","5.9.29.183","172.19.0.3","TCP","1504","9002 → 43520 [PSH, ACK] Seq=593970 Ack=33008 Win=65535 Len=1448 [TCP segment of a reassembled PDU]"
"16.689274","172.19.0.3","5.9.29.183","TCP","56","43520 → 9002 [ACK] Seq=33008 Ack=595418 Win=11903 Len=0"
"16.689276","5.9.29.183","172.19.0.3","TCP","1516","9002 → 43520 [PSH, ACK] Seq=595418 Ack=33008 Win=65535 Len=1460 [TCP segment of a reassembled PDU]"
"16.689374","5.9.29.183","172.19.0.3","TLSv1.2","1516","Application Data [TCP segment of a reassembled PDU]"
"16.689379","5.9.29.183","172.19.0.3","TCP","1516","9002 → 43520 [PSH, ACK] Seq=598338 Ack=33008 Win=65535 Len=1460 [TCP segment of a reassembled PDU]"
"16.689403","5.9.29.183","172.19.0.3","TCP","1516","9002 → 43520 [PSH, ACK] Seq=599798 Ack=33008 Win=65535 Len=1460 [TCP segment of a reassembled PDU]"
"16.689433","5.9.29.183","172.19.0.3","TLSv1.2","1516","Application Data [TCP segment of a reassembled PDU]"
"16.689437","5.9.29.183","172.19.0.3","TCP","1516","9002 → 43520 [PSH, ACK] Seq=602718 Ack=33008 Win=65535 Len=1460 [TCP segment of a reassembled PDU]"
"16.689467","172.19.0.3","5.9.29.183","TCP","56","43520 → 9002 [ACK] Seq=33008 Ack=604178 Win=11855 Len=0"
"16.689485","5.9.29.183","172.19.0.3","TCP","1432","9002 → 43520 [PSH, ACK] Seq=604178 Ack=33008 Win=65535 Len=1376 [TCP segment of a reassembled PDU]"
"16.689874","172.19.0.3","5.9.29.183","TLSv1.2","599","Application Data"
"16.690074","5.9.29.183","172.19.0.3","TCP","56","9002 → 43520 [ACK] Seq=605554 Ack=33551 Win=65535 Len=0"
"16.696494","5.9.29.183","172.19.0.3","TLSv1.2","1504","Application Data [TCP segment of a reassembled PDU]"
"16.696549","5.9.29.183","172.19.0.3","TCP","1516","9002 → 43520 [PSH, ACK] Seq=607002 Ack=33551 Win=65535 Len=1460 [TCP segment of a reassembled PDU]"
"16.696564","172.19.0.3","5.9.29.183","TCP","56","43520 → 9002 [ACK] Seq=33551 Ack=608462 Win=11903 Len=0"
"16.696566","5.9.29.183","172.19.0.3","TLSv1.2","926","Application Data"
"16.700904","172.19.0.3","5.9.29.183","TLSv1.2","599","Application Data"
"16.701146","5.9.29.183","172.19.0.3","TCP","56","9002 → 43520 [ACK] Seq=609332 Ack=34094 Win=65535 Len=0"
"16.973930","5.9.29.183","172.19.0.3","TLSv1.2","599","Application Data"
"16.974866","172.19.0.3","5.9.29.183","TLSv1.2","599","Application Data"
"16.975242","5.9.29.183","172.19.0.3","TCP","56","9002 → 43520 [ACK] Seq=609875 Ack=34637 Win=65535 Len=0"
"17.165858","5.9.29.183","172.19.0.3","TLSv1.2","599","Application Data"
"17.200631","5.9.29.183","172.19.0.3","TCP","1516","[TCP segment of a reassembled PDU]"
"17.200707","172.19.0.3","5.9.29.183","TCP","56","43520 → 9002 [ACK] Seq=34637 Ack=611878 Win=11911 Len=0"
"17.200710","5.9.29.183","172.19.0.3","TCP","1492","9002 → 43520 [PSH, ACK] Seq=611878 Ack=34637 Win=65535 Len=1436 [TCP segment of a reassembled PDU]"
"17.200721","5.9.29.183","172.19.0.3","TLSv1.2","1516","Application Data [TCP segment of a reassembled PDU]"
"17.200724","5.9.29.183","172.19.0.3","TCP","1516","9002 → 43520 [PSH, ACK] Seq=614774 Ack=34637 Win=65535 Len=1460 [TCP segment of a reassembled PDU]"
"17.200812","5.9.29.183","172.19.0.3","TCP","1516","9002 → 43520 [PSH, ACK] Seq=616234 Ack=34637 Win=65535 Len=1460 [TCP segment of a reassembled PDU]"
"17.200818","5.9.29.183","172.19.0.3","TLSv1.2","1516","Application Data [TCP segment of a reassembled PDU]"
"17.200822","5.9.29.183","172.19.0.3","TCP","1516","9002 → 43520 [PSH, ACK] Seq=619154 Ack=34637 Win=65535 Len=1460 [TCP segment of a reassembled PDU]"
"17.200825","5.9.29.183","172.19.0.3","TCP","1177","9002 → 43520 [PSH, ACK] Seq=620614 Ack=34637 Win=65535 Len=1121 [TCP segment of a reassembled PDU]"
"17.200852","172.19.0.3","5.9.29.183","TCP","56","43520 → 9002 [ACK] Seq=34637 Ack=621735 Win=11855 Len=0"
"17.212734","5.9.29.183","172.19.0.3","TLSv1.2","1516","Application Data [TCP segment of a reassembled PDU]"
"17.212798","5.9.29.183","172.19.0.3","TCP","1492","9002 → 43520 [PSH, ACK] Seq=623195 Ack=34637 Win=65535 Len=1436 [TCP segment of a reassembled PDU]"
"17.212817","172.19.0.3","5.9.29.183","TCP","56","43520 → 9002 [ACK] Seq=34637 Ack=624631 Win=11901 Len=0"
"17.216306","5.9.29.183","172.19.0.3","TLSv1.2","1516","Application Data [TCP segment of a reassembled PDU]"
"17.216363","5.9.29.183","172.19.0.3","TCP","1492","9002 → 43520 [PSH, ACK] Seq=626091 Ack=34637 Win=65535 Len=1436 [TCP segment of a reassembled PDU]"
"17.216378","172.19.0.3","5.9.29.183","TCP","56","43520 → 9002 [ACK] Seq=34637 Ack=627527 Win=11903 Len=0"
"17.216380","5.9.29.183","172.19.0.3","TCP","1516","9002 → 43520 [PSH, ACK] Seq=627527 Ack=34637 Win=65535 Len=1460 [TCP segment of a reassembled PDU]"
"17.216383","5.9.29.183","172.19.0.3","TLSv1.2","1516","Application Data [TCP segment of a reassembled PDU]"
"17.216490","5.9.29.183","172.19.0.3","TCP","430","9002 → 43520 [PSH, ACK] Seq=630447 Ack=34637 Win=65535 Len=374 [TCP segment of a reassembled PDU]"
"17.216493","5.9.29.183","172.19.0.3","TCP","1516","9002 → 43520 [PSH, ACK] Seq=630821 Ack=34637 Win=65535 Len=1460 [TCP segment of a reassembled PDU]"
"17.216495","5.9.29.183","172.19.0.3","TCP","1516","9002 → 43520 [PSH, ACK] Seq=632281 Ack=34637 Win=65535 Len=1460 [TCP segment of a reassembled PDU]"
"17.216496","5.9.29.183","172.19.0.3","TLSv1.2","580","Application Data, Application Data"
"17.216502","172.19.0.3","5.9.29.183","TCP","56","43520 → 9002 [ACK] Seq=34637 Ack=630447 Win=11887 Len=0"
"17.216757","172.19.0.3","5.9.29.183","TCP","56","43520 → 9002 [ACK] Seq=34637 Ack=634265 Win=11858 Len=0"
"17.226913","5.9.29.183","172.19.0.3","TCP","1504","[TCP segment of a reassembled PDU]"
"17.227020","5.9.29.183","172.19.0.3","TCP","1504","9002 → 43520 [PSH, ACK] Seq=635713 Ack=34637 Win=65535 Len=1448 [TCP segment of a reassembled PDU]"
"17.227035","172.19.0.3","5.9.29.183","TCP","56","43520 → 9002 [ACK] Seq=34637 Ack=637161 Win=11903 Len=0"
"17.232066","5.9.29.183","172.19.0.3","TLSv1.2","787","Application Data"
"17.232507","172.19.0.3","5.9.29.183","TLSv1.2","599","Application Data"
"17.232852","5.9.29.183","172.19.0.3","TCP","56","9002 → 43520 [ACK] Seq=637892 Ack=35180 Win=65535 Len=0"
"17.237447","5.9.29.183","172.19.0.3","TCP","1504","[TCP segment of a reassembled PDU]"
"17.237665","5.9.29.183","172.19.0.3","TCP","1504","9002 → 43520 [PSH, ACK] Seq=639340 Ack=35180 Win=65535 Len=1448 [TCP segment of a reassembled PDU]"
"17.237735","5.9.29.183","172.19.0.3","TLSv1.2","1504","Application Data [TCP segment of a reassembled PDU]"
"17.237801","172.19.0.3","5.9.29.183","TCP","56","43520 → 9002 [ACK] Seq=35180 Ack=642236 Win=11895 Len=0"
"17.237983","5.9.29.183","172.19.0.3","TCP","1516","9002 → 43520 [PSH, ACK] Seq=642236 Ack=35180 Win=65535 Len=1460 [TCP segment of a reassembled PDU]"
"17.237993","5.9.29.183","172.19.0.3","TCP","1492","9002 → 43520 [PSH, ACK] Seq=643696 Ack=35180 Win=65535 Len=1436 [TCP segment of a reassembled PDU]"
"17.238040","172.19.0.3","5.9.29.183","TCP","56","43520 → 9002 [ACK] Seq=35180 Ack=645132 Win=11879 Len=0"
"17.238122","5.9.29.183","172.19.0.3","TLSv1.2","1516","Application Data [TCP segment of a reassembled PDU]"
"17.238129","5.9.29.183","172.19.0.3","TCP","1516","9002 → 43520 [PSH, ACK] Seq=646592 Ack=35180 Win=65535 Len=1460 [TCP segment of a reassembled PDU]"
"17.238137","172.19.0.3","5.9.29.183","TCP","56","43520 → 9002 [ACK] Seq=35180 Ack=648052 Win=11903 Len=0"
"17.238139","5.9.29.183","172.19.0.3","TCP","1516","9002 → 43520 [PSH, ACK] Seq=648052 Ack=35180 Win=65535 Len=1460 [TCP segment of a reassembled PDU]"
"17.238200","5.9.29.183","172.19.0.3","TLSv1.2","1516","Application Data [TCP segment of a reassembled PDU]"
"17.238206","5.9.29.183","172.19.0.3","TCP","1456","9002 → 43520 [PSH, ACK] Seq=650972 Ack=35180 Win=65535 Len=1400 [TCP segment of a reassembled PDU]"
"17.238299","172.19.0.3","5.9.29.183","TCP","56","43520 → 9002 [ACK] Seq=35180 Ack=652372 Win=11877 Len=0"
"17.247446","5.9.29.183","172.19.0.3","TLSv1.2","1112","Application Data"
"17.248008","172.19.0.3","5.9.29.183","TLSv1.2","599","Application Data"
"17.248321","5.9.29.183","172.19.0.3","TCP","56","9002 → 43520 [ACK] Seq=653428 Ack=35723 Win=65535 Len=0"
"17.257521","172.19.0.3","5.9.29.183","TLSv1.2","599","Application Data"
"17.257934","5.9.29.183","172.19.0.3","TCP","56","9002 → 43520 [ACK] Seq=653428 Ack=36266 Win=65535 Len=0"
"17.274827","5.9.29.183","172.19.0.3","TLSv1.2","599","Application Data"
"17.319836","172.19.0.3","5.9.29.183","TCP","56","43520 → 9002 [ACK] Seq=36266 Ack=653971 Win=11911 Len=0"
