_ws.col.Time,_ws.col.Source,_ws.col.Destination,_ws.col.Protocol,_ws.col.Length,_ws.col.Info
"0.000000","172.18.0.2","54.38.73.16","TLSv1.2","611","Application Data"
"0.025356","54.38.73.16","172.18.0.2","TCP","68","21002 → 36876 [ACK] Seq=1 Ack=544 Win=1452 Len=0 TSval=2677797744 TSecr=1094594249"
"0.328546","54.38.73.16","172.18.0.2","TLSv1.2","611","Application Data"
"0.328590","172.18.0.2","54.38.73.16","TCP","68","36876 → 21002 [ACK] Seq=544 Ack=544 Win=5608 Len=0 TSval=1094594578 TSecr=2677797798"
"0.329759","172.18.0.2","54.38.73.16","TCP","1516","[TCP segment of a reassembled PDU]"
"0.329845","172.18.0.2","54.38.73.16","TLSv1.2","705","Application Data"
"0.354023","54.38.73.16","172.18.0.2","TCP","68","21002 → 36876 [ACK] Seq=544 Ack=1992 Win=1450 Len=0 TSval=2677797827 TSecr=1094594579"
"0.354047","54.38.73.16","172.18.0.2","TCP","68","21002 → 36876 [ACK] Seq=544 Ack=2629 Win=1452 Len=0 TSval=2677797827 TSecr=1094594579"
"0.738767","54.38.73.16","172.18.0.2","TLSv1.2","611","Application Data"
"0.738805","172.18.0.2","54.38.73.16","TCP","68","36876 → 21002 [ACK] Seq=2629 Ack=1087 Win=5608 Len=0 TSval=1094594988 TSecr=2677797911"
"0.833345","54.38.73.16","172.18.0.2","TLSv1.2","1125","Application Data"
"0.833367","172.18.0.2","54.38.73.16","TCP","68","36876 → 21002 [ACK] Seq=2629 Ack=2144 Win=5600 Len=0 TSval=1094595082 TSecr=2677797946"
"0.839047","172.18.0.2","54.38.73.16","TLSv1.2","611","Application Data"
"0.864922","54.38.73.16","172.18.0.2","TCP","68","21002 → 36876 [ACK] Seq=2144 Ack=3172 Win=1452 Len=0 TSval=2677797954 TSecr=1094595088"
"1.160211","54.38.73.16","172.18.0.2","TLSv1.2","611","Application Data"
"1.161232","172.18.0.2","54.38.73.16","TLSv1.2","611","Application Data"
"1.184861","54.38.73.16","172.18.0.2","TCP","68","21002 → 36876 [ACK] Seq=2687 Ack=3715 Win=1452 Len=0 TSval=2677798034 TSecr=1094595410"
"1.378543","54.38.73.16","172.18.0.2","TLSv1.2","611","Application Data"
"1.410420","54.38.73.16","172.18.0.2","TCP","2964","[TCP segment of a reassembled PDU]"
"1.410464","172.18.0.2","54.38.73.16","TCP","68","36876 → 21002 [ACK] Seq=3715 Ack=6126 Win=5596 Len=0 TSval=1094595660 TSecr=2677798083"
"1.435194","54.38.73.16","172.18.0.2","TLSv1.2","799","Application Data"
"1.465124","54.38.73.16","172.18.0.2","TCP","2964","[TCP segment of a reassembled PDU]"
"1.465149","172.18.0.2","54.38.73.16","TCP","68","36876 → 21002 [ACK] Seq=3715 Ack=9753 Win=5596 Len=0 TSval=1094595714 TSecr=2677798097"
"1.474769","54.38.73.16","172.18.0.2","TLSv1.2","7308","Application Data, Application Data"
"1.474981","172.18.0.2","54.38.73.16","TCP","68","36876 → 21002 [ACK] Seq=3715 Ack=16993 Win=5565 Len=0 TSval=1094595724 TSecr=2677798107"
"1.475402","172.18.0.2","54.38.73.16","TLSv1.2","611","Application Data"
"1.485368","54.38.73.16","172.18.0.2","TLSv1.2","2964","Application Data [TCP segment of a reassembled PDU]"
"1.485394","172.18.0.2","54.38.73.16","TCP","68","36876 → 21002 [ACK] Seq=4258 Ack=19889 Win=5596 Len=0 TSval=1094595735 TSecr=2677798109"
"1.488964","54.38.73.16","172.18.0.2","TLSv1.2","2964","Application Data [TCP segment of a reassembled PDU]"
"1.488989","172.18.0.2","54.38.73.16","TCP","68","36876 → 21002 [ACK] Seq=4258 Ack=22785 Win=5596 Len=0 TSval=1094595738 TSecr=2677798110"
"1.495434","54.38.73.16","172.18.0.2","TCP","1516","21002 → 36876 [ACK] Seq=22785 Ack=3715 Win=1452 Len=1448 TSval=2677798112 TSecr=1094595714 [TCP segment of a reassembled PDU]"
"1.498711","54.38.73.16","172.18.0.2","TCP","68","[TCP Previous segment not captured] 21002 → 36876 [ACK] Seq=31473 Ack=4258 Win=1452 Len=0 TSval=2677798113 TSecr=1094595725"
"1.498773","54.38.73.16","172.18.0.2","TCP","7308","[TCP Retransmission] 21002 → 36876 [ACK] Seq=24233 Ack=3715 Win=1452 Len=7240 TSval=2677798113 TSecr=1094595724"
"1.498937","172.18.0.2","54.38.73.16","TCP","68","36876 → 21002 [ACK] Seq=4258 Ack=31473 Win=5573 Len=0 TSval=1094595748 TSecr=2677798112"
"1.499715","172.18.0.2","54.38.73.16","TLSv1.2","611","Application Data"
"1.508554","54.38.73.16","172.18.0.2","TLSv1.2","2964","Ignored Unknown Record"
"1.508579","172.18.0.2","54.38.73.16","TCP","68","36876 → 21002 [ACK] Seq=4801 Ack=34369 Win=5596 Len=0 TSval=1094595758 TSecr=2677798115"
"1.513001","54.38.73.16","172.18.0.2","TCP","2600","[TCP segment of a reassembled PDU]"
"1.513026","172.18.0.2","54.38.73.16","TCP","68","36876 → 21002 [ACK] Seq=4801 Ack=36901 Win=5597 Len=0 TSval=1094595762 TSecr=2677798116"
"1.561376","54.38.73.16","172.18.0.2","TCP","68","21002 → 36876 [ACK] Seq=36901 Ack=4801 Win=1452 Len=0 TSval=2677798129 TSecr=1094595749"
"1.561427","172.18.0.2","54.38.73.16","TLSv1.2","611","Application Data"
"1.585608","54.38.73.16","172.18.0.2","TCP","68","21002 → 36876 [ACK] Seq=36901 Ack=5344 Win=1452 Len=0 TSval=2677798134 TSecr=1094595811"
"1.865022","54.38.73.16","172.18.0.2","TCP","611","21002 → 36876 [PSH, ACK] Seq=36901 Ack=5344 Win=1452 Len=543 TSval=2677798196 TSecr=1094595811 [TCP segment of a reassembled PDU]"
"1.866094","172.18.0.2","54.38.73.16","TLSv1.2","611","Application Data"
"1.889798","54.38.73.16","172.18.0.2","TCP","68","21002 → 36876 [ACK] Seq=37444 Ack=5887 Win=1452 Len=0 TSval=2677798211 TSecr=1094596115"
"2.154996","54.38.73.16","172.18.0.2","TCP","3695","21002 → 36876 [PSH, ACK] Seq=37444 Ack=5887 Win=1452 Len=3627 TSval=2677798276 TSecr=1094596115 [TCP segment of a reassembled PDU]"
"2.155147","172.18.0.2","54.38.73.16","TCP","68","36876 → 21002 [ACK] Seq=5887 Ack=41071 Win=5584 Len=0 TSval=1094596404 TSecr=2677798276"
"2.165892","54.38.73.16","172.18.0.2","TCP","2964","21002 → 36876 [ACK] Seq=41071 Ack=5887 Win=1452 Len=2896 TSval=2677798279 TSecr=1094596115 [TCP segment of a reassembled PDU]"
"2.165917","172.18.0.2","54.38.73.16","TCP","68","36876 → 21002 [ACK] Seq=5887 Ack=43967 Win=5596 Len=0 TSval=1094596415 TSecr=2677798279"
"2.174183","54.38.73.16","172.18.0.2","TCP","7308","21002 → 36876 [ACK] Seq=43967 Ack=5887 Win=1452 Len=7240 TSval=2677798282 TSecr=1094596115 [TCP segment of a reassembled PDU]"
"2.174350","172.18.0.2","54.38.73.16","TCP","68","36876 → 21002 [ACK] Seq=5887 Ack=51207 Win=5565 Len=0 TSval=1094596423 TSecr=2677798282"
"2.179372","54.38.73.16","172.18.0.2","TCP","1870","21002 → 36876 [PSH, ACK] Seq=51207 Ack=5887 Win=1452 Len=1802 TSval=2677798283 TSecr=1094596404 [TCP segment of a reassembled PDU]"
"2.179396","172.18.0.2","54.38.73.16","TCP","68","36876 → 21002 [ACK] Seq=5887 Ack=53009 Win=5600 Len=0 TSval=1094596429 TSecr=2677798283"
"2.184322","54.38.73.16","172.18.0.2","TCP","1516","21002 → 36876 [ACK] Seq=53009 Ack=5887 Win=1452 Len=1448 TSval=2677798284 TSecr=1094596404 [TCP segment of a reassembled PDU]"
"2.191091","54.38.73.16","172.18.0.2","TCP","1516","21002 → 36876 [ACK] Seq=54457 Ack=5887 Win=1452 Len=1448 TSval=2677798286 TSecr=1094596415 [TCP segment of a reassembled PDU]"
"2.191263","172.18.0.2","54.38.73.16","TCP","68","36876 → 21002 [ACK] Seq=5887 Ack=55905 Win=5612 Len=0 TSval=1094596440 TSecr=2677798284"
"2.197784","172.18.0.2","193.111.115.210","TLSv1.2","611","Application Data"
"2.202838","54.38.73.16","172.18.0.2","TCP","1342","21002 → 36876 [PSH, ACK] Seq=55905 Ack=5887 Win=1452 Len=1274 TSval=2677798289 TSecr=1094596429 [TCP segment of a reassembled PDU]"
"2.205095","54.38.73.16","172.18.0.2","TCP","10204","21002 → 36876 [ACK] Seq=57179 Ack=5887 Win=1452 Len=10136 TSval=2677798289 TSecr=1094596429 [TCP segment of a reassembled PDU]"
"2.205267","172.18.0.2","54.38.73.16","TCP","68","36876 → 21002 [ACK] Seq=5887 Ack=67315 Win=5550 Len=0 TSval=1094596454 TSecr=2677798289"
"2.206214","172.18.0.2","54.38.73.16","TLSv1.2","1125","Application Data"
"2.215387","54.38.73.16","172.18.0.2","TCP","1516","21002 → 36876 [ACK] Seq=67315 Ack=5887 Win=1452 Len=1448 TSval=2677798292 TSecr=1094596440 [TCP segment of a reassembled PDU]"
"2.228158","54.38.73.16","172.18.0.2","TCP","1516","21002 → 36876 [ACK] Seq=68763 Ack=5887 Win=1452 Len=1448 TSval=2677798294 TSecr=1094596440 [TCP segment of a reassembled PDU]"
"2.228182","172.18.0.2","54.38.73.16","TCP","68","36876 → 21002 [ACK] Seq=6944 Ack=70211 Win=5593 Len=0 TSval=1094596477 TSecr=2677798292"
"2.228879","54.38.73.16","172.18.0.2","TCP","2964","21002 → 36876 [ACK] Seq=70211 Ack=5887 Win=1452 Len=2896 TSval=2677798295 TSecr=1094596454 [TCP segment of a reassembled PDU]"
"2.228902","172.18.0.2","54.38.73.16","TCP","68","36876 → 21002 [ACK] Seq=6944 Ack=73107 Win=5596 Len=0 TSval=1094596478 TSecr=2677798295"
"2.229586","54.38.73.16","172.18.0.2","TCP","733","21002 → 36876 [PSH, ACK] Seq=73107 Ack=5887 Win=1452 Len=665 TSval=2677798295 TSecr=1094596454 [TCP segment of a reassembled PDU]"
"2.229691","54.38.73.16","172.18.0.2","TCP","68","21002 → 36876 [ACK] Seq=73772 Ack=6944 Win=1452 Len=0 TSval=2677798296 TSecr=1094596455"
"2.235234","54.38.73.16","172.18.0.2","TLSv1.2","7308","Encrypted Handshake Message, Ignored Unknown Record"
"2.235406","172.18.0.2","54.38.73.16","TCP","68","36876 → 21002 [ACK] Seq=6944 Ack=81012 Win=5565 Len=0 TSval=1094596485 TSecr=2677798295"
"2.239060","193.111.115.210","172.18.0.2","TCP","68","443 → 49692 [ACK] Seq=1 Ack=544 Win=1452 Len=0 TSval=1321587822 TSecr=2015743744"
"2.254528","54.38.73.16","172.18.0.2","TLSv1.2","2964","Ignored Unknown Record"
"2.254552","172.18.0.2","54.38.73.16","TCP","68","36876 → 21002 [ACK] Seq=6944 Ack=83908 Win=5596 Len=0 TSval=1094596504 TSecr=2677798302"
"2.254572","54.38.73.16","172.18.0.2","TLSv1.2","2964","Ignored Unknown Record"
"2.254709","172.18.0.2","54.38.73.16","TCP","68","36876 → 21002 [ACK] Seq=6944 Ack=86804 Win=5581 Len=0 TSval=1094596504 TSecr=2677798302"
"2.259514","54.38.73.16","172.18.0.2","TLSv1.2","4715","Ignored Unknown Record"
"2.259538","172.18.0.2","54.38.73.16","TCP","68","36876 → 21002 [ACK] Seq=6944 Ack=91451 Win=5585 Len=0 TSval=1094596509 TSecr=2677798303"
"2.260015","172.18.0.2","54.38.73.16","TLSv1.2","611","Application Data"
"2.277118","54.38.73.16","172.18.0.2","TCP","2964","[TCP segment of a reassembled PDU]"
"2.277144","172.18.0.2","54.38.73.16","TCP","68","36876 → 21002 [ACK] Seq=7487 Ack=94347 Win=5596 Len=0 TSval=1094596526 TSecr=2677798307"
"2.279264","54.38.73.16","172.18.0.2","TLSv1.2","5860","Application Data, Application Data"
"2.279429","172.18.0.2","54.38.73.16","TCP","68","36876 → 21002 [ACK] Seq=7487 Ack=100139 Win=5581 Len=0 TSval=1094596529 TSecr=2677798308"
"2.283517","54.38.73.16","172.18.0.2","TLSv1.2","1747","Application Data"
"2.283542","172.18.0.2","54.38.73.16","TCP","68","36876 → 21002 [ACK] Seq=7487 Ack=101818 Win=5601 Len=0 TSval=1094596533 TSecr=2677798309"
"2.308627","54.38.73.16","172.18.0.2","TLSv1.2","2667","Application Data"
"2.308816","172.18.0.2","54.38.73.16","TCP","68","36876 → 21002 [ACK] Seq=7487 Ack=104417 Win=5597 Len=0 TSval=1094596558 TSecr=2677798315"
"2.319144","172.18.0.2","54.38.73.16","TLSv1.2","611","Application Data"
"2.381563","54.38.73.16","172.18.0.2","TCP","68","21002 → 36876 [ACK] Seq=104417 Ack=8030 Win=1452 Len=0 TSval=2677798334 TSecr=1094596568"
"2.684646","54.38.73.16","172.18.0.2","TLSv1.2","611","Application Data"
"2.685776","172.18.0.2","54.38.73.16","TLSv1.2","611","Application Data"
"2.710448","54.38.73.16","172.18.0.2","TCP","68","21002 → 36876 [ACK] Seq=104960 Ack=8573 Win=1452 Len=0 TSval=2677798416 TSecr=1094596935"
"3.161956","54.38.73.16","172.18.0.2","TLSv1.2","3695","Application Data"
"3.162102","172.18.0.2","54.38.73.16","TCP","68","36876 → 21002 [ACK] Seq=8573 Ack=108587 Win=5584 Len=0 TSval=1094597411 TSecr=2677798528"
"3.179939","54.38.73.16","172.18.0.2","TCP","2964","[TCP segment of a reassembled PDU]"
"3.179964","172.18.0.2","54.38.73.16","TCP","68","36876 → 21002 [ACK] Seq=8573 Ack=111483 Win=5596 Len=0 TSval=1094597429 TSecr=2677798533"
"3.186353","54.38.73.16","172.18.0.2","TLSv1.2","1342","Application Data, Application Data"
"3.188573","54.38.73.16","172.18.0.2","TLSv1.2","4412","Application Data"
"3.188746","172.18.0.2","54.38.73.16","TCP","68","36876 → 21002 [ACK] Seq=8573 Ack=117101 Win=5580 Len=0 TSval=1094597438 TSecr=2677798535"
"3.188972","54.38.73.16","172.18.0.2","TLSv1.2","5860","Application Data [TCP segment of a reassembled PDU]"
"3.189276","172.18.0.2","54.38.73.16","TLSv1.2","611","Application Data"
"3.203578","54.38.73.16","172.18.0.2","TLSv1.2","2964","Application Data, Application Data"
"3.203605","172.18.0.2","54.38.73.16","TCP","68","36876 → 21002 [ACK] Seq=9116 Ack=125789 Win=5596 Len=0 TSval=1094597453 TSecr=2677798539"
"3.214558","54.38.73.16","172.18.0.2","TLSv1.2","5860","Application Data [TCP segment of a reassembled PDU]"
"3.214595","54.38.73.16","172.18.0.2","TLSv1.2","5860","Application Data [TCP segment of a reassembled PDU]"
"3.214703","172.18.0.2","54.38.73.16","TCP","68","36876 → 21002 [ACK] Seq=9116 Ack=137373 Win=5551 Len=0 TSval=1094597464 TSecr=2677798541"
"3.215437","172.18.0.2","54.38.73.16","TLSv1.2","611","Application Data"
"3.228230","54.38.73.16","172.18.0.2","TLSv1.2","2964","Application Data, Application Data"
"3.228255","172.18.0.2","54.38.73.16","TCP","68","36876 → 21002 [ACK] Seq=9659 Ack=140269 Win=5596 Len=0 TSval=1094597477 TSecr=2677798545"
"3.240527","54.38.73.16","172.18.0.2","TLSv1.2","11652","Application Data, Application Data, Application Data"
"3.240559","54.38.73.16","172.18.0.2","TCP","1516","21002 → 36876 [ACK] Seq=151853 Ack=9659 Win=1452 Len=1448 TSval=2677798548 TSecr=1094597465 [TCP segment of a reassembled PDU]"
"3.240692","172.18.0.2","54.38.73.16","TCP","68","36876 → 21002 [ACK] Seq=9659 Ack=153301 Win=5535 Len=0 TSval=1094597490 TSecr=2677798548"
"3.253656","54.38.73.16","172.18.0.2","TLSv1.2","2964","Application Data [TCP segment of a reassembled PDU]"
"3.253682","172.18.0.2","54.38.73.16","TCP","68","36876 → 21002 [ACK] Seq=9659 Ack=156197 Win=5596 Len=0 TSval=1094597503 TSecr=2677798552"
"3.267004","54.38.73.16","172.18.0.2","TLSv1.2","11652","Application Data, Application Data, Application Data"
"3.267177","172.18.0.2","54.38.73.16","TCP","68","36876 → 21002 [ACK] Seq=9659 Ack=167781 Win=5551 Len=0 TSval=1094597516 TSecr=2677798554"
"3.267588","172.18.0.2","54.38.73.16","TLSv1.2","611","Application Data"
"3.272459","54.38.73.16","172.18.0.2","TLSv1.2","1516","Application Data, Application Data"
"3.281109","54.38.73.16","172.18.0.2","TCP","1516","21002 → 36876 [ACK] Seq=169229 Ack=9659 Win=1452 Len=1448 TSval=2677798558 TSecr=1094597503 [TCP segment of a reassembled PDU]"
"3.281133","172.18.0.2","54.38.73.16","TCP","68","36876 → 21002 [ACK] Seq=10202 Ack=170677 Win=5593 Len=0 TSval=1094597530 TSecr=2677798556"
"3.297374","54.38.73.16","172.18.0.2","TLSv1.2","4412","Application Data [TCP segment of a reassembled PDU]"
"3.297570","172.18.0.2","54.38.73.16","TCP","68","36876 → 21002 [ACK] Seq=10202 Ack=175021 Win=5580 Len=0 TSval=1094597547 TSecr=2677798562"
"3.297579","54.38.73.16","172.18.0.2","TLSv1.2","3691","Application Data, Application Data, Application Data"
"3.297927","172.18.0.2","54.38.73.16","TCP","68","36876 → 21002 [ACK] Seq=10202 Ack=178644 Win=5552 Len=0 TSval=1094597547 TSecr=2677798562"
"3.333098","54.38.73.16","172.18.0.2","TCP","68","21002 → 36876 [ACK] Seq=178644 Ack=10202 Win=1452 Len=0 TSval=2677798572 TSecr=1094597517"
"3.333144","172.18.0.2","54.38.73.16","TLSv1.2","1154","Application Data, Application Data"
"3.394287","54.38.73.16","172.18.0.2","TCP","68","21002 → 36876 [ACK] Seq=178644 Ack=11288 Win=1452 Len=0 TSval=2677798587 TSecr=1094597582"
"3.707723","54.38.73.16","172.18.0.2","TLSv1.2","611","Application Data"
"3.708757","172.18.0.2","54.38.73.16","TLSv1.2","611","Application Data"
"3.732288","54.38.73.16","172.18.0.2","TCP","68","21002 → 36876 [ACK] Seq=179187 Ack=11831 Win=1452 Len=0 TSval=2677798671 TSecr=1094597958"
"3.986412","54.38.73.16","172.18.0.2","TLSv1.2","611","Application Data"
"4.006994","54.38.73.16","172.18.0.2","TCP","1516","[TCP segment of a reassembled PDU]"
"4.007134","172.18.0.2","54.38.73.16","TCP","68","36876 → 21002 [ACK] Seq=11831 Ack=181178 Win=5597 Len=0 TSval=1094598256 TSecr=2677798734"
"4.007285","54.38.73.16","172.18.0.2","TCP","1516","21002 → 36876 [ACK] Seq=181178 Ack=11831 Win=1452 Len=1448 TSval=2677798740 TSecr=1094597958 [TCP segment of a reassembled PDU]"
"4.028318","54.38.73.16","172.18.0.2","TLSv1.2","4412","Application Data [TCP segment of a reassembled PDU]"
"4.028486","172.18.0.2","54.38.73.16","TCP","68","36876 → 21002 [ACK] Seq=11831 Ack=186970 Win=5580 Len=0 TSval=1094598278 TSecr=2677798740"
"4.030308","54.38.73.16","172.18.0.2","TLSv1.2","82","Application Data"
"4.061817","54.38.73.16","172.18.0.2","TCP","2964","[TCP segment of a reassembled PDU]"
"4.061842","172.18.0.2","54.38.73.16","TCP","68","36876 → 21002 [ACK] Seq=11831 Ack=189880 Win=5596 Len=0 TSval=1094598311 TSecr=2677798746"
"4.072745","54.38.73.16","172.18.0.2","TLSv1.2","4412","Application Data [TCP segment of a reassembled PDU]"
"4.072915","172.18.0.2","54.38.73.16","TCP","68","36876 → 21002 [ACK] Seq=11831 Ack=194224 Win=5580 Len=0 TSval=1094598322 TSecr=2677798756"
"4.085238","54.38.73.16","172.18.0.2","TLSv1.2","1516","Application Data, Application Data"
"4.086845","54.38.73.16","172.18.0.2","TLSv1.2","234","Application Data"
"4.086871","172.18.0.2","54.38.73.16","TCP","68","36876 → 21002 [ACK] Seq=11831 Ack=195838 Win=5593 Len=0 TSval=1094598336 TSecr=2677798759"
"4.115090","54.38.73.16","172.18.0.2","TLSv1.2","3695","Application Data"
"4.115269","172.18.0.2","54.38.73.16","TCP","68","36876 → 21002 [ACK] Seq=11831 Ack=199465 Win=5580 Len=0 TSval=1094598364 TSecr=2677798767"
"4.123630","54.38.73.16","172.18.0.2","TCP","1516","[TCP segment of a reassembled PDU]"
"4.124019","54.38.73.16","172.18.0.2","TCP","1516","21002 → 36876 [ACK] Seq=200913 Ack=11831 Win=1452 Len=1448 TSval=2677798769 TSecr=1094598336 [TCP segment of a reassembled PDU]"
"4.124039","172.18.0.2","54.38.73.16","TCP","68","36876 → 21002 [ACK] Seq=11831 Ack=202361 Win=5593 Len=0 TSval=1094598373 TSecr=2677798769"
"4.133993","54.38.73.16","172.18.0.2","TLSv1.2","4412","Application Data [TCP segment of a reassembled PDU]"
"4.134162","172.18.0.2","54.38.73.16","TCP","68","36876 → 21002 [ACK] Seq=11831 Ack=206705 Win=5580 Len=0 TSval=1094598383 TSecr=2677798772"
"4.139748","54.38.73.16","172.18.0.2","TLSv1.2","1139","Application Data, Application Data"
"4.140228","172.18.0.2","54.38.73.16","TLSv1.2","611","Application Data"
"4.146548","54.38.73.16","172.18.0.2","TLSv1.2","5860","Application Data"
"4.146691","172.18.0.2","54.38.73.16","TCP","68","36876 → 21002 [ACK] Seq=12374 Ack=213568 Win=5581 Len=0 TSval=1094598396 TSecr=2677798775"
"4.148741","54.38.73.16","172.18.0.2","TLSv1.2","2964","Application Data [TCP segment of a reassembled PDU]"
"4.148766","172.18.0.2","54.38.73.16","TCP","68","36876 → 21002 [ACK] Seq=12374 Ack=216464 Win=5596 Len=0 TSval=1094598398 TSecr=2677798775"
"4.161078","54.38.73.16","172.18.0.2","TLSv1.2","2964","Application Data [TCP segment of a reassembled PDU]"
"4.161103","172.18.0.2","54.38.73.16","TCP","68","36876 → 21002 [ACK] Seq=12374 Ack=219360 Win=5596 Len=0 TSval=1094598410 TSecr=2677798778"
"4.164526","54.38.73.16","172.18.0.2","TLSv1.2","2964","Application Data [TCP segment of a reassembled PDU]"
"4.164558","172.18.0.2","54.38.73.16","TCP","68","36876 → 21002 [ACK] Seq=12374 Ack=222256 Win=5596 Len=0 TSval=1094598414 TSecr=2677798779"
"4.165053","172.18.0.2","54.38.73.16","TLSv1.2","611","Application Data"
"4.170566","54.38.73.16","172.18.0.2","TLSv1.2","5860","Application Data, Application Data"
"4.170738","172.18.0.2","54.38.73.16","TCP","68","36876 → 21002 [ACK] Seq=12917 Ack=228048 Win=5581 Len=0 TSval=1094598420 TSecr=2677798781"
"4.172397","54.38.73.16","172.18.0.2","TLSv1.2","2964","Application Data [TCP segment of a reassembled PDU]"
"4.172422","172.18.0.2","54.38.73.16","TCP","68","36876 → 21002 [ACK] Seq=12917 Ack=230944 Win=5596 Len=0 TSval=1094598422 TSecr=2677798781"
"4.178341","54.38.73.16","172.18.0.2","TCP","1516","21002 → 36876 [ACK] Seq=230944 Ack=12374 Win=1452 Len=1448 TSval=2677798783 TSecr=1094598398 [TCP segment of a reassembled PDU]"
"4.184732","54.38.73.16","172.18.0.2","TCP","1516","21002 → 36876 [ACK] Seq=232392 Ack=12374 Win=1452 Len=1448 TSval=2677798784 TSecr=1094598410 [TCP segment of a reassembled PDU]"
"4.184907","172.18.0.2","54.38.73.16","TCP","68","36876 → 21002 [ACK] Seq=12917 Ack=233840 Win=5612 Len=0 TSval=1094598434 TSecr=2677798783"
"4.189129","54.38.73.16","172.18.0.2","TLSv1.2","5860","Application Data, Application Data"
"4.189299","172.18.0.2","54.38.73.16","TCP","68","36876 → 21002 [ACK] Seq=12917 Ack=239632 Win=5581 Len=0 TSval=1094598438 TSecr=2677798785"
"4.194385","54.38.73.16","172.18.0.2","TLSv1.2","3997","Application Data, Application Data"
"4.194419","172.18.0.2","54.38.73.16","TLSv1.2","611","Application Data"
"4.221209","54.38.73.16","172.18.0.2","TLSv1.2","2153","Application Data"
"4.221240","172.18.0.2","54.38.73.16","TCP","68","36876 → 21002 [ACK] Seq=13460 Ack=245646 Win=5599 Len=0 TSval=1094598470 TSecr=2677798793"
"4.231305","172.18.0.2","54.38.73.16","TLSv1.2","611","Application Data"
"4.293576","54.38.73.16","172.18.0.2","TCP","68","21002 → 36876 [ACK] Seq=245646 Ack=14003 Win=1452 Len=0 TSval=2677798812 TSecr=1094598480"
"4.629374","54.38.73.16","172.18.0.2","TLSv1.2","611","Application Data"
"4.630473","172.18.0.2","54.38.73.16","TLSv1.2","611","Application Data"
"4.655250","54.38.73.16","172.18.0.2","TCP","68","21002 → 36876 [ACK] Seq=246189 Ack=14546 Win=1452 Len=0 TSval=2677798902 TSecr=1094598880"
"4.887105","54.38.73.16","172.18.0.2","TLSv1.2","3695","Application Data"
"4.887288","172.18.0.2","54.38.73.16","TCP","68","36876 → 21002 [ACK] Seq=14546 Ack=249816 Win=5584 Len=0 TSval=1094599136 TSecr=2677798959"
"4.894763","54.38.73.16","172.18.0.2","TCP","1516","[TCP segment of a reassembled PDU]"
"4.895409","54.38.73.16","172.18.0.2","TCP","1516","21002 → 36876 [ACK] Seq=251264 Ack=14546 Win=1452 Len=1448 TSval=2677798962 TSecr=1094598880 [TCP segment of a reassembled PDU]"
"4.895435","172.18.0.2","54.38.73.16","TCP","68","36876 → 21002 [ACK] Seq=14546 Ack=252712 Win=5593 Len=0 TSval=1094599145 TSecr=2677798962"
"4.905362","54.38.73.16","172.18.0.2","TLSv1.2","4412","Application Data [TCP segment of a reassembled PDU]"
"4.905569","172.18.0.2","54.38.73.16","TCP","68","36876 → 21002 [ACK] Seq=14546 Ack=257056 Win=5580 Len=0 TSval=1094599155 TSecr=2677798964"
"4.910235","54.38.73.16","172.18.0.2","TLSv1.2","82","Application Data"
"4.916434","54.38.73.16","172.18.0.2","TCP","2964","[TCP segment of a reassembled PDU]"
"4.916460","172.18.0.2","54.38.73.16","TCP","68","36876 → 21002 [ACK] Seq=14546 Ack=259966 Win=5596 Len=0 TSval=1094599166 TSecr=2677798966"
"4.926223","54.38.73.16","172.18.0.2","TLSv1.2","7308","Application Data, Application Data, Application Data"
"4.926392","172.18.0.2","54.38.73.16","TCP","68","36876 → 21002 [ACK] Seq=14546 Ack=267206 Win=5565 Len=0 TSval=1094599175 TSecr=2677798970"
"4.929417","54.38.73.16","172.18.0.2","TLSv1.2","2964","Application Data [TCP segment of a reassembled PDU]"
"4.929442","172.18.0.2","54.38.73.16","TCP","68","36876 → 21002 [ACK] Seq=14546 Ack=270102 Win=5596 Len=0 TSval=1094599179 TSecr=2677798971"
"4.942262","54.38.73.16","172.18.0.2","TLSv1.2","2601","Application Data"
"4.942288","172.18.0.2","54.38.73.16","TCP","68","36876 → 21002 [ACK] Seq=14546 Ack=272635 Win=5597 Len=0 TSval=1094599191 TSecr=2677798973"
"4.942733","172.18.0.2","54.38.73.16","TLSv1.2","611","Application Data"
"4.947484","54.38.73.16","172.18.0.2","TCP","2964","[TCP segment of a reassembled PDU]"
"4.947653","172.18.0.2","54.38.73.16","TCP","68","36876 → 21002 [ACK] Seq=15089 Ack=275531 Win=5596 Len=0 TSval=1094599197 TSecr=2677798975"
"4.950821","54.38.73.16","172.18.0.2","TLSv1.2","1516","Application Data [TCP segment of a reassembled PDU]"
"4.958243","54.38.73.16","172.18.0.2","TLSv1.2","5860","Application Data, Application Data"
"4.958382","172.18.0.2","54.38.73.16","TCP","68","36876 → 21002 [ACK] Seq=15089 Ack=282771 Win=5581 Len=0 TSval=1094599207 TSecr=2677798976"
"4.967936","54.38.73.16","172.18.0.2","TLSv1.2","328","Application Data"
"4.967971","54.38.73.16","172.18.0.2","TCP","68","21002 → 36876 [ACK] Seq=283031 Ack=15089 Win=1452 Len=0 TSval=2677798980 TSecr=1094599192"
"4.967994","172.18.0.2","54.38.73.16","TLSv1.2","611","Application Data"
"4.970359","54.38.73.16","172.18.0.2","TCP","2964","[TCP segment of a reassembled PDU]"
"4.970526","172.18.0.2","54.38.73.16","TCP","68","36876 → 21002 [ACK] Seq=15632 Ack=285927 Win=5596 Len=0 TSval=1094599220 TSecr=2677798980"
"4.992556","54.38.73.16","172.18.0.2","TLSv1.2","285","Application Data"
"5.001117","172.18.0.2","54.38.73.16","TLSv1.2","611","Application Data"
"5.062088","54.38.73.16","172.18.0.2","TCP","68","21002 → 36876 [ACK] Seq=286144 Ack=16175 Win=1452 Len=0 TSval=2677799004 TSecr=1094599250"
"5.448596","54.38.73.16","172.18.0.2","TLSv1.2","611","Application Data"
"5.449739","172.18.0.2","54.38.73.16","TLSv1.2","611","Application Data"
"5.476785","54.38.73.16","172.18.0.2","TCP","68","21002 → 36876 [ACK] Seq=286687 Ack=16718 Win=1452 Len=0 TSval=2677799107 TSecr=1094599699"
"5.775726","54.38.73.16","172.18.0.2","TLSv1.2","611","Application Data"
"5.797285","54.38.73.16","172.18.0.2","TCP","2964","[TCP segment of a reassembled PDU]"
"5.797467","172.18.0.2","54.38.73.16","TCP","68","36876 → 21002 [ACK] Seq=16718 Ack=290126 Win=5596 Len=0 TSval=1094600047 TSecr=2677799182"
"5.822105","54.38.73.16","172.18.0.2","TLSv1.2","799","Application Data"
"5.828741","54.38.73.16","172.18.0.2","TLSv1.2","7308","Application Data"
"5.828973","172.18.0.2","54.38.73.16","TCP","68","36876 → 21002 [ACK] Seq=16718 Ack=298097 Win=5565 Len=0 TSval=1094600078 TSecr=2677799194"
"5.839744","54.38.73.16","172.18.0.2","TLSv1.2","2964","Application Data [TCP segment of a reassembled PDU]"
"5.839769","172.18.0.2","54.38.73.16","TCP","68","36876 → 21002 [ACK] Seq=16718 Ack=300993 Win=5596 Len=0 TSval=1094600089 TSecr=2677799198"
"5.849850","54.38.73.16","172.18.0.2","TLSv1.2","2964","Application Data [TCP segment of a reassembled PDU]"
"5.849876","172.18.0.2","54.38.73.16","TCP","68","36876 → 21002 [ACK] Seq=16718 Ack=303889 Win=5596 Len=0 TSval=1094600099 TSecr=2677799201"
"5.852860","54.38.73.16","172.18.0.2","TLSv1.2","8756","Application Data, Application Data"
"5.852960","172.18.0.2","54.38.73.16","TCP","68","36876 → 21002 [ACK] Seq=16718 Ack=312577 Win=5566 Len=0 TSval=1094600102 TSecr=2677799201"
"5.860487","54.38.73.16","172.18.0.2","TCP","1516","21002 → 36876 [ACK] Seq=312577 Ack=16718 Win=1452 Len=1448 TSval=2677799203 TSecr=1094600078 [TCP segment of a reassembled PDU]"
"5.863735","54.38.73.16","172.18.0.2","TLSv1.2","2964","Application Data, Application Data"
"5.863752","172.18.0.2","54.38.73.16","TCP","68","36876 → 21002 [ACK] Seq=16718 Ack=316921 Win=5596 Len=0 TSval=1094600113 TSecr=2677799203"
"5.864257","172.18.0.2","54.38.73.16","TLSv1.2","611","Application Data"
"5.874929","54.38.73.16","172.18.0.2","TLSv1.2","2964","Application Data [TCP segment of a reassembled PDU]"
"5.874954","172.18.0.2","54.38.73.16","TCP","68","36876 → 21002 [ACK] Seq=17261 Ack=319817 Win=5596 Len=0 TSval=1094600124 TSecr=2677799207"
"5.877078","54.38.73.16","172.18.0.2","TLSv1.2","8756","Application Data, Application Data"
"5.877239","172.18.0.2","54.38.73.16","TCP","68","36876 → 21002 [ACK] Seq=17261 Ack=328505 Win=5566 Len=0 TSval=1094600126 TSecr=2677799207"
"5.888507","54.38.73.16","172.18.0.2","TLSv1.2","2964","Application Data [TCP segment of a reassembled PDU]"
"5.888533","172.18.0.2","54.38.73.16","TCP","68","36876 → 21002 [ACK] Seq=17261 Ack=331401 Win=5596 Len=0 TSval=1094600138 TSecr=2677799210"
"5.888924","54.38.73.16","172.18.0.2","TCP","68","21002 → 36876 [ACK] Seq=331401 Ack=17261 Win=1452 Len=0 TSval=2677799210 TSecr=1094600113"
"5.889064","172.18.0.2","54.38.73.16","TLSv1.2","611","Application Data"
"5.894235","54.38.73.16","172.18.0.2","TLSv1.2","1516","Application Data [TCP segment of a reassembled PDU]"
"5.898254","54.38.73.16","172.18.0.2","TCP","2964","21002 → 36876 [ACK] Seq=332849 Ack=17261 Win=1452 Len=2896 TSval=2677799213 TSecr=1094600124 [TCP segment of a reassembled PDU]"
"5.898278","172.18.0.2","54.38.73.16","TCP","68","36876 → 21002 [ACK] Seq=17804 Ack=335745 Win=5596 Len=0 TSval=1094600147 TSecr=2677799212"
"5.898563","54.38.73.16","172.18.0.2","TLSv1.2","1516","Application Data [TCP segment of a reassembled PDU]"
"5.901007","54.38.73.16","172.18.0.2","TLSv1.2","4568","Application Data, Application Data, Application Data"
"5.901167","172.18.0.2","54.38.73.16","TCP","68","36876 → 21002 [ACK] Seq=17804 Ack=341693 Win=5586 Len=0 TSval=1094600150 TSecr=2677799213"
"5.914325","172.18.0.2","54.38.73.16","TLSv1.2","1516","Application Data"
"5.927198","54.38.73.16","172.18.0.2","TLSv1.2","611","Application Data"
"5.927231","172.18.0.2","54.38.73.16","TLSv1.2","220","Application Data"
"5.951476","54.38.73.16","172.18.0.2","TCP","68","21002 → 36876 [ACK] Seq=342236 Ack=19404 Win=1452 Len=0 TSval=2677799226 TSecr=1094600163"
"6.267934","54.38.73.16","172.18.0.2","TLSv1.2","611","Application Data"
"6.268987","172.18.0.2","54.38.73.16","TLSv1.2","611","Application Data"
"6.329074","54.38.73.16","172.18.0.2","TCP","68","21002 → 36876 [ACK] Seq=342779 Ack=19947 Win=1452 Len=0 TSval=2677799321 TSecr=1094600518"
"6.487354","54.38.73.16","172.18.0.2","TLSv1.2","611","Application Data"
"6.527457","54.38.73.16","172.18.0.2","TCP","2964","[TCP segment of a reassembled PDU]"
"6.527501","172.18.0.2","54.38.73.16","TCP","68","36876 → 21002 [ACK] Seq=19947 Ack=346218 Win=5596 Len=0 TSval=1094600777 TSecr=2677799360"
"6.538624","54.38.73.16","172.18.0.2","TLSv1.2","4412","Application Data [TCP segment of a reassembled PDU]"
"6.538794","172.18.0.2","54.38.73.16","TCP","68","36876 → 21002 [ACK] Seq=19947 Ack=350562 Win=5580 Len=0 TSval=1094600788 TSecr=2677799373"
"6.550595","54.38.73.16","172.18.0.2","TLSv1.2","82","Application Data"
"6.569703","54.38.73.16","172.18.0.2","TLSv1.2","2964","Application Data"
"6.569729","172.18.0.2","54.38.73.16","TCP","68","36876 → 21002 [ACK] Seq=19947 Ack=353472 Win=5596 Len=0 TSval=1094600819 TSecr=2677799376"
"6.596056","54.38.73.16","172.18.0.2","TLSv1.2","828","Application Data"
"6.603072","172.18.0.2","54.38.73.16","TLSv1.2","611","Application Data"
"6.630082","54.38.73.16","172.18.0.2","TCP","68","21002 → 36876 [ACK] Seq=354232 Ack=20490 Win=1452 Len=0 TSval=2677799396 TSecr=1094600852"
"6.882904","54.38.73.16","172.18.0.2","TLSv1.2","611","Application Data"
"6.883842","172.18.0.2","54.38.73.16","TLSv1.2","611","Application Data"
"6.908749","54.38.73.16","172.18.0.2","TCP","68","21002 → 36876 [ACK] Seq=354775 Ack=21033 Win=1452 Len=0 TSval=2677799465 TSecr=1094601133"
