_ws.col.Time,_ws.col.Source,_ws.col.Destination,_ws.col.Protocol,_ws.col.Length,_ws.col.Info
"0.000000","172.18.0.2","54.38.73.16","TLSv1.2","611","Application Data"
"0.063444","54.38.73.16","172.18.0.2","TCP","68","21002 → 36876 [ACK] Seq=1 Ack=544 Win=1452 Len=0 TSval=2677095753 TSecr=1091786264"
"0.373435","54.38.73.16","172.18.0.2","TLSv1.2","611","Application Data"
"0.373457","172.18.0.2","54.38.73.16","TCP","68","36876 → 21002 [ACK] Seq=544 Ack=544 Win=5608 Len=0 TSval=1091786638 TSecr=2677095820"
"0.373840","172.18.0.2","54.38.73.16","TCP","1516","[TCP segment of a reassembled PDU]"
"0.373862","172.18.0.2","54.38.73.16","TLSv1.2","705","Application Data"
"0.397508","54.38.73.16","172.18.0.2","TCP","68","21002 → 36876 [ACK] Seq=544 Ack=2629 Win=1450 Len=0 TSval=2677095836 TSecr=1091786638"
"0.783496","54.38.73.16","172.18.0.2","TLSv1.2","611","Application Data"
"0.783552","172.18.0.2","54.38.73.16","TCP","68","36876 → 21002 [ACK] Seq=2629 Ack=1087 Win=5608 Len=0 TSval=1091787048 TSecr=2677095927"
"0.872666","54.38.73.16","172.18.0.2","TLSv1.2","1125","Application Data"
"0.872721","172.18.0.2","54.38.73.16","TCP","68","36876 → 21002 [ACK] Seq=2629 Ack=2144 Win=5600 Len=0 TSval=1091787137 TSecr=2677095955"
"0.878605","172.18.0.2","54.38.73.16","TLSv1.2","611","Application Data"
"0.902047","54.38.73.16","172.18.0.2","TCP","68","21002 → 36876 [ACK] Seq=2144 Ack=3172 Win=1452 Len=0 TSval=2677095962 TSecr=1091787143"
"1.192139","54.38.73.16","172.18.0.2","TLSv1.2","611","Application Data"
"1.192192","172.18.0.2","54.38.73.16","TCP","68","36876 → 21002 [ACK] Seq=3172 Ack=2687 Win=5608 Len=0 TSval=1091787457 TSecr=2677096024"
"1.193186","172.18.0.2","54.38.73.16","TLSv1.2","611","Application Data"
"1.217883","54.38.73.16","172.18.0.2","TCP","68","21002 → 36876 [ACK] Seq=2687 Ack=3715 Win=1452 Len=0 TSval=2677096041 TSecr=1091787458"
"1.535645","54.38.73.16","172.18.0.2","TLSv1.2","3695","Application Data"
"1.535833","172.18.0.2","54.38.73.16","TCP","68","36876 → 21002 [ACK] Seq=3715 Ack=6314 Win=5584 Len=0 TSval=1091787800 TSecr=2677096120"
"1.545172","54.38.73.16","172.18.0.2","TLSv1.2","7308","Application Data"
"1.545354","172.18.0.2","54.38.73.16","TCP","68","36876 → 21002 [ACK] Seq=3715 Ack=13554 Win=5565 Len=0 TSval=1091787810 TSecr=2677096123"
"1.555458","54.38.73.16","172.18.0.2","TLSv1.2","2964","Application Data [TCP segment of a reassembled PDU]"
"1.555491","172.18.0.2","54.38.73.16","TCP","68","36876 → 21002 [ACK] Seq=3715 Ack=16450 Win=5596 Len=0 TSval=1091787820 TSecr=2677096126"
"1.560572","54.38.73.16","172.18.0.2","TLSv1.2","5468","Application Data, Application Data"
"1.560786","172.18.0.2","54.38.73.16","TCP","68","36876 → 21002 [ACK] Seq=3715 Ack=21850 Win=5582 Len=0 TSval=1091787825 TSecr=2677096127"
"1.569150","54.38.73.16","172.18.0.2","TCP","2964","[TCP segment of a reassembled PDU]"
"1.569187","172.18.0.2","54.38.73.16","TCP","68","36876 → 21002 [ACK] Seq=3715 Ack=24746 Win=5596 Len=0 TSval=1091787834 TSecr=2677096128"
"1.569457","54.38.73.16","172.18.0.2","TLSv1.2","2964","Application Data [TCP segment of a reassembled PDU]"
"1.569483","172.18.0.2","54.38.73.16","TCP","68","36876 → 21002 [ACK] Seq=3715 Ack=27642 Win=5596 Len=0 TSval=1091787834 TSecr=2677096129"
"1.578755","54.38.73.16","172.18.0.2","TLSv1.2","5860","Application Data, Application Data"
"1.578917","172.18.0.2","54.38.73.16","TCP","68","36876 → 21002 [ACK] Seq=3715 Ack=33434 Win=5581 Len=0 TSval=1091787843 TSecr=2677096131"
"1.579297","172.18.0.2","54.38.73.16","TLSv1.2","611","Application Data"
"1.579905","54.38.73.16","172.18.0.2","TCP","2964","21002 → 36876 [ACK] Seq=33434 Ack=3715 Win=1452 Len=2896 TSval=2677096132 TSecr=1091787820 [TCP segment of a reassembled PDU]"
"1.579930","172.18.0.2","54.38.73.16","TCP","68","36876 → 21002 [ACK] Seq=4258 Ack=36330 Win=5596 Len=0 TSval=1091787844 TSecr=2677096132"
"1.584573","54.38.73.16","172.18.0.2","TLSv1.2","4780","Application Data, Application Data, Application Data"
"1.584746","172.18.0.2","54.38.73.16","TCP","68","36876 → 21002 [ACK] Seq=4258 Ack=41042 Win=5585 Len=0 TSval=1091787849 TSecr=2677096133"
"1.594241","54.38.73.16","172.18.0.2","TCP","2964","[TCP segment of a reassembled PDU]"
"1.594273","172.18.0.2","54.38.73.16","TCP","68","36876 → 21002 [ACK] Seq=4258 Ack=43938 Win=5596 Len=0 TSval=1091787859 TSecr=2677096135"
"1.594556","54.38.73.16","172.18.0.2","TLSv1.2","2964","Application Data [TCP segment of a reassembled PDU]"
"1.594591","172.18.0.2","54.38.73.16","TCP","68","36876 → 21002 [ACK] Seq=4258 Ack=46834 Win=5596 Len=0 TSval=1091787859 TSecr=2677096135"
"1.603939","54.38.73.16","172.18.0.2","TCP","68","[TCP Previous segment not captured] 21002 → 36876 [ACK] Seq=52626 Ack=4258 Win=1452 Len=0 TSval=2677096138 TSecr=1091787844"
"1.604007","172.18.0.2","54.38.73.16","TLSv1.2","611","Application Data"
"1.603966","54.38.73.16","172.18.0.2","TCP","5860","[TCP Retransmission] 21002 → 36876 [ACK] Seq=46834 Ack=3715 Win=1452 Len=5792 TSval=2677096138 TSecr=1091787843"
"1.603970","54.38.73.16","172.18.0.2","TLSv1.2","2964","Ignored Unknown Record"
"1.604194","172.18.0.2","54.38.73.16","TCP","68","36876 → 21002 [ACK] Seq=4801 Ack=55522 Win=5557 Len=0 TSval=1091787869 TSecr=2677096138"
"1.608565","54.38.73.16","172.18.0.2","TLSv1.2","6322","Ignored Unknown Record"
"1.608599","172.18.0.2","54.38.73.16","TCP","68","36876 → 21002 [ACK] Seq=4801 Ack=61776 Win=5565 Len=0 TSval=1091787873 TSecr=2677096139"
"1.619692","54.38.73.16","172.18.0.2","TLSv1.2","4412","Application Data"
"1.619727","172.18.0.2","54.38.73.16","TCP","68","36876 → 21002 [ACK] Seq=4801 Ack=66120 Win=5580 Len=0 TSval=1091787884 TSecr=2677096142"
"1.632522","54.38.73.16","172.18.0.2","TLSv1.2","408","Application Data"
"1.632587","172.18.0.2","54.38.73.16","TLSv1.2","611","Application Data"
"1.670819","54.38.73.16","172.18.0.2","TLSv1.2","1125","Application Data"
"1.714103","172.18.0.2","54.38.73.16","TCP","68","36876 → 21002 [ACK] Seq=5344 Ack=67517 Win=5612 Len=0 TSval=1091787979 TSecr=2677096154"
"1.725533","54.38.73.16","172.18.0.2","TCP","2964","[TCP segment of a reassembled PDU]"
"1.725723","172.18.0.2","54.38.73.16","TCP","68","36876 → 21002 [ACK] Seq=5344 Ack=70413 Win=5596 Len=0 TSval=1091787990 TSecr=2677096167"
"1.739832","54.38.73.16","172.18.0.2","TLSv1.2","799","Application Data"
"1.740012","172.18.0.2","54.38.73.16","TCP","68","36876 → 21002 [ACK] Seq=5344 Ack=71144 Win=5612 Len=0 TSval=1091788004 TSecr=2677096171"
"1.741092","172.18.0.2","54.38.73.16","TLSv1.2","611","Application Data"
"1.765513","54.38.73.16","172.18.0.2","TLSv1.2","611","Application Data"
"1.765625","172.18.0.2","54.38.73.16","TCP","68","36876 → 21002 [ACK] Seq=5887 Ack=71687 Win=5612 Len=0 TSval=1091788030 TSecr=2677096178"
"1.803470","54.38.73.16","172.18.0.2","TCP","68","21002 → 36876 [ACK] Seq=71687 Ack=5887 Win=1452 Len=0 TSval=2677096188 TSecr=1091788006"
"1.803514","172.18.0.2","54.38.73.16","TLSv1.2","611","Application Data"
"1.868072","54.38.73.16","172.18.0.2","TCP","68","21002 → 36876 [ACK] Seq=71687 Ack=6430 Win=1452 Len=0 TSval=2677096204 TSecr=1091788068"
"2.533066","54.38.73.16","172.18.0.2","TLSv1.2","611","Application Data"
"2.533121","172.18.0.2","54.38.73.16","TCP","68","36876 → 21002 [ACK] Seq=6430 Ack=72230 Win=5608 Len=0 TSval=1091788798 TSecr=2677096325"
"2.534134","172.18.0.2","54.38.73.16","TLSv1.2","611","Application Data"
"2.558639","54.38.73.16","172.18.0.2","TCP","68","21002 → 36876 [ACK] Seq=72230 Ack=6973 Win=1452 Len=0 TSval=2677096376 TSecr=1091788799"
"2.964305","54.38.73.16","172.18.0.2","TLSv1.2","3695","Application Data"
"2.964487","172.18.0.2","54.38.73.16","TCP","68","36876 → 21002 [ACK] Seq=6973 Ack=75857 Win=5584 Len=0 TSval=1091789229 TSecr=2677096478"
"2.974913","54.38.73.16","172.18.0.2","TCP","2964","[TCP segment of a reassembled PDU]"
"2.974941","172.18.0.2","54.38.73.16","TCP","68","36876 → 21002 [ACK] Seq=6973 Ack=78753 Win=5596 Len=0 TSval=1091789239 TSecr=2677096480"
"2.984716","54.38.73.16","172.18.0.2","TLSv1.2","7308","Application Data, Application Data"
"2.984855","172.18.0.2","54.38.73.16","TCP","68","36876 → 21002 [ACK] Seq=6973 Ack=85993 Win=5565 Len=0 TSval=1091789249 TSecr=2677096483"
"2.988535","54.38.73.16","172.18.0.2","TLSv1.2","813","Application Data"
"2.996373","54.38.73.16","172.18.0.2","TCP","2964","[TCP segment of a reassembled PDU]"
"2.996406","172.18.0.2","54.38.73.16","TCP","68","36876 → 21002 [ACK] Seq=6973 Ack=89634 Win=5596 Len=0 TSval=1091789261 TSecr=2677096484"
"3.004819","54.38.73.16","172.18.0.2","TLSv1.2","4412","Application Data [TCP segment of a reassembled PDU]"
"3.005000","172.18.0.2","54.38.73.16","TCP","68","36876 → 21002 [ACK] Seq=6973 Ack=93978 Win=5580 Len=0 TSval=1091789269 TSecr=2677096488"
"3.005253","54.38.73.16","172.18.0.2","TLSv1.2","2964","Application Data [TCP segment of a reassembled PDU]"
"3.005453","172.18.0.2","54.38.73.16","TLSv1.2","611","Application Data"
"3.016962","54.38.73.16","172.18.0.2","TLSv1.2","5860","Application Data, Application Data"
"3.016998","172.18.0.2","54.38.73.16","TCP","68","36876 → 21002 [ACK] Seq=7516 Ack=102666 Win=5581 Len=0 TSval=1091789281 TSecr=2677096491"
"3.021658","54.38.73.16","172.18.0.2","TLSv1.2","1247","Application Data"
"3.027893","54.38.73.16","172.18.0.2","TCP","2964","[TCP segment of a reassembled PDU]"
"3.027925","172.18.0.2","54.38.73.16","TCP","68","36876 → 21002 [ACK] Seq=7516 Ack=106741 Win=5596 Len=0 TSval=1091789292 TSecr=2677096492"
"3.029561","54.38.73.16","172.18.0.2","TCP","68","21002 → 36876 [ACK] Seq=106741 Ack=7516 Win=1452 Len=0 TSval=2677096494 TSecr=1091789270"
"3.029604","172.18.0.2","54.38.73.16","TLSv1.2","611","Application Data"
"3.052844","54.38.73.16","172.18.0.2","TLSv1.2","285","Application Data"
"3.091882","54.38.73.16","172.18.0.2","TCP","68","21002 → 36876 [ACK] Seq=106958 Ack=8059 Win=1452 Len=0 TSval=2677096510 TSecr=1091789294"
"3.094233","172.18.0.2","54.38.73.16","TCP","68","36876 → 21002 [ACK] Seq=8059 Ack=106958 Win=5612 Len=0 TSval=1091789359 TSecr=2677096500"
"3.120281","54.38.73.16","172.18.0.2","TLSv1.2","611","Application Data"
"3.120338","172.18.0.2","54.38.73.16","TCP","68","36876 → 21002 [ACK] Seq=8059 Ack=107501 Win=5608 Len=0 TSval=1091789385 TSecr=2677096517"
"3.150240","54.38.73.16","172.18.0.2","TLSv1.2","4145","Application Data"
"3.150274","172.18.0.2","54.38.73.16","TCP","68","36876 → 21002 [ACK] Seq=8059 Ack=111578 Win=5580 Len=0 TSval=1091789415 TSecr=2677096524"
"3.151388","172.18.0.2","54.38.73.16","TLSv1.2","611","Application Data"
"3.175474","54.38.73.16","172.18.0.2","TLSv1.2","161","Application Data"
"3.175530","172.18.0.2","54.38.73.16","TCP","68","36876 → 21002 [ACK] Seq=8602 Ack=111671 Win=5612 Len=0 TSval=1091789440 TSecr=2677096531"
"3.175483","54.38.73.16","172.18.0.2","TCP","68","21002 → 36876 [ACK] Seq=111671 Ack=8602 Win=1452 Len=0 TSval=2677096531 TSecr=1091789416"
"3.175564","172.18.0.2","54.38.73.16","TLSv1.2","611","Application Data"
"3.200008","54.38.73.16","172.18.0.2","TCP","68","21002 → 36876 [ACK] Seq=111671 Ack=9145 Win=1452 Len=0 TSval=2677096537 TSecr=1091789440"
"3.649827","54.38.73.16","172.18.0.2","TLSv1.2","611","Application Data"
"3.649880","172.18.0.2","54.38.73.16","TCP","68","36876 → 21002 [ACK] Seq=9145 Ack=112214 Win=5608 Len=0 TSval=1091789914 TSecr=2677096629"
"3.650954","172.18.0.2","54.38.73.16","TLSv1.2","611","Application Data"
"3.676070","54.38.73.16","172.18.0.2","TCP","68","21002 → 36876 [ACK] Seq=112214 Ack=9688 Win=1452 Len=0 TSval=2677096656 TSecr=1091789915"
"3.988140","54.38.73.16","172.18.0.2","TLSv1.2","611","Application Data"
"3.997424","54.38.73.16","172.18.0.2","TCP","2964","[TCP segment of a reassembled PDU]"
"3.997599","172.18.0.2","54.38.73.16","TCP","68","36876 → 21002 [ACK] Seq=9688 Ack=115653 Win=5596 Len=0 TSval=1091790262 TSecr=2677096733"
"4.009598","54.38.73.16","172.18.0.2","TLSv1.2","7308","Application Data, Application Data"
"4.009790","172.18.0.2","54.38.73.16","TCP","68","36876 → 21002 [ACK] Seq=9688 Ack=122893 Win=5565 Len=0 TSval=1091790274 TSecr=2677096738"
"4.018224","54.38.73.16","172.18.0.2","TLSv1.2","2964","Application Data [TCP segment of a reassembled PDU]"
"4.018262","172.18.0.2","54.38.73.16","TCP","68","36876 → 21002 [ACK] Seq=9688 Ack=125789 Win=5596 Len=0 TSval=1091790283 TSecr=2677096741"
"4.023020","54.38.73.16","172.18.0.2","TLSv1.2","6199","Application Data, Application Data"
"4.023201","172.18.0.2","54.38.73.16","TCP","68","36876 → 21002 [ACK] Seq=9688 Ack=131920 Win=5565 Len=0 TSval=1091790288 TSecr=2677096742"
"4.041657","54.38.73.16","172.18.0.2","TCP","1516","[TCP segment of a reassembled PDU]"
"4.041934","54.38.73.16","172.18.0.2","TLSv1.2","8756","Application Data, Application Data"
"4.041966","172.18.0.2","54.38.73.16","TCP","68","36876 → 21002 [ACK] Seq=9688 Ack=142056 Win=5566 Len=0 TSval=1091790306 TSecr=2677096747"
"4.042786","172.18.0.2","54.38.73.16","TLSv1.2","611","Application Data"
"4.043882","54.38.73.16","172.18.0.2","TLSv1.2","2964","Application Data [TCP segment of a reassembled PDU]"
"4.043916","172.18.0.2","54.38.73.16","TCP","68","36876 → 21002 [ACK] Seq=10231 Ack=144952 Win=5596 Len=0 TSval=1091790308 TSecr=2677096747"
"4.047448","54.38.73.16","172.18.0.2","TLSv1.2","3086","Application Data"
"4.047619","172.18.0.2","54.38.73.16","TCP","68","36876 → 21002 [ACK] Seq=10231 Ack=147970 Win=5612 Len=0 TSval=1091790312 TSecr=2677096749"
"4.050935","54.38.73.16","172.18.0.2","TCP","2964","[TCP segment of a reassembled PDU]"
"4.051115","172.18.0.2","54.38.73.16","TCP","68","36876 → 21002 [ACK] Seq=10231 Ack=150866 Win=5596 Len=0 TSval=1091790316 TSecr=2677096749"
"4.066264","54.38.73.16","172.18.0.2","TLSv1.2","5860","Application Data, Application Data"
"4.066445","172.18.0.2","54.38.73.16","TCP","68","36876 → 21002 [ACK] Seq=10231 Ack=156658 Win=5581 Len=0 TSval=1091790331 TSecr=2677096753"
"4.066514","54.38.73.16","172.18.0.2","TCP","68","21002 → 36876 [ACK] Seq=156658 Ack=10231 Win=1452 Len=0 TSval=2677096753 TSecr=1091790307"
"4.066554","172.18.0.2","54.38.73.16","TLSv1.2","611","Application Data"
"4.072278","54.38.73.16","172.18.0.2","TLSv1.2","1262","Application Data, Application Data"
"4.114153","172.18.0.2","54.38.73.16","TCP","68","36876 → 21002 [ACK] Seq=10774 Ack=157852 Win=5612 Len=0 TSval=1091790379 TSecr=2677096755"
"4.131370","54.38.73.16","172.18.0.2","TCP","68","21002 → 36876 [ACK] Seq=157852 Ack=10774 Win=1452 Len=0 TSval=2677096770 TSecr=1091790331"
"4.131413","172.18.0.2","54.38.73.16","TLSv1.2","611","Application Data"
"4.162046","54.38.73.16","172.18.0.2","TCP","68","21002 → 36876 [ACK] Seq=157852 Ack=11317 Win=1452 Len=0 TSval=2677096777 TSecr=1091790396"
"4.394506","54.38.73.16","172.18.0.2","TLSv1.2","611","Application Data"
"4.394562","172.18.0.2","54.38.73.16","TCP","68","36876 → 21002 [ACK] Seq=11317 Ack=158395 Win=5608 Len=0 TSval=1091790659 TSecr=2677096835"
"4.395581","172.18.0.2","54.38.73.16","TLSv1.2","611","Application Data"
"4.418953","54.38.73.16","172.18.0.2","TCP","68","21002 → 36876 [ACK] Seq=158395 Ack=11860 Win=1452 Len=0 TSval=2677096842 TSecr=1091790660"
"4.714512","54.38.73.16","172.18.0.2","TLSv1.2","3695","Application Data"
"4.714566","172.18.0.2","54.38.73.16","TCP","68","36876 → 21002 [ACK] Seq=11860 Ack=162022 Win=5584 Len=0 TSval=1091790979 TSecr=2677096915"
"4.725488","54.38.73.16","172.18.0.2","TCP","2964","[TCP segment of a reassembled PDU]"
"4.725522","172.18.0.2","54.38.73.16","TCP","68","36876 → 21002 [ACK] Seq=11860 Ack=164918 Win=5596 Len=0 TSval=1091790990 TSecr=2677096918"
"4.736521","54.38.73.16","172.18.0.2","TLSv1.2","7308","Application Data, Application Data"
"4.736576","172.18.0.2","54.38.73.16","TCP","68","36876 → 21002 [ACK] Seq=11860 Ack=172158 Win=5565 Len=0 TSval=1091791001 TSecr=2677096921"
"4.737532","54.38.73.16","172.18.0.2","TLSv1.2","1870","Application Data, Application Data"
"4.737560","172.18.0.2","54.38.73.16","TCP","68","36876 → 21002 [ACK] Seq=11860 Ack=173960 Win=5600 Len=0 TSval=1091791002 TSecr=2677096921"
"4.748589","54.38.73.16","172.18.0.2","TLSv1.2","5860","Application Data"
"4.748623","172.18.0.2","54.38.73.16","TCP","68","36876 → 21002 [ACK] Seq=11860 Ack=179752 Win=5581 Len=0 TSval=1091791013 TSecr=2677096924"
"4.749442","54.38.73.16","172.18.0.2","TCP","1516","21002 → 36876 [ACK] Seq=179752 Ack=11860 Win=1452 Len=1448 TSval=2677096924 TSecr=1091790990 [TCP segment of a reassembled PDU]"
"4.749469","172.18.0.2","54.38.73.16","TCP","68","36876 → 21002 [ACK] Seq=11860 Ack=181200 Win=5593 Len=0 TSval=1091791014 TSecr=2677096924"
"4.760009","54.38.73.16","172.18.0.2","TLSv1.2","2964","Application Data [TCP segment of a reassembled PDU]"
"4.760044","172.18.0.2","54.38.73.16","TCP","68","36876 → 21002 [ACK] Seq=11860 Ack=184096 Win=5596 Len=0 TSval=1091791024 TSecr=2677096927"
"4.760913","54.38.73.16","172.18.0.2","TLSv1.2","5860","Application Data, Application Data"
"4.760949","172.18.0.2","54.38.73.16","TCP","68","36876 → 21002 [ACK] Seq=11860 Ack=189888 Win=5581 Len=0 TSval=1091791025 TSecr=2677096927"
"4.761272","54.38.73.16","172.18.0.2","TLSv1.2","3846","Application Data, Application Data"
"4.761299","172.18.0.2","54.38.73.16","TCP","68","36876 → 21002 [ACK] Seq=11860 Ack=193666 Win=5552 Len=0 TSval=1091791026 TSecr=2677096927"
"4.761344","172.18.0.2","54.38.73.16","TLSv1.2","611","Application Data"
"4.772441","54.38.73.16","172.18.0.2","TLSv1.2","5860","Application Data"
"4.772475","172.18.0.2","54.38.73.16","TCP","68","36876 → 21002 [ACK] Seq=12403 Ack=199458 Win=5581 Len=0 TSval=1091791037 TSecr=2677096930"
"4.782837","54.38.73.16","172.18.0.2","TCP","1516","21002 → 36876 [ACK] Seq=199458 Ack=11860 Win=1452 Len=1448 TSval=2677096932 TSecr=1091791014 [TCP segment of a reassembled PDU]"
"4.782869","172.18.0.2","54.38.73.16","TCP","68","36876 → 21002 [ACK] Seq=12403 Ack=200906 Win=5593 Len=0 TSval=1091791047 TSecr=2677096932"
"4.784167","54.38.73.16","172.18.0.2","TLSv1.2","1516","Application Data [TCP segment of a reassembled PDU]"
"4.784202","172.18.0.2","54.38.73.16","TCP","68","36876 → 21002 [ACK] Seq=12403 Ack=202354 Win=5593 Len=0 TSval=1091791049 TSecr=2677096933"
"4.785522","54.38.73.16","172.18.0.2","TLSv1.2","733","[TCP Previous segment not captured] , Ignored Unknown Record"
"4.785590","172.18.0.2","54.38.73.16","TCP","80","[TCP Window Update] 36876 → 21002 [ACK] Seq=12403 Ack=202354 Win=5606 Len=0 TSval=1091791050 TSecr=2677096933 SLE=209594 SRE=210259"
"4.785540","54.38.73.16","172.18.0.2","TCP","68","21002 → 36876 [ACK] Seq=210259 Ack=12403 Win=1452 Len=0 TSval=2677096933 TSecr=1091791026"
"4.785606","172.18.0.2","54.38.73.16","TLSv1.2","623","Application Data"
"4.785555","54.38.73.16","172.18.0.2","TCP","7308","[TCP Out-Of-Order] 21002 → 36876 [ACK] Seq=202354 Ack=11860 Win=1452 Len=7240 TSval=2677096933 TSecr=1091791025"
"4.785637","172.18.0.2","54.38.73.16","TCP","68","36876 → 21002 [ACK] Seq=12946 Ack=210259 Win=5569 Len=0 TSval=1091791050 TSecr=2677096933"
"4.806531","54.38.73.16","172.18.0.2","TCP","2964","[TCP segment of a reassembled PDU]"
"4.806564","172.18.0.2","54.38.73.16","TCP","68","36876 → 21002 [ACK] Seq=12946 Ack=213155 Win=5596 Len=0 TSval=1091791071 TSecr=2677096938"
"4.809807","54.38.73.16","172.18.0.2","TLSv1.2","799","Application Data"
"4.809850","172.18.0.2","54.38.73.16","TLSv1.2","611","Application Data"
"4.871392","54.38.73.16","172.18.0.2","TCP","68","21002 → 36876 [ACK] Seq=213886 Ack=13489 Win=1452 Len=0 TSval=2677096955 TSecr=1091791074"
"4.885287","54.38.73.16","172.18.0.2","TLSv1.2","3181","Application Data"
"4.885471","172.18.0.2","54.38.73.16","TCP","68","36876 → 21002 [ACK] Seq=13489 Ack=216999 Win=5580 Len=0 TSval=1091791150 TSecr=2677096958"
"4.930964","54.38.73.16","172.18.0.2","TLSv1.2","1125","Application Data"
"4.940645","172.18.0.2","54.38.73.16","TLSv1.2","611","Application Data"
"4.965025","54.38.73.16","172.18.0.2","TCP","68","21002 → 36876 [ACK] Seq=218056 Ack=14032 Win=1452 Len=0 TSval=2677096978 TSecr=1091791205"
"5.288153","54.38.73.16","172.18.0.2","TLSv1.2","611","Application Data"
"5.289212","172.18.0.2","54.38.73.16","TLSv1.2","611","Application Data"
"5.313359","54.38.73.16","172.18.0.2","TCP","68","21002 → 36876 [ACK] Seq=218599 Ack=14575 Win=1452 Len=0 TSval=2677097065 TSecr=1091791554"
"5.903588","54.38.73.16","172.18.0.2","TLSv1.2","3695","Application Data"
"5.903594","54.38.73.16","172.18.0.2","TCP","2964","[TCP segment of a reassembled PDU]"
"5.903598","54.38.73.16","172.18.0.2","TLSv1.2","7308","Application Data, Application Data"
"5.903602","54.38.73.16","172.18.0.2","TCP","1516","21002 → 36876 [ACK] Seq=232362 Ack=14575 Win=1452 Len=1448 TSval=2677097189 TSecr=1091791554 [TCP segment of a reassembled PDU]"
"5.903788","172.18.0.2","54.38.73.16","TCP","68","36876 → 21002 [ACK] Seq=14575 Ack=233810 Win=5521 Len=0 TSval=1091792168 TSecr=2677097160"
"5.928746","54.38.73.16","172.18.0.2","TLSv1.2","14445","Application Data, Application Data, Application Data, Application Data, Application Data, Application Data, Application Data"
"5.928786","172.18.0.2","54.38.73.16","TCP","68","36876 → 21002 [ACK] Seq=14575 Ack=248187 Win=5536 Len=0 TSval=1091792193 TSecr=2677097219"
"5.930169","172.18.0.2","54.38.73.16","TLSv1.2","611","Application Data"
"5.936259","54.38.73.16","172.18.0.2","TCP","2964","[TCP segment of a reassembled PDU]"
"5.936292","172.18.0.2","54.38.73.16","TCP","68","36876 → 21002 [ACK] Seq=15118 Ack=251083 Win=5596 Len=0 TSval=1091792201 TSecr=2677097221"
"5.936439","54.38.73.16","172.18.0.2","TLSv1.2","2964","Application Data [TCP segment of a reassembled PDU]"
"5.936458","172.18.0.2","54.38.73.16","TCP","68","36876 → 21002 [ACK] Seq=15118 Ack=253979 Win=5596 Len=0 TSval=1091792201 TSecr=2677097221"
"5.954672","54.38.73.16","172.18.0.2","TLSv1.2","14548","Application Data, Application Data, Application Data, Application Data"
"5.954871","172.18.0.2","54.38.73.16","TCP","68","36876 → 21002 [ACK] Seq=15118 Ack=268459 Win=5536 Len=0 TSval=1091792219 TSecr=2677097225"
"5.955913","54.38.73.16","172.18.0.2","TCP","68","21002 → 36876 [ACK] Seq=268459 Ack=15118 Win=1452 Len=0 TSval=2677097226 TSecr=1091792195"
"5.955949","172.18.0.2","54.38.73.16","TLSv1.2","611","Application Data"
"5.960741","54.38.73.16","172.18.0.2","TLSv1.2","2964","Application Data [TCP segment of a reassembled PDU]"
"5.960917","172.18.0.2","54.38.73.16","TCP","68","36876 → 21002 [ACK] Seq=15661 Ack=271355 Win=5596 Len=0 TSval=1091792225 TSecr=2677097227"
"5.961608","54.38.73.16","172.18.0.2","TLSv1.2","2964","Application Data, Application Data, Application Data"
"5.961633","172.18.0.2","54.38.73.16","TCP","68","36876 → 21002 [ACK] Seq=15661 Ack=274251 Win=5596 Len=0 TSval=1091792226 TSecr=2677097227"
"5.979020","54.38.73.16","172.18.0.2","TLSv1.2","9304","Application Data, Application Data, Application Data"
"5.979204","172.18.0.2","54.38.73.16","TCP","68","36876 → 21002 [ACK] Seq=15661 Ack=283487 Win=5550 Len=0 TSval=1091792244 TSecr=2677097231"
"6.023781","54.38.73.16","172.18.0.2","TCP","68","21002 → 36876 [ACK] Seq=283487 Ack=15661 Win=1452 Len=0 TSval=2677097243 TSecr=1091792220"
"6.023835","172.18.0.2","54.38.73.16","TLSv1.2","1154","Application Data, Application Data"
"6.047901","54.38.73.16","172.18.0.2","TCP","68","21002 → 36876 [ACK] Seq=283487 Ack=16747 Win=1452 Len=0 TSval=2677097249 TSecr=1091792288"
"6.517463","54.38.73.16","172.18.0.2","TLSv1.2","611","Application Data"
"6.518590","172.18.0.2","54.38.73.16","TLSv1.2","611","Application Data"
"6.542246","54.38.73.16","172.18.0.2","TCP","68","21002 → 36876 [ACK] Seq=284030 Ack=17290 Win=1452 Len=0 TSval=2677097372 TSecr=1091792783"
"6.984906","54.38.73.16","172.18.0.2","TLSv1.2","4145","Application Data"
"6.985097","172.18.0.2","54.38.73.16","TCP","68","36876 → 21002 [ACK] Seq=17290 Ack=288107 Win=5581 Len=0 TSval=1091793250 TSecr=2677097483"
"6.995201","54.38.73.16","172.18.0.2","TLSv1.2","10204","Application Data, Application Data, Application Data"
"6.995381","172.18.0.2","54.38.73.16","TCP","68","36876 → 21002 [ACK] Seq=17290 Ack=298243 Win=5550 Len=0 TSval=1091793260 TSecr=2677097485"
"7.009776","54.38.73.16","172.18.0.2","TLSv1.2","1420","Application Data"
"7.010357","172.18.0.2","54.38.73.16","TLSv1.2","611","Application Data"
"7.015640","54.38.73.16","172.18.0.2","TLSv1.2","7308","Application Data"
"7.015795","172.18.0.2","54.38.73.16","TCP","68","36876 → 21002 [ACK] Seq=17833 Ack=306835 Win=5565 Len=0 TSval=1091793280 TSecr=2677097491"
"7.021046","54.38.73.16","172.18.0.2","TLSv1.2","5860","Application Data, Application Data"
"7.021080","172.18.0.2","54.38.73.16","TCP","68","36876 → 21002 [ACK] Seq=17833 Ack=312627 Win=5581 Len=0 TSval=1091793286 TSecr=2677097492"
"7.026953","54.38.73.16","172.18.0.2","TLSv1.2","2964","Application Data [TCP segment of a reassembled PDU]"
"7.026986","172.18.0.2","54.38.73.16","TCP","68","36876 → 21002 [ACK] Seq=17833 Ack=315523 Win=5596 Len=0 TSval=1091793291 TSecr=2677097493"
"7.027150","54.38.73.16","172.18.0.2","TCP","1516","21002 → 36876 [ACK] Seq=315523 Ack=17290 Win=1452 Len=1448 TSval=2677097493 TSecr=1091793260 [TCP segment of a reassembled PDU]"
"7.034226","54.38.73.16","172.18.0.2","TLSv1.2","313","Application Data"
"7.034270","172.18.0.2","54.38.73.16","TLSv1.2","611","Application Data"
"7.037307","54.38.73.16","172.18.0.2","TCP","1516","[TCP segment of a reassembled PDU]"
"7.039898","54.38.73.16","172.18.0.2","TLSv1.2","4412","Application Data [TCP segment of a reassembled PDU]"
"7.040077","172.18.0.2","54.38.73.16","TCP","68","36876 → 21002 [ACK] Seq=18376 Ack=323008 Win=5580 Len=0 TSval=1091793305 TSecr=2677097496"
"7.059849","54.38.73.16","172.18.0.2","TLSv1.2","1016","Application Data"
"7.102244","172.18.0.2","54.38.73.16","TCP","68","36876 → 21002 [ACK] Seq=18376 Ack=323956 Win=5612 Len=0 TSval=1091793367 TSecr=2677097501"
"7.144432","54.38.73.16","172.18.0.2","TLSv1.2","1125","Application Data"
"7.144489","172.18.0.2","54.38.73.16","TCP","68","36876 → 21002 [ACK] Seq=18376 Ack=325013 Win=5604 Len=0 TSval=1091793409 TSecr=2677097523"
"7.150760","172.18.0.2","54.38.73.16","TLSv1.2","611","Application Data"
"7.215890","54.38.73.16","172.18.0.2","TCP","68","21002 → 36876 [ACK] Seq=325013 Ack=18919 Win=1452 Len=0 TSval=2677097541 TSecr=1091793415"
"7.644096","54.38.73.16","172.18.0.2","TLSv1.2","611","Application Data"
"7.644173","172.18.0.2","54.38.73.16","TCP","68","36876 → 21002 [ACK] Seq=18919 Ack=325556 Win=5608 Len=0 TSval=1091793909 TSecr=2677097628"
"7.645151","172.18.0.2","54.38.73.16","TLSv1.2","611","Application Data"
"7.670583","54.38.73.16","172.18.0.2","TCP","68","21002 → 36876 [ACK] Seq=325556 Ack=19462 Win=1452 Len=0 TSval=2677097654 TSecr=1091793910"
"7.898141","54.38.73.16","172.18.0.2","TLSv1.2","3695","Application Data"
"7.898206","172.18.0.2","54.38.73.16","TCP","68","36876 → 21002 [ACK] Seq=19462 Ack=329183 Win=5584 Len=0 TSval=1091794163 TSecr=2677097711"
"7.906594","54.38.73.16","172.18.0.2","TCP","2964","[TCP segment of a reassembled PDU]"
"7.906631","172.18.0.2","54.38.73.16","TCP","68","36876 → 21002 [ACK] Seq=19462 Ack=332079 Win=5596 Len=0 TSval=1091794171 TSecr=2677097713"
"7.923070","54.38.73.16","172.18.0.2","TLSv1.2","799","Application Data"
"7.923106","172.18.0.2","54.38.73.16","TCP","68","36876 → 21002 [ACK] Seq=19462 Ack=332810 Win=5593 Len=0 TSval=1091794188 TSecr=2677097717"
"7.928556","54.38.73.16","172.18.0.2","TCP","1516","[TCP segment of a reassembled PDU]"
"7.928589","172.18.0.2","54.38.73.16","TCP","68","36876 → 21002 [ACK] Seq=19462 Ack=334258 Win=5593 Len=0 TSval=1091794193 TSecr=2677097719"
"7.928844","54.38.73.16","172.18.0.2","TCP","1516","21002 → 36876 [ACK] Seq=334258 Ack=19462 Win=1452 Len=1448 TSval=2677097719 TSecr=1091794163 [TCP segment of a reassembled PDU]"
"7.928865","172.18.0.2","54.38.73.16","TCP","68","36876 → 21002 [ACK] Seq=19462 Ack=335706 Win=5593 Len=0 TSval=1091794193 TSecr=2677097719"
"7.948835","54.38.73.16","172.18.0.2","TLSv1.2","799","Application Data"
"7.948870","172.18.0.2","54.38.73.16","TCP","68","36876 → 21002 [ACK] Seq=19462 Ack=336437 Win=5593 Len=0 TSval=1091794213 TSecr=2677097724"
"7.962506","54.38.73.16","172.18.0.2","TCP","1516","[TCP segment of a reassembled PDU]"
"7.962537","172.18.0.2","54.38.73.16","TCP","68","36876 → 21002 [ACK] Seq=19462 Ack=337885 Win=5593 Len=0 TSval=1091794227 TSecr=2677097727"
"7.971558","54.38.73.16","172.18.0.2","TLSv1.2","4412","Application Data, Application Data"
"7.971593","172.18.0.2","54.38.73.16","TCP","68","36876 → 21002 [ACK] Seq=19462 Ack=342229 Win=5580 Len=0 TSval=1091794236 TSecr=2677097730"
"7.973586","54.38.73.16","172.18.0.2","TLSv1.2","531","Application Data"
"7.973634","172.18.0.2","54.38.73.16","TCP","68","36876 → 21002 [ACK] Seq=19462 Ack=342692 Win=5593 Len=0 TSval=1091794238 TSecr=2677097730"
"7.992741","54.38.73.16","172.18.0.2","TLSv1.2","7308","Application Data"
"7.992799","172.18.0.2","54.38.73.16","TCP","68","36876 → 21002 [ACK] Seq=19462 Ack=349932 Win=5565 Len=0 TSval=1091794257 TSecr=2677097735"
"7.998371","54.38.73.16","172.18.0.2","TLSv1.2","596","Application Data"
"7.998406","172.18.0.2","54.38.73.16","TCP","68","36876 → 21002 [ACK] Seq=19462 Ack=350460 Win=5593 Len=0 TSval=1091794263 TSecr=2677097736"
"8.004725","54.38.73.16","172.18.0.2","TCP","2964","[TCP segment of a reassembled PDU]"
"8.004757","172.18.0.2","54.38.73.16","TCP","68","36876 → 21002 [ACK] Seq=19462 Ack=353356 Win=5596 Len=0 TSval=1091794269 TSecr=2677097738"
"8.022875","54.38.73.16","172.18.0.2","TLSv1.2","1342","Application Data, Application Data"
"8.022915","172.18.0.2","54.38.73.16","TCP","68","36876 → 21002 [ACK] Seq=19462 Ack=354630 Win=5593 Len=0 TSval=1091794287 TSecr=2677097742"
"8.023434","172.18.0.2","54.38.73.16","TLSv1.2","1125","Application Data"
"8.025313","54.38.73.16","172.18.0.2","TCP","1516","[TCP segment of a reassembled PDU]"
"8.046859","54.38.73.16","172.18.0.2","TLSv1.2","705","Application Data"
"8.046907","172.18.0.2","54.38.73.16","TCP","68","36876 → 21002 [ACK] Seq=20519 Ack=356715 Win=5593 Len=0 TSval=1091794311 TSecr=2677097743"
"8.048202","54.38.73.16","172.18.0.2","TCP","68","21002 → 36876 [ACK] Seq=356715 Ack=20519 Win=1452 Len=0 TSval=2677097749 TSecr=1091794288"
"8.054908","172.18.0.2","54.38.73.16","TLSv1.2","611","Application Data"
"8.081750","54.38.73.16","172.18.0.2","TCP","68","21002 → 36876 [ACK] Seq=356715 Ack=21062 Win=1452 Len=0 TSval=2677097757 TSecr=1091794319"
"8.462448","54.38.73.16","172.18.0.2","TLSv1.2","611","Application Data"
"8.462795","172.18.0.2","54.38.73.16","TLSv1.2","611","Application Data"
"8.489244","54.38.73.16","172.18.0.2","TCP","68","21002 → 36876 [ACK] Seq=357258 Ack=21605 Win=1452 Len=0 TSval=2677097859 TSecr=1091794727"
"9.115242","54.38.73.16","172.18.0.2","TLSv1.2","4145","Application Data"
"9.115407","172.18.0.2","54.38.73.16","TCP","68","36876 → 21002 [ACK] Seq=21605 Ack=361335 Win=5581 Len=0 TSval=1091795380 TSecr=2677098015"
"9.125515","54.38.73.16","172.18.0.2","TLSv1.2","2964","Application Data"
"9.125547","172.18.0.2","54.38.73.16","TCP","68","36876 → 21002 [ACK] Seq=21605 Ack=364231 Win=5596 Len=0 TSval=1091795390 TSecr=2677098018"
"9.139529","54.38.73.16","172.18.0.2","TLSv1.2","892","Application Data"
"9.147445","54.38.73.16","172.18.0.2","TCP","2964","[TCP segment of a reassembled PDU]"
"9.147478","172.18.0.2","54.38.73.16","TCP","68","36876 → 21002 [ACK] Seq=21605 Ack=367951 Win=5596 Len=0 TSval=1091795412 TSecr=2677098022"
"9.157356","54.38.73.16","172.18.0.2","TLSv1.2","4412","Application Data [TCP segment of a reassembled PDU]"
"9.157526","172.18.0.2","54.38.73.16","TCP","68","36876 → 21002 [ACK] Seq=21605 Ack=372295 Win=5580 Len=0 TSval=1091795422 TSecr=2677098026"
"9.172153","54.38.73.16","172.18.0.2","TLSv1.2","1139","Application Data, Application Data"
"9.189639","54.38.73.16","172.18.0.2","TLSv1.2","11652","Application Data, Application Data"
"9.189796","172.18.0.2","54.38.73.16","TCP","68","36876 → 21002 [ACK] Seq=21605 Ack=384950 Win=5551 Len=0 TSval=1091795454 TSecr=2677098030"
"9.200239","54.38.73.16","172.18.0.2","TLSv1.2","5860","Application Data, Application Data"
"9.200282","172.18.0.2","54.38.73.16","TCP","68","36876 → 21002 [ACK] Seq=21605 Ack=390742 Win=5581 Len=0 TSval=1091795465 TSecr=2677098037"
"9.200767","172.18.0.2","54.38.73.16","TLSv1.2","611","Application Data"
"9.215739","54.38.73.16","172.18.0.2","TLSv1.2","3426","Application Data, Application Data"
"9.215892","172.18.0.2","54.38.73.16","TCP","68","36876 → 21002 [ACK] Seq=22148 Ack=394100 Win=5580 Len=0 TSval=1091795480 TSecr=2677098040"
"9.220365","54.38.73.16","172.18.0.2","TLSv1.2","7308","Application Data"
"9.220519","172.18.0.2","54.38.73.16","TCP","68","36876 → 21002 [ACK] Seq=22148 Ack=401340 Win=5565 Len=0 TSval=1091795485 TSecr=2677098042"
"9.224391","54.38.73.16","172.18.0.2","TCP","68","21002 → 36876 [ACK] Seq=401340 Ack=22148 Win=1452 Len=0 TSval=2677098043 TSecr=1091795465"
"9.231156","54.38.73.16","172.18.0.2","TLSv1.2","7308","Application Data, Application Data"
"9.231193","172.18.0.2","54.38.73.16","TCP","68","36876 → 21002 [ACK] Seq=22148 Ack=408580 Win=5565 Len=0 TSval=1091795496 TSecr=2677098044"
"9.232008","172.18.0.2","54.38.73.16","TLSv1.2","611","Application Data"
"9.240777","54.38.73.16","172.18.0.2","TLSv1.2","1667","Application Data, Application Data"
"9.240809","172.18.0.2","54.38.73.16","TCP","68","36876 → 21002 [ACK] Seq=22691 Ack=410179 Win=5601 Len=0 TSval=1091795505 TSecr=2677098047"
"9.241689","54.38.73.16","172.18.0.2","TCP","2964","[TCP segment of a reassembled PDU]"
"9.241812","172.18.0.2","54.38.73.16","TCP","68","36876 → 21002 [ACK] Seq=22691 Ack=413075 Win=5596 Len=0 TSval=1091795506 TSecr=2677098047"
"9.245016","54.38.73.16","172.18.0.2","TLSv1.2","5860","Application Data, Application Data"
"9.245156","172.18.0.2","54.38.73.16","TCP","68","36876 → 21002 [ACK] Seq=22691 Ack=418867 Win=5581 Len=0 TSval=1091795510 TSecr=2677098048"
"9.254697","54.38.73.16","172.18.0.2","TCP","1516","21002 → 36876 [ACK] Seq=418867 Ack=22148 Win=1452 Len=1448 TSval=2677098050 TSecr=1091795485 [TCP segment of a reassembled PDU]"
"9.255465","54.38.73.16","172.18.0.2","TLSv1.2","2964","Application Data [TCP segment of a reassembled PDU]"
"9.255536","172.18.0.2","54.38.73.16","TCP","68","36876 → 21002 [ACK] Seq=22691 Ack=423211 Win=5596 Len=0 TSval=1091795520 TSecr=2677098050"
"9.255693","54.38.73.16","172.18.0.2","TCP","2964","21002 → 36876 [ACK] Seq=423211 Ack=22148 Win=1452 Len=2896 TSval=2677098051 TSecr=1091795496 [TCP segment of a reassembled PDU]"
"9.255976","172.18.0.2","54.38.73.16","TCP","68","36876 → 21002 [ACK] Seq=22691 Ack=426107 Win=5581 Len=0 TSval=1091795520 TSecr=2677098051"
"9.265275","54.38.73.16","172.18.0.2","TLSv1.2","219","Application Data, Application Data"
"9.265342","172.18.0.2","54.38.73.16","TLSv1.2","611","Application Data"
"9.327394","54.38.73.16","172.18.0.2","TCP","68","21002 → 36876 [ACK] Seq=426258 Ack=23234 Win=1452 Len=0 TSval=2677098069 TSecr=1091795530"
"9.337741","54.38.73.16","172.18.0.2","TLSv1.2","4145","Application Data"
"9.337747","54.38.73.16","172.18.0.2","TCP","1516","[TCP segment of a reassembled PDU]"
"9.337904","172.18.0.2","54.38.73.16","TCP","68","36876 → 21002 [ACK] Seq=23234 Ack=431783 Win=5582 Len=0 TSval=1091795602 TSecr=2677098071"
"9.362926","54.38.73.16","172.18.0.2","TLSv1.2","769","Application Data"
"9.370224","172.18.0.2","54.38.73.16","TLSv1.2","611","Application Data"
"9.431516","54.38.73.16","172.18.0.2","TCP","68","21002 → 36876 [ACK] Seq=432484 Ack=23777 Win=1452 Len=0 TSval=2677098095 TSecr=1091795635"
"9.897176","54.38.73.16","172.18.0.2","TLSv1.2","611","Application Data"
"9.898207","172.18.0.2","54.38.73.16","TLSv1.2","611","Application Data"
"9.915497","54.38.73.16","172.18.0.2","TLSv1.2","611","[TCP Spurious Retransmission] , Application Data"
"9.915560","172.18.0.2","54.38.73.16","TCP","80","[TCP Dup ACK 317#1] 36876 → 21002 [ACK] Seq=24320 Ack=433027 Win=5612 Len=0 TSval=1091796180 TSecr=2677098216 SLE=432484 SRE=433027"
"9.922588","54.38.73.16","172.18.0.2","TCP","68","21002 → 36876 [ACK] Seq=433027 Ack=24320 Win=1452 Len=0 TSval=2677098217 TSecr=1091796163"
"10.129452","54.38.73.16","172.18.0.2","TLSv1.2","611","Application Data"
"10.129520","172.18.0.2","54.38.73.16","TCP","68","36876 → 21002 [ACK] Seq=24320 Ack=433570 Win=5608 Len=0 TSval=1091796394 TSecr=2677098269"
"10.151293","54.38.73.16","172.18.0.2","TCP","2964","[TCP segment of a reassembled PDU]"
"10.151349","172.18.0.2","54.38.73.16","TCP","68","36876 → 21002 [ACK] Seq=24320 Ack=436466 Win=5596 Len=0 TSval=1091796416 TSecr=2677098274"
"10.153454","54.38.73.16","172.18.0.2","TLSv1.2","799","Application Data"
"10.153530","172.18.0.2","54.38.73.16","TCP","68","36876 → 21002 [ACK] Seq=24320 Ack=437197 Win=5593 Len=0 TSval=1091796418 TSecr=2677098275"
"10.160438","54.38.73.16","172.18.0.2","TLSv1.2","5860","Application Data"
"10.160472","172.18.0.2","54.38.73.16","TCP","68","36876 → 21002 [ACK] Seq=24320 Ack=442989 Win=5581 Len=0 TSval=1091796425 TSecr=2677098277"
"10.175810","54.38.73.16","172.18.0.2","TLSv1.2","2964","Application Data [TCP segment of a reassembled PDU]"
"10.175842","172.18.0.2","54.38.73.16","TCP","68","36876 → 21002 [ACK] Seq=24320 Ack=445885 Win=5596 Len=0 TSval=1091796440 TSecr=2677098281"
"10.177680","54.38.73.16","172.18.0.2","TCP","2964","21002 → 36876 [ACK] Seq=445885 Ack=24320 Win=1452 Len=2896 TSval=2677098281 TSecr=1091796418 [TCP segment of a reassembled PDU]"
"10.177712","172.18.0.2","54.38.73.16","TCP","68","36876 → 21002 [ACK] Seq=24320 Ack=448781 Win=5596 Len=0 TSval=1091796442 TSecr=2677098281"
"10.185806","54.38.73.16","172.18.0.2","TLSv1.2","2964","Application Data, Application Data"
"10.185840","172.18.0.2","54.38.73.16","TCP","68","36876 → 21002 [ACK] Seq=24320 Ack=451677 Win=5596 Len=0 TSval=1091796450 TSecr=2677098283"
"10.186146","54.38.73.16","172.18.0.2","TLSv1.2","2964","Application Data [TCP segment of a reassembled PDU]"
"10.186174","172.18.0.2","54.38.73.16","TCP","68","36876 → 21002 [ACK] Seq=24320 Ack=454573 Win=5581 Len=0 TSval=1091796451 TSecr=2677098283"
"10.201013","54.38.73.16","172.18.0.2","TLSv1.2","2941","Application Data, Application Data"
"10.201046","172.18.0.2","54.38.73.16","TCP","68","36876 → 21002 [ACK] Seq=24320 Ack=457446 Win=5596 Len=0 TSval=1091796465 TSecr=2677098287"
"10.203767","54.38.73.16","172.18.0.2","TCP","2964","[TCP segment of a reassembled PDU]"
"10.203806","172.18.0.2","54.38.73.16","TCP","68","36876 → 21002 [ACK] Seq=24320 Ack=460342 Win=5596 Len=0 TSval=1091796468 TSecr=2677098287"
"10.214660","54.38.73.16","172.18.0.2","TLSv1.2","4412","Application Data [TCP segment of a reassembled PDU]"
"10.214694","172.18.0.2","54.38.73.16","TCP","68","36876 → 21002 [ACK] Seq=24320 Ack=464686 Win=5580 Len=0 TSval=1091796479 TSecr=2677098290"
"10.215192","172.18.0.2","54.38.73.16","TLSv1.2","1125","Application Data"
"10.225586","54.38.73.16","172.18.0.2","TLSv1.2","82","Application Data"
"10.225621","172.18.0.2","54.38.73.16","TCP","68","36876 → 21002 [ACK] Seq=25377 Ack=464700 Win=5609 Len=0 TSval=1091796490 TSecr=2677098293"
"10.240732","54.38.73.16","172.18.0.2","TCP","68","21002 → 36876 [ACK] Seq=464700 Ack=25377 Win=1452 Len=0 TSval=2677098297 TSecr=1091796480"
"10.257087","54.38.73.16","172.18.0.2","TLSv1.2","4145","Application Data"
"10.257119","172.18.0.2","54.38.73.16","TCP","68","36876 → 21002 [ACK] Seq=25377 Ack=468777 Win=5580 Len=0 TSval=1091796522 TSecr=2677098301"
"10.281860","54.38.73.16","172.18.0.2","TLSv1.2","161","Application Data"
"10.281898","172.18.0.2","54.38.73.16","TCP","68","36876 → 21002 [ACK] Seq=25377 Ack=468870 Win=5609 Len=0 TSval=1091796546 TSecr=2677098307"
"10.344115","54.38.73.16","172.18.0.2","TLSv1.2","1125","Application Data"
"10.344315","172.18.0.2","54.38.73.16","TCP","68","36876 → 21002 [ACK] Seq=25377 Ack=469927 Win=5612 Len=0 TSval=1091796609 TSecr=2677098322"
"10.377638","54.38.73.16","172.18.0.2","TLSv1.2","2667","Application Data"
"10.377830","172.18.0.2","54.38.73.16","TCP","68","36876 → 21002 [ACK] Seq=25377 Ack=472526 Win=5597 Len=0 TSval=1091796642 TSecr=2677098331"
"10.386385","172.18.0.2","54.38.73.16","TLSv1.2","611","Application Data"
"10.447163","54.38.73.16","172.18.0.2","TCP","68","21002 → 36876 [ACK] Seq=472526 Ack=25920 Win=1452 Len=0 TSval=2677098349 TSecr=1091796651"
"10.716244","54.38.73.16","172.18.0.2","TLSv1.2","611","Application Data"
"10.716302","172.18.0.2","54.38.73.16","TCP","68","36876 → 21002 [ACK] Seq=25920 Ack=473069 Win=5608 Len=0 TSval=1091796981 TSecr=2677098401"
"10.717343","172.18.0.2","54.38.73.16","TLSv1.2","611","Application Data"
"10.741145","54.38.73.16","172.18.0.2","TCP","68","21002 → 36876 [ACK] Seq=473069 Ack=26463 Win=1452 Len=0 TSval=2677098422 TSecr=1091796982"
"11.073977","54.38.73.16","172.18.0.2","TLSv1.2","4145","Application Data"
"11.074171","172.18.0.2","54.38.73.16","TCP","68","36876 → 21002 [ACK] Seq=26463 Ack=477146 Win=5581 Len=0 TSval=1091797339 TSecr=2677098505"
"11.084386","54.38.73.16","172.18.0.2","TLSv1.2","7308","Application Data, Application Data"
"11.084605","172.18.0.2","54.38.73.16","TCP","68","36876 → 21002 [ACK] Seq=26463 Ack=484386 Win=5565 Len=0 TSval=1091797349 TSecr=2677098508"
"11.098308","54.38.73.16","172.18.0.2","TLSv1.2","1232","Application Data, Application Data"
"11.105670","54.38.73.16","172.18.0.2","TCP","2964","[TCP segment of a reassembled PDU]"
"11.105704","172.18.0.2","54.38.73.16","TCP","68","36876 → 21002 [ACK] Seq=26463 Ack=488446 Win=5596 Len=0 TSval=1091797370 TSecr=2677098511"
"11.116575","54.38.73.16","172.18.0.2","TLSv1.2","2964","Application Data [TCP segment of a reassembled PDU]"
"11.116608","172.18.0.2","54.38.73.16","TCP","68","36876 → 21002 [ACK] Seq=26463 Ack=491342 Win=5596 Len=0 TSval=1091797381 TSecr=2677098516"
"11.117593","54.38.73.16","172.18.0.2","TCP","1516","21002 → 36876 [ACK] Seq=491342 Ack=26463 Win=1452 Len=1448 TSval=2677098516 TSecr=1091797349 [TCP segment of a reassembled PDU]"
"11.129621","54.38.73.16","172.18.0.2","TLSv1.2","2964","[TCP Previous segment not captured] , Ignored Unknown Record"
"11.129656","172.18.0.2","54.38.73.16","TCP","80","36876 → 21002 [ACK] Seq=26463 Ack=492790 Win=5596 Len=0 TSval=1091797394 TSecr=2677098516 SLE=497134 SRE=500030"
"11.139016","54.38.73.16","172.18.0.2","TLSv1.2","1516","Ignored Unknown Record"
"11.139052","172.18.0.2","54.38.73.16","TCP","80","[TCP Dup ACK 372#1] 36876 → 21002 [ACK] Seq=26463 Ack=492790 Win=5596 Len=0 TSval=1091797404 TSecr=2677098516 SLE=497134 SRE=501478"
"11.140704","54.38.73.16","172.18.0.2","TLSv1.2","2964","Ignored Unknown Record"
"11.140743","172.18.0.2","54.38.73.16","TCP","80","[TCP Dup ACK 372#2] 36876 → 21002 [ACK] Seq=26463 Ack=492790 Win=5596 Len=0 TSval=1091797405 TSecr=2677098516 SLE=497134 SRE=504374"
"11.155504","54.38.73.16","172.18.0.2","TLSv1.2","4412","Ignored Unknown Record"
"11.156638","172.18.0.2","54.38.73.16","TCP","80","[TCP Dup ACK 372#3] 36876 → 21002 [ACK] Seq=26463 Ack=492790 Win=5596 Len=0 TSval=1091797420 TSecr=2677098516 SLE=497134 SRE=508718"
"11.163615","54.38.73.16","172.18.0.2","TLSv1.2","1516","Ignored Unknown Record"
"11.164692","54.38.73.16","172.18.0.2","TLSv1.2","2964","Ignored Unknown Record"
"11.164733","172.18.0.2","54.38.73.16","TCP","80","[TCP Dup ACK 372#4] 36876 → 21002 [ACK] Seq=26463 Ack=492790 Win=5596 Len=0 TSval=1091797429 TSecr=2677098516 SLE=497134 SRE=513062"
"11.180789","54.38.73.16","172.18.0.2","TLSv1.2","4412","[TCP Fast Retransmission] , Application Data, Application Data"
"11.180844","172.18.0.2","54.38.73.16","TCP","68","36876 → 21002 [ACK] Seq=26463 Ack=513062 Win=5472 Len=0 TSval=1091797445 TSecr=2677098532"
"11.182139","172.18.0.2","54.38.73.16","TLSv1.2","611","Application Data"
"11.188352","54.38.73.16","172.18.0.2","TLSv1.2","4412","Ignored Unknown Record"
"11.188386","172.18.0.2","54.38.73.16","TCP","68","36876 → 21002 [ACK] Seq=27006 Ack=517406 Win=5580 Len=0 TSval=1091797453 TSecr=2677098534"
"11.204558","54.38.73.16","172.18.0.2","TLSv1.2","4412","Ignored Unknown Record"
"11.204598","172.18.0.2","54.38.73.16","TCP","68","36876 → 21002 [ACK] Seq=27006 Ack=521750 Win=5580 Len=0 TSval=1091797469 TSecr=2677098538"
"11.205442","54.38.73.16","172.18.0.2","TCP","68","21002 → 36876 [ACK] Seq=521750 Ack=27006 Win=1452 Len=0 TSval=2677098538 TSecr=1091797447"
"11.205479","172.18.0.2","54.38.73.16","TLSv1.2","611","Application Data"
"11.214624","54.38.73.16","172.18.0.2","TLSv1.2","4366","Ignored Unknown Record"
"11.214630","54.38.73.16","172.18.0.2","TCP","1516","[TCP segment of a reassembled PDU]"
"11.214811","172.18.0.2","54.38.73.16","TCP","68","36876 → 21002 [ACK] Seq=27549 Ack=527496 Win=5568 Len=0 TSval=1091797479 TSecr=2677098540"
"11.227968","54.38.73.16","172.18.0.2","TLSv1.2","2964","Application Data, Application Data"
"11.228001","172.18.0.2","54.38.73.16","TCP","68","36876 → 21002 [ACK] Seq=27549 Ack=530392 Win=5596 Len=0 TSval=1091797492 TSecr=2677098544"
"11.239640","54.38.73.16","172.18.0.2","TLSv1.2","5860","Application Data [TCP segment of a reassembled PDU]"
"11.239683","172.18.0.2","54.38.73.16","TLSv1.2","611","Application Data"
"11.245173","54.38.73.16","172.18.0.2","TLSv1.2","1516","Application Data [TCP segment of a reassembled PDU]"
"11.252315","54.38.73.16","172.18.0.2","TCP","1516","21002 → 36876 [ACK] Seq=537632 Ack=27549 Win=1452 Len=1448 TSval=2677098550 TSecr=1091797492 [TCP segment of a reassembled PDU]"
"11.252348","172.18.0.2","54.38.73.16","TCP","68","36876 → 21002 [ACK] Seq=28092 Ack=539080 Win=5593 Len=0 TSval=1091797517 TSecr=2677098548"
"11.264574","54.38.73.16","172.18.0.2","TLSv1.2","4412","Application Data, Application Data"
"11.264710","54.38.73.16","172.18.0.2","TCP","1516","21002 → 36876 [ACK] Seq=543424 Ack=28092 Win=1452 Len=1448 TSval=2677098553 TSecr=1091797504 [TCP segment of a reassembled PDU]"
"11.264762","172.18.0.2","54.38.73.16","TCP","68","36876 → 21002 [ACK] Seq=28092 Ack=544872 Win=5564 Len=0 TSval=1091797529 TSecr=2677098553"
"11.277607","54.38.73.16","172.18.0.2","TLSv1.2","2036","Application Data, Application Data"
"11.277640","172.18.0.2","54.38.73.16","TCP","68","36876 → 21002 [ACK] Seq=28092 Ack=546840 Win=5599 Len=0 TSval=1091797542 TSecr=2677098556"
"11.288628","172.18.0.2","54.38.73.16","TLSv1.2","611","Application Data"
"11.351297","54.38.73.16","172.18.0.2","TCP","68","21002 → 36876 [ACK] Seq=546840 Ack=28635 Win=1452 Len=0 TSval=2677098575 TSecr=1091797553"
"11.944247","54.38.73.16","172.18.0.2","TLSv1.2","611","Application Data"
"11.945292","172.18.0.2","54.38.73.16","TLSv1.2","611","Application Data"
"11.969637","54.38.73.16","172.18.0.2","TCP","68","21002 → 36876 [ACK] Seq=547383 Ack=29178 Win=1452 Len=0 TSval=2677098729 TSecr=1091798210"
"12.354613","54.38.73.16","172.18.0.2","TLSv1.2","611","Application Data"
"12.367418","54.38.73.16","172.18.0.2","TLSv1.2","7308","Application Data"
"12.367604","172.18.0.2","54.38.73.16","TCP","68","36876 → 21002 [ACK] Seq=29178 Ack=555166 Win=5565 Len=0 TSval=1091798632 TSecr=2677098823"
"12.389925","54.38.73.16","172.18.0.2","TLSv1.2","1516","Application Data [TCP segment of a reassembled PDU]"
"12.391829","54.38.73.16","172.18.0.2","TLSv1.2","6402","Application Data, Application Data"
"12.391862","172.18.0.2","54.38.73.16","TCP","68","36876 → 21002 [ACK] Seq=29178 Ack=562948 Win=5565 Len=0 TSval=1091798656 TSecr=2677098834"
"12.401079","54.38.73.16","172.18.0.2","TCP","1516","[TCP segment of a reassembled PDU]"
"12.415829","54.38.73.16","172.18.0.2","TLSv1.2","5874","Application Data, Application Data"
"12.415864","172.18.0.2","54.38.73.16","TCP","68","36876 → 21002 [ACK] Seq=29178 Ack=570202 Win=5578 Len=0 TSval=1091798680 TSecr=2677098837"
"12.416357","172.18.0.2","54.38.73.16","TLSv1.2","611","Application Data"
"12.422799","54.38.73.16","172.18.0.2","TCP","1516","[TCP segment of a reassembled PDU]"
"12.441160","54.38.73.16","172.18.0.2","TCP","68","[TCP Previous segment not captured] 21002 → 36876 [ACK] Seq=580338 Ack=29721 Win=1452 Len=0 TSval=2677098847 TSecr=1091798681"
"12.441179","54.38.73.16","172.18.0.2","TCP","8756","[TCP Retransmission] 21002 → 36876 [ACK] Seq=571650 Ack=29178 Win=1452 Len=8688 TSval=2677098847 TSecr=1091798680"
"12.441365","172.18.0.2","54.38.73.16","TCP","68","36876 → 21002 [ACK] Seq=29721 Ack=580338 Win=5566 Len=0 TSval=1091798706 TSecr=2677098842"
"12.441809","172.18.0.2","54.38.73.16","TLSv1.2","611","Application Data"
"12.467017","54.38.73.16","172.18.0.2","TLSv1.2","4498","Ignored Unknown Record"
"12.467073","172.18.0.2","54.38.73.16","TCP","68","36876 → 21002 [ACK] Seq=30264 Ack=584768 Win=5586 Len=0 TSval=1091798732 TSecr=2677098853"
"12.507798","54.38.73.16","172.18.0.2","TCP","68","21002 → 36876 [ACK] Seq=584768 Ack=30264 Win=1452 Len=0 TSval=2677098864 TSecr=1091798706"
"12.507870","172.18.0.2","54.38.73.16","TLSv1.2","611","Application Data"
"12.534657","54.38.73.16","172.18.0.2","TCP","68","21002 → 36876 [ACK] Seq=584768 Ack=30807 Win=1452 Len=0 TSval=2677098870 TSecr=1091798772"
"12.969095","54.38.73.16","172.18.0.2","TLSv1.2","611","Application Data"
"12.970206","172.18.0.2","54.38.73.16","TLSv1.2","611","Application Data"
"12.992802","54.38.73.16","172.18.0.2","TLSv1.2","611","[TCP Spurious Retransmission] , Application Data"
"12.992845","172.18.0.2","54.38.73.16","TCP","80","[TCP Dup ACK 432#1] 36876 → 21002 [ACK] Seq=31350 Ack=585311 Win=5612 Len=0 TSval=1091799257 TSecr=2677098985 SLE=584768 SRE=585311"
"12.995693","54.38.73.16","172.18.0.2","TCP","68","21002 → 36876 [ACK] Seq=585311 Ack=31350 Win=1452 Len=0 TSval=2677098985 TSecr=1091799235"
"13.582609","54.38.73.16","172.18.0.2","TLSv1.2","3695","Application Data"
"13.582658","172.18.0.2","54.38.73.16","TCP","68","36876 → 21002 [ACK] Seq=31350 Ack=588938 Win=5584 Len=0 TSval=1091799847 TSecr=2677099078"
"13.582614","54.38.73.16","172.18.0.2","TLSv1.2","4412","Application Data"
"13.582670","172.18.0.2","54.38.73.16","TCP","68","36876 → 21002 [ACK] Seq=31350 Ack=593282 Win=5558 Len=0 TSval=1091799847 TSecr=2677099081"
"13.582617","54.38.73.16","172.18.0.2","TLSv1.2","1516","Application Data [TCP segment of a reassembled PDU]"
"13.582675","172.18.0.2","54.38.73.16","TCP","68","36876 → 21002 [ACK] Seq=31350 Ack=594730 Win=5551 Len=0 TSval=1091799847 TSecr=2677099087"
"13.582620","54.38.73.16","172.18.0.2","TCP","1516","21002 → 36876 [ACK] Seq=594730 Ack=31350 Win=1452 Len=1448 TSval=2677099117 TSecr=1091799257 [TCP segment of a reassembled PDU]"
"13.582683","172.18.0.2","54.38.73.16","TCP","68","36876 → 21002 [ACK] Seq=31350 Ack=596178 Win=5540 Len=0 TSval=1091799847 TSecr=2677099117"
"13.608979","54.38.73.16","172.18.0.2","TLSv1.2","10022","Application Data, Application Data, Application Data, Application Data, Application Data, Application Data"
"13.609015","172.18.0.2","54.38.73.16","TCP","68","36876 → 21002 [ACK] Seq=31350 Ack=606132 Win=5550 Len=0 TSval=1091799873 TSecr=2677099139"
"13.634687","54.38.73.16","172.18.0.2","TLSv1.2","9407","Application Data, Application Data, Application Data"
"13.634724","172.18.0.2","54.38.73.16","TCP","68","36876 → 21002 [ACK] Seq=31350 Ack=615471 Win=5550 Len=0 TSval=1091799899 TSecr=2677099145"
"13.635644","172.18.0.2","54.38.73.16","TLSv1.2","611","Application Data"
"13.659186","54.38.73.16","172.18.0.2","TLSv1.2","9950","Application Data, Application Data, Application Data, Application Data"
"13.659221","172.18.0.2","54.38.73.16","TCP","68","36876 → 21002 [ACK] Seq=31893 Ack=625353 Win=5550 Len=0 TSval=1091799924 TSecr=2677099151"
"13.659472","54.38.73.16","172.18.0.2","TCP","68","21002 → 36876 [ACK] Seq=625353 Ack=31893 Win=1452 Len=0 TSval=2677099152 TSecr=1091799900"
"13.659740","172.18.0.2","54.38.73.16","TLSv1.2","611","Application Data"
"13.685953","54.38.73.16","172.18.0.2","TLSv1.2","9950","Application Data, Application Data, Application Data, Application Data"
"13.685993","172.18.0.2","54.38.73.16","TCP","68","36876 → 21002 [ACK] Seq=32436 Ack=635235 Win=5531 Len=0 TSval=1091799950 TSecr=2677099158"
"13.711763","54.38.73.16","172.18.0.2","TLSv1.2","9950","Application Data, Application Data, Application Data, Application Data"
"13.711805","172.18.0.2","54.38.73.16","TCP","68","36876 → 21002 [ACK] Seq=32436 Ack=645117 Win=5550 Len=0 TSval=1091799976 TSecr=2677099164"
"13.712285","172.18.0.2","54.38.73.16","TLSv1.2","611","Application Data"
"13.736601","54.38.73.16","172.18.0.2","TLSv1.2","9950","Application Data, Application Data, Application Data, Application Data"
"13.736640","172.18.0.2","54.38.73.16","TCP","68","36876 → 21002 [ACK] Seq=32979 Ack=654999 Win=5550 Len=0 TSval=1091800001 TSecr=2677099170"
"13.761369","54.38.73.16","172.18.0.2","TLSv1.2","5780","Application Data, Application Data"
"13.761406","172.18.0.2","54.38.73.16","TCP","68","36876 → 21002 [ACK] Seq=32979 Ack=660711 Win=5581 Len=0 TSval=1091800026 TSecr=2677099177"
"13.768646","172.18.0.2","54.38.73.16","TLSv1.2","611","Application Data"
"13.831580","54.38.73.16","172.18.0.2","TCP","68","21002 → 36876 [ACK] Seq=660711 Ack=33522 Win=1452 Len=0 TSval=2677099195 TSecr=1091800033"
"14.401844","54.38.73.16","172.18.0.2","TLSv1.2","611","Application Data"
"14.403003","172.18.0.2","54.38.73.16","TLSv1.2","611","Application Data"
"14.428693","54.38.73.16","172.18.0.2","TCP","68","21002 → 36876 [ACK] Seq=661254 Ack=34065 Win=1452 Len=0 TSval=2677099344 TSecr=1091800667"
"14.812751","54.38.73.16","172.18.0.2","TLSv1.2","611","Application Data"
"14.812806","54.38.73.16","172.18.0.2","TCP","2964","[TCP segment of a reassembled PDU]"
"14.812810","54.38.73.16","172.18.0.2","TLSv1.2","4412","Application Data [TCP segment of a reassembled PDU]"
"14.812814","54.38.73.16","172.18.0.2","TLSv1.2","1516","Application Data [TCP segment of a reassembled PDU]"
"14.813004","172.18.0.2","54.38.73.16","TCP","68","36876 → 21002 [ACK] Seq=34065 Ack=670485 Win=5548 Len=0 TSval=1091801077 TSecr=2677099421"
"14.838010","54.38.73.16","172.18.0.2","TLSv1.2","9515","Application Data, Application Data, Application Data"
"14.838047","172.18.0.2","54.38.73.16","TCP","68","36876 → 21002 [ACK] Seq=34065 Ack=679932 Win=5550 Len=0 TSval=1091801102 TSecr=2677099446"
"14.838561","172.18.0.2","54.38.73.16","TLSv1.2","611","Application Data"
"14.863998","54.38.73.16","172.18.0.2","TCP","68","[TCP Previous segment not captured] 21002 → 36876 [ACK] Seq=689271 Ack=34608 Win=1452 Len=0 TSval=2677099452 TSecr=1091801103"
"14.864018","54.38.73.16","172.18.0.2","TCP","9407","[TCP Retransmission] 21002 → 36876 [PSH, ACK] Seq=679932 Ack=34065 Win=1452 Len=9339 TSval=2677099452 TSecr=1091801102"
"14.864079","172.18.0.2","54.38.73.16","TCP","68","36876 → 21002 [ACK] Seq=34608 Ack=689271 Win=5561 Len=0 TSval=1091801129 TSecr=2677099446"
"14.864935","172.18.0.2","54.38.73.16","TLSv1.2","611","Application Data"
"14.888894","54.38.73.16","172.18.0.2","TLSv1.2","9407","Application Data, Application Data, Application Data"
"14.889092","172.18.0.2","54.38.73.16","TCP","68","36876 → 21002 [ACK] Seq=35151 Ack=698610 Win=5550 Len=0 TSval=1091801154 TSecr=2677099459"
"14.914658","54.38.73.16","172.18.0.2","TLSv1.2","9950","Application Data, Application Data, Application Data, Application Data"
"14.914715","172.18.0.2","54.38.73.16","TCP","68","36876 → 21002 [ACK] Seq=35151 Ack=708492 Win=5550 Len=0 TSval=1091801179 TSecr=2677099465"
"14.938572","54.38.73.16","172.18.0.2","TLSv1.2","9979","Application Data, Application Data, Application Data, Application Data, Application Data"
"14.938627","172.18.0.2","54.38.73.16","TCP","68","36876 → 21002 [ACK] Seq=35151 Ack=718403 Win=5550 Len=0 TSval=1091801203 TSecr=2677099471"
"14.939316","172.18.0.2","54.38.73.16","TLSv1.2","611","Application Data"
"14.962667","54.38.73.16","172.18.0.2","TLSv1.2","9950","Application Data, Application Data, Application Data, Application Data"
"14.962712","172.18.0.2","54.38.73.16","TCP","68","36876 → 21002 [ACK] Seq=35694 Ack=728285 Win=5550 Len=0 TSval=1091801227 TSecr=2677099477"
"14.986967","54.38.73.16","172.18.0.2","TLSv1.2","2667","Application Data"
"14.987008","172.18.0.2","54.38.73.16","TLSv1.2","611","Application Data"
"15.052049","54.38.73.16","172.18.0.2","TCP","68","21002 → 36876 [ACK] Seq=730884 Ack=36237 Win=1452 Len=0 TSval=2677099500 TSecr=1091801251"
"15.052091","172.18.0.2","54.38.73.16","TLSv1.2","611","Application Data"
"15.117424","54.38.73.16","172.18.0.2","TCP","68","21002 → 36876 [ACK] Seq=730884 Ack=36780 Win=1452 Len=0 TSval=2677099516 TSecr=1091801317"
"15.456666","54.38.73.16","172.18.0.2","TLSv1.2","611","Application Data"
"15.457742","172.18.0.2","54.38.73.16","TLSv1.2","611","Application Data"
"15.481631","54.38.73.16","172.18.0.2","TCP","68","21002 → 36876 [ACK] Seq=731427 Ack=37323 Win=1452 Len=0 TSval=2677099607 TSecr=1091801722"
"15.682234","54.38.73.16","172.18.0.2","TLSv1.2","611","Application Data"
"15.716110","54.38.73.16","172.18.0.2","TLSv1.2","7308","Application Data"
"15.716274","172.18.0.2","54.38.73.16","TCP","68","36876 → 21002 [ACK] Seq=37323 Ack=739210 Win=5565 Len=0 TSval=1091801981 TSecr=2677099657"
"15.728338","54.38.73.16","172.18.0.2","TLSv1.2","1516","Application Data [TCP segment of a reassembled PDU]"
"15.741177","54.38.73.16","172.18.0.2","TLSv1.2","5888","Application Data, Application Data"
"15.741210","172.18.0.2","54.38.73.16","TCP","68","36876 → 21002 [ACK] Seq=37323 Ack=746478 Win=5578 Len=0 TSval=1091802006 TSecr=2677099669"
"15.741530","54.38.73.16","172.18.0.2","TCP","1516","[TCP segment of a reassembled PDU]"
"15.765526","54.38.73.16","172.18.0.2","TLSv1.2","2964","Application Data [TCP segment of a reassembled PDU]"
"15.765560","172.18.0.2","54.38.73.16","TCP","68","36876 → 21002 [ACK] Seq=37323 Ack=750822 Win=5596 Len=0 TSval=1091802030 TSecr=2677099672"
"15.765809","54.38.73.16","172.18.0.2","TLSv1.2","5860","Application Data [TCP segment of a reassembled PDU]"
"15.766050","172.18.0.2","54.38.73.16","TCP","68","36876 → 21002 [ACK] Seq=37323 Ack=756614 Win=5566 Len=0 TSval=1091802030 TSecr=2677099678"
"15.789535","54.38.73.16","172.18.0.2","TLSv1.2","1356","Application Data, Application Data"
"15.789992","172.18.0.2","54.38.73.16","TLSv1.2","611","Application Data"
"15.793233","54.38.73.16","172.18.0.2","TLSv1.2","10204","Application Data, Application Data"
"15.793380","172.18.0.2","54.38.73.16","TCP","68","36876 → 21002 [ACK] Seq=37866 Ack=768038 Win=5550 Len=0 TSval=1091802058 TSecr=2677099685"
"15.814334","54.38.73.16","172.18.0.2","TCP","68","21002 → 36876 [ACK] Seq=768038 Ack=37866 Win=1452 Len=0 TSval=2677099690 TSecr=1091802054"
"15.816950","54.38.73.16","172.18.0.2","TCP","1516","21002 → 36876 [ACK] Seq=768038 Ack=37866 Win=1452 Len=1448 TSval=2677099691 TSecr=1091802058 [TCP segment of a reassembled PDU]"
"15.817665","54.38.73.16","172.18.0.2","TLSv1.2","9761","Application Data, Application Data, Application Data, Application Data, Application Data"
"15.817700","172.18.0.2","54.38.73.16","TCP","68","36876 → 21002 [ACK] Seq=37866 Ack=779179 Win=5550 Len=0 TSval=1091802082 TSecr=2677099691"
"15.818851","172.18.0.2","54.38.73.16","TLSv1.2","611","Application Data"
"15.855090","54.38.73.16","172.18.0.2","TLSv1.2","4145","Application Data"
"15.855156","172.18.0.2","54.38.73.16","TCP","68","36876 → 21002 [ACK] Seq=38409 Ack=783256 Win=5579 Len=0 TSval=1091802120 TSecr=2677099700"
"15.855096","54.38.73.16","172.18.0.2","TLSv1.2","7308","Application Data"
"15.855262","172.18.0.2","54.38.73.16","TCP","68","36876 → 21002 [ACK] Seq=38409 Ack=790496 Win=5533 Len=0 TSval=1091802120 TSecr=2677099700"
"15.856074","172.18.0.2","54.38.73.16","TLSv1.2","611","Application Data"
"15.879237","54.38.73.16","172.18.0.2","TLSv1.2","4287","Application Data, Application Data"
"15.879304","172.18.0.2","54.38.73.16","TCP","68","36876 → 21002 [ACK] Seq=38952 Ack=794715 Win=5580 Len=0 TSval=1091802144 TSecr=2677099707"
"15.920534","54.38.73.16","172.18.0.2","TCP","68","21002 → 36876 [ACK] Seq=794715 Ack=38952 Win=1452 Len=0 TSval=2677099717 TSecr=1091802121"
"15.920572","172.18.0.2","54.38.73.16","TLSv1.2","611","Application Data"
"15.991023","54.38.73.16","172.18.0.2","TCP","68","21002 → 36876 [ACK] Seq=794715 Ack=39495 Win=1452 Len=0 TSval=2677099735 TSecr=1091802185"
