_ws.col.Time,_ws.col.Source,_ws.col.Destination,_ws.col.Protocol,_ws.col.Length,_ws.col.Info
"0.000000","172.18.0.2","54.38.73.16","TLSv1.2","611","Application Data"
"0.025188","54.38.73.16","172.18.0.2","TCP","68","21002 → 36876 [ACK] Seq=1 Ack=544 Win=1452 Len=0 TSval=2677115804 TSecr=1091866509"
"0.410881","54.38.73.16","172.18.0.2","TLSv1.2","611","Application Data"
"0.410954","172.18.0.2","54.38.73.16","TCP","68","36876 → 21002 [ACK] Seq=544 Ack=544 Win=5608 Len=0 TSval=1091866920 TSecr=2677115880"
"0.412049","172.18.0.2","54.38.73.16","TLSv1.2","2153","Application Data"
"0.437026","54.38.73.16","172.18.0.2","TCP","68","21002 → 36876 [ACK] Seq=544 Ack=2629 Win=1450 Len=0 TSval=2677115907 TSecr=1091866921"
"0.760660","54.38.73.16","172.18.0.2","TLSv1.2","611","Application Data"
"0.760724","172.18.0.2","54.38.73.16","TCP","68","36876 → 21002 [ACK] Seq=2629 Ack=1087 Win=5608 Len=0 TSval=1091867270 TSecr=2677115988"
"0.921411","54.38.73.16","172.18.0.2","TLSv1.2","1125","Application Data"
"0.921446","172.18.0.2","54.38.73.16","TCP","68","36876 → 21002 [ACK] Seq=2629 Ack=2144 Win=5600 Len=0 TSval=1091867430 TSecr=2677116016"
"0.927562","172.18.0.2","54.38.73.16","TLSv1.2","611","Application Data"
"0.951479","54.38.73.16","172.18.0.2","TCP","68","21002 → 36876 [ACK] Seq=2144 Ack=3172 Win=1452 Len=0 TSval=2677116036 TSecr=1091867437"
"1.238358","54.38.73.16","172.18.0.2","TLSv1.2","611","Application Data"
"1.239395","172.18.0.2","54.38.73.16","TLSv1.2","611","Application Data"
"1.264105","54.38.73.16","172.18.0.2","TCP","68","21002 → 36876 [ACK] Seq=2687 Ack=3715 Win=1452 Len=0 TSval=2677116114 TSecr=1091867748"
"1.516869","54.38.73.16","172.18.0.2","TLSv1.2","4145","Application Data"
"1.516874","54.38.73.16","172.18.0.2","TCP","2964","[TCP segment of a reassembled PDU]"
"1.517030","172.18.0.2","54.38.73.16","TCP","68","36876 → 21002 [ACK] Seq=3715 Ack=9660 Win=5566 Len=0 TSval=1091868026 TSecr=2677116177"
"1.527764","54.38.73.16","172.18.0.2","TLSv1.2","4412","Application Data [TCP segment of a reassembled PDU]"
"1.527798","172.18.0.2","54.38.73.16","TCP","68","36876 → 21002 [ACK] Seq=3715 Ack=14004 Win=5580 Len=0 TSval=1091868037 TSecr=2677116180"
"1.528306","172.18.0.2","54.38.73.16","TLSv1.2","611","Application Data"
"1.542104","54.38.73.16","172.18.0.2","TLSv1.2","5860","Application Data, Application Data"
"1.542138","172.18.0.2","54.38.73.16","TCP","68","36876 → 21002 [ACK] Seq=4258 Ack=19796 Win=5581 Len=0 TSval=1091868051 TSecr=2677116183"
"1.549834","54.38.73.16","172.18.0.2","TCP","1516","21002 → 36876 [ACK] Seq=19796 Ack=3715 Win=1452 Len=1448 TSval=2677116185 TSecr=1091868026 [TCP segment of a reassembled PDU]"
"1.551937","54.38.73.16","172.18.0.2","TLSv1.2","4412","Application Data, Application Data"
"1.552083","172.18.0.2","54.38.73.16","TCP","68","36876 → 21002 [ACK] Seq=4258 Ack=25588 Win=5580 Len=0 TSval=1091868061 TSecr=2677116185"
"1.552576","54.38.73.16","172.18.0.2","TCP","68","21002 → 36876 [ACK] Seq=25588 Ack=4258 Win=1452 Len=0 TSval=2677116186 TSecr=1091868037"
"1.568362","54.38.73.16","172.18.0.2","TLSv1.2","5860","Application Data [TCP segment of a reassembled PDU]"
"1.568398","172.18.0.2","54.38.73.16","TCP","68","36876 → 21002 [ACK] Seq=4258 Ack=31380 Win=5581 Len=0 TSval=1091868077 TSecr=2677116190"
"1.568912","172.18.0.2","54.38.73.16","TLSv1.2","611","Application Data"
"1.576979","54.38.73.16","172.18.0.2","TLSv1.2","5860","Application Data, Application Data, Application Data"
"1.577013","172.18.0.2","54.38.73.16","TCP","68","36876 → 21002 [ACK] Seq=4801 Ack=37172 Win=5581 Len=0 TSval=1091868086 TSecr=2677116192"
"1.584332","54.38.73.16","172.18.0.2","TCP","1516","21002 → 36876 [ACK] Seq=37172 Ack=4258 Win=1452 Len=1448 TSval=2677116194 TSecr=1091868061 [TCP segment of a reassembled PDU]"
"1.592456","54.38.73.16","172.18.0.2","TLSv1.2","4412","Application Data, Application Data"
"1.592604","172.18.0.2","54.38.73.16","TCP","68","36876 → 21002 [ACK] Seq=4801 Ack=42964 Win=5580 Len=0 TSval=1091868102 TSecr=2677116194"
"1.602663","54.38.73.16","172.18.0.2","TLSv1.2","5860","Application Data [TCP segment of a reassembled PDU]"
"1.602705","172.18.0.2","54.38.73.16","TCP","68","36876 → 21002 [ACK] Seq=4801 Ack=48756 Win=5581 Len=0 TSval=1091868112 TSecr=2677116198"
"1.617674","54.38.73.16","172.18.0.2","TLSv1.2","5860","Application Data, Application Data"
"1.617708","172.18.0.2","54.38.73.16","TCP","68","36876 → 21002 [ACK] Seq=4801 Ack=54548 Win=5581 Len=0 TSval=1091868127 TSecr=2677116202"
"1.628444","54.38.73.16","172.18.0.2","TLSv1.2","2670","Application Data, Application Data"
"1.628481","172.18.0.2","54.38.73.16","TCP","68","36876 → 21002 [ACK] Seq=4801 Ack=57150 Win=5597 Len=0 TSval=1091868138 TSecr=2677116205"
"1.628450","54.38.73.16","172.18.0.2","TLSv1.2","4412","Application Data"
"1.628612","172.18.0.2","54.38.73.16","TCP","68","36876 → 21002 [ACK] Seq=4801 Ack=61494 Win=5566 Len=0 TSval=1091868138 TSecr=2677116205"
"1.628997","172.18.0.2","54.38.73.16","TLSv1.2","611","Application Data"
"1.643747","54.38.73.16","172.18.0.2","TLSv1.2","5860","Application Data [TCP segment of a reassembled PDU]"
"1.643786","172.18.0.2","54.38.73.16","TCP","68","36876 → 21002 [ACK] Seq=5344 Ack=67286 Win=5581 Len=0 TSval=1091868153 TSecr=2677116209"
"1.654064","54.38.73.16","172.18.0.2","TLSv1.2","4440","Application Data, Application Data"
"1.654098","172.18.0.2","54.38.73.16","TCP","68","36876 → 21002 [ACK] Seq=5344 Ack=71658 Win=5586 Len=0 TSval=1091868163 TSecr=2677116211"
"1.690894","54.38.73.16","172.18.0.2","TCP","68","21002 → 36876 [ACK] Seq=71658 Ack=5344 Win=1452 Len=0 TSval=2677116221 TSecr=1091868138"
"1.690968","172.18.0.2","54.38.73.16","TLSv1.2","1154","Application Data, Application Data"
"1.755741","54.38.73.16","172.18.0.2","TCP","68","21002 → 36876 [ACK] Seq=71658 Ack=6430 Win=1452 Len=0 TSval=2677116237 TSecr=1091868200"
"2.152722","54.38.73.16","172.18.0.2","TLSv1.2","611","Application Data"
"2.153068","172.18.0.2","54.38.73.16","TLSv1.2","611","Application Data"
"2.178187","54.38.73.16","172.18.0.2","TLSv1.2","611","[TCP Spurious Retransmission] , Application Data"
"2.178211","172.18.0.2","54.38.73.16","TCP","80","[TCP Dup ACK 53#1] 36876 → 21002 [ACK] Seq=6973 Ack=72201 Win=5612 Len=0 TSval=1091868687 TSecr=2677116343 SLE=71658 SRE=72201"
"2.178267","54.38.73.16","172.18.0.2","TCP","68","21002 → 36876 [ACK] Seq=72201 Ack=6973 Win=1452 Len=0 TSval=2677116343 TSecr=1091868662"
"2.509377","54.38.73.16","172.18.0.2","TLSv1.2","611","Application Data"
"2.509447","172.18.0.2","54.38.73.16","TCP","68","36876 → 21002 [ACK] Seq=6973 Ack=72744 Win=5608 Len=0 TSval=1091869018 TSecr=2677116424"
"2.516918","54.38.73.16","172.18.0.2","TLSv1.2","4412","Application Data"
"2.516956","172.18.0.2","54.38.73.16","TCP","68","36876 → 21002 [ACK] Seq=6973 Ack=77088 Win=5580 Len=0 TSval=1091869026 TSecr=2677116427"
"2.527881","54.38.73.16","172.18.0.2","TLSv1.2","5860","Application Data, Application Data"
"2.527916","172.18.0.2","54.38.73.16","TCP","68","36876 → 21002 [ACK] Seq=6973 Ack=82880 Win=5581 Len=0 TSval=1091869037 TSecr=2677116430"
"2.543434","54.38.73.16","172.18.0.2","TLSv1.2","2964","Application Data [TCP segment of a reassembled PDU]"
"2.543467","172.18.0.2","54.38.73.16","TCP","68","36876 → 21002 [ACK] Seq=6973 Ack=85776 Win=5596 Len=0 TSval=1091869053 TSecr=2677116434"
"2.554182","54.38.73.16","172.18.0.2","TLSv1.2","5860","Application Data, Application Data"
"2.554216","172.18.0.2","54.38.73.16","TCP","68","36876 → 21002 [ACK] Seq=6973 Ack=91568 Win=5581 Len=0 TSval=1091869063 TSecr=2677116436"
"2.560442","54.38.73.16","172.18.0.2","TCP","1516","21002 → 36876 [ACK] Seq=91568 Ack=6973 Win=1452 Len=1448 TSval=2677116438 TSecr=1091869037 [TCP segment of a reassembled PDU]"
"2.560475","172.18.0.2","54.38.73.16","TCP","68","36876 → 21002 [ACK] Seq=6973 Ack=93016 Win=5593 Len=0 TSval=1091869070 TSecr=2677116438"
"2.567483","54.38.73.16","172.18.0.2","TCP","1516","21002 → 36876 [ACK] Seq=93016 Ack=6973 Win=1452 Len=1448 TSval=2677116440 TSecr=1091869053 [TCP segment of a reassembled PDU]"
"2.567515","172.18.0.2","54.38.73.16","TCP","68","36876 → 21002 [ACK] Seq=6973 Ack=94464 Win=5593 Len=0 TSval=1091869077 TSecr=2677116440"
"2.578706","54.38.73.16","172.18.0.2","TLSv1.2","7308","Application Data, Application Data, Application Data"
"2.578764","172.18.0.2","54.38.73.16","TCP","68","36876 → 21002 [ACK] Seq=6973 Ack=101704 Win=5565 Len=0 TSval=1091869088 TSecr=2677116443"
"2.579049","54.38.73.16","172.18.0.2","TLSv1.2","1516","Application Data [TCP segment of a reassembled PDU]"
"2.579080","172.18.0.2","54.38.73.16","TCP","68","36876 → 21002 [ACK] Seq=6973 Ack=103152 Win=5554 Len=0 TSval=1091869088 TSecr=2677116443"
"2.579814","172.18.0.2","54.38.73.16","TLSv1.2","611","Application Data"
"2.591537","54.38.73.16","172.18.0.2","TLSv1.2","2964","Application Data [TCP segment of a reassembled PDU]"
"2.591570","172.18.0.2","54.38.73.16","TCP","68","36876 → 21002 [ACK] Seq=7516 Ack=106048 Win=5596 Len=0 TSval=1091869101 TSecr=2677116446"
"2.603670","54.38.73.16","172.18.0.2","TLSv1.2","1036","Application Data"
"2.603718","172.18.0.2","54.38.73.16","TCP","68","36876 → 21002 [ACK] Seq=7516 Ack=107016 Win=5605 Len=0 TSval=1091869113 TSecr=2677116449"
"2.603680","54.38.73.16","172.18.0.2","TCP","68","21002 → 36876 [ACK] Seq=107016 Ack=7516 Win=1452 Len=0 TSval=2677116449 TSecr=1091869089"
"2.669811","54.38.73.16","172.18.0.2","TLSv1.2","4145","Application Data"
"2.669848","172.18.0.2","54.38.73.16","TCP","68","36876 → 21002 [ACK] Seq=7516 Ack=111093 Win=5580 Len=0 TSval=1091869179 TSecr=2677116465"
"2.693728","54.38.73.16","172.18.0.2","TLSv1.2","675","Application Data"
"2.693775","172.18.0.2","54.38.73.16","TCP","68","36876 → 21002 [ACK] Seq=7516 Ack=111700 Win=5593 Len=0 TSval=1091869203 TSecr=2677116471"
"2.702282","172.18.0.2","54.38.73.16","TLSv1.2","611","Application Data"
"2.727042","54.38.73.16","172.18.0.2","TCP","68","21002 → 36876 [ACK] Seq=111700 Ack=8059 Win=1452 Len=0 TSval=2677116479 TSecr=1091869211"
"3.073288","54.38.73.16","172.18.0.2","TLSv1.2","611","Application Data"
"3.073353","172.18.0.2","54.38.73.16","TCP","68","36876 → 21002 [ACK] Seq=8059 Ack=112243 Win=5608 Len=0 TSval=1091869582 TSecr=2677116547"
"3.074405","172.18.0.2","54.38.73.16","TLSv1.2","611","Application Data"
"3.098361","54.38.73.16","172.18.0.2","TCP","68","21002 → 36876 [ACK] Seq=112243 Ack=8602 Win=1452 Len=0 TSval=2677116573 TSecr=1091869583"
"3.415211","54.38.73.16","172.18.0.2","TLSv1.2","611","Application Data"
"3.415618","172.18.0.2","54.38.73.16","TLSv1.2","611","Application Data"
"3.441063","54.38.73.16","172.18.0.2","TCP","68","21002 → 36876 [ACK] Seq=112786 Ack=9145 Win=1452 Len=0 TSval=2677116658 TSecr=1091869925"
"3.445532","54.38.73.16","172.18.0.2","TCP","1516","[TCP segment of a reassembled PDU]"
"3.445820","54.38.73.16","172.18.0.2","TLSv1.2","2247","Application Data"
"3.445913","172.18.0.2","54.38.73.16","TCP","68","36876 → 21002 [ACK] Seq=9145 Ack=116413 Win=5612 Len=0 TSval=1091869955 TSecr=2677116659"
"3.456213","54.38.73.16","172.18.0.2","TCP","2964","[TCP segment of a reassembled PDU]"
"3.456361","172.18.0.2","54.38.73.16","TCP","68","36876 → 21002 [ACK] Seq=9145 Ack=119309 Win=5596 Len=0 TSval=1091869965 TSecr=2677116662"
"3.471363","54.38.73.16","172.18.0.2","TLSv1.2","799","Application Data"
"3.480321","54.38.73.16","172.18.0.2","TCP","2964","[TCP segment of a reassembled PDU]"
"3.480355","172.18.0.2","54.38.73.16","TCP","68","36876 → 21002 [ACK] Seq=9145 Ack=122936 Win=5596 Len=0 TSval=1091869989 TSecr=2677116666"
"3.490050","54.38.73.16","172.18.0.2","TLSv1.2","7308","Application Data, Application Data"
"3.490206","172.18.0.2","54.38.73.16","TCP","68","36876 → 21002 [ACK] Seq=9145 Ack=130176 Win=5565 Len=0 TSval=1091869999 TSecr=2677116670"
"3.505397","54.38.73.16","172.18.0.2","TLSv1.2","2964","Application Data [TCP segment of a reassembled PDU]"
"3.505430","172.18.0.2","54.38.73.16","TCP","68","36876 → 21002 [ACK] Seq=9145 Ack=133072 Win=5596 Len=0 TSval=1091870014 TSecr=2677116674"
"3.512759","54.38.73.16","172.18.0.2","TCP","1516","21002 → 36876 [ACK] Seq=133072 Ack=9145 Win=1452 Len=1448 TSval=2677116676 TSecr=1091869989 [TCP segment of a reassembled PDU]"
"3.514449","54.38.73.16","172.18.0.2","TLSv1.2","7308","Application Data, Application Data, Application Data"
"3.514595","172.18.0.2","54.38.73.16","TCP","68","36876 → 21002 [ACK] Seq=9145 Ack=141760 Win=5565 Len=0 TSval=1091870024 TSecr=2677116676"
"3.515367","172.18.0.2","54.38.73.16","TLSv1.2","611","Application Data"
"3.530064","54.38.73.16","172.18.0.2","TCP","2964","21002 → 36876 [ACK] Seq=141760 Ack=9145 Win=1452 Len=2896 TSval=2677116680 TSecr=1091870014 [TCP segment of a reassembled PDU]"
"3.530102","172.18.0.2","54.38.73.16","TCP","68","36876 → 21002 [ACK] Seq=9688 Ack=144656 Win=5596 Len=0 TSval=1091870039 TSecr=2677116680"
"3.541060","54.38.73.16","172.18.0.2","TLSv1.2","8756","Application Data, Application Data, Application Data, Application Data"
"3.541207","172.18.0.2","54.38.73.16","TCP","68","36876 → 21002 [ACK] Seq=9688 Ack=153344 Win=5566 Len=0 TSval=1091870050 TSecr=2677116683"
"3.557258","54.38.73.16","172.18.0.2","TCP","2964","21002 → 36876 [ACK] Seq=153344 Ack=9688 Win=1452 Len=2896 TSval=2677116687 TSecr=1091870024 [TCP segment of a reassembled PDU]"
"3.557297","172.18.0.2","54.38.73.16","TCP","68","36876 → 21002 [ACK] Seq=9688 Ack=156240 Win=5596 Len=0 TSval=1091870066 TSecr=2677116687"
"3.568776","54.38.73.16","172.18.0.2","TLSv1.2","1738","Application Data, Application Data"
"3.568809","172.18.0.2","54.38.73.16","TCP","68","36876 → 21002 [ACK] Seq=9688 Ack=157910 Win=5601 Len=0 TSval=1091870078 TSecr=2677116689"
"3.577963","172.18.0.2","54.38.73.16","TLSv1.2","611","Application Data"
"3.642707","54.38.73.16","172.18.0.2","TCP","68","21002 → 36876 [ACK] Seq=157910 Ack=10231 Win=1452 Len=0 TSval=2677116709 TSecr=1091870087"
"3.904745","54.38.73.16","172.18.0.2","TLSv1.2","611","Application Data"
"3.905820","172.18.0.2","54.38.73.16","TLSv1.2","611","Application Data"
"3.931026","54.38.73.16","172.18.0.2","TCP","68","21002 → 36876 [ACK] Seq=158453 Ack=10774 Win=1452 Len=0 TSval=2677116781 TSecr=1091870415"
"4.200590","54.38.73.16","172.18.0.2","TLSv1.2","611","Application Data"
"4.200633","54.38.73.16","172.18.0.2","TCP","2964","[TCP segment of a reassembled PDU]"
"4.200793","172.18.0.2","54.38.73.16","TCP","68","36876 → 21002 [ACK] Seq=10774 Ack=161892 Win=5586 Len=0 TSval=1091870710 TSecr=2677116845"
"4.224514","54.38.73.16","172.18.0.2","TLSv1.2","799","Application Data"
"4.232962","54.38.73.16","172.18.0.2","TLSv1.2","4412","Application Data"
"4.233114","172.18.0.2","54.38.73.16","TCP","68","36876 → 21002 [ACK] Seq=10774 Ack=166967 Win=5580 Len=0 TSval=1091870742 TSecr=2677116854"
"4.233289","54.38.73.16","172.18.0.2","TLSv1.2","7308","Application Data [TCP segment of a reassembled PDU]"
"4.233693","172.18.0.2","54.38.73.16","TLSv1.2","611","Application Data"
"4.259583","54.38.73.16","172.18.0.2","TLSv1.2","5860","Application Data, Application Data, Application Data"
"4.259619","172.18.0.2","54.38.73.16","TCP","68","36876 → 21002 [ACK] Seq=11317 Ack=179999 Win=5581 Len=0 TSval=1091870769 TSecr=2677116863"
"4.260808","54.38.73.16","172.18.0.2","TLSv1.2","7082","Application Data, Application Data, Application Data"
"4.260914","172.18.0.2","54.38.73.16","TCP","68","36876 → 21002 [ACK] Seq=11317 Ack=187013 Win=5565 Len=0 TSval=1091870770 TSecr=2677116863"
"4.261529","172.18.0.2","54.38.73.16","TLSv1.2","611","Application Data"
"4.283894","54.38.73.16","172.18.0.2","TLSv1.2","5860","Application Data"
"4.283929","172.18.0.2","54.38.73.16","TCP","68","36876 → 21002 [ACK] Seq=11860 Ack=192805 Win=5581 Len=0 TSval=1091870793 TSecr=2677116869"
"4.284837","54.38.73.16","172.18.0.2","TLSv1.2","6728","Application Data, Application Data, Application Data"
"4.284958","172.18.0.2","54.38.73.16","TCP","68","36876 → 21002 [ACK] Seq=11860 Ack=199465 Win=5565 Len=0 TSval=1091870794 TSecr=2677116869"
"4.308140","54.38.73.16","172.18.0.2","TLSv1.2","5860","Application Data"
"4.308180","172.18.0.2","54.38.73.16","TCP","68","36876 → 21002 [ACK] Seq=11860 Ack=205257 Win=5581 Len=0 TSval=1091870817 TSecr=2677116875"
"4.310161","54.38.73.16","172.18.0.2","TLSv1.2","6728","Application Data, Application Data, Application Data"
"4.310311","172.18.0.2","54.38.73.16","TCP","68","36876 → 21002 [ACK] Seq=11860 Ack=211917 Win=5565 Len=0 TSval=1091870819 TSecr=2677116875"
"4.311063","172.18.0.2","54.38.73.16","TLSv1.2","611","Application Data"
"4.332748","54.38.73.16","172.18.0.2","TCP","1516","[TCP segment of a reassembled PDU]"
"4.334096","54.38.73.16","172.18.0.2","TLSv1.2","705","Application Data"
"4.334144","172.18.0.2","54.38.73.16","TCP","68","36876 → 21002 [ACK] Seq=12403 Ack=214002 Win=5593 Len=0 TSval=1091870843 TSecr=2677116881"
"4.353553","54.38.73.16","172.18.0.2","TCP","2964","[TCP segment of a reassembled PDU]"
"4.353594","172.18.0.2","54.38.73.16","TCP","68","36876 → 21002 [ACK] Seq=12403 Ack=216898 Win=5596 Len=0 TSval=1091870863 TSecr=2677116886"
"4.357663","54.38.73.16","172.18.0.2","TLSv1.2","799","Application Data"
"4.364705","172.18.0.2","54.38.73.16","TLSv1.2","611","Application Data"
"4.427341","54.38.73.16","172.18.0.2","TCP","68","21002 → 36876 [ACK] Seq=217629 Ack=12946 Win=1452 Len=0 TSval=2677116905 TSecr=1091870874"
"4.820414","54.38.73.16","172.18.0.2","TLSv1.2","611","Application Data"
"4.821497","172.18.0.2","54.38.73.16","TLSv1.2","611","Application Data"
"4.855347","54.38.73.16","172.18.0.2","TCP","68","21002 → 36876 [ACK] Seq=218172 Ack=13489 Win=1452 Len=0 TSval=2677117012 TSecr=1091871330"
"5.061041","54.38.73.16","172.18.0.2","TLSv1.2","611","Application Data"
"5.061420","172.18.0.2","54.38.73.16","TLSv1.2","611","Application Data"
"5.083732","54.38.73.16","172.18.0.2","TCP","2964","[TCP segment of a reassembled PDU]"
"5.083885","172.18.0.2","54.38.73.16","TCP","68","36876 → 21002 [ACK] Seq=14032 Ack=221611 Win=5596 Len=0 TSval=1091871593 TSecr=2677117068"
"5.085105","54.38.73.16","172.18.0.2","TLSv1.2","799","Application Data"
"5.095578","54.38.73.16","172.18.0.2","TCP","2964","[TCP segment of a reassembled PDU]"
"5.095615","172.18.0.2","54.38.73.16","TCP","68","36876 → 21002 [ACK] Seq=14032 Ack=225238 Win=5596 Len=0 TSval=1091871605 TSecr=2677117069"
"5.121002","54.38.73.16","172.18.0.2","TLSv1.2","799","Application Data"
"5.161653","172.18.0.2","54.38.73.16","TCP","68","36876 → 21002 [ACK] Seq=14032 Ack=225969 Win=5612 Len=0 TSval=1091871671 TSecr=2677117078"
"5.181333","54.38.73.16","172.18.0.2","TCP","2964","[TCP segment of a reassembled PDU]"
"5.181367","172.18.0.2","54.38.73.16","TCP","68","36876 → 21002 [ACK] Seq=14032 Ack=228865 Win=5596 Len=0 TSval=1091871690 TSecr=2677117093"
"5.186264","54.38.73.16","172.18.0.2","TLSv1.2","799","Application Data"
"5.186309","172.18.0.2","54.38.73.16","TCP","68","36876 → 21002 [ACK] Seq=14032 Ack=229596 Win=5593 Len=0 TSval=1091871695 TSecr=2677117095"
"5.202985","54.38.73.16","172.18.0.2","TLSv1.2","7308","Application Data, Application Data"
"5.203018","172.18.0.2","54.38.73.16","TCP","68","36876 → 21002 [ACK] Seq=14032 Ack=236836 Win=5565 Len=0 TSval=1091871712 TSecr=2677117099"
"5.211400","54.38.73.16","172.18.0.2","TLSv1.2","1139","Application Data"
"5.211436","172.18.0.2","54.38.73.16","TCP","68","36876 → 21002 [ACK] Seq=14032 Ack=237907 Win=5593 Len=0 TSval=1091871720 TSecr=2677117101"
"5.215747","54.38.73.16","172.18.0.2","TLSv1.2","4412","Application Data"
"5.215780","172.18.0.2","54.38.73.16","TCP","68","36876 → 21002 [ACK] Seq=14032 Ack=242251 Win=5580 Len=0 TSval=1091871725 TSecr=2677117102"
"5.229376","54.38.73.16","172.18.0.2","TLSv1.2","5860","Application Data [TCP segment of a reassembled PDU]"
"5.229409","172.18.0.2","54.38.73.16","TCP","68","36876 → 21002 [ACK] Seq=14032 Ack=248043 Win=5581 Len=0 TSval=1091871738 TSecr=2677117105"
"5.229929","172.18.0.2","54.38.73.16","TLSv1.2","611","Application Data"
"5.236883","54.38.73.16","172.18.0.2","TLSv1.2","1516","Application Data [TCP segment of a reassembled PDU]"
"5.236918","172.18.0.2","54.38.73.16","TCP","68","36876 → 21002 [ACK] Seq=14575 Ack=249491 Win=5593 Len=0 TSval=1091871746 TSecr=2677117107"
"5.236888","54.38.73.16","172.18.0.2","TCP","1516","21002 → 36876 [ACK] Seq=249491 Ack=14032 Win=1452 Len=1448 TSval=2677117107 TSecr=1091871720 [TCP segment of a reassembled PDU]"
"5.236952","172.18.0.2","54.38.73.16","TCP","68","36876 → 21002 [ACK] Seq=14575 Ack=250939 Win=5582 Len=0 TSval=1091871746 TSecr=2677117107"
"5.240414","54.38.73.16","172.18.0.2","TLSv1.2","2964","Application Data [TCP segment of a reassembled PDU]"
"5.240448","172.18.0.2","54.38.73.16","TCP","68","36876 → 21002 [ACK] Seq=14575 Ack=253835 Win=5596 Len=0 TSval=1091871749 TSecr=2677117108"
"5.246630","54.38.73.16","172.18.0.2","TLSv1.2","1516","Application Data [TCP segment of a reassembled PDU]"
"5.246662","172.18.0.2","54.38.73.16","TCP","68","36876 → 21002 [ACK] Seq=14575 Ack=255283 Win=5593 Len=0 TSval=1091871756 TSecr=2677117110"
"5.256435","54.38.73.16","172.18.0.2","TLSv1.2","4412","Application Data [TCP segment of a reassembled PDU]"
"5.256575","172.18.0.2","54.38.73.16","TCP","68","36876 → 21002 [ACK] Seq=14575 Ack=259627 Win=5580 Len=0 TSval=1091871766 TSecr=2677117112"
"5.261294","54.38.73.16","172.18.0.2","TLSv1.2","2964","Application Data [TCP segment of a reassembled PDU]"
"5.261333","172.18.0.2","54.38.73.16","TCP","68","36876 → 21002 [ACK] Seq=14575 Ack=262523 Win=5596 Len=0 TSval=1091871770 TSecr=2677117113"
"5.264244","54.38.73.16","172.18.0.2","TLSv1.2","2964","Application Data [TCP segment of a reassembled PDU]"
"5.264276","172.18.0.2","54.38.73.16","TCP","68","36876 → 21002 [ACK] Seq=14575 Ack=265419 Win=5596 Len=0 TSval=1091871773 TSecr=2677117114"
"5.267197","54.38.73.16","172.18.0.2","TCP","1516","21002 → 36876 [ACK] Seq=265419 Ack=14575 Win=1452 Len=1448 TSval=2677117115 TSecr=1091871749 [TCP segment of a reassembled PDU]"
"5.270167","54.38.73.16","172.18.0.2","TLSv1.2","1516","Application Data, Application Data"
"5.270303","172.18.0.2","54.38.73.16","TCP","68","36876 → 21002 [ACK] Seq=14575 Ack=268315 Win=5593 Len=0 TSval=1091871779 TSecr=2677117115"
"5.280953","54.38.73.16","172.18.0.2","TLSv1.2","4412","Application Data [TCP segment of a reassembled PDU]"
"5.281102","172.18.0.2","54.38.73.16","TCP","68","36876 → 21002 [ACK] Seq=14575 Ack=272659 Win=5580 Len=0 TSval=1091871790 TSecr=2677117118"
"5.281677","172.18.0.2","54.38.73.16","TLSv1.2","1125","Application Data"
"5.285843","54.38.73.16","172.18.0.2","TLSv1.2","2964","Application Data [TCP segment of a reassembled PDU]"
"5.285878","172.18.0.2","54.38.73.16","TCP","68","36876 → 21002 [ACK] Seq=15632 Ack=275555 Win=5596 Len=0 TSval=1091871795 TSecr=2677117119"
"5.289986","54.38.73.16","172.18.0.2","TLSv1.2","2918","Application Data, Application Data"
"5.290019","172.18.0.2","54.38.73.16","TCP","68","36876 → 21002 [ACK] Seq=15632 Ack=278405 Win=5596 Len=0 TSval=1091871799 TSecr=2677117120"
"5.342525","54.38.73.16","172.18.0.2","TCP","68","21002 → 36876 [ACK] Seq=278405 Ack=15632 Win=1452 Len=0 TSval=2677117134 TSecr=1091871791"
"5.434986","54.38.73.16","172.18.0.2","TLSv1.2","3181","Application Data"
"5.435139","172.18.0.2","54.38.73.16","TCP","68","36876 → 21002 [ACK] Seq=15632 Ack=281518 Win=5580 Len=0 TSval=1091871944 TSecr=2677117156"
"5.459014","54.38.73.16","172.18.0.2","TLSv1.2","611","Application Data"
"5.459202","172.18.0.2","54.38.73.16","TCP","68","36876 → 21002 [ACK] Seq=15632 Ack=282061 Win=5612 Len=0 TSval=1091871968 TSecr=2677117163"
"5.487396","54.38.73.16","172.18.0.2","TLSv1.2","1125","Application Data"
"5.487563","172.18.0.2","54.38.73.16","TCP","68","36876 → 21002 [ACK] Seq=15632 Ack=283118 Win=5612 Len=0 TSval=1091871997 TSecr=2677117170"
"5.494221","172.18.0.2","54.38.73.16","TLSv1.2","611","Application Data"
"5.520009","54.38.73.16","172.18.0.2","TCP","68","21002 → 36876 [ACK] Seq=283118 Ack=16175 Win=1452 Len=0 TSval=2677117178 TSecr=1091872003"
"5.838129","54.38.73.16","172.18.0.2","TLSv1.2","611","Application Data"
"5.839179","172.18.0.2","54.38.73.16","TLSv1.2","611","Application Data"
"5.863970","54.38.73.16","172.18.0.2","TCP","68","21002 → 36876 [ACK] Seq=283661 Ack=16718 Win=1452 Len=0 TSval=2677117264 TSecr=1091872348"
"6.070427","54.38.73.16","172.18.0.2","TLSv1.2","3695","Application Data"
"6.070593","172.18.0.2","54.38.73.16","TCP","68","36876 → 21002 [ACK] Seq=16718 Ack=287288 Win=5584 Len=0 TSval=1091872580 TSecr=2677117315"
"6.079811","54.38.73.16","172.18.0.2","TLSv1.2","8756","Application Data, Application Data"
"6.079968","172.18.0.2","54.38.73.16","TCP","68","36876 → 21002 [ACK] Seq=16718 Ack=295976 Win=5566 Len=0 TSval=1091872589 TSecr=2677117318"
"6.095526","54.38.73.16","172.18.0.2","TCP","2964","21002 → 36876 [ACK] Seq=295976 Ack=16718 Win=1452 Len=2896 TSval=2677117322 TSecr=1091872580 [TCP segment of a reassembled PDU]"
"6.095582","172.18.0.2","54.38.73.16","TCP","68","36876 → 21002 [ACK] Seq=16718 Ack=298872 Win=5596 Len=0 TSval=1091872605 TSecr=2677117322"
"6.104095","54.38.73.16","172.18.0.2","TLSv1.2","2964","Application Data [TCP segment of a reassembled PDU]"
"6.104128","172.18.0.2","54.38.73.16","TCP","68","36876 → 21002 [ACK] Seq=16718 Ack=301768 Win=5596 Len=0 TSval=1091872613 TSecr=2677117324"
"6.104418","54.38.73.16","172.18.0.2","TLSv1.2","2181","Application Data, Application Data"
"6.104610","172.18.0.2","54.38.73.16","TCP","68","36876 → 21002 [ACK] Seq=16718 Ack=303881 Win=5584 Len=0 TSval=1091872614 TSecr=2677117324"
"6.176085","54.38.73.16","172.18.0.2","TLSv1.2","3695","Application Data"
"6.176233","172.18.0.2","54.38.73.16","TCP","68","36876 → 21002 [ACK] Seq=16718 Ack=307508 Win=5580 Len=0 TSval=1091872685 TSecr=2677117342"
"6.185466","54.38.73.16","172.18.0.2","TCP","2964","[TCP segment of a reassembled PDU]"
"6.185517","172.18.0.2","54.38.73.16","TCP","68","36876 → 21002 [ACK] Seq=16718 Ack=310404 Win=5596 Len=0 TSval=1091872695 TSecr=2677117344"
"6.195721","54.38.73.16","172.18.0.2","TLSv1.2","4412","Application Data [TCP segment of a reassembled PDU]"
"6.195864","172.18.0.2","54.38.73.16","TCP","68","36876 → 21002 [ACK] Seq=16718 Ack=314748 Win=5580 Len=0 TSval=1091872705 TSecr=2677117347"
"6.196292","172.18.0.2","54.38.73.16","TLSv1.2","611","Application Data"
"6.206561","54.38.73.16","172.18.0.2","TLSv1.2","1516","Application Data [TCP segment of a reassembled PDU]"
"6.209552","54.38.73.16","172.18.0.2","TLSv1.2","3318","Application Data, Application Data"
"6.209572","172.18.0.2","54.38.73.16","TCP","68","36876 → 21002 [ACK] Seq=17261 Ack=319446 Win=5580 Len=0 TSval=1091872719 TSecr=2677117349"
"6.222142","54.38.73.16","172.18.0.2","TCP","68","21002 → 36876 [ACK] Seq=319446 Ack=17261 Win=1452 Len=0 TSval=2677117353 TSecr=1091872705"
"6.229686","54.38.73.16","172.18.0.2","TCP","1516","[TCP segment of a reassembled PDU]"
"6.233536","54.38.73.16","172.18.0.2","TLSv1.2","705","Application Data"
"6.233575","172.18.0.2","54.38.73.16","TCP","68","36876 → 21002 [ACK] Seq=17261 Ack=321531 Win=5593 Len=0 TSval=1091872743 TSecr=2677117355"
"6.251602","54.38.73.16","172.18.0.2","TCP","2964","[TCP segment of a reassembled PDU]"
"6.251639","172.18.0.2","54.38.73.16","TCP","68","36876 → 21002 [ACK] Seq=17261 Ack=324427 Win=5596 Len=0 TSval=1091872761 TSecr=2677117361"
"6.266733","54.38.73.16","172.18.0.2","TLSv1.2","285","Application Data"
"6.267375","172.18.0.2","54.38.73.16","TLSv1.2","611","Application Data"
"6.330067","54.38.73.16","172.18.0.2","TCP","68","21002 → 36876 [ACK] Seq=324644 Ack=17804 Win=1452 Len=0 TSval=2677117381 TSecr=1091872776"
"6.330111","172.18.0.2","54.38.73.16","TLSv1.2","611","Application Data"
"6.355464","54.38.73.16","172.18.0.2","TCP","68","21002 → 36876 [ACK] Seq=324644 Ack=18347 Win=1452 Len=0 TSval=2677117387 TSecr=1091872839"
"6.686079","54.38.73.16","172.18.0.2","TLSv1.2","611","Application Data"
"6.687124","172.18.0.2","54.38.73.16","TLSv1.2","611","Application Data"
"6.712269","54.38.73.16","172.18.0.2","TCP","68","21002 → 36876 [ACK] Seq=325187 Ack=18890 Win=1452 Len=0 TSval=2677117476 TSecr=1091873196"
"6.932744","54.38.73.16","172.18.0.2","TLSv1.2","4145","Application Data"
"6.932902","172.18.0.2","54.38.73.16","TCP","68","36876 → 21002 [ACK] Seq=18890 Ack=329264 Win=5581 Len=0 TSval=1091873442 TSecr=2677117531"
"6.943465","54.38.73.16","172.18.0.2","TLSv1.2","7308","Application Data, Application Data"
"6.943618","172.18.0.2","54.38.73.16","TCP","68","36876 → 21002 [ACK] Seq=18890 Ack=336504 Win=5565 Len=0 TSval=1091873453 TSecr=2677117534"
"6.957671","54.38.73.16","172.18.0.2","TLSv1.2","2260","Application Data, Application Data"
"6.957705","172.18.0.2","54.38.73.16","TCP","68","36876 → 21002 [ACK] Seq=18890 Ack=338696 Win=5599 Len=0 TSval=1091873467 TSecr=2677117537"
"6.965853","54.38.73.16","172.18.0.2","TCP","2964","[TCP segment of a reassembled PDU]"
"6.966002","172.18.0.2","54.38.73.16","TCP","68","36876 → 21002 [ACK] Seq=18890 Ack=341592 Win=5596 Len=0 TSval=1091873475 TSecr=2677117539"
"6.968237","54.38.73.16","172.18.0.2","TLSv1.2","5860","Application Data, Application Data"
"6.968378","172.18.0.2","54.38.73.16","TCP","68","36876 → 21002 [ACK] Seq=18890 Ack=347384 Win=5581 Len=0 TSval=1091873477 TSecr=2677117540"
"6.984018","54.38.73.16","172.18.0.2","TCP","2964","21002 → 36876 [ACK] Seq=347384 Ack=18890 Win=1452 Len=2896 TSval=2677117544 TSecr=1091873467 [TCP segment of a reassembled PDU]"
"6.984051","172.18.0.2","54.38.73.16","TCP","68","36876 → 21002 [ACK] Seq=18890 Ack=350280 Win=5596 Len=0 TSval=1091873493 TSecr=2677117544"
"6.990856","54.38.73.16","172.18.0.2","TLSv1.2","2964","Application Data [TCP segment of a reassembled PDU]"
"6.990890","172.18.0.2","54.38.73.16","TCP","68","36876 → 21002 [ACK] Seq=18890 Ack=353176 Win=5596 Len=0 TSval=1091873500 TSecr=2677117546"
"6.992859","54.38.73.16","172.18.0.2","TLSv1.2","3209","Application Data, Application Data"
"6.993006","172.18.0.2","54.38.73.16","TCP","68","36876 → 21002 [ACK] Seq=18890 Ack=356317 Win=5580 Len=0 TSval=1091873502 TSecr=2677117546"
"6.993440","172.18.0.2","54.38.73.16","TLSv1.2","611","Application Data"
"7.018080","54.38.73.16","172.18.0.2","TCP","68","21002 → 36876 [ACK] Seq=356317 Ack=19433 Win=1452 Len=0 TSval=2677117553 TSecr=1091873502"
"7.018123","172.18.0.2","54.38.73.16","TLSv1.2","611","Application Data"
"7.043672","54.38.73.16","172.18.0.2","TCP","68","21002 → 36876 [ACK] Seq=356317 Ack=19976 Win=1452 Len=0 TSval=2677117559 TSecr=1091873527"
"7.374741","54.38.73.16","172.18.0.2","TLSv1.2","611","Application Data"
"7.375772","172.18.0.2","54.38.73.16","TLSv1.2","611","Application Data"
"7.400045","54.38.73.16","172.18.0.2","TCP","68","21002 → 36876 [ACK] Seq=356860 Ack=20519 Win=1452 Len=0 TSval=2677117648 TSecr=1091873885"
"7.622205","54.38.73.16","172.18.0.2","TLSv1.2","3695","Application Data"
"7.622367","172.18.0.2","54.38.73.16","TCP","68","36876 → 21002 [ACK] Seq=20519 Ack=360487 Win=5584 Len=0 TSval=1091874131 TSecr=2677117703"
"7.632917","54.38.73.16","172.18.0.2","TLSv1.2","10204","Application Data, Application Data"
"7.633075","172.18.0.2","54.38.73.16","TCP","68","36876 → 21002 [ACK] Seq=20519 Ack=370623 Win=5550 Len=0 TSval=1091874142 TSecr=2677117706"
"7.647879","54.38.73.16","172.18.0.2","TLSv1.2","2964","Application Data [TCP segment of a reassembled PDU]"
"7.647911","172.18.0.2","54.38.73.16","TCP","68","36876 → 21002 [ACK] Seq=20519 Ack=373519 Win=5596 Len=0 TSval=1091874157 TSecr=2677117710"
"7.657457","54.38.73.16","172.18.0.2","TLSv1.2","11652","Application Data, Application Data, Application Data"
"7.657635","172.18.0.2","54.38.73.16","TCP","68","36876 → 21002 [ACK] Seq=20519 Ack=385103 Win=5551 Len=0 TSval=1091874167 TSecr=2677117712"
"7.658418","172.18.0.2","54.38.73.16","TLSv1.2","611","Application Data"
"7.672723","54.38.73.16","172.18.0.2","TCP","2964","21002 → 36876 [ACK] Seq=385103 Ack=20519 Win=1452 Len=2896 TSval=2677117716 TSecr=1091874157 [TCP segment of a reassembled PDU]"
"7.672757","172.18.0.2","54.38.73.16","TCP","68","36876 → 21002 [ACK] Seq=21062 Ack=387999 Win=5596 Len=0 TSval=1091874182 TSecr=2677117716"
"7.681344","54.38.73.16","172.18.0.2","TLSv1.2","8756","Application Data, Application Data, Application Data"
"7.681523","172.18.0.2","54.38.73.16","TCP","68","36876 → 21002 [ACK] Seq=21062 Ack=396687 Win=5566 Len=0 TSval=1091874191 TSecr=2677117718"
"7.681600","54.38.73.16","172.18.0.2","TLSv1.2","2964","Application Data, Application Data"
"7.681888","54.38.73.16","172.18.0.2","TCP","68","21002 → 36876 [ACK] Seq=399583 Ack=21062 Win=1452 Len=0 TSval=2677117719 TSecr=1091874167"
"7.681930","172.18.0.2","54.38.73.16","TLSv1.2","611","Application Data"
"7.698315","54.38.73.16","172.18.0.2","TCP","1516","21002 → 36876 [ACK] Seq=399583 Ack=21062 Win=1452 Len=1448 TSval=2677117722 TSecr=1091874167 [TCP segment of a reassembled PDU]"
"7.698322","54.38.73.16","172.18.0.2","TLSv1.2","2964","Application Data [TCP segment of a reassembled PDU]"
"7.698382","172.18.0.2","54.38.73.16","TCP","68","36876 → 21002 [ACK] Seq=21605 Ack=403927 Win=5578 Len=0 TSval=1091874207 TSecr=2677117722"
"7.698702","54.38.73.16","172.18.0.2","TLSv1.2","1516","Application Data [TCP segment of a reassembled PDU]"
"7.705525","54.38.73.16","172.18.0.2","TLSv1.2","8756","Application Data, Application Data"
"7.705668","172.18.0.2","54.38.73.16","TCP","68","36876 → 21002 [ACK] Seq=21605 Ack=414063 Win=5566 Len=0 TSval=1091874215 TSecr=2677117722"
"7.706133","54.38.73.16","172.18.0.2","TLSv1.2","2497","Application Data, Application Data"
"7.706175","172.18.0.2","54.38.73.16","TLSv1.2","611","Application Data"
"7.706940","54.38.73.16","172.18.0.2","TCP","1516","[TCP segment of a reassembled PDU]"
"7.722340","54.38.73.16","172.18.0.2","TLSv1.2","2964","Application Data [TCP segment of a reassembled PDU]"
"7.722372","172.18.0.2","54.38.73.16","TCP","68","36876 → 21002 [ACK] Seq=22148 Ack=420836 Win=5596 Len=0 TSval=1091874231 TSecr=2677117725"
"7.729738","54.38.73.16","172.18.0.2","TCP","2964","21002 → 36876 [ACK] Seq=420836 Ack=21605 Win=1452 Len=2896 TSval=2677117730 TSecr=1091874215 [TCP segment of a reassembled PDU]"
"7.729770","172.18.0.2","54.38.73.16","TCP","68","36876 → 21002 [ACK] Seq=22148 Ack=423732 Win=5596 Len=0 TSval=1091874239 TSecr=2677117730"
"7.730426","54.38.73.16","172.18.0.2","TLSv1.2","2964","Application Data [TCP segment of a reassembled PDU]"
"7.730460","172.18.0.2","54.38.73.16","TCP","68","36876 → 21002 [ACK] Seq=22148 Ack=426628 Win=5596 Len=0 TSval=1091874239 TSecr=2677117730"
"7.730645","54.38.73.16","172.18.0.2","TLSv1.2","1153","[TCP Previous segment not captured] , Ignored Unknown Record"
"7.730713","172.18.0.2","54.38.73.16","TCP","80","[TCP Dup ACK 301#1] 36876 → 21002 [ACK] Seq=22148 Ack=426628 Win=5596 Len=0 TSval=1091874240 TSecr=2677117730 SLE=430972 SRE=432057"
"7.730675","54.38.73.16","172.18.0.2","TCP","4412","[TCP Out-Of-Order] 21002 → 36876 [ACK] Seq=426628 Ack=21605 Win=1452 Len=4344 TSval=2677117730 TSecr=1091874215"
"7.730747","172.18.0.2","54.38.73.16","TCP","68","36876 → 21002 [ACK] Seq=22148 Ack=432057 Win=5554 Len=0 TSval=1091874240 TSecr=2677117730"
"7.731438","172.18.0.2","54.38.73.16","TLSv1.2","611","Application Data"
"7.795917","54.38.73.16","172.18.0.2","TCP","68","21002 → 36876 [ACK] Seq=432057 Ack=22691 Win=1452 Len=0 TSval=2677117747 TSecr=1091874240"
"7.795961","172.18.0.2","54.38.73.16","TLSv1.2","611","Application Data"
"7.860129","54.38.73.16","172.18.0.2","TCP","68","21002 → 36876 [ACK] Seq=432057 Ack=23234 Win=1452 Len=0 TSval=2677117763 TSecr=1091874305"
"8.019525","54.38.73.16","172.18.0.2","TLSv1.2","611","Application Data"
"8.020566","172.18.0.2","54.38.73.16","TLSv1.2","611","Application Data"
"8.082409","54.38.73.16","172.18.0.2","TCP","68","21002 → 36876 [ACK] Seq=432600 Ack=23777 Win=1452 Len=0 TSval=2677117819 TSecr=1091874530"
"8.243603","54.38.73.16","172.18.0.2","TLSv1.2","611","Application Data"
"8.273804","54.38.73.16","172.18.0.2","TCP","2964","[TCP segment of a reassembled PDU]"
"8.273865","172.18.0.2","54.38.73.16","TCP","68","36876 → 21002 [ACK] Seq=23777 Ack=436039 Win=5596 Len=0 TSval=1091874783 TSecr=2677117858"
"8.295752","54.38.73.16","172.18.0.2","TLSv1.2","4412","Application Data [TCP segment of a reassembled PDU]"
"8.295895","172.18.0.2","54.38.73.16","TCP","68","36876 → 21002 [ACK] Seq=23777 Ack=440383 Win=5580 Len=0 TSval=1091874805 TSecr=2677117872"
"8.297627","54.38.73.16","172.18.0.2","TLSv1.2","82","Application Data"
"8.315067","54.38.73.16","172.18.0.2","TLSv1.2","4412","Application Data"
"8.315107","172.18.0.2","54.38.73.16","TCP","68","36876 → 21002 [ACK] Seq=23777 Ack=444741 Win=5580 Len=0 TSval=1091874824 TSecr=2677117872"
"8.315309","54.38.73.16","172.18.0.2","TCP","2964","21002 → 36876 [ACK] Seq=444741 Ack=23777 Win=1452 Len=2896 TSval=2677117877 TSecr=1091874783 [TCP segment of a reassembled PDU]"
"8.315521","172.18.0.2","54.38.73.16","TCP","68","36876 → 21002 [ACK] Seq=23777 Ack=447637 Win=5565 Len=0 TSval=1091874825 TSecr=2677117877"
"8.327994","54.38.73.16","172.18.0.2","TLSv1.2","2964","Application Data, Application Data"
"8.328027","172.18.0.2","54.38.73.16","TCP","68","36876 → 21002 [ACK] Seq=23777 Ack=450533 Win=5596 Len=0 TSval=1091874837 TSecr=2677117880"
"8.328215","54.38.73.16","172.18.0.2","TCP","1516","21002 → 36876 [ACK] Seq=450533 Ack=23777 Win=1452 Len=1448 TSval=2677117880 TSecr=1091874805 [TCP segment of a reassembled PDU]"
"8.335872","54.38.73.16","172.18.0.2","TLSv1.2","1516","Application Data [TCP segment of a reassembled PDU]"
"8.336005","172.18.0.2","54.38.73.16","TCP","68","36876 → 21002 [ACK] Seq=23777 Ack=453429 Win=5593 Len=0 TSval=1091874845 TSecr=2677117880"
"8.340804","54.38.73.16","172.18.0.2","TLSv1.2","950","[TCP Previous segment not captured] , Ignored Unknown Record"
"8.340853","172.18.0.2","54.38.73.16","TCP","80","[TCP Dup ACK 327#1] 36876 → 21002 [ACK] Seq=23777 Ack=453429 Win=5593 Len=0 TSval=1091874850 TSecr=2677117880 SLE=459221 SRE=460103"
"8.340820","54.38.73.16","172.18.0.2","TCP","5860","[TCP Out-Of-Order] 21002 → 36876 [ACK] Seq=453429 Ack=23777 Win=1452 Len=5792 TSval=2677117883 TSecr=1091874824"
"8.340891","172.18.0.2","54.38.73.16","TCP","68","36876 → 21002 [ACK] Seq=23777 Ack=460103 Win=5565 Len=0 TSval=1091874850 TSecr=2677117883"
"8.341756","172.18.0.2","54.38.73.16","TLSv1.2","611","Application Data"
"8.348693","54.38.73.16","172.18.0.2","TCP","1516","[TCP segment of a reassembled PDU]"
"8.352812","54.38.73.16","172.18.0.2","TCP","1516","21002 → 36876 [ACK] Seq=461551 Ack=23777 Win=1452 Len=1448 TSval=2677117886 TSecr=1091874837 [TCP segment of a reassembled PDU]"
"8.352956","172.18.0.2","54.38.73.16","TCP","68","36876 → 21002 [ACK] Seq=24320 Ack=462999 Win=5612 Len=0 TSval=1091874862 TSecr=2677117885"
"8.364907","54.38.73.16","172.18.0.2","TLSv1.2","1342","Application Data, Application Data"
"8.364917","54.38.73.16","172.18.0.2","TCP","68","21002 → 36876 [ACK] Seq=464273 Ack=24320 Win=1452 Len=0 TSval=2677117889 TSecr=1091874851"
"8.368529","54.38.73.16","172.18.0.2","TCP","2964","[TCP segment of a reassembled PDU]"
"8.368715","172.18.0.2","54.38.73.16","TCP","68","36876 → 21002 [ACK] Seq=24320 Ack=467169 Win=5596 Len=0 TSval=1091874878 TSecr=2677117889"
"8.391995","54.38.73.16","172.18.0.2","TLSv1.2","1342","Application Data, Application Data"
"8.433666","172.18.0.2","54.38.73.16","TCP","68","36876 → 21002 [ACK] Seq=24320 Ack=468443 Win=5612 Len=0 TSval=1091874943 TSecr=2677117896"
"8.464637","54.38.73.16","172.18.0.2","TLSv1.2","611","Application Data"
"8.464697","172.18.0.2","54.38.73.16","TCP","68","36876 → 21002 [ACK] Seq=24320 Ack=468986 Win=5608 Len=0 TSval=1091874974 TSecr=2677117914"
"8.486907","54.38.73.16","172.18.0.2","TCP","2964","[TCP segment of a reassembled PDU]"
"8.486940","172.18.0.2","54.38.73.16","TCP","68","36876 → 21002 [ACK] Seq=24320 Ack=471882 Win=5596 Len=0 TSval=1091874996 TSecr=2677117920"
"8.491103","54.38.73.16","172.18.0.2","TLSv1.2","285","Application Data"
"8.491153","172.18.0.2","54.38.73.16","TCP","68","36876 → 21002 [ACK] Seq=24320 Ack=472099 Win=5595 Len=0 TSval=1091875000 TSecr=2677117921"
"8.498275","172.18.0.2","54.38.73.16","TLSv1.2","611","Application Data"
"8.562355","54.38.73.16","172.18.0.2","TCP","68","21002 → 36876 [ACK] Seq=472099 Ack=24863 Win=1452 Len=0 TSval=2677117939 TSecr=1091875007"
"8.808077","54.38.73.16","172.18.0.2","TLSv1.2","611","Application Data"
"8.808142","172.18.0.2","54.38.73.16","TCP","68","36876 → 21002 [ACK] Seq=24863 Ack=472642 Win=5608 Len=0 TSval=1091875317 TSecr=2677117985"
"8.809132","172.18.0.2","54.38.73.16","TLSv1.2","611","Application Data"
"8.832952","54.38.73.16","172.18.0.2","TCP","68","21002 → 36876 [ACK] Seq=472642 Ack=25406 Win=1452 Len=0 TSval=2677118006 TSecr=1091875318"
"9.033864","54.38.73.16","172.18.0.2","TLSv1.2","611","Application Data"
"9.033901","172.18.0.2","54.38.73.16","TCP","68","36876 → 21002 [ACK] Seq=25406 Ack=473185 Win=5608 Len=0 TSval=1091875543 TSecr=2677118056"
"9.046188","54.38.73.16","172.18.0.2","TCP","2964","[TCP segment of a reassembled PDU]"
"9.046223","172.18.0.2","54.38.73.16","TCP","68","36876 → 21002 [ACK] Seq=25406 Ack=476081 Win=5596 Len=0 TSval=1091875555 TSecr=2677118059"
"9.058279","54.38.73.16","172.18.0.2","TLSv1.2","799","Application Data"
"9.058338","172.18.0.2","54.38.73.16","TCP","68","36876 → 21002 [ACK] Seq=25406 Ack=476812 Win=5593 Len=0 TSval=1091875567 TSecr=2677118063"
"9.063446","54.38.73.16","172.18.0.2","TCP","2964","[TCP segment of a reassembled PDU]"
"9.063478","172.18.0.2","54.38.73.16","TCP","68","36876 → 21002 [ACK] Seq=25406 Ack=479708 Win=5596 Len=0 TSval=1091875573 TSecr=2677118064"
"9.073711","54.38.73.16","172.18.0.2","TLSv1.2","5860","Application Data, Application Data"
"9.073747","172.18.0.2","54.38.73.16","TCP","68","36876 → 21002 [ACK] Seq=25406 Ack=485500 Win=5581 Len=0 TSval=1091875583 TSecr=2677118066"
"9.073927","54.38.73.16","172.18.0.2","TLSv1.2","4412","Application Data [TCP segment of a reassembled PDU]"
"9.073964","172.18.0.2","54.38.73.16","TCP","68","36876 → 21002 [ACK] Seq=25406 Ack=489844 Win=5550 Len=0 TSval=1091875583 TSecr=2677118066"
"9.074656","172.18.0.2","54.38.73.16","TLSv1.2","611","Application Data"
"9.087874","54.38.73.16","172.18.0.2","TLSv1.2","2964","Application Data [TCP segment of a reassembled PDU]"
"9.087907","172.18.0.2","54.38.73.16","TCP","68","36876 → 21002 [ACK] Seq=25949 Ack=492740 Win=5596 Len=0 TSval=1091875597 TSecr=2677118070"
"9.098195","54.38.73.16","172.18.0.2","TCP","1516","21002 → 36876 [ACK] Seq=492740 Ack=25406 Win=1452 Len=1448 TSval=2677118072 TSecr=1091875573 [TCP segment of a reassembled PDU]"
"9.098200","54.38.73.16","172.18.0.2","TCP","1516","21002 → 36876 [ACK] Seq=494188 Ack=25406 Win=1452 Len=1448 TSval=2677118073 TSecr=1091875583 [TCP segment of a reassembled PDU]"
"9.098344","172.18.0.2","54.38.73.16","TCP","68","36876 → 21002 [ACK] Seq=25949 Ack=495636 Win=5612 Len=0 TSval=1091875607 TSecr=2677118072"
"9.098434","54.38.73.16","172.18.0.2","TLSv1.2","2964","Application Data, Application Data"
"9.098495","172.18.0.2","54.38.73.16","TCP","68","36876 → 21002 [ACK] Seq=25949 Ack=498532 Win=5596 Len=0 TSval=1091875608 TSecr=2677118073"
"9.099524","54.38.73.16","172.18.0.2","TCP","68","[TCP Previous segment not captured] 21002 → 36876 [ACK] Seq=504324 Ack=25949 Win=1452 Len=0 TSval=2677118073 TSecr=1091875584"
"9.099541","54.38.73.16","172.18.0.2","TCP","5860","[TCP Retransmission] 21002 → 36876 [ACK] Seq=498532 Ack=25406 Win=1452 Len=5792 TSval=2677118073 TSecr=1091875583"
"9.099662","172.18.0.2","54.38.73.16","TCP","68","36876 → 21002 [ACK] Seq=25949 Ack=504324 Win=5581 Len=0 TSval=1091875609 TSecr=2677118073"
"9.100015","172.18.0.2","54.38.73.16","TLSv1.2","611","Application Data"
"9.112578","54.38.73.16","172.18.0.2","TLSv1.2","2964","Ignored Unknown Record"
"9.112612","172.18.0.2","54.38.73.16","TCP","68","36876 → 21002 [ACK] Seq=26492 Ack=507220 Win=5596 Len=0 TSval=1091875622 TSecr=2677118076"
"9.130861","54.38.73.16","172.18.0.2","TLSv1.2","2964","Ignored Unknown Record"
"9.130904","172.18.0.2","54.38.73.16","TCP","68","36876 → 21002 [ACK] Seq=26492 Ack=510116 Win=5596 Len=0 TSval=1091875640 TSecr=2677118079"
"9.130867","54.38.73.16","172.18.0.2","TLSv1.2","2964","Ignored Unknown Record"
"9.130871","54.38.73.16","172.18.0.2","TLSv1.2","8478","Ignored Unknown Record"
"9.131031","172.18.0.2","54.38.73.16","TCP","68","36876 → 21002 [ACK] Seq=26492 Ack=521422 Win=5537 Len=0 TSval=1091875640 TSecr=2677118079"
"9.136575","54.38.73.16","172.18.0.2","TCP","2964","[TCP segment of a reassembled PDU]"
"9.136613","172.18.0.2","54.38.73.16","TCP","68","36876 → 21002 [ACK] Seq=26492 Ack=524318 Win=5596 Len=0 TSval=1091875646 TSecr=2677118082"
"9.157210","54.38.73.16","172.18.0.2","TLSv1.2","10652","Application Data, Application Data, Application Data, Application Data"
"9.157364","172.18.0.2","54.38.73.16","TCP","68","36876 → 21002 [ACK] Seq=26492 Ack=534902 Win=5555 Len=0 TSval=1091875666 TSecr=2677118087"
"9.157894","172.18.0.2","54.38.73.16","TLSv1.2","611","Application Data"
"9.218040","54.38.73.16","172.18.0.2","TLSv1.2","4145","Application Data"
"9.218103","172.18.0.2","54.38.73.16","TCP","68","36876 → 21002 [ACK] Seq=27035 Ack=538979 Win=5589 Len=0 TSval=1091875727 TSecr=2677118102"
"9.218045","54.38.73.16","172.18.0.2","TCP","1516","[TCP segment of a reassembled PDU]"
"9.218364","54.38.73.16","172.18.0.2","TCP","1516","21002 → 36876 [ACK] Seq=540427 Ack=27035 Win=1452 Len=1448 TSval=2677118102 TSecr=1091875667 [TCP segment of a reassembled PDU]"
"9.218660","172.18.0.2","54.38.73.16","TLSv1.2","611","Application Data"
"9.241402","54.38.73.16","172.18.0.2","TLSv1.2","4412","Application Data [TCP segment of a reassembled PDU]"
"9.241418","172.18.0.2","54.38.73.16","TCP","68","36876 → 21002 [ACK] Seq=27578 Ack=546219 Win=5580 Len=0 TSval=1091875750 TSecr=2677118108"
"9.242480","54.38.73.16","172.18.0.2","TLSv1.2","146","Application Data"
"9.282246","54.38.73.16","172.18.0.2","TCP","68","21002 → 36876 [ACK] Seq=546297 Ack=27578 Win=1452 Len=0 TSval=2677118119 TSecr=1091875728"
"9.282264","172.18.0.2","54.38.73.16","TLSv1.2","611","Application Data"
"9.346346","54.38.73.16","172.18.0.2","TCP","68","21002 → 36876 [ACK] Seq=546297 Ack=28121 Win=1452 Len=0 TSval=2677118135 TSecr=1091875791"
"9.627521","54.38.73.16","172.18.0.2","TLSv1.2","611","Application Data"
"9.628595","172.18.0.2","54.38.73.16","TLSv1.2","611","Application Data"
"9.652552","54.38.73.16","172.18.0.2","TCP","68","21002 → 36876 [ACK] Seq=546840 Ack=28664 Win=1452 Len=0 TSval=2677118211 TSecr=1091876138"
"9.858917","54.38.73.16","172.18.0.2","TLSv1.2","3695","Application Data"
"9.859077","172.18.0.2","54.38.73.16","TCP","68","36876 → 21002 [ACK] Seq=28664 Ack=550467 Win=5584 Len=0 TSval=1091876368 TSecr=2677118262"
"9.867466","54.38.73.16","172.18.0.2","TLSv1.2","7308","Application Data"
"9.867617","172.18.0.2","54.38.73.16","TCP","68","36876 → 21002 [ACK] Seq=28664 Ack=557707 Win=5565 Len=0 TSval=1091876377 TSecr=2677118265"
"9.878047","54.38.73.16","172.18.0.2","TLSv1.2","2964","Application Data, Application Data"
"9.878105","172.18.0.2","54.38.73.16","TCP","68","36876 → 21002 [ACK] Seq=28664 Ack=560603 Win=5596 Len=0 TSval=1091876387 TSecr=2677118267"
"9.884023","54.38.73.16","172.18.0.2","TLSv1.2","2964","Application Data [TCP segment of a reassembled PDU]"
"9.884056","172.18.0.2","54.38.73.16","TCP","68","36876 → 21002 [ACK] Seq=28664 Ack=563499 Win=5596 Len=0 TSval=1091876393 TSecr=2677118269"
"9.892404","54.38.73.16","172.18.0.2","TLSv1.2","8756","Application Data, Application Data"
"9.892545","172.18.0.2","54.38.73.16","TCP","68","36876 → 21002 [ACK] Seq=28664 Ack=572187 Win=5566 Len=0 TSval=1091876402 TSecr=2677118271"
"9.903640","54.38.73.16","172.18.0.2","TLSv1.2","2964","Application Data [TCP segment of a reassembled PDU]"
"9.903673","172.18.0.2","54.38.73.16","TCP","68","36876 → 21002 [ACK] Seq=28664 Ack=575083 Win=5596 Len=0 TSval=1091876413 TSecr=2677118274"
"9.904169","172.18.0.2","54.38.73.16","TLSv1.2","611","Application Data"
"9.909672","54.38.73.16","172.18.0.2","TCP","2964","21002 → 36876 [ACK] Seq=575083 Ack=28664 Win=1452 Len=2896 TSval=2677118275 TSecr=1091876393 [TCP segment of a reassembled PDU]"
"9.909705","172.18.0.2","54.38.73.16","TCP","68","36876 → 21002 [ACK] Seq=29207 Ack=577979 Win=5596 Len=0 TSval=1091876419 TSecr=2677118275"
"9.916651","54.38.73.16","172.18.0.2","TLSv1.2","4200","Application Data, Application Data, Application Data"
"9.916793","172.18.0.2","54.38.73.16","TCP","68","36876 → 21002 [ACK] Seq=29207 Ack=582111 Win=5580 Len=0 TSval=1091876426 TSecr=2677118277"
"9.927544","54.38.73.16","172.18.0.2","TCP","1516","[TCP segment of a reassembled PDU]"
"9.929368","54.38.73.16","172.18.0.2","TCP","68","21002 → 36876 [ACK] Seq=583559 Ack=29207 Win=1452 Len=0 TSval=2677118280 TSecr=1091876413"
"9.940140","54.38.73.16","172.18.0.2","TLSv1.2","705","Application Data"
"9.940188","172.18.0.2","54.38.73.16","TCP","68","36876 → 21002 [ACK] Seq=29207 Ack=584196 Win=5593 Len=0 TSval=1091876449 TSecr=2677118279"
"9.949013","172.18.0.2","54.38.73.16","TLSv1.2","611","Application Data"
"10.010915","54.38.73.16","172.18.0.2","TCP","68","21002 → 36876 [ACK] Seq=584196 Ack=29750 Win=1452 Len=0 TSval=2677118301 TSecr=1091876458"
"10.343803","54.38.73.16","172.18.0.2","TLSv1.2","611","Application Data"
"10.344928","172.18.0.2","54.38.73.16","TLSv1.2","611","Application Data"
"10.369433","54.38.73.16","172.18.0.2","TCP","68","21002 → 36876 [ACK] Seq=584739 Ack=30293 Win=1452 Len=0 TSval=2677118390 TSecr=1091876854"
"10.862580","54.38.73.16","172.18.0.2","TLSv1.2","611","Application Data"
"10.884703","54.38.73.16","172.18.0.2","TCP","2964","[TCP segment of a reassembled PDU]"
"10.884851","172.18.0.2","54.38.73.16","TCP","68","36876 → 21002 [ACK] Seq=30293 Ack=588178 Win=5596 Len=0 TSval=1091877394 TSecr=2677118513"
"10.895381","54.38.73.16","172.18.0.2","TLSv1.2","1516","Application Data [TCP segment of a reassembled PDU]"
"10.908351","54.38.73.16","172.18.0.2","TLSv1.2","4412","Application Data [TCP segment of a reassembled PDU]"
"10.908496","172.18.0.2","54.38.73.16","TCP","68","36876 → 21002 [ACK] Seq=30293 Ack=593970 Win=5580 Len=0 TSval=1091877418 TSecr=2677118522"
"10.908837","172.18.0.2","54.38.73.16","TLSv1.2","611","Application Data"
"10.909413","54.38.73.16","172.18.0.2","TLSv1.2","748","Application Data, Application Data"
"10.918944","54.38.73.16","172.18.0.2","TLSv1.2","5860","Application Data"
"10.918979","172.18.0.2","54.38.73.16","TCP","68","36876 → 21002 [ACK] Seq=30836 Ack=600442 Win=5581 Len=0 TSval=1091877428 TSecr=2677118525"
"10.932084","54.38.73.16","172.18.0.2","TCP","1516","21002 → 36876 [ACK] Seq=600442 Ack=30293 Win=1452 Len=1448 TSval=2677118531 TSecr=1091877418 [TCP segment of a reassembled PDU]"
"10.932975","54.38.73.16","172.18.0.2","TCP","68","21002 → 36876 [ACK] Seq=601890 Ack=30836 Win=1452 Len=0 TSval=2677118531 TSecr=1091877418"
"10.944123","54.38.73.16","172.18.0.2","TLSv1.2","596","Application Data"
"10.944159","172.18.0.2","54.38.73.16","TCP","68","36876 → 21002 [ACK] Seq=30836 Ack=602418 Win=5593 Len=0 TSval=1091877453 TSecr=2677118531"
"10.949021","54.38.73.16","172.18.0.2","TLSv1.2","11652","Application Data, Application Data"
"10.949177","172.18.0.2","54.38.73.16","TCP","68","36876 → 21002 [ACK] Seq=30836 Ack=614002 Win=5551 Len=0 TSval=1091877458 TSecr=2677118535"
"10.969511","54.38.73.16","172.18.0.2","TLSv1.2","2964","Application Data [TCP segment of a reassembled PDU]"
"10.969551","172.18.0.2","54.38.73.16","TCP","68","36876 → 21002 [ACK] Seq=30836 Ack=616898 Win=5596 Len=0 TSval=1091877479 TSecr=2677118540"
"10.970038","172.18.0.2","54.38.73.16","TLSv1.2","611","Application Data"
"10.973402","54.38.73.16","172.18.0.2","TLSv1.2","2964","Application Data [TCP segment of a reassembled PDU]"
"10.973435","172.18.0.2","54.38.73.16","TCP","68","36876 → 21002 [ACK] Seq=31379 Ack=619794 Win=5596 Len=0 TSval=1091877482 TSecr=2677118541"
"10.973644","54.38.73.16","172.18.0.2","TLSv1.2","8756","Application Data, Application Data, Application Data"
"10.973908","172.18.0.2","54.38.73.16","TCP","68","36876 → 21002 [ACK] Seq=31379 Ack=628482 Win=5551 Len=0 TSval=1091877483 TSecr=2677118541"
"10.995843","54.38.73.16","172.18.0.2","TLSv1.2","2964","Application Data [TCP segment of a reassembled PDU]"
"10.995876","172.18.0.2","54.38.73.16","TCP","68","36876 → 21002 [ACK] Seq=31379 Ack=631378 Win=5596 Len=0 TSval=1091877505 TSecr=2677118547"
"10.997750","54.38.73.16","172.18.0.2","TCP","2964","21002 → 36876 [ACK] Seq=631378 Ack=31379 Win=1452 Len=2896 TSval=2677118547 TSecr=1091877479 [TCP segment of a reassembled PDU]"
"10.997790","172.18.0.2","54.38.73.16","TCP","68","36876 → 21002 [ACK] Seq=31379 Ack=634274 Win=5596 Len=0 TSval=1091877507 TSecr=2677118547"
"10.998514","54.38.73.16","172.18.0.2","TLSv1.2","8652","Application Data, Application Data, Application Data, Application Data"
"10.998656","172.18.0.2","54.38.73.16","TCP","68","36876 → 21002 [ACK] Seq=31379 Ack=642858 Win=5566 Len=0 TSval=1091877508 TSecr=2677118548"
"10.999425","172.18.0.2","54.38.73.16","TLSv1.2","611","Application Data"
"11.003722","54.38.73.16","172.18.0.2","TCP","2964","[TCP segment of a reassembled PDU]"
"11.003754","172.18.0.2","54.38.73.16","TCP","68","36876 → 21002 [ACK] Seq=31922 Ack=645754 Win=5596 Len=0 TSval=1091877513 TSecr=2677118549"
"11.020585","54.38.73.16","172.18.0.2","TLSv1.2","2964","Application Data [TCP segment of a reassembled PDU]"
"11.020618","172.18.0.2","54.38.73.16","TCP","68","36876 → 21002 [ACK] Seq=31922 Ack=648650 Win=5596 Len=0 TSval=1091877530 TSecr=2677118553"
"11.021890","54.38.73.16","172.18.0.2","TLSv1.2","2964","Application Data [TCP segment of a reassembled PDU]"
"11.021920","172.18.0.2","54.38.73.16","TCP","68","36876 → 21002 [ACK] Seq=31922 Ack=651546 Win=5596 Len=0 TSval=1091877531 TSecr=2677118554"
"11.021896","54.38.73.16","172.18.0.2","TCP","2964","21002 → 36876 [ACK] Seq=651546 Ack=31379 Win=1452 Len=2896 TSval=2677118554 TSecr=1091877508 [TCP segment of a reassembled PDU]"
"11.022037","172.18.0.2","54.38.73.16","TCP","68","36876 → 21002 [ACK] Seq=31922 Ack=654442 Win=5581 Len=0 TSval=1091877531 TSecr=2677118554"
"11.022269","54.38.73.16","172.18.0.2","TLSv1.2","5620","Application Data, Application Data, Application Data, Application Data"
"11.022515","172.18.0.2","54.38.73.16","TCP","68","36876 → 21002 [ACK] Seq=31922 Ack=659994 Win=5552 Len=0 TSval=1091877532 TSecr=2677118554"
"11.061644","54.38.73.16","172.18.0.2","TCP","68","21002 → 36876 [ACK] Seq=659994 Ack=31922 Win=1452 Len=0 TSval=2677118564 TSecr=1091877508"
"11.061686","172.18.0.2","54.38.73.16","TLSv1.2","1154","Application Data, Application Data"
"11.123117","54.38.73.16","172.18.0.2","TCP","68","21002 → 36876 [ACK] Seq=659994 Ack=33008 Win=1452 Len=0 TSval=2677118579 TSecr=1091877571"
"11.470198","54.38.73.16","172.18.0.2","TLSv1.2","611","Application Data"
"11.471302","172.18.0.2","54.38.73.16","TLSv1.2","611","Application Data"
"11.494750","54.38.73.16","172.18.0.2","TCP","68","21002 → 36876 [ACK] Seq=660537 Ack=33551 Win=1452 Len=0 TSval=2677118672 TSecr=1091877980"
"11.743781","54.38.73.16","172.18.0.2","TLSv1.2","3181","Application Data"
"11.743939","172.18.0.2","54.38.73.16","TCP","68","36876 → 21002 [ACK] Seq=33551 Ack=663650 Win=5588 Len=0 TSval=1091878253 TSecr=2677118734"
"11.755211","54.38.73.16","172.18.0.2","TCP","2964","[TCP segment of a reassembled PDU]"
"11.755246","172.18.0.2","54.38.73.16","TCP","68","36876 → 21002 [ACK] Seq=33551 Ack=666546 Win=5596 Len=0 TSval=1091878264 TSecr=2677118736"
"11.764171","54.38.73.16","172.18.0.2","TLSv1.2","1516","Application Data, Application Data"
"11.767701","54.38.73.16","172.18.0.2","TLSv1.2","951","Application Data"
"11.767855","172.18.0.2","54.38.73.16","TCP","68","36876 → 21002 [ACK] Seq=33551 Ack=668877 Win=5612 Len=0 TSval=1091878277 TSecr=2677118739"
"11.775047","54.38.73.16","172.18.0.2","TLSv1.2","8756","Application Data, Application Data"
"11.775198","172.18.0.2","54.38.73.16","TCP","68","36876 → 21002 [ACK] Seq=33551 Ack=677565 Win=5566 Len=0 TSval=1091878284 TSecr=2677118742"
"11.779472","54.38.73.16","172.18.0.2","TCP","2964","21002 → 36876 [ACK] Seq=677565 Ack=33551 Win=1452 Len=2896 TSval=2677118743 TSecr=1091878264 [TCP segment of a reassembled PDU]"
"11.779505","172.18.0.2","54.38.73.16","TCP","68","36876 → 21002 [ACK] Seq=33551 Ack=680461 Win=5596 Len=0 TSval=1091878289 TSecr=2677118743"
"11.791915","54.38.73.16","172.18.0.2","TLSv1.2","2964","Application Data [TCP segment of a reassembled PDU]"
"11.791948","172.18.0.2","54.38.73.16","TCP","68","36876 → 21002 [ACK] Seq=33551 Ack=683357 Win=5596 Len=0 TSval=1091878301 TSecr=2677118746"
"11.800338","54.38.73.16","172.18.0.2","TLSv1.2","8756","Application Data, Application Data"
"11.800488","172.18.0.2","54.38.73.16","TCP","68","36876 → 21002 [ACK] Seq=33551 Ack=692045 Win=5566 Len=0 TSval=1091878310 TSecr=2677118748"
"11.801316","172.18.0.2","54.38.73.16","TLSv1.2","611","Application Data"
"11.802936","54.38.73.16","172.18.0.2","TLSv1.2","2964","Application Data, Application Data"
"11.802970","172.18.0.2","54.38.73.16","TCP","68","36876 → 21002 [ACK] Seq=34094 Ack=694941 Win=5596 Len=0 TSval=1091878312 TSecr=2677118749"
"11.816476","54.38.73.16","172.18.0.2","TLSv1.2","2964","Application Data [TCP segment of a reassembled PDU]"
"11.816513","172.18.0.2","54.38.73.16","TCP","68","36876 → 21002 [ACK] Seq=34094 Ack=697837 Win=5596 Len=0 TSval=1091878326 TSecr=2677118752"
"11.824732","54.38.73.16","172.18.0.2","TLSv1.2","8756","Application Data, Application Data"
"11.824871","172.18.0.2","54.38.73.16","TCP","68","36876 → 21002 [ACK] Seq=34094 Ack=706525 Win=5566 Len=0 TSval=1091878334 TSecr=2677118754"
"11.825269","54.38.73.16","172.18.0.2","TCP","68","21002 → 36876 [ACK] Seq=706525 Ack=34094 Win=1452 Len=0 TSval=2677118754 TSecr=1091878310"
"11.825316","172.18.0.2","54.38.73.16","TLSv1.2","611","Application Data"
"11.827432","54.38.73.16","172.18.0.2","TLSv1.2","5860","Application Data [TCP segment of a reassembled PDU]"
"11.827465","172.18.0.2","54.38.73.16","TCP","68","36876 → 21002 [ACK] Seq=34637 Ack=712317 Win=5581 Len=0 TSval=1091878337 TSecr=2677118755"
"11.840041","54.38.73.16","172.18.0.2","TLSv1.2","2964","Application Data, Application Data"
"11.840075","172.18.0.2","54.38.73.16","TCP","68","36876 → 21002 [ACK] Seq=34637 Ack=715213 Win=5596 Len=0 TSval=1091878349 TSecr=2677118758"
"11.850974","54.38.73.16","172.18.0.2","TLSv1.2","8756","Application Data, Application Data"
"11.851121","172.18.0.2","54.38.73.16","TCP","68","36876 → 21002 [ACK] Seq=34637 Ack=723901 Win=5566 Len=0 TSval=1091878360 TSecr=2677118760"
"11.851559","54.38.73.16","172.18.0.2","TLSv1.2","6247","Application Data, Application Data, Application Data, Application Data"
"11.851608","172.18.0.2","54.38.73.16","TLSv1.2","611","Application Data"
"11.915956","54.38.73.16","172.18.0.2","TCP","68","21002 → 36876 [ACK] Seq=730080 Ack=35180 Win=1452 Len=0 TSval=2677118777 TSecr=1091878361"
"11.916021","172.18.0.2","54.38.73.16","TLSv1.2","611","Application Data"
"11.988405","54.38.73.16","172.18.0.2","TCP","68","21002 → 36876 [ACK] Seq=730080 Ack=35723 Win=1452 Len=0 TSval=2677118793 TSecr=1091878425"
"12.291767","54.38.73.16","172.18.0.2","TLSv1.2","611","Application Data"
"12.292274","172.18.0.2","54.38.73.16","TLSv1.2","611","Application Data"
"12.315797","54.38.73.16","172.18.0.2","TCP","68","21002 → 36876 [ACK] Seq=730623 Ack=36266 Win=1452 Len=0 TSval=2677118877 TSecr=1091878801"
"12.648485","54.38.73.16","172.18.0.2","TLSv1.2","3695","Application Data"
"12.648644","172.18.0.2","54.38.73.16","TCP","68","36876 → 21002 [ACK] Seq=36266 Ack=734250 Win=5584 Len=0 TSval=1091879158 TSecr=2677118960"
"12.669719","54.38.73.16","172.18.0.2","TCP","2964","[TCP segment of a reassembled PDU]"
"12.669752","172.18.0.2","54.38.73.16","TCP","68","36876 → 21002 [ACK] Seq=36266 Ack=737146 Win=5596 Len=0 TSval=1091879179 TSecr=2677118965"
"12.673358","54.38.73.16","172.18.0.2","TLSv1.2","799","Application Data"
"12.683369","54.38.73.16","172.18.0.2","TCP","2964","[TCP segment of a reassembled PDU]"
"12.683402","172.18.0.2","54.38.73.16","TCP","68","36876 → 21002 [ACK] Seq=36266 Ack=740773 Win=5596 Len=0 TSval=1091879192 TSecr=2677118966"
"12.696861","54.38.73.16","172.18.0.2","TLSv1.2","4412","Application Data, Application Data"
"12.697009","172.18.0.2","54.38.73.16","TCP","68","36876 → 21002 [ACK] Seq=36266 Ack=745117 Win=5580 Len=0 TSval=1091879206 TSecr=2677118971"
"12.705424","54.38.73.16","172.18.0.2","TLSv1.2","2964","Application Data [TCP segment of a reassembled PDU]"
"12.705457","172.18.0.2","54.38.73.16","TCP","68","36876 → 21002 [ACK] Seq=36266 Ack=748013 Win=5596 Len=0 TSval=1091879214 TSecr=2677118974"
"12.709042","54.38.73.16","172.18.0.2","TLSv1.2","1356","Application Data"
"12.709554","172.18.0.2","54.38.73.16","TLSv1.2","611","Application Data"
"12.714793","54.38.73.16","172.18.0.2","TLSv1.2","4412","Application Data"
"12.714944","172.18.0.2","54.38.73.16","TCP","68","36876 → 21002 [ACK] Seq=36809 Ack=753645 Win=5580 Len=0 TSval=1091879224 TSecr=2677118977"
"12.726900","54.38.73.16","172.18.0.2","TLSv1.2","4412","Application Data [TCP segment of a reassembled PDU]"
"12.726936","172.18.0.2","54.38.73.16","TCP","68","36876 → 21002 [ACK] Seq=36809 Ack=757989 Win=5580 Len=0 TSval=1091879236 TSecr=2677118980"
"12.733094","54.38.73.16","172.18.0.2","TLSv1.2","205","Application Data"
"12.733605","172.18.0.2","54.38.73.16","TLSv1.2","611","Application Data"
"12.735796","54.38.73.16","172.18.0.2","TCP","2964","[TCP segment of a reassembled PDU]"
"12.735942","172.18.0.2","54.38.73.16","TCP","68","36876 → 21002 [ACK] Seq=37352 Ack=761022 Win=5596 Len=0 TSval=1091879245 TSecr=2677118982"
"12.739888","54.38.73.16","172.18.0.2","TLSv1.2","1516","Application Data [TCP segment of a reassembled PDU]"
"12.746934","54.38.73.16","172.18.0.2","TLSv1.2","4412","Application Data [TCP segment of a reassembled PDU]"
"12.747077","172.18.0.2","54.38.73.16","TCP","68","36876 → 21002 [ACK] Seq=37352 Ack=766814 Win=5580 Len=0 TSval=1091879256 TSecr=2677118983"
"12.752299","54.38.73.16","172.18.0.2","TLSv1.2","2964","Application Data [TCP segment of a reassembled PDU]"
"12.752333","172.18.0.2","54.38.73.16","TCP","68","36876 → 21002 [ACK] Seq=37352 Ack=769710 Win=5596 Len=0 TSval=1091879261 TSecr=2677118986"
"12.759092","54.38.73.16","172.18.0.2","TLSv1.2","2964","Application Data [TCP segment of a reassembled PDU]"
"12.759134","172.18.0.2","54.38.73.16","TCP","68","36876 → 21002 [ACK] Seq=37352 Ack=772606 Win=5596 Len=0 TSval=1091879268 TSecr=2677118988"
"12.760302","54.38.73.16","172.18.0.2","TLSv1.2","2964","Application Data [TCP segment of a reassembled PDU]"
"12.760335","172.18.0.2","54.38.73.16","TCP","68","36876 → 21002 [ACK] Seq=37352 Ack=775502 Win=5596 Len=0 TSval=1091879269 TSecr=2677118988"
"12.771457","54.38.73.16","172.18.0.2","TLSv1.2","5860","Application Data, Application Data"
"12.771602","172.18.0.2","54.38.73.16","TCP","68","36876 → 21002 [ACK] Seq=37352 Ack=781294 Win=5581 Len=0 TSval=1091879281 TSecr=2677118991"
"12.776861","54.38.73.16","172.18.0.2","TCP","2964","21002 → 36876 [ACK] Seq=781294 Ack=37352 Win=1452 Len=2896 TSval=2677118992 TSecr=1091879261 [TCP segment of a reassembled PDU]"
"12.776893","172.18.0.2","54.38.73.16","TCP","68","36876 → 21002 [ACK] Seq=37352 Ack=784190 Win=5596 Len=0 TSval=1091879286 TSecr=2677118992"
"12.786002","54.38.73.16","172.18.0.2","TLSv1.2","2964","Application Data [TCP segment of a reassembled PDU]"
"12.786041","172.18.0.2","54.38.73.16","TCP","68","36876 → 21002 [ACK] Seq=37352 Ack=787086 Win=5596 Len=0 TSval=1091879295 TSecr=2677118994"
"12.786008","54.38.73.16","172.18.0.2","TLSv1.2","2238","Application Data, Application Data"
"12.786169","172.18.0.2","54.38.73.16","TCP","68","36876 → 21002 [ACK] Seq=37352 Ack=789256 Win=5584 Len=0 TSval=1091879295 TSecr=2677118994"
"12.786556","172.18.0.2","54.38.73.16","TLSv1.2","611","Application Data"
"12.807963","54.38.73.16","172.18.0.2","TCP","2964","[TCP segment of a reassembled PDU]"
"12.807996","172.18.0.2","54.38.73.16","TCP","68","36876 → 21002 [ACK] Seq=37895 Ack=792152 Win=5596 Len=0 TSval=1091879317 TSecr=2677119000"
"12.814165","54.38.73.16","172.18.0.2","TLSv1.2","799","Application Data"
"12.850863","54.38.73.16","172.18.0.2","TCP","68","21002 → 36876 [ACK] Seq=792883 Ack=37895 Win=1452 Len=0 TSval=2677119011 TSecr=1091879296"
"12.857655","172.18.0.2","54.38.73.16","TCP","68","36876 → 21002 [ACK] Seq=37895 Ack=792883 Win=5612 Len=0 TSval=1091879367 TSecr=2677119001"
"12.881897","54.38.73.16","172.18.0.2","TLSv1.2","1125","Application Data"
"12.882063","172.18.0.2","54.38.73.16","TCP","68","36876 → 21002 [ACK] Seq=37895 Ack=793940 Win=5612 Len=0 TSval=1091879391 TSecr=2677119018"
"12.888782","172.18.0.2","54.38.73.16","TLSv1.2","611","Application Data"
"12.949530","54.38.73.16","172.18.0.2","TCP","68","21002 → 36876 [ACK] Seq=793940 Ack=38438 Win=1452 Len=0 TSval=2677119036 TSecr=1091879398"
