_ws.col.Time,_ws.col.Source,_ws.col.Destination,_ws.col.Protocol,_ws.col.Length,_ws.col.Info
"0.000000","172.18.0.2","54.38.73.16","TLSv1.2","611","Application Data"
"0.025330","54.38.73.16","172.18.0.2","TCP","68","21002 → 36876 [ACK] Seq=1 Ack=544 Win=1452 Len=0 TSval=2678363773 TSecr=1096858347"
"0.729168","54.38.73.16","172.18.0.2","TLSv1.2","611","Application Data"
"0.729211","172.18.0.2","54.38.73.16","TCP","68","36876 → 21002 [ACK] Seq=544 Ack=544 Win=5608 Len=0 TSval=1096859077 TSecr=2678363934"
"0.730334","172.18.0.2","54.38.73.16","TLSv1.2","2153","Application Data"
"0.754724","54.38.73.16","172.18.0.2","TCP","68","21002 → 36876 [ACK] Seq=544 Ack=2629 Win=1450 Len=0 TSval=2678363955 TSecr=1096859078"
"1.189729","54.38.73.16","172.18.0.2","TLSv1.2","611","Application Data"
"1.189785","172.18.0.2","54.38.73.16","TCP","68","36876 → 21002 [ACK] Seq=2629 Ack=1087 Win=5608 Len=0 TSval=1096859537 TSecr=2678364064"
"1.219598","54.38.73.16","172.18.0.2","TLSv1.2","1125","Application Data"
"1.219622","172.18.0.2","54.38.73.16","TCP","68","36876 → 21002 [ACK] Seq=2629 Ack=2144 Win=5600 Len=0 TSval=1096859567 TSecr=2678364072"
"1.226308","172.18.0.2","54.38.73.16","TLSv1.2","611","Application Data"
"1.251816","54.38.73.16","172.18.0.2","TCP","68","21002 → 36876 [ACK] Seq=2144 Ack=3172 Win=1452 Len=0 TSval=2678364080 TSecr=1096859574"
"1.548192","54.38.73.16","172.18.0.2","TLSv1.2","611","Application Data"
"1.548235","172.18.0.2","54.38.73.16","TCP","68","36876 → 21002 [ACK] Seq=3172 Ack=2687 Win=5608 Len=0 TSval=1096859896 TSecr=2678364142"
"1.549119","172.18.0.2","54.38.73.16","TLSv1.2","611","Application Data"
"1.572422","54.38.73.16","172.18.0.2","TCP","68","21002 → 36876 [ACK] Seq=2687 Ack=3715 Win=1452 Len=0 TSval=2678364160 TSecr=1096859897"
"1.897279","54.38.73.16","172.18.0.2","TLSv1.2","3695","Application Data"
"1.897434","172.18.0.2","54.38.73.16","TCP","68","36876 → 21002 [ACK] Seq=3715 Ack=6314 Win=5584 Len=0 TSval=1096860245 TSecr=2678364241"
"1.897912","172.18.0.2","54.38.73.16","TLSv1.2","611","Application Data"
"1.921590","54.38.73.16","172.18.0.2","TCP","68","21002 → 36876 [ACK] Seq=6314 Ack=4258 Win=1452 Len=0 TSval=2678364247 TSecr=1096860245"
"1.937905","54.38.73.16","172.18.0.2","TLSv1.2","3695","Application Data"
"1.938055","172.18.0.2","54.38.73.16","TCP","68","36876 → 21002 [ACK] Seq=4258 Ack=9941 Win=5584 Len=0 TSval=1096860285 TSecr=2678364251"
"1.948894","54.38.73.16","172.18.0.2","TCP","2964","[TCP segment of a reassembled PDU]"
"1.948920","172.18.0.2","54.38.73.16","TCP","68","36876 → 21002 [ACK] Seq=4258 Ack=12837 Win=5596 Len=0 TSval=1096860296 TSecr=2678364254"
"1.957936","54.38.73.16","172.18.0.2","TLSv1.2","5860","Application Data, Application Data"
"1.958033","172.18.0.2","54.38.73.16","TCP","68","36876 → 21002 [ACK] Seq=4258 Ack=18629 Win=5581 Len=0 TSval=1096860305 TSecr=2678364256"
"1.958115","54.38.73.16","172.18.0.2","TCP","1516","21002 → 36876 [ACK] Seq=18629 Ack=4258 Win=1452 Len=1448 TSval=2678364256 TSecr=1096860245 [TCP segment of a reassembled PDU]"
"1.961495","54.38.73.16","172.18.0.2","TLSv1.2","1327","Application Data"
"1.961505","172.18.0.2","54.38.73.16","TCP","68","36876 → 21002 [ACK] Seq=4258 Ack=21336 Win=5593 Len=0 TSval=1096860309 TSecr=2678364256"
"1.968783","54.38.73.16","172.18.0.2","TLSv1.2","4412","Application Data"
"1.968861","172.18.0.2","54.38.73.16","TCP","68","36876 → 21002 [ACK] Seq=4258 Ack=25680 Win=5580 Len=0 TSval=1096860316 TSecr=2678364259"
"1.972687","54.38.73.16","172.18.0.2","TCP","2964","21002 → 36876 [ACK] Seq=25680 Ack=4258 Win=1452 Len=2896 TSval=2678364260 TSecr=1096860296 [TCP segment of a reassembled PDU]"
"1.972710","172.18.0.2","54.38.73.16","TCP","68","36876 → 21002 [ACK] Seq=4258 Ack=28576 Win=5596 Len=0 TSval=1096860320 TSecr=2678364260"
"1.981792","54.38.73.16","172.18.0.2","TLSv1.2","2964","Application Data, Application Data"
"1.981810","172.18.0.2","54.38.73.16","TCP","68","36876 → 21002 [ACK] Seq=4258 Ack=31472 Win=5596 Len=0 TSval=1096860329 TSecr=2678364262"
"1.982044","172.18.0.2","54.38.73.16","TLSv1.2","611","Application Data"
"1.985576","54.38.73.16","172.18.0.2","TLSv1.2","1356","Application Data"
"2.000485","54.38.73.16","172.18.0.2","TLSv1.2","7308","Application Data"
"2.000632","172.18.0.2","54.38.73.16","TCP","68","36876 → 21002 [ACK] Seq=4801 Ack=40000 Win=5565 Len=0 TSval=1096860348 TSecr=2678364263"
"2.011056","54.38.73.16","172.18.0.2","TLSv1.2","4412","Application Data, Application Data"
"2.011103","172.18.0.2","54.38.73.16","TCP","68","36876 → 21002 [ACK] Seq=4801 Ack=44344 Win=5580 Len=0 TSval=1096860359 TSecr=2678364270"
"2.024687","54.38.73.16","172.18.0.2","TLSv1.2","422","Application Data"
"2.032505","54.38.73.16","172.18.0.2","TLSv1.2","5860","Application Data"
"2.032532","172.18.0.2","54.38.73.16","TCP","68","36876 → 21002 [ACK] Seq=4801 Ack=50490 Win=5581 Len=0 TSval=1096860380 TSecr=2678364273"
"2.032713","54.38.73.16","172.18.0.2","TCP","1516","21002 → 36876 [ACK] Seq=50490 Ack=4801 Win=1452 Len=1448 TSval=2678364275 TSecr=1096860348 [TCP segment of a reassembled PDU]"
"2.043334","54.38.73.16","172.18.0.2","TLSv1.2","1516","Application Data [TCP segment of a reassembled PDU]"
"2.043358","172.18.0.2","54.38.73.16","TCP","68","36876 → 21002 [ACK] Seq=4801 Ack=53386 Win=5593 Len=0 TSval=1096860391 TSecr=2678364275"
"2.043648","54.38.73.16","172.18.0.2","TCP","1516","21002 → 36876 [ACK] Seq=53386 Ack=4801 Win=1452 Len=1448 TSval=2678364278 TSecr=1096860359 [TCP segment of a reassembled PDU]"
"2.057417","54.38.73.16","172.18.0.2","TLSv1.2","1327","Application Data"
"2.057441","172.18.0.2","54.38.73.16","TCP","68","36876 → 21002 [ACK] Seq=4801 Ack=56093 Win=5593 Len=0 TSval=1096860405 TSecr=2678364278"
"2.057904","172.18.0.2","54.38.73.16","TLSv1.2","611","Application Data"
"2.064478","54.38.73.16","172.18.0.2","TCP","2964","[TCP segment of a reassembled PDU]"
"2.064723","172.18.0.2","54.38.73.16","TCP","68","36876 → 21002 [ACK] Seq=5344 Ack=58989 Win=5596 Len=0 TSval=1096860412 TSecr=2678364283"
"2.081395","54.38.73.16","172.18.0.2","TLSv1.2","285","Application Data"
"2.085864","54.38.73.16","172.18.0.2","TCP","2964","[TCP segment of a reassembled PDU]"
"2.085895","172.18.0.2","54.38.73.16","TLSv1.2","611","Application Data"
"2.110331","54.38.73.16","172.18.0.2","TLSv1.2","799","Application Data"
"2.151137","172.18.0.2","54.38.73.16","TCP","68","36876 → 21002 [ACK] Seq=5887 Ack=62833 Win=5612 Len=0 TSval=1096860499 TSecr=2678364294"
"2.179838","54.38.73.16","172.18.0.2","TLSv1.2","3695","Application Data"
"2.179983","172.18.0.2","54.38.73.16","TCP","68","36876 → 21002 [ACK] Seq=5887 Ack=66460 Win=5584 Len=0 TSval=1096860527 TSecr=2678364312"
"2.211958","54.38.73.16","172.18.0.2","TLSv1.2","4145","Application Data"
"2.212101","172.18.0.2","54.38.73.16","TCP","68","36876 → 21002 [ACK] Seq=5887 Ack=70537 Win=5580 Len=0 TSval=1096860560 TSecr=2678364319"
"2.212484","54.38.73.16","172.18.0.2","TLSv1.2","7308","Application Data"
"2.212603","172.18.0.2","54.38.73.16","TCP","68","36876 → 21002 [ACK] Seq=5887 Ack=77777 Win=5565 Len=0 TSval=1096860560 TSecr=2678364319"
"2.236483","54.38.73.16","172.18.0.2","TLSv1.2","660","Application Data"
"2.236622","172.18.0.2","54.38.73.16","TCP","68","36876 → 21002 [ACK] Seq=5887 Ack=78369 Win=5612 Len=0 TSval=1096860584 TSecr=2678364326"
"2.243238","54.38.73.16","172.18.0.2","TCP","2964","[TCP segment of a reassembled PDU]"
"2.243373","172.18.0.2","54.38.73.16","TCP","68","36876 → 21002 [ACK] Seq=5887 Ack=81265 Win=5596 Len=0 TSval=1096860591 TSecr=2678364328"
"2.260698","54.38.73.16","172.18.0.2","TLSv1.2","285","Application Data"
"2.260848","172.18.0.2","54.38.73.16","TCP","68","36876 → 21002 [ACK] Seq=5887 Ack=81482 Win=5612 Len=0 TSval=1096860608 TSecr=2678364332"
"2.261297","172.18.0.2","54.38.73.16","TLSv1.2","611","Application Data"
"2.322940","54.38.73.16","172.18.0.2","TCP","68","21002 → 36876 [ACK] Seq=81482 Ack=6430 Win=1452 Len=0 TSval=2678364348 TSecr=1096860609"
"2.323003","172.18.0.2","54.38.73.16","TLSv1.2","611","Application Data"
"2.386849","54.38.73.16","172.18.0.2","TCP","68","21002 → 36876 [ACK] Seq=81482 Ack=6973 Win=1452 Len=0 TSval=2678364364 TSecr=1096860670"
"2.776567","54.38.73.16","172.18.0.2","TLSv1.2","611","Application Data"
"2.776612","172.18.0.2","54.38.73.16","TCP","68","36876 → 21002 [ACK] Seq=6973 Ack=82025 Win=5608 Len=0 TSval=1096861124 TSecr=2678364450"
"2.777397","172.18.0.2","54.38.73.16","TLSv1.2","611","Application Data"
"2.801297","54.38.73.16","172.18.0.2","TCP","68","21002 → 36876 [ACK] Seq=82025 Ack=7516 Win=1452 Len=0 TSval=2678364467 TSecr=1096861125"
"3.289557","54.38.73.16","172.18.0.2","TLSv1.2","4145","Application Data"
"3.289612","172.18.0.2","54.38.73.16","TCP","68","36876 → 21002 [ACK] Seq=7516 Ack=86102 Win=5581 Len=0 TSval=1096861637 TSecr=2678364562"
"3.289793","54.38.73.16","172.18.0.2","TLSv1.2","7308","Application Data"
"3.289811","172.18.0.2","54.38.73.16","TCP","68","36876 → 21002 [ACK] Seq=7516 Ack=93342 Win=5573 Len=0 TSval=1096861637 TSecr=2678364562"
"3.289816","54.38.73.16","172.18.0.2","TLSv1.2","2964","Application Data [TCP segment of a reassembled PDU]"
"3.289831","172.18.0.2","54.38.73.16","TCP","68","36876 → 21002 [ACK] Seq=7516 Ack=96238 Win=5558 Len=0 TSval=1096861637 TSecr=2678364565"
"3.289833","54.38.73.16","172.18.0.2","TCP","1516","21002 → 36876 [ACK] Seq=96238 Ack=7516 Win=1452 Len=1448 TSval=2678364583 TSecr=1096861125 [TCP segment of a reassembled PDU]"
"3.289843","172.18.0.2","54.38.73.16","TCP","68","36876 → 21002 [ACK] Seq=7516 Ack=97686 Win=5551 Len=0 TSval=1096861637 TSecr=2678364583"
"3.314376","54.38.73.16","172.18.0.2","TLSv1.2","5860","Application Data, Application Data"
"3.314405","172.18.0.2","54.38.73.16","TCP","68","36876 → 21002 [ACK] Seq=7516 Ack=103478 Win=5581 Len=0 TSval=1096861662 TSecr=2678364595"
"3.314597","54.38.73.16","172.18.0.2","TLSv1.2","8688","Application Data, Application Data, Application Data, Application Data"
"3.314622","172.18.0.2","54.38.73.16","TCP","68","36876 → 21002 [ACK] Seq=7516 Ack=112098 Win=5536 Len=0 TSval=1096861662 TSecr=2678364595"
"3.315635","172.18.0.2","54.38.73.16","TLSv1.2","611","Application Data"
"3.320145","54.38.73.16","172.18.0.2","TLSv1.2","4412","Application Data"
"3.320161","172.18.0.2","54.38.73.16","TCP","68","36876 → 21002 [ACK] Seq=8059 Ack=116442 Win=5580 Len=0 TSval=1096861668 TSecr=2678364597"
"3.339966","54.38.73.16","172.18.0.2","TLSv1.2","11652","Application Data, Application Data, Application Data"
"3.340077","172.18.0.2","54.38.73.16","TCP","68","36876 → 21002 [ACK] Seq=8059 Ack=128026 Win=5551 Len=0 TSval=1096861688 TSecr=2678364602"
"3.340221","54.38.73.16","172.18.0.2","TCP","68","[TCP Previous segment not captured] 21002 → 36876 [ACK] Seq=130922 Ack=8059 Win=1452 Len=0 TSval=2678364602 TSecr=1096861663"
"3.340242","172.18.0.2","54.38.73.16","TLSv1.2","611","Application Data"
"3.340247","54.38.73.16","172.18.0.2","TCP","2964","[TCP Retransmission] 21002 → 36876 [ACK] Seq=128026 Ack=7516 Win=1452 Len=2896 TSval=2678364602 TSecr=1096861662"
"3.340323","172.18.0.2","54.38.73.16","TCP","68","36876 → 21002 [ACK] Seq=8602 Ack=130922 Win=5536 Len=0 TSval=1096861688 TSecr=2678364602"
"3.344473","54.38.73.16","172.18.0.2","TLSv1.2","2964","Ignored Unknown Record"
"3.344487","172.18.0.2","54.38.73.16","TCP","68","36876 → 21002 [ACK] Seq=8602 Ack=133818 Win=5596 Len=0 TSval=1096861692 TSecr=2678364603"
"3.355324","54.38.73.16","172.18.0.2","TLSv1.2","1516","Ignored Unknown Record"
"3.364234","54.38.73.16","172.18.0.2","TLSv1.2","2964","Ignored Unknown Record"
"3.364248","172.18.0.2","54.38.73.16","TCP","68","36876 → 21002 [ACK] Seq=8602 Ack=138162 Win=5596 Len=0 TSval=1096861712 TSecr=2678364606"
"3.364456","54.38.73.16","172.18.0.2","TLSv1.2","7308","Ignored Unknown Record"
"3.364568","172.18.0.2","54.38.73.16","TCP","68","36876 → 21002 [ACK] Seq=8602 Ack=145402 Win=5565 Len=0 TSval=1096861712 TSecr=2678364608"
"3.364638","54.38.73.16","172.18.0.2","TLSv1.2","2964","Ignored Unknown Record"
"3.364667","172.18.0.2","54.38.73.16","TLSv1.2","611","Application Data"
"3.365322","54.38.73.16","172.18.0.2","TLSv1.2","2964","Ignored Unknown Record"
"3.365338","172.18.0.2","54.38.73.16","TCP","68","36876 → 21002 [ACK] Seq=9145 Ack=151194 Win=5596 Len=0 TSval=1096861713 TSecr=2678364608"
"3.368527","54.38.73.16","172.18.0.2","TLSv1.2","2964","Ignored Unknown Record"
"3.368542","172.18.0.2","54.38.73.16","TCP","68","36876 → 21002 [ACK] Seq=9145 Ack=154090 Win=5596 Len=0 TSval=1096861716 TSecr=2678364609"
"3.388934","54.38.73.16","172.18.0.2","TLSv1.2","174","Ignored Unknown Record"
"3.426991","54.38.73.16","172.18.0.2","TCP","68","21002 → 36876 [ACK] Seq=154196 Ack=9145 Win=1452 Len=0 TSval=2678364624 TSecr=1096861712"
"3.427023","172.18.0.2","54.38.73.16","TLSv1.2","1154","Application Data, Application Data"
"3.487203","02:42:09:5f:bf:77","","ARP","44","Who has 172.18.0.2? Tell 172.18.0.1"
"3.487215","02:42:ac:12:00:02","","ARP","44","172.18.0.2 is at 02:42:ac:12:00:02"
"3.491647","54.38.73.16","172.18.0.2","TCP","68","21002 → 36876 [ACK] Seq=154196 Ack=10231 Win=1452 Len=0 TSval=2678364640 TSecr=1096861774"
"3.801061","54.38.73.16","172.18.0.2","TLSv1.2","611","Application Data"
"3.801889","172.18.0.2","54.38.73.16","TLSv1.2","611","Application Data"
"3.825859","54.38.73.16","172.18.0.2","TCP","68","21002 → 36876 [ACK] Seq=154739 Ack=10774 Win=1452 Len=0 TSval=2678364723 TSecr=1096862149"
"4.167466","54.38.73.16","172.18.0.2","TLSv1.2","611","Application Data"
"4.189810","54.38.73.16","172.18.0.2","TCP","2964","[TCP segment of a reassembled PDU]"
"4.189945","172.18.0.2","54.38.73.16","TCP","68","36876 → 21002 [ACK] Seq=10774 Ack=158178 Win=5596 Len=0 TSval=1096862537 TSecr=2678364809"
"4.190086","54.38.73.16","172.18.0.2","TLSv1.2","4412","Application Data [TCP segment of a reassembled PDU]"
"4.190210","172.18.0.2","54.38.73.16","TCP","68","36876 → 21002 [ACK] Seq=10774 Ack=162522 Win=5580 Len=0 TSval=1096862538 TSecr=2678364814"
"4.203158","54.38.73.16","172.18.0.2","TLSv1.2","2964","Application Data [TCP segment of a reassembled PDU]"
"4.203176","172.18.0.2","54.38.73.16","TCP","68","36876 → 21002 [ACK] Seq=10774 Ack=165418 Win=5596 Len=0 TSval=1096862551 TSecr=2678364818"
"4.203586","172.18.0.2","54.38.73.16","TLSv1.2","611","Application Data"
"4.213598","54.38.73.16","172.18.0.2","TLSv1.2","1516","Application Data [TCP segment of a reassembled PDU]"
"4.213989","54.38.73.16","172.18.0.2","TLSv1.2","422","Application Data"
"4.214053","172.18.0.2","54.38.73.16","TCP","68","36876 → 21002 [ACK] Seq=11317 Ack=167220 Win=5612 Len=0 TSval=1096862561 TSecr=2678364820"
"4.224554","54.38.73.16","172.18.0.2","TLSv1.2","8756","Application Data, Application Data"
"4.224689","172.18.0.2","54.38.73.16","TCP","68","36876 → 21002 [ACK] Seq=11317 Ack=175908 Win=5566 Len=0 TSval=1096862572 TSecr=2678364823"
"4.225195","54.38.73.16","172.18.0.2","TLSv1.2","2964","Application Data [TCP segment of a reassembled PDU]"
"4.225235","172.18.0.2","54.38.73.16","TCP","68","36876 → 21002 [ACK] Seq=11317 Ack=178804 Win=5551 Len=0 TSval=1096862573 TSecr=2678364823"
"4.227508","54.38.73.16","172.18.0.2","TCP","68","21002 → 36876 [ACK] Seq=178804 Ack=11317 Win=1452 Len=0 TSval=2678364824 TSecr=1096862551"
"4.235337","54.38.73.16","172.18.0.2","TLSv1.2","4412","Application Data [TCP segment of a reassembled PDU]"
"4.235354","172.18.0.2","54.38.73.16","TCP","68","36876 → 21002 [ACK] Seq=11317 Ack=183148 Win=5580 Len=0 TSval=1096862583 TSecr=2678364826"
"4.237725","54.38.73.16","172.18.0.2","TLSv1.2","2964","Application Data [TCP segment of a reassembled PDU]"
"4.237741","172.18.0.2","54.38.73.16","TCP","68","36876 → 21002 [ACK] Seq=11317 Ack=186044 Win=5596 Len=0 TSval=1096862585 TSecr=2678364826"
"4.238129","172.18.0.2","54.38.73.16","TLSv1.2","611","Application Data"
"4.248768","54.38.73.16","172.18.0.2","TLSv1.2","8756","Application Data, Application Data, Application Data"
"4.248942","172.18.0.2","54.38.73.16","TCP","68","36876 → 21002 [ACK] Seq=11860 Ack=194732 Win=5566 Len=0 TSval=1096862596 TSecr=2678364829"
"4.249722","54.38.73.16","172.18.0.2","TLSv1.2","2144","Application Data, Application Data"
"4.249807","172.18.0.2","54.38.73.16","TCP","68","36876 → 21002 [ACK] Seq=11860 Ack=196808 Win=5554 Len=0 TSval=1096862597 TSecr=2678364829"
"4.259846","54.38.73.16","172.18.0.2","TCP","1516","[TCP segment of a reassembled PDU]"
"4.270557","54.38.73.16","172.18.0.2","TLSv1.2","2964","Application Data [TCP segment of a reassembled PDU]"
"4.270588","172.18.0.2","54.38.73.16","TCP","68","36876 → 21002 [ACK] Seq=11860 Ack=201152 Win=5596 Len=0 TSval=1096862618 TSecr=2678364832"
"4.274286","54.38.73.16","172.18.0.2","TLSv1.2","922","Application Data"
"4.282114","54.38.73.16","172.18.0.2","TCP","2964","[TCP segment of a reassembled PDU]"
"4.282140","172.18.0.2","54.38.73.16","TCP","68","36876 → 21002 [ACK] Seq=11860 Ack=204902 Win=5596 Len=0 TSval=1096862630 TSecr=2678364835"
"4.306459","54.38.73.16","172.18.0.2","TLSv1.2","799","Application Data"
"4.347287","172.18.0.2","54.38.73.16","TCP","68","36876 → 21002 [ACK] Seq=11860 Ack=205633 Win=5612 Len=0 TSval=1096862695 TSecr=2678364843"
"4.371445","54.38.73.16","172.18.0.2","TLSv1.2","1125","Application Data"
"4.371490","172.18.0.2","54.38.73.16","TCP","68","36876 → 21002 [ACK] Seq=11860 Ack=206690 Win=5604 Len=0 TSval=1096862719 TSecr=2678364860"
"4.380511","172.18.0.2","54.38.73.16","TLSv1.2","611","Application Data"
"4.442948","54.38.73.16","172.18.0.2","TCP","68","21002 → 36876 [ACK] Seq=206690 Ack=12403 Win=1452 Len=0 TSval=2678364878 TSecr=1096862728"
"4.824662","54.38.73.16","172.18.0.2","TLSv1.2","611","Application Data"
"4.824706","172.18.0.2","54.38.73.16","TCP","68","36876 → 21002 [ACK] Seq=12403 Ack=207233 Win=5608 Len=0 TSval=1096863172 TSecr=2678364956"
"4.825763","172.18.0.2","54.38.73.16","TLSv1.2","611","Application Data"
"4.850042","54.38.73.16","172.18.0.2","TCP","68","21002 → 36876 [ACK] Seq=207233 Ack=12946 Win=1452 Len=0 TSval=2678364979 TSecr=1096863173"
"5.234986","54.38.73.16","172.18.0.2","TLSv1.2","3695","Application Data"
"5.235030","172.18.0.2","54.38.73.16","TCP","68","36876 → 21002 [ACK] Seq=12946 Ack=210860 Win=5584 Len=0 TSval=1096863582 TSecr=2678365071"
"5.235034","54.38.73.16","172.18.0.2","TCP","2964","[TCP segment of a reassembled PDU]"
"5.235047","172.18.0.2","54.38.73.16","TCP","68","36876 → 21002 [ACK] Seq=12946 Ack=213756 Win=5566 Len=0 TSval=1096863582 TSecr=2678365074"
"5.258315","54.38.73.16","172.18.0.2","TLSv1.2","1342","Application Data, Application Data"
"5.258341","172.18.0.2","54.38.73.16","TCP","68","36876 → 21002 [ACK] Seq=12946 Ack=215030 Win=5593 Len=0 TSval=1096863606 TSecr=2678365081"
"5.260256","54.38.73.16","172.18.0.2","TLSv1.2","10204","Application Data, Application Data"
"5.260302","172.18.0.2","54.38.73.16","TCP","68","36876 → 21002 [ACK] Seq=12946 Ack=225166 Win=5550 Len=0 TSval=1096863608 TSecr=2678365082"
"5.260856","172.18.0.2","54.38.73.16","TLSv1.2","611","Application Data"
"5.272355","54.38.73.16","172.18.0.2","TLSv1.2","1516","Application Data [TCP segment of a reassembled PDU]"
"5.283349","54.38.73.16","172.18.0.2","TLSv1.2","936","Application Data"
"5.283374","172.18.0.2","54.38.73.16","TCP","68","36876 → 21002 [ACK] Seq=13489 Ack=227482 Win=5593 Len=0 TSval=1096863631 TSecr=2678365085"
"5.284782","54.38.73.16","172.18.0.2","TCP","68","21002 → 36876 [ACK] Seq=227482 Ack=13489 Win=1452 Len=0 TSval=2678365088 TSecr=1096863608"
"5.293134","54.38.73.16","172.18.0.2","TCP","2964","[TCP segment of a reassembled PDU]"
"5.293161","172.18.0.2","54.38.73.16","TCP","68","36876 → 21002 [ACK] Seq=13489 Ack=230378 Win=5596 Len=0 TSval=1096863641 TSecr=2678365090"
"5.307270","54.38.73.16","172.18.0.2","TLSv1.2","1342","Application Data, Application Data"
"5.315513","172.18.0.2","54.38.73.16","TLSv1.2","611","Application Data"
"5.378855","54.38.73.16","172.18.0.2","TCP","68","21002 → 36876 [ACK] Seq=231652 Ack=14032 Win=1452 Len=0 TSval=2678365112 TSecr=1096863663"
"5.746347","54.38.73.16","172.18.0.2","TLSv1.2","611","Application Data"
"5.747466","172.18.0.2","54.38.73.16","TLSv1.2","611","Application Data"
"5.771852","54.38.73.16","172.18.0.2","TCP","68","21002 → 36876 [ACK] Seq=232195 Ack=14575 Win=1452 Len=0 TSval=2678365210 TSecr=1096864095"
"6.032698","54.38.73.16","172.18.0.2","TLSv1.2","3695","Application Data"
"6.032880","172.18.0.2","54.38.73.16","TCP","68","36876 → 21002 [ACK] Seq=14575 Ack=235822 Win=5584 Len=0 TSval=1096864380 TSecr=2678365275"
"6.043146","54.38.73.16","172.18.0.2","TLSv1.2","4412","Application Data"
"6.043296","172.18.0.2","54.38.73.16","TCP","68","36876 → 21002 [ACK] Seq=14575 Ack=240166 Win=5580 Len=0 TSval=1096864391 TSecr=2678365277"
"6.056976","54.38.73.16","172.18.0.2","TLSv1.2","408","Application Data"
"6.099212","172.18.0.2","54.38.73.16","TCP","68","36876 → 21002 [ACK] Seq=14575 Ack=240506 Win=5612 Len=0 TSval=1096864447 TSecr=2678365281"
"6.182910","54.38.73.16","172.18.0.2","TLSv1.2","3695","Application Data"
"6.182957","172.18.0.2","54.38.73.16","TCP","68","36876 → 21002 [ACK] Seq=14575 Ack=244133 Win=5584 Len=0 TSval=1096864530 TSecr=2678365312"
"6.202969","54.38.73.16","172.18.0.2","TCP","2964","[TCP segment of a reassembled PDU]"
"6.202994","172.18.0.2","54.38.73.16","TCP","68","36876 → 21002 [ACK] Seq=14575 Ack=247029 Win=5596 Len=0 TSval=1096864550 TSecr=2678365317"
"6.206193","54.38.73.16","172.18.0.2","TLSv1.2","799","Application Data"
"6.206218","172.18.0.2","54.38.73.16","TCP","68","36876 → 21002 [ACK] Seq=14575 Ack=247760 Win=5593 Len=0 TSval=1096864554 TSecr=2678365318"
"6.211919","54.38.73.16","172.18.0.2","TLSv1.2","4412","Application Data"
"6.211944","172.18.0.2","54.38.73.16","TCP","68","36876 → 21002 [ACK] Seq=14575 Ack=252104 Win=5580 Len=0 TSval=1096864559 TSecr=2678365320"
"6.229851","54.38.73.16","172.18.0.2","TLSv1.2","922","Application Data"
"6.229916","172.18.0.2","54.38.73.16","TCP","68","36876 → 21002 [ACK] Seq=14575 Ack=252958 Win=5593 Len=0 TSval=1096864577 TSecr=2678365324"
"6.232732","54.38.73.16","172.18.0.2","TLSv1.2","4412","Application Data"
"6.232755","172.18.0.2","54.38.73.16","TCP","68","36876 → 21002 [ACK] Seq=14575 Ack=257302 Win=5580 Len=0 TSval=1096864580 TSecr=2678365325"
"6.234216","54.38.73.16","172.18.0.2","TLSv1.2","2964","Application Data [TCP segment of a reassembled PDU]"
"6.234229","172.18.0.2","54.38.73.16","TCP","68","36876 → 21002 [ACK] Seq=14575 Ack=260198 Win=5596 Len=0 TSval=1096864582 TSecr=2678365325"
"6.243404","54.38.73.16","172.18.0.2","TLSv1.2","4412","Application Data, Application Data"
"6.243417","172.18.0.2","54.38.73.16","TCP","68","36876 → 21002 [ACK] Seq=14575 Ack=264542 Win=5580 Len=0 TSval=1096864591 TSecr=2678365328"
"6.243826","172.18.0.2","54.38.73.16","TLSv1.2","611","Application Data"
"6.254694","54.38.73.16","172.18.0.2","TLSv1.2","5860","Application Data, Application Data"
"6.254719","172.18.0.2","54.38.73.16","TCP","68","36876 → 21002 [ACK] Seq=15118 Ack=270334 Win=5581 Len=0 TSval=1096864602 TSecr=2678365330"
"6.258057","54.38.73.16","172.18.0.2","TLSv1.2","2970","Application Data, Application Data"
"6.258081","172.18.0.2","54.38.73.16","TCP","68","36876 → 21002 [ACK] Seq=15118 Ack=273236 Win=5593 Len=0 TSval=1096864606 TSecr=2678365331"
"6.264997","54.38.73.16","172.18.0.2","TLSv1.2","4412","Application Data"
"6.265023","172.18.0.2","54.38.73.16","TCP","68","36876 → 21002 [ACK] Seq=15118 Ack=277580 Win=5580 Len=0 TSval=1096864612 TSecr=2678365333"
"6.268078","54.38.73.16","172.18.0.2","TCP","68","[TCP Previous segment not captured] 21002 → 36876 [ACK] Seq=280476 Ack=15118 Win=1452 Len=0 TSval=2678365334 TSecr=1096864591"
"6.268111","172.18.0.2","54.38.73.16","TLSv1.2","611","Application Data"
"6.268119","54.38.73.16","172.18.0.2","TCP","2964","[TCP Retransmission] 21002 → 36876 [ACK] Seq=277580 Ack=14575 Win=1452 Len=2896 TSval=2678365334 TSecr=1096864591"
"6.268251","172.18.0.2","54.38.73.16","TCP","68","36876 → 21002 [ACK] Seq=15661 Ack=280476 Win=5612 Len=0 TSval=1096864616 TSecr=2678365334"
"6.276601","54.38.73.16","172.18.0.2","TCP","1516","21002 → 36876 [ACK] Seq=280476 Ack=15118 Win=1452 Len=1448 TSval=2678365336 TSecr=1096864591 [TCP segment of a reassembled PDU], Application Data"
"6.279415","54.38.73.16","172.18.0.2","TCP","2964","21002 → 36876 [ACK] Seq=281924 Ack=15118 Win=1452 Len=2896 TSval=2678365337 TSecr=1096864602 [TCP segment of a reassembled PDU]"
"6.279555","172.18.0.2","54.38.73.16","TCP","68","36876 → 21002 [ACK] Seq=15661 Ack=284820 Win=5612 Len=0 TSval=1096864627 TSecr=2678365336"
"6.282563","54.38.73.16","172.18.0.2","TLSv1.2","965","Application Data, Application Data"
"6.283060","172.18.0.2","54.38.73.16","TCP","68","36876 → 21002 [ACK] Seq=15661 Ack=285717 Win=5612 Len=0 TSval=1096864630 TSecr=2678365337"
"6.286094","54.38.73.16","172.18.0.2","TLSv1.2","5860","Application Data"
"6.286238","172.18.0.2","54.38.73.16","TCP","68","36876 → 21002 [ACK] Seq=15661 Ack=291509 Win=5581 Len=0 TSval=1096864634 TSecr=2678365338"
"6.308709","54.38.73.16","172.18.0.2","TLSv1.2","299","[TCP Previous segment not captured] , Ignored Unknown Record"
"6.308744","172.18.0.2","54.38.73.16","TLSv1.2","623","Application Data"
"6.308751","54.38.73.16","172.18.0.2","TCP","4412","[TCP Out-Of-Order] 21002 → 36876 [ACK] Seq=291509 Ack=15661 Win=1452 Len=4344 TSval=2678365344 TSecr=1096864616"
"6.308786","172.18.0.2","54.38.73.16","TCP","68","36876 → 21002 [ACK] Seq=16204 Ack=296084 Win=5586 Len=0 TSval=1096864656 TSecr=2678365344"
"6.319160","54.38.73.16","172.18.0.2","TCP","2964","[TCP segment of a reassembled PDU]"
"6.319182","172.18.0.2","54.38.73.16","TCP","68","36876 → 21002 [ACK] Seq=16204 Ack=298980 Win=5596 Len=0 TSval=1096864667 TSecr=2678365346"
"6.333570","54.38.73.16","172.18.0.2","TLSv1.2","799","Application Data"
"6.340220","172.18.0.2","54.38.73.16","TLSv1.2","611","Application Data"
"6.402994","54.38.73.16","172.18.0.2","TCP","68","21002 → 36876 [ACK] Seq=299711 Ack=16747 Win=1452 Len=0 TSval=2678365368 TSecr=1096864688"
"6.872699","54.38.73.16","172.18.0.2","TLSv1.2","611","Application Data"
"6.873686","172.18.0.2","54.38.73.16","TLSv1.2","611","Application Data"
"6.897635","54.38.73.16","172.18.0.2","TCP","68","21002 → 36876 [ACK] Seq=300254 Ack=17290 Win=1452 Len=0 TSval=2678365491 TSecr=1096865221"
"7.228319","54.38.73.16","172.18.0.2","TLSv1.2","611","Application Data"
"7.271275","172.18.0.2","54.38.73.16","TCP","68","36876 → 21002 [ACK] Seq=17290 Ack=300797 Win=5612 Len=0 TSval=1096865619 TSecr=2678365574"
"7.272086","54.38.73.16","172.18.0.2","TCP","2964","[TCP segment of a reassembled PDU]"
"7.272111","172.18.0.2","54.38.73.16","TCP","68","36876 → 21002 [ACK] Seq=17290 Ack=303693 Win=5596 Len=0 TSval=1096865620 TSecr=2678365585"
"7.282855","54.38.73.16","172.18.0.2","TLSv1.2","1516","Application Data [TCP segment of a reassembled PDU]"
"7.282898","172.18.0.2","54.38.73.16","TCP","68","36876 → 21002 [ACK] Seq=17290 Ack=305141 Win=5593 Len=0 TSval=1096865630 TSecr=2678365587"
"7.283233","54.38.73.16","172.18.0.2","TCP","2964","21002 → 36876 [ACK] Seq=305141 Ack=17290 Win=1452 Len=2896 TSval=2678365587 TSecr=1096865221 [TCP segment of a reassembled PDU]"
"7.283257","172.18.0.2","54.38.73.16","TCP","68","36876 → 21002 [ACK] Seq=17290 Ack=308037 Win=5578 Len=0 TSval=1096865631 TSecr=2678365587"
"7.293489","54.38.73.16","172.18.0.2","TLSv1.2","2964","Application Data [TCP segment of a reassembled PDU]"
"7.293514","172.18.0.2","54.38.73.16","TCP","68","36876 → 21002 [ACK] Seq=17290 Ack=310933 Win=5596 Len=0 TSval=1096865641 TSecr=2678365590"
"7.296471","54.38.73.16","172.18.0.2","TLSv1.2","813","Application Data"
"7.296496","172.18.0.2","54.38.73.16","TCP","68","36876 → 21002 [ACK] Seq=17290 Ack=311678 Win=5593 Len=0 TSval=1096865644 TSecr=2678365591"
"7.326024","54.38.73.16","172.18.0.2","TLSv1.2","936","[TCP Previous segment not captured] , Ignored Unknown Record"
"7.326052","172.18.0.2","54.38.73.16","TCP","80","[TCP Dup ACK 247#1] 36876 → 21002 [ACK] Seq=17290 Ack=311678 Win=5593 Len=0 TSval=1096865673 TSecr=2678365591 SLE=323262 SRE=324130"
"7.326058","54.38.73.16","172.18.0.2","TCP","11652","[TCP Out-Of-Order] 21002 → 36876 [ACK] Seq=311678 Ack=17290 Win=1452 Len=11584 TSval=2678365598 TSecr=1096865641"
"7.326087","172.18.0.2","54.38.73.16","TCP","68","36876 → 21002 [ACK] Seq=17290 Ack=324130 Win=5535 Len=0 TSval=1096865674 TSecr=2678365598"
"7.327404","172.18.0.2","54.38.73.16","TLSv1.2","611","Application Data"
"7.338256","54.38.73.16","172.18.0.2","TCP","2964","[TCP segment of a reassembled PDU]"
"7.338281","172.18.0.2","54.38.73.16","TCP","68","36876 → 21002 [ACK] Seq=17833 Ack=327026 Win=5596 Len=0 TSval=1096865686 TSecr=2678365601"
"7.349365","54.38.73.16","172.18.0.2","TLSv1.2","2964","Application Data [TCP segment of a reassembled PDU]"
"7.349390","172.18.0.2","54.38.73.16","TCP","68","36876 → 21002 [ACK] Seq=17833 Ack=329922 Win=5596 Len=0 TSval=1096865697 TSecr=2678365604"
"7.350960","54.38.73.16","172.18.0.2","TCP","82","[TCP Previous segment not captured] 21002 → 36876 [PSH, ACK] Seq=331370 Ack=17290 Win=1452 Len=14 TSval=2678365604 TSecr=1096865674 [TCP segment of a reassembled PDU]"
"7.350991","172.18.0.2","54.38.73.16","TCP","80","[TCP Window Update] 36876 → 21002 [ACK] Seq=17833 Ack=329922 Win=5609 Len=0 TSval=1096865698 TSecr=2678365604 SLE=331370 SRE=331384"
"7.350994","54.38.73.16","172.18.0.2","TCP","1516","[TCP Out-Of-Order] 21002 → 36876 [ACK] Seq=329922 Ack=17290 Win=1452 Len=1448 TSval=2678365604 TSecr=1096865673"
"7.351023","172.18.0.2","54.38.73.16","TCP","68","36876 → 21002 [ACK] Seq=17833 Ack=331384 Win=5601 Len=0 TSval=1096865698 TSecr=2678365604"
"7.351844","54.38.73.16","172.18.0.2","TCP","68","21002 → 36876 [ACK] Seq=331384 Ack=17833 Win=1452 Len=0 TSval=2678365605 TSecr=1096865675"
"7.351870","172.18.0.2","54.38.73.16","TLSv1.2","611","Application Data"
"7.359474","54.38.73.16","172.18.0.2","TLSv1.2","7308","Application Data"
"7.359499","172.18.0.2","54.38.73.16","TCP","68","36876 → 21002 [ACK] Seq=18376 Ack=338624 Win=5565 Len=0 TSval=1096865707 TSecr=2678365607"
"7.371346","54.38.73.16","172.18.0.2","TLSv1.2","4412","Application Data [TCP segment of a reassembled PDU]"
"7.371373","172.18.0.2","54.38.73.16","TCP","68","36876 → 21002 [ACK] Seq=18376 Ack=342968 Win=5580 Len=0 TSval=1096865719 TSecr=2678365609"
"7.374893","54.38.73.16","172.18.0.2","TLSv1.2","422","Application Data, Application Data"
"7.375362","172.18.0.2","54.38.73.16","TCP","68","36876 → 21002 [ACK] Seq=18376 Ack=343322 Win=5612 Len=0 TSval=1096865723 TSecr=2678365611"
"7.382624","54.38.73.16","172.18.0.2","TCP","2964","[TCP segment of a reassembled PDU]"
"7.382805","172.18.0.2","54.38.73.16","TCP","68","36876 → 21002 [ACK] Seq=18376 Ack=346218 Win=5596 Len=0 TSval=1096865730 TSecr=2678365612"
"7.393404","54.38.73.16","172.18.0.2","TLSv1.2","2964","Application Data [TCP segment of a reassembled PDU]"
"7.393429","172.18.0.2","54.38.73.16","TCP","68","36876 → 21002 [ACK] Seq=18376 Ack=349114 Win=5596 Len=0 TSval=1096865741 TSecr=2678365615"
"7.399588","54.38.73.16","172.18.0.2","TLSv1.2","1016","Application Data"
"7.399748","172.18.0.2","54.38.73.16","TCP","68","36876 → 21002 [ACK] Seq=18376 Ack=350062 Win=5612 Len=0 TSval=1096865747 TSecr=2678365617"
"7.413614","54.38.73.16","172.18.0.2","TLSv1.2","7308","Application Data"
"7.413791","172.18.0.2","54.38.73.16","TCP","68","36876 → 21002 [ACK] Seq=18376 Ack=357302 Win=5565 Len=0 TSval=1096865761 TSecr=2678365620"
"7.414235","172.18.0.2","54.38.73.16","TLSv1.2","611","Application Data"
"7.424108","54.38.73.16","172.18.0.2","TLSv1.2","596","Application Data"
"7.424142","54.38.73.16","172.18.0.2","TLSv1.2","7308","Application Data"
"7.424159","172.18.0.2","54.38.73.16","TCP","68","36876 → 21002 [ACK] Seq=18919 Ack=365070 Win=5569 Len=0 TSval=1096865772 TSecr=2678365623"
"7.447324","54.38.73.16","172.18.0.2","TLSv1.2","2964","Application Data [TCP segment of a reassembled PDU]"
"7.447355","172.18.0.2","54.38.73.16","TCP","68","36876 → 21002 [ACK] Seq=18919 Ack=367966 Win=5596 Len=0 TSval=1096865795 TSecr=2678365628"
"7.448728","54.38.73.16","172.18.0.2","TLSv1.2","813","Application Data"
"7.457217","54.38.73.16","172.18.0.2","TCP","2964","[TCP segment of a reassembled PDU]"
"7.457242","172.18.0.2","54.38.73.16","TCP","68","36876 → 21002 [ACK] Seq=18919 Ack=371607 Win=5596 Len=0 TSval=1096865805 TSecr=2678365629"
"7.480609","54.38.73.16","172.18.0.2","TLSv1.2","4412","Application Data [TCP segment of a reassembled PDU]"
"7.480746","172.18.0.2","54.38.73.16","TCP","68","36876 → 21002 [ACK] Seq=18919 Ack=375951 Win=5580 Len=0 TSval=1096865828 TSecr=2678365637"
"7.482190","54.38.73.16","172.18.0.2","TLSv1.2","82","Application Data"
"7.482699","172.18.0.2","54.38.73.16","TLSv1.2","611","Application Data"
"7.501339","54.38.73.16","172.18.0.2","TCP","2964","[TCP segment of a reassembled PDU]"
"7.501517","172.18.0.2","54.38.73.16","TCP","68","36876 → 21002 [ACK] Seq=19462 Ack=378861 Win=5596 Len=0 TSval=1096865849 TSecr=2678365642"
"7.506629","54.38.73.16","172.18.0.2","TLSv1.2","285","Application Data"
"7.507142","172.18.0.2","54.38.73.16","TLSv1.2","611","Application Data"
"7.531909","54.38.73.16","172.18.0.2","TLSv1.2","611","Application Data"
"7.532915","172.18.0.2","54.38.73.16","TLSv1.2","611","Application Data"
"7.558744","54.38.73.16","172.18.0.2","TLSv1.2","611","Application Data"
"7.558777","172.18.0.2","54.38.73.16","TLSv1.2","611","Application Data"
"7.630905","54.38.73.16","172.18.0.2","TCP","68","21002 → 36876 [ACK] Seq=380164 Ack=21091 Win=1452 Len=0 TSval=2678365675 TSecr=1096865906"
"7.999639","54.38.73.16","172.18.0.2","TLSv1.2","611","Application Data"
"8.000643","172.18.0.2","54.38.73.16","TLSv1.2","611","Application Data"
"8.024956","54.38.73.16","172.18.0.2","TCP","68","21002 → 36876 [ACK] Seq=380707 Ack=21634 Win=1452 Len=0 TSval=2678365773 TSecr=1096866348"
"8.691834","54.38.73.16","172.18.0.2","TLSv1.2","611","Application Data"
"8.702448","54.38.73.16","172.18.0.2","TCP","2964","[TCP segment of a reassembled PDU]"
"8.702611","172.18.0.2","54.38.73.16","TCP","68","36876 → 21002 [ACK] Seq=21634 Ack=384146 Win=5596 Len=0 TSval=1096867050 TSecr=2678365940"
"8.711943","54.38.73.16","172.18.0.2","TLSv1.2","4412","Application Data [TCP segment of a reassembled PDU]"
"8.712094","172.18.0.2","54.38.73.16","TCP","68","36876 → 21002 [ACK] Seq=21634 Ack=388490 Win=5580 Len=0 TSval=1096867060 TSecr=2678365945"
"8.722418","54.38.73.16","172.18.0.2","TLSv1.2","2964","Application Data, Application Data"
"8.722441","172.18.0.2","54.38.73.16","TCP","68","36876 → 21002 [ACK] Seq=21634 Ack=391386 Win=5596 Len=0 TSval=1096867070 TSecr=2678365947"
"8.727344","54.38.73.16","172.18.0.2","TLSv1.2","1356","Application Data"
"8.744052","54.38.73.16","172.18.0.2","TLSv1.2","8756","Application Data, Application Data"
"8.744220","172.18.0.2","54.38.73.16","TCP","68","36876 → 21002 [ACK] Seq=21634 Ack=401362 Win=5566 Len=0 TSval=1096867092 TSecr=2678365949"
"8.754149","54.38.73.16","172.18.0.2","TLSv1.2","4412","Application Data [TCP segment of a reassembled PDU]"
"8.754175","172.18.0.2","54.38.73.16","TCP","68","36876 → 21002 [ACK] Seq=21634 Ack=405706 Win=5580 Len=0 TSval=1096867102 TSecr=2678365955"
"8.754339","54.38.73.16","172.18.0.2","TLSv1.2","1516","Application Data [TCP segment of a reassembled PDU]"
"8.766583","54.38.73.16","172.18.0.2","TLSv1.2","2964","Application Data [TCP segment of a reassembled PDU]"
"8.766611","172.18.0.2","54.38.73.16","TCP","68","36876 → 21002 [ACK] Seq=21634 Ack=410050 Win=5596 Len=0 TSval=1096867114 TSecr=2678365955"
"8.767014","172.18.0.2","54.38.73.16","TLSv1.2","611","Application Data"
"8.769101","54.38.73.16","172.18.0.2","TLSv1.2","2427","Application Data, Application Data"
"8.769126","172.18.0.2","54.38.73.16","TCP","68","36876 → 21002 [ACK] Seq=22177 Ack=412409 Win=5598 Len=0 TSval=1096867117 TSecr=2678365959"
"8.786312","54.38.73.16","172.18.0.2","TLSv1.2","7308","Application Data"
"8.786492","172.18.0.2","54.38.73.16","TCP","68","36876 → 21002 [ACK] Seq=22177 Ack=419649 Win=5565 Len=0 TSval=1096867134 TSecr=2678365963"
"8.790314","54.38.73.16","172.18.0.2","TCP","68","21002 → 36876 [ACK] Seq=419649 Ack=22177 Win=1452 Len=0 TSval=2678365964 TSecr=1096867114"
"8.793036","54.38.73.16","172.18.0.2","TLSv1.2","596","Application Data"
"8.797818","54.38.73.16","172.18.0.2","TCP","2964","[TCP segment of a reassembled PDU]"
"8.797843","172.18.0.2","54.38.73.16","TCP","68","36876 → 21002 [ACK] Seq=22177 Ack=423073 Win=5596 Len=0 TSval=1096867145 TSecr=2678365965"
"8.808772","54.38.73.16","172.18.0.2","TLSv1.2","4412","Application Data, Application Data"
"8.808908","172.18.0.2","54.38.73.16","TCP","68","36876 → 21002 [ACK] Seq=22177 Ack=427417 Win=5580 Len=0 TSval=1096867156 TSecr=2678365969"
"8.818112","54.38.73.16","172.18.0.2","TLSv1.2","2964","Application Data [TCP segment of a reassembled PDU]"
"8.818137","172.18.0.2","54.38.73.16","TCP","68","36876 → 21002 [ACK] Seq=22177 Ack=430313 Win=5596 Len=0 TSval=1096867166 TSecr=2678365971"
"8.818667","172.18.0.2","54.38.73.16","TLSv1.2","611","Application Data"
"8.821355","54.38.73.16","172.18.0.2","TLSv1.2","1356","Application Data"
"8.850712","54.38.73.16","172.18.0.2","TCP","1516","[TCP segment of a reassembled PDU]"
"8.850896","172.18.0.2","54.38.73.16","TCP","68","36876 → 21002 [ACK] Seq=22720 Ack=433049 Win=5593 Len=0 TSval=1096867198 TSecr=2678365972"
"8.874613","54.38.73.16","172.18.0.2","TLSv1.2","705","Application Data"
"8.875060","172.18.0.2","54.38.73.16","TLSv1.2","611","Application Data"
"8.882543","54.38.73.16","172.18.0.2","TCP","1516","[TCP segment of a reassembled PDU]"
"8.892940","54.38.73.16","172.18.0.2","TLSv1.2","4412","Application Data [TCP segment of a reassembled PDU]"
"8.893109","172.18.0.2","54.38.73.16","TCP","68","36876 → 21002 [ACK] Seq=23263 Ack=439478 Win=5580 Len=0 TSval=1096867241 TSecr=2678365987"
"8.903019","54.38.73.16","172.18.0.2","TLSv1.2","502","Application Data"
"8.903646","54.38.73.16","172.18.0.2","TCP","2964","[TCP segment of a reassembled PDU]"
"8.903666","172.18.0.2","54.38.73.16","TCP","68","36876 → 21002 [ACK] Seq=23263 Ack=442808 Win=5596 Len=0 TSval=1096867251 TSecr=2678365993"
"8.928065","54.38.73.16","172.18.0.2","TLSv1.2","1342","Application Data, Application Data"
"8.936480","54.38.73.16","172.18.0.2","TCP","1516","[TCP segment of a reassembled PDU]"
"8.936652","172.18.0.2","54.38.73.16","TCP","68","36876 → 21002 [ACK] Seq=23263 Ack=445530 Win=5593 Len=0 TSval=1096867284 TSecr=2678365999"
"8.961369","54.38.73.16","172.18.0.2","TLSv1.2","705","Application Data"
"8.971486","172.18.0.2","54.38.73.16","TLSv1.2","611","Application Data"
"9.036482","54.38.73.16","172.18.0.2","TCP","68","21002 → 36876 [ACK] Seq=446167 Ack=23806 Win=1452 Len=0 TSval=2678366026 TSecr=1096867319"
"9.432775","54.38.73.16","172.18.0.2","TLSv1.2","611","Application Data"
"9.433777","172.18.0.2","54.38.73.16","TLSv1.2","611","Application Data"
"9.457167","54.38.73.16","172.18.0.2","TCP","68","21002 → 36876 [ACK] Seq=446710 Ack=24349 Win=1452 Len=0 TSval=2678366131 TSecr=1096867781"
"9.842864","54.38.73.16","172.18.0.2","TLSv1.2","4145","Application Data"
"9.842896","54.38.73.16","172.18.0.2","TCP","2964","[TCP segment of a reassembled PDU]"
"9.842903","54.38.73.16","172.18.0.2","TLSv1.2","1516","Application Data [TCP segment of a reassembled PDU]"
"9.843040","172.18.0.2","54.38.73.16","TCP","68","36876 → 21002 [ACK] Seq=24349 Ack=455131 Win=5548 Len=0 TSval=1096868190 TSecr=2678366218"
"9.843982","54.38.73.16","172.18.0.2","TLSv1.2","2964","Application Data [TCP segment of a reassembled PDU]"
"9.844002","172.18.0.2","54.38.73.16","TCP","68","36876 → 21002 [ACK] Seq=24349 Ack=458027 Win=5596 Len=0 TSval=1096868191 TSecr=2678366228"
"9.867341","54.38.73.16","172.18.0.2","TLSv1.2","1203","Application Data"
"9.885622","54.38.73.16","172.18.0.2","TCP","2964","[TCP segment of a reassembled PDU]"
"9.885646","172.18.0.2","54.38.73.16","TCP","68","36876 → 21002 [ACK] Seq=24349 Ack=462058 Win=5596 Len=0 TSval=1096868233 TSecr=2678366234"
"9.907337","54.38.73.16","172.18.0.2","TLSv1.2","4412","Application Data [TCP segment of a reassembled PDU]"
"9.907512","172.18.0.2","54.38.73.16","TCP","68","36876 → 21002 [ACK] Seq=24349 Ack=466402 Win=5580 Len=0 TSval=1096868255 TSecr=2678366244"
"9.909444","54.38.73.16","172.18.0.2","TLSv1.2","82","Application Data"
"9.917011","172.18.0.2","54.38.73.16","TLSv1.2","611","Application Data"
"9.940600","54.38.73.16","172.18.0.2","TCP","68","21002 → 36876 [ACK] Seq=466416 Ack=24892 Win=1452 Len=0 TSval=2678366252 TSecr=1096868264"
"10.559841","54.38.73.16","172.18.0.2","TLSv1.2","611","Application Data"
"10.560822","172.18.0.2","54.38.73.16","TLSv1.2","611","Application Data"
"10.584535","54.38.73.16","172.18.0.2","TCP","68","21002 → 36876 [ACK] Seq=466959 Ack=25435 Win=1452 Len=0 TSval=2678366413 TSecr=1096868908"
"11.274558","54.38.73.16","172.18.0.2","TLSv1.2","611","Application Data"
"11.274938","54.38.73.16","172.18.0.2","TCP","2964","[TCP segment of a reassembled PDU]"
"11.275042","172.18.0.2","54.38.73.16","TCP","68","36876 → 21002 [ACK] Seq=25435 Ack=470398 Win=5596 Len=0 TSval=1096869622 TSecr=2678366570"
"11.299499","54.38.73.16","172.18.0.2","TLSv1.2","285","Application Data"
"11.306683","172.18.0.2","54.38.73.16","TLSv1.2","611","Application Data"
"11.331265","54.38.73.16","172.18.0.2","TCP","68","21002 → 36876 [ACK] Seq=470615 Ack=25978 Win=1452 Len=0 TSval=2678366600 TSecr=1096869654"
"11.892661","54.38.73.16","172.18.0.2","TLSv1.2","611","Application Data"
"11.893702","172.18.0.2","54.38.73.16","TLSv1.2","611","Application Data"
"11.917636","54.38.73.16","172.18.0.2","TCP","68","21002 → 36876 [ACK] Seq=471158 Ack=26521 Win=1452 Len=0 TSval=2678366746 TSecr=1096870241"
