_ws.col.Time,_ws.col.Source,_ws.col.Destination,_ws.col.Protocol,_ws.col.Length,_ws.col.Info
"0.000000","172.19.0.3","5.9.29.183","TLSv1.2","599","Application Data"
"0.000286","5.9.29.183","172.19.0.3","TCP","56","9002 → 43520 [ACK] Seq=1 Ack=544 Win=65535 Len=0"
"0.790788","5.9.29.183","172.19.0.3","TLSv1.2","599","Application Data"
"0.791925","172.19.0.3","5.9.29.183","TLSv1.2","2141","Application Data"
"0.792327","5.9.29.183","172.19.0.3","TCP","56","9002 → 43520 [ACK] Seq=544 Ack=2629 Win=65535 Len=0"
"1.301375","5.9.29.183","172.19.0.3","TLSv1.2","599","Application Data"
"1.344233","172.19.0.3","5.9.29.183","TCP","56","43520 → 9002 [ACK] Seq=2629 Ack=1087 Win=12738 Len=0"
"1.396253","5.9.29.183","172.19.0.3","TCP","1516","[TCP segment of a reassembled PDU]"
"1.396276","172.19.0.3","5.9.29.183","TCP","56","43520 → 9002 [ACK] Seq=2629 Ack=2547 Win=12738 Len=0"
"1.396339","5.9.29.183","172.19.0.3","TLSv1.2","167","Application Data"
"1.396363","172.19.0.3","5.9.29.183","TCP","56","43520 → 9002 [ACK] Seq=2629 Ack=2658 Win=12738 Len=0"
"1.400588","172.19.0.3","5.9.29.183","TLSv1.2","599","Application Data"
"1.400844","5.9.29.183","172.19.0.3","TCP","56","9002 → 43520 [ACK] Seq=2658 Ack=3172 Win=65535 Len=0"
"1.672469","5.9.29.183","172.19.0.3","TLSv1.2","599","Application Data"
"1.673290","172.19.0.3","5.9.29.183","TLSv1.2","599","Application Data"
"1.673712","5.9.29.183","172.19.0.3","TCP","56","9002 → 43520 [ACK] Seq=3201 Ack=3715 Win=65535 Len=0"
"1.976092","5.9.29.183","172.19.0.3","TCP","1516","[TCP segment of a reassembled PDU]"
"1.976180","5.9.29.183","172.19.0.3","TCP","1492","9002 → 43520 [PSH, ACK] Seq=4661 Ack=3715 Win=65535 Len=1436 [TCP segment of a reassembled PDU]"
"1.976191","5.9.29.183","172.19.0.3","TLSv1.2","787","Application Data"
"1.976358","172.19.0.3","5.9.29.183","TCP","56","43520 → 9002 [ACK] Seq=3715 Ack=6828 Win=12722 Len=0"
"1.986568","5.9.29.183","172.19.0.3","TCP","1516","[TCP segment of a reassembled PDU]"
"1.986631","5.9.29.183","172.19.0.3","TCP","1492","9002 → 43520 [PSH, ACK] Seq=8288 Ack=3715 Win=65535 Len=1436 [TCP segment of a reassembled PDU]"
"1.986648","172.19.0.3","5.9.29.183","TCP","56","43520 → 9002 [ACK] Seq=3715 Ack=9724 Win=12730 Len=0"
"1.986652","5.9.29.183","172.19.0.3","TLSv1.2","1516","Application Data [TCP segment of a reassembled PDU]"
"1.986656","5.9.29.183","172.19.0.3","TCP","1492","9002 → 43520 [PSH, ACK] Seq=11184 Ack=3715 Win=65535 Len=1436 [TCP segment of a reassembled PDU]"
"1.986829","172.19.0.3","5.9.29.183","TCP","56","43520 → 9002 [ACK] Seq=3715 Ack=12620 Win=12714 Len=0"
"1.991459","5.9.29.183","172.19.0.3","TCP","1516","9002 → 43520 [PSH, ACK] Seq=12620 Ack=3715 Win=65535 Len=1460 [TCP segment of a reassembled PDU]"
"1.991524","5.9.29.183","172.19.0.3","TLSv1.2","572","Application Data"
"1.991542","172.19.0.3","5.9.29.183","TCP","56","43520 → 9002 [ACK] Seq=3715 Ack=14596 Win=12730 Len=0"
"2.033473","5.9.29.183","172.19.0.3","TCP","1516","[TCP segment of a reassembled PDU]"
"2.033536","5.9.29.183","172.19.0.3","TCP","1492","9002 → 43520 [PSH, ACK] Seq=16056 Ack=3715 Win=65535 Len=1436 [TCP segment of a reassembled PDU]"
"2.033557","172.19.0.3","5.9.29.183","TCP","56","43520 → 9002 [ACK] Seq=3715 Ack=17492 Win=12730 Len=0"
"2.033766","5.9.29.183","172.19.0.3","TLSv1.2","1237","Application Data"
"2.044254","5.9.29.183","172.19.0.3","TLSv1.2","1516","Application Data"
"2.044278","172.19.0.3","5.9.29.183","TCP","56","43520 → 9002 [ACK] Seq=3715 Ack=20133 Win=12738 Len=0"
"2.044335","5.9.29.183","172.19.0.3","TCP","1492","9002 → 43520 [PSH, ACK] Seq=20133 Ack=3715 Win=65535 Len=1436 [TCP segment of a reassembled PDU]"
"2.049366","5.9.29.183","172.19.0.3","TLSv1.2","1394","Application Data"
"2.049391","172.19.0.3","5.9.29.183","TCP","56","43520 → 9002 [ACK] Seq=3715 Ack=22907 Win=12738 Len=0"
"2.054350","5.9.29.183","172.19.0.3","TCP","1504","[TCP segment of a reassembled PDU]"
"2.054666","5.9.29.183","172.19.0.3","TCP","1516","9002 → 43520 [PSH, ACK] Seq=24355 Ack=3715 Win=65535 Len=1460 [TCP segment of a reassembled PDU]"
"2.054684","172.19.0.3","5.9.29.183","TCP","56","43520 → 9002 [ACK] Seq=3715 Ack=25815 Win=12738 Len=0"
"2.054728","5.9.29.183","172.19.0.3","TLSv1.2","1516","Application Data [TCP segment of a reassembled PDU]"
"2.054737","5.9.29.183","172.19.0.3","TCP","1516","9002 → 43520 [PSH, ACK] Seq=27275 Ack=3715 Win=65535 Len=1460 [TCP segment of a reassembled PDU]"
"2.054741","5.9.29.183","172.19.0.3","TCP","1468","9002 → 43520 [PSH, ACK] Seq=28735 Ack=3715 Win=65535 Len=1412 [TCP segment of a reassembled PDU]"
"2.054850","172.19.0.3","5.9.29.183","TCP","56","43520 → 9002 [ACK] Seq=3715 Ack=30147 Win=12712 Len=0"
"2.064780","5.9.29.183","172.19.0.3","TLSv1.2","1516","Application Data [TCP segment of a reassembled PDU]"
"2.064857","5.9.29.183","172.19.0.3","TCP","1492","9002 → 43520 [PSH, ACK] Seq=31607 Ack=3715 Win=65535 Len=1436 [TCP segment of a reassembled PDU]"
"2.064878","172.19.0.3","5.9.29.183","TCP","56","43520 → 9002 [ACK] Seq=3715 Ack=33043 Win=12730 Len=0"
"2.064881","5.9.29.183","172.19.0.3","TCP","1504","9002 → 43520 [PSH, ACK] Seq=33043 Ack=3715 Win=65535 Len=1448 [TCP segment of a reassembled PDU]"
"2.065209","172.19.0.3","5.9.29.183","TLSv1.2","599","Application Data"
"2.065563","5.9.29.183","172.19.0.3","TCP","56","9002 → 43520 [ACK] Seq=34491 Ack=4258 Win=65535 Len=0"
"2.080424","5.9.29.183","172.19.0.3","TLSv1.2","1504","Application Data, Application Data"
"2.080807","5.9.29.183","172.19.0.3","TCP","1516","9002 → 43520 [PSH, ACK] Seq=35939 Ack=4258 Win=65535 Len=1460 [TCP segment of a reassembled PDU]"
"2.080832","172.19.0.3","5.9.29.183","TCP","56","43520 → 9002 [ACK] Seq=4258 Ack=37399 Win=12730 Len=0"
"2.080837","5.9.29.183","172.19.0.3","TCP","1492","9002 → 43520 [PSH, ACK] Seq=37399 Ack=4258 Win=65535 Len=1436 [TCP segment of a reassembled PDU]"
"2.080913","5.9.29.183","172.19.0.3","TLSv1.2","859","Application Data [TCP segment of a reassembled PDU]"
"2.080920","5.9.29.183","172.19.0.3","TLSv1.2","461","Application Data"
"2.080963","172.19.0.3","5.9.29.183","TCP","56","43520 → 9002 [ACK] Seq=4258 Ack=40043 Win=12710 Len=0"
"2.106879","5.9.29.183","172.19.0.3","TCP","1516","[TCP segment of a reassembled PDU]"
"2.106955","5.9.29.183","172.19.0.3","TCP","1516","9002 → 43520 [PSH, ACK] Seq=41503 Ack=4258 Win=65535 Len=1460 [TCP segment of a reassembled PDU]"
"2.106972","172.19.0.3","5.9.29.183","TCP","56","43520 → 9002 [ACK] Seq=4258 Ack=42963 Win=12730 Len=0"
"2.106975","5.9.29.183","172.19.0.3","TLSv1.2","763","Application Data"
"2.132120","5.9.29.183","172.19.0.3","TCP","1516","[TCP segment of a reassembled PDU]"
"2.132142","172.19.0.3","5.9.29.183","TCP","56","43520 → 9002 [ACK] Seq=4258 Ack=45130 Win=12738 Len=0"
"2.132194","5.9.29.183","172.19.0.3","TCP","1492","9002 → 43520 [PSH, ACK] Seq=45130 Ack=4258 Win=65535 Len=1436 [TCP segment of a reassembled PDU]"
"2.132416","5.9.29.183","172.19.0.3","TLSv1.2","1237","Application Data"
"2.132426","172.19.0.3","5.9.29.183","TCP","56","43520 → 9002 [ACK] Seq=4258 Ack=47747 Win=12738 Len=0"
"2.141660","5.9.29.183","172.19.0.3","TLSv1.2","1504","Application Data"
"2.141808","5.9.29.183","172.19.0.3","TCP","1504","9002 → 43520 [PSH, ACK] Seq=49195 Ack=4258 Win=65535 Len=1448 [TCP segment of a reassembled PDU]"
"2.141916","172.19.0.3","5.9.29.183","TCP","56","43520 → 9002 [ACK] Seq=4258 Ack=50643 Win=12730 Len=0"
"2.147863","5.9.29.183","172.19.0.3","TLSv1.2","1423","Application Data, Application Data"
"2.192020","172.19.0.3","5.9.29.183","TCP","56","43520 → 9002 [ACK] Seq=4258 Ack=52010 Win=12738 Len=0"
"2.202924","5.9.29.183","172.19.0.3","TCP","1504","[TCP segment of a reassembled PDU]"
"2.202966","5.9.29.183","172.19.0.3","TLSv1.2","693","Application Data"
"2.203029","172.19.0.3","5.9.29.183","TCP","56","43520 → 9002 [ACK] Seq=4258 Ack=54095 Win=12730 Len=0"
"2.203353","172.19.0.3","5.9.29.183","TLSv1.2","599","Application Data"
"2.203563","5.9.29.183","172.19.0.3","TCP","56","9002 → 43520 [ACK] Seq=54095 Ack=4801 Win=65535 Len=0"
"2.942571","5.9.29.183","172.19.0.3","TCP","1516","[TCP segment of a reassembled PDU]"
"2.942633","5.9.29.183","172.19.0.3","TLSv1.2","167","Application Data"
"2.942769","172.19.0.3","5.9.29.183","TCP","56","43520 → 9002 [ACK] Seq=4801 Ack=55666 Win=12730 Len=0"
"2.943044","5.9.29.183","172.19.0.3","TCP","1516","[TCP segment of a reassembled PDU]"
"2.943058","5.9.29.183","172.19.0.3","TLSv1.2","681","Application Data"
"2.943093","172.19.0.3","5.9.29.183","TLSv1.2","599","Application Data"
"2.943218","5.9.29.183","172.19.0.3","TCP","1516","[TCP segment of a reassembled PDU]"
"2.943229","172.19.0.3","5.9.29.183","TCP","56","43520 → 9002 [ACK] Seq=5344 Ack=59211 Win=12738 Len=0"
"2.943232","5.9.29.183","172.19.0.3","TLSv1.2","681","Application Data"
"2.943403","5.9.29.183","172.19.0.3","TCP","56","9002 → 43520 [ACK] Seq=59836 Ack=5344 Win=65535 Len=0"
"2.967201","5.9.29.183","172.19.0.3","TCP","1516","[TCP segment of a reassembled PDU]"
"2.967227","172.19.0.3","5.9.29.183","TCP","56","43520 → 9002 [ACK] Seq=5344 Ack=61296 Win=12738 Len=0"
"2.967289","5.9.29.183","172.19.0.3","TLSv1.2","681","Application Data"
"3.010606","172.19.0.3","5.9.29.183","TCP","56","43520 → 9002 [ACK] Seq=5344 Ack=61921 Win=12738 Len=0"
"3.557728","5.9.29.183","172.19.0.3","TCP","1516","[TCP segment of a reassembled PDU]"
"3.557880","172.19.0.3","5.9.29.183","TCP","56","43520 → 9002 [ACK] Seq=5344 Ack=63381 Win=12738 Len=0"
"3.557885","5.9.29.183","172.19.0.3","TLSv1.2","681","Application Data"
"3.557901","172.19.0.3","5.9.29.183","TCP","56","43520 → 9002 [ACK] Seq=5344 Ack=64006 Win=12734 Len=0"
"3.562685","172.19.0.3","5.9.29.183","TLSv1.2","599","Application Data"
"3.563003","5.9.29.183","172.19.0.3","TCP","56","9002 → 43520 [ACK] Seq=64006 Ack=5887 Win=65535 Len=0"
"4.219790","5.9.29.183","172.19.0.3","TLSv1.2","599","Application Data"
"4.220851","172.19.0.3","5.9.29.183","TLSv1.2","599","Application Data"
"4.221334","5.9.29.183","172.19.0.3","TCP","56","9002 → 43520 [ACK] Seq=64549 Ack=6430 Win=65535 Len=0"
"4.498664","5.9.29.183","172.19.0.3","TLSv1.2","599","Application Data"
"4.548987","172.19.0.3","5.9.29.183","TCP","56","43520 → 9002 [ACK] Seq=6430 Ack=65092 Win=12738 Len=0"
"4.569042","5.9.29.183","172.19.0.3","TCP","1516","[TCP segment of a reassembled PDU]"
"4.569068","172.19.0.3","5.9.29.183","TCP","56","43520 → 9002 [ACK] Seq=6430 Ack=66552 Win=12738 Len=0"
"4.569128","5.9.29.183","172.19.0.3","TCP","1492","9002 → 43520 [PSH, ACK] Seq=66552 Ack=6430 Win=65535 Len=1436 [TCP segment of a reassembled PDU]"
"4.569146","172.19.0.3","5.9.29.183","TCP","56","43520 → 9002 [ACK] Seq=6430 Ack=67988 Win=12730 Len=0"
"4.569148","5.9.29.183","172.19.0.3","TLSv1.2","1504","Application Data [TCP segment of a reassembled PDU]"
"4.569154","172.19.0.3","5.9.29.183","TCP","56","43520 → 9002 [ACK] Seq=6430 Ack=69436 Win=12722 Len=0"
"4.584744","5.9.29.183","172.19.0.3","TCP","1516","9002 → 43520 [PSH, ACK] Seq=69436 Ack=6430 Win=65535 Len=1460 [TCP segment of a reassembled PDU]"
"4.584766","172.19.0.3","5.9.29.183","TCP","56","43520 → 9002 [ACK] Seq=6430 Ack=70896 Win=12738 Len=0"
"4.584815","5.9.29.183","172.19.0.3","TCP","1492","9002 → 43520 [PSH, ACK] Seq=70896 Ack=6430 Win=65535 Len=1436 [TCP segment of a reassembled PDU]"
"4.584827","172.19.0.3","5.9.29.183","TCP","56","43520 → 9002 [ACK] Seq=6430 Ack=72332 Win=12730 Len=0"
"4.600334","5.9.29.183","172.19.0.3","TLSv1.2","1516","Application Data, Application Data"
"4.600360","172.19.0.3","5.9.29.183","TCP","56","43520 → 9002 [ACK] Seq=6430 Ack=73792 Win=12738 Len=0"
"4.600418","5.9.29.183","172.19.0.3","TCP","1516","9002 → 43520 [PSH, ACK] Seq=73792 Ack=6430 Win=65535 Len=1460 [TCP segment of a reassembled PDU]"
"4.600437","172.19.0.3","5.9.29.183","TCP","56","43520 → 9002 [ACK] Seq=6430 Ack=75252 Win=12730 Len=0"
"4.600442","5.9.29.183","172.19.0.3","TLSv1.2","1320","Application Data"
"4.600449","172.19.0.3","5.9.29.183","TCP","56","43520 → 9002 [ACK] Seq=6430 Ack=76516 Win=12722 Len=0"
"4.618514","5.9.29.183","172.19.0.3","TCP","1516","[TCP segment of a reassembled PDU]"
"4.618537","172.19.0.3","5.9.29.183","TCP","56","43520 → 9002 [ACK] Seq=6430 Ack=77976 Win=12738 Len=0"
"4.618613","5.9.29.183","172.19.0.3","TCP","1492","9002 → 43520 [PSH, ACK] Seq=77976 Ack=6430 Win=65535 Len=1436 [TCP segment of a reassembled PDU]"
"4.618626","172.19.0.3","5.9.29.183","TCP","56","43520 → 9002 [ACK] Seq=6430 Ack=79412 Win=12730 Len=0"
"4.618703","5.9.29.183","172.19.0.3","TLSv1.2","787","Application Data"
"4.618728","172.19.0.3","5.9.29.183","TCP","56","43520 → 9002 [ACK] Seq=6430 Ack=80143 Win=12725 Len=0"
"4.634080","5.9.29.183","172.19.0.3","TLSv1.2","599","Application Data"
"4.634102","172.19.0.3","5.9.29.183","TCP","56","43520 → 9002 [ACK] Seq=6430 Ack=80686 Win=12738 Len=0"
"4.642898","5.9.29.183","172.19.0.3","TCP","1516","[TCP segment of a reassembled PDU]"
"4.642921","172.19.0.3","5.9.29.183","TCP","56","43520 → 9002 [ACK] Seq=6430 Ack=82146 Win=12736 Len=0"
"4.642979","5.9.29.183","172.19.0.3","TCP","1492","9002 → 43520 [PSH, ACK] Seq=82146 Ack=6430 Win=65535 Len=1436 [TCP segment of a reassembled PDU]"
"4.642998","172.19.0.3","5.9.29.183","TCP","56","43520 → 9002 [ACK] Seq=6430 Ack=83582 Win=12728 Len=0"
"4.649430","5.9.29.183","172.19.0.3","TLSv1.2","787","Application Data"
"4.649456","172.19.0.3","5.9.29.183","TCP","56","43520 → 9002 [ACK] Seq=6430 Ack=84313 Win=12738 Len=0"
"4.664592","5.9.29.183","172.19.0.3","TLSv1.2","599","Application Data"
"4.664757","5.9.29.183","172.19.0.3","TCP","1504","[TCP segment of a reassembled PDU]"
"4.664838","172.19.0.3","5.9.29.183","TCP","56","43520 → 9002 [ACK] Seq=6430 Ack=86304 Win=12730 Len=0"
"4.664972","5.9.29.183","172.19.0.3","TCP","1504","9002 → 43520 [PSH, ACK] Seq=86304 Ack=6430 Win=65535 Len=1448 [TCP segment of a reassembled PDU]"
"4.664982","5.9.29.183","172.19.0.3","TLSv1.2","1504","Application Data [TCP segment of a reassembled PDU]"
"4.664999","172.19.0.3","5.9.29.183","TCP","56","43520 → 9002 [ACK] Seq=6430 Ack=89200 Win=12714 Len=0"
"4.680252","5.9.29.183","172.19.0.3","TLSv1.2","396","Application Data"
"4.680494","172.19.0.3","5.9.29.183","TCP","56","43520 → 9002 [ACK] Seq=6430 Ack=89540 Win=12738 Len=0"
"4.827005","5.9.29.183","172.19.0.3","TCP","1516","[TCP segment of a reassembled PDU]"
"4.827084","5.9.29.183","172.19.0.3","TLSv1.2","167","Application Data"
"4.827263","172.19.0.3","5.9.29.183","TCP","56","43520 → 9002 [ACK] Seq=6430 Ack=91111 Win=12730 Len=0"
"4.827662","172.19.0.3","5.9.29.183","TLSv1.2","599","Application Data"
"4.828013","5.9.29.183","172.19.0.3","TCP","56","9002 → 43520 [ACK] Seq=91111 Ack=6973 Win=65535 Len=0"
"4.836096","172.19.0.3","5.9.29.183","TLSv1.2","599","Application Data"
"4.836299","5.9.29.183","172.19.0.3","TCP","56","9002 → 43520 [ACK] Seq=91111 Ack=7516 Win=65535 Len=0"
"5.183372","5.9.29.183","172.19.0.3","TLSv1.2","599","Application Data"
"5.184445","172.19.0.3","5.9.29.183","TLSv1.2","599","Application Data"
"5.184808","5.9.29.183","172.19.0.3","TCP","56","9002 → 43520 [ACK] Seq=91654 Ack=8059 Win=65535 Len=0"
"5.487590","5.9.29.183","172.19.0.3","TCP","1516","[TCP segment of a reassembled PDU]"
"5.487685","5.9.29.183","172.19.0.3","TCP","1492","9002 → 43520 [PSH, ACK] Seq=93114 Ack=8059 Win=65535 Len=1436 [TCP segment of a reassembled PDU]"
"5.487715","5.9.29.183","172.19.0.3","TLSv1.2","273","Application Data"
"5.487846","172.19.0.3","5.9.29.183","TCP","56","43520 → 9002 [ACK] Seq=8059 Ack=94767 Win=12722 Len=0"
"5.498639","5.9.29.183","172.19.0.3","TCP","1504","[TCP segment of a reassembled PDU]"
"5.502478","5.9.29.183","172.19.0.3","TCP","1504","9002 → 43520 [PSH, ACK] Seq=96215 Ack=8059 Win=65535 Len=1448 [TCP segment of a reassembled PDU]"
"5.502490","172.19.0.3","5.9.29.183","TCP","56","43520 → 9002 [ACK] Seq=8059 Ack=97663 Win=12738 Len=0"
"5.502585","5.9.29.183","172.19.0.3","TLSv1.2","787","Application Data"
"5.510919","5.9.29.183","172.19.0.3","TCP","1516","[TCP segment of a reassembled PDU]"
"5.510936","172.19.0.3","5.9.29.183","TCP","56","43520 → 9002 [ACK] Seq=8059 Ack=99854 Win=12738 Len=0"
"5.510971","5.9.29.183","172.19.0.3","TCP","1492","9002 → 43520 [PSH, ACK] Seq=99854 Ack=8059 Win=65535 Len=1436 [TCP segment of a reassembled PDU]"
"5.518429","5.9.29.183","172.19.0.3","TLSv1.2","1330","Application Data, Application Data"
"5.518455","172.19.0.3","5.9.29.183","TCP","56","43520 → 9002 [ACK] Seq=8059 Ack=102564 Win=12738 Len=0"
"5.547477","5.9.29.183","172.19.0.3","TCP","1516","[TCP segment of a reassembled PDU]"
"5.547551","5.9.29.183","172.19.0.3","TCP","1206","9002 → 43520 [PSH, ACK] Seq=104024 Ack=8059 Win=65535 Len=1150 [TCP segment of a reassembled PDU]"
"5.547558","5.9.29.183","172.19.0.3","TCP","342","9002 → 43520 [PSH, ACK] Seq=105174 Ack=8059 Win=65535 Len=286 [TCP segment of a reassembled PDU]"
"5.547573","5.9.29.183","172.19.0.3","TLSv1.2","787","Application Data"
"5.547634","172.19.0.3","5.9.29.183","TCP","56","43520 → 9002 [ACK] Seq=8059 Ack=106191 Win=12712 Len=0"
"5.557426","5.9.29.183","172.19.0.3","TCP","1504","[TCP segment of a reassembled PDU]"
"5.557524","5.9.29.183","172.19.0.3","TCP","1504","9002 → 43520 [PSH, ACK] Seq=107639 Ack=8059 Win=65535 Len=1448 [TCP segment of a reassembled PDU]"
"5.557534","172.19.0.3","5.9.29.183","TCP","56","43520 → 9002 [ACK] Seq=8059 Ack=109087 Win=12730 Len=0"
"5.564811","5.9.29.183","172.19.0.3","TLSv1.2","1504","Application Data [TCP segment of a reassembled PDU]"
"5.565019","5.9.29.183","172.19.0.3","TLSv1.2","1516","Application Data [TCP segment of a reassembled PDU]"
"5.565035","172.19.0.3","5.9.29.183","TCP","56","43520 → 9002 [ACK] Seq=8059 Ack=111995 Win=12730 Len=0"
"5.565038","5.9.29.183","172.19.0.3","TCP","1516","9002 → 43520 [PSH, ACK] Seq=111995 Ack=8059 Win=65535 Len=1460 [TCP segment of a reassembled PDU]"
"5.565043","5.9.29.183","172.19.0.3","TCP","1480","9002 → 43520 [PSH, ACK] Seq=113455 Ack=8059 Win=65535 Len=1424 [TCP segment of a reassembled PDU]"
"5.565117","172.19.0.3","5.9.29.183","TCP","56","43520 → 9002 [ACK] Seq=8059 Ack=114879 Win=12714 Len=0"
"5.565391","172.19.0.3","5.9.29.183","TLSv1.2","599","Application Data"
"5.565697","5.9.29.183","172.19.0.3","TCP","56","9002 → 43520 [ACK] Seq=114879 Ack=8602 Win=65535 Len=0"
"5.581376","5.9.29.183","172.19.0.3","TLSv1.2","1279","Application Data, Application Data, Application Data"
"5.581466","5.9.29.183","172.19.0.3","TCP","1516","[TCP segment of a reassembled PDU]"
"5.581484","172.19.0.3","5.9.29.183","TCP","56","43520 → 9002 [ACK] Seq=8602 Ack=117562 Win=12730 Len=0"
"5.581566","5.9.29.183","172.19.0.3","TCP","1516","9002 → 43520 [PSH, ACK] Seq=117562 Ack=8602 Win=65535 Len=1460 [TCP segment of a reassembled PDU]"
"5.581572","5.9.29.183","172.19.0.3","TLSv1.2","1516","Application Data [TCP segment of a reassembled PDU]"
"5.581575","5.9.29.183","172.19.0.3","TCP","1468","9002 → 43520 [PSH, ACK] Seq=120482 Ack=8602 Win=65535 Len=1412 [TCP segment of a reassembled PDU]"
"5.581605","172.19.0.3","5.9.29.183","TCP","56","43520 → 9002 [ACK] Seq=8602 Ack=121894 Win=12706 Len=0"
"5.582284","172.19.0.3","5.9.29.183","TLSv1.2","599","Application Data"
"5.582528","5.9.29.183","172.19.0.3","TCP","56","9002 → 43520 [ACK] Seq=121894 Ack=9145 Win=65535 Len=0"
"5.593541","5.9.29.183","172.19.0.3","TLSv1.2","1504","Application Data [TCP segment of a reassembled PDU]"
"5.596728","5.9.29.183","172.19.0.3","TCP","1504","9002 → 43520 [PSH, ACK] Seq=123342 Ack=9145 Win=65535 Len=1448 [TCP segment of a reassembled PDU]"
"5.596756","172.19.0.3","5.9.29.183","TCP","56","43520 → 9002 [ACK] Seq=9145 Ack=124790 Win=12738 Len=0"
"5.598132","5.9.29.183","172.19.0.3","TCP","1504","9002 → 43520 [PSH, ACK] Seq=124790 Ack=9145 Win=65535 Len=1448 [TCP segment of a reassembled PDU]"
"5.598247","5.9.29.183","172.19.0.3","TLSv1.2","1516","Application Data [TCP segment of a reassembled PDU]"
"5.598254","5.9.29.183","172.19.0.3","TLSv1.2","912","Application Data"
"5.598296","172.19.0.3","5.9.29.183","TCP","56","43520 → 9002 [ACK] Seq=9145 Ack=128554 Win=12722 Len=0"
"5.607078","5.9.29.183","172.19.0.3","TCP","1504","[TCP segment of a reassembled PDU]"
"5.611897","5.9.29.183","172.19.0.3","TCP","1504","9002 → 43520 [PSH, ACK] Seq=130002 Ack=9145 Win=65535 Len=1448 [TCP segment of a reassembled PDU]"
"5.611921","172.19.0.3","5.9.29.183","TCP","56","43520 → 9002 [ACK] Seq=9145 Ack=131450 Win=12736 Len=0"
"5.613428","5.9.29.183","172.19.0.3","TLSv1.2","787","Application Data"
"5.619893","5.9.29.183","172.19.0.3","TCP","1504","[TCP segment of a reassembled PDU]"
"5.619914","172.19.0.3","5.9.29.183","TCP","56","43520 → 9002 [ACK] Seq=9145 Ack=133629 Win=12738 Len=0"
"5.619965","5.9.29.183","172.19.0.3","TCP","1504","9002 → 43520 [PSH, ACK] Seq=133629 Ack=9145 Win=65535 Len=1448 [TCP segment of a reassembled PDU]"
"5.628830","5.9.29.183","172.19.0.3","TLSv1.2","1330","Application Data, Application Data"
"5.628855","172.19.0.3","5.9.29.183","TCP","56","43520 → 9002 [ACK] Seq=9145 Ack=136351 Win=12738 Len=0"
"5.629746","5.9.29.183","172.19.0.3","TCP","1516","[TCP segment of a reassembled PDU]"
"5.629796","5.9.29.183","172.19.0.3","TCP","1492","9002 → 43520 [PSH, ACK] Seq=137811 Ack=9145 Win=65535 Len=1436 [TCP segment of a reassembled PDU]"
"5.629928","172.19.0.3","5.9.29.183","TCP","56","43520 → 9002 [ACK] Seq=9145 Ack=139247 Win=12730 Len=0"
"5.644297","5.9.29.183","172.19.0.3","TLSv1.2","1516","Application Data [TCP segment of a reassembled PDU]"
"5.644377","5.9.29.183","172.19.0.3","TCP","1492","9002 → 43520 [PSH, ACK] Seq=140707 Ack=9145 Win=65535 Len=1436 [TCP segment of a reassembled PDU]"
"5.644405","172.19.0.3","5.9.29.183","TCP","56","43520 → 9002 [ACK] Seq=9145 Ack=142143 Win=12730 Len=0"
"5.644563","5.9.29.183","172.19.0.3","TCP","1516","9002 → 43520 [PSH, ACK] Seq=142143 Ack=9145 Win=65535 Len=1460 [TCP segment of a reassembled PDU]"
"5.644572","5.9.29.183","172.19.0.3","TLSv1.2","1492","Application Data [TCP segment of a reassembled PDU]"
"5.644600","172.19.0.3","5.9.29.183","TCP","56","43520 → 9002 [ACK] Seq=9145 Ack=145039 Win=12714 Len=0"
"5.645192","172.19.0.3","5.9.29.183","TLSv1.2","599","Application Data"
"5.645454","5.9.29.183","172.19.0.3","TCP","56","9002 → 43520 [ACK] Seq=145039 Ack=9688 Win=65535 Len=0"
"5.661087","5.9.29.183","172.19.0.3","TLSv1.2","1516","Application Data [TCP segment of a reassembled PDU]"
"5.661178","5.9.29.183","172.19.0.3","TCP","1516","9002 → 43520 [PSH, ACK] Seq=146499 Ack=9688 Win=65535 Len=1460 [TCP segment of a reassembled PDU]"
"5.661196","172.19.0.3","5.9.29.183","TCP","56","43520 → 9002 [ACK] Seq=9688 Ack=147959 Win=12730 Len=0"
"5.661199","5.9.29.183","172.19.0.3","TLSv1.2","1516","Application Data [TCP segment of a reassembled PDU]"
"5.661279","5.9.29.183","172.19.0.3","TCP","1516","9002 → 43520 [PSH, ACK] Seq=149419 Ack=9688 Win=65535 Len=1460 [TCP segment of a reassembled PDU]"
"5.661283","5.9.29.183","172.19.0.3","TCP","1456","9002 → 43520 [PSH, ACK] Seq=150879 Ack=9688 Win=65535 Len=1400 [TCP segment of a reassembled PDU]"
"5.661286","5.9.29.183","172.19.0.3","TLSv1.2","1264","Application Data, Application Data"
"5.661414","172.19.0.3","5.9.29.183","TCP","56","43520 → 9002 [ACK] Seq=9688 Ack=153487 Win=12698 Len=0"
"5.669349","5.9.29.183","172.19.0.3","TCP","1516","[TCP segment of a reassembled PDU]"
"5.669419","5.9.29.183","172.19.0.3","TCP","1492","9002 → 43520 [PSH, ACK] Seq=154947 Ack=9688 Win=65535 Len=1436 [TCP segment of a reassembled PDU]"
"5.669441","172.19.0.3","5.9.29.183","TCP","56","43520 → 9002 [ACK] Seq=9688 Ack=156383 Win=12730 Len=0"
"5.676778","5.9.29.183","172.19.0.3","TLSv1.2","1516","Application Data [TCP segment of a reassembled PDU]"
"5.676856","5.9.29.183","172.19.0.3","TCP","1516","9002 → 43520 [PSH, ACK] Seq=157843 Ack=9688 Win=65535 Len=1460 [TCP segment of a reassembled PDU]"
"5.676869","5.9.29.183","172.19.0.3","TCP","1516","9002 → 43520 [PSH, ACK] Seq=159303 Ack=9688 Win=65535 Len=1460 [TCP segment of a reassembled PDU]"
"5.676873","5.9.29.183","172.19.0.3","TLSv1.2","1516","Application Data [TCP segment of a reassembled PDU]"
"5.676897","5.9.29.183","172.19.0.3","TLSv1.2","1173","Application Data"
"5.677001","172.19.0.3","5.9.29.183","TCP","56","43520 → 9002 [ACK] Seq=9688 Ack=163340 Win=12704 Len=0"
"5.677402","172.19.0.3","5.9.29.183","TLSv1.2","599","Application Data"
"5.677667","5.9.29.183","172.19.0.3","TCP","56","9002 → 43520 [ACK] Seq=163340 Ack=10231 Win=65535 Len=0"
"5.682700","5.9.29.183","172.19.0.3","TCP","1504","[TCP segment of a reassembled PDU]"
"5.691995","5.9.29.183","172.19.0.3","TLSv1.2","693","Application Data"
"5.692021","172.19.0.3","5.9.29.183","TCP","56","43520 → 9002 [ACK] Seq=10231 Ack=165425 Win=12738 Len=0"
"5.698946","172.19.0.3","5.9.29.183","TLSv1.2","599","Application Data"
"5.699206","5.9.29.183","172.19.0.3","TCP","56","9002 → 43520 [ACK] Seq=165425 Ack=10774 Win=65535 Len=0"
"6.131544","5.9.29.183","172.19.0.3","TLSv1.2","599","Application Data"
"6.132509","172.19.0.3","5.9.29.183","TLSv1.2","599","Application Data"
"6.132921","5.9.29.183","172.19.0.3","TCP","56","9002 → 43520 [ACK] Seq=165968 Ack=11317 Win=65535 Len=0"
"6.439969","5.9.29.183","172.19.0.3","TCP","1516","[TCP segment of a reassembled PDU]"
"6.440084","5.9.29.183","172.19.0.3","TCP","1492","9002 → 43520 [PSH, ACK] Seq=167428 Ack=11317 Win=65535 Len=1436 [TCP segment of a reassembled PDU]"
"6.440097","5.9.29.183","172.19.0.3","TLSv1.2","787","Application Data"
"6.440300","172.19.0.3","5.9.29.183","TCP","56","43520 → 9002 [ACK] Seq=11317 Ack=169595 Win=12722 Len=0"
"6.451978","5.9.29.183","172.19.0.3","TCP","1171","[TCP segment of a reassembled PDU]"
"6.452042","5.9.29.183","172.19.0.3","TCP","389","9002 → 43520 [PSH, ACK] Seq=170710 Ack=11317 Win=65535 Len=333 [TCP segment of a reassembled PDU]"
"6.452123","5.9.29.183","172.19.0.3","TCP","1504","9002 → 43520 [PSH, ACK] Seq=171043 Ack=11317 Win=65535 Len=1448 [TCP segment of a reassembled PDU]"
"6.452138","172.19.0.3","5.9.29.183","TCP","56","43520 → 9002 [ACK] Seq=11317 Ack=172491 Win=12722 Len=0"
"6.455370","5.9.29.183","172.19.0.3","TLSv1.2","787","Application Data"
"6.464360","5.9.29.183","172.19.0.3","TCP","1516","[TCP segment of a reassembled PDU]"
"6.464383","172.19.0.3","5.9.29.183","TCP","56","43520 → 9002 [ACK] Seq=11317 Ack=174682 Win=12738 Len=0"
"6.464442","5.9.29.183","172.19.0.3","TCP","1492","9002 → 43520 [PSH, ACK] Seq=174682 Ack=11317 Win=65535 Len=1436 [TCP segment of a reassembled PDU]"
"6.470583","5.9.29.183","172.19.0.3","TLSv1.2","1330","Application Data, Application Data"
"6.470606","172.19.0.3","5.9.29.183","TCP","56","43520 → 9002 [ACK] Seq=11317 Ack=177392 Win=12738 Len=0"
"6.506352","5.9.29.183","172.19.0.3","TCP","1516","[TCP segment of a reassembled PDU]"
"6.506484","5.9.29.183","172.19.0.3","TCP","1492","9002 → 43520 [PSH, ACK] Seq=178852 Ack=11317 Win=65535 Len=1436 [TCP segment of a reassembled PDU]"
"6.506582","5.9.29.183","172.19.0.3","TLSv1.2","1237","Application Data"
"6.506674","5.9.29.183","172.19.0.3","TCP","1516","[TCP segment of a reassembled PDU]"
"6.506678","5.9.29.183","172.19.0.3","TCP","1516","9002 → 43520 [PSH, ACK] Seq=182929 Ack=11317 Win=65535 Len=1460 [TCP segment of a reassembled PDU]"
"6.506680","172.19.0.3","5.9.29.183","TCP","56","43520 → 9002 [ACK] Seq=11317 Ack=181469 Win=12722 Len=0"
"6.506680","5.9.29.183","172.19.0.3","TLSv1.2","1516","Application Data [TCP segment of a reassembled PDU]"
"6.506733","5.9.29.183","172.19.0.3","TCP","1516","9002 → 43520 [PSH, ACK] Seq=185849 Ack=11317 Win=65535 Len=1460 [TCP segment of a reassembled PDU]"
"6.506788","5.9.29.183","172.19.0.3","TCP","1456","9002 → 43520 [PSH, ACK] Seq=187309 Ack=11317 Win=65535 Len=1400 [TCP segment of a reassembled PDU]"
"6.506868","172.19.0.3","5.9.29.183","TCP","56","43520 → 9002 [ACK] Seq=11317 Ack=188709 Win=12682 Len=0"
"6.522533","5.9.29.183","172.19.0.3","TLSv1.2","1516","Application Data [TCP segment of a reassembled PDU]"
"6.522606","5.9.29.183","172.19.0.3","TLSv1.2","1492","Application Data [TCP segment of a reassembled PDU]"
"6.522628","172.19.0.3","5.9.29.183","TCP","56","43520 → 9002 [ACK] Seq=11317 Ack=191605 Win=12728 Len=0"
"6.569631","5.9.29.183","172.19.0.3","TCP","1504","9002 → 43520 [PSH, ACK] Seq=191605 Ack=11317 Win=65535 Len=1448 [TCP segment of a reassembled PDU]"
"6.585005","5.9.29.183","172.19.0.3","TLSv1.2","1504","Application Data [TCP segment of a reassembled PDU]"
"6.585048","172.19.0.3","5.9.29.183","TCP","56","43520 → 9002 [ACK] Seq=11317 Ack=194501 Win=12738 Len=0"
"6.585101","5.9.29.183","172.19.0.3","TCP","1516","9002 → 43520 [PSH, ACK] Seq=194501 Ack=11317 Win=65535 Len=1460 [TCP segment of a reassembled PDU]"
"6.585154","5.9.29.183","172.19.0.3","TCP","1516","9002 → 43520 [PSH, ACK] Seq=195961 Ack=11317 Win=65535 Len=1460 [TCP segment of a reassembled PDU]"
"6.585164","5.9.29.183","172.19.0.3","TLSv1.2","247","Application Data"
"6.585235","172.19.0.3","5.9.29.183","TCP","56","43520 → 9002 [ACK] Seq=11317 Ack=197612 Win=12714 Len=0"
"6.585486","172.19.0.3","5.9.29.183","TLSv1.2","599","Application Data"
"6.585849","5.9.29.183","172.19.0.3","TCP","56","9002 → 43520 [ACK] Seq=197612 Ack=11860 Win=65535 Len=0"
"6.749767","5.9.29.183","172.19.0.3","TCP","1516","[TCP segment of a reassembled PDU]"
"6.749841","5.9.29.183","172.19.0.3","TCP","1492","9002 → 43520 [PSH, ACK] Seq=199072 Ack=11860 Win=65535 Len=1436 [TCP segment of a reassembled PDU]"
"6.749880","172.19.0.3","5.9.29.183","TCP","56","43520 → 9002 [ACK] Seq=11860 Ack=200508 Win=12730 Len=0"
"6.749884","5.9.29.183","172.19.0.3","TLSv1.2","273","Application Data"
"6.755385","172.19.0.3","5.9.29.183","TLSv1.2","599","Application Data"
"6.755672","5.9.29.183","172.19.0.3","TCP","56","9002 → 43520 [ACK] Seq=200725 Ack=12403 Win=65535 Len=0"
"7.027931","5.9.29.183","172.19.0.3","TLSv1.2","599","Application Data"
"7.028895","172.19.0.3","5.9.29.183","TLSv1.2","599","Application Data"
"7.029245","5.9.29.183","172.19.0.3","TCP","56","9002 → 43520 [ACK] Seq=201268 Ack=12946 Win=65535 Len=0"
"7.373055","5.9.29.183","172.19.0.3","TCP","1516","[TCP segment of a reassembled PDU]"
"7.373167","5.9.29.183","172.19.0.3","TCP","1492","9002 → 43520 [PSH, ACK] Seq=202728 Ack=12946 Win=65535 Len=1436 [TCP segment of a reassembled PDU]"
"7.373183","5.9.29.183","172.19.0.3","TLSv1.2","787","Application Data"
"7.373322","172.19.0.3","5.9.29.183","TCP","56","43520 → 9002 [ACK] Seq=12946 Ack=204895 Win=12722 Len=0"
"7.397182","5.9.29.183","172.19.0.3","TCP","1504","[TCP segment of a reassembled PDU]"
"7.397426","5.9.29.183","172.19.0.3","TCP","1504","9002 → 43520 [PSH, ACK] Seq=206343 Ack=12946 Win=65535 Len=1448 [TCP segment of a reassembled PDU]"
"7.397443","172.19.0.3","5.9.29.183","TCP","56","43520 → 9002 [ACK] Seq=12946 Ack=207791 Win=12730 Len=0"
"7.397446","5.9.29.183","172.19.0.3","TLSv1.2","787","Application Data"
"7.408617","5.9.29.183","172.19.0.3","TCP","1516","[TCP segment of a reassembled PDU]"
"7.408643","172.19.0.3","5.9.29.183","TCP","56","43520 → 9002 [ACK] Seq=12946 Ack=209982 Win=12738 Len=0"
"7.408704","5.9.29.183","172.19.0.3","TCP","1492","9002 → 43520 [PSH, ACK] Seq=209982 Ack=12946 Win=65535 Len=1436 [TCP segment of a reassembled PDU]"
"7.413036","5.9.29.183","172.19.0.3","TLSv1.2","1330","Application Data, Application Data"
"7.413060","172.19.0.3","5.9.29.183","TCP","56","43520 → 9002 [ACK] Seq=12946 Ack=212692 Win=12738 Len=0"
"7.413580","172.19.0.3","5.9.29.183","TLSv1.2","599","Application Data"
"7.413894","5.9.29.183","172.19.0.3","TCP","56","9002 → 43520 [ACK] Seq=212692 Ack=13489 Win=65535 Len=0"
"7.446473","5.9.29.183","172.19.0.3","TCP","1516","[TCP segment of a reassembled PDU]"
"7.446563","5.9.29.183","172.19.0.3","TCP","1516","9002 → 43520 [PSH, ACK] Seq=214152 Ack=13489 Win=65535 Len=1460 [TCP segment of a reassembled PDU]"
"7.446577","5.9.29.183","172.19.0.3","TLSv1.2","763","Application Data"
"7.446779","172.19.0.3","5.9.29.183","TCP","56","43520 → 9002 [ACK] Seq=13489 Ack=216319 Win=12722 Len=0"
"7.455124","5.9.29.183","172.19.0.3","TCP","1516","[TCP segment of a reassembled PDU]"
"7.455264","5.9.29.183","172.19.0.3","TCP","1516","9002 → 43520 [PSH, ACK] Seq=217779 Ack=13489 Win=65535 Len=1460 [TCP segment of a reassembled PDU]"
"7.455289","172.19.0.3","5.9.29.183","TCP","56","43520 → 9002 [ACK] Seq=13489 Ack=219239 Win=12728 Len=0"
"7.455294","5.9.29.183","172.19.0.3","TLSv1.2","1516","Application Data [TCP segment of a reassembled PDU]"
"7.455384","5.9.29.183","172.19.0.3","TCP","1516","9002 → 43520 [PSH, ACK] Seq=220699 Ack=13489 Win=65535 Len=1460 [TCP segment of a reassembled PDU]"
"7.455388","5.9.29.183","172.19.0.3","TCP","1456","9002 → 43520 [PSH, ACK] Seq=222159 Ack=13489 Win=65535 Len=1400 [TCP segment of a reassembled PDU]"
"7.455390","5.9.29.183","172.19.0.3","TLSv1.2","1504","Application Data [TCP segment of a reassembled PDU]"
"7.455559","172.19.0.3","5.9.29.183","TCP","56","43520 → 9002 [ACK] Seq=13489 Ack=225007 Win=12696 Len=0"
"7.461781","5.9.29.183","172.19.0.3","TLSv1.2","193","Application Data"
"7.467182","5.9.29.183","172.19.0.3","TCP","1516","[TCP segment of a reassembled PDU]"
"7.467204","172.19.0.3","5.9.29.183","TCP","56","43520 → 9002 [ACK] Seq=13489 Ack=226604 Win=12738 Len=0"
"7.467261","5.9.29.183","172.19.0.3","TCP","1492","9002 → 43520 [PSH, ACK] Seq=226604 Ack=13489 Win=65535 Len=1436 [TCP segment of a reassembled PDU]"
"7.477246","5.9.29.183","172.19.0.3","TLSv1.2","1516","Application Data [TCP segment of a reassembled PDU]"
"7.477277","172.19.0.3","5.9.29.183","TCP","56","43520 → 9002 [ACK] Seq=13489 Ack=229500 Win=12738 Len=0"
"7.477385","5.9.29.183","172.19.0.3","TCP","1492","9002 → 43520 [PSH, ACK] Seq=229500 Ack=13489 Win=65535 Len=1436 [TCP segment of a reassembled PDU]"
"7.477500","5.9.29.183","172.19.0.3","TCP","1516","9002 → 43520 [PSH, ACK] Seq=230936 Ack=13489 Win=65535 Len=1460 [TCP segment of a reassembled PDU]"
"7.477507","5.9.29.183","172.19.0.3","TLSv1.2","1516","Application Data [TCP segment of a reassembled PDU]"
"7.477510","5.9.29.183","172.19.0.3","TCP","1480","9002 → 43520 [PSH, ACK] Seq=233856 Ack=13489 Win=65535 Len=1424 [TCP segment of a reassembled PDU]"
"7.477513","5.9.29.183","172.19.0.3","TCP","1022","9002 → 43520 [PSH, ACK] Seq=235280 Ack=13489 Win=65535 Len=966 [TCP segment of a reassembled PDU]"
"7.477630","5.9.29.183","172.19.0.3","TLSv1.2","1516","Application Data [TCP segment of a reassembled PDU]"
"7.477639","5.9.29.183","172.19.0.3","TLSv1.2","460","Application Data"
"7.477730","172.19.0.3","5.9.29.183","TLSv1.2","599","Application Data"
"7.478330","5.9.29.183","172.19.0.3","TCP","56","9002 → 43520 [ACK] Seq=238110 Ack=14032 Win=65535 Len=0"
"7.528491","5.9.29.183","172.19.0.3","TCP","1516","[TCP segment of a reassembled PDU]"
"7.528558","5.9.29.183","172.19.0.3","TCP","1516","9002 → 43520 [PSH, ACK] Seq=239570 Ack=14032 Win=65535 Len=1460 [TCP segment of a reassembled PDU]"
"7.528578","172.19.0.3","5.9.29.183","TCP","56","43520 → 9002 [ACK] Seq=14032 Ack=241030 Win=12730 Len=0"
"7.528580","5.9.29.183","172.19.0.3","TLSv1.2","763","Application Data"
"7.544249","5.9.29.183","172.19.0.3","TCP","1516","[TCP segment of a reassembled PDU]"
"7.544272","172.19.0.3","5.9.29.183","TCP","56","43520 → 9002 [ACK] Seq=14032 Ack=243197 Win=12738 Len=0"
"7.544332","5.9.29.183","172.19.0.3","TCP","1492","9002 → 43520 [PSH, ACK] Seq=243197 Ack=14032 Win=65535 Len=1436 [TCP segment of a reassembled PDU]"
"7.544381","5.9.29.183","172.19.0.3","TLSv1.2","1237","Application Data"
"7.544516","172.19.0.3","5.9.29.183","TCP","56","43520 → 9002 [ACK] Seq=14032 Ack=245814 Win=12720 Len=0"
"7.545437","172.19.0.3","5.9.29.183","TLSv1.2","599","Application Data"
"7.545721","5.9.29.183","172.19.0.3","TCP","56","9002 → 43520 [ACK] Seq=245814 Ack=14575 Win=65535 Len=0"
"7.555617","172.19.0.3","5.9.29.183","TLSv1.2","599","Application Data"
"7.555838","5.9.29.183","172.19.0.3","TCP","56","9002 → 43520 [ACK] Seq=245814 Ack=15118 Win=65535 Len=0"
"7.559585","5.9.29.183","172.19.0.3","TLSv1.2","149","Application Data"
"7.604565","172.19.0.3","5.9.29.183","TCP","56","43520 → 9002 [ACK] Seq=15118 Ack=245907 Win=12738 Len=0"
"7.985263","5.9.29.183","172.19.0.3","TLSv1.2","599","Application Data"
"7.985360","172.19.0.3","5.9.29.183","TCP","56","43520 → 9002 [ACK] Seq=15118 Ack=246450 Win=12738 Len=0"
"7.986253","172.19.0.3","5.9.29.183","TLSv1.2","599","Application Data"
"7.986550","5.9.29.183","172.19.0.3","TCP","56","9002 → 43520 [ACK] Seq=246450 Ack=15661 Win=65535 Len=0"
"8.659581","5.9.29.183","172.19.0.3","TCP","1516","[TCP segment of a reassembled PDU]"
"8.659693","5.9.29.183","172.19.0.3","TCP","1492","9002 → 43520 [PSH, ACK] Seq=247910 Ack=15661 Win=65535 Len=1436 [TCP segment of a reassembled PDU]"
"8.659707","5.9.29.183","172.19.0.3","TLSv1.2","787","Application Data"
"8.659855","172.19.0.3","5.9.29.183","TCP","56","43520 → 9002 [ACK] Seq=15661 Ack=250077 Win=12722 Len=0"
"8.681566","5.9.29.183","172.19.0.3","TCP","1504","[TCP segment of a reassembled PDU]"
"8.681681","5.9.29.183","172.19.0.3","TCP","1504","9002 → 43520 [PSH, ACK] Seq=251525 Ack=15661 Win=65535 Len=1448 [TCP segment of a reassembled PDU]"
"8.681704","172.19.0.3","5.9.29.183","TCP","56","43520 → 9002 [ACK] Seq=15661 Ack=252973 Win=12730 Len=0"
"8.681787","5.9.29.183","172.19.0.3","TLSv1.2","787","Application Data"
"8.694053","5.9.29.183","172.19.0.3","TCP","1516","[TCP segment of a reassembled PDU]"
"8.694075","172.19.0.3","5.9.29.183","TCP","56","43520 → 9002 [ACK] Seq=15661 Ack=255164 Win=12738 Len=0"
"8.694133","5.9.29.183","172.19.0.3","TCP","1492","9002 → 43520 [PSH, ACK] Seq=255164 Ack=15661 Win=65535 Len=1436 [TCP segment of a reassembled PDU]"
"8.697284","5.9.29.183","172.19.0.3","TLSv1.2","787","Application Data"
"8.697309","172.19.0.3","5.9.29.183","TCP","56","43520 → 9002 [ACK] Seq=15661 Ack=257331 Win=12738 Len=0"
"8.706706","5.9.29.183","172.19.0.3","TCP","1504","[TCP segment of a reassembled PDU]"
"8.707102","5.9.29.183","172.19.0.3","TCP","1504","9002 → 43520 [PSH, ACK] Seq=258779 Ack=15661 Win=65535 Len=1448 [TCP segment of a reassembled PDU]"
"8.707122","172.19.0.3","5.9.29.183","TCP","56","43520 → 9002 [ACK] Seq=15661 Ack=260227 Win=12738 Len=0"
"8.712496","5.9.29.183","172.19.0.3","TLSv1.2","787","Application Data"
"8.715767","5.9.29.183","172.19.0.3","TCP","1504","[TCP segment of a reassembled PDU]"
"8.715795","172.19.0.3","5.9.29.183","TCP","56","43520 → 9002 [ACK] Seq=15661 Ack=262406 Win=12738 Len=0"
"8.716025","5.9.29.183","172.19.0.3","TCP","1516","9002 → 43520 [PSH, ACK] Seq=262406 Ack=15661 Win=65535 Len=1460 [TCP segment of a reassembled PDU]"
"8.716035","5.9.29.183","172.19.0.3","TLSv1.2","1516","Application Data [TCP segment of a reassembled PDU]"
"8.716040","5.9.29.183","172.19.0.3","TCP","1516","9002 → 43520 [PSH, ACK] Seq=265326 Ack=15661 Win=65535 Len=1460 [TCP segment of a reassembled PDU]"
"8.716043","5.9.29.183","172.19.0.3","TCP","1468","9002 → 43520 [PSH, ACK] Seq=266786 Ack=15661 Win=65535 Len=1412 [TCP segment of a reassembled PDU]"
"8.716070","172.19.0.3","5.9.29.183","TCP","56","43520 → 9002 [ACK] Seq=15661 Ack=268198 Win=12714 Len=0"
"8.716328","5.9.29.183","172.19.0.3","TLSv1.2","1504","Application Data [TCP segment of a reassembled PDU]"
"8.716618","172.19.0.3","5.9.29.183","TLSv1.2","599","Application Data"
"8.716899","5.9.29.183","172.19.0.3","TCP","56","9002 → 43520 [ACK] Seq=269646 Ack=16204 Win=65535 Len=0"
"8.728140","5.9.29.183","172.19.0.3","TLSv1.2","193","Application Data"
"8.739781","5.9.29.183","172.19.0.3","TCP","1516","[TCP segment of a reassembled PDU]"
"8.739803","172.19.0.3","5.9.29.183","TCP","56","43520 → 9002 [ACK] Seq=16204 Ack=271243 Win=12738 Len=0"
"8.739858","5.9.29.183","172.19.0.3","TCP","1492","9002 → 43520 [PSH, ACK] Seq=271243 Ack=16204 Win=65535 Len=1436 [TCP segment of a reassembled PDU]"
"8.740043","5.9.29.183","172.19.0.3","TLSv1.2","1516","Application Data [TCP segment of a reassembled PDU]"
"8.740057","172.19.0.3","5.9.29.183","TCP","56","43520 → 9002 [ACK] Seq=16204 Ack=274139 Win=12738 Len=0"
"8.740064","5.9.29.183","172.19.0.3","TCP","1516","9002 → 43520 [PSH, ACK] Seq=274139 Ack=16204 Win=65535 Len=1460 [TCP segment of a reassembled PDU]"
"8.740207","5.9.29.183","172.19.0.3","TCP","1516","9002 → 43520 [PSH, ACK] Seq=275599 Ack=16204 Win=65535 Len=1460 [TCP segment of a reassembled PDU]"
"8.740214","5.9.29.183","172.19.0.3","TLSv1.2","1468","Application Data [TCP segment of a reassembled PDU]"
"8.740362","172.19.0.3","5.9.29.183","TLSv1.2","599","Application Data"
"8.740610","5.9.29.183","172.19.0.3","TCP","56","9002 → 43520 [ACK] Seq=278471 Ack=16747 Win=65535 Len=0"
"8.743462","5.9.29.183","172.19.0.3","TLSv1.2","1221","Application Data"
"8.753547","5.9.29.183","172.19.0.3","TCP","1516","[TCP segment of a reassembled PDU]"
"8.753571","172.19.0.3","5.9.29.183","TCP","56","43520 → 9002 [ACK] Seq=16747 Ack=281096 Win=12738 Len=0"
"8.753628","5.9.29.183","172.19.0.3","TCP","1492","9002 → 43520 [PSH, ACK] Seq=281096 Ack=16747 Win=65535 Len=1436 [TCP segment of a reassembled PDU]"
"8.758783","5.9.29.183","172.19.0.3","TLSv1.2","787","Application Data"
"8.758828","172.19.0.3","5.9.29.183","TCP","56","43520 → 9002 [ACK] Seq=16747 Ack=283263 Win=12738 Len=0"
"8.763842","5.9.29.183","172.19.0.3","TCP","1504","[TCP segment of a reassembled PDU]"
"8.764070","5.9.29.183","172.19.0.3","TCP","1516","9002 → 43520 [PSH, ACK] Seq=284711 Ack=16747 Win=65535 Len=1460 [TCP segment of a reassembled PDU]"
"8.764083","5.9.29.183","172.19.0.3","TLSv1.2","1492","Application Data [TCP segment of a reassembled PDU]"
"8.764135","172.19.0.3","5.9.29.183","TCP","56","43520 → 9002 [ACK] Seq=16747 Ack=287607 Win=12722 Len=0"
"8.766710","5.9.29.183","172.19.0.3","TLSv1.2","1516","Application Data [TCP segment of a reassembled PDU]"
"8.766781","5.9.29.183","172.19.0.3","TCP","1492","9002 → 43520 [PSH, ACK] Seq=289067 Ack=16747 Win=65535 Len=1436 [TCP segment of a reassembled PDU]"
"8.766802","172.19.0.3","5.9.29.183","TCP","56","43520 → 9002 [ACK] Seq=16747 Ack=290503 Win=12730 Len=0"
"8.773723","5.9.29.183","172.19.0.3","TLSv1.2","613","Application Data"
"8.788775","5.9.29.183","172.19.0.3","TCP","1504","[TCP segment of a reassembled PDU]"
"8.788794","172.19.0.3","5.9.29.183","TCP","56","43520 → 9002 [ACK] Seq=16747 Ack=292508 Win=12738 Len=0"
"8.789139","5.9.29.183","172.19.0.3","TCP","1516","9002 → 43520 [PSH, ACK] Seq=292508 Ack=16747 Win=65535 Len=1460 [TCP segment of a reassembled PDU]"
"8.789213","5.9.29.183","172.19.0.3","TLSv1.2","1516","Application Data [TCP segment of a reassembled PDU]"
"8.789245","5.9.29.183","172.19.0.3","TCP","1516","9002 → 43520 [PSH, ACK] Seq=295428 Ack=16747 Win=65535 Len=1460 [TCP segment of a reassembled PDU]"
"8.789270","5.9.29.183","172.19.0.3","TCP","1516","9002 → 43520 [PSH, ACK] Seq=296888 Ack=16747 Win=65535 Len=1460 [TCP segment of a reassembled PDU]"
"8.789276","172.19.0.3","5.9.29.183","TCP","56","43520 → 9002 [ACK] Seq=16747 Ack=295428 Win=12728 Len=0"
"8.789276","5.9.29.183","172.19.0.3","TLSv1.2","1516","Application Data [TCP segment of a reassembled PDU]"
"8.789296","5.9.29.183","172.19.0.3","TCP","1444","9002 → 43520 [PSH, ACK] Seq=299808 Ack=16747 Win=65535 Len=1388 [TCP segment of a reassembled PDU]"
"8.789298","5.9.29.183","172.19.0.3","TCP","642","9002 → 43520 [PSH, ACK] Seq=301196 Ack=16747 Win=65535 Len=586 [TCP segment of a reassembled PDU]"
"8.789420","5.9.29.183","172.19.0.3","TCP","1516","9002 → 43520 [PSH, ACK] Seq=301782 Ack=16747 Win=65535 Len=1460 [TCP segment of a reassembled PDU]"
"8.789449","5.9.29.183","172.19.0.3","TLSv1.2","1516","Application Data [TCP segment of a reassembled PDU]"
"8.789456","172.19.0.3","5.9.29.183","TCP","56","43520 → 9002 [ACK] Seq=16747 Ack=303242 Win=12680 Len=0"
"8.789466","5.9.29.183","172.19.0.3","TCP","894","9002 → 43520 [PSH, ACK] Seq=304702 Ack=16747 Win=65535 Len=838 [TCP segment of a reassembled PDU]"
"8.789501","172.19.0.3","5.9.29.183","TCP","56","43520 → 9002 [ACK] Seq=16747 Ack=305540 Win=12663 Len=0"
"8.789728","172.19.0.3","5.9.29.183","TLSv1.2","599","Application Data"
"8.789950","5.9.29.183","172.19.0.3","TCP","56","9002 → 43520 [ACK] Seq=305540 Ack=17290 Win=65535 Len=0"
"8.805219","5.9.29.183","172.19.0.3","TLSv1.2","1516","Application Data [TCP segment of a reassembled PDU]"
"8.805381","5.9.29.183","172.19.0.3","TCP","1492","9002 → 43520 [PSH, ACK] Seq=307000 Ack=17290 Win=65535 Len=1436 [TCP segment of a reassembled PDU]"
"8.805407","172.19.0.3","5.9.29.183","TCP","56","43520 → 9002 [ACK] Seq=17290 Ack=308436 Win=12730 Len=0"
"8.805514","5.9.29.183","172.19.0.3","TCP","1516","9002 → 43520 [PSH, ACK] Seq=308436 Ack=17290 Win=65535 Len=1460 [TCP segment of a reassembled PDU]"
"8.805521","5.9.29.183","172.19.0.3","TLSv1.2","1516","Application Data [TCP segment of a reassembled PDU]"
"8.805525","5.9.29.183","172.19.0.3","TCP","1480","9002 → 43520 [PSH, ACK] Seq=311356 Ack=17290 Win=65535 Len=1424 [TCP segment of a reassembled PDU]"
"8.805528","5.9.29.183","172.19.0.3","TLSv1.2","98","Application Data"
"8.805642","172.19.0.3","5.9.29.183","TCP","56","43520 → 9002 [ACK] Seq=17290 Ack=312822 Win=12704 Len=0"
"8.811072","172.19.0.3","5.9.29.183","TLSv1.2","599","Application Data"
"8.811305","5.9.29.183","172.19.0.3","TCP","56","9002 → 43520 [ACK] Seq=312822 Ack=17833 Win=65535 Len=0"
"9.398677","5.9.29.183","172.19.0.3","TLSv1.2","599","Application Data"
"9.399564","172.19.0.3","5.9.29.183","TLSv1.2","599","Application Data"
"9.399919","5.9.29.183","172.19.0.3","TCP","56","9002 → 43520 [ACK] Seq=313365 Ack=18376 Win=65535 Len=0"
"9.670421","5.9.29.183","172.19.0.3","TCP","1516","[TCP segment of a reassembled PDU]"
"9.670515","5.9.29.183","172.19.0.3","TCP","1516","9002 → 43520 [PSH, ACK] Seq=314825 Ack=18376 Win=65535 Len=1460 [TCP segment of a reassembled PDU]"
"9.670557","5.9.29.183","172.19.0.3","TLSv1.2","763","Application Data"
"9.670650","172.19.0.3","5.9.29.183","TCP","56","43520 → 9002 [ACK] Seq=18376 Ack=316992 Win=12722 Len=0"
"9.719299","5.9.29.183","172.19.0.3","TCP","1504","[TCP segment of a reassembled PDU]"
"9.719453","5.9.29.183","172.19.0.3","TCP","1504","9002 → 43520 [PSH, ACK] Seq=318440 Ack=18376 Win=65535 Len=1448 [TCP segment of a reassembled PDU]"
"9.719474","172.19.0.3","5.9.29.183","TCP","56","43520 → 9002 [ACK] Seq=18376 Ack=319888 Win=12730 Len=0"
"9.719476","5.9.29.183","172.19.0.3","TLSv1.2","787","Application Data"
"9.719772","172.19.0.3","5.9.29.183","TLSv1.2","599","Application Data"
"9.720138","5.9.29.183","172.19.0.3","TCP","56","9002 → 43520 [ACK] Seq=320619 Ack=18919 Win=65535 Len=0"
"9.729870","5.9.29.183","172.19.0.3","TCP","1516","[TCP segment of a reassembled PDU]"
"9.729935","5.9.29.183","172.19.0.3","TCP","1516","9002 → 43520 [PSH, ACK] Seq=322079 Ack=18919 Win=65535 Len=1460 [TCP segment of a reassembled PDU]"
"9.729945","5.9.29.183","172.19.0.3","TLSv1.2","1516","Application Data [TCP segment of a reassembled PDU]"
"9.729949","5.9.29.183","172.19.0.3","TCP","1468","9002 → 43520 [PSH, ACK] Seq=324999 Ack=18919 Win=65535 Len=1412 [TCP segment of a reassembled PDU]"
"9.730075","172.19.0.3","5.9.29.183","TCP","56","43520 → 9002 [ACK] Seq=18919 Ack=326411 Win=12712 Len=0"
"9.735172","5.9.29.183","172.19.0.3","TLSv1.2","490","Application Data"
"9.742944","5.9.29.183","172.19.0.3","TCP","1516","[TCP segment of a reassembled PDU]"
"9.742969","172.19.0.3","5.9.29.183","TCP","56","43520 → 9002 [ACK] Seq=18919 Ack=328305 Win=12738 Len=0"
"9.743027","5.9.29.183","172.19.0.3","TCP","1492","9002 → 43520 [PSH, ACK] Seq=328305 Ack=18919 Win=65535 Len=1436 [TCP segment of a reassembled PDU]"
"9.750884","5.9.29.183","172.19.0.3","TLSv1.2","1330","Application Data, Application Data"
"9.750908","172.19.0.3","5.9.29.183","TCP","56","43520 → 9002 [ACK] Seq=18919 Ack=331015 Win=12738 Len=0"
"9.752191","5.9.29.183","172.19.0.3","TCP","1504","[TCP segment of a reassembled PDU]"
"9.752692","5.9.29.183","172.19.0.3","TCP","1516","9002 → 43520 [PSH, ACK] Seq=332463 Ack=18919 Win=65535 Len=1460 [TCP segment of a reassembled PDU]"
"9.752709","172.19.0.3","5.9.29.183","TCP","56","43520 → 9002 [ACK] Seq=18919 Ack=333923 Win=12738 Len=0"
"9.752753","5.9.29.183","172.19.0.3","TLSv1.2","1492","Application Data [TCP segment of a reassembled PDU]"
"9.752828","5.9.29.183","172.19.0.3","TCP","1516","9002 → 43520 [PSH, ACK] Seq=335359 Ack=18919 Win=65535 Len=1460 [TCP segment of a reassembled PDU]"
"9.752834","5.9.29.183","172.19.0.3","TCP","1516","9002 → 43520 [PSH, ACK] Seq=336819 Ack=18919 Win=65535 Len=1460 [TCP segment of a reassembled PDU]"
"9.752837","5.9.29.183","172.19.0.3","TLSv1.2","1480","Application Data [TCP segment of a reassembled PDU]"
"9.752939","172.19.0.3","5.9.29.183","TCP","56","43520 → 9002 [ACK] Seq=18919 Ack=339703 Win=12706 Len=0"
"9.766449","5.9.29.183","172.19.0.3","TLSv1.2","1221","Application Data"
"9.766964","172.19.0.3","5.9.29.183","TLSv1.2","599","Application Data"
"9.767314","5.9.29.183","172.19.0.3","TCP","56","9002 → 43520 [ACK] Seq=340868 Ack=19462 Win=65535 Len=0"
"9.802893","5.9.29.183","172.19.0.3","TCP","1504","[TCP segment of a reassembled PDU]"
"9.803043","5.9.29.183","172.19.0.3","TCP","1504","9002 → 43520 [PSH, ACK] Seq=342316 Ack=19462 Win=65535 Len=1448 [TCP segment of a reassembled PDU]"
"9.803170","172.19.0.3","5.9.29.183","TCP","56","43520 → 9002 [ACK] Seq=19462 Ack=343764 Win=12730 Len=0"
"9.803224","5.9.29.183","172.19.0.3","TLSv1.2","1237","Application Data"
"9.803228","5.9.29.183","172.19.0.3","TCP","1516","[TCP segment of a reassembled PDU]"
"9.803230","5.9.29.183","172.19.0.3","TCP","1492","9002 → 43520 [PSH, ACK] Seq=346405 Ack=19462 Win=65535 Len=1436 [TCP segment of a reassembled PDU]"
"9.803240","172.19.0.3","5.9.29.183","TCP","56","43520 → 9002 [ACK] Seq=19462 Ack=346405 Win=12730 Len=0"
"9.814212","5.9.29.183","172.19.0.3","TLSv1.2","1504","Application Data [TCP segment of a reassembled PDU]"
"9.814236","172.19.0.3","5.9.29.183","TCP","56","43520 → 9002 [ACK] Seq=19462 Ack=349289 Win=12738 Len=0"
"9.818896","5.9.29.183","172.19.0.3","TLSv1.2","1488","Application Data"
"9.861225","172.19.0.3","5.9.29.183","TCP","56","43520 → 9002 [ACK] Seq=19462 Ack=350721 Win=12738 Len=0"
"10.095624","5.9.29.183","172.19.0.3","TCP","1516","[TCP segment of a reassembled PDU]"
"10.095706","172.19.0.3","5.9.29.183","TCP","56","43520 → 9002 [ACK] Seq=19462 Ack=352181 Win=12738 Len=0"
"10.095709","5.9.29.183","172.19.0.3","TCP","1492","9002 → 43520 [PSH, ACK] Seq=352181 Ack=19462 Win=65535 Len=1436 [TCP segment of a reassembled PDU]"
"10.095720","172.19.0.3","5.9.29.183","TCP","56","43520 → 9002 [ACK] Seq=19462 Ack=353617 Win=12730 Len=0"
"10.095721","5.9.29.183","172.19.0.3","TLSv1.2","787","Application Data"
"10.095726","172.19.0.3","5.9.29.183","TCP","56","43520 → 9002 [ACK] Seq=19462 Ack=354348 Win=12725 Len=0"
"10.107086","5.9.29.183","172.19.0.3","TCP","1504","[TCP segment of a reassembled PDU]"
"10.107112","172.19.0.3","5.9.29.183","TCP","56","43520 → 9002 [ACK] Seq=19462 Ack=355796 Win=12738 Len=0"
"10.107174","5.9.29.183","172.19.0.3","TCP","1504","9002 → 43520 [PSH, ACK] Seq=355796 Ack=19462 Win=65535 Len=1448 [TCP segment of a reassembled PDU]"
"10.107191","172.19.0.3","5.9.29.183","TCP","56","43520 → 9002 [ACK] Seq=19462 Ack=357244 Win=12730 Len=0"
"10.111386","5.9.29.183","172.19.0.3","TLSv1.2","1330","Application Data, Application Data"
"10.111413","172.19.0.3","5.9.29.183","TCP","56","43520 → 9002 [ACK] Seq=19462 Ack=358518 Win=12738 Len=0"
"10.175388","5.9.29.183","172.19.0.3","TCP","1516","[TCP segment of a reassembled PDU]"
"10.175413","172.19.0.3","5.9.29.183","TCP","56","43520 → 9002 [ACK] Seq=19462 Ack=359978 Win=12738 Len=0"
"10.175468","5.9.29.183","172.19.0.3","TCP","1516","9002 → 43520 [PSH, ACK] Seq=359978 Ack=19462 Win=65535 Len=1460 [TCP segment of a reassembled PDU]"
"10.175480","172.19.0.3","5.9.29.183","TCP","56","43520 → 9002 [ACK] Seq=19462 Ack=361438 Win=12730 Len=0"
"10.175483","5.9.29.183","172.19.0.3","TLSv1.2","763","Application Data"
"10.175489","172.19.0.3","5.9.29.183","TCP","56","43520 → 9002 [ACK] Seq=19462 Ack=362145 Win=12725 Len=0"
"10.187779","5.9.29.183","172.19.0.3","TCP","1516","[TCP segment of a reassembled PDU]"
"10.187803","172.19.0.3","5.9.29.183","TCP","56","43520 → 9002 [ACK] Seq=19462 Ack=363605 Win=12738 Len=0"
"10.187856","5.9.29.183","172.19.0.3","TCP","1492","9002 → 43520 [PSH, ACK] Seq=363605 Ack=19462 Win=65535 Len=1436 [TCP segment of a reassembled PDU]"
"10.187869","172.19.0.3","5.9.29.183","TCP","56","43520 → 9002 [ACK] Seq=19462 Ack=365041 Win=12730 Len=0"
"10.190824","5.9.29.183","172.19.0.3","TLSv1.2","1330","Application Data, Application Data"
"10.190851","172.19.0.3","5.9.29.183","TCP","56","43520 → 9002 [ACK] Seq=19462 Ack=366315 Win=12738 Len=0"
"10.191287","172.19.0.3","5.9.29.183","TLSv1.2","599","Application Data"
"10.191605","5.9.29.183","172.19.0.3","TCP","56","9002 → 43520 [ACK] Seq=366315 Ack=20005 Win=65535 Len=0"
"10.234668","5.9.29.183","172.19.0.3","TCP","1059","[TCP segment of a reassembled PDU]"
"10.234832","5.9.29.183","172.19.0.3","TCP","1516","9002 → 43520 [PSH, ACK] Seq=367318 Ack=20005 Win=65535 Len=1460 [TCP segment of a reassembled PDU]"
"10.234842","5.9.29.183","172.19.0.3","TLSv1.2","706","Application Data"
"10.234908","172.19.0.3","5.9.29.183","TCP","56","43520 → 9002 [ACK] Seq=20005 Ack=369428 Win=12722 Len=0"
"10.239493","172.19.0.3","5.9.29.183","TLSv1.2","599","Application Data"
"10.239725","5.9.29.183","172.19.0.3","TCP","56","9002 → 43520 [ACK] Seq=369428 Ack=20548 Win=65535 Len=0"
"10.539651","5.9.29.183","172.19.0.3","TLSv1.2","599","Application Data"
"10.540544","172.19.0.3","5.9.29.183","TLSv1.2","599","Application Data"
"10.540901","5.9.29.183","172.19.0.3","TCP","56","9002 → 43520 [ACK] Seq=369971 Ack=21091 Win=65535 Len=0"
"10.871499","5.9.29.183","172.19.0.3","TCP","1516","[TCP segment of a reassembled PDU]"
"10.871547","5.9.29.183","172.19.0.3","TCP","1492","9002 → 43520 [PSH, ACK] Seq=371431 Ack=21091 Win=65535 Len=1436 [TCP segment of a reassembled PDU]"
"10.871555","5.9.29.183","172.19.0.3","TLSv1.2","787","Application Data"
"10.871692","172.19.0.3","5.9.29.183","TCP","56","43520 → 9002 [ACK] Seq=21091 Ack=373598 Win=12722 Len=0"
"10.872030","172.19.0.3","5.9.29.183","TLSv1.2","599","Application Data"
"10.872223","5.9.29.183","172.19.0.3","TCP","56","9002 → 43520 [ACK] Seq=373598 Ack=21634 Win=65535 Len=0"
"10.883598","5.9.29.183","172.19.0.3","TCP","1504","[TCP segment of a reassembled PDU]"
"10.883811","5.9.29.183","172.19.0.3","TCP","1504","9002 → 43520 [PSH, ACK] Seq=375046 Ack=21634 Win=65535 Len=1448 [TCP segment of a reassembled PDU]"
"10.883826","172.19.0.3","5.9.29.183","TCP","56","43520 → 9002 [ACK] Seq=21634 Ack=376494 Win=12738 Len=0"
"10.887024","5.9.29.183","172.19.0.3","TLSv1.2","1330","Application Data, Application Data"
"10.927863","172.19.0.3","5.9.29.183","TCP","56","43520 → 9002 [ACK] Seq=21634 Ack=377768 Win=12738 Len=0"
"10.929079","5.9.29.183","172.19.0.3","TCP","1504","[TCP segment of a reassembled PDU]"
"10.929094","172.19.0.3","5.9.29.183","TCP","56","43520 → 9002 [ACK] Seq=21634 Ack=379216 Win=12736 Len=0"
"10.929459","5.9.29.183","172.19.0.3","TCP","1504","9002 → 43520 [PSH, ACK] Seq=379216 Ack=21634 Win=65535 Len=1448 [TCP segment of a reassembled PDU]"
"10.929473","172.19.0.3","5.9.29.183","TCP","56","43520 → 9002 [ACK] Seq=21634 Ack=380664 Win=12738 Len=0"
"10.929633","5.9.29.183","172.19.0.3","TLSv1.2","1237","Application Data"
"10.929639","5.9.29.183","172.19.0.3","TCP","1516","[TCP segment of a reassembled PDU]"
"10.929641","5.9.29.183","172.19.0.3","TCP","1492","9002 → 43520 [PSH, ACK] Seq=383305 Ack=21634 Win=65535 Len=1436 [TCP segment of a reassembled PDU]"
"10.929654","172.19.0.3","5.9.29.183","TCP","56","43520 → 9002 [ACK] Seq=21634 Ack=381845 Win=12738 Len=0"
"10.929792","172.19.0.3","5.9.29.183","TCP","56","43520 → 9002 [ACK] Seq=21634 Ack=383305 Win=12730 Len=0"
"10.929839","172.19.0.3","5.9.29.183","TCP","56","43520 → 9002 [ACK] Seq=21634 Ack=384741 Win=12722 Len=0"
"10.937646","5.9.29.183","172.19.0.3","TLSv1.2","1516","Application Data [TCP segment of a reassembled PDU]"
"10.937669","172.19.0.3","5.9.29.183","TCP","56","43520 → 9002 [ACK] Seq=21634 Ack=386201 Win=12738 Len=0"
"10.937730","5.9.29.183","172.19.0.3","TCP","1516","9002 → 43520 [PSH, ACK] Seq=386201 Ack=21634 Win=65535 Len=1460 [TCP segment of a reassembled PDU]"
"10.937747","172.19.0.3","5.9.29.183","TCP","56","43520 → 9002 [ACK] Seq=21634 Ack=387661 Win=12730 Len=0"
"10.937751","5.9.29.183","172.19.0.3","TCP","1516","9002 → 43520 [PSH, ACK] Seq=387661 Ack=21634 Win=65535 Len=1460 [TCP segment of a reassembled PDU]"
"10.937760","172.19.0.3","5.9.29.183","TCP","56","43520 → 9002 [ACK] Seq=21634 Ack=389121 Win=12722 Len=0"
"10.937762","5.9.29.183","172.19.0.3","TLSv1.2","1516","Application Data [TCP segment of a reassembled PDU]"
"10.937772","172.19.0.3","5.9.29.183","TCP","56","43520 → 9002 [ACK] Seq=21634 Ack=390581 Win=12714 Len=0"
"10.937774","5.9.29.183","172.19.0.3","TCP","1456","9002 → 43520 [PSH, ACK] Seq=390581 Ack=21634 Win=65535 Len=1400 [TCP segment of a reassembled PDU]"
"10.937781","172.19.0.3","5.9.29.183","TCP","56","43520 → 9002 [ACK] Seq=21634 Ack=391981 Win=12706 Len=0"
"10.945034","5.9.29.183","172.19.0.3","TCP","1516","9002 → 43520 [PSH, ACK] Seq=391981 Ack=21634 Win=65535 Len=1460 [TCP segment of a reassembled PDU]"
"10.945059","172.19.0.3","5.9.29.183","TCP","56","43520 → 9002 [ACK] Seq=21634 Ack=393441 Win=12738 Len=0"
"10.945117","5.9.29.183","172.19.0.3","TLSv1.2","1492","Application Data [TCP segment of a reassembled PDU]"
"10.945134","172.19.0.3","5.9.29.183","TCP","56","43520 → 9002 [ACK] Seq=21634 Ack=394877 Win=12730 Len=0"
"10.955036","5.9.29.183","172.19.0.3","TCP","1504","9002 → 43520 [PSH, ACK] Seq=394877 Ack=21634 Win=65535 Len=1448 [TCP segment of a reassembled PDU]"
"10.955246","172.19.0.3","5.9.29.183","TCP","56","43520 → 9002 [ACK] Seq=21634 Ack=396325 Win=12738 Len=0"
"10.960252","5.9.29.183","172.19.0.3","TLSv1.2","1516","Application Data [TCP segment of a reassembled PDU]"
"10.960314","5.9.29.183","172.19.0.3","TCP","1492","9002 → 43520 [PSH, ACK] Seq=397785 Ack=21634 Win=65535 Len=1436 [TCP segment of a reassembled PDU]"
"10.960458","172.19.0.3","5.9.29.183","TCP","56","43520 → 9002 [ACK] Seq=21634 Ack=399221 Win=12730 Len=0"
"10.960565","5.9.29.183","172.19.0.3","TCP","1516","9002 → 43520 [PSH, ACK] Seq=399221 Ack=21634 Win=65535 Len=1460 [TCP segment of a reassembled PDU]"
"10.960574","5.9.29.183","172.19.0.3","TLSv1.2","1516","Application Data, Application Data"
"10.960665","5.9.29.183","172.19.0.3","TCP","1480","9002 → 43520 [PSH, ACK] Seq=402141 Ack=21634 Win=65535 Len=1424 [TCP segment of a reassembled PDU]"
"10.960699","5.9.29.183","172.19.0.3","TCP","1516","9002 → 43520 [PSH, ACK] Seq=403565 Ack=21634 Win=65535 Len=1460 [TCP segment of a reassembled PDU]"
"10.960722","5.9.29.183","172.19.0.3","TLSv1.2","1330","Application Data, Application Data"
"10.960820","172.19.0.3","5.9.29.183","TLSv1.2","599","Application Data"
"10.961020","5.9.29.183","172.19.0.3","TCP","56","9002 → 43520 [ACK] Seq=406299 Ack=22177 Win=65535 Len=0"
"10.986750","5.9.29.183","172.19.0.3","TCP","1504","[TCP segment of a reassembled PDU]"
"10.986852","5.9.29.183","172.19.0.3","TCP","1504","9002 → 43520 [PSH, ACK] Seq=407747 Ack=22177 Win=65535 Len=1448 [TCP segment of a reassembled PDU]"
"10.986870","172.19.0.3","5.9.29.183","TCP","56","43520 → 9002 [ACK] Seq=22177 Ack=409195 Win=12728 Len=0"
"10.986936","5.9.29.183","172.19.0.3","TLSv1.2","273","Application Data"
"11.027798","172.19.0.3","5.9.29.183","TCP","56","43520 → 9002 [ACK] Seq=22177 Ack=409412 Win=12738 Len=0"
"11.160686","5.9.29.183","172.19.0.3","TCP","1516","[TCP segment of a reassembled PDU]"
"11.160748","5.9.29.183","172.19.0.3","TCP","1492","9002 → 43520 [PSH, ACK] Seq=410872 Ack=22177 Win=65535 Len=1436 [TCP segment of a reassembled PDU]"
"11.160760","5.9.29.183","172.19.0.3","TLSv1.2","787","Application Data"
"11.160929","172.19.0.3","5.9.29.183","TCP","56","43520 → 9002 [ACK] Seq=22177 Ack=413039 Win=12722 Len=0"
"11.165982","172.19.0.3","5.9.29.183","TLSv1.2","599","Application Data"
"11.166259","5.9.29.183","172.19.0.3","TCP","56","9002 → 43520 [ACK] Seq=413039 Ack=22720 Win=65535 Len=0"
"11.858295","5.9.29.183","172.19.0.3","TLSv1.2","599","Application Data"
"11.859167","172.19.0.3","5.9.29.183","TLSv1.2","599","Application Data"
"11.859510","5.9.29.183","172.19.0.3","TCP","56","9002 → 43520 [ACK] Seq=413582 Ack=23263 Win=65535 Len=0"
"12.164634","5.9.29.183","172.19.0.3","TCP","1516","[TCP segment of a reassembled PDU]"
"12.164683","5.9.29.183","172.19.0.3","TCP","1516","9002 → 43520 [PSH, ACK] Seq=415042 Ack=23263 Win=65535 Len=1460 [TCP segment of a reassembled PDU]"
"12.164693","5.9.29.183","172.19.0.3","TLSv1.2","763","Application Data"
"12.164804","172.19.0.3","5.9.29.183","TCP","56","43520 → 9002 [ACK] Seq=23263 Ack=417209 Win=12722 Len=0"
"12.189162","5.9.29.183","172.19.0.3","TLSv1.2","599","Application Data"
"12.198918","5.9.29.183","172.19.0.3","TCP","1516","[TCP segment of a reassembled PDU]"
"12.198984","172.19.0.3","5.9.29.183","TCP","56","43520 → 9002 [ACK] Seq=23263 Ack=419212 Win=12738 Len=0"
"12.199002","5.9.29.183","172.19.0.3","TCP","1516","9002 → 43520 [PSH, ACK] Seq=419212 Ack=23263 Win=65535 Len=1460 [TCP segment of a reassembled PDU]"
"12.199013","5.9.29.183","172.19.0.3","TLSv1.2","1516","Application Data [TCP segment of a reassembled PDU]"
"12.199155","5.9.29.183","172.19.0.3","TCP","1468","9002 → 43520 [PSH, ACK] Seq=422132 Ack=23263 Win=65535 Len=1412 [TCP segment of a reassembled PDU]"
"12.199165","5.9.29.183","172.19.0.3","TCP","1504","9002 → 43520 [PSH, ACK] Seq=423544 Ack=23263 Win=65535 Len=1448 [TCP segment of a reassembled PDU]"
"12.199248","172.19.0.3","5.9.29.183","TCP","56","43520 → 9002 [ACK] Seq=23263 Ack=424992 Win=12706 Len=0"
"12.204409","5.9.29.183","172.19.0.3","TLSv1.2","584","Application Data"
"12.204918","172.19.0.3","5.9.29.183","TLSv1.2","599","Application Data"
"12.205295","5.9.29.183","172.19.0.3","TCP","56","9002 → 43520 [ACK] Seq=425520 Ack=23806 Win=65535 Len=0"
"12.218937","5.9.29.183","172.19.0.3","TCP","1504","[TCP segment of a reassembled PDU]"
"12.218970","5.9.29.183","172.19.0.3","TCP","1504","9002 → 43520 [PSH, ACK] Seq=426968 Ack=23806 Win=65535 Len=1448 [TCP segment of a reassembled PDU]"
"12.219126","172.19.0.3","5.9.29.183","TCP","56","43520 → 9002 [ACK] Seq=23806 Ack=428416 Win=12730 Len=0"
"12.219417","5.9.29.183","172.19.0.3","TLSv1.2","787","Application Data"
"12.243058","5.9.29.183","172.19.0.3","TCP","1516","[TCP segment of a reassembled PDU]"
"12.243089","172.19.0.3","5.9.29.183","TCP","56","43520 → 9002 [ACK] Seq=23806 Ack=430607 Win=12738 Len=0"
"12.243111","5.9.29.183","172.19.0.3","TCP","1492","9002 → 43520 [PSH, ACK] Seq=430607 Ack=23806 Win=65535 Len=1436 [TCP segment of a reassembled PDU]"
"12.243280","5.9.29.183","172.19.0.3","TLSv1.2","273","Application Data"
"12.243366","172.19.0.3","5.9.29.183","TCP","56","43520 → 9002 [ACK] Seq=23806 Ack=432260 Win=12726 Len=0"
"12.250446","5.9.29.183","172.19.0.3","TCP","650","[TCP segment of a reassembled PDU]"
"12.250594","5.9.29.183","172.19.0.3","TCP","910","9002 → 43520 [PSH, ACK] Seq=432854 Ack=23806 Win=65535 Len=854 [TCP segment of a reassembled PDU]"
"12.250602","5.9.29.183","172.19.0.3","TCP","1516","9002 → 43520 [PSH, ACK] Seq=433708 Ack=23806 Win=65535 Len=1460 [TCP segment of a reassembled PDU]"
"12.250605","5.9.29.183","172.19.0.3","TLSv1.2","1516","Application Data [TCP segment of a reassembled PDU]"
"12.250608","5.9.29.183","172.19.0.3","TCP","1480","9002 → 43520 [PSH, ACK] Seq=436628 Ack=23806 Win=65535 Len=1424 [TCP segment of a reassembled PDU]"
"12.250690","172.19.0.3","5.9.29.183","TCP","56","43520 → 9002 [ACK] Seq=23806 Ack=438052 Win=12704 Len=0"
"12.258828","5.9.29.183","172.19.0.3","TCP","1516","9002 → 43520 [PSH, ACK] Seq=438052 Ack=23806 Win=65535 Len=1460 [TCP segment of a reassembled PDU]"
"12.258865","5.9.29.183","172.19.0.3","TLSv1.2","601","Application Data, Application Data"
"12.258884","172.19.0.3","5.9.29.183","TCP","56","43520 → 9002 [ACK] Seq=23806 Ack=440057 Win=12730 Len=0"
"12.259307","172.19.0.3","5.9.29.183","TLSv1.2","599","Application Data"
"12.259671","5.9.29.183","172.19.0.3","TCP","56","9002 → 43520 [ACK] Seq=440057 Ack=24349 Win=65535 Len=0"
"12.262587","5.9.29.183","172.19.0.3","TCP","1504","[TCP segment of a reassembled PDU]"
"12.274272","5.9.29.183","172.19.0.3","TCP","1504","9002 → 43520 [PSH, ACK] Seq=441505 Ack=24349 Win=65535 Len=1448 [TCP segment of a reassembled PDU]"
"12.274331","172.19.0.3","5.9.29.183","TCP","56","43520 → 9002 [ACK] Seq=24349 Ack=442953 Win=12738 Len=0"
"12.274484","5.9.29.183","172.19.0.3","TLSv1.2","1504","Application Data [TCP segment of a reassembled PDU]"
"12.274689","5.9.29.183","172.19.0.3","TCP","1516","9002 → 43520 [PSH, ACK] Seq=444401 Ack=24349 Win=65535 Len=1460 [TCP segment of a reassembled PDU]"
"12.274700","5.9.29.183","172.19.0.3","TCP","1516","9002 → 43520 [PSH, ACK] Seq=445861 Ack=24349 Win=65535 Len=1460 [TCP segment of a reassembled PDU]"
"12.274853","5.9.29.183","172.19.0.3","TLSv1.2","1480","Application Data [TCP segment of a reassembled PDU]"
"12.274860","5.9.29.183","172.19.0.3","TCP","1516","9002 → 43520 [PSH, ACK] Seq=448745 Ack=24349 Win=65535 Len=1460 [TCP segment of a reassembled PDU]"
"12.274865","5.9.29.183","172.19.0.3","TLSv1.2","275","Application Data"
"12.275002","172.19.0.3","5.9.29.183","TCP","56","43520 → 9002 [ACK] Seq=24349 Ack=450424 Win=12690 Len=0"
"12.294695","5.9.29.183","172.19.0.3","TCP","1516","[TCP segment of a reassembled PDU]"
"12.294725","5.9.29.183","172.19.0.3","TCP","1516","9002 → 43520 [PSH, ACK] Seq=451884 Ack=24349 Win=65535 Len=1460 [TCP segment of a reassembled PDU]"
"12.294739","172.19.0.3","5.9.29.183","TCP","56","43520 → 9002 [ACK] Seq=24349 Ack=453344 Win=12730 Len=0"
"12.294742","5.9.29.183","172.19.0.3","TLSv1.2","1213","Application Data"
"12.294745","5.9.29.183","172.19.0.3","TCP","1516","[TCP segment of a reassembled PDU]"
"12.294748","5.9.29.183","172.19.0.3","TCP","1492","9002 → 43520 [PSH, ACK] Seq=455961 Ack=24349 Win=65535 Len=1436 [TCP segment of a reassembled PDU]"
"12.294915","172.19.0.3","5.9.29.183","TCP","56","43520 → 9002 [ACK] Seq=24349 Ack=457397 Win=12706 Len=0"
"12.310154","5.9.29.183","172.19.0.3","TLSv1.2","851","Application Data"
"12.337062","5.9.29.183","172.19.0.3","TCP","1516","[TCP segment of a reassembled PDU]"
"12.337093","172.19.0.3","5.9.29.183","TCP","56","43520 → 9002 [ACK] Seq=24349 Ack=459652 Win=12736 Len=0"
"12.337341","5.9.29.183","172.19.0.3","TCP","1492","9002 → 43520 [PSH, ACK] Seq=459652 Ack=24349 Win=65535 Len=1436 [TCP segment of a reassembled PDU]"
"12.337492","5.9.29.183","172.19.0.3","TLSv1.2","1516","Application Data [TCP segment of a reassembled PDU]"
"12.337501","172.19.0.3","5.9.29.183","TCP","56","43520 → 9002 [ACK] Seq=24349 Ack=462548 Win=12738 Len=0"
"12.337503","5.9.29.183","172.19.0.3","TCP","1516","9002 → 43520 [PSH, ACK] Seq=462548 Ack=24349 Win=65535 Len=1460 [TCP segment of a reassembled PDU]"
"12.337507","5.9.29.183","172.19.0.3","TCP","1516","9002 → 43520 [PSH, ACK] Seq=464008 Ack=24349 Win=65535 Len=1460 [TCP segment of a reassembled PDU]"
"12.337510","5.9.29.183","172.19.0.3","TLSv1.2","1516","Application Data [TCP segment of a reassembled PDU]"
"12.337566","5.9.29.183","172.19.0.3","TCP","1516","9002 → 43520 [PSH, ACK] Seq=466928 Ack=24349 Win=65535 Len=1460 [TCP segment of a reassembled PDU]"
"12.337573","5.9.29.183","172.19.0.3","TCP","1177","9002 → 43520 [PSH, ACK] Seq=468388 Ack=24349 Win=65535 Len=1121 [TCP segment of a reassembled PDU]"
"12.337602","172.19.0.3","5.9.29.183","TCP","56","43520 → 9002 [ACK] Seq=24349 Ack=469509 Win=12698 Len=0"
"12.338147","172.19.0.3","5.9.29.183","TLSv1.2","599","Application Data"
"12.338391","5.9.29.183","172.19.0.3","TCP","56","9002 → 43520 [ACK] Seq=469509 Ack=24892 Win=65535 Len=0"
"12.352791","5.9.29.183","172.19.0.3","TLSv1.2","1504","Application Data [TCP segment of a reassembled PDU]"
"12.352824","5.9.29.183","172.19.0.3","TCP","1504","9002 → 43520 [PSH, ACK] Seq=470957 Ack=24892 Win=65535 Len=1448 [TCP segment of a reassembled PDU]"
"12.352841","172.19.0.3","5.9.29.183","TCP","56","43520 → 9002 [ACK] Seq=24892 Ack=472405 Win=12730 Len=0"
"12.354030","5.9.29.183","172.19.0.3","TCP","1504","9002 → 43520 [PSH, ACK] Seq=472405 Ack=24892 Win=65535 Len=1448 [TCP segment of a reassembled PDU]"
"12.354044","5.9.29.183","172.19.0.3","TLSv1.2","988","Application Data, Application Data"
"12.354054","172.19.0.3","5.9.29.183","TCP","56","43520 → 9002 [ACK] Seq=24892 Ack=474785 Win=12730 Len=0"
