_ws.col.Time,_ws.col.Source,_ws.col.Destination,_ws.col.Protocol,_ws.col.Length,_ws.col.Info
"0.000000","172.18.0.2","54.38.73.16","TLSv1.2","611","Application Data"
"0.026058","54.38.73.16","172.18.0.2","TCP","68","21002 → 36876 [ACK] Seq=1 Ack=544 Win=1452 Len=0 TSval=2676431311 TSecr=1089128556"
"0.260189","54.38.73.16","172.18.0.2","TLSv1.2","611","Application Data"
"0.260249","172.18.0.2","54.38.73.16","TCP","68","36876 → 21002 [ACK] Seq=544 Ack=544 Win=5608 Len=0 TSval=1089128816 TSecr=2676431367"
"0.261389","172.18.0.2","54.38.73.16","TLSv1.2","2153","Application Data"
"0.286606","54.38.73.16","172.18.0.2","TCP","68","21002 → 36876 [ACK] Seq=544 Ack=2629 Win=1450 Len=0 TSval=2676431376 TSecr=1089128817"
"0.567056","54.38.73.16","172.18.0.2","TLSv1.2","1639","Application Data"
"0.567106","172.18.0.2","54.38.73.16","TCP","68","36876 → 21002 [ACK] Seq=2629 Ack=2115 Win=5600 Len=0 TSval=1089129123 TSecr=2676431440"
"0.574647","172.18.0.2","54.38.73.16","TLSv1.2","611","Application Data"
"0.598604","54.38.73.16","172.18.0.2","TCP","68","21002 → 36876 [ACK] Seq=2115 Ack=3172 Win=1452 Len=0 TSval=2676431454 TSecr=1089129130"
"0.874797","54.38.73.16","172.18.0.2","TLSv1.2","611","Application Data"
"0.875811","172.18.0.2","54.38.73.16","TLSv1.2","611","Application Data"
"0.900317","54.38.73.16","172.18.0.2","TCP","68","21002 → 36876 [ACK] Seq=2658 Ack=3715 Win=1452 Len=0 TSval=2676431530 TSecr=1089129431"
"1.231550","54.38.73.16","172.18.0.2","TCP","2964","[TCP segment of a reassembled PDU]"
"1.231654","54.38.73.16","172.18.0.2","TLSv1.2","799","Application Data"
"1.231745","172.18.0.2","54.38.73.16","TCP","68","36876 → 21002 [ACK] Seq=3715 Ack=6285 Win=5584 Len=0 TSval=1089129787 TSecr=2676431612"
"1.255028","54.38.73.16","172.18.0.2","TLSv1.2","611","Application Data"
"1.284272","54.38.73.16","172.18.0.2","TLSv1.2","7308","Application Data"
"1.284425","172.18.0.2","54.38.73.16","TCP","68","36876 → 21002 [ACK] Seq=3715 Ack=14068 Win=5565 Len=0 TSval=1089129840 TSecr=2676431618"
"1.296457","54.38.73.16","172.18.0.2","TLSv1.2","2964","Application Data [TCP segment of a reassembled PDU]"
"1.296491","172.18.0.2","54.38.73.16","TCP","68","36876 → 21002 [ACK] Seq=3715 Ack=16964 Win=5596 Len=0 TSval=1089129852 TSecr=2676431628"
"1.308821","54.38.73.16","172.18.0.2","TLSv1.2","4954","Application Data, Application Data"
"1.309001","172.18.0.2","54.38.73.16","TCP","68","36876 → 21002 [ACK] Seq=3715 Ack=21850 Win=5584 Len=0 TSval=1089129865 TSecr=2676431632"
"1.309467","172.18.0.2","54.38.73.16","TLSv1.2","611","Application Data"
"1.316909","54.38.73.16","172.18.0.2","TCP","2964","[TCP segment of a reassembled PDU]"
"1.316942","172.18.0.2","54.38.73.16","TCP","68","36876 → 21002 [ACK] Seq=4258 Ack=24746 Win=5596 Len=0 TSval=1089129873 TSecr=2676431634"
"1.320680","54.38.73.16","172.18.0.2","TLSv1.2","2964","Application Data [TCP segment of a reassembled PDU]"
"1.320714","172.18.0.2","54.38.73.16","TCP","68","36876 → 21002 [ACK] Seq=4258 Ack=27642 Win=5596 Len=0 TSval=1089129876 TSecr=2676431635"
"1.333300","54.38.73.16","172.18.0.2","TLSv1.2","2964","Application Data [TCP segment of a reassembled PDU]"
"1.333333","172.18.0.2","54.38.73.16","TCP","68","36876 → 21002 [ACK] Seq=4258 Ack=30538 Win=5596 Len=0 TSval=1089129889 TSecr=2676431638"
"1.334283","54.38.73.16","172.18.0.2","TCP","68","[TCP Previous segment not captured] 21002 → 36876 [ACK] Seq=33434 Ack=4258 Win=1452 Len=0 TSval=2676431638 TSecr=1089129865"
"1.334344","172.18.0.2","54.38.73.16","TLSv1.2","611","Application Data"
"1.334312","54.38.73.16","172.18.0.2","TCP","2964","[TCP Retransmission] 21002 → 36876 [ACK] Seq=30538 Ack=3715 Win=1452 Len=2896 TSval=2676431638 TSecr=1089129865"
"1.334483","172.18.0.2","54.38.73.16","TCP","68","36876 → 21002 [ACK] Seq=4801 Ack=33434 Win=5596 Len=0 TSval=1089129890 TSecr=2676431638"
"1.339983","54.38.73.16","172.18.0.2","TLSv1.2","1479","Ignored Unknown Record"
"1.349399","54.38.73.16","172.18.0.2","TCP","2964","[TCP segment of a reassembled PDU]"
"1.349433","172.18.0.2","54.38.73.16","TCP","68","36876 → 21002 [ACK] Seq=4801 Ack=37741 Win=5596 Len=0 TSval=1089129905 TSecr=2676431640"
"1.375076","54.38.73.16","172.18.0.2","TLSv1.2","799","Application Data"
"1.383617","172.18.0.2","54.38.73.16","TLSv1.2","611","Application Data"
"1.446945","54.38.73.16","172.18.0.2","TCP","68","21002 → 36876 [ACK] Seq=38472 Ack=5344 Win=1452 Len=0 TSval=2676431667 TSecr=1089129939"
"1.620411","54.38.73.16","172.18.0.2","TLSv1.2","611","Application Data"
"1.621450","172.18.0.2","54.38.73.16","TLSv1.2","611","Application Data"
"1.646164","54.38.73.16","172.18.0.2","TCP","68","21002 → 36876 [ACK] Seq=39015 Ack=5887 Win=1452 Len=0 TSval=2676431716 TSecr=1089130177"
"1.873664","54.38.73.16","172.18.0.2","TLSv1.2","611","Application Data"
"1.915032","172.18.0.2","54.38.73.16","TCP","68","36876 → 21002 [ACK] Seq=5887 Ack=39558 Win=5612 Len=0 TSval=1089130471 TSecr=2676431773"
"1.917500","54.38.73.16","172.18.0.2","TCP","2964","[TCP segment of a reassembled PDU]"
"1.917533","172.18.0.2","54.38.73.16","TCP","68","36876 → 21002 [ACK] Seq=5887 Ack=42454 Win=5596 Len=0 TSval=1089130473 TSecr=2676431784"
"1.930176","54.38.73.16","172.18.0.2","TLSv1.2","4412","Application Data [TCP segment of a reassembled PDU]"
"1.930233","172.18.0.2","54.38.73.16","TCP","68","36876 → 21002 [ACK] Seq=5887 Ack=46798 Win=5580 Len=0 TSval=1089130486 TSecr=2676431787"
"1.939745","54.38.73.16","172.18.0.2","TLSv1.2","625","Application Data, Application Data"
"1.939780","172.18.0.2","54.38.73.16","TCP","68","36876 → 21002 [ACK] Seq=5887 Ack=47355 Win=5593 Len=0 TSval=1089130495 TSecr=2676431790"
"1.941295","54.38.73.16","172.18.0.2","TCP","2964","[TCP segment of a reassembled PDU]"
"1.941317","172.18.0.2","54.38.73.16","TCP","68","36876 → 21002 [ACK] Seq=5887 Ack=50251 Win=5596 Len=0 TSval=1089130497 TSecr=2676431790"
"1.953626","54.38.73.16","172.18.0.2","TLSv1.2","2964","Application Data [TCP segment of a reassembled PDU]"
"1.953661","172.18.0.2","54.38.73.16","TCP","68","36876 → 21002 [ACK] Seq=5887 Ack=53147 Win=5596 Len=0 TSval=1089130509 TSecr=2676431793"
"1.954253","54.38.73.16","172.18.0.2","TCP","1516","21002 → 36876 [ACK] Seq=53147 Ack=5887 Win=1452 Len=1448 TSval=2676431793 TSecr=1089130486 [TCP segment of a reassembled PDU]"
"1.954285","172.18.0.2","54.38.73.16","TCP","68","36876 → 21002 [ACK] Seq=5887 Ack=54595 Win=5593 Len=0 TSval=1089130510 TSecr=2676431793"
"1.963881","54.38.73.16","172.18.0.2","TLSv1.2","625","Application Data, Application Data"
"1.963929","172.18.0.2","54.38.73.16","TCP","68","36876 → 21002 [ACK] Seq=5887 Ack=55152 Win=5593 Len=0 TSval=1089130520 TSecr=2676431796"
"1.975663","54.38.73.16","172.18.0.2","TLSv1.2","4412","Application Data"
"1.975718","172.18.0.2","54.38.73.16","TCP","68","36876 → 21002 [ACK] Seq=5887 Ack=59496 Win=5580 Len=0 TSval=1089130531 TSecr=2676431799"
"1.991642","54.38.73.16","172.18.0.2","TLSv1.2","408","Application Data"
"1.991677","172.18.0.2","54.38.73.16","TCP","68","36876 → 21002 [ACK] Seq=5887 Ack=59836 Win=5593 Len=0 TSval=1089130547 TSecr=2676431802"
"2.011161","54.38.73.16","172.18.0.2","TCP","2964","[TCP segment of a reassembled PDU]"
"2.011198","172.18.0.2","54.38.73.16","TCP","68","36876 → 21002 [ACK] Seq=5887 Ack=62732 Win=5596 Len=0 TSval=1089130567 TSecr=2676431807"
"2.021280","54.38.73.16","172.18.0.2","TLSv1.2","285","Application Data"
"2.021317","172.18.0.2","54.38.73.16","TCP","68","36876 → 21002 [ACK] Seq=5887 Ack=62949 Win=5595 Len=0 TSval=1089130577 TSecr=2676431810"
"2.029557","172.18.0.2","54.38.73.16","TLSv1.2","611","Application Data"
"2.054488","54.38.73.16","172.18.0.2","TCP","68","21002 → 36876 [ACK] Seq=62949 Ack=6430 Win=1452 Len=0 TSval=2676431818 TSecr=1089130585"
"2.310490","54.38.73.16","172.18.0.2","TLSv1.2","611","Application Data"
"2.310547","172.18.0.2","54.38.73.16","TCP","68","36876 → 21002 [ACK] Seq=6430 Ack=63492 Win=5608 Len=0 TSval=1089130866 TSecr=2676431870"
"2.311600","172.18.0.2","54.38.73.16","TLSv1.2","611","Application Data"
"2.335278","54.38.73.16","172.18.0.2","TCP","68","21002 → 36876 [ACK] Seq=63492 Ack=6973 Win=1452 Len=0 TSval=2676431889 TSecr=1089130867"
"2.575977","54.38.73.16","172.18.0.2","TLSv1.2","3695","Application Data"
"2.576036","172.18.0.2","54.38.73.16","TCP","68","36876 → 21002 [ACK] Seq=6973 Ack=67119 Win=5584 Len=0 TSval=1089131132 TSecr=2676431948"
"2.595964","54.38.73.16","172.18.0.2","TLSv1.2","2964","Application Data"
"2.595997","172.18.0.2","54.38.73.16","TCP","68","36876 → 21002 [ACK] Seq=6973 Ack=70015 Win=5596 Len=0 TSval=1089131152 TSecr=2676431953"
"2.600667","54.38.73.16","172.18.0.2","TLSv1.2","1342","Application Data"
"2.600702","172.18.0.2","54.38.73.16","TCP","68","36876 → 21002 [ACK] Seq=6973 Ack=71289 Win=5593 Len=0 TSval=1089131156 TSecr=2676431955"
"2.606399","54.38.73.16","172.18.0.2","TCP","2964","[TCP segment of a reassembled PDU]"
"2.606433","172.18.0.2","54.38.73.16","TCP","68","36876 → 21002 [ACK] Seq=6973 Ack=74185 Win=5596 Len=0 TSval=1089131162 TSecr=2676431956"
"2.627021","54.38.73.16","172.18.0.2","TLSv1.2","1342","Application Data, Application Data"
"2.627058","172.18.0.2","54.38.73.16","TCP","68","36876 → 21002 [ACK] Seq=6973 Ack=75459 Win=5593 Len=0 TSval=1089131183 TSecr=2676431961"
"2.627517","172.18.0.2","54.38.73.16","TLSv1.2","611","Application Data"
"2.639002","54.38.73.16","172.18.0.2","TLSv1.2","2964","Application Data"
"2.639038","172.18.0.2","54.38.73.16","TCP","68","36876 → 21002 [ACK] Seq=7516 Ack=78355 Win=5596 Len=0 TSval=1089131195 TSecr=2676431964"
"2.651349","54.38.73.16","172.18.0.2","TLSv1.2","1342","Application Data"
"2.651358","54.38.73.16","172.18.0.2","TCP","68","21002 → 36876 [ACK] Seq=79629 Ack=7516 Win=1452 Len=0 TSval=2676431968 TSecr=1089131183"
"2.673036","54.38.73.16","172.18.0.2","TCP","2964","[TCP segment of a reassembled PDU]"
"2.673070","172.18.0.2","54.38.73.16","TCP","68","36876 → 21002 [ACK] Seq=7516 Ack=82525 Win=5596 Len=0 TSval=1089131229 TSecr=2676431968"
"2.698142","54.38.73.16","172.18.0.2","TLSv1.2","1342","Application Data, Application Data"
"2.711505","54.38.73.16","172.18.0.2","TCP","2964","[TCP segment of a reassembled PDU]"
"2.711538","172.18.0.2","54.38.73.16","TCP","68","36876 → 21002 [ACK] Seq=7516 Ack=86695 Win=5596 Len=0 TSval=1089131267 TSecr=2676431979"
"2.722580","54.38.73.16","172.18.0.2","TLSv1.2","4412","Application Data [TCP segment of a reassembled PDU]"
"2.722724","172.18.0.2","54.38.73.16","TCP","68","36876 → 21002 [ACK] Seq=7516 Ack=91039 Win=5580 Len=0 TSval=1089131278 TSecr=2676431985"
"2.733427","54.38.73.16","172.18.0.2","TLSv1.2","1516","Application Data, Application Data"
"2.733919","172.18.0.2","54.38.73.16","TLSv1.2","611","Application Data"
"2.736340","54.38.73.16","172.18.0.2","TLSv1.2","1262","Application Data"
"2.779034","172.18.0.2","54.38.73.16","TCP","68","36876 → 21002 [ACK] Seq=8059 Ack=93681 Win=5612 Len=0 TSval=1089131335 TSecr=2676431989"
"2.795426","54.38.73.16","172.18.0.2","TCP","68","21002 → 36876 [ACK] Seq=93681 Ack=8059 Win=1452 Len=0 TSval=2676432004 TSecr=1089131290"
"2.795472","172.18.0.2","54.38.73.16","TLSv1.2","611","Application Data"
"2.822904","54.38.73.16","172.18.0.2","TCP","68","21002 → 36876 [ACK] Seq=93681 Ack=8602 Win=1452 Len=0 TSval=2676432010 TSecr=1089131351"
"3.539667","54.38.73.16","172.18.0.2","TLSv1.2","611","Application Data"
"3.539726","172.18.0.2","54.38.73.16","TCP","68","36876 → 21002 [ACK] Seq=8602 Ack=94224 Win=5608 Len=0 TSval=1089132095 TSecr=2676432112"
"3.539883","54.38.73.16","172.18.0.2","TLSv1.2","611","[TCP Spurious Retransmission] , Application Data"
"3.539917","172.18.0.2","54.38.73.16","TCP","80","[TCP Window Update] 36876 → 21002 [ACK] Seq=8602 Ack=94224 Win=5612 Len=0 TSval=1089132096 TSecr=2676432171 SLE=93681 SRE=94224"
"3.540782","172.18.0.2","54.38.73.16","TLSv1.2","611","Application Data"
"3.565316","54.38.73.16","172.18.0.2","TCP","68","21002 → 36876 [ACK] Seq=94224 Ack=9145 Win=1452 Len=0 TSval=2676432196 TSecr=1089132096"
"3.798588","54.38.73.16","172.18.0.2","TLSv1.2","3695","Application Data"
"3.798646","172.18.0.2","54.38.73.16","TCP","68","36876 → 21002 [ACK] Seq=9145 Ack=97851 Win=5584 Len=0 TSval=1089132354 TSecr=2676432254"
"3.822484","54.38.73.16","172.18.0.2","TLSv1.2","611","Application Data"
"3.822516","172.18.0.2","54.38.73.16","TCP","68","36876 → 21002 [ACK] Seq=9145 Ack=98394 Win=5593 Len=0 TSval=1089132378 TSecr=2676432260"
"3.834015","54.38.73.16","172.18.0.2","TCP","2964","[TCP segment of a reassembled PDU]"
"3.834082","172.18.0.2","54.38.73.16","TCP","68","36876 → 21002 [ACK] Seq=9145 Ack=101290 Win=5596 Len=0 TSval=1089132390 TSecr=2676432263"
"3.845702","54.38.73.16","172.18.0.2","TLSv1.2","2964","Application Data [TCP segment of a reassembled PDU]"
"3.845732","172.18.0.2","54.38.73.16","TCP","68","36876 → 21002 [ACK] Seq=9145 Ack=104186 Win=5596 Len=0 TSval=1089132401 TSecr=2676432266"
"3.846608","54.38.73.16","172.18.0.2","TLSv1.2","2073","Application Data, Application Data"
"3.846638","172.18.0.2","54.38.73.16","TCP","68","36876 → 21002 [ACK] Seq=9145 Ack=106191 Win=5599 Len=0 TSval=1089132402 TSecr=2676432266"
"3.856731","54.38.73.16","172.18.0.2","TCP","1516","[TCP segment of a reassembled PDU]"
"3.856759","172.18.0.2","54.38.73.16","TCP","68","36876 → 21002 [ACK] Seq=9145 Ack=107639 Win=5593 Len=0 TSval=1089132412 TSecr=2676432269"
"3.863614","54.38.73.16","172.18.0.2","TLSv1.2","2964","Application Data [TCP segment of a reassembled PDU]"
"3.863645","172.18.0.2","54.38.73.16","TCP","68","36876 → 21002 [ACK] Seq=9145 Ack=110535 Win=5596 Len=0 TSval=1089132419 TSecr=2676432270"
"3.871530","54.38.73.16","172.18.0.2","TCP","2964","21002 → 36876 [ACK] Seq=110535 Ack=9145 Win=1452 Len=2896 TSval=2676432273 TSecr=1089132401 [TCP segment of a reassembled PDU]"
"3.871568","172.18.0.2","54.38.73.16","TCP","68","36876 → 21002 [ACK] Seq=9145 Ack=113431 Win=5596 Len=0 TSval=1089132427 TSecr=2676432273"
"3.871535","54.38.73.16","172.18.0.2","TLSv1.2","2964","Application Data [TCP segment of a reassembled PDU]"
"3.871604","172.18.0.2","54.38.73.16","TCP","68","36876 → 21002 [ACK] Seq=9145 Ack=116327 Win=5581 Len=0 TSval=1089132427 TSecr=2676432273"
"3.887080","54.38.73.16","172.18.0.2","TLSv1.2","2964","Application Data [TCP segment of a reassembled PDU]"
"3.887114","172.18.0.2","54.38.73.16","TCP","68","36876 → 21002 [ACK] Seq=9145 Ack=119223 Win=5596 Len=0 TSval=1089132443 TSecr=2676432276"
"3.892931","54.38.73.16","172.18.0.2","TLSv1.2","1516","Application Data [TCP segment of a reassembled PDU]"
"3.892965","172.18.0.2","54.38.73.16","TCP","68","36876 → 21002 [ACK] Seq=9145 Ack=120671 Win=5593 Len=0 TSval=1089132449 TSecr=2676432278"
"3.893413","172.18.0.2","54.38.73.16","TLSv1.2","611","Application Data"
"3.897491","54.38.73.16","172.18.0.2","TLSv1.2","4412","Application Data [TCP segment of a reassembled PDU]"
"3.897548","172.18.0.2","54.38.73.16","TCP","68","36876 → 21002 [ACK] Seq=9688 Ack=125015 Win=5580 Len=0 TSval=1089132453 TSecr=2676432279"
"3.912173","54.38.73.16","172.18.0.2","TLSv1.2","2007","Application Data, Application Data"
"3.912205","172.18.0.2","54.38.73.16","TCP","68","36876 → 21002 [ACK] Seq=9688 Ack=126954 Win=5600 Len=0 TSval=1089132468 TSecr=2676432283"
"3.918263","54.38.73.16","172.18.0.2","TCP","68","[TCP Previous segment not captured] 21002 → 36876 [ACK] Seq=128402 Ack=9688 Win=1452 Len=0 TSval=2676432284 TSecr=1089132449"
"3.918317","172.18.0.2","54.38.73.16","TLSv1.2","611","Application Data"
"3.918280","54.38.73.16","172.18.0.2","TCP","1516","[TCP Retransmission] 21002 → 36876 [ACK] Seq=126954 Ack=9145 Win=1452 Len=1448 TSval=2676432284 TSecr=1089132449"
"3.926647","54.38.73.16","172.18.0.2","TLSv1.2","2964","Ignored Unknown Record"
"3.926785","172.18.0.2","54.38.73.16","TCP","68","36876 → 21002 [ACK] Seq=10231 Ack=131298 Win=5596 Len=0 TSval=1089132482 TSecr=2676432284"
"3.937611","54.38.73.16","172.18.0.2","TLSv1.2","922","Ignored Unknown Record"
"3.937644","54.38.73.16","172.18.0.2","TLSv1.2","4412","Application Data"
"3.937785","172.18.0.2","54.38.73.16","TCP","68","36876 → 21002 [ACK] Seq=10231 Ack=136496 Win=5583 Len=0 TSval=1089132493 TSecr=2676432289"
"3.950960","54.38.73.16","172.18.0.2","TCP","2964","21002 → 36876 [ACK] Seq=136496 Ack=10231 Win=1452 Len=2896 TSval=2676432292 TSecr=1089132474 [TCP segment of a reassembled PDU]"
"3.951003","172.18.0.2","54.38.73.16","TCP","68","36876 → 21002 [ACK] Seq=10231 Ack=139392 Win=5596 Len=0 TSval=1089132507 TSecr=2676432292"
"3.952800","54.38.73.16","172.18.0.2","TLSv1.2","1516","Application Data, Application Data"
"3.963589","54.38.73.16","172.18.0.2","TLSv1.2","3318","Application Data"
"3.963730","172.18.0.2","54.38.73.16","TCP","68","36876 → 21002 [ACK] Seq=10231 Ack=144090 Win=5612 Len=0 TSval=1089132519 TSecr=2676432293"
"3.965419","54.38.73.16","172.18.0.2","TCP","1516","[TCP segment of a reassembled PDU]"
"3.976625","54.38.73.16","172.18.0.2","TLSv1.2","2964","Application Data [TCP segment of a reassembled PDU]"
"3.976682","172.18.0.2","54.38.73.16","TCP","68","36876 → 21002 [ACK] Seq=10231 Ack=148434 Win=5596 Len=0 TSval=1089132532 TSecr=2676432296"
"3.976817","172.18.0.2","54.38.73.16","TLSv1.2","611","Application Data"
"3.989755","54.38.73.16","172.18.0.2","TLSv1.2","5860","Application Data [TCP segment of a reassembled PDU]"
"3.989830","172.18.0.2","54.38.73.16","TCP","68","36876 → 21002 [ACK] Seq=10774 Ack=154226 Win=5581 Len=0 TSval=1089132545 TSecr=2676432302"
"4.000672","54.38.73.16","172.18.0.2","TLSv1.2","1516","Application Data [TCP segment of a reassembled PDU]"
"4.000946","54.38.73.16","172.18.0.2","TCP","1516","21002 → 36876 [ACK] Seq=155674 Ack=10231 Win=1452 Len=1448 TSval=2676432305 TSecr=1089132532 [TCP segment of a reassembled PDU]"
"4.000959","172.18.0.2","54.38.73.16","TCP","68","36876 → 21002 [ACK] Seq=10774 Ack=157122 Win=5593 Len=0 TSval=1089132557 TSecr=2676432305"
"4.008005","54.38.73.16","172.18.0.2","TLSv1.2","1516","Application Data [TCP segment of a reassembled PDU]"
"4.015593","54.38.73.16","172.18.0.2","TLSv1.2","4412","Application Data [TCP segment of a reassembled PDU]"
"4.015715","172.18.0.2","54.38.73.16","TCP","68","36876 → 21002 [ACK] Seq=10774 Ack=162914 Win=5580 Len=0 TSval=1089132571 TSecr=2676432307"
"4.019938","54.38.73.16","172.18.0.2","TCP","1516","21002 → 36876 [ACK] Seq=162914 Ack=10774 Win=1452 Len=1448 TSval=2676432310 TSecr=1089132545 [TCP segment of a reassembled PDU]"
"4.026286","54.38.73.16","172.18.0.2","TLSv1.2","1587","Application Data, Application Data"
"4.026315","172.18.0.2","54.38.73.16","TCP","68","36876 → 21002 [ACK] Seq=10774 Ack=165881 Win=5601 Len=0 TSval=1089132582 TSecr=2676432310"
"4.036357","172.18.0.2","54.38.73.16","TLSv1.2","611","Application Data"
"4.099852","54.38.73.16","172.18.0.2","TCP","68","21002 → 36876 [ACK] Seq=165881 Ack=11317 Win=1452 Len=0 TSval=2676432330 TSecr=1089132592"
"4.663084","54.38.73.16","172.18.0.2","TLSv1.2","611","Application Data"
"4.664172","172.18.0.2","54.38.73.16","TLSv1.2","611","Application Data"
"4.687797","54.38.73.16","172.18.0.2","TCP","68","21002 → 36876 [ACK] Seq=166424 Ack=11860 Win=1452 Len=0 TSval=2676432477 TSecr=1089133220"
"5.014519","54.38.73.16","172.18.0.2","TLSv1.2","611","Application Data"
"5.054959","172.18.0.2","54.38.73.16","TCP","68","36876 → 21002 [ACK] Seq=11860 Ack=166967 Win=5612 Len=0 TSval=1089133611 TSecr=2676432558"
"5.066516","54.38.73.16","172.18.0.2","TLSv1.2","7308","Application Data"
"5.066565","172.18.0.2","54.38.73.16","TCP","68","36876 → 21002 [ACK] Seq=11860 Ack=174207 Win=5565 Len=0 TSval=1089133622 TSecr=2676432571"
"5.078191","54.38.73.16","172.18.0.2","TLSv1.2","1516","Application Data [TCP segment of a reassembled PDU]"
"5.078220","172.18.0.2","54.38.73.16","TCP","68","36876 → 21002 [ACK] Seq=11860 Ack=175655 Win=5593 Len=0 TSval=1089133634 TSecr=2676432574"
"5.114698","54.38.73.16","172.18.0.2","TLSv1.2","1370","[TCP Previous segment not captured] , Ignored Unknown Record"
"5.114768","172.18.0.2","54.38.73.16","TCP","80","[TCP Dup ACK 174#1] 36876 → 21002 [ACK] Seq=11860 Ack=175655 Win=5593 Len=0 TSval=1089133670 TSecr=2676432574 SLE=184343 SRE=185645"
"5.114728","54.38.73.16","172.18.0.2","TCP","8756","[TCP Out-Of-Order] 21002 → 36876 [ACK] Seq=175655 Ack=11860 Win=1452 Len=8688 TSval=2676432583 TSecr=1089133622"
"5.114805","172.18.0.2","54.38.73.16","TCP","68","36876 → 21002 [ACK] Seq=11860 Ack=185645 Win=5550 Len=0 TSval=1089133670 TSecr=2676432583"
"5.115307","172.18.0.2","54.38.73.16","TLSv1.2","611","Application Data"
"5.140213","54.38.73.16","172.18.0.2","TCP","68","[TCP Previous segment not captured] 21002 → 36876 [ACK] Seq=191357 Ack=12403 Win=1452 Len=0 TSval=2676432590 TSecr=1089133671"
"5.140228","54.38.73.16","172.18.0.2","TCP","5780","[TCP Retransmission] 21002 → 36876 [PSH, ACK] Seq=185645 Ack=11860 Win=1452 Len=5712 TSval=2676432590 TSecr=1089133670"
"5.140267","172.18.0.2","54.38.73.16","TCP","68","36876 → 21002 [ACK] Seq=12403 Ack=191357 Win=5581 Len=0 TSval=1089133696 TSecr=2676432590"
"5.197116","54.38.73.16","172.18.0.2","TLSv1.2","3695","Application Data"
"5.197146","172.18.0.2","54.38.73.16","TCP","68","36876 → 21002 [ACK] Seq=12403 Ack=194984 Win=5580 Len=0 TSval=1089133753 TSecr=2676432604"
"5.197602","172.18.0.2","54.38.73.16","TLSv1.2","611","Application Data"
"5.206564","54.38.73.16","172.18.0.2","TCP","2964","[TCP segment of a reassembled PDU]"
"5.206594","172.18.0.2","54.38.73.16","TCP","68","36876 → 21002 [ACK] Seq=12946 Ack=197880 Win=5596 Len=0 TSval=1089133762 TSecr=2676432606"
"5.217131","54.38.73.16","172.18.0.2","TLSv1.2","2964","Application Data [TCP segment of a reassembled PDU]"
"5.217166","172.18.0.2","54.38.73.16","TCP","68","36876 → 21002 [ACK] Seq=12946 Ack=200776 Win=5596 Len=0 TSval=1089133773 TSecr=2676432609"
"5.222083","54.38.73.16","172.18.0.2","TCP","68","[TCP Previous segment not captured] 21002 → 36876 [ACK] Seq=203672 Ack=12946 Win=1452 Len=0 TSval=2676432610 TSecr=1089133753"
"5.222102","54.38.73.16","172.18.0.2","TCP","2964","[TCP Retransmission] 21002 → 36876 [ACK] Seq=200776 Ack=12403 Win=1452 Len=2896 TSval=2676432610 TSecr=1089133753"
"5.222145","172.18.0.2","54.38.73.16","TCP","68","36876 → 21002 [ACK] Seq=12946 Ack=203672 Win=5596 Len=0 TSval=1089133778 TSecr=2676432610"
"5.228905","54.38.73.16","172.18.0.2","TLSv1.2","1516","Ignored Unknown Record"
"5.228940","172.18.0.2","54.38.73.16","TCP","68","36876 → 21002 [ACK] Seq=12946 Ack=205120 Win=5593 Len=0 TSval=1089133785 TSecr=2676432612"
"5.232492","54.38.73.16","172.18.0.2","TLSv1.2","1516","Ignored Unknown Record"
"5.232525","172.18.0.2","54.38.73.16","TCP","68","36876 → 21002 [ACK] Seq=12946 Ack=206568 Win=5593 Len=0 TSval=1089133788 TSecr=2676432613"
"5.242197","54.38.73.16","172.18.0.2","TLSv1.2","2964","Ignored Unknown Record"
"5.242231","172.18.0.2","54.38.73.16","TCP","68","36876 → 21002 [ACK] Seq=12946 Ack=209464 Win=5596 Len=0 TSval=1089133798 TSecr=2676432615"
"5.247965","54.38.73.16","172.18.0.2","TLSv1.2","5860","Ignored Unknown Record"
"5.247998","172.18.0.2","54.38.73.16","TCP","68","36876 → 21002 [ACK] Seq=12946 Ack=215256 Win=5581 Len=0 TSval=1089133804 TSecr=2676432616"
"5.254409","54.38.73.16","172.18.0.2","TLSv1.2","1516","Ignored Unknown Record"
"5.267707","54.38.73.16","172.18.0.2","TLSv1.2","2964","Ignored Unknown Record"
"5.267740","172.18.0.2","54.38.73.16","TCP","68","36876 → 21002 [ACK] Seq=12946 Ack=219600 Win=5596 Len=0 TSval=1089133823 TSecr=2676432618"
"5.273778","54.38.73.16","172.18.0.2","TLSv1.2","5860","Ignored Unknown Record"
"5.273940","172.18.0.2","54.38.73.16","TCP","68","36876 → 21002 [ACK] Seq=12946 Ack=225392 Win=5581 Len=0 TSval=1089133830 TSecr=2676432623"
"5.274375","172.18.0.2","54.38.73.16","TLSv1.2","611","Application Data"
"5.290699","54.38.73.16","172.18.0.2","TLSv1.2","1516","Ignored Unknown Record"
"5.292729","54.38.73.16","172.18.0.2","TLSv1.2","4412","Ignored Unknown Record"
"5.292905","172.18.0.2","54.38.73.16","TCP","68","36876 → 21002 [ACK] Seq=13489 Ack=231184 Win=5580 Len=0 TSval=1089133849 TSecr=2676432627"
"5.299446","54.38.73.16","172.18.0.2","TLSv1.2","5860","Ignored Unknown Record"
"5.299590","172.18.0.2","54.38.73.16","TCP","68","36876 → 21002 [ACK] Seq=13489 Ack=236976 Win=5564 Len=0 TSval=1089133855 TSecr=2676432629"
"5.318530","54.38.73.16","172.18.0.2","TLSv1.2","5860","Ignored Unknown Record"
"5.318576","172.18.0.2","54.38.73.16","TLSv1.2","611","Application Data"
"5.324433","54.38.73.16","172.18.0.2","TLSv1.2","5777","Ignored Unknown Record"
"5.324467","172.18.0.2","54.38.73.16","TCP","68","36876 → 21002 [ACK] Seq=14032 Ack=248477 Win=5581 Len=0 TSval=1089133880 TSecr=2676432636"
"5.345998","172.18.0.2","54.38.73.16","TLSv1.2","1516","Application Data, Application Data"
"5.347604","54.38.73.16","172.18.0.2","TLSv1.2","611","Application Data"
"5.347668","172.18.0.2","54.38.73.16","TLSv1.2","249","Application Data"
"5.373387","54.38.73.16","172.18.0.2","TCP","68","21002 → 36876 [ACK] Seq=249020 Ack=15661 Win=1452 Len=0 TSval=2676432648 TSecr=1089133902"
"5.602386","54.38.73.16","172.18.0.2","TLSv1.2","611","Application Data"
"5.603464","172.18.0.2","54.38.73.16","TLSv1.2","611","Application Data"
"5.668710","54.38.73.16","172.18.0.2","TCP","68","21002 → 36876 [ACK] Seq=249563 Ack=16204 Win=1452 Len=0 TSval=2676432722 TSecr=1089134159"
"5.873230","54.38.73.16","172.18.0.2","TLSv1.2","3695","Application Data"
"5.873420","172.18.0.2","54.38.73.16","TCP","68","36876 → 21002 [ACK] Seq=16204 Ack=253190 Win=5584 Len=0 TSval=1089134429 TSecr=2676432773"
"5.883206","54.38.73.16","172.18.0.2","TLSv1.2","4412","Application Data"
"5.883393","172.18.0.2","54.38.73.16","TCP","68","36876 → 21002 [ACK] Seq=16204 Ack=257534 Win=5580 Len=0 TSval=1089134439 TSecr=2676432775"
"5.893706","54.38.73.16","172.18.0.2","TLSv1.2","2964","Application Data [TCP segment of a reassembled PDU]"
"5.893740","172.18.0.2","54.38.73.16","TCP","68","36876 → 21002 [ACK] Seq=16204 Ack=260430 Win=5596 Len=0 TSval=1089134449 TSecr=2676432778"
"5.900299","54.38.73.16","172.18.0.2","TLSv1.2","2964","Application Data [TCP segment of a reassembled PDU]"
"5.900333","172.18.0.2","54.38.73.16","TCP","68","36876 → 21002 [ACK] Seq=16204 Ack=263326 Win=5596 Len=0 TSval=1089134456 TSecr=2676432780"
"5.908293","54.38.73.16","172.18.0.2","TLSv1.2","1870","Application Data"
"5.908326","172.18.0.2","54.38.73.16","TCP","68","36876 → 21002 [ACK] Seq=16204 Ack=265128 Win=5600 Len=0 TSval=1089134464 TSecr=2676432782"
"5.915542","172.18.0.2","54.38.73.16","TLSv1.2","611","Application Data"
"5.943032","54.38.73.16","172.18.0.2","TCP","68","21002 → 36876 [ACK] Seq=265128 Ack=16747 Win=1452 Len=0 TSval=2676432790 TSecr=1089134471"
"6.306711","54.38.73.16","172.18.0.2","TLSv1.2","611","Application Data"
"6.307753","172.18.0.2","54.38.73.16","TLSv1.2","611","Application Data"
"6.331709","54.38.73.16","172.18.0.2","TCP","68","21002 → 36876 [ACK] Seq=265671 Ack=17290 Win=1452 Len=0 TSval=2676432888 TSecr=1089134863"
"6.711875","54.38.73.16","172.18.0.2","TLSv1.2","611","Application Data"
"6.711934","54.38.73.16","172.18.0.2","TCP","2964","[TCP segment of a reassembled PDU]"
"6.711938","54.38.73.16","172.18.0.2","TLSv1.2","4412","Application Data [TCP segment of a reassembled PDU]"
"6.712127","172.18.0.2","54.38.73.16","TCP","68","36876 → 21002 [ACK] Seq=17290 Ack=273454 Win=5552 Len=0 TSval=1089135268 TSecr=2676432965"
"6.737033","54.38.73.16","172.18.0.2","TLSv1.2","625","Application Data, Application Data"
"6.744294","172.18.0.2","54.38.73.16","TLSv1.2","611","Application Data"
"6.768735","54.38.73.16","172.18.0.2","TCP","68","21002 → 36876 [ACK] Seq=274011 Ack=17833 Win=1452 Len=0 TSval=2676432997 TSecr=1089135300"
"7.120704","54.38.73.16","172.18.0.2","TLSv1.2","611","Application Data"
"7.121749","172.18.0.2","54.38.73.16","TLSv1.2","611","Application Data"
"7.146222","54.38.73.16","172.18.0.2","TCP","68","21002 → 36876 [ACK] Seq=274554 Ack=18376 Win=1452 Len=0 TSval=2676433091 TSecr=1089135677"
"7.458250","54.38.73.16","172.18.0.2","TLSv1.2","3695","Application Data"
"7.458449","172.18.0.2","54.38.73.16","TCP","68","36876 → 21002 [ACK] Seq=18376 Ack=278181 Win=5584 Len=0 TSval=1089136014 TSecr=2676433168"
"7.466002","54.38.73.16","172.18.0.2","TCP","1516","[TCP segment of a reassembled PDU]"
"7.467092","54.38.73.16","172.18.0.2","TLSv1.2","4412","Application Data [TCP segment of a reassembled PDU]"
"7.467241","172.18.0.2","54.38.73.16","TCP","68","36876 → 21002 [ACK] Seq=18376 Ack=283973 Win=5580 Len=0 TSval=1089136023 TSecr=2676433171"
"7.483015","54.38.73.16","172.18.0.2","TLSv1.2","2587","Application Data, Application Data"
"7.483048","172.18.0.2","54.38.73.16","TCP","68","36876 → 21002 [ACK] Seq=18376 Ack=286492 Win=5597 Len=0 TSval=1089136039 TSecr=2676433175"
"7.483570","172.18.0.2","54.38.73.16","TLSv1.2","611","Application Data"
"7.489373","54.38.73.16","172.18.0.2","TCP","1516","[TCP segment of a reassembled PDU]"
"7.489486","54.38.73.16","172.18.0.2","TCP","1516","21002 → 36876 [ACK] Seq=287940 Ack=18376 Win=1452 Len=1448 TSval=2676433177 TSecr=1089136014 [TCP segment of a reassembled PDU]"
"7.489558","172.18.0.2","54.38.73.16","TCP","68","36876 → 21002 [ACK] Seq=18919 Ack=289388 Win=5577 Len=0 TSval=1089136045 TSecr=2676433177"
"7.492661","54.38.73.16","172.18.0.2","TLSv1.2","4412","Application Data, Application Data"
"7.492697","172.18.0.2","54.38.73.16","TCP","68","36876 → 21002 [ACK] Seq=18919 Ack=293732 Win=5580 Len=0 TSval=1089136048 TSecr=2676433178"
"7.501076","54.38.73.16","172.18.0.2","TLSv1.2","1516","Application Data [TCP segment of a reassembled PDU]"
"7.508905","54.38.73.16","172.18.0.2","TCP","68","[TCP Previous segment not captured] 21002 → 36876 [ACK] Seq=298076 Ack=18919 Win=1452 Len=0 TSval=2676433182 TSecr=1089136039"
"7.508936","54.38.73.16","172.18.0.2","TCP","2964","[TCP Retransmission] 21002 → 36876 [ACK] Seq=295180 Ack=18376 Win=1452 Len=2896 TSval=2676433182 TSecr=1089136039"
"7.508981","172.18.0.2","54.38.73.16","TCP","68","36876 → 21002 [ACK] Seq=18919 Ack=298076 Win=5596 Len=0 TSval=1089136065 TSecr=2676433180"
"7.514136","54.38.73.16","172.18.0.2","TCP","2964","21002 → 36876 [ACK] Seq=298076 Ack=18919 Win=1452 Len=2896 TSval=2676433183 TSecr=1089136045 [TCP segment of a reassembled PDU], Application Data"
"7.514170","172.18.0.2","54.38.73.16","TCP","68","36876 → 21002 [ACK] Seq=18919 Ack=300972 Win=5596 Len=0 TSval=1089136070 TSecr=2676433183"
"7.517870","54.38.73.16","172.18.0.2","TLSv1.2","668","Application Data"
"7.518287","172.18.0.2","54.38.73.16","TLSv1.2","611","Application Data"
"7.526679","54.38.73.16","172.18.0.2","TCP","2964","[TCP segment of a reassembled PDU]"
"7.526829","172.18.0.2","54.38.73.16","TCP","68","36876 → 21002 [ACK] Seq=19462 Ack=304468 Win=5596 Len=0 TSval=1089136082 TSecr=2676433186"
"7.541083","54.38.73.16","172.18.0.2","TLSv1.2","4412","Application Data [TCP segment of a reassembled PDU]"
"7.541231","172.18.0.2","54.38.73.16","TCP","68","36876 → 21002 [ACK] Seq=19462 Ack=308812 Win=5580 Len=0 TSval=1089136097 TSecr=2676433190"
"7.543012","54.38.73.16","172.18.0.2","TLSv1.2","625","Application Data, Application Data"
"7.552707","54.38.73.16","172.18.0.2","TCP","1516","[TCP segment of a reassembled PDU]"
"7.552739","172.18.0.2","54.38.73.16","TCP","68","36876 → 21002 [ACK] Seq=19462 Ack=310817 Win=5593 Len=0 TSval=1089136108 TSecr=2676433191"
"7.577866","54.38.73.16","172.18.0.2","TLSv1.2","705","Application Data"
"7.586300","172.18.0.2","54.38.73.16","TLSv1.2","611","Application Data"
"7.647456","54.38.73.16","172.18.0.2","TCP","68","21002 → 36876 [ACK] Seq=311454 Ack=20005 Win=1452 Len=0 TSval=2676433217 TSecr=1089136142"
"7.813315","54.38.73.16","172.18.0.2","TLSv1.2","611","Application Data"
"7.814361","172.18.0.2","54.38.73.16","TLSv1.2","611","Application Data"
"7.839024","54.38.73.16","172.18.0.2","TCP","68","21002 → 36876 [ACK] Seq=311997 Ack=20548 Win=1452 Len=0 TSval=2676433265 TSecr=1089136370"
