_ws.col.Time,_ws.col.Source,_ws.col.Destination,_ws.col.Protocol,_ws.col.Length,_ws.col.Info
"0.000000","172.18.0.2","54.38.73.16","TLSv1.2","611","Application Data"
"0.026446","54.38.73.16","172.18.0.2","TCP","68","21002 → 36876 [ACK] Seq=1 Ack=544 Win=1452 Len=0 TSval=2678789679 TSecr=1098561960"
"0.558968","54.38.73.16","172.18.0.2","TLSv1.2","611","Application Data"
"0.559537","172.18.0.2","54.38.73.16","TLSv1.2","2153","Application Data"
"0.583330","54.38.73.16","172.18.0.2","TCP","68","21002 → 36876 [ACK] Seq=544 Ack=2629 Win=1448 Len=0 TSval=2678789819 TSecr=1098562519"
"0.802195","54.38.73.16","172.18.0.2","TLSv1.2","611","Application Data"
"0.843033","172.18.0.2","54.38.73.16","TCP","68","36876 → 21002 [ACK] Seq=2629 Ack=1087 Win=5612 Len=0 TSval=1098562803 TSecr=2678789873"
"0.868323","54.38.73.16","172.18.0.2","TLSv1.2","1125","Application Data"
"0.868368","172.18.0.2","54.38.73.16","TCP","68","36876 → 21002 [ACK] Seq=2629 Ack=2144 Win=5604 Len=0 TSval=1098562828 TSecr=2678789890"
"0.875810","172.18.0.2","54.38.73.16","TLSv1.2","611","Application Data"
"0.899899","54.38.73.16","172.18.0.2","TCP","68","21002 → 36876 [ACK] Seq=2144 Ack=3172 Win=1452 Len=0 TSval=2678789898 TSecr=1098562835"
"1.281756","54.38.73.16","172.18.0.2","TLSv1.2","611","Application Data"
"1.281805","172.18.0.2","54.38.73.16","TCP","68","36876 → 21002 [ACK] Seq=3172 Ack=2687 Win=5608 Len=0 TSval=1098563241 TSecr=2678789971"
"1.282764","172.18.0.2","54.38.73.16","TLSv1.2","611","Application Data"
"1.307105","54.38.73.16","172.18.0.2","TCP","68","21002 → 36876 [ACK] Seq=2687 Ack=3715 Win=1452 Len=0 TSval=2678790000 TSecr=1098563242"
"1.719239","54.38.73.16","172.18.0.2","TLSv1.2","3695","Application Data"
"1.719283","172.18.0.2","54.38.73.16","TCP","68","36876 → 21002 [ACK] Seq=3715 Ack=6314 Win=5584 Len=0 TSval=1098563679 TSecr=2678790103"
"1.729072","54.38.73.16","172.18.0.2","TCP","2964","[TCP segment of a reassembled PDU]"
"1.729096","172.18.0.2","54.38.73.16","TCP","68","36876 → 21002 [ACK] Seq=3715 Ack=9210 Win=5596 Len=0 TSval=1098563689 TSecr=2678790105"
"1.739070","54.38.73.16","172.18.0.2","TLSv1.2","4412","Application Data [TCP segment of a reassembled PDU]"
"1.739095","172.18.0.2","54.38.73.16","TCP","68","36876 → 21002 [ACK] Seq=3715 Ack=13554 Win=5580 Len=0 TSval=1098563699 TSecr=2678790108"
"1.742298","54.38.73.16","172.18.0.2","TLSv1.2","1139","Application Data, Application Data"
"1.742322","172.18.0.2","54.38.73.16","TCP","68","36876 → 21002 [ACK] Seq=3715 Ack=14625 Win=5593 Len=0 TSval=1098563702 TSecr=2678790109"
"1.753497","54.38.73.16","172.18.0.2","TCP","1516","[TCP segment of a reassembled PDU]"
"1.753522","172.18.0.2","54.38.73.16","TCP","68","36876 → 21002 [ACK] Seq=3715 Ack=16073 Win=5593 Len=0 TSval=1098563713 TSecr=2678790111"
"1.766035","54.38.73.16","172.18.0.2","TLSv1.2","1219","Application Data"
"1.766060","172.18.0.2","54.38.73.16","TCP","68","36876 → 21002 [ACK] Seq=3715 Ack=17224 Win=5593 Len=0 TSval=1098563726 TSecr=2678790115"
"1.774619","172.18.0.2","54.38.73.16","TLSv1.2","611","Application Data"
"1.799525","54.38.73.16","172.18.0.2","TCP","68","21002 → 36876 [ACK] Seq=17224 Ack=4258 Win=1452 Len=0 TSval=2678790123 TSecr=1098563734"
"2.094786","54.38.73.16","172.18.0.2","TLSv1.2","611","Application Data"
"2.095833","172.18.0.2","54.38.73.16","TLSv1.2","611","Application Data"
"2.121327","54.38.73.16","172.18.0.2","TCP","68","21002 → 36876 [ACK] Seq=17767 Ack=4801 Win=1452 Len=0 TSval=2678790203 TSecr=1098564055"
"2.443328","54.38.73.16","172.18.0.2","TLSv1.2","3695","Application Data"
"2.443479","172.18.0.2","54.38.73.16","TCP","68","36876 → 21002 [ACK] Seq=4801 Ack=21394 Win=5584 Len=0 TSval=1098564403 TSecr=2678790284"
"2.454260","54.38.73.16","172.18.0.2","TCP","2964","[TCP segment of a reassembled PDU]"
"2.454286","172.18.0.2","54.38.73.16","TCP","68","36876 → 21002 [ACK] Seq=4801 Ack=24290 Win=5596 Len=0 TSval=1098564414 TSecr=2678790286"
"2.464503","54.38.73.16","172.18.0.2","TLSv1.2","4412","Application Data [TCP segment of a reassembled PDU]"
"2.464671","172.18.0.2","54.38.73.16","TCP","68","36876 → 21002 [ACK] Seq=4801 Ack=28634 Win=5580 Len=0 TSval=1098564424 TSecr=2678790289"
"2.466677","54.38.73.16","172.18.0.2","TLSv1.2","82","Application Data"
"2.507035","172.18.0.2","54.38.73.16","TCP","68","36876 → 21002 [ACK] Seq=4801 Ack=28648 Win=5612 Len=0 TSval=1098564467 TSecr=2678790290"
"2.523308","54.38.73.16","172.18.0.2","TLSv1.2","4412","Application Data"
"2.523355","172.18.0.2","54.38.73.16","TCP","68","36876 → 21002 [ACK] Seq=4801 Ack=32992 Win=5580 Len=0 TSval=1098564483 TSecr=2678790303"
"2.530901","54.38.73.16","172.18.0.2","TLSv1.2","408","Application Data"
"2.530929","172.18.0.2","54.38.73.16","TCP","68","36876 → 21002 [ACK] Seq=4801 Ack=33332 Win=5593 Len=0 TSval=1098564491 TSecr=2678790306"
"2.533358","54.38.73.16","172.18.0.2","TLSv1.2","7308","Application Data"
"2.533383","172.18.0.2","54.38.73.16","TCP","68","36876 → 21002 [ACK] Seq=4801 Ack=40572 Win=5565 Len=0 TSval=1098564493 TSecr=2678790306"
"2.533872","172.18.0.2","54.38.73.16","TLSv1.2","611","Application Data"
"2.547238","54.38.73.16","172.18.0.2","TLSv1.2","2964","Application Data [TCP segment of a reassembled PDU]"
"2.547263","172.18.0.2","54.38.73.16","TCP","68","36876 → 21002 [ACK] Seq=5344 Ack=43468 Win=5596 Len=0 TSval=1098564507 TSecr=2678790310"
"2.554688","54.38.73.16","172.18.0.2","TLSv1.2","2964","Application Data [TCP segment of a reassembled PDU]"
"2.554713","172.18.0.2","54.38.73.16","TCP","68","36876 → 21002 [ACK] Seq=5344 Ack=46364 Win=5596 Len=0 TSval=1098564514 TSecr=2678790312"
"2.557215","54.38.73.16","172.18.0.2","TLSv1.2","6771","Application Data, Application Data, Application Data, Application Data"
"2.557239","172.18.0.2","54.38.73.16","TCP","68","36876 → 21002 [ACK] Seq=5344 Ack=53067 Win=5565 Len=0 TSval=1098564517 TSecr=2678790312"
"2.557809","54.38.73.16","172.18.0.2","TCP","68","21002 → 36876 [ACK] Seq=53067 Ack=5344 Win=1452 Len=0 TSval=2678790312 TSecr=1098564494"
"2.557837","172.18.0.2","54.38.73.16","TLSv1.2","611","Application Data"
"2.581661","54.38.73.16","172.18.0.2","TLSv1.2","611","Application Data"
"2.581698","172.18.0.2","54.38.73.16","TCP","68","36876 → 21002 [ACK] Seq=5887 Ack=53610 Win=5593 Len=0 TSval=1098564541 TSecr=2678790318"
"2.618122","54.38.73.16","172.18.0.2","TCP","68","21002 → 36876 [ACK] Seq=53610 Ack=5887 Win=1452 Len=0 TSval=2678790328 TSecr=1098564517"
"2.618184","172.18.0.2","54.38.73.16","TLSv1.2","1154","Application Data, Application Data"
"2.643020","54.38.73.16","172.18.0.2","TCP","68","21002 → 36876 [ACK] Seq=53610 Ack=6973 Win=1452 Len=0 TSval=2678790333 TSecr=1098564578"
"2.860309","54.38.73.16","172.18.0.2","TLSv1.2","611","Application Data"
"2.861360","172.18.0.2","54.38.73.16","TLSv1.2","611","Application Data"
"2.886263","54.38.73.16","172.18.0.2","TCP","68","21002 → 36876 [ACK] Seq=54153 Ack=7516 Win=1452 Len=0 TSval=2678790395 TSecr=1098564821"
"3.228948","172.18.0.2","54.38.73.16","TLSv1.2","1125","Application Data"
"3.253578","54.38.73.16","172.18.0.2","TCP","68","21002 → 36876 [ACK] Seq=54153 Ack=8573 Win=1452 Len=0 TSval=2678790486 TSecr=1098565189"
"3.269533","54.38.73.16","172.18.0.2","TLSv1.2","611","Application Data"
"3.270520","172.18.0.2","54.38.73.16","TLSv1.2","611","Application Data"
"3.299162","54.38.73.16","172.18.0.2","TLSv1.2","3695","Application Data"
"3.299339","172.18.0.2","54.38.73.16","TCP","68","36876 → 21002 [ACK] Seq=9116 Ack=58323 Win=5584 Len=0 TSval=1098565259 TSecr=2678790498"
"3.309618","54.38.73.16","172.18.0.2","TLSv1.2","8756","Application Data, Application Data"
"3.309793","172.18.0.2","54.38.73.16","TCP","68","36876 → 21002 [ACK] Seq=9116 Ack=67011 Win=5566 Len=0 TSval=1098565269 TSecr=2678790500"
"3.323161","54.38.73.16","172.18.0.2","TLSv1.2","2964","Application Data [TCP segment of a reassembled PDU]"
"3.323186","172.18.0.2","54.38.73.16","TCP","68","36876 → 21002 [ACK] Seq=9116 Ack=69907 Win=5596 Len=0 TSval=1098565283 TSecr=2678790504"
"3.334672","54.38.73.16","172.18.0.2","TLSv1.2","4563","Application Data, Application Data"
"3.334704","54.38.73.16","172.18.0.2","TCP","2964","[TCP segment of a reassembled PDU]"
"3.334842","172.18.0.2","54.38.73.16","TCP","68","36876 → 21002 [ACK] Seq=9116 Ack=77298 Win=5571 Len=0 TSval=1098565294 TSecr=2678790506"
"3.344688","54.38.73.16","172.18.0.2","TLSv1.2","1516","Application Data [TCP segment of a reassembled PDU]"
"3.348726","54.38.73.16","172.18.0.2","TCP","2964","21002 → 36876 [ACK] Seq=78746 Ack=9116 Win=1452 Len=2896 TSval=2678790510 TSecr=1098565283 [TCP segment of a reassembled PDU]"
"3.348751","172.18.0.2","54.38.73.16","TCP","68","36876 → 21002 [ACK] Seq=9116 Ack=81642 Win=5596 Len=0 TSval=1098565308 TSecr=2678790509"
"3.362409","54.38.73.16","172.18.0.2","TLSv1.2","8756","Application Data, Application Data, Application Data"
"3.362577","172.18.0.2","54.38.73.16","TCP","68","36876 → 21002 [ACK] Seq=9116 Ack=90330 Win=5566 Len=0 TSval=1098565322 TSecr=2678790513"
"3.363702","172.18.0.2","54.38.73.16","TLSv1.2","1125","Application Data"
"3.375924","54.38.73.16","172.18.0.2","TLSv1.2","2964","Application Data [TCP segment of a reassembled PDU]"
"3.375950","172.18.0.2","54.38.73.16","TCP","68","36876 → 21002 [ACK] Seq=10173 Ack=93226 Win=5596 Len=0 TSval=1098565336 TSecr=2678790517"
"3.388862","54.38.73.16","172.18.0.2","TLSv1.2","11652","Application Data, Application Data, Application Data, Application Data"
"3.389038","172.18.0.2","54.38.73.16","TCP","68","36876 → 21002 [ACK] Seq=10173 Ack=104810 Win=5551 Len=0 TSval=1098565349 TSecr=2678790520"
"3.400401","54.38.73.16","172.18.0.2","TLSv1.2","2964","Application Data, Application Data"
"3.400433","172.18.0.2","54.38.73.16","TLSv1.2","611","Application Data"
"3.414635","54.38.73.16","172.18.0.2","TLSv1.2","1550","Application Data"
"3.414661","172.18.0.2","54.38.73.16","TCP","68","36876 → 21002 [ACK] Seq=10716 Ack=109188 Win=5601 Len=0 TSval=1098565374 TSecr=2678790526"
"3.462251","54.38.73.16","172.18.0.2","TCP","68","21002 → 36876 [ACK] Seq=109188 Ack=10716 Win=1452 Len=0 TSval=2678790539 TSecr=1098565360"
"3.462284","172.18.0.2","54.38.73.16","TLSv1.2","1154","Application Data, Application Data"
"3.525999","54.38.73.16","172.18.0.2","TCP","68","21002 → 36876 [ACK] Seq=109188 Ack=11802 Win=1452 Len=0 TSval=2678790555 TSecr=1098565422"
"3.528886","54.38.73.16","172.18.0.2","TLSv1.2","611","Application Data"
"3.571037","172.18.0.2","54.38.73.16","TCP","68","36876 → 21002 [ACK] Seq=11802 Ack=109731 Win=5612 Len=0 TSval=1098565531 TSecr=2678790555"
"3.811047","02:42:09:5f:bf:77","","ARP","44","Who has 172.18.0.2? Tell 172.18.0.1"
"3.811061","02:42:ac:12:00:02","","ARP","44","172.18.0.2 is at 02:42:ac:12:00:02"
"3.838978","54.38.73.16","172.18.0.2","TLSv1.2","611","Application Data"
"3.839023","172.18.0.2","54.38.73.16","TCP","68","36876 → 21002 [ACK] Seq=11802 Ack=110274 Win=5608 Len=0 TSval=1098565799 TSecr=2678790623"
"3.840052","172.18.0.2","54.38.73.16","TLSv1.2","611","Application Data"
"3.902998","54.38.73.16","172.18.0.2","TCP","68","21002 → 36876 [ACK] Seq=110274 Ack=12345 Win=1452 Len=0 TSval=2678790649 TSecr=1098565800"
"4.115417","54.38.73.16","172.18.0.2","TLSv1.2","611","Application Data"
"4.115462","172.18.0.2","54.38.73.16","TCP","68","36876 → 21002 [ACK] Seq=12345 Ack=110817 Win=5608 Len=0 TSval=1098566075 TSecr=2678790702"
"4.136144","54.38.73.16","172.18.0.2","TLSv1.2","7308","Application Data"
"4.136189","172.18.0.2","54.38.73.16","TCP","68","36876 → 21002 [ACK] Seq=12345 Ack=118057 Win=5565 Len=0 TSval=1098566096 TSecr=2678790707"
"4.139819","54.38.73.16","172.18.0.2","TLSv1.2","596","Application Data"
"4.139843","172.18.0.2","54.38.73.16","TCP","68","36876 → 21002 [ACK] Seq=12345 Ack=118585 Win=5593 Len=0 TSval=1098566100 TSecr=2678790708"
"4.147476","54.38.73.16","172.18.0.2","TLSv1.2","5860","Application Data"
"4.147502","172.18.0.2","54.38.73.16","TCP","68","36876 → 21002 [ACK] Seq=12345 Ack=124377 Win=5581 Len=0 TSval=1098566107 TSecr=2678790710"
"4.161129","54.38.73.16","172.18.0.2","TLSv1.2","5860","Application Data [TCP segment of a reassembled PDU]"
"4.161154","172.18.0.2","54.38.73.16","TCP","68","36876 → 21002 [ACK] Seq=12345 Ack=130169 Win=5581 Len=0 TSval=1098566121 TSecr=2678790713"
"4.165790","54.38.73.16","172.18.0.2","TLSv1.2","2964","Application Data [TCP segment of a reassembled PDU]"
"4.165814","172.18.0.2","54.38.73.16","TCP","68","36876 → 21002 [ACK] Seq=12345 Ack=133065 Win=5596 Len=0 TSval=1098566125 TSecr=2678790714"
"4.171900","54.38.73.16","172.18.0.2","TLSv1.2","5860","Application Data, Application Data"
"4.171925","172.18.0.2","54.38.73.16","TCP","68","36876 → 21002 [ACK] Seq=12345 Ack=138857 Win=5581 Len=0 TSval=1098566132 TSecr=2678790716"
"4.172755","172.18.0.2","54.38.73.16","TLSv1.2","611","Application Data"
"4.186180","54.38.73.16","172.18.0.2","TLSv1.2","5860","Application Data [TCP segment of a reassembled PDU]"
"4.186205","172.18.0.2","54.38.73.16","TCP","68","36876 → 21002 [ACK] Seq=12888 Ack=144649 Win=5581 Len=0 TSval=1098566146 TSecr=2678790719"
"4.190990","54.38.73.16","172.18.0.2","TLSv1.2","2964","Application Data, Application Data"
"4.191017","172.18.0.2","54.38.73.16","TCP","68","36876 → 21002 [ACK] Seq=12888 Ack=147545 Win=5596 Len=0 TSval=1098566151 TSecr=2678790721"
"4.197128","54.38.73.16","172.18.0.2","TCP","68","[TCP Previous segment not captured] 21002 → 36876 [ACK] Seq=153337 Ack=12888 Win=1452 Len=0 TSval=2678790722 TSecr=1098566132"
"4.197162","172.18.0.2","54.38.73.16","TLSv1.2","611","Application Data"
"4.197170","54.38.73.16","172.18.0.2","TCP","5860","[TCP Retransmission] 21002 → 36876 [ACK] Seq=147545 Ack=12345 Win=1452 Len=5792 TSval=2678790722 TSecr=1098566132"
"4.197314","172.18.0.2","54.38.73.16","TCP","68","36876 → 21002 [ACK] Seq=13431 Ack=153337 Win=5581 Len=0 TSval=1098566157 TSecr=2678790722"
"4.211807","54.38.73.16","172.18.0.2","TLSv1.2","8756","Ignored Unknown Record"
"4.211980","172.18.0.2","54.38.73.16","TCP","68","36876 → 21002 [ACK] Seq=13431 Ack=162025 Win=5566 Len=0 TSval=1098566172 TSecr=2678790726"
"4.216376","54.38.73.16","172.18.0.2","TLSv1.2","2964","Ignored Unknown Record"
"4.216400","172.18.0.2","54.38.73.16","TCP","68","36876 → 21002 [ACK] Seq=13431 Ack=164921 Win=5596 Len=0 TSval=1098566176 TSecr=2678790727"
"4.221175","54.38.73.16","172.18.0.2","TLSv1.2","485","Ignored Unknown Record"
"4.221207","172.18.0.2","54.38.73.16","TLSv1.2","611","Application Data"
"4.283355","54.38.73.16","172.18.0.2","TCP","68","21002 → 36876 [ACK] Seq=165338 Ack=13974 Win=1452 Len=0 TSval=2678790744 TSecr=1098566181"
"4.283391","172.18.0.2","54.38.73.16","TLSv1.2","611","Application Data"
"4.308018","54.38.73.16","172.18.0.2","TCP","68","21002 → 36876 [ACK] Seq=165338 Ack=14517 Win=1452 Len=0 TSval=2678790750 TSecr=1098566243"
"4.551028","54.38.73.16","172.18.0.2","TLSv1.2","611","Application Data"
"4.552045","172.18.0.2","54.38.73.16","TLSv1.2","611","Application Data"
"4.576385","54.38.73.16","172.18.0.2","TCP","68","21002 → 36876 [ACK] Seq=165881 Ack=15060 Win=1452 Len=0 TSval=2678790817 TSecr=1098566512"
"4.902791","54.38.73.16","172.18.0.2","TLSv1.2","3181","Application Data"
"4.902960","172.18.0.2","54.38.73.16","TCP","68","36876 → 21002 [ACK] Seq=15060 Ack=168994 Win=5588 Len=0 TSval=1098566863 TSecr=2678790898"
"4.911998","54.38.73.16","172.18.0.2","TLSv1.2","7308","Application Data"
"4.912172","172.18.0.2","54.38.73.16","TCP","68","36876 → 21002 [ACK] Seq=15060 Ack=176234 Win=5565 Len=0 TSval=1098566872 TSecr=2678790901"
"4.927369","54.38.73.16","172.18.0.2","TLSv1.2","596","Application Data"
"4.933258","54.38.73.16","172.18.0.2","TLSv1.2","5860","Application Data"
"4.933285","172.18.0.2","54.38.73.16","TCP","68","36876 → 21002 [ACK] Seq=15060 Ack=182554 Win=5581 Len=0 TSval=1098566893 TSecr=2678790905"
"4.936823","54.38.73.16","172.18.0.2","TCP","1516","21002 → 36876 [ACK] Seq=182554 Ack=15060 Win=1452 Len=1448 TSval=2678790907 TSecr=1098566872 [TCP segment of a reassembled PDU]"
"4.944153","54.38.73.16","172.18.0.2","TLSv1.2","7308","Application Data, Application Data"
"4.944323","172.18.0.2","54.38.73.16","TCP","68","36876 → 21002 [ACK] Seq=15060 Ack=191242 Win=5565 Len=0 TSval=1098566904 TSecr=2678790907"
"4.958725","54.38.73.16","172.18.0.2","TLSv1.2","3238","Application Data, Application Data, Application Data"
"4.958750","172.18.0.2","54.38.73.16","TCP","68","36876 → 21002 [ACK] Seq=15060 Ack=194412 Win=5580 Len=0 TSval=1098566918 TSecr=2678790912"
"4.959332","172.18.0.2","54.38.73.16","TLSv1.2","611","Application Data"
"4.969423","54.38.73.16","172.18.0.2","TCP","2964","[TCP segment of a reassembled PDU]"
"4.969447","172.18.0.2","54.38.73.16","TCP","68","36876 → 21002 [ACK] Seq=15603 Ack=197308 Win=5596 Len=0 TSval=1098566929 TSecr=2678790915"
"4.979861","54.38.73.16","172.18.0.2","TLSv1.2","8756","Application Data, Application Data, Application Data"
"4.979993","172.18.0.2","54.38.73.16","TCP","68","36876 → 21002 [ACK] Seq=15603 Ack=205996 Win=5566 Len=0 TSval=1098566940 TSecr=2678790918"
"4.985663","54.38.73.16","172.18.0.2","TCP","68","[TCP Previous segment not captured] 21002 → 36876 [ACK] Seq=208892 Ack=15603 Win=1452 Len=0 TSval=2678790919 TSecr=1098566919"
"4.985694","172.18.0.2","54.38.73.16","TLSv1.2","611","Application Data"
"4.985702","54.38.73.16","172.18.0.2","TCP","2964","[TCP Retransmission] 21002 → 36876 [ACK] Seq=205996 Ack=15060 Win=1452 Len=2896 TSval=2678790919 TSecr=1098566918"
"4.985858","172.18.0.2","54.38.73.16","TCP","68","36876 → 21002 [ACK] Seq=16146 Ack=208892 Win=5596 Len=0 TSval=1098566946 TSecr=2678790919"
"4.989931","54.38.73.16","172.18.0.2","TLSv1.2","1516","Ignored Unknown Record"
"4.992885","54.38.73.16","172.18.0.2","TLSv1.2","1516","Ignored Unknown Record"
"4.993054","172.18.0.2","54.38.73.16","TCP","68","36876 → 21002 [ACK] Seq=16146 Ack=211788 Win=5593 Len=0 TSval=1098566953 TSecr=2678790921"
"5.002509","54.38.73.16","172.18.0.2","TLSv1.2","1516","Ignored Unknown Record"
"5.005248","54.38.73.16","172.18.0.2","TLSv1.2","7308","Ignored Unknown Record"
"5.005379","172.18.0.2","54.38.73.16","TCP","68","36876 → 21002 [ACK] Seq=16146 Ack=220476 Win=5565 Len=0 TSval=1098566965 TSecr=2678790924"
"5.013058","54.38.73.16","172.18.0.2","TLSv1.2","1516","Ignored Unknown Record"
"5.013091","172.18.0.2","54.38.73.16","TLSv1.2","611","Application Data"
"5.014360","54.38.73.16","172.18.0.2","TLSv1.2","4412","Ignored Unknown Record"
"5.014513","172.18.0.2","54.38.73.16","TCP","68","36876 → 21002 [ACK] Seq=16689 Ack=226268 Win=5580 Len=0 TSval=1098566974 TSecr=2678790926"
"5.019069","54.38.73.16","172.18.0.2","TLSv1.2","2964","Ignored Unknown Record"
"5.019094","172.18.0.2","54.38.73.16","TCP","68","36876 → 21002 [ACK] Seq=16689 Ack=229164 Win=5596 Len=0 TSval=1098566979 TSecr=2678790928"
"5.030326","54.38.73.16","172.18.0.2","TLSv1.2","3700","Ignored Unknown Record"
"5.030498","172.18.0.2","54.38.73.16","TCP","68","36876 → 21002 [ACK] Seq=16689 Ack=232796 Win=5580 Len=0 TSval=1098566990 TSecr=2678790930"
"5.038892","54.38.73.16","172.18.0.2","TCP","2964","[TCP segment of a reassembled PDU]"
"5.038934","172.18.0.2","54.38.73.16","TCP","68","36876 → 21002 [ACK] Seq=16689 Ack=235692 Win=5596 Len=0 TSval=1098566999 TSecr=2678790933"
"5.052881","54.38.73.16","172.18.0.2","TLSv1.2","4412","Application Data, Application Data"
"5.053014","172.18.0.2","54.38.73.16","TCP","68","36876 → 21002 [ACK] Seq=16689 Ack=240036 Win=5580 Len=0 TSval=1098567013 TSecr=2678790936"
"5.054443","54.38.73.16","172.18.0.2","TLSv1.2","625","Application Data"
"5.067175","54.38.73.16","172.18.0.2","TCP","1516","[TCP segment of a reassembled PDU]"
"5.067199","172.18.0.2","54.38.73.16","TCP","68","36876 → 21002 [ACK] Seq=16689 Ack=242041 Win=5593 Len=0 TSval=1098567027 TSecr=2678790937"
"5.091581","54.38.73.16","172.18.0.2","TLSv1.2","705","Application Data"
"5.098805","172.18.0.2","54.38.73.16","TLSv1.2","611","Application Data"
"5.161828","54.38.73.16","172.18.0.2","TCP","68","21002 → 36876 [ACK] Seq=242678 Ack=17232 Win=1452 Len=0 TSval=2678790964 TSecr=1098567058"
"5.474138","54.38.73.16","172.18.0.2","TLSv1.2","611","Application Data"
"5.475184","172.18.0.2","54.38.73.16","TLSv1.2","611","Application Data"
"5.499488","54.38.73.16","172.18.0.2","TCP","68","21002 → 36876 [ACK] Seq=243221 Ack=17775 Win=1452 Len=0 TSval=2678791048 TSecr=1098567435"
"5.812793","54.38.73.16","172.18.0.2","TLSv1.2","611","Application Data"
"5.849746","54.38.73.16","172.18.0.2","TCP","2964","[TCP segment of a reassembled PDU]"
"5.849771","172.18.0.2","54.38.73.16","TCP","68","36876 → 21002 [ACK] Seq=17775 Ack=246660 Win=5596 Len=0 TSval=1098567809 TSecr=2678791126"
"5.864594","54.38.73.16","172.18.0.2","TLSv1.2","4412","Application Data [TCP segment of a reassembled PDU]"
"5.864729","172.18.0.2","54.38.73.16","TCP","68","36876 → 21002 [ACK] Seq=17775 Ack=251004 Win=5580 Len=0 TSval=1098567824 TSecr=2678791139"
"5.865245","172.18.0.2","54.38.73.16","TLSv1.2","611","Application Data"
"5.873915","54.38.73.16","172.18.0.2","TLSv1.2","2964","Application Data [TCP segment of a reassembled PDU]"
"5.873939","172.18.0.2","54.38.73.16","TCP","68","36876 → 21002 [ACK] Seq=18318 Ack=253900 Win=5596 Len=0 TSval=1098567834 TSecr=2678791142"
"5.874460","54.38.73.16","172.18.0.2","TLSv1.2","2964","Application Data [TCP segment of a reassembled PDU]"
"5.874488","172.18.0.2","54.38.73.16","TCP","68","36876 → 21002 [ACK] Seq=18318 Ack=256796 Win=5596 Len=0 TSval=1098567834 TSecr=2678791142"
"5.874505","54.38.73.16","172.18.0.2","TLSv1.2","5860","Application Data [TCP segment of a reassembled PDU]"
"5.874582","172.18.0.2","54.38.73.16","TCP","68","36876 → 21002 [ACK] Seq=18318 Ack=262588 Win=5566 Len=0 TSval=1098567834 TSecr=2678791142"
"5.889628","54.38.73.16","172.18.0.2","TLSv1.2","1516","Application Data [TCP segment of a reassembled PDU]"
"5.889793","54.38.73.16","172.18.0.2","TCP","68","[TCP Previous segment not captured] 21002 → 36876 [ACK] Seq=265484 Ack=18318 Win=1452 Len=0 TSval=2678791145 TSecr=1098567825"
"5.889814","54.38.73.16","172.18.0.2","TCP","1516","[TCP Retransmission] 21002 → 36876 [ACK] Seq=264036 Ack=17775 Win=1452 Len=1448 TSval=2678791145 TSecr=1098567824"
"5.889836","172.18.0.2","54.38.73.16","TCP","68","36876 → 21002 [ACK] Seq=18318 Ack=265484 Win=5585 Len=0 TSval=1098567849 TSecr=2678791145"
"5.896691","54.38.73.16","172.18.0.2","TCP","1516","21002 → 36876 [ACK] Seq=265484 Ack=18318 Win=1452 Len=1448 TSval=2678791147 TSecr=1098567825 [TCP segment of a reassembled PDU] [TCP segment of a reassembled PDU]"
"5.898563","54.38.73.16","172.18.0.2","TLSv1.2","11652","Application Data, Application Data, Application Data"
"5.898695","54.38.73.16","172.18.0.2","TCP","1516","21002 → 36876 [ACK] Seq=278516 Ack=18318 Win=1452 Len=1448 TSval=2678791148 TSecr=1098567834 [TCP segment of a reassembled PDU]"
"5.898701","172.18.0.2","54.38.73.16","TCP","68","36876 → 21002 [ACK] Seq=18318 Ack=278516 Win=5551 Len=0 TSval=1098567858 TSecr=2678791147"
"5.899254","172.18.0.2","54.38.73.16","TLSv1.2","611","Application Data"
"5.907936","54.38.73.16","172.18.0.2","TCP","1516","21002 → 36876 [ACK] Seq=279964 Ack=18318 Win=1452 Len=1448 TSval=2678791150 TSecr=1098567834 [TCP segment of a reassembled PDU]"
"5.914471","54.38.73.16","172.18.0.2","TLSv1.2","2964","Application Data [TCP segment of a reassembled PDU]"
"5.914496","172.18.0.2","54.38.73.16","TCP","68","36876 → 21002 [ACK] Seq=18861 Ack=284308 Win=5596 Len=0 TSval=1098567874 TSecr=2678791150"
"5.922193","54.38.73.16","172.18.0.2","TLSv1.2","10816","Application Data, Application Data, Application Data, Application Data"
"5.922330","172.18.0.2","54.38.73.16","TCP","68","36876 → 21002 [ACK] Seq=18861 Ack=295056 Win=5554 Len=0 TSval=1098567882 TSecr=2678791153"
"5.931962","54.38.73.16","172.18.0.2","TCP","2964","[TCP segment of a reassembled PDU]"
"5.931994","172.18.0.2","54.38.73.16","TLSv1.2","611","Application Data"
"5.944102","54.38.73.16","172.18.0.2","TLSv1.2","2964","Application Data [TCP segment of a reassembled PDU]"
"5.944128","172.18.0.2","54.38.73.16","TCP","68","36876 → 21002 [ACK] Seq=19404 Ack=300848 Win=5596 Len=0 TSval=1098567904 TSecr=2678791159"
"5.946121","54.38.73.16","172.18.0.2","TLSv1.2","502","Application Data"
"5.986959","172.18.0.2","54.38.73.16","TCP","68","36876 → 21002 [ACK] Seq=19404 Ack=301282 Win=5612 Len=0 TSval=1098567947 TSecr=2678791159"
"5.994771","54.38.73.16","172.18.0.2","TCP","68","21002 → 36876 [ACK] Seq=301282 Ack=19404 Win=1452 Len=0 TSval=2678791172 TSecr=1098567892"
"5.994817","172.18.0.2","54.38.73.16","TLSv1.2","1154","Application Data, Application Data"
"6.058882","54.38.73.16","172.18.0.2","TCP","68","21002 → 36876 [ACK] Seq=301282 Ack=20490 Win=1452 Len=0 TSval=2678791188 TSecr=1098567954"
"6.281280","54.38.73.16","172.18.0.2","TLSv1.2","611","Application Data"
"6.281328","172.18.0.2","54.38.73.16","TCP","68","36876 → 21002 [ACK] Seq=20490 Ack=301825 Win=5608 Len=0 TSval=1098568241 TSecr=2678791243"
"6.282342","172.18.0.2","54.38.73.16","TLSv1.2","611","Application Data"
"6.306702","54.38.73.16","172.18.0.2","TCP","68","21002 → 36876 [ACK] Seq=301825 Ack=21033 Win=1452 Len=0 TSval=2678791250 TSecr=1098568242"
"6.631784","54.38.73.16","172.18.0.2","TLSv1.2","611","Application Data"
"6.631843","172.18.0.2","54.38.73.16","TCP","68","36876 → 21002 [ACK] Seq=21033 Ack=302368 Win=5608 Len=0 TSval=1098568591 TSecr=2678791331"
"6.642241","54.38.73.16","172.18.0.2","TCP","2964","[TCP segment of a reassembled PDU]"
"6.642262","172.18.0.2","54.38.73.16","TCP","68","36876 → 21002 [ACK] Seq=21033 Ack=305264 Win=5596 Len=0 TSval=1098568602 TSecr=2678791334"
"6.642867","54.38.73.16","172.18.0.2","TLSv1.2","4412","Application Data [TCP segment of a reassembled PDU]"
"6.642887","172.18.0.2","54.38.73.16","TCP","68","36876 → 21002 [ACK] Seq=21033 Ack=309608 Win=5580 Len=0 TSval=1098568603 TSecr=2678791334"
"6.655018","54.38.73.16","172.18.0.2","TLSv1.2","5860","Application Data, Application Data"
"6.655043","172.18.0.2","54.38.73.16","TCP","68","36876 → 21002 [ACK] Seq=21033 Ack=315400 Win=5581 Len=0 TSval=1098568615 TSecr=2678791337"
"6.656820","54.38.73.16","172.18.0.2","TLSv1.2","2572","Application Data"
"6.656844","172.18.0.2","54.38.73.16","TCP","68","36876 → 21002 [ACK] Seq=21033 Ack=317904 Win=5597 Len=0 TSval=1098568617 TSecr=2678791337"
"6.668081","54.38.73.16","172.18.0.2","TLSv1.2","7308","Application Data"
"6.668122","172.18.0.2","54.38.73.16","TCP","68","36876 → 21002 [ACK] Seq=21033 Ack=325144 Win=5565 Len=0 TSval=1098568628 TSecr=2678791340"
"6.679691","54.38.73.16","172.18.0.2","TLSv1.2","5860","Application Data, Application Data"
"6.679718","172.18.0.2","54.38.73.16","TCP","68","36876 → 21002 [ACK] Seq=21033 Ack=330936 Win=5581 Len=0 TSval=1098568639 TSecr=2678791343"
"6.680684","172.18.0.2","54.38.73.16","TLSv1.2","611","Application Data"
"6.683054","54.38.73.16","172.18.0.2","TCP","2964","21002 → 36876 [ACK] Seq=330936 Ack=21033 Win=1452 Len=2896 TSval=2678791343 TSecr=1098568617 [TCP segment of a reassembled PDU]"
"6.683080","172.18.0.2","54.38.73.16","TCP","68","36876 → 21002 [ACK] Seq=21576 Ack=333832 Win=5596 Len=0 TSval=1098568643 TSecr=2678791343"
"6.692556","54.38.73.16","172.18.0.2","TLSv1.2","4412","Application Data, Application Data"
"6.692581","172.18.0.2","54.38.73.16","TCP","68","36876 → 21002 [ACK] Seq=21576 Ack=338176 Win=5580 Len=0 TSval=1098568652 TSecr=2678791346"
"6.693382","54.38.73.16","172.18.0.2","TLSv1.2","1516","Application Data [TCP segment of a reassembled PDU]"
"6.693403","172.18.0.2","54.38.73.16","TCP","68","36876 → 21002 [ACK] Seq=21576 Ack=339624 Win=5593 Len=0 TSval=1098568653 TSecr=2678791346"
"6.704312","54.38.73.16","172.18.0.2","TCP","1516","21002 → 36876 [ACK] Seq=339624 Ack=21033 Win=1452 Len=1448 TSval=2678791349 TSecr=1098568628 [TCP segment of a reassembled PDU]"
"6.704337","172.18.0.2","54.38.73.16","TCP","68","36876 → 21002 [ACK] Seq=21576 Ack=341072 Win=5593 Len=0 TSval=1098568664 TSecr=2678791349"
"6.705422","54.38.73.16","172.18.0.2","TCP","68","[TCP Previous segment not captured] 21002 → 36876 [ACK] Seq=348312 Ack=21576 Win=1452 Len=0 TSval=2678791349 TSecr=1098568640"
"6.705448","54.38.73.16","172.18.0.2","TCP","7308","[TCP Retransmission] 21002 → 36876 [ACK] Seq=341072 Ack=21033 Win=1452 Len=7240 TSval=2678791349 TSecr=1098568639"
"6.705463","172.18.0.2","54.38.73.16","TCP","68","36876 → 21002 [ACK] Seq=21576 Ack=348312 Win=5573 Len=0 TSval=1098568665 TSecr=2678791349"
"6.707976","54.38.73.16","172.18.0.2","TLSv1.2","2964","Ignored Unknown Record"
"6.708002","172.18.0.2","54.38.73.16","TCP","68","36876 → 21002 [ACK] Seq=21576 Ack=351208 Win=5596 Len=0 TSval=1098568668 TSecr=2678791350"
"6.718046","54.38.73.16","172.18.0.2","TLSv1.2","2964","Ignored Unknown Record"
"6.718072","172.18.0.2","54.38.73.16","TCP","68","36876 → 21002 [ACK] Seq=21576 Ack=354104 Win=5596 Len=0 TSval=1098568678 TSecr=2678791353"
"6.718379","54.38.73.16","172.18.0.2","TLSv1.2","2766","Ignored Unknown Record"
"6.718402","172.18.0.2","54.38.73.16","TCP","68","36876 → 21002 [ACK] Seq=21576 Ack=356802 Win=5582 Len=0 TSval=1098568678 TSecr=2678791353"
"6.718635","172.18.0.2","54.38.73.16","TLSv1.2","611","Application Data"
"6.782696","54.38.73.16","172.18.0.2","TCP","68","21002 → 36876 [ACK] Seq=356802 Ack=22119 Win=1452 Len=0 TSval=2678791369 TSecr=1098568678"
"6.782729","172.18.0.2","54.38.73.16","TLSv1.2","1154","Application Data, Application Data"
"6.806990","54.38.73.16","172.18.0.2","TCP","68","21002 → 36876 [ACK] Seq=356802 Ack=23205 Win=1452 Len=0 TSval=2678791375 TSecr=1098568742"
"7.052264","54.38.73.16","172.18.0.2","TLSv1.2","611","Application Data"
"7.053307","172.18.0.2","54.38.73.16","TLSv1.2","611","Application Data"
"7.077167","54.38.73.16","172.18.0.2","TCP","68","21002 → 36876 [ACK] Seq=357345 Ack=23748 Win=1452 Len=0 TSval=2678791442 TSecr=1098569013"
"7.318219","54.38.73.16","172.18.0.2","TLSv1.2","3695","Application Data"
"7.318263","54.38.73.16","172.18.0.2","TLSv1.2","7308","Application Data"
"7.318381","172.18.0.2","54.38.73.16","TCP","68","36876 → 21002 [ACK] Seq=23748 Ack=368212 Win=5535 Len=0 TSval=1098569278 TSecr=2678791498"
"7.342130","54.38.73.16","172.18.0.2","TLSv1.2","1139","Application Data, Application Data"
"7.357635","54.38.73.16","172.18.0.2","TCP","1516","[TCP segment of a reassembled PDU]"
"7.357658","172.18.0.2","54.38.73.16","TCP","68","36876 → 21002 [ACK] Seq=23748 Ack=370731 Win=5593 Len=0 TSval=1098569317 TSecr=2678791509"
"7.383079","54.38.73.16","172.18.0.2","TLSv1.2","1219","Application Data"
"7.389075","172.18.0.2","54.38.73.16","TLSv1.2","611","Application Data"
"7.413156","54.38.73.16","172.18.0.2","TCP","68","21002 → 36876 [ACK] Seq=371882 Ack=24291 Win=1452 Len=0 TSval=2678791526 TSecr=1098569349"
"7.818308","54.38.73.16","172.18.0.2","TLSv1.2","611","Application Data"
"7.819367","172.18.0.2","54.38.73.16","TLSv1.2","611","Application Data"
"7.843494","54.38.73.16","172.18.0.2","TCP","68","21002 → 36876 [ACK] Seq=372425 Ack=24834 Win=1452 Len=0 TSval=2678791634 TSecr=1098569779"
"8.189822","54.38.73.16","172.18.0.2","TLSv1.2","3181","Application Data"
"8.189971","172.18.0.2","54.38.73.16","TCP","68","36876 → 21002 [ACK] Seq=24834 Ack=375538 Win=5588 Len=0 TSval=1098570150 TSecr=2678791720"
"8.220286","54.38.73.16","172.18.0.2","TLSv1.2","4145","Application Data"
"8.220312","172.18.0.2","54.38.73.16","TCP","68","36876 → 21002 [ACK] Seq=24834 Ack=379615 Win=5589 Len=0 TSval=1098570180 TSecr=2678791728"
"8.220331","54.38.73.16","172.18.0.2","TCP","2964","[TCP segment of a reassembled PDU]"
"8.220445","172.18.0.2","54.38.73.16","TCP","68","36876 → 21002 [ACK] Seq=24834 Ack=382511 Win=5567 Len=0 TSval=1098570180 TSecr=2678791728"
"8.230791","54.38.73.16","172.18.0.2","TLSv1.2","7308","Application Data, Application Data"
"8.230962","172.18.0.2","54.38.73.16","TCP","68","36876 → 21002 [ACK] Seq=24834 Ack=389751 Win=5565 Len=0 TSval=1098570191 TSecr=2678791731"
"8.244262","54.38.73.16","172.18.0.2","TLSv1.2","5047","Application Data, Application Data, Application Data"
"8.244286","172.18.0.2","54.38.73.16","TCP","68","36876 → 21002 [ACK] Seq=24834 Ack=394730 Win=5584 Len=0 TSval=1098570204 TSecr=2678791734"
"8.253680","54.38.73.16","172.18.0.2","TCP","2964","[TCP segment of a reassembled PDU]"
"8.253706","172.18.0.2","54.38.73.16","TCP","68","36876 → 21002 [ACK] Seq=24834 Ack=397626 Win=5596 Len=0 TSval=1098570213 TSecr=2678791736"
"8.268355","54.38.73.16","172.18.0.2","TLSv1.2","1516","Application Data, Application Data"
"8.268803","172.18.0.2","54.38.73.16","TLSv1.2","611","Application Data"
"8.269503","54.38.73.16","172.18.0.2","TLSv1.2","1465","Application Data"
"8.279513","54.38.73.16","172.18.0.2","TCP","2964","[TCP segment of a reassembled PDU]"
"8.279547","172.18.0.2","54.38.73.16","TCP","68","36876 → 21002 [ACK] Seq=25377 Ack=403367 Win=5596 Len=0 TSval=1098570239 TSecr=2678791740"
"8.292794","54.38.73.16","172.18.0.2","TCP","68","21002 → 36876 [ACK] Seq=403367 Ack=25377 Win=1452 Len=0 TSval=2678791746 TSecr=1098570228"
"8.298996","54.38.73.16","172.18.0.2","TLSv1.2","5860","Application Data, Application Data, Application Data"
"8.299142","172.18.0.2","54.38.73.16","TCP","68","36876 → 21002 [ACK] Seq=25377 Ack=409159 Win=5581 Len=0 TSval=1098570259 TSecr=2678791747"
"8.299929","172.18.0.2","54.38.73.16","TLSv1.2","611","Application Data"
"8.303036","54.38.73.16","172.18.0.2","TLSv1.2","234","Application Data"
"8.309787","54.38.73.16","172.18.0.2","TCP","2964","[TCP segment of a reassembled PDU]"
"8.309811","172.18.0.2","54.38.73.16","TCP","68","36876 → 21002 [ACK] Seq=25920 Ack=412221 Win=5596 Len=0 TSval=1098570269 TSecr=2678791749"
"8.334713","54.38.73.16","172.18.0.2","TLSv1.2","1342","Application Data, Application Data"
"8.353423","54.38.73.16","172.18.0.2","TCP","2964","[TCP segment of a reassembled PDU]"
"8.353450","172.18.0.2","54.38.73.16","TCP","68","36876 → 21002 [ACK] Seq=25920 Ack=416391 Win=5596 Len=0 TSval=1098570313 TSecr=2678791757"
"8.364340","54.38.73.16","172.18.0.2","TLSv1.2","4412","Application Data [TCP segment of a reassembled PDU]"
"8.364481","172.18.0.2","54.38.73.16","TCP","68","36876 → 21002 [ACK] Seq=25920 Ack=420735 Win=5580 Len=0 TSval=1098570324 TSecr=2678791764"
"8.379203","54.38.73.16","172.18.0.2","TLSv1.2","1356","[TCP Previous segment not captured] , Ignored Unknown Record"
"8.379230","172.18.0.2","54.38.73.16","TCP","80","[TCP Window Update] 36876 → 21002 [ACK] Seq=25920 Ack=420735 Win=5593 Len=0 TSval=1098570339 TSecr=2678791764 SLE=423631 SRE=424919"
"8.379234","54.38.73.16","172.18.0.2","TCP","2964","[TCP Out-Of-Order] 21002 → 36876 [ACK] Seq=420735 Ack=25920 Win=1452 Len=2896 TSval=2678791767 TSecr=1098570260"
"8.379266","172.18.0.2","54.38.73.16","TCP","68","36876 → 21002 [ACK] Seq=25920 Ack=424919 Win=5580 Len=0 TSval=1098570339 TSecr=2678791767"
"8.380006","172.18.0.2","54.38.73.16","TLSv1.2","611","Application Data"
"8.427202","54.38.73.16","172.18.0.2","TLSv1.2","4145","Application Data"
"8.427264","172.18.0.2","54.38.73.16","TCP","68","36876 → 21002 [ACK] Seq=26463 Ack=428996 Win=5589 Len=0 TSval=1098570387 TSecr=2678791779"
"8.427272","54.38.73.16","172.18.0.2","TCP","2964","[TCP segment of a reassembled PDU]"
"8.427363","172.18.0.2","54.38.73.16","TCP","68","36876 → 21002 [ACK] Seq=26463 Ack=431892 Win=5567 Len=0 TSval=1098570387 TSecr=2678791779"
"8.439987","54.38.73.16","172.18.0.2","TLSv1.2","2964","Application Data [TCP segment of a reassembled PDU]"
"8.440011","172.18.0.2","54.38.73.16","TCP","68","36876 → 21002 [ACK] Seq=26463 Ack=434788 Win=5596 Len=0 TSval=1098570400 TSecr=2678791782"
"8.440578","54.38.73.16","172.18.0.2","TCP","1516","21002 → 36876 [ACK] Seq=434788 Ack=26463 Win=1452 Len=1448 TSval=2678791782 TSecr=1098570340 [TCP segment of a reassembled PDU]"
"8.452409","54.38.73.16","172.18.0.2","TLSv1.2","689","Application Data, Application Data"
"8.452550","172.18.0.2","54.38.73.16","TCP","68","36876 → 21002 [ACK] Seq=26463 Ack=436857 Win=5593 Len=0 TSval=1098570412 TSecr=2678791782"
"8.459810","172.18.0.2","54.38.73.16","TLSv1.2","611","Application Data"
"8.522002","54.38.73.16","172.18.0.2","TCP","68","21002 → 36876 [ACK] Seq=436857 Ack=27006 Win=1452 Len=0 TSval=2678791804 TSecr=1098570419"
"8.957180","54.38.73.16","172.18.0.2","TLSv1.2","611","Application Data"
"8.958290","172.18.0.2","54.38.73.16","TLSv1.2","611","Application Data"
"8.973948","54.38.73.16","172.18.0.2","TLSv1.2","611","[TCP Spurious Retransmission] , Application Data"
"8.973981","172.18.0.2","54.38.73.16","TCP","80","[TCP Dup ACK 321#1] 36876 → 21002 [ACK] Seq=27549 Ack=437400 Win=5612 Len=0 TSval=1098570934 TSecr=2678791917 SLE=436857 SRE=437400"
"8.982952","54.38.73.16","172.18.0.2","TCP","68","21002 → 36876 [ACK] Seq=437400 Ack=27549 Win=1452 Len=0 TSval=2678791919 TSecr=1098570918"
"9.285436","54.38.73.16","172.18.0.2","TLSv1.2","3695","Application Data"
"9.285484","172.18.0.2","54.38.73.16","TCP","68","36876 → 21002 [ACK] Seq=27549 Ack=441027 Win=5584 Len=0 TSval=1098571245 TSecr=2678791994"
"9.310621","54.38.73.16","172.18.0.2","TLSv1.2","1125","Application Data"
"9.310646","172.18.0.2","54.38.73.16","TCP","68","36876 → 21002 [ACK] Seq=27549 Ack=442084 Win=5593 Len=0 TSval=1098571270 TSecr=2678792001"
"9.347136","54.38.73.16","172.18.0.2","TLSv1.2","4145","Application Data"
"9.347161","172.18.0.2","54.38.73.16","TCP","68","36876 → 21002 [ACK] Seq=27549 Ack=446161 Win=5580 Len=0 TSval=1098571307 TSecr=2678792010"
"9.347183","54.38.73.16","172.18.0.2","TLSv1.2","5860","Application Data"
"9.347213","172.18.0.2","54.38.73.16","TCP","68","36876 → 21002 [ACK] Seq=27549 Ack=451953 Win=5550 Len=0 TSval=1098571307 TSecr=2678792010"
"9.371733","54.38.73.16","172.18.0.2","TLSv1.2","9934","Application Data, Application Data, Application Data, Application Data, Application Data"
"9.371759","172.18.0.2","54.38.73.16","TCP","68","36876 → 21002 [ACK] Seq=27549 Ack=461819 Win=5550 Len=0 TSval=1098571331 TSecr=2678792016"
"9.372870","172.18.0.2","54.38.73.16","TLSv1.2","611","Application Data"
"9.377586","54.38.73.16","172.18.0.2","TCP","1516","[TCP segment of a reassembled PDU]"
"9.377611","172.18.0.2","54.38.73.16","TCP","68","36876 → 21002 [ACK] Seq=28092 Ack=463267 Win=5593 Len=0 TSval=1098571337 TSecr=2678792017"
"9.397314","54.38.73.16","172.18.0.2","TCP","68","[TCP Previous segment not captured] 21002 → 36876 [ACK] Seq=471955 Ack=28092 Win=1452 Len=0 TSval=2678792022 TSecr=1098571333"
"9.397338","54.38.73.16","172.18.0.2","TCP","8756","[TCP Retransmission] 21002 → 36876 [ACK] Seq=463267 Ack=27549 Win=1452 Len=8688 TSval=2678792022 TSecr=1098571331"
"9.397353","172.18.0.2","54.38.73.16","TCP","68","36876 → 21002 [ACK] Seq=28092 Ack=471955 Win=5566 Len=0 TSval=1098571357 TSecr=2678792022"
"9.397851","172.18.0.2","54.38.73.16","TLSv1.2","611","Application Data"
"9.401821","54.38.73.16","172.18.0.2","TLSv1.2","1841","Ignored Unknown Record"
"9.401845","172.18.0.2","54.38.73.16","TCP","68","36876 → 21002 [ACK] Seq=28635 Ack=473728 Win=5600 Len=0 TSval=1098571362 TSecr=2678792023"
"9.462627","54.38.73.16","172.18.0.2","TCP","68","21002 → 36876 [ACK] Seq=473728 Ack=28635 Win=1452 Len=0 TSval=2678792039 TSecr=1098571358"
"9.462659","172.18.0.2","54.38.73.16","TLSv1.2","611","Application Data"
"9.486867","54.38.73.16","172.18.0.2","TCP","68","21002 → 36876 [ACK] Seq=473728 Ack=29178 Win=1452 Len=0 TSval=2678792045 TSecr=1098571422"
"9.685136","54.38.73.16","172.18.0.2","TLSv1.2","611","Application Data"
"9.685160","172.18.0.2","54.38.73.16","TCP","68","36876 → 21002 [ACK] Seq=29178 Ack=474271 Win=5608 Len=0 TSval=1098571645 TSecr=2678792094"
"9.686198","172.18.0.2","54.38.73.16","TLSv1.2","611","Application Data"
"9.710421","54.38.73.16","172.18.0.2","TCP","68","21002 → 36876 [ACK] Seq=474271 Ack=29721 Win=1452 Len=0 TSval=2678792100 TSecr=1098571646"
"9.911409","54.38.73.16","172.18.0.2","TLSv1.2","611","Application Data"
"9.922557","54.38.73.16","172.18.0.2","TCP","2964","[TCP segment of a reassembled PDU]"
"9.922700","172.18.0.2","54.38.73.16","TCP","68","36876 → 21002 [ACK] Seq=29721 Ack=477710 Win=5596 Len=0 TSval=1098571882 TSecr=2678792151"
"9.931411","54.38.73.16","172.18.0.2","TLSv1.2","2964","Application Data [TCP segment of a reassembled PDU]"
"9.931458","172.18.0.2","54.38.73.16","TCP","68","36876 → 21002 [ACK] Seq=29721 Ack=480606 Win=5596 Len=0 TSval=1098571891 TSecr=2678792156"
"9.931995","54.38.73.16","172.18.0.2","TLSv1.2","5860","Application Data [TCP segment of a reassembled PDU]"
"9.932123","172.18.0.2","54.38.73.16","TCP","68","36876 → 21002 [ACK] Seq=29721 Ack=486398 Win=5581 Len=0 TSval=1098571892 TSecr=2678792156"
"9.947120","54.38.73.16","172.18.0.2","TLSv1.2","2964","Application Data [TCP segment of a reassembled PDU]"
"9.947145","172.18.0.2","54.38.73.16","TCP","68","36876 → 21002 [ACK] Seq=29721 Ack=489294 Win=5596 Len=0 TSval=1098571907 TSecr=2678792160"
"9.954587","54.38.73.16","172.18.0.2","TLSv1.2","2964","Application Data [TCP segment of a reassembled PDU]"
"9.954611","172.18.0.2","54.38.73.16","TCP","68","36876 → 21002 [ACK] Seq=29721 Ack=492190 Win=5596 Len=0 TSval=1098571914 TSecr=2678792162"
"9.956138","54.38.73.16","172.18.0.2","TLSv1.2","6539","Application Data, Application Data, Application Data"
"9.956269","172.18.0.2","54.38.73.16","TCP","68","36876 → 21002 [ACK] Seq=29721 Ack=498661 Win=5565 Len=0 TSval=1098571916 TSecr=2678792162"
"9.972579","54.38.73.16","172.18.0.2","TCP","2964","[TCP segment of a reassembled PDU]"
"9.972604","172.18.0.2","54.38.73.16","TCP","68","36876 → 21002 [ACK] Seq=29721 Ack=501557 Win=5596 Len=0 TSval=1098571932 TSecr=2678792166"
"9.980100","54.38.73.16","172.18.0.2","TLSv1.2","799","Application Data"
"9.980546","172.18.0.2","54.38.73.16","TLSv1.2","611","Application Data"
"9.987102","54.38.73.16","172.18.0.2","TLSv1.2","5860","Application Data"
"9.987243","172.18.0.2","54.38.73.16","TCP","68","36876 → 21002 [ACK] Seq=30264 Ack=508080 Win=5581 Len=0 TSval=1098571947 TSecr=2678792170"
"9.999213","54.38.73.16","172.18.0.2","TLSv1.2","2964","Application Data [TCP segment of a reassembled PDU]"
"9.999238","172.18.0.2","54.38.73.16","TCP","68","36876 → 21002 [ACK] Seq=30264 Ack=510976 Win=5596 Len=0 TSval=1098571959 TSecr=2678792173"
"10.006279","54.38.73.16","172.18.0.2","TLSv1.2","205","Application Data"
"10.020279","54.38.73.16","172.18.0.2","TCP","2964","[TCP segment of a reassembled PDU]"
"10.020304","172.18.0.2","54.38.73.16","TCP","68","36876 → 21002 [ACK] Seq=30264 Ack=514009 Win=5596 Len=0 TSval=1098571980 TSecr=2678792174"
"10.030214","54.38.73.16","172.18.0.2","TLSv1.2","4412","Application Data [TCP segment of a reassembled PDU]"
"10.030353","172.18.0.2","54.38.73.16","TCP","68","36876 → 21002 [ACK] Seq=30264 Ack=518353 Win=5580 Len=0 TSval=1098571990 TSecr=2678792180"
"10.030455","54.38.73.16","172.18.0.2","TLSv1.2","2964","Application Data [TCP segment of a reassembled PDU]"
"10.030901","172.18.0.2","54.38.73.16","TLSv1.2","611","Application Data"
"10.041202","54.38.73.16","172.18.0.2","TLSv1.2","1516","Application Data [TCP segment of a reassembled PDU]"
"10.043817","54.38.73.16","172.18.0.2","TLSv1.2","3506","Application Data"
"10.043843","172.18.0.2","54.38.73.16","TCP","68","36876 → 21002 [ACK] Seq=30807 Ack=526135 Win=5580 Len=0 TSval=1098572004 TSecr=2678792183"
