_ws.col.Time,_ws.col.Source,_ws.col.Destination,_ws.col.Protocol,_ws.col.Length,_ws.col.Info
"0.000000","172.19.0.3","5.9.29.183","TLSv1.2","599","Application Data"
"0.000280","5.9.29.183","172.19.0.3","TCP","56","9002 → 43520 [ACK] Seq=1 Ack=544 Win=65535 Len=0"
"0.180279","5.9.29.183","172.19.0.3","TLSv1.2","599","Application Data"
"0.180303","172.19.0.3","5.9.29.183","TCP","56","43520 → 9002 [ACK] Seq=544 Ack=544 Win=11911 Len=0"
"0.181677","172.19.0.3","5.9.29.183","TLSv1.2","2141","Application Data"
"0.182112","5.9.29.183","172.19.0.3","TCP","56","9002 → 43520 [ACK] Seq=544 Ack=2629 Win=65535 Len=0"
"0.589883","5.9.29.183","172.19.0.3","TLSv1.2","599","Application Data"
"0.605343","5.9.29.183","172.19.0.3","TCP","1516","[TCP segment of a reassembled PDU]"
"0.605367","172.19.0.3","5.9.29.183","TCP","56","43520 → 9002 [ACK] Seq=2629 Ack=2547 Win=11911 Len=0"
"0.605423","5.9.29.183","172.19.0.3","TLSv1.2","167","Application Data"
"0.609812","172.19.0.3","5.9.29.183","TLSv1.2","599","Application Data"
"0.610116","5.9.29.183","172.19.0.3","TCP","56","9002 → 43520 [ACK] Seq=2658 Ack=3172 Win=65535 Len=0"
"0.834716","5.9.29.183","172.19.0.3","TLSv1.2","599","Application Data"
"0.835659","172.19.0.3","5.9.29.183","TLSv1.2","599","Application Data"
"0.836009","5.9.29.183","172.19.0.3","TCP","56","9002 → 43520 [ACK] Seq=3201 Ack=3715 Win=65535 Len=0"
"0.993318","5.9.29.183","172.19.0.3","TCP","1516","[TCP segment of a reassembled PDU]"
"0.993390","5.9.29.183","172.19.0.3","TCP","1516","9002 → 43520 [PSH, ACK] Seq=4661 Ack=3715 Win=65535 Len=1460 [TCP segment of a reassembled PDU]"
"0.993404","5.9.29.183","172.19.0.3","TLSv1.2","763","Application Data"
"0.993588","172.19.0.3","5.9.29.183","TCP","56","43520 → 9002 [ACK] Seq=3715 Ack=6828 Win=11895 Len=0"
"1.006414","5.9.29.183","172.19.0.3","TCP","1516","[TCP segment of a reassembled PDU]"
"1.006481","5.9.29.183","172.19.0.3","TCP","1492","9002 → 43520 [PSH, ACK] Seq=8288 Ack=3715 Win=65535 Len=1436 [TCP segment of a reassembled PDU]"
"1.006498","172.19.0.3","5.9.29.183","TCP","56","43520 → 9002 [ACK] Seq=3715 Ack=9724 Win=11903 Len=0"
"1.010943","5.9.29.183","172.19.0.3","TLSv1.2","1330","Application Data, Application Data"
"1.051235","172.19.0.3","5.9.29.183","TCP","56","43520 → 9002 [ACK] Seq=3715 Ack=10998 Win=11911 Len=0"
"1.070419","5.9.29.183","172.19.0.3","TCP","1516","[TCP segment of a reassembled PDU]"
"1.070507","172.19.0.3","5.9.29.183","TCP","56","43520 → 9002 [ACK] Seq=3715 Ack=12458 Win=11911 Len=0"
"1.070511","5.9.29.183","172.19.0.3","TCP","1516","9002 → 43520 [PSH, ACK] Seq=12458 Ack=3715 Win=65535 Len=1460 [TCP segment of a reassembled PDU]"
"1.070522","172.19.0.3","5.9.29.183","TCP","56","43520 → 9002 [ACK] Seq=3715 Ack=13918 Win=11903 Len=0"
"1.070524","5.9.29.183","172.19.0.3","TLSv1.2","1516","Application Data [TCP segment of a reassembled PDU]"
"1.070529","172.19.0.3","5.9.29.183","TCP","56","43520 → 9002 [ACK] Seq=3715 Ack=15378 Win=11895 Len=0"
"1.070531","5.9.29.183","172.19.0.3","TCP","1516","9002 → 43520 [PSH, ACK] Seq=15378 Ack=3715 Win=65535 Len=1460 [TCP segment of a reassembled PDU]"
"1.070538","172.19.0.3","5.9.29.183","TCP","56","43520 → 9002 [ACK] Seq=3715 Ack=16838 Win=11887 Len=0"
"1.070539","5.9.29.183","172.19.0.3","TCP","1189","9002 → 43520 [PSH, ACK] Seq=16838 Ack=3715 Win=65535 Len=1133 [TCP segment of a reassembled PDU]"
"1.070544","172.19.0.3","5.9.29.183","TCP","56","43520 → 9002 [ACK] Seq=3715 Ack=17971 Win=11879 Len=0"
"1.083696","5.9.29.183","172.19.0.3","TLSv1.2","1516","Application Data, Application Data"
"1.083717","172.19.0.3","5.9.29.183","TCP","56","43520 → 9002 [ACK] Seq=3715 Ack=19431 Win=11911 Len=0"
"1.083769","5.9.29.183","172.19.0.3","TCP","1516","9002 → 43520 [PSH, ACK] Seq=19431 Ack=3715 Win=65535 Len=1460 [TCP segment of a reassembled PDU]"
"1.083782","172.19.0.3","5.9.29.183","TCP","56","43520 → 9002 [ACK] Seq=3715 Ack=20891 Win=11903 Len=0"
"1.083785","5.9.29.183","172.19.0.3","TCP","1516","9002 → 43520 [PSH, ACK] Seq=20891 Ack=3715 Win=65535 Len=1460 [TCP segment of a reassembled PDU]"
"1.083791","172.19.0.3","5.9.29.183","TCP","56","43520 → 9002 [ACK] Seq=3715 Ack=22351 Win=11895 Len=0"
"1.083792","5.9.29.183","172.19.0.3","TLSv1.2","1516","Application Data [TCP segment of a reassembled PDU]"
"1.083798","172.19.0.3","5.9.29.183","TCP","56","43520 → 9002 [ACK] Seq=3715 Ack=23811 Win=11887 Len=0"
"1.083799","5.9.29.183","172.19.0.3","TCP","1257","9002 → 43520 [PSH, ACK] Seq=23811 Ack=3715 Win=65535 Len=1201 [TCP segment of a reassembled PDU]"
"1.083805","172.19.0.3","5.9.29.183","TCP","56","43520 → 9002 [ACK] Seq=3715 Ack=25012 Win=11879 Len=0"
"1.083903","5.9.29.183","172.19.0.3","TCP","255","9002 → 43520 [PSH, ACK] Seq=25012 Ack=3715 Win=65535 Len=199 [TCP segment of a reassembled PDU]"
"1.083915","172.19.0.3","5.9.29.183","TCP","56","43520 → 9002 [ACK] Seq=3715 Ack=25211 Win=11878 Len=0"
"1.085827","5.9.29.183","172.19.0.3","TCP","1504","9002 → 43520 [PSH, ACK] Seq=25211 Ack=3715 Win=65535 Len=1448 [TCP segment of a reassembled PDU]"
"1.085838","172.19.0.3","5.9.29.183","TCP","56","43520 → 9002 [ACK] Seq=3715 Ack=26659 Win=11911 Len=0"
"1.085883","5.9.29.183","172.19.0.3","TLSv1.2","1017","Application Data, Application Data"
"1.086183","172.19.0.3","5.9.29.183","TCP","56","43520 → 9002 [ACK] Seq=3715 Ack=27620 Win=11911 Len=0"
"1.101351","5.9.29.183","172.19.0.3","TCP","1516","[TCP segment of a reassembled PDU]"
"1.101437","5.9.29.183","172.19.0.3","TCP","1492","9002 → 43520 [PSH, ACK] Seq=29080 Ack=3715 Win=65535 Len=1436 [TCP segment of a reassembled PDU]"
"1.101638","172.19.0.3","5.9.29.183","TCP","56","43520 → 9002 [ACK] Seq=3715 Ack=30516 Win=11903 Len=0"
"1.104071","5.9.29.183","172.19.0.3","TLSv1.2","787","Application Data"
"1.104205","172.19.0.3","5.9.29.183","TCP","56","43520 → 9002 [ACK] Seq=3715 Ack=31247 Win=11911 Len=0"
"1.104480","172.19.0.3","5.9.29.183","TLSv1.2","599","Application Data"
"1.104756","5.9.29.183","172.19.0.3","TCP","56","9002 → 43520 [ACK] Seq=31247 Ack=4258 Win=65535 Len=0"
"1.112772","5.9.29.183","172.19.0.3","TCP","1516","[TCP segment of a reassembled PDU]"
"1.112824","5.9.29.183","172.19.0.3","TCP","1492","9002 → 43520 [PSH, ACK] Seq=32707 Ack=4258 Win=65535 Len=1436 [TCP segment of a reassembled PDU]"
"1.112988","172.19.0.3","5.9.29.183","TCP","56","43520 → 9002 [ACK] Seq=4258 Ack=34143 Win=11903 Len=0"
"1.121065","5.9.29.183","172.19.0.3","TLSv1.2","273","Application Data"
"1.124980","172.19.0.3","5.9.29.183","TLSv1.2","599","Application Data"
"1.125355","5.9.29.183","172.19.0.3","TCP","56","9002 → 43520 [ACK] Seq=34360 Ack=4801 Win=65535 Len=0"
"1.314506","5.9.29.183","172.19.0.3","TLSv1.2","599","Application Data"
"1.315455","172.19.0.3","5.9.29.183","TLSv1.2","599","Application Data"
"1.316069","5.9.29.183","172.19.0.3","TCP","56","9002 → 43520 [ACK] Seq=34903 Ack=5344 Win=65535 Len=0"
"1.549861","5.9.29.183","172.19.0.3","TCP","1516","[TCP segment of a reassembled PDU]"
"1.549939","5.9.29.183","172.19.0.3","TCP","1516","9002 → 43520 [PSH, ACK] Seq=36363 Ack=5344 Win=65535 Len=1460 [TCP segment of a reassembled PDU]"
"1.549952","5.9.29.183","172.19.0.3","TLSv1.2","1213","Application Data"
"1.549958","5.9.29.183","172.19.0.3","TCP","1516","[TCP segment of a reassembled PDU]"
"1.550044","5.9.29.183","172.19.0.3","TCP","1516","9002 → 43520 [PSH, ACK] Seq=40440 Ack=5344 Win=65535 Len=1460 [TCP segment of a reassembled PDU]"
"1.550051","5.9.29.183","172.19.0.3","TLSv1.2","1516","Application Data [TCP segment of a reassembled PDU]"
"1.550146","172.19.0.3","5.9.29.183","TCP","56","43520 → 9002 [ACK] Seq=5344 Ack=43360 Win=11869 Len=0"
"1.550173","5.9.29.183","172.19.0.3","TCP","1516","9002 → 43520 [PSH, ACK] Seq=43360 Ack=5344 Win=65535 Len=1460 [TCP segment of a reassembled PDU]"
"1.550176","5.9.29.183","172.19.0.3","TCP","1456","9002 → 43520 [PSH, ACK] Seq=44820 Ack=5344 Win=65535 Len=1400 [TCP segment of a reassembled PDU]"
"1.550200","172.19.0.3","5.9.29.183","TCP","56","43520 → 9002 [ACK] Seq=5344 Ack=46220 Win=11853 Len=0"
"1.565728","5.9.29.183","172.19.0.3","TLSv1.2","648","Application Data"
"1.573838","5.9.29.183","172.19.0.3","TCP","1516","[TCP segment of a reassembled PDU]"
"1.573854","172.19.0.3","5.9.29.183","TCP","56","43520 → 9002 [ACK] Seq=5344 Ack=48272 Win=11911 Len=0"
"1.573908","5.9.29.183","172.19.0.3","TCP","1516","9002 → 43520 [PSH, ACK] Seq=48272 Ack=5344 Win=65535 Len=1460 [TCP segment of a reassembled PDU]"
"1.573916","5.9.29.183","172.19.0.3","TLSv1.2","1516","Application Data [TCP segment of a reassembled PDU]"
"1.573918","5.9.29.183","172.19.0.3","TCP","1516","9002 → 43520 [PSH, ACK] Seq=51192 Ack=5344 Win=65535 Len=1460 [TCP segment of a reassembled PDU]"
"1.573921","5.9.29.183","172.19.0.3","TCP","1456","9002 → 43520 [PSH, ACK] Seq=52652 Ack=5344 Win=65535 Len=1400 [TCP segment of a reassembled PDU]"
"1.573986","5.9.29.183","172.19.0.3","TLSv1.2","1516","Application Data [TCP segment of a reassembled PDU]"
"1.573990","5.9.29.183","172.19.0.3","TCP","1516","9002 → 43520 [PSH, ACK] Seq=55512 Ack=5344 Win=65535 Len=1460 [TCP segment of a reassembled PDU]"
"1.573992","5.9.29.183","172.19.0.3","TCP","1516","9002 → 43520 [PSH, ACK] Seq=56972 Ack=5344 Win=65535 Len=1460 [TCP segment of a reassembled PDU]"
"1.573994","5.9.29.183","172.19.0.3","TLSv1.2","1516","Application Data [TCP segment of a reassembled PDU]"
"1.573996","5.9.29.183","172.19.0.3","TCP","1516","9002 → 43520 [PSH, ACK] Seq=59892 Ack=5344 Win=65535 Len=1460 [TCP segment of a reassembled PDU]"
"1.574057","5.9.29.183","172.19.0.3","TCP","1444","9002 → 43520 [PSH, ACK] Seq=61352 Ack=5344 Win=65535 Len=1388 [TCP segment of a reassembled PDU]"
"1.574068","172.19.0.3","5.9.29.183","TCP","56","43520 → 9002 [ACK] Seq=5344 Ack=61352 Win=11838 Len=0"
"1.574321","172.19.0.3","5.9.29.183","TLSv1.2","599","Application Data"
"1.574490","5.9.29.183","172.19.0.3","TCP","56","9002 → 43520 [ACK] Seq=62740 Ack=5887 Win=65535 Len=0"
"1.576216","5.9.29.183","172.19.0.3","TLSv1.2","1504","Application Data, Application Data"
"1.576357","5.9.29.183","172.19.0.3","TCP","1504","9002 → 43520 [PSH, ACK] Seq=64188 Ack=5887 Win=65535 Len=1448 [TCP segment of a reassembled PDU]"
"1.576364","172.19.0.3","5.9.29.183","TCP","56","43520 → 9002 [ACK] Seq=5887 Ack=65636 Win=11901 Len=0"
"1.582121","5.9.29.183","172.19.0.3","TLSv1.2","424","Application Data"
"1.584209","172.19.0.3","5.9.29.183","TLSv1.2","599","Application Data"
"1.584566","5.9.29.183","172.19.0.3","TCP","56","9002 → 43520 [ACK] Seq=66004 Ack=6430 Win=65535 Len=0"
"1.586602","5.9.29.183","172.19.0.3","TCP","1516","[TCP segment of a reassembled PDU]"
"1.586674","5.9.29.183","172.19.0.3","TCP","1492","9002 → 43520 [PSH, ACK] Seq=67464 Ack=6430 Win=65535 Len=1436 [TCP segment of a reassembled PDU]"
"1.586854","172.19.0.3","5.9.29.183","TCP","56","43520 → 9002 [ACK] Seq=6430 Ack=68900 Win=11903 Len=0"
"1.590379","5.9.29.183","172.19.0.3","TLSv1.2","1516","Application Data [TCP segment of a reassembled PDU]"
"1.590444","5.9.29.183","172.19.0.3","TCP","1516","9002 → 43520 [PSH, ACK] Seq=70360 Ack=6430 Win=65535 Len=1460 [TCP segment of a reassembled PDU]"
"1.590462","172.19.0.3","5.9.29.183","TCP","56","43520 → 9002 [ACK] Seq=6430 Ack=71820 Win=11903 Len=0"
"1.590465","5.9.29.183","172.19.0.3","TCP","1516","9002 → 43520 [PSH, ACK] Seq=71820 Ack=6430 Win=65535 Len=1460 [TCP segment of a reassembled PDU]"
"1.590469","5.9.29.183","172.19.0.3","TLSv1.2","1516","Application Data [TCP segment of a reassembled PDU]"
"1.590472","5.9.29.183","172.19.0.3","TCP","1456","9002 → 43520 [PSH, ACK] Seq=74740 Ack=6430 Win=65535 Len=1400 [TCP segment of a reassembled PDU]"
"1.590544","5.9.29.183","172.19.0.3","TCP","1516","9002 → 43520 [PSH, ACK] Seq=76140 Ack=6430 Win=65535 Len=1460 [TCP segment of a reassembled PDU]"
"1.590551","5.9.29.183","172.19.0.3","TLSv1.2","1516","Application Data [TCP segment of a reassembled PDU]"
"1.590636","172.19.0.3","5.9.29.183","TCP","56","43520 → 9002 [ACK] Seq=6430 Ack=79060 Win=11863 Len=0"
"1.590826","5.9.29.183","172.19.0.3","TCP","1516","9002 → 43520 [PSH, ACK] Seq=79060 Ack=6430 Win=65535 Len=1460 [TCP segment of a reassembled PDU]"
"1.590835","5.9.29.183","172.19.0.3","TCP","1468","9002 → 43520 [PSH, ACK] Seq=80520 Ack=6430 Win=65535 Len=1412 [TCP segment of a reassembled PDU]"
"1.590874","172.19.0.3","5.9.29.183","TCP","56","43520 → 9002 [ACK] Seq=6430 Ack=81932 Win=11847 Len=0"
"1.591206","5.9.29.183","172.19.0.3","TLSv1.2","1504","Application Data, Application Data"
"1.591453","5.9.29.183","172.19.0.3","TCP","1504","9002 → 43520 [PSH, ACK] Seq=83380 Ack=6430 Win=65535 Len=1448 [TCP segment of a reassembled PDU]"
"1.591575","172.19.0.3","5.9.29.183","TCP","56","43520 → 9002 [ACK] Seq=6430 Ack=84828 Win=11830 Len=0"
"1.596941","5.9.29.183","172.19.0.3","TLSv1.2","424","Application Data"
"1.610374","5.9.29.183","172.19.0.3","TCP","1504","[TCP segment of a reassembled PDU]"
"1.610422","172.19.0.3","5.9.29.183","TCP","56","43520 → 9002 [ACK] Seq=6430 Ack=86644 Win=11911 Len=0"
"1.610464","5.9.29.183","172.19.0.3","TCP","1516","9002 → 43520 [PSH, ACK] Seq=86644 Ack=6430 Win=65535 Len=1460 [TCP segment of a reassembled PDU]"
"1.610518","5.9.29.183","172.19.0.3","TLSv1.2","1516","Application Data [TCP segment of a reassembled PDU]"
"1.610531","5.9.29.183","172.19.0.3","TCP","1040","9002 → 43520 [PSH, ACK] Seq=89564 Ack=6430 Win=65535 Len=984 [TCP segment of a reassembled PDU]"
"1.610535","5.9.29.183","172.19.0.3","TCP","1516","9002 → 43520 [PSH, ACK] Seq=90548 Ack=6430 Win=65535 Len=1460 [TCP segment of a reassembled PDU]"
"1.610538","5.9.29.183","172.19.0.3","TLSv1.2","1516","Application Data [TCP segment of a reassembled PDU]"
"1.610541","5.9.29.183","172.19.0.3","TCP","472","9002 → 43520 [PSH, ACK] Seq=93468 Ack=6430 Win=65535 Len=416 [TCP segment of a reassembled PDU]"
"1.610543","5.9.29.183","172.19.0.3","TCP","1516","9002 → 43520 [PSH, ACK] Seq=93884 Ack=6430 Win=65535 Len=1460 [TCP segment of a reassembled PDU]"
"1.610545","5.9.29.183","172.19.0.3","TCP","1492","9002 → 43520 [PSH, ACK] Seq=95344 Ack=6430 Win=65535 Len=1436 [TCP segment of a reassembled PDU]"
"1.610619","5.9.29.183","172.19.0.3","TLSv1.2","1516","Application Data [TCP segment of a reassembled PDU]"
"1.610624","5.9.29.183","172.19.0.3","TCP","1492","9002 → 43520 [PSH, ACK] Seq=98240 Ack=6430 Win=65535 Len=1436 [TCP segment of a reassembled PDU]"
"1.610629","5.9.29.183","172.19.0.3","TCP","1504","9002 → 43520 [PSH, ACK] Seq=99676 Ack=6430 Win=65535 Len=1448 [TCP segment of a reassembled PDU]"
"1.610650","172.19.0.3","5.9.29.183","TCP","56","43520 → 9002 [ACK] Seq=6430 Ack=101124 Win=11820 Len=0"
"1.610875","172.19.0.3","5.9.29.183","TLSv1.2","599","Application Data"
"1.611062","5.9.29.183","172.19.0.3","TCP","56","9002 → 43520 [ACK] Seq=101124 Ack=6973 Win=65535 Len=0"
"1.611766","5.9.29.183","172.19.0.3","TLSv1.2","721","Application Data, Application Data"
"1.615588","5.9.29.183","172.19.0.3","TCP","1504","[TCP segment of a reassembled PDU]"
"1.615608","172.19.0.3","5.9.29.183","TCP","56","43520 → 9002 [ACK] Seq=6973 Ack=103237 Win=11911 Len=0"
"1.620237","172.19.0.3","5.9.29.183","TLSv1.2","599","Application Data"
"1.620581","5.9.29.183","172.19.0.3","TCP","56","9002 → 43520 [ACK] Seq=103237 Ack=7516 Win=65535 Len=0"
"1.626698","5.9.29.183","172.19.0.3","TLSv1.2","1207","Application Data"
"1.631336","172.19.0.3","5.9.29.183","TLSv1.2","599","Application Data"
"1.631542","5.9.29.183","172.19.0.3","TCP","56","9002 → 43520 [ACK] Seq=104388 Ack=8059 Win=65535 Len=0"
"1.844003","5.9.29.183","172.19.0.3","TLSv1.2","599","Application Data"
"1.844775","172.19.0.3","5.9.29.183","TLSv1.2","599","Application Data"
"1.845059","5.9.29.183","172.19.0.3","TCP","56","9002 → 43520 [ACK] Seq=104931 Ack=8602 Win=65535 Len=0"
"2.008731","5.9.29.183","172.19.0.3","TCP","1516","[TCP segment of a reassembled PDU]"
"2.008786","5.9.29.183","172.19.0.3","TCP","1516","9002 → 43520 [PSH, ACK] Seq=106391 Ack=8602 Win=65535 Len=1460 [TCP segment of a reassembled PDU]"
"2.008797","5.9.29.183","172.19.0.3","TLSv1.2","763","Application Data"
"2.008955","172.19.0.3","5.9.29.183","TCP","56","43520 → 9002 [ACK] Seq=8602 Ack=108558 Win=11895 Len=0"
"2.018825","5.9.29.183","172.19.0.3","TCP","1516","[TCP segment of a reassembled PDU]"
"2.018870","5.9.29.183","172.19.0.3","TCP","1516","9002 → 43520 [PSH, ACK] Seq=110018 Ack=8602 Win=65535 Len=1460 [TCP segment of a reassembled PDU]"
"2.018882","172.19.0.3","5.9.29.183","TCP","56","43520 → 9002 [ACK] Seq=8602 Ack=111478 Win=11903 Len=0"
"2.018884","5.9.29.183","172.19.0.3","TLSv1.2","1516","Application Data [TCP segment of a reassembled PDU]"
"2.018886","5.9.29.183","172.19.0.3","TCP","1516","9002 → 43520 [PSH, ACK] Seq=112938 Ack=8602 Win=65535 Len=1460 [TCP segment of a reassembled PDU]"
"2.018891","5.9.29.183","172.19.0.3","TCP","1456","9002 → 43520 [PSH, ACK] Seq=114398 Ack=8602 Win=65535 Len=1400 [TCP segment of a reassembled PDU]"
"2.019015","172.19.0.3","5.9.29.183","TCP","56","43520 → 9002 [ACK] Seq=8602 Ack=115798 Win=11879 Len=0"
"2.024654","5.9.29.183","172.19.0.3","TLSv1.2","70","Application Data"
"2.027538","172.19.0.3","5.9.29.183","TLSv1.2","599","Application Data"
"2.027829","5.9.29.183","172.19.0.3","TCP","56","9002 → 43520 [ACK] Seq=115812 Ack=9145 Win=65535 Len=0"
"2.255412","5.9.29.183","172.19.0.3","TLSv1.2","599","Application Data"
"2.256391","172.19.0.3","5.9.29.183","TLSv1.2","599","Application Data"
"2.256693","5.9.29.183","172.19.0.3","TCP","56","9002 → 43520 [ACK] Seq=116355 Ack=9688 Win=65535 Len=0"
"2.499916","5.9.29.183","172.19.0.3","TCP","1516","[TCP segment of a reassembled PDU]"
"2.500012","5.9.29.183","172.19.0.3","TCP","1516","9002 → 43520 [PSH, ACK] Seq=117815 Ack=9688 Win=65535 Len=1460 [TCP segment of a reassembled PDU]"
"2.500020","5.9.29.183","172.19.0.3","TLSv1.2","763","Application Data"
"2.500144","172.19.0.3","5.9.29.183","TCP","56","43520 → 9002 [ACK] Seq=9688 Ack=119982 Win=11895 Len=0"
"2.510732","5.9.29.183","172.19.0.3","TCP","1516","[TCP segment of a reassembled PDU]"
"2.510798","5.9.29.183","172.19.0.3","TCP","1516","9002 → 43520 [PSH, ACK] Seq=121442 Ack=9688 Win=65535 Len=1460 [TCP segment of a reassembled PDU]"
"2.510815","172.19.0.3","5.9.29.183","TCP","56","43520 → 9002 [ACK] Seq=9688 Ack=122902 Win=11903 Len=0"
"2.510818","5.9.29.183","172.19.0.3","TLSv1.2","1516","Application Data [TCP segment of a reassembled PDU]"
"2.510822","5.9.29.183","172.19.0.3","TCP","1468","9002 → 43520 [PSH, ACK] Seq=124362 Ack=9688 Win=65535 Len=1412 [TCP segment of a reassembled PDU]"
"2.510948","172.19.0.3","5.9.29.183","TCP","56","43520 → 9002 [ACK] Seq=9688 Ack=125774 Win=11887 Len=0"
"2.515378","5.9.29.183","172.19.0.3","TLSv1.2","1004","Application Data"
"2.519951","172.19.0.3","5.9.29.183","TLSv1.2","599","Application Data"
"2.520304","5.9.29.183","172.19.0.3","TCP","56","9002 → 43520 [ACK] Seq=126722 Ack=10231 Win=65535 Len=0"
"2.710928","5.9.29.183","172.19.0.3","TLSv1.2","599","Application Data"
"2.711808","172.19.0.3","5.9.29.183","TLSv1.2","599","Application Data"
"2.712156","5.9.29.183","172.19.0.3","TCP","56","9002 → 43520 [ACK] Seq=127265 Ack=10774 Win=65535 Len=0"
"2.915105","5.9.29.183","172.19.0.3","TCP","1516","[TCP segment of a reassembled PDU]"
"2.915179","5.9.29.183","172.19.0.3","TCP","1516","9002 → 43520 [PSH, ACK] Seq=128725 Ack=10774 Win=65535 Len=1460 [TCP segment of a reassembled PDU]"
"2.915194","5.9.29.183","172.19.0.3","TLSv1.2","763","Application Data"
"2.915350","172.19.0.3","5.9.29.183","TCP","56","43520 → 9002 [ACK] Seq=10774 Ack=130892 Win=11895 Len=0"
"2.923380","5.9.29.183","172.19.0.3","TCP","1516","[TCP segment of a reassembled PDU]"
"2.923446","5.9.29.183","172.19.0.3","TCP","1516","9002 → 43520 [PSH, ACK] Seq=132352 Ack=10774 Win=65535 Len=1460 [TCP segment of a reassembled PDU]"
"2.923464","172.19.0.3","5.9.29.183","TCP","56","43520 → 9002 [ACK] Seq=10774 Ack=133812 Win=11903 Len=0"
"2.923467","5.9.29.183","172.19.0.3","TLSv1.2","1480","Application Data [TCP segment of a reassembled PDU]"
"2.923471","5.9.29.183","172.19.0.3","TCP","1516","9002 → 43520 [PSH, ACK] Seq=135236 Ack=10774 Win=65535 Len=1460 [TCP segment of a reassembled PDU]"
"2.923474","5.9.29.183","172.19.0.3","TCP","1516","9002 → 43520 [PSH, ACK] Seq=136696 Ack=10774 Win=65535 Len=1460 [TCP segment of a reassembled PDU]"
"2.923477","5.9.29.183","172.19.0.3","TLSv1.2","1516","Application Data [TCP segment of a reassembled PDU]"
"2.923481","5.9.29.183","172.19.0.3","TCP","1468","9002 → 43520 [PSH, ACK] Seq=139616 Ack=10774 Win=65535 Len=1412 [TCP segment of a reassembled PDU]"
"2.923565","5.9.29.183","172.19.0.3","TCP","1516","9002 → 43520 [PSH, ACK] Seq=141028 Ack=10774 Win=65535 Len=1460 [TCP segment of a reassembled PDU]"
"2.923572","5.9.29.183","172.19.0.3","TLSv1.2","1516","Application Data [TCP segment of a reassembled PDU]"
"2.923586","5.9.29.183","172.19.0.3","TCP","1516","9002 → 43520 [PSH, ACK] Seq=143948 Ack=10774 Win=65535 Len=1460 [TCP segment of a reassembled PDU]"
"2.923588","5.9.29.183","172.19.0.3","TCP","1468","9002 → 43520 [PSH, ACK] Seq=145408 Ack=10774 Win=65535 Len=1412 [TCP segment of a reassembled PDU]"
"2.923605","172.19.0.3","5.9.29.183","TCP","56","43520 → 9002 [ACK] Seq=10774 Ack=142488 Win=11855 Len=0"
"2.923676","172.19.0.3","5.9.29.183","TCP","56","43520 → 9002 [ACK] Seq=10774 Ack=146820 Win=11828 Len=0"
"2.927609","5.9.29.183","172.19.0.3","TLSv1.2","1504","Application Data, Application Data"
"2.932234","5.9.29.183","172.19.0.3","TCP","1516","9002 → 43520 [PSH, ACK] Seq=148268 Ack=10774 Win=65535 Len=1460 [TCP segment of a reassembled PDU]"
"2.932255","172.19.0.3","5.9.29.183","TCP","56","43520 → 9002 [ACK] Seq=10774 Ack=149728 Win=11911 Len=0"
"2.932303","5.9.29.183","172.19.0.3","TLSv1.2","412","Application Data"
"2.934869","5.9.29.183","172.19.0.3","TCP","1516","[TCP segment of a reassembled PDU]"
"2.934890","172.19.0.3","5.9.29.183","TCP","56","43520 → 9002 [ACK] Seq=10774 Ack=151544 Win=11911 Len=0"
"2.934938","5.9.29.183","172.19.0.3","TCP","1516","9002 → 43520 [PSH, ACK] Seq=151544 Ack=10774 Win=65535 Len=1460 [TCP segment of a reassembled PDU]"
"2.934950","5.9.29.183","172.19.0.3","TLSv1.2","1516","Application Data [TCP segment of a reassembled PDU]"
"2.934953","5.9.29.183","172.19.0.3","TCP","1468","9002 → 43520 [PSH, ACK] Seq=154464 Ack=10774 Win=65535 Len=1412 [TCP segment of a reassembled PDU]"
"2.935152","172.19.0.3","5.9.29.183","TCP","56","43520 → 9002 [ACK] Seq=10774 Ack=155876 Win=11887 Len=0"
"2.935380","172.19.0.3","5.9.29.183","TLSv1.2","599","Application Data"
"2.935668","5.9.29.183","172.19.0.3","TCP","56","9002 → 43520 [ACK] Seq=155876 Ack=11317 Win=65535 Len=0"
"2.938976","5.9.29.183","172.19.0.3","TCP","264","9002 → 43520 [PSH, ACK] Seq=155876 Ack=11317 Win=65535 Len=208 [TCP segment of a reassembled PDU]"
"2.939044","5.9.29.183","172.19.0.3","TCP","1516","9002 → 43520 [PSH, ACK] Seq=156084 Ack=11317 Win=65535 Len=1460 [TCP segment of a reassembled PDU]"
"2.939093","172.19.0.3","5.9.29.183","TCP","56","43520 → 9002 [ACK] Seq=11317 Ack=157544 Win=11903 Len=0"
"2.939097","5.9.29.183","172.19.0.3","TLSv1.2","1516","Application Data [TCP segment of a reassembled PDU]"
"2.939102","5.9.29.183","172.19.0.3","TCP","1516","9002 → 43520 [PSH, ACK] Seq=159004 Ack=11317 Win=65535 Len=1460 [TCP segment of a reassembled PDU]"
"2.939164","5.9.29.183","172.19.0.3","TCP","1260","9002 → 43520 [PSH, ACK] Seq=160464 Ack=11317 Win=65535 Len=1204 [TCP segment of a reassembled PDU]"
"2.939184","172.19.0.3","5.9.29.183","TCP","56","43520 → 9002 [ACK] Seq=11317 Ack=160464 Win=11887 Len=0"
"2.940425","5.9.29.183","172.19.0.3","TLSv1.2","1516","Application Data [TCP segment of a reassembled PDU]"
"2.940434","172.19.0.3","5.9.29.183","TCP","56","43520 → 9002 [ACK] Seq=11317 Ack=163128 Win=11911 Len=0"
"2.940467","5.9.29.183","172.19.0.3","TCP","1516","9002 → 43520 [PSH, ACK] Seq=163128 Ack=11317 Win=65535 Len=1460 [TCP segment of a reassembled PDU]"
"2.940475","5.9.29.183","172.19.0.3","TCP","1480","9002 → 43520 [PSH, ACK] Seq=164588 Ack=11317 Win=65535 Len=1424 [TCP segment of a reassembled PDU]"
"2.940568","172.19.0.3","5.9.29.183","TCP","56","43520 → 9002 [ACK] Seq=11317 Ack=166012 Win=11895 Len=0"
"2.946637","172.19.0.3","5.9.29.183","TLSv1.2","599","Application Data"
"2.947097","5.9.29.183","172.19.0.3","TCP","56","9002 → 43520 [ACK] Seq=166012 Ack=11860 Win=65535 Len=0"
"2.947705","5.9.29.183","172.19.0.3","TLSv1.2","721","Application Data, Application Data"
"2.949146","5.9.29.183","172.19.0.3","TCP","1504","[TCP segment of a reassembled PDU]"
"2.949171","172.19.0.3","5.9.29.183","TCP","56","43520 → 9002 [ACK] Seq=11860 Ack=168125 Win=11911 Len=0"
"2.949243","5.9.29.183","172.19.0.3","TCP","1516","9002 → 43520 [PSH, ACK] Seq=168125 Ack=11860 Win=65535 Len=1460 [TCP segment of a reassembled PDU]"
"2.949264","5.9.29.183","172.19.0.3","TLSv1.2","1492","Application Data [TCP segment of a reassembled PDU]"
"2.949272","5.9.29.183","172.19.0.3","TCP","1516","9002 → 43520 [PSH, ACK] Seq=171021 Ack=11860 Win=65535 Len=1460 [TCP segment of a reassembled PDU]"
"2.949280","5.9.29.183","172.19.0.3","TCP","1492","9002 → 43520 [PSH, ACK] Seq=172481 Ack=11860 Win=65535 Len=1436 [TCP segment of a reassembled PDU]"
"2.949286","5.9.29.183","172.19.0.3","TLSv1.2","1516","Application Data [TCP segment of a reassembled PDU]"
"2.949317","172.19.0.3","5.9.29.183","TCP","56","43520 → 9002 [ACK] Seq=11860 Ack=173917 Win=11877 Len=0"
"2.949478","5.9.29.183","172.19.0.3","TCP","1516","9002 → 43520 [PSH, ACK] Seq=175377 Ack=11860 Win=65535 Len=1460 [TCP segment of a reassembled PDU]"
"2.949489","5.9.29.183","172.19.0.3","TCP","1480","9002 → 43520 [PSH, ACK] Seq=176837 Ack=11860 Win=65535 Len=1424 [TCP segment of a reassembled PDU]"
"2.949496","5.9.29.183","172.19.0.3","TLSv1.2","1516","Application Data [TCP segment of a reassembled PDU]"
"2.949502","5.9.29.183","172.19.0.3","TCP","1516","9002 → 43520 [PSH, ACK] Seq=179721 Ack=11860 Win=65535 Len=1460 [TCP segment of a reassembled PDU]"
"2.949508","5.9.29.183","172.19.0.3","TCP","1480","9002 → 43520 [PSH, ACK] Seq=181181 Ack=11860 Win=65535 Len=1424 [TCP segment of a reassembled PDU]"
"2.949530","172.19.0.3","5.9.29.183","TCP","56","43520 → 9002 [ACK] Seq=11860 Ack=182605 Win=11828 Len=0"
"2.952203","5.9.29.183","172.19.0.3","TLSv1.2","1516","Application Data, Application Data"
"2.952253","5.9.29.183","172.19.0.3","TCP","1492","9002 → 43520 [PSH, ACK] Seq=184065 Ack=11860 Win=65535 Len=1436 [TCP segment of a reassembled PDU]"
"2.952266","172.19.0.3","5.9.29.183","TCP","56","43520 → 9002 [ACK] Seq=11860 Ack=185501 Win=11903 Len=0"
"2.952324","5.9.29.183","172.19.0.3","TCP","1504","9002 → 43520 [PSH, ACK] Seq=185501 Ack=11860 Win=65535 Len=1448 [TCP segment of a reassembled PDU]"
"2.957220","172.19.0.3","5.9.29.183","TLSv1.2","599","Application Data"
"2.957585","5.9.29.183","172.19.0.3","TCP","56","9002 → 43520 [ACK] Seq=186949 Ack=12403 Win=65535 Len=0"
"2.963261","5.9.29.183","172.19.0.3","TLSv1.2","1061","Application Data, Application Data"
"2.970997","5.9.29.183","172.19.0.3","TCP","1516","[TCP segment of a reassembled PDU]"
"2.971017","172.19.0.3","5.9.29.183","TCP","56","43520 → 9002 [ACK] Seq=12403 Ack=189414 Win=11911 Len=0"
"2.971062","5.9.29.183","172.19.0.3","TCP","1516","9002 → 43520 [PSH, ACK] Seq=189414 Ack=12403 Win=65535 Len=1460 [TCP segment of a reassembled PDU]"
"2.971168","5.9.29.183","172.19.0.3","TLSv1.2","1516","Application Data [TCP segment of a reassembled PDU]"
"2.971173","5.9.29.183","172.19.0.3","TCP","1516","9002 → 43520 [PSH, ACK] Seq=192334 Ack=12403 Win=65535 Len=1460 [TCP segment of a reassembled PDU]"
"2.971176","5.9.29.183","172.19.0.3","TCP","1516","9002 → 43520 [PSH, ACK] Seq=193794 Ack=12403 Win=65535 Len=1460 [TCP segment of a reassembled PDU]"
"2.971216","172.19.0.3","5.9.29.183","TCP","56","43520 → 9002 [ACK] Seq=12403 Ack=195254 Win=11879 Len=0"
"2.971457","5.9.29.183","172.19.0.3","TLSv1.2","1516","Application Data [TCP segment of a reassembled PDU]"
"2.971464","5.9.29.183","172.19.0.3","TCP","1432","9002 → 43520 [PSH, ACK] Seq=196714 Ack=12403 Win=65535 Len=1376 [TCP segment of a reassembled PDU]"
"2.971471","172.19.0.3","5.9.29.183","TCP","56","43520 → 9002 [ACK] Seq=12403 Ack=198090 Win=11901 Len=0"
"2.971535","5.9.29.183","172.19.0.3","TCP","1516","9002 → 43520 [PSH, ACK] Seq=198090 Ack=12403 Win=65535 Len=1460 [TCP segment of a reassembled PDU]"
"2.971627","5.9.29.183","172.19.0.3","TLSv1.2","1516","Application Data [TCP segment of a reassembled PDU]"
"2.971634","172.19.0.3","5.9.29.183","TCP","56","43520 → 9002 [ACK] Seq=12403 Ack=201010 Win=11911 Len=0"
"2.971635","5.9.29.183","172.19.0.3","TCP","1516","9002 → 43520 [PSH, ACK] Seq=201010 Ack=12403 Win=65535 Len=1460 [TCP segment of a reassembled PDU]"
"2.971638","5.9.29.183","172.19.0.3","TCP","1468","9002 → 43520 [PSH, ACK] Seq=202470 Ack=12403 Win=65535 Len=1412 [TCP segment of a reassembled PDU]"
"2.971663","172.19.0.3","5.9.29.183","TCP","56","43520 → 9002 [ACK] Seq=12403 Ack=203882 Win=11895 Len=0"
"2.975236","5.9.29.183","172.19.0.3","TLSv1.2","1504","Application Data, Application Data"
"2.980202","5.9.29.183","172.19.0.3","TLSv1.2","330","Application Data"
"2.980222","172.19.0.3","5.9.29.183","TCP","56","43520 → 9002 [ACK] Seq=12403 Ack=205604 Win=11911 Len=0"
"2.980528","172.19.0.3","5.9.29.183","TLSv1.2","599","Application Data"
"2.980764","5.9.29.183","172.19.0.3","TCP","56","9002 → 43520 [ACK] Seq=205604 Ack=12946 Win=65535 Len=0"
"2.986318","5.9.29.183","172.19.0.3","TCP","1516","[TCP segment of a reassembled PDU]"
"2.986365","5.9.29.183","172.19.0.3","TCP","1492","9002 → 43520 [PSH, ACK] Seq=207064 Ack=12946 Win=65535 Len=1436 [TCP segment of a reassembled PDU]"
"2.986485","172.19.0.3","5.9.29.183","TCP","56","43520 → 9002 [ACK] Seq=12946 Ack=208500 Win=11903 Len=0"
"2.995641","5.9.29.183","172.19.0.3","TLSv1.2","1330","Application Data, Application Data"
"2.996221","172.19.0.3","5.9.29.183","TLSv1.2","599","Application Data"
"2.996617","5.9.29.183","172.19.0.3","TCP","56","9002 → 43520 [ACK] Seq=209774 Ack=13489 Win=65535 Len=0"
"3.005825","172.19.0.3","5.9.29.183","TLSv1.2","599","Application Data"
"3.006086","5.9.29.183","172.19.0.3","TCP","56","9002 → 43520 [ACK] Seq=209774 Ack=14032 Win=65535 Len=0"
"3.229959","5.9.29.183","172.19.0.3","TLSv1.2","599","Application Data"
"3.230737","172.19.0.3","5.9.29.183","TLSv1.2","599","Application Data"
"3.230982","5.9.29.183","172.19.0.3","TCP","56","9002 → 43520 [ACK] Seq=210317 Ack=14575 Win=65535 Len=0"
"3.498499","5.9.29.183","172.19.0.3","TCP","1516","[TCP segment of a reassembled PDU]"
"3.498620","5.9.29.183","172.19.0.3","TCP","1516","9002 → 43520 [PSH, ACK] Seq=211777 Ack=14575 Win=65535 Len=1460 [TCP segment of a reassembled PDU]"
"3.498634","5.9.29.183","172.19.0.3","TLSv1.2","763","Application Data"
"3.498771","172.19.0.3","5.9.29.183","TCP","56","43520 → 9002 [ACK] Seq=14575 Ack=213944 Win=11895 Len=0"
"3.509011","5.9.29.183","172.19.0.3","TCP","1504","[TCP segment of a reassembled PDU]"
"3.509136","5.9.29.183","172.19.0.3","TCP","1516","9002 → 43520 [PSH, ACK] Seq=215392 Ack=14575 Win=65535 Len=1460 [TCP segment of a reassembled PDU]"
"3.509155","172.19.0.3","5.9.29.183","TCP","56","43520 → 9002 [ACK] Seq=14575 Ack=216852 Win=11903 Len=0"
"3.509158","5.9.29.183","172.19.0.3","TLSv1.2","1516","Application Data [TCP segment of a reassembled PDU]"
"3.509163","5.9.29.183","172.19.0.3","TCP","1516","9002 → 43520 [PSH, ACK] Seq=218312 Ack=14575 Win=65535 Len=1460 [TCP segment of a reassembled PDU]"
"3.509248","172.19.0.3","5.9.29.183","TCP","56","43520 → 9002 [ACK] Seq=14575 Ack=219772 Win=11887 Len=0"
"3.509253","5.9.29.183","172.19.0.3","TCP","1516","9002 → 43520 [PSH, ACK] Seq=219772 Ack=14575 Win=65535 Len=1460 [TCP segment of a reassembled PDU]"
"3.509257","5.9.29.183","172.19.0.3","TCP","444","9002 → 43520 [PSH, ACK] Seq=221232 Ack=14575 Win=65535 Len=388 [TCP segment of a reassembled PDU]"
"3.509259","5.9.29.183","172.19.0.3","TLSv1.2","1516","Application Data [TCP segment of a reassembled PDU]"
"3.509261","5.9.29.183","172.19.0.3","TCP","1056","9002 → 43520 [PSH, ACK] Seq=223080 Ack=14575 Win=65535 Len=1000 [TCP segment of a reassembled PDU]"
"3.509322","172.19.0.3","5.9.29.183","TCP","56","43520 → 9002 [ACK] Seq=14575 Ack=224080 Win=11855 Len=0"
"3.514586","5.9.29.183","172.19.0.3","TCP","1516","9002 → 43520 [PSH, ACK] Seq=224080 Ack=14575 Win=65535 Len=1460 [TCP segment of a reassembled PDU]"
"3.514659","5.9.29.183","172.19.0.3","TLSv1.2","912","Application Data, Application Data"
"3.514680","172.19.0.3","5.9.29.183","TCP","56","43520 → 9002 [ACK] Seq=14575 Ack=226396 Win=11901 Len=0"
"3.522606","5.9.29.183","172.19.0.3","TCP","1516","[TCP segment of a reassembled PDU]"
"3.522679","5.9.29.183","172.19.0.3","TCP","1516","9002 → 43520 [PSH, ACK] Seq=227856 Ack=14575 Win=65535 Len=1460 [TCP segment of a reassembled PDU]"
"3.522700","172.19.0.3","5.9.29.183","TCP","56","43520 → 9002 [ACK] Seq=14575 Ack=229316 Win=11903 Len=0"
"3.522705","5.9.29.183","172.19.0.3","TLSv1.2","1516","Application Data [TCP segment of a reassembled PDU]"
"3.522710","5.9.29.183","172.19.0.3","TCP","1468","9002 → 43520 [PSH, ACK] Seq=230776 Ack=14575 Win=65535 Len=1412 [TCP segment of a reassembled PDU]"
"3.522862","172.19.0.3","5.9.29.183","TCP","56","43520 → 9002 [ACK] Seq=14575 Ack=232188 Win=11887 Len=0"
"3.525198","5.9.29.183","172.19.0.3","TCP","1516","9002 → 43520 [PSH, ACK] Seq=232188 Ack=14575 Win=65535 Len=1460 [TCP segment of a reassembled PDU]"
"3.525343","5.9.29.183","172.19.0.3","TLSv1.2","1516","Application Data [TCP segment of a reassembled PDU]"
"3.525362","172.19.0.3","5.9.29.183","TCP","56","43520 → 9002 [ACK] Seq=14575 Ack=235108 Win=11903 Len=0"
"3.525365","5.9.29.183","172.19.0.3","TCP","1516","9002 → 43520 [PSH, ACK] Seq=235108 Ack=14575 Win=65535 Len=1460 [TCP segment of a reassembled PDU]"
"3.525369","5.9.29.183","172.19.0.3","TCP","1468","9002 → 43520 [PSH, ACK] Seq=236568 Ack=14575 Win=65535 Len=1412 [TCP segment of a reassembled PDU]"
"3.525442","172.19.0.3","5.9.29.183","TCP","56","43520 → 9002 [ACK] Seq=14575 Ack=237980 Win=11887 Len=0"
"3.525443","5.9.29.183","172.19.0.3","TLSv1.2","1516","Application Data [TCP segment of a reassembled PDU]"
"3.525447","5.9.29.183","172.19.0.3","TCP","1492","9002 → 43520 [PSH, ACK] Seq=239440 Ack=14575 Win=65535 Len=1436 [TCP segment of a reassembled PDU]"
"3.525672","172.19.0.3","5.9.29.183","TCP","56","43520 → 9002 [ACK] Seq=14575 Ack=240876 Win=11871 Len=0"
"3.525914","172.19.0.3","5.9.29.183","TLSv1.2","599","Application Data"
"3.526164","5.9.29.183","172.19.0.3","TCP","56","9002 → 43520 [ACK] Seq=240876 Ack=15118 Win=65535 Len=0"
"3.530587","5.9.29.183","172.19.0.3","TLSv1.2","1112","Application Data"
"3.535149","5.9.29.183","172.19.0.3","TCP","1516","[TCP segment of a reassembled PDU]"
"3.535171","172.19.0.3","5.9.29.183","TCP","56","43520 → 9002 [ACK] Seq=15118 Ack=243392 Win=11911 Len=0"
"3.535222","5.9.29.183","172.19.0.3","TCP","1516","9002 → 43520 [PSH, ACK] Seq=243392 Ack=15118 Win=65535 Len=1460 [TCP segment of a reassembled PDU]"
"3.535233","5.9.29.183","172.19.0.3","TLSv1.2","1516","Application Data [TCP segment of a reassembled PDU]"
"3.535237","5.9.29.183","172.19.0.3","TCP","1516","9002 → 43520 [PSH, ACK] Seq=246312 Ack=15118 Win=65535 Len=1460 [TCP segment of a reassembled PDU]"
"3.535328","5.9.29.183","172.19.0.3","TCP","1456","9002 → 43520 [PSH, ACK] Seq=247772 Ack=15118 Win=65535 Len=1400 [TCP segment of a reassembled PDU]"
"3.535334","5.9.29.183","172.19.0.3","TLSv1.2","1516","Application Data [TCP segment of a reassembled PDU]"
"3.535338","5.9.29.183","172.19.0.3","TCP","1516","9002 → 43520 [PSH, ACK] Seq=250632 Ack=15118 Win=65535 Len=1460 [TCP segment of a reassembled PDU]"
"3.535411","172.19.0.3","5.9.29.183","TCP","56","43520 → 9002 [ACK] Seq=15118 Ack=252092 Win=11863 Len=0"
"3.535443","5.9.29.183","172.19.0.3","TCP","1480","9002 → 43520 [PSH, ACK] Seq=252092 Ack=15118 Win=65535 Len=1424 [TCP segment of a reassembled PDU]"
"3.547564","5.9.29.183","172.19.0.3","TLSv1.2","381","Application Data"
"3.547585","172.19.0.3","5.9.29.183","TCP","56","43520 → 9002 [ACK] Seq=15118 Ack=253841 Win=11909 Len=0"
"3.550140","5.9.29.183","172.19.0.3","TCP","1504","[TCP segment of a reassembled PDU]"
"3.564150","5.9.29.183","172.19.0.3","TLSv1.2","179","Application Data"
"3.564174","172.19.0.3","5.9.29.183","TCP","56","43520 → 9002 [ACK] Seq=15118 Ack=255412 Win=11911 Len=0"
"3.569336","172.19.0.3","5.9.29.183","TLSv1.2","599","Application Data"
"3.569703","5.9.29.183","172.19.0.3","TCP","56","9002 → 43520 [ACK] Seq=255412 Ack=15661 Win=65535 Len=0"
"3.738065","5.9.29.183","172.19.0.3","TLSv1.2","599","Application Data"
"3.738946","172.19.0.3","5.9.29.183","TLSv1.2","599","Application Data"
"3.739287","5.9.29.183","172.19.0.3","TCP","56","9002 → 43520 [ACK] Seq=255955 Ack=16204 Win=65535 Len=0"
"3.983668","5.9.29.183","172.19.0.3","TCP","1516","[TCP segment of a reassembled PDU]"
"3.983774","5.9.29.183","172.19.0.3","TCP","1516","9002 → 43520 [PSH, ACK] Seq=257415 Ack=16204 Win=65535 Len=1460 [TCP segment of a reassembled PDU]"
"3.983788","5.9.29.183","172.19.0.3","TLSv1.2","1213","Application Data"
"3.983913","172.19.0.3","5.9.29.183","TCP","56","43520 → 9002 [ACK] Seq=16204 Ack=260032 Win=11895 Len=0"
"3.994961","5.9.29.183","172.19.0.3","TLSv1.2","1516","Application Data"
"3.995012","5.9.29.183","172.19.0.3","TCP","1516","9002 → 43520 [PSH, ACK] Seq=261492 Ack=16204 Win=65535 Len=1460 [TCP segment of a reassembled PDU]"
"3.995025","172.19.0.3","5.9.29.183","TCP","56","43520 → 9002 [ACK] Seq=16204 Ack=262952 Win=11903 Len=0"
"3.995028","5.9.29.183","172.19.0.3","TLSv1.2","1516","Application Data [TCP segment of a reassembled PDU]"
"3.995031","5.9.29.183","172.19.0.3","TCP","1468","9002 → 43520 [PSH, ACK] Seq=264412 Ack=16204 Win=65535 Len=1412 [TCP segment of a reassembled PDU]"
"3.995037","5.9.29.183","172.19.0.3","TCP","1516","9002 → 43520 [PSH, ACK] Seq=265824 Ack=16204 Win=65535 Len=1460 [TCP segment of a reassembled PDU]"
"3.995039","5.9.29.183","172.19.0.3","TLSv1.2","1516","Application Data [TCP segment of a reassembled PDU]"
"3.995118","5.9.29.183","172.19.0.3","TCP","1516","9002 → 43520 [PSH, ACK] Seq=268744 Ack=16204 Win=65535 Len=1460 [TCP segment of a reassembled PDU]"
"3.995124","5.9.29.183","172.19.0.3","TCP","1516","9002 → 43520 [PSH, ACK] Seq=270204 Ack=16204 Win=65535 Len=1460 [TCP segment of a reassembled PDU]"
"3.995128","5.9.29.183","172.19.0.3","TLSv1.2","1456","Application Data [TCP segment of a reassembled PDU]"
"3.995144","172.19.0.3","5.9.29.183","TCP","56","43520 → 9002 [ACK] Seq=16204 Ack=271664 Win=11853 Len=0"
"3.995492","172.19.0.3","5.9.29.183","TLSv1.2","599","Application Data"
"3.995681","5.9.29.183","172.19.0.3","TCP","56","9002 → 43520 [ACK] Seq=273064 Ack=16747 Win=65535 Len=0"
"3.999503","5.9.29.183","172.19.0.3","TCP","1516","9002 → 43520 [PSH, ACK] Seq=273064 Ack=16747 Win=65535 Len=1460 [TCP segment of a reassembled PDU]"
"3.999564","5.9.29.183","172.19.0.3","TCP","1516","9002 → 43520 [PSH, ACK] Seq=274524 Ack=16747 Win=65535 Len=1460 [TCP segment of a reassembled PDU]"
"3.999582","172.19.0.3","5.9.29.183","TCP","56","43520 → 9002 [ACK] Seq=16747 Ack=275984 Win=11903 Len=0"
"3.999585","5.9.29.183","172.19.0.3","TLSv1.2","247","Application Data"
"4.008560","5.9.29.183","172.19.0.3","TCP","1516","[TCP segment of a reassembled PDU]"
"4.008583","172.19.0.3","5.9.29.183","TCP","56","43520 → 9002 [ACK] Seq=16747 Ack=277635 Win=11911 Len=0"
"4.008640","5.9.29.183","172.19.0.3","TCP","1516","9002 → 43520 [PSH, ACK] Seq=277635 Ack=16747 Win=65535 Len=1460 [TCP segment of a reassembled PDU]"
"4.008655","5.9.29.183","172.19.0.3","TLSv1.2","1516","Application Data [TCP segment of a reassembled PDU]"
"4.008660","5.9.29.183","172.19.0.3","TCP","1468","9002 → 43520 [PSH, ACK] Seq=280555 Ack=16747 Win=65535 Len=1412 [TCP segment of a reassembled PDU]"
"4.008810","172.19.0.3","5.9.29.183","TCP","56","43520 → 9002 [ACK] Seq=16747 Ack=281967 Win=11887 Len=0"
"4.015722","5.9.29.183","172.19.0.3","TLSv1.2","490","Application Data"
"4.016444","172.19.0.3","5.9.29.183","TLSv1.2","599","Application Data"
"4.016798","5.9.29.183","172.19.0.3","TCP","56","9002 → 43520 [ACK] Seq=282401 Ack=17290 Win=65535 Len=0"
"4.026121","172.19.0.3","5.9.29.183","TLSv1.2","599","Application Data"
"4.026437","5.9.29.183","172.19.0.3","TCP","56","9002 → 43520 [ACK] Seq=282401 Ack=17833 Win=65535 Len=0"
"4.244108","5.9.29.183","172.19.0.3","TLSv1.2","599","Application Data"
"4.245015","172.19.0.3","5.9.29.183","TLSv1.2","599","Application Data"
"4.245345","5.9.29.183","172.19.0.3","TCP","56","9002 → 43520 [ACK] Seq=282944 Ack=18376 Win=65535 Len=0"
"4.504958","5.9.29.183","172.19.0.3","TCP","1516","[TCP segment of a reassembled PDU]"
"4.505091","5.9.29.183","172.19.0.3","TCP","1516","9002 → 43520 [PSH, ACK] Seq=284404 Ack=18376 Win=65535 Len=1460 [TCP segment of a reassembled PDU]"
"4.505145","5.9.29.183","172.19.0.3","TLSv1.2","1348","Application Data [TCP segment of a reassembled PDU]"
"4.505150","5.9.29.183","172.19.0.3","TCP","1516","9002 → 43520 [PSH, ACK] Seq=287156 Ack=18376 Win=65535 Len=1460 [TCP segment of a reassembled PDU]"
"4.505154","5.9.29.183","172.19.0.3","TCP","1516","9002 → 43520 [PSH, ACK] Seq=288616 Ack=18376 Win=65535 Len=1460 [TCP segment of a reassembled PDU]"
"4.505157","5.9.29.183","172.19.0.3","TLSv1.2","1516","Application Data [TCP segment of a reassembled PDU]"
"4.505224","5.9.29.183","172.19.0.3","TCP","1516","9002 → 43520 [PSH, ACK] Seq=291536 Ack=18376 Win=65535 Len=1460 [TCP segment of a reassembled PDU]"
"4.505226","172.19.0.3","5.9.29.183","TCP","56","43520 → 9002 [ACK] Seq=18376 Ack=291536 Win=11871 Len=0"
"4.505228","5.9.29.183","172.19.0.3","TCP","1321","9002 → 43520 [PSH, ACK] Seq=292996 Ack=18376 Win=65535 Len=1265 [TCP segment of a reassembled PDU]"
"4.505309","172.19.0.3","5.9.29.183","TCP","56","43520 → 9002 [ACK] Seq=18376 Ack=294261 Win=11855 Len=0"
"4.516782","5.9.29.183","172.19.0.3","TLSv1.2","1516","Application Data, Application Data"
"4.516857","5.9.29.183","172.19.0.3","TCP","1492","9002 → 43520 [PSH, ACK] Seq=295721 Ack=18376 Win=65535 Len=1436 [TCP segment of a reassembled PDU]"
"4.516880","172.19.0.3","5.9.29.183","TCP","56","43520 → 9002 [ACK] Seq=18376 Ack=297157 Win=11903 Len=0"
"4.524381","5.9.29.183","172.19.0.3","TCP","1516","9002 → 43520 [PSH, ACK] Seq=297157 Ack=18376 Win=65535 Len=1460 [TCP segment of a reassembled PDU]"
"4.524492","5.9.29.183","172.19.0.3","TLSv1.2","1516","Application Data [TCP segment of a reassembled PDU]"
"4.524502","5.9.29.183","172.19.0.3","TCP","1516","9002 → 43520 [PSH, ACK] Seq=300077 Ack=18376 Win=65535 Len=1460 [TCP segment of a reassembled PDU]"
"4.524522","5.9.29.183","172.19.0.3","TCP","1468","9002 → 43520 [PSH, ACK] Seq=301537 Ack=18376 Win=65535 Len=1412 [TCP segment of a reassembled PDU]"
"4.524645","172.19.0.3","5.9.29.183","TCP","56","43520 → 9002 [ACK] Seq=18376 Ack=302949 Win=11885 Len=0"
"4.524677","5.9.29.183","172.19.0.3","TLSv1.2","1516","Application Data [TCP segment of a reassembled PDU]"
"4.524682","5.9.29.183","172.19.0.3","TCP","1516","9002 → 43520 [PSH, ACK] Seq=304409 Ack=18376 Win=65535 Len=1460 [TCP segment of a reassembled PDU]"
"4.524684","5.9.29.183","172.19.0.3","TCP","1516","9002 → 43520 [PSH, ACK] Seq=305869 Ack=18376 Win=65535 Len=1460 [TCP segment of a reassembled PDU]"
"4.524686","5.9.29.183","172.19.0.3","TLSv1.2","1516","Application Data [TCP segment of a reassembled PDU]"
"4.524688","5.9.29.183","172.19.0.3","TCP","1516","9002 → 43520 [PSH, ACK] Seq=308789 Ack=18376 Win=65535 Len=1460 [TCP segment of a reassembled PDU]"
"4.524699","5.9.29.183","172.19.0.3","TLSv1.2","225","Application Data"
"4.524879","172.19.0.3","5.9.29.183","TCP","56","43520 → 9002 [ACK] Seq=18376 Ack=310418 Win=11836 Len=0"
"4.525452","172.19.0.3","5.9.29.183","TLSv1.2","599","Application Data"
"4.525657","5.9.29.183","172.19.0.3","TCP","56","9002 → 43520 [ACK] Seq=310418 Ack=18919 Win=65535 Len=0"
"4.531257","5.9.29.183","172.19.0.3","TCP","1516","[TCP segment of a reassembled PDU]"
"4.531329","5.9.29.183","172.19.0.3","TCP","1492","9002 → 43520 [PSH, ACK] Seq=311878 Ack=18919 Win=65535 Len=1436 [TCP segment of a reassembled PDU]"
"4.531495","172.19.0.3","5.9.29.183","TCP","56","43520 → 9002 [ACK] Seq=18919 Ack=313314 Win=11903 Len=0"
"4.540680","5.9.29.183","172.19.0.3","TLSv1.2","1516","Application Data, Application Data"
"4.540792","5.9.29.183","172.19.0.3","TCP","1516","9002 → 43520 [PSH, ACK] Seq=314774 Ack=18919 Win=65535 Len=1460 [TCP segment of a reassembled PDU]"
"4.540809","172.19.0.3","5.9.29.183","TCP","56","43520 → 9002 [ACK] Seq=18919 Ack=316234 Win=11903 Len=0"
"4.540812","5.9.29.183","172.19.0.3","TCP","1480","9002 → 43520 [PSH, ACK] Seq=316234 Ack=18919 Win=65535 Len=1424 [TCP segment of a reassembled PDU]"
"4.540876","5.9.29.183","172.19.0.3","TLSv1.2","1516","Application Data [TCP segment of a reassembled PDU]"
"4.540881","5.9.29.183","172.19.0.3","TCP","1492","9002 → 43520 [PSH, ACK] Seq=319118 Ack=18919 Win=65535 Len=1436 [TCP segment of a reassembled PDU]"
"4.540911","172.19.0.3","5.9.29.183","TCP","56","43520 → 9002 [ACK] Seq=18919 Ack=320554 Win=11879 Len=0"
"4.541217","172.19.0.3","5.9.29.183","TLSv1.2","599","Application Data"
"4.541455","5.9.29.183","172.19.0.3","TCP","56","9002 → 43520 [ACK] Seq=320554 Ack=19462 Win=65535 Len=0"
"4.541463","5.9.29.183","172.19.0.3","TLSv1.2","316","Application Data"
"4.544154","172.19.0.3","185.21.216.198","TLSv1.2","599","Application Data"
"4.544379","185.21.216.198","172.19.0.3","TCP","56","41389 → 37034 [ACK] Seq=1 Ack=544 Win=65535 Len=0"
"4.550764","172.19.0.3","5.9.29.183","TLSv1.2","599","Application Data"
"4.550984","5.9.29.183","172.19.0.3","TCP","56","9002 → 43520 [ACK] Seq=320814 Ack=20005 Win=65535 Len=0"
"4.741407","5.9.29.183","172.19.0.3","TLSv1.2","599","Application Data"
"4.742521","172.19.0.3","5.9.29.183","TLSv1.2","599","Application Data"
"4.742871","5.9.29.183","172.19.0.3","TCP","56","9002 → 43520 [ACK] Seq=321357 Ack=20548 Win=65535 Len=0"
"4.924280","5.9.29.183","172.19.0.3","TCP","1504","[TCP segment of a reassembled PDU]"
"4.924383","5.9.29.183","172.19.0.3","TCP","1516","9002 → 43520 [PSH, ACK] Seq=322805 Ack=20548 Win=65535 Len=1460 [TCP segment of a reassembled PDU]"
"4.924452","5.9.29.183","172.19.0.3","TLSv1.2","1225","Application Data"
"4.924482","172.19.0.3","5.9.29.183","TCP","56","43520 → 9002 [ACK] Seq=20548 Ack=325434 Win=11895 Len=0"
"4.924540","5.9.29.183","172.19.0.3","TCP","1516","[TCP segment of a reassembled PDU]"
"4.924544","5.9.29.183","172.19.0.3","TCP","1516","9002 → 43520 [PSH, ACK] Seq=326894 Ack=20548 Win=65535 Len=1460 [TCP segment of a reassembled PDU]"
"4.924585","172.19.0.3","5.9.29.183","TCP","56","43520 → 9002 [ACK] Seq=20548 Ack=328354 Win=11877 Len=0"
"4.924693","5.9.29.183","172.19.0.3","TLSv1.2","1516","Application Data [TCP segment of a reassembled PDU]"
"4.924700","5.9.29.183","172.19.0.3","TCP","1468","9002 → 43520 [PSH, ACK] Seq=329814 Ack=20548 Win=65535 Len=1412 [TCP segment of a reassembled PDU]"
"4.924744","5.9.29.183","172.19.0.3","TCP","1516","9002 → 43520 [PSH, ACK] Seq=331226 Ack=20548 Win=65535 Len=1460 [TCP segment of a reassembled PDU]"
"4.924786","5.9.29.183","172.19.0.3","TLSv1.2","1516","Application Data [TCP segment of a reassembled PDU]"
"4.924829","5.9.29.183","172.19.0.3","TCP","1480","9002 → 43520 [PSH, ACK] Seq=334146 Ack=20548 Win=65535 Len=1424 [TCP segment of a reassembled PDU]"
"4.924854","172.19.0.3","5.9.29.183","TCP","56","43520 → 9002 [ACK] Seq=20548 Ack=335570 Win=11836 Len=0"
"4.924965","5.9.29.183","172.19.0.3","TCP","1504","9002 → 43520 [PSH, ACK] Seq=335570 Ack=20548 Win=65535 Len=1448 [TCP segment of a reassembled PDU]"
"4.928457","5.9.29.183","172.19.0.3","TLSv1.2","1504","Application Data, Application Data"
"4.928467","172.19.0.3","5.9.29.183","TCP","56","43520 → 9002 [ACK] Seq=20548 Ack=338466 Win=11911 Len=0"
"4.928570","5.9.29.183","172.19.0.3","TCP","1504","9002 → 43520 [PSH, ACK] Seq=338466 Ack=20548 Win=65535 Len=1448 [TCP segment of a reassembled PDU]"
"4.935760","5.9.29.183","172.19.0.3","TLSv1.2","1504","Application Data [TCP segment of a reassembled PDU]"
"4.935768","172.19.0.3","5.9.29.183","TCP","56","43520 → 9002 [ACK] Seq=20548 Ack=341362 Win=11911 Len=0"
"4.935890","5.9.29.183","172.19.0.3","TCP","1504","9002 → 43520 [PSH, ACK] Seq=341362 Ack=20548 Win=65535 Len=1448 [TCP segment of a reassembled PDU]"
"4.936002","5.9.29.183","172.19.0.3","TCP","1504","9002 → 43520 [PSH, ACK] Seq=342810 Ack=20548 Win=65535 Len=1448 [TCP segment of a reassembled PDU]"
"4.936134","5.9.29.183","172.19.0.3","TLSv1.2","1516","Application Data [TCP segment of a reassembled PDU]"
"4.936185","172.19.0.3","5.9.29.183","TCP","56","43520 → 9002 [ACK] Seq=20548 Ack=344258 Win=11895 Len=0"
"4.936211","5.9.29.183","172.19.0.3","TCP","1492","9002 → 43520 [PSH, ACK] Seq=345718 Ack=20548 Win=65535 Len=1436 [TCP segment of a reassembled PDU]"
"4.936216","5.9.29.183","172.19.0.3","TCP","1504","9002 → 43520 [PSH, ACK] Seq=347154 Ack=20548 Win=65535 Len=1448 [TCP segment of a reassembled PDU]"
"4.936241","172.19.0.3","5.9.29.183","TCP","56","43520 → 9002 [ACK] Seq=20548 Ack=348602 Win=11871 Len=0"
"4.936293","5.9.29.183","172.19.0.3","TLSv1.2","1516","Application Data [TCP segment of a reassembled PDU]"
"4.936297","5.9.29.183","172.19.0.3","TCP","1492","9002 → 43520 [PSH, ACK] Seq=350062 Ack=20548 Win=65535 Len=1436 [TCP segment of a reassembled PDU]"
"4.936298","5.9.29.183","172.19.0.3","TCP","1250","9002 → 43520 [PSH, ACK] Seq=351498 Ack=20548 Win=65535 Len=1194 [TCP segment of a reassembled PDU]"
"4.936299","5.9.29.183","172.19.0.3","TLSv1.2","1516","Application Data [TCP segment of a reassembled PDU]"
"4.936301","5.9.29.183","172.19.0.3","TCP","298","9002 → 43520 [PSH, ACK] Seq=354152 Ack=20548 Win=65535 Len=242 [TCP segment of a reassembled PDU]"
"4.936361","5.9.29.183","172.19.0.3","TCP","1504","9002 → 43520 [PSH, ACK] Seq=354394 Ack=20548 Win=65535 Len=1448 [TCP segment of a reassembled PDU]"
"4.936419","172.19.0.3","5.9.29.183","TCP","56","43520 → 9002 [ACK] Seq=20548 Ack=355842 Win=11820 Len=0"
"4.936582","172.19.0.3","5.9.29.183","TLSv1.2","599","Application Data"
"4.936729","5.9.29.183","172.19.0.3","TCP","56","9002 → 43520 [ACK] Seq=355842 Ack=21091 Win=65535 Len=0"
"4.939256","5.9.29.183","172.19.0.3","TLSv1.2","1504","Application Data, Application Data"
"4.939987","5.9.29.183","172.19.0.3","TCP","1504","9002 → 43520 [PSH, ACK] Seq=357290 Ack=21091 Win=65535 Len=1448 [TCP segment of a reassembled PDU]"
"4.940000","172.19.0.3","5.9.29.183","TCP","56","43520 → 9002 [ACK] Seq=21091 Ack=358738 Win=11911 Len=0"
"4.940028","5.9.29.183","172.19.0.3","TLSv1.2","1059","Application Data"
"4.949015","5.9.29.183","172.19.0.3","TCP","1516","[TCP segment of a reassembled PDU]"
"4.949162","172.19.0.3","5.9.29.183","TCP","56","43520 → 9002 [ACK] Seq=21091 Ack=361201 Win=11911 Len=0"
"4.949215","5.9.29.183","172.19.0.3","TCP","1516","9002 → 43520 [PSH, ACK] Seq=361201 Ack=21091 Win=65535 Len=1460 [TCP segment of a reassembled PDU]"
"4.949227","5.9.29.183","172.19.0.3","TLSv1.2","1516","Application Data [TCP segment of a reassembled PDU]"
"4.949349","5.9.29.183","172.19.0.3","TCP","1468","9002 → 43520 [PSH, ACK] Seq=364121 Ack=21091 Win=65535 Len=1412 [TCP segment of a reassembled PDU]"
"4.949387","5.9.29.183","172.19.0.3","TCP","1516","9002 → 43520 [PSH, ACK] Seq=365533 Ack=21091 Win=65535 Len=1460 [TCP segment of a reassembled PDU]"
"4.949392","5.9.29.183","172.19.0.3","TLSv1.2","1492","Application Data [TCP segment of a reassembled PDU]"
"4.949394","5.9.29.183","172.19.0.3","TCP","1516","9002 → 43520 [PSH, ACK] Seq=368429 Ack=21091 Win=65535 Len=1460 [TCP segment of a reassembled PDU]"
"4.949396","5.9.29.183","172.19.0.3","TCP","1492","9002 → 43520 [PSH, ACK] Seq=369889 Ack=21091 Win=65535 Len=1436 [TCP segment of a reassembled PDU]"
"4.949406","172.19.0.3","5.9.29.183","TCP","56","43520 → 9002 [ACK] Seq=21091 Ack=365533 Win=11887 Len=0"
"4.949421","5.9.29.183","172.19.0.3","TLSv1.2","1516","Application Data [TCP segment of a reassembled PDU]"
"4.949424","5.9.29.183","172.19.0.3","TCP","1492","9002 → 43520 [PSH, ACK] Seq=372785 Ack=21091 Win=65535 Len=1436 [TCP segment of a reassembled PDU]"
"4.949478","172.19.0.3","5.9.29.183","TCP","56","43520 → 9002 [ACK] Seq=21091 Ack=374221 Win=11838 Len=0"
"4.949905","172.19.0.3","5.9.29.183","TLSv1.2","599","Application Data"
"4.950166","5.9.29.183","172.19.0.3","TCP","56","9002 → 43520 [ACK] Seq=374221 Ack=21634 Win=65535 Len=0"
"4.955544","5.9.29.183","172.19.0.3","TLSv1.2","84","Application Data"
"4.959375","172.19.0.3","5.9.29.183","TLSv1.2","599","Application Data"
"4.959725","5.9.29.183","172.19.0.3","TCP","56","9002 → 43520 [ACK] Seq=374249 Ack=22177 Win=65535 Len=0"
"4.968356","172.19.0.3","5.9.29.183","TLSv1.2","599","Application Data"
"4.968581","5.9.29.183","172.19.0.3","TCP","56","9002 → 43520 [ACK] Seq=374249 Ack=22720 Win=65535 Len=0"
"5.171208","5.9.29.183","172.19.0.3","TLSv1.2","599","Application Data"
"5.172084","172.19.0.3","5.9.29.183","TLSv1.2","599","Application Data"
"5.172402","5.9.29.183","172.19.0.3","TCP","56","9002 → 43520 [ACK] Seq=374792 Ack=23263 Win=65535 Len=0"
"5.375377","5.9.29.183","172.19.0.3","TCP","1516","[TCP segment of a reassembled PDU]"
"5.375473","5.9.29.183","172.19.0.3","TCP","1516","9002 → 43520 [PSH, ACK] Seq=376252 Ack=23263 Win=65535 Len=1460 [TCP segment of a reassembled PDU]"
"5.375486","5.9.29.183","172.19.0.3","TLSv1.2","1516","Application Data [TCP segment of a reassembled PDU]"
"5.375492","5.9.29.183","172.19.0.3","TCP","1516","9002 → 43520 [PSH, ACK] Seq=379172 Ack=23263 Win=65535 Len=1460 [TCP segment of a reassembled PDU]"
"5.375498","5.9.29.183","172.19.0.3","TCP","1189","9002 → 43520 [PSH, ACK] Seq=380632 Ack=23263 Win=65535 Len=1133 [TCP segment of a reassembled PDU]"
"5.375609","172.19.0.3","5.9.29.183","TCP","56","43520 → 9002 [ACK] Seq=23263 Ack=381765 Win=11879 Len=0"
"5.384944","5.9.29.183","172.19.0.3","TLSv1.2","1516","Application Data [TCP segment of a reassembled PDU]"
"5.385019","5.9.29.183","172.19.0.3","TCP","1492","9002 → 43520 [PSH, ACK] Seq=383225 Ack=23263 Win=65535 Len=1436 [TCP segment of a reassembled PDU]"
"5.385037","172.19.0.3","5.9.29.183","TCP","56","43520 → 9002 [ACK] Seq=23263 Ack=384661 Win=11903 Len=0"
"5.385041","5.9.29.183","172.19.0.3","TCP","1516","9002 → 43520 [PSH, ACK] Seq=384661 Ack=23263 Win=65535 Len=1460 [TCP segment of a reassembled PDU]"
"5.385045","5.9.29.183","172.19.0.3","TLSv1.2","1492","Application Data [TCP segment of a reassembled PDU]"
"5.385204","172.19.0.3","5.9.29.183","TCP","56","43520 → 9002 [ACK] Seq=23263 Ack=387557 Win=11887 Len=0"
"5.392028","5.9.29.183","172.19.0.3","TLSv1.2","1285","Application Data"
"5.432123","172.19.0.3","5.9.29.183","TCP","56","43520 → 9002 [ACK] Seq=23263 Ack=388786 Win=11911 Len=0"
