_ws.col.Time,_ws.col.Source,_ws.col.Destination,_ws.col.Protocol,_ws.col.Length,_ws.col.Info
"0.000000","172.19.0.3","5.9.29.183","TLSv1.2","599","Application Data"
"0.000308","5.9.29.183","172.19.0.3","TCP","56","9002 → 43520 [ACK] Seq=1 Ack=544 Win=65535 Len=0"
"0.736397","5.9.29.183","172.19.0.3","TLSv1.2","599","Application Data"
"0.736482","172.19.0.3","5.9.29.183","TCP","56","43520 → 9002 [ACK] Seq=544 Ack=544 Win=12738 Len=0"
"0.737179","172.19.0.3","5.9.29.183","TLSv1.2","2141","Application Data"
"0.737537","5.9.29.183","172.19.0.3","TCP","56","9002 → 43520 [ACK] Seq=544 Ack=2629 Win=65535 Len=0"
"1.656250","5.9.29.183","172.19.0.3","TLSv1.2","599","Application Data"
"1.697578","172.19.0.3","5.9.29.183","TCP","56","43520 → 9002 [ACK] Seq=2629 Ack=1087 Win=12738 Len=0"
"1.726484","5.9.29.183","172.19.0.3","TLSv1.2","1113","Application Data"
"1.726507","172.19.0.3","5.9.29.183","TCP","56","43520 → 9002 [ACK] Seq=2629 Ack=2144 Win=12738 Len=0"
"1.730690","172.19.0.3","5.9.29.183","TLSv1.2","599","Application Data"
"1.730986","5.9.29.183","172.19.0.3","TCP","56","9002 → 43520 [ACK] Seq=2144 Ack=3172 Win=65535 Len=0"
"2.825165","5.9.29.183","172.19.0.3","TLSv1.2","599","Application Data"
"2.825913","172.19.0.3","5.9.29.183","TLSv1.2","599","Application Data"
"2.826375","5.9.29.183","172.19.0.3","TCP","56","9002 → 43520 [ACK] Seq=2687 Ack=3715 Win=65535 Len=0"
"3.808486","5.9.29.183","172.19.0.3","TCP","1516","[TCP segment of a reassembled PDU]"
"3.808619","5.9.29.183","172.19.0.3","TCP","1516","9002 → 43520 [PSH, ACK] Seq=4147 Ack=3715 Win=65535 Len=1460 [TCP segment of a reassembled PDU]"
"3.808634","5.9.29.183","172.19.0.3","TLSv1.2","763","Application Data"
"3.808699","5.9.29.183","172.19.0.3","TCP","1516","[TCP segment of a reassembled PDU]"
"3.808705","5.9.29.183","172.19.0.3","TCP","1516","9002 → 43520 [PSH, ACK] Seq=7774 Ack=3715 Win=65535 Len=1460 [TCP segment of a reassembled PDU]"
"3.808708","5.9.29.183","172.19.0.3","TLSv1.2","1516","Application Data [TCP segment of a reassembled PDU]"
"3.808712","5.9.29.183","172.19.0.3","TCP","1516","9002 → 43520 [PSH, ACK] Seq=10694 Ack=3715 Win=65535 Len=1460 [TCP segment of a reassembled PDU]"
"3.808715","5.9.29.183","172.19.0.3","TCP","1456","9002 → 43520 [PSH, ACK] Seq=12154 Ack=3715 Win=65535 Len=1400 [TCP segment of a reassembled PDU]"
"3.808770","172.19.0.3","5.9.29.183","TCP","56","43520 → 9002 [ACK] Seq=3715 Ack=13554 Win=12682 Len=0"
"3.823965","5.9.29.183","172.19.0.3","TLSv1.2","1516","Application Data, Application Data"
"3.824054","5.9.29.183","172.19.0.3","TCP","1492","9002 → 43520 [PSH, ACK] Seq=15014 Ack=3715 Win=65535 Len=1436 [TCP segment of a reassembled PDU]"
"3.824092","172.19.0.3","5.9.29.183","TCP","56","43520 → 9002 [ACK] Seq=3715 Ack=16450 Win=12730 Len=0"
"3.824300","5.9.29.183","172.19.0.3","TCP","1516","9002 → 43520 [PSH, ACK] Seq=16450 Ack=3715 Win=65535 Len=1460 [TCP segment of a reassembled PDU]"
"3.824341","5.9.29.183","172.19.0.3","TLSv1.2","1492","Application Data [TCP segment of a reassembled PDU]"
"3.824406","5.9.29.183","172.19.0.3","TCP","1516","9002 → 43520 [PSH, ACK] Seq=19346 Ack=3715 Win=65535 Len=1460 [TCP segment of a reassembled PDU]"
"3.824419","5.9.29.183","172.19.0.3","TLSv1.2","1516","Application Data [TCP segment of a reassembled PDU]"
"3.824433","172.19.0.3","5.9.29.183","TCP","56","43520 → 9002 [ACK] Seq=3715 Ack=20806 Win=12706 Len=0"
"3.824463","5.9.29.183","172.19.0.3","TLSv1.2","1516","Application Data"
"3.824469","5.9.29.183","172.19.0.3","TLSv1.2","1351","Application Data"
"3.824498","172.19.0.3","5.9.29.183","TCP","56","43520 → 9002 [ACK] Seq=3715 Ack=25021 Win=12682 Len=0"
"3.824868","172.19.0.3","5.9.29.183","TLSv1.2","599","Application Data"
"3.825097","5.9.29.183","172.19.0.3","TCP","56","9002 → 43520 [ACK] Seq=25021 Ack=4258 Win=65535 Len=0"
"3.836691","5.9.29.183","172.19.0.3","TCP","1516","[TCP segment of a reassembled PDU]"
"3.836759","5.9.29.183","172.19.0.3","TCP","1492","9002 → 43520 [PSH, ACK] Seq=26481 Ack=4258 Win=65535 Len=1436 [TCP segment of a reassembled PDU]"
"3.836776","172.19.0.3","5.9.29.183","TCP","56","43520 → 9002 [ACK] Seq=4258 Ack=27917 Win=12728 Len=0"
"3.839954","5.9.29.183","172.19.0.3","TLSv1.2","1516","Application Data [TCP segment of a reassembled PDU]"
"3.840040","5.9.29.183","172.19.0.3","TCP","1492","9002 → 43520 [PSH, ACK] Seq=29377 Ack=4258 Win=65535 Len=1436 [TCP segment of a reassembled PDU]"
"3.840072","172.19.0.3","5.9.29.183","TCP","56","43520 → 9002 [ACK] Seq=4258 Ack=30813 Win=12730 Len=0"
"3.840228","5.9.29.183","172.19.0.3","TCP","1516","9002 → 43520 [PSH, ACK] Seq=30813 Ack=4258 Win=65535 Len=1460 [TCP segment of a reassembled PDU]"
"3.840240","5.9.29.183","172.19.0.3","TLSv1.2","1492","Application Data [TCP segment of a reassembled PDU]"
"3.840317","172.19.0.3","5.9.29.183","TCP","56","43520 → 9002 [ACK] Seq=4258 Ack=33709 Win=12714 Len=0"
"3.840343","5.9.29.183","172.19.0.3","TCP","1516","9002 → 43520 [PSH, ACK] Seq=33709 Ack=4258 Win=65535 Len=1460 [TCP segment of a reassembled PDU]"
"3.840351","5.9.29.183","172.19.0.3","TCP","1516","9002 → 43520 [PSH, ACK] Seq=35169 Ack=4258 Win=65535 Len=1460 [TCP segment of a reassembled PDU]"
"3.840354","5.9.29.183","172.19.0.3","TLSv1.2","1516","Application Data [TCP segment of a reassembled PDU]"
"3.840475","5.9.29.183","172.19.0.3","TLSv1.2","468","Application Data"
"3.840587","172.19.0.3","5.9.29.183","TLSv1.2","599","Application Data"
"3.840829","5.9.29.183","172.19.0.3","TCP","56","9002 → 43520 [ACK] Seq=38501 Ack=4801 Win=65535 Len=0"
"3.862422","5.9.29.183","172.19.0.3","TCP","1504","[TCP segment of a reassembled PDU]"
"3.862723","5.9.29.183","172.19.0.3","TCP","1504","9002 → 43520 [PSH, ACK] Seq=39949 Ack=4801 Win=65535 Len=1448 [TCP segment of a reassembled PDU]"
"3.862739","172.19.0.3","5.9.29.183","TCP","56","43520 → 9002 [ACK] Seq=4801 Ack=41397 Win=12738 Len=0"
"3.862871","5.9.29.183","172.19.0.3","TLSv1.2","1237","Application Data"
"3.878608","5.9.29.183","172.19.0.3","TLSv1.2","1177","Application Data"
"3.878631","172.19.0.3","5.9.29.183","TCP","56","43520 → 9002 [ACK] Seq=4801 Ack=43699 Win=12738 Len=0"
"3.912945","5.9.29.183","172.19.0.3","TCP","1504","[TCP segment of a reassembled PDU]"
"3.913302","5.9.29.183","172.19.0.3","TCP","1504","9002 → 43520 [PSH, ACK] Seq=45147 Ack=4801 Win=65535 Len=1448 [TCP segment of a reassembled PDU]"
"3.913363","172.19.0.3","5.9.29.183","TCP","56","43520 → 9002 [ACK] Seq=4801 Ack=46595 Win=12730 Len=0"
"3.913433","5.9.29.183","172.19.0.3","TLSv1.2","1516","Application Data [TCP segment of a reassembled PDU]"
"3.913439","5.9.29.183","172.19.0.3","TCP","1516","9002 → 43520 [PSH, ACK] Seq=48055 Ack=4801 Win=65535 Len=1460 [TCP segment of a reassembled PDU]"
"3.913481","172.19.0.3","5.9.29.183","TCP","56","43520 → 9002 [ACK] Seq=4801 Ack=49515 Win=12714 Len=0"
"3.913578","5.9.29.183","172.19.0.3","TCP","1213","9002 → 43520 [PSH, ACK] Seq=49515 Ack=4801 Win=65535 Len=1157 [TCP segment of a reassembled PDU]"
"3.913623","5.9.29.183","172.19.0.3","TLSv1.2","1516","Application Data [TCP segment of a reassembled PDU]"
"3.913660","5.9.29.183","172.19.0.3","TCP","1516","9002 → 43520 [PSH, ACK] Seq=52132 Ack=4801 Win=65535 Len=1460 [TCP segment of a reassembled PDU]"
"3.913665","5.9.29.183","172.19.0.3","TCP","1516","9002 → 43520 [PSH, ACK] Seq=53592 Ack=4801 Win=65535 Len=1460 [TCP segment of a reassembled PDU]"
"3.913715","172.19.0.3","5.9.29.183","TCP","56","43520 → 9002 [ACK] Seq=4801 Ack=55052 Win=12680 Len=0"
"3.913727","5.9.29.183","172.19.0.3","TLSv1.2","1516","Application Data [TCP segment of a reassembled PDU]"
"3.913731","5.9.29.183","172.19.0.3","TCP","1456","9002 → 43520 [PSH, ACK] Seq=56512 Ack=4801 Win=65535 Len=1400 [TCP segment of a reassembled PDU]"
"3.913771","172.19.0.3","5.9.29.183","TCP","56","43520 → 9002 [ACK] Seq=4801 Ack=57912 Win=12663 Len=0"
"3.914158","172.19.0.3","5.9.29.183","TLSv1.2","599","Application Data"
"3.914372","5.9.29.183","172.19.0.3","TCP","56","9002 → 43520 [ACK] Seq=57912 Ack=5344 Win=65535 Len=0"
"3.929041","5.9.29.183","172.19.0.3","TCP","1516","9002 → 43520 [PSH, ACK] Seq=57912 Ack=5344 Win=65535 Len=1460 [TCP segment of a reassembled PDU]"
"3.929135","5.9.29.183","172.19.0.3","TCP","346","9002 → 43520 [PSH, ACK] Seq=59372 Ack=5344 Win=65535 Len=290 [TCP segment of a reassembled PDU]"
"3.929201","172.19.0.3","5.9.29.183","TCP","56","43520 → 9002 [ACK] Seq=5344 Ack=59662 Win=12730 Len=0"
"3.929281","5.9.29.183","172.19.0.3","TLSv1.2","686","Application Data, Application Data"
"3.955325","5.9.29.183","172.19.0.3","TCP","1504","[TCP segment of a reassembled PDU]"
"3.955346","172.19.0.3","5.9.29.183","TCP","56","43520 → 9002 [ACK] Seq=5344 Ack=61740 Win=12738 Len=0"
"3.955436","5.9.29.183","172.19.0.3","TCP","1516","9002 → 43520 [PSH, ACK] Seq=61740 Ack=5344 Win=65535 Len=1460 [TCP segment of a reassembled PDU]"
"3.955448","5.9.29.183","172.19.0.3","TLSv1.2","1516","Application Data [TCP segment of a reassembled PDU]"
"3.955452","5.9.29.183","172.19.0.3","TCP","1213","9002 → 43520 [PSH, ACK] Seq=64660 Ack=5344 Win=65535 Len=1157 [TCP segment of a reassembled PDU]"
"3.955540","5.9.29.183","172.19.0.3","TCP","1516","9002 → 43520 [PSH, ACK] Seq=65817 Ack=5344 Win=65535 Len=1460 [TCP segment of a reassembled PDU]"
"3.955547","5.9.29.183","172.19.0.3","TLSv1.2","1516","Application Data [TCP segment of a reassembled PDU]"
"3.955594","172.19.0.3","5.9.29.183","TCP","56","43520 → 9002 [ACK] Seq=5344 Ack=67277 Win=12706 Len=0"
"3.955613","5.9.29.183","172.19.0.3","TCP","1516","9002 → 43520 [PSH, ACK] Seq=68737 Ack=5344 Win=65535 Len=1460 [TCP segment of a reassembled PDU]"
"3.955617","5.9.29.183","172.19.0.3","TCP","1516","9002 → 43520 [PSH, ACK] Seq=70197 Ack=5344 Win=65535 Len=1460 [TCP segment of a reassembled PDU]"
"3.955642","5.9.29.183","172.19.0.3","TLSv1.2","1516","Application Data [TCP segment of a reassembled PDU]"
"3.955645","5.9.29.183","172.19.0.3","TCP","1444","9002 → 43520 [PSH, ACK] Seq=73117 Ack=5344 Win=65535 Len=1388 [TCP segment of a reassembled PDU]"
"3.955669","172.19.0.3","5.9.29.183","TCP","56","43520 → 9002 [ACK] Seq=5344 Ack=74505 Win=12665 Len=0"
"3.970775","5.9.29.183","172.19.0.3","TCP","1504","9002 → 43520 [PSH, ACK] Seq=74505 Ack=5344 Win=65535 Len=1448 [TCP segment of a reassembled PDU]"
"3.971127","5.9.29.183","172.19.0.3","TLSv1.2","1504","Application Data, Application Data"
"3.971145","172.19.0.3","5.9.29.183","TCP","56","43520 → 9002 [ACK] Seq=5344 Ack=77401 Win=12738 Len=0"
"3.971462","5.9.29.183","172.19.0.3","TCP","1516","9002 → 43520 [PSH, ACK] Seq=77401 Ack=5344 Win=65535 Len=1460 [TCP segment of a reassembled PDU]"
"3.971520","5.9.29.183","172.19.0.3","TCP","1492","9002 → 43520 [PSH, ACK] Seq=78861 Ack=5344 Win=65535 Len=1436 [TCP segment of a reassembled PDU]"
"3.971585","172.19.0.3","5.9.29.183","TLSv1.2","599","Application Data"
"3.971656","5.9.29.183","172.19.0.3","TLSv1.2","1516","Application Data [TCP segment of a reassembled PDU]"
"3.971663","5.9.29.183","172.19.0.3","TLSv1.2","382","Application Data"
"3.971682","172.19.0.3","5.9.29.183","TCP","56","43520 → 9002 [ACK] Seq=5887 Ack=82083 Win=12709 Len=0"
"3.971836","5.9.29.183","172.19.0.3","TCP","56","9002 → 43520 [ACK] Seq=82083 Ack=5887 Win=65535 Len=0"
"3.981277","172.19.0.3","5.9.29.183","TLSv1.2","1113","Application Data"
"3.981624","5.9.29.183","172.19.0.3","TCP","56","9002 → 43520 [ACK] Seq=82083 Ack=6944 Win=65535 Len=0"
"5.040435","5.9.29.183","172.19.0.3","TLSv1.2","599","Application Data"
"5.041205","172.19.0.3","5.9.29.183","TLSv1.2","599","Application Data"
"5.041579","5.9.29.183","172.19.0.3","TCP","56","9002 → 43520 [ACK] Seq=82626 Ack=7487 Win=65535 Len=0"
"5.962580","5.9.29.183","172.19.0.3","TLSv1.2","599","Application Data"
"5.965222","5.9.29.183","172.19.0.3","TCP","1504","[TCP segment of a reassembled PDU]"
"5.965260","172.19.0.3","5.9.29.183","TCP","56","43520 → 9002 [ACK] Seq=7487 Ack=84617 Win=12738 Len=0"
"5.965427","5.9.29.183","172.19.0.3","TCP","1504","9002 → 43520 [PSH, ACK] Seq=84617 Ack=7487 Win=65535 Len=1448 [TCP segment of a reassembled PDU]"
"5.965521","5.9.29.183","172.19.0.3","TLSv1.2","1516","Application Data [TCP segment of a reassembled PDU]"
"5.965613","5.9.29.183","172.19.0.3","TCP","1516","9002 → 43520 [PSH, ACK] Seq=87525 Ack=7487 Win=65535 Len=1460 [TCP segment of a reassembled PDU]"
"5.965620","5.9.29.183","172.19.0.3","TCP","1480","9002 → 43520 [PSH, ACK] Seq=88985 Ack=7487 Win=65535 Len=1424 [TCP segment of a reassembled PDU]"
"5.965638","172.19.0.3","5.9.29.183","TCP","56","43520 → 9002 [ACK] Seq=7487 Ack=90409 Win=12706 Len=0"
"5.979661","5.9.29.183","172.19.0.3","TLSv1.2","613","Application Data, Application Data"
"6.025654","172.19.0.3","5.9.29.183","TCP","56","43520 → 9002 [ACK] Seq=7487 Ack=90966 Win=12738 Len=0"
"6.068201","5.9.29.183","172.19.0.3","TCP","1504","[TCP segment of a reassembled PDU]"
"6.068229","172.19.0.3","5.9.29.183","TCP","56","43520 → 9002 [ACK] Seq=7487 Ack=92414 Win=12738 Len=0"
"6.068370","5.9.29.183","172.19.0.3","TCP","1504","9002 → 43520 [PSH, ACK] Seq=92414 Ack=7487 Win=65535 Len=1448 [TCP segment of a reassembled PDU]"
"6.068387","172.19.0.3","5.9.29.183","TCP","56","43520 → 9002 [ACK] Seq=7487 Ack=93862 Win=12730 Len=0"
"6.068389","5.9.29.183","172.19.0.3","TLSv1.2","1237","Application Data"
"6.068395","172.19.0.3","5.9.29.183","TCP","56","43520 → 9002 [ACK] Seq=7487 Ack=95043 Win=12722 Len=0"
"6.084085","5.9.29.183","172.19.0.3","TLSv1.2","149","Application Data"
"6.084110","172.19.0.3","5.9.29.183","TCP","56","43520 → 9002 [ACK] Seq=7487 Ack=95136 Win=12738 Len=0"
"6.102263","5.9.29.183","172.19.0.3","TCP","1504","[TCP segment of a reassembled PDU]"
"6.102287","172.19.0.3","5.9.29.183","TCP","56","43520 → 9002 [ACK] Seq=7487 Ack=96584 Win=12738 Len=0"
"6.102364","5.9.29.183","172.19.0.3","TCP","1504","9002 → 43520 [PSH, ACK] Seq=96584 Ack=7487 Win=65535 Len=1448 [TCP segment of a reassembled PDU]"
"6.102378","172.19.0.3","5.9.29.183","TCP","56","43520 → 9002 [ACK] Seq=7487 Ack=98032 Win=12730 Len=0"
"6.102541","5.9.29.183","172.19.0.3","TLSv1.2","1516","Application Data [TCP segment of a reassembled PDU]"
"6.102550","172.19.0.3","5.9.29.183","TCP","56","43520 → 9002 [ACK] Seq=7487 Ack=99492 Win=12722 Len=0"
"6.102552","5.9.29.183","172.19.0.3","TCP","1516","9002 → 43520 [PSH, ACK] Seq=99492 Ack=7487 Win=65535 Len=1460 [TCP segment of a reassembled PDU]"
"6.102561","172.19.0.3","5.9.29.183","TCP","56","43520 → 9002 [ACK] Seq=7487 Ack=100952 Win=12714 Len=0"
"6.102562","5.9.29.183","172.19.0.3","TCP","1516","9002 → 43520 [PSH, ACK] Seq=100952 Ack=7487 Win=65535 Len=1460 [TCP segment of a reassembled PDU]"
"6.102567","172.19.0.3","5.9.29.183","TCP","56","43520 → 9002 [ACK] Seq=7487 Ack=102412 Win=12704 Len=0"
"6.102569","5.9.29.183","172.19.0.3","TLSv1.2","1516","Application Data [TCP segment of a reassembled PDU]"
"6.102575","172.19.0.3","5.9.29.183","TCP","56","43520 → 9002 [ACK] Seq=7487 Ack=103872 Win=12696 Len=0"
"6.102576","5.9.29.183","172.19.0.3","TCP","1189","9002 → 43520 [PSH, ACK] Seq=103872 Ack=7487 Win=65535 Len=1133 [TCP segment of a reassembled PDU]"
"6.102581","172.19.0.3","5.9.29.183","TCP","56","43520 → 9002 [ACK] Seq=7487 Ack=105005 Win=12688 Len=0"
"6.118154","5.9.29.183","172.19.0.3","TCP","1516","9002 → 43520 [PSH, ACK] Seq=105005 Ack=7487 Win=65535 Len=1460 [TCP segment of a reassembled PDU]"
"6.118177","172.19.0.3","5.9.29.183","TCP","56","43520 → 9002 [ACK] Seq=7487 Ack=106465 Win=12738 Len=0"
"6.118193","5.9.29.183","172.19.0.3","TLSv1.2","1492","Application Data [TCP segment of a reassembled PDU]"
"6.118200","172.19.0.3","5.9.29.183","TCP","56","43520 → 9002 [ACK] Seq=7487 Ack=107901 Win=12730 Len=0"
"6.118202","5.9.29.183","172.19.0.3","TCP","1516","9002 → 43520 [PSH, ACK] Seq=107901 Ack=7487 Win=65535 Len=1460 [TCP segment of a reassembled PDU]"
"6.118207","5.9.29.183","172.19.0.3","TLSv1.2","339","Application Data"
"6.118383","172.19.0.3","5.9.29.183","TCP","56","43520 → 9002 [ACK] Seq=7487 Ack=109644 Win=12717 Len=0"
"6.118806","172.19.0.3","5.9.29.183","TLSv1.2","599","Application Data"
"6.119039","5.9.29.183","172.19.0.3","TCP","56","9002 → 43520 [ACK] Seq=109644 Ack=8030 Win=65535 Len=0"
"6.122049","5.9.29.183","172.19.0.3","TCP","1516","[TCP segment of a reassembled PDU]"
"6.122079","5.9.29.183","172.19.0.3","TCP","1492","9002 → 43520 [PSH, ACK] Seq=111104 Ack=8030 Win=65535 Len=1436 [TCP segment of a reassembled PDU]"
"6.122085","5.9.29.183","172.19.0.3","TLSv1.2","1516","Application Data [TCP segment of a reassembled PDU]"
"6.122247","5.9.29.183","172.19.0.3","TCP","1492","9002 → 43520 [PSH, ACK] Seq=114000 Ack=8030 Win=65535 Len=1436 [TCP segment of a reassembled PDU]"
"6.122373","172.19.0.3","5.9.29.183","TCP","56","43520 → 9002 [ACK] Seq=8030 Ack=115436 Win=12714 Len=0"
"6.133802","5.9.29.183","172.19.0.3","TCP","1516","9002 → 43520 [PSH, ACK] Seq=115436 Ack=8030 Win=65535 Len=1460 [TCP segment of a reassembled PDU]"
"6.133833","5.9.29.183","172.19.0.3","TLSv1.2","1492","Application Data [TCP segment of a reassembled PDU]"
"6.133847","172.19.0.3","5.9.29.183","TCP","56","43520 → 9002 [ACK] Seq=8030 Ack=118332 Win=12730 Len=0"
"6.133849","5.9.29.183","172.19.0.3","TLSv1.2","193","Application Data"
"6.175605","172.19.0.3","5.9.29.183","TCP","56","43520 → 9002 [ACK] Seq=8030 Ack=118469 Win=12738 Len=0"
"6.284019","5.9.29.183","172.19.0.3","TCP","1516","[TCP segment of a reassembled PDU]"
"6.284098","5.9.29.183","172.19.0.3","TCP","1516","9002 → 43520 [PSH, ACK] Seq=119929 Ack=8030 Win=65535 Len=1460 [TCP segment of a reassembled PDU]"
"6.284111","5.9.29.183","172.19.0.3","TLSv1.2","1213","Application Data"
"6.284292","5.9.29.183","172.19.0.3","TCP","1516","[TCP segment of a reassembled PDU]"
"6.284299","5.9.29.183","172.19.0.3","TCP","1248","9002 → 43520 [PSH, ACK] Seq=124006 Ack=8030 Win=65535 Len=1192 [TCP segment of a reassembled PDU]"
"6.284303","5.9.29.183","172.19.0.3","TLSv1.2","1516","Application Data [TCP segment of a reassembled PDU]"
"6.284431","5.9.29.183","172.19.0.3","TCP","1516","9002 → 43520 [PSH, ACK] Seq=126658 Ack=8030 Win=65535 Len=1460 [TCP segment of a reassembled PDU]"
"6.284438","5.9.29.183","172.19.0.3","TCP","1516","9002 → 43520 [PSH, ACK] Seq=128118 Ack=8030 Win=65535 Len=1460 [TCP segment of a reassembled PDU]"
"6.284442","5.9.29.183","172.19.0.3","TCP","264","9002 → 43520 [PSH, ACK] Seq=129578 Ack=8030 Win=65535 Len=208 [TCP segment of a reassembled PDU]"
"6.284528","172.19.0.3","5.9.29.183","TCP","56","43520 → 9002 [ACK] Seq=8030 Ack=129786 Win=12672 Len=0"
"6.284998","172.19.0.3","5.9.29.183","TLSv1.2","599","Application Data"
"6.285295","5.9.29.183","172.19.0.3","TCP","56","9002 → 43520 [ACK] Seq=129786 Ack=8573 Win=65535 Len=0"
"6.299756","5.9.29.183","172.19.0.3","TLSv1.2","648","Application Data"
"6.311112","5.9.29.183","172.19.0.3","TCP","1516","[TCP segment of a reassembled PDU]"
"6.311136","172.19.0.3","5.9.29.183","TCP","56","43520 → 9002 [ACK] Seq=8573 Ack=131838 Win=12738 Len=0"
"6.311152","5.9.29.183","172.19.0.3","TCP","1492","9002 → 43520 [PSH, ACK] Seq=131838 Ack=8573 Win=65535 Len=1436 [TCP segment of a reassembled PDU]"
"6.311159","5.9.29.183","172.19.0.3","TLSv1.2","1516","Application Data [TCP segment of a reassembled PDU]"
"6.311343","5.9.29.183","172.19.0.3","TCP","1516","9002 → 43520 [PSH, ACK] Seq=134734 Ack=8573 Win=65535 Len=1460 [TCP segment of a reassembled PDU]"
"6.311353","5.9.29.183","172.19.0.3","TCP","1516","9002 → 43520 [PSH, ACK] Seq=136194 Ack=8573 Win=65535 Len=1460 [TCP segment of a reassembled PDU]"
"6.311356","5.9.29.183","172.19.0.3","TLSv1.2","1516","Application Data [TCP segment of a reassembled PDU]"
"6.311376","5.9.29.183","172.19.0.3","TCP","1456","9002 → 43520 [PSH, ACK] Seq=139114 Ack=8573 Win=65535 Len=1400 [TCP segment of a reassembled PDU]"
"6.311459","172.19.0.3","5.9.29.183","TCP","56","43520 → 9002 [ACK] Seq=8573 Ack=140514 Win=12690 Len=0"
"6.311903","172.19.0.3","5.9.29.183","TLSv1.2","599","Application Data"
"6.312151","5.9.29.183","172.19.0.3","TCP","56","9002 → 43520 [ACK] Seq=140514 Ack=9116 Win=65535 Len=0"
"6.315154","5.9.29.183","172.19.0.3","TCP","1504","9002 → 43520 [PSH, ACK] Seq=140514 Ack=9116 Win=65535 Len=1448 [TCP segment of a reassembled PDU]"
"6.327012","5.9.29.183","172.19.0.3","TLSv1.2","1516","Application Data [TCP segment of a reassembled PDU]"
"6.327038","172.19.0.3","5.9.29.183","TCP","56","43520 → 9002 [ACK] Seq=9116 Ack=143422 Win=12738 Len=0"
"6.327054","5.9.29.183","172.19.0.3","TCP","1492","9002 → 43520 [PSH, ACK] Seq=143422 Ack=9116 Win=65535 Len=1436 [TCP segment of a reassembled PDU]"
"6.327270","5.9.29.183","172.19.0.3","TCP","1516","9002 → 43520 [PSH, ACK] Seq=144858 Ack=9116 Win=65535 Len=1460 [TCP segment of a reassembled PDU]"
"6.327277","5.9.29.183","172.19.0.3","TLSv1.2","1516","Application Data, Application Data"
"6.327280","5.9.29.183","172.19.0.3","TCP","1516","9002 → 43520 [PSH, ACK] Seq=147778 Ack=9116 Win=65535 Len=1460 [TCP segment of a reassembled PDU]"
"6.327283","5.9.29.183","172.19.0.3","TCP","1468","9002 → 43520 [PSH, ACK] Seq=149238 Ack=9116 Win=65535 Len=1412 [TCP segment of a reassembled PDU]"
"6.327353","172.19.0.3","5.9.29.183","TCP","56","43520 → 9002 [ACK] Seq=9116 Ack=150650 Win=12698 Len=0"
"6.334625","5.9.29.183","172.19.0.3","TLSv1.2","1504","Application Data, Application Data"
"6.342644","5.9.29.183","172.19.0.3","TLSv1.2","1504","Application Data [TCP segment of a reassembled PDU]"
"6.342683","172.19.0.3","5.9.29.183","TCP","56","43520 → 9002 [ACK] Seq=9116 Ack=153546 Win=12736 Len=0"
"6.342913","5.9.29.183","172.19.0.3","TCP","1516","9002 → 43520 [PSH, ACK] Seq=153546 Ack=9116 Win=65535 Len=1460 [TCP segment of a reassembled PDU]"
"6.342922","5.9.29.183","172.19.0.3","TCP","1492","9002 → 43520 [PSH, ACK] Seq=155006 Ack=9116 Win=65535 Len=1436 [TCP segment of a reassembled PDU]"
"6.342926","5.9.29.183","172.19.0.3","TLSv1.2","1516","Application Data [TCP segment of a reassembled PDU]"
"6.343035","5.9.29.183","172.19.0.3","TCP","1516","9002 → 43520 [PSH, ACK] Seq=157902 Ack=9116 Win=65535 Len=1460 [TCP segment of a reassembled PDU]"
"6.343043","5.9.29.183","172.19.0.3","TCP","1516","9002 → 43520 [PSH, ACK] Seq=159362 Ack=9116 Win=65535 Len=1460 [TCP segment of a reassembled PDU]"
"6.343046","5.9.29.183","172.19.0.3","TLSv1.2","1516","Application Data [TCP segment of a reassembled PDU]"
"6.343058","5.9.29.183","172.19.0.3","TLSv1.2","339","Application Data"
"6.343122","172.19.0.3","5.9.29.183","TCP","56","43520 → 9002 [ACK] Seq=9116 Ack=162565 Win=12680 Len=0"
"6.343701","172.19.0.3","5.9.29.183","TLSv1.2","599","Application Data"
"6.343939","5.9.29.183","172.19.0.3","TCP","56","9002 → 43520 [ACK] Seq=162565 Ack=9659 Win=65535 Len=0"
"6.355002","172.19.0.3","5.9.29.183","TLSv1.2","1113","Application Data"
"6.355292","5.9.29.183","172.19.0.3","TCP","56","9002 → 43520 [ACK] Seq=162565 Ack=10716 Win=65535 Len=0"
"6.509320","5.9.29.183","172.19.0.3","TLSv1.2","599","Application Data"
"6.552773","172.19.0.3","5.9.29.183","TCP","56","43520 → 9002 [ACK] Seq=10716 Ack=163108 Win=12738 Len=0"
"7.192207","5.9.29.183","172.19.0.3","TLSv1.2","599","Application Data"
"7.192302","172.19.0.3","5.9.29.183","TCP","56","43520 → 9002 [ACK] Seq=10716 Ack=163651 Win=12738 Len=0"
"7.193036","172.19.0.3","5.9.29.183","TLSv1.2","599","Application Data"
"7.193410","5.9.29.183","172.19.0.3","TCP","56","9002 → 43520 [ACK] Seq=163651 Ack=11259 Win=65535 Len=0"
"8.114527","5.9.29.183","172.19.0.3","TLSv1.2","599","Application Data"
"8.114813","5.9.29.183","172.19.0.3","TCP","1516","[TCP segment of a reassembled PDU]"
"8.114828","172.19.0.3","5.9.29.183","TCP","56","43520 → 9002 [ACK] Seq=11259 Ack=165654 Win=12738 Len=0"
"8.114831","5.9.29.183","172.19.0.3","TCP","1492","9002 → 43520 [PSH, ACK] Seq=165654 Ack=11259 Win=65535 Len=1436 [TCP segment of a reassembled PDU]"
"8.130394","5.9.29.183","172.19.0.3","TLSv1.2","787","Application Data"
"8.130421","172.19.0.3","5.9.29.183","TCP","56","43520 → 9002 [ACK] Seq=11259 Ack=167821 Win=12738 Len=0"
"8.150118","5.9.29.183","172.19.0.3","TCP","1504","[TCP segment of a reassembled PDU]"
"8.150257","5.9.29.183","172.19.0.3","TCP","1504","9002 → 43520 [PSH, ACK] Seq=169269 Ack=11259 Win=65535 Len=1448 [TCP segment of a reassembled PDU]"
"8.150264","5.9.29.183","172.19.0.3","TLSv1.2","1237","Application Data"
"8.150378","172.19.0.3","5.9.29.183","TCP","56","43520 → 9002 [ACK] Seq=11259 Ack=171898 Win=12722 Len=0"
"8.166725","5.9.29.183","172.19.0.3","TLSv1.2","149","Application Data"
"8.209236","172.19.0.3","5.9.29.183","TCP","56","43520 → 9002 [ACK] Seq=11259 Ack=171991 Win=12738 Len=0"
"8.250533","5.9.29.183","172.19.0.3","TCP","1516","[TCP segment of a reassembled PDU]"
"8.250559","172.19.0.3","5.9.29.183","TCP","56","43520 → 9002 [ACK] Seq=11259 Ack=173451 Win=12738 Len=0"
"8.250625","5.9.29.183","172.19.0.3","TCP","1516","9002 → 43520 [PSH, ACK] Seq=173451 Ack=11259 Win=65535 Len=1460 [TCP segment of a reassembled PDU]"
"8.250647","172.19.0.3","5.9.29.183","TCP","56","43520 → 9002 [ACK] Seq=11259 Ack=174911 Win=12730 Len=0"
"8.250650","5.9.29.183","172.19.0.3","TLSv1.2","763","Application Data"
"8.250656","172.19.0.3","5.9.29.183","TCP","56","43520 → 9002 [ACK] Seq=11259 Ack=175618 Win=12725 Len=0"
"8.266442","5.9.29.183","172.19.0.3","TLSv1.2","599","Application Data"
"8.266472","172.19.0.3","5.9.29.183","TCP","56","43520 → 9002 [ACK] Seq=11259 Ack=176161 Win=12738 Len=0"
"8.322589","5.9.29.183","172.19.0.3","TCP","1516","[TCP segment of a reassembled PDU]"
"8.322615","172.19.0.3","5.9.29.183","TCP","56","43520 → 9002 [ACK] Seq=11259 Ack=177621 Win=12738 Len=0"
"8.322674","5.9.29.183","172.19.0.3","TCP","1516","9002 → 43520 [PSH, ACK] Seq=177621 Ack=11259 Win=65535 Len=1460 [TCP segment of a reassembled PDU]"
"8.322687","172.19.0.3","5.9.29.183","TCP","56","43520 → 9002 [ACK] Seq=11259 Ack=179081 Win=12728 Len=0"
"8.322690","5.9.29.183","172.19.0.3","TLSv1.2","763","Application Data"
"8.322696","172.19.0.3","5.9.29.183","TCP","56","43520 → 9002 [ACK] Seq=11259 Ack=179788 Win=12723 Len=0"
"8.323066","172.19.0.3","5.9.29.183","TLSv1.2","599","Application Data"
"8.323399","5.9.29.183","172.19.0.3","TCP","56","9002 → 43520 [ACK] Seq=179788 Ack=11802 Win=65535 Len=0"
"8.347761","5.9.29.183","172.19.0.3","TCP","1516","[TCP segment of a reassembled PDU]"
"8.347831","5.9.29.183","172.19.0.3","TCP","1492","9002 → 43520 [PSH, ACK] Seq=181248 Ack=11802 Win=65535 Len=1436 [TCP segment of a reassembled PDU]"
"8.347870","5.9.29.183","172.19.0.3","TLSv1.2","1516","Application Data [TCP segment of a reassembled PDU]"
"8.347875","5.9.29.183","172.19.0.3","TCP","1516","9002 → 43520 [PSH, ACK] Seq=184144 Ack=11802 Win=65535 Len=1460 [TCP segment of a reassembled PDU]"
"8.347881","5.9.29.183","172.19.0.3","TCP","1516","9002 → 43520 [PSH, ACK] Seq=185604 Ack=11802 Win=65535 Len=1460 [TCP segment of a reassembled PDU]"
"8.348007","172.19.0.3","5.9.29.183","TCP","56","43520 → 9002 [ACK] Seq=11802 Ack=187064 Win=12706 Len=0"
"8.348014","5.9.29.183","172.19.0.3","TLSv1.2","1516","Application Data [TCP segment of a reassembled PDU]"
"8.348019","5.9.29.183","172.19.0.3","TCP","1516","9002 → 43520 [PSH, ACK] Seq=188524 Ack=11802 Win=65535 Len=1460 [TCP segment of a reassembled PDU]"
"8.348021","5.9.29.183","172.19.0.3","TCP","806","9002 → 43520 [PSH, ACK] Seq=189984 Ack=11802 Win=65535 Len=750 [TCP segment of a reassembled PDU]"
"8.348090","172.19.0.3","5.9.29.183","TCP","56","43520 → 9002 [ACK] Seq=11802 Ack=190734 Win=12682 Len=0"
"8.348173","5.9.29.183","172.19.0.3","TCP","427","9002 → 43520 [PSH, ACK] Seq=190734 Ack=11802 Win=65535 Len=371 [TCP segment of a reassembled PDU]"
"8.363612","5.9.29.183","172.19.0.3","TLSv1.2","648","Application Data"
"8.363832","172.19.0.3","5.9.29.183","TCP","56","43520 → 9002 [ACK] Seq=11802 Ack=191697 Win=12738 Len=0"
"8.364109","172.19.0.3","5.9.29.183","TLSv1.2","599","Application Data"
"8.364464","5.9.29.183","172.19.0.3","TCP","56","9002 → 43520 [ACK] Seq=191697 Ack=12345 Win=65535 Len=0"
"8.408686","5.9.29.183","172.19.0.3","TCP","1516","[TCP segment of a reassembled PDU]"
"8.408770","5.9.29.183","172.19.0.3","TCP","1492","9002 → 43520 [PSH, ACK] Seq=193157 Ack=12345 Win=65535 Len=1436 [TCP segment of a reassembled PDU]"
"8.408855","5.9.29.183","172.19.0.3","TLSv1.2","1237","Application Data"
"8.408998","172.19.0.3","5.9.29.183","TCP","56","43520 → 9002 [ACK] Seq=12345 Ack=195774 Win=12722 Len=0"
"8.409240","5.9.29.183","172.19.0.3","TCP","1516","[TCP segment of a reassembled PDU]"
"8.409248","5.9.29.183","172.19.0.3","TCP","1492","9002 → 43520 [PSH, ACK] Seq=197234 Ack=12345 Win=65535 Len=1436 [TCP segment of a reassembled PDU]"
"8.409256","172.19.0.3","5.9.29.183","TCP","56","43520 → 9002 [ACK] Seq=12345 Ack=198670 Win=12730 Len=0"
"8.424490","5.9.29.183","172.19.0.3","TLSv1.2","851","Application Data"
"8.469503","172.19.0.3","5.9.29.183","TCP","56","43520 → 9002 [ACK] Seq=12345 Ack=199465 Win=12738 Len=0"
"8.472426","5.9.29.183","172.19.0.3","TCP","1516","[TCP segment of a reassembled PDU]"
"8.472494","5.9.29.183","172.19.0.3","TCP","1492","9002 → 43520 [PSH, ACK] Seq=200925 Ack=12345 Win=65535 Len=1436 [TCP segment of a reassembled PDU]"
"8.472506","5.9.29.183","172.19.0.3","TLSv1.2","1237","Application Data"
"8.472645","172.19.0.3","5.9.29.183","TCP","56","43520 → 9002 [ACK] Seq=12345 Ack=203542 Win=12720 Len=0"
"8.488079","5.9.29.183","172.19.0.3","TLSv1.2","149","Application Data"
"8.488377","172.19.0.3","5.9.29.183","TCP","56","43520 → 9002 [ACK] Seq=12345 Ack=203635 Win=12738 Len=0"
"8.524535","5.9.29.183","172.19.0.3","TCP","1516","[TCP segment of a reassembled PDU]"
"8.524599","5.9.29.183","172.19.0.3","TLSv1.2","1195","Application Data"
"8.524843","172.19.0.3","5.9.29.183","TCP","56","43520 → 9002 [ACK] Seq=12345 Ack=206234 Win=12730 Len=0"
"8.529662","172.19.0.3","5.9.29.183","TLSv1.2","599","Application Data"
"8.529957","5.9.29.183","172.19.0.3","TCP","56","9002 → 43520 [ACK] Seq=206234 Ack=12888 Win=65535 Len=0"
"9.303625","5.9.29.183","172.19.0.3","TLSv1.2","599","Application Data"
"9.304773","172.19.0.3","5.9.29.183","TLSv1.2","599","Application Data"
"9.305318","5.9.29.183","172.19.0.3","TCP","56","9002 → 43520 [ACK] Seq=206777 Ack=13431 Win=65535 Len=0"
"9.959488","5.9.29.183","172.19.0.3","TCP","1516","[TCP segment of a reassembled PDU]"
"9.959519","5.9.29.183","172.19.0.3","TCP","1516","9002 → 43520 [PSH, ACK] Seq=208237 Ack=13431 Win=65535 Len=1460 [TCP segment of a reassembled PDU]"
"9.959526","5.9.29.183","172.19.0.3","TLSv1.2","763","Application Data"
"9.959529","5.9.29.183","172.19.0.3","TCP","1504","[TCP segment of a reassembled PDU]"
"9.959731","5.9.29.183","172.19.0.3","TCP","1504","9002 → 43520 [PSH, ACK] Seq=211852 Ack=13431 Win=65535 Len=1448 [TCP segment of a reassembled PDU]"
"9.959740","5.9.29.183","172.19.0.3","TLSv1.2","787","Application Data"
"9.959774","172.19.0.3","5.9.29.183","TCP","56","43520 → 9002 [ACK] Seq=13431 Ack=214031 Win=12698 Len=0"
"10.063457","5.9.29.183","172.19.0.3","TCP","1516","[TCP segment of a reassembled PDU]"
"10.063487","5.9.29.183","172.19.0.3","TCP","1492","9002 → 43520 [PSH, ACK] Seq=215491 Ack=13431 Win=65535 Len=1436 [TCP segment of a reassembled PDU]"
"10.063542","172.19.0.3","5.9.29.183","TCP","56","43520 → 9002 [ACK] Seq=13431 Ack=216927 Win=12730 Len=0"
"10.063660","5.9.29.183","172.19.0.3","TLSv1.2","1237","Application Data"
"10.079250","5.9.29.183","172.19.0.3","TLSv1.2","149","Application Data"
"10.079401","172.19.0.3","5.9.29.183","TCP","56","43520 → 9002 [ACK] Seq=13431 Ack=218201 Win=12738 Len=0"
"10.085687","5.9.29.183","172.19.0.3","TCP","1516","[TCP segment of a reassembled PDU]"
"10.085725","5.9.29.183","172.19.0.3","TCP","1492","9002 → 43520 [PSH, ACK] Seq=219661 Ack=13431 Win=65535 Len=1436 [TCP segment of a reassembled PDU]"
"10.085735","5.9.29.183","172.19.0.3","TLSv1.2","1516","Application Data [TCP segment of a reassembled PDU]"
"10.085850","5.9.29.183","172.19.0.3","TCP","1516","9002 → 43520 [PSH, ACK] Seq=222557 Ack=13431 Win=65535 Len=1460 [TCP segment of a reassembled PDU]"
"10.085939","5.9.29.183","172.19.0.3","TCP","1480","9002 → 43520 [PSH, ACK] Seq=224017 Ack=13431 Win=65535 Len=1424 [TCP segment of a reassembled PDU]"
"10.086102","5.9.29.183","172.19.0.3","TLSv1.2","1504","Application Data [TCP segment of a reassembled PDU]"
"10.086234","5.9.29.183","172.19.0.3","TCP","1504","9002 → 43520 [PSH, ACK] Seq=226889 Ack=13431 Win=65535 Len=1448 [TCP segment of a reassembled PDU]"
"10.086297","172.19.0.3","5.9.29.183","TCP","56","43520 → 9002 [ACK] Seq=13431 Ack=228337 Win=12690 Len=0"
"10.094459","5.9.29.183","172.19.0.3","TLSv1.2","801","Application Data"
"10.096198","5.9.29.183","172.19.0.3","TCP","1504","[TCP segment of a reassembled PDU]"
"10.096210","172.19.0.3","5.9.29.183","TCP","56","43520 → 9002 [ACK] Seq=13431 Ack=230530 Win=12736 Len=0"
"10.100836","5.9.29.183","172.19.0.3","TCP","1516","9002 → 43520 [PSH, ACK] Seq=230530 Ack=13431 Win=65535 Len=1460 [TCP segment of a reassembled PDU]"
"10.100872","5.9.29.183","172.19.0.3","TLSv1.2","1492","Application Data [TCP segment of a reassembled PDU]"
"10.101022","172.19.0.3","5.9.29.183","TCP","56","43520 → 9002 [ACK] Seq=13431 Ack=233426 Win=12730 Len=0"
"10.101546","5.9.29.183","172.19.0.3","TCP","1516","9002 → 43520 [PSH, ACK] Seq=233426 Ack=13431 Win=65535 Len=1460 [TCP segment of a reassembled PDU]"
"10.101555","5.9.29.183","172.19.0.3","TCP","1492","9002 → 43520 [PSH, ACK] Seq=234886 Ack=13431 Win=65535 Len=1436 [TCP segment of a reassembled PDU]"
"10.101709","172.19.0.3","5.9.29.183","TLSv1.2","1113","Application Data"
"10.101910","5.9.29.183","172.19.0.3","TCP","56","9002 → 43520 [ACK] Seq=236322 Ack=14488 Win=65535 Len=0"
"10.101986","5.9.29.183","172.19.0.3","TLSv1.2","1516","Application Data [TCP segment of a reassembled PDU]"
"10.102062","5.9.29.183","172.19.0.3","TCP","1492","9002 → 43520 [PSH, ACK] Seq=237782 Ack=14488 Win=65535 Len=1436 [TCP segment of a reassembled PDU]"
"10.102070","172.19.0.3","5.9.29.183","TCP","56","43520 → 9002 [ACK] Seq=14488 Ack=239218 Win=12730 Len=0"
"10.109721","5.9.29.183","172.19.0.3","TLSv1.2","1315","Application Data"
"10.157006","172.19.0.3","5.9.29.183","TCP","56","43520 → 9002 [ACK] Seq=14488 Ack=240477 Win=12738 Len=0"
"10.259735","5.9.29.183","172.19.0.3","TCP","1516","[TCP segment of a reassembled PDU]"
"10.259758","172.19.0.3","5.9.29.183","TCP","56","43520 → 9002 [ACK] Seq=14488 Ack=241937 Win=12738 Len=0"
"10.259771","5.9.29.183","172.19.0.3","TCP","1492","9002 → 43520 [PSH, ACK] Seq=241937 Ack=14488 Win=65535 Len=1436 [TCP segment of a reassembled PDU]"
"10.259782","172.19.0.3","5.9.29.183","TCP","56","43520 → 9002 [ACK] Seq=14488 Ack=243373 Win=12730 Len=0"
"10.259783","5.9.29.183","172.19.0.3","TLSv1.2","1516","Application Data [TCP segment of a reassembled PDU]"
"10.259788","172.19.0.3","5.9.29.183","TCP","56","43520 → 9002 [ACK] Seq=14488 Ack=244833 Win=12722 Len=0"
"10.259923","5.9.29.183","172.19.0.3","TCP","1516","9002 → 43520 [PSH, ACK] Seq=244833 Ack=14488 Win=65535 Len=1460 [TCP segment of a reassembled PDU]"
"10.259938","172.19.0.3","5.9.29.183","TCP","56","43520 → 9002 [ACK] Seq=14488 Ack=246293 Win=12714 Len=0"
"10.259940","5.9.29.183","172.19.0.3","TCP","1213","9002 → 43520 [PSH, ACK] Seq=246293 Ack=14488 Win=65535 Len=1157 [TCP segment of a reassembled PDU]"
"10.259945","172.19.0.3","5.9.29.183","TCP","56","43520 → 9002 [ACK] Seq=14488 Ack=247450 Win=12706 Len=0"
"10.271420","5.9.29.183","172.19.0.3","TLSv1.2","1516","Application Data [TCP segment of a reassembled PDU]"
"10.271443","172.19.0.3","5.9.29.183","TCP","56","43520 → 9002 [ACK] Seq=14488 Ack=248910 Win=12738 Len=0"
"10.271457","5.9.29.183","172.19.0.3","TCP","1516","9002 → 43520 [PSH, ACK] Seq=248910 Ack=14488 Win=65535 Len=1460 [TCP segment of a reassembled PDU]"
"10.271464","172.19.0.3","5.9.29.183","TCP","56","43520 → 9002 [ACK] Seq=14488 Ack=250370 Win=12730 Len=0"
"10.271466","5.9.29.183","172.19.0.3","TLSv1.2","1516","Application Data [TCP segment of a reassembled PDU]"
"10.271471","5.9.29.183","172.19.0.3","TCP","1468","9002 → 43520 [PSH, ACK] Seq=251830 Ack=14488 Win=65535 Len=1412 [TCP segment of a reassembled PDU]"
"10.271602","5.9.29.183","172.19.0.3","TCP","1504","9002 → 43520 [PSH, ACK] Seq=253242 Ack=14488 Win=65535 Len=1448 [TCP segment of a reassembled PDU]"
"10.271675","172.19.0.3","5.9.29.183","TCP","56","43520 → 9002 [ACK] Seq=14488 Ack=254690 Win=12706 Len=0"
"10.275279","5.9.29.183","172.19.0.3","TLSv1.2","865","Application Data"
"10.275428","172.19.0.3","5.9.29.183","TCP","56","43520 → 9002 [ACK] Seq=14488 Ack=255499 Win=12738 Len=0"
"10.279477","172.19.0.3","5.9.29.183","TLSv1.2","599","Application Data"
"10.279746","5.9.29.183","172.19.0.3","TCP","56","9002 → 43520 [ACK] Seq=255499 Ack=15031 Win=65535 Len=0"
"11.186594","5.9.29.183","172.19.0.3","TLSv1.2","599","Application Data"
"11.187536","172.19.0.3","5.9.29.183","TLSv1.2","599","Application Data"
"11.187885","5.9.29.183","172.19.0.3","TCP","56","9002 → 43520 [ACK] Seq=256042 Ack=15574 Win=65535 Len=0"
"12.108627","5.9.29.183","172.19.0.3","TCP","284","[TCP segment of a reassembled PDU]"
"12.108659","5.9.29.183","172.19.0.3","TLSv1.2","371","Application Data"
"12.108794","172.19.0.3","5.9.29.183","TCP","56","43520 → 9002 [ACK] Seq=15574 Ack=256585 Win=12738 Len=0"
"12.109423","5.9.29.183","172.19.0.3","TCP","1516","[TCP segment of a reassembled PDU]"
"12.109464","5.9.29.183","172.19.0.3","TCP","1492","9002 → 43520 [PSH, ACK] Seq=258045 Ack=15574 Win=65535 Len=1436 [TCP segment of a reassembled PDU]"
"12.109472","5.9.29.183","172.19.0.3","TLSv1.2","1516","Application Data [TCP segment of a reassembled PDU]"
"12.109505","5.9.29.183","172.19.0.3","TCP","1516","9002 → 43520 [PSH, ACK] Seq=260941 Ack=15574 Win=65535 Len=1460 [TCP segment of a reassembled PDU]"
"12.109511","5.9.29.183","172.19.0.3","TCP","1480","9002 → 43520 [PSH, ACK] Seq=262401 Ack=15574 Win=65535 Len=1424 [TCP segment of a reassembled PDU]"
"12.109545","172.19.0.3","5.9.29.183","TCP","56","43520 → 9002 [ACK] Seq=15574 Ack=263825 Win=12706 Len=0"
"12.116481","5.9.29.183","172.19.0.3","TLSv1.2","1516","Application Data, Application Data"
"12.116511","5.9.29.183","172.19.0.3","TCP","1516","9002 → 43520 [PSH, ACK] Seq=265285 Ack=15574 Win=65535 Len=1460 [TCP segment of a reassembled PDU]"
"12.116525","172.19.0.3","5.9.29.183","TCP","56","43520 → 9002 [ACK] Seq=15574 Ack=266745 Win=12730 Len=0"
"12.116527","5.9.29.183","172.19.0.3","TCP","1480","9002 → 43520 [PSH, ACK] Seq=266745 Ack=15574 Win=65535 Len=1424 [TCP segment of a reassembled PDU]"
"12.124899","5.9.29.183","172.19.0.3","TLSv1.2","439","Application Data, Application Data"
"12.124925","172.19.0.3","5.9.29.183","TCP","56","43520 → 9002 [ACK] Seq=15574 Ack=268552 Win=12736 Len=0"
"12.139357","5.9.29.183","172.19.0.3","TCP","1516","[TCP segment of a reassembled PDU]"
"12.139385","5.9.29.183","172.19.0.3","TCP","1492","9002 → 43520 [PSH, ACK] Seq=270012 Ack=15574 Win=65535 Len=1436 [TCP segment of a reassembled PDU]"
"12.139391","5.9.29.183","172.19.0.3","TLSv1.2","1504","Application Data [TCP segment of a reassembled PDU]"
"12.139512","172.19.0.3","5.9.29.183","TCP","56","43520 → 9002 [ACK] Seq=15574 Ack=272896 Win=12722 Len=0"
"12.140102","5.9.29.183","172.19.0.3","TLSv1.2","396","Application Data"
"12.154323","5.9.29.183","172.19.0.3","TCP","1504","[TCP segment of a reassembled PDU]"
"12.154344","172.19.0.3","5.9.29.183","TCP","56","43520 → 9002 [ACK] Seq=15574 Ack=274684 Win=12738 Len=0"
"12.155077","5.9.29.183","172.19.0.3","TLSv1.2","693","Application Data"
"12.158677","172.19.0.3","5.9.29.183","TLSv1.2","599","Application Data"
"12.159008","5.9.29.183","172.19.0.3","TCP","56","9002 → 43520 [ACK] Seq=275321 Ack=16117 Win=65535 Len=0"
"13.249479","5.9.29.183","172.19.0.3","TLSv1.2","599","Application Data"
"13.250358","172.19.0.3","5.9.29.183","TLSv1.2","599","Application Data"
"13.250775","5.9.29.183","172.19.0.3","TCP","56","9002 → 43520 [ACK] Seq=275864 Ack=16660 Win=65535 Len=0"
"13.956053","5.9.29.183","172.19.0.3","TCP","1516","[TCP segment of a reassembled PDU]"
"13.956089","5.9.29.183","172.19.0.3","TCP","1492","9002 → 43520 [PSH, ACK] Seq=277324 Ack=16660 Win=65535 Len=1436 [TCP segment of a reassembled PDU]"
"13.956381","172.19.0.3","5.9.29.183","TCP","56","43520 → 9002 [ACK] Seq=16660 Ack=278760 Win=12728 Len=0"
"13.956430","5.9.29.183","172.19.0.3","TLSv1.2","787","Application Data"
"13.976818","5.9.29.183","172.19.0.3","TCP","1516","[TCP segment of a reassembled PDU]"
"13.976848","172.19.0.3","5.9.29.183","TCP","56","43520 → 9002 [ACK] Seq=16660 Ack=280951 Win=12738 Len=0"
"13.976860","5.9.29.183","172.19.0.3","TCP","1492","9002 → 43520 [PSH, ACK] Seq=280951 Ack=16660 Win=65535 Len=1436 [TCP segment of a reassembled PDU]"
"13.977095","5.9.29.183","172.19.0.3","TLSv1.2","1237","Application Data"
"13.977135","5.9.29.183","172.19.0.3","TCP","1516","[TCP segment of a reassembled PDU]"
"13.977159","5.9.29.183","172.19.0.3","TCP","1492","9002 → 43520 [PSH, ACK] Seq=285028 Ack=16660 Win=65535 Len=1436 [TCP segment of a reassembled PDU]"
"13.977324","172.19.0.3","5.9.29.183","TCP","56","43520 → 9002 [ACK] Seq=16660 Ack=286464 Win=12706 Len=0"
"13.992937","5.9.29.183","172.19.0.3","TLSv1.2","851","Application Data"
"13.993428","172.19.0.3","5.9.29.183","TLSv1.2","599","Application Data"
"13.993752","5.9.29.183","172.19.0.3","TCP","56","9002 → 43520 [ACK] Seq=287259 Ack=17203 Win=65535 Len=0"
"14.114293","5.9.29.183","172.19.0.3","TLSv1.2","1113","Application Data"
"14.143567","5.9.29.183","172.19.0.3","TCP","1516","[TCP segment of a reassembled PDU]"
"14.143590","172.19.0.3","5.9.29.183","TCP","56","43520 → 9002 [ACK] Seq=17203 Ack=289776 Win=12738 Len=0"
"14.143606","5.9.29.183","172.19.0.3","TCP","1492","9002 → 43520 [PSH, ACK] Seq=289776 Ack=17203 Win=65535 Len=1436 [TCP segment of a reassembled PDU]"
"14.143616","5.9.29.183","172.19.0.3","TLSv1.2","1237","Application Data"
"14.143750","5.9.29.183","172.19.0.3","TCP","1516","[TCP segment of a reassembled PDU]"
"14.143761","5.9.29.183","172.19.0.3","TCP","1492","9002 → 43520 [PSH, ACK] Seq=293853 Ack=17203 Win=65535 Len=1436 [TCP segment of a reassembled PDU]"
"14.143840","172.19.0.3","5.9.29.183","TCP","56","43520 → 9002 [ACK] Seq=17203 Ack=295289 Win=12706 Len=0"
"14.159981","5.9.29.183","172.19.0.3","TLSv1.2","880","Application Data, Application Data"
"14.164097","5.9.29.183","172.19.0.3","TCP","1504","[TCP segment of a reassembled PDU]"
"14.164126","172.19.0.3","5.9.29.183","TCP","56","43520 → 9002 [ACK] Seq=17203 Ack=297561 Win=12738 Len=0"
"14.164396","5.9.29.183","172.19.0.3","TCP","1516","9002 → 43520 [PSH, ACK] Seq=297561 Ack=17203 Win=65535 Len=1460 [TCP segment of a reassembled PDU]"
"14.164410","5.9.29.183","172.19.0.3","TLSv1.2","1492","Application Data [TCP segment of a reassembled PDU]"
"14.164498","172.19.0.3","5.9.29.183","TCP","56","43520 → 9002 [ACK] Seq=17203 Ack=300457 Win=12722 Len=0"
"14.165374","5.9.29.183","172.19.0.3","TLSv1.2","1504","Application Data [TCP segment of a reassembled PDU]"
"14.165478","5.9.29.183","172.19.0.3","TCP","1504","9002 → 43520 [PSH, ACK] Seq=301905 Ack=17203 Win=65535 Len=1448 [TCP segment of a reassembled PDU]"
"14.165489","172.19.0.3","5.9.29.183","TCP","56","43520 → 9002 [ACK] Seq=17203 Ack=303353 Win=12728 Len=0"
"14.175356","5.9.29.183","172.19.0.3","TLSv1.2","613","Application Data"
"14.175758","172.19.0.3","5.9.29.183","TLSv1.2","599","Application Data"
"14.176181","5.9.29.183","172.19.0.3","TCP","56","9002 → 43520 [ACK] Seq=303910 Ack=17746 Win=65535 Len=0"
"14.190728","5.9.29.183","172.19.0.3","TLSv1.2","599","Application Data"
"14.233063","172.19.0.3","5.9.29.183","TCP","56","43520 → 9002 [ACK] Seq=17746 Ack=304453 Win=12738 Len=0"
"14.344008","5.9.29.183","172.19.0.3","TCP","1516","[TCP segment of a reassembled PDU]"
"14.344031","172.19.0.3","5.9.29.183","TCP","56","43520 → 9002 [ACK] Seq=17746 Ack=305913 Win=12738 Len=0"
"14.344048","5.9.29.183","172.19.0.3","TCP","1516","9002 → 43520 [PSH, ACK] Seq=305913 Ack=17746 Win=65535 Len=1460 [TCP segment of a reassembled PDU]"
"14.344064","172.19.0.3","5.9.29.183","TCP","56","43520 → 9002 [ACK] Seq=17746 Ack=307373 Win=12730 Len=0"
"14.344066","5.9.29.183","172.19.0.3","TLSv1.2","249","Application Data"
"14.344072","172.19.0.3","5.9.29.183","TCP","56","43520 → 9002 [ACK] Seq=17746 Ack=307566 Win=12729 Len=0"
"14.348134","172.19.0.3","5.9.29.183","TLSv1.2","599","Application Data"
"14.348459","5.9.29.183","172.19.0.3","TCP","56","9002 → 43520 [ACK] Seq=307566 Ack=18289 Win=65535 Len=0"
"14.926140","5.9.29.183","172.19.0.3","TLSv1.2","599","Application Data"
"14.926899","172.19.0.3","5.9.29.183","TLSv1.2","599","Application Data"
"14.927351","5.9.29.183","172.19.0.3","TCP","56","9002 → 43520 [ACK] Seq=308109 Ack=18832 Win=65535 Len=0"
"15.779688","172.19.0.3","5.9.29.183","TLSv1.2","1113","Application Data"
"15.780240","5.9.29.183","172.19.0.3","TCP","56","9002 → 43520 [ACK] Seq=308109 Ack=19889 Win=65535 Len=0"
"15.784718","5.9.29.183","172.19.0.3","TLSv1.2","599","Application Data"
"15.807238","5.9.29.183","172.19.0.3","TCP","1504","[TCP segment of a reassembled PDU]"
"15.807273","172.19.0.3","5.9.29.183","TCP","56","43520 → 9002 [ACK] Seq=19889 Ack=310100 Win=12738 Len=0"
"15.807466","5.9.29.183","172.19.0.3","TCP","1504","9002 → 43520 [PSH, ACK] Seq=310100 Ack=19889 Win=65535 Len=1448 [TCP segment of a reassembled PDU]"
"15.807479","5.9.29.183","172.19.0.3","TLSv1.2","1237","Application Data"
"15.807555","172.19.0.3","5.9.29.183","TCP","56","43520 → 9002 [ACK] Seq=19889 Ack=312729 Win=12722 Len=0"
"15.808116","172.19.0.3","5.9.29.183","TLSv1.2","599","Application Data"
"15.808370","5.9.29.183","172.19.0.3","TCP","56","9002 → 43520 [ACK] Seq=312729 Ack=20432 Win=65535 Len=0"
"15.821679","5.9.29.183","172.19.0.3","TLSv1.2","1516","Application Data"
"15.821712","5.9.29.183","172.19.0.3","TCP","1492","9002 → 43520 [PSH, ACK] Seq=314189 Ack=20432 Win=65535 Len=1436 [TCP segment of a reassembled PDU]"
"15.821860","172.19.0.3","5.9.29.183","TCP","56","43520 → 9002 [ACK] Seq=20432 Ack=315625 Win=12730 Len=0"
"15.822816","5.9.29.183","172.19.0.3","TLSv1.2","1423","Application Data, Application Data"
"15.846814","5.9.29.183","172.19.0.3","TLSv1.2","599","Application Data"
"15.846841","172.19.0.3","5.9.29.183","TCP","56","43520 → 9002 [ACK] Seq=20432 Ack=317535 Win=12738 Len=0"
"15.847573","172.19.0.3","5.9.29.183","TLSv1.2","599","Application Data"
"15.847863","5.9.29.183","172.19.0.3","TCP","56","9002 → 43520 [ACK] Seq=317535 Ack=20975 Win=65535 Len=0"
"15.920713","5.9.29.183","172.19.0.3","TLSv1.2","599","Application Data"
"15.942648","5.9.29.183","172.19.0.3","TCP","1516","[TCP segment of a reassembled PDU]"
"15.942676","172.19.0.3","5.9.29.183","TCP","56","43520 → 9002 [ACK] Seq=20975 Ack=319538 Win=12738 Len=0"
"15.942696","5.9.29.183","172.19.0.3","TCP","1516","9002 → 43520 [PSH, ACK] Seq=319538 Ack=20975 Win=65535 Len=1460 [TCP segment of a reassembled PDU]"
"15.942713","5.9.29.183","172.19.0.3","TCP","864","9002 → 43520 [PSH, ACK] Seq=320998 Ack=20975 Win=65535 Len=808 [TCP segment of a reassembled PDU]"
"15.942848","5.9.29.183","172.19.0.3","TLSv1.2","405","Application Data"
"15.942934","172.19.0.3","5.9.29.183","TCP","56","43520 → 9002 [ACK] Seq=20975 Ack=322155 Win=12718 Len=0"
"15.958206","5.9.29.183","172.19.0.3","TLSv1.2","149","Application Data"
"15.978156","5.9.29.183","172.19.0.3","TCP","1516","[TCP segment of a reassembled PDU]"
"15.978180","172.19.0.3","5.9.29.183","TCP","56","43520 → 9002 [ACK] Seq=20975 Ack=323708 Win=12736 Len=0"
"15.978195","5.9.29.183","172.19.0.3","TCP","1492","9002 → 43520 [PSH, ACK] Seq=323708 Ack=20975 Win=65535 Len=1436 [TCP segment of a reassembled PDU]"
"15.978355","5.9.29.183","172.19.0.3","TLSv1.2","1237","Application Data"
"15.978433","172.19.0.3","5.9.29.183","TCP","56","43520 → 9002 [ACK] Seq=20975 Ack=326325 Win=12720 Len=0"
"15.978568","5.9.29.183","172.19.0.3","TCP","1516","[TCP segment of a reassembled PDU]"
"15.978575","5.9.29.183","172.19.0.3","TCP","1492","9002 → 43520 [PSH, ACK] Seq=327785 Ack=20975 Win=65535 Len=1436 [TCP segment of a reassembled PDU]"
"15.978582","172.19.0.3","5.9.29.183","TCP","56","43520 → 9002 [ACK] Seq=20975 Ack=329221 Win=12730 Len=0"
"15.990268","5.9.29.183","172.19.0.3","TLSv1.2","1516","Application Data [TCP segment of a reassembled PDU]"
"15.990301","5.9.29.183","172.19.0.3","TCP","1492","9002 → 43520 [PSH, ACK] Seq=330681 Ack=20975 Win=65535 Len=1436 [TCP segment of a reassembled PDU]"
"15.990318","172.19.0.3","5.9.29.183","TCP","56","43520 → 9002 [ACK] Seq=20975 Ack=332117 Win=12730 Len=0"
"15.993442","5.9.29.183","172.19.0.3","TCP","1504","9002 → 43520 [PSH, ACK] Seq=332117 Ack=20975 Win=65535 Len=1448 [TCP segment of a reassembled PDU]"
"15.993546","5.9.29.183","172.19.0.3","TLSv1.2","1504","Application Data [TCP segment of a reassembled PDU]"
"15.993560","172.19.0.3","5.9.29.183","TCP","56","43520 → 9002 [ACK] Seq=20975 Ack=335013 Win=12730 Len=0"
"15.994239","5.9.29.183","172.19.0.3","TCP","1516","9002 → 43520 [PSH, ACK] Seq=335013 Ack=20975 Win=65535 Len=1460 [TCP segment of a reassembled PDU]"
"15.994251","5.9.29.183","172.19.0.3","TLSv1.2","853","Application Data"
"15.994260","172.19.0.3","5.9.29.183","TCP","56","43520 → 9002 [ACK] Seq=20975 Ack=337270 Win=12730 Len=0"
"15.994526","172.19.0.3","5.9.29.183","TLSv1.2","599","Application Data"
"15.994808","5.9.29.183","172.19.0.3","TCP","56","9002 → 43520 [ACK] Seq=337270 Ack=21518 Win=65535 Len=0"
"16.028058","5.9.29.183","172.19.0.3","TCP","1516","[TCP segment of a reassembled PDU]"
"16.028093","5.9.29.183","172.19.0.3","TCP","1492","9002 → 43520 [PSH, ACK] Seq=338730 Ack=21518 Win=65535 Len=1436 [TCP segment of a reassembled PDU]"
"16.028343","5.9.29.183","172.19.0.3","TLSv1.2","1516","Application Data [TCP segment of a reassembled PDU]"
"16.028353","5.9.29.183","172.19.0.3","TCP","1516","9002 → 43520 [PSH, ACK] Seq=341626 Ack=21518 Win=65535 Len=1460 [TCP segment of a reassembled PDU]"
"16.028357","5.9.29.183","172.19.0.3","TCP","1213","9002 → 43520 [PSH, ACK] Seq=343086 Ack=21518 Win=65535 Len=1157 [TCP segment of a reassembled PDU]"
"16.028430","172.19.0.3","5.9.29.183","TCP","56","43520 → 9002 [ACK] Seq=21518 Ack=344243 Win=12706 Len=0"
"16.028705","172.19.0.3","5.9.29.183","TLSv1.2","599","Application Data"
"16.028919","5.9.29.183","172.19.0.3","TCP","56","9002 → 43520 [ACK] Seq=344243 Ack=22061 Win=65535 Len=0"
"16.044243","5.9.29.183","172.19.0.3","TLSv1.2","851","Application Data"
"16.085653","172.19.0.3","5.9.29.183","TCP","56","43520 → 9002 [ACK] Seq=22061 Ack=345038 Win=12738 Len=0"
"16.186024","5.9.29.183","172.19.0.3","TCP","1516","[TCP segment of a reassembled PDU]"
"16.186071","5.9.29.183","172.19.0.3","TCP","1492","9002 → 43520 [PSH, ACK] Seq=346498 Ack=22061 Win=65535 Len=1436 [TCP segment of a reassembled PDU]"
"16.186294","172.19.0.3","5.9.29.183","TCP","56","43520 → 9002 [ACK] Seq=22061 Ack=347934 Win=12730 Len=0"
"16.186568","5.9.29.183","172.19.0.3","TLSv1.2","1237","Application Data"
"16.186682","5.9.29.183","172.19.0.3","TCP","1516","[TCP segment of a reassembled PDU]"
"16.186691","5.9.29.183","172.19.0.3","TCP","1492","9002 → 43520 [PSH, ACK] Seq=350575 Ack=22061 Win=65535 Len=1436 [TCP segment of a reassembled PDU]"
"16.186738","172.19.0.3","5.9.29.183","TCP","56","43520 → 9002 [ACK] Seq=22061 Ack=352011 Win=12720 Len=0"
"16.186876","5.9.29.183","172.19.0.3","TLSv1.2","1516","Application Data [TCP segment of a reassembled PDU]"
"16.186884","5.9.29.183","172.19.0.3","TCP","1492","9002 → 43520 [PSH, ACK] Seq=353471 Ack=22061 Win=65535 Len=1436 [TCP segment of a reassembled PDU]"
"16.186965","5.9.29.183","172.19.0.3","TCP","1504","9002 → 43520 [PSH, ACK] Seq=354907 Ack=22061 Win=65535 Len=1448 [TCP segment of a reassembled PDU]"
"16.187081","172.19.0.3","5.9.29.183","TCP","56","43520 → 9002 [ACK] Seq=22061 Ack=356355 Win=12696 Len=0"
"16.202617","5.9.29.183","172.19.0.3","TLSv1.2","134","Application Data"
"16.202815","172.19.0.3","5.9.29.183","TCP","56","43520 → 9002 [ACK] Seq=22061 Ack=356433 Win=12738 Len=0"
