_ws.col.Time,_ws.col.Source,_ws.col.Destination,_ws.col.Protocol,_ws.col.Length,_ws.col.Info
"0.000000","172.19.0.3","5.9.29.183","TLSv1.2","599","Application Data"
"0.000294","5.9.29.183","172.19.0.3","TCP","56","9002 → 43520 [ACK] Seq=1 Ack=544 Win=65535 Len=0"
"0.308609","5.9.29.183","172.19.0.3","TLSv1.2","599","Application Data"
"0.309472","172.19.0.3","5.9.29.183","TLSv1.2","2141","Application Data"
"0.309796","5.9.29.183","172.19.0.3","TCP","56","9002 → 43520 [ACK] Seq=544 Ack=2629 Win=65535 Len=0"
"0.891577","5.9.29.183","172.19.0.3","TLSv1.2","599","Application Data"
"0.893693","172.19.0.3","5.9.29.183","TLSv1.2","599","Application Data"
"0.894279","5.9.29.183","172.19.0.3","TCP","56","9002 → 43520 [ACK] Seq=1087 Ack=3172 Win=65535 Len=0"
"0.904029","172.19.0.3","5.9.29.183","TLSv1.2","599","Application Data"
"0.904424","5.9.29.183","172.19.0.3","TCP","56","9002 → 43520 [ACK] Seq=1087 Ack=3715 Win=65535 Len=0"
"0.919874","5.9.29.183","172.19.0.3","TLSv1.2","599","Application Data"
"0.961082","172.19.0.3","5.9.29.183","TCP","56","43520 → 9002 [ACK] Seq=3715 Ack=1630 Win=11911 Len=0"
"1.150913","5.9.29.183","172.19.0.3","TLSv1.2","599","Application Data"
"1.150988","172.19.0.3","5.9.29.183","TCP","56","43520 → 9002 [ACK] Seq=3715 Ack=2173 Win=11911 Len=0"
"1.151483","172.19.0.3","5.9.29.183","TLSv1.2","599","Application Data"
"1.151697","5.9.29.183","172.19.0.3","TCP","56","9002 → 43520 [ACK] Seq=2173 Ack=4258 Win=65535 Len=0"
"1.378206","5.9.29.183","172.19.0.3","TLSv1.2","599","Application Data"
"1.405770","5.9.29.183","172.19.0.3","TCP","410","[TCP segment of a reassembled PDU]"
"1.405795","172.19.0.3","5.9.29.183","TCP","56","43520 → 9002 [ACK] Seq=4258 Ack=3070 Win=11911 Len=0"
"1.405971","5.9.29.183","172.19.0.3","TCP","1516","9002 → 43520 [PSH, ACK] Seq=3070 Ack=4258 Win=65535 Len=1460 [TCP segment of a reassembled PDU]"
"1.405983","5.9.29.183","172.19.0.3","TCP","1516","9002 → 43520 [PSH, ACK] Seq=4530 Ack=4258 Win=65535 Len=1460 [TCP segment of a reassembled PDU]"
"1.405987","5.9.29.183","172.19.0.3","TLSv1.2","409","Application Data"
"1.406043","172.19.0.3","5.9.29.183","TCP","56","43520 → 9002 [ACK] Seq=4258 Ack=6343 Win=11886 Len=0"
"1.418380","5.9.29.183","172.19.0.3","TCP","1504","[TCP segment of a reassembled PDU]"
"1.418654","5.9.29.183","172.19.0.3","TCP","1504","9002 → 43520 [PSH, ACK] Seq=7791 Ack=4258 Win=65535 Len=1448 [TCP segment of a reassembled PDU]"
"1.418666","172.19.0.3","5.9.29.183","TCP","56","43520 → 9002 [ACK] Seq=4258 Ack=9239 Win=11911 Len=0"
"1.421617","5.9.29.183","172.19.0.3","TLSv1.2","1330","Application Data, Application Data"
"1.429690","5.9.29.183","172.19.0.3","TCP","1504","[TCP segment of a reassembled PDU]"
"1.429713","172.19.0.3","5.9.29.183","TCP","56","43520 → 9002 [ACK] Seq=4258 Ack=11961 Win=11911 Len=0"
"1.430432","5.9.29.183","172.19.0.3","TCP","1504","9002 → 43520 [PSH, ACK] Seq=11961 Ack=4258 Win=65535 Len=1448 [TCP segment of a reassembled PDU]"
"1.430685","5.9.29.183","172.19.0.3","TLSv1.2","1504","Application Data [TCP segment of a reassembled PDU]"
"1.430718","172.19.0.3","5.9.29.183","TCP","56","43520 → 9002 [ACK] Seq=4258 Ack=14857 Win=11911 Len=0"
"1.430756","5.9.29.183","172.19.0.3","TCP","1504","9002 → 43520 [PSH, ACK] Seq=14857 Ack=4258 Win=65535 Len=1448 [TCP segment of a reassembled PDU]"
"1.430763","5.9.29.183","172.19.0.3","TCP","1504","9002 → 43520 [PSH, ACK] Seq=16305 Ack=4258 Win=65535 Len=1448 [TCP segment of a reassembled PDU]"
"1.430823","5.9.29.183","172.19.0.3","TLSv1.2","1504","Application Data [TCP segment of a reassembled PDU]"
"1.430828","5.9.29.183","172.19.0.3","TCP","1504","9002 → 43520 [PSH, ACK] Seq=19201 Ack=4258 Win=65535 Len=1448 [TCP segment of a reassembled PDU]"
"1.430861","172.19.0.3","5.9.29.183","TCP","56","43520 → 9002 [ACK] Seq=4258 Ack=20649 Win=11879 Len=0"
"1.433964","5.9.29.183","172.19.0.3","TLSv1.2","1504","Application Data [TCP segment of a reassembled PDU]"
"1.436680","5.9.29.183","172.19.0.3","TLSv1.2","410","Application Data"
"1.436698","172.19.0.3","5.9.29.183","TCP","56","43520 → 9002 [ACK] Seq=4258 Ack=22451 Win=11911 Len=0"
"1.441858","5.9.29.183","172.19.0.3","TCP","1504","[TCP segment of a reassembled PDU]"
"1.446560","5.9.29.183","172.19.0.3","TCP","1504","9002 → 43520 [PSH, ACK] Seq=23899 Ack=4258 Win=65535 Len=1448 [TCP segment of a reassembled PDU]"
"1.446578","172.19.0.3","5.9.29.183","TCP","56","43520 → 9002 [ACK] Seq=4258 Ack=25347 Win=11911 Len=0"
"1.452438","5.9.29.183","172.19.0.3","TLSv1.2","1330","Application Data, Application Data"
"1.456275","5.9.29.183","172.19.0.3","TCP","1504","[TCP segment of a reassembled PDU]"
"1.456293","172.19.0.3","5.9.29.183","TCP","56","43520 → 9002 [ACK] Seq=4258 Ack=28069 Win=11911 Len=0"
"1.456330","5.9.29.183","172.19.0.3","TCP","1504","9002 → 43520 [PSH, ACK] Seq=28069 Ack=4258 Win=65535 Len=1448 [TCP segment of a reassembled PDU]"
"1.467547","5.9.29.183","172.19.0.3","TLSv1.2","787","Application Data"
"1.467566","172.19.0.3","5.9.29.183","TCP","56","43520 → 9002 [ACK] Seq=4258 Ack=30248 Win=11911 Len=0"
"1.467957","172.19.0.3","5.9.29.183","TLSv1.2","1113","Application Data"
"1.468140","5.9.29.183","172.19.0.3","TCP","56","9002 → 43520 [ACK] Seq=30248 Ack=5315 Win=65535 Len=0"
"1.471995","5.9.29.183","172.19.0.3","TCP","1516","[TCP segment of a reassembled PDU]"
"1.472043","5.9.29.183","172.19.0.3","TCP","1492","9002 → 43520 [PSH, ACK] Seq=31708 Ack=5315 Win=65535 Len=1436 [TCP segment of a reassembled PDU]"
"1.472163","172.19.0.3","5.9.29.183","TCP","56","43520 → 9002 [ACK] Seq=5315 Ack=33144 Win=11903 Len=0"
"1.482795","5.9.29.183","172.19.0.3","TLSv1.2","787","Application Data"
"1.502031","5.9.29.183","172.19.0.3","TCP","1516","[TCP segment of a reassembled PDU]"
"1.502049","172.19.0.3","5.9.29.183","TCP","56","43520 → 9002 [ACK] Seq=5315 Ack=35335 Win=11911 Len=0"
"1.502083","5.9.29.183","172.19.0.3","TCP","1492","9002 → 43520 [PSH, ACK] Seq=35335 Ack=5315 Win=65535 Len=1436 [TCP segment of a reassembled PDU]"
"1.502110","5.9.29.183","172.19.0.3","TLSv1.2","1237","Application Data"
"1.502220","172.19.0.3","5.9.29.183","TCP","56","43520 → 9002 [ACK] Seq=5315 Ack=37952 Win=11895 Len=0"
"1.502744","172.19.0.3","5.9.29.183","TLSv1.2","599","Application Data"
"1.502919","5.9.29.183","172.19.0.3","TCP","56","9002 → 43520 [ACK] Seq=37952 Ack=5858 Win=65535 Len=0"
"1.512452","172.19.0.3","5.9.29.183","TLSv1.2","599","Application Data"
"1.512863","5.9.29.183","172.19.0.3","TCP","56","9002 → 43520 [ACK] Seq=37952 Ack=6401 Win=65535 Len=0"
"1.517224","5.9.29.183","172.19.0.3","TLSv1.2","149","Application Data"
"1.557936","172.19.0.3","5.9.29.183","TCP","56","43520 → 9002 [ACK] Seq=6401 Ack=38045 Win=11911 Len=0"
"1.898800","5.9.29.183","172.19.0.3","TLSv1.2","599","Application Data"
"1.898881","172.19.0.3","5.9.29.183","TCP","56","43520 → 9002 [ACK] Seq=6401 Ack=38588 Win=11911 Len=0"
"1.899640","172.19.0.3","5.9.29.183","TLSv1.2","599","Application Data"
"1.900018","5.9.29.183","172.19.0.3","TCP","56","9002 → 43520 [ACK] Seq=38588 Ack=6944 Win=65535 Len=0"
"2.175153","5.9.29.183","172.19.0.3","TCP","1516","[TCP segment of a reassembled PDU]"
"2.175232","5.9.29.183","172.19.0.3","TCP","1492","9002 → 43520 [PSH, ACK] Seq=40048 Ack=6944 Win=65535 Len=1436 [TCP segment of a reassembled PDU]"
"2.175240","5.9.29.183","172.19.0.3","TLSv1.2","787","Application Data"
"2.175363","172.19.0.3","5.9.29.183","TCP","56","43520 → 9002 [ACK] Seq=6944 Ack=42215 Win=11895 Len=0"
"2.197878","5.9.29.183","172.19.0.3","TCP","1504","[TCP segment of a reassembled PDU]"
"2.198633","5.9.29.183","172.19.0.3","TCP","1504","9002 → 43520 [PSH, ACK] Seq=43663 Ack=6944 Win=65535 Len=1448 [TCP segment of a reassembled PDU]"
"2.198652","172.19.0.3","5.9.29.183","TCP","56","43520 → 9002 [ACK] Seq=6944 Ack=45111 Win=11911 Len=0"
"2.198697","5.9.29.183","172.19.0.3","TLSv1.2","787","Application Data"
"2.208826","5.9.29.183","172.19.0.3","TCP","1516","[TCP segment of a reassembled PDU]"
"2.208848","172.19.0.3","5.9.29.183","TCP","56","43520 → 9002 [ACK] Seq=6944 Ack=47302 Win=11911 Len=0"
"2.208899","5.9.29.183","172.19.0.3","TCP","1516","9002 → 43520 [PSH, ACK] Seq=47302 Ack=6944 Win=65535 Len=1460 [TCP segment of a reassembled PDU]"
"2.208910","5.9.29.183","172.19.0.3","TLSv1.2","1480","Application Data [TCP segment of a reassembled PDU]"
"2.209046","172.19.0.3","5.9.29.183","TCP","56","43520 → 9002 [ACK] Seq=6944 Ack=50186 Win=11895 Len=0"
"2.214156","5.9.29.183","172.19.0.3","TLSv1.2","396","Application Data"
"2.221655","5.9.29.183","172.19.0.3","TCP","1504","[TCP segment of a reassembled PDU]"
"2.221677","172.19.0.3","5.9.29.183","TCP","56","43520 → 9002 [ACK] Seq=6944 Ack=51974 Win=11911 Len=0"
"2.222603","5.9.29.183","172.19.0.3","TCP","1504","9002 → 43520 [PSH, ACK] Seq=51974 Ack=6944 Win=65535 Len=1448 [TCP segment of a reassembled PDU]"
"2.222779","5.9.29.183","172.19.0.3","TLSv1.2","1516","Application Data [TCP segment of a reassembled PDU]"
"2.222792","172.19.0.3","5.9.29.183","TCP","56","43520 → 9002 [ACK] Seq=6944 Ack=54882 Win=11911 Len=0"
"2.222795","5.9.29.183","172.19.0.3","TCP","1492","9002 → 43520 [PSH, ACK] Seq=54882 Ack=6944 Win=65535 Len=1436 [TCP segment of a reassembled PDU]"
"2.222803","5.9.29.183","172.19.0.3","TCP","1504","9002 → 43520 [PSH, ACK] Seq=56318 Ack=6944 Win=65535 Len=1448 [TCP segment of a reassembled PDU]"
"2.222979","172.19.0.3","5.9.29.183","TCP","56","43520 → 9002 [ACK] Seq=6944 Ack=57766 Win=11893 Len=0"
"2.224662","5.9.29.183","172.19.0.3","TLSv1.2","1516","Application Data [TCP segment of a reassembled PDU]"
"2.224706","5.9.29.183","172.19.0.3","TCP","1516","9002 → 43520 [PSH, ACK] Seq=59226 Ack=6944 Win=65535 Len=1460 [TCP segment of a reassembled PDU]"
"2.224743","172.19.0.3","5.9.29.183","TCP","56","43520 → 9002 [ACK] Seq=6944 Ack=60686 Win=11903 Len=0"
"2.224747","5.9.29.183","172.19.0.3","TCP","1480","9002 → 43520 [PSH, ACK] Seq=60686 Ack=6944 Win=65535 Len=1424 [TCP segment of a reassembled PDU]"
"2.224827","5.9.29.183","172.19.0.3","TLSv1.2","1516","Application Data [TCP segment of a reassembled PDU]"
"2.224835","5.9.29.183","172.19.0.3","TCP","1516","9002 → 43520 [PSH, ACK] Seq=63570 Ack=6944 Win=65535 Len=1460 [TCP segment of a reassembled PDU]"
"2.224838","5.9.29.183","172.19.0.3","TCP","1480","9002 → 43520 [PSH, ACK] Seq=65030 Ack=6944 Win=65535 Len=1424 [TCP segment of a reassembled PDU]"
"2.224946","172.19.0.3","5.9.29.183","TCP","56","43520 → 9002 [ACK] Seq=6944 Ack=66454 Win=11871 Len=0"
"2.229315","5.9.29.183","172.19.0.3","TLSv1.2","1504","Application Data, Application Data"
"2.229641","172.19.0.3","5.9.29.183","TLSv1.2","599","Application Data"
"2.229934","5.9.29.183","172.19.0.3","TCP","56","9002 → 43520 [ACK] Seq=67902 Ack=7487 Win=65535 Len=0"
"2.239966","5.9.29.183","172.19.0.3","TCP","760","9002 → 43520 [PSH, ACK] Seq=67902 Ack=7487 Win=65535 Len=704 [TCP segment of a reassembled PDU]"
"2.240024","5.9.29.183","172.19.0.3","TCP","1516","9002 → 43520 [PSH, ACK] Seq=68606 Ack=7487 Win=65535 Len=1460 [TCP segment of a reassembled PDU]"
"2.240032","5.9.29.183","172.19.0.3","TLSv1.2","1516","Application Data [TCP segment of a reassembled PDU]"
"2.240050","5.9.29.183","172.19.0.3","TCP","776","9002 → 43520 [PSH, ACK] Seq=71526 Ack=7487 Win=65535 Len=720 [TCP segment of a reassembled PDU]"
"2.240053","5.9.29.183","172.19.0.3","TCP","1516","9002 → 43520 [PSH, ACK] Seq=72246 Ack=7487 Win=65535 Len=1460 [TCP segment of a reassembled PDU]"
"2.240084","172.19.0.3","5.9.29.183","TCP","56","43520 → 9002 [ACK] Seq=7487 Ack=73706 Win=11879 Len=0"
"2.240145","5.9.29.183","172.19.0.3","TLSv1.2","1516","Application Data [TCP segment of a reassembled PDU]"
"2.240149","5.9.29.183","172.19.0.3","TLSv1.2","320","Application Data"
"2.240279","172.19.0.3","5.9.29.183","TCP","56","43520 → 9002 [ACK] Seq=7487 Ack=75430 Win=11866 Len=0"
"2.246389","5.9.29.183","172.19.0.3","TCP","1504","[TCP segment of a reassembled PDU]"
"2.246455","5.9.29.183","172.19.0.3","TCP","1516","9002 → 43520 [PSH, ACK] Seq=76878 Ack=7487 Win=65535 Len=1460 [TCP segment of a reassembled PDU]"
"2.246468","172.19.0.3","5.9.29.183","TCP","56","43520 → 9002 [ACK] Seq=7487 Ack=78338 Win=11903 Len=0"
"2.246470","5.9.29.183","172.19.0.3","TLSv1.2","1492","Application Data [TCP segment of a reassembled PDU]"
"2.246473","5.9.29.183","172.19.0.3","TCP","1516","9002 → 43520 [PSH, ACK] Seq=79774 Ack=7487 Win=65535 Len=1460 [TCP segment of a reassembled PDU]"
"2.246528","5.9.29.183","172.19.0.3","TCP","1492","9002 → 43520 [PSH, ACK] Seq=81234 Ack=7487 Win=65535 Len=1436 [TCP segment of a reassembled PDU]"
"2.246532","5.9.29.183","172.19.0.3","TLSv1.2","1516","Application Data [TCP segment of a reassembled PDU]"
"2.246534","5.9.29.183","172.19.0.3","TCP","1492","9002 → 43520 [PSH, ACK] Seq=84130 Ack=7487 Win=65535 Len=1436 [TCP segment of a reassembled PDU]"
"2.246567","172.19.0.3","5.9.29.183","TCP","56","43520 → 9002 [ACK] Seq=7487 Ack=85566 Win=11861 Len=0"
"2.246928","172.19.0.3","5.9.29.183","TLSv1.2","599","Application Data"
"2.247070","5.9.29.183","172.19.0.3","TCP","56","9002 → 43520 [ACK] Seq=85566 Ack=8030 Win=65535 Len=0"
"2.256426","5.9.29.183","172.19.0.3","TCP","1516","9002 → 43520 [PSH, ACK] Seq=85566 Ack=8030 Win=65535 Len=1460 [TCP segment of a reassembled PDU]"
"2.256476","5.9.29.183","172.19.0.3","TLSv1.2","369","Application Data"
"2.256489","172.19.0.3","5.9.29.183","TCP","56","43520 → 9002 [ACK] Seq=8030 Ack=87339 Win=11903 Len=0"
"2.256491","5.9.29.183","172.19.0.3","TCP","1516","[TCP segment of a reassembled PDU]"
"2.256494","5.9.29.183","172.19.0.3","TCP","1516","9002 → 43520 [PSH, ACK] Seq=88799 Ack=8030 Win=65535 Len=1460 [TCP segment of a reassembled PDU]"
"2.256496","5.9.29.183","172.19.0.3","TLSv1.2","1516","Application Data [TCP segment of a reassembled PDU]"
"2.256498","5.9.29.183","172.19.0.3","TCP","1468","9002 → 43520 [PSH, ACK] Seq=91719 Ack=8030 Win=65535 Len=1412 [TCP segment of a reassembled PDU]"
"2.256584","172.19.0.3","5.9.29.183","TCP","56","43520 → 9002 [ACK] Seq=8030 Ack=93131 Win=11871 Len=0"
"2.256994","172.19.0.3","5.9.29.183","TLSv1.2","599","Application Data"
"2.257155","5.9.29.183","172.19.0.3","TCP","56","9002 → 43520 [ACK] Seq=93131 Ack=8573 Win=65535 Len=0"
"2.263217","5.9.29.183","172.19.0.3","TCP","1516","9002 → 43520 [PSH, ACK] Seq=93131 Ack=8573 Win=65535 Len=1460 [TCP segment of a reassembled PDU]"
"2.263263","5.9.29.183","172.19.0.3","TLSv1.2","1516","Application Data [TCP segment of a reassembled PDU]"
"2.263275","172.19.0.3","5.9.29.183","TCP","56","43520 → 9002 [ACK] Seq=8573 Ack=96051 Win=11903 Len=0"
"2.263277","5.9.29.183","172.19.0.3","TCP","1516","9002 → 43520 [PSH, ACK] Seq=96051 Ack=8573 Win=65535 Len=1460 [TCP segment of a reassembled PDU]"
"2.263288","5.9.29.183","172.19.0.3","TCP","1516","9002 → 43520 [PSH, ACK] Seq=97511 Ack=8573 Win=65535 Len=1460 [TCP segment of a reassembled PDU]"
"2.263291","5.9.29.183","172.19.0.3","TLSv1.2","1456","Application Data [TCP segment of a reassembled PDU]"
"2.263396","172.19.0.3","5.9.29.183","TCP","56","43520 → 9002 [ACK] Seq=8573 Ack=100371 Win=11879 Len=0"
"2.263503","5.9.29.183","172.19.0.3","TCP","1516","9002 → 43520 [PSH, ACK] Seq=100371 Ack=8573 Win=65535 Len=1460 [TCP segment of a reassembled PDU]"
"2.263509","5.9.29.183","172.19.0.3","TCP","1492","9002 → 43520 [PSH, ACK] Seq=101831 Ack=8573 Win=65535 Len=1436 [TCP segment of a reassembled PDU]"
"2.263588","172.19.0.3","5.9.29.183","TCP","56","43520 → 9002 [ACK] Seq=8573 Ack=103267 Win=11863 Len=0"
"2.268156","5.9.29.183","172.19.0.3","TLSv1.2","1504","Application Data [TCP segment of a reassembled PDU]"
"2.271894","5.9.29.183","172.19.0.3","TCP","1516","9002 → 43520 [PSH, ACK] Seq=104715 Ack=8573 Win=65535 Len=1460 [TCP segment of a reassembled PDU]"
"2.271912","172.19.0.3","5.9.29.183","TCP","56","43520 → 9002 [ACK] Seq=8573 Ack=106175 Win=11911 Len=0"
"2.271957","5.9.29.183","172.19.0.3","TLSv1.2","1492","Application Data [TCP segment of a reassembled PDU]"
"2.272187","5.9.29.183","172.19.0.3","TLSv1.2","518","Application Data"
"2.272219","172.19.0.3","5.9.29.183","TCP","56","43520 → 9002 [ACK] Seq=8573 Ack=108073 Win=11897 Len=0"
"2.276219","172.19.0.3","5.9.29.183","TLSv1.2","599","Application Data"
"2.276472","5.9.29.183","172.19.0.3","TCP","56","9002 → 43520 [ACK] Seq=108073 Ack=9116 Win=65535 Len=0"
"2.579033","5.9.29.183","172.19.0.3","TLSv1.2","599","Application Data"
"2.579780","172.19.0.3","5.9.29.183","TLSv1.2","599","Application Data"
"2.580190","5.9.29.183","172.19.0.3","TCP","56","9002 → 43520 [ACK] Seq=108616 Ack=9659 Win=65535 Len=0"
"2.891944","5.9.29.183","172.19.0.3","TLSv1.2","599","Application Data"
"2.905936","5.9.29.183","172.19.0.3","TCP","1516","[TCP segment of a reassembled PDU]"
"2.905960","172.19.0.3","5.9.29.183","TCP","56","43520 → 9002 [ACK] Seq=9659 Ack=110619 Win=11911 Len=0"
"2.906024","5.9.29.183","172.19.0.3","TCP","1492","9002 → 43520 [PSH, ACK] Seq=110619 Ack=9659 Win=65535 Len=1436 [TCP segment of a reassembled PDU]"
"2.906814","5.9.29.183","172.19.0.3","TLSv1.2","787","Application Data"
"2.906829","172.19.0.3","5.9.29.183","TCP","56","43520 → 9002 [ACK] Seq=9659 Ack=112786 Win=11911 Len=0"
"2.919532","5.9.29.183","172.19.0.3","TCP","1516","[TCP segment of a reassembled PDU]"
"2.919594","5.9.29.183","172.19.0.3","TCP","1492","9002 → 43520 [PSH, ACK] Seq=114246 Ack=9659 Win=65535 Len=1436 [TCP segment of a reassembled PDU]"
"2.919822","172.19.0.3","5.9.29.183","TCP","56","43520 → 9002 [ACK] Seq=9659 Ack=115682 Win=11903 Len=0"
"2.923082","5.9.29.183","172.19.0.3","TLSv1.2","1330","Application Data, Application Data"
"2.931126","5.9.29.183","172.19.0.3","TCP","1504","[TCP segment of a reassembled PDU]"
"2.931150","172.19.0.3","5.9.29.183","TCP","56","43520 → 9002 [ACK] Seq=9659 Ack=118404 Win=11911 Len=0"
"2.931784","5.9.29.183","172.19.0.3","TCP","1504","9002 → 43520 [PSH, ACK] Seq=118404 Ack=9659 Win=65535 Len=1448 [TCP segment of a reassembled PDU]"
"2.938660","5.9.29.183","172.19.0.3","TLSv1.2","1330","Application Data, Application Data"
"2.938687","172.19.0.3","5.9.29.183","TCP","56","43520 → 9002 [ACK] Seq=9659 Ack=121126 Win=11911 Len=0"
"2.940962","5.9.29.183","172.19.0.3","TCP","1504","[TCP segment of a reassembled PDU]"
"2.942083","5.9.29.183","172.19.0.3","TCP","1504","9002 → 43520 [PSH, ACK] Seq=122574 Ack=9659 Win=65535 Len=1448 [TCP segment of a reassembled PDU]"
"2.942176","172.19.0.3","5.9.29.183","TCP","56","43520 → 9002 [ACK] Seq=9659 Ack=124022 Win=11911 Len=0"
"2.942368","5.9.29.183","172.19.0.3","TLSv1.2","1516","Application Data [TCP segment of a reassembled PDU]"
"2.942410","5.9.29.183","172.19.0.3","TCP","1516","9002 → 43520 [PSH, ACK] Seq=125482 Ack=9659 Win=65535 Len=1460 [TCP segment of a reassembled PDU]"
"2.942417","5.9.29.183","172.19.0.3","TCP","1516","9002 → 43520 [PSH, ACK] Seq=126942 Ack=9659 Win=65535 Len=1460 [TCP segment of a reassembled PDU]"
"2.942419","5.9.29.183","172.19.0.3","TLSv1.2","1516","Application Data [TCP segment of a reassembled PDU]"
"2.942425","5.9.29.183","172.19.0.3","TCP","1456","9002 → 43520 [PSH, ACK] Seq=129862 Ack=9659 Win=65535 Len=1400 [TCP segment of a reassembled PDU]"
"2.942483","172.19.0.3","5.9.29.183","TCP","56","43520 → 9002 [ACK] Seq=9659 Ack=131262 Win=11879 Len=0"
"2.947159","5.9.29.183","172.19.0.3","TCP","1504","9002 → 43520 [PSH, ACK] Seq=131262 Ack=9659 Win=65535 Len=1448 [TCP segment of a reassembled PDU]"
"2.947220","5.9.29.183","172.19.0.3","TLSv1.2","1488","Application Data [TCP segment of a reassembled PDU]"
"2.947235","172.19.0.3","5.9.29.183","TCP","56","43520 → 9002 [ACK] Seq=9659 Ack=134142 Win=11901 Len=0"
"2.947237","5.9.29.183","172.19.0.3","TCP","72","9002 → 43520 [PSH, ACK] Seq=134142 Ack=9659 Win=65535 Len=16 [TCP segment of a reassembled PDU]"
"2.947409","5.9.29.183","172.19.0.3","TCP","1516","9002 → 43520 [PSH, ACK] Seq=134158 Ack=9659 Win=65535 Len=1460 [TCP segment of a reassembled PDU]"
"2.947416","5.9.29.183","172.19.0.3","TCP","1492","9002 → 43520 [PSH, ACK] Seq=135618 Ack=9659 Win=65535 Len=1436 [TCP segment of a reassembled PDU]"
"2.947490","172.19.0.3","5.9.29.183","TCP","56","43520 → 9002 [ACK] Seq=9659 Ack=137054 Win=11883 Len=0"
"2.953666","5.9.29.183","172.19.0.3","TLSv1.2","1504","Application Data, Application Data"
"2.954070","172.19.0.3","5.9.29.183","TLSv1.2","1113","Application Data"
"2.954308","5.9.29.183","172.19.0.3","TCP","56","9002 → 43520 [ACK] Seq=138502 Ack=10716 Win=65535 Len=0"
"2.963466","5.9.29.183","172.19.0.3","TCP","1516","9002 → 43520 [PSH, ACK] Seq=138502 Ack=10716 Win=65535 Len=1460 [TCP segment of a reassembled PDU]"
"2.963521","5.9.29.183","172.19.0.3","TLSv1.2","1492","Application Data [TCP segment of a reassembled PDU]"
"2.963528","5.9.29.183","172.19.0.3","TCP","1516","9002 → 43520 [PSH, ACK] Seq=141398 Ack=10716 Win=65535 Len=1460 [TCP segment of a reassembled PDU]"
"2.963531","5.9.29.183","172.19.0.3","TCP","1492","9002 → 43520 [PSH, ACK] Seq=142858 Ack=10716 Win=65535 Len=1436 [TCP segment of a reassembled PDU]"
"2.963570","5.9.29.183","172.19.0.3","TLSv1.2","1516","Application Data [TCP segment of a reassembled PDU]"
"2.963575","5.9.29.183","172.19.0.3","TCP","1492","9002 → 43520 [PSH, ACK] Seq=145754 Ack=10716 Win=65535 Len=1436 [TCP segment of a reassembled PDU]"
"2.963619","5.9.29.183","172.19.0.3","TCP","1504","9002 → 43520 [PSH, ACK] Seq=147190 Ack=10716 Win=65535 Len=1448 [TCP segment of a reassembled PDU]"
"2.963653","172.19.0.3","5.9.29.183","TCP","56","43520 → 9002 [ACK] Seq=10716 Ack=147190 Win=11871 Len=0"
"2.963676","5.9.29.183","172.19.0.3","TLSv1.2","1504","Application Data [TCP segment of a reassembled PDU]"
"2.963678","5.9.29.183","172.19.0.3","TLSv1.2","141","Application Data"
"2.963931","172.19.0.3","5.9.29.183","TCP","56","43520 → 9002 [ACK] Seq=10716 Ack=150171 Win=11848 Len=0"
"2.968131","5.9.29.183","172.19.0.3","TCP","1504","[TCP segment of a reassembled PDU]"
"2.969699","5.9.29.183","172.19.0.3","TCP","1504","9002 → 43520 [PSH, ACK] Seq=151619 Ack=10716 Win=65535 Len=1448 [TCP segment of a reassembled PDU]"
"2.969713","172.19.0.3","5.9.29.183","TCP","56","43520 → 9002 [ACK] Seq=10716 Ack=153067 Win=11911 Len=0"
"2.970261","5.9.29.183","172.19.0.3","TLSv1.2","1516","Application Data [TCP segment of a reassembled PDU]"
"2.970301","5.9.29.183","172.19.0.3","TCP","1492","9002 → 43520 [PSH, ACK] Seq=154527 Ack=10716 Win=65535 Len=1436 [TCP segment of a reassembled PDU]"
"2.970373","172.19.0.3","5.9.29.183","TCP","56","43520 → 9002 [ACK] Seq=10716 Ack=155963 Win=11903 Len=0"
"2.970388","5.9.29.183","172.19.0.3","TCP","1504","9002 → 43520 [PSH, ACK] Seq=155963 Ack=10716 Win=65535 Len=1448 [TCP segment of a reassembled PDU]"
"2.979872","5.9.29.183","172.19.0.3","TLSv1.2","1516","Application Data [TCP segment of a reassembled PDU]"
"2.979892","172.19.0.3","5.9.29.183","TCP","56","43520 → 9002 [ACK] Seq=10716 Ack=158871 Win=11911 Len=0"
"2.979945","5.9.29.183","172.19.0.3","TLSv1.2","181","Application Data"
"2.980537","5.9.29.183","172.19.0.3","TCP","1504","[TCP segment of a reassembled PDU]"
"2.980547","172.19.0.3","5.9.29.183","TCP","56","43520 → 9002 [ACK] Seq=10716 Ack=160444 Win=11911 Len=0"
"2.981546","5.9.29.183","172.19.0.3","TCP","1516","9002 → 43520 [PSH, ACK] Seq=160444 Ack=10716 Win=65535 Len=1460 [TCP segment of a reassembled PDU]"
"2.981578","5.9.29.183","172.19.0.3","TLSv1.2","1492","Application Data [TCP segment of a reassembled PDU]"
"2.981584","5.9.29.183","172.19.0.3","TCP","1516","9002 → 43520 [PSH, ACK] Seq=163340 Ack=10716 Win=65535 Len=1460 [TCP segment of a reassembled PDU]"
"2.981596","5.9.29.183","172.19.0.3","TCP","1516","9002 → 43520 [PSH, ACK] Seq=164800 Ack=10716 Win=65535 Len=1460 [TCP segment of a reassembled PDU]"
"2.981648","172.19.0.3","5.9.29.183","TCP","56","43520 → 9002 [ACK] Seq=10716 Ack=166260 Win=11887 Len=0"
"2.981682","5.9.29.183","172.19.0.3","TLSv1.2","1516","Application Data [TCP segment of a reassembled PDU]"
"2.981686","5.9.29.183","172.19.0.3","TCP","1468","9002 → 43520 [PSH, ACK] Seq=167720 Ack=10716 Win=65535 Len=1412 [TCP segment of a reassembled PDU]"
"2.981857","172.19.0.3","5.9.29.183","TLSv1.2","599","Application Data"
"2.982015","5.9.29.183","172.19.0.3","TCP","56","9002 → 43520 [ACK] Seq=169132 Ack=11259 Win=65535 Len=0"
"2.985307","5.9.29.183","172.19.0.3","TCP","1504","9002 → 43520 [PSH, ACK] Seq=169132 Ack=11259 Win=65535 Len=1448 [TCP segment of a reassembled PDU]"
"2.995162","5.9.29.183","172.19.0.3","TLSv1.2","1504","Application Data [TCP segment of a reassembled PDU]"
"2.995185","172.19.0.3","5.9.29.183","TCP","56","43520 → 9002 [ACK] Seq=11259 Ack=172028 Win=11911 Len=0"
"2.995898","5.9.29.183","172.19.0.3","TCP","1504","9002 → 43520 [PSH, ACK] Seq=172028 Ack=11259 Win=65535 Len=1448 [TCP segment of a reassembled PDU]"
"2.995974","5.9.29.183","172.19.0.3","TCP","1516","9002 → 43520 [PSH, ACK] Seq=173476 Ack=11259 Win=65535 Len=1460 [TCP segment of a reassembled PDU]"
"2.996014","5.9.29.183","172.19.0.3","TLSv1.2","1516","Application Data, Application Data"
"2.996018","5.9.29.183","172.19.0.3","TCP","1516","9002 → 43520 [PSH, ACK] Seq=176396 Ack=11259 Win=65535 Len=1460 [TCP segment of a reassembled PDU]"
"2.996022","5.9.29.183","172.19.0.3","TCP","1468","9002 → 43520 [PSH, ACK] Seq=177856 Ack=11259 Win=65535 Len=1412 [TCP segment of a reassembled PDU]"
"2.996052","172.19.0.3","5.9.29.183","TCP","56","43520 → 9002 [ACK] Seq=11259 Ack=179268 Win=11879 Len=0"
"2.997462","5.9.29.183","172.19.0.3","TLSv1.2","1504","Application Data [TCP segment of a reassembled PDU]"
"2.998056","5.9.29.183","172.19.0.3","TCP","1504","9002 → 43520 [PSH, ACK] Seq=180716 Ack=11259 Win=65535 Len=1448 [TCP segment of a reassembled PDU]"
"2.998066","172.19.0.3","5.9.29.183","TCP","56","43520 → 9002 [ACK] Seq=11259 Ack=182164 Win=11911 Len=0"
"2.998381","5.9.29.183","172.19.0.3","TLSv1.2","1516","Application Data [TCP segment of a reassembled PDU]"
"2.998430","5.9.29.183","172.19.0.3","TCP","1516","9002 → 43520 [PSH, ACK] Seq=183624 Ack=11259 Win=65535 Len=1460 [TCP segment of a reassembled PDU]"
"2.998438","5.9.29.183","172.19.0.3","TCP","1516","9002 → 43520 [PSH, ACK] Seq=185084 Ack=11259 Win=65535 Len=1460 [TCP segment of a reassembled PDU]"
"2.998456","5.9.29.183","172.19.0.3","TLSv1.2","1039","Application Data, Application Data"
"2.998517","172.19.0.3","5.9.29.183","TCP","56","43520 → 9002 [ACK] Seq=11259 Ack=187527 Win=11885 Len=0"
"2.998965","172.19.0.3","5.9.29.183","TLSv1.2","1113","Application Data"
"2.999209","5.9.29.183","172.19.0.3","TCP","56","9002 → 43520 [ACK] Seq=187527 Ack=12316 Win=65535 Len=0"
"3.008150","172.19.0.3","5.9.29.183","TLSv1.2","599","Application Data"
"3.008571","5.9.29.183","172.19.0.3","TCP","56","9002 → 43520 [ACK] Seq=187527 Ack=12859 Win=65535 Len=0"
"3.348388","5.9.29.183","172.19.0.3","TLSv1.2","599","Application Data"
"3.349389","172.19.0.3","5.9.29.183","TLSv1.2","599","Application Data"
"3.349776","5.9.29.183","172.19.0.3","TCP","56","9002 → 43520 [ACK] Seq=188070 Ack=13402 Win=65535 Len=0"
"3.609935","5.9.29.183","172.19.0.3","TCP","1504","[TCP segment of a reassembled PDU]"
"3.610458","5.9.29.183","172.19.0.3","TCP","1504","9002 → 43520 [PSH, ACK] Seq=189518 Ack=13402 Win=65535 Len=1448 [TCP segment of a reassembled PDU]"
"3.610473","172.19.0.3","5.9.29.183","TCP","56","43520 → 9002 [ACK] Seq=13402 Ack=190966 Win=11911 Len=0"
"3.610516","5.9.29.183","172.19.0.3","TLSv1.2","787","Application Data"
"3.625424","5.9.29.183","172.19.0.3","TCP","1504","[TCP segment of a reassembled PDU]"
"3.625447","172.19.0.3","5.9.29.183","TCP","56","43520 → 9002 [ACK] Seq=13402 Ack=193145 Win=11911 Len=0"
"3.626216","5.9.29.183","172.19.0.3","TCP","1504","9002 → 43520 [PSH, ACK] Seq=193145 Ack=13402 Win=65535 Len=1448 [TCP segment of a reassembled PDU]"
"3.626257","5.9.29.183","172.19.0.3","TLSv1.2","787","Application Data"
"3.626317","172.19.0.3","5.9.29.183","TCP","56","43520 → 9002 [ACK] Seq=13402 Ack=195324 Win=11911 Len=0"
"3.640865","5.9.29.183","172.19.0.3","TCP","1504","[TCP segment of a reassembled PDU]"
"3.641107","5.9.29.183","172.19.0.3","TCP","1504","9002 → 43520 [PSH, ACK] Seq=196772 Ack=13402 Win=65535 Len=1448 [TCP segment of a reassembled PDU]"
"3.641151","172.19.0.3","5.9.29.183","TCP","56","43520 → 9002 [ACK] Seq=13402 Ack=198220 Win=11911 Len=0"
"3.642265","5.9.29.183","172.19.0.3","TLSv1.2","1330","Application Data, Application Data"
"3.645944","172.19.0.3","5.9.29.183","TLSv1.2","599","Application Data"
"3.646190","5.9.29.183","172.19.0.3","TCP","56","9002 → 43520 [ACK] Seq=199494 Ack=13945 Win=65535 Len=0"
"3.924376","5.9.29.183","172.19.0.3","TCP","240","[TCP segment of a reassembled PDU]"
"3.924481","5.9.29.183","172.19.0.3","TLSv1.2","415","Application Data"
"3.924637","172.19.0.3","5.9.29.183","TCP","56","43520 → 9002 [ACK] Seq=13945 Ack=200037 Win=11911 Len=0"
"3.925279","172.19.0.3","5.9.29.183","TLSv1.2","599","Application Data"
"3.925539","5.9.29.183","172.19.0.3","TCP","56","9002 → 43520 [ACK] Seq=200037 Ack=14488 Win=65535 Len=0"
"4.177822","5.9.29.183","172.19.0.3","TCP","1516","[TCP segment of a reassembled PDU]"
"4.177905","5.9.29.183","172.19.0.3","TCP","1492","9002 → 43520 [PSH, ACK] Seq=201497 Ack=14488 Win=65535 Len=1436 [TCP segment of a reassembled PDU]"
"4.177913","5.9.29.183","172.19.0.3","TLSv1.2","787","Application Data"
"4.178052","172.19.0.3","5.9.29.183","TCP","56","43520 → 9002 [ACK] Seq=14488 Ack=203664 Win=11895 Len=0"
"4.192226","5.9.29.183","172.19.0.3","TCP","1516","[TCP segment of a reassembled PDU]"
"4.192292","5.9.29.183","172.19.0.3","TCP","1492","9002 → 43520 [PSH, ACK] Seq=205124 Ack=14488 Win=65535 Len=1436 [TCP segment of a reassembled PDU]"
"4.192308","172.19.0.3","5.9.29.183","TCP","56","43520 → 9002 [ACK] Seq=14488 Ack=206560 Win=11903 Len=0"
"4.193188","5.9.29.183","172.19.0.3","TLSv1.2","787","Application Data"
"4.215708","5.9.29.183","172.19.0.3","TCP","1504","[TCP segment of a reassembled PDU]"
"4.215728","172.19.0.3","5.9.29.183","TCP","56","43520 → 9002 [ACK] Seq=14488 Ack=208739 Win=11911 Len=0"
"4.217030","5.9.29.183","172.19.0.3","TCP","1504","9002 → 43520 [PSH, ACK] Seq=208739 Ack=14488 Win=65535 Len=1448 [TCP segment of a reassembled PDU]"
"4.217098","5.9.29.183","172.19.0.3","TLSv1.2","1516","Application Data [TCP segment of a reassembled PDU]"
"4.217107","5.9.29.183","172.19.0.3","TCP","1516","9002 → 43520 [PSH, ACK] Seq=211647 Ack=14488 Win=65535 Len=1460 [TCP segment of a reassembled PDU]"
"4.217160","172.19.0.3","5.9.29.183","TCP","56","43520 → 9002 [ACK] Seq=14488 Ack=213107 Win=11895 Len=0"
"4.217181","5.9.29.183","172.19.0.3","TCP","1213","9002 → 43520 [PSH, ACK] Seq=213107 Ack=14488 Win=65535 Len=1157 [TCP segment of a reassembled PDU]"
"4.217184","5.9.29.183","172.19.0.3","TLSv1.2","1516","Application Data [TCP segment of a reassembled PDU]"
"4.217186","5.9.29.183","172.19.0.3","TCP","1492","9002 → 43520 [PSH, ACK] Seq=215724 Ack=14488 Win=65535 Len=1436 [TCP segment of a reassembled PDU]"
"4.217187","5.9.29.183","172.19.0.3","TCP","1504","9002 → 43520 [PSH, ACK] Seq=217160 Ack=14488 Win=65535 Len=1448 [TCP segment of a reassembled PDU]"
"4.217224","5.9.29.183","172.19.0.3","TLSv1.2","1504","Application Data [TCP segment of a reassembled PDU]"
"4.217281","5.9.29.183","172.19.0.3","TCP","1504","9002 → 43520 [PSH, ACK] Seq=220056 Ack=14488 Win=65535 Len=1448 [TCP segment of a reassembled PDU]"
"4.217373","172.19.0.3","5.9.29.183","TCP","56","43520 → 9002 [ACK] Seq=14488 Ack=221504 Win=11847 Len=0"
"4.233716","5.9.29.183","172.19.0.3","TCP","1504","9002 → 43520 [PSH, ACK] Seq=221504 Ack=14488 Win=65535 Len=1448 [TCP segment of a reassembled PDU]"
"4.233781","5.9.29.183","172.19.0.3","TLSv1.2","1516","Application Data, Application Data"
"4.233798","172.19.0.3","5.9.29.183","TCP","56","43520 → 9002 [ACK] Seq=14488 Ack=224412 Win=11903 Len=0"
"4.233801","5.9.29.183","172.19.0.3","TCP","1516","9002 → 43520 [PSH, ACK] Seq=224412 Ack=14488 Win=65535 Len=1460 [TCP segment of a reassembled PDU]"
"4.233805","5.9.29.183","172.19.0.3","TCP","1516","9002 → 43520 [PSH, ACK] Seq=225872 Ack=14488 Win=65535 Len=1460 [TCP segment of a reassembled PDU]"
"4.233901","5.9.29.183","172.19.0.3","TLSv1.2","1516","Application Data [TCP segment of a reassembled PDU]"
"4.233907","5.9.29.183","172.19.0.3","TCP","1456","9002 → 43520 [PSH, ACK] Seq=228792 Ack=14488 Win=65535 Len=1400 [TCP segment of a reassembled PDU]"
"4.233928","172.19.0.3","5.9.29.183","TCP","56","43520 → 9002 [ACK] Seq=14488 Ack=228792 Win=11877 Len=0"
"4.234354","172.19.0.3","5.9.29.183","TLSv1.2","599","Application Data"
"4.234609","5.9.29.183","172.19.0.3","TCP","56","9002 → 43520 [ACK] Seq=230192 Ack=15031 Win=65535 Len=0"
"4.248918","5.9.29.183","172.19.0.3","TLSv1.2","1504","Application Data [TCP segment of a reassembled PDU]"
"4.249980","5.9.29.183","172.19.0.3","TCP","1516","9002 → 43520 [PSH, ACK] Seq=231640 Ack=15031 Win=65535 Len=1460 [TCP segment of a reassembled PDU]"
"4.250028","172.19.0.3","5.9.29.183","TCP","56","43520 → 9002 [ACK] Seq=15031 Ack=233100 Win=11911 Len=0"
"4.250142","5.9.29.183","172.19.0.3","TCP","1492","9002 → 43520 [PSH, ACK] Seq=233100 Ack=15031 Win=65535 Len=1436 [TCP segment of a reassembled PDU]"
"4.250174","5.9.29.183","172.19.0.3","TLSv1.2","1516","Application Data, Application Data"
"4.250220","5.9.29.183","172.19.0.3","TCP","1516","9002 → 43520 [PSH, ACK] Seq=235996 Ack=15031 Win=65535 Len=1460 [TCP segment of a reassembled PDU]"
"4.250224","172.19.0.3","5.9.29.183","TCP","56","43520 → 9002 [ACK] Seq=15031 Ack=235996 Win=11911 Len=0"
"4.250225","5.9.29.183","172.19.0.3","TCP","1516","9002 → 43520 [PSH, ACK] Seq=237456 Ack=15031 Win=65535 Len=1460 [TCP segment of a reassembled PDU]"
"4.250249","5.9.29.183","172.19.0.3","TLSv1.2","1516","Application Data, Application Data"
"4.250251","5.9.29.183","172.19.0.3","TCP","1456","9002 → 43520 [PSH, ACK] Seq=240376 Ack=15031 Win=65535 Len=1400 [TCP segment of a reassembled PDU]"
"4.250268","172.19.0.3","5.9.29.183","TCP","56","43520 → 9002 [ACK] Seq=15031 Ack=241776 Win=11879 Len=0"
"4.250318","5.9.29.183","172.19.0.3","TCP","1516","9002 → 43520 [PSH, ACK] Seq=241776 Ack=15031 Win=65535 Len=1460 [TCP segment of a reassembled PDU]"
"4.250323","5.9.29.183","172.19.0.3","TLSv1.2","1516","Application Data, Application Data"
"4.250360","5.9.29.183","172.19.0.3","TCP","1516","9002 → 43520 [PSH, ACK] Seq=244696 Ack=15031 Win=65535 Len=1460 [TCP segment of a reassembled PDU]"
"4.250363","5.9.29.183","172.19.0.3","TCP","1516","9002 → 43520 [PSH, ACK] Seq=246156 Ack=15031 Win=65535 Len=1460 [TCP segment of a reassembled PDU]"
"4.250392","172.19.0.3","5.9.29.183","TCP","56","43520 → 9002 [ACK] Seq=15031 Ack=247616 Win=11847 Len=0"
"4.250404","5.9.29.183","172.19.0.3","TLSv1.2","743","Application Data"
"4.250661","172.19.0.3","5.9.29.183","TLSv1.2","599","Application Data"
"4.250787","5.9.29.183","172.19.0.3","TCP","56","9002 → 43520 [ACK] Seq=248303 Ack=15574 Win=65535 Len=0"
"4.258284","5.9.29.183","172.19.0.3","TCP","1516","[TCP segment of a reassembled PDU]"
"4.258338","5.9.29.183","172.19.0.3","TCP","1516","9002 → 43520 [PSH, ACK] Seq=249763 Ack=15574 Win=65535 Len=1460 [TCP segment of a reassembled PDU]"
"4.258355","172.19.0.3","5.9.29.183","TCP","56","43520 → 9002 [ACK] Seq=15574 Ack=251223 Win=11903 Len=0"
"4.258358","5.9.29.183","172.19.0.3","TLSv1.2","1516","Application Data [TCP segment of a reassembled PDU]"
"4.258361","5.9.29.183","172.19.0.3","TLSv1.2","1468","Application Data [TCP segment of a reassembled PDU]"
"4.258515","172.19.0.3","5.9.29.183","TCP","56","43520 → 9002 [ACK] Seq=15574 Ack=254095 Win=11885 Len=0"
"4.261358","172.19.0.3","5.9.29.183","TLSv1.2","599","Application Data"
"4.261587","5.9.29.183","172.19.0.3","TCP","56","9002 → 43520 [ACK] Seq=254095 Ack=16117 Win=65535 Len=0"
"4.266025","5.9.29.183","172.19.0.3","TCP","1504","9002 → 43520 [PSH, ACK] Seq=254095 Ack=16117 Win=65535 Len=1448 [TCP segment of a reassembled PDU]"
"4.266218","5.9.29.183","172.19.0.3","TCP","1504","9002 → 43520 [PSH, ACK] Seq=255543 Ack=16117 Win=65535 Len=1448 [TCP segment of a reassembled PDU]"
"4.266228","172.19.0.3","5.9.29.183","TCP","56","43520 → 9002 [ACK] Seq=16117 Ack=256991 Win=11911 Len=0"
"4.266487","5.9.29.183","172.19.0.3","TLSv1.2","1516","Application Data, Application Data"
"4.266517","5.9.29.183","172.19.0.3","TCP","1492","9002 → 43520 [PSH, ACK] Seq=258451 Ack=16117 Win=65535 Len=1436 [TCP segment of a reassembled PDU]"
"4.266522","5.9.29.183","172.19.0.3","TCP","1516","9002 → 43520 [PSH, ACK] Seq=259887 Ack=16117 Win=65535 Len=1460 [TCP segment of a reassembled PDU]"
"4.266534","5.9.29.183","172.19.0.3","TLSv1.2","1492","Application Data, Application Data"
"4.266570","172.19.0.3","5.9.29.183","TCP","56","43520 → 9002 [ACK] Seq=16117 Ack=262783 Win=11887 Len=0"
"4.266587","5.9.29.183","172.19.0.3","TCP","1516","9002 → 43520 [PSH, ACK] Seq=262783 Ack=16117 Win=65535 Len=1460 [TCP segment of a reassembled PDU]"
"4.266844","5.9.29.183","172.19.0.3","TLSv1.2","767","Application Data"
"4.266906","172.19.0.3","5.9.29.183","TCP","56","43520 → 9002 [ACK] Seq=16117 Ack=264954 Win=11871 Len=0"
"4.275913","5.9.29.183","172.19.0.3","TCP","316","[TCP segment of a reassembled PDU]"
"4.275962","5.9.29.183","172.19.0.3","TCP","1516","9002 → 43520 [PSH, ACK] Seq=265214 Ack=16117 Win=65535 Len=1460 [TCP segment of a reassembled PDU]"
"4.275975","172.19.0.3","5.9.29.183","TCP","56","43520 → 9002 [ACK] Seq=16117 Ack=266674 Win=11903 Len=0"
"4.275977","5.9.29.183","172.19.0.3","TCP","1232","9002 → 43520 [PSH, ACK] Seq=266674 Ack=16117 Win=65535 Len=1176 [TCP segment of a reassembled PDU]"
"4.282532","5.9.29.183","172.19.0.3","TLSv1.2","1330","Application Data, Application Data"
"4.282560","172.19.0.3","5.9.29.183","TCP","56","43520 → 9002 [ACK] Seq=16117 Ack=269124 Win=11911 Len=0"
"4.355770","5.9.29.183","172.19.0.3","TLSv1.2","1113","Application Data"
"4.360850","172.19.0.3","5.9.29.183","TLSv1.2","599","Application Data"
"4.361385","5.9.29.183","172.19.0.3","TCP","56","9002 → 43520 [ACK] Seq=270181 Ack=16660 Win=65535 Len=0"
"4.597793","5.9.29.183","172.19.0.3","TLSv1.2","599","Application Data"
"4.598500","172.19.0.3","5.9.29.183","TLSv1.2","599","Application Data"
"4.598859","5.9.29.183","172.19.0.3","TCP","56","9002 → 43520 [ACK] Seq=270724 Ack=17203 Win=65535 Len=0"
"4.891348","5.9.29.183","172.19.0.3","TLSv1.2","599","Application Data"
"4.917143","5.9.29.183","172.19.0.3","TCP","1516","[TCP segment of a reassembled PDU]"
"4.917161","172.19.0.3","5.9.29.183","TCP","56","43520 → 9002 [ACK] Seq=17203 Ack=272727 Win=11911 Len=0"
"4.917195","5.9.29.183","172.19.0.3","TLSv1.2","681","Application Data"
"4.920239","172.19.0.3","5.9.29.183","TLSv1.2","599","Application Data"
"4.920429","5.9.29.183","172.19.0.3","TCP","56","9002 → 43520 [ACK] Seq=273352 Ack=17746 Win=65535 Len=0"
"5.142584","5.9.29.183","172.19.0.3","TLSv1.2","599","Application Data"
"5.143340","172.19.0.3","5.9.29.183","TLSv1.2","599","Application Data"
"5.143683","5.9.29.183","172.19.0.3","TCP","56","9002 → 43520 [ACK] Seq=273895 Ack=18289 Win=65535 Len=0"
"5.368574","5.9.29.183","172.19.0.3","TLSv1.2","599","Application Data"
"5.409911","172.19.0.3","5.9.29.183","TCP","56","43520 → 9002 [ACK] Seq=18289 Ack=274438 Win=11911 Len=0"
"5.437045","5.9.29.183","172.19.0.3","TCP","1516","[TCP segment of a reassembled PDU]"
"5.437066","172.19.0.3","5.9.29.183","TCP","56","43520 → 9002 [ACK] Seq=18289 Ack=275898 Win=11911 Len=0"
"5.437108","5.9.29.183","172.19.0.3","TLSv1.2","1195","Application Data"
"5.437121","172.19.0.3","5.9.29.183","TCP","56","43520 → 9002 [ACK] Seq=18289 Ack=277037 Win=11903 Len=0"
"5.441329","172.19.0.3","5.9.29.183","TLSv1.2","599","Application Data"
"5.441590","5.9.29.183","172.19.0.3","TCP","56","9002 → 43520 [ACK] Seq=277037 Ack=18832 Win=65535 Len=0"
"5.656937","5.9.29.183","172.19.0.3","TLSv1.2","599","Application Data"
"5.657546","172.19.0.3","5.9.29.183","TLSv1.2","599","Application Data"
"5.657748","5.9.29.183","172.19.0.3","TCP","56","9002 → 43520 [ACK] Seq=277580 Ack=19375 Win=65535 Len=0"
"5.983045","5.9.29.183","172.19.0.3","TLSv1.2","599","Application Data"
"6.023152","5.9.29.183","172.19.0.3","TCP","1516","[TCP segment of a reassembled PDU]"
"6.023169","172.19.0.3","5.9.29.183","TCP","56","43520 → 9002 [ACK] Seq=19375 Ack=279583 Win=11911 Len=0"
"6.023203","5.9.29.183","172.19.0.3","TCP","1492","9002 → 43520 [PSH, ACK] Seq=279583 Ack=19375 Win=65535 Len=1436 [TCP segment of a reassembled PDU]"
"6.023212","5.9.29.183","172.19.0.3","TLSv1.2","787","Application Data"
"6.023320","172.19.0.3","5.9.29.183","TCP","56","43520 → 9002 [ACK] Seq=19375 Ack=281750 Win=11895 Len=0"
"6.069268","5.9.29.183","172.19.0.3","TCP","1516","[TCP segment of a reassembled PDU]"
"6.069322","5.9.29.183","172.19.0.3","TLSv1.2","1195","Application Data"
"6.069339","172.19.0.3","5.9.29.183","TCP","56","43520 → 9002 [ACK] Seq=19375 Ack=284349 Win=11903 Len=0"
"6.072072","172.19.0.3","5.9.29.183","TLSv1.2","599","Application Data"
"6.072322","5.9.29.183","172.19.0.3","TCP","56","9002 → 43520 [ACK] Seq=284349 Ack=19918 Win=65535 Len=0"
"6.326605","5.9.29.183","172.19.0.3","TLSv1.2","599","Application Data"
"6.327166","172.19.0.3","5.9.29.183","TLSv1.2","599","Application Data"
"6.327420","5.9.29.183","172.19.0.3","TCP","56","9002 → 43520 [ACK] Seq=284892 Ack=20461 Win=65535 Len=0"
"6.565103","5.9.29.183","172.19.0.3","TCP","1516","[TCP segment of a reassembled PDU]"
"6.565186","5.9.29.183","172.19.0.3","TCP","1492","9002 → 43520 [PSH, ACK] Seq=286352 Ack=20461 Win=65535 Len=1436 [TCP segment of a reassembled PDU]"
"6.565197","5.9.29.183","172.19.0.3","TLSv1.2","787","Application Data"
"6.565414","172.19.0.3","5.9.29.183","TCP","56","43520 → 9002 [ACK] Seq=20461 Ack=288519 Win=11895 Len=0"
"6.579861","5.9.29.183","172.19.0.3","TCP","1504","[TCP segment of a reassembled PDU]"
"6.579976","5.9.29.183","172.19.0.3","TCP","1504","9002 → 43520 [PSH, ACK] Seq=289967 Ack=20461 Win=65535 Len=1448 [TCP segment of a reassembled PDU]"
"6.579998","172.19.0.3","5.9.29.183","TCP","56","43520 → 9002 [ACK] Seq=20461 Ack=291415 Win=11903 Len=0"
"6.581315","5.9.29.183","172.19.0.3","TLSv1.2","1330","Application Data, Application Data"
"6.593655","5.9.29.183","172.19.0.3","TCP","1504","[TCP segment of a reassembled PDU]"
"6.593689","172.19.0.3","5.9.29.183","TCP","56","43520 → 9002 [ACK] Seq=20461 Ack=294137 Win=11911 Len=0"
"6.593739","5.9.29.183","172.19.0.3","TCP","1504","9002 → 43520 [PSH, ACK] Seq=294137 Ack=20461 Win=65535 Len=1448 [TCP segment of a reassembled PDU]"
"6.596325","5.9.29.183","172.19.0.3","TLSv1.2","1330","Application Data, Application Data"
"6.596341","172.19.0.3","5.9.29.183","TCP","56","43520 → 9002 [ACK] Seq=20461 Ack=296859 Win=11911 Len=0"
"6.596753","172.19.0.3","5.9.29.183","TLSv1.2","599","Application Data"
"6.596972","5.9.29.183","172.19.0.3","TCP","56","9002 → 43520 [ACK] Seq=296859 Ack=21004 Win=65535 Len=0"
"6.624386","5.9.29.183","172.19.0.3","TCP","1504","[TCP segment of a reassembled PDU]"
"6.624451","5.9.29.183","172.19.0.3","TCP","1516","9002 → 43520 [PSH, ACK] Seq=298307 Ack=21004 Win=65535 Len=1460 [TCP segment of a reassembled PDU]"
"6.624481","5.9.29.183","172.19.0.3","TLSv1.2","1225","Application Data"
"6.624537","172.19.0.3","5.9.29.183","TCP","56","43520 → 9002 [ACK] Seq=21004 Ack=300936 Win=11895 Len=0"
"6.625102","172.19.0.3","5.9.29.183","TLSv1.2","599","Application Data"
"6.625336","5.9.29.183","172.19.0.3","TCP","56","9002 → 43520 [ACK] Seq=300936 Ack=21547 Win=65535 Len=0"
"6.635437","172.19.0.3","5.9.29.183","TLSv1.2","599","Application Data"
"6.635849","5.9.29.183","172.19.0.3","TCP","56","9002 → 43520 [ACK] Seq=300936 Ack=22090 Win=65535 Len=0"
"6.639106","5.9.29.183","172.19.0.3","TLSv1.2","149","Application Data"
"6.680157","172.19.0.3","5.9.29.183","TCP","56","43520 → 9002 [ACK] Seq=22090 Ack=301029 Win=11911 Len=0"
"6.881697","5.9.29.183","172.19.0.3","TLSv1.2","599","Application Data"
"6.881764","172.19.0.3","5.9.29.183","TCP","56","43520 → 9002 [ACK] Seq=22090 Ack=301572 Win=11911 Len=0"
"6.882368","172.19.0.3","5.9.29.183","TLSv1.2","599","Application Data"
"6.882620","5.9.29.183","172.19.0.3","TCP","56","9002 → 43520 [ACK] Seq=301572 Ack=22633 Win=65535 Len=0"
"7.119367","5.9.29.183","172.19.0.3","TLSv1.2","599","Application Data"
"7.137788","5.9.29.183","172.19.0.3","TCP","1516","[TCP segment of a reassembled PDU]"
"7.137808","172.19.0.3","5.9.29.183","TCP","56","43520 → 9002 [ACK] Seq=22633 Ack=303575 Win=11911 Len=0"
"7.137858","5.9.29.183","172.19.0.3","TCP","1516","9002 → 43520 [PSH, ACK] Seq=303575 Ack=22633 Win=65535 Len=1460 [TCP segment of a reassembled PDU]"
"7.137869","5.9.29.183","172.19.0.3","TLSv1.2","763","Application Data"
"7.138012","172.19.0.3","5.9.29.183","TCP","56","43520 → 9002 [ACK] Seq=22633 Ack=305742 Win=11895 Len=0"
"7.149585","5.9.29.183","172.19.0.3","TCP","1516","[TCP segment of a reassembled PDU]"
"7.149633","5.9.29.183","172.19.0.3","TCP","1492","9002 → 43520 [PSH, ACK] Seq=307202 Ack=22633 Win=65535 Len=1436 [TCP segment of a reassembled PDU]"
"7.149646","172.19.0.3","5.9.29.183","TCP","56","43520 → 9002 [ACK] Seq=22633 Ack=308638 Win=11903 Len=0"
"7.149648","5.9.29.183","172.19.0.3","TLSv1.2","1516","Application Data [TCP segment of a reassembled PDU]"
"7.149651","5.9.29.183","172.19.0.3","TCP","1516","9002 → 43520 [PSH, ACK] Seq=310098 Ack=22633 Win=65535 Len=1460 [TCP segment of a reassembled PDU]"
"7.149655","5.9.29.183","172.19.0.3","TCP","1480","9002 → 43520 [PSH, ACK] Seq=311558 Ack=22633 Win=65535 Len=1424 [TCP segment of a reassembled PDU]"
"7.149756","172.19.0.3","5.9.29.183","TCP","56","43520 → 9002 [ACK] Seq=22633 Ack=312982 Win=11879 Len=0"
"7.153117","5.9.29.183","172.19.0.3","TLSv1.2","1127","Application Data, Application Data"
"7.164092","5.9.29.183","172.19.0.3","TCP","1516","[TCP segment of a reassembled PDU]"
"7.164114","172.19.0.3","5.9.29.183","TCP","56","43520 → 9002 [ACK] Seq=22633 Ack=315513 Win=11911 Len=0"
"7.164149","5.9.29.183","172.19.0.3","TCP","1516","9002 → 43520 [PSH, ACK] Seq=315513 Ack=22633 Win=65535 Len=1460 [TCP segment of a reassembled PDU]"
"7.164184","5.9.29.183","172.19.0.3","TLSv1.2","1480","Application Data [TCP segment of a reassembled PDU]"
"7.164334","172.19.0.3","5.9.29.183","TCP","56","43520 → 9002 [ACK] Seq=22633 Ack=318397 Win=11895 Len=0"
"7.169200","5.9.29.183","172.19.0.3","TLSv1.2","396","Application Data"
"7.180885","5.9.29.183","172.19.0.3","TCP","1516","[TCP segment of a reassembled PDU]"
"7.180904","172.19.0.3","5.9.29.183","TCP","56","43520 → 9002 [ACK] Seq=22633 Ack=320197 Win=11911 Len=0"
"7.180939","5.9.29.183","172.19.0.3","TCP","1516","9002 → 43520 [PSH, ACK] Seq=320197 Ack=22633 Win=65535 Len=1460 [TCP segment of a reassembled PDU]"
"7.180968","5.9.29.183","172.19.0.3","TLSv1.2","1480","Application Data [TCP segment of a reassembled PDU]"
"7.181034","5.9.29.183","172.19.0.3","TLSv1.2","1516","Application Data [TCP segment of a reassembled PDU]"
"7.181038","5.9.29.183","172.19.0.3","TCP","1516","9002 → 43520 [PSH, ACK] Seq=324541 Ack=22633 Win=65535 Len=1460 [TCP segment of a reassembled PDU]"
"7.181040","5.9.29.183","172.19.0.3","TCP","1516","9002 → 43520 [PSH, ACK] Seq=326001 Ack=22633 Win=65535 Len=1460 [TCP segment of a reassembled PDU]"
"7.181044","5.9.29.183","172.19.0.3","TLSv1.2","1468","Application Data [TCP segment of a reassembled PDU]"
"7.181059","172.19.0.3","5.9.29.183","TCP","56","43520 → 9002 [ACK] Seq=22633 Ack=328873 Win=11863 Len=0"
"7.185672","5.9.29.183","172.19.0.3","TLSv1.2","830","Application Data"
"7.185956","172.19.0.3","5.9.29.183","TLSv1.2","599","Application Data"
"7.186169","5.9.29.183","172.19.0.3","TCP","56","9002 → 43520 [ACK] Seq=329647 Ack=23176 Win=65535 Len=0"
"7.201103","5.9.29.183","172.19.0.3","TCP","1159","[TCP segment of a reassembled PDU]"
"7.201167","5.9.29.183","172.19.0.3","TCP","1516","9002 → 43520 [PSH, ACK] Seq=330750 Ack=23176 Win=65535 Len=1460 [TCP segment of a reassembled PDU]"
"7.201188","5.9.29.183","172.19.0.3","TLSv1.2","606","Application Data"
"7.201344","172.19.0.3","5.9.29.183","TCP","56","43520 → 9002 [ACK] Seq=23176 Ack=332760 Win=11895 Len=0"
"7.204630","172.19.0.3","5.9.29.183","TLSv1.2","599","Application Data"
"7.205092","5.9.29.183","172.19.0.3","TCP","56","9002 → 43520 [ACK] Seq=332760 Ack=23719 Win=65535 Len=0"
"7.476027","5.9.29.183","172.19.0.3","TLSv1.2","599","Application Data"
"7.476790","172.19.0.3","5.9.29.183","TLSv1.2","599","Application Data"
"7.477083","5.9.29.183","172.19.0.3","TCP","56","9002 → 43520 [ACK] Seq=333303 Ack=24262 Win=65535 Len=0"
"7.781131","5.9.29.183","172.19.0.3","TCP","1504","[TCP segment of a reassembled PDU]"
"7.781199","5.9.29.183","172.19.0.3","TLSv1.2","1207","Application Data"
"7.781309","172.19.0.3","5.9.29.183","TCP","56","43520 → 9002 [ACK] Seq=24262 Ack=335902 Win=11903 Len=0"
"7.809570","5.9.29.183","172.19.0.3","TLSv1.2","1113","Application Data"
"7.850981","172.19.0.3","5.9.29.183","TCP","56","43520 → 9002 [ACK] Seq=24262 Ack=336959 Win=11911 Len=0"
"7.884034","5.9.29.183","172.19.0.3","TCP","1504","[TCP segment of a reassembled PDU]"
"7.884053","172.19.0.3","5.9.29.183","TCP","56","43520 → 9002 [ACK] Seq=24262 Ack=338407 Win=11911 Len=0"
"7.884088","5.9.29.183","172.19.0.3","TCP","1516","9002 → 43520 [PSH, ACK] Seq=338407 Ack=24262 Win=65535 Len=1460 [TCP segment of a reassembled PDU]"
"7.884098","172.19.0.3","5.9.29.183","TCP","56","43520 → 9002 [ACK] Seq=24262 Ack=339867 Win=11903 Len=0"
"7.884100","5.9.29.183","172.19.0.3","TLSv1.2","775","Application Data"
"7.884103","172.19.0.3","5.9.29.183","TCP","56","43520 → 9002 [ACK] Seq=24262 Ack=340586 Win=11898 Len=0"
"7.897563","5.9.29.183","172.19.0.3","TCP","1504","[TCP segment of a reassembled PDU]"
"7.897582","172.19.0.3","5.9.29.183","TCP","56","43520 → 9002 [ACK] Seq=24262 Ack=342034 Win=11911 Len=0"
"7.897617","5.9.29.183","172.19.0.3","TCP","1504","9002 → 43520 [PSH, ACK] Seq=342034 Ack=24262 Win=65535 Len=1448 [TCP segment of a reassembled PDU]"
"7.897625","172.19.0.3","5.9.29.183","TCP","56","43520 → 9002 [ACK] Seq=24262 Ack=343482 Win=11901 Len=0"
"7.899263","5.9.29.183","172.19.0.3","TLSv1.2","787","Application Data"
"7.899284","172.19.0.3","5.9.29.183","TCP","56","43520 → 9002 [ACK] Seq=24262 Ack=344213 Win=11911 Len=0"
"7.914415","5.9.29.183","172.19.0.3","TLSv1.2","1113","Application Data"
"7.914443","172.19.0.3","5.9.29.183","TCP","56","43520 → 9002 [ACK] Seq=24262 Ack=345270 Win=11911 Len=0"
"7.918566","5.9.29.183","172.19.0.3","TCP","1504","[TCP segment of a reassembled PDU]"
"7.918620","172.19.0.3","5.9.29.183","TCP","56","43520 → 9002 [ACK] Seq=24262 Ack=346718 Win=11911 Len=0"
"7.918664","5.9.29.183","172.19.0.3","TCP","1516","9002 → 43520 [PSH, ACK] Seq=346718 Ack=24262 Win=65535 Len=1460 [TCP segment of a reassembled PDU]"
"7.918676","172.19.0.3","5.9.29.183","TCP","56","43520 → 9002 [ACK] Seq=24262 Ack=348178 Win=11903 Len=0"
"7.918679","5.9.29.183","172.19.0.3","TLSv1.2","1516","Application Data [TCP segment of a reassembled PDU]"
"7.918686","172.19.0.3","5.9.29.183","TCP","56","43520 → 9002 [ACK] Seq=24262 Ack=349638 Win=11895 Len=0"
"7.918688","5.9.29.183","172.19.0.3","TCP","1480","9002 → 43520 [PSH, ACK] Seq=349638 Ack=24262 Win=65535 Len=1424 [TCP segment of a reassembled PDU]"
"7.918694","172.19.0.3","5.9.29.183","TCP","56","43520 → 9002 [ACK] Seq=24262 Ack=351062 Win=11887 Len=0"
"7.918695","5.9.29.183","172.19.0.3","TCP","1516","9002 → 43520 [PSH, ACK] Seq=351062 Ack=24262 Win=65535 Len=1460 [TCP segment of a reassembled PDU]"
"7.918698","172.19.0.3","5.9.29.183","TCP","56","43520 → 9002 [ACK] Seq=24262 Ack=352522 Win=11879 Len=0"
"7.918862","5.9.29.183","172.19.0.3","TLSv1.2","1516","Application Data [TCP segment of a reassembled PDU]"
"7.918873","172.19.0.3","5.9.29.183","TCP","56","43520 → 9002 [ACK] Seq=24262 Ack=353982 Win=11871 Len=0"
"7.918874","5.9.29.183","172.19.0.3","TCP","1516","9002 → 43520 [PSH, ACK] Seq=353982 Ack=24262 Win=65535 Len=1460 [TCP segment of a reassembled PDU]"
"7.918877","5.9.29.183","172.19.0.3","TCP","1516","9002 → 43520 [PSH, ACK] Seq=355442 Ack=24262 Win=65535 Len=1460 [TCP segment of a reassembled PDU]"
"7.918880","5.9.29.183","172.19.0.3","TLSv1.2","1456","Application Data [TCP segment of a reassembled PDU]"
"7.918888","172.19.0.3","5.9.29.183","TCP","56","43520 → 9002 [ACK] Seq=24262 Ack=355442 Win=11863 Len=0"
"7.919084","172.19.0.3","5.9.29.183","TLSv1.2","599","Application Data"
"7.919252","5.9.29.183","172.19.0.3","TCP","56","9002 → 43520 [ACK] Seq=358302 Ack=24805 Win=65535 Len=0"
"7.929420","5.9.29.183","172.19.0.3","TCP","1504","9002 → 43520 [PSH, ACK] Seq=358302 Ack=24805 Win=65535 Len=1448 [TCP segment of a reassembled PDU]"
"7.929470","5.9.29.183","172.19.0.3","TLSv1.2","1504","Application Data [TCP segment of a reassembled PDU]"
"7.929490","172.19.0.3","5.9.29.183","TCP","56","43520 → 9002 [ACK] Seq=24805 Ack=361198 Win=11903 Len=0"
"7.929886","172.19.0.3","5.9.29.183","TLSv1.2","599","Application Data"
"7.930158","5.9.29.183","172.19.0.3","TCP","56","9002 → 43520 [ACK] Seq=361198 Ack=25348 Win=65535 Len=0"
"7.933996","5.9.29.183","172.19.0.3","TCP","1504","9002 → 43520 [PSH, ACK] Seq=361198 Ack=25348 Win=65535 Len=1448 [TCP segment of a reassembled PDU]"
"7.934045","5.9.29.183","172.19.0.3","TCP","1516","9002 → 43520 [PSH, ACK] Seq=362646 Ack=25348 Win=65535 Len=1460 [TCP segment of a reassembled PDU]"
"7.934058","172.19.0.3","5.9.29.183","TCP","56","43520 → 9002 [ACK] Seq=25348 Ack=364106 Win=11903 Len=0"
"7.934060","5.9.29.183","172.19.0.3","TLSv1.2","1516","Application Data [TCP segment of a reassembled PDU]"
"7.934117","5.9.29.183","172.19.0.3","TLSv1.2","494","Application Data"
"7.934177","172.19.0.3","5.9.29.183","TCP","56","43520 → 9002 [ACK] Seq=25348 Ack=366004 Win=11889 Len=0"
"7.945572","5.9.29.183","172.19.0.3","TCP","1504","[TCP segment of a reassembled PDU]"
"7.945920","5.9.29.183","172.19.0.3","TCP","1504","9002 → 43520 [PSH, ACK] Seq=367452 Ack=25348 Win=65535 Len=1448 [TCP segment of a reassembled PDU]"
"7.945954","172.19.0.3","5.9.29.183","TCP","56","43520 → 9002 [ACK] Seq=25348 Ack=368900 Win=11909 Len=0"
"7.946133","5.9.29.183","172.19.0.3","TLSv1.2","1516","Application Data [TCP segment of a reassembled PDU]"
"7.946284","5.9.29.183","172.19.0.3","TCP","1516","9002 → 43520 [PSH, ACK] Seq=370360 Ack=25348 Win=65535 Len=1460 [TCP segment of a reassembled PDU]"
"7.946294","5.9.29.183","172.19.0.3","TCP","1516","9002 → 43520 [PSH, ACK] Seq=371820 Ack=25348 Win=65535 Len=1460 [TCP segment of a reassembled PDU]"
"7.946298","5.9.29.183","172.19.0.3","TLSv1.2","1468","Application Data [TCP segment of a reassembled PDU]"
"7.946459","5.9.29.183","172.19.0.3","TCP","1516","9002 → 43520 [PSH, ACK] Seq=374692 Ack=25348 Win=65535 Len=1460 [TCP segment of a reassembled PDU]"
"7.946434","172.19.0.3","5.9.29.183","TCP","56","43520 → 9002 [ACK] Seq=25348 Ack=374692 Win=11887 Len=0"
"7.946574","5.9.29.183","172.19.0.3","TCP","1516","9002 → 43520 [PSH, ACK] Seq=376152 Ack=25348 Win=65535 Len=1460 [TCP segment of a reassembled PDU]"
"7.946580","5.9.29.183","172.19.0.3","TLSv1.2","1516","Application Data [TCP segment of a reassembled PDU]"
"7.946583","5.9.29.183","172.19.0.3","TCP","1468","9002 → 43520 [PSH, ACK] Seq=379072 Ack=25348 Win=65535 Len=1412 [TCP segment of a reassembled PDU]"
"7.946944","172.19.0.3","5.9.29.183","TCP","56","43520 → 9002 [ACK] Seq=25348 Ack=380484 Win=11855 Len=0"
"7.949851","5.9.29.183","172.19.0.3","TLSv1.2","84","Application Data"
"7.956094","172.19.0.3","5.9.29.183","TLSv1.2","599","Application Data"
"7.956553","5.9.29.183","172.19.0.3","TCP","56","9002 → 43520 [ACK] Seq=380512 Ack=25891 Win=65535 Len=0"
"8.241358","5.9.29.183","172.19.0.3","TLSv1.2","599","Application Data"
"8.242083","172.19.0.3","5.9.29.183","TLSv1.2","599","Application Data"
"8.242289","5.9.29.183","172.19.0.3","TCP","56","9002 → 43520 [ACK] Seq=381055 Ack=26434 Win=65535 Len=0"
"8.542059","5.9.29.183","172.19.0.3","TCP","1504","[TCP segment of a reassembled PDU]"
"8.542180","5.9.29.183","172.19.0.3","TCP","1516","9002 → 43520 [PSH, ACK] Seq=382503 Ack=26434 Win=65535 Len=1460 [TCP segment of a reassembled PDU]"
"8.542188","5.9.29.183","172.19.0.3","TLSv1.2","775","Application Data"
"8.542325","172.19.0.3","5.9.29.183","TCP","56","43520 → 9002 [ACK] Seq=26434 Ack=384682 Win=11895 Len=0"
"8.552919","5.9.29.183","172.19.0.3","TCP","1516","[TCP segment of a reassembled PDU]"
"8.552971","5.9.29.183","172.19.0.3","TCP","1516","9002 → 43520 [PSH, ACK] Seq=386142 Ack=26434 Win=65535 Len=1460 [TCP segment of a reassembled PDU]"
"8.552985","172.19.0.3","5.9.29.183","TCP","56","43520 → 9002 [ACK] Seq=26434 Ack=387602 Win=11903 Len=0"
"8.552988","5.9.29.183","172.19.0.3","TLSv1.2","1516","Application Data [TCP segment of a reassembled PDU]"
"8.552990","5.9.29.183","172.19.0.3","TCP","1468","9002 → 43520 [PSH, ACK] Seq=389062 Ack=26434 Win=65535 Len=1412 [TCP segment of a reassembled PDU]"
"8.553168","172.19.0.3","5.9.29.183","TCP","56","43520 → 9002 [ACK] Seq=26434 Ack=390474 Win=11887 Len=0"
"8.573221","5.9.29.183","172.19.0.3","TLSv1.2","1504","Application Data [TCP segment of a reassembled PDU]"
"8.578835","5.9.29.183","172.19.0.3","TLSv1.2","613","Application Data"
"8.578853","172.19.0.3","5.9.29.183","TCP","56","43520 → 9002 [ACK] Seq=26434 Ack=392479 Win=11909 Len=0"
"8.585246","5.9.29.183","172.19.0.3","TCP","1504","[TCP segment of a reassembled PDU]"
"8.585298","5.9.29.183","172.19.0.3","TCP","1516","9002 → 43520 [PSH, ACK] Seq=393927 Ack=26434 Win=65535 Len=1460 [TCP segment of a reassembled PDU]"
"8.585305","5.9.29.183","172.19.0.3","TCP","955","9002 → 43520 [PSH, ACK] Seq=395387 Ack=26434 Win=65535 Len=899 [TCP segment of a reassembled PDU]"
"8.585308","5.9.29.183","172.19.0.3","TLSv1.2","1516","Application Data [TCP segment of a reassembled PDU]"
"8.585310","5.9.29.183","172.19.0.3","TCP","1516","9002 → 43520 [PSH, ACK] Seq=397746 Ack=26434 Win=65535 Len=1460 [TCP segment of a reassembled PDU]"
"8.585332","5.9.29.183","172.19.0.3","TLSv1.2","1516","Application Data [TCP segment of a reassembled PDU]"
"8.585338","5.9.29.183","172.19.0.3","TCP","1516","9002 → 43520 [PSH, ACK] Seq=400666 Ack=26434 Win=65535 Len=1460 [TCP segment of a reassembled PDU]"
"8.585340","5.9.29.183","172.19.0.3","TCP","545","9002 → 43520 [PSH, ACK] Seq=402126 Ack=26434 Win=65535 Len=489 [TCP segment of a reassembled PDU]"
"8.585415","5.9.29.183","172.19.0.3","TCP","1516","9002 → 43520 [PSH, ACK] Seq=402615 Ack=26434 Win=65535 Len=1460 [TCP segment of a reassembled PDU]"
"8.585419","5.9.29.183","172.19.0.3","TLSv1.2","1492","Application Data [TCP segment of a reassembled PDU]"
"8.585446","172.19.0.3","5.9.29.183","TCP","56","43520 → 9002 [ACK] Seq=26434 Ack=405511 Win=11838 Len=0"
"8.585935","172.19.0.3","5.9.29.183","TLSv1.2","599","Application Data"
"8.586117","5.9.29.183","172.19.0.3","TCP","56","9002 → 43520 [ACK] Seq=405511 Ack=26977 Win=65535 Len=0"
"8.592341","5.9.29.183","172.19.0.3","TCP","1504","9002 → 43520 [PSH, ACK] Seq=405511 Ack=26977 Win=65535 Len=1448 [TCP segment of a reassembled PDU]"
"8.593728","5.9.29.183","172.19.0.3","TCP","1504","9002 → 43520 [PSH, ACK] Seq=406959 Ack=26977 Win=65535 Len=1448 [TCP segment of a reassembled PDU]"
"8.593737","172.19.0.3","5.9.29.183","TCP","56","43520 → 9002 [ACK] Seq=26977 Ack=408407 Win=11911 Len=0"
"8.593842","5.9.29.183","172.19.0.3","TLSv1.2","1504","Application Data, Application Data"
"8.593869","5.9.29.183","172.19.0.3","TCP","1516","9002 → 43520 [PSH, ACK] Seq=409855 Ack=26977 Win=65535 Len=1460 [TCP segment of a reassembled PDU]"
"8.593876","5.9.29.183","172.19.0.3","TCP","1492","9002 → 43520 [PSH, ACK] Seq=411315 Ack=26977 Win=65535 Len=1436 [TCP segment of a reassembled PDU]"
"8.593902","172.19.0.3","5.9.29.183","TCP","56","43520 → 9002 [ACK] Seq=26977 Ack=412751 Win=11895 Len=0"
"8.595717","172.19.0.3","5.9.29.183","TLSv1.2","599","Application Data"
"8.596149","5.9.29.183","172.19.0.3","TCP","56","9002 → 43520 [ACK] Seq=412751 Ack=27520 Win=65535 Len=0"
"8.600723","5.9.29.183","172.19.0.3","TLSv1.2","1516","Application Data [TCP segment of a reassembled PDU]"
"8.600770","5.9.29.183","172.19.0.3","TCP","1516","9002 → 43520 [PSH, ACK] Seq=414211 Ack=27520 Win=65535 Len=1460 [TCP segment of a reassembled PDU]"
"8.600775","5.9.29.183","172.19.0.3","TLSv1.2","1225","Application Data"
"8.600883","172.19.0.3","5.9.29.183","TCP","56","43520 → 9002 [ACK] Seq=27520 Ack=416840 Win=11895 Len=0"
"8.601746","5.9.29.183","172.19.0.3","TCP","1516","[TCP segment of a reassembled PDU]"
"8.601806","5.9.29.183","172.19.0.3","TCP","1516","9002 → 43520 [PSH, ACK] Seq=418300 Ack=27520 Win=65535 Len=1460 [TCP segment of a reassembled PDU]"
"8.601815","172.19.0.3","5.9.29.183","TCP","56","43520 → 9002 [ACK] Seq=27520 Ack=419760 Win=11901 Len=0"
"8.601867","5.9.29.183","172.19.0.3","TLSv1.2","1516","Application Data [TCP segment of a reassembled PDU]"
"8.601895","5.9.29.183","172.19.0.3","TCP","1468","9002 → 43520 [PSH, ACK] Seq=421220 Ack=27520 Win=65535 Len=1412 [TCP segment of a reassembled PDU]"
"8.601902","172.19.0.3","5.9.29.183","TCP","56","43520 → 9002 [ACK] Seq=27520 Ack=422632 Win=11903 Len=0"
"8.601904","5.9.29.183","172.19.0.3","TCP","1504","9002 → 43520 [PSH, ACK] Seq=422632 Ack=27520 Win=65535 Len=1448 [TCP segment of a reassembled PDU]"
"8.616810","5.9.29.183","172.19.0.3","TLSv1.2","1504","Application Data [TCP segment of a reassembled PDU]"
"8.616873","172.19.0.3","5.9.29.183","TCP","56","43520 → 9002 [ACK] Seq=27520 Ack=425528 Win=11911 Len=0"
"8.616910","5.9.29.183","172.19.0.3","TCP","1516","9002 → 43520 [PSH, ACK] Seq=425528 Ack=27520 Win=65535 Len=1460 [TCP segment of a reassembled PDU]"
"8.616953","5.9.29.183","172.19.0.3","TCP","1516","9002 → 43520 [PSH, ACK] Seq=426988 Ack=27520 Win=65535 Len=1460 [TCP segment of a reassembled PDU]"
"8.617041","172.19.0.3","5.9.29.183","TCP","56","43520 → 9002 [ACK] Seq=27520 Ack=428448 Win=11895 Len=0"
"8.617103","5.9.29.183","172.19.0.3","TLSv1.2","1516","Application Data [TCP segment of a reassembled PDU]"
"8.617111","5.9.29.183","172.19.0.3","TCP","1516","9002 → 43520 [PSH, ACK] Seq=429908 Ack=27520 Win=65535 Len=1460 [TCP segment of a reassembled PDU]"
"8.617115","5.9.29.183","172.19.0.3","TLSv1.2","1516","Application Data [TCP segment of a reassembled PDU]"
"8.617118","5.9.29.183","172.19.0.3","TCP","1516","9002 → 43520 [PSH, ACK] Seq=432828 Ack=27520 Win=65535 Len=1460 [TCP segment of a reassembled PDU]"
"8.617121","5.9.29.183","172.19.0.3","TCP","1516","9002 → 43520 [PSH, ACK] Seq=434288 Ack=27520 Win=65535 Len=1460 [TCP segment of a reassembled PDU]"
"8.617125","5.9.29.183","172.19.0.3","TLSv1.2","1420","Application Data [TCP segment of a reassembled PDU]"
"8.617248","5.9.29.183","172.19.0.3","TCP","1516","9002 → 43520 [PSH, ACK] Seq=437112 Ack=27520 Win=65535 Len=1460 [TCP segment of a reassembled PDU]"
"8.617255","5.9.29.183","172.19.0.3","TCP","1516","9002 → 43520 [PSH, ACK] Seq=438572 Ack=27520 Win=65535 Len=1460 [TCP segment of a reassembled PDU]"
"8.617279","5.9.29.183","172.19.0.3","TLSv1.2","1225","Application Data, Application Data"
"8.617280","172.19.0.3","5.9.29.183","TCP","56","43520 → 9002 [ACK] Seq=27520 Ack=438572 Win=11838 Len=0"
"8.617383","172.19.0.3","5.9.29.183","TCP","56","43520 → 9002 [ACK] Seq=27520 Ack=441201 Win=11822 Len=0"
"8.617971","172.19.0.3","5.9.29.183","TLSv1.2","599","Application Data"
"8.618238","5.9.29.183","172.19.0.3","TCP","56","9002 → 43520 [ACK] Seq=441201 Ack=28063 Win=65535 Len=0"
"8.624335","5.9.29.183","172.19.0.3","TCP","1504","[TCP segment of a reassembled PDU]"
"8.633408","5.9.29.183","172.19.0.3","TCP","1516","9002 → 43520 [PSH, ACK] Seq=442649 Ack=28063 Win=65535 Len=1460 [TCP segment of a reassembled PDU]"
"8.633430","172.19.0.3","5.9.29.183","TCP","56","43520 → 9002 [ACK] Seq=28063 Ack=444109 Win=11911 Len=0"
"8.633480","5.9.29.183","172.19.0.3","TLSv1.2","1516","Application Data [TCP segment of a reassembled PDU]"
"8.633527","5.9.29.183","172.19.0.3","TCP","1516","9002 → 43520 [PSH, ACK] Seq=445569 Ack=28063 Win=65535 Len=1460 [TCP segment of a reassembled PDU]"
"8.633536","5.9.29.183","172.19.0.3","TLSv1.2","968","Application Data"
"8.633688","172.19.0.3","5.9.29.183","TCP","56","43520 → 9002 [ACK] Seq=28063 Ack=447941 Win=11885 Len=0"
"8.636735","5.9.29.183","172.19.0.3","TCP","1504","[TCP segment of a reassembled PDU]"
"8.648260","5.9.29.183","172.19.0.3","TLSv1.2","693","Application Data"
"8.648282","172.19.0.3","5.9.29.183","TCP","56","43520 → 9002 [ACK] Seq=28063 Ack=450026 Win=11911 Len=0"
"8.653738","5.9.29.183","172.19.0.3","TCP","1516","[TCP segment of a reassembled PDU]"
"8.653803","5.9.29.183","172.19.0.3","TCP","1492","9002 → 43520 [PSH, ACK] Seq=451486 Ack=28063 Win=65535 Len=1436 [TCP segment of a reassembled PDU]"
"8.653955","172.19.0.3","5.9.29.183","TCP","56","43520 → 9002 [ACK] Seq=28063 Ack=452922 Win=11903 Len=0"
"8.663228","5.9.29.183","172.19.0.3","TLSv1.2","1330","Application Data, Application Data"
"8.683716","5.9.29.183","172.19.0.3","TCP","1516","[TCP segment of a reassembled PDU]"
"8.683735","172.19.0.3","5.9.29.183","TCP","56","43520 → 9002 [ACK] Seq=28063 Ack=455656 Win=11911 Len=0"
"8.683774","5.9.29.183","172.19.0.3","TCP","1492","9002 → 43520 [PSH, ACK] Seq=455656 Ack=28063 Win=65535 Len=1436 [TCP segment of a reassembled PDU]"
"8.683811","5.9.29.183","172.19.0.3","TLSv1.2","273","Application Data"
"8.683920","172.19.0.3","5.9.29.183","TCP","56","43520 → 9002 [ACK] Seq=28063 Ack=457309 Win=11899 Len=0"
"8.684206","172.19.0.3","5.9.29.183","TLSv1.2","599","Application Data"
"8.684690","5.9.29.183","172.19.0.3","TCP","56","9002 → 43520 [ACK] Seq=457309 Ack=28606 Win=65535 Len=0"
"8.692761","172.19.0.3","5.9.29.183","TLSv1.2","599","Application Data"
"8.692989","5.9.29.183","172.19.0.3","TCP","56","9002 → 43520 [ACK] Seq=457309 Ack=29149 Win=65535 Len=0"
"8.974083","5.9.29.183","172.19.0.3","TLSv1.2","599","Application Data"
"8.974807","172.19.0.3","5.9.29.183","TLSv1.2","599","Application Data"
"8.975170","5.9.29.183","172.19.0.3","TCP","56","9002 → 43520 [ACK] Seq=457852 Ack=29692 Win=65535 Len=0"
"9.198768","5.9.29.183","172.19.0.3","TLSv1.2","599","Application Data"
"9.239852","172.19.0.3","5.9.29.183","TCP","56","43520 → 9002 [ACK] Seq=29692 Ack=458395 Win=11911 Len=0"
"9.247138","5.9.29.183","172.19.0.3","TCP","1516","[TCP segment of a reassembled PDU]"
"9.247156","172.19.0.3","5.9.29.183","TCP","56","43520 → 9002 [ACK] Seq=29692 Ack=459855 Win=11911 Len=0"
"9.247192","5.9.29.183","172.19.0.3","TCP","1516","9002 → 43520 [PSH, ACK] Seq=459855 Ack=29692 Win=65535 Len=1460 [TCP segment of a reassembled PDU]"
"9.247203","172.19.0.3","5.9.29.183","TCP","56","43520 → 9002 [ACK] Seq=29692 Ack=461315 Win=11903 Len=0"
"9.247204","5.9.29.183","172.19.0.3","TCP","563","9002 → 43520 [PSH, ACK] Seq=461315 Ack=29692 Win=65535 Len=507 [TCP segment of a reassembled PDU]"
"9.247208","172.19.0.3","5.9.29.183","TCP","56","43520 → 9002 [ACK] Seq=29692 Ack=461822 Win=11900 Len=0"
"9.247209","5.9.29.183","172.19.0.3","TLSv1.2","256","Application Data"
"9.247213","172.19.0.3","5.9.29.183","TCP","56","43520 → 9002 [ACK] Seq=29692 Ack=462022 Win=11899 Len=0"
"9.259659","5.9.29.183","172.19.0.3","TCP","1504","[TCP segment of a reassembled PDU]"
"9.259707","172.19.0.3","5.9.29.183","TCP","56","43520 → 9002 [ACK] Seq=29692 Ack=463470 Win=11911 Len=0"
"9.259848","5.9.29.183","172.19.0.3","TCP","1516","9002 → 43520 [PSH, ACK] Seq=463470 Ack=29692 Win=65535 Len=1460 [TCP segment of a reassembled PDU]"
"9.259901","172.19.0.3","5.9.29.183","TCP","56","43520 → 9002 [ACK] Seq=29692 Ack=464930 Win=11911 Len=0"
"9.259955","5.9.29.183","172.19.0.3","TLSv1.2","1492","Application Data [TCP segment of a reassembled PDU]"
"9.259964","172.19.0.3","5.9.29.183","TCP","56","43520 → 9002 [ACK] Seq=29692 Ack=466366 Win=11911 Len=0"
"9.263319","5.9.29.183","172.19.0.3","TLSv1.2","396","Application Data"
"9.263338","172.19.0.3","5.9.29.183","TCP","56","43520 → 9002 [ACK] Seq=29692 Ack=466706 Win=11911 Len=0"
"9.266211","172.19.0.3","5.9.29.183","TLSv1.2","599","Application Data"
"9.266454","5.9.29.183","172.19.0.3","TCP","56","9002 → 43520 [ACK] Seq=466706 Ack=30235 Win=65535 Len=0"
"9.489915","5.9.29.183","172.19.0.3","TLSv1.2","599","Application Data"
"9.490552","172.19.0.3","5.9.29.183","TLSv1.2","599","Application Data"
"9.490854","5.9.29.183","172.19.0.3","TCP","56","9002 → 43520 [ACK] Seq=467249 Ack=30778 Win=65535 Len=0"
"9.790800","5.9.29.183","172.19.0.3","TLSv1.2","599","Application Data"
"9.831679","172.19.0.3","5.9.29.183","TCP","56","43520 → 9002 [ACK] Seq=30778 Ack=467792 Win=11911 Len=0"
"9.887013","5.9.29.183","172.19.0.3","TCP","1516","[TCP segment of a reassembled PDU]"
"9.887037","172.19.0.3","5.9.29.183","TCP","56","43520 → 9002 [ACK] Seq=30778 Ack=469252 Win=11911 Len=0"
"9.887096","5.9.29.183","172.19.0.3","TCP","1516","9002 → 43520 [PSH, ACK] Seq=469252 Ack=30778 Win=65535 Len=1460 [TCP segment of a reassembled PDU]"
"9.887112","172.19.0.3","5.9.29.183","TCP","56","43520 → 9002 [ACK] Seq=30778 Ack=470712 Win=11903 Len=0"
"9.887114","5.9.29.183","172.19.0.3","TLSv1.2","763","Application Data"
"9.887119","172.19.0.3","5.9.29.183","TCP","56","43520 → 9002 [ACK] Seq=30778 Ack=471419 Win=11898 Len=0"
"9.913621","5.9.29.183","172.19.0.3","TCP","1504","[TCP segment of a reassembled PDU]"
"9.913663","172.19.0.3","5.9.29.183","TCP","56","43520 → 9002 [ACK] Seq=30778 Ack=472867 Win=11911 Len=0"
"9.913698","5.9.29.183","172.19.0.3","TCP","1516","9002 → 43520 [PSH, ACK] Seq=472867 Ack=30778 Win=65535 Len=1460 [TCP segment of a reassembled PDU]"
"9.913707","172.19.0.3","5.9.29.183","TCP","56","43520 → 9002 [ACK] Seq=30778 Ack=474327 Win=11903 Len=0"
"9.913709","5.9.29.183","172.19.0.3","TLSv1.2","1225","Application Data"
"9.913713","172.19.0.3","5.9.29.183","TCP","56","43520 → 9002 [ACK] Seq=30778 Ack=475496 Win=11895 Len=0"
"9.913806","5.9.29.183","172.19.0.3","TCP","1516","[TCP segment of a reassembled PDU]"
"9.913809","5.9.29.183","172.19.0.3","TCP","1516","9002 → 43520 [PSH, ACK] Seq=476956 Ack=30778 Win=65535 Len=1460 [TCP segment of a reassembled PDU]"
"9.913810","5.9.29.183","172.19.0.3","TLSv1.2","1516","Application Data [TCP segment of a reassembled PDU]"
"9.913812","5.9.29.183","172.19.0.3","TCP","1516","9002 → 43520 [PSH, ACK] Seq=479876 Ack=30778 Win=65535 Len=1460 [TCP segment of a reassembled PDU]"
"9.913813","5.9.29.183","172.19.0.3","TCP","1456","9002 → 43520 [PSH, ACK] Seq=481336 Ack=30778 Win=65535 Len=1400 [TCP segment of a reassembled PDU]"
"9.913821","172.19.0.3","5.9.29.183","TCP","56","43520 → 9002 [ACK] Seq=30778 Ack=476956 Win=11911 Len=0"
"9.913868","172.19.0.3","5.9.29.183","TCP","56","43520 → 9002 [ACK] Seq=30778 Ack=478416 Win=11903 Len=0"
"9.913898","172.19.0.3","5.9.29.183","TCP","56","43520 → 9002 [ACK] Seq=30778 Ack=479876 Win=11895 Len=0"
"9.913928","172.19.0.3","5.9.29.183","TCP","56","43520 → 9002 [ACK] Seq=30778 Ack=481336 Win=11887 Len=0"
"9.913954","172.19.0.3","5.9.29.183","TCP","56","43520 → 9002 [ACK] Seq=30778 Ack=482736 Win=11879 Len=0"
"9.929538","5.9.29.183","172.19.0.3","TLSv1.2","134","Application Data"
"9.929558","172.19.0.3","5.9.29.183","TCP","56","43520 → 9002 [ACK] Seq=30778 Ack=482814 Win=11911 Len=0"
"9.946636","5.9.29.183","172.19.0.3","TLSv1.2","1113","Application Data"
"9.946659","172.19.0.3","5.9.29.183","TCP","56","43520 → 9002 [ACK] Seq=30778 Ack=483871 Win=11911 Len=0"
"9.977175","5.9.29.183","172.19.0.3","TCP","1516","[TCP segment of a reassembled PDU]"
"9.977199","172.19.0.3","5.9.29.183","TCP","56","43520 → 9002 [ACK] Seq=30778 Ack=485331 Win=11911 Len=0"
"9.977249","5.9.29.183","172.19.0.3","TLSv1.2","1195","Application Data"
"9.977262","172.19.0.3","5.9.29.183","TCP","56","43520 → 9002 [ACK] Seq=30778 Ack=486470 Win=11903 Len=0"
