_ws.col.Time,_ws.col.Source,_ws.col.Destination,_ws.col.Protocol,_ws.col.Length,_ws.col.Info
"0.000000","54.38.73.16","172.18.0.2","TCP","68","21002 → 36876 [ACK] Seq=1 Ack=1 Win=1452 Len=0 TSval=2677789325 TSecr=1094560535"
"0.102287","172.18.0.2","54.38.73.16","TLSv1.2","611","Application Data"
"0.164219","54.38.73.16","172.18.0.2","TCP","68","21002 → 36876 [ACK] Seq=1 Ack=544 Win=1452 Len=0 TSval=2677789366 TSecr=1094560697"
"0.394507","54.38.73.16","172.18.0.2","TLSv1.2","611","Application Data"
"0.395703","172.18.0.2","54.38.73.16","TCP","1516","[TCP segment of a reassembled PDU]"
"0.395820","172.18.0.2","54.38.73.16","TLSv1.2","705","Application Data"
"0.419388","54.38.73.16","172.18.0.2","TCP","68","21002 → 36876 [ACK] Seq=544 Ack=2629 Win=1450 Len=0 TSval=2677789429 TSecr=1094560991"
"0.804894","54.38.73.16","172.18.0.2","TLSv1.2","1639","Application Data"
"0.805062","172.18.0.2","54.38.73.16","TCP","68","36876 → 21002 [ACK] Seq=2629 Ack=2115 Win=5600 Len=0 TSval=1094561400 TSecr=2677789513"
"0.812039","172.18.0.2","54.38.73.16","TLSv1.2","611","Application Data"
"0.823580","54.38.73.16","172.18.0.2","TLSv1.2","191","[TCP Spurious Retransmission] , Ignored Unknown Record"
"0.823623","172.18.0.2","54.38.73.16","TCP","80","[TCP Dup ACK 9#1] 36876 → 21002 [ACK] Seq=3172 Ack=2115 Win=5612 Len=0 TSval=1094561419 TSecr=2677789531 SLE=1992 SRE=2115"
"0.836493","54.38.73.16","172.18.0.2","TCP","68","21002 → 36876 [ACK] Seq=2115 Ack=3172 Win=1452 Len=0 TSval=2677789534 TSecr=1094561407"
"1.111841","54.38.73.16","172.18.0.2","TLSv1.2","611","Application Data"
"1.111886","172.18.0.2","54.38.73.16","TCP","68","36876 → 21002 [ACK] Seq=3172 Ack=2658 Win=5608 Len=0 TSval=1094561707 TSecr=2677789592"
"1.112867","172.18.0.2","54.38.73.16","TLSv1.2","611","Application Data"
"1.137825","54.38.73.16","172.18.0.2","TCP","68","21002 → 36876 [ACK] Seq=2658 Ack=3715 Win=1452 Len=0 TSval=2677789609 TSecr=1094561708"
"1.439867","54.38.73.16","172.18.0.2","TLSv1.2","3695","Application Data"
"1.439908","172.18.0.2","54.38.73.16","TCP","68","36876 → 21002 [ACK] Seq=3715 Ack=6285 Win=5584 Len=0 TSval=1094562035 TSecr=2677789684"
"1.464355","54.38.73.16","172.18.0.2","TLSv1.2","611","Application Data"
"1.464380","172.18.0.2","54.38.73.16","TCP","68","36876 → 21002 [ACK] Seq=3715 Ack=6828 Win=5593 Len=0 TSval=1094562059 TSecr=2677789691"
"1.473586","54.38.73.16","172.18.0.2","TCP","2964","[TCP segment of a reassembled PDU]"
"1.473610","172.18.0.2","54.38.73.16","TCP","68","36876 → 21002 [ACK] Seq=3715 Ack=9724 Win=5596 Len=0 TSval=1094562069 TSecr=2677789693"
"1.483288","54.38.73.16","172.18.0.2","TLSv1.2","5860","Application Data, Application Data"
"1.483312","172.18.0.2","54.38.73.16","TCP","68","36876 → 21002 [ACK] Seq=3715 Ack=15516 Win=5581 Len=0 TSval=1094562078 TSecr=2677789695"
"1.487935","54.38.73.16","172.18.0.2","TCP","2964","21002 → 36876 [ACK] Seq=15516 Ack=3715 Win=1452 Len=2896 TSval=2677789697 TSecr=1094562059 [TCP segment of a reassembled PDU]"
"1.487959","172.18.0.2","54.38.73.16","TCP","68","36876 → 21002 [ACK] Seq=3715 Ack=18412 Win=5596 Len=0 TSval=1094562083 TSecr=2677789697"
"1.498078","54.38.73.16","172.18.0.2","TLSv1.2","2964","Application Data, Application Data"
"1.498103","172.18.0.2","54.38.73.16","TCP","68","36876 → 21002 [ACK] Seq=3715 Ack=21308 Win=5596 Len=0 TSval=1094562093 TSecr=2677789699"
"1.507354","54.38.73.16","172.18.0.2","TLSv1.2","5860","Application Data, Application Data, Application Data"
"1.507417","172.18.0.2","54.38.73.16","TCP","68","36876 → 21002 [ACK] Seq=3715 Ack=27100 Win=5581 Len=0 TSval=1094562102 TSecr=2677789701"
"1.512101","54.38.73.16","172.18.0.2","TCP","2964","21002 → 36876 [ACK] Seq=27100 Ack=3715 Win=1452 Len=2896 TSval=2677789703 TSecr=1094562083 [TCP segment of a reassembled PDU]"
"1.512126","172.18.0.2","54.38.73.16","TCP","68","36876 → 21002 [ACK] Seq=3715 Ack=29996 Win=5596 Len=0 TSval=1094562107 TSecr=2677789703"
"1.522069","54.38.73.16","172.18.0.2","TLSv1.2","262","Application Data"
"1.522094","172.18.0.2","54.38.73.16","TCP","68","36876 → 21002 [ACK] Seq=3715 Ack=30190 Win=5595 Len=0 TSval=1094562117 TSecr=2677789705"
"1.522812","172.18.0.2","54.38.73.16","TLSv1.2","1125","Application Data"
"1.545836","54.38.73.16","172.18.0.2","TCP","68","21002 → 36876 [ACK] Seq=30190 Ack=4772 Win=1452 Len=0 TSval=2677789711 TSecr=1094562118"
"1.545852","172.18.0.2","54.38.73.16","TLSv1.2","611","Application Data"
"1.576060","54.38.73.16","172.18.0.2","TCP","68","21002 → 36876 [ACK] Seq=30190 Ack=5315 Win=1452 Len=0 TSval=2677789717 TSecr=1094562141"
"1.727443","193.111.115.210","172.18.0.2","TLSv1.2","611","Application Data"
"1.727508","172.18.0.2","193.111.115.210","TCP","68","49692 → 443 [ACK] Seq=1 Ack=544 Win=497 Len=0 TSval=2015709620 TSecr=1321579304"
"2.238040","54.38.73.16","172.18.0.2","TLSv1.2","611","Application Data"
"2.238083","172.18.0.2","54.38.73.16","TCP","68","36876 → 21002 [ACK] Seq=5315 Ack=30733 Win=5608 Len=0 TSval=1094562833 TSecr=2677789808"
"2.238088","54.38.73.16","172.18.0.2","TLSv1.2","611","[TCP Spurious Retransmission] , Application Data"
"2.238097","172.18.0.2","54.38.73.16","TCP","80","[TCP Dup ACK 43#1] 36876 → 21002 [ACK] Seq=5315 Ack=30733 Win=5608 Len=0 TSval=1094562833 TSecr=2677789866 SLE=30190 SRE=30733"
"2.239110","172.18.0.2","54.38.73.16","TLSv1.2","611","Application Data"
"2.263605","54.38.73.16","172.18.0.2","TCP","68","21002 → 36876 [ACK] Seq=30733 Ack=5858 Win=1452 Len=0 TSval=2677789890 TSecr=1094562834"
"2.475090","54.38.73.16","172.18.0.2","TLSv1.2","3695","Application Data"
"2.475115","172.18.0.2","54.38.73.16","TCP","68","36876 → 21002 [ACK] Seq=5858 Ack=34360 Win=5584 Len=0 TSval=1094563070 TSecr=2677789942"
"2.492390","54.38.73.16","172.18.0.2","TLSv1.2","7308","Application Data"
"2.492437","172.18.0.2","54.38.73.16","TCP","68","36876 → 21002 [ACK] Seq=5858 Ack=41600 Win=5565 Len=0 TSval=1094563087 TSecr=2677789948"
"2.498995","54.38.73.16","172.18.0.2","TLSv1.2","2964","Application Data [TCP segment of a reassembled PDU]"
"2.499020","172.18.0.2","54.38.73.16","TCP","68","36876 → 21002 [ACK] Seq=5858 Ack=44496 Win=5596 Len=0 TSval=1094563094 TSecr=2677789949"
"2.518460","54.38.73.16","172.18.0.2","TCP","1516","21002 → 36876 [ACK] Seq=44496 Ack=5858 Win=1452 Len=1448 TSval=2677789950 TSecr=1094563070 [TCP segment of a reassembled PDU]"
"2.518485","172.18.0.2","54.38.73.16","TCP","68","36876 → 21002 [ACK] Seq=5858 Ack=45944 Win=5593 Len=0 TSval=1094563114 TSecr=2677789950"
"2.525422","54.38.73.16","172.18.0.2","TLSv1.2","5860","Application Data, Application Data, Application Data"
"2.525446","172.18.0.2","54.38.73.16","TCP","68","36876 → 21002 [ACK] Seq=5858 Ack=51736 Win=5581 Len=0 TSval=1094563121 TSecr=2677789956"
"2.525468","54.38.73.16","172.18.0.2","TCP","2964","21002 → 36876 [ACK] Seq=51736 Ack=5858 Win=1452 Len=2896 TSval=2677789956 TSecr=1094563094 [TCP segment of a reassembled PDU]"
"2.525482","172.18.0.2","54.38.73.16","TCP","68","36876 → 21002 [ACK] Seq=5858 Ack=54632 Win=5566 Len=0 TSval=1094563121 TSecr=2677789956"
"2.536426","54.38.73.16","172.18.0.2","TLSv1.2","1516","Application Data [TCP segment of a reassembled PDU]"
"2.536451","172.18.0.2","54.38.73.16","TCP","68","36876 → 21002 [ACK] Seq=5858 Ack=56080 Win=5593 Len=0 TSval=1094563132 TSecr=2677789959"
"2.544514","54.38.73.16","172.18.0.2","TLSv1.2","1516","Application Data [TCP segment of a reassembled PDU]"
"2.544540","172.18.0.2","54.38.73.16","TCP","68","36876 → 21002 [ACK] Seq=5858 Ack=57528 Win=5593 Len=0 TSval=1094563140 TSecr=2677789960"
"2.544955","172.18.0.2","54.38.73.16","TLSv1.2","611","Application Data"
"2.550397","54.38.73.16","172.18.0.2","TLSv1.2","8756","Application Data, Application Data"
"2.550447","172.18.0.2","54.38.73.16","TCP","68","36876 → 21002 [ACK] Seq=6401 Ack=66216 Win=5566 Len=0 TSval=1094563145 TSecr=2677789962"
"2.563164","54.38.73.16","172.18.0.2","TLSv1.2","1516","Application Data [TCP segment of a reassembled PDU]"
"2.563187","172.18.0.2","54.38.73.16","TCP","68","36876 → 21002 [ACK] Seq=6401 Ack=67664 Win=5593 Len=0 TSval=1094563158 TSecr=2677789965"
"2.567894","54.38.73.16","172.18.0.2","TLSv1.2","1516","Application Data [TCP segment of a reassembled PDU]"
"2.567918","172.18.0.2","54.38.73.16","TCP","68","36876 → 21002 [ACK] Seq=6401 Ack=69112 Win=5593 Len=0 TSval=1094563163 TSecr=2677789967"
"2.574604","54.38.73.16","172.18.0.2","TLSv1.2","8756","Application Data, Application Data, Application Data"
"2.574638","172.18.0.2","54.38.73.16","TCP","68","36876 → 21002 [ACK] Seq=6401 Ack=77800 Win=5566 Len=0 TSval=1094563170 TSecr=2677789968"
"2.592488","54.38.73.16","172.18.0.2","TLSv1.2","2964","Application Data [TCP segment of a reassembled PDU]"
"2.592512","172.18.0.2","54.38.73.16","TCP","68","36876 → 21002 [ACK] Seq=6401 Ack=80696 Win=5596 Len=0 TSval=1094563188 TSecr=2677789973"
"2.599139","54.38.73.16","172.18.0.2","TLSv1.2","8756","Application Data, Application Data, Application Data"
"2.599271","172.18.0.2","54.38.73.16","TCP","68","36876 → 21002 [ACK] Seq=6401 Ack=89384 Win=5566 Len=0 TSval=1094563194 TSecr=2677789974"
"2.599788","172.18.0.2","54.38.73.16","TLSv1.2","1125","Application Data"
"2.617474","54.38.73.16","172.18.0.2","TLSv1.2","2964","Application Data [TCP segment of a reassembled PDU]"
"2.617500","172.18.0.2","54.38.73.16","TCP","68","36876 → 21002 [ACK] Seq=7458 Ack=92280 Win=5596 Len=0 TSval=1094563213 TSecr=2677789979"
"2.623975","54.38.73.16","172.18.0.2","TLSv1.2","2352","Application Data"
"2.623999","172.18.0.2","54.38.73.16","TCP","68","36876 → 21002 [ACK] Seq=7458 Ack=94564 Win=5598 Len=0 TSval=1094563219 TSecr=2677789981"
"2.665808","54.38.73.16","172.18.0.2","TCP","68","21002 → 36876 [ACK] Seq=94564 Ack=7458 Win=1452 Len=0 TSval=2677789991 TSecr=1094563195"
"2.665839","172.18.0.2","54.38.73.16","TLSv1.2","611","Application Data"
"2.689995","54.38.73.16","172.18.0.2","TCP","68","21002 → 36876 [ACK] Seq=94564 Ack=8001 Win=1452 Len=0 TSval=2677789997 TSecr=1094563261"
"3.165093","54.38.73.16","172.18.0.2","TLSv1.2","611","Application Data"
"3.166083","172.18.0.2","54.38.73.16","TLSv1.2","611","Application Data"
"3.191172","54.38.73.16","172.18.0.2","TCP","68","21002 → 36876 [ACK] Seq=95107 Ack=8544 Win=1452 Len=0 TSval=2677790122 TSecr=1094563761"
"3.470414","54.38.73.16","172.18.0.2","TLSv1.2","611","Application Data"
"3.511657","172.18.0.2","54.38.73.16","TCP","68","36876 → 21002 [ACK] Seq=8544 Ack=95650 Win=5612 Len=0 TSval=1094564107 TSecr=2677790192"
"3.533601","54.38.73.16","172.18.0.2","TCP","2964","[TCP segment of a reassembled PDU]"
"3.533626","172.18.0.2","54.38.73.16","TCP","68","36876 → 21002 [ACK] Seq=8544 Ack=98546 Win=5596 Len=0 TSval=1094564129 TSecr=2677790208"
"3.535964","54.38.73.16","172.18.0.2","TLSv1.2","799","Application Data"
"3.536008","172.18.0.2","54.38.73.16","TCP","68","36876 → 21002 [ACK] Seq=8544 Ack=99277 Win=5593 Len=0 TSval=1094564131 TSecr=2677790209"
"3.596896","54.38.73.16","172.18.0.2","TLSv1.2","3695","Application Data"
"3.596920","172.18.0.2","54.38.73.16","TCP","68","36876 → 21002 [ACK] Seq=8544 Ack=102904 Win=5580 Len=0 TSval=1094564192 TSecr=2677790224"
"3.606868","54.38.73.16","172.18.0.2","TCP","2964","[TCP segment of a reassembled PDU]"
"3.606893","172.18.0.2","54.38.73.16","TCP","68","36876 → 21002 [ACK] Seq=8544 Ack=105800 Win=5596 Len=0 TSval=1094564202 TSecr=2677790226"
"3.620774","54.38.73.16","172.18.0.2","TLSv1.2","1342","Application Data, Application Data"
"3.620799","172.18.0.2","54.38.73.16","TCP","68","36876 → 21002 [ACK] Seq=8544 Ack=107074 Win=5593 Len=0 TSval=1094564216 TSecr=2677790230"
"3.640299","54.38.73.16","172.18.0.2","TCP","2964","[TCP segment of a reassembled PDU]"
"3.640324","172.18.0.2","54.38.73.16","TCP","68","36876 → 21002 [ACK] Seq=8544 Ack=109970 Win=5596 Len=0 TSval=1094564235 TSecr=2677790234"
"3.645253","54.38.73.16","172.18.0.2","TLSv1.2","799","Application Data"
"3.645277","172.18.0.2","54.38.73.16","TCP","68","36876 → 21002 [ACK] Seq=8544 Ack=110701 Win=5593 Len=0 TSval=1094564240 TSecr=2677790236"
"3.669356","54.38.73.16","172.18.0.2","TLSv1.2","611","Application Data"
"3.669390","172.18.0.2","54.38.73.16","TCP","68","36876 → 21002 [ACK] Seq=8544 Ack=111244 Win=5593 Len=0 TSval=1094564264 TSecr=2677790242"
"3.671299","54.38.73.16","172.18.0.2","TCP","2964","[TCP segment of a reassembled PDU]"
"3.671320","172.18.0.2","54.38.73.16","TCP","68","36876 → 21002 [ACK] Seq=8544 Ack=114140 Win=5596 Len=0 TSval=1094564266 TSecr=2677790242"
"3.694187","54.38.73.16","172.18.0.2","TLSv1.2","799","Application Data"
"3.694221","172.18.0.2","54.38.73.16","TCP","68","36876 → 21002 [ACK] Seq=8544 Ack=114871 Win=5593 Len=0 TSval=1094564289 TSecr=2677790248"
"3.694394","54.38.73.16","172.18.0.2","TCP","2964","[TCP segment of a reassembled PDU]"
"3.694414","172.18.0.2","54.38.73.16","TCP","68","36876 → 21002 [ACK] Seq=8544 Ack=117767 Win=5596 Len=0 TSval=1094564289 TSecr=2677790248"
"3.718631","54.38.73.16","172.18.0.2","TLSv1.2","1516","Application Data [TCP segment of a reassembled PDU]"
"3.718655","172.18.0.2","54.38.73.16","TCP","68","36876 → 21002 [ACK] Seq=8544 Ack=119215 Win=5593 Len=0 TSval=1094564314 TSecr=2677790254"
"3.719308","54.38.73.16","172.18.0.2","TLSv1.2","922","Application Data"
"3.719332","172.18.0.2","54.38.73.16","TCP","68","36876 → 21002 [ACK] Seq=8544 Ack=120069 Win=5593 Len=0 TSval=1094564314 TSecr=2677790254"
"3.728166","54.38.73.16","172.18.0.2","TCP","2964","[TCP segment of a reassembled PDU]"
"3.728191","172.18.0.2","54.38.73.16","TCP","68","36876 → 21002 [ACK] Seq=8544 Ack=122965 Win=5596 Len=0 TSval=1094564323 TSecr=2677790257"
"3.739592","54.38.73.16","172.18.0.2","TLSv1.2","2964","Application Data [TCP segment of a reassembled PDU]"
"3.739618","172.18.0.2","54.38.73.16","TCP","68","36876 → 21002 [ACK] Seq=8544 Ack=125861 Win=5596 Len=0 TSval=1094564335 TSecr=2677790259"
"3.740067","172.18.0.2","54.38.73.16","TLSv1.2","611","Application Data"
"3.742881","54.38.73.16","172.18.0.2","TLSv1.2","502","Application Data"
"3.743038","172.18.0.2","54.38.73.16","TCP","68","36876 → 21002 [ACK] Seq=9087 Ack=126295 Win=5612 Len=0 TSval=1094564338 TSecr=2677790260"
"3.763978","54.38.73.16","172.18.0.2","TCP","68","21002 → 36876 [ACK] Seq=126295 Ack=9087 Win=1452 Len=0 TSval=2677790266 TSecr=1094564335"
"3.772308","54.38.73.16","172.18.0.2","TLSv1.2","2667","Application Data"
"3.772461","172.18.0.2","54.38.73.16","TCP","68","36876 → 21002 [ACK] Seq=9087 Ack=128894 Win=5597 Len=0 TSval=1094564368 TSecr=2677790267"
"3.781011","54.38.73.16","172.18.0.2","TCP","2964","[TCP segment of a reassembled PDU]"
"3.781166","172.18.0.2","54.38.73.16","TCP","68","36876 → 21002 [ACK] Seq=9087 Ack=131790 Win=5596 Len=0 TSval=1094564376 TSecr=2677790269"
"3.796507","54.38.73.16","172.18.0.2","TLSv1.2","799","Application Data"
"3.796670","172.18.0.2","54.38.73.16","TCP","68","36876 → 21002 [ACK] Seq=9087 Ack=132521 Win=5612 Len=0 TSval=1094564392 TSecr=2677790274"
"3.812180","54.38.73.16","172.18.0.2","TCP","2964","[TCP segment of a reassembled PDU]"
"3.812342","172.18.0.2","54.38.73.16","TCP","68","36876 → 21002 [ACK] Seq=9087 Ack=135417 Win=5596 Len=0 TSval=1094564407 TSecr=2677790277"
"3.820956","54.38.73.16","172.18.0.2","TLSv1.2","799","Application Data"
"3.821110","172.18.0.2","54.38.73.16","TCP","68","36876 → 21002 [ACK] Seq=9087 Ack=136148 Win=5612 Len=0 TSval=1094564416 TSecr=2677790280"
"3.821510","172.18.0.2","54.38.73.16","TLSv1.2","611","Application Data"
"3.823595","54.38.73.16","172.18.0.2","TCP","1516","[TCP segment of a reassembled PDU]"
"3.832949","54.38.73.16","172.18.0.2","TLSv1.2","2964","Application Data [TCP segment of a reassembled PDU]"
"3.833105","172.18.0.2","54.38.73.16","TCP","68","36876 → 21002 [ACK] Seq=9630 Ack=140492 Win=5596 Len=0 TSval=1094564428 TSecr=2677790280"
"3.845550","54.38.73.16","172.18.0.2","TLSv1.2","922","Application Data"
"3.845726","172.18.0.2","54.38.73.16","TCP","68","36876 → 21002 [ACK] Seq=9630 Ack=141346 Win=5612 Len=0 TSval=1094564441 TSecr=2677790286"
"3.876533","54.38.73.16","172.18.0.2","TLSv1.2","611","Application Data"
"3.876563","172.18.0.2","54.38.73.16","TLSv1.2","1154","Application Data, Application Data"
"3.941073","54.38.73.16","172.18.0.2","TCP","68","21002 → 36876 [ACK] Seq=141889 Ack=10716 Win=1452 Len=0 TSval=2677790310 TSecr=1094564472"
"4.169407","54.38.73.16","172.18.0.2","TLSv1.2","611","Application Data"
"4.170409","172.18.0.2","54.38.73.16","TLSv1.2","611","Application Data"
"4.194891","54.38.73.16","172.18.0.2","TCP","68","21002 → 36876 [ACK] Seq=142432 Ack=11259 Win=1452 Len=0 TSval=2677790373 TSecr=1094564765"
"4.804744","54.38.73.16","172.18.0.2","TLSv1.2","611","Application Data"
"4.825459","54.38.73.16","172.18.0.2","TLSv1.2","4412","Application Data"
"4.825619","172.18.0.2","54.38.73.16","TCP","68","36876 → 21002 [ACK] Seq=11259 Ack=147319 Win=5580 Len=0 TSval=1094565421 TSecr=2677790525"
"4.826602","54.38.73.16","172.18.0.2","TLSv1.2","2964","Application Data [TCP segment of a reassembled PDU]"
"4.826622","172.18.0.2","54.38.73.16","TCP","68","36876 → 21002 [ACK] Seq=11259 Ack=150215 Win=5596 Len=0 TSval=1094565422 TSecr=2677790531"
"4.838405","54.38.73.16","172.18.0.2","TLSv1.2","2964","Application Data [TCP segment of a reassembled PDU]"
"4.838428","172.18.0.2","54.38.73.16","TCP","68","36876 → 21002 [ACK] Seq=11259 Ack=153111 Win=5596 Len=0 TSval=1094565433 TSecr=2677790534"
"4.849696","54.38.73.16","172.18.0.2","TLSv1.2","842","Application Data"
"4.871192","54.38.73.16","172.18.0.2","TCP","2964","[TCP segment of a reassembled PDU]"
"4.871216","172.18.0.2","54.38.73.16","TCP","68","36876 → 21002 [ACK] Seq=11259 Ack=156781 Win=5596 Len=0 TSval=1094565466 TSecr=2677790537"
"4.890653","54.38.73.16","172.18.0.2","TLSv1.2","7308","Application Data, Application Data"
"4.890822","172.18.0.2","54.38.73.16","TCP","68","36876 → 21002 [ACK] Seq=11259 Ack=164021 Win=5565 Len=0 TSval=1094565486 TSecr=2677790547"
"4.895223","54.38.73.16","172.18.0.2","TLSv1.2","1327","Application Data"
"4.903202","54.38.73.16","172.18.0.2","TCP","1516","[TCP segment of a reassembled PDU]"
"4.903226","172.18.0.2","54.38.73.16","TCP","68","36876 → 21002 [ACK] Seq=11259 Ack=166728 Win=5593 Len=0 TSval=1094565498 TSecr=2677790548"
"4.927527","54.38.73.16","172.18.0.2","TLSv1.2","705","Application Data"
"4.971578","172.18.0.2","54.38.73.16","TCP","68","36876 → 21002 [ACK] Seq=11259 Ack=167365 Win=5612 Len=0 TSval=1094565567 TSecr=2677790556"
"5.331611","54.38.73.16","172.18.0.2","TLSv1.2","2153","Application Data"
"5.331639","172.18.0.2","54.38.73.16","TCP","68","36876 → 21002 [ACK] Seq=11259 Ack=169450 Win=5599 Len=0 TSval=1094565927 TSecr=2677790657"
"5.332267","172.18.0.2","54.38.73.16","TLSv1.2","611","Application Data"
"5.356094","54.38.73.16","172.18.0.2","TCP","68","21002 → 36876 [ACK] Seq=169450 Ack=11802 Win=1452 Len=0 TSval=2677790664 TSecr=1094565927"
"5.356109","172.18.0.2","54.38.73.16","TLSv1.2","611","Application Data"
"5.380931","54.38.73.16","172.18.0.2","TCP","68","21002 → 36876 [ACK] Seq=169450 Ack=12345 Win=1452 Len=0 TSval=2677790670 TSecr=1094565951"
"5.924255","54.38.73.16","172.18.0.2","TLSv1.2","611","Application Data"
"5.924298","172.18.0.2","54.38.73.16","TCP","68","36876 → 21002 [ACK] Seq=12345 Ack=169993 Win=5608 Len=0 TSval=1094566519 TSecr=2677790729"
"5.924302","54.38.73.16","172.18.0.2","TLSv1.2","611","[TCP Spurious Retransmission] , Application Data"
"5.924311","172.18.0.2","54.38.73.16","TCP","80","[TCP Dup ACK 170#1] 36876 → 21002 [ACK] Seq=12345 Ack=169993 Win=5608 Len=0 TSval=1094566519 TSecr=2677790788 SLE=169450 SRE=169993"
"5.925305","172.18.0.2","54.38.73.16","TLSv1.2","611","Application Data"
"5.949976","54.38.73.16","172.18.0.2","TCP","68","21002 → 36876 [ACK] Seq=169993 Ack=12888 Win=1452 Len=0 TSval=2677790812 TSecr=1094566520"
"6.264130","54.38.73.16","172.18.0.2","TLSv1.2","611","Application Data"
"6.264173","172.18.0.2","54.38.73.16","TCP","68","36876 → 21002 [ACK] Seq=12888 Ack=170536 Win=5608 Len=0 TSval=1094566859 TSecr=2677790890"
"6.295391","54.38.73.16","172.18.0.2","TLSv1.2","3695","Application Data"
"6.295416","172.18.0.2","54.38.73.16","TCP","68","36876 → 21002 [ACK] Seq=12888 Ack=174163 Win=5580 Len=0 TSval=1094566890 TSecr=2677790898"
"6.307827","54.38.73.16","172.18.0.2","TCP","2964","[TCP segment of a reassembled PDU]"
"6.307854","172.18.0.2","54.38.73.16","TCP","68","36876 → 21002 [ACK] Seq=12888 Ack=177059 Win=5596 Len=0 TSval=1094566903 TSecr=2677790902"
"6.320495","54.38.73.16","172.18.0.2","TLSv1.2","799","Application Data"
"6.320519","172.18.0.2","54.38.73.16","TCP","68","36876 → 21002 [ACK] Seq=12888 Ack=177790 Win=5593 Len=0 TSval=1094566916 TSecr=2677790904"
"6.320540","54.38.73.16","172.18.0.2","TCP","2964","[TCP segment of a reassembled PDU]"
"6.320554","172.18.0.2","54.38.73.16","TCP","68","36876 → 21002 [ACK] Seq=12888 Ack=180686 Win=5578 Len=0 TSval=1094566916 TSecr=2677790905"
"6.333471","54.38.73.16","172.18.0.2","TLSv1.2","4412","Application Data [TCP segment of a reassembled PDU]"
"6.333495","172.18.0.2","54.38.73.16","TCP","68","36876 → 21002 [ACK] Seq=12888 Ack=185030 Win=5580 Len=0 TSval=1094566929 TSecr=2677790908"
"6.343314","54.38.73.16","172.18.0.2","TLSv1.2","2964","Application Data, Application Data"
"6.343338","172.18.0.2","54.38.73.16","TCP","68","36876 → 21002 [ACK] Seq=12888 Ack=187926 Win=5577 Len=0 TSval=1094566938 TSecr=2677790910"
"6.345198","54.38.73.16","172.18.0.2","TLSv1.2","1899","Application Data, Application Data"
"6.345222","172.18.0.2","54.38.73.16","TCP","68","36876 → 21002 [ACK] Seq=12888 Ack=189757 Win=5600 Len=0 TSval=1094566940 TSecr=2677790911"
"6.345710","172.18.0.2","54.38.73.16","TLSv1.2","611","Application Data"
"6.353031","54.38.73.16","172.18.0.2","TCP","2964","[TCP segment of a reassembled PDU]"
"6.353055","172.18.0.2","54.38.73.16","TCP","68","36876 → 21002 [ACK] Seq=13431 Ack=192653 Win=5596 Len=0 TSval=1094566948 TSecr=2677790913"
"6.357207","54.38.73.16","172.18.0.2","TLSv1.2","2964","Application Data [TCP segment of a reassembled PDU]"
"6.357237","172.18.0.2","54.38.73.16","TCP","68","36876 → 21002 [ACK] Seq=13431 Ack=195549 Win=5596 Len=0 TSval=1094566952 TSecr=2677790914"
"6.365002","54.38.73.16","172.18.0.2","TCP","1516","21002 → 36876 [ACK] Seq=195549 Ack=12888 Win=1452 Len=1448 TSval=2677790916 TSecr=1094566929 [TCP segment of a reassembled PDU]"
"6.365027","172.18.0.2","54.38.73.16","TCP","68","36876 → 21002 [ACK] Seq=13431 Ack=196997 Win=5593 Len=0 TSval=1094566960 TSecr=2677790916"
"6.368391","54.38.73.16","172.18.0.2","TLSv1.2","1516","Application Data [TCP segment of a reassembled PDU]"
"6.368416","172.18.0.2","54.38.73.16","TCP","68","36876 → 21002 [ACK] Seq=13431 Ack=198445 Win=5593 Len=0 TSval=1094566963 TSecr=2677790916"
"6.370315","54.38.73.16","172.18.0.2","TLSv1.2","1233","Application Data"
"6.370340","172.18.0.2","54.38.73.16","TCP","68","36876 → 21002 [ACK] Seq=13431 Ack=199610 Win=5604 Len=0 TSval=1094566965 TSecr=2677790917"
"6.370359","54.38.73.16","172.18.0.2","TCP","68","21002 → 36876 [ACK] Seq=199610 Ack=13431 Win=1452 Len=0 TSval=2677790917 TSecr=1094566941"
"6.370376","172.18.0.2","54.38.73.16","TLSv1.2","611","Application Data"
"6.395904","54.38.73.16","172.18.0.2","TCP","68","21002 → 36876 [ACK] Seq=199610 Ack=13974 Win=1452 Len=0 TSval=2677790924 TSecr=1094566965"
"6.395936","172.18.0.2","54.38.73.16","TLSv1.2","611","Application Data"
"6.421013","54.38.73.16","172.18.0.2","TCP","68","21002 → 36876 [ACK] Seq=199610 Ack=14517 Win=1448 Len=0 TSval=2677790930 TSecr=1094566991"
"6.744757","54.38.73.16","172.18.0.2","TLSv1.2","611","Application Data"
"6.745800","172.18.0.2","54.38.73.16","TLSv1.2","611","Application Data"
"6.770988","54.38.73.16","172.18.0.2","TCP","68","21002 → 36876 [ACK] Seq=200153 Ack=15060 Win=1452 Len=0 TSval=2677791017 TSecr=1094567341"
"7.274341","54.38.73.16","172.18.0.2","TLSv1.2","611","Application Data"
"7.315646","172.18.0.2","54.38.73.16","TCP","68","36876 → 21002 [ACK] Seq=15060 Ack=200696 Win=5612 Len=0 TSval=1094567911 TSecr=2677791143"
"7.372148","54.38.73.16","172.18.0.2","TLSv1.2","3695","Application Data"
"7.372192","172.18.0.2","54.38.73.16","TCP","68","36876 → 21002 [ACK] Seq=15060 Ack=204323 Win=5584 Len=0 TSval=1094567967 TSecr=2677791167"
"7.393856","54.38.73.16","172.18.0.2","TCP","2964","[TCP segment of a reassembled PDU]"
"7.393881","172.18.0.2","54.38.73.16","TCP","68","36876 → 21002 [ACK] Seq=15060 Ack=207219 Win=5596 Len=0 TSval=1094567989 TSecr=2677791173"
"7.395563","54.38.73.16","172.18.0.2","TLSv1.2","799","Application Data"
"7.395590","172.18.0.2","54.38.73.16","TCP","68","36876 → 21002 [ACK] Seq=15060 Ack=207950 Win=5593 Len=0 TSval=1094567991 TSecr=2677791174"
"7.441849","54.38.73.16","172.18.0.2","TLSv1.2","3695","Application Data"
"7.441874","172.18.0.2","54.38.73.16","TCP","68","36876 → 21002 [ACK] Seq=15060 Ack=211577 Win=5580 Len=0 TSval=1094568037 TSecr=2677791185"
"7.451264","54.38.73.16","172.18.0.2","TLSv1.2","8756","Application Data, Application Data"
"7.451289","172.18.0.2","54.38.73.16","TCP","68","36876 → 21002 [ACK] Seq=15060 Ack=220265 Win=5566 Len=0 TSval=1094568046 TSecr=2677791187"
"7.469591","54.38.73.16","172.18.0.2","TCP","2964","21002 → 36876 [ACK] Seq=220265 Ack=15060 Win=1452 Len=2896 TSval=2677791191 TSecr=1094568037 [TCP segment of a reassembled PDU]"
"7.469615","172.18.0.2","54.38.73.16","TCP","68","36876 → 21002 [ACK] Seq=15060 Ack=223161 Win=5596 Len=0 TSval=1094568065 TSecr=2677791191"
"7.475751","54.38.73.16","172.18.0.2","TLSv1.2","9790","Application Data, Application Data, Application Data, Application Data, Application Data, Application Data"
"7.475794","172.18.0.2","54.38.73.16","TCP","68","36876 → 21002 [ACK] Seq=15060 Ack=232883 Win=5550 Len=0 TSval=1094568071 TSecr=2677791193"
"7.476739","172.18.0.2","54.38.73.16","TLSv1.2","611","Application Data"
"7.494470","54.38.73.16","172.18.0.2","TCP","2964","[TCP segment of a reassembled PDU]"
"7.494496","172.18.0.2","54.38.73.16","TCP","68","36876 → 21002 [ACK] Seq=15603 Ack=235779 Win=5596 Len=0 TSval=1094568090 TSecr=2677791198"
"7.499885","54.38.73.16","172.18.0.2","TLSv1.2","8756","Application Data, Application Data, Application Data"
"7.499910","172.18.0.2","54.38.73.16","TCP","68","36876 → 21002 [ACK] Seq=15603 Ack=244467 Win=5566 Len=0 TSval=1094568095 TSecr=2677791199"
"7.500800","54.38.73.16","172.18.0.2","TCP","68","21002 → 36876 [ACK] Seq=244467 Ack=15603 Win=1452 Len=0 TSval=2677791200 TSecr=1094568072"
"7.508844","54.38.73.16","172.18.0.2","TLSv1.2","1516","Application Data, Application Data"
"7.508868","172.18.0.2","54.38.73.16","TCP","68","36876 → 21002 [ACK] Seq=15603 Ack=245915 Win=5593 Len=0 TSval=1094568104 TSecr=2677791202"
"7.509392","172.18.0.2","54.38.73.16","TLSv1.2","611","Application Data"
"7.518467","54.38.73.16","172.18.0.2","TCP","1516","21002 → 36876 [ACK] Seq=245915 Ack=15603 Win=1452 Len=1448 TSval=2677791204 TSecr=1094568090 [TCP segment of a reassembled PDU]"
"7.518492","172.18.0.2","54.38.73.16","TCP","68","36876 → 21002 [ACK] Seq=16146 Ack=247363 Win=5593 Len=0 TSval=1094568114 TSecr=2677791204"
"7.524470","54.38.73.16","172.18.0.2","TLSv1.2","11652","Application Data, Application Data, Application Data, Application Data"
"7.524496","172.18.0.2","54.38.73.16","TCP","68","36876 → 21002 [ACK] Seq=16146 Ack=258947 Win=5551 Len=0 TSval=1094568120 TSecr=2677791206"
"7.543344","54.38.73.16","172.18.0.2","TLSv1.2","2964","Application Data [TCP segment of a reassembled PDU]"
"7.543377","172.18.0.2","54.38.73.16","TLSv1.2","611","Application Data"
"7.548991","54.38.73.16","172.18.0.2","TLSv1.2","5380","Application Data, Application Data"
"7.549162","172.18.0.2","54.38.73.16","TCP","68","36876 → 21002 [ACK] Seq=16689 Ack=267155 Win=5583 Len=0 TSval=1094568144 TSecr=2677791212"
"7.589796","54.38.73.16","172.18.0.2","TLSv1.2","611","Application Data"
"7.625799","54.38.73.16","172.18.0.2","TCP","1516","[TCP segment of a reassembled PDU]"
"7.625823","172.18.0.2","54.38.73.16","TCP","68","36876 → 21002 [ACK] Seq=16689 Ack=269146 Win=5593 Len=0 TSval=1094568221 TSecr=2677791222"
"7.649673","54.38.73.16","172.18.0.2","TLSv1.2","191","Application Data"
"7.659890","172.18.0.2","54.38.73.16","TLSv1.2","611","Application Data"
"7.725761","54.38.73.16","172.18.0.2","TCP","68","21002 → 36876 [ACK] Seq=269269 Ack=17232 Win=1452 Len=0 TSval=2677791256 TSecr=1094568255"
"8.076910","54.38.73.16","172.18.0.2","TLSv1.2","611","Application Data"
"8.077870","172.18.0.2","54.38.73.16","TLSv1.2","611","Application Data"
"8.103056","54.38.73.16","172.18.0.2","TCP","68","21002 → 36876 [ACK] Seq=269812 Ack=17775 Win=1452 Len=0 TSval=2677791350 TSecr=1094568673"
"8.330789","54.38.73.16","172.18.0.2","TLSv1.2","611","Application Data"
"8.341867","54.38.73.16","172.18.0.2","TCP","2964","[TCP segment of a reassembled PDU]"
"8.342043","172.18.0.2","54.38.73.16","TCP","68","36876 → 21002 [ACK] Seq=17775 Ack=273251 Win=5596 Len=0 TSval=1094568937 TSecr=2677791407"
"8.352364","54.38.73.16","172.18.0.2","TLSv1.2","4412","Application Data [TCP segment of a reassembled PDU]"
"8.352528","172.18.0.2","54.38.73.16","TCP","68","36876 → 21002 [ACK] Seq=17775 Ack=277595 Win=5580 Len=0 TSval=1094568948 TSecr=2677791413"
"8.364971","54.38.73.16","172.18.0.2","TLSv1.2","2964","Application Data, Application Data"
"8.364997","172.18.0.2","54.38.73.16","TCP","68","36876 → 21002 [ACK] Seq=17775 Ack=280491 Win=5596 Len=0 TSval=1094568960 TSecr=2677791416"
"8.370413","54.38.73.16","172.18.0.2","TLSv1.2","1356","Application Data"
"8.375489","54.38.73.16","172.18.0.2","TLSv1.2","5860","Application Data"
"8.375637","172.18.0.2","54.38.73.16","TCP","68","36876 → 21002 [ACK] Seq=17775 Ack=287571 Win=5581 Len=0 TSval=1094568971 TSecr=2677791417"
"8.375640","54.38.73.16","172.18.0.2","TCP","1516","21002 → 36876 [ACK] Seq=287571 Ack=17775 Win=1452 Len=1448 TSval=2677791419 TSecr=1094568948 [TCP segment of a reassembled PDU]"
"8.399841","54.38.73.16","172.18.0.2","TLSv1.2","596","Application Data"
"8.399866","172.18.0.2","54.38.73.16","TCP","68","36876 → 21002 [ACK] Seq=17775 Ack=289547 Win=5593 Len=0 TSval=1094568995 TSecr=2677791419"
"8.447954","54.38.73.16","172.18.0.2","TLSv1.2","4145","Application Data"
"8.448135","172.18.0.2","54.38.73.16","TCP","68","36876 → 21002 [ACK] Seq=17775 Ack=293624 Win=5580 Len=0 TSval=1094569043 TSecr=2677791436"
"8.451425","54.38.73.16","172.18.0.2","TLSv1.2","2964","Application Data"
"8.451450","172.18.0.2","54.38.73.16","TCP","68","36876 → 21002 [ACK] Seq=17775 Ack=296520 Win=5596 Len=0 TSval=1094569047 TSecr=2677791437"
"8.451875","172.18.0.2","54.38.73.16","TLSv1.2","611","Application Data"
"8.462464","54.38.73.16","172.18.0.2","TLSv1.2","5860","Application Data, Application Data"
"8.462608","172.18.0.2","54.38.73.16","TCP","68","36876 → 21002 [ACK] Seq=18318 Ack=302312 Win=5581 Len=0 TSval=1094569058 TSecr=2677791440"
"8.475027","54.38.73.16","172.18.0.2","TLSv1.2","1326","Application Data"
"8.475999","54.38.73.16","172.18.0.2","TCP","1516","[TCP segment of a reassembled PDU]"
"8.476022","172.18.0.2","54.38.73.16","TCP","68","36876 → 21002 [ACK] Seq=18318 Ack=305018 Win=5593 Len=0 TSval=1094569071 TSecr=2677791443"
"8.477363","54.38.73.16","172.18.0.2","TCP","68","21002 → 36876 [ACK] Seq=305018 Ack=18318 Win=1452 Len=0 TSval=2677791444 TSecr=1094569047"
"8.477396","172.18.0.2","54.38.73.16","TLSv1.2","611","Application Data"
"8.501903","54.38.73.16","172.18.0.2","TLSv1.2","191","Application Data"
"8.539588","54.38.73.16","172.18.0.2","TCP","68","21002 → 36876 [ACK] Seq=305141 Ack=18861 Win=1452 Len=0 TSval=2677791460 TSecr=1094569072"
"8.539636","172.18.0.2","54.38.73.16","TLSv1.2","611","Application Data"
"8.563230","54.38.73.16","172.18.0.2","TCP","68","21002 → 36876 [ACK] Seq=305141 Ack=19404 Win=1452 Len=0 TSval=2677791465 TSecr=1094569135"
"8.726599","193.111.115.210","172.18.0.2","TLSv1.2","611","Application Data"
"8.726625","172.18.0.2","193.111.115.210","TCP","68","49692 → 443 [ACK] Seq=1 Ack=1087 Win=493 Len=0 TSval=2015716619 TSecr=1321581055"
"9.304728","54.38.73.16","172.18.0.2","TLSv1.2","611","Application Data"
"9.305800","172.18.0.2","54.38.73.16","TLSv1.2","611","Application Data"
"9.329758","54.38.73.16","172.18.0.2","TCP","68","21002 → 36876 [ACK] Seq=305684 Ack=19947 Win=1452 Len=0 TSval=2677791657 TSecr=1094569901"
"9.611175","54.38.73.16","172.18.0.2","TCP","1516","[TCP segment of a reassembled PDU]"
"9.611322","54.38.73.16","172.18.0.2","TLSv1.2","2247","Application Data"
"9.611332","54.38.73.16","172.18.0.2","TCP","2964","[TCP segment of a reassembled PDU]"
"9.611374","172.18.0.2","54.38.73.16","TCP","68","36876 → 21002 [ACK] Seq=19947 Ack=312207 Win=5566 Len=0 TSval=1094570206 TSecr=2677791717"
"9.626867","54.38.73.16","172.18.0.2","TLSv1.2","1516","Application Data, Application Data"
"9.634834","54.38.73.16","172.18.0.2","TLSv1.2","951","Application Data"
"9.634858","172.18.0.2","54.38.73.16","TCP","68","36876 → 21002 [ACK] Seq=19947 Ack=314538 Win=5593 Len=0 TSval=1094570230 TSecr=2677791731"
"9.641606","172.18.0.2","54.38.73.16","TLSv1.2","611","Application Data"
"9.665408","54.38.73.16","172.18.0.2","TCP","68","21002 → 36876 [ACK] Seq=314538 Ack=20490 Win=1452 Len=0 TSval=2677791741 TSecr=1094570237"
"10.020713","54.38.73.16","172.18.0.2","TLSv1.2","611","Application Data"
"10.021765","172.18.0.2","54.38.73.16","TLSv1.2","611","Application Data"
"10.046903","54.38.73.16","172.18.0.2","TCP","68","21002 → 36876 [ACK] Seq=315081 Ack=21033 Win=1452 Len=0 TSval=2677791836 TSecr=1094570617"
"10.290419","54.38.73.16","172.18.0.2","TLSv1.2","3695","Application Data"
"10.290599","172.18.0.2","54.38.73.16","TCP","68","36876 → 21002 [ACK] Seq=21033 Ack=318708 Win=5584 Len=0 TSval=1094570886 TSecr=2677791897"
"10.298409","54.38.73.16","172.18.0.2","TLSv1.2","5860","Application Data"
"10.298589","172.18.0.2","54.38.73.16","TCP","68","36876 → 21002 [ACK] Seq=21033 Ack=324500 Win=5581 Len=0 TSval=1094570894 TSecr=2677791899"
"10.299099","54.38.73.16","172.18.0.2","TCP","1516","21002 → 36876 [ACK] Seq=324500 Ack=21033 Win=1452 Len=1448 TSval=2677791899 TSecr=1094570617 [TCP segment of a reassembled PDU]"
"10.314608","54.38.73.16","172.18.0.2","TLSv1.2","1139","Application Data, Application Data"
"10.314633","172.18.0.2","54.38.73.16","TCP","68","36876 → 21002 [ACK] Seq=21033 Ack=327019 Win=5593 Len=0 TSval=1094570910 TSecr=2677791899"
"10.341797","54.38.73.16","172.18.0.2","TLSv1.2","3695","Application Data"
"10.341972","172.18.0.2","54.38.73.16","TCP","68","36876 → 21002 [ACK] Seq=21033 Ack=330646 Win=5580 Len=0 TSval=1094570937 TSecr=2677791910"
"10.342991","172.18.0.2","54.38.73.16","TLSv1.2","611","Application Data"
"10.366125","54.38.73.16","172.18.0.2","TLSv1.2","611","Application Data"
"10.367952","54.38.73.16","172.18.0.2","TCP","68","21002 → 36876 [ACK] Seq=331189 Ack=21576 Win=1452 Len=0 TSval=2677791917 TSecr=1094570938"
"10.367981","172.18.0.2","54.38.73.16","TLSv1.2","611","Application Data"
"10.392267","54.38.73.16","172.18.0.2","TCP","68","21002 → 36876 [ACK] Seq=331189 Ack=22119 Win=1452 Len=0 TSval=2677791923 TSecr=1094570963"
"10.839931","54.38.73.16","172.18.0.2","TLSv1.2","611","Application Data"
"10.841046","172.18.0.2","54.38.73.16","TLSv1.2","611","Application Data"
"10.866828","54.38.73.16","172.18.0.2","TCP","68","21002 → 36876 [ACK] Seq=331732 Ack=22662 Win=1452 Len=0 TSval=2677792041 TSecr=1094571436"
"10.991589","172.18.0.2","193.111.115.210","TLSv1.2","611","Application Data"
"11.037076","193.111.115.210","172.18.0.2","TCP","68","443 → 49692 [ACK] Seq=1087 Ack=544 Win=1452 Len=0 TSval=1321581631 TSecr=2015718884"
"11.249531","54.38.73.16","172.18.0.2","TCP","1516","[TCP segment of a reassembled PDU]"
"11.249962","54.38.73.16","172.18.0.2","TLSv1.2","2247","Application Data"
"11.249988","54.38.73.16","172.18.0.2","TLSv1.2","7308","Application Data"
"11.250000","54.38.73.16","172.18.0.2","TLSv1.2","2964","Application Data [TCP segment of a reassembled PDU]"
"11.250072","172.18.0.2","54.38.73.16","TCP","68","36876 → 21002 [ACK] Seq=22662 Ack=345495 Win=5538 Len=0 TSval=1094571845 TSecr=2677792122"
"11.274947","54.38.73.16","172.18.0.2","TLSv1.2","4412","Application Data [TCP segment of a reassembled PDU]"
"11.274975","172.18.0.2","54.38.73.16","TCP","68","36876 → 21002 [ACK] Seq=22662 Ack=349839 Win=5580 Len=0 TSval=1094571870 TSecr=2677792143"
"11.275389","54.38.73.16","172.18.0.2","TLSv1.2","9949","Application Data, Application Data, Application Data, Application Data"
"11.275648","172.18.0.2","54.38.73.16","TCP","68","36876 → 21002 [ACK] Seq=22662 Ack=359720 Win=5550 Len=0 TSval=1094571871 TSecr=2677792143"
"11.276050","172.18.0.2","54.38.73.16","TLSv1.2","611","Application Data"
"11.299384","54.38.73.16","172.18.0.2","TCP","2964","[TCP segment of a reassembled PDU]"
"11.299409","172.18.0.2","54.38.73.16","TCP","68","36876 → 21002 [ACK] Seq=23205 Ack=362616 Win=5596 Len=0 TSval=1094571894 TSecr=2677792149"
"11.301050","54.38.73.16","172.18.0.2","TCP","68","[TCP Previous segment not captured] 21002 → 36876 [ACK] Seq=373743 Ack=23205 Win=1452 Len=0 TSval=2677792150 TSecr=1094571871"
"11.301084","172.18.0.2","54.38.73.16","TLSv1.2","611","Application Data"
"11.301094","54.38.73.16","172.18.0.2","TCP","11195","[TCP Retransmission] 21002 → 36876 [PSH, ACK] Seq=362616 Ack=22662 Win=1452 Len=11127 TSval=2677792150 TSecr=1094571871"
"11.301220","172.18.0.2","54.38.73.16","TCP","68","36876 → 21002 [ACK] Seq=23748 Ack=373743 Win=5553 Len=0 TSval=1094571896 TSecr=2677792150"
"11.325858","54.38.73.16","172.18.0.2","TCP","2964","[TCP segment of a reassembled PDU]"
"11.325883","172.18.0.2","54.38.73.16","TCP","68","36876 → 21002 [ACK] Seq=23748 Ack=376639 Win=5596 Len=0 TSval=1094571921 TSecr=2677792156"
"11.325908","54.38.73.16","172.18.0.2","TLSv1.2","11195","Application Data, Application Data, Application Data, Application Data, Application Data"
"11.326024","172.18.0.2","54.38.73.16","TCP","68","36876 → 21002 [ACK] Seq=23748 Ack=387766 Win=5538 Len=0 TSval=1094571921 TSecr=2677792156"
"11.326967","172.18.0.2","54.38.73.16","TLSv1.2","611","Application Data"
"11.352004","54.38.73.16","172.18.0.2","TLSv1.2","14091","Application Data, Application Data, Application Data, Application Data, Application Data"
"11.352031","172.18.0.2","54.38.73.16","TCP","68","36876 → 21002 [ACK] Seq=24291 Ack=401789 Win=5538 Len=0 TSval=1094571947 TSecr=2677792162"
"11.376493","54.38.73.16","172.18.0.2","TLSv1.2","4238","Application Data, Application Data"
"11.376547","172.18.0.2","54.38.73.16","TLSv1.2","611","Application Data"
"11.439599","54.38.73.16","172.18.0.2","TCP","68","21002 → 36876 [ACK] Seq=405959 Ack=24834 Win=1452 Len=0 TSval=2677792185 TSecr=1094571972"
"11.439632","172.18.0.2","54.38.73.16","TLSv1.2","611","Application Data"
"11.500017","54.38.73.16","172.18.0.2","TCP","68","21002 → 36876 [ACK] Seq=405959 Ack=25377 Win=1452 Len=0 TSval=2677792200 TSecr=1094572035"
"11.966795","54.38.73.16","172.18.0.2","TLSv1.2","611","Application Data"
"11.967952","172.18.0.2","54.38.73.16","TLSv1.2","611","Application Data"
"11.991883","54.38.73.16","172.18.0.2","TCP","68","21002 → 36876 [ACK] Seq=406502 Ack=25920 Win=1452 Len=0 TSval=2677792323 TSecr=1094572563"
"12.537468","54.38.73.16","172.18.0.2","TLSv1.2","3695","Application Data"
"12.537607","172.18.0.2","54.38.73.16","TCP","68","36876 → 21002 [ACK] Seq=25920 Ack=410129 Win=5584 Len=0 TSval=1094573133 TSecr=2677792459"
"12.559128","54.38.73.16","172.18.0.2","TCP","2964","[TCP segment of a reassembled PDU]"
"12.559151","172.18.0.2","54.38.73.16","TCP","68","36876 → 21002 [ACK] Seq=25920 Ack=413025 Win=5596 Len=0 TSval=1094573154 TSecr=2677792464"
"12.561550","54.38.73.16","172.18.0.2","TLSv1.2","799","Application Data"
"12.567377","54.38.73.16","172.18.0.2","TLSv1.2","7308","Application Data"
"12.567531","172.18.0.2","54.38.73.16","TCP","68","36876 → 21002 [ACK] Seq=25920 Ack=420996 Win=5565 Len=0 TSval=1094573163 TSecr=2677792465"
"12.579762","54.38.73.16","172.18.0.2","TLSv1.2","2964","Application Data, Application Data"
"12.579786","172.18.0.2","54.38.73.16","TCP","68","36876 → 21002 [ACK] Seq=25920 Ack=423892 Win=5596 Len=0 TSval=1094573175 TSecr=2677792469"
"12.583558","54.38.73.16","172.18.0.2","TCP","1516","21002 → 36876 [ACK] Seq=423892 Ack=25920 Win=1452 Len=1448 TSval=2677792471 TSecr=1094573154 [TCP segment of a reassembled PDU]"
"12.588961","54.38.73.16","172.18.0.2","TLSv1.2","1516","Application Data, Application Data"
"12.589075","172.18.0.2","54.38.73.16","TCP","68","36876 → 21002 [ACK] Seq=25920 Ack=426788 Win=5593 Len=0 TSval=1094573184 TSecr=2677792471"
"12.594209","54.38.73.16","172.18.0.2","TCP","1516","21002 → 36876 [ACK] Seq=426788 Ack=25920 Win=1452 Len=1448 TSval=2677792472 TSecr=1094573163 [TCP segment of a reassembled PDU]"
"12.595175","54.38.73.16","172.18.0.2","TLSv1.2","7308","Application Data, Application Data"
"12.595309","172.18.0.2","54.38.73.16","TCP","68","36876 → 21002 [ACK] Seq=25920 Ack=435476 Win=5565 Len=0 TSval=1094573190 TSecr=2677792472"
"12.596143","172.18.0.2","54.38.73.16","TLSv1.2","611","Application Data"
"12.604372","54.38.73.16","172.18.0.2","TCP","2964","21002 → 36876 [ACK] Seq=435476 Ack=25920 Win=1452 Len=2896 TSval=2677792476 TSecr=1094573175 [TCP segment of a reassembled PDU]"
"12.604397","172.18.0.2","54.38.73.16","TCP","68","36876 → 21002 [ACK] Seq=26463 Ack=438372 Win=5596 Len=0 TSval=1094573199 TSecr=2677792476"
"12.614139","54.38.73.16","172.18.0.2","TLSv1.2","2964","Application Data, Application Data"
"12.614168","172.18.0.2","54.38.73.16","TCP","68","36876 → 21002 [ACK] Seq=26463 Ack=441268 Win=5596 Len=0 TSval=1094573209 TSecr=2677792478"
"12.623319","54.38.73.16","172.18.0.2","TCP","68","[TCP Previous segment not captured] 21002 → 36876 [ACK] Seq=449599 Ack=26463 Win=1452 Len=0 TSval=2677792480 TSecr=1094573191"
"12.623342","54.38.73.16","172.18.0.2","TCP","8399","[TCP Retransmission] 21002 → 36876 [PSH, ACK] Seq=441268 Ack=25920 Win=1452 Len=8331 TSval=2677792480 TSecr=1094573190"
"12.623520","172.18.0.2","54.38.73.16","TCP","68","36876 → 21002 [ACK] Seq=26463 Ack=449599 Win=5567 Len=0 TSval=1094573219 TSecr=2677792480"
"12.623566","54.38.73.16","172.18.0.2","TCP","1516","[TCP segment of a reassembled PDU]"
"12.630282","54.38.73.16","172.18.0.2","TCP","1516","21002 → 36876 [ACK] Seq=451047 Ack=26463 Win=1452 Len=1448 TSval=2677792482 TSecr=1094573199 [TCP segment of a reassembled PDU]"
"12.630307","172.18.0.2","54.38.73.16","TCP","68","36876 → 21002 [ACK] Seq=26463 Ack=452495 Win=5593 Len=0 TSval=1094573225 TSecr=2677792480"
"12.633242","54.38.73.16","172.18.0.2","TLSv1.2","1516","Application Data [TCP segment of a reassembled PDU]"
"12.642507","54.38.73.16","172.18.0.2","TCP","2964","21002 → 36876 [ACK] Seq=453943 Ack=26463 Win=1452 Len=2896 TSval=2677792485 TSecr=1094573209 [TCP segment of a reassembled PDU]"
"12.642532","172.18.0.2","54.38.73.16","TCP","68","36876 → 21002 [ACK] Seq=26463 Ack=456839 Win=5596 Len=0 TSval=1094573238 TSecr=2677792483"
"12.648194","54.38.73.16","172.18.0.2","TLSv1.2","1139","Application Data, Application Data"
"12.648700","172.18.0.2","54.38.73.16","TLSv1.2","611","Application Data"
"12.712024","54.38.73.16","172.18.0.2","TCP","68","21002 → 36876 [ACK] Seq=457910 Ack=27006 Win=1452 Len=0 TSval=2677792503 TSecr=1094573244"
"12.712059","172.18.0.2","54.38.73.16","TLSv1.2","611","Application Data"
"12.735995","54.38.73.16","172.18.0.2","TCP","68","21002 → 36876 [ACK] Seq=457910 Ack=27549 Win=1452 Len=0 TSval=2677792509 TSecr=1094573307"
