_ws.col.Time,_ws.col.Source,_ws.col.Destination,_ws.col.Protocol,_ws.col.Length,_ws.col.Info
"0.000000","172.18.0.2","54.38.73.16","TLSv1.2","611","Application Data"
"0.025626","54.38.73.16","172.18.0.2","TCP","68","21002 → 36876 [ACK] Seq=1 Ack=544 Win=1452 Len=0 TSval=2675640283 TSecr=1085964466"
"0.975096","54.38.73.16","172.18.0.2","TLSv1.2","611","Application Data"
"0.975151","172.18.0.2","54.38.73.16","TCP","68","36876 → 21002 [ACK] Seq=544 Ack=544 Win=5608 Len=0 TSval=1085965441 TSecr=2675640447"
"0.976275","172.18.0.2","54.38.73.16","TLSv1.2","2153","Application Data"
"1.004036","54.38.73.16","172.18.0.2","TCP","68","21002 → 36876 [ACK] Seq=544 Ack=2629 Win=1450 Len=0 TSval=2675640527 TSecr=1085965442"
"1.589128","54.38.73.16","172.18.0.2","TLSv1.2","611","Application Data"
"1.589182","172.18.0.2","54.38.73.16","TCP","68","36876 → 21002 [ACK] Seq=2629 Ack=1087 Win=5608 Len=0 TSval=1085966055 TSecr=2675640668"
"1.684034","54.38.73.16","172.18.0.2","TLSv1.2","1125","Application Data"
"1.684072","172.18.0.2","54.38.73.16","TCP","68","36876 → 21002 [ACK] Seq=2629 Ack=2144 Win=5600 Len=0 TSval=1085966150 TSecr=2675640697"
"1.690379","172.18.0.2","54.38.73.16","TLSv1.2","611","Application Data"
"1.714577","54.38.73.16","172.18.0.2","TCP","68","21002 → 36876 [ACK] Seq=2144 Ack=3172 Win=1452 Len=0 TSval=2675640705 TSecr=1085966157"
"2.510317","54.38.73.16","172.18.0.2","TLSv1.2","611","Application Data"
"2.510421","172.18.0.2","54.38.73.16","TCP","68","36876 → 21002 [ACK] Seq=3172 Ack=2687 Win=5608 Len=0 TSval=1085966977 TSecr=2675640881"
"2.511334","172.18.0.2","54.38.73.16","TLSv1.2","611","Application Data"
"2.536360","54.38.73.16","172.18.0.2","TCP","68","21002 → 36876 [ACK] Seq=2687 Ack=3715 Win=1452 Len=0 TSval=2675640910 TSecr=1085966978"
"3.432136","54.38.73.16","172.18.0.2","TCP","1516","[TCP segment of a reassembled PDU]"
"3.432595","54.38.73.16","172.18.0.2","TLSv1.2","2247","Application Data"
"3.432600","54.38.73.16","172.18.0.2","TLSv1.2","2964","Application Data"
"3.432604","54.38.73.16","172.18.0.2","TLSv1.2","1516","Application Data [TCP segment of a reassembled PDU]"
"3.432721","172.18.0.2","54.38.73.16","TCP","68","36876 → 21002 [ACK] Seq=3715 Ack=10658 Win=5568 Len=0 TSval=1085967899 TSecr=2675641075"
"3.456630","54.38.73.16","172.18.0.2","TLSv1.2","4578","Application Data, Application Data"
"3.456651","172.18.0.2","54.38.73.16","TCP","68","36876 → 21002 [ACK] Seq=3715 Ack=15168 Win=5586 Len=0 TSval=1085967923 TSecr=2675641141"
"3.637320","54.38.73.16","172.18.0.2","TLSv1.2","3695","Application Data"
"3.637456","172.18.0.2","54.38.73.16","TCP","68","36876 → 21002 [ACK] Seq=3715 Ack=18795 Win=5581 Len=0 TSval=1085968104 TSecr=2675641170"
"3.708942","54.38.73.16","172.18.0.2","TLSv1.2","3695","Application Data"
"3.709034","172.18.0.2","54.38.73.16","TCP","68","36876 → 21002 [ACK] Seq=3715 Ack=22422 Win=5580 Len=0 TSval=1085968175 TSecr=2675641203"
"3.709358","172.18.0.2","54.38.73.16","TLSv1.2","611","Application Data"
"3.732382","54.38.73.16","172.18.0.2","TLSv1.2","1125","Application Data"
"3.733292","54.38.73.16","172.18.0.2","TCP","68","21002 → 36876 [ACK] Seq=23479 Ack=4258 Win=1452 Len=0 TSval=2675641210 TSecr=1085968176"
"3.752400","54.38.73.16","172.18.0.2","TLSv1.2","2964","Application Data"
"3.752522","172.18.0.2","54.38.73.16","TCP","68","36876 → 21002 [ACK] Seq=4258 Ack=26375 Win=5596 Len=0 TSval=1085968219 TSecr=2675641209"
"3.776503","54.38.73.16","172.18.0.2","TLSv1.2","1342","Application Data"
"3.806631","54.38.73.16","172.18.0.2","TCP","2964","[TCP segment of a reassembled PDU]"
"3.806651","172.18.0.2","54.38.73.16","TCP","68","36876 → 21002 [ACK] Seq=4258 Ack=30545 Win=5596 Len=0 TSval=1085968273 TSecr=2675641220"
"3.831517","54.38.73.16","172.18.0.2","TLSv1.2","799","Application Data"
"3.831861","172.18.0.2","54.38.73.16","TLSv1.2","611","Application Data"
"3.872391","54.38.73.16","172.18.0.2","TLSv1.2","1639","Application Data"
"3.872520","172.18.0.2","54.38.73.16","TCP","68","36876 → 21002 [ACK] Seq=4801 Ack=32847 Win=5601 Len=0 TSval=1085968339 TSecr=2675641244"
"3.892841","54.38.73.16","172.18.0.2","TCP","2964","[TCP segment of a reassembled PDU]"
"3.892932","172.18.0.2","54.38.73.16","TCP","68","36876 → 21002 [ACK] Seq=4801 Ack=35743 Win=5596 Len=0 TSval=1085968359 TSecr=2675641249"
"3.896105","54.38.73.16","172.18.0.2","TLSv1.2","799","Application Data"
"3.935500","54.38.73.16","172.18.0.2","TCP","1516","[TCP segment of a reassembled PDU]"
"3.935540","172.18.0.2","54.38.73.16","TCP","68","36876 → 21002 [ACK] Seq=4801 Ack=37922 Win=5603 Len=0 TSval=1085968402 TSecr=2675641250"
"3.969496","54.38.73.16","172.18.0.2","TLSv1.2","191","Application Data"
"3.972527","172.18.0.2","54.38.73.16","TLSv1.2","611","Application Data"
"4.037304","54.38.73.16","172.18.0.2","TCP","68","21002 → 36876 [ACK] Seq=38045 Ack=5344 Win=1452 Len=0 TSval=2675641286 TSecr=1085968439"
"4.661635","54.38.73.16","172.18.0.2","TLSv1.2","611","Application Data"
"4.662606","172.18.0.2","54.38.73.16","TLSv1.2","611","Application Data"
"4.687396","54.38.73.16","172.18.0.2","TCP","68","21002 → 36876 [ACK] Seq=38588 Ack=5887 Win=1452 Len=0 TSval=2675641448 TSecr=1085969129"
"5.894718","54.38.73.16","172.18.0.2","TCP","1516","[TCP segment of a reassembled PDU]"
"5.895038","54.38.73.16","172.18.0.2","TLSv1.2","2247","Application Data"
"5.895045","54.38.73.16","172.18.0.2","TCP","2964","[TCP segment of a reassembled PDU]"
"5.895052","54.38.73.16","172.18.0.2","TLSv1.2","1516","Application Data [TCP segment of a reassembled PDU]"
"5.895057","54.38.73.16","172.18.0.2","TLSv1.2","1516","Application Data [TCP segment of a reassembled PDU]"
"5.895160","172.18.0.2","54.38.73.16","TCP","68","36876 → 21002 [ACK] Seq=5887 Ack=48007 Win=5569 Len=0 TSval=1085970361 TSecr=2675641671"
"5.921144","54.38.73.16","172.18.0.2","TLSv1.2","8328","Application Data, Application Data, Application Data, Application Data"
"5.921353","172.18.0.2","54.38.73.16","TCP","68","36876 → 21002 [ACK] Seq=5887 Ack=56267 Win=5567 Len=0 TSval=1085970388 TSecr=2675641756"
"5.946791","54.38.73.16","172.18.0.2","TLSv1.2","6808","Application Data, Application Data"
"5.946950","172.18.0.2","54.38.73.16","TCP","68","36876 → 21002 [ACK] Seq=5887 Ack=63007 Win=5565 Len=0 TSval=1085970413 TSecr=2675641763"
"5.970959","54.38.73.16","172.18.0.2","TLSv1.2","611","Application Data"
"5.978618","54.38.73.16","172.18.0.2","TCP","2964","[TCP segment of a reassembled PDU]"
"5.978655","172.18.0.2","54.38.73.16","TCP","68","36876 → 21002 [ACK] Seq=5887 Ack=66446 Win=5596 Len=0 TSval=1085970445 TSecr=2675641769"
"6.003054","54.38.73.16","172.18.0.2","TLSv1.2","799","Application Data"
"6.003561","172.18.0.2","54.38.73.16","TLSv1.2","611","Application Data"
"6.018489","54.38.73.16","172.18.0.2","TCP","1516","[TCP segment of a reassembled PDU]"
"6.027561","54.38.73.16","172.18.0.2","TLSv1.2","191","Application Data"
"6.027767","172.18.0.2","54.38.73.16","TCP","68","36876 → 21002 [ACK] Seq=6430 Ack=68748 Win=5612 Len=0 TSval=1085970494 TSecr=2675641781"
"6.061738","54.38.73.16","172.18.0.2","TLSv1.2","3181","Application Data"
"6.061885","172.18.0.2","54.38.73.16","TCP","68","36876 → 21002 [ACK] Seq=6430 Ack=71861 Win=5588 Len=0 TSval=1085970528 TSecr=2675641791"
"6.102649","54.38.73.16","172.18.0.2","TLSv1.2","2153","Application Data"
"6.102683","172.18.0.2","54.38.73.16","TCP","68","36876 → 21002 [ACK] Seq=6430 Ack=73946 Win=5599 Len=0 TSval=1085970569 TSecr=2675641802"
"6.103196","172.18.0.2","54.38.73.16","TLSv1.2","611","Application Data"
"6.164716","54.38.73.16","172.18.0.2","TCP","68","21002 → 36876 [ACK] Seq=73946 Ack=6973 Win=1452 Len=0 TSval=2675641818 TSecr=1085970569"
"6.175468","54.38.73.16","172.18.0.2","TLSv1.2","3181","Application Data"
"6.175624","172.18.0.2","54.38.73.16","TCP","68","36876 → 21002 [ACK] Seq=6973 Ack=77059 Win=5588 Len=0 TSval=1085970642 TSecr=2675641820"
"6.218710","54.38.73.16","172.18.0.2","TLSv1.2","1125","Application Data"
"6.260441","172.18.0.2","54.38.73.16","TCP","68","36876 → 21002 [ACK] Seq=6973 Ack=78116 Win=5612 Len=0 TSval=1085970727 TSecr=2675641831"
"6.260827","54.38.73.16","172.18.0.2","TCP","2964","[TCP segment of a reassembled PDU]"
"6.260864","172.18.0.2","54.38.73.16","TCP","68","36876 → 21002 [ACK] Seq=6973 Ack=81012 Win=5596 Len=0 TSval=1085970727 TSecr=2675641841"
"6.285154","54.38.73.16","172.18.0.2","TLSv1.2","1342","Application Data, Application Data"
"6.285205","172.18.0.2","54.38.73.16","TCP","68","36876 → 21002 [ACK] Seq=6973 Ack=82286 Win=5593 Len=0 TSval=1085970751 TSecr=2675641847"
"6.322955","54.38.73.16","172.18.0.2","TLSv1.2","3695","Application Data"
"6.322988","172.18.0.2","54.38.73.16","TCP","68","36876 → 21002 [ACK] Seq=6973 Ack=85913 Win=5580 Len=0 TSval=1085970789 TSecr=2675641857"
"6.354671","54.38.73.16","172.18.0.2","TLSv1.2","1125","Application Data"
"6.354729","172.18.0.2","54.38.73.16","TCP","68","36876 → 21002 [ACK] Seq=6973 Ack=86970 Win=5593 Len=0 TSval=1085970821 TSecr=2675641865"
"6.448681","54.38.73.16","172.18.0.2","TLSv1.2","3695","Application Data"
"6.448714","172.18.0.2","54.38.73.16","TCP","68","36876 → 21002 [ACK] Seq=6973 Ack=90597 Win=5580 Len=0 TSval=1085970915 TSecr=2675641888"
"6.449160","172.18.0.2","54.38.73.16","TLSv1.2","611","Application Data"
"6.472923","54.38.73.16","172.18.0.2","TLSv1.2","1125","Application Data"
"6.472932","54.38.73.16","172.18.0.2","TCP","68","21002 → 36876 [ACK] Seq=91654 Ack=7516 Win=1452 Len=0 TSval=2675641895 TSecr=1085970915"
"6.473160","172.18.0.2","54.38.73.16","TCP","68","36876 → 21002 [ACK] Seq=7516 Ack=91654 Win=5612 Len=0 TSval=1085970939 TSecr=2675641895"
"6.607823","54.38.73.16","172.18.0.2","TLSv1.2","3181","Application Data"
"6.607831","54.38.73.16","172.18.0.2","TCP","2964","[TCP segment of a reassembled PDU]"
"6.608000","172.18.0.2","54.38.73.16","TCP","68","36876 → 21002 [ACK] Seq=7516 Ack=97663 Win=5568 Len=0 TSval=1085971074 TSecr=2675641921"
"6.637453","54.38.73.16","172.18.0.2","TLSv1.2","799","Application Data"
"6.637684","172.18.0.2","54.38.73.16","TCP","68","36876 → 21002 [ACK] Seq=7516 Ack=98394 Win=5612 Len=0 TSval=1085971104 TSecr=2675641935"
"6.641833","54.38.73.16","172.18.0.2","TCP","2964","[TCP segment of a reassembled PDU]"
"6.642015","172.18.0.2","54.38.73.16","TCP","68","36876 → 21002 [ACK] Seq=7516 Ack=101290 Win=5596 Len=0 TSval=1085971108 TSecr=2675641937"
"6.662081","54.38.73.16","172.18.0.2","TLSv1.2","828","Application Data, Application Data"
"6.662550","172.18.0.2","54.38.73.16","TCP","68","36876 → 21002 [ACK] Seq=7516 Ack=102050 Win=5612 Len=0 TSval=1085971129 TSecr=2675641942"
"6.703885","54.38.73.16","172.18.0.2","TLSv1.2","1125","Application Data"
"6.704103","172.18.0.2","54.38.73.16","TCP","68","36876 → 21002 [ACK] Seq=7516 Ack=103107 Win=5612 Len=0 TSval=1085971170 TSecr=2675641952"
"6.728238","54.38.73.16","172.18.0.2","TLSv1.2","799","[TCP Previous segment not captured] , Ignored Unknown Record"
"6.728285","172.18.0.2","54.38.73.16","TCP","80","[TCP Dup ACK 103#1] 36876 → 21002 [ACK] Seq=7516 Ack=103107 Win=5612 Len=0 TSval=1085971194 TSecr=2675641952 SLE=106003 SRE=106734"
"6.728256","54.38.73.16","172.18.0.2","TCP","2964","[TCP Out-Of-Order] 21002 → 36876 [ACK] Seq=103107 Ack=7516 Win=1452 Len=2896 TSval=2675641958 TSecr=1085971129"
"6.728320","172.18.0.2","54.38.73.16","TCP","68","36876 → 21002 [ACK] Seq=7516 Ack=106734 Win=5584 Len=0 TSval=1085971194 TSecr=2675641958"
"7.016239","54.38.73.16","172.18.0.2","TLSv1.2","705","[TCP Previous segment not captured] , Ignored Unknown Record"
"7.016290","172.18.0.2","54.38.73.16","TCP","80","[TCP Window Update] 36876 → 21002 [ACK] Seq=7516 Ack=106734 Win=5606 Len=0 TSval=1085971482 TSecr=2675641958 SLE=108182 SRE=108819"
"7.016257","54.38.73.16","172.18.0.2","TCP","2153","[TCP Retransmission] 21002 → 36876 [PSH, ACK] Seq=106734 Ack=7516 Win=1452 Len=2085 TSval=2675641998 TSecr=1085971194"
"7.016321","172.18.0.2","54.38.73.16","TCP","80","36876 → 21002 [ACK] Seq=7516 Ack=108819 Win=5590 Len=0 TSval=1085971482 TSecr=2675641998 SLE=108182 SRE=108819"
"7.026832","172.18.0.2","54.38.73.16","TLSv1.2","611","Application Data"
"7.051943","54.38.73.16","172.18.0.2","TCP","68","21002 → 36876 [ACK] Seq=108819 Ack=8059 Win=1452 Len=0 TSval=2675642039 TSecr=1085971493"
"7.740768","54.38.73.16","172.18.0.2","TLSv1.2","611","Application Data"
"7.740825","172.18.0.2","54.38.73.16","TCP","68","36876 → 21002 [ACK] Seq=8059 Ack=109362 Win=5608 Len=0 TSval=1085972207 TSecr=2675642204"
"7.741765","172.18.0.2","54.38.73.16","TLSv1.2","611","Application Data"
"7.765906","54.38.73.16","172.18.0.2","TCP","68","21002 → 36876 [ACK] Seq=109362 Ack=8602 Win=1452 Len=0 TSval=2675642218 TSecr=1085972208"
"8.962987","54.38.73.16","172.18.0.2","TLSv1.2","1516","[TCP Previous segment not captured] , Ignored Unknown Record"
"8.963039","172.18.0.2","54.38.73.16","TCP","80","[TCP Dup ACK 115#1] 36876 → 21002 [ACK] Seq=8602 Ack=109362 Win=5612 Len=0 TSval=1085973429 TSecr=2675642218 SLE=112801 SRE=114249"
"8.962994","54.38.73.16","172.18.0.2","TLSv1.2","1516","Ignored Unknown Record"
"8.963060","172.18.0.2","54.38.73.16","TCP","80","[TCP Dup ACK 115#2] 36876 → 21002 [ACK] Seq=8602 Ack=109362 Win=5612 Len=0 TSval=1085973429 TSecr=2675642218 SLE=112801 SRE=115697"
"8.986506","54.38.73.16","172.18.0.2","TLSv1.2","1516","Ignored Unknown Record"
"8.986543","172.18.0.2","54.38.73.16","TCP","80","[TCP Dup ACK 115#3] 36876 → 21002 [ACK] Seq=8602 Ack=109362 Win=5612 Len=0 TSval=1085973453 TSecr=2675642218 SLE=112801 SRE=117145"
"9.010996","54.38.73.16","172.18.0.2","TLSv1.2","1516","Ignored Unknown Record"
"9.012095","172.18.0.2","54.38.73.16","TCP","80","[TCP Dup ACK 115#4] 36876 → 21002 [ACK] Seq=8602 Ack=109362 Win=5612 Len=0 TSval=1085973477 TSecr=2675642218 SLE=112801 SRE=118593"
"9.036605","54.38.73.16","172.18.0.2","TLSv1.2","1516","Ignored Unknown Record"
"9.037655","172.18.0.2","54.38.73.16","TCP","80","[TCP Dup ACK 115#5] 36876 → 21002 [ACK] Seq=8602 Ack=109362 Win=5612 Len=0 TSval=1085973503 TSecr=2675642218 SLE=112801 SRE=120041"
"9.061917","54.38.73.16","172.18.0.2","TLSv1.2","1516","Ignored Unknown Record"
"9.062981","172.18.0.2","54.38.73.16","TCP","80","[TCP Dup ACK 115#6] 36876 → 21002 [ACK] Seq=8602 Ack=109362 Win=5612 Len=0 TSval=1085973528 TSecr=2675642218 SLE=112801 SRE=121489"
"9.087619","54.38.73.16","172.18.0.2","TLSv1.2","1516","Ignored Unknown Record"
"9.088718","172.18.0.2","54.38.73.16","TCP","80","[TCP Dup ACK 115#7] 36876 → 21002 [ACK] Seq=8602 Ack=109362 Win=5612 Len=0 TSval=1085973554 TSecr=2675642218 SLE=112801 SRE=122937"
"9.113925","54.38.73.16","172.18.0.2","TLSv1.2","1516","Ignored Unknown Record"
"9.114991","172.18.0.2","54.38.73.16","TCP","80","[TCP Dup ACK 115#8] 36876 → 21002 [ACK] Seq=8602 Ack=109362 Win=5612 Len=0 TSval=1085973580 TSecr=2675642218 SLE=112801 SRE=124385"
"9.139786","54.38.73.16","172.18.0.2","TCP","611","[TCP Retransmission] 21002 → 36876 [PSH, ACK] Seq=109362 Ack=8602 Win=1452 Len=543 TSval=2675642561 TSecr=1085973580"
"9.139851","172.18.0.2","54.38.73.16","TCP","80","36876 → 21002 [ACK] Seq=8602 Ack=109905 Win=5608 Len=0 TSval=1085973606 TSecr=2675642561 SLE=112801 SRE=124385"
"9.139804","54.38.73.16","172.18.0.2","TCP","1516","[TCP Retransmission] 21002 → 36876 [ACK] Seq=109905 Ack=8602 Win=1452 Len=1448 TSval=2675642561 TSecr=1085973580"
"9.139866","172.18.0.2","54.38.73.16","TCP","80","36876 → 21002 [ACK] Seq=8602 Ack=111353 Win=5597 Len=0 TSval=1085973606 TSecr=2675642561 SLE=112801 SRE=124385"
"9.163957","54.38.73.16","172.18.0.2","TCP","1516","[TCP Retransmission] 21002 → 36876 [ACK] Seq=111353 Ack=8602 Win=1452 Len=1448 TSval=2675642567 TSecr=1085973606"
"9.164027","172.18.0.2","54.38.73.16","TCP","68","36876 → 21002 [ACK] Seq=8602 Ack=124385 Win=5496 Len=0 TSval=1085973630 TSecr=2675642567"
"9.163965","54.38.73.16","172.18.0.2","TLSv1.2","1516","Ignored Unknown Record"
"9.188973","54.38.73.16","172.18.0.2","TLSv1.2","1516","Ignored Unknown Record"
"9.189005","172.18.0.2","54.38.73.16","TCP","68","36876 → 21002 [ACK] Seq=8602 Ack=127281 Win=5593 Len=0 TSval=1085973655 TSecr=2675642567"
"9.213400","54.38.73.16","172.18.0.2","TLSv1.2","2514","Ignored Unknown Record"
"9.213442","172.18.0.2","54.38.73.16","TCP","68","36876 → 21002 [ACK] Seq=8602 Ack=129727 Win=5598 Len=0 TSval=1085973680 TSecr=2675642580"
"9.213953","172.18.0.2","54.38.73.16","TLSv1.2","611","Application Data"
"9.218042","54.38.73.16","172.18.0.2","TCP","1516","[TCP segment of a reassembled PDU]"
"9.238251","54.38.73.16","172.18.0.2","TCP","68","[TCP Previous segment not captured] 21002 → 36876 [ACK] Seq=133897 Ack=9145 Win=1452 Len=0 TSval=2675642586 TSecr=1085973680"
"9.238269","54.38.73.16","172.18.0.2","TCP","2790","[TCP Retransmission] 21002 → 36876 [PSH, ACK] Seq=131175 Ack=8602 Win=1452 Len=2722 TSval=2675642586 TSecr=1085973680"
"9.238492","172.18.0.2","54.38.73.16","TCP","68","36876 → 21002 [ACK] Seq=9145 Ack=133897 Win=5596 Len=0 TSval=1085973705 TSecr=2675642581"
"9.263391","54.38.73.16","172.18.0.2","TLSv1.2","611","Application Data"
"9.282898","54.38.73.16","172.18.0.2","TCP","2964","[TCP segment of a reassembled PDU]"
"9.283078","172.18.0.2","54.38.73.16","TCP","68","36876 → 21002 [ACK] Seq=9145 Ack=137336 Win=5577 Len=0 TSval=1085973749 TSecr=2675642592"
"9.307518","54.38.73.16","172.18.0.2","TLSv1.2","799","Application Data"
"9.308102","172.18.0.2","54.38.73.16","TLSv1.2","611","Application Data"
"9.316027","54.38.73.16","172.18.0.2","TCP","1516","[TCP segment of a reassembled PDU]"
"9.331786","54.38.73.16","172.18.0.2","TLSv1.2","191","Application Data"
"9.331939","172.18.0.2","54.38.73.16","TCP","68","36876 → 21002 [ACK] Seq=9688 Ack=139638 Win=5612 Len=0 TSval=1085973798 TSecr=2675642605"
"9.390524","54.38.73.16","172.18.0.2","TLSv1.2","3695","Application Data"
"9.390673","172.18.0.2","54.38.73.16","TCP","68","36876 → 21002 [ACK] Seq=9688 Ack=143265 Win=5584 Len=0 TSval=1085973857 TSecr=2675642624"
"9.414310","54.38.73.16","172.18.0.2","TLSv1.2","1639","Application Data"
"9.414342","172.18.0.2","54.38.73.16","TCP","68","36876 → 21002 [ACK] Seq=9688 Ack=144836 Win=5601 Len=0 TSval=1085973881 TSecr=2675642630"
"9.553341","54.38.73.16","172.18.0.2","TLSv1.2","3695","Application Data"
"9.553505","172.18.0.2","54.38.73.16","TCP","68","36876 → 21002 [ACK] Seq=9688 Ack=148463 Win=5580 Len=0 TSval=1085974020 TSecr=2675642665"
"9.581976","54.38.73.16","172.18.0.2","TLSv1.2","4238","Application Data, Application Data"
"9.582008","172.18.0.2","54.38.73.16","TCP","68","36876 → 21002 [ACK] Seq=9688 Ack=152633 Win=5580 Len=0 TSval=1085974048 TSecr=2675642671"
"9.610389","54.38.73.16","172.18.0.2","TLSv1.2","611","Application Data"
"9.650987","54.38.73.16","172.18.0.2","TCP","2964","[TCP segment of a reassembled PDU]"
"9.651020","172.18.0.2","54.38.73.16","TCP","68","36876 → 21002 [ACK] Seq=9688 Ack=156072 Win=5596 Len=0 TSval=1085974117 TSecr=2675642679"
"9.676302","54.38.73.16","172.18.0.2","TLSv1.2","1856","Application Data, Application Data"
"9.676333","172.18.0.2","54.38.73.16","TCP","68","36876 → 21002 [ACK] Seq=9688 Ack=157860 Win=5600 Len=0 TSval=1085974143 TSecr=2675642696"
"9.692893","54.38.73.16","172.18.0.2","TCP","1516","[TCP segment of a reassembled PDU]"
"9.701542","54.38.73.16","172.18.0.2","TLSv1.2","2247","Application Data"
"9.701729","172.18.0.2","54.38.73.16","TCP","68","36876 → 21002 [ACK] Seq=9688 Ack=161487 Win=5612 Len=0 TSval=1085974168 TSecr=2675642700"
"9.702152","172.18.0.2","54.38.73.16","TLSv1.2","611","Application Data"
"9.765068","54.38.73.16","172.18.0.2","TCP","68","21002 → 36876 [ACK] Seq=161487 Ack=10231 Win=1452 Len=0 TSval=2675642718 TSecr=1085974168"
"9.800795","54.38.73.16","172.18.0.2","TLSv1.2","3181","Application Data"
"9.800975","172.18.0.2","54.38.73.16","TCP","68","36876 → 21002 [ACK] Seq=10231 Ack=164600 Win=5588 Len=0 TSval=1085974267 TSecr=2675642726"
"9.830330","54.38.73.16","172.18.0.2","TLSv1.2","1125","Application Data"
"9.872431","172.18.0.2","54.38.73.16","TCP","68","36876 → 21002 [ACK] Seq=10231 Ack=165657 Win=5612 Len=0 TSval=1085974339 TSecr=2675642733"
"9.936615","54.38.73.16","172.18.0.2","TLSv1.2","3695","Application Data"
"9.936769","172.18.0.2","54.38.73.16","TCP","68","36876 → 21002 [ACK] Seq=10231 Ack=169284 Win=5584 Len=0 TSval=1085974403 TSecr=2675642760"
"9.968041","54.38.73.16","172.18.0.2","TLSv1.2","3695","Application Data"
"9.968215","172.18.0.2","54.38.73.16","TCP","68","36876 → 21002 [ACK] Seq=10231 Ack=172911 Win=5580 Len=0 TSval=1085974434 TSecr=2675642768"
"10.010423","54.38.73.16","172.18.0.2","TLSv1.2","1125","Application Data"
"10.010573","172.18.0.2","54.38.73.16","TCP","68","36876 → 21002 [ACK] Seq=10231 Ack=173968 Win=5612 Len=0 TSval=1085974477 TSecr=2675642779"
"10.190945","54.38.73.16","172.18.0.2","TCP","1516","[TCP segment of a reassembled PDU]"
"10.191719","54.38.73.16","172.18.0.2","TLSv1.2","2247","Application Data"
"10.191887","172.18.0.2","54.38.73.16","TCP","68","36876 → 21002 [ACK] Seq=10231 Ack=177595 Win=5612 Len=0 TSval=1085974658 TSecr=2675642819"
"10.395861","54.38.73.16","172.18.0.2","TLSv1.2","3695","Application Data"
"10.396060","172.18.0.2","54.38.73.16","TCP","68","36876 → 21002 [ACK] Seq=10231 Ack=181222 Win=5584 Len=0 TSval=1085974862 TSecr=2675642859"
"10.396584","172.18.0.2","54.38.73.16","TLSv1.2","611","Application Data"
"10.401418","54.38.73.16","172.18.0.2","TCP","1516","[TCP segment of a reassembled PDU]"
"10.419796","54.38.73.16","172.18.0.2","TLSv1.2","2964","Application Data, Application Data"
"10.419960","172.18.0.2","54.38.73.16","TCP","68","36876 → 21002 [ACK] Seq=10774 Ack=185566 Win=5596 Len=0 TSval=1085974886 TSecr=2675642877"
"10.420296","54.38.73.16","172.18.0.2","TCP","68","21002 → 36876 [ACK] Seq=185566 Ack=10774 Win=1452 Len=0 TSval=2675642881 TSecr=1085974863"
"10.444442","54.38.73.16","172.18.0.2","TLSv1.2","437","Application Data"
"10.444690","172.18.0.2","54.38.73.16","TCP","68","36876 → 21002 [ACK] Seq=10774 Ack=185935 Win=5612 Len=0 TSval=1085974911 TSecr=2675642887"
"10.600603","54.38.73.16","172.18.0.2","TLSv1.2","2153","Application Data"
"10.600761","172.18.0.2","54.38.73.16","TCP","68","36876 → 21002 [ACK] Seq=10774 Ack=188020 Win=5596 Len=0 TSval=1085975067 TSecr=2675642915"
"10.601389","172.18.0.2","54.38.73.16","TLSv1.2","611","Application Data"
"10.664854","54.38.73.16","172.18.0.2","TCP","68","21002 → 36876 [ACK] Seq=188020 Ack=11317 Win=1452 Len=0 TSval=2675642943 TSecr=1085975068"
"10.664908","172.18.0.2","54.38.73.16","TLSv1.2","611","Application Data"
"10.687910","54.38.73.16","172.18.0.2","TCP","68","21002 → 36876 [ACK] Seq=188020 Ack=11860 Win=1452 Len=0 TSval=2675642948 TSecr=1085975131"
"11.420384","54.38.73.16","172.18.0.2","TLSv1.2","611","Application Data"
"11.420437","172.18.0.2","54.38.73.16","TCP","68","36876 → 21002 [ACK] Seq=11860 Ack=188563 Win=5608 Len=0 TSval=1085975887 TSecr=2675643114"
"11.421304","172.18.0.2","54.38.73.16","TLSv1.2","611","Application Data"
"11.451627","54.38.73.16","172.18.0.2","TCP","68","21002 → 36876 [ACK] Seq=188563 Ack=12403 Win=1452 Len=0 TSval=2675643139 TSecr=1085975887"
"12.032504","54.38.73.16","172.18.0.2","TLSv1.2","611","Application Data"
"12.076389","172.18.0.2","54.38.73.16","TCP","68","36876 → 21002 [ACK] Seq=12403 Ack=189106 Win=5612 Len=0 TSval=1085976543 TSecr=2675643262"
"12.113190","54.38.73.16","172.18.0.2","TLSv1.2","3695","Application Data"
"12.113247","172.18.0.2","54.38.73.16","TCP","68","36876 → 21002 [ACK] Seq=12403 Ack=192733 Win=5584 Len=0 TSval=1085976579 TSecr=2675643304"
"12.137301","54.38.73.16","172.18.0.2","TLSv1.2","1125","Application Data"
"12.137325","172.18.0.2","54.38.73.16","TCP","68","36876 → 21002 [ACK] Seq=12403 Ack=193790 Win=5593 Len=0 TSval=1085976604 TSecr=2675643311"
"12.175848","54.38.73.16","172.18.0.2","TLSv1.2","3181","Application Data"
"12.175879","172.18.0.2","54.38.73.16","TCP","68","36876 → 21002 [ACK] Seq=12403 Ack=196903 Win=5580 Len=0 TSval=1085976642 TSecr=2675643320"
"12.208140","54.38.73.16","172.18.0.2","TLSv1.2","3695","Application Data"
"12.208175","172.18.0.2","54.38.73.16","TCP","68","36876 → 21002 [ACK] Seq=12403 Ack=200530 Win=5580 Len=0 TSval=1085976674 TSecr=2675643328"
"12.215560","172.18.0.2","54.38.73.16","TLSv1.2","611","Application Data"
"12.240565","54.38.73.16","172.18.0.2","TCP","68","21002 → 36876 [ACK] Seq=200530 Ack=12946 Win=1452 Len=0 TSval=2675643336 TSecr=1085976682"
"13.263267","54.38.73.16","172.18.0.2","TLSv1.2","611","Application Data"
"13.263328","172.18.0.2","54.38.73.16","TCP","68","36876 → 21002 [ACK] Seq=12946 Ack=201073 Win=5608 Len=0 TSval=1085977729 TSecr=2675643572"
"13.264551","172.18.0.2","54.38.73.16","TLSv1.2","611","Application Data"
"13.295093","54.38.73.16","172.18.0.2","TCP","68","21002 → 36876 [ACK] Seq=201073 Ack=13489 Win=1452 Len=0 TSval=2675643600 TSecr=1085977731"
"14.300425","02:42:09:5f:bf:77","","ARP","44","Who has 172.18.0.2? Tell 172.18.0.1"
"14.300482","02:42:ac:12:00:02","","ARP","44","172.18.0.2 is at 02:42:ac:12:00:02"
"14.491594","54.38.73.16","172.18.0.2","TCP","1516","[TCP segment of a reassembled PDU]"
"14.491642","172.18.0.2","54.38.73.16","TCP","68","36876 → 21002 [ACK] Seq=13489 Ack=202521 Win=5601 Len=0 TSval=1085978958 TSecr=2675643869"
"14.491754","54.38.73.16","172.18.0.2","TLSv1.2","611","[TCP Previous segment not captured] , Application Data"
"14.491793","172.18.0.2","54.38.73.16","TCP","80","[TCP Dup ACK 227#1] 36876 → 21002 [ACK] Seq=13489 Ack=202521 Win=5601 Len=0 TSval=1085978958 TSecr=2675643869 SLE=204700 SRE=205243"
"14.491775","54.38.73.16","172.18.0.2","TCP","2247","[TCP Out-Of-Order] 21002 → 36876 [PSH, ACK] Seq=202521 Ack=13489 Win=1452 Len=2179 TSval=2675643869 TSecr=1085977731"
"14.491808","172.18.0.2","54.38.73.16","TCP","68","36876 → 21002 [ACK] Seq=13489 Ack=205243 Win=5583 Len=0 TSval=1085978958 TSecr=2675643869"
"14.579264","54.38.73.16","172.18.0.2","TLSv1.2","4145","Application Data"
"14.579296","172.18.0.2","54.38.73.16","TCP","68","36876 → 21002 [ACK] Seq=13489 Ack=209320 Win=5580 Len=0 TSval=1085979045 TSecr=2675643920"
"14.604694","54.38.73.16","172.18.0.2","TLSv1.2","161","Application Data"
"14.604727","172.18.0.2","54.38.73.16","TCP","68","36876 → 21002 [ACK] Seq=13489 Ack=209413 Win=5609 Len=0 TSval=1085979071 TSecr=2675643928"
"14.678031","54.38.73.16","172.18.0.2","TLSv1.2","799","[TCP Previous segment not captured] , Ignored Unknown Record"
"14.678068","172.18.0.2","54.38.73.16","TCP","80","[TCP Dup ACK 235#1] 36876 → 21002 [ACK] Seq=13489 Ack=209413 Win=5609 Len=0 TSval=1085979144 TSecr=2675643928 SLE=212309 SRE=213040"
"14.723544","54.38.73.16","172.18.0.2","TLSv1.2","2964","Application Data"
"14.723590","172.18.0.2","54.38.73.16","TCP","80","[TCP Dup ACK 235#2] 36876 → 21002 [ACK] Seq=13489 Ack=209413 Win=5609 Len=0 TSval=1085979190 TSecr=2675643928 SLE=212309 SRE=215936"
"14.748020","54.38.73.16","172.18.0.2","TCP","2964","[TCP Retransmission] 21002 → 36876 [ACK] Seq=209413 Ack=13489 Win=1452 Len=2896 TSval=2675643963 TSecr=1085979190"
"14.748070","172.18.0.2","54.38.73.16","TCP","68","36876 → 21002 [ACK] Seq=13489 Ack=215936 Win=5565 Len=0 TSval=1085979214 TSecr=2675643963"
"14.765501","54.38.73.16","172.18.0.2","TLSv1.2","1516","Application Data [TCP segment of a reassembled PDU]"
"14.765533","172.18.0.2","54.38.73.16","TCP","68","36876 → 21002 [ACK] Seq=13489 Ack=217384 Win=5593 Len=0 TSval=1085979232 TSecr=2675643968"
"14.772982","54.38.73.16","172.18.0.2","TLSv1.2","437","Application Data"
"14.773020","172.18.0.2","54.38.73.16","TCP","68","36876 → 21002 [ACK] Seq=13489 Ack=217753 Win=5593 Len=0 TSval=1085979239 TSecr=2675643970"
"15.104430","54.38.73.16","172.18.0.2","TLSv1.2","611","[TCP Previous segment not captured] , Application Data"
"15.104488","172.18.0.2","54.38.73.16","TCP","80","[TCP Dup ACK 245#1] 36876 → 21002 [ACK] Seq=13489 Ack=217753 Win=5593 Len=0 TSval=1085979571 TSecr=2675643970 SLE=221380 SRE=221923"
"15.104455","54.38.73.16","172.18.0.2","TCP","3695","[TCP Out-Of-Order] 21002 → 36876 [PSH, ACK] Seq=217753 Ack=13489 Win=1452 Len=3627 TSval=2675644003 TSecr=1085979239"
"15.104520","172.18.0.2","54.38.73.16","TCP","68","36876 → 21002 [ACK] Seq=13489 Ack=221923 Win=5565 Len=0 TSval=1085979571 TSecr=2675644003"
"15.128507","54.38.73.16","172.18.0.2","TLSv1.2","3695","Application Data"
"15.128553","172.18.0.2","54.38.73.16","TCP","68","36876 → 21002 [ACK] Seq=13489 Ack=225550 Win=5580 Len=0 TSval=1085979595 TSecr=2675644058"
"15.185765","54.38.73.16","172.18.0.2","TLSv1.2","2153","Application Data"
"15.185797","172.18.0.2","54.38.73.16","TCP","68","36876 → 21002 [ACK] Seq=13489 Ack=227635 Win=5599 Len=0 TSval=1085979652 TSecr=2675644073"
"15.186250","172.18.0.2","54.38.73.16","TLSv1.2","611","Application Data"
"15.210353","54.38.73.16","172.18.0.2","TCP","68","21002 → 36876 [ACK] Seq=227635 Ack=14032 Win=1452 Len=0 TSval=2675644079 TSecr=1085979652"
"15.311624","54.38.73.16","172.18.0.2","TCP","1516","[TCP segment of a reassembled PDU]"
"15.311723","54.38.73.16","172.18.0.2","TLSv1.2","1219","Application Data"
"15.311802","172.18.0.2","54.38.73.16","TCP","68","36876 → 21002 [ACK] Seq=14032 Ack=230234 Win=5592 Len=0 TSval=1085979778 TSecr=2675644104"
"15.402937","54.38.73.16","172.18.0.2","TLSv1.2","3695","Application Data"
"15.403089","172.18.0.2","54.38.73.16","TCP","68","36876 → 21002 [ACK] Seq=14032 Ack=233861 Win=5580 Len=0 TSval=1085979869 TSecr=2675644127"
"15.403536","172.18.0.2","54.38.73.16","TLSv1.2","611","Application Data"
"15.427839","54.38.73.16","172.18.0.2","TLSv1.2","611","Application Data"
"15.427849","54.38.73.16","172.18.0.2","TCP","68","21002 → 36876 [ACK] Seq=234404 Ack=14575 Win=1452 Len=0 TSval=2675644133 TSecr=1085979870"
"15.468386","172.18.0.2","54.38.73.16","TCP","68","36876 → 21002 [ACK] Seq=14575 Ack=234404 Win=5612 Len=0 TSval=1085979935 TSecr=2675644133"
"15.569485","54.38.73.16","172.18.0.2","TLSv1.2","3695","Application Data"
"15.569533","172.18.0.2","54.38.73.16","TCP","68","36876 → 21002 [ACK] Seq=14575 Ack=238031 Win=5584 Len=0 TSval=1085980036 TSecr=2675644168"
"15.605545","54.38.73.16","172.18.0.2","TLSv1.2","611","Application Data"
"15.605588","172.18.0.2","54.38.73.16","TCP","68","36876 → 21002 [ACK] Seq=14575 Ack=238574 Win=5593 Len=0 TSval=1085980072 TSecr=2675644176"
"15.706816","54.38.73.16","172.18.0.2","TLSv1.2","3695","Application Data"
"15.706898","172.18.0.2","54.38.73.16","TCP","68","36876 → 21002 [ACK] Seq=14575 Ack=242201 Win=5580 Len=0 TSval=1085980173 TSecr=2675644200"
"15.735264","54.38.73.16","172.18.0.2","TLSv1.2","611","Application Data"
"15.735313","172.18.0.2","54.38.73.16","TCP","68","36876 → 21002 [ACK] Seq=14575 Ack=242744 Win=5593 Len=0 TSval=1085980201 TSecr=2675644210"
"15.759604","54.38.73.16","172.18.0.2","TLSv1.2","611","Application Data"
"15.759641","172.18.0.2","54.38.73.16","TCP","68","36876 → 21002 [ACK] Seq=14575 Ack=243287 Win=5593 Len=0 TSval=1085980226 TSecr=2675644216"
"15.791039","54.38.73.16","172.18.0.2","TLSv1.2","3695","Application Data"
"15.791072","172.18.0.2","54.38.73.16","TCP","68","36876 → 21002 [ACK] Seq=14575 Ack=246914 Win=5580 Len=0 TSval=1085980257 TSecr=2675644224"
"15.811773","54.38.73.16","172.18.0.2","TCP","2964","[TCP segment of a reassembled PDU]"
"15.811825","172.18.0.2","54.38.73.16","TCP","68","36876 → 21002 [ACK] Seq=14575 Ack=249810 Win=5577 Len=0 TSval=1085980278 TSecr=2675644229"
"15.815278","54.38.73.16","172.18.0.2","TLSv1.2","799","Application Data"
"15.815316","172.18.0.2","54.38.73.16","TCP","68","36876 → 21002 [ACK] Seq=14575 Ack=250541 Win=5593 Len=0 TSval=1085980281 TSecr=2675644230"
"15.838903","54.38.73.16","172.18.0.2","TLSv1.2","611","Application Data"
"15.839143","172.18.0.2","54.38.73.16","TCP","68","36876 → 21002 [ACK] Seq=14575 Ack=251084 Win=5612 Len=0 TSval=1085980305 TSecr=2675644236"
"15.894737","54.38.73.16","172.18.0.2","TLSv1.2","3695","Application Data"
"15.894921","172.18.0.2","54.38.73.16","TCP","68","36876 → 21002 [ACK] Seq=14575 Ack=254711 Win=5584 Len=0 TSval=1085980361 TSecr=2675644250"
"15.895334","172.18.0.2","54.38.73.16","TLSv1.2","611","Application Data"
"15.919513","54.38.73.16","172.18.0.2","TCP","68","21002 → 36876 [ACK] Seq=254711 Ack=15118 Win=1452 Len=0 TSval=2675644256 TSecr=1085980362"
"15.924255","54.38.73.16","172.18.0.2","TLSv1.2","611","Application Data"
"15.924463","172.18.0.2","54.38.73.16","TCP","68","36876 → 21002 [ACK] Seq=15118 Ack=255254 Win=5612 Len=0 TSval=1085980391 TSecr=2675644257"
"15.965657","54.38.73.16","172.18.0.2","TLSv1.2","3695","Application Data"
"15.965850","172.18.0.2","54.38.73.16","TCP","68","36876 → 21002 [ACK] Seq=15118 Ack=258881 Win=5584 Len=0 TSval=1085980432 TSecr=2675644268"
"15.989155","54.38.73.16","172.18.0.2","TLSv1.2","611","Application Data"
"15.989401","172.18.0.2","54.38.73.16","TCP","68","36876 → 21002 [ACK] Seq=15118 Ack=259424 Win=5612 Len=0 TSval=1085980456 TSecr=2675644274"
"16.037594","54.38.73.16","172.18.0.2","TLSv1.2","611","Application Data"
"16.080442","172.18.0.2","54.38.73.16","TCP","68","36876 → 21002 [ACK] Seq=15118 Ack=259967 Win=5612 Len=0 TSval=1085980547 TSecr=2675644286"
"16.110025","54.38.73.16","172.18.0.2","TLSv1.2","3181","Application Data"
"16.110190","172.18.0.2","54.38.73.16","TCP","68","36876 → 21002 [ACK] Seq=15118 Ack=263080 Win=5588 Len=0 TSval=1085980576 TSecr=2675644304"
"16.173211","54.38.73.16","172.18.0.2","TLSv1.2","1639","Application Data"
"16.173233","172.18.0.2","54.38.73.16","TCP","68","36876 → 21002 [ACK] Seq=15118 Ack=264651 Win=5601 Len=0 TSval=1085980639 TSecr=2675644320"
"16.225057","54.38.73.16","172.18.0.2","TLSv1.2","3695","Application Data"
"16.225257","172.18.0.2","54.38.73.16","TCP","68","36876 → 21002 [ACK] Seq=15118 Ack=268278 Win=5580 Len=0 TSval=1085980691 TSecr=2675644333"
"16.298238","54.38.73.16","172.18.0.2","TLSv1.2","3695","Application Data"
"16.298304","172.18.0.2","54.38.73.16","TCP","68","36876 → 21002 [ACK] Seq=15118 Ack=271905 Win=5580 Len=0 TSval=1085980764 TSecr=2675644351"
"16.311650","172.18.0.2","54.38.73.16","TLSv1.2","611","Application Data"
"16.372731","54.38.73.16","172.18.0.2","TCP","68","21002 → 36876 [ACK] Seq=271905 Ack=15661 Win=1452 Len=0 TSval=2675644370 TSecr=1085980778"
"16.744417","54.38.73.16","172.18.0.2","TLSv1.2","611","Application Data"
"16.744470","172.18.0.2","54.38.73.16","TCP","68","36876 → 21002 [ACK] Seq=15661 Ack=272448 Win=5608 Len=0 TSval=1085981211 TSecr=2675644454"
"16.745426","172.18.0.2","54.38.73.16","TLSv1.2","611","Application Data"
"16.770168","54.38.73.16","172.18.0.2","TCP","68","21002 → 36876 [ACK] Seq=272448 Ack=16204 Win=1452 Len=0 TSval=2675644469 TSecr=1085981212"
"17.564257","54.38.73.16","172.18.0.2","TLSv1.2","611","Application Data"
"17.564278","54.38.73.16","172.18.0.2","TCP","611","[TCP Retransmission] 21002 → 36876 [PSH, ACK] Seq=272448 Ack=16204 Win=1452 Len=543 TSval=2675644660 TSecr=1085981212"
"17.564383","172.18.0.2","54.38.73.16","TCP","80","36876 → 21002 [ACK] Seq=16204 Ack=272991 Win=5608 Len=0 TSval=1085982031 TSecr=2675644660 SLE=272448 SRE=272991"
"17.564296","54.38.73.16","172.18.0.2","TCP","1516","[TCP segment of a reassembled PDU]"
"17.564399","172.18.0.2","54.38.73.16","TCP","68","[TCP Dup ACK 311#1] 36876 → 21002 [ACK] Seq=16204 Ack=272991 Win=5608 Len=0 TSval=1085982031 TSecr=2675644660"
"17.588683","54.38.73.16","172.18.0.2","TLSv1.2","191","Application Data"
"17.588721","172.18.0.2","54.38.73.16","TCP","80","[TCP Dup ACK 311#2] 36876 → 21002 [ACK] Seq=16204 Ack=272991 Win=5608 Len=0 TSval=1085982055 TSecr=2675644660 SLE=274439 SRE=274562"
"17.600461","54.38.73.16","172.18.0.2","TCP","191","[TCP Retransmission] 21002 → 36876 [PSH, ACK] Seq=274439 Ack=16204 Win=1452 Len=123 TSval=2675644677 TSecr=1085982031"
"17.600503","172.18.0.2","54.38.73.16","TCP","88","[TCP Dup ACK 311#3] 36876 → 21002 [ACK] Seq=16204 Ack=272991 Win=5608 Len=0 TSval=1085982067 TSecr=2675644660 SLE=274439 SRE=274562 SLE=274439 SRE=274562"
"17.872635","54.38.73.16","172.18.0.2","TCP","1516","[TCP Retransmission] 21002 → 36876 [ACK] Seq=272991 Ack=16204 Win=1452 Len=1448 TSval=2675644737 TSecr=1085982067"
"17.872696","172.18.0.2","54.38.73.16","TCP","68","36876 → 21002 [ACK] Seq=16204 Ack=274562 Win=5596 Len=0 TSval=1085982339 TSecr=2675644737"
"17.881048","172.18.0.2","54.38.73.16","TLSv1.2","611","Application Data"
"17.910163","54.38.73.16","172.18.0.2","TCP","68","21002 → 36876 [ACK] Seq=274562 Ack=16747 Win=1452 Len=0 TSval=2675644754 TSecr=1085982347"
"18.490763","54.38.73.16","172.18.0.2","TLSv1.2","611","Application Data"
"18.490832","172.18.0.2","54.38.73.16","TCP","68","36876 → 21002 [ACK] Seq=16747 Ack=275105 Win=5608 Len=0 TSval=1085982957 TSecr=2675644870"
"18.491730","172.18.0.2","54.38.73.16","TLSv1.2","611","Application Data"
"18.534746","54.38.73.16","172.18.0.2","TCP","68","21002 → 36876 [ACK] Seq=275105 Ack=17290 Win=1452 Len=0 TSval=2675644910 TSecr=1085982958"
"19.102366","54.38.73.16","172.18.0.2","TCP","1516","[TCP segment of a reassembled PDU]"
"19.102430","172.18.0.2","54.38.73.16","TCP","68","36876 → 21002 [ACK] Seq=17290 Ack=276553 Win=5601 Len=0 TSval=1085983569 TSecr=2675645033"
"19.102594","54.38.73.16","172.18.0.2","TLSv1.2","1733","Application Data"
"19.102622","172.18.0.2","54.38.73.16","TCP","68","36876 → 21002 [ACK] Seq=17290 Ack=278218 Win=5601 Len=0 TSval=1085983569 TSecr=2675645033"
"19.110291","172.18.0.2","54.38.73.16","TLSv1.2","611","Application Data"
"19.137344","54.38.73.16","172.18.0.2","TCP","68","21002 → 36876 [ACK] Seq=278218 Ack=17833 Win=1452 Len=0 TSval=2675645061 TSecr=1085983576"
"20.026883","54.38.73.16","172.18.0.2","TLSv1.2","611","Application Data"
"20.027882","172.18.0.2","54.38.73.16","TLSv1.2","611","Application Data"
"20.051817","54.38.73.16","172.18.0.2","TCP","68","21002 → 36876 [ACK] Seq=278761 Ack=18376 Win=1452 Len=0 TSval=2675645289 TSecr=1085984494"
"21.256518","54.38.73.16","172.18.0.2","TLSv1.2","611","Application Data"
"21.256555","54.38.73.16","172.18.0.2","TCP","2964","[TCP segment of a reassembled PDU]"
"21.256680","172.18.0.2","54.38.73.16","TCP","68","36876 → 21002 [ACK] Seq=18376 Ack=282200 Win=5586 Len=0 TSval=1085985723 TSecr=2675645528"
"21.283280","54.38.73.16","172.18.0.2","TLSv1.2","1516","Application Data [TCP segment of a reassembled PDU]"
"21.288586","54.38.73.16","172.18.0.2","TLSv1.2","1979","Application Data, Application Data"
"21.288618","172.18.0.2","54.38.73.16","TCP","68","36876 → 21002 [ACK] Seq=18376 Ack=285559 Win=5600 Len=0 TSval=1085985755 TSecr=2675645597"
"21.294750","172.18.0.2","54.38.73.16","TLSv1.2","611","Application Data"
"21.319200","54.38.73.16","172.18.0.2","TCP","68","21002 → 36876 [ACK] Seq=285559 Ack=18919 Win=1452 Len=0 TSval=2675645606 TSecr=1085985761"
"21.869419","54.38.73.16","172.18.0.2","TLSv1.2","611","Application Data"
"21.870491","172.18.0.2","54.38.73.16","TLSv1.2","611","Application Data"
"21.896004","54.38.73.16","172.18.0.2","TCP","68","21002 → 36876 [ACK] Seq=286102 Ack=19462 Win=1452 Len=0 TSval=2675645750 TSecr=1085986337"
"22.481450","54.38.73.16","172.18.0.2","TLSv1.2","611","Application Data"
"22.524470","172.18.0.2","54.38.73.16","TCP","68","36876 → 21002 [ACK] Seq=19462 Ack=286645 Win=5612 Len=0 TSval=1085986991 TSecr=2675645884"
"22.583408","54.38.73.16","172.18.0.2","TLSv1.2","3695","Application Data"
"22.583470","172.18.0.2","54.38.73.16","TCP","68","36876 → 21002 [ACK] Seq=19462 Ack=290272 Win=5584 Len=0 TSval=1085987050 TSecr=2675645922"
"22.583917","172.18.0.2","54.38.73.16","TLSv1.2","611","Application Data"
"22.610165","54.38.73.16","172.18.0.2","TCP","68","21002 → 36876 [ACK] Seq=290272 Ack=20005 Win=1452 Len=0 TSval=2675645929 TSecr=1085987050"
"22.701123","54.38.73.16","172.18.0.2","TLSv1.2","3695","Application Data"
"22.701156","172.18.0.2","54.38.73.16","TCP","68","36876 → 21002 [ACK] Seq=20005 Ack=293899 Win=5584 Len=0 TSval=1085987167 TSecr=2675645951"
"22.711129","54.38.73.16","172.18.0.2","TCP","1516","[TCP segment of a reassembled PDU]"
"22.711162","172.18.0.2","54.38.73.16","TCP","68","36876 → 21002 [ACK] Seq=20005 Ack=295347 Win=5593 Len=0 TSval=1085987177 TSecr=2675645954"
"22.726339","54.38.73.16","172.18.0.2","TLSv1.2","2964","Application Data [TCP segment of a reassembled PDU]"
"22.726372","172.18.0.2","54.38.73.16","TCP","68","36876 → 21002 [ACK] Seq=20005 Ack=298243 Win=5596 Len=0 TSval=1085987193 TSecr=2675645958"
"22.735021","54.38.73.16","172.18.0.2","TCP","1516","21002 → 36876 [ACK] Seq=298243 Ack=20005 Win=1452 Len=1448 TSval=2675645960 TSecr=1085987167 [TCP segment of a reassembled PDU]"
"22.735052","172.18.0.2","54.38.73.16","TCP","68","36876 → 21002 [ACK] Seq=20005 Ack=299691 Win=5593 Len=0 TSval=1085987201 TSecr=2675645960"
"22.735778","54.38.73.16","172.18.0.2","TLSv1.2","1516","Application Data [TCP segment of a reassembled PDU]"
"22.735811","172.18.0.2","54.38.73.16","TCP","68","36876 → 21002 [ACK] Seq=20005 Ack=301139 Win=5593 Len=0 TSval=1085987202 TSecr=2675645960"
"22.751373","54.38.73.16","172.18.0.2","TLSv1.2","625","Application Data"
"22.751411","172.18.0.2","54.38.73.16","TCP","68","36876 → 21002 [ACK] Seq=20005 Ack=301696 Win=5593 Len=0 TSval=1085987218 TSecr=2675645964"
"22.777791","54.38.73.16","172.18.0.2","TLSv1.2","1125","Application Data"
"22.777839","172.18.0.2","54.38.73.16","TCP","68","36876 → 21002 [ACK] Seq=20005 Ack=302753 Win=5593 Len=0 TSval=1085987244 TSecr=2675645970"
"22.784003","172.18.0.2","54.38.73.16","TLSv1.2","611","Application Data"
"22.809872","54.38.73.16","172.18.0.2","TCP","68","21002 → 36876 [ACK] Seq=302753 Ack=20548 Win=1452 Len=0 TSval=2675645979 TSecr=1085987250"
"23.297871","54.38.73.16","172.18.0.2","TLSv1.2","611","Application Data"
"23.297899","172.18.0.2","54.38.73.16","TCP","68","36876 → 21002 [ACK] Seq=20548 Ack=303296 Win=5608 Len=0 TSval=1085987764 TSecr=2675646087"
"23.298438","172.18.0.2","54.38.73.16","TLSv1.2","611","Application Data"
"23.322834","54.38.73.16","172.18.0.2","TCP","68","21002 → 36876 [ACK] Seq=303296 Ack=21091 Win=1452 Len=0 TSval=2675646107 TSecr=1085987765"
"24.016609","54.38.73.16","172.18.0.2","TLSv1.2","3695","Application Data"
"24.016756","172.18.0.2","54.38.73.16","TCP","68","36876 → 21002 [ACK] Seq=21091 Ack=306923 Win=5584 Len=0 TSval=1085988483 TSecr=2675646268"
"24.053887","54.38.73.16","172.18.0.2","TLSv1.2","1516","Application Data"
"24.070109","54.38.73.16","172.18.0.2","TLSv1.2","2790","Application Data"
"24.070139","172.18.0.2","54.38.73.16","TCP","68","36876 → 21002 [ACK] Seq=21091 Ack=311093 Win=5596 Len=0 TSval=1085988536 TSecr=2675646290"
"24.085330","54.38.73.16","172.18.0.2","TCP","1516","[TCP segment of a reassembled PDU]"
"24.094929","54.38.73.16","172.18.0.2","TLSv1.2","1733","Application Data"
"24.094962","172.18.0.2","54.38.73.16","TCP","68","36876 → 21002 [ACK] Seq=21091 Ack=314206 Win=5601 Len=0 TSval=1085988561 TSecr=2675646298"
"24.118978","54.38.73.16","172.18.0.2","TLSv1.2","1639","Application Data"
"24.119010","172.18.0.2","54.38.73.16","TCP","68","36876 → 21002 [ACK] Seq=21091 Ack=315777 Win=5601 Len=0 TSval=1085988585 TSecr=2675646306"
"24.212600","54.38.73.16","172.18.0.2","TLSv1.2","3181","Application Data"
"24.212741","172.18.0.2","54.38.73.16","TCP","68","36876 → 21002 [ACK] Seq=21091 Ack=318890 Win=5580 Len=0 TSval=1085988679 TSecr=2675646329"
"24.264371","54.38.73.16","172.18.0.2","TLSv1.2","1639","Application Data"
"24.264404","172.18.0.2","54.38.73.16","TCP","68","36876 → 21002 [ACK] Seq=21091 Ack=320461 Win=5601 Len=0 TSval=1085988731 TSecr=2675646342"
"24.338783","54.38.73.16","172.18.0.2","TLSv1.2","3695","Application Data"
"24.338930","172.18.0.2","54.38.73.16","TCP","68","36876 → 21002 [ACK] Seq=21091 Ack=324088 Win=5580 Len=0 TSval=1085988805 TSecr=2675646361"
"24.363943","54.38.73.16","172.18.0.2","TLSv1.2","1125","Application Data"
"24.404504","172.18.0.2","54.38.73.16","TCP","68","36876 → 21002 [ACK] Seq=21091 Ack=325145 Win=5612 Len=0 TSval=1085988871 TSecr=2675646367"
"24.412368","54.38.73.16","172.18.0.2","TCP","2964","[TCP segment of a reassembled PDU]"
"24.412398","172.18.0.2","54.38.73.16","TCP","68","36876 → 21002 [ACK] Seq=21091 Ack=328041 Win=5596 Len=0 TSval=1085988879 TSecr=2675646379"
"24.428093","54.38.73.16","172.18.0.2","TLSv1.2","285","Application Data"
"24.428154","172.18.0.2","54.38.73.16","TCP","68","36876 → 21002 [ACK] Seq=21091 Ack=328258 Win=5595 Len=0 TSval=1085988894 TSecr=2675646383"
"24.432963","54.38.73.16","172.18.0.2","TCP","1516","[TCP segment of a reassembled PDU]"
"24.432996","172.18.0.2","54.38.73.16","TCP","68","36876 → 21002 [ACK] Seq=21091 Ack=329706 Win=5593 Len=0 TSval=1085988899 TSecr=2675646385"
"24.435992","54.38.73.16","172.18.0.2","TCP","1516","21002 → 36876 [ACK] Seq=329706 Ack=21091 Win=1452 Len=1448 TSval=2675646385 TSecr=1085988879 [TCP segment of a reassembled PDU]"
"24.436025","172.18.0.2","54.38.73.16","TCP","68","36876 → 21002 [ACK] Seq=21091 Ack=331154 Win=5593 Len=0 TSval=1085988902 TSecr=2675646385"
"24.451995","54.38.73.16","172.18.0.2","TLSv1.2","285","Application Data"
"24.452033","172.18.0.2","54.38.73.16","TCP","68","36876 → 21002 [ACK] Seq=21091 Ack=331371 Win=5593 Len=0 TSval=1085988918 TSecr=2675646389"
"24.452583","172.18.0.2","54.38.73.16","TLSv1.2","611","Application Data"
"24.477027","54.38.73.16","172.18.0.2","TCP","68","21002 → 36876 [ACK] Seq=331371 Ack=21634 Win=1452 Len=0 TSval=2675646395 TSecr=1085988919"
"24.561576","54.38.73.16","172.18.0.2","TLSv1.2","2153","Application Data"
"24.561611","172.18.0.2","54.38.73.16","TCP","68","36876 → 21002 [ACK] Seq=21634 Ack=333456 Win=5599 Len=0 TSval=1085989028 TSecr=2675646416"
"24.568484","172.18.0.2","54.38.73.16","TLSv1.2","611","Application Data"
"24.592201","54.38.73.16","172.18.0.2","TCP","68","21002 → 36876 [ACK] Seq=333456 Ack=22177 Win=1452 Len=0 TSval=2675646424 TSecr=1085989035"
"25.229717","54.38.73.16","172.18.0.2","TLSv1.2","611","Application Data"
"25.229777","172.18.0.2","54.38.73.16","TCP","68","36876 → 21002 [ACK] Seq=22177 Ack=333999 Win=5608 Len=0 TSval=1085989696 TSecr=2675646584"
"25.230735","172.18.0.2","54.38.73.16","TLSv1.2","611","Application Data"
"25.255802","54.38.73.16","172.18.0.2","TCP","68","21002 → 36876 [ACK] Seq=333999 Ack=22720 Win=1452 Len=0 TSval=2675646590 TSecr=1085989697"
"26.164003","54.38.73.16","172.18.0.2","TCP","1516","[TCP segment of a reassembled PDU]"
"26.164120","54.38.73.16","172.18.0.2","TLSv1.2","2697","Application Data"
"26.164127","54.38.73.16","172.18.0.2","TLSv1.2","1516","Application Data"
"26.164132","54.38.73.16","172.18.0.2","TCP","1516","21002 → 36876 [ACK] Seq=339524 Ack=22720 Win=1452 Len=1448 TSval=2675646780 TSecr=1085989697 [TCP segment of a reassembled PDU]"
"26.164201","172.18.0.2","54.38.73.16","TCP","68","36876 → 21002 [ACK] Seq=22720 Ack=340972 Win=5582 Len=0 TSval=1085990630 TSecr=2675646759"
"26.188866","54.38.73.16","172.18.0.2","TLSv1.2","5576","Application Data, Application Data, Application Data"
"26.188898","172.18.0.2","54.38.73.16","TCP","68","36876 → 21002 [ACK] Seq=22720 Ack=346480 Win=5582 Len=0 TSval=1085990655 TSecr=2675646824"
"26.189629","172.18.0.2","54.38.73.16","TLSv1.2","611","Application Data"
"26.196225","54.38.73.16","172.18.0.2","TCP","1516","[TCP segment of a reassembled PDU]"
"26.214636","54.38.73.16","172.18.0.2","TCP","68","[TCP Previous segment not captured] 21002 → 36876 [ACK] Seq=353720 Ack=23263 Win=1452 Len=0 TSval=2675646830 TSecr=1085990656"
"26.214663","54.38.73.16","172.18.0.2","TCP","5860","[TCP Retransmission] 21002 → 36876 [ACK] Seq=347928 Ack=22720 Win=1452 Len=5792 TSval=2675646830 TSecr=1085990655"
"26.214801","172.18.0.2","54.38.73.16","TCP","68","36876 → 21002 [ACK] Seq=23263 Ack=353720 Win=5581 Len=0 TSval=1085990681 TSecr=2675646825"
"26.239832","54.38.73.16","172.18.0.2","TLSv1.2","2196","Ignored Unknown Record"
"26.239862","172.18.0.2","54.38.73.16","TCP","68","36876 → 21002 [ACK] Seq=23263 Ack=355848 Win=5599 Len=0 TSval=1085990706 TSecr=2675646836"
"26.247930","54.38.73.16","172.18.0.2","TCP","2964","[TCP segment of a reassembled PDU]"
"26.248067","172.18.0.2","54.38.73.16","TCP","68","36876 → 21002 [ACK] Seq=23263 Ack=358744 Win=5596 Len=0 TSval=1085990714 TSecr=2675646838"
"26.265227","54.38.73.16","172.18.0.2","TLSv1.2","285","Application Data"
"26.308422","172.18.0.2","54.38.73.16","TCP","68","36876 → 21002 [ACK] Seq=23263 Ack=358961 Win=5612 Len=0 TSval=1085990775 TSecr=2675646842"
"26.320831","54.38.73.16","172.18.0.2","TCP","2964","[TCP segment of a reassembled PDU]"
"26.320846","172.18.0.2","54.38.73.16","TCP","68","36876 → 21002 [ACK] Seq=23263 Ack=361857 Win=5596 Len=0 TSval=1085990787 TSecr=2675646856"
"26.331796","54.38.73.16","172.18.0.2","TLSv1.2","799","Application Data"
"26.331826","172.18.0.2","54.38.73.16","TCP","68","36876 → 21002 [ACK] Seq=23263 Ack=362588 Win=5593 Len=0 TSval=1085990798 TSecr=2675646859"
"26.332010","172.18.0.2","54.38.73.16","TLSv1.2","611","Application Data"
"26.342406","54.38.73.16","172.18.0.2","TCP","1516","[TCP segment of a reassembled PDU]"
"26.342423","172.18.0.2","54.38.73.16","TCP","68","36876 → 21002 [ACK] Seq=23806 Ack=364036 Win=5601 Len=0 TSval=1085990809 TSecr=2675646862"
"26.355499","54.38.73.16","172.18.0.2","TLSv1.2","191","Application Data"
"26.355531","172.18.0.2","54.38.73.16","TCP","68","36876 → 21002 [ACK] Seq=23806 Ack=364159 Win=5601 Len=0 TSval=1085990822 TSecr=2675646865"
"26.393104","54.38.73.16","172.18.0.2","TCP","68","21002 → 36876 [ACK] Seq=364159 Ack=23806 Win=1452 Len=0 TSval=2675646875 TSecr=1085990798"
"26.436373","54.38.73.16","172.18.0.2","TLSv1.2","3695","Application Data"
"26.436405","172.18.0.2","54.38.73.16","TCP","68","36876 → 21002 [ACK] Seq=23806 Ack=367786 Win=5580 Len=0 TSval=1085990903 TSecr=2675646885"
"26.608281","54.38.73.16","172.18.0.2","TLSv1.2","1639","Application Data"
"26.608332","172.18.0.2","54.38.73.16","TCP","68","36876 → 21002 [ACK] Seq=23806 Ack=369357 Win=5577 Len=0 TSval=1085991074 TSecr=2675646928"
"26.619603","54.38.73.16","172.18.0.2","TLSv1.2","4412","Application Data"
"26.619635","172.18.0.2","54.38.73.16","TCP","68","36876 → 21002 [ACK] Seq=23806 Ack=373701 Win=5580 Len=0 TSval=1085991086 TSecr=2675646931"
"26.632317","54.38.73.16","172.18.0.2","TCP","2964","21002 → 36876 [ACK] Seq=373701 Ack=23806 Win=1452 Len=2896 TSval=2675646934 TSecr=1085991074 [TCP segment of a reassembled PDU]"
"26.632366","172.18.0.2","54.38.73.16","TCP","68","36876 → 21002 [ACK] Seq=23806 Ack=376597 Win=5596 Len=0 TSval=1085991099 TSecr=2675646934"
"26.643739","54.38.73.16","172.18.0.2","TLSv1.2","1139","Application Data, Application Data"
"26.644153","172.18.0.2","54.38.73.16","TCP","68","36876 → 21002 [ACK] Seq=23806 Ack=377668 Win=5612 Len=0 TSval=1085991110 TSecr=2675646937"
"26.671105","54.38.73.16","172.18.0.2","TLSv1.2","3695","Application Data"
"26.671251","172.18.0.2","54.38.73.16","TCP","68","36876 → 21002 [ACK] Seq=23806 Ack=381295 Win=5584 Len=0 TSval=1085991137 TSecr=2675646944"
"26.685357","172.18.0.2","54.38.73.16","TLSv1.2","611","Application Data"
"26.702505","54.38.73.16","172.18.0.2","TLSv1.2","611","Application Data"
"26.702635","172.18.0.2","54.38.73.16","TCP","68","36876 → 21002 [ACK] Seq=24349 Ack=381838 Win=5612 Len=0 TSval=1085991169 TSecr=2675646952"
"26.709682","54.38.73.16","172.18.0.2","TCP","68","21002 → 36876 [ACK] Seq=381838 Ack=24349 Win=1452 Len=0 TSval=2675646954 TSecr=1085991152"
"26.709723","172.18.0.2","54.38.73.16","TLSv1.2","611","Application Data"
"26.732987","54.38.73.16","172.18.0.2","TCP","68","21002 → 36876 [ACK] Seq=381838 Ack=24892 Win=1452 Len=0 TSval=2675646960 TSecr=1085991176"
"27.386988","54.38.73.16","172.18.0.2","TLSv1.2","611","Application Data"
"27.387908","172.18.0.2","54.38.73.16","TLSv1.2","611","Application Data"
"27.412206","54.38.73.16","172.18.0.2","TCP","68","21002 → 36876 [ACK] Seq=382381 Ack=25435 Win=1452 Len=0 TSval=2675647129 TSecr=1085991854"
"27.906057","54.38.73.16","172.18.0.2","TCP","1516","[TCP segment of a reassembled PDU]"
"27.906196","54.38.73.16","172.18.0.2","TLSv1.2","2247","Application Data"
"27.906264","172.18.0.2","54.38.73.16","TCP","68","36876 → 21002 [ACK] Seq=25435 Ack=386008 Win=5612 Len=0 TSval=1085992372 TSecr=2675647250"
"27.930028","54.38.73.16","172.18.0.2","TLSv1.2","611","Application Data"
"27.972521","172.18.0.2","54.38.73.16","TCP","68","36876 → 21002 [ACK] Seq=25435 Ack=386551 Win=5612 Len=0 TSval=1085992439 TSecr=2675647259"
"28.003686","54.38.73.16","172.18.0.2","TLSv1.2","3695","Application Data"
"28.003738","172.18.0.2","54.38.73.16","TCP","68","36876 → 21002 [ACK] Seq=25435 Ack=390178 Win=5584 Len=0 TSval=1085992470 TSecr=2675647277"
"28.027231","54.38.73.16","172.18.0.2","TLSv1.2","1125","Application Data"
"28.027263","172.18.0.2","54.38.73.16","TCP","68","36876 → 21002 [ACK] Seq=25435 Ack=391235 Win=5593 Len=0 TSval=1085992493 TSecr=2675647283"
"28.069762","54.38.73.16","172.18.0.2","TLSv1.2","3695","Application Data"
"28.069794","172.18.0.2","54.38.73.16","TCP","68","36876 → 21002 [ACK] Seq=25435 Ack=394862 Win=5580 Len=0 TSval=1085992536 TSecr=2675647293"
"28.092188","54.38.73.16","172.18.0.2","TCP","2964","[TCP segment of a reassembled PDU]"
"28.092222","172.18.0.2","54.38.73.16","TCP","68","36876 → 21002 [ACK] Seq=25435 Ack=397758 Win=5596 Len=0 TSval=1085992558 TSecr=2675647298"
"28.093328","54.38.73.16","172.18.0.2","TLSv1.2","799","Application Data"
"28.093360","172.18.0.2","54.38.73.16","TCP","68","36876 → 21002 [ACK] Seq=25435 Ack=398489 Win=5593 Len=0 TSval=1085992560 TSecr=2675647300"
"28.093836","172.18.0.2","54.38.73.16","TLSv1.2","611","Application Data"
"28.117359","54.38.73.16","172.18.0.2","TCP","68","21002 → 36876 [ACK] Seq=398489 Ack=25978 Win=1452 Len=0 TSval=2675647306 TSecr=1085992560"
"28.162256","54.38.73.16","172.18.0.2","TLSv1.2","1125","Application Data"
"28.162289","172.18.0.2","54.38.73.16","TCP","68","36876 → 21002 [ACK] Seq=25978 Ack=399546 Win=5604 Len=0 TSval=1085992628 TSecr=2675647317"
"28.183022","54.38.73.16","172.18.0.2","TCP","2964","[TCP segment of a reassembled PDU]"
"28.183052","172.18.0.2","54.38.73.16","TCP","68","36876 → 21002 [ACK] Seq=25978 Ack=402442 Win=5582 Len=0 TSval=1085992649 TSecr=2675647322"
"28.187505","54.38.73.16","172.18.0.2","TLSv1.2","285","Application Data"
"28.187537","172.18.0.2","54.38.73.16","TCP","68","36876 → 21002 [ACK] Seq=25978 Ack=402659 Win=5593 Len=0 TSval=1085992654 TSecr=2675647323"
"28.218143","54.38.73.16","172.18.0.2","TLSv1.2","611","Application Data"
"28.218176","172.18.0.2","54.38.73.16","TCP","68","36876 → 21002 [ACK] Seq=25978 Ack=403202 Win=5593 Len=0 TSval=1085992684 TSecr=2675647330"
"28.244057","54.38.73.16","172.18.0.2","TLSv1.2","1125","Application Data"
"28.244094","172.18.0.2","54.38.73.16","TCP","68","36876 → 21002 [ACK] Seq=25978 Ack=404259 Win=5593 Len=0 TSval=1085992710 TSecr=2675647337"
"28.274661","54.38.73.16","172.18.0.2","TLSv1.2","3181","Application Data"
"28.274692","172.18.0.2","54.38.73.16","TCP","68","36876 → 21002 [ACK] Seq=25978 Ack=407372 Win=5580 Len=0 TSval=1085992741 TSecr=2675647345"
"28.308039","54.38.73.16","172.18.0.2","TLSv1.2","3181","Application Data"
"28.308069","172.18.0.2","54.38.73.16","TCP","68","36876 → 21002 [ACK] Seq=25978 Ack=410485 Win=5580 Len=0 TSval=1085992774 TSecr=2675647353"
"28.308568","172.18.0.2","54.38.73.16","TLSv1.2","611","Application Data"
"28.333460","54.38.73.16","172.18.0.2","TLSv1.2","1125","Application Data"
"28.333464","54.38.73.16","172.18.0.2","TCP","68","21002 → 36876 [ACK] Seq=411542 Ack=26521 Win=1452 Len=0 TSval=2675647360 TSecr=1085992775"
"28.333526","172.18.0.2","54.38.73.16","TCP","68","36876 → 21002 [ACK] Seq=26521 Ack=411542 Win=5612 Len=0 TSval=1085992800 TSecr=2675647359"
"28.410683","54.38.73.16","172.18.0.2","TLSv1.2","1125","Application Data"
"28.452520","172.18.0.2","54.38.73.16","TCP","68","36876 → 21002 [ACK] Seq=26521 Ack=412599 Win=5612 Len=0 TSval=1085992919 TSecr=2675647379"
"28.456377","54.38.73.16","172.18.0.2","TCP","2964","[TCP segment of a reassembled PDU]"
"28.456520","172.18.0.2","54.38.73.16","TCP","68","36876 → 21002 [ACK] Seq=26521 Ack=415495 Win=5596 Len=0 TSval=1085992923 TSecr=2675647390"
"28.477835","54.38.73.16","172.18.0.2","TLSv1.2","799","Application Data"
"28.478030","172.18.0.2","54.38.73.16","TCP","68","36876 → 21002 [ACK] Seq=26521 Ack=416226 Win=5612 Len=0 TSval=1085992944 TSecr=2675647396"
"28.625248","54.38.73.16","172.18.0.2","TLSv1.2","1639","Application Data"
"28.625253","54.38.73.16","172.18.0.2","TCP","2964","[TCP segment of a reassembled PDU]"
"28.625257","54.38.73.16","172.18.0.2","TLSv1.2","1516","Application Data [TCP segment of a reassembled PDU]"
"28.625433","172.18.0.2","54.38.73.16","TCP","68","36876 → 21002 [ACK] Seq=26521 Ack=422141 Win=5568 Len=0 TSval=1085993092 TSecr=2675647421"
"28.652148","54.38.73.16","172.18.0.2","TLSv1.2","4035","Application Data, Application Data"
"28.652179","172.18.0.2","54.38.73.16","TCP","68","36876 → 21002 [ACK] Seq=26521 Ack=426108 Win=5580 Len=0 TSval=1085993118 TSecr=2675647439"
"28.697842","54.38.73.16","172.18.0.2","TLSv1.2","3695","Application Data"
"28.697891","172.18.0.2","54.38.73.16","TCP","68","36876 → 21002 [ACK] Seq=26521 Ack=429735 Win=5580 Len=0 TSval=1085993164 TSecr=2675647451"
"28.725104","54.38.73.16","172.18.0.2","TLSv1.2","1125","Application Data"
"28.725343","172.18.0.2","54.38.73.16","TCP","68","36876 → 21002 [ACK] Seq=26521 Ack=430792 Win=5612 Len=0 TSval=1085993192 TSecr=2675647458"
"28.766332","54.38.73.16","172.18.0.2","TLSv1.2","3695","Application Data"
"28.766506","172.18.0.2","54.38.73.16","TCP","68","36876 → 21002 [ACK] Seq=26521 Ack=434419 Win=5584 Len=0 TSval=1085993233 TSecr=2675647468"
"28.766917","172.18.0.2","54.38.73.16","TLSv1.2","611","Application Data"
"28.791298","54.38.73.16","172.18.0.2","TCP","68","21002 → 36876 [ACK] Seq=434419 Ack=27064 Win=1452 Len=0 TSval=2675647474 TSecr=1085993233"
"28.820977","54.38.73.16","172.18.0.2","TLSv1.2","3695","Application Data"
"28.821149","172.18.0.2","54.38.73.16","TCP","68","36876 → 21002 [ACK] Seq=27064 Ack=438046 Win=5584 Len=0 TSval=1085993287 TSecr=2675647481"
"28.846322","54.38.73.16","172.18.0.2","TLSv1.2","611","Application Data"
"28.877684","54.38.73.16","172.18.0.2","TCP","2964","[TCP segment of a reassembled PDU]"
"28.877715","172.18.0.2","54.38.73.16","TCP","68","36876 → 21002 [ACK] Seq=27064 Ack=441485 Win=5596 Len=0 TSval=1085993344 TSecr=2675647488"
"28.888026","54.38.73.16","172.18.0.2","TLSv1.2","2964","Application Data [TCP segment of a reassembled PDU]"
"28.888060","172.18.0.2","54.38.73.16","TCP","68","36876 → 21002 [ACK] Seq=27064 Ack=444381 Win=5596 Len=0 TSval=1085993354 TSecr=2675647498"
"28.902526","54.38.73.16","172.18.0.2","TLSv1.2","2073","Application Data, Application Data"
"28.902558","172.18.0.2","54.38.73.16","TCP","68","36876 → 21002 [ACK] Seq=27064 Ack=446386 Win=5599 Len=0 TSval=1085993369 TSecr=2675647502"
"28.957004","54.38.73.16","172.18.0.2","TLSv1.2","611","Application Data"
"29.004417","172.18.0.2","54.38.73.16","TCP","68","36876 → 21002 [ACK] Seq=27064 Ack=446929 Win=5612 Len=0 TSval=1085993471 TSecr=2675647515"
"29.024126","54.38.73.16","172.18.0.2","TCP","2964","[TCP segment of a reassembled PDU]"
"29.024297","172.18.0.2","54.38.73.16","TCP","68","36876 → 21002 [ACK] Seq=27064 Ack=449825 Win=5596 Len=0 TSval=1085993490 TSecr=2675647532"
"29.029535","54.38.73.16","172.18.0.2","TLSv1.2","799","Application Data"
"29.029661","172.18.0.2","54.38.73.16","TCP","68","36876 → 21002 [ACK] Seq=27064 Ack=450556 Win=5612 Len=0 TSval=1085993496 TSecr=2675647534"
"29.029994","172.18.0.2","54.38.73.16","TLSv1.2","611","Application Data"
"29.049164","54.38.73.16","172.18.0.2","TCP","2964","[TCP segment of a reassembled PDU]"
"29.049341","172.18.0.2","54.38.73.16","TCP","68","36876 → 21002 [ACK] Seq=27607 Ack=453452 Win=5596 Len=0 TSval=1085993516 TSecr=2675647539"
"29.056791","54.38.73.16","172.18.0.2","TLSv1.2","799","Application Data"
"29.056962","172.18.0.2","54.38.73.16","TCP","68","36876 → 21002 [ACK] Seq=27607 Ack=454183 Win=5612 Len=0 TSval=1085993523 TSecr=2675647540"
"29.093027","54.38.73.16","172.18.0.2","TCP","68","21002 → 36876 [ACK] Seq=454183 Ack=27607 Win=1452 Len=0 TSval=2675647550 TSecr=1085993496"
"29.094698","54.38.73.16","172.18.0.2","TLSv1.2","3695","Application Data"
"29.094852","172.18.0.2","54.38.73.16","TCP","68","36876 → 21002 [ACK] Seq=27607 Ack=457810 Win=5584 Len=0 TSval=1085993561 TSecr=2675647550"
"29.119798","54.38.73.16","172.18.0.2","TLSv1.2","611","Application Data"
"29.119947","172.18.0.2","54.38.73.16","TCP","68","36876 → 21002 [ACK] Seq=27607 Ack=458353 Win=5612 Len=0 TSval=1085993586 TSecr=2675647556"
"29.143550","54.38.73.16","172.18.0.2","TLSv1.2","611","Application Data"
"29.144332","172.18.0.2","54.38.73.16","TLSv1.2","611","Application Data"
"29.169399","54.38.73.16","172.18.0.2","TLSv1.2","611","Application Data"
"29.169445","172.18.0.2","54.38.73.16","TLSv1.2","611","Application Data"
"29.235080","54.38.73.16","172.18.0.2","TCP","68","21002 → 36876 [ACK] Seq=459439 Ack=28693 Win=1452 Len=0 TSval=2675647585 TSecr=1085993636"
"29.850526","54.38.73.16","172.18.0.2","TLSv1.2","611","Application Data"
"29.851765","172.18.0.2","54.38.73.16","TLSv1.2","611","Application Data"
"29.875345","54.38.73.16","172.18.0.2","TCP","68","21002 → 36876 [ACK] Seq=459982 Ack=29236 Win=1452 Len=0 TSval=2675647745 TSecr=1085994318"
"30.466335","54.38.73.16","172.18.0.2","TCP","1516","[TCP segment of a reassembled PDU]"
"30.466497","54.38.73.16","172.18.0.2","TLSv1.2","2247","Application Data"
"30.466547","172.18.0.2","54.38.73.16","TCP","68","36876 → 21002 [ACK] Seq=29236 Ack=463609 Win=5612 Len=0 TSval=1085994933 TSecr=2675647886"
"30.566942","54.38.73.16","172.18.0.2","TLSv1.2","611","Application Data"
"30.578060","54.38.73.16","172.18.0.2","TCP","2964","[TCP segment of a reassembled PDU]"
"30.578248","172.18.0.2","54.38.73.16","TCP","68","36876 → 21002 [ACK] Seq=29236 Ack=467048 Win=5596 Len=0 TSval=1085995044 TSecr=2675647917"
"30.598931","54.38.73.16","172.18.0.2","TLSv1.2","1516","Application Data [TCP segment of a reassembled PDU]"
"30.603035","54.38.73.16","172.18.0.2","TLSv1.2","408","Application Data"
"30.603204","172.18.0.2","54.38.73.16","TCP","68","36876 → 21002 [ACK] Seq=29236 Ack=468836 Win=5612 Len=0 TSval=1085995069 TSecr=2675647926"
"30.610663","172.18.0.2","54.38.73.16","TLSv1.2","611","Application Data"
"30.640062","54.38.73.16","172.18.0.2","TCP","68","21002 → 36876 [ACK] Seq=468836 Ack=29779 Win=1452 Len=0 TSval=2675647936 TSecr=1085995077"
"31.389325","54.38.73.16","172.18.0.2","TLSv1.2","611","Application Data"
"31.390222","172.18.0.2","54.38.73.16","TLSv1.2","611","Application Data"
"31.420995","54.38.73.16","172.18.0.2","TCP","68","21002 → 36876 [ACK] Seq=469379 Ack=30322 Win=1452 Len=0 TSval=2675648132 TSecr=1085995856"
