_ws.col.Time,_ws.col.Source,_ws.col.Destination,_ws.col.Protocol,_ws.col.Length,_ws.col.Info
"0.000000","172.18.0.2","54.38.73.16","TLSv1.2","611","Application Data"
"0.063973","54.38.73.16","172.18.0.2","TCP","68","21002 → 36876 [ACK] Seq=1 Ack=544 Win=1452 Len=0 TSval=2677330864 TSecr=1092726700"
"0.901670","54.38.73.16","172.18.0.2","TLSv1.2","611","Application Data"
"0.902080","54.38.73.16","172.18.0.2","TCP","611","[TCP Retransmission] 21002 → 36876 [PSH, ACK] Seq=1 Ack=544 Win=1452 Len=543 TSval=2677331067 TSecr=1092726700"
"0.902146","172.18.0.2","54.38.73.16","TCP","80","36876 → 21002 [ACK] Seq=544 Ack=544 Win=5612 Len=0 TSval=1092727602 TSecr=2677331067 SLE=1 SRE=544"
"0.902878","172.18.0.2","54.38.73.16","TCP","1516","[TCP segment of a reassembled PDU]"
"0.902981","172.18.0.2","54.38.73.16","TLSv1.2","705","Application Data"
"0.926571","54.38.73.16","172.18.0.2","TCP","68","21002 → 36876 [ACK] Seq=544 Ack=2629 Win=1448 Len=0 TSval=2677331079 TSecr=1092727603"
"2.129011","54.38.73.16","172.18.0.2","TLSv1.2","611","Application Data"
"2.129064","172.18.0.2","54.38.73.16","TCP","68","36876 → 21002 [ACK] Seq=2629 Ack=1087 Win=5608 Len=0 TSval=1092728829 TSecr=2677331307"
"2.129163","54.38.73.16","172.18.0.2","TLSv1.2","1125","Application Data"
"2.129180","172.18.0.2","54.38.73.16","TCP","68","36876 → 21002 [ACK] Seq=2629 Ack=2144 Win=5600 Len=0 TSval=1092728829 TSecr=2677331379"
"2.138782","172.18.0.2","54.38.73.16","TLSv1.2","611","Application Data"
"2.164832","54.38.73.16","172.18.0.2","TCP","68","21002 → 36876 [ACK] Seq=2144 Ack=3172 Win=1452 Len=0 TSval=2677331388 TSecr=1092728839"
"3.358335","54.38.73.16","172.18.0.2","TLSv1.2","611","Application Data"
"3.358392","172.18.0.2","54.38.73.16","TCP","68","36876 → 21002 [ACK] Seq=3172 Ack=2687 Win=5608 Len=0 TSval=1092730059 TSecr=2677331618"
"3.359449","172.18.0.2","54.38.73.16","TLSv1.2","611","Application Data"
"3.383074","54.38.73.16","172.18.0.2","TCP","68","21002 → 36876 [ACK] Seq=2687 Ack=3715 Win=1452 Len=0 TSval=2677331693 TSecr=1092730060"
"3.972207","54.38.73.16","172.18.0.2","TLSv1.2","611","Application Data"
"3.974416","54.38.73.16","172.18.0.2","TCP","2964","[TCP segment of a reassembled PDU]"
"3.974561","172.18.0.2","54.38.73.16","TCP","68","36876 → 21002 [ACK] Seq=3715 Ack=6126 Win=5596 Len=0 TSval=1092730675 TSecr=2677331833"
"3.985800","54.38.73.16","172.18.0.2","TLSv1.2","1516","Application Data [TCP segment of a reassembled PDU]"
"3.998026","54.38.73.16","172.18.0.2","TLSv1.2","2964","Application Data [TCP segment of a reassembled PDU]"
"3.998059","172.18.0.2","54.38.73.16","TCP","68","36876 → 21002 [ACK] Seq=3715 Ack=10470 Win=5596 Len=0 TSval=1092730698 TSecr=2677331844"
"3.998207","54.38.73.16","172.18.0.2","TLSv1.2","625","Application Data"
"4.038441","172.18.0.2","54.38.73.16","TCP","68","36876 → 21002 [ACK] Seq=3715 Ack=11027 Win=5612 Len=0 TSval=1092730739 TSecr=2677331847"
"4.120551","54.38.73.16","172.18.0.2","TLSv1.2","3695","Application Data"
"4.120614","172.18.0.2","54.38.73.16","TCP","68","36876 → 21002 [ACK] Seq=3715 Ack=14654 Win=5584 Len=0 TSval=1092730821 TSecr=2677331877"
"4.141159","54.38.73.16","172.18.0.2","TLSv1.2","5860","Application Data"
"4.141192","172.18.0.2","54.38.73.16","TCP","68","36876 → 21002 [ACK] Seq=3715 Ack=20446 Win=5581 Len=0 TSval=1092730841 TSecr=2677331883"
"4.152504","54.38.73.16","172.18.0.2","TLSv1.2","2044","Application Data"
"4.152537","172.18.0.2","54.38.73.16","TCP","68","36876 → 21002 [ACK] Seq=3715 Ack=22422 Win=5599 Len=0 TSval=1092730853 TSecr=2677331884"
"4.152785","54.38.73.16","172.18.0.2","TCP","1516","[TCP segment of a reassembled PDU]"
"4.152815","172.18.0.2","54.38.73.16","TCP","68","36876 → 21002 [ACK] Seq=3715 Ack=23870 Win=5593 Len=0 TSval=1092730853 TSecr=2677331886"
"4.177860","54.38.73.16","172.18.0.2","TLSv1.2","1219","Application Data"
"4.177897","172.18.0.2","54.38.73.16","TCP","68","36876 → 21002 [ACK] Seq=3715 Ack=25021 Win=5593 Len=0 TSval=1092730878 TSecr=2677331892"
"4.278610","54.38.73.16","172.18.0.2","TLSv1.2","3695","Application Data"
"4.278648","172.18.0.2","54.38.73.16","TCP","68","36876 → 21002 [ACK] Seq=3715 Ack=28648 Win=5580 Len=0 TSval=1092730979 TSecr=2677331917"
"4.279149","172.18.0.2","54.38.73.16","TLSv1.2","611","Application Data"
"4.287725","54.38.73.16","172.18.0.2","TLSv1.2","5860","Application Data"
"4.287760","172.18.0.2","54.38.73.16","TCP","68","36876 → 21002 [ACK] Seq=4258 Ack=34440 Win=5581 Len=0 TSval=1092730988 TSecr=2677331919"
"4.335136","54.38.73.16","172.18.0.2","TCP","1516","21002 → 36876 [ACK] Seq=34440 Ack=3715 Win=1452 Len=1448 TSval=2677331923 TSecr=1092730878 [TCP segment of a reassembled PDU]"
"4.335168","172.18.0.2","54.38.73.16","TCP","68","36876 → 21002 [ACK] Seq=4258 Ack=35888 Win=5593 Len=0 TSval=1092731035 TSecr=2677331923"
"4.335328","54.38.73.16","172.18.0.2","TCP","68","[TCP Previous segment not captured] 21002 → 36876 [ACK] Seq=38501 Ack=4258 Win=1452 Len=0 TSval=2677331923 TSecr=1092730979"
"4.335370","54.38.73.16","172.18.0.2","TCP","2681","[TCP Retransmission] 21002 → 36876 [PSH, ACK] Seq=35888 Ack=3715 Win=1452 Len=2613 TSval=2677331923 TSecr=1092730979"
"4.335408","172.18.0.2","54.38.73.16","TCP","68","36876 → 21002 [ACK] Seq=4258 Ack=38501 Win=5597 Len=0 TSval=1092731036 TSecr=2677331923"
"4.335376","54.38.73.16","172.18.0.2","TCP","2964","[TCP segment of a reassembled PDU]"
"4.335432","172.18.0.2","54.38.73.16","TCP","68","36876 → 21002 [ACK] Seq=4258 Ack=41397 Win=5582 Len=0 TSval=1092731036 TSecr=2677331926"
"4.370563","54.38.73.16","172.18.0.2","TLSv1.2","1342","Application Data, Application Data"
"4.370599","172.18.0.2","54.38.73.16","TCP","68","36876 → 21002 [ACK] Seq=4258 Ack=42671 Win=5593 Len=0 TSval=1092731071 TSecr=2677331940"
"4.441572","54.38.73.16","172.18.0.2","TLSv1.2","3695","Application Data"
"4.441606","172.18.0.2","54.38.73.16","TCP","68","36876 → 21002 [ACK] Seq=4258 Ack=46298 Win=5580 Len=0 TSval=1092731142 TSecr=2677331958"
"4.450003","54.38.73.16","172.18.0.2","TLSv1.2","5860","Application Data, Application Data"
"4.450040","172.18.0.2","54.38.73.16","TCP","68","36876 → 21002 [ACK] Seq=4258 Ack=52090 Win=5581 Len=0 TSval=1092731150 TSecr=2677331960"
"4.450555","54.38.73.16","172.18.0.2","TCP","1516","21002 → 36876 [ACK] Seq=52090 Ack=4258 Win=1452 Len=1448 TSval=2677331960 TSecr=1092731071 [TCP segment of a reassembled PDU]"
"4.468033","54.38.73.16","172.18.0.2","TLSv1.2","2196","Application Data, Application Data"
"4.468066","172.18.0.2","54.38.73.16","TCP","68","36876 → 21002 [ACK] Seq=4258 Ack=55666 Win=5599 Len=0 TSval=1092731168 TSecr=2677331960"
"4.468588","172.18.0.2","54.38.73.16","TLSv1.2","1125","Application Data"
"4.498156","54.38.73.16","172.18.0.2","TLSv1.2","3695","Application Data"
"4.498344","172.18.0.2","54.38.73.16","TCP","68","36876 → 21002 [ACK] Seq=5315 Ack=59293 Win=5580 Len=0 TSval=1092731199 TSecr=2677331972"
"4.590882","54.38.73.16","172.18.0.2","TLSv1.2","2667","Application Data"
"4.590916","172.18.0.2","54.38.73.16","TCP","68","36876 → 21002 [ACK] Seq=5315 Ack=61892 Win=5597 Len=0 TSval=1092731291 TSecr=2677331995"
"4.615576","54.38.73.16","172.18.0.2","TLSv1.2","4145","Application Data"
"4.615583","54.38.73.16","172.18.0.2","TLSv1.2","5860","Application Data"
"4.615738","172.18.0.2","54.38.73.16","TCP","68","36876 → 21002 [ACK] Seq=5315 Ack=71761 Win=5549 Len=0 TSval=1092731316 TSecr=2677332001"
"4.627108","54.38.73.16","172.18.0.2","TCP","1516","21002 → 36876 [ACK] Seq=71761 Ack=5315 Win=1452 Len=1448 TSval=2677332004 TSecr=1092731291 [TCP segment of a reassembled PDU]"
"4.641079","54.38.73.16","172.18.0.2","TLSv1.2","4830","Application Data, Application Data, Application Data"
"4.641116","172.18.0.2","54.38.73.16","TCP","68","36876 → 21002 [ACK] Seq=5315 Ack=77971 Win=5585 Len=0 TSval=1092731341 TSecr=2677332004"
"4.792277","54.38.73.16","172.18.0.2","TLSv1.2","3181","Application Data"
"4.792475","172.18.0.2","54.38.73.16","TCP","68","36876 → 21002 [ACK] Seq=5315 Ack=81084 Win=5583 Len=0 TSval=1092731493 TSecr=2677332034"
"4.792968","172.18.0.2","54.38.73.16","TLSv1.2","611","Application Data"
"4.830326","02:42:09:5f:bf:77","","ARP","44","Who has 172.18.0.2? Tell 172.18.0.1"
"4.830370","02:42:ac:12:00:02","","ARP","44","172.18.0.2 is at 02:42:ac:12:00:02"
"4.856343","54.38.73.16","172.18.0.2","TCP","68","21002 → 36876 [ACK] Seq=81084 Ack=5858 Win=1452 Len=0 TSval=2677332062 TSecr=1092731493"
"5.406361","54.38.73.16","172.18.0.2","TCP","799","[TCP Previous segment not captured] 21002 → 36876 [PSH, ACK] Seq=83980 Ack=5858 Win=1452 Len=731 TSval=2677332197 TSecr=1092731493"
"5.406412","172.18.0.2","54.38.73.16","TCP","80","[TCP Dup ACK 70#1] 36876 → 21002 [ACK] Seq=5858 Ack=81084 Win=5612 Len=0 TSval=1092732107 TSecr=2677332062 SLE=83980 SRE=84711"
"5.406378","54.38.73.16","172.18.0.2","TCP","3695","[TCP Retransmission] 21002 → 36876 [PSH, ACK] Seq=81084 Ack=5858 Win=1452 Len=3627 TSval=2677332175 TSecr=1092731493"
"5.406461","172.18.0.2","54.38.73.16","TCP","80","36876 → 21002 [ACK] Seq=5858 Ack=84711 Win=5584 Len=0 TSval=1092732107 TSecr=2677332175 SLE=83980 SRE=84711"
"5.414026","193.111.115.210","172.18.0.2","TLSv1.2","611","Application Data"
"5.414038","172.18.0.2","193.111.115.210","TCP","68","49692 → 443 [ACK] Seq=1 Ack=544 Win=497 Len=0 TSval=2013879411 TSecr=1321123402"
"5.414079","172.18.0.2","54.38.73.16","TLSv1.2","611","Application Data"
"5.437586","54.38.73.16","172.18.0.2","TCP","68","21002 → 36876 [ACK] Seq=84711 Ack=6401 Win=1452 Len=0 TSval=2677332207 TSecr=1092732114"
"6.122515","54.38.73.16","172.18.0.2","TLSv1.2","611","Application Data"
"6.123489","172.18.0.2","54.38.73.16","TLSv1.2","611","Application Data"
"6.149415","54.38.73.16","172.18.0.2","TCP","68","21002 → 36876 [ACK] Seq=85254 Ack=6944 Win=1452 Len=0 TSval=2677332384 TSecr=1092732824"
"7.044681","54.38.73.16","172.18.0.2","TCP","1516","[TCP segment of a reassembled PDU]"
"7.044925","54.38.73.16","172.18.0.2","TLSv1.2","1342","[TCP Previous segment not captured] , Ignored Unknown Record"
"7.044990","172.18.0.2","54.38.73.16","TCP","80","36876 → 21002 [ACK] Seq=6944 Ack=86702 Win=5601 Len=0 TSval=1092733745 TSecr=2677332534 SLE=91777 SRE=93051"
"7.044951","54.38.73.16","172.18.0.2","TCP","2247","[TCP Out-Of-Order] 21002 → 36876 [PSH, ACK] Seq=86702 Ack=6944 Win=1452 Len=2179 TSval=2677332534 TSecr=1092732824"
"7.045029","172.18.0.2","54.38.73.16","TCP","80","36876 → 21002 [ACK] Seq=6944 Ack=88881 Win=5584 Len=0 TSval=1092733745 TSecr=2677332534 SLE=91777 SRE=93051"
"7.044956","54.38.73.16","172.18.0.2","TCP","2964","[TCP Out-Of-Order] 21002 → 36876 [ACK] Seq=88881 Ack=6944 Win=1452 Len=2896 TSval=2677332537 TSecr=1092732824"
"7.045050","172.18.0.2","54.38.73.16","TCP","68","36876 → 21002 [ACK] Seq=6944 Ack=93051 Win=5568 Len=0 TSval=1092733745 TSecr=2677332537"
"7.071340","54.38.73.16","172.18.0.2","TLSv1.2","4145","Application Data"
"7.071377","172.18.0.2","54.38.73.16","TCP","68","36876 → 21002 [ACK] Seq=6944 Ack=97128 Win=5589 Len=0 TSval=1092733772 TSecr=2677332615"
"7.071346","54.38.73.16","172.18.0.2","TLSv1.2","4412","Application Data"
"7.071527","172.18.0.2","54.38.73.16","TCP","68","36876 → 21002 [ACK] Seq=6944 Ack=101472 Win=5567 Len=0 TSval=1092733772 TSecr=2677332615"
"7.097390","54.38.73.16","172.18.0.2","TLSv1.2","8240","Application Data, Application Data, Application Data"
"7.097424","172.18.0.2","54.38.73.16","TCP","68","36876 → 21002 [ACK] Seq=6944 Ack=109644 Win=5568 Len=0 TSval=1092733798 TSecr=2677332622"
"7.098235","172.18.0.2","54.38.73.16","TLSv1.2","611","Application Data"
"7.121478","54.38.73.16","172.18.0.2","TLSv1.2","1125","Application Data"
"7.122756","54.38.73.16","172.18.0.2","TCP","68","21002 → 36876 [ACK] Seq=110701 Ack=7487 Win=1452 Len=0 TSval=2677332628 TSecr=1092733799"
"7.166429","172.18.0.2","54.38.73.16","TCP","68","36876 → 21002 [ACK] Seq=7487 Ack=110701 Win=5612 Len=0 TSval=1092733867 TSecr=2677332628"
"7.218049","54.38.73.16","172.18.0.2","TLSv1.2","3695","Application Data"
"7.218104","172.18.0.2","54.38.73.16","TCP","68","36876 → 21002 [ACK] Seq=7487 Ack=114328 Win=5584 Len=0 TSval=1092733918 TSecr=2677332652"
"7.218661","172.18.0.2","54.38.73.16","TLSv1.2","611","Application Data"
"7.239178","54.38.73.16","172.18.0.2","TCP","1516","[TCP segment of a reassembled PDU]"
"7.239211","172.18.0.2","54.38.73.16","TCP","68","36876 → 21002 [ACK] Seq=8030 Ack=115776 Win=5601 Len=0 TSval=1092733939 TSecr=2677332657"
"7.239327","54.38.73.16","172.18.0.2","TCP","1516","21002 → 36876 [ACK] Seq=115776 Ack=7487 Win=1452 Len=1448 TSval=2677332657 TSecr=1092733867 [TCP segment of a reassembled PDU]"
"7.239342","172.18.0.2","54.38.73.16","TCP","68","36876 → 21002 [ACK] Seq=8030 Ack=117224 Win=5590 Len=0 TSval=1092733940 TSecr=2677332657"
"7.242549","54.38.73.16","172.18.0.2","TLSv1.2","285","Application Data"
"7.242577","172.18.0.2","54.38.73.16","TCP","68","36876 → 21002 [ACK] Seq=8030 Ack=117441 Win=5593 Len=0 TSval=1092733943 TSecr=2677332658"
"7.243203","54.38.73.16","172.18.0.2","TCP","68","21002 → 36876 [ACK] Seq=117441 Ack=8030 Win=1452 Len=0 TSval=2677332658 TSecr=1092733919"
"7.266912","54.38.73.16","172.18.0.2","TLSv1.2","1125","Application Data"
"7.266948","172.18.0.2","54.38.73.16","TCP","68","36876 → 21002 [ACK] Seq=8030 Ack=118498 Win=5593 Len=0 TSval=1092733967 TSecr=2677332664"
"7.453750","54.38.73.16","172.18.0.2","TCP","1516","[TCP segment of a reassembled PDU]"
"7.453781","172.18.0.2","54.38.73.16","TCP","68","36876 → 21002 [ACK] Seq=8030 Ack=119946 Win=5593 Len=0 TSval=1092734154 TSecr=2677332691"
"7.453954","54.38.73.16","172.18.0.2","TLSv1.2","2247","Application Data"
"7.453975","172.18.0.2","54.38.73.16","TCP","68","36876 → 21002 [ACK] Seq=8030 Ack=122125 Win=5599 Len=0 TSval=1092734154 TSecr=2677332691"
"7.453959","54.38.73.16","172.18.0.2","TCP","2964","[TCP segment of a reassembled PDU]"
"7.454083","172.18.0.2","54.38.73.16","TCP","68","36876 → 21002 [ACK] Seq=8030 Ack=125021 Win=5584 Len=0 TSval=1092734154 TSecr=2677332694"
"7.477240","54.38.73.16","172.18.0.2","TLSv1.2","799","Application Data"
"7.477415","172.18.0.2","54.38.73.16","TCP","68","36876 → 21002 [ACK] Seq=8030 Ack=125752 Win=5612 Len=0 TSval=1092734178 TSecr=2677332717"
"7.513490","54.38.73.16","172.18.0.2","TLSv1.2","3695","Application Data"
"7.513663","172.18.0.2","54.38.73.16","TCP","68","36876 → 21002 [ACK] Seq=8030 Ack=129379 Win=5584 Len=0 TSval=1092734214 TSecr=2677332726"
"7.536277","54.38.73.16","172.18.0.2","TCP","1516","[TCP segment of a reassembled PDU]"
"7.537738","54.38.73.16","172.18.0.2","TLSv1.2","705","Application Data"
"7.537765","172.18.0.2","54.38.73.16","TCP","68","36876 → 21002 [ACK] Seq=8030 Ack=131464 Win=5593 Len=0 TSval=1092734238 TSecr=2677332732"
"7.547232","54.38.73.16","172.18.0.2","TCP","2964","[TCP segment of a reassembled PDU]"
"7.547270","172.18.0.2","54.38.73.16","TCP","68","36876 → 21002 [ACK] Seq=8030 Ack=134360 Win=5596 Len=0 TSval=1092734248 TSecr=2677332734"
"7.557893","54.38.73.16","172.18.0.2","TLSv1.2","1516","Application Data [TCP segment of a reassembled PDU]"
"7.561280","54.38.73.16","172.18.0.2","TLSv1.2","408","Application Data"
"7.561382","172.18.0.2","54.38.73.16","TCP","68","36876 → 21002 [ACK] Seq=8030 Ack=136148 Win=5612 Len=0 TSval=1092734262 TSecr=2677332737"
"7.680948","54.38.73.16","172.18.0.2","TLSv1.2","3695","Application Data"
"7.681083","172.18.0.2","54.38.73.16","TCP","68","36876 → 21002 [ACK] Seq=8030 Ack=139775 Win=5584 Len=0 TSval=1092734381 TSecr=2677332768"
"7.681525","172.18.0.2","54.38.73.16","TLSv1.2","611","Application Data"
"7.743773","54.38.73.16","172.18.0.2","TCP","68","21002 → 36876 [ACK] Seq=139775 Ack=8573 Win=1452 Len=0 TSval=2677332784 TSecr=1092734382"
"7.965908","54.38.73.16","172.18.0.2","TLSv1.2","705","[TCP Previous segment not captured] , Ignored Unknown Record"
"7.965988","172.18.0.2","54.38.73.16","TCP","80","[TCP Dup ACK 134#1] 36876 → 21002 [ACK] Seq=8573 Ack=139775 Win=5612 Len=0 TSval=1092734666 TSecr=2677332784 SLE=141223 SRE=141860"
"7.965919","54.38.73.16","172.18.0.2","TCP","2153","[TCP Retransmission] 21002 → 36876 [PSH, ACK] Seq=139775 Ack=8573 Win=1452 Len=2085 TSval=2677332812 TSecr=1092734382"
"7.966015","172.18.0.2","54.38.73.16","TCP","80","36876 → 21002 [ACK] Seq=8573 Ack=141860 Win=5596 Len=0 TSval=1092734666 TSecr=2677332812 SLE=141223 SRE=141860"
"7.982605","54.38.73.16","172.18.0.2","TLSv1.2","5860","Application Data"
"7.982637","172.18.0.2","54.38.73.16","TCP","68","36876 → 21002 [ACK] Seq=8573 Ack=147652 Win=5581 Len=0 TSval=1092734683 TSecr=2677332843"
"7.989846","54.38.73.16","172.18.0.2","TLSv1.2","2964","Application Data [TCP segment of a reassembled PDU]"
"7.989876","172.18.0.2","54.38.73.16","TCP","68","36876 → 21002 [ACK] Seq=8573 Ack=150548 Win=5596 Len=0 TSval=1092734690 TSecr=2677332845"
"8.007480","54.38.73.16","172.18.0.2","TCP","2964","21002 → 36876 [ACK] Seq=150548 Ack=8573 Win=1452 Len=2896 TSval=2677332849 TSecr=1092734683 [TCP segment of a reassembled PDU]"
"8.007511","172.18.0.2","54.38.73.16","TCP","68","36876 → 21002 [ACK] Seq=8573 Ack=153444 Win=5596 Len=0 TSval=1092734708 TSecr=2677332849"
"8.013783","54.38.73.16","172.18.0.2","TLSv1.2","1450","Application Data, Application Data"
"8.013812","172.18.0.2","54.38.73.16","TCP","68","36876 → 21002 [ACK] Seq=8573 Ack=154826 Win=5593 Len=0 TSval=1092734714 TSecr=2677332851"
"8.016711","54.38.73.16","172.18.0.2","TCP","1516","[TCP segment of a reassembled PDU]"
"8.016733","172.18.0.2","54.38.73.16","TCP","68","36876 → 21002 [ACK] Seq=8573 Ack=156274 Win=5593 Len=0 TSval=1092734717 TSecr=2677332852"
"8.038681","54.38.73.16","172.18.0.2","TLSv1.2","1219","Application Data"
"8.038717","172.18.0.2","54.38.73.16","TCP","68","36876 → 21002 [ACK] Seq=8573 Ack=157425 Win=5593 Len=0 TSval=1092734739 TSecr=2677332857"
"8.171174","54.38.73.16","172.18.0.2","TLSv1.2","3181","Application Data"
"8.171218","172.18.0.2","54.38.73.16","TCP","68","36876 → 21002 [ACK] Seq=8573 Ack=160538 Win=5583 Len=0 TSval=1092734871 TSecr=2677332883"
"8.171802","172.18.0.2","54.38.73.16","TLSv1.2","611","Application Data"
"8.195700","54.38.73.16","172.18.0.2","TCP","68","21002 → 36876 [ACK] Seq=160538 Ack=9116 Win=1452 Len=0 TSval=2677332897 TSecr=1092734872"
"8.199375","54.38.73.16","172.18.0.2","TLSv1.2","2667","Application Data"
"8.199536","172.18.0.2","54.38.73.16","TCP","68","36876 → 21002 [ACK] Seq=9116 Ack=163137 Win=5597 Len=0 TSval=1092734900 TSecr=2677332897"
"8.199982","172.18.0.2","54.38.73.16","TLSv1.2","611","Application Data"
"8.225225","54.38.73.16","172.18.0.2","TLSv1.2","1125","Application Data"
"8.263317","54.38.73.16","172.18.0.2","TCP","68","21002 → 36876 [ACK] Seq=164194 Ack=9659 Win=1452 Len=0 TSval=2677332914 TSecr=1092734900"
"8.263359","172.18.0.2","54.38.73.16","TLSv1.2","611","Application Data"
"8.287206","54.38.73.16","172.18.0.2","TCP","68","21002 → 36876 [ACK] Seq=164194 Ack=10202 Win=1452 Len=0 TSval=2677332919 TSecr=1092734964"
"10.117823","54.38.73.16","172.18.0.2","TLSv1.2","611","Application Data"
"10.118857","172.18.0.2","54.38.73.16","TLSv1.2","611","Application Data"
"10.144779","54.38.73.16","172.18.0.2","TCP","68","21002 → 36876 [ACK] Seq=164737 Ack=10745 Win=1452 Len=0 TSval=2677333384 TSecr=1092736819"
"12.094583","172.18.0.2","193.111.115.210","TLSv1.2","611","Application Data"
"12.137125","193.111.115.210","172.18.0.2","TCP","68","443 → 49692 [ACK] Seq=544 Ack=544 Win=769 Len=0 TSval=1321125076 TSecr=2013886092"
"14.110894","54.38.73.16","172.18.0.2","TLSv1.2","799","[TCP Previous segment not captured] , Ignored Unknown Record"
"14.110940","172.18.0.2","54.38.73.16","TCP","80","[TCP Dup ACK 165#1] 36876 → 21002 [ACK] Seq=10745 Ack=164737 Win=5612 Len=0 TSval=1092740811 TSecr=2677333384 SLE=167633 SRE=168364"
"14.110909","54.38.73.16","172.18.0.2","TCP","3695","[TCP Retransmission] 21002 → 36876 [PSH, ACK] Seq=164737 Ack=10745 Win=1452 Len=3627 TSval=2677334337 TSecr=1092736819"
"14.110971","172.18.0.2","54.38.73.16","TCP","80","36876 → 21002 [ACK] Seq=10745 Ack=168364 Win=5584 Len=0 TSval=1092740811 TSecr=2677334337 SLE=167633 SRE=168364"
"14.422413","54.38.73.16","172.18.0.2","TLSv1.2","3695","Application Data"
"14.422518","172.18.0.2","54.38.73.16","TCP","68","36876 → 21002 [ACK] Seq=10745 Ack=171991 Win=5581 Len=0 TSval=1092741123 TSecr=2677334440"
"14.621746","54.38.73.16","172.18.0.2","TLSv1.2","611","Application Data"
"14.662324","172.18.0.2","54.38.73.16","TCP","68","36876 → 21002 [ACK] Seq=10745 Ack=172534 Win=5612 Len=0 TSval=1092741363 TSecr=2677334484"
"15.042541","54.38.73.16","172.18.0.2","TLSv1.2","611","Application Data"
"15.042581","172.18.0.2","54.38.73.16","TCP","68","36876 → 21002 [ACK] Seq=10745 Ack=173077 Win=5608 Len=0 TSval=1092741743 TSecr=2677334592"
"16.568328","193.111.115.210","172.18.0.2","TLSv1.2","611","Application Data"
"16.568387","172.18.0.2","193.111.115.210","TCP","68","49692 → 443 [ACK] Seq=544 Ack=1087 Win=497 Len=0 TSval=2013890566 TSecr=1321126169"
"16.873735","54.38.73.16","172.18.0.2","TLSv1.2","3695","Application Data"
"16.873764","172.18.0.2","54.38.73.16","TCP","68","36876 → 21002 [ACK] Seq=10745 Ack=176704 Win=5581 Len=0 TSval=1092743574 TSecr=2677335041"
"16.898075","54.38.73.16","172.18.0.2","TLSv1.2","611","Application Data"
"16.898110","172.18.0.2","54.38.73.16","TCP","68","36876 → 21002 [ACK] Seq=10745 Ack=177247 Win=5593 Len=0 TSval=1092743598 TSecr=2677335072"
"19.640335","54.38.73.16","172.18.0.2","TLSv1.2","799","[TCP Previous segment not captured] , Ignored Unknown Record"
"19.640387","172.18.0.2","54.38.73.16","TCP","80","[TCP Window Update] 36876 → 21002 [ACK] Seq=10745 Ack=177247 Win=5606 Len=0 TSval=1092746341 TSecr=2677335072 SLE=180143 SRE=180874"
"19.640354","54.38.73.16","172.18.0.2","TCP","3695","[TCP Retransmission] 21002 → 36876 [PSH, ACK] Seq=177247 Ack=10745 Win=1452 Len=3627 TSval=2677335685 TSecr=1092743598"
"19.640417","172.18.0.2","54.38.73.16","TCP","80","36876 → 21002 [ACK] Seq=10745 Ack=180874 Win=5581 Len=0 TSval=1092746341 TSecr=2677335685 SLE=180143 SRE=180874"
"19.640357","54.38.73.16","172.18.0.2","TCP","1516","[TCP segment of a reassembled PDU]"
"19.640441","172.18.0.2","54.38.73.16","TCP","68","36876 → 21002 [ACK] Seq=10745 Ack=182322 Win=5573 Len=0 TSval=1092746341 TSecr=2677335729"
"19.665436","54.38.73.16","172.18.0.2","TLSv1.2","2247","Application Data"
"19.665466","172.18.0.2","54.38.73.16","TCP","68","36876 → 21002 [ACK] Seq=10745 Ack=184501 Win=5599 Len=0 TSval=1092746366 TSecr=2677335764"
"19.752550","54.38.73.16","172.18.0.2","TLSv1.2","3695","Application Data"
"19.752568","172.18.0.2","54.38.73.16","TCP","68","36876 → 21002 [ACK] Seq=10745 Ack=188128 Win=5580 Len=0 TSval=1092746453 TSecr=2677335785"
"19.952529","54.38.73.16","172.18.0.2","TLSv1.2","611","Application Data"
"19.952561","172.18.0.2","54.38.73.16","TCP","68","36876 → 21002 [ACK] Seq=10745 Ack=188671 Win=5593 Len=0 TSval=1092746653 TSecr=2677335819"
"20.152735","54.38.73.16","172.18.0.2","TLSv1.2","3695","Application Data"
"20.152764","172.18.0.2","54.38.73.16","TCP","68","36876 → 21002 [ACK] Seq=10745 Ack=192298 Win=5581 Len=0 TSval=1092746853 TSecr=2677335862"
"20.153221","172.18.0.2","54.38.73.16","TLSv1.2","611","Application Data"
"20.178300","54.38.73.16","172.18.0.2","TCP","68","21002 → 36876 [ACK] Seq=192298 Ack=11288 Win=1452 Len=0 TSval=2677335892 TSecr=1092746853"
"20.223123","54.38.73.16","172.18.0.2","TLSv1.2","3695","Application Data"
"20.223154","172.18.0.2","54.38.73.16","TCP","68","36876 → 21002 [ACK] Seq=11288 Ack=195925 Win=5584 Len=0 TSval=1092746923 TSecr=2677335903"
"20.249707","54.38.73.16","172.18.0.2","TLSv1.2","1639","Application Data"
"20.249738","172.18.0.2","54.38.73.16","TCP","68","36876 → 21002 [ACK] Seq=11288 Ack=197496 Win=5601 Len=0 TSval=1092746950 TSecr=2677335909"
"20.314192","54.38.73.16","172.18.0.2","TLSv1.2","2667","Application Data"
"20.314223","172.18.0.2","54.38.73.16","TCP","68","36876 → 21002 [ACK] Seq=11288 Ack=200095 Win=5597 Len=0 TSval=1092747014 TSecr=2677335926"
"20.561543","54.38.73.16","172.18.0.2","TLSv1.2","4145","Application Data"
"20.561600","172.18.0.2","54.38.73.16","TCP","68","36876 → 21002 [ACK] Seq=11288 Ack=204172 Win=5579 Len=0 TSval=1092747262 TSecr=2677335974"
"20.586359","54.38.73.16","172.18.0.2","TLSv1.2","4302","Application Data, Application Data"
"20.586389","172.18.0.2","54.38.73.16","TCP","68","36876 → 21002 [ACK] Seq=11288 Ack=208406 Win=5580 Len=0 TSval=1092747287 TSecr=2677335994"
"20.587435","172.18.0.2","54.38.73.16","TLSv1.2","611","Application Data"
"20.611465","54.38.73.16","172.18.0.2","TLSv1.2","611","Application Data"
"20.611480","172.18.0.2","54.38.73.16","TCP","68","36876 → 21002 [ACK] Seq=11831 Ack=208949 Win=5608 Len=0 TSval=1092747312 TSecr=2677336000"
"20.613534","54.38.73.16","172.18.0.2","TCP","68","21002 → 36876 [ACK] Seq=208949 Ack=11831 Win=1452 Len=0 TSval=2677336001 TSecr=1092747288"
"20.613545","172.18.0.2","54.38.73.16","TLSv1.2","611","Application Data"
"20.638125","54.38.73.16","172.18.0.2","TCP","68","21002 → 36876 [ACK] Seq=208949 Ack=12374 Win=1452 Len=0 TSval=2677336007 TSecr=1092747314"
"22.714025","54.38.73.16","172.18.0.2","TLSv1.2","611","Application Data"
"22.714975","172.18.0.2","54.38.73.16","TLSv1.2","611","Application Data"
"22.738877","54.38.73.16","172.18.0.2","TCP","68","21002 → 36876 [ACK] Seq=209492 Ack=12917 Win=1452 Len=0 TSval=2677336532 TSecr=1092749415"
"23.944506","54.38.73.16","172.18.0.2","TLSv1.2","611","Application Data"
"23.961684","54.38.73.16","172.18.0.2","TCP","2964","[TCP segment of a reassembled PDU]"
"23.961888","172.18.0.2","54.38.73.16","TCP","68","36876 → 21002 [ACK] Seq=12917 Ack=212931 Win=5596 Len=0 TSval=1092750662 TSecr=2677336764"
"23.985936","54.38.73.16","172.18.0.2","TLSv1.2","799","Application Data"
"23.986490","172.18.0.2","54.38.73.16","TLSv1.2","611","Application Data"
"24.010386","54.38.73.16","172.18.0.2","TCP","68","21002 → 36876 [ACK] Seq=213662 Ack=13460 Win=1452 Len=0 TSval=2677336850 TSecr=1092750687"
"24.145686","54.38.73.16","172.18.0.2","TLSv1.2","1125","Application Data"
"24.186329","172.18.0.2","54.38.73.16","TCP","68","36876 → 21002 [ACK] Seq=13460 Ack=214719 Win=5612 Len=0 TSval=1092750887 TSecr=2677336882"
"25.008149","172.18.0.2","193.111.115.210","TLSv1.2","611","Application Data"
"25.035770","54.38.73.16","172.18.0.2","TLSv1.2","3695","Application Data"
"25.035823","172.18.0.2","54.38.73.16","TCP","68","36876 → 21002 [ACK] Seq=13460 Ack=218346 Win=5584 Len=0 TSval=1092751736 TSecr=2677337106"
"25.051310","193.111.115.210","172.18.0.2","TCP","68","443 → 49692 [ACK] Seq=1087 Ack=1087 Win=777 Len=0 TSval=1321128293 TSecr=2013899005"
"25.475556","54.38.73.16","172.18.0.2","TCP","1516","[TCP segment of a reassembled PDU]"
"25.475588","172.18.0.2","54.38.73.16","TCP","68","36876 → 21002 [ACK] Seq=13460 Ack=219794 Win=5593 Len=0 TSval=1092752176 TSecr=2677337157"
"25.475946","54.38.73.16","172.18.0.2","TLSv1.2","2247","Application Data"
"25.475979","172.18.0.2","54.38.73.16","TCP","68","36876 → 21002 [ACK] Seq=13460 Ack=221973 Win=5599 Len=0 TSval=1092752176 TSecr=2677337157"
"25.475952","54.38.73.16","172.18.0.2","TCP","1516","[TCP segment of a reassembled PDU]"
"25.476012","172.18.0.2","54.38.73.16","TCP","68","36876 → 21002 [ACK] Seq=13460 Ack=223421 Win=5588 Len=0 TSval=1092752176 TSecr=2677337201"
"25.501059","54.38.73.16","172.18.0.2","TLSv1.2","3876","Application Data, Application Data, Application Data, Application Data"
"25.501091","172.18.0.2","54.38.73.16","TCP","68","36876 → 21002 [ACK] Seq=13460 Ack=227229 Win=5580 Len=0 TSval=1092752201 TSecr=2677337223"
"25.505701","54.38.73.16","172.18.0.2","TCP","1516","[TCP segment of a reassembled PDU]"
"25.505751","172.18.0.2","54.38.73.16","TCP","68","36876 → 21002 [ACK] Seq=13460 Ack=228677 Win=5593 Len=0 TSval=1092752206 TSecr=2677337224"
"25.525128","54.38.73.16","172.18.0.2","TLSv1.2","2964","Application Data [TCP segment of a reassembled PDU]"
"25.525162","172.18.0.2","54.38.73.16","TCP","68","36876 → 21002 [ACK] Seq=13460 Ack=231573 Win=5596 Len=0 TSval=1092752225 TSecr=2677337229"
"25.529044","54.38.73.16","172.18.0.2","TCP","1516","21002 → 36876 [ACK] Seq=231573 Ack=13460 Win=1452 Len=1448 TSval=2677337230 TSecr=1092752201 [TCP segment of a reassembled PDU]"
"25.529075","172.18.0.2","54.38.73.16","TCP","68","36876 → 21002 [ACK] Seq=13460 Ack=233021 Win=5593 Len=0 TSval=1092752229 TSecr=2677337230"
"25.538447","54.38.73.16","172.18.0.2","TLSv1.2","1516","Application Data [TCP segment of a reassembled PDU]"
"25.538480","172.18.0.2","54.38.73.16","TCP","68","36876 → 21002 [ACK] Seq=13460 Ack=234469 Win=5593 Len=0 TSval=1092752239 TSecr=2677337232"
"25.548962","54.38.73.16","172.18.0.2","TCP","1516","21002 → 36876 [ACK] Seq=234469 Ack=13460 Win=1452 Len=1448 TSval=2677337235 TSecr=1092752225 [TCP segment of a reassembled PDU]"
"25.549006","172.18.0.2","54.38.73.16","TCP","68","36876 → 21002 [ACK] Seq=13460 Ack=235917 Win=5593 Len=0 TSval=1092752249 TSecr=2677337235"
"25.552549","54.38.73.16","172.18.0.2","TLSv1.2","2964","Application Data, Application Data"
"25.552588","172.18.0.2","54.38.73.16","TCP","68","36876 → 21002 [ACK] Seq=13460 Ack=238813 Win=5596 Len=0 TSval=1092752253 TSecr=2677337236"
"25.553058","172.18.0.2","54.38.73.16","TLSv1.2","611","Application Data"
"25.564757","54.38.73.16","172.18.0.2","TLSv1.2","451","Application Data"
"25.564833","172.18.0.2","54.38.73.16","TCP","68","36876 → 21002 [ACK] Seq=14003 Ack=239196 Win=5594 Len=0 TSval=1092752265 TSecr=2677337239"
"25.576727","54.38.73.16","172.18.0.2","TCP","68","21002 → 36876 [ACK] Seq=239196 Ack=14003 Win=1452 Len=0 TSval=2677337242 TSecr=1092752253"
"25.624032","54.38.73.16","172.18.0.2","TLSv1.2","1639","Application Data"
"25.624065","172.18.0.2","54.38.73.16","TCP","68","36876 → 21002 [ACK] Seq=14003 Ack=240767 Win=5601 Len=0 TSval=1092752324 TSecr=2677337254"
"25.668479","54.38.73.16","172.18.0.2","TLSv1.2","3695","Application Data"
"25.668511","172.18.0.2","54.38.73.16","TCP","68","36876 → 21002 [ACK] Seq=14003 Ack=244394 Win=5580 Len=0 TSval=1092752369 TSecr=2677337264"
"25.693148","54.38.73.16","172.18.0.2","TLSv1.2","2153","Application Data"
"25.693179","172.18.0.2","54.38.73.16","TCP","68","36876 → 21002 [ACK] Seq=14003 Ack=246479 Win=5599 Len=0 TSval=1092752393 TSecr=2677337271"
"25.791983","54.38.73.16","172.18.0.2","TLSv1.2","1639","Application Data"
"25.792028","172.18.0.2","54.38.73.16","TCP","68","36876 → 21002 [ACK] Seq=14003 Ack=248050 Win=5601 Len=0 TSval=1092752492 TSecr=2677337295"
"25.833709","54.38.73.16","172.18.0.2","TLSv1.2","3695","Application Data"
"25.833890","172.18.0.2","54.38.73.16","TCP","68","36876 → 21002 [ACK] Seq=14003 Ack=251677 Win=5580 Len=0 TSval=1092752534 TSecr=2677337306"
"25.858495","54.38.73.16","172.18.0.2","TLSv1.2","2153","Application Data"
"25.858528","172.18.0.2","54.38.73.16","TCP","68","36876 → 21002 [ACK] Seq=14003 Ack=253762 Win=5599 Len=0 TSval=1092752559 TSecr=2677337312"
"25.939232","54.38.73.16","172.18.0.2","TLSv1.2","3695","Application Data"
"25.939415","172.18.0.2","54.38.73.16","TCP","68","36876 → 21002 [ACK] Seq=14003 Ack=257389 Win=5580 Len=0 TSval=1092752640 TSecr=2677337332"
"25.963860","54.38.73.16","172.18.0.2","TLSv1.2","611","Application Data"
"25.964033","172.18.0.2","54.38.73.16","TCP","68","36876 → 21002 [ACK] Seq=14003 Ack=257932 Win=5612 Len=0 TSval=1092752664 TSecr=2677337339"
"25.980643","54.38.73.16","172.18.0.2","TCP","2964","[TCP segment of a reassembled PDU]"
"25.980820","172.18.0.2","54.38.73.16","TCP","68","36876 → 21002 [ACK] Seq=14003 Ack=260828 Win=5596 Len=0 TSval=1092752681 TSecr=2677337343"
"25.987303","54.38.73.16","172.18.0.2","TLSv1.2","799","Application Data"
"25.987452","172.18.0.2","54.38.73.16","TCP","68","36876 → 21002 [ACK] Seq=14003 Ack=261559 Win=5612 Len=0 TSval=1092752688 TSecr=2677337345"
"25.988013","172.18.0.2","54.38.73.16","TLSv1.2","611","Application Data"
"26.004627","54.38.73.16","172.18.0.2","TCP","1516","[TCP segment of a reassembled PDU]"
"26.011847","54.38.73.16","172.18.0.2","TLSv1.2","1219","Application Data"
"26.011856","54.38.73.16","172.18.0.2","TCP","68","21002 → 36876 [ACK] Seq=264158 Ack=14546 Win=1452 Len=0 TSval=2677337351 TSecr=1092752688"
"26.011993","172.18.0.2","54.38.73.16","TCP","68","36876 → 21002 [ACK] Seq=14546 Ack=264158 Win=5612 Len=0 TSval=1092752712 TSecr=2677337349"
"26.105220","54.38.73.16","172.18.0.2","TLSv1.2","2667","Application Data"
"26.105374","172.18.0.2","54.38.73.16","TCP","68","36876 → 21002 [ACK] Seq=14546 Ack=266757 Win=5597 Len=0 TSval=1092752806 TSecr=2677337374"
"26.105881","172.18.0.2","54.38.73.16","TLSv1.2","611","Application Data"
"26.130115","54.38.73.16","172.18.0.2","TCP","68","21002 → 36876 [ACK] Seq=266757 Ack=15089 Win=1452 Len=0 TSval=2677337380 TSecr=1092752806"
"26.147700","54.38.73.16","172.18.0.2","TLSv1.2","3695","Application Data"
"26.147832","172.18.0.2","54.38.73.16","TCP","68","36876 → 21002 [ACK] Seq=15089 Ack=270384 Win=5584 Len=0 TSval=1092752848 TSecr=2677337384"
"26.172125","54.38.73.16","172.18.0.2","TLSv1.2","2153","Application Data"
"26.172167","172.18.0.2","54.38.73.16","TCP","68","36876 → 21002 [ACK] Seq=15089 Ack=272469 Win=5599 Len=0 TSval=1092752872 TSecr=2677337391"
"26.266946","54.38.73.16","172.18.0.2","TLSv1.2","3695","Application Data"
"26.267135","172.18.0.2","54.38.73.16","TCP","68","36876 → 21002 [ACK] Seq=15089 Ack=276096 Win=5580 Len=0 TSval=1092752967 TSecr=2677337414"
"26.286497","54.38.73.16","172.18.0.2","TCP","1516","[TCP segment of a reassembled PDU]"
"26.293161","54.38.73.16","172.18.0.2","TLSv1.2","2247","Application Data"
"26.293196","172.18.0.2","54.38.73.16","TCP","68","36876 → 21002 [ACK] Seq=15089 Ack=279723 Win=5599 Len=0 TSval=1092752993 TSecr=2677337419"
"26.883797","172.18.0.2","193.111.115.210","TLSv1.2","611","Application Data"
"26.926358","193.111.115.210","172.18.0.2","TCP","68","443 → 49692 [ACK] Seq=1087 Ack=1630 Win=786 Len=0 TSval=1321128760 TSecr=2013900881"
"27.115485","54.38.73.16","172.18.0.2","TLSv1.2","1219","[TCP Previous segment not captured] , Ignored Unknown Record"
"27.115535","172.18.0.2","54.38.73.16","TCP","80","[TCP Dup ACK 293#1] 36876 → 21002 [ACK] Seq=15089 Ack=279723 Win=5599 Len=0 TSval=1092753816 TSecr=2677337419 SLE=281171 SRE=282322"
"27.115501","54.38.73.16","172.18.0.2","TCP","2667","[TCP Retransmission] 21002 → 36876 [PSH, ACK] Seq=279723 Ack=15089 Win=1452 Len=2599 TSval=2677337604 TSecr=1092752993"
"27.115571","172.18.0.2","54.38.73.16","TCP","80","36876 → 21002 [ACK] Seq=15089 Ack=282322 Win=5597 Len=0 TSval=1092753816 TSecr=2677337604 SLE=281171 SRE=282322"
"27.122928","172.18.0.2","54.38.73.16","TLSv1.2","611","Application Data"
"27.184229","54.38.73.16","172.18.0.2","TCP","68","21002 → 36876 [ACK] Seq=282322 Ack=15632 Win=1452 Len=0 TSval=2677337644 TSecr=1092753823"
"28.856580","54.38.73.16","172.18.0.2","TLSv1.2","611","Application Data"
"28.857631","172.18.0.2","54.38.73.16","TLSv1.2","611","Application Data"
"28.881773","54.38.73.16","172.18.0.2","TCP","68","21002 → 36876 [ACK] Seq=282865 Ack=16175 Win=1452 Len=0 TSval=2677338068 TSecr=1092755558"
"30.085496","54.38.73.16","172.18.0.2","TLSv1.2","611","Application Data"
"30.118211","54.38.73.16","172.18.0.2","TCP","1516","[TCP segment of a reassembled PDU]"
"30.118299","172.18.0.2","54.38.73.16","TCP","68","36876 → 21002 [ACK] Seq=16175 Ack=284856 Win=5597 Len=0 TSval=1092756819 TSecr=2677338339"
"30.143143","54.38.73.16","172.18.0.2","TLSv1.2","2247","Application Data"
"30.143176","172.18.0.2","54.38.73.16","TCP","68","36876 → 21002 [ACK] Seq=16175 Ack=287035 Win=5599 Len=0 TSval=1092756843 TSecr=2677338383"
"30.289684","54.38.73.16","172.18.0.2","TLSv1.2","3181","Application Data"
"30.289865","172.18.0.2","54.38.73.16","TCP","68","36876 → 21002 [ACK] Seq=16175 Ack=290148 Win=5583 Len=0 TSval=1092756990 TSecr=2677338410"
"30.314019","54.38.73.16","172.18.0.2","TLSv1.2","1125","Application Data"
"30.315041","54.38.73.16","172.18.0.2","TCP","2964","[TCP segment of a reassembled PDU]"
"30.315069","172.18.0.2","54.38.73.16","TCP","68","36876 → 21002 [ACK] Seq=16175 Ack=294101 Win=5596 Len=0 TSval=1092757015 TSecr=2677338426"
"30.338639","54.38.73.16","172.18.0.2","TLSv1.2","828","Application Data, Application Data"
"30.382297","172.18.0.2","54.38.73.16","TCP","68","36876 → 21002 [ACK] Seq=16175 Ack=294861 Win=5612 Len=0 TSval=1092757083 TSecr=2677338432"
"30.447320","54.38.73.16","172.18.0.2","TLSv1.2","2153","Application Data"
"30.447358","172.18.0.2","54.38.73.16","TCP","68","36876 → 21002 [ACK] Seq=16175 Ack=296946 Win=5599 Len=0 TSval=1092757148 TSecr=2677338459"
"30.448490","172.18.0.2","54.38.73.16","TLSv1.2","611","Application Data"
"30.472888","54.38.73.16","172.18.0.2","TCP","68","21002 → 36876 [ACK] Seq=296946 Ack=16718 Win=1452 Len=0 TSval=2677338466 TSecr=1092757149"
"30.472929","172.18.0.2","54.38.73.16","TLSv1.2","611","Application Data"
"30.497691","54.38.73.16","172.18.0.2","TCP","68","21002 → 36876 [ACK] Seq=296946 Ack=17261 Win=1452 Len=0 TSval=2677338472 TSecr=1092757173"
"30.704574","54.38.73.16","172.18.0.2","TLSv1.2","611","Application Data"
"30.704670","172.18.0.2","54.38.73.16","TCP","68","36876 → 21002 [ACK] Seq=17261 Ack=297489 Win=5608 Len=0 TSval=1092757405 TSecr=2677338500"
"30.942326","02:42:09:5f:bf:77","","ARP","44","Who has 172.18.0.2? Tell 172.18.0.1"
"30.942362","02:42:ac:12:00:02","","ARP","44","172.18.0.2 is at 02:42:ac:12:00:02"
"31.620421","54.38.73.16","172.18.0.2","TLSv1.2","611","Application Data"
"31.620471","172.18.0.2","54.38.73.16","TCP","68","36876 → 21002 [ACK] Seq=17261 Ack=298032 Win=5604 Len=0 TSval=1092758321 TSecr=2677338687"
"31.621389","172.18.0.2","54.38.73.16","TLSv1.2","611","Application Data"
"31.647143","54.38.73.16","172.18.0.2","TCP","68","21002 → 36876 [ACK] Seq=298032 Ack=17804 Win=1452 Len=0 TSval=2677338759 TSecr=1092758322"
"32.850289","54.38.73.16","172.18.0.2","TCP","799","[TCP Previous segment not captured] 21002 → 36876 [PSH, ACK] Seq=300928 Ack=17804 Win=1452 Len=731 TSval=2677339038 TSecr=1092758322"
"32.850357","172.18.0.2","54.38.73.16","TCP","80","[TCP Dup ACK 328#1] 36876 → 21002 [ACK] Seq=17804 Ack=298032 Win=5612 Len=0 TSval=1092759551 TSecr=2677338759 SLE=300928 SRE=301659"
"32.850315","54.38.73.16","172.18.0.2","TCP","3695","[TCP Retransmission] 21002 → 36876 [PSH, ACK] Seq=298032 Ack=17804 Win=1452 Len=3627 TSval=2677338988 TSecr=1092758322"
"32.850399","172.18.0.2","54.38.73.16","TCP","80","36876 → 21002 [ACK] Seq=17804 Ack=301659 Win=5584 Len=0 TSval=1092759551 TSecr=2677338988 SLE=300928 SRE=301659"
"33.464109","54.38.73.16","172.18.0.2","TLSv1.2","4145","Application Data"
"33.464157","172.18.0.2","54.38.73.16","TCP","68","36876 → 21002 [ACK] Seq=17804 Ack=305736 Win=5579 Len=0 TSval=1092760164 TSecr=2677339149"
"33.464118","54.38.73.16","172.18.0.2","TLSv1.2","1516","Application Data"
"33.464202","172.18.0.2","54.38.73.16","TCP","68","36876 → 21002 [ACK] Seq=17804 Ack=307184 Win=5568 Len=0 TSval=1092760164 TSecr=2677339211"
"33.487534","54.38.73.16","172.18.0.2","TLSv1.2","3969","Application Data, Application Data, Application Data, Application Data"
"33.487568","172.18.0.2","54.38.73.16","TCP","68","36876 → 21002 [ACK] Seq=17804 Ack=311085 Win=5580 Len=0 TSval=1092760188 TSecr=2677339220"
"33.512280","54.38.73.16","172.18.0.2","TLSv1.2","3181","Application Data"
"33.512319","172.18.0.2","54.38.73.16","TCP","68","36876 → 21002 [ACK] Seq=17804 Ack=314198 Win=5580 Len=0 TSval=1092760213 TSecr=2677339226"
"33.557699","54.38.73.16","172.18.0.2","TLSv1.2","3695","Application Data"
"33.557732","172.18.0.2","54.38.73.16","TCP","68","36876 → 21002 [ACK] Seq=17804 Ack=317825 Win=5580 Len=0 TSval=1092760258 TSecr=2677339237"
"33.583988","54.38.73.16","172.18.0.2","TLSv1.2","4238","Application Data, Application Data"
"33.584021","172.18.0.2","54.38.73.16","TCP","68","36876 → 21002 [ACK] Seq=17804 Ack=321995 Win=5580 Len=0 TSval=1092760284 TSecr=2677339244"
"33.584543","172.18.0.2","54.38.73.16","TLSv1.2","611","Application Data"
