_ws.col.Time,_ws.col.Source,_ws.col.Destination,_ws.col.Protocol,_ws.col.Length,_ws.col.Info
"0.000000","54.38.73.16","172.18.0.2","TCP","68","21002 → 36876 [ACK] Seq=1 Ack=1 Win=1452 Len=0 TSval=2673045568 TSecr=1075585642"
"0.114579","172.18.0.2","54.38.73.16","TLSv1.2","611","Application Data"
"0.175986","54.38.73.16","172.18.0.2","TCP","68","21002 → 36876 [ACK] Seq=1 Ack=544 Win=1452 Len=0 TSval=2673045612 TSecr=1075585820"
"0.665266","54.38.73.16","172.18.0.2","TLSv1.2","611","Application Data"
"0.665285","54.38.73.16","172.18.0.2","TCP","611","[TCP Retransmission] 21002 → 36876 [PSH, ACK] Seq=1 Ack=544 Win=1452 Len=543 TSval=2673045724 TSecr=1075585820"
"0.665345","172.18.0.2","54.38.73.16","TCP","80","36876 → 21002 [ACK] Seq=544 Ack=544 Win=5608 Len=0 TSval=1075586371 TSecr=2673045724 SLE=1 SRE=544"
"0.666456","172.18.0.2","54.38.73.16","TCP","1516","[TCP segment of a reassembled PDU]"
"0.666540","172.18.0.2","54.38.73.16","TLSv1.2","705","Application Data"
"0.690117","54.38.73.16","172.18.0.2","TCP","68","21002 → 36876 [ACK] Seq=544 Ack=1992 Win=1450 Len=0 TSval=2673045740 TSecr=1075586372"
"0.690130","54.38.73.16","172.18.0.2","TCP","68","21002 → 36876 [ACK] Seq=544 Ack=2629 Win=1452 Len=0 TSval=2673045740 TSecr=1075586372"
"0.907704","54.38.73.16","172.18.0.2","TLSv1.2","611","Application Data"
"0.907766","172.18.0.2","54.38.73.16","TCP","68","36876 → 21002 [ACK] Seq=2629 Ack=1087 Win=5608 Len=0 TSval=1075586614 TSecr=2673045794"
"1.002141","54.38.73.16","172.18.0.2","TLSv1.2","1125","Application Data"
"1.002219","172.18.0.2","54.38.73.16","TCP","68","36876 → 21002 [ACK] Seq=2629 Ack=2144 Win=5600 Len=0 TSval=1075586708 TSecr=2673045818"
"1.008536","172.18.0.2","54.38.73.16","TLSv1.2","611","Application Data"
"1.033097","54.38.73.16","172.18.0.2","TCP","68","21002 → 36876 [ACK] Seq=2144 Ack=3172 Win=1452 Len=0 TSval=2673045826 TSecr=1075586714"
"1.381350","54.38.73.16","172.18.0.2","TLSv1.2","611","Application Data"
"1.381409","172.18.0.2","54.38.73.16","TCP","68","36876 → 21002 [ACK] Seq=3172 Ack=2687 Win=5608 Len=0 TSval=1075587087 TSecr=2673045902"
"1.382432","172.18.0.2","54.38.73.16","TLSv1.2","611","Application Data"
"1.407333","54.38.73.16","172.18.0.2","TCP","68","21002 → 36876 [ACK] Seq=2687 Ack=3715 Win=1452 Len=0 TSval=2673045919 TSecr=1075587088"
"1.638881","54.38.73.16","172.18.0.2","TLSv1.2","3695","Application Data"
"1.639071","172.18.0.2","54.38.73.16","TCP","68","36876 → 21002 [ACK] Seq=3715 Ack=6314 Win=5584 Len=0 TSval=1075587345 TSecr=2673045977"
"1.647616","54.38.73.16","172.18.0.2","TLSv1.2","5860","Application Data"
"1.647788","172.18.0.2","54.38.73.16","TCP","68","36876 → 21002 [ACK] Seq=3715 Ack=12106 Win=5580 Len=0 TSval=1075587354 TSecr=2673045979"
"1.662213","54.38.73.16","172.18.0.2","TLSv1.2","5671","Application Data, Application Data"
"1.662249","172.18.0.2","54.38.73.16","TCP","68","36876 → 21002 [ACK] Seq=3715 Ack=17709 Win=5581 Len=0 TSval=1075587368 TSecr=2673045983"
"1.673677","54.38.73.16","172.18.0.2","TLSv1.2","5860","Application Data"
"1.673900","172.18.0.2","54.38.73.16","TCP","68","36876 → 21002 [ACK] Seq=3715 Ack=23501 Win=5580 Len=0 TSval=1075587380 TSecr=2673045985"
"1.686784","54.38.73.16","172.18.0.2","TLSv1.2","3615","Application Data, Application Data"
"1.686974","172.18.0.2","54.38.73.16","TCP","68","36876 → 21002 [ACK] Seq=3715 Ack=27048 Win=5579 Len=0 TSval=1075587393 TSecr=2673045989"
"1.711482","54.38.73.16","172.18.0.2","TLSv1.2","1125","Application Data"
"1.719220","172.18.0.2","54.38.73.16","TLSv1.2","611","Application Data"
"1.743374","54.38.73.16","172.18.0.2","TCP","68","21002 → 36876 [ACK] Seq=28105 Ack=4258 Win=1452 Len=0 TSval=2673046003 TSecr=1075587425"
"1.942315","54.38.73.16","172.18.0.2","TLSv1.2","611","Application Data"
"1.943311","172.18.0.2","54.38.73.16","TLSv1.2","611","Application Data"
"1.968226","54.38.73.16","172.18.0.2","TCP","68","21002 → 36876 [ACK] Seq=28648 Ack=4801 Win=1452 Len=0 TSval=2673046059 TSecr=1075587649"
"2.519475","54.38.73.16","172.18.0.2","TLSv1.2","611","Application Data"
"2.539987","54.38.73.16","172.18.0.2","TCP","2964","[TCP segment of a reassembled PDU]"
"2.540172","172.18.0.2","54.38.73.16","TCP","68","36876 → 21002 [ACK] Seq=4801 Ack=32087 Win=5595 Len=0 TSval=1075588246 TSecr=2673046197"
"2.550570","54.38.73.16","172.18.0.2","TLSv1.2","4412","Application Data [TCP segment of a reassembled PDU]"
"2.550749","172.18.0.2","54.38.73.16","TCP","68","36876 → 21002 [ACK] Seq=4801 Ack=36431 Win=5579 Len=0 TSval=1075588257 TSecr=2673046205"
"2.564317","54.38.73.16","172.18.0.2","TLSv1.2","625","Application Data, Application Data"
"2.583955","54.38.73.16","172.18.0.2","TCP","2964","[TCP segment of a reassembled PDU]"
"2.583993","172.18.0.2","54.38.73.16","TCP","68","36876 → 21002 [ACK] Seq=4801 Ack=39884 Win=5595 Len=0 TSval=1075588290 TSecr=2673046209"
"2.609440","54.38.73.16","172.18.0.2","TLSv1.2","285","Application Data"
"2.616485","172.18.0.2","54.38.73.16","TLSv1.2","611","Application Data"
"2.640440","54.38.73.16","172.18.0.2","TCP","68","21002 → 36876 [ACK] Seq=40101 Ack=5344 Win=1452 Len=0 TSval=2673046228 TSecr=1075588322"
"2.840810","54.38.73.16","172.18.0.2","TLSv1.2","611","Application Data"
"2.841805","172.18.0.2","54.38.73.16","TLSv1.2","611","Application Data"
"2.865431","54.38.73.16","172.18.0.2","TCP","68","21002 → 36876 [ACK] Seq=40644 Ack=5887 Win=1452 Len=0 TSval=2673046284 TSecr=1075588548"
"3.065488","54.38.73.16","172.18.0.2","TLSv1.2","611","Application Data"
"3.073905","54.38.73.16","172.18.0.2","TCP","2964","[TCP segment of a reassembled PDU]"
"3.074084","172.18.0.2","54.38.73.16","TCP","68","36876 → 21002 [ACK] Seq=5887 Ack=44083 Win=5595 Len=0 TSval=1075588780 TSecr=2673046333"
"3.095129","54.38.73.16","172.18.0.2","TLSv1.2","4412","Application Data [TCP segment of a reassembled PDU]"
"3.095378","172.18.0.2","54.38.73.16","TCP","68","36876 → 21002 [ACK] Seq=5887 Ack=48427 Win=5579 Len=0 TSval=1075588801 TSecr=2673046341"
"3.097402","54.38.73.16","172.18.0.2","TLSv1.2","82","Application Data"
"3.097844","172.18.0.2","54.38.73.16","TLSv1.2","611","Application Data"
"3.104556","54.38.73.16","172.18.0.2","TLSv1.2","5860","Application Data"
"3.104763","172.18.0.2","54.38.73.16","TCP","68","36876 → 21002 [ACK] Seq=6430 Ack=54233 Win=5580 Len=0 TSval=1075588811 TSecr=2673046344"
"3.132329","54.38.73.16","172.18.0.2","TLSv1.2","2964","Application Data [TCP segment of a reassembled PDU]"
"3.132364","172.18.0.2","54.38.73.16","TCP","68","36876 → 21002 [ACK] Seq=6430 Ack=57129 Win=5595 Len=0 TSval=1075588838 TSecr=2673046350"
"3.134598","54.38.73.16","172.18.0.2","TCP","2964","21002 → 36876 [ACK] Seq=57129 Ack=6430 Win=1452 Len=2896 TSval=2673046351 TSecr=1075588804 [TCP segment of a reassembled PDU]"
"3.134642","172.18.0.2","54.38.73.16","TCP","68","36876 → 21002 [ACK] Seq=6430 Ack=60025 Win=5595 Len=0 TSval=1075588840 TSecr=2673046351"
"3.136175","54.38.73.16","172.18.0.2","TLSv1.2","5860","Application Data, Application Data, Application Data, Application Data"
"3.136352","172.18.0.2","54.38.73.16","TCP","68","36876 → 21002 [ACK] Seq=6430 Ack=65817 Win=5580 Len=0 TSval=1075588842 TSecr=2673046351"
"3.156621","54.38.73.16","172.18.0.2","TCP","2964","21002 → 36876 [ACK] Seq=65817 Ack=6430 Win=1452 Len=2896 TSval=2673046357 TSecr=1075588838 [TCP segment of a reassembled PDU]"
"3.156657","172.18.0.2","54.38.73.16","TCP","68","36876 → 21002 [ACK] Seq=6430 Ack=68713 Win=5595 Len=0 TSval=1075588862 TSecr=2673046357"
"3.158091","54.38.73.16","172.18.0.2","TLSv1.2","2964","Application Data, Application Data"
"3.158127","172.18.0.2","54.38.73.16","TCP","68","36876 → 21002 [ACK] Seq=6430 Ack=71609 Win=5595 Len=0 TSval=1075588864 TSecr=2673046357"
"3.158675","172.18.0.2","54.38.73.16","TLSv1.2","611","Application Data"
"3.160131","54.38.73.16","172.18.0.2","TLSv1.2","5460","Application Data, Application Data"
"3.160265","172.18.0.2","54.38.73.16","TCP","68","36876 → 21002 [ACK] Seq=6973 Ack=77001 Win=5582 Len=0 TSval=1075588866 TSecr=2673046358"
"3.164874","54.38.73.16","172.18.0.2","TCP","1516","[TCP segment of a reassembled PDU]"
"3.180718","54.38.73.16","172.18.0.2","TLSv1.2","2964","Application Data [TCP segment of a reassembled PDU]"
"3.180777","172.18.0.2","54.38.73.16","TCP","68","36876 → 21002 [ACK] Seq=6973 Ack=81345 Win=5595 Len=0 TSval=1075588887 TSecr=2673046359"
"3.182749","54.38.73.16","172.18.0.2","TCP","2964","21002 → 36876 [ACK] Seq=81345 Ack=6430 Win=1452 Len=2896 TSval=2673046363 TSecr=1075588864 [TCP segment of a reassembled PDU]"
"3.182783","172.18.0.2","54.38.73.16","TCP","68","36876 → 21002 [ACK] Seq=6973 Ack=84241 Win=5595 Len=0 TSval=1075588889 TSecr=2673046363"
"3.184707","54.38.73.16","172.18.0.2","TLSv1.2","5860","Application Data, Application Data"
"3.184883","172.18.0.2","54.38.73.16","TCP","68","36876 → 21002 [ACK] Seq=6973 Ack=90033 Win=5580 Len=0 TSval=1075588891 TSecr=2673046364"
"3.204144","54.38.73.16","172.18.0.2","TLSv1.2","2964","Application Data, Application Data"
"3.204178","172.18.0.2","54.38.73.16","TCP","68","36876 → 21002 [ACK] Seq=6973 Ack=92929 Win=5595 Len=0 TSval=1075588910 TSecr=2673046369"
"3.206025","54.38.73.16","172.18.0.2","TLSv1.2","2964","Application Data [TCP segment of a reassembled PDU]"
"3.206049","172.18.0.2","54.38.73.16","TCP","68","36876 → 21002 [ACK] Seq=6973 Ack=95825 Win=5595 Len=0 TSval=1075588912 TSecr=2673046369"
"3.206431","172.18.0.2","54.38.73.16","TLSv1.2","611","Application Data"
"3.208809","54.38.73.16","172.18.0.2","TLSv1.2","5860","Application Data [TCP segment of a reassembled PDU]"
"3.208998","172.18.0.2","54.38.73.16","TCP","68","36876 → 21002 [ACK] Seq=7516 Ack=101617 Win=5580 Len=0 TSval=1075588915 TSecr=2673046370"
"3.217048","54.38.73.16","172.18.0.2","TLSv1.2","1516","Application Data, Application Data"
"3.228689","54.38.73.16","172.18.0.2","TCP","1516","21002 → 36876 [ACK] Seq=103065 Ack=6973 Win=1452 Len=1448 TSval=2673046375 TSecr=1075588910 [TCP segment of a reassembled PDU]"
"3.228724","172.18.0.2","54.38.73.16","TCP","68","36876 → 21002 [ACK] Seq=7516 Ack=104513 Win=5593 Len=0 TSval=1075588934 TSecr=2673046372"
"3.229733","54.38.73.16","172.18.0.2","TLSv1.2","2964","Application Data [TCP segment of a reassembled PDU]"
"3.229769","172.18.0.2","54.38.73.16","TCP","68","36876 → 21002 [ACK] Seq=7516 Ack=107409 Win=5595 Len=0 TSval=1075588936 TSecr=2673046375"
"3.233494","54.38.73.16","172.18.0.2","TLSv1.2","5860","Application Data [TCP segment of a reassembled PDU]"
"3.233539","172.18.0.2","54.38.73.16","TLSv1.2","611","Application Data"
"3.238113","54.38.73.16","172.18.0.2","TLSv1.2","1516","Application Data [TCP segment of a reassembled PDU]"
"3.252330","54.38.73.16","172.18.0.2","TLSv1.2","2964","Application Data, Application Data"
"3.252369","172.18.0.2","54.38.73.16","TCP","68","36876 → 21002 [ACK] Seq=8059 Ack=117545 Win=5595 Len=0 TSval=1075588958 TSecr=2673046377"
"3.254145","54.38.73.16","172.18.0.2","TLSv1.2","2964","Application Data [TCP segment of a reassembled PDU]"
"3.254182","172.18.0.2","54.38.73.16","TCP","68","36876 → 21002 [ACK] Seq=8059 Ack=120441 Win=5595 Len=0 TSval=1075588960 TSecr=2673046381"
"3.257329","54.38.73.16","172.18.0.2","TLSv1.2","4923","Application Data, Application Data"
"3.257376","172.18.0.2","54.38.73.16","TLSv1.2","611","Application Data"
"3.320446","54.38.73.16","172.18.0.2","TCP","68","21002 → 36876 [ACK] Seq=125296 Ack=8602 Win=1452 Len=0 TSval=2673046398 TSecr=1075588963"
"3.320499","172.18.0.2","54.38.73.16","TLSv1.2","611","Application Data"
"3.384536","54.38.73.16","172.18.0.2","TCP","68","21002 → 36876 [ACK] Seq=125296 Ack=9145 Win=1452 Len=0 TSval=2673046414 TSecr=1075589026"
"3.943187","54.38.73.16","172.18.0.2","TLSv1.2","611","Application Data"
"3.943315","54.38.73.16","172.18.0.2","TCP","611","[TCP Retransmission] 21002 → 36876 [PSH, ACK] Seq=125296 Ack=9145 Win=1452 Len=543 TSval=2673046532 TSecr=1075589026"
"3.943345","172.18.0.2","54.38.73.16","TCP","80","36876 → 21002 [ACK] Seq=9145 Ack=125839 Win=5608 Len=0 TSval=1075589649 TSecr=2673046532 SLE=125296 SRE=125839"
"3.944307","172.18.0.2","54.38.73.16","TLSv1.2","611","Application Data"
"3.968204","54.38.73.16","172.18.0.2","TCP","68","21002 → 36876 [ACK] Seq=125839 Ack=9688 Win=1452 Len=0 TSval=2673046560 TSecr=1075589650"
"4.281430","54.38.73.16","172.18.0.2","TLSv1.2","611","Application Data"
"4.281488","172.18.0.2","54.38.73.16","TCP","68","36876 → 21002 [ACK] Seq=9688 Ack=126382 Win=5608 Len=0 TSval=1075589987 TSecr=2673046638"
"4.289204","54.38.73.16","172.18.0.2","TCP","1516","[TCP segment of a reassembled PDU]"
"4.289239","172.18.0.2","54.38.73.16","TCP","68","36876 → 21002 [ACK] Seq=9688 Ack=127830 Win=5597 Len=0 TSval=1075589995 TSecr=2673046640"
"4.290114","54.38.73.16","172.18.0.2","TLSv1.2","5860","Application Data [TCP segment of a reassembled PDU]"
"4.290150","172.18.0.2","54.38.73.16","TCP","68","36876 → 21002 [ACK] Seq=9688 Ack=133622 Win=5580 Len=0 TSval=1075589996 TSecr=2673046640"
"4.301002","54.38.73.16","172.18.0.2","TLSv1.2","2964","Application Data [TCP segment of a reassembled PDU]"
"4.301039","172.18.0.2","54.38.73.16","TCP","68","36876 → 21002 [ACK] Seq=9688 Ack=136518 Win=5595 Len=0 TSval=1075590007 TSecr=2673046643"
"4.313651","54.38.73.16","172.18.0.2","TCP","1516","21002 → 36876 [ACK] Seq=136518 Ack=9688 Win=1452 Len=1448 TSval=2673046646 TSecr=1075589995 [TCP segment of a reassembled PDU]"
"4.313705","172.18.0.2","54.38.73.16","TCP","68","36876 → 21002 [ACK] Seq=9688 Ack=137966 Win=5603 Len=0 TSval=1075590019 TSecr=2673046646"
"4.313670","54.38.73.16","172.18.0.2","TLSv1.2","4412","Application Data, Application Data"
"4.313736","172.18.0.2","54.38.73.16","TCP","68","36876 → 21002 [ACK] Seq=9688 Ack=142310 Win=5579 Len=0 TSval=1075590020 TSecr=2673046646"
"4.320834","54.38.73.16","172.18.0.2","TLSv1.2","1516","Application Data [TCP segment of a reassembled PDU]"
"4.320871","172.18.0.2","54.38.73.16","TCP","68","36876 → 21002 [ACK] Seq=9688 Ack=143758 Win=5593 Len=0 TSval=1075590027 TSecr=2673046648"
"4.324801","54.38.73.16","172.18.0.2","TLSv1.2","2964","Application Data [TCP segment of a reassembled PDU]"
"4.324839","172.18.0.2","54.38.73.16","TCP","68","36876 → 21002 [ACK] Seq=9688 Ack=146654 Win=5595 Len=0 TSval=1075590031 TSecr=2673046649"
"4.338916","54.38.73.16","172.18.0.2","TLSv1.2","5860","Application Data, Application Data"
"4.338953","172.18.0.2","54.38.73.16","TCP","68","36876 → 21002 [ACK] Seq=9688 Ack=152446 Win=5580 Len=0 TSval=1075590045 TSecr=2673046652"
"4.348511","54.38.73.16","172.18.0.2","TLSv1.2","2964","Application Data [TCP segment of a reassembled PDU]"
"4.348546","172.18.0.2","54.38.73.16","TCP","68","36876 → 21002 [ACK] Seq=9688 Ack=155342 Win=5595 Len=0 TSval=1075590054 TSecr=2673046655"
"4.349130","172.18.0.2","54.38.73.16","TLSv1.2","1125","Application Data"
"4.363685","54.38.73.16","172.18.0.2","TLSv1.2","5860","Application Data, Application Data"
"4.363723","172.18.0.2","54.38.73.16","TCP","68","36876 → 21002 [ACK] Seq=10745 Ack=161134 Win=5580 Len=0 TSval=1075590069 TSecr=2673046658"
"4.372700","54.38.73.16","172.18.0.2","TCP","68","[TCP Previous segment not captured] 21002 → 36876 [ACK] Seq=164281 Ack=10745 Win=1452 Len=0 TSval=2673046661 TSecr=1075590055"
"4.372725","54.38.73.16","172.18.0.2","TCP","3215","[TCP Retransmission] 21002 → 36876 [PSH, ACK] Seq=161134 Ack=9688 Win=1452 Len=3147 TSval=2673046661 TSecr=1075590054"
"4.372786","172.18.0.2","54.38.73.16","TCP","68","36876 → 21002 [ACK] Seq=10745 Ack=164281 Win=5592 Len=0 TSval=1075590079 TSecr=2673046661"
"4.381486","172.18.0.2","54.38.73.16","TLSv1.2","611","Application Data"
"4.406507","54.38.73.16","172.18.0.2","TCP","68","21002 → 36876 [ACK] Seq=164281 Ack=11288 Win=1452 Len=0 TSval=2673046669 TSecr=1075590087"
"4.658721","54.38.73.16","172.18.0.2","TLSv1.2","611","Application Data"
"4.659737","172.18.0.2","54.38.73.16","TLSv1.2","611","Application Data"
"4.683664","54.38.73.16","172.18.0.2","TCP","68","21002 → 36876 [ACK] Seq=164824 Ack=11831 Win=1452 Len=0 TSval=2673046738 TSecr=1075590365"
"5.291282","54.38.73.16","172.18.0.2","TLSv1.2","611","Application Data"
"5.310933","54.38.73.16","172.18.0.2","TLSv1.2","4412","Application Data"
"5.311122","172.18.0.2","54.38.73.16","TCP","68","36876 → 21002 [ACK] Seq=11831 Ack=169711 Win=5579 Len=0 TSval=1075591017 TSecr=2673046890"
"5.311270","54.38.73.16","172.18.0.2","TCP","2964","21002 → 36876 [ACK] Seq=169711 Ack=11831 Win=1452 Len=2896 TSval=2673046895 TSecr=1075590365 [TCP segment of a reassembled PDU]"
"5.311469","172.18.0.2","54.38.73.16","TCP","68","36876 → 21002 [ACK] Seq=11831 Ack=172607 Win=5563 Len=0 TSval=1075591017 TSecr=2673046895"
"5.331891","54.38.73.16","172.18.0.2","TLSv1.2","1516","Application Data [TCP segment of a reassembled PDU]"
"5.335092","54.38.73.16","172.18.0.2","TLSv1.2","5860","Application Data [TCP segment of a reassembled PDU]"
"5.335130","172.18.0.2","54.38.73.16","TCP","68","36876 → 21002 [ACK] Seq=11831 Ack=179847 Win=5580 Len=0 TSval=1075591041 TSecr=2673046900"
"5.335891","54.38.73.16","172.18.0.2","TLSv1.2","2964","Application Data [TCP segment of a reassembled PDU]"
"5.335927","172.18.0.2","54.38.73.16","TCP","68","36876 → 21002 [ACK] Seq=11831 Ack=182743 Win=5595 Len=0 TSval=1075591042 TSecr=2673046901"
"5.359326","54.38.73.16","172.18.0.2","TLSv1.2","2964","Application Data [TCP segment of a reassembled PDU]"
"5.359362","172.18.0.2","54.38.73.16","TCP","68","36876 → 21002 [ACK] Seq=11831 Ack=185639 Win=5595 Len=0 TSval=1075591065 TSecr=2673046907"
"5.359702","54.38.73.16","172.18.0.2","TLSv1.2","2964","Application Data [TCP segment of a reassembled PDU]"
"5.359759","172.18.0.2","54.38.73.16","TCP","68","36876 → 21002 [ACK] Seq=11831 Ack=188535 Win=5595 Len=0 TSval=1075591066 TSecr=2673046907"
"5.360045","54.38.73.16","172.18.0.2","TLSv1.2","4403","Application Data, Application Data, Application Data"
"5.360299","172.18.0.2","54.38.73.16","TCP","68","36876 → 21002 [ACK] Seq=11831 Ack=192870 Win=5563 Len=0 TSval=1075591066 TSecr=2673046907"
"5.360776","172.18.0.2","54.38.73.16","TLSv1.2","611","Application Data"
"5.383653","54.38.73.16","172.18.0.2","TCP","2964","[TCP segment of a reassembled PDU]"
"5.383703","172.18.0.2","54.38.73.16","TCP","68","36876 → 21002 [ACK] Seq=12374 Ack=195766 Win=5595 Len=0 TSval=1075591089 TSecr=2673046913"
"5.383667","54.38.73.16","172.18.0.2","TLSv1.2","2964","Application Data [TCP segment of a reassembled PDU]"
"5.383842","172.18.0.2","54.38.73.16","TCP","68","36876 → 21002 [ACK] Seq=12374 Ack=198662 Win=5579 Len=0 TSval=1075591090 TSecr=2673046913"
"5.383894","54.38.73.16","172.18.0.2","TCP","68","[TCP Previous segment not captured] 21002 → 36876 [ACK] Seq=202752 Ack=12374 Win=1452 Len=0 TSval=2673046914 TSecr=1075591067"
"5.383912","54.38.73.16","172.18.0.2","TCP","4158","[TCP Retransmission] 21002 → 36876 [PSH, ACK] Seq=198662 Ack=11831 Win=1452 Len=4090 TSval=2673046914 TSecr=1075591066"
"5.384203","172.18.0.2","54.38.73.16","TCP","68","36876 → 21002 [ACK] Seq=12374 Ack=202752 Win=5572 Len=0 TSval=1075591090 TSecr=2673046914"
"5.408323","54.38.73.16","172.18.0.2","TCP","2964","[TCP segment of a reassembled PDU]"
"5.408367","172.18.0.2","54.38.73.16","TCP","68","36876 → 21002 [ACK] Seq=12374 Ack=205648 Win=5595 Len=0 TSval=1075591114 TSecr=2673046920"
"5.408334","54.38.73.16","172.18.0.2","TLSv1.2","2964","Application Data [TCP segment of a reassembled PDU]"
"5.408532","172.18.0.2","54.38.73.16","TCP","68","36876 → 21002 [ACK] Seq=12374 Ack=208544 Win=5579 Len=0 TSval=1075591114 TSecr=2673046920"
"5.408569","54.38.73.16","172.18.0.2","TLSv1.2","4158","Application Data, Application Data, Application Data"
"5.408631","172.18.0.2","54.38.73.16","TCP","68","36876 → 21002 [ACK] Seq=12374 Ack=212634 Win=5563 Len=0 TSval=1075591114 TSecr=2673046920"
"5.409055","172.18.0.2","54.38.73.16","TLSv1.2","611","Application Data"
"5.433082","54.38.73.16","172.18.0.2","TLSv1.2","5266","Application Data, Application Data"
"5.433122","172.18.0.2","54.38.73.16","TCP","68","36876 → 21002 [ACK] Seq=12917 Ack=217832 Win=5583 Len=0 TSval=1075591139 TSecr=2673046926"
"5.471570","54.38.73.16","172.18.0.2","TCP","68","21002 → 36876 [ACK] Seq=217832 Ack=12917 Win=1452 Len=0 TSval=2673046936 TSecr=1075591115"
"5.471617","172.18.0.2","54.38.73.16","TLSv1.2","1154","Application Data, Application Data"
"5.496444","54.38.73.16","172.18.0.2","TCP","68","21002 → 36876 [ACK] Seq=217832 Ack=14003 Win=1452 Len=0 TSval=2673046942 TSecr=1075591177"
"5.699842","54.38.73.16","172.18.0.2","TLSv1.2","611","Application Data"
"5.700931","172.18.0.2","54.38.73.16","TLSv1.2","611","Application Data"
"5.724785","54.38.73.16","172.18.0.2","TCP","68","21002 → 36876 [ACK] Seq=218375 Ack=14546 Win=1452 Len=0 TSval=2673046999 TSecr=1075591407"
"6.032663","54.38.73.16","172.18.0.2","TLSv1.2","3695","Application Data"
"6.032857","172.18.0.2","54.38.73.16","TCP","68","36876 → 21002 [ACK] Seq=14546 Ack=222002 Win=5584 Len=0 TSval=1075591739 TSecr=2673047075"
"6.053473","54.38.73.16","172.18.0.2","TLSv1.2","5860","Application Data"
"6.053618","172.18.0.2","54.38.73.16","TCP","68","36876 → 21002 [ACK] Seq=14546 Ack=227794 Win=5580 Len=0 TSval=1075591759 TSecr=2673047081"
"6.056724","54.38.73.16","172.18.0.2","TLSv1.2","2964","Application Data [TCP segment of a reassembled PDU]"
"6.056779","172.18.0.2","54.38.73.16","TCP","68","36876 → 21002 [ACK] Seq=14546 Ack=230690 Win=5595 Len=0 TSval=1075591763 TSecr=2673047082"
"6.069012","54.38.73.16","172.18.0.2","TCP","1516","21002 → 36876 [ACK] Seq=230690 Ack=14546 Win=1452 Len=1448 TSval=2673047084 TSecr=1075591739 [TCP segment of a reassembled PDU]"
"6.078028","54.38.73.16","172.18.0.2","TLSv1.2","4412","Application Data [TCP segment of a reassembled PDU]"
"6.078172","172.18.0.2","54.38.73.16","TCP","68","36876 → 21002 [ACK] Seq=14546 Ack=236482 Win=5578 Len=0 TSval=1075591784 TSecr=2673047084"
"6.080993","54.38.73.16","172.18.0.2","TLSv1.2","5837","Application Data, Application Data, Application Data, Application Data"
"6.081036","172.18.0.2","54.38.73.16","TCP","68","36876 → 21002 [ACK] Seq=14546 Ack=242251 Win=5580 Len=0 TSval=1075591787 TSecr=2673047088"
"6.103123","54.38.73.16","172.18.0.2","TLSv1.2","5860","Application Data"
"6.103166","172.18.0.2","54.38.73.16","TCP","68","36876 → 21002 [ACK] Seq=14546 Ack=248043 Win=5580 Len=0 TSval=1075591809 TSecr=2673047093"
"6.103635","172.18.0.2","54.38.73.16","TLSv1.2","611","Application Data"
"6.106690","54.38.73.16","172.18.0.2","TLSv1.2","5860","Application Data, Application Data, Application Data"
"6.106727","172.18.0.2","54.38.73.16","TCP","68","36876 → 21002 [ACK] Seq=15089 Ack=253835 Win=5580 Len=0 TSval=1075591812 TSecr=2673047094"
"6.134413","54.38.73.16","172.18.0.2","TCP","68","[TCP Previous segment not captured] 21002 → 36876 [ACK] Seq=259627 Ack=15089 Win=1452 Len=0 TSval=2673047099 TSecr=1075591809"
"6.134452","54.38.73.16","172.18.0.2","TCP","5860","[TCP Retransmission] 21002 → 36876 [ACK] Seq=253835 Ack=14546 Win=1452 Len=5792 TSval=2673047099 TSecr=1075591809"
"6.134530","172.18.0.2","54.38.73.16","TCP","68","36876 → 21002 [ACK] Seq=15089 Ack=259627 Win=5580 Len=0 TSval=1075591840 TSecr=2673047094"
"6.134461","54.38.73.16","172.18.0.2","TLSv1.2","5540","Ignored Unknown Record"
"6.134625","172.18.0.2","54.38.73.16","TCP","68","36876 → 21002 [ACK] Seq=15089 Ack=265099 Win=5550 Len=0 TSval=1075591840 TSecr=2673047100"
"6.135094","172.18.0.2","54.38.73.16","TLSv1.2","611","Application Data"
"6.158957","54.38.73.16","172.18.0.2","TLSv1.2","11492","Application Data, Application Data, Application Data, Application Data"
"6.159000","172.18.0.2","54.38.73.16","TCP","68","36876 → 21002 [ACK] Seq=15632 Ack=276523 Win=5551 Len=0 TSval=1075591865 TSecr=2673047107"
"6.182476","54.38.73.16","172.18.0.2","TLSv1.2","7322","Application Data, Application Data"
"6.182544","172.18.0.2","54.38.73.16","TLSv1.2","611","Application Data"
"6.243952","54.38.73.16","172.18.0.2","TCP","68","21002 → 36876 [ACK] Seq=283777 Ack=16175 Win=1452 Len=0 TSval=2673047129 TSecr=1075591888"
"6.243998","172.18.0.2","54.38.73.16","TLSv1.2","611","Application Data"
"6.308229","54.38.73.16","172.18.0.2","TCP","68","21002 → 36876 [ACK] Seq=283777 Ack=16718 Win=1452 Len=0 TSval=2673047145 TSecr=1075591950"
"6.603878","54.38.73.16","172.18.0.2","TLSv1.2","611","Application Data"
"6.604934","172.18.0.2","54.38.73.16","TLSv1.2","611","Application Data"
"6.628436","54.38.73.16","172.18.0.2","TCP","68","21002 → 36876 [ACK] Seq=284320 Ack=17261 Win=1452 Len=0 TSval=2673047225 TSecr=1075592311"
"6.846475","54.38.73.16","172.18.0.2","TLSv1.2","611","Application Data"
"6.868112","54.38.73.16","172.18.0.2","TCP","2964","[TCP segment of a reassembled PDU]"
"6.868265","172.18.0.2","54.38.73.16","TCP","68","36876 → 21002 [ACK] Seq=17261 Ack=287759 Win=5595 Len=0 TSval=1075592574 TSecr=2673047279"
"6.889015","54.38.73.16","172.18.0.2","TLSv1.2","7308","Application Data, Application Data"
"6.889166","172.18.0.2","54.38.73.16","TCP","68","36876 → 21002 [ACK] Seq=17261 Ack=294999 Win=5564 Len=0 TSval=1075592595 TSecr=2673047290"
"6.892522","54.38.73.16","172.18.0.2","TLSv1.2","1870","Application Data, Application Data"
"6.892557","172.18.0.2","54.38.73.16","TCP","68","36876 → 21002 [ACK] Seq=17261 Ack=296801 Win=5600 Len=0 TSval=1075592598 TSecr=2673047291"
"6.914073","54.38.73.16","172.18.0.2","TCP","1516","[TCP segment of a reassembled PDU]"
"6.915988","54.38.73.16","172.18.0.2","TLSv1.2","191","Application Data"
"6.916152","172.18.0.2","54.38.73.16","TCP","68","36876 → 21002 [ACK] Seq=17261 Ack=298372 Win=5612 Len=0 TSval=1075592622 TSecr=2673047296"
"6.921507","54.38.73.16","172.18.0.2","TCP","1516","[TCP segment of a reassembled PDU]"
"6.921865","54.38.73.16","172.18.0.2","TCP","1516","21002 → 36876 [ACK] Seq=299820 Ack=17261 Win=1452 Len=1448 TSval=2673047298 TSecr=1075592598 [TCP segment of a reassembled PDU]"
"6.921978","172.18.0.2","54.38.73.16","TCP","68","36876 → 21002 [ACK] Seq=17261 Ack=301268 Win=5612 Len=0 TSval=1075592628 TSecr=2673047298"
"6.940579","54.38.73.16","172.18.0.2","TLSv1.2","1342","Application Data, Application Data"
"6.946337","172.18.0.2","54.38.73.16","TLSv1.2","611","Application Data"
"6.970298","54.38.73.16","172.18.0.2","TCP","68","21002 → 36876 [ACK] Seq=302542 Ack=17804 Win=1452 Len=0 TSval=2673047310 TSecr=1075592652"
