_ws.col.Time,_ws.col.Source,_ws.col.Destination,_ws.col.Protocol,_ws.col.Length,_ws.col.Info
"0.000000","172.18.0.2","54.38.73.16","TLSv1.2","611","Application Data"
"0.026202","54.38.73.16","172.18.0.2","TCP","68","21002 → 36876 [ACK] Seq=1 Ack=544 Win=1452 Len=0 TSval=2679222069 TSecr=1100291506"
"0.671974","54.38.73.16","172.18.0.2","TLSv1.2","611","Application Data"
"0.673177","172.18.0.2","54.38.73.16","TLSv1.2","2153","Application Data"
"0.698513","54.38.73.16","172.18.0.2","TCP","68","21002 → 36876 [ACK] Seq=544 Ack=2629 Win=1448 Len=0 TSval=2679222237 TSecr=1100292179"
"1.285510","54.38.73.16","172.18.0.2","TLSv1.2","611","Application Data"
"1.329097","172.18.0.2","54.38.73.16","TCP","68","36876 → 21002 [ACK] Seq=2629 Ack=1087 Win=5612 Len=0 TSval=1100292835 TSecr=2679222360"
"1.353710","54.38.73.16","172.18.0.2","TLSv1.2","1125","Application Data"
"1.353765","172.18.0.2","54.38.73.16","TCP","68","36876 → 21002 [ACK] Seq=2629 Ack=2144 Win=5604 Len=0 TSval=1100292859 TSecr=2679222401"
"1.361219","172.18.0.2","54.38.73.16","TLSv1.2","611","Application Data"
"1.385296","54.38.73.16","172.18.0.2","TCP","68","21002 → 36876 [ACK] Seq=2144 Ack=3172 Win=1452 Len=0 TSval=2679222409 TSecr=1100292867"
"1.899986","54.38.73.16","172.18.0.2","TLSv1.2","611","Application Data"
"1.900004","172.18.0.2","54.38.73.16","TCP","68","36876 → 21002 [ACK] Seq=3172 Ack=2687 Win=5608 Len=0 TSval=1100293406 TSecr=2679222534"
"1.900378","172.18.0.2","54.38.73.16","TLSv1.2","611","Application Data"
"1.924531","54.38.73.16","172.18.0.2","TCP","68","21002 → 36876 [ACK] Seq=2687 Ack=3715 Win=1452 Len=0 TSval=2679222544 TSecr=1100293406"
"2.513890","54.38.73.16","172.18.0.2","TLSv1.2","611","Application Data"
"2.513943","172.18.0.2","54.38.73.16","TCP","68","36876 → 21002 [ACK] Seq=3715 Ack=3230 Win=5608 Len=0 TSval=1100294020 TSecr=2679222665"
"2.514216","54.38.73.16","172.18.0.2","TCP","2964","[TCP segment of a reassembled PDU]"
"2.514236","172.18.0.2","54.38.73.16","TCP","68","36876 → 21002 [ACK] Seq=3715 Ack=6126 Win=5596 Len=0 TSval=1100294020 TSecr=2679222667"
"2.514242","54.38.73.16","172.18.0.2","TLSv1.2","4412","Application Data [TCP segment of a reassembled PDU]"
"2.514266","172.18.0.2","54.38.73.16","TCP","68","36876 → 21002 [ACK] Seq=3715 Ack=10470 Win=5565 Len=0 TSval=1100294020 TSecr=2679222675"
"2.532795","54.38.73.16","172.18.0.2","TLSv1.2","2964","Application Data, Application Data"
"2.532817","172.18.0.2","54.38.73.16","TCP","68","36876 → 21002 [ACK] Seq=3715 Ack=13366 Win=5596 Len=0 TSval=1100294038 TSecr=2679222696"
"2.537271","54.38.73.16","172.18.0.2","TLSv1.2","1356","Application Data"
"2.537291","172.18.0.2","54.38.73.16","TCP","68","36876 → 21002 [ACK] Seq=3715 Ack=14654 Win=5593 Len=0 TSval=1100294043 TSecr=2679222697"
"2.554445","54.38.73.16","172.18.0.2","TLSv1.2","2964","Application Data"
"2.554488","172.18.0.2","54.38.73.16","TCP","68","36876 → 21002 [ACK] Seq=3715 Ack=17550 Win=5596 Len=0 TSval=1100294060 TSecr=2679222701"
"2.554817","54.38.73.16","172.18.0.2","TLSv1.2","4412","Application Data [TCP segment of a reassembled PDU]"
"2.554837","172.18.0.2","54.38.73.16","TCP","68","36876 → 21002 [ACK] Seq=3715 Ack=21894 Win=5580 Len=0 TSval=1100294060 TSecr=2679222701"
"2.561046","54.38.73.16","172.18.0.2","TLSv1.2","625","Application Data"
"2.561061","172.18.0.2","54.38.73.16","TCP","68","36876 → 21002 [ACK] Seq=3715 Ack=22451 Win=5593 Len=0 TSval=1100294067 TSecr=2679222703"
"2.564825","54.38.73.16","172.18.0.2","TLSv1.2","4412","Application Data"
"2.564840","172.18.0.2","54.38.73.16","TCP","68","36876 → 21002 [ACK] Seq=3715 Ack=26795 Win=5580 Len=0 TSval=1100294070 TSecr=2679222704"
"2.584588","54.38.73.16","172.18.0.2","TLSv1.2","408","Application Data"
"2.584613","172.18.0.2","54.38.73.16","TCP","68","36876 → 21002 [ACK] Seq=3715 Ack=27135 Win=5593 Len=0 TSval=1100294090 TSecr=2679222709"
"2.588272","54.38.73.16","172.18.0.2","TCP","2964","[TCP segment of a reassembled PDU]"
"2.588296","172.18.0.2","54.38.73.16","TCP","68","36876 → 21002 [ACK] Seq=3715 Ack=30031 Win=5596 Len=0 TSval=1100294094 TSecr=2679222709"
"2.609252","54.38.73.16","172.18.0.2","TLSv1.2","285","Application Data"
"2.609276","172.18.0.2","54.38.73.16","TCP","68","36876 → 21002 [ACK] Seq=3715 Ack=30248 Win=5595 Len=0 TSval=1100294115 TSecr=2679222715"
"2.609704","172.18.0.2","54.38.73.16","TLSv1.2","611","Application Data"
"2.633350","54.38.73.16","172.18.0.2","TCP","68","21002 → 36876 [ACK] Seq=30248 Ack=4258 Win=1452 Len=0 TSval=2679222721 TSecr=1100294115"
"2.675687","54.38.73.16","172.18.0.2","TLSv1.2","4145","Application Data"
"2.675713","54.38.73.16","172.18.0.2","TLSv1.2","5860","Application Data"
"2.675800","172.18.0.2","54.38.73.16","TCP","68","36876 → 21002 [ACK] Seq=4258 Ack=40117 Win=5551 Len=0 TSval=1100294181 TSecr=2679222731"
"2.686539","54.38.73.16","172.18.0.2","TLSv1.2","2964","Application Data, Application Data"
"2.686563","172.18.0.2","54.38.73.16","TCP","68","36876 → 21002 [ACK] Seq=4258 Ack=43013 Win=5596 Len=0 TSval=1100294192 TSecr=2679222734"
"2.700560","54.38.73.16","172.18.0.2","TLSv1.2","2897","Application Data, Application Data"
"2.700578","172.18.0.2","54.38.73.16","TCP","68","36876 → 21002 [ACK] Seq=4258 Ack=45842 Win=5596 Len=0 TSval=1100294206 TSecr=2679222737"
"2.731754","54.38.73.16","172.18.0.2","TLSv1.2","4145","Application Data"
"2.731903","172.18.0.2","54.38.73.16","TCP","68","36876 → 21002 [ACK] Seq=4258 Ack=49919 Win=5580 Len=0 TSval=1100294237 TSecr=2679222745"
"2.762569","54.38.73.16","172.18.0.2","TLSv1.2","675","Application Data"
"2.776552","54.38.73.16","172.18.0.2","TCP","1516","[TCP segment of a reassembled PDU]"
"2.776571","172.18.0.2","54.38.73.16","TCP","68","36876 → 21002 [ACK] Seq=4258 Ack=51974 Win=5593 Len=0 TSval=1100294282 TSecr=2679222753"
"2.801071","54.38.73.16","172.18.0.2","TLSv1.2","1516","Application Data [TCP segment of a reassembled PDU]"
"2.801144","54.38.73.16","172.18.0.2","TLSv1.2","828","Application Data"
"2.801229","172.18.0.2","54.38.73.16","TCP","68","36876 → 21002 [ACK] Seq=4258 Ack=54182 Win=5577 Len=0 TSval=1100294307 TSecr=2679222763"
"2.801532","172.18.0.2","54.38.73.16","TLSv1.2","611","Application Data"
"2.864696","54.38.73.16","172.18.0.2","TCP","68","21002 → 36876 [ACK] Seq=54182 Ack=4801 Win=1452 Len=0 TSval=2679222779 TSecr=1100294307"
"2.880650","54.38.73.16","172.18.0.2","TLSv1.2","4145","Application Data"
"2.880691","172.18.0.2","54.38.73.16","TCP","68","36876 → 21002 [ACK] Seq=4801 Ack=58259 Win=5589 Len=0 TSval=1100294386 TSecr=2679222783"
"2.880694","54.38.73.16","172.18.0.2","TCP","1516","[TCP segment of a reassembled PDU]"
"2.880942","54.38.73.16","172.18.0.2","TLSv1.2","2964","Application Data [TCP segment of a reassembled PDU]"
"2.881135","172.18.0.2","54.38.73.16","TLSv1.2","611","Application Data"
"2.904291","54.38.73.16","172.18.0.2","TLSv1.2","1516","Application Data [TCP segment of a reassembled PDU]"
"2.904659","54.38.73.16","172.18.0.2","TLSv1.2","81","Application Data"
"2.904681","172.18.0.2","54.38.73.16","TCP","68","36876 → 21002 [ACK] Seq=5344 Ack=64064 Win=5590 Len=0 TSval=1100294410 TSecr=2679222789"
"2.944229","54.38.73.16","172.18.0.2","TCP","68","21002 → 36876 [ACK] Seq=64064 Ack=5344 Win=1452 Len=0 TSval=2679222799 TSecr=1100294387"
"2.944261","172.18.0.2","54.38.73.16","TLSv1.2","611","Application Data"
"3.007972","54.38.73.16","172.18.0.2","TCP","68","21002 → 36876 [ACK] Seq=64064 Ack=5887 Win=1452 Len=0 TSval=2679222815 TSecr=1100294450"
"3.847681","54.38.73.16","172.18.0.2","TLSv1.2","611","Application Data"
"3.848062","54.38.73.16","172.18.0.2","TCP","611","[TCP Retransmission] 21002 → 36876 [PSH, ACK] Seq=64064 Ack=5887 Win=1452 Len=543 TSval=2679222995 TSecr=1100294450"
"3.848097","172.18.0.2","54.38.73.16","TCP","80","36876 → 21002 [ACK] Seq=5887 Ack=64607 Win=5612 Len=0 TSval=1100295354 TSecr=2679222995 SLE=64064 SRE=64607"
"3.848626","172.18.0.2","54.38.73.16","TLSv1.2","611","Application Data"
"3.872776","54.38.73.16","172.18.0.2","TCP","68","21002 → 36876 [ACK] Seq=64607 Ack=6430 Win=1452 Len=0 TSval=2679223031 TSecr=1100295354"
"4.669756","54.38.73.16","172.18.0.2","TLSv1.2","3695","Application Data"
"4.669796","172.18.0.2","54.38.73.16","TCP","68","36876 → 21002 [ACK] Seq=6430 Ack=68234 Win=5584 Len=0 TSval=1100296175 TSecr=2679223203"
"4.669911","54.38.73.16","172.18.0.2","TCP","2964","[TCP segment of a reassembled PDU]"
"4.669942","172.18.0.2","54.38.73.16","TCP","68","36876 → 21002 [ACK] Seq=6430 Ack=71130 Win=5580 Len=0 TSval=1100296176 TSecr=2679223214"
"4.680164","54.38.73.16","172.18.0.2","TLSv1.2","2964","Application Data, Application Data"
"4.680186","172.18.0.2","54.38.73.16","TCP","68","36876 → 21002 [ACK] Seq=6430 Ack=74026 Win=5596 Len=0 TSval=1100296186 TSecr=2679223233"
"4.680363","54.38.73.16","172.18.0.2","TLSv1.2","2964","Application Data [TCP segment of a reassembled PDU]"
"4.680376","172.18.0.2","54.38.73.16","TCP","68","36876 → 21002 [ACK] Seq=6430 Ack=76922 Win=5581 Len=0 TSval=1100296186 TSecr=2679223233"
"4.694386","54.38.73.16","172.18.0.2","TLSv1.2","234","Application Data"
"4.694408","172.18.0.2","54.38.73.16","TCP","68","36876 → 21002 [ACK] Seq=6430 Ack=77088 Win=5593 Len=0 TSval=1100296200 TSecr=2679223236"
"4.703165","54.38.73.16","172.18.0.2","TLSv1.2","4412","Application Data"
"4.703192","172.18.0.2","54.38.73.16","TCP","68","36876 → 21002 [ACK] Seq=6430 Ack=81432 Win=5580 Len=0 TSval=1100296209 TSecr=2679223238"
"4.704979","54.38.73.16","172.18.0.2","TLSv1.2","2964","Application Data [TCP segment of a reassembled PDU]"
"4.704997","172.18.0.2","54.38.73.16","TCP","68","36876 → 21002 [ACK] Seq=6430 Ack=84328 Win=5596 Len=0 TSval=1100296211 TSecr=2679223239"
"4.715008","54.38.73.16","172.18.0.2","TLSv1.2","1516","Application Data [TCP segment of a reassembled PDU]"
"4.715028","172.18.0.2","54.38.73.16","TCP","68","36876 → 21002 [ACK] Seq=6430 Ack=85776 Win=5593 Len=0 TSval=1100296221 TSecr=2679223241"
"4.718348","54.38.73.16","172.18.0.2","TLSv1.2","1262","Application Data"
"4.718366","172.18.0.2","54.38.73.16","TCP","68","36876 → 21002 [ACK] Seq=6430 Ack=86970 Win=5593 Len=0 TSval=1100296224 TSecr=2679223242"
"4.727076","172.18.0.2","54.38.73.16","TLSv1.2","611","Application Data"
"4.752091","54.38.73.16","172.18.0.2","TCP","68","21002 → 36876 [ACK] Seq=86970 Ack=6973 Win=1452 Len=0 TSval=2679223250 TSecr=1100296233"
"5.278838","54.38.73.16","172.18.0.2","TLSv1.2","611","Application Data"
"5.278894","172.18.0.2","54.38.73.16","TCP","68","36876 → 21002 [ACK] Seq=6973 Ack=87513 Win=5608 Len=0 TSval=1100296784 TSecr=2679223363"
"5.279986","172.18.0.2","54.38.73.16","TLSv1.2","611","Application Data"
"5.303209","54.38.73.16","172.18.0.2","TCP","68","21002 → 36876 [ACK] Seq=87513 Ack=7516 Win=1452 Len=0 TSval=2679223388 TSecr=1100296786"
"5.894334","54.38.73.16","172.18.0.2","TLSv1.2","611","Application Data"
"5.894370","54.38.73.16","172.18.0.2","TCP","1516","[TCP segment of a reassembled PDU]"
"5.894516","172.18.0.2","54.38.73.16","TCP","68","36876 → 21002 [ACK] Seq=7516 Ack=89504 Win=5597 Len=0 TSval=1100297400 TSecr=2679223484"
"5.919567","54.38.73.16","172.18.0.2","TLSv1.2","705","Application Data"
"5.924302","172.18.0.2","54.38.73.16","TLSv1.2","611","Application Data"
"5.948485","54.38.73.16","172.18.0.2","TCP","68","21002 → 36876 [ACK] Seq=90141 Ack=8059 Win=1452 Len=0 TSval=2679223550 TSecr=1100297430"
"6.509894","54.38.73.16","172.18.0.2","TLSv1.2","611","Application Data"
"6.510903","172.18.0.2","54.38.73.16","TLSv1.2","611","Application Data"
"6.535642","54.38.73.16","172.18.0.2","TCP","68","21002 → 36876 [ACK] Seq=90684 Ack=8602 Win=1452 Len=0 TSval=2679223696 TSecr=1100298016"
"7.127077","54.38.73.16","172.18.0.2","TCP","1516","[TCP segment of a reassembled PDU]"
"7.127449","54.38.73.16","172.18.0.2","TLSv1.2","2697","Application Data"
"7.127472","54.38.73.16","172.18.0.2","TCP","2964","[TCP segment of a reassembled PDU]"
"7.127480","54.38.73.16","172.18.0.2","TLSv1.2","2964","Application Data, Application Data"
"7.127590","172.18.0.2","54.38.73.16","TCP","68","36876 → 21002 [ACK] Seq=8602 Ack=100553 Win=5567 Len=0 TSval=1100298633 TSecr=2679223819"
"7.129010","02:42:09:5f:bf:77","","ARP","44","Who has 172.18.0.2? Tell 172.18.0.1"
"7.129023","02:42:ac:12:00:02","","ARP","44","172.18.0.2 is at 02:42:ac:12:00:02"
"7.150954","54.38.73.16","172.18.0.2","TLSv1.2","1109","Application Data"
"7.162967","54.38.73.16","172.18.0.2","TLSv1.2","8756","Application Data, Application Data"
"7.163145","172.18.0.2","54.38.73.16","TCP","68","36876 → 21002 [ACK] Seq=8602 Ack=110282 Win=5566 Len=0 TSval=1100298669 TSecr=2679223850"
"7.163946","172.18.0.2","54.38.73.16","TLSv1.2","611","Application Data"
"7.184307","54.38.73.16","172.18.0.2","TLSv1.2","1516","Application Data [TCP segment of a reassembled PDU]"
"7.187224","54.38.73.16","172.18.0.2","TCP","68","[TCP Previous segment not captured] 21002 → 36876 [ACK] Seq=115103 Ack=9145 Win=1452 Len=0 TSval=2679223859 TSecr=1100298670"
"7.187248","54.38.73.16","172.18.0.2","TCP","3441","[TCP Retransmission] 21002 → 36876 [PSH, ACK] Seq=111730 Ack=8602 Win=1452 Len=3373 TSval=2679223859 TSecr=1100298669"
"7.187262","172.18.0.2","54.38.73.16","TCP","68","36876 → 21002 [ACK] Seq=9145 Ack=115103 Win=5592 Len=0 TSval=1100298693 TSecr=2679223858"
"7.278369","54.38.73.16","172.18.0.2","TCP","2964","[TCP segment of a reassembled PDU]"
"7.278397","172.18.0.2","54.38.73.16","TCP","68","36876 → 21002 [ACK] Seq=9145 Ack=117999 Win=5596 Len=0 TSval=1100298784 TSecr=2679223882"
"7.278717","54.38.73.16","172.18.0.2","TLSv1.2","1249","Application Data"
"7.278742","54.38.73.16","172.18.0.2","TLSv1.2","5860","Application Data"
"7.278895","172.18.0.2","54.38.73.16","TCP","68","36876 → 21002 [ACK] Seq=9145 Ack=124972 Win=5566 Len=0 TSval=1100298784 TSecr=2679223882"
"7.279340","172.18.0.2","54.38.73.16","TLSv1.2","611","Application Data"
"7.288891","54.38.73.16","172.18.0.2","TCP","1516","21002 → 36876 [ACK] Seq=124972 Ack=9145 Win=1452 Len=1448 TSval=2679223885 TSecr=1100298693 [TCP segment of a reassembled PDU]"
"7.301971","54.38.73.16","172.18.0.2","TLSv1.2","2964","Application Data [TCP segment of a reassembled PDU]"
"7.301996","172.18.0.2","54.38.73.16","TCP","68","36876 → 21002 [ACK] Seq=9688 Ack=129316 Win=5596 Len=0 TSval=1100298808 TSecr=2679223885"
"7.302666","54.38.73.16","172.18.0.2","TLSv1.2","4504","Application Data, Application Data"
"7.302801","172.18.0.2","54.38.73.16","TCP","68","36876 → 21002 [ACK] Seq=9688 Ack=133752 Win=5586 Len=0 TSval=1100298808 TSecr=2679223888"
"7.303080","54.38.73.16","172.18.0.2","TCP","68","21002 → 36876 [ACK] Seq=133752 Ack=9688 Win=1452 Len=0 TSval=2679223888 TSecr=1100298785"
"7.325848","54.38.73.16","172.18.0.2","TLSv1.2","1125","Application Data"
"7.369085","172.18.0.2","54.38.73.16","TCP","68","36876 → 21002 [ACK] Seq=9688 Ack=134809 Win=5612 Len=0 TSval=1100298875 TSecr=2679223894"
"7.405755","54.38.73.16","172.18.0.2","TLSv1.2","4145","Application Data"
"7.405800","172.18.0.2","54.38.73.16","TCP","68","36876 → 21002 [ACK] Seq=9688 Ack=138886 Win=5589 Len=0 TSval=1100298911 TSecr=2679223913"
"7.405805","54.38.73.16","172.18.0.2","TLSv1.2","5860","Application Data"
"7.405817","172.18.0.2","54.38.73.16","TCP","68","36876 → 21002 [ACK] Seq=9688 Ack=144678 Win=5551 Len=0 TSval=1100298911 TSecr=2679223913"
"7.406646","172.18.0.2","54.38.73.16","TLSv1.2","611","Application Data"
"7.416626","54.38.73.16","172.18.0.2","TCP","1516","21002 → 36876 [ACK] Seq=144678 Ack=9688 Win=1452 Len=1448 TSval=2679223916 TSecr=1100298875 [TCP segment of a reassembled PDU]"
"7.416651","172.18.0.2","54.38.73.16","TCP","68","36876 → 21002 [ACK] Seq=10231 Ack=146126 Win=5593 Len=0 TSval=1100298922 TSecr=2679223916"
"7.431662","54.38.73.16","172.18.0.2","TLSv1.2","4830","Application Data, Application Data, Application Data"
"7.431688","172.18.0.2","54.38.73.16","TCP","68","36876 → 21002 [ACK] Seq=10231 Ack=150888 Win=5585 Len=0 TSval=1100298937 TSecr=2679223920"
"7.436688","54.38.73.16","172.18.0.2","TCP","2964","[TCP segment of a reassembled PDU]"
"7.436720","172.18.0.2","54.38.73.16","TCP","68","36876 → 21002 [ACK] Seq=10231 Ack=153784 Win=5596 Len=0 TSval=1100298942 TSecr=2679223922"
"7.456511","54.38.73.16","172.18.0.2","TLSv1.2","1342","Application Data, Application Data"
"7.456892","172.18.0.2","54.38.73.16","TCP","68","36876 → 21002 [ACK] Seq=10231 Ack=155058 Win=5612 Len=0 TSval=1100298962 TSecr=2679223927"
"7.531845","54.38.73.16","172.18.0.2","TLSv1.2","3695","Application Data"
"7.531985","172.18.0.2","54.38.73.16","TCP","68","36876 → 21002 [ACK] Seq=10231 Ack=158685 Win=5584 Len=0 TSval=1100299038 TSecr=2679223945"
"7.532445","172.18.0.2","54.38.73.16","TLSv1.2","611","Application Data"
"7.541568","54.38.73.16","172.18.0.2","TCP","2964","[TCP segment of a reassembled PDU]"
"7.541710","172.18.0.2","54.38.73.16","TCP","68","36876 → 21002 [ACK] Seq=10774 Ack=161581 Win=5596 Len=0 TSval=1100299047 TSecr=2679223948"
"7.541824","54.38.73.16","172.18.0.2","TLSv1.2","2964","Application Data [TCP segment of a reassembled PDU]"
"7.541847","172.18.0.2","54.38.73.16","TCP","68","36876 → 21002 [ACK] Seq=10774 Ack=164477 Win=5596 Len=0 TSval=1100299047 TSecr=2679223948"
"7.556374","54.38.73.16","172.18.0.2","TLSv1.2","2587","Application Data, Application Data"
"7.556399","172.18.0.2","54.38.73.16","TCP","68","36876 → 21002 [ACK] Seq=10774 Ack=166996 Win=5597 Len=0 TSval=1100299062 TSecr=2679223952"
"7.596165","54.38.73.16","172.18.0.2","TCP","68","21002 → 36876 [ACK] Seq=166996 Ack=10774 Win=1452 Len=0 TSval=2679223962 TSecr=1100299038"
"7.676519","54.38.73.16","172.18.0.2","TLSv1.2","3695","Application Data"
"7.676674","172.18.0.2","54.38.73.16","TCP","68","36876 → 21002 [ACK] Seq=10774 Ack=170623 Win=5580 Len=0 TSval=1100299182 TSecr=2679223981"
"7.677231","172.18.0.2","54.38.73.16","TLSv1.2","611","Application Data"
"7.686902","54.38.73.16","172.18.0.2","TLSv1.2","4412","Application Data"
"7.687051","172.18.0.2","54.38.73.16","TCP","68","36876 → 21002 [ACK] Seq=11317 Ack=174967 Win=5580 Len=0 TSval=1100299193 TSecr=2679223984"
"7.701971","54.38.73.16","172.18.0.2","TLSv1.2","922","Application Data"
"7.739870","54.38.73.16","172.18.0.2","TCP","68","21002 → 36876 [ACK] Seq=175821 Ack=11317 Win=1452 Len=0 TSval=2679223998 TSecr=1100299183"
"7.739892","172.18.0.2","54.38.73.16","TLSv1.2","611","Application Data"
"7.800580","54.38.73.16","172.18.0.2","TCP","68","21002 → 36876 [ACK] Seq=175821 Ack=11860 Win=1452 Len=0 TSval=2679224013 TSecr=1100299245"
"8.658161","54.38.73.16","172.18.0.2","TLSv1.2","611","Application Data"
"8.658197","54.38.73.16","172.18.0.2","TCP","611","[TCP Retransmission] 21002 → 36876 [PSH, ACK] Seq=175821 Ack=11860 Win=1452 Len=543 TSval=2679224219 TSecr=1100299245"
"8.658234","172.18.0.2","54.38.73.16","TCP","80","36876 → 21002 [ACK] Seq=11860 Ack=176364 Win=5608 Len=0 TSval=1100300164 TSecr=2679224219 SLE=175821 SRE=176364"
"8.659265","172.18.0.2","54.38.73.16","TLSv1.2","611","Application Data"
"8.684120","54.38.73.16","172.18.0.2","TCP","68","21002 → 36876 [ACK] Seq=176364 Ack=12403 Win=1452 Len=0 TSval=2679224233 TSecr=1100300165"
"9.273434","54.38.73.16","172.18.0.2","TLSv1.2","3695","Application Data"
"9.273489","172.18.0.2","54.38.73.16","TCP","68","36876 → 21002 [ACK] Seq=12403 Ack=179991 Win=5591 Len=0 TSval=1100300779 TSecr=2679224372"
"9.273497","54.38.73.16","172.18.0.2","TCP","2964","[TCP segment of a reassembled PDU]"
"9.273520","172.18.0.2","54.38.73.16","TCP","68","36876 → 21002 [ACK] Seq=12403 Ack=182887 Win=5576 Len=0 TSval=1100300779 TSecr=2679224375"
"9.273702","54.38.73.16","172.18.0.2","TLSv1.2","2964","Application Data [TCP segment of a reassembled PDU]"
"9.273724","172.18.0.2","54.38.73.16","TCP","68","36876 → 21002 [ACK] Seq=12403 Ack=185783 Win=5561 Len=0 TSval=1100300779 TSecr=2679224375"
"9.273728","54.38.73.16","172.18.0.2","TCP","1516","21002 → 36876 [ACK] Seq=185783 Ack=12403 Win=1452 Len=1448 TSval=2679224377 TSecr=1100300165 [TCP segment of a reassembled PDU]"
"9.273742","172.18.0.2","54.38.73.16","TCP","68","36876 → 21002 [ACK] Seq=12403 Ack=187231 Win=5550 Len=0 TSval=1100300779 TSecr=2679224377"
"9.297620","54.38.73.16","172.18.0.2","TLSv1.2","6337","Application Data, Application Data, Application Data, Application Data"
"9.297644","172.18.0.2","54.38.73.16","TCP","68","36876 → 21002 [ACK] Seq=12403 Ack=193500 Win=5565 Len=0 TSval=1100300803 TSecr=2679224387"
"9.366230","54.38.73.16","172.18.0.2","TLSv1.2","3181","Application Data"
"9.366255","172.18.0.2","54.38.73.16","TCP","68","36876 → 21002 [ACK] Seq=12403 Ack=196613 Win=5580 Len=0 TSval=1100300872 TSecr=2679224404"
"9.385799","54.38.73.16","172.18.0.2","TLSv1.2","4412","Application Data"
"9.385823","172.18.0.2","54.38.73.16","TCP","68","36876 → 21002 [ACK] Seq=12403 Ack=200957 Win=5580 Len=0 TSval=1100300891 TSecr=2679224409"
"9.390070","54.38.73.16","172.18.0.2","TCP","2964","21002 → 36876 [ACK] Seq=200957 Ack=12403 Win=1452 Len=2896 TSval=2679224410 TSecr=1100300872 [TCP segment of a reassembled PDU]"
"9.390092","172.18.0.2","54.38.73.16","TCP","68","36876 → 21002 [ACK] Seq=12403 Ack=203853 Win=5596 Len=0 TSval=1100300896 TSecr=2679224410"
"9.410788","54.38.73.16","172.18.0.2","TLSv1.2","1653","Application Data, Application Data"
"9.410810","172.18.0.2","54.38.73.16","TCP","68","36876 → 21002 [ACK] Seq=12403 Ack=205438 Win=5601 Len=0 TSval=1100300916 TSecr=2679224415"
"9.411286","172.18.0.2","54.38.73.16","TLSv1.2","611","Application Data"
"9.435996","54.38.73.16","172.18.0.2","TCP","68","21002 → 36876 [ACK] Seq=205438 Ack=12946 Win=1452 Len=0 TSval=2679224421 TSecr=1100300917"
"9.470461","54.38.73.16","172.18.0.2","TLSv1.2","4145","Application Data"
"9.470483","172.18.0.2","54.38.73.16","TCP","68","36876 → 21002 [ACK] Seq=12946 Ack=209515 Win=5589 Len=0 TSval=1100300976 TSecr=2679224430"
"9.470502","54.38.73.16","172.18.0.2","TCP","1516","[TCP segment of a reassembled PDU]"
"9.470516","172.18.0.2","54.38.73.16","TCP","68","36876 → 21002 [ACK] Seq=12946 Ack=210963 Win=5582 Len=0 TSval=1100300976 TSecr=2679224430"
"9.492305","54.38.73.16","172.18.0.2","TLSv1.2","1516","Application Data [TCP segment of a reassembled PDU]"
"9.492327","172.18.0.2","54.38.73.16","TCP","68","36876 → 21002 [ACK] Seq=12946 Ack=212411 Win=5593 Len=0 TSval=1100300998 TSecr=2679224435"
"9.492719","172.18.0.2","54.38.73.16","TLSv1.2","611","Application Data"
"9.494051","54.38.73.16","172.18.0.2","TLSv1.2","892","Application Data"
"9.537010","172.18.0.2","54.38.73.16","TCP","68","36876 → 21002 [ACK] Seq=13489 Ack=213235 Win=5612 Len=0 TSval=1100301043 TSecr=2679224436"
"9.579285","54.38.73.16","172.18.0.2","TCP","68","21002 → 36876 [ACK] Seq=213235 Ack=13489 Win=1452 Len=0 TSval=2679224457 TSecr=1100300998"
"9.784629","54.38.73.16","172.18.0.2","TCP","1516","[TCP segment of a reassembled PDU]"
"9.784677","172.18.0.2","54.38.73.16","TCP","68","36876 → 21002 [ACK] Seq=13489 Ack=214683 Win=5601 Len=0 TSval=1100301290 TSecr=2679224493"
"9.784941","54.38.73.16","172.18.0.2","TLSv1.2","2697","Application Data"
"9.784960","172.18.0.2","54.38.73.16","TCP","68","36876 → 21002 [ACK] Seq=13489 Ack=217312 Win=5597 Len=0 TSval=1100301291 TSecr=2679224493"
"9.784969","54.38.73.16","172.18.0.2","TCP","2964","[TCP segment of a reassembled PDU]"
"9.784983","172.18.0.2","54.38.73.16","TCP","68","36876 → 21002 [ACK] Seq=13489 Ack=220208 Win=5582 Len=0 TSval=1100301291 TSecr=2679224493"
"9.784987","54.38.73.16","172.18.0.2","TLSv1.2","1516","Application Data [TCP segment of a reassembled PDU]"
"9.784999","172.18.0.2","54.38.73.16","TCP","68","36876 → 21002 [ACK] Seq=13489 Ack=221656 Win=5574 Len=0 TSval=1100301291 TSecr=2679224496"
"9.803726","54.38.73.16","172.18.0.2","TCP","1516","21002 → 36876 [ACK] Seq=221656 Ack=13489 Win=1452 Len=1448 TSval=2679224514 TSecr=1100300998 [TCP segment of a reassembled PDU]"
"9.803749","172.18.0.2","54.38.73.16","TCP","68","36876 → 21002 [ACK] Seq=13489 Ack=223104 Win=5593 Len=0 TSval=1100301309 TSecr=2679224514"
"9.811215","54.38.73.16","172.18.0.2","TLSv1.2","7308","Application Data, Application Data, Application Data"
"9.811238","172.18.0.2","54.38.73.16","TCP","68","36876 → 21002 [ACK] Seq=13489 Ack=230344 Win=5565 Len=0 TSval=1100301317 TSecr=2679224515"
"9.812059","172.18.0.2","54.38.73.16","TLSv1.2","611","Application Data"
"9.835074","54.38.73.16","172.18.0.2","TLSv1.2","4236","Application Data, Application Data"
"9.835097","172.18.0.2","54.38.73.16","TCP","68","36876 → 21002 [ACK] Seq=14032 Ack=234512 Win=5580 Len=0 TSval=1100301341 TSecr=2679224521"
"9.835764","54.38.73.16","172.18.0.2","TCP","68","21002 → 36876 [ACK] Seq=234512 Ack=14032 Win=1452 Len=0 TSval=2679224522 TSecr=1100301318"
"10.199718","54.38.73.16","172.18.0.2","TLSv1.2","4145","Application Data"
"10.199768","172.18.0.2","54.38.73.16","TCP","68","36876 → 21002 [ACK] Seq=14032 Ack=238589 Win=5579 Len=0 TSval=1100301705 TSecr=2679224562"
"10.199776","54.38.73.16","172.18.0.2","TCP","2964","[TCP segment of a reassembled PDU]"
"10.199799","172.18.0.2","54.38.73.16","TCP","68","36876 → 21002 [ACK] Seq=14032 Ack=241485 Win=5564 Len=0 TSval=1100301705 TSecr=2679224562"
"10.200233","54.38.73.16","172.18.0.2","TLSv1.2","1516","Application Data [TCP segment of a reassembled PDU]"
"10.200245","172.18.0.2","54.38.73.16","TCP","68","36876 → 21002 [ACK] Seq=14032 Ack=242933 Win=5603 Len=0 TSval=1100301706 TSecr=2679224562"
"10.200265","54.38.73.16","172.18.0.2","TCP","1516","21002 → 36876 [ACK] Seq=242933 Ack=14032 Win=1452 Len=1448 TSval=2679224586 TSecr=1100301341 [TCP segment of a reassembled PDU]"
"10.200276","172.18.0.2","54.38.73.16","TCP","68","36876 → 21002 [ACK] Seq=14032 Ack=244381 Win=5592 Len=0 TSval=1100301706 TSecr=2679224586"
"10.223008","54.38.73.16","172.18.0.2","TLSv1.2","566","Application Data"
"10.223035","172.18.0.2","54.38.73.16","TCP","68","36876 → 21002 [ACK] Seq=14032 Ack=244879 Win=5593 Len=0 TSval=1100301729 TSecr=2679224618"
"10.232499","172.18.0.2","54.38.73.16","TLSv1.2","611","Application Data"
"10.256396","54.38.73.16","172.18.0.2","TCP","68","21002 → 36876 [ACK] Seq=244879 Ack=14575 Win=1452 Len=0 TSval=2679224627 TSecr=1100301738"
"10.809098","54.38.73.16","172.18.0.2","TLSv1.2","611","Application Data"
"10.809134","172.18.0.2","54.38.73.16","TCP","68","36876 → 21002 [ACK] Seq=14575 Ack=245422 Win=5608 Len=0 TSval=1100302315 TSecr=2679224745"
"10.809927","172.18.0.2","54.38.73.16","TLSv1.2","611","Application Data"
"10.834160","54.38.73.16","172.18.0.2","TCP","68","21002 → 36876 [ACK] Seq=245422 Ack=15118 Win=1452 Len=0 TSval=2679224771 TSecr=1100302316"
"11.421706","54.38.73.16","172.18.0.2","TLSv1.2","611","Application Data"
"11.421735","54.38.73.16","172.18.0.2","TCP","2964","[TCP segment of a reassembled PDU]"
"11.421858","172.18.0.2","54.38.73.16","TCP","68","36876 → 21002 [ACK] Seq=15118 Ack=248861 Win=5586 Len=0 TSval=1100302927 TSecr=2679224898"
"11.446011","54.38.73.16","172.18.0.2","TLSv1.2","799","Application Data"
"11.477232","54.38.73.16","172.18.0.2","TLSv1.2","5860","Application Data"
"11.477249","172.18.0.2","54.38.73.16","TCP","68","36876 → 21002 [ACK] Seq=15118 Ack=255384 Win=5581 Len=0 TSval=1100302983 TSecr=2679224924"
"11.501066","54.38.73.16","172.18.0.2","TLSv1.2","2044","Application Data"
"11.501080","172.18.0.2","54.38.73.16","TCP","68","36876 → 21002 [ACK] Seq=15118 Ack=257360 Win=5599 Len=0 TSval=1100303007 TSecr=2679224938"
"11.601436","54.38.73.16","172.18.0.2","TLSv1.2","3695","Application Data"
"11.601598","172.18.0.2","54.38.73.16","TCP","68","36876 → 21002 [ACK] Seq=15118 Ack=260987 Win=5580 Len=0 TSval=1100303107 TSecr=2679224963"
"11.621510","54.38.73.16","172.18.0.2","TCP","2964","[TCP segment of a reassembled PDU]"
"11.621525","172.18.0.2","54.38.73.16","TCP","68","36876 → 21002 [ACK] Seq=15118 Ack=263883 Win=5596 Len=0 TSval=1100303127 TSecr=2679224968"
"11.624729","54.38.73.16","172.18.0.2","TLSv1.2","285","Application Data"
"11.625165","172.18.0.2","54.38.73.16","TLSv1.2","611","Application Data"
"11.648820","54.38.73.16","172.18.0.2","TCP","68","21002 → 36876 [ACK] Seq=264100 Ack=15661 Win=1452 Len=0 TSval=2679224975 TSecr=1100303131"
"11.713714","54.38.73.16","172.18.0.2","TCP","2964","[TCP segment of a reassembled PDU]"
"11.713798","54.38.73.16","172.18.0.2","TLSv1.2","1249","Application Data"
"11.713807","54.38.73.16","172.18.0.2","TCP","1516","[TCP segment of a reassembled PDU]"
"11.713846","172.18.0.2","54.38.73.16","TCP","68","36876 → 21002 [ACK] Seq=15661 Ack=269625 Win=5582 Len=0 TSval=1100303219 TSecr=2679224991"
"11.724773","54.38.73.16","172.18.0.2","TLSv1.2","1516","Application Data [TCP segment of a reassembled PDU]"
"11.738064","54.38.73.16","172.18.0.2","TLSv1.2","378","Application Data"
"11.738079","172.18.0.2","54.38.73.16","TCP","68","36876 → 21002 [ACK] Seq=15661 Ack=271383 Win=5593 Len=0 TSval=1100303244 TSecr=2679224994"
"11.738324","172.18.0.2","54.38.73.16","TLSv1.2","611","Application Data"
"11.761542","54.38.73.16","172.18.0.2","TCP","68","21002 → 36876 [ACK] Seq=271383 Ack=16204 Win=1452 Len=0 TSval=2679225003 TSecr=1100303244"
"11.828659","54.38.73.16","172.18.0.2","TLSv1.2","1639","Application Data"
"11.828781","172.18.0.2","54.38.73.16","TCP","68","36876 → 21002 [ACK] Seq=16204 Ack=272954 Win=5601 Len=0 TSval=1100303334 TSecr=2679225020"
"11.913661","54.38.73.16","172.18.0.2","TLSv1.2","4145","Application Data"
"11.913681","54.38.73.16","172.18.0.2","TCP","1516","[TCP segment of a reassembled PDU]"
"11.913781","172.18.0.2","54.38.73.16","TCP","68","36876 → 21002 [ACK] Seq=16204 Ack=278479 Win=5582 Len=0 TSval=1100303419 TSecr=2679225041"
"11.936969","54.38.73.16","172.18.0.2","TLSv1.2","255","Application Data"
"11.965681","54.38.73.16","172.18.0.2","TLSv1.2","5860","Application Data"
"11.965798","172.18.0.2","54.38.73.16","TCP","68","36876 → 21002 [ACK] Seq=16204 Ack=284458 Win=5581 Len=0 TSval=1100303471 TSecr=2679225047"
"11.989575","54.38.73.16","172.18.0.2","TLSv1.2","1530","Application Data"
"11.989602","172.18.0.2","54.38.73.16","TCP","68","36876 → 21002 [ACK] Seq=16204 Ack=285920 Win=5601 Len=0 TSval=1100303495 TSecr=2679225060"
"11.995473","172.18.0.2","54.38.73.16","TLSv1.2","611","Application Data"
"12.056712","54.38.73.16","172.18.0.2","TCP","68","21002 → 36876 [ACK] Seq=285920 Ack=16747 Win=1452 Len=0 TSval=2679225077 TSecr=1100303501"
"12.447281","54.38.73.16","172.18.0.2","TLSv1.2","611","Application Data"
"12.448102","172.18.0.2","54.38.73.16","TLSv1.2","611","Application Data"
"12.473525","54.38.73.16","172.18.0.2","TCP","68","21002 → 36876 [ACK] Seq=286463 Ack=17290 Win=1452 Len=0 TSval=2679225181 TSecr=1100303954"
"12.957409","54.38.73.16","172.18.0.2","TLSv1.2","611","Application Data"
"12.957797","54.38.73.16","172.18.0.2","TCP","2964","[TCP segment of a reassembled PDU]"
"12.957888","172.18.0.2","54.38.73.16","TCP","68","36876 → 21002 [ACK] Seq=17290 Ack=289902 Win=5596 Len=0 TSval=1100304463 TSecr=2679225294"
"12.981756","54.38.73.16","172.18.0.2","TLSv1.2","799","Application Data"
"13.024998","172.18.0.2","54.38.73.16","TCP","68","36876 → 21002 [ACK] Seq=17290 Ack=290633 Win=5612 Len=0 TSval=1100304531 TSecr=2679225308"
"13.070024","54.38.73.16","172.18.0.2","TLSv1.2","4145","Application Data"
"13.070045","172.18.0.2","54.38.73.16","TCP","68","36876 → 21002 [ACK] Seq=17290 Ack=294710 Win=5581 Len=0 TSval=1100304576 TSecr=2679225330"
"13.079567","54.38.73.16","172.18.0.2","TLSv1.2","2964","Application Data"
"13.079581","172.18.0.2","54.38.73.16","TCP","68","36876 → 21002 [ACK] Seq=17290 Ack=297606 Win=5596 Len=0 TSval=1100304585 TSecr=2679225332"
"13.094250","54.38.73.16","172.18.0.2","TLSv1.2","892","Application Data"
"13.094263","172.18.0.2","54.38.73.16","TCP","68","36876 → 21002 [ACK] Seq=17290 Ack=298430 Win=5593 Len=0 TSval=1100304600 TSecr=2679225336"
"13.112242","54.38.73.16","172.18.0.2","TCP","2964","[TCP segment of a reassembled PDU]"
"13.112266","172.18.0.2","54.38.73.16","TCP","68","36876 → 21002 [ACK] Seq=17290 Ack=301326 Win=5596 Len=0 TSval=1100304618 TSecr=2679225340"
"13.118561","54.38.73.16","172.18.0.2","TLSv1.2","1342","Application Data, Application Data"
"13.118586","172.18.0.2","54.38.73.16","TCP","68","36876 → 21002 [ACK] Seq=17290 Ack=302600 Win=5593 Len=0 TSval=1100304624 TSecr=2679225342"
"13.154739","54.38.73.16","172.18.0.2","TLSv1.2","3695","Application Data"
"13.154764","172.18.0.2","54.38.73.16","TCP","68","36876 → 21002 [ACK] Seq=17290 Ack=306227 Win=5580 Len=0 TSval=1100304660 TSecr=2679225351"
"13.178449","54.38.73.16","172.18.0.2","TLSv1.2","611","Application Data"
"13.178475","172.18.0.2","54.38.73.16","TCP","68","36876 → 21002 [ACK] Seq=17290 Ack=306770 Win=5593 Len=0 TSval=1100304684 TSecr=2679225357"
"13.185237","54.38.73.16","172.18.0.2","TLSv1.2","5860","Application Data"
"13.185264","172.18.0.2","54.38.73.16","TCP","68","36876 → 21002 [ACK] Seq=17290 Ack=312562 Win=5581 Len=0 TSval=1100304691 TSecr=2679225359"
"13.207648","54.38.73.16","172.18.0.2","TLSv1.2","2044","Application Data"
"13.207673","172.18.0.2","54.38.73.16","TCP","68","36876 → 21002 [ACK] Seq=17290 Ack=314538 Win=5599 Len=0 TSval=1100304713 TSecr=2679225364"
"13.208181","172.18.0.2","54.38.73.16","TLSv1.2","611","Application Data"
"13.232235","54.38.73.16","172.18.0.2","TCP","68","21002 → 36876 [ACK] Seq=314538 Ack=17833 Win=1452 Len=0 TSval=2679225371 TSecr=1100304714"
"13.576839","54.38.73.16","172.18.0.2","TLSv1.2","4145","Application Data"
"13.576865","172.18.0.2","54.38.73.16","TCP","68","36876 → 21002 [ACK] Seq=17833 Ack=318615 Win=5581 Len=0 TSval=1100305082 TSecr=2679225408"
"13.576868","54.38.73.16","172.18.0.2","TLSv1.2","4412","Application Data"
"13.576881","172.18.0.2","54.38.73.16","TCP","68","36876 → 21002 [ACK] Seq=17833 Ack=322959 Win=5556 Len=0 TSval=1100305082 TSecr=2679225408"
"13.576883","54.38.73.16","172.18.0.2","TCP","1516","21002 → 36876 [ACK] Seq=322959 Ack=17833 Win=1452 Len=1448 TSval=2679225426 TSecr=1100304714 [TCP segment of a reassembled PDU]"
"13.576890","172.18.0.2","54.38.73.16","TCP","68","36876 → 21002 [ACK] Seq=17833 Ack=324407 Win=5545 Len=0 TSval=1100305082 TSecr=2679225426"
"13.577461","172.18.0.2","54.38.73.16","TLSv1.2","611","Application Data"
"13.602762","54.38.73.16","172.18.0.2","TLSv1.2","2964","Application Data [TCP segment of a reassembled PDU]"
"13.602787","172.18.0.2","54.38.73.16","TCP","68","36876 → 21002 [ACK] Seq=18376 Ack=327303 Win=5596 Len=0 TSval=1100305108 TSecr=2679225463"
"13.603175","54.38.73.16","172.18.0.2","TCP","68","[TCP Previous segment not captured] 21002 → 36876 [ACK] Seq=332159 Ack=18376 Win=1452 Len=0 TSval=2679225463 TSecr=1100305083"
"13.603231","54.38.73.16","172.18.0.2","TCP","4924","[TCP Retransmission] 21002 → 36876 [PSH, ACK] Seq=327303 Ack=17833 Win=1452 Len=4856 TSval=2679225463 TSecr=1100305082"
"13.603248","172.18.0.2","54.38.73.16","TCP","68","36876 → 21002 [ACK] Seq=18376 Ack=332159 Win=5569 Len=0 TSval=1100305109 TSecr=2679225463"
"13.612211","172.18.0.2","54.38.73.16","TLSv1.2","611","Application Data"
"13.636370","54.38.73.16","172.18.0.2","TCP","68","21002 → 36876 [ACK] Seq=332159 Ack=18919 Win=1452 Len=0 TSval=2679225472 TSecr=1100305118"
"14.188881","54.38.73.16","172.18.0.2","TLSv1.2","611","Application Data"
"14.189858","172.18.0.2","54.38.73.16","TLSv1.2","611","Application Data"
"14.217695","54.38.73.16","172.18.0.2","TCP","68","21002 → 36876 [ACK] Seq=332702 Ack=19462 Win=1452 Len=0 TSval=2679225617 TSecr=1100305695"
"14.597754","54.38.73.16","172.18.0.2","TLSv1.2","611","Application Data"
"14.605567","54.38.73.16","172.18.0.2","TCP","2964","[TCP segment of a reassembled PDU]"
"14.605720","172.18.0.2","54.38.73.16","TCP","68","36876 → 21002 [ACK] Seq=19462 Ack=336141 Win=5596 Len=0 TSval=1100306111 TSecr=2679225708"
"14.628877","54.38.73.16","172.18.0.2","TLSv1.2","799","Application Data"
"14.669084","172.18.0.2","54.38.73.16","TCP","68","36876 → 21002 [ACK] Seq=19462 Ack=336872 Win=5612 Len=0 TSval=1100306175 TSecr=2679225720"
"14.708807","54.38.73.16","172.18.0.2","TLSv1.2","4145","Application Data"
"14.708860","172.18.0.2","54.38.73.16","TCP","68","36876 → 21002 [ACK] Seq=19462 Ack=340949 Win=5589 Len=0 TSval=1100306214 TSecr=2679225740"
"14.708869","54.38.73.16","172.18.0.2","TLSv1.2","7308","Application Data"
"14.708890","172.18.0.2","54.38.73.16","TCP","68","36876 → 21002 [ACK] Seq=19462 Ack=348189 Win=5552 Len=0 TSval=1100306214 TSecr=2679225740"
"14.735600","54.38.73.16","172.18.0.2","TLSv1.2","1717","Application Data, Application Data"
"14.735621","172.18.0.2","54.38.73.16","TCP","68","36876 → 21002 [ACK] Seq=19462 Ack=349838 Win=5601 Len=0 TSval=1100306241 TSecr=2679225746"
"14.904559","54.38.73.16","172.18.0.2","TCP","1516","[TCP segment of a reassembled PDU]"
"14.904582","172.18.0.2","54.38.73.16","TCP","68","36876 → 21002 [ACK] Seq=19462 Ack=351286 Win=5593 Len=0 TSval=1100306410 TSecr=2679225773"
"14.904817","54.38.73.16","172.18.0.2","TLSv1.2","2697","Application Data"
"14.904831","172.18.0.2","54.38.73.16","TCP","68","36876 → 21002 [ACK] Seq=19462 Ack=353915 Win=5597 Len=0 TSval=1100306410 TSecr=2679225773"
"14.904845","54.38.73.16","172.18.0.2","TLSv1.2","7308","Application Data"
"14.904856","172.18.0.2","54.38.73.16","TCP","68","36876 → 21002 [ACK] Seq=19462 Ack=361155 Win=5551 Len=0 TSval=1100306410 TSecr=2679225773"
"14.928605","54.38.73.16","172.18.0.2","TLSv1.2","660","Application Data"
"14.928629","172.18.0.2","54.38.73.16","TCP","68","36876 → 21002 [ACK] Seq=19462 Ack=361747 Win=5593 Len=0 TSval=1100306434 TSecr=2679225795"
"14.929126","172.18.0.2","54.38.73.16","TLSv1.2","611","Application Data"
"14.953124","54.38.73.16","172.18.0.2","TCP","68","21002 → 36876 [ACK] Seq=361747 Ack=20005 Win=1452 Len=0 TSval=2679225801 TSecr=1100306435"
"14.985801","54.38.73.16","172.18.0.2","TCP","2964","[TCP segment of a reassembled PDU]"
"14.985826","172.18.0.2","54.38.73.16","TCP","68","36876 → 21002 [ACK] Seq=20005 Ack=364643 Win=5596 Len=0 TSval=1100306491 TSecr=2679225809"
"14.986459","54.38.73.16","172.18.0.2","TLSv1.2","285","Application Data"
"14.986483","172.18.0.2","54.38.73.16","TCP","68","36876 → 21002 [ACK] Seq=20005 Ack=364860 Win=5595 Len=0 TSval=1100306492 TSecr=2679225809"
"14.992738","172.18.0.2","54.38.73.16","TLSv1.2","611","Application Data"
"15.056361","54.38.73.16","172.18.0.2","TCP","68","21002 → 36876 [ACK] Seq=364860 Ack=20548 Win=1452 Len=0 TSval=2679225827 TSecr=1100306498"
"15.724100","54.38.73.16","172.18.0.2","TLSv1.2","611","Application Data"
"15.724152","172.18.0.2","54.38.73.16","TCP","68","36876 → 21002 [ACK] Seq=20548 Ack=365403 Win=5608 Len=0 TSval=1100307230 TSecr=2679225931"
"15.725129","172.18.0.2","54.38.73.16","TLSv1.2","611","Application Data"
"15.744317","54.38.73.16","172.18.0.2","TLSv1.2","611","[TCP Spurious Retransmission] , Application Data"
"15.744346","172.18.0.2","54.38.73.16","TCP","80","[TCP Dup ACK 345#1] 36876 → 21002 [ACK] Seq=21091 Ack=365403 Win=5612 Len=0 TSval=1100307250 TSecr=2679225999 SLE=364860 SRE=365403"
"15.750543","54.38.73.16","172.18.0.2","TCP","68","21002 → 36876 [ACK] Seq=365403 Ack=21091 Win=1452 Len=0 TSval=2679226000 TSecr=1100307231"
"16.235782","54.38.73.16","172.18.0.2","TLSv1.2","611","Application Data"
"16.235830","172.18.0.2","54.38.73.16","TCP","68","36876 → 21002 [ACK] Seq=21091 Ack=365946 Win=5608 Len=0 TSval=1100307741 TSecr=2679226118"
"16.440955","54.38.73.16","172.18.0.2","TLSv1.2","799","[TCP Previous segment not captured] , Ignored Unknown Record"
"16.440984","172.18.0.2","54.38.73.16","TCP","80","[TCP Dup ACK 351#1] 36876 → 21002 [ACK] Seq=21091 Ack=365946 Win=5608 Len=0 TSval=1100307947 TSecr=2679226118 SLE=368842 SRE=369573"
"16.950786","54.38.73.16","172.18.0.2","TCP","1516","[TCP Retransmission] 21002 → 36876 [ACK] Seq=365946 Ack=21091 Win=1452 Len=1448 TSval=2679226255 TSecr=1100307947"
"16.950829","172.18.0.2","54.38.73.16","TCP","80","36876 → 21002 [ACK] Seq=21091 Ack=367394 Win=5597 Len=0 TSval=1100308456 TSecr=2679226255 SLE=368842 SRE=369573"
"16.974772","54.38.73.16","172.18.0.2","TLSv1.2","705","[TCP Previous segment not captured] , Ignored Unknown Record"
"16.974796","172.18.0.2","54.38.73.16","TCP","88","[TCP Dup ACK 355#1] 36876 → 21002 [ACK] Seq=21091 Ack=367394 Win=5597 Len=0 TSval=1100308480 TSecr=2679226255 SLE=371021 SRE=371658 SLE=368842 SRE=369573"
"17.001370","54.38.73.16","172.18.0.2","TCP","1516","[TCP Retransmission] 21002 → 36876 [ACK] Seq=367394 Ack=21091 Win=1452 Len=1448 TSval=2679226313 TSecr=1100308480"
"17.001415","172.18.0.2","54.38.73.16","TCP","80","36876 → 21002 [ACK] Seq=21091 Ack=369573 Win=5580 Len=0 TSval=1100308507 TSecr=2679226313 SLE=371021 SRE=371658"
"17.001420","54.38.73.16","172.18.0.2","TCP","1516","[TCP Retransmission] 21002 → 36876 [ACK] Seq=369573 Ack=21091 Win=1452 Len=1448 TSval=2679226313 TSecr=1100308480"
"17.001435","172.18.0.2","54.38.73.16","TCP","68","36876 → 21002 [ACK] Seq=21091 Ack=371658 Win=5564 Len=0 TSval=1100308507 TSecr=2679226313"
"17.002193","172.18.0.2","54.38.73.16","TLSv1.2","611","Application Data"
"17.028467","54.38.73.16","172.18.0.2","TCP","68","21002 → 36876 [ACK] Seq=371658 Ack=21634 Win=1452 Len=0 TSval=2679226319 TSecr=1100308508"
"17.028482","172.18.0.2","54.38.73.16","TLSv1.2","611","Application Data"
"17.051841","54.38.73.16","172.18.0.2","TCP","68","21002 → 36876 [ACK] Seq=371658 Ack=22177 Win=1452 Len=0 TSval=2679226326 TSecr=1100308534"
"17.567135","54.38.73.16","172.18.0.2","TLSv1.2","611","Application Data"
"17.567184","172.18.0.2","54.38.73.16","TCP","68","36876 → 21002 [ACK] Seq=22177 Ack=372201 Win=5608 Len=0 TSval=1100309073 TSecr=2679226447"
"17.568172","172.18.0.2","54.38.73.16","TLSv1.2","611","Application Data"
"17.591987","54.38.73.16","172.18.0.2","TCP","68","21002 → 36876 [ACK] Seq=372201 Ack=22720 Win=1452 Len=0 TSval=2679226461 TSecr=1100309074"
"18.182410","54.38.73.16","172.18.0.2","TLSv1.2","3695","Application Data"
"18.182443","172.18.0.2","54.38.73.16","TCP","68","36876 → 21002 [ACK] Seq=22720 Ack=375828 Win=5584 Len=0 TSval=1100309688 TSecr=2679226560"
"18.182448","54.38.73.16","172.18.0.2","TCP","2964","[TCP segment of a reassembled PDU]"
"18.182461","172.18.0.2","54.38.73.16","TCP","68","36876 → 21002 [ACK] Seq=22720 Ack=378724 Win=5566 Len=0 TSval=1100309688 TSecr=2679226563"
"18.182462","54.38.73.16","172.18.0.2","TLSv1.2","1516","Application Data [TCP segment of a reassembled PDU]"
"18.182468","172.18.0.2","54.38.73.16","TCP","68","36876 → 21002 [ACK] Seq=22720 Ack=380172 Win=5555 Len=0 TSval=1100309688 TSecr=2679226599"
"18.206221","54.38.73.16","172.18.0.2","TLSv1.2","7177","Application Data, Application Data, Application Data, Application Data"
"18.206244","172.18.0.2","54.38.73.16","TCP","68","36876 → 21002 [ACK] Seq=22720 Ack=387281 Win=5565 Len=0 TSval=1100309712 TSecr=2679226614"
"18.230205","54.38.73.16","172.18.0.2","TCP","1516","[TCP segment of a reassembled PDU]"
"18.230230","172.18.0.2","54.38.73.16","TCP","68","36876 → 21002 [ACK] Seq=22720 Ack=388729 Win=5593 Len=0 TSval=1100309736 TSecr=2679226620"
"18.231136","54.38.73.16","172.18.0.2","TLSv1.2","5360","Application Data, Application Data"
"18.231159","172.18.0.2","54.38.73.16","TCP","68","36876 → 21002 [ACK] Seq=22720 Ack=394021 Win=5583 Len=0 TSval=1100309737 TSecr=2679226620"
"18.255984","54.38.73.16","172.18.0.2","TLSv1.2","611","Application Data"
"18.256006","172.18.0.2","54.38.73.16","TCP","68","36876 → 21002 [ACK] Seq=22720 Ack=394564 Win=5593 Len=0 TSval=1100309762 TSecr=2679226626"
"18.387257","54.38.73.16","172.18.0.2","TLSv1.2","3695","Application Data"
"18.387279","172.18.0.2","54.38.73.16","TCP","68","36876 → 21002 [ACK] Seq=22720 Ack=398191 Win=5581 Len=0 TSval=1100309893 TSecr=2679226654"
"18.387298","54.38.73.16","172.18.0.2","TCP","2964","[TCP segment of a reassembled PDU]"
"18.387316","172.18.0.2","54.38.73.16","TCP","68","36876 → 21002 [ACK] Seq=22720 Ack=401087 Win=5566 Len=0 TSval=1100309893 TSecr=2679226656"
"18.387770","172.18.0.2","54.38.73.16","TLSv1.2","611","Application Data"
"18.411522","54.38.73.16","172.18.0.2","TCP","68","[TCP Previous segment not captured] 21002 → 36876 [ACK] Seq=408044 Ack=23263 Win=1452 Len=0 TSval=2679226665 TSecr=1100309893"
"18.411544","54.38.73.16","172.18.0.2","TCP","7025","[TCP Retransmission] 21002 → 36876 [PSH, ACK] Seq=401087 Ack=22720 Win=1452 Len=6957 TSval=2679226665 TSecr=1100309893"
"18.411558","172.18.0.2","54.38.73.16","TCP","68","36876 → 21002 [ACK] Seq=23263 Ack=408044 Win=5574 Len=0 TSval=1100309917 TSecr=2679226665"
"18.435624","54.38.73.16","172.18.0.2","TLSv1.2","1125","Application Data"
"18.476994","172.18.0.2","54.38.73.16","TCP","68","36876 → 21002 [ACK] Seq=23263 Ack=409101 Win=5612 Len=0 TSval=1100309983 TSecr=2679226671"
"18.487315","54.38.73.16","172.18.0.2","TCP","2964","[TCP segment of a reassembled PDU]"
"18.487337","172.18.0.2","54.38.73.16","TCP","68","36876 → 21002 [ACK] Seq=23263 Ack=411997 Win=5596 Len=0 TSval=1100309993 TSecr=2679226684"
"18.496836","54.38.73.16","172.18.0.2","TLSv1.2","2964","Application Data [TCP segment of a reassembled PDU]"
"18.496859","172.18.0.2","54.38.73.16","TCP","68","36876 → 21002 [ACK] Seq=23263 Ack=414893 Win=5596 Len=0 TSval=1100310002 TSecr=2679226687"
"18.511377","54.38.73.16","172.18.0.2","TLSv1.2","1530","Application Data"
"18.511400","172.18.0.2","54.38.73.16","TCP","68","36876 → 21002 [ACK] Seq=23263 Ack=416355 Win=5601 Len=0 TSval=1100310017 TSecr=2679226690"
"18.528368","54.38.73.16","172.18.0.2","TCP","1516","[TCP segment of a reassembled PDU]"
"18.528418","172.18.0.2","54.38.73.16","TCP","68","36876 → 21002 [ACK] Seq=23263 Ack=417803 Win=5593 Len=0 TSval=1100310034 TSecr=2679226695"
"18.534689","54.38.73.16","172.18.0.2","TLSv1.2","191","Application Data"
"18.534816","172.18.0.2","54.38.73.16","TCP","68","36876 → 21002 [ACK] Seq=23263 Ack=417926 Win=5612 Len=0 TSval=1100310040 TSecr=2679226696"
"18.623830","54.38.73.16","172.18.0.2","TCP","2964","[TCP segment of a reassembled PDU]"
"18.623967","172.18.0.2","54.38.73.16","TCP","68","36876 → 21002 [ACK] Seq=23263 Ack=420822 Win=5596 Len=0 TSval=1100310130 TSecr=2679226718"
"18.624096","54.38.73.16","172.18.0.2","TLSv1.2","1249","Application Data"
"18.624118","54.38.73.16","172.18.0.2","TCP","2964","[TCP segment of a reassembled PDU]"
"18.624163","172.18.0.2","54.38.73.16","TCP","68","36876 → 21002 [ACK] Seq=23263 Ack=424899 Win=5581 Len=0 TSval=1100310130 TSecr=2679226718"
"18.648853","54.38.73.16","172.18.0.2","TLSv1.2","1920","Application Data, Application Data"
"18.648875","172.18.0.2","54.38.73.16","TCP","68","36876 → 21002 [ACK] Seq=23263 Ack=426751 Win=5600 Len=0 TSval=1100310154 TSecr=2679226725"
"18.649351","172.18.0.2","54.38.73.16","TLSv1.2","1125","Application Data"
"18.723979","54.38.73.16","172.18.0.2","TCP","68","21002 → 36876 [ACK] Seq=426751 Ack=24320 Win=1452 Len=0 TSval=2679226744 TSecr=1100310155"
"18.739988","54.38.73.16","172.18.0.2","TLSv1.2","3695","Application Data"
"18.740121","172.18.0.2","54.38.73.16","TCP","68","36876 → 21002 [ACK] Seq=24320 Ack=430378 Win=5580 Len=0 TSval=1100310246 TSecr=2679226747"
"18.793997","54.38.73.16","172.18.0.2","TLSv1.2","4145","Application Data"
"18.794042","172.18.0.2","54.38.73.16","TCP","68","36876 → 21002 [ACK] Seq=24320 Ack=434455 Win=5580 Len=0 TSval=1100310300 TSecr=2679226760"
"18.819980","54.38.73.16","172.18.0.2","TLSv1.2","704","Application Data, Application Data"
"18.820231","172.18.0.2","54.38.73.16","TCP","68","36876 → 21002 [ACK] Seq=24320 Ack=435091 Win=5612 Len=0 TSval=1100310326 TSecr=2679226767"
"18.826300","172.18.0.2","54.38.73.16","TLSv1.2","611","Application Data"
"18.850777","54.38.73.16","172.18.0.2","TCP","68","21002 → 36876 [ACK] Seq=435091 Ack=24863 Win=1452 Len=0 TSval=2679226775 TSecr=1100310332"
"19.410385","54.38.73.16","172.18.0.2","TLSv1.2","611","Application Data"
"19.410433","172.18.0.2","54.38.73.16","TCP","68","36876 → 21002 [ACK] Seq=24863 Ack=435634 Win=5608 Len=0 TSval=1100310916 TSecr=2679226889"
"19.411332","172.18.0.2","54.38.73.16","TLSv1.2","611","Application Data"
"19.435511","54.38.73.16","172.18.0.2","TCP","68","21002 → 36876 [ACK] Seq=435634 Ack=25406 Win=1452 Len=0 TSval=2679226921 TSecr=1100310917"
"20.025585","54.38.73.16","172.18.0.2","TLSv1.2","611","Application Data"
"20.025618","54.38.73.16","172.18.0.2","TCP","2964","[TCP segment of a reassembled PDU]"
"20.025640","54.38.73.16","172.18.0.2","TLSv1.2","2964","Application Data [TCP segment of a reassembled PDU]"
"20.025651","54.38.73.16","172.18.0.2","TCP","1516","21002 → 36876 [ACK] Seq=441969 Ack=25406 Win=1452 Len=1448 TSval=2679227053 TSecr=1100310917 [TCP segment of a reassembled PDU]"
"20.025798","172.18.0.2","54.38.73.16","TCP","68","36876 → 21002 [ACK] Seq=25406 Ack=443417 Win=5552 Len=0 TSval=1100311531 TSecr=2679227018"
"20.049767","54.38.73.16","172.18.0.2","TLSv1.2","6880","Application Data, Application Data, Application Data, Application Data, Application Data"
"20.049790","172.18.0.2","54.38.73.16","TCP","68","36876 → 21002 [ACK] Seq=25406 Ack=450229 Win=5565 Len=0 TSval=1100311555 TSecr=2679227075"
"20.072797","54.38.73.16","172.18.0.2","TLSv1.2","1639","Application Data"
"20.072822","172.18.0.2","54.38.73.16","TCP","68","36876 → 21002 [ACK] Seq=25406 Ack=451800 Win=5601 Len=0 TSval=1100311578 TSecr=2679227081"
"20.229442","54.38.73.16","172.18.0.2","TCP","1516","[TCP segment of a reassembled PDU]"
"20.229641","54.38.73.16","172.18.0.2","TLSv1.2","2697","Application Data"
"20.229663","54.38.73.16","172.18.0.2","TCP","2964","[TCP segment of a reassembled PDU]"
"20.229672","54.38.73.16","172.18.0.2","TLSv1.2","1516","Application Data [TCP segment of a reassembled PDU]"
"20.229724","172.18.0.2","54.38.73.16","TCP","68","36876 → 21002 [ACK] Seq=25406 Ack=460221 Win=5566 Len=0 TSval=1100311735 TSecr=2679227115"
"20.253556","54.38.73.16","172.18.0.2","TCP","2964","21002 → 36876 [ACK] Seq=460221 Ack=25406 Win=1452 Len=2896 TSval=2679227126 TSecr=1100311735 [TCP segment of a reassembled PDU]"
"20.253579","172.18.0.2","54.38.73.16","TCP","68","36876 → 21002 [ACK] Seq=25406 Ack=463117 Win=5596 Len=0 TSval=1100311759 TSecr=2679227126"
"20.253867","54.38.73.16","172.18.0.2","TLSv1.2","4316","Application Data, Application Data, Application Data"
"20.253963","172.18.0.2","54.38.73.16","TCP","68","36876 → 21002 [ACK] Seq=25406 Ack=467365 Win=5580 Len=0 TSval=1100311760 TSecr=2679227126"
"20.254400","172.18.0.2","54.38.73.16","TLSv1.2","611","Application Data"
"20.278222","54.38.73.16","172.18.0.2","TCP","68","21002 → 36876 [ACK] Seq=467365 Ack=25949 Win=1452 Len=0 TSval=2679227132 TSecr=1100311760"
"20.278259","172.18.0.2","54.38.73.16","TLSv1.2","611","Application Data"
"20.302865","54.38.73.16","172.18.0.2","TCP","68","21002 → 36876 [ACK] Seq=467365 Ack=26492 Win=1452 Len=0 TSval=2679227138 TSecr=1100311784"
"20.946765","54.38.73.16","172.18.0.2","TLSv1.2","611","Application Data"
"20.947708","172.18.0.2","54.38.73.16","TLSv1.2","611","Application Data"
"20.972473","54.38.73.16","172.18.0.2","TCP","68","21002 → 36876 [ACK] Seq=467908 Ack=27035 Win=1452 Len=0 TSval=2679227305 TSecr=1100312453"
