_ws.col.Time,_ws.col.Source,_ws.col.Destination,_ws.col.Protocol,_ws.col.Length,_ws.col.Info
"0.000000","172.19.0.3","5.9.29.183","TLSv1.2","599","Application Data"
"0.000262","5.9.29.183","172.19.0.3","TCP","56","9002 → 43520 [ACK] Seq=1 Ack=544 Win=65535 Len=0"
"0.225090","5.9.29.183","172.19.0.3","TLSv1.2","599","Application Data"
"0.225192","172.19.0.3","5.9.29.183","TCP","56","43520 → 9002 [ACK] Seq=544 Ack=544 Win=8466 Len=0"
"0.226325","172.19.0.3","5.9.29.183","TLSv1.2","2141","Application Data"
"0.226634","5.9.29.183","172.19.0.3","TCP","56","9002 → 43520 [ACK] Seq=544 Ack=2004 Win=65535 Len=0"
"0.226773","5.9.29.183","172.19.0.3","TCP","56","9002 → 43520 [ACK] Seq=544 Ack=2629 Win=65535 Len=0"
"0.711249","5.9.29.183","172.19.0.3","TLSv1.2","599","Application Data"
"0.727674","5.9.29.183","172.19.0.3","TLSv1.2","1113","Application Data"
"0.727698","172.19.0.3","5.9.29.183","TCP","56","43520 → 9002 [ACK] Seq=2629 Ack=2144 Win=8466 Len=0"
"0.731833","172.19.0.3","5.9.29.183","TLSv1.2","599","Application Data"
"0.732154","5.9.29.183","172.19.0.3","TCP","56","9002 → 43520 [ACK] Seq=2144 Ack=3172 Win=65535 Len=0"
"0.975770","5.9.29.183","172.19.0.3","TLSv1.2","599","Application Data"
"0.976514","172.19.0.3","5.9.29.183","TLSv1.2","599","Application Data"
"0.976867","5.9.29.183","172.19.0.3","TCP","56","9002 → 43520 [ACK] Seq=2687 Ack=3715 Win=65535 Len=0"
"1.253920","5.9.29.183","172.19.0.3","TLSv1.2","599","Application Data"
"1.297407","172.19.0.3","5.9.29.183","TCP","56","43520 → 9002 [ACK] Seq=3715 Ack=3230 Win=8466 Len=0"
"1.326339","5.9.29.183","172.19.0.3","TCP","1516","[TCP segment of a reassembled PDU]"
"1.326364","172.19.0.3","5.9.29.183","TCP","56","43520 → 9002 [ACK] Seq=3715 Ack=4690 Win=8466 Len=0"
"1.326424","5.9.29.183","172.19.0.3","TCP","1516","9002 → 43520 [PSH, ACK] Seq=4690 Ack=3715 Win=65535 Len=1460 [TCP segment of a reassembled PDU]"
"1.326442","172.19.0.3","5.9.29.183","TCP","56","43520 → 9002 [ACK] Seq=3715 Ack=6150 Win=8458 Len=0"
"1.326444","5.9.29.183","172.19.0.3","TLSv1.2","763","Application Data"
"1.326450","172.19.0.3","5.9.29.183","TCP","56","43520 → 9002 [ACK] Seq=3715 Ack=6857 Win=8453 Len=0"
"1.357017","5.9.29.183","172.19.0.3","TCP","1516","[TCP segment of a reassembled PDU]"
"1.357035","172.19.0.3","5.9.29.183","TCP","56","43520 → 9002 [ACK] Seq=3715 Ack=8317 Win=8466 Len=0"
"1.357117","5.9.29.183","172.19.0.3","TCP","851","9002 → 43520 [PSH, ACK] Seq=8317 Ack=3715 Win=65535 Len=795 [TCP segment of a reassembled PDU]"
"1.357133","172.19.0.3","5.9.29.183","TCP","56","43520 → 9002 [ACK] Seq=3715 Ack=9112 Win=8460 Len=0"
"1.357297","5.9.29.183","172.19.0.3","TCP","1516","9002 → 43520 [PSH, ACK] Seq=9112 Ack=3715 Win=65535 Len=1460 [TCP segment of a reassembled PDU]"
"1.357307","172.19.0.3","5.9.29.183","TCP","56","43520 → 9002 [ACK] Seq=3715 Ack=10572 Win=8466 Len=0"
"1.357375","5.9.29.183","172.19.0.3","TLSv1.2","1516","Application Data [TCP segment of a reassembled PDU]"
"1.357397","172.19.0.3","5.9.29.183","TCP","56","43520 → 9002 [ACK] Seq=3715 Ack=12032 Win=8458 Len=0"
"1.357401","5.9.29.183","172.19.0.3","TCP","1516","9002 → 43520 [PSH, ACK] Seq=12032 Ack=3715 Win=65535 Len=1460 [TCP segment of a reassembled PDU]"
"1.357414","172.19.0.3","5.9.29.183","TCP","56","43520 → 9002 [ACK] Seq=3715 Ack=13492 Win=8450 Len=0"
"1.357417","5.9.29.183","172.19.0.3","TCP","1516","9002 → 43520 [PSH, ACK] Seq=13492 Ack=3715 Win=65535 Len=1460 [TCP segment of a reassembled PDU]"
"1.357428","172.19.0.3","5.9.29.183","TCP","56","43520 → 9002 [ACK] Seq=3715 Ack=14952 Win=8442 Len=0"
"1.357430","5.9.29.183","172.19.0.3","TLSv1.2","1516","Application Data [TCP segment of a reassembled PDU]"
"1.357438","172.19.0.3","5.9.29.183","TCP","56","43520 → 9002 [ACK] Seq=3715 Ack=16412 Win=8434 Len=0"
"1.357441","5.9.29.183","172.19.0.3","TCP","1516","9002 → 43520 [PSH, ACK] Seq=16412 Ack=3715 Win=65535 Len=1460 [TCP segment of a reassembled PDU]"
"1.357448","172.19.0.3","5.9.29.183","TCP","56","43520 → 9002 [ACK] Seq=3715 Ack=17872 Win=8426 Len=0"
"1.357761","5.9.29.183","172.19.0.3","TCP","358","9002 → 43520 [PSH, ACK] Seq=17872 Ack=3715 Win=65535 Len=302 [TCP segment of a reassembled PDU]"
"1.357770","172.19.0.3","5.9.29.183","TCP","56","43520 → 9002 [ACK] Seq=3715 Ack=18174 Win=8424 Len=0"
"1.372947","5.9.29.183","172.19.0.3","TLSv1.2","648","Application Data"
"1.372967","172.19.0.3","5.9.29.183","TCP","56","43520 → 9002 [ACK] Seq=3715 Ack=18766 Win=8466 Len=0"
"1.388385","5.9.29.183","172.19.0.3","TLSv1.2","599","Application Data"
"1.388408","172.19.0.3","5.9.29.183","TCP","56","43520 → 9002 [ACK] Seq=3715 Ack=19309 Win=8466 Len=0"
"1.396761","5.9.29.183","172.19.0.3","TCP","1504","[TCP segment of a reassembled PDU]"
"1.396784","172.19.0.3","5.9.29.183","TCP","56","43520 → 9002 [ACK] Seq=3715 Ack=20757 Win=8464 Len=0"
"1.396836","5.9.29.183","172.19.0.3","TCP","1504","9002 → 43520 [PSH, ACK] Seq=20757 Ack=3715 Win=65535 Len=1448 [TCP segment of a reassembled PDU]"
"1.403382","5.9.29.183","172.19.0.3","TLSv1.2","787","Application Data"
"1.403404","172.19.0.3","5.9.29.183","TCP","56","43520 → 9002 [ACK] Seq=3715 Ack=22936 Win=8466 Len=0"
"1.418650","5.9.29.183","172.19.0.3","TLSv1.2","1113","Application Data"
"1.418869","172.19.0.3","5.9.29.183","TCP","56","43520 → 9002 [ACK] Seq=3715 Ack=23993 Win=8466 Len=0"
"1.449218","5.9.29.183","172.19.0.3","TCP","1516","[TCP segment of a reassembled PDU]"
"1.449258","5.9.29.183","172.19.0.3","TCP","1492","9002 → 43520 [PSH, ACK] Seq=25453 Ack=3715 Win=65535 Len=1436 [TCP segment of a reassembled PDU]"
"1.449264","5.9.29.183","172.19.0.3","TLSv1.2","787","Application Data"
"1.449337","172.19.0.3","5.9.29.183","TCP","56","43520 → 9002 [ACK] Seq=3715 Ack=27620 Win=8450 Len=0"
"1.452363","172.19.0.3","5.9.29.183","TLSv1.2","599","Application Data"
"1.452573","5.9.29.183","172.19.0.3","TCP","56","9002 → 43520 [ACK] Seq=27620 Ack=4258 Win=65535 Len=0"
"1.738167","5.9.29.183","172.19.0.3","TLSv1.2","599","Application Data"
"1.738894","172.19.0.3","5.9.29.183","TLSv1.2","599","Application Data"
"1.739092","5.9.29.183","172.19.0.3","TCP","56","9002 → 43520 [ACK] Seq=28163 Ack=4801 Win=65535 Len=0"
"2.016445","5.9.29.183","172.19.0.3","TCP","1504","[TCP segment of a reassembled PDU]"
"2.016993","5.9.29.183","172.19.0.3","TCP","1504","9002 → 43520 [PSH, ACK] Seq=29611 Ack=4801 Win=65535 Len=1448 [TCP segment of a reassembled PDU]"
"2.017008","172.19.0.3","5.9.29.183","TCP","56","43520 → 9002 [ACK] Seq=4801 Ack=31059 Win=8466 Len=0"
"2.017051","5.9.29.183","172.19.0.3","TLSv1.2","787","Application Data"
"2.035340","5.9.29.183","172.19.0.3","TCP","1504","[TCP segment of a reassembled PDU]"
"2.035359","172.19.0.3","5.9.29.183","TCP","56","43520 → 9002 [ACK] Seq=4801 Ack=33238 Win=8466 Len=0"
"2.035399","5.9.29.183","172.19.0.3","TCP","1516","9002 → 43520 [PSH, ACK] Seq=33238 Ack=4801 Win=65535 Len=1460 [TCP segment of a reassembled PDU]"
"2.035408","5.9.29.183","172.19.0.3","TLSv1.2","1225","Application Data"
"2.035587","172.19.0.3","5.9.29.183","TCP","56","43520 → 9002 [ACK] Seq=4801 Ack=35867 Win=8448 Len=0"
"2.035819","172.19.0.3","5.9.29.183","TLSv1.2","599","Application Data"
"2.036001","5.9.29.183","172.19.0.3","TCP","56","9002 → 43520 [ACK] Seq=35867 Ack=5344 Win=65535 Len=0"
"2.051387","5.9.29.183","172.19.0.3","TLSv1.2","1516","Application Data"
"2.051458","5.9.29.183","172.19.0.3","TCP","1492","9002 → 43520 [PSH, ACK] Seq=37327 Ack=5344 Win=65535 Len=1436 [TCP segment of a reassembled PDU]"
"2.051626","172.19.0.3","5.9.29.183","TCP","56","43520 → 9002 [ACK] Seq=5344 Ack=38763 Win=8458 Len=0"
"2.052148","5.9.29.183","172.19.0.3","TLSv1.2","880","Application Data"
"2.054986","172.19.0.3","5.9.29.183","TLSv1.2","599","Application Data"
"2.055196","5.9.29.183","172.19.0.3","TCP","56","9002 → 43520 [ACK] Seq=39587 Ack=5887 Win=65535 Len=0"
"2.290174","5.9.29.183","172.19.0.3","TLSv1.2","599","Application Data"
"2.291062","172.19.0.3","5.9.29.183","TLSv1.2","599","Application Data"
"2.291433","5.9.29.183","172.19.0.3","TCP","56","9002 → 43520 [ACK] Seq=40130 Ack=6430 Win=65535 Len=0"
"2.570000","5.9.29.183","172.19.0.3","TCP","1516","[TCP segment of a reassembled PDU]"
"2.570048","5.9.29.183","172.19.0.3","TCP","1516","9002 → 43520 [PSH, ACK] Seq=41590 Ack=6430 Win=65535 Len=1460 [TCP segment of a reassembled PDU]"
"2.570055","5.9.29.183","172.19.0.3","TLSv1.2","1213","Application Data"
"2.570058","5.9.29.183","172.19.0.3","TCP","1516","[TCP segment of a reassembled PDU]"
"2.570061","5.9.29.183","172.19.0.3","TCP","1492","9002 → 43520 [PSH, ACK] Seq=45667 Ack=6430 Win=65535 Len=1436 [TCP segment of a reassembled PDU]"
"2.570165","172.19.0.3","5.9.29.183","TCP","56","43520 → 9002 [ACK] Seq=6430 Ack=47103 Win=8434 Len=0"
"2.585772","5.9.29.183","172.19.0.3","TLSv1.2","337","Application Data"
"2.594025","5.9.29.183","172.19.0.3","TCP","1516","[TCP segment of a reassembled PDU]"
"2.594048","172.19.0.3","5.9.29.183","TCP","56","43520 → 9002 [ACK] Seq=6430 Ack=48844 Win=8466 Len=0"
"2.594098","5.9.29.183","172.19.0.3","TCP","1492","9002 → 43520 [PSH, ACK] Seq=48844 Ack=6430 Win=65535 Len=1436 [TCP segment of a reassembled PDU]"
"2.602878","5.9.29.183","172.19.0.3","TLSv1.2","1330","Application Data, Application Data"
"2.602893","172.19.0.3","5.9.29.183","TCP","56","43520 → 9002 [ACK] Seq=6430 Ack=51554 Win=8466 Len=0"
"2.603678","5.9.29.183","172.19.0.3","TCP","1504","[TCP segment of a reassembled PDU]"
"2.603819","5.9.29.183","172.19.0.3","TCP","1504","9002 → 43520 [PSH, ACK] Seq=53002 Ack=6430 Win=65535 Len=1448 [TCP segment of a reassembled PDU]"
"2.603827","172.19.0.3","5.9.29.183","TCP","56","43520 → 9002 [ACK] Seq=6430 Ack=54450 Win=8466 Len=0"
"2.603855","5.9.29.183","172.19.0.3","TLSv1.2","1504","Application Data [TCP segment of a reassembled PDU]"
"2.604097","5.9.29.183","172.19.0.3","TCP","1504","9002 → 43520 [PSH, ACK] Seq=55898 Ack=6430 Win=65535 Len=1448 [TCP segment of a reassembled PDU]"
"2.604124","172.19.0.3","5.9.29.183","TCP","56","43520 → 9002 [ACK] Seq=6430 Ack=57346 Win=8466 Len=0"
"2.604197","5.9.29.183","172.19.0.3","TCP","1516","9002 → 43520 [PSH, ACK] Seq=57346 Ack=6430 Win=65535 Len=1460 [TCP segment of a reassembled PDU]"
"2.604201","5.9.29.183","172.19.0.3","TLSv1.2","1516","Application Data [TCP segment of a reassembled PDU]"
"2.604204","5.9.29.183","172.19.0.3","TCP","1480","9002 → 43520 [PSH, ACK] Seq=60266 Ack=6430 Win=65535 Len=1424 [TCP segment of a reassembled PDU]"
"2.604216","172.19.0.3","5.9.29.183","TCP","56","43520 → 9002 [ACK] Seq=6430 Ack=61690 Win=8448 Len=0"
"2.609766","5.9.29.183","172.19.0.3","TCP","1504","9002 → 43520 [PSH, ACK] Seq=61690 Ack=6430 Win=65535 Len=1448 [TCP segment of a reassembled PDU]"
"2.618757","5.9.29.183","172.19.0.3","TLSv1.2","924","Application Data, Application Data"
"2.618776","172.19.0.3","5.9.29.183","TCP","56","43520 → 9002 [ACK] Seq=6430 Ack=64006 Win=8466 Len=0"
"2.620381","5.9.29.183","172.19.0.3","TCP","1504","[TCP segment of a reassembled PDU]"
"2.620592","5.9.29.183","172.19.0.3","TCP","1516","9002 → 43520 [PSH, ACK] Seq=65454 Ack=6430 Win=65535 Len=1460 [TCP segment of a reassembled PDU]"
"2.620599","172.19.0.3","5.9.29.183","TCP","56","43520 → 9002 [ACK] Seq=6430 Ack=66914 Win=8466 Len=0"
"2.620627","5.9.29.183","172.19.0.3","TLSv1.2","1492","Application Data [TCP segment of a reassembled PDU]"
"2.620633","5.9.29.183","172.19.0.3","TCP","1504","9002 → 43520 [PSH, ACK] Seq=68350 Ack=6430 Win=65535 Len=1448 [TCP segment of a reassembled PDU]"
"2.620718","172.19.0.3","5.9.29.183","TCP","56","43520 → 9002 [ACK] Seq=6430 Ack=69798 Win=8450 Len=0"
"2.620894","172.19.0.3","5.9.29.183","TLSv1.2","599","Application Data"
"2.621055","5.9.29.183","172.19.0.3","TCP","56","9002 → 43520 [ACK] Seq=69798 Ack=6973 Win=65535 Len=0"
"2.626349","5.9.29.183","172.19.0.3","TCP","1504","9002 → 43520 [PSH, ACK] Seq=69798 Ack=6973 Win=65535 Len=1448 [TCP segment of a reassembled PDU]"
"2.634827","5.9.29.183","172.19.0.3","TLSv1.2","1127","Application Data, Application Data"
"2.634845","172.19.0.3","5.9.29.183","TCP","56","43520 → 9002 [ACK] Seq=6973 Ack=72317 Win=8466 Len=0"
"2.637599","5.9.29.183","172.19.0.3","TCP","1516","[TCP segment of a reassembled PDU]"
"2.637656","5.9.29.183","172.19.0.3","TCP","927","9002 → 43520 [PSH, ACK] Seq=73777 Ack=6973 Win=65535 Len=871 [TCP segment of a reassembled PDU]"
"2.637662","5.9.29.183","172.19.0.3","TCP","1516","9002 → 43520 [PSH, ACK] Seq=74648 Ack=6973 Win=65535 Len=1460 [TCP segment of a reassembled PDU]"
"2.637665","5.9.29.183","172.19.0.3","TLSv1.2","1516","Application Data [TCP segment of a reassembled PDU]"
"2.637681","5.9.29.183","172.19.0.3","TCP","1516","9002 → 43520 [PSH, ACK] Seq=77568 Ack=6973 Win=65535 Len=1460 [TCP segment of a reassembled PDU]"
"2.637684","5.9.29.183","172.19.0.3","TCP","585","9002 → 43520 [PSH, ACK] Seq=79028 Ack=6973 Win=65535 Len=529 [TCP segment of a reassembled PDU]"
"2.637700","172.19.0.3","5.9.29.183","TCP","56","43520 → 9002 [ACK] Seq=6973 Ack=79557 Win=8426 Len=0"
"2.649939","5.9.29.183","172.19.0.3","TLSv1.2","584","Application Data"
"2.660268","5.9.29.183","172.19.0.3","TCP","1516","[TCP segment of a reassembled PDU]"
"2.660286","172.19.0.3","5.9.29.183","TCP","56","43520 → 9002 [ACK] Seq=6973 Ack=81545 Win=8466 Len=0"
"2.660320","5.9.29.183","172.19.0.3","TCP","1492","9002 → 43520 [PSH, ACK] Seq=81545 Ack=6973 Win=65535 Len=1436 [TCP segment of a reassembled PDU]"
"2.665341","5.9.29.183","172.19.0.3","TLSv1.2","787","Application Data"
"2.665359","172.19.0.3","5.9.29.183","TCP","56","43520 → 9002 [ACK] Seq=6973 Ack=83712 Win=8466 Len=0"
"2.673458","5.9.29.183","172.19.0.3","TCP","1516","[TCP segment of a reassembled PDU]"
"2.673504","5.9.29.183","172.19.0.3","TCP","1516","9002 → 43520 [PSH, ACK] Seq=85172 Ack=6973 Win=65535 Len=1460 [TCP segment of a reassembled PDU]"
"2.673510","5.9.29.183","172.19.0.3","TLSv1.2","1516","Application Data [TCP segment of a reassembled PDU]"
"2.673513","5.9.29.183","172.19.0.3","TCP","1516","9002 → 43520 [PSH, ACK] Seq=88092 Ack=6973 Win=65535 Len=1460 [TCP segment of a reassembled PDU]"
"2.673515","5.9.29.183","172.19.0.3","TCP","1516","9002 → 43520 [PSH, ACK] Seq=89552 Ack=6973 Win=65535 Len=1460 [TCP segment of a reassembled PDU]"
"2.673517","5.9.29.183","172.19.0.3","TLSv1.2","1444","Application Data [TCP segment of a reassembled PDU]"
"2.673618","172.19.0.3","5.9.29.183","TCP","56","43520 → 9002 [ACK] Seq=6973 Ack=92400 Win=8424 Len=0"
"2.673942","172.19.0.3","5.9.29.183","TLSv1.2","599","Application Data"
"2.674109","5.9.29.183","172.19.0.3","TCP","56","9002 → 43520 [ACK] Seq=92400 Ack=7516 Win=65535 Len=0"
"2.680808","5.9.29.183","172.19.0.3","TLSv1.2","1221","Application Data"
"2.683425","172.19.0.3","5.9.29.183","TLSv1.2","599","Application Data"
"2.683735","5.9.29.183","172.19.0.3","TCP","56","9002 → 43520 [ACK] Seq=93565 Ack=8059 Win=65535 Len=0"
"2.689300","5.9.29.183","172.19.0.3","TCP","1516","[TCP segment of a reassembled PDU]"
"2.689334","5.9.29.183","172.19.0.3","TCP","1492","9002 → 43520 [PSH, ACK] Seq=95025 Ack=8059 Win=65535 Len=1436 [TCP segment of a reassembled PDU]"
"2.689398","172.19.0.3","5.9.29.183","TCP","56","43520 → 9002 [ACK] Seq=8059 Ack=96461 Win=8458 Len=0"
"2.690010","5.9.29.183","172.19.0.3","TLSv1.2","1504","Application Data [TCP segment of a reassembled PDU]"
"2.696330","5.9.29.183","172.19.0.3","TLSv1.2","396","Application Data"
"2.696351","172.19.0.3","5.9.29.183","TCP","56","43520 → 9002 [ACK] Seq=8059 Ack=98249 Win=8466 Len=0"
"2.706492","5.9.29.183","172.19.0.3","TCP","1516","[TCP segment of a reassembled PDU]"
"2.706561","5.9.29.183","172.19.0.3","TCP","1492","9002 → 43520 [PSH, ACK] Seq=99709 Ack=8059 Win=65535 Len=1436 [TCP segment of a reassembled PDU]"
"2.706578","5.9.29.183","172.19.0.3","TLSv1.2","1504","Application Data [TCP segment of a reassembled PDU]"
"2.706659","172.19.0.3","5.9.29.183","TCP","56","43520 → 9002 [ACK] Seq=8059 Ack=102593 Win=8450 Len=0"
"2.706956","5.9.29.183","172.19.0.3","TCP","1504","9002 → 43520 [PSH, ACK] Seq=102593 Ack=8059 Win=65535 Len=1448 [TCP segment of a reassembled PDU]"
"2.713004","5.9.29.183","172.19.0.3","TLSv1.2","1004","Application Data"
"2.713023","172.19.0.3","5.9.29.183","TCP","56","43520 → 9002 [ACK] Seq=8059 Ack=104989 Win=8466 Len=0"
"2.728699","5.9.29.183","172.19.0.3","TCP","1516","[TCP segment of a reassembled PDU]"
"2.728747","5.9.29.183","172.19.0.3","TLSv1.2","167","Application Data"
"2.728855","172.19.0.3","5.9.29.183","TCP","56","43520 → 9002 [ACK] Seq=8059 Ack=106560 Win=8458 Len=0"
"2.739650","5.9.29.183","172.19.0.3","TCP","1516","[TCP segment of a reassembled PDU]"
"2.739711","5.9.29.183","172.19.0.3","TCP","1492","9002 → 43520 [PSH, ACK] Seq=108020 Ack=8059 Win=65535 Len=1436 [TCP segment of a reassembled PDU]"
"2.739718","5.9.29.183","172.19.0.3","TLSv1.2","1516","Application Data [TCP segment of a reassembled PDU]"
"2.739720","5.9.29.183","172.19.0.3","TCP","1516","9002 → 43520 [PSH, ACK] Seq=110916 Ack=8059 Win=65535 Len=1460 [TCP segment of a reassembled PDU]"
"2.739722","5.9.29.183","172.19.0.3","TCP","1516","9002 → 43520 [PSH, ACK] Seq=112376 Ack=8059 Win=65535 Len=1460 [TCP segment of a reassembled PDU]"
"2.739724","5.9.29.183","172.19.0.3","TLSv1.2","1516","Application Data [TCP segment of a reassembled PDU]"
"2.739736","5.9.29.183","172.19.0.3","TCP","1456","9002 → 43520 [PSH, ACK] Seq=115296 Ack=8059 Win=65535 Len=1400 [TCP segment of a reassembled PDU]"
"2.739822","172.19.0.3","5.9.29.183","TCP","56","43520 → 9002 [ACK] Seq=8059 Ack=116696 Win=8416 Len=0"
"2.743781","5.9.29.183","172.19.0.3","TLSv1.2","801","Application Data"
"2.768129","5.9.29.183","172.19.0.3","TCP","1516","[TCP segment of a reassembled PDU]"
"2.768146","172.19.0.3","5.9.29.183","TCP","56","43520 → 9002 [ACK] Seq=8059 Ack=118901 Win=8466 Len=0"
"2.768180","5.9.29.183","172.19.0.3","TCP","1516","9002 → 43520 [PSH, ACK] Seq=118901 Ack=8059 Win=65535 Len=1460 [TCP segment of a reassembled PDU]"
"2.768188","5.9.29.183","172.19.0.3","TLSv1.2","763","Application Data"
"2.768286","172.19.0.3","5.9.29.183","TCP","56","43520 → 9002 [ACK] Seq=8059 Ack=121068 Win=8450 Len=0"
"2.768469","172.19.0.3","5.9.29.183","TLSv1.2","599","Application Data"
"2.768615","5.9.29.183","172.19.0.3","TCP","56","9002 → 43520 [ACK] Seq=121068 Ack=8602 Win=65535 Len=0"
"2.784168","5.9.29.183","172.19.0.3","TCP","1516","[TCP segment of a reassembled PDU]"
"2.784214","5.9.29.183","172.19.0.3","TCP","1516","9002 → 43520 [PSH, ACK] Seq=122528 Ack=8602 Win=65535 Len=1460 [TCP segment of a reassembled PDU]"
"2.784220","5.9.29.183","172.19.0.3","TLSv1.2","763","Application Data"
"2.784324","172.19.0.3","5.9.29.183","TCP","56","43520 → 9002 [ACK] Seq=8602 Ack=124695 Win=8450 Len=0"
"2.788335","172.19.0.3","5.9.29.183","TLSv1.2","599","Application Data"
"2.788578","5.9.29.183","172.19.0.3","TCP","56","9002 → 43520 [ACK] Seq=124695 Ack=9145 Win=65535 Len=0"
"3.050641","5.9.29.183","172.19.0.3","TLSv1.2","599","Application Data"
"3.051250","172.19.0.3","5.9.29.183","TLSv1.2","599","Application Data"
"3.051547","5.9.29.183","172.19.0.3","TCP","56","9002 → 43520 [ACK] Seq=125238 Ack=9688 Win=65535 Len=0"
"3.327421","5.9.29.183","172.19.0.3","TLSv1.2","599","Application Data"
"3.341035","5.9.29.183","172.19.0.3","TCP","1516","[TCP segment of a reassembled PDU]"
"3.341058","172.19.0.3","5.9.29.183","TCP","56","43520 → 9002 [ACK] Seq=9688 Ack=127241 Win=8466 Len=0"
"3.341115","5.9.29.183","172.19.0.3","TCP","1516","9002 → 43520 [PSH, ACK] Seq=127241 Ack=9688 Win=65535 Len=1460 [TCP segment of a reassembled PDU]"
"3.341125","5.9.29.183","172.19.0.3","TLSv1.2","1516","Application Data [TCP segment of a reassembled PDU]"
"3.341128","5.9.29.183","172.19.0.3","TCP","1516","9002 → 43520 [PSH, ACK] Seq=130161 Ack=9688 Win=65535 Len=1460 [TCP segment of a reassembled PDU]"
"3.341131","5.9.29.183","172.19.0.3","TCP","1516","9002 → 43520 [PSH, ACK] Seq=131621 Ack=9688 Win=65535 Len=1460 [TCP segment of a reassembled PDU]"
"3.341133","5.9.29.183","172.19.0.3","TLSv1.2","1516","Application Data [TCP segment of a reassembled PDU]"
"3.341271","5.9.29.183","172.19.0.3","TCP","1432","9002 → 43520 [PSH, ACK] Seq=134541 Ack=9688 Win=65535 Len=1376 [TCP segment of a reassembled PDU]"
"3.341277","172.19.0.3","5.9.29.183","TCP","56","43520 → 9002 [ACK] Seq=9688 Ack=134541 Win=8426 Len=0"
"3.342511","5.9.29.183","172.19.0.3","TLSv1.2","801","Application Data"
"3.342536","172.19.0.3","5.9.29.183","TCP","56","43520 → 9002 [ACK] Seq=9688 Ack=136662 Win=8464 Len=0"
"3.360795","5.9.29.183","172.19.0.3","TCP","1516","[TCP segment of a reassembled PDU]"
"3.360856","5.9.29.183","172.19.0.3","TCP","1516","9002 → 43520 [PSH, ACK] Seq=138122 Ack=9688 Win=65535 Len=1460 [TCP segment of a reassembled PDU]"
"3.360864","5.9.29.183","172.19.0.3","TCP","658","9002 → 43520 [PSH, ACK] Seq=139582 Ack=9688 Win=65535 Len=602 [TCP segment of a reassembled PDU]"
"3.360867","5.9.29.183","172.19.0.3","TLSv1.2","1516","Application Data [TCP segment of a reassembled PDU]"
"3.360910","5.9.29.183","172.19.0.3","TCP","1516","9002 → 43520 [PSH, ACK] Seq=141644 Ack=9688 Win=65535 Len=1460 [TCP segment of a reassembled PDU]"
"3.360915","5.9.29.183","172.19.0.3","TLSv1.2","1516","Application Data [TCP segment of a reassembled PDU]"
"3.360958","5.9.29.183","172.19.0.3","TCP","1516","9002 → 43520 [PSH, ACK] Seq=144564 Ack=9688 Win=65535 Len=1460 [TCP segment of a reassembled PDU]"
"3.360996","5.9.29.183","172.19.0.3","TCP","1516","9002 → 43520 [PSH, ACK] Seq=146024 Ack=9688 Win=65535 Len=1460 [TCP segment of a reassembled PDU]"
"3.360999","5.9.29.183","172.19.0.3","TCP","551","9002 → 43520 [PSH, ACK] Seq=147484 Ack=9688 Win=65535 Len=495 [TCP segment of a reassembled PDU]"
"3.361012","172.19.0.3","5.9.29.183","TCP","56","43520 → 9002 [ACK] Seq=9688 Ack=146024 Win=8418 Len=0"
"3.361115","172.19.0.3","5.9.29.183","TCP","56","43520 → 9002 [ACK] Seq=9688 Ack=147979 Win=8403 Len=0"
"3.361469","172.19.0.3","5.9.29.183","TLSv1.2","599","Application Data"
"3.361733","5.9.29.183","172.19.0.3","TCP","56","9002 → 43520 [ACK] Seq=147979 Ack=10231 Win=65535 Len=0"
"3.376843","5.9.29.183","172.19.0.3","TLSv1.2","1191","Application Data, Application Data"
"3.382094","5.9.29.183","172.19.0.3","TCP","1504","[TCP segment of a reassembled PDU]"
"3.382115","172.19.0.3","5.9.29.183","TCP","56","43520 → 9002 [ACK] Seq=10231 Ack=150562 Win=8466 Len=0"
"3.392748","5.9.29.183","172.19.0.3","TLSv1.2","693","Application Data"
"3.393086","172.19.0.3","5.9.29.183","TLSv1.2","599","Application Data"
"3.393308","5.9.29.183","172.19.0.3","TCP","56","9002 → 43520 [ACK] Seq=151199 Ack=10774 Win=65535 Len=0"
"3.397339","5.9.29.183","172.19.0.3","TCP","1516","[TCP segment of a reassembled PDU]"
"3.397398","5.9.29.183","172.19.0.3","TCP","1516","9002 → 43520 [PSH, ACK] Seq=152659 Ack=10774 Win=65535 Len=1460 [TCP segment of a reassembled PDU]"
"3.397404","5.9.29.183","172.19.0.3","TLSv1.2","1516","Application Data [TCP segment of a reassembled PDU]"
"3.397407","5.9.29.183","172.19.0.3","TCP","1516","9002 → 43520 [PSH, ACK] Seq=155579 Ack=10774 Win=65535 Len=1460 [TCP segment of a reassembled PDU]"
"3.397409","5.9.29.183","172.19.0.3","TCP","1516","9002 → 43520 [PSH, ACK] Seq=157039 Ack=10774 Win=65535 Len=1460 [TCP segment of a reassembled PDU]"
"3.397411","5.9.29.183","172.19.0.3","TLSv1.2","1444","Application Data [TCP segment of a reassembled PDU]"
"3.397584","172.19.0.3","5.9.29.183","TCP","56","43520 → 9002 [ACK] Seq=10774 Ack=159887 Win=8426 Len=0"
"3.407976","5.9.29.183","172.19.0.3","TLSv1.2","707","Application Data"
"3.422958","5.9.29.183","172.19.0.3","TCP","1504","[TCP segment of a reassembled PDU]"
"3.422976","172.19.0.3","5.9.29.183","TCP","56","43520 → 9002 [ACK] Seq=10774 Ack=161986 Win=8466 Len=0"
"3.423389","5.9.29.183","172.19.0.3","TLSv1.2","1207","Application Data"
"3.426381","172.19.0.3","5.9.29.183","TLSv1.2","599","Application Data"
"3.426555","5.9.29.183","172.19.0.3","TCP","56","9002 → 43520 [ACK] Seq=163137 Ack=11317 Win=65535 Len=0"
"3.676747","5.9.29.183","172.19.0.3","TLSv1.2","599","Application Data"
"3.677387","172.19.0.3","5.9.29.183","TLSv1.2","599","Application Data"
"3.677626","5.9.29.183","172.19.0.3","TCP","56","9002 → 43520 [ACK] Seq=163680 Ack=11860 Win=65535 Len=0"
"3.970852","5.9.29.183","172.19.0.3","TCP","1516","[TCP segment of a reassembled PDU]"
"3.970898","5.9.29.183","172.19.0.3","TCP","1516","9002 → 43520 [PSH, ACK] Seq=165140 Ack=11860 Win=65535 Len=1460 [TCP segment of a reassembled PDU]"
"3.970905","5.9.29.183","172.19.0.3","TLSv1.2","763","Application Data"
"3.971013","172.19.0.3","5.9.29.183","TCP","56","43520 → 9002 [ACK] Seq=11860 Ack=167307 Win=8450 Len=0"
"4.039906","5.9.29.183","172.19.0.3","TCP","1504","[TCP segment of a reassembled PDU]"
"4.040222","5.9.29.183","172.19.0.3","TCP","1516","9002 → 43520 [PSH, ACK] Seq=168755 Ack=11860 Win=65535 Len=1460 [TCP segment of a reassembled PDU]"
"4.040233","172.19.0.3","5.9.29.183","TCP","56","43520 → 9002 [ACK] Seq=11860 Ack=170215 Win=8466 Len=0"
"4.040259","5.9.29.183","172.19.0.3","TLSv1.2","775","Application Data"
"4.051198","5.9.29.183","172.19.0.3","TCP","1516","[TCP segment of a reassembled PDU]"
"4.051271","172.19.0.3","5.9.29.183","TCP","56","43520 → 9002 [ACK] Seq=11860 Ack=172394 Win=8466 Len=0"
"4.051301","5.9.29.183","172.19.0.3","TCP","1492","9002 → 43520 [PSH, ACK] Seq=172394 Ack=11860 Win=65535 Len=1436 [TCP segment of a reassembled PDU]"
"4.051371","5.9.29.183","172.19.0.3","TLSv1.2","1516","Application Data [TCP segment of a reassembled PDU]"
"4.051377","5.9.29.183","172.19.0.3","TCP","1516","9002 → 43520 [PSH, ACK] Seq=175290 Ack=11860 Win=65535 Len=1460 [TCP segment of a reassembled PDU]"
"4.051384","5.9.29.183","172.19.0.3","TCP","1480","9002 → 43520 [PSH, ACK] Seq=176750 Ack=11860 Win=65535 Len=1424 [TCP segment of a reassembled PDU]"
"4.051426","172.19.0.3","5.9.29.183","TCP","56","43520 → 9002 [ACK] Seq=11860 Ack=178174 Win=8434 Len=0"
"4.056107","5.9.29.183","172.19.0.3","TLSv1.2","584","Application Data"
"4.068215","5.9.29.183","172.19.0.3","TCP","1516","[TCP segment of a reassembled PDU]"
"4.068232","172.19.0.3","5.9.29.183","TCP","56","43520 → 9002 [ACK] Seq=11860 Ack=180162 Win=8466 Len=0"
"4.068266","5.9.29.183","172.19.0.3","TCP","1516","9002 → 43520 [PSH, ACK] Seq=180162 Ack=11860 Win=65535 Len=1460 [TCP segment of a reassembled PDU]"
"4.068273","5.9.29.183","172.19.0.3","TLSv1.2","1516","Application Data [TCP segment of a reassembled PDU]"
"4.068276","5.9.29.183","172.19.0.3","TCP","1516","9002 → 43520 [PSH, ACK] Seq=183082 Ack=11860 Win=65535 Len=1460 [TCP segment of a reassembled PDU]"
"4.068278","5.9.29.183","172.19.0.3","TCP","1516","9002 → 43520 [PSH, ACK] Seq=184542 Ack=11860 Win=65535 Len=1460 [TCP segment of a reassembled PDU]"
"4.068280","5.9.29.183","172.19.0.3","TLSv1.2","1516","Application Data [TCP segment of a reassembled PDU]"
"4.068284","5.9.29.183","172.19.0.3","TCP","1432","9002 → 43520 [PSH, ACK] Seq=187462 Ack=11860 Win=65535 Len=1376 [TCP segment of a reassembled PDU]"
"4.068344","5.9.29.183","172.19.0.3","TCP","1516","9002 → 43520 [PSH, ACK] Seq=188838 Ack=11860 Win=65535 Len=1460 [TCP segment of a reassembled PDU]"
"4.068348","5.9.29.183","172.19.0.3","TLSv1.2","1516","Application Data [TCP segment of a reassembled PDU]"
"4.068350","5.9.29.183","172.19.0.3","TCP","1516","9002 → 43520 [PSH, ACK] Seq=191758 Ack=11860 Win=65535 Len=1460 [TCP segment of a reassembled PDU]"
"4.068353","5.9.29.183","172.19.0.3","TCP","1468","9002 → 43520 [PSH, ACK] Seq=193218 Ack=11860 Win=65535 Len=1412 [TCP segment of a reassembled PDU]"
"4.068402","172.19.0.3","5.9.29.183","TCP","56","43520 → 9002 [ACK] Seq=11860 Ack=194630 Win=8383 Len=0"
"4.068806","172.19.0.3","5.9.29.183","TLSv1.2","599","Application Data"
"4.069099","5.9.29.183","172.19.0.3","TCP","56","9002 → 43520 [ACK] Seq=194630 Ack=12403 Win=65535 Len=0"
"4.071454","5.9.29.183","172.19.0.3","TLSv1.2","721","Application Data, Application Data"
"4.078939","172.19.0.3","5.9.29.183","TLSv1.2","599","Application Data"
"4.079185","5.9.29.183","172.19.0.3","TCP","56","9002 → 43520 [ACK] Seq=195295 Ack=12946 Win=65535 Len=0"
"4.085924","5.9.29.183","172.19.0.3","TCP","1516","[TCP segment of a reassembled PDU]"
"4.085964","5.9.29.183","172.19.0.3","TCP","1516","9002 → 43520 [PSH, ACK] Seq=196755 Ack=12946 Win=65535 Len=1460 [TCP segment of a reassembled PDU]"
"4.085969","5.9.29.183","172.19.0.3","TLSv1.2","1516","Application Data [TCP segment of a reassembled PDU]"
"4.085972","5.9.29.183","172.19.0.3","TCP","1516","9002 → 43520 [PSH, ACK] Seq=199675 Ack=12946 Win=65535 Len=1460 [TCP segment of a reassembled PDU]"
"4.085974","5.9.29.183","172.19.0.3","TCP","1516","9002 → 43520 [PSH, ACK] Seq=201135 Ack=12946 Win=65535 Len=1460 [TCP segment of a reassembled PDU]"
"4.085976","5.9.29.183","172.19.0.3","TLSv1.2","1516","Application Data [TCP segment of a reassembled PDU]"
"4.085987","5.9.29.183","172.19.0.3","TCP","1432","9002 → 43520 [PSH, ACK] Seq=204055 Ack=12946 Win=65535 Len=1376 [TCP segment of a reassembled PDU]"
"4.086052","172.19.0.3","5.9.29.183","TCP","56","43520 → 9002 [ACK] Seq=12946 Ack=205431 Win=8418 Len=0"
"4.086634","5.9.29.183","172.19.0.3","TCP","345","9002 → 43520 [PSH, ACK] Seq=205431 Ack=12946 Win=65535 Len=289 [TCP segment of a reassembled PDU]"
"4.086700","5.9.29.183","172.19.0.3","TLSv1.2","512","Application Data"
"4.086758","172.19.0.3","5.9.29.183","TCP","56","43520 → 9002 [ACK] Seq=12946 Ack=206176 Win=8466 Len=0"
"4.102537","5.9.29.183","172.19.0.3","TLSv1.2","1113","Application Data"
"4.102641","5.9.29.183","172.19.0.3","TCP","1504","[TCP segment of a reassembled PDU]"
"4.102712","172.19.0.3","5.9.29.183","TCP","56","43520 → 9002 [ACK] Seq=12946 Ack=208681 Win=8458 Len=0"
"4.103412","5.9.29.183","172.19.0.3","TCP","1504","9002 → 43520 [PSH, ACK] Seq=208681 Ack=12946 Win=65535 Len=1448 [TCP segment of a reassembled PDU]"
"4.103492","5.9.29.183","172.19.0.3","TLSv1.2","1516","Application Data [TCP segment of a reassembled PDU]"
"4.103498","172.19.0.3","5.9.29.183","TCP","56","43520 → 9002 [ACK] Seq=12946 Ack=211589 Win=8458 Len=0"
"4.103500","5.9.29.183","172.19.0.3","TCP","1516","9002 → 43520 [PSH, ACK] Seq=211589 Ack=12946 Win=65535 Len=1460 [TCP segment of a reassembled PDU]"
"4.103543","5.9.29.183","172.19.0.3","TCP","1516","9002 → 43520 [PSH, ACK] Seq=213049 Ack=12946 Win=65535 Len=1460 [TCP segment of a reassembled PDU]"
"4.103570","172.19.0.3","5.9.29.183","TCP","56","43520 → 9002 [ACK] Seq=12946 Ack=214509 Win=8442 Len=0"
"4.103581","5.9.29.183","172.19.0.3","TLSv1.2","1468","Application Data [TCP segment of a reassembled PDU]"
"4.118945","5.9.29.183","172.19.0.3","TLSv1.2","707","Application Data"
"4.118962","172.19.0.3","5.9.29.183","TCP","56","43520 → 9002 [ACK] Seq=12946 Ack=216572 Win=8466 Len=0"
"4.119312","172.19.0.3","5.9.29.183","TLSv1.2","599","Application Data"
"4.119465","5.9.29.183","172.19.0.3","TCP","56","9002 → 43520 [ACK] Seq=216572 Ack=13489 Win=65535 Len=0"
"4.129580","172.19.0.3","5.9.29.183","TLSv1.2","599","Application Data"
"4.129802","5.9.29.183","172.19.0.3","TCP","56","9002 → 43520 [ACK] Seq=216572 Ack=14032 Win=65535 Len=0"
"4.453521","5.9.29.183","172.19.0.3","TLSv1.2","599","Application Data"
"4.454114","172.19.0.3","5.9.29.183","TLSv1.2","599","Application Data"
"4.454360","5.9.29.183","172.19.0.3","TCP","56","9002 → 43520 [ACK] Seq=217115 Ack=14575 Win=65535 Len=0"
"4.820544","5.9.29.183","172.19.0.3","TCP","1504","[TCP segment of a reassembled PDU]"
"4.820871","5.9.29.183","172.19.0.3","TCP","1516","9002 → 43520 [PSH, ACK] Seq=218563 Ack=14575 Win=65535 Len=1460 [TCP segment of a reassembled PDU]"
"4.820885","172.19.0.3","5.9.29.183","TCP","56","43520 → 9002 [ACK] Seq=14575 Ack=220023 Win=8466 Len=0"
"4.820890","5.9.29.183","172.19.0.3","TLSv1.2","775","Application Data"
"4.862269","5.9.29.183","172.19.0.3","TCP","1516","[TCP segment of a reassembled PDU]"
"4.862288","172.19.0.3","5.9.29.183","TCP","56","43520 → 9002 [ACK] Seq=14575 Ack=222202 Win=8466 Len=0"
"4.862330","5.9.29.183","172.19.0.3","TCP","1492","9002 → 43520 [PSH, ACK] Seq=222202 Ack=14575 Win=65535 Len=1436 [TCP segment of a reassembled PDU]"
"4.862339","5.9.29.183","172.19.0.3","TLSv1.2","1516","Application Data [TCP segment of a reassembled PDU]"
"4.862342","5.9.29.183","172.19.0.3","TCP","1516","9002 → 43520 [PSH, ACK] Seq=225098 Ack=14575 Win=65535 Len=1460 [TCP segment of a reassembled PDU]"
"4.862381","5.9.29.183","172.19.0.3","TCP","1213","9002 → 43520 [PSH, ACK] Seq=226558 Ack=14575 Win=65535 Len=1157 [TCP segment of a reassembled PDU]"
"4.862627","172.19.0.3","5.9.29.183","TCP","56","43520 → 9002 [ACK] Seq=14575 Ack=227715 Win=8434 Len=0"
"4.877594","5.9.29.183","172.19.0.3","TLSv1.2","337","Application Data"
"4.882795","5.9.29.183","172.19.0.3","TCP","1516","[TCP segment of a reassembled PDU]"
"4.882815","172.19.0.3","5.9.29.183","TCP","56","43520 → 9002 [ACK] Seq=14575 Ack=229456 Win=8466 Len=0"
"4.882861","5.9.29.183","172.19.0.3","TCP","1516","9002 → 43520 [PSH, ACK] Seq=229456 Ack=14575 Win=65535 Len=1460 [TCP segment of a reassembled PDU]"
"4.882874","5.9.29.183","172.19.0.3","TLSv1.2","1480","Application Data [TCP segment of a reassembled PDU]"
"4.883015","5.9.29.183","172.19.0.3","TCP","1504","9002 → 43520 [PSH, ACK] Seq=232340 Ack=14575 Win=65535 Len=1448 [TCP segment of a reassembled PDU]"
"4.883052","172.19.0.3","5.9.29.183","TCP","56","43520 → 9002 [ACK] Seq=14575 Ack=233788 Win=8442 Len=0"
"4.883298","5.9.29.183","172.19.0.3","TCP","1516","9002 → 43520 [PSH, ACK] Seq=233788 Ack=14575 Win=65535 Len=1460 [TCP segment of a reassembled PDU]"
"4.883304","5.9.29.183","172.19.0.3","TLSv1.2","1516","Application Data [TCP segment of a reassembled PDU]"
"4.883352","172.19.0.3","5.9.29.183","TCP","56","43520 → 9002 [ACK] Seq=14575 Ack=236708 Win=8426 Len=0"
"4.883353","5.9.29.183","172.19.0.3","TCP","1516","9002 → 43520 [PSH, ACK] Seq=236708 Ack=14575 Win=65535 Len=1460 [TCP segment of a reassembled PDU]"
"4.883357","5.9.29.183","172.19.0.3","TCP","1468","9002 → 43520 [PSH, ACK] Seq=238168 Ack=14575 Win=65535 Len=1412 [TCP segment of a reassembled PDU]"
"4.883400","172.19.0.3","5.9.29.183","TCP","56","43520 → 9002 [ACK] Seq=14575 Ack=239580 Win=8410 Len=0"
"4.892671","5.9.29.183","172.19.0.3","TLSv1.2","381","Application Data"
"4.907813","5.9.29.183","172.19.0.3","TCP","1516","[TCP segment of a reassembled PDU]"
"4.907831","172.19.0.3","5.9.29.183","TCP","56","43520 → 9002 [ACK] Seq=14575 Ack=241365 Win=8464 Len=0"
"4.907870","5.9.29.183","172.19.0.3","TCP","1516","9002 → 43520 [PSH, ACK] Seq=241365 Ack=14575 Win=65535 Len=1460 [TCP segment of a reassembled PDU]"
"4.907913","5.9.29.183","172.19.0.3","TLSv1.2","1516","Application Data [TCP segment of a reassembled PDU]"
"4.907919","5.9.29.183","172.19.0.3","TLSv1.2","360","Application Data"
"4.908043","172.19.0.3","5.9.29.183","TCP","56","43520 → 9002 [ACK] Seq=14575 Ack=244589 Win=8440 Len=0"
"4.908235","172.19.0.3","5.9.29.183","TLSv1.2","599","Application Data"
"4.908461","5.9.29.183","172.19.0.3","TCP","56","9002 → 43520 [ACK] Seq=244589 Ack=15118 Win=65535 Len=0"
"4.935438","5.9.29.183","172.19.0.3","TCP","1516","[TCP segment of a reassembled PDU]"
"4.935495","5.9.29.183","172.19.0.3","TCP","1516","9002 → 43520 [PSH, ACK] Seq=246049 Ack=15118 Win=65535 Len=1460 [TCP segment of a reassembled PDU]"
"4.935509","172.19.0.3","5.9.29.183","TCP","56","43520 → 9002 [ACK] Seq=15118 Ack=247509 Win=8458 Len=0"
"4.935511","5.9.29.183","172.19.0.3","TLSv1.2","1213","Application Data"
"4.935515","5.9.29.183","172.19.0.3","TCP","1504","[TCP segment of a reassembled PDU]"
"4.935665","172.19.0.3","5.9.29.183","TCP","56","43520 → 9002 [ACK] Seq=15118 Ack=250114 Win=8442 Len=0"
"4.935901","172.19.0.3","5.9.29.183","TLSv1.2","599","Application Data"
"4.936298","5.9.29.183","172.19.0.3","TCP","56","9002 → 43520 [ACK] Seq=250114 Ack=15661 Win=65535 Len=0"
"4.940925","5.9.29.183","172.19.0.3","TLSv1.2","1504","Application Data [TCP segment of a reassembled PDU]"
"4.940993","5.9.29.183","172.19.0.3","TCP","1516","9002 → 43520 [PSH, ACK] Seq=251562 Ack=15661 Win=65535 Len=1460 [TCP segment of a reassembled PDU]"
"4.941009","172.19.0.3","5.9.29.183","TCP","56","43520 → 9002 [ACK] Seq=15661 Ack=253022 Win=8458 Len=0"
"4.941061","5.9.29.183","172.19.0.3","TCP","1492","9002 → 43520 [PSH, ACK] Seq=253022 Ack=15661 Win=65535 Len=1436 [TCP segment of a reassembled PDU]"
"4.950791","5.9.29.183","172.19.0.3","TLSv1.2","1097","Application Data, Application Data"
"4.950810","172.19.0.3","5.9.29.183","TCP","56","43520 → 9002 [ACK] Seq=15661 Ack=255499 Win=8466 Len=0"
"4.961460","5.9.29.183","172.19.0.3","TCP","1516","[TCP segment of a reassembled PDU]"
"4.961507","5.9.29.183","172.19.0.3","TCP","1516","9002 → 43520 [PSH, ACK] Seq=256959 Ack=15661 Win=65535 Len=1460 [TCP segment of a reassembled PDU]"
"4.961513","5.9.29.183","172.19.0.3","TLSv1.2","1516","Application Data [TCP segment of a reassembled PDU]"
"4.961516","5.9.29.183","172.19.0.3","TCP","1468","9002 → 43520 [PSH, ACK] Seq=259879 Ack=15661 Win=65535 Len=1412 [TCP segment of a reassembled PDU]"
"4.961518","5.9.29.183","172.19.0.3","TCP","1516","9002 → 43520 [PSH, ACK] Seq=261291 Ack=15661 Win=65535 Len=1460 [TCP segment of a reassembled PDU]"
"4.961520","5.9.29.183","172.19.0.3","TLSv1.2","1492","Application Data [TCP segment of a reassembled PDU]"
"4.961646","172.19.0.3","5.9.29.183","TCP","56","43520 → 9002 [ACK] Seq=15661 Ack=264187 Win=8426 Len=0"
"4.966789","5.9.29.183","172.19.0.3","TLSv1.2","1221","Application Data"
"4.984001","5.9.29.183","172.19.0.3","TCP","1516","[TCP segment of a reassembled PDU]"
"4.984018","172.19.0.3","5.9.29.183","TCP","56","43520 → 9002 [ACK] Seq=15661 Ack=266812 Win=8464 Len=0"
"4.984059","5.9.29.183","172.19.0.3","TCP","1516","9002 → 43520 [PSH, ACK] Seq=266812 Ack=15661 Win=65535 Len=1460 [TCP segment of a reassembled PDU]"
"4.984088","5.9.29.183","172.19.0.3","TLSv1.2","1213","Application Data"
"4.984094","5.9.29.183","172.19.0.3","TCP","1516","[TCP segment of a reassembled PDU]"
"4.984097","5.9.29.183","172.19.0.3","TCP","423","9002 → 43520 [PSH, ACK] Seq=270889 Ack=15661 Win=65535 Len=367 [TCP segment of a reassembled PDU]"
"4.984100","5.9.29.183","172.19.0.3","TCP","1125","9002 → 43520 [PSH, ACK] Seq=271256 Ack=15661 Win=65535 Len=1069 [TCP segment of a reassembled PDU]"
"4.984198","172.19.0.3","5.9.29.183","TCP","56","43520 → 9002 [ACK] Seq=15661 Ack=272325 Win=8424 Len=0"
"4.984391","172.19.0.3","5.9.29.183","TLSv1.2","599","Application Data"
"4.984586","5.9.29.183","172.19.0.3","TCP","56","9002 → 43520 [ACK] Seq=272325 Ack=16204 Win=65535 Len=0"
"4.988868","5.9.29.183","172.19.0.3","TLSv1.2","1504","Application Data [TCP segment of a reassembled PDU]"
"4.999208","5.9.29.183","172.19.0.3","TLSv1.2","974","Application Data"
"4.999227","172.19.0.3","5.9.29.183","TCP","56","43520 → 9002 [ACK] Seq=16204 Ack=274691 Win=8466 Len=0"
"5.002764","5.9.29.183","172.19.0.3","TCP","1516","[TCP segment of a reassembled PDU]"
"5.002807","5.9.29.183","172.19.0.3","TCP","1516","9002 → 43520 [PSH, ACK] Seq=276151 Ack=16204 Win=65535 Len=1460 [TCP segment of a reassembled PDU]"
"5.002814","5.9.29.183","172.19.0.3","TLSv1.2","1516","Application Data [TCP segment of a reassembled PDU]"
"5.002816","5.9.29.183","172.19.0.3","TCP","1516","9002 → 43520 [PSH, ACK] Seq=279071 Ack=16204 Win=65535 Len=1460 [TCP segment of a reassembled PDU]"
"5.002818","5.9.29.183","172.19.0.3","TCP","1456","9002 → 43520 [PSH, ACK] Seq=280531 Ack=16204 Win=65535 Len=1400 [TCP segment of a reassembled PDU]"
"5.002950","172.19.0.3","5.9.29.183","TCP","56","43520 → 9002 [ACK] Seq=16204 Ack=281931 Win=8434 Len=0"
"5.014249","5.9.29.183","172.19.0.3","TLSv1.2","584","Application Data"
"5.017904","172.19.0.3","5.9.29.183","TLSv1.2","599","Application Data"
"5.018413","5.9.29.183","172.19.0.3","TCP","56","9002 → 43520 [ACK] Seq=282459 Ack=16747 Win=65535 Len=0"
"5.312391","5.9.29.183","172.19.0.3","TLSv1.2","599","Application Data"
"5.313226","172.19.0.3","5.9.29.183","TLSv1.2","599","Application Data"
"5.313537","5.9.29.183","172.19.0.3","TCP","56","9002 → 43520 [ACK] Seq=283002 Ack=17290 Win=65535 Len=0"
"5.566463","5.9.29.183","172.19.0.3","TCP","1516","[TCP segment of a reassembled PDU]"
"5.566525","5.9.29.183","172.19.0.3","TCP","1492","9002 → 43520 [PSH, ACK] Seq=284462 Ack=17290 Win=65535 Len=1436 [TCP segment of a reassembled PDU]"
"5.566533","5.9.29.183","172.19.0.3","TLSv1.2","1237","Application Data"
"5.566622","172.19.0.3","5.9.29.183","TCP","56","43520 → 9002 [ACK] Seq=17290 Ack=287079 Win=8450 Len=0"
"5.582377","5.9.29.183","172.19.0.3","TLSv1.2","149","Application Data"
"5.582867","5.9.29.183","172.19.0.3","TCP","1504","[TCP segment of a reassembled PDU]"
"5.582876","172.19.0.3","5.9.29.183","TCP","56","43520 → 9002 [ACK] Seq=17290 Ack=288620 Win=8466 Len=0"
"5.582999","5.9.29.183","172.19.0.3","TCP","1504","9002 → 43520 [PSH, ACK] Seq=288620 Ack=17290 Win=65535 Len=1448 [TCP segment of a reassembled PDU]"
"5.595116","5.9.29.183","172.19.0.3","TLSv1.2","1504","Application Data, Application Data"
"5.595135","172.19.0.3","5.9.29.183","TCP","56","43520 → 9002 [ACK] Seq=17290 Ack=291516 Win=8466 Len=0"
"5.595168","5.9.29.183","172.19.0.3","TCP","1504","9002 → 43520 [PSH, ACK] Seq=291516 Ack=17290 Win=65535 Len=1448 [TCP segment of a reassembled PDU]"
"5.595282","5.9.29.183","172.19.0.3","TCP","1504","9002 → 43520 [PSH, ACK] Seq=292964 Ack=17290 Win=65535 Len=1448 [TCP segment of a reassembled PDU]"
"5.595287","5.9.29.183","172.19.0.3","TLSv1.2","1504","Application Data [TCP segment of a reassembled PDU]"
"5.595310","172.19.0.3","5.9.29.183","TCP","56","43520 → 9002 [ACK] Seq=17290 Ack=295860 Win=8442 Len=0"
"5.595415","5.9.29.183","172.19.0.3","TCP","1516","9002 → 43520 [PSH, ACK] Seq=295860 Ack=17290 Win=65535 Len=1460 [TCP segment of a reassembled PDU]"
"5.595421","5.9.29.183","172.19.0.3","TCP","1492","9002 → 43520 [PSH, ACK] Seq=297320 Ack=17290 Win=65535 Len=1436 [TCP segment of a reassembled PDU]"
"5.595468","172.19.0.3","5.9.29.183","TCP","56","43520 → 9002 [ACK] Seq=17290 Ack=298756 Win=8426 Len=0"
"5.597051","5.9.29.183","172.19.0.3","TLSv1.2","410","Application Data"
"5.617796","5.9.29.183","172.19.0.3","TCP","1516","[TCP segment of a reassembled PDU]"
"5.617813","172.19.0.3","5.9.29.183","TCP","56","43520 → 9002 [ACK] Seq=17290 Ack=300570 Win=8466 Len=0"
"5.617846","5.9.29.183","172.19.0.3","TLSv1.2","681","Application Data"
"5.618182","172.19.0.3","5.9.29.183","TLSv1.2","599","Application Data"
"5.618404","5.9.29.183","172.19.0.3","TCP","56","9002 → 43520 [ACK] Seq=301195 Ack=17833 Win=65535 Len=0"
"5.628021","172.19.0.3","5.9.29.183","TLSv1.2","599","Application Data"
"5.628240","5.9.29.183","172.19.0.3","TCP","56","9002 → 43520 [ACK] Seq=301195 Ack=18376 Win=65535 Len=0"
"6.003883","5.9.29.183","172.19.0.3","TLSv1.2","599","Application Data"
"6.004736","172.19.0.3","5.9.29.183","TLSv1.2","599","Application Data"
"6.005016","5.9.29.183","172.19.0.3","TCP","56","9002 → 43520 [ACK] Seq=301738 Ack=18919 Win=65535 Len=0"
"6.254829","5.9.29.183","172.19.0.3","TCP","1516","[TCP segment of a reassembled PDU]"
"6.254934","5.9.29.183","172.19.0.3","TCP","1516","9002 → 43520 [PSH, ACK] Seq=303198 Ack=18919 Win=65535 Len=1460 [TCP segment of a reassembled PDU]"
"6.254950","5.9.29.183","172.19.0.3","TLSv1.2","763","Application Data"
"6.255091","172.19.0.3","5.9.29.183","TCP","56","43520 → 9002 [ACK] Seq=18919 Ack=305365 Win=8450 Len=0"
"6.282505","5.9.29.183","172.19.0.3","TCP","1504","[TCP segment of a reassembled PDU]"
"6.282586","5.9.29.183","172.19.0.3","TCP","1516","9002 → 43520 [PSH, ACK] Seq=306813 Ack=18919 Win=65535 Len=1460 [TCP segment of a reassembled PDU]"
"6.282602","172.19.0.3","5.9.29.183","TCP","56","43520 → 9002 [ACK] Seq=18919 Ack=308273 Win=8458 Len=0"
"6.282605","5.9.29.183","172.19.0.3","TLSv1.2","1516","Application Data [TCP segment of a reassembled PDU]"
"6.282673","5.9.29.183","172.19.0.3","TCP","1213","9002 → 43520 [PSH, ACK] Seq=309733 Ack=18919 Win=65535 Len=1157 [TCP segment of a reassembled PDU]"
"6.282680","5.9.29.183","172.19.0.3","TCP","1516","9002 → 43520 [PSH, ACK] Seq=310890 Ack=18919 Win=65535 Len=1460 [TCP segment of a reassembled PDU]"
"6.282683","5.9.29.183","172.19.0.3","TLSv1.2","1492","Application Data [TCP segment of a reassembled PDU]"
"6.282713","172.19.0.3","5.9.29.183","TCP","56","43520 → 9002 [ACK] Seq=18919 Ack=313786 Win=8426 Len=0"
"6.298569","5.9.29.183","172.19.0.3","TLSv1.2","460","Application Data"
"6.324806","5.9.29.183","172.19.0.3","TCP","1516","[TCP segment of a reassembled PDU]"
"6.324825","172.19.0.3","5.9.29.183","TCP","56","43520 → 9002 [ACK] Seq=18919 Ack=315650 Win=8466 Len=0"
"6.324897","5.9.29.183","172.19.0.3","TLSv1.2","1195","Application Data"
"6.335180","5.9.29.183","172.19.0.3","TCP","1516","[TCP segment of a reassembled PDU]"
"6.335200","172.19.0.3","5.9.29.183","TCP","56","43520 → 9002 [ACK] Seq=18919 Ack=318249 Win=8466 Len=0"
"6.335327","5.9.29.183","172.19.0.3","TCP","1516","9002 → 43520 [PSH, ACK] Seq=318249 Ack=18919 Win=65535 Len=1460 [TCP segment of a reassembled PDU]"
"6.335403","5.9.29.183","172.19.0.3","TLSv1.2","1480","Application Data [TCP segment of a reassembled PDU]"
"6.335409","5.9.29.183","172.19.0.3","TCP","1516","9002 → 43520 [PSH, ACK] Seq=321133 Ack=18919 Win=65535 Len=1460 [TCP segment of a reassembled PDU]"
"6.335424","172.19.0.3","5.9.29.183","TCP","56","43520 → 9002 [ACK] Seq=18919 Ack=321133 Win=8450 Len=0"
"6.335489","5.9.29.183","172.19.0.3","TCP","1516","9002 → 43520 [PSH, ACK] Seq=322593 Ack=18919 Win=65535 Len=1460 [TCP segment of a reassembled PDU]"
"6.335497","5.9.29.183","172.19.0.3","TLSv1.2","1516","Application Data [TCP segment of a reassembled PDU]"
"6.335577","172.19.0.3","5.9.29.183","TCP","56","43520 → 9002 [ACK] Seq=18919 Ack=325513 Win=8426 Len=0"
"6.335607","5.9.29.183","172.19.0.3","TCP","1516","9002 → 43520 [PSH, ACK] Seq=325513 Ack=18919 Win=65535 Len=1460 [TCP segment of a reassembled PDU]"
"6.335613","5.9.29.183","172.19.0.3","TCP","1456","9002 → 43520 [PSH, ACK] Seq=326973 Ack=18919 Win=65535 Len=1400 [TCP segment of a reassembled PDU]"
"6.335798","172.19.0.3","5.9.29.183","TCP","56","43520 → 9002 [ACK] Seq=18919 Ack=328373 Win=8410 Len=0"
"6.341583","5.9.29.183","172.19.0.3","TLSv1.2","381","Application Data"
"6.341959","172.19.0.3","5.9.29.183","TLSv1.2","599","Application Data"
"6.342205","5.9.29.183","172.19.0.3","TCP","56","9002 → 43520 [ACK] Seq=328698 Ack=19462 Win=65535 Len=0"
"6.351912","5.9.29.183","172.19.0.3","TCP","1516","[TCP segment of a reassembled PDU]"
"6.351961","5.9.29.183","172.19.0.3","TCP","1516","9002 → 43520 [PSH, ACK] Seq=330158 Ack=19462 Win=65535 Len=1460 [TCP segment of a reassembled PDU]"
"6.351967","5.9.29.183","172.19.0.3","TLSv1.2","1480","Application Data [TCP segment of a reassembled PDU]"
"6.351970","5.9.29.183","172.19.0.3","TCP","1516","9002 → 43520 [PSH, ACK] Seq=333042 Ack=19462 Win=65535 Len=1460 [TCP segment of a reassembled PDU]"
"6.351987","5.9.29.183","172.19.0.3","TCP","1516","9002 → 43520 [PSH, ACK] Seq=334502 Ack=19462 Win=65535 Len=1460 [TCP segment of a reassembled PDU]"
"6.351990","5.9.29.183","172.19.0.3","TCP","886","9002 → 43520 [PSH, ACK] Seq=335962 Ack=19462 Win=65535 Len=830 [TCP segment of a reassembled PDU]"
"6.352062","5.9.29.183","172.19.0.3","TLSv1.2","1516","Application Data [TCP segment of a reassembled PDU]"
"6.352066","5.9.29.183","172.19.0.3","TCP","1516","9002 → 43520 [PSH, ACK] Seq=338252 Ack=19462 Win=65535 Len=1460 [TCP segment of a reassembled PDU]"
"6.352113","5.9.29.183","172.19.0.3","TLSv1.2","1516","Application Data [TCP segment of a reassembled PDU]"
"6.352119","5.9.29.183","172.19.0.3","TCP","1516","9002 → 43520 [PSH, ACK] Seq=341172 Ack=19462 Win=65535 Len=1460 [TCP segment of a reassembled PDU]"
"6.352139","172.19.0.3","5.9.29.183","TCP","56","43520 → 9002 [ACK] Seq=19462 Ack=341172 Win=8402 Len=0"
"6.352242","5.9.29.183","172.19.0.3","TCP","1516","9002 → 43520 [PSH, ACK] Seq=342632 Ack=19462 Win=65535 Len=1460 [TCP segment of a reassembled PDU]"
"6.352250","5.9.29.183","172.19.0.3","TCP","590","9002 → 43520 [PSH, ACK] Seq=344092 Ack=19462 Win=65535 Len=534 [TCP segment of a reassembled PDU]"
"6.352385","172.19.0.3","5.9.29.183","TCP","56","43520 → 9002 [ACK] Seq=19462 Ack=344626 Win=8377 Len=0"
"6.356996","5.9.29.183","172.19.0.3","TLSv1.2","178","Application Data"
"6.368609","5.9.29.183","172.19.0.3","TCP","1504","[TCP segment of a reassembled PDU]"
"6.368627","172.19.0.3","5.9.29.183","TCP","56","43520 → 9002 [ACK] Seq=19462 Ack=346196 Win=8466 Len=0"
"6.368728","5.9.29.183","172.19.0.3","TCP","1516","9002 → 43520 [PSH, ACK] Seq=346196 Ack=19462 Win=65535 Len=1460 [TCP segment of a reassembled PDU]"
"6.368767","5.9.29.183","172.19.0.3","TLSv1.2","1492","Application Data [TCP segment of a reassembled PDU]"
"6.368837","172.19.0.3","5.9.29.183","TCP","56","43520 → 9002 [ACK] Seq=19462 Ack=349092 Win=8450 Len=0"
"6.368857","5.9.29.183","172.19.0.3","TCP","1516","9002 → 43520 [PSH, ACK] Seq=349092 Ack=19462 Win=65535 Len=1460 [TCP segment of a reassembled PDU]"
"6.368859","5.9.29.183","172.19.0.3","TCP","1516","9002 → 43520 [PSH, ACK] Seq=350552 Ack=19462 Win=65535 Len=1460 [TCP segment of a reassembled PDU]"
"6.368861","5.9.29.183","172.19.0.3","TLSv1.2","1480","Application Data [TCP segment of a reassembled PDU]"
"6.368882","172.19.0.3","5.9.29.183","TCP","56","43520 → 9002 [ACK] Seq=19462 Ack=353436 Win=8426 Len=0"
"6.368913","5.9.29.183","172.19.0.3","TCP","1504","9002 → 43520 [PSH, ACK] Seq=353436 Ack=19462 Win=65535 Len=1448 [TCP segment of a reassembled PDU]"
"6.374289","5.9.29.183","172.19.0.3","TLSv1.2","801","Application Data"
"6.374306","172.19.0.3","5.9.29.183","TCP","56","43520 → 9002 [ACK] Seq=19462 Ack=355629 Win=8466 Len=0"
"6.374702","172.19.0.3","5.9.29.183","TLSv1.2","1113","Application Data"
"6.374891","5.9.29.183","172.19.0.3","TCP","56","9002 → 43520 [ACK] Seq=355629 Ack=20519 Win=65535 Len=0"
"6.377808","5.9.29.183","172.19.0.3","TCP","1504","[TCP segment of a reassembled PDU]"
"6.390041","5.9.29.183","172.19.0.3","TLSv1.2","693","Application Data"
"6.390057","172.19.0.3","5.9.29.183","TCP","56","43520 → 9002 [ACK] Seq=20519 Ack=357714 Win=8466 Len=0"
"6.393305","5.9.29.183","172.19.0.3","TCP","1516","[TCP segment of a reassembled PDU]"
"6.393335","5.9.29.183","172.19.0.3","TCP","1492","9002 → 43520 [PSH, ACK] Seq=359174 Ack=20519 Win=65535 Len=1436 [TCP segment of a reassembled PDU]"
"6.393385","172.19.0.3","5.9.29.183","TCP","56","43520 → 9002 [ACK] Seq=20519 Ack=360610 Win=8458 Len=0"
"6.407297","5.9.29.183","172.19.0.3","TLSv1.2","787","Application Data"
"6.410247","5.9.29.183","172.19.0.3","TCP","1516","[TCP segment of a reassembled PDU]"
"6.410267","172.19.0.3","5.9.29.183","TCP","56","43520 → 9002 [ACK] Seq=20519 Ack=362801 Win=8466 Len=0"
"6.410312","5.9.29.183","172.19.0.3","TCP","1492","9002 → 43520 [PSH, ACK] Seq=362801 Ack=20519 Win=65535 Len=1436 [TCP segment of a reassembled PDU]"
"6.424755","5.9.29.183","172.19.0.3","TLSv1.2","273","Application Data"
"6.424774","172.19.0.3","5.9.29.183","TCP","56","43520 → 9002 [ACK] Seq=20519 Ack=364454 Win=8466 Len=0"
"6.426638","172.19.0.3","5.9.29.183","TLSv1.2","599","Application Data"
"6.426905","5.9.29.183","172.19.0.3","TCP","56","9002 → 43520 [ACK] Seq=364454 Ack=21062 Win=65535 Len=0"
"6.473861","5.9.29.183","172.19.0.3","TLSv1.2","599","Application Data"
"6.517136","172.19.0.3","5.9.29.183","TCP","56","43520 → 9002 [ACK] Seq=21062 Ack=364997 Win=8466 Len=0"
