_ws.col.Time,_ws.col.Source,_ws.col.Destination,_ws.col.Protocol,_ws.col.Length,_ws.col.Info
"0.000000","172.19.0.3","5.9.29.183","TLSv1.2","599","Application Data"
"0.000308","5.9.29.183","172.19.0.3","TCP","56","9002 → 43520 [ACK] Seq=1 Ack=544 Win=65535 Len=0"
"0.279800","5.9.29.183","172.19.0.3","TLSv1.2","599","Application Data"
"0.279855","172.19.0.3","5.9.29.183","TCP","56","43520 → 9002 [ACK] Seq=544 Ack=544 Win=8466 Len=0"
"0.280517","172.19.0.3","5.9.29.183","TLSv1.2","2141","Application Data"
"0.280728","5.9.29.183","172.19.0.3","TCP","56","9002 → 43520 [ACK] Seq=544 Ack=2004 Win=65535 Len=0"
"0.280781","5.9.29.183","172.19.0.3","TCP","56","9002 → 43520 [ACK] Seq=544 Ack=2629 Win=65535 Len=0"
"0.842289","5.9.29.183","172.19.0.3","TCP","1504","[TCP segment of a reassembled PDU]"
"0.842354","5.9.29.183","172.19.0.3","TLSv1.2","179","Application Data"
"0.842478","172.19.0.3","5.9.29.183","TCP","56","43520 → 9002 [ACK] Seq=2629 Ack=2115 Win=8458 Len=0"
"0.845461","172.19.0.3","5.9.29.183","TLSv1.2","599","Application Data"
"0.845716","5.9.29.183","172.19.0.3","TCP","56","9002 → 43520 [ACK] Seq=2115 Ack=3172 Win=65535 Len=0"
"1.148976","5.9.29.183","172.19.0.3","TLSv1.2","599","Application Data"
"1.149525","172.19.0.3","5.9.29.183","TLSv1.2","599","Application Data"
"1.149816","5.9.29.183","172.19.0.3","TCP","56","9002 → 43520 [ACK] Seq=2658 Ack=3715 Win=65535 Len=0"
"1.424194","5.9.29.183","172.19.0.3","TLSv1.2","599","Application Data"
"1.442226","5.9.29.183","172.19.0.3","TCP","1516","[TCP segment of a reassembled PDU]"
"1.442243","172.19.0.3","5.9.29.183","TCP","56","43520 → 9002 [ACK] Seq=3715 Ack=4661 Win=8466 Len=0"
"1.442278","5.9.29.183","172.19.0.3","TCP","1492","9002 → 43520 [PSH, ACK] Seq=4661 Ack=3715 Win=65535 Len=1436 [TCP segment of a reassembled PDU]"
"1.442289","5.9.29.183","172.19.0.3","TLSv1.2","787","Application Data"
"1.442402","172.19.0.3","5.9.29.183","TCP","56","43520 → 9002 [ACK] Seq=3715 Ack=6828 Win=8450 Len=0"
"1.476798","5.9.29.183","172.19.0.3","TCP","1516","[TCP segment of a reassembled PDU]"
"1.476847","5.9.29.183","172.19.0.3","TCP","1492","9002 → 43520 [PSH, ACK] Seq=8288 Ack=3715 Win=65535 Len=1436 [TCP segment of a reassembled PDU]"
"1.476860","172.19.0.3","5.9.29.183","TCP","56","43520 → 9002 [ACK] Seq=3715 Ack=9724 Win=8458 Len=0"
"1.476862","5.9.29.183","172.19.0.3","TLSv1.2","1237","Application Data"
"1.488374","5.9.29.183","172.19.0.3","TLSv1.2","1504","Application Data"
"1.488432","172.19.0.3","5.9.29.183","TCP","56","43520 → 9002 [ACK] Seq=3715 Ack=12353 Win=8466 Len=0"
"1.488590","5.9.29.183","172.19.0.3","TCP","1504","9002 → 43520 [PSH, ACK] Seq=12353 Ack=3715 Win=65535 Len=1448 [TCP segment of a reassembled PDU]"
"1.488851","5.9.29.183","172.19.0.3","TLSv1.2","1516","Application Data [TCP segment of a reassembled PDU]"
"1.488919","5.9.29.183","172.19.0.3","TCP","1492","9002 → 43520 [PSH, ACK] Seq=15261 Ack=3715 Win=65535 Len=1436 [TCP segment of a reassembled PDU]"
"1.488954","172.19.0.3","5.9.29.183","TCP","56","43520 → 9002 [ACK] Seq=3715 Ack=16697 Win=8442 Len=0"
"1.493337","5.9.29.183","172.19.0.3","TLSv1.2","1504","Application Data [TCP segment of a reassembled PDU]"
"1.497360","5.9.29.183","172.19.0.3","TLSv1.2","706","Application Data"
"1.497371","172.19.0.3","5.9.29.183","TCP","56","43520 → 9002 [ACK] Seq=3715 Ack=18795 Win=8466 Len=0"
"1.511536","5.9.29.183","172.19.0.3","TCP","1516","[TCP segment of a reassembled PDU]"
"1.511578","5.9.29.183","172.19.0.3","TCP","1492","9002 → 43520 [PSH, ACK] Seq=20255 Ack=3715 Win=65535 Len=1436 [TCP segment of a reassembled PDU]"
"1.511711","172.19.0.3","5.9.29.183","TCP","56","43520 → 9002 [ACK] Seq=3715 Ack=21691 Win=8456 Len=0"
"1.513329","5.9.29.183","172.19.0.3","TLSv1.2","1330","Application Data, Application Data"
"1.513604","172.19.0.3","5.9.29.183","TLSv1.2","599","Application Data"
"1.513824","5.9.29.183","172.19.0.3","TCP","56","9002 → 43520 [ACK] Seq=22965 Ack=4258 Win=65535 Len=0"
"1.545040","5.9.29.183","172.19.0.3","TCP","1504","[TCP segment of a reassembled PDU]"
"1.545122","5.9.29.183","172.19.0.3","TCP","1504","9002 → 43520 [PSH, ACK] Seq=24413 Ack=4258 Win=65535 Len=1448 [TCP segment of a reassembled PDU]"
"1.545186","5.9.29.183","172.19.0.3","TLSv1.2","1237","Application Data"
"1.545220","172.19.0.3","5.9.29.183","TCP","56","43520 → 9002 [ACK] Seq=4258 Ack=27042 Win=8450 Len=0"
"1.561469","5.9.29.183","172.19.0.3","TLSv1.2","1177","Application Data"
"1.565951","172.19.0.3","5.9.29.183","TLSv1.2","599","Application Data"
"1.566233","5.9.29.183","172.19.0.3","TCP","56","9002 → 43520 [ACK] Seq=28163 Ack=4801 Win=65535 Len=0"
"2.026264","5.9.29.183","172.19.0.3","TLSv1.2","599","Application Data"
"2.026847","172.19.0.3","5.9.29.183","TLSv1.2","599","Application Data"
"2.027096","5.9.29.183","172.19.0.3","TCP","56","9002 → 43520 [ACK] Seq=28706 Ack=5344 Win=65535 Len=0"
"2.374067","5.9.29.183","172.19.0.3","TCP","1504","[TCP segment of a reassembled PDU]"
"2.374134","5.9.29.183","172.19.0.3","TCP","1516","9002 → 43520 [PSH, ACK] Seq=30154 Ack=5344 Win=65535 Len=1460 [TCP segment of a reassembled PDU]"
"2.374143","5.9.29.183","172.19.0.3","TLSv1.2","775","Application Data"
"2.374243","172.19.0.3","5.9.29.183","TCP","56","43520 → 9002 [ACK] Seq=5344 Ack=32333 Win=8450 Len=0"
"2.422007","5.9.29.183","172.19.0.3","TCP","1504","[TCP segment of a reassembled PDU]"
"2.422061","5.9.29.183","172.19.0.3","TCP","1516","9002 → 43520 [PSH, ACK] Seq=33781 Ack=5344 Win=65535 Len=1460 [TCP segment of a reassembled PDU]"
"2.422080","172.19.0.3","5.9.29.183","TCP","56","43520 → 9002 [ACK] Seq=5344 Ack=35241 Win=8456 Len=0"
"2.422082","5.9.29.183","172.19.0.3","TLSv1.2","775","Application Data"
"2.434826","5.9.29.183","172.19.0.3","TCP","1504","[TCP segment of a reassembled PDU]"
"2.434847","172.19.0.3","5.9.29.183","TCP","56","43520 → 9002 [ACK] Seq=5344 Ack=37408 Win=8466 Len=0"
"2.434890","5.9.29.183","172.19.0.3","TCP","1516","9002 → 43520 [PSH, ACK] Seq=37408 Ack=5344 Win=65535 Len=1460 [TCP segment of a reassembled PDU]"
"2.434905","5.9.29.183","172.19.0.3","TLSv1.2","1492","Application Data [TCP segment of a reassembled PDU]"
"2.435082","172.19.0.3","5.9.29.183","TCP","56","43520 → 9002 [ACK] Seq=5344 Ack=40304 Win=8450 Len=0"
"2.437282","5.9.29.183","172.19.0.3","TLSv1.2","396","Application Data"
"2.440461","172.19.0.3","5.9.29.183","TLSv1.2","599","Application Data"
"2.440739","5.9.29.183","172.19.0.3","TCP","56","9002 → 43520 [ACK] Seq=40644 Ack=5887 Win=65535 Len=0"
"3.020129","5.9.29.183","172.19.0.3","TLSv1.2","599","Application Data"
"3.020657","172.19.0.3","5.9.29.183","TLSv1.2","599","Application Data"
"3.020880","5.9.29.183","172.19.0.3","TCP","56","9002 → 43520 [ACK] Seq=41187 Ack=6430 Win=65535 Len=0"
"3.370170","5.9.29.183","172.19.0.3","TCP","1504","[TCP segment of a reassembled PDU]"
"3.370222","5.9.29.183","172.19.0.3","TCP","1516","9002 → 43520 [PSH, ACK] Seq=42635 Ack=6430 Win=65535 Len=1460 [TCP segment of a reassembled PDU]"
"3.370230","5.9.29.183","172.19.0.3","TLSv1.2","775","Application Data"
"3.370411","172.19.0.3","5.9.29.183","TCP","56","43520 → 9002 [ACK] Seq=6430 Ack=44814 Win=8450 Len=0"
"3.404994","5.9.29.183","172.19.0.3","TCP","1504","[TCP segment of a reassembled PDU]"
"3.405047","5.9.29.183","172.19.0.3","TCP","1516","9002 → 43520 [PSH, ACK] Seq=46262 Ack=6430 Win=65535 Len=1460 [TCP segment of a reassembled PDU]"
"3.405060","172.19.0.3","5.9.29.183","TCP","56","43520 → 9002 [ACK] Seq=6430 Ack=47722 Win=8458 Len=0"
"3.405062","5.9.29.183","172.19.0.3","TLSv1.2","775","Application Data"
"3.422513","5.9.29.183","172.19.0.3","TCP","1516","[TCP segment of a reassembled PDU]"
"3.422530","172.19.0.3","5.9.29.183","TCP","56","43520 → 9002 [ACK] Seq=6430 Ack=49901 Win=8466 Len=0"
"3.422565","5.9.29.183","172.19.0.3","TCP","1492","9002 → 43520 [PSH, ACK] Seq=49901 Ack=6430 Win=65535 Len=1436 [TCP segment of a reassembled PDU]"
"3.422573","5.9.29.183","172.19.0.3","TLSv1.2","1237","Application Data"
"3.422678","172.19.0.3","5.9.29.183","TCP","56","43520 → 9002 [ACK] Seq=6430 Ack=52518 Win=8450 Len=0"
"3.439449","5.9.29.183","172.19.0.3","TLSv1.2","149","Application Data"
"3.452318","5.9.29.183","172.19.0.3","TCP","1516","[TCP segment of a reassembled PDU]"
"3.452342","172.19.0.3","5.9.29.183","TCP","56","43520 → 9002 [ACK] Seq=6430 Ack=54071 Win=8466 Len=0"
"3.452396","5.9.29.183","172.19.0.3","TCP","1516","9002 → 43520 [PSH, ACK] Seq=54071 Ack=6430 Win=65535 Len=1460 [TCP segment of a reassembled PDU]"
"3.452449","5.9.29.183","172.19.0.3","TLSv1.2","1516","Application Data [TCP segment of a reassembled PDU]"
"3.452456","5.9.29.183","172.19.0.3","TCP","1516","9002 → 43520 [PSH, ACK] Seq=56991 Ack=6430 Win=65535 Len=1460 [TCP segment of a reassembled PDU]"
"3.452464","5.9.29.183","172.19.0.3","TCP","1456","9002 → 43520 [PSH, ACK] Seq=58451 Ack=6430 Win=65535 Len=1400 [TCP segment of a reassembled PDU]"
"3.452635","172.19.0.3","5.9.29.183","TCP","56","43520 → 9002 [ACK] Seq=6430 Ack=59851 Win=8432 Len=0"
"3.454825","5.9.29.183","172.19.0.3","TLSv1.2","584","Application Data"
"3.485303","5.9.29.183","172.19.0.3","TCP","419","[TCP segment of a reassembled PDU]"
"3.485345","172.19.0.3","5.9.29.183","TCP","56","43520 → 9002 [ACK] Seq=6430 Ack=60742 Win=8466 Len=0"
"3.485381","5.9.29.183","172.19.0.3","TCP","1516","9002 → 43520 [PSH, ACK] Seq=60742 Ack=6430 Win=65535 Len=1460 [TCP segment of a reassembled PDU]"
"3.485434","5.9.29.183","172.19.0.3","TCP","1516","9002 → 43520 [PSH, ACK] Seq=62202 Ack=6430 Win=65535 Len=1460 [TCP segment of a reassembled PDU]"
"3.485523","172.19.0.3","5.9.29.183","TCP","56","43520 → 9002 [ACK] Seq=6430 Ack=63662 Win=8450 Len=0"
"3.485542","5.9.29.183","172.19.0.3","TLSv1.2","1516","Application Data [TCP segment of a reassembled PDU]"
"3.485549","5.9.29.183","172.19.0.3","TCP","838","9002 → 43520 [PSH, ACK] Seq=65122 Ack=6430 Win=65535 Len=782 [TCP segment of a reassembled PDU]"
"3.485552","5.9.29.183","172.19.0.3","TCP","1516","9002 → 43520 [PSH, ACK] Seq=65904 Ack=6430 Win=65535 Len=1460 [TCP segment of a reassembled PDU]"
"3.485555","5.9.29.183","172.19.0.3","TLSv1.2","1516","Application Data [TCP segment of a reassembled PDU]"
"3.485619","172.19.0.3","5.9.29.183","TCP","56","43520 → 9002 [ACK] Seq=6430 Ack=68824 Win=8418 Len=0"
"3.485762","5.9.29.183","172.19.0.3","TCP","1516","9002 → 43520 [PSH, ACK] Seq=68824 Ack=6430 Win=65535 Len=1460 [TCP segment of a reassembled PDU]"
"3.485773","5.9.29.183","172.19.0.3","TCP","1468","9002 → 43520 [PSH, ACK] Seq=70284 Ack=6430 Win=65535 Len=1412 [TCP segment of a reassembled PDU]"
"3.485826","172.19.0.3","5.9.29.183","TCP","56","43520 → 9002 [ACK] Seq=6430 Ack=71696 Win=8402 Len=0"
"3.486060","172.19.0.3","5.9.29.183","TLSv1.2","599","Application Data"
"3.486332","5.9.29.183","172.19.0.3","TCP","56","9002 → 43520 [ACK] Seq=71696 Ack=6973 Win=65535 Len=0"
"3.501657","5.9.29.183","172.19.0.3","TLSv1.2","1191","Application Data, Application Data"
"3.517825","5.9.29.183","172.19.0.3","TCP","1504","[TCP segment of a reassembled PDU]"
"3.517861","172.19.0.3","5.9.29.183","TCP","56","43520 → 9002 [ACK] Seq=6973 Ack=74279 Win=8466 Len=0"
"3.517908","5.9.29.183","172.19.0.3","TCP","1516","9002 → 43520 [PSH, ACK] Seq=74279 Ack=6973 Win=65535 Len=1460 [TCP segment of a reassembled PDU]"
"3.517920","5.9.29.183","172.19.0.3","TLSv1.2","1225","Application Data"
"3.518049","172.19.0.3","5.9.29.183","TCP","56","43520 → 9002 [ACK] Seq=6973 Ack=76908 Win=8450 Len=0"
"3.518506","172.19.0.3","5.9.29.183","TLSv1.2","599","Application Data"
"3.518716","5.9.29.183","172.19.0.3","TCP","56","9002 → 43520 [ACK] Seq=76908 Ack=7516 Win=65535 Len=0"
"3.533001","5.9.29.183","172.19.0.3","TLSv1.2","1177","Application Data"
"3.560205","5.9.29.183","172.19.0.3","TCP","1504","[TCP segment of a reassembled PDU]"
"3.560230","172.19.0.3","5.9.29.183","TCP","56","43520 → 9002 [ACK] Seq=7516 Ack=79477 Win=8466 Len=0"
"3.560388","5.9.29.183","172.19.0.3","TCP","1516","9002 → 43520 [PSH, ACK] Seq=79477 Ack=7516 Win=65535 Len=1460 [TCP segment of a reassembled PDU]"
"3.560397","5.9.29.183","172.19.0.3","TLSv1.2","1225","Application Data"
"3.560406","172.19.0.3","5.9.29.183","TCP","56","43520 → 9002 [ACK] Seq=7516 Ack=82106 Win=8466 Len=0"
"3.560467","5.9.29.183","172.19.0.3","TCP","1516","[TCP segment of a reassembled PDU]"
"3.560509","5.9.29.183","172.19.0.3","TCP","1492","9002 → 43520 [PSH, ACK] Seq=83566 Ack=7516 Win=65535 Len=1436 [TCP segment of a reassembled PDU]"
"3.560616","172.19.0.3","5.9.29.183","TCP","56","43520 → 9002 [ACK] Seq=7516 Ack=85002 Win=8456 Len=0"
"3.576813","5.9.29.183","172.19.0.3","TLSv1.2","851","Application Data"
"3.581152","5.9.29.183","172.19.0.3","TCP","1516","[TCP segment of a reassembled PDU]"
"3.581172","172.19.0.3","5.9.29.183","TCP","56","43520 → 9002 [ACK] Seq=7516 Ack=87257 Win=8466 Len=0"
"3.581210","5.9.29.183","172.19.0.3","TCP","1516","9002 → 43520 [PSH, ACK] Seq=87257 Ack=7516 Win=65535 Len=1460 [TCP segment of a reassembled PDU]"
"3.581240","5.9.29.183","172.19.0.3","TLSv1.2","1480","Application Data [TCP segment of a reassembled PDU]"
"3.581246","5.9.29.183","172.19.0.3","TCP","1504","9002 → 43520 [PSH, ACK] Seq=90141 Ack=7516 Win=65535 Len=1448 [TCP segment of a reassembled PDU]"
"3.581413","172.19.0.3","5.9.29.183","TCP","56","43520 → 9002 [ACK] Seq=7516 Ack=91589 Win=8442 Len=0"
"3.591974","5.9.29.183","172.19.0.3","TLSv1.2","490","Application Data"
"3.599202","5.9.29.183","172.19.0.3","TCP","1516","[TCP segment of a reassembled PDU]"
"3.599220","172.19.0.3","5.9.29.183","TCP","56","43520 → 9002 [ACK] Seq=7516 Ack=93483 Win=8466 Len=0"
"3.599257","5.9.29.183","172.19.0.3","TCP","1516","9002 → 43520 [PSH, ACK] Seq=93483 Ack=7516 Win=65535 Len=1460 [TCP segment of a reassembled PDU]"
"3.599286","5.9.29.183","172.19.0.3","TLSv1.2","1516","Application Data [TCP segment of a reassembled PDU]"
"3.599291","5.9.29.183","172.19.0.3","TCP","1468","9002 → 43520 [PSH, ACK] Seq=96403 Ack=7516 Win=65535 Len=1412 [TCP segment of a reassembled PDU]"
"3.599419","172.19.0.3","5.9.29.183","TCP","56","43520 → 9002 [ACK] Seq=7516 Ack=97815 Win=8442 Len=0"
"3.599623","172.19.0.3","5.9.29.183","TLSv1.2","599","Application Data"
"3.599856","5.9.29.183","172.19.0.3","TCP","56","9002 → 43520 [ACK] Seq=97815 Ack=8059 Win=65535 Len=0"
"3.607323","5.9.29.183","172.19.0.3","TLSv1.2","490","Application Data"
"3.621805","5.9.29.183","172.19.0.3","TCP","1516","[TCP segment of a reassembled PDU]"
"3.621830","172.19.0.3","5.9.29.183","TCP","56","43520 → 9002 [ACK] Seq=8059 Ack=99709 Win=8466 Len=0"
"3.621896","5.9.29.183","172.19.0.3","TCP","1492","9002 → 43520 [PSH, ACK] Seq=99709 Ack=8059 Win=65535 Len=1436 [TCP segment of a reassembled PDU]"
"3.622245","5.9.29.183","172.19.0.3","TLSv1.2","787","Application Data"
"3.622252","172.19.0.3","5.9.29.183","TCP","56","43520 → 9002 [ACK] Seq=8059 Ack=101876 Win=8466 Len=0"
"3.632651","5.9.29.183","172.19.0.3","TCP","1504","[TCP segment of a reassembled PDU]"
"3.632724","5.9.29.183","172.19.0.3","TCP","1516","9002 → 43520 [PSH, ACK] Seq=103324 Ack=8059 Win=65535 Len=1460 [TCP segment of a reassembled PDU]"
"3.632731","5.9.29.183","172.19.0.3","TLSv1.2","1516","Application Data [TCP segment of a reassembled PDU]"
"3.632733","5.9.29.183","172.19.0.3","TCP","1480","9002 → 43520 [PSH, ACK] Seq=106244 Ack=8059 Win=65535 Len=1424 [TCP segment of a reassembled PDU]"
"3.632764","5.9.29.183","172.19.0.3","TCP","1504","9002 → 43520 [PSH, ACK] Seq=107668 Ack=8059 Win=65535 Len=1448 [TCP segment of a reassembled PDU]"
"3.632836","172.19.0.3","5.9.29.183","TCP","56","43520 → 9002 [ACK] Seq=8059 Ack=109116 Win=8432 Len=0"
"3.639591","5.9.29.183","172.19.0.3","TLSv1.2","584","Application Data"
"3.665745","5.9.29.183","172.19.0.3","TCP","1516","[TCP segment of a reassembled PDU]"
"3.665795","172.19.0.3","5.9.29.183","TCP","56","43520 → 9002 [ACK] Seq=8059 Ack=111104 Win=8466 Len=0"
"3.665860","5.9.29.183","172.19.0.3","TCP","1492","9002 → 43520 [PSH, ACK] Seq=111104 Ack=8059 Win=65535 Len=1436 [TCP segment of a reassembled PDU]"
"3.665876","5.9.29.183","172.19.0.3","TLSv1.2","1516","Application Data [TCP segment of a reassembled PDU]"
"3.666080","5.9.29.183","172.19.0.3","TCP","1516","9002 → 43520 [PSH, ACK] Seq=114000 Ack=8059 Win=65535 Len=1460 [TCP segment of a reassembled PDU]"
"3.666089","5.9.29.183","172.19.0.3","TCP","1213","9002 → 43520 [PSH, ACK] Seq=115460 Ack=8059 Win=65535 Len=1157 [TCP segment of a reassembled PDU]"
"3.666113","172.19.0.3","5.9.29.183","TCP","56","43520 → 9002 [ACK] Seq=8059 Ack=116617 Win=8434 Len=0"
"3.680716","5.9.29.183","172.19.0.3","TLSv1.2","337","Application Data"
"3.682619","5.9.29.183","172.19.0.3","TCP","1504","[TCP segment of a reassembled PDU]"
"3.682636","172.19.0.3","5.9.29.183","TCP","56","43520 → 9002 [ACK] Seq=8059 Ack=118346 Win=8466 Len=0"
"3.682669","5.9.29.183","172.19.0.3","TCP","1504","9002 → 43520 [PSH, ACK] Seq=118346 Ack=8059 Win=65535 Len=1448 [TCP segment of a reassembled PDU]"
"3.682677","5.9.29.183","172.19.0.3","TLSv1.2","1516","Application Data [TCP segment of a reassembled PDU]"
"3.682679","5.9.29.183","172.19.0.3","TCP","1492","9002 → 43520 [PSH, ACK] Seq=121254 Ack=8059 Win=65535 Len=1436 [TCP segment of a reassembled PDU]"
"3.682681","5.9.29.183","172.19.0.3","TCP","1504","9002 → 43520 [PSH, ACK] Seq=122690 Ack=8059 Win=65535 Len=1448 [TCP segment of a reassembled PDU]"
"3.682766","172.19.0.3","5.9.29.183","TCP","56","43520 → 9002 [ACK] Seq=8059 Ack=124138 Win=8434 Len=0"
"3.682976","172.19.0.3","5.9.29.183","TLSv1.2","599","Application Data"
"3.683211","5.9.29.183","172.19.0.3","TCP","56","9002 → 43520 [ACK] Seq=124138 Ack=8602 Win=65535 Len=0"
"3.696332","5.9.29.183","172.19.0.3","TLSv1.2","584","Application Data"
"3.721213","5.9.29.183","172.19.0.3","TLSv1.2","1113","Application Data"
"3.721231","172.19.0.3","5.9.29.183","TCP","56","43520 → 9002 [ACK] Seq=8602 Ack=125723 Win=8466 Len=0"
"3.725752","172.19.0.3","5.9.29.183","TLSv1.2","599","Application Data"
"3.726042","5.9.29.183","172.19.0.3","TCP","56","9002 → 43520 [ACK] Seq=125723 Ack=9145 Win=65535 Len=0"
"4.137415","5.9.29.183","172.19.0.3","TLSv1.2","599","Application Data"
"4.137936","172.19.0.3","5.9.29.183","TLSv1.2","599","Application Data"
"4.138153","5.9.29.183","172.19.0.3","TCP","56","9002 → 43520 [ACK] Seq=126266 Ack=9688 Win=65535 Len=0"
"4.433848","5.9.29.183","172.19.0.3","TCP","68","[TCP segment of a reassembled PDU]"
"4.433915","5.9.29.183","172.19.0.3","TLSv1.2","587","Application Data"
"4.434027","172.19.0.3","5.9.29.183","TCP","56","43520 → 9002 [ACK] Seq=9688 Ack=126809 Win=8466 Len=0"
"4.450245","5.9.29.183","172.19.0.3","TCP","1516","[TCP segment of a reassembled PDU]"
"4.450302","5.9.29.183","172.19.0.3","TCP","1516","9002 → 43520 [PSH, ACK] Seq=128269 Ack=9688 Win=65535 Len=1460 [TCP segment of a reassembled PDU]"
"4.450312","5.9.29.183","172.19.0.3","TLSv1.2","763","Application Data"
"4.450501","172.19.0.3","5.9.29.183","TCP","56","43520 → 9002 [ACK] Seq=9688 Ack=130436 Win=8450 Len=0"
"4.450757","172.19.0.3","5.9.29.183","TLSv1.2","599","Application Data"
"4.450966","5.9.29.183","172.19.0.3","TCP","56","9002 → 43520 [ACK] Seq=130436 Ack=10231 Win=65535 Len=0"
"4.506989","5.9.29.183","172.19.0.3","TCP","1516","[TCP segment of a reassembled PDU]"
"4.507036","5.9.29.183","172.19.0.3","TCP","1492","9002 → 43520 [PSH, ACK] Seq=131896 Ack=10231 Win=65535 Len=1436 [TCP segment of a reassembled PDU]"
"4.507046","5.9.29.183","172.19.0.3","TLSv1.2","787","Application Data"
"4.507155","172.19.0.3","5.9.29.183","TCP","56","43520 → 9002 [ACK] Seq=10231 Ack=134063 Win=8448 Len=0"
"4.520853","5.9.29.183","172.19.0.3","TCP","1516","[TCP segment of a reassembled PDU]"
"4.520911","5.9.29.183","172.19.0.3","TCP","1492","9002 → 43520 [PSH, ACK] Seq=135523 Ack=10231 Win=65535 Len=1436 [TCP segment of a reassembled PDU]"
"4.520930","172.19.0.3","5.9.29.183","TCP","56","43520 → 9002 [ACK] Seq=10231 Ack=136959 Win=8458 Len=0"
"4.520935","5.9.29.183","172.19.0.3","TLSv1.2","1504","Application Data [TCP segment of a reassembled PDU]"
"4.521015","5.9.29.183","172.19.0.3","TCP","1504","9002 → 43520 [PSH, ACK] Seq=138407 Ack=10231 Win=65535 Len=1448 [TCP segment of a reassembled PDU]"
"4.521026","5.9.29.183","172.19.0.3","TCP","1504","9002 → 43520 [PSH, ACK] Seq=139855 Ack=10231 Win=65535 Len=1448 [TCP segment of a reassembled PDU]"
"4.521114","172.19.0.3","5.9.29.183","TCP","56","43520 → 9002 [ACK] Seq=10231 Ack=141303 Win=8434 Len=0"
"4.524985","5.9.29.183","172.19.0.3","TLSv1.2","1127","Application Data, Application Data"
"4.565492","172.19.0.3","5.9.29.183","TCP","56","43520 → 9002 [ACK] Seq=10231 Ack=142374 Win=8466 Len=0"
"4.575114","5.9.29.183","172.19.0.3","TCP","1504","[TCP segment of a reassembled PDU]"
"4.575135","172.19.0.3","5.9.29.183","TCP","56","43520 → 9002 [ACK] Seq=10231 Ack=143822 Win=8466 Len=0"
"4.575173","5.9.29.183","172.19.0.3","TCP","1516","9002 → 43520 [PSH, ACK] Seq=143822 Ack=10231 Win=65535 Len=1460 [TCP segment of a reassembled PDU]"
"4.575190","172.19.0.3","5.9.29.183","TCP","56","43520 → 9002 [ACK] Seq=10231 Ack=145282 Win=8458 Len=0"
"4.575191","5.9.29.183","172.19.0.3","TLSv1.2","1225","Application Data"
"4.575197","172.19.0.3","5.9.29.183","TCP","56","43520 → 9002 [ACK] Seq=10231 Ack=146451 Win=8450 Len=0"
"4.590560","5.9.29.183","172.19.0.3","TLSv1.2","149","Application Data"
"4.590588","172.19.0.3","5.9.29.183","TCP","56","43520 → 9002 [ACK] Seq=10231 Ack=146544 Win=8466 Len=0"
"4.591909","5.9.29.183","172.19.0.3","TCP","1504","[TCP segment of a reassembled PDU]"
"4.591926","172.19.0.3","5.9.29.183","TCP","56","43520 → 9002 [ACK] Seq=10231 Ack=147992 Win=8466 Len=0"
"4.591979","5.9.29.183","172.19.0.3","TCP","1516","9002 → 43520 [PSH, ACK] Seq=147992 Ack=10231 Win=65535 Len=1460 [TCP segment of a reassembled PDU]"
"4.591994","172.19.0.3","5.9.29.183","TCP","56","43520 → 9002 [ACK] Seq=10231 Ack=149452 Win=8458 Len=0"
"4.592117","5.9.29.183","172.19.0.3","TLSv1.2","1492","Application Data [TCP segment of a reassembled PDU]"
"4.592127","172.19.0.3","5.9.29.183","TCP","56","43520 → 9002 [ACK] Seq=10231 Ack=150888 Win=8466 Len=0"
"4.592157","5.9.29.183","172.19.0.3","TCP","1516","9002 → 43520 [PSH, ACK] Seq=150888 Ack=10231 Win=65535 Len=1460 [TCP segment of a reassembled PDU]"
"4.592165","172.19.0.3","5.9.29.183","TCP","56","43520 → 9002 [ACK] Seq=10231 Ack=152348 Win=8458 Len=0"
"4.592167","5.9.29.183","172.19.0.3","TCP","1492","9002 → 43520 [PSH, ACK] Seq=152348 Ack=10231 Win=65535 Len=1436 [TCP segment of a reassembled PDU]"
"4.592170","172.19.0.3","5.9.29.183","TCP","56","43520 → 9002 [ACK] Seq=10231 Ack=153784 Win=8450 Len=0"
"4.605474","5.9.29.183","172.19.0.3","TLSv1.2","584","Application Data"
"4.605729","172.19.0.3","5.9.29.183","TCP","56","43520 → 9002 [ACK] Seq=10231 Ack=154312 Win=8466 Len=0"
"4.606082","172.19.0.3","5.9.29.183","TLSv1.2","599","Application Data"
"4.606601","5.9.29.183","172.19.0.3","TCP","56","9002 → 43520 [ACK] Seq=154312 Ack=10774 Win=65535 Len=0"
"4.615455","5.9.29.183","172.19.0.3","TCP","1504","[TCP segment of a reassembled PDU]"
"4.615504","5.9.29.183","172.19.0.3","TCP","1504","9002 → 43520 [PSH, ACK] Seq=155760 Ack=10774 Win=65535 Len=1448 [TCP segment of a reassembled PDU]"
"4.615635","172.19.0.3","5.9.29.183","TCP","56","43520 → 9002 [ACK] Seq=10774 Ack=157208 Win=8456 Len=0"
"4.620629","5.9.29.183","172.19.0.3","TLSv1.2","1330","Application Data, Application Data"
"4.638744","5.9.29.183","172.19.0.3","TCP","1516","[TCP segment of a reassembled PDU]"
"4.638783","172.19.0.3","5.9.29.183","TCP","56","43520 → 9002 [ACK] Seq=10774 Ack=159942 Win=8466 Len=0"
"4.638854","5.9.29.183","172.19.0.3","TCP","1516","9002 → 43520 [PSH, ACK] Seq=159942 Ack=10774 Win=65535 Len=1460 [TCP segment of a reassembled PDU]"
"4.638889","5.9.29.183","172.19.0.3","TLSv1.2","1213","Application Data"
"4.639110","172.19.0.3","5.9.29.183","TCP","56","43520 → 9002 [ACK] Seq=10774 Ack=162559 Win=8450 Len=0"
"4.654237","5.9.29.183","172.19.0.3","TLSv1.2","149","Application Data"
"4.658420","5.9.29.183","172.19.0.3","TCP","1504","[TCP segment of a reassembled PDU]"
"4.658451","172.19.0.3","5.9.29.183","TCP","56","43520 → 9002 [ACK] Seq=10774 Ack=164100 Win=8466 Len=0"
"4.669389","5.9.29.183","172.19.0.3","TLSv1.2","179","Application Data"
"4.673553","172.19.0.3","5.9.29.183","TLSv1.2","599","Application Data"
"4.674047","5.9.29.183","172.19.0.3","TCP","56","9002 → 43520 [ACK] Seq=164223 Ack=11317 Win=65535 Len=0"
"5.026863","5.9.29.183","172.19.0.3","TLSv1.2","599","Application Data"
"5.028101","172.19.0.3","5.9.29.183","TLSv1.2","599","Application Data"
"5.028425","5.9.29.183","172.19.0.3","TCP","56","9002 → 43520 [ACK] Seq=164766 Ack=11860 Win=65535 Len=0"
"5.340657","5.9.29.183","172.19.0.3","TCP","1504","[TCP segment of a reassembled PDU]"
"5.340726","5.9.29.183","172.19.0.3","TCP","1504","9002 → 43520 [PSH, ACK] Seq=166214 Ack=11860 Win=65535 Len=1448 [TCP segment of a reassembled PDU]"
"5.340735","5.9.29.183","172.19.0.3","TLSv1.2","1237","Application Data"
"5.340838","172.19.0.3","5.9.29.183","TCP","56","43520 → 9002 [ACK] Seq=11860 Ack=168843 Win=8450 Len=0"
"5.356280","5.9.29.183","172.19.0.3","TLSv1.2","149","Application Data"
"5.373374","5.9.29.183","172.19.0.3","TCP","1504","[TCP segment of a reassembled PDU]"
"5.373393","172.19.0.3","5.9.29.183","TCP","56","43520 → 9002 [ACK] Seq=11860 Ack=170384 Win=8466 Len=0"
"5.373501","5.9.29.183","172.19.0.3","TCP","1516","9002 → 43520 [PSH, ACK] Seq=170384 Ack=11860 Win=65535 Len=1460 [TCP segment of a reassembled PDU]"
"5.373510","5.9.29.183","172.19.0.3","TLSv1.2","775","Application Data"
"5.373569","172.19.0.3","5.9.29.183","TCP","56","43520 → 9002 [ACK] Seq=11860 Ack=172563 Win=8450 Len=0"
"5.389391","5.9.29.183","172.19.0.3","TCP","1504","[TCP segment of a reassembled PDU]"
"5.389477","5.9.29.183","172.19.0.3","TCP","1516","9002 → 43520 [PSH, ACK] Seq=174011 Ack=11860 Win=65535 Len=1460 [TCP segment of a reassembled PDU]"
"5.389486","172.19.0.3","5.9.29.183","TCP","56","43520 → 9002 [ACK] Seq=11860 Ack=175471 Win=8458 Len=0"
"5.389488","5.9.29.183","172.19.0.3","TLSv1.2","1225","Application Data"
"5.402379","5.9.29.183","172.19.0.3","TLSv1.2","1516","Application Data"
"5.402396","172.19.0.3","5.9.29.183","TCP","56","43520 → 9002 [ACK] Seq=11860 Ack=178100 Win=8466 Len=0"
"5.402428","5.9.29.183","172.19.0.3","TCP","1492","9002 → 43520 [PSH, ACK] Seq=178100 Ack=11860 Win=65535 Len=1436 [TCP segment of a reassembled PDU]"
"5.402435","5.9.29.183","172.19.0.3","TLSv1.2","1516","Application Data [TCP segment of a reassembled PDU]"
"5.402438","5.9.29.183","172.19.0.3","TCP","1516","9002 → 43520 [PSH, ACK] Seq=180996 Ack=11860 Win=65535 Len=1460 [TCP segment of a reassembled PDU]"
"5.402442","5.9.29.183","172.19.0.3","TCP","1480","9002 → 43520 [PSH, ACK] Seq=182456 Ack=11860 Win=65535 Len=1424 [TCP segment of a reassembled PDU]"
"5.402567","172.19.0.3","5.9.29.183","TCP","56","43520 → 9002 [ACK] Seq=11860 Ack=183880 Win=8434 Len=0"
"5.405380","5.9.29.183","172.19.0.3","TLSv1.2","677","Application Data"
"5.406028","172.19.0.3","5.9.29.183","TLSv1.2","599","Application Data"
"5.406496","5.9.29.183","172.19.0.3","TCP","56","9002 → 43520 [ACK] Seq=184501 Ack=12403 Win=65535 Len=0"
"5.418201","5.9.29.183","172.19.0.3","TCP","1504","[TCP segment of a reassembled PDU]"
"5.418333","5.9.29.183","172.19.0.3","TCP","1504","9002 → 43520 [PSH, ACK] Seq=185949 Ack=12403 Win=65535 Len=1448 [TCP segment of a reassembled PDU]"
"5.418407","5.9.29.183","172.19.0.3","TLSv1.2","1516","Application Data [TCP segment of a reassembled PDU]"
"5.418414","5.9.29.183","172.19.0.3","TCP","1516","9002 → 43520 [PSH, ACK] Seq=188857 Ack=12403 Win=65535 Len=1460 [TCP segment of a reassembled PDU]"
"5.418419","5.9.29.183","172.19.0.3","TCP","1480","9002 → 43520 [PSH, ACK] Seq=190317 Ack=12403 Win=65535 Len=1424 [TCP segment of a reassembled PDU]"
"5.418424","5.9.29.183","172.19.0.3","TCP","129","9002 → 43520 [PSH, ACK] Seq=191741 Ack=12403 Win=65535 Len=73 [TCP segment of a reassembled PDU]"
"5.418480","172.19.0.3","5.9.29.183","TCP","56","43520 → 9002 [ACK] Seq=12403 Ack=191814 Win=8432 Len=0"
"5.418502","5.9.29.183","172.19.0.3","TLSv1.2","1431","Application Data [TCP segment of a reassembled PDU]"
"5.418812","172.19.0.3","5.9.29.183","TLSv1.2","599","Application Data"
"5.418984","5.9.29.183","172.19.0.3","TCP","56","9002 → 43520 [ACK] Seq=193189 Ack=12946 Win=65535 Len=0"
"5.421158","5.9.29.183","172.19.0.3","TLSv1.2","193","Application Data"
"5.440608","5.9.29.183","172.19.0.3","TCP","1516","[TCP segment of a reassembled PDU]"
"5.440629","172.19.0.3","5.9.29.183","TCP","56","43520 → 9002 [ACK] Seq=12946 Ack=194786 Win=8466 Len=0"
"5.440664","5.9.29.183","172.19.0.3","TCP","1516","9002 → 43520 [PSH, ACK] Seq=194786 Ack=12946 Win=65535 Len=1460 [TCP segment of a reassembled PDU]"
"5.440695","5.9.29.183","172.19.0.3","TLSv1.2","763","Application Data"
"5.440829","172.19.0.3","5.9.29.183","TCP","56","43520 → 9002 [ACK] Seq=12946 Ack=196953 Win=8450 Len=0"
"5.451991","5.9.29.183","172.19.0.3","TCP","1516","[TCP segment of a reassembled PDU]"
"5.452037","5.9.29.183","172.19.0.3","TCP","1492","9002 → 43520 [PSH, ACK] Seq=198413 Ack=12946 Win=65535 Len=1436 [TCP segment of a reassembled PDU]"
"5.452050","172.19.0.3","5.9.29.183","TCP","56","43520 → 9002 [ACK] Seq=12946 Ack=199849 Win=8458 Len=0"
"5.452052","5.9.29.183","172.19.0.3","TLSv1.2","1516","Application Data [TCP segment of a reassembled PDU]"
"5.452261","5.9.29.183","172.19.0.3","TCP","1516","9002 → 43520 [PSH, ACK] Seq=201309 Ack=12946 Win=65535 Len=1460 [TCP segment of a reassembled PDU]"
"5.452270","5.9.29.183","172.19.0.3","TCP","1480","9002 → 43520 [PSH, ACK] Seq=202769 Ack=12946 Win=65535 Len=1424 [TCP segment of a reassembled PDU]"
"5.452330","172.19.0.3","5.9.29.183","TCP","56","43520 → 9002 [ACK] Seq=12946 Ack=204193 Win=8434 Len=0"
"5.456151","5.9.29.183","172.19.0.3","TLSv1.2","584","Application Data"
"5.474021","5.9.29.183","172.19.0.3","TCP","1504","[TCP segment of a reassembled PDU]"
"5.474040","172.19.0.3","5.9.29.183","TCP","56","43520 → 9002 [ACK] Seq=12946 Ack=206169 Win=8466 Len=0"
"5.474076","5.9.29.183","172.19.0.3","TCP","1516","9002 → 43520 [PSH, ACK] Seq=206169 Ack=12946 Win=65535 Len=1460 [TCP segment of a reassembled PDU]"
"5.474105","5.9.29.183","172.19.0.3","TLSv1.2","1225","Application Data"
"5.474263","172.19.0.3","5.9.29.183","TCP","56","43520 → 9002 [ACK] Seq=12946 Ack=208798 Win=8448 Len=0"
"5.489851","5.9.29.183","172.19.0.3","TLSv1.2","149","Application Data"
"5.507646","5.9.29.183","172.19.0.3","TCP","1516","[TCP segment of a reassembled PDU]"
"5.507663","172.19.0.3","5.9.29.183","TCP","56","43520 → 9002 [ACK] Seq=12946 Ack=210351 Win=8466 Len=0"
"5.507696","5.9.29.183","172.19.0.3","TLSv1.2","167","Application Data"
"5.523843","5.9.29.183","172.19.0.3","TCP","1504","[TCP segment of a reassembled PDU]"
"5.523862","172.19.0.3","5.9.29.183","TCP","56","43520 → 9002 [ACK] Seq=12946 Ack=211910 Win=8466 Len=0"
"5.523895","5.9.29.183","172.19.0.3","TCP","1516","9002 → 43520 [PSH, ACK] Seq=211910 Ack=12946 Win=65535 Len=1460 [TCP segment of a reassembled PDU]"
"5.523904","5.9.29.183","172.19.0.3","TLSv1.2","775","Application Data"
"5.524069","172.19.0.3","5.9.29.183","TCP","56","43520 → 9002 [ACK] Seq=12946 Ack=214089 Win=8450 Len=0"
"5.541335","5.9.29.183","172.19.0.3","TCP","1504","[TCP segment of a reassembled PDU]"
"5.541380","5.9.29.183","172.19.0.3","TCP","1516","9002 → 43520 [PSH, ACK] Seq=215537 Ack=12946 Win=65535 Len=1460 [TCP segment of a reassembled PDU]"
"5.541392","172.19.0.3","5.9.29.183","TCP","56","43520 → 9002 [ACK] Seq=12946 Ack=216997 Win=8458 Len=0"
"5.541394","5.9.29.183","172.19.0.3","TLSv1.2","775","Application Data"
"5.541791","172.19.0.3","5.9.29.183","TLSv1.2","599","Application Data"
"5.542038","5.9.29.183","172.19.0.3","TCP","56","9002 → 43520 [ACK] Seq=217716 Ack=13489 Win=65535 Len=0"
"5.551268","172.19.0.3","5.9.29.183","TLSv1.2","599","Application Data"
"5.551585","5.9.29.183","172.19.0.3","TCP","56","9002 → 43520 [ACK] Seq=217716 Ack=14032 Win=65535 Len=0"
"5.960705","5.9.29.183","172.19.0.3","TLSv1.2","599","Application Data"
"5.961423","172.19.0.3","5.9.29.183","TLSv1.2","599","Application Data"
"5.961738","5.9.29.183","172.19.0.3","TCP","56","9002 → 43520 [ACK] Seq=218259 Ack=14575 Win=65535 Len=0"
"6.304230","5.9.29.183","172.19.0.3","TCP","1516","[TCP segment of a reassembled PDU]"
"6.304287","5.9.29.183","172.19.0.3","TCP","1492","9002 → 43520 [PSH, ACK] Seq=219719 Ack=14575 Win=65535 Len=1436 [TCP segment of a reassembled PDU]"
"6.304297","5.9.29.183","172.19.0.3","TLSv1.2","787","Application Data"
"6.304602","172.19.0.3","5.9.29.183","TCP","56","43520 → 9002 [ACK] Seq=14575 Ack=221886 Win=8450 Len=0"
"6.335013","5.9.29.183","172.19.0.3","TCP","1504","[TCP segment of a reassembled PDU]"
"6.335069","5.9.29.183","172.19.0.3","TCP","1516","9002 → 43520 [PSH, ACK] Seq=223334 Ack=14575 Win=65535 Len=1460 [TCP segment of a reassembled PDU]"
"6.335087","172.19.0.3","5.9.29.183","TCP","56","43520 → 9002 [ACK] Seq=14575 Ack=224794 Win=8458 Len=0"
"6.335223","5.9.29.183","172.19.0.3","TLSv1.2","775","Application Data"
"6.347035","5.9.29.183","172.19.0.3","TCP","1516","[TCP segment of a reassembled PDU]"
"6.347073","172.19.0.3","5.9.29.183","TCP","56","43520 → 9002 [ACK] Seq=14575 Ack=226973 Win=8466 Len=0"
"6.347109","5.9.29.183","172.19.0.3","TCP","1492","9002 → 43520 [PSH, ACK] Seq=226973 Ack=14575 Win=65535 Len=1436 [TCP segment of a reassembled PDU]"
"6.347369","5.9.29.183","172.19.0.3","TLSv1.2","1516","Application Data [TCP segment of a reassembled PDU]"
"6.347380","172.19.0.3","5.9.29.183","TCP","56","43520 → 9002 [ACK] Seq=14575 Ack=229869 Win=8466 Len=0"
"6.347382","5.9.29.183","172.19.0.3","TCP","1516","9002 → 43520 [PSH, ACK] Seq=229869 Ack=14575 Win=65535 Len=1460 [TCP segment of a reassembled PDU]"
"6.347386","5.9.29.183","172.19.0.3","TCP","1516","9002 → 43520 [PSH, ACK] Seq=231329 Ack=14575 Win=65535 Len=1460 [TCP segment of a reassembled PDU]"
"6.347388","5.9.29.183","172.19.0.3","TLSv1.2","1468","Application Data [TCP segment of a reassembled PDU]"
"6.347663","172.19.0.3","5.9.29.183","TCP","56","43520 → 9002 [ACK] Seq=14575 Ack=234201 Win=8440 Len=0"
"6.350155","5.9.29.183","172.19.0.3","TLSv1.2","1221","Application Data"
"6.350548","172.19.0.3","5.9.29.183","TLSv1.2","599","Application Data"
"6.350834","5.9.29.183","172.19.0.3","TCP","56","9002 → 43520 [ACK] Seq=235366 Ack=15118 Win=65535 Len=0"
"6.350939","5.9.29.183","172.19.0.3","TCP","1504","[TCP segment of a reassembled PDU]"
"6.365531","5.9.29.183","172.19.0.3","TLSv1.2","693","Application Data"
"6.365569","172.19.0.3","5.9.29.183","TCP","56","43520 → 9002 [ACK] Seq=15118 Ack=237451 Win=8466 Len=0"
"6.366921","5.9.29.183","172.19.0.3","TCP","1504","[TCP segment of a reassembled PDU]"
"6.366976","5.9.29.183","172.19.0.3","TCP","1504","9002 → 43520 [PSH, ACK] Seq=238899 Ack=15118 Win=65535 Len=1448 [TCP segment of a reassembled PDU]"
"6.367099","172.19.0.3","5.9.29.183","TCP","56","43520 → 9002 [ACK] Seq=15118 Ack=240347 Win=8458 Len=0"
"6.378493","5.9.29.183","172.19.0.3","TLSv1.2","1504","Application Data [TCP segment of a reassembled PDU]"
"6.378551","5.9.29.183","172.19.0.3","TCP","1516","9002 → 43520 [PSH, ACK] Seq=241795 Ack=15118 Win=65535 Len=1460 [TCP segment of a reassembled PDU]"
"6.378568","172.19.0.3","5.9.29.183","TCP","56","43520 → 9002 [ACK] Seq=15118 Ack=243255 Win=8458 Len=0"
"6.378572","5.9.29.183","172.19.0.3","TCP","1516","9002 → 43520 [PSH, ACK] Seq=243255 Ack=15118 Win=65535 Len=1460 [TCP segment of a reassembled PDU]"
"6.378633","5.9.29.183","172.19.0.3","TLSv1.2","1480","Application Data [TCP segment of a reassembled PDU]"
"6.378668","172.19.0.3","5.9.29.183","TCP","56","43520 → 9002 [ACK] Seq=15118 Ack=246139 Win=8442 Len=0"
"6.379143","172.19.0.3","5.9.29.183","TLSv1.2","599","Application Data"
"6.379418","5.9.29.183","172.19.0.3","TCP","56","9002 → 43520 [ACK] Seq=246139 Ack=15661 Win=65535 Len=0"
"6.380298","5.9.29.183","172.19.0.3","TLSv1.2","1221","Application Data"
"6.401215","5.9.29.183","172.19.0.3","TCP","1516","[TCP segment of a reassembled PDU]"
"6.401238","172.19.0.3","5.9.29.183","TCP","56","43520 → 9002 [ACK] Seq=15661 Ack=248764 Win=8466 Len=0"
"6.401324","5.9.29.183","172.19.0.3","TCP","1516","9002 → 43520 [PSH, ACK] Seq=248764 Ack=15661 Win=65535 Len=1460 [TCP segment of a reassembled PDU]"
"6.401384","5.9.29.183","172.19.0.3","TLSv1.2","763","Application Data"
"6.401871","172.19.0.3","5.9.29.183","TCP","56","43520 → 9002 [ACK] Seq=15661 Ack=250931 Win=8450 Len=0"
"6.420363","5.9.29.183","172.19.0.3","TCP","1516","[TCP segment of a reassembled PDU]"
"6.420427","5.9.29.183","172.19.0.3","TCP","1492","9002 → 43520 [PSH, ACK] Seq=252391 Ack=15661 Win=65535 Len=1436 [TCP segment of a reassembled PDU]"
"6.420445","172.19.0.3","5.9.29.183","TCP","56","43520 → 9002 [ACK] Seq=15661 Ack=253827 Win=8458 Len=0"
"6.427138","5.9.29.183","172.19.0.3","TLSv1.2","1330","Application Data, Application Data"
"6.439910","5.9.29.183","172.19.0.3","TCP","1516","[TCP segment of a reassembled PDU]"
"6.439935","172.19.0.3","5.9.29.183","TCP","56","43520 → 9002 [ACK] Seq=15661 Ack=256561 Win=8466 Len=0"
"6.440030","5.9.29.183","172.19.0.3","TCP","845","9002 → 43520 [PSH, ACK] Seq=256561 Ack=15661 Win=65535 Len=789 [TCP segment of a reassembled PDU]"
"6.440041","5.9.29.183","172.19.0.3","TCP","703","9002 → 43520 [PSH, ACK] Seq=257350 Ack=15661 Win=65535 Len=647 [TCP segment of a reassembled PDU]"
"6.440378","172.19.0.3","5.9.29.183","TCP","56","43520 → 9002 [ACK] Seq=15661 Ack=257997 Win=8466 Len=0"
"6.451797","5.9.29.183","172.19.0.3","TLSv1.2","1330","Application Data, Application Data"
"6.458592","5.9.29.183","172.19.0.3","TCP","1504","[TCP segment of a reassembled PDU]"
"6.458616","172.19.0.3","5.9.29.183","TCP","56","43520 → 9002 [ACK] Seq=15661 Ack=260719 Win=8466 Len=0"
"6.458660","5.9.29.183","172.19.0.3","TCP","1504","9002 → 43520 [PSH, ACK] Seq=260719 Ack=15661 Win=65535 Len=1448 [TCP segment of a reassembled PDU]"
"6.458698","5.9.29.183","172.19.0.3","TLSv1.2","1504","Application Data [TCP segment of a reassembled PDU]"
"6.458826","172.19.0.3","5.9.29.183","TCP","56","43520 → 9002 [ACK] Seq=15661 Ack=263615 Win=8450 Len=0"
"6.468463","5.9.29.183","172.19.0.3","TLSv1.2","396","Application Data"
"6.474794","5.9.29.183","172.19.0.3","TCP","1516","[TCP segment of a reassembled PDU]"
"6.474819","172.19.0.3","5.9.29.183","TCP","56","43520 → 9002 [ACK] Seq=15661 Ack=265415 Win=8466 Len=0"
"6.474873","5.9.29.183","172.19.0.3","TCP","1516","9002 → 43520 [PSH, ACK] Seq=265415 Ack=15661 Win=65535 Len=1460 [TCP segment of a reassembled PDU]"
"6.474915","5.9.29.183","172.19.0.3","TLSv1.2","1516","Application Data [TCP segment of a reassembled PDU]"
"6.474924","5.9.29.183","172.19.0.3","TCP","1516","9002 → 43520 [PSH, ACK] Seq=268335 Ack=15661 Win=65535 Len=1460 [TCP segment of a reassembled PDU]"
"6.474930","5.9.29.183","172.19.0.3","TCP","1516","9002 → 43520 [PSH, ACK] Seq=269795 Ack=15661 Win=65535 Len=1460 [TCP segment of a reassembled PDU]"
"6.474936","5.9.29.183","172.19.0.3","TLSv1.2","1444","Application Data [TCP segment of a reassembled PDU]"
"6.475040","172.19.0.3","5.9.29.183","TCP","56","43520 → 9002 [ACK] Seq=15661 Ack=272643 Win=8426 Len=0"
"6.475544","172.19.0.3","5.9.29.183","TLSv1.2","599","Application Data"
"6.475870","5.9.29.183","172.19.0.3","TCP","56","9002 → 43520 [ACK] Seq=272643 Ack=16204 Win=65535 Len=0"
"6.478660","5.9.29.183","172.19.0.3","TLSv1.2","1516","Application Data [TCP segment of a reassembled PDU]"
"6.478722","5.9.29.183","172.19.0.3","TCP","1492","9002 → 43520 [PSH, ACK] Seq=274103 Ack=16204 Win=65535 Len=1436 [TCP segment of a reassembled PDU]"
"6.478744","172.19.0.3","5.9.29.183","TCP","56","43520 → 9002 [ACK] Seq=16204 Ack=275539 Win=8458 Len=0"
"6.484792","5.9.29.183","172.19.0.3","TLSv1.2","924","Application Data"
"6.489797","5.9.29.183","172.19.0.3","TCP","1504","[TCP segment of a reassembled PDU]"
"6.489823","172.19.0.3","5.9.29.183","TCP","56","43520 → 9002 [ACK] Seq=16204 Ack=277855 Win=8466 Len=0"
"6.489868","5.9.29.183","172.19.0.3","TCP","1516","9002 → 43520 [PSH, ACK] Seq=277855 Ack=16204 Win=65535 Len=1460 [TCP segment of a reassembled PDU]"
"6.489909","5.9.29.183","172.19.0.3","TLSv1.2","1492","Application Data [TCP segment of a reassembled PDU]"
"6.490025","172.19.0.3","5.9.29.183","TCP","56","43520 → 9002 [ACK] Seq=16204 Ack=280751 Win=8450 Len=0"
"6.494442","5.9.29.183","172.19.0.3","TLSv1.2","1504","Application Data [TCP segment of a reassembled PDU]"
"6.499968","5.9.29.183","172.19.0.3","TLSv1.2","519","Application Data"
"6.499993","172.19.0.3","5.9.29.183","TCP","56","43520 → 9002 [ACK] Seq=16204 Ack=282662 Win=8466 Len=0"
"6.501211","172.19.0.3","5.9.29.183","TLSv1.2","599","Application Data"
"6.501717","5.9.29.183","172.19.0.3","TCP","56","9002 → 43520 [ACK] Seq=282662 Ack=16747 Win=65535 Len=0"
"6.511416","172.19.0.3","5.9.29.183","TLSv1.2","599","Application Data"
"6.511835","5.9.29.183","172.19.0.3","TCP","56","9002 → 43520 [ACK] Seq=282662 Ack=17290 Win=65535 Len=0"
"6.619813","5.9.29.183","172.19.0.3","TLSv1.2","599","Application Data"
"6.660632","172.19.0.3","5.9.29.183","TCP","56","43520 → 9002 [ACK] Seq=17290 Ack=283205 Win=8466 Len=0"
"6.851012","5.9.29.183","172.19.0.3","TLSv1.2","599","Application Data"
"6.851063","172.19.0.3","5.9.29.183","TCP","56","43520 → 9002 [ACK] Seq=17290 Ack=283748 Win=8466 Len=0"
"6.851878","172.19.0.3","5.9.29.183","TLSv1.2","599","Application Data"
"6.852065","5.9.29.183","172.19.0.3","TCP","56","9002 → 43520 [ACK] Seq=283748 Ack=17833 Win=65535 Len=0"
"7.185651","5.9.29.183","172.19.0.3","TCP","1504","[TCP segment of a reassembled PDU]"
"7.185765","5.9.29.183","172.19.0.3","TCP","1516","9002 → 43520 [PSH, ACK] Seq=285196 Ack=17833 Win=65535 Len=1460 [TCP segment of a reassembled PDU]"
"7.185812","5.9.29.183","172.19.0.3","TLSv1.2","1516","Application Data [TCP segment of a reassembled PDU]"
"7.185816","5.9.29.183","172.19.0.3","TCP","1213","9002 → 43520 [PSH, ACK] Seq=288116 Ack=17833 Win=65535 Len=1157 [TCP segment of a reassembled PDU]"
"7.185820","5.9.29.183","172.19.0.3","TCP","1504","9002 → 43520 [PSH, ACK] Seq=289273 Ack=17833 Win=65535 Len=1448 [TCP segment of a reassembled PDU]"
"7.185975","172.19.0.3","5.9.29.183","TCP","56","43520 → 9002 [ACK] Seq=17833 Ack=290721 Win=8432 Len=0"
"7.186541","172.19.0.3","5.9.29.183","TLSv1.2","599","Application Data"
"7.186889","5.9.29.183","172.19.0.3","TCP","56","9002 → 43520 [ACK] Seq=290721 Ack=18376 Win=65535 Len=0"
"7.201538","5.9.29.183","172.19.0.3","TLSv1.2","337","Application Data"
"7.224460","5.9.29.183","172.19.0.3","TCP","1516","[TCP segment of a reassembled PDU]"
"7.224482","172.19.0.3","5.9.29.183","TCP","56","43520 → 9002 [ACK] Seq=18376 Ack=292462 Win=8466 Len=0"
"7.224517","5.9.29.183","172.19.0.3","TCP","1492","9002 → 43520 [PSH, ACK] Seq=292462 Ack=18376 Win=65535 Len=1436 [TCP segment of a reassembled PDU]"
"7.224527","5.9.29.183","172.19.0.3","TLSv1.2","787","Application Data"
"7.224666","172.19.0.3","5.9.29.183","TCP","56","43520 → 9002 [ACK] Seq=18376 Ack=294629 Win=8450 Len=0"
"7.236543","5.9.29.183","172.19.0.3","TCP","1504","[TCP segment of a reassembled PDU]"
"7.236585","5.9.29.183","172.19.0.3","TCP","1516","9002 → 43520 [PSH, ACK] Seq=296077 Ack=18376 Win=65535 Len=1460 [TCP segment of a reassembled PDU]"
"7.236597","172.19.0.3","5.9.29.183","TCP","56","43520 → 9002 [ACK] Seq=18376 Ack=297537 Win=8458 Len=0"
"7.236599","5.9.29.183","172.19.0.3","TLSv1.2","1516","Application Data [TCP segment of a reassembled PDU]"
"7.236601","5.9.29.183","172.19.0.3","TCP","1480","9002 → 43520 [PSH, ACK] Seq=298997 Ack=18376 Win=65535 Len=1424 [TCP segment of a reassembled PDU]"
"7.236687","172.19.0.3","5.9.29.183","TCP","56","43520 → 9002 [ACK] Seq=18376 Ack=300421 Win=8442 Len=0"
"7.240148","5.9.29.183","172.19.0.3","TLSv1.2","1004","Application Data"
"7.244138","172.19.0.3","5.9.29.183","TLSv1.2","599","Application Data"
"7.244559","5.9.29.183","172.19.0.3","TCP","56","9002 → 43520 [ACK] Seq=301369 Ack=18919 Win=65535 Len=0"
"7.608479","5.9.29.183","172.19.0.3","TLSv1.2","599","Application Data"
"7.609433","172.19.0.3","5.9.29.183","TLSv1.2","599","Application Data"
"7.609777","5.9.29.183","172.19.0.3","TCP","56","9002 → 43520 [ACK] Seq=301912 Ack=19462 Win=65535 Len=0"
"7.894652","5.9.29.183","172.19.0.3","TCP","1504","[TCP segment of a reassembled PDU]"
"7.894680","5.9.29.183","172.19.0.3","TCP","1516","9002 → 43520 [PSH, ACK] Seq=303360 Ack=19462 Win=65535 Len=1460 [TCP segment of a reassembled PDU]"
"7.894686","5.9.29.183","172.19.0.3","TLSv1.2","775","Application Data"
"7.894766","172.19.0.3","5.9.29.183","TCP","56","43520 → 9002 [ACK] Seq=19462 Ack=305539 Win=8450 Len=0"
"7.923840","5.9.29.183","172.19.0.3","TCP","1516","[TCP segment of a reassembled PDU]"
"7.923884","5.9.29.183","172.19.0.3","TCP","1492","9002 → 43520 [PSH, ACK] Seq=306999 Ack=19462 Win=65535 Len=1436 [TCP segment of a reassembled PDU]"
"7.923896","172.19.0.3","5.9.29.183","TCP","56","43520 → 9002 [ACK] Seq=19462 Ack=308435 Win=8458 Len=0"
"7.923899","5.9.29.183","172.19.0.3","TLSv1.2","1516","Application Data [TCP segment of a reassembled PDU]"
"7.923901","5.9.29.183","172.19.0.3","TCP","1516","9002 → 43520 [PSH, ACK] Seq=309895 Ack=19462 Win=65535 Len=1460 [TCP segment of a reassembled PDU]"
"7.923905","5.9.29.183","172.19.0.3","TCP","1213","9002 → 43520 [PSH, ACK] Seq=311355 Ack=19462 Win=65535 Len=1157 [TCP segment of a reassembled PDU]"
"7.924060","172.19.0.3","5.9.29.183","TCP","56","43520 → 9002 [ACK] Seq=19462 Ack=312512 Win=8434 Len=0"
"7.939168","5.9.29.183","172.19.0.3","TLSv1.2","1516","Application Data [TCP segment of a reassembled PDU]"
"7.939224","5.9.29.183","172.19.0.3","TCP","1516","9002 → 43520 [PSH, ACK] Seq=313972 Ack=19462 Win=65535 Len=1460 [TCP segment of a reassembled PDU]"
"7.939243","172.19.0.3","5.9.29.183","TCP","56","43520 → 9002 [ACK] Seq=19462 Ack=315432 Win=8458 Len=0"
"7.939351","5.9.29.183","172.19.0.3","TCP","1516","9002 → 43520 [PSH, ACK] Seq=315432 Ack=19462 Win=65535 Len=1460 [TCP segment of a reassembled PDU]"
"7.939358","5.9.29.183","172.19.0.3","TLSv1.2","1468","Application Data [TCP segment of a reassembled PDU]"
"7.939360","5.9.29.183","172.19.0.3","TCP","1504","9002 → 43520 [PSH, ACK] Seq=318304 Ack=19462 Win=65535 Len=1448 [TCP segment of a reassembled PDU]"
"7.939399","172.19.0.3","5.9.29.183","TCP","56","43520 → 9002 [ACK] Seq=19462 Ack=319752 Win=8432 Len=0"
"7.941119","5.9.29.183","172.19.0.3","TLSv1.2","1379","Application Data"
"7.971732","5.9.29.183","172.19.0.3","TCP","1516","[TCP segment of a reassembled PDU]"
"7.971750","172.19.0.3","5.9.29.183","TCP","56","43520 → 9002 [ACK] Seq=19462 Ack=322535 Win=8466 Len=0"
"7.971820","5.9.29.183","172.19.0.3","TCP","407","9002 → 43520 [PSH, ACK] Seq=322535 Ack=19462 Win=65535 Len=351 [TCP segment of a reassembled PDU]"
"7.971829","5.9.29.183","172.19.0.3","TCP","1516","9002 → 43520 [PSH, ACK] Seq=322886 Ack=19462 Win=65535 Len=1460 [TCP segment of a reassembled PDU]"
"7.971832","5.9.29.183","172.19.0.3","TLSv1.2","1516","Application Data [TCP segment of a reassembled PDU]"
"7.971834","5.9.29.183","172.19.0.3","TCP","1516","9002 → 43520 [PSH, ACK] Seq=325806 Ack=19462 Win=65535 Len=1460 [TCP segment of a reassembled PDU]"
"7.971836","5.9.29.183","172.19.0.3","TCP","1516","9002 → 43520 [PSH, ACK] Seq=327266 Ack=19462 Win=65535 Len=1460 [TCP segment of a reassembled PDU]"
"7.971840","5.9.29.183","172.19.0.3","TLSv1.2","826","Application Data [TCP segment of a reassembled PDU]"
"7.971983","172.19.0.3","5.9.29.183","TCP","56","43520 → 9002 [ACK] Seq=19462 Ack=329496 Win=8418 Len=0"
"7.972325","172.19.0.3","5.9.29.183","TLSv1.2","599","Application Data"
"7.972540","5.9.29.183","172.19.0.3","TCP","56","9002 → 43520 [ACK] Seq=329496 Ack=20005 Win=65535 Len=0"
"7.987110","5.9.29.183","172.19.0.3","TLSv1.2","460","Application Data"
"7.989898","5.9.29.183","172.19.0.3","TCP","1516","[TCP segment of a reassembled PDU]"
"7.989919","172.19.0.3","5.9.29.183","TCP","56","43520 → 9002 [ACK] Seq=20005 Ack=331360 Win=8466 Len=0"
"7.989954","5.9.29.183","172.19.0.3","TCP","1516","9002 → 43520 [PSH, ACK] Seq=331360 Ack=20005 Win=65535 Len=1460 [TCP segment of a reassembled PDU]"
"7.989986","5.9.29.183","172.19.0.3","TLSv1.2","1480","Application Data [TCP segment of a reassembled PDU]"
"7.989991","5.9.29.183","172.19.0.3","TCP","1516","9002 → 43520 [PSH, ACK] Seq=334244 Ack=20005 Win=65535 Len=1460 [TCP segment of a reassembled PDU]"
"7.989995","5.9.29.183","172.19.0.3","TCP","1516","9002 → 43520 [PSH, ACK] Seq=335704 Ack=20005 Win=65535 Len=1460 [TCP segment of a reassembled PDU]"
"7.989998","5.9.29.183","172.19.0.3","TLSv1.2","1516","Application Data [TCP segment of a reassembled PDU]"
"7.990002","5.9.29.183","172.19.0.3","TCP","1516","9002 → 43520 [PSH, ACK] Seq=338624 Ack=20005 Win=65535 Len=1460 [TCP segment of a reassembled PDU]"
"7.990005","5.9.29.183","172.19.0.3","TCP","1456","9002 → 43520 [PSH, ACK] Seq=340084 Ack=20005 Win=65535 Len=1400 [TCP segment of a reassembled PDU]"
"7.990156","172.19.0.3","5.9.29.183","TCP","56","43520 → 9002 [ACK] Seq=20005 Ack=341484 Win=8410 Len=0"
"8.002222","5.9.29.183","172.19.0.3","TLSv1.2","381","Application Data"
"8.002549","172.19.0.3","5.9.29.183","TLSv1.2","599","Application Data"
"8.002744","5.9.29.183","172.19.0.3","TCP","56","9002 → 43520 [ACK] Seq=341809 Ack=20548 Win=65535 Len=0"
"8.006429","5.9.29.183","172.19.0.3","TCP","1516","[TCP segment of a reassembled PDU]"
"8.006464","5.9.29.183","172.19.0.3","TCP","1492","9002 → 43520 [PSH, ACK] Seq=343269 Ack=20548 Win=65535 Len=1436 [TCP segment of a reassembled PDU]"
"8.006550","172.19.0.3","5.9.29.183","TCP","56","43520 → 9002 [ACK] Seq=20548 Ack=344705 Win=8456 Len=0"
"8.006565","5.9.29.183","172.19.0.3","TLSv1.2","1504","Application Data [TCP segment of a reassembled PDU]"
"8.017591","5.9.29.183","172.19.0.3","TLSv1.2","396","Application Data"
"8.017649","172.19.0.3","5.9.29.183","TCP","56","43520 → 9002 [ACK] Seq=20548 Ack=346493 Win=8466 Len=0"
"8.024076","5.9.29.183","172.19.0.3","TCP","1504","[TCP segment of a reassembled PDU]"
"8.024120","5.9.29.183","172.19.0.3","TCP","1516","9002 → 43520 [PSH, ACK] Seq=347941 Ack=20548 Win=65535 Len=1460 [TCP segment of a reassembled PDU]"
"8.024126","5.9.29.183","172.19.0.3","TLSv1.2","1492","Application Data [TCP segment of a reassembled PDU]"
"8.024265","172.19.0.3","5.9.29.183","TCP","56","43520 → 9002 [ACK] Seq=20548 Ack=350837 Win=8450 Len=0"
"8.029265","5.9.29.183","172.19.0.3","TLSv1.2","1516","Application Data [TCP segment of a reassembled PDU]"
"8.029311","5.9.29.183","172.19.0.3","TCP","1492","9002 → 43520 [PSH, ACK] Seq=352297 Ack=20548 Win=65535 Len=1436 [TCP segment of a reassembled PDU]"
"8.029323","172.19.0.3","5.9.29.183","TCP","56","43520 → 9002 [ACK] Seq=20548 Ack=353733 Win=8458 Len=0"
"8.032508","5.9.29.183","172.19.0.3","TLSv1.2","613","Application Data"
"8.032833","172.19.0.3","5.9.29.183","TLSv1.2","599","Application Data"
"8.033098","5.9.29.183","172.19.0.3","TCP","56","9002 → 43520 [ACK] Seq=354290 Ack=21091 Win=65535 Len=0"
"8.057987","5.9.29.183","172.19.0.3","TCP","1504","[TCP segment of a reassembled PDU]"
"8.058029","5.9.29.183","172.19.0.3","TCP","1504","9002 → 43520 [PSH, ACK] Seq=355738 Ack=21091 Win=65535 Len=1448 [TCP segment of a reassembled PDU]"
"8.058183","5.9.29.183","172.19.0.3","TLSv1.2","1237","Application Data"
"8.058186","5.9.29.183","172.19.0.3","TCP","1504","[TCP segment of a reassembled PDU]"
"8.058189","172.19.0.3","5.9.29.183","TCP","56","43520 → 9002 [ACK] Seq=21091 Ack=357186 Win=8458 Len=0"
"8.058266","172.19.0.3","5.9.29.183","TCP","56","43520 → 9002 [ACK] Seq=21091 Ack=359815 Win=8442 Len=0"
"8.074007","5.9.29.183","172.19.0.3","TLSv1.2","1271","Application Data"
"8.112997","5.9.29.183","172.19.0.3","TCP","1516","[TCP segment of a reassembled PDU]"
"8.113015","172.19.0.3","5.9.29.183","TCP","56","43520 → 9002 [ACK] Seq=21091 Ack=362490 Win=8466 Len=0"
"8.113048","5.9.29.183","172.19.0.3","TCP","1492","9002 → 43520 [PSH, ACK] Seq=362490 Ack=21091 Win=65535 Len=1436 [TCP segment of a reassembled PDU]"
"8.113077","5.9.29.183","172.19.0.3","TLSv1.2","787","Application Data"
"8.113186","172.19.0.3","5.9.29.183","TCP","56","43520 → 9002 [ACK] Seq=21091 Ack=364657 Win=8450 Len=0"
