_ws.col.Time,_ws.col.Source,_ws.col.Destination,_ws.col.Protocol,_ws.col.Length,_ws.col.Info
"0.000000","172.19.0.3","5.9.29.183","TLSv1.2","599","Application Data"
"0.000320","5.9.29.183","172.19.0.3","TCP","56","9002 → 43520 [ACK] Seq=1 Ack=544 Win=65535 Len=0"
"1.157362","5.9.29.183","172.19.0.3","TLSv1.2","599","Application Data"
"1.157452","172.19.0.3","5.9.29.183","TCP","56","43520 → 9002 [ACK] Seq=544 Ack=544 Win=11911 Len=0"
"1.158200","172.19.0.3","5.9.29.183","TLSv1.2","2141","Application Data"
"1.158667","5.9.29.183","172.19.0.3","TCP","56","9002 → 43520 [ACK] Seq=544 Ack=2629 Win=65535 Len=0"
"2.186197","5.9.29.183","172.19.0.3","TLSv1.2","599","Application Data"
"2.211587","5.9.29.183","172.19.0.3","TCP","1516","[TCP segment of a reassembled PDU]"
"2.211609","172.19.0.3","5.9.29.183","TCP","56","43520 → 9002 [ACK] Seq=2629 Ack=2547 Win=11911 Len=0"
"2.211661","5.9.29.183","172.19.0.3","TLSv1.2","167","Application Data"
"2.215886","172.19.0.3","5.9.29.183","TLSv1.2","599","Application Data"
"2.216221","5.9.29.183","172.19.0.3","TCP","56","9002 → 43520 [ACK] Seq=2658 Ack=3172 Win=65535 Len=0"
"2.626919","5.9.29.183","172.19.0.3","TLSv1.2","599","Application Data"
"2.627708","172.19.0.3","5.9.29.183","TLSv1.2","599","Application Data"
"2.628082","5.9.29.183","172.19.0.3","TCP","56","9002 → 43520 [ACK] Seq=3201 Ack=3715 Win=65535 Len=0"
"3.014816","5.9.29.183","172.19.0.3","TLSv1.2","599","Application Data"
"3.059426","172.19.0.3","5.9.29.183","TCP","56","43520 → 9002 [ACK] Seq=3715 Ack=3744 Win=11911 Len=0"
"3.059904","5.9.29.183","172.19.0.3","TCP","1516","[TCP segment of a reassembled PDU]"
"3.059926","172.19.0.3","5.9.29.183","TCP","56","43520 → 9002 [ACK] Seq=3715 Ack=5204 Win=11911 Len=0"
"3.059975","5.9.29.183","172.19.0.3","TCP","1492","9002 → 43520 [PSH, ACK] Seq=5204 Ack=3715 Win=65535 Len=1436 [TCP segment of a reassembled PDU]"
"3.059991","172.19.0.3","5.9.29.183","TCP","56","43520 → 9002 [ACK] Seq=3715 Ack=6640 Win=11903 Len=0"
"3.060214","5.9.29.183","172.19.0.3","TLSv1.2","1237","Application Data"
"3.060226","172.19.0.3","5.9.29.183","TCP","56","43520 → 9002 [ACK] Seq=3715 Ack=7821 Win=11911 Len=0"
"3.060259","5.9.29.183","172.19.0.3","TCP","1516","[TCP segment of a reassembled PDU]"
"3.060265","172.19.0.3","5.9.29.183","TCP","56","43520 → 9002 [ACK] Seq=3715 Ack=9281 Win=11903 Len=0"
"3.060267","5.9.29.183","172.19.0.3","TCP","1492","9002 → 43520 [PSH, ACK] Seq=9281 Ack=3715 Win=65535 Len=1436 [TCP segment of a reassembled PDU]"
"3.060272","172.19.0.3","5.9.29.183","TCP","56","43520 → 9002 [ACK] Seq=3715 Ack=10717 Win=11895 Len=0"
"3.076972","5.9.29.183","172.19.0.3","TLSv1.2","337","Application Data"
"3.077000","172.19.0.3","5.9.29.183","TCP","56","43520 → 9002 [ACK] Seq=3715 Ack=10998 Win=11911 Len=0"
"3.077552","172.19.0.3","5.9.29.183","TLSv1.2","599","Application Data"
"3.077850","5.9.29.183","172.19.0.3","TCP","56","9002 → 43520 [ACK] Seq=10998 Ack=4258 Win=65535 Len=0"
"3.093671","5.9.29.183","172.19.0.3","TCP","274","[TCP segment of a reassembled PDU]"
"3.093822","5.9.29.183","172.19.0.3","TLSv1.2","381","Application Data"
"3.093958","172.19.0.3","5.9.29.183","TCP","56","43520 → 9002 [ACK] Seq=4258 Ack=11541 Win=11911 Len=0"
"3.127660","5.9.29.183","172.19.0.3","TCP","1516","[TCP segment of a reassembled PDU]"
"3.127725","5.9.29.183","172.19.0.3","TCP","1492","9002 → 43520 [PSH, ACK] Seq=13001 Ack=4258 Win=65535 Len=1436 [TCP segment of a reassembled PDU]"
"3.127734","5.9.29.183","172.19.0.3","TLSv1.2","787","Application Data"
"3.127915","172.19.0.3","5.9.29.183","TCP","56","43520 → 9002 [ACK] Seq=4258 Ack=15168 Win=11895 Len=0"
"3.142777","5.9.29.183","172.19.0.3","TCP","1516","[TCP segment of a reassembled PDU]"
"3.142835","5.9.29.183","172.19.0.3","TCP","1492","9002 → 43520 [PSH, ACK] Seq=16628 Ack=4258 Win=65535 Len=1436 [TCP segment of a reassembled PDU]"
"3.142853","172.19.0.3","5.9.29.183","TCP","56","43520 → 9002 [ACK] Seq=4258 Ack=18064 Win=11903 Len=0"
"3.143041","5.9.29.183","172.19.0.3","TLSv1.2","1330","Application Data, Application Data"
"3.193639","172.19.0.3","5.9.29.183","TCP","56","43520 → 9002 [ACK] Seq=4258 Ack=19338 Win=11911 Len=0"
"3.204364","5.9.29.183","172.19.0.3","TCP","1516","[TCP segment of a reassembled PDU]"
"3.204387","172.19.0.3","5.9.29.183","TCP","56","43520 → 9002 [ACK] Seq=4258 Ack=20798 Win=11909 Len=0"
"3.204437","5.9.29.183","172.19.0.3","TCP","1492","9002 → 43520 [PSH, ACK] Seq=20798 Ack=4258 Win=65535 Len=1436 [TCP segment of a reassembled PDU]"
"3.204453","172.19.0.3","5.9.29.183","TCP","56","43520 → 9002 [ACK] Seq=4258 Ack=22234 Win=11901 Len=0"
"3.204454","5.9.29.183","172.19.0.3","TLSv1.2","787","Application Data"
"3.204460","172.19.0.3","5.9.29.183","TCP","56","43520 → 9002 [ACK] Seq=4258 Ack=22965 Win=11896 Len=0"
"3.220394","5.9.29.183","172.19.0.3","TCP","1504","[TCP segment of a reassembled PDU]"
"3.220421","172.19.0.3","5.9.29.183","TCP","56","43520 → 9002 [ACK] Seq=4258 Ack=24413 Win=11911 Len=0"
"3.220546","5.9.29.183","172.19.0.3","TLSv1.2","179","Application Data"
"3.220644","172.19.0.3","5.9.29.183","TCP","56","43520 → 9002 [ACK] Seq=4258 Ack=24536 Win=11911 Len=0"
"3.282965","5.9.29.183","172.19.0.3","TLSv1.2","1113","Application Data"
"3.283198","172.19.0.3","5.9.29.183","TCP","56","43520 → 9002 [ACK] Seq=4258 Ack=25593 Win=11911 Len=0"
"3.287404","172.19.0.3","5.9.29.183","TLSv1.2","599","Application Data"
"3.287623","5.9.29.183","172.19.0.3","TCP","56","9002 → 43520 [ACK] Seq=25593 Ack=4801 Win=65535 Len=0"
"3.662205","5.9.29.183","172.19.0.3","TLSv1.2","599","Application Data"
"3.662935","172.19.0.3","5.9.29.183","TLSv1.2","599","Application Data"
"3.663157","5.9.29.183","172.19.0.3","TCP","56","9002 → 43520 [ACK] Seq=26136 Ack=5344 Win=65535 Len=0"
"4.053265","5.9.29.183","172.19.0.3","TLSv1.2","599","Application Data"
"4.068339","5.9.29.183","172.19.0.3","TCP","1516","[TCP segment of a reassembled PDU]"
"4.068362","172.19.0.3","5.9.29.183","TCP","56","43520 → 9002 [ACK] Seq=5344 Ack=28139 Win=11911 Len=0"
"4.068416","5.9.29.183","172.19.0.3","TCP","1492","9002 → 43520 [PSH, ACK] Seq=28139 Ack=5344 Win=65535 Len=1436 [TCP segment of a reassembled PDU]"
"4.068430","5.9.29.183","172.19.0.3","TLSv1.2","787","Application Data"
"4.068574","172.19.0.3","5.9.29.183","TCP","56","43520 → 9002 [ACK] Seq=5344 Ack=30306 Win=11895 Len=0"
"4.142676","5.9.29.183","172.19.0.3","TCP","1516","[TCP segment of a reassembled PDU]"
"4.142734","5.9.29.183","172.19.0.3","TCP","1516","9002 → 43520 [PSH, ACK] Seq=31766 Ack=5344 Win=65535 Len=1460 [TCP segment of a reassembled PDU]"
"4.142756","172.19.0.3","5.9.29.183","TCP","56","43520 → 9002 [ACK] Seq=5344 Ack=33226 Win=11903 Len=0"
"4.142758","5.9.29.183","172.19.0.3","TLSv1.2","763","Application Data"
"4.158718","5.9.29.183","172.19.0.3","TCP","1516","[TCP segment of a reassembled PDU]"
"4.158740","172.19.0.3","5.9.29.183","TCP","56","43520 → 9002 [ACK] Seq=5344 Ack=35393 Win=11911 Len=0"
"4.158796","5.9.29.183","172.19.0.3","TCP","1492","9002 → 43520 [PSH, ACK] Seq=35393 Ack=5344 Win=65535 Len=1436 [TCP segment of a reassembled PDU]"
"4.158842","5.9.29.183","172.19.0.3","TLSv1.2","787","Application Data"
"4.158980","172.19.0.3","5.9.29.183","TCP","56","43520 → 9002 [ACK] Seq=5344 Ack=37560 Win=11895 Len=0"
"4.168620","5.9.29.183","172.19.0.3","TCP","1516","[TCP segment of a reassembled PDU]"
"4.168721","5.9.29.183","172.19.0.3","TCP","1492","9002 → 43520 [PSH, ACK] Seq=39020 Ack=5344 Win=65535 Len=1436 [TCP segment of a reassembled PDU]"
"4.168741","172.19.0.3","5.9.29.183","TCP","56","43520 → 9002 [ACK] Seq=5344 Ack=40456 Win=11903 Len=0"
"4.168843","5.9.29.183","172.19.0.3","TLSv1.2","1516","Application Data [TCP segment of a reassembled PDU]"
"4.168848","5.9.29.183","172.19.0.3","TCP","1492","9002 → 43520 [PSH, ACK] Seq=41916 Ack=5344 Win=65535 Len=1436 [TCP segment of a reassembled PDU]"
"4.168850","5.9.29.183","172.19.0.3","TCP","1504","9002 → 43520 [PSH, ACK] Seq=43352 Ack=5344 Win=65535 Len=1448 [TCP segment of a reassembled PDU]"
"4.168877","172.19.0.3","5.9.29.183","TCP","56","43520 → 9002 [ACK] Seq=5344 Ack=44800 Win=11879 Len=0"
"4.175467","5.9.29.183","172.19.0.3","TLSv1.2","584","Application Data"
"4.219064","172.19.0.3","5.9.29.183","TCP","56","43520 → 9002 [ACK] Seq=5344 Ack=45328 Win=11911 Len=0"
"4.256825","5.9.29.183","172.19.0.3","TCP","1516","[TCP segment of a reassembled PDU]"
"4.256848","172.19.0.3","5.9.29.183","TCP","56","43520 → 9002 [ACK] Seq=5344 Ack=46788 Win=11911 Len=0"
"4.256896","5.9.29.183","172.19.0.3","TCP","1492","9002 → 43520 [PSH, ACK] Seq=46788 Ack=5344 Win=65535 Len=1436 [TCP segment of a reassembled PDU]"
"4.256912","172.19.0.3","5.9.29.183","TCP","56","43520 → 9002 [ACK] Seq=5344 Ack=48224 Win=11901 Len=0"
"4.256914","5.9.29.183","172.19.0.3","TLSv1.2","787","Application Data"
"4.256920","172.19.0.3","5.9.29.183","TCP","56","43520 → 9002 [ACK] Seq=5344 Ack=48955 Win=11896 Len=0"
"4.267922","5.9.29.183","172.19.0.3","TCP","1504","[TCP segment of a reassembled PDU]"
"4.267956","172.19.0.3","5.9.29.183","TCP","56","43520 → 9002 [ACK] Seq=5344 Ack=50403 Win=11911 Len=0"
"4.268247","5.9.29.183","172.19.0.3","TCP","1504","9002 → 43520 [PSH, ACK] Seq=50403 Ack=5344 Win=65535 Len=1448 [TCP segment of a reassembled PDU]"
"4.268266","172.19.0.3","5.9.29.183","TCP","56","43520 → 9002 [ACK] Seq=5344 Ack=51851 Win=11911 Len=0"
"4.268313","5.9.29.183","172.19.0.3","TLSv1.2","1516","Application Data [TCP segment of a reassembled PDU]"
"4.268326","172.19.0.3","5.9.29.183","TCP","56","43520 → 9002 [ACK] Seq=5344 Ack=53311 Win=11903 Len=0"
"4.268329","5.9.29.183","172.19.0.3","TCP","1516","9002 → 43520 [PSH, ACK] Seq=53311 Ack=5344 Win=65535 Len=1460 [TCP segment of a reassembled PDU]"
"4.268335","172.19.0.3","5.9.29.183","TCP","56","43520 → 9002 [ACK] Seq=5344 Ack=54771 Win=11895 Len=0"
"4.268336","5.9.29.183","172.19.0.3","TCP","1480","9002 → 43520 [PSH, ACK] Seq=54771 Ack=5344 Win=65535 Len=1424 [TCP segment of a reassembled PDU]"
"4.268345","172.19.0.3","5.9.29.183","TCP","56","43520 → 9002 [ACK] Seq=5344 Ack=56195 Win=11887 Len=0"
"4.268593","172.19.0.3","5.9.29.183","TLSv1.2","599","Application Data"
"4.268892","5.9.29.183","172.19.0.3","TCP","56","9002 → 43520 [ACK] Seq=56195 Ack=5887 Win=65535 Len=0"
"4.272278","5.9.29.183","172.19.0.3","TLSv1.2","1127","Application Data, Application Data"
"4.287075","5.9.29.183","172.19.0.3","TCP","1504","[TCP segment of a reassembled PDU]"
"4.287113","172.19.0.3","5.9.29.183","TCP","56","43520 → 9002 [ACK] Seq=5887 Ack=58714 Win=11911 Len=0"
"4.291736","5.9.29.183","172.19.0.3","TLSv1.2","1207","Application Data"
"4.340704","172.19.0.3","5.9.29.183","TCP","56","43520 → 9002 [ACK] Seq=5887 Ack=59865 Win=11911 Len=0"
"4.349328","5.9.29.183","172.19.0.3","TCP","1516","[TCP segment of a reassembled PDU]"
"4.349416","5.9.29.183","172.19.0.3","TCP","1492","9002 → 43520 [PSH, ACK] Seq=61325 Ack=5887 Win=65535 Len=1436 [TCP segment of a reassembled PDU]"
"4.349513","5.9.29.183","172.19.0.3","TLSv1.2","1237","Application Data"
"4.349579","5.9.29.183","172.19.0.3","TCP","1516","[TCP segment of a reassembled PDU]"
"4.349586","5.9.29.183","172.19.0.3","TCP","1492","9002 → 43520 [PSH, ACK] Seq=65402 Ack=5887 Win=65535 Len=1436 [TCP segment of a reassembled PDU]"
"4.349613","172.19.0.3","5.9.29.183","TCP","56","43520 → 9002 [ACK] Seq=5887 Ack=66838 Win=11879 Len=0"
"4.364911","5.9.29.183","172.19.0.3","TLSv1.2","1516","Application Data [TCP segment of a reassembled PDU]"
"4.364987","5.9.29.183","172.19.0.3","TCP","1516","9002 → 43520 [PSH, ACK] Seq=68298 Ack=5887 Win=65535 Len=1460 [TCP segment of a reassembled PDU]"
"4.365007","172.19.0.3","5.9.29.183","TCP","56","43520 → 9002 [ACK] Seq=5887 Ack=69758 Win=11903 Len=0"
"4.365010","5.9.29.183","172.19.0.3","TCP","1480","9002 → 43520 [PSH, ACK] Seq=69758 Ack=5887 Win=65535 Len=1424 [TCP segment of a reassembled PDU]"
"4.365078","5.9.29.183","172.19.0.3","TLSv1.2","134","Application Data"
"4.365128","172.19.0.3","5.9.29.183","TCP","56","43520 → 9002 [ACK] Seq=5887 Ack=71260 Win=11892 Len=0"
"4.365515","172.19.0.3","5.9.29.183","TLSv1.2","599","Application Data"
"4.365828","5.9.29.183","172.19.0.3","TCP","56","9002 → 43520 [ACK] Seq=71260 Ack=6430 Win=65535 Len=0"
"4.479346","5.9.29.183","172.19.0.3","TCP","1516","[TCP segment of a reassembled PDU]"
"4.479420","5.9.29.183","172.19.0.3","TCP","1492","9002 → 43520 [PSH, ACK] Seq=72720 Ack=6430 Win=65535 Len=1436 [TCP segment of a reassembled PDU]"
"4.479443","172.19.0.3","5.9.29.183","TCP","56","43520 → 9002 [ACK] Seq=6430 Ack=74156 Win=11903 Len=0"
"4.479445","5.9.29.183","172.19.0.3","TLSv1.2","787","Application Data"
"4.490381","5.9.29.183","172.19.0.3","TCP","1504","[TCP segment of a reassembled PDU]"
"4.490411","172.19.0.3","5.9.29.183","TCP","56","43520 → 9002 [ACK] Seq=6430 Ack=76335 Win=11911 Len=0"
"4.490672","5.9.29.183","172.19.0.3","TCP","473","9002 → 43520 [PSH, ACK] Seq=76335 Ack=6430 Win=65535 Len=417 [TCP segment of a reassembled PDU]"
"4.490878","5.9.29.183","172.19.0.3","TCP","1516","9002 → 43520 [PSH, ACK] Seq=76752 Ack=6430 Win=65535 Len=1460 [TCP segment of a reassembled PDU]"
"4.490892","172.19.0.3","5.9.29.183","TCP","56","43520 → 9002 [ACK] Seq=6430 Ack=78212 Win=11911 Len=0"
"4.490935","5.9.29.183","172.19.0.3","TLSv1.2","1516","Application Data [TCP segment of a reassembled PDU]"
"4.490943","5.9.29.183","172.19.0.3","TCP","1516","9002 → 43520 [PSH, ACK] Seq=79672 Ack=6430 Win=65535 Len=1460 [TCP segment of a reassembled PDU]"
"4.491000","5.9.29.183","172.19.0.3","TCP","1051","9002 → 43520 [PSH, ACK] Seq=81132 Ack=6430 Win=65535 Len=995 [TCP segment of a reassembled PDU]"
"4.491039","172.19.0.3","5.9.29.183","TCP","56","43520 → 9002 [ACK] Seq=6430 Ack=82127 Win=11887 Len=0"
"4.491284","172.19.0.3","5.9.29.183","TLSv1.2","599","Application Data"
"4.491606","5.9.29.183","172.19.0.3","TCP","56","9002 → 43520 [ACK] Seq=82127 Ack=6973 Win=65535 Len=0"
"4.495671","5.9.29.183","172.19.0.3","TLSv1.2","584","Application Data"
"4.523983","5.9.29.183","172.19.0.3","TCP","1516","[TCP segment of a reassembled PDU]"
"4.524012","172.19.0.3","5.9.29.183","TCP","56","43520 → 9002 [ACK] Seq=6973 Ack=84115 Win=11911 Len=0"
"4.524106","5.9.29.183","172.19.0.3","TCP","1492","9002 → 43520 [PSH, ACK] Seq=84115 Ack=6973 Win=65535 Len=1436 [TCP segment of a reassembled PDU]"
"4.524197","5.9.29.183","172.19.0.3","TLSv1.2","1237","Application Data"
"4.524265","172.19.0.3","5.9.29.183","TCP","56","43520 → 9002 [ACK] Seq=6973 Ack=86732 Win=11895 Len=0"
"4.539572","5.9.29.183","172.19.0.3","TLSv1.2","663","Application Data"
"4.554989","5.9.29.183","172.19.0.3","TLSv1.2","1113","Application Data"
"4.555014","172.19.0.3","5.9.29.183","TCP","56","43520 → 9002 [ACK] Seq=6973 Ack=88396 Win=11911 Len=0"
"4.560100","5.9.29.183","172.19.0.3","TCP","1504","[TCP segment of a reassembled PDU]"
"4.570614","5.9.29.183","172.19.0.3","TLSv1.2","1207","Application Data"
"4.570639","172.19.0.3","5.9.29.183","TCP","56","43520 → 9002 [ACK] Seq=6973 Ack=90995 Win=11911 Len=0"
"4.575878","172.19.0.3","5.9.29.183","TLSv1.2","599","Application Data"
"4.576125","5.9.29.183","172.19.0.3","TCP","56","9002 → 43520 [ACK] Seq=90995 Ack=7516 Win=65535 Len=0"
"4.992352","5.9.29.183","172.19.0.3","TLSv1.2","599","Application Data"
"4.993252","172.19.0.3","5.9.29.183","TLSv1.2","599","Application Data"
"4.993562","5.9.29.183","172.19.0.3","TCP","56","9002 → 43520 [ACK] Seq=91538 Ack=8059 Win=65535 Len=0"
"5.395137","5.9.29.183","172.19.0.3","TCP","1516","[TCP segment of a reassembled PDU]"
"5.395240","5.9.29.183","172.19.0.3","TCP","1516","9002 → 43520 [PSH, ACK] Seq=92998 Ack=8059 Win=65535 Len=1460 [TCP segment of a reassembled PDU]"
"5.395256","5.9.29.183","172.19.0.3","TLSv1.2","763","Application Data"
"5.395386","172.19.0.3","5.9.29.183","TCP","56","43520 → 9002 [ACK] Seq=8059 Ack=95165 Win=11895 Len=0"
"5.410476","5.9.29.183","172.19.0.3","TCP","1516","[TCP segment of a reassembled PDU]"
"5.410539","5.9.29.183","172.19.0.3","TCP","1492","9002 → 43520 [PSH, ACK] Seq=96625 Ack=8059 Win=65535 Len=1436 [TCP segment of a reassembled PDU]"
"5.410555","172.19.0.3","5.9.29.183","TCP","56","43520 → 9002 [ACK] Seq=8059 Ack=98061 Win=11903 Len=0"
"5.415967","5.9.29.183","172.19.0.3","TLSv1.2","787","Application Data"
"5.457272","172.19.0.3","5.9.29.183","TCP","56","43520 → 9002 [ACK] Seq=8059 Ack=98792 Win=11911 Len=0"
"5.500640","5.9.29.183","172.19.0.3","TCP","1516","[TCP segment of a reassembled PDU]"
"5.500665","172.19.0.3","5.9.29.183","TCP","56","43520 → 9002 [ACK] Seq=8059 Ack=100252 Win=11911 Len=0"
"5.500728","5.9.29.183","172.19.0.3","TCP","1492","9002 → 43520 [PSH, ACK] Seq=100252 Ack=8059 Win=65535 Len=1436 [TCP segment of a reassembled PDU]"
"5.500760","172.19.0.3","5.9.29.183","TCP","56","43520 → 9002 [ACK] Seq=8059 Ack=101688 Win=11901 Len=0"
"5.500942","5.9.29.183","172.19.0.3","TLSv1.2","1237","Application Data"
"5.500953","172.19.0.3","5.9.29.183","TCP","56","43520 → 9002 [ACK] Seq=8059 Ack=102869 Win=11911 Len=0"
"5.512268","5.9.29.183","172.19.0.3","TLSv1.2","1516","Application Data"
"5.512332","172.19.0.3","5.9.29.183","TCP","56","43520 → 9002 [ACK] Seq=8059 Ack=104329 Win=11911 Len=0"
"5.512384","5.9.29.183","172.19.0.3","TCP","1492","9002 → 43520 [PSH, ACK] Seq=104329 Ack=8059 Win=65535 Len=1436 [TCP segment of a reassembled PDU]"
"5.512397","172.19.0.3","5.9.29.183","TCP","56","43520 → 9002 [ACK] Seq=8059 Ack=105765 Win=11903 Len=0"
"5.512504","5.9.29.183","172.19.0.3","TLSv1.2","1516","Application Data [TCP segment of a reassembled PDU]"
"5.512517","172.19.0.3","5.9.29.183","TCP","56","43520 → 9002 [ACK] Seq=8059 Ack=107225 Win=11895 Len=0"
"5.512520","5.9.29.183","172.19.0.3","TCP","1492","9002 → 43520 [PSH, ACK] Seq=107225 Ack=8059 Win=65535 Len=1436 [TCP segment of a reassembled PDU]"
"5.512523","5.9.29.183","172.19.0.3","TCP","1504","9002 → 43520 [PSH, ACK] Seq=108661 Ack=8059 Win=65535 Len=1448 [TCP segment of a reassembled PDU]"
"5.512544","172.19.0.3","5.9.29.183","TCP","56","43520 → 9002 [ACK] Seq=8059 Ack=108661 Win=11887 Len=0"
"5.512594","172.19.0.3","5.9.29.183","TCP","56","43520 → 9002 [ACK] Seq=8059 Ack=110109 Win=11879 Len=0"
"5.516989","5.9.29.183","172.19.0.3","TLSv1.2","677","Application Data"
"5.517014","172.19.0.3","5.9.29.183","TCP","56","43520 → 9002 [ACK] Seq=8059 Ack=110730 Win=11911 Len=0"
"5.535915","5.9.29.183","172.19.0.3","TCP","1516","[TCP segment of a reassembled PDU]"
"5.535943","172.19.0.3","5.9.29.183","TCP","56","43520 → 9002 [ACK] Seq=8059 Ack=112190 Win=11911 Len=0"
"5.536014","5.9.29.183","172.19.0.3","TCP","1492","9002 → 43520 [PSH, ACK] Seq=112190 Ack=8059 Win=65535 Len=1436 [TCP segment of a reassembled PDU]"
"5.536081","172.19.0.3","5.9.29.183","TCP","56","43520 → 9002 [ACK] Seq=8059 Ack=113626 Win=11903 Len=0"
"5.536173","5.9.29.183","172.19.0.3","TLSv1.2","1237","Application Data"
"5.536181","172.19.0.3","5.9.29.183","TCP","56","43520 → 9002 [ACK] Seq=8059 Ack=114807 Win=11911 Len=0"
"5.552096","5.9.29.183","172.19.0.3","TLSv1.2","149","Application Data"
"5.552119","172.19.0.3","5.9.29.183","TCP","56","43520 → 9002 [ACK] Seq=8059 Ack=114900 Win=11911 Len=0"
"5.571253","5.9.29.183","172.19.0.3","TCP","1516","[TCP segment of a reassembled PDU]"
"5.571476","5.9.29.183","172.19.0.3","TCP","1492","9002 → 43520 [PSH, ACK] Seq=116360 Ack=8059 Win=65535 Len=1436 [TCP segment of a reassembled PDU]"
"5.571522","172.19.0.3","5.9.29.183","TCP","56","43520 → 9002 [ACK] Seq=8059 Ack=117796 Win=11911 Len=0"
"5.571590","5.9.29.183","172.19.0.3","TLSv1.2","787","Application Data"
"5.571663","172.19.0.3","5.9.29.183","TCP","56","43520 → 9002 [ACK] Seq=8059 Ack=118527 Win=11911 Len=0"
"5.571936","172.19.0.3","5.9.29.183","TLSv1.2","1113","Application Data"
"5.572228","5.9.29.183","172.19.0.3","TCP","56","9002 → 43520 [ACK] Seq=118527 Ack=9116 Win=65535 Len=0"
"5.587727","5.9.29.183","172.19.0.3","TLSv1.2","1113","Application Data"
"5.604743","5.9.29.183","172.19.0.3","TLSv1.2","1113","Application Data"
"5.604770","172.19.0.3","5.9.29.183","TCP","56","43520 → 9002 [ACK] Seq=9116 Ack=120641 Win=11911 Len=0"
"5.609762","172.19.0.3","5.9.29.183","TLSv1.2","599","Application Data"
"5.610030","5.9.29.183","172.19.0.3","TCP","56","9002 → 43520 [ACK] Seq=120641 Ack=9659 Win=65535 Len=0"
"6.035226","5.9.29.183","172.19.0.3","TLSv1.2","599","Application Data"
"6.036211","172.19.0.3","5.9.29.183","TLSv1.2","599","Application Data"
"6.036565","5.9.29.183","172.19.0.3","TCP","56","9002 → 43520 [ACK] Seq=121184 Ack=10202 Win=65535 Len=0"
"6.496640","5.9.29.183","172.19.0.3","TCP","1516","[TCP segment of a reassembled PDU]"
"6.496734","5.9.29.183","172.19.0.3","TCP","1492","9002 → 43520 [PSH, ACK] Seq=122644 Ack=10202 Win=65535 Len=1436 [TCP segment of a reassembled PDU]"
"6.496881","172.19.0.3","5.9.29.183","TCP","56","43520 → 9002 [ACK] Seq=10202 Ack=124080 Win=11903 Len=0"
"6.498216","5.9.29.183","172.19.0.3","TLSv1.2","787","Application Data"
"6.504825","5.9.29.183","172.19.0.3","TCP","1504","[TCP segment of a reassembled PDU]"
"6.504851","172.19.0.3","5.9.29.183","TCP","56","43520 → 9002 [ACK] Seq=10202 Ack=126259 Win=11911 Len=0"
"6.504900","5.9.29.183","172.19.0.3","TCP","1504","9002 → 43520 [PSH, ACK] Seq=126259 Ack=10202 Win=65535 Len=1448 [TCP segment of a reassembled PDU]"
"6.513643","5.9.29.183","172.19.0.3","TLSv1.2","787","Application Data"
"6.513668","172.19.0.3","5.9.29.183","TCP","56","43520 → 9002 [ACK] Seq=10202 Ack=128438 Win=11911 Len=0"
"6.516620","5.9.29.183","172.19.0.3","TCP","1516","[TCP segment of a reassembled PDU]"
"6.516712","5.9.29.183","172.19.0.3","TCP","1492","9002 → 43520 [PSH, ACK] Seq=129898 Ack=10202 Win=65535 Len=1436 [TCP segment of a reassembled PDU]"
"6.516724","5.9.29.183","172.19.0.3","TLSv1.2","1504","Application Data [TCP segment of a reassembled PDU]"
"6.516863","172.19.0.3","5.9.29.183","TCP","56","43520 → 9002 [ACK] Seq=10202 Ack=132782 Win=11895 Len=0"
"6.529613","5.9.29.183","172.19.0.3","TLSv1.2","396","Application Data"
"6.561547","5.9.29.183","172.19.0.3","TCP","1516","[TCP segment of a reassembled PDU]"
"6.561562","172.19.0.3","5.9.29.183","TCP","56","43520 → 9002 [ACK] Seq=10202 Ack=134582 Win=11911 Len=0"
"6.561648","5.9.29.183","172.19.0.3","TCP","1492","9002 → 43520 [PSH, ACK] Seq=134582 Ack=10202 Win=65535 Len=1436 [TCP segment of a reassembled PDU]"
"6.561662","5.9.29.183","172.19.0.3","TLSv1.2","787","Application Data"
"6.561760","172.19.0.3","5.9.29.183","TCP","56","43520 → 9002 [ACK] Seq=10202 Ack=136749 Win=11895 Len=0"
"6.565594","172.19.0.3","5.9.29.183","TLSv1.2","599","Application Data"
"6.565844","5.9.29.183","172.19.0.3","TCP","56","9002 → 43520 [ACK] Seq=136749 Ack=10745 Win=65535 Len=0"
"6.964132","5.9.29.183","172.19.0.3","TLSv1.2","599","Application Data"
"6.965102","172.19.0.3","5.9.29.183","TLSv1.2","599","Application Data"
"6.965429","5.9.29.183","172.19.0.3","TCP","56","9002 → 43520 [ACK] Seq=137292 Ack=11288 Win=65535 Len=0"
"7.289845","02:42:7b:11:31:3d","","ARP","44","Who has 172.19.0.3? Tell 172.19.0.1"
"7.289860","02:42:ac:13:00:03","","ARP","44","172.19.0.3 is at 02:42:ac:13:00:03"
"7.361275","5.9.29.183","172.19.0.3","TCP","1516","[TCP segment of a reassembled PDU]"
"7.361428","5.9.29.183","172.19.0.3","TCP","1492","9002 → 43520 [PSH, ACK] Seq=138752 Ack=11288 Win=65535 Len=1436 [TCP segment of a reassembled PDU]"
"7.361465","5.9.29.183","172.19.0.3","TLSv1.2","787","Application Data"
"7.361579","172.19.0.3","5.9.29.183","TCP","56","43520 → 9002 [ACK] Seq=11288 Ack=140919 Win=11895 Len=0"
"7.372672","5.9.29.183","172.19.0.3","TCP","1425","[TCP segment of a reassembled PDU]"
"7.372732","5.9.29.183","172.19.0.3","TCP","135","9002 → 43520 [PSH, ACK] Seq=142288 Ack=11288 Win=65535 Len=79 [TCP segment of a reassembled PDU]"
"7.372936","172.19.0.3","5.9.29.183","TCP","56","43520 → 9002 [ACK] Seq=11288 Ack=142367 Win=11911 Len=0"
"7.372941","5.9.29.183","172.19.0.3","TCP","1504","9002 → 43520 [PSH, ACK] Seq=142367 Ack=11288 Win=65535 Len=1448 [TCP segment of a reassembled PDU]"
"7.372994","5.9.29.183","172.19.0.3","TLSv1.2","1504","Application Data [TCP segment of a reassembled PDU]"
"7.373030","172.19.0.3","5.9.29.183","TCP","56","43520 → 9002 [ACK] Seq=11288 Ack=145263 Win=11903 Len=0"
"7.377379","5.9.29.183","172.19.0.3","TLSv1.2","396","Application Data"
"7.419826","172.19.0.3","5.9.29.183","TCP","56","43520 → 9002 [ACK] Seq=11288 Ack=145603 Win=11911 Len=0"
"7.484001","5.9.29.183","172.19.0.3","TCP","1516","[TCP segment of a reassembled PDU]"
"7.484025","172.19.0.3","5.9.29.183","TCP","56","43520 → 9002 [ACK] Seq=11288 Ack=147063 Win=11911 Len=0"
"7.484084","5.9.29.183","172.19.0.3","TCP","1516","9002 → 43520 [PSH, ACK] Seq=147063 Ack=11288 Win=65535 Len=1460 [TCP segment of a reassembled PDU]"
"7.484108","172.19.0.3","5.9.29.183","TCP","56","43520 → 9002 [ACK] Seq=11288 Ack=148523 Win=11903 Len=0"
"7.484110","5.9.29.183","172.19.0.3","TLSv1.2","763","Application Data"
"7.484118","172.19.0.3","5.9.29.183","TCP","56","43520 → 9002 [ACK] Seq=11288 Ack=149230 Win=11898 Len=0"
"7.499920","5.9.29.183","172.19.0.3","TCP","1516","[TCP segment of a reassembled PDU]"
"7.499978","172.19.0.3","5.9.29.183","TCP","56","43520 → 9002 [ACK] Seq=11288 Ack=150690 Win=11911 Len=0"
"7.500028","5.9.29.183","172.19.0.3","TCP","1492","9002 → 43520 [PSH, ACK] Seq=150690 Ack=11288 Win=65535 Len=1436 [TCP segment of a reassembled PDU]"
"7.500040","172.19.0.3","5.9.29.183","TCP","56","43520 → 9002 [ACK] Seq=11288 Ack=152126 Win=11903 Len=0"
"7.500116","5.9.29.183","172.19.0.3","TLSv1.2","1330","Application Data, Application Data"
"7.500125","172.19.0.3","5.9.29.183","TCP","56","43520 → 9002 [ACK] Seq=11288 Ack=153400 Win=11895 Len=0"
"7.510985","5.9.29.183","172.19.0.3","TCP","1504","[TCP segment of a reassembled PDU]"
"7.511015","172.19.0.3","5.9.29.183","TCP","56","43520 → 9002 [ACK] Seq=11288 Ack=154848 Win=11911 Len=0"
"7.511215","5.9.29.183","172.19.0.3","TCP","1516","9002 → 43520 [PSH, ACK] Seq=154848 Ack=11288 Win=65535 Len=1460 [TCP segment of a reassembled PDU]"
"7.511228","172.19.0.3","5.9.29.183","TCP","56","43520 → 9002 [ACK] Seq=11288 Ack=156308 Win=11903 Len=0"
"7.511230","5.9.29.183","172.19.0.3","TLSv1.2","1516","Application Data [TCP segment of a reassembled PDU]"
"7.511268","172.19.0.3","5.9.29.183","TCP","56","43520 → 9002 [ACK] Seq=11288 Ack=157768 Win=11895 Len=0"
"7.511273","5.9.29.183","172.19.0.3","TCP","1480","9002 → 43520 [PSH, ACK] Seq=157768 Ack=11288 Win=65535 Len=1424 [TCP segment of a reassembled PDU]"
"7.511285","172.19.0.3","5.9.29.183","TCP","56","43520 → 9002 [ACK] Seq=11288 Ack=159192 Win=11887 Len=0"
"7.511404","5.9.29.183","172.19.0.3","TCP","1504","9002 → 43520 [PSH, ACK] Seq=159192 Ack=11288 Win=65535 Len=1448 [TCP segment of a reassembled PDU]"
"7.511416","172.19.0.3","5.9.29.183","TCP","56","43520 → 9002 [ACK] Seq=11288 Ack=160640 Win=11879 Len=0"
"7.515697","5.9.29.183","172.19.0.3","TLSv1.2","1127","Application Data, Application Data"
"7.515724","172.19.0.3","5.9.29.183","TCP","56","43520 → 9002 [ACK] Seq=11288 Ack=161711 Win=11911 Len=0"
"7.535893","5.9.29.183","172.19.0.3","TCP","1516","[TCP segment of a reassembled PDU]"
"7.535971","5.9.29.183","172.19.0.3","TLSv1.2","1195","Application Data"
"7.536167","172.19.0.3","5.9.29.183","TCP","56","43520 → 9002 [ACK] Seq=11288 Ack=164310 Win=11903 Len=0"
"7.536531","172.19.0.3","5.9.29.183","TLSv1.2","599","Application Data"
"7.536830","5.9.29.183","172.19.0.3","TCP","56","9002 → 43520 [ACK] Seq=164310 Ack=11831 Win=65535 Len=0"
"7.548650","5.9.29.183","172.19.0.3","TCP","1516","[TCP segment of a reassembled PDU]"
"7.548720","5.9.29.183","172.19.0.3","TCP","1492","9002 → 43520 [PSH, ACK] Seq=165770 Ack=11831 Win=65535 Len=1436 [TCP segment of a reassembled PDU]"
"7.548760","5.9.29.183","172.19.0.3","TLSv1.2","1516","Application Data [TCP segment of a reassembled PDU]"
"7.548765","5.9.29.183","172.19.0.3","TCP","1516","9002 → 43520 [PSH, ACK] Seq=168666 Ack=11831 Win=65535 Len=1460 [TCP segment of a reassembled PDU]"
"7.548768","5.9.29.183","172.19.0.3","TCP","1480","9002 → 43520 [PSH, ACK] Seq=170126 Ack=11831 Win=65535 Len=1424 [TCP segment of a reassembled PDU]"
"7.548861","172.19.0.3","5.9.29.183","TCP","56","43520 → 9002 [ACK] Seq=11831 Ack=171550 Win=11877 Len=0"
"7.551431","5.9.29.183","172.19.0.3","TLSv1.2","584","Application Data"
"7.551909","172.19.0.3","5.9.29.183","TLSv1.2","599","Application Data"
"7.552291","5.9.29.183","172.19.0.3","TCP","56","9002 → 43520 [ACK] Seq=172078 Ack=12374 Win=65535 Len=0"
"7.565895","5.9.29.183","172.19.0.3","TCP","1516","[TCP segment of a reassembled PDU]"
"7.565974","5.9.29.183","172.19.0.3","TCP","1516","9002 → 43520 [PSH, ACK] Seq=173538 Ack=12374 Win=65535 Len=1460 [TCP segment of a reassembled PDU]"
"7.565989","5.9.29.183","172.19.0.3","TLSv1.2","1516","Application Data [TCP segment of a reassembled PDU]"
"7.565994","5.9.29.183","172.19.0.3","TCP","1468","9002 → 43520 [PSH, ACK] Seq=176458 Ack=12374 Win=65535 Len=1412 [TCP segment of a reassembled PDU]"
"7.566182","172.19.0.3","5.9.29.183","TCP","56","43520 → 9002 [ACK] Seq=12374 Ack=177870 Win=11887 Len=0"
"7.566522","5.9.29.183","172.19.0.3","TCP","1504","9002 → 43520 [PSH, ACK] Seq=177870 Ack=12374 Win=65535 Len=1448 [TCP segment of a reassembled PDU]"
"7.566640","5.9.29.183","172.19.0.3","TLSv1.2","1516","Application Data [TCP segment of a reassembled PDU]"
"7.566649","172.19.0.3","5.9.29.183","TCP","56","43520 → 9002 [ACK] Seq=12374 Ack=180778 Win=11911 Len=0"
"7.566652","5.9.29.183","172.19.0.3","TLSv1.2","181","Application Data"
"7.570192","172.19.0.3","5.9.29.183","TLSv1.2","599","Application Data"
"7.570424","5.9.29.183","172.19.0.3","TCP","56","9002 → 43520 [ACK] Seq=180903 Ack=12917 Win=65535 Len=0"
"8.188411","5.9.29.183","172.19.0.3","TLSv1.2","599","Application Data"
"8.189272","172.19.0.3","5.9.29.183","TLSv1.2","599","Application Data"
"8.189701","5.9.29.183","172.19.0.3","TCP","56","9002 → 43520 [ACK] Seq=181446 Ack=13460 Win=65535 Len=0"
"8.574628","5.9.29.183","172.19.0.3","TCP","1516","[TCP segment of a reassembled PDU]"
"8.574723","5.9.29.183","172.19.0.3","TCP","1492","9002 → 43520 [PSH, ACK] Seq=182906 Ack=13460 Win=65535 Len=1436 [TCP segment of a reassembled PDU]"
"8.574755","5.9.29.183","172.19.0.3","TLSv1.2","787","Application Data"
"8.574856","172.19.0.3","5.9.29.183","TCP","56","43520 → 9002 [ACK] Seq=13460 Ack=185073 Win=11895 Len=0"
"8.591084","5.9.29.183","172.19.0.3","TCP","1516","[TCP segment of a reassembled PDU]"
"8.591176","5.9.29.183","172.19.0.3","TCP","1492","9002 → 43520 [PSH, ACK] Seq=186533 Ack=13460 Win=65535 Len=1436 [TCP segment of a reassembled PDU]"
"8.591194","172.19.0.3","5.9.29.183","TCP","56","43520 → 9002 [ACK] Seq=13460 Ack=187969 Win=11903 Len=0"
"8.591261","5.9.29.183","172.19.0.3","TLSv1.2","1330","Application Data, Application Data"
"8.607516","5.9.29.183","172.19.0.3","TLSv1.2","599","Application Data"
"8.607542","172.19.0.3","5.9.29.183","TCP","56","43520 → 9002 [ACK] Seq=13460 Ack=189786 Win=11911 Len=0"
"8.675687","5.9.29.183","172.19.0.3","TCP","1504","[TCP segment of a reassembled PDU]"
"8.675864","5.9.29.183","172.19.0.3","TCP","1504","9002 → 43520 [PSH, ACK] Seq=191234 Ack=13460 Win=65535 Len=1448 [TCP segment of a reassembled PDU]"
"8.675918","172.19.0.3","5.9.29.183","TCP","56","43520 → 9002 [ACK] Seq=13460 Ack=192682 Win=11903 Len=0"
"8.676020","5.9.29.183","172.19.0.3","TLSv1.2","787","Application Data"
"8.692362","5.9.29.183","172.19.0.3","TCP","1516","[TCP segment of a reassembled PDU]"
"8.692372","172.19.0.3","5.9.29.183","TCP","56","43520 → 9002 [ACK] Seq=13460 Ack=194873 Win=11911 Len=0"
"8.692404","5.9.29.183","172.19.0.3","TCP","1492","9002 → 43520 [PSH, ACK] Seq=194873 Ack=13460 Win=65535 Len=1436 [TCP segment of a reassembled PDU]"
"8.693085","5.9.29.183","172.19.0.3","TLSv1.2","1237","Application Data"
"8.693094","172.19.0.3","5.9.29.183","TCP","56","43520 → 9002 [ACK] Seq=13460 Ack=197490 Win=11911 Len=0"
"8.704062","5.9.29.183","172.19.0.3","TLSv1.2","1504","Application Data"
"8.704286","5.9.29.183","172.19.0.3","TCP","1504","9002 → 43520 [PSH, ACK] Seq=198938 Ack=13460 Win=65535 Len=1448 [TCP segment of a reassembled PDU]"
"8.704396","172.19.0.3","5.9.29.183","TCP","56","43520 → 9002 [ACK] Seq=13460 Ack=200386 Win=11901 Len=0"
"8.704465","5.9.29.183","172.19.0.3","TLSv1.2","1516","Application Data [TCP segment of a reassembled PDU]"
"8.704474","5.9.29.183","172.19.0.3","TCP","1516","9002 → 43520 [PSH, ACK] Seq=201846 Ack=13460 Win=65535 Len=1460 [TCP segment of a reassembled PDU]"
"8.704480","5.9.29.183","172.19.0.3","TCP","1480","9002 → 43520 [PSH, ACK] Seq=203306 Ack=13460 Win=65535 Len=1424 [TCP segment of a reassembled PDU]"
"8.704554","172.19.0.3","5.9.29.183","TCP","56","43520 → 9002 [ACK] Seq=13460 Ack=204730 Win=11877 Len=0"
"8.709371","5.9.29.183","172.19.0.3","TLSv1.2","677","Application Data"
"8.726802","5.9.29.183","172.19.0.3","TCP","1504","[TCP segment of a reassembled PDU]"
"8.726861","172.19.0.3","5.9.29.183","TCP","56","43520 → 9002 [ACK] Seq=13460 Ack=206799 Win=11911 Len=0"
"8.726976","5.9.29.183","172.19.0.3","TCP","1081","9002 → 43520 [PSH, ACK] Seq=206799 Ack=13460 Win=65535 Len=1025 [TCP segment of a reassembled PDU]"
"8.727062","5.9.29.183","172.19.0.3","TLSv1.2","1210","Application Data"
"8.727098","172.19.0.3","5.9.29.183","TCP","56","43520 → 9002 [ACK] Seq=13460 Ack=208978 Win=11895 Len=0"
"8.727381","172.19.0.3","5.9.29.183","TLSv1.2","599","Application Data"
"8.727657","5.9.29.183","172.19.0.3","TCP","56","9002 → 43520 [ACK] Seq=208978 Ack=14003 Win=65535 Len=0"
"8.761499","5.9.29.183","172.19.0.3","TCP","1516","[TCP segment of a reassembled PDU]"
"8.761606","5.9.29.183","172.19.0.3","TCP","1492","9002 → 43520 [PSH, ACK] Seq=210438 Ack=14003 Win=65535 Len=1436 [TCP segment of a reassembled PDU]"
"8.761644","5.9.29.183","172.19.0.3","TLSv1.2","787","Application Data"
"8.761825","172.19.0.3","5.9.29.183","TCP","56","43520 → 9002 [ACK] Seq=14003 Ack=212605 Win=11895 Len=0"
"8.778397","5.9.29.183","172.19.0.3","TCP","1516","[TCP segment of a reassembled PDU]"
"8.778470","5.9.29.183","172.19.0.3","TCP","1516","9002 → 43520 [PSH, ACK] Seq=214065 Ack=14003 Win=65535 Len=1460 [TCP segment of a reassembled PDU]"
"8.778491","172.19.0.3","5.9.29.183","TCP","56","43520 → 9002 [ACK] Seq=14003 Ack=215525 Win=11903 Len=0"
"8.778496","5.9.29.183","172.19.0.3","TLSv1.2","1213","Application Data"
"8.779999","172.19.0.3","5.9.29.183","TLSv1.2","599","Application Data"
"8.780431","5.9.29.183","172.19.0.3","TCP","56","9002 → 43520 [ACK] Seq=216682 Ack=14546 Win=65535 Len=0"
"8.790342","172.19.0.3","5.9.29.183","TLSv1.2","599","Application Data"
"8.790557","5.9.29.183","172.19.0.3","TCP","56","9002 → 43520 [ACK] Seq=216682 Ack=15089 Win=65535 Len=0"
"8.793670","5.9.29.183","172.19.0.3","TLSv1.2","149","Application Data"
"8.836879","172.19.0.3","5.9.29.183","TCP","56","43520 → 9002 [ACK] Seq=15089 Ack=216775 Win=11911 Len=0"
"9.198073","5.9.29.183","172.19.0.3","TLSv1.2","599","Application Data"
"9.198167","172.19.0.3","5.9.29.183","TCP","56","43520 → 9002 [ACK] Seq=15089 Ack=217318 Win=11911 Len=0"
"9.199086","172.19.0.3","5.9.29.183","TLSv1.2","599","Application Data"
"9.199487","5.9.29.183","172.19.0.3","TCP","56","9002 → 43520 [ACK] Seq=217318 Ack=15632 Win=65535 Len=0"
"9.607655","5.9.29.183","172.19.0.3","TCP","1516","[TCP segment of a reassembled PDU]"
"9.607756","5.9.29.183","172.19.0.3","TCP","1492","9002 → 43520 [PSH, ACK] Seq=218778 Ack=15632 Win=65535 Len=1436 [TCP segment of a reassembled PDU]"
"9.607769","5.9.29.183","172.19.0.3","TLSv1.2","787","Application Data"
"9.607904","172.19.0.3","5.9.29.183","TCP","56","43520 → 9002 [ACK] Seq=15632 Ack=220945 Win=11895 Len=0"
"9.758860","5.9.29.183","172.19.0.3","TCP","1516","[TCP segment of a reassembled PDU]"
"9.758924","5.9.29.183","172.19.0.3","TCP","1492","9002 → 43520 [PSH, ACK] Seq=222405 Ack=15632 Win=65535 Len=1436 [TCP segment of a reassembled PDU]"
"9.758990","172.19.0.3","5.9.29.183","TCP","56","43520 → 9002 [ACK] Seq=15632 Ack=223841 Win=11903 Len=0"
"9.758993","5.9.29.183","172.19.0.3","TLSv1.2","787","Application Data"
"9.763235","172.19.0.3","5.9.29.183","TLSv1.2","599","Application Data"
"9.763579","5.9.29.183","172.19.0.3","TCP","56","9002 → 43520 [ACK] Seq=224572 Ack=16175 Win=65535 Len=0"
"10.141632","5.9.29.183","172.19.0.3","TLSv1.2","599","Application Data"
"10.142641","172.19.0.3","5.9.29.183","TLSv1.2","599","Application Data"
"10.142991","5.9.29.183","172.19.0.3","TCP","56","9002 → 43520 [ACK] Seq=225115 Ack=16718 Win=65535 Len=0"
"10.539103","5.9.29.183","172.19.0.3","TCP","1516","[TCP segment of a reassembled PDU]"
"10.539206","5.9.29.183","172.19.0.3","TCP","1516","9002 → 43520 [PSH, ACK] Seq=226575 Ack=16718 Win=65535 Len=1460 [TCP segment of a reassembled PDU]"
"10.539221","5.9.29.183","172.19.0.3","TLSv1.2","763","Application Data"
"10.539370","172.19.0.3","5.9.29.183","TCP","56","43520 → 9002 [ACK] Seq=16718 Ack=228742 Win=11895 Len=0"
"10.539671","172.19.0.3","5.9.29.183","TLSv1.2","599","Application Data"
"10.539971","5.9.29.183","172.19.0.3","TCP","56","9002 → 43520 [ACK] Seq=228742 Ack=17261 Win=65535 Len=0"
"10.556159","5.9.29.183","172.19.0.3","TCP","1516","[TCP segment of a reassembled PDU]"
"10.556234","5.9.29.183","172.19.0.3","TCP","1516","9002 → 43520 [PSH, ACK] Seq=230202 Ack=17261 Win=65535 Len=1460 [TCP segment of a reassembled PDU]"
"10.556248","5.9.29.183","172.19.0.3","TLSv1.2","763","Application Data"
"10.556435","172.19.0.3","5.9.29.183","TCP","56","43520 → 9002 [ACK] Seq=17261 Ack=232369 Win=11893 Len=0"
"10.589467","5.9.29.183","172.19.0.3","TLSv1.2","1113","Application Data"
"10.631796","172.19.0.3","5.9.29.183","TCP","56","43520 → 9002 [ACK] Seq=17261 Ack=233426 Win=11911 Len=0"
"10.638352","5.9.29.183","172.19.0.3","TCP","1516","[TCP segment of a reassembled PDU]"
"10.638376","172.19.0.3","5.9.29.183","TCP","56","43520 → 9002 [ACK] Seq=17261 Ack=234886 Win=11911 Len=0"
"10.638433","5.9.29.183","172.19.0.3","TCP","1492","9002 → 43520 [PSH, ACK] Seq=234886 Ack=17261 Win=65535 Len=1436 [TCP segment of a reassembled PDU]"
"10.638451","172.19.0.3","5.9.29.183","TCP","56","43520 → 9002 [ACK] Seq=17261 Ack=236322 Win=11903 Len=0"
"10.638452","5.9.29.183","172.19.0.3","TLSv1.2","273","Application Data"
"10.638458","172.19.0.3","5.9.29.183","TCP","56","43520 → 9002 [ACK] Seq=17261 Ack=236539 Win=11902 Len=0"
"10.649220","5.9.29.183","172.19.0.3","TCP","1504","[TCP segment of a reassembled PDU]"
"10.649250","172.19.0.3","5.9.29.183","TCP","56","43520 → 9002 [ACK] Seq=17261 Ack=237987 Win=11911 Len=0"
"10.649462","5.9.29.183","172.19.0.3","TCP","1504","9002 → 43520 [PSH, ACK] Seq=237987 Ack=17261 Win=65535 Len=1448 [TCP segment of a reassembled PDU]"
"10.649475","172.19.0.3","5.9.29.183","TCP","56","43520 → 9002 [ACK] Seq=17261 Ack=239435 Win=11903 Len=0"
"10.649478","5.9.29.183","172.19.0.3","TLSv1.2","1504","Application Data [TCP segment of a reassembled PDU]"
"10.649483","172.19.0.3","5.9.29.183","TCP","56","43520 → 9002 [ACK] Seq=17261 Ack=240883 Win=11895 Len=0"
"10.653983","5.9.29.183","172.19.0.3","TLSv1.2","1516","Application Data [TCP segment of a reassembled PDU]"
"10.654006","172.19.0.3","5.9.29.183","TCP","56","43520 → 9002 [ACK] Seq=17261 Ack=242343 Win=11911 Len=0"
"10.654079","5.9.29.183","172.19.0.3","TCP","1492","9002 → 43520 [PSH, ACK] Seq=242343 Ack=17261 Win=65535 Len=1436 [TCP segment of a reassembled PDU]"
"10.654123","172.19.0.3","5.9.29.183","TCP","56","43520 → 9002 [ACK] Seq=17261 Ack=243779 Win=11903 Len=0"
"10.654306","5.9.29.183","172.19.0.3","TLSv1.2","613","Application Data"
"10.654332","172.19.0.3","5.9.29.183","TCP","56","43520 → 9002 [ACK] Seq=17261 Ack=244336 Win=11911 Len=0"
"10.665402","5.9.29.183","172.19.0.3","TCP","1504","[TCP segment of a reassembled PDU]"
"10.665429","172.19.0.3","5.9.29.183","TCP","56","43520 → 9002 [ACK] Seq=17261 Ack=245784 Win=11911 Len=0"
"10.665580","5.9.29.183","172.19.0.3","TCP","1504","9002 → 43520 [PSH, ACK] Seq=245784 Ack=17261 Win=65535 Len=1448 [TCP segment of a reassembled PDU]"
"10.665589","172.19.0.3","5.9.29.183","TCP","56","43520 → 9002 [ACK] Seq=17261 Ack=247232 Win=11903 Len=0"
"10.665591","5.9.29.183","172.19.0.3","TLSv1.2","1516","Application Data [TCP segment of a reassembled PDU]"
"10.665593","5.9.29.183","172.19.0.3","TCP","1516","9002 → 43520 [PSH, ACK] Seq=248692 Ack=17261 Win=65535 Len=1460 [TCP segment of a reassembled PDU]"
"10.665620","172.19.0.3","5.9.29.183","TCP","56","43520 → 9002 [ACK] Seq=17261 Ack=248692 Win=11895 Len=0"
"10.665668","5.9.29.183","172.19.0.3","TCP","1480","9002 → 43520 [PSH, ACK] Seq=250152 Ack=17261 Win=65535 Len=1424 [TCP segment of a reassembled PDU]"
"10.665781","172.19.0.3","5.9.29.183","TCP","56","43520 → 9002 [ACK] Seq=17261 Ack=251576 Win=11879 Len=0"
"10.670294","5.9.29.183","172.19.0.3","TLSv1.2","584","Application Data"
"10.670522","172.19.0.3","5.9.29.183","TCP","56","43520 → 9002 [ACK] Seq=17261 Ack=252104 Win=11911 Len=0"
"10.670766","172.19.0.3","5.9.29.183","TLSv1.2","599","Application Data"
"10.671008","5.9.29.183","172.19.0.3","TCP","56","9002 → 43520 [ACK] Seq=252104 Ack=17804 Win=65535 Len=0"
"10.686805","5.9.29.183","172.19.0.3","TLSv1.2","599","Application Data"
"10.727368","172.19.0.3","5.9.29.183","TCP","56","43520 → 9002 [ACK] Seq=17804 Ack=252647 Win=11911 Len=0"
"10.731524","5.9.29.183","172.19.0.3","TCP","1504","[TCP segment of a reassembled PDU]"
"10.731760","172.19.0.3","5.9.29.183","TCP","56","43520 → 9002 [ACK] Seq=17804 Ack=254095 Win=11911 Len=0"
"10.731899","5.9.29.183","172.19.0.3","TCP","1504","9002 → 43520 [PSH, ACK] Seq=254095 Ack=17804 Win=65535 Len=1448 [TCP segment of a reassembled PDU]"
"10.732078","5.9.29.183","172.19.0.3","TLSv1.2","1516","Application Data [TCP segment of a reassembled PDU]"
"10.732154","5.9.29.183","172.19.0.3","TCP","1225","9002 → 43520 [PSH, ACK] Seq=257003 Ack=17804 Win=65535 Len=1169 [TCP segment of a reassembled PDU]"
"10.732181","5.9.29.183","172.19.0.3","TCP","1504","9002 → 43520 [PSH, ACK] Seq=258172 Ack=17804 Win=65535 Len=1448 [TCP segment of a reassembled PDU]"
"10.732210","172.19.0.3","5.9.29.183","TCP","56","43520 → 9002 [ACK] Seq=17804 Ack=259620 Win=11893 Len=0"
"10.747343","5.9.29.183","172.19.0.3","TLSv1.2","1516","Application Data [TCP segment of a reassembled PDU]"
"10.747393","5.9.29.183","172.19.0.3","TCP","1516","9002 → 43520 [PSH, ACK] Seq=261080 Ack=17804 Win=65535 Len=1460 [TCP segment of a reassembled PDU]"
"10.747410","172.19.0.3","5.9.29.183","TCP","56","43520 → 9002 [ACK] Seq=17804 Ack=262540 Win=11903 Len=0"
"10.747413","5.9.29.183","172.19.0.3","TLSv1.2","1516","Application Data [TCP segment of a reassembled PDU]"
"10.747419","5.9.29.183","172.19.0.3","TCP","1516","9002 → 43520 [PSH, ACK] Seq=264000 Ack=17804 Win=65535 Len=1460 [TCP segment of a reassembled PDU]"
"10.747473","5.9.29.183","172.19.0.3","TCP","1456","9002 → 43520 [PSH, ACK] Seq=265460 Ack=17804 Win=65535 Len=1400 [TCP segment of a reassembled PDU]"
"10.747517","172.19.0.3","5.9.29.183","TCP","56","43520 → 9002 [ACK] Seq=17804 Ack=266860 Win=11879 Len=0"
"10.747551","5.9.29.183","172.19.0.3","TLSv1.2","1504","Application Data [TCP segment of a reassembled PDU]"
"10.747885","5.9.29.183","172.19.0.3","TLSv1.2","1502","Application Data"
"10.747895","172.19.0.3","5.9.29.183","TCP","56","43520 → 9002 [ACK] Seq=17804 Ack=268308 Win=11911 Len=0"
"10.747931","172.19.0.3","5.9.29.183","TCP","56","43520 → 9002 [ACK] Seq=17804 Ack=269754 Win=11911 Len=0"
"10.812163","5.9.29.183","172.19.0.3","TCP","1516","[TCP segment of a reassembled PDU]"
"10.812231","5.9.29.183","172.19.0.3","TCP","1492","9002 → 43520 [PSH, ACK] Seq=271214 Ack=17804 Win=65535 Len=1436 [TCP segment of a reassembled PDU]"
"10.812243","5.9.29.183","172.19.0.3","TCP","766","9002 → 43520 [PSH, ACK] Seq=272650 Ack=17804 Win=65535 Len=710 [TCP segment of a reassembled PDU]"
"10.812396","5.9.29.183","172.19.0.3","TLSv1.2","1516","Application Data [TCP segment of a reassembled PDU]"
"10.812402","5.9.29.183","172.19.0.3","TCP","1516","9002 → 43520 [PSH, ACK] Seq=274820 Ack=17804 Win=65535 Len=1460 [TCP segment of a reassembled PDU]"
"10.812404","5.9.29.183","172.19.0.3","TCP","503","9002 → 43520 [PSH, ACK] Seq=276280 Ack=17804 Win=65535 Len=447 [TCP segment of a reassembled PDU]"
"10.812412","172.19.0.3","5.9.29.183","TCP","56","43520 → 9002 [ACK] Seq=17804 Ack=273360 Win=11895 Len=0"
"10.812497","172.19.0.3","5.9.29.183","TCP","56","43520 → 9002 [ACK] Seq=17804 Ack=276727 Win=11871 Len=0"
"10.827808","5.9.29.183","172.19.0.3","TLSv1.2","1516","Application Data, Application Data"
"10.827881","5.9.29.183","172.19.0.3","TCP","1516","9002 → 43520 [PSH, ACK] Seq=278187 Ack=17804 Win=65535 Len=1460 [TCP segment of a reassembled PDU]"
"10.827899","172.19.0.3","5.9.29.183","TCP","56","43520 → 9002 [ACK] Seq=17804 Ack=279647 Win=11903 Len=0"
"10.827902","5.9.29.183","172.19.0.3","TCP","1480","9002 → 43520 [PSH, ACK] Seq=279647 Ack=17804 Win=65535 Len=1424 [TCP segment of a reassembled PDU]"
"10.827906","5.9.29.183","172.19.0.3","TLSv1.2","1516","Application Data [TCP segment of a reassembled PDU]"
"10.827909","5.9.29.183","172.19.0.3","TCP","1516","9002 → 43520 [PSH, ACK] Seq=282531 Ack=17804 Win=65535 Len=1460 [TCP segment of a reassembled PDU]"
"10.827912","5.9.29.183","172.19.0.3","TCP","1480","9002 → 43520 [PSH, ACK] Seq=283991 Ack=17804 Win=65535 Len=1424 [TCP segment of a reassembled PDU]"
"10.828026","172.19.0.3","5.9.29.183","TCP","56","43520 → 9002 [ACK] Seq=17804 Ack=285415 Win=11869 Len=0"
"10.828381","5.9.29.183","172.19.0.3","TLSv1.2","1017","Application Data, Application Data"
"10.828429","172.19.0.3","5.9.29.183","TLSv1.2","599","Application Data"
"10.828663","5.9.29.183","172.19.0.3","TCP","56","9002 → 43520 [ACK] Seq=286376 Ack=18347 Win=65535 Len=0"
"10.842913","172.19.0.3","5.9.29.183","TLSv1.2","599","Application Data"
"10.843516","5.9.29.183","172.19.0.3","TCP","56","9002 → 43520 [ACK] Seq=286376 Ack=18890 Win=65535 Len=0"
"10.848815","5.9.29.183","172.19.0.3","TLSv1.2","1113","Application Data"
"10.866304","5.9.29.183","172.19.0.3","TCP","1504","[TCP segment of a reassembled PDU]"
"10.866322","172.19.0.3","5.9.29.183","TCP","56","43520 → 9002 [ACK] Seq=18890 Ack=288881 Win=11911 Len=0"
"10.866652","5.9.29.183","172.19.0.3","TCP","1504","9002 → 43520 [PSH, ACK] Seq=288881 Ack=18890 Win=65535 Len=1448 [TCP segment of a reassembled PDU]"
"10.866699","5.9.29.183","172.19.0.3","TLSv1.2","273","Application Data"
"10.866785","172.19.0.3","5.9.29.183","TCP","56","43520 → 9002 [ACK] Seq=18890 Ack=290546 Win=11911 Len=0"
"10.899508","5.9.29.183","172.19.0.3","TCP","1516","[TCP segment of a reassembled PDU]"
"10.899567","5.9.29.183","172.19.0.3","TCP","1516","9002 → 43520 [PSH, ACK] Seq=292006 Ack=18890 Win=65535 Len=1460 [TCP segment of a reassembled PDU]"
"10.899576","5.9.29.183","172.19.0.3","TLSv1.2","763","Application Data"
"10.899711","172.19.0.3","5.9.29.183","TCP","56","43520 → 9002 [ACK] Seq=18890 Ack=294173 Win=11895 Len=0"
"10.915658","5.9.29.183","172.19.0.3","TCP","1516","[TCP segment of a reassembled PDU]"
"10.915730","5.9.29.183","172.19.0.3","TLSv1.2","681","Application Data"
"10.915755","172.19.0.3","5.9.29.183","TCP","56","43520 → 9002 [ACK] Seq=18890 Ack=296258 Win=11903 Len=0"
"10.920466","172.19.0.3","5.9.29.183","TLSv1.2","599","Application Data"
"10.920788","5.9.29.183","172.19.0.3","TCP","56","9002 → 43520 [ACK] Seq=296258 Ack=19433 Win=65535 Len=0"
"11.354440","5.9.29.183","172.19.0.3","TLSv1.2","599","Application Data"
"11.355224","172.19.0.3","5.9.29.183","TLSv1.2","599","Application Data"
"11.355568","5.9.29.183","172.19.0.3","TCP","56","9002 → 43520 [ACK] Seq=296801 Ack=19976 Win=65535 Len=0"
"11.809955","5.9.29.183","172.19.0.3","TCP","1516","[TCP segment of a reassembled PDU]"
"11.810082","5.9.29.183","172.19.0.3","TCP","1492","9002 → 43520 [PSH, ACK] Seq=298261 Ack=19976 Win=65535 Len=1436 [TCP segment of a reassembled PDU]"
"11.810098","5.9.29.183","172.19.0.3","TLSv1.2","787","Application Data"
"11.810233","172.19.0.3","5.9.29.183","TCP","56","43520 → 9002 [ACK] Seq=19976 Ack=300428 Win=11895 Len=0"
"11.843863","5.9.29.183","172.19.0.3","TCP","1504","[TCP segment of a reassembled PDU]"
"11.844011","5.9.29.183","172.19.0.3","TCP","1504","9002 → 43520 [PSH, ACK] Seq=301876 Ack=19976 Win=65535 Len=1448 [TCP segment of a reassembled PDU]"
"11.844025","172.19.0.3","5.9.29.183","TCP","56","43520 → 9002 [ACK] Seq=19976 Ack=303324 Win=11903 Len=0"
"11.844028","5.9.29.183","172.19.0.3","TLSv1.2","1237","Application Data"
"11.860213","5.9.29.183","172.19.0.3","TLSv1.2","149","Application Data"
"11.860407","172.19.0.3","5.9.29.183","TCP","56","43520 → 9002 [ACK] Seq=19976 Ack=304598 Win=11911 Len=0"
"11.890767","5.9.29.183","172.19.0.3","TCP","1516","[TCP segment of a reassembled PDU]"
"11.890878","5.9.29.183","172.19.0.3","TCP","1492","9002 → 43520 [PSH, ACK] Seq=306058 Ack=19976 Win=65535 Len=1436 [TCP segment of a reassembled PDU]"
"11.890934","5.9.29.183","172.19.0.3","TLSv1.2","1516","Application Data [TCP segment of a reassembled PDU]"
"11.890939","5.9.29.183","172.19.0.3","TCP","1516","9002 → 43520 [PSH, ACK] Seq=308954 Ack=19976 Win=65535 Len=1460 [TCP segment of a reassembled PDU]"
"11.890943","5.9.29.183","172.19.0.3","TCP","1213","9002 → 43520 [PSH, ACK] Seq=310414 Ack=19976 Win=65535 Len=1157 [TCP segment of a reassembled PDU]"
"11.891036","172.19.0.3","5.9.29.183","TCP","56","43520 → 9002 [ACK] Seq=19976 Ack=311571 Win=11879 Len=0"
"11.906616","5.9.29.183","172.19.0.3","TLSv1.2","851","Application Data"
"11.907708","5.9.29.183","172.19.0.3","TCP","1504","[TCP segment of a reassembled PDU]"
"11.907727","172.19.0.3","5.9.29.183","TCP","56","43520 → 9002 [ACK] Seq=19976 Ack=313814 Win=11911 Len=0"
"11.908320","5.9.29.183","172.19.0.3","TCP","1516","9002 → 43520 [PSH, ACK] Seq=313814 Ack=19976 Win=65535 Len=1460 [TCP segment of a reassembled PDU]"
"11.908367","5.9.29.183","172.19.0.3","TLSv1.2","1516","Application Data [TCP segment of a reassembled PDU]"
"11.908375","5.9.29.183","172.19.0.3","TCP","1516","9002 → 43520 [PSH, ACK] Seq=316734 Ack=19976 Win=65535 Len=1460 [TCP segment of a reassembled PDU]"
"11.908379","5.9.29.183","172.19.0.3","TCP","1468","9002 → 43520 [PSH, ACK] Seq=318194 Ack=19976 Win=65535 Len=1412 [TCP segment of a reassembled PDU]"
"11.908439","172.19.0.3","5.9.29.183","TCP","56","43520 → 9002 [ACK] Seq=19976 Ack=319606 Win=11887 Len=0"
"11.921987","5.9.29.183","172.19.0.3","TLSv1.2","584","Application Data"
"11.942881","5.9.29.183","172.19.0.3","TCP","1516","[TCP segment of a reassembled PDU]"
"11.942910","172.19.0.3","5.9.29.183","TCP","56","43520 → 9002 [ACK] Seq=19976 Ack=321594 Win=11911 Len=0"
"11.943018","5.9.29.183","172.19.0.3","TCP","1492","9002 → 43520 [PSH, ACK] Seq=321594 Ack=19976 Win=65535 Len=1436 [TCP segment of a reassembled PDU]"
"11.943139","5.9.29.183","172.19.0.3","TLSv1.2","1237","Application Data"
"11.943185","172.19.0.3","5.9.29.183","TCP","56","43520 → 9002 [ACK] Seq=19976 Ack=324211 Win=11895 Len=0"
"11.943553","172.19.0.3","5.9.29.183","TLSv1.2","599","Application Data"
"11.943816","5.9.29.183","172.19.0.3","TCP","56","9002 → 43520 [ACK] Seq=324211 Ack=20519 Win=65535 Len=0"
"11.961989","5.9.29.183","172.19.0.3","TLSv1.2","1177","Application Data"
"11.996580","5.9.29.183","172.19.0.3","TCP","1516","[TCP segment of a reassembled PDU]"
"11.996601","172.19.0.3","5.9.29.183","TCP","56","43520 → 9002 [ACK] Seq=20519 Ack=326792 Win=11911 Len=0"
"11.996645","5.9.29.183","172.19.0.3","TCP","1492","9002 → 43520 [PSH, ACK] Seq=326792 Ack=20519 Win=65535 Len=1436 [TCP segment of a reassembled PDU]"
"11.996655","5.9.29.183","172.19.0.3","TLSv1.2","787","Application Data"
"11.996786","172.19.0.3","5.9.29.183","TCP","56","43520 → 9002 [ACK] Seq=20519 Ack=328959 Win=11895 Len=0"
"12.011986","5.9.29.183","172.19.0.3","TCP","1516","[TCP segment of a reassembled PDU]"
"12.012138","5.9.29.183","172.19.0.3","TCP","1492","9002 → 43520 [PSH, ACK] Seq=330419 Ack=20519 Win=65535 Len=1436 [TCP segment of a reassembled PDU]"
"12.012158","172.19.0.3","5.9.29.183","TCP","56","43520 → 9002 [ACK] Seq=20519 Ack=331855 Win=11903 Len=0"
"12.012247","5.9.29.183","172.19.0.3","TLSv1.2","1516","Application Data [TCP segment of a reassembled PDU]"
"12.012252","5.9.29.183","172.19.0.3","TCP","1516","9002 → 43520 [PSH, ACK] Seq=333315 Ack=20519 Win=65535 Len=1460 [TCP segment of a reassembled PDU]"
"12.012259","172.19.0.3","5.9.29.183","TCP","56","43520 → 9002 [ACK] Seq=20519 Ack=334775 Win=11903 Len=0"
"12.012261","5.9.29.183","172.19.0.3","TCP","1480","9002 → 43520 [PSH, ACK] Seq=334775 Ack=20519 Win=65535 Len=1424 [TCP segment of a reassembled PDU]"
"12.012264","5.9.29.183","172.19.0.3","TLSv1.2","584","Application Data"
"12.012288","172.19.0.3","5.9.29.183","TCP","56","43520 → 9002 [ACK] Seq=20519 Ack=336727 Win=11888 Len=0"
"12.012634","172.19.0.3","5.9.29.183","TLSv1.2","599","Application Data"
"12.012852","5.9.29.183","172.19.0.3","TCP","56","9002 → 43520 [ACK] Seq=336727 Ack=21062 Win=65535 Len=0"
"12.030667","5.9.29.183","172.19.0.3","TCP","1504","[TCP segment of a reassembled PDU]"
"12.031059","5.9.29.183","172.19.0.3","TCP","777","9002 → 43520 [PSH, ACK] Seq=338175 Ack=21062 Win=65535 Len=721 [TCP segment of a reassembled PDU]"
"12.031078","172.19.0.3","5.9.29.183","TCP","56","43520 → 9002 [ACK] Seq=21062 Ack=338896 Win=11911 Len=0"
"12.031119","5.9.29.183","172.19.0.3","TCP","1516","9002 → 43520 [PSH, ACK] Seq=338896 Ack=21062 Win=65535 Len=1460 [TCP segment of a reassembled PDU]"
"12.031128","5.9.29.183","172.19.0.3","TLSv1.2","504","Application Data"
"12.031199","172.19.0.3","5.9.29.183","TCP","56","43520 → 9002 [ACK] Seq=21062 Ack=340804 Win=11911 Len=0"
"12.036626","5.9.29.183","172.19.0.3","TLSv1.2","1504","Application Data"
"12.036665","5.9.29.183","172.19.0.3","TCP","1504","9002 → 43520 [PSH, ACK] Seq=342252 Ack=21062 Win=65535 Len=1448 [TCP segment of a reassembled PDU]"
"12.036744","172.19.0.3","5.9.29.183","TCP","56","43520 → 9002 [ACK] Seq=21062 Ack=343700 Win=11903 Len=0"
"12.046865","5.9.29.183","172.19.0.3","TLSv1.2","880","Application Data"
"12.086692","5.9.29.183","172.19.0.3","TCP","1516","[TCP segment of a reassembled PDU]"
"12.086715","172.19.0.3","5.9.29.183","TCP","56","43520 → 9002 [ACK] Seq=21062 Ack=345984 Win=11911 Len=0"
"12.086771","5.9.29.183","172.19.0.3","TCP","1492","9002 → 43520 [PSH, ACK] Seq=345984 Ack=21062 Win=65535 Len=1436 [TCP segment of a reassembled PDU]"
"12.086783","5.9.29.183","172.19.0.3","TLSv1.2","1237","Application Data"
"12.086926","172.19.0.3","5.9.29.183","TCP","56","43520 → 9002 [ACK] Seq=21062 Ack=348601 Win=11895 Len=0"
"12.094201","5.9.29.183","172.19.0.3","TLSv1.2","1504","Application Data"
"12.094668","172.19.0.3","5.9.29.183","TLSv1.2","599","Application Data"
"12.095094","5.9.29.183","172.19.0.3","TCP","56","9002 → 43520 [ACK] Seq=350049 Ack=21605 Win=65535 Len=0"
"12.102400","5.9.29.183","172.19.0.3","TLSv1.2","1300","Application Data"
"12.106204","5.9.29.183","172.19.0.3","TCP","1504","[TCP segment of a reassembled PDU]"
"12.106424","5.9.29.183","172.19.0.3","TCP","1516","9002 → 43520 [PSH, ACK] Seq=352741 Ack=21605 Win=65535 Len=1460 [TCP segment of a reassembled PDU]"
"12.106434","5.9.29.183","172.19.0.3","TLSv1.2","1516","Application Data [TCP segment of a reassembled PDU]"
"12.106465","5.9.29.183","172.19.0.3","TCP","1516","9002 → 43520 [PSH, ACK] Seq=355661 Ack=21605 Win=65535 Len=1460 [TCP segment of a reassembled PDU]"
"12.106470","172.19.0.3","5.9.29.183","TCP","56","43520 → 9002 [ACK] Seq=21605 Ack=354201 Win=11901 Len=0"
"12.106490","5.9.29.183","172.19.0.3","TCP","1516","9002 → 43520 [PSH, ACK] Seq=357121 Ack=21605 Win=65535 Len=1460 [TCP segment of a reassembled PDU]"
"12.106557","172.19.0.3","5.9.29.183","TCP","56","43520 → 9002 [ACK] Seq=21605 Ack=358581 Win=11877 Len=0"
"12.106639","5.9.29.183","172.19.0.3","TLSv1.2","1516","Application Data [TCP segment of a reassembled PDU]"
"12.106650","5.9.29.183","172.19.0.3","TCP","1444","9002 → 43520 [PSH, ACK] Seq=360041 Ack=21605 Win=65535 Len=1388 [TCP segment of a reassembled PDU]"
"12.106663","5.9.29.183","172.19.0.3","TCP","1516","9002 → 43520 [PSH, ACK] Seq=361429 Ack=21605 Win=65535 Len=1460 [TCP segment of a reassembled PDU]"
"12.106735","5.9.29.183","172.19.0.3","TLSv1.2","1492","Application Data [TCP segment of a reassembled PDU]"
"12.106768","172.19.0.3","5.9.29.183","TCP","56","43520 → 9002 [ACK] Seq=21605 Ack=364325 Win=11845 Len=0"
"12.111513","5.9.29.183","172.19.0.3","TCP","1516","9002 → 43520 [PSH, ACK] Seq=364325 Ack=21605 Win=65535 Len=1460 [TCP segment of a reassembled PDU]"
"12.111587","5.9.29.183","172.19.0.3","TCP","1492","9002 → 43520 [PSH, ACK] Seq=365785 Ack=21605 Win=65535 Len=1436 [TCP segment of a reassembled PDU]"
"12.111611","172.19.0.3","5.9.29.183","TCP","56","43520 → 9002 [ACK] Seq=21605 Ack=367221 Win=11903 Len=0"
"12.118218","5.9.29.183","172.19.0.3","TLSv1.2","178","Application Data"
"12.133643","5.9.29.183","172.19.0.3","TLSv1.2","599","Application Data"
"12.133891","172.19.0.3","5.9.29.183","TCP","56","43520 → 9002 [ACK] Seq=21605 Ack=367886 Win=11911 Len=0"
"12.167063","5.9.29.183","172.19.0.3","TCP","1516","[TCP segment of a reassembled PDU]"
"12.167138","5.9.29.183","172.19.0.3","TLSv1.2","681","Application Data"
"12.167279","172.19.0.3","5.9.29.183","TCP","56","43520 → 9002 [ACK] Seq=21605 Ack=369971 Win=11903 Len=0"
"12.172528","172.19.0.3","5.9.29.183","TLSv1.2","599","Application Data"
"12.173176","5.9.29.183","172.19.0.3","TCP","56","9002 → 43520 [ACK] Seq=369971 Ack=22148 Win=65535 Len=0"
"12.642956","5.9.29.183","172.19.0.3","TLSv1.2","599","Application Data"
"12.643624","172.19.0.3","5.9.29.183","TLSv1.2","599","Application Data"
"12.643854","5.9.29.183","172.19.0.3","TCP","56","9002 → 43520 [ACK] Seq=370514 Ack=22691 Win=65535 Len=0"
"13.510819","5.9.29.183","172.19.0.3","TCP","1516","[TCP segment of a reassembled PDU]"
"13.510848","5.9.29.183","172.19.0.3","TCP","1492","9002 → 43520 [PSH, ACK] Seq=371974 Ack=22691 Win=65535 Len=1436 [TCP segment of a reassembled PDU]"
"13.510898","5.9.29.183","172.19.0.3","TLSv1.2","787","Application Data"
"13.510973","172.19.0.3","5.9.29.183","TCP","56","43520 → 9002 [ACK] Seq=22691 Ack=374141 Win=11895 Len=0"
"13.530004","5.9.29.183","172.19.0.3","TCP","1516","[TCP segment of a reassembled PDU]"
"13.530034","5.9.29.183","172.19.0.3","TCP","1516","9002 → 43520 [PSH, ACK] Seq=375601 Ack=22691 Win=65535 Len=1460 [TCP segment of a reassembled PDU]"
"13.530050","172.19.0.3","5.9.29.183","TCP","56","43520 → 9002 [ACK] Seq=22691 Ack=377061 Win=11903 Len=0"
"13.530053","5.9.29.183","172.19.0.3","TLSv1.2","763","Application Data"
"13.550271","5.9.29.183","172.19.0.3","TCP","1516","[TCP segment of a reassembled PDU]"
"13.550295","172.19.0.3","5.9.29.183","TCP","56","43520 → 9002 [ACK] Seq=22691 Ack=379228 Win=11911 Len=0"
"13.550311","5.9.29.183","172.19.0.3","TCP","1516","9002 → 43520 [PSH, ACK] Seq=379228 Ack=22691 Win=65535 Len=1460 [TCP segment of a reassembled PDU]"
"13.550319","5.9.29.183","172.19.0.3","TLSv1.2","1213","Application Data"
"13.550531","172.19.0.3","5.9.29.183","TCP","56","43520 → 9002 [ACK] Seq=22691 Ack=381845 Win=11895 Len=0"
"13.560614","5.9.29.183","172.19.0.3","TLSv1.2","1504","Application Data"
"13.560689","5.9.29.183","172.19.0.3","TCP","1516","9002 → 43520 [PSH, ACK] Seq=383293 Ack=22691 Win=65535 Len=1460 [TCP segment of a reassembled PDU]"
"13.560707","172.19.0.3","5.9.29.183","TCP","56","43520 → 9002 [ACK] Seq=22691 Ack=384753 Win=11901 Len=0"
"13.560710","5.9.29.183","172.19.0.3","TLSv1.2","1516","Application Data [TCP segment of a reassembled PDU]"
"13.560714","5.9.29.183","172.19.0.3","TCP","1516","9002 → 43520 [PSH, ACK] Seq=386213 Ack=22691 Win=65535 Len=1460 [TCP segment of a reassembled PDU]"
"13.560844","5.9.29.183","172.19.0.3","TCP","1516","9002 → 43520 [PSH, ACK] Seq=387673 Ack=22691 Win=65535 Len=1460 [TCP segment of a reassembled PDU]"
"13.560851","5.9.29.183","172.19.0.3","TLSv1.2","1516","Application Data [TCP segment of a reassembled PDU]"
"13.560926","172.19.0.3","5.9.29.183","TCP","56","43520 → 9002 [ACK] Seq=22691 Ack=390593 Win=11869 Len=0"
"13.561013","5.9.29.183","172.19.0.3","TCP","1444","9002 → 43520 [PSH, ACK] Seq=390593 Ack=22691 Win=65535 Len=1388 [TCP segment of a reassembled PDU]"
"13.561303","172.19.0.3","5.9.29.183","TLSv1.2","599","Application Data"
"13.561643","5.9.29.183","172.19.0.3","TCP","56","9002 → 43520 [ACK] Seq=391981 Ack=23234 Win=65535 Len=0"
"13.566651","5.9.29.183","172.19.0.3","TLSv1.2","1408","Application Data"
"13.608910","172.19.0.3","5.9.29.183","TCP","56","43520 → 9002 [ACK] Seq=23234 Ack=393333 Win=11911 Len=0"
"13.618305","5.9.29.183","172.19.0.3","TCP","1516","[TCP segment of a reassembled PDU]"
"13.618329","172.19.0.3","5.9.29.183","TCP","56","43520 → 9002 [ACK] Seq=23234 Ack=394793 Win=11911 Len=0"
"13.618346","5.9.29.183","172.19.0.3","TCP","1492","9002 → 43520 [PSH, ACK] Seq=394793 Ack=23234 Win=65535 Len=1436 [TCP segment of a reassembled PDU]"
"13.618360","172.19.0.3","5.9.29.183","TCP","56","43520 → 9002 [ACK] Seq=23234 Ack=396229 Win=11903 Len=0"
"13.618362","5.9.29.183","172.19.0.3","TLSv1.2","1237","Application Data"
"13.618368","172.19.0.3","5.9.29.183","TCP","56","43520 → 9002 [ACK] Seq=23234 Ack=397410 Win=11895 Len=0"
"13.618813","172.19.0.3","5.9.29.183","TLSv1.2","599","Application Data"
"13.619127","5.9.29.183","172.19.0.3","TCP","56","9002 → 43520 [ACK] Seq=397410 Ack=23777 Win=65535 Len=0"
"13.635194","5.9.29.183","172.19.0.3","TLSv1.2","149","Application Data"
"13.635321","5.9.29.183","172.19.0.3","TCP","1504","[TCP segment of a reassembled PDU]"
"13.635419","172.19.0.3","5.9.29.183","TCP","56","43520 → 9002 [ACK] Seq=23777 Ack=398951 Win=11903 Len=0"
"13.650834","5.9.29.183","172.19.0.3","TLSv1.2","179","Application Data"
"13.652876","5.9.29.183","172.19.0.3","TCP","1516","[TCP segment of a reassembled PDU]"
"13.652899","172.19.0.3","5.9.29.183","TCP","56","43520 → 9002 [ACK] Seq=23777 Ack=400534 Win=11911 Len=0"
"13.652914","5.9.29.183","172.19.0.3","TCP","1492","9002 → 43520 [PSH, ACK] Seq=400534 Ack=23777 Win=65535 Len=1436 [TCP segment of a reassembled PDU]"
"13.666341","5.9.29.183","172.19.0.3","TLSv1.2","1516","Application Data [TCP segment of a reassembled PDU]"
"13.666368","172.19.0.3","5.9.29.183","TCP","56","43520 → 9002 [ACK] Seq=23777 Ack=403430 Win=11911 Len=0"
"13.666386","5.9.29.183","172.19.0.3","TCP","1058","9002 → 43520 [PSH, ACK] Seq=403430 Ack=23777 Win=65535 Len=1002 [TCP segment of a reassembled PDU]"
"13.666584","5.9.29.183","172.19.0.3","TCP","1221","9002 → 43520 [PSH, ACK] Seq=404432 Ack=23777 Win=65535 Len=1165 [TCP segment of a reassembled PDU]"
"13.666591","5.9.29.183","172.19.0.3","TLSv1.2","1516","Application Data [TCP segment of a reassembled PDU]"
"13.666597","5.9.29.183","172.19.0.3","TCP","1492","9002 → 43520 [PSH, ACK] Seq=407057 Ack=23777 Win=65535 Len=1436 [TCP segment of a reassembled PDU]"
"13.666668","172.19.0.3","5.9.29.183","TCP","56","43520 → 9002 [ACK] Seq=23777 Ack=408493 Win=11877 Len=0"
"13.684460","5.9.29.183","172.19.0.3","TLSv1.2","490","Application Data"
"13.689540","172.19.0.3","5.9.29.183","TLSv1.2","599","Application Data"
"13.689783","5.9.29.183","172.19.0.3","TCP","56","9002 → 43520 [ACK] Seq=408927 Ack=24320 Win=65535 Len=0"
"15.406972","5.9.29.183","172.19.0.3","TLSv1.2","599","Application Data"
"15.407902","172.19.0.3","5.9.29.183","TLSv1.2","599","Application Data"
"15.408337","5.9.29.183","172.19.0.3","TCP","56","9002 → 43520 [ACK] Seq=409470 Ack=24863 Win=65535 Len=0"
"15.854999","5.9.29.183","172.19.0.3","TCP","1516","[TCP segment of a reassembled PDU]"
"15.855024","5.9.29.183","172.19.0.3","TCP","1492","9002 → 43520 [PSH, ACK] Seq=410930 Ack=24863 Win=65535 Len=1436 [TCP segment of a reassembled PDU]"
"15.855105","5.9.29.183","172.19.0.3","TLSv1.2","787","Application Data"
"15.855175","172.19.0.3","5.9.29.183","TCP","56","43520 → 9002 [ACK] Seq=24863 Ack=413097 Win=11893 Len=0"
"15.872377","5.9.29.183","172.19.0.3","TCP","1504","[TCP segment of a reassembled PDU]"
"15.872515","5.9.29.183","172.19.0.3","TCP","1504","9002 → 43520 [PSH, ACK] Seq=414545 Ack=24863 Win=65535 Len=1448 [TCP segment of a reassembled PDU]"
"15.872529","172.19.0.3","5.9.29.183","TCP","56","43520 → 9002 [ACK] Seq=24863 Ack=415993 Win=11903 Len=0"
"15.872532","5.9.29.183","172.19.0.3","TLSv1.2","787","Application Data"
"15.888967","5.9.29.183","172.19.0.3","TLSv1.2","599","Application Data"
"15.889122","172.19.0.3","5.9.29.183","TCP","56","43520 → 9002 [ACK] Seq=24863 Ack=417267 Win=11911 Len=0"
"15.939357","5.9.29.183","172.19.0.3","TCP","1504","[TCP segment of a reassembled PDU]"
"15.939521","5.9.29.183","172.19.0.3","TCP","1504","9002 → 43520 [PSH, ACK] Seq=418715 Ack=24863 Win=65535 Len=1448 [TCP segment of a reassembled PDU]"
"15.939531","5.9.29.183","172.19.0.3","TLSv1.2","787","Application Data"
"15.939611","172.19.0.3","5.9.29.183","TCP","56","43520 → 9002 [ACK] Seq=24863 Ack=420894 Win=11895 Len=0"
"15.950390","5.9.29.183","172.19.0.3","TCP","1516","[TCP segment of a reassembled PDU]"
"15.950420","5.9.29.183","172.19.0.3","TCP","1516","9002 → 43520 [PSH, ACK] Seq=422354 Ack=24863 Win=65535 Len=1460 [TCP segment of a reassembled PDU]"
"15.950434","172.19.0.3","5.9.29.183","TCP","56","43520 → 9002 [ACK] Seq=24863 Ack=423814 Win=11903 Len=0"
"15.950437","5.9.29.183","172.19.0.3","TLSv1.2","1480","Application Data [TCP segment of a reassembled PDU]"
"15.955535","5.9.29.183","172.19.0.3","TLSv1.2","396","Application Data"
"15.955559","172.19.0.3","5.9.29.183","TCP","56","43520 → 9002 [ACK] Seq=24863 Ack=425578 Win=11911 Len=0"
"15.966536","5.9.29.183","172.19.0.3","TCP","1504","[TCP segment of a reassembled PDU]"
"15.966703","5.9.29.183","172.19.0.3","TCP","1504","9002 → 43520 [PSH, ACK] Seq=427026 Ack=24863 Win=65535 Len=1448 [TCP segment of a reassembled PDU]"
"15.966712","5.9.29.183","172.19.0.3","TLSv1.2","1504","Application Data [TCP segment of a reassembled PDU]"
"15.966789","172.19.0.3","5.9.29.183","TCP","56","43520 → 9002 [ACK] Seq=24863 Ack=429922 Win=11895 Len=0"
"15.971503","5.9.29.183","172.19.0.3","TLSv1.2","396","Application Data"
"15.971534","5.9.29.183","172.19.0.3","TCP","1504","[TCP segment of a reassembled PDU]"
"15.971551","172.19.0.3","5.9.29.183","TCP","56","43520 → 9002 [ACK] Seq=24863 Ack=431710 Win=11903 Len=0"
"15.972107","5.9.29.183","172.19.0.3","TCP","1504","9002 → 43520 [PSH, ACK] Seq=431710 Ack=24863 Win=65535 Len=1448 [TCP segment of a reassembled PDU]"
"15.986881","5.9.29.183","172.19.0.3","TLSv1.2","787","Application Data"
"15.986905","172.19.0.3","5.9.29.183","TCP","56","43520 → 9002 [ACK] Seq=24863 Ack=433889 Win=11911 Len=0"
"16.011063","5.9.29.183","172.19.0.3","TCP","1516","[TCP segment of a reassembled PDU]"
"16.011088","5.9.29.183","172.19.0.3","TCP","1492","9002 → 43520 [PSH, ACK] Seq=435349 Ack=24863 Win=65535 Len=1436 [TCP segment of a reassembled PDU]"
"16.011093","5.9.29.183","172.19.0.3","TLSv1.2","1237","Application Data"
"16.011206","172.19.0.3","5.9.29.183","TCP","56","43520 → 9002 [ACK] Seq=24863 Ack=437966 Win=11893 Len=0"
"16.011604","172.19.0.3","5.9.29.183","TLSv1.2","1113","Application Data"
"16.011832","5.9.29.183","172.19.0.3","TCP","56","9002 → 43520 [ACK] Seq=437966 Ack=25920 Win=65535 Len=0"
"16.027985","5.9.29.183","172.19.0.3","TLSv1.2","149","Application Data"
"16.067363","5.9.29.183","172.19.0.3","TCP","1516","[TCP segment of a reassembled PDU]"
"16.067384","172.19.0.3","5.9.29.183","TCP","56","43520 → 9002 [ACK] Seq=25920 Ack=439519 Win=11911 Len=0"
"16.067393","5.9.29.183","172.19.0.3","TCP","1492","9002 → 43520 [PSH, ACK] Seq=439519 Ack=25920 Win=65535 Len=1436 [TCP segment of a reassembled PDU]"
"16.067400","5.9.29.183","172.19.0.3","TLSv1.2","787","Application Data"
"16.067557","172.19.0.3","5.9.29.183","TCP","56","43520 → 9002 [ACK] Seq=25920 Ack=441686 Win=11895 Len=0"
"16.069760","172.19.0.3","5.9.29.183","TLSv1.2","599","Application Data"
"16.070074","5.9.29.183","172.19.0.3","TCP","56","9002 → 43520 [ACK] Seq=441686 Ack=26463 Win=65535 Len=0"
"16.080052","172.19.0.3","5.9.29.183","TLSv1.2","599","Application Data"
"16.080304","5.9.29.183","172.19.0.3","TCP","56","9002 → 43520 [ACK] Seq=441686 Ack=27006 Win=65535 Len=0"
"16.084013","5.9.29.183","172.19.0.3","TLSv1.2","599","Application Data"
"16.124418","172.19.0.3","5.9.29.183","TCP","56","43520 → 9002 [ACK] Seq=27006 Ack=442229 Win=11911 Len=0"
"16.715704","5.9.29.183","172.19.0.3","TLSv1.2","599","Application Data"
"16.715774","172.19.0.3","5.9.29.183","TCP","56","43520 → 9002 [ACK] Seq=27006 Ack=442772 Win=11911 Len=0"
"16.716554","172.19.0.3","5.9.29.183","TLSv1.2","599","Application Data"
"16.716808","5.9.29.183","172.19.0.3","TCP","56","9002 → 43520 [ACK] Seq=442772 Ack=27549 Win=65535 Len=0"
"17.085719","5.9.29.183","172.19.0.3","TCP","1516","[TCP segment of a reassembled PDU]"
"17.085811","5.9.29.183","172.19.0.3","TCP","1492","9002 → 43520 [PSH, ACK] Seq=444232 Ack=27549 Win=65535 Len=1436 [TCP segment of a reassembled PDU]"
"17.085837","5.9.29.183","172.19.0.3","TLSv1.2","787","Application Data"
"17.085886","172.19.0.3","5.9.29.183","TCP","56","43520 → 9002 [ACK] Seq=27549 Ack=446399 Win=11895 Len=0"
"17.121230","5.9.29.183","172.19.0.3","TCP","1516","[TCP segment of a reassembled PDU]"
"17.121337","5.9.29.183","172.19.0.3","TCP","1516","9002 → 43520 [PSH, ACK] Seq=447859 Ack=27549 Win=65535 Len=1460 [TCP segment of a reassembled PDU]"
"17.121361","172.19.0.3","5.9.29.183","TCP","56","43520 → 9002 [ACK] Seq=27549 Ack=449319 Win=11903 Len=0"
"17.121436","5.9.29.183","172.19.0.3","TLSv1.2","763","Application Data"
"17.138802","5.9.29.183","172.19.0.3","TLSv1.2","599","Application Data"
"17.139065","172.19.0.3","5.9.29.183","TCP","56","43520 → 9002 [ACK] Seq=27549 Ack=450569 Win=11911 Len=0"
"17.172917","5.9.29.183","172.19.0.3","TCP","1516","[TCP segment of a reassembled PDU]"
"17.172990","5.9.29.183","172.19.0.3","TCP","1492","9002 → 43520 [PSH, ACK] Seq=452029 Ack=27549 Win=65535 Len=1436 [TCP segment of a reassembled PDU]"
"17.173197","172.19.0.3","5.9.29.183","TCP","56","43520 → 9002 [ACK] Seq=27549 Ack=453465 Win=11903 Len=0"
"17.174128","5.9.29.183","172.19.0.3","TLSv1.2","787","Application Data"
"17.183413","5.9.29.183","172.19.0.3","TCP","1504","[TCP segment of a reassembled PDU]"
"17.183441","172.19.0.3","5.9.29.183","TCP","56","43520 → 9002 [ACK] Seq=27549 Ack=455644 Win=11911 Len=0"
"17.183640","5.9.29.183","172.19.0.3","TCP","1516","9002 → 43520 [PSH, ACK] Seq=455644 Ack=27549 Win=65535 Len=1460 [TCP segment of a reassembled PDU]"
"17.183652","5.9.29.183","172.19.0.3","TLSv1.2","1516","Application Data [TCP segment of a reassembled PDU]"
"17.183654","5.9.29.183","172.19.0.3","TCP","1480","9002 → 43520 [PSH, ACK] Seq=458564 Ack=27549 Win=65535 Len=1424 [TCP segment of a reassembled PDU]"
"17.183687","172.19.0.3","5.9.29.183","TCP","56","43520 → 9002 [ACK] Seq=27549 Ack=459988 Win=11885 Len=0"
"17.191469","5.9.29.183","172.19.0.3","TCP","1504","9002 → 43520 [PSH, ACK] Seq=459988 Ack=27549 Win=65535 Len=1448 [TCP segment of a reassembled PDU]"
"17.192267","5.9.29.183","172.19.0.3","TLSv1.2","70","Application Data"
"17.192286","172.19.0.3","5.9.29.183","TCP","56","43520 → 9002 [ACK] Seq=27549 Ack=461450 Win=11911 Len=0"
"17.227300","5.9.29.183","172.19.0.3","TCP","1516","[TCP segment of a reassembled PDU]"
"17.227361","5.9.29.183","172.19.0.3","TCP","1492","9002 → 43520 [PSH, ACK] Seq=462910 Ack=27549 Win=65535 Len=1436 [TCP segment of a reassembled PDU]"
"17.227370","5.9.29.183","172.19.0.3","TLSv1.2","787","Application Data"
"17.227540","172.19.0.3","5.9.29.183","TCP","56","43520 → 9002 [ACK] Seq=27549 Ack=465077 Win=11895 Len=0"
"17.238732","5.9.29.183","172.19.0.3","TCP","1516","[TCP segment of a reassembled PDU]"
"17.238809","5.9.29.183","172.19.0.3","TCP","1492","9002 → 43520 [PSH, ACK] Seq=466537 Ack=27549 Win=65535 Len=1436 [TCP segment of a reassembled PDU]"
"17.238829","172.19.0.3","5.9.29.183","TCP","56","43520 → 9002 [ACK] Seq=27549 Ack=467973 Win=11903 Len=0"
"17.238832","5.9.29.183","172.19.0.3","TLSv1.2","1504","Application Data [TCP segment of a reassembled PDU]"
"17.239180","172.19.0.3","5.9.29.183","TLSv1.2","599","Application Data"
"17.239517","5.9.29.183","172.19.0.3","TCP","56","9002 → 43520 [ACK] Seq=469421 Ack=28092 Win=65535 Len=0"
"17.243702","5.9.29.183","172.19.0.3","TCP","603","9002 → 43520 [PSH, ACK] Seq=469421 Ack=28092 Win=65535 Len=547 [TCP segment of a reassembled PDU]"
"17.243779","5.9.29.183","172.19.0.3","TLSv1.2","363","Application Data"
"17.243930","172.19.0.3","5.9.29.183","TCP","56","43520 → 9002 [ACK] Seq=28092 Ack=470275 Win=11911 Len=0"
"17.256060","5.9.29.183","172.19.0.3","TCP","1504","[TCP segment of a reassembled PDU]"
"17.256415","5.9.29.183","172.19.0.3","TCP","1516","9002 → 43520 [PSH, ACK] Seq=471723 Ack=28092 Win=65535 Len=1460 [TCP segment of a reassembled PDU]"
"17.256431","172.19.0.3","5.9.29.183","TCP","56","43520 → 9002 [ACK] Seq=28092 Ack=473183 Win=11911 Len=0"
"17.256436","5.9.29.183","172.19.0.3","TLSv1.2","1516","Application Data [TCP segment of a reassembled PDU]"
"17.256442","5.9.29.183","172.19.0.3","TCP","1480","9002 → 43520 [PSH, ACK] Seq=474643 Ack=28092 Win=65535 Len=1424 [TCP segment of a reassembled PDU]"
"17.256503","172.19.0.3","5.9.29.183","TCP","56","43520 → 9002 [ACK] Seq=28092 Ack=476067 Win=11895 Len=0"
"17.256509","5.9.29.183","172.19.0.3","TCP","1504","9002 → 43520 [PSH, ACK] Seq=476067 Ack=28092 Win=65535 Len=1448 [TCP segment of a reassembled PDU]"
"17.259162","5.9.29.183","172.19.0.3","TLSv1.2","1127","Application Data, Application Data"
"17.259187","172.19.0.3","5.9.29.183","TCP","56","43520 → 9002 [ACK] Seq=28092 Ack=478586 Win=11911 Len=0"
"17.278351","5.9.29.183","172.19.0.3","TCP","1504","[TCP segment of a reassembled PDU]"
"17.278468","5.9.29.183","172.19.0.3","TCP","1504","9002 → 43520 [PSH, ACK] Seq=480034 Ack=28092 Win=65535 Len=1448 [TCP segment of a reassembled PDU]"
"17.278495","5.9.29.183","172.19.0.3","TLSv1.2","1237","Application Data"
"17.278619","172.19.0.3","5.9.29.183","TCP","56","43520 → 9002 [ACK] Seq=28092 Ack=482663 Win=11895 Len=0"
"17.294069","5.9.29.183","172.19.0.3","TLSv1.2","149","Application Data"
"17.309800","5.9.29.183","172.19.0.3","TLSv1.2","599","Application Data"
"17.310097","172.19.0.3","5.9.29.183","TCP","56","43520 → 9002 [ACK] Seq=28092 Ack=483299 Win=11911 Len=0"
"17.310522","5.9.29.183","172.19.0.3","TCP","1504","[TCP segment of a reassembled PDU]"
"17.310678","5.9.29.183","172.19.0.3","TCP","1516","9002 → 43520 [PSH, ACK] Seq=484747 Ack=28092 Win=65535 Len=1460 [TCP segment of a reassembled PDU]"
"17.310689","172.19.0.3","5.9.29.183","TCP","56","43520 → 9002 [ACK] Seq=28092 Ack=486207 Win=11911 Len=0"
"17.310691","5.9.29.183","172.19.0.3","TLSv1.2","1516","Application Data [TCP segment of a reassembled PDU]"
"17.310793","5.9.29.183","172.19.0.3","TCP","1516","9002 → 43520 [PSH, ACK] Seq=487667 Ack=28092 Win=65535 Len=1460 [TCP segment of a reassembled PDU]"
"17.310800","5.9.29.183","172.19.0.3","TCP","1468","9002 → 43520 [PSH, ACK] Seq=489127 Ack=28092 Win=65535 Len=1412 [TCP segment of a reassembled PDU]"
"17.310857","172.19.0.3","5.9.29.183","TCP","56","43520 → 9002 [ACK] Seq=28092 Ack=490539 Win=11895 Len=0"
"17.325213","5.9.29.183","172.19.0.3","TLSv1.2","584","Application Data"
"17.325690","172.19.0.3","5.9.29.183","TLSv1.2","599","Application Data"
"17.326100","5.9.29.183","172.19.0.3","TCP","56","9002 → 43520 [ACK] Seq=491067 Ack=28635 Win=65535 Len=0"
"17.328510","5.9.29.183","172.19.0.3","TCP","1504","[TCP segment of a reassembled PDU]"
"17.328829","5.9.29.183","172.19.0.3","TCP","1504","9002 → 43520 [PSH, ACK] Seq=492515 Ack=28635 Win=65535 Len=1448 [TCP segment of a reassembled PDU]"
"17.328850","172.19.0.3","5.9.29.183","TCP","56","43520 → 9002 [ACK] Seq=28635 Ack=493963 Win=11911 Len=0"
"17.328853","5.9.29.183","172.19.0.3","TLSv1.2","1504","Application Data [TCP segment of a reassembled PDU]"
"17.337222","172.19.0.3","5.9.29.183","TLSv1.2","599","Application Data"
"17.337722","5.9.29.183","172.19.0.3","TCP","56","9002 → 43520 [ACK] Seq=495411 Ack=29178 Win=65535 Len=0"
"17.340470","5.9.29.183","172.19.0.3","TLSv1.2","1424","Application Data"
"17.363790","5.9.29.183","172.19.0.3","TCP","1516","[TCP segment of a reassembled PDU]"
"17.363812","172.19.0.3","5.9.29.183","TCP","56","43520 → 9002 [ACK] Seq=29178 Ack=498239 Win=11911 Len=0"
"17.363892","5.9.29.183","172.19.0.3","TCP","1492","9002 → 43520 [PSH, ACK] Seq=498239 Ack=29178 Win=65535 Len=1436 [TCP segment of a reassembled PDU]"
"17.363968","5.9.29.183","172.19.0.3","TLSv1.2","1237","Application Data"
"17.364020","172.19.0.3","5.9.29.183","TCP","56","43520 → 9002 [ACK] Seq=29178 Ack=500856 Win=11895 Len=0"
"17.368671","5.9.29.183","172.19.0.3","TLSv1.2","1504","Application Data"
"17.368966","5.9.29.183","172.19.0.3","TCP","1504","9002 → 43520 [PSH, ACK] Seq=502304 Ack=29178 Win=65535 Len=1448 [TCP segment of a reassembled PDU]"
"17.368983","172.19.0.3","5.9.29.183","TCP","56","43520 → 9002 [ACK] Seq=29178 Ack=503752 Win=11903 Len=0"
"17.379117","5.9.29.183","172.19.0.3","TLSv1.2","880","Application Data"
"17.398216","5.9.29.183","172.19.0.3","TCP","1516","[TCP segment of a reassembled PDU]"
"17.398238","172.19.0.3","5.9.29.183","TCP","56","43520 → 9002 [ACK] Seq=29178 Ack=506036 Win=11911 Len=0"
"17.398289","5.9.29.183","172.19.0.3","TCP","1516","9002 → 43520 [PSH, ACK] Seq=506036 Ack=29178 Win=65535 Len=1460 [TCP segment of a reassembled PDU]"
"17.398300","5.9.29.183","172.19.0.3","TLSv1.2","1516","Application Data [TCP segment of a reassembled PDU]"
"17.398304","5.9.29.183","172.19.0.3","TCP","1201","9002 → 43520 [PSH, ACK] Seq=508956 Ack=29178 Win=65535 Len=1145 [TCP segment of a reassembled PDU]"
"17.398308","5.9.29.183","172.19.0.3","TCP","1516","9002 → 43520 [PSH, ACK] Seq=510101 Ack=29178 Win=65535 Len=1460 [TCP segment of a reassembled PDU]"
"17.398391","5.9.29.183","172.19.0.3","TLSv1.2","1516","Application Data [TCP segment of a reassembled PDU]"
"17.398400","5.9.29.183","172.19.0.3","TCP","1516","9002 → 43520 [PSH, ACK] Seq=513021 Ack=29178 Win=65535 Len=1460 [TCP segment of a reassembled PDU]"
"17.398403","5.9.29.183","172.19.0.3","TCP","1468","9002 → 43520 [PSH, ACK] Seq=514481 Ack=29178 Win=65535 Len=1412 [TCP segment of a reassembled PDU]"
"17.398446","172.19.0.3","5.9.29.183","TCP","56","43520 → 9002 [ACK] Seq=29178 Ack=515893 Win=11853 Len=0"
"17.413778","5.9.29.183","172.19.0.3","TLSv1.2","134","Application Data"
"17.454536","172.19.0.3","5.9.29.183","TCP","56","43520 → 9002 [ACK] Seq=29178 Ack=515971 Win=11911 Len=0"
"17.468688","5.9.29.183","172.19.0.3","TCP","1516","[TCP segment of a reassembled PDU]"
"17.468773","5.9.29.183","172.19.0.3","TCP","1492","9002 → 43520 [PSH, ACK] Seq=517431 Ack=29178 Win=65535 Len=1436 [TCP segment of a reassembled PDU]"
"17.468787","5.9.29.183","172.19.0.3","TLSv1.2","1237","Application Data"
"17.468951","172.19.0.3","5.9.29.183","TCP","56","43520 → 9002 [ACK] Seq=29178 Ack=520048 Win=11895 Len=0"
"17.485252","5.9.29.183","172.19.0.3","TLSv1.2","149","Application Data"
"17.485452","172.19.0.3","5.9.29.183","TCP","56","43520 → 9002 [ACK] Seq=29178 Ack=520141 Win=11911 Len=0"
"17.490197","172.19.0.3","5.9.29.183","TLSv1.2","599","Application Data"
"17.490459","5.9.29.183","172.19.0.3","TCP","56","9002 → 43520 [ACK] Seq=520141 Ack=29721 Win=65535 Len=0"
"17.857575","5.9.29.183","172.19.0.3","TLSv1.2","599","Application Data"
"17.858441","172.19.0.3","5.9.29.183","TLSv1.2","599","Application Data"
"17.858828","5.9.29.183","172.19.0.3","TCP","56","9002 → 43520 [ACK] Seq=520684 Ack=30264 Win=65535 Len=0"
"18.230836","5.9.29.183","172.19.0.3","TCP","1516","[TCP segment of a reassembled PDU]"
"18.230907","5.9.29.183","172.19.0.3","TCP","1516","9002 → 43520 [PSH, ACK] Seq=522144 Ack=30264 Win=65535 Len=1460 [TCP segment of a reassembled PDU]"
"18.230917","5.9.29.183","172.19.0.3","TLSv1.2","763","Application Data"
"18.231084","172.19.0.3","5.9.29.183","TCP","56","43520 → 9002 [ACK] Seq=30264 Ack=524311 Win=11895 Len=0"
"18.309182","5.9.29.183","172.19.0.3","TCP","1516","[TCP segment of a reassembled PDU]"
"18.309258","5.9.29.183","172.19.0.3","TCP","1492","9002 → 43520 [PSH, ACK] Seq=525771 Ack=30264 Win=65535 Len=1436 [TCP segment of a reassembled PDU]"
"18.309280","172.19.0.3","5.9.29.183","TCP","56","43520 → 9002 [ACK] Seq=30264 Ack=527207 Win=11903 Len=0"
"18.309282","5.9.29.183","172.19.0.3","TLSv1.2","787","Application Data"
"18.325170","5.9.29.183","172.19.0.3","TCP","1504","[TCP segment of a reassembled PDU]"
"18.325192","172.19.0.3","5.9.29.183","TCP","56","43520 → 9002 [ACK] Seq=30264 Ack=529386 Win=11911 Len=0"
"18.325288","5.9.29.183","172.19.0.3","TCP","1504","9002 → 43520 [PSH, ACK] Seq=529386 Ack=30264 Win=65535 Len=1448 [TCP segment of a reassembled PDU]"
"18.325365","5.9.29.183","172.19.0.3","TLSv1.2","1330","Application Data, Application Data"
"18.325457","172.19.0.3","5.9.29.183","TCP","56","43520 → 9002 [ACK] Seq=30264 Ack=532108 Win=11895 Len=0"
"18.363128","5.9.29.183","172.19.0.3","TCP","1516","[TCP segment of a reassembled PDU]"
"18.363189","5.9.29.183","172.19.0.3","TCP","1516","9002 → 43520 [PSH, ACK] Seq=533568 Ack=30264 Win=65535 Len=1460 [TCP segment of a reassembled PDU]"
"18.363207","172.19.0.3","5.9.29.183","TCP","56","43520 → 9002 [ACK] Seq=30264 Ack=535028 Win=11901 Len=0"
"18.363208","5.9.29.183","172.19.0.3","TCP","532","9002 → 43520 [PSH, ACK] Seq=535028 Ack=30264 Win=65535 Len=476 [TCP segment of a reassembled PDU]"
"18.363276","5.9.29.183","172.19.0.3","TLSv1.2","1516","Application Data [TCP segment of a reassembled PDU]"
"18.363281","5.9.29.183","172.19.0.3","TCP","1516","9002 → 43520 [PSH, ACK] Seq=536964 Ack=30264 Win=65535 Len=1460 [TCP segment of a reassembled PDU]"
"18.363284","5.9.29.183","172.19.0.3","TCP","713","9002 → 43520 [PSH, ACK] Seq=538424 Ack=30264 Win=65535 Len=657 [TCP segment of a reassembled PDU]"
"18.363317","172.19.0.3","5.9.29.183","TCP","56","43520 → 9002 [ACK] Seq=30264 Ack=539081 Win=11870 Len=0"
"18.378933","5.9.29.183","172.19.0.3","TLSv1.2","1516","Application Data, Application Data"
"18.379008","5.9.29.183","172.19.0.3","TCP","1382","9002 → 43520 [PSH, ACK] Seq=540541 Ack=30264 Win=65535 Len=1326 [TCP segment of a reassembled PDU]"
"18.379029","172.19.0.3","5.9.29.183","TCP","56","43520 → 9002 [ACK] Seq=30264 Ack=541867 Win=11903 Len=0"
"18.380118","5.9.29.183","172.19.0.3","TCP","1504","9002 → 43520 [PSH, ACK] Seq=541867 Ack=30264 Win=65535 Len=1448 [TCP segment of a reassembled PDU]"
"18.380206","5.9.29.183","172.19.0.3","TLSv1.2","1516","Application Data [TCP segment of a reassembled PDU]"
"18.380221","172.19.0.3","5.9.29.183","TCP","56","43520 → 9002 [ACK] Seq=30264 Ack=544775 Win=11903 Len=0"
"18.380224","5.9.29.183","172.19.0.3","TCP","1516","9002 → 43520 [PSH, ACK] Seq=544775 Ack=30264 Win=65535 Len=1460 [TCP segment of a reassembled PDU]"
"18.380284","5.9.29.183","172.19.0.3","TCP","1480","9002 → 43520 [PSH, ACK] Seq=546235 Ack=30264 Win=65535 Len=1424 [TCP segment of a reassembled PDU]"
"18.380455","172.19.0.3","5.9.29.183","TLSv1.2","599","Application Data"
"18.380862","5.9.29.183","172.19.0.3","TCP","56","9002 → 43520 [ACK] Seq=547659 Ack=30807 Win=65535 Len=0"
"18.394801","5.9.29.183","172.19.0.3","TLSv1.2","1127","Application Data, Application Data"
"18.394868","5.9.29.183","172.19.0.3","TCP","1516","[TCP segment of a reassembled PDU]"
"18.394885","172.19.0.3","5.9.29.183","TCP","56","43520 → 9002 [ACK] Seq=30807 Ack=550190 Win=11903 Len=0"
"18.394888","5.9.29.183","172.19.0.3","TCP","1492","9002 → 43520 [PSH, ACK] Seq=550190 Ack=30807 Win=65535 Len=1436 [TCP segment of a reassembled PDU]"
"18.395170","5.9.29.183","172.19.0.3","TLSv1.2","1504","Application Data [TCP segment of a reassembled PDU]"
"18.395349","172.19.0.3","5.9.29.183","TLSv1.2","599","Application Data"
"18.395598","5.9.29.183","172.19.0.3","TCP","56","9002 → 43520 [ACK] Seq=553074 Ack=31350 Win=65535 Len=0"
"18.399718","5.9.29.183","172.19.0.3","TLSv1.2","1504","Application Data [TCP segment of a reassembled PDU]"
"18.410745","5.9.29.183","172.19.0.3","TLSv1.2","1033","Application Data"
"18.410768","172.19.0.3","5.9.29.183","TCP","56","43520 → 9002 [ACK] Seq=31350 Ack=555499 Win=11911 Len=0"
"18.451213","5.9.29.183","172.19.0.3","TCP","1516","[TCP segment of a reassembled PDU]"
"18.451290","5.9.29.183","172.19.0.3","TLSv1.2","681","Application Data"
"18.451470","172.19.0.3","5.9.29.183","TCP","56","43520 → 9002 [ACK] Seq=31350 Ack=557584 Win=11901 Len=0"
"18.456092","172.19.0.3","5.9.29.183","TLSv1.2","599","Application Data"
"18.456342","5.9.29.183","172.19.0.3","TCP","56","9002 → 43520 [ACK] Seq=557584 Ack=31893 Win=65535 Len=0"
"19.183254","5.9.29.183","172.19.0.3","TLSv1.2","599","Application Data"
"19.184243","172.19.0.3","5.9.29.183","TLSv1.2","599","Application Data"
"19.184628","5.9.29.183","172.19.0.3","TCP","56","9002 → 43520 [ACK] Seq=558127 Ack=32436 Win=65535 Len=0"
"19.566549","5.9.29.183","172.19.0.3","TLSv1.2","599","Application Data"
"19.607211","172.19.0.3","5.9.29.183","TCP","56","43520 → 9002 [ACK] Seq=32436 Ack=558670 Win=11911 Len=0"
"19.741256","5.9.29.183","172.19.0.3","TCP","1516","[TCP segment of a reassembled PDU]"
"19.741277","172.19.0.3","5.9.29.183","TCP","56","43520 → 9002 [ACK] Seq=32436 Ack=560130 Win=11911 Len=0"
"19.741324","5.9.29.183","172.19.0.3","TLSv1.2","167","Application Data"
"19.741340","172.19.0.3","5.9.29.183","TCP","56","43520 → 9002 [ACK] Seq=32436 Ack=560241 Win=11911 Len=0"
