_ws.col.Time,_ws.col.Source,_ws.col.Destination,_ws.col.Protocol,_ws.col.Length,_ws.col.Info
"0.000000","172.19.0.3","5.9.29.183","TLSv1.2","599","Application Data"
"0.000236","5.9.29.183","172.19.0.3","TCP","56","9002 → 43520 [ACK] Seq=1 Ack=544 Win=65535 Len=0"
"0.410377","5.9.29.183","172.19.0.3","TLSv1.2","599","Application Data"
"0.410469","172.19.0.3","5.9.29.183","TCP","56","43520 → 9002 [ACK] Seq=544 Ack=544 Win=8466 Len=0"
"0.411372","172.19.0.3","5.9.29.183","TLSv1.2","2141","Application Data"
"0.411640","5.9.29.183","172.19.0.3","TCP","56","9002 → 43520 [ACK] Seq=544 Ack=2629 Win=65535 Len=0"
"1.065159","5.9.29.183","172.19.0.3","TCP","1516","[TCP segment of a reassembled PDU]"
"1.065261","5.9.29.183","172.19.0.3","TLSv1.2","167","Application Data"
"1.065411","172.19.0.3","5.9.29.183","TCP","56","43520 → 9002 [ACK] Seq=2629 Ack=2115 Win=8456 Len=0"
"1.070388","172.19.0.3","5.9.29.183","TLSv1.2","599","Application Data"
"1.070863","5.9.29.183","172.19.0.3","TCP","56","9002 → 43520 [ACK] Seq=2115 Ack=3172 Win=65535 Len=0"
"1.484980","5.9.29.183","172.19.0.3","TLSv1.2","599","Application Data"
"1.485500","172.19.0.3","5.9.29.183","TLSv1.2","599","Application Data"
"1.485750","5.9.29.183","172.19.0.3","TCP","56","9002 → 43520 [ACK] Seq=2658 Ack=3715 Win=65535 Len=0"
"1.928206","5.9.29.183","172.19.0.3","TCP","1516","[TCP segment of a reassembled PDU]"
"1.928270","5.9.29.183","172.19.0.3","TCP","1492","9002 → 43520 [PSH, ACK] Seq=4118 Ack=3715 Win=65535 Len=1436 [TCP segment of a reassembled PDU]"
"1.928281","5.9.29.183","172.19.0.3","TLSv1.2","787","Application Data"
"1.928430","172.19.0.3","5.9.29.183","TCP","56","43520 → 9002 [ACK] Seq=3715 Ack=6285 Win=8450 Len=0"
"1.943983","5.9.29.183","172.19.0.3","TCP","1504","[TCP segment of a reassembled PDU]"
"1.944034","5.9.29.183","172.19.0.3","TCP","1516","9002 → 43520 [PSH, ACK] Seq=7733 Ack=3715 Win=65535 Len=1460 [TCP segment of a reassembled PDU]"
"1.944048","172.19.0.3","5.9.29.183","TCP","56","43520 → 9002 [ACK] Seq=3715 Ack=9193 Win=8456 Len=0"
"1.944051","5.9.29.183","172.19.0.3","TLSv1.2","775","Application Data"
"1.960411","5.9.29.183","172.19.0.3","TLSv1.2","1113","Application Data"
"1.960431","172.19.0.3","5.9.29.183","TCP","56","43520 → 9002 [ACK] Seq=3715 Ack=10969 Win=8466 Len=0"
"2.008535","5.9.29.183","172.19.0.3","TCP","1516","[TCP segment of a reassembled PDU]"
"2.008650","5.9.29.183","172.19.0.3","TCP","1492","9002 → 43520 [PSH, ACK] Seq=12429 Ack=3715 Win=65535 Len=1436 [TCP segment of a reassembled PDU]"
"2.008688","5.9.29.183","172.19.0.3","TLSv1.2","787","Application Data"
"2.008692","172.19.0.3","5.9.29.183","TCP","56","43520 → 9002 [ACK] Seq=3715 Ack=13865 Win=8458 Len=0"
"2.024036","5.9.29.183","172.19.0.3","TLSv1.2","599","Application Data"
"2.024206","172.19.0.3","5.9.29.183","TCP","56","43520 → 9002 [ACK] Seq=3715 Ack=15139 Win=8466 Len=0"
"2.038746","5.9.29.183","172.19.0.3","TCP","1504","[TCP segment of a reassembled PDU]"
"2.038790","5.9.29.183","172.19.0.3","TCP","1516","9002 → 43520 [PSH, ACK] Seq=16587 Ack=3715 Win=65535 Len=1460 [TCP segment of a reassembled PDU]"
"2.038804","5.9.29.183","172.19.0.3","TLSv1.2","775","Application Data"
"2.038955","172.19.0.3","5.9.29.183","TCP","56","43520 → 9002 [ACK] Seq=3715 Ack=18766 Win=8450 Len=0"
"2.050359","5.9.29.183","172.19.0.3","TCP","1504","[TCP segment of a reassembled PDU]"
"2.050403","5.9.29.183","172.19.0.3","TCP","1516","9002 → 43520 [PSH, ACK] Seq=20214 Ack=3715 Win=65535 Len=1460 [TCP segment of a reassembled PDU]"
"2.050414","172.19.0.3","5.9.29.183","TCP","56","43520 → 9002 [ACK] Seq=3715 Ack=21674 Win=8458 Len=0"
"2.050416","5.9.29.183","172.19.0.3","TLSv1.2","1492","Application Data [TCP segment of a reassembled PDU]"
"2.050419","5.9.29.183","172.19.0.3","TCP","1516","9002 → 43520 [PSH, ACK] Seq=23110 Ack=3715 Win=65535 Len=1460 [TCP segment of a reassembled PDU]"
"2.050423","5.9.29.183","172.19.0.3","TCP","1492","9002 → 43520 [PSH, ACK] Seq=24570 Ack=3715 Win=65535 Len=1436 [TCP segment of a reassembled PDU]"
"2.050478","5.9.29.183","172.19.0.3","TLSv1.2","1516","Application Data [TCP segment of a reassembled PDU]"
"2.050483","5.9.29.183","172.19.0.3","TCP","775","9002 → 43520 [PSH, ACK] Seq=27466 Ack=3715 Win=65535 Len=719 [TCP segment of a reassembled PDU]"
"2.050485","5.9.29.183","172.19.0.3","TCP","773","9002 → 43520 [PSH, ACK] Seq=28185 Ack=3715 Win=65535 Len=717 [TCP segment of a reassembled PDU]"
"2.050519","172.19.0.3","5.9.29.183","TCP","56","43520 → 9002 [ACK] Seq=3715 Ack=28902 Win=8410 Len=0"
"2.055043","5.9.29.183","172.19.0.3","TCP","1516","9002 → 43520 [PSH, ACK] Seq=28902 Ack=3715 Win=65535 Len=1460 [TCP segment of a reassembled PDU]"
"2.055086","5.9.29.183","172.19.0.3","TLSv1.2","912","Application Data, Application Data"
"2.055098","172.19.0.3","5.9.29.183","TCP","56","43520 → 9002 [ACK] Seq=3715 Ack=31218 Win=8458 Len=0"
"2.055347","172.19.0.3","5.9.29.183","TLSv1.2","599","Application Data"
"2.055514","5.9.29.183","172.19.0.3","TCP","56","9002 → 43520 [ACK] Seq=31218 Ack=4258 Win=65535 Len=0"
"2.070565","5.9.29.183","172.19.0.3","TCP","1516","[TCP segment of a reassembled PDU]"
"2.070608","5.9.29.183","172.19.0.3","TCP","1492","9002 → 43520 [PSH, ACK] Seq=32678 Ack=4258 Win=65535 Len=1436 [TCP segment of a reassembled PDU]"
"2.070620","172.19.0.3","5.9.29.183","TCP","56","43520 → 9002 [ACK] Seq=4258 Ack=34114 Win=8458 Len=0"
"2.070622","5.9.29.183","172.19.0.3","TLSv1.2","787","Application Data"
"2.086758","5.9.29.183","172.19.0.3","TCP","1516","[TCP segment of a reassembled PDU]"
"2.086776","172.19.0.3","5.9.29.183","TCP","56","43520 → 9002 [ACK] Seq=4258 Ack=36305 Win=8466 Len=0"
"2.086807","5.9.29.183","172.19.0.3","TCP","1516","9002 → 43520 [PSH, ACK] Seq=36305 Ack=4258 Win=65535 Len=1460 [TCP segment of a reassembled PDU]"
"2.086836","5.9.29.183","172.19.0.3","TLSv1.2","1213","Application Data"
"2.086950","172.19.0.3","5.9.29.183","TCP","56","43520 → 9002 [ACK] Seq=4258 Ack=38922 Win=8450 Len=0"
"2.102070","5.9.29.183","172.19.0.3","TLSv1.2","149","Application Data"
"2.134319","5.9.29.183","172.19.0.3","TCP","1516","[TCP segment of a reassembled PDU]"
"2.134336","172.19.0.3","5.9.29.183","TCP","56","43520 → 9002 [ACK] Seq=4258 Ack=40475 Win=8466 Len=0"
"2.134370","5.9.29.183","172.19.0.3","TCP","1516","9002 → 43520 [PSH, ACK] Seq=40475 Ack=4258 Win=65535 Len=1460 [TCP segment of a reassembled PDU]"
"2.134400","5.9.29.183","172.19.0.3","TLSv1.2","1213","Application Data"
"2.134521","172.19.0.3","5.9.29.183","TCP","56","43520 → 9002 [ACK] Seq=4258 Ack=43092 Win=8450 Len=0"
"2.149568","5.9.29.183","172.19.0.3","TLSv1.2","149","Application Data"
"2.160214","5.9.29.183","172.19.0.3","TCP","1516","[TCP segment of a reassembled PDU]"
"2.160254","172.19.0.3","5.9.29.183","TCP","56","43520 → 9002 [ACK] Seq=4258 Ack=44645 Win=8466 Len=0"
"2.160307","5.9.29.183","172.19.0.3","TCP","1516","9002 → 43520 [PSH, ACK] Seq=44645 Ack=4258 Win=65535 Len=1460 [TCP segment of a reassembled PDU]"
"2.160354","5.9.29.183","172.19.0.3","TLSv1.2","1516","Application Data [TCP segment of a reassembled PDU]"
"2.160363","5.9.29.183","172.19.0.3","TCP","1516","9002 → 43520 [PSH, ACK] Seq=47565 Ack=4258 Win=65535 Len=1460 [TCP segment of a reassembled PDU]"
"2.160368","5.9.29.183","172.19.0.3","TCP","1516","9002 → 43520 [PSH, ACK] Seq=49025 Ack=4258 Win=65535 Len=1460 [TCP segment of a reassembled PDU]"
"2.160476","5.9.29.183","172.19.0.3","TLSv1.2","1516","Application Data [TCP segment of a reassembled PDU]"
"2.160480","5.9.29.183","172.19.0.3","TCP","1516","9002 → 43520 [PSH, ACK] Seq=51945 Ack=4258 Win=65535 Len=1460 [TCP segment of a reassembled PDU]"
"2.160482","5.9.29.183","172.19.0.3","TCP","1420","9002 → 43520 [PSH, ACK] Seq=53405 Ack=4258 Win=65535 Len=1364 [TCP segment of a reassembled PDU]"
"2.160484","5.9.29.183","172.19.0.3","TLSv1.2","1516","Application Data [TCP segment of a reassembled PDU]"
"2.160486","5.9.29.183","172.19.0.3","TCP","1516","9002 → 43520 [PSH, ACK] Seq=56229 Ack=4258 Win=65535 Len=1460 [TCP segment of a reassembled PDU]"
"2.160488","5.9.29.183","172.19.0.3","TCP","1480","9002 → 43520 [PSH, ACK] Seq=57689 Ack=4258 Win=65535 Len=1424 [TCP segment of a reassembled PDU]"
"2.160491","172.19.0.3","5.9.29.183","TCP","56","43520 → 9002 [ACK] Seq=4258 Ack=50485 Win=8434 Len=0"
"2.160586","172.19.0.3","5.9.29.183","TCP","56","43520 → 9002 [ACK] Seq=4258 Ack=59113 Win=8383 Len=0"
"2.161225","172.19.0.3","5.9.29.183","TLSv1.2","599","Application Data"
"2.161478","5.9.29.183","172.19.0.3","TCP","56","9002 → 43520 [ACK] Seq=59113 Ack=4801 Win=65535 Len=0"
"2.165155","5.9.29.183","172.19.0.3","TLSv1.2","721","Application Data, Application Data"
"2.170442","172.19.0.3","5.9.29.183","TLSv1.2","599","Application Data"
"2.170989","5.9.29.183","172.19.0.3","TCP","56","9002 → 43520 [ACK] Seq=59778 Ack=5344 Win=65535 Len=0"
"2.261389","5.9.29.183","172.19.0.3","TCP","1504","[TCP segment of a reassembled PDU]"
"2.261452","5.9.29.183","172.19.0.3","TCP","1516","9002 → 43520 [PSH, ACK] Seq=61226 Ack=5344 Win=65535 Len=1460 [TCP segment of a reassembled PDU]"
"2.261464","5.9.29.183","172.19.0.3","TLSv1.2","1225","Application Data"
"2.261730","172.19.0.3","5.9.29.183","TCP","56","43520 → 9002 [ACK] Seq=5344 Ack=63855 Win=8450 Len=0"
"2.262202","172.19.0.3","5.9.29.183","TLSv1.2","599","Application Data"
"2.262396","5.9.29.183","172.19.0.3","TCP","56","9002 → 43520 [ACK] Seq=63855 Ack=5887 Win=65535 Len=0"
"2.271247","172.19.0.3","5.9.29.183","TLSv1.2","599","Application Data"
"2.271593","5.9.29.183","172.19.0.3","TCP","56","9002 → 43520 [ACK] Seq=63855 Ack=6430 Win=65535 Len=0"
"2.276995","5.9.29.183","172.19.0.3","TLSv1.2","149","Application Data"
"2.319849","172.19.0.3","5.9.29.183","TCP","56","43520 → 9002 [ACK] Seq=6430 Ack=63948 Win=8466 Len=0"
"2.543205","185.21.216.198","172.19.0.3","TLSv1.2","599","Application Data"
"2.543264","172.19.0.3","185.21.216.198","TCP","56","47918 → 41389 [ACK] Seq=1 Ack=544 Win=1134 Len=0"
"2.861560","5.9.29.183","172.19.0.3","TLSv1.2","599","Application Data"
"2.861615","172.19.0.3","5.9.29.183","TCP","56","43520 → 9002 [ACK] Seq=6430 Ack=64491 Win=8466 Len=0"
"2.862200","172.19.0.3","5.9.29.183","TLSv1.2","599","Application Data"
"2.862426","5.9.29.183","172.19.0.3","TCP","56","9002 → 43520 [ACK] Seq=64491 Ack=6973 Win=65535 Len=0"
"3.286468","5.9.29.183","172.19.0.3","TLSv1.2","599","Application Data"
"3.327381","5.9.29.183","172.19.0.3","TCP","1516","[TCP segment of a reassembled PDU]"
"3.327486","172.19.0.3","5.9.29.183","TCP","56","43520 → 9002 [ACK] Seq=6973 Ack=65034 Win=8466 Len=0"
"3.327503","172.19.0.3","5.9.29.183","TCP","56","43520 → 9002 [ACK] Seq=6973 Ack=66494 Win=8466 Len=0"
"3.327623","5.9.29.183","172.19.0.3","TCP","1516","9002 → 43520 [PSH, ACK] Seq=66494 Ack=6973 Win=65535 Len=1460 [TCP segment of a reassembled PDU]"
"3.327641","172.19.0.3","5.9.29.183","TCP","56","43520 → 9002 [ACK] Seq=6973 Ack=67954 Win=8458 Len=0"
"3.327643","5.9.29.183","172.19.0.3","TLSv1.2","763","Application Data"
"3.327651","172.19.0.3","5.9.29.183","TCP","56","43520 → 9002 [ACK] Seq=6973 Ack=68661 Win=8453 Len=0"
"3.364641","5.9.29.183","172.19.0.3","TCP","1504","[TCP segment of a reassembled PDU]"
"3.364664","172.19.0.3","5.9.29.183","TCP","56","43520 → 9002 [ACK] Seq=6973 Ack=70109 Win=8466 Len=0"
"3.364711","5.9.29.183","172.19.0.3","TCP","1516","9002 → 43520 [PSH, ACK] Seq=70109 Ack=6973 Win=65535 Len=1460 [TCP segment of a reassembled PDU]"
"3.364723","172.19.0.3","5.9.29.183","TCP","56","43520 → 9002 [ACK] Seq=6973 Ack=71569 Win=8458 Len=0"
"3.364726","5.9.29.183","172.19.0.3","TLSv1.2","1225","Application Data"
"3.364731","172.19.0.3","5.9.29.183","TCP","56","43520 → 9002 [ACK] Seq=6973 Ack=72738 Win=8450 Len=0"
"3.381166","5.9.29.183","172.19.0.3","TLSv1.2","149","Application Data"
"3.381191","172.19.0.3","5.9.29.183","TCP","56","43520 → 9002 [ACK] Seq=6973 Ack=72831 Win=8466 Len=0"
"3.417014","5.9.29.183","172.19.0.3","TCP","1516","[TCP segment of a reassembled PDU]"
"3.417033","172.19.0.3","5.9.29.183","TCP","56","43520 → 9002 [ACK] Seq=6973 Ack=74291 Win=8466 Len=0"
"3.417068","5.9.29.183","172.19.0.3","TCP","1516","9002 → 43520 [PSH, ACK] Seq=74291 Ack=6973 Win=65535 Len=1460 [TCP segment of a reassembled PDU]"
"3.417076","172.19.0.3","5.9.29.183","TCP","56","43520 → 9002 [ACK] Seq=6973 Ack=75751 Win=8458 Len=0"
"3.417078","5.9.29.183","172.19.0.3","TLSv1.2","1213","Application Data"
"3.417082","172.19.0.3","5.9.29.183","TCP","56","43520 → 9002 [ACK] Seq=6973 Ack=76908 Win=8450 Len=0"
"3.432779","5.9.29.183","172.19.0.3","TLSv1.2","149","Application Data"
"3.432809","172.19.0.3","5.9.29.183","TCP","56","43520 → 9002 [ACK] Seq=6973 Ack=77001 Win=8466 Len=0"
"3.444552","5.9.29.183","172.19.0.3","TCP","1504","[TCP segment of a reassembled PDU]"
"3.444583","172.19.0.3","5.9.29.183","TCP","56","43520 → 9002 [ACK] Seq=6973 Ack=78449 Win=8466 Len=0"
"3.444765","5.9.29.183","172.19.0.3","TCP","1504","9002 → 43520 [PSH, ACK] Seq=78449 Ack=6973 Win=65535 Len=1448 [TCP segment of a reassembled PDU]"
"3.444769","5.9.29.183","172.19.0.3","TLSv1.2","1516","Application Data [TCP segment of a reassembled PDU]"
"3.444770","5.9.29.183","172.19.0.3","TCP","1516","9002 → 43520 [PSH, ACK] Seq=81357 Ack=6973 Win=65535 Len=1460 [TCP segment of a reassembled PDU]"
"3.444781","172.19.0.3","5.9.29.183","TCP","56","43520 → 9002 [ACK] Seq=6973 Ack=79897 Win=8464 Len=0"
"3.444823","5.9.29.183","172.19.0.3","TCP","1480","9002 → 43520 [PSH, ACK] Seq=82817 Ack=6973 Win=65535 Len=1424 [TCP segment of a reassembled PDU]"
"3.444832","172.19.0.3","5.9.29.183","TCP","56","43520 → 9002 [ACK] Seq=6973 Ack=81357 Win=8456 Len=0"
"3.444885","172.19.0.3","5.9.29.183","TCP","56","43520 → 9002 [ACK] Seq=6973 Ack=82817 Win=8448 Len=0"
"3.444941","5.9.29.183","172.19.0.3","TLSv1.2","1516","Application Data [TCP segment of a reassembled PDU]"
"3.444969","5.9.29.183","172.19.0.3","TCP","1516","9002 → 43520 [PSH, ACK] Seq=85701 Ack=6973 Win=65535 Len=1460 [TCP segment of a reassembled PDU]"
"3.444973","5.9.29.183","172.19.0.3","TCP","1480","9002 → 43520 [PSH, ACK] Seq=87161 Ack=6973 Win=65535 Len=1424 [TCP segment of a reassembled PDU]"
"3.445093","172.19.0.3","5.9.29.183","TCP","56","43520 → 9002 [ACK] Seq=6973 Ack=88585 Win=8416 Len=0"
"3.451967","5.9.29.183","172.19.0.3","TLSv1.2","381","Application Data"
"3.452162","172.19.0.3","5.9.29.183","TCP","56","43520 → 9002 [ACK] Seq=6973 Ack=88910 Win=8466 Len=0"
"3.464072","5.9.29.183","172.19.0.3","TCP","1516","[TCP segment of a reassembled PDU]"
"3.464117","5.9.29.183","172.19.0.3","TCP","1516","9002 → 43520 [PSH, ACK] Seq=90370 Ack=6973 Win=65535 Len=1460 [TCP segment of a reassembled PDU]"
"3.464123","5.9.29.183","172.19.0.3","TLSv1.2","1516","Application Data [TCP segment of a reassembled PDU]"
"3.464126","5.9.29.183","172.19.0.3","TLSv1.2","487","Application Data [TCP segment of a reassembled PDU]"
"3.464128","5.9.29.183","172.19.0.3","TCP","1516","9002 → 43520 [PSH, ACK] Seq=93721 Ack=6973 Win=65535 Len=1460 [TCP segment of a reassembled PDU]"
"3.464130","5.9.29.183","172.19.0.3","TCP","1516","9002 → 43520 [PSH, ACK] Seq=95181 Ack=6973 Win=65535 Len=1460 [TCP segment of a reassembled PDU]"
"3.464149","5.9.29.183","172.19.0.3","TLSv1.2","1516","Application Data [TCP segment of a reassembled PDU]"
"3.464152","5.9.29.183","172.19.0.3","TCP","1516","9002 → 43520 [PSH, ACK] Seq=98101 Ack=6973 Win=65535 Len=1460 [TCP segment of a reassembled PDU]"
"3.464156","5.9.29.183","172.19.0.3","TCP","989","9002 → 43520 [PSH, ACK] Seq=99561 Ack=6973 Win=65535 Len=933 [TCP segment of a reassembled PDU]"
"3.464233","172.19.0.3","5.9.29.183","TCP","56","43520 → 9002 [ACK] Seq=6973 Ack=100494 Win=8402 Len=0"
"3.464432","172.19.0.3","5.9.29.183","TLSv1.2","599","Application Data"
"3.464598","5.9.29.183","172.19.0.3","TCP","56","9002 → 43520 [ACK] Seq=100494 Ack=7516 Win=65535 Len=0"
"3.468056","5.9.29.183","172.19.0.3","TLSv1.2","410","Application Data"
"3.474827","172.19.0.3","5.9.29.183","TLSv1.2","599","Application Data"
"3.475141","5.9.29.183","172.19.0.3","TCP","56","9002 → 43520 [ACK] Seq=100848 Ack=8059 Win=65535 Len=0"
"3.487271","5.9.29.183","172.19.0.3","TLSv1.2","599","Application Data"
"3.503579","5.9.29.183","172.19.0.3","TCP","1516","[TCP segment of a reassembled PDU]"
"3.503658","5.9.29.183","172.19.0.3","TLSv1.2","1195","Application Data"
"3.503770","172.19.0.3","5.9.29.183","TCP","56","43520 → 9002 [ACK] Seq=8059 Ack=103990 Win=8456 Len=0"
"3.506932","172.19.0.3","5.9.29.183","TLSv1.2","599","Application Data"
"3.507212","5.9.29.183","172.19.0.3","TCP","56","9002 → 43520 [ACK] Seq=103990 Ack=8602 Win=65535 Len=0"
"4.067671","5.9.29.183","172.19.0.3","TLSv1.2","599","Application Data"
"4.068286","172.19.0.3","5.9.29.183","TLSv1.2","599","Application Data"
"4.068573","5.9.29.183","172.19.0.3","TCP","56","9002 → 43520 [ACK] Seq=104533 Ack=9145 Win=65535 Len=0"
"4.516179","5.9.29.183","172.19.0.3","TLSv1.2","599","Application Data"
"4.531296","5.9.29.183","172.19.0.3","TCP","1504","[TCP segment of a reassembled PDU]"
"4.531322","172.19.0.3","5.9.29.183","TCP","56","43520 → 9002 [ACK] Seq=9145 Ack=106524 Win=8466 Len=0"
"4.531506","5.9.29.183","172.19.0.3","TCP","1504","9002 → 43520 [PSH, ACK] Seq=106524 Ack=9145 Win=65535 Len=1448 [TCP segment of a reassembled PDU]"
"4.532288","5.9.29.183","172.19.0.3","TLSv1.2","787","Application Data"
"4.532297","172.19.0.3","5.9.29.183","TCP","56","43520 → 9002 [ACK] Seq=9145 Ack=108703 Win=8466 Len=0"
"4.565501","5.9.29.183","172.19.0.3","TCP","1516","[TCP segment of a reassembled PDU]"
"4.565549","5.9.29.183","172.19.0.3","TCP","1516","9002 → 43520 [PSH, ACK] Seq=110163 Ack=9145 Win=65535 Len=1460 [TCP segment of a reassembled PDU]"
"4.565559","5.9.29.183","172.19.0.3","TLSv1.2","1213","Application Data"
"4.565722","172.19.0.3","5.9.29.183","TCP","56","43520 → 9002 [ACK] Seq=9145 Ack=112780 Win=8450 Len=0"
"4.581920","5.9.29.183","172.19.0.3","TLSv1.2","149","Application Data"
"4.624000","172.19.0.3","5.9.29.183","TCP","56","43520 → 9002 [ACK] Seq=9145 Ack=112873 Win=8466 Len=0"
"4.689370","5.9.29.183","172.19.0.3","TCP","1516","[TCP segment of a reassembled PDU]"
"4.689392","172.19.0.3","5.9.29.183","TCP","56","43520 → 9002 [ACK] Seq=9145 Ack=114333 Win=8466 Len=0"
"4.689437","5.9.29.183","172.19.0.3","TCP","1516","9002 → 43520 [PSH, ACK] Seq=114333 Ack=9145 Win=65535 Len=1460 [TCP segment of a reassembled PDU]"
"4.689453","172.19.0.3","5.9.29.183","TCP","56","43520 → 9002 [ACK] Seq=9145 Ack=115793 Win=8458 Len=0"
"4.689455","5.9.29.183","172.19.0.3","TLSv1.2","1213","Application Data"
"4.689460","172.19.0.3","5.9.29.183","TCP","56","43520 → 9002 [ACK] Seq=9145 Ack=116950 Win=8450 Len=0"
"4.703964","5.9.29.183","172.19.0.3","TLSv1.2","1516","Application Data"
"4.703983","172.19.0.3","5.9.29.183","TCP","56","43520 → 9002 [ACK] Seq=9145 Ack=118410 Win=8466 Len=0"
"4.704026","5.9.29.183","172.19.0.3","TCP","1492","9002 → 43520 [PSH, ACK] Seq=118410 Ack=9145 Win=65535 Len=1436 [TCP segment of a reassembled PDU]"
"4.704036","172.19.0.3","5.9.29.183","TCP","56","43520 → 9002 [ACK] Seq=9145 Ack=119846 Win=8458 Len=0"
"4.704103","5.9.29.183","172.19.0.3","TLSv1.2","1516","Application Data [TCP segment of a reassembled PDU]"
"4.704110","172.19.0.3","5.9.29.183","TCP","56","43520 → 9002 [ACK] Seq=9145 Ack=121306 Win=8450 Len=0"
"4.704112","5.9.29.183","172.19.0.3","TCP","1516","9002 → 43520 [PSH, ACK] Seq=121306 Ack=9145 Win=65535 Len=1460 [TCP segment of a reassembled PDU]"
"4.704119","172.19.0.3","5.9.29.183","TCP","56","43520 → 9002 [ACK] Seq=9145 Ack=122766 Win=8440 Len=0"
"4.704202","5.9.29.183","172.19.0.3","TCP","1480","9002 → 43520 [PSH, ACK] Seq=122766 Ack=9145 Win=65535 Len=1424 [TCP segment of a reassembled PDU]"
"4.704209","172.19.0.3","5.9.29.183","TCP","56","43520 → 9002 [ACK] Seq=9145 Ack=124190 Win=8432 Len=0"
"4.704211","5.9.29.183","172.19.0.3","TLSv1.2","1516","Application Data [TCP segment of a reassembled PDU]"
"4.704216","172.19.0.3","5.9.29.183","TCP","56","43520 → 9002 [ACK] Seq=9145 Ack=125650 Win=8424 Len=0"
"4.704217","5.9.29.183","172.19.0.3","TCP","1492","9002 → 43520 [PSH, ACK] Seq=125650 Ack=9145 Win=65535 Len=1436 [TCP segment of a reassembled PDU]"
"4.704220","172.19.0.3","5.9.29.183","TCP","56","43520 → 9002 [ACK] Seq=9145 Ack=127086 Win=8416 Len=0"
"4.705178","5.9.29.183","172.19.0.3","TCP","1504","9002 → 43520 [PSH, ACK] Seq=127086 Ack=9145 Win=65535 Len=1448 [TCP segment of a reassembled PDU]"
"4.705226","172.19.0.3","5.9.29.183","TCP","56","43520 → 9002 [ACK] Seq=9145 Ack=128534 Win=8466 Len=0"
"4.705272","5.9.29.183","172.19.0.3","TLSv1.2","1516","Application Data [TCP segment of a reassembled PDU]"
"4.705286","172.19.0.3","5.9.29.183","TCP","56","43520 → 9002 [ACK] Seq=9145 Ack=129994 Win=8458 Len=0"
"4.705386","5.9.29.183","172.19.0.3","TCP","1492","9002 → 43520 [PSH, ACK] Seq=129994 Ack=9145 Win=65535 Len=1436 [TCP segment of a reassembled PDU]"
"4.705395","5.9.29.183","172.19.0.3","TLSv1.2","1205","Application Data"
"4.705476","172.19.0.3","5.9.29.183","TCP","56","43520 → 9002 [ACK] Seq=9145 Ack=132579 Win=8442 Len=0"
"4.705788","172.19.0.3","5.9.29.183","TLSv1.2","599","Application Data"
"4.705976","5.9.29.183","172.19.0.3","TCP","56","9002 → 43520 [ACK] Seq=132579 Ack=9688 Win=65535 Len=0"
"4.721279","5.9.29.183","172.19.0.3","TCP","1516","[TCP segment of a reassembled PDU]"
"4.721322","5.9.29.183","172.19.0.3","TCP","1516","9002 → 43520 [PSH, ACK] Seq=134039 Ack=9688 Win=65535 Len=1460 [TCP segment of a reassembled PDU]"
"4.721327","5.9.29.183","172.19.0.3","TLSv1.2","1213","Application Data"
"4.721329","5.9.29.183","172.19.0.3","TCP","1516","[TCP segment of a reassembled PDU]"
"4.721331","5.9.29.183","172.19.0.3","TCP","1492","9002 → 43520 [PSH, ACK] Seq=138116 Ack=9688 Win=65535 Len=1436 [TCP segment of a reassembled PDU]"
"4.721466","172.19.0.3","5.9.29.183","TCP","56","43520 → 9002 [ACK] Seq=9688 Ack=139552 Win=8434 Len=0"
"4.736381","5.9.29.183","172.19.0.3","TLSv1.2","1394","Application Data, Application Data"
"4.764293","5.9.29.183","172.19.0.3","TCP","1516","[TCP segment of a reassembled PDU]"
"4.764310","172.19.0.3","5.9.29.183","TCP","56","43520 → 9002 [ACK] Seq=9688 Ack=142350 Win=8466 Len=0"
"4.764348","5.9.29.183","172.19.0.3","TCP","1516","9002 → 43520 [PSH, ACK] Seq=142350 Ack=9688 Win=65535 Len=1460 [TCP segment of a reassembled PDU]"
"4.764355","5.9.29.183","172.19.0.3","TLSv1.2","763","Application Data"
"4.764496","172.19.0.3","5.9.29.183","TCP","56","43520 → 9002 [ACK] Seq=9688 Ack=144517 Win=8450 Len=0"
"4.774991","5.9.29.183","172.19.0.3","TCP","1516","[TCP segment of a reassembled PDU]"
"4.775036","5.9.29.183","172.19.0.3","TCP","1516","9002 → 43520 [PSH, ACK] Seq=145977 Ack=9688 Win=65535 Len=1460 [TCP segment of a reassembled PDU]"
"4.775056","172.19.0.3","5.9.29.183","TCP","56","43520 → 9002 [ACK] Seq=9688 Ack=147437 Win=8458 Len=0"
"4.775059","5.9.29.183","172.19.0.3","TLSv1.2","1516","Application Data [TCP segment of a reassembled PDU]"
"4.775071","5.9.29.183","172.19.0.3","TCP","1516","9002 → 43520 [PSH, ACK] Seq=148897 Ack=9688 Win=65535 Len=1460 [TCP segment of a reassembled PDU]"
"4.775117","5.9.29.183","172.19.0.3","TCP","1456","9002 → 43520 [PSH, ACK] Seq=150357 Ack=9688 Win=65535 Len=1400 [TCP segment of a reassembled PDU]"
"4.775171","172.19.0.3","5.9.29.183","TCP","56","43520 → 9002 [ACK] Seq=9688 Ack=151757 Win=8432 Len=0"
"4.779919","5.9.29.183","172.19.0.3","TLSv1.2","584","Application Data"
"4.791309","5.9.29.183","172.19.0.3","TCP","1516","[TCP segment of a reassembled PDU]"
"4.791332","172.19.0.3","5.9.29.183","TCP","56","43520 → 9002 [ACK] Seq=9688 Ack=153745 Win=8466 Len=0"
"4.791368","5.9.29.183","172.19.0.3","TCP","1492","9002 → 43520 [PSH, ACK] Seq=153745 Ack=9688 Win=65535 Len=1436 [TCP segment of a reassembled PDU]"
"4.791407","5.9.29.183","172.19.0.3","TLSv1.2","1516","Application Data [TCP segment of a reassembled PDU]"
"4.791501","5.9.29.183","172.19.0.3","TCP","1516","9002 → 43520 [PSH, ACK] Seq=156641 Ack=9688 Win=65535 Len=1460 [TCP segment of a reassembled PDU]"
"4.791505","5.9.29.183","172.19.0.3","TCP","1212","9002 → 43520 [PSH, ACK] Seq=158101 Ack=9688 Win=65535 Len=1156 [TCP segment of a reassembled PDU]"
"4.791507","172.19.0.3","5.9.29.183","TCP","56","43520 → 9002 [ACK] Seq=9688 Ack=156641 Win=8450 Len=0"
"4.791507","5.9.29.183","172.19.0.3","TLSv1.2","1516","Application Data [TCP segment of a reassembled PDU]"
"4.791510","5.9.29.183","172.19.0.3","TCP","1516","9002 → 43520 [PSH, ACK] Seq=160717 Ack=9688 Win=65535 Len=1460 [TCP segment of a reassembled PDU]"
"4.791512","5.9.29.183","172.19.0.3","TCP","1516","9002 → 43520 [PSH, ACK] Seq=162177 Ack=9688 Win=65535 Len=1460 [TCP segment of a reassembled PDU]"
"4.791567","172.19.0.3","5.9.29.183","TCP","56","43520 → 9002 [ACK] Seq=9688 Ack=163637 Win=8410 Len=0"
"4.791581","5.9.29.183","172.19.0.3","TLSv1.2","1516","Application Data [TCP segment of a reassembled PDU]"
"4.791672","5.9.29.183","172.19.0.3","TCP","1516","9002 → 43520 [PSH, ACK] Seq=165097 Ack=9688 Win=65535 Len=1460 [TCP segment of a reassembled PDU]"
"4.791681","5.9.29.183","172.19.0.3","TCP","264","9002 → 43520 [PSH, ACK] Seq=166557 Ack=9688 Win=65535 Len=208 [TCP segment of a reassembled PDU]"
"4.791758","5.9.29.183","172.19.0.3","TCP","1504","9002 → 43520 [PSH, ACK] Seq=166765 Ack=9688 Win=65535 Len=1448 [TCP segment of a reassembled PDU]"
"4.791870","172.19.0.3","5.9.29.183","TLSv1.2","599","Application Data"
"4.792018","5.9.29.183","172.19.0.3","TCP","56","9002 → 43520 [ACK] Seq=168213 Ack=10231 Win=65535 Len=0"
"4.795207","5.9.29.183","172.19.0.3","TLSv1.2","721","Application Data, Application Data"
"4.800757","172.19.0.3","5.9.29.183","TLSv1.2","599","Application Data"
"4.801068","5.9.29.183","172.19.0.3","TCP","56","9002 → 43520 [ACK] Seq=168878 Ack=10774 Win=65535 Len=0"
"4.807813","5.9.29.183","172.19.0.3","TCP","1516","[TCP segment of a reassembled PDU]"
"4.807888","5.9.29.183","172.19.0.3","TCP","1516","9002 → 43520 [PSH, ACK] Seq=170338 Ack=10774 Win=65535 Len=1460 [TCP segment of a reassembled PDU]"
"4.807901","5.9.29.183","172.19.0.3","TLSv1.2","1516","Application Data [TCP segment of a reassembled PDU]"
"4.807904","5.9.29.183","172.19.0.3","TCP","1468","9002 → 43520 [PSH, ACK] Seq=173258 Ack=10774 Win=65535 Len=1412 [TCP segment of a reassembled PDU]"
"4.808042","172.19.0.3","5.9.29.183","TCP","56","43520 → 9002 [ACK] Seq=10774 Ack=174670 Win=8440 Len=0"
"4.810961","5.9.29.183","172.19.0.3","TLSv1.2","1004","Application Data"
"4.811983","172.19.0.3","5.9.29.183","TLSv1.2","599","Application Data"
"4.812325","5.9.29.183","172.19.0.3","TCP","56","9002 → 43520 [ACK] Seq=175618 Ack=11317 Win=65535 Len=0"
"4.821512","172.19.0.3","5.9.29.183","TLSv1.2","599","Application Data"
"4.821759","5.9.29.183","172.19.0.3","TCP","56","9002 → 43520 [ACK] Seq=175618 Ack=11860 Win=65535 Len=0"
"4.826151","5.9.29.183","172.19.0.3","TLSv1.2","599","Application Data"
"4.867016","172.19.0.3","5.9.29.183","TCP","56","43520 → 9002 [ACK] Seq=11860 Ack=176161 Win=8466 Len=0"
"5.385229","5.9.29.183","172.19.0.3","TLSv1.2","599","Application Data"
"5.385321","172.19.0.3","5.9.29.183","TCP","56","43520 → 9002 [ACK] Seq=11860 Ack=176704 Win=8466 Len=0"
"5.386372","172.19.0.3","5.9.29.183","TLSv1.2","599","Application Data"
"5.386891","5.9.29.183","172.19.0.3","TCP","56","9002 → 43520 [ACK] Seq=176704 Ack=12403 Win=65535 Len=0"
"5.820686","5.9.29.183","172.19.0.3","TCP","1504","[TCP segment of a reassembled PDU]"
"5.820754","5.9.29.183","172.19.0.3","TCP","1504","9002 → 43520 [PSH, ACK] Seq=178152 Ack=12403 Win=65535 Len=1448 [TCP segment of a reassembled PDU]"
"5.820771","5.9.29.183","172.19.0.3","TLSv1.2","787","Application Data"
"5.820859","172.19.0.3","5.9.29.183","TCP","56","43520 → 9002 [ACK] Seq=12403 Ack=180331 Win=8450 Len=0"
"5.838373","5.9.29.183","172.19.0.3","TLSv1.2","599","Application Data"
"5.854384","5.9.29.183","172.19.0.3","TCP","1504","[TCP segment of a reassembled PDU]"
"5.854408","172.19.0.3","5.9.29.183","TCP","56","43520 → 9002 [ACK] Seq=12403 Ack=182322 Win=8464 Len=0"
"5.854497","5.9.29.183","172.19.0.3","TCP","1516","9002 → 43520 [PSH, ACK] Seq=182322 Ack=12403 Win=65535 Len=1460 [TCP segment of a reassembled PDU]"
"5.854573","5.9.29.183","172.19.0.3","TLSv1.2","1225","Application Data"
"5.854592","172.19.0.3","5.9.29.183","TCP","56","43520 → 9002 [ACK] Seq=12403 Ack=184951 Win=8448 Len=0"
"5.870291","5.9.29.183","172.19.0.3","TLSv1.2","149","Application Data"
"5.910723","172.19.0.3","5.9.29.183","TCP","56","43520 → 9002 [ACK] Seq=12403 Ack=185044 Win=8466 Len=0"
"5.938683","5.9.29.183","172.19.0.3","TCP","1504","[TCP segment of a reassembled PDU]"
"5.938701","172.19.0.3","5.9.29.183","TCP","56","43520 → 9002 [ACK] Seq=12403 Ack=186492 Win=8466 Len=0"
"5.938726","5.9.29.183","172.19.0.3","TCP","1504","9002 → 43520 [PSH, ACK] Seq=186492 Ack=12403 Win=65535 Len=1448 [TCP segment of a reassembled PDU]"
"5.938736","172.19.0.3","5.9.29.183","TCP","56","43520 → 9002 [ACK] Seq=12403 Ack=187940 Win=8458 Len=0"
"5.938798","5.9.29.183","172.19.0.3","TLSv1.2","1237","Application Data"
"5.938807","172.19.0.3","5.9.29.183","TCP","56","43520 → 9002 [ACK] Seq=12403 Ack=189121 Win=8450 Len=0"
"5.954385","5.9.29.183","172.19.0.3","TLSv1.2","149","Application Data"
"5.954402","172.19.0.3","5.9.29.183","TCP","56","43520 → 9002 [ACK] Seq=12403 Ack=189214 Win=8466 Len=0"
"6.038261","5.9.29.183","172.19.0.3","TCP","1504","[TCP segment of a reassembled PDU]"
"6.038279","172.19.0.3","5.9.29.183","TCP","56","43520 → 9002 [ACK] Seq=12403 Ack=190662 Win=8466 Len=0"
"6.038312","5.9.29.183","172.19.0.3","TCP","1504","9002 → 43520 [PSH, ACK] Seq=190662 Ack=12403 Win=65535 Len=1448 [TCP segment of a reassembled PDU]"
"6.038320","172.19.0.3","5.9.29.183","TCP","56","43520 → 9002 [ACK] Seq=12403 Ack=192110 Win=8458 Len=0"
"6.038788","5.9.29.183","172.19.0.3","TLSv1.2","273","Application Data"
"6.038795","172.19.0.3","5.9.29.183","TCP","56","43520 → 9002 [ACK] Seq=12403 Ack=192327 Win=8466 Len=0"
"6.043507","172.19.0.3","5.9.29.183","TLSv1.2","599","Application Data"
"6.043805","5.9.29.183","172.19.0.3","TCP","56","9002 → 43520 [ACK] Seq=192327 Ack=12946 Win=65535 Len=0"
"6.466787","5.9.29.183","172.19.0.3","TLSv1.2","599","Application Data"
"6.467865","172.19.0.3","5.9.29.183","TLSv1.2","599","Application Data"
"6.468181","5.9.29.183","172.19.0.3","TCP","56","9002 → 43520 [ACK] Seq=192870 Ack=13489 Win=65535 Len=0"
"6.887355","5.9.29.183","172.19.0.3","TCP","1516","[TCP segment of a reassembled PDU]"
"6.887437","5.9.29.183","172.19.0.3","TCP","1516","9002 → 43520 [PSH, ACK] Seq=194330 Ack=13489 Win=65535 Len=1460 [TCP segment of a reassembled PDU]"
"6.887449","5.9.29.183","172.19.0.3","TLSv1.2","763","Application Data"
"6.887564","172.19.0.3","5.9.29.183","TCP","56","43520 → 9002 [ACK] Seq=13489 Ack=196497 Win=8450 Len=0"
"6.952832","5.9.29.183","172.19.0.3","TCP","1516","[TCP segment of a reassembled PDU]"
"6.952902","5.9.29.183","172.19.0.3","TCP","1516","9002 → 43520 [PSH, ACK] Seq=197957 Ack=13489 Win=65535 Len=1460 [TCP segment of a reassembled PDU]"
"6.952924","172.19.0.3","5.9.29.183","TCP","56","43520 → 9002 [ACK] Seq=13489 Ack=199417 Win=8458 Len=0"
"6.952926","5.9.29.183","172.19.0.3","TLSv1.2","1213","Application Data"
"6.968267","5.9.29.183","172.19.0.3","TLSv1.2","149","Application Data"
"6.968541","172.19.0.3","5.9.29.183","TCP","56","43520 → 9002 [ACK] Seq=13489 Ack=200667 Win=8466 Len=0"
"7.000337","5.9.29.183","172.19.0.3","TCP","1504","[TCP segment of a reassembled PDU]"
"7.000384","5.9.29.183","172.19.0.3","TCP","1516","9002 → 43520 [PSH, ACK] Seq=202115 Ack=13489 Win=65535 Len=1460 [TCP segment of a reassembled PDU]"
"7.000392","5.9.29.183","172.19.0.3","TLSv1.2","1225","Application Data"
"7.000498","172.19.0.3","5.9.29.183","TCP","56","43520 → 9002 [ACK] Seq=13489 Ack=204744 Win=8450 Len=0"
"7.015900","5.9.29.183","172.19.0.3","TLSv1.2","149","Application Data"
"7.029038","5.9.29.183","172.19.0.3","TCP","1504","[TCP segment of a reassembled PDU]"
"7.029059","172.19.0.3","5.9.29.183","TCP","56","43520 → 9002 [ACK] Seq=13489 Ack=206285 Win=8466 Len=0"
"7.029225","5.9.29.183","172.19.0.3","TCP","1516","9002 → 43520 [PSH, ACK] Seq=206285 Ack=13489 Win=65535 Len=1460 [TCP segment of a reassembled PDU]"
"7.029238","5.9.29.183","172.19.0.3","TLSv1.2","1492","Application Data [TCP segment of a reassembled PDU]"
"7.029328","172.19.0.3","5.9.29.183","TCP","56","43520 → 9002 [ACK] Seq=13489 Ack=209181 Win=8450 Len=0"
"7.029348","5.9.29.183","172.19.0.3","TLSv1.2","1516","Application Data [TCP segment of a reassembled PDU]"
"7.029352","5.9.29.183","172.19.0.3","TCP","1516","9002 → 43520 [PSH, ACK] Seq=210641 Ack=13489 Win=65535 Len=1460 [TCP segment of a reassembled PDU]"
"7.029354","5.9.29.183","172.19.0.3","TCP","1516","9002 → 43520 [PSH, ACK] Seq=212101 Ack=13489 Win=65535 Len=1460 [TCP segment of a reassembled PDU]"
"7.029413","172.19.0.3","5.9.29.183","TCP","56","43520 → 9002 [ACK] Seq=13489 Ack=213561 Win=8424 Len=0"
"7.029484","5.9.29.183","172.19.0.3","TLSv1.2","1468","Application Data [TCP segment of a reassembled PDU]"
"7.029787","172.19.0.3","5.9.29.183","TLSv1.2","599","Application Data"
"7.030131","5.9.29.183","172.19.0.3","TCP","56","9002 → 43520 [ACK] Seq=214973 Ack=14032 Win=65535 Len=0"
"7.030557","5.9.29.183","172.19.0.3","TLSv1.2","1344","Application Data"
"7.045671","5.9.29.183","172.19.0.3","TCP","1516","[TCP segment of a reassembled PDU]"
"7.045694","172.19.0.3","5.9.29.183","TCP","56","43520 → 9002 [ACK] Seq=14032 Ack=217721 Win=8466 Len=0"
"7.045744","5.9.29.183","172.19.0.3","TCP","1516","9002 → 43520 [PSH, ACK] Seq=217721 Ack=14032 Win=65535 Len=1460 [TCP segment of a reassembled PDU]"
"7.045755","5.9.29.183","172.19.0.3","TLSv1.2","1480","Application Data [TCP segment of a reassembled PDU]"
"7.045822","5.9.29.183","172.19.0.3","TLSv1.2","910","Application Data"
"7.045906","172.19.0.3","5.9.29.183","TCP","56","43520 → 9002 [ACK] Seq=14032 Ack=221459 Win=8442 Len=0"
"7.046170","172.19.0.3","5.9.29.183","TLSv1.2","599","Application Data"
"7.046412","5.9.29.183","172.19.0.3","TCP","56","9002 → 43520 [ACK] Seq=221459 Ack=14575 Win=65535 Len=0"
"7.067062","5.9.29.183","172.19.0.3","TCP","1504","[TCP segment of a reassembled PDU]"
"7.067162","5.9.29.183","172.19.0.3","TCP","1516","9002 → 43520 [PSH, ACK] Seq=222907 Ack=14575 Win=65535 Len=1460 [TCP segment of a reassembled PDU]"
"7.067193","172.19.0.3","5.9.29.183","TCP","56","43520 → 9002 [ACK] Seq=14575 Ack=224367 Win=8458 Len=0"
"7.067196","5.9.29.183","172.19.0.3","TCP","482","9002 → 43520 [PSH, ACK] Seq=224367 Ack=14575 Win=65535 Len=426 [TCP segment of a reassembled PDU]"
"7.067200","5.9.29.183","172.19.0.3","TLSv1.2","349","Application Data"
"7.067454","172.19.0.3","5.9.29.183","TCP","56","43520 → 9002 [ACK] Seq=14575 Ack=225086 Win=8466 Len=0"
"7.099329","5.9.29.183","172.19.0.3","TCP","1516","[TCP segment of a reassembled PDU]"
"7.099415","5.9.29.183","172.19.0.3","TCP","1492","9002 → 43520 [PSH, ACK] Seq=226546 Ack=14575 Win=65535 Len=1436 [TCP segment of a reassembled PDU]"
"7.099424","5.9.29.183","172.19.0.3","TLSv1.2","787","Application Data"
"7.099710","172.19.0.3","5.9.29.183","TCP","56","43520 → 9002 [ACK] Seq=14575 Ack=228713 Win=8450 Len=0"
"7.147675","5.9.29.183","172.19.0.3","TLSv1.2","599","Application Data"
"7.187827","172.19.0.3","5.9.29.183","TCP","56","43520 → 9002 [ACK] Seq=14575 Ack=229256 Win=8466 Len=0"
"7.195654","5.9.29.183","172.19.0.3","TCP","1516","[TCP segment of a reassembled PDU]"
"7.195672","172.19.0.3","5.9.29.183","TCP","56","43520 → 9002 [ACK] Seq=14575 Ack=230716 Win=8466 Len=0"
"7.195718","5.9.29.183","172.19.0.3","TLSv1.2","167","Application Data"
"7.196057","172.19.0.3","5.9.29.183","TCP","56","43520 → 9002 [ACK] Seq=14575 Ack=230827 Win=8466 Len=0"
"7.199441","172.19.0.3","5.9.29.183","TLSv1.2","599","Application Data"
"7.199698","5.9.29.183","172.19.0.3","TCP","56","9002 → 43520 [ACK] Seq=230827 Ack=15118 Win=65535 Len=0"
"7.789741","5.9.29.183","172.19.0.3","TLSv1.2","599","Application Data"
"7.790276","172.19.0.3","5.9.29.183","TLSv1.2","599","Application Data"
"7.790500","5.9.29.183","172.19.0.3","TCP","56","9002 → 43520 [ACK] Seq=231370 Ack=15661 Win=65535 Len=0"
"8.247887","5.9.29.183","172.19.0.3","TCP","1516","[TCP segment of a reassembled PDU]"
"8.247959","5.9.29.183","172.19.0.3","TCP","1492","9002 → 43520 [PSH, ACK] Seq=232830 Ack=15661 Win=65535 Len=1436 [TCP segment of a reassembled PDU]"
"8.247965","5.9.29.183","172.19.0.3","TLSv1.2","787","Application Data"
"8.248099","172.19.0.3","5.9.29.183","TCP","56","43520 → 9002 [ACK] Seq=15661 Ack=234997 Win=8448 Len=0"
"8.273976","5.9.29.183","172.19.0.3","TCP","1504","[TCP segment of a reassembled PDU]"
"8.274042","5.9.29.183","172.19.0.3","TCP","1516","9002 → 43520 [PSH, ACK] Seq=236445 Ack=15661 Win=65535 Len=1460 [TCP segment of a reassembled PDU]"
"8.274072","172.19.0.3","5.9.29.183","TCP","56","43520 → 9002 [ACK] Seq=15661 Ack=237905 Win=8458 Len=0"
"8.274076","5.9.29.183","172.19.0.3","TLSv1.2","1225","Application Data"
"8.289084","5.9.29.183","172.19.0.3","TLSv1.2","663","Application Data"
"8.289104","172.19.0.3","5.9.29.183","TCP","56","43520 → 9002 [ACK] Seq=15661 Ack=239681 Win=8466 Len=0"
"8.358124","5.9.29.183","172.19.0.3","TCP","1504","[TCP segment of a reassembled PDU]"
"8.358166","5.9.29.183","172.19.0.3","TCP","1504","9002 → 43520 [PSH, ACK] Seq=241129 Ack=15661 Win=65535 Len=1448 [TCP segment of a reassembled PDU]"
"8.358174","5.9.29.183","172.19.0.3","TLSv1.2","1237","Application Data"
"8.358261","172.19.0.3","5.9.29.183","TCP","56","43520 → 9002 [ACK] Seq=15661 Ack=243758 Win=8450 Len=0"
"8.374014","5.9.29.183","172.19.0.3","TLSv1.2","1516","Application Data"
"8.374144","5.9.29.183","172.19.0.3","TCP","1492","9002 → 43520 [PSH, ACK] Seq=245218 Ack=15661 Win=65535 Len=1436 [TCP segment of a reassembled PDU]"
"8.374170","172.19.0.3","5.9.29.183","TCP","56","43520 → 9002 [ACK] Seq=15661 Ack=246654 Win=8458 Len=0"
"8.374266","5.9.29.183","172.19.0.3","TLSv1.2","880","Application Data"
"8.384268","5.9.29.183","172.19.0.3","TCP","1504","[TCP segment of a reassembled PDU]"
"8.384394","172.19.0.3","5.9.29.183","TCP","56","43520 → 9002 [ACK] Seq=15661 Ack=248926 Win=8466 Len=0"
"8.384444","5.9.29.183","172.19.0.3","TCP","1504","9002 → 43520 [PSH, ACK] Seq=248926 Ack=15661 Win=65535 Len=1448 [TCP segment of a reassembled PDU]"
"8.384484","5.9.29.183","172.19.0.3","TLSv1.2","1504","Application Data [TCP segment of a reassembled PDU]"
"8.384571","5.9.29.183","172.19.0.3","TCP","1516","9002 → 43520 [PSH, ACK] Seq=251822 Ack=15661 Win=65535 Len=1460 [TCP segment of a reassembled PDU]"
"8.384575","5.9.29.183","172.19.0.3","TCP","1516","9002 → 43520 [PSH, ACK] Seq=253282 Ack=15661 Win=65535 Len=1460 [TCP segment of a reassembled PDU]"
"8.384577","5.9.29.183","172.19.0.3","TLSv1.2","1516","Application Data [TCP segment of a reassembled PDU]"
"8.384578","5.9.29.183","172.19.0.3","TCP","1468","9002 → 43520 [PSH, ACK] Seq=256202 Ack=15661 Win=65535 Len=1412 [TCP segment of a reassembled PDU]"
"8.384586","172.19.0.3","5.9.29.183","TCP","56","43520 → 9002 [ACK] Seq=15661 Ack=251822 Win=8450 Len=0"
"8.384701","172.19.0.3","5.9.29.183","TCP","56","43520 → 9002 [ACK] Seq=15661 Ack=257614 Win=8418 Len=0"
"8.389017","5.9.29.183","172.19.0.3","TCP","1504","9002 → 43520 [PSH, ACK] Seq=257614 Ack=15661 Win=65535 Len=1448 [TCP segment of a reassembled PDU]"
"8.389165","5.9.29.183","172.19.0.3","TLSv1.2","1504","Application Data [TCP segment of a reassembled PDU]"
"8.389199","172.19.0.3","5.9.29.183","TCP","56","43520 → 9002 [ACK] Seq=15661 Ack=260510 Win=8466 Len=0"
"8.389235","5.9.29.183","172.19.0.3","TCP","1516","9002 → 43520 [PSH, ACK] Seq=260510 Ack=15661 Win=65535 Len=1460 [TCP segment of a reassembled PDU]"
"8.389285","5.9.29.183","172.19.0.3","TLSv1.2","72","Application Data"
"8.389427","172.19.0.3","5.9.29.183","TLSv1.2","599","Application Data"
"8.389610","5.9.29.183","172.19.0.3","TCP","56","9002 → 43520 [ACK] Seq=261986 Ack=16204 Win=65535 Len=0"
"8.400599","172.19.0.3","5.9.29.183","TLSv1.2","599","Application Data"
"8.400874","5.9.29.183","172.19.0.3","TCP","1516","[TCP segment of a reassembled PDU]"
"8.400927","5.9.29.183","172.19.0.3","TCP","1516","9002 → 43520 [PSH, ACK] Seq=263446 Ack=16204 Win=65535 Len=1460 [TCP segment of a reassembled PDU]"
"8.400941","5.9.29.183","172.19.0.3","TLSv1.2","1480","Application Data [TCP segment of a reassembled PDU]"
"8.401031","5.9.29.183","172.19.0.3","TCP","56","9002 → 43520 [ACK] Seq=266330 Ack=16747 Win=65535 Len=0"
"8.401033","172.19.0.3","5.9.29.183","TCP","56","43520 → 9002 [ACK] Seq=16747 Ack=266330 Win=8450 Len=0"
"8.405050","5.9.29.183","172.19.0.3","TLSv1.2","910","Application Data"
"8.445936","172.19.0.3","5.9.29.183","TCP","56","43520 → 9002 [ACK] Seq=16747 Ack=267184 Win=8466 Len=0"
"8.473121","5.9.29.183","172.19.0.3","TCP","1516","[TCP segment of a reassembled PDU]"
"8.473142","172.19.0.3","5.9.29.183","TCP","56","43520 → 9002 [ACK] Seq=16747 Ack=268644 Win=8466 Len=0"
"8.473198","5.9.29.183","172.19.0.3","TCP","1516","9002 → 43520 [PSH, ACK] Seq=268644 Ack=16747 Win=65535 Len=1460 [TCP segment of a reassembled PDU]"
"8.473260","172.19.0.3","5.9.29.183","TCP","56","43520 → 9002 [ACK] Seq=16747 Ack=270104 Win=8458 Len=0"
"8.473265","5.9.29.183","172.19.0.3","TLSv1.2","763","Application Data"
"8.473274","172.19.0.3","5.9.29.183","TCP","56","43520 → 9002 [ACK] Seq=16747 Ack=270811 Win=8453 Len=0"
"8.492063","5.9.29.183","172.19.0.3","TLSv1.2","599","Application Data"
"8.492283","172.19.0.3","5.9.29.183","TCP","56","43520 → 9002 [ACK] Seq=16747 Ack=271354 Win=8466 Len=0"
"8.505149","5.9.29.183","172.19.0.3","TCP","1516","[TCP segment of a reassembled PDU]"
"8.505200","5.9.29.183","172.19.0.3","TCP","1492","9002 → 43520 [PSH, ACK] Seq=272814 Ack=16747 Win=65535 Len=1436 [TCP segment of a reassembled PDU]"
"8.505289","5.9.29.183","172.19.0.3","TLSv1.2","1516","Application Data [TCP segment of a reassembled PDU]"
"8.505293","5.9.29.183","172.19.0.3","TCP","1516","9002 → 43520 [PSH, ACK] Seq=275710 Ack=16747 Win=65535 Len=1460 [TCP segment of a reassembled PDU]"
"8.505297","5.9.29.183","172.19.0.3","TCP","1516","9002 → 43520 [PSH, ACK] Seq=277170 Ack=16747 Win=65535 Len=1460 [TCP segment of a reassembled PDU]"
"8.505300","5.9.29.183","172.19.0.3","TLSv1.2","1516","Application Data [TCP segment of a reassembled PDU]"
"8.505310","5.9.29.183","172.19.0.3","TCP","1516","9002 → 43520 [PSH, ACK] Seq=280090 Ack=16747 Win=65535 Len=1460 [TCP segment of a reassembled PDU]"
"8.505335","172.19.0.3","5.9.29.183","TCP","56","43520 → 9002 [ACK] Seq=16747 Ack=281550 Win=8418 Len=0"
"8.505394","5.9.29.183","172.19.0.3","TCP","1516","9002 → 43520 [PSH, ACK] Seq=281550 Ack=16747 Win=65535 Len=1460 [TCP segment of a reassembled PDU]"
"8.505400","5.9.29.183","172.19.0.3","TLSv1.2","1432","Application Data [TCP segment of a reassembled PDU]"
"8.505518","172.19.0.3","5.9.29.183","TCP","56","43520 → 9002 [ACK] Seq=16747 Ack=284386 Win=8402 Len=0"
"8.506369","172.19.0.3","5.9.29.183","TLSv1.2","599","Application Data"
"8.506590","5.9.29.183","172.19.0.3","TCP","56","9002 → 43520 [ACK] Seq=284386 Ack=17290 Win=65535 Len=0"
"8.507449","5.9.29.183","172.19.0.3","TLSv1.2","504","Application Data"
"8.509988","5.9.29.183","172.19.0.3","TCP","1504","[TCP segment of a reassembled PDU]"
"8.509998","172.19.0.3","5.9.29.183","TCP","56","43520 → 9002 [ACK] Seq=17290 Ack=286282 Win=8466 Len=0"
"8.522739","5.9.29.183","172.19.0.3","TLSv1.2","1207","Application Data"
"8.563654","172.19.0.3","5.9.29.183","TCP","56","43520 → 9002 [ACK] Seq=17290 Ack=287433 Win=8466 Len=0"
"8.578686","5.9.29.183","172.19.0.3","TCP","1516","[TCP segment of a reassembled PDU]"
"8.578764","5.9.29.183","172.19.0.3","TLSv1.2","681","Application Data"
"8.578924","172.19.0.3","5.9.29.183","TCP","56","43520 → 9002 [ACK] Seq=17290 Ack=289518 Win=8458 Len=0"
"8.587485","172.19.0.3","5.9.29.183","TLSv1.2","599","Application Data"
"8.587831","5.9.29.183","172.19.0.3","TCP","56","9002 → 43520 [ACK] Seq=289518 Ack=17833 Win=65535 Len=0"
"8.628052","172.19.0.3","5.9.29.183","TLSv1.2","599","Application Data"
"8.628332","5.9.29.183","172.19.0.3","TCP","56","9002 → 43520 [ACK] Seq=289518 Ack=18376 Win=65535 Len=0"
"8.660865","5.9.29.183","172.19.0.3","TLSv1.2","599","Application Data"
"8.661376","172.19.0.3","5.9.29.183","TLSv1.2","599","Application Data"
"8.661590","5.9.29.183","172.19.0.3","TCP","56","9002 → 43520 [ACK] Seq=290061 Ack=18919 Win=65535 Len=0"
"9.172380","5.9.29.183","172.19.0.3","TCP","324","[TCP segment of a reassembled PDU]"
"9.172445","5.9.29.183","172.19.0.3","TLSv1.2","331","Application Data"
"9.172605","172.19.0.3","5.9.29.183","TCP","56","43520 → 9002 [ACK] Seq=18919 Ack=290604 Win=8466 Len=0"
"9.173137","172.19.0.3","5.9.29.183","TLSv1.2","599","Application Data"
"9.173364","5.9.29.183","172.19.0.3","TCP","56","9002 → 43520 [ACK] Seq=290604 Ack=19462 Win=65535 Len=0"
"9.621099","5.9.29.183","172.19.0.3","TCP","1516","[TCP segment of a reassembled PDU]"
"9.621199","5.9.29.183","172.19.0.3","TCP","1492","9002 → 43520 [PSH, ACK] Seq=292064 Ack=19462 Win=65535 Len=1436 [TCP segment of a reassembled PDU]"
"9.621212","5.9.29.183","172.19.0.3","TLSv1.2","787","Application Data"
"9.621409","172.19.0.3","5.9.29.183","TCP","56","43520 → 9002 [ACK] Seq=19462 Ack=294231 Win=8450 Len=0"
"9.637635","5.9.29.183","172.19.0.3","TCP","1516","[TCP segment of a reassembled PDU]"
"9.637697","5.9.29.183","172.19.0.3","TCP","1492","9002 → 43520 [PSH, ACK] Seq=295691 Ack=19462 Win=65535 Len=1436 [TCP segment of a reassembled PDU]"
"9.637715","172.19.0.3","5.9.29.183","TCP","56","43520 → 9002 [ACK] Seq=19462 Ack=297127 Win=8458 Len=0"
"9.637718","5.9.29.183","172.19.0.3","TLSv1.2","787","Application Data"
"9.653291","5.9.29.183","172.19.0.3","TCP","1516","[TCP segment of a reassembled PDU]"
"9.653311","172.19.0.3","5.9.29.183","TCP","56","43520 → 9002 [ACK] Seq=19462 Ack=299318 Win=8466 Len=0"
"9.653352","5.9.29.183","172.19.0.3","TCP","1492","9002 → 43520 [PSH, ACK] Seq=299318 Ack=19462 Win=65535 Len=1436 [TCP segment of a reassembled PDU]"
"9.653361","5.9.29.183","172.19.0.3","TLSv1.2","787","Application Data"
"9.653519","172.19.0.3","5.9.29.183","TCP","56","43520 → 9002 [ACK] Seq=19462 Ack=301485 Win=8450 Len=0"
"9.669648","5.9.29.183","172.19.0.3","TLSv1.2","599","Application Data"
"9.710801","172.19.0.3","5.9.29.183","TCP","56","43520 → 9002 [ACK] Seq=19462 Ack=302028 Win=8466 Len=0"
"9.761426","5.9.29.183","172.19.0.3","TCP","1516","[TCP segment of a reassembled PDU]"
"9.761444","172.19.0.3","5.9.29.183","TCP","56","43520 → 9002 [ACK] Seq=19462 Ack=303488 Win=8466 Len=0"
"9.761476","5.9.29.183","172.19.0.3","TLSv1.2","167","Application Data"
"9.761487","172.19.0.3","5.9.29.183","TCP","56","43520 → 9002 [ACK] Seq=19462 Ack=303599 Win=8466 Len=0"
"9.861696","5.9.29.183","172.19.0.3","TCP","1504","[TCP segment of a reassembled PDU]"
"9.861719","172.19.0.3","5.9.29.183","TCP","56","43520 → 9002 [ACK] Seq=19462 Ack=305047 Win=8466 Len=0"
"9.861768","5.9.29.183","172.19.0.3","TLSv1.2","179","Application Data"
"9.861780","172.19.0.3","5.9.29.183","TCP","56","43520 → 9002 [ACK] Seq=19462 Ack=305170 Win=8466 Len=0"
"9.865997","172.19.0.3","5.9.29.183","TLSv1.2","599","Application Data"
"9.866232","5.9.29.183","172.19.0.3","TCP","56","9002 → 43520 [ACK] Seq=305170 Ack=20005 Win=65535 Len=0"
"10.278026","5.9.29.183","172.19.0.3","TLSv1.2","599","Application Data"
"10.278771","172.19.0.3","5.9.29.183","TLSv1.2","599","Application Data"
"10.278978","5.9.29.183","172.19.0.3","TCP","56","9002 → 43520 [ACK] Seq=305713 Ack=20548 Win=65535 Len=0"
"10.866823","185.21.216.198","172.19.0.3","TLSv1.2","599","Application Data"
"10.866846","172.19.0.3","185.21.216.198","TCP","56","47918 → 41389 [ACK] Seq=1 Ack=1087 Win=1143 Len=0"
"10.870570","5.9.29.183","172.19.0.3","TLSv1.2","599","Application Data"
"10.890059","5.9.29.183","172.19.0.3","TCP","1504","[TCP segment of a reassembled PDU]"
"10.890077","172.19.0.3","5.9.29.183","TCP","56","43520 → 9002 [ACK] Seq=20548 Ack=307704 Win=8466 Len=0"
"10.890112","5.9.29.183","172.19.0.3","TCP","1516","9002 → 43520 [PSH, ACK] Seq=307704 Ack=20548 Win=65535 Len=1460 [TCP segment of a reassembled PDU]"
"10.890122","5.9.29.183","172.19.0.3","TLSv1.2","775","Application Data"
"10.890218","172.19.0.3","5.9.29.183","TCP","56","43520 → 9002 [ACK] Seq=20548 Ack=309883 Win=8450 Len=0"
"10.922448","5.9.29.183","172.19.0.3","TLSv1.2","1113","Application Data"
"10.967558","172.19.0.3","5.9.29.183","TCP","56","43520 → 9002 [ACK] Seq=20548 Ack=310940 Win=8466 Len=0"
"10.993902","5.9.29.183","172.19.0.3","TCP","1504","[TCP segment of a reassembled PDU]"
"10.993926","172.19.0.3","5.9.29.183","TCP","56","43520 → 9002 [ACK] Seq=20548 Ack=312388 Win=8466 Len=0"
"10.993980","5.9.29.183","172.19.0.3","TCP","1516","9002 → 43520 [PSH, ACK] Seq=312388 Ack=20548 Win=65535 Len=1460 [TCP segment of a reassembled PDU]"
"10.993997","172.19.0.3","5.9.29.183","TCP","56","43520 → 9002 [ACK] Seq=20548 Ack=313848 Win=8458 Len=0"
"10.993999","5.9.29.183","172.19.0.3","TLSv1.2","1225","Application Data"
"10.994004","172.19.0.3","5.9.29.183","TCP","56","43520 → 9002 [ACK] Seq=20548 Ack=315017 Win=8450 Len=0"
"10.996676","172.19.0.3","5.9.29.183","TLSv1.2","599","Application Data"
"10.996901","5.9.29.183","172.19.0.3","TCP","56","9002 → 43520 [ACK] Seq=315017 Ack=21091 Win=65535 Len=0"
"11.006442","172.19.0.3","5.9.29.183","TLSv1.2","599","Application Data"
"11.006733","5.9.29.183","172.19.0.3","TCP","56","9002 → 43520 [ACK] Seq=315017 Ack=21634 Win=65535 Len=0"
"11.009155","5.9.29.183","172.19.0.3","TLSv1.2","149","Application Data"
"11.050315","172.19.0.3","5.9.29.183","TCP","56","43520 → 9002 [ACK] Seq=21634 Ack=315110 Win=8466 Len=0"
"11.576559","5.9.29.183","172.19.0.3","TLSv1.2","599","Application Data"
"11.576612","172.19.0.3","5.9.29.183","TCP","56","43520 → 9002 [ACK] Seq=21634 Ack=315653 Win=8464 Len=0"
"11.577151","172.19.0.3","5.9.29.183","TLSv1.2","599","Application Data"
"11.577340","5.9.29.183","172.19.0.3","TCP","56","9002 → 43520 [ACK] Seq=315653 Ack=22177 Win=65535 Len=0"
"12.025016","5.9.29.183","172.19.0.3","TCP","1504","[TCP segment of a reassembled PDU]"
"12.025086","5.9.29.183","172.19.0.3","TCP","1516","9002 → 43520 [PSH, ACK] Seq=317101 Ack=22177 Win=65535 Len=1460 [TCP segment of a reassembled PDU]"
"12.025096","5.9.29.183","172.19.0.3","TLSv1.2","775","Application Data"
"12.025231","172.19.0.3","5.9.29.183","TCP","56","43520 → 9002 [ACK] Seq=22177 Ack=319280 Win=8450 Len=0"
"12.025518","172.19.0.3","5.9.29.183","TLSv1.2","599","Application Data"
"12.025775","5.9.29.183","172.19.0.3","TCP","56","9002 → 43520 [ACK] Seq=319280 Ack=22720 Win=65535 Len=0"
"12.066172","5.9.29.183","172.19.0.3","TCP","1504","[TCP segment of a reassembled PDU]"
"12.066246","5.9.29.183","172.19.0.3","TCP","1516","9002 → 43520 [PSH, ACK] Seq=320728 Ack=22720 Win=65535 Len=1460 [TCP segment of a reassembled PDU]"
"12.066267","5.9.29.183","172.19.0.3","TLSv1.2","1225","Application Data"
"12.066363","172.19.0.3","5.9.29.183","TCP","56","43520 → 9002 [ACK] Seq=22720 Ack=323357 Win=8448 Len=0"
"12.081794","5.9.29.183","172.19.0.3","TLSv1.2","663","Application Data"
"12.118727","5.9.29.183","172.19.0.3","TCP","1516","[TCP segment of a reassembled PDU]"
"12.118748","172.19.0.3","5.9.29.183","TCP","56","43520 → 9002 [ACK] Seq=22720 Ack=325424 Win=8466 Len=0"
"12.118789","5.9.29.183","172.19.0.3","TCP","1516","9002 → 43520 [PSH, ACK] Seq=325424 Ack=22720 Win=65535 Len=1460 [TCP segment of a reassembled PDU]"
"12.118824","5.9.29.183","172.19.0.3","TLSv1.2","763","Application Data"
"12.118984","172.19.0.3","5.9.29.183","TCP","56","43520 → 9002 [ACK] Seq=22720 Ack=327591 Win=8450 Len=0"
"12.134708","5.9.29.183","172.19.0.3","TLSv1.2","599","Application Data"
"12.150465","5.9.29.183","172.19.0.3","TCP","1516","[TCP segment of a reassembled PDU]"
"12.150482","172.19.0.3","5.9.29.183","TCP","56","43520 → 9002 [ACK] Seq=22720 Ack=329594 Win=8466 Len=0"
"12.150516","5.9.29.183","172.19.0.3","TCP","1516","9002 → 43520 [PSH, ACK] Seq=329594 Ack=22720 Win=65535 Len=1460 [TCP segment of a reassembled PDU]"
"12.150524","5.9.29.183","172.19.0.3","TLSv1.2","763","Application Data"
"12.150728","172.19.0.3","5.9.29.183","TCP","56","43520 → 9002 [ACK] Seq=22720 Ack=331761 Win=8450 Len=0"
"12.162727","5.9.29.183","172.19.0.3","TCP","1504","[TCP segment of a reassembled PDU]"
"12.162824","5.9.29.183","172.19.0.3","TCP","1516","9002 → 43520 [PSH, ACK] Seq=333209 Ack=22720 Win=65535 Len=1460 [TCP segment of a reassembled PDU]"
"12.162870","172.19.0.3","5.9.29.183","TCP","56","43520 → 9002 [ACK] Seq=22720 Ack=334669 Win=8458 Len=0"
"12.162953","5.9.29.183","172.19.0.3","TLSv1.2","1516","Application Data [TCP segment of a reassembled PDU]"
"12.163059","5.9.29.183","172.19.0.3","TCP","1480","9002 → 43520 [PSH, ACK] Seq=336129 Ack=22720 Win=65535 Len=1424 [TCP segment of a reassembled PDU]"
"12.163088","5.9.29.183","172.19.0.3","TCP","1504","9002 → 43520 [PSH, ACK] Seq=337553 Ack=22720 Win=65535 Len=1448 [TCP segment of a reassembled PDU]"
"12.163160","172.19.0.3","5.9.29.183","TCP","56","43520 → 9002 [ACK] Seq=22720 Ack=339001 Win=8434 Len=0"
"12.168697","5.9.29.183","172.19.0.3","TLSv1.2","1127","Application Data, Application Data"
"12.180009","5.9.29.183","172.19.0.3","TCP","1504","[TCP segment of a reassembled PDU]"
"12.180051","172.19.0.3","5.9.29.183","TCP","56","43520 → 9002 [ACK] Seq=22720 Ack=341520 Win=8466 Len=0"
"12.180104","5.9.29.183","172.19.0.3","TCP","1516","9002 → 43520 [PSH, ACK] Seq=341520 Ack=22720 Win=65535 Len=1460 [TCP segment of a reassembled PDU]"
"12.180176","5.9.29.183","172.19.0.3","TLSv1.2","1516","Application Data [TCP segment of a reassembled PDU]"
"12.180187","5.9.29.183","172.19.0.3","TCP","1480","9002 → 43520 [PSH, ACK] Seq=344440 Ack=22720 Win=65535 Len=1424 [TCP segment of a reassembled PDU]"
"12.180228","172.19.0.3","5.9.29.183","TCP","56","43520 → 9002 [ACK] Seq=22720 Ack=345864 Win=8442 Len=0"
"12.180521","172.19.0.3","5.9.29.183","TLSv1.2","599","Application Data"
"12.180730","5.9.29.183","172.19.0.3","TCP","56","9002 → 43520 [ACK] Seq=345864 Ack=23263 Win=65535 Len=0"
"12.202511","5.9.29.183","172.19.0.3","TLSv1.2","490","Application Data"
"12.213800","5.9.29.183","172.19.0.3","TCP","1516","[TCP segment of a reassembled PDU]"
"12.213818","172.19.0.3","5.9.29.183","TCP","56","43520 → 9002 [ACK] Seq=23263 Ack=347758 Win=8464 Len=0"
"12.213852","5.9.29.183","172.19.0.3","TCP","1492","9002 → 43520 [PSH, ACK] Seq=347758 Ack=23263 Win=65535 Len=1436 [TCP segment of a reassembled PDU]"
"12.218976","5.9.29.183","172.19.0.3","TLSv1.2","1330","Application Data, Application Data"
"12.219009","172.19.0.3","5.9.29.183","TCP","56","43520 → 9002 [ACK] Seq=23263 Ack=350468 Win=8466 Len=0"
"12.241363","5.9.29.183","172.19.0.3","TLSv1.2","1113","Application Data"
"12.261711","5.9.29.183","172.19.0.3","TCP","1504","[TCP segment of a reassembled PDU]"
"12.261729","172.19.0.3","5.9.29.183","TCP","56","43520 → 9002 [ACK] Seq=23263 Ack=352973 Win=8466 Len=0"
"12.261757","5.9.29.183","172.19.0.3","TCP","1516","9002 → 43520 [PSH, ACK] Seq=352973 Ack=23263 Win=65535 Len=1460 [TCP segment of a reassembled PDU]"
"12.261763","5.9.29.183","172.19.0.3","TLSv1.2","775","Application Data"
"12.261847","172.19.0.3","5.9.29.183","TCP","56","43520 → 9002 [ACK] Seq=23263 Ack=355152 Win=8450 Len=0"
"12.277986","5.9.29.183","172.19.0.3","TCP","769","[TCP segment of a reassembled PDU]"
"12.278035","5.9.29.183","172.19.0.3","TCP","1516","9002 → 43520 [PSH, ACK] Seq=355865 Ack=23263 Win=65535 Len=1460 [TCP segment of a reassembled PDU]"
"12.278052","172.19.0.3","5.9.29.183","TCP","56","43520 → 9002 [ACK] Seq=23263 Ack=357325 Win=8458 Len=0"
"12.278057","5.9.29.183","172.19.0.3","TCP","1516","9002 → 43520 [PSH, ACK] Seq=357325 Ack=23263 Win=65535 Len=1460 [TCP segment of a reassembled PDU]"
"12.278065","5.9.29.183","172.19.0.3","TLSv1.2","593","Application Data, Application Data"
"12.278176","172.19.0.3","5.9.29.183","TCP","56","43520 → 9002 [ACK] Seq=23263 Ack=359322 Win=8443 Len=0"
"12.288746","5.9.29.183","172.19.0.3","TCP","1516","[TCP segment of a reassembled PDU]"
"12.288819","5.9.29.183","172.19.0.3","TCP","1492","9002 → 43520 [PSH, ACK] Seq=360782 Ack=23263 Win=65535 Len=1436 [TCP segment of a reassembled PDU]"
"12.288832","172.19.0.3","5.9.29.183","TCP","56","43520 → 9002 [ACK] Seq=23263 Ack=362218 Win=8458 Len=0"
"12.288899","5.9.29.183","172.19.0.3","TLSv1.2","1516","Application Data [TCP segment of a reassembled PDU]"
"12.288910","5.9.29.183","172.19.0.3","TCP","1516","9002 → 43520 [PSH, ACK] Seq=363678 Ack=23263 Win=65535 Len=1460 [TCP segment of a reassembled PDU]"
"12.288914","5.9.29.183","172.19.0.3","TCP","1480","9002 → 43520 [PSH, ACK] Seq=365138 Ack=23263 Win=65535 Len=1424 [TCP segment of a reassembled PDU]"
"12.288946","172.19.0.3","5.9.29.183","TCP","56","43520 → 9002 [ACK] Seq=23263 Ack=366562 Win=8434 Len=0"
"12.293030","5.9.29.183","172.19.0.3","TLSv1.2","584","Application Data"
"12.323672","5.9.29.183","172.19.0.3","TLSv1.2","1113","Application Data"
"12.323698","172.19.0.3","5.9.29.183","TCP","56","43520 → 9002 [ACK] Seq=23263 Ack=368147 Win=8466 Len=0"
"12.324273","172.19.0.3","5.9.29.183","TLSv1.2","599","Application Data"
"12.324636","5.9.29.183","172.19.0.3","TCP","56","9002 → 43520 [ACK] Seq=368147 Ack=23806 Win=65535 Len=0"
"12.370567","5.9.29.183","172.19.0.3","TLSv1.2","1113","Application Data"
"12.372143","172.19.0.3","5.9.29.183","TLSv1.2","599","Application Data"
"12.372442","5.9.29.183","172.19.0.3","TCP","56","9002 → 43520 [ACK] Seq=369204 Ack=24349 Win=65535 Len=0"
"12.380868","172.19.0.3","5.9.29.183","TLSv1.2","599","Application Data"
"12.381153","5.9.29.183","172.19.0.3","TCP","56","9002 → 43520 [ACK] Seq=369204 Ack=24892 Win=65535 Len=0"
"12.922105","5.9.29.183","172.19.0.3","TLSv1.2","599","Application Data"
"12.922822","172.19.0.3","5.9.29.183","TLSv1.2","599","Application Data"
"12.923118","5.9.29.183","172.19.0.3","TCP","56","9002 → 43520 [ACK] Seq=369747 Ack=25435 Win=65535 Len=0"
"14.931721","5.9.29.183","172.19.0.3","TLSv1.2","599","Application Data"
"14.959083","5.9.29.183","172.19.0.3","TCP","1504","[TCP segment of a reassembled PDU]"
"14.959184","172.19.0.3","5.9.29.183","TCP","56","43520 → 9002 [ACK] Seq=25435 Ack=371738 Win=8466 Len=0"
"14.959206","5.9.29.183","172.19.0.3","TCP","1516","9002 → 43520 [PSH, ACK] Seq=371738 Ack=25435 Win=65535 Len=1460 [TCP segment of a reassembled PDU]"
"14.959223","5.9.29.183","172.19.0.3","TLSv1.2","1225","Application Data"
"14.959395","5.9.29.183","172.19.0.3","TCP","1516","[TCP segment of a reassembled PDU]"
"14.959429","5.9.29.183","172.19.0.3","TCP","1492","9002 → 43520 [PSH, ACK] Seq=375827 Ack=25435 Win=65535 Len=1436 [TCP segment of a reassembled PDU]"
"14.959584","172.19.0.3","5.9.29.183","TCP","56","43520 → 9002 [ACK] Seq=25435 Ack=377263 Win=8432 Len=0"
"14.974251","5.9.29.183","172.19.0.3","TLSv1.2","851","Application Data"
"14.993805","5.9.29.183","172.19.0.3","TCP","1504","[TCP segment of a reassembled PDU]"
"14.993826","172.19.0.3","5.9.29.183","TCP","56","43520 → 9002 [ACK] Seq=25435 Ack=379506 Win=8466 Len=0"
"14.994134","5.9.29.183","172.19.0.3","TCP","1516","9002 → 43520 [PSH, ACK] Seq=379506 Ack=25435 Win=65535 Len=1460 [TCP segment of a reassembled PDU]"
"14.994146","5.9.29.183","172.19.0.3","TLSv1.2","1225","Application Data"
"14.994178","172.19.0.3","5.9.29.183","TCP","56","43520 → 9002 [ACK] Seq=25435 Ack=382135 Win=8466 Len=0"
"15.008889","5.9.29.183","172.19.0.3","TLSv1.2","1516","Application Data"
"15.008931","5.9.29.183","172.19.0.3","TCP","1492","9002 → 43520 [PSH, ACK] Seq=383595 Ack=25435 Win=65535 Len=1436 [TCP segment of a reassembled PDU]"
"15.009050","172.19.0.3","5.9.29.183","TCP","56","43520 → 9002 [ACK] Seq=25435 Ack=385031 Win=8458 Len=0"
"15.009368","5.9.29.183","172.19.0.3","TLSv1.2","880","Application Data"
"15.017964","5.9.29.183","172.19.0.3","TCP","1516","[TCP segment of a reassembled PDU]"
"15.017985","172.19.0.3","5.9.29.183","TCP","56","43520 → 9002 [ACK] Seq=25435 Ack=387315 Win=8466 Len=0"
"15.017997","5.9.29.183","172.19.0.3","TCP","1516","9002 → 43520 [PSH, ACK] Seq=387315 Ack=25435 Win=65535 Len=1460 [TCP segment of a reassembled PDU]"
"15.018003","5.9.29.183","172.19.0.3","TLSv1.2","1516","Application Data [TCP segment of a reassembled PDU]"
"15.018110","5.9.29.183","172.19.0.3","TCP","1516","9002 → 43520 [PSH, ACK] Seq=390235 Ack=25435 Win=65535 Len=1460 [TCP segment of a reassembled PDU]"
"15.018117","5.9.29.183","172.19.0.3","TCP","1456","9002 → 43520 [PSH, ACK] Seq=391695 Ack=25435 Win=65535 Len=1400 [TCP segment of a reassembled PDU]"
"15.018180","172.19.0.3","5.9.29.183","TCP","56","43520 → 9002 [ACK] Seq=25435 Ack=393095 Win=8434 Len=0"
"15.025140","5.9.29.183","172.19.0.3","TLSv1.2","1127","Application Data, Application Data"
"15.066748","5.9.29.183","172.19.0.3","TCP","1516","[TCP segment of a reassembled PDU]"
"15.066771","172.19.0.3","5.9.29.183","TCP","56","43520 → 9002 [ACK] Seq=25435 Ack=395626 Win=8466 Len=0"
"15.066814","5.9.29.183","172.19.0.3","TCP","1516","9002 → 43520 [PSH, ACK] Seq=395626 Ack=25435 Win=65535 Len=1460 [TCP segment of a reassembled PDU]"
"15.066826","5.9.29.183","172.19.0.3","TLSv1.2","1213","Application Data"
"15.067026","172.19.0.3","5.9.29.183","TCP","56","43520 → 9002 [ACK] Seq=25435 Ack=398243 Win=8450 Len=0"
"15.067323","172.19.0.3","5.9.29.183","TLSv1.2","599","Application Data"
"15.067665","5.9.29.183","172.19.0.3","TCP","56","9002 → 43520 [ACK] Seq=398243 Ack=25978 Win=65535 Len=0"
"15.082833","5.9.29.183","172.19.0.3","TLSv1.2","149","Application Data"
"15.083414","172.19.0.3","5.9.29.183","TLSv1.2","599","Application Data"
"15.083648","5.9.29.183","172.19.0.3","TCP","56","9002 → 43520 [ACK] Seq=398336 Ack=26521 Win=65535 Len=0"
"15.093155","172.19.0.3","5.9.29.183","TLSv1.2","599","Application Data"
"15.093430","5.9.29.183","172.19.0.3","TCP","56","9002 → 43520 [ACK] Seq=398336 Ack=27064 Win=65535 Len=0"
"15.097750","5.9.29.183","172.19.0.3","TLSv1.2","599","Application Data"
"15.140260","172.19.0.3","5.9.29.183","TCP","56","43520 → 9002 [ACK] Seq=27064 Ack=398879 Win=8466 Len=0"
"15.611747","5.9.29.183","172.19.0.3","TLSv1.2","599","Application Data"
"15.611778","172.19.0.3","5.9.29.183","TCP","56","43520 → 9002 [ACK] Seq=27064 Ack=399422 Win=8466 Len=0"
"15.612663","172.19.0.3","5.9.29.183","TLSv1.2","599","Application Data"
"15.613220","5.9.29.183","172.19.0.3","TCP","56","9002 → 43520 [ACK] Seq=399422 Ack=27607 Win=65535 Len=0"
"16.068103","5.9.29.183","172.19.0.3","TLSv1.2","599","Application Data"
"16.085485","5.9.29.183","172.19.0.3","TCP","1504","[TCP segment of a reassembled PDU]"
"16.085504","172.19.0.3","5.9.29.183","TCP","56","43520 → 9002 [ACK] Seq=27607 Ack=401413 Win=8466 Len=0"
"16.085517","5.9.29.183","172.19.0.3","TCP","1516","9002 → 43520 [PSH, ACK] Seq=401413 Ack=27607 Win=65535 Len=1460 [TCP segment of a reassembled PDU]"
"16.085526","5.9.29.183","172.19.0.3","TLSv1.2","775","Application Data"
"16.085673","172.19.0.3","5.9.29.183","TCP","56","43520 → 9002 [ACK] Seq=27607 Ack=403592 Win=8450 Len=0"
"16.135406","5.9.29.183","172.19.0.3","TCP","1516","[TCP segment of a reassembled PDU]"
"16.135437","5.9.29.183","172.19.0.3","TCP","1516","9002 → 43520 [PSH, ACK] Seq=405052 Ack=27607 Win=65535 Len=1460 [TCP segment of a reassembled PDU]"
"16.135455","172.19.0.3","5.9.29.183","TCP","56","43520 → 9002 [ACK] Seq=27607 Ack=406512 Win=8458 Len=0"
"16.135456","5.9.29.183","172.19.0.3","TLSv1.2","763","Application Data"
"16.151118","5.9.29.183","172.19.0.3","TLSv1.2","599","Application Data"
"16.151283","172.19.0.3","5.9.29.183","TCP","56","43520 → 9002 [ACK] Seq=27607 Ack=407762 Win=8466 Len=0"
"16.167217","5.9.29.183","172.19.0.3","TCP","1516","[TCP segment of a reassembled PDU]"
"16.167242","5.9.29.183","172.19.0.3","TCP","1516","9002 → 43520 [PSH, ACK] Seq=409222 Ack=27607 Win=65535 Len=1460 [TCP segment of a reassembled PDU]"
"16.167247","5.9.29.183","172.19.0.3","TLSv1.2","1213","Application Data"
"16.167354","172.19.0.3","5.9.29.183","TCP","56","43520 → 9002 [ACK] Seq=27607 Ack=411839 Win=8450 Len=0"
"16.182686","5.9.29.183","172.19.0.3","TLSv1.2","149","Application Data"
"16.199394","5.9.29.183","172.19.0.3","TCP","1504","[TCP segment of a reassembled PDU]"
"16.199455","172.19.0.3","5.9.29.183","TCP","56","43520 → 9002 [ACK] Seq=27607 Ack=413380 Win=8466 Len=0"
"16.199472","5.9.29.183","172.19.0.3","TCP","1516","9002 → 43520 [PSH, ACK] Seq=413380 Ack=27607 Win=65535 Len=1460 [TCP segment of a reassembled PDU]"
"16.199480","5.9.29.183","172.19.0.3","TLSv1.2","1516","Application Data [TCP segment of a reassembled PDU]"
"16.199659","5.9.29.183","172.19.0.3","TCP","1213","9002 → 43520 [PSH, ACK] Seq=416300 Ack=27607 Win=65535 Len=1157 [TCP segment of a reassembled PDU]"
"16.199669","5.9.29.183","172.19.0.3","TCP","1516","9002 → 43520 [PSH, ACK] Seq=417457 Ack=27607 Win=65535 Len=1460 [TCP segment of a reassembled PDU]"
"16.199672","5.9.29.183","172.19.0.3","TLSv1.2","1516","Application Data [TCP segment of a reassembled PDU]"
"16.199676","5.9.29.183","172.19.0.3","TCP","1080","9002 → 43520 [PSH, ACK] Seq=420377 Ack=27607 Win=65535 Len=1024 [TCP segment of a reassembled PDU]"
"16.199679","5.9.29.183","172.19.0.3","TCP","1516","9002 → 43520 [PSH, ACK] Seq=421401 Ack=27607 Win=65535 Len=1460 [TCP segment of a reassembled PDU]"
"16.199682","5.9.29.183","172.19.0.3","TCP","444","9002 → 43520 [PSH, ACK] Seq=422861 Ack=27607 Win=65535 Len=388 [TCP segment of a reassembled PDU]"
"16.199760","172.19.0.3","5.9.29.183","TCP","56","43520 → 9002 [ACK] Seq=27607 Ack=423249 Win=8400 Len=0"
"16.214845","5.9.29.183","172.19.0.3","TLSv1.2","648","Application Data"
"16.215196","172.19.0.3","5.9.29.183","TLSv1.2","599","Application Data"
"16.215485","5.9.29.183","172.19.0.3","TCP","56","9002 → 43520 [ACK] Seq=423841 Ack=28150 Win=65535 Len=0"
"16.224834","5.9.29.183","172.19.0.3","TCP","1516","[TCP segment of a reassembled PDU]"
"16.224860","5.9.29.183","172.19.0.3","TCP","1492","9002 → 43520 [PSH, ACK] Seq=425301 Ack=28150 Win=65535 Len=1436 [TCP segment of a reassembled PDU]"
"16.225002","172.19.0.3","5.9.29.183","TCP","56","43520 → 9002 [ACK] Seq=28150 Ack=426737 Win=8458 Len=0"
"16.229857","5.9.29.183","172.19.0.3","TLSv1.2","787","Application Data"
"16.230182","172.19.0.3","5.9.29.183","TLSv1.2","599","Application Data"
"16.230429","5.9.29.183","172.19.0.3","TCP","56","9002 → 43520 [ACK] Seq=427468 Ack=28693 Win=65535 Len=0"
"16.241189","5.9.29.183","172.19.0.3","TCP","1504","[TCP segment of a reassembled PDU]"
"16.241212","5.9.29.183","172.19.0.3","TCP","1516","9002 → 43520 [PSH, ACK] Seq=428916 Ack=28693 Win=65535 Len=1460 [TCP segment of a reassembled PDU]"
"16.241216","5.9.29.183","172.19.0.3","TLSv1.2","1492","Application Data [TCP segment of a reassembled PDU]"
"16.241219","5.9.29.183","172.19.0.3","TCP","1516","9002 → 43520 [PSH, ACK] Seq=431812 Ack=28693 Win=65535 Len=1460 [TCP segment of a reassembled PDU]"
"16.241221","5.9.29.183","172.19.0.3","TCP","1492","9002 → 43520 [PSH, ACK] Seq=433272 Ack=28693 Win=65535 Len=1436 [TCP segment of a reassembled PDU]"
"16.241314","172.19.0.3","5.9.29.183","TCP","56","43520 → 9002 [ACK] Seq=28693 Ack=434708 Win=8434 Len=0"
"16.244880","5.9.29.183","172.19.0.3","TLSv1.2","584","Application Data"
"16.279792","5.9.29.183","172.19.0.3","TCP","1504","[TCP segment of a reassembled PDU]"
"16.279836","172.19.0.3","5.9.29.183","TCP","56","43520 → 9002 [ACK] Seq=28693 Ack=436684 Win=8466 Len=0"
"16.279845","5.9.29.183","172.19.0.3","TCP","1516","9002 → 43520 [PSH, ACK] Seq=436684 Ack=28693 Win=65535 Len=1460 [TCP segment of a reassembled PDU]"
"16.279935","5.9.29.183","172.19.0.3","TLSv1.2","1225","Application Data"
"16.279996","172.19.0.3","5.9.29.183","TCP","56","43520 → 9002 [ACK] Seq=28693 Ack=439313 Win=8450 Len=0"
"16.295037","5.9.29.183","172.19.0.3","TLSv1.2","149","Application Data"
"16.310066","5.9.29.183","172.19.0.3","TCP","1504","[TCP segment of a reassembled PDU]"
"16.310098","172.19.0.3","5.9.29.183","TCP","56","43520 → 9002 [ACK] Seq=28693 Ack=440854 Win=8466 Len=0"
"16.310381","5.9.29.183","172.19.0.3","TCP","1516","9002 → 43520 [PSH, ACK] Seq=440854 Ack=28693 Win=65535 Len=1460 [TCP segment of a reassembled PDU]"
"16.310570","5.9.29.183","172.19.0.3","TLSv1.2","1516","Application Data [TCP segment of a reassembled PDU]"
"16.310578","5.9.29.183","172.19.0.3","TCP","1480","9002 → 43520 [PSH, ACK] Seq=443774 Ack=28693 Win=65535 Len=1424 [TCP segment of a reassembled PDU]"
"16.310581","5.9.29.183","172.19.0.3","TCP","1516","9002 → 43520 [PSH, ACK] Seq=445198 Ack=28693 Win=65535 Len=1460 [TCP segment of a reassembled PDU]"
"16.310666","5.9.29.183","172.19.0.3","TLSv1.2","572","Application Data"
"16.310734","172.19.0.3","5.9.29.183","TCP","56","43520 → 9002 [ACK] Seq=28693 Ack=447174 Win=8424 Len=0"
"16.325379","5.9.29.183","172.19.0.3","TCP","1516","[TCP segment of a reassembled PDU]"
"16.325439","5.9.29.183","172.19.0.3","TCP","1492","9002 → 43520 [PSH, ACK] Seq=448634 Ack=28693 Win=65535 Len=1436 [TCP segment of a reassembled PDU]"
"16.325459","172.19.0.3","5.9.29.183","TCP","56","43520 → 9002 [ACK] Seq=28693 Ack=450070 Win=8458 Len=0"
"16.325584","5.9.29.183","172.19.0.3","TLSv1.2","1516","Application Data [TCP segment of a reassembled PDU]"
"16.325590","5.9.29.183","172.19.0.3","TCP","1516","9002 → 43520 [PSH, ACK] Seq=451530 Ack=28693 Win=65535 Len=1460 [TCP segment of a reassembled PDU]"
"16.325593","5.9.29.183","172.19.0.3","TCP","1516","9002 → 43520 [PSH, ACK] Seq=452990 Ack=28693 Win=65535 Len=1460 [TCP segment of a reassembled PDU]"
"16.325691","5.9.29.183","172.19.0.3","TLSv1.2","1516","Application Data [TCP segment of a reassembled PDU]"
"16.325733","5.9.29.183","172.19.0.3","TCP","1516","9002 → 43520 [PSH, ACK] Seq=455910 Ack=28693 Win=65535 Len=1460 [TCP segment of a reassembled PDU]"
"16.325815","5.9.29.183","172.19.0.3","TCP","1516","9002 → 43520 [PSH, ACK] Seq=457370 Ack=28693 Win=65535 Len=1460 [TCP segment of a reassembled PDU]"
"16.325829","5.9.29.183","172.19.0.3","TLSv1.2","1432","Application Data [TCP segment of a reassembled PDU]"
"16.325885","5.9.29.183","172.19.0.3","TCP","1516","9002 → 43520 [PSH, ACK] Seq=460206 Ack=28693 Win=65535 Len=1460 [TCP segment of a reassembled PDU]"
"16.325909","5.9.29.183","172.19.0.3","TLSv1.2","1100","Application Data"
"16.325974","172.19.0.3","5.9.29.183","TCP","56","43520 → 9002 [ACK] Seq=28693 Ack=462710 Win=8385 Len=0"
"16.326432","172.19.0.3","5.9.29.183","TLSv1.2","599","Application Data"
"16.326668","5.9.29.183","172.19.0.3","TCP","56","9002 → 43520 [ACK] Seq=462710 Ack=29236 Win=65535 Len=0"
"16.379085","5.9.29.183","172.19.0.3","TCP","1516","[TCP segment of a reassembled PDU]"
"16.379114","5.9.29.183","172.19.0.3","TLSv1.2","167","Application Data"
"16.379130","172.19.0.3","5.9.29.183","TCP","56","43520 → 9002 [ACK] Seq=29236 Ack=464281 Win=8458 Len=0"
"16.981755","185.21.216.198","172.19.0.3","TLSv1.2","599","Application Data"
"16.981795","172.19.0.3","185.21.216.198","TCP","56","47918 → 41389 [ACK] Seq=1 Ack=1630 Win=1151 Len=0"
"17.021868","02:42:7b:11:31:3d","","ARP","44","Who has 172.19.0.3? Tell 172.19.0.1"
"17.021882","02:42:ac:13:00:03","","ARP","44","172.19.0.3 is at 02:42:ac:13:00:03"
