_ws.col.Time,_ws.col.Source,_ws.col.Destination,_ws.col.Protocol,_ws.col.Length,_ws.col.Info
"0.000000","172.19.0.3","5.9.29.183","TLSv1.2","599","Application Data"
"0.000245","5.9.29.183","172.19.0.3","TCP","56","9002 → 43520 [ACK] Seq=1 Ack=544 Win=65535 Len=0"
"0.229564","5.9.29.183","172.19.0.3","TLSv1.2","599","Application Data"
"0.230385","172.19.0.3","5.9.29.183","TLSv1.2","2141","Application Data"
"0.230643","5.9.29.183","172.19.0.3","TCP","56","9002 → 43520 [ACK] Seq=544 Ack=2629 Win=65535 Len=0"
"0.679849","5.9.29.183","172.19.0.3","TCP","1516","[TCP segment of a reassembled PDU]"
"0.679952","5.9.29.183","172.19.0.3","TLSv1.2","167","Application Data"
"0.680173","172.19.0.3","5.9.29.183","TCP","56","43520 → 9002 [ACK] Seq=2629 Ack=2115 Win=12730 Len=0"
"0.685483","172.19.0.3","5.9.29.183","TLSv1.2","599","Application Data"
"0.685959","5.9.29.183","172.19.0.3","TCP","56","9002 → 43520 [ACK] Seq=2115 Ack=3172 Win=65535 Len=0"
"0.883316","5.9.29.183","172.19.0.3","TLSv1.2","599","Application Data"
"0.883939","172.19.0.3","5.9.29.183","TLSv1.2","599","Application Data"
"0.884135","5.9.29.183","172.19.0.3","TCP","56","9002 → 43520 [ACK] Seq=2658 Ack=3715 Win=65535 Len=0"
"1.139994","5.9.29.183","172.19.0.3","TLSv1.2","599","Application Data"
"1.152268","5.9.29.183","172.19.0.3","TCP","1504","[TCP segment of a reassembled PDU]"
"1.152291","172.19.0.3","5.9.29.183","TCP","56","43520 → 9002 [ACK] Seq=3715 Ack=4649 Win=12738 Len=0"
"1.152542","5.9.29.183","172.19.0.3","TCP","1504","9002 → 43520 [PSH, ACK] Seq=4649 Ack=3715 Win=65535 Len=1448 [TCP segment of a reassembled PDU]"
"1.152656","5.9.29.183","172.19.0.3","TCP","737","9002 → 43520 [PSH, ACK] Seq=6097 Ack=3715 Win=65535 Len=681 [TCP segment of a reassembled PDU]"
"1.152761","5.9.29.183","172.19.0.3","TLSv1.2","1516","Application Data [TCP segment of a reassembled PDU]"
"1.152768","172.19.0.3","5.9.29.183","TCP","56","43520 → 9002 [ACK] Seq=3715 Ack=6778 Win=12738 Len=0"
"1.152811","5.9.29.183","172.19.0.3","TCP","1516","9002 → 43520 [PSH, ACK] Seq=8238 Ack=3715 Win=65535 Len=1460 [TCP segment of a reassembled PDU]"
"1.152816","5.9.29.183","172.19.0.3","TCP","799","9002 → 43520 [PSH, ACK] Seq=9698 Ack=3715 Win=65535 Len=743 [TCP segment of a reassembled PDU]"
"1.152836","172.19.0.3","5.9.29.183","TCP","56","43520 → 9002 [ACK] Seq=3715 Ack=10441 Win=12722 Len=0"
"1.153079","172.19.0.3","5.9.29.183","TLSv1.2","599","Application Data"
"1.153319","5.9.29.183","172.19.0.3","TCP","56","9002 → 43520 [ACK] Seq=10441 Ack=4258 Win=65535 Len=0"
"1.155141","5.9.29.183","172.19.0.3","TLSv1.2","584","Application Data"
"1.169475","5.9.29.183","172.19.0.3","TCP","1516","[TCP segment of a reassembled PDU]"
"1.169493","172.19.0.3","5.9.29.183","TCP","56","43520 → 9002 [ACK] Seq=4258 Ack=12429 Win=12738 Len=0"
"1.169533","5.9.29.183","172.19.0.3","TCP","1516","9002 → 43520 [PSH, ACK] Seq=12429 Ack=4258 Win=65535 Len=1460 [TCP segment of a reassembled PDU]"
"1.169542","5.9.29.183","172.19.0.3","TLSv1.2","1516","Application Data [TCP segment of a reassembled PDU]"
"1.169545","5.9.29.183","172.19.0.3","TCP","1468","9002 → 43520 [PSH, ACK] Seq=15349 Ack=4258 Win=65535 Len=1412 [TCP segment of a reassembled PDU]"
"1.169547","5.9.29.183","172.19.0.3","TCP","1516","9002 → 43520 [PSH, ACK] Seq=16761 Ack=4258 Win=65535 Len=1460 [TCP segment of a reassembled PDU]"
"1.169550","5.9.29.183","172.19.0.3","TLSv1.2","1492","Application Data [TCP segment of a reassembled PDU]"
"1.169611","5.9.29.183","172.19.0.3","TCP","1516","9002 → 43520 [PSH, ACK] Seq=19657 Ack=4258 Win=65535 Len=1460 [TCP segment of a reassembled PDU]"
"1.169616","5.9.29.183","172.19.0.3","TCP","1516","9002 → 43520 [PSH, ACK] Seq=21117 Ack=4258 Win=65535 Len=1460 [TCP segment of a reassembled PDU]"
"1.169665","172.19.0.3","5.9.29.183","TCP","56","43520 → 9002 [ACK] Seq=4258 Ack=22577 Win=12682 Len=0"
"1.169897","5.9.29.183","172.19.0.3","TLSv1.2","1516","Application Data [TCP segment of a reassembled PDU]"
"1.169904","5.9.29.183","172.19.0.3","TCP","1468","9002 → 43520 [PSH, ACK] Seq=24037 Ack=4258 Win=65535 Len=1412 [TCP segment of a reassembled PDU]"
"1.169907","5.9.29.183","172.19.0.3","TCP","1504","9002 → 43520 [PSH, ACK] Seq=25449 Ack=4258 Win=65535 Len=1448 [TCP segment of a reassembled PDU]"
"1.169982","172.19.0.3","5.9.29.183","TCP","56","43520 → 9002 [ACK] Seq=4258 Ack=26897 Win=12657 Len=0"
"1.171400","5.9.29.183","172.19.0.3","TLSv1.2","721","Application Data, Application Data"
"1.177159","5.9.29.183","172.19.0.3","TCP","1504","[TCP segment of a reassembled PDU]"
"1.177178","172.19.0.3","5.9.29.183","TCP","56","43520 → 9002 [ACK] Seq=4258 Ack=29010 Win=12738 Len=0"
"1.186047","5.9.29.183","172.19.0.3","TLSv1.2","1516","Application Data [TCP segment of a reassembled PDU]"
"1.186094","5.9.29.183","172.19.0.3","TCP","1516","9002 → 43520 [PSH, ACK] Seq=30470 Ack=4258 Win=65535 Len=1460 [TCP segment of a reassembled PDU]"
"1.186100","5.9.29.183","172.19.0.3","TCP","1516","9002 → 43520 [PSH, ACK] Seq=31930 Ack=4258 Win=65535 Len=1460 [TCP segment of a reassembled PDU]"
"1.186102","5.9.29.183","172.19.0.3","TLSv1.2","1516","Application Data [TCP segment of a reassembled PDU]"
"1.186105","5.9.29.183","172.19.0.3","TCP","1456","9002 → 43520 [PSH, ACK] Seq=34850 Ack=4258 Win=65535 Len=1400 [TCP segment of a reassembled PDU]"
"1.186278","172.19.0.3","5.9.29.183","TCP","56","43520 → 9002 [ACK] Seq=4258 Ack=36250 Win=12706 Len=0"
"1.186327","5.9.29.183","172.19.0.3","TCP","1516","9002 → 43520 [PSH, ACK] Seq=36250 Ack=4258 Win=65535 Len=1460 [TCP segment of a reassembled PDU]"
"1.186334","5.9.29.183","172.19.0.3","TLSv1.2","1516","Application Data [TCP segment of a reassembled PDU]"
"1.186336","5.9.29.183","172.19.0.3","TCP","1480","9002 → 43520 [PSH, ACK] Seq=39170 Ack=4258 Win=65535 Len=1424 [TCP segment of a reassembled PDU]"
"1.186345","5.9.29.183","172.19.0.3","TCP","1504","9002 → 43520 [PSH, ACK] Seq=40594 Ack=4258 Win=65535 Len=1448 [TCP segment of a reassembled PDU]"
"1.186470","172.19.0.3","5.9.29.183","TLSv1.2","599","Application Data"
"1.186642","5.9.29.183","172.19.0.3","TCP","56","9002 → 43520 [ACK] Seq=42042 Ack=4801 Win=65535 Len=0"
"1.186995","5.9.29.183","172.19.0.3","TLSv1.2","627","Application Data, Application Data"
"1.201658","5.9.29.183","172.19.0.3","TCP","1516","[TCP segment of a reassembled PDU]"
"1.201676","172.19.0.3","5.9.29.183","TCP","56","43520 → 9002 [ACK] Seq=4801 Ack=44073 Win=12738 Len=0"
"1.201717","5.9.29.183","172.19.0.3","TCP","1516","9002 → 43520 [PSH, ACK] Seq=44073 Ack=4801 Win=65535 Len=1460 [TCP segment of a reassembled PDU]"
"1.201726","5.9.29.183","172.19.0.3","TLSv1.2","1516","Application Data [TCP segment of a reassembled PDU]"
"1.201729","5.9.29.183","172.19.0.3","TCP","1468","9002 → 43520 [PSH, ACK] Seq=46993 Ack=4801 Win=65535 Len=1412 [TCP segment of a reassembled PDU]"
"1.201731","5.9.29.183","172.19.0.3","TCP","1516","9002 → 43520 [PSH, ACK] Seq=48405 Ack=4801 Win=65535 Len=1460 [TCP segment of a reassembled PDU]"
"1.201785","5.9.29.183","172.19.0.3","TLSv1.2","1516","Application Data [TCP segment of a reassembled PDU]"
"1.201792","5.9.29.183","172.19.0.3","TCP","1480","9002 → 43520 [PSH, ACK] Seq=51325 Ack=4801 Win=65535 Len=1424 [TCP segment of a reassembled PDU]"
"1.201850","172.19.0.3","5.9.29.183","TCP","56","43520 → 9002 [ACK] Seq=4801 Ack=52749 Win=12690 Len=0"
"1.203367","5.9.29.183","172.19.0.3","TCP","1504","9002 → 43520 [PSH, ACK] Seq=52749 Ack=4801 Win=65535 Len=1448 [TCP segment of a reassembled PDU]"
"1.203397","5.9.29.183","172.19.0.3","TLSv1.2","924","Application Data, Application Data"
"1.203405","172.19.0.3","5.9.29.183","TCP","56","43520 → 9002 [ACK] Seq=4801 Ack=55065 Win=12730 Len=0"
"1.203606","172.19.0.3","5.9.29.183","TLSv1.2","599","Application Data"
"1.203761","5.9.29.183","172.19.0.3","TCP","56","9002 → 43520 [ACK] Seq=55065 Ack=5344 Win=65535 Len=0"
"1.254610","5.9.29.183","172.19.0.3","TCP","1516","[TCP segment of a reassembled PDU]"
"1.254816","5.9.29.183","172.19.0.3","TLSv1.2","167","Application Data"
"1.254826","172.19.0.3","5.9.29.183","TCP","56","43520 → 9002 [ACK] Seq=5344 Ack=56636 Win=12738 Len=0"
"1.258294","172.19.0.3","5.9.29.183","TLSv1.2","599","Application Data"
"1.258493","5.9.29.183","172.19.0.3","TCP","56","9002 → 43520 [ACK] Seq=56636 Ack=5887 Win=65535 Len=0"
"1.486764","5.9.29.183","172.19.0.3","TLSv1.2","599","Application Data"
"1.487564","172.19.0.3","5.9.29.183","TLSv1.2","599","Application Data"
"1.487818","5.9.29.183","172.19.0.3","TCP","56","9002 → 43520 [ACK] Seq=57179 Ack=6430 Win=65535 Len=0"
"1.956480","5.9.29.183","172.19.0.3","TCP","1516","[TCP segment of a reassembled PDU]"
"1.956566","5.9.29.183","172.19.0.3","TCP","1516","9002 → 43520 [PSH, ACK] Seq=58639 Ack=6430 Win=65535 Len=1460 [TCP segment of a reassembled PDU]"
"1.956576","5.9.29.183","172.19.0.3","TLSv1.2","763","Application Data"
"1.956612","5.9.29.183","172.19.0.3","TCP","1516","[TCP segment of a reassembled PDU]"
"1.956624","5.9.29.183","172.19.0.3","TCP","1516","9002 → 43520 [PSH, ACK] Seq=62266 Ack=6430 Win=65535 Len=1460 [TCP segment of a reassembled PDU]"
"1.956630","5.9.29.183","172.19.0.3","TLSv1.2","1516","Application Data [TCP segment of a reassembled PDU]"
"1.956692","5.9.29.183","172.19.0.3","TCP","1468","9002 → 43520 [PSH, ACK] Seq=65186 Ack=6430 Win=65535 Len=1412 [TCP segment of a reassembled PDU]"
"1.956695","5.9.29.183","172.19.0.3","TCP","1516","9002 → 43520 [PSH, ACK] Seq=66598 Ack=6430 Win=65535 Len=1460 [TCP segment of a reassembled PDU]"
"1.956696","172.19.0.3","5.9.29.183","TCP","56","43520 → 9002 [ACK] Seq=6430 Ack=65186 Win=12698 Len=0"
"1.956697","5.9.29.183","172.19.0.3","TLSv1.2","1516","Application Data [TCP segment of a reassembled PDU]"
"1.956699","5.9.29.183","172.19.0.3","TCP","1516","9002 → 43520 [PSH, ACK] Seq=69518 Ack=6430 Win=65535 Len=1460 [TCP segment of a reassembled PDU]"
"1.956725","5.9.29.183","172.19.0.3","TCP","1392","9002 → 43520 [PSH, ACK] Seq=70978 Ack=6430 Win=65535 Len=1336 [TCP segment of a reassembled PDU]"
"1.956745","5.9.29.183","172.19.0.3","TCP","132","9002 → 43520 [PSH, ACK] Seq=72314 Ack=6430 Win=65535 Len=76 [TCP segment of a reassembled PDU]"
"1.956783","172.19.0.3","5.9.29.183","TCP","56","43520 → 9002 [ACK] Seq=6430 Ack=72390 Win=12647 Len=0"
"1.956994","172.19.0.3","5.9.29.183","TLSv1.2","599","Application Data"
"1.957177","5.9.29.183","172.19.0.3","TCP","56","9002 → 43520 [ACK] Seq=72390 Ack=6973 Win=65535 Len=0"
"1.972596","5.9.29.183","172.19.0.3","TLSv1.2","1516","Application Data [TCP segment of a reassembled PDU]"
"1.972642","5.9.29.183","172.19.0.3","TCP","1492","9002 → 43520 [PSH, ACK] Seq=73850 Ack=6973 Win=65535 Len=1436 [TCP segment of a reassembled PDU]"
"1.972655","172.19.0.3","5.9.29.183","TCP","56","43520 → 9002 [ACK] Seq=6973 Ack=75286 Win=12730 Len=0"
"1.973115","5.9.29.183","172.19.0.3","TLSv1.2","1504","Application Data [TCP segment of a reassembled PDU]"
"1.973172","5.9.29.183","172.19.0.3","TLSv1.2","1516","Application Data [TCP segment of a reassembled PDU]"
"1.973186","172.19.0.3","5.9.29.183","TCP","56","43520 → 9002 [ACK] Seq=6973 Ack=78194 Win=12730 Len=0"
"1.973255","5.9.29.183","172.19.0.3","TCP","1516","9002 → 43520 [PSH, ACK] Seq=78194 Ack=6973 Win=65535 Len=1460 [TCP segment of a reassembled PDU]"
"1.973261","5.9.29.183","172.19.0.3","TLSv1.2","1480","Application Data, Application Data"
"1.973263","5.9.29.183","172.19.0.3","TLSv1.2","1090","Application Data"
"1.973359","172.19.0.3","5.9.29.183","TCP","56","43520 → 9002 [ACK] Seq=6973 Ack=82112 Win=12706 Len=0"
"1.977324","172.19.0.3","5.9.29.183","TLSv1.2","599","Application Data"
"1.977587","5.9.29.183","172.19.0.3","TCP","56","9002 → 43520 [ACK] Seq=82112 Ack=7516 Win=65535 Len=0"
"2.382769","5.9.29.183","172.19.0.3","TLSv1.2","599","Application Data"
"2.383639","172.19.0.3","5.9.29.183","TLSv1.2","599","Application Data"
"2.383912","5.9.29.183","172.19.0.3","TCP","56","9002 → 43520 [ACK] Seq=82655 Ack=8059 Win=65535 Len=0"
"2.846008","5.9.29.183","172.19.0.3","TCP","1516","[TCP segment of a reassembled PDU]"
"2.846091","5.9.29.183","172.19.0.3","TCP","1516","9002 → 43520 [PSH, ACK] Seq=84115 Ack=8059 Win=65535 Len=1460 [TCP segment of a reassembled PDU]"
"2.846101","5.9.29.183","172.19.0.3","TLSv1.2","763","Application Data"
"2.846106","5.9.29.183","172.19.0.3","TCP","1516","[TCP segment of a reassembled PDU]"
"2.846111","5.9.29.183","172.19.0.3","TCP","1516","9002 → 43520 [PSH, ACK] Seq=87742 Ack=8059 Win=65535 Len=1460 [TCP segment of a reassembled PDU]"
"2.846114","5.9.29.183","172.19.0.3","TLSv1.2","1516","Application Data [TCP segment of a reassembled PDU]"
"2.846117","5.9.29.183","172.19.0.3","TCP","1516","9002 → 43520 [PSH, ACK] Seq=90662 Ack=8059 Win=65535 Len=1460 [TCP segment of a reassembled PDU]"
"2.846140","5.9.29.183","172.19.0.3","TCP","1516","9002 → 43520 [PSH, ACK] Seq=92122 Ack=8059 Win=65535 Len=1460 [TCP segment of a reassembled PDU]"
"2.846148","5.9.29.183","172.19.0.3","TLSv1.2","1444","Application Data, Application Data"
"2.846211","5.9.29.183","172.19.0.3","TCP","1504","9002 → 43520 [PSH, ACK] Seq=94970 Ack=8059 Win=65535 Len=1448 [TCP segment of a reassembled PDU]"
"2.846244","172.19.0.3","5.9.29.183","TCP","56","43520 → 9002 [ACK] Seq=8059 Ack=96418 Win=12665 Len=0"
"2.861869","5.9.29.183","172.19.0.3","TCP","1516","9002 → 43520 [PSH, ACK] Seq=96418 Ack=8059 Win=65535 Len=1460 [TCP segment of a reassembled PDU]"
"2.861924","5.9.29.183","172.19.0.3","TLSv1.2","1516","Application Data [TCP segment of a reassembled PDU]"
"2.861940","172.19.0.3","5.9.29.183","TCP","56","43520 → 9002 [ACK] Seq=8059 Ack=99338 Win=12730 Len=0"
"2.861943","5.9.29.183","172.19.0.3","TCP","1516","9002 → 43520 [PSH, ACK] Seq=99338 Ack=8059 Win=65535 Len=1460 [TCP segment of a reassembled PDU]"
"2.861946","5.9.29.183","172.19.0.3","TLSv1.2","1516","Application Data [TCP segment of a reassembled PDU]"
"2.861948","5.9.29.183","172.19.0.3","TCP","1516","9002 → 43520 [PSH, ACK] Seq=102258 Ack=8059 Win=65535 Len=1460 [TCP segment of a reassembled PDU]"
"2.861950","5.9.29.183","172.19.0.3","TCP","1444","9002 → 43520 [PSH, ACK] Seq=103718 Ack=8059 Win=65535 Len=1388 [TCP segment of a reassembled PDU]"
"2.862119","172.19.0.3","5.9.29.183","TCP","56","43520 → 9002 [ACK] Seq=8059 Ack=105106 Win=12698 Len=0"
"2.862476","5.9.29.183","172.19.0.3","TLSv1.2","1504","Application Data [TCP segment of a reassembled PDU]"
"2.862734","5.9.29.183","172.19.0.3","TCP","1516","9002 → 43520 [PSH, ACK] Seq=106554 Ack=8059 Win=65535 Len=1460 [TCP segment of a reassembled PDU]"
"2.862742","172.19.0.3","5.9.29.183","TCP","56","43520 → 9002 [ACK] Seq=8059 Ack=108014 Win=12738 Len=0"
"2.862792","5.9.29.183","172.19.0.3","TCP","1492","9002 → 43520 [PSH, ACK] Seq=108014 Ack=8059 Win=65535 Len=1436 [TCP segment of a reassembled PDU]"
"2.862833","5.9.29.183","172.19.0.3","TLSv1.2","1278","Application Data, Application Data"
"2.862839","172.19.0.3","5.9.29.183","TCP","56","43520 → 9002 [ACK] Seq=8059 Ack=110672 Win=12738 Len=0"
"2.862998","172.19.0.3","5.9.29.183","TLSv1.2","599","Application Data"
"2.863165","5.9.29.183","172.19.0.3","TCP","56","9002 → 43520 [ACK] Seq=110672 Ack=8602 Win=65535 Len=0"
"2.875779","5.9.29.183","172.19.0.3","TCP","1504","[TCP segment of a reassembled PDU]"
"2.875822","5.9.29.183","172.19.0.3","TCP","1516","9002 → 43520 [PSH, ACK] Seq=112120 Ack=8602 Win=65535 Len=1460 [TCP segment of a reassembled PDU]"
"2.875827","5.9.29.183","172.19.0.3","TLSv1.2","1516","Application Data [TCP segment of a reassembled PDU]"
"2.875829","5.9.29.183","172.19.0.3","TCP","1480","9002 → 43520 [PSH, ACK] Seq=115040 Ack=8602 Win=65535 Len=1424 [TCP segment of a reassembled PDU]"
"2.875832","5.9.29.183","172.19.0.3","TCP","1516","9002 → 43520 [PSH, ACK] Seq=116464 Ack=8602 Win=65535 Len=1460 [TCP segment of a reassembled PDU]"
"2.875834","5.9.29.183","172.19.0.3","TLSv1.2","1516","Application Data [TCP segment of a reassembled PDU]"
"2.875845","5.9.29.183","172.19.0.3","TCP","1480","9002 → 43520 [PSH, ACK] Seq=119384 Ack=8602 Win=65535 Len=1424 [TCP segment of a reassembled PDU]"
"2.875936","172.19.0.3","5.9.29.183","TCP","56","43520 → 9002 [ACK] Seq=8602 Ack=120808 Win=12690 Len=0"
"2.876203","172.19.0.3","5.9.29.183","TLSv1.2","599","Application Data"
"2.876349","5.9.29.183","172.19.0.3","TCP","56","9002 → 43520 [ACK] Seq=120808 Ack=9145 Win=65535 Len=0"
"2.878188","5.9.29.183","172.19.0.3","TLSv1.2","1516","Application Data [TCP segment of a reassembled PDU]"
"2.878218","5.9.29.183","172.19.0.3","TCP","1516","9002 → 43520 [PSH, ACK] Seq=122268 Ack=9145 Win=65535 Len=1460 [TCP segment of a reassembled PDU]"
"2.878226","172.19.0.3","5.9.29.183","TCP","56","43520 → 9002 [ACK] Seq=9145 Ack=123728 Win=12730 Len=0"
"2.878228","5.9.29.183","172.19.0.3","TCP","1516","9002 → 43520 [PSH, ACK] Seq=123728 Ack=9145 Win=65535 Len=1460 [TCP segment of a reassembled PDU]"
"2.878230","5.9.29.183","172.19.0.3","TLSv1.2","1468","Application Data [TCP segment of a reassembled PDU]"
"2.878272","172.19.0.3","5.9.29.183","TCP","56","43520 → 9002 [ACK] Seq=9145 Ack=126600 Win=12714 Len=0"
"2.879270","5.9.29.183","172.19.0.3","TLSv1.2","207","Application Data"
"2.920206","172.19.0.3","5.9.29.183","TCP","56","43520 → 9002 [ACK] Seq=9145 Ack=126751 Win=12738 Len=0"
"3.016728","5.9.29.183","172.19.0.3","TLSv1.2","1113","Application Data"
"3.016747","172.19.0.3","5.9.29.183","TCP","56","43520 → 9002 [ACK] Seq=9145 Ack=127808 Win=12738 Len=0"
"3.016806","5.9.29.183","172.19.0.3","TCP","1516","[TCP segment of a reassembled PDU]"
"3.016815","172.19.0.3","5.9.29.183","TCP","56","43520 → 9002 [ACK] Seq=9145 Ack=129268 Win=12730 Len=0"
"3.016816","5.9.29.183","172.19.0.3","TCP","1492","9002 → 43520 [PSH, ACK] Seq=129268 Ack=9145 Win=65535 Len=1436 [TCP segment of a reassembled PDU]"
"3.016821","172.19.0.3","5.9.29.183","TCP","56","43520 → 9002 [ACK] Seq=9145 Ack=130704 Win=12720 Len=0"
"3.032526","5.9.29.183","172.19.0.3","TLSv1.2","273","Application Data"
"3.032536","172.19.0.3","5.9.29.183","TCP","56","43520 → 9002 [ACK] Seq=9145 Ack=130921 Win=12738 Len=0"
"3.036600","172.19.0.3","5.9.29.183","TLSv1.2","599","Application Data"
"3.036880","5.9.29.183","172.19.0.3","TCP","56","9002 → 43520 [ACK] Seq=130921 Ack=9688 Win=65535 Len=0"
"3.404515","5.9.29.183","172.19.0.3","TLSv1.2","599","Application Data"
"3.405398","172.19.0.3","5.9.29.183","TLSv1.2","599","Application Data"
"3.405659","5.9.29.183","172.19.0.3","TCP","56","9002 → 43520 [ACK] Seq=131464 Ack=10231 Win=65535 Len=0"
"3.739839","5.9.29.183","172.19.0.3","TLSv1.2","599","Application Data"
"3.739951","5.9.29.183","172.19.0.3","TCP","1516","[TCP segment of a reassembled PDU]"
"3.739964","5.9.29.183","172.19.0.3","TCP","1516","9002 → 43520 [PSH, ACK] Seq=133467 Ack=10231 Win=65535 Len=1460 [TCP segment of a reassembled PDU]"
"3.740010","5.9.29.183","172.19.0.3","TLSv1.2","1516","Application Data [TCP segment of a reassembled PDU]"
"3.740018","5.9.29.183","172.19.0.3","TCP","1516","9002 → 43520 [PSH, ACK] Seq=136387 Ack=10231 Win=65535 Len=1460 [TCP segment of a reassembled PDU]"
"3.740023","5.9.29.183","172.19.0.3","TCP","59","9002 → 43520 [PSH, ACK] Seq=137847 Ack=10231 Win=65535 Len=3 [TCP segment of a reassembled PDU]"
"3.740060","172.19.0.3","5.9.29.183","TCP","56","43520 → 9002 [ACK] Seq=10231 Ack=137850 Win=12702 Len=0"
"3.740229","5.9.29.183","172.19.0.3","TCP","1516","9002 → 43520 [PSH, ACK] Seq=137850 Ack=10231 Win=65535 Len=1460 [TCP segment of a reassembled PDU]"
"3.740237","5.9.29.183","172.19.0.3","TLSv1.2","1516","Application Data [TCP segment of a reassembled PDU]"
"3.740240","5.9.29.183","172.19.0.3","TCP","1516","9002 → 43520 [PSH, ACK] Seq=140770 Ack=10231 Win=65535 Len=1460 [TCP segment of a reassembled PDU]"
"3.740304","172.19.0.3","5.9.29.183","TCP","56","43520 → 9002 [ACK] Seq=10231 Ack=142230 Win=12678 Len=0"
"3.740366","5.9.29.183","172.19.0.3","TCP","1516","9002 → 43520 [PSH, ACK] Seq=142230 Ack=10231 Win=65535 Len=1460 [TCP segment of a reassembled PDU]"
"3.740372","5.9.29.183","172.19.0.3","TLSv1.2","1516","Application Data [TCP segment of a reassembled PDU]"
"3.740375","5.9.29.183","172.19.0.3","TCP","1393","9002 → 43520 [PSH, ACK] Seq=145150 Ack=10231 Win=65535 Len=1337 [TCP segment of a reassembled PDU]"
"3.740593","172.19.0.3","5.9.29.183","TCP","56","43520 → 9002 [ACK] Seq=10231 Ack=146487 Win=12653 Len=0"
"3.755431","5.9.29.183","172.19.0.3","TLSv1.2","1112","Application Data"
"3.757576","5.9.29.183","172.19.0.3","TCP","1516","[TCP segment of a reassembled PDU]"
"3.757592","172.19.0.3","5.9.29.183","TCP","56","43520 → 9002 [ACK] Seq=10231 Ack=149003 Win=12738 Len=0"
"3.757628","5.9.29.183","172.19.0.3","TCP","1516","9002 → 43520 [PSH, ACK] Seq=149003 Ack=10231 Win=65535 Len=1460 [TCP segment of a reassembled PDU]"
"3.757637","5.9.29.183","172.19.0.3","TLSv1.2","1516","Application Data [TCP segment of a reassembled PDU]"
"3.757639","5.9.29.183","172.19.0.3","TCP","1516","9002 → 43520 [PSH, ACK] Seq=151923 Ack=10231 Win=65535 Len=1460 [TCP segment of a reassembled PDU]"
"3.757641","5.9.29.183","172.19.0.3","TCP","1516","9002 → 43520 [PSH, ACK] Seq=153383 Ack=10231 Win=65535 Len=1460 [TCP segment of a reassembled PDU]"
"3.757644","5.9.29.183","172.19.0.3","TLSv1.2","1516","Application Data [TCP segment of a reassembled PDU]"
"3.757704","5.9.29.183","172.19.0.3","TCP","1432","9002 → 43520 [PSH, ACK] Seq=156303 Ack=10231 Win=65535 Len=1376 [TCP segment of a reassembled PDU]"
"3.757713","5.9.29.183","172.19.0.3","TCP","1504","9002 → 43520 [PSH, ACK] Seq=157679 Ack=10231 Win=65535 Len=1448 [TCP segment of a reassembled PDU]"
"3.757746","172.19.0.3","5.9.29.183","TCP","56","43520 → 9002 [ACK] Seq=10231 Ack=159127 Win=12682 Len=0"
"3.771025","5.9.29.183","172.19.0.3","TLSv1.2","1516","Application Data, Application Data"
"3.771068","5.9.29.183","172.19.0.3","TCP","1516","9002 → 43520 [PSH, ACK] Seq=160587 Ack=10231 Win=65535 Len=1460 [TCP segment of a reassembled PDU]"
"3.771090","172.19.0.3","5.9.29.183","TCP","56","43520 → 9002 [ACK] Seq=10231 Ack=162047 Win=12730 Len=0"
"3.771093","5.9.29.183","172.19.0.3","TCP","1480","9002 → 43520 [PSH, ACK] Seq=162047 Ack=10231 Win=65535 Len=1424 [TCP segment of a reassembled PDU]"
"3.771343","172.19.0.3","5.9.29.183","TLSv1.2","599","Application Data"
"3.771538","5.9.29.183","172.19.0.3","TCP","56","9002 → 43520 [ACK] Seq=163471 Ack=10774 Win=65535 Len=0"
"3.771895","5.9.29.183","172.19.0.3","TLSv1.2","750","Application Data, Application Data"
"3.815086","172.19.0.3","5.9.29.183","TCP","56","43520 → 9002 [ACK] Seq=10774 Ack=164165 Win=12738 Len=0"
"3.909679","5.9.29.183","172.19.0.3","TCP","1516","[TCP segment of a reassembled PDU]"
"3.909700","172.19.0.3","5.9.29.183","TCP","56","43520 → 9002 [ACK] Seq=10774 Ack=165625 Win=12738 Len=0"
"3.909750","5.9.29.183","172.19.0.3","TCP","1492","9002 → 43520 [PSH, ACK] Seq=165625 Ack=10774 Win=65535 Len=1436 [TCP segment of a reassembled PDU]"
"3.909765","172.19.0.3","5.9.29.183","TCP","56","43520 → 9002 [ACK] Seq=10774 Ack=167061 Win=12730 Len=0"
"3.909767","5.9.29.183","172.19.0.3","TLSv1.2","273","Application Data"
"3.909773","172.19.0.3","5.9.29.183","TCP","56","43520 → 9002 [ACK] Seq=10774 Ack=167278 Win=12729 Len=0"
"3.910301","172.19.0.3","5.9.29.183","TLSv1.2","599","Application Data"
"3.910507","5.9.29.183","172.19.0.3","TCP","56","9002 → 43520 [ACK] Seq=167278 Ack=11317 Win=65535 Len=0"
"3.919928","172.19.0.3","5.9.29.183","TLSv1.2","599","Application Data"
"3.920213","5.9.29.183","172.19.0.3","TCP","56","9002 → 43520 [ACK] Seq=167278 Ack=11860 Win=65535 Len=0"
"4.227274","5.9.29.183","172.19.0.3","TLSv1.2","599","Application Data"
"4.228051","172.19.0.3","5.9.29.183","TLSv1.2","599","Application Data"
"4.228313","5.9.29.183","172.19.0.3","TCP","56","9002 → 43520 [ACK] Seq=167821 Ack=12403 Win=65535 Len=0"
"4.667261","5.9.29.183","172.19.0.3","TCP","1516","[TCP segment of a reassembled PDU]"
"4.667323","5.9.29.183","172.19.0.3","TCP","1516","9002 → 43520 [PSH, ACK] Seq=169281 Ack=12403 Win=65535 Len=1460 [TCP segment of a reassembled PDU]"
"4.667332","5.9.29.183","172.19.0.3","TLSv1.2","763","Application Data"
"4.667427","172.19.0.3","5.9.29.183","TCP","56","43520 → 9002 [ACK] Seq=12403 Ack=171448 Win=12722 Len=0"
"4.678451","5.9.29.183","172.19.0.3","TCP","1504","[TCP segment of a reassembled PDU]"
"4.678775","5.9.29.183","172.19.0.3","TCP","1504","9002 → 43520 [PSH, ACK] Seq=172896 Ack=12403 Win=65535 Len=1448 [TCP segment of a reassembled PDU]"
"4.678785","172.19.0.3","5.9.29.183","TCP","56","43520 → 9002 [ACK] Seq=12403 Ack=174344 Win=12738 Len=0"
"4.683371","5.9.29.183","172.19.0.3","TLSv1.2","787","Application Data"
"4.703064","5.9.29.183","172.19.0.3","TCP","1516","[TCP segment of a reassembled PDU]"
"4.703081","172.19.0.3","5.9.29.183","TCP","56","43520 → 9002 [ACK] Seq=12403 Ack=176535 Win=12738 Len=0"
"4.703111","5.9.29.183","172.19.0.3","TCP","1492","9002 → 43520 [PSH, ACK] Seq=176535 Ack=12403 Win=65535 Len=1436 [TCP segment of a reassembled PDU]"
"4.703127","5.9.29.183","172.19.0.3","TLSv1.2","1237","Application Data"
"4.703274","172.19.0.3","5.9.29.183","TCP","56","43520 → 9002 [ACK] Seq=12403 Ack=179152 Win=12722 Len=0"
"4.712561","5.9.29.183","172.19.0.3","TLSv1.2","1516","Application Data"
"4.712607","5.9.29.183","172.19.0.3","TCP","1492","9002 → 43520 [PSH, ACK] Seq=180612 Ack=12403 Win=65535 Len=1436 [TCP segment of a reassembled PDU]"
"4.712619","172.19.0.3","5.9.29.183","TCP","56","43520 → 9002 [ACK] Seq=12403 Ack=182048 Win=12730 Len=0"
"4.713026","5.9.29.183","172.19.0.3","TLSv1.2","1516","Application Data [TCP segment of a reassembled PDU]"
"4.713064","5.9.29.183","172.19.0.3","TCP","1516","9002 → 43520 [PSH, ACK] Seq=183508 Ack=12403 Win=65535 Len=1460 [TCP segment of a reassembled PDU]"
"4.713071","172.19.0.3","5.9.29.183","TCP","56","43520 → 9002 [ACK] Seq=12403 Ack=184968 Win=12730 Len=0"
"4.713073","5.9.29.183","172.19.0.3","TCP","1480","9002 → 43520 [PSH, ACK] Seq=184968 Ack=12403 Win=65535 Len=1424 [TCP segment of a reassembled PDU]"
"4.722275","5.9.29.183","172.19.0.3","TLSv1.2","677","Application Data"
"4.722297","172.19.0.3","5.9.29.183","TCP","56","43520 → 9002 [ACK] Seq=12403 Ack=187013 Win=12738 Len=0"
"4.725800","5.9.29.183","172.19.0.3","TCP","1516","[TCP segment of a reassembled PDU]"
"4.725860","5.9.29.183","172.19.0.3","TCP","1516","9002 → 43520 [PSH, ACK] Seq=188473 Ack=12403 Win=65535 Len=1460 [TCP segment of a reassembled PDU]"
"4.725869","5.9.29.183","172.19.0.3","TLSv1.2","1516","Application Data [TCP segment of a reassembled PDU]"
"4.725873","5.9.29.183","172.19.0.3","TCP","1468","9002 → 43520 [PSH, ACK] Seq=191393 Ack=12403 Win=65535 Len=1412 [TCP segment of a reassembled PDU]"
"4.725878","5.9.29.183","172.19.0.3","TCP","1516","9002 → 43520 [PSH, ACK] Seq=192805 Ack=12403 Win=65535 Len=1460 [TCP segment of a reassembled PDU]"
"4.725905","5.9.29.183","172.19.0.3","TLSv1.2","1492","Application Data [TCP segment of a reassembled PDU]"
"4.725910","5.9.29.183","172.19.0.3","TCP","1504","9002 → 43520 [PSH, ACK] Seq=195701 Ack=12403 Win=65535 Len=1448 [TCP segment of a reassembled PDU]"
"4.725957","172.19.0.3","5.9.29.183","TCP","56","43520 → 9002 [ACK] Seq=12403 Ack=197149 Win=12688 Len=0"
"4.726399","172.19.0.3","5.9.29.183","TLSv1.2","599","Application Data"
"4.726650","5.9.29.183","172.19.0.3","TCP","56","9002 → 43520 [ACK] Seq=197149 Ack=12946 Win=65535 Len=0"
"4.738976","5.9.29.183","172.19.0.3","TCP","1516","9002 → 43520 [PSH, ACK] Seq=197149 Ack=12946 Win=65535 Len=1460 [TCP segment of a reassembled PDU]"
"4.739029","5.9.29.183","172.19.0.3","TLSv1.2","1516","Application Data, Application Data"
"4.739043","172.19.0.3","5.9.29.183","TCP","56","43520 → 9002 [ACK] Seq=12946 Ack=200069 Win=12730 Len=0"
"4.739045","5.9.29.183","172.19.0.3","TCP","1516","9002 → 43520 [PSH, ACK] Seq=200069 Ack=12946 Win=65535 Len=1460 [TCP segment of a reassembled PDU]"
"4.739148","5.9.29.183","172.19.0.3","TCP","1516","9002 → 43520 [PSH, ACK] Seq=201529 Ack=12946 Win=65535 Len=1460 [TCP segment of a reassembled PDU]"
"4.739155","5.9.29.183","172.19.0.3","TCP","453","9002 → 43520 [PSH, ACK] Seq=202989 Ack=12946 Win=65535 Len=397 [TCP segment of a reassembled PDU]"
"4.739213","5.9.29.183","172.19.0.3","TLSv1.2","305","Application Data, Application Data"
"4.739309","172.19.0.3","5.9.29.183","TCP","56","43520 → 9002 [ACK] Seq=12946 Ack=203635 Win=12703 Len=0"
"4.765163","5.9.29.183","172.19.0.3","TCP","1516","[TCP segment of a reassembled PDU]"
"4.765216","5.9.29.183","172.19.0.3","TCP","1516","9002 → 43520 [PSH, ACK] Seq=205095 Ack=12946 Win=65535 Len=1460 [TCP segment of a reassembled PDU]"
"4.765228","172.19.0.3","5.9.29.183","TCP","56","43520 → 9002 [ACK] Seq=12946 Ack=206555 Win=12730 Len=0"
"4.765230","5.9.29.183","172.19.0.3","TLSv1.2","763","Application Data"
"4.768779","172.19.0.3","5.9.29.183","TLSv1.2","599","Application Data"
"4.768951","5.9.29.183","172.19.0.3","TCP","56","9002 → 43520 [ACK] Seq=207262 Ack=13489 Win=65535 Len=0"
"4.973369","5.9.29.183","172.19.0.3","TLSv1.2","599","Application Data"
"4.974035","172.19.0.3","5.9.29.183","TLSv1.2","599","Application Data"
"4.974251","5.9.29.183","172.19.0.3","TCP","56","9002 → 43520 [ACK] Seq=207805 Ack=14032 Win=65535 Len=0"
"5.203809","5.9.29.183","172.19.0.3","TLSv1.2","599","Application Data"
"5.214226","5.9.29.183","172.19.0.3","TCP","1504","[TCP segment of a reassembled PDU]"
"5.214246","172.19.0.3","5.9.29.183","TCP","56","43520 → 9002 [ACK] Seq=14032 Ack=209796 Win=12738 Len=0"
"5.214280","5.9.29.183","172.19.0.3","TCP","1504","9002 → 43520 [PSH, ACK] Seq=209796 Ack=14032 Win=65535 Len=1448 [TCP segment of a reassembled PDU]"
"5.214371","5.9.29.183","172.19.0.3","TLSv1.2","1516","Application Data [TCP segment of a reassembled PDU]"
"5.214375","5.9.29.183","172.19.0.3","TCP","1516","9002 → 43520 [PSH, ACK] Seq=212704 Ack=14032 Win=65535 Len=1460 [TCP segment of a reassembled PDU]"
"5.214378","5.9.29.183","172.19.0.3","TCP","1480","9002 → 43520 [PSH, ACK] Seq=214164 Ack=14032 Win=65535 Len=1424 [TCP segment of a reassembled PDU]"
"5.214409","172.19.0.3","5.9.29.183","TCP","56","43520 → 9002 [ACK] Seq=14032 Ack=215588 Win=12706 Len=0"
"5.214992","5.9.29.183","172.19.0.3","TLSv1.2","1516","Application Data [TCP segment of a reassembled PDU]"
"5.215021","5.9.29.183","172.19.0.3","TCP","1492","9002 → 43520 [PSH, ACK] Seq=217048 Ack=14032 Win=65535 Len=1436 [TCP segment of a reassembled PDU]"
"5.215029","172.19.0.3","5.9.29.183","TCP","56","43520 → 9002 [ACK] Seq=14032 Ack=218484 Win=12728 Len=0"
"5.215174","5.9.29.183","172.19.0.3","TCP","1504","9002 → 43520 [PSH, ACK] Seq=218484 Ack=14032 Win=65535 Len=1448 [TCP segment of a reassembled PDU]"
"5.219802","5.9.29.183","172.19.0.3","TLSv1.2","381","Application Data"
"5.219820","172.19.0.3","5.9.29.183","TCP","56","43520 → 9002 [ACK] Seq=14032 Ack=220257 Win=12738 Len=0"
"5.220146","172.19.0.3","5.9.29.183","TLSv1.2","599","Application Data"
"5.220377","5.9.29.183","172.19.0.3","TCP","56","9002 → 43520 [ACK] Seq=220257 Ack=14575 Win=65535 Len=0"
"5.229187","5.9.29.183","172.19.0.3","TCP","1516","[TCP segment of a reassembled PDU]"
"5.229223","5.9.29.183","172.19.0.3","TCP","1516","9002 → 43520 [PSH, ACK] Seq=221717 Ack=14575 Win=65535 Len=1460 [TCP segment of a reassembled PDU]"
"5.229229","5.9.29.183","172.19.0.3","TLSv1.2","1516","Application Data [TCP segment of a reassembled PDU]"
"5.229231","5.9.29.183","172.19.0.3","TCP","1516","9002 → 43520 [PSH, ACK] Seq=224637 Ack=14575 Win=65535 Len=1460 [TCP segment of a reassembled PDU]"
"5.229234","5.9.29.183","172.19.0.3","TCP","1516","9002 → 43520 [PSH, ACK] Seq=226097 Ack=14575 Win=65535 Len=1460 [TCP segment of a reassembled PDU]"
"5.229236","5.9.29.183","172.19.0.3","TLSv1.2","1444","Application Data [TCP segment of a reassembled PDU]"
"5.229372","172.19.0.3","5.9.29.183","TCP","56","43520 → 9002 [ACK] Seq=14575 Ack=228945 Win=12698 Len=0"
"5.229435","5.9.29.183","172.19.0.3","TCP","1516","9002 → 43520 [PSH, ACK] Seq=228945 Ack=14575 Win=65535 Len=1460 [TCP segment of a reassembled PDU]"
"5.229443","5.9.29.183","172.19.0.3","TCP","1516","9002 → 43520 [PSH, ACK] Seq=230405 Ack=14575 Win=65535 Len=1460 [TCP segment of a reassembled PDU]"
"5.229448","5.9.29.183","172.19.0.3","TLSv1.2","1480","Application Data [TCP segment of a reassembled PDU]"
"5.229501","5.9.29.183","172.19.0.3","TCP","1504","9002 → 43520 [PSH, ACK] Seq=233289 Ack=14575 Win=65535 Len=1448 [TCP segment of a reassembled PDU]"
"5.229528","172.19.0.3","5.9.29.183","TCP","56","43520 → 9002 [ACK] Seq=14575 Ack=234737 Win=12665 Len=0"
"5.235923","5.9.29.183","172.19.0.3","TLSv1.2","1112","Application Data"
"5.236352","172.19.0.3","5.9.29.183","TLSv1.2","599","Application Data"
"5.236619","5.9.29.183","172.19.0.3","TCP","56","9002 → 43520 [ACK] Seq=235793 Ack=15118 Win=65535 Len=0"
"5.241079","5.9.29.183","172.19.0.3","TCP","1504","[TCP segment of a reassembled PDU]"
"5.241560","5.9.29.183","172.19.0.3","TCP","1516","9002 → 43520 [PSH, ACK] Seq=237241 Ack=15118 Win=65535 Len=1460 [TCP segment of a reassembled PDU]"
"5.241573","172.19.0.3","5.9.29.183","TCP","56","43520 → 9002 [ACK] Seq=15118 Ack=238701 Win=12738 Len=0"
"5.241637","5.9.29.183","172.19.0.3","TLSv1.2","1516","Application Data [TCP segment of a reassembled PDU]"
"5.241643","5.9.29.183","172.19.0.3","TCP","1516","9002 → 43520 [PSH, ACK] Seq=240161 Ack=15118 Win=65535 Len=1460 [TCP segment of a reassembled PDU]"
"5.241669","172.19.0.3","5.9.29.183","TCP","56","43520 → 9002 [ACK] Seq=15118 Ack=241621 Win=12722 Len=0"
"5.241703","5.9.29.183","172.19.0.3","TCP","1468","9002 → 43520 [PSH, ACK] Seq=241621 Ack=15118 Win=65535 Len=1412 [TCP segment of a reassembled PDU]"
"5.241707","5.9.29.183","172.19.0.3","TLSv1.2","1516","Application Data [TCP segment of a reassembled PDU]"
"5.241709","5.9.29.183","172.19.0.3","TCP","1516","9002 → 43520 [PSH, ACK] Seq=244493 Ack=15118 Win=65535 Len=1460 [TCP segment of a reassembled PDU]"
"5.241711","5.9.29.183","172.19.0.3","TCP","1480","9002 → 43520 [PSH, ACK] Seq=245953 Ack=15118 Win=65535 Len=1424 [TCP segment of a reassembled PDU]"
"5.241841","172.19.0.3","5.9.29.183","TCP","56","43520 → 9002 [ACK] Seq=15118 Ack=247377 Win=12688 Len=0"
"5.241857","5.9.29.183","172.19.0.3","TLSv1.2","1504","Application Data [TCP segment of a reassembled PDU]"
"5.241962","5.9.29.183","172.19.0.3","TCP","1516","9002 → 43520 [PSH, ACK] Seq=248825 Ack=15118 Win=65535 Len=1460 [TCP segment of a reassembled PDU]"
"5.241967","5.9.29.183","172.19.0.3","TCP","1492","9002 → 43520 [PSH, ACK] Seq=250285 Ack=15118 Win=65535 Len=1436 [TCP segment of a reassembled PDU]"
"5.242028","172.19.0.3","5.9.29.183","TCP","56","43520 → 9002 [ACK] Seq=15118 Ack=251721 Win=12663 Len=0"
"5.243693","5.9.29.183","172.19.0.3","TLSv1.2","1516","Application Data, Application Data"
"5.243723","5.9.29.183","172.19.0.3","TCP","1516","9002 → 43520 [PSH, ACK] Seq=253181 Ack=15118 Win=65535 Len=1460 [TCP segment of a reassembled PDU]"
"5.243731","172.19.0.3","5.9.29.183","TCP","56","43520 → 9002 [ACK] Seq=15118 Ack=254641 Win=12730 Len=0"
"5.243733","5.9.29.183","172.19.0.3","TCP","1480","9002 → 43520 [PSH, ACK] Seq=254641 Ack=15118 Win=65535 Len=1424 [TCP segment of a reassembled PDU]"
"5.244166","5.9.29.183","172.19.0.3","TLSv1.2","1516","Application Data [TCP segment of a reassembled PDU]"
"5.244173","172.19.0.3","5.9.29.183","TCP","56","43520 → 9002 [ACK] Seq=15118 Ack=257525 Win=12738 Len=0"
"5.244199","5.9.29.183","172.19.0.3","TCP","1492","9002 → 43520 [PSH, ACK] Seq=257525 Ack=15118 Win=65535 Len=1436 [TCP segment of a reassembled PDU]"
"5.251354","5.9.29.183","172.19.0.3","TLSv1.2","735","Application Data"
"5.251372","172.19.0.3","5.9.29.183","TCP","56","43520 → 9002 [ACK] Seq=15118 Ack=259640 Win=12738 Len=0"
"5.251695","172.19.0.3","5.9.29.183","TLSv1.2","599","Application Data"
"5.251857","5.9.29.183","172.19.0.3","TCP","56","9002 → 43520 [ACK] Seq=259640 Ack=15661 Win=65535 Len=0"
"5.253125","5.9.29.183","172.19.0.3","TCP","1516","[TCP segment of a reassembled PDU]"
"5.253157","5.9.29.183","172.19.0.3","TCP","1516","9002 → 43520 [PSH, ACK] Seq=261100 Ack=15661 Win=65535 Len=1460 [TCP segment of a reassembled PDU]"
"5.253162","5.9.29.183","172.19.0.3","TLSv1.2","1516","Application Data [TCP segment of a reassembled PDU]"
"5.253164","5.9.29.183","172.19.0.3","TCP","1468","9002 → 43520 [PSH, ACK] Seq=264020 Ack=15661 Win=65535 Len=1412 [TCP segment of a reassembled PDU]"
"5.253175","5.9.29.183","172.19.0.3","TCP","1516","9002 → 43520 [PSH, ACK] Seq=265432 Ack=15661 Win=65535 Len=1460 [TCP segment of a reassembled PDU]"
"5.253213","5.9.29.183","172.19.0.3","TLSv1.2","1492","Application Data [TCP segment of a reassembled PDU]"
"5.253217","172.19.0.3","5.9.29.183","TCP","56","43520 → 9002 [ACK] Seq=15661 Ack=266892 Win=12706 Len=0"
"5.253657","5.9.29.183","172.19.0.3","TCP","650","9002 → 43520 [PSH, ACK] Seq=268328 Ack=15661 Win=65535 Len=594 [TCP segment of a reassembled PDU]"
"5.253665","172.19.0.3","5.9.29.183","TCP","56","43520 → 9002 [ACK] Seq=15661 Ack=268922 Win=12738 Len=0"
"5.253761","5.9.29.183","172.19.0.3","TCP","1516","9002 → 43520 [PSH, ACK] Seq=268922 Ack=15661 Win=65535 Len=1460 [TCP segment of a reassembled PDU]"
"5.253766","5.9.29.183","172.19.0.3","TCP","898","9002 → 43520 [PSH, ACK] Seq=270382 Ack=15661 Win=65535 Len=842 [TCP segment of a reassembled PDU]"
"5.253820","172.19.0.3","5.9.29.183","TCP","56","43520 → 9002 [ACK] Seq=15661 Ack=271224 Win=12738 Len=0"
"5.266856","5.9.29.183","172.19.0.3","TLSv1.2","1504","Application Data, Application Data"
"5.267217","172.19.0.3","5.9.29.183","TLSv1.2","599","Application Data"
"5.267312","5.9.29.183","172.19.0.3","TCP","1504","9002 → 43520 [PSH, ACK] Seq=272672 Ack=15661 Win=65535 Len=1448 [TCP segment of a reassembled PDU]"
"5.267355","5.9.29.183","172.19.0.3","TCP","1516","9002 → 43520 [PSH, ACK] Seq=274120 Ack=15661 Win=65535 Len=1460 [TCP segment of a reassembled PDU]"
"5.267375","172.19.0.3","5.9.29.183","TCP","56","43520 → 9002 [ACK] Seq=16204 Ack=275580 Win=12722 Len=0"
"5.267406","5.9.29.183","172.19.0.3","TLSv1.2","1516","Application Data [TCP segment of a reassembled PDU]"
"5.267410","5.9.29.183","172.19.0.3","TCP","1480","9002 → 43520 [PSH, ACK] Seq=277040 Ack=15661 Win=65535 Len=1424 [TCP segment of a reassembled PDU]"
"5.267415","172.19.0.3","5.9.29.183","TCP","56","43520 → 9002 [ACK] Seq=16204 Ack=278464 Win=12730 Len=0"
"5.267506","5.9.29.183","172.19.0.3","TCP","56","9002 → 43520 [ACK] Seq=278464 Ack=16204 Win=65535 Len=0"
"5.267563","5.9.29.183","172.19.0.3","TCP","1516","9002 → 43520 [PSH, ACK] Seq=278464 Ack=16204 Win=65535 Len=1460 [TCP segment of a reassembled PDU]"
"5.267612","5.9.29.183","172.19.0.3","TLSv1.2","1492","Application Data [TCP segment of a reassembled PDU]"
"5.267622","172.19.0.3","5.9.29.183","TCP","56","43520 → 9002 [ACK] Seq=16204 Ack=281360 Win=12730 Len=0"
"5.267719","5.9.29.183","172.19.0.3","TCP","1516","9002 → 43520 [PSH, ACK] Seq=281360 Ack=16204 Win=65535 Len=1460 [TCP segment of a reassembled PDU]"
"5.267759","5.9.29.183","172.19.0.3","TLSv1.2","723","Application Data"
"5.267927","172.19.0.3","5.9.29.183","TCP","56","43520 → 9002 [ACK] Seq=16204 Ack=283487 Win=12714 Len=0"
"5.280468","5.9.29.183","172.19.0.3","TCP","1504","[TCP segment of a reassembled PDU]"
"5.280781","5.9.29.183","172.19.0.3","TCP","1504","9002 → 43520 [PSH, ACK] Seq=284935 Ack=16204 Win=65535 Len=1448 [TCP segment of a reassembled PDU]"
"5.280790","172.19.0.3","5.9.29.183","TCP","56","43520 → 9002 [ACK] Seq=16204 Ack=286383 Win=12738 Len=0"
"5.280875","5.9.29.183","172.19.0.3","TLSv1.2","1504","Application Data [TCP segment of a reassembled PDU]"
"5.281076","172.19.0.3","5.9.29.183","TLSv1.2","599","Application Data"
"5.281234","5.9.29.183","172.19.0.3","TCP","56","9002 → 43520 [ACK] Seq=287831 Ack=16747 Win=65535 Len=0"
"5.285412","5.9.29.183","172.19.0.3","TLSv1.2","396","Application Data"
"5.317999","5.9.29.183","172.19.0.3","TCP","1516","[TCP segment of a reassembled PDU]"
