_ws.col.Time,_ws.col.Source,_ws.col.Destination,_ws.col.Protocol,_ws.col.Length,_ws.col.Info
"0.000000","172.19.0.3","5.9.29.183","TLSv1.2","599","Application Data"
"0.000267","5.9.29.183","172.19.0.3","TCP","56","9002 → 43520 [ACK] Seq=1 Ack=544 Win=65535 Len=0"
"1.112262","5.9.29.183","172.19.0.3","TLSv1.2","599","Application Data"
"1.112353","172.19.0.3","5.9.29.183","TCP","56","43520 → 9002 [ACK] Seq=544 Ack=544 Win=11911 Len=0"
"1.113214","172.19.0.3","5.9.29.183","TLSv1.2","2141","Application Data"
"1.113529","5.9.29.183","172.19.0.3","TCP","56","9002 → 43520 [ACK] Seq=544 Ack=2004 Win=65535 Len=0"
"1.113590","5.9.29.183","172.19.0.3","TCP","56","9002 → 43520 [ACK] Seq=544 Ack=2629 Win=65535 Len=0"
"2.194961","5.9.29.183","172.19.0.3","TLSv1.2","599","Application Data"
"2.245789","172.19.0.3","5.9.29.183","TCP","56","43520 → 9002 [ACK] Seq=2629 Ack=1087 Win=11911 Len=0"
"2.502096","5.9.29.183","172.19.0.3","TLSv1.2","1113","Application Data"
"2.502122","172.19.0.3","5.9.29.183","TCP","56","43520 → 9002 [ACK] Seq=2629 Ack=2144 Win=11911 Len=0"
"2.505755","172.19.0.3","5.9.29.183","TLSv1.2","599","Application Data"
"2.506058","5.9.29.183","172.19.0.3","TCP","56","9002 → 43520 [ACK] Seq=2144 Ack=3172 Win=65535 Len=0"
"2.887647","185.21.216.198","172.19.0.3","TLSv1.2","599","Application Data"
"2.887672","172.19.0.3","185.21.216.198","TCP","56","37034 → 41389 [ACK] Seq=1 Ack=544 Win=1452 Len=0"
"3.424505","5.9.29.183","172.19.0.3","TLSv1.2","599","Application Data"
"3.425301","172.19.0.3","5.9.29.183","TLSv1.2","599","Application Data"
"3.425592","5.9.29.183","172.19.0.3","TCP","56","9002 → 43520 [ACK] Seq=2687 Ack=3715 Win=65535 Len=0"
"4.470470","5.9.29.183","172.19.0.3","TLSv1.2","599","Application Data"
"4.503826","5.9.29.183","172.19.0.3","TCP","1504","[TCP segment of a reassembled PDU]"
"4.503847","172.19.0.3","5.9.29.183","TCP","56","43520 → 9002 [ACK] Seq=3715 Ack=4678 Win=11911 Len=0"
"4.503900","5.9.29.183","172.19.0.3","TCP","1516","9002 → 43520 [PSH, ACK] Seq=4678 Ack=3715 Win=65535 Len=1460 [TCP segment of a reassembled PDU]"
"4.503914","5.9.29.183","172.19.0.3","TLSv1.2","775","Application Data"
"4.504058","172.19.0.3","5.9.29.183","TCP","56","43520 → 9002 [ACK] Seq=3715 Ack=6857 Win=11895 Len=0"
"4.518761","5.9.29.183","172.19.0.3","TCP","1516","[TCP segment of a reassembled PDU]"
"4.518935","5.9.29.183","172.19.0.3","TCP","1171","9002 → 43520 [PSH, ACK] Seq=8317 Ack=3715 Win=65535 Len=1115 [TCP segment of a reassembled PDU]"
"4.518964","172.19.0.3","5.9.29.183","TCP","56","43520 → 9002 [ACK] Seq=3715 Ack=9432 Win=11903 Len=0"
"4.519048","5.9.29.183","172.19.0.3","TCP","377","9002 → 43520 [PSH, ACK] Seq=9432 Ack=3715 Win=65535 Len=321 [TCP segment of a reassembled PDU]"
"4.519250","5.9.29.183","172.19.0.3","TLSv1.2","787","Application Data"
"4.519380","172.19.0.3","5.9.29.183","TCP","56","43520 → 9002 [ACK] Seq=3715 Ack=10484 Win=11911 Len=0"
"4.546525","5.9.29.183","172.19.0.3","TCP","1516","[TCP segment of a reassembled PDU]"
"4.546594","5.9.29.183","172.19.0.3","TCP","1492","9002 → 43520 [PSH, ACK] Seq=11944 Ack=3715 Win=65535 Len=1436 [TCP segment of a reassembled PDU]"
"4.546604","5.9.29.183","172.19.0.3","TLSv1.2","787","Application Data"
"4.546783","172.19.0.3","5.9.29.183","TCP","56","43520 → 9002 [ACK] Seq=3715 Ack=14111 Win=11895 Len=0"
"4.562410","5.9.29.183","172.19.0.3","TLSv1.2","599","Application Data"
"4.606369","172.19.0.3","5.9.29.183","TCP","56","43520 → 9002 [ACK] Seq=3715 Ack=14654 Win=11911 Len=0"
"4.629587","5.9.29.183","172.19.0.3","TLSv1.2","599","Application Data"
"4.629646","172.19.0.3","5.9.29.183","TCP","56","43520 → 9002 [ACK] Seq=3715 Ack=15197 Win=11911 Len=0"
"4.655004","5.9.29.183","172.19.0.3","TCP","1516","[TCP segment of a reassembled PDU]"
"4.655028","172.19.0.3","5.9.29.183","TCP","56","43520 → 9002 [ACK] Seq=3715 Ack=16657 Win=11911 Len=0"
"4.655093","5.9.29.183","172.19.0.3","TCP","1492","9002 → 43520 [PSH, ACK] Seq=16657 Ack=3715 Win=65535 Len=1436 [TCP segment of a reassembled PDU]"
"4.655110","172.19.0.3","5.9.29.183","TCP","56","43520 → 9002 [ACK] Seq=3715 Ack=18093 Win=11903 Len=0"
"4.655111","5.9.29.183","172.19.0.3","TLSv1.2","787","Application Data"
"4.655117","172.19.0.3","5.9.29.183","TCP","56","43520 → 9002 [ACK] Seq=3715 Ack=18824 Win=11898 Len=0"
"4.961729","5.9.29.183","172.19.0.3","TCP","1516","[TCP segment of a reassembled PDU]"
"4.961753","172.19.0.3","5.9.29.183","TCP","56","43520 → 9002 [ACK] Seq=3715 Ack=20284 Win=11909 Len=0"
"4.961801","5.9.29.183","172.19.0.3","TCP","1492","9002 → 43520 [PSH, ACK] Seq=20284 Ack=3715 Win=65535 Len=1436 [TCP segment of a reassembled PDU]"
"4.961817","172.19.0.3","5.9.29.183","TCP","56","43520 → 9002 [ACK] Seq=3715 Ack=21720 Win=11901 Len=0"
"4.961819","5.9.29.183","172.19.0.3","TLSv1.2","273","Application Data"
"4.961825","172.19.0.3","5.9.29.183","TCP","56","43520 → 9002 [ACK] Seq=3715 Ack=21937 Win=11900 Len=0"
"4.962270","172.19.0.3","5.9.29.183","TLSv1.2","599","Application Data"
"4.962533","5.9.29.183","172.19.0.3","TCP","56","9002 → 43520 [ACK] Seq=21937 Ack=4258 Win=65535 Len=0"
"4.971603","172.19.0.3","5.9.29.183","TLSv1.2","599","Application Data"
"4.972095","5.9.29.183","172.19.0.3","TCP","56","9002 → 43520 [ACK] Seq=21937 Ack=4801 Win=65535 Len=0"
"5.393095","172.19.0.3","185.21.216.198","TLSv1.2","599","Application Data"
"5.393714","185.21.216.198","172.19.0.3","TCP","56","41389 → 37034 [ACK] Seq=544 Ack=544 Win=65535 Len=0"
"5.884030","5.9.29.183","172.19.0.3","TLSv1.2","599","Application Data"
"5.884759","172.19.0.3","5.9.29.183","TLSv1.2","599","Application Data"
"5.885121","5.9.29.183","172.19.0.3","TCP","56","9002 → 43520 [ACK] Seq=22480 Ack=5344 Win=65535 Len=0"
"6.967361","5.9.29.183","172.19.0.3","TLSv1.2","599","Application Data"
"6.967663","5.9.29.183","172.19.0.3","TCP","1516","[TCP segment of a reassembled PDU]"
"6.967678","172.19.0.3","5.9.29.183","TCP","56","43520 → 9002 [ACK] Seq=5344 Ack=24483 Win=11911 Len=0"
"6.967680","5.9.29.183","172.19.0.3","TCP","1516","9002 → 43520 [PSH, ACK] Seq=24483 Ack=5344 Win=65535 Len=1460 [TCP segment of a reassembled PDU]"
"6.967687","5.9.29.183","172.19.0.3","TLSv1.2","1516","Application Data [TCP segment of a reassembled PDU]"
"6.967793","5.9.29.183","172.19.0.3","TCP","1516","9002 → 43520 [PSH, ACK] Seq=27403 Ack=5344 Win=65535 Len=1460 [TCP segment of a reassembled PDU]"
"6.967797","5.9.29.183","172.19.0.3","TCP","1456","9002 → 43520 [PSH, ACK] Seq=28863 Ack=5344 Win=65535 Len=1400 [TCP segment of a reassembled PDU]"
"6.967803","172.19.0.3","5.9.29.183","TCP","56","43520 → 9002 [ACK] Seq=5344 Ack=27403 Win=11895 Len=0"
"6.967896","172.19.0.3","5.9.29.183","TCP","56","43520 → 9002 [ACK] Seq=5344 Ack=30263 Win=11879 Len=0"
"6.982765","5.9.29.183","172.19.0.3","TLSv1.2","70","Application Data"
"7.031536","172.19.0.3","5.9.29.183","TCP","56","43520 → 9002 [ACK] Seq=5344 Ack=30277 Win=11911 Len=0"
"7.097584","5.9.29.183","172.19.0.3","TCP","1504","[TCP segment of a reassembled PDU]"
"7.097648","172.19.0.3","5.9.29.183","TCP","56","43520 → 9002 [ACK] Seq=5344 Ack=31725 Win=11911 Len=0"
"7.097821","5.9.29.183","172.19.0.3","TCP","1516","9002 → 43520 [PSH, ACK] Seq=31725 Ack=5344 Win=65535 Len=1460 [TCP segment of a reassembled PDU]"
"7.097837","172.19.0.3","5.9.29.183","TCP","56","43520 → 9002 [ACK] Seq=5344 Ack=33185 Win=11903 Len=0"
"7.097839","5.9.29.183","172.19.0.3","TLSv1.2","775","Application Data"
"7.097846","172.19.0.3","5.9.29.183","TCP","56","43520 → 9002 [ACK] Seq=5344 Ack=33904 Win=11898 Len=0"
"7.112792","5.9.29.183","172.19.0.3","TCP","1516","[TCP segment of a reassembled PDU]"
"7.112823","172.19.0.3","5.9.29.183","TCP","56","43520 → 9002 [ACK] Seq=5344 Ack=35364 Win=11911 Len=0"
"7.112885","5.9.29.183","172.19.0.3","TCP","1492","9002 → 43520 [PSH, ACK] Seq=35364 Ack=5344 Win=65535 Len=1436 [TCP segment of a reassembled PDU]"
"7.112899","172.19.0.3","5.9.29.183","TCP","56","43520 → 9002 [ACK] Seq=5344 Ack=36800 Win=11903 Len=0"
"7.113015","5.9.29.183","172.19.0.3","TLSv1.2","787","Application Data"
"7.113023","172.19.0.3","5.9.29.183","TCP","56","43520 → 9002 [ACK] Seq=5344 Ack=37531 Win=11898 Len=0"
"7.128402","5.9.29.183","172.19.0.3","TLSv1.2","599","Application Data"
"7.128423","172.19.0.3","5.9.29.183","TCP","56","43520 → 9002 [ACK] Seq=5344 Ack=38074 Win=11911 Len=0"
"7.159136","5.9.29.183","172.19.0.3","TCP","1516","[TCP segment of a reassembled PDU]"
"7.159162","172.19.0.3","5.9.29.183","TCP","56","43520 → 9002 [ACK] Seq=5344 Ack=39534 Win=11911 Len=0"
"7.159218","5.9.29.183","172.19.0.3","TCP","1516","9002 → 43520 [PSH, ACK] Seq=39534 Ack=5344 Win=65535 Len=1460 [TCP segment of a reassembled PDU]"
"7.159231","172.19.0.3","5.9.29.183","TCP","56","43520 → 9002 [ACK] Seq=5344 Ack=40994 Win=11903 Len=0"
"7.159234","5.9.29.183","172.19.0.3","TLSv1.2","763","Application Data"
"7.159240","172.19.0.3","5.9.29.183","TCP","56","43520 → 9002 [ACK] Seq=5344 Ack=41701 Win=11898 Len=0"
"7.174435","5.9.29.183","172.19.0.3","TCP","1516","[TCP segment of a reassembled PDU]"
"7.174462","172.19.0.3","5.9.29.183","TCP","56","43520 → 9002 [ACK] Seq=5344 Ack=43161 Win=11909 Len=0"
"7.174587","5.9.29.183","172.19.0.3","TCP","1492","9002 → 43520 [PSH, ACK] Seq=43161 Ack=5344 Win=65535 Len=1436 [TCP segment of a reassembled PDU]"
"7.174597","172.19.0.3","5.9.29.183","TCP","56","43520 → 9002 [ACK] Seq=5344 Ack=44597 Win=11901 Len=0"
"7.174599","5.9.29.183","172.19.0.3","TLSv1.2","1330","Application Data, Application Data"
"7.174962","172.19.0.3","5.9.29.183","TCP","56","43520 → 9002 [ACK] Seq=5344 Ack=45871 Win=11911 Len=0"
"7.189564","5.9.29.183","172.19.0.3","TCP","1516","[TCP segment of a reassembled PDU]"
"7.189631","5.9.29.183","172.19.0.3","TCP","1492","9002 → 43520 [PSH, ACK] Seq=47331 Ack=5344 Win=65535 Len=1436 [TCP segment of a reassembled PDU]"
"7.189641","5.9.29.183","172.19.0.3","TLSv1.2","1330","Application Data, Application Data"
"7.189781","172.19.0.3","5.9.29.183","TCP","56","43520 → 9002 [ACK] Seq=5344 Ack=50041 Win=11895 Len=0"
"7.190064","172.19.0.3","5.9.29.183","TLSv1.2","599","Application Data"
"7.190328","5.9.29.183","172.19.0.3","TCP","56","9002 → 43520 [ACK] Seq=50041 Ack=5887 Win=65535 Len=0"
"7.202446","5.9.29.183","172.19.0.3","TCP","1516","[TCP segment of a reassembled PDU]"
"7.202527","5.9.29.183","172.19.0.3","TCP","1492","9002 → 43520 [PSH, ACK] Seq=51501 Ack=5887 Win=65535 Len=1436 [TCP segment of a reassembled PDU]"
"7.202552","172.19.0.3","5.9.29.183","TCP","56","43520 → 9002 [ACK] Seq=5887 Ack=52937 Win=11903 Len=0"
"7.204972","5.9.29.183","172.19.0.3","TLSv1.2","1330","Application Data, Application Data"
"7.225740","5.9.29.183","172.19.0.3","TCP","1504","[TCP segment of a reassembled PDU]"
"7.225765","172.19.0.3","5.9.29.183","TCP","56","43520 → 9002 [ACK] Seq=5887 Ack=55659 Win=11911 Len=0"
"7.225816","5.9.29.183","172.19.0.3","TCP","1516","9002 → 43520 [PSH, ACK] Seq=55659 Ack=5887 Win=65535 Len=1460 [TCP segment of a reassembled PDU]"
"7.225827","5.9.29.183","172.19.0.3","TLSv1.2","775","Application Data"
"7.225976","172.19.0.3","5.9.29.183","TCP","56","43520 → 9002 [ACK] Seq=5887 Ack=57838 Win=11895 Len=0"
"7.372009","5.9.29.183","172.19.0.3","TCP","1516","[TCP segment of a reassembled PDU]"
"7.372083","5.9.29.183","172.19.0.3","TCP","1516","9002 → 43520 [PSH, ACK] Seq=59298 Ack=5887 Win=65535 Len=1460 [TCP segment of a reassembled PDU]"
"7.372109","172.19.0.3","5.9.29.183","TCP","56","43520 → 9002 [ACK] Seq=5887 Ack=60758 Win=11903 Len=0"
"7.372111","5.9.29.183","172.19.0.3","TLSv1.2","763","Application Data"
"7.405799","5.9.29.183","172.19.0.3","TCP","1516","[TCP segment of a reassembled PDU]"
"7.405874","172.19.0.3","5.9.29.183","TCP","56","43520 → 9002 [ACK] Seq=5887 Ack=62925 Win=11911 Len=0"
"7.405877","5.9.29.183","172.19.0.3","TCP","1516","9002 → 43520 [PSH, ACK] Seq=62925 Ack=5887 Win=65535 Len=1460 [TCP segment of a reassembled PDU]"
"7.405919","5.9.29.183","172.19.0.3","TLSv1.2","763","Application Data"
"7.406026","172.19.0.3","5.9.29.183","TCP","56","43520 → 9002 [ACK] Seq=5887 Ack=65092 Win=11895 Len=0"
"7.417105","5.9.29.183","172.19.0.3","TCP","1516","[TCP segment of a reassembled PDU]"
"7.417178","5.9.29.183","172.19.0.3","TCP","1516","9002 → 43520 [PSH, ACK] Seq=66552 Ack=5887 Win=65535 Len=1460 [TCP segment of a reassembled PDU]"
"7.417197","172.19.0.3","5.9.29.183","TCP","56","43520 → 9002 [ACK] Seq=5887 Ack=68012 Win=11903 Len=0"
"7.417200","5.9.29.183","172.19.0.3","TLSv1.2","1480","Application Data [TCP segment of a reassembled PDU]"
"7.421575","5.9.29.183","172.19.0.3","TLSv1.2","396","Application Data"
"7.421618","172.19.0.3","5.9.29.183","TCP","56","43520 → 9002 [ACK] Seq=5887 Ack=69776 Win=11911 Len=0"
"7.455105","5.9.29.183","172.19.0.3","TCP","1516","[TCP segment of a reassembled PDU]"
"7.455165","5.9.29.183","172.19.0.3","TCP","1516","9002 → 43520 [PSH, ACK] Seq=71236 Ack=5887 Win=65535 Len=1460 [TCP segment of a reassembled PDU]"
"7.455175","5.9.29.183","172.19.0.3","TLSv1.2","763","Application Data"
"7.455307","172.19.0.3","5.9.29.183","TCP","56","43520 → 9002 [ACK] Seq=5887 Ack=73403 Win=11895 Len=0"
"7.465631","5.9.29.183","172.19.0.3","TCP","1516","[TCP segment of a reassembled PDU]"
"7.465711","5.9.29.183","172.19.0.3","TCP","161","9002 → 43520 [PSH, ACK] Seq=74863 Ack=5887 Win=65535 Len=105 [TCP segment of a reassembled PDU]"
"7.465736","172.19.0.3","5.9.29.183","TCP","56","43520 → 9002 [ACK] Seq=5887 Ack=74968 Win=11903 Len=0"
"7.466110","5.9.29.183","172.19.0.3","TCP","1516","9002 → 43520 [PSH, ACK] Seq=74968 Ack=5887 Win=65535 Len=1460 [TCP segment of a reassembled PDU]"
"7.466162","5.9.29.183","172.19.0.3","TLSv1.2","1375","Application Data [TCP segment of a reassembled PDU]"
"7.466175","172.19.0.3","5.9.29.183","TCP","56","43520 → 9002 [ACK] Seq=5887 Ack=77747 Win=11903 Len=0"
"7.466462","172.19.0.3","5.9.29.183","TLSv1.2","1113","Application Data"
"7.466782","5.9.29.183","172.19.0.3","TCP","56","9002 → 43520 [ACK] Seq=77747 Ack=6944 Win=65535 Len=0"
"7.470984","5.9.29.183","172.19.0.3","TLSv1.2","396","Application Data"
"7.503637","5.9.29.183","172.19.0.3","TCP","1516","[TCP segment of a reassembled PDU]"
"7.503660","172.19.0.3","5.9.29.183","TCP","56","43520 → 9002 [ACK] Seq=6944 Ack=79547 Win=11911 Len=0"
"7.503708","5.9.29.183","172.19.0.3","TLSv1.2","1195","Application Data"
"7.511924","172.19.0.3","5.9.29.183","TLSv1.2","599","Application Data"
"7.512266","5.9.29.183","172.19.0.3","TCP","56","9002 → 43520 [ACK] Seq=80686 Ack=7487 Win=65535 Len=0"
"8.603412","5.9.29.183","172.19.0.3","TLSv1.2","599","Application Data"
"8.604067","172.19.0.3","5.9.29.183","TLSv1.2","599","Application Data"
"8.604328","5.9.29.183","172.19.0.3","TCP","56","9002 → 43520 [ACK] Seq=81229 Ack=8030 Win=65535 Len=0"
"9.640617","5.9.29.183","172.19.0.3","TCP","1516","[TCP segment of a reassembled PDU]"
"9.640703","5.9.29.183","172.19.0.3","TCP","1516","9002 → 43520 [PSH, ACK] Seq=82689 Ack=8030 Win=65535 Len=1460 [TCP segment of a reassembled PDU]"
"9.640713","5.9.29.183","172.19.0.3","TLSv1.2","763","Application Data"
"9.640741","5.9.29.183","172.19.0.3","TCP","1516","[TCP segment of a reassembled PDU]"
"9.640745","5.9.29.183","172.19.0.3","TCP","1492","9002 → 43520 [PSH, ACK] Seq=86316 Ack=8030 Win=65535 Len=1436 [TCP segment of a reassembled PDU]"
"9.640824","172.19.0.3","5.9.29.183","TCP","56","43520 → 9002 [ACK] Seq=8030 Ack=87752 Win=11879 Len=0"
"9.656645","5.9.29.183","172.19.0.3","TLSv1.2","787","Application Data"
"9.689767","5.9.29.183","172.19.0.3","TLSv1.2","599","Application Data"
"9.689789","172.19.0.3","5.9.29.183","TCP","56","43520 → 9002 [ACK] Seq=8030 Ack=89026 Win=11911 Len=0"
"9.879220","5.9.29.183","172.19.0.3","TCP","1516","[TCP segment of a reassembled PDU]"
"9.879272","5.9.29.183","172.19.0.3","TCP","1492","9002 → 43520 [PSH, ACK] Seq=90486 Ack=8030 Win=65535 Len=1436 [TCP segment of a reassembled PDU]"
"9.879282","5.9.29.183","172.19.0.3","TLSv1.2","787","Application Data"
"9.879406","172.19.0.3","5.9.29.183","TCP","56","43520 → 9002 [ACK] Seq=8030 Ack=92653 Win=11893 Len=0"
"9.891364","5.9.29.183","172.19.0.3","TCP","1516","[TCP segment of a reassembled PDU]"
"9.891419","5.9.29.183","172.19.0.3","TCP","1492","9002 → 43520 [PSH, ACK] Seq=94113 Ack=8030 Win=65535 Len=1436 [TCP segment of a reassembled PDU]"
"9.891434","172.19.0.3","5.9.29.183","TCP","56","43520 → 9002 [ACK] Seq=8030 Ack=95549 Win=11903 Len=0"
"9.894438","5.9.29.183","172.19.0.3","TLSv1.2","1330","Application Data, Application Data"
"9.916523","5.9.29.183","172.19.0.3","TCP","1516","[TCP segment of a reassembled PDU]"
"9.916548","172.19.0.3","5.9.29.183","TCP","56","43520 → 9002 [ACK] Seq=8030 Ack=98283 Win=11911 Len=0"
"9.916608","5.9.29.183","172.19.0.3","TCP","1516","9002 → 43520 [PSH, ACK] Seq=98283 Ack=8030 Win=65535 Len=1460 [TCP segment of a reassembled PDU]"
"9.916659","5.9.29.183","172.19.0.3","TLSv1.2","763","Application Data"
"9.916831","172.19.0.3","5.9.29.183","TCP","56","43520 → 9002 [ACK] Seq=8030 Ack=100450 Win=11895 Len=0"
"9.929072","5.9.29.183","172.19.0.3","TCP","1504","[TCP segment of a reassembled PDU]"
"9.931544","5.9.29.183","172.19.0.3","TLSv1.2","179","Application Data"
"9.931563","172.19.0.3","5.9.29.183","TCP","56","43520 → 9002 [ACK] Seq=8030 Ack=102021 Win=11911 Len=0"
"9.956334","5.9.29.183","172.19.0.3","TCP","1516","[TCP segment of a reassembled PDU]"
"9.956400","5.9.29.183","172.19.0.3","TCP","1516","9002 → 43520 [PSH, ACK] Seq=103481 Ack=8030 Win=65535 Len=1460 [TCP segment of a reassembled PDU]"
"9.956409","5.9.29.183","172.19.0.3","TLSv1.2","763","Application Data"
"9.956590","172.19.0.3","5.9.29.183","TCP","56","43520 → 9002 [ACK] Seq=8030 Ack=105648 Win=11895 Len=0"
"9.967954","5.9.29.183","172.19.0.3","TCP","1516","[TCP segment of a reassembled PDU]"
"9.968016","5.9.29.183","172.19.0.3","TCP","1516","9002 → 43520 [PSH, ACK] Seq=107108 Ack=8030 Win=65535 Len=1460 [TCP segment of a reassembled PDU]"
"9.968033","172.19.0.3","5.9.29.183","TCP","56","43520 → 9002 [ACK] Seq=8030 Ack=108568 Win=11903 Len=0"
"9.968036","5.9.29.183","172.19.0.3","TLSv1.2","1516","Application Data [TCP segment of a reassembled PDU]"
"9.968040","5.9.29.183","172.19.0.3","TCP","1516","9002 → 43520 [PSH, ACK] Seq=110028 Ack=8030 Win=65535 Len=1460 [TCP segment of a reassembled PDU]"
"9.968046","5.9.29.183","172.19.0.3","TCP","1456","9002 → 43520 [PSH, ACK] Seq=111488 Ack=8030 Win=65535 Len=1400 [TCP segment of a reassembled PDU]"
"9.968178","172.19.0.3","5.9.29.183","TCP","56","43520 → 9002 [ACK] Seq=8030 Ack=112888 Win=11879 Len=0"
"9.968620","172.19.0.3","5.9.29.183","TLSv1.2","599","Application Data"
"9.968986","5.9.29.183","172.19.0.3","TCP","56","9002 → 43520 [ACK] Seq=112888 Ack=8573 Win=65535 Len=0"
"9.971578","5.9.29.183","172.19.0.3","TLSv1.2","584","Application Data"
"9.994541","5.9.29.183","172.19.0.3","TLSv1.2","599","Application Data"
"9.994904","172.19.0.3","5.9.29.183","TCP","56","43520 → 9002 [ACK] Seq=8573 Ack=113959 Win=11911 Len=0"
"10.149968","5.9.29.183","172.19.0.3","TCP","1516","[TCP segment of a reassembled PDU]"
"10.150045","5.9.29.183","172.19.0.3","TCP","1516","9002 → 43520 [PSH, ACK] Seq=115419 Ack=8573 Win=65535 Len=1460 [TCP segment of a reassembled PDU]"
"10.150059","5.9.29.183","172.19.0.3","TLSv1.2","763","Application Data"
"10.150241","172.19.0.3","5.9.29.183","TCP","56","43520 → 9002 [ACK] Seq=8573 Ack=117586 Win=11895 Len=0"
"10.164607","5.9.29.183","172.19.0.3","TCP","1516","[TCP segment of a reassembled PDU]"
"10.164682","5.9.29.183","172.19.0.3","TCP","1492","9002 → 43520 [PSH, ACK] Seq=119046 Ack=8573 Win=65535 Len=1436 [TCP segment of a reassembled PDU]"
"10.164704","172.19.0.3","5.9.29.183","TCP","56","43520 → 9002 [ACK] Seq=8573 Ack=120482 Win=11903 Len=0"
"10.165634","5.9.29.183","172.19.0.3","TLSv1.2","787","Application Data"
"10.201044","5.9.29.183","172.19.0.3","TCP","1516","[TCP segment of a reassembled PDU]"
"10.201163","172.19.0.3","5.9.29.183","TCP","56","43520 → 9002 [ACK] Seq=8573 Ack=122673 Win=11911 Len=0"
"10.201168","5.9.29.183","172.19.0.3","TCP","1492","9002 → 43520 [PSH, ACK] Seq=122673 Ack=8573 Win=65535 Len=1436 [TCP segment of a reassembled PDU]"
"10.201270","5.9.29.183","172.19.0.3","TLSv1.2","1516","Application Data [TCP segment of a reassembled PDU]"
"10.201280","172.19.0.3","5.9.29.183","TCP","56","43520 → 9002 [ACK] Seq=8573 Ack=125569 Win=11911 Len=0"
"10.201282","5.9.29.183","172.19.0.3","TCP","1516","9002 → 43520 [PSH, ACK] Seq=125569 Ack=8573 Win=65535 Len=1460 [TCP segment of a reassembled PDU]"
"10.201286","5.9.29.183","172.19.0.3","TCP","1213","9002 → 43520 [PSH, ACK] Seq=127029 Ack=8573 Win=65535 Len=1157 [TCP segment of a reassembled PDU]"
"10.201311","172.19.0.3","5.9.29.183","TCP","56","43520 → 9002 [ACK] Seq=8573 Ack=128186 Win=11895 Len=0"
"10.216856","5.9.29.183","172.19.0.3","TLSv1.2","1394","Application Data, Application Data"
"10.217266","172.19.0.3","5.9.29.183","TLSv1.2","599","Application Data"
"10.217593","5.9.29.183","172.19.0.3","TCP","56","9002 → 43520 [ACK] Seq=129524 Ack=9116 Win=65535 Len=0"
"10.217897","5.9.29.183","172.19.0.3","TCP","1504","[TCP segment of a reassembled PDU]"
"10.218025","5.9.29.183","172.19.0.3","TCP","1504","9002 → 43520 [PSH, ACK] Seq=130972 Ack=9116 Win=65535 Len=1448 [TCP segment of a reassembled PDU]"
"10.218045","172.19.0.3","5.9.29.183","TCP","56","43520 → 9002 [ACK] Seq=9116 Ack=132420 Win=11911 Len=0"
"10.232192","5.9.29.183","172.19.0.3","TLSv1.2","1330","Application Data, Application Data"
"10.232699","172.19.0.3","5.9.29.183","TLSv1.2","599","Application Data"
"10.233128","5.9.29.183","172.19.0.3","TCP","56","9002 → 43520 [ACK] Seq=133694 Ack=9659 Win=65535 Len=0"
"10.256435","5.9.29.183","172.19.0.3","TCP","1516","[TCP segment of a reassembled PDU]"
"10.256506","5.9.29.183","172.19.0.3","TCP","1492","9002 → 43520 [PSH, ACK] Seq=135154 Ack=9659 Win=65535 Len=1436 [TCP segment of a reassembled PDU]"
"10.256515","5.9.29.183","172.19.0.3","TLSv1.2","787","Application Data"
"10.256668","172.19.0.3","5.9.29.183","TCP","56","43520 → 9002 [ACK] Seq=9659 Ack=137321 Win=11895 Len=0"
"10.264746","5.9.29.183","172.19.0.3","TCP","1504","[TCP segment of a reassembled PDU]"
"10.264811","5.9.29.183","172.19.0.3","TCP","1516","9002 → 43520 [PSH, ACK] Seq=138769 Ack=9659 Win=65535 Len=1460 [TCP segment of a reassembled PDU]"
"10.264828","172.19.0.3","5.9.29.183","TCP","56","43520 → 9002 [ACK] Seq=9659 Ack=140229 Win=11901 Len=0"
"10.264831","5.9.29.183","172.19.0.3","TCP","331","9002 → 43520 [PSH, ACK] Seq=140229 Ack=9659 Win=65535 Len=275 [TCP segment of a reassembled PDU]"
"10.264976","5.9.29.183","172.19.0.3","TLSv1.2","1516","Application Data [TCP segment of a reassembled PDU]"
"10.264981","5.9.29.183","172.19.0.3","TCP","1516","9002 → 43520 [PSH, ACK] Seq=141964 Ack=9659 Win=65535 Len=1460 [TCP segment of a reassembled PDU]"
"10.264983","5.9.29.183","172.19.0.3","TCP","1193","9002 → 43520 [PSH, ACK] Seq=143424 Ack=9659 Win=65535 Len=1137 [TCP segment of a reassembled PDU]"
"10.265001","172.19.0.3","5.9.29.183","TCP","56","43520 → 9002 [ACK] Seq=9659 Ack=141964 Win=11911 Len=0"
"10.265068","172.19.0.3","5.9.29.183","TCP","56","43520 → 9002 [ACK] Seq=9659 Ack=144561 Win=11895 Len=0"
"10.271666","5.9.29.183","172.19.0.3","TLSv1.2","1127","Application Data, Application Data"
"10.293246","5.9.29.183","172.19.0.3","TCP","1516","[TCP segment of a reassembled PDU]"
"10.293267","172.19.0.3","5.9.29.183","TCP","56","43520 → 9002 [ACK] Seq=9659 Ack=147092 Win=11911 Len=0"
"10.293316","5.9.29.183","172.19.0.3","TCP","1516","9002 → 43520 [PSH, ACK] Seq=147092 Ack=9659 Win=65535 Len=1460 [TCP segment of a reassembled PDU]"
"10.293327","5.9.29.183","172.19.0.3","TLSv1.2","249","Application Data"
"10.293476","172.19.0.3","5.9.29.183","TCP","56","43520 → 9002 [ACK] Seq=9659 Ack=148745 Win=11899 Len=0"
"10.372219","5.9.29.183","172.19.0.3","TCP","1516","[TCP segment of a reassembled PDU]"
"10.372296","5.9.29.183","172.19.0.3","TCP","1516","9002 → 43520 [PSH, ACK] Seq=150205 Ack=9659 Win=65535 Len=1460 [TCP segment of a reassembled PDU]"
"10.372324","172.19.0.3","5.9.29.183","TCP","56","43520 → 9002 [ACK] Seq=9659 Ack=151665 Win=11903 Len=0"
"10.372327","5.9.29.183","172.19.0.3","TLSv1.2","763","Application Data"
"10.405932","5.9.29.183","172.19.0.3","TCP","1516","[TCP segment of a reassembled PDU]"
"10.405954","172.19.0.3","5.9.29.183","TCP","56","43520 → 9002 [ACK] Seq=9659 Ack=153832 Win=11911 Len=0"
"10.406008","5.9.29.183","172.19.0.3","TCP","1492","9002 → 43520 [PSH, ACK] Seq=153832 Ack=9659 Win=65535 Len=1436 [TCP segment of a reassembled PDU]"
"10.406020","5.9.29.183","172.19.0.3","TLSv1.2","1237","Application Data"
"10.406164","172.19.0.3","5.9.29.183","TCP","56","43520 → 9002 [ACK] Seq=9659 Ack=156449 Win=11895 Len=0"
"10.421473","5.9.29.183","172.19.0.3","TLSv1.2","149","Application Data"
"10.435885","5.9.29.183","172.19.0.3","TCP","1504","[TCP segment of a reassembled PDU]"
"10.435912","172.19.0.3","5.9.29.183","TCP","56","43520 → 9002 [ACK] Seq=9659 Ack=157990 Win=11911 Len=0"
"10.435972","5.9.29.183","172.19.0.3","TCP","1504","9002 → 43520 [PSH, ACK] Seq=157990 Ack=9659 Win=65535 Len=1448 [TCP segment of a reassembled PDU]"
"10.439050","5.9.29.183","172.19.0.3","TLSv1.2","787","Application Data"
"10.439109","172.19.0.3","5.9.29.183","TCP","56","43520 → 9002 [ACK] Seq=9659 Ack=160169 Win=11911 Len=0"
"10.439599","172.19.0.3","5.9.29.183","TLSv1.2","599","Application Data"
"10.440020","5.9.29.183","172.19.0.3","TCP","56","9002 → 43520 [ACK] Seq=160169 Ack=10202 Win=65535 Len=0"
"10.449644","172.19.0.3","5.9.29.183","TLSv1.2","599","Application Data"
"10.449926","5.9.29.183","172.19.0.3","TCP","56","9002 → 43520 [ACK] Seq=160169 Ack=10745 Win=65535 Len=0"
"11.224315","172.19.0.3","185.21.216.198","TLSv1.2","599","Application Data"
"11.224797","185.21.216.198","172.19.0.3","TCP","56","41389 → 37034 [ACK] Seq=544 Ack=1087 Win=65535 Len=0"
"11.633117","5.9.29.183","172.19.0.3","TLSv1.2","599","Application Data"
"11.634140","172.19.0.3","5.9.29.183","TLSv1.2","599","Application Data"
"11.634476","5.9.29.183","172.19.0.3","TCP","56","9002 → 43520 [ACK] Seq=160712 Ack=11288 Win=65535 Len=0"
"12.798767","5.9.29.183","172.19.0.3","TLSv1.2","599","Application Data"
"12.798898","5.9.29.183","172.19.0.3","TCP","1516","[TCP segment of a reassembled PDU]"
"12.798912","5.9.29.183","172.19.0.3","TCP","1516","9002 → 43520 [PSH, ACK] Seq=162715 Ack=11288 Win=65535 Len=1460 [TCP segment of a reassembled PDU]"
"12.798954","5.9.29.183","172.19.0.3","TLSv1.2","1516","Application Data [TCP segment of a reassembled PDU]"
"12.798960","5.9.29.183","172.19.0.3","TCP","1516","9002 → 43520 [PSH, ACK] Seq=165635 Ack=11288 Win=65535 Len=1460 [TCP segment of a reassembled PDU]"
"12.798963","5.9.29.183","172.19.0.3","TLSv1.2","1516","Application Data [TCP segment of a reassembled PDU]"
"12.799036","5.9.29.183","172.19.0.3","TLSv1.2","553","Application Data"
"12.799041","172.19.0.3","5.9.29.183","TCP","56","43520 → 9002 [ACK] Seq=11288 Ack=168555 Win=11869 Len=0"
"12.843215","172.19.0.3","5.9.29.183","TCP","56","43520 → 9002 [ACK] Seq=11288 Ack=169052 Win=11911 Len=0"
"13.240494","5.9.29.183","172.19.0.3","TCP","1516","[TCP segment of a reassembled PDU]"
"13.240516","172.19.0.3","5.9.29.183","TCP","56","43520 → 9002 [ACK] Seq=11288 Ack=170512 Win=11911 Len=0"
"13.240569","5.9.29.183","172.19.0.3","TLSv1.2","1516","Application Data [TCP segment of a reassembled PDU]"
"13.240585","172.19.0.3","5.9.29.183","TCP","56","43520 → 9002 [ACK] Seq=11288 Ack=171972 Win=11903 Len=0"
"13.240587","5.9.29.183","172.19.0.3","TCP","1183","9002 → 43520 [PSH, ACK] Seq=171972 Ack=11288 Win=65535 Len=1127 [TCP segment of a reassembled PDU]"
"13.240592","172.19.0.3","5.9.29.183","TCP","56","43520 → 9002 [ACK] Seq=11288 Ack=173099 Win=11895 Len=0"
"13.240594","5.9.29.183","172.19.0.3","TCP","1516","9002 → 43520 [PSH, ACK] Seq=173099 Ack=11288 Win=65535 Len=1460 [TCP segment of a reassembled PDU]"
"13.240600","172.19.0.3","5.9.29.183","TCP","56","43520 → 9002 [ACK] Seq=11288 Ack=174559 Win=11887 Len=0"
"13.240601","5.9.29.183","172.19.0.3","TLSv1.2","1516","Application Data, Application Data"
"13.240607","172.19.0.3","5.9.29.183","TCP","56","43520 → 9002 [ACK] Seq=11288 Ack=176019 Win=11879 Len=0"
"13.240830","5.9.29.183","172.19.0.3","TCP","1516","9002 → 43520 [PSH, ACK] Seq=176019 Ack=11288 Win=65535 Len=1460 [TCP segment of a reassembled PDU]"
"13.240841","172.19.0.3","5.9.29.183","TCP","56","43520 → 9002 [ACK] Seq=11288 Ack=177479 Win=11871 Len=0"
"13.240842","5.9.29.183","172.19.0.3","TCP","1516","9002 → 43520 [PSH, ACK] Seq=177479 Ack=11288 Win=65535 Len=1460 [TCP segment of a reassembled PDU]"
"13.240847","172.19.0.3","5.9.29.183","TCP","56","43520 → 9002 [ACK] Seq=11288 Ack=178939 Win=11863 Len=0"
"13.240849","5.9.29.183","172.19.0.3","TLSv1.2","1516","Application Data, Application Data"
"13.240855","172.19.0.3","5.9.29.183","TCP","56","43520 → 9002 [ACK] Seq=11288 Ack=180399 Win=11855 Len=0"
"13.240856","5.9.29.183","172.19.0.3","TCP","1444","9002 → 43520 [PSH, ACK] Seq=180399 Ack=11288 Win=65535 Len=1388 [TCP segment of a reassembled PDU]"
"13.240861","172.19.0.3","5.9.29.183","TCP","56","43520 → 9002 [ACK] Seq=11288 Ack=181787 Win=11847 Len=0"
"13.246387","5.9.29.183","172.19.0.3","TCP","1504","9002 → 43520 [PSH, ACK] Seq=181787 Ack=11288 Win=65535 Len=1448 [TCP segment of a reassembled PDU]"
"13.246412","172.19.0.3","5.9.29.183","TCP","56","43520 → 9002 [ACK] Seq=11288 Ack=183235 Win=11911 Len=0"
"13.255804","5.9.29.183","172.19.0.3","TLSv1.2","1504","Application Data, Application Data"
"13.255908","172.19.0.3","5.9.29.183","TCP","56","43520 → 9002 [ACK] Seq=11288 Ack=184683 Win=11911 Len=0"
"13.255947","5.9.29.183","172.19.0.3","TCP","1516","9002 → 43520 [PSH, ACK] Seq=184683 Ack=11288 Win=65535 Len=1460 [TCP segment of a reassembled PDU]"
"13.255959","172.19.0.3","5.9.29.183","TCP","56","43520 → 9002 [ACK] Seq=11288 Ack=186143 Win=11903 Len=0"
"13.255961","5.9.29.183","172.19.0.3","TCP","1492","9002 → 43520 [PSH, ACK] Seq=186143 Ack=11288 Win=65535 Len=1436 [TCP segment of a reassembled PDU]"
"13.255978","172.19.0.3","5.9.29.183","TCP","56","43520 → 9002 [ACK] Seq=11288 Ack=187579 Win=11895 Len=0"
"13.256133","5.9.29.183","172.19.0.3","TLSv1.2","1516","Application Data [TCP segment of a reassembled PDU]"
"13.256140","172.19.0.3","5.9.29.183","TCP","56","43520 → 9002 [ACK] Seq=11288 Ack=189039 Win=11887 Len=0"
"13.256142","5.9.29.183","172.19.0.3","TLSv1.2","1516","Application Data [TCP segment of a reassembled PDU]"
"13.256146","172.19.0.3","5.9.29.183","TCP","56","43520 → 9002 [ACK] Seq=11288 Ack=190499 Win=11879 Len=0"
"13.256148","5.9.29.183","172.19.0.3","TLSv1.2","1480","Application Data [TCP segment of a reassembled PDU]"
"13.256151","172.19.0.3","5.9.29.183","TCP","56","43520 → 9002 [ACK] Seq=11288 Ack=191923 Win=11869 Len=0"
"13.256152","5.9.29.183","172.19.0.3","TLSv1.2","634","Application Data"
"13.256311","172.19.0.3","5.9.29.183","TLSv1.2","599","Application Data"
"13.256539","5.9.29.183","172.19.0.3","TCP","56","9002 → 43520 [ACK] Seq=192501 Ack=11831 Win=65535 Len=0"
"13.267619","172.19.0.3","5.9.29.183","TLSv1.2","599","Application Data"
"13.268052","5.9.29.183","172.19.0.3","TCP","56","9002 → 43520 [ACK] Seq=192501 Ack=12374 Win=65535 Len=0"
"13.271149","5.9.29.183","172.19.0.3","TLSv1.2","599","Application Data"
"13.302286","5.9.29.183","172.19.0.3","TCP","1516","[TCP segment of a reassembled PDU]"
"13.302310","172.19.0.3","5.9.29.183","TCP","56","43520 → 9002 [ACK] Seq=12374 Ack=194504 Win=11911 Len=0"
"13.302370","5.9.29.183","172.19.0.3","TCP","1516","9002 → 43520 [PSH, ACK] Seq=194504 Ack=12374 Win=65535 Len=1460 [TCP segment of a reassembled PDU]"
"13.302383","5.9.29.183","172.19.0.3","TLSv1.2","763","Application Data"
"13.302521","172.19.0.3","5.9.29.183","TCP","56","43520 → 9002 [ACK] Seq=12374 Ack=196671 Win=11895 Len=0"
"13.317200","5.9.29.183","172.19.0.3","TLSv1.2","599","Application Data"
"13.327441","5.9.29.183","172.19.0.3","TCP","1516","[TCP segment of a reassembled PDU]"
"13.327465","172.19.0.3","5.9.29.183","TCP","56","43520 → 9002 [ACK] Seq=12374 Ack=198674 Win=11911 Len=0"
"13.327521","5.9.29.183","172.19.0.3","TCP","1516","9002 → 43520 [PSH, ACK] Seq=198674 Ack=12374 Win=65535 Len=1460 [TCP segment of a reassembled PDU]"
"13.327568","5.9.29.183","172.19.0.3","TLSv1.2","1480","Application Data [TCP segment of a reassembled PDU]"
"13.327798","172.19.0.3","5.9.29.183","TCP","56","43520 → 9002 [ACK] Seq=12374 Ack=201558 Win=11895 Len=0"
"13.332637","5.9.29.183","172.19.0.3","TLSv1.2","396","Application Data"
"13.382342","172.19.0.3","5.9.29.183","TCP","56","43520 → 9002 [ACK] Seq=12374 Ack=201898 Win=11911 Len=0"
"13.401600","5.9.29.183","172.19.0.3","TCP","1504","[TCP segment of a reassembled PDU]"
"13.401720","5.9.29.183","172.19.0.3","TCP","1504","9002 → 43520 [PSH, ACK] Seq=203346 Ack=12374 Win=65535 Len=1448 [TCP segment of a reassembled PDU]"
"13.401730","5.9.29.183","172.19.0.3","TLSv1.2","1302","Application Data [TCP segment of a reassembled PDU]"
"13.401823","172.19.0.3","5.9.29.183","TCP","56","43520 → 9002 [ACK] Seq=12374 Ack=206040 Win=11895 Len=0"
"13.401881","5.9.29.183","172.19.0.3","TCP","1516","9002 → 43520 [PSH, ACK] Seq=206040 Ack=12374 Win=65535 Len=1460 [TCP segment of a reassembled PDU]"
"13.401926","5.9.29.183","172.19.0.3","TCP","1427","9002 → 43520 [PSH, ACK] Seq=207500 Ack=12374 Win=65535 Len=1371 [TCP segment of a reassembled PDU]"
"13.402041","172.19.0.3","5.9.29.183","TCP","56","43520 → 9002 [ACK] Seq=12374 Ack=208871 Win=11879 Len=0"
"13.417276","5.9.29.183","172.19.0.3","TLSv1.2","337","Application Data"
"13.417571","172.19.0.3","5.9.29.183","TCP","56","43520 → 9002 [ACK] Seq=12374 Ack=209152 Win=11911 Len=0"
"13.522221","5.9.29.183","172.19.0.3","TCP","1516","[TCP segment of a reassembled PDU]"
"13.522299","5.9.29.183","172.19.0.3","TLSv1.2","681","Application Data"
"13.522504","172.19.0.3","5.9.29.183","TCP","56","43520 → 9002 [ACK] Seq=12374 Ack=211237 Win=11903 Len=0"
"13.527400","172.19.0.3","5.9.29.183","TLSv1.2","599","Application Data"
"13.527682","5.9.29.183","172.19.0.3","TCP","56","9002 → 43520 [ACK] Seq=211237 Ack=12917 Win=65535 Len=0"
"14.551471","5.9.29.183","172.19.0.3","TLSv1.2","599","Application Data"
"14.552468","172.19.0.3","5.9.29.183","TLSv1.2","599","Application Data"
"14.552842","5.9.29.183","172.19.0.3","TCP","56","9002 → 43520 [ACK] Seq=211780 Ack=13460 Win=65535 Len=0"
"15.579114","5.9.29.183","172.19.0.3","TLSv1.2","1516","Application Data"
"15.579228","5.9.29.183","172.19.0.3","TCP","587","9002 → 43520 [PSH, ACK] Seq=213240 Ack=13460 Win=65535 Len=531 [TCP segment of a reassembled PDU]"
"15.579242","5.9.29.183","172.19.0.3","TCP","1504","9002 → 43520 [PSH, ACK] Seq=213771 Ack=13460 Win=65535 Len=1448 [TCP segment of a reassembled PDU]"
"15.579388","172.19.0.3","5.9.29.183","TCP","56","43520 → 9002 [ACK] Seq=13460 Ack=215219 Win=11895 Len=0"
"15.589807","5.9.29.183","172.19.0.3","TLSv1.2","1504","Application Data [TCP segment of a reassembled PDU]"
"15.589878","5.9.29.183","172.19.0.3","TCP","1516","9002 → 43520 [PSH, ACK] Seq=216667 Ack=13460 Win=65535 Len=1460 [TCP segment of a reassembled PDU]"
"15.589896","172.19.0.3","5.9.29.183","TCP","56","43520 → 9002 [ACK] Seq=13460 Ack=218127 Win=11903 Len=0"
"15.589899","5.9.29.183","172.19.0.3","TCP","1492","9002 → 43520 [PSH, ACK] Seq=218127 Ack=13460 Win=65535 Len=1436 [TCP segment of a reassembled PDU]"
"15.594364","5.9.29.183","172.19.0.3","TLSv1.2","70","Application Data"
"15.594614","172.19.0.3","5.9.29.183","TCP","56","43520 → 9002 [ACK] Seq=13460 Ack=219577 Win=11911 Len=0"
"15.648339","5.9.29.183","172.19.0.3","TLSv1.2","599","Application Data"
"15.691559","172.19.0.3","5.9.29.183","TCP","56","43520 → 9002 [ACK] Seq=13460 Ack=220120 Win=11911 Len=0"
"15.775795","5.9.29.183","172.19.0.3","TCP","1516","[TCP segment of a reassembled PDU]"
"15.775816","172.19.0.3","5.9.29.183","TCP","56","43520 → 9002 [ACK] Seq=13460 Ack=221580 Win=11911 Len=0"
"15.775863","5.9.29.183","172.19.0.3","TCP","1492","9002 → 43520 [PSH, ACK] Seq=221580 Ack=13460 Win=65535 Len=1436 [TCP segment of a reassembled PDU]"
"15.775879","172.19.0.3","5.9.29.183","TCP","56","43520 → 9002 [ACK] Seq=13460 Ack=223016 Win=11903 Len=0"
"15.775880","5.9.29.183","172.19.0.3","TLSv1.2","787","Application Data"
"15.775886","172.19.0.3","5.9.29.183","TCP","56","43520 → 9002 [ACK] Seq=13460 Ack=223747 Win=11898 Len=0"
"15.791200","5.9.29.183","172.19.0.3","TLSv1.2","599","Application Data"
"15.791226","172.19.0.3","5.9.29.183","TCP","56","43520 → 9002 [ACK] Seq=13460 Ack=224290 Win=11911 Len=0"
"15.812026","5.9.29.183","172.19.0.3","TCP","1516","[TCP segment of a reassembled PDU]"
"15.812086","172.19.0.3","5.9.29.183","TCP","56","43520 → 9002 [ACK] Seq=13460 Ack=225750 Win=11911 Len=0"
"15.812139","5.9.29.183","172.19.0.3","TCP","1492","9002 → 43520 [PSH, ACK] Seq=225750 Ack=13460 Win=65535 Len=1436 [TCP segment of a reassembled PDU]"
"15.812151","172.19.0.3","5.9.29.183","TCP","56","43520 → 9002 [ACK] Seq=13460 Ack=227186 Win=11903 Len=0"
"15.812230","5.9.29.183","172.19.0.3","TLSv1.2","787","Application Data"
"15.812239","172.19.0.3","5.9.29.183","TCP","56","43520 → 9002 [ACK] Seq=13460 Ack=227917 Win=11898 Len=0"
"15.827907","5.9.29.183","172.19.0.3","TLSv1.2","1113","Application Data"
"15.827934","172.19.0.3","5.9.29.183","TCP","56","43520 → 9002 [ACK] Seq=13460 Ack=228974 Win=11911 Len=0"
"15.847607","5.9.29.183","172.19.0.3","TCP","1516","[TCP segment of a reassembled PDU]"
"15.847636","172.19.0.3","5.9.29.183","TCP","56","43520 → 9002 [ACK] Seq=13460 Ack=230434 Win=11911 Len=0"
"15.847701","5.9.29.183","172.19.0.3","TCP","1516","9002 → 43520 [PSH, ACK] Seq=230434 Ack=13460 Win=65535 Len=1460 [TCP segment of a reassembled PDU]"
"15.847717","172.19.0.3","5.9.29.183","TCP","56","43520 → 9002 [ACK] Seq=13460 Ack=231894 Win=11903 Len=0"
"15.847720","5.9.29.183","172.19.0.3","TLSv1.2","249","Application Data"
"15.847728","172.19.0.3","5.9.29.183","TCP","56","43520 → 9002 [ACK] Seq=13460 Ack=232087 Win=11902 Len=0"
"15.857440","5.9.29.183","172.19.0.3","TCP","1516","[TCP segment of a reassembled PDU]"
"15.857461","172.19.0.3","5.9.29.183","TCP","56","43520 → 9002 [ACK] Seq=13460 Ack=233547 Win=11911 Len=0"
"15.857508","5.9.29.183","172.19.0.3","TCP","1492","9002 → 43520 [PSH, ACK] Seq=233547 Ack=13460 Win=65535 Len=1436 [TCP segment of a reassembled PDU]"
"15.857553","5.9.29.183","172.19.0.3","TLSv1.2","1516","Application Data [TCP segment of a reassembled PDU]"
"15.857562","5.9.29.183","172.19.0.3","TCP","1516","9002 → 43520 [PSH, ACK] Seq=236443 Ack=13460 Win=65535 Len=1460 [TCP segment of a reassembled PDU]"
"15.857639","5.9.29.183","172.19.0.3","TCP","1480","9002 → 43520 [PSH, ACK] Seq=237903 Ack=13460 Win=65535 Len=1424 [TCP segment of a reassembled PDU]"
"15.857790","172.19.0.3","5.9.29.183","TCP","56","43520 → 9002 [ACK] Seq=13460 Ack=239327 Win=11879 Len=0"
"15.858084","172.19.0.3","5.9.29.183","TLSv1.2","599","Application Data"
"15.858334","5.9.29.183","172.19.0.3","TCP","56","9002 → 43520 [ACK] Seq=239327 Ack=14003 Win=65535 Len=0"
"15.862584","5.9.29.183","172.19.0.3","TLSv1.2","584","Application Data"
"15.870943","172.19.0.3","5.9.29.183","TLSv1.2","599","Application Data"
"15.871517","5.9.29.183","172.19.0.3","TCP","56","9002 → 43520 [ACK] Seq=239855 Ack=14546 Win=65535 Len=0"
"15.887565","5.9.29.183","172.19.0.3","TLSv1.2","599","Application Data"
"15.902607","5.9.29.183","172.19.0.3","TLSv1.2","599","Application Data"
"15.902628","172.19.0.3","5.9.29.183","TCP","56","43520 → 9002 [ACK] Seq=14546 Ack=240941 Win=11911 Len=0"
"16.055721","5.9.29.183","172.19.0.3","TCP","1516","[TCP segment of a reassembled PDU]"
"16.055801","5.9.29.183","172.19.0.3","TLSv1.2","1195","Application Data"
"16.055991","172.19.0.3","5.9.29.183","TCP","56","43520 → 9002 [ACK] Seq=14546 Ack=243540 Win=11903 Len=0"
"16.302652","5.9.29.183","172.19.0.3","TCP","1516","[TCP segment of a reassembled PDU]"
