_ws.col.Time,_ws.col.Source,_ws.col.Destination,_ws.col.Protocol,_ws.col.Length,_ws.col.Info
"0.000000","172.18.0.2","54.38.73.16","TLSv1.2","611","Application Data"
"0.024577","54.38.73.16","172.18.0.2","TCP","68","21002 → 36876 [ACK] Seq=1 Ack=544 Win=1452 Len=0 TSval=2673127180 TSecr=1075912129"
"0.389582","54.38.73.16","172.18.0.2","TLSv1.2","611","Application Data"
"0.390726","172.18.0.2","54.38.73.16","TCP","1516","[TCP segment of a reassembled PDU]"
"0.390813","172.18.0.2","54.38.73.16","TLSv1.2","705","Application Data"
"0.414752","54.38.73.16","172.18.0.2","TCP","68","21002 → 36876 [ACK] Seq=544 Ack=2629 Win=1450 Len=0 TSval=2673127278 TSecr=1075912520"
"0.695037","54.38.73.16","172.18.0.2","TLSv1.2","611","Application Data"
"0.737726","172.18.0.2","54.38.73.16","TCP","68","36876 → 21002 [ACK] Seq=2629 Ack=1087 Win=5612 Len=0 TSval=1075912867 TSecr=2673127345"
"0.761703","54.38.73.16","172.18.0.2","TLSv1.2","1125","Application Data"
"0.761761","172.18.0.2","54.38.73.16","TCP","68","36876 → 21002 [ACK] Seq=2629 Ack=2144 Win=5604 Len=0 TSval=1075912891 TSecr=2673127364"
"0.767463","172.18.0.2","54.38.73.16","TLSv1.2","611","Application Data"
"0.791053","54.38.73.16","172.18.0.2","TCP","68","21002 → 36876 [ACK] Seq=2144 Ack=3172 Win=1452 Len=0 TSval=2673127372 TSecr=1075912896"
"1.116095","54.38.73.16","172.18.0.2","TLSv1.2","611","Application Data"
"1.116153","172.18.0.2","54.38.73.16","TCP","68","36876 → 21002 [ACK] Seq=3172 Ack=2687 Win=5608 Len=0 TSval=1075913245 TSecr=2673127453"
"1.117114","172.18.0.2","54.38.73.16","TLSv1.2","611","Application Data"
"1.140750","54.38.73.16","172.18.0.2","TCP","68","21002 → 36876 [ACK] Seq=2687 Ack=3715 Win=1452 Len=0 TSval=2673127459 TSecr=1075913246"
"1.322464","54.38.73.16","172.18.0.2","TLSv1.2","611","Application Data"
"1.322503","172.18.0.2","54.38.73.16","TCP","68","36876 → 21002 [ACK] Seq=3715 Ack=3230 Win=5608 Len=0 TSval=1075913451 TSecr=2673127504"
"1.364343","54.38.73.16","172.18.0.2","TLSv1.2","3695","Application Data"
"1.364397","172.18.0.2","54.38.73.16","TCP","68","36876 → 21002 [ACK] Seq=3715 Ack=6857 Win=5580 Len=0 TSval=1075913493 TSecr=2673127515"
"1.373883","54.38.73.16","172.18.0.2","TLSv1.2","7308","Application Data"
"1.373922","172.18.0.2","54.38.73.16","TCP","68","36876 → 21002 [ACK] Seq=3715 Ack=14097 Win=5564 Len=0 TSval=1075913503 TSecr=2673127517"
"1.384464","54.38.73.16","172.18.0.2","TLSv1.2","2964","Application Data [TCP segment of a reassembled PDU]"
"1.384500","172.18.0.2","54.38.73.16","TCP","68","36876 → 21002 [ACK] Seq=3715 Ack=16993 Win=5595 Len=0 TSval=1075913513 TSecr=2673127520"
"1.387699","54.38.73.16","172.18.0.2","TLSv1.2","1870","Application Data, Application Data"
"1.387738","172.18.0.2","54.38.73.16","TCP","68","36876 → 21002 [ACK] Seq=3715 Ack=18795 Win=5600 Len=0 TSval=1075913517 TSecr=2673127521"
"1.394075","54.38.73.16","172.18.0.2","TCP","1516","[TCP segment of a reassembled PDU]"
"1.394110","172.18.0.2","54.38.73.16","TCP","68","36876 → 21002 [ACK] Seq=3715 Ack=20243 Win=5593 Len=0 TSval=1075913523 TSecr=2673127522"
"1.398895","54.38.73.16","172.18.0.2","TCP","1516","21002 → 36876 [ACK] Seq=20243 Ack=3715 Win=1452 Len=1448 TSval=2673127523 TSecr=1075913503 [TCP segment of a reassembled PDU]"
"1.398930","172.18.0.2","54.38.73.16","TCP","68","36876 → 21002 [ACK] Seq=3715 Ack=21691 Win=5593 Len=0 TSval=1075913528 TSecr=2673127523"
"1.411728","54.38.73.16","172.18.0.2","TLSv1.2","285","Application Data"
"1.411766","172.18.0.2","54.38.73.16","TCP","68","36876 → 21002 [ACK] Seq=3715 Ack=21908 Win=5593 Len=0 TSval=1075913541 TSecr=2673127527"
"1.436806","54.38.73.16","172.18.0.2","TLSv1.2","1125","Application Data"
"1.436845","172.18.0.2","54.38.73.16","TCP","68","36876 → 21002 [ACK] Seq=3715 Ack=22965 Win=5593 Len=0 TSval=1075913566 TSecr=2673127533"
"1.444185","172.18.0.2","54.38.73.16","TLSv1.2","611","Application Data"
"1.467763","54.38.73.16","172.18.0.2","TCP","68","21002 → 36876 [ACK] Seq=22965 Ack=4258 Win=1452 Len=0 TSval=2673127541 TSecr=1075913573"
"1.822906","54.38.73.16","172.18.0.2","TLSv1.2","611","Application Data"
"1.824043","172.18.0.2","54.38.73.16","TLSv1.2","611","Application Data"
"1.847624","54.38.73.16","172.18.0.2","TCP","68","21002 → 36876 [ACK] Seq=23508 Ack=4801 Win=1452 Len=0 TSval=2673127636 TSecr=1075913953"
"2.048957","54.38.73.16","172.18.0.2","TLSv1.2","611","Application Data"
"2.059213","54.38.73.16","172.18.0.2","TCP","2964","[TCP segment of a reassembled PDU]"
"2.059397","172.18.0.2","54.38.73.16","TCP","68","36876 → 21002 [ACK] Seq=4801 Ack=26947 Win=5595 Len=0 TSval=1075914188 TSecr=2673127686"
"2.070329","54.38.73.16","172.18.0.2","TLSv1.2","4412","Application Data [TCP segment of a reassembled PDU]"
"2.070511","172.18.0.2","54.38.73.16","TCP","68","36876 → 21002 [ACK] Seq=4801 Ack=31291 Win=5579 Len=0 TSval=1075914199 TSecr=2673127691"
"2.079887","54.38.73.16","172.18.0.2","TLSv1.2","5860","Application Data, Application Data"
"2.079926","172.18.0.2","54.38.73.16","TCP","68","36876 → 21002 [ACK] Seq=4801 Ack=37083 Win=5580 Len=0 TSval=1075914209 TSecr=2673127694"
"2.083706","54.38.73.16","172.18.0.2","TLSv1.2","2964","Application Data [TCP segment of a reassembled PDU]"
"2.083740","172.18.0.2","54.38.73.16","TCP","68","36876 → 21002 [ACK] Seq=4801 Ack=39979 Win=5595 Len=0 TSval=1075914213 TSecr=2673127695"
"2.096268","54.38.73.16","172.18.0.2","TLSv1.2","5860","Application Data [TCP segment of a reassembled PDU]"
"2.096483","172.18.0.2","54.38.73.16","TCP","68","36876 → 21002 [ACK] Seq=4801 Ack=45771 Win=5580 Len=0 TSval=1075914225 TSecr=2673127697"
"2.105558","54.38.73.16","172.18.0.2","TLSv1.2","5860","Application Data, Application Data, Application Data"
"2.105596","172.18.0.2","54.38.73.16","TCP","68","36876 → 21002 [ACK] Seq=4801 Ack=51563 Win=5580 Len=0 TSval=1075914235 TSecr=2673127700"
"2.106547","172.18.0.2","54.38.73.16","TLSv1.2","1125","Application Data"
"2.108214","54.38.73.16","172.18.0.2","TCP","2964","21002 → 36876 [ACK] Seq=51563 Ack=4801 Win=1452 Len=2896 TSval=2673127701 TSecr=1075914213 [TCP segment of a reassembled PDU]"
"2.108249","172.18.0.2","54.38.73.16","TCP","68","36876 → 21002 [ACK] Seq=5858 Ack=54459 Win=5595 Len=0 TSval=1075914237 TSecr=2673127701"
"2.120172","54.38.73.16","172.18.0.2","TLSv1.2","1516","Application Data, Application Data"
"2.120720","54.38.73.16","172.18.0.2","TLSv1.2","4026","Application Data, Application Data"
"2.120823","172.18.0.2","54.38.73.16","TCP","68","36876 → 21002 [ACK] Seq=5858 Ack=59865 Win=5560 Len=0 TSval=1075914250 TSecr=2673127704"
"2.129680","54.38.73.16","172.18.0.2","TCP","68","21002 → 36876 [ACK] Seq=59865 Ack=5858 Win=1452 Len=0 TSval=2673127706 TSecr=1075914236"
"2.141822","54.38.73.16","172.18.0.2","TCP","1516","[TCP segment of a reassembled PDU]"
"2.145648","54.38.73.16","172.18.0.2","TLSv1.2","1219","Application Data"
"2.145686","172.18.0.2","54.38.73.16","TCP","68","36876 → 21002 [ACK] Seq=5858 Ack=62464 Win=5593 Len=0 TSval=1075914275 TSecr=2673127709"
"2.154282","172.18.0.2","54.38.73.16","TLSv1.2","611","Application Data"
"2.215046","54.38.73.16","172.18.0.2","TCP","68","21002 → 36876 [ACK] Seq=62464 Ack=6401 Win=1452 Len=0 TSval=2673127728 TSecr=1075914283"
"2.373088","54.38.73.16","172.18.0.2","TLSv1.2","611","Application Data"
"2.374168","172.18.0.2","54.38.73.16","TLSv1.2","611","Application Data"
"2.398889","54.38.73.16","172.18.0.2","TCP","68","21002 → 36876 [ACK] Seq=63007 Ack=6944 Win=1452 Len=0 TSval=2673127774 TSecr=1075914503"
"2.966067","54.38.73.16","172.18.0.2","TLSv1.2","3695","Application Data"
"2.966260","172.18.0.2","54.38.73.16","TCP","68","36876 → 21002 [ACK] Seq=6944 Ack=66634 Win=5584 Len=0 TSval=1075915095 TSecr=2673127915"
"2.986265","54.38.73.16","172.18.0.2","TLSv1.2","7308","Application Data"
"2.986431","172.18.0.2","54.38.73.16","TCP","68","36876 → 21002 [ACK] Seq=6944 Ack=73874 Win=5564 Len=0 TSval=1075915115 TSecr=2673127920"
"2.989844","54.38.73.16","172.18.0.2","TLSv1.2","596","Application Data"
"2.996177","54.38.73.16","172.18.0.2","TLSv1.2","5860","Application Data"
"2.996214","172.18.0.2","54.38.73.16","TCP","68","36876 → 21002 [ACK] Seq=6944 Ack=80194 Win=5580 Len=0 TSval=1075915125 TSecr=2673127921"
"3.010290","54.38.73.16","172.18.0.2","TLSv1.2","5860","Application Data [TCP segment of a reassembled PDU]"
"3.010328","172.18.0.2","54.38.73.16","TCP","68","36876 → 21002 [ACK] Seq=6944 Ack=85986 Win=5580 Len=0 TSval=1075915139 TSecr=2673127926"
"3.018917","54.38.73.16","172.18.0.2","TLSv1.2","1516","Application Data [TCP segment of a reassembled PDU]"
"3.021151","54.38.73.16","172.18.0.2","TLSv1.2","7308","Application Data, Application Data, Application Data"
"3.021299","172.18.0.2","54.38.73.16","TCP","68","36876 → 21002 [ACK] Seq=6944 Ack=94674 Win=5564 Len=0 TSval=1075915150 TSecr=2673127928"
"3.021800","172.18.0.2","54.38.73.16","TLSv1.2","611","Application Data"
"3.034329","54.38.73.16","172.18.0.2","TLSv1.2","5860","Application Data [TCP segment of a reassembled PDU]"
"3.034365","172.18.0.2","54.38.73.16","TCP","68","36876 → 21002 [ACK] Seq=7487 Ack=100466 Win=5580 Len=0 TSval=1075915163 TSecr=2673127932"
"3.045412","54.38.73.16","172.18.0.2","TCP","68","[TCP Previous segment not captured] 21002 → 36876 [ACK] Seq=107074 Ack=7487 Win=1452 Len=0 TSval=2673127935 TSecr=1075915151"
"3.045435","54.38.73.16","172.18.0.2","TCP","6676","[TCP Retransmission] 21002 → 36876 [PSH, ACK] Seq=100466 Ack=6944 Win=1452 Len=6608 TSval=2673127935 TSecr=1075915150"
"3.045652","172.18.0.2","54.38.73.16","TCP","68","36876 → 21002 [ACK] Seq=7487 Ack=107074 Win=5564 Len=0 TSval=1075915175 TSecr=2673127935"
"3.046401","172.18.0.2","54.38.73.16","TLSv1.2","611","Application Data"
"3.048627","54.38.73.16","172.18.0.2","TCP","2964","[TCP segment of a reassembled PDU]"
"3.048663","172.18.0.2","54.38.73.16","TCP","68","36876 → 21002 [ACK] Seq=8030 Ack=109970 Win=5595 Len=0 TSval=1075915178 TSecr=2673127936"
"3.069442","54.38.73.16","172.18.0.2","TLSv1.2","1342","Application Data, Application Data"
"3.069480","54.38.73.16","172.18.0.2","TCP","1516","[TCP segment of a reassembled PDU]"
"3.069653","172.18.0.2","54.38.73.16","TCP","68","36876 → 21002 [ACK] Seq=8030 Ack=112692 Win=5577 Len=0 TSval=1075915199 TSecr=2673127941"
"3.093299","54.38.73.16","172.18.0.2","TLSv1.2","1219","Application Data"
"3.102744","172.18.0.2","54.38.73.16","TLSv1.2","611","Application Data"
"3.166405","54.38.73.16","172.18.0.2","TCP","68","21002 → 36876 [ACK] Seq=113843 Ack=8573 Win=1452 Len=0 TSval=2673127966 TSecr=1075915232"
"3.461491","54.38.73.16","172.18.0.2","TLSv1.2","611","Application Data"
"3.462554","172.18.0.2","54.38.73.16","TLSv1.2","611","Application Data"
"3.485334","54.38.73.16","172.18.0.2","TCP","68","21002 → 36876 [ACK] Seq=114386 Ack=9116 Win=1452 Len=0 TSval=2673128045 TSecr=1075915592"
"3.782322","54.38.73.16","172.18.0.2","TLSv1.2","611","Application Data"
"3.813581","54.38.73.16","172.18.0.2","TCP","2964","[TCP segment of a reassembled PDU]"
"3.813620","172.18.0.2","54.38.73.16","TCP","68","36876 → 21002 [ACK] Seq=9116 Ack=117825 Win=5595 Len=0 TSval=1075915943 TSecr=2673128119"
"3.824437","54.38.73.16","172.18.0.2","TLSv1.2","4412","Application Data [TCP segment of a reassembled PDU]"
"3.824652","172.18.0.2","54.38.73.16","TCP","68","36876 → 21002 [ACK] Seq=9116 Ack=122169 Win=5579 Len=0 TSval=1075915954 TSecr=2673128130"
"3.838451","54.38.73.16","172.18.0.2","TLSv1.2","625","Application Data, Application Data"
"3.866949","54.38.73.16","172.18.0.2","TCP","2964","[TCP segment of a reassembled PDU]"
"3.866987","172.18.0.2","54.38.73.16","TCP","68","36876 → 21002 [ACK] Seq=9116 Ack=125622 Win=5595 Len=0 TSval=1075915996 TSecr=2673128133"
"3.891577","54.38.73.16","172.18.0.2","TLSv1.2","285","Application Data"
"3.899007","172.18.0.2","54.38.73.16","TLSv1.2","611","Application Data"
"3.922642","54.38.73.16","172.18.0.2","TCP","68","21002 → 36876 [ACK] Seq=125839 Ack=9659 Win=1452 Len=0 TSval=2673128155 TSecr=1075916028"
"4.280488","54.38.73.16","172.18.0.2","TLSv1.2","611","Application Data"
"4.281585","172.18.0.2","54.38.73.16","TLSv1.2","611","Application Data"
"4.304618","54.38.73.16","172.18.0.2","TCP","68","21002 → 36876 [ACK] Seq=126382 Ack=10202 Win=1452 Len=0 TSval=2673128250 TSecr=1075916411"
"4.523943","54.38.73.16","172.18.0.2","TLSv1.2","3695","Application Data"
"4.524125","172.18.0.2","54.38.73.16","TCP","68","36876 → 21002 [ACK] Seq=10202 Ack=130009 Win=5584 Len=0 TSval=1075916653 TSecr=2673128305"
"4.533206","54.38.73.16","172.18.0.2","TLSv1.2","4412","Application Data"
"4.533342","172.18.0.2","54.38.73.16","TCP","68","36876 → 21002 [ACK] Seq=10202 Ack=134353 Win=5579 Len=0 TSval=1075916662 TSecr=2673128307"
"4.533559","54.38.73.16","172.18.0.2","TLSv1.2","4412","Application Data [TCP segment of a reassembled PDU]"
"4.533731","172.18.0.2","54.38.73.16","TCP","68","36876 → 21002 [ACK] Seq=10202 Ack=138697 Win=5547 Len=0 TSval=1075916663 TSecr=2673128307"
"4.544978","54.38.73.16","172.18.0.2","TLSv1.2","1516","Application Data [TCP segment of a reassembled PDU]"
"4.547910","54.38.73.16","172.18.0.2","TLSv1.2","2384","Application Data"
"4.547944","172.18.0.2","54.38.73.16","TCP","68","36876 → 21002 [ACK] Seq=10202 Ack=142461 Win=5598 Len=0 TSval=1075916677 TSecr=2673128310"
"4.554533","54.38.73.16","172.18.0.2","TCP","1516","[TCP segment of a reassembled PDU]"
"4.557759","54.38.73.16","172.18.0.2","TLSv1.2","2964","Application Data [TCP segment of a reassembled PDU]"
"4.557771","54.38.73.16","172.18.0.2","TCP","2964","21002 → 36876 [ACK] Seq=146805 Ack=10202 Win=1452 Len=2896 TSval=2673128313 TSecr=1075916663 [TCP segment of a reassembled PDU]"
"4.557936","172.18.0.2","54.38.73.16","TCP","68","36876 → 21002 [ACK] Seq=10202 Ack=149701 Win=5579 Len=0 TSval=1075916687 TSecr=2673128313"
"4.565296","54.38.73.16","172.18.0.2","TLSv1.2","2964","Application Data [TCP segment of a reassembled PDU]"
"4.565330","172.18.0.2","54.38.73.16","TCP","68","36876 → 21002 [ACK] Seq=10202 Ack=152597 Win=5595 Len=0 TSval=1075916694 TSecr=2673128315"
"4.571548","54.38.73.16","172.18.0.2","TLSv1.2","2384","Application Data, Application Data"
"4.571585","172.18.0.2","54.38.73.16","TCP","68","36876 → 21002 [ACK] Seq=10202 Ack=154913 Win=5598 Len=0 TSval=1075916701 TSecr=2673128317"
"4.572049","172.18.0.2","54.38.73.16","TLSv1.2","611","Application Data"
"4.595961","54.38.73.16","172.18.0.2","TCP","68","21002 → 36876 [ACK] Seq=154913 Ack=10745 Win=1452 Len=0 TSval=2673128323 TSecr=1075916701"
"4.596007","172.18.0.2","54.38.73.16","TLSv1.2","611","Application Data"
"4.619691","54.38.73.16","172.18.0.2","TCP","68","21002 → 36876 [ACK] Seq=154913 Ack=11288 Win=1452 Len=0 TSval=2673128329 TSecr=1075916725"
"4.894999","54.38.73.16","172.18.0.2","TLSv1.2","611","Application Data"
"4.896072","172.18.0.2","54.38.73.16","TLSv1.2","611","Application Data"
"4.919778","54.38.73.16","172.18.0.2","TCP","68","21002 → 36876 [ACK] Seq=155456 Ack=11831 Win=1452 Len=0 TSval=2673128404 TSecr=1075917025"
"5.119617","54.38.73.16","172.18.0.2","TLSv1.2","611","Application Data"
"5.140894","54.38.73.16","172.18.0.2","TCP","2964","[TCP segment of a reassembled PDU]"
"5.141087","172.18.0.2","54.38.73.16","TCP","68","36876 → 21002 [ACK] Seq=11831 Ack=158895 Win=5595 Len=0 TSval=1075917270 TSecr=2673128454"
"5.150185","54.38.73.16","172.18.0.2","TLSv1.2","10204","Application Data, Application Data, Application Data"
"5.150371","172.18.0.2","54.38.73.16","TCP","68","36876 → 21002 [ACK] Seq=11831 Ack=169031 Win=5549 Len=0 TSval=1075917279 TSecr=2673128461"
"5.150786","172.18.0.2","54.38.73.16","TLSv1.2","611","Application Data"
"5.165001","54.38.73.16","172.18.0.2","TLSv1.2","2964","Application Data [TCP segment of a reassembled PDU]"
"5.165037","172.18.0.2","54.38.73.16","TCP","68","36876 → 21002 [ACK] Seq=12374 Ack=171927 Win=5595 Len=0 TSval=1075917294 TSecr=2673128465"
"5.172078","54.38.73.16","172.18.0.2","TCP","1516","21002 → 36876 [ACK] Seq=171927 Ack=11831 Win=1452 Len=1448 TSval=2673128467 TSecr=1075917270 [TCP segment of a reassembled PDU]"
"5.175026","54.38.73.16","172.18.0.2","TLSv1.2","6025","Application Data, Application Data, Application Data"
"5.175151","54.38.73.16","172.18.0.2","TCP","68","21002 → 36876 [ACK] Seq=179332 Ack=12374 Win=1452 Len=0 TSval=2673128468 TSecr=1075917280"
"5.175201","172.18.0.2","54.38.73.16","TCP","68","36876 → 21002 [ACK] Seq=12374 Ack=179332 Win=5564 Len=0 TSval=1075917304 TSecr=2673128467"
"5.198875","54.38.73.16","172.18.0.2","TLSv1.2","1125","Application Data"
"5.213618","54.38.73.16","172.18.0.2","TCP","2964","[TCP segment of a reassembled PDU]"
"5.213656","172.18.0.2","54.38.73.16","TCP","68","36876 → 21002 [ACK] Seq=12374 Ack=183285 Win=5595 Len=0 TSval=1075917343 TSecr=2673128474"
"5.223331","54.38.73.16","172.18.0.2","TLSv1.2","1516","Application Data [TCP segment of a reassembled PDU]"
"5.223672","54.38.73.16","172.18.0.2","TLSv1.2","8756","Application Data, Application Data"
"5.223907","172.18.0.2","54.38.73.16","TLSv1.2","611","Application Data"
"5.238111","54.38.73.16","172.18.0.2","TLSv1.2","2964","Application Data [TCP segment of a reassembled PDU]"
"5.238147","172.18.0.2","54.38.73.16","TCP","68","36876 → 21002 [ACK] Seq=12917 Ack=196317 Win=5595 Len=0 TSval=1075917367 TSecr=2673128483"
"5.245380","54.38.73.16","172.18.0.2","TCP","1516","21002 → 36876 [ACK] Seq=196317 Ack=12374 Win=1452 Len=1448 TSval=2673128485 TSecr=1075917343 [TCP segment of a reassembled PDU]"
"5.248336","54.38.73.16","172.18.0.2","TLSv1.2","10204","Application Data, Application Data, Application Data, Application Data, Application Data"
"5.248530","172.18.0.2","54.38.73.16","TCP","68","36876 → 21002 [ACK] Seq=12917 Ack=207901 Win=5549 Len=0 TSval=1075917378 TSecr=2673128485"
"5.249815","172.18.0.2","54.38.73.16","TLSv1.2","611","Application Data"
"5.262184","54.38.73.16","172.18.0.2","TCP","2964","21002 → 36876 [ACK] Seq=207901 Ack=12917 Win=1452 Len=2896 TSval=2673128489 TSecr=1075917367 [TCP segment of a reassembled PDU]"
"5.262221","172.18.0.2","54.38.73.16","TCP","68","36876 → 21002 [ACK] Seq=13460 Ack=210797 Win=5595 Len=0 TSval=1075917391 TSecr=2673128489"
"5.272533","54.38.73.16","172.18.0.2","TLSv1.2","2390","Application Data, Application Data, Application Data"
"5.272568","172.18.0.2","54.38.73.16","TCP","68","36876 → 21002 [ACK] Seq=13460 Ack=213119 Win=5598 Len=0 TSval=1075917402 TSecr=2673128492"
"5.311352","54.38.73.16","172.18.0.2","TCP","68","21002 → 36876 [ACK] Seq=213119 Ack=13460 Win=1452 Len=0 TSval=2673128502 TSecr=1075917379"
"5.311390","172.18.0.2","54.38.73.16","TLSv1.2","1154","Application Data, Application Data"
"5.376318","54.38.73.16","172.18.0.2","TCP","68","21002 → 36876 [ACK] Seq=213119 Ack=14546 Win=1452 Len=0 TSval=2673128518 TSecr=1075917440"
"5.543317","54.38.73.16","172.18.0.2","TLSv1.2","611","Application Data"
"5.544354","172.18.0.2","54.38.73.16","TLSv1.2","611","Application Data"
"5.568074","54.38.73.16","172.18.0.2","TCP","68","21002 → 36876 [ACK] Seq=213662 Ack=15089 Win=1452 Len=0 TSval=2673128566 TSecr=1075917673"
"5.767913","54.38.73.16","172.18.0.2","TLSv1.2","4145","Application Data"
"5.767927","54.38.73.16","172.18.0.2","TCP","2964","[TCP segment of a reassembled PDU]"
"5.768087","172.18.0.2","54.38.73.16","TCP","68","36876 → 21002 [ACK] Seq=15089 Ack=220635 Win=5564 Len=0 TSval=1075917897 TSecr=2673128616"
"5.778192","54.38.73.16","172.18.0.2","TLSv1.2","4412","Application Data [TCP segment of a reassembled PDU]"
"5.778228","172.18.0.2","54.38.73.16","TCP","68","36876 → 21002 [ACK] Seq=15089 Ack=224979 Win=5579 Len=0 TSval=1075917907 TSecr=2673128618"
"5.789728","54.38.73.16","172.18.0.2","TLSv1.2","2964","Application Data, Application Data"
"5.789780","172.18.0.2","54.38.73.16","TCP","68","36876 → 21002 [ACK] Seq=15089 Ack=227875 Win=5595 Len=0 TSval=1075917919 TSecr=2673128621"
"5.792981","54.38.73.16","172.18.0.2","TLSv1.2","906","Application Data"
"5.808677","54.38.73.16","172.18.0.2","TCP","1516","[TCP segment of a reassembled PDU]"
"5.808862","172.18.0.2","54.38.73.16","TCP","68","36876 → 21002 [ACK] Seq=15089 Ack=230161 Win=5593 Len=0 TSval=1075917938 TSecr=2673128622"
"5.819151","54.38.73.16","172.18.0.2","TLSv1.2","2964","Application Data [TCP segment of a reassembled PDU]"
"5.819191","172.18.0.2","54.38.73.16","TCP","68","36876 → 21002 [ACK] Seq=15089 Ack=233057 Win=5595 Len=0 TSval=1075917948 TSecr=2673128629"
"5.833267","54.38.73.16","172.18.0.2","TLSv1.2","922","Application Data"
"5.840739","172.18.0.2","54.38.73.16","TLSv1.2","611","Application Data"
"5.865175","54.38.73.16","172.18.0.2","TCP","68","21002 → 36876 [ACK] Seq=233911 Ack=15632 Win=1452 Len=0 TSval=2673128640 TSecr=1075917970"
"6.042939","54.38.73.16","172.18.0.2","TLSv1.2","611","Application Data"
"6.043995","172.18.0.2","54.38.73.16","TLSv1.2","611","Application Data"
"6.068090","54.38.73.16","172.18.0.2","TCP","68","21002 → 36876 [ACK] Seq=234454 Ack=16175 Win=1452 Len=0 TSval=2673128691 TSecr=1075918173"
"6.252131","54.38.73.16","172.18.0.2","TLSv1.2","611","Application Data"
"6.275213","54.38.73.16","172.18.0.2","TCP","2964","[TCP segment of a reassembled PDU]"
"6.275360","172.18.0.2","54.38.73.16","TCP","68","36876 → 21002 [ACK] Seq=16175 Ack=237893 Win=5595 Len=0 TSval=1075918404 TSecr=2673128737"
"6.283824","54.38.73.16","172.18.0.2","TLSv1.2","2964","Application Data [TCP segment of a reassembled PDU]"
"6.283878","172.18.0.2","54.38.73.16","TCP","68","36876 → 21002 [ACK] Seq=16175 Ack=240789 Win=5595 Len=0 TSval=1075918413 TSecr=2673128745"
"6.284196","54.38.73.16","172.18.0.2","TLSv1.2","4412","Application Data [TCP segment of a reassembled PDU]"
"6.284272","172.18.0.2","54.38.73.16","TCP","68","36876 → 21002 [ACK] Seq=16175 Ack=245133 Win=5563 Len=0 TSval=1075918413 TSecr=2673128745"
"6.294591","54.38.73.16","172.18.0.2","TLSv1.2","2964","Application Data [TCP segment of a reassembled PDU]"
"6.294626","172.18.0.2","54.38.73.16","TCP","68","36876 → 21002 [ACK] Seq=16175 Ack=248029 Win=5595 Len=0 TSval=1075918424 TSecr=2673128747"
"6.299090","54.38.73.16","172.18.0.2","TLSv1.2","2964","Application Data [TCP segment of a reassembled PDU]"
"6.299125","172.18.0.2","54.38.73.16","TCP","68","36876 → 21002 [ACK] Seq=16175 Ack=250925 Win=5595 Len=0 TSval=1075918428 TSecr=2673128749"
"6.308781","54.38.73.16","172.18.0.2","TCP","2964","21002 → 36876 [ACK] Seq=250925 Ack=16175 Win=1452 Len=2896 TSval=2673128751 TSecr=1075918413 [TCP segment of a reassembled PDU]"
"6.308817","172.18.0.2","54.38.73.16","TCP","68","36876 → 21002 [ACK] Seq=16175 Ack=253821 Win=5595 Len=0 TSval=1075918438 TSecr=2673128751"
"6.308990","54.38.73.16","172.18.0.2","TLSv1.2","5860","Application Data, Application Data"
"6.309069","172.18.0.2","54.38.73.16","TCP","68","36876 → 21002 [ACK] Seq=16175 Ack=259613 Win=5580 Len=0 TSval=1075918438 TSecr=2673128751"
"6.321560","54.38.73.16","172.18.0.2","TLSv1.2","2964","Application Data [TCP segment of a reassembled PDU]"
"6.321598","172.18.0.2","54.38.73.16","TCP","68","36876 → 21002 [ACK] Seq=16175 Ack=262509 Win=5595 Len=0 TSval=1075918451 TSecr=2673128754"
"6.322065","172.18.0.2","54.38.73.16","TLSv1.2","611","Application Data"
"6.322525","54.38.73.16","172.18.0.2","TCP","2964","21002 → 36876 [ACK] Seq=262509 Ack=16175 Win=1452 Len=2896 TSval=2673128755 TSecr=1075918428 [TCP segment of a reassembled PDU]"
"6.322555","172.18.0.2","54.38.73.16","TCP","68","36876 → 21002 [ACK] Seq=16718 Ack=265405 Win=5595 Len=0 TSval=1075918452 TSecr=2673128755"
"6.333590","54.38.73.16","172.18.0.2","TLSv1.2","8756","Application Data, Application Data, Application Data, Application Data"
"6.333767","172.18.0.2","54.38.73.16","TCP","68","36876 → 21002 [ACK] Seq=16718 Ack=274093 Win=5565 Len=0 TSval=1075918463 TSecr=2673128757"
"6.344904","54.38.73.16","172.18.0.2","TLSv1.2","5860","Application Data, Application Data"
"6.344943","172.18.0.2","54.38.73.16","TCP","68","36876 → 21002 [ACK] Seq=16718 Ack=279885 Win=5580 Len=0 TSval=1075918474 TSecr=2673128760"
"6.345455","54.38.73.16","172.18.0.2","TCP","68","21002 → 36876 [ACK] Seq=279885 Ack=16718 Win=1452 Len=0 TSval=2673128760 TSecr=1075918451"
"6.345498","172.18.0.2","54.38.73.16","TLSv1.2","611","Application Data"
"6.347126","54.38.73.16","172.18.0.2","TCP","2964","21002 → 36876 [ACK] Seq=279885 Ack=16718 Win=1452 Len=2896 TSval=2673128761 TSecr=1075918452 [TCP segment of a reassembled PDU]"
"6.347163","172.18.0.2","54.38.73.16","TCP","68","36876 → 21002 [ACK] Seq=17261 Ack=282781 Win=5595 Len=0 TSval=1075918476 TSecr=2673128761"
"6.357932","54.38.73.16","172.18.0.2","TLSv1.2","7308","Application Data, Application Data"
"6.358056","54.38.73.16","172.18.0.2","TLSv1.2","1516","Application Data [TCP segment of a reassembled PDU]"
"6.358130","172.18.0.2","54.38.73.16","TCP","68","36876 → 21002 [ACK] Seq=17261 Ack=291469 Win=5548 Len=0 TSval=1075918487 TSecr=2673128763"
"6.368390","54.38.73.16","172.18.0.2","TCP","1516","21002 → 36876 [ACK] Seq=291469 Ack=16718 Win=1452 Len=1448 TSval=2673128766 TSecr=1075918463 [TCP segment of a reassembled PDU]"
"6.369048","54.38.73.16","172.18.0.2","TLSv1.2","4412","Application Data, Application Data"
"6.369084","172.18.0.2","54.38.73.16","TCP","68","36876 → 21002 [ACK] Seq=17261 Ack=297261 Win=5579 Len=0 TSval=1075918498 TSecr=2673128766"
"6.370825","54.38.73.16","172.18.0.2","TLSv1.2","5860","Application Data [TCP segment of a reassembled PDU]"
"6.370872","172.18.0.2","54.38.73.16","TLSv1.2","611","Application Data"
"6.383039","54.38.73.16","172.18.0.2","TLSv1.2","8756","Application Data, Application Data, Application Data"
"6.383222","172.18.0.2","54.38.73.16","TCP","68","36876 → 21002 [ACK] Seq=17804 Ack=311741 Win=5565 Len=0 TSval=1075918512 TSecr=2673128770"
"6.393595","54.38.73.16","172.18.0.2","TLSv1.2","4718","Application Data, Application Data"
"6.393634","172.18.0.2","54.38.73.16","TCP","68","36876 → 21002 [ACK] Seq=17804 Ack=316391 Win=5585 Len=0 TSval=1075918523 TSecr=2673128772"
"6.434745","54.38.73.16","172.18.0.2","TCP","68","21002 → 36876 [ACK] Seq=316391 Ack=17804 Win=1452 Len=0 TSval=2673128783 TSecr=1075918500"
"6.434792","172.18.0.2","54.38.73.16","TLSv1.2","1154","Application Data, Application Data"
"6.498473","54.38.73.16","172.18.0.2","TCP","68","21002 → 36876 [ACK] Seq=316391 Ack=18890 Win=1452 Len=0 TSval=2673128799 TSecr=1075918564"
"6.737757","54.38.73.16","172.18.0.2","TLSv1.2","611","Application Data"
"6.738836","172.18.0.2","54.38.73.16","TLSv1.2","611","Application Data"
"6.763839","54.38.73.16","172.18.0.2","TCP","68","21002 → 36876 [ACK] Seq=316934 Ack=19433 Win=1452 Len=0 TSval=2673128865 TSecr=1075918868"
"7.062536","54.38.73.16","172.18.0.2","TLSv1.2","611","Application Data"
"7.062942","172.18.0.2","54.38.73.16","TLSv1.2","611","Application Data"
"7.081391","54.38.73.16","172.18.0.2","TLSv1.2","4412","Application Data"
"7.081648","172.18.0.2","54.38.73.16","TCP","68","36876 → 21002 [ACK] Seq=19976 Ack=321821 Win=5579 Len=0 TSval=1075919211 TSecr=2673128944"
"7.081937","54.38.73.16","172.18.0.2","TLSv1.2","5860","Application Data [TCP segment of a reassembled PDU]"
"7.082057","172.18.0.2","54.38.73.16","TCP","68","36876 → 21002 [ACK] Seq=19976 Ack=327613 Win=5548 Len=0 TSval=1075919211 TSecr=2673128944"
"7.086558","54.38.73.16","172.18.0.2","TLSv1.2","1327","Application Data"
"7.091742","54.38.73.16","172.18.0.2","TLSv1.2","4412","Application Data"
"7.091778","172.18.0.2","54.38.73.16","TCP","68","36876 → 21002 [ACK] Seq=19976 Ack=333216 Win=5579 Len=0 TSval=1075919221 TSecr=2673128946"
"7.105249","54.38.73.16","172.18.0.2","TCP","1516","21002 → 36876 [ACK] Seq=333216 Ack=19976 Win=1452 Len=1448 TSval=2673128950 TSecr=1075919211 [TCP segment of a reassembled PDU]"
"7.105694","54.38.73.16","172.18.0.2","TLSv1.2","4412","Application Data [TCP segment of a reassembled PDU]"
"7.105728","172.18.0.2","54.38.73.16","TCP","68","36876 → 21002 [ACK] Seq=19976 Ack=339008 Win=5579 Len=0 TSval=1075919235 TSecr=2673128950"
"7.106397","54.38.73.16","172.18.0.2","TLSv1.2","8756","Application Data, Application Data"
"7.106514","172.18.0.2","54.38.73.16","TCP","68","36876 → 21002 [ACK] Seq=19976 Ack=347696 Win=5565 Len=0 TSval=1075919235 TSecr=2673128950"
"7.107206","172.18.0.2","54.38.73.16","TLSv1.2","611","Application Data"
"7.116958","54.38.73.16","172.18.0.2","TLSv1.2","5860","Application Data, Application Data"
"7.116995","172.18.0.2","54.38.73.16","TCP","68","36876 → 21002 [ACK] Seq=20519 Ack=353488 Win=5580 Len=0 TSval=1075919246 TSecr=2673128953"
"7.129821","54.38.73.16","172.18.0.2","TCP","1516","21002 → 36876 [ACK] Seq=353488 Ack=19976 Win=1452 Len=1448 TSval=2673128956 TSecr=1075919235 [TCP segment of a reassembled PDU]"
"7.130749","54.38.73.16","172.18.0.2","TLSv1.2","13100","Application Data, Application Data, Application Data, Application Data, Application Data"
"7.130934","172.18.0.2","54.38.73.16","TCP","68","36876 → 21002 [ACK] Seq=20519 Ack=367968 Win=5534 Len=0 TSval=1075919260 TSecr=2673128956"
"7.141598","54.38.73.16","172.18.0.2","TLSv1.2","8756","Application Data, Application Data"
"7.141644","172.18.0.2","54.38.73.16","TCP","68","36876 → 21002 [ACK] Seq=20519 Ack=376656 Win=5565 Len=0 TSval=1075919271 TSecr=2673128959"
"7.142151","172.18.0.2","54.38.73.16","TLSv1.2","1125","Application Data"
"7.155294","54.38.73.16","172.18.0.2","TLSv1.2","14548","Application Data, Application Data, Application Data, Application Data, Application Data, Application Data, Application Data"
"7.155493","172.18.0.2","54.38.73.16","TCP","68","36876 → 21002 [ACK] Seq=21576 Ack=391136 Win=5518 Len=0 TSval=1075919284 TSecr=2673128963"
"7.166732","54.38.73.16","172.18.0.2","TLSv1.2","2149","Application Data"
"7.166769","172.18.0.2","54.38.73.16","TCP","68","36876 → 21002 [ACK] Seq=21576 Ack=393217 Win=5598 Len=0 TSval=1075919296 TSecr=2673128966"
"7.206360","54.38.73.16","172.18.0.2","TCP","68","21002 → 36876 [ACK] Seq=393217 Ack=21576 Win=1452 Len=0 TSval=2673128976 TSecr=1075919271"
"7.206404","172.18.0.2","54.38.73.16","TLSv1.2","611","Application Data"
"7.230880","54.38.73.16","172.18.0.2","TCP","68","21002 → 36876 [ACK] Seq=393217 Ack=22119 Win=1452 Len=0 TSval=2673128982 TSecr=1075919335"
"7.413112","54.38.73.16","172.18.0.2","TLSv1.2","611","Application Data"
"7.414236","172.18.0.2","54.38.73.16","TLSv1.2","611","Application Data"
"7.474820","54.38.73.16","172.18.0.2","TCP","68","21002 → 36876 [ACK] Seq=393760 Ack=22662 Win=1452 Len=0 TSval=2673129043 TSecr=1075919543"
"7.642393","54.38.73.16","172.18.0.2","TLSv1.2","611","Application Data"
"7.678027","54.38.73.16","172.18.0.2","TCP","2964","[TCP segment of a reassembled PDU]"
"7.678085","172.18.0.2","54.38.73.16","TCP","68","36876 → 21002 [ACK] Seq=22662 Ack=397199 Win=5595 Len=0 TSval=1075919807 TSecr=2673129084"
"7.688201","54.38.73.16","172.18.0.2","TLSv1.2","10204","Application Data, Application Data, Application Data"
"7.688393","172.18.0.2","54.38.73.16","TCP","68","36876 → 21002 [ACK] Seq=22662 Ack=407335 Win=5549 Len=0 TSval=1075919817 TSecr=2673129096"
"7.702953","54.38.73.16","172.18.0.2","TLSv1.2","8756","Application Data, Application Data, Application Data"
"7.702991","172.18.0.2","54.38.73.16","TCP","68","36876 → 21002 [ACK] Seq=22662 Ack=416023 Win=5565 Len=0 TSval=1075919832 TSecr=2673129099"
"7.712328","54.38.73.16","172.18.0.2","TLSv1.2","8756","Application Data, Application Data, Application Data"
"7.712372","172.18.0.2","54.38.73.16","TCP","68","36876 → 21002 [ACK] Seq=22662 Ack=424711 Win=5565 Len=0 TSval=1075919841 TSecr=2673129102"
"7.713121","172.18.0.2","54.38.73.16","TLSv1.2","611","Application Data"
"7.720340","54.38.73.16","172.18.0.2","TLSv1.2","1516","Application Data [TCP segment of a reassembled PDU]"
"7.727490","54.38.73.16","172.18.0.2","TCP","1516","21002 → 36876 [ACK] Seq=426159 Ack=22662 Win=1452 Len=1448 TSval=2673129106 TSecr=1075919832 [TCP segment of a reassembled PDU]"
"7.727525","172.18.0.2","54.38.73.16","TCP","68","36876 → 21002 [ACK] Seq=23205 Ack=427607 Win=5593 Len=0 TSval=1075919857 TSecr=2673129104"
"7.728238","54.38.73.16","172.18.0.2","TLSv1.2","8756","Application Data, Application Data, Application Data"
"7.728425","172.18.0.2","54.38.73.16","TCP","68","36876 → 21002 [ACK] Seq=23205 Ack=436295 Win=5565 Len=0 TSval=1075919857 TSecr=2673129106"
"7.736333","54.38.73.16","172.18.0.2","TLSv1.2","8756","Application Data, Application Data, Application Data"
"7.736375","172.18.0.2","54.38.73.16","TCP","68","36876 → 21002 [ACK] Seq=23205 Ack=444983 Win=5565 Len=0 TSval=1075919865 TSecr=2673129108"
"7.736971","54.38.73.16","172.18.0.2","TCP","68","21002 → 36876 [ACK] Seq=444983 Ack=23205 Win=1452 Len=0 TSval=2673129108 TSecr=1075919842"
"7.737010","172.18.0.2","54.38.73.16","TLSv1.2","611","Application Data"
"7.753050","54.38.73.16","172.18.0.2","TCP","2964","21002 → 36876 [ACK] Seq=444983 Ack=23205 Win=1452 Len=2896 TSval=2673129112 TSecr=1075919857 [TCP segment of a reassembled PDU]"
"7.753087","172.18.0.2","54.38.73.16","TCP","68","36876 → 21002 [ACK] Seq=23748 Ack=447879 Win=5595 Len=0 TSval=1075919882 TSecr=2673129112"
"7.753420","54.38.73.16","172.18.0.2","TLSv1.2","6667","Application Data, Application Data, Application Data"
"7.753628","172.18.0.2","54.38.73.16","TCP","68","36876 → 21002 [ACK] Seq=23748 Ack=454478 Win=5564 Len=0 TSval=1075919883 TSecr=2673129112"
"7.798399","54.38.73.16","172.18.0.2","TCP","68","21002 → 36876 [ACK] Seq=454478 Ack=23748 Win=1452 Len=0 TSval=2673129124 TSecr=1075919866"
"7.798443","172.18.0.2","54.38.73.16","TLSv1.2","1154","Application Data, Application Data"
"7.822737","54.38.73.16","172.18.0.2","TCP","68","21002 → 36876 [ACK] Seq=454478 Ack=24834 Win=1452 Len=0 TSval=2673129129 TSecr=1075919927"
"8.376222","54.38.73.16","172.18.0.2","TLSv1.2","611","Application Data"
"8.376255","54.38.73.16","172.18.0.2","TCP","611","[TCP Retransmission] 21002 → 36876 [PSH, ACK] Seq=454478 Ack=24834 Win=1452 Len=543 TSval=2673129259 TSecr=1075919927"
"8.376315","172.18.0.2","54.38.73.16","TCP","80","36876 → 21002 [ACK] Seq=24834 Ack=455021 Win=5608 Len=0 TSval=1075920505 TSecr=2673129259 SLE=454478 SRE=455021"
"8.377319","172.18.0.2","54.38.73.16","TLSv1.2","611","Application Data"
"8.401129","54.38.73.16","172.18.0.2","TCP","68","21002 → 36876 [ACK] Seq=455021 Ack=25377 Win=1452 Len=0 TSval=2673129274 TSecr=1075920506"
"8.597751","54.38.73.16","172.18.0.2","TLSv1.2","3695","Application Data"
"8.597779","172.18.0.2","54.38.73.16","TCP","68","36876 → 21002 [ACK] Seq=25377 Ack=458648 Win=5584 Len=0 TSval=1075920727 TSecr=2673129323"
"8.606458","54.38.73.16","172.18.0.2","TLSv1.2","10204","Application Data, Application Data"
"8.606482","172.18.0.2","54.38.73.16","TCP","68","36876 → 21002 [ACK] Seq=25377 Ack=468784 Win=5549 Len=0 TSval=1075920735 TSecr=2673129325"
"8.622360","54.38.73.16","172.18.0.2","TLSv1.2","2964","Application Data [TCP segment of a reassembled PDU]"
"8.622415","172.18.0.2","54.38.73.16","TCP","68","36876 → 21002 [ACK] Seq=25377 Ack=471680 Win=5595 Len=0 TSval=1075920751 TSecr=2673129329"
"8.630823","54.38.73.16","172.18.0.2","TCP","2964","21002 → 36876 [ACK] Seq=471680 Ack=25377 Win=1452 Len=2896 TSval=2673129332 TSecr=1075920735 [TCP segment of a reassembled PDU]"
"8.630859","172.18.0.2","54.38.73.16","TCP","68","36876 → 21002 [ACK] Seq=25377 Ack=474576 Win=5595 Len=0 TSval=1075920760 TSecr=2673129332"
"8.631217","54.38.73.16","172.18.0.2","TLSv1.2","7473","Application Data, Application Data, Application Data, Application Data"
"8.631265","172.18.0.2","54.38.73.16","TCP","68","36876 → 21002 [ACK] Seq=25377 Ack=481981 Win=5570 Len=0 TSval=1075920760 TSecr=2673129332"
"8.631915","172.18.0.2","54.38.73.16","TLSv1.2","611","Application Data"
"8.656244","54.38.73.16","172.18.0.2","TLSv1.2","1125","Application Data"
"8.656294","172.18.0.2","54.38.73.16","TCP","68","36876 → 21002 [ACK] Seq=25920 Ack=483038 Win=5603 Len=0 TSval=1075920785 TSecr=2673129338"
"8.656258","54.38.73.16","172.18.0.2","TCP","68","21002 → 36876 [ACK] Seq=483038 Ack=25920 Win=1452 Len=0 TSval=2673129338 TSecr=1075920761"
"8.656331","172.18.0.2","54.38.73.16","TLSv1.2","611","Application Data"
"8.680178","54.38.73.16","172.18.0.2","TCP","68","21002 → 36876 [ACK] Seq=483038 Ack=26463 Win=1452 Len=0 TSval=2673129344 TSecr=1075920785"
"8.680237","172.18.0.2","54.38.73.16","TLSv1.2","611","Application Data"
"8.703760","54.38.73.16","172.18.0.2","TCP","68","21002 → 36876 [ACK] Seq=483038 Ack=27006 Win=1452 Len=0 TSval=2673129350 TSecr=1075920809"
"9.000581","54.38.73.16","172.18.0.2","TLSv1.2","611","Application Data"
"9.001707","172.18.0.2","54.38.73.16","TLSv1.2","611","Application Data"
"9.026138","54.38.73.16","172.18.0.2","TCP","68","21002 → 36876 [ACK] Seq=483581 Ack=27549 Win=1452 Len=0 TSval=2673129430 TSecr=1075921131"
