_ws.col.Time,_ws.col.Source,_ws.col.Destination,_ws.col.Protocol,_ws.col.Length,_ws.col.Info
"0.000000","172.18.0.2","54.38.73.16","TLSv1.2","611","Application Data"
"0.025217","54.38.73.16","172.18.0.2","TCP","68","21002 → 36876 [ACK] Seq=1 Ack=544 Win=1452 Len=0 TSval=2675891555 TSecr=1086969547"
"0.858235","54.38.73.16","172.18.0.2","TLSv1.2","611","Application Data"
"0.859319","172.18.0.2","54.38.73.16","TCP","1516","[TCP segment of a reassembled PDU]"
"0.859433","172.18.0.2","54.38.73.16","TLSv1.2","705","Application Data"
"0.883460","54.38.73.16","172.18.0.2","TCP","68","21002 → 36876 [ACK] Seq=544 Ack=2629 Win=1446 Len=0 TSval=2675891769 TSecr=1086970406"
"1.371608","54.38.73.16","172.18.0.2","TLSv1.2","1639","Application Data"
"1.371786","172.18.0.2","54.38.73.16","TCP","68","36876 → 21002 [ACK] Seq=2629 Ack=2115 Win=5601 Len=0 TSval=1086970919 TSecr=2675891872"
"1.378401","172.18.0.2","54.38.73.16","TLSv1.2","611","Application Data"
"1.397399","54.38.73.16","172.18.0.2","TCP","191","[TCP Spurious Retransmission] 21002 → 36876 [PSH, ACK] Seq=1992 Ack=2629 Win=1452 Len=123 TSval=2675891898 TSecr=1086970406"
"1.397439","172.18.0.2","54.38.73.16","TCP","80","[TCP Dup ACK 8#1] 36876 → 21002 [ACK] Seq=3172 Ack=2115 Win=5612 Len=0 TSval=1086970945 TSecr=2675891898 SLE=1992 SRE=2115"
"1.401821","54.38.73.16","172.18.0.2","TCP","68","21002 → 36876 [ACK] Seq=2115 Ack=3172 Win=1452 Len=0 TSval=2675891899 TSecr=1086970926"
"1.987036","54.38.73.16","172.18.0.2","TLSv1.2","611","Application Data"
"1.987068","172.18.0.2","54.38.73.16","TCP","68","36876 → 21002 [ACK] Seq=3172 Ack=2658 Win=5608 Len=0 TSval=1086971534 TSecr=2675892010"
"1.987748","172.18.0.2","54.38.73.16","TLSv1.2","611","Application Data"
"2.012115","54.38.73.16","172.18.0.2","TCP","68","21002 → 36876 [ACK] Seq=2658 Ack=3715 Win=1452 Len=0 TSval=2675892051 TSecr=1086971535"
"2.496442","54.38.73.16","172.18.0.2","TLSv1.2","3695","Application Data"
"2.496487","172.18.0.2","54.38.73.16","TCP","68","36876 → 21002 [ACK] Seq=3715 Ack=6285 Win=5584 Len=0 TSval=1086972044 TSecr=2675892172"
"2.539018","54.38.73.16","172.18.0.2","TLSv1.2","3695","Application Data"
"2.539047","172.18.0.2","54.38.73.16","TCP","68","36876 → 21002 [ACK] Seq=3715 Ack=9912 Win=5580 Len=0 TSval=1086972086 TSecr=2675892183"
"2.548783","54.38.73.16","172.18.0.2","TLSv1.2","5860","Application Data"
"2.548818","172.18.0.2","54.38.73.16","TCP","68","36876 → 21002 [ACK] Seq=3715 Ack=15704 Win=5581 Len=0 TSval=1086972096 TSecr=2675892186"
"2.563788","54.38.73.16","172.18.0.2","TLSv1.2","2964","Application Data [TCP segment of a reassembled PDU]"
"2.563815","172.18.0.2","54.38.73.16","TCP","68","36876 → 21002 [ACK] Seq=3715 Ack=18600 Win=5596 Len=0 TSval=1086972111 TSecr=2675892189"
"2.564267","54.38.73.16","172.18.0.2","TLSv1.2","2964","Application Data [TCP segment of a reassembled PDU]"
"2.564309","172.18.0.2","54.38.73.16","TCP","68","36876 → 21002 [ACK] Seq=3715 Ack=21496 Win=5574 Len=0 TSval=1086972111 TSecr=2675892189"
"2.573301","54.38.73.16","172.18.0.2","TCP","2964","21002 → 36876 [ACK] Seq=21496 Ack=3715 Win=1452 Len=2896 TSval=2675892192 TSecr=1086972096 [TCP segment of a reassembled PDU]"
"2.573328","172.18.0.2","54.38.73.16","TCP","68","36876 → 21002 [ACK] Seq=3715 Ack=24392 Win=5596 Len=0 TSval=1086972121 TSecr=2675892192"
"2.573772","54.38.73.16","172.18.0.2","TLSv1.2","2964","Application Data, Application Data"
"2.573792","172.18.0.2","54.38.73.16","TCP","68","36876 → 21002 [ACK] Seq=3715 Ack=27288 Win=5596 Len=0 TSval=1086972121 TSecr=2675892192"
"2.589005","54.38.73.16","172.18.0.2","TLSv1.2","5860","Application Data, Application Data, Application Data"
"2.589036","172.18.0.2","54.38.73.16","TCP","68","36876 → 21002 [ACK] Seq=3715 Ack=33080 Win=5581 Len=0 TSval=1086972136 TSecr=2675892196"
"2.589454","172.18.0.2","54.38.73.16","TLSv1.2","611","Application Data"
"2.597606","54.38.73.16","172.18.0.2","TLSv1.2","5860","Application Data, Application Data"
"2.597634","172.18.0.2","54.38.73.16","TCP","68","36876 → 21002 [ACK] Seq=4258 Ack=38872 Win=5581 Len=0 TSval=1086972145 TSecr=2675892198"
"2.616673","54.38.73.16","172.18.0.2","TCP","68","[TCP Previous segment not captured] 21002 → 36876 [ACK] Seq=44664 Ack=4258 Win=1452 Len=0 TSval=2675892202 TSecr=1086972137"
"2.616702","54.38.73.16","172.18.0.2","TCP","5860","[TCP Retransmission] 21002 → 36876 [ACK] Seq=38872 Ack=3715 Win=1452 Len=5792 TSval=2675892202 TSecr=1086972136"
"2.616739","172.18.0.2","54.38.73.16","TCP","68","36876 → 21002 [ACK] Seq=4258 Ack=44664 Win=5581 Len=0 TSval=1086972164 TSecr=2675892202"
"2.623086","54.38.73.16","172.18.0.2","TLSv1.2","6871","Ignored Unknown Record"
"2.623131","172.18.0.2","54.38.73.16","TCP","68","36876 → 21002 [ACK] Seq=4258 Ack=51467 Win=5565 Len=0 TSval=1086972170 TSecr=2675892204"
"2.623549","172.18.0.2","54.38.73.16","TLSv1.2","611","Application Data"
"2.641988","54.38.73.16","172.18.0.2","TCP","2964","[TCP segment of a reassembled PDU]"
"2.642015","172.18.0.2","54.38.73.16","TCP","68","36876 → 21002 [ACK] Seq=4801 Ack=54363 Win=5596 Len=0 TSval=1086972189 TSecr=2675892209"
"2.648569","54.38.73.16","172.18.0.2","TLSv1.2","1342","Application Data, Application Data"
"2.670628","54.38.73.16","172.18.0.2","TCP","2964","[TCP segment of a reassembled PDU]"
"2.670655","172.18.0.2","54.38.73.16","TLSv1.2","611","Application Data"
"2.679135","54.38.73.16","172.18.0.2","TLSv1.2","8756","Application Data, Application Data"
"2.679256","172.18.0.2","54.38.73.16","TCP","68","36876 → 21002 [ACK] Seq=5344 Ack=67221 Win=5566 Len=0 TSval=1086972226 TSecr=2675892218"
"2.695076","54.38.73.16","172.18.0.2","TLSv1.2","2964","Application Data [TCP segment of a reassembled PDU]"
"2.695114","172.18.0.2","54.38.73.16","TCP","68","36876 → 21002 [ACK] Seq=5344 Ack=70117 Win=5596 Len=0 TSval=1086972242 TSecr=2675892222"
"2.700373","54.38.73.16","172.18.0.2","TLSv1.2","1516","Application Data [TCP segment of a reassembled PDU]"
"2.703014","54.38.73.16","172.18.0.2","TCP","2964","21002 → 36876 [ACK] Seq=71565 Ack=5344 Win=1452 Len=2896 TSval=2675892224 TSecr=1086972226 [TCP segment of a reassembled PDU]"
"2.703036","172.18.0.2","54.38.73.16","TCP","68","36876 → 21002 [ACK] Seq=5344 Ack=74461 Win=5596 Len=0 TSval=1086972250 TSecr=2675892224"
"2.703501","54.38.73.16","172.18.0.2","TLSv1.2","4412","Application Data, Application Data, Application Data"
"2.703576","172.18.0.2","54.38.73.16","TCP","68","36876 → 21002 [ACK] Seq=5344 Ack=78805 Win=5580 Len=0 TSval=1086972251 TSecr=2675892224"
"2.719915","54.38.73.16","172.18.0.2","TLSv1.2","1833","Application Data, Application Data"
"2.719940","172.18.0.2","54.38.73.16","TCP","68","36876 → 21002 [ACK] Seq=5344 Ack=80570 Win=5600 Len=0 TSval=1086972267 TSecr=2675892228"
"2.730701","172.18.0.2","54.38.73.16","TLSv1.2","611","Application Data"
"2.796242","54.38.73.16","172.18.0.2","TCP","68","21002 → 36876 [ACK] Seq=80570 Ack=5887 Win=1452 Len=0 TSval=2675892248 TSecr=1086972278"
"3.110673","54.38.73.16","172.18.0.2","TLSv1.2","611","Application Data"
"3.111571","172.18.0.2","54.38.73.16","TLSv1.2","611","Application Data"
"3.135786","54.38.73.16","172.18.0.2","TCP","68","21002 → 36876 [ACK] Seq=81113 Ack=6430 Win=1452 Len=0 TSval=2675892332 TSecr=1086972659"
"3.622117","54.38.73.16","172.18.0.2","TLSv1.2","4145","Application Data"
"3.622123","54.38.73.16","172.18.0.2","TCP","2964","[TCP segment of a reassembled PDU]"
"3.622126","54.38.73.16","172.18.0.2","TLSv1.2","4412","Application Data, Application Data"
"3.622130","54.38.73.16","172.18.0.2","TLSv1.2","1516","Application Data [TCP segment of a reassembled PDU]"
"3.622306","172.18.0.2","54.38.73.16","TCP","68","36876 → 21002 [ACK] Seq=6430 Ack=93878 Win=5534 Len=0 TSval=1086973169 TSecr=2675892419"
"3.646110","54.38.73.16","172.18.0.2","TCP","1516","21002 → 36876 [ACK] Seq=93878 Ack=6430 Win=1452 Len=1448 TSval=2675892460 TSecr=1086972659 [TCP segment of a reassembled PDU]"
"3.646726","54.38.73.16","172.18.0.2","TLSv1.2","392","Application Data"
"3.646756","172.18.0.2","54.38.73.16","TCP","68","36876 → 21002 [ACK] Seq=6430 Ack=95650 Win=5593 Len=0 TSval=1086973194 TSecr=2675892460"
"3.654989","172.18.0.2","54.38.73.16","TLSv1.2","611","Application Data"
"3.678939","54.38.73.16","172.18.0.2","TCP","68","21002 → 36876 [ACK] Seq=95650 Ack=6973 Win=1452 Len=0 TSval=2675892468 TSecr=1086973202"
"4.135497","54.38.73.16","172.18.0.2","TLSv1.2","611","Application Data"
"4.136437","172.18.0.2","54.38.73.16","TLSv1.2","611","Application Data"
"4.159750","54.38.73.16","172.18.0.2","TCP","68","21002 → 36876 [ACK] Seq=96193 Ack=7516 Win=1452 Len=0 TSval=2675892589 TSecr=1086973684"
"4.474379","54.38.73.16","172.18.0.2","TLSv1.2","3695","Application Data"
"4.474539","172.18.0.2","54.38.73.16","TCP","68","36876 → 21002 [ACK] Seq=7516 Ack=99820 Win=5584 Len=0 TSval=1086974022 TSecr=2675892667"
"4.483675","54.38.73.16","172.18.0.2","TCP","2964","[TCP segment of a reassembled PDU]"
"4.483696","172.18.0.2","54.38.73.16","TCP","68","36876 → 21002 [ACK] Seq=7516 Ack=102716 Win=5596 Len=0 TSval=1086974031 TSecr=2675892669"
"4.494358","54.38.73.16","172.18.0.2","TLSv1.2","7308","Application Data, Application Data"
"4.494478","172.18.0.2","54.38.73.16","TCP","68","36876 → 21002 [ACK] Seq=7516 Ack=109956 Win=5565 Len=0 TSval=1086974042 TSecr=2675892672"
"4.494794","172.18.0.2","54.38.73.16","TLSv1.2","611","Application Data"
"4.497451","54.38.73.16","172.18.0.2","TLSv1.2","1327","Application Data"
"4.518096","54.38.73.16","172.18.0.2","TCP","68","21002 → 36876 [ACK] Seq=111215 Ack=8059 Win=1452 Len=0 TSval=2675892678 TSecr=1086974042"
"4.526102","54.38.73.16","172.18.0.2","TLSv1.2","7308","Application Data, Application Data"
"4.526125","172.18.0.2","54.38.73.16","TCP","68","36876 → 21002 [ACK] Seq=8059 Ack=118455 Win=5565 Len=0 TSval=1086974073 TSecr=2675892673"
"4.535305","54.38.73.16","172.18.0.2","TLSv1.2","5860","Application Data, Application Data"
"4.535328","172.18.0.2","54.38.73.16","TCP","68","36876 → 21002 [ACK] Seq=8059 Ack=124247 Win=5581 Len=0 TSval=1086974083 TSecr=2675892682"
"4.535920","172.18.0.2","54.38.73.16","TLSv1.2","611","Application Data"
"4.549814","54.38.73.16","172.18.0.2","TLSv1.2","5200","Application Data, Application Data"
"4.549850","172.18.0.2","54.38.73.16","TCP","68","36876 → 21002 [ACK] Seq=8602 Ack=129379 Win=5583 Len=0 TSval=1086974097 TSecr=2675892686"
"4.579514","54.38.73.16","172.18.0.2","TLSv1.2","408","[TCP Previous segment not captured] , Ignored Unknown Record"
"4.579603","172.18.0.2","54.38.73.16","TCP","80","[TCP Window Update] 36876 → 21002 [ACK] Seq=8602 Ack=129379 Win=5593 Len=0 TSval=1086974127 TSecr=2675892686 SLE=133723 SRE=134063"
"4.579571","54.38.73.16","172.18.0.2","TCP","4412","[TCP Out-Of-Order] 21002 → 36876 [ACK] Seq=129379 Ack=8602 Win=1452 Len=4344 TSval=2675892690 TSecr=1086974083"
"4.579628","172.18.0.2","54.38.73.16","TCP","68","36876 → 21002 [ACK] Seq=8602 Ack=134063 Win=5564 Len=0 TSval=1086974127 TSecr=2675892690"
"4.579575","54.38.73.16","172.18.0.2","TLSv1.2","7308","Application Data"
"4.579701","172.18.0.2","54.38.73.16","TCP","68","36876 → 21002 [ACK] Seq=8602 Ack=141303 Win=5518 Len=0 TSval=1086974127 TSecr=2675892693"
"4.604691","54.38.73.16","172.18.0.2","TLSv1.2","1653","Application Data, Application Data"
"4.604712","172.18.0.2","54.38.73.16","TCP","68","36876 → 21002 [ACK] Seq=8602 Ack=142888 Win=5601 Len=0 TSval=1086974152 TSecr=2675892700"
"4.631709","54.38.73.16","172.18.0.2","TLSv1.2","3695","Application Data"
"4.631856","172.18.0.2","54.38.73.16","TCP","68","36876 → 21002 [ACK] Seq=8602 Ack=146515 Win=5580 Len=0 TSval=1086974179 TSecr=2675892706"
"4.632736","172.18.0.2","54.38.73.16","TLSv1.2","611","Application Data"
"4.672917","54.38.73.16","172.18.0.2","TLSv1.2","611","Application Data"
"4.672969","172.18.0.2","54.38.73.16","TLSv1.2","611","Application Data"
"4.736054","54.38.73.16","172.18.0.2","TCP","68","21002 → 36876 [ACK] Seq=147058 Ack=9688 Win=1452 Len=0 TSval=2675892733 TSecr=1086974220"
"4.953630","54.38.73.16","172.18.0.2","TLSv1.2","611","Application Data"
"4.954651","172.18.0.2","54.38.73.16","TLSv1.2","611","Application Data"
"4.978087","54.38.73.16","172.18.0.2","TCP","68","21002 → 36876 [ACK] Seq=147601 Ack=10231 Win=1452 Len=0 TSval=2675892793 TSecr=1086974502"
"5.312214","54.38.73.16","172.18.0.2","TLSv1.2","4145","Application Data"
"5.312220","54.38.73.16","172.18.0.2","TCP","2964","[TCP segment of a reassembled PDU]"
"5.312381","172.18.0.2","54.38.73.16","TCP","68","36876 → 21002 [ACK] Seq=10231 Ack=154574 Win=5566 Len=0 TSval=1086974860 TSecr=2675892876"
"5.321502","54.38.73.16","172.18.0.2","TLSv1.2","4412","Application Data [TCP segment of a reassembled PDU]"
"5.321536","172.18.0.2","54.38.73.16","TCP","68","36876 → 21002 [ACK] Seq=10231 Ack=158918 Win=5580 Len=0 TSval=1086974869 TSecr=2675892879"
"5.322036","172.18.0.2","54.38.73.16","TLSv1.2","611","Application Data"
"5.331108","54.38.73.16","172.18.0.2","TLSv1.2","2964","Application Data [TCP segment of a reassembled PDU]"
"5.331141","172.18.0.2","54.38.73.16","TCP","68","36876 → 21002 [ACK] Seq=10774 Ack=161814 Win=5596 Len=0 TSval=1086974878 TSecr=2675892881"
"5.336467","54.38.73.16","172.18.0.2","TLSv1.2","5860","Application Data, Application Data"
"5.336610","172.18.0.2","54.38.73.16","TCP","68","36876 → 21002 [ACK] Seq=10774 Ack=167606 Win=5581 Len=0 TSval=1086974884 TSecr=2675892883"
"5.345514","54.38.73.16","172.18.0.2","TLSv1.2","2853","Application Data"
"5.345549","172.18.0.2","54.38.73.16","TCP","68","36876 → 21002 [ACK] Seq=10774 Ack=170391 Win=5596 Len=0 TSval=1086974893 TSecr=2675892885"
"5.346101","54.38.73.16","172.18.0.2","TCP","68","21002 → 36876 [ACK] Seq=170391 Ack=10774 Win=1452 Len=0 TSval=2675892885 TSecr=1086974869"
"5.350975","54.38.73.16","172.18.0.2","TCP","2964","[TCP segment of a reassembled PDU]"
"5.351007","172.18.0.2","54.38.73.16","TCP","68","36876 → 21002 [ACK] Seq=10774 Ack=173287 Win=5596 Len=0 TSval=1086974898 TSecr=2675892886"
"5.355377","54.38.73.16","172.18.0.2","TLSv1.2","1516","Application Data [TCP segment of a reassembled PDU]"
"5.355903","172.18.0.2","54.38.73.16","TLSv1.2","611","Application Data"
"5.370943","54.38.73.16","172.18.0.2","TLSv1.2","922","Application Data"
"5.403067","54.38.73.16","172.18.0.2","TCP","2964","[TCP segment of a reassembled PDU]"
"5.403106","172.18.0.2","54.38.73.16","TCP","68","36876 → 21002 [ACK] Seq=11317 Ack=178485 Win=5596 Len=0 TSval=1086974950 TSecr=2675892891"
"5.413473","54.38.73.16","172.18.0.2","TLSv1.2","8756","Application Data, Application Data, Application Data"
"5.413620","172.18.0.2","54.38.73.16","TCP","68","36876 → 21002 [ACK] Seq=11317 Ack=187173 Win=5566 Len=0 TSval=1086974961 TSecr=2675892902"
"5.427907","54.38.73.16","172.18.0.2","TLSv1.2","1993","Application Data, Application Data"
"5.427942","172.18.0.2","54.38.73.16","TCP","68","36876 → 21002 [ACK] Seq=11317 Ack=189098 Win=5600 Len=0 TSval=1086974975 TSecr=2675892905"
"5.444438","54.38.73.16","172.18.0.2","TCP","2964","[TCP segment of a reassembled PDU]"
"5.444596","172.18.0.2","54.38.73.16","TCP","68","36876 → 21002 [ACK] Seq=11317 Ack=191994 Win=5596 Len=0 TSval=1086974992 TSecr=2675892909"
"5.451959","54.38.73.16","172.18.0.2","TLSv1.2","799","Application Data"
"5.461083","172.18.0.2","54.38.73.16","TLSv1.2","611","Application Data"
"5.528184","54.38.73.16","172.18.0.2","TCP","68","21002 → 36876 [ACK] Seq=192725 Ack=11860 Win=1452 Len=0 TSval=2675892931 TSecr=1086975008"
"5.772933","54.38.73.16","172.18.0.2","TLSv1.2","611","Application Data"
"5.773973","172.18.0.2","54.38.73.16","TLSv1.2","611","Application Data"
"5.798804","54.38.73.16","172.18.0.2","TCP","68","21002 → 36876 [ACK] Seq=193268 Ack=12403 Win=1452 Len=0 TSval=2675892998 TSecr=1086975321"
"6.026643","54.38.73.16","172.18.0.2","TLSv1.2","3695","Application Data"
"6.026801","172.18.0.2","54.38.73.16","TCP","68","36876 → 21002 [ACK] Seq=12403 Ack=196895 Win=5584 Len=0 TSval=1086975574 TSecr=2675893055"
"6.036659","54.38.73.16","172.18.0.2","TLSv1.2","10204","Application Data, Application Data"
"6.036807","172.18.0.2","54.38.73.16","TCP","68","36876 → 21002 [ACK] Seq=12403 Ack=207031 Win=5550 Len=0 TSval=1086975584 TSecr=2675893058"
"6.052600","54.38.73.16","172.18.0.2","TLSv1.2","2964","Application Data [TCP segment of a reassembled PDU]"
"6.052635","172.18.0.2","54.38.73.16","TCP","68","36876 → 21002 [ACK] Seq=12403 Ack=209927 Win=5596 Len=0 TSval=1086975600 TSecr=2675893062"
"6.053142","172.18.0.2","54.38.73.16","TLSv1.2","611","Application Data"
"6.062123","54.38.73.16","172.18.0.2","TLSv1.2","8756","Application Data, Application Data"
"6.062278","172.18.0.2","54.38.73.16","TCP","68","36876 → 21002 [ACK] Seq=12946 Ack=218615 Win=5566 Len=0 TSval=1086975609 TSecr=2675893064"
"6.062279","54.38.73.16","172.18.0.2","TLSv1.2","2964","Application Data [TCP segment of a reassembled PDU]"
"6.062614","172.18.0.2","54.38.73.16","TCP","68","36876 → 21002 [ACK] Seq=12946 Ack=221511 Win=5551 Len=0 TSval=1086975610 TSecr=2675893064"
"6.079050","54.38.73.16","172.18.0.2","TCP","68","[TCP Previous segment not captured] 21002 → 36876 [ACK] Seq=224407 Ack=12946 Win=1452 Len=0 TSval=2675893068 TSecr=1086975600"
"6.079119","172.18.0.2","54.38.73.16","TLSv1.2","611","Application Data"
"6.079081","54.38.73.16","172.18.0.2","TCP","2964","[TCP Retransmission] 21002 → 36876 [ACK] Seq=221511 Ack=12403 Win=1452 Len=2896 TSval=2675893068 TSecr=1086975600"
"6.079258","172.18.0.2","54.38.73.16","TCP","68","36876 → 21002 [ACK] Seq=13489 Ack=224407 Win=5596 Len=0 TSval=1086975626 TSecr=2675893068"
"6.086961","54.38.73.16","172.18.0.2","TLSv1.2","8756","Ignored Unknown Record"
"6.086966","54.38.73.16","172.18.0.2","TLSv1.2","3251","Ignored Unknown Record"
"6.087108","172.18.0.2","54.38.73.16","TCP","68","36876 → 21002 [ACK] Seq=13489 Ack=236278 Win=5535 Len=0 TSval=1086975634 TSecr=2675893070"
"6.104217","54.38.73.16","172.18.0.2","TCP","2964","[TCP segment of a reassembled PDU]"
"6.104256","172.18.0.2","54.38.73.16","TCP","68","36876 → 21002 [ACK] Seq=13489 Ack=239174 Win=5596 Len=0 TSval=1086975651 TSecr=2675893074"
"6.112107","54.38.73.16","172.18.0.2","TLSv1.2","5512","Application Data, Application Data, Application Data, Application Data"
"6.112252","172.18.0.2","54.38.73.16","TCP","68","36876 → 21002 [ACK] Seq=13489 Ack=244618 Win=5582 Len=0 TSval=1086975659 TSecr=2675893077"
"6.120253","54.38.73.16","172.18.0.2","TLSv1.2","5860","Application Data"
"6.120397","172.18.0.2","54.38.73.16","TCP","68","36876 → 21002 [ACK] Seq=13489 Ack=250410 Win=5581 Len=0 TSval=1086975668 TSecr=2675893078"
"6.120833","172.18.0.2","54.38.73.16","TLSv1.2","611","Application Data"
"6.130795","54.38.73.16","172.18.0.2","TLSv1.2","4412","Application Data [TCP segment of a reassembled PDU]"
"6.130943","172.18.0.2","54.38.73.16","TCP","68","36876 → 21002 [ACK] Seq=14032 Ack=254754 Win=5561 Len=0 TSval=1086975678 TSecr=2675893081"
"6.137015","54.38.73.16","172.18.0.2","TLSv1.2","1870","Application Data, Application Data"
"6.137047","172.18.0.2","54.38.73.16","TCP","68","36876 → 21002 [ACK] Seq=14032 Ack=256556 Win=5600 Len=0 TSval=1086975684 TSecr=2675893083"
"6.184586","54.38.73.16","172.18.0.2","TCP","68","21002 → 36876 [ACK] Seq=256556 Ack=14032 Win=1452 Len=0 TSval=2675893095 TSecr=1086975668"
"6.184631","172.18.0.2","54.38.73.16","TLSv1.2","611","Application Data"
"6.248872","54.38.73.16","172.18.0.2","TCP","68","21002 → 36876 [ACK] Seq=256556 Ack=14575 Win=1452 Len=0 TSval=2675893111 TSecr=1086975732"
"6.395031","54.38.73.16","172.18.0.2","TLSv1.2","611","Application Data"
"6.396112","172.18.0.2","54.38.73.16","TLSv1.2","611","Application Data"
"6.460237","54.38.73.16","172.18.0.2","TCP","68","21002 → 36876 [ACK] Seq=257099 Ack=15118 Win=1452 Len=0 TSval=2675893164 TSecr=1086975943"
"6.797030","54.38.73.16","172.18.0.2","TCP","1516","[TCP segment of a reassembled PDU]"
"6.797348","54.38.73.16","172.18.0.2","TLSv1.2","2697","Application Data"
"6.797353","54.38.73.16","172.18.0.2","TLSv1.2","7308","Application Data"
"6.797358","54.38.73.16","172.18.0.2","TLSv1.2","2964","Application Data [TCP segment of a reassembled PDU]"
"6.797466","172.18.0.2","54.38.73.16","TCP","68","36876 → 21002 [ACK] Seq=15118 Ack=271312 Win=5536 Len=0 TSval=1086976345 TSecr=2675893233"
"6.797947","172.18.0.2","54.38.73.16","TLSv1.2","611","Application Data"
"6.801536","54.38.73.16","172.18.0.2","TLSv1.2","1516","Application Data [TCP segment of a reassembled PDU]"
"6.822372","54.38.73.16","172.18.0.2","TCP","68","[TCP Previous segment not captured] 21002 → 36876 [ACK] Seq=287230 Ack=15661 Win=1452 Len=0 TSval=2675893254 TSecr=1086976345"
"6.822400","54.38.73.16","172.18.0.2","TCP","14538","[TCP Retransmission] 21002 → 36876 [PSH, ACK] Seq=272760 Ack=15118 Win=1452 Len=14470 TSval=2675893254 TSecr=1086976345"
"6.822451","172.18.0.2","54.38.73.16","TCP","68","36876 → 21002 [ACK] Seq=15661 Ack=287230 Win=5536 Len=0 TSval=1086976370 TSecr=2675893249"
"6.823530","172.18.0.2","54.38.73.16","TLSv1.2","611","Application Data"
"6.847445","54.38.73.16","172.18.0.2","TLSv1.2","12520","Application Data, Application Data, Application Data, Application Data"
"6.847617","172.18.0.2","54.38.73.16","TCP","68","36876 → 21002 [ACK] Seq=16204 Ack=299682 Win=5535 Len=0 TSval=1086976395 TSecr=2675893260"
"6.849939","54.38.73.16","172.18.0.2","TCP","2964","[TCP segment of a reassembled PDU]"
"6.849980","172.18.0.2","54.38.73.16","TCP","68","36876 → 21002 [ACK] Seq=16204 Ack=302578 Win=5596 Len=0 TSval=1086976397 TSecr=2675893261"
"6.872554","54.38.73.16","172.18.0.2","TLSv1.2","11652","Application Data, Application Data, Application Data"
"6.872707","172.18.0.2","54.38.73.16","TCP","68","36876 → 21002 [ACK] Seq=16204 Ack=314162 Win=5551 Len=0 TSval=1086976420 TSecr=2675893266"
"6.873702","172.18.0.2","54.38.73.16","TLSv1.2","1125","Application Data"
"6.874572","54.38.73.16","172.18.0.2","TLSv1.2","4295","Application Data, Application Data, Application Data, Application Data"
"6.874605","172.18.0.2","54.38.73.16","TCP","68","36876 → 21002 [ACK] Seq=17261 Ack=318389 Win=5580 Len=0 TSval=1086976422 TSecr=2675893267"
"6.897772","54.38.73.16","172.18.0.2","TCP","2964","[TCP segment of a reassembled PDU]"
"6.897806","172.18.0.2","54.38.73.16","TCP","68","36876 → 21002 [ACK] Seq=17261 Ack=321285 Win=5596 Len=0 TSval=1086976445 TSecr=2675893273"
"6.897962","54.38.73.16","172.18.0.2","TLSv1.2","1342","Application Data, Application Data"
"6.908433","172.18.0.2","54.38.73.16","TLSv1.2","611","Application Data"
"6.971558","54.38.73.16","172.18.0.2","TCP","68","21002 → 36876 [ACK] Seq=322559 Ack=17804 Win=1452 Len=0 TSval=2675893292 TSecr=1086976456"
"7.616739","54.38.73.16","172.18.0.2","TLSv1.2","611","Application Data"
"7.616751","54.38.73.16","172.18.0.2","TCP","611","[TCP Retransmission] 21002 → 36876 [PSH, ACK] Seq=322559 Ack=17804 Win=1452 Len=543 TSval=2675893417 TSecr=1086976456"
"7.616829","172.18.0.2","54.38.73.16","TCP","80","36876 → 21002 [ACK] Seq=17804 Ack=323102 Win=5608 Len=0 TSval=1086977164 TSecr=2675893417 SLE=322559 SRE=323102"
"7.617862","172.18.0.2","54.38.73.16","TLSv1.2","611","Application Data"
"7.644028","54.38.73.16","172.18.0.2","TCP","68","21002 → 36876 [ACK] Seq=323102 Ack=18347 Win=1452 Len=0 TSval=2675893459 TSecr=1086977165"
"8.128365","54.38.73.16","172.18.0.2","TLSv1.2","611","Application Data"
"8.128432","172.18.0.2","54.38.73.16","TCP","68","36876 → 21002 [ACK] Seq=18347 Ack=323645 Win=5608 Len=0 TSval=1086977676 TSecr=2675893570"
"8.128625","54.38.73.16","172.18.0.2","TLSv1.2","7308","Application Data"
"8.128663","172.18.0.2","54.38.73.16","TCP","68","36876 → 21002 [ACK] Seq=18347 Ack=330885 Win=5565 Len=0 TSval=1086977676 TSecr=2675893578"
"8.137633","54.38.73.16","172.18.0.2","TLSv1.2","5860","Application Data, Application Data"
"8.137666","172.18.0.2","54.38.73.16","TCP","68","36876 → 21002 [ACK] Seq=18347 Ack=336677 Win=5581 Len=0 TSval=1086977685 TSecr=2675893583"
"8.152259","54.38.73.16","172.18.0.2","TLSv1.2","5860","Application Data [TCP segment of a reassembled PDU]"
"8.152293","172.18.0.2","54.38.73.16","TCP","68","36876 → 21002 [ACK] Seq=18347 Ack=342469 Win=5581 Len=0 TSval=1086977699 TSecr=2675893587"
"8.161832","54.38.73.16","172.18.0.2","TLSv1.2","5860","Application Data, Application Data"
"8.161868","172.18.0.2","54.38.73.16","TCP","68","36876 → 21002 [ACK] Seq=18347 Ack=348261 Win=5564 Len=0 TSval=1086977709 TSecr=2675893589"
"8.176511","54.38.73.16","172.18.0.2","TLSv1.2","5860","Application Data, Application Data"
"8.176551","172.18.0.2","54.38.73.16","TCP","68","36876 → 21002 [ACK] Seq=18347 Ack=354053 Win=5581 Len=0 TSval=1086977724 TSecr=2675893593"
"8.177294","172.18.0.2","54.38.73.16","TLSv1.2","611","Application Data"
"8.185863","54.38.73.16","172.18.0.2","TLSv1.2","761","Application Data"
"8.185899","172.18.0.2","54.38.73.16","TCP","68","36876 → 21002 [ACK] Seq=18890 Ack=354746 Win=5593 Len=0 TSval=1086977733 TSecr=2675893595"
"8.202380","54.38.73.16","172.18.0.2","TCP","68","21002 → 36876 [ACK] Seq=354746 Ack=18890 Win=1452 Len=0 TSval=2675893599 TSecr=1086977724"
"8.231285","54.38.73.16","172.18.0.2","TLSv1.2","3695","Application Data"
"8.231318","172.18.0.2","54.38.73.16","TCP","68","36876 → 21002 [ACK] Seq=18890 Ack=358373 Win=5580 Len=0 TSval=1086977778 TSecr=2675893606"
"8.240859","54.38.73.16","172.18.0.2","TCP","2964","[TCP segment of a reassembled PDU]"
"8.240892","172.18.0.2","54.38.73.16","TCP","68","36876 → 21002 [ACK] Seq=18890 Ack=361269 Win=5596 Len=0 TSval=1086977788 TSecr=2675893609"
"8.241154","54.38.73.16","172.18.0.2","TLSv1.2","4412","Application Data [TCP segment of a reassembled PDU]"
"8.241176","172.18.0.2","54.38.73.16","TCP","68","36876 → 21002 [ACK] Seq=18890 Ack=365613 Win=5580 Len=0 TSval=1086977788 TSecr=2675893609"
"8.254389","54.38.73.16","172.18.0.2","TLSv1.2","1516","Application Data [TCP segment of a reassembled PDU]"
"8.254421","172.18.0.2","54.38.73.16","TCP","68","36876 → 21002 [ACK] Seq=18890 Ack=367061 Win=5593 Len=0 TSval=1086977802 TSecr=2675893612"
"8.254980","172.18.0.2","54.38.73.16","TLSv1.2","611","Application Data"
"8.255210","54.38.73.16","172.18.0.2","TLSv1.2","3318","Application Data, Application Data"
"8.255304","172.18.0.2","54.38.73.16","TCP","68","36876 → 21002 [ACK] Seq=19433 Ack=370311 Win=5580 Len=0 TSval=1086977802 TSecr=2675893612"
"8.284136","54.38.73.16","172.18.0.2","TLSv1.2","4145","Application Data"
"8.284180","172.18.0.2","54.38.73.16","TCP","68","36876 → 21002 [ACK] Seq=19433 Ack=374388 Win=5589 Len=0 TSval=1086977831 TSecr=2675893620"
"8.284142","54.38.73.16","172.18.0.2","TCP","1516","[TCP segment of a reassembled PDU]"
"8.284476","54.38.73.16","172.18.0.2","TLSv1.2","2964","Application Data [TCP segment of a reassembled PDU]"
"8.284665","172.18.0.2","54.38.73.16","TCP","68","36876 → 21002 [ACK] Seq=19433 Ack=378732 Win=5567 Len=0 TSval=1086977832 TSecr=2675893620"
"8.285178","172.18.0.2","54.38.73.16","TLSv1.2","611","Application Data"
"8.305176","54.38.73.16","172.18.0.2","TLSv1.2","4412","Application Data [TCP segment of a reassembled PDU]"
"8.305209","172.18.0.2","54.38.73.16","TCP","68","36876 → 21002 [ACK] Seq=19976 Ack=383076 Win=5580 Len=0 TSval=1086977852 TSecr=2675893625"
"8.308620","54.38.73.16","172.18.0.2","TLSv1.2","2964","Application Data [TCP segment of a reassembled PDU]"
"8.308659","172.18.0.2","54.38.73.16","TCP","68","36876 → 21002 [ACK] Seq=19976 Ack=385972 Win=5596 Len=0 TSval=1086977856 TSecr=2675893626"
"8.308625","54.38.73.16","172.18.0.2","TLSv1.2","5141","Application Data, Application Data"
"8.308782","172.18.0.2","54.38.73.16","TCP","68","36876 → 21002 [ACK] Seq=19976 Ack=391045 Win=5569 Len=0 TSval=1086977856 TSecr=2675893626"
"8.329555","54.38.73.16","172.18.0.2","TCP","2964","[TCP segment of a reassembled PDU]"
"8.329593","172.18.0.2","54.38.73.16","TCP","68","36876 → 21002 [ACK] Seq=19976 Ack=393941 Win=5596 Len=0 TSval=1086977877 TSecr=2675893631"
"8.331767","54.38.73.16","172.18.0.2","TLSv1.2","799","Application Data"
"8.335497","54.38.73.16","172.18.0.2","TCP","2964","[TCP segment of a reassembled PDU]"
"8.335530","172.18.0.2","54.38.73.16","TCP","68","36876 → 21002 [ACK] Seq=19976 Ack=397568 Win=5596 Len=0 TSval=1086977883 TSecr=2675893632"
"8.335890","54.38.73.16","172.18.0.2","TLSv1.2","4412","Application Data [TCP segment of a reassembled PDU]"
"8.336005","172.18.0.2","54.38.73.16","TCP","68","36876 → 21002 [ACK] Seq=19976 Ack=401912 Win=5580 Len=0 TSval=1086977883 TSecr=2675893632"
"8.360934","54.38.73.16","172.18.0.2","TLSv1.2","596","Application Data"
"8.361421","172.18.0.2","54.38.73.16","TLSv1.2","611","Application Data"
"8.402119","54.38.73.16","172.18.0.2","TLSv1.2","1125","Application Data"
"8.413042","172.18.0.2","54.38.73.16","TLSv1.2","611","Application Data"
"8.476554","54.38.73.16","172.18.0.2","TCP","68","21002 → 36876 [ACK] Seq=403497 Ack=21062 Win=1452 Len=0 TSval=2675893668 TSecr=1086977960"
"8.744771","54.38.73.16","172.18.0.2","TLSv1.2","611","Application Data"
"8.745851","172.18.0.2","54.38.73.16","TLSv1.2","611","Application Data"
"8.771274","54.38.73.16","172.18.0.2","TCP","68","21002 → 36876 [ACK] Seq=404040 Ack=21605 Win=1452 Len=0 TSval=2675893741 TSecr=1086978293"
"8.978153","54.38.73.16","172.18.0.2","TLSv1.2","4145","Application Data"
"8.978159","54.38.73.16","172.18.0.2","TLSv1.2","7308","Application Data"
"8.978319","172.18.0.2","54.38.73.16","TCP","68","36876 → 21002 [ACK] Seq=21605 Ack=415357 Win=5552 Len=0 TSval=1086978525 TSecr=2675893793"
"8.998828","54.38.73.16","172.18.0.2","TLSv1.2","1516","Application Data [TCP segment of a reassembled PDU]"
"9.002031","54.38.73.16","172.18.0.2","TLSv1.2","11652","Application Data, Application Data, Application Data"
"9.002175","172.18.0.2","54.38.73.16","TCP","68","36876 → 21002 [ACK] Seq=21605 Ack=428389 Win=5551 Len=0 TSval=1086978549 TSecr=2675893798"
"9.002629","172.18.0.2","54.38.73.16","TLSv1.2","611","Application Data"
"9.026794","54.38.73.16","172.18.0.2","TCP","68","[TCP Previous segment not captured] 21002 → 36876 [ACK] Seq=440853 Ack=22148 Win=1452 Len=0 TSval=2675893805 TSecr=1086978550"
"9.026814","54.38.73.16","172.18.0.2","TCP","12532","[TCP Retransmission] 21002 → 36876 [PSH, ACK] Seq=428389 Ack=21605 Win=1452 Len=12464 TSval=2675893805 TSecr=1086978549"
"9.026969","172.18.0.2","54.38.73.16","TCP","68","36876 → 21002 [ACK] Seq=22148 Ack=440853 Win=5546 Len=0 TSval=1086978574 TSecr=2675893805"
"9.027733","172.18.0.2","54.38.73.16","TLSv1.2","611","Application Data"
"9.051914","54.38.73.16","172.18.0.2","TLSv1.2","13063","Application Data, Application Data, Application Data, Application Data, Application Data"
"9.052072","172.18.0.2","54.38.73.16","TCP","68","36876 → 21002 [ACK] Seq=22691 Ack=453848 Win=5535 Len=0 TSval=1086978599 TSecr=2675893811"
"9.076390","54.38.73.16","172.18.0.2","TLSv1.2","13063","Application Data, Application Data, Application Data, Application Data, Application Data"
"9.076434","172.18.0.2","54.38.73.16","TCP","68","36876 → 21002 [ACK] Seq=22691 Ack=466843 Win=5535 Len=0 TSval=1086978624 TSecr=2675893817"
"9.076889","172.18.0.2","54.38.73.16","TLSv1.2","611","Application Data"
"9.102849","54.38.73.16","172.18.0.2","TLSv1.2","13063","Application Data, Application Data, Application Data, Application Data, Application Data"
"9.102909","172.18.0.2","54.38.73.16","TCP","68","36876 → 21002 [ACK] Seq=23234 Ack=479838 Win=5535 Len=0 TSval=1086978650 TSecr=2675893824"
"9.126349","54.38.73.16","172.18.0.2","TLSv1.2","611","Application Data"
"9.126396","172.18.0.2","54.38.73.16","TLSv1.2","1154","Application Data, Application Data"
"9.188975","54.38.73.16","172.18.0.2","TCP","68","21002 → 36876 [ACK] Seq=480381 Ack=24320 Win=1452 Len=0 TSval=2675893846 TSecr=1086978674"
"9.189018","172.18.0.2","54.38.73.16","TLSv1.2","611","Application Data"
"9.212689","54.38.73.16","172.18.0.2","TCP","68","21002 → 36876 [ACK] Seq=480381 Ack=24863 Win=1452 Len=0 TSval=2675893852 TSecr=1086978736"
"9.460337","54.38.73.16","172.18.0.2","TLSv1.2","611","Application Data"
"9.461426","172.18.0.2","54.38.73.16","TLSv1.2","611","Application Data"
"9.485690","54.38.73.16","172.18.0.2","TCP","68","21002 → 36876 [ACK] Seq=480924 Ack=25406 Win=1452 Len=0 TSval=2675893920 TSecr=1086979009"
"9.768872","54.38.73.16","172.18.0.2","TLSv1.2","611","Application Data"
"9.768903","54.38.73.16","172.18.0.2","TCP","2964","[TCP segment of a reassembled PDU]"
"9.769068","172.18.0.2","54.38.73.16","TCP","68","36876 → 21002 [ACK] Seq=25406 Ack=484363 Win=5586 Len=0 TSval=1086979316 TSecr=2675893987"
"9.775906","54.38.73.16","172.18.0.2","TLSv1.2","4412","Application Data [TCP segment of a reassembled PDU]"
"9.776047","172.18.0.2","54.38.73.16","TCP","68","36876 → 21002 [ACK] Seq=25406 Ack=488707 Win=5580 Len=0 TSval=1086979323 TSecr=2675893992"
"9.786285","54.38.73.16","172.18.0.2","TLSv1.2","2964","Application Data, Application Data"
"9.786320","172.18.0.2","54.38.73.16","TCP","68","36876 → 21002 [ACK] Seq=25406 Ack=491603 Win=5596 Len=0 TSval=1086979333 TSecr=2675893995"
"9.794226","54.38.73.16","172.18.0.2","TLSv1.2","1899","Application Data, Application Data"
"9.794259","172.18.0.2","54.38.73.16","TCP","68","36876 → 21002 [ACK] Seq=25406 Ack=493434 Win=5600 Len=0 TSval=1086979341 TSecr=2675893997"
"9.806029","54.38.73.16","172.18.0.2","TCP","2964","[TCP segment of a reassembled PDU]"
"9.806183","172.18.0.2","54.38.73.16","TCP","68","36876 → 21002 [ACK] Seq=25406 Ack=496330 Win=5596 Len=0 TSval=1086979353 TSecr=2675894000"
"9.815869","54.38.73.16","172.18.0.2","TLSv1.2","7308","Application Data, Application Data"
"9.816055","172.18.0.2","54.38.73.16","TCP","68","36876 → 21002 [ACK] Seq=25406 Ack=503570 Win=5565 Len=0 TSval=1086979363 TSecr=2675894002"
"9.819149","54.38.73.16","172.18.0.2","TLSv1.2","2964","Application Data [TCP segment of a reassembled PDU]"
"9.819185","172.18.0.2","54.38.73.16","TCP","68","36876 → 21002 [ACK] Seq=25406 Ack=506466 Win=5596 Len=0 TSval=1086979366 TSecr=2675894003"
"9.833468","54.38.73.16","172.18.0.2","TLSv1.2","2572","Application Data"
"9.833501","172.18.0.2","54.38.73.16","TCP","68","36876 → 21002 [ACK] Seq=25406 Ack=508970 Win=5597 Len=0 TSval=1086979381 TSecr=2675894006"
"9.833990","172.18.0.2","54.38.73.16","TLSv1.2","611","Application Data"
"9.842597","54.38.73.16","172.18.0.2","TLSv1.2","5860","Application Data"
"9.842747","172.18.0.2","54.38.73.16","TCP","68","36876 → 21002 [ACK] Seq=25949 Ack=514762 Win=5581 Len=0 TSval=1086979390 TSecr=2675894009"
"9.843440","54.38.73.16","172.18.0.2","TLSv1.2","2964","Application Data [TCP segment of a reassembled PDU]"
"9.843470","172.18.0.2","54.38.73.16","TCP","68","36876 → 21002 [ACK] Seq=25949 Ack=517658 Win=5596 Len=0 TSval=1086979391 TSecr=2675894009"
"9.857557","54.38.73.16","172.18.0.2","TCP","2964","21002 → 36876 [ACK] Seq=517658 Ack=25406 Win=1452 Len=2896 TSval=2675894013 TSecr=1086979381 [TCP segment of a reassembled PDU]"
"9.857590","172.18.0.2","54.38.73.16","TCP","68","36876 → 21002 [ACK] Seq=25949 Ack=520554 Win=5596 Len=0 TSval=1086979405 TSecr=2675894013"
"9.858710","54.38.73.16","172.18.0.2","TCP","68","21002 → 36876 [ACK] Seq=520554 Ack=25949 Win=1452 Len=0 TSval=2675894013 TSecr=1086979381"
"9.867530","54.38.73.16","172.18.0.2","TLSv1.2","2964","Application Data, Application Data"
"9.867564","172.18.0.2","54.38.73.16","TCP","68","36876 → 21002 [ACK] Seq=25949 Ack=523450 Win=5596 Len=0 TSval=1086979415 TSecr=2675894015"
"9.868169","54.38.73.16","172.18.0.2","TLSv1.2","5860","Application Data, Application Data"
"9.868184","54.38.73.16","172.18.0.2","TLSv1.2","2615","Application Data"
"9.868287","172.18.0.2","54.38.73.16","TCP","68","36876 → 21002 [ACK] Seq=25949 Ack=531789 Win=5567 Len=0 TSval=1086979415 TSecr=2675894015"
"9.868705","172.18.0.2","54.38.73.16","TLSv1.2","611","Application Data"
"9.883309","54.38.73.16","172.18.0.2","TCP","2964","[TCP segment of a reassembled PDU]"
"9.883363","172.18.0.2","54.38.73.16","TCP","68","36876 → 21002 [ACK] Seq=26492 Ack=534685 Win=5596 Len=0 TSval=1086979431 TSecr=2675894019"
"9.892573","54.38.73.16","172.18.0.2","TLSv1.2","502","[TCP Previous segment not captured] , Ignored Unknown Record"
"9.892622","172.18.0.2","54.38.73.16","TCP","80","[TCP Dup ACK 318#1] 36876 → 21002 [ACK] Seq=26492 Ack=534685 Win=5596 Len=0 TSval=1086979440 TSecr=2675894019 SLE=537581 SRE=538015"
"9.892588","54.38.73.16","172.18.0.2","TCP","2964","[TCP Out-Of-Order] 21002 → 36876 [ACK] Seq=534685 Ack=25949 Win=1452 Len=2896 TSval=2675894021 TSecr=1086979415"
"9.892657","172.18.0.2","54.38.73.16","TCP","68","36876 → 21002 [ACK] Seq=26492 Ack=538015 Win=5580 Len=0 TSval=1086979440 TSecr=2675894021"
"9.931872","54.38.73.16","172.18.0.2","TCP","68","21002 → 36876 [ACK] Seq=538015 Ack=26492 Win=1452 Len=0 TSval=2675894032 TSecr=1086979416"
"9.931901","172.18.0.2","54.38.73.16","TLSv1.2","1154","Application Data, Application Data"
"9.956453","54.38.73.16","172.18.0.2","TCP","68","21002 → 36876 [ACK] Seq=538015 Ack=27578 Win=1452 Len=0 TSval=2675894038 TSecr=1086979479"
"10.279095","54.38.73.16","172.18.0.2","TLSv1.2","611","Application Data"
"10.280257","172.18.0.2","54.38.73.16","TLSv1.2","611","Application Data"
"10.306972","54.38.73.16","172.18.0.2","TCP","68","21002 → 36876 [ACK] Seq=538558 Ack=28121 Win=1452 Len=0 TSval=2675894125 TSecr=1086979827"
"10.627289","54.38.73.16","172.18.0.2","TLSv1.2","3695","Application Data"
"10.627464","172.18.0.2","54.38.73.16","TCP","68","36876 → 21002 [ACK] Seq=28121 Ack=542185 Win=5584 Len=0 TSval=1086980175 TSecr=2675894205"
"10.637273","54.38.73.16","172.18.0.2","TCP","2964","[TCP segment of a reassembled PDU]"
"10.637310","172.18.0.2","54.38.73.16","TCP","68","36876 → 21002 [ACK] Seq=28121 Ack=545081 Win=5596 Len=0 TSval=1086980184 TSecr=2675894208"
"10.652706","54.38.73.16","172.18.0.2","TLSv1.2","799","Application Data"
"10.676193","54.38.73.16","172.18.0.2","TCP","2964","[TCP segment of a reassembled PDU]"
"10.676227","172.18.0.2","54.38.73.16","TCP","68","36876 → 21002 [ACK] Seq=28121 Ack=548708 Win=5596 Len=0 TSval=1086980223 TSecr=2675894211"
"10.676395","54.38.73.16","172.18.0.2","TLSv1.2","4412","Application Data [TCP segment of a reassembled PDU]"
"10.676477","172.18.0.2","54.38.73.16","TCP","68","36876 → 21002 [ACK] Seq=28121 Ack=553052 Win=5580 Len=0 TSval=1086980224 TSecr=2675894217"
"10.690111","54.38.73.16","172.18.0.2","TLSv1.2","5860","Application Data, Application Data, Application Data"
"10.690148","172.18.0.2","54.38.73.16","TCP","68","36876 → 21002 [ACK] Seq=28121 Ack=558844 Win=5581 Len=0 TSval=1086980237 TSecr=2675894221"
"10.700389","54.38.73.16","172.18.0.2","TCP","2964","21002 → 36876 [ACK] Seq=558844 Ack=28121 Win=1452 Len=2896 TSval=2675894224 TSecr=1086980223 [TCP segment of a reassembled PDU]"
"10.700431","172.18.0.2","54.38.73.16","TCP","68","36876 → 21002 [ACK] Seq=28121 Ack=561740 Win=5596 Len=0 TSval=1086980248 TSecr=2675894224"
"10.700396","54.38.73.16","172.18.0.2","TLSv1.2","1790","Application Data, Application Data"
"10.700560","172.18.0.2","54.38.73.16","TCP","68","36876 → 21002 [ACK] Seq=28121 Ack=563462 Win=5585 Len=0 TSval=1086980248 TSecr=2675894224"
"10.701876","54.38.73.16","172.18.0.2","TCP","2964","[TCP segment of a reassembled PDU]"
"10.701910","172.18.0.2","54.38.73.16","TCP","68","36876 → 21002 [ACK] Seq=28121 Ack=566358 Win=5596 Len=0 TSval=1086980249 TSecr=2675894224"
"10.727466","54.38.73.16","172.18.0.2","TLSv1.2","1342","Application Data, Application Data"
"10.727945","172.18.0.2","54.38.73.16","TLSv1.2","611","Application Data"
"10.754230","54.38.73.16","172.18.0.2","TCP","68","21002 → 36876 [ACK] Seq=567632 Ack=28664 Win=1452 Len=0 TSval=2675894237 TSecr=1086980275"
"10.754281","54.38.73.16","172.18.0.2","TLSv1.2","4145","Application Data"
"10.754285","54.38.73.16","172.18.0.2","TCP","2964","[TCP segment of a reassembled PDU]"
"10.754449","172.18.0.2","54.38.73.16","TCP","68","36876 → 21002 [ACK] Seq=28664 Ack=574605 Win=5564 Len=0 TSval=1086980302 TSecr=2675894237"
"10.775156","54.38.73.16","172.18.0.2","TLSv1.2","7308","Application Data, Application Data"
"10.775198","172.18.0.2","54.38.73.16","TCP","68","36876 → 21002 [ACK] Seq=28664 Ack=581845 Win=5565 Len=0 TSval=1086980322 TSecr=2675894242"
"10.775770","172.18.0.2","54.38.73.16","TLSv1.2","611","Application Data"
"10.779620","54.38.73.16","172.18.0.2","TLSv1.2","1420","Application Data, Application Data"
"10.808691","54.38.73.16","172.18.0.2","TCP","2964","[TCP segment of a reassembled PDU]"
"10.808731","172.18.0.2","54.38.73.16","TCP","68","36876 → 21002 [ACK] Seq=29207 Ack=586093 Win=5596 Len=0 TSval=1086980356 TSecr=2675894243"
"10.818448","54.38.73.16","172.18.0.2","TLSv1.2","5860","Application Data, Application Data"
"10.818592","172.18.0.2","54.38.73.16","TCP","68","36876 → 21002 [ACK] Seq=29207 Ack=591885 Win=5581 Len=0 TSval=1086980366 TSecr=2675894253"
"10.818730","54.38.73.16","172.18.0.2","TLSv1.2","4412","Application Data [TCP segment of a reassembled PDU]"
"10.818972","172.18.0.2","54.38.73.16","TCP","68","36876 → 21002 [ACK] Seq=29207 Ack=596229 Win=5550 Len=0 TSval=1086980366 TSecr=2675894253"
"10.819460","172.18.0.2","54.38.73.16","TLSv1.2","611","Application Data"
"10.834588","54.38.73.16","172.18.0.2","TLSv1.2","2964","Application Data [TCP segment of a reassembled PDU]"
"10.834655","172.18.0.2","54.38.73.16","TCP","68","36876 → 21002 [ACK] Seq=29750 Ack=599125 Win=5596 Len=0 TSval=1086980382 TSecr=2675894257"
"10.842957","54.38.73.16","172.18.0.2","TCP","1516","21002 → 36876 [ACK] Seq=599125 Ack=29207 Win=1452 Len=1448 TSval=2675894259 TSecr=1086980356 [TCP segment of a reassembled PDU]"
"10.843543","54.38.73.16","172.18.0.2","TLSv1.2","7596","Application Data, Application Data, Application Data, Application Data"
"10.843666","172.18.0.2","54.38.73.16","TCP","68","36876 → 21002 [ACK] Seq=29750 Ack=608101 Win=5570 Len=0 TSval=1086980391 TSecr=2675894259"
"10.880447","54.38.73.16","172.18.0.2","TCP","68","21002 → 36876 [ACK] Seq=608101 Ack=29750 Win=1452 Len=0 TSval=2675894269 TSecr=1086980367"
"10.880475","172.18.0.2","54.38.73.16","TLSv1.2","611","Application Data"
"10.944161","54.38.73.16","172.18.0.2","TCP","68","21002 → 36876 [ACK] Seq=608101 Ack=30293 Win=1452 Len=0 TSval=2675894285 TSecr=1086980428"
"11.201047","54.38.73.16","172.18.0.2","TLSv1.2","611","Application Data"
"11.202210","172.18.0.2","54.38.73.16","TLSv1.2","611","Application Data"
"11.226151","54.38.73.16","172.18.0.2","TCP","68","21002 → 36876 [ACK] Seq=608644 Ack=30836 Win=1452 Len=0 TSval=2675894355 TSecr=1086980749"
"11.471391","54.38.73.16","172.18.0.2","TLSv1.2","611","Application Data"
"11.501990","54.38.73.16","172.18.0.2","TCP","2964","[TCP segment of a reassembled PDU]"
"11.502144","172.18.0.2","54.38.73.16","TCP","68","36876 → 21002 [ACK] Seq=30836 Ack=612083 Win=5596 Len=0 TSval=1086981049 TSecr=2675894416"
"11.511437","54.38.73.16","172.18.0.2","TLSv1.2","4412","Application Data [TCP segment of a reassembled PDU]"
"11.511615","172.18.0.2","54.38.73.16","TCP","68","36876 → 21002 [ACK] Seq=30836 Ack=616427 Win=5580 Len=0 TSval=1086981059 TSecr=2675894426"
"11.511920","54.38.73.16","172.18.0.2","TLSv1.2","5860","Application Data, Application Data"
"11.512023","172.18.0.2","54.38.73.16","TCP","68","36876 → 21002 [ACK] Seq=30836 Ack=622219 Win=5550 Len=0 TSval=1086981059 TSecr=2675894426"
"11.526979","54.38.73.16","172.18.0.2","TLSv1.2","2964","Application Data [TCP segment of a reassembled PDU]"
"11.527011","172.18.0.2","54.38.73.16","TCP","68","36876 → 21002 [ACK] Seq=30836 Ack=625115 Win=5596 Len=0 TSval=1086981074 TSecr=2675894430"
"11.532677","54.38.73.16","172.18.0.2","TCP","1516","21002 → 36876 [ACK] Seq=625115 Ack=30836 Win=1452 Len=1448 TSval=2675894432 TSecr=1086981049 [TCP segment of a reassembled PDU]"
"11.535602","54.38.73.16","172.18.0.2","TLSv1.2","4412","Application Data, Application Data"
"11.535746","172.18.0.2","54.38.73.16","TCP","68","36876 → 21002 [ACK] Seq=30836 Ack=630907 Win=5580 Len=0 TSval=1086981083 TSecr=2675894432"
"11.536192","172.18.0.2","54.38.73.16","TLSv1.2","611","Application Data"
"11.536540","54.38.73.16","172.18.0.2","TLSv1.2","5308","Application Data, Application Data"
"11.536583","172.18.0.2","54.38.73.16","TCP","68","36876 → 21002 [ACK] Seq=31379 Ack=636147 Win=5583 Len=0 TSval=1086981084 TSecr=2675894433"
"11.551581","54.38.73.16","172.18.0.2","TCP","2964","[TCP segment of a reassembled PDU]"
"11.551614","172.18.0.2","54.38.73.16","TCP","68","36876 → 21002 [ACK] Seq=31379 Ack=639043 Win=5596 Len=0 TSval=1086981099 TSecr=2675894436"
"11.560245","54.38.73.16","172.18.0.2","TCP","68","[TCP Previous segment not captured] 21002 → 36876 [ACK] Seq=644835 Ack=31379 Win=1452 Len=0 TSval=2675894439 TSecr=1086981083"
"11.560340","172.18.0.2","54.38.73.16","TLSv1.2","611","Application Data"
"11.560296","54.38.73.16","172.18.0.2","TCP","5860","[TCP Retransmission] 21002 → 36876 [ACK] Seq=639043 Ack=30836 Win=1452 Len=5792 TSval=2675894439 TSecr=1086981083"
"11.560300","54.38.73.16","172.18.0.2","TLSv1.2","5860","Ignored Unknown Record"
"11.560479","172.18.0.2","54.38.73.16","TCP","68","36876 → 21002 [ACK] Seq=31922 Ack=650627 Win=5542 Len=0 TSval=1086981108 TSecr=2675894439"
"11.575893","54.38.73.16","172.18.0.2","TLSv1.2","1516","Ignored Unknown Record"
"11.576998","54.38.73.16","172.18.0.2","TLSv1.2","1516","Ignored Unknown Record"
"11.577030","172.18.0.2","54.38.73.16","TCP","68","36876 → 21002 [ACK] Seq=31922 Ack=653523 Win=5593 Len=0 TSval=1086981124 TSecr=2675894443"
"11.584654","54.38.73.16","172.18.0.2","TLSv1.2","4412","Ignored Unknown Record"
"11.584808","172.18.0.2","54.38.73.16","TCP","68","36876 → 21002 [ACK] Seq=31922 Ack=657867 Win=5580 Len=0 TSval=1086981132 TSecr=2675894445"
"11.584819","54.38.73.16","172.18.0.2","TLSv1.2","2224","Ignored Unknown Record"
"11.585207","172.18.0.2","54.38.73.16","TCP","68","36876 → 21002 [ACK] Seq=31922 Ack=660023 Win=5568 Len=0 TSval=1086981132 TSecr=2675894445"
"11.585684","54.38.73.16","172.18.0.2","TCP","1516","[TCP segment of a reassembled PDU]"
"11.586410","54.38.73.16","172.18.0.2","TLSv1.2","4412","Application Data [TCP segment of a reassembled PDU]"
"11.586435","172.18.0.2","54.38.73.16","TCP","68","36876 → 21002 [ACK] Seq=31922 Ack=665815 Win=5580 Len=0 TSval=1086981134 TSecr=2675894445"
"11.586846","172.18.0.2","54.38.73.16","TLSv1.2","611","Application Data"
"11.600315","54.38.73.16","172.18.0.2","TCP","1516","21002 → 36876 [ACK] Seq=665815 Ack=31922 Win=1452 Len=1448 TSval=2675894449 TSecr=1086981124 [TCP segment of a reassembled PDU]"
"11.609910","54.38.73.16","172.18.0.2","TLSv1.2","1139","Application Data, Application Data"
"11.609945","172.18.0.2","54.38.73.16","TCP","68","36876 → 21002 [ACK] Seq=32465 Ack=668334 Win=5593 Len=0 TSval=1086981157 TSecr=2675894449"
"11.631656","54.38.73.16","172.18.0.2","TCP","2964","[TCP segment of a reassembled PDU]"
"11.631695","172.18.0.2","54.38.73.16","TCP","68","36876 → 21002 [ACK] Seq=32465 Ack=671230 Win=5596 Len=0 TSval=1086981179 TSecr=2675894456"
"11.633967","54.38.73.16","172.18.0.2","TLSv1.2","799","Application Data"
"11.640218","54.38.73.16","172.18.0.2","TLSv1.2","5860","Application Data"
"11.640359","54.38.73.16","172.18.0.2","TCP","1516","21002 → 36876 [ACK] Seq=677753 Ack=32465 Win=1452 Len=1448 TSval=2675894459 TSecr=1086981157 [TCP segment of a reassembled PDU]"
"11.640375","172.18.0.2","54.38.73.16","TCP","68","36876 → 21002 [ACK] Seq=32465 Ack=677753 Win=5581 Len=0 TSval=1086981188 TSecr=2675894457"
"11.663935","54.38.73.16","172.18.0.2","TLSv1.2","596","Application Data"
"11.663971","172.18.0.2","54.38.73.16","TCP","68","36876 → 21002 [ACK] Seq=32465 Ack=679729 Win=5593 Len=0 TSval=1086981211 TSecr=2675894459"
"11.664487","172.18.0.2","54.38.73.16","TLSv1.2","611","Application Data"
"11.683397","54.38.73.16","172.18.0.2","TCP","1516","[TCP segment of a reassembled PDU]"
"11.687522","54.38.73.16","172.18.0.2","TLSv1.2","1219","Application Data"
"11.687676","172.18.0.2","54.38.73.16","TCP","68","36876 → 21002 [ACK] Seq=33008 Ack=682328 Win=5612 Len=0 TSval=1086981235 TSecr=2675894469"
"11.723477","54.38.73.16","172.18.0.2","TCP","68","21002 → 36876 [ACK] Seq=682328 Ack=33008 Win=1452 Len=0 TSval=2675894480 TSecr=1086981212"
"11.723520","172.18.0.2","54.38.73.16","TLSv1.2","611","Application Data"
"11.783629","54.38.73.16","172.18.0.2","TCP","68","21002 → 36876 [ACK] Seq=682328 Ack=33551 Win=1452 Len=0 TSval=2675894495 TSecr=1086981271"
