_ws.col.Time,_ws.col.Source,_ws.col.Destination,_ws.col.Protocol,_ws.col.Length,_ws.col.Info
"0.000000","172.18.0.2","54.38.73.16","TLSv1.2","611","Application Data"
"0.023711","54.38.73.16","172.18.0.2","TCP","68","21002 → 36876 [ACK] Seq=1 Ack=544 Win=1452 Len=0 TSval=2674299959 TSecr=1080603208"
"0.303649","54.38.73.16","172.18.0.2","TLSv1.2","611","Application Data"
"0.304780","172.18.0.2","54.38.73.16","TCP","1516","[TCP segment of a reassembled PDU]"
"0.304864","172.18.0.2","54.38.73.16","TLSv1.2","705","Application Data"
"0.330293","54.38.73.16","172.18.0.2","TCP","68","21002 → 36876 [ACK] Seq=544 Ack=2629 Win=1448 Len=0 TSval=2674300035 TSecr=1080603513"
"0.713224","54.38.73.16","172.18.0.2","TLSv1.2","611","Application Data"
"0.754170","172.18.0.2","54.38.73.16","TCP","68","36876 → 21002 [ACK] Seq=2629 Ack=1087 Win=5612 Len=0 TSval=1080603963 TSecr=2674300119"
"0.777937","54.38.73.16","172.18.0.2","TLSv1.2","1125","Application Data"
"0.777982","172.18.0.2","54.38.73.16","TCP","68","36876 → 21002 [ACK] Seq=2629 Ack=2144 Win=5604 Len=0 TSval=1080603986 TSecr=2674300147"
"0.784287","172.18.0.2","54.38.73.16","TLSv1.2","611","Application Data"
"0.807898","54.38.73.16","172.18.0.2","TCP","68","21002 → 36876 [ACK] Seq=2144 Ack=3172 Win=1452 Len=0 TSval=2674300155 TSecr=1080603993"
"1.002444","54.38.73.16","172.18.0.2","TLSv1.2","611","Application Data"
"1.002469","172.18.0.2","54.38.73.16","TCP","68","36876 → 21002 [ACK] Seq=3172 Ack=2687 Win=5608 Len=0 TSval=1080604211 TSecr=2674300203"
"1.003516","172.18.0.2","54.38.73.16","TLSv1.2","611","Application Data"
"1.027339","54.38.73.16","172.18.0.2","TCP","68","21002 → 36876 [ACK] Seq=2687 Ack=3715 Win=1452 Len=0 TSval=2674300210 TSecr=1080604212"
"1.244343","54.38.73.16","172.18.0.2","TLSv1.2","3695","Application Data"
"1.244399","172.18.0.2","54.38.73.16","TCP","68","36876 → 21002 [ACK] Seq=3715 Ack=6314 Win=5584 Len=0 TSval=1080604453 TSecr=2674300263"
"1.253518","54.38.73.16","172.18.0.2","TLSv1.2","7308","Application Data"
"1.253545","172.18.0.2","54.38.73.16","TCP","68","36876 → 21002 [ACK] Seq=3715 Ack=13554 Win=5564 Len=0 TSval=1080604462 TSecr=2674300266"
"1.254004","172.18.0.2","54.38.73.16","TLSv1.2","611","Application Data"
"1.263596","54.38.73.16","172.18.0.2","TLSv1.2","1516","Application Data [TCP segment of a reassembled PDU]"
"1.269746","54.38.73.16","172.18.0.2","TLSv1.2","1233","Application Data"
"1.269771","172.18.0.2","54.38.73.16","TCP","68","36876 → 21002 [ACK] Seq=4258 Ack=16167 Win=5593 Len=0 TSval=1080604478 TSecr=2674300269"
"1.274730","54.38.73.16","172.18.0.2","TCP","1516","[TCP segment of a reassembled PDU]"
"1.278687","54.38.73.16","172.18.0.2","TCP","68","21002 → 36876 [ACK] Seq=17615 Ack=4258 Win=1452 Len=0 TSval=2674300272 TSecr=1080604462"
"1.285292","54.38.73.16","172.18.0.2","TLSv1.2","2964","Application Data [TCP segment of a reassembled PDU]"
"1.285316","172.18.0.2","54.38.73.16","TCP","68","36876 → 21002 [ACK] Seq=4258 Ack=20511 Win=5595 Len=0 TSval=1080604494 TSecr=2674300271"
"1.296247","54.38.73.16","172.18.0.2","TLSv1.2","1436","Application Data"
"1.303650","172.18.0.2","54.38.73.16","TLSv1.2","611","Application Data"
"1.367427","54.38.73.16","172.18.0.2","TCP","68","21002 → 36876 [ACK] Seq=21879 Ack=4801 Win=1452 Len=0 TSval=2674300295 TSecr=1080604512"
"1.635118","54.38.73.16","172.18.0.2","TLSv1.2","611","Application Data"
"1.636208","172.18.0.2","54.38.73.16","TLSv1.2","611","Application Data"
"1.660422","54.38.73.16","172.18.0.2","TCP","68","21002 → 36876 [ACK] Seq=22422 Ack=5344 Win=1452 Len=0 TSval=2674300368 TSecr=1080604845"
"1.862081","54.38.73.16","172.18.0.2","TLSv1.2","3695","Application Data"
"1.862234","172.18.0.2","54.38.73.16","TCP","68","36876 → 21002 [ACK] Seq=5344 Ack=26049 Win=5584 Len=0 TSval=1080605071 TSecr=2674300418"
"1.883559","54.38.73.16","172.18.0.2","TCP","2964","[TCP segment of a reassembled PDU]"
"1.883608","172.18.0.2","54.38.73.16","TCP","68","36876 → 21002 [ACK] Seq=5344 Ack=28945 Win=5595 Len=0 TSval=1080605092 TSecr=2674300424"
"1.885814","54.38.73.16","172.18.0.2","TLSv1.2","799","Application Data"
"1.893729","54.38.73.16","172.18.0.2","TLSv1.2","4412","Application Data"
"1.893871","172.18.0.2","54.38.73.16","TCP","68","36876 → 21002 [ACK] Seq=5344 Ack=34020 Win=5579 Len=0 TSval=1080605102 TSecr=2674300424"
"1.904787","54.38.73.16","172.18.0.2","TLSv1.2","4412","Application Data [TCP segment of a reassembled PDU]"
"1.904816","172.18.0.2","54.38.73.16","TCP","68","36876 → 21002 [ACK] Seq=5344 Ack=38364 Win=5579 Len=0 TSval=1080605113 TSecr=2674300429"
"1.918637","54.38.73.16","172.18.0.2","TLSv1.2","234","Application Data, Application Data"
"1.927661","54.38.73.16","172.18.0.2","TLSv1.2","10204","Application Data, Application Data"
"1.927806","172.18.0.2","54.38.73.16","TCP","68","36876 → 21002 [ACK] Seq=5344 Ack=48666 Win=5549 Len=0 TSval=1080605136 TSecr=2674300432"
"1.928885","54.38.73.16","172.18.0.2","TCP","1516","21002 → 36876 [ACK] Seq=48666 Ack=5344 Win=1452 Len=1448 TSval=2674300435 TSecr=1080605113 [TCP segment of a reassembled PDU]"
"1.937937","54.38.73.16","172.18.0.2","TLSv1.2","2964","Application Data [TCP segment of a reassembled PDU]"
"1.937964","172.18.0.2","54.38.73.16","TCP","68","36876 → 21002 [ACK] Seq=5344 Ack=53010 Win=5595 Len=0 TSval=1080605146 TSecr=2674300435"
"1.938467","172.18.0.2","54.38.73.16","TLSv1.2","611","Application Data"
"1.953157","54.38.73.16","172.18.0.2","TLSv1.2","11652","Application Data, Application Data, Application Data"
"1.953300","172.18.0.2","54.38.73.16","TCP","68","36876 → 21002 [ACK] Seq=5887 Ack=64594 Win=5550 Len=0 TSval=1080605162 TSecr=2674300441"
"1.962762","54.38.73.16","172.18.0.2","TCP","68","[TCP Previous segment not captured] 21002 → 36876 [ACK] Seq=67490 Ack=5887 Win=1452 Len=0 TSval=2674300443 TSecr=1080605147"
"1.962794","172.18.0.2","54.38.73.16","TLSv1.2","611","Application Data"
"1.962802","54.38.73.16","172.18.0.2","TCP","2964","[TCP Retransmission] 21002 → 36876 [ACK] Seq=64594 Ack=5344 Win=1452 Len=2896 TSval=2674300443 TSecr=1080605146"
"1.962975","172.18.0.2","54.38.73.16","TCP","68","36876 → 21002 [ACK] Seq=6430 Ack=67490 Win=5595 Len=0 TSval=1080605171 TSecr=2674300443"
"1.971204","54.38.73.16","172.18.0.2","TLSv1.2","1516","Ignored Unknown Record"
"1.978241","54.38.73.16","172.18.0.2","TCP","11700","21002 → 36876 [PSH, ACK] Seq=68938 Ack=5887 Win=1452 Len=11632 TSval=2674300447 TSecr=1080605162"
"1.978412","172.18.0.2","54.38.73.16","TCP","68","36876 → 21002 [ACK] Seq=6430 Ack=80570 Win=5547 Len=0 TSval=1080605187 TSecr=2674300445"
"2.027740","54.38.73.16","172.18.0.2","TCP","68","21002 → 36876 [ACK] Seq=80570 Ack=6430 Win=1452 Len=0 TSval=2674300460 TSecr=1080605171"
"2.027770","172.18.0.2","54.38.73.16","TLSv1.2","1154","Application Data, Application Data"
"2.052773","54.38.73.16","172.18.0.2","TCP","68","21002 → 36876 [ACK] Seq=80570 Ack=7516 Win=1452 Len=0 TSval=2674300466 TSecr=1080605236"
"2.658793","54.38.73.16","172.18.0.2","TLSv1.2","611","Application Data"
"2.659825","172.18.0.2","54.38.73.16","TLSv1.2","611","Application Data"
"2.684644","54.38.73.16","172.18.0.2","TCP","68","21002 → 36876 [ACK] Seq=81113 Ack=8059 Win=1452 Len=0 TSval=2674300624 TSecr=1080605868"
"3.062700","54.38.73.16","172.18.0.2","TLSv1.2","4145","Application Data"
"3.062735","54.38.73.16","172.18.0.2","TLSv1.2","7308","Application Data"
"3.062839","172.18.0.2","54.38.73.16","TCP","68","36876 → 21002 [ACK] Seq=8059 Ack=92430 Win=5550 Len=0 TSval=1080606271 TSecr=2674300718"
"3.072598","54.38.73.16","172.18.0.2","TLSv1.2","2964","Application Data [TCP segment of a reassembled PDU]"
"3.072658","172.18.0.2","54.38.73.16","TCP","68","36876 → 21002 [ACK] Seq=8059 Ack=95326 Win=5595 Len=0 TSval=1080606281 TSecr=2674300721"
"3.087233","54.38.73.16","172.18.0.2","TLSv1.2","8756","Application Data, Application Data"
"3.087375","172.18.0.2","54.38.73.16","TCP","68","36876 → 21002 [ACK] Seq=8059 Ack=104014 Win=5565 Len=0 TSval=1080606296 TSecr=2674300724"
"3.087434","54.38.73.16","172.18.0.2","TLSv1.2","3070","Application Data, Application Data"
"3.087750","172.18.0.2","54.38.73.16","TCP","68","36876 → 21002 [ACK] Seq=8059 Ack=107016 Win=5542 Len=0 TSval=1080606296 TSecr=2674300724"
"3.088705","172.18.0.2","54.38.73.16","TLSv1.2","611","Application Data"
"3.111945","54.38.73.16","172.18.0.2","TCP","68","21002 → 36876 [ACK] Seq=107016 Ack=8602 Win=1452 Len=0 TSval=2674300731 TSecr=1080606297"
"3.116576","54.38.73.16","172.18.0.2","TLSv1.2","3695","Application Data"
"3.116725","172.18.0.2","54.38.73.16","TCP","68","36876 → 21002 [ACK] Seq=8602 Ack=110643 Win=5584 Len=0 TSval=1080606325 TSecr=2674300732"
"3.125762","54.38.73.16","172.18.0.2","TLSv1.2","7308","Application Data"
"3.125904","172.18.0.2","54.38.73.16","TCP","68","36876 → 21002 [ACK] Seq=8602 Ack=117883 Win=5564 Len=0 TSval=1080606334 TSecr=2674300734"
"3.126389","172.18.0.2","54.38.73.16","TLSv1.2","611","Application Data"
"3.136233","54.38.73.16","172.18.0.2","TLSv1.2","2964","Application Data, Application Data"
"3.136258","172.18.0.2","54.38.73.16","TCP","68","36876 → 21002 [ACK] Seq=9145 Ack=120779 Win=5595 Len=0 TSval=1080606345 TSecr=2674300737"
"3.140131","54.38.73.16","172.18.0.2","TLSv1.2","2927","Application Data, Application Data"
"3.140156","172.18.0.2","54.38.73.16","TCP","68","36876 → 21002 [ACK] Seq=9145 Ack=123638 Win=5595 Len=0 TSval=1080606349 TSecr=2674300738"
"3.146662","54.38.73.16","172.18.0.2","TCP","2964","[TCP segment of a reassembled PDU]"
"3.146687","172.18.0.2","54.38.73.16","TCP","68","36876 → 21002 [ACK] Seq=9145 Ack=126534 Win=5595 Len=0 TSval=1080606355 TSecr=2674300739"
"3.156761","54.38.73.16","172.18.0.2","TLSv1.2","2964","Application Data [TCP segment of a reassembled PDU]"
"3.156795","172.18.0.2","54.38.73.16","TCP","68","36876 → 21002 [ACK] Seq=9145 Ack=129430 Win=5595 Len=0 TSval=1080606365 TSecr=2674300742"
"3.164116","54.38.73.16","172.18.0.2","TLSv1.2","1016","Application Data"
"3.165720","54.38.73.16","172.18.0.2","TLSv1.2","4412","Application Data"
"3.165858","172.18.0.2","54.38.73.16","TCP","68","36876 → 21002 [ACK] Seq=9145 Ack=134722 Win=5579 Len=0 TSval=1080606374 TSecr=2674300744"
"3.166361","172.18.0.2","54.38.73.16","TLSv1.2","611","Application Data"
"3.176795","54.38.73.16","172.18.0.2","TLSv1.2","5860","Application Data, Application Data"
"3.176820","172.18.0.2","54.38.73.16","TCP","68","36876 → 21002 [ACK] Seq=9688 Ack=140514 Win=5580 Len=0 TSval=1080606385 TSecr=2674300747"
"3.187320","54.38.73.16","172.18.0.2","TLSv1.2","2964","Application Data [TCP segment of a reassembled PDU]"
"3.187345","172.18.0.2","54.38.73.16","TCP","68","36876 → 21002 [ACK] Seq=9688 Ack=143410 Win=5595 Len=0 TSval=1080606396 TSecr=2674300749"
"3.190224","54.38.73.16","172.18.0.2","TLSv1.2","1059","Application Data"
"3.197083","54.38.73.16","172.18.0.2","TCP","1516","[TCP segment of a reassembled PDU]"
"3.197232","172.18.0.2","54.38.73.16","TCP","68","36876 → 21002 [ACK] Seq=9688 Ack=145849 Win=5593 Len=0 TSval=1080606406 TSecr=2674300750"
"3.207048","54.38.73.16","172.18.0.2","TLSv1.2","8756","Application Data, Application Data, Application Data"
"3.207186","172.18.0.2","54.38.73.16","TCP","68","36876 → 21002 [ACK] Seq=9688 Ack=154537 Win=5565 Len=0 TSval=1080606416 TSecr=2674300754"
"3.217155","54.38.73.16","172.18.0.2","TLSv1.2","2964","Application Data [TCP segment of a reassembled PDU]"
"3.217180","172.18.0.2","54.38.73.16","TCP","68","36876 → 21002 [ACK] Seq=9688 Ack=157433 Win=5595 Len=0 TSval=1080606426 TSecr=2674300757"
"3.220582","54.38.73.16","172.18.0.2","TLSv1.2","1059","Application Data"
"3.227944","54.38.73.16","172.18.0.2","TCP","1516","[TCP segment of a reassembled PDU]"
"3.228082","172.18.0.2","54.38.73.16","TCP","68","36876 → 21002 [ACK] Seq=9688 Ack=159872 Win=5593 Len=0 TSval=1080606437 TSecr=2674300758"
"3.251628","54.38.73.16","172.18.0.2","TLSv1.2","191","Application Data"
"3.252188","172.18.0.2","54.38.73.16","TLSv1.2","611","Application Data"
"3.316396","54.38.73.16","172.18.0.2","TCP","68","21002 → 36876 [ACK] Seq=159995 Ack=10231 Win=1452 Len=0 TSval=2674300782 TSecr=1080606461"
"3.316428","172.18.0.2","54.38.73.16","TLSv1.2","611","Application Data"
"3.379859","54.38.73.16","172.18.0.2","TCP","68","21002 → 36876 [ACK] Seq=159995 Ack=10774 Win=1452 Len=0 TSval=2674300798 TSecr=1080606525"
"3.887877","54.38.73.16","172.18.0.2","TLSv1.2","611","Application Data"
"3.888825","172.18.0.2","54.38.73.16","TLSv1.2","611","Application Data"
"3.913080","54.38.73.16","172.18.0.2","TCP","68","21002 → 36876 [ACK] Seq=160538 Ack=11317 Win=1452 Len=0 TSval=2674300931 TSecr=1080607097"
"4.243333","54.38.73.16","172.18.0.2","TLSv1.2","611","Application Data"
"4.278074","54.38.73.16","172.18.0.2","TCP","2964","[TCP segment of a reassembled PDU]"
"4.278098","172.18.0.2","54.38.73.16","TCP","68","36876 → 21002 [ACK] Seq=11317 Ack=163977 Win=5595 Len=0 TSval=1080607487 TSecr=2674301014"
"4.286513","54.38.73.16","172.18.0.2","TLSv1.2","8756","Application Data, Application Data"
"4.286638","172.18.0.2","54.38.73.16","TCP","68","36876 → 21002 [ACK] Seq=11317 Ack=172665 Win=5565 Len=0 TSval=1080607495 TSecr=2674301024"
"4.286721","54.38.73.16","172.18.0.2","TLSv1.2","1516","Application Data [TCP segment of a reassembled PDU]"
"4.287400","172.18.0.2","54.38.73.16","TLSv1.2","611","Application Data"
"4.304032","54.38.73.16","172.18.0.2","TLSv1.2","5860","Application Data [TCP segment of a reassembled PDU]"
"4.304057","172.18.0.2","54.38.73.16","TCP","68","36876 → 21002 [ACK] Seq=11860 Ack=179905 Win=5580 Len=0 TSval=1080607513 TSecr=2674301028"
"4.312262","54.38.73.16","172.18.0.2","TLSv1.2","407","Application Data"
"4.312292","54.38.73.16","172.18.0.2","TCP","68","21002 → 36876 [ACK] Seq=180244 Ack=11860 Win=1452 Len=0 TSval=2674301030 TSecr=1080607496"
"4.329069","54.38.73.16","172.18.0.2","TLSv1.2","10204","Application Data, Application Data"
"4.329265","172.18.0.2","54.38.73.16","TCP","68","36876 → 21002 [ACK] Seq=11860 Ack=190380 Win=5549 Len=0 TSval=1080607538 TSecr=2674301030"
"4.330148","172.18.0.2","54.38.73.16","TLSv1.2","611","Application Data"
"4.352981","54.38.73.16","172.18.0.2","TLSv1.2","1327","Application Data"
"4.359735","54.38.73.16","172.18.0.2","TLSv1.2","7308","Application Data"
"4.359768","172.18.0.2","54.38.73.16","TCP","68","36876 → 21002 [ACK] Seq=12403 Ack=198879 Win=5564 Len=0 TSval=1080607568 TSecr=2674301041"
"4.369557","54.38.73.16","172.18.0.2","TLSv1.2","4412","Application Data, Application Data"
"4.369583","172.18.0.2","54.38.73.16","TCP","68","36876 → 21002 [ACK] Seq=12403 Ack=203223 Win=5579 Len=0 TSval=1080607578 TSecr=2674301045"
"4.384664","54.38.73.16","172.18.0.2","TLSv1.2","1450","Application Data"
"4.410689","54.38.73.16","172.18.0.2","TCP","2964","[TCP segment of a reassembled PDU]"
"4.410712","172.18.0.2","54.38.73.16","TCP","68","36876 → 21002 [ACK] Seq=12403 Ack=207501 Win=5595 Len=0 TSval=1080607619 TSecr=2674301049"
"4.420623","54.38.73.16","172.18.0.2","TLSv1.2","1516","Application Data [TCP segment of a reassembled PDU]"
"4.420962","54.38.73.16","172.18.0.2","TCP","1516","21002 → 36876 [ACK] Seq=208949 Ack=12403 Win=1452 Len=1448 TSval=2674301058 TSecr=1080607578 [TCP segment of a reassembled PDU]"
"4.421002","172.18.0.2","54.38.73.16","TCP","68","36876 → 21002 [ACK] Seq=12403 Ack=210397 Win=5577 Len=0 TSval=1080607629 TSecr=2674301058"
"4.436270","54.38.73.16","172.18.0.2","TLSv1.2","502","Application Data"
"4.442602","172.18.0.2","54.38.73.16","TLSv1.2","611","Application Data"
"4.503885","54.38.73.16","172.18.0.2","TCP","68","21002 → 36876 [ACK] Seq=210831 Ack=12946 Win=1452 Len=0 TSval=2674301079 TSecr=1080607651"
"5.527296","54.38.73.16","172.18.0.2","TLSv1.2","611","Application Data"
"5.527329","54.38.73.16","172.18.0.2","TCP","611","[TCP Retransmission] 21002 → 36876 [PSH, ACK] Seq=210831 Ack=12946 Win=1452 Len=543 TSval=2674301320 TSecr=1080607651"
"5.527348","172.18.0.2","54.38.73.16","TCP","80","36876 → 21002 [ACK] Seq=12946 Ack=211374 Win=5608 Len=0 TSval=1080608736 TSecr=2674301320 SLE=210831 SRE=211374"
"5.528248","172.18.0.2","54.38.73.16","TLSv1.2","611","Application Data"
"5.552002","54.38.73.16","172.18.0.2","TCP","68","21002 → 36876 [ACK] Seq=211374 Ack=13489 Win=1452 Len=0 TSval=2674301341 TSecr=1080608737"
"6.446084","54.38.73.16","172.18.0.2","TLSv1.2","611","Application Data"
"6.446138","172.18.0.2","54.38.73.16","TCP","68","36876 → 21002 [ACK] Seq=13489 Ack=211917 Win=5608 Len=0 TSval=1080609655 TSecr=2674301513"
"6.446445","54.38.73.16","172.18.0.2","TCP","1356","[TCP Previous segment not captured]  [TCP segment of a reassembled PDU]"
"6.446465","172.18.0.2","54.38.73.16","TCP","80","[TCP Dup ACK 150#1] 36876 → 21002 [ACK] Seq=13489 Ack=211917 Win=5608 Len=0 TSval=1080609655 TSecr=2674301513 SLE=222053 SRE=223341"
"6.446469","54.38.73.16","172.18.0.2","TCP","5860","[TCP Out-Of-Order] 21002 → 36876 [ACK] Seq=211917 Ack=13489 Win=1452 Len=5792 TSval=2674301526 TSecr=1080608737"
"6.446479","172.18.0.2","54.38.73.16","TCP","80","36876 → 21002 [ACK] Seq=13489 Ack=217709 Win=5571 Len=0 TSval=1080609655 TSecr=2674301526 SLE=222053 SRE=223341"
"6.446480","54.38.73.16","172.18.0.2","TCP","1516","[TCP Out-Of-Order] 21002 → 36876 [ACK] Seq=217709 Ack=13489 Win=1452 Len=1448 TSval=2674301528 TSecr=1080608737"
"6.446490","172.18.0.2","54.38.73.16","TCP","80","36876 → 21002 [ACK] Seq=13489 Ack=219157 Win=5562 Len=0 TSval=1080609655 TSecr=2674301528 SLE=222053 SRE=223341"
"6.446491","54.38.73.16","172.18.0.2","TCP","2964","[TCP Out-Of-Order] 21002 → 36876 [ACK] Seq=219157 Ack=13489 Win=1452 Len=2896 TSval=2674301531 TSecr=1080608737"
"6.446500","172.18.0.2","54.38.73.16","TCP","68","36876 → 21002 [ACK] Seq=13489 Ack=223341 Win=5546 Len=0 TSval=1080609655 TSecr=2674301531"
"6.446502","54.38.73.16","172.18.0.2","TCP","1516","21002 → 36876 [ACK] Seq=223341 Ack=13489 Win=1452 Len=1448 TSval=2674301551 TSecr=1080608737 [TCP segment of a reassembled PDU]"
"6.446509","172.18.0.2","54.38.73.16","TCP","68","36876 → 21002 [ACK] Seq=13489 Ack=224789 Win=5535 Len=0 TSval=1080609655 TSecr=2674301551"
"6.447374","172.18.0.2","54.38.73.16","TLSv1.2","611","Application Data"
"6.471396","54.38.73.16","172.18.0.2","TCP","68","[TCP Previous segment not captured] 21002 → 36876 [ACK] Seq=236373 Ack=14032 Win=1452 Len=0 TSval=2674301570 TSecr=1080609656"
"6.471419","54.38.73.16","172.18.0.2","TCP","11652","[TCP Retransmission] 21002 → 36876 [ACK] Seq=224789 Ack=13489 Win=1452 Len=11584 TSval=2674301570 TSecr=1080609655"
"6.471433","172.18.0.2","54.38.73.16","TCP","68","36876 → 21002 [ACK] Seq=14032 Ack=236373 Win=5550 Len=0 TSval=1080609680 TSecr=2674301570"
"6.495193","54.38.73.16","172.18.0.2","TLSv1.2","6771","Ignored Unknown Record"
"6.495216","172.18.0.2","54.38.73.16","TCP","68","36876 → 21002 [ACK] Seq=14032 Ack=243076 Win=5564 Len=0 TSval=1080609704 TSecr=2674301576"
"6.495635","172.18.0.2","54.38.73.16","TLSv1.2","611","Application Data"
"6.530352","54.38.73.16","172.18.0.2","TLSv1.2","2153","Application Data"
"6.530383","172.18.0.2","54.38.73.16","TCP","68","36876 → 21002 [ACK] Seq=14575 Ack=245161 Win=5598 Len=0 TSval=1080609739 TSecr=2674301585"
"6.536731","172.18.0.2","54.38.73.16","TLSv1.2","611","Application Data"
"6.599472","54.38.73.16","172.18.0.2","TCP","68","21002 → 36876 [ACK] Seq=245161 Ack=15118 Win=1452 Len=0 TSval=2674301603 TSecr=1080609745"
"7.267415","54.38.73.16","172.18.0.2","TLSv1.2","611","Application Data"
"7.268382","172.18.0.2","54.38.73.16","TLSv1.2","611","Application Data"
"7.292739","54.38.73.16","172.18.0.2","TCP","68","21002 → 36876 [ACK] Seq=245704 Ack=15661 Win=1452 Len=0 TSval=2674301776 TSecr=1080610477"
"7.604718","54.38.73.16","172.18.0.2","TLSv1.2","611","Application Data"
"7.614029","54.38.73.16","172.18.0.2","TCP","2964","[TCP segment of a reassembled PDU]"
"7.614152","172.18.0.2","54.38.73.16","TCP","68","36876 → 21002 [ACK] Seq=15661 Ack=249143 Win=5595 Len=0 TSval=1080610823 TSecr=2674301854"
"7.624054","54.38.73.16","172.18.0.2","TLSv1.2","2964","Application Data [TCP segment of a reassembled PDU]"
"7.624069","172.18.0.2","54.38.73.16","TCP","68","36876 → 21002 [ACK] Seq=15661 Ack=252039 Win=5595 Len=0 TSval=1080610833 TSecr=2674301859"
"7.624460","54.38.73.16","172.18.0.2","TCP","1516","21002 → 36876 [ACK] Seq=252039 Ack=15661 Win=1452 Len=1448 TSval=2674301859 TSecr=1080610477 [TCP segment of a reassembled PDU]"
"7.637365","54.38.73.16","172.18.0.2","TLSv1.2","625","Application Data, Application Data"
"7.637486","172.18.0.2","54.38.73.16","TCP","68","36876 → 21002 [ACK] Seq=15661 Ack=254044 Win=5593 Len=0 TSval=1080610846 TSecr=2674301859"
"7.645098","54.38.73.16","172.18.0.2","TCP","2964","[TCP segment of a reassembled PDU]"
"7.645114","172.18.0.2","54.38.73.16","TCP","68","36876 → 21002 [ACK] Seq=15661 Ack=256940 Win=5595 Len=0 TSval=1080610854 TSecr=2674301864"
"7.661820","54.38.73.16","172.18.0.2","TLSv1.2","799","Application Data"
"7.665942","54.38.73.16","172.18.0.2","TCP","1516","[TCP segment of a reassembled PDU]"
"7.666020","172.18.0.2","54.38.73.16","TCP","68","36876 → 21002 [ACK] Seq=15661 Ack=259119 Win=5593 Len=0 TSval=1080610874 TSecr=2674301868"
"7.666521","54.38.73.16","172.18.0.2","TCP","1516","21002 → 36876 [ACK] Seq=259119 Ack=15661 Win=1452 Len=1448 TSval=2674301869 TSecr=1080610846 [TCP segment of a reassembled PDU]"
"7.676646","54.38.73.16","172.18.0.2","TLSv1.2","2964","Application Data [TCP segment of a reassembled PDU]"
"7.676661","172.18.0.2","54.38.73.16","TCP","68","36876 → 21002 [ACK] Seq=15661 Ack=263463 Win=5595 Len=0 TSval=1080610885 TSecr=2674301869"
"7.691433","54.38.73.16","172.18.0.2","TLSv1.2","502","Application Data"
"7.698321","54.38.73.16","172.18.0.2","TCP","2964","[TCP segment of a reassembled PDU]"
"7.698336","172.18.0.2","54.38.73.16","TCP","68","36876 → 21002 [ACK] Seq=15661 Ack=266793 Win=5595 Len=0 TSval=1080610907 TSecr=2674301876"
"7.719568","54.38.73.16","172.18.0.2","TLSv1.2","4412","Application Data [TCP segment of a reassembled PDU]"
"7.719643","172.18.0.2","54.38.73.16","TCP","68","36876 → 21002 [ACK] Seq=15661 Ack=271137 Win=5579 Len=0 TSval=1080610928 TSecr=2674301882"
"7.722489","54.38.73.16","172.18.0.2","TLSv1.2","625","Application Data, Application Data"
"7.722906","172.18.0.2","54.38.73.16","TLSv1.2","611","Application Data"
"7.746619","54.38.73.16","172.18.0.2","TCP","68","21002 → 36876 [ACK] Seq=271694 Ack=16204 Win=1452 Len=0 TSval=2674301889 TSecr=1080610931"
"7.748243","54.38.73.16","172.18.0.2","TLSv1.2","3695","Application Data"
"7.748323","172.18.0.2","54.38.73.16","TCP","68","36876 → 21002 [ACK] Seq=16204 Ack=275321 Win=5584 Len=0 TSval=1080610957 TSecr=2674301890"
"7.748633","172.18.0.2","54.38.73.16","TLSv1.2","611","Application Data"
"7.758608","54.38.73.16","172.18.0.2","TCP","1516","[TCP segment of a reassembled PDU]"
"7.772581","54.38.73.16","172.18.0.2","TLSv1.2","705","Application Data"
"7.772658","172.18.0.2","54.38.73.16","TCP","68","36876 → 21002 [ACK] Seq=16747 Ack=277406 Win=5612 Len=0 TSval=1080610981 TSecr=2674301892"
"7.789077","54.38.73.16","172.18.0.2","TLSv1.2","7308","Application Data"
"7.789161","172.18.0.2","54.38.73.16","TCP","68","36876 → 21002 [ACK] Seq=16747 Ack=284646 Win=5564 Len=0 TSval=1080610998 TSecr=2674301900"
"7.796679","54.38.73.16","172.18.0.2","TLSv1.2","625","Application Data, Application Data"
"7.810351","54.38.73.16","172.18.0.2","TCP","2964","[TCP segment of a reassembled PDU]"
"7.810355","172.18.0.2","54.38.73.16","TCP","68","36876 → 21002 [ACK] Seq=16747 Ack=288099 Win=5595 Len=0 TSval=1080611019 TSecr=2674301902"
"7.821400","54.38.73.16","172.18.0.2","TLSv1.2","4412","Application Data [TCP segment of a reassembled PDU]"
"7.821425","172.18.0.2","54.38.73.16","TCP","68","36876 → 21002 [ACK] Seq=16747 Ack=292443 Win=5579 Len=0 TSval=1080611030 TSecr=2674301908"
"7.834401","54.38.73.16","172.18.0.2","TLSv1.2","1139","Application Data, Application Data"
"7.862028","54.38.73.16","172.18.0.2","TCP","2964","[TCP segment of a reassembled PDU]"
"7.862055","172.18.0.2","54.38.73.16","TCP","68","36876 → 21002 [ACK] Seq=16747 Ack=296410 Win=5595 Len=0 TSval=1080611071 TSecr=2674301911"
"7.872740","54.38.73.16","172.18.0.2","TLSv1.2","5860","Application Data, Application Data"
"7.872899","172.18.0.2","54.38.73.16","TCP","68","36876 → 21002 [ACK] Seq=16747 Ack=302202 Win=5580 Len=0 TSval=1080611081 TSecr=2674301921"
"7.873015","54.38.73.16","172.18.0.2","TCP","1516","21002 → 36876 [ACK] Seq=302202 Ack=16747 Win=1452 Len=1448 TSval=2674301921 TSecr=1080611030 [TCP segment of a reassembled PDU]"
"7.873865","172.18.0.2","54.38.73.16","TLSv1.2","611","Application Data"
"7.888066","54.38.73.16","172.18.0.2","TLSv1.2","2964","Application Data, Application Data"
"7.888090","172.18.0.2","54.38.73.16","TCP","68","36876 → 21002 [ACK] Seq=17290 Ack=306546 Win=5595 Len=0 TSval=1080611097 TSecr=2674301925"
"7.899318","54.38.73.16","172.18.0.2","TLSv1.2","5860","Application Data [TCP segment of a reassembled PDU]"
"7.899341","54.38.73.16","172.18.0.2","TLSv1.2","2964","Application Data [TCP segment of a reassembled PDU]"
"7.899407","172.18.0.2","54.38.73.16","TCP","68","36876 → 21002 [ACK] Seq=17290 Ack=315234 Win=5564 Len=0 TSval=1080611108 TSecr=2674301927"
"7.912132","54.38.73.16","172.18.0.2","TLSv1.2","2964","Application Data [TCP segment of a reassembled PDU]"
"7.912149","172.18.0.2","54.38.73.16","TCP","68","36876 → 21002 [ACK] Seq=17290 Ack=318130 Win=5595 Len=0 TSval=1080611121 TSecr=2674301931"
"7.924134","54.38.73.16","172.18.0.2","TLSv1.2","7610","Application Data, Application Data, Application Data"
"7.924211","172.18.0.2","54.38.73.16","TCP","68","36876 → 21002 [ACK] Seq=17290 Ack=325672 Win=5570 Len=0 TSval=1080611133 TSecr=2674301934"
"7.924803","172.18.0.2","54.38.73.16","TLSv1.2","1125","Application Data"
"7.950128","54.38.73.16","172.18.0.2","TLSv1.2","3181","Application Data"
"7.950209","172.18.0.2","54.38.73.16","TCP","68","36876 → 21002 [ACK] Seq=18347 Ack=328785 Win=5588 Len=0 TSval=1080611159 TSecr=2674301940"
"7.959801","172.18.0.2","54.38.73.16","TLSv1.2","611","Application Data"
"8.023700","54.38.73.16","172.18.0.2","TCP","68","21002 → 36876 [ACK] Seq=328785 Ack=18890 Win=1452 Len=0 TSval=2674301959 TSecr=1080611168"
"8.291433","54.38.73.16","172.18.0.2","TLSv1.2","611","Application Data"
"8.292223","172.18.0.2","54.38.73.16","TLSv1.2","611","Application Data"
"8.317775","54.38.73.16","172.18.0.2","TCP","68","21002 → 36876 [ACK] Seq=329328 Ack=19433 Win=1452 Len=0 TSval=2674302032 TSecr=1080611501"
"9.084289","54.38.73.16","172.18.0.2","TLSv1.2","3181","Application Data"
"9.084436","172.18.0.2","54.38.73.16","TCP","68","36876 → 21002 [ACK] Seq=19433 Ack=332441 Win=5588 Len=0 TSval=1080612293 TSecr=2674302224"
"9.105216","54.38.73.16","172.18.0.2","TCP","2964","[TCP segment of a reassembled PDU]"
"9.105240","172.18.0.2","54.38.73.16","TCP","68","36876 → 21002 [ACK] Seq=19433 Ack=335337 Win=5595 Len=0 TSval=1080612314 TSecr=2674302229"
"9.107923","54.38.73.16","172.18.0.2","TLSv1.2","799","Application Data"
"9.133287","54.38.73.16","172.18.0.2","TLSv1.2","4412","Application Data"
"9.133431","172.18.0.2","54.38.73.16","TCP","68","36876 → 21002 [ACK] Seq=19433 Ack=340412 Win=5578 Len=0 TSval=1080612342 TSecr=2674302230"
"9.156606","54.38.73.16","172.18.0.2","TLSv1.2","437","Application Data, Application Data"
"9.198229","172.18.0.2","54.38.73.16","TCP","68","36876 → 21002 [ACK] Seq=19433 Ack=340781 Win=5612 Len=0 TSval=1080612407 TSecr=2674302242"
"9.217498","54.38.73.16","172.18.0.2","TCP","2964","[TCP segment of a reassembled PDU]"
"9.217545","172.18.0.2","54.38.73.16","TCP","68","36876 → 21002 [ACK] Seq=19433 Ack=343677 Win=5595 Len=0 TSval=1080612426 TSecr=2674302257"
"9.221621","54.38.73.16","172.18.0.2","TLSv1.2","799","Application Data"
"9.221644","172.18.0.2","54.38.73.16","TCP","68","36876 → 21002 [ACK] Seq=19433 Ack=344408 Win=5593 Len=0 TSval=1080612430 TSecr=2674302258"
"9.236075","54.38.73.16","172.18.0.2","TLSv1.2","4412","Application Data"
"9.236103","172.18.0.2","54.38.73.16","TCP","68","36876 → 21002 [ACK] Seq=19433 Ack=348752 Win=5579 Len=0 TSval=1080612445 TSecr=2674302262"
"9.244635","54.38.73.16","172.18.0.2","TLSv1.2","922","Application Data"
"9.244659","172.18.0.2","54.38.73.16","TCP","68","36876 → 21002 [ACK] Seq=19433 Ack=349606 Win=5593 Len=0 TSval=1080612453 TSecr=2674302264"
"9.246327","54.38.73.16","172.18.0.2","TCP","2964","[TCP segment of a reassembled PDU]"
"9.246352","172.18.0.2","54.38.73.16","TCP","68","36876 → 21002 [ACK] Seq=19433 Ack=352502 Win=5595 Len=0 TSval=1080612455 TSecr=2674302264"
"9.266454","54.38.73.16","172.18.0.2","TLSv1.2","4412","Application Data, Application Data"
"9.266479","172.18.0.2","54.38.73.16","TCP","68","36876 → 21002 [ACK] Seq=19433 Ack=356846 Win=5579 Len=0 TSval=1080612475 TSecr=2674302269"
"9.269086","54.38.73.16","172.18.0.2","TLSv1.2","625","Application Data"
"9.269111","172.18.0.2","54.38.73.16","TCP","68","36876 → 21002 [ACK] Seq=19433 Ack=357403 Win=5593 Len=0 TSval=1080612478 TSecr=2674302270"
"9.269588","172.18.0.2","54.38.73.16","TLSv1.2","611","Application Data"
"9.276990","54.38.73.16","172.18.0.2","TLSv1.2","4412","Application Data"
"9.277017","172.18.0.2","54.38.73.16","TCP","68","36876 → 21002 [ACK] Seq=19976 Ack=361747 Win=5579 Len=0 TSval=1080612485 TSecr=2674302272"
"9.287572","54.38.73.16","172.18.0.2","TLSv1.2","2964","Application Data [TCP segment of a reassembled PDU]"
"9.287598","172.18.0.2","54.38.73.16","TCP","68","36876 → 21002 [ACK] Seq=19976 Ack=364643 Win=5595 Len=0 TSval=1080612496 TSecr=2674302275"
"9.289931","54.38.73.16","172.18.0.2","TLSv1.2","2964","Application Data [TCP segment of a reassembled PDU]"
"9.289956","172.18.0.2","54.38.73.16","TCP","68","36876 → 21002 [ACK] Seq=19976 Ack=367539 Win=5595 Len=0 TSval=1080612498 TSecr=2674302275"
"9.294531","54.38.73.16","172.18.0.2","TCP","68","[TCP Previous segment not captured] 21002 → 36876 [ACK] Seq=370435 Ack=19976 Win=1452 Len=0 TSval=2674302276 TSecr=1080612478"
"9.294553","54.38.73.16","172.18.0.2","TCP","2964","[TCP Retransmission] 21002 → 36876 [ACK] Seq=367539 Ack=19433 Win=1452 Len=2896 TSval=2674302276 TSecr=1080612478"
"9.294568","172.18.0.2","54.38.73.16","TCP","68","36876 → 21002 [ACK] Seq=19976 Ack=370435 Win=5595 Len=0 TSval=1080612503 TSecr=2674302276"
"9.300809","54.38.73.16","172.18.0.2","TCP","516","21002 → 36876 [PSH, ACK] Seq=370435 Ack=19976 Win=1452 Len=448 TSval=2674302278 TSecr=1080612485 [TCP segment of a reassembled PDU]"
"9.300946","172.18.0.2","54.38.73.16","TCP","68","36876 → 21002 [ACK] Seq=19976 Ack=370883 Win=5612 Len=0 TSval=1080612509 TSecr=2674302278"
"9.318566","54.38.73.16","172.18.0.2","TLSv1.2","4412","Application Data"
"9.318709","172.18.0.2","54.38.73.16","TCP","68","36876 → 21002 [ACK] Seq=19976 Ack=375227 Win=5579 Len=0 TSval=1080612527 TSecr=2674302282"
"9.325398","54.38.73.16","172.18.0.2","TLSv1.2","1436","Application Data"
"9.325542","172.18.0.2","54.38.73.16","TCP","68","36876 → 21002 [ACK] Seq=19976 Ack=376595 Win=5612 Len=0 TSval=1080612534 TSecr=2674302284"
"9.330020","54.38.73.16","172.18.0.2","TCP","2964","[TCP segment of a reassembled PDU]"
"9.330164","172.18.0.2","54.38.73.16","TCP","68","36876 → 21002 [ACK] Seq=19976 Ack=379491 Win=5595 Len=0 TSval=1080612539 TSecr=2674302285"
"9.339196","54.38.73.16","172.18.0.2","TLSv1.2","4412","Application Data, Application Data"
"9.339333","172.18.0.2","54.38.73.16","TCP","68","36876 → 21002 [ACK] Seq=19976 Ack=383835 Win=5579 Len=0 TSval=1080612548 TSecr=2674302287"
"9.339753","172.18.0.2","54.38.73.16","TLSv1.2","611","Application Data"
"9.343053","54.38.73.16","172.18.0.2","TLSv1.2","2964","Application Data [TCP segment of a reassembled PDU]"
"9.343080","172.18.0.2","54.38.73.16","TCP","68","36876 → 21002 [ACK] Seq=20519 Ack=386731 Win=5595 Len=0 TSval=1080612552 TSecr=2674302288"
"9.349359","54.38.73.16","172.18.0.2","TLSv1.2","328","Application Data"
"9.349493","172.18.0.2","54.38.73.16","TCP","68","36876 → 21002 [ACK] Seq=20519 Ack=386991 Win=5612 Len=0 TSval=1080612558 TSecr=2674302290"
"9.359837","54.38.73.16","172.18.0.2","TLSv1.2","4412","Application Data"
"9.359981","172.18.0.2","54.38.73.16","TCP","68","36876 → 21002 [ACK] Seq=20519 Ack=391335 Win=5579 Len=0 TSval=1080612568 TSecr=2674302293"
"9.362942","54.38.73.16","172.18.0.2","TCP","1516","21002 → 36876 [ACK] Seq=391335 Ack=19976 Win=1452 Len=1448 TSval=2674302293 TSecr=1080612548 [TCP segment of a reassembled PDU]"
"9.370709","54.38.73.16","172.18.0.2","TLSv1.2","2964","Application Data [TCP segment of a reassembled PDU]"
"9.370743","172.18.0.2","54.38.73.16","TLSv1.2","611","Application Data"
"9.371031","54.38.73.16","172.18.0.2","TCP","1516","21002 → 36876 [ACK] Seq=395679 Ack=20519 Win=1452 Len=1448 TSval=2674302295 TSecr=1080612548 [TCP segment of a reassembled PDU]"
"9.372898","54.38.73.16","172.18.0.2","TLSv1.2","2384","Application Data, Application Data"
"9.372923","172.18.0.2","54.38.73.16","TCP","68","36876 → 21002 [ACK] Seq=21062 Ack=399443 Win=5598 Len=0 TSval=1080612581 TSecr=2674302295"
"9.384240","54.38.73.16","172.18.0.2","TCP","2964","[TCP segment of a reassembled PDU]"
"9.384383","172.18.0.2","54.38.73.16","TCP","68","36876 → 21002 [ACK] Seq=21062 Ack=402339 Win=5595 Len=0 TSval=1080612593 TSecr=2674302299"
"9.394527","54.38.73.16","172.18.0.2","TLSv1.2","1516","Application Data [TCP segment of a reassembled PDU]"
"9.396996","54.38.73.16","172.18.0.2","TLSv1.2","922","Application Data"
"9.397137","172.18.0.2","54.38.73.16","TCP","68","36876 → 21002 [ACK] Seq=21062 Ack=404641 Win=5612 Len=0 TSval=1080612606 TSecr=2674302301"
"9.403735","54.38.73.16","172.18.0.2","TCP","2964","[TCP segment of a reassembled PDU]"
"9.403877","172.18.0.2","54.38.73.16","TCP","68","36876 → 21002 [ACK] Seq=21062 Ack=407537 Win=5595 Len=0 TSval=1080612612 TSecr=2674302304"
"9.421146","54.38.73.16","172.18.0.2","TLSv1.2","285","Application Data"
"9.421786","172.18.0.2","54.38.73.16","TLSv1.2","611","Application Data"
"9.483519","54.38.73.16","172.18.0.2","TCP","68","21002 → 36876 [ACK] Seq=407754 Ack=21605 Win=1452 Len=0 TSval=2674302324 TSecr=1080612630"
"9.483552","172.18.0.2","54.38.73.16","TLSv1.2","611","Application Data"
"9.547231","54.38.73.16","172.18.0.2","TCP","68","21002 → 36876 [ACK] Seq=407754 Ack=22148 Win=1452 Len=0 TSval=2674302340 TSecr=1080612692"
"9.828007","54.38.73.16","172.18.0.2","TLSv1.2","611","Application Data"
"9.829085","172.18.0.2","54.38.73.16","TLSv1.2","611","Application Data"
"9.853549","54.38.73.16","172.18.0.2","TCP","68","21002 → 36876 [ACK] Seq=408297 Ack=22691 Win=1452 Len=0 TSval=2674302416 TSecr=1080613038"
"10.234942","54.38.73.16","172.18.0.2","TLSv1.2","3695","Application Data"
"10.235095","172.18.0.2","54.38.73.16","TCP","68","36876 → 21002 [ACK] Seq=22691 Ack=411924 Win=5584 Len=0 TSval=1080613444 TSecr=2674302511"
"10.252344","54.38.73.16","172.18.0.2","TLSv1.2","1516","Application Data"
"10.252532","54.38.73.16","172.18.0.2","TCP","1516","21002 → 36876 [ACK] Seq=413372 Ack=22691 Win=1452 Len=1448 TSval=2674302516 TSecr=1080613038 [TCP segment of a reassembled PDU]"
"10.252648","172.18.0.2","54.38.73.16","TCP","68","36876 → 21002 [ACK] Seq=22691 Ack=414820 Win=5577 Len=0 TSval=1080613461 TSecr=2674302516"
"10.258717","54.38.73.16","172.18.0.2","TLSv1.2","1342","Application Data"
"10.262104","54.38.73.16","172.18.0.2","TLSv1.2","4412","Application Data"
"10.262129","172.18.0.2","54.38.73.16","TCP","68","36876 → 21002 [ACK] Seq=22691 Ack=420438 Win=5579 Len=0 TSval=1080613471 TSecr=2674302517"
"10.274129","54.38.73.16","172.18.0.2","TLSv1.2","2964","Application Data [TCP segment of a reassembled PDU]"
"10.274155","172.18.0.2","54.38.73.16","TCP","68","36876 → 21002 [ACK] Seq=22691 Ack=423334 Win=5595 Len=0 TSval=1080613483 TSecr=2674302521"
"10.284997","54.38.73.16","172.18.0.2","TLSv1.2","2964","Application Data [TCP segment of a reassembled PDU]"
"10.285022","172.18.0.2","54.38.73.16","TCP","68","36876 → 21002 [ACK] Seq=22691 Ack=426230 Win=5595 Len=0 TSval=1080613493 TSecr=2674302524"
"10.285907","54.38.73.16","172.18.0.2","TLSv1.2","1870","Application Data"
"10.285928","172.18.0.2","54.38.73.16","TCP","68","36876 → 21002 [ACK] Seq=22691 Ack=428032 Win=5600 Len=0 TSval=1080613494 TSecr=2674302524"
"10.294465","54.38.73.16","172.18.0.2","TLSv1.2","4412","Application Data"
"10.294608","172.18.0.2","54.38.73.16","TCP","68","36876 → 21002 [ACK] Seq=22691 Ack=432376 Win=5579 Len=0 TSval=1080613503 TSecr=2674302526"
"10.295038","172.18.0.2","54.38.73.16","TLSv1.2","611","Application Data"
"10.297939","54.38.73.16","172.18.0.2","TCP","2964","21002 → 36876 [ACK] Seq=432376 Ack=22691 Win=1452 Len=2896 TSval=2674302527 TSecr=1080613483 [TCP segment of a reassembled PDU]"
"10.297964","172.18.0.2","54.38.73.16","TCP","68","36876 → 21002 [ACK] Seq=23234 Ack=435272 Win=5595 Len=0 TSval=1080613506 TSecr=2674302527"
"10.312722","54.38.73.16","172.18.0.2","TLSv1.2","2964","Application Data [TCP segment of a reassembled PDU]"
"10.312749","172.18.0.2","54.38.73.16","TCP","68","36876 → 21002 [ACK] Seq=23234 Ack=438168 Win=5595 Len=0 TSval=1080613521 TSecr=2674302530"
"10.312767","54.38.73.16","172.18.0.2","TLSv1.2","2964","Application Data [TCP segment of a reassembled PDU]"
"10.312878","172.18.0.2","54.38.73.16","TCP","68","36876 → 21002 [ACK] Seq=23234 Ack=441064 Win=5579 Len=0 TSval=1080613521 TSecr=2674302530"
"10.319587","54.38.73.16","172.18.0.2","TCP","68","[TCP Previous segment not captured] 21002 → 36876 [ACK] Seq=442569 Ack=23234 Win=1452 Len=0 TSval=2674302532 TSecr=1080613503"
"10.319619","172.18.0.2","54.38.73.16","TLSv1.2","611","Application Data"
"10.319627","54.38.73.16","172.18.0.2","TCP","1573","[TCP Retransmission] 21002 → 36876 [PSH, ACK] Seq=441064 Ack=22691 Win=1452 Len=1505 TSval=2674302532 TSecr=1080613503"
"10.319760","172.18.0.2","54.38.73.16","TCP","68","36876 → 21002 [ACK] Seq=23777 Ack=442569 Win=5601 Len=0 TSval=1080613528 TSecr=2674302532"
"10.344658","54.38.73.16","172.18.0.2","TCP","68","21002 → 36876 [ACK] Seq=442569 Ack=23777 Win=1452 Len=0 TSval=2674302539 TSecr=1080613528"
"10.543821","54.38.73.16","172.18.0.2","TLSv1.2","1125","Application Data"
"10.543950","54.38.73.16","172.18.0.2","TCP","1516","[TCP segment of a reassembled PDU]"
"10.543988","172.18.0.2","54.38.73.16","TCP","68","36876 → 21002 [ACK] Seq=23777 Ack=445074 Win=5582 Len=0 TSval=1080613752 TSecr=2674302580"
"10.567805","54.38.73.16","172.18.0.2","TLSv1.2","705","Application Data"
"10.574445","172.18.0.2","54.38.73.16","TLSv1.2","611","Application Data"
"10.597711","54.38.73.16","172.18.0.2","TCP","68","21002 → 36876 [ACK] Seq=445711 Ack=24320 Win=1452 Len=0 TSval=2674302602 TSecr=1080613783"
"10.812220","54.38.73.16","172.18.0.2","TLSv1.2","611","Application Data"
"10.813344","172.18.0.2","54.38.73.16","TLSv1.2","611","Application Data"
"10.836628","54.38.73.16","172.18.0.2","TCP","68","21002 → 36876 [ACK] Seq=446254 Ack=24863 Win=1452 Len=0 TSval=2674302662 TSecr=1080614022"
"11.084607","54.38.73.16","172.18.0.2","TLSv1.2","611","Application Data"
"11.115320","54.38.73.16","172.18.0.2","TLSv1.2","4412","Application Data"
"11.115371","172.18.0.2","54.38.73.16","TCP","68","36876 → 21002 [ACK] Seq=24863 Ack=451141 Win=5579 Len=0 TSval=1080614324 TSecr=2674302724"
"11.126139","54.38.73.16","172.18.0.2","TLSv1.2","2964","Application Data [TCP segment of a reassembled PDU]"
"11.126191","172.18.0.2","54.38.73.16","TCP","68","36876 → 21002 [ACK] Seq=24863 Ack=454037 Win=5595 Len=0 TSval=1080614335 TSecr=2674302734"
"11.140539","54.38.73.16","172.18.0.2","TLSv1.2","111","Application Data"
"11.182221","172.18.0.2","54.38.73.16","TCP","68","36876 → 21002 [ACK] Seq=24863 Ack=454080 Win=5612 Len=0 TSval=1080614391 TSecr=2674302738"
"11.206118","54.38.73.16","172.18.0.2","TLSv1.2","611","Application Data"
"11.206172","172.18.0.2","54.38.73.16","TCP","68","36876 → 21002 [ACK] Seq=24863 Ack=454623 Win=5608 Len=0 TSval=1080614415 TSecr=2674302754"
"11.280541","54.38.73.16","172.18.0.2","TLSv1.2","3695","Application Data"
"11.280566","172.18.0.2","54.38.73.16","TCP","68","36876 → 21002 [ACK] Seq=24863 Ack=458250 Win=5580 Len=0 TSval=1080614489 TSecr=2674302773"
"11.306542","54.38.73.16","172.18.0.2","TLSv1.2","1125","Application Data"
"11.306567","172.18.0.2","54.38.73.16","TCP","68","36876 → 21002 [ACK] Seq=24863 Ack=459307 Win=5593 Len=0 TSval=1080614515 TSecr=2674302779"
"11.332857","54.38.73.16","172.18.0.2","TLSv1.2","4145","Application Data"
"11.332881","172.18.0.2","54.38.73.16","TCP","68","36876 → 21002 [ACK] Seq=24863 Ack=463384 Win=5589 Len=0 TSval=1080614541 TSecr=2674302785"
"11.332903","54.38.73.16","172.18.0.2","TCP","1516","[TCP segment of a reassembled PDU]"
"11.332923","172.18.0.2","54.38.73.16","TCP","68","36876 → 21002 [ACK] Seq=24863 Ack=464832 Win=5580 Len=0 TSval=1080614541 TSecr=2674302785"
"11.352016","54.38.73.16","172.18.0.2","TLSv1.2","1516","Application Data [TCP segment of a reassembled PDU]"
"11.352043","172.18.0.2","54.38.73.16","TCP","68","36876 → 21002 [ACK] Seq=24863 Ack=466280 Win=5593 Len=0 TSval=1080614561 TSecr=2674302791"
"11.357104","54.38.73.16","172.18.0.2","TLSv1.2","892","Application Data"
"11.357129","172.18.0.2","54.38.73.16","TCP","68","36876 → 21002 [ACK] Seq=24863 Ack=467104 Win=5593 Len=0 TSval=1080614566 TSecr=2674302792"
"11.363678","54.38.73.16","172.18.0.2","TCP","2964","[TCP segment of a reassembled PDU]"
"11.363703","172.18.0.2","54.38.73.16","TCP","68","36876 → 21002 [ACK] Seq=24863 Ack=470000 Win=5595 Len=0 TSval=1080614572 TSecr=2674302793"
"11.372521","54.38.73.16","172.18.0.2","TLSv1.2","2964","Application Data [TCP segment of a reassembled PDU]"
"11.372547","172.18.0.2","54.38.73.16","TCP","68","36876 → 21002 [ACK] Seq=24863 Ack=472896 Win=5595 Len=0 TSval=1080614581 TSecr=2674302796"
"11.380560","54.38.73.16","172.18.0.2","TLSv1.2","1016","Application Data"
"11.380584","172.18.0.2","54.38.73.16","TCP","68","36876 → 21002 [ACK] Seq=24863 Ack=473844 Win=5593 Len=0 TSval=1080614589 TSecr=2674302798"
"11.381041","172.18.0.2","54.38.73.16","TLSv1.2","611","Application Data"
"11.382689","54.38.73.16","172.18.0.2","TCP","1516","[TCP segment of a reassembled PDU]"
"11.382714","172.18.0.2","54.38.73.16","TCP","68","36876 → 21002 [ACK] Seq=25406 Ack=475292 Win=5601 Len=0 TSval=1080614591 TSecr=2674302798"
"11.392706","54.38.73.16","172.18.0.2","TLSv1.2","1516","Application Data [TCP segment of a reassembled PDU]"
"11.392730","172.18.0.2","54.38.73.16","TCP","68","36876 → 21002 [ACK] Seq=25406 Ack=476740 Win=5593 Len=0 TSval=1080614601 TSecr=2674302801"
"11.404511","54.38.73.16","172.18.0.2","TLSv1.2","1342","Application Data"
"11.404546","54.38.73.16","172.18.0.2","TCP","68","21002 → 36876 [ACK] Seq=478014 Ack=25406 Win=1452 Len=0 TSval=2674302804 TSecr=1080614590"
"11.404647","172.18.0.2","54.38.73.16","TCP","68","36876 → 21002 [ACK] Seq=25406 Ack=478014 Win=5612 Len=0 TSval=1080614613 TSecr=2674302804"
"11.413578","54.38.73.16","172.18.0.2","TCP","1516","[TCP segment of a reassembled PDU]"
"11.423550","54.38.73.16","172.18.0.2","TLSv1.2","7308","Application Data, Application Data"
"11.423684","172.18.0.2","54.38.73.16","TCP","68","36876 → 21002 [ACK] Seq=25406 Ack=486702 Win=5564 Len=0 TSval=1080614632 TSecr=2674302806"
"11.424445","172.18.0.2","54.38.73.16","TLSv1.2","611","Application Data"
"11.428025","54.38.73.16","172.18.0.2","TLSv1.2","205","Application Data"
"11.428162","172.18.0.2","54.38.73.16","TCP","68","36876 → 21002 [ACK] Seq=25949 Ack=486839 Win=5612 Len=0 TSval=1080614637 TSecr=2674302810"
"11.445564","54.38.73.16","172.18.0.2","TCP","2964","[TCP segment of a reassembled PDU]"
"11.445705","172.18.0.2","54.38.73.16","TCP","68","36876 → 21002 [ACK] Seq=25949 Ack=489735 Win=5595 Len=0 TSval=1080614654 TSecr=2674302814"
"11.452252","54.38.73.16","172.18.0.2","TLSv1.2","1342","Application Data, Application Data"
"11.452649","172.18.0.2","54.38.73.16","TCP","68","36876 → 21002 [ACK] Seq=25949 Ack=491009 Win=5612 Len=0 TSval=1080614661 TSecr=2674302816"
"11.476145","54.38.73.16","172.18.0.2","TLSv1.2","7308","Application Data"
"11.476295","172.18.0.2","54.38.73.16","TCP","68","36876 → 21002 [ACK] Seq=25949 Ack=498249 Win=5564 Len=0 TSval=1080614685 TSecr=2674302822"
"11.476551","54.38.73.16","172.18.0.2","TLSv1.2","596","Application Data"
"11.476695","172.18.0.2","54.38.73.16","TCP","68","36876 → 21002 [ACK] Seq=25949 Ack=498777 Win=5612 Len=0 TSval=1080614685 TSecr=2674302822"
"11.477201","172.18.0.2","54.38.73.16","TLSv1.2","611","Application Data"
"11.486305","54.38.73.16","172.18.0.2","TLSv1.2","4412","Application Data"
"11.486444","172.18.0.2","54.38.73.16","TCP","68","36876 → 21002 [ACK] Seq=26492 Ack=503121 Win=5579 Len=0 TSval=1080614695 TSecr=2674302824"
"11.500852","54.38.73.16","172.18.0.2","TLSv1.2","6634","Application Data, Application Data, Application Data"
"11.500992","172.18.0.2","54.38.73.16","TCP","68","36876 → 21002 [ACK] Seq=26492 Ack=509687 Win=5564 Len=0 TSval=1080614709 TSecr=2674302828"
"11.517546","54.38.73.16","172.18.0.2","TLSv1.2","4412","Application Data"
"11.517579","172.18.0.2","54.38.73.16","TCP","68","36876 → 21002 [ACK] Seq=26492 Ack=514031 Win=5579 Len=0 TSval=1080614726 TSecr=2674302832"
"11.524797","54.38.73.16","172.18.0.2","TLSv1.2","408","Application Data"
"11.548670","54.38.73.16","172.18.0.2","TLSv1.2","4412","Application Data"
"11.548694","172.18.0.2","54.38.73.16","TCP","68","36876 → 21002 [ACK] Seq=26492 Ack=518715 Win=5579 Len=0 TSval=1080614757 TSecr=2674302834"
"11.568968","54.38.73.16","172.18.0.2","TLSv1.2","1516","Application Data, Application Data"
"11.572307","54.38.73.16","172.18.0.2","TLSv1.2","1074","Application Data"
"11.572331","172.18.0.2","54.38.73.16","TCP","68","36876 → 21002 [ACK] Seq=26492 Ack=521169 Win=5593 Len=0 TSval=1080614781 TSecr=2674302845"
"11.579821","172.18.0.2","54.38.73.16","TLSv1.2","611","Application Data"
"11.643351","54.38.73.16","172.18.0.2","TCP","68","21002 → 36876 [ACK] Seq=521169 Ack=27035 Win=1452 Len=0 TSval=2674302864 TSecr=1080614788"
"11.992787","54.38.73.16","172.18.0.2","TLSv1.2","611","Application Data"
"11.993923","172.18.0.2","54.38.73.16","TLSv1.2","611","Application Data"
"12.019530","54.38.73.16","172.18.0.2","TCP","68","21002 → 36876 [ACK] Seq=521712 Ack=27578 Win=1452 Len=0 TSval=2674302957 TSecr=1080615202"
"12.354235","02:42:09:5f:bf:77","","ARP","44","Who has 172.18.0.2? Tell 172.18.0.1"
"12.354249","02:42:ac:12:00:02","","ARP","44","172.18.0.2 is at 02:42:ac:12:00:02"
"12.591807","54.38.73.16","172.18.0.2","TCP","1516","[TCP segment of a reassembled PDU]"
"12.592136","54.38.73.16","172.18.0.2","TLSv1.2","2247","Application Data"
"12.592158","54.38.73.16","172.18.0.2","TCP","2964","[TCP segment of a reassembled PDU]"
"12.592168","54.38.73.16","172.18.0.2","TLSv1.2","4412","Application Data, Application Data"
"12.592177","54.38.73.16","172.18.0.2","TLSv1.2","1516","Application Data, Application Data"
"12.592182","54.38.73.16","172.18.0.2","TCP","1516","21002 → 36876 [ACK] Seq=534027 Ack=27578 Win=1452 Len=1448 TSval=2674303071 TSecr=1080615202 [TCP segment of a reassembled PDU]"
"12.592235","172.18.0.2","54.38.73.16","TCP","68","36876 → 21002 [ACK] Seq=27578 Ack=535475 Win=5546 Len=0 TSval=1080615801 TSecr=2674303032"
"12.617024","54.38.73.16","172.18.0.2","TLSv1.2","12838","Application Data, Application Data, Application Data, Application Data, Application Data, Application Data"
"12.617170","172.18.0.2","54.38.73.16","TCP","68","36876 → 21002 [ACK] Seq=27578 Ack=548245 Win=5534 Len=0 TSval=1080615826 TSecr=2674303107"
"12.617630","172.18.0.2","54.38.73.16","TLSv1.2","611","Application Data"
"12.640672","54.38.73.16","172.18.0.2","TCP","68","[TCP Previous segment not captured] 21002 → 36876 [ACK] Seq=550844 Ack=28121 Win=1452 Len=0 TSval=2674303113 TSecr=1080615826"
"12.640704","172.18.0.2","54.38.73.16","TLSv1.2","611","Application Data"
"12.640712","54.38.73.16","172.18.0.2","TCP","2667","[TCP Retransmission] 21002 → 36876 [PSH, ACK] Seq=548245 Ack=27578 Win=1452 Len=2599 TSval=2674303113 TSecr=1080615826"
"12.640850","172.18.0.2","54.38.73.16","TCP","68","36876 → 21002 [ACK] Seq=28664 Ack=550844 Win=5596 Len=0 TSval=1080615849 TSecr=2674303113"
"12.664430","54.38.73.16","172.18.0.2","TCP","68","21002 → 36876 [ACK] Seq=550844 Ack=28664 Win=1452 Len=0 TSval=2674303119 TSecr=1080615849"
"12.664456","172.18.0.2","54.38.73.16","TLSv1.2","611","Application Data"
"12.688066","54.38.73.16","172.18.0.2","TCP","68","21002 → 36876 [ACK] Seq=550844 Ack=29207 Win=1452 Len=0 TSval=2674303125 TSecr=1080615873"
"13.001400","54.38.73.16","172.18.0.2","TLSv1.2","611","Application Data"
"13.002491","172.18.0.2","54.38.73.16","TLSv1.2","611","Application Data"
"13.026352","54.38.73.16","172.18.0.2","TCP","68","21002 → 36876 [ACK] Seq=551387 Ack=29750 Win=1452 Len=0 TSval=2674303209 TSecr=1080616211"
"13.514654","54.38.73.16","172.18.0.2","TLSv1.2","611","Application Data"
"13.514689","54.38.73.16","172.18.0.2","TCP","2964","[TCP segment of a reassembled PDU]"
"13.514711","54.38.73.16","172.18.0.2","TLSv1.2","4412","Application Data [TCP segment of a reassembled PDU]"
"13.514723","54.38.73.16","172.18.0.2","TLSv1.2","2964","Application Data [TCP segment of a reassembled PDU]"
"13.514731","54.38.73.16","172.18.0.2","TLSv1.2","1516","Application Data [TCP segment of a reassembled PDU]"
"13.514808","172.18.0.2","54.38.73.16","TCP","68","36876 → 21002 [ACK] Seq=29750 Ack=563514 Win=5527 Len=0 TSval=1080616723 TSecr=2674303278"
"13.514866","54.38.73.16","172.18.0.2","TCP","1516","21002 → 36876 [ACK] Seq=563514 Ack=29750 Win=1452 Len=1448 TSval=2674303296 TSecr=1080616211 [TCP segment of a reassembled PDU]"
"13.514875","54.38.73.16","172.18.0.2","TCP","1516","21002 → 36876 [ACK] Seq=564962 Ack=29750 Win=1452 Len=1448 TSval=2674303326 TSecr=1080616211 [TCP segment of a reassembled PDU]"
"13.514916","172.18.0.2","54.38.73.16","TCP","68","36876 → 21002 [ACK] Seq=29750 Ack=566410 Win=5528 Len=0 TSval=1080616723 TSecr=2674303296"
"13.539480","54.38.73.16","172.18.0.2","TLSv1.2","14148","Application Data, Application Data, Application Data, Application Data, Application Data, Application Data, Application Data"
"13.539508","172.18.0.2","54.38.73.16","TCP","68","36876 → 21002 [ACK] Seq=29750 Ack=580490 Win=5537 Len=0 TSval=1080616748 TSecr=2674303337"
"13.540760","172.18.0.2","54.38.73.16","TLSv1.2","611","Application Data"
"13.545310","54.38.73.16","172.18.0.2","TCP","1516","[TCP segment of a reassembled PDU]"
"13.563504","54.38.73.16","172.18.0.2","TLSv1.2","13100","Application Data, Application Data, Application Data"
"13.563649","172.18.0.2","54.38.73.16","TCP","68","36876 → 21002 [ACK] Seq=30293 Ack=594970 Win=5534 Len=0 TSval=1080616772 TSecr=2674303339"
"13.563821","54.38.73.16","172.18.0.2","TCP","1516","21002 → 36876 [ACK] Seq=594970 Ack=29750 Win=1452 Len=1448 TSval=2674303344 TSecr=1080616748 [TCP segment of a reassembled PDU]"
"13.564876","54.38.73.16","172.18.0.2","TCP","68","21002 → 36876 [ACK] Seq=596418 Ack=30293 Win=1452 Len=0 TSval=2674303344 TSecr=1080616749"
"13.564897","172.18.0.2","54.38.73.16","TLSv1.2","611","Application Data"
"13.588410","54.38.73.16","172.18.0.2","TLSv1.2","9044","Application Data, Application Data, Application Data, Application Data, Application Data"
"13.588544","172.18.0.2","54.38.73.16","TCP","68","36876 → 21002 [ACK] Seq=30836 Ack=605394 Win=5549 Len=0 TSval=1080616797 TSecr=2674303350"
"13.631437","54.38.73.16","172.18.0.2","TCP","68","21002 → 36876 [ACK] Seq=605394 Ack=30836 Win=1452 Len=0 TSval=2674303361 TSecr=1080616773"
"13.631469","172.18.0.2","54.38.73.16","TLSv1.2","1154","Application Data, Application Data"
"13.654685","54.38.73.16","172.18.0.2","TCP","68","21002 → 36876 [ACK] Seq=605394 Ack=31922 Win=1452 Len=0 TSval=2674303366 TSecr=1080616840"
"13.898709","54.38.73.16","172.18.0.2","TLSv1.2","611","Application Data"
"13.899659","172.18.0.2","54.38.73.16","TLSv1.2","611","Application Data"
"13.923684","54.38.73.16","172.18.0.2","TCP","68","21002 → 36876 [ACK] Seq=605937 Ack=32465 Win=1452 Len=0 TSval=2674303434 TSecr=1080617108"
"14.134213","54.38.73.16","172.18.0.2","TLSv1.2","3695","Application Data"
"14.134365","172.18.0.2","54.38.73.16","TCP","68","36876 → 21002 [ACK] Seq=32465 Ack=609564 Win=5584 Len=0 TSval=1080617343 TSecr=2674303486"
"14.143216","54.38.73.16","172.18.0.2","TLSv1.2","4412","Application Data"
"14.143358","172.18.0.2","54.38.73.16","TCP","68","36876 → 21002 [ACK] Seq=32465 Ack=613908 Win=5579 Len=0 TSval=1080617352 TSecr=2674303489"
