_ws.col.Time,_ws.col.Source,_ws.col.Destination,_ws.col.Protocol,_ws.col.Length,_ws.col.Info
"0.000000","172.19.0.3","5.9.29.183","TLSv1.2","599","Application Data"
"0.000310","5.9.29.183","172.19.0.3","TCP","56","9002 → 43520 [ACK] Seq=1 Ack=544 Win=65535 Len=0"
"0.889541","5.9.29.183","172.19.0.3","TLSv1.2","599","Application Data"
"0.889593","172.19.0.3","5.9.29.183","TCP","56","43520 → 9002 [ACK] Seq=544 Ack=544 Win=11911 Len=0"
"0.890358","172.19.0.3","5.9.29.183","TLSv1.2","2141","Application Data"
"0.890801","5.9.29.183","172.19.0.3","TCP","56","9002 → 43520 [ACK] Seq=544 Ack=2629 Win=65535 Len=0"
"1.812264","5.9.29.183","172.19.0.3","TCP","1309","[TCP segment of a reassembled PDU]"
"1.812285","5.9.29.183","172.19.0.3","TLSv1.2","374","Application Data"
"1.812369","172.19.0.3","5.9.29.183","TCP","56","43520 → 9002 [ACK] Seq=2629 Ack=2115 Win=11903 Len=0"
"1.815156","172.19.0.3","5.9.29.183","TLSv1.2","599","Application Data"
"1.815384","5.9.29.183","172.19.0.3","TCP","56","9002 → 43520 [ACK] Seq=2115 Ack=3172 Win=65535 Len=0"
"2.614705","02:42:7b:11:31:3d","","ARP","44","Who has 172.19.0.3? Tell 172.19.0.1"
"2.614724","02:42:ac:13:00:03","","ARP","44","172.19.0.3 is at 02:42:ac:13:00:03"
"2.734392","5.9.29.183","172.19.0.3","TLSv1.2","599","Application Data"
"2.735203","172.19.0.3","5.9.29.183","TLSv1.2","599","Application Data"
"2.735608","5.9.29.183","172.19.0.3","TCP","56","9002 → 43520 [ACK] Seq=2658 Ack=3715 Win=65535 Len=0"
"3.553816","5.9.29.183","172.19.0.3","TCP","1516","[TCP segment of a reassembled PDU]"
"3.553845","5.9.29.183","172.19.0.3","TCP","1516","9002 → 43520 [PSH, ACK] Seq=4118 Ack=3715 Win=65535 Len=1460 [TCP segment of a reassembled PDU]"
"3.553852","5.9.29.183","172.19.0.3","TLSv1.2","249","Application Data"
"3.554073","172.19.0.3","5.9.29.183","TCP","56","43520 → 9002 [ACK] Seq=3715 Ack=5771 Win=11895 Len=0"
"3.554264","5.9.29.183","172.19.0.3","TLSv1.2","1516","Application Data, Application Data"
"3.554373","5.9.29.183","172.19.0.3","TCP","1516","9002 → 43520 [PSH, ACK] Seq=7231 Ack=3715 Win=65535 Len=1460 [TCP segment of a reassembled PDU]"
"3.554382","172.19.0.3","5.9.29.183","TCP","56","43520 → 9002 [ACK] Seq=3715 Ack=8691 Win=11903 Len=0"
"3.554384","5.9.29.183","172.19.0.3","TCP","1118","9002 → 43520 [PSH, ACK] Seq=8691 Ack=3715 Win=65535 Len=1062 [TCP segment of a reassembled PDU]"
"3.569464","5.9.29.183","172.19.0.3","TLSv1.2","787","Application Data"
"3.569490","172.19.0.3","5.9.29.183","TCP","56","43520 → 9002 [ACK] Seq=3715 Ack=10484 Win=11911 Len=0"
"3.636912","5.9.29.183","172.19.0.3","TCP","1504","[TCP segment of a reassembled PDU]"
"3.636944","5.9.29.183","172.19.0.3","TCP","1516","9002 → 43520 [PSH, ACK] Seq=11932 Ack=3715 Win=65535 Len=1460 [TCP segment of a reassembled PDU]"
"3.636953","5.9.29.183","172.19.0.3","TLSv1.2","775","Application Data"
"3.637058","172.19.0.3","5.9.29.183","TCP","56","43520 → 9002 [ACK] Seq=3715 Ack=14111 Win=11895 Len=0"
"3.669412","5.9.29.183","172.19.0.3","TLSv1.2","599","Application Data"
"3.713627","172.19.0.3","5.9.29.183","TCP","56","43520 → 9002 [ACK] Seq=3715 Ack=14654 Win=11911 Len=0"
"3.716864","5.9.29.183","172.19.0.3","TCP","1504","[TCP segment of a reassembled PDU]"
"3.716884","172.19.0.3","5.9.29.183","TCP","56","43520 → 9002 [ACK] Seq=3715 Ack=16102 Win=11911 Len=0"
"3.716893","5.9.29.183","172.19.0.3","TCP","1516","9002 → 43520 [PSH, ACK] Seq=16102 Ack=3715 Win=65535 Len=1460 [TCP segment of a reassembled PDU]"
"3.716904","172.19.0.3","5.9.29.183","TCP","56","43520 → 9002 [ACK] Seq=3715 Ack=17562 Win=11903 Len=0"
"3.716905","5.9.29.183","172.19.0.3","TLSv1.2","775","Application Data"
"3.716910","172.19.0.3","5.9.29.183","TCP","56","43520 → 9002 [ACK] Seq=3715 Ack=18281 Win=11898 Len=0"
"3.749339","5.9.29.183","172.19.0.3","TCP","1516","[TCP segment of a reassembled PDU]"
"3.749364","172.19.0.3","5.9.29.183","TCP","56","43520 → 9002 [ACK] Seq=3715 Ack=19741 Win=11911 Len=0"
"3.749381","5.9.29.183","172.19.0.3","TCP","1516","9002 → 43520 [PSH, ACK] Seq=19741 Ack=3715 Win=65535 Len=1460 [TCP segment of a reassembled PDU]"
"3.749392","172.19.0.3","5.9.29.183","TCP","56","43520 → 9002 [ACK] Seq=3715 Ack=21201 Win=11903 Len=0"
"3.749396","5.9.29.183","172.19.0.3","TLSv1.2","1213","Application Data"
"3.749404","172.19.0.3","5.9.29.183","TCP","56","43520 → 9002 [ACK] Seq=3715 Ack=22358 Win=11895 Len=0"
"3.765554","5.9.29.183","172.19.0.3","TLSv1.2","149","Application Data"
"3.765594","172.19.0.3","5.9.29.183","TCP","56","43520 → 9002 [ACK] Seq=3715 Ack=22451 Win=11911 Len=0"
"3.828146","5.9.29.183","172.19.0.3","TLSv1.2","1113","Application Data"
"3.828212","172.19.0.3","5.9.29.183","TCP","56","43520 → 9002 [ACK] Seq=3715 Ack=23508 Win=11909 Len=0"
"3.870635","5.9.29.183","172.19.0.3","TCP","1516","[TCP segment of a reassembled PDU]"
"3.870659","172.19.0.3","5.9.29.183","TCP","56","43520 → 9002 [ACK] Seq=3715 Ack=24968 Win=11911 Len=0"
"3.870674","5.9.29.183","172.19.0.3","TCP","1516","9002 → 43520 [PSH, ACK] Seq=24968 Ack=3715 Win=65535 Len=1460 [TCP segment of a reassembled PDU]"
"3.870681","172.19.0.3","5.9.29.183","TCP","56","43520 → 9002 [ACK] Seq=3715 Ack=26428 Win=11903 Len=0"
"3.870683","5.9.29.183","172.19.0.3","TLSv1.2","1213","Application Data"
"3.870688","172.19.0.3","5.9.29.183","TCP","56","43520 → 9002 [ACK] Seq=3715 Ack=27585 Win=11895 Len=0"
"3.870689","5.9.29.183","172.19.0.3","TCP","1516","[TCP segment of a reassembled PDU]"
"3.871121","5.9.29.183","172.19.0.3","TCP","1492","9002 → 43520 [PSH, ACK] Seq=29045 Ack=3715 Win=65535 Len=1436 [TCP segment of a reassembled PDU]"
"3.871133","172.19.0.3","5.9.29.183","TCP","56","43520 → 9002 [ACK] Seq=3715 Ack=30481 Win=11911 Len=0"
"3.886348","5.9.29.183","172.19.0.3","TLSv1.2","337","Application Data"
"3.886491","172.19.0.3","5.9.29.183","TCP","56","43520 → 9002 [ACK] Seq=3715 Ack=30762 Win=11911 Len=0"
"3.886824","172.19.0.3","5.9.29.183","TLSv1.2","599","Application Data"
"3.887126","5.9.29.183","172.19.0.3","TCP","56","9002 → 43520 [ACK] Seq=30762 Ack=4258 Win=65535 Len=0"
"3.901995","5.9.29.183","172.19.0.3","TCP","1516","[TCP segment of a reassembled PDU]"
"3.902021","5.9.29.183","172.19.0.3","TCP","1492","9002 → 43520 [PSH, ACK] Seq=32222 Ack=4258 Win=65535 Len=1436 [TCP segment of a reassembled PDU]"
"3.902139","5.9.29.183","172.19.0.3","TLSv1.2","1237","Application Data"
"3.902200","172.19.0.3","5.9.29.183","TCP","56","43520 → 9002 [ACK] Seq=4258 Ack=34839 Win=11895 Len=0"
"3.918739","5.9.29.183","172.19.0.3","TLSv1.2","663","Application Data"
"3.960128","172.19.0.3","5.9.29.183","TCP","56","43520 → 9002 [ACK] Seq=4258 Ack=35446 Win=11911 Len=0"
"4.033305","5.9.29.183","172.19.0.3","TCP","1516","[TCP segment of a reassembled PDU]"
"4.033337","5.9.29.183","172.19.0.3","TCP","1516","9002 → 43520 [PSH, ACK] Seq=36906 Ack=4258 Win=65535 Len=1460 [TCP segment of a reassembled PDU]"
"4.033347","5.9.29.183","172.19.0.3","TLSv1.2","763","Application Data"
"4.033492","172.19.0.3","5.9.29.183","TCP","56","43520 → 9002 [ACK] Seq=4258 Ack=39073 Win=11895 Len=0"
"4.111194","5.9.29.183","172.19.0.3","TCP","1504","[TCP segment of a reassembled PDU]"
"4.111224","5.9.29.183","172.19.0.3","TCP","1516","9002 → 43520 [PSH, ACK] Seq=40521 Ack=4258 Win=65535 Len=1460 [TCP segment of a reassembled PDU]"
"4.111239","172.19.0.3","5.9.29.183","TCP","56","43520 → 9002 [ACK] Seq=4258 Ack=41981 Win=11903 Len=0"
"4.111241","5.9.29.183","172.19.0.3","TLSv1.2","775","Application Data"
"4.111428","172.19.0.3","5.9.29.183","TCP","56","43520 → 9002 [ACK] Seq=4258 Ack=42700 Win=11911 Len=0"
"4.111828","172.19.0.3","5.9.29.183","TLSv1.2","599","Application Data"
"4.112043","5.9.29.183","172.19.0.3","TCP","56","9002 → 43520 [ACK] Seq=42700 Ack=4801 Win=65535 Len=0"
"4.197838","5.9.29.183","172.19.0.3","TLSv1.2","1113","Application Data"
"4.240397","172.19.0.3","5.9.29.183","TCP","56","43520 → 9002 [ACK] Seq=4801 Ack=43757 Win=11911 Len=0"
"4.344293","5.9.29.183","172.19.0.3","TCP","1504","[TCP segment of a reassembled PDU]"
"4.344315","5.9.29.183","172.19.0.3","TCP","1516","9002 → 43520 [PSH, ACK] Seq=45205 Ack=4801 Win=65535 Len=1460 [TCP segment of a reassembled PDU]"
"4.344322","5.9.29.183","172.19.0.3","TLSv1.2","775","Application Data"
"4.344413","172.19.0.3","5.9.29.183","TCP","56","43520 → 9002 [ACK] Seq=4801 Ack=47384 Win=11893 Len=0"
"4.408491","5.9.29.183","172.19.0.3","TCP","1516","[TCP segment of a reassembled PDU]"
"4.408523","5.9.29.183","172.19.0.3","TCP","1516","9002 → 43520 [PSH, ACK] Seq=48844 Ack=4801 Win=65535 Len=1460 [TCP segment of a reassembled PDU]"
"4.408544","172.19.0.3","5.9.29.183","TCP","56","43520 → 9002 [ACK] Seq=4801 Ack=50304 Win=11903 Len=0"
"4.408546","5.9.29.183","172.19.0.3","TLSv1.2","763","Application Data"
"4.408754","172.19.0.3","5.9.29.183","TCP","56","43520 → 9002 [ACK] Seq=4801 Ack=51011 Win=11911 Len=0"
"4.442214","5.9.29.183","172.19.0.3","TLSv1.2","599","Application Data"
"4.442364","172.19.0.3","5.9.29.183","TCP","56","43520 → 9002 [ACK] Seq=4801 Ack=51554 Win=11911 Len=0"
"4.491401","5.9.29.183","172.19.0.3","TCP","1516","[TCP segment of a reassembled PDU]"
"4.491432","5.9.29.183","172.19.0.3","TCP","1492","9002 → 43520 [PSH, ACK] Seq=53014 Ack=4801 Win=65535 Len=1436 [TCP segment of a reassembled PDU]"
"4.491440","5.9.29.183","172.19.0.3","TLSv1.2","1237","Application Data"
"4.491632","172.19.0.3","5.9.29.183","TCP","56","43520 → 9002 [ACK] Seq=4801 Ack=55631 Win=11895 Len=0"
"4.491901","172.19.0.3","5.9.29.183","TLSv1.2","599","Application Data"
"4.492215","5.9.29.183","172.19.0.3","TCP","56","9002 → 43520 [ACK] Seq=55631 Ack=5344 Win=65535 Len=0"
"4.507528","5.9.29.183","172.19.0.3","TLSv1.2","149","Application Data"
"4.547922","172.19.0.3","5.9.29.183","TCP","56","43520 → 9002 [ACK] Seq=5344 Ack=55724 Win=11911 Len=0"
"4.556798","5.9.29.183","172.19.0.3","TCP","1516","[TCP segment of a reassembled PDU]"
"4.556829","5.9.29.183","172.19.0.3","TCP","1516","9002 → 43520 [PSH, ACK] Seq=57184 Ack=5344 Win=65535 Len=1460 [TCP segment of a reassembled PDU]"
"4.556840","5.9.29.183","172.19.0.3","TLSv1.2","763","Application Data"
"4.556970","172.19.0.3","5.9.29.183","TCP","56","43520 → 9002 [ACK] Seq=5344 Ack=59351 Win=11895 Len=0"
"4.625062","5.9.29.183","172.19.0.3","TLSv1.2","599","Application Data"
"4.625248","172.19.0.3","5.9.29.183","TCP","56","43520 → 9002 [ACK] Seq=5344 Ack=59894 Win=11911 Len=0"
"4.675562","5.9.29.183","172.19.0.3","TLSv1.2","599","Application Data"
"4.709191","5.9.29.183","172.19.0.3","TCP","1516","[TCP segment of a reassembled PDU]"
"4.709233","172.19.0.3","5.9.29.183","TCP","56","43520 → 9002 [ACK] Seq=5344 Ack=61897 Win=11911 Len=0"
"4.709237","5.9.29.183","172.19.0.3","TCP","1516","9002 → 43520 [PSH, ACK] Seq=61897 Ack=5344 Win=65535 Len=1460 [TCP segment of a reassembled PDU]"
"4.709247","5.9.29.183","172.19.0.3","TLSv1.2","1213","Application Data"
"4.709437","172.19.0.3","5.9.29.183","TCP","56","43520 → 9002 [ACK] Seq=5344 Ack=64514 Win=11895 Len=0"
"4.725022","5.9.29.183","172.19.0.3","TLSv1.2","149","Application Data"
"4.725154","172.19.0.3","5.9.29.183","TCP","56","43520 → 9002 [ACK] Seq=5344 Ack=64607 Win=11911 Len=0"
"5.176221","5.9.29.183","172.19.0.3","TCP","1516","[TCP segment of a reassembled PDU]"
"5.176244","172.19.0.3","5.9.29.183","TCP","56","43520 → 9002 [ACK] Seq=5344 Ack=66067 Win=11911 Len=0"
"5.176254","5.9.29.183","172.19.0.3","TCP","1322","9002 → 43520 [PSH, ACK] Seq=66067 Ack=5344 Win=65535 Len=1266 [TCP segment of a reassembled PDU]"
"5.176264","172.19.0.3","5.9.29.183","TCP","56","43520 → 9002 [ACK] Seq=5344 Ack=67333 Win=11903 Len=0"
"5.176389","5.9.29.183","172.19.0.3","TLSv1.2","957","Application Data"
"5.176398","172.19.0.3","5.9.29.183","TCP","56","43520 → 9002 [ACK] Seq=5344 Ack=68234 Win=11896 Len=0"
"5.372558","5.9.29.183","172.19.0.3","TCP","1516","[TCP segment of a reassembled PDU]"
"5.372582","172.19.0.3","5.9.29.183","TCP","56","43520 → 9002 [ACK] Seq=5344 Ack=69694 Win=11911 Len=0"
"5.372599","5.9.29.183","172.19.0.3","TCP","1516","9002 → 43520 [PSH, ACK] Seq=69694 Ack=5344 Win=65535 Len=1460 [TCP segment of a reassembled PDU]"
"5.372610","172.19.0.3","5.9.29.183","TCP","56","43520 → 9002 [ACK] Seq=5344 Ack=71154 Win=11903 Len=0"
"5.372614","5.9.29.183","172.19.0.3","TLSv1.2","763","Application Data"
"5.372620","172.19.0.3","5.9.29.183","TCP","56","43520 → 9002 [ACK] Seq=5344 Ack=71861 Win=11898 Len=0"
"5.454908","5.9.29.183","172.19.0.3","TCP","1516","[TCP segment of a reassembled PDU]"
"5.454932","172.19.0.3","5.9.29.183","TCP","56","43520 → 9002 [ACK] Seq=5344 Ack=73321 Win=11911 Len=0"
"5.454948","5.9.29.183","172.19.0.3","TCP","1516","9002 → 43520 [PSH, ACK] Seq=73321 Ack=5344 Win=65535 Len=1460 [TCP segment of a reassembled PDU]"
"5.454961","172.19.0.3","5.9.29.183","TCP","56","43520 → 9002 [ACK] Seq=5344 Ack=74781 Win=11903 Len=0"
"5.454964","5.9.29.183","172.19.0.3","TLSv1.2","763","Application Data"
"5.454969","172.19.0.3","5.9.29.183","TCP","56","43520 → 9002 [ACK] Seq=5344 Ack=75488 Win=11898 Len=0"
"5.472495","5.9.29.183","172.19.0.3","TLSv1.2","599","Application Data"
"5.472522","172.19.0.3","5.9.29.183","TCP","56","43520 → 9002 [ACK] Seq=5344 Ack=76031 Win=11911 Len=0"
"5.489078","5.9.29.183","172.19.0.3","TCP","1516","[TCP segment of a reassembled PDU]"
"5.489104","172.19.0.3","5.9.29.183","TCP","56","43520 → 9002 [ACK] Seq=5344 Ack=77491 Win=11911 Len=0"
"5.489188","5.9.29.183","172.19.0.3","TCP","1492","9002 → 43520 [PSH, ACK] Seq=77491 Ack=5344 Win=65535 Len=1436 [TCP segment of a reassembled PDU]"
"5.489201","172.19.0.3","5.9.29.183","TCP","56","43520 → 9002 [ACK] Seq=5344 Ack=78927 Win=11903 Len=0"
"5.489307","5.9.29.183","172.19.0.3","TLSv1.2","273","Application Data"
"5.489316","172.19.0.3","5.9.29.183","TCP","56","43520 → 9002 [ACK] Seq=5344 Ack=79144 Win=11911 Len=0"
"5.540526","5.9.29.183","172.19.0.3","TCP","1516","[TCP segment of a reassembled PDU]"
"5.540551","172.19.0.3","5.9.29.183","TCP","56","43520 → 9002 [ACK] Seq=5344 Ack=80604 Win=11911 Len=0"
"5.540611","5.9.29.183","172.19.0.3","TLSv1.2","167","Application Data"
"5.540629","172.19.0.3","5.9.29.183","TCP","56","43520 → 9002 [ACK] Seq=5344 Ack=80715 Win=11911 Len=0"
"5.546045","172.19.0.3","5.9.29.183","TLSv1.2","599","Application Data"
"5.546326","5.9.29.183","172.19.0.3","TCP","56","9002 → 43520 [ACK] Seq=80715 Ack=5887 Win=65535 Len=0"
"6.035871","172.19.0.3","5.9.29.183","TLSv1.2","1113","Application Data"
"6.036255","5.9.29.183","172.19.0.3","TCP","56","9002 → 43520 [ACK] Seq=80715 Ack=6944 Win=65535 Len=0"
"6.092176","5.9.29.183","172.19.0.3","TLSv1.2","599","Application Data"
"6.093319","172.19.0.3","5.9.29.183","TLSv1.2","599","Application Data"
"6.093672","5.9.29.183","172.19.0.3","TCP","56","9002 → 43520 [ACK] Seq=81258 Ack=7487 Win=65535 Len=0"
"6.114966","5.9.29.183","172.19.0.3","TLSv1.2","599","Application Data"
"6.115542","172.19.0.3","5.9.29.183","TLSv1.2","599","Application Data"
"6.115902","5.9.29.183","172.19.0.3","TCP","56","9002 → 43520 [ACK] Seq=81801 Ack=8030 Win=65535 Len=0"
"6.214558","5.9.29.183","172.19.0.3","TLSv1.2","599","Application Data"
"6.215296","172.19.0.3","5.9.29.183","TLSv1.2","599","Application Data"
"6.216031","5.9.29.183","172.19.0.3","TCP","56","9002 → 43520 [ACK] Seq=82344 Ack=8573 Win=65535 Len=0"
"6.604468","5.9.29.183","172.19.0.3","TLSv1.2","599","Application Data"
"6.649789","172.19.0.3","5.9.29.183","TCP","56","43520 → 9002 [ACK] Seq=8573 Ack=82887 Win=11911 Len=0"
"6.702648","5.9.29.183","172.19.0.3","TCP","1516","[TCP segment of a reassembled PDU]"
"6.702672","172.19.0.3","5.9.29.183","TCP","56","43520 → 9002 [ACK] Seq=8573 Ack=84347 Win=11909 Len=0"
"6.702732","5.9.29.183","172.19.0.3","TCP","1516","9002 → 43520 [PSH, ACK] Seq=84347 Ack=8573 Win=65535 Len=1460 [TCP segment of a reassembled PDU]"
"6.702753","172.19.0.3","5.9.29.183","TCP","56","43520 → 9002 [ACK] Seq=8573 Ack=85807 Win=11901 Len=0"
"6.702756","5.9.29.183","172.19.0.3","TLSv1.2","763","Application Data"
"6.702764","172.19.0.3","5.9.29.183","TCP","56","43520 → 9002 [ACK] Seq=8573 Ack=86514 Win=11896 Len=0"
"6.752051","5.9.29.183","172.19.0.3","TCP","1516","[TCP segment of a reassembled PDU]"
"6.752072","172.19.0.3","5.9.29.183","TCP","56","43520 → 9002 [ACK] Seq=8573 Ack=87974 Win=11911 Len=0"
"6.752112","5.9.29.183","172.19.0.3","TCP","1492","9002 → 43520 [PSH, ACK] Seq=87974 Ack=8573 Win=65535 Len=1436 [TCP segment of a reassembled PDU]"
"6.752121","172.19.0.3","5.9.29.183","TCP","56","43520 → 9002 [ACK] Seq=8573 Ack=89410 Win=11903 Len=0"
"6.752123","5.9.29.183","172.19.0.3","TLSv1.2","787","Application Data"
"6.752128","172.19.0.3","5.9.29.183","TCP","56","43520 → 9002 [ACK] Seq=8573 Ack=90141 Win=11898 Len=0"
"6.800720","5.9.29.183","172.19.0.3","TLSv1.2","1113","Application Data"
"6.800743","172.19.0.3","5.9.29.183","TCP","56","43520 → 9002 [ACK] Seq=8573 Ack=91198 Win=11911 Len=0"
"6.833536","5.9.29.183","172.19.0.3","TCP","1516","[TCP segment of a reassembled PDU]"
"6.833557","172.19.0.3","5.9.29.183","TCP","56","43520 → 9002 [ACK] Seq=8573 Ack=92658 Win=11911 Len=0"
"6.833599","5.9.29.183","172.19.0.3","TCP","1492","9002 → 43520 [PSH, ACK] Seq=92658 Ack=8573 Win=65535 Len=1436 [TCP segment of a reassembled PDU]"
"6.833608","172.19.0.3","5.9.29.183","TCP","56","43520 → 9002 [ACK] Seq=8573 Ack=94094 Win=11903 Len=0"
"6.833610","5.9.29.183","172.19.0.3","TLSv1.2","1237","Application Data"
"6.833615","172.19.0.3","5.9.29.183","TCP","56","43520 → 9002 [ACK] Seq=8573 Ack=95275 Win=11895 Len=0"
"6.849484","5.9.29.183","172.19.0.3","TLSv1.2","149","Application Data"
"6.849508","172.19.0.3","5.9.29.183","TCP","56","43520 → 9002 [ACK] Seq=8573 Ack=95368 Win=11911 Len=0"
"6.866347","5.9.29.183","172.19.0.3","TCP","1516","[TCP segment of a reassembled PDU]"
"6.866369","172.19.0.3","5.9.29.183","TCP","56","43520 → 9002 [ACK] Seq=8573 Ack=96828 Win=11911 Len=0"
"6.866419","5.9.29.183","172.19.0.3","TCP","1516","9002 → 43520 [PSH, ACK] Seq=96828 Ack=8573 Win=65535 Len=1460 [TCP segment of a reassembled PDU]"
"6.866432","172.19.0.3","5.9.29.183","TCP","56","43520 → 9002 [ACK] Seq=8573 Ack=98288 Win=11903 Len=0"
"6.866434","5.9.29.183","172.19.0.3","TLSv1.2","763","Application Data"
"6.866440","172.19.0.3","5.9.29.183","TCP","56","43520 → 9002 [ACK] Seq=8573 Ack=98995 Win=11898 Len=0"
"6.866858","172.19.0.3","5.9.29.183","TLSv1.2","599","Application Data"
"6.867120","5.9.29.183","172.19.0.3","TCP","56","9002 → 43520 [ACK] Seq=98995 Ack=9116 Win=65535 Len=0"
"6.917271","5.9.29.183","172.19.0.3","TCP","1504","[TCP segment of a reassembled PDU]"
"6.917341","5.9.29.183","172.19.0.3","TCP","1504","9002 → 43520 [PSH, ACK] Seq=100443 Ack=9116 Win=65535 Len=1448 [TCP segment of a reassembled PDU]"
"6.917439","172.19.0.3","5.9.29.183","TCP","56","43520 → 9002 [ACK] Seq=9116 Ack=101891 Win=11903 Len=0"
"6.917661","5.9.29.183","172.19.0.3","TLSv1.2","1237","Application Data"
"6.933094","5.9.29.183","172.19.0.3","TLSv1.2","149","Application Data"
"6.933408","172.19.0.3","5.9.29.183","TCP","56","43520 → 9002 [ACK] Seq=9116 Ack=103165 Win=11911 Len=0"
"6.951818","5.9.29.183","172.19.0.3","TLSv1.2","1113","Application Data"
"6.995865","172.19.0.3","5.9.29.183","TCP","56","43520 → 9002 [ACK] Seq=9116 Ack=104222 Win=11911 Len=0"
"7.033647","5.9.29.183","172.19.0.3","TCP","1516","[TCP segment of a reassembled PDU]"
"7.033711","5.9.29.183","172.19.0.3","TCP","1516","9002 → 43520 [PSH, ACK] Seq=105682 Ack=9116 Win=65535 Len=1460 [TCP segment of a reassembled PDU]"
"7.033723","5.9.29.183","172.19.0.3","TLSv1.2","763","Application Data"
"7.033835","172.19.0.3","5.9.29.183","TCP","56","43520 → 9002 [ACK] Seq=9116 Ack=107849 Win=11893 Len=0"
"7.090845","5.9.29.183","172.19.0.3","TCP","1516","[TCP segment of a reassembled PDU]"
"7.090909","5.9.29.183","172.19.0.3","TCP","1516","9002 → 43520 [PSH, ACK] Seq=109309 Ack=9116 Win=65535 Len=1460 [TCP segment of a reassembled PDU]"
"7.090928","172.19.0.3","5.9.29.183","TCP","56","43520 → 9002 [ACK] Seq=9116 Ack=110769 Win=11903 Len=0"
"7.090930","5.9.29.183","172.19.0.3","TLSv1.2","763","Application Data"
"7.091060","172.19.0.3","5.9.29.183","TCP","56","43520 → 9002 [ACK] Seq=9116 Ack=111476 Win=11911 Len=0"
"7.091354","172.19.0.3","5.9.29.183","TLSv1.2","599","Application Data"
"7.091588","5.9.29.183","172.19.0.3","TCP","56","9002 → 43520 [ACK] Seq=111476 Ack=9659 Win=65535 Len=0"
"7.157868","5.9.29.183","172.19.0.3","TLSv1.2","599","Application Data"
"7.176216","5.9.29.183","172.19.0.3","TCP","1516","[TCP segment of a reassembled PDU]"
"7.176246","172.19.0.3","5.9.29.183","TCP","56","43520 → 9002 [ACK] Seq=9659 Ack=113479 Win=11911 Len=0"
"7.176313","5.9.29.183","172.19.0.3","TCP","1516","9002 → 43520 [PSH, ACK] Seq=113479 Ack=9659 Win=65535 Len=1460 [TCP segment of a reassembled PDU]"
"7.176370","5.9.29.183","172.19.0.3","TLSv1.2","763","Application Data"
"7.176509","172.19.0.3","5.9.29.183","TCP","56","43520 → 9002 [ACK] Seq=9659 Ack=115646 Win=11895 Len=0"
"7.224157","5.9.29.183","172.19.0.3","TCP","1516","[TCP segment of a reassembled PDU]"
"7.224233","5.9.29.183","172.19.0.3","TLSv1.2","1195","Application Data"
"7.224260","172.19.0.3","5.9.29.183","TCP","56","43520 → 9002 [ACK] Seq=9659 Ack=118245 Win=11903 Len=0"
"7.258268","5.9.29.183","172.19.0.3","TCP","1516","[TCP segment of a reassembled PDU]"
"7.258332","5.9.29.183","172.19.0.3","TCP","1516","9002 → 43520 [PSH, ACK] Seq=119705 Ack=9659 Win=65535 Len=1460 [TCP segment of a reassembled PDU]"
"7.258350","172.19.0.3","5.9.29.183","TCP","56","43520 → 9002 [ACK] Seq=9659 Ack=121165 Win=11903 Len=0"
"7.258353","5.9.29.183","172.19.0.3","TLSv1.2","763","Application Data"
"7.300116","172.19.0.3","5.9.29.183","TCP","56","43520 → 9002 [ACK] Seq=9659 Ack=121872 Win=11911 Len=0"
"7.312888","5.9.29.183","172.19.0.3","TLSv1.2","1113","Application Data"
"7.313158","172.19.0.3","5.9.29.183","TCP","56","43520 → 9002 [ACK] Seq=9659 Ack=122929 Win=11911 Len=0"
"7.345586","5.9.29.183","172.19.0.3","TCP","1516","[TCP segment of a reassembled PDU]"
"7.345660","5.9.29.183","172.19.0.3","TCP","1516","9002 → 43520 [PSH, ACK] Seq=124389 Ack=9659 Win=65535 Len=1460 [TCP segment of a reassembled PDU]"
"7.345676","5.9.29.183","172.19.0.3","TLSv1.2","763","Application Data"
"7.345884","172.19.0.3","5.9.29.183","TCP","56","43520 → 9002 [ACK] Seq=9659 Ack=126556 Win=11895 Len=0"
"7.360947","5.9.29.183","172.19.0.3","TCP","1516","[TCP segment of a reassembled PDU]"
"7.361017","5.9.29.183","172.19.0.3","TCP","1492","9002 → 43520 [PSH, ACK] Seq=128016 Ack=9659 Win=65535 Len=1436 [TCP segment of a reassembled PDU]"
"7.361035","172.19.0.3","5.9.29.183","TCP","56","43520 → 9002 [ACK] Seq=9659 Ack=129452 Win=11901 Len=0"
"7.361038","5.9.29.183","172.19.0.3","TLSv1.2","787","Application Data"
"7.361208","172.19.0.3","5.9.29.183","TCP","56","43520 → 9002 [ACK] Seq=9659 Ack=130183 Win=11911 Len=0"
"7.388412","5.9.29.183","172.19.0.3","TCP","1516","[TCP segment of a reassembled PDU]"
"7.388494","5.9.29.183","172.19.0.3","TCP","1282","9002 → 43520 [PSH, ACK] Seq=131643 Ack=9659 Win=65535 Len=1226 [TCP segment of a reassembled PDU]"
"7.388524","5.9.29.183","172.19.0.3","TLSv1.2","1447","Application Data"
"7.388677","172.19.0.3","5.9.29.183","TCP","56","43520 → 9002 [ACK] Seq=9659 Ack=134260 Win=11895 Len=0"
"7.403871","5.9.29.183","172.19.0.3","TLSv1.2","663","Application Data"
"7.404099","172.19.0.3","5.9.29.183","TCP","56","43520 → 9002 [ACK] Seq=9659 Ack=134867 Win=11911 Len=0"
"7.404321","172.19.0.3","5.9.29.183","TLSv1.2","599","Application Data"
"7.404618","5.9.29.183","172.19.0.3","TCP","56","9002 → 43520 [ACK] Seq=134867 Ack=10202 Win=65535 Len=0"
"7.428169","5.9.29.183","172.19.0.3","TLSv1.2","599","Application Data"
"7.473202","172.19.0.3","5.9.29.183","TCP","56","43520 → 9002 [ACK] Seq=10202 Ack=135410 Win=11911 Len=0"
"7.623324","5.9.29.183","172.19.0.3","TCP","1516","[TCP segment of a reassembled PDU]"
"7.623403","5.9.29.183","172.19.0.3","TCP","1516","9002 → 43520 [PSH, ACK] Seq=136870 Ack=10202 Win=65535 Len=1460 [TCP segment of a reassembled PDU]"
"7.623418","5.9.29.183","172.19.0.3","TLSv1.2","763","Application Data"
"7.623594","172.19.0.3","5.9.29.183","TCP","56","43520 → 9002 [ACK] Seq=10202 Ack=139037 Win=11895 Len=0"
"7.670428","5.9.29.183","172.19.0.3","TCP","1516","[TCP segment of a reassembled PDU]"
"7.670494","5.9.29.183","172.19.0.3","TCP","1516","9002 → 43520 [PSH, ACK] Seq=140497 Ack=10202 Win=65535 Len=1460 [TCP segment of a reassembled PDU]"
"7.670515","172.19.0.3","5.9.29.183","TCP","56","43520 → 9002 [ACK] Seq=10202 Ack=141957 Win=11903 Len=0"
"7.670517","5.9.29.183","172.19.0.3","TLSv1.2","1213","Application Data"
"7.670654","172.19.0.3","5.9.29.183","TCP","56","43520 → 9002 [ACK] Seq=10202 Ack=143114 Win=11911 Len=0"
"7.685917","5.9.29.183","172.19.0.3","TLSv1.2","149","Application Data"
"7.686122","172.19.0.3","5.9.29.183","TCP","56","43520 → 9002 [ACK] Seq=10202 Ack=143207 Win=11911 Len=0"
"7.716960","5.9.29.183","172.19.0.3","TCP","1516","[TCP segment of a reassembled PDU]"
"7.717038","5.9.29.183","172.19.0.3","TCP","1516","9002 → 43520 [PSH, ACK] Seq=144667 Ack=10202 Win=65535 Len=1460 [TCP segment of a reassembled PDU]"
"7.717047","5.9.29.183","172.19.0.3","TLSv1.2","1213","Application Data"
"7.717263","172.19.0.3","5.9.29.183","TCP","56","43520 → 9002 [ACK] Seq=10202 Ack=147284 Win=11895 Len=0"
"7.732863","5.9.29.183","172.19.0.3","TLSv1.2","149","Application Data"
"7.733163","172.19.0.3","5.9.29.183","TCP","56","43520 → 9002 [ACK] Seq=10202 Ack=147377 Win=11911 Len=0"
"7.750383","5.9.29.183","172.19.0.3","TCP","1504","[TCP segment of a reassembled PDU]"
"7.750529","5.9.29.183","172.19.0.3","TCP","1516","9002 → 43520 [PSH, ACK] Seq=148825 Ack=10202 Win=65535 Len=1460 [TCP segment of a reassembled PDU]"
"7.750536","5.9.29.183","172.19.0.3","TLSv1.2","775","Application Data"
"7.750644","172.19.0.3","5.9.29.183","TCP","56","43520 → 9002 [ACK] Seq=10202 Ack=151004 Win=11893 Len=0"
"7.750934","172.19.0.3","5.9.29.183","TLSv1.2","599","Application Data"
"7.751194","5.9.29.183","172.19.0.3","TCP","56","9002 → 43520 [ACK] Seq=151004 Ack=10745 Win=65535 Len=0"
"7.766987","5.9.29.183","172.19.0.3","TLSv1.2","1113","Application Data"
"7.807774","172.19.0.3","5.9.29.183","TCP","56","43520 → 9002 [ACK] Seq=10745 Ack=152061 Win=11911 Len=0"
"7.863952","5.9.29.183","172.19.0.3","TCP","1516","[TCP segment of a reassembled PDU]"
"7.864030","5.9.29.183","172.19.0.3","TCP","1516","9002 → 43520 [PSH, ACK] Seq=153521 Ack=10745 Win=65535 Len=1460 [TCP segment of a reassembled PDU]"
"7.864046","5.9.29.183","172.19.0.3","TLSv1.2","763","Application Data"
"7.864188","172.19.0.3","5.9.29.183","TCP","56","43520 → 9002 [ACK] Seq=10745 Ack=155688 Win=11895 Len=0"
"7.912635","5.9.29.183","172.19.0.3","TCP","1516","[TCP segment of a reassembled PDU]"
"7.912701","5.9.29.183","172.19.0.3","TCP","1516","9002 → 43520 [PSH, ACK] Seq=157148 Ack=10745 Win=65535 Len=1460 [TCP segment of a reassembled PDU]"
"7.912732","172.19.0.3","5.9.29.183","TCP","56","43520 → 9002 [ACK] Seq=10745 Ack=158608 Win=11903 Len=0"
"7.912735","5.9.29.183","172.19.0.3","TLSv1.2","1213","Application Data"
"7.913116","172.19.0.3","5.9.29.183","TCP","56","43520 → 9002 [ACK] Seq=10745 Ack=159765 Win=11911 Len=0"
"7.928087","5.9.29.183","172.19.0.3","TLSv1.2","149","Application Data"
"7.928185","172.19.0.3","5.9.29.183","TCP","56","43520 → 9002 [ACK] Seq=10745 Ack=159858 Win=11911 Len=0"
"7.984589","5.9.29.183","172.19.0.3","TLSv1.2","1113","Application Data"
"7.984842","172.19.0.3","5.9.29.183","TCP","56","43520 → 9002 [ACK] Seq=10745 Ack=160915 Win=11911 Len=0"
"7.990288","172.19.0.3","5.9.29.183","TLSv1.2","599","Application Data"
"7.990578","5.9.29.183","172.19.0.3","TCP","56","9002 → 43520 [ACK] Seq=160915 Ack=11288 Win=65535 Len=0"
"9.177523","5.9.29.183","172.19.0.3","TLSv1.2","599","Application Data"
"9.178339","172.19.0.3","5.9.29.183","TLSv1.2","599","Application Data"
"9.178699","5.9.29.183","172.19.0.3","TCP","56","9002 → 43520 [ACK] Seq=161458 Ack=11831 Win=65535 Len=0"
"9.754984","5.9.29.183","172.19.0.3","TLSv1.2","599","Application Data"
"9.795556","172.19.0.3","5.9.29.183","TCP","56","43520 → 9002 [ACK] Seq=11831 Ack=162001 Win=11911 Len=0"
"10.397250","5.9.29.183","172.19.0.3","TCP","1516","[TCP segment of a reassembled PDU]"
"10.397275","172.19.0.3","5.9.29.183","TCP","56","43520 → 9002 [ACK] Seq=11831 Ack=163461 Win=11911 Len=0"
"10.397472","5.9.29.183","172.19.0.3","TCP","1492","9002 → 43520 [PSH, ACK] Seq=163461 Ack=11831 Win=65535 Len=1436 [TCP segment of a reassembled PDU]"
"10.397487","172.19.0.3","5.9.29.183","TCP","56","43520 → 9002 [ACK] Seq=11831 Ack=164897 Win=11903 Len=0"
"10.397723","5.9.29.183","172.19.0.3","TLSv1.2","1516","Application Data [TCP segment of a reassembled PDU]"
"10.397734","172.19.0.3","5.9.29.183","TCP","56","43520 → 9002 [ACK] Seq=11831 Ack=166357 Win=11911 Len=0"
"10.397801","5.9.29.183","172.19.0.3","TCP","1516","9002 → 43520 [PSH, ACK] Seq=166357 Ack=11831 Win=65535 Len=1460 [TCP segment of a reassembled PDU]"
"10.397812","172.19.0.3","5.9.29.183","TCP","56","43520 → 9002 [ACK] Seq=11831 Ack=167817 Win=11903 Len=0"
"10.397886","5.9.29.183","172.19.0.3","TCP","763","9002 → 43520 [PSH, ACK] Seq=167817 Ack=11831 Win=65535 Len=707 [TCP segment of a reassembled PDU]"
"10.397896","172.19.0.3","5.9.29.183","TCP","56","43520 → 9002 [ACK] Seq=11831 Ack=168524 Win=11898 Len=0"
"10.398106","5.9.29.183","172.19.0.3","TLSv1.2","1516","Application Data [TCP segment of a reassembled PDU]"
"10.398117","172.19.0.3","5.9.29.183","TCP","56","43520 → 9002 [ACK] Seq=11831 Ack=169984 Win=11911 Len=0"
"10.398120","5.9.29.183","172.19.0.3","TCP","1516","9002 → 43520 [PSH, ACK] Seq=169984 Ack=11831 Win=65535 Len=1460 [TCP segment of a reassembled PDU]"
"10.398128","172.19.0.3","5.9.29.183","TCP","56","43520 → 9002 [ACK] Seq=11831 Ack=171444 Win=11903 Len=0"
"10.398130","5.9.29.183","172.19.0.3","TCP","763","9002 → 43520 [PSH, ACK] Seq=171444 Ack=11831 Win=65535 Len=707 [TCP segment of a reassembled PDU]"
"10.398137","172.19.0.3","5.9.29.183","TCP","56","43520 → 9002 [ACK] Seq=11831 Ack=172151 Win=11898 Len=0"
"10.413950","5.9.29.183","172.19.0.3","TLSv1.2","1516","Application Data [TCP segment of a reassembled PDU]"
"10.414018","172.19.0.3","5.9.29.183","TCP","56","43520 → 9002 [ACK] Seq=11831 Ack=173611 Win=11911 Len=0"
"10.414099","5.9.29.183","172.19.0.3","TCP","1492","9002 → 43520 [PSH, ACK] Seq=173611 Ack=11831 Win=65535 Len=1436 [TCP segment of a reassembled PDU]"
"10.414151","172.19.0.3","5.9.29.183","TCP","56","43520 → 9002 [ACK] Seq=11831 Ack=175047 Win=11903 Len=0"
"10.414177","5.9.29.183","172.19.0.3","TCP","1516","9002 → 43520 [PSH, ACK] Seq=175047 Ack=11831 Win=65535 Len=1460 [TCP segment of a reassembled PDU]"
"10.414189","172.19.0.3","5.9.29.183","TCP","56","43520 → 9002 [ACK] Seq=11831 Ack=176507 Win=11895 Len=0"
"10.414191","5.9.29.183","172.19.0.3","TLSv1.2","1115","Application Data, Application Data"
"10.414233","172.19.0.3","5.9.29.183","TCP","56","43520 → 9002 [ACK] Seq=11831 Ack=177566 Win=11887 Len=0"
"10.515997","5.9.29.183","172.19.0.3","TCP","1504","[TCP segment of a reassembled PDU]"
"10.516015","172.19.0.3","5.9.29.183","TCP","56","43520 → 9002 [ACK] Seq=11831 Ack=179014 Win=11911 Len=0"
"10.516051","5.9.29.183","172.19.0.3","TCP","1516","9002 → 43520 [PSH, ACK] Seq=179014 Ack=11831 Win=65535 Len=1460 [TCP segment of a reassembled PDU]"
"10.516065","172.19.0.3","5.9.29.183","TCP","56","43520 → 9002 [ACK] Seq=11831 Ack=180474 Win=11903 Len=0"
"10.516068","5.9.29.183","172.19.0.3","TLSv1.2","775","Application Data"
"10.516078","172.19.0.3","5.9.29.183","TCP","56","43520 → 9002 [ACK] Seq=11831 Ack=181193 Win=11898 Len=0"
"10.635224","5.9.29.183","172.19.0.3","TLSv1.2","599","Application Data"
"10.635244","172.19.0.3","5.9.29.183","TCP","56","43520 → 9002 [ACK] Seq=11831 Ack=181736 Win=11911 Len=0"
"10.686058","5.9.29.183","172.19.0.3","TCP","1504","[TCP segment of a reassembled PDU]"
"10.686123","5.9.29.183","172.19.0.3","TCP","1516","9002 → 43520 [PSH, ACK] Seq=183184 Ack=11831 Win=65535 Len=1460 [TCP segment of a reassembled PDU]"
"10.686131","5.9.29.183","172.19.0.3","TLSv1.2","775","Application Data"
"10.686254","172.19.0.3","5.9.29.183","TCP","56","43520 → 9002 [ACK] Seq=11831 Ack=185363 Win=11895 Len=0"
"10.687677","172.19.0.3","5.9.29.183","TLSv1.2","599","Application Data"
"10.688191","5.9.29.183","172.19.0.3","TCP","56","9002 → 43520 [ACK] Seq=185363 Ack=12374 Win=65535 Len=0"
"10.697439","172.19.0.3","5.9.29.183","TLSv1.2","599","Application Data"
"10.697762","5.9.29.183","172.19.0.3","TCP","56","9002 → 43520 [ACK] Seq=185363 Ack=12917 Win=65535 Len=0"
"10.737222","5.9.29.183","172.19.0.3","TLSv1.2","599","Application Data"
"10.777460","172.19.0.3","5.9.29.183","TCP","56","43520 → 9002 [ACK] Seq=12917 Ack=185906 Win=11911 Len=0"
"11.625103","5.9.29.183","172.19.0.3","TLSv1.2","599","Application Data"
"11.625169","172.19.0.3","5.9.29.183","TCP","56","43520 → 9002 [ACK] Seq=12917 Ack=186449 Win=11911 Len=0"
"11.625935","172.19.0.3","5.9.29.183","TLSv1.2","599","Application Data"
"11.626130","5.9.29.183","172.19.0.3","TCP","56","9002 → 43520 [ACK] Seq=186449 Ack=13460 Win=65535 Len=0"
"12.562911","5.9.29.183","172.19.0.3","TLSv1.2","599","Application Data"
"12.605577","172.19.0.3","5.9.29.183","TCP","56","43520 → 9002 [ACK] Seq=13460 Ack=186992 Win=11911 Len=0"
"12.753182","5.9.29.183","172.19.0.3","TCP","1516","[TCP segment of a reassembled PDU]"
"12.753207","172.19.0.3","5.9.29.183","TCP","56","43520 → 9002 [ACK] Seq=13460 Ack=188452 Win=11911 Len=0"
"12.753271","5.9.29.183","172.19.0.3","TCP","1516","9002 → 43520 [PSH, ACK] Seq=188452 Ack=13460 Win=65535 Len=1460 [TCP segment of a reassembled PDU]"
"12.753289","172.19.0.3","5.9.29.183","TCP","56","43520 → 9002 [ACK] Seq=13460 Ack=189912 Win=11903 Len=0"
"12.753435","5.9.29.183","172.19.0.3","TLSv1.2","763","Application Data"
"12.753456","172.19.0.3","5.9.29.183","TCP","56","43520 → 9002 [ACK] Seq=13460 Ack=190619 Win=11911 Len=0"
"12.891319","5.9.29.183","172.19.0.3","TCP","1516","[TCP segment of a reassembled PDU]"
"12.891343","172.19.0.3","5.9.29.183","TCP","56","43520 → 9002 [ACK] Seq=13460 Ack=192079 Win=11911 Len=0"
"12.891393","5.9.29.183","172.19.0.3","TCP","1516","9002 → 43520 [PSH, ACK] Seq=192079 Ack=13460 Win=65535 Len=1460 [TCP segment of a reassembled PDU]"
"12.891405","172.19.0.3","5.9.29.183","TCP","56","43520 → 9002 [ACK] Seq=13460 Ack=193539 Win=11903 Len=0"
"12.891408","5.9.29.183","172.19.0.3","TLSv1.2","763","Application Data"
"12.891414","172.19.0.3","5.9.29.183","TCP","56","43520 → 9002 [ACK] Seq=13460 Ack=194246 Win=11898 Len=0"
"12.977201","5.9.29.183","172.19.0.3","TLSv1.2","599","Application Data"
"12.977226","172.19.0.3","5.9.29.183","TCP","56","43520 → 9002 [ACK] Seq=13460 Ack=194789 Win=11911 Len=0"
"13.236934","5.9.29.183","172.19.0.3","TCP","1516","[TCP segment of a reassembled PDU]"
"13.236964","172.19.0.3","5.9.29.183","TCP","56","43520 → 9002 [ACK] Seq=13460 Ack=196249 Win=11911 Len=0"
"13.237024","5.9.29.183","172.19.0.3","TCP","1516","9002 → 43520 [PSH, ACK] Seq=196249 Ack=13460 Win=65535 Len=1460 [TCP segment of a reassembled PDU]"
"13.237041","172.19.0.3","5.9.29.183","TCP","56","43520 → 9002 [ACK] Seq=13460 Ack=197709 Win=11903 Len=0"
"13.237043","5.9.29.183","172.19.0.3","TCP","752","9002 → 43520 [PSH, ACK] Seq=197709 Ack=13460 Win=65535 Len=696 [TCP segment of a reassembled PDU]"
"13.237048","172.19.0.3","5.9.29.183","TCP","56","43520 → 9002 [ACK] Seq=13460 Ack=198405 Win=11898 Len=0"
"13.237134","5.9.29.183","172.19.0.3","TLSv1.2","67","Application Data"
"13.237142","172.19.0.3","5.9.29.183","TCP","56","43520 → 9002 [ACK] Seq=13460 Ack=198416 Win=11898 Len=0"
"13.316048","5.9.29.183","172.19.0.3","TLSv1.2","1113","Application Data"
"13.316073","172.19.0.3","5.9.29.183","TCP","56","43520 → 9002 [ACK] Seq=13460 Ack=199473 Win=11911 Len=0"
"13.319923","172.19.0.3","5.9.29.183","TLSv1.2","599","Application Data"
"13.320255","5.9.29.183","172.19.0.3","TCP","56","9002 → 43520 [ACK] Seq=199473 Ack=14003 Win=65535 Len=0"
"14.086714","5.9.29.183","172.19.0.3","TLSv1.2","599","Application Data"
"14.087734","172.19.0.3","5.9.29.183","TLSv1.2","599","Application Data"
"14.088098","5.9.29.183","172.19.0.3","TCP","56","9002 → 43520 [ACK] Seq=200016 Ack=14546 Win=65535 Len=0"
"14.714122","5.9.29.183","172.19.0.3","TCP","1516","[TCP segment of a reassembled PDU]"
"14.714199","5.9.29.183","172.19.0.3","TCP","1516","9002 → 43520 [PSH, ACK] Seq=201476 Ack=14546 Win=65535 Len=1460 [TCP segment of a reassembled PDU]"
"14.714216","5.9.29.183","172.19.0.3","TLSv1.2","763","Application Data"
"14.714655","172.19.0.3","5.9.29.183","TCP","56","43520 → 9002 [ACK] Seq=14546 Ack=203643 Win=11895 Len=0"
"14.884229","5.9.29.183","172.19.0.3","TCP","1516","[TCP segment of a reassembled PDU]"
"14.884277","5.9.29.183","172.19.0.3","TCP","1516","9002 → 43520 [PSH, ACK] Seq=205103 Ack=14546 Win=65535 Len=1460 [TCP segment of a reassembled PDU]"
"14.884292","172.19.0.3","5.9.29.183","TCP","56","43520 → 9002 [ACK] Seq=14546 Ack=206563 Win=11903 Len=0"
"14.884293","5.9.29.183","172.19.0.3","TLSv1.2","763","Application Data"
"14.884541","172.19.0.3","5.9.29.183","TLSv1.2","599","Application Data"
"14.884710","5.9.29.183","172.19.0.3","TCP","56","9002 → 43520 [ACK] Seq=207270 Ack=15089 Win=65535 Len=0"
"14.989960","5.9.29.183","172.19.0.3","TCP","1516","[TCP segment of a reassembled PDU]"
"14.990040","5.9.29.183","172.19.0.3","TCP","1516","9002 → 43520 [PSH, ACK] Seq=208730 Ack=15089 Win=65535 Len=1460 [TCP segment of a reassembled PDU]"
"14.990052","5.9.29.183","172.19.0.3","TLSv1.2","763","Application Data"
"14.990216","172.19.0.3","5.9.29.183","TCP","56","43520 → 9002 [ACK] Seq=15089 Ack=210897 Win=11895 Len=0"
"14.993614","172.19.0.3","5.9.29.183","TLSv1.2","599","Application Data"
"14.993869","5.9.29.183","172.19.0.3","TCP","56","9002 → 43520 [ACK] Seq=210897 Ack=15632 Win=65535 Len=0"
"16.075758","5.9.29.183","172.19.0.3","TLSv1.2","599","Application Data"
"16.076338","172.19.0.3","5.9.29.183","TLSv1.2","599","Application Data"
"16.076586","5.9.29.183","172.19.0.3","TCP","56","9002 → 43520 [ACK] Seq=211440 Ack=16175 Win=65535 Len=0"
"16.824949","5.9.29.183","172.19.0.3","TLSv1.2","599","Application Data"
"16.867222","172.19.0.3","5.9.29.183","TCP","56","43520 → 9002 [ACK] Seq=16175 Ack=211983 Win=11911 Len=0"
"16.877373","5.9.29.183","172.19.0.3","TCP","1504","[TCP segment of a reassembled PDU]"
"16.877400","172.19.0.3","5.9.29.183","TCP","56","43520 → 9002 [ACK] Seq=16175 Ack=213431 Win=11911 Len=0"
"16.877416","5.9.29.183","172.19.0.3","TCP","1516","9002 → 43520 [PSH, ACK] Seq=213431 Ack=16175 Win=65535 Len=1460 [TCP segment of a reassembled PDU]"
"16.877426","172.19.0.3","5.9.29.183","TCP","56","43520 → 9002 [ACK] Seq=16175 Ack=214891 Win=11903 Len=0"
"16.877427","5.9.29.183","172.19.0.3","TLSv1.2","775","Application Data"
"16.877430","172.19.0.3","5.9.29.183","TCP","56","43520 → 9002 [ACK] Seq=16175 Ack=215610 Win=11898 Len=0"
"16.946018","5.9.29.183","172.19.0.3","TCP","1516","[TCP segment of a reassembled PDU]"
"16.946047","172.19.0.3","5.9.29.183","TCP","56","43520 → 9002 [ACK] Seq=16175 Ack=217070 Win=11911 Len=0"
"16.946068","5.9.29.183","172.19.0.3","TCP","1516","9002 → 43520 [PSH, ACK] Seq=217070 Ack=16175 Win=65535 Len=1460 [TCP segment of a reassembled PDU]"
"16.946075","172.19.0.3","5.9.29.183","TCP","56","43520 → 9002 [ACK] Seq=16175 Ack=218530 Win=11903 Len=0"
"16.946077","5.9.29.183","172.19.0.3","TLSv1.2","763","Application Data"
"16.946081","172.19.0.3","5.9.29.183","TCP","56","43520 → 9002 [ACK] Seq=16175 Ack=219237 Win=11898 Len=0"
"16.987329","5.9.29.183","172.19.0.3","TLSv1.2","599","Application Data"
"16.987352","172.19.0.3","5.9.29.183","TCP","56","43520 → 9002 [ACK] Seq=16175 Ack=219780 Win=11911 Len=0"
"17.025644","5.9.29.183","172.19.0.3","TCP","1504","[TCP segment of a reassembled PDU]"
"17.025667","172.19.0.3","5.9.29.183","TCP","56","43520 → 9002 [ACK] Seq=16175 Ack=221228 Win=11909 Len=0"
"17.025680","5.9.29.183","172.19.0.3","TCP","1516","9002 → 43520 [PSH, ACK] Seq=221228 Ack=16175 Win=65535 Len=1460 [TCP segment of a reassembled PDU]"
"17.025688","172.19.0.3","5.9.29.183","TCP","56","43520 → 9002 [ACK] Seq=16175 Ack=222688 Win=11901 Len=0"
"17.025690","5.9.29.183","172.19.0.3","TLSv1.2","775","Application Data"
"17.025695","172.19.0.3","5.9.29.183","TCP","56","43520 → 9002 [ACK] Seq=16175 Ack=223407 Win=11896 Len=0"
"17.060421","5.9.29.183","172.19.0.3","TCP","1504","[TCP segment of a reassembled PDU]"
"17.060442","172.19.0.3","5.9.29.183","TCP","56","43520 → 9002 [ACK] Seq=16175 Ack=224855 Win=11911 Len=0"
"17.060466","5.9.29.183","172.19.0.3","TCP","1516","9002 → 43520 [PSH, ACK] Seq=224855 Ack=16175 Win=65535 Len=1460 [TCP segment of a reassembled PDU]"
"17.060477","172.19.0.3","5.9.29.183","TCP","56","43520 → 9002 [ACK] Seq=16175 Ack=226315 Win=11903 Len=0"
"17.060480","5.9.29.183","172.19.0.3","TLSv1.2","775","Application Data"
"17.060485","172.19.0.3","5.9.29.183","TCP","56","43520 → 9002 [ACK] Seq=16175 Ack=227034 Win=11898 Len=0"
"17.140711","5.9.29.183","172.19.0.3","TCP","1516","[TCP segment of a reassembled PDU]"
"17.140734","172.19.0.3","5.9.29.183","TCP","56","43520 → 9002 [ACK] Seq=16175 Ack=228494 Win=11911 Len=0"
"17.140749","5.9.29.183","172.19.0.3","TCP","1492","9002 → 43520 [PSH, ACK] Seq=228494 Ack=16175 Win=65535 Len=1436 [TCP segment of a reassembled PDU]"
"17.140756","172.19.0.3","5.9.29.183","TCP","56","43520 → 9002 [ACK] Seq=16175 Ack=229930 Win=11903 Len=0"
"17.140758","5.9.29.183","172.19.0.3","TLSv1.2","1237","Application Data"
"17.140946","172.19.0.3","5.9.29.183","TCP","56","43520 → 9002 [ACK] Seq=16175 Ack=231111 Win=11911 Len=0"
"17.156534","5.9.29.183","172.19.0.3","TLSv1.2","149","Application Data"
"17.156683","172.19.0.3","5.9.29.183","TCP","56","43520 → 9002 [ACK] Seq=16175 Ack=231204 Win=11911 Len=0"
"17.157920","5.9.29.183","172.19.0.3","TCP","1504","[TCP segment of a reassembled PDU]"
"17.157933","5.9.29.183","172.19.0.3","TCP","1504","9002 → 43520 [PSH, ACK] Seq=232652 Ack=16175 Win=65535 Len=1448 [TCP segment of a reassembled PDU]"
"17.158005","172.19.0.3","5.9.29.183","TCP","56","43520 → 9002 [ACK] Seq=16175 Ack=234100 Win=11903 Len=0"
"17.171930","5.9.29.183","172.19.0.3","TLSv1.2","787","Application Data"
"17.172072","172.19.0.3","5.9.29.183","TCP","56","43520 → 9002 [ACK] Seq=16175 Ack=234831 Win=11911 Len=0"
"17.191082","5.9.29.183","172.19.0.3","TLSv1.2","1113","Application Data"
"17.191290","172.19.0.3","5.9.29.183","TCP","56","43520 → 9002 [ACK] Seq=16175 Ack=235888 Win=11911 Len=0"
"17.238369","5.9.29.183","172.19.0.3","TCP","1516","[TCP segment of a reassembled PDU]"
"17.238400","5.9.29.183","172.19.0.3","TCP","1516","9002 → 43520 [PSH, ACK] Seq=237348 Ack=16175 Win=65535 Len=1460 [TCP segment of a reassembled PDU]"
"17.238411","5.9.29.183","172.19.0.3","TLSv1.2","763","Application Data"
"17.238555","172.19.0.3","5.9.29.183","TCP","56","43520 → 9002 [ACK] Seq=16175 Ack=239515 Win=11895 Len=0"
"17.238835","172.19.0.3","5.9.29.183","TLSv1.2","599","Application Data"
"17.239161","5.9.29.183","172.19.0.3","TCP","56","9002 → 43520 [ACK] Seq=239515 Ack=16718 Win=65535 Len=0"
"17.249325","5.9.29.183","172.19.0.3","TCP","1504","[TCP segment of a reassembled PDU]"
"17.253498","5.9.29.183","172.19.0.3","TCP","1504","9002 → 43520 [PSH, ACK] Seq=240963 Ack=16718 Win=65535 Len=1448 [TCP segment of a reassembled PDU]"
"17.253554","172.19.0.3","5.9.29.183","TCP","56","43520 → 9002 [ACK] Seq=16718 Ack=242411 Win=11911 Len=0"
"17.253567","5.9.29.183","172.19.0.3","TLSv1.2","1504","Application Data [TCP segment of a reassembled PDU]"
"17.253658","5.9.29.183","172.19.0.3","TCP","1504","9002 → 43520 [PSH, ACK] Seq=243859 Ack=16718 Win=65535 Len=1448 [TCP segment of a reassembled PDU]"
"17.253759","172.19.0.3","5.9.29.183","TCP","56","43520 → 9002 [ACK] Seq=16718 Ack=245307 Win=11893 Len=0"
"17.269085","5.9.29.183","172.19.0.3","TLSv1.2","1516","Application Data [TCP segment of a reassembled PDU]"
"17.269161","5.9.29.183","172.19.0.3","TCP","1516","9002 → 43520 [PSH, ACK] Seq=246767 Ack=16718 Win=65535 Len=1460 [TCP segment of a reassembled PDU]"
"17.269185","172.19.0.3","5.9.29.183","TCP","56","43520 → 9002 [ACK] Seq=16718 Ack=248227 Win=11903 Len=0"
"17.269190","5.9.29.183","172.19.0.3","TLSv1.2","169","Application Data"
"17.309610","172.19.0.3","5.9.29.183","TCP","56","43520 → 9002 [ACK] Seq=16718 Ack=248340 Win=11911 Len=0"
"17.311479","5.9.29.183","172.19.0.3","TCP","1504","[TCP segment of a reassembled PDU]"
"17.311562","5.9.29.183","172.19.0.3","TCP","1516","9002 → 43520 [PSH, ACK] Seq=249788 Ack=16718 Win=65535 Len=1460 [TCP segment of a reassembled PDU]"
"17.311606","5.9.29.183","172.19.0.3","TLSv1.2","1516","Application Data [TCP segment of a reassembled PDU]"
"17.311611","5.9.29.183","172.19.0.3","TCP","1516","9002 → 43520 [PSH, ACK] Seq=252708 Ack=16718 Win=65535 Len=1460 [TCP segment of a reassembled PDU]"
"17.311614","5.9.29.183","172.19.0.3","TCP","1201","9002 → 43520 [PSH, ACK] Seq=254168 Ack=16718 Win=65535 Len=1145 [TCP segment of a reassembled PDU]"
"17.311690","172.19.0.3","5.9.29.183","TCP","56","43520 → 9002 [ACK] Seq=16718 Ack=255313 Win=11879 Len=0"
"17.327491","5.9.29.183","172.19.0.3","TLSv1.2","851","Application Data"
"17.327692","172.19.0.3","5.9.29.183","TCP","56","43520 → 9002 [ACK] Seq=16718 Ack=256108 Win=11911 Len=0"
"17.347719","5.9.29.183","172.19.0.3","TCP","1516","[TCP segment of a reassembled PDU]"
"17.347793","5.9.29.183","172.19.0.3","TCP","1516","9002 → 43520 [PSH, ACK] Seq=257568 Ack=16718 Win=65535 Len=1460 [TCP segment of a reassembled PDU]"
"17.347805","5.9.29.183","172.19.0.3","TLSv1.2","763","Application Data"
"17.348081","172.19.0.3","5.9.29.183","TCP","56","43520 → 9002 [ACK] Seq=16718 Ack=259735 Win=11895 Len=0"
"17.348384","172.19.0.3","5.9.29.183","TLSv1.2","599","Application Data"
"17.348780","5.9.29.183","172.19.0.3","TCP","56","9002 → 43520 [ACK] Seq=259735 Ack=17261 Win=65535 Len=0"
"17.421328","5.9.29.183","172.19.0.3","TCP","1504","[TCP segment of a reassembled PDU]"
"17.421390","5.9.29.183","172.19.0.3","TCP","1516","9002 → 43520 [PSH, ACK] Seq=261183 Ack=17261 Win=65535 Len=1460 [TCP segment of a reassembled PDU]"
"17.421402","5.9.29.183","172.19.0.3","TLSv1.2","1354","Application Data [TCP segment of a reassembled PDU]"
"17.421428","5.9.29.183","172.19.0.3","TCP","1516","9002 → 43520 [PSH, ACK] Seq=263941 Ack=17261 Win=65535 Len=1460 [TCP segment of a reassembled PDU]"
"17.421432","5.9.29.183","172.19.0.3","TCP","1363","9002 → 43520 [PSH, ACK] Seq=265401 Ack=17261 Win=65535 Len=1307 [TCP segment of a reassembled PDU]"
"17.421538","172.19.0.3","5.9.29.183","TCP","56","43520 → 9002 [ACK] Seq=17261 Ack=266708 Win=11879 Len=0"
"17.421808","172.19.0.3","5.9.29.183","TLSv1.2","599","Application Data"
"17.422117","5.9.29.183","172.19.0.3","TCP","56","9002 → 43520 [ACK] Seq=266708 Ack=17804 Win=65535 Len=0"
"17.436561","5.9.29.183","172.19.0.3","TLSv1.2","1504","Application Data [TCP segment of a reassembled PDU]"
"17.436680","5.9.29.183","172.19.0.3","TLSv1.2","460","Application Data"
"17.436693","172.19.0.3","5.9.29.183","TCP","56","43520 → 9002 [ACK] Seq=17804 Ack=268560 Win=11901 Len=0"
"17.488260","5.9.29.183","172.19.0.3","TCP","1516","[TCP segment of a reassembled PDU]"
"17.488337","5.9.29.183","172.19.0.3","TCP","1492","9002 → 43520 [PSH, ACK] Seq=270020 Ack=17804 Win=65535 Len=1436 [TCP segment of a reassembled PDU]"
"17.488366","172.19.0.3","5.9.29.183","TCP","56","43520 → 9002 [ACK] Seq=17804 Ack=271456 Win=11903 Len=0"
"17.488368","5.9.29.183","172.19.0.3","TLSv1.2","787","Application Data"
"17.528954","172.19.0.3","5.9.29.183","TCP","56","43520 → 9002 [ACK] Seq=17804 Ack=272187 Win=11911 Len=0"
"17.547161","5.9.29.183","172.19.0.3","TCP","1516","[TCP segment of a reassembled PDU]"
"17.547226","5.9.29.183","172.19.0.3","TCP","1492","9002 → 43520 [PSH, ACK] Seq=273647 Ack=17804 Win=65535 Len=1436 [TCP segment of a reassembled PDU]"
"17.547237","5.9.29.183","172.19.0.3","TLSv1.2","1237","Application Data"
"17.547494","172.19.0.3","5.9.29.183","TCP","56","43520 → 9002 [ACK] Seq=17804 Ack=276264 Win=11895 Len=0"
"17.562567","5.9.29.183","172.19.0.3","TLSv1.2","663","Application Data"
"17.562857","172.19.0.3","5.9.29.183","TCP","56","43520 → 9002 [ACK] Seq=17804 Ack=276871 Win=11911 Len=0"
"17.566382","5.9.29.183","172.19.0.3","TCP","1516","[TCP segment of a reassembled PDU]"
"17.566435","5.9.29.183","172.19.0.3","TCP","1492","9002 → 43520 [PSH, ACK] Seq=278331 Ack=17804 Win=65535 Len=1436 [TCP segment of a reassembled PDU]"
"17.566602","172.19.0.3","5.9.29.183","TCP","56","43520 → 9002 [ACK] Seq=17804 Ack=279767 Win=11903 Len=0"
"17.578433","5.9.29.183","172.19.0.3","TLSv1.2","787","Application Data"
"17.578685","172.19.0.3","5.9.29.183","TCP","56","43520 → 9002 [ACK] Seq=17804 Ack=280498 Win=11911 Len=0"
"17.583101","5.9.29.183","172.19.0.3","TCP","1516","[TCP segment of a reassembled PDU]"
"17.583175","5.9.29.183","172.19.0.3","TCP","1492","9002 → 43520 [PSH, ACK] Seq=281958 Ack=17804 Win=65535 Len=1436 [TCP segment of a reassembled PDU]"
"17.583469","172.19.0.3","5.9.29.183","TCP","56","43520 → 9002 [ACK] Seq=17804 Ack=283394 Win=11903 Len=0"
"17.593647","5.9.29.183","172.19.0.3","TLSv1.2","787","Application Data"
"17.593934","172.19.0.3","5.9.29.183","TCP","56","43520 → 9002 [ACK] Seq=17804 Ack=284125 Win=11911 Len=0"
"17.615138","5.9.29.183","172.19.0.3","TCP","1516","[TCP segment of a reassembled PDU]"
"17.615204","5.9.29.183","172.19.0.3","TLSv1.2","681","Application Data"
"17.615434","172.19.0.3","5.9.29.183","TCP","56","43520 → 9002 [ACK] Seq=17804 Ack=286210 Win=11903 Len=0"
"17.661287","5.9.29.183","172.19.0.3","TCP","1516","[TCP segment of a reassembled PDU]"
"17.661394","5.9.29.183","172.19.0.3","TCP","1516","9002 → 43520 [PSH, ACK] Seq=287670 Ack=17804 Win=65535 Len=1460 [TCP segment of a reassembled PDU]"
"17.661418","172.19.0.3","5.9.29.183","TCP","56","43520 → 9002 [ACK] Seq=17804 Ack=289130 Win=11903 Len=0"
"17.661421","5.9.29.183","172.19.0.3","TLSv1.2","763","Application Data"
"17.661565","172.19.0.3","5.9.29.183","TCP","56","43520 → 9002 [ACK] Seq=17804 Ack=289837 Win=11911 Len=0"
"17.661819","172.19.0.3","5.9.29.183","TLSv1.2","599","Application Data"
"17.662109","5.9.29.183","172.19.0.3","TCP","56","9002 → 43520 [ACK] Seq=289837 Ack=18347 Win=65535 Len=0"
"17.709570","5.9.29.183","172.19.0.3","TCP","1516","[TCP segment of a reassembled PDU]"
"17.709635","5.9.29.183","172.19.0.3","TCP","1516","9002 → 43520 [PSH, ACK] Seq=291297 Ack=18347 Win=65535 Len=1460 [TCP segment of a reassembled PDU]"
"17.709647","5.9.29.183","172.19.0.3","TLSv1.2","1213","Application Data"
"17.709792","172.19.0.3","5.9.29.183","TCP","56","43520 → 9002 [ACK] Seq=18347 Ack=293914 Win=11895 Len=0"
"17.710585","172.19.0.3","5.9.29.183","TLSv1.2","599","Application Data"
"17.710842","5.9.29.183","172.19.0.3","TCP","56","9002 → 43520 [ACK] Seq=293914 Ack=18890 Win=65535 Len=0"
"17.720458","172.19.0.3","5.9.29.183","TLSv1.2","599","Application Data"
"17.720699","5.9.29.183","172.19.0.3","TCP","56","9002 → 43520 [ACK] Seq=293914 Ack=19433 Win=65535 Len=0"
"17.724948","5.9.29.183","172.19.0.3","TLSv1.2","149","Application Data"
"17.767125","172.19.0.3","5.9.29.183","TCP","56","43520 → 9002 [ACK] Seq=19433 Ack=294007 Win=11911 Len=0"
"18.694504","5.9.29.183","172.19.0.3","TLSv1.2","599","Application Data"
"18.694591","172.19.0.3","5.9.29.183","TCP","56","43520 → 9002 [ACK] Seq=19433 Ack=294550 Win=11911 Len=0"
"18.695536","172.19.0.3","5.9.29.183","TLSv1.2","599","Application Data"
"18.695821","5.9.29.183","172.19.0.3","TCP","56","9002 → 43520 [ACK] Seq=294550 Ack=19976 Win=65535 Len=0"
"19.211530","5.9.29.183","172.19.0.3","TCP","1516","[TCP segment of a reassembled PDU]"
"19.211592","5.9.29.183","172.19.0.3","TCP","1516","9002 → 43520 [PSH, ACK] Seq=296010 Ack=19976 Win=65535 Len=1460 [TCP segment of a reassembled PDU]"
"19.211601","5.9.29.183","172.19.0.3","TLSv1.2","763","Application Data"
"19.211721","172.19.0.3","5.9.29.183","TCP","56","43520 → 9002 [ACK] Seq=19976 Ack=298177 Win=11895 Len=0"
"19.242965","5.9.29.183","172.19.0.3","TCP","1516","[TCP segment of a reassembled PDU]"
"19.243030","5.9.29.183","172.19.0.3","TCP","1516","9002 → 43520 [PSH, ACK] Seq=299637 Ack=19976 Win=65535 Len=1460 [TCP segment of a reassembled PDU]"
"19.243048","172.19.0.3","5.9.29.183","TCP","56","43520 → 9002 [ACK] Seq=19976 Ack=301097 Win=11903 Len=0"
"19.243051","5.9.29.183","172.19.0.3","TLSv1.2","1213","Application Data"
"19.258903","5.9.29.183","172.19.0.3","TLSv1.2","149","Application Data"
"19.259176","172.19.0.3","5.9.29.183","TCP","56","43520 → 9002 [ACK] Seq=19976 Ack=302347 Win=11911 Len=0"
"19.339434","5.9.29.183","172.19.0.3","TCP","1516","[TCP segment of a reassembled PDU]"
"19.339500","5.9.29.183","172.19.0.3","TCP","1492","9002 → 43520 [PSH, ACK] Seq=303807 Ack=19976 Win=65535 Len=1436 [TCP segment of a reassembled PDU]"
"19.339512","5.9.29.183","172.19.0.3","TLSv1.2","787","Application Data"
"19.339676","172.19.0.3","5.9.29.183","TCP","56","43520 → 9002 [ACK] Seq=19976 Ack=305974 Win=11895 Len=0"
"19.350240","5.9.29.183","172.19.0.3","TCP","1504","[TCP segment of a reassembled PDU]"
"19.350334","5.9.29.183","172.19.0.3","TCP","1504","9002 → 43520 [PSH, ACK] Seq=307422 Ack=19976 Win=65535 Len=1448 [TCP segment of a reassembled PDU]"
"19.350359","172.19.0.3","5.9.29.183","TCP","56","43520 → 9002 [ACK] Seq=19976 Ack=308870 Win=11903 Len=0"
"19.355017","5.9.29.183","172.19.0.3","TLSv1.2","1516","Application Data [TCP segment of a reassembled PDU]"
"19.355125","5.9.29.183","172.19.0.3","TCP","1492","9002 → 43520 [PSH, ACK] Seq=310330 Ack=19976 Win=65535 Len=1436 [TCP segment of a reassembled PDU]"
"19.355145","172.19.0.3","5.9.29.183","TCP","56","43520 → 9002 [ACK] Seq=19976 Ack=311766 Win=11903 Len=0"
"19.355220","5.9.29.183","172.19.0.3","TCP","1504","9002 → 43520 [PSH, ACK] Seq=311766 Ack=19976 Win=65535 Len=1448 [TCP segment of a reassembled PDU]"
"19.355226","5.9.29.183","172.19.0.3","TLSv1.2","70","Application Data"
"19.355250","172.19.0.3","5.9.29.183","TCP","56","43520 → 9002 [ACK] Seq=19976 Ack=313228 Win=11893 Len=0"
"19.355829","172.19.0.3","5.9.29.183","TLSv1.2","599","Application Data"
"19.356067","5.9.29.183","172.19.0.3","TCP","56","9002 → 43520 [ACK] Seq=313228 Ack=20519 Win=65535 Len=0"
"19.366707","5.9.29.183","172.19.0.3","TCP","1516","[TCP segment of a reassembled PDU]"
"19.366725","5.9.29.183","172.19.0.3","TCP","1492","9002 → 43520 [PSH, ACK] Seq=314688 Ack=20519 Win=65535 Len=1436 [TCP segment of a reassembled PDU]"
"19.366826","172.19.0.3","5.9.29.183","TCP","56","43520 → 9002 [ACK] Seq=20519 Ack=316124 Win=11903 Len=0"
"19.370709","5.9.29.183","172.19.0.3","TLSv1.2","1516","Application Data [TCP segment of a reassembled PDU]"
"19.370765","5.9.29.183","172.19.0.3","TCP","1516","9002 → 43520 [PSH, ACK] Seq=317584 Ack=20519 Win=65535 Len=1460 [TCP segment of a reassembled PDU]"
"19.370773","5.9.29.183","172.19.0.3","TCP","1516","9002 → 43520 [PSH, ACK] Seq=319044 Ack=20519 Win=65535 Len=1460 [TCP segment of a reassembled PDU]"
"19.370775","5.9.29.183","172.19.0.3","TLSv1.2","548","Application Data"
"19.370946","172.19.0.3","5.9.29.183","TCP","56","43520 → 9002 [ACK] Seq=20519 Ack=320996 Win=11885 Len=0"
"19.371331","172.19.0.3","5.9.29.183","TLSv1.2","599","Application Data"
"19.371621","5.9.29.183","172.19.0.3","TCP","56","9002 → 43520 [ACK] Seq=320996 Ack=21062 Win=65535 Len=0"
"19.387257","5.9.29.183","172.19.0.3","TLSv1.2","599","Application Data"
"19.419673","5.9.29.183","172.19.0.3","TCP","1516","[TCP segment of a reassembled PDU]"
"19.419697","172.19.0.3","5.9.29.183","TCP","56","43520 → 9002 [ACK] Seq=21062 Ack=322999 Win=11911 Len=0"
"19.419753","5.9.29.183","172.19.0.3","TCP","1492","9002 → 43520 [PSH, ACK] Seq=322999 Ack=21062 Win=65535 Len=1436 [TCP segment of a reassembled PDU]"
"19.419766","5.9.29.183","172.19.0.3","TLSv1.2","273","Application Data"
"19.419908","172.19.0.3","5.9.29.183","TCP","56","43520 → 9002 [ACK] Seq=21062 Ack=324652 Win=11899 Len=0"
"19.485578","5.9.29.183","172.19.0.3","TCP","1504","[TCP segment of a reassembled PDU]"
"19.485630","5.9.29.183","172.19.0.3","TCP","1516","9002 → 43520 [PSH, ACK] Seq=326100 Ack=21062 Win=65535 Len=1460 [TCP segment of a reassembled PDU]"
"19.485648","172.19.0.3","5.9.29.183","TCP","56","43520 → 9002 [ACK] Seq=21062 Ack=327560 Win=11903 Len=0"
"19.485650","5.9.29.183","172.19.0.3","TLSv1.2","775","Application Data"
"19.518359","5.9.29.183","172.19.0.3","TCP","1254","[TCP segment of a reassembled PDU]"
"19.518381","172.19.0.3","5.9.29.183","TCP","56","43520 → 9002 [ACK] Seq=21062 Ack=329477 Win=11911 Len=0"
"19.518431","5.9.29.183","172.19.0.3","TCP","1516","9002 → 43520 [PSH, ACK] Seq=329477 Ack=21062 Win=65535 Len=1460 [TCP segment of a reassembled PDU]"
"19.518478","5.9.29.183","172.19.0.3","TLSv1.2","1475","Application Data"
"19.518624","172.19.0.3","5.9.29.183","TCP","56","43520 → 9002 [ACK] Seq=21062 Ack=332356 Win=11895 Len=0"
"19.534198","5.9.29.183","172.19.0.3","TLSv1.2","149","Application Data"
"19.579576","172.19.0.3","5.9.29.183","TCP","56","43520 → 9002 [ACK] Seq=21062 Ack=332449 Win=11911 Len=0"
"19.584726","5.9.29.183","172.19.0.3","TCP","1516","[TCP segment of a reassembled PDU]"
"19.584836","5.9.29.183","172.19.0.3","TLSv1.2","1195","Application Data"
"19.584985","172.19.0.3","5.9.29.183","TCP","56","43520 → 9002 [ACK] Seq=21062 Ack=335048 Win=11903 Len=0"
"19.589161","172.19.0.3","5.9.29.183","TLSv1.2","599","Application Data"
"19.589480","5.9.29.183","172.19.0.3","TCP","56","9002 → 43520 [ACK] Seq=335048 Ack=21605 Win=65535 Len=0"
"20.235239","5.9.29.183","172.19.0.3","TLSv1.2","599","Application Data"
"20.236032","172.19.0.3","5.9.29.183","TLSv1.2","599","Application Data"
"20.236389","5.9.29.183","172.19.0.3","TCP","56","9002 → 43520 [ACK] Seq=335591 Ack=22148 Win=65535 Len=0"
"21.158363","5.9.29.183","172.19.0.3","TCP","1516","[TCP segment of a reassembled PDU]"
"21.158463","5.9.29.183","172.19.0.3","TCP","1516","9002 → 43520 [PSH, ACK] Seq=337051 Ack=22148 Win=65535 Len=1460 [TCP segment of a reassembled PDU]"
"21.158476","5.9.29.183","172.19.0.3","TLSv1.2","1516","Application Data [TCP segment of a reassembled PDU]"
"21.158482","5.9.29.183","172.19.0.3","TCP","1516","9002 → 43520 [PSH, ACK] Seq=339971 Ack=22148 Win=65535 Len=1460 [TCP segment of a reassembled PDU]"
"21.158490","5.9.29.183","172.19.0.3","TCP","739","9002 → 43520 [PSH, ACK] Seq=341431 Ack=22148 Win=65535 Len=683 [TCP segment of a reassembled PDU]"
"21.158516","5.9.29.183","172.19.0.3","TLSv1.2","1516","Application Data, Application Data"
"21.158521","5.9.29.183","172.19.0.3","TCP","1492","9002 → 43520 [PSH, ACK] Seq=343574 Ack=22148 Win=65535 Len=1436 [TCP segment of a reassembled PDU]"
"21.158643","172.19.0.3","5.9.29.183","TCP","56","43520 → 9002 [ACK] Seq=22148 Ack=345010 Win=11861 Len=0"
"21.173840","5.9.29.183","172.19.0.3","TCP","1516","9002 → 43520 [PSH, ACK] Seq=345010 Ack=22148 Win=65535 Len=1460 [TCP segment of a reassembled PDU]"
"21.173908","5.9.29.183","172.19.0.3","TLSv1.2","1516","Application Data, Application Data"
"21.173982","172.19.0.3","5.9.29.183","TCP","56","43520 → 9002 [ACK] Seq=22148 Ack=347930 Win=11903 Len=0"
"21.173987","5.9.29.183","172.19.0.3","TCP","1480","9002 → 43520 [PSH, ACK] Seq=347930 Ack=22148 Win=65535 Len=1424 [TCP segment of a reassembled PDU]"
"21.174069","5.9.29.183","172.19.0.3","TCP","1516","9002 → 43520 [PSH, ACK] Seq=349354 Ack=22148 Win=65535 Len=1460 [TCP segment of a reassembled PDU]"
"21.174076","5.9.29.183","172.19.0.3","TLSv1.2","1516","Application Data [TCP segment of a reassembled PDU]"
"21.174079","5.9.29.183","172.19.0.3","TLSv1.2","1052","Application Data"
"21.174285","172.19.0.3","5.9.29.183","TCP","56","43520 → 9002 [ACK] Seq=22148 Ack=353270 Win=11871 Len=0"
"21.178377","5.9.29.183","172.19.0.3","TCP","1516","[TCP segment of a reassembled PDU]"
"21.178426","5.9.29.183","172.19.0.3","TCP","1492","9002 → 43520 [PSH, ACK] Seq=354730 Ack=22148 Win=65535 Len=1436 [TCP segment of a reassembled PDU]"
"21.178438","172.19.0.3","5.9.29.183","TCP","56","43520 → 9002 [ACK] Seq=22148 Ack=356166 Win=11903 Len=0"
"21.188785","5.9.29.183","172.19.0.3","TLSv1.2","1516","Application Data [TCP segment of a reassembled PDU]"
"21.188840","5.9.29.183","172.19.0.3","TCP","1492","9002 → 43520 [PSH, ACK] Seq=357626 Ack=22148 Win=65535 Len=1436 [TCP segment of a reassembled PDU]"
"21.188851","172.19.0.3","5.9.29.183","TCP","56","43520 → 9002 [ACK] Seq=22148 Ack=359062 Win=11903 Len=0"
"21.188923","5.9.29.183","172.19.0.3","TCP","1516","9002 → 43520 [PSH, ACK] Seq=359062 Ack=22148 Win=65535 Len=1460 [TCP segment of a reassembled PDU]"
"21.188928","5.9.29.183","172.19.0.3","TLSv1.2","1492","Application Data [TCP segment of a reassembled PDU]"
"21.188931","5.9.29.183","172.19.0.3","TCP","1516","9002 → 43520 [PSH, ACK] Seq=361958 Ack=22148 Win=65535 Len=1460 [TCP segment of a reassembled PDU]"
"21.189011","5.9.29.183","172.19.0.3","TCP","1492","9002 → 43520 [PSH, ACK] Seq=363418 Ack=22148 Win=65535 Len=1436 [TCP segment of a reassembled PDU]"
"21.189029","172.19.0.3","5.9.29.183","TCP","56","43520 → 9002 [ACK] Seq=22148 Ack=364854 Win=11871 Len=0"
"21.204490","5.9.29.183","172.19.0.3","TLSv1.2","1516","Application Data [TCP segment of a reassembled PDU]"
"21.204559","5.9.29.183","172.19.0.3","TLSv1.2","1516","Application Data [TCP segment of a reassembled PDU]"
"21.204575","172.19.0.3","5.9.29.183","TCP","56","43520 → 9002 [ACK] Seq=22148 Ack=367774 Win=11903 Len=0"
"21.204578","5.9.29.183","172.19.0.3","TCP","1516","9002 → 43520 [PSH, ACK] Seq=367774 Ack=22148 Win=65535 Len=1460 [TCP segment of a reassembled PDU]"
"21.204582","5.9.29.183","172.19.0.3","TCP","1516","9002 → 43520 [PSH, ACK] Seq=369234 Ack=22148 Win=65535 Len=1460 [TCP segment of a reassembled PDU]"
"21.204588","5.9.29.183","172.19.0.3","TLSv1.2","1516","Application Data [TCP segment of a reassembled PDU]"
"21.204690","5.9.29.183","172.19.0.3","TCP","1516","9002 → 43520 [PSH, ACK] Seq=372154 Ack=22148 Win=65535 Len=1460 [TCP segment of a reassembled PDU]"
"21.204694","5.9.29.183","172.19.0.3","TLSv1.2","1432","Application Data [TCP segment of a reassembled PDU]"
"21.204696","5.9.29.183","172.19.0.3","TLSv1.2","641","Application Data"
"21.204706","172.19.0.3","5.9.29.183","TCP","56","43520 → 9002 [ACK] Seq=22148 Ack=372154 Win=11877 Len=0"
"21.205020","172.19.0.3","5.9.29.183","TLSv1.2","1113","Application Data"
"21.205444","5.9.29.183","172.19.0.3","TCP","56","9002 → 43520 [ACK] Seq=375575 Ack=23205 Win=65535 Len=0"
"21.219727","5.9.29.183","172.19.0.3","TCP","1504","[TCP segment of a reassembled PDU]"
"21.220041","5.9.29.183","172.19.0.3","TCP","1516","9002 → 43520 [PSH, ACK] Seq=377023 Ack=23205 Win=65535 Len=1460 [TCP segment of a reassembled PDU]"
"21.220063","172.19.0.3","5.9.29.183","TCP","56","43520 → 9002 [ACK] Seq=23205 Ack=378483 Win=11911 Len=0"
"21.220148","5.9.29.183","172.19.0.3","TLSv1.2","1516","Application Data [TCP segment of a reassembled PDU]"
"21.220283","5.9.29.183","172.19.0.3","TCP","1516","9002 → 43520 [PSH, ACK] Seq=379943 Ack=23205 Win=65535 Len=1460 [TCP segment of a reassembled PDU]"
"21.220293","5.9.29.183","172.19.0.3","TCP","1516","9002 → 43520 [PSH, ACK] Seq=381403 Ack=23205 Win=65535 Len=1460 [TCP segment of a reassembled PDU]"
"21.220298","5.9.29.183","172.19.0.3","TLSv1.2","536","Application Data"
"21.220330","172.19.0.3","5.9.29.183","TCP","56","43520 → 9002 [ACK] Seq=23205 Ack=382863 Win=11887 Len=0"
"21.251302","5.9.29.183","172.19.0.3","TCP","1516","[TCP segment of a reassembled PDU]"
"21.251324","172.19.0.3","5.9.29.183","TCP","56","43520 → 9002 [ACK] Seq=23205 Ack=384803 Win=11911 Len=0"
"21.251376","5.9.29.183","172.19.0.3","TCP","1516","9002 → 43520 [PSH, ACK] Seq=384803 Ack=23205 Win=65535 Len=1460 [TCP segment of a reassembled PDU]"
"21.251387","5.9.29.183","172.19.0.3","TLSv1.2","763","Application Data"
"21.251570","172.19.0.3","5.9.29.183","TCP","56","43520 → 9002 [ACK] Seq=23205 Ack=386970 Win=11895 Len=0"
"21.279050","5.9.29.183","172.19.0.3","TCP","1504","[TCP segment of a reassembled PDU]"
"21.279105","5.9.29.183","172.19.0.3","TCP","1516","9002 → 43520 [PSH, ACK] Seq=388418 Ack=23205 Win=65535 Len=1460 [TCP segment of a reassembled PDU]"
"21.279120","172.19.0.3","5.9.29.183","TCP","56","43520 → 9002 [ACK] Seq=23205 Ack=389878 Win=11903 Len=0"
"21.279122","5.9.29.183","172.19.0.3","TLSv1.2","1225","Application Data"
"21.279525","172.19.0.3","5.9.29.183","TLSv1.2","599","Application Data"
"21.279715","5.9.29.183","172.19.0.3","TCP","56","9002 → 43520 [ACK] Seq=391047 Ack=23748 Win=65535 Len=0"
"21.294524","5.9.29.183","172.19.0.3","TLSv1.2","663","Application Data"
"21.316201","5.9.29.183","172.19.0.3","TCP","1504","[TCP segment of a reassembled PDU]"
"21.316224","172.19.0.3","5.9.29.183","TCP","56","43520 → 9002 [ACK] Seq=23748 Ack=393102 Win=11911 Len=0"
"21.316273","5.9.29.183","172.19.0.3","TCP","1516","9002 → 43520 [PSH, ACK] Seq=393102 Ack=23748 Win=65535 Len=1460 [TCP segment of a reassembled PDU]"
"21.316324","5.9.29.183","172.19.0.3","TCP","507","9002 → 43520 [PSH, ACK] Seq=394562 Ack=23748 Win=65535 Len=451 [TCP segment of a reassembled PDU]"
"21.316419","5.9.29.183","172.19.0.3","TLSv1.2","324","Application Data"
"21.316524","172.19.0.3","5.9.29.183","TCP","56","43520 → 9002 [ACK] Seq=23748 Ack=395281 Win=11894 Len=0"
"21.328247","5.9.29.183","172.19.0.3","TCP","1504","[TCP segment of a reassembled PDU]"
"21.328425","5.9.29.183","172.19.0.3","TCP","1516","9002 → 43520 [PSH, ACK] Seq=396729 Ack=23748 Win=65535 Len=1460 [TCP segment of a reassembled PDU]"
"21.328436","172.19.0.3","5.9.29.183","TCP","56","43520 → 9002 [ACK] Seq=23748 Ack=398189 Win=11911 Len=0"
"21.328451","5.9.29.183","172.19.0.3","TLSv1.2","1492","Application Data [TCP segment of a reassembled PDU]"
"21.328456","5.9.29.183","172.19.0.3","TCP","1516","9002 → 43520 [PSH, ACK] Seq=399625 Ack=23748 Win=65535 Len=1460 [TCP segment of a reassembled PDU]"
"21.328473","172.19.0.3","5.9.29.183","TCP","56","43520 → 9002 [ACK] Seq=23748 Ack=401085 Win=11895 Len=0"
"21.328508","5.9.29.183","172.19.0.3","TCP","1492","9002 → 43520 [PSH, ACK] Seq=401085 Ack=23748 Win=65535 Len=1436 [TCP segment of a reassembled PDU]"
"21.331365","5.9.29.183","172.19.0.3","TLSv1.2","584","Application Data"
"21.331377","172.19.0.3","5.9.29.183","TCP","56","43520 → 9002 [ACK] Seq=23748 Ack=403049 Win=11911 Len=0"
"21.350334","5.9.29.183","172.19.0.3","TCP","1504","[TCP segment of a reassembled PDU]"
"21.350400","5.9.29.183","172.19.0.3","TCP","1516","9002 → 43520 [PSH, ACK] Seq=404497 Ack=23748 Win=65535 Len=1460 [TCP segment of a reassembled PDU]"
"21.350409","5.9.29.183","172.19.0.3","TLSv1.2","1225","Application Data"
"21.350561","172.19.0.3","5.9.29.183","TCP","56","43520 → 9002 [ACK] Seq=23748 Ack=407126 Win=11895 Len=0"
"21.365380","5.9.29.183","172.19.0.3","TLSv1.2","149","Application Data"
"21.366345","5.9.29.183","172.19.0.3","TCP","1504","[TCP segment of a reassembled PDU]"
"21.366359","172.19.0.3","5.9.29.183","TCP","56","43520 → 9002 [ACK] Seq=23748 Ack=408667 Win=11911 Len=0"
"21.380994","5.9.29.183","172.19.0.3","TLSv1.2","1207","Application Data"
"21.423302","172.19.0.3","5.9.29.183","TCP","56","43520 → 9002 [ACK] Seq=23748 Ack=409818 Win=11911 Len=0"
"21.430317","5.9.29.183","172.19.0.3","TCP","1516","[TCP segment of a reassembled PDU]"
"21.430381","5.9.29.183","172.19.0.3","TCP","1492","9002 → 43520 [PSH, ACK] Seq=411278 Ack=23748 Win=65535 Len=1436 [TCP segment of a reassembled PDU]"
"21.430392","5.9.29.183","172.19.0.3","TLSv1.2","787","Application Data"
"21.430540","172.19.0.3","5.9.29.183","TCP","56","43520 → 9002 [ACK] Seq=23748 Ack=413445 Win=11895 Len=0"
"21.435978","172.19.0.3","5.9.29.183","TLSv1.2","599","Application Data"
"21.436257","5.9.29.183","172.19.0.3","TCP","56","9002 → 43520 [ACK] Seq=413445 Ack=24291 Win=65535 Len=0"
"22.077817","5.9.29.183","172.19.0.3","TLSv1.2","599","Application Data"
"22.078726","172.19.0.3","5.9.29.183","TLSv1.2","599","Application Data"
"22.079104","5.9.29.183","172.19.0.3","TCP","56","9002 → 43520 [ACK] Seq=413988 Ack=24834 Win=65535 Len=0"
"23.000456","5.9.29.183","172.19.0.3","TCP","1516","[TCP segment of a reassembled PDU]"
"23.000523","5.9.29.183","172.19.0.3","TCP","1516","9002 → 43520 [PSH, ACK] Seq=415448 Ack=24834 Win=65535 Len=1460 [TCP segment of a reassembled PDU]"
"23.000542","5.9.29.183","172.19.0.3","TLSv1.2","1516","Application Data, Application Data"
"23.000550","5.9.29.183","172.19.0.3","TCP","1201","9002 → 43520 [PSH, ACK] Seq=418368 Ack=24834 Win=65535 Len=1145 [TCP segment of a reassembled PDU]"
"23.000899","172.19.0.3","5.9.29.183","TCP","56","43520 → 9002 [ACK] Seq=24834 Ack=419513 Win=11887 Len=0"
"23.001308","172.19.0.3","5.9.29.183","TLSv1.2","599","Application Data"
"23.001737","5.9.29.183","172.19.0.3","TCP","1516","9002 → 43520 [PSH, ACK] Seq=419513 Ack=24834 Win=65535 Len=1460 [TCP segment of a reassembled PDU]"
"23.001773","5.9.29.183","172.19.0.3","TLSv1.2","1516","Application Data [TCP segment of a reassembled PDU]"
"23.001792","172.19.0.3","5.9.29.183","TCP","56","43520 → 9002 [ACK] Seq=25377 Ack=422433 Win=11903 Len=0"
"23.001798","5.9.29.183","172.19.0.3","TCP","1516","9002 → 43520 [PSH, ACK] Seq=422433 Ack=24834 Win=65535 Len=1460 [TCP segment of a reassembled PDU]"
"23.002138","5.9.29.183","172.19.0.3","TCP","1516","9002 → 43520 [PSH, ACK] Seq=423893 Ack=24834 Win=65535 Len=1460 [TCP segment of a reassembled PDU]"
"23.002149","5.9.29.183","172.19.0.3","TLSv1.2","1516","Application Data [TCP segment of a reassembled PDU]"
"23.002161","5.9.29.183","172.19.0.3","TCP","1516","9002 → 43520 [PSH, ACK] Seq=426813 Ack=24834 Win=65535 Len=1460 [TCP segment of a reassembled PDU]"
"23.002165","5.9.29.183","172.19.0.3","TLSv1.2","1432","Application Data [TCP segment of a reassembled PDU]"
"23.002573","5.9.29.183","172.19.0.3","TCP","56","9002 → 43520 [ACK] Seq=429649 Ack=25377 Win=65535 Len=0"
"23.004671","172.19.0.3","5.9.29.183","TCP","56","43520 → 9002 [ACK] Seq=25377 Ack=429649 Win=11863 Len=0"
"23.016143","5.9.29.183","172.19.0.3","TCP","1516","9002 → 43520 [PSH, ACK] Seq=429649 Ack=25377 Win=65535 Len=1460 [TCP segment of a reassembled PDU]"
"23.016198","5.9.29.183","172.19.0.3","TCP","1516","9002 → 43520 [PSH, ACK] Seq=431109 Ack=25377 Win=65535 Len=1460 [TCP segment of a reassembled PDU]"
"23.016223","172.19.0.3","5.9.29.183","TCP","56","43520 → 9002 [ACK] Seq=25377 Ack=432569 Win=11903 Len=0"
"23.016227","5.9.29.183","172.19.0.3","TLSv1.2","1516","Application Data [TCP segment of a reassembled PDU]"
"23.016233","5.9.29.183","172.19.0.3","TLSv1.2","264","Application Data"
"23.016527","172.19.0.3","5.9.29.183","TCP","56","43520 → 9002 [ACK] Seq=25377 Ack=434237 Win=11890 Len=0"
"23.025752","172.19.0.3","5.9.29.183","TLSv1.2","599","Application Data"
"23.026212","5.9.29.183","172.19.0.3","TCP","56","9002 → 43520 [ACK] Seq=434237 Ack=25920 Win=65535 Len=0"
"23.924341","5.9.29.183","172.19.0.3","TLSv1.2","599","Application Data"
"23.925145","172.19.0.3","5.9.29.183","TLSv1.2","599","Application Data"
"23.925438","5.9.29.183","172.19.0.3","TCP","56","9002 → 43520 [ACK] Seq=434780 Ack=26463 Win=65535 Len=0"
"24.849003","5.9.29.183","172.19.0.3","TCP","1516","[TCP segment of a reassembled PDU]"
"24.849217","5.9.29.183","172.19.0.3","TCP","1492","9002 → 43520 [PSH, ACK] Seq=436240 Ack=26463 Win=65535 Len=1436 [TCP segment of a reassembled PDU]"
"24.849258","5.9.29.183","172.19.0.3","TLSv1.2","1516","Application Data [TCP segment of a reassembled PDU]"
"24.849289","5.9.29.183","172.19.0.3","TCP","1516","9002 → 43520 [PSH, ACK] Seq=439136 Ack=26463 Win=65535 Len=1460 [TCP segment of a reassembled PDU]"
"24.849320","5.9.29.183","172.19.0.3","TLSv1.2","1516","Application Data [TCP segment of a reassembled PDU]"
"24.849667","5.9.29.183","172.19.0.3","TCP","1516","9002 → 43520 [PSH, ACK] Seq=442056 Ack=26463 Win=65535 Len=1460 [TCP segment of a reassembled PDU]"
"24.849686","5.9.29.183","172.19.0.3","TCP","1516","9002 → 43520 [PSH, ACK] Seq=443516 Ack=26463 Win=65535 Len=1460 [TCP segment of a reassembled PDU]"
"24.849699","5.9.29.183","172.19.0.3","TLSv1.2","1516","Application Data [TCP segment of a reassembled PDU]"
"24.849727","5.9.29.183","172.19.0.3","TCP","1516","9002 → 43520 [PSH, ACK] Seq=446436 Ack=26463 Win=65535 Len=1460 [TCP segment of a reassembled PDU]"
"24.849736","5.9.29.183","172.19.0.3","TCP","703","9002 → 43520 [PSH, ACK] Seq=447896 Ack=26463 Win=65535 Len=647 [TCP segment of a reassembled PDU]"
"24.850154","172.19.0.3","5.9.29.183","TCP","56","43520 → 9002 [ACK] Seq=26463 Ack=448543 Win=11838 Len=0"
"24.863609","5.9.29.183","172.19.0.3","TLSv1.2","1516","Application Data [TCP segment of a reassembled PDU]"
"24.863686","5.9.29.183","172.19.0.3","TLSv1.2","1492","Application Data [TCP segment of a reassembled PDU]"
"24.863735","172.19.0.3","5.9.29.183","TCP","56","43520 → 9002 [ACK] Seq=26463 Ack=451439 Win=11903 Len=0"
"24.864575","5.9.29.183","172.19.0.3","TCP","1516","9002 → 43520 [PSH, ACK] Seq=451439 Ack=26463 Win=65535 Len=1460 [TCP segment of a reassembled PDU]"
"24.864617","5.9.29.183","172.19.0.3","TLSv1.2","1492","Application Data [TCP segment of a reassembled PDU]"
"24.864634","5.9.29.183","172.19.0.3","TCP","1504","9002 → 43520 [PSH, ACK] Seq=454335 Ack=26463 Win=65535 Len=1448 [TCP segment of a reassembled PDU]"
"24.864799","172.19.0.3","5.9.29.183","TCP","56","43520 → 9002 [ACK] Seq=26463 Ack=455783 Win=11879 Len=0"
"24.864825","5.9.29.183","172.19.0.3","TLSv1.2","1516","Application Data [TCP segment of a reassembled PDU]"
"24.864841","5.9.29.183","172.19.0.3","TCP","1516","9002 → 43520 [PSH, ACK] Seq=457243 Ack=26463 Win=65535 Len=1460 [TCP segment of a reassembled PDU]"
"24.864917","5.9.29.183","172.19.0.3","TCP","1480","9002 → 43520 [PSH, ACK] Seq=458703 Ack=26463 Win=65535 Len=1424 [TCP segment of a reassembled PDU]"
"24.864933","172.19.0.3","5.9.29.183","TCP","56","43520 → 9002 [ACK] Seq=26463 Ack=458703 Win=11863 Len=0"
"24.869877","5.9.29.183","172.19.0.3","TCP","478","9002 → 43520 [PSH, ACK] Seq=460127 Ack=26463 Win=65535 Len=422 [TCP segment of a reassembled PDU]"
"24.869902","172.19.0.3","5.9.29.183","TCP","56","43520 → 9002 [ACK] Seq=26463 Ack=460549 Win=11911 Len=0"
"24.869945","5.9.29.183","172.19.0.3","TLSv1.2","1082","Application Data [TCP segment of a reassembled PDU]"
"24.880723","5.9.29.183","172.19.0.3","TLSv1.2","1516","Application Data, Application Data"
"24.880812","5.9.29.183","172.19.0.3","TCP","1516","9002 → 43520 [PSH, ACK] Seq=463035 Ack=26463 Win=65535 Len=1460 [TCP segment of a reassembled PDU]"
"24.880976","172.19.0.3","5.9.29.183","TCP","56","43520 → 9002 [ACK] Seq=26463 Ack=464495 Win=11901 Len=0"
"24.880993","5.9.29.183","172.19.0.3","TLSv1.2","986","Application Data"
"24.881247","172.19.0.3","5.9.29.183","TLSv1.2","599","Application Data"
"24.881508","5.9.29.183","172.19.0.3","TCP","56","9002 → 43520 [ACK] Seq=465425 Ack=27006 Win=65535 Len=0"
"24.886868","5.9.29.183","172.19.0.3","TCP","1516","[TCP segment of a reassembled PDU]"
"24.886945","5.9.29.183","172.19.0.3","TCP","1492","9002 → 43520 [PSH, ACK] Seq=466885 Ack=27006 Win=65535 Len=1436 [TCP segment of a reassembled PDU]"
"24.886975","172.19.0.3","5.9.29.183","TCP","56","43520 → 9002 [ACK] Seq=27006 Ack=468321 Win=11903 Len=0"
"24.897644","5.9.29.183","172.19.0.3","TLSv1.2","1330","Application Data, Application Data"
"24.899857","172.19.0.3","5.9.29.183","TLSv1.2","599","Application Data"
"24.900632","5.9.29.183","172.19.0.3","TCP","56","9002 → 43520 [ACK] Seq=469595 Ack=27549 Win=65535 Len=0"
"25.345412","5.9.29.183","172.19.0.3","TCP","1516","[TCP segment of a reassembled PDU]"
"25.345511","5.9.29.183","172.19.0.3","TLSv1.2","1195","Application Data"
"25.345655","172.19.0.3","5.9.29.183","TCP","56","43520 → 9002 [ACK] Seq=27549 Ack=472194 Win=11903 Len=0"
