_ws.col.Time,_ws.col.Source,_ws.col.Destination,_ws.col.Protocol,_ws.col.Length,_ws.col.Info
"0.000000","172.18.0.2","54.38.73.16","TLSv1.2","611","Application Data"
"0.063617","54.38.73.16","172.18.0.2","TCP","68","21002 → 36876 [ACK] Seq=1 Ack=544 Win=1452 Len=0 TSval=2674997747 TSecr=1083394300"
"0.773851","54.38.73.16","172.18.0.2","TLSv1.2","611","Application Data"
"0.773870","54.38.73.16","172.18.0.2","TCP","611","[TCP Retransmission] 21002 → 36876 [PSH, ACK] Seq=1 Ack=544 Win=1452 Len=543 TSval=2674997907 TSecr=1083394300"
"0.773941","172.18.0.2","54.38.73.16","TCP","80","36876 → 21002 [ACK] Seq=544 Ack=544 Win=5608 Len=0 TSval=1083395074 TSecr=2674997907 SLE=1 SRE=544"
"0.774994","172.18.0.2","54.38.73.16","TCP","1516","[TCP segment of a reassembled PDU]"
"0.775073","172.18.0.2","54.38.73.16","TLSv1.2","705","Application Data"
"0.798034","54.38.73.16","172.18.0.2","TCP","68","21002 → 36876 [ACK] Seq=544 Ack=2629 Win=1448 Len=0 TSval=2674997930 TSecr=1083395075"
"1.381423","54.38.73.16","172.18.0.2","TLSv1.2","1639","Application Data"
"1.381480","172.18.0.2","54.38.73.16","TCP","68","36876 → 21002 [ACK] Seq=2629 Ack=2115 Win=5600 Len=0 TSval=1083395682 TSecr=2674998058"
"1.387879","172.18.0.2","54.38.73.16","TLSv1.2","611","Application Data"
"1.412805","54.38.73.16","172.18.0.2","TCP","68","21002 → 36876 [ACK] Seq=2115 Ack=3172 Win=1452 Len=0 TSval=2674998084 TSecr=1083395688"
"2.000358","54.38.73.16","172.18.0.2","TLSv1.2","611","Application Data"
"2.000422","172.18.0.2","54.38.73.16","TCP","68","36876 → 21002 [ACK] Seq=3172 Ack=2658 Win=5608 Len=0 TSval=1083396301 TSecr=2674998205"
"2.001405","172.18.0.2","54.38.73.16","TLSv1.2","611","Application Data"
"2.024463","54.38.73.16","172.18.0.2","TCP","68","21002 → 36876 [ACK] Seq=2658 Ack=3715 Win=1452 Len=0 TSval=2674998237 TSecr=1083396302"
"2.611955","54.38.73.16","172.18.0.2","TLSv1.2","3695","Application Data"
"2.612088","172.18.0.2","54.38.73.16","TCP","68","36876 → 21002 [ACK] Seq=3715 Ack=6285 Win=5584 Len=0 TSval=1083396913 TSecr=2674998360"
"2.635656","54.38.73.16","172.18.0.2","TCP","1516","[TCP segment of a reassembled PDU]"
"2.636643","54.38.73.16","172.18.0.2","TLSv1.2","2790","Application Data, Application Data"
"2.636667","172.18.0.2","54.38.73.16","TCP","68","36876 → 21002 [ACK] Seq=3715 Ack=10455 Win=5596 Len=0 TSval=1083396937 TSecr=2674998390"
"2.642178","54.38.73.16","172.18.0.2","TCP","1516","[TCP segment of a reassembled PDU]"
"2.659857","54.38.73.16","172.18.0.2","TLSv1.2","2964","Application Data [TCP segment of a reassembled PDU]"
"2.659892","172.18.0.2","54.38.73.16","TCP","68","36876 → 21002 [ACK] Seq=3715 Ack=14799 Win=5596 Len=0 TSval=1083396960 TSecr=2674998391"
"2.663558","54.38.73.16","172.18.0.2","TCP","1516","21002 → 36876 [ACK] Seq=14799 Ack=3715 Win=1452 Len=1448 TSval=2674998396 TSecr=1083396937 [TCP segment of a reassembled PDU]"
"2.682879","54.38.73.16","172.18.0.2","TLSv1.2","2964","Application Data [TCP segment of a reassembled PDU]"
"2.682915","172.18.0.2","54.38.73.16","TCP","68","36876 → 21002 [ACK] Seq=3715 Ack=19143 Win=5596 Len=0 TSval=1083396983 TSecr=2674998396"
"2.685203","54.38.73.16","172.18.0.2","TCP","1516","21002 → 36876 [ACK] Seq=19143 Ack=3715 Win=1452 Len=1448 TSval=2674998402 TSecr=1083396960 [TCP segment of a reassembled PDU]"
"2.706887","54.38.73.16","172.18.0.2","TLSv1.2","2964","Application Data, Application Data, Application Data"
"2.706913","172.18.0.2","54.38.73.16","TCP","68","36876 → 21002 [ACK] Seq=3715 Ack=23487 Win=5596 Len=0 TSval=1083397007 TSecr=2674998402"
"2.728806","54.38.73.16","172.18.0.2","TCP","1516","21002 → 36876 [ACK] Seq=23487 Ack=3715 Win=1452 Len=1448 TSval=2674998412 TSecr=1083396983 [TCP segment of a reassembled PDU]"
"2.730818","54.38.73.16","172.18.0.2","TLSv1.2","2964","Application Data, Application Data"
"2.730842","172.18.0.2","54.38.73.16","TCP","68","36876 → 21002 [ACK] Seq=3715 Ack=27831 Win=5596 Len=0 TSval=1083397031 TSecr=2674998412"
"2.738788","54.38.73.16","172.18.0.2","TCP","1516","21002 → 36876 [ACK] Seq=27831 Ack=3715 Win=1452 Len=1448 TSval=2674998415 TSecr=1083397007 [TCP segment of a reassembled PDU]"
"2.754592","54.38.73.16","172.18.0.2","TLSv1.2","2964","Application Data, Application Data"
"2.754622","172.18.0.2","54.38.73.16","TCP","68","36876 → 21002 [ACK] Seq=3715 Ack=32175 Win=5596 Len=0 TSval=1083397055 TSecr=2674998415"
"2.755049","172.18.0.2","54.38.73.16","TLSv1.2","611","Application Data"
"2.758377","54.38.73.16","172.18.0.2","TCP","1516","21002 → 36876 [ACK] Seq=32175 Ack=3715 Win=1452 Len=1448 TSval=2674998420 TSecr=1083397031 [TCP segment of a reassembled PDU]"
"2.779451","54.38.73.16","172.18.0.2","TCP","68","[TCP Previous segment not captured] 21002 → 36876 [ACK] Seq=36519 Ack=4258 Win=1452 Len=0 TSval=2674998425 TSecr=1083397055"
"2.779467","54.38.73.16","172.18.0.2","TCP","2964","[TCP Retransmission] 21002 → 36876 [ACK] Seq=33623 Ack=3715 Win=1452 Len=2896 TSval=2674998425 TSecr=1083397055"
"2.779505","172.18.0.2","54.38.73.16","TCP","68","36876 → 21002 [ACK] Seq=4258 Ack=36519 Win=5596 Len=0 TSval=1083397080 TSecr=2674998420"
"2.779917","172.18.0.2","54.38.73.16","TLSv1.2","611","Application Data"
"2.789907","54.38.73.16","172.18.0.2","TLSv1.2","1516","Ignored Unknown Record"
"2.803199","54.38.73.16","172.18.0.2","TLSv1.2","2964","Ignored Unknown Record"
"2.803225","172.18.0.2","54.38.73.16","TCP","68","36876 → 21002 [ACK] Seq=4801 Ack=40863 Win=5596 Len=0 TSval=1083397104 TSecr=2674998428"
"2.810900","54.38.73.16","172.18.0.2","TLSv1.2","1516","Ignored Unknown Record"
"2.828192","54.38.73.16","172.18.0.2","TLSv1.2","2964","Ignored Unknown Record"
"2.828220","172.18.0.2","54.38.73.16","TCP","68","36876 → 21002 [ACK] Seq=4801 Ack=45207 Win=5596 Len=0 TSval=1083397129 TSecr=2674998433"
"2.831349","54.38.73.16","172.18.0.2","TLSv1.2","1516","Ignored Unknown Record"
"2.851690","54.38.73.16","172.18.0.2","TLSv1.2","2964","Ignored Unknown Record"
"2.851720","172.18.0.2","54.38.73.16","TCP","68","36876 → 21002 [ACK] Seq=4801 Ack=49551 Win=5596 Len=0 TSval=1083397152 TSecr=2674998438"
"2.861106","54.38.73.16","172.18.0.2","TLSv1.2","1516","Ignored Unknown Record"
"2.875352","54.38.73.16","172.18.0.2","TLSv1.2","2964","Ignored Unknown Record"
"2.875388","172.18.0.2","54.38.73.16","TCP","68","36876 → 21002 [ACK] Seq=4801 Ack=53895 Win=5596 Len=0 TSval=1083397176 TSecr=2674998446"
"2.882542","54.38.73.16","172.18.0.2","TLSv1.2","1516","Ignored Unknown Record"
"2.898827","54.38.73.16","172.18.0.2","TLSv1.2","2964","Ignored Unknown Record"
"2.898863","172.18.0.2","54.38.73.16","TCP","68","36876 → 21002 [ACK] Seq=4801 Ack=58239 Win=5596 Len=0 TSval=1083397199 TSecr=2674998451"
"2.899271","172.18.0.2","54.38.73.16","TLSv1.2","611","Application Data"
"2.902567","54.38.73.16","172.18.0.2","TLSv1.2","1516","Ignored Unknown Record"
"2.923363","54.38.73.16","172.18.0.2","TLSv1.2","2964","Ignored Unknown Record"
"2.923384","172.18.0.2","54.38.73.16","TCP","68","36876 → 21002 [ACK] Seq=5344 Ack=62583 Win=5596 Len=0 TSval=1083397224 TSecr=2674998456"
"2.933422","54.38.73.16","172.18.0.2","TLSv1.2","1516","Ignored Unknown Record"
"2.947174","54.38.73.16","172.18.0.2","TLSv1.2","2964","Ignored Unknown Record"
"2.947209","172.18.0.2","54.38.73.16","TCP","68","36876 → 21002 [ACK] Seq=5344 Ack=66927 Win=5596 Len=0 TSval=1083397248 TSecr=2674998464"
"2.954635","54.38.73.16","172.18.0.2","TLSv1.2","1516","Ignored Unknown Record"
"2.972476","54.38.73.16","172.18.0.2","TLSv1.2","2964","Ignored Unknown Record"
"2.972498","172.18.0.2","54.38.73.16","TCP","68","36876 → 21002 [ACK] Seq=5344 Ack=71271 Win=5596 Len=0 TSval=1083397273 TSecr=2674998469"
"2.997198","54.38.73.16","172.18.0.2","TLSv1.2","2374","Ignored Unknown Record"
"2.997226","172.18.0.2","54.38.73.16","TCP","68","36876 → 21002 [ACK] Seq=5344 Ack=73577 Win=5598 Len=0 TSval=1083397298 TSecr=2674998480"
"3.007428","172.18.0.2","54.38.73.16","TLSv1.2","611","Application Data"
"3.068168","54.38.73.16","172.18.0.2","TCP","68","21002 → 36876 [ACK] Seq=73577 Ack=5887 Win=1452 Len=0 TSval=2674998498 TSecr=1083397308"
"3.533266","54.38.73.16","172.18.0.2","TLSv1.2","611","Application Data"
"3.534335","172.18.0.2","54.38.73.16","TLSv1.2","611","Application Data"
"3.557487","54.38.73.16","172.18.0.2","TCP","68","21002 → 36876 [ACK] Seq=74120 Ack=6430 Win=1452 Len=0 TSval=2674998620 TSecr=1083397835"
"4.454906","54.38.73.16","172.18.0.2","TCP","1516","[TCP segment of a reassembled PDU]"
"4.455097","54.38.73.16","172.18.0.2","TLSv1.2","2247","Application Data"
"4.455105","54.38.73.16","172.18.0.2","TCP","1516","[TCP segment of a reassembled PDU]"
"4.455183","172.18.0.2","54.38.73.16","TCP","68","36876 → 21002 [ACK] Seq=6430 Ack=79195 Win=5583 Len=0 TSval=1083398756 TSecr=2674998822"
"4.480301","54.38.73.16","172.18.0.2","TLSv1.2","5360","Application Data, Application Data"
"4.480335","172.18.0.2","54.38.73.16","TCP","68","36876 → 21002 [ACK] Seq=6430 Ack=84487 Win=5583 Len=0 TSval=1083398781 TSecr=2674998850"
"4.481160","172.18.0.2","54.38.73.16","TLSv1.2","611","Application Data"
"4.505049","54.38.73.16","172.18.0.2","TCP","68","[TCP Previous segment not captured] 21002 → 36876 [ACK] Seq=89171 Ack=6973 Win=1452 Len=0 TSval=2674998857 TSecr=1083398782"
"4.505064","54.38.73.16","172.18.0.2","TCP","4752","[TCP Retransmission] 21002 → 36876 [PSH, ACK] Seq=84487 Ack=6430 Win=1452 Len=4684 TSval=2674998857 TSecr=1083398781"
"4.505224","172.18.0.2","54.38.73.16","TCP","68","36876 → 21002 [ACK] Seq=6973 Ack=89171 Win=5585 Len=0 TSval=1083398806 TSecr=2674998850"
"4.513095","172.18.0.2","54.38.73.16","TLSv1.2","611","Application Data"
"4.537312","54.38.73.16","172.18.0.2","TCP","68","21002 → 36876 [ACK] Seq=89171 Ack=7516 Win=1452 Len=0 TSval=2674998865 TSecr=1083398814"
"5.382021","54.38.73.16","172.18.0.2","TLSv1.2","611","Application Data"
"5.383104","172.18.0.2","54.38.73.16","TLSv1.2","611","Application Data"
"5.406855","54.38.73.16","172.18.0.2","TCP","68","21002 → 36876 [ACK] Seq=89714 Ack=8059 Win=1452 Len=0 TSval=2674999082 TSecr=1083399684"
"5.989648","54.38.73.16","172.18.0.2","TLSv1.2","611","Application Data"
"5.990201","54.38.73.16","172.18.0.2","TLSv1.2","4412","Application Data"
"5.990327","172.18.0.2","54.38.73.16","TCP","68","36876 → 21002 [ACK] Seq=8059 Ack=94601 Win=5580 Len=0 TSval=1083400291 TSecr=2674999207"
"6.014700","54.38.73.16","172.18.0.2","TCP","2964","21002 → 36876 [ACK] Seq=94601 Ack=8059 Win=1452 Len=2896 TSval=2674999234 TSecr=1083400291 [TCP segment of a reassembled PDU]"
"6.014733","172.18.0.2","54.38.73.16","TCP","68","36876 → 21002 [ACK] Seq=8059 Ack=97497 Win=5596 Len=0 TSval=1083400315 TSecr=2674999234"
"6.039045","54.38.73.16","172.18.0.2","TLSv1.2","2681","Application Data, Application Data"
"6.039079","172.18.0.2","54.38.73.16","TCP","68","36876 → 21002 [ACK] Seq=8059 Ack=100110 Win=5597 Len=0 TSval=1083400340 TSecr=2674999240"
"6.044491","54.38.73.16","172.18.0.2","TCP","1516","[TCP segment of a reassembled PDU]"
"6.062750","54.38.73.16","172.18.0.2","TLSv1.2","705","Application Data"
"6.062901","172.18.0.2","54.38.73.16","TCP","68","36876 → 21002 [ACK] Seq=8059 Ack=102195 Win=5612 Len=0 TSval=1083400363 TSecr=2674999242"
"6.138279","54.38.73.16","172.18.0.2","TLSv1.2","3695","Application Data"
"6.138429","172.18.0.2","54.38.73.16","TCP","68","36876 → 21002 [ACK] Seq=8059 Ack=105822 Win=5584 Len=0 TSval=1083400439 TSecr=2674999265"
"6.604080","54.38.73.16","172.18.0.2","TCP","1516","[TCP segment of a reassembled PDU]"
"6.604225","54.38.73.16","172.18.0.2","TLSv1.2","2247","Application Data"
"6.604262","172.18.0.2","54.38.73.16","TCP","68","36876 → 21002 [ACK] Seq=8059 Ack=109449 Win=5599 Len=0 TSval=1083400905 TSecr=2674999306"
"6.604232","54.38.73.16","172.18.0.2","TLSv1.2","1516","Application Data"
"6.628212","54.38.73.16","172.18.0.2","TLSv1.2","2964","Application Data [TCP segment of a reassembled PDU]"
"6.628354","172.18.0.2","54.38.73.16","TCP","68","36876 → 21002 [ACK] Seq=8059 Ack=113793 Win=5596 Len=0 TSval=1083400929 TSecr=2674999334"
"6.656038","54.38.73.16","172.18.0.2","TLSv1.2","4093","Application Data, Application Data, Application Data"
"6.656183","172.18.0.2","54.38.73.16","TCP","68","36876 → 21002 [ACK] Seq=8059 Ack=117818 Win=5580 Len=0 TSval=1083400957 TSecr=2674999395"
"6.656948","172.18.0.2","54.38.73.16","TLSv1.2","611","Application Data"
"6.680217","54.38.73.16","172.18.0.2","TLSv1.2","4238","Application Data, Application Data"
"6.680373","172.18.0.2","54.38.73.16","TCP","68","36876 → 21002 [ACK] Seq=8602 Ack=121988 Win=5580 Len=0 TSval=1083400981 TSecr=2674999401"
"6.680645","54.38.73.16","172.18.0.2","TCP","68","21002 → 36876 [ACK] Seq=121988 Ack=8602 Win=1452 Len=0 TSval=2674999401 TSecr=1083400957"
"6.705008","54.38.73.16","172.18.0.2","TLSv1.2","4238","Application Data, Application Data"
"6.705050","172.18.0.2","54.38.73.16","TCP","68","36876 → 21002 [ACK] Seq=8602 Ack=126158 Win=5580 Len=0 TSval=1083401005 TSecr=2674999407"
"6.746874","54.38.73.16","172.18.0.2","TLSv1.2","4145","Application Data"
"6.746926","172.18.0.2","54.38.73.16","TCP","68","36876 → 21002 [ACK] Seq=8602 Ack=130235 Win=5580 Len=0 TSval=1083401047 TSecr=2674999417"
"6.771217","54.38.73.16","172.18.0.2","TLSv1.2","4302","Application Data, Application Data"
"6.771254","172.18.0.2","54.38.73.16","TCP","68","36876 → 21002 [ACK] Seq=8602 Ack=134469 Win=5580 Len=0 TSval=1083401072 TSecr=2674999423"
"6.796169","54.38.73.16","172.18.0.2","TCP","2964","[TCP segment of a reassembled PDU]"
"6.796198","172.18.0.2","54.38.73.16","TCP","68","36876 → 21002 [ACK] Seq=8602 Ack=137365 Win=5596 Len=0 TSval=1083401097 TSecr=2674999430"
"6.796494","54.38.73.16","172.18.0.2","TLSv1.2","1342","Application Data, Application Data"
"6.796853","172.18.0.2","54.38.73.16","TLSv1.2","611","Application Data"
"6.820772","54.38.73.16","172.18.0.2","TCP","2964","[TCP segment of a reassembled PDU]"
"6.820801","172.18.0.2","54.38.73.16","TCP","68","36876 → 21002 [ACK] Seq=9145 Ack=141535 Win=5596 Len=0 TSval=1083401121 TSecr=2674999436"
"6.821000","54.38.73.16","172.18.0.2","TLSv1.2","1342","Application Data, Application Data"
"6.821407","172.18.0.2","54.38.73.16","TLSv1.2","611","Application Data"
"6.845206","54.38.73.16","172.18.0.2","TLSv1.2","1342","[TCP Previous segment not captured] , Ignored Unknown Record"
"6.845277","172.18.0.2","54.38.73.16","TCP","80","[TCP Dup ACK 127#1] 36876 → 21002 [ACK] Seq=9688 Ack=142809 Win=5593 Len=0 TSval=1083401146 TSecr=2674999436 SLE=145705 SRE=146979"
"6.845232","54.38.73.16","172.18.0.2","TCP","2964","[TCP Out-Of-Order] 21002 → 36876 [ACK] Seq=142809 Ack=9145 Win=1452 Len=2896 TSval=2674999442 TSecr=1083401121"
"6.845317","172.18.0.2","54.38.73.16","TCP","68","36876 → 21002 [ACK] Seq=9688 Ack=146979 Win=5580 Len=0 TSval=1083401146 TSecr=2674999436"
"6.869779","54.38.73.16","172.18.0.2","TLSv1.2","4238","Application Data, Application Data"
"6.869829","172.18.0.2","54.38.73.16","TCP","68","36876 → 21002 [ACK] Seq=9688 Ack=151149 Win=5580 Len=0 TSval=1083401170 TSecr=2674999448"
"6.894863","54.38.73.16","172.18.0.2","TLSv1.2","4238","Application Data, Application Data"
"6.894897","172.18.0.2","54.38.73.16","TCP","68","36876 → 21002 [ACK] Seq=9688 Ack=155319 Win=5580 Len=0 TSval=1083401195 TSecr=2674999454"
"6.919029","54.38.73.16","172.18.0.2","TLSv1.2","4238","Application Data, Application Data"
"6.919063","172.18.0.2","54.38.73.16","TCP","68","36876 → 21002 [ACK] Seq=9688 Ack=159489 Win=5580 Len=0 TSval=1083401219 TSecr=2674999460"
"6.942938","54.38.73.16","172.18.0.2","TLSv1.2","4238","Application Data, Application Data"
"6.942973","172.18.0.2","54.38.73.16","TCP","68","36876 → 21002 [ACK] Seq=9688 Ack=163659 Win=5580 Len=0 TSval=1083401243 TSecr=2674999466"
"6.967891","54.38.73.16","172.18.0.2","TLSv1.2","4238","Application Data, Application Data"
"6.967928","172.18.0.2","54.38.73.16","TCP","68","36876 → 21002 [ACK] Seq=9688 Ack=167829 Win=5580 Len=0 TSval=1083401268 TSecr=2674999472"
"6.968459","172.18.0.2","54.38.73.16","TLSv1.2","611","Application Data"
"6.992507","54.38.73.16","172.18.0.2","TLSv1.2","4238","Application Data, Application Data"
"6.992626","172.18.0.2","54.38.73.16","TCP","68","36876 → 21002 [ACK] Seq=10231 Ack=171999 Win=5580 Len=0 TSval=1083401293 TSecr=2674999478"
"7.017392","54.38.73.16","172.18.0.2","TLSv1.2","1125","Application Data"
"7.027284","172.18.0.2","54.38.73.16","TLSv1.2","611","Application Data"
"7.088030","54.38.73.16","172.18.0.2","TCP","68","21002 → 36876 [ACK] Seq=173056 Ack=10774 Win=1452 Len=0 TSval=2674999503 TSecr=1083401328"
"8.038963","54.38.73.16","172.18.0.2","TLSv1.2","611","Application Data"
"8.039988","172.18.0.2","54.38.73.16","TLSv1.2","611","Application Data"
"8.063442","54.38.73.16","172.18.0.2","TCP","68","21002 → 36876 [ACK] Seq=173599 Ack=11317 Win=1452 Len=0 TSval=2674999747 TSecr=1083402340"
"8.720681","54.38.73.16","172.18.0.2","TLSv1.2","611","Application Data"
"8.746104","54.38.73.16","172.18.0.2","TCP","2964","[TCP segment of a reassembled PDU]"
"8.746243","172.18.0.2","54.38.73.16","TCP","68","36876 → 21002 [ACK] Seq=11317 Ack=177038 Win=5596 Len=0 TSval=1083403047 TSecr=2674999898"
"8.770263","54.38.73.16","172.18.0.2","TLSv1.2","3912","Application Data, Application Data"
"8.770390","172.18.0.2","54.38.73.16","TCP","68","36876 → 21002 [ACK] Seq=11317 Ack=180882 Win=5580 Len=0 TSval=1083403071 TSecr=2674999923"
"8.794188","54.38.73.16","172.18.0.2","TLSv1.2","4238","Application Data, Application Data"
"8.794228","172.18.0.2","54.38.73.16","TCP","68","36876 → 21002 [ACK] Seq=11317 Ack=185052 Win=5580 Len=0 TSval=1083403095 TSecr=2674999929"
"8.818469","54.38.73.16","172.18.0.2","TCP","1516","[TCP segment of a reassembled PDU]"
"8.818599","54.38.73.16","172.18.0.2","TLSv1.2","2790","Application Data, Application Data"
"8.818655","172.18.0.2","54.38.73.16","TCP","68","36876 → 21002 [ACK] Seq=11317 Ack=189222 Win=5578 Len=0 TSval=1083403119 TSecr=2674999935"
"8.841789","54.38.73.16","172.18.0.2","TLSv1.2","4238","Application Data, Application Data"
"8.841824","172.18.0.2","54.38.73.16","TCP","68","36876 → 21002 [ACK] Seq=11317 Ack=193392 Win=5580 Len=0 TSval=1083403142 TSecr=2674999941"
"8.842391","172.18.0.2","54.38.73.16","TLSv1.2","611","Application Data"
"8.866619","54.38.73.16","172.18.0.2","TCP","68","[TCP Previous segment not captured] 21002 → 36876 [ACK] Seq=197562 Ack=11860 Win=1452 Len=0 TSval=2674999947 TSecr=1083403143"
"8.866644","54.38.73.16","172.18.0.2","TCP","4238","[TCP Retransmission] 21002 → 36876 [PSH, ACK] Seq=193392 Ack=11317 Win=1452 Len=4170 TSval=2674999947 TSecr=1083403142"
"8.866698","172.18.0.2","54.38.73.16","TCP","68","36876 → 21002 [ACK] Seq=11860 Ack=197562 Win=5589 Len=0 TSval=1083403167 TSecr=2674999941"
"8.890302","54.38.73.16","172.18.0.2","TLSv1.2","4238","Application Data, Application Data"
"8.890541","172.18.0.2","54.38.73.16","TCP","68","36876 → 21002 [ACK] Seq=11860 Ack=201732 Win=5580 Len=0 TSval=1083403191 TSecr=2674999953"
"8.891083","172.18.0.2","54.38.73.16","TLSv1.2","611","Application Data"
"8.913968","54.38.73.16","172.18.0.2","TCP","2964","[TCP segment of a reassembled PDU]"
"8.913999","172.18.0.2","54.38.73.16","TCP","68","36876 → 21002 [ACK] Seq=12403 Ack=204628 Win=5596 Len=0 TSval=1083403214 TSecr=2674999959"
"8.914208","54.38.73.16","172.18.0.2","TLSv1.2","1342","Application Data, Application Data"
"8.938061","54.38.73.16","172.18.0.2","TCP","2964","[TCP segment of a reassembled PDU]"
"8.938125","172.18.0.2","54.38.73.16","TCP","68","36876 → 21002 [ACK] Seq=12403 Ack=208798 Win=5596 Len=0 TSval=1083403239 TSecr=2674999959"
"8.962737","54.38.73.16","172.18.0.2","TLSv1.2","3941","Application Data, Application Data, Application Data"
"8.962927","172.18.0.2","54.38.73.16","TCP","68","36876 → 21002 [ACK] Seq=12403 Ack=212671 Win=5580 Len=0 TSval=1083403263 TSecr=2674999971"
"8.987183","54.38.73.16","172.18.0.2","TLSv1.2","4238","Application Data, Application Data"
"8.987216","172.18.0.2","54.38.73.16","TCP","68","36876 → 21002 [ACK] Seq=12403 Ack=216841 Win=5580 Len=0 TSval=1083403288 TSecr=2674999977"
"9.011099","54.38.73.16","172.18.0.2","TLSv1.2","4238","Application Data, Application Data"
"9.011156","172.18.0.2","54.38.73.16","TCP","68","36876 → 21002 [ACK] Seq=12403 Ack=221011 Win=5580 Len=0 TSval=1083403312 TSecr=2674999983"
"9.035611","54.38.73.16","172.18.0.2","TLSv1.2","4238","Application Data, Application Data"
"9.035790","172.18.0.2","54.38.73.16","TCP","68","36876 → 21002 [ACK] Seq=12403 Ack=225181 Win=5578 Len=0 TSval=1083403336 TSecr=2674999989"
"9.060850","54.38.73.16","172.18.0.2","TLSv1.2","4238","Application Data, Application Data"
"9.060890","172.18.0.2","54.38.73.16","TCP","68","36876 → 21002 [ACK] Seq=12403 Ack=229351 Win=5580 Len=0 TSval=1083403361 TSecr=2674999996"
"9.061392","172.18.0.2","54.38.73.16","TLSv1.2","611","Application Data"
"9.084662","54.38.73.16","172.18.0.2","TLSv1.2","4238","Application Data, Application Data"
"9.084708","172.18.0.2","54.38.73.16","TCP","68","36876 → 21002 [ACK] Seq=12946 Ack=233521 Win=5580 Len=0 TSval=1083403385 TSecr=2675000002"
"9.111812","54.38.73.16","172.18.0.2","TLSv1.2","4238","Application Data, Application Data"
"9.111864","172.18.0.2","54.38.73.16","TCP","68","36876 → 21002 [ACK] Seq=12946 Ack=237691 Win=5580 Len=0 TSval=1083403412 TSecr=2675000008"
"9.136162","54.38.73.16","172.18.0.2","TLSv1.2","1125","Application Data"
"9.146771","172.18.0.2","54.38.73.16","TLSv1.2","611","Application Data"
"9.208402","54.38.73.16","172.18.0.2","TCP","68","21002 → 36876 [ACK] Seq=238748 Ack=13489 Win=1452 Len=0 TSval=2675000033 TSecr=1083403447"
"9.984339","54.38.73.16","172.18.0.2","TLSv1.2","611","Application Data"
"9.985361","172.18.0.2","54.38.73.16","TLSv1.2","611","Application Data"
"10.009843","54.38.73.16","172.18.0.2","TCP","68","21002 → 36876 [ACK] Seq=239291 Ack=14032 Win=1452 Len=0 TSval=2675000233 TSecr=1083404286"
"10.532547","54.38.73.16","172.18.0.2","TLSv1.2","3695","Application Data"
"10.532707","172.18.0.2","54.38.73.16","TCP","68","36876 → 21002 [ACK] Seq=14032 Ack=242918 Win=5584 Len=0 TSval=1083404833 TSecr=2675000363"
"10.572321","54.38.73.16","172.18.0.2","TCP","2964","[TCP segment of a reassembled PDU]"
"10.572355","172.18.0.2","54.38.73.16","TCP","68","36876 → 21002 [ACK] Seq=14032 Ack=245814 Win=5596 Len=0 TSval=1083404873 TSecr=2675000374"
"10.572503","54.38.73.16","172.18.0.2","TLSv1.2","799","Application Data"
"10.572940","172.18.0.2","54.38.73.16","TLSv1.2","611","Application Data"
"10.598386","54.38.73.16","172.18.0.2","TCP","68","21002 → 36876 [ACK] Seq=246545 Ack=14575 Win=1452 Len=0 TSval=2675000380 TSecr=1083404873"
"10.603324","54.38.73.16","172.18.0.2","TLSv1.2","4145","Application Data"
"10.603505","172.18.0.2","54.38.73.16","TCP","68","36876 → 21002 [ACK] Seq=14575 Ack=250622 Win=5581 Len=0 TSval=1083404904 TSecr=2675000381"
"10.627418","54.38.73.16","172.18.0.2","TLSv1.2","3788","Application Data, Application Data"
"10.627605","172.18.0.2","54.38.73.16","TCP","68","36876 → 21002 [ACK] Seq=14575 Ack=254342 Win=5580 Len=0 TSval=1083404928 TSecr=2675000387"
"10.651404","54.38.73.16","172.18.0.2","TLSv1.2","1639","Application Data"
"10.651440","172.18.0.2","54.38.73.16","TCP","68","36876 → 21002 [ACK] Seq=14575 Ack=255913 Win=5601 Len=0 TSval=1083404952 TSecr=2675000393"
"10.653839","54.38.73.16","172.18.0.2","TCP","1516","[TCP segment of a reassembled PDU]"
"10.676277","54.38.73.16","172.18.0.2","TLSv1.2","2247","Application Data"
"10.676457","172.18.0.2","54.38.73.16","TCP","68","36876 → 21002 [ACK] Seq=14575 Ack=259540 Win=5612 Len=0 TSval=1083404977 TSecr=2675000394"
"10.701742","54.38.73.16","172.18.0.2","TLSv1.2","3695","Application Data"
"10.701931","172.18.0.2","54.38.73.16","TCP","68","36876 → 21002 [ACK] Seq=14575 Ack=263167 Win=5584 Len=0 TSval=1083405002 TSecr=2675000406"
"10.727209","54.38.73.16","172.18.0.2","TLSv1.2","4145","Application Data"
"10.727395","172.18.0.2","54.38.73.16","TCP","68","36876 → 21002 [ACK] Seq=14575 Ack=267244 Win=5580 Len=0 TSval=1083405028 TSecr=2675000412"
"10.727808","172.18.0.2","54.38.73.16","TLSv1.2","611","Application Data"
"10.753087","54.38.73.16","172.18.0.2","TLSv1.2","2246","Application Data, Application Data"
"10.753269","172.18.0.2","54.38.73.16","TCP","68","36876 → 21002 [ACK] Seq=15118 Ack=269422 Win=5599 Len=0 TSval=1083405054 TSecr=2675000419"
"10.770107","54.38.73.16","172.18.0.2","TCP","1516","[TCP segment of a reassembled PDU]"
"10.777616","54.38.73.16","172.18.0.2","TLSv1.2","191","Application Data"
"10.777797","172.18.0.2","54.38.73.16","TCP","68","36876 → 21002 [ACK] Seq=15118 Ack=270993 Win=5612 Len=0 TSval=1083405078 TSecr=2675000423"
"10.844640","54.38.73.16","172.18.0.2","TLSv1.2","4145","Application Data"
"10.844647","54.38.73.16","172.18.0.2","TCP","1516","[TCP segment of a reassembled PDU]"
"10.844839","172.18.0.2","54.38.73.16","TCP","68","36876 → 21002 [ACK] Seq=15118 Ack=276518 Win=5582 Len=0 TSval=1083405145 TSecr=2675000441"
"10.868966","54.38.73.16","172.18.0.2","TLSv1.2","5424","Application Data, Application Data"
"10.869001","172.18.0.2","54.38.73.16","TCP","68","36876 → 21002 [ACK] Seq=15118 Ack=281874 Win=5583 Len=0 TSval=1083405169 TSecr=2675000448"
"10.893581","54.38.73.16","172.18.0.2","TLSv1.2","4238","Application Data, Application Data"
"10.893737","172.18.0.2","54.38.73.16","TCP","68","36876 → 21002 [ACK] Seq=15118 Ack=286044 Win=5580 Len=0 TSval=1083405194 TSecr=2675000454"
"10.918525","54.38.73.16","172.18.0.2","TLSv1.2","1125","Application Data"
"10.920835","54.38.73.16","172.18.0.2","TCP","2964","[TCP segment of a reassembled PDU]"
"10.920867","172.18.0.2","54.38.73.16","TCP","68","36876 → 21002 [ACK] Seq=15118 Ack=289997 Win=5596 Len=0 TSval=1083405221 TSecr=2675000460"
"10.929922","54.38.73.16","172.18.0.2","TLSv1.2","1516","Application Data [TCP segment of a reassembled PDU]"
"10.945070","54.38.73.16","172.18.0.2","TCP","2964","21002 → 36876 [ACK] Seq=291445 Ack=15118 Win=1452 Len=2896 TSval=2675000467 TSecr=1083405221 [TCP segment of a reassembled PDU]"
"10.945104","172.18.0.2","54.38.73.16","TCP","68","36876 → 21002 [ACK] Seq=15118 Ack=294341 Win=5596 Len=0 TSval=1083405246 TSecr=2675000463"
"10.951685","54.38.73.16","172.18.0.2","TLSv1.2","1516","Application Data [TCP segment of a reassembled PDU]"
"10.952171","172.18.0.2","54.38.73.16","TLSv1.2","611","Application Data"
"10.969208","54.38.73.16","172.18.0.2","TLSv1.2","2964","Application Data, Application Data"
"10.969243","172.18.0.2","54.38.73.16","TCP","68","36876 → 21002 [ACK] Seq=15661 Ack=298685 Win=5596 Len=0 TSval=1083405270 TSecr=2675000473"
"10.972955","54.38.73.16","172.18.0.2","TCP","1516","21002 → 36876 [ACK] Seq=298685 Ack=15118 Win=1452 Len=1448 TSval=2675000474 TSecr=1083405246 [TCP segment of a reassembled PDU]"
"10.975908","54.38.73.16","172.18.0.2","TLSv1.2","1516","Application Data, Application Data"
"10.975949","172.18.0.2","54.38.73.16","TLSv1.2","611","Application Data"
"10.995568","54.38.73.16","172.18.0.2","TCP","1516","21002 → 36876 [ACK] Seq=301581 Ack=15661 Win=1452 Len=1448 TSval=2675000479 TSecr=1083405270 [TCP segment of a reassembled PDU]"
"10.999622","54.38.73.16","172.18.0.2","TLSv1.2","2964","Application Data, Application Data"
"10.999662","172.18.0.2","54.38.73.16","TCP","68","36876 → 21002 [ACK] Seq=16204 Ack=305925 Win=5596 Len=0 TSval=1083405300 TSecr=2675000479"
"11.007850","54.38.73.16","172.18.0.2","TLSv1.2","1516","Application Data [TCP segment of a reassembled PDU]"
"11.023888","54.38.73.16","172.18.0.2","TLSv1.2","4273","Application Data, Application Data"
"11.024070","172.18.0.2","54.38.73.16","TCP","68","36876 → 21002 [ACK] Seq=16204 Ack=311578 Win=5580 Len=0 TSval=1083405324 TSecr=2675000482"
"11.034631","172.18.0.2","54.38.73.16","TLSv1.2","611","Application Data"
"11.096296","54.38.73.16","172.18.0.2","TCP","68","21002 → 36876 [ACK] Seq=311578 Ack=16747 Win=1452 Len=0 TSval=2675000505 TSecr=1083405335"
"12.135749","54.38.73.16","172.18.0.2","TLSv1.2","611","Application Data"
"12.135763","54.38.73.16","172.18.0.2","TCP","611","[TCP Retransmission] 21002 → 36876 [PSH, ACK] Seq=311578 Ack=16747 Win=1452 Len=543 TSval=2675000748 TSecr=1083405335"
"12.135818","172.18.0.2","54.38.73.16","TCP","80","36876 → 21002 [ACK] Seq=16747 Ack=312121 Win=5608 Len=0 TSval=1083406436 TSecr=2675000748 SLE=311578 SRE=312121"
"12.136715","172.18.0.2","54.38.73.16","TLSv1.2","611","Application Data"
"12.160860","54.38.73.16","172.18.0.2","TCP","68","21002 → 36876 [ACK] Seq=312121 Ack=17290 Win=1452 Len=0 TSval=2675000771 TSecr=1083406437"
"12.737703","54.38.73.16","172.18.0.2","TCP","2964","[TCP segment of a reassembled PDU]"
"12.737757","172.18.0.2","54.38.73.16","TCP","68","36876 → 21002 [ACK] Seq=17290 Ack=315017 Win=5596 Len=0 TSval=1083407038 TSecr=2675000915"
"12.738058","54.38.73.16","172.18.0.2","TLSv1.2","1249","Application Data"
"12.738131","172.18.0.2","54.38.73.16","TCP","68","36876 → 21002 [ACK] Seq=17290 Ack=316198 Win=5604 Len=0 TSval=1083407039 TSecr=2675000915"
"12.738104","54.38.73.16","172.18.0.2","TCP","2964","[TCP segment of a reassembled PDU]"
"12.738161","172.18.0.2","54.38.73.16","TCP","68","36876 → 21002 [ACK] Seq=17290 Ack=319094 Win=5582 Len=0 TSval=1083407039 TSecr=2675000915"
"12.762611","54.38.73.16","172.18.0.2","TLSv1.2","892","Application Data, Application Data"
"12.762647","172.18.0.2","54.38.73.16","TCP","68","36876 → 21002 [ACK] Seq=17290 Ack=319918 Win=5593 Len=0 TSval=1083407063 TSecr=2675000921"
"12.785600","54.38.73.16","172.18.0.2","TCP","2964","[TCP segment of a reassembled PDU]"
"12.785634","172.18.0.2","54.38.73.16","TCP","68","36876 → 21002 [ACK] Seq=17290 Ack=322814 Win=5596 Len=0 TSval=1083407086 TSecr=2675000927"
"12.788940","54.38.73.16","172.18.0.2","TLSv1.2","1342","Application Data, Application Data"
"12.788977","172.18.0.2","54.38.73.16","TCP","68","36876 → 21002 [ACK] Seq=17290 Ack=324088 Win=5593 Len=0 TSval=1083407089 TSecr=2675000928"
"12.828442","54.38.73.16","172.18.0.2","TLSv1.2","3181","Application Data"
"12.828479","172.18.0.2","54.38.73.16","TCP","68","36876 → 21002 [ACK] Seq=17290 Ack=327201 Win=5580 Len=0 TSval=1083407129 TSecr=2675000938"
"12.835801","172.18.0.2","54.38.73.16","TLSv1.2","611","Application Data"
"12.859503","54.38.73.16","172.18.0.2","TCP","68","21002 → 36876 [ACK] Seq=327201 Ack=17833 Win=1452 Len=0 TSval=2675000946 TSecr=1083407136"
"13.979169","54.38.73.16","172.18.0.2","TLSv1.2","611","Application Data"
"13.979224","172.18.0.2","54.38.73.16","TCP","68","36876 → 21002 [ACK] Seq=17833 Ack=327744 Win=5608 Len=0 TSval=1083408280 TSecr=2675001169"
"13.980241","172.18.0.2","54.38.73.16","TLSv1.2","611","Application Data"
"13.983499","54.38.73.16","172.18.0.2","TLSv1.2","611","[TCP Spurious Retransmission] , Application Data"
"13.983552","172.18.0.2","54.38.73.16","TCP","80","[TCP Dup ACK 272#1] 36876 → 21002 [ACK] Seq=18376 Ack=327744 Win=5612 Len=0 TSval=1083408284 TSecr=2675001227 SLE=327201 SRE=327744"
"14.004681","54.38.73.16","172.18.0.2","TCP","68","21002 → 36876 [ACK] Seq=327744 Ack=18376 Win=1452 Len=0 TSval=2675001232 TSecr=1083408281"
"14.592625","54.38.73.16","172.18.0.2","TLSv1.2","611","Application Data"
"14.592718","172.18.0.2","54.38.73.16","TCP","68","36876 → 21002 [ACK] Seq=18376 Ack=328287 Win=5608 Len=0 TSval=1083408893 TSecr=2675001354"
"14.592669","54.38.73.16","172.18.0.2","TCP","2964","[TCP segment of a reassembled PDU]"
"14.592737","172.18.0.2","54.38.73.16","TCP","68","36876 → 21002 [ACK] Seq=18376 Ack=331183 Win=5586 Len=0 TSval=1083408893 TSecr=2675001362"
"14.592871","54.38.73.16","172.18.0.2","TLSv1.2","1516","Application Data [TCP segment of a reassembled PDU]"
"14.592893","172.18.0.2","54.38.73.16","TCP","68","36876 → 21002 [ACK] Seq=18376 Ack=332631 Win=5575 Len=0 TSval=1083408893 TSecr=2675001362"
"14.617401","54.38.73.16","172.18.0.2","TCP","2964","21002 → 36876 [ACK] Seq=332631 Ack=18376 Win=1452 Len=2896 TSval=2675001385 TSecr=1083408893 [TCP segment of a reassembled PDU]"
"14.617446","172.18.0.2","54.38.73.16","TCP","68","36876 → 21002 [ACK] Seq=18376 Ack=335527 Win=5596 Len=0 TSval=1083408918 TSecr=2675001385"
"14.617593","54.38.73.16","172.18.0.2","TLSv1.2","1516","Application Data [TCP segment of a reassembled PDU]"
"14.617613","172.18.0.2","54.38.73.16","TCP","68","36876 → 21002 [ACK] Seq=18376 Ack=336975 Win=5593 Len=0 TSval=1083408918 TSecr=2675001385"
"14.643500","54.38.73.16","172.18.0.2","TLSv1.2","2804","Application Data, Application Data"
"14.643530","172.18.0.2","54.38.73.16","TCP","68","36876 → 21002 [ACK] Seq=18376 Ack=339711 Win=5596 Len=0 TSval=1083408944 TSecr=2675001391"
"14.651986","54.38.73.16","172.18.0.2","TCP","1516","[TCP segment of a reassembled PDU]"
"14.652015","172.18.0.2","54.38.73.16","TCP","68","36876 → 21002 [ACK] Seq=18376 Ack=341159 Win=5593 Len=0 TSval=1083408952 TSecr=2675001394"
"14.668241","54.38.73.16","172.18.0.2","TLSv1.2","2964","Application Data [TCP segment of a reassembled PDU]"
"14.668276","172.18.0.2","54.38.73.16","TCP","68","36876 → 21002 [ACK] Seq=18376 Ack=344055 Win=5596 Len=0 TSval=1083408969 TSecr=2675001397"
"14.676800","54.38.73.16","172.18.0.2","TLSv1.2","1516","Application Data, Application Data"
"14.676831","172.18.0.2","54.38.73.16","TCP","68","36876 → 21002 [ACK] Seq=18376 Ack=345503 Win=5593 Len=0 TSval=1083408977 TSecr=2675001400"
"14.692019","54.38.73.16","172.18.0.2","TCP","1516","21002 → 36876 [ACK] Seq=345503 Ack=18376 Win=1452 Len=1448 TSval=2675001404 TSecr=1083408969 [TCP segment of a reassembled PDU]"
"14.692053","172.18.0.2","54.38.73.16","TCP","68","36876 → 21002 [ACK] Seq=18376 Ack=346951 Win=5593 Len=0 TSval=1083408992 TSecr=2675001404"
"14.692328","54.38.73.16","172.18.0.2","TLSv1.2","1516","Application Data [TCP segment of a reassembled PDU]"
"14.692354","172.18.0.2","54.38.73.16","TCP","68","36876 → 21002 [ACK] Seq=18376 Ack=348399 Win=5593 Len=0 TSval=1083408993 TSecr=2675001404"
"14.703084","54.38.73.16","172.18.0.2","TLSv1.2","1291","Application Data"
"14.703122","172.18.0.2","54.38.73.16","TCP","68","36876 → 21002 [ACK] Seq=18376 Ack=349622 Win=5593 Len=0 TSval=1083409004 TSecr=2675001406"
"14.703558","172.18.0.2","54.38.73.16","TLSv1.2","611","Application Data"
"14.727017","54.38.73.16","172.18.0.2","TCP","68","21002 → 36876 [ACK] Seq=349622 Ack=18919 Win=1452 Len=0 TSval=2675001412 TSecr=1083409004"
"14.728137","54.38.73.16","172.18.0.2","TLSv1.2","4145","Application Data"
"14.728170","172.18.0.2","54.38.73.16","TCP","68","36876 → 21002 [ACK] Seq=18919 Ack=353699 Win=5581 Len=0 TSval=1083409029 TSecr=2675001412"
"14.754388","54.38.73.16","172.18.0.2","TLSv1.2","4302","Application Data, Application Data"
"14.754422","172.18.0.2","54.38.73.16","TCP","68","36876 → 21002 [ACK] Seq=18919 Ack=357933 Win=5580 Len=0 TSval=1083409055 TSecr=2675001419"
"14.754935","172.18.0.2","54.38.73.16","TLSv1.2","611","Application Data"
"14.778818","54.38.73.16","172.18.0.2","TCP","2964","[TCP segment of a reassembled PDU]"
"14.778852","172.18.0.2","54.38.73.16","TCP","68","36876 → 21002 [ACK] Seq=19462 Ack=360829 Win=5596 Len=0 TSval=1083409079 TSecr=2675001425"
"14.779012","54.38.73.16","172.18.0.2","TLSv1.2","1342","Application Data, Application Data"
"14.779339","172.18.0.2","54.38.73.16","TCP","68","36876 → 21002 [ACK] Seq=19462 Ack=362103 Win=5612 Len=0 TSval=1083409080 TSecr=2675001425"
"14.805006","54.38.73.16","172.18.0.2","TLSv1.2","1342","[TCP Previous segment not captured] , Ignored Unknown Record"
"14.805061","172.18.0.2","54.38.73.16","TCP","80","[TCP Dup ACK 311#1] 36876 → 21002 [ACK] Seq=19462 Ack=362103 Win=5612 Len=0 TSval=1083409105 TSecr=2675001425 SLE=364999 SRE=366273"
"14.805022","54.38.73.16","172.18.0.2","TCP","2964","[TCP Out-Of-Order] 21002 → 36876 [ACK] Seq=362103 Ack=19462 Win=1452 Len=2896 TSval=2675001432 TSecr=1083409055"
"14.805095","172.18.0.2","54.38.73.16","TCP","68","36876 → 21002 [ACK] Seq=19462 Ack=366273 Win=5580 Len=0 TSval=1083409106 TSecr=2675001432"
"14.806246","172.18.0.2","54.38.73.16","TLSv1.2","611","Application Data"
"14.831567","54.38.73.16","172.18.0.2","TLSv1.2","611","Application Data"
"14.868940","54.38.73.16","172.18.0.2","TCP","68","21002 → 36876 [ACK] Seq=366816 Ack=20005 Win=1452 Len=0 TSval=2675001448 TSecr=1083409107"
"14.868983","172.18.0.2","54.38.73.16","TLSv1.2","611","Application Data"
"14.893383","54.38.73.16","172.18.0.2","TCP","68","21002 → 36876 [ACK] Seq=366816 Ack=20548 Win=1452 Len=0 TSval=2675001454 TSecr=1083409169"
"15.822077","54.38.73.16","172.18.0.2","TLSv1.2","611","Application Data"
"15.822117","54.38.73.16","172.18.0.2","TCP","611","[TCP Retransmission] 21002 → 36876 [PSH, ACK] Seq=366816 Ack=20548 Win=1452 Len=543 TSval=2675001685 TSecr=1083409169"
"15.822200","172.18.0.2","54.38.73.16","TCP","80","36876 → 21002 [ACK] Seq=20548 Ack=367359 Win=5608 Len=0 TSval=1083410123 TSecr=2675001685 SLE=366816 SRE=367359"
"15.823121","172.18.0.2","54.38.73.16","TLSv1.2","611","Application Data"
"15.846789","54.38.73.16","172.18.0.2","TCP","68","21002 → 36876 [ACK] Seq=367359 Ack=21091 Win=1452 Len=0 TSval=2675001692 TSecr=1083410124"
"16.436734","54.38.73.16","172.18.0.2","TLSv1.2","4145","Application Data"
"16.436799","172.18.0.2","54.38.73.16","TCP","68","36876 → 21002 [ACK] Seq=21091 Ack=371436 Win=5581 Len=0 TSval=1083410737 TSecr=2675001799"
"16.436740","54.38.73.16","172.18.0.2","TCP","1516","[TCP segment of a reassembled PDU]"
"16.436819","172.18.0.2","54.38.73.16","TCP","68","36876 → 21002 [ACK] Seq=21091 Ack=372884 Win=5570 Len=0 TSval=1083410737 TSecr=2675001818"
"16.463248","54.38.73.16","172.18.0.2","TLSv1.2","3911","Application Data, Application Data, Application Data"
"16.463281","172.18.0.2","54.38.73.16","TCP","68","36876 → 21002 [ACK] Seq=21091 Ack=376727 Win=5580 Len=0 TSval=1083410764 TSecr=2675001846"
"16.487977","54.38.73.16","172.18.0.2","TLSv1.2","4238","Application Data, Application Data"
"16.488009","172.18.0.2","54.38.73.16","TCP","68","36876 → 21002 [ACK] Seq=21091 Ack=380897 Win=5580 Len=0 TSval=1083410788 TSecr=2675001852"
"16.512386","54.38.73.16","172.18.0.2","TLSv1.2","4238","Application Data, Application Data"
"16.512422","172.18.0.2","54.38.73.16","TCP","68","36876 → 21002 [ACK] Seq=21091 Ack=385067 Win=5580 Len=0 TSval=1083410813 TSecr=2675001859"
"16.535990","54.38.73.16","172.18.0.2","TLSv1.2","4238","Application Data, Application Data"
"16.536026","172.18.0.2","54.38.73.16","TCP","68","36876 → 21002 [ACK] Seq=21091 Ack=389237 Win=5580 Len=0 TSval=1083410836 TSecr=2675001865"
"16.560463","54.38.73.16","172.18.0.2","TLSv1.2","4238","Application Data, Application Data"
"16.560497","172.18.0.2","54.38.73.16","TCP","68","36876 → 21002 [ACK] Seq=21091 Ack=393407 Win=5580 Len=0 TSval=1083410861 TSecr=2675001871"
"16.561163","172.18.0.2","54.38.73.16","TLSv1.2","611","Application Data"
"16.584357","54.38.73.16","172.18.0.2","TLSv1.2","4238","Application Data, Application Data"
"16.584390","172.18.0.2","54.38.73.16","TCP","68","36876 → 21002 [ACK] Seq=21634 Ack=397577 Win=5580 Len=0 TSval=1083410885 TSecr=2675001877"
"16.585007","54.38.73.16","172.18.0.2","TCP","68","21002 → 36876 [ACK] Seq=397577 Ack=21634 Win=1452 Len=0 TSval=2675001877 TSecr=1083410862"
"16.607873","54.38.73.16","172.18.0.2","TLSv1.2","4238","Application Data, Application Data"
"16.607904","172.18.0.2","54.38.73.16","TCP","68","36876 → 21002 [ACK] Seq=21634 Ack=401747 Win=5580 Len=0 TSval=1083410908 TSecr=2675001883"
"16.633600","54.38.73.16","172.18.0.2","TLSv1.2","4238","Application Data, Application Data"
"16.633633","172.18.0.2","54.38.73.16","TCP","68","36876 → 21002 [ACK] Seq=21634 Ack=405917 Win=5580 Len=0 TSval=1083410934 TSecr=2675001889"
"16.634136","172.18.0.2","54.38.73.16","TLSv1.2","611","Application Data"
"16.658109","54.38.73.16","172.18.0.2","TLSv1.2","4238","Application Data, Application Data"
"16.658125","172.18.0.2","54.38.73.16","TCP","68","36876 → 21002 [ACK] Seq=22177 Ack=410087 Win=5580 Len=0 TSval=1083410959 TSecr=2675001895"
"16.682076","54.38.73.16","172.18.0.2","TLSv1.2","4238","Application Data, Application Data"
"16.682116","172.18.0.2","54.38.73.16","TCP","68","36876 → 21002 [ACK] Seq=22177 Ack=414257 Win=5580 Len=0 TSval=1083410983 TSecr=2675001901"
"16.706321","54.38.73.16","172.18.0.2","TLSv1.2","4238","Application Data, Application Data"
"16.706355","172.18.0.2","54.38.73.16","TCP","68","36876 → 21002 [ACK] Seq=22177 Ack=418427 Win=5580 Len=0 TSval=1083411007 TSecr=2675001907"
"16.730136","54.38.73.16","172.18.0.2","TCP","2964","[TCP segment of a reassembled PDU]"
"16.730169","172.18.0.2","54.38.73.16","TCP","68","36876 → 21002 [ACK] Seq=22177 Ack=421323 Win=5596 Len=0 TSval=1083411031 TSecr=2675001913"
"16.730284","54.38.73.16","172.18.0.2","TLSv1.2","1342","Application Data, Application Data"
"16.730631","172.18.0.2","54.38.73.16","TLSv1.2","611","Application Data"
"16.754820","54.38.73.16","172.18.0.2","TLSv1.2","1342","[TCP Previous segment not captured] , Ignored Unknown Record"
"16.754870","172.18.0.2","54.38.73.16","TCP","80","[TCP Window Update] 36876 → 21002 [ACK] Seq=22720 Ack=422597 Win=5593 Len=0 TSval=1083411055 TSecr=2675001913 SLE=425493 SRE=426767"
"16.754835","54.38.73.16","172.18.0.2","TCP","2964","[TCP Out-Of-Order] 21002 → 36876 [ACK] Seq=422597 Ack=22177 Win=1452 Len=2896 TSval=2675001919 TSecr=1083411031"
"16.754901","172.18.0.2","54.38.73.16","TCP","68","36876 → 21002 [ACK] Seq=22720 Ack=426767 Win=5580 Len=0 TSval=1083411055 TSecr=2675001913"
"16.779397","54.38.73.16","172.18.0.2","TLSv1.2","4238","Application Data, Application Data"
"16.779486","172.18.0.2","54.38.73.16","TCP","68","36876 → 21002 [ACK] Seq=22720 Ack=430937 Win=5580 Len=0 TSval=1083411080 TSecr=2675001925"
"16.802891","54.38.73.16","172.18.0.2","TCP","2964","[TCP segment of a reassembled PDU]"
"16.802926","172.18.0.2","54.38.73.16","TCP","68","36876 → 21002 [ACK] Seq=22720 Ack=433833 Win=5596 Len=0 TSval=1083411103 TSecr=2675001931"
"16.803099","54.38.73.16","172.18.0.2","TLSv1.2","1342","Application Data, Application Data"
"16.811713","54.38.73.16","172.18.0.2","TCP","1516","[TCP segment of a reassembled PDU]"
"16.811871","172.18.0.2","54.38.73.16","TCP","68","36876 → 21002 [ACK] Seq=22720 Ack=436555 Win=5593 Len=0 TSval=1083411112 TSecr=2675001931"
"16.828114","54.38.73.16","172.18.0.2","TLSv1.2","2964","Application Data [TCP segment of a reassembled PDU]"
"16.828147","172.18.0.2","54.38.73.16","TCP","68","36876 → 21002 [ACK] Seq=22720 Ack=439451 Win=5596 Len=0 TSval=1083411129 TSecr=2675001937"
"16.834848","54.38.73.16","172.18.0.2","TLSv1.2","2964","Application Data [TCP segment of a reassembled PDU]"
"16.834881","172.18.0.2","54.38.73.16","TCP","68","36876 → 21002 [ACK] Seq=22720 Ack=442347 Win=5596 Len=0 TSval=1083411135 TSecr=2675001939"
"16.853079","54.38.73.16","172.18.0.2","TLSv1.2","2167","Application Data"
"16.853112","172.18.0.2","54.38.73.16","TCP","68","36876 → 21002 [ACK] Seq=22720 Ack=444446 Win=5599 Len=0 TSval=1083411154 TSecr=2675001944"
"16.863543","172.18.0.2","54.38.73.16","TLSv1.2","611","Application Data"
"16.939433","54.38.73.16","172.18.0.2","TCP","68","21002 → 36876 [ACK] Seq=444446 Ack=23263 Win=1452 Len=0 TSval=2675001966 TSecr=1083411164"
"17.664478","54.38.73.16","172.18.0.2","TLSv1.2","611","Application Data"
"17.665020","172.18.0.2","54.38.73.16","TLSv1.2","611","Application Data"
"17.690293","54.38.73.16","172.18.0.2","TCP","68","21002 → 36876 [ACK] Seq=444989 Ack=23806 Win=1452 Len=0 TSval=2675002153 TSecr=1083411965"
"18.279077","54.38.73.16","172.18.0.2","TLSv1.2","611","Application Data"
"18.279206","54.38.73.16","172.18.0.2","TCP","2964","[TCP segment of a reassembled PDU]"
"18.279211","54.38.73.16","172.18.0.2","TLSv1.2","1516","Application Data [TCP segment of a reassembled PDU]"
"18.279275","172.18.0.2","54.38.73.16","TCP","68","36876 → 21002 [ACK] Seq=23806 Ack=449876 Win=5574 Len=0 TSval=1083412580 TSecr=2675002274"
"18.304994","54.38.73.16","172.18.0.2","TLSv1.2","4412","Application Data [TCP segment of a reassembled PDU]"
"18.305032","172.18.0.2","54.38.73.16","TCP","68","36876 → 21002 [ACK] Seq=23806 Ack=454220 Win=5580 Len=0 TSval=1083412605 TSecr=2675002307"
"18.305305","54.38.73.16","172.18.0.2","TLSv1.2","1233","Application Data"
"18.330062","54.38.73.16","172.18.0.2","TCP","2964","[TCP segment of a reassembled PDU]"
"18.330111","172.18.0.2","54.38.73.16","TCP","68","36876 → 21002 [ACK] Seq=23806 Ack=458281 Win=5596 Len=0 TSval=1083412631 TSecr=2675002307"
"18.334108","54.38.73.16","172.18.0.2","TLSv1.2","1516","Application Data [TCP segment of a reassembled PDU]"
"18.334601","172.18.0.2","54.38.73.16","TLSv1.2","611","Application Data"
"18.353962","54.38.73.16","172.18.0.2","TLSv1.2","2964","Application Data, Application Data"
"18.353995","172.18.0.2","54.38.73.16","TCP","68","36876 → 21002 [ACK] Seq=24349 Ack=462625 Win=5596 Len=0 TSval=1083412654 TSecr=2675002319"
"18.358274","54.38.73.16","172.18.0.2","TLSv1.2","2739","Application Data, Application Data"
"18.358315","172.18.0.2","54.38.73.16","TCP","68","36876 → 21002 [ACK] Seq=24349 Ack=465296 Win=5597 Len=0 TSval=1083412659 TSecr=2675002320"
"18.378044","54.38.73.16","172.18.0.2","TCP","2964","[TCP segment of a reassembled PDU]"
"18.378230","172.18.0.2","54.38.73.16","TCP","68","36876 → 21002 [ACK] Seq=24349 Ack=468192 Win=5596 Len=0 TSval=1083412679 TSecr=2675002325"
"18.382492","54.38.73.16","172.18.0.2","TLSv1.2","2913","Application Data, Application Data, Application Data"
"18.382530","172.18.0.2","54.38.73.16","TCP","68","36876 → 21002 [ACK] Seq=24349 Ack=471037 Win=5596 Len=0 TSval=1083412683 TSecr=2675002326"
"18.383349","172.18.0.2","54.38.73.16","TLSv1.2","611","Application Data"
"18.402534","54.38.73.16","172.18.0.2","TCP","2964","[TCP segment of a reassembled PDU]"
"18.402694","172.18.0.2","54.38.73.16","TCP","68","36876 → 21002 [ACK] Seq=24892 Ack=473933 Win=5596 Len=0 TSval=1083412703 TSecr=2675002331"
"18.406293","54.38.73.16","172.18.0.2","TLSv1.2","2913","Application Data, Application Data, Application Data"
"18.406326","172.18.0.2","54.38.73.16","TCP","68","36876 → 21002 [ACK] Seq=24892 Ack=476778 Win=5596 Len=0 TSval=1083412707 TSecr=2675002332"
"18.426657","54.38.73.16","172.18.0.2","TLSv1.2","2964","Application Data"
"18.426697","172.18.0.2","54.38.73.16","TCP","68","36876 → 21002 [ACK] Seq=24892 Ack=479674 Win=5596 Len=0 TSval=1083412727 TSecr=2675002337"
"18.430116","54.38.73.16","172.18.0.2","TLSv1.2","2964","Application Data [TCP segment of a reassembled PDU]"
"18.430151","172.18.0.2","54.38.73.16","TCP","68","36876 → 21002 [ACK] Seq=24892 Ack=482570 Win=5596 Len=0 TSval=1083412731 TSecr=2675002338"
"18.451954","54.38.73.16","172.18.0.2","TLSv1.2","2964","Application Data [TCP segment of a reassembled PDU]"
"18.451990","172.18.0.2","54.38.73.16","TCP","68","36876 → 21002 [ACK] Seq=24892 Ack=485466 Win=5596 Len=0 TSval=1083412752 TSecr=2675002343"
"18.453884","54.38.73.16","172.18.0.2","TLSv1.2","1262","Application Data"
"18.460431","172.18.0.2","54.38.73.16","TLSv1.2","611","Application Data"
"18.520184","54.38.73.16","172.18.0.2","TCP","68","21002 → 36876 [ACK] Seq=486660 Ack=25435 Win=1452 Len=0 TSval=2675002361 TSecr=1083412761"
"19.201527","54.38.73.16","172.18.0.2","TLSv1.2","611","Application Data"
"19.202626","172.18.0.2","54.38.73.16","TLSv1.2","611","Application Data"
"19.227056","54.38.73.16","172.18.0.2","TCP","68","21002 → 36876 [ACK] Seq=487203 Ack=25978 Win=1452 Len=0 TSval=2675002537 TSecr=1083413503"
"19.815344","54.38.73.16","172.18.0.2","TLSv1.2","3695","Application Data"
"19.815350","54.38.73.16","172.18.0.2","TCP","1516","[TCP segment of a reassembled PDU]"
"19.815541","172.18.0.2","54.38.73.16","TCP","68","36876 → 21002 [ACK] Seq=25978 Ack=492278 Win=5573 Len=0 TSval=1083414116 TSecr=2675002669"
"19.840152","54.38.73.16","172.18.0.2","TLSv1.2","5360","Application Data, Application Data"
"19.840187","172.18.0.2","54.38.73.16","TCP","68","36876 → 21002 [ACK] Seq=25978 Ack=497570 Win=5583 Len=0 TSval=1083414141 TSecr=2675002691"
"19.865809","54.38.73.16","172.18.0.2","TLSv1.2","4752","Application Data, Application Data"
"19.865858","172.18.0.2","54.38.73.16","TCP","68","36876 → 21002 [ACK] Seq=25978 Ack=502254 Win=5585 Len=0 TSval=1083414166 TSecr=2675002697"
"19.901148","54.38.73.16","172.18.0.2","TLSv1.2","4145","Application Data"
"19.901278","54.38.73.16","172.18.0.2","TLSv1.2","1516","Application Data"
"19.901346","172.18.0.2","54.38.73.16","TCP","68","36876 → 21002 [ACK] Seq=25978 Ack=507779 Win=5564 Len=0 TSval=1083414202 TSecr=2675002706"
"19.925829","54.38.73.16","172.18.0.2","TLSv1.2","5453","Application Data, Application Data"
"19.925865","172.18.0.2","54.38.73.16","TCP","68","36876 → 21002 [ACK] Seq=25978 Ack=513164 Win=5582 Len=0 TSval=1083414226 TSecr=2675002712"
"19.926416","172.18.0.2","54.38.73.16","TLSv1.2","611","Application Data"
"19.950752","54.38.73.16","172.18.0.2","TCP","68","[TCP Previous segment not captured] 21002 → 36876 [ACK] Seq=518905 Ack=26521 Win=1452 Len=0 TSval=2675002718 TSecr=1083414227"
"19.950820","172.18.0.2","54.38.73.16","TLSv1.2","611","Application Data"
"19.950781","54.38.73.16","172.18.0.2","TCP","5809","[TCP Retransmission] 21002 → 36876 [PSH, ACK] Seq=513164 Ack=25978 Win=1452 Len=5741 TSval=2675002718 TSecr=1083414226"
"19.950983","172.18.0.2","54.38.73.16","TCP","68","36876 → 21002 [ACK] Seq=27064 Ack=518905 Win=5581 Len=0 TSval=1083414251 TSecr=2675002712"
"19.977764","54.38.73.16","172.18.0.2","TCP","68","21002 → 36876 [ACK] Seq=518905 Ack=27064 Win=1452 Len=0 TSval=2675002724 TSecr=1083414251"
"19.977803","54.38.73.16","172.18.0.2","TLSv1.2","5809","Application Data, Application Data, Application Data"
"19.977963","172.18.0.2","54.38.73.16","TCP","68","36876 → 21002 [ACK] Seq=27064 Ack=524646 Win=5572 Len=0 TSval=1083414278 TSecr=2675002724"
"20.001796","54.38.73.16","172.18.0.2","TLSv1.2","1639","Application Data"
"20.001830","172.18.0.2","54.38.73.16","TCP","68","36876 → 21002 [ACK] Seq=27064 Ack=526217 Win=5601 Len=0 TSval=1083414302 TSecr=2675002731"
"20.081215","54.38.73.16","172.18.0.2","TLSv1.2","2153","Application Data"
"20.081366","172.18.0.2","54.38.73.16","TCP","68","36876 → 21002 [ACK] Seq=27064 Ack=528302 Win=5599 Len=0 TSval=1083414382 TSecr=2675002751"
"20.090313","172.18.0.2","54.38.73.16","TLSv1.2","611","Application Data"
"20.152198","54.38.73.16","172.18.0.2","TCP","68","21002 → 36876 [ACK] Seq=528302 Ack=27607 Win=1452 Len=0 TSval=2675002769 TSecr=1083414391"
"20.736962","54.38.73.16","172.18.0.2","TLSv1.2","611","Application Data"
"20.737674","172.18.0.2","54.38.73.16","TLSv1.2","611","Application Data"
"20.762111","54.38.73.16","172.18.0.2","TCP","68","21002 → 36876 [ACK] Seq=528845 Ack=28150 Win=1452 Len=0 TSval=2675002921 TSecr=1083415038"
"21.349533","54.38.73.16","172.18.0.2","TLSv1.2","611","Application Data"
"21.349679","54.38.73.16","172.18.0.2","TCP","2964","[TCP segment of a reassembled PDU]"
"21.349687","54.38.73.16","172.18.0.2","TLSv1.2","1516","Application Data [TCP segment of a reassembled PDU]"
"21.349828","172.18.0.2","54.38.73.16","TCP","68","36876 → 21002 [ACK] Seq=28150 Ack=533732 Win=5580 Len=0 TSval=1083415650 TSecr=2675003045"
"21.376274","54.38.73.16","172.18.0.2","TLSv1.2","5606","Application Data, Application Data, Application Data"
"21.376307","172.18.0.2","54.38.73.16","TCP","68","36876 → 21002 [ACK] Seq=28150 Ack=539270 Win=5582 Len=0 TSval=1083415677 TSecr=2675003074"
"21.403386","54.38.73.16","172.18.0.2","TLSv1.2","5809","Application Data, Application Data, Application Data"
"21.403529","172.18.0.2","54.38.73.16","TCP","68","36876 → 21002 [ACK] Seq=28150 Ack=545011 Win=5581 Len=0 TSval=1083415704 TSecr=2675003081"
"21.434105","54.38.73.16","172.18.0.2","TLSv1.2","5809","Application Data, Application Data, Application Data"
"21.434145","172.18.0.2","54.38.73.16","TCP","68","36876 → 21002 [ACK] Seq=28150 Ack=550752 Win=5581 Len=0 TSval=1083415735 TSecr=2675003089"
"21.461318","54.38.73.16","172.18.0.2","TLSv1.2","4752","Application Data, Application Data"
"21.461376","172.18.0.2","54.38.73.16","TCP","68","36876 → 21002 [ACK] Seq=28150 Ack=555436 Win=5585 Len=0 TSval=1083415762 TSecr=2675003096"
"21.462148","172.18.0.2","54.38.73.16","TLSv1.2","611","Application Data"
"21.486318","54.38.73.16","172.18.0.2","TCP","68","21002 → 36876 [ACK] Seq=555436 Ack=28693 Win=1452 Len=0 TSval=2675003102 TSecr=1083415763"
"21.486355","172.18.0.2","54.38.73.16","TLSv1.2","611","Application Data"
"21.511856","54.38.73.16","172.18.0.2","TCP","68","21002 → 36876 [ACK] Seq=555436 Ack=29236 Win=1452 Len=0 TSval=2675003108 TSecr=1083415787"
"22.271678","54.38.73.16","172.18.0.2","TLSv1.2","611","Application Data"
"22.272610","172.18.0.2","54.38.73.16","TLSv1.2","611","Application Data"
"22.296622","54.38.73.16","172.18.0.2","TCP","68","21002 → 36876 [ACK] Seq=555979 Ack=29779 Win=1452 Len=0 TSval=2675003305 TSecr=1083416573"
