_ws.col.Time,_ws.col.Source,_ws.col.Destination,_ws.col.Protocol,_ws.col.Length,_ws.col.Info
"0.000000","172.19.0.3","5.9.29.183","TLSv1.2","1113","Application Data"
"0.000269","5.9.29.183","172.19.0.3","TCP","56","9002 → 43520 [ACK] Seq=1 Ack=1058 Win=65535 Len=0"
"0.089426","5.9.29.183","172.19.0.3","TLSv1.2","599","Application Data"
"0.089859","172.19.0.3","5.9.29.183","TLSv1.2","599","Application Data"
"0.090106","5.9.29.183","172.19.0.3","TCP","56","9002 → 43520 [ACK] Seq=544 Ack=1601 Win=65535 Len=0"
"0.099139","172.19.0.3","5.9.29.183","TLSv1.2","599","Application Data"
"0.099471","5.9.29.183","172.19.0.3","TCP","56","9002 → 43520 [ACK] Seq=544 Ack=2144 Win=65535 Len=0"
"0.137399","5.9.29.183","172.19.0.3","TLSv1.2","599","Application Data"
"0.138097","172.19.0.3","5.9.29.183","TLSv1.2","1113","Application Data"
"0.138344","5.9.29.183","172.19.0.3","TCP","56","9002 → 43520 [ACK] Seq=1087 Ack=3201 Win=65535 Len=0"
"0.179189","5.9.29.183","172.19.0.3","TLSv1.2","1113","Application Data"
"0.212303","5.9.29.183","172.19.0.3","TLSv1.2","599","Application Data"
"0.212323","172.19.0.3","5.9.29.183","TCP","56","43520 → 9002 [ACK] Seq=3201 Ack=2687 Win=11911 Len=0"
"0.247172","5.9.29.183","172.19.0.3","TLSv1.2","1113","Application Data"
"0.278227","5.9.29.183","172.19.0.3","TLSv1.2","1113","Application Data"
"0.278246","172.19.0.3","5.9.29.183","TCP","56","43520 → 9002 [ACK] Seq=3201 Ack=4801 Win=11911 Len=0"
"0.293734","5.9.29.183","172.19.0.3","TLSv1.2","1113","Application Data"
"0.309672","5.9.29.183","172.19.0.3","TLSv1.2","599","Application Data"
"0.309690","172.19.0.3","5.9.29.183","TCP","56","43520 → 9002 [ACK] Seq=3201 Ack=6401 Win=11911 Len=0"
"0.326726","5.9.29.183","172.19.0.3","TLSv1.2","1113","Application Data"
"0.371142","172.19.0.3","5.9.29.183","TCP","56","43520 → 9002 [ACK] Seq=3201 Ack=7458 Win=11911 Len=0"
"0.669294","5.9.29.183","172.19.0.3","TLSv1.2","599","Application Data"
"0.669355","172.19.0.3","5.9.29.183","TCP","56","43520 → 9002 [ACK] Seq=3201 Ack=8001 Win=11911 Len=0"
"0.669949","172.19.0.3","5.9.29.183","TLSv1.2","599","Application Data"
"0.670222","5.9.29.183","172.19.0.3","TCP","56","9002 → 43520 [ACK] Seq=8001 Ack=3744 Win=65535 Len=0"
"0.788468","172.19.0.3","5.9.29.183","TLSv1.2","599","Application Data"
"0.788854","5.9.29.183","172.19.0.3","TCP","56","9002 → 43520 [ACK] Seq=8001 Ack=4287 Win=65535 Len=0"
"0.815241","5.9.29.183","172.19.0.3","TLSv1.2","599","Application Data"
"0.815920","172.19.0.3","5.9.29.183","TLSv1.2","599","Application Data"
"0.816248","5.9.29.183","172.19.0.3","TCP","56","9002 → 43520 [ACK] Seq=8544 Ack=4830 Win=65535 Len=0"
"0.881871","5.9.29.183","172.19.0.3","TLSv1.2","599","Application Data"
"0.882521","172.19.0.3","5.9.29.183","TLSv1.2","599","Application Data"
"0.882852","5.9.29.183","172.19.0.3","TCP","56","9002 → 43520 [ACK] Seq=9087 Ack=5373 Win=65535 Len=0"
"0.977011","5.9.29.183","172.19.0.3","TLSv1.2","599","Application Data"
"1.017303","5.9.29.183","172.19.0.3","TLSv1.2","599","Application Data"
"1.017322","172.19.0.3","5.9.29.183","TCP","56","43520 → 9002 [ACK] Seq=5373 Ack=10173 Win=11911 Len=0"
"1.018062","172.19.0.3","5.9.29.183","TLSv1.2","2141","Application Data"
"1.018265","5.9.29.183","172.19.0.3","TCP","56","9002 → 43520 [ACK] Seq=10173 Ack=6833 Win=65535 Len=0"
"1.018330","5.9.29.183","172.19.0.3","TCP","56","9002 → 43520 [ACK] Seq=10173 Ack=7458 Win=65535 Len=0"
"1.529937","5.9.29.183","172.19.0.3","TLSv1.2","599","Application Data"
"1.544437","5.9.29.183","172.19.0.3","TCP","1504","[TCP segment of a reassembled PDU]"
"1.544480","172.19.0.3","5.9.29.183","TCP","56","43520 → 9002 [ACK] Seq=7458 Ack=12164 Win=11911 Len=0"
"1.544945","5.9.29.183","172.19.0.3","TLSv1.2","179","Application Data"
"1.551055","172.19.0.3","5.9.29.183","TLSv1.2","599","Application Data"
"1.551435","5.9.29.183","172.19.0.3","TCP","56","9002 → 43520 [ACK] Seq=12287 Ack=8001 Win=65535 Len=0"
"1.777797","5.9.29.183","172.19.0.3","TLSv1.2","599","Application Data"
"1.778385","172.19.0.3","5.9.29.183","TLSv1.2","599","Application Data"
"1.778633","5.9.29.183","172.19.0.3","TCP","56","9002 → 43520 [ACK] Seq=12830 Ack=8544 Win=65535 Len=0"
"1.788120","172.19.0.3","5.9.29.183","TLSv1.2","599","Application Data"
"1.788441","5.9.29.183","172.19.0.3","TCP","56","9002 → 43520 [ACK] Seq=12830 Ack=9087 Win=65535 Len=0"
"1.825540","5.9.29.183","172.19.0.3","TLSv1.2","599","Application Data"
"1.826305","172.19.0.3","5.9.29.183","TLSv1.2","599","Application Data"
"1.826719","5.9.29.183","172.19.0.3","TCP","56","9002 → 43520 [ACK] Seq=13373 Ack=9630 Win=65535 Len=0"
"1.932031","5.9.29.183","172.19.0.3","TLSv1.2","599","Application Data"
"1.933294","172.19.0.3","5.9.29.183","TLSv1.2","599","Application Data"
"1.933586","5.9.29.183","172.19.0.3","TCP","56","9002 → 43520 [ACK] Seq=13916 Ack=10173 Win=65535 Len=0"
"2.120141","5.9.29.183","172.19.0.3","TCP","1516","[TCP segment of a reassembled PDU]"
"2.120186","5.9.29.183","172.19.0.3","TCP","1492","9002 → 43520 [PSH, ACK] Seq=15376 Ack=10173 Win=65535 Len=1436 [TCP segment of a reassembled PDU]"
"2.120194","5.9.29.183","172.19.0.3","TLSv1.2","1516","Application Data [TCP segment of a reassembled PDU]"
"2.120196","5.9.29.183","172.19.0.3","TCP","1225","9002 → 43520 [PSH, ACK] Seq=18272 Ack=10173 Win=65535 Len=1169 [TCP segment of a reassembled PDU]"
"2.120304","172.19.0.3","5.9.29.183","TCP","56","43520 → 9002 [ACK] Seq=10173 Ack=19441 Win=11887 Len=0"
"2.124361","5.9.29.183","172.19.0.3","TLSv1.2","1504","Application Data [TCP segment of a reassembled PDU]"
"2.136376","5.9.29.183","172.19.0.3","TLSv1.2","880","Application Data"
"2.136399","172.19.0.3","5.9.29.183","TCP","56","43520 → 9002 [ACK] Seq=10173 Ack=21713 Win=11911 Len=0"
"2.140291","5.9.29.183","172.19.0.3","TCP","1504","[TCP segment of a reassembled PDU]"
"2.151334","5.9.29.183","172.19.0.3","TLSv1.2","1207","Application Data"
"2.151352","172.19.0.3","5.9.29.183","TCP","56","43520 → 9002 [ACK] Seq=10173 Ack=24312 Win=11911 Len=0"
"2.181904","5.9.29.183","172.19.0.3","TCP","1516","[TCP segment of a reassembled PDU]"
"2.181958","5.9.29.183","172.19.0.3","TCP","1492","9002 → 43520 [PSH, ACK] Seq=25772 Ack=10173 Win=65535 Len=1436 [TCP segment of a reassembled PDU]"
"2.182128","172.19.0.3","5.9.29.183","TCP","56","43520 → 9002 [ACK] Seq=10173 Ack=27208 Win=11903 Len=0"
"2.182313","5.9.29.183","172.19.0.3","TLSv1.2","1237","Application Data"
"2.182577","5.9.29.183","172.19.0.3","TCP","1516","[TCP segment of a reassembled PDU]"
"2.182610","172.19.0.3","5.9.29.183","TCP","56","43520 → 9002 [ACK] Seq=10173 Ack=29849 Win=11911 Len=0"
"2.182613","5.9.29.183","172.19.0.3","TLSv1.2","1516","Application Data [TCP segment of a reassembled PDU]"
"2.182728","5.9.29.183","172.19.0.3","TCP","1516","9002 → 43520 [PSH, ACK] Seq=31309 Ack=10173 Win=65535 Len=1460 [TCP segment of a reassembled PDU]"
"2.182735","5.9.29.183","172.19.0.3","TCP","1516","9002 → 43520 [PSH, ACK] Seq=32769 Ack=10173 Win=65535 Len=1460 [TCP segment of a reassembled PDU]"
"2.182740","5.9.29.183","172.19.0.3","TLSv1.2","1456","Application Data [TCP segment of a reassembled PDU]"
"2.182835","172.19.0.3","5.9.29.183","TCP","56","43520 → 9002 [ACK] Seq=10173 Ack=35629 Win=11879 Len=0"
"2.197630","5.9.29.183","172.19.0.3","TLSv1.2","677","Application Data"
"2.198955","5.9.29.183","172.19.0.3","TCP","1504","[TCP segment of a reassembled PDU]"
"2.198967","172.19.0.3","5.9.29.183","TCP","56","43520 → 9002 [ACK] Seq=10173 Ack=37698 Win=11909 Len=0"
"2.199473","5.9.29.183","172.19.0.3","TCP","1516","9002 → 43520 [PSH, ACK] Seq=37698 Ack=10173 Win=65535 Len=1460 [TCP segment of a reassembled PDU]"
"2.199522","5.9.29.183","172.19.0.3","TLSv1.2","1492","Application Data [TCP segment of a reassembled PDU]"
"2.199608","172.19.0.3","5.9.29.183","TCP","56","43520 → 9002 [ACK] Seq=10173 Ack=40594 Win=11903 Len=0"
"2.205449","5.9.29.183","172.19.0.3","TLSv1.2","1516","Application Data [TCP segment of a reassembled PDU]"
"2.205524","5.9.29.183","172.19.0.3","TCP","66","9002 → 43520 [PSH, ACK] Seq=42054 Ack=10173 Win=65535 Len=10 [TCP segment of a reassembled PDU]"
"2.205546","172.19.0.3","5.9.29.183","TCP","56","43520 → 9002 [ACK] Seq=10173 Ack=42064 Win=11909 Len=0"
"2.205550","5.9.29.183","172.19.0.3","TCP","1516","9002 → 43520 [PSH, ACK] Seq=42064 Ack=10173 Win=65535 Len=1460 [TCP segment of a reassembled PDU]"
"2.205557","5.9.29.183","172.19.0.3","TCP","1470","9002 → 43520 [PSH, ACK] Seq=43524 Ack=10173 Win=65535 Len=1414 [TCP segment of a reassembled PDU]"
"2.205812","172.19.0.3","5.9.29.183","TCP","56","43520 → 9002 [ACK] Seq=10173 Ack=44938 Win=11893 Len=0"
"2.206028","172.19.0.3","5.9.29.183","TLSv1.2","599","Application Data"
"2.206304","5.9.29.183","172.19.0.3","TCP","56","9002 → 43520 [ACK] Seq=44938 Ack=10716 Win=65535 Len=0"
"2.212865","5.9.29.183","172.19.0.3","TLSv1.2","222","Application Data, Application Data"
"2.216416","5.9.29.183","172.19.0.3","TCP","1504","[TCP segment of a reassembled PDU]"
"2.216428","172.19.0.3","5.9.29.183","TCP","56","43520 → 9002 [ACK] Seq=10716 Ack=46552 Win=11911 Len=0"
"2.216861","5.9.29.183","172.19.0.3","TCP","1516","9002 → 43520 [PSH, ACK] Seq=46552 Ack=10716 Win=65535 Len=1460 [TCP segment of a reassembled PDU]"
"2.216943","5.9.29.183","172.19.0.3","TLSv1.2","1492","Application Data [TCP segment of a reassembled PDU]"
"2.216976","5.9.29.183","172.19.0.3","TCP","1516","9002 → 43520 [PSH, ACK] Seq=49448 Ack=10716 Win=65535 Len=1460 [TCP segment of a reassembled PDU]"
"2.216979","5.9.29.183","172.19.0.3","TCP","1516","9002 → 43520 [PSH, ACK] Seq=50908 Ack=10716 Win=65535 Len=1460 [TCP segment of a reassembled PDU]"
"2.216980","5.9.29.183","172.19.0.3","TLSv1.2","1480","Application Data [TCP segment of a reassembled PDU]"
"2.216985","172.19.0.3","5.9.29.183","TCP","56","43520 → 9002 [ACK] Seq=10716 Ack=49448 Win=11903 Len=0"
"2.217137","172.19.0.3","5.9.29.183","TCP","56","43520 → 9002 [ACK] Seq=10716 Ack=53792 Win=11879 Len=0"
"2.227873","5.9.29.183","172.19.0.3","TLSv1.2","193","Application Data"
"2.233358","5.9.29.183","172.19.0.3","TCP","1504","[TCP segment of a reassembled PDU]"
"2.233372","172.19.0.3","5.9.29.183","TCP","56","43520 → 9002 [ACK] Seq=10716 Ack=55377 Win=11911 Len=0"
"2.233404","5.9.29.183","172.19.0.3","TCP","1516","9002 → 43520 [PSH, ACK] Seq=55377 Ack=10716 Win=65535 Len=1460 [TCP segment of a reassembled PDU]"
"2.233416","5.9.29.183","172.19.0.3","TLSv1.2","1516","Application Data [TCP segment of a reassembled PDU]"
"2.233423","5.9.29.183","172.19.0.3","TCP","1516","9002 → 43520 [PSH, ACK] Seq=58297 Ack=10716 Win=65535 Len=1460 [TCP segment of a reassembled PDU]"
"2.233516","172.19.0.3","5.9.29.183","TCP","56","43520 → 9002 [ACK] Seq=10716 Ack=59757 Win=11887 Len=0"
"2.233607","5.9.29.183","172.19.0.3","TLSv1.2","1468","Application Data [TCP segment of a reassembled PDU]"
"2.233668","5.9.29.183","172.19.0.3","TCP","1516","9002 → 43520 [PSH, ACK] Seq=61169 Ack=10716 Win=65535 Len=1460 [TCP segment of a reassembled PDU]"
"2.233728","5.9.29.183","172.19.0.3","TCP","1516","9002 → 43520 [PSH, ACK] Seq=62629 Ack=10716 Win=65535 Len=1460 [TCP segment of a reassembled PDU]"
"2.233769","5.9.29.183","172.19.0.3","TLSv1.2","1480","Application Data [TCP segment of a reassembled PDU]"
"2.233807","172.19.0.3","5.9.29.183","TCP","56","43520 → 9002 [ACK] Seq=10716 Ack=65513 Win=11853 Len=0"
"2.239806","5.9.29.183","172.19.0.3","TLSv1.2","1504","Application Data [TCP segment of a reassembled PDU]"
"2.239910","5.9.29.183","172.19.0.3","TCP","1516","9002 → 43520 [PSH, ACK] Seq=66961 Ack=10716 Win=65535 Len=1460 [TCP segment of a reassembled PDU]"
"2.239918","172.19.0.3","5.9.29.183","TCP","56","43520 → 9002 [ACK] Seq=10716 Ack=68421 Win=11903 Len=0"
"2.239920","5.9.29.183","172.19.0.3","TCP","1492","9002 → 43520 [PSH, ACK] Seq=68421 Ack=10716 Win=65535 Len=1436 [TCP segment of a reassembled PDU]"
"2.240036","172.19.0.3","5.9.29.183","TLSv1.2","1113","Application Data"
"2.240207","5.9.29.183","172.19.0.3","TCP","56","9002 → 43520 [ACK] Seq=69857 Ack=11773 Win=65535 Len=0"
"2.243114","5.9.29.183","172.19.0.3","TLSv1.2","207","Application Data"
"2.258172","5.9.29.183","172.19.0.3","TCP","1504","[TCP segment of a reassembled PDU]"
"2.258190","172.19.0.3","5.9.29.183","TCP","56","43520 → 9002 [ACK] Seq=11773 Ack=71456 Win=11911 Len=0"
"2.258233","5.9.29.183","172.19.0.3","TLSv1.2","179","Application Data"
"2.261762","172.19.0.3","5.9.29.183","TLSv1.2","599","Application Data"
"2.262065","5.9.29.183","172.19.0.3","TCP","56","9002 → 43520 [ACK] Seq=71579 Ack=12316 Win=65535 Len=0"
"2.546527","5.9.29.183","172.19.0.3","TLSv1.2","599","Application Data"
"2.547265","172.19.0.3","5.9.29.183","TLSv1.2","599","Application Data"
"2.547694","5.9.29.183","172.19.0.3","TCP","56","9002 → 43520 [ACK] Seq=72122 Ack=12859 Win=65535 Len=0"
"2.925817","5.9.29.183","172.19.0.3","TCP","1516","[TCP segment of a reassembled PDU]"
"2.925888","5.9.29.183","172.19.0.3","TCP","1492","9002 → 43520 [PSH, ACK] Seq=73582 Ack=12859 Win=65535 Len=1436 [TCP segment of a reassembled PDU]"
"2.925898","5.9.29.183","172.19.0.3","TLSv1.2","787","Application Data"
"2.926045","172.19.0.3","5.9.29.183","TCP","56","43520 → 9002 [ACK] Seq=12859 Ack=75749 Win=11895 Len=0"
"2.935692","5.9.29.183","172.19.0.3","TCP","1504","[TCP segment of a reassembled PDU]"
"2.936741","5.9.29.183","172.19.0.3","TCP","1504","9002 → 43520 [PSH, ACK] Seq=77197 Ack=12859 Win=65535 Len=1448 [TCP segment of a reassembled PDU]"
"2.936754","172.19.0.3","5.9.29.183","TCP","56","43520 → 9002 [ACK] Seq=12859 Ack=78645 Win=11911 Len=0"
"2.936816","5.9.29.183","172.19.0.3","TLSv1.2","1516","Application Data [TCP segment of a reassembled PDU]"
"2.936895","5.9.29.183","172.19.0.3","TCP","1516","9002 → 43520 [PSH, ACK] Seq=80105 Ack=12859 Win=65535 Len=1460 [TCP segment of a reassembled PDU]"
"2.936900","5.9.29.183","172.19.0.3","TCP","1516","9002 → 43520 [PSH, ACK] Seq=81565 Ack=12859 Win=65535 Len=1460 [TCP segment of a reassembled PDU]"
"2.936905","5.9.29.183","172.19.0.3","TLSv1.2","1468","Application Data [TCP segment of a reassembled PDU]"
"2.936920","172.19.0.3","5.9.29.183","TCP","56","43520 → 9002 [ACK] Seq=12859 Ack=83025 Win=11887 Len=0"
"2.941360","5.9.29.183","172.19.0.3","TLSv1.2","1221","Application Data"
"2.941371","172.19.0.3","5.9.29.183","TCP","56","43520 → 9002 [ACK] Seq=12859 Ack=85602 Win=11911 Len=0"
"2.951137","5.9.29.183","172.19.0.3","TCP","1516","[TCP segment of a reassembled PDU]"
"2.951184","5.9.29.183","172.19.0.3","TCP","1492","9002 → 43520 [PSH, ACK] Seq=87062 Ack=12859 Win=65535 Len=1436 [TCP segment of a reassembled PDU]"
"2.951297","172.19.0.3","5.9.29.183","TCP","56","43520 → 9002 [ACK] Seq=12859 Ack=88498 Win=11903 Len=0"
"2.951470","5.9.29.183","172.19.0.3","TLSv1.2","1516","Application Data [TCP segment of a reassembled PDU]"
"2.951502","5.9.29.183","172.19.0.3","TCP","1516","9002 → 43520 [PSH, ACK] Seq=89958 Ack=12859 Win=65535 Len=1460 [TCP segment of a reassembled PDU]"
"2.951508","5.9.29.183","172.19.0.3","TCP","1480","9002 → 43520 [PSH, ACK] Seq=91418 Ack=12859 Win=65535 Len=1424 [TCP segment of a reassembled PDU]"
"2.951562","172.19.0.3","5.9.29.183","TCP","56","43520 → 9002 [ACK] Seq=12859 Ack=92842 Win=11893 Len=0"
"2.956645","5.9.29.183","172.19.0.3","TLSv1.2","584","Application Data"
"2.967353","5.9.29.183","172.19.0.3","TCP","1504","[TCP segment of a reassembled PDU]"
"2.967415","172.19.0.3","5.9.29.183","TCP","56","43520 → 9002 [ACK] Seq=12859 Ack=94818 Win=11911 Len=0"
"2.967999","5.9.29.183","172.19.0.3","TCP","1516","9002 → 43520 [PSH, ACK] Seq=94818 Ack=12859 Win=65535 Len=1460 [TCP segment of a reassembled PDU]"
"2.968221","5.9.29.183","172.19.0.3","TLSv1.2","1516","Application Data [TCP segment of a reassembled PDU]"
"2.968234","5.9.29.183","172.19.0.3","TCP","1516","9002 → 43520 [PSH, ACK] Seq=97738 Ack=12859 Win=65535 Len=1460 [TCP segment of a reassembled PDU]"
"2.968525","172.19.0.3","5.9.29.183","TCP","56","43520 → 9002 [ACK] Seq=12859 Ack=99198 Win=11895 Len=0"
"2.968687","5.9.29.183","172.19.0.3","TLSv1.2","1468","Application Data [TCP segment of a reassembled PDU]"
"2.968698","5.9.29.183","172.19.0.3","TCP","1516","9002 → 43520 [PSH, ACK] Seq=100610 Ack=12859 Win=65535 Len=1460 [TCP segment of a reassembled PDU]"
"2.968705","5.9.29.183","172.19.0.3","TCP","1492","9002 → 43520 [PSH, ACK] Seq=102070 Ack=12859 Win=65535 Len=1436 [TCP segment of a reassembled PDU]"
"2.968834","172.19.0.3","5.9.29.183","TCP","56","43520 → 9002 [ACK] Seq=12859 Ack=103506 Win=11871 Len=0"
"2.969037","172.19.0.3","5.9.29.183","TLSv1.2","599","Application Data"
"2.969427","5.9.29.183","172.19.0.3","TCP","56","9002 → 43520 [ACK] Seq=103506 Ack=13402 Win=65535 Len=0"
"2.970901","5.9.29.183","172.19.0.3","TLSv1.2","1504","Application Data, Application Data"
"2.970979","5.9.29.183","172.19.0.3","TCP","1504","9002 → 43520 [PSH, ACK] Seq=104954 Ack=13402 Win=65535 Len=1448 [TCP segment of a reassembled PDU]"
"2.970997","172.19.0.3","5.9.29.183","TCP","56","43520 → 9002 [ACK] Seq=13402 Ack=106402 Win=11903 Len=0"
"2.971068","5.9.29.183","172.19.0.3","TCP","1254","9002 → 43520 [PSH, ACK] Seq=106402 Ack=13402 Win=65535 Len=1198 [TCP segment of a reassembled PDU]"
"2.971075","5.9.29.183","172.19.0.3","TCP","306","9002 → 43520 [PSH, ACK] Seq=107600 Ack=13402 Win=65535 Len=250 [TCP segment of a reassembled PDU]"
"2.971221","172.19.0.3","5.9.29.183","TCP","56","43520 → 9002 [ACK] Seq=13402 Ack=107850 Win=11911 Len=0"
"2.971502","5.9.29.183","172.19.0.3","TLSv1.2","656","Application Data, Application Data"
"2.981369","5.9.29.183","172.19.0.3","TCP","1504","[TCP segment of a reassembled PDU]"
"2.981387","172.19.0.3","5.9.29.183","TCP","56","43520 → 9002 [ACK] Seq=13402 Ack=109898 Win=11911 Len=0"
"2.981719","5.9.29.183","172.19.0.3","TCP","1516","9002 → 43520 [PSH, ACK] Seq=109898 Ack=13402 Win=65535 Len=1460 [TCP segment of a reassembled PDU]"
"2.981729","5.9.29.183","172.19.0.3","TLSv1.2","1516","Application Data [TCP segment of a reassembled PDU]"
"2.981736","5.9.29.183","172.19.0.3","TLSv1.2","1480","Application Data [TCP segment of a reassembled PDU]"
"2.981825","172.19.0.3","5.9.29.183","TCP","56","43520 → 9002 [ACK] Seq=13402 Ack=114242 Win=11895 Len=0"
"2.981835","5.9.29.183","172.19.0.3","TCP","1516","9002 → 43520 [PSH, ACK] Seq=114242 Ack=13402 Win=65535 Len=1460 [TCP segment of a reassembled PDU]"
"2.981839","5.9.29.183","172.19.0.3","TCP","1516","9002 → 43520 [PSH, ACK] Seq=115702 Ack=13402 Win=65535 Len=1460 [TCP segment of a reassembled PDU]"
"2.981840","5.9.29.183","172.19.0.3","TLSv1.2","1516","Application Data [TCP segment of a reassembled PDU]"
"2.981847","5.9.29.183","172.19.0.3","TLSv1.2","1468","Application Data [TCP segment of a reassembled PDU]"
"2.981911","5.9.29.183","172.19.0.3","TCP","1516","9002 → 43520 [PSH, ACK] Seq=120034 Ack=13402 Win=65535 Len=1460 [TCP segment of a reassembled PDU]"
"2.981917","5.9.29.183","172.19.0.3","TCP","1516","9002 → 43520 [PSH, ACK] Seq=121494 Ack=13402 Win=65535 Len=1460 [TCP segment of a reassembled PDU]"
"2.981954","5.9.29.183","172.19.0.3","TLSv1.2","1480","Application Data [TCP segment of a reassembled PDU]"
"2.981990","172.19.0.3","5.9.29.183","TCP","56","43520 → 9002 [ACK] Seq=13402 Ack=124378 Win=11836 Len=0"
"2.982387","172.19.0.3","5.9.29.183","TLSv1.2","599","Application Data"
"2.982569","5.9.29.183","172.19.0.3","TCP","56","9002 → 43520 [ACK] Seq=124378 Ack=13945 Win=65535 Len=0"
"2.987157","5.9.29.183","172.19.0.3","TLSv1.2","750","Application Data"
"2.992069","172.19.0.3","5.9.29.183","TLSv1.2","1627","Application Data"
"2.992374","5.9.29.183","172.19.0.3","TCP","56","9002 → 43520 [ACK] Seq=125072 Ack=15516 Win=65535 Len=0"
"3.004433","5.9.29.183","172.19.0.3","TLSv1.2","599","Application Data"
"3.046937","172.19.0.3","5.9.29.183","TCP","56","43520 → 9002 [ACK] Seq=15516 Ack=125615 Win=11911 Len=0"
"3.265062","5.9.29.183","172.19.0.3","TLSv1.2","599","Application Data"
"3.265140","172.19.0.3","5.9.29.183","TCP","56","43520 → 9002 [ACK] Seq=15516 Ack=126158 Win=11911 Len=0"
"3.266276","172.19.0.3","5.9.29.183","TLSv1.2","599","Application Data"
"3.266557","5.9.29.183","172.19.0.3","TCP","56","9002 → 43520 [ACK] Seq=126158 Ack=16059 Win=65535 Len=0"
"3.545995","5.9.29.183","172.19.0.3","TCP","1516","[TCP segment of a reassembled PDU]"
"3.546082","5.9.29.183","172.19.0.3","TCP","1492","9002 → 43520 [PSH, ACK] Seq=127618 Ack=16059 Win=65535 Len=1436 [TCP segment of a reassembled PDU]"
"3.546198","5.9.29.183","172.19.0.3","TLSv1.2","1516","Application Data [TCP segment of a reassembled PDU]"
"3.546204","5.9.29.183","172.19.0.3","TCP","1225","9002 → 43520 [PSH, ACK] Seq=130514 Ack=16059 Win=65535 Len=1169 [TCP segment of a reassembled PDU]"
"3.546211","172.19.0.3","5.9.29.183","TCP","56","43520 → 9002 [ACK] Seq=16059 Ack=129054 Win=11903 Len=0"
"3.546258","5.9.29.183","172.19.0.3","TCP","1504","9002 → 43520 [PSH, ACK] Seq=131683 Ack=16059 Win=65535 Len=1448 [TCP segment of a reassembled PDU]"
"3.546288","172.19.0.3","5.9.29.183","TCP","56","43520 → 9002 [ACK] Seq=16059 Ack=133131 Win=11879 Len=0"
"3.561881","5.9.29.183","172.19.0.3","TLSv1.2","880","Application Data, Application Data"
"3.565854","5.9.29.183","172.19.0.3","TCP","1504","[TCP segment of a reassembled PDU]"
"3.565868","172.19.0.3","5.9.29.183","TCP","56","43520 → 9002 [ACK] Seq=16059 Ack=135403 Win=11911 Len=0"
"3.566151","5.9.29.183","172.19.0.3","TCP","1504","9002 → 43520 [PSH, ACK] Seq=135403 Ack=16059 Win=65535 Len=1448 [TCP segment of a reassembled PDU]"
"3.577015","5.9.29.183","172.19.0.3","TLSv1.2","1330","Application Data, Application Data"
"3.577032","172.19.0.3","5.9.29.183","TCP","56","43520 → 9002 [ACK] Seq=16059 Ack=138125 Win=11911 Len=0"
"3.580961","5.9.29.183","172.19.0.3","TCP","1504","[TCP segment of a reassembled PDU]"
"3.581005","5.9.29.183","172.19.0.3","TCP","1504","9002 → 43520 [PSH, ACK] Seq=139573 Ack=16059 Win=65535 Len=1448 [TCP segment of a reassembled PDU]"
"3.581151","172.19.0.3","5.9.29.183","TCP","56","43520 → 9002 [ACK] Seq=16059 Ack=141021 Win=11903 Len=0"
"3.589128","5.9.29.183","172.19.0.3","TLSv1.2","1504","Application Data, Application Data"
"3.589181","5.9.29.183","172.19.0.3","TCP","1516","9002 → 43520 [PSH, ACK] Seq=142469 Ack=16059 Win=65535 Len=1460 [TCP segment of a reassembled PDU]"
"3.589193","172.19.0.3","5.9.29.183","TCP","56","43520 → 9002 [ACK] Seq=16059 Ack=143929 Win=11903 Len=0"
"3.589393","5.9.29.183","172.19.0.3","TCP","1516","9002 → 43520 [PSH, ACK] Seq=143929 Ack=16059 Win=65535 Len=1460 [TCP segment of a reassembled PDU]"
"3.589398","5.9.29.183","172.19.0.3","TLSv1.2","1516","Application Data [TCP segment of a reassembled PDU]"
"3.589400","5.9.29.183","172.19.0.3","TCP","1516","9002 → 43520 [PSH, ACK] Seq=146849 Ack=16059 Win=65535 Len=1460 [TCP segment of a reassembled PDU]"
"3.589402","5.9.29.183","172.19.0.3","TCP","1456","9002 → 43520 [PSH, ACK] Seq=148309 Ack=16059 Win=65535 Len=1400 [TCP segment of a reassembled PDU]"
"3.589454","172.19.0.3","5.9.29.183","TCP","56","43520 → 9002 [ACK] Seq=16059 Ack=149709 Win=11869 Len=0"
"3.592745","5.9.29.183","172.19.0.3","TLSv1.2","1516","Application Data [TCP segment of a reassembled PDU]"
"3.592797","5.9.29.183","172.19.0.3","TCP","1492","9002 → 43520 [PSH, ACK] Seq=151169 Ack=16059 Win=65535 Len=1436 [TCP segment of a reassembled PDU]"
"3.592813","172.19.0.3","5.9.29.183","TCP","56","43520 → 9002 [ACK] Seq=16059 Ack=152605 Win=11903 Len=0"
"3.602895","5.9.29.183","172.19.0.3","TCP","1504","9002 → 43520 [PSH, ACK] Seq=152605 Ack=16059 Win=65535 Len=1448 [TCP segment of a reassembled PDU]"
"3.604810","5.9.29.183","172.19.0.3","TLSv1.2","1504","Application Data [TCP segment of a reassembled PDU]"
"3.604829","172.19.0.3","5.9.29.183","TCP","56","43520 → 9002 [ACK] Seq=16059 Ack=155501 Win=11911 Len=0"
"3.605139","172.19.0.3","5.9.29.183","TLSv1.2","599","Application Data"
"3.605287","5.9.29.183","172.19.0.3","TCP","1516","9002 → 43520 [PSH, ACK] Seq=155501 Ack=16059 Win=65535 Len=1460 [TCP segment of a reassembled PDU]"
"3.605328","5.9.29.183","172.19.0.3","TLSv1.2","1492","Application Data [TCP segment of a reassembled PDU]"
"3.605369","5.9.29.183","172.19.0.3","TCP","1516","9002 → 43520 [PSH, ACK] Seq=158397 Ack=16059 Win=65535 Len=1460 [TCP segment of a reassembled PDU]"
"3.605385","172.19.0.3","5.9.29.183","TCP","56","43520 → 9002 [ACK] Seq=16602 Ack=158397 Win=11903 Len=0"
"3.605393","5.9.29.183","172.19.0.3","TCP","1516","9002 → 43520 [PSH, ACK] Seq=159857 Ack=16059 Win=65535 Len=1460 [TCP segment of a reassembled PDU]"
"3.605410","5.9.29.183","172.19.0.3","TLSv1.2","1480","Application Data, Application Data"
"3.605543","5.9.29.183","172.19.0.3","TCP","56","9002 → 43520 [ACK] Seq=162741 Ack=16602 Win=65535 Len=0"
"3.605553","5.9.29.183","172.19.0.3","TCP","1516","9002 → 43520 [PSH, ACK] Seq=162741 Ack=16602 Win=65535 Len=1460 [TCP segment of a reassembled PDU]"
"3.605577","172.19.0.3","5.9.29.183","TCP","56","43520 → 9002 [ACK] Seq=16602 Ack=164201 Win=11871 Len=0"
"3.605658","5.9.29.183","172.19.0.3","TCP","1516","9002 → 43520 [PSH, ACK] Seq=164201 Ack=16602 Win=65535 Len=1460 [TCP segment of a reassembled PDU]"
"3.605667","5.9.29.183","172.19.0.3","TLSv1.2","1516","Application Data [TCP segment of a reassembled PDU]"
"3.605686","5.9.29.183","172.19.0.3","TLSv1.2","1162","Application Data"
"3.605865","172.19.0.3","5.9.29.183","TCP","56","43520 → 9002 [ACK] Seq=16602 Ack=168227 Win=11847 Len=0"
"3.615172","172.19.0.3","5.9.29.183","TLSv1.2","599","Application Data"
"3.615496","5.9.29.183","172.19.0.3","TCP","56","9002 → 43520 [ACK] Seq=168227 Ack=17145 Win=65535 Len=0"
"3.905270","5.9.29.183","172.19.0.3","TLSv1.2","599","Application Data"
"3.906115","172.19.0.3","5.9.29.183","TLSv1.2","599","Application Data"
"3.906400","5.9.29.183","172.19.0.3","TCP","56","9002 → 43520 [ACK] Seq=168770 Ack=17688 Win=65535 Len=0"
"4.196333","5.9.29.183","172.19.0.3","TCP","1516","[TCP segment of a reassembled PDU]"
"4.196433","5.9.29.183","172.19.0.3","TCP","1492","9002 → 43520 [PSH, ACK] Seq=170230 Ack=17688 Win=65535 Len=1436 [TCP segment of a reassembled PDU]"
"4.196447","5.9.29.183","172.19.0.3","TLSv1.2","787","Application Data"
"4.196566","172.19.0.3","5.9.29.183","TCP","56","43520 → 9002 [ACK] Seq=17688 Ack=172397 Win=11895 Len=0"
"4.197056","172.19.0.3","5.9.29.183","TLSv1.2","599","Application Data"
"4.197252","5.9.29.183","172.19.0.3","TCP","56","9002 → 43520 [ACK] Seq=172397 Ack=18231 Win=65535 Len=0"
"4.208134","5.9.29.183","172.19.0.3","TCP","795","[TCP segment of a reassembled PDU]"
"4.208180","5.9.29.183","172.19.0.3","TCP","1516","9002 → 43520 [PSH, ACK] Seq=173136 Ack=18231 Win=65535 Len=1460 [TCP segment of a reassembled PDU]"
"4.208186","5.9.29.183","172.19.0.3","TCP","753","9002 → 43520 [PSH, ACK] Seq=174596 Ack=18231 Win=65535 Len=697 [TCP segment of a reassembled PDU]"
"4.208274","172.19.0.3","5.9.29.183","TCP","56","43520 → 9002 [ACK] Seq=18231 Ack=175293 Win=11895 Len=0"
"4.208565","5.9.29.183","172.19.0.3","TLSv1.2","1516","Application Data [TCP segment of a reassembled PDU]"
"4.208633","5.9.29.183","172.19.0.3","TLSv1.2","1516","Application Data [TCP segment of a reassembled PDU]"
"4.208645","172.19.0.3","5.9.29.183","TCP","56","43520 → 9002 [ACK] Seq=18231 Ack=178213 Win=11901 Len=0"
"4.208647","5.9.29.183","172.19.0.3","TCP","1480","9002 → 43520 [PSH, ACK] Seq=178213 Ack=18231 Win=65535 Len=1424 [TCP segment of a reassembled PDU]"
"4.208693","5.9.29.183","172.19.0.3","TCP","1504","9002 → 43520 [PSH, ACK] Seq=179637 Ack=18231 Win=65535 Len=1448 [TCP segment of a reassembled PDU]"
"4.208793","172.19.0.3","5.9.29.183","TCP","56","43520 → 9002 [ACK] Seq=18231 Ack=181085 Win=11885 Len=0"
"4.211647","5.9.29.183","172.19.0.3","TLSv1.2","1504","Application Data [TCP segment of a reassembled PDU]"
"4.211787","5.9.29.183","172.19.0.3","TLSv1.2","1344","Application Data"
"4.211801","172.19.0.3","5.9.29.183","TCP","56","43520 → 9002 [ACK] Seq=18231 Ack=183821 Win=11903 Len=0"
"4.226384","5.9.29.183","172.19.0.3","TCP","1516","[TCP segment of a reassembled PDU]"
"4.226458","5.9.29.183","172.19.0.3","TCP","1492","9002 → 43520 [PSH, ACK] Seq=185281 Ack=18231 Win=65535 Len=1436 [TCP segment of a reassembled PDU]"
"4.226482","172.19.0.3","5.9.29.183","TCP","56","43520 → 9002 [ACK] Seq=18231 Ack=186717 Win=11903 Len=0"
"4.227098","5.9.29.183","172.19.0.3","TLSv1.2","1516","Application Data [TCP segment of a reassembled PDU]"
"4.227152","5.9.29.183","172.19.0.3","TCP","1516","9002 → 43520 [PSH, ACK] Seq=188177 Ack=18231 Win=65535 Len=1460 [TCP segment of a reassembled PDU]"
"4.227170","172.19.0.3","5.9.29.183","TCP","56","43520 → 9002 [ACK] Seq=18231 Ack=189637 Win=11903 Len=0"
"4.227416","5.9.29.183","172.19.0.3","TCP","1516","9002 → 43520 [PSH, ACK] Seq=189637 Ack=18231 Win=65535 Len=1460 [TCP segment of a reassembled PDU]"
"4.227426","5.9.29.183","172.19.0.3","TLSv1.2","1516","Application Data [TCP segment of a reassembled PDU]"
"4.227431","5.9.29.183","172.19.0.3","TCP","1456","9002 → 43520 [PSH, ACK] Seq=192557 Ack=18231 Win=65535 Len=1400 [TCP segment of a reassembled PDU]"
"4.227436","5.9.29.183","172.19.0.3","TLSv1.2","287","Application Data"
"4.227479","172.19.0.3","5.9.29.183","TCP","56","43520 → 9002 [ACK] Seq=18231 Ack=194188 Win=11871 Len=0"
"4.231701","5.9.29.183","172.19.0.3","TCP","1504","[TCP segment of a reassembled PDU]"
"4.242214","5.9.29.183","172.19.0.3","TLSv1.2","1207","Application Data"
"4.242245","172.19.0.3","5.9.29.183","TCP","56","43520 → 9002 [ACK] Seq=18231 Ack=196787 Win=11911 Len=0"
"4.242564","172.19.0.3","5.9.29.183","TLSv1.2","599","Application Data"
"4.242747","5.9.29.183","172.19.0.3","TCP","56","9002 → 43520 [ACK] Seq=196787 Ack=18774 Win=65535 Len=0"
"4.242797","5.9.29.183","172.19.0.3","TCP","1504","[TCP segment of a reassembled PDU]"
"4.242860","5.9.29.183","172.19.0.3","TCP","1504","9002 → 43520 [PSH, ACK] Seq=198235 Ack=18774 Win=65535 Len=1448 [TCP segment of a reassembled PDU]"
"4.242891","172.19.0.3","5.9.29.183","TCP","56","43520 → 9002 [ACK] Seq=18774 Ack=199683 Win=11903 Len=0"
"4.242950","5.9.29.183","172.19.0.3","TLSv1.2","1516","Application Data [TCP segment of a reassembled PDU]"
"4.242955","5.9.29.183","172.19.0.3","TCP","1492","9002 → 43520 [PSH, ACK] Seq=201143 Ack=18774 Win=65535 Len=1436 [TCP segment of a reassembled PDU]"
"4.242961","172.19.0.3","5.9.29.183","TCP","56","43520 → 9002 [ACK] Seq=18774 Ack=202579 Win=11903 Len=0"
"4.243138","5.9.29.183","172.19.0.3","TCP","1516","9002 → 43520 [PSH, ACK] Seq=202579 Ack=18774 Win=65535 Len=1460 [TCP segment of a reassembled PDU]"
"4.243168","5.9.29.183","172.19.0.3","TLSv1.2","1492","Application Data, Application Data"
"4.243219","172.19.0.3","5.9.29.183","TCP","56","43520 → 9002 [ACK] Seq=18774 Ack=205475 Win=11901 Len=0"
"4.243828","5.9.29.183","172.19.0.3","TCP","1516","9002 → 43520 [PSH, ACK] Seq=205475 Ack=18774 Win=65535 Len=1460 [TCP segment of a reassembled PDU]"
"4.243859","5.9.29.183","172.19.0.3","TCP","1492","9002 → 43520 [PSH, ACK] Seq=206935 Ack=18774 Win=65535 Len=1436 [TCP segment of a reassembled PDU]"
"4.243867","172.19.0.3","5.9.29.183","TCP","56","43520 → 9002 [ACK] Seq=18774 Ack=208371 Win=11903 Len=0"
"4.249327","5.9.29.183","172.19.0.3","TLSv1.2","1504","Application Data, Application Data"
"4.249374","5.9.29.183","172.19.0.3","TCP","1516","9002 → 43520 [PSH, ACK] Seq=209819 Ack=18774 Win=65535 Len=1460 [TCP segment of a reassembled PDU]"
"4.249387","172.19.0.3","5.9.29.183","TCP","56","43520 → 9002 [ACK] Seq=18774 Ack=211279 Win=11903 Len=0"
"4.249389","5.9.29.183","172.19.0.3","TCP","1492","9002 → 43520 [PSH, ACK] Seq=211279 Ack=18774 Win=65535 Len=1436 [TCP segment of a reassembled PDU]"
"4.258192","5.9.29.183","172.19.0.3","TLSv1.2","236","Application Data"
"4.258209","172.19.0.3","5.9.29.183","TCP","56","43520 → 9002 [ACK] Seq=18774 Ack=212895 Win=11911 Len=0"
"4.259416","5.9.29.183","172.19.0.3","TCP","1504","[TCP segment of a reassembled PDU]"
"4.259918","5.9.29.183","172.19.0.3","TCP","1516","9002 → 43520 [PSH, ACK] Seq=214343 Ack=18774 Win=65535 Len=1460 [TCP segment of a reassembled PDU]"
"4.259924","172.19.0.3","5.9.29.183","TCP","56","43520 → 9002 [ACK] Seq=18774 Ack=215803 Win=11911 Len=0"
"4.259976","5.9.29.183","172.19.0.3","TLSv1.2","1516","Application Data [TCP segment of a reassembled PDU]"
"4.259982","5.9.29.183","172.19.0.3","TLSv1.2","1516","Application Data [TCP segment of a reassembled PDU]"
"4.260015","172.19.0.3","5.9.29.183","TCP","56","43520 → 9002 [ACK] Seq=18774 Ack=218723 Win=11895 Len=0"
"4.260017","5.9.29.183","172.19.0.3","TCP","1468","9002 → 43520 [PSH, ACK] Seq=218723 Ack=18774 Win=65535 Len=1412 [TCP segment of a reassembled PDU]"
"4.260245","5.9.29.183","172.19.0.3","TCP","1504","9002 → 43520 [PSH, ACK] Seq=220135 Ack=18774 Win=65535 Len=1448 [TCP segment of a reassembled PDU]"
"4.260252","172.19.0.3","5.9.29.183","TCP","56","43520 → 9002 [ACK] Seq=18774 Ack=221583 Win=11911 Len=0"
"4.265748","5.9.29.183","172.19.0.3","TLSv1.2","1516","Application Data, Application Data"
"4.265801","5.9.29.183","172.19.0.3","TCP","1492","9002 → 43520 [PSH, ACK] Seq=223043 Ack=18774 Win=65535 Len=1436 [TCP segment of a reassembled PDU]"
"4.265936","172.19.0.3","5.9.29.183","TCP","56","43520 → 9002 [ACK] Seq=18774 Ack=224479 Win=11903 Len=0"
"4.266286","172.19.0.3","5.9.29.183","TLSv1.2","599","Application Data"
"4.266608","5.9.29.183","172.19.0.3","TCP","56","9002 → 43520 [ACK] Seq=224479 Ack=19317 Win=65535 Len=0"
"4.273407","5.9.29.183","172.19.0.3","TLSv1.2","953","Application Data"
"4.275270","172.19.0.3","5.9.29.183","TLSv1.2","599","Application Data"
"4.275624","5.9.29.183","172.19.0.3","TCP","56","9002 → 43520 [ACK] Seq=225376 Ack=19860 Win=65535 Len=0"
"4.285476","172.19.0.3","5.9.29.183","TLSv1.2","599","Application Data"
"4.285688","5.9.29.183","172.19.0.3","TCP","56","9002 → 43520 [ACK] Seq=225376 Ack=20403 Win=65535 Len=0"
"4.527229","5.9.29.183","172.19.0.3","TLSv1.2","599","Application Data"
"4.528036","172.19.0.3","5.9.29.183","TLSv1.2","599","Application Data"
"4.528326","5.9.29.183","172.19.0.3","TCP","56","9002 → 43520 [ACK] Seq=225919 Ack=20946 Win=65535 Len=0"
"4.766645","5.9.29.183","172.19.0.3","TCP","1516","[TCP segment of a reassembled PDU]"
"4.766714","5.9.29.183","172.19.0.3","TCP","1492","9002 → 43520 [PSH, ACK] Seq=227379 Ack=20946 Win=65535 Len=1436 [TCP segment of a reassembled PDU]"
"4.766840","172.19.0.3","5.9.29.183","TCP","56","43520 → 9002 [ACK] Seq=20946 Ack=228815 Win=11903 Len=0"
"4.766891","5.9.29.183","172.19.0.3","TLSv1.2","1516","Application Data [TCP segment of a reassembled PDU]"
"4.766947","5.9.29.183","172.19.0.3","TCP","1225","9002 → 43520 [PSH, ACK] Seq=230275 Ack=20946 Win=65535 Len=1169 [TCP segment of a reassembled PDU]"
"4.766972","172.19.0.3","5.9.29.183","TCP","56","43520 → 9002 [ACK] Seq=20946 Ack=231444 Win=11903 Len=0"
"4.767014","5.9.29.183","172.19.0.3","TCP","1504","9002 → 43520 [PSH, ACK] Seq=231444 Ack=20946 Win=65535 Len=1448 [TCP segment of a reassembled PDU]"
"4.782244","5.9.29.183","172.19.0.3","TLSv1.2","337","Application Data"
"4.782261","172.19.0.3","5.9.29.183","TCP","56","43520 → 9002 [ACK] Seq=20946 Ack=233173 Win=11909 Len=0"
"4.797461","5.9.29.183","172.19.0.3","TLSv1.2","1113","Application Data"
"4.802940","5.9.29.183","172.19.0.3","TCP","1504","[TCP segment of a reassembled PDU]"
"4.802967","172.19.0.3","5.9.29.183","TCP","56","43520 → 9002 [ACK] Seq=20946 Ack=235678 Win=11911 Len=0"
"4.803105","5.9.29.183","172.19.0.3","TCP","1504","9002 → 43520 [PSH, ACK] Seq=235678 Ack=20946 Win=65535 Len=1448 [TCP segment of a reassembled PDU]"
"4.812546","5.9.29.183","172.19.0.3","TLSv1.2","787","Application Data"
"4.812564","172.19.0.3","5.9.29.183","TCP","56","43520 → 9002 [ACK] Seq=20946 Ack=237857 Win=11911 Len=0"
"4.818838","5.9.29.183","172.19.0.3","TCP","871","[TCP segment of a reassembled PDU]"
"4.818900","5.9.29.183","172.19.0.3","TCP","1516","9002 → 43520 [PSH, ACK] Seq=238672 Ack=20946 Win=65535 Len=1460 [TCP segment of a reassembled PDU]"
"4.818907","5.9.29.183","172.19.0.3","TCP","677","9002 → 43520 [PSH, ACK] Seq=240132 Ack=20946 Win=65535 Len=621 [TCP segment of a reassembled PDU]"
"4.819054","172.19.0.3","5.9.29.183","TCP","56","43520 → 9002 [ACK] Seq=20946 Ack=240753 Win=11895 Len=0"
"4.827843","5.9.29.183","172.19.0.3","TLSv1.2","787","Application Data"
"4.871651","172.19.0.3","5.9.29.183","TCP","56","43520 → 9002 [ACK] Seq=20946 Ack=241484 Win=11911 Len=0"
"4.899479","5.9.29.183","172.19.0.3","TCP","1504","[TCP segment of a reassembled PDU]"
"4.899496","172.19.0.3","5.9.29.183","TCP","56","43520 → 9002 [ACK] Seq=20946 Ack=242932 Win=11911 Len=0"
"4.900577","5.9.29.183","172.19.0.3","TCP","1504","9002 → 43520 [PSH, ACK] Seq=242932 Ack=20946 Win=65535 Len=1448 [TCP segment of a reassembled PDU]"
"4.900584","172.19.0.3","5.9.29.183","TCP","56","43520 → 9002 [ACK] Seq=20946 Ack=244380 Win=11911 Len=0"
"4.900611","5.9.29.183","172.19.0.3","TLSv1.2","787","Application Data"
"4.900621","172.19.0.3","5.9.29.183","TCP","56","43520 → 9002 [ACK] Seq=20946 Ack=245111 Win=11906 Len=0"
"4.914962","5.9.29.183","172.19.0.3","TCP","1504","[TCP segment of a reassembled PDU]"
"4.914981","172.19.0.3","5.9.29.183","TCP","56","43520 → 9002 [ACK] Seq=20946 Ack=246559 Win=11911 Len=0"
"4.915019","5.9.29.183","172.19.0.3","TCP","1504","9002 → 43520 [PSH, ACK] Seq=246559 Ack=20946 Win=65535 Len=1448 [TCP segment of a reassembled PDU]"
"4.915028","172.19.0.3","5.9.29.183","TCP","56","43520 → 9002 [ACK] Seq=20946 Ack=248007 Win=11903 Len=0"
"4.916009","5.9.29.183","172.19.0.3","TLSv1.2","1330","Application Data, Application Data"
"4.916019","172.19.0.3","5.9.29.183","TCP","56","43520 → 9002 [ACK] Seq=20946 Ack=249281 Win=11911 Len=0"
"4.943117","5.9.29.183","172.19.0.3","TCP","1516","[TCP segment of a reassembled PDU]"
"4.943133","172.19.0.3","5.9.29.183","TCP","56","43520 → 9002 [ACK] Seq=20946 Ack=250741 Win=11911 Len=0"
"4.943164","5.9.29.183","172.19.0.3","TCP","1492","9002 → 43520 [PSH, ACK] Seq=250741 Ack=20946 Win=65535 Len=1436 [TCP segment of a reassembled PDU]"
"4.943172","172.19.0.3","5.9.29.183","TCP","56","43520 → 9002 [ACK] Seq=20946 Ack=252177 Win=11903 Len=0"
"4.943409","5.9.29.183","172.19.0.3","TLSv1.2","1237","Application Data"
"4.943416","172.19.0.3","5.9.29.183","TCP","56","43520 → 9002 [ACK] Seq=20946 Ack=253358 Win=11911 Len=0"
"4.943683","172.19.0.3","5.9.29.183","TLSv1.2","599","Application Data"
"4.943883","5.9.29.183","172.19.0.3","TCP","56","9002 → 43520 [ACK] Seq=253358 Ack=21489 Win=65535 Len=0"
"4.959080","5.9.29.183","172.19.0.3","TLSv1.2","663","Application Data"
"4.978423","5.9.29.183","172.19.0.3","TCP","1504","[TCP segment of a reassembled PDU]"
"4.978443","172.19.0.3","5.9.29.183","TCP","56","43520 → 9002 [ACK] Seq=21489 Ack=255413 Win=11911 Len=0"
"4.978493","5.9.29.183","172.19.0.3","TCP","1516","9002 → 43520 [PSH, ACK] Seq=255413 Ack=21489 Win=65535 Len=1460 [TCP segment of a reassembled PDU]"
"4.978506","5.9.29.183","172.19.0.3","TLSv1.2","1225","Application Data"
"4.978636","172.19.0.3","5.9.29.183","TCP","56","43520 → 9002 [ACK] Seq=21489 Ack=258042 Win=11893 Len=0"
"4.993334","5.9.29.183","172.19.0.3","TLSv1.2","149","Application Data"
"5.007704","5.9.29.183","172.19.0.3","TCP","1504","[TCP segment of a reassembled PDU]"
"5.007721","172.19.0.3","5.9.29.183","TCP","56","43520 → 9002 [ACK] Seq=21489 Ack=259583 Win=11911 Len=0"
"5.007751","5.9.29.183","172.19.0.3","TCP","1504","9002 → 43520 [PSH, ACK] Seq=259583 Ack=21489 Win=65535 Len=1448 [TCP segment of a reassembled PDU]"
"5.008342","5.9.29.183","172.19.0.3","TLSv1.2","787","Application Data"
"5.008348","172.19.0.3","5.9.29.183","TCP","56","43520 → 9002 [ACK] Seq=21489 Ack=261762 Win=11911 Len=0"
"5.023741","5.9.29.183","172.19.0.3","TCP","1516","[TCP segment of a reassembled PDU]"
"5.023786","5.9.29.183","172.19.0.3","TCP","1492","9002 → 43520 [PSH, ACK] Seq=263222 Ack=21489 Win=65535 Len=1436 [TCP segment of a reassembled PDU]"
"5.023801","5.9.29.183","172.19.0.3","TLSv1.2","1330","Application Data, Application Data"
"5.023893","172.19.0.3","5.9.29.183","TCP","56","43520 → 9002 [ACK] Seq=21489 Ack=265932 Win=11895 Len=0"
"5.038085","5.9.29.183","172.19.0.3","TCP","1504","[TCP segment of a reassembled PDU]"
"5.038225","5.9.29.183","172.19.0.3","TCP","1504","9002 → 43520 [PSH, ACK] Seq=267380 Ack=21489 Win=65535 Len=1448 [TCP segment of a reassembled PDU]"
"5.038237","172.19.0.3","5.9.29.183","TCP","56","43520 → 9002 [ACK] Seq=21489 Ack=268828 Win=11903 Len=0"
"5.039110","5.9.29.183","172.19.0.3","TLSv1.2","787","Application Data"
"5.042411","172.19.0.3","5.9.29.183","TLSv1.2","599","Application Data"
"5.042614","5.9.29.183","172.19.0.3","TCP","56","9002 → 43520 [ACK] Seq=269559 Ack=22032 Win=65535 Len=0"
"5.249107","5.9.29.183","172.19.0.3","TLSv1.2","599","Application Data"
"5.249722","172.19.0.3","5.9.29.183","TLSv1.2","599","Application Data"
"5.249906","5.9.29.183","172.19.0.3","TCP","56","9002 → 43520 [ACK] Seq=270102 Ack=22575 Win=65535 Len=0"
"5.539985","5.9.29.183","172.19.0.3","TCP","1516","[TCP segment of a reassembled PDU]"
"5.540059","5.9.29.183","172.19.0.3","TCP","1492","9002 → 43520 [PSH, ACK] Seq=271562 Ack=22575 Win=65535 Len=1436 [TCP segment of a reassembled PDU]"
"5.540182","172.19.0.3","5.9.29.183","TCP","56","43520 → 9002 [ACK] Seq=22575 Ack=272998 Win=11903 Len=0"
"5.540339","5.9.29.183","172.19.0.3","TLSv1.2","1237","Application Data"
"5.544893","5.9.29.183","172.19.0.3","TLSv1.2","1504","Application Data"
"5.544905","172.19.0.3","5.9.29.183","TCP","56","43520 → 9002 [ACK] Seq=22575 Ack=275627 Win=11911 Len=0"
"5.545377","5.9.29.183","172.19.0.3","TCP","1504","9002 → 43520 [PSH, ACK] Seq=275627 Ack=22575 Win=65535 Len=1448 [TCP segment of a reassembled PDU]"
"5.556366","5.9.29.183","172.19.0.3","TLSv1.2","880","Application Data"
"5.556389","172.19.0.3","5.9.29.183","TCP","56","43520 → 9002 [ACK] Seq=22575 Ack=277899 Win=11911 Len=0"
"5.556857","172.19.0.3","5.9.29.183","TLSv1.2","599","Application Data"
"5.557145","5.9.29.183","172.19.0.3","TCP","56","9002 → 43520 [ACK] Seq=277899 Ack=23118 Win=65535 Len=0"
"5.560176","5.9.29.183","172.19.0.3","TCP","1516","[TCP segment of a reassembled PDU]"
"5.560242","5.9.29.183","172.19.0.3","TCP","1492","9002 → 43520 [PSH, ACK] Seq=279359 Ack=23118 Win=65535 Len=1436 [TCP segment of a reassembled PDU]"
"5.560428","172.19.0.3","5.9.29.183","TCP","56","43520 → 9002 [ACK] Seq=23118 Ack=280795 Win=11903 Len=0"
"5.571406","5.9.29.183","172.19.0.3","TLSv1.2","1516","Application Data, Application Data"
"5.571477","5.9.29.183","172.19.0.3","TCP","1492","9002 → 43520 [PSH, ACK] Seq=282255 Ack=23118 Win=65535 Len=1436 [TCP segment of a reassembled PDU]"
"5.571609","172.19.0.3","5.9.29.183","TCP","56","43520 → 9002 [ACK] Seq=23118 Ack=283691 Win=11901 Len=0"
"5.571767","5.9.29.183","172.19.0.3","TCP","1516","9002 → 43520 [PSH, ACK] Seq=283691 Ack=23118 Win=65535 Len=1460 [TCP segment of a reassembled PDU]"
"5.571784","5.9.29.183","172.19.0.3","TLSv1.2","1516","Application Data [TCP segment of a reassembled PDU]"
"5.571794","5.9.29.183","172.19.0.3","TCP","1480","9002 → 43520 [PSH, ACK] Seq=286611 Ack=23118 Win=65535 Len=1424 [TCP segment of a reassembled PDU]"
"5.571905","172.19.0.3","5.9.29.183","TCP","56","43520 → 9002 [ACK] Seq=23118 Ack=288035 Win=11877 Len=0"
"5.571970","5.9.29.183","172.19.0.3","TCP","1516","9002 → 43520 [PSH, ACK] Seq=288035 Ack=23118 Win=65535 Len=1460 [TCP segment of a reassembled PDU]"
"5.571978","5.9.29.183","172.19.0.3","TLSv1.2","1492","Application Data [TCP segment of a reassembled PDU]"
"5.571981","5.9.29.183","172.19.0.3","TLSv1.2","1516","Application Data [TCP segment of a reassembled PDU]"
"5.571983","5.9.29.183","172.19.0.3","TCP","1492","9002 → 43520 [PSH, ACK] Seq=292391 Ack=23118 Win=65535 Len=1436 [TCP segment of a reassembled PDU]"
"5.572000","172.19.0.3","5.9.29.183","TCP","56","43520 → 9002 [ACK] Seq=23118 Ack=293827 Win=11845 Len=0"
"5.575521","5.9.29.183","172.19.0.3","TCP","1504","9002 → 43520 [PSH, ACK] Seq=293827 Ack=23118 Win=65535 Len=1448 [TCP segment of a reassembled PDU]"
"5.575732","5.9.29.183","172.19.0.3","TLSv1.2","1504","Application Data [TCP segment of a reassembled PDU]"
"5.575737","5.9.29.183","172.19.0.3","TLSv1.2","967","Application Data"
"5.575750","172.19.0.3","5.9.29.183","TCP","56","43520 → 9002 [ACK] Seq=23118 Ack=296723 Win=11911 Len=0"
"5.576018","172.19.0.3","5.9.29.183","TLSv1.2","599","Application Data"
"5.576233","5.9.29.183","172.19.0.3","TCP","56","9002 → 43520 [ACK] Seq=297634 Ack=23661 Win=65535 Len=0"
"5.588343","5.9.29.183","172.19.0.3","TCP","1504","[TCP segment of a reassembled PDU]"
"5.589385","5.9.29.183","172.19.0.3","TCP","1504","9002 → 43520 [PSH, ACK] Seq=299082 Ack=23661 Win=65535 Len=1448 [TCP segment of a reassembled PDU]"
"5.589398","172.19.0.3","5.9.29.183","TCP","56","43520 → 9002 [ACK] Seq=23661 Ack=300530 Win=11911 Len=0"
"5.589948","5.9.29.183","172.19.0.3","TLSv1.2","1516","Application Data [TCP segment of a reassembled PDU]"
"5.589999","5.9.29.183","172.19.0.3","TCP","1492","9002 → 43520 [PSH, ACK] Seq=301990 Ack=23661 Win=65535 Len=1436 [TCP segment of a reassembled PDU]"
"5.590007","5.9.29.183","172.19.0.3","TCP","838","9002 → 43520 [PSH, ACK] Seq=303426 Ack=23661 Win=65535 Len=782 [TCP segment of a reassembled PDU]"
"5.590079","172.19.0.3","5.9.29.183","TCP","56","43520 → 9002 [ACK] Seq=23661 Ack=304208 Win=11895 Len=0"
"5.590126","5.9.29.183","172.19.0.3","TCP","1516","9002 → 43520 [PSH, ACK] Seq=304208 Ack=23661 Win=65535 Len=1460 [TCP segment of a reassembled PDU]"
"5.590350","5.9.29.183","172.19.0.3","TLSv1.2","1516","Application Data [TCP segment of a reassembled PDU]"
"5.590362","172.19.0.3","5.9.29.183","TCP","56","43520 → 9002 [ACK] Seq=23661 Ack=307128 Win=11911 Len=0"
"5.590370","5.9.29.183","172.19.0.3","TCP","1516","9002 → 43520 [PSH, ACK] Seq=307128 Ack=23661 Win=65535 Len=1460 [TCP segment of a reassembled PDU]"
"5.590375","5.9.29.183","172.19.0.3","TCP","686","9002 → 43520 [PSH, ACK] Seq=308588 Ack=23661 Win=65535 Len=630 [TCP segment of a reassembled PDU]"
"5.590441","172.19.0.3","5.9.29.183","TCP","56","43520 → 9002 [ACK] Seq=23661 Ack=309218 Win=11895 Len=0"
"5.590909","5.9.29.183","172.19.0.3","TLSv1.2","1438","Application Data, Application Data"
"5.603967","5.9.29.183","172.19.0.3","TCP","1504","[TCP segment of a reassembled PDU]"
"5.603986","172.19.0.3","5.9.29.183","TCP","56","43520 → 9002 [ACK] Seq=23661 Ack=312048 Win=11911 Len=0"
"5.604325","5.9.29.183","172.19.0.3","TCP","1516","9002 → 43520 [PSH, ACK] Seq=312048 Ack=23661 Win=65535 Len=1460 [TCP segment of a reassembled PDU]"
"5.604406","5.9.29.183","172.19.0.3","TLSv1.2","1492","Application Data [TCP segment of a reassembled PDU]"
"5.604474","5.9.29.183","172.19.0.3","TCP","1516","9002 → 43520 [PSH, ACK] Seq=314944 Ack=23661 Win=65535 Len=1460 [TCP segment of a reassembled PDU]"
"5.604477","5.9.29.183","172.19.0.3","TCP","1516","9002 → 43520 [PSH, ACK] Seq=316404 Ack=23661 Win=65535 Len=1460 [TCP segment of a reassembled PDU]"
"5.604478","5.9.29.183","172.19.0.3","TLSv1.2","1516","Application Data [TCP segment of a reassembled PDU]"
"5.604480","5.9.29.183","172.19.0.3","TCP","1516","9002 → 43520 [PSH, ACK] Seq=319324 Ack=23661 Win=65535 Len=1460 [TCP segment of a reassembled PDU]"
"5.604481","5.9.29.183","172.19.0.3","TCP","1456","9002 → 43520 [PSH, ACK] Seq=320784 Ack=23661 Win=65535 Len=1400 [TCP segment of a reassembled PDU]"
"5.604483","172.19.0.3","5.9.29.183","TCP","56","43520 → 9002 [ACK] Seq=23661 Ack=314944 Win=11903 Len=0"
"5.604631","172.19.0.3","5.9.29.183","TCP","56","43520 → 9002 [ACK] Seq=23661 Ack=322184 Win=11863 Len=0"
"5.606173","5.9.29.183","172.19.0.3","TLSv1.2","1438","Application Data, Application Data"
"5.606425","172.19.0.3","5.9.29.183","TLSv1.2","599","Application Data"
"5.606652","5.9.29.183","172.19.0.3","TCP","56","9002 → 43520 [ACK] Seq=323566 Ack=24204 Win=65535 Len=0"
"5.609000","5.9.29.183","172.19.0.3","TCP","1504","[TCP segment of a reassembled PDU]"
"5.619920","5.9.29.183","172.19.0.3","TLSv1.2","1516","Application Data [TCP segment of a reassembled PDU]"
"5.619937","172.19.0.3","5.9.29.183","TCP","56","43520 → 9002 [ACK] Seq=24204 Ack=326474 Win=11911 Len=0"
"5.619972","5.9.29.183","172.19.0.3","TCP","1492","9002 → 43520 [PSH, ACK] Seq=326474 Ack=24204 Win=65535 Len=1436 [TCP segment of a reassembled PDU]"
"5.620328","5.9.29.183","172.19.0.3","TCP","1516","9002 → 43520 [PSH, ACK] Seq=327910 Ack=24204 Win=65535 Len=1460 [TCP segment of a reassembled PDU]"
"5.620335","172.19.0.3","5.9.29.183","TCP","56","43520 → 9002 [ACK] Seq=24204 Ack=329370 Win=11911 Len=0"
"5.620341","5.9.29.183","172.19.0.3","TLSv1.2","1492","Application Data [TCP segment of a reassembled PDU]"
"5.620344","5.9.29.183","172.19.0.3","TCP","1516","9002 → 43520 [PSH, ACK] Seq=330806 Ack=24204 Win=65535 Len=1460 [TCP segment of a reassembled PDU]"
"5.620418","172.19.0.3","5.9.29.183","TCP","56","43520 → 9002 [ACK] Seq=24204 Ack=332266 Win=11895 Len=0"
"5.620540","172.19.0.3","5.9.29.183","TLSv1.2","599","Application Data"
"5.620616","5.9.29.183","172.19.0.3","TCP","1516","9002 → 43520 [PSH, ACK] Seq=332266 Ack=24204 Win=65535 Len=1460 [TCP segment of a reassembled PDU]"
"5.620625","5.9.29.183","172.19.0.3","TLSv1.2","1480","Application Data [TCP segment of a reassembled PDU]"
"5.620630","172.19.0.3","5.9.29.183","TCP","56","43520 → 9002 [ACK] Seq=24747 Ack=335150 Win=11903 Len=0"
"5.620806","5.9.29.183","172.19.0.3","TCP","1516","9002 → 43520 [PSH, ACK] Seq=335150 Ack=24204 Win=65535 Len=1460 [TCP segment of a reassembled PDU]"
"5.620810","5.9.29.183","172.19.0.3","TCP","1492","9002 → 43520 [PSH, ACK] Seq=336610 Ack=24204 Win=65535 Len=1436 [TCP segment of a reassembled PDU]"
"5.620812","5.9.29.183","172.19.0.3","TLSv1.2","1516","Application Data [TCP segment of a reassembled PDU]"
"5.620814","5.9.29.183","172.19.0.3","TCP","1492","9002 → 43520 [PSH, ACK] Seq=339506 Ack=24204 Win=65535 Len=1436 [TCP segment of a reassembled PDU]"
"5.620840","172.19.0.3","5.9.29.183","TCP","56","43520 → 9002 [ACK] Seq=24747 Ack=340942 Win=11869 Len=0"
"5.621105","5.9.29.183","172.19.0.3","TCP","56","9002 → 43520 [ACK] Seq=340942 Ack=24747 Win=65535 Len=0"
"5.621402","5.9.29.183","172.19.0.3","TLSv1.2","815","Application Data"
"5.642989","5.9.29.183","172.19.0.3","TCP","1516","[TCP segment of a reassembled PDU]"
"5.643010","172.19.0.3","5.9.29.183","TCP","56","43520 → 9002 [ACK] Seq=24747 Ack=343161 Win=11911 Len=0"
"5.643024","5.9.29.183","172.19.0.3","TCP","1516","9002 → 43520 [PSH, ACK] Seq=343161 Ack=24747 Win=65535 Len=1460 [TCP segment of a reassembled PDU]"
"5.643031","5.9.29.183","172.19.0.3","TLSv1.2","763","Application Data"
"5.643196","172.19.0.3","5.9.29.183","TCP","56","43520 → 9002 [ACK] Seq=24747 Ack=345328 Win=11895 Len=0"
"5.658575","5.9.29.183","172.19.0.3","TLSv1.2","1113","Application Data"
"5.662648","172.19.0.3","5.9.29.183","TLSv1.2","599","Application Data"
"5.662916","5.9.29.183","172.19.0.3","TCP","56","9002 → 43520 [ACK] Seq=346385 Ack=25290 Win=65535 Len=0"
"5.990339","5.9.29.183","172.19.0.3","TLSv1.2","599","Application Data"
"5.991059","172.19.0.3","5.9.29.183","TLSv1.2","599","Application Data"
"5.991351","5.9.29.183","172.19.0.3","TCP","56","9002 → 43520 [ACK] Seq=346928 Ack=25833 Win=65535 Len=0"
"6.231543","5.9.29.183","172.19.0.3","TCP","1516","[TCP segment of a reassembled PDU]"
"6.231628","5.9.29.183","172.19.0.3","TCP","1492","9002 → 43520 [PSH, ACK] Seq=348388 Ack=25833 Win=65535 Len=1436 [TCP segment of a reassembled PDU]"
"6.231650","5.9.29.183","172.19.0.3","TLSv1.2","787","Application Data"
"6.231821","172.19.0.3","5.9.29.183","TCP","56","43520 → 9002 [ACK] Seq=25833 Ack=350555 Win=11895 Len=0"
"6.276430","5.9.29.183","172.19.0.3","TCP","1516","[TCP segment of a reassembled PDU]"
"6.276602","5.9.29.183","172.19.0.3","TCP","1492","9002 → 43520 [PSH, ACK] Seq=352015 Ack=25833 Win=65535 Len=1436 [TCP segment of a reassembled PDU]"
"6.276619","172.19.0.3","5.9.29.183","TCP","56","43520 → 9002 [ACK] Seq=25833 Ack=353451 Win=11903 Len=0"
"6.276713","5.9.29.183","172.19.0.3","TLSv1.2","1516","Application Data [TCP segment of a reassembled PDU]"
"6.276759","5.9.29.183","172.19.0.3","TCP","1516","9002 → 43520 [PSH, ACK] Seq=354911 Ack=25833 Win=65535 Len=1460 [TCP segment of a reassembled PDU]"
"6.276767","172.19.0.3","5.9.29.183","TCP","56","43520 → 9002 [ACK] Seq=25833 Ack=356371 Win=11903 Len=0"
"6.276769","5.9.29.183","172.19.0.3","TCP","1516","9002 → 43520 [PSH, ACK] Seq=356371 Ack=25833 Win=65535 Len=1460 [TCP segment of a reassembled PDU]"
"6.276875","5.9.29.183","172.19.0.3","TLSv1.2","1201","Application Data [TCP segment of a reassembled PDU]"
"6.276882","5.9.29.183","172.19.0.3","TCP","1504","9002 → 43520 [PSH, ACK] Seq=358976 Ack=25833 Win=65535 Len=1448 [TCP segment of a reassembled PDU]"
"6.276884","5.9.29.183","172.19.0.3","TCP","1516","9002 → 43520 [PSH, ACK] Seq=360424 Ack=25833 Win=65535 Len=1460 [TCP segment of a reassembled PDU]"
"6.276953","5.9.29.183","172.19.0.3","TLSv1.2","1492","Application Data [TCP segment of a reassembled PDU]"
"6.276956","5.9.29.183","172.19.0.3","TCP","1504","9002 → 43520 [PSH, ACK] Seq=363320 Ack=25833 Win=65535 Len=1448 [TCP segment of a reassembled PDU]"
"6.276957","172.19.0.3","5.9.29.183","TCP","56","43520 → 9002 [ACK] Seq=25833 Ack=361884 Win=11869 Len=0"
"6.276994","172.19.0.3","5.9.29.183","TCP","56","43520 → 9002 [ACK] Seq=25833 Ack=364768 Win=11853 Len=0"
"6.292797","5.9.29.183","172.19.0.3","TLSv1.2","1516","Application Data [TCP segment of a reassembled PDU]"
"6.292869","5.9.29.183","172.19.0.3","TCP","1516","9002 → 43520 [PSH, ACK] Seq=366228 Ack=25833 Win=65535 Len=1460 [TCP segment of a reassembled PDU]"
"6.292890","172.19.0.3","5.9.29.183","TCP","56","43520 → 9002 [ACK] Seq=25833 Ack=367688 Win=11903 Len=0"
"6.292894","5.9.29.183","172.19.0.3","TCP","1355","9002 → 43520 [PSH, ACK] Seq=367688 Ack=25833 Win=65535 Len=1299 [TCP segment of a reassembled PDU]"
"6.293971","5.9.29.183","172.19.0.3","TCP","813","9002 → 43520 [PSH, ACK] Seq=368987 Ack=25833 Win=65535 Len=757 [TCP segment of a reassembled PDU]"
"6.293979","172.19.0.3","5.9.29.183","TCP","56","43520 → 9002 [ACK] Seq=25833 Ack=369744 Win=11911 Len=0"
"6.294068","5.9.29.183","172.19.0.3","TLSv1.2","1516","Application Data [TCP segment of a reassembled PDU]"
"6.294075","5.9.29.183","172.19.0.3","TCP","1516","9002 → 43520 [PSH, ACK] Seq=371204 Ack=25833 Win=65535 Len=1460 [TCP segment of a reassembled PDU]"
"6.294108","5.9.29.183","172.19.0.3","TCP","723","9002 → 43520 [PSH, ACK] Seq=372664 Ack=25833 Win=65535 Len=667 [TCP segment of a reassembled PDU]"
"6.294167","172.19.0.3","5.9.29.183","TCP","56","43520 → 9002 [ACK] Seq=25833 Ack=373331 Win=11887 Len=0"
"6.308450","5.9.29.183","172.19.0.3","TLSv1.2","1127","Application Data, Application Data"
"6.309017","172.19.0.3","5.9.29.183","TLSv1.2","599","Application Data"
"6.309348","5.9.29.183","172.19.0.3","TCP","56","9002 → 43520 [ACK] Seq=374402 Ack=26376 Win=65535 Len=0"
"6.316290","5.9.29.183","172.19.0.3","TCP","1504","[TCP segment of a reassembled PDU]"
"6.317017","5.9.29.183","172.19.0.3","TCP","1504","9002 → 43520 [PSH, ACK] Seq=375850 Ack=26376 Win=65535 Len=1448 [TCP segment of a reassembled PDU]"
"6.317029","172.19.0.3","5.9.29.183","TCP","56","43520 → 9002 [ACK] Seq=26376 Ack=377298 Win=11911 Len=0"
"6.326338","5.9.29.183","172.19.0.3","TLSv1.2","1330","Application Data, Application Data"
"6.328256","5.9.29.183","172.19.0.3","TCP","1504","[TCP segment of a reassembled PDU]"
"6.328273","172.19.0.3","5.9.29.183","TCP","56","43520 → 9002 [ACK] Seq=26376 Ack=380020 Win=11911 Len=0"
"6.328661","5.9.29.183","172.19.0.3","TCP","1516","9002 → 43520 [PSH, ACK] Seq=380020 Ack=26376 Win=65535 Len=1460 [TCP segment of a reassembled PDU]"
"6.328779","5.9.29.183","172.19.0.3","TLSv1.2","1516","Application Data [TCP segment of a reassembled PDU]"
"6.328786","5.9.29.183","172.19.0.3","TLSv1.2","1480","Application Data [TCP segment of a reassembled PDU]"
"6.328868","172.19.0.3","5.9.29.183","TCP","56","43520 → 9002 [ACK] Seq=26376 Ack=384364 Win=11895 Len=0"
"6.328889","5.9.29.183","172.19.0.3","TCP","1516","9002 → 43520 [PSH, ACK] Seq=384364 Ack=26376 Win=65535 Len=1460 [TCP segment of a reassembled PDU]"
"6.328892","5.9.29.183","172.19.0.3","TCP","1516","9002 → 43520 [PSH, ACK] Seq=385824 Ack=26376 Win=65535 Len=1460 [TCP segment of a reassembled PDU]"
"6.329076","172.19.0.3","5.9.29.183","TCP","56","43520 → 9002 [ACK] Seq=26376 Ack=387284 Win=11879 Len=0"
"6.329244","5.9.29.183","172.19.0.3","TLSv1.2","1516","Application Data [TCP segment of a reassembled PDU]"
"6.329252","5.9.29.183","172.19.0.3","TCP","1468","9002 → 43520 [PSH, ACK] Seq=388744 Ack=26376 Win=65535 Len=1412 [TCP segment of a reassembled PDU]"
"6.329356","172.19.0.3","5.9.29.183","TLSv1.2","599","Application Data"
"6.329570","5.9.29.183","172.19.0.3","TCP","56","9002 → 43520 [ACK] Seq=390156 Ack=26919 Win=65535 Len=0"
"6.334740","5.9.29.183","172.19.0.3","TLSv1.2","1504","Application Data [TCP segment of a reassembled PDU]"
"6.334782","5.9.29.183","172.19.0.3","TCP","1504","9002 → 43520 [PSH, ACK] Seq=391604 Ack=26919 Win=65535 Len=1448 [TCP segment of a reassembled PDU]"
"6.334793","172.19.0.3","5.9.29.183","TCP","56","43520 → 9002 [ACK] Seq=26919 Ack=393052 Win=11903 Len=0"
"6.341648","5.9.29.183","172.19.0.3","TLSv1.2","1141","Application Data"
"6.361633","5.9.29.183","172.19.0.3","TCP","1504","[TCP segment of a reassembled PDU]"
"6.361651","172.19.0.3","5.9.29.183","TCP","56","43520 → 9002 [ACK] Seq=26919 Ack=395585 Win=11911 Len=0"
"6.361967","5.9.29.183","172.19.0.3","TCP","1504","9002 → 43520 [PSH, ACK] Seq=395585 Ack=26919 Win=65535 Len=1448 [TCP segment of a reassembled PDU]"
"6.362043","5.9.29.183","172.19.0.3","TLSv1.2","1516","Application Data [TCP segment of a reassembled PDU]"
"6.362066","5.9.29.183","172.19.0.3","TCP","1516","9002 → 43520 [PSH, ACK] Seq=398493 Ack=26919 Win=65535 Len=1460 [TCP segment of a reassembled PDU]"
"6.362069","5.9.29.183","172.19.0.3","TCP","1213","9002 → 43520 [PSH, ACK] Seq=399953 Ack=26919 Win=65535 Len=1157 [TCP segment of a reassembled PDU]"
"6.362093","172.19.0.3","5.9.29.183","TCP","56","43520 → 9002 [ACK] Seq=26919 Ack=401110 Win=11887 Len=0"
"6.377859","5.9.29.183","172.19.0.3","TLSv1.2","851","Application Data"
"6.378337","172.19.0.3","5.9.29.183","TLSv1.2","599","Application Data"
"6.378875","5.9.29.183","172.19.0.3","TCP","56","9002 → 43520 [ACK] Seq=401905 Ack=27462 Win=65535 Len=0"
"6.379618","5.9.29.183","172.19.0.3","TCP","1504","[TCP segment of a reassembled PDU]"
"6.380335","5.9.29.183","172.19.0.3","TCP","1516","9002 → 43520 [PSH, ACK] Seq=403353 Ack=27462 Win=65535 Len=1460 [TCP segment of a reassembled PDU]"
"6.380355","172.19.0.3","5.9.29.183","TCP","56","43520 → 9002 [ACK] Seq=27462 Ack=404813 Win=11911 Len=0"
"6.380707","5.9.29.183","172.19.0.3","TLSv1.2","1516","Application Data [TCP segment of a reassembled PDU]"
"6.380857","5.9.29.183","172.19.0.3","TCP","1516","9002 → 43520 [PSH, ACK] Seq=406273 Ack=27462 Win=65535 Len=1460 [TCP segment of a reassembled PDU]"
"6.380888","5.9.29.183","172.19.0.3","TCP","1468","9002 → 43520 [PSH, ACK] Seq=407733 Ack=27462 Win=65535 Len=1412 [TCP segment of a reassembled PDU]"
"6.380931","172.19.0.3","5.9.29.183","TCP","56","43520 → 9002 [ACK] Seq=27462 Ack=409145 Win=11895 Len=0"
"6.380973","5.9.29.183","172.19.0.3","TLSv1.2","1504","Application Data [TCP segment of a reassembled PDU]"
"6.385399","5.9.29.183","172.19.0.3","TLSv1.2","1516","Application Data [TCP segment of a reassembled PDU]"
"6.385421","172.19.0.3","5.9.29.183","TCP","56","43520 → 9002 [ACK] Seq=27462 Ack=412053 Win=11911 Len=0"
"6.385459","5.9.29.183","172.19.0.3","TCP","1492","9002 → 43520 [PSH, ACK] Seq=412053 Ack=27462 Win=65535 Len=1436 [TCP segment of a reassembled PDU]"
"6.393179","5.9.29.183","172.19.0.3","TLSv1.2","924","Application Data"
"6.393439","172.19.0.3","5.9.29.183","TCP","56","43520 → 9002 [ACK] Seq=27462 Ack=414357 Win=11911 Len=0"
"6.397005","5.9.29.183","172.19.0.3","TCP","1504","[TCP segment of a reassembled PDU]"
"6.397288","5.9.29.183","172.19.0.3","TCP","1516","9002 → 43520 [PSH, ACK] Seq=415805 Ack=27462 Win=65535 Len=1460 [TCP segment of a reassembled PDU]"
"6.397456","172.19.0.3","5.9.29.183","TCP","56","43520 → 9002 [ACK] Seq=27462 Ack=417265 Win=11903 Len=0"
"6.397715","5.9.29.183","172.19.0.3","TLSv1.2","1516","Application Data [TCP segment of a reassembled PDU]"
"6.397776","5.9.29.183","172.19.0.3","TCP","1480","9002 → 43520 [PSH, ACK] Seq=418725 Ack=27462 Win=65535 Len=1424 [TCP segment of a reassembled PDU]"
"6.397795","172.19.0.3","5.9.29.183","TCP","56","43520 → 9002 [ACK] Seq=27462 Ack=420149 Win=11903 Len=0"
"6.398134","5.9.29.183","172.19.0.3","TCP","1516","9002 → 43520 [PSH, ACK] Seq=420149 Ack=27462 Win=65535 Len=1460 [TCP segment of a reassembled PDU]"
"6.398145","5.9.29.183","172.19.0.3","TLSv1.2","1516","Application Data [TCP segment of a reassembled PDU]"
"6.398158","172.19.0.3","5.9.29.183","TCP","56","43520 → 9002 [ACK] Seq=27462 Ack=423069 Win=11903 Len=0"
"6.398162","5.9.29.183","172.19.0.3","TCP","1516","9002 → 43520 [PSH, ACK] Seq=423069 Ack=27462 Win=65535 Len=1460 [TCP segment of a reassembled PDU]"
"6.398168","5.9.29.183","172.19.0.3","TCP","1468","9002 → 43520 [PSH, ACK] Seq=424529 Ack=27462 Win=65535 Len=1412 [TCP segment of a reassembled PDU]"
"6.398242","172.19.0.3","5.9.29.183","TCP","56","43520 → 9002 [ACK] Seq=27462 Ack=425941 Win=11887 Len=0"
"6.408587","5.9.29.183","172.19.0.3","TLSv1.2","1438","Application Data, Application Data"
"6.408956","172.19.0.3","5.9.29.183","TLSv1.2","599","Application Data"
"6.409287","5.9.29.183","172.19.0.3","TCP","56","9002 → 43520 [ACK] Seq=427323 Ack=28005 Win=65535 Len=0"
"6.420303","5.9.29.183","172.19.0.3","TCP","1504","[TCP segment of a reassembled PDU]"
"6.423888","5.9.29.183","172.19.0.3","TLSv1.2","179","Application Data"
"6.423909","172.19.0.3","5.9.29.183","TCP","56","43520 → 9002 [ACK] Seq=28005 Ack=428894 Win=11911 Len=0"
"6.429143","172.19.0.3","5.9.29.183","TLSv1.2","599","Application Data"
"6.429467","5.9.29.183","172.19.0.3","TCP","56","9002 → 43520 [ACK] Seq=428894 Ack=28548 Win=65535 Len=0"
"6.776827","5.9.29.183","172.19.0.3","TLSv1.2","599","Application Data"
"6.777517","172.19.0.3","5.9.29.183","TLSv1.2","599","Application Data"
"6.777822","5.9.29.183","172.19.0.3","TCP","56","9002 → 43520 [ACK] Seq=429437 Ack=29091 Win=65535 Len=0"
"7.116115","5.9.29.183","172.19.0.3","TLSv1.2","599","Application Data"
"7.146749","5.9.29.183","172.19.0.3","TCP","1504","[TCP segment of a reassembled PDU]"
"7.146766","172.19.0.3","5.9.29.183","TCP","56","43520 → 9002 [ACK] Seq=29091 Ack=431428 Win=11911 Len=0"
"7.147663","5.9.29.183","172.19.0.3","TCP","1516","9002 → 43520 [PSH, ACK] Seq=431428 Ack=29091 Win=65535 Len=1460 [TCP segment of a reassembled PDU]"
"7.147891","5.9.29.183","172.19.0.3","TLSv1.2","775","Application Data"
"7.147932","172.19.0.3","5.9.29.183","TCP","56","43520 → 9002 [ACK] Seq=29091 Ack=433607 Win=11911 Len=0"
"7.156594","5.9.29.183","172.19.0.3","TCP","1516","[TCP segment of a reassembled PDU]"
"7.156660","5.9.29.183","172.19.0.3","TCP","269","9002 → 43520 [PSH, ACK] Seq=435067 Ack=29091 Win=65535 Len=213 [TCP segment of a reassembled PDU]"
"7.156683","5.9.29.183","172.19.0.3","TCP","1279","9002 → 43520 [PSH, ACK] Seq=435280 Ack=29091 Win=65535 Len=1223 [TCP segment of a reassembled PDU]"
"7.156686","5.9.29.183","172.19.0.3","TLSv1.2","1516","Application Data [TCP segment of a reassembled PDU]"
"7.156789","5.9.29.183","172.19.0.3","TCP","1516","9002 → 43520 [PSH, ACK] Seq=437963 Ack=29091 Win=65535 Len=1460 [TCP segment of a reassembled PDU]"
"7.156793","5.9.29.183","172.19.0.3","TCP","1480","9002 → 43520 [PSH, ACK] Seq=439423 Ack=29091 Win=65535 Len=1424 [TCP segment of a reassembled PDU]"
"7.156944","172.19.0.3","5.9.29.183","TCP","56","43520 → 9002 [ACK] Seq=29091 Ack=440847 Win=11871 Len=0"
"7.157140","172.19.0.3","5.9.29.183","TLSv1.2","599","Application Data"
"7.157301","5.9.29.183","172.19.0.3","TCP","56","9002 → 43520 [ACK] Seq=440847 Ack=29634 Win=65535 Len=0"
"7.163620","5.9.29.183","172.19.0.3","TLSv1.2","584","Application Data"
"7.171325","5.9.29.183","172.19.0.3","TCP","1504","[TCP segment of a reassembled PDU]"
"7.171343","172.19.0.3","5.9.29.183","TCP","56","43520 → 9002 [ACK] Seq=29634 Ack=442823 Win=11909 Len=0"
"7.171681","5.9.29.183","172.19.0.3","TCP","1516","9002 → 43520 [PSH, ACK] Seq=442823 Ack=29634 Win=65535 Len=1460 [TCP segment of a reassembled PDU]"
"7.171756","5.9.29.183","172.19.0.3","TLSv1.2","1516","Application Data [TCP segment of a reassembled PDU]"
"7.171765","5.9.29.183","172.19.0.3","TCP","1480","9002 → 43520 [PSH, ACK] Seq=445743 Ack=29634 Win=65535 Len=1424 [TCP segment of a reassembled PDU]"
"7.171793","5.9.29.183","172.19.0.3","TCP","1516","9002 → 43520 [PSH, ACK] Seq=447167 Ack=29634 Win=65535 Len=1460 [TCP segment of a reassembled PDU]"
"7.171797","5.9.29.183","172.19.0.3","TLSv1.2","1516","Application Data [TCP segment of a reassembled PDU]"
"7.171799","5.9.29.183","172.19.0.3","TCP","1480","9002 → 43520 [PSH, ACK] Seq=450087 Ack=29634 Win=65535 Len=1424 [TCP segment of a reassembled PDU]"
"7.171817","172.19.0.3","5.9.29.183","TCP","56","43520 → 9002 [ACK] Seq=29634 Ack=451511 Win=11871 Len=0"
"7.172275","5.9.29.183","172.19.0.3","TCP","1504","9002 → 43520 [PSH, ACK] Seq=451511 Ack=29634 Win=65535 Len=1448 [TCP segment of a reassembled PDU]"
"7.172368","5.9.29.183","172.19.0.3","TLSv1.2","1516","Application Data [TCP segment of a reassembled PDU]"
"7.172372","5.9.29.183","172.19.0.3","TCP","1516","9002 → 43520 [PSH, ACK] Seq=454419 Ack=29634 Win=65535 Len=1460 [TCP segment of a reassembled PDU]"
"7.172375","5.9.29.183","172.19.0.3","TCP","1480","9002 → 43520 [PSH, ACK] Seq=455879 Ack=29634 Win=65535 Len=1424 [TCP segment of a reassembled PDU]"
"7.172384","172.19.0.3","5.9.29.183","TCP","56","43520 → 9002 [ACK] Seq=29634 Ack=454419 Win=11911 Len=0"
"7.172434","172.19.0.3","5.9.29.183","TCP","56","43520 → 9002 [ACK] Seq=29634 Ack=457303 Win=11895 Len=0"
"7.178823","5.9.29.183","172.19.0.3","TLSv1.2","721","Application Data, Application Data"
"7.179196","172.19.0.3","5.9.29.183","TLSv1.2","599","Application Data"
"7.179492","5.9.29.183","172.19.0.3","TCP","56","9002 → 43520 [ACK] Seq=457968 Ack=30177 Win=65535 Len=0"
"7.212208","5.9.29.183","172.19.0.3","TCP","1504","[TCP segment of a reassembled PDU]"
"7.212269","5.9.29.183","172.19.0.3","TCP","1516","9002 → 43520 [PSH, ACK] Seq=459416 Ack=30177 Win=65535 Len=1460 [TCP segment of a reassembled PDU]"
"7.212278","5.9.29.183","172.19.0.3","TLSv1.2","1516","Application Data [TCP segment of a reassembled PDU]"
"7.212281","5.9.29.183","172.19.0.3","TCP","1213","9002 → 43520 [PSH, ACK] Seq=462336 Ack=30177 Win=65535 Len=1157 [TCP segment of a reassembled PDU]"
"7.212403","172.19.0.3","5.9.29.183","TCP","56","43520 → 9002 [ACK] Seq=30177 Ack=463493 Win=11887 Len=0"
"7.216919","5.9.29.183","172.19.0.3","TLSv1.2","1504","Application Data [TCP segment of a reassembled PDU]"
"7.227566","5.9.29.183","172.19.0.3","TLSv1.2","880","Application Data"
"7.227580","172.19.0.3","5.9.29.183","TCP","56","43520 → 9002 [ACK] Seq=30177 Ack=465765 Win=11911 Len=0"
"7.233286","5.9.29.183","172.19.0.3","TCP","1504","[TCP segment of a reassembled PDU]"
"7.233341","5.9.29.183","172.19.0.3","TCP","1504","9002 → 43520 [PSH, ACK] Seq=467213 Ack=30177 Win=65535 Len=1448 [TCP segment of a reassembled PDU]"
"7.233440","172.19.0.3","5.9.29.183","TCP","56","43520 → 9002 [ACK] Seq=30177 Ack=468661 Win=11903 Len=0"
"7.242983","5.9.29.183","172.19.0.3","TLSv1.2","273","Application Data"
"7.247191","172.19.0.3","5.9.29.183","TLSv1.2","599","Application Data"
"7.247447","5.9.29.183","172.19.0.3","TCP","56","9002 → 43520 [ACK] Seq=468878 Ack=30720 Win=65535 Len=0"
"7.590752","5.9.29.183","172.19.0.3","TLSv1.2","599","Application Data"
"7.591634","172.19.0.3","5.9.29.183","TLSv1.2","599","Application Data"
"7.592023","5.9.29.183","172.19.0.3","TCP","56","9002 → 43520 [ACK] Seq=469421 Ack=31263 Win=65535 Len=0"
"7.913200","5.9.29.183","172.19.0.3","TCP","1516","[TCP segment of a reassembled PDU]"
"7.913248","5.9.29.183","172.19.0.3","TCP","1492","9002 → 43520 [PSH, ACK] Seq=470881 Ack=31263 Win=65535 Len=1436 [TCP segment of a reassembled PDU]"
"7.913372","172.19.0.3","5.9.29.183","TCP","56","43520 → 9002 [ACK] Seq=31263 Ack=472317 Win=11903 Len=0"
"7.913525","5.9.29.183","172.19.0.3","TLSv1.2","787","Application Data"
"7.924718","5.9.29.183","172.19.0.3","TCP","1516","[TCP segment of a reassembled PDU]"
"7.924739","172.19.0.3","5.9.29.183","TCP","56","43520 → 9002 [ACK] Seq=31263 Ack=474508 Win=11911 Len=0"
"7.924796","5.9.29.183","172.19.0.3","TCP","1492","9002 → 43520 [PSH, ACK] Seq=474508 Ack=31263 Win=65535 Len=1436 [TCP segment of a reassembled PDU]"
"7.924896","5.9.29.183","172.19.0.3","TLSv1.2","1516","Application Data [TCP segment of a reassembled PDU]"
"7.924902","5.9.29.183","172.19.0.3","TCP","1492","9002 → 43520 [PSH, ACK] Seq=477404 Ack=31263 Win=65535 Len=1436 [TCP segment of a reassembled PDU]"
"7.924935","172.19.0.3","5.9.29.183","TCP","56","43520 → 9002 [ACK] Seq=31263 Ack=478840 Win=11887 Len=0"
"7.925013","5.9.29.183","172.19.0.3","TCP","1516","9002 → 43520 [PSH, ACK] Seq=478840 Ack=31263 Win=65535 Len=1460 [TCP segment of a reassembled PDU]"
"7.925017","5.9.29.183","172.19.0.3","TLSv1.2","1492","Application Data [TCP segment of a reassembled PDU]"
"7.925106","172.19.0.3","5.9.29.183","TCP","56","43520 → 9002 [ACK] Seq=31263 Ack=481736 Win=11871 Len=0"
"7.929330","5.9.29.183","172.19.0.3","TLSv1.2","1221","Application Data"
"7.940283","5.9.29.183","172.19.0.3","TCP","1516","[TCP segment of a reassembled PDU]"
"7.940300","172.19.0.3","5.9.29.183","TCP","56","43520 → 9002 [ACK] Seq=31263 Ack=484361 Win=11911 Len=0"
"7.940332","5.9.29.183","172.19.0.3","TCP","1516","9002 → 43520 [PSH, ACK] Seq=484361 Ack=31263 Win=65535 Len=1460 [TCP segment of a reassembled PDU]"
"7.940339","5.9.29.183","172.19.0.3","TLSv1.2","1516","Application Data [TCP segment of a reassembled PDU]"
"7.940342","5.9.29.183","172.19.0.3","TCP","1468","9002 → 43520 [PSH, ACK] Seq=487281 Ack=31263 Win=65535 Len=1412 [TCP segment of a reassembled PDU]"
"7.940344","5.9.29.183","172.19.0.3","TCP","1504","9002 → 43520 [PSH, ACK] Seq=488693 Ack=31263 Win=65535 Len=1448 [TCP segment of a reassembled PDU]"
"7.940445","172.19.0.3","5.9.29.183","TCP","56","43520 → 9002 [ACK] Seq=31263 Ack=490141 Win=11879 Len=0"
"7.944310","5.9.29.183","172.19.0.3","TLSv1.2","584","Application Data"
"7.944862","172.19.0.3","5.9.29.183","TLSv1.2","599","Application Data"
"7.945085","5.9.29.183","172.19.0.3","TCP","56","9002 → 43520 [ACK] Seq=490669 Ack=31806 Win=65535 Len=0"
"7.956266","5.9.29.183","172.19.0.3","TCP","1504","[TCP segment of a reassembled PDU]"
"7.956853","5.9.29.183","172.19.0.3","TCP","1516","9002 → 43520 [PSH, ACK] Seq=492117 Ack=31806 Win=65535 Len=1460 [TCP segment of a reassembled PDU]"
"7.956863","172.19.0.3","5.9.29.183","TCP","56","43520 → 9002 [ACK] Seq=31806 Ack=493577 Win=11911 Len=0"
"7.956890","5.9.29.183","172.19.0.3","TLSv1.2","1492","Application Data [TCP segment of a reassembled PDU]"
"7.956896","5.9.29.183","172.19.0.3","TCP","1516","9002 → 43520 [PSH, ACK] Seq=495013 Ack=31806 Win=65535 Len=1460 [TCP segment of a reassembled PDU]"
"7.956940","5.9.29.183","172.19.0.3","TCP","1516","9002 → 43520 [PSH, ACK] Seq=496473 Ack=31806 Win=65535 Len=1460 [TCP segment of a reassembled PDU]"
"7.956951","172.19.0.3","5.9.29.183","TCP","56","43520 → 9002 [ACK] Seq=31806 Ack=496473 Win=11893 Len=0"
"7.957035","5.9.29.183","172.19.0.3","TLSv1.2","1516","Application Data [TCP segment of a reassembled PDU]"
"7.957039","5.9.29.183","172.19.0.3","TCP","1468","9002 → 43520 [PSH, ACK] Seq=499393 Ack=31806 Win=65535 Len=1412 [TCP segment of a reassembled PDU]"
"7.957079","5.9.29.183","172.19.0.3","TCP","67","9002 → 43520 [PSH, ACK] Seq=500805 Ack=31806 Win=65535 Len=11 [TCP segment of a reassembled PDU]"
"7.957084","172.19.0.3","5.9.29.183","TCP","56","43520 → 9002 [ACK] Seq=31806 Ack=500805 Win=11869 Len=0"
"7.957165","5.9.29.183","172.19.0.3","TCP","1493","9002 → 43520 [PSH, ACK] Seq=500816 Ack=31806 Win=65535 Len=1437 [TCP segment of a reassembled PDU]"
"7.957244","172.19.0.3","5.9.29.183","TLSv1.2","599","Application Data"
"7.957403","5.9.29.183","172.19.0.3","TCP","56","9002 → 43520 [ACK] Seq=502253 Ack=32349 Win=65535 Len=0"
"7.959160","5.9.29.183","172.19.0.3","TLSv1.2","381","Application Data"
"7.971928","5.9.29.183","172.19.0.3","TCP","1504","[TCP segment of a reassembled PDU]"
"7.971941","172.19.0.3","5.9.29.183","TCP","56","43520 → 9002 [ACK] Seq=32349 Ack=504026 Win=11911 Len=0"
"7.971972","5.9.29.183","172.19.0.3","TCP","1516","9002 → 43520 [PSH, ACK] Seq=504026 Ack=32349 Win=65535 Len=1460 [TCP segment of a reassembled PDU]"
"7.971979","5.9.29.183","172.19.0.3","TLSv1.2","1492","Application Data [TCP segment of a reassembled PDU]"
"7.972062","172.19.0.3","5.9.29.183","TCP","56","43520 → 9002 [ACK] Seq=32349 Ack=506922 Win=11895 Len=0"
"7.972288","5.9.29.183","172.19.0.3","TCP","1504","9002 → 43520 [PSH, ACK] Seq=506922 Ack=32349 Win=65535 Len=1448 [TCP segment of a reassembled PDU]"
"7.974580","5.9.29.183","172.19.0.3","TLSv1.2","490","Application Data"
"7.974597","172.19.0.3","5.9.29.183","TCP","56","43520 → 9002 [ACK] Seq=32349 Ack=508804 Win=11911 Len=0"
"7.989878","5.9.29.183","172.19.0.3","TCP","1504","[TCP segment of a reassembled PDU]"
"7.989999","5.9.29.183","172.19.0.3","TCP","1516","9002 → 43520 [PSH, ACK] Seq=510252 Ack=32349 Win=65535 Len=1460 [TCP segment of a reassembled PDU]"
"7.990008","5.9.29.183","172.19.0.3","TLSv1.2","1225","Application Data"
"7.990056","5.9.29.183","172.19.0.3","TCP","1516","[TCP segment of a reassembled PDU]"
"7.990061","5.9.29.183","172.19.0.3","TCP","1516","9002 → 43520 [PSH, ACK] Seq=514341 Ack=32349 Win=65535 Len=1460 [TCP segment of a reassembled PDU]"
"7.990063","5.9.29.183","172.19.0.3","TLSv1.2","1480","Application Data [TCP segment of a reassembled PDU]"
"7.990064","5.9.29.183","172.19.0.3","TCP","1516","9002 → 43520 [PSH, ACK] Seq=517225 Ack=32349 Win=65535 Len=1460 [TCP segment of a reassembled PDU]"
"7.990073","5.9.29.183","172.19.0.3","TCP","1492","9002 → 43520 [PSH, ACK] Seq=518685 Ack=32349 Win=65535 Len=1436 [TCP segment of a reassembled PDU]"
"7.990078","172.19.0.3","5.9.29.183","TCP","56","43520 → 9002 [ACK] Seq=32349 Ack=514341 Win=11887 Len=0"
"7.990144","172.19.0.3","5.9.29.183","TCP","56","43520 → 9002 [ACK] Seq=32349 Ack=520121 Win=11853 Len=0"
"7.990594","5.9.29.183","172.19.0.3","TLSv1.2","1516","Application Data [TCP segment of a reassembled PDU]"
"7.990670","5.9.29.183","172.19.0.3","TCP","1516","9002 → 43520 [PSH, ACK] Seq=521581 Ack=32349 Win=65535 Len=1460 [TCP segment of a reassembled PDU]"
"7.990684","172.19.0.3","5.9.29.183","TCP","56","43520 → 9002 [ACK] Seq=32349 Ack=523041 Win=11903 Len=0"
"7.990728","5.9.29.183","172.19.0.3","TCP","1480","9002 → 43520 [PSH, ACK] Seq=523041 Ack=32349 Win=65535 Len=1424 [TCP segment of a reassembled PDU]"
"7.997201","5.9.29.183","172.19.0.3","TLSv1.2","1504","Application Data, Application Data"
"7.997209","172.19.0.3","5.9.29.183","TCP","56","43520 → 9002 [ACK] Seq=32349 Ack=525913 Win=11911 Len=0"
"7.997319","5.9.29.183","172.19.0.3","TCP","1516","9002 → 43520 [PSH, ACK] Seq=525913 Ack=32349 Win=65535 Len=1460 [TCP segment of a reassembled PDU]"
"7.997324","5.9.29.183","172.19.0.3","TCP","1492","9002 → 43520 [PSH, ACK] Seq=527373 Ack=32349 Win=65535 Len=1436 [TCP segment of a reassembled PDU]"
"7.997448","172.19.0.3","5.9.29.183","TLSv1.2","599","Application Data"
"7.997979","5.9.29.183","172.19.0.3","TCP","56","9002 → 43520 [ACK] Seq=528809 Ack=32892 Win=65535 Len=0"
"7.998011","5.9.29.183","172.19.0.3","TLSv1.2","1516","Application Data [TCP segment of a reassembled PDU]"
"7.998093","5.9.29.183","172.19.0.3","TCP","1516","9002 → 43520 [PSH, ACK] Seq=530269 Ack=32892 Win=65535 Len=1460 [TCP segment of a reassembled PDU]"
"7.998101","172.19.0.3","5.9.29.183","TCP","56","43520 → 9002 [ACK] Seq=32892 Ack=531729 Win=11903 Len=0"
"7.998102","5.9.29.183","172.19.0.3","TCP","1480","9002 → 43520 [PSH, ACK] Seq=531729 Ack=32892 Win=65535 Len=1424 [TCP segment of a reassembled PDU]"
"8.005093","5.9.29.183","172.19.0.3","TLSv1.2","611","Application Data, Application Data"
"8.005109","172.19.0.3","5.9.29.183","TCP","56","43520 → 9002 [ACK] Seq=32892 Ack=533708 Win=11911 Len=0"
"8.009651","5.9.29.183","172.19.0.3","TCP","1504","[TCP segment of a reassembled PDU]"
"8.020558","5.9.29.183","172.19.0.3","TLSv1.2","179","Application Data"
"8.020582","172.19.0.3","5.9.29.183","TCP","56","43520 → 9002 [ACK] Seq=32892 Ack=535279 Win=11911 Len=0"
"8.026558","172.19.0.3","5.9.29.183","TLSv1.2","599","Application Data"
"8.026891","5.9.29.183","172.19.0.3","TCP","56","9002 → 43520 [ACK] Seq=535279 Ack=33435 Win=65535 Len=0"
"8.330278","5.9.29.183","172.19.0.3","TLSv1.2","599","Application Data"
"8.330963","172.19.0.3","5.9.29.183","TLSv1.2","599","Application Data"
"8.331157","5.9.29.183","172.19.0.3","TCP","56","9002 → 43520 [ACK] Seq=535822 Ack=33978 Win=65535 Len=0"
"8.639678","5.9.29.183","172.19.0.3","TLSv1.2","599","Application Data"
"8.650735","5.9.29.183","172.19.0.3","TCP","1504","[TCP segment of a reassembled PDU]"
"8.650766","172.19.0.3","5.9.29.183","TCP","56","43520 → 9002 [ACK] Seq=33978 Ack=537813 Win=11911 Len=0"
"8.652985","5.9.29.183","172.19.0.3","TCP","1516","9002 → 43520 [PSH, ACK] Seq=537813 Ack=33978 Win=65535 Len=1460 [TCP segment of a reassembled PDU]"
"8.653045","5.9.29.183","172.19.0.3","TLSv1.2","1492","Application Data [TCP segment of a reassembled PDU]"
"8.653065","5.9.29.183","172.19.0.3","TLSv1.2","1516","Application Data [TCP segment of a reassembled PDU]"
"8.653075","5.9.29.183","172.19.0.3","TCP","1516","9002 → 43520 [PSH, ACK] Seq=542169 Ack=33978 Win=65535 Len=1460 [TCP segment of a reassembled PDU]"
"8.653181","5.9.29.183","172.19.0.3","TCP","1516","9002 → 43520 [PSH, ACK] Seq=543629 Ack=33978 Win=65535 Len=1460 [TCP segment of a reassembled PDU]"
"8.653187","5.9.29.183","172.19.0.3","TLSv1.2","1516","Application Data [TCP segment of a reassembled PDU]"
"8.653189","172.19.0.3","5.9.29.183","TCP","56","43520 → 9002 [ACK] Seq=33978 Ack=543629 Win=11887 Len=0"
"8.653190","5.9.29.183","172.19.0.3","TCP","1456","9002 → 43520 [PSH, ACK] Seq=546549 Ack=33978 Win=65535 Len=1400 [TCP segment of a reassembled PDU]"
"8.653402","172.19.0.3","5.9.29.183","TCP","56","43520 → 9002 [ACK] Seq=33978 Ack=547949 Win=11863 Len=0"
"8.653620","172.19.0.3","5.9.29.183","TLSv1.2","599","Application Data"
"8.653849","5.9.29.183","172.19.0.3","TCP","56","9002 → 43520 [ACK] Seq=547949 Ack=34521 Win=65535 Len=0"
"8.654844","5.9.29.183","172.19.0.3","TCP","1504","9002 → 43520 [PSH, ACK] Seq=547949 Ack=34521 Win=65535 Len=1448 [TCP segment of a reassembled PDU]"
"8.654923","5.9.29.183","172.19.0.3","TLSv1.2","1516","Application Data [TCP segment of a reassembled PDU]"
"8.654935","172.19.0.3","5.9.29.183","TCP","56","43520 → 9002 [ACK] Seq=34521 Ack=550857 Win=11903 Len=0"
"8.654984","5.9.29.183","172.19.0.3","TCP","1492","9002 → 43520 [PSH, ACK] Seq=550857 Ack=34521 Win=65535 Len=1436 [TCP segment of a reassembled PDU]"
"8.670898","5.9.29.183","172.19.0.3","TLSv1.2","1504","Application Data [TCP segment of a reassembled PDU]"
"8.670944","172.19.0.3","5.9.29.183","TCP","56","43520 → 9002 [ACK] Seq=34521 Ack=553741 Win=11911 Len=0"
"8.670986","5.9.29.183","172.19.0.3","TCP","1516","9002 → 43520 [PSH, ACK] Seq=553741 Ack=34521 Win=65535 Len=1460 [TCP segment of a reassembled PDU]"
"8.671001","5.9.29.183","172.19.0.3","TCP","1516","9002 → 43520 [PSH, ACK] Seq=555201 Ack=34521 Win=65535 Len=1460 [TCP segment of a reassembled PDU]"
"8.671008","5.9.29.183","172.19.0.3","TLSv1.2","1480","Application Data [TCP segment of a reassembled PDU]"
"8.671142","172.19.0.3","5.9.29.183","TCP","56","43520 → 9002 [ACK] Seq=34521 Ack=558085 Win=11885 Len=0"
"8.671277","5.9.29.183","172.19.0.3","TLSv1.2","641","Application Data"
"8.675242","172.19.0.3","5.9.29.183","TLSv1.2","599","Application Data"
"8.675751","5.9.29.183","172.19.0.3","TCP","56","9002 → 43520 [ACK] Seq=558670 Ack=35064 Win=65535 Len=0"
"9.069156","5.9.29.183","172.19.0.3","TLSv1.2","599","Application Data"
"9.069738","172.19.0.3","5.9.29.183","TLSv1.2","599","Application Data"
"9.070062","5.9.29.183","172.19.0.3","TCP","56","9002 → 43520 [ACK] Seq=559213 Ack=35607 Win=65535 Len=0"
"9.351661","5.9.29.183","172.19.0.3","TCP","1516","[TCP segment of a reassembled PDU]"
"9.351729","5.9.29.183","172.19.0.3","TCP","1516","9002 → 43520 [PSH, ACK] Seq=560673 Ack=35607 Win=65535 Len=1460 [TCP segment of a reassembled PDU]"
"9.351739","5.9.29.183","172.19.0.3","TLSv1.2","763","Application Data"
"9.351934","172.19.0.3","5.9.29.183","TCP","56","43520 → 9002 [ACK] Seq=35607 Ack=562840 Win=11893 Len=0"
"9.362182","5.9.29.183","172.19.0.3","TCP","1504","[TCP segment of a reassembled PDU]"
"9.362379","5.9.29.183","172.19.0.3","TCP","1504","9002 → 43520 [PSH, ACK] Seq=564288 Ack=35607 Win=65535 Len=1448 [TCP segment of a reassembled PDU]"
"9.362489","172.19.0.3","5.9.29.183","TCP","56","43520 → 9002 [ACK] Seq=35607 Ack=565736 Win=11903 Len=0"
"9.362528","5.9.29.183","172.19.0.3","TCP","672","9002 → 43520 [PSH, ACK] Seq=565736 Ack=35607 Win=65535 Len=616 [TCP segment of a reassembled PDU]"
"9.362601","5.9.29.183","172.19.0.3","TLSv1.2","888","Application Data [TCP segment of a reassembled PDU]"
"9.362875","172.19.0.3","5.9.29.183","TCP","56","43520 → 9002 [ACK] Seq=35607 Ack=567184 Win=11911 Len=0"
"9.364219","5.9.29.183","172.19.0.3","TLSv1.2","1504","Application Data [TCP segment of a reassembled PDU]"
"9.364303","5.9.29.183","172.19.0.3","TCP","1504","9002 → 43520 [PSH, ACK] Seq=568632 Ack=35607 Win=65535 Len=1448 [TCP segment of a reassembled PDU]"
"9.364361","172.19.0.3","5.9.29.183","TCP","56","43520 → 9002 [ACK] Seq=35607 Ack=570080 Win=11903 Len=0"
"9.366942","5.9.29.183","172.19.0.3","TLSv1.2","1127","Application Data"
"9.379443","5.9.29.183","172.19.0.3","TCP","1504","[TCP segment of a reassembled PDU]"
"9.379473","172.19.0.3","5.9.29.183","TCP","56","43520 → 9002 [ACK] Seq=35607 Ack=572599 Win=11911 Len=0"
"9.379654","5.9.29.183","172.19.0.3","TCP","1504","9002 → 43520 [PSH, ACK] Seq=572599 Ack=35607 Win=65535 Len=1448 [TCP segment of a reassembled PDU]"
"9.382186","5.9.29.183","172.19.0.3","TLSv1.2","787","Application Data"
"9.382195","172.19.0.3","5.9.29.183","TCP","56","43520 → 9002 [ACK] Seq=35607 Ack=574778 Win=11911 Len=0"
"9.390197","5.9.29.183","172.19.0.3","TCP","1516","[TCP segment of a reassembled PDU]"
"9.390242","5.9.29.183","172.19.0.3","TCP","1516","9002 → 43520 [PSH, ACK] Seq=576238 Ack=35607 Win=65535 Len=1460 [TCP segment of a reassembled PDU]"
"9.390248","5.9.29.183","172.19.0.3","TLSv1.2","1516","Application Data [TCP segment of a reassembled PDU]"
"9.390250","5.9.29.183","172.19.0.3","TLSv1.2","1516","Application Data [TCP segment of a reassembled PDU]"
"9.390254","5.9.29.183","172.19.0.3","TCP","1456","9002 → 43520 [PSH, ACK] Seq=580618 Ack=35607 Win=65535 Len=1400 [TCP segment of a reassembled PDU]"
"9.390421","172.19.0.3","5.9.29.183","TCP","56","43520 → 9002 [ACK] Seq=35607 Ack=582018 Win=11879 Len=0"
"9.390472","5.9.29.183","172.19.0.3","TCP","1516","9002 → 43520 [PSH, ACK] Seq=582018 Ack=35607 Win=65535 Len=1460 [TCP segment of a reassembled PDU]"
"9.390477","5.9.29.183","172.19.0.3","TLSv1.2","1516","Application Data [TCP segment of a reassembled PDU]"
"9.390513","172.19.0.3","5.9.29.183","TCP","56","43520 → 9002 [ACK] Seq=35607 Ack=584938 Win=11863 Len=0"
"9.390532","5.9.29.183","172.19.0.3","TCP","1480","9002 → 43520 [PSH, ACK] Seq=584938 Ack=35607 Win=65535 Len=1424 [TCP segment of a reassembled PDU]"
"9.390600","5.9.29.183","172.19.0.3","TLSv1.2","1516","Application Data [TCP segment of a reassembled PDU]"
"9.390604","5.9.29.183","172.19.0.3","TCP","1516","9002 → 43520 [PSH, ACK] Seq=587822 Ack=35607 Win=65535 Len=1460 [TCP segment of a reassembled PDU]"
"9.390607","5.9.29.183","172.19.0.3","TCP","1516","9002 → 43520 [PSH, ACK] Seq=589282 Ack=35607 Win=65535 Len=1460 [TCP segment of a reassembled PDU]"
"9.390615","5.9.29.183","172.19.0.3","TLSv1.2","1468","Application Data [TCP segment of a reassembled PDU]"
"9.390682","172.19.0.3","5.9.29.183","TCP","56","43520 → 9002 [ACK] Seq=35607 Ack=592154 Win=11820 Len=0"
"9.391036","172.19.0.3","5.9.29.183","TLSv1.2","599","Application Data"
"9.391180","5.9.29.183","172.19.0.3","TCP","56","9002 → 43520 [ACK] Seq=592154 Ack=36150 Win=65535 Len=0"
"9.397612","5.9.29.183","172.19.0.3","TCP","1516","9002 → 43520 [PSH, ACK] Seq=592154 Ack=36150 Win=65535 Len=1460 [TCP segment of a reassembled PDU]"
"9.397663","5.9.29.183","172.19.0.3","TLSv1.2","1440","Application Data"
"9.397678","172.19.0.3","5.9.29.183","TCP","56","43520 → 9002 [ACK] Seq=36150 Ack=594998 Win=11903 Len=0"
"9.403114","172.19.0.3","5.9.29.183","TLSv1.2","599","Application Data"
"9.403587","5.9.29.183","172.19.0.3","TCP","56","9002 → 43520 [ACK] Seq=594998 Ack=36693 Win=65535 Len=0"
"9.404791","5.9.29.183","172.19.0.3","TCP","1504","[TCP segment of a reassembled PDU]"
"9.404933","5.9.29.183","172.19.0.3","TCP","1516","9002 → 43520 [PSH, ACK] Seq=596446 Ack=36693 Win=65535 Len=1460 [TCP segment of a reassembled PDU]"
"9.404943","5.9.29.183","172.19.0.3","TLSv1.2","1516","Application Data [TCP segment of a reassembled PDU]"
"9.404947","5.9.29.183","172.19.0.3","TCP","1480","9002 → 43520 [PSH, ACK] Seq=599366 Ack=36693 Win=65535 Len=1424 [TCP segment of a reassembled PDU]"
"9.404985","172.19.0.3","5.9.29.183","TCP","56","43520 → 9002 [ACK] Seq=36693 Ack=600790 Win=11887 Len=0"
"9.405926","5.9.29.183","172.19.0.3","TCP","1504","9002 → 43520 [PSH, ACK] Seq=600790 Ack=36693 Win=65535 Len=1448 [TCP segment of a reassembled PDU]"
"9.406054","5.9.29.183","172.19.0.3","TLSv1.2","1516","Application Data [TCP segment of a reassembled PDU]"
"9.406072","172.19.0.3","5.9.29.183","TCP","56","43520 → 9002 [ACK] Seq=36693 Ack=603698 Win=11903 Len=0"
"9.406076","5.9.29.183","172.19.0.3","TCP","1516","9002 → 43520 [PSH, ACK] Seq=603698 Ack=36693 Win=65535 Len=1460 [TCP segment of a reassembled PDU]"
"9.406177","5.9.29.183","172.19.0.3","TCP","1480","9002 → 43520 [PSH, ACK] Seq=605158 Ack=36693 Win=65535 Len=1424 [TCP segment of a reassembled PDU]"
"9.406240","172.19.0.3","5.9.29.183","TCP","56","43520 → 9002 [ACK] Seq=36693 Ack=606582 Win=11887 Len=0"
"9.412603","5.9.29.183","172.19.0.3","TLSv1.2","924","Application Data, Application Data"
"9.418352","5.9.29.183","172.19.0.3","TCP","1516","[TCP segment of a reassembled PDU]"
"9.418373","172.19.0.3","5.9.29.183","TCP","56","43520 → 9002 [ACK] Seq=36693 Ack=608910 Win=11911 Len=0"
"9.418421","5.9.29.183","172.19.0.3","TCP","1516","9002 → 43520 [PSH, ACK] Seq=608910 Ack=36693 Win=65535 Len=1460 [TCP segment of a reassembled PDU]"
"9.418433","5.9.29.183","172.19.0.3","TLSv1.2","1516","Application Data [TCP segment of a reassembled PDU]"
"9.418438","5.9.29.183","172.19.0.3","TCP","1468","9002 → 43520 [PSH, ACK] Seq=611830 Ack=36693 Win=65535 Len=1412 [TCP segment of a reassembled PDU]"
"9.418600","172.19.0.3","5.9.29.183","TCP","56","43520 → 9002 [ACK] Seq=36693 Ack=613242 Win=11887 Len=0"
"9.419007","172.19.0.3","5.9.29.183","TLSv1.2","599","Application Data"
"9.419259","5.9.29.183","172.19.0.3","TCP","56","9002 → 43520 [ACK] Seq=613242 Ack=37236 Win=65535 Len=0"
"9.427798","5.9.29.183","172.19.0.3","TLSv1.2","1004","Application Data"
"9.431369","172.19.0.3","5.9.29.183","TLSv1.2","599","Application Data"
"9.431601","5.9.29.183","172.19.0.3","TCP","56","9002 → 43520 [ACK] Seq=614190 Ack=37779 Win=65535 Len=0"
"9.737402","5.9.29.183","172.19.0.3","TLSv1.2","599","Application Data"
"9.738387","172.19.0.3","5.9.29.183","TLSv1.2","599","Application Data"
"9.738710","5.9.29.183","172.19.0.3","TCP","56","9002 → 43520 [ACK] Seq=614733 Ack=38322 Win=65535 Len=0"
"10.069866","5.9.29.183","172.19.0.3","TCP","1516","[TCP segment of a reassembled PDU]"
"10.070069","5.9.29.183","172.19.0.3","TCP","1492","9002 → 43520 [PSH, ACK] Seq=616193 Ack=38322 Win=65535 Len=1436 [TCP segment of a reassembled PDU]"
"10.070088","172.19.0.3","5.9.29.183","TCP","56","43520 → 9002 [ACK] Seq=38322 Ack=617629 Win=11911 Len=0"
"10.070139","5.9.29.183","172.19.0.3","TLSv1.2","787","Application Data"
"10.089383","5.9.29.183","172.19.0.3","TCP","1516","[TCP segment of a reassembled PDU]"
"10.089446","5.9.29.183","172.19.0.3","TCP","1492","9002 → 43520 [PSH, ACK] Seq=619820 Ack=38322 Win=65535 Len=1436 [TCP segment of a reassembled PDU]"
"10.089792","172.19.0.3","5.9.29.183","TCP","56","43520 → 9002 [ACK] Seq=38322 Ack=621256 Win=11901 Len=0"
"10.090142","5.9.29.183","172.19.0.3","TLSv1.2","1516","Application Data [TCP segment of a reassembled PDU]"
"10.090191","5.9.29.183","172.19.0.3","TCP","1516","9002 → 43520 [PSH, ACK] Seq=622716 Ack=38322 Win=65535 Len=1460 [TCP segment of a reassembled PDU]"
"10.090204","172.19.0.3","5.9.29.183","TCP","56","43520 → 9002 [ACK] Seq=38322 Ack=624176 Win=11903 Len=0"
"10.090207","5.9.29.183","172.19.0.3","TCP","1213","9002 → 43520 [PSH, ACK] Seq=624176 Ack=38322 Win=65535 Len=1157 [TCP segment of a reassembled PDU]"
"10.105330","5.9.29.183","172.19.0.3","TLSv1.2","1504","Application Data [TCP segment of a reassembled PDU]"
"10.105349","172.19.0.3","5.9.29.183","TCP","56","43520 → 9002 [ACK] Seq=38322 Ack=626781 Win=11911 Len=0"
"10.105388","5.9.29.183","172.19.0.3","TCP","1516","9002 → 43520 [PSH, ACK] Seq=626781 Ack=38322 Win=65535 Len=1460 [TCP segment of a reassembled PDU]"
"10.105397","5.9.29.183","172.19.0.3","TCP","1492","9002 → 43520 [PSH, ACK] Seq=628241 Ack=38322 Win=65535 Len=1436 [TCP segment of a reassembled PDU]"
"10.105539","172.19.0.3","5.9.29.183","TCP","56","43520 → 9002 [ACK] Seq=38322 Ack=629677 Win=11895 Len=0"
"10.105686","5.9.29.183","172.19.0.3","TLSv1.2","677","Application Data, Application Data"
"10.113690","5.9.29.183","172.19.0.3","TCP","1504","[TCP segment of a reassembled PDU]"
"10.113715","172.19.0.3","5.9.29.183","TCP","56","43520 → 9002 [ACK] Seq=38322 Ack=631746 Win=11911 Len=0"
"10.114064","5.9.29.183","172.19.0.3","TCP","198","9002 → 43520 [PSH, ACK] Seq=631746 Ack=38322 Win=65535 Len=142 [TCP segment of a reassembled PDU]"
"10.114071","5.9.29.183","172.19.0.3","TCP","1516","9002 → 43520 [PSH, ACK] Seq=631888 Ack=38322 Win=65535 Len=1460 [TCP segment of a reassembled PDU]"
"10.114074","5.9.29.183","172.19.0.3","TLSv1.2","1350","Application Data [TCP segment of a reassembled PDU]"
"10.114097","172.19.0.3","5.9.29.183","TCP","56","43520 → 9002 [ACK] Seq=38322 Ack=634642 Win=11895 Len=0"
"10.120807","5.9.29.183","172.19.0.3","TLSv1.2","910","Application Data"
"10.129123","5.9.29.183","172.19.0.3","TCP","1516","[TCP segment of a reassembled PDU]"
"10.129138","172.19.0.3","5.9.29.183","TCP","56","43520 → 9002 [ACK] Seq=38322 Ack=636956 Win=11911 Len=0"
"10.129166","5.9.29.183","172.19.0.3","TCP","1492","9002 → 43520 [PSH, ACK] Seq=636956 Ack=38322 Win=65535 Len=1436 [TCP segment of a reassembled PDU]"
"10.136543","5.9.29.183","172.19.0.3","TLSv1.2","787","Application Data"
"10.136568","172.19.0.3","5.9.29.183","TCP","56","43520 → 9002 [ACK] Seq=38322 Ack=639123 Win=11911 Len=0"
"10.137491","5.9.29.183","172.19.0.3","TCP","1504","[TCP segment of a reassembled PDU]"
"10.137951","5.9.29.183","172.19.0.3","TCP","1516","9002 → 43520 [PSH, ACK] Seq=640571 Ack=38322 Win=65535 Len=1460 [TCP segment of a reassembled PDU]"
"10.137960","172.19.0.3","5.9.29.183","TCP","56","43520 → 9002 [ACK] Seq=38322 Ack=642031 Win=11911 Len=0"
"10.138022","5.9.29.183","172.19.0.3","TLSv1.2","1516","Application Data [TCP segment of a reassembled PDU]"
"10.138062","5.9.29.183","172.19.0.3","TCP","1480","9002 → 43520 [PSH, ACK] Seq=643491 Ack=38322 Win=65535 Len=1424 [TCP segment of a reassembled PDU]"
"10.138069","5.9.29.183","172.19.0.3","TCP","1504","9002 → 43520 [PSH, ACK] Seq=644915 Ack=38322 Win=65535 Len=1448 [TCP segment of a reassembled PDU]"
"10.138116","172.19.0.3","5.9.29.183","TCP","56","43520 → 9002 [ACK] Seq=38322 Ack=646363 Win=11885 Len=0"
"10.138354","172.19.0.3","5.9.29.183","TLSv1.2","599","Application Data"
"10.138557","5.9.29.183","172.19.0.3","TCP","56","9002 → 43520 [ACK] Seq=646363 Ack=38865 Win=65535 Len=0"
"10.151813","5.9.29.183","172.19.0.3","TLSv1.2","70","Application Data"
"10.193069","172.19.0.3","5.9.29.183","TCP","56","43520 → 9002 [ACK] Seq=38865 Ack=646377 Win=11911 Len=0"
