_ws.col.Time,_ws.col.Source,_ws.col.Destination,_ws.col.Protocol,_ws.col.Length,_ws.col.Info
"0.000000","172.19.0.3","5.9.29.183","TLSv1.2","599","Application Data"
"0.000316","5.9.29.183","172.19.0.3","TCP","56","9002 → 43520 [ACK] Seq=1 Ack=544 Win=65535 Len=0"
"0.191338","5.9.29.183","172.19.0.3","TLSv1.2","599","Application Data"
"0.192265","172.19.0.3","5.9.29.183","TLSv1.2","2141","Application Data"
"0.192649","5.9.29.183","172.19.0.3","TCP","56","9002 → 43520 [ACK] Seq=544 Ack=2629 Win=65535 Len=0"
"0.573356","5.9.29.183","172.19.0.3","TLSv1.2","599","Application Data"
"0.614364","172.19.0.3","5.9.29.183","TCP","56","43520 → 9002 [ACK] Seq=2629 Ack=1087 Win=12738 Len=0"
"0.707905","5.9.29.183","172.19.0.3","TLSv1.2","1113","Application Data"
"0.707928","172.19.0.3","5.9.29.183","TCP","56","43520 → 9002 [ACK] Seq=2629 Ack=2144 Win=12738 Len=0"
"0.712455","172.19.0.3","5.9.29.183","TLSv1.2","599","Application Data"
"0.712820","5.9.29.183","172.19.0.3","TCP","56","9002 → 43520 [ACK] Seq=2144 Ack=3172 Win=65535 Len=0"
"0.959998","5.9.29.183","172.19.0.3","TLSv1.2","599","Application Data"
"0.960974","172.19.0.3","5.9.29.183","TLSv1.2","599","Application Data"
"0.961359","5.9.29.183","172.19.0.3","TCP","56","9002 → 43520 [ACK] Seq=2687 Ack=3715 Win=65535 Len=0"
"1.248516","5.9.29.183","172.19.0.3","TLSv1.2","599","Application Data"
"1.292916","172.19.0.3","5.9.29.183","TCP","56","43520 → 9002 [ACK] Seq=3715 Ack=3230 Win=12738 Len=0"
"1.293454","5.9.29.183","172.19.0.3","TCP","1516","[TCP segment of a reassembled PDU]"
"1.293476","172.19.0.3","5.9.29.183","TCP","56","43520 → 9002 [ACK] Seq=3715 Ack=4690 Win=12738 Len=0"
"1.293589","5.9.29.183","172.19.0.3","TCP","1492","9002 → 43520 [PSH, ACK] Seq=4690 Ack=3715 Win=65535 Len=1436 [TCP segment of a reassembled PDU]"
"1.293607","172.19.0.3","5.9.29.183","TCP","56","43520 → 9002 [ACK] Seq=3715 Ack=6126 Win=12730 Len=0"
"1.293752","5.9.29.183","172.19.0.3","TLSv1.2","787","Application Data"
"1.293764","172.19.0.3","5.9.29.183","TCP","56","43520 → 9002 [ACK] Seq=3715 Ack=6857 Win=12738 Len=0"
"1.329429","5.9.29.183","172.19.0.3","TCP","1504","[TCP segment of a reassembled PDU]"
"1.329466","172.19.0.3","5.9.29.183","TCP","56","43520 → 9002 [ACK] Seq=3715 Ack=8305 Win=12738 Len=0"
"1.329644","5.9.29.183","172.19.0.3","TCP","1504","9002 → 43520 [PSH, ACK] Seq=8305 Ack=3715 Win=65535 Len=1448 [TCP segment of a reassembled PDU]"
"1.329655","172.19.0.3","5.9.29.183","TCP","56","43520 → 9002 [ACK] Seq=3715 Ack=9753 Win=12730 Len=0"
"1.329734","5.9.29.183","172.19.0.3","TLSv1.2","1237","Application Data"
"1.329743","172.19.0.3","5.9.29.183","TCP","56","43520 → 9002 [ACK] Seq=3715 Ack=10934 Win=12738 Len=0"
"1.345195","5.9.29.183","172.19.0.3","TLSv1.2","149","Application Data"
"1.345220","172.19.0.3","5.9.29.183","TCP","56","43520 → 9002 [ACK] Seq=3715 Ack=11027 Win=12738 Len=0"
"1.360298","5.9.29.183","172.19.0.3","TCP","1516","[TCP segment of a reassembled PDU]"
"1.360321","172.19.0.3","5.9.29.183","TCP","56","43520 → 9002 [ACK] Seq=3715 Ack=12487 Win=12736 Len=0"
"1.360392","5.9.29.183","172.19.0.3","TCP","1492","9002 → 43520 [PSH, ACK] Seq=12487 Ack=3715 Win=65535 Len=1436 [TCP segment of a reassembled PDU]"
"1.360405","172.19.0.3","5.9.29.183","TCP","56","43520 → 9002 [ACK] Seq=3715 Ack=13923 Win=12728 Len=0"
"1.360408","5.9.29.183","172.19.0.3","TLSv1.2","787","Application Data"
"1.360414","172.19.0.3","5.9.29.183","TCP","56","43520 → 9002 [ACK] Seq=3715 Ack=14654 Win=12723 Len=0"
"1.409102","5.9.29.183","172.19.0.3","TLSv1.2","1113","Application Data"
"1.409127","172.19.0.3","5.9.29.183","TCP","56","43520 → 9002 [ACK] Seq=3715 Ack=15711 Win=12738 Len=0"
"1.413526","172.19.0.3","5.9.29.183","TLSv1.2","599","Application Data"
"1.413783","5.9.29.183","172.19.0.3","TCP","56","9002 → 43520 [ACK] Seq=15711 Ack=4258 Win=65535 Len=0"
"1.690081","5.9.29.183","172.19.0.3","TLSv1.2","599","Application Data"
"1.690993","172.19.0.3","5.9.29.183","TLSv1.2","599","Application Data"
"1.691345","5.9.29.183","172.19.0.3","TCP","56","9002 → 43520 [ACK] Seq=16254 Ack=4801 Win=65535 Len=0"
"1.962323","5.9.29.183","172.19.0.3","TCP","1516","[TCP segment of a reassembled PDU]"
"1.962428","5.9.29.183","172.19.0.3","TCP","1492","9002 → 43520 [PSH, ACK] Seq=17714 Ack=4801 Win=65535 Len=1436 [TCP segment of a reassembled PDU]"
"1.962442","5.9.29.183","172.19.0.3","TLSv1.2","787","Application Data"
"1.962576","172.19.0.3","5.9.29.183","TCP","56","43520 → 9002 [ACK] Seq=4801 Ack=19881 Win=12722 Len=0"
"1.976569","5.9.29.183","172.19.0.3","TCP","1516","[TCP segment of a reassembled PDU]"
"1.976628","5.9.29.183","172.19.0.3","TCP","1492","9002 → 43520 [PSH, ACK] Seq=21341 Ack=4801 Win=65535 Len=1436 [TCP segment of a reassembled PDU]"
"1.976650","172.19.0.3","5.9.29.183","TCP","56","43520 → 9002 [ACK] Seq=4801 Ack=22777 Win=12730 Len=0"
"1.978005","5.9.29.183","172.19.0.3","TLSv1.2","1330","Application Data, Application Data"
"2.021356","172.19.0.3","5.9.29.183","TCP","56","43520 → 9002 [ACK] Seq=4801 Ack=24051 Win=12738 Len=0"
"2.069560","5.9.29.183","172.19.0.3","TCP","1396","[TCP segment of a reassembled PDU]"
"2.069583","172.19.0.3","5.9.29.183","TCP","56","43520 → 9002 [ACK] Seq=4801 Ack=25391 Win=12736 Len=0"
"2.069643","5.9.29.183","172.19.0.3","TCP","1516","9002 → 43520 [PSH, ACK] Seq=25391 Ack=4801 Win=65535 Len=1460 [TCP segment of a reassembled PDU]"
"2.069661","172.19.0.3","5.9.29.183","TCP","56","43520 → 9002 [ACK] Seq=4801 Ack=26851 Win=12728 Len=0"
"2.069663","5.9.29.183","172.19.0.3","TLSv1.2","883","Application Data"
"2.069669","172.19.0.3","5.9.29.183","TCP","56","43520 → 9002 [ACK] Seq=4801 Ack=27678 Win=12722 Len=0"
"2.070118","172.19.0.3","5.9.29.183","TLSv1.2","599","Application Data"
"2.070465","5.9.29.183","172.19.0.3","TCP","56","9002 → 43520 [ACK] Seq=27678 Ack=5344 Win=65535 Len=0"
"2.081807","5.9.29.183","172.19.0.3","TCP","1504","[TCP segment of a reassembled PDU]"
"2.082098","5.9.29.183","172.19.0.3","TCP","1504","9002 → 43520 [PSH, ACK] Seq=29126 Ack=5344 Win=65535 Len=1448 [TCP segment of a reassembled PDU]"
"2.082110","172.19.0.3","5.9.29.183","TCP","56","43520 → 9002 [ACK] Seq=5344 Ack=30574 Win=12738 Len=0"
"2.084634","5.9.29.183","172.19.0.3","TLSv1.2","787","Application Data"
"2.093455","5.9.29.183","172.19.0.3","TCP","1504","[TCP segment of a reassembled PDU]"
"2.093482","172.19.0.3","5.9.29.183","TCP","56","43520 → 9002 [ACK] Seq=5344 Ack=32753 Win=12738 Len=0"
"2.100079","5.9.29.183","172.19.0.3","TLSv1.2","1207","Application Data"
"2.103989","172.19.0.3","5.9.29.183","TLSv1.2","599","Application Data"
"2.104314","5.9.29.183","172.19.0.3","TCP","56","9002 → 43520 [ACK] Seq=33904 Ack=5887 Win=65535 Len=0"
"2.505144","5.9.29.183","172.19.0.3","TLSv1.2","599","Application Data"
"2.506140","172.19.0.3","5.9.29.183","TLSv1.2","599","Application Data"
"2.506505","5.9.29.183","172.19.0.3","TCP","56","9002 → 43520 [ACK] Seq=34447 Ack=6430 Win=65535 Len=0"
"2.849034","5.9.29.183","172.19.0.3","TLSv1.2","599","Application Data"
"2.857109","5.9.29.183","172.19.0.3","TCP","1504","[TCP segment of a reassembled PDU]"
"2.857134","172.19.0.3","5.9.29.183","TCP","56","43520 → 9002 [ACK] Seq=6430 Ack=36438 Win=12738 Len=0"
"2.857198","5.9.29.183","172.19.0.3","TCP","1504","9002 → 43520 [PSH, ACK] Seq=36438 Ack=6430 Win=65535 Len=1448 [TCP segment of a reassembled PDU]"
"2.864230","5.9.29.183","172.19.0.3","TLSv1.2","787","Application Data"
"2.864255","172.19.0.3","5.9.29.183","TCP","56","43520 → 9002 [ACK] Seq=6430 Ack=38617 Win=12738 Len=0"
"2.870032","5.9.29.183","172.19.0.3","TCP","1516","[TCP segment of a reassembled PDU]"
"2.870106","5.9.29.183","172.19.0.3","TCP","1492","9002 → 43520 [PSH, ACK] Seq=40077 Ack=6430 Win=65535 Len=1436 [TCP segment of a reassembled PDU]"
"2.870359","172.19.0.3","5.9.29.183","TCP","56","43520 → 9002 [ACK] Seq=6430 Ack=41513 Win=12730 Len=0"
"2.879674","5.9.29.183","172.19.0.3","TLSv1.2","1330","Application Data, Application Data"
"2.920481","172.19.0.3","5.9.29.183","TCP","56","43520 → 9002 [ACK] Seq=6430 Ack=42787 Win=12738 Len=0"
"2.961540","5.9.29.183","172.19.0.3","TCP","1516","[TCP segment of a reassembled PDU]"
"2.961565","172.19.0.3","5.9.29.183","TCP","56","43520 → 9002 [ACK] Seq=6430 Ack=44247 Win=12738 Len=0"
"2.961646","5.9.29.183","172.19.0.3","TCP","1492","9002 → 43520 [PSH, ACK] Seq=44247 Ack=6430 Win=65535 Len=1436 [TCP segment of a reassembled PDU]"
"2.961663","172.19.0.3","5.9.29.183","TCP","56","43520 → 9002 [ACK] Seq=6430 Ack=45683 Win=12730 Len=0"
"2.961740","5.9.29.183","172.19.0.3","TLSv1.2","787","Application Data"
"2.961749","172.19.0.3","5.9.29.183","TCP","56","43520 → 9002 [ACK] Seq=6430 Ack=46414 Win=12725 Len=0"
"2.968158","5.9.29.183","172.19.0.3","TCP","1516","[TCP segment of a reassembled PDU]"
"2.968181","172.19.0.3","5.9.29.183","TCP","56","43520 → 9002 [ACK] Seq=6430 Ack=47874 Win=12738 Len=0"
"2.968281","5.9.29.183","172.19.0.3","TCP","1492","9002 → 43520 [PSH, ACK] Seq=47874 Ack=6430 Win=65535 Len=1436 [TCP segment of a reassembled PDU]"
"2.968295","172.19.0.3","5.9.29.183","TCP","56","43520 → 9002 [ACK] Seq=6430 Ack=49310 Win=12730 Len=0"
"2.968298","5.9.29.183","172.19.0.3","TLSv1.2","1516","Application Data [TCP segment of a reassembled PDU]"
"2.968303","172.19.0.3","5.9.29.183","TCP","56","43520 → 9002 [ACK] Seq=6430 Ack=50770 Win=12722 Len=0"
"2.968305","5.9.29.183","172.19.0.3","TCP","1492","9002 → 43520 [PSH, ACK] Seq=50770 Ack=6430 Win=65535 Len=1436 [TCP segment of a reassembled PDU]"
"2.968314","172.19.0.3","5.9.29.183","TCP","56","43520 → 9002 [ACK] Seq=6430 Ack=52206 Win=12714 Len=0"
"2.968480","5.9.29.183","172.19.0.3","TCP","1516","9002 → 43520 [PSH, ACK] Seq=52206 Ack=6430 Win=65535 Len=1460 [TCP segment of a reassembled PDU]"
"2.968489","172.19.0.3","5.9.29.183","TCP","56","43520 → 9002 [ACK] Seq=6430 Ack=53666 Win=12706 Len=0"
"2.968491","5.9.29.183","172.19.0.3","TLSv1.2","1516","Application Data [TCP segment of a reassembled PDU]"
"2.968498","172.19.0.3","5.9.29.183","TCP","56","43520 → 9002 [ACK] Seq=6430 Ack=55126 Win=12698 Len=0"
"2.968499","5.9.29.183","172.19.0.3","TCP","1480","9002 → 43520 [PSH, ACK] Seq=55126 Ack=6430 Win=65535 Len=1424 [TCP segment of a reassembled PDU]"
"2.968504","172.19.0.3","5.9.29.183","TCP","56","43520 → 9002 [ACK] Seq=6430 Ack=56550 Win=12688 Len=0"
"2.976853","5.9.29.183","172.19.0.3","TCP","1504","9002 → 43520 [PSH, ACK] Seq=56550 Ack=6430 Win=65535 Len=1448 [TCP segment of a reassembled PDU]"
"2.976877","172.19.0.3","5.9.29.183","TCP","56","43520 → 9002 [ACK] Seq=6430 Ack=57998 Win=12738 Len=0"
"2.976939","5.9.29.183","172.19.0.3","TLSv1.2","924","Application Data, Application Data"
"2.976956","172.19.0.3","5.9.29.183","TCP","56","43520 → 9002 [ACK] Seq=6430 Ack=58866 Win=12732 Len=0"
"2.981119","5.9.29.183","172.19.0.3","TCP","1516","[TCP segment of a reassembled PDU]"
"2.981193","5.9.29.183","172.19.0.3","TCP","1492","9002 → 43520 [PSH, ACK] Seq=60326 Ack=6430 Win=65535 Len=1436 [TCP segment of a reassembled PDU]"
"2.981368","172.19.0.3","5.9.29.183","TCP","56","43520 → 9002 [ACK] Seq=6430 Ack=61762 Win=12730 Len=0"
"2.992681","5.9.29.183","172.19.0.3","TLSv1.2","787","Application Data"
"2.992936","172.19.0.3","5.9.29.183","TCP","56","43520 → 9002 [ACK] Seq=6430 Ack=62493 Win=12738 Len=0"
"2.993238","172.19.0.3","5.9.29.183","TLSv1.2","599","Application Data"
"2.993610","5.9.29.183","172.19.0.3","TCP","56","9002 → 43520 [ACK] Seq=62493 Ack=6973 Win=65535 Len=0"
"3.024383","5.9.29.183","172.19.0.3","TLSv1.2","1113","Application Data"
"3.057505","5.9.29.183","172.19.0.3","TCP","1504","[TCP segment of a reassembled PDU]"
"3.057563","172.19.0.3","5.9.29.183","TCP","56","43520 → 9002 [ACK] Seq=6973 Ack=64998 Win=12738 Len=0"
"3.057612","5.9.29.183","172.19.0.3","TCP","1504","9002 → 43520 [PSH, ACK] Seq=64998 Ack=6973 Win=65535 Len=1448 [TCP segment of a reassembled PDU]"
"3.057686","5.9.29.183","172.19.0.3","TLSv1.2","787","Application Data"
"3.057765","172.19.0.3","5.9.29.183","TCP","56","43520 → 9002 [ACK] Seq=6973 Ack=67177 Win=12722 Len=0"
"3.067569","5.9.29.183","172.19.0.3","TCP","1516","[TCP segment of a reassembled PDU]"
"3.067663","5.9.29.183","172.19.0.3","TCP","1516","9002 → 43520 [PSH, ACK] Seq=68637 Ack=6973 Win=65535 Len=1460 [TCP segment of a reassembled PDU]"
"3.067681","172.19.0.3","5.9.29.183","TCP","56","43520 → 9002 [ACK] Seq=6973 Ack=70097 Win=12730 Len=0"
"3.067685","5.9.29.183","172.19.0.3","TLSv1.2","1480","Application Data [TCP segment of a reassembled PDU]"
"3.067779","5.9.29.183","172.19.0.3","TCP","1516","9002 → 43520 [PSH, ACK] Seq=71521 Ack=6973 Win=65535 Len=1460 [TCP segment of a reassembled PDU]"
"3.067783","5.9.29.183","172.19.0.3","TCP","1516","9002 → 43520 [PSH, ACK] Seq=72981 Ack=6973 Win=65535 Len=1460 [TCP segment of a reassembled PDU]"
"3.067785","5.9.29.183","172.19.0.3","TLSv1.2","1516","Application Data [TCP segment of a reassembled PDU]"
"3.067787","5.9.29.183","172.19.0.3","TCP","1516","9002 → 43520 [PSH, ACK] Seq=75901 Ack=6973 Win=65535 Len=1460 [TCP segment of a reassembled PDU]"
"3.067789","5.9.29.183","172.19.0.3","TCP","1456","9002 → 43520 [PSH, ACK] Seq=77361 Ack=6973 Win=65535 Len=1400 [TCP segment of a reassembled PDU]"
"3.067813","172.19.0.3","5.9.29.183","TCP","56","43520 → 9002 [ACK] Seq=6973 Ack=78761 Win=12682 Len=0"
"3.072673","5.9.29.183","172.19.0.3","TLSv1.2","381","Application Data"
"3.080287","5.9.29.183","172.19.0.3","TCP","1504","[TCP segment of a reassembled PDU]"
"3.080312","172.19.0.3","5.9.29.183","TCP","56","43520 → 9002 [ACK] Seq=6973 Ack=80534 Win=12738 Len=0"
"3.088033","5.9.29.183","172.19.0.3","TLSv1.2","179","Application Data"
"3.088476","172.19.0.3","5.9.29.183","TLSv1.2","599","Application Data"
"3.088778","5.9.29.183","172.19.0.3","TCP","56","9002 → 43520 [ACK] Seq=80657 Ack=7516 Win=65535 Len=0"
"3.133377","5.9.29.183","172.19.0.3","TCP","1516","[TCP segment of a reassembled PDU]"
"3.133442","5.9.29.183","172.19.0.3","TLSv1.2","1195","Application Data"
"3.133590","172.19.0.3","5.9.29.183","TCP","56","43520 → 9002 [ACK] Seq=7516 Ack=83256 Win=12730 Len=0"
"3.138692","172.19.0.3","5.9.29.183","TLSv1.2","599","Application Data"
"3.138937","5.9.29.183","172.19.0.3","TCP","56","9002 → 43520 [ACK] Seq=83256 Ack=8059 Win=65535 Len=0"
"3.490187","5.9.29.183","172.19.0.3","TLSv1.2","599","Application Data"
"3.491149","172.19.0.3","5.9.29.183","TLSv1.2","599","Application Data"
"3.491518","5.9.29.183","172.19.0.3","TCP","56","9002 → 43520 [ACK] Seq=83799 Ack=8602 Win=65535 Len=0"
"3.745134","5.9.29.183","172.19.0.3","TCP","1516","[TCP segment of a reassembled PDU]"
"3.745234","5.9.29.183","172.19.0.3","TCP","1492","9002 → 43520 [PSH, ACK] Seq=85259 Ack=8602 Win=65535 Len=1436 [TCP segment of a reassembled PDU]"
"3.745244","5.9.29.183","172.19.0.3","TLSv1.2","1237","Application Data"
"3.745442","172.19.0.3","5.9.29.183","TCP","56","43520 → 9002 [ACK] Seq=8602 Ack=87876 Win=12720 Len=0"
"3.756666","5.9.29.183","172.19.0.3","TLSv1.2","1504","Application Data"
"3.756834","5.9.29.183","172.19.0.3","TCP","1504","9002 → 43520 [PSH, ACK] Seq=89324 Ack=8602 Win=65535 Len=1448 [TCP segment of a reassembled PDU]"
"3.756851","172.19.0.3","5.9.29.183","TCP","56","43520 → 9002 [ACK] Seq=8602 Ack=90772 Win=12730 Len=0"
"3.760679","5.9.29.183","172.19.0.3","TCP","211","9002 → 43520 [PSH, ACK] Seq=90772 Ack=8602 Win=65535 Len=155 [TCP segment of a reassembled PDU]"
"3.760752","5.9.29.183","172.19.0.3","TLSv1.2","1268","Application Data, Application Data"
"3.761108","172.19.0.3","5.9.29.183","TCP","56","43520 → 9002 [ACK] Seq=8602 Ack=92139 Win=12738 Len=0"
"3.765197","5.9.29.183","172.19.0.3","TCP","1504","[TCP segment of a reassembled PDU]"
"3.765252","5.9.29.183","172.19.0.3","TCP","1504","9002 → 43520 [PSH, ACK] Seq=93587 Ack=8602 Win=65535 Len=1448 [TCP segment of a reassembled PDU]"
"3.765372","172.19.0.3","5.9.29.183","TCP","56","43520 → 9002 [ACK] Seq=8602 Ack=95035 Win=12730 Len=0"
"3.775539","5.9.29.183","172.19.0.3","TLSv1.2","787","Application Data"
"3.801004","5.9.29.183","172.19.0.3","TCP","1516","[TCP segment of a reassembled PDU]"
"3.801027","172.19.0.3","5.9.29.183","TCP","56","43520 → 9002 [ACK] Seq=8602 Ack=97226 Win=12738 Len=0"
"3.801073","5.9.29.183","172.19.0.3","TCP","1492","9002 → 43520 [PSH, ACK] Seq=97226 Ack=8602 Win=65535 Len=1436 [TCP segment of a reassembled PDU]"
"3.801180","5.9.29.183","172.19.0.3","TLSv1.2","1237","Application Data"
"3.801282","172.19.0.3","5.9.29.183","TCP","56","43520 → 9002 [ACK] Seq=8602 Ack=99843 Win=12722 Len=0"
"3.801360","5.9.29.183","172.19.0.3","TCP","1516","[TCP segment of a reassembled PDU]"
"3.801367","5.9.29.183","172.19.0.3","TCP","1516","9002 → 43520 [PSH, ACK] Seq=101303 Ack=8602 Win=65535 Len=1460 [TCP segment of a reassembled PDU]"
"3.801375","172.19.0.3","5.9.29.183","TCP","56","43520 → 9002 [ACK] Seq=8602 Ack=102763 Win=12730 Len=0"
"3.801465","5.9.29.183","172.19.0.3","TLSv1.2","1516","Application Data [TCP segment of a reassembled PDU]"
"3.801471","5.9.29.183","172.19.0.3","TCP","1468","9002 → 43520 [PSH, ACK] Seq=104223 Ack=8602 Win=65535 Len=1412 [TCP segment of a reassembled PDU]"
"3.801538","5.9.29.183","172.19.0.3","TCP","1516","9002 → 43520 [PSH, ACK] Seq=105635 Ack=8602 Win=65535 Len=1460 [TCP segment of a reassembled PDU]"
"3.801543","5.9.29.183","172.19.0.3","TLSv1.2","1516","Application Data [TCP segment of a reassembled PDU]"
"3.801556","172.19.0.3","5.9.29.183","TCP","56","43520 → 9002 [ACK] Seq=8602 Ack=105635 Win=12714 Len=0"
"3.801631","172.19.0.3","5.9.29.183","TCP","56","43520 → 9002 [ACK] Seq=8602 Ack=108555 Win=12698 Len=0"
"3.801648","5.9.29.183","172.19.0.3","TCP","1480","9002 → 43520 [PSH, ACK] Seq=108555 Ack=8602 Win=65535 Len=1424 [TCP segment of a reassembled PDU]"
"3.816938","5.9.29.183","172.19.0.3","TCP","1516","9002 → 43520 [PSH, ACK] Seq=109979 Ack=8602 Win=65535 Len=1460 [TCP segment of a reassembled PDU]"
"3.816998","172.19.0.3","5.9.29.183","TCP","56","43520 → 9002 [ACK] Seq=8602 Ack=111439 Win=12738 Len=0"
"3.817049","5.9.29.183","172.19.0.3","TLSv1.2","1492","Application Data [TCP segment of a reassembled PDU]"
"3.817105","5.9.29.183","172.19.0.3","TCP","1504","9002 → 43520 [PSH, ACK] Seq=112875 Ack=8602 Win=65535 Len=1448 [TCP segment of a reassembled PDU]"
"3.817194","5.9.29.183","172.19.0.3","TLSv1.2","148","Application Data"
"3.817330","172.19.0.3","5.9.29.183","TCP","56","43520 → 9002 [ACK] Seq=8602 Ack=114415 Win=12715 Len=0"
"3.817601","172.19.0.3","5.9.29.183","TLSv1.2","599","Application Data"
"3.817891","5.9.29.183","172.19.0.3","TCP","56","9002 → 43520 [ACK] Seq=114415 Ack=9145 Win=65535 Len=0"
"3.827266","172.19.0.3","5.9.29.183","TLSv1.2","599","Application Data"
"3.827471","5.9.29.183","172.19.0.3","TCP","56","9002 → 43520 [ACK] Seq=114415 Ack=9688 Win=65535 Len=0"
"4.243522","5.9.29.183","172.19.0.3","TLSv1.2","599","Application Data"
"4.244528","172.19.0.3","5.9.29.183","TLSv1.2","599","Application Data"
"4.244879","5.9.29.183","172.19.0.3","TCP","56","9002 → 43520 [ACK] Seq=114958 Ack=10231 Win=65535 Len=0"
"4.501821","5.9.29.183","172.19.0.3","TCP","1504","[TCP segment of a reassembled PDU]"
"4.501881","5.9.29.183","172.19.0.3","TCP","1504","9002 → 43520 [PSH, ACK] Seq=116406 Ack=10231 Win=65535 Len=1448 [TCP segment of a reassembled PDU]"
"4.501892","5.9.29.183","172.19.0.3","TLSv1.2","787","Application Data"
"4.502030","172.19.0.3","5.9.29.183","TCP","56","43520 → 9002 [ACK] Seq=10231 Ack=118585 Win=12722 Len=0"
"4.514761","5.9.29.183","172.19.0.3","TCP","1516","[TCP segment of a reassembled PDU]"
"4.514834","5.9.29.183","172.19.0.3","TCP","1492","9002 → 43520 [PSH, ACK] Seq=120045 Ack=10231 Win=65535 Len=1436 [TCP segment of a reassembled PDU]"
"4.514855","172.19.0.3","5.9.29.183","TCP","56","43520 → 9002 [ACK] Seq=10231 Ack=121481 Win=12730 Len=0"
"4.517509","5.9.29.183","172.19.0.3","TLSv1.2","1330","Application Data, Application Data"
"4.546815","5.9.29.183","172.19.0.3","TCP","1504","[TCP segment of a reassembled PDU]"
"4.546841","172.19.0.3","5.9.29.183","TCP","56","43520 → 9002 [ACK] Seq=10231 Ack=124203 Win=12738 Len=0"
"4.547006","5.9.29.183","172.19.0.3","TCP","1504","9002 → 43520 [PSH, ACK] Seq=124203 Ack=10231 Win=65535 Len=1448 [TCP segment of a reassembled PDU]"
"4.547016","5.9.29.183","172.19.0.3","TLSv1.2","787","Application Data"
"4.547097","172.19.0.3","5.9.29.183","TCP","56","43520 → 9002 [ACK] Seq=10231 Ack=126382 Win=12722 Len=0"
"4.557295","5.9.29.183","172.19.0.3","TCP","1516","[TCP segment of a reassembled PDU]"
"4.557369","5.9.29.183","172.19.0.3","TCP","1516","9002 → 43520 [PSH, ACK] Seq=127842 Ack=10231 Win=65535 Len=1460 [TCP segment of a reassembled PDU]"
"4.557386","172.19.0.3","5.9.29.183","TCP","56","43520 → 9002 [ACK] Seq=10231 Ack=129302 Win=12730 Len=0"
"4.557389","5.9.29.183","172.19.0.3","TLSv1.2","1516","Application Data [TCP segment of a reassembled PDU]"
"4.557393","5.9.29.183","172.19.0.3","TCP","1516","9002 → 43520 [PSH, ACK] Seq=130762 Ack=10231 Win=65535 Len=1460 [TCP segment of a reassembled PDU]"
"4.557400","5.9.29.183","172.19.0.3","TCP","1516","9002 → 43520 [PSH, ACK] Seq=132222 Ack=10231 Win=65535 Len=1460 [TCP segment of a reassembled PDU]"
"4.557403","5.9.29.183","172.19.0.3","TLSv1.2","1516","Application Data [TCP segment of a reassembled PDU]"
"4.557407","5.9.29.183","172.19.0.3","TCP","1432","9002 → 43520 [PSH, ACK] Seq=135142 Ack=10231 Win=65535 Len=1376 [TCP segment of a reassembled PDU]"
"4.557527","172.19.0.3","5.9.29.183","TCP","56","43520 → 9002 [ACK] Seq=10231 Ack=136518 Win=12690 Len=0"
"4.557926","172.19.0.3","5.9.29.183","TLSv1.2","599","Application Data"
"4.558261","5.9.29.183","172.19.0.3","TCP","56","9002 → 43520 [ACK] Seq=136518 Ack=10774 Win=65535 Len=0"
"4.562704","5.9.29.183","172.19.0.3","TCP","1516","9002 → 43520 [PSH, ACK] Seq=136518 Ack=10774 Win=65535 Len=1460 [TCP segment of a reassembled PDU]"
"4.562775","5.9.29.183","172.19.0.3","TLSv1.2","369","Application Data"
"4.562797","172.19.0.3","5.9.29.183","TCP","56","43520 → 9002 [ACK] Seq=10774 Ack=138291 Win=12730 Len=0"
"4.576230","5.9.29.183","172.19.0.3","TCP","1516","[TCP segment of a reassembled PDU]"
"4.576299","5.9.29.183","172.19.0.3","TCP","1492","9002 → 43520 [PSH, ACK] Seq=139751 Ack=10774 Win=65535 Len=1436 [TCP segment of a reassembled PDU]"
"4.576331","5.9.29.183","172.19.0.3","TLSv1.2","1516","Application Data [TCP segment of a reassembled PDU]"
"4.576336","5.9.29.183","172.19.0.3","TCP","1516","9002 → 43520 [PSH, ACK] Seq=142647 Ack=10774 Win=65535 Len=1460 [TCP segment of a reassembled PDU]"
"4.576455","172.19.0.3","5.9.29.183","TCP","56","43520 → 9002 [ACK] Seq=10774 Ack=144107 Win=12712 Len=0"
"4.576481","5.9.29.183","172.19.0.3","TCP","1516","9002 → 43520 [PSH, ACK] Seq=144107 Ack=10774 Win=65535 Len=1460 [TCP segment of a reassembled PDU]"
"4.576486","5.9.29.183","172.19.0.3","TLSv1.2","1516","Application Data [TCP segment of a reassembled PDU]"
"4.576488","5.9.29.183","172.19.0.3","TCP","1516","9002 → 43520 [PSH, ACK] Seq=147027 Ack=10774 Win=65535 Len=1460 [TCP segment of a reassembled PDU]"
"4.576490","5.9.29.183","172.19.0.3","TCP","1444","9002 → 43520 [PSH, ACK] Seq=148487 Ack=10774 Win=65535 Len=1388 [TCP segment of a reassembled PDU]"
"4.576548","172.19.0.3","5.9.29.183","TCP","56","43520 → 9002 [ACK] Seq=10774 Ack=149875 Win=12680 Len=0"
"4.576580","5.9.29.183","172.19.0.3","TLSv1.2","1516","Application Data [TCP segment of a reassembled PDU]"
"4.576584","5.9.29.183","172.19.0.3","TCP","1492","9002 → 43520 [PSH, ACK] Seq=151335 Ack=10774 Win=65535 Len=1436 [TCP segment of a reassembled PDU]"
"4.576789","172.19.0.3","5.9.29.183","TLSv1.2","599","Application Data"
"4.577017","5.9.29.183","172.19.0.3","TCP","56","9002 → 43520 [ACK] Seq=152771 Ack=11317 Win=65535 Len=0"
"4.577736","5.9.29.183","172.19.0.3","TLSv1.2","598","Application Data"
"4.609235","5.9.29.183","172.19.0.3","TCP","1516","[TCP segment of a reassembled PDU]"
"4.609263","172.19.0.3","5.9.29.183","TCP","56","43520 → 9002 [ACK] Seq=11317 Ack=154773 Win=12738 Len=0"
"4.609328","5.9.29.183","172.19.0.3","TCP","1492","9002 → 43520 [PSH, ACK] Seq=154773 Ack=11317 Win=65535 Len=1436 [TCP segment of a reassembled PDU]"
"4.609542","5.9.29.183","172.19.0.3","TCP","310","9002 → 43520 [PSH, ACK] Seq=156209 Ack=11317 Win=65535 Len=254 [TCP segment of a reassembled PDU]"
"4.609553","172.19.0.3","5.9.29.183","TCP","56","43520 → 9002 [ACK] Seq=11317 Ack=156463 Win=12738 Len=0"
"4.609555","5.9.29.183","172.19.0.3","TLSv1.2","1516","Application Data [TCP segment of a reassembled PDU]"
"4.609560","5.9.29.183","172.19.0.3","TCP","1516","9002 → 43520 [PSH, ACK] Seq=157923 Ack=11317 Win=65535 Len=1460 [TCP segment of a reassembled PDU]"
"4.609563","5.9.29.183","172.19.0.3","TCP","959","9002 → 43520 [PSH, ACK] Seq=159383 Ack=11317 Win=65535 Len=903 [TCP segment of a reassembled PDU]"
"4.609717","172.19.0.3","5.9.29.183","TCP","56","43520 → 9002 [ACK] Seq=11317 Ack=160286 Win=12722 Len=0"
"4.623739","5.9.29.183","172.19.0.3","TLSv1.2","1516","Application Data [TCP segment of a reassembled PDU]"
"4.623810","5.9.29.183","172.19.0.3","TCP","1516","9002 → 43520 [PSH, ACK] Seq=161746 Ack=11317 Win=65535 Len=1460 [TCP segment of a reassembled PDU]"
"4.623833","172.19.0.3","5.9.29.183","TCP","56","43520 → 9002 [ACK] Seq=11317 Ack=163206 Win=12730 Len=0"
"4.623837","5.9.29.183","172.19.0.3","TCP","1480","9002 → 43520 [PSH, ACK] Seq=163206 Ack=11317 Win=65535 Len=1424 [TCP segment of a reassembled PDU]"
"4.624745","5.9.29.183","172.19.0.3","TLSv1.2","677","Application Data, Application Data"
"4.624755","172.19.0.3","5.9.29.183","TCP","56","43520 → 9002 [ACK] Seq=11317 Ack=165251 Win=12738 Len=0"
"4.634924","5.9.29.183","172.19.0.3","TCP","1504","[TCP segment of a reassembled PDU]"
"4.640793","5.9.29.183","172.19.0.3","TLSv1.2","693","Application Data"
"4.640831","172.19.0.3","5.9.29.183","TCP","56","43520 → 9002 [ACK] Seq=11317 Ack=167336 Win=12738 Len=0"
"4.641229","172.19.0.3","5.9.29.183","TLSv1.2","599","Application Data"
"4.641590","5.9.29.183","172.19.0.3","TCP","56","9002 → 43520 [ACK] Seq=167336 Ack=11860 Win=65535 Len=0"
"4.683318","5.9.29.183","172.19.0.3","TCP","1516","[TCP segment of a reassembled PDU]"
"4.683388","5.9.29.183","172.19.0.3","TCP","1516","9002 → 43520 [PSH, ACK] Seq=168796 Ack=11860 Win=65535 Len=1460 [TCP segment of a reassembled PDU]"
"4.683402","5.9.29.183","172.19.0.3","TLSv1.2","763","Application Data"
"4.683612","172.19.0.3","5.9.29.183","TCP","56","43520 → 9002 [ACK] Seq=11860 Ack=170963 Win=12722 Len=0"
"4.698625","5.9.29.183","172.19.0.3","TLSv1.2","1113","Application Data"
"4.739363","172.19.0.3","5.9.29.183","TCP","56","43520 → 9002 [ACK] Seq=11860 Ack=172020 Win=12738 Len=0"
