_ws.col.Time,_ws.col.Source,_ws.col.Destination,_ws.col.Protocol,_ws.col.Length,_ws.col.Info
"0.000000","172.19.0.3","5.9.29.183","TLSv1.2","599","Application Data"
"0.000326","5.9.29.183","172.19.0.3","TCP","56","9002 → 43520 [ACK] Seq=1 Ack=544 Win=65535 Len=0"
"0.676743","5.9.29.183","172.19.0.3","TLSv1.2","599","Application Data"
"0.676838","172.19.0.3","5.9.29.183","TCP","56","43520 → 9002 [ACK] Seq=544 Ack=544 Win=11911 Len=0"
"0.677599","172.19.0.3","5.9.29.183","TLSv1.2","2141","Application Data"
"0.678050","5.9.29.183","172.19.0.3","TCP","56","9002 → 43520 [ACK] Seq=544 Ack=2004 Win=65535 Len=0"
"0.678108","5.9.29.183","172.19.0.3","TCP","56","9002 → 43520 [ACK] Seq=544 Ack=2629 Win=65535 Len=0"
"1.599298","5.9.29.183","172.19.0.3","TLSv1.2","1516","Application Data"
"1.599375","5.9.29.183","172.19.0.3","TCP","587","9002 → 43520 [PSH, ACK] Seq=2004 Ack=2629 Win=65535 Len=531 [TCP segment of a reassembled PDU]"
"1.599550","172.19.0.3","5.9.29.183","TCP","56","43520 → 9002 [ACK] Seq=2629 Ack=2535 Win=11903 Len=0"
"1.614121","5.9.29.183","172.19.0.3","TLSv1.2","179","Application Data"
"1.618931","172.19.0.3","5.9.29.183","TLSv1.2","599","Application Data"
"1.619295","5.9.29.183","172.19.0.3","TCP","56","9002 → 43520 [ACK] Seq=2658 Ack=3172 Win=65535 Len=0"
"2.213869","5.9.29.183","172.19.0.3","TLSv1.2","599","Application Data"
"2.214556","172.19.0.3","5.9.29.183","TLSv1.2","599","Application Data"
"2.214862","5.9.29.183","172.19.0.3","TCP","56","9002 → 43520 [ACK] Seq=3201 Ack=3715 Win=65535 Len=0"
"3.137316","5.9.29.183","172.19.0.3","TCP","1089","[TCP segment of a reassembled PDU]"
"3.137501","5.9.29.183","172.19.0.3","TCP","1516","9002 → 43520 [PSH, ACK] Seq=4234 Ack=3715 Win=65535 Len=1460 [TCP segment of a reassembled PDU]"
"3.137544","5.9.29.183","172.19.0.3","TLSv1.2","1516","Application Data [TCP segment of a reassembled PDU]"
"3.137564","5.9.29.183","172.19.0.3","TLSv1.2","273","Application Data"
"3.137606","172.19.0.3","5.9.29.183","TCP","56","43520 → 9002 [ACK] Seq=3715 Ack=7371 Win=11887 Len=0"
"3.193639","5.9.29.183","172.19.0.3","TCP","1516","[TCP segment of a reassembled PDU]"
"3.193723","5.9.29.183","172.19.0.3","TCP","1516","9002 → 43520 [PSH, ACK] Seq=8831 Ack=3715 Win=65535 Len=1460 [TCP segment of a reassembled PDU]"
"3.193753","172.19.0.3","5.9.29.183","TCP","56","43520 → 9002 [ACK] Seq=3715 Ack=10291 Win=11903 Len=0"
"3.193756","5.9.29.183","172.19.0.3","TLSv1.2","763","Application Data"
"3.234506","172.19.0.3","5.9.29.183","TCP","56","43520 → 9002 [ACK] Seq=3715 Ack=10998 Win=11911 Len=0"
"3.242361","5.9.29.183","172.19.0.3","TCP","1516","[TCP segment of a reassembled PDU]"
"3.242384","172.19.0.3","5.9.29.183","TCP","56","43520 → 9002 [ACK] Seq=3715 Ack=12458 Win=11911 Len=0"
"3.242444","5.9.29.183","172.19.0.3","TCP","1516","9002 → 43520 [PSH, ACK] Seq=12458 Ack=3715 Win=65535 Len=1460 [TCP segment of a reassembled PDU]"
"3.242463","172.19.0.3","5.9.29.183","TCP","56","43520 → 9002 [ACK] Seq=3715 Ack=13918 Win=11903 Len=0"
"3.242590","5.9.29.183","172.19.0.3","TLSv1.2","1213","Application Data"
"3.242600","172.19.0.3","5.9.29.183","TCP","56","43520 → 9002 [ACK] Seq=3715 Ack=15075 Win=11895 Len=0"
"3.257720","5.9.29.183","172.19.0.3","TLSv1.2","149","Application Data"
"3.257743","172.19.0.3","5.9.29.183","TCP","56","43520 → 9002 [ACK] Seq=3715 Ack=15168 Win=11909 Len=0"
"3.280289","5.9.29.183","172.19.0.3","TCP","1504","[TCP segment of a reassembled PDU]"
"3.280323","172.19.0.3","5.9.29.183","TCP","56","43520 → 9002 [ACK] Seq=3715 Ack=16616 Win=11911 Len=0"
"3.280561","5.9.29.183","172.19.0.3","TCP","1516","9002 → 43520 [PSH, ACK] Seq=16616 Ack=3715 Win=65535 Len=1460 [TCP segment of a reassembled PDU]"
"3.280575","172.19.0.3","5.9.29.183","TCP","56","43520 → 9002 [ACK] Seq=3715 Ack=18076 Win=11903 Len=0"
"3.280578","5.9.29.183","172.19.0.3","TLSv1.2","775","Application Data"
"3.280583","172.19.0.3","5.9.29.183","TCP","56","43520 → 9002 [ACK] Seq=3715 Ack=18795 Win=11898 Len=0"
"3.296097","5.9.29.183","172.19.0.3","TLSv1.2","599","Application Data"
"3.296119","172.19.0.3","5.9.29.183","TCP","56","43520 → 9002 [ACK] Seq=3715 Ack=19338 Win=11911 Len=0"
"3.322173","5.9.29.183","172.19.0.3","TCP","1516","[TCP segment of a reassembled PDU]"
"3.322195","172.19.0.3","5.9.29.183","TCP","56","43520 → 9002 [ACK] Seq=3715 Ack=20798 Win=11911 Len=0"
"3.322247","5.9.29.183","172.19.0.3","TCP","1492","9002 → 43520 [PSH, ACK] Seq=20798 Ack=3715 Win=65535 Len=1436 [TCP segment of a reassembled PDU]"
"3.322259","172.19.0.3","5.9.29.183","TCP","56","43520 → 9002 [ACK] Seq=3715 Ack=22234 Win=11903 Len=0"
"3.322262","5.9.29.183","172.19.0.3","TLSv1.2","787","Application Data"
"3.322267","172.19.0.3","5.9.29.183","TCP","56","43520 → 9002 [ACK] Seq=3715 Ack=22965 Win=11898 Len=0"
"3.346345","5.9.29.183","172.19.0.3","TLSv1.2","1113","Application Data"
"3.346367","172.19.0.3","5.9.29.183","TCP","56","43520 → 9002 [ACK] Seq=3715 Ack=24022 Win=11911 Len=0"
"3.685888","5.9.29.183","172.19.0.3","TCP","1516","[TCP segment of a reassembled PDU]"
"3.685907","172.19.0.3","5.9.29.183","TCP","56","43520 → 9002 [ACK] Seq=3715 Ack=25482 Win=11911 Len=0"
"3.685961","5.9.29.183","172.19.0.3","TCP","1516","9002 → 43520 [PSH, ACK] Seq=25482 Ack=3715 Win=65535 Len=1460 [TCP segment of a reassembled PDU]"
"3.685976","172.19.0.3","5.9.29.183","TCP","56","43520 → 9002 [ACK] Seq=3715 Ack=26942 Win=11903 Len=0"
"3.685978","5.9.29.183","172.19.0.3","TLSv1.2","763","Application Data"
"3.685982","172.19.0.3","5.9.29.183","TCP","56","43520 → 9002 [ACK] Seq=3715 Ack=27649 Win=11898 Len=0"
"3.759242","5.9.29.183","172.19.0.3","TCP","1504","[TCP segment of a reassembled PDU]"
"3.759267","172.19.0.3","5.9.29.183","TCP","56","43520 → 9002 [ACK] Seq=3715 Ack=29097 Win=11911 Len=0"
"3.759319","5.9.29.183","172.19.0.3","TCP","1516","9002 → 43520 [PSH, ACK] Seq=29097 Ack=3715 Win=65535 Len=1460 [TCP segment of a reassembled PDU]"
"3.759347","172.19.0.3","5.9.29.183","TCP","56","43520 → 9002 [ACK] Seq=3715 Ack=30557 Win=11903 Len=0"
"3.759350","5.9.29.183","172.19.0.3","TLSv1.2","775","Application Data"
"3.759358","172.19.0.3","5.9.29.183","TCP","56","43520 → 9002 [ACK] Seq=3715 Ack=31276 Win=11898 Len=0"
"3.759715","172.19.0.3","5.9.29.183","TLSv1.2","1113","Application Data"
"3.760020","5.9.29.183","172.19.0.3","TCP","56","9002 → 43520 [ACK] Seq=31276 Ack=4772 Win=65535 Len=0"
"3.799203","5.9.29.183","172.19.0.3","TLSv1.2","599","Application Data"
"3.838835","5.9.29.183","172.19.0.3","TCP","1504","[TCP segment of a reassembled PDU]"
"3.838853","172.19.0.3","5.9.29.183","TCP","56","43520 → 9002 [ACK] Seq=4772 Ack=33267 Win=11911 Len=0"
"3.838888","5.9.29.183","172.19.0.3","TCP","1504","9002 → 43520 [PSH, ACK] Seq=33267 Ack=4772 Win=65535 Len=1448 [TCP segment of a reassembled PDU]"
"3.838916","5.9.29.183","172.19.0.3","TLSv1.2","787","Application Data"
"3.839038","172.19.0.3","5.9.29.183","TCP","56","43520 → 9002 [ACK] Seq=4772 Ack=35446 Win=11895 Len=0"
"3.879234","5.9.29.183","172.19.0.3","TLSv1.2","599","Application Data"
"3.922000","172.19.0.3","5.9.29.183","TCP","56","43520 → 9002 [ACK] Seq=4772 Ack=35989 Win=11911 Len=0"
"3.956640","5.9.29.183","172.19.0.3","TCP","1504","[TCP segment of a reassembled PDU]"
"3.956662","172.19.0.3","5.9.29.183","TCP","56","43520 → 9002 [ACK] Seq=4772 Ack=37437 Win=11909 Len=0"
"3.956725","5.9.29.183","172.19.0.3","TCP","1516","9002 → 43520 [PSH, ACK] Seq=37437 Ack=4772 Win=65535 Len=1460 [TCP segment of a reassembled PDU]"
"3.956748","172.19.0.3","5.9.29.183","TCP","56","43520 → 9002 [ACK] Seq=4772 Ack=38897 Win=11901 Len=0"
"3.956751","5.9.29.183","172.19.0.3","TLSv1.2","775","Application Data"
"3.956756","172.19.0.3","5.9.29.183","TCP","56","43520 → 9002 [ACK] Seq=4772 Ack=39616 Win=11896 Len=0"
"4.046902","5.9.29.183","172.19.0.3","TCP","1516","[TCP segment of a reassembled PDU]"
"4.046954","172.19.0.3","5.9.29.183","TCP","56","43520 → 9002 [ACK] Seq=4772 Ack=41076 Win=11911 Len=0"
"4.046957","5.9.29.183","172.19.0.3","TLSv1.2","1195","Application Data"
"4.046969","172.19.0.3","5.9.29.183","TCP","56","43520 → 9002 [ACK] Seq=4772 Ack=42215 Win=11903 Len=0"
"4.119606","5.9.29.183","172.19.0.3","TCP","1516","[TCP segment of a reassembled PDU]"
"4.119632","172.19.0.3","5.9.29.183","TCP","56","43520 → 9002 [ACK] Seq=4772 Ack=43675 Win=11911 Len=0"
"4.119649","5.9.29.183","172.19.0.3","TCP","1516","9002 → 43520 [PSH, ACK] Seq=43675 Ack=4772 Win=65535 Len=1460 [TCP segment of a reassembled PDU]"
"4.119660","5.9.29.183","172.19.0.3","TLSv1.2","763","Application Data"
"4.119850","172.19.0.3","5.9.29.183","TCP","56","43520 → 9002 [ACK] Seq=4772 Ack=45842 Win=11895 Len=0"
"4.172710","5.9.29.183","172.19.0.3","TCP","1504","[TCP segment of a reassembled PDU]"
"4.172733","5.9.29.183","172.19.0.3","TCP","1516","9002 → 43520 [PSH, ACK] Seq=47290 Ack=4772 Win=65535 Len=1460 [TCP segment of a reassembled PDU]"
"4.172749","172.19.0.3","5.9.29.183","TCP","56","43520 → 9002 [ACK] Seq=4772 Ack=48750 Win=11903 Len=0"
"4.172750","5.9.29.183","172.19.0.3","TLSv1.2","261","Application Data"
"4.172905","172.19.0.3","5.9.29.183","TCP","56","43520 → 9002 [ACK] Seq=4772 Ack=48955 Win=11911 Len=0"
"4.293675","5.9.29.183","172.19.0.3","TCP","1516","[TCP segment of a reassembled PDU]"
"4.293698","5.9.29.183","172.19.0.3","TCP","1492","9002 → 43520 [PSH, ACK] Seq=50415 Ack=4772 Win=65535 Len=1436 [TCP segment of a reassembled PDU]"
"4.293755","5.9.29.183","172.19.0.3","TLSv1.2","787","Application Data"
"4.293851","172.19.0.3","5.9.29.183","TCP","56","43520 → 9002 [ACK] Seq=4772 Ack=52582 Win=11895 Len=0"
"4.423950","5.9.29.183","172.19.0.3","TCP","1516","[TCP segment of a reassembled PDU]"
"4.424233","5.9.29.183","172.19.0.3","TCP","1492","9002 → 43520 [PSH, ACK] Seq=54042 Ack=4772 Win=65535 Len=1436 [TCP segment of a reassembled PDU]"
"4.424238","5.9.29.183","172.19.0.3","TLSv1.2","787","Application Data"
"4.424252","172.19.0.3","5.9.29.183","TCP","56","43520 → 9002 [ACK] Seq=4772 Ack=55478 Win=11911 Len=0"
"4.424333","172.19.0.3","5.9.29.183","TCP","56","43520 → 9002 [ACK] Seq=4772 Ack=56209 Win=11911 Len=0"
"4.424588","172.19.0.3","5.9.29.183","TLSv1.2","599","Application Data"
"4.424808","5.9.29.183","172.19.0.3","TCP","56","9002 → 43520 [ACK] Seq=56209 Ack=5315 Win=65535 Len=0"
"4.533051","5.9.29.183","172.19.0.3","TCP","1516","[TCP segment of a reassembled PDU]"
"4.533084","5.9.29.183","172.19.0.3","TCP","1516","9002 → 43520 [PSH, ACK] Seq=57669 Ack=5315 Win=65535 Len=1460 [TCP segment of a reassembled PDU]"
"4.533094","5.9.29.183","172.19.0.3","TLSv1.2","763","Application Data"
"4.533245","172.19.0.3","5.9.29.183","TCP","56","43520 → 9002 [ACK] Seq=5315 Ack=59836 Win=11893 Len=0"
"4.579565","5.9.29.183","172.19.0.3","TLSv1.2","1113","Application Data"
"4.620696","172.19.0.3","5.9.29.183","TCP","56","43520 → 9002 [ACK] Seq=5315 Ack=60893 Win=11911 Len=0"
"4.639422","5.9.29.183","172.19.0.3","TCP","1516","[TCP segment of a reassembled PDU]"
"4.639452","5.9.29.183","172.19.0.3","TCP","1516","9002 → 43520 [PSH, ACK] Seq=62353 Ack=5315 Win=65535 Len=1460 [TCP segment of a reassembled PDU]"
"4.639459","5.9.29.183","172.19.0.3","TLSv1.2","763","Application Data"
"4.639567","172.19.0.3","5.9.29.183","TCP","56","43520 → 9002 [ACK] Seq=5315 Ack=64520 Win=11895 Len=0"
"4.660956","5.9.29.183","172.19.0.3","TCP","1516","[TCP segment of a reassembled PDU]"
"4.660976","5.9.29.183","172.19.0.3","TCP","1492","9002 → 43520 [PSH, ACK] Seq=65980 Ack=5315 Win=65535 Len=1436 [TCP segment of a reassembled PDU]"
"4.660986","172.19.0.3","5.9.29.183","TCP","56","43520 → 9002 [ACK] Seq=5315 Ack=67416 Win=11903 Len=0"
"4.660988","5.9.29.183","172.19.0.3","TLSv1.2","1237","Application Data"
"4.661221","172.19.0.3","5.9.29.183","TCP","56","43520 → 9002 [ACK] Seq=5315 Ack=68597 Win=11911 Len=0"
"4.676745","5.9.29.183","172.19.0.3","TLSv1.2","663","Application Data"
"4.676890","172.19.0.3","5.9.29.183","TCP","56","43520 → 9002 [ACK] Seq=5315 Ack=69204 Win=11911 Len=0"
"5.039670","5.9.29.183","172.19.0.3","TCP","622","[TCP segment of a reassembled PDU]"
"5.039743","172.19.0.3","5.9.29.183","TCP","56","43520 → 9002 [ACK] Seq=5315 Ack=69770 Win=11911 Len=0"
"5.039897","5.9.29.183","172.19.0.3","TCP","1516","9002 → 43520 [PSH, ACK] Seq=69770 Ack=5315 Win=65535 Len=1460 [TCP segment of a reassembled PDU]"
"5.039913","172.19.0.3","5.9.29.183","TCP","56","43520 → 9002 [ACK] Seq=5315 Ack=71230 Win=11903 Len=0"
"5.039914","5.9.29.183","172.19.0.3","TCP","1516","9002 → 43520 [PSH, ACK] Seq=71230 Ack=5315 Win=65535 Len=1460 [TCP segment of a reassembled PDU]"
"5.039920","172.19.0.3","5.9.29.183","TCP","56","43520 → 9002 [ACK] Seq=5315 Ack=72690 Win=11895 Len=0"
"5.039922","5.9.29.183","172.19.0.3","TLSv1.2","197","Application Data"
"5.039928","172.19.0.3","5.9.29.183","TCP","56","43520 → 9002 [ACK] Seq=5315 Ack=72831 Win=11894 Len=0"
"5.112950","5.9.29.183","172.19.0.3","TCP","1516","[TCP segment of a reassembled PDU]"
"5.112975","172.19.0.3","5.9.29.183","TCP","56","43520 → 9002 [ACK] Seq=5315 Ack=74291 Win=11911 Len=0"
"5.112993","5.9.29.183","172.19.0.3","TCP","1516","9002 → 43520 [PSH, ACK] Seq=74291 Ack=5315 Win=65535 Len=1460 [TCP segment of a reassembled PDU]"
"5.113005","172.19.0.3","5.9.29.183","TCP","56","43520 → 9002 [ACK] Seq=5315 Ack=75751 Win=11903 Len=0"
"5.113008","5.9.29.183","172.19.0.3","TLSv1.2","763","Application Data"
"5.113017","172.19.0.3","5.9.29.183","TCP","56","43520 → 9002 [ACK] Seq=5315 Ack=76458 Win=11898 Len=0"
"5.149923","5.9.29.183","172.19.0.3","TLSv1.2","599","Application Data"
"5.149945","172.19.0.3","5.9.29.183","TCP","56","43520 → 9002 [ACK] Seq=5315 Ack=77001 Win=11911 Len=0"
"5.185324","5.9.29.183","172.19.0.3","TCP","1516","[TCP segment of a reassembled PDU]"
"5.185381","172.19.0.3","5.9.29.183","TCP","56","43520 → 9002 [ACK] Seq=5315 Ack=78461 Win=11911 Len=0"
"5.185392","5.9.29.183","172.19.0.3","TCP","1516","9002 → 43520 [PSH, ACK] Seq=78461 Ack=5315 Win=65535 Len=1460 [TCP segment of a reassembled PDU]"
"5.185401","172.19.0.3","5.9.29.183","TCP","56","43520 → 9002 [ACK] Seq=5315 Ack=79921 Win=11903 Len=0"
"5.185522","5.9.29.183","172.19.0.3","TLSv1.2","763","Application Data"
"5.185531","172.19.0.3","5.9.29.183","TCP","56","43520 → 9002 [ACK] Seq=5315 Ack=80628 Win=11898 Len=0"
"5.186397","172.19.0.3","5.9.29.183","TLSv1.2","599","Application Data"
"5.186803","5.9.29.183","172.19.0.3","TCP","56","9002 → 43520 [ACK] Seq=80628 Ack=5858 Win=65535 Len=0"
"5.194719","172.19.0.3","5.9.29.183","TLSv1.2","599","Application Data"
"5.194939","5.9.29.183","172.19.0.3","TCP","56","9002 → 43520 [ACK] Seq=80628 Ack=6401 Win=65535 Len=0"
"5.235447","5.9.29.183","172.19.0.3","TLSv1.2","599","Application Data"
"5.278499","172.19.0.3","5.9.29.183","TCP","56","43520 → 9002 [ACK] Seq=6401 Ack=81171 Win=11911 Len=0"
"6.528565","5.9.29.183","172.19.0.3","TLSv1.2","599","Application Data"
"6.528653","172.19.0.3","5.9.29.183","TCP","56","43520 → 9002 [ACK] Seq=6401 Ack=81714 Win=11911 Len=0"
"6.529405","172.19.0.3","5.9.29.183","TLSv1.2","599","Application Data"
"6.529706","5.9.29.183","172.19.0.3","TCP","56","9002 → 43520 [ACK] Seq=81714 Ack=6944 Win=65535 Len=0"
"7.132795","5.9.29.183","172.19.0.3","TLSv1.2","599","Application Data"
"7.173668","172.19.0.3","5.9.29.183","TCP","56","43520 → 9002 [ACK] Seq=6944 Ack=82257 Win=11911 Len=0"
"7.242439","5.9.29.183","172.19.0.3","TCP","1516","[TCP segment of a reassembled PDU]"
"7.242463","172.19.0.3","5.9.29.183","TCP","56","43520 → 9002 [ACK] Seq=6944 Ack=83717 Win=11911 Len=0"
"7.242523","5.9.29.183","172.19.0.3","TCP","1516","9002 → 43520 [PSH, ACK] Seq=83717 Ack=6944 Win=65535 Len=1460 [TCP segment of a reassembled PDU]"
"7.242544","172.19.0.3","5.9.29.183","TCP","56","43520 → 9002 [ACK] Seq=6944 Ack=85177 Win=11903 Len=0"
"7.242546","5.9.29.183","172.19.0.3","TLSv1.2","763","Application Data"
"7.242555","172.19.0.3","5.9.29.183","TCP","56","43520 → 9002 [ACK] Seq=6944 Ack=85884 Win=11898 Len=0"
"7.242949","172.19.0.3","5.9.29.183","TLSv1.2","599","Application Data"
"7.243271","5.9.29.183","172.19.0.3","TCP","56","9002 → 43520 [ACK] Seq=85884 Ack=7487 Win=65535 Len=0"
"7.856648","5.9.29.183","172.19.0.3","TCP","1516","[TCP segment of a reassembled PDU]"
"7.856754","5.9.29.183","172.19.0.3","TCP","1516","9002 → 43520 [PSH, ACK] Seq=87344 Ack=7487 Win=65535 Len=1460 [TCP segment of a reassembled PDU]"
"7.856767","5.9.29.183","172.19.0.3","TLSv1.2","763","Application Data"
"7.856934","172.19.0.3","5.9.29.183","TCP","56","43520 → 9002 [ACK] Seq=7487 Ack=89511 Win=11895 Len=0"
"7.931167","5.9.29.183","172.19.0.3","TLSv1.2","599","Application Data"
"7.976106","172.19.0.3","5.9.29.183","TCP","56","43520 → 9002 [ACK] Seq=7487 Ack=90054 Win=11911 Len=0"
"8.014840","5.9.29.183","172.19.0.3","TCP","1516","[TCP segment of a reassembled PDU]"
"8.014862","172.19.0.3","5.9.29.183","TCP","56","43520 → 9002 [ACK] Seq=7487 Ack=91514 Win=11911 Len=0"
"8.014881","5.9.29.183","172.19.0.3","TCP","1516","9002 → 43520 [PSH, ACK] Seq=91514 Ack=7487 Win=65535 Len=1460 [TCP segment of a reassembled PDU]"
"8.014895","172.19.0.3","5.9.29.183","TCP","56","43520 → 9002 [ACK] Seq=7487 Ack=92974 Win=11903 Len=0"
"8.014897","5.9.29.183","172.19.0.3","TLSv1.2","763","Application Data"
"8.014904","172.19.0.3","5.9.29.183","TCP","56","43520 → 9002 [ACK] Seq=7487 Ack=93681 Win=11898 Len=0"
"8.063923","5.9.29.183","172.19.0.3","TCP","1516","[TCP segment of a reassembled PDU]"
"8.063946","172.19.0.3","5.9.29.183","TCP","56","43520 → 9002 [ACK] Seq=7487 Ack=95141 Win=11911 Len=0"
"8.063962","5.9.29.183","172.19.0.3","TCP","1516","9002 → 43520 [PSH, ACK] Seq=95141 Ack=7487 Win=65535 Len=1460 [TCP segment of a reassembled PDU]"
"8.063969","172.19.0.3","5.9.29.183","TCP","56","43520 → 9002 [ACK] Seq=7487 Ack=96601 Win=11903 Len=0"
"8.063971","5.9.29.183","172.19.0.3","TLSv1.2","249","Application Data"
"8.063976","172.19.0.3","5.9.29.183","TCP","56","43520 → 9002 [ACK] Seq=7487 Ack=96794 Win=11902 Len=0"
"8.168948","5.9.29.183","172.19.0.3","TCP","1516","[TCP segment of a reassembled PDU]"
"8.168968","172.19.0.3","5.9.29.183","TCP","56","43520 → 9002 [ACK] Seq=7487 Ack=98254 Win=11911 Len=0"
"8.168983","5.9.29.183","172.19.0.3","TCP","1492","9002 → 43520 [PSH, ACK] Seq=98254 Ack=7487 Win=65535 Len=1436 [TCP segment of a reassembled PDU]"
"8.168990","172.19.0.3","5.9.29.183","TCP","56","43520 → 9002 [ACK] Seq=7487 Ack=99690 Win=11903 Len=0"
"8.168992","5.9.29.183","172.19.0.3","TLSv1.2","787","Application Data"
"8.168997","172.19.0.3","5.9.29.183","TCP","56","43520 → 9002 [ACK] Seq=7487 Ack=100421 Win=11898 Len=0"
"8.334441","5.9.29.183","172.19.0.3","TCP","1516","[TCP segment of a reassembled PDU]"
"8.334460","172.19.0.3","5.9.29.183","TCP","56","43520 → 9002 [ACK] Seq=7487 Ack=101881 Win=11909 Len=0"
"8.334492","5.9.29.183","172.19.0.3","TCP","1492","9002 → 43520 [PSH, ACK] Seq=101881 Ack=7487 Win=65535 Len=1436 [TCP segment of a reassembled PDU]"
"8.334503","172.19.0.3","5.9.29.183","TCP","56","43520 → 9002 [ACK] Seq=7487 Ack=103317 Win=11901 Len=0"
"8.334696","5.9.29.183","172.19.0.3","TLSv1.2","787","Application Data"
"8.334704","172.19.0.3","5.9.29.183","TCP","56","43520 → 9002 [ACK] Seq=7487 Ack=104048 Win=11911 Len=0"
"8.421075","5.9.29.183","172.19.0.3","TLSv1.2","599","Application Data"
"8.421097","172.19.0.3","5.9.29.183","TCP","56","43520 → 9002 [ACK] Seq=7487 Ack=104591 Win=11911 Len=0"
"8.970507","5.9.29.183","172.19.0.3","TCP","1516","[TCP segment of a reassembled PDU]"
"8.970529","172.19.0.3","5.9.29.183","TCP","56","43520 → 9002 [ACK] Seq=7487 Ack=106051 Win=11911 Len=0"
"8.970541","5.9.29.183","172.19.0.3","TCP","1492","9002 → 43520 [PSH, ACK] Seq=106051 Ack=7487 Win=65535 Len=1436 [TCP segment of a reassembled PDU]"
"8.970552","172.19.0.3","5.9.29.183","TCP","56","43520 → 9002 [ACK] Seq=7487 Ack=107487 Win=11903 Len=0"
"8.970554","5.9.29.183","172.19.0.3","TLSv1.2","787","Application Data"
"8.970559","172.19.0.3","5.9.29.183","TCP","56","43520 → 9002 [ACK] Seq=7487 Ack=108218 Win=11898 Len=0"
"8.971022","172.19.0.3","5.9.29.183","TLSv1.2","599","Application Data"
"8.971427","5.9.29.183","172.19.0.3","TCP","56","9002 → 43520 [ACK] Seq=108218 Ack=8030 Win=65535 Len=0"
"9.068104","5.9.29.183","172.19.0.3","TLSv1.2","599","Application Data"
"9.108431","172.19.0.3","5.9.29.183","TCP","56","43520 → 9002 [ACK] Seq=8030 Ack=108761 Win=11911 Len=0"
"9.190743","5.9.29.183","172.19.0.3","TCP","1516","[TCP segment of a reassembled PDU]"
"9.190782","172.19.0.3","5.9.29.183","TCP","56","43520 → 9002 [ACK] Seq=8030 Ack=110221 Win=11911 Len=0"
"9.190784","5.9.29.183","172.19.0.3","TCP","1492","9002 → 43520 [PSH, ACK] Seq=110221 Ack=8030 Win=65535 Len=1436 [TCP segment of a reassembled PDU]"
"9.190793","172.19.0.3","5.9.29.183","TCP","56","43520 → 9002 [ACK] Seq=8030 Ack=111657 Win=11903 Len=0"
"9.190794","5.9.29.183","172.19.0.3","TLSv1.2","787","Application Data"
"9.190799","172.19.0.3","5.9.29.183","TCP","56","43520 → 9002 [ACK] Seq=8030 Ack=112388 Win=11898 Len=0"
"9.238222","5.9.29.183","172.19.0.3","TLSv1.2","599","Application Data"
"9.238245","172.19.0.3","5.9.29.183","TCP","56","43520 → 9002 [ACK] Seq=8030 Ack=112931 Win=11911 Len=0"
"9.308862","5.9.29.183","172.19.0.3","TCP","1516","[TCP segment of a reassembled PDU]"
"9.308885","172.19.0.3","5.9.29.183","TCP","56","43520 → 9002 [ACK] Seq=8030 Ack=114391 Win=11911 Len=0"
"9.308900","5.9.29.183","172.19.0.3","TCP","1516","9002 → 43520 [PSH, ACK] Seq=114391 Ack=8030 Win=65535 Len=1460 [TCP segment of a reassembled PDU]"
"9.308908","172.19.0.3","5.9.29.183","TCP","56","43520 → 9002 [ACK] Seq=8030 Ack=115851 Win=11903 Len=0"
"9.308910","5.9.29.183","172.19.0.3","TLSv1.2","763","Application Data"
"9.308915","172.19.0.3","5.9.29.183","TCP","56","43520 → 9002 [ACK] Seq=8030 Ack=116558 Win=11898 Len=0"
"9.324003","5.9.29.183","172.19.0.3","TCP","1516","[TCP segment of a reassembled PDU]"
"9.324028","172.19.0.3","5.9.29.183","TCP","56","43520 → 9002 [ACK] Seq=8030 Ack=118018 Win=11911 Len=0"
"9.324046","5.9.29.183","172.19.0.3","TCP","1492","9002 → 43520 [PSH, ACK] Seq=118018 Ack=8030 Win=65535 Len=1436 [TCP segment of a reassembled PDU]"
"9.324054","172.19.0.3","5.9.29.183","TCP","56","43520 → 9002 [ACK] Seq=8030 Ack=119454 Win=11903 Len=0"
"9.324056","5.9.29.183","172.19.0.3","TLSv1.2","273","Application Data"
"9.324061","172.19.0.3","5.9.29.183","TCP","56","43520 → 9002 [ACK] Seq=8030 Ack=119671 Win=11902 Len=0"
"9.503188","5.9.29.183","172.19.0.3","TCP","1516","[TCP segment of a reassembled PDU]"
"9.503213","172.19.0.3","5.9.29.183","TCP","56","43520 → 9002 [ACK] Seq=8030 Ack=121131 Win=11911 Len=0"
"9.503229","5.9.29.183","172.19.0.3","TCP","1516","9002 → 43520 [PSH, ACK] Seq=121131 Ack=8030 Win=65535 Len=1460 [TCP segment of a reassembled PDU]"
"9.503236","5.9.29.183","172.19.0.3","TLSv1.2","763","Application Data"
"9.503419","172.19.0.3","5.9.29.183","TCP","56","43520 → 9002 [ACK] Seq=8030 Ack=123298 Win=11895 Len=0"
"9.599050","5.9.29.183","172.19.0.3","TLSv1.2","599","Application Data"
"9.599242","172.19.0.3","5.9.29.183","TCP","56","43520 → 9002 [ACK] Seq=8030 Ack=123841 Win=11911 Len=0"
"9.706324","5.9.29.183","172.19.0.3","TCP","1516","[TCP segment of a reassembled PDU]"
"9.706345","5.9.29.183","172.19.0.3","TCP","1492","9002 → 43520 [PSH, ACK] Seq=125301 Ack=8030 Win=65535 Len=1436 [TCP segment of a reassembled PDU]"
"9.706353","5.9.29.183","172.19.0.3","TLSv1.2","787","Application Data"
"9.706461","172.19.0.3","5.9.29.183","TCP","56","43520 → 9002 [ACK] Seq=8030 Ack=127468 Win=11895 Len=0"
"9.874302","5.9.29.183","172.19.0.3","TCP","1504","[TCP segment of a reassembled PDU]"
"9.874333","5.9.29.183","172.19.0.3","TCP","1516","9002 → 43520 [PSH, ACK] Seq=128916 Ack=8030 Win=65535 Len=1460 [TCP segment of a reassembled PDU]"
"9.874350","172.19.0.3","5.9.29.183","TCP","56","43520 → 9002 [ACK] Seq=8030 Ack=130376 Win=11903 Len=0"
"9.874352","5.9.29.183","172.19.0.3","TLSv1.2","775","Application Data"
"9.874531","172.19.0.3","5.9.29.183","TCP","56","43520 → 9002 [ACK] Seq=8030 Ack=131095 Win=11911 Len=0"
"9.971110","5.9.29.183","172.19.0.3","TCP","1516","[TCP segment of a reassembled PDU]"
"9.971143","5.9.29.183","172.19.0.3","TLSv1.2","1195","Application Data"
"9.971289","172.19.0.3","5.9.29.183","TCP","56","43520 → 9002 [ACK] Seq=8030 Ack=133694 Win=11903 Len=0"
"9.971583","172.19.0.3","5.9.29.183","TLSv1.2","599","Application Data"
"9.971927","5.9.29.183","172.19.0.3","TCP","56","9002 → 43520 [ACK] Seq=133694 Ack=8573 Win=65535 Len=0"
"10.091461","5.9.29.183","172.19.0.3","TCP","1516","[TCP segment of a reassembled PDU]"
"10.091536","5.9.29.183","172.19.0.3","TCP","208","9002 → 43520 [PSH, ACK] Seq=135154 Ack=8573 Win=65535 Len=152 [TCP segment of a reassembled PDU]"
"10.091618","5.9.29.183","172.19.0.3","TCP","1516","9002 → 43520 [PSH, ACK] Seq=135306 Ack=8573 Win=65535 Len=1460 [TCP segment of a reassembled PDU]"
"10.091625","5.9.29.183","172.19.0.3","TLSv1.2","611","Application Data"
"10.091709","172.19.0.3","5.9.29.183","TCP","56","43520 → 9002 [ACK] Seq=8573 Ack=137321 Win=11887 Len=0"
"10.092005","172.19.0.3","5.9.29.183","TLSv1.2","599","Application Data"
"10.092303","5.9.29.183","172.19.0.3","TCP","56","9002 → 43520 [ACK] Seq=137321 Ack=9116 Win=65535 Len=0"
"10.188046","5.9.29.183","172.19.0.3","TCP","1516","[TCP segment of a reassembled PDU]"
"10.188079","5.9.29.183","172.19.0.3","TCP","1516","9002 → 43520 [PSH, ACK] Seq=138781 Ack=9116 Win=65535 Len=1460 [TCP segment of a reassembled PDU]"
"10.188089","5.9.29.183","172.19.0.3","TLSv1.2","763","Application Data"
"10.188248","172.19.0.3","5.9.29.183","TCP","56","43520 → 9002 [ACK] Seq=9116 Ack=140948 Win=11895 Len=0"
"10.270338","5.9.29.183","172.19.0.3","TCP","1516","[TCP segment of a reassembled PDU]"
"10.270372","5.9.29.183","172.19.0.3","TCP","1516","9002 → 43520 [PSH, ACK] Seq=142408 Ack=9116 Win=65535 Len=1460 [TCP segment of a reassembled PDU]"
"10.270393","172.19.0.3","5.9.29.183","TCP","56","43520 → 9002 [ACK] Seq=9116 Ack=143868 Win=11901 Len=0"
"10.270396","5.9.29.183","172.19.0.3","TLSv1.2","1213","Application Data"
"10.285994","5.9.29.183","172.19.0.3","TLSv1.2","149","Application Data"
"10.286280","172.19.0.3","5.9.29.183","TCP","56","43520 → 9002 [ACK] Seq=9116 Ack=145118 Win=11911 Len=0"
"10.317784","5.9.29.183","172.19.0.3","TLSv1.2","1113","Application Data"
"10.358911","172.19.0.3","5.9.29.183","TCP","56","43520 → 9002 [ACK] Seq=9116 Ack=146175 Win=11911 Len=0"
"10.377756","5.9.29.183","172.19.0.3","TCP","1504","[TCP segment of a reassembled PDU]"
"10.377784","5.9.29.183","172.19.0.3","TCP","1516","9002 → 43520 [PSH, ACK] Seq=147623 Ack=9116 Win=65535 Len=1460 [TCP segment of a reassembled PDU]"
"10.377792","5.9.29.183","172.19.0.3","TLSv1.2","775","Application Data"
"10.377910","172.19.0.3","5.9.29.183","TCP","56","43520 → 9002 [ACK] Seq=9116 Ack=149802 Win=11895 Len=0"
"10.430595","5.9.29.183","172.19.0.3","TCP","1516","[TCP segment of a reassembled PDU]"
"10.430627","5.9.29.183","172.19.0.3","TCP","1516","9002 → 43520 [PSH, ACK] Seq=151262 Ack=9116 Win=65535 Len=1460 [TCP segment of a reassembled PDU]"
"10.430648","172.19.0.3","5.9.29.183","TCP","56","43520 → 9002 [ACK] Seq=9116 Ack=152722 Win=11903 Len=0"
"10.430650","5.9.29.183","172.19.0.3","TLSv1.2","763","Application Data"
"10.430842","172.19.0.3","5.9.29.183","TCP","56","43520 → 9002 [ACK] Seq=9116 Ack=153429 Win=11911 Len=0"
"10.465779","5.9.29.183","172.19.0.3","TLSv1.2","599","Application Data"
"10.465955","172.19.0.3","5.9.29.183","TCP","56","43520 → 9002 [ACK] Seq=9116 Ack=153972 Win=11911 Len=0"
"10.539518","5.9.29.183","172.19.0.3","TCP","1516","[TCP segment of a reassembled PDU]"
"10.539549","5.9.29.183","172.19.0.3","TCP","1516","9002 → 43520 [PSH, ACK] Seq=155432 Ack=9116 Win=65535 Len=1460 [TCP segment of a reassembled PDU]"
"10.539559","5.9.29.183","172.19.0.3","TLSv1.2","763","Application Data"
"10.539678","172.19.0.3","5.9.29.183","TCP","56","43520 → 9002 [ACK] Seq=9116 Ack=157599 Win=11895 Len=0"
"10.635378","5.9.29.183","172.19.0.3","TCP","1516","[TCP segment of a reassembled PDU]"
"10.635409","5.9.29.183","172.19.0.3","TLSv1.2","681","Application Data"
"10.635428","172.19.0.3","5.9.29.183","TCP","56","43520 → 9002 [ACK] Seq=9116 Ack=159684 Win=11903 Len=0"
"10.640588","172.19.0.3","5.9.29.183","TLSv1.2","599","Application Data"
"10.640954","5.9.29.183","172.19.0.3","TCP","56","9002 → 43520 [ACK] Seq=159684 Ack=9659 Win=65535 Len=0"
"11.685426","5.9.29.183","172.19.0.3","TLSv1.2","599","Application Data"
"11.686326","172.19.0.3","5.9.29.183","TLSv1.2","599","Application Data"
"11.686595","5.9.29.183","172.19.0.3","TCP","56","9002 → 43520 [ACK] Seq=160227 Ack=10202 Win=65535 Len=0"
"12.359220","5.9.29.183","172.19.0.3","TCP","1516","[TCP segment of a reassembled PDU]"
"12.359307","5.9.29.183","172.19.0.3","TCP","1492","9002 → 43520 [PSH, ACK] Seq=161687 Ack=10202 Win=65535 Len=1436 [TCP segment of a reassembled PDU]"
"12.359355","5.9.29.183","172.19.0.3","TLSv1.2","1516","Application Data, Application Data"
"12.359360","5.9.29.183","172.19.0.3","TCP","1516","9002 → 43520 [PSH, ACK] Seq=164583 Ack=10202 Win=65535 Len=1460 [TCP segment of a reassembled PDU]"
"12.359428","172.19.0.3","5.9.29.183","TCP","56","43520 → 9002 [ACK] Seq=10202 Ack=166043 Win=11887 Len=0"
"12.359429","5.9.29.183","172.19.0.3","TCP","1306","9002 → 43520 [PSH, ACK] Seq=166043 Ack=10202 Win=65535 Len=1250 [TCP segment of a reassembled PDU]"
"12.374842","5.9.29.183","172.19.0.3","TLSv1.2","1330","Application Data, Application Data"
"12.374856","172.19.0.3","5.9.29.183","TCP","56","43520 → 9002 [ACK] Seq=10202 Ack=168567 Win=11911 Len=0"
"12.385657","5.9.29.183","172.19.0.3","TCP","1516","[TCP segment of a reassembled PDU]"
"12.385742","5.9.29.183","172.19.0.3","TCP","1492","9002 → 43520 [PSH, ACK] Seq=170027 Ack=10202 Win=65535 Len=1436 [TCP segment of a reassembled PDU]"
"12.385905","172.19.0.3","5.9.29.183","TCP","56","43520 → 9002 [ACK] Seq=10202 Ack=171463 Win=11903 Len=0"
"12.390098","5.9.29.183","172.19.0.3","TLSv1.2","787","Application Data"
"12.431132","172.19.0.3","5.9.29.183","TCP","56","43520 → 9002 [ACK] Seq=10202 Ack=172194 Win=11911 Len=0"
"12.437199","5.9.29.183","172.19.0.3","TCP","1504","[TCP segment of a reassembled PDU]"
"12.437231","172.19.0.3","5.9.29.183","TCP","56","43520 → 9002 [ACK] Seq=10202 Ack=173642 Win=11911 Len=0"
"12.437277","5.9.29.183","172.19.0.3","TCP","1516","9002 → 43520 [PSH, ACK] Seq=173642 Ack=10202 Win=65535 Len=1460 [TCP segment of a reassembled PDU]"
"12.437293","172.19.0.3","5.9.29.183","TCP","56","43520 → 9002 [ACK] Seq=10202 Ack=175102 Win=11903 Len=0"
"12.437295","5.9.29.183","172.19.0.3","TLSv1.2","775","Application Data"
"12.437300","172.19.0.3","5.9.29.183","TCP","56","43520 → 9002 [ACK] Seq=10202 Ack=175821 Win=11898 Len=0"
"12.484805","5.9.29.183","172.19.0.3","TLSv1.2","599","Application Data"
"12.484829","172.19.0.3","5.9.29.183","TCP","56","43520 → 9002 [ACK] Seq=10202 Ack=176364 Win=11911 Len=0"
"12.496194","5.9.29.183","172.19.0.3","TCP","1504","[TCP segment of a reassembled PDU]"
"12.496223","172.19.0.3","5.9.29.183","TCP","56","43520 → 9002 [ACK] Seq=10202 Ack=177812 Win=11909 Len=0"
"12.496341","5.9.29.183","172.19.0.3","TCP","1504","9002 → 43520 [PSH, ACK] Seq=177812 Ack=10202 Win=65535 Len=1448 [TCP segment of a reassembled PDU]"
"12.496349","172.19.0.3","5.9.29.183","TCP","56","43520 → 9002 [ACK] Seq=10202 Ack=179260 Win=11901 Len=0"
"12.500832","5.9.29.183","172.19.0.3","TLSv1.2","787","Application Data"
"12.500859","172.19.0.3","5.9.29.183","TCP","56","43520 → 9002 [ACK] Seq=10202 Ack=179991 Win=11911 Len=0"
"12.518853","5.9.29.183","172.19.0.3","TCP","1516","[TCP segment of a reassembled PDU]"
"12.518874","172.19.0.3","5.9.29.183","TCP","56","43520 → 9002 [ACK] Seq=10202 Ack=181451 Win=11911 Len=0"
"12.518924","5.9.29.183","172.19.0.3","TCP","1516","9002 → 43520 [PSH, ACK] Seq=181451 Ack=10202 Win=65535 Len=1460 [TCP segment of a reassembled PDU]"
"12.518936","172.19.0.3","5.9.29.183","TCP","56","43520 → 9002 [ACK] Seq=10202 Ack=182911 Win=11903 Len=0"
"12.518938","5.9.29.183","172.19.0.3","TLSv1.2","1213","Application Data"
"12.518943","172.19.0.3","5.9.29.183","TCP","56","43520 → 9002 [ACK] Seq=10202 Ack=184068 Win=11895 Len=0"
"12.534576","5.9.29.183","172.19.0.3","TLSv1.2","663","Application Data"
"12.534601","172.19.0.3","5.9.29.183","TCP","56","43520 → 9002 [ACK] Seq=10202 Ack=184675 Win=11911 Len=0"
"12.539129","172.19.0.3","5.9.29.183","TLSv1.2","599","Application Data"
"12.539415","5.9.29.183","172.19.0.3","TCP","56","9002 → 43520 [ACK] Seq=184675 Ack=10745 Win=65535 Len=0"
"13.278933","5.9.29.183","172.19.0.3","TLSv1.2","599","Application Data"
"13.279828","172.19.0.3","5.9.29.183","TLSv1.2","599","Application Data"
"13.280256","5.9.29.183","172.19.0.3","TCP","56","9002 → 43520 [ACK] Seq=185218 Ack=11288 Win=65535 Len=0"
"13.895884","5.9.29.183","172.19.0.3","TLSv1.2","599","Application Data"
"13.905906","5.9.29.183","172.19.0.3","TCP","1516","[TCP segment of a reassembled PDU]"
"13.905928","172.19.0.3","5.9.29.183","TCP","56","43520 → 9002 [ACK] Seq=11288 Ack=187221 Win=11911 Len=0"
"13.905983","5.9.29.183","172.19.0.3","TCP","1492","9002 → 43520 [PSH, ACK] Seq=187221 Ack=11288 Win=65535 Len=1436 [TCP segment of a reassembled PDU]"
"13.910981","5.9.29.183","172.19.0.3","TLSv1.2","787","Application Data"
"13.911007","172.19.0.3","5.9.29.183","TCP","56","43520 → 9002 [ACK] Seq=11288 Ack=189388 Win=11911 Len=0"
"13.911474","172.19.0.3","5.9.29.183","TLSv1.2","599","Application Data"
"13.911795","5.9.29.183","172.19.0.3","TCP","56","9002 → 43520 [ACK] Seq=189388 Ack=11831 Win=65535 Len=0"
"13.941834","5.9.29.183","172.19.0.3","TCP","1516","[TCP segment of a reassembled PDU]"
"13.941890","5.9.29.183","172.19.0.3","TCP","1516","9002 → 43520 [PSH, ACK] Seq=190848 Ack=11831 Win=65535 Len=1460 [TCP segment of a reassembled PDU]"
"13.941901","5.9.29.183","172.19.0.3","TLSv1.2","1213","Application Data"
"13.942637","172.19.0.3","5.9.29.183","TCP","56","43520 → 9002 [ACK] Seq=11831 Ack=193465 Win=11895 Len=0"
"13.957303","5.9.29.183","172.19.0.3","TLSv1.2","149","Application Data"
"13.998583","172.19.0.3","5.9.29.183","TCP","56","43520 → 9002 [ACK] Seq=11831 Ack=193558 Win=11911 Len=0"
"14.026672","5.9.29.183","172.19.0.3","TCP","1516","[TCP segment of a reassembled PDU]"
"14.026695","172.19.0.3","5.9.29.183","TCP","56","43520 → 9002 [ACK] Seq=11831 Ack=195018 Win=11911 Len=0"
"14.026747","5.9.29.183","172.19.0.3","TCP","1492","9002 → 43520 [PSH, ACK] Seq=195018 Ack=11831 Win=65535 Len=1436 [TCP segment of a reassembled PDU]"
"14.026763","172.19.0.3","5.9.29.183","TCP","56","43520 → 9002 [ACK] Seq=11831 Ack=196454 Win=11903 Len=0"
"14.026765","5.9.29.183","172.19.0.3","TLSv1.2","1237","Application Data"
"14.026771","172.19.0.3","5.9.29.183","TCP","56","43520 → 9002 [ACK] Seq=11831 Ack=197635 Win=11895 Len=0"
"14.042311","5.9.29.183","172.19.0.3","TLSv1.2","149","Application Data"
"14.042339","172.19.0.3","5.9.29.183","TCP","56","43520 → 9002 [ACK] Seq=11831 Ack=197728 Win=11911 Len=0"
"14.067750","5.9.29.183","172.19.0.3","TLSv1.2","1113","Application Data"
"14.067776","172.19.0.3","5.9.29.183","TCP","56","43520 → 9002 [ACK] Seq=11831 Ack=198785 Win=11911 Len=0"
"14.072470","172.19.0.3","5.9.29.183","TLSv1.2","599","Application Data"
"14.072767","5.9.29.183","172.19.0.3","TCP","56","9002 → 43520 [ACK] Seq=198785 Ack=12374 Win=65535 Len=0"
"14.818981","5.9.29.183","172.19.0.3","TLSv1.2","599","Application Data"
"14.819722","172.19.0.3","5.9.29.183","TLSv1.2","599","Application Data"
"14.819967","5.9.29.183","172.19.0.3","TCP","56","9002 → 43520 [ACK] Seq=199328 Ack=12917 Win=65535 Len=0"
"15.383408","5.9.29.183","172.19.0.3","TCP","1516","[TCP segment of a reassembled PDU]"
"15.383506","5.9.29.183","172.19.0.3","TCP","110","9002 → 43520 [PSH, ACK] Seq=200788 Ack=12917 Win=65535 Len=54 [TCP segment of a reassembled PDU]"
"15.383657","5.9.29.183","172.19.0.3","TCP","1516","9002 → 43520 [PSH, ACK] Seq=200842 Ack=12917 Win=65535 Len=1460 [TCP segment of a reassembled PDU]"
"15.383665","5.9.29.183","172.19.0.3","TLSv1.2","709","Application Data"
"15.383689","172.19.0.3","5.9.29.183","TCP","56","43520 → 9002 [ACK] Seq=12917 Ack=202302 Win=11899 Len=0"
"15.425021","172.19.0.3","5.9.29.183","TCP","56","43520 → 9002 [ACK] Seq=12917 Ack=202955 Win=11911 Len=0"
"15.442994","5.9.29.183","172.19.0.3","TCP","1504","[TCP segment of a reassembled PDU]"
"15.443018","172.19.0.3","5.9.29.183","TCP","56","43520 → 9002 [ACK] Seq=12917 Ack=204403 Win=11911 Len=0"
"15.443432","5.9.29.183","172.19.0.3","TCP","1504","9002 → 43520 [PSH, ACK] Seq=204403 Ack=12917 Win=65535 Len=1448 [TCP segment of a reassembled PDU]"
"15.443443","172.19.0.3","5.9.29.183","TCP","56","43520 → 9002 [ACK] Seq=12917 Ack=205851 Win=11911 Len=0"
"15.443487","5.9.29.183","172.19.0.3","TLSv1.2","787","Application Data"
"15.443502","172.19.0.3","5.9.29.183","TCP","56","43520 → 9002 [ACK] Seq=12917 Ack=206582 Win=11906 Len=0"
"15.507801","5.9.29.183","172.19.0.3","TCP","1504","[TCP segment of a reassembled PDU]"
"15.507821","172.19.0.3","5.9.29.183","TCP","56","43520 → 9002 [ACK] Seq=12917 Ack=208030 Win=11911 Len=0"
"15.507862","5.9.29.183","172.19.0.3","TCP","1516","9002 → 43520 [PSH, ACK] Seq=208030 Ack=12917 Win=65535 Len=1460 [TCP segment of a reassembled PDU]"
"15.507872","172.19.0.3","5.9.29.183","TCP","56","43520 → 9002 [ACK] Seq=12917 Ack=209490 Win=11903 Len=0"
"15.507874","5.9.29.183","172.19.0.3","TLSv1.2","261","Application Data"
"15.507879","172.19.0.3","5.9.29.183","TCP","56","43520 → 9002 [ACK] Seq=12917 Ack=209695 Win=11902 Len=0"
"15.511939","172.19.0.3","5.9.29.183","TLSv1.2","599","Application Data"
"15.512189","5.9.29.183","172.19.0.3","TCP","56","9002 → 43520 [ACK] Seq=209695 Ack=13460 Win=65535 Len=0"
"16.353306","5.9.29.183","172.19.0.3","TLSv1.2","599","Application Data"
"16.354247","172.19.0.3","5.9.29.183","TLSv1.2","599","Application Data"
"16.354595","5.9.29.183","172.19.0.3","TCP","56","9002 → 43520 [ACK] Seq=210238 Ack=14003 Win=65535 Len=0"
"16.932755","02:42:7b:11:31:3d","","ARP","44","Who has 172.19.0.3? Tell 172.19.0.1"
"16.932768","02:42:ac:13:00:03","","ARP","44","172.19.0.3 is at 02:42:ac:13:00:03"
"16.970714","5.9.29.183","172.19.0.3","TCP","1516","[TCP segment of a reassembled PDU]"
"16.970857","5.9.29.183","172.19.0.3","TCP","1492","9002 → 43520 [PSH, ACK] Seq=211698 Ack=14003 Win=65535 Len=1436 [TCP segment of a reassembled PDU]"
"16.970873","5.9.29.183","172.19.0.3","TLSv1.2","787","Application Data"
"16.971002","172.19.0.3","5.9.29.183","TCP","56","43520 → 9002 [ACK] Seq=14003 Ack=213865 Win=11895 Len=0"
"17.140579","5.9.29.183","172.19.0.3","TCP","1504","[TCP segment of a reassembled PDU]"
"17.140768","5.9.29.183","172.19.0.3","TCP","1504","9002 → 43520 [PSH, ACK] Seq=215313 Ack=14003 Win=65535 Len=1448 [TCP segment of a reassembled PDU]"
"17.140786","172.19.0.3","5.9.29.183","TCP","56","43520 → 9002 [ACK] Seq=14003 Ack=216761 Win=11903 Len=0"
"17.140787","5.9.29.183","172.19.0.3","TLSv1.2","787","Application Data"
"17.182083","172.19.0.3","5.9.29.183","TCP","56","43520 → 9002 [ACK] Seq=14003 Ack=217492 Win=11911 Len=0"
"17.234168","5.9.29.183","172.19.0.3","TCP","1516","[TCP segment of a reassembled PDU]"
"17.234193","172.19.0.3","5.9.29.183","TCP","56","43520 → 9002 [ACK] Seq=14003 Ack=218952 Win=11911 Len=0"
"17.234253","5.9.29.183","172.19.0.3","TCP","1516","9002 → 43520 [PSH, ACK] Seq=218952 Ack=14003 Win=65535 Len=1460 [TCP segment of a reassembled PDU]"
"17.234277","172.19.0.3","5.9.29.183","TCP","56","43520 → 9002 [ACK] Seq=14003 Ack=220412 Win=11903 Len=0"
"17.234279","5.9.29.183","172.19.0.3","TLSv1.2","763","Application Data"
"17.234286","172.19.0.3","5.9.29.183","TCP","56","43520 → 9002 [ACK] Seq=14003 Ack=221119 Win=11898 Len=0"
"17.295269","5.9.29.183","172.19.0.3","TLSv1.2","1113","Application Data"
"17.295292","172.19.0.3","5.9.29.183","TCP","56","43520 → 9002 [ACK] Seq=14003 Ack=222176 Win=11911 Len=0"
"17.794884","5.9.29.183","172.19.0.3","TCP","1516","[TCP segment of a reassembled PDU]"
"17.794940","172.19.0.3","5.9.29.183","TCP","56","43520 → 9002 [ACK] Seq=14003 Ack=223636 Win=11911 Len=0"
"17.794991","5.9.29.183","172.19.0.3","TCP","1492","9002 → 43520 [PSH, ACK] Seq=223636 Ack=14003 Win=65535 Len=1436 [TCP segment of a reassembled PDU]"
"17.795007","172.19.0.3","5.9.29.183","TCP","56","43520 → 9002 [ACK] Seq=14003 Ack=225072 Win=11901 Len=0"
"17.795009","5.9.29.183","172.19.0.3","TLSv1.2","1516","Application Data [TCP segment of a reassembled PDU]"
"17.795015","172.19.0.3","5.9.29.183","TCP","56","43520 → 9002 [ACK] Seq=14003 Ack=226532 Win=11893 Len=0"
"17.795126","5.9.29.183","172.19.0.3","TCP","1516","9002 → 43520 [PSH, ACK] Seq=226532 Ack=14003 Win=65535 Len=1460 [TCP segment of a reassembled PDU]"
"17.795138","172.19.0.3","5.9.29.183","TCP","56","43520 → 9002 [ACK] Seq=14003 Ack=227992 Win=11885 Len=0"
"17.795139","5.9.29.183","172.19.0.3","TCP","763","9002 → 43520 [PSH, ACK] Seq=227992 Ack=14003 Win=65535 Len=707 [TCP segment of a reassembled PDU]"
"17.795145","172.19.0.3","5.9.29.183","TCP","56","43520 → 9002 [ACK] Seq=14003 Ack=228699 Win=11880 Len=0"
"17.810050","5.9.29.183","172.19.0.3","TLSv1.2","1504","Application Data, Application Data"
"17.810103","172.19.0.3","5.9.29.183","TCP","56","43520 → 9002 [ACK] Seq=14003 Ack=230147 Win=11911 Len=0"
"17.810207","5.9.29.183","172.19.0.3","TCP","1516","9002 → 43520 [PSH, ACK] Seq=230147 Ack=14003 Win=65535 Len=1460 [TCP segment of a reassembled PDU]"
"17.810215","172.19.0.3","5.9.29.183","TCP","56","43520 → 9002 [ACK] Seq=14003 Ack=231607 Win=11903 Len=0"
"17.810217","5.9.29.183","172.19.0.3","TCP","1516","9002 → 43520 [PSH, ACK] Seq=231607 Ack=14003 Win=65535 Len=1460 [TCP segment of a reassembled PDU]"
"17.810221","172.19.0.3","5.9.29.183","TCP","56","43520 → 9002 [ACK] Seq=14003 Ack=233067 Win=11895 Len=0"
"17.810222","5.9.29.183","172.19.0.3","TLSv1.2","1132","Application Data, Application Data"
"17.810226","172.19.0.3","5.9.29.183","TCP","56","43520 → 9002 [ACK] Seq=14003 Ack=234143 Win=11887 Len=0"
"17.824609","5.9.29.183","172.19.0.3","TCP","1504","[TCP segment of a reassembled PDU]"
"17.824632","172.19.0.3","5.9.29.183","TCP","56","43520 → 9002 [ACK] Seq=14003 Ack=235591 Win=11911 Len=0"
"17.825280","5.9.29.183","172.19.0.3","TCP","1504","9002 → 43520 [PSH, ACK] Seq=235591 Ack=14003 Win=65535 Len=1448 [TCP segment of a reassembled PDU]"
"17.825291","172.19.0.3","5.9.29.183","TCP","56","43520 → 9002 [ACK] Seq=14003 Ack=237039 Win=11911 Len=0"
"17.825498","5.9.29.183","172.19.0.3","TLSv1.2","787","Application Data"
"17.825508","172.19.0.3","5.9.29.183","TCP","56","43520 → 9002 [ACK] Seq=14003 Ack=237770 Win=11911 Len=0"
"17.825848","172.19.0.3","5.9.29.183","TLSv1.2","599","Application Data"
"17.826108","5.9.29.183","172.19.0.3","TCP","56","9002 → 43520 [ACK] Seq=237770 Ack=14546 Win=65535 Len=0"
"17.896392","5.9.29.183","172.19.0.3","TLSv1.2","1113","Application Data"
"17.938956","172.19.0.3","5.9.29.183","TCP","56","43520 → 9002 [ACK] Seq=14546 Ack=238827 Win=11911 Len=0"
"17.975032","5.9.29.183","172.19.0.3","TCP","1516","[TCP segment of a reassembled PDU]"
"17.975056","172.19.0.3","5.9.29.183","TCP","56","43520 → 9002 [ACK] Seq=14546 Ack=240287 Win=11911 Len=0"
"17.975115","5.9.29.183","172.19.0.3","TCP","1516","9002 → 43520 [PSH, ACK] Seq=240287 Ack=14546 Win=65535 Len=1460 [TCP segment of a reassembled PDU]"
"17.975137","172.19.0.3","5.9.29.183","TCP","56","43520 → 9002 [ACK] Seq=14546 Ack=241747 Win=11903 Len=0"
"17.975141","5.9.29.183","172.19.0.3","TLSv1.2","763","Application Data"
"17.975391","172.19.0.3","5.9.29.183","TCP","56","43520 → 9002 [ACK] Seq=14546 Ack=242454 Win=11911 Len=0"
"18.075466","5.9.29.183","172.19.0.3","TCP","1516","[TCP segment of a reassembled PDU]"
"18.075544","5.9.29.183","172.19.0.3","TCP","1516","9002 → 43520 [PSH, ACK] Seq=243914 Ack=14546 Win=65535 Len=1460 [TCP segment of a reassembled PDU]"
"18.075561","5.9.29.183","172.19.0.3","TLSv1.2","763","Application Data"
"18.075713","172.19.0.3","5.9.29.183","TCP","56","43520 → 9002 [ACK] Seq=14546 Ack=246081 Win=11895 Len=0"
"18.076013","172.19.0.3","5.9.29.183","TLSv1.2","599","Application Data"
"18.076395","5.9.29.183","172.19.0.3","TCP","56","9002 → 43520 [ACK] Seq=246081 Ack=15089 Win=65535 Len=0"
"18.137456","5.9.29.183","172.19.0.3","TCP","1504","[TCP segment of a reassembled PDU]"
"18.137799","5.9.29.183","172.19.0.3","TCP","1504","9002 → 43520 [PSH, ACK] Seq=247529 Ack=15089 Win=65535 Len=1448 [TCP segment of a reassembled PDU]"
"18.137811","172.19.0.3","5.9.29.183","TCP","56","43520 → 9002 [ACK] Seq=15089 Ack=248977 Win=11911 Len=0"
"18.137844","5.9.29.183","172.19.0.3","TLSv1.2","787","Application Data"
"18.176843","5.9.29.183","172.19.0.3","TLSv1.2","599","Application Data"
"18.176866","172.19.0.3","5.9.29.183","TCP","56","43520 → 9002 [ACK] Seq=15089 Ack=250251 Win=11911 Len=0"
"18.257168","5.9.29.183","172.19.0.3","TLSv1.2","1113","Application Data"
"18.298206","172.19.0.3","5.9.29.183","TCP","56","43520 → 9002 [ACK] Seq=15089 Ack=251308 Win=11911 Len=0"
"18.299883","5.9.29.183","172.19.0.3","TCP","1504","[TCP segment of a reassembled PDU]"
"18.299944","5.9.29.183","172.19.0.3","TCP","1516","9002 → 43520 [PSH, ACK] Seq=252756 Ack=15089 Win=65535 Len=1460 [TCP segment of a reassembled PDU]"
"18.299954","5.9.29.183","172.19.0.3","TLSv1.2","1225","Application Data"
"18.300075","172.19.0.3","5.9.29.183","TCP","56","43520 → 9002 [ACK] Seq=15089 Ack=255385 Win=11895 Len=0"
"18.315545","5.9.29.183","172.19.0.3","TLSv1.2","149","Application Data"
"18.315811","172.19.0.3","5.9.29.183","TCP","56","43520 → 9002 [ACK] Seq=15089 Ack=255478 Win=11911 Len=0"
"18.362274","5.9.29.183","172.19.0.3","TCP","1516","[TCP segment of a reassembled PDU]"
"18.362350","5.9.29.183","172.19.0.3","TCP","1516","9002 → 43520 [PSH, ACK] Seq=256938 Ack=15089 Win=65535 Len=1460 [TCP segment of a reassembled PDU]"
"18.362365","5.9.29.183","172.19.0.3","TLSv1.2","763","Application Data"
"18.362511","172.19.0.3","5.9.29.183","TCP","56","43520 → 9002 [ACK] Seq=15089 Ack=259105 Win=11895 Len=0"
"18.398384","5.9.29.183","172.19.0.3","TCP","1504","[TCP segment of a reassembled PDU]"
"18.398639","172.19.0.3","5.9.29.183","TCP","56","43520 → 9002 [ACK] Seq=15089 Ack=260553 Win=11911 Len=0"
"18.398943","5.9.29.183","172.19.0.3","TCP","1504","9002 → 43520 [PSH, ACK] Seq=260553 Ack=15089 Win=65535 Len=1448 [TCP segment of a reassembled PDU]"
"18.399044","5.9.29.183","172.19.0.3","TLSv1.2","1237","Application Data"
"18.399224","172.19.0.3","5.9.29.183","TCP","56","43520 → 9002 [ACK] Seq=15089 Ack=263182 Win=11911 Len=0"
"18.399499","172.19.0.3","5.9.29.183","TLSv1.2","599","Application Data"
"18.399742","5.9.29.183","172.19.0.3","TCP","56","9002 → 43520 [ACK] Seq=263182 Ack=15632 Win=65535 Len=0"
"18.414251","5.9.29.183","172.19.0.3","TLSv1.2","149","Application Data"
"18.441264","5.9.29.183","172.19.0.3","TCP","1516","[TCP segment of a reassembled PDU]"
"18.441284","172.19.0.3","5.9.29.183","TCP","56","43520 → 9002 [ACK] Seq=15632 Ack=264735 Win=11911 Len=0"
"18.441330","5.9.29.183","172.19.0.3","TCP","1516","9002 → 43520 [PSH, ACK] Seq=264735 Ack=15632 Win=65535 Len=1460 [TCP segment of a reassembled PDU]"
"18.441365","5.9.29.183","172.19.0.3","TCP","239","9002 → 43520 [PSH, ACK] Seq=266195 Ack=15632 Win=65535 Len=183 [TCP segment of a reassembled PDU]"
"18.441429","5.9.29.183","172.19.0.3","TLSv1.2","1030","Application Data"
"18.441470","172.19.0.3","5.9.29.183","TCP","56","43520 → 9002 [ACK] Seq=15632 Ack=267352 Win=11891 Len=0"
"18.456466","5.9.29.183","172.19.0.3","TLSv1.2","149","Application Data"
"18.485767","5.9.29.183","172.19.0.3","TCP","1516","[TCP segment of a reassembled PDU]"
"18.485798","172.19.0.3","5.9.29.183","TCP","56","43520 → 9002 [ACK] Seq=15632 Ack=268905 Win=11911 Len=0"
"18.485859","5.9.29.183","172.19.0.3","TCP","1492","9002 → 43520 [PSH, ACK] Seq=268905 Ack=15632 Win=65535 Len=1436 [TCP segment of a reassembled PDU]"
"18.485916","5.9.29.183","172.19.0.3","TLSv1.2","787","Application Data"
"18.486072","172.19.0.3","5.9.29.183","TCP","56","43520 → 9002 [ACK] Seq=15632 Ack=271072 Win=11895 Len=0"
"18.569769","5.9.29.183","172.19.0.3","TCP","1516","[TCP segment of a reassembled PDU]"
"18.569833","5.9.29.183","172.19.0.3","TCP","1492","9002 → 43520 [PSH, ACK] Seq=272532 Ack=15632 Win=65535 Len=1436 [TCP segment of a reassembled PDU]"
"18.569854","172.19.0.3","5.9.29.183","TCP","56","43520 → 9002 [ACK] Seq=15632 Ack=273968 Win=11903 Len=0"
"18.569856","5.9.29.183","172.19.0.3","TLSv1.2","1237","Application Data"
"18.585017","5.9.29.183","172.19.0.3","TLSv1.2","149","Application Data"
"18.585219","172.19.0.3","5.9.29.183","TCP","56","43520 → 9002 [ACK] Seq=15632 Ack=275242 Win=11911 Len=0"
"18.625378","5.9.29.183","172.19.0.3","TCP","1516","[TCP segment of a reassembled PDU]"
"18.625457","5.9.29.183","172.19.0.3","TCP","1516","9002 → 43520 [PSH, ACK] Seq=276702 Ack=15632 Win=65535 Len=1460 [TCP segment of a reassembled PDU]"
"18.625472","5.9.29.183","172.19.0.3","TLSv1.2","763","Application Data"
"18.625627","172.19.0.3","5.9.29.183","TCP","56","43520 → 9002 [ACK] Seq=15632 Ack=278869 Win=11895 Len=0"
"18.661900","5.9.29.183","172.19.0.3","TCP","1516","[TCP segment of a reassembled PDU]"
"18.661974","5.9.29.183","172.19.0.3","TCP","1516","9002 → 43520 [PSH, ACK] Seq=280329 Ack=15632 Win=65535 Len=1460 [TCP segment of a reassembled PDU]"
"18.661995","172.19.0.3","5.9.29.183","TCP","56","43520 → 9002 [ACK] Seq=15632 Ack=281789 Win=11903 Len=0"
"18.661999","5.9.29.183","172.19.0.3","TLSv1.2","1213","Application Data"
"18.677332","5.9.29.183","172.19.0.3","TLSv1.2","149","Application Data"
"18.677601","172.19.0.3","5.9.29.183","TCP","56","43520 → 9002 [ACK] Seq=15632 Ack=283039 Win=11911 Len=0"
"18.703125","5.9.29.183","172.19.0.3","TCP","1516","[TCP segment of a reassembled PDU]"
"18.703196","5.9.29.183","172.19.0.3","TCP","1516","9002 → 43520 [PSH, ACK] Seq=284499 Ack=15632 Win=65535 Len=1460 [TCP segment of a reassembled PDU]"
"18.703211","5.9.29.183","172.19.0.3","TLSv1.2","1213","Application Data"
"18.703369","172.19.0.3","5.9.29.183","TCP","56","43520 → 9002 [ACK] Seq=15632 Ack=287116 Win=11895 Len=0"
"18.718510","5.9.29.183","172.19.0.3","TLSv1.2","149","Application Data"
"18.741055","5.9.29.183","172.19.0.3","TLSv1.2","599","Application Data"
"18.741327","172.19.0.3","5.9.29.183","TCP","56","43520 → 9002 [ACK] Seq=15632 Ack=287752 Win=11911 Len=0"
"18.797935","5.9.29.183","172.19.0.3","TCP","1504","[TCP segment of a reassembled PDU]"
"18.797998","5.9.29.183","172.19.0.3","TCP","1516","9002 → 43520 [PSH, ACK] Seq=289200 Ack=15632 Win=65535 Len=1460 [TCP segment of a reassembled PDU]"
"18.798014","5.9.29.183","172.19.0.3","TLSv1.2","775","Application Data"
"18.798375","172.19.0.3","5.9.29.183","TCP","56","43520 → 9002 [ACK] Seq=15632 Ack=291379 Win=11895 Len=0"
"18.798678","172.19.0.3","5.9.29.183","TLSv1.2","599","Application Data"
"18.799009","5.9.29.183","172.19.0.3","TCP","56","9002 → 43520 [ACK] Seq=291379 Ack=16175 Win=65535 Len=0"
"18.896448","5.9.29.183","172.19.0.3","TCP","1516","[TCP segment of a reassembled PDU]"
"18.896510","5.9.29.183","172.19.0.3","TLSv1.2","1195","Application Data"
"18.896672","172.19.0.3","5.9.29.183","TCP","56","43520 → 9002 [ACK] Seq=16175 Ack=293978 Win=11903 Len=0"
"18.902885","172.19.0.3","5.9.29.183","TLSv1.2","599","Application Data"
"18.903165","5.9.29.183","172.19.0.3","TCP","56","9002 → 43520 [ACK] Seq=293978 Ack=16718 Win=65535 Len=0"
"19.737252","5.9.29.183","172.19.0.3","TLSv1.2","599","Application Data"
"19.738217","172.19.0.3","5.9.29.183","TLSv1.2","599","Application Data"
"19.738562","5.9.29.183","172.19.0.3","TCP","56","9002 → 43520 [ACK] Seq=294521 Ack=17261 Win=65535 Len=0"
"20.659711","5.9.29.183","172.19.0.3","TCP","1504","[TCP segment of a reassembled PDU]"
"20.659858","5.9.29.183","172.19.0.3","TCP","1516","9002 → 43520 [PSH, ACK] Seq=295969 Ack=17261 Win=65535 Len=1460 [TCP segment of a reassembled PDU]"
"20.659912","5.9.29.183","172.19.0.3","TLSv1.2","1516","Application Data [TCP segment of a reassembled PDU]"
"20.659917","5.9.29.183","172.19.0.3","TCP","1516","9002 → 43520 [PSH, ACK] Seq=298889 Ack=17261 Win=65535 Len=1460 [TCP segment of a reassembled PDU]"
"20.659921","5.9.29.183","172.19.0.3","TCP","751","9002 → 43520 [PSH, ACK] Seq=300349 Ack=17261 Win=65535 Len=695 [TCP segment of a reassembled PDU]"
"20.659924","5.9.29.183","172.19.0.3","TLSv1.2","1504","Application Data [TCP segment of a reassembled PDU]"
"20.660015","172.19.0.3","5.9.29.183","TCP","56","43520 → 9002 [ACK] Seq=17261 Ack=302492 Win=11871 Len=0"
"20.660406","172.19.0.3","5.9.29.183","TLSv1.2","599","Application Data"
"20.660671","5.9.29.183","172.19.0.3","TCP","56","9002 → 43520 [ACK] Seq=302492 Ack=17804 Win=65535 Len=0"
"20.675122","5.9.29.183","172.19.0.3","TCP","1504","9002 → 43520 [PSH, ACK] Seq=302492 Ack=17804 Win=65535 Len=1448 [TCP segment of a reassembled PDU]"
"20.675189","5.9.29.183","172.19.0.3","TCP","1516","9002 → 43520 [PSH, ACK] Seq=303940 Ack=17804 Win=65535 Len=1460 [TCP segment of a reassembled PDU]"
"20.675207","172.19.0.3","5.9.29.183","TCP","56","43520 → 9002 [ACK] Seq=17804 Ack=305400 Win=11903 Len=0"
"20.675210","5.9.29.183","172.19.0.3","TLSv1.2","1492","Application Data [TCP segment of a reassembled PDU]"
"20.676134","5.9.29.183","172.19.0.3","TLSv1.2","1504","Application Data, Application Data"
"20.676148","172.19.0.3","5.9.29.183","TCP","56","43520 → 9002 [ACK] Seq=17804 Ack=308284 Win=11911 Len=0"
"20.690694","5.9.29.183","172.19.0.3","TLSv1.2","1516","Application Data [TCP segment of a reassembled PDU]"
"20.690771","5.9.29.183","172.19.0.3","TCP","1516","9002 → 43520 [PSH, ACK] Seq=309744 Ack=17804 Win=65535 Len=1460 [TCP segment of a reassembled PDU]"
"20.690784","5.9.29.183","172.19.0.3","TCP","1480","9002 → 43520 [PSH, ACK] Seq=311204 Ack=17804 Win=65535 Len=1424 [TCP segment of a reassembled PDU]"
"20.690948","172.19.0.3","5.9.29.183","TCP","56","43520 → 9002 [ACK] Seq=17804 Ack=312628 Win=11895 Len=0"
"20.793557","5.9.29.183","172.19.0.3","TLSv1.2","1516","Application Data, Application Data"
"20.793629","5.9.29.183","172.19.0.3","TCP","1516","9002 → 43520 [PSH, ACK] Seq=314088 Ack=17804 Win=65535 Len=1460 [TCP segment of a reassembled PDU]"
"20.793651","172.19.0.3","5.9.29.183","TCP","56","43520 → 9002 [ACK] Seq=17804 Ack=315548 Win=11903 Len=0"
"20.793653","5.9.29.183","172.19.0.3","TCP","1516","9002 → 43520 [PSH, ACK] Seq=315548 Ack=17804 Win=65535 Len=1460 [TCP segment of a reassembled PDU]"
"20.793657","5.9.29.183","172.19.0.3","TLSv1.2","989","Application Data, Application Data"
"20.793767","172.19.0.3","5.9.29.183","TCP","56","43520 → 9002 [ACK] Seq=17804 Ack=317941 Win=11887 Len=0"
"20.808623","5.9.29.183","172.19.0.3","TCP","1516","[TCP segment of a reassembled PDU]"
"20.808731","5.9.29.183","172.19.0.3","TCP","1492","9002 → 43520 [PSH, ACK] Seq=319401 Ack=17804 Win=65535 Len=1436 [TCP segment of a reassembled PDU]"
"20.808751","172.19.0.3","5.9.29.183","TCP","56","43520 → 9002 [ACK] Seq=17804 Ack=320837 Win=11901 Len=0"
"20.808755","5.9.29.183","172.19.0.3","TLSv1.2","1516","Application Data [TCP segment of a reassembled PDU]"
"20.808824","5.9.29.183","172.19.0.3","TLSv1.2","898","Application Data"
"20.808871","172.19.0.3","5.9.29.183","TCP","56","43520 → 9002 [ACK] Seq=17804 Ack=323139 Win=11885 Len=0"
"20.809209","172.19.0.3","5.9.29.183","TLSv1.2","599","Application Data"
"20.809458","5.9.29.183","172.19.0.3","TCP","56","9002 → 43520 [ACK] Seq=323139 Ack=18347 Win=65535 Len=0"
"20.824302","5.9.29.183","172.19.0.3","TCP","1516","[TCP segment of a reassembled PDU]"
"20.824369","5.9.29.183","172.19.0.3","TCP","1516","9002 → 43520 [PSH, ACK] Seq=324599 Ack=18347 Win=65535 Len=1460 [TCP segment of a reassembled PDU]"
"20.824386","172.19.0.3","5.9.29.183","TCP","56","43520 → 9002 [ACK] Seq=18347 Ack=326059 Win=11903 Len=0"
"20.824389","5.9.29.183","172.19.0.3","TLSv1.2","763","Application Data"
"20.867702","172.19.0.3","5.9.29.183","TCP","56","43520 → 9002 [ACK] Seq=18347 Ack=326766 Win=11911 Len=0"
"20.908197","5.9.29.183","172.19.0.3","TCP","1516","[TCP segment of a reassembled PDU]"
"20.908223","172.19.0.3","5.9.29.183","TCP","56","43520 → 9002 [ACK] Seq=18347 Ack=328226 Win=11911 Len=0"
"20.908284","5.9.29.183","172.19.0.3","TCP","1516","9002 → 43520 [PSH, ACK] Seq=328226 Ack=18347 Win=65535 Len=1460 [TCP segment of a reassembled PDU]"
"20.908336","172.19.0.3","5.9.29.183","TCP","56","43520 → 9002 [ACK] Seq=18347 Ack=329686 Win=11903 Len=0"
"20.908340","5.9.29.183","172.19.0.3","TLSv1.2","763","Application Data"
"20.908349","172.19.0.3","5.9.29.183","TCP","56","43520 → 9002 [ACK] Seq=18347 Ack=330393 Win=11898 Len=0"
"20.923222","5.9.29.183","172.19.0.3","TLSv1.2","599","Application Data"
"20.923243","172.19.0.3","5.9.29.183","TCP","56","43520 → 9002 [ACK] Seq=18347 Ack=330936 Win=11911 Len=0"
"20.947932","5.9.29.183","172.19.0.3","TCP","1034","[TCP segment of a reassembled PDU]"
"20.948078","5.9.29.183","172.19.0.3","TCP","1516","9002 → 43520 [PSH, ACK] Seq=331914 Ack=18347 Win=65535 Len=1460 [TCP segment of a reassembled PDU]"
"20.948214","5.9.29.183","172.19.0.3","TLSv1.2","1245","Application Data"
"20.948297","172.19.0.3","5.9.29.183","TCP","56","43520 → 9002 [ACK] Seq=18347 Ack=334563 Win=11895 Len=0"
"21.002856","5.9.29.183","172.19.0.3","TCP","1516","[TCP segment of a reassembled PDU]"
"21.002932","5.9.29.183","172.19.0.3","TLSv1.2","167","Application Data"
"21.002961","172.19.0.3","5.9.29.183","TCP","56","43520 → 9002 [ACK] Seq=18347 Ack=336134 Win=11903 Len=0"
"21.009027","172.19.0.3","5.9.29.183","TLSv1.2","599","Application Data"
"21.009420","5.9.29.183","172.19.0.3","TCP","56","9002 → 43520 [ACK] Seq=336134 Ack=18890 Win=65535 Len=0"
"22.262603","5.9.29.183","172.19.0.3","TLSv1.2","599","Application Data"
"22.263723","172.19.0.3","5.9.29.183","TLSv1.2","599","Application Data"
"22.264036","5.9.29.183","172.19.0.3","TCP","56","9002 → 43520 [ACK] Seq=336677 Ack=19433 Win=65535 Len=0"
"23.048053","5.9.29.183","172.19.0.3","TCP","1516","[TCP segment of a reassembled PDU]"
"23.048118","5.9.29.183","172.19.0.3","TCP","1492","9002 → 43520 [PSH, ACK] Seq=338137 Ack=19433 Win=65535 Len=1436 [TCP segment of a reassembled PDU]"
"23.048135","5.9.29.183","172.19.0.3","TLSv1.2","787","Application Data"
"23.048223","172.19.0.3","5.9.29.183","TCP","56","43520 → 9002 [ACK] Seq=19433 Ack=340304 Win=11895 Len=0"
"23.072277","5.9.29.183","172.19.0.3","TLSv1.2","599","Application Data"
"23.113752","172.19.0.3","5.9.29.183","TCP","56","43520 → 9002 [ACK] Seq=19433 Ack=340847 Win=11911 Len=0"
"23.161176","5.9.29.183","172.19.0.3","TCP","1504","[TCP segment of a reassembled PDU]"
"23.161198","172.19.0.3","5.9.29.183","TCP","56","43520 → 9002 [ACK] Seq=19433 Ack=342295 Win=11911 Len=0"
"23.161238","5.9.29.183","172.19.0.3","TCP","1516","9002 → 43520 [PSH, ACK] Seq=342295 Ack=19433 Win=65535 Len=1460 [TCP segment of a reassembled PDU]"
"23.161268","172.19.0.3","5.9.29.183","TCP","56","43520 → 9002 [ACK] Seq=19433 Ack=343755 Win=11903 Len=0"
"23.161273","5.9.29.183","172.19.0.3","TLSv1.2","775","Application Data"
"23.161395","172.19.0.3","5.9.29.183","TCP","56","43520 → 9002 [ACK] Seq=19433 Ack=344474 Win=11898 Len=0"
"23.228177","5.9.29.183","172.19.0.3","TCP","1516","[TCP segment of a reassembled PDU]"
"23.228196","172.19.0.3","5.9.29.183","TCP","56","43520 → 9002 [ACK] Seq=19433 Ack=345934 Win=11911 Len=0"
"23.228230","5.9.29.183","172.19.0.3","TCP","1516","9002 → 43520 [PSH, ACK] Seq=345934 Ack=19433 Win=65535 Len=1460 [TCP segment of a reassembled PDU]"
"23.228238","172.19.0.3","5.9.29.183","TCP","56","43520 → 9002 [ACK] Seq=19433 Ack=347394 Win=11903 Len=0"
"23.228240","5.9.29.183","172.19.0.3","TLSv1.2","763","Application Data"
"23.228244","172.19.0.3","5.9.29.183","TCP","56","43520 → 9002 [ACK] Seq=19433 Ack=348101 Win=11898 Len=0"
"23.253990","5.9.29.183","172.19.0.3","TCP","1516","[TCP segment of a reassembled PDU]"
"23.254009","172.19.0.3","5.9.29.183","TCP","56","43520 → 9002 [ACK] Seq=19433 Ack=349561 Win=11911 Len=0"
"23.254043","5.9.29.183","172.19.0.3","TCP","1492","9002 → 43520 [PSH, ACK] Seq=349561 Ack=19433 Win=65535 Len=1436 [TCP segment of a reassembled PDU]"
"23.254056","172.19.0.3","5.9.29.183","TCP","56","43520 → 9002 [ACK] Seq=19433 Ack=350997 Win=11903 Len=0"
"23.254327","5.9.29.183","172.19.0.3","TLSv1.2","787","Application Data"
"23.254339","172.19.0.3","5.9.29.183","TCP","56","43520 → 9002 [ACK] Seq=19433 Ack=351728 Win=11911 Len=0"
"23.254723","172.19.0.3","5.9.29.183","TLSv1.2","599","Application Data"
"23.254954","5.9.29.183","172.19.0.3","TCP","56","9002 → 43520 [ACK] Seq=351728 Ack=19976 Win=65535 Len=0"
"23.292401","5.9.29.183","172.19.0.3","TLSv1.2","1113","Application Data"
"23.333299","172.19.0.3","5.9.29.183","TCP","56","43520 → 9002 [ACK] Seq=19976 Ack=352785 Win=11911 Len=0"
"23.369131","5.9.29.183","172.19.0.3","TCP","1504","[TCP segment of a reassembled PDU]"
"23.369177","172.19.0.3","5.9.29.183","TCP","56","43520 → 9002 [ACK] Seq=19976 Ack=354233 Win=11911 Len=0"
"23.369246","5.9.29.183","172.19.0.3","TCP","1504","9002 → 43520 [PSH, ACK] Seq=354233 Ack=19976 Win=65535 Len=1448 [TCP segment of a reassembled PDU]"
"23.369266","172.19.0.3","5.9.29.183","TCP","56","43520 → 9002 [ACK] Seq=19976 Ack=355681 Win=11903 Len=0"
"23.369346","5.9.29.183","172.19.0.3","TLSv1.2","787","Application Data"
"23.369356","172.19.0.3","5.9.29.183","TCP","56","43520 → 9002 [ACK] Seq=19976 Ack=356412 Win=11898 Len=0"
"23.383777","5.9.29.183","172.19.0.3","TCP","1504","[TCP segment of a reassembled PDU]"
"23.384129","5.9.29.183","172.19.0.3","TCP","1504","9002 → 43520 [PSH, ACK] Seq=357860 Ack=19976 Win=65535 Len=1448 [TCP segment of a reassembled PDU]"
"23.384146","172.19.0.3","5.9.29.183","TCP","56","43520 → 9002 [ACK] Seq=19976 Ack=359308 Win=11911 Len=0"
"23.384521","5.9.29.183","172.19.0.3","TLSv1.2","787","Application Data"
"23.384629","172.19.0.3","5.9.29.183","TCP","56","43520 → 9002 [ACK] Seq=19976 Ack=360039 Win=11911 Len=0"
"23.410860","5.9.29.183","172.19.0.3","TCP","1516","[TCP segment of a reassembled PDU]"
"23.410911","5.9.29.183","172.19.0.3","TLSv1.2","167","Application Data"
"23.411043","172.19.0.3","5.9.29.183","TCP","56","43520 → 9002 [ACK] Seq=19976 Ack=361610 Win=11903 Len=0"
"23.500124","5.9.29.183","172.19.0.3","TCP","1516","[TCP segment of a reassembled PDU]"
"23.500204","5.9.29.183","172.19.0.3","TCP","1492","9002 → 43520 [PSH, ACK] Seq=363070 Ack=19976 Win=65535 Len=1436 [TCP segment of a reassembled PDU]"
"23.500218","5.9.29.183","172.19.0.3","TLSv1.2","787","Application Data"
"23.500354","172.19.0.3","5.9.29.183","TCP","56","43520 → 9002 [ACK] Seq=19976 Ack=365237 Win=11893 Len=0"
"23.500711","172.19.0.3","5.9.29.183","TLSv1.2","599","Application Data"
"23.501062","5.9.29.183","172.19.0.3","TCP","56","9002 → 43520 [ACK] Seq=365237 Ack=20519 Win=65535 Len=0"
"23.558567","5.9.29.183","172.19.0.3","TCP","1504","[TCP segment of a reassembled PDU]"
"23.558858","5.9.29.183","172.19.0.3","TCP","1504","9002 → 43520 [PSH, ACK] Seq=366685 Ack=20519 Win=65535 Len=1448 [TCP segment of a reassembled PDU]"
"23.558867","172.19.0.3","5.9.29.183","TCP","56","43520 → 9002 [ACK] Seq=20519 Ack=368133 Win=11911 Len=0"
"23.558979","5.9.29.183","172.19.0.3","TLSv1.2","787","Application Data"
"23.596720","5.9.29.183","172.19.0.3","TLSv1.2","599","Application Data"
"23.596739","172.19.0.3","5.9.29.183","TCP","56","43520 → 9002 [ACK] Seq=20519 Ack=369407 Win=11911 Len=0"
"23.626120","5.9.29.183","172.19.0.3","TCP","1504","[TCP segment of a reassembled PDU]"
"23.626163","5.9.29.183","172.19.0.3","TCP","1516","9002 → 43520 [PSH, ACK] Seq=370855 Ack=20519 Win=65535 Len=1460 [TCP segment of a reassembled PDU]"
"23.626171","5.9.29.183","172.19.0.3","TLSv1.2","775","Application Data"
"23.626274","172.19.0.3","5.9.29.183","TCP","56","43520 → 9002 [ACK] Seq=20519 Ack=373034 Win=11895 Len=0"
"23.664480","5.9.29.183","172.19.0.3","TCP","1516","[TCP segment of a reassembled PDU]"
"23.664528","5.9.29.183","172.19.0.3","TCP","1492","9002 → 43520 [PSH, ACK] Seq=374494 Ack=20519 Win=65535 Len=1436 [TCP segment of a reassembled PDU]"
"23.664540","172.19.0.3","5.9.29.183","TCP","56","43520 → 9002 [ACK] Seq=20519 Ack=375930 Win=11903 Len=0"
"23.664542","5.9.29.183","172.19.0.3","TLSv1.2","1237","Application Data"
"23.680008","5.9.29.183","172.19.0.3","TLSv1.2","149","Application Data"
"23.680195","172.19.0.3","5.9.29.183","TCP","56","43520 → 9002 [ACK] Seq=20519 Ack=377204 Win=11911 Len=0"
"23.718408","5.9.29.183","172.19.0.3","TCP","1504","[TCP segment of a reassembled PDU]"
"23.718487","5.9.29.183","172.19.0.3","TCP","1516","9002 → 43520 [PSH, ACK] Seq=378652 Ack=20519 Win=65535 Len=1460 [TCP segment of a reassembled PDU]"
"23.718497","5.9.29.183","172.19.0.3","TLSv1.2","1225","Application Data"
"23.718599","172.19.0.3","5.9.29.183","TCP","56","43520 → 9002 [ACK] Seq=20519 Ack=381281 Win=11895 Len=0"
"23.733912","5.9.29.183","172.19.0.3","TLSv1.2","149","Application Data"
"23.755166","5.9.29.183","172.19.0.3","TCP","1516","[TCP segment of a reassembled PDU]"
"23.755182","172.19.0.3","5.9.29.183","TCP","56","43520 → 9002 [ACK] Seq=20519 Ack=382834 Win=11909 Len=0"
"23.755210","5.9.29.183","172.19.0.3","TLSv1.2","167","Application Data"
"23.790551","5.9.29.183","172.19.0.3","TCP","1516","[TCP segment of a reassembled PDU]"
"23.790569","172.19.0.3","5.9.29.183","TCP","56","43520 → 9002 [ACK] Seq=20519 Ack=384405 Win=11911 Len=0"
"23.790602","5.9.29.183","172.19.0.3","TCP","1492","9002 → 43520 [PSH, ACK] Seq=384405 Ack=20519 Win=65535 Len=1436 [TCP segment of a reassembled PDU]"
"23.791150","5.9.29.183","172.19.0.3","TLSv1.2","1237","Application Data"
"23.791157","172.19.0.3","5.9.29.183","TCP","56","43520 → 9002 [ACK] Seq=20519 Ack=387022 Win=11911 Len=0"
"23.791242","5.9.29.183","172.19.0.3","TCP","1504","[TCP segment of a reassembled PDU]"
"23.794865","5.9.29.183","172.19.0.3","TLSv1.2","1504","Application Data [TCP segment of a reassembled PDU]"
"23.794874","172.19.0.3","5.9.29.183","TCP","56","43520 → 9002 [ACK] Seq=20519 Ack=389918 Win=11911 Len=0"
"23.795218","172.19.0.3","5.9.29.183","TLSv1.2","599","Application Data"
"23.795414","5.9.29.183","172.19.0.3","TCP","56","9002 → 43520 [ACK] Seq=389918 Ack=21062 Win=65535 Len=0"
"23.807447","5.9.29.183","172.19.0.3","TLSv1.2","880","Application Data"
"23.852530","172.19.0.3","5.9.29.183","TCP","56","43520 → 9002 [ACK] Seq=21062 Ack=390742 Win=11911 Len=0"
"23.906489","5.9.29.183","172.19.0.3","TCP","1504","[TCP segment of a reassembled PDU]"
"23.906540","5.9.29.183","172.19.0.3","TCP","1504","9002 → 43520 [PSH, ACK] Seq=392190 Ack=21062 Win=65535 Len=1448 [TCP segment of a reassembled PDU]"
"23.906572","5.9.29.183","172.19.0.3","TLSv1.2","787","Application Data"
"23.906690","172.19.0.3","5.9.29.183","TCP","56","43520 → 9002 [ACK] Seq=21062 Ack=394369 Win=11895 Len=0"
"23.932524","5.9.29.183","172.19.0.3","TCP","1504","[TCP segment of a reassembled PDU]"
"23.932585","5.9.29.183","172.19.0.3","TCP","1516","9002 → 43520 [PSH, ACK] Seq=395817 Ack=21062 Win=65535 Len=1460 [TCP segment of a reassembled PDU]"
"23.932598","172.19.0.3","5.9.29.183","TCP","56","43520 → 9002 [ACK] Seq=21062 Ack=397277 Win=11903 Len=0"
"23.932600","5.9.29.183","172.19.0.3","TCP","229","9002 → 43520 [PSH, ACK] Seq=397277 Ack=21062 Win=65535 Len=173 [TCP segment of a reassembled PDU]"
"23.932675","5.9.29.183","172.19.0.3","TLSv1.2","602","Application Data"
"23.932780","172.19.0.3","5.9.29.183","TCP","56","43520 → 9002 [ACK] Seq=21062 Ack=397996 Win=11911 Len=0"
"23.942357","5.9.29.183","172.19.0.3","TCP","1504","[TCP segment of a reassembled PDU]"
"23.942407","5.9.29.183","172.19.0.3","TCP","1504","9002 → 43520 [PSH, ACK] Seq=399444 Ack=21062 Win=65535 Len=1448 [TCP segment of a reassembled PDU]"
"23.942531","172.19.0.3","5.9.29.183","TCP","56","43520 → 9002 [ACK] Seq=21062 Ack=400892 Win=11903 Len=0"
"23.948004","5.9.29.183","172.19.0.3","TLSv1.2","1330","Application Data, Application Data"
"23.948341","172.19.0.3","5.9.29.183","TLSv1.2","599","Application Data"
"23.948620","5.9.29.183","172.19.0.3","TCP","56","9002 → 43520 [ACK] Seq=402166 Ack=21605 Win=65535 Len=0"
"23.981444","5.9.29.183","172.19.0.3","TCP","1504","[TCP segment of a reassembled PDU]"
"23.981493","5.9.29.183","172.19.0.3","TCP","1516","9002 → 43520 [PSH, ACK] Seq=403614 Ack=21605 Win=65535 Len=1460 [TCP segment of a reassembled PDU]"
"23.981529","5.9.29.183","172.19.0.3","TLSv1.2","1225","Application Data"
"23.981632","172.19.0.3","5.9.29.183","TCP","56","43520 → 9002 [ACK] Seq=21605 Ack=406243 Win=11893 Len=0"
"23.997291","5.9.29.183","172.19.0.3","TLSv1.2","149","Application Data"
"24.015627","5.9.29.183","172.19.0.3","TCP","1516","[TCP segment of a reassembled PDU]"
"24.015678","172.19.0.3","5.9.29.183","TCP","56","43520 → 9002 [ACK] Seq=21605 Ack=407796 Win=11911 Len=0"
"24.016110","5.9.29.183","172.19.0.3","TCP","1516","9002 → 43520 [PSH, ACK] Seq=407796 Ack=21605 Win=65535 Len=1460 [TCP segment of a reassembled PDU]"
"24.016121","5.9.29.183","172.19.0.3","TLSv1.2","763","Application Data"
"24.016412","172.19.0.3","5.9.29.183","TCP","56","43520 → 9002 [ACK] Seq=21605 Ack=409963 Win=11895 Len=0"
"24.053761","5.9.29.183","172.19.0.3","TLSv1.2","1113","Application Data"
"24.094638","172.19.0.3","5.9.29.183","TCP","56","43520 → 9002 [ACK] Seq=21605 Ack=411020 Win=11911 Len=0"
"24.728188","5.9.29.183","172.19.0.3","TCP","1504","[TCP segment of a reassembled PDU]"
"24.728247","172.19.0.3","5.9.29.183","TCP","56","43520 → 9002 [ACK] Seq=21605 Ack=412468 Win=11911 Len=0"
"24.728251","5.9.29.183","172.19.0.3","TCP","1516","9002 → 43520 [PSH, ACK] Seq=412468 Ack=21605 Win=65535 Len=1460 [TCP segment of a reassembled PDU]"
"24.728264","172.19.0.3","5.9.29.183","TCP","56","43520 → 9002 [ACK] Seq=21605 Ack=413928 Win=11903 Len=0"
"24.728265","5.9.29.183","172.19.0.3","TLSv1.2","775","Application Data"
"24.728275","172.19.0.3","5.9.29.183","TCP","56","43520 → 9002 [ACK] Seq=21605 Ack=414647 Win=11898 Len=0"
"24.733481","172.19.0.3","5.9.29.183","TLSv1.2","599","Application Data"
"24.733911","5.9.29.183","172.19.0.3","TCP","56","9002 → 43520 [ACK] Seq=414647 Ack=22148 Win=65535 Len=0"
"25.249306","5.9.29.183","172.19.0.3","TLSv1.2","599","Application Data"
"25.250243","172.19.0.3","5.9.29.183","TLSv1.2","599","Application Data"
"25.250583","5.9.29.183","172.19.0.3","TCP","56","9002 → 43520 [ACK] Seq=415190 Ack=22691 Win=65535 Len=0"
"25.752950","5.9.29.183","172.19.0.3","TLSv1.2","599","Application Data"
"25.794170","172.19.0.3","5.9.29.183","TCP","56","43520 → 9002 [ACK] Seq=22691 Ack=415733 Win=11911 Len=0"
"25.922753","5.9.29.183","172.19.0.3","TCP","1516","[TCP segment of a reassembled PDU]"
"25.922781","172.19.0.3","5.9.29.183","TCP","56","43520 → 9002 [ACK] Seq=22691 Ack=417193 Win=11911 Len=0"
"25.922826","5.9.29.183","172.19.0.3","TCP","1492","9002 → 43520 [PSH, ACK] Seq=417193 Ack=22691 Win=65535 Len=1436 [TCP segment of a reassembled PDU]"
"25.922844","172.19.0.3","5.9.29.183","TCP","56","43520 → 9002 [ACK] Seq=22691 Ack=418629 Win=11903 Len=0"
"25.922847","5.9.29.183","172.19.0.3","TLSv1.2","787","Application Data"
"25.922854","172.19.0.3","5.9.29.183","TCP","56","43520 → 9002 [ACK] Seq=22691 Ack=419360 Win=11898 Len=0"
"26.012680","5.9.29.183","172.19.0.3","TCP","1504","[TCP segment of a reassembled PDU]"
"26.012701","172.19.0.3","5.9.29.183","TCP","56","43520 → 9002 [ACK] Seq=22691 Ack=420808 Win=11911 Len=0"
"26.012767","5.9.29.183","172.19.0.3","TCP","1516","9002 → 43520 [PSH, ACK] Seq=420808 Ack=22691 Win=65535 Len=1460 [TCP segment of a reassembled PDU]"
"26.012778","172.19.0.3","5.9.29.183","TCP","56","43520 → 9002 [ACK] Seq=22691 Ack=422268 Win=11903 Len=0"
"26.012781","5.9.29.183","172.19.0.3","TLSv1.2","775","Application Data"
"26.012788","172.19.0.3","5.9.29.183","TCP","56","43520 → 9002 [ACK] Seq=22691 Ack=422987 Win=11898 Len=0"
"26.051688","5.9.29.183","172.19.0.3","TLSv1.2","599","Application Data"
"26.051725","172.19.0.3","5.9.29.183","TCP","56","43520 → 9002 [ACK] Seq=22691 Ack=423530 Win=11911 Len=0"
"26.094299","5.9.29.183","172.19.0.3","TCP","1504","[TCP segment of a reassembled PDU]"
"26.094328","172.19.0.3","5.9.29.183","TCP","56","43520 → 9002 [ACK] Seq=22691 Ack=424978 Win=11911 Len=0"
"26.094372","5.9.29.183","172.19.0.3","TCP","1516","9002 → 43520 [PSH, ACK] Seq=424978 Ack=22691 Win=65535 Len=1460 [TCP segment of a reassembled PDU]"
"26.094385","172.19.0.3","5.9.29.183","TCP","56","43520 → 9002 [ACK] Seq=22691 Ack=426438 Win=11903 Len=0"
"26.094388","5.9.29.183","172.19.0.3","TLSv1.2","775","Application Data"
"26.094394","172.19.0.3","5.9.29.183","TCP","56","43520 → 9002 [ACK] Seq=22691 Ack=427157 Win=11898 Len=0"
"26.138409","5.9.29.183","172.19.0.3","TCP","1516","[TCP segment of a reassembled PDU]"
"26.138435","172.19.0.3","5.9.29.183","TCP","56","43520 → 9002 [ACK] Seq=22691 Ack=428617 Win=11911 Len=0"
"26.138488","5.9.29.183","172.19.0.3","TLSv1.2","167","Application Data"
"26.138504","172.19.0.3","5.9.29.183","TCP","56","43520 → 9002 [ACK] Seq=22691 Ack=428728 Win=11911 Len=0"
"26.245027","5.9.29.183","172.19.0.3","TCP","1504","[TCP segment of a reassembled PDU]"
"26.245053","172.19.0.3","5.9.29.183","TCP","56","43520 → 9002 [ACK] Seq=22691 Ack=430176 Win=11911 Len=0"
"26.245092","5.9.29.183","172.19.0.3","TCP","1516","9002 → 43520 [PSH, ACK] Seq=430176 Ack=22691 Win=65535 Len=1460 [TCP segment of a reassembled PDU]"
"26.245104","172.19.0.3","5.9.29.183","TCP","56","43520 → 9002 [ACK] Seq=22691 Ack=431636 Win=11903 Len=0"
"26.245108","5.9.29.183","172.19.0.3","TLSv1.2","775","Application Data"
"26.245118","172.19.0.3","5.9.29.183","TCP","56","43520 → 9002 [ACK] Seq=22691 Ack=432355 Win=11898 Len=0"
"26.329885","5.9.29.183","172.19.0.3","TCP","1516","[TCP segment of a reassembled PDU]"
"26.329991","5.9.29.183","172.19.0.3","TCP","1492","9002 → 43520 [PSH, ACK] Seq=433815 Ack=22691 Win=65535 Len=1436 [TCP segment of a reassembled PDU]"
"26.330021","172.19.0.3","5.9.29.183","TCP","56","43520 → 9002 [ACK] Seq=22691 Ack=435251 Win=11903 Len=0"
"26.330026","5.9.29.183","172.19.0.3","TLSv1.2","273","Application Data"
"26.330290","172.19.0.3","5.9.29.183","TCP","56","43520 → 9002 [ACK] Seq=22691 Ack=435468 Win=11911 Len=0"
"26.336804","172.19.0.3","5.9.29.183","TLSv1.2","599","Application Data"
"26.337191","5.9.29.183","172.19.0.3","TCP","56","9002 → 43520 [ACK] Seq=435468 Ack=23234 Win=65535 Len=0"
"26.929678","5.9.29.183","172.19.0.3","TLSv1.2","599","Application Data"
"26.930441","172.19.0.3","5.9.29.183","TLSv1.2","599","Application Data"
"26.930740","5.9.29.183","172.19.0.3","TCP","56","9002 → 43520 [ACK] Seq=436011 Ack=23777 Win=65535 Len=0"
"28.016637","5.9.29.183","172.19.0.3","TLSv1.2","599","Application Data"
"28.016721","5.9.29.183","172.19.0.3","TCP","1516","[TCP segment of a reassembled PDU]"
"28.016760","5.9.29.183","172.19.0.3","TCP","1516","9002 → 43520 [PSH, ACK] Seq=438014 Ack=23777 Win=65535 Len=1460 [TCP segment of a reassembled PDU]"
"28.016763","5.9.29.183","172.19.0.3","TLSv1.2","763","Application Data"
"28.016766","5.9.29.183","172.19.0.3","TCP","1516","[TCP segment of a reassembled PDU]"
"28.016818","5.9.29.183","172.19.0.3","TCP","1492","9002 → 43520 [PSH, ACK] Seq=441641 Ack=23777 Win=65535 Len=1436 [TCP segment of a reassembled PDU]"
"28.017000","172.19.0.3","5.9.29.183","TCP","56","43520 → 9002 [ACK] Seq=23777 Ack=443077 Win=11869 Len=0"
"28.033021","5.9.29.183","172.19.0.3","TLSv1.2","1516","Application Data [TCP segment of a reassembled PDU]"
"28.033066","5.9.29.183","172.19.0.3","TCP","1492","9002 → 43520 [PSH, ACK] Seq=444537 Ack=23777 Win=65535 Len=1436 [TCP segment of a reassembled PDU]"
"28.033078","172.19.0.3","5.9.29.183","TCP","56","43520 → 9002 [ACK] Seq=23777 Ack=445973 Win=11903 Len=0"
"28.033080","5.9.29.183","172.19.0.3","TCP","1516","9002 → 43520 [PSH, ACK] Seq=445973 Ack=23777 Win=65535 Len=1460 [TCP segment of a reassembled PDU]"
"28.033083","5.9.29.183","172.19.0.3","TLSv1.2","1516","Application Data [TCP segment of a reassembled PDU]"
"28.033085","5.9.29.183","172.19.0.3","TLSv1.2","1197","Application Data"
"28.033201","172.19.0.3","5.9.29.183","TCP","56","43520 → 9002 [ACK] Seq=23777 Ack=450034 Win=11879 Len=0"
"28.037786","5.9.29.183","172.19.0.3","TCP","1504","[TCP segment of a reassembled PDU]"
"28.049091","5.9.29.183","172.19.0.3","TLSv1.2","179","Application Data"
"28.049110","172.19.0.3","5.9.29.183","TCP","56","43520 → 9002 [ACK] Seq=23777 Ack=451605 Win=11911 Len=0"
"28.071089","5.9.29.183","172.19.0.3","TCP","1516","[TCP segment of a reassembled PDU]"
"28.071140","5.9.29.183","172.19.0.3","TCP","1492","9002 → 43520 [PSH, ACK] Seq=453065 Ack=23777 Win=65535 Len=1436 [TCP segment of a reassembled PDU]"
"28.071149","5.9.29.183","172.19.0.3","TLSv1.2","787","Application Data"
"28.071266","172.19.0.3","5.9.29.183","TCP","56","43520 → 9002 [ACK] Seq=23777 Ack=455232 Win=11895 Len=0"
"28.171503","5.9.29.183","172.19.0.3","TCP","1516","[TCP segment of a reassembled PDU]"
"28.171569","5.9.29.183","172.19.0.3","TLSv1.2","1195","Application Data"
"28.171595","172.19.0.3","5.9.29.183","TCP","56","43520 → 9002 [ACK] Seq=23777 Ack=457831 Win=11903 Len=0"
"28.172005","172.19.0.3","5.9.29.183","TLSv1.2","599","Application Data"
"28.172187","5.9.29.183","172.19.0.3","TCP","56","9002 → 43520 [ACK] Seq=457831 Ack=24320 Win=65535 Len=0"
"28.223560","5.9.29.183","172.19.0.3","TCP","1516","[TCP segment of a reassembled PDU]"
"28.223608","5.9.29.183","172.19.0.3","TCP","1516","9002 → 43520 [PSH, ACK] Seq=459291 Ack=24320 Win=65535 Len=1460 [TCP segment of a reassembled PDU]"
"28.223616","5.9.29.183","172.19.0.3","TLSv1.2","763","Application Data"
"28.223754","172.19.0.3","5.9.29.183","TCP","56","43520 → 9002 [ACK] Seq=24320 Ack=461458 Win=11895 Len=0"
"28.275182","5.9.29.183","172.19.0.3","TCP","1516","[TCP segment of a reassembled PDU]"
"28.275258","5.9.29.183","172.19.0.3","TCP","124","9002 → 43520 [PSH, ACK] Seq=462918 Ack=24320 Win=65535 Len=68 [TCP segment of a reassembled PDU]"
"28.275310","172.19.0.3","5.9.29.183","TCP","56","43520 → 9002 [ACK] Seq=24320 Ack=462986 Win=11909 Len=0"
"28.275390","5.9.29.183","172.19.0.3","TCP","1516","9002 → 43520 [PSH, ACK] Seq=462986 Ack=24320 Win=65535 Len=1460 [TCP segment of a reassembled PDU]"
"28.275399","5.9.29.183","172.19.0.3","TLSv1.2","1145","Application Data"
"28.275471","172.19.0.3","5.9.29.183","TCP","56","43520 → 9002 [ACK] Seq=24320 Ack=465535 Win=11891 Len=0"
"28.275766","172.19.0.3","5.9.29.183","TLSv1.2","599","Application Data"
"28.276033","5.9.29.183","172.19.0.3","TCP","56","9002 → 43520 [ACK] Seq=465535 Ack=24863 Win=65535 Len=0"
"28.290744","5.9.29.183","172.19.0.3","TLSv1.2","149","Application Data"
"28.315066","5.9.29.183","172.19.0.3","TCP","1504","[TCP segment of a reassembled PDU]"
"28.315083","172.19.0.3","5.9.29.183","TCP","56","43520 → 9002 [ACK] Seq=24863 Ack=467076 Win=11911 Len=0"
"28.315138","5.9.29.183","172.19.0.3","TLSv1.2","693","Application Data"
"28.357129","172.19.0.3","5.9.29.183","TCP","56","43520 → 9002 [ACK] Seq=24863 Ack=467713 Win=11911 Len=0"
"28.398892","5.9.29.183","172.19.0.3","TCP","1504","[TCP segment of a reassembled PDU]"
"28.398925","172.19.0.3","5.9.29.183","TCP","56","43520 → 9002 [ACK] Seq=24863 Ack=469161 Win=11911 Len=0"
"28.398960","5.9.29.183","172.19.0.3","TCP","1516","9002 → 43520 [PSH, ACK] Seq=469161 Ack=24863 Win=65535 Len=1460 [TCP segment of a reassembled PDU]"
"28.398971","172.19.0.3","5.9.29.183","TCP","56","43520 → 9002 [ACK] Seq=24863 Ack=470621 Win=11903 Len=0"
"28.398973","5.9.29.183","172.19.0.3","TLSv1.2","775","Application Data"
"28.398977","172.19.0.3","5.9.29.183","TCP","56","43520 → 9002 [ACK] Seq=24863 Ack=471340 Win=11898 Len=0"
"28.457354","5.9.29.183","172.19.0.3","TCP","1516","[TCP segment of a reassembled PDU]"
"28.457422","5.9.29.183","172.19.0.3","TLSv1.2","681","Application Data"
"28.457441","172.19.0.3","5.9.29.183","TCP","56","43520 → 9002 [ACK] Seq=24863 Ack=473425 Win=11903 Len=0"
