_ws.col.Time,_ws.col.Source,_ws.col.Destination,_ws.col.Protocol,_ws.col.Length,_ws.col.Info
"0.000000","172.19.0.3","5.9.29.183","TLSv1.2","599","Application Data"
"0.000519","5.9.29.183","172.19.0.3","TCP","56","9002 → 43520 [ACK] Seq=1 Ack=544 Win=65535 Len=0"
"0.413144","5.9.29.183","172.19.0.3","TLSv1.2","599","Application Data"
"0.413215","172.19.0.3","5.9.29.183","TCP","56","43520 → 9002 [ACK] Seq=544 Ack=544 Win=11911 Len=0"
"0.414120","172.19.0.3","5.9.29.183","TLSv1.2","2141","Application Data"
"0.414618","5.9.29.183","172.19.0.3","TCP","56","9002 → 43520 [ACK] Seq=544 Ack=2004 Win=65535 Len=0"
"0.414678","5.9.29.183","172.19.0.3","TCP","56","9002 → 43520 [ACK] Seq=544 Ack=2629 Win=65535 Len=0"
"1.086186","5.9.29.183","172.19.0.3","TLSv1.2","599","Application Data"
"1.126573","172.19.0.3","5.9.29.183","TCP","56","43520 → 9002 [ACK] Seq=2629 Ack=1087 Win=11911 Len=0"
"1.199019","5.9.29.183","172.19.0.3","TLSv1.2","1113","Application Data"
"1.199038","172.19.0.3","5.9.29.183","TCP","56","43520 → 9002 [ACK] Seq=2629 Ack=2144 Win=11911 Len=0"
"1.202941","172.19.0.3","5.9.29.183","TLSv1.2","599","Application Data"
"1.203268","5.9.29.183","172.19.0.3","TCP","56","9002 → 43520 [ACK] Seq=2144 Ack=3172 Win=65535 Len=0"
"1.895648","5.9.29.183","172.19.0.3","TLSv1.2","599","Application Data"
"1.896312","172.19.0.3","5.9.29.183","TLSv1.2","599","Application Data"
"1.896536","5.9.29.183","172.19.0.3","TCP","56","9002 → 43520 [ACK] Seq=2687 Ack=3715 Win=65535 Len=0"
"2.523226","5.9.29.183","172.19.0.3","TLSv1.2","599","Application Data"
"2.558931","5.9.29.183","172.19.0.3","TCP","1516","[TCP segment of a reassembled PDU]"
"2.558952","172.19.0.3","5.9.29.183","TCP","56","43520 → 9002 [ACK] Seq=3715 Ack=4690 Win=11909 Len=0"
"2.559001","5.9.29.183","172.19.0.3","TCP","1266","9002 → 43520 [PSH, ACK] Seq=4690 Ack=3715 Win=65535 Len=1210 [TCP segment of a reassembled PDU]"
"2.559013","5.9.29.183","172.19.0.3","TLSv1.2","1013","Application Data"
"2.559145","172.19.0.3","5.9.29.183","TCP","56","43520 → 9002 [ACK] Seq=3715 Ack=6857 Win=11893 Len=0"
"2.583037","5.9.29.183","172.19.0.3","TCP","1516","[TCP segment of a reassembled PDU]"
"2.583087","5.9.29.183","172.19.0.3","TCP","1492","9002 → 43520 [PSH, ACK] Seq=8317 Ack=3715 Win=65535 Len=1436 [TCP segment of a reassembled PDU]"
"2.583101","172.19.0.3","5.9.29.183","TCP","56","43520 → 9002 [ACK] Seq=3715 Ack=9753 Win=11903 Len=0"
"2.583103","5.9.29.183","172.19.0.3","TLSv1.2","1237","Application Data"
"2.598429","5.9.29.183","172.19.0.3","TLSv1.2","149","Application Data"
"2.598635","172.19.0.3","5.9.29.183","TCP","56","43520 → 9002 [ACK] Seq=3715 Ack=11027 Win=11911 Len=0"
"2.644180","5.9.29.183","172.19.0.3","TCP","1504","[TCP segment of a reassembled PDU]"
"2.644227","5.9.29.183","172.19.0.3","TCP","1516","9002 → 43520 [PSH, ACK] Seq=12475 Ack=3715 Win=65535 Len=1460 [TCP segment of a reassembled PDU]"
"2.644235","5.9.29.183","172.19.0.3","TLSv1.2","1516","Application Data [TCP segment of a reassembled PDU]"
"2.644261","5.9.29.183","172.19.0.3","TCP","1516","9002 → 43520 [PSH, ACK] Seq=15395 Ack=3715 Win=65535 Len=1460 [TCP segment of a reassembled PDU]"
"2.644282","5.9.29.183","172.19.0.3","TCP","1516","9002 → 43520 [PSH, ACK] Seq=16855 Ack=3715 Win=65535 Len=1460 [TCP segment of a reassembled PDU]"
"2.644287","5.9.29.183","172.19.0.3","TLSv1.2","1516","Application Data [TCP segment of a reassembled PDU]"
"2.644300","5.9.29.183","172.19.0.3","TCP","1516","9002 → 43520 [PSH, ACK] Seq=19775 Ack=3715 Win=65535 Len=1460 [TCP segment of a reassembled PDU]"
"2.644316","5.9.29.183","172.19.0.3","TCP","1516","9002 → 43520 [PSH, ACK] Seq=21235 Ack=3715 Win=65535 Len=1460 [TCP segment of a reassembled PDU]"
"2.644319","5.9.29.183","172.19.0.3","TLSv1.2","1153","Application Data [TCP segment of a reassembled PDU]"
"2.644359","172.19.0.3","5.9.29.183","TCP","56","43520 → 9002 [ACK] Seq=3715 Ack=23792 Win=11847 Len=0"
"2.644635","172.19.0.3","5.9.29.183","TLSv1.2","599","Application Data"
"2.644778","5.9.29.183","172.19.0.3","TCP","56","9002 → 43520 [ACK] Seq=23792 Ack=4258 Win=65535 Len=0"
"2.655768","5.9.29.183","172.19.0.3","TLSv1.2","1504","Application Data [TCP segment of a reassembled PDU]"
"2.659838","5.9.29.183","172.19.0.3","TCP","1516","9002 → 43520 [PSH, ACK] Seq=25240 Ack=4258 Win=65535 Len=1460 [TCP segment of a reassembled PDU]"
"2.659865","172.19.0.3","5.9.29.183","TCP","56","43520 → 9002 [ACK] Seq=4258 Ack=26700 Win=11911 Len=0"
"2.659909","5.9.29.183","172.19.0.3","TCP","1492","9002 → 43520 [PSH, ACK] Seq=26700 Ack=4258 Win=65535 Len=1436 [TCP segment of a reassembled PDU]"
"2.659947","5.9.29.183","172.19.0.3","TLSv1.2","568","Application Data"
"2.660101","172.19.0.3","5.9.29.183","TCP","56","43520 → 9002 [ACK] Seq=4258 Ack=28648 Win=11911 Len=0"
"2.660355","172.19.0.3","5.9.29.183","TLSv1.2","599","Application Data"
"2.660624","5.9.29.183","172.19.0.3","TCP","56","9002 → 43520 [ACK] Seq=28648 Ack=4801 Win=65535 Len=0"
"2.677205","5.9.29.183","172.19.0.3","TCP","1516","[TCP segment of a reassembled PDU]"
"2.677258","5.9.29.183","172.19.0.3","TCP","1516","9002 → 43520 [PSH, ACK] Seq=30108 Ack=4801 Win=65535 Len=1460 [TCP segment of a reassembled PDU]"
"2.677265","5.9.29.183","172.19.0.3","TLSv1.2","1213","Application Data"
"2.677484","172.19.0.3","5.9.29.183","TCP","56","43520 → 9002 [ACK] Seq=4801 Ack=32725 Win=11895 Len=0"
"2.692481","5.9.29.183","172.19.0.3","TLSv1.2","663","Application Data"
"2.714428","5.9.29.183","172.19.0.3","TCP","1516","[TCP segment of a reassembled PDU]"
"2.714446","172.19.0.3","5.9.29.183","TCP","56","43520 → 9002 [ACK] Seq=4801 Ack=34792 Win=11911 Len=0"
"2.714478","5.9.29.183","172.19.0.3","TCP","1516","9002 → 43520 [PSH, ACK] Seq=34792 Ack=4801 Win=65535 Len=1460 [TCP segment of a reassembled PDU]"
"2.714508","5.9.29.183","172.19.0.3","TLSv1.2","1213","Application Data"
"2.714616","172.19.0.3","5.9.29.183","TCP","56","43520 → 9002 [ACK] Seq=4801 Ack=37409 Win=11895 Len=0"
"2.729860","5.9.29.183","172.19.0.3","TLSv1.2","1177","Application Data"
"2.738901","5.9.29.183","172.19.0.3","TCP","1504","[TCP segment of a reassembled PDU]"
"2.738918","172.19.0.3","5.9.29.183","TCP","56","43520 → 9002 [ACK] Seq=4801 Ack=39978 Win=11911 Len=0"
"2.738963","5.9.29.183","172.19.0.3","TCP","1504","9002 → 43520 [PSH, ACK] Seq=39978 Ack=4801 Win=65535 Len=1448 [TCP segment of a reassembled PDU]"
"2.745173","5.9.29.183","172.19.0.3","TLSv1.2","1330","Application Data, Application Data"
"2.745195","172.19.0.3","5.9.29.183","TCP","56","43520 → 9002 [ACK] Seq=4801 Ack=42700 Win=11911 Len=0"
"2.749159","5.9.29.183","172.19.0.3","TCP","1516","[TCP segment of a reassembled PDU]"
"2.749205","5.9.29.183","172.19.0.3","TCP","1516","9002 → 43520 [PSH, ACK] Seq=44160 Ack=4801 Win=65535 Len=1460 [TCP segment of a reassembled PDU]"
"2.749211","5.9.29.183","172.19.0.3","TLSv1.2","1516","Application Data [TCP segment of a reassembled PDU]"
"2.749214","5.9.29.183","172.19.0.3","TCP","1468","9002 → 43520 [PSH, ACK] Seq=47080 Ack=4801 Win=65535 Len=1412 [TCP segment of a reassembled PDU]"
"2.749322","172.19.0.3","5.9.29.183","TCP","56","43520 → 9002 [ACK] Seq=4801 Ack=48492 Win=11887 Len=0"
"2.760908","5.9.29.183","172.19.0.3","TLSv1.2","1004","Application Data"
"2.761120","5.9.29.183","172.19.0.3","TCP","1504","[TCP segment of a reassembled PDU]"
"2.761169","172.19.0.3","5.9.29.183","TCP","56","43520 → 9002 [ACK] Seq=4801 Ack=50888 Win=11911 Len=0"
"2.761377","5.9.29.183","172.19.0.3","TCP","1516","9002 → 43520 [PSH, ACK] Seq=50888 Ack=4801 Win=65535 Len=1460 [TCP segment of a reassembled PDU]"
"2.761443","5.9.29.183","172.19.0.3","TLSv1.2","1516","Application Data [TCP segment of a reassembled PDU]"
"2.761496","5.9.29.183","172.19.0.3","TCP","1480","9002 → 43520 [PSH, ACK] Seq=53808 Ack=4801 Win=65535 Len=1424 [TCP segment of a reassembled PDU]"
"2.761556","5.9.29.183","172.19.0.3","TCP","1516","9002 → 43520 [PSH, ACK] Seq=55232 Ack=4801 Win=65535 Len=1460 [TCP segment of a reassembled PDU]"
"2.761613","172.19.0.3","5.9.29.183","TCP","56","43520 → 9002 [ACK] Seq=4801 Ack=56692 Win=11885 Len=0"
"2.761743","5.9.29.183","172.19.0.3","TLSv1.2","1516","Application Data [TCP segment of a reassembled PDU]"
"2.761753","5.9.29.183","172.19.0.3","TCP","1516","9002 → 43520 [PSH, ACK] Seq=58152 Ack=4801 Win=65535 Len=1460 [TCP segment of a reassembled PDU]"
"2.761756","5.9.29.183","172.19.0.3","TCP","1516","9002 → 43520 [PSH, ACK] Seq=59612 Ack=4801 Win=65535 Len=1460 [TCP segment of a reassembled PDU]"
"2.761759","5.9.29.183","172.19.0.3","TLSv1.2","1456","Application Data [TCP segment of a reassembled PDU]"
"2.761773","172.19.0.3","5.9.29.183","TCP","56","43520 → 9002 [ACK] Seq=4801 Ack=62472 Win=11853 Len=0"
"2.762095","172.19.0.3","5.9.29.183","TLSv1.2","599","Application Data"
"2.762427","5.9.29.183","172.19.0.3","TCP","56","9002 → 43520 [ACK] Seq=62472 Ack=5344 Win=65535 Len=0"
"2.774030","5.9.29.183","172.19.0.3","TCP","1504","9002 → 43520 [PSH, ACK] Seq=62472 Ack=5344 Win=65535 Len=1448 [TCP segment of a reassembled PDU]"
"2.776493","5.9.29.183","172.19.0.3","TCP","1504","9002 → 43520 [PSH, ACK] Seq=63920 Ack=5344 Win=65535 Len=1448 [TCP segment of a reassembled PDU]"
"2.776509","172.19.0.3","5.9.29.183","TCP","56","43520 → 9002 [ACK] Seq=5344 Ack=65368 Win=11911 Len=0"
"2.776577","5.9.29.183","172.19.0.3","TLSv1.2","1504","Application Data, Application Data"
"2.776614","5.9.29.183","172.19.0.3","TCP","1504","9002 → 43520 [PSH, ACK] Seq=66816 Ack=5344 Win=65535 Len=1448 [TCP segment of a reassembled PDU]"
"2.776721","172.19.0.3","5.9.29.183","TCP","56","43520 → 9002 [ACK] Seq=5344 Ack=68264 Win=11895 Len=0"
"2.776796","5.9.29.183","172.19.0.3","TCP","1504","9002 → 43520 [PSH, ACK] Seq=68264 Ack=5344 Win=65535 Len=1448 [TCP segment of a reassembled PDU]"
"2.776802","5.9.29.183","172.19.0.3","TLSv1.2","1504","Application Data [TCP segment of a reassembled PDU]"
"2.776805","5.9.29.183","172.19.0.3","TCP","332","9002 → 43520 [PSH, ACK] Seq=71160 Ack=5344 Win=65535 Len=276 [TCP segment of a reassembled PDU]"
"2.777118","5.9.29.183","172.19.0.3","TLSv1.2","1516","Application Data [TCP segment of a reassembled PDU]"
"2.777127","5.9.29.183","172.19.0.3","TCP","1516","9002 → 43520 [PSH, ACK] Seq=72896 Ack=5344 Win=65535 Len=1460 [TCP segment of a reassembled PDU]"
"2.777129","5.9.29.183","172.19.0.3","TCP","1516","9002 → 43520 [PSH, ACK] Seq=74356 Ack=5344 Win=65535 Len=1460 [TCP segment of a reassembled PDU]"
"2.777132","5.9.29.183","172.19.0.3","TLSv1.2","1192","Application Data [TCP segment of a reassembled PDU]"
"2.777237","5.9.29.183","172.19.0.3","TCP","1516","9002 → 43520 [PSH, ACK] Seq=76952 Ack=5344 Win=65535 Len=1460 [TCP segment of a reassembled PDU]"
"2.777244","5.9.29.183","172.19.0.3","TCP","1516","9002 → 43520 [PSH, ACK] Seq=78412 Ack=5344 Win=65535 Len=1460 [TCP segment of a reassembled PDU]"
"2.777247","172.19.0.3","5.9.29.183","TLSv1.2","599","Application Data"
"2.777335","5.9.29.183","172.19.0.3","TLSv1.2","240","Application Data, Application Data"
"2.777376","172.19.0.3","5.9.29.183","TCP","56","43520 → 9002 [ACK] Seq=5887 Ack=80056 Win=11814 Len=0"
"2.777569","5.9.29.183","172.19.0.3","TCP","56","9002 → 43520 [ACK] Seq=80056 Ack=5887 Win=65535 Len=0"
"2.819332","172.19.0.3","5.9.29.183","TLSv1.2","599","Application Data"
"2.819754","5.9.29.183","172.19.0.3","TCP","56","9002 → 43520 [ACK] Seq=80056 Ack=6430 Win=65535 Len=0"
"2.826250","5.9.29.183","172.19.0.3","TLSv1.2","599","Application Data"
"2.829621","172.19.0.3","5.9.29.183","TLSv1.2","599","Application Data"
"2.829927","5.9.29.183","172.19.0.3","TCP","56","9002 → 43520 [ACK] Seq=80599 Ack=6973 Win=65535 Len=0"
"3.408374","5.9.29.183","172.19.0.3","TLSv1.2","599","Application Data"
"3.409281","172.19.0.3","5.9.29.183","TLSv1.2","599","Application Data"
"3.409536","5.9.29.183","172.19.0.3","TCP","56","9002 → 43520 [ACK] Seq=81142 Ack=7516 Win=65535 Len=0"
"3.809027","5.9.29.183","172.19.0.3","TLSv1.2","599","Application Data"
"3.849685","172.19.0.3","5.9.29.183","TCP","56","43520 → 9002 [ACK] Seq=7516 Ack=81685 Win=11911 Len=0"
"3.859289","5.9.29.183","172.19.0.3","TCP","1504","[TCP segment of a reassembled PDU]"
"3.859317","172.19.0.3","5.9.29.183","TCP","56","43520 → 9002 [ACK] Seq=7516 Ack=83133 Win=11911 Len=0"
"3.859362","5.9.29.183","172.19.0.3","TCP","1516","9002 → 43520 [PSH, ACK] Seq=83133 Ack=7516 Win=65535 Len=1460 [TCP segment of a reassembled PDU]"
"3.859376","172.19.0.3","5.9.29.183","TCP","56","43520 → 9002 [ACK] Seq=7516 Ack=84593 Win=11903 Len=0"
"3.859377","5.9.29.183","172.19.0.3","TLSv1.2","1516","Application Data [TCP segment of a reassembled PDU]"
"3.859383","172.19.0.3","5.9.29.183","TCP","56","43520 → 9002 [ACK] Seq=7516 Ack=86053 Win=11895 Len=0"
"3.859384","5.9.29.183","172.19.0.3","TCP","1516","9002 → 43520 [PSH, ACK] Seq=86053 Ack=7516 Win=65535 Len=1460 [TCP segment of a reassembled PDU]"
"3.859389","172.19.0.3","5.9.29.183","TCP","56","43520 → 9002 [ACK] Seq=7516 Ack=87513 Win=11887 Len=0"
"3.859390","5.9.29.183","172.19.0.3","TCP","1201","9002 → 43520 [PSH, ACK] Seq=87513 Ack=7516 Win=65535 Len=1145 [TCP segment of a reassembled PDU]"
"3.859394","172.19.0.3","5.9.29.183","TCP","56","43520 → 9002 [ACK] Seq=7516 Ack=88658 Win=11879 Len=0"
"3.874575","5.9.29.183","172.19.0.3","TLSv1.2","851","Application Data"
"3.874596","172.19.0.3","5.9.29.183","TCP","56","43520 → 9002 [ACK] Seq=7516 Ack=89453 Win=11911 Len=0"
"3.924843","5.9.29.183","172.19.0.3","TCP","1504","[TCP segment of a reassembled PDU]"
"3.924861","172.19.0.3","5.9.29.183","TCP","56","43520 → 9002 [ACK] Seq=7516 Ack=90901 Win=11911 Len=0"
"3.924996","5.9.29.183","172.19.0.3","TCP","1516","9002 → 43520 [PSH, ACK] Seq=90901 Ack=7516 Win=65535 Len=1460 [TCP segment of a reassembled PDU]"
"3.925005","172.19.0.3","5.9.29.183","TCP","56","43520 → 9002 [ACK] Seq=7516 Ack=92361 Win=11903 Len=0"
"3.925007","5.9.29.183","172.19.0.3","TLSv1.2","261","Application Data"
"3.925012","172.19.0.3","5.9.29.183","TCP","56","43520 → 9002 [ACK] Seq=7516 Ack=92566 Win=11902 Len=0"
"3.934639","5.9.29.183","172.19.0.3","TCP","1516","[TCP segment of a reassembled PDU]"
"3.934660","172.19.0.3","5.9.29.183","TCP","56","43520 → 9002 [ACK] Seq=7516 Ack=94026 Win=11911 Len=0"
"3.934695","5.9.29.183","172.19.0.3","TCP","1492","9002 → 43520 [PSH, ACK] Seq=94026 Ack=7516 Win=65535 Len=1436 [TCP segment of a reassembled PDU]"
"3.934703","172.19.0.3","5.9.29.183","TCP","56","43520 → 9002 [ACK] Seq=7516 Ack=95462 Win=11903 Len=0"
"3.934705","5.9.29.183","172.19.0.3","TLSv1.2","1516","Application Data [TCP segment of a reassembled PDU]"
"3.934709","172.19.0.3","5.9.29.183","TCP","56","43520 → 9002 [ACK] Seq=7516 Ack=96922 Win=11895 Len=0"
"3.934710","5.9.29.183","172.19.0.3","TCP","1516","9002 → 43520 [PSH, ACK] Seq=96922 Ack=7516 Win=65535 Len=1460 [TCP segment of a reassembled PDU]"
"3.934713","172.19.0.3","5.9.29.183","TCP","56","43520 → 9002 [ACK] Seq=7516 Ack=98382 Win=11887 Len=0"
"3.934714","5.9.29.183","172.19.0.3","TCP","1516","9002 → 43520 [PSH, ACK] Seq=98382 Ack=7516 Win=65535 Len=1460 [TCP segment of a reassembled PDU]"
"3.934718","172.19.0.3","5.9.29.183","TCP","56","43520 → 9002 [ACK] Seq=7516 Ack=99842 Win=11879 Len=0"
"3.934859","5.9.29.183","172.19.0.3","TLSv1.2","1516","Application Data [TCP segment of a reassembled PDU]"
"3.934868","172.19.0.3","5.9.29.183","TCP","56","43520 → 9002 [ACK] Seq=7516 Ack=101302 Win=11871 Len=0"
"3.934869","5.9.29.183","172.19.0.3","TCP","1456","9002 → 43520 [PSH, ACK] Seq=101302 Ack=7516 Win=65535 Len=1400 [TCP segment of a reassembled PDU]"
"3.935118","172.19.0.3","5.9.29.183","TCP","56","43520 → 9002 [ACK] Seq=7516 Ack=102702 Win=11911 Len=0"
"3.940221","5.9.29.183","172.19.0.3","TLSv1.2","801","Application Data"
"3.940480","172.19.0.3","5.9.29.183","TCP","56","43520 → 9002 [ACK] Seq=7516 Ack=103447 Win=11911 Len=0"
"3.955369","5.9.29.183","172.19.0.3","TLSv1.2","1113","Application Data"
"3.955543","172.19.0.3","5.9.29.183","TCP","56","43520 → 9002 [ACK] Seq=7516 Ack=104504 Win=11911 Len=0"
"4.011220","5.9.29.183","172.19.0.3","TCP","1516","[TCP segment of a reassembled PDU]"
"4.011278","5.9.29.183","172.19.0.3","TCP","1516","9002 → 43520 [PSH, ACK] Seq=105964 Ack=7516 Win=65535 Len=1460 [TCP segment of a reassembled PDU]"
"4.011290","5.9.29.183","172.19.0.3","TLSv1.2","1213","Application Data"
"4.011473","5.9.29.183","172.19.0.3","TLSv1.2","1504","Application Data"
"4.011525","172.19.0.3","5.9.29.183","TCP","56","43520 → 9002 [ACK] Seq=7516 Ack=110029 Win=11887 Len=0"
"4.011687","5.9.29.183","172.19.0.3","TCP","1504","9002 → 43520 [PSH, ACK] Seq=110029 Ack=7516 Win=65535 Len=1448 [TCP segment of a reassembled PDU]"
"4.011800","172.19.0.3","5.9.29.183","TLSv1.2","599","Application Data"
"4.012017","5.9.29.183","172.19.0.3","TCP","56","9002 → 43520 [ACK] Seq=111477 Ack=8059 Win=65535 Len=0"
"4.026586","5.9.29.183","172.19.0.3","TLSv1.2","880","Application Data"
"4.030433","5.9.29.183","172.19.0.3","TCP","1516","[TCP segment of a reassembled PDU]"
"4.030451","172.19.0.3","5.9.29.183","TCP","56","43520 → 9002 [ACK] Seq=8059 Ack=113761 Win=11911 Len=0"
"4.030485","5.9.29.183","172.19.0.3","TCP","1492","9002 → 43520 [PSH, ACK] Seq=113761 Ack=8059 Win=65535 Len=1436 [TCP segment of a reassembled PDU]"
"4.030514","5.9.29.183","172.19.0.3","TLSv1.2","1504","Application Data [TCP segment of a reassembled PDU]"
"4.030615","172.19.0.3","5.9.29.183","TCP","56","43520 → 9002 [ACK] Seq=8059 Ack=116645 Win=11895 Len=0"
"4.038017","5.9.29.183","172.19.0.3","TLSv1.2","1504","Application Data [TCP segment of a reassembled PDU]"
"4.038101","5.9.29.183","172.19.0.3","TCP","1516","9002 → 43520 [PSH, ACK] Seq=118093 Ack=8059 Win=65535 Len=1460 [TCP segment of a reassembled PDU]"
"4.038117","172.19.0.3","5.9.29.183","TCP","56","43520 → 9002 [ACK] Seq=8059 Ack=119553 Win=11903 Len=0"
"4.038120","5.9.29.183","172.19.0.3","TCP","1516","9002 → 43520 [PSH, ACK] Seq=119553 Ack=8059 Win=65535 Len=1460 [TCP segment of a reassembled PDU]"
"4.038196","5.9.29.183","172.19.0.3","TLSv1.2","1480","Application Data [TCP segment of a reassembled PDU]"
"4.038201","5.9.29.183","172.19.0.3","TCP","1516","9002 → 43520 [PSH, ACK] Seq=122437 Ack=8059 Win=65535 Len=1460 [TCP segment of a reassembled PDU]"
"4.038205","5.9.29.183","172.19.0.3","TLSv1.2","1516","Application Data [TCP segment of a reassembled PDU]"
"4.038246","172.19.0.3","5.9.29.183","TCP","56","43520 → 9002 [ACK] Seq=8059 Ack=125357 Win=11871 Len=0"
"4.038268","5.9.29.183","172.19.0.3","TCP","1516","9002 → 43520 [PSH, ACK] Seq=125357 Ack=8059 Win=65535 Len=1460 [TCP segment of a reassembled PDU]"
"4.038302","5.9.29.183","172.19.0.3","TLSv1.2","1516","Application Data [TCP segment of a reassembled PDU]"
"4.038337","5.9.29.183","172.19.0.3","TCP","1456","9002 → 43520 [PSH, ACK] Seq=128277 Ack=8059 Win=65535 Len=1400 [TCP segment of a reassembled PDU]"
"4.038491","172.19.0.3","5.9.29.183","TLSv1.2","599","Application Data"
"4.038663","5.9.29.183","172.19.0.3","TCP","56","9002 → 43520 [ACK] Seq=129677 Ack=8602 Win=65535 Len=0"
"4.041549","5.9.29.183","172.19.0.3","TLSv1.2","1504","Application Data [TCP segment of a reassembled PDU]"
"4.041618","5.9.29.183","172.19.0.3","TCP","1504","9002 → 43520 [PSH, ACK] Seq=131125 Ack=8602 Win=65535 Len=1448 [TCP segment of a reassembled PDU]"
"4.041627","172.19.0.3","5.9.29.183","TCP","56","43520 → 9002 [ACK] Seq=8602 Ack=132573 Win=11903 Len=0"
"4.045255","5.9.29.183","172.19.0.3","TCP","1504","9002 → 43520 [PSH, ACK] Seq=132573 Ack=8602 Win=65535 Len=1448 [TCP segment of a reassembled PDU]"
"4.045320","5.9.29.183","172.19.0.3","TLSv1.2","1504","Application Data [TCP segment of a reassembled PDU]"
"4.045329","172.19.0.3","5.9.29.183","TCP","56","43520 → 9002 [ACK] Seq=8602 Ack=135469 Win=11903 Len=0"
"4.049654","172.19.0.3","5.9.29.183","TLSv1.2","599","Application Data"
"4.050045","5.9.29.183","172.19.0.3","TCP","56","9002 → 43520 [ACK] Seq=135469 Ack=9145 Win=65535 Len=0"
"4.053142","5.9.29.183","172.19.0.3","TCP","1516","9002 → 43520 [PSH, ACK] Seq=135469 Ack=9145 Win=65535 Len=1460 [TCP segment of a reassembled PDU]"
"4.053212","5.9.29.183","172.19.0.3","TCP","99","9002 → 43520 [PSH, ACK] Seq=136929 Ack=9145 Win=65535 Len=43 [TCP segment of a reassembled PDU]"
"4.053218","5.9.29.183","172.19.0.3","TCP","1449","9002 → 43520 [PSH, ACK] Seq=136972 Ack=9145 Win=65535 Len=1393 [TCP segment of a reassembled PDU]"
"4.053221","5.9.29.183","172.19.0.3","TLSv1.2","1504","Application Data [TCP segment of a reassembled PDU]"
"4.053233","5.9.29.183","172.19.0.3","TLSv1.2","1504","Application Data [TCP segment of a reassembled PDU]"
"4.053266","5.9.29.183","172.19.0.3","TCP","1504","9002 → 43520 [PSH, ACK] Seq=141261 Ack=9145 Win=65535 Len=1448 [TCP segment of a reassembled PDU]"
"4.053307","172.19.0.3","5.9.29.183","TCP","56","43520 → 9002 [ACK] Seq=9145 Ack=142709 Win=11877 Len=0"
"4.053319","5.9.29.183","172.19.0.3","TCP","1504","9002 → 43520 [PSH, ACK] Seq=142709 Ack=9145 Win=65535 Len=1448 [TCP segment of a reassembled PDU]"
"4.053697","5.9.29.183","172.19.0.3","TLSv1.2","1504","Application Data, Application Data"
"4.053763","172.19.0.3","5.9.29.183","TCP","56","43520 → 9002 [ACK] Seq=9145 Ack=145605 Win=11861 Len=0"
"4.053913","5.9.29.183","172.19.0.3","TCP","1504","9002 → 43520 [PSH, ACK] Seq=145605 Ack=9145 Win=65535 Len=1448 [TCP segment of a reassembled PDU]"
"4.053916","5.9.29.183","172.19.0.3","TLSv1.2","90","Application Data"
"4.053927","172.19.0.3","5.9.29.183","TCP","56","43520 → 9002 [ACK] Seq=9145 Ack=147087 Win=11911 Len=0"
"4.061517","5.9.29.183","172.19.0.3","TCP","1504","[TCP segment of a reassembled PDU]"
"4.061564","5.9.29.183","172.19.0.3","TCP","1504","9002 → 43520 [PSH, ACK] Seq=148535 Ack=9145 Win=65535 Len=1448 [TCP segment of a reassembled PDU]"
"4.061685","172.19.0.3","5.9.29.183","TCP","56","43520 → 9002 [ACK] Seq=9145 Ack=149983 Win=11903 Len=0"
"4.065232","5.9.29.183","172.19.0.3","TLSv1.2","1504","Application Data [TCP segment of a reassembled PDU]"
"4.065267","5.9.29.183","172.19.0.3","TCP","1516","9002 → 43520 [PSH, ACK] Seq=151431 Ack=9145 Win=65535 Len=1460 [TCP segment of a reassembled PDU]"
"4.065275","172.19.0.3","5.9.29.183","TCP","56","43520 → 9002 [ACK] Seq=9145 Ack=152891 Win=11903 Len=0"
"4.065277","5.9.29.183","172.19.0.3","TCP","1492","9002 → 43520 [PSH, ACK] Seq=152891 Ack=9145 Win=65535 Len=1436 [TCP segment of a reassembled PDU]"
"4.069124","5.9.29.183","172.19.0.3","TLSv1.2","584","Application Data"
"4.069141","172.19.0.3","5.9.29.183","TCP","56","43520 → 9002 [ACK] Seq=9145 Ack=154855 Win=11911 Len=0"
"4.103555","5.9.29.183","172.19.0.3","TCP","1504","[TCP segment of a reassembled PDU]"
"4.103616","5.9.29.183","172.19.0.3","TCP","1516","9002 → 43520 [PSH, ACK] Seq=156303 Ack=9145 Win=65535 Len=1460 [TCP segment of a reassembled PDU]"
"4.103629","5.9.29.183","172.19.0.3","TLSv1.2","775","Application Data"
"4.103831","172.19.0.3","5.9.29.183","TCP","56","43520 → 9002 [ACK] Seq=9145 Ack=158482 Win=11895 Len=0"
"4.137883","172.19.0.3","5.9.29.183","TLSv1.2","599","Application Data"
"4.138296","5.9.29.183","172.19.0.3","TCP","56","9002 → 43520 [ACK] Seq=158482 Ack=9688 Win=65535 Len=0"
"4.147516","172.19.0.3","5.9.29.183","TLSv1.2","599","Application Data"
"4.148006","5.9.29.183","172.19.0.3","TCP","56","9002 → 43520 [ACK] Seq=158482 Ack=10231 Win=65535 Len=0"
"4.152744","5.9.29.183","172.19.0.3","TLSv1.2","599","Application Data"
"4.194189","172.19.0.3","5.9.29.183","TCP","56","43520 → 9002 [ACK] Seq=10231 Ack=159025 Win=11911 Len=0"
"4.656121","5.9.29.183","172.19.0.3","TLSv1.2","599","Application Data"
"4.656175","172.19.0.3","5.9.29.183","TCP","56","43520 → 9002 [ACK] Seq=10231 Ack=159568 Win=11911 Len=0"
"4.656847","172.19.0.3","5.9.29.183","TLSv1.2","599","Application Data"
"4.657046","5.9.29.183","172.19.0.3","TCP","56","9002 → 43520 [ACK] Seq=159568 Ack=10774 Win=65535 Len=0"
"5.093685","5.9.29.183","172.19.0.3","TLSv1.2","599","Application Data"
"5.116694","5.9.29.183","172.19.0.3","TCP","1504","[TCP segment of a reassembled PDU]"
"5.116711","172.19.0.3","5.9.29.183","TCP","56","43520 → 9002 [ACK] Seq=10774 Ack=161559 Win=11911 Len=0"
"5.116743","5.9.29.183","172.19.0.3","TCP","1516","9002 → 43520 [PSH, ACK] Seq=161559 Ack=10774 Win=65535 Len=1460 [TCP segment of a reassembled PDU]"
"5.116753","5.9.29.183","172.19.0.3","TLSv1.2","775","Application Data"
"5.116861","172.19.0.3","5.9.29.183","TCP","56","43520 → 9002 [ACK] Seq=10774 Ack=163738 Win=11895 Len=0"
"5.123917","5.9.29.183","172.19.0.3","TCP","1516","[TCP segment of a reassembled PDU]"
"5.123975","5.9.29.183","172.19.0.3","TCP","1492","9002 → 43520 [PSH, ACK] Seq=165198 Ack=10774 Win=65535 Len=1436 [TCP segment of a reassembled PDU]"
"5.123989","172.19.0.3","5.9.29.183","TCP","56","43520 → 9002 [ACK] Seq=10774 Ack=166634 Win=11903 Len=0"
"5.132096","5.9.29.183","172.19.0.3","TLSv1.2","787","Application Data"
"5.135998","5.9.29.183","172.19.0.3","TCP","1516","[TCP segment of a reassembled PDU]"
"5.136010","172.19.0.3","5.9.29.183","TCP","56","43520 → 9002 [ACK] Seq=10774 Ack=168825 Win=11911 Len=0"
"5.136038","5.9.29.183","172.19.0.3","TCP","1492","9002 → 43520 [PSH, ACK] Seq=168825 Ack=10774 Win=65535 Len=1436 [TCP segment of a reassembled PDU]"
"5.147171","5.9.29.183","172.19.0.3","TLSv1.2","1330","Application Data, Application Data"
"5.147189","172.19.0.3","5.9.29.183","TCP","56","43520 → 9002 [ACK] Seq=10774 Ack=171535 Win=11911 Len=0"
"5.147560","172.19.0.3","5.9.29.183","TLSv1.2","599","Application Data"
"5.147828","5.9.29.183","172.19.0.3","TCP","56","9002 → 43520 [ACK] Seq=171535 Ack=11317 Win=65535 Len=0"
"5.151798","5.9.29.183","172.19.0.3","TCP","1516","[TCP segment of a reassembled PDU]"
"5.151838","5.9.29.183","172.19.0.3","TCP","1492","9002 → 43520 [PSH, ACK] Seq=172995 Ack=11317 Win=65535 Len=1436 [TCP segment of a reassembled PDU]"
"5.151939","172.19.0.3","5.9.29.183","TCP","56","43520 → 9002 [ACK] Seq=11317 Ack=174431 Win=11903 Len=0"
"5.162175","5.9.29.183","172.19.0.3","TLSv1.2","1330","Application Data, Application Data"
"5.187225","5.9.29.183","172.19.0.3","TCP","1516","[TCP segment of a reassembled PDU]"
"5.187246","172.19.0.3","5.9.29.183","TCP","56","43520 → 9002 [ACK] Seq=11317 Ack=177165 Win=11911 Len=0"
"5.187287","5.9.29.183","172.19.0.3","TCP","1516","9002 → 43520 [PSH, ACK] Seq=177165 Ack=11317 Win=65535 Len=1460 [TCP segment of a reassembled PDU]"
"5.187324","5.9.29.183","172.19.0.3","TLSv1.2","763","Application Data"
"5.187440","172.19.0.3","5.9.29.183","TCP","56","43520 → 9002 [ACK] Seq=11317 Ack=179332 Win=11895 Len=0"
"5.202910","5.9.29.183","172.19.0.3","TLSv1.2","599","Application Data"
"5.245693","172.19.0.3","5.9.29.183","TCP","56","43520 → 9002 [ACK] Seq=11317 Ack=179875 Win=11911 Len=0"
"5.298484","5.9.29.183","172.19.0.3","TCP","1504","[TCP segment of a reassembled PDU]"
"5.298503","172.19.0.3","5.9.29.183","TCP","56","43520 → 9002 [ACK] Seq=11317 Ack=181323 Win=11911 Len=0"
"5.298539","5.9.29.183","172.19.0.3","TCP","1504","9002 → 43520 [PSH, ACK] Seq=181323 Ack=11317 Win=65535 Len=1448 [TCP segment of a reassembled PDU]"
"5.298551","172.19.0.3","5.9.29.183","TCP","56","43520 → 9002 [ACK] Seq=11317 Ack=182771 Win=11903 Len=0"
"5.298552","5.9.29.183","172.19.0.3","TLSv1.2","787","Application Data"
"5.298556","172.19.0.3","5.9.29.183","TCP","56","43520 → 9002 [ACK] Seq=11317 Ack=183502 Win=11898 Len=0"
"5.299864","172.19.0.3","5.9.29.183","TLSv1.2","599","Application Data"
"5.300248","5.9.29.183","172.19.0.3","TCP","56","9002 → 43520 [ACK] Seq=183502 Ack=11860 Win=65535 Len=0"
"5.309310","172.19.0.3","5.9.29.183","TLSv1.2","599","Application Data"
"5.309727","5.9.29.183","172.19.0.3","TCP","56","9002 → 43520 [ACK] Seq=183502 Ack=12403 Win=65535 Len=0"
"5.324852","5.9.29.183","172.19.0.3","TLSv1.2","599","Application Data"
"5.365990","172.19.0.3","5.9.29.183","TCP","56","43520 → 9002 [ACK] Seq=12403 Ack=184045 Win=11911 Len=0"
"5.812900","5.9.29.183","172.19.0.3","TLSv1.2","599","Application Data"
"5.812931","172.19.0.3","5.9.29.183","TCP","56","43520 → 9002 [ACK] Seq=12403 Ack=184588 Win=11911 Len=0"
"5.813708","172.19.0.3","5.9.29.183","TLSv1.2","599","Application Data"
"5.814177","5.9.29.183","172.19.0.3","TCP","56","9002 → 43520 [ACK] Seq=184588 Ack=12946 Win=65535 Len=0"
"6.277360","5.9.29.183","172.19.0.3","TLSv1.2","599","Application Data"
"6.318106","172.19.0.3","5.9.29.183","TCP","56","43520 → 9002 [ACK] Seq=12946 Ack=185131 Win=11911 Len=0"
"6.340165","5.9.29.183","172.19.0.3","TCP","1504","[TCP segment of a reassembled PDU]"
"6.340186","172.19.0.3","5.9.29.183","TCP","56","43520 → 9002 [ACK] Seq=12946 Ack=186579 Win=11911 Len=0"
"6.340194","5.9.29.183","172.19.0.3","TCP","1516","9002 → 43520 [PSH, ACK] Seq=186579 Ack=12946 Win=65535 Len=1460 [TCP segment of a reassembled PDU]"
"6.340202","172.19.0.3","5.9.29.183","TCP","56","43520 → 9002 [ACK] Seq=12946 Ack=188039 Win=11903 Len=0"
"6.340203","5.9.29.183","172.19.0.3","TLSv1.2","775","Application Data"
"6.340207","172.19.0.3","5.9.29.183","TCP","56","43520 → 9002 [ACK] Seq=12946 Ack=188758 Win=11898 Len=0"
"6.362141","5.9.29.183","172.19.0.3","TCP","1504","[TCP segment of a reassembled PDU]"
"6.362158","172.19.0.3","5.9.29.183","TCP","56","43520 → 9002 [ACK] Seq=12946 Ack=190206 Win=11911 Len=0"
"6.362316","5.9.29.183","172.19.0.3","TCP","1516","9002 → 43520 [PSH, ACK] Seq=190206 Ack=12946 Win=65535 Len=1460 [TCP segment of a reassembled PDU]"
"6.362343","172.19.0.3","5.9.29.183","TCP","56","43520 → 9002 [ACK] Seq=12946 Ack=191666 Win=11903 Len=0"
"6.362412","5.9.29.183","172.19.0.3","TLSv1.2","775","Application Data"
"6.362421","172.19.0.3","5.9.29.183","TCP","56","43520 → 9002 [ACK] Seq=12946 Ack=192385 Win=11898 Len=0"
"6.386483","5.9.29.183","172.19.0.3","TLSv1.2","599","Application Data"
"6.386505","172.19.0.3","5.9.29.183","TCP","56","43520 → 9002 [ACK] Seq=12946 Ack=192928 Win=11911 Len=0"
"6.412066","5.9.29.183","172.19.0.3","TCP","1516","[TCP segment of a reassembled PDU]"
"6.412101","172.19.0.3","5.9.29.183","TCP","56","43520 → 9002 [ACK] Seq=12946 Ack=194388 Win=11911 Len=0"
"6.412126","5.9.29.183","172.19.0.3","TCP","1492","9002 → 43520 [PSH, ACK] Seq=194388 Ack=12946 Win=65535 Len=1436 [TCP segment of a reassembled PDU]"
"6.412139","172.19.0.3","5.9.29.183","TCP","56","43520 → 9002 [ACK] Seq=12946 Ack=195824 Win=11903 Len=0"
"6.412584","5.9.29.183","172.19.0.3","TLSv1.2","787","Application Data"
"6.412619","172.19.0.3","5.9.29.183","TCP","56","43520 → 9002 [ACK] Seq=12946 Ack=196555 Win=11898 Len=0"
"6.466809","5.9.29.183","172.19.0.3","TLSv1.2","1113","Application Data"
"6.466830","172.19.0.3","5.9.29.183","TCP","56","43520 → 9002 [ACK] Seq=12946 Ack=197612 Win=11911 Len=0"
"6.470701","172.19.0.3","5.9.29.183","TLSv1.2","599","Application Data"
"6.471078","5.9.29.183","172.19.0.3","TCP","56","9002 → 43520 [ACK] Seq=197612 Ack=13489 Win=65535 Len=0"
"6.852747","5.9.29.183","172.19.0.3","TLSv1.2","599","Application Data"
"6.853431","172.19.0.3","5.9.29.183","TLSv1.2","599","Application Data"
"6.853613","5.9.29.183","172.19.0.3","TCP","56","9002 → 43520 [ACK] Seq=198155 Ack=14032 Win=65535 Len=0"
"7.463796","5.9.29.183","172.19.0.3","TCP","1516","[TCP segment of a reassembled PDU]"
"7.463839","5.9.29.183","172.19.0.3","TCP","1492","9002 → 43520 [PSH, ACK] Seq=199615 Ack=14032 Win=65535 Len=1436 [TCP segment of a reassembled PDU]"
"7.463850","5.9.29.183","172.19.0.3","TLSv1.2","787","Application Data"
"7.464033","172.19.0.3","5.9.29.183","TCP","56","43520 → 9002 [ACK] Seq=14032 Ack=201782 Win=11895 Len=0"
"7.487317","5.9.29.183","172.19.0.3","TCP","782","[TCP segment of a reassembled PDU]"
"7.487548","5.9.29.183","172.19.0.3","TCP","1516","9002 → 43520 [PSH, ACK] Seq=202508 Ack=14032 Win=65535 Len=1460 [TCP segment of a reassembled PDU]"
"7.487567","172.19.0.3","5.9.29.183","TCP","56","43520 → 9002 [ACK] Seq=14032 Ack=203968 Win=11903 Len=0"
"7.487571","5.9.29.183","172.19.0.3","TCP","1516","9002 → 43520 [PSH, ACK] Seq=203968 Ack=14032 Win=65535 Len=1460 [TCP segment of a reassembled PDU]"
"7.487576","5.9.29.183","172.19.0.3","TLSv1.2","487","Application Data"
"7.487672","172.19.0.3","5.9.29.183","TCP","56","43520 → 9002 [ACK] Seq=14032 Ack=205859 Win=11889 Len=0"
"7.502403","5.9.29.183","172.19.0.3","TLSv1.2","149","Application Data"
"7.542580","172.19.0.3","5.9.29.183","TCP","56","43520 → 9002 [ACK] Seq=14032 Ack=205952 Win=11911 Len=0"
"7.546676","5.9.29.183","172.19.0.3","TCP","1504","[TCP segment of a reassembled PDU]"
"7.546688","172.19.0.3","5.9.29.183","TCP","56","43520 → 9002 [ACK] Seq=14032 Ack=207400 Win=11911 Len=0"
"7.546897","5.9.29.183","172.19.0.3","TCP","1504","9002 → 43520 [PSH, ACK] Seq=207400 Ack=14032 Win=65535 Len=1448 [TCP segment of a reassembled PDU]"
"7.546909","172.19.0.3","5.9.29.183","TCP","56","43520 → 9002 [ACK] Seq=14032 Ack=208848 Win=11903 Len=0"
"7.546910","5.9.29.183","172.19.0.3","TLSv1.2","273","Application Data"
"7.546914","172.19.0.3","5.9.29.183","TCP","56","43520 → 9002 [ACK] Seq=14032 Ack=209065 Win=11902 Len=0"
"7.549824","172.19.0.3","5.9.29.183","TLSv1.2","599","Application Data"
"7.550606","5.9.29.183","172.19.0.3","TCP","56","9002 → 43520 [ACK] Seq=209065 Ack=14575 Win=65535 Len=0"
"8.090203","5.9.29.183","172.19.0.3","TLSv1.2","599","Application Data"
"8.090878","172.19.0.3","5.9.29.183","TLSv1.2","599","Application Data"
"8.091087","5.9.29.183","172.19.0.3","TCP","56","9002 → 43520 [ACK] Seq=209608 Ack=15118 Win=65535 Len=0"
"8.531414","5.9.29.183","172.19.0.3","TCP","1516","[TCP segment of a reassembled PDU]"
"8.531440","5.9.29.183","172.19.0.3","TCP","1492","9002 → 43520 [PSH, ACK] Seq=211068 Ack=15118 Win=65535 Len=1436 [TCP segment of a reassembled PDU]"
"8.531445","5.9.29.183","172.19.0.3","TLSv1.2","787","Application Data"
"8.531535","172.19.0.3","5.9.29.183","TCP","56","43520 → 9002 [ACK] Seq=15118 Ack=213235 Win=11895 Len=0"
"8.556980","5.9.29.183","172.19.0.3","TCP","1516","[TCP segment of a reassembled PDU]"
"8.557004","5.9.29.183","172.19.0.3","TCP","1492","9002 → 43520 [PSH, ACK] Seq=214695 Ack=15118 Win=65535 Len=1436 [TCP segment of a reassembled PDU]"
"8.557013","172.19.0.3","5.9.29.183","TCP","56","43520 → 9002 [ACK] Seq=15118 Ack=216131 Win=11903 Len=0"
"8.557015","5.9.29.183","172.19.0.3","TLSv1.2","787","Application Data"
"8.568303","5.9.29.183","172.19.0.3","TCP","1516","[TCP segment of a reassembled PDU]"
"8.568322","172.19.0.3","5.9.29.183","TCP","56","43520 → 9002 [ACK] Seq=15118 Ack=218322 Win=11911 Len=0"
"8.568334","5.9.29.183","172.19.0.3","TCP","1492","9002 → 43520 [PSH, ACK] Seq=218322 Ack=15118 Win=65535 Len=1436 [TCP segment of a reassembled PDU]"
"8.572692","5.9.29.183","172.19.0.3","TLSv1.2","1330","Application Data, Application Data"
"8.572710","172.19.0.3","5.9.29.183","TCP","56","43520 → 9002 [ACK] Seq=15118 Ack=221032 Win=11911 Len=0"
"8.618544","5.9.29.183","172.19.0.3","TLSv1.2","1113","Application Data"
"8.638583","5.9.29.183","172.19.0.3","TCP","1516","[TCP segment of a reassembled PDU]"
"8.638601","172.19.0.3","5.9.29.183","TCP","56","43520 → 9002 [ACK] Seq=15118 Ack=223549 Win=11911 Len=0"
"8.638613","5.9.29.183","172.19.0.3","TCP","1516","9002 → 43520 [PSH, ACK] Seq=223549 Ack=15118 Win=65535 Len=1460 [TCP segment of a reassembled PDU]"
"8.638619","5.9.29.183","172.19.0.3","TLSv1.2","1213","Application Data"
"8.638622","5.9.29.183","172.19.0.3","TCP","1504","[TCP segment of a reassembled PDU]"
"8.638753","172.19.0.3","5.9.29.183","TCP","56","43520 → 9002 [ACK] Seq=15118 Ack=227614 Win=11887 Len=0"
"8.638939","172.19.0.3","5.9.29.183","TLSv1.2","599","Application Data"
"8.639154","5.9.29.183","172.19.0.3","TCP","56","9002 → 43520 [ACK] Seq=227614 Ack=15661 Win=65535 Len=0"
"8.642029","5.9.29.183","172.19.0.3","TLSv1.2","1504","Application Data [TCP segment of a reassembled PDU]"
"8.652080","5.9.29.183","172.19.0.3","TLSv1.2","1504","Application Data [TCP segment of a reassembled PDU]"
"8.652100","172.19.0.3","5.9.29.183","TCP","56","43520 → 9002 [ACK] Seq=15661 Ack=230510 Win=11911 Len=0"
"8.652115","5.9.29.183","172.19.0.3","TCP","1516","9002 → 43520 [PSH, ACK] Seq=230510 Ack=15661 Win=65535 Len=1460 [TCP segment of a reassembled PDU]"
"8.652124","5.9.29.183","172.19.0.3","TCP","1492","9002 → 43520 [PSH, ACK] Seq=231970 Ack=15661 Win=65535 Len=1436 [TCP segment of a reassembled PDU]"
"8.652295","172.19.0.3","5.9.29.183","TCP","56","43520 → 9002 [ACK] Seq=15661 Ack=233406 Win=11895 Len=0"
"8.653704","5.9.29.183","172.19.0.3","TLSv1.2","163","Application Data"
"8.661558","5.9.29.183","172.19.0.3","TCP","1504","[TCP segment of a reassembled PDU]"
"8.661577","172.19.0.3","5.9.29.183","TCP","56","43520 → 9002 [ACK] Seq=15661 Ack=234961 Win=11911 Len=0"
"8.661588","5.9.29.183","172.19.0.3","TCP","1504","9002 → 43520 [PSH, ACK] Seq=234961 Ack=15661 Win=65535 Len=1448 [TCP segment of a reassembled PDU]"
"8.661594","5.9.29.183","172.19.0.3","TLSv1.2","1504","Application Data [TCP segment of a reassembled PDU]"
"8.661716","172.19.0.3","5.9.29.183","TCP","56","43520 → 9002 [ACK] Seq=15661 Ack=237857 Win=11895 Len=0"
"8.661902","172.19.0.3","5.9.29.183","TLSv1.2","599","Application Data"
"8.662070","5.9.29.183","172.19.0.3","TCP","56","9002 → 43520 [ACK] Seq=237857 Ack=16204 Win=65535 Len=0"
"8.664103","5.9.29.183","172.19.0.3","TLSv1.2","1504","Application Data [TCP segment of a reassembled PDU]"
"8.664120","5.9.29.183","172.19.0.3","TCP","1504","9002 → 43520 [PSH, ACK] Seq=239305 Ack=16204 Win=65535 Len=1448 [TCP segment of a reassembled PDU]"
"8.664128","172.19.0.3","5.9.29.183","TCP","56","43520 → 9002 [ACK] Seq=16204 Ack=240753 Win=11903 Len=0"
"8.668981","5.9.29.183","172.19.0.3","TLSv1.2","1127","Application Data"
"8.688548","5.9.29.183","172.19.0.3","TCP","1516","[TCP segment of a reassembled PDU]"
"8.688572","172.19.0.3","5.9.29.183","TCP","56","43520 → 9002 [ACK] Seq=16204 Ack=243284 Win=11911 Len=0"
"8.688588","5.9.29.183","172.19.0.3","TCP","1516","9002 → 43520 [PSH, ACK] Seq=243284 Ack=16204 Win=65535 Len=1460 [TCP segment of a reassembled PDU]"
"8.688598","5.9.29.183","172.19.0.3","TLSv1.2","1213","Application Data"
"8.688793","172.19.0.3","5.9.29.183","TCP","56","43520 → 9002 [ACK] Seq=16204 Ack=245901 Win=11895 Len=0"
"8.703380","5.9.29.183","172.19.0.3","TLSv1.2","149","Application Data"
"8.724633","5.9.29.183","172.19.0.3","TCP","1516","[TCP segment of a reassembled PDU]"
"8.724662","172.19.0.3","5.9.29.183","TCP","56","43520 → 9002 [ACK] Seq=16204 Ack=247454 Win=11911 Len=0"
"8.724900","5.9.29.183","172.19.0.3","TCP","1516","9002 → 43520 [PSH, ACK] Seq=247454 Ack=16204 Win=65535 Len=1460 [TCP segment of a reassembled PDU]"
"8.724910","5.9.29.183","172.19.0.3","TLSv1.2","763","Application Data"
"8.724942","172.19.0.3","5.9.29.183","TCP","56","43520 → 9002 [ACK] Seq=16204 Ack=249621 Win=11895 Len=0"
"8.733976","5.9.29.183","172.19.0.3","TCP","1516","[TCP segment of a reassembled PDU]"
"8.734004","5.9.29.183","172.19.0.3","TCP","1516","9002 → 43520 [PSH, ACK] Seq=251081 Ack=16204 Win=65535 Len=1460 [TCP segment of a reassembled PDU]"
"8.734017","172.19.0.3","5.9.29.183","TCP","56","43520 → 9002 [ACK] Seq=16204 Ack=252541 Win=11901 Len=0"
"8.734019","5.9.29.183","172.19.0.3","TLSv1.2","1516","Application Data [TCP segment of a reassembled PDU]"
"8.734023","5.9.29.183","172.19.0.3","TCP","1516","9002 → 43520 [PSH, ACK] Seq=254001 Ack=16204 Win=65535 Len=1460 [TCP segment of a reassembled PDU]"
"8.734026","5.9.29.183","172.19.0.3","TCP","1456","9002 → 43520 [PSH, ACK] Seq=255461 Ack=16204 Win=65535 Len=1400 [TCP segment of a reassembled PDU]"
"8.734216","5.9.29.183","172.19.0.3","TLSv1.2","1516","Application Data [TCP segment of a reassembled PDU]"
"8.734229","5.9.29.183","172.19.0.3","TCP","1516","9002 → 43520 [PSH, ACK] Seq=258321 Ack=16204 Win=65535 Len=1460 [TCP segment of a reassembled PDU]"
"8.734233","5.9.29.183","172.19.0.3","TCP","1516","9002 → 43520 [PSH, ACK] Seq=259781 Ack=16204 Win=65535 Len=1460 [TCP segment of a reassembled PDU]"
"8.734236","5.9.29.183","172.19.0.3","TLSv1.2","1468","Application Data [TCP segment of a reassembled PDU]"
"8.734310","172.19.0.3","5.9.29.183","TCP","56","43520 → 9002 [ACK] Seq=16204 Ack=262653 Win=11845 Len=0"
"8.735014","172.19.0.3","5.9.29.183","TLSv1.2","599","Application Data"
"8.735230","5.9.29.183","172.19.0.3","TCP","56","9002 → 43520 [ACK] Seq=262653 Ack=16747 Win=65535 Len=0"
"8.739793","5.9.29.183","172.19.0.3","TCP","1516","9002 → 43520 [PSH, ACK] Seq=262653 Ack=16747 Win=65535 Len=1460 [TCP segment of a reassembled PDU]"
"8.739819","5.9.29.183","172.19.0.3","TCP","1516","9002 → 43520 [PSH, ACK] Seq=264113 Ack=16747 Win=65535 Len=1460 [TCP segment of a reassembled PDU]"
"8.739830","172.19.0.3","5.9.29.183","TCP","56","43520 → 9002 [ACK] Seq=16747 Ack=265573 Win=11903 Len=0"
"8.739832","5.9.29.183","172.19.0.3","TLSv1.2","1516","Application Data, Application Data"
"8.739835","5.9.29.183","172.19.0.3","TCP","1067","9002 → 43520 [PSH, ACK] Seq=267033 Ack=16747 Win=65535 Len=1011 [TCP segment of a reassembled PDU]"
"8.739837","5.9.29.183","172.19.0.3","TCP","1516","9002 → 43520 [PSH, ACK] Seq=268044 Ack=16747 Win=65535 Len=1460 [TCP segment of a reassembled PDU]"
"8.739840","5.9.29.183","172.19.0.3","TCP","445","9002 → 43520 [PSH, ACK] Seq=269504 Ack=16747 Win=65535 Len=389 [TCP segment of a reassembled PDU]"
"8.739991","172.19.0.3","5.9.29.183","TCP","56","43520 → 9002 [ACK] Seq=16747 Ack=269893 Win=11871 Len=0"
"8.749245","5.9.29.183","172.19.0.3","TLSv1.2","1504","Application Data [TCP segment of a reassembled PDU]"
"8.749271","5.9.29.183","172.19.0.3","TCP","1516","9002 → 43520 [PSH, ACK] Seq=271341 Ack=16747 Win=65535 Len=1460 [TCP segment of a reassembled PDU]"
"8.749282","172.19.0.3","5.9.29.183","TCP","56","43520 → 9002 [ACK] Seq=16747 Ack=272801 Win=11903 Len=0"
"8.749284","5.9.29.183","172.19.0.3","TLSv1.2","1237","Application Data"
"8.750151","5.9.29.183","172.19.0.3","TCP","1516","[TCP segment of a reassembled PDU]"
"8.750159","172.19.0.3","5.9.29.183","TCP","56","43520 → 9002 [ACK] Seq=16747 Ack=275442 Win=11911 Len=0"
"8.750164","5.9.29.183","172.19.0.3","TCP","1492","9002 → 43520 [PSH, ACK] Seq=275442 Ack=16747 Win=65535 Len=1436 [TCP segment of a reassembled PDU]"
"8.764676","5.9.29.183","172.19.0.3","TLSv1.2","1330","Application Data, Application Data"
"8.764732","172.19.0.3","5.9.29.183","TCP","56","43520 → 9002 [ACK] Seq=16747 Ack=278152 Win=11911 Len=0"
"8.765078","172.19.0.3","5.9.29.183","TLSv1.2","599","Application Data"
"8.765259","5.9.29.183","172.19.0.3","TCP","56","9002 → 43520 [ACK] Seq=278152 Ack=17290 Win=65535 Len=0"
"8.772317","5.9.29.183","172.19.0.3","TCP","1516","[TCP segment of a reassembled PDU]"
"8.772344","5.9.29.183","172.19.0.3","TCP","1492","9002 → 43520 [PSH, ACK] Seq=279612 Ack=17290 Win=65535 Len=1436 [TCP segment of a reassembled PDU]"
"8.772448","172.19.0.3","5.9.29.183","TCP","56","43520 → 9002 [ACK] Seq=17290 Ack=281048 Win=11903 Len=0"
"8.779715","5.9.29.183","172.19.0.3","TLSv1.2","273","Application Data"
"8.816796","5.9.29.183","172.19.0.3","TCP","1516","[TCP segment of a reassembled PDU]"
"8.816813","172.19.0.3","5.9.29.183","TCP","56","43520 → 9002 [ACK] Seq=17290 Ack=282725 Win=11911 Len=0"
"8.816825","5.9.29.183","172.19.0.3","TCP","1516","9002 → 43520 [PSH, ACK] Seq=282725 Ack=17290 Win=65535 Len=1460 [TCP segment of a reassembled PDU]"
"8.816830","5.9.29.183","172.19.0.3","TLSv1.2","763","Application Data"
"8.816962","172.19.0.3","5.9.29.183","TCP","56","43520 → 9002 [ACK] Seq=17290 Ack=284892 Win=11895 Len=0"
"8.876151","5.9.29.183","172.19.0.3","TCP","1504","[TCP segment of a reassembled PDU]"
"8.876174","5.9.29.183","172.19.0.3","TCP","1516","9002 → 43520 [PSH, ACK] Seq=286340 Ack=17290 Win=65535 Len=1460 [TCP segment of a reassembled PDU]"
"8.876185","172.19.0.3","5.9.29.183","TCP","56","43520 → 9002 [ACK] Seq=17290 Ack=287800 Win=11903 Len=0"
"8.876186","5.9.29.183","172.19.0.3","TLSv1.2","1225","Application Data"
"8.876580","172.19.0.3","5.9.29.183","TLSv1.2","599","Application Data"
"8.876745","5.9.29.183","172.19.0.3","TCP","56","9002 → 43520 [ACK] Seq=288969 Ack=17833 Win=65535 Len=0"
"8.891898","5.9.29.183","172.19.0.3","TLSv1.2","149","Application Data"
"8.932417","172.19.0.3","5.9.29.183","TCP","56","43520 → 9002 [ACK] Seq=17833 Ack=289062 Win=11911 Len=0"
"8.939945","5.9.29.183","172.19.0.3","TCP","1504","[TCP segment of a reassembled PDU]"
"8.939978","5.9.29.183","172.19.0.3","TCP","1516","9002 → 43520 [PSH, ACK] Seq=290510 Ack=17833 Win=65535 Len=1460 [TCP segment of a reassembled PDU]"
"8.939990","5.9.29.183","172.19.0.3","TLSv1.2","261","Application Data"
"8.940113","172.19.0.3","5.9.29.183","TCP","56","43520 → 9002 [ACK] Seq=17833 Ack=292175 Win=11895 Len=0"
"8.943903","172.19.0.3","5.9.29.183","TLSv1.2","599","Application Data"
"8.944192","5.9.29.183","172.19.0.3","TCP","56","9002 → 43520 [ACK] Seq=292175 Ack=18376 Win=65535 Len=0"
"9.184085","02:42:7b:11:31:3d","","ARP","44","Who has 172.19.0.3? Tell 172.19.0.1"
"9.184094","02:42:ac:13:00:03","","ARP","44","172.19.0.3 is at 02:42:ac:13:00:03"
"9.472356","5.9.29.183","172.19.0.3","TLSv1.2","599","Application Data"
"9.472987","172.19.0.3","5.9.29.183","TLSv1.2","599","Application Data"
"9.473524","5.9.29.183","172.19.0.3","TCP","56","9002 → 43520 [ACK] Seq=292718 Ack=18919 Win=65535 Len=0"
"9.888157","5.9.29.183","172.19.0.3","TLSv1.2","599","Application Data"
"9.920226","5.9.29.183","172.19.0.3","TCP","1516","[TCP segment of a reassembled PDU]"
"9.920250","172.19.0.3","5.9.29.183","TCP","56","43520 → 9002 [ACK] Seq=18919 Ack=294721 Win=11911 Len=0"
"9.920260","5.9.29.183","172.19.0.3","TCP","1516","9002 → 43520 [PSH, ACK] Seq=294721 Ack=18919 Win=65535 Len=1460 [TCP segment of a reassembled PDU]"
"9.920267","5.9.29.183","172.19.0.3","TLSv1.2","1213","Application Data"
"9.920362","5.9.29.183","172.19.0.3","TCP","1516","[TCP segment of a reassembled PDU]"
"9.920370","5.9.29.183","172.19.0.3","TCP","1492","9002 → 43520 [PSH, ACK] Seq=298798 Ack=18919 Win=65535 Len=1436 [TCP segment of a reassembled PDU]"
"9.920493","172.19.0.3","5.9.29.183","TCP","56","43520 → 9002 [ACK] Seq=18919 Ack=300234 Win=11879 Len=0"
"9.935941","5.9.29.183","172.19.0.3","TLSv1.2","337","Application Data"
"9.938606","5.9.29.183","172.19.0.3","TCP","1504","[TCP segment of a reassembled PDU]"
"9.938620","172.19.0.3","5.9.29.183","TCP","56","43520 → 9002 [ACK] Seq=18919 Ack=301963 Win=11911 Len=0"
"9.938735","5.9.29.183","172.19.0.3","TCP","1504","9002 → 43520 [PSH, ACK] Seq=301963 Ack=18919 Win=65535 Len=1448 [TCP segment of a reassembled PDU]"
"9.950909","5.9.29.183","172.19.0.3","TLSv1.2","1330","Application Data, Application Data"
"9.950927","172.19.0.3","5.9.29.183","TCP","56","43520 → 9002 [ACK] Seq=18919 Ack=304685 Win=11911 Len=0"
"9.991060","5.9.29.183","172.19.0.3","TCP","1504","[TCP segment of a reassembled PDU]"
"9.991111","5.9.29.183","172.19.0.3","TCP","1504","9002 → 43520 [PSH, ACK] Seq=306133 Ack=18919 Win=65535 Len=1448 [TCP segment of a reassembled PDU]"
"9.991170","5.9.29.183","172.19.0.3","TLSv1.2","1237","Application Data"
"9.991174","5.9.29.183","172.19.0.3","TCP","1516","[TCP segment of a reassembled PDU]"
"9.991177","5.9.29.183","172.19.0.3","TCP","1492","9002 → 43520 [PSH, ACK] Seq=310222 Ack=18919 Win=65535 Len=1436 [TCP segment of a reassembled PDU]"
"9.991241","172.19.0.3","5.9.29.183","TCP","56","43520 → 9002 [ACK] Seq=18919 Ack=311658 Win=11879 Len=0"
"10.006963","5.9.29.183","172.19.0.3","TLSv1.2","851","Application Data"
"10.016082","5.9.29.183","172.19.0.3","TCP","1516","[TCP segment of a reassembled PDU]"
"10.016107","172.19.0.3","5.9.29.183","TCP","56","43520 → 9002 [ACK] Seq=18919 Ack=313913 Win=11911 Len=0"
"10.016122","5.9.29.183","172.19.0.3","TCP","1492","9002 → 43520 [PSH, ACK] Seq=313913 Ack=18919 Win=65535 Len=1436 [TCP segment of a reassembled PDU]"
"10.016129","5.9.29.183","172.19.0.3","TLSv1.2","1504","Application Data [TCP segment of a reassembled PDU]"
"10.016302","172.19.0.3","5.9.29.183","TCP","56","43520 → 9002 [ACK] Seq=18919 Ack=316797 Win=11895 Len=0"
"10.021802","5.9.29.183","172.19.0.3","TLSv1.2","396","Application Data"
"10.038558","5.9.29.183","172.19.0.3","TCP","1516","[TCP segment of a reassembled PDU]"
"10.038578","172.19.0.3","5.9.29.183","TCP","56","43520 → 9002 [ACK] Seq=18919 Ack=318597 Win=11911 Len=0"
"10.038591","5.9.29.183","172.19.0.3","TCP","1516","9002 → 43520 [PSH, ACK] Seq=318597 Ack=18919 Win=65535 Len=1460 [TCP segment of a reassembled PDU]"
"10.038596","5.9.29.183","172.19.0.3","TLSv1.2","1516","Application Data [TCP segment of a reassembled PDU]"
"10.038598","5.9.29.183","172.19.0.3","TCP","1201","9002 → 43520 [PSH, ACK] Seq=321517 Ack=18919 Win=65535 Len=1145 [TCP segment of a reassembled PDU]"
"10.038749","5.9.29.183","172.19.0.3","TCP","1504","9002 → 43520 [PSH, ACK] Seq=322662 Ack=18919 Win=65535 Len=1448 [TCP segment of a reassembled PDU]"
"10.038779","172.19.0.3","5.9.29.183","TCP","56","43520 → 9002 [ACK] Seq=18919 Ack=324110 Win=11879 Len=0"
"10.038979","172.19.0.3","5.9.29.183","TLSv1.2","599","Application Data"
"10.039150","5.9.29.183","172.19.0.3","TCP","56","9002 → 43520 [ACK] Seq=324110 Ack=19462 Win=65535 Len=0"
"10.053795","5.9.29.183","172.19.0.3","TLSv1.2","851","Application Data"
"10.070442","5.9.29.183","172.19.0.3","TCP","1516","[TCP segment of a reassembled PDU]"
"10.070460","172.19.0.3","5.9.29.183","TCP","56","43520 → 9002 [ACK] Seq=19462 Ack=326365 Win=11911 Len=0"
"10.070472","5.9.29.183","172.19.0.3","TCP","1516","9002 → 43520 [PSH, ACK] Seq=326365 Ack=19462 Win=65535 Len=1460 [TCP segment of a reassembled PDU]"
"10.070477","5.9.29.183","172.19.0.3","TLSv1.2","1213","Application Data"
"10.070603","172.19.0.3","5.9.29.183","TCP","56","43520 → 9002 [ACK] Seq=19462 Ack=328982 Win=11893 Len=0"
"10.081955","5.9.29.183","172.19.0.3","TLSv1.2","1516","Application Data"
"10.081985","5.9.29.183","172.19.0.3","TCP","1492","9002 → 43520 [PSH, ACK] Seq=330442 Ack=19462 Win=65535 Len=1436 [TCP segment of a reassembled PDU]"
"10.081999","172.19.0.3","5.9.29.183","TCP","56","43520 → 9002 [ACK] Seq=19462 Ack=331878 Win=11903 Len=0"
"10.085629","5.9.29.183","172.19.0.3","TLSv1.2","880","Application Data"
"10.085899","172.19.0.3","5.9.29.183","TLSv1.2","599","Application Data"
"10.086151","5.9.29.183","172.19.0.3","TCP","56","9002 → 43520 [ACK] Seq=332702 Ack=20005 Win=65535 Len=0"
"10.096438","172.19.0.3","5.9.29.183","TLSv1.2","1113","Application Data"
"10.096763","5.9.29.183","172.19.0.3","TCP","56","9002 → 43520 [ACK] Seq=332702 Ack=21062 Win=65535 Len=0"
"10.133023","5.9.29.183","172.19.0.3","TLSv1.2","599","Application Data"
"10.178113","172.19.0.3","5.9.29.183","TCP","56","43520 → 9002 [ACK] Seq=21062 Ack=333245 Win=11911 Len=0"
"10.560121","5.9.29.183","172.19.0.3","TCP","391","[TCP segment of a reassembled PDU]"
"10.560204","172.19.0.3","5.9.29.183","TCP","56","43520 → 9002 [ACK] Seq=21062 Ack=333580 Win=11911 Len=0"
"10.560206","5.9.29.183","172.19.0.3","TLSv1.2","264","Application Data"
"10.560214","172.19.0.3","5.9.29.183","TCP","56","43520 → 9002 [ACK] Seq=21062 Ack=333788 Win=11910 Len=0"
"10.560801","172.19.0.3","5.9.29.183","TLSv1.2","599","Application Data"
"10.560992","5.9.29.183","172.19.0.3","TCP","56","9002 → 43520 [ACK] Seq=333788 Ack=21605 Win=65535 Len=0"
"10.994987","5.9.29.183","172.19.0.3","TCP","1504","[TCP segment of a reassembled PDU]"
"10.995074","5.9.29.183","172.19.0.3","TCP","1516","9002 → 43520 [PSH, ACK] Seq=335236 Ack=21605 Win=65535 Len=1460 [TCP segment of a reassembled PDU]"
"10.995084","5.9.29.183","172.19.0.3","TLSv1.2","775","Application Data"
"10.995201","172.19.0.3","5.9.29.183","TCP","56","43520 → 9002 [ACK] Seq=21605 Ack=337415 Win=11895 Len=0"
"11.006098","5.9.29.183","172.19.0.3","TCP","1516","[TCP segment of a reassembled PDU]"
"11.006150","5.9.29.183","172.19.0.3","TCP","1492","9002 → 43520 [PSH, ACK] Seq=338875 Ack=21605 Win=65535 Len=1436 [TCP segment of a reassembled PDU]"
"11.006163","172.19.0.3","5.9.29.183","TCP","56","43520 → 9002 [ACK] Seq=21605 Ack=340311 Win=11903 Len=0"
"11.010216","5.9.29.183","172.19.0.3","TLSv1.2","787","Application Data"
"11.025377","5.9.29.183","172.19.0.3","TLSv1.2","1113","Application Data"
"11.025404","172.19.0.3","5.9.29.183","TCP","56","43520 → 9002 [ACK] Seq=21605 Ack=342099 Win=11911 Len=0"
"11.078422","5.9.29.183","172.19.0.3","TCP","1516","[TCP segment of a reassembled PDU]"
"11.078471","5.9.29.183","172.19.0.3","TCP","1492","9002 → 43520 [PSH, ACK] Seq=343559 Ack=21605 Win=65535 Len=1436 [TCP segment of a reassembled PDU]"
"11.078481","5.9.29.183","172.19.0.3","TLSv1.2","787","Application Data"
"11.078619","172.19.0.3","5.9.29.183","TCP","56","43520 → 9002 [ACK] Seq=21605 Ack=345726 Win=11895 Len=0"
"11.089364","5.9.29.183","172.19.0.3","TCP","1516","[TCP segment of a reassembled PDU]"
"11.089423","5.9.29.183","172.19.0.3","TCP","1516","9002 → 43520 [PSH, ACK] Seq=347186 Ack=21605 Win=65535 Len=1460 [TCP segment of a reassembled PDU]"
"11.089437","172.19.0.3","5.9.29.183","TCP","56","43520 → 9002 [ACK] Seq=21605 Ack=348646 Win=11903 Len=0"
"11.089440","5.9.29.183","172.19.0.3","TLSv1.2","1516","Application Data [TCP segment of a reassembled PDU]"
"11.089443","5.9.29.183","172.19.0.3","TCP","1516","9002 → 43520 [PSH, ACK] Seq=350106 Ack=21605 Win=65535 Len=1460 [TCP segment of a reassembled PDU]"
"11.089448","5.9.29.183","172.19.0.3","TCP","1456","9002 → 43520 [PSH, ACK] Seq=351566 Ack=21605 Win=65535 Len=1400 [TCP segment of a reassembled PDU]"
"11.089450","5.9.29.183","172.19.0.3","TLSv1.2","1516","Application Data [TCP segment of a reassembled PDU]"
"11.089453","5.9.29.183","172.19.0.3","TCP","1492","9002 → 43520 [PSH, ACK] Seq=354426 Ack=21605 Win=65535 Len=1436 [TCP segment of a reassembled PDU]"
"11.089551","172.19.0.3","5.9.29.183","TCP","56","43520 → 9002 [ACK] Seq=21605 Ack=355862 Win=11861 Len=0"
"11.094352","5.9.29.183","172.19.0.3","TLSv1.2","1504","Application Data [TCP segment of a reassembled PDU]"
"11.094406","5.9.29.183","172.19.0.3","TLSv1.2","410","Application Data"
"11.094421","172.19.0.3","5.9.29.183","TCP","56","43520 → 9002 [ACK] Seq=21605 Ack=357664 Win=11903 Len=0"
"11.099608","5.9.29.183","172.19.0.3","TCP","1516","[TCP segment of a reassembled PDU]"
"11.099668","5.9.29.183","172.19.0.3","TCP","1516","9002 → 43520 [PSH, ACK] Seq=359124 Ack=21605 Win=65535 Len=1460 [TCP segment of a reassembled PDU]"
"11.099682","172.19.0.3","5.9.29.183","TCP","56","43520 → 9002 [ACK] Seq=21605 Ack=360584 Win=11903 Len=0"
"11.099684","5.9.29.183","172.19.0.3","TLSv1.2","1516","Application Data [TCP segment of a reassembled PDU]"
"11.099688","5.9.29.183","172.19.0.3","TCP","1468","9002 → 43520 [PSH, ACK] Seq=362044 Ack=21605 Win=65535 Len=1412 [TCP segment of a reassembled PDU]"
"11.099817","172.19.0.3","5.9.29.183","TCP","56","43520 → 9002 [ACK] Seq=21605 Ack=363456 Win=11887 Len=0"
"11.100054","172.19.0.3","5.9.29.183","TLSv1.2","599","Application Data"
"11.100311","5.9.29.183","172.19.0.3","TCP","56","9002 → 43520 [ACK] Seq=363456 Ack=22148 Win=65535 Len=0"
"11.109570","5.9.29.183","172.19.0.3","TCP","1516","9002 → 43520 [PSH, ACK] Seq=363456 Ack=22148 Win=65535 Len=1460 [TCP segment of a reassembled PDU]"
"11.109616","5.9.29.183","172.19.0.3","TLSv1.2","1492","Application Data [TCP segment of a reassembled PDU]"
"11.109630","172.19.0.3","5.9.29.183","TCP","56","43520 → 9002 [ACK] Seq=22148 Ack=366352 Win=11903 Len=0"
"11.109633","5.9.29.183","172.19.0.3","TLSv1.2","707","Application Data"
"11.130065","5.9.29.183","172.19.0.3","TCP","1516","[TCP segment of a reassembled PDU]"
"11.130087","172.19.0.3","5.9.29.183","TCP","56","43520 → 9002 [ACK] Seq=22148 Ack=368463 Win=11911 Len=0"
"11.130124","5.9.29.183","172.19.0.3","TCP","1492","9002 → 43520 [PSH, ACK] Seq=368463 Ack=22148 Win=65535 Len=1436 [TCP segment of a reassembled PDU]"
"11.130152","5.9.29.183","172.19.0.3","TLSv1.2","273","Application Data"
"11.130295","172.19.0.3","5.9.29.183","TCP","56","43520 → 9002 [ACK] Seq=22148 Ack=370116 Win=11899 Len=0"
"11.178796","5.9.29.183","172.19.0.3","TCP","1504","[TCP segment of a reassembled PDU]"
"11.178843","5.9.29.183","172.19.0.3","TCP","1516","9002 → 43520 [PSH, ACK] Seq=371564 Ack=22148 Win=65535 Len=1460 [TCP segment of a reassembled PDU]"
"11.178857","172.19.0.3","5.9.29.183","TCP","56","43520 → 9002 [ACK] Seq=22148 Ack=373024 Win=11903 Len=0"
"11.178858","5.9.29.183","172.19.0.3","TLSv1.2","775","Application Data"
"11.217502","5.9.29.183","172.19.0.3","TCP","1504","[TCP segment of a reassembled PDU]"
"11.217549","172.19.0.3","5.9.29.183","TCP","56","43520 → 9002 [ACK] Seq=22148 Ack=375191 Win=11909 Len=0"
"11.217593","5.9.29.183","172.19.0.3","TCP","1516","9002 → 43520 [PSH, ACK] Seq=375191 Ack=22148 Win=65535 Len=1460 [TCP segment of a reassembled PDU]"
"11.217630","5.9.29.183","172.19.0.3","TLSv1.2","1516","Application Data [TCP segment of a reassembled PDU]"
"11.217637","5.9.29.183","172.19.0.3","TCP","1516","9002 → 43520 [PSH, ACK] Seq=378111 Ack=22148 Win=65535 Len=1460 [TCP segment of a reassembled PDU]"
"11.217644","5.9.29.183","172.19.0.3","TCP","1516","9002 → 43520 [PSH, ACK] Seq=379571 Ack=22148 Win=65535 Len=1460 [TCP segment of a reassembled PDU]"
"11.217648","5.9.29.183","172.19.0.3","TLSv1.2","1516","Application Data [TCP segment of a reassembled PDU]"
"11.217720","5.9.29.183","172.19.0.3","TCP","1516","9002 → 43520 [PSH, ACK] Seq=382491 Ack=22148 Win=65535 Len=1460 [TCP segment of a reassembled PDU]"
"11.217727","5.9.29.183","172.19.0.3","TCP","1165","9002 → 43520 [PSH, ACK] Seq=383951 Ack=22148 Win=65535 Len=1109 [TCP segment of a reassembled PDU]"
"11.217766","172.19.0.3","5.9.29.183","TCP","56","43520 → 9002 [ACK] Seq=22148 Ack=385060 Win=11853 Len=0"
"11.232807","5.9.29.183","172.19.0.3","TLSv1.2","1504","Application Data [TCP segment of a reassembled PDU]"
"11.232888","5.9.29.183","172.19.0.3","TCP","1516","9002 → 43520 [PSH, ACK] Seq=386508 Ack=22148 Win=65535 Len=1460 [TCP segment of a reassembled PDU]"
"11.232904","172.19.0.3","5.9.29.183","TCP","56","43520 → 9002 [ACK] Seq=22148 Ack=387968 Win=11903 Len=0"
"11.233001","5.9.29.183","172.19.0.3","TCP","1516","9002 → 43520 [PSH, ACK] Seq=387968 Ack=22148 Win=65535 Len=1460 [TCP segment of a reassembled PDU]"
"11.233006","5.9.29.183","172.19.0.3","TLSv1.2","1516","Application Data [TCP segment of a reassembled PDU]"
"11.233009","5.9.29.183","172.19.0.3","TCP","1468","9002 → 43520 [PSH, ACK] Seq=390888 Ack=22148 Win=65535 Len=1412 [TCP segment of a reassembled PDU]"
"11.233030","5.9.29.183","172.19.0.3","TCP","1516","9002 → 43520 [PSH, ACK] Seq=392300 Ack=22148 Win=65535 Len=1460 [TCP segment of a reassembled PDU]"
"11.233037","5.9.29.183","172.19.0.3","TLSv1.2","1516","Application Data [TCP segment of a reassembled PDU]"
"11.233040","5.9.29.183","172.19.0.3","TCP","1516","9002 → 43520 [PSH, ACK] Seq=395220 Ack=22148 Win=65535 Len=1460 [TCP segment of a reassembled PDU]"
"11.233042","5.9.29.183","172.19.0.3","TLSv1.2","1516","Application Data [TCP segment of a reassembled PDU]"
"11.233055","5.9.29.183","172.19.0.3","TCP","1032","9002 → 43520 [PSH, ACK] Seq=398140 Ack=22148 Win=65535 Len=976 [TCP segment of a reassembled PDU]"
"11.233176","5.9.29.183","172.19.0.3","TCP","1516","9002 → 43520 [PSH, ACK] Seq=399116 Ack=22148 Win=65535 Len=1460 [TCP segment of a reassembled PDU]"
"11.233185","5.9.29.183","172.19.0.3","TLSv1.2","1516","Application Data [TCP segment of a reassembled PDU]"
"11.233201","5.9.29.183","172.19.0.3","TLSv1.2","265","Application Data"
"11.233223","172.19.0.3","5.9.29.183","TLSv1.2","1113","Application Data"
"11.233430","5.9.29.183","172.19.0.3","TCP","56","9002 → 43520 [ACK] Seq=402245 Ack=23205 Win=65535 Len=0"
"11.248472","5.9.29.183","172.19.0.3","TLSv1.2","1516","Application Data"
"11.248524","5.9.29.183","172.19.0.3","TCP","1516","9002 → 43520 [PSH, ACK] Seq=403705 Ack=23205 Win=65535 Len=1460 [TCP segment of a reassembled PDU]"
"11.248538","172.19.0.3","5.9.29.183","TCP","56","43520 → 9002 [ACK] Seq=23205 Ack=405165 Win=11903 Len=0"
"11.248540","5.9.29.183","172.19.0.3","TCP","1480","9002 → 43520 [PSH, ACK] Seq=405165 Ack=23205 Win=65535 Len=1424 [TCP segment of a reassembled PDU]"
"11.248543","5.9.29.183","172.19.0.3","TLSv1.2","1453","Application Data, Application Data"
"11.248732","172.19.0.3","5.9.29.183","TCP","56","43520 → 9002 [ACK] Seq=23205 Ack=407986 Win=11887 Len=0"
"11.296562","5.9.29.183","172.19.0.3","TCP","1504","[TCP segment of a reassembled PDU]"
"11.296625","5.9.29.183","172.19.0.3","TCP","1516","9002 → 43520 [PSH, ACK] Seq=409434 Ack=23205 Win=65535 Len=1460 [TCP segment of a reassembled PDU]"
"11.296646","172.19.0.3","5.9.29.183","TCP","56","43520 → 9002 [ACK] Seq=23205 Ack=410894 Win=11903 Len=0"
"11.296648","5.9.29.183","172.19.0.3","TLSv1.2","1225","Application Data"
"11.297020","172.19.0.3","5.9.29.183","TLSv1.2","599","Application Data"
"11.297300","5.9.29.183","172.19.0.3","TCP","56","9002 → 43520 [ACK] Seq=412063 Ack=23748 Win=65535 Len=0"
"11.311600","5.9.29.183","172.19.0.3","TLSv1.2","149","Application Data"
"11.316298","172.19.0.3","5.9.29.183","TLSv1.2","599","Application Data"
"11.316655","5.9.29.183","172.19.0.3","TCP","56","9002 → 43520 [ACK] Seq=412156 Ack=24291 Win=65535 Len=0"
"11.756965","5.9.29.183","172.19.0.3","TLSv1.2","599","Application Data"
"11.758008","172.19.0.3","5.9.29.183","TLSv1.2","599","Application Data"
"11.758394","5.9.29.183","172.19.0.3","TCP","56","9002 → 43520 [ACK] Seq=412699 Ack=24834 Win=65535 Len=0"
"12.170692","5.9.29.183","172.19.0.3","TCP","1516","[TCP segment of a reassembled PDU]"
"12.170718","5.9.29.183","172.19.0.3","TCP","1516","9002 → 43520 [PSH, ACK] Seq=414159 Ack=24834 Win=65535 Len=1460 [TCP segment of a reassembled PDU]"
"12.170722","5.9.29.183","172.19.0.3","TLSv1.2","763","Application Data"
"12.170808","172.19.0.3","5.9.29.183","TCP","56","43520 → 9002 [ACK] Seq=24834 Ack=416326 Win=11895 Len=0"
"12.183199","5.9.29.183","172.19.0.3","TCP","1504","[TCP segment of a reassembled PDU]"
"12.183332","5.9.29.183","172.19.0.3","TCP","1504","9002 → 43520 [PSH, ACK] Seq=417774 Ack=24834 Win=65535 Len=1448 [TCP segment of a reassembled PDU]"
"12.183356","172.19.0.3","5.9.29.183","TCP","56","43520 → 9002 [ACK] Seq=24834 Ack=419222 Win=11903 Len=0"
"12.185631","5.9.29.183","172.19.0.3","TLSv1.2","787","Application Data"
"12.216558","5.9.29.183","172.19.0.3","TCP","1504","[TCP segment of a reassembled PDU]"
"12.216577","172.19.0.3","5.9.29.183","TCP","56","43520 → 9002 [ACK] Seq=24834 Ack=421401 Win=11911 Len=0"
"12.216584","5.9.29.183","172.19.0.3","TCP","1516","9002 → 43520 [PSH, ACK] Seq=421401 Ack=24834 Win=65535 Len=1460 [TCP segment of a reassembled PDU]"
"12.216589","5.9.29.183","172.19.0.3","TLSv1.2","1225","Application Data"
"12.216697","172.19.0.3","5.9.29.183","TCP","56","43520 → 9002 [ACK] Seq=24834 Ack=424030 Win=11895 Len=0"
"12.232113","5.9.29.183","172.19.0.3","TLSv1.2","149","Application Data"
"12.265279","5.9.29.183","172.19.0.3","TCP","1504","[TCP segment of a reassembled PDU]"
"12.265296","172.19.0.3","5.9.29.183","TCP","56","43520 → 9002 [ACK] Seq=24834 Ack=425571 Win=11911 Len=0"
"12.265309","5.9.29.183","172.19.0.3","TCP","1516","9002 → 43520 [PSH, ACK] Seq=425571 Ack=24834 Win=65535 Len=1460 [TCP segment of a reassembled PDU]"
"12.265313","5.9.29.183","172.19.0.3","TLSv1.2","775","Application Data"
"12.265449","172.19.0.3","5.9.29.183","TCP","56","43520 → 9002 [ACK] Seq=24834 Ack=427750 Win=11895 Len=0"
"12.362099","5.9.29.183","172.19.0.3","TCP","1516","[TCP segment of a reassembled PDU]"
"12.362123","5.9.29.183","172.19.0.3","TCP","1492","9002 → 43520 [PSH, ACK] Seq=429210 Ack=24834 Win=65535 Len=1436 [TCP segment of a reassembled PDU]"
"12.362135","172.19.0.3","5.9.29.183","TCP","56","43520 → 9002 [ACK] Seq=24834 Ack=430646 Win=11903 Len=0"
"12.362136","5.9.29.183","172.19.0.3","TLSv1.2","787","Application Data"
"12.363504","172.19.0.3","5.9.29.183","TLSv1.2","599","Application Data"
"12.363869","5.9.29.183","172.19.0.3","TCP","56","9002 → 43520 [ACK] Seq=431377 Ack=25377 Win=65535 Len=0"
"12.372991","172.19.0.3","5.9.29.183","TLSv1.2","599","Application Data"
"12.373282","5.9.29.183","172.19.0.3","TCP","56","9002 → 43520 [ACK] Seq=431377 Ack=25920 Win=65535 Len=0"
"12.386719","5.9.29.183","172.19.0.3","TLSv1.2","599","Application Data"
"12.429537","172.19.0.3","5.9.29.183","TCP","56","43520 → 9002 [ACK] Seq=25920 Ack=431920 Win=11911 Len=0"
"12.874316","5.9.29.183","172.19.0.3","TLSv1.2","599","Application Data"
"12.874382","172.19.0.3","5.9.29.183","TCP","56","43520 → 9002 [ACK] Seq=25920 Ack=432463 Win=11911 Len=0"
"12.875132","172.19.0.3","5.9.29.183","TLSv1.2","599","Application Data"
"12.875342","5.9.29.183","172.19.0.3","TCP","56","9002 → 43520 [ACK] Seq=432463 Ack=26463 Win=65535 Len=0"
"13.601919","5.9.29.183","172.19.0.3","TLSv1.2","599","Application Data"
"13.627408","5.9.29.183","172.19.0.3","TCP","1516","[TCP segment of a reassembled PDU]"
"13.627428","172.19.0.3","5.9.29.183","TCP","56","43520 → 9002 [ACK] Seq=26463 Ack=434466 Win=11911 Len=0"
"13.627467","5.9.29.183","172.19.0.3","TCP","1492","9002 → 43520 [PSH, ACK] Seq=434466 Ack=26463 Win=65535 Len=1436 [TCP segment of a reassembled PDU]"
"13.627480","5.9.29.183","172.19.0.3","TLSv1.2","787","Application Data"
"13.627604","172.19.0.3","5.9.29.183","TCP","56","43520 → 9002 [ACK] Seq=26463 Ack=436633 Win=11895 Len=0"
"13.640939","5.9.29.183","172.19.0.3","TCP","1516","[TCP segment of a reassembled PDU]"
"13.640994","5.9.29.183","172.19.0.3","TCP","1492","9002 → 43520 [PSH, ACK] Seq=438093 Ack=26463 Win=65535 Len=1436 [TCP segment of a reassembled PDU]"
"13.641010","172.19.0.3","5.9.29.183","TCP","56","43520 → 9002 [ACK] Seq=26463 Ack=439529 Win=11903 Len=0"
"13.642857","5.9.29.183","172.19.0.3","TLSv1.2","787","Application Data"
"13.643168","172.19.0.3","5.9.29.183","TLSv1.2","599","Application Data"
"13.643446","5.9.29.183","172.19.0.3","TCP","56","9002 → 43520 [ACK] Seq=440260 Ack=27006 Win=65535 Len=0"
"13.667591","5.9.29.183","172.19.0.3","TLSv1.2","599","Application Data"
"13.697579","5.9.29.183","172.19.0.3","TCP","1504","[TCP segment of a reassembled PDU]"
"13.697601","172.19.0.3","5.9.29.183","TCP","56","43520 → 9002 [ACK] Seq=27006 Ack=442251 Win=11911 Len=0"
"13.697650","5.9.29.183","172.19.0.3","TCP","1504","9002 → 43520 [PSH, ACK] Seq=442251 Ack=27006 Win=65535 Len=1448 [TCP segment of a reassembled PDU]"
"13.697697","5.9.29.183","172.19.0.3","TLSv1.2","787","Application Data"
"13.697884","172.19.0.3","5.9.29.183","TCP","56","43520 → 9002 [ACK] Seq=27006 Ack=444430 Win=11895 Len=0"
"13.727651","5.9.29.183","172.19.0.3","TCP","1516","[TCP segment of a reassembled PDU]"
"13.727700","5.9.29.183","172.19.0.3","TCP","1516","9002 → 43520 [PSH, ACK] Seq=445890 Ack=27006 Win=65535 Len=1460 [TCP segment of a reassembled PDU]"
"13.727713","172.19.0.3","5.9.29.183","TCP","56","43520 → 9002 [ACK] Seq=27006 Ack=447350 Win=11903 Len=0"
"13.727716","5.9.29.183","172.19.0.3","TLSv1.2","1213","Application Data"
"13.739500","5.9.29.183","172.19.0.3","TLSv1.2","1516","Application Data"
"13.739530","172.19.0.3","5.9.29.183","TCP","56","43520 → 9002 [ACK] Seq=27006 Ack=449967 Win=11911 Len=0"
"13.739639","5.9.29.183","172.19.0.3","TCP","1516","9002 → 43520 [PSH, ACK] Seq=449967 Ack=27006 Win=65535 Len=1460 [TCP segment of a reassembled PDU]"
"13.739686","5.9.29.183","172.19.0.3","TLSv1.2","1516","Application Data [TCP segment of a reassembled PDU]"
"13.739696","5.9.29.183","172.19.0.3","TCP","1516","9002 → 43520 [PSH, ACK] Seq=452887 Ack=27006 Win=65535 Len=1460 [TCP segment of a reassembled PDU]"
"13.739786","5.9.29.183","172.19.0.3","TCP","1516","9002 → 43520 [PSH, ACK] Seq=454347 Ack=27006 Win=65535 Len=1460 [TCP segment of a reassembled PDU]"
"13.739792","5.9.29.183","172.19.0.3","TLSv1.2","1444","Application Data [TCP segment of a reassembled PDU]"
"13.739796","5.9.29.183","172.19.0.3","TCP","1504","9002 → 43520 [PSH, ACK] Seq=457195 Ack=27006 Win=65535 Len=1448 [TCP segment of a reassembled PDU]"
"13.739832","172.19.0.3","5.9.29.183","TCP","56","43520 → 9002 [ACK] Seq=27006 Ack=458643 Win=11863 Len=0"
"13.742953","5.9.29.183","172.19.0.3","TCP","1516","9002 → 43520 [PSH, ACK] Seq=458643 Ack=27006 Win=65535 Len=1460 [TCP segment of a reassembled PDU]"
"13.743015","5.9.29.183","172.19.0.3","TLSv1.2","1516","Application Data [TCP segment of a reassembled PDU]"
"13.743032","172.19.0.3","5.9.29.183","TCP","56","43520 → 9002 [ACK] Seq=27006 Ack=461563 Win=11903 Len=0"
"13.743035","5.9.29.183","172.19.0.3","TCP","1480","9002 → 43520 [PSH, ACK] Seq=461563 Ack=27006 Win=65535 Len=1424 [TCP segment of a reassembled PDU]"
"13.743039","5.9.29.183","172.19.0.3","TLSv1.2","1205","Application Data"
"13.743162","172.19.0.3","5.9.29.183","TCP","56","43520 → 9002 [ACK] Seq=27006 Ack=464136 Win=11887 Len=0"
"13.743561","172.19.0.3","5.9.29.183","TLSv1.2","599","Application Data"
"13.743889","5.9.29.183","172.19.0.3","TCP","56","9002 → 43520 [ACK] Seq=464136 Ack=27549 Win=65535 Len=0"
"13.794850","5.9.29.183","172.19.0.3","TCP","572","[TCP segment of a reassembled PDU]"
"13.794890","5.9.29.183","172.19.0.3","TCP","988","9002 → 43520 [PSH, ACK] Seq=464652 Ack=27549 Win=65535 Len=932 [TCP segment of a reassembled PDU]"
"13.795012","5.9.29.183","172.19.0.3","TCP","1516","9002 → 43520 [PSH, ACK] Seq=465584 Ack=27549 Win=65535 Len=1460 [TCP segment of a reassembled PDU]"
"13.795013","172.19.0.3","5.9.29.183","TCP","56","43520 → 9002 [ACK] Seq=27549 Ack=465584 Win=11911 Len=0"
"13.795016","5.9.29.183","172.19.0.3","TLSv1.2","775","Application Data"
"13.795068","172.19.0.3","5.9.29.183","TCP","56","43520 → 9002 [ACK] Seq=27549 Ack=467763 Win=11911 Len=0"
"13.862259","5.9.29.183","172.19.0.3","TLSv1.2","599","Application Data"
"13.887913","5.9.29.183","172.19.0.3","TCP","1516","[TCP segment of a reassembled PDU]"
"13.887931","172.19.0.3","5.9.29.183","TCP","56","43520 → 9002 [ACK] Seq=27549 Ack=469766 Win=11911 Len=0"
"13.887964","5.9.29.183","172.19.0.3","TLSv1.2","167","Application Data"
"13.928640","172.19.0.3","5.9.29.183","TCP","56","43520 → 9002 [ACK] Seq=27549 Ack=469877 Win=11911 Len=0"
