_ws.col.Time,_ws.col.Source,_ws.col.Destination,_ws.col.Protocol,_ws.col.Length,_ws.col.Info
"0.000000","172.19.0.3","5.9.29.183","TLSv1.2","599","Application Data"
"0.000372","5.9.29.183","172.19.0.3","TCP","56","9002 → 43520 [ACK] Seq=1 Ack=544 Win=65535 Len=0"
"1.023943","5.9.29.183","172.19.0.3","TLSv1.2","599","Application Data"
"1.024032","172.19.0.3","5.9.29.183","TCP","56","43520 → 9002 [ACK] Seq=544 Ack=544 Win=11911 Len=0"
"1.024869","172.19.0.3","5.9.29.183","TLSv1.2","2141","Application Data"
"1.025272","5.9.29.183","172.19.0.3","TCP","56","9002 → 43520 [ACK] Seq=544 Ack=2629 Win=65535 Len=0"
"1.943667","5.9.29.183","172.19.0.3","TLSv1.2","599","Application Data"
"1.958821","5.9.29.183","172.19.0.3","TLSv1.2","1113","Application Data"
"1.958845","172.19.0.3","5.9.29.183","TCP","56","43520 → 9002 [ACK] Seq=2629 Ack=2144 Win=11911 Len=0"
"1.963082","172.19.0.3","5.9.29.183","TLSv1.2","599","Application Data"
"1.963388","5.9.29.183","172.19.0.3","TCP","56","9002 → 43520 [ACK] Seq=2144 Ack=3172 Win=65535 Len=0"
"2.866110","5.9.29.183","172.19.0.3","TLSv1.2","599","Application Data"
"2.866865","172.19.0.3","5.9.29.183","TLSv1.2","599","Application Data"
"2.867253","5.9.29.183","172.19.0.3","TCP","56","9002 → 43520 [ACK] Seq=2687 Ack=3715 Win=65535 Len=0"
"3.594008","5.9.29.183","172.19.0.3","TLSv1.2","599","Application Data"
"3.634840","172.19.0.3","5.9.29.183","TCP","56","43520 → 9002 [ACK] Seq=3715 Ack=3230 Win=11911 Len=0"
"3.753461","5.9.29.183","172.19.0.3","TCP","1516","[TCP segment of a reassembled PDU]"
"3.753499","172.19.0.3","5.9.29.183","TCP","56","43520 → 9002 [ACK] Seq=3715 Ack=4690 Win=11911 Len=0"
"3.753546","5.9.29.183","172.19.0.3","TCP","1516","9002 → 43520 [PSH, ACK] Seq=4690 Ack=3715 Win=65535 Len=1460 [TCP segment of a reassembled PDU]"
"3.753563","172.19.0.3","5.9.29.183","TCP","56","43520 → 9002 [ACK] Seq=3715 Ack=6150 Win=11903 Len=0"
"3.753565","5.9.29.183","172.19.0.3","TLSv1.2","763","Application Data"
"3.753571","172.19.0.3","5.9.29.183","TCP","56","43520 → 9002 [ACK] Seq=3715 Ack=6857 Win=11898 Len=0"
"3.859308","5.9.29.183","172.19.0.3","TCP","1504","[TCP segment of a reassembled PDU]"
"3.859330","172.19.0.3","5.9.29.183","TCP","56","43520 → 9002 [ACK] Seq=3715 Ack=8305 Win=11911 Len=0"
"3.859383","5.9.29.183","172.19.0.3","TCP","1516","9002 → 43520 [PSH, ACK] Seq=8305 Ack=3715 Win=65535 Len=1460 [TCP segment of a reassembled PDU]"
"3.859395","172.19.0.3","5.9.29.183","TCP","56","43520 → 9002 [ACK] Seq=3715 Ack=9765 Win=11903 Len=0"
"3.859398","5.9.29.183","172.19.0.3","TLSv1.2","775","Application Data"
"3.859404","172.19.0.3","5.9.29.183","TCP","56","43520 → 9002 [ACK] Seq=3715 Ack=10484 Win=11898 Len=0"
"3.914186","5.9.29.183","172.19.0.3","TLSv1.2","599","Application Data"
"3.914210","172.19.0.3","5.9.29.183","TCP","56","43520 → 9002 [ACK] Seq=3715 Ack=11027 Win=11911 Len=0"
"3.953102","5.9.29.183","172.19.0.3","TCP","1516","[TCP segment of a reassembled PDU]"
"3.953128","172.19.0.3","5.9.29.183","TCP","56","43520 → 9002 [ACK] Seq=3715 Ack=12487 Win=11911 Len=0"
"3.953188","5.9.29.183","172.19.0.3","TCP","1516","9002 → 43520 [PSH, ACK] Seq=12487 Ack=3715 Win=65535 Len=1460 [TCP segment of a reassembled PDU]"
"3.953205","172.19.0.3","5.9.29.183","TCP","56","43520 → 9002 [ACK] Seq=3715 Ack=13947 Win=11903 Len=0"
"3.953208","5.9.29.183","172.19.0.3","TLSv1.2","763","Application Data"
"3.953214","172.19.0.3","5.9.29.183","TCP","56","43520 → 9002 [ACK] Seq=3715 Ack=14654 Win=11898 Len=0"
"3.974171","5.9.29.183","172.19.0.3","TCP","1516","[TCP segment of a reassembled PDU]"
"3.974195","172.19.0.3","5.9.29.183","TCP","56","43520 → 9002 [ACK] Seq=3715 Ack=16114 Win=11911 Len=0"
"3.974246","5.9.29.183","172.19.0.3","TCP","1516","9002 → 43520 [PSH, ACK] Seq=16114 Ack=3715 Win=65535 Len=1460 [TCP segment of a reassembled PDU]"
"3.974258","172.19.0.3","5.9.29.183","TCP","56","43520 → 9002 [ACK] Seq=3715 Ack=17574 Win=11903 Len=0"
"3.974261","5.9.29.183","172.19.0.3","TLSv1.2","763","Application Data"
"3.974267","172.19.0.3","5.9.29.183","TCP","56","43520 → 9002 [ACK] Seq=3715 Ack=18281 Win=11898 Len=0"
"3.987210","5.9.29.183","172.19.0.3","TCP","1504","[TCP segment of a reassembled PDU]"
"3.987236","172.19.0.3","5.9.29.183","TCP","56","43520 → 9002 [ACK] Seq=3715 Ack=19729 Win=11911 Len=0"
"3.989574","5.9.29.183","172.19.0.3","TLSv1.2","179","Application Data"
"3.989597","172.19.0.3","5.9.29.183","TCP","56","43520 → 9002 [ACK] Seq=3715 Ack=19852 Win=11911 Len=0"
"4.533486","5.9.29.183","172.19.0.3","TCP","1516","[TCP segment of a reassembled PDU]"
"4.533510","172.19.0.3","5.9.29.183","TCP","56","43520 → 9002 [ACK] Seq=3715 Ack=21312 Win=11911 Len=0"
"4.533561","5.9.29.183","172.19.0.3","TCP","1492","9002 → 43520 [PSH, ACK] Seq=21312 Ack=3715 Win=65535 Len=1436 [TCP segment of a reassembled PDU]"
"4.533577","172.19.0.3","5.9.29.183","TCP","56","43520 → 9002 [ACK] Seq=3715 Ack=22748 Win=11903 Len=0"
"4.533579","5.9.29.183","172.19.0.3","TLSv1.2","787","Application Data"
"4.533585","172.19.0.3","5.9.29.183","TCP","56","43520 → 9002 [ACK] Seq=3715 Ack=23479 Win=11898 Len=0"
"4.664715","5.9.29.183","172.19.0.3","TCP","1516","[TCP segment of a reassembled PDU]"
"4.664740","172.19.0.3","5.9.29.183","TCP","56","43520 → 9002 [ACK] Seq=3715 Ack=24939 Win=11911 Len=0"
"4.664803","5.9.29.183","172.19.0.3","TCP","1516","9002 → 43520 [PSH, ACK] Seq=24939 Ack=3715 Win=65535 Len=1460 [TCP segment of a reassembled PDU]"
"4.664822","172.19.0.3","5.9.29.183","TCP","56","43520 → 9002 [ACK] Seq=3715 Ack=26399 Win=11903 Len=0"
"4.664828","5.9.29.183","172.19.0.3","TLSv1.2","763","Application Data"
"4.664837","172.19.0.3","5.9.29.183","TCP","56","43520 → 9002 [ACK] Seq=3715 Ack=27106 Win=11898 Len=0"
"4.728873","5.9.29.183","172.19.0.3","TCP","1516","[TCP segment of a reassembled PDU]"
"4.728896","172.19.0.3","5.9.29.183","TCP","56","43520 → 9002 [ACK] Seq=3715 Ack=28566 Win=11911 Len=0"
"4.728950","5.9.29.183","172.19.0.3","TCP","1492","9002 → 43520 [PSH, ACK] Seq=28566 Ack=3715 Win=65535 Len=1436 [TCP segment of a reassembled PDU]"
"4.728962","172.19.0.3","5.9.29.183","TCP","56","43520 → 9002 [ACK] Seq=3715 Ack=30002 Win=11903 Len=0"
"4.728965","5.9.29.183","172.19.0.3","TLSv1.2","787","Application Data"
"4.728971","172.19.0.3","5.9.29.183","TCP","56","43520 → 9002 [ACK] Seq=3715 Ack=30733 Win=11898 Len=0"
"4.729425","172.19.0.3","5.9.29.183","TLSv1.2","599","Application Data"
"4.729713","5.9.29.183","172.19.0.3","TCP","56","9002 → 43520 [ACK] Seq=30733 Ack=4258 Win=65535 Len=0"
"4.762762","5.9.29.183","172.19.0.3","TLSv1.2","599","Application Data"
"4.793837","5.9.29.183","172.19.0.3","TCP","1504","[TCP segment of a reassembled PDU]"
"4.793868","172.19.0.3","5.9.29.183","TCP","56","43520 → 9002 [ACK] Seq=4258 Ack=32724 Win=11911 Len=0"
"4.794073","5.9.29.183","172.19.0.3","TCP","1504","9002 → 43520 [PSH, ACK] Seq=32724 Ack=4258 Win=65535 Len=1448 [TCP segment of a reassembled PDU]"
"4.794133","5.9.29.183","172.19.0.3","TLSv1.2","273","Application Data"
"4.794159","172.19.0.3","5.9.29.183","TCP","56","43520 → 9002 [ACK] Seq=4258 Ack=34389 Win=11911 Len=0"
"4.878020","5.9.29.183","172.19.0.3","TCP","1504","[TCP segment of a reassembled PDU]"
"4.878105","5.9.29.183","172.19.0.3","TCP","1516","9002 → 43520 [PSH, ACK] Seq=35837 Ack=4258 Win=65535 Len=1460 [TCP segment of a reassembled PDU]"
"4.878116","5.9.29.183","172.19.0.3","TLSv1.2","775","Application Data"
"4.878206","172.19.0.3","5.9.29.183","TCP","56","43520 → 9002 [ACK] Seq=4258 Ack=38016 Win=11895 Len=0"
"4.955957","5.9.29.183","172.19.0.3","TCP","1516","[TCP segment of a reassembled PDU]"
"4.956062","5.9.29.183","172.19.0.3","TCP","1516","9002 → 43520 [PSH, ACK] Seq=39476 Ack=4258 Win=65535 Len=1460 [TCP segment of a reassembled PDU]"
"4.956089","172.19.0.3","5.9.29.183","TCP","56","43520 → 9002 [ACK] Seq=4258 Ack=40936 Win=11901 Len=0"
"4.956093","5.9.29.183","172.19.0.3","TLSv1.2","763","Application Data"
"4.997710","172.19.0.3","5.9.29.183","TCP","56","43520 → 9002 [ACK] Seq=4258 Ack=41643 Win=11911 Len=0"
"5.016792","5.9.29.183","172.19.0.3","TLSv1.2","599","Application Data"
"5.016815","172.19.0.3","5.9.29.183","TCP","56","43520 → 9002 [ACK] Seq=4258 Ack=42186 Win=11911 Len=0"
"5.090772","5.9.29.183","172.19.0.3","TCP","1516","[TCP segment of a reassembled PDU]"
"5.090842","5.9.29.183","172.19.0.3","TCP","1516","9002 → 43520 [PSH, ACK] Seq=43646 Ack=4258 Win=65535 Len=1460 [TCP segment of a reassembled PDU]"
"5.090854","5.9.29.183","172.19.0.3","TLSv1.2","763","Application Data"
"5.091001","172.19.0.3","5.9.29.183","TCP","56","43520 → 9002 [ACK] Seq=4258 Ack=45813 Win=11895 Len=0"
"5.091289","172.19.0.3","5.9.29.183","TLSv1.2","599","Application Data"
"5.091666","5.9.29.183","172.19.0.3","TCP","56","9002 → 43520 [ACK] Seq=45813 Ack=4801 Win=65535 Len=0"
"5.157790","5.9.29.183","172.19.0.3","TCP","1516","[TCP segment of a reassembled PDU]"
"5.157868","5.9.29.183","172.19.0.3","TLSv1.2","167","Application Data"
"5.158038","172.19.0.3","5.9.29.183","TCP","56","43520 → 9002 [ACK] Seq=4801 Ack=47384 Win=11903 Len=0"
"5.263548","5.9.29.183","172.19.0.3","TCP","1516","[TCP segment of a reassembled PDU]"
"5.263657","5.9.29.183","172.19.0.3","TCP","248","9002 → 43520 [PSH, ACK] Seq=48844 Ack=4801 Win=65535 Len=192 [TCP segment of a reassembled PDU]"
"5.263680","172.19.0.3","5.9.29.183","TCP","56","43520 → 9002 [ACK] Seq=4801 Ack=49036 Win=11903 Len=0"
"5.263763","5.9.29.183","172.19.0.3","TCP","1516","9002 → 43520 [PSH, ACK] Seq=49036 Ack=4801 Win=65535 Len=1460 [TCP segment of a reassembled PDU]"
"5.263772","5.9.29.183","172.19.0.3","TLSv1.2","571","Application Data"
"5.263815","172.19.0.3","5.9.29.183","TCP","56","43520 → 9002 [ACK] Seq=4801 Ack=51011 Win=11888 Len=0"
"5.346397","5.9.29.183","172.19.0.3","TCP","1516","[TCP segment of a reassembled PDU]"
"5.346497","5.9.29.183","172.19.0.3","TCP","1516","9002 → 43520 [PSH, ACK] Seq=52471 Ack=4801 Win=65535 Len=1460 [TCP segment of a reassembled PDU]"
"5.346523","172.19.0.3","5.9.29.183","TCP","56","43520 → 9002 [ACK] Seq=4801 Ack=53931 Win=11903 Len=0"
"5.346525","5.9.29.183","172.19.0.3","TLSv1.2","763","Application Data"
"5.346848","172.19.0.3","5.9.29.183","TLSv1.2","599","Application Data"
"5.347157","5.9.29.183","172.19.0.3","TCP","56","9002 → 43520 [ACK] Seq=54638 Ack=5344 Win=65535 Len=0"
"5.418116","5.9.29.183","172.19.0.3","TLSv1.2","599","Application Data"
"5.459064","172.19.0.3","5.9.29.183","TCP","56","43520 → 9002 [ACK] Seq=5344 Ack=55181 Win=11911 Len=0"
"5.495822","5.9.29.183","172.19.0.3","TCP","1516","[TCP segment of a reassembled PDU]"
"5.495894","5.9.29.183","172.19.0.3","TCP","1516","9002 → 43520 [PSH, ACK] Seq=56641 Ack=5344 Win=65535 Len=1460 [TCP segment of a reassembled PDU]"
"5.495909","5.9.29.183","172.19.0.3","TLSv1.2","763","Application Data"
"5.496090","172.19.0.3","5.9.29.183","TCP","56","43520 → 9002 [ACK] Seq=5344 Ack=58808 Win=11893 Len=0"
"5.545480","5.9.29.183","172.19.0.3","TCP","1516","[TCP segment of a reassembled PDU]"
"5.545552","5.9.29.183","172.19.0.3","TCP","1516","9002 → 43520 [PSH, ACK] Seq=60268 Ack=5344 Win=65535 Len=1460 [TCP segment of a reassembled PDU]"
"5.545573","172.19.0.3","5.9.29.183","TCP","56","43520 → 9002 [ACK] Seq=5344 Ack=61728 Win=11903 Len=0"
"5.545575","5.9.29.183","172.19.0.3","TLSv1.2","763","Application Data"
"5.545714","172.19.0.3","5.9.29.183","TCP","56","43520 → 9002 [ACK] Seq=5344 Ack=62435 Win=11911 Len=0"
"5.587550","5.9.29.183","172.19.0.3","TLSv1.2","599","Application Data"
"5.587829","172.19.0.3","5.9.29.183","TCP","56","43520 → 9002 [ACK] Seq=5344 Ack=62978 Win=11911 Len=0"
"5.612717","5.9.29.183","172.19.0.3","TCP","1516","[TCP segment of a reassembled PDU]"
"5.612792","5.9.29.183","172.19.0.3","TCP","1516","9002 → 43520 [PSH, ACK] Seq=64438 Ack=5344 Win=65535 Len=1460 [TCP segment of a reassembled PDU]"
"5.612808","5.9.29.183","172.19.0.3","TLSv1.2","763","Application Data"
"5.612967","172.19.0.3","5.9.29.183","TCP","56","43520 → 9002 [ACK] Seq=5344 Ack=66605 Win=11895 Len=0"
"5.626129","5.9.29.183","172.19.0.3","TCP","1516","[TCP segment of a reassembled PDU]"
"5.626204","5.9.29.183","172.19.0.3","TCP","1492","9002 → 43520 [PSH, ACK] Seq=68065 Ack=5344 Win=65535 Len=1436 [TCP segment of a reassembled PDU]"
"5.626227","172.19.0.3","5.9.29.183","TCP","56","43520 → 9002 [ACK] Seq=5344 Ack=69501 Win=11903 Len=0"
"5.628233","5.9.29.183","172.19.0.3","TLSv1.2","1330","Application Data, Application Data"
"5.628617","172.19.0.3","5.9.29.183","TCP","56","43520 → 9002 [ACK] Seq=5344 Ack=70775 Win=11911 Len=0"
"5.668457","5.9.29.183","172.19.0.3","TCP","1516","[TCP segment of a reassembled PDU]"
"5.668555","5.9.29.183","172.19.0.3","TCP","1516","9002 → 43520 [PSH, ACK] Seq=72235 Ack=5344 Win=65535 Len=1460 [TCP segment of a reassembled PDU]"
"5.668576","5.9.29.183","172.19.0.3","TLSv1.2","763","Application Data"
"5.668766","172.19.0.3","5.9.29.183","TCP","56","43520 → 9002 [ACK] Seq=5344 Ack=74402 Win=11895 Len=0"
"5.729229","5.9.29.183","172.19.0.3","TCP","1516","[TCP segment of a reassembled PDU]"
"5.729280","5.9.29.183","172.19.0.3","TCP","1516","9002 → 43520 [PSH, ACK] Seq=75862 Ack=5344 Win=65535 Len=1460 [TCP segment of a reassembled PDU]"
"5.729297","172.19.0.3","5.9.29.183","TCP","56","43520 → 9002 [ACK] Seq=5344 Ack=77322 Win=11903 Len=0"
"5.729299","5.9.29.183","172.19.0.3","TLSv1.2","1213","Application Data"
"5.729425","172.19.0.3","5.9.29.183","TCP","56","43520 → 9002 [ACK] Seq=5344 Ack=78479 Win=11911 Len=0"
"5.744444","5.9.29.183","172.19.0.3","TLSv1.2","149","Application Data"
"5.744619","172.19.0.3","5.9.29.183","TCP","56","43520 → 9002 [ACK] Seq=5344 Ack=78572 Win=11911 Len=0"
"5.744634","5.9.29.183","172.19.0.3","TCP","1504","[TCP segment of a reassembled PDU]"
"5.744738","172.19.0.3","5.9.29.183","TCP","56","43520 → 9002 [ACK] Seq=5344 Ack=80020 Win=11911 Len=0"
"5.759736","5.9.29.183","172.19.0.3","TLSv1.2","1207","Application Data"
"5.759941","172.19.0.3","5.9.29.183","TCP","56","43520 → 9002 [ACK] Seq=5344 Ack=81171 Win=11911 Len=0"
"5.760238","172.19.0.3","5.9.29.183","TLSv1.2","599","Application Data"
"5.760403","5.9.29.183","172.19.0.3","TCP","56","9002 → 43520 [ACK] Seq=81171 Ack=5887 Win=65535 Len=0"
"5.770265","172.19.0.3","5.9.29.183","TLSv1.2","599","Application Data"
"5.770513","5.9.29.183","172.19.0.3","TCP","56","9002 → 43520 [ACK] Seq=81171 Ack=6430 Win=65535 Len=0"
"6.411681","02:42:7b:11:31:3d","","ARP","44","Who has 172.19.0.3? Tell 172.19.0.1"
"6.411705","02:42:ac:13:00:03","","ARP","44","172.19.0.3 is at 02:42:ac:13:00:03"
"6.816887","5.9.29.183","172.19.0.3","TLSv1.2","599","Application Data"
"6.817869","172.19.0.3","5.9.29.183","TLSv1.2","599","Application Data"
"6.818300","5.9.29.183","172.19.0.3","TCP","56","9002 → 43520 [ACK] Seq=81714 Ack=6973 Win=65535 Len=0"
"7.480837","5.9.29.183","172.19.0.3","TCP","1516","[TCP segment of a reassembled PDU]"
"7.480901","5.9.29.183","172.19.0.3","TCP","1492","9002 → 43520 [PSH, ACK] Seq=83174 Ack=6973 Win=65535 Len=1436 [TCP segment of a reassembled PDU]"
"7.480911","5.9.29.183","172.19.0.3","TLSv1.2","787","Application Data"
"7.481007","172.19.0.3","5.9.29.183","TCP","56","43520 → 9002 [ACK] Seq=6973 Ack=85341 Win=11895 Len=0"
"7.496382","5.9.29.183","172.19.0.3","TLSv1.2","599","Application Data"
"7.539699","172.19.0.3","5.9.29.183","TCP","56","43520 → 9002 [ACK] Seq=6973 Ack=85884 Win=11911 Len=0"
"7.619345","5.9.29.183","172.19.0.3","TCP","1516","[TCP segment of a reassembled PDU]"
"7.619368","172.19.0.3","5.9.29.183","TCP","56","43520 → 9002 [ACK] Seq=6973 Ack=87344 Win=11911 Len=0"
"7.619412","5.9.29.183","172.19.0.3","TCP","1492","9002 → 43520 [PSH, ACK] Seq=87344 Ack=6973 Win=65535 Len=1436 [TCP segment of a reassembled PDU]"
"7.619429","172.19.0.3","5.9.29.183","TCP","56","43520 → 9002 [ACK] Seq=6973 Ack=88780 Win=11903 Len=0"
"7.619430","5.9.29.183","172.19.0.3","TLSv1.2","787","Application Data"
"7.619436","172.19.0.3","5.9.29.183","TCP","56","43520 → 9002 [ACK] Seq=6973 Ack=89511 Win=11898 Len=0"
"7.652252","5.9.29.183","172.19.0.3","TCP","1516","[TCP segment of a reassembled PDU]"
"7.652276","172.19.0.3","5.9.29.183","TCP","56","43520 → 9002 [ACK] Seq=6973 Ack=90971 Win=11911 Len=0"
"7.652337","5.9.29.183","172.19.0.3","TCP","1516","9002 → 43520 [PSH, ACK] Seq=90971 Ack=6973 Win=65535 Len=1460 [TCP segment of a reassembled PDU]"
"7.652356","172.19.0.3","5.9.29.183","TCP","56","43520 → 9002 [ACK] Seq=6973 Ack=92431 Win=11903 Len=0"
"7.652360","5.9.29.183","172.19.0.3","TLSv1.2","763","Application Data"
"7.652366","172.19.0.3","5.9.29.183","TCP","56","43520 → 9002 [ACK] Seq=6973 Ack=93138 Win=11898 Len=0"
"7.691969","5.9.29.183","172.19.0.3","TCP","1516","[TCP segment of a reassembled PDU]"
"7.691994","172.19.0.3","5.9.29.183","TCP","56","43520 → 9002 [ACK] Seq=6973 Ack=94598 Win=11911 Len=0"
"7.692057","5.9.29.183","172.19.0.3","TCP","1516","9002 → 43520 [PSH, ACK] Seq=94598 Ack=6973 Win=65535 Len=1460 [TCP segment of a reassembled PDU]"
"7.692075","172.19.0.3","5.9.29.183","TCP","56","43520 → 9002 [ACK] Seq=6973 Ack=96058 Win=11903 Len=0"
"7.692079","5.9.29.183","172.19.0.3","TLSv1.2","763","Application Data"
"7.692086","172.19.0.3","5.9.29.183","TCP","56","43520 → 9002 [ACK] Seq=6973 Ack=96765 Win=11898 Len=0"
"7.692545","172.19.0.3","5.9.29.183","TLSv1.2","599","Application Data"
"7.692896","5.9.29.183","172.19.0.3","TCP","56","9002 → 43520 [ACK] Seq=96765 Ack=7516 Win=65535 Len=0"
"7.707348","5.9.29.183","172.19.0.3","TLSv1.2","1113","Application Data"
"7.742285","5.9.29.183","172.19.0.3","TCP","1516","[TCP segment of a reassembled PDU]"
"7.742307","172.19.0.3","5.9.29.183","TCP","56","43520 → 9002 [ACK] Seq=7516 Ack=99282 Win=11911 Len=0"
"7.742355","5.9.29.183","172.19.0.3","TCP","1492","9002 → 43520 [PSH, ACK] Seq=99282 Ack=7516 Win=65535 Len=1436 [TCP segment of a reassembled PDU]"
"7.742399","5.9.29.183","172.19.0.3","TLSv1.2","787","Application Data"
"7.742531","172.19.0.3","5.9.29.183","TCP","56","43520 → 9002 [ACK] Seq=7516 Ack=101449 Win=11895 Len=0"
"7.772991","5.9.29.183","172.19.0.3","TLSv1.2","1113","Application Data"
"7.813638","172.19.0.3","5.9.29.183","TCP","56","43520 → 9002 [ACK] Seq=7516 Ack=102506 Win=11911 Len=0"
"7.832620","5.9.29.183","172.19.0.3","TCP","1516","[TCP segment of a reassembled PDU]"
"7.832645","172.19.0.3","5.9.29.183","TCP","56","43520 → 9002 [ACK] Seq=7516 Ack=103966 Win=11911 Len=0"
"7.832706","5.9.29.183","172.19.0.3","TCP","1516","9002 → 43520 [PSH, ACK] Seq=103966 Ack=7516 Win=65535 Len=1460 [TCP segment of a reassembled PDU]"
"7.832759","5.9.29.183","172.19.0.3","TLSv1.2","763","Application Data"
"7.832970","172.19.0.3","5.9.29.183","TCP","56","43520 → 9002 [ACK] Seq=7516 Ack=106133 Win=11895 Len=0"
"7.844717","5.9.29.183","172.19.0.3","TCP","1516","[TCP segment of a reassembled PDU]"
"7.844799","5.9.29.183","172.19.0.3","TCP","1492","9002 → 43520 [PSH, ACK] Seq=107593 Ack=7516 Win=65535 Len=1436 [TCP segment of a reassembled PDU]"
"7.844823","172.19.0.3","5.9.29.183","TCP","56","43520 → 9002 [ACK] Seq=7516 Ack=109029 Win=11903 Len=0"
"7.848158","5.9.29.183","172.19.0.3","TLSv1.2","787","Application Data"
"7.848369","172.19.0.3","5.9.29.183","TCP","56","43520 → 9002 [ACK] Seq=7516 Ack=109760 Win=11911 Len=0"
"7.848652","172.19.0.3","5.9.29.183","TLSv1.2","599","Application Data"
"7.848986","5.9.29.183","172.19.0.3","TCP","56","9002 → 43520 [ACK] Seq=109760 Ack=8059 Win=65535 Len=0"
"7.916844","5.9.29.183","172.19.0.3","TLSv1.2","1113","Application Data"
"7.955759","5.9.29.183","172.19.0.3","TCP","1504","[TCP segment of a reassembled PDU]"
"7.955784","172.19.0.3","5.9.29.183","TCP","56","43520 → 9002 [ACK] Seq=8059 Ack=112265 Win=11911 Len=0"
"7.956182","5.9.29.183","172.19.0.3","TCP","1516","9002 → 43520 [PSH, ACK] Seq=112265 Ack=8059 Win=65535 Len=1460 [TCP segment of a reassembled PDU]"
"7.956222","5.9.29.183","172.19.0.3","TCP","903","9002 → 43520 [PSH, ACK] Seq=113725 Ack=8059 Win=65535 Len=847 [TCP segment of a reassembled PDU]"
"7.956231","5.9.29.183","172.19.0.3","TLSv1.2","378","Application Data"
"7.956340","172.19.0.3","5.9.29.183","TCP","56","43520 → 9002 [ACK] Seq=8059 Ack=114894 Win=11911 Len=0"
"7.971653","5.9.29.183","172.19.0.3","TLSv1.2","149","Application Data"
"7.993201","5.9.29.183","172.19.0.3","TCP","1504","[TCP segment of a reassembled PDU]"
"7.993221","172.19.0.3","5.9.29.183","TCP","56","43520 → 9002 [ACK] Seq=8059 Ack=116435 Win=11911 Len=0"
"7.993480","5.9.29.183","172.19.0.3","TCP","1504","9002 → 43520 [PSH, ACK] Seq=116435 Ack=8059 Win=65535 Len=1448 [TCP segment of a reassembled PDU]"
"7.993500","5.9.29.183","172.19.0.3","TLSv1.2","1237","Application Data"
"7.993567","172.19.0.3","5.9.29.183","TCP","56","43520 → 9002 [ACK] Seq=8059 Ack=119064 Win=11911 Len=0"
"8.009215","5.9.29.183","172.19.0.3","TLSv1.2","149","Application Data"
"8.049402","172.19.0.3","5.9.29.183","TCP","56","43520 → 9002 [ACK] Seq=8059 Ack=119157 Win=11911 Len=0"
"8.083482","5.9.29.183","172.19.0.3","TCP","1516","[TCP segment of a reassembled PDU]"
"8.083593","5.9.29.183","172.19.0.3","TCP","1516","9002 → 43520 [PSH, ACK] Seq=120617 Ack=8059 Win=65535 Len=1460 [TCP segment of a reassembled PDU]"
"8.083614","5.9.29.183","172.19.0.3","TLSv1.2","763","Application Data"
"8.083767","172.19.0.3","5.9.29.183","TCP","56","43520 → 9002 [ACK] Seq=8059 Ack=122784 Win=11895 Len=0"
"8.170119","5.9.29.183","172.19.0.3","TCP","1516","[TCP segment of a reassembled PDU]"
"8.170197","5.9.29.183","172.19.0.3","TCP","1516","9002 → 43520 [PSH, ACK] Seq=124244 Ack=8059 Win=65535 Len=1460 [TCP segment of a reassembled PDU]"
"8.170226","172.19.0.3","5.9.29.183","TCP","56","43520 → 9002 [ACK] Seq=8059 Ack=125704 Win=11901 Len=0"
"8.170229","5.9.29.183","172.19.0.3","TLSv1.2","763","Application Data"
"8.170363","172.19.0.3","5.9.29.183","TCP","56","43520 → 9002 [ACK] Seq=8059 Ack=126411 Win=11911 Len=0"
"8.293582","5.9.29.183","172.19.0.3","TCP","1516","[TCP segment of a reassembled PDU]"
"8.293648","5.9.29.183","172.19.0.3","TCP","1492","9002 → 43520 [PSH, ACK] Seq=127871 Ack=8059 Win=65535 Len=1436 [TCP segment of a reassembled PDU]"
"8.293660","5.9.29.183","172.19.0.3","TLSv1.2","1237","Application Data"
"8.293865","172.19.0.3","5.9.29.183","TCP","56","43520 → 9002 [ACK] Seq=8059 Ack=130488 Win=11895 Len=0"
"8.309239","5.9.29.183","172.19.0.3","TLSv1.2","149","Application Data"
"8.309534","172.19.0.3","5.9.29.183","TCP","56","43520 → 9002 [ACK] Seq=8059 Ack=130581 Win=11911 Len=0"
"8.329642","5.9.29.183","172.19.0.3","TCP","1504","[TCP segment of a reassembled PDU]"
"8.329914","172.19.0.3","5.9.29.183","TCP","56","43520 → 9002 [ACK] Seq=8059 Ack=132029 Win=11911 Len=0"
"8.330135","5.9.29.183","172.19.0.3","TCP","1504","9002 → 43520 [PSH, ACK] Seq=132029 Ack=8059 Win=65535 Len=1448 [TCP segment of a reassembled PDU]"
"8.330250","5.9.29.183","172.19.0.3","TLSv1.2","1237","Application Data"
"8.330321","172.19.0.3","5.9.29.183","TCP","56","43520 → 9002 [ACK] Seq=8059 Ack=134658 Win=11911 Len=0"
"8.330571","172.19.0.3","5.9.29.183","TLSv1.2","599","Application Data"
"8.330834","5.9.29.183","172.19.0.3","TCP","56","9002 → 43520 [ACK] Seq=134658 Ack=8602 Win=65535 Len=0"
"8.345889","5.9.29.183","172.19.0.3","TLSv1.2","149","Application Data"
"8.366412","5.9.29.183","172.19.0.3","TLSv1.2","1113","Application Data"
"8.366625","172.19.0.3","5.9.29.183","TCP","56","43520 → 9002 [ACK] Seq=8602 Ack=135808 Win=11911 Len=0"
"8.441582","5.9.29.183","172.19.0.3","TCP","1516","[TCP segment of a reassembled PDU]"
"8.441658","5.9.29.183","172.19.0.3","TCP","1516","9002 → 43520 [PSH, ACK] Seq=137268 Ack=8602 Win=65535 Len=1460 [TCP segment of a reassembled PDU]"
"8.441672","5.9.29.183","172.19.0.3","TLSv1.2","763","Application Data"
"8.441855","172.19.0.3","5.9.29.183","TCP","56","43520 → 9002 [ACK] Seq=8602 Ack=139435 Win=11895 Len=0"
"8.504664","5.9.29.183","172.19.0.3","TCP","1504","[TCP segment of a reassembled PDU]"
"8.504987","5.9.29.183","172.19.0.3","TCP","1504","9002 → 43520 [PSH, ACK] Seq=140883 Ack=8602 Win=65535 Len=1448 [TCP segment of a reassembled PDU]"
"8.505025","172.19.0.3","5.9.29.183","TCP","56","43520 → 9002 [ACK] Seq=8602 Ack=142331 Win=11911 Len=0"
"8.505109","5.9.29.183","172.19.0.3","TLSv1.2","787","Application Data"
"8.546138","172.19.0.3","5.9.29.183","TCP","56","43520 → 9002 [ACK] Seq=8602 Ack=143062 Win=11911 Len=0"
"8.570017","5.9.29.183","172.19.0.3","TCP","1516","[TCP segment of a reassembled PDU]"
"8.570136","5.9.29.183","172.19.0.3","TCP","1516","9002 → 43520 [PSH, ACK] Seq=144522 Ack=8602 Win=65535 Len=1460 [TCP segment of a reassembled PDU]"
"8.570154","5.9.29.183","172.19.0.3","TLSv1.2","1213","Application Data"
"8.570381","172.19.0.3","5.9.29.183","TCP","56","43520 → 9002 [ACK] Seq=8602 Ack=147139 Win=11893 Len=0"
"8.585438","5.9.29.183","172.19.0.3","TLSv1.2","149","Application Data"
"8.585710","172.19.0.3","5.9.29.183","TCP","56","43520 → 9002 [ACK] Seq=8602 Ack=147232 Win=11911 Len=0"
"8.596463","5.9.29.183","172.19.0.3","TCP","1516","[TCP segment of a reassembled PDU]"
"8.596539","5.9.29.183","172.19.0.3","TCP","1516","9002 → 43520 [PSH, ACK] Seq=148692 Ack=8602 Win=65535 Len=1460 [TCP segment of a reassembled PDU]"
"8.596550","5.9.29.183","172.19.0.3","TLSv1.2","1516","Application Data [TCP segment of a reassembled PDU]"
"8.596554","5.9.29.183","172.19.0.3","TCP","1468","9002 → 43520 [PSH, ACK] Seq=151612 Ack=8602 Win=65535 Len=1412 [TCP segment of a reassembled PDU]"
"8.596581","5.9.29.183","172.19.0.3","TCP","1504","9002 → 43520 [PSH, ACK] Seq=153024 Ack=8602 Win=65535 Len=1448 [TCP segment of a reassembled PDU]"
"8.596739","172.19.0.3","5.9.29.183","TCP","56","43520 → 9002 [ACK] Seq=8602 Ack=154472 Win=11879 Len=0"
"8.597055","172.19.0.3","5.9.29.183","TLSv1.2","599","Application Data"
"8.597323","5.9.29.183","172.19.0.3","TCP","56","9002 → 43520 [ACK] Seq=154472 Ack=9145 Win=65535 Len=0"
"8.600529","5.9.29.183","172.19.0.3","TLSv1.2","584","Application Data"
"8.640285","5.9.29.183","172.19.0.3","TLSv1.2","1113","Application Data"
"8.640309","172.19.0.3","5.9.29.183","TCP","56","43520 → 9002 [ACK] Seq=9145 Ack=156057 Win=11911 Len=0"
"8.705074","5.9.29.183","172.19.0.3","TCP","1504","[TCP segment of a reassembled PDU]"
"8.705638","5.9.29.183","172.19.0.3","TCP","1504","9002 → 43520 [PSH, ACK] Seq=157505 Ack=9145 Win=65535 Len=1448 [TCP segment of a reassembled PDU]"
"8.705655","172.19.0.3","5.9.29.183","TCP","56","43520 → 9002 [ACK] Seq=9145 Ack=158953 Win=11911 Len=0"
"8.705698","5.9.29.183","172.19.0.3","TLSv1.2","787","Application Data"
"8.711053","172.19.0.3","5.9.29.183","TLSv1.2","599","Application Data"
"8.711368","5.9.29.183","172.19.0.3","TCP","56","9002 → 43520 [ACK] Seq=159684 Ack=9688 Win=65535 Len=0"
"9.324584","5.9.29.183","172.19.0.3","TLSv1.2","599","Application Data"
"9.325352","172.19.0.3","5.9.29.183","TLSv1.2","599","Application Data"
"9.325752","5.9.29.183","172.19.0.3","TCP","56","9002 → 43520 [ACK] Seq=160227 Ack=10231 Win=65535 Len=0"
"9.939110","5.9.29.183","172.19.0.3","TCP","1504","[TCP segment of a reassembled PDU]"
"9.939449","5.9.29.183","172.19.0.3","TCP","1504","9002 → 43520 [PSH, ACK] Seq=161675 Ack=10231 Win=65535 Len=1448 [TCP segment of a reassembled PDU]"
"9.939463","172.19.0.3","5.9.29.183","TCP","56","43520 → 9002 [ACK] Seq=10231 Ack=163123 Win=11911 Len=0"
"9.939758","5.9.29.183","172.19.0.3","TLSv1.2","787","Application Data"
"9.985511","172.19.0.3","5.9.29.183","TCP","56","43520 → 9002 [ACK] Seq=10231 Ack=163854 Win=11911 Len=0"
"10.014771","5.9.29.183","172.19.0.3","TCP","1516","[TCP segment of a reassembled PDU]"
"10.014789","172.19.0.3","5.9.29.183","TCP","56","43520 → 9002 [ACK] Seq=10231 Ack=165314 Win=11911 Len=0"
"10.014795","5.9.29.183","172.19.0.3","TCP","1492","9002 → 43520 [PSH, ACK] Seq=165314 Ack=10231 Win=65535 Len=1436 [TCP segment of a reassembled PDU]"
"10.014804","172.19.0.3","5.9.29.183","TCP","56","43520 → 9002 [ACK] Seq=10231 Ack=166750 Win=11903 Len=0"
"10.014805","5.9.29.183","172.19.0.3","TLSv1.2","787","Application Data"
"10.014809","172.19.0.3","5.9.29.183","TCP","56","43520 → 9002 [ACK] Seq=10231 Ack=167481 Win=11898 Len=0"
"10.068926","5.9.29.183","172.19.0.3","TCP","1516","[TCP segment of a reassembled PDU]"
"10.068952","172.19.0.3","5.9.29.183","TCP","56","43520 → 9002 [ACK] Seq=10231 Ack=168941 Win=11911 Len=0"
"10.068969","5.9.29.183","172.19.0.3","TCP","1516","9002 → 43520 [PSH, ACK] Seq=168941 Ack=10231 Win=65535 Len=1460 [TCP segment of a reassembled PDU]"
"10.068979","172.19.0.3","5.9.29.183","TCP","56","43520 → 9002 [ACK] Seq=10231 Ack=170401 Win=11903 Len=0"
"10.068982","5.9.29.183","172.19.0.3","TLSv1.2","763","Application Data"
"10.068988","172.19.0.3","5.9.29.183","TCP","56","43520 → 9002 [ACK] Seq=10231 Ack=171108 Win=11898 Len=0"
"10.084392","5.9.29.183","172.19.0.3","TLSv1.2","599","Application Data"
"10.084419","172.19.0.3","5.9.29.183","TCP","56","43520 → 9002 [ACK] Seq=10231 Ack=171651 Win=11911 Len=0"
"10.102876","5.9.29.183","172.19.0.3","TCP","1516","[TCP segment of a reassembled PDU]"
"10.102901","172.19.0.3","5.9.29.183","TCP","56","43520 → 9002 [ACK] Seq=10231 Ack=173111 Win=11911 Len=0"
"10.102918","5.9.29.183","172.19.0.3","TCP","1516","9002 → 43520 [PSH, ACK] Seq=173111 Ack=10231 Win=65535 Len=1460 [TCP segment of a reassembled PDU]"
"10.102928","172.19.0.3","5.9.29.183","TCP","56","43520 → 9002 [ACK] Seq=10231 Ack=174571 Win=11903 Len=0"
"10.102931","5.9.29.183","172.19.0.3","TLSv1.2","1213","Application Data"
"10.102937","172.19.0.3","5.9.29.183","TCP","56","43520 → 9002 [ACK] Seq=10231 Ack=175728 Win=11895 Len=0"
"10.118839","5.9.29.183","172.19.0.3","TLSv1.2","149","Application Data"
"10.118863","172.19.0.3","5.9.29.183","TCP","56","43520 → 9002 [ACK] Seq=10231 Ack=175821 Win=11911 Len=0"
"10.126297","5.9.29.183","172.19.0.3","TCP","1516","[TCP segment of a reassembled PDU]"
"10.126323","172.19.0.3","5.9.29.183","TCP","56","43520 → 9002 [ACK] Seq=10231 Ack=177281 Win=11911 Len=0"
"10.126342","5.9.29.183","172.19.0.3","TCP","1492","9002 → 43520 [PSH, ACK] Seq=177281 Ack=10231 Win=65535 Len=1436 [TCP segment of a reassembled PDU]"
"10.126355","172.19.0.3","5.9.29.183","TCP","56","43520 → 9002 [ACK] Seq=10231 Ack=178717 Win=11901 Len=0"
"10.134314","5.9.29.183","172.19.0.3","TLSv1.2","787","Application Data"
"10.134344","172.19.0.3","5.9.29.183","TCP","56","43520 → 9002 [ACK] Seq=10231 Ack=179448 Win=11911 Len=0"
"10.149610","5.9.29.183","172.19.0.3","TCP","716","[TCP segment of a reassembled PDU]"
"10.149645","5.9.29.183","172.19.0.3","TLSv1.2","453","Application Data"
"10.149793","172.19.0.3","5.9.29.183","TCP","56","43520 → 9002 [ACK] Seq=10231 Ack=180505 Win=11911 Len=0"
"10.687077","5.9.29.183","172.19.0.3","TCP","1516","[TCP segment of a reassembled PDU]"
"10.687099","172.19.0.3","5.9.29.183","TCP","56","43520 → 9002 [ACK] Seq=10231 Ack=181965 Win=11911 Len=0"
"10.687115","5.9.29.183","172.19.0.3","TCP","1492","9002 → 43520 [PSH, ACK] Seq=181965 Ack=10231 Win=65535 Len=1436 [TCP segment of a reassembled PDU]"
"10.687126","172.19.0.3","5.9.29.183","TCP","56","43520 → 9002 [ACK] Seq=10231 Ack=183401 Win=11903 Len=0"
"10.687300","5.9.29.183","172.19.0.3","TLSv1.2","787","Application Data"
"10.687310","172.19.0.3","5.9.29.183","TCP","56","43520 → 9002 [ACK] Seq=10231 Ack=184132 Win=11898 Len=0"
"10.715647","5.9.29.183","172.19.0.3","TLSv1.2","1113","Application Data"
"10.715672","172.19.0.3","5.9.29.183","TCP","56","43520 → 9002 [ACK] Seq=10231 Ack=185189 Win=11911 Len=0"
"10.719718","172.19.0.3","5.9.29.183","TLSv1.2","599","Application Data"
"10.720088","5.9.29.183","172.19.0.3","TCP","56","9002 → 43520 [ACK] Seq=185189 Ack=10774 Win=65535 Len=0"
"11.476434","5.9.29.183","172.19.0.3","TLSv1.2","599","Application Data"
"11.477163","172.19.0.3","5.9.29.183","TLSv1.2","599","Application Data"
"11.477565","5.9.29.183","172.19.0.3","TCP","56","9002 → 43520 [ACK] Seq=185732 Ack=11317 Win=65535 Len=0"
"12.089005","5.9.29.183","172.19.0.3","TLSv1.2","599","Application Data"
"12.129860","172.19.0.3","5.9.29.183","TCP","56","43520 → 9002 [ACK] Seq=11317 Ack=186275 Win=11911 Len=0"
"12.764019","5.9.29.183","172.19.0.3","TCP","1516","[TCP segment of a reassembled PDU]"
"12.764039","172.19.0.3","5.9.29.183","TCP","56","43520 → 9002 [ACK] Seq=11317 Ack=187735 Win=11911 Len=0"
"12.764052","5.9.29.183","172.19.0.3","TCP","1492","9002 → 43520 [PSH, ACK] Seq=187735 Ack=11317 Win=65535 Len=1436 [TCP segment of a reassembled PDU]"
"12.764060","172.19.0.3","5.9.29.183","TCP","56","43520 → 9002 [ACK] Seq=11317 Ack=189171 Win=11903 Len=0"
"12.764061","5.9.29.183","172.19.0.3","TLSv1.2","787","Application Data"
"12.764066","172.19.0.3","5.9.29.183","TCP","56","43520 → 9002 [ACK] Seq=11317 Ack=189902 Win=11898 Len=0"
"12.885811","5.9.29.183","172.19.0.3","TCP","1516","[TCP segment of a reassembled PDU]"
"12.885836","172.19.0.3","5.9.29.183","TCP","56","43520 → 9002 [ACK] Seq=11317 Ack=191362 Win=11911 Len=0"
"12.885854","5.9.29.183","172.19.0.3","TCP","1516","9002 → 43520 [PSH, ACK] Seq=191362 Ack=11317 Win=65535 Len=1460 [TCP segment of a reassembled PDU]"
"12.885867","172.19.0.3","5.9.29.183","TCP","56","43520 → 9002 [ACK] Seq=11317 Ack=192822 Win=11903 Len=0"
"12.885871","5.9.29.183","172.19.0.3","TLSv1.2","763","Application Data"
"12.885879","172.19.0.3","5.9.29.183","TCP","56","43520 → 9002 [ACK] Seq=11317 Ack=193529 Win=11898 Len=0"
"12.980487","5.9.29.183","172.19.0.3","TLSv1.2","599","Application Data"
"12.980540","172.19.0.3","5.9.29.183","TCP","56","43520 → 9002 [ACK] Seq=11317 Ack=194072 Win=11911 Len=0"
"13.069045","5.9.29.183","172.19.0.3","TCP","1516","[TCP segment of a reassembled PDU]"
"13.069072","172.19.0.3","5.9.29.183","TCP","56","43520 → 9002 [ACK] Seq=11317 Ack=195532 Win=11911 Len=0"
"13.069090","5.9.29.183","172.19.0.3","TCP","1516","9002 → 43520 [PSH, ACK] Seq=195532 Ack=11317 Win=65535 Len=1460 [TCP segment of a reassembled PDU]"
"13.069101","172.19.0.3","5.9.29.183","TCP","56","43520 → 9002 [ACK] Seq=11317 Ack=196992 Win=11903 Len=0"
"13.069103","5.9.29.183","172.19.0.3","TLSv1.2","249","Application Data"
"13.069109","172.19.0.3","5.9.29.183","TCP","56","43520 → 9002 [ACK] Seq=11317 Ack=197185 Win=11902 Len=0"
"13.140141","5.9.29.183","172.19.0.3","TCP","1516","[TCP segment of a reassembled PDU]"
"13.140163","172.19.0.3","5.9.29.183","TCP","56","43520 → 9002 [ACK] Seq=11317 Ack=198645 Win=11911 Len=0"
"13.140175","5.9.29.183","172.19.0.3","TLSv1.2","167","Application Data"
"13.140182","172.19.0.3","5.9.29.183","TCP","56","43520 → 9002 [ACK] Seq=11317 Ack=198756 Win=11911 Len=0"
"13.144333","172.19.0.3","5.9.29.183","TLSv1.2","599","Application Data"
"13.144580","5.9.29.183","172.19.0.3","TCP","56","9002 → 43520 [ACK] Seq=198756 Ack=11860 Win=65535 Len=0"
"13.933392","5.9.29.183","172.19.0.3","TLSv1.2","599","Application Data"
"13.934646","172.19.0.3","5.9.29.183","TLSv1.2","599","Application Data"
"13.935287","5.9.29.183","172.19.0.3","TCP","56","9002 → 43520 [ACK] Seq=199299 Ack=12403 Win=65535 Len=0"
"14.825038","5.9.29.183","172.19.0.3","TCP","1516","[TCP segment of a reassembled PDU]"
"14.825136","5.9.29.183","172.19.0.3","TCP","1516","9002 → 43520 [PSH, ACK] Seq=200759 Ack=12403 Win=65535 Len=1460 [TCP segment of a reassembled PDU]"
"14.825144","5.9.29.183","172.19.0.3","TLSv1.2","763","Application Data"
"14.825148","5.9.29.183","172.19.0.3","TLSv1.2","1516","Application Data"
"14.825151","5.9.29.183","172.19.0.3","TCP","587","9002 → 43520 [PSH, ACK] Seq=204386 Ack=12403 Win=65535 Len=531 [TCP segment of a reassembled PDU]"
"14.825344","172.19.0.3","5.9.29.183","TCP","56","43520 → 9002 [ACK] Seq=12403 Ack=204917 Win=11877 Len=0"
"14.825615","172.19.0.3","5.9.29.183","TLSv1.2","599","Application Data"
"14.825770","5.9.29.183","172.19.0.3","TCP","56","9002 → 43520 [ACK] Seq=204917 Ack=12946 Win=65535 Len=0"
"14.841498","5.9.29.183","172.19.0.3","TCP","1516","9002 → 43520 [PSH, ACK] Seq=204917 Ack=12946 Win=65535 Len=1460 [TCP segment of a reassembled PDU]"
"14.841548","5.9.29.183","172.19.0.3","TLSv1.2","1516","Application Data [TCP segment of a reassembled PDU]"
"14.841560","172.19.0.3","5.9.29.183","TCP","56","43520 → 9002 [ACK] Seq=12946 Ack=207837 Win=11903 Len=0"
"14.841561","5.9.29.183","172.19.0.3","TCP","1516","9002 → 43520 [PSH, ACK] Seq=207837 Ack=12946 Win=65535 Len=1460 [TCP segment of a reassembled PDU]"
"14.841573","5.9.29.183","172.19.0.3","TLSv1.2","454","Application Data"
"14.841670","172.19.0.3","5.9.29.183","TCP","56","43520 → 9002 [ACK] Seq=12946 Ack=209695 Win=11889 Len=0"
"14.844643","172.19.0.3","5.9.29.183","TLSv1.2","599","Application Data"
"14.844826","5.9.29.183","172.19.0.3","TCP","56","9002 → 43520 [ACK] Seq=209695 Ack=13489 Win=65535 Len=0"
"15.780416","5.9.29.183","172.19.0.3","TLSv1.2","599","Application Data"
"15.781341","172.19.0.3","5.9.29.183","TLSv1.2","599","Application Data"
"15.781835","5.9.29.183","172.19.0.3","TCP","56","9002 → 43520 [ACK] Seq=210238 Ack=14032 Win=65535 Len=0"
"16.395392","5.9.29.183","172.19.0.3","TLSv1.2","599","Application Data"
"16.424074","5.9.29.183","172.19.0.3","TCP","1516","[TCP segment of a reassembled PDU]"
"16.424093","172.19.0.3","5.9.29.183","TCP","56","43520 → 9002 [ACK] Seq=14032 Ack=212241 Win=11911 Len=0"
"16.424232","5.9.29.183","172.19.0.3","TCP","1492","9002 → 43520 [PSH, ACK] Seq=212241 Ack=14032 Win=65535 Len=1436 [TCP segment of a reassembled PDU]"
"16.424386","5.9.29.183","172.19.0.3","TLSv1.2","787","Application Data"
"16.424396","172.19.0.3","5.9.29.183","TCP","56","43520 → 9002 [ACK] Seq=14032 Ack=214408 Win=11911 Len=0"
"16.502437","5.9.29.183","172.19.0.3","TCP","1516","[TCP segment of a reassembled PDU]"
"16.502497","5.9.29.183","172.19.0.3","TCP","1516","9002 → 43520 [PSH, ACK] Seq=215868 Ack=14032 Win=65535 Len=1460 [TCP segment of a reassembled PDU]"
"16.502509","5.9.29.183","172.19.0.3","TLSv1.2","763","Application Data"
"16.502676","172.19.0.3","5.9.29.183","TCP","56","43520 → 9002 [ACK] Seq=14032 Ack=218035 Win=11895 Len=0"
"16.529794","5.9.29.183","172.19.0.3","TLSv1.2","599","Application Data"
"16.570375","172.19.0.3","5.9.29.183","TCP","56","43520 → 9002 [ACK] Seq=14032 Ack=218578 Win=11911 Len=0"
"16.577408","5.9.29.183","172.19.0.3","TCP","1516","[TCP segment of a reassembled PDU]"
"16.577419","172.19.0.3","5.9.29.183","TCP","56","43520 → 9002 [ACK] Seq=14032 Ack=220038 Win=11911 Len=0"
"16.577455","5.9.29.183","172.19.0.3","TCP","1492","9002 → 43520 [PSH, ACK] Seq=220038 Ack=14032 Win=65535 Len=1436 [TCP segment of a reassembled PDU]"
"16.577468","172.19.0.3","5.9.29.183","TCP","56","43520 → 9002 [ACK] Seq=14032 Ack=221474 Win=11903 Len=0"
"16.577469","5.9.29.183","172.19.0.3","TLSv1.2","787","Application Data"
"16.577474","172.19.0.3","5.9.29.183","TCP","56","43520 → 9002 [ACK] Seq=14032 Ack=222205 Win=11898 Len=0"
"16.602929","5.9.29.183","172.19.0.3","TLSv1.2","599","Application Data"
"16.602956","172.19.0.3","5.9.29.183","TCP","56","43520 → 9002 [ACK] Seq=14032 Ack=222748 Win=11911 Len=0"
"16.639650","5.9.29.183","172.19.0.3","TCP","1516","[TCP segment of a reassembled PDU]"
"16.639697","172.19.0.3","5.9.29.183","TCP","56","43520 → 9002 [ACK] Seq=14032 Ack=224208 Win=11909 Len=0"
"16.639755","5.9.29.183","172.19.0.3","TCP","1492","9002 → 43520 [PSH, ACK] Seq=224208 Ack=14032 Win=65535 Len=1436 [TCP segment of a reassembled PDU]"
"16.639770","172.19.0.3","5.9.29.183","TCP","56","43520 → 9002 [ACK] Seq=14032 Ack=225644 Win=11901 Len=0"
"16.639773","5.9.29.183","172.19.0.3","TLSv1.2","273","Application Data"
"16.639779","172.19.0.3","5.9.29.183","TCP","56","43520 → 9002 [ACK] Seq=14032 Ack=225861 Win=11900 Len=0"
"16.732109","5.9.29.183","172.19.0.3","TCP","1516","[TCP segment of a reassembled PDU]"
"16.732136","172.19.0.3","5.9.29.183","TCP","56","43520 → 9002 [ACK] Seq=14032 Ack=227321 Win=11911 Len=0"
"16.732199","5.9.29.183","172.19.0.3","TCP","1492","9002 → 43520 [PSH, ACK] Seq=227321 Ack=14032 Win=65535 Len=1436 [TCP segment of a reassembled PDU]"
"16.732216","172.19.0.3","5.9.29.183","TCP","56","43520 → 9002 [ACK] Seq=14032 Ack=228757 Win=11903 Len=0"
"16.732440","5.9.29.183","172.19.0.3","TLSv1.2","787","Application Data"
"16.732456","172.19.0.3","5.9.29.183","TCP","56","43520 → 9002 [ACK] Seq=14032 Ack=229488 Win=11911 Len=0"
"16.841291","5.9.29.183","172.19.0.3","TCP","1504","[TCP segment of a reassembled PDU]"
"16.841314","172.19.0.3","5.9.29.183","TCP","56","43520 → 9002 [ACK] Seq=14032 Ack=230936 Win=11911 Len=0"
"16.841367","5.9.29.183","172.19.0.3","TCP","1516","9002 → 43520 [PSH, ACK] Seq=230936 Ack=14032 Win=65535 Len=1460 [TCP segment of a reassembled PDU]"
"16.841379","172.19.0.3","5.9.29.183","TCP","56","43520 → 9002 [ACK] Seq=14032 Ack=232396 Win=11903 Len=0"
"16.841382","5.9.29.183","172.19.0.3","TLSv1.2","775","Application Data"
"16.841552","172.19.0.3","5.9.29.183","TCP","56","43520 → 9002 [ACK] Seq=14032 Ack=233115 Win=11911 Len=0"
"16.903040","5.9.29.183","172.19.0.3","TCP","1516","[TCP segment of a reassembled PDU]"
"16.903113","5.9.29.183","172.19.0.3","TCP","1516","9002 → 43520 [PSH, ACK] Seq=234575 Ack=14032 Win=65535 Len=1460 [TCP segment of a reassembled PDU]"
"16.903127","5.9.29.183","172.19.0.3","TLSv1.2","763","Application Data"
"16.903376","172.19.0.3","5.9.29.183","TCP","56","43520 → 9002 [ACK] Seq=14032 Ack=236742 Win=11895 Len=0"
"16.903653","172.19.0.3","5.9.29.183","TLSv1.2","599","Application Data"
"16.903913","5.9.29.183","172.19.0.3","TCP","56","9002 → 43520 [ACK] Seq=236742 Ack=14575 Win=65535 Len=0"
"16.938753","5.9.29.183","172.19.0.3","TCP","1516","[TCP segment of a reassembled PDU]"
"16.938824","5.9.29.183","172.19.0.3","TCP","1516","9002 → 43520 [PSH, ACK] Seq=238202 Ack=14575 Win=65535 Len=1460 [TCP segment of a reassembled PDU]"
"16.938834","5.9.29.183","172.19.0.3","TLSv1.2","1516","Application Data [TCP segment of a reassembled PDU]"
"16.938837","5.9.29.183","172.19.0.3","TCP","1201","9002 → 43520 [PSH, ACK] Seq=241122 Ack=14575 Win=65535 Len=1145 [TCP segment of a reassembled PDU]"
"16.938844","5.9.29.183","172.19.0.3","TCP","1504","9002 → 43520 [PSH, ACK] Seq=242267 Ack=14575 Win=65535 Len=1448 [TCP segment of a reassembled PDU]"
"16.939009","172.19.0.3","5.9.29.183","TCP","56","43520 → 9002 [ACK] Seq=14575 Ack=243715 Win=11879 Len=0"
"16.954480","5.9.29.183","172.19.0.3","TLSv1.2","1394","Application Data, Application Data"
"16.981978","5.9.29.183","172.19.0.3","TCP","647","[TCP segment of a reassembled PDU]"
"16.982001","172.19.0.3","5.9.29.183","TCP","56","43520 → 9002 [ACK] Seq=14575 Ack=245644 Win=11911 Len=0"
"16.982051","5.9.29.183","172.19.0.3","TLSv1.2","522","Application Data"
"17.022377","172.19.0.3","5.9.29.183","TCP","56","43520 → 9002 [ACK] Seq=14575 Ack=246110 Win=11911 Len=0"
"17.061477","5.9.29.183","172.19.0.3","TCP","1516","[TCP segment of a reassembled PDU]"
"17.061545","5.9.29.183","172.19.0.3","TCP","1492","9002 → 43520 [PSH, ACK] Seq=247570 Ack=14575 Win=65535 Len=1436 [TCP segment of a reassembled PDU]"
"17.061557","5.9.29.183","172.19.0.3","TLSv1.2","787","Application Data"
"17.061697","172.19.0.3","5.9.29.183","TCP","56","43520 → 9002 [ACK] Seq=14575 Ack=249737 Win=11893 Len=0"
"17.116313","5.9.29.183","172.19.0.3","TCP","1504","[TCP segment of a reassembled PDU]"
"17.116409","5.9.29.183","172.19.0.3","TCP","1516","9002 → 43520 [PSH, ACK] Seq=251185 Ack=14575 Win=65535 Len=1460 [TCP segment of a reassembled PDU]"
"17.116428","172.19.0.3","5.9.29.183","TCP","56","43520 → 9002 [ACK] Seq=14575 Ack=252645 Win=11903 Len=0"
"17.116430","5.9.29.183","172.19.0.3","TLSv1.2","775","Application Data"
"17.116674","172.19.0.3","5.9.29.183","TCP","56","43520 → 9002 [ACK] Seq=14575 Ack=253364 Win=11911 Len=0"
"17.152058","5.9.29.183","172.19.0.3","TLSv1.2","599","Application Data"
"17.152369","172.19.0.3","5.9.29.183","TCP","56","43520 → 9002 [ACK] Seq=14575 Ack=253907 Win=11911 Len=0"
"17.192468","5.9.29.183","172.19.0.3","TCP","1516","[TCP segment of a reassembled PDU]"
"17.192541","5.9.29.183","172.19.0.3","TCP","1516","9002 → 43520 [PSH, ACK] Seq=255367 Ack=14575 Win=65535 Len=1460 [TCP segment of a reassembled PDU]"
"17.192558","5.9.29.183","172.19.0.3","TLSv1.2","1213","Application Data"
"17.192783","172.19.0.3","5.9.29.183","TCP","56","43520 → 9002 [ACK] Seq=14575 Ack=257984 Win=11895 Len=0"
"17.193100","172.19.0.3","5.9.29.183","TLSv1.2","599","Application Data"
"17.193414","5.9.29.183","172.19.0.3","TCP","56","9002 → 43520 [ACK] Seq=257984 Ack=15118 Win=65535 Len=0"
"17.208237","5.9.29.183","172.19.0.3","TLSv1.2","149","Application Data"
"17.222835","5.9.29.183","172.19.0.3","TCP","1516","[TCP segment of a reassembled PDU]"
"17.222859","172.19.0.3","5.9.29.183","TCP","56","43520 → 9002 [ACK] Seq=15118 Ack=259537 Win=11911 Len=0"
"17.222922","5.9.29.183","172.19.0.3","TCP","1492","9002 → 43520 [PSH, ACK] Seq=259537 Ack=15118 Win=65535 Len=1436 [TCP segment of a reassembled PDU]"
"17.223708","5.9.29.183","172.19.0.3","TLSv1.2","787","Application Data"
"17.223721","172.19.0.3","5.9.29.183","TCP","56","43520 → 9002 [ACK] Seq=15118 Ack=261704 Win=11911 Len=0"
"17.233312","5.9.29.183","172.19.0.3","TCP","1516","[TCP segment of a reassembled PDU]"
"17.233390","5.9.29.183","172.19.0.3","TCP","1492","9002 → 43520 [PSH, ACK] Seq=263164 Ack=15118 Win=65535 Len=1436 [TCP segment of a reassembled PDU]"
"17.233578","172.19.0.3","5.9.29.183","TCP","56","43520 → 9002 [ACK] Seq=15118 Ack=264600 Win=11903 Len=0"
"17.239304","5.9.29.183","172.19.0.3","TLSv1.2","1330","Application Data, Application Data"
"17.239759","172.19.0.3","5.9.29.183","TLSv1.2","599","Application Data"
"17.240095","5.9.29.183","172.19.0.3","TCP","56","9002 → 43520 [ACK] Seq=265874 Ack=15661 Win=65535 Len=0"
"17.268056","5.9.29.183","172.19.0.3","TCP","1504","[TCP segment of a reassembled PDU]"
"17.268174","5.9.29.183","172.19.0.3","TCP","1516","9002 → 43520 [PSH, ACK] Seq=267322 Ack=15661 Win=65535 Len=1460 [TCP segment of a reassembled PDU]"
"17.268201","5.9.29.183","172.19.0.3","TLSv1.2","1225","Application Data"
"17.268325","172.19.0.3","5.9.29.183","TCP","56","43520 → 9002 [ACK] Seq=15661 Ack=269951 Win=11893 Len=0"
"17.283953","5.9.29.183","172.19.0.3","TLSv1.2","149","Application Data"
"17.303398","5.9.29.183","172.19.0.3","TCP","1504","[TCP segment of a reassembled PDU]"
"17.303420","172.19.0.3","5.9.29.183","TCP","56","43520 → 9002 [ACK] Seq=15661 Ack=271492 Win=11911 Len=0"
"17.303615","5.9.29.183","172.19.0.3","TCP","1504","9002 → 43520 [PSH, ACK] Seq=271492 Ack=15661 Win=65535 Len=1448 [TCP segment of a reassembled PDU]"
"17.303625","5.9.29.183","172.19.0.3","TLSv1.2","787","Application Data"
"17.303674","172.19.0.3","5.9.29.183","TCP","56","43520 → 9002 [ACK] Seq=15661 Ack=273671 Win=11895 Len=0"
"17.389268","5.9.29.183","172.19.0.3","TLSv1.2","1113","Application Data"
"17.430675","172.19.0.3","5.9.29.183","TCP","56","43520 → 9002 [ACK] Seq=15661 Ack=274728 Win=11911 Len=0"
"17.932749","5.9.29.183","172.19.0.3","TCP","1504","[TCP segment of a reassembled PDU]"
"17.932813","172.19.0.3","5.9.29.183","TCP","56","43520 → 9002 [ACK] Seq=15661 Ack=276176 Win=11911 Len=0"
"17.932815","5.9.29.183","172.19.0.3","TCP","1504","9002 → 43520 [PSH, ACK] Seq=276176 Ack=15661 Win=65535 Len=1448 [TCP segment of a reassembled PDU]"
"17.932824","172.19.0.3","5.9.29.183","TCP","56","43520 → 9002 [ACK] Seq=15661 Ack=277624 Win=11903 Len=0"
"17.932825","5.9.29.183","172.19.0.3","TLSv1.2","787","Application Data"
"17.932830","172.19.0.3","5.9.29.183","TCP","56","43520 → 9002 [ACK] Seq=15661 Ack=278355 Win=11898 Len=0"
"17.948081","5.9.29.183","172.19.0.3","TLSv1.2","599","Application Data"
"17.948097","172.19.0.3","5.9.29.183","TCP","56","43520 → 9002 [ACK] Seq=15661 Ack=278898 Win=11911 Len=0"
"18.015623","5.9.29.183","172.19.0.3","TCP","1516","[TCP segment of a reassembled PDU]"
"18.015645","172.19.0.3","5.9.29.183","TCP","56","43520 → 9002 [ACK] Seq=15661 Ack=280358 Win=11911 Len=0"
"18.015879","5.9.29.183","172.19.0.3","TCP","1492","9002 → 43520 [PSH, ACK] Seq=280358 Ack=15661 Win=65535 Len=1436 [TCP segment of a reassembled PDU]"
"18.015895","172.19.0.3","5.9.29.183","TCP","56","43520 → 9002 [ACK] Seq=15661 Ack=281794 Win=11911 Len=0"
"18.015898","5.9.29.183","172.19.0.3","TLSv1.2","787","Application Data"
"18.015909","172.19.0.3","5.9.29.183","TCP","56","43520 → 9002 [ACK] Seq=15661 Ack=282525 Win=11906 Len=0"
"18.086807","5.9.29.183","172.19.0.3","TLSv1.2","599","Application Data"
"18.086842","172.19.0.3","5.9.29.183","TCP","56","43520 → 9002 [ACK] Seq=15661 Ack=283068 Win=11911 Len=0"
"18.148506","5.9.29.183","172.19.0.3","TCP","1516","[TCP segment of a reassembled PDU]"
"18.148524","172.19.0.3","5.9.29.183","TCP","56","43520 → 9002 [ACK] Seq=15661 Ack=284528 Win=11911 Len=0"
"18.148554","5.9.29.183","172.19.0.3","TCP","1492","9002 → 43520 [PSH, ACK] Seq=284528 Ack=15661 Win=65535 Len=1436 [TCP segment of a reassembled PDU]"
"18.148562","172.19.0.3","5.9.29.183","TCP","56","43520 → 9002 [ACK] Seq=15661 Ack=285964 Win=11903 Len=0"
"18.148564","5.9.29.183","172.19.0.3","TLSv1.2","787","Application Data"
"18.148567","172.19.0.3","5.9.29.183","TCP","56","43520 → 9002 [ACK] Seq=15661 Ack=286695 Win=11898 Len=0"
"18.185448","5.9.29.183","172.19.0.3","TLSv1.2","599","Application Data"
"18.185477","172.19.0.3","5.9.29.183","TCP","56","43520 → 9002 [ACK] Seq=15661 Ack=287238 Win=11911 Len=0"
"18.216405","5.9.29.183","172.19.0.3","TCP","1516","[TCP segment of a reassembled PDU]"
"18.216477","172.19.0.3","5.9.29.183","TCP","56","43520 → 9002 [ACK] Seq=15661 Ack=288698 Win=11911 Len=0"
"18.216583","5.9.29.183","172.19.0.3","TCP","1516","9002 → 43520 [PSH, ACK] Seq=288698 Ack=15661 Win=65535 Len=1460 [TCP segment of a reassembled PDU]"
"18.216622","172.19.0.3","5.9.29.183","TCP","56","43520 → 9002 [ACK] Seq=15661 Ack=290158 Win=11901 Len=0"
"18.216630","5.9.29.183","172.19.0.3","TLSv1.2","763","Application Data"
"18.216648","172.19.0.3","5.9.29.183","TCP","56","43520 → 9002 [ACK] Seq=15661 Ack=290865 Win=11896 Len=0"
"18.217723","172.19.0.3","5.9.29.183","TLSv1.2","599","Application Data"
"18.218321","5.9.29.183","172.19.0.3","TCP","56","9002 → 43520 [ACK] Seq=290865 Ack=16204 Win=65535 Len=0"
"18.263928","5.9.29.183","172.19.0.3","TCP","1504","[TCP segment of a reassembled PDU]"
"18.263981","5.9.29.183","172.19.0.3","TLSv1.2","1207","Application Data"
"18.264108","172.19.0.3","5.9.29.183","TCP","56","43520 → 9002 [ACK] Seq=16204 Ack=293464 Win=11903 Len=0"
"18.271365","172.19.0.3","5.9.29.183","TLSv1.2","599","Application Data"
"18.272227","5.9.29.183","172.19.0.3","TCP","56","9002 → 43520 [ACK] Seq=293464 Ack=16747 Win=65535 Len=0"
"19.100759","5.9.29.183","172.19.0.3","TLSv1.2","599","Application Data"
"19.101544","172.19.0.3","5.9.29.183","TLSv1.2","599","Application Data"
"19.102032","5.9.29.183","172.19.0.3","TCP","56","9002 → 43520 [ACK] Seq=294007 Ack=17290 Win=65535 Len=0"
"20.084375","5.9.29.183","172.19.0.3","TCP","1516","[TCP segment of a reassembled PDU]"
"20.084551","5.9.29.183","172.19.0.3","TCP","1492","9002 → 43520 [PSH, ACK] Seq=295467 Ack=17290 Win=65535 Len=1436 [TCP segment of a reassembled PDU]"
"20.084595","172.19.0.3","5.9.29.183","TCP","56","43520 → 9002 [ACK] Seq=17290 Ack=296903 Win=11901 Len=0"
"20.084615","5.9.29.183","172.19.0.3","TLSv1.2","787","Application Data"
"20.084618","5.9.29.183","172.19.0.3","TCP","1516","[TCP segment of a reassembled PDU]"
"20.084620","5.9.29.183","172.19.0.3","TCP","1516","9002 → 43520 [PSH, ACK] Seq=299094 Ack=17290 Win=65535 Len=1460 [TCP segment of a reassembled PDU]"
"20.084622","5.9.29.183","172.19.0.3","TLSv1.2","763","Application Data"
"20.084663","172.19.0.3","5.9.29.183","TCP","56","43520 → 9002 [ACK] Seq=17290 Ack=301261 Win=11869 Len=0"
"20.100411","5.9.29.183","172.19.0.3","TLSv1.2","599","Application Data"
"20.143967","172.19.0.3","5.9.29.183","TCP","56","43520 → 9002 [ACK] Seq=17290 Ack=301804 Win=11911 Len=0"
"20.603940","5.9.29.183","172.19.0.3","TCP","1516","[TCP segment of a reassembled PDU]"
"20.603960","172.19.0.3","5.9.29.183","TCP","56","43520 → 9002 [ACK] Seq=17290 Ack=303264 Win=11911 Len=0"
"20.603994","5.9.29.183","172.19.0.3","TCP","1492","9002 → 43520 [PSH, ACK] Seq=303264 Ack=17290 Win=65535 Len=1436 [TCP segment of a reassembled PDU]"
"20.604007","172.19.0.3","5.9.29.183","TCP","56","43520 → 9002 [ACK] Seq=17290 Ack=304700 Win=11903 Len=0"
"20.604009","5.9.29.183","172.19.0.3","TLSv1.2","273","Application Data"
"20.604014","172.19.0.3","5.9.29.183","TCP","56","43520 → 9002 [ACK] Seq=17290 Ack=304917 Win=11902 Len=0"
"20.726430","5.9.29.183","172.19.0.3","TCP","1504","[TCP segment of a reassembled PDU]"
"20.726450","172.19.0.3","5.9.29.183","TCP","56","43520 → 9002 [ACK] Seq=17290 Ack=306365 Win=11911 Len=0"
"20.726489","5.9.29.183","172.19.0.3","TCP","1516","9002 → 43520 [PSH, ACK] Seq=306365 Ack=17290 Win=65535 Len=1460 [TCP segment of a reassembled PDU]"
"20.726498","172.19.0.3","5.9.29.183","TCP","56","43520 → 9002 [ACK] Seq=17290 Ack=307825 Win=11903 Len=0"
"20.726500","5.9.29.183","172.19.0.3","TLSv1.2","775","Application Data"
"20.726505","172.19.0.3","5.9.29.183","TCP","56","43520 → 9002 [ACK] Seq=17290 Ack=308544 Win=11898 Len=0"
"20.816573","5.9.29.183","172.19.0.3","TCP","1504","[TCP segment of a reassembled PDU]"
"20.816625","172.19.0.3","5.9.29.183","TCP","56","43520 → 9002 [ACK] Seq=17290 Ack=309992 Win=11911 Len=0"
"20.816740","5.9.29.183","172.19.0.3","TCP","1244","9002 → 43520 [PSH, ACK] Seq=309992 Ack=17290 Win=65535 Len=1188 [TCP segment of a reassembled PDU]"
"20.816756","172.19.0.3","5.9.29.183","TCP","56","43520 → 9002 [ACK] Seq=17290 Ack=311180 Win=11903 Len=0"
"20.816760","5.9.29.183","172.19.0.3","TLSv1.2","1047","Application Data"
"20.816769","172.19.0.3","5.9.29.183","TCP","56","43520 → 9002 [ACK] Seq=17290 Ack=312171 Win=11896 Len=0"
"20.817036","172.19.0.3","5.9.29.183","TLSv1.2","599","Application Data"
"20.817521","5.9.29.183","172.19.0.3","TCP","56","9002 → 43520 [ACK] Seq=312171 Ack=17833 Win=65535 Len=0"
"20.876378","5.9.29.183","172.19.0.3","TLSv1.2","599","Application Data"
"20.917486","172.19.0.3","5.9.29.183","TCP","56","43520 → 9002 [ACK] Seq=17833 Ack=312714 Win=11911 Len=0"
"20.924666","5.9.29.183","172.19.0.3","TCP","1504","[TCP segment of a reassembled PDU]"
"20.924687","172.19.0.3","5.9.29.183","TCP","56","43520 → 9002 [ACK] Seq=17833 Ack=314162 Win=11911 Len=0"
"20.925045","5.9.29.183","172.19.0.3","TCP","1504","9002 → 43520 [PSH, ACK] Seq=314162 Ack=17833 Win=65535 Len=1448 [TCP segment of a reassembled PDU]"
"20.925056","172.19.0.3","5.9.29.183","TCP","56","43520 → 9002 [ACK] Seq=17833 Ack=315610 Win=11911 Len=0"
"20.925084","5.9.29.183","172.19.0.3","TLSv1.2","787","Application Data"
"20.925095","172.19.0.3","5.9.29.183","TCP","56","43520 → 9002 [ACK] Seq=17833 Ack=316341 Win=11906 Len=0"
"20.964684","5.9.29.183","172.19.0.3","TLSv1.2","599","Application Data"
"20.964720","172.19.0.3","5.9.29.183","TCP","56","43520 → 9002 [ACK] Seq=17833 Ack=316884 Win=11909 Len=0"
"21.048684","5.9.29.183","172.19.0.3","TCP","1504","[TCP segment of a reassembled PDU]"
"21.048735","172.19.0.3","5.9.29.183","TCP","56","43520 → 9002 [ACK] Seq=17833 Ack=318332 Win=11911 Len=0"
"21.048738","5.9.29.183","172.19.0.3","TCP","1516","9002 → 43520 [PSH, ACK] Seq=318332 Ack=17833 Win=65535 Len=1460 [TCP segment of a reassembled PDU]"
"21.048765","5.9.29.183","172.19.0.3","TLSv1.2","775","Application Data"
"21.048839","172.19.0.3","5.9.29.183","TCP","56","43520 → 9002 [ACK] Seq=17833 Ack=320511 Win=11895 Len=0"
"21.049056","172.19.0.3","5.9.29.183","TLSv1.2","599","Application Data"
"21.049268","5.9.29.183","172.19.0.3","TCP","56","9002 → 43520 [ACK] Seq=320511 Ack=18376 Win=65535 Len=0"
"21.150782","5.9.29.183","172.19.0.3","TCP","1504","[TCP segment of a reassembled PDU]"
"21.151073","5.9.29.183","172.19.0.3","TCP","1504","9002 → 43520 [PSH, ACK] Seq=321959 Ack=18376 Win=65535 Len=1448 [TCP segment of a reassembled PDU]"
"21.151083","172.19.0.3","5.9.29.183","TCP","56","43520 → 9002 [ACK] Seq=18376 Ack=323407 Win=11911 Len=0"
"21.151111","5.9.29.183","172.19.0.3","TLSv1.2","787","Application Data"
"21.191349","172.19.0.3","5.9.29.183","TCP","56","43520 → 9002 [ACK] Seq=18376 Ack=324138 Win=11911 Len=0"
"21.244136","5.9.29.183","172.19.0.3","TLSv1.2","1113","Application Data"
"21.244317","172.19.0.3","5.9.29.183","TCP","56","43520 → 9002 [ACK] Seq=18376 Ack=325195 Win=11911 Len=0"
"21.286289","5.9.29.183","172.19.0.3","TCP","1504","[TCP segment of a reassembled PDU]"
"21.286484","5.9.29.183","172.19.0.3","TCP","1516","9002 → 43520 [PSH, ACK] Seq=326643 Ack=18376 Win=65535 Len=1460 [TCP segment of a reassembled PDU]"
"21.286538","5.9.29.183","172.19.0.3","TLSv1.2","775","Application Data"
"21.286801","172.19.0.3","5.9.29.183","TCP","56","43520 → 9002 [ACK] Seq=18376 Ack=328822 Win=11895 Len=0"
"21.322079","5.9.29.183","172.19.0.3","TLSv1.2","599","Application Data"
"21.322363","172.19.0.3","5.9.29.183","TCP","56","43520 → 9002 [ACK] Seq=18376 Ack=329365 Win=11911 Len=0"
"21.362009","5.9.29.183","172.19.0.3","TCP","1516","[TCP segment of a reassembled PDU]"
"21.362101","5.9.29.183","172.19.0.3","TCP","1516","9002 → 43520 [PSH, ACK] Seq=330825 Ack=18376 Win=65535 Len=1460 [TCP segment of a reassembled PDU]"
"21.362129","5.9.29.183","172.19.0.3","TLSv1.2","763","Application Data"
"21.362540","172.19.0.3","5.9.29.183","TCP","56","43520 → 9002 [ACK] Seq=18376 Ack=332992 Win=11895 Len=0"
"21.426328","5.9.29.183","172.19.0.3","TCP","1516","[TCP segment of a reassembled PDU]"
"21.426382","5.9.29.183","172.19.0.3","TLSv1.2","167","Application Data"
"21.426399","172.19.0.3","5.9.29.183","TCP","56","43520 → 9002 [ACK] Seq=18376 Ack=334563 Win=11903 Len=0"
"21.430874","172.19.0.3","5.9.29.183","TLSv1.2","599","Application Data"
"21.431174","5.9.29.183","172.19.0.3","TCP","56","9002 → 43520 [ACK] Seq=334563 Ack=18919 Win=65535 Len=0"
"22.211667","5.9.29.183","172.19.0.3","TLSv1.2","599","Application Data"
"22.212562","172.19.0.3","5.9.29.183","TLSv1.2","599","Application Data"
"22.212848","5.9.29.183","172.19.0.3","TCP","56","9002 → 43520 [ACK] Seq=335106 Ack=19462 Win=65535 Len=0"
"22.835395","5.9.29.183","172.19.0.3","TLSv1.2","599","Application Data"
"22.876345","172.19.0.3","5.9.29.183","TCP","56","43520 → 9002 [ACK] Seq=19462 Ack=335649 Win=11911 Len=0"
"22.897819","5.9.29.183","172.19.0.3","TCP","1516","[TCP segment of a reassembled PDU]"
"22.897843","172.19.0.3","5.9.29.183","TCP","56","43520 → 9002 [ACK] Seq=19462 Ack=337109 Win=11911 Len=0"
"22.897906","5.9.29.183","172.19.0.3","TCP","1516","9002 → 43520 [PSH, ACK] Seq=337109 Ack=19462 Win=65535 Len=1460 [TCP segment of a reassembled PDU]"
"22.897927","172.19.0.3","5.9.29.183","TCP","56","43520 → 9002 [ACK] Seq=19462 Ack=338569 Win=11903 Len=0"
"22.897929","5.9.29.183","172.19.0.3","TLSv1.2","763","Application Data"
"22.897935","172.19.0.3","5.9.29.183","TCP","56","43520 → 9002 [ACK] Seq=19462 Ack=339276 Win=11898 Len=0"
"22.949519","5.9.29.183","172.19.0.3","TCP","1504","[TCP segment of a reassembled PDU]"
"22.949550","172.19.0.3","5.9.29.183","TCP","56","43520 → 9002 [ACK] Seq=19462 Ack=340724 Win=11911 Len=0"
"22.949599","5.9.29.183","172.19.0.3","TCP","1504","9002 → 43520 [PSH, ACK] Seq=340724 Ack=19462 Win=65535 Len=1448 [TCP segment of a reassembled PDU]"
"22.949610","172.19.0.3","5.9.29.183","TCP","56","43520 → 9002 [ACK] Seq=19462 Ack=342172 Win=11903 Len=0"
"22.949613","5.9.29.183","172.19.0.3","TLSv1.2","787","Application Data"
"22.949618","172.19.0.3","5.9.29.183","TCP","56","43520 → 9002 [ACK] Seq=19462 Ack=342903 Win=11898 Len=0"
"22.991151","5.9.29.183","172.19.0.3","TLSv1.2","599","Application Data"
"22.991194","172.19.0.3","5.9.29.183","TCP","56","43520 → 9002 [ACK] Seq=19462 Ack=343446 Win=11911 Len=0"
"23.033205","5.9.29.183","172.19.0.3","TCP","1516","[TCP segment of a reassembled PDU]"
"23.033223","172.19.0.3","5.9.29.183","TCP","56","43520 → 9002 [ACK] Seq=19462 Ack=344906 Win=11911 Len=0"
"23.033263","5.9.29.183","172.19.0.3","TCP","1516","9002 → 43520 [PSH, ACK] Seq=344906 Ack=19462 Win=65535 Len=1460 [TCP segment of a reassembled PDU]"
"23.033272","172.19.0.3","5.9.29.183","TCP","56","43520 → 9002 [ACK] Seq=19462 Ack=346366 Win=11903 Len=0"
"23.033273","5.9.29.183","172.19.0.3","TLSv1.2","763","Application Data"
"23.033277","172.19.0.3","5.9.29.183","TCP","56","43520 → 9002 [ACK] Seq=19462 Ack=347073 Win=11898 Len=0"
"23.066262","5.9.29.183","172.19.0.3","TCP","1516","[TCP segment of a reassembled PDU]"
"23.066285","172.19.0.3","5.9.29.183","TCP","56","43520 → 9002 [ACK] Seq=19462 Ack=348533 Win=11911 Len=0"
"23.066334","5.9.29.183","172.19.0.3","TCP","1492","9002 → 43520 [PSH, ACK] Seq=348533 Ack=19462 Win=65535 Len=1436 [TCP segment of a reassembled PDU]"
"23.066343","172.19.0.3","5.9.29.183","TCP","56","43520 → 9002 [ACK] Seq=19462 Ack=349969 Win=11903 Len=0"
"23.066345","5.9.29.183","172.19.0.3","TLSv1.2","787","Application Data"
"23.066349","172.19.0.3","5.9.29.183","TCP","56","43520 → 9002 [ACK] Seq=19462 Ack=350700 Win=11898 Len=0"
"23.101585","5.9.29.183","172.19.0.3","TLSv1.2","1113","Application Data"
"23.101604","172.19.0.3","5.9.29.183","TCP","56","43520 → 9002 [ACK] Seq=19462 Ack=351757 Win=11911 Len=0"
"23.126445","5.9.29.183","172.19.0.3","TCP","1504","[TCP segment of a reassembled PDU]"
"23.126462","172.19.0.3","5.9.29.183","TCP","56","43520 → 9002 [ACK] Seq=19462 Ack=353205 Win=11911 Len=0"
"23.126496","5.9.29.183","172.19.0.3","TCP","1516","9002 → 43520 [PSH, ACK] Seq=353205 Ack=19462 Win=65535 Len=1460 [TCP segment of a reassembled PDU]"
"23.126504","5.9.29.183","172.19.0.3","TLSv1.2","775","Application Data"
"23.126642","172.19.0.3","5.9.29.183","TCP","56","43520 → 9002 [ACK] Seq=19462 Ack=355384 Win=11895 Len=0"
"23.137055","5.9.29.183","172.19.0.3","TCP","1504","[TCP segment of a reassembled PDU]"
"23.137223","172.19.0.3","5.9.29.183","TCP","56","43520 → 9002 [ACK] Seq=19462 Ack=356832 Win=11911 Len=0"
"23.141602","5.9.29.183","172.19.0.3","TCP","1516","9002 → 43520 [PSH, ACK] Seq=356832 Ack=19462 Win=65535 Len=1460 [TCP segment of a reassembled PDU]"
"23.141653","5.9.29.183","172.19.0.3","TLSv1.2","775","Application Data"
"23.141813","172.19.0.3","5.9.29.183","TCP","56","43520 → 9002 [ACK] Seq=19462 Ack=359011 Win=11911 Len=0"
"23.185219","5.9.29.183","172.19.0.3","TLSv1.2","1113","Application Data"
"23.185412","172.19.0.3","5.9.29.183","TCP","56","43520 → 9002 [ACK] Seq=19462 Ack=360068 Win=11911 Len=0"
"23.277402","5.9.29.183","172.19.0.3","TCP","1504","[TCP segment of a reassembled PDU]"
"23.277469","5.9.29.183","172.19.0.3","TCP","1516","9002 → 43520 [PSH, ACK] Seq=361516 Ack=19462 Win=65535 Len=1460 [TCP segment of a reassembled PDU]"
"23.277481","5.9.29.183","172.19.0.3","TLSv1.2","775","Application Data"
"23.277610","172.19.0.3","5.9.29.183","TCP","56","43520 → 9002 [ACK] Seq=19462 Ack=363695 Win=11895 Len=0"
"23.277909","172.19.0.3","5.9.29.183","TLSv1.2","1113","Application Data"
"23.278180","5.9.29.183","172.19.0.3","TCP","56","9002 → 43520 [ACK] Seq=363695 Ack=20519 Win=65535 Len=0"
"23.348334","5.9.29.183","172.19.0.3","TCP","1516","[TCP segment of a reassembled PDU]"
"23.348422","5.9.29.183","172.19.0.3","TCP","1492","9002 → 43520 [PSH, ACK] Seq=365155 Ack=20519 Win=65535 Len=1436 [TCP segment of a reassembled PDU]"
"23.348439","5.9.29.183","172.19.0.3","TLSv1.2","787","Application Data"
"23.348743","172.19.0.3","5.9.29.183","TCP","56","43520 → 9002 [ACK] Seq=20519 Ack=367322 Win=11895 Len=0"
"23.375891","5.9.29.183","172.19.0.3","TLSv1.2","599","Application Data"
"23.388915","5.9.29.183","172.19.0.3","TCP","1516","[TCP segment of a reassembled PDU]"
"23.388939","172.19.0.3","5.9.29.183","TCP","56","43520 → 9002 [ACK] Seq=20519 Ack=369325 Win=11911 Len=0"
"23.389002","5.9.29.183","172.19.0.3","TCP","1492","9002 → 43520 [PSH, ACK] Seq=369325 Ack=20519 Win=65535 Len=1436 [TCP segment of a reassembled PDU]"
"23.390377","5.9.29.183","172.19.0.3","TLSv1.2","787","Application Data"
"23.390393","172.19.0.3","5.9.29.183","TCP","56","43520 → 9002 [ACK] Seq=20519 Ack=371492 Win=11911 Len=0"
"23.426415","5.9.29.183","172.19.0.3","TLSv1.2","1113","Application Data"
"23.462754","5.9.29.183","172.19.0.3","TCP","1516","[TCP segment of a reassembled PDU]"
"23.462789","172.19.0.3","5.9.29.183","TCP","56","43520 → 9002 [ACK] Seq=20519 Ack=374009 Win=11911 Len=0"
"23.462833","5.9.29.183","172.19.0.3","TCP","1492","9002 → 43520 [PSH, ACK] Seq=374009 Ack=20519 Win=65535 Len=1436 [TCP segment of a reassembled PDU]"
"23.462844","5.9.29.183","172.19.0.3","TLSv1.2","787","Application Data"
"23.462999","172.19.0.3","5.9.29.183","TCP","56","43520 → 9002 [ACK] Seq=20519 Ack=376176 Win=11895 Len=0"
"23.506954","5.9.29.183","172.19.0.3","TCP","596","[TCP segment of a reassembled PDU]"
"23.507033","5.9.29.183","172.19.0.3","TCP","1516","9002 → 43520 [PSH, ACK] Seq=376716 Ack=20519 Win=65535 Len=1460 [TCP segment of a reassembled PDU]"
"23.507055","172.19.0.3","5.9.29.183","TCP","56","43520 → 9002 [ACK] Seq=20519 Ack=378176 Win=11903 Len=0"
"23.507057","5.9.29.183","172.19.0.3","TCP","1516","9002 → 43520 [PSH, ACK] Seq=378176 Ack=20519 Win=65535 Len=1460 [TCP segment of a reassembled PDU]"
"23.507061","5.9.29.183","172.19.0.3","TLSv1.2","673","Application Data"
"23.507157","172.19.0.3","5.9.29.183","TCP","56","43520 → 9002 [ACK] Seq=20519 Ack=380253 Win=11887 Len=0"
"23.522306","5.9.29.183","172.19.0.3","TLSv1.2","149","Application Data"
"23.563430","172.19.0.3","5.9.29.183","TCP","56","43520 → 9002 [ACK] Seq=20519 Ack=380346 Win=11911 Len=0"
"23.595792","5.9.29.183","172.19.0.3","TLSv1.2","1113","Application Data"
"23.596157","172.19.0.3","5.9.29.183","TCP","56","43520 → 9002 [ACK] Seq=20519 Ack=381403 Win=11911 Len=0"
"23.631637","5.9.29.183","172.19.0.3","TCP","1516","[TCP segment of a reassembled PDU]"
"23.631716","5.9.29.183","172.19.0.3","TCP","1516","9002 → 43520 [PSH, ACK] Seq=382863 Ack=20519 Win=65535 Len=1460 [TCP segment of a reassembled PDU]"
"23.631728","5.9.29.183","172.19.0.3","TLSv1.2","763","Application Data"
"23.631882","172.19.0.3","5.9.29.183","TCP","56","43520 → 9002 [ACK] Seq=20519 Ack=385030 Win=11895 Len=0"
"23.672467","5.9.29.183","172.19.0.3","TCP","1516","[TCP segment of a reassembled PDU]"
"23.672552","5.9.29.183","172.19.0.3","TCP","1516","9002 → 43520 [PSH, ACK] Seq=386490 Ack=20519 Win=65535 Len=1460 [TCP segment of a reassembled PDU]"
"23.672584","172.19.0.3","5.9.29.183","TCP","56","43520 → 9002 [ACK] Seq=20519 Ack=387950 Win=11903 Len=0"
"23.672586","5.9.29.183","172.19.0.3","TLSv1.2","1213","Application Data"
"23.672744","172.19.0.3","5.9.29.183","TCP","56","43520 → 9002 [ACK] Seq=20519 Ack=389107 Win=11911 Len=0"
"23.673092","172.19.0.3","5.9.29.183","TLSv1.2","599","Application Data"
"23.673715","5.9.29.183","172.19.0.3","TCP","56","9002 → 43520 [ACK] Seq=389107 Ack=21062 Win=65535 Len=0"
"23.687931","5.9.29.183","172.19.0.3","TLSv1.2","149","Application Data"
"23.710160","5.9.29.183","172.19.0.3","TCP","1504","[TCP segment of a reassembled PDU]"
"23.710181","172.19.0.3","5.9.29.183","TCP","56","43520 → 9002 [ACK] Seq=21062 Ack=390648 Win=11911 Len=0"
"23.710224","5.9.29.183","172.19.0.3","TCP","1516","9002 → 43520 [PSH, ACK] Seq=390648 Ack=21062 Win=65535 Len=1460 [TCP segment of a reassembled PDU]"
"23.710233","5.9.29.183","172.19.0.3","TLSv1.2","1225","Application Data"
"23.710356","172.19.0.3","5.9.29.183","TCP","56","43520 → 9002 [ACK] Seq=21062 Ack=393277 Win=11895 Len=0"
"23.725633","5.9.29.183","172.19.0.3","TLSv1.2","149","Application Data"
"23.766554","172.19.0.3","5.9.29.183","TCP","56","43520 → 9002 [ACK] Seq=21062 Ack=393370 Win=11911 Len=0"
"23.794795","5.9.29.183","172.19.0.3","TCP","1504","[TCP segment of a reassembled PDU]"
"23.794861","5.9.29.183","172.19.0.3","TCP","1516","9002 → 43520 [PSH, ACK] Seq=394818 Ack=21062 Win=65535 Len=1460 [TCP segment of a reassembled PDU]"
"23.794873","5.9.29.183","172.19.0.3","TLSv1.2","775","Application Data"
"23.795015","172.19.0.3","5.9.29.183","TCP","56","43520 → 9002 [ACK] Seq=21062 Ack=396997 Win=11895 Len=0"
"23.811978","5.9.29.183","172.19.0.3","TCP","1516","[TCP segment of a reassembled PDU]"
"23.812040","5.9.29.183","172.19.0.3","TCP","1492","9002 → 43520 [PSH, ACK] Seq=398457 Ack=21062 Win=65535 Len=1436 [TCP segment of a reassembled PDU]"
"23.812065","172.19.0.3","5.9.29.183","TCP","56","43520 → 9002 [ACK] Seq=21062 Ack=399893 Win=11903 Len=0"
"23.812070","5.9.29.183","172.19.0.3","TLSv1.2","1237","Application Data"
"23.812212","172.19.0.3","5.9.29.183","TCP","56","43520 → 9002 [ACK] Seq=21062 Ack=401074 Win=11911 Len=0"
"23.828309","5.9.29.183","172.19.0.3","TLSv1.2","149","Application Data"
"23.828529","172.19.0.3","5.9.29.183","TCP","56","43520 → 9002 [ACK] Seq=21062 Ack=401167 Win=11911 Len=0"
"23.842515","5.9.29.183","172.19.0.3","TCP","1504","[TCP segment of a reassembled PDU]"
"23.842579","5.9.29.183","172.19.0.3","TCP","1504","9002 → 43520 [PSH, ACK] Seq=402615 Ack=21062 Win=65535 Len=1448 [TCP segment of a reassembled PDU]"
"23.842731","172.19.0.3","5.9.29.183","TCP","56","43520 → 9002 [ACK] Seq=21062 Ack=404063 Win=11903 Len=0"
"23.843194","5.9.29.183","172.19.0.3","TLSv1.2","1330","Application Data, Application Data"
"23.843468","172.19.0.3","5.9.29.183","TCP","56","43520 → 9002 [ACK] Seq=21062 Ack=405337 Win=11911 Len=0"
"23.901978","5.9.29.183","172.19.0.3","TCP","1504","[TCP segment of a reassembled PDU]"
"23.902051","5.9.29.183","172.19.0.3","TCP","1516","9002 → 43520 [PSH, ACK] Seq=406785 Ack=21062 Win=65535 Len=1460 [TCP segment of a reassembled PDU]"
"23.902063","5.9.29.183","172.19.0.3","TLSv1.2","775","Application Data"
"23.902228","172.19.0.3","5.9.29.183","TCP","56","43520 → 9002 [ACK] Seq=21062 Ack=408964 Win=11895 Len=0"
"23.944342","5.9.29.183","172.19.0.3","TLSv1.2","599","Application Data"
"23.944542","172.19.0.3","5.9.29.183","TCP","56","43520 → 9002 [ACK] Seq=21062 Ack=409507 Win=11911 Len=0"
"23.992290","5.9.29.183","172.19.0.3","TCP","1516","[TCP segment of a reassembled PDU]"
"23.992352","5.9.29.183","172.19.0.3","TCP","1492","9002 → 43520 [PSH, ACK] Seq=410967 Ack=21062 Win=65535 Len=1436 [TCP segment of a reassembled PDU]"
"23.992363","5.9.29.183","172.19.0.3","TLSv1.2","787","Application Data"
"23.992504","172.19.0.3","5.9.29.183","TCP","56","43520 → 9002 [ACK] Seq=21062 Ack=413134 Win=11895 Len=0"
"24.000087","172.19.0.3","5.9.29.183","TLSv1.2","599","Application Data"
"24.000396","5.9.29.183","172.19.0.3","TCP","56","9002 → 43520 [ACK] Seq=413134 Ack=21605 Win=65535 Len=0"
"24.674534","5.9.29.183","172.19.0.3","TLSv1.2","599","Application Data"
"24.675659","172.19.0.3","5.9.29.183","TLSv1.2","599","Application Data"
"24.676368","5.9.29.183","172.19.0.3","TCP","56","9002 → 43520 [ACK] Seq=413677 Ack=22148 Win=65535 Len=0"
"25.288606","5.9.29.183","172.19.0.3","TCP","1516","[TCP segment of a reassembled PDU]"
"25.288633","5.9.29.183","172.19.0.3","TCP","1492","9002 → 43520 [PSH, ACK] Seq=415137 Ack=22148 Win=65535 Len=1436 [TCP segment of a reassembled PDU]"
"25.288639","5.9.29.183","172.19.0.3","TLSv1.2","787","Application Data"
"25.288734","172.19.0.3","5.9.29.183","TCP","56","43520 → 9002 [ACK] Seq=22148 Ack=417304 Win=11895 Len=0"
"25.288981","172.19.0.3","5.9.29.183","TLSv1.2","599","Application Data"
"25.289255","5.9.29.183","172.19.0.3","TCP","56","9002 → 43520 [ACK] Seq=417304 Ack=22691 Win=65535 Len=0"
"25.342611","5.9.29.183","172.19.0.3","TCP","1516","[TCP segment of a reassembled PDU]"
"25.342664","5.9.29.183","172.19.0.3","TCP","1492","9002 → 43520 [PSH, ACK] Seq=418764 Ack=22691 Win=65535 Len=1436 [TCP segment of a reassembled PDU]"
"25.342676","5.9.29.183","172.19.0.3","TLSv1.2","787","Application Data"
"25.342859","172.19.0.3","5.9.29.183","TCP","56","43520 → 9002 [ACK] Seq=22691 Ack=420931 Win=11895 Len=0"
"25.378791","5.9.29.183","172.19.0.3","TLSv1.2","599","Application Data"
"25.417109","5.9.29.183","172.19.0.3","TCP","1504","[TCP segment of a reassembled PDU]"
"25.417127","172.19.0.3","5.9.29.183","TCP","56","43520 → 9002 [ACK] Seq=22691 Ack=422922 Win=11911 Len=0"
"25.417139","5.9.29.183","172.19.0.3","TCP","1504","9002 → 43520 [PSH, ACK] Seq=422922 Ack=22691 Win=65535 Len=1448 [TCP segment of a reassembled PDU]"
"25.417144","5.9.29.183","172.19.0.3","TLSv1.2","1237","Application Data"
"25.417278","172.19.0.3","5.9.29.183","TCP","56","43520 → 9002 [ACK] Seq=22691 Ack=425551 Win=11895 Len=0"
"25.432354","5.9.29.183","172.19.0.3","TLSv1.2","149","Application Data"
"25.475494","172.19.0.3","5.9.29.183","TCP","56","43520 → 9002 [ACK] Seq=22691 Ack=425644 Win=11911 Len=0"
"25.477325","5.9.29.183","172.19.0.3","TCP","1504","[TCP segment of a reassembled PDU]"
"25.477343","172.19.0.3","5.9.29.183","TCP","56","43520 → 9002 [ACK] Seq=22691 Ack=427092 Win=11911 Len=0"
"25.477355","5.9.29.183","172.19.0.3","TCP","1516","9002 → 43520 [PSH, ACK] Seq=427092 Ack=22691 Win=65535 Len=1460 [TCP segment of a reassembled PDU]"
"25.477362","172.19.0.3","5.9.29.183","TCP","56","43520 → 9002 [ACK] Seq=22691 Ack=428552 Win=11903 Len=0"
"25.477363","5.9.29.183","172.19.0.3","TLSv1.2","775","Application Data"
"25.477366","172.19.0.3","5.9.29.183","TCP","56","43520 → 9002 [ACK] Seq=22691 Ack=429271 Win=11898 Len=0"
"25.512601","5.9.29.183","172.19.0.3","TLSv1.2","1113","Application Data"
"25.512634","172.19.0.3","5.9.29.183","TCP","56","43520 → 9002 [ACK] Seq=22691 Ack=430328 Win=11911 Len=0"
"25.615686","5.9.29.183","172.19.0.3","TCP","1504","[TCP segment of a reassembled PDU]"
"25.615708","172.19.0.3","5.9.29.183","TCP","56","43520 → 9002 [ACK] Seq=22691 Ack=431776 Win=11909 Len=0"
"25.615717","5.9.29.183","172.19.0.3","TLSv1.2","1207","Application Data"
"25.615745","172.19.0.3","5.9.29.183","TCP","56","43520 → 9002 [ACK] Seq=22691 Ack=432927 Win=11901 Len=0"
"25.619393","172.19.0.3","5.9.29.183","TLSv1.2","599","Application Data"
"25.619636","5.9.29.183","172.19.0.3","TCP","56","9002 → 43520 [ACK] Seq=432927 Ack=23234 Win=65535 Len=0"
"26.210660","5.9.29.183","172.19.0.3","TLSv1.2","599","Application Data"
"26.211487","172.19.0.3","5.9.29.183","TLSv1.2","599","Application Data"
"26.211753","5.9.29.183","172.19.0.3","TCP","56","9002 → 43520 [ACK] Seq=433470 Ack=23777 Win=65535 Len=0"
"27.130587","5.9.29.183","172.19.0.3","TLSv1.2","599","Application Data"
"27.130655","5.9.29.183","172.19.0.3","TCP","1516","[TCP segment of a reassembled PDU]"
"27.130685","5.9.29.183","172.19.0.3","TCP","1492","9002 → 43520 [PSH, ACK] Seq=435473 Ack=23777 Win=65535 Len=1436 [TCP segment of a reassembled PDU]"
"27.130689","5.9.29.183","172.19.0.3","TLSv1.2","1516","Application Data [TCP segment of a reassembled PDU]"
"27.130691","5.9.29.183","172.19.0.3","TCP","1516","9002 → 43520 [PSH, ACK] Seq=438369 Ack=23777 Win=65535 Len=1460 [TCP segment of a reassembled PDU]"
"27.130743","5.9.29.183","172.19.0.3","TCP","1480","9002 → 43520 [PSH, ACK] Seq=439829 Ack=23777 Win=65535 Len=1424 [TCP segment of a reassembled PDU]"
"27.130784","172.19.0.3","5.9.29.183","TCP","56","43520 → 9002 [ACK] Seq=23777 Ack=441253 Win=11869 Len=0"
"27.146550","5.9.29.183","172.19.0.3","TLSv1.2","1055","Application Data, Application Data"
"27.146632","5.9.29.183","172.19.0.3","TCP","1516","9002 → 43520 [PSH, ACK] Seq=442252 Ack=23777 Win=65535 Len=1460 [TCP segment of a reassembled PDU]"
"27.146668","172.19.0.3","5.9.29.183","TCP","56","43520 → 9002 [ACK] Seq=23777 Ack=443712 Win=11903 Len=0"
"27.146672","5.9.29.183","172.19.0.3","TCP","1516","9002 → 43520 [PSH, ACK] Seq=443712 Ack=23777 Win=65535 Len=1460 [TCP segment of a reassembled PDU]"
"27.146675","5.9.29.183","172.19.0.3","TLSv1.2","1516","Application Data, Application Data"
"27.146678","5.9.29.183","172.19.0.3","TLSv1.2","1489","Application Data"
"27.146885","172.19.0.3","5.9.29.183","TCP","56","43520 → 9002 [ACK] Seq=23777 Ack=448065 Win=11879 Len=0"
"27.146904","5.9.29.183","172.19.0.3","TCP","1504","[TCP segment of a reassembled PDU]"
"27.161609","5.9.29.183","172.19.0.3","TCP","1516","9002 → 43520 [PSH, ACK] Seq=449513 Ack=23777 Win=65535 Len=1460 [TCP segment of a reassembled PDU]"
"27.161644","172.19.0.3","5.9.29.183","TCP","56","43520 → 9002 [ACK] Seq=23777 Ack=450973 Win=11911 Len=0"
"27.161712","5.9.29.183","172.19.0.3","TLSv1.2","1492","Application Data [TCP segment of a reassembled PDU]"
"27.162096","5.9.29.183","172.19.0.3","TCP","1504","9002 → 43520 [PSH, ACK] Seq=452409 Ack=23777 Win=65535 Len=1448 [TCP segment of a reassembled PDU]"
"27.162115","5.9.29.183","172.19.0.3","TCP","1516","9002 → 43520 [PSH, ACK] Seq=453857 Ack=23777 Win=65535 Len=1460 [TCP segment of a reassembled PDU]"
"27.162120","5.9.29.183","172.19.0.3","TLSv1.2","1492","Application Data [TCP segment of a reassembled PDU]"
"27.162356","172.19.0.3","5.9.29.183","TCP","56","43520 → 9002 [ACK] Seq=23777 Ack=456753 Win=11879 Len=0"
"27.263358","5.9.29.183","172.19.0.3","TLSv1.2","1516","Application Data, Application Data"
"27.263427","5.9.29.183","172.19.0.3","TCP","1492","9002 → 43520 [PSH, ACK] Seq=458213 Ack=23777 Win=65535 Len=1436 [TCP segment of a reassembled PDU]"
"27.263459","172.19.0.3","5.9.29.183","TCP","56","43520 → 9002 [ACK] Seq=23777 Ack=459649 Win=11903 Len=0"
"27.263463","5.9.29.183","172.19.0.3","TCP","1516","9002 → 43520 [PSH, ACK] Seq=459649 Ack=23777 Win=65535 Len=1460 [TCP segment of a reassembled PDU]"
"27.263473","5.9.29.183","172.19.0.3","TLSv1.2","1516","Application Data [TCP segment of a reassembled PDU]"
"27.263482","5.9.29.183","172.19.0.3","TCP","1516","9002 → 43520 [PSH, ACK] Seq=462569 Ack=23777 Win=65535 Len=1460 [TCP segment of a reassembled PDU]"
"27.263490","5.9.29.183","172.19.0.3","TLSv1.2","1257","Application Data, Application Data"
"27.263625","172.19.0.3","5.9.29.183","TCP","56","43520 → 9002 [ACK] Seq=23777 Ack=465230 Win=11871 Len=0"
"27.264312","172.19.0.3","5.9.29.183","TLSv1.2","599","Application Data"
"27.264727","5.9.29.183","172.19.0.3","TCP","56","9002 → 43520 [ACK] Seq=465230 Ack=24320 Win=65535 Len=0"
"27.278420","5.9.29.183","172.19.0.3","TCP","1504","[TCP segment of a reassembled PDU]"
"27.278468","5.9.29.183","172.19.0.3","TCP","1516","9002 → 43520 [PSH, ACK] Seq=466678 Ack=24320 Win=65535 Len=1460 [TCP segment of a reassembled PDU]"
"27.278482","172.19.0.3","5.9.29.183","TCP","56","43520 → 9002 [ACK] Seq=24320 Ack=468138 Win=11901 Len=0"
"27.278484","5.9.29.183","172.19.0.3","TLSv1.2","1492","Application Data [TCP segment of a reassembled PDU]"
"27.278487","5.9.29.183","172.19.0.3","TLSv1.2","1424","Application Data"
"27.278611","172.19.0.3","5.9.29.183","TCP","56","43520 → 9002 [ACK] Seq=24320 Ack=470942 Win=11885 Len=0"
"27.278833","172.19.0.3","5.9.29.183","TLSv1.2","599","Application Data"
"27.279064","5.9.29.183","172.19.0.3","TCP","56","9002 → 43520 [ACK] Seq=470942 Ack=24863 Win=65535 Len=0"
