_ws.col.Time,_ws.col.Source,_ws.col.Destination,_ws.col.Protocol,_ws.col.Length,_ws.col.Info
"0.000000","172.19.0.3","5.9.29.183","TLSv1.2","599","Application Data"
"0.000336","5.9.29.183","172.19.0.3","TCP","56","9002 → 43520 [ACK] Seq=1 Ack=544 Win=65535 Len=0"
"6.802729","172.19.0.3","5.9.29.183","TLSv1.2","599","Application Data"
"6.803246","5.9.29.183","172.19.0.3","TCP","56","9002 → 43520 [ACK] Seq=1 Ack=1087 Win=65535 Len=0"
"9.031793","5.9.29.183","172.19.0.3","TLSv1.2","599","Application Data"
"9.031833","172.19.0.3","5.9.29.183","TCP","56","43520 → 9002 [ACK] Seq=1087 Ack=544 Win=11911 Len=0"
"9.032551","172.19.0.3","5.9.29.183","TLSv1.2","2141","Application Data"
"9.032947","5.9.29.183","172.19.0.3","TCP","56","9002 → 43520 [ACK] Seq=544 Ack=3172 Win=65535 Len=0"
"10.080909","5.9.29.183","172.19.0.3","TCP","1516","[TCP segment of a reassembled PDU]"
"10.080942","5.9.29.183","172.19.0.3","TLSv1.2","167","Application Data"
"10.081074","172.19.0.3","5.9.29.183","TCP","56","43520 → 9002 [ACK] Seq=3172 Ack=2115 Win=11903 Len=0"
"10.085073","172.19.0.3","5.9.29.183","TLSv1.2","599","Application Data"
"10.085347","5.9.29.183","172.19.0.3","TCP","56","9002 → 43520 [ACK] Seq=2115 Ack=3715 Win=65535 Len=0"
"10.466701","5.9.29.183","172.19.0.3","TLSv1.2","599","Application Data"
"10.467362","172.19.0.3","5.9.29.183","TLSv1.2","599","Application Data"
"10.467772","5.9.29.183","172.19.0.3","TCP","56","9002 → 43520 [ACK] Seq=2658 Ack=4258 Win=65535 Len=0"
"10.898386","5.9.29.183","172.19.0.3","TLSv1.2","599","Application Data"
"10.929333","5.9.29.183","172.19.0.3","TCP","1516","[TCP segment of a reassembled PDU]"
"10.929360","172.19.0.3","5.9.29.183","TCP","56","43520 → 9002 [ACK] Seq=4258 Ack=4661 Win=11911 Len=0"
"10.929377","5.9.29.183","172.19.0.3","TCP","1492","9002 → 43520 [PSH, ACK] Seq=4661 Ack=4258 Win=65535 Len=1436 [TCP segment of a reassembled PDU]"
"10.944453","5.9.29.183","172.19.0.3","TLSv1.2","787","Application Data"
"10.944472","172.19.0.3","5.9.29.183","TCP","56","43520 → 9002 [ACK] Seq=4258 Ack=6828 Win=11911 Len=0"
"10.959024","5.9.29.183","172.19.0.3","TCP","1504","[TCP segment of a reassembled PDU]"
"10.959044","5.9.29.183","172.19.0.3","TCP","1504","9002 → 43520 [PSH, ACK] Seq=8276 Ack=4258 Win=65535 Len=1448 [TCP segment of a reassembled PDU]"
"10.959170","5.9.29.183","172.19.0.3","TLSv1.2","787","Application Data"
"10.959198","172.19.0.3","5.9.29.183","TCP","56","43520 → 9002 [ACK] Seq=4258 Ack=10455 Win=11895 Len=0"
"11.004907","5.9.29.183","172.19.0.3","TCP","1504","[TCP segment of a reassembled PDU]"
"11.004925","5.9.29.183","172.19.0.3","TCP","1516","9002 → 43520 [PSH, ACK] Seq=11903 Ack=4258 Win=65535 Len=1460 [TCP segment of a reassembled PDU]"
"11.004939","172.19.0.3","5.9.29.183","TCP","56","43520 → 9002 [ACK] Seq=4258 Ack=13363 Win=11903 Len=0"
"11.004941","5.9.29.183","172.19.0.3","TLSv1.2","1492","Application Data [TCP segment of a reassembled PDU]"
"11.020152","5.9.29.183","172.19.0.3","TLSv1.2","396","Application Data"
"11.020182","172.19.0.3","5.9.29.183","TCP","56","43520 → 9002 [ACK] Seq=4258 Ack=15139 Win=11911 Len=0"
"11.056850","5.9.29.183","172.19.0.3","TCP","1516","[TCP segment of a reassembled PDU]"
"11.056883","5.9.29.183","172.19.0.3","TCP","1516","9002 → 43520 [PSH, ACK] Seq=16599 Ack=4258 Win=65535 Len=1460 [TCP segment of a reassembled PDU]"
"11.056894","5.9.29.183","172.19.0.3","TLSv1.2","763","Application Data"
"11.057028","172.19.0.3","5.9.29.183","TCP","56","43520 → 9002 [ACK] Seq=4258 Ack=18766 Win=11895 Len=0"
"11.071781","5.9.29.183","172.19.0.3","TCP","1504","[TCP segment of a reassembled PDU]"
"11.071801","5.9.29.183","172.19.0.3","TCP","1504","9002 → 43520 [PSH, ACK] Seq=20214 Ack=4258 Win=65535 Len=1448 [TCP segment of a reassembled PDU]"
"11.071812","172.19.0.3","5.9.29.183","TCP","56","43520 → 9002 [ACK] Seq=4258 Ack=21662 Win=11903 Len=0"
"11.072113","5.9.29.183","172.19.0.3","TLSv1.2","1330","Application Data, Application Data"
"11.087654","5.9.29.183","172.19.0.3","TLSv1.2","599","Application Data"
"11.087678","172.19.0.3","5.9.29.183","TCP","56","43520 → 9002 [ACK] Seq=4258 Ack=23479 Win=11911 Len=0"
"11.108651","5.9.29.183","172.19.0.3","TCP","1516","[TCP segment of a reassembled PDU]"
"11.108668","5.9.29.183","172.19.0.3","TCP","1492","9002 → 43520 [PSH, ACK] Seq=24939 Ack=4258 Win=65535 Len=1436 [TCP segment of a reassembled PDU]"
"11.108672","5.9.29.183","172.19.0.3","TLSv1.2","787","Application Data"
"11.108752","172.19.0.3","5.9.29.183","TCP","56","43520 → 9002 [ACK] Seq=4258 Ack=27106 Win=11895 Len=0"
"11.133167","5.9.29.183","172.19.0.3","TLSv1.2","599","Application Data"
"11.160939","5.9.29.183","172.19.0.3","TCP","1504","[TCP segment of a reassembled PDU]"
"11.160959","172.19.0.3","5.9.29.183","TCP","56","43520 → 9002 [ACK] Seq=4258 Ack=29097 Win=11911 Len=0"
"11.160971","5.9.29.183","172.19.0.3","TCP","1504","9002 → 43520 [PSH, ACK] Seq=29097 Ack=4258 Win=65535 Len=1448 [TCP segment of a reassembled PDU]"
"11.160975","5.9.29.183","172.19.0.3","TLSv1.2","787","Application Data"
"11.161100","172.19.0.3","5.9.29.183","TCP","56","43520 → 9002 [ACK] Seq=4258 Ack=31276 Win=11895 Len=0"
"11.161300","172.19.0.3","5.9.29.183","TLSv1.2","1113","Application Data"
"11.161589","5.9.29.183","172.19.0.3","TCP","56","9002 → 43520 [ACK] Seq=31276 Ack=5315 Win=65535 Len=0"
"11.186149","5.9.29.183","172.19.0.3","TCP","1516","[TCP segment of a reassembled PDU]"
"11.186181","5.9.29.183","172.19.0.3","TCP","1516","9002 → 43520 [PSH, ACK] Seq=32736 Ack=5315 Win=65535 Len=1460 [TCP segment of a reassembled PDU]"
"11.186189","5.9.29.183","172.19.0.3","TLSv1.2","763","Application Data"
"11.186327","172.19.0.3","5.9.29.183","TCP","56","43520 → 9002 [ACK] Seq=5315 Ack=34903 Win=11895 Len=0"
"11.193306","172.19.0.3","5.9.29.183","TLSv1.2","599","Application Data"
"11.193555","5.9.29.183","172.19.0.3","TCP","56","9002 → 43520 [ACK] Seq=34903 Ack=5858 Win=65535 Len=0"
"11.527828","5.9.29.183","172.19.0.3","TLSv1.2","599","Application Data"
"11.528503","172.19.0.3","5.9.29.183","TLSv1.2","599","Application Data"
"11.528828","5.9.29.183","172.19.0.3","TCP","56","9002 → 43520 [ACK] Seq=35446 Ack=6401 Win=65535 Len=0"
"11.886129","5.9.29.183","172.19.0.3","TCP","1516","[TCP segment of a reassembled PDU]"
"11.886155","5.9.29.183","172.19.0.3","TCP","1492","9002 → 43520 [PSH, ACK] Seq=36906 Ack=6401 Win=65535 Len=1436 [TCP segment of a reassembled PDU]"
"11.886162","5.9.29.183","172.19.0.3","TLSv1.2","787","Application Data"
"11.886257","172.19.0.3","5.9.29.183","TCP","56","43520 → 9002 [ACK] Seq=6401 Ack=39073 Win=11895 Len=0"
"11.916274","5.9.29.183","172.19.0.3","TCP","1516","[TCP segment of a reassembled PDU]"
"11.916319","5.9.29.183","172.19.0.3","TCP","1516","9002 → 43520 [PSH, ACK] Seq=40533 Ack=6401 Win=65535 Len=1460 [TCP segment of a reassembled PDU]"
"11.916335","172.19.0.3","5.9.29.183","TCP","56","43520 → 9002 [ACK] Seq=6401 Ack=41993 Win=11903 Len=0"
"11.916338","5.9.29.183","172.19.0.3","TLSv1.2","1213","Application Data"
"11.931742","5.9.29.183","172.19.0.3","TLSv1.2","149","Application Data"
"11.931920","172.19.0.3","5.9.29.183","TCP","56","43520 → 9002 [ACK] Seq=6401 Ack=43243 Win=11911 Len=0"
"11.941789","5.9.29.183","172.19.0.3","TCP","1504","[TCP segment of a reassembled PDU]"
"11.941818","5.9.29.183","172.19.0.3","TCP","1504","9002 → 43520 [PSH, ACK] Seq=44691 Ack=6401 Win=65535 Len=1448 [TCP segment of a reassembled PDU]"
"11.941929","172.19.0.3","5.9.29.183","TCP","56","43520 → 9002 [ACK] Seq=6401 Ack=46139 Win=11901 Len=0"
"11.946973","5.9.29.183","172.19.0.3","TLSv1.2","787","Application Data"
"11.955419","5.9.29.183","172.19.0.3","TCP","1516","[TCP segment of a reassembled PDU]"
"11.955441","172.19.0.3","5.9.29.183","TCP","56","43520 → 9002 [ACK] Seq=6401 Ack=48330 Win=11911 Len=0"
"11.955454","5.9.29.183","172.19.0.3","TCP","1492","9002 → 43520 [PSH, ACK] Seq=48330 Ack=6401 Win=65535 Len=1436 [TCP segment of a reassembled PDU]"
"11.961996","5.9.29.183","172.19.0.3","TLSv1.2","787","Application Data"
"11.962015","172.19.0.3","5.9.29.183","TCP","56","43520 → 9002 [ACK] Seq=6401 Ack=50497 Win=11911 Len=0"
"11.976978","5.9.29.183","172.19.0.3","TLSv1.2","599","Application Data"
"11.995775","5.9.29.183","172.19.0.3","TCP","1516","[TCP segment of a reassembled PDU]"
"11.995798","172.19.0.3","5.9.29.183","TCP","56","43520 → 9002 [ACK] Seq=6401 Ack=52500 Win=11911 Len=0"
"11.995814","5.9.29.183","172.19.0.3","TCP","1492","9002 → 43520 [PSH, ACK] Seq=52500 Ack=6401 Win=65535 Len=1436 [TCP segment of a reassembled PDU]"
"11.995822","5.9.29.183","172.19.0.3","TLSv1.2","787","Application Data"
"11.995986","172.19.0.3","5.9.29.183","TCP","56","43520 → 9002 [ACK] Seq=6401 Ack=54667 Win=11895 Len=0"
"12.019271","5.9.29.183","172.19.0.3","TCP","1516","[TCP segment of a reassembled PDU]"
"12.019298","5.9.29.183","172.19.0.3","TCP","1516","9002 → 43520 [PSH, ACK] Seq=56127 Ack=6401 Win=65535 Len=1460 [TCP segment of a reassembled PDU]"
"12.019310","172.19.0.3","5.9.29.183","TCP","56","43520 → 9002 [ACK] Seq=6401 Ack=57587 Win=11903 Len=0"
"12.019312","5.9.29.183","172.19.0.3","TLSv1.2","1213","Application Data"
"12.034529","5.9.29.183","172.19.0.3","TLSv1.2","149","Application Data"
"12.034794","172.19.0.3","5.9.29.183","TCP","56","43520 → 9002 [ACK] Seq=6401 Ack=58837 Win=11911 Len=0"
"12.049715","5.9.29.183","172.19.0.3","TLSv1.2","1113","Application Data"
"12.054519","5.9.29.183","172.19.0.3","TCP","1504","[TCP segment of a reassembled PDU]"
"12.054540","172.19.0.3","5.9.29.183","TCP","56","43520 → 9002 [ACK] Seq=6401 Ack=61342 Win=11911 Len=0"
"12.065004","5.9.29.183","172.19.0.3","TLSv1.2","1207","Application Data"
"12.065536","172.19.0.3","5.9.29.183","TLSv1.2","599","Application Data"
"12.065932","5.9.29.183","172.19.0.3","TCP","56","9002 → 43520 [ACK] Seq=62493 Ack=6944 Win=65535 Len=0"
"12.075377","172.19.0.3","5.9.29.183","TLSv1.2","599","Application Data"
"12.075690","5.9.29.183","172.19.0.3","TCP","56","9002 → 43520 [ACK] Seq=62493 Ack=7487 Win=65535 Len=0"
"12.132341","02:42:7b:11:31:3d","","ARP","44","Who has 172.19.0.3? Tell 172.19.0.1"
"12.132355","02:42:ac:13:00:03","","ARP","44","172.19.0.3 is at 02:42:ac:13:00:03"
"12.397067","5.9.29.183","172.19.0.3","TLSv1.2","599","Application Data"
"12.397763","172.19.0.3","5.9.29.183","TLSv1.2","599","Application Data"
"12.398004","5.9.29.183","172.19.0.3","TCP","56","9002 → 43520 [ACK] Seq=63036 Ack=8030 Win=65535 Len=0"
"12.695826","5.9.29.183","172.19.0.3","TLSv1.2","599","Application Data"
"12.735299","5.9.29.183","172.19.0.3","TCP","1504","[TCP segment of a reassembled PDU]"
"12.735324","172.19.0.3","5.9.29.183","TCP","56","43520 → 9002 [ACK] Seq=8030 Ack=65027 Win=11911 Len=0"
"12.735355","5.9.29.183","172.19.0.3","TCP","332","9002 → 43520 [PSH, ACK] Seq=65027 Ack=8030 Win=65535 Len=276 [TCP segment of a reassembled PDU]"
"12.735371","5.9.29.183","172.19.0.3","TCP","1516","9002 → 43520 [PSH, ACK] Seq=65303 Ack=8030 Win=65535 Len=1460 [TCP segment of a reassembled PDU]"
"12.735375","5.9.29.183","172.19.0.3","TLSv1.2","1516","Application Data [TCP segment of a reassembled PDU]"
"12.735379","5.9.29.183","172.19.0.3","TCP","1516","9002 → 43520 [PSH, ACK] Seq=68223 Ack=8030 Win=65535 Len=1460 [TCP segment of a reassembled PDU]"
"12.735383","5.9.29.183","172.19.0.3","TCP","925","9002 → 43520 [PSH, ACK] Seq=69683 Ack=8030 Win=65535 Len=869 [TCP segment of a reassembled PDU]"
"12.735574","172.19.0.3","5.9.29.183","TCP","56","43520 → 9002 [ACK] Seq=8030 Ack=70552 Win=11871 Len=0"
"12.750491","5.9.29.183","172.19.0.3","TLSv1.2","337","Application Data"
"12.764635","5.9.29.183","172.19.0.3","TCP","1516","[TCP segment of a reassembled PDU]"
"12.764658","172.19.0.3","5.9.29.183","TCP","56","43520 → 9002 [ACK] Seq=8030 Ack=72293 Win=11911 Len=0"
"12.764675","5.9.29.183","172.19.0.3","TCP","1492","9002 → 43520 [PSH, ACK] Seq=72293 Ack=8030 Win=65535 Len=1436 [TCP segment of a reassembled PDU]"
"12.765361","5.9.29.183","172.19.0.3","TLSv1.2","787","Application Data"
"12.765378","172.19.0.3","5.9.29.183","TCP","56","43520 → 9002 [ACK] Seq=8030 Ack=74460 Win=11911 Len=0"
"12.780938","5.9.29.183","172.19.0.3","TLSv1.2","599","Application Data"
"12.787933","5.9.29.183","172.19.0.3","TCP","1516","[TCP segment of a reassembled PDU]"
"12.788002","172.19.0.3","5.9.29.183","TCP","56","43520 → 9002 [ACK] Seq=8030 Ack=76463 Win=11911 Len=0"
"12.788016","5.9.29.183","172.19.0.3","TCP","1516","9002 → 43520 [PSH, ACK] Seq=76463 Ack=8030 Win=65535 Len=1460 [TCP segment of a reassembled PDU]"
"12.788024","5.9.29.183","172.19.0.3","TLSv1.2","1516","Application Data [TCP segment of a reassembled PDU]"
"12.788028","5.9.29.183","172.19.0.3","TCP","1468","9002 → 43520 [PSH, ACK] Seq=79383 Ack=8030 Win=65535 Len=1412 [TCP segment of a reassembled PDU]"
"12.788190","172.19.0.3","5.9.29.183","TCP","56","43520 → 9002 [ACK] Seq=8030 Ack=80795 Win=11887 Len=0"
"12.796290","5.9.29.183","172.19.0.3","TCP","1504","9002 → 43520 [PSH, ACK] Seq=80795 Ack=8030 Win=65535 Len=1448 [TCP segment of a reassembled PDU]"
"12.836539","5.9.29.183","172.19.0.3","TLSv1.2","1504","Application Data, Application Data"
"12.836557","172.19.0.3","5.9.29.183","TCP","56","43520 → 9002 [ACK] Seq=8030 Ack=83691 Win=11911 Len=0"
"12.852199","5.9.29.183","172.19.0.3","TCP","1516","9002 → 43520 [PSH, ACK] Seq=83691 Ack=8030 Win=65535 Len=1460 [TCP segment of a reassembled PDU]"
"12.852226","5.9.29.183","172.19.0.3","TCP","1492","9002 → 43520 [PSH, ACK] Seq=85151 Ack=8030 Win=65535 Len=1436 [TCP segment of a reassembled PDU]"
"12.852354","5.9.29.183","172.19.0.3","TLSv1.2","1516","Application Data [TCP segment of a reassembled PDU]"
"12.852357","5.9.29.183","172.19.0.3","TLSv1.2","1035","Application Data"
"12.852366","172.19.0.3","5.9.29.183","TCP","56","43520 → 9002 [ACK] Seq=8030 Ack=86587 Win=11911 Len=0"
"12.852425","172.19.0.3","5.9.29.183","TCP","56","43520 → 9002 [ACK] Seq=8030 Ack=89026 Win=11903 Len=0"
"12.852630","172.19.0.3","5.9.29.183","TLSv1.2","599","Application Data"
"12.852786","5.9.29.183","172.19.0.3","TCP","56","9002 → 43520 [ACK] Seq=89026 Ack=8573 Win=65535 Len=0"
"12.862772","172.19.0.3","5.9.29.183","TLSv1.2","599","Application Data"
"12.863237","5.9.29.183","172.19.0.3","TCP","56","9002 → 43520 [ACK] Seq=89026 Ack=9116 Win=65535 Len=0"
"12.875771","5.9.29.183","172.19.0.3","TCP","1516","[TCP segment of a reassembled PDU]"
"12.875801","5.9.29.183","172.19.0.3","TCP","1516","9002 → 43520 [PSH, ACK] Seq=90486 Ack=9116 Win=65535 Len=1460 [TCP segment of a reassembled PDU]"
"12.875807","5.9.29.183","172.19.0.3","TLSv1.2","249","Application Data"
"12.875925","172.19.0.3","5.9.29.183","TCP","56","43520 → 9002 [ACK] Seq=9116 Ack=92139 Win=11895 Len=0"
"12.894451","5.9.29.183","172.19.0.3","TCP","1516","[TCP segment of a reassembled PDU]"
"12.894528","5.9.29.183","172.19.0.3","TCP","1516","9002 → 43520 [PSH, ACK] Seq=93599 Ack=9116 Win=65535 Len=1460 [TCP segment of a reassembled PDU]"
"12.894553","172.19.0.3","5.9.29.183","TCP","56","43520 → 9002 [ACK] Seq=9116 Ack=95059 Win=11901 Len=0"
"12.894557","5.9.29.183","172.19.0.3","TLSv1.2","763","Application Data"
"12.906178","5.9.29.183","172.19.0.3","TCP","1504","[TCP segment of a reassembled PDU]"
"12.906201","172.19.0.3","5.9.29.183","TCP","56","43520 → 9002 [ACK] Seq=9116 Ack=97214 Win=11911 Len=0"
"12.906217","5.9.29.183","172.19.0.3","TCP","1516","9002 → 43520 [PSH, ACK] Seq=97214 Ack=9116 Win=65535 Len=1460 [TCP segment of a reassembled PDU]"
"12.906224","5.9.29.183","172.19.0.3","TLSv1.2","1492","Application Data [TCP segment of a reassembled PDU]"
"12.906399","172.19.0.3","5.9.29.183","TCP","56","43520 → 9002 [ACK] Seq=9116 Ack=100110 Win=11895 Len=0"
"12.911846","5.9.29.183","172.19.0.3","TLSv1.2","1504","Application Data [TCP segment of a reassembled PDU]"
"12.911876","5.9.29.183","172.19.0.3","TCP","1516","9002 → 43520 [PSH, ACK] Seq=101558 Ack=9116 Win=65535 Len=1460 [TCP segment of a reassembled PDU]"
"12.911889","172.19.0.3","5.9.29.183","TCP","56","43520 → 9002 [ACK] Seq=9116 Ack=103018 Win=11903 Len=0"
"12.911891","5.9.29.183","172.19.0.3","TLSv1.2","1115","Application Data"
"12.928493","5.9.29.183","172.19.0.3","TCP","1516","[TCP segment of a reassembled PDU]"
"12.928514","172.19.0.3","5.9.29.183","TCP","56","43520 → 9002 [ACK] Seq=9116 Ack=105537 Win=11911 Len=0"
"12.928528","5.9.29.183","172.19.0.3","TCP","1516","9002 → 43520 [PSH, ACK] Seq=105537 Ack=9116 Win=65535 Len=1460 [TCP segment of a reassembled PDU]"
"12.928534","5.9.29.183","172.19.0.3","TLSv1.2","763","Application Data"
"12.928728","172.19.0.3","5.9.29.183","TCP","56","43520 → 9002 [ACK] Seq=9116 Ack=107704 Win=11895 Len=0"
"12.960540","5.9.29.183","172.19.0.3","TCP","1504","[TCP segment of a reassembled PDU]"
"12.960742","5.9.29.183","172.19.0.3","TCP","1504","9002 → 43520 [PSH, ACK] Seq=109152 Ack=9116 Win=65535 Len=1448 [TCP segment of a reassembled PDU]"
"12.960799","172.19.0.3","5.9.29.183","TCP","56","43520 → 9002 [ACK] Seq=9116 Ack=110600 Win=11903 Len=0"
"12.960870","5.9.29.183","172.19.0.3","TLSv1.2","1237","Application Data"
"12.976270","5.9.29.183","172.19.0.3","TLSv1.2","149","Application Data"
"12.976405","172.19.0.3","5.9.29.183","TCP","56","43520 → 9002 [ACK] Seq=9116 Ack=111874 Win=11911 Len=0"
"12.992537","5.9.29.183","172.19.0.3","TCP","1504","[TCP segment of a reassembled PDU]"
"12.992555","5.9.29.183","172.19.0.3","TCP","1516","9002 → 43520 [PSH, ACK] Seq=113322 Ack=9116 Win=65535 Len=1460 [TCP segment of a reassembled PDU]"
"12.992558","5.9.29.183","172.19.0.3","TLSv1.2","1225","Application Data"
"12.992639","172.19.0.3","5.9.29.183","TCP","56","43520 → 9002 [ACK] Seq=9116 Ack=115951 Win=11895 Len=0"
"12.992886","172.19.0.3","5.9.29.183","TLSv1.2","599","Application Data"
"12.993059","5.9.29.183","172.19.0.3","TCP","56","9002 → 43520 [ACK] Seq=115951 Ack=9659 Win=65535 Len=0"
"13.003664","5.9.29.183","172.19.0.3","TLSv1.2","1516","Application Data"
"13.003690","5.9.29.183","172.19.0.3","TCP","1492","9002 → 43520 [PSH, ACK] Seq=117411 Ack=9659 Win=65535 Len=1436 [TCP segment of a reassembled PDU]"
"13.003694","5.9.29.183","172.19.0.3","TLSv1.2","1504","Application Data [TCP segment of a reassembled PDU]"
"13.003791","172.19.0.3","5.9.29.183","TCP","56","43520 → 9002 [ACK] Seq=9659 Ack=120295 Win=11893 Len=0"
"13.007974","5.9.29.183","172.19.0.3","TLSv1.2","1003","Application Data"
"13.008245","5.9.29.183","172.19.0.3","TCP","1504","[TCP segment of a reassembled PDU]"
"13.008252","172.19.0.3","5.9.29.183","TCP","56","43520 → 9002 [ACK] Seq=9659 Ack=122690 Win=11911 Len=0"
"13.023504","5.9.29.183","172.19.0.3","TLSv1.2","1207","Application Data"
"13.041324","5.9.29.183","172.19.0.3","TCP","1516","[TCP segment of a reassembled PDU]"
"13.041349","172.19.0.3","5.9.29.183","TCP","56","43520 → 9002 [ACK] Seq=9659 Ack=125301 Win=11911 Len=0"
"13.041365","5.9.29.183","172.19.0.3","TLSv1.2","167","Application Data"
"13.046520","172.19.0.3","5.9.29.183","TLSv1.2","599","Application Data"
"13.046826","5.9.29.183","172.19.0.3","TCP","56","9002 → 43520 [ACK] Seq=125412 Ack=10202 Win=65535 Len=0"
"13.377274","5.9.29.183","172.19.0.3","TLSv1.2","599","Application Data"
"13.377923","172.19.0.3","5.9.29.183","TLSv1.2","599","Application Data"
"13.378104","5.9.29.183","172.19.0.3","TCP","56","9002 → 43520 [ACK] Seq=125955 Ack=10745 Win=65535 Len=0"
"13.680168","5.9.29.183","172.19.0.3","TLSv1.2","599","Application Data"
"13.708716","5.9.29.183","172.19.0.3","TCP","1516","[TCP segment of a reassembled PDU]"
"13.708738","172.19.0.3","5.9.29.183","TCP","56","43520 → 9002 [ACK] Seq=10745 Ack=127958 Win=11911 Len=0"
"13.708751","5.9.29.183","172.19.0.3","TCP","1516","9002 → 43520 [PSH, ACK] Seq=127958 Ack=10745 Win=65535 Len=1460 [TCP segment of a reassembled PDU]"
"13.708760","5.9.29.183","172.19.0.3","TLSv1.2","763","Application Data"
"13.708914","172.19.0.3","5.9.29.183","TCP","56","43520 → 9002 [ACK] Seq=10745 Ack=130125 Win=11895 Len=0"
"13.723565","5.9.29.183","172.19.0.3","TCP","770","[TCP segment of a reassembled PDU]"
"13.723577","5.9.29.183","172.19.0.3","TCP","1516","9002 → 43520 [PSH, ACK] Seq=130839 Ack=10745 Win=65535 Len=1460 [TCP segment of a reassembled PDU]"
"13.723584","172.19.0.3","5.9.29.183","TCP","56","43520 → 9002 [ACK] Seq=10745 Ack=132299 Win=11903 Len=0"
"13.723586","5.9.29.183","172.19.0.3","TCP","778","9002 → 43520 [PSH, ACK] Seq=132299 Ack=10745 Win=65535 Len=722 [TCP segment of a reassembled PDU]"
"13.724075","5.9.29.183","172.19.0.3","TLSv1.2","1330","Application Data, Application Data"
"13.724083","172.19.0.3","5.9.29.183","TCP","56","43520 → 9002 [ACK] Seq=10745 Ack=134295 Win=11911 Len=0"
"13.746778","5.9.29.183","172.19.0.3","TCP","1516","[TCP segment of a reassembled PDU]"
"13.746819","5.9.29.183","172.19.0.3","TCP","1516","9002 → 43520 [PSH, ACK] Seq=135755 Ack=10745 Win=65535 Len=1460 [TCP segment of a reassembled PDU]"
"13.746826","5.9.29.183","172.19.0.3","TLSv1.2","763","Application Data"
"13.746952","172.19.0.3","5.9.29.183","TCP","56","43520 → 9002 [ACK] Seq=10745 Ack=137922 Win=11895 Len=0"
"13.762019","5.9.29.183","172.19.0.3","TCP","1516","[TCP segment of a reassembled PDU]"
"13.762043","5.9.29.183","172.19.0.3","TLSv1.2","167","Application Data"
"13.762056","172.19.0.3","5.9.29.183","TCP","56","43520 → 9002 [ACK] Seq=10745 Ack=139493 Win=11903 Len=0"
"13.762393","172.19.0.3","5.9.29.183","TLSv1.2","599","Application Data"
"13.762719","5.9.29.183","172.19.0.3","TCP","56","9002 → 43520 [ACK] Seq=139493 Ack=11288 Win=65535 Len=0"
"13.774773","5.9.29.183","172.19.0.3","TCP","1516","[TCP segment of a reassembled PDU]"
"13.774804","5.9.29.183","172.19.0.3","TCP","1492","9002 → 43520 [PSH, ACK] Seq=140953 Ack=11288 Win=65535 Len=1436 [TCP segment of a reassembled PDU]"
"13.774917","172.19.0.3","5.9.29.183","TCP","56","43520 → 9002 [ACK] Seq=11288 Ack=142389 Win=11903 Len=0"
"13.776943","5.9.29.183","172.19.0.3","TLSv1.2","787","Application Data"
"13.785799","5.9.29.183","172.19.0.3","TCP","1504","[TCP segment of a reassembled PDU]"
"13.785818","172.19.0.3","5.9.29.183","TCP","56","43520 → 9002 [ACK] Seq=11288 Ack=144568 Win=11911 Len=0"
"13.785830","5.9.29.183","172.19.0.3","TCP","1504","9002 → 43520 [PSH, ACK] Seq=144568 Ack=11288 Win=65535 Len=1448 [TCP segment of a reassembled PDU]"
"13.792193","5.9.29.183","172.19.0.3","TLSv1.2","1330","Application Data, Application Data"
"13.792215","172.19.0.3","5.9.29.183","TCP","56","43520 → 9002 [ACK] Seq=11288 Ack=147290 Win=11911 Len=0"
"13.812161","5.9.29.183","172.19.0.3","TCP","1504","[TCP segment of a reassembled PDU]"
"13.812266","5.9.29.183","172.19.0.3","TCP","1516","9002 → 43520 [PSH, ACK] Seq=148738 Ack=11288 Win=65535 Len=1460 [TCP segment of a reassembled PDU]"
"13.812274","5.9.29.183","172.19.0.3","TLSv1.2","1225","Application Data"
"13.812356","172.19.0.3","5.9.29.183","TCP","56","43520 → 9002 [ACK] Seq=11288 Ack=151367 Win=11895 Len=0"
"13.827855","5.9.29.183","172.19.0.3","TLSv1.2","1206","Application Data, Application Data"
"13.828231","172.19.0.3","5.9.29.183","TLSv1.2","599","Application Data"
"13.828517","5.9.29.183","172.19.0.3","TCP","56","9002 → 43520 [ACK] Seq=152517 Ack=11831 Win=65535 Len=0"
"13.841671","5.9.29.183","172.19.0.3","TCP","1504","[TCP segment of a reassembled PDU]"
"13.842929","5.9.29.183","172.19.0.3","TLSv1.2","179","Application Data"
"13.842941","172.19.0.3","5.9.29.183","TCP","56","43520 → 9002 [ACK] Seq=11831 Ack=154088 Win=11911 Len=0"
"13.884651","5.9.29.183","172.19.0.3","TCP","1504","[TCP segment of a reassembled PDU]"
"13.884681","5.9.29.183","172.19.0.3","TCP","1516","9002 → 43520 [PSH, ACK] Seq=155536 Ack=11831 Win=65535 Len=1460 [TCP segment of a reassembled PDU]"
"13.884686","5.9.29.183","172.19.0.3","TLSv1.2","1225","Application Data"
"13.884689","5.9.29.183","172.19.0.3","TCP","1516","[TCP segment of a reassembled PDU]"
"13.884695","5.9.29.183","172.19.0.3","TCP","1492","9002 → 43520 [PSH, ACK] Seq=159625 Ack=11831 Win=65535 Len=1436 [TCP segment of a reassembled PDU]"
"13.884803","172.19.0.3","5.9.29.183","TCP","56","43520 → 9002 [ACK] Seq=11831 Ack=161061 Win=11879 Len=0"
"13.889234","5.9.29.183","172.19.0.3","TLSv1.2","1516","Application Data, Application Data"
"13.889264","5.9.29.183","172.19.0.3","TCP","1492","9002 → 43520 [PSH, ACK] Seq=162521 Ack=11831 Win=65535 Len=1436 [TCP segment of a reassembled PDU]"
"13.889279","172.19.0.3","5.9.29.183","TCP","56","43520 → 9002 [ACK] Seq=11831 Ack=163957 Win=11903 Len=0"
"13.900314","5.9.29.183","172.19.0.3","TCP","1504","9002 → 43520 [PSH, ACK] Seq=163957 Ack=11831 Win=65535 Len=1448 [TCP segment of a reassembled PDU]"
"13.900341","5.9.29.183","172.19.0.3","TLSv1.2","163","Application Data"
"13.900352","172.19.0.3","5.9.29.183","TCP","56","43520 → 9002 [ACK] Seq=11831 Ack=165512 Win=11903 Len=0"
"13.915268","5.9.29.183","172.19.0.3","TCP","1504","[TCP segment of a reassembled PDU]"
"13.915441","5.9.29.183","172.19.0.3","TCP","1516","9002 → 43520 [PSH, ACK] Seq=166960 Ack=11831 Win=65535 Len=1460 [TCP segment of a reassembled PDU]"
"13.915451","5.9.29.183","172.19.0.3","TLSv1.2","1516","Application Data [TCP segment of a reassembled PDU]"
"13.915454","5.9.29.183","172.19.0.3","TLSv1.2","372","Application Data"
"13.915538","172.19.0.3","5.9.29.183","TCP","56","43520 → 9002 [ACK] Seq=11831 Ack=170196 Win=11885 Len=0"
"13.922274","5.9.29.183","172.19.0.3","TCP","1516","[TCP segment of a reassembled PDU]"
"13.922308","5.9.29.183","172.19.0.3","TCP","1492","9002 → 43520 [PSH, ACK] Seq=171656 Ack=11831 Win=65535 Len=1436 [TCP segment of a reassembled PDU]"
"13.922327","172.19.0.3","5.9.29.183","TCP","56","43520 → 9002 [ACK] Seq=11831 Ack=173092 Win=11903 Len=0"
"13.930537","5.9.29.183","172.19.0.3","TLSv1.2","787","Application Data"
"13.966034","5.9.29.183","172.19.0.3","TCP","1516","[TCP segment of a reassembled PDU]"
"13.966057","172.19.0.3","5.9.29.183","TCP","56","43520 → 9002 [ACK] Seq=11831 Ack=175283 Win=11911 Len=0"
"13.966071","5.9.29.183","172.19.0.3","TLSv1.2","681","Application Data"
"13.970230","172.19.0.3","5.9.29.183","TLSv1.2","599","Application Data"
"13.970527","5.9.29.183","172.19.0.3","TCP","56","9002 → 43520 [ACK] Seq=175908 Ack=12374 Win=65535 Len=0"
"14.238007","5.9.29.183","172.19.0.3","TLSv1.2","599","Application Data"
"14.238802","172.19.0.3","5.9.29.183","TLSv1.2","599","Application Data"
"14.239161","5.9.29.183","172.19.0.3","TCP","56","9002 → 43520 [ACK] Seq=176451 Ack=12917 Win=65535 Len=0"
"14.573397","5.9.29.183","172.19.0.3","TCP","1516","[TCP segment of a reassembled PDU]"
"14.573427","5.9.29.183","172.19.0.3","TCP","1516","9002 → 43520 [PSH, ACK] Seq=177911 Ack=12917 Win=65535 Len=1460 [TCP segment of a reassembled PDU]"
"14.573435","5.9.29.183","172.19.0.3","TLSv1.2","763","Application Data"
"14.573548","172.19.0.3","5.9.29.183","TCP","56","43520 → 9002 [ACK] Seq=12917 Ack=180078 Win=11895 Len=0"
"14.587189","5.9.29.183","172.19.0.3","TCP","1516","[TCP segment of a reassembled PDU]"
"14.587217","5.9.29.183","172.19.0.3","TCP","1492","9002 → 43520 [PSH, ACK] Seq=181538 Ack=12917 Win=65535 Len=1436 [TCP segment of a reassembled PDU]"
"14.587229","172.19.0.3","5.9.29.183","TCP","56","43520 → 9002 [ACK] Seq=12917 Ack=182974 Win=11903 Len=0"
"14.588292","5.9.29.183","172.19.0.3","TLSv1.2","787","Application Data"
"14.602960","5.9.29.183","172.19.0.3","TCP","1504","[TCP segment of a reassembled PDU]"
"14.602981","172.19.0.3","5.9.29.183","TCP","56","43520 → 9002 [ACK] Seq=12917 Ack=185153 Win=11911 Len=0"
"14.602995","5.9.29.183","172.19.0.3","TCP","1504","9002 → 43520 [PSH, ACK] Seq=185153 Ack=12917 Win=65535 Len=1448 [TCP segment of a reassembled PDU]"
"14.604240","5.9.29.183","172.19.0.3","TLSv1.2","1330","Application Data, Application Data"
"14.604250","172.19.0.3","5.9.29.183","TCP","56","43520 → 9002 [ACK] Seq=12917 Ack=187875 Win=11911 Len=0"
"14.617425","5.9.29.183","172.19.0.3","TCP","1516","[TCP segment of a reassembled PDU]"
"14.617456","5.9.29.183","172.19.0.3","TCP","1492","9002 → 43520 [PSH, ACK] Seq=189335 Ack=12917 Win=65535 Len=1436 [TCP segment of a reassembled PDU]"
"14.617585","172.19.0.3","5.9.29.183","TCP","56","43520 → 9002 [ACK] Seq=12917 Ack=190771 Win=11903 Len=0"
"14.619903","5.9.29.183","172.19.0.3","TLSv1.2","1330","Application Data, Application Data"
"14.620390","172.19.0.3","5.9.29.183","TLSv1.2","599","Application Data"
"14.620886","5.9.29.183","172.19.0.3","TCP","56","9002 → 43520 [ACK] Seq=192045 Ack=13460 Win=65535 Len=0"
"14.677966","5.9.29.183","172.19.0.3","TCP","1504","[TCP segment of a reassembled PDU]"
"14.677997","5.9.29.183","172.19.0.3","TCP","1516","9002 → 43520 [PSH, ACK] Seq=193493 Ack=13460 Win=65535 Len=1460 [TCP segment of a reassembled PDU]"
"14.678006","5.9.29.183","172.19.0.3","TLSv1.2","775","Application Data"
"14.678129","172.19.0.3","5.9.29.183","TCP","56","43520 → 9002 [ACK] Seq=13460 Ack=195672 Win=11895 Len=0"
"14.688983","5.9.29.183","172.19.0.3","TCP","759","[TCP segment of a reassembled PDU]"
"14.689013","5.9.29.183","172.19.0.3","TCP","1516","9002 → 43520 [PSH, ACK] Seq=196375 Ack=13460 Win=65535 Len=1460 [TCP segment of a reassembled PDU]"
"14.689026","172.19.0.3","5.9.29.183","TCP","56","43520 → 9002 [ACK] Seq=13460 Ack=197835 Win=11903 Len=0"
"14.689028","5.9.29.183","172.19.0.3","TCP","1516","9002 → 43520 [PSH, ACK] Seq=197835 Ack=13460 Win=65535 Len=1460 [TCP segment of a reassembled PDU]"
"14.689032","5.9.29.183","172.19.0.3","TLSv1.2","777","Application Data [TCP segment of a reassembled PDU]"
"14.689192","172.19.0.3","5.9.29.183","TCP","56","43520 → 9002 [ACK] Seq=13460 Ack=200016 Win=11886 Len=0"
"14.693022","5.9.29.183","172.19.0.3","TLSv1.2","396","Application Data"
"14.734746","172.19.0.3","5.9.29.183","TCP","56","43520 → 9002 [ACK] Seq=13460 Ack=200356 Win=11911 Len=0"
"14.738138","5.9.29.183","172.19.0.3","TCP","1516","[TCP segment of a reassembled PDU]"
"14.738162","172.19.0.3","5.9.29.183","TCP","56","43520 → 9002 [ACK] Seq=13460 Ack=201816 Win=11911 Len=0"
"14.738179","5.9.29.183","172.19.0.3","TCP","1516","9002 → 43520 [PSH, ACK] Seq=201816 Ack=13460 Win=65535 Len=1460 [TCP segment of a reassembled PDU]"
"14.738196","172.19.0.3","5.9.29.183","TCP","56","43520 → 9002 [ACK] Seq=13460 Ack=203276 Win=11903 Len=0"
"14.738197","5.9.29.183","172.19.0.3","TLSv1.2","249","Application Data"
"14.738206","172.19.0.3","5.9.29.183","TCP","56","43520 → 9002 [ACK] Seq=13460 Ack=203469 Win=11902 Len=0"
"14.738601","172.19.0.3","5.9.29.183","TLSv1.2","599","Application Data"
"14.738895","5.9.29.183","172.19.0.3","TCP","56","9002 → 43520 [ACK] Seq=203469 Ack=14003 Win=65535 Len=0"
"14.767328","5.9.29.183","172.19.0.3","TLSv1.2","1113","Application Data"
"14.771903","172.19.0.3","5.9.29.183","TLSv1.2","599","Application Data"
"14.772176","5.9.29.183","172.19.0.3","TCP","56","9002 → 43520 [ACK] Seq=204526 Ack=14546 Win=65535 Len=0"
"15.183213","5.9.29.183","172.19.0.3","TLSv1.2","599","Application Data"
"15.184095","172.19.0.3","5.9.29.183","TLSv1.2","599","Application Data"
"15.184442","5.9.29.183","172.19.0.3","TCP","56","9002 → 43520 [ACK] Seq=205069 Ack=15089 Win=65535 Len=0"
"15.544289","5.9.29.183","172.19.0.3","TCP","1504","[TCP segment of a reassembled PDU]"
"15.544318","5.9.29.183","172.19.0.3","TCP","1516","9002 → 43520 [PSH, ACK] Seq=206517 Ack=15089 Win=65535 Len=1460 [TCP segment of a reassembled PDU]"
"15.544325","5.9.29.183","172.19.0.3","TLSv1.2","775","Application Data"
"15.544449","172.19.0.3","5.9.29.183","TCP","56","43520 → 9002 [ACK] Seq=15089 Ack=208696 Win=11895 Len=0"
"15.554901","5.9.29.183","172.19.0.3","TCP","1516","[TCP segment of a reassembled PDU]"
"15.554932","5.9.29.183","172.19.0.3","TCP","1492","9002 → 43520 [PSH, ACK] Seq=210156 Ack=15089 Win=65535 Len=1436 [TCP segment of a reassembled PDU]"
"15.554947","172.19.0.3","5.9.29.183","TCP","56","43520 → 9002 [ACK] Seq=15089 Ack=211592 Win=11903 Len=0"
"15.559778","5.9.29.183","172.19.0.3","TLSv1.2","787","Application Data"
"15.580965","5.9.29.183","172.19.0.3","TCP","1504","[TCP segment of a reassembled PDU]"
"15.581012","172.19.0.3","5.9.29.183","TCP","56","43520 → 9002 [ACK] Seq=15089 Ack=213771 Win=11911 Len=0"
"15.581025","5.9.29.183","172.19.0.3","TCP","1516","9002 → 43520 [PSH, ACK] Seq=213771 Ack=15089 Win=65535 Len=1460 [TCP segment of a reassembled PDU]"
"15.581033","5.9.29.183","172.19.0.3","TLSv1.2","1516","Application Data [TCP segment of a reassembled PDU]"
"15.581036","5.9.29.183","172.19.0.3","TCP","1516","9002 → 43520 [PSH, ACK] Seq=216691 Ack=15089 Win=65535 Len=1460 [TCP segment of a reassembled PDU]"
"15.581133","5.9.29.183","172.19.0.3","TCP","1201","9002 → 43520 [PSH, ACK] Seq=218151 Ack=15089 Win=65535 Len=1145 [TCP segment of a reassembled PDU]"
"15.581201","172.19.0.3","5.9.29.183","TCP","56","43520 → 9002 [ACK] Seq=15089 Ack=219296 Win=11879 Len=0"
"15.595925","5.9.29.183","172.19.0.3","TLSv1.2","1504","Application Data [TCP segment of a reassembled PDU]"
"15.595949","5.9.29.183","172.19.0.3","TCP","1504","9002 → 43520 [PSH, ACK] Seq=220744 Ack=15089 Win=65535 Len=1448 [TCP segment of a reassembled PDU]"
"15.595959","172.19.0.3","5.9.29.183","TCP","56","43520 → 9002 [ACK] Seq=15089 Ack=222192 Win=11903 Len=0"
"15.595961","5.9.29.183","172.19.0.3","TCP","1504","9002 → 43520 [PSH, ACK] Seq=222192 Ack=15089 Win=65535 Len=1448 [TCP segment of a reassembled PDU]"
"15.595963","5.9.29.183","172.19.0.3","TLSv1.2","1504","Application Data [TCP segment of a reassembled PDU]"
"15.596082","172.19.0.3","5.9.29.183","TCP","56","43520 → 9002 [ACK] Seq=15089 Ack=225088 Win=11887 Len=0"
"15.638452","5.9.29.183","172.19.0.3","TCP","1504","9002 → 43520 [PSH, ACK] Seq=225088 Ack=15089 Win=65535 Len=1448 [TCP segment of a reassembled PDU]"
"15.682153","172.19.0.3","5.9.29.183","TCP","56","43520 → 9002 [ACK] Seq=15089 Ack=226536 Win=11911 Len=0"
"15.699024","5.9.29.183","172.19.0.3","TCP","1516","9002 → 43520 [PSH, ACK] Seq=226536 Ack=15089 Win=65535 Len=1460 [TCP segment of a reassembled PDU]"
"15.699050","172.19.0.3","5.9.29.183","TCP","56","43520 → 9002 [ACK] Seq=15089 Ack=227996 Win=11911 Len=0"
"15.699066","5.9.29.183","172.19.0.3","TLSv1.2","1516","Application Data, Application Data"
"15.699078","172.19.0.3","5.9.29.183","TCP","56","43520 → 9002 [ACK] Seq=15089 Ack=229456 Win=11901 Len=0"
"15.699079","5.9.29.183","172.19.0.3","TCP","1516","9002 → 43520 [PSH, ACK] Seq=229456 Ack=15089 Win=65535 Len=1460 [TCP segment of a reassembled PDU]"
"15.699084","172.19.0.3","5.9.29.183","TCP","56","43520 → 9002 [ACK] Seq=15089 Ack=230916 Win=11893 Len=0"
"15.699086","5.9.29.183","172.19.0.3","TCP","1468","9002 → 43520 [PSH, ACK] Seq=230916 Ack=15089 Win=65535 Len=1412 [TCP segment of a reassembled PDU]"
"15.699092","172.19.0.3","5.9.29.183","TCP","56","43520 → 9002 [ACK] Seq=15089 Ack=232328 Win=11885 Len=0"
"15.699288","5.9.29.183","172.19.0.3","TLSv1.2","1516","Application Data [TCP segment of a reassembled PDU]"
"15.699300","172.19.0.3","5.9.29.183","TCP","56","43520 → 9002 [ACK] Seq=15089 Ack=233788 Win=11877 Len=0"
"15.699303","5.9.29.183","172.19.0.3","TCP","1516","9002 → 43520 [PSH, ACK] Seq=233788 Ack=15089 Win=65535 Len=1460 [TCP segment of a reassembled PDU]"
"15.699310","172.19.0.3","5.9.29.183","TCP","56","43520 → 9002 [ACK] Seq=15089 Ack=235248 Win=11869 Len=0"
"15.699311","5.9.29.183","172.19.0.3","TLSv1.2","978","Application Data"
"15.699316","172.19.0.3","5.9.29.183","TCP","56","43520 → 9002 [ACK] Seq=15089 Ack=236170 Win=11862 Len=0"
"15.700071","172.19.0.3","5.9.29.183","TLSv1.2","599","Application Data"
"15.700345","5.9.29.183","172.19.0.3","TCP","56","9002 → 43520 [ACK] Seq=236170 Ack=15632 Win=65535 Len=0"
"15.717201","5.9.29.183","172.19.0.3","TCP","1504","[TCP segment of a reassembled PDU]"
"15.717225","5.9.29.183","172.19.0.3","TCP","1516","9002 → 43520 [PSH, ACK] Seq=237618 Ack=15632 Win=65535 Len=1460 [TCP segment of a reassembled PDU]"
"15.717236","172.19.0.3","5.9.29.183","TCP","56","43520 → 9002 [ACK] Seq=15632 Ack=239078 Win=11903 Len=0"
"15.717238","5.9.29.183","172.19.0.3","TLSv1.2","1225","Application Data"
"15.718081","172.19.0.3","5.9.29.183","TLSv1.2","599","Application Data"
"15.718536","5.9.29.183","172.19.0.3","TCP","56","9002 → 43520 [ACK] Seq=240247 Ack=16175 Win=65535 Len=0"
"15.727577","172.19.0.3","5.9.29.183","TLSv1.2","599","Application Data"
"15.727829","5.9.29.183","172.19.0.3","TCP","56","9002 → 43520 [ACK] Seq=240247 Ack=16718 Win=65535 Len=0"
"15.732916","5.9.29.183","172.19.0.3","TLSv1.2","149","Application Data"
"15.776808","172.19.0.3","5.9.29.183","TCP","56","43520 → 9002 [ACK] Seq=16718 Ack=240340 Win=11911 Len=0"
"16.007030","5.9.29.183","172.19.0.3","TLSv1.2","599","Application Data"
"16.007073","172.19.0.3","5.9.29.183","TCP","56","43520 → 9002 [ACK] Seq=16718 Ack=240883 Win=11911 Len=0"
"16.008033","172.19.0.3","5.9.29.183","TLSv1.2","599","Application Data"
"16.008342","5.9.29.183","172.19.0.3","TCP","56","9002 → 43520 [ACK] Seq=240883 Ack=17261 Win=65535 Len=0"
"16.267021","5.9.29.183","172.19.0.3","TCP","1516","[TCP segment of a reassembled PDU]"
"16.267055","5.9.29.183","172.19.0.3","TCP","1516","9002 → 43520 [PSH, ACK] Seq=242343 Ack=17261 Win=65535 Len=1460 [TCP segment of a reassembled PDU]"
"16.267063","5.9.29.183","172.19.0.3","TLSv1.2","763","Application Data"
"16.267195","172.19.0.3","5.9.29.183","TCP","56","43520 → 9002 [ACK] Seq=17261 Ack=244510 Win=11895 Len=0"
"16.279404","5.9.29.183","172.19.0.3","TCP","1516","[TCP segment of a reassembled PDU]"
"16.279434","5.9.29.183","172.19.0.3","TCP","1492","9002 → 43520 [PSH, ACK] Seq=245970 Ack=17261 Win=65535 Len=1436 [TCP segment of a reassembled PDU]"
"16.279447","172.19.0.3","5.9.29.183","TCP","56","43520 → 9002 [ACK] Seq=17261 Ack=247406 Win=11903 Len=0"
"16.282385","5.9.29.183","172.19.0.3","TLSv1.2","787","Application Data"
"16.282887","172.19.0.3","5.9.29.183","TLSv1.2","599","Application Data"
"16.283263","5.9.29.183","172.19.0.3","TCP","56","9002 → 43520 [ACK] Seq=248137 Ack=17804 Win=65535 Len=0"
"16.297227","5.9.29.183","172.19.0.3","TLSv1.2","599","Application Data"
"16.303050","5.9.29.183","172.19.0.3","TCP","1516","[TCP segment of a reassembled PDU]"
"16.303073","172.19.0.3","5.9.29.183","TCP","56","43520 → 9002 [ACK] Seq=17804 Ack=250140 Win=11911 Len=0"
"16.303091","5.9.29.183","172.19.0.3","TCP","1492","9002 → 43520 [PSH, ACK] Seq=250140 Ack=17804 Win=65535 Len=1436 [TCP segment of a reassembled PDU]"
"16.312674","5.9.29.183","172.19.0.3","TLSv1.2","1516","Application Data [TCP segment of a reassembled PDU]"
"16.312698","172.19.0.3","5.9.29.183","TCP","56","43520 → 9002 [ACK] Seq=17804 Ack=253036 Win=11911 Len=0"
"16.312712","5.9.29.183","172.19.0.3","TCP","1516","9002 → 43520 [PSH, ACK] Seq=253036 Ack=17804 Win=65535 Len=1460 [TCP segment of a reassembled PDU]"
"16.312719","5.9.29.183","172.19.0.3","TCP","1480","9002 → 43520 [PSH, ACK] Seq=254496 Ack=17804 Win=65535 Len=1424 [TCP segment of a reassembled PDU]"
"16.312723","5.9.29.183","172.19.0.3","TLSv1.2","1516","Application Data [TCP segment of a reassembled PDU]"
"16.312729","5.9.29.183","172.19.0.3","TCP","1516","9002 → 43520 [PSH, ACK] Seq=257380 Ack=17804 Win=65535 Len=1460 [TCP segment of a reassembled PDU]"
"16.312850","5.9.29.183","172.19.0.3","TCP","1516","9002 → 43520 [PSH, ACK] Seq=258840 Ack=17804 Win=65535 Len=1460 [TCP segment of a reassembled PDU]"
"16.312860","5.9.29.183","172.19.0.3","TLSv1.2","374","Application Data, Application Data"
"16.312928","172.19.0.3","5.9.29.183","TCP","56","43520 → 9002 [ACK] Seq=17804 Ack=260618 Win=11863 Len=0"
"16.317603","172.19.0.3","5.9.29.183","TLSv1.2","599","Application Data"
"16.317966","5.9.29.183","172.19.0.3","TCP","56","9002 → 43520 [ACK] Seq=260618 Ack=18347 Win=65535 Len=0"
"16.588600","5.9.29.183","172.19.0.3","TLSv1.2","599","Application Data"
"16.589400","172.19.0.3","5.9.29.183","TLSv1.2","599","Application Data"
"16.589678","5.9.29.183","172.19.0.3","TCP","56","9002 → 43520 [ACK] Seq=261161 Ack=18890 Win=65535 Len=0"
"16.895965","5.9.29.183","172.19.0.3","TCP","806","[TCP segment of a reassembled PDU]"
"16.895996","5.9.29.183","172.19.0.3","TCP","1516","9002 → 43520 [PSH, ACK] Seq=261911 Ack=18890 Win=65535 Len=1460 [TCP segment of a reassembled PDU]"
"16.896003","5.9.29.183","172.19.0.3","TCP","1516","9002 → 43520 [PSH, ACK] Seq=263371 Ack=18890 Win=65535 Len=1460 [TCP segment of a reassembled PDU]"
"16.896006","5.9.29.183","172.19.0.3","TLSv1.2","463","Application Data"
"16.896127","172.19.0.3","5.9.29.183","TCP","56","43520 → 9002 [ACK] Seq=18890 Ack=265238 Win=11887 Len=0"
"16.907431","5.9.29.183","172.19.0.3","TLSv1.2","1516","Application Data"
"16.907511","5.9.29.183","172.19.0.3","TCP","1492","9002 → 43520 [PSH, ACK] Seq=266698 Ack=18890 Win=65535 Len=1436 [TCP segment of a reassembled PDU]"
"16.907530","172.19.0.3","5.9.29.183","TCP","56","43520 → 9002 [ACK] Seq=18890 Ack=268134 Win=11901 Len=0"
"16.907534","5.9.29.183","172.19.0.3","TLSv1.2","1516","Application Data [TCP segment of a reassembled PDU]"
"16.907671","5.9.29.183","172.19.0.3","TCP","1516","9002 → 43520 [PSH, ACK] Seq=269594 Ack=18890 Win=65535 Len=1460 [TCP segment of a reassembled PDU]"
"16.907678","5.9.29.183","172.19.0.3","TCP","1480","9002 → 43520 [PSH, ACK] Seq=271054 Ack=18890 Win=65535 Len=1424 [TCP segment of a reassembled PDU]"
"16.907754","172.19.0.3","5.9.29.183","TCP","56","43520 → 9002 [ACK] Seq=18890 Ack=272478 Win=11877 Len=0"
"16.911463","5.9.29.183","172.19.0.3","TLSv1.2","163","Application Data"
"16.922867","5.9.29.183","172.19.0.3","TCP","1516","[TCP segment of a reassembled PDU]"
"16.922884","172.19.0.3","5.9.29.183","TCP","56","43520 → 9002 [ACK] Seq=18890 Ack=274045 Win=11911 Len=0"
"16.922897","5.9.29.183","172.19.0.3","TCP","1516","9002 → 43520 [PSH, ACK] Seq=274045 Ack=18890 Win=65535 Len=1460 [TCP segment of a reassembled PDU]"
"16.922902","5.9.29.183","172.19.0.3","TLSv1.2","1480","Application Data [TCP segment of a reassembled PDU]"
"16.922905","5.9.29.183","172.19.0.3","TCP","1516","9002 → 43520 [PSH, ACK] Seq=276929 Ack=18890 Win=65535 Len=1460 [TCP segment of a reassembled PDU]"
"16.922907","5.9.29.183","172.19.0.3","TCP","1516","9002 → 43520 [PSH, ACK] Seq=278389 Ack=18890 Win=65535 Len=1460 [TCP segment of a reassembled PDU]"
"16.922910","5.9.29.183","172.19.0.3","TLSv1.2","1516","Application Data [TCP segment of a reassembled PDU]"
"16.923009","5.9.29.183","172.19.0.3","TCP","1468","9002 → 43520 [PSH, ACK] Seq=281309 Ack=18890 Win=65535 Len=1412 [TCP segment of a reassembled PDU]"
"16.923016","5.9.29.183","172.19.0.3","TCP","1504","9002 → 43520 [PSH, ACK] Seq=282721 Ack=18890 Win=65535 Len=1448 [TCP segment of a reassembled PDU]"
"16.923083","172.19.0.3","5.9.29.183","TCP","56","43520 → 9002 [ACK] Seq=18890 Ack=284169 Win=11855 Len=0"
"16.926667","5.9.29.183","172.19.0.3","TLSv1.2","924","Application Data, Application Data"
"16.942967","5.9.29.183","172.19.0.3","TCP","1516","[TCP segment of a reassembled PDU]"
"16.942989","172.19.0.3","5.9.29.183","TCP","56","43520 → 9002 [ACK] Seq=18890 Ack=286497 Win=11911 Len=0"
"16.943005","5.9.29.183","172.19.0.3","TCP","1516","9002 → 43520 [PSH, ACK] Seq=286497 Ack=18890 Win=65535 Len=1460 [TCP segment of a reassembled PDU]"
"16.943012","5.9.29.183","172.19.0.3","TLSv1.2","1213","Application Data"
"16.943172","172.19.0.3","5.9.29.183","TCP","56","43520 → 9002 [ACK] Seq=18890 Ack=289114 Win=11895 Len=0"
"16.943391","172.19.0.3","5.9.29.183","TLSv1.2","599","Application Data"
"16.943637","5.9.29.183","172.19.0.3","TCP","56","9002 → 43520 [ACK] Seq=289114 Ack=19433 Win=65535 Len=0"
"16.954024","5.9.29.183","172.19.0.3","TLSv1.2","1516","Application Data"
"16.954055","5.9.29.183","172.19.0.3","TCP","1492","9002 → 43520 [PSH, ACK] Seq=290574 Ack=19433 Win=65535 Len=1436 [TCP segment of a reassembled PDU]"
"16.954061","5.9.29.183","172.19.0.3","TLSv1.2","1516","Application Data [TCP segment of a reassembled PDU]"
"16.954064","5.9.29.183","172.19.0.3","TCP","1516","9002 → 43520 [PSH, ACK] Seq=293470 Ack=19433 Win=65535 Len=1460 [TCP segment of a reassembled PDU]"
"16.954067","5.9.29.183","172.19.0.3","TCP","1480","9002 → 43520 [PSH, ACK] Seq=294930 Ack=19433 Win=65535 Len=1424 [TCP segment of a reassembled PDU]"
"16.954173","172.19.0.3","5.9.29.183","TCP","56","43520 → 9002 [ACK] Seq=19433 Ack=296354 Win=11877 Len=0"
"16.958543","5.9.29.183","172.19.0.3","TLSv1.2","1516","Application Data [TCP segment of a reassembled PDU]"
"16.958572","5.9.29.183","172.19.0.3","TCP","1516","9002 → 43520 [PSH, ACK] Seq=297814 Ack=19433 Win=65535 Len=1460 [TCP segment of a reassembled PDU]"
"16.958586","172.19.0.3","5.9.29.183","TCP","56","43520 → 9002 [ACK] Seq=19433 Ack=299274 Win=11903 Len=0"
"16.958588","5.9.29.183","172.19.0.3","TLSv1.2","1384","Application Data"
"16.959203","172.19.0.3","5.9.29.183","TLSv1.2","599","Application Data"
"16.959496","5.9.29.183","172.19.0.3","TCP","56","9002 → 43520 [ACK] Seq=300602 Ack=19976 Win=65535 Len=0"
"16.969031","5.9.29.183","172.19.0.3","TCP","1504","[TCP segment of a reassembled PDU]"
"16.971499","5.9.29.183","172.19.0.3","TCP","1516","9002 → 43520 [PSH, ACK] Seq=302050 Ack=19976 Win=65535 Len=1460 [TCP segment of a reassembled PDU]"
"16.971521","172.19.0.3","5.9.29.183","TCP","56","43520 → 9002 [ACK] Seq=19976 Ack=303510 Win=11911 Len=0"
"16.971535","5.9.29.183","172.19.0.3","TLSv1.2","1492","Application Data [TCP segment of a reassembled PDU]"
"16.975394","5.9.29.183","172.19.0.3","TLSv1.2","1424","Application Data"
"16.975419","172.19.0.3","5.9.29.183","TCP","56","43520 → 9002 [ACK] Seq=19976 Ack=306314 Win=11911 Len=0"
"16.979970","172.19.0.3","5.9.29.183","TLSv1.2","599","Application Data"
"16.980265","5.9.29.183","172.19.0.3","TCP","56","9002 → 43520 [ACK] Seq=306314 Ack=20519 Win=65535 Len=0"
"17.328445","5.9.29.183","172.19.0.3","TLSv1.2","599","Application Data"
"17.329442","172.19.0.3","5.9.29.183","TLSv1.2","599","Application Data"
"17.329794","5.9.29.183","172.19.0.3","TCP","56","9002 → 43520 [ACK] Seq=306857 Ack=21062 Win=65535 Len=0"
"17.684549","5.9.29.183","172.19.0.3","TCP","1516","[TCP segment of a reassembled PDU]"
"17.684581","5.9.29.183","172.19.0.3","TCP","1516","9002 → 43520 [PSH, ACK] Seq=308317 Ack=21062 Win=65535 Len=1460 [TCP segment of a reassembled PDU]"
"17.684587","5.9.29.183","172.19.0.3","TLSv1.2","763","Application Data"
"17.684706","172.19.0.3","5.9.29.183","TCP","56","43520 → 9002 [ACK] Seq=21062 Ack=310484 Win=11895 Len=0"
"17.713639","5.9.29.183","172.19.0.3","TCP","1504","[TCP segment of a reassembled PDU]"
"17.713668","5.9.29.183","172.19.0.3","TCP","1516","9002 → 43520 [PSH, ACK] Seq=311932 Ack=21062 Win=65535 Len=1460 [TCP segment of a reassembled PDU]"
"17.713680","172.19.0.3","5.9.29.183","TCP","56","43520 → 9002 [ACK] Seq=21062 Ack=313392 Win=11903 Len=0"
"17.713682","5.9.29.183","172.19.0.3","TLSv1.2","775","Application Data"
"17.729003","5.9.29.183","172.19.0.3","TCP","1516","[TCP segment of a reassembled PDU]"
"17.729023","172.19.0.3","5.9.29.183","TCP","56","43520 → 9002 [ACK] Seq=21062 Ack=315571 Win=11911 Len=0"
"17.729038","5.9.29.183","172.19.0.3","TCP","1516","9002 → 43520 [PSH, ACK] Seq=315571 Ack=21062 Win=65535 Len=1460 [TCP segment of a reassembled PDU]"
"17.729045","5.9.29.183","172.19.0.3","TLSv1.2","1306","Application Data, Application Data"
"17.729205","172.19.0.3","5.9.29.183","TCP","56","43520 → 9002 [ACK] Seq=21062 Ack=318281 Win=11895 Len=0"
"17.739433","5.9.29.183","172.19.0.3","TCP","1516","[TCP segment of a reassembled PDU]"
"17.739460","5.9.29.183","172.19.0.3","TCP","1516","9002 → 43520 [PSH, ACK] Seq=319741 Ack=21062 Win=65535 Len=1460 [TCP segment of a reassembled PDU]"
"17.739473","172.19.0.3","5.9.29.183","TCP","56","43520 → 9002 [ACK] Seq=21062 Ack=321201 Win=11903 Len=0"
"17.739476","5.9.29.183","172.19.0.3","TLSv1.2","1480","Application Data [TCP segment of a reassembled PDU]"
"17.743876","5.9.29.183","172.19.0.3","TLSv1.2","1516","Application Data [TCP segment of a reassembled PDU]"
"17.743898","172.19.0.3","5.9.29.183","TCP","56","43520 → 9002 [ACK] Seq=21062 Ack=324085 Win=11911 Len=0"
"17.743913","5.9.29.183","172.19.0.3","TCP","1492","9002 → 43520 [PSH, ACK] Seq=324085 Ack=21062 Win=65535 Len=1436 [TCP segment of a reassembled PDU]"
"17.745288","5.9.29.183","172.19.0.3","TLSv1.2","613","Application Data"
"17.745301","172.19.0.3","5.9.29.183","TCP","56","43520 → 9002 [ACK] Seq=21062 Ack=326078 Win=11911 Len=0"
"17.753548","5.9.29.183","172.19.0.3","TCP","1425","[TCP segment of a reassembled PDU]"
"17.753579","5.9.29.183","172.19.0.3","TCP","1516","9002 → 43520 [PSH, ACK] Seq=327447 Ack=21062 Win=65535 Len=1460 [TCP segment of a reassembled PDU]"
"17.753584","5.9.29.183","172.19.0.3","TLSv1.2","1516","Application Data [TCP segment of a reassembled PDU]"
"17.753587","5.9.29.183","172.19.0.3","TCP","1516","9002 → 43520 [PSH, ACK] Seq=330367 Ack=21062 Win=65535 Len=1460 [TCP segment of a reassembled PDU]"
"17.753593","5.9.29.183","172.19.0.3","TCP","99","9002 → 43520 [PSH, ACK] Seq=331827 Ack=21062 Win=65535 Len=43 [TCP segment of a reassembled PDU]"
"17.753722","172.19.0.3","5.9.29.183","TCP","56","43520 → 9002 [ACK] Seq=21062 Ack=331870 Win=11883 Len=0"
"17.754550","5.9.29.183","172.19.0.3","TCP","1516","9002 → 43520 [PSH, ACK] Seq=331870 Ack=21062 Win=65535 Len=1460 [TCP segment of a reassembled PDU]"
"17.754624","5.9.29.183","172.19.0.3","TLSv1.2","1492","Application Data [TCP segment of a reassembled PDU]"
"17.754634","172.19.0.3","5.9.29.183","TCP","56","43520 → 9002 [ACK] Seq=21062 Ack=334766 Win=11903 Len=0"
"17.755042","172.19.0.3","5.9.29.183","TLSv1.2","599","Application Data"
"17.755283","5.9.29.183","172.19.0.3","TCP","56","9002 → 43520 [ACK] Seq=334766 Ack=21605 Win=65535 Len=0"
"17.759028","5.9.29.183","172.19.0.3","TCP","1504","9002 → 43520 [PSH, ACK] Seq=334766 Ack=21605 Win=65535 Len=1448 [TCP segment of a reassembled PDU]"
"17.760389","5.9.29.183","172.19.0.3","TLSv1.2","801","Application Data"
"17.760416","172.19.0.3","5.9.29.183","TCP","56","43520 → 9002 [ACK] Seq=21605 Ack=336959 Win=11911 Len=0"
"17.766870","5.9.29.183","172.19.0.3","TCP","1504","[TCP segment of a reassembled PDU]"
"17.766899","5.9.29.183","172.19.0.3","TCP","1504","9002 → 43520 [PSH, ACK] Seq=338407 Ack=21605 Win=65535 Len=1448 [TCP segment of a reassembled PDU]"
"17.767012","172.19.0.3","5.9.29.183","TCP","56","43520 → 9002 [ACK] Seq=21605 Ack=339855 Win=11903 Len=0"
"17.768452","5.9.29.183","172.19.0.3","TLSv1.2","1504","Application Data [TCP segment of a reassembled PDU]"
"17.775673","5.9.29.183","172.19.0.3","TLSv1.2","1424","Application Data"
"17.775693","172.19.0.3","5.9.29.183","TCP","56","43520 → 9002 [ACK] Seq=21605 Ack=342671 Win=11911 Len=0"
"17.784290","5.9.29.183","172.19.0.3","TCP","1504","[TCP segment of a reassembled PDU]"
"17.784320","5.9.29.183","172.19.0.3","TCP","1504","9002 → 43520 [PSH, ACK] Seq=344119 Ack=21605 Win=65535 Len=1448 [TCP segment of a reassembled PDU]"
"17.784447","172.19.0.3","5.9.29.183","TCP","56","43520 → 9002 [ACK] Seq=21605 Ack=345567 Win=11903 Len=0"
"17.790859","5.9.29.183","172.19.0.3","TLSv1.2","787","Application Data"
"17.805733","5.9.29.183","172.19.0.3","TLSv1.2","1113","Application Data"
"17.805754","172.19.0.3","5.9.29.183","TCP","56","43520 → 9002 [ACK] Seq=21605 Ack=347355 Win=11911 Len=0"
"17.807670","5.9.29.183","172.19.0.3","TCP","1504","[TCP segment of a reassembled PDU]"
"17.807786","5.9.29.183","172.19.0.3","TCP","1504","9002 → 43520 [PSH, ACK] Seq=348803 Ack=21605 Win=65535 Len=1448 [TCP segment of a reassembled PDU]"
"17.807795","172.19.0.3","5.9.29.183","TCP","56","43520 → 9002 [ACK] Seq=21605 Ack=350251 Win=11911 Len=0"
"17.817167","5.9.29.183","172.19.0.3","TLSv1.2","1504","Application Data [TCP segment of a reassembled PDU]"
"17.817237","5.9.29.183","172.19.0.3","TCP","1516","9002 → 43520 [PSH, ACK] Seq=351699 Ack=21605 Win=65535 Len=1460 [TCP segment of a reassembled PDU]"
"17.817248","5.9.29.183","172.19.0.3","TCP","1492","9002 → 43520 [PSH, ACK] Seq=353159 Ack=21605 Win=65535 Len=1436 [TCP segment of a reassembled PDU]"
"17.817332","5.9.29.183","172.19.0.3","TLSv1.2","1516","Application Data [TCP segment of a reassembled PDU]"
"17.817339","5.9.29.183","172.19.0.3","TCP","1516","9002 → 43520 [PSH, ACK] Seq=356055 Ack=21605 Win=65535 Len=1460 [TCP segment of a reassembled PDU]"
"17.817342","5.9.29.183","172.19.0.3","TCP","1480","9002 → 43520 [PSH, ACK] Seq=357515 Ack=21605 Win=65535 Len=1424 [TCP segment of a reassembled PDU]"
"17.817418","172.19.0.3","5.9.29.183","TCP","56","43520 → 9002 [ACK] Seq=21605 Ack=358939 Win=11869 Len=0"
"17.818016","172.19.0.3","5.9.29.183","TLSv1.2","599","Application Data"
"17.818279","5.9.29.183","172.19.0.3","TCP","56","9002 → 43520 [ACK] Seq=358939 Ack=22148 Win=65535 Len=0"
"17.821110","5.9.29.183","172.19.0.3","TLSv1.2","1438","Application Data, Application Data"
"17.827467","172.19.0.3","5.9.29.183","TLSv1.2","1113","Application Data"
"17.827853","5.9.29.183","172.19.0.3","TCP","56","9002 → 43520 [ACK] Seq=360321 Ack=23205 Win=65535 Len=0"
"18.182859","5.9.29.183","172.19.0.3","TLSv1.2","599","Application Data"
"18.183756","172.19.0.3","5.9.29.183","TLSv1.2","599","Application Data"
"18.184060","5.9.29.183","172.19.0.3","TCP","56","9002 → 43520 [ACK] Seq=360864 Ack=23748 Win=65535 Len=0"
"18.476717","5.9.29.183","172.19.0.3","TLSv1.2","599","Application Data"
"18.507404","5.9.29.183","172.19.0.3","TCP","1516","[TCP segment of a reassembled PDU]"
"18.507429","172.19.0.3","5.9.29.183","TCP","56","43520 → 9002 [ACK] Seq=23748 Ack=362867 Win=11911 Len=0"
"18.507445","5.9.29.183","172.19.0.3","TCP","1492","9002 → 43520 [PSH, ACK] Seq=362867 Ack=23748 Win=65535 Len=1436 [TCP segment of a reassembled PDU]"
"18.507456","5.9.29.183","172.19.0.3","TLSv1.2","787","Application Data"
"18.507732","172.19.0.3","5.9.29.183","TCP","56","43520 → 9002 [ACK] Seq=23748 Ack=365034 Win=11895 Len=0"
"18.522025","5.9.29.183","172.19.0.3","TCP","1516","[TCP segment of a reassembled PDU]"
"18.522052","5.9.29.183","172.19.0.3","TCP","1492","9002 → 43520 [PSH, ACK] Seq=366494 Ack=23748 Win=65535 Len=1436 [TCP segment of a reassembled PDU]"
"18.522063","172.19.0.3","5.9.29.183","TCP","56","43520 → 9002 [ACK] Seq=23748 Ack=367930 Win=11903 Len=0"
"18.522738","5.9.29.183","172.19.0.3","TLSv1.2","787","Application Data"
"18.535604","5.9.29.183","172.19.0.3","TCP","1516","[TCP segment of a reassembled PDU]"
"18.535627","172.19.0.3","5.9.29.183","TCP","56","43520 → 9002 [ACK] Seq=23748 Ack=370121 Win=11911 Len=0"
"18.535641","5.9.29.183","172.19.0.3","TCP","1492","9002 → 43520 [PSH, ACK] Seq=370121 Ack=23748 Win=65535 Len=1436 [TCP segment of a reassembled PDU]"
"18.538318","5.9.29.183","172.19.0.3","TLSv1.2","787","Application Data"
"18.538344","172.19.0.3","5.9.29.183","TCP","56","43520 → 9002 [ACK] Seq=23748 Ack=372288 Win=11911 Len=0"
"18.546563","5.9.29.183","172.19.0.3","TCP","1504","[TCP segment of a reassembled PDU]"
"18.546627","5.9.29.183","172.19.0.3","TCP","1516","9002 → 43520 [PSH, ACK] Seq=373736 Ack=23748 Win=65535 Len=1460 [TCP segment of a reassembled PDU]"
"18.546636","5.9.29.183","172.19.0.3","TLSv1.2","1516","Application Data [TCP segment of a reassembled PDU]"
"18.546766","5.9.29.183","172.19.0.3","TCP","1516","9002 → 43520 [PSH, ACK] Seq=376656 Ack=23748 Win=65535 Len=1460 [TCP segment of a reassembled PDU]"
"18.546774","5.9.29.183","172.19.0.3","TCP","1468","9002 → 43520 [PSH, ACK] Seq=378116 Ack=23748 Win=65535 Len=1412 [TCP segment of a reassembled PDU]"
"18.546777","5.9.29.183","172.19.0.3","TLSv1.2","1516","Application Data [TCP segment of a reassembled PDU]"
"18.546787","5.9.29.183","172.19.0.3","TCP","1492","9002 → 43520 [PSH, ACK] Seq=380988 Ack=23748 Win=65535 Len=1436 [TCP segment of a reassembled PDU]"
"18.546877","172.19.0.3","5.9.29.183","TCP","56","43520 → 9002 [ACK] Seq=23748 Ack=382424 Win=11863 Len=0"
"18.550943","5.9.29.183","172.19.0.3","TCP","1504","9002 → 43520 [PSH, ACK] Seq=382424 Ack=23748 Win=65535 Len=1448 [TCP segment of a reassembled PDU]"
"18.553368","5.9.29.183","172.19.0.3","TLSv1.2","924","Application Data, Application Data"
"18.553391","172.19.0.3","5.9.29.183","TCP","56","43520 → 9002 [ACK] Seq=23748 Ack=384740 Win=11911 Len=0"
"18.558095","5.9.29.183","172.19.0.3","TCP","1504","[TCP segment of a reassembled PDU]"
"18.558331","5.9.29.183","172.19.0.3","TCP","1504","9002 → 43520 [PSH, ACK] Seq=386188 Ack=23748 Win=65535 Len=1448 [TCP segment of a reassembled PDU]"
"18.558343","172.19.0.3","5.9.29.183","TCP","56","43520 → 9002 [ACK] Seq=23748 Ack=387636 Win=11911 Len=0"
"18.561890","5.9.29.183","172.19.0.3","TLSv1.2","1516","Application Data [TCP segment of a reassembled PDU]"
"18.561918","5.9.29.183","172.19.0.3","TCP","1492","9002 → 43520 [PSH, ACK] Seq=389096 Ack=23748 Win=65535 Len=1436 [TCP segment of a reassembled PDU]"
"18.562019","5.9.29.183","172.19.0.3","TCP","1504","9002 → 43520 [PSH, ACK] Seq=390532 Ack=23748 Win=65535 Len=1448 [TCP segment of a reassembled PDU]"
"18.562098","172.19.0.3","5.9.29.183","TCP","56","43520 → 9002 [ACK] Seq=23748 Ack=391980 Win=11895 Len=0"
"18.562334","172.19.0.3","5.9.29.183","TLSv1.2","599","Application Data"
"18.562540","5.9.29.183","172.19.0.3","TCP","56","9002 → 43520 [ACK] Seq=391980 Ack=24291 Win=65535 Len=0"
"18.568485","5.9.29.183","172.19.0.3","TLSv1.2","584","Application Data"
"18.572608","5.9.29.183","172.19.0.3","TCP","531","[TCP segment of a reassembled PDU]"
"18.572632","5.9.29.183","172.19.0.3","TCP","1516","9002 → 43520 [PSH, ACK] Seq=392983 Ack=24291 Win=65535 Len=1460 [TCP segment of a reassembled PDU]"
"18.572643","172.19.0.3","5.9.29.183","TCP","56","43520 → 9002 [ACK] Seq=24291 Ack=394443 Win=11903 Len=0"
"18.572645","5.9.29.183","172.19.0.3","TCP","1017","9002 → 43520 [PSH, ACK] Seq=394443 Ack=24291 Win=65535 Len=961 [TCP segment of a reassembled PDU]"
"18.583735","5.9.29.183","172.19.0.3","TLSv1.2","273","Application Data"
"18.583926","172.19.0.3","5.9.29.183","TCP","56","43520 → 9002 [ACK] Seq=24291 Ack=395621 Win=11911 Len=0"
