_ws.col.Time,_ws.col.Source,_ws.col.Destination,_ws.col.Protocol,_ws.col.Length,_ws.col.Info
"0.000000","172.19.0.3","5.9.29.183","TLSv1.2","599","Application Data"
"0.000306","5.9.29.183","172.19.0.3","TCP","56","9002 → 43520 [ACK] Seq=1 Ack=544 Win=65535 Len=0"
"0.233235","5.9.29.183","172.19.0.3","TLSv1.2","599","Application Data"
"0.233322","172.19.0.3","5.9.29.183","TCP","56","43520 → 9002 [ACK] Seq=544 Ack=544 Win=11911 Len=0"
"0.234327","172.19.0.3","5.9.29.183","TLSv1.2","2141","Application Data"
"0.234719","5.9.29.183","172.19.0.3","TCP","56","9002 → 43520 [ACK] Seq=544 Ack=2004 Win=65535 Len=0"
"0.234779","5.9.29.183","172.19.0.3","TCP","56","9002 → 43520 [ACK] Seq=544 Ack=2629 Win=65535 Len=0"
"0.802138","5.9.29.183","172.19.0.3","TCP","1516","[TCP segment of a reassembled PDU]"
"0.802227","5.9.29.183","172.19.0.3","TLSv1.2","167","Application Data"
"0.802358","172.19.0.3","5.9.29.183","TCP","56","43520 → 9002 [ACK] Seq=2629 Ack=2115 Win=11903 Len=0"
"0.807442","172.19.0.3","5.9.29.183","TLSv1.2","599","Application Data"
"0.807807","5.9.29.183","172.19.0.3","TCP","56","9002 → 43520 [ACK] Seq=2115 Ack=3172 Win=65535 Len=0"
"1.076746","5.9.29.183","172.19.0.3","TLSv1.2","599","Application Data"
"1.077621","172.19.0.3","5.9.29.183","TLSv1.2","599","Application Data"
"1.077906","5.9.29.183","172.19.0.3","TCP","56","9002 → 43520 [ACK] Seq=2658 Ack=3715 Win=65535 Len=0"
"1.307510","5.9.29.183","172.19.0.3","TCP","1516","[TCP segment of a reassembled PDU]"
"1.307614","5.9.29.183","172.19.0.3","TCP","1516","9002 → 43520 [PSH, ACK] Seq=4118 Ack=3715 Win=65535 Len=1460 [TCP segment of a reassembled PDU]"
"1.307629","5.9.29.183","172.19.0.3","TLSv1.2","763","Application Data"
"1.307760","172.19.0.3","5.9.29.183","TCP","56","43520 → 9002 [ACK] Seq=3715 Ack=6285 Win=11895 Len=0"
"1.308063","172.19.0.3","5.9.29.183","TLSv1.2","599","Application Data"
"1.308355","5.9.29.183","172.19.0.3","TCP","56","9002 → 43520 [ACK] Seq=6285 Ack=4258 Win=65535 Len=0"
"1.323115","5.9.29.183","172.19.0.3","TLSv1.2","599","Application Data"
"1.334528","5.9.29.183","172.19.0.3","TCP","1516","[TCP segment of a reassembled PDU]"
"1.334548","172.19.0.3","5.9.29.183","TCP","56","43520 → 9002 [ACK] Seq=4258 Ack=8288 Win=11911 Len=0"
"1.334583","5.9.29.183","172.19.0.3","TCP","1492","9002 → 43520 [PSH, ACK] Seq=8288 Ack=4258 Win=65535 Len=1436 [TCP segment of a reassembled PDU]"
"1.339008","5.9.29.183","172.19.0.3","TLSv1.2","787","Application Data"
"1.339028","172.19.0.3","5.9.29.183","TCP","56","43520 → 9002 [ACK] Seq=4258 Ack=10455 Win=11911 Len=0"
"1.348696","5.9.29.183","172.19.0.3","TCP","1516","[TCP segment of a reassembled PDU]"
"1.348763","5.9.29.183","172.19.0.3","TCP","1492","9002 → 43520 [PSH, ACK] Seq=11915 Ack=4258 Win=65535 Len=1436 [TCP segment of a reassembled PDU]"
"1.348903","172.19.0.3","5.9.29.183","TCP","56","43520 → 9002 [ACK] Seq=4258 Ack=13351 Win=11903 Len=0"
"1.355431","5.9.29.183","172.19.0.3","TCP","1191","9002 → 43520 [PSH, ACK] Seq=13351 Ack=4258 Win=65535 Len=1135 [TCP segment of a reassembled PDU]"
"1.355626","5.9.29.183","172.19.0.3","TLSv1.2","195","Application Data, Application Data"
"1.356049","172.19.0.3","5.9.29.183","TCP","56","43520 → 9002 [ACK] Seq=4258 Ack=14625 Win=11911 Len=0"
"1.358898","5.9.29.183","172.19.0.3","TCP","1504","[TCP segment of a reassembled PDU]"
"1.358977","5.9.29.183","172.19.0.3","TCP","1504","9002 → 43520 [PSH, ACK] Seq=16073 Ack=4258 Win=65535 Len=1448 [TCP segment of a reassembled PDU]"
"1.359027","5.9.29.183","172.19.0.3","TLSv1.2","1504","Application Data [TCP segment of a reassembled PDU]"
"1.359082","172.19.0.3","5.9.29.183","TCP","56","43520 → 9002 [ACK] Seq=4258 Ack=18969 Win=11893 Len=0"
"1.359114","5.9.29.183","172.19.0.3","TCP","1516","9002 → 43520 [PSH, ACK] Seq=18969 Ack=4258 Win=65535 Len=1460 [TCP segment of a reassembled PDU]"
"1.359117","5.9.29.183","172.19.0.3","TCP","1516","9002 → 43520 [PSH, ACK] Seq=20429 Ack=4258 Win=65535 Len=1460 [TCP segment of a reassembled PDU]"
"1.359119","5.9.29.183","172.19.0.3","TLSv1.2","1480","Application Data [TCP segment of a reassembled PDU]"
"1.359138","172.19.0.3","5.9.29.183","TCP","56","43520 → 9002 [ACK] Seq=4258 Ack=23313 Win=11869 Len=0"
"1.359181","5.9.29.183","172.19.0.3","TCP","1504","9002 → 43520 [PSH, ACK] Seq=23313 Ack=4258 Win=65535 Len=1448 [TCP segment of a reassembled PDU]"
"1.364256","5.9.29.183","172.19.0.3","TCP","1504","9002 → 43520 [PSH, ACK] Seq=24761 Ack=4258 Win=65535 Len=1448 [TCP segment of a reassembled PDU]"
"1.364277","172.19.0.3","5.9.29.183","TCP","56","43520 → 9002 [ACK] Seq=4258 Ack=26209 Win=11911 Len=0"
"1.370446","5.9.29.183","172.19.0.3","TLSv1.2","381","Application Data"
"1.371814","5.9.29.183","172.19.0.3","TCP","1504","[TCP segment of a reassembled PDU]"
"1.371828","172.19.0.3","5.9.29.183","TCP","56","43520 → 9002 [ACK] Seq=4258 Ack=27982 Win=11911 Len=0"
"1.371872","5.9.29.183","172.19.0.3","TCP","1516","9002 → 43520 [PSH, ACK] Seq=27982 Ack=4258 Win=65535 Len=1460 [TCP segment of a reassembled PDU]"
"1.371917","5.9.29.183","172.19.0.3","TLSv1.2","1492","Application Data [TCP segment of a reassembled PDU]"
"1.372004","172.19.0.3","5.9.29.183","TCP","56","43520 → 9002 [ACK] Seq=4258 Ack=30878 Win=11895 Len=0"
"1.372234","172.19.0.3","5.9.29.183","TLSv1.2","599","Application Data"
"1.372573","5.9.29.183","172.19.0.3","TCP","56","9002 → 43520 [ACK] Seq=30878 Ack=4801 Win=65535 Len=0"
"1.385628","5.9.29.183","172.19.0.3","TLSv1.2","396","Application Data"
"1.413710","5.9.29.183","172.19.0.3","TCP","1516","[TCP segment of a reassembled PDU]"
"1.413735","172.19.0.3","5.9.29.183","TCP","56","43520 → 9002 [ACK] Seq=4801 Ack=32678 Win=11911 Len=0"
"1.413797","5.9.29.183","172.19.0.3","TCP","1516","9002 → 43520 [PSH, ACK] Seq=32678 Ack=4801 Win=65535 Len=1460 [TCP segment of a reassembled PDU]"
"1.413814","5.9.29.183","172.19.0.3","TLSv1.2","763","Application Data"
"1.413989","172.19.0.3","5.9.29.183","TCP","56","43520 → 9002 [ACK] Seq=4801 Ack=34845 Win=11895 Len=0"
"1.455220","5.9.29.183","172.19.0.3","TLSv1.2","1113","Application Data"
"1.460152","172.19.0.3","5.9.29.183","TLSv1.2","599","Application Data"
"1.460432","5.9.29.183","172.19.0.3","TCP","56","9002 → 43520 [ACK] Seq=35902 Ack=5344 Win=65535 Len=0"
"1.733660","5.9.29.183","172.19.0.3","TLSv1.2","599","Application Data"
"1.734483","172.19.0.3","5.9.29.183","TLSv1.2","599","Application Data"
"1.734885","5.9.29.183","172.19.0.3","TCP","56","9002 → 43520 [ACK] Seq=36445 Ack=5887 Win=65535 Len=0"
"2.039517","5.9.29.183","172.19.0.3","TCP","1516","[TCP segment of a reassembled PDU]"
"2.039584","5.9.29.183","172.19.0.3","TCP","1516","9002 → 43520 [PSH, ACK] Seq=37905 Ack=5887 Win=65535 Len=1460 [TCP segment of a reassembled PDU]"
"2.039591","5.9.29.183","172.19.0.3","TLSv1.2","763","Application Data"
"2.039711","172.19.0.3","5.9.29.183","TCP","56","43520 → 9002 [ACK] Seq=5887 Ack=40072 Win=11895 Len=0"
"2.061680","5.9.29.183","172.19.0.3","TCP","1516","[TCP segment of a reassembled PDU]"
"2.061725","5.9.29.183","172.19.0.3","TCP","1492","9002 → 43520 [PSH, ACK] Seq=41532 Ack=5887 Win=65535 Len=1436 [TCP segment of a reassembled PDU]"
"2.061738","172.19.0.3","5.9.29.183","TCP","56","43520 → 9002 [ACK] Seq=5887 Ack=42968 Win=11903 Len=0"
"2.061740","5.9.29.183","172.19.0.3","TLSv1.2","1516","Application Data [TCP segment of a reassembled PDU]"
"2.061742","5.9.29.183","172.19.0.3","TCP","1516","9002 → 43520 [PSH, ACK] Seq=44428 Ack=5887 Win=65535 Len=1460 [TCP segment of a reassembled PDU]"
"2.061747","5.9.29.183","172.19.0.3","TCP","1213","9002 → 43520 [PSH, ACK] Seq=45888 Ack=5887 Win=65535 Len=1157 [TCP segment of a reassembled PDU]"
"2.061865","172.19.0.3","5.9.29.183","TCP","56","43520 → 9002 [ACK] Seq=5887 Ack=47045 Win=11879 Len=0"
"2.077738","5.9.29.183","172.19.0.3","TLSv1.2","337","Application Data"
"2.093781","5.9.29.183","172.19.0.3","TCP","1516","[TCP segment of a reassembled PDU]"
"2.093806","172.19.0.3","5.9.29.183","TCP","56","43520 → 9002 [ACK] Seq=5887 Ack=48786 Win=11911 Len=0"
"2.093865","5.9.29.183","172.19.0.3","TCP","1516","9002 → 43520 [PSH, ACK] Seq=48786 Ack=5887 Win=65535 Len=1460 [TCP segment of a reassembled PDU]"
"2.093880","5.9.29.183","172.19.0.3","TLSv1.2","763","Application Data"
"2.094029","172.19.0.3","5.9.29.183","TCP","56","43520 → 9002 [ACK] Seq=5887 Ack=50953 Win=11895 Len=0"
"2.107410","5.9.29.183","172.19.0.3","TCP","1504","[TCP segment of a reassembled PDU]"
"2.108747","5.9.29.183","172.19.0.3","TLSv1.2","693","Application Data"
"2.108763","172.19.0.3","5.9.29.183","TCP","56","43520 → 9002 [ACK] Seq=5887 Ack=53038 Win=11911 Len=0"
"2.118274","5.9.29.183","172.19.0.3","TCP","1516","[TCP segment of a reassembled PDU]"
"2.118325","5.9.29.183","172.19.0.3","TCP","1516","9002 → 43520 [PSH, ACK] Seq=54498 Ack=5887 Win=65535 Len=1460 [TCP segment of a reassembled PDU]"
"2.118332","5.9.29.183","172.19.0.3","TLSv1.2","1516","Application Data [TCP segment of a reassembled PDU]"
"2.118335","5.9.29.183","172.19.0.3","TCP","1516","9002 → 43520 [PSH, ACK] Seq=57418 Ack=5887 Win=65535 Len=1460 [TCP segment of a reassembled PDU]"
"2.118338","5.9.29.183","172.19.0.3","TCP","1456","9002 → 43520 [PSH, ACK] Seq=58878 Ack=5887 Win=65535 Len=1400 [TCP segment of a reassembled PDU]"
"2.118535","172.19.0.3","5.9.29.183","TCP","56","43520 → 9002 [ACK] Seq=5887 Ack=60278 Win=11879 Len=0"
"2.123761","5.9.29.183","172.19.0.3","TLSv1.2","70","Application Data"
"2.124178","172.19.0.3","5.9.29.183","TLSv1.2","599","Application Data"
"2.124521","5.9.29.183","172.19.0.3","TCP","56","9002 → 43520 [ACK] Seq=60292 Ack=6430 Win=65535 Len=0"
"2.130767","5.9.29.183","172.19.0.3","TCP","1516","[TCP segment of a reassembled PDU]"
"2.130826","5.9.29.183","172.19.0.3","TCP","1492","9002 → 43520 [PSH, ACK] Seq=61752 Ack=6430 Win=65535 Len=1436 [TCP segment of a reassembled PDU]"
"2.130955","172.19.0.3","5.9.29.183","TCP","56","43520 → 9002 [ACK] Seq=6430 Ack=63188 Win=11903 Len=0"
"2.140120","5.9.29.183","172.19.0.3","TLSv1.2","273","Application Data"
"2.140653","172.19.0.3","5.9.29.183","TLSv1.2","599","Application Data"
"2.140918","5.9.29.183","172.19.0.3","TCP","56","9002 → 43520 [ACK] Seq=63405 Ack=6973 Win=65535 Len=0"
"2.150574","172.19.0.3","5.9.29.183","TLSv1.2","599","Application Data"
"2.150784","5.9.29.183","172.19.0.3","TCP","56","9002 → 43520 [ACK] Seq=63405 Ack=7516 Win=65535 Len=0"
"2.470137","5.9.29.183","172.19.0.3","TLSv1.2","599","Application Data"
"2.471085","172.19.0.3","5.9.29.183","TLSv1.2","599","Application Data"
"2.471410","5.9.29.183","172.19.0.3","TCP","56","9002 → 43520 [ACK] Seq=63948 Ack=8059 Win=65535 Len=0"
"2.711584","5.9.29.183","172.19.0.3","TLSv1.2","599","Application Data"
"2.738583","5.9.29.183","172.19.0.3","TCP","1516","[TCP segment of a reassembled PDU]"
"2.738607","172.19.0.3","5.9.29.183","TCP","56","43520 → 9002 [ACK] Seq=8059 Ack=65951 Win=11911 Len=0"
"2.738648","5.9.29.183","172.19.0.3","TCP","1492","9002 → 43520 [PSH, ACK] Seq=65951 Ack=8059 Win=65535 Len=1436 [TCP segment of a reassembled PDU]"
"2.738659","5.9.29.183","172.19.0.3","TLSv1.2","1516","Application Data [TCP segment of a reassembled PDU]"
"2.738793","5.9.29.183","172.19.0.3","TCP","1516","9002 → 43520 [PSH, ACK] Seq=68847 Ack=8059 Win=65535 Len=1460 [TCP segment of a reassembled PDU]"
"2.738845","5.9.29.183","172.19.0.3","TCP","1213","9002 → 43520 [PSH, ACK] Seq=70307 Ack=8059 Win=65535 Len=1157 [TCP segment of a reassembled PDU]"
"2.738862","172.19.0.3","5.9.29.183","TCP","56","43520 → 9002 [ACK] Seq=8059 Ack=70307 Win=11887 Len=0"
"2.753872","5.9.29.183","172.19.0.3","TLSv1.2","337","Application Data"
"2.754069","172.19.0.3","5.9.29.183","TCP","56","43520 → 9002 [ACK] Seq=8059 Ack=71745 Win=11911 Len=0"
"2.768772","5.9.29.183","172.19.0.3","TLSv1.2","599","Application Data"
"2.769048","5.9.29.183","172.19.0.3","TCP","1504","[TCP segment of a reassembled PDU]"
"2.769063","172.19.0.3","5.9.29.183","TCP","56","43520 → 9002 [ACK] Seq=8059 Ack=73736 Win=11911 Len=0"
"2.769218","5.9.29.183","172.19.0.3","TCP","1504","9002 → 43520 [PSH, ACK] Seq=73736 Ack=8059 Win=65535 Len=1448 [TCP segment of a reassembled PDU]"
"2.769368","5.9.29.183","172.19.0.3","TLSv1.2","1504","Application Data [TCP segment of a reassembled PDU]"
"2.769376","172.19.0.3","5.9.29.183","TCP","56","43520 → 9002 [ACK] Seq=8059 Ack=76632 Win=11911 Len=0"
"2.769528","5.9.29.183","172.19.0.3","TCP","1516","9002 → 43520 [PSH, ACK] Seq=76632 Ack=8059 Win=65535 Len=1460 [TCP segment of a reassembled PDU]"
"2.769535","5.9.29.183","172.19.0.3","TCP","1492","9002 → 43520 [PSH, ACK] Seq=78092 Ack=8059 Win=65535 Len=1436 [TCP segment of a reassembled PDU]"
"2.769624","172.19.0.3","5.9.29.183","TCP","56","43520 → 9002 [ACK] Seq=8059 Ack=79528 Win=11895 Len=0"
"2.784228","5.9.29.183","172.19.0.3","TCP","550","9002 → 43520 [PSH, ACK] Seq=79528 Ack=8059 Win=65535 Len=494 [TCP segment of a reassembled PDU]"
"2.784350","5.9.29.183","172.19.0.3","TLSv1.2","1516","Application Data [TCP segment of a reassembled PDU]"
"2.784365","172.19.0.3","5.9.29.183","TCP","56","43520 → 9002 [ACK] Seq=8059 Ack=81482 Win=11903 Len=0"
"2.784367","5.9.29.183","172.19.0.3","TCP","1516","9002 → 43520 [PSH, ACK] Seq=81482 Ack=8059 Win=65535 Len=1460 [TCP segment of a reassembled PDU]"
"2.784458","5.9.29.183","172.19.0.3","TCP","986","9002 → 43520 [PSH, ACK] Seq=82942 Ack=8059 Win=65535 Len=930 [TCP segment of a reassembled PDU]"
"2.784555","5.9.29.183","172.19.0.3","TLSv1.2","1516","Application Data [TCP segment of a reassembled PDU]"
"2.784561","5.9.29.183","172.19.0.3","TCP","1516","9002 → 43520 [PSH, ACK] Seq=85332 Ack=8059 Win=65535 Len=1460 [TCP segment of a reassembled PDU]"
"2.784588","172.19.0.3","5.9.29.183","TCP","56","43520 → 9002 [ACK] Seq=8059 Ack=86792 Win=11871 Len=0"
"2.784643","5.9.29.183","172.19.0.3","TLSv1.2","1088","Application Data"
"2.799347","5.9.29.183","172.19.0.3","TCP","1516","[TCP segment of a reassembled PDU]"
"2.799368","172.19.0.3","5.9.29.183","TCP","56","43520 → 9002 [ACK] Seq=8059 Ack=89284 Win=11911 Len=0"
"2.799410","5.9.29.183","172.19.0.3","TCP","1516","9002 → 43520 [PSH, ACK] Seq=89284 Ack=8059 Win=65535 Len=1460 [TCP segment of a reassembled PDU]"
"2.799424","5.9.29.183","172.19.0.3","TLSv1.2","1480","Application Data [TCP segment of a reassembled PDU]"
"2.799628","5.9.29.183","172.19.0.3","TLSv1.2","396","Application Data"
"2.799634","172.19.0.3","5.9.29.183","TCP","56","43520 → 9002 [ACK] Seq=8059 Ack=92168 Win=11895 Len=0"
"2.799919","172.19.0.3","5.9.29.183","TLSv1.2","599","Application Data"
"2.800225","5.9.29.183","172.19.0.3","TCP","56","9002 → 43520 [ACK] Seq=92508 Ack=8602 Win=65535 Len=0"
"2.813964","5.9.29.183","172.19.0.3","TCP","1516","[TCP segment of a reassembled PDU]"
"2.814017","5.9.29.183","172.19.0.3","TCP","1516","9002 → 43520 [PSH, ACK] Seq=93968 Ack=8602 Win=65535 Len=1460 [TCP segment of a reassembled PDU]"
"2.814031","172.19.0.3","5.9.29.183","TCP","56","43520 → 9002 [ACK] Seq=8602 Ack=95428 Win=11903 Len=0"
"2.814034","5.9.29.183","172.19.0.3","TLSv1.2","1480","Application Data [TCP segment of a reassembled PDU]"
"2.814037","5.9.29.183","172.19.0.3","TCP","1516","9002 → 43520 [PSH, ACK] Seq=96852 Ack=8602 Win=65535 Len=1460 [TCP segment of a reassembled PDU]"
"2.814040","5.9.29.183","172.19.0.3","TCP","1516","9002 → 43520 [PSH, ACK] Seq=98312 Ack=8602 Win=65535 Len=1460 [TCP segment of a reassembled PDU]"
"2.814042","5.9.29.183","172.19.0.3","TLSv1.2","1516","Application Data [TCP segment of a reassembled PDU]"
"2.814111","5.9.29.183","172.19.0.3","TCP","1516","9002 → 43520 [PSH, ACK] Seq=101232 Ack=8602 Win=65535 Len=1460 [TCP segment of a reassembled PDU]"
"2.814119","5.9.29.183","172.19.0.3","TCP","1456","9002 → 43520 [PSH, ACK] Seq=102692 Ack=8602 Win=65535 Len=1400 [TCP segment of a reassembled PDU]"
"2.814151","172.19.0.3","5.9.29.183","TCP","56","43520 → 9002 [ACK] Seq=8602 Ack=104092 Win=11853 Len=0"
"2.814663","5.9.29.183","172.19.0.3","TLSv1.2","381","Application Data"
"2.829580","5.9.29.183","172.19.0.3","TCP","1516","[TCP segment of a reassembled PDU]"
"2.829606","172.19.0.3","5.9.29.183","TCP","56","43520 → 9002 [ACK] Seq=8602 Ack=105877 Win=11911 Len=0"
"2.829680","5.9.29.183","172.19.0.3","TCP","1492","9002 → 43520 [PSH, ACK] Seq=105877 Ack=8602 Win=65535 Len=1436 [TCP segment of a reassembled PDU]"
"2.829703","5.9.29.183","172.19.0.3","TLSv1.2","1516","Application Data [TCP segment of a reassembled PDU]"
"2.829709","5.9.29.183","172.19.0.3","TCP","1516","9002 → 43520 [PSH, ACK] Seq=108773 Ack=8602 Win=65535 Len=1460 [TCP segment of a reassembled PDU]"
"2.829713","5.9.29.183","172.19.0.3","TCP","1516","9002 → 43520 [PSH, ACK] Seq=110233 Ack=8602 Win=65535 Len=1460 [TCP segment of a reassembled PDU]"
"2.829716","5.9.29.183","172.19.0.3","TLSv1.2","1516","Application Data [TCP segment of a reassembled PDU]"
"2.829815","172.19.0.3","5.9.29.183","TCP","56","43520 → 9002 [ACK] Seq=8602 Ack=113153 Win=11871 Len=0"
"2.829837","5.9.29.183","172.19.0.3","TCP","1516","9002 → 43520 [PSH, ACK] Seq=113153 Ack=8602 Win=65535 Len=1460 [TCP segment of a reassembled PDU]"
"2.829843","5.9.29.183","172.19.0.3","TCP","1516","9002 → 43520 [PSH, ACK] Seq=114613 Ack=8602 Win=65535 Len=1460 [TCP segment of a reassembled PDU]"
"2.829846","5.9.29.183","172.19.0.3","TLSv1.2","1516","Application Data [TCP segment of a reassembled PDU]"
"2.829849","5.9.29.183","172.19.0.3","TCP","1516","9002 → 43520 [PSH, ACK] Seq=117533 Ack=8602 Win=65535 Len=1460 [TCP segment of a reassembled PDU]"
"2.829852","5.9.29.183","172.19.0.3","TCP","1408","9002 → 43520 [PSH, ACK] Seq=118993 Ack=8602 Win=65535 Len=1352 [TCP segment of a reassembled PDU]"
"2.829855","5.9.29.183","172.19.0.3","TLSv1.2","721","Application Data, Application Data"
"2.829911","172.19.0.3","5.9.29.183","TCP","56","43520 → 9002 [ACK] Seq=8602 Ack=121010 Win=11822 Len=0"
"2.830451","172.19.0.3","5.9.29.183","TLSv1.2","599","Application Data"
"2.830770","5.9.29.183","172.19.0.3","TCP","56","9002 → 43520 [ACK] Seq=121010 Ack=9145 Win=65535 Len=0"
"2.840737","172.19.0.3","5.9.29.183","TLSv1.2","599","Application Data"
"2.841134","5.9.29.183","172.19.0.3","TCP","56","9002 → 43520 [ACK] Seq=121010 Ack=9688 Win=65535 Len=0"
"2.847051","5.9.29.183","172.19.0.3","TCP","1516","[TCP segment of a reassembled PDU]"
"2.847101","5.9.29.183","172.19.0.3","TCP","1516","9002 → 43520 [PSH, ACK] Seq=122470 Ack=9688 Win=65535 Len=1460 [TCP segment of a reassembled PDU]"
"2.847108","5.9.29.183","172.19.0.3","TLSv1.2","1213","Application Data"
"2.847218","172.19.0.3","5.9.29.183","TCP","56","43520 → 9002 [ACK] Seq=9688 Ack=125087 Win=11893 Len=0"
"2.850976","172.19.0.3","5.9.29.183","TLSv1.2","599","Application Data"
"2.851230","5.9.29.183","172.19.0.3","TCP","56","9002 → 43520 [ACK] Seq=125087 Ack=10231 Win=65535 Len=0"
"2.859861","172.19.0.3","5.9.29.183","TLSv1.2","599","Application Data"
"2.860058","5.9.29.183","172.19.0.3","TCP","56","9002 → 43520 [ACK] Seq=125087 Ack=10774 Win=65535 Len=0"
"2.862618","5.9.29.183","172.19.0.3","TLSv1.2","149","Application Data"
"2.905193","172.19.0.3","5.9.29.183","TCP","56","43520 → 9002 [ACK] Seq=10774 Ack=125180 Win=11911 Len=0"
"3.240306","5.9.29.183","172.19.0.3","TLSv1.2","599","Application Data"
"3.240370","172.19.0.3","5.9.29.183","TCP","56","43520 → 9002 [ACK] Seq=10774 Ack=125723 Win=11911 Len=0"
"3.241125","172.19.0.3","5.9.29.183","TLSv1.2","599","Application Data"
"3.241339","5.9.29.183","172.19.0.3","TCP","56","9002 → 43520 [ACK] Seq=125723 Ack=11317 Win=65535 Len=0"
"3.488790","5.9.29.183","172.19.0.3","TLSv1.2","599","Application Data"
"3.509357","5.9.29.183","172.19.0.3","TCP","1504","[TCP segment of a reassembled PDU]"
"3.509377","172.19.0.3","5.9.29.183","TCP","56","43520 → 9002 [ACK] Seq=11317 Ack=127714 Win=11911 Len=0"
"3.509420","5.9.29.183","172.19.0.3","TCP","1504","9002 → 43520 [PSH, ACK] Seq=127714 Ack=11317 Win=65535 Len=1448 [TCP segment of a reassembled PDU]"
"3.509431","5.9.29.183","172.19.0.3","TLSv1.2","787","Application Data"
"3.509554","172.19.0.3","5.9.29.183","TCP","56","43520 → 9002 [ACK] Seq=11317 Ack=129893 Win=11895 Len=0"
"3.530188","5.9.29.183","172.19.0.3","TCP","1516","[TCP segment of a reassembled PDU]"
"3.530263","5.9.29.183","172.19.0.3","TCP","1492","9002 → 43520 [PSH, ACK] Seq=131353 Ack=11317 Win=65535 Len=1436 [TCP segment of a reassembled PDU]"
"3.530279","172.19.0.3","5.9.29.183","TCP","56","43520 → 9002 [ACK] Seq=11317 Ack=132789 Win=11903 Len=0"
"3.530369","5.9.29.183","172.19.0.3","TLSv1.2","1516","Application Data [TCP segment of a reassembled PDU]"
"3.530375","5.9.29.183","172.19.0.3","TCP","1516","9002 → 43520 [PSH, ACK] Seq=134249 Ack=11317 Win=65535 Len=1460 [TCP segment of a reassembled PDU]"
"3.530408","172.19.0.3","5.9.29.183","TCP","56","43520 → 9002 [ACK] Seq=11317 Ack=135709 Win=11903 Len=0"
"3.530437","5.9.29.183","172.19.0.3","TCP","1516","9002 → 43520 [PSH, ACK] Seq=135709 Ack=11317 Win=65535 Len=1460 [TCP segment of a reassembled PDU]"
"3.530582","5.9.29.183","172.19.0.3","TLSv1.2","1201","Application Data [TCP segment of a reassembled PDU]"
"3.530696","172.19.0.3","5.9.29.183","TCP","56","43520 → 9002 [ACK] Seq=11317 Ack=138314 Win=11887 Len=0"
"3.546464","5.9.29.183","172.19.0.3","TLSv1.2","1504","Application Data [TCP segment of a reassembled PDU]"
"3.546527","5.9.29.183","172.19.0.3","TCP","1516","9002 → 43520 [PSH, ACK] Seq=139762 Ack=11317 Win=65535 Len=1460 [TCP segment of a reassembled PDU]"
"3.546541","172.19.0.3","5.9.29.183","TCP","56","43520 → 9002 [ACK] Seq=11317 Ack=141222 Win=11903 Len=0"
"3.546543","5.9.29.183","172.19.0.3","TCP","1492","9002 → 43520 [PSH, ACK] Seq=141222 Ack=11317 Win=65535 Len=1436 [TCP segment of a reassembled PDU]"
"3.546547","5.9.29.183","172.19.0.3","TLSv1.2","1504","Application Data [TCP segment of a reassembled PDU]"
"3.546615","5.9.29.183","172.19.0.3","TCP","1508","9002 → 43520 [PSH, ACK] Seq=144106 Ack=11317 Win=65535 Len=1452 [TCP segment of a reassembled PDU]"
"3.546623","5.9.29.183","172.19.0.3","TCP","1516","9002 → 43520 [PSH, ACK] Seq=145558 Ack=11317 Win=65535 Len=1460 [TCP segment of a reassembled PDU]"
"3.546673","172.19.0.3","5.9.29.183","TCP","56","43520 → 9002 [ACK] Seq=11317 Ack=147018 Win=11871 Len=0"
"3.546702","5.9.29.183","172.19.0.3","TLSv1.2","1516","Application Data [TCP segment of a reassembled PDU]"
"3.546705","5.9.29.183","172.19.0.3","TCP","1476","9002 → 43520 [PSH, ACK] Seq=148478 Ack=11317 Win=65535 Len=1420 [TCP segment of a reassembled PDU]"
"3.546815","5.9.29.183","172.19.0.3","TCP","1516","9002 → 43520 [PSH, ACK] Seq=149898 Ack=11317 Win=65535 Len=1460 [TCP segment of a reassembled PDU]"
"3.546822","5.9.29.183","172.19.0.3","TLSv1.2","1492","Application Data [TCP segment of a reassembled PDU]"
"3.546852","172.19.0.3","5.9.29.183","TCP","56","43520 → 9002 [ACK] Seq=11317 Ack=152794 Win=11836 Len=0"
"3.546904","5.9.29.183","172.19.0.3","TCP","1516","9002 → 43520 [PSH, ACK] Seq=152794 Ack=11317 Win=65535 Len=1460 [TCP segment of a reassembled PDU]"
"3.546909","5.9.29.183","172.19.0.3","TLSv1.2","570","Application Data"
"3.547079","172.19.0.3","5.9.29.183","TCP","56","43520 → 9002 [ACK] Seq=11317 Ack=154768 Win=11821 Len=0"
"3.547432","172.19.0.3","5.9.29.183","TLSv1.2","599","Application Data"
"3.547637","5.9.29.183","172.19.0.3","TCP","56","9002 → 43520 [ACK] Seq=154768 Ack=11860 Win=65535 Len=0"
"3.563353","5.9.29.183","172.19.0.3","TCP","1516","[TCP segment of a reassembled PDU]"
"3.563420","5.9.29.183","172.19.0.3","TCP","1516","9002 → 43520 [PSH, ACK] Seq=156228 Ack=11860 Win=65535 Len=1460 [TCP segment of a reassembled PDU]"
"3.563437","172.19.0.3","5.9.29.183","TCP","56","43520 → 9002 [ACK] Seq=11860 Ack=157688 Win=11903 Len=0"
"3.563440","5.9.29.183","172.19.0.3","TLSv1.2","1213","Application Data"
"3.563444","5.9.29.183","172.19.0.3","TCP","1516","[TCP segment of a reassembled PDU]"
"3.563448","5.9.29.183","172.19.0.3","TCP","1516","9002 → 43520 [PSH, ACK] Seq=160305 Ack=11860 Win=65535 Len=1460 [TCP segment of a reassembled PDU]"
"3.563534","5.9.29.183","172.19.0.3","TLSv1.2","1516","Application Data [TCP segment of a reassembled PDU]"
"3.563541","5.9.29.183","172.19.0.3","TCP","1516","9002 → 43520 [PSH, ACK] Seq=163225 Ack=11860 Win=65535 Len=1460 [TCP segment of a reassembled PDU]"
"3.563544","5.9.29.183","172.19.0.3","TCP","1516","9002 → 43520 [PSH, ACK] Seq=164685 Ack=11860 Win=65535 Len=1460 [TCP segment of a reassembled PDU]"
"3.563547","5.9.29.183","172.19.0.3","TLSv1.2","1444","Application Data [TCP segment of a reassembled PDU]"
"3.563571","172.19.0.3","5.9.29.183","TCP","56","43520 → 9002 [ACK] Seq=11860 Ack=167533 Win=11847 Len=0"
"3.564313","172.19.0.3","5.9.29.183","TLSv1.2","599","Application Data"
"3.564597","5.9.29.183","172.19.0.3","TCP","56","9002 → 43520 [ACK] Seq=167533 Ack=12403 Win=65535 Len=0"
"3.579022","5.9.29.183","172.19.0.3","TLSv1.2","1285","Application Data"
"3.583357","5.9.29.183","172.19.0.3","TCP","1504","[TCP segment of a reassembled PDU]"
"3.583376","172.19.0.3","5.9.29.183","TCP","56","43520 → 9002 [ACK] Seq=12403 Ack=170210 Win=11911 Len=0"
"3.583414","5.9.29.183","172.19.0.3","TCP","1516","9002 → 43520 [PSH, ACK] Seq=170210 Ack=12403 Win=65535 Len=1460 [TCP segment of a reassembled PDU]"
"3.583424","5.9.29.183","172.19.0.3","TLSv1.2","1492","Application Data [TCP segment of a reassembled PDU]"
"3.583573","172.19.0.3","5.9.29.183","TCP","56","43520 → 9002 [ACK] Seq=12403 Ack=173106 Win=11895 Len=0"
"3.594862","5.9.29.183","172.19.0.3","TLSv1.2","1424","Application Data"
"3.598999","172.19.0.3","5.9.29.183","TLSv1.2","599","Application Data"
"3.599374","5.9.29.183","172.19.0.3","TCP","56","9002 → 43520 [ACK] Seq=174474 Ack=12946 Win=65535 Len=0"
"4.000150","5.9.29.183","172.19.0.3","TLSv1.2","599","Application Data"
"4.000994","172.19.0.3","5.9.29.183","TLSv1.2","599","Application Data"
"4.001264","5.9.29.183","172.19.0.3","TCP","56","9002 → 43520 [ACK] Seq=175017 Ack=13489 Win=65535 Len=0"
"4.248432","5.9.29.183","172.19.0.3","TLSv1.2","599","Application Data"
"4.275757","5.9.29.183","172.19.0.3","TCP","1516","[TCP segment of a reassembled PDU]"
"4.275777","172.19.0.3","5.9.29.183","TCP","56","43520 → 9002 [ACK] Seq=13489 Ack=177020 Win=11911 Len=0"
"4.275843","5.9.29.183","172.19.0.3","TCP","1516","9002 → 43520 [PSH, ACK] Seq=177020 Ack=13489 Win=65535 Len=1460 [TCP segment of a reassembled PDU]"
"4.275859","5.9.29.183","172.19.0.3","TLSv1.2","1516","Application Data [TCP segment of a reassembled PDU]"
"4.275865","5.9.29.183","172.19.0.3","TCP","1516","9002 → 43520 [PSH, ACK] Seq=179940 Ack=13489 Win=65535 Len=1460 [TCP segment of a reassembled PDU]"
"4.275871","5.9.29.183","172.19.0.3","TCP","1189","9002 → 43520 [PSH, ACK] Seq=181400 Ack=13489 Win=65535 Len=1133 [TCP segment of a reassembled PDU]"
"4.276007","172.19.0.3","5.9.29.183","TCP","56","43520 → 9002 [ACK] Seq=13489 Ack=182533 Win=11879 Len=0"
"4.292553","5.9.29.183","172.19.0.3","TLSv1.2","851","Application Data"
"4.306099","5.9.29.183","172.19.0.3","TCP","1516","[TCP segment of a reassembled PDU]"
"4.306119","172.19.0.3","5.9.29.183","TCP","56","43520 → 9002 [ACK] Seq=13489 Ack=184788 Win=11911 Len=0"
"4.306160","5.9.29.183","172.19.0.3","TCP","1492","9002 → 43520 [PSH, ACK] Seq=184788 Ack=13489 Win=65535 Len=1436 [TCP segment of a reassembled PDU]"
"4.306229","5.9.29.183","172.19.0.3","TLSv1.2","1516","Application Data [TCP segment of a reassembled PDU]"
"4.306342","172.19.0.3","5.9.29.183","TCP","56","43520 → 9002 [ACK] Seq=13489 Ack=187684 Win=11895 Len=0"
"4.306352","5.9.29.183","172.19.0.3","TLSv1.2","1516","Application Data [TCP segment of a reassembled PDU]"
"4.306356","5.9.29.183","172.19.0.3","TCP","1480","9002 → 43520 [PSH, ACK] Seq=189144 Ack=13489 Win=65535 Len=1424 [TCP segment of a reassembled PDU]"
"4.306358","5.9.29.183","172.19.0.3","TCP","1516","9002 → 43520 [PSH, ACK] Seq=190568 Ack=13489 Win=65535 Len=1460 [TCP segment of a reassembled PDU]"
"4.306359","5.9.29.183","172.19.0.3","TLSv1.2","1516","Application Data, Application Data"
"4.306361","5.9.29.183","172.19.0.3","TCP","1480","9002 → 43520 [PSH, ACK] Seq=193488 Ack=13489 Win=65535 Len=1424 [TCP segment of a reassembled PDU]"
"4.306403","172.19.0.3","5.9.29.183","TCP","56","43520 → 9002 [ACK] Seq=13489 Ack=194912 Win=11853 Len=0"
"4.307729","5.9.29.183","172.19.0.3","TCP","1504","9002 → 43520 [PSH, ACK] Seq=194912 Ack=13489 Win=65535 Len=1448 [TCP segment of a reassembled PDU]"
"4.307846","5.9.29.183","172.19.0.3","TLSv1.2","1504","Application Data [TCP segment of a reassembled PDU]"
"4.307853","172.19.0.3","5.9.29.183","TCP","56","43520 → 9002 [ACK] Seq=13489 Ack=197808 Win=11911 Len=0"
"4.307855","5.9.29.183","172.19.0.3","TLSv1.2","142","Application Data"
"4.321287","5.9.29.183","172.19.0.3","TCP","1504","[TCP segment of a reassembled PDU]"
"4.321308","172.19.0.3","5.9.29.183","TCP","56","43520 → 9002 [ACK] Seq=13489 Ack=199342 Win=11911 Len=0"
"4.323582","5.9.29.183","172.19.0.3","TLSv1.2","693","Application Data"
"4.325389","5.9.29.183","172.19.0.3","TCP","1504","[TCP segment of a reassembled PDU]"
"4.325400","172.19.0.3","5.9.29.183","TCP","56","43520 → 9002 [ACK] Seq=13489 Ack=201427 Win=11911 Len=0"
"4.338822","5.9.29.183","172.19.0.3","TLSv1.2","1207","Application Data"
"4.339442","172.19.0.3","5.9.29.183","TLSv1.2","599","Application Data"
"4.339881","5.9.29.183","172.19.0.3","TCP","56","9002 → 43520 [ACK] Seq=202578 Ack=14032 Win=65535 Len=0"
"4.349115","172.19.0.3","5.9.29.183","TLSv1.2","599","Application Data"
"4.349513","5.9.29.183","172.19.0.3","TCP","56","9002 → 43520 [ACK] Seq=202578 Ack=14575 Win=65535 Len=0"
"4.562493","5.9.29.183","172.19.0.3","TLSv1.2","599","Application Data"
"4.563266","172.19.0.3","5.9.29.183","TLSv1.2","599","Application Data"
"4.563526","5.9.29.183","172.19.0.3","TCP","56","9002 → 43520 [ACK] Seq=203121 Ack=15118 Win=65535 Len=0"
"4.781290","5.9.29.183","172.19.0.3","TLSv1.2","599","Application Data"
"4.819734","5.9.29.183","172.19.0.3","TCP","1516","[TCP segment of a reassembled PDU]"
"4.819752","172.19.0.3","5.9.29.183","TCP","56","43520 → 9002 [ACK] Seq=15118 Ack=205124 Win=11911 Len=0"
"4.819786","5.9.29.183","172.19.0.3","TCP","1492","9002 → 43520 [PSH, ACK] Seq=205124 Ack=15118 Win=65535 Len=1436 [TCP segment of a reassembled PDU]"
"4.819796","5.9.29.183","172.19.0.3","TLSv1.2","1516","Application Data [TCP segment of a reassembled PDU]"
"4.819799","5.9.29.183","172.19.0.3","TCP","1516","9002 → 43520 [PSH, ACK] Seq=208020 Ack=15118 Win=65535 Len=1460 [TCP segment of a reassembled PDU]"
"4.819801","5.9.29.183","172.19.0.3","TCP","1213","9002 → 43520 [PSH, ACK] Seq=209480 Ack=15118 Win=65535 Len=1157 [TCP segment of a reassembled PDU]"
"4.819803","5.9.29.183","172.19.0.3","TCP","513","9002 → 43520 [PSH, ACK] Seq=210637 Ack=15118 Win=65535 Len=457 [TCP segment of a reassembled PDU]"
"4.819854","5.9.29.183","172.19.0.3","TLSv1.2","1516","Application Data [TCP segment of a reassembled PDU]"
"4.819858","5.9.29.183","172.19.0.3","TCP","1516","9002 → 43520 [PSH, ACK] Seq=212554 Ack=15118 Win=65535 Len=1460 [TCP segment of a reassembled PDU]"
"4.819891","5.9.29.183","172.19.0.3","TCP","1023","9002 → 43520 [PSH, ACK] Seq=214014 Ack=15118 Win=65535 Len=967 [TCP segment of a reassembled PDU]"
"4.819908","172.19.0.3","5.9.29.183","TCP","56","43520 → 9002 [ACK] Seq=15118 Ack=214981 Win=11847 Len=0"
"4.834717","5.9.29.183","172.19.0.3","TLSv1.2","1516","Application Data [TCP segment of a reassembled PDU]"
"4.834774","5.9.29.183","172.19.0.3","TCP","1492","9002 → 43520 [PSH, ACK] Seq=216441 Ack=15118 Win=65535 Len=1436 [TCP segment of a reassembled PDU]"
"4.834794","172.19.0.3","5.9.29.183","TCP","56","43520 → 9002 [ACK] Seq=15118 Ack=217877 Win=11903 Len=0"
"4.834957","5.9.29.183","172.19.0.3","TCP","1504","9002 → 43520 [PSH, ACK] Seq=217877 Ack=15118 Win=65535 Len=1448 [TCP segment of a reassembled PDU]"
"4.834963","5.9.29.183","172.19.0.3","TLSv1.2","1504","Application Data [TCP segment of a reassembled PDU]"
"4.835047","5.9.29.183","172.19.0.3","TCP","1516","9002 → 43520 [PSH, ACK] Seq=220773 Ack=15118 Win=65535 Len=1460 [TCP segment of a reassembled PDU]"
"4.835102","5.9.29.183","172.19.0.3","TCP","1492","9002 → 43520 [PSH, ACK] Seq=222233 Ack=15118 Win=65535 Len=1436 [TCP segment of a reassembled PDU]"
"4.835111","172.19.0.3","5.9.29.183","TCP","56","43520 → 9002 [ACK] Seq=15118 Ack=222233 Win=11877 Len=0"
"4.835132","5.9.29.183","172.19.0.3","TLSv1.2","1516","Application Data [TCP segment of a reassembled PDU]"
"4.835135","5.9.29.183","172.19.0.3","TCP","1492","9002 → 43520 [PSH, ACK] Seq=225129 Ack=15118 Win=65535 Len=1436 [TCP segment of a reassembled PDU]"
"4.835152","172.19.0.3","5.9.29.183","TCP","56","43520 → 9002 [ACK] Seq=15118 Ack=226565 Win=11853 Len=0"
"4.835196","5.9.29.183","172.19.0.3","TLSv1.2","1504","Application Data [TCP segment of a reassembled PDU]"
"4.835230","5.9.29.183","172.19.0.3","TCP","1504","9002 → 43520 [PSH, ACK] Seq=228013 Ack=15118 Win=65535 Len=1448 [TCP segment of a reassembled PDU]"
"4.835331","5.9.29.183","172.19.0.3","TLSv1.2","1190","Application Data"
"4.835391","172.19.0.3","5.9.29.183","TLSv1.2","599","Application Data"
"4.835540","5.9.29.183","172.19.0.3","TCP","56","9002 → 43520 [ACK] Seq=230595 Ack=15661 Win=65535 Len=0"
"4.845026","172.19.0.3","5.9.29.183","TLSv1.2","599","Application Data"
"4.845325","5.9.29.183","172.19.0.3","TCP","56","9002 → 43520 [ACK] Seq=230595 Ack=16204 Win=65535 Len=0"
"4.848533","5.9.29.183","172.19.0.3","TCP","1504","[TCP segment of a reassembled PDU]"
"4.848619","5.9.29.183","172.19.0.3","TCP","1504","9002 → 43520 [PSH, ACK] Seq=232043 Ack=16204 Win=65535 Len=1448 [TCP segment of a reassembled PDU]"
"4.848624","5.9.29.183","172.19.0.3","TLSv1.2","1504","Application Data [TCP segment of a reassembled PDU]"
"4.848654","172.19.0.3","5.9.29.183","TCP","56","43520 → 9002 [ACK] Seq=16204 Ack=234939 Win=11895 Len=0"
"4.850669","5.9.29.183","172.19.0.3","TLSv1.2","396","Application Data"
"4.866292","5.9.29.183","172.19.0.3","TCP","1516","[TCP segment of a reassembled PDU]"
"4.866310","172.19.0.3","5.9.29.183","TCP","56","43520 → 9002 [ACK] Seq=16204 Ack=236739 Win=11911 Len=0"
"4.866342","5.9.29.183","172.19.0.3","TCP","1516","9002 → 43520 [PSH, ACK] Seq=236739 Ack=16204 Win=65535 Len=1460 [TCP segment of a reassembled PDU]"
"4.866350","5.9.29.183","172.19.0.3","TLSv1.2","249","Application Data"
"4.866542","172.19.0.3","5.9.29.183","TCP","56","43520 → 9002 [ACK] Seq=16204 Ack=238392 Win=11899 Len=0"
"4.869935","172.19.0.3","5.9.29.183","TLSv1.2","599","Application Data"
"4.870183","5.9.29.183","172.19.0.3","TCP","56","9002 → 43520 [ACK] Seq=238392 Ack=16747 Win=65535 Len=0"
"5.188343","5.9.29.183","172.19.0.3","TLSv1.2","599","Application Data"
"5.189401","172.19.0.3","5.9.29.183","TLSv1.2","599","Application Data"
"5.189757","5.9.29.183","172.19.0.3","TCP","56","9002 → 43520 [ACK] Seq=238935 Ack=17290 Win=65535 Len=0"
"5.459718","5.9.29.183","172.19.0.3","TCP","1516","[TCP segment of a reassembled PDU]"
"5.459803","5.9.29.183","172.19.0.3","TCP","1492","9002 → 43520 [PSH, ACK] Seq=240395 Ack=17290 Win=65535 Len=1436 [TCP segment of a reassembled PDU]"
"5.459814","5.9.29.183","172.19.0.3","TLSv1.2","787","Application Data"
"5.459938","172.19.0.3","5.9.29.183","TCP","56","43520 → 9002 [ACK] Seq=17290 Ack=242562 Win=11895 Len=0"
"5.475094","5.9.29.183","172.19.0.3","TLSv1.2","599","Application Data"
"5.486326","5.9.29.183","172.19.0.3","TCP","1516","[TCP segment of a reassembled PDU]"
"5.486345","172.19.0.3","5.9.29.183","TCP","56","43520 → 9002 [ACK] Seq=17290 Ack=244565 Win=11911 Len=0"
"5.486390","5.9.29.183","172.19.0.3","TCP","1516","9002 → 43520 [PSH, ACK] Seq=244565 Ack=17290 Win=65535 Len=1460 [TCP segment of a reassembled PDU]"
"5.486399","5.9.29.183","172.19.0.3","TLSv1.2","1516","Application Data [TCP segment of a reassembled PDU]"
"5.486402","5.9.29.183","172.19.0.3","TCP","1516","9002 → 43520 [PSH, ACK] Seq=247485 Ack=17290 Win=65535 Len=1460 [TCP segment of a reassembled PDU]"
"5.486407","5.9.29.183","172.19.0.3","TCP","1516","9002 → 43520 [PSH, ACK] Seq=248945 Ack=17290 Win=65535 Len=1460 [TCP segment of a reassembled PDU]"
"5.486410","5.9.29.183","172.19.0.3","TLSv1.2","1516","Application Data [TCP segment of a reassembled PDU]"
"5.486413","5.9.29.183","172.19.0.3","TCP","1432","9002 → 43520 [PSH, ACK] Seq=251865 Ack=17290 Win=65535 Len=1376 [TCP segment of a reassembled PDU]"
"5.486474","5.9.29.183","172.19.0.3","TCP","1516","9002 → 43520 [PSH, ACK] Seq=253241 Ack=17290 Win=65535 Len=1460 [TCP segment of a reassembled PDU]"
"5.486480","5.9.29.183","172.19.0.3","TLSv1.2","1492","Application Data [TCP segment of a reassembled PDU]"
"5.486526","172.19.0.3","5.9.29.183","TCP","56","43520 → 9002 [ACK] Seq=17290 Ack=256137 Win=11845 Len=0"
"5.490507","5.9.29.183","172.19.0.3","TCP","1516","9002 → 43520 [PSH, ACK] Seq=256137 Ack=17290 Win=65535 Len=1460 [TCP segment of a reassembled PDU]"
"5.490558","5.9.29.183","172.19.0.3","TCP","1492","9002 → 43520 [PSH, ACK] Seq=257597 Ack=17290 Win=65535 Len=1436 [TCP segment of a reassembled PDU]"
"5.490571","172.19.0.3","5.9.29.183","TCP","56","43520 → 9002 [ACK] Seq=17290 Ack=259033 Win=11903 Len=0"
"5.501630","5.9.29.183","172.19.0.3","TLSv1.2","178","Application Data"
"5.505636","172.19.0.3","5.9.29.183","TLSv1.2","599","Application Data"
"5.505905","5.9.29.183","172.19.0.3","TCP","56","9002 → 43520 [ACK] Seq=259155 Ack=17833 Win=65535 Len=0"
"5.765630","5.9.29.183","172.19.0.3","TLSv1.2","599","Application Data"
"5.766830","172.19.0.3","5.9.29.183","TLSv1.2","599","Application Data"
"5.767119","5.9.29.183","172.19.0.3","TCP","56","9002 → 43520 [ACK] Seq=259698 Ack=18376 Win=65535 Len=0"
"6.072727","5.9.29.183","172.19.0.3","TLSv1.2","599","Application Data"
"6.104125","5.9.29.183","172.19.0.3","TCP","1516","[TCP segment of a reassembled PDU]"
"6.104149","172.19.0.3","5.9.29.183","TCP","56","43520 → 9002 [ACK] Seq=18376 Ack=261701 Win=11909 Len=0"
"6.104199","5.9.29.183","172.19.0.3","TCP","1516","9002 → 43520 [PSH, ACK] Seq=261701 Ack=18376 Win=65535 Len=1460 [TCP segment of a reassembled PDU]"
"6.104213","5.9.29.183","172.19.0.3","TLSv1.2","763","Application Data"
"6.104401","172.19.0.3","5.9.29.183","TCP","56","43520 → 9002 [ACK] Seq=18376 Ack=263868 Win=11893 Len=0"
"6.120114","5.9.29.183","172.19.0.3","TCP","1516","[TCP segment of a reassembled PDU]"
"6.120175","5.9.29.183","172.19.0.3","TCP","1492","9002 → 43520 [PSH, ACK] Seq=265328 Ack=18376 Win=65535 Len=1436 [TCP segment of a reassembled PDU]"
"6.120195","172.19.0.3","5.9.29.183","TCP","56","43520 → 9002 [ACK] Seq=18376 Ack=266764 Win=11903 Len=0"
"6.121462","5.9.29.183","172.19.0.3","TLSv1.2","787","Application Data"
"6.130290","5.9.29.183","172.19.0.3","TCP","1504","[TCP segment of a reassembled PDU]"
"6.130352","172.19.0.3","5.9.29.183","TCP","56","43520 → 9002 [ACK] Seq=18376 Ack=268943 Win=11911 Len=0"
"6.130401","5.9.29.183","172.19.0.3","TCP","1516","9002 → 43520 [PSH, ACK] Seq=268943 Ack=18376 Win=65535 Len=1460 [TCP segment of a reassembled PDU]"
"6.130448","5.9.29.183","172.19.0.3","TLSv1.2","1492","Application Data [TCP segment of a reassembled PDU]"
"6.130532","5.9.29.183","172.19.0.3","TCP","1516","9002 → 43520 [PSH, ACK] Seq=271839 Ack=18376 Win=65535 Len=1460 [TCP segment of a reassembled PDU]"
"6.130541","5.9.29.183","172.19.0.3","TCP","1492","9002 → 43520 [PSH, ACK] Seq=273299 Ack=18376 Win=65535 Len=1436 [TCP segment of a reassembled PDU]"
"6.130585","172.19.0.3","5.9.29.183","TCP","56","43520 → 9002 [ACK] Seq=18376 Ack=274735 Win=11879 Len=0"
"6.137416","5.9.29.183","172.19.0.3","TLSv1.2","584","Application Data"
"6.137898","172.19.0.3","5.9.29.183","TLSv1.2","599","Application Data"
"6.138291","5.9.29.183","172.19.0.3","TCP","56","9002 → 43520 [ACK] Seq=275263 Ack=18919 Win=65535 Len=0"
"6.144468","5.9.29.183","172.19.0.3","TCP","1423","[TCP segment of a reassembled PDU]"
"6.144556","5.9.29.183","172.19.0.3","TCP","137","9002 → 43520 [PSH, ACK] Seq=276630 Ack=18919 Win=65535 Len=81 [TCP segment of a reassembled PDU]"
"6.144576","5.9.29.183","172.19.0.3","TCP","1504","9002 → 43520 [PSH, ACK] Seq=276711 Ack=18919 Win=65535 Len=1448 [TCP segment of a reassembled PDU]"
"6.144664","172.19.0.3","5.9.29.183","TCP","56","43520 → 9002 [ACK] Seq=18919 Ack=278159 Win=11895 Len=0"
"6.144934","5.9.29.183","172.19.0.3","TLSv1.2","1516","Application Data [TCP segment of a reassembled PDU]"
"6.144973","5.9.29.183","172.19.0.3","TCP","1516","9002 → 43520 [PSH, ACK] Seq=279619 Ack=18919 Win=65535 Len=1460 [TCP segment of a reassembled PDU]"
"6.144984","172.19.0.3","5.9.29.183","TCP","56","43520 → 9002 [ACK] Seq=18919 Ack=281079 Win=11903 Len=0"
"6.144986","5.9.29.183","172.19.0.3","TCP","1516","9002 → 43520 [PSH, ACK] Seq=281079 Ack=18919 Win=65535 Len=1460 [TCP segment of a reassembled PDU]"
"6.145036","5.9.29.183","172.19.0.3","TLSv1.2","1516","Application Data [TCP segment of a reassembled PDU]"
"6.145041","5.9.29.183","172.19.0.3","TCP","1456","9002 → 43520 [PSH, ACK] Seq=283999 Ack=18919 Win=65535 Len=1400 [TCP segment of a reassembled PDU]"
"6.145145","172.19.0.3","5.9.29.183","TCP","56","43520 → 9002 [ACK] Seq=18919 Ack=285399 Win=11879 Len=0"
"6.146010","5.9.29.183","172.19.0.3","TCP","1504","9002 → 43520 [PSH, ACK] Seq=285399 Ack=18919 Win=65535 Len=1448 [TCP segment of a reassembled PDU]"
"6.146170","5.9.29.183","172.19.0.3","TLSv1.2","1516","Application Data [TCP segment of a reassembled PDU]"
"6.146177","172.19.0.3","5.9.29.183","TCP","56","43520 → 9002 [ACK] Seq=18919 Ack=288307 Win=11911 Len=0"
"6.146324","5.9.29.183","172.19.0.3","TCP","1516","9002 → 43520 [PSH, ACK] Seq=288307 Ack=18919 Win=65535 Len=1460 [TCP segment of a reassembled PDU]"
"6.146345","5.9.29.183","172.19.0.3","TCP","1480","9002 → 43520 [PSH, ACK] Seq=289767 Ack=18919 Win=65535 Len=1424 [TCP segment of a reassembled PDU]"
"6.146366","172.19.0.3","5.9.29.183","TCP","56","43520 → 9002 [ACK] Seq=18919 Ack=291191 Win=11895 Len=0"
"6.146688","172.19.0.3","5.9.29.183","TLSv1.2","599","Application Data"
"6.147064","5.9.29.183","172.19.0.3","TCP","56","9002 → 43520 [ACK] Seq=291191 Ack=19462 Win=65535 Len=0"
"6.152207","5.9.29.183","172.19.0.3","TLSv1.2","1516","Application Data, Application Data"
"6.152269","5.9.29.183","172.19.0.3","TCP","1492","9002 → 43520 [PSH, ACK] Seq=292651 Ack=19462 Win=65535 Len=1436 [TCP segment of a reassembled PDU]"
"6.152409","172.19.0.3","5.9.29.183","TCP","56","43520 → 9002 [ACK] Seq=19462 Ack=294087 Win=11903 Len=0"
"6.152776","5.9.29.183","172.19.0.3","TLSv1.2","1452","Application Data"
"6.159537","5.9.29.183","172.19.0.3","TCP","1504","[TCP segment of a reassembled PDU]"
"6.159563","172.19.0.3","5.9.29.183","TCP","56","43520 → 9002 [ACK] Seq=19462 Ack=296931 Win=11911 Len=0"
"6.159731","5.9.29.183","172.19.0.3","TCP","1516","9002 → 43520 [PSH, ACK] Seq=296931 Ack=19462 Win=65535 Len=1460 [TCP segment of a reassembled PDU]"
"6.159741","5.9.29.183","172.19.0.3","TLSv1.2","1516","Application Data [TCP segment of a reassembled PDU]"
"6.159743","5.9.29.183","172.19.0.3","TCP","1480","9002 → 43520 [PSH, ACK] Seq=299851 Ack=19462 Win=65535 Len=1424 [TCP segment of a reassembled PDU]"
"6.159768","172.19.0.3","5.9.29.183","TCP","56","43520 → 9002 [ACK] Seq=19462 Ack=301275 Win=11887 Len=0"
"6.161475","5.9.29.183","172.19.0.3","TCP","1516","9002 → 43520 [PSH, ACK] Seq=301275 Ack=19462 Win=65535 Len=1460 [TCP segment of a reassembled PDU]"
"6.161513","5.9.29.183","172.19.0.3","TLSv1.2","1492","Application Data [TCP segment of a reassembled PDU]"
"6.161523","172.19.0.3","5.9.29.183","TCP","56","43520 → 9002 [ACK] Seq=19462 Ack=304171 Win=11903 Len=0"
"6.169331","5.9.29.183","172.19.0.3","TLSv1.2","707","Application Data"
"6.172918","172.19.0.3","5.9.29.183","TLSv1.2","599","Application Data"
"6.173163","5.9.29.183","172.19.0.3","TCP","56","9002 → 43520 [ACK] Seq=304822 Ack=20005 Win=65535 Len=0"
"6.433245","5.9.29.183","172.19.0.3","TLSv1.2","599","Application Data"
"6.434132","172.19.0.3","5.9.29.183","TLSv1.2","599","Application Data"
"6.434439","5.9.29.183","172.19.0.3","TCP","56","9002 → 43520 [ACK] Seq=305365 Ack=20548 Win=65535 Len=0"
"6.665383","5.9.29.183","172.19.0.3","TLSv1.2","599","Application Data"
"6.678703","5.9.29.183","172.19.0.3","TCP","1516","[TCP segment of a reassembled PDU]"
"6.678797","172.19.0.3","5.9.29.183","TCP","56","43520 → 9002 [ACK] Seq=20548 Ack=307368 Win=11911 Len=0"
"6.678851","5.9.29.183","172.19.0.3","TCP","1492","9002 → 43520 [PSH, ACK] Seq=307368 Ack=20548 Win=65535 Len=1436 [TCP segment of a reassembled PDU]"
"6.678952","5.9.29.183","172.19.0.3","TLSv1.2","1516","Application Data [TCP segment of a reassembled PDU]"
"6.678958","5.9.29.183","172.19.0.3","TCP","1516","9002 → 43520 [PSH, ACK] Seq=310264 Ack=20548 Win=65535 Len=1460 [TCP segment of a reassembled PDU]"
"6.678963","5.9.29.183","172.19.0.3","TCP","1480","9002 → 43520 [PSH, ACK] Seq=311724 Ack=20548 Win=65535 Len=1424 [TCP segment of a reassembled PDU]"
"6.679009","172.19.0.3","5.9.29.183","TCP","56","43520 → 9002 [ACK] Seq=20548 Ack=313148 Win=11879 Len=0"
"6.680661","5.9.29.183","172.19.0.3","TLSv1.2","584","Application Data"
"6.711748","5.9.29.183","172.19.0.3","TCP","1516","[TCP segment of a reassembled PDU]"
"6.711764","172.19.0.3","5.9.29.183","TCP","56","43520 → 9002 [ACK] Seq=20548 Ack=315136 Win=11911 Len=0"
"6.711797","5.9.29.183","172.19.0.3","TCP","1492","9002 → 43520 [PSH, ACK] Seq=315136 Ack=20548 Win=65535 Len=1436 [TCP segment of a reassembled PDU]"
"6.711826","5.9.29.183","172.19.0.3","TLSv1.2","1516","Application Data [TCP segment of a reassembled PDU]"
"6.711832","5.9.29.183","172.19.0.3","TCP","1516","9002 → 43520 [PSH, ACK] Seq=318032 Ack=20548 Win=65535 Len=1460 [TCP segment of a reassembled PDU]"
"6.711836","5.9.29.183","172.19.0.3","TCP","1516","9002 → 43520 [PSH, ACK] Seq=319492 Ack=20548 Win=65535 Len=1460 [TCP segment of a reassembled PDU]"
"6.711839","5.9.29.183","172.19.0.3","TLSv1.2","1516","Application Data [TCP segment of a reassembled PDU]"
"6.711910","5.9.29.183","172.19.0.3","TCP","1516","9002 → 43520 [PSH, ACK] Seq=322412 Ack=20548 Win=65535 Len=1460 [TCP segment of a reassembled PDU]"
"6.711916","5.9.29.183","172.19.0.3","TCP","1177","9002 → 43520 [PSH, ACK] Seq=323872 Ack=20548 Win=65535 Len=1121 [TCP segment of a reassembled PDU]"
"6.711920","5.9.29.183","172.19.0.3","TLSv1.2","1516","Application Data [TCP segment of a reassembled PDU]"
"6.711923","5.9.29.183","172.19.0.3","TCP","1492","9002 → 43520 [PSH, ACK] Seq=326453 Ack=20548 Win=65535 Len=1436 [TCP segment of a reassembled PDU]"
"6.711949","172.19.0.3","5.9.29.183","TCP","56","43520 → 9002 [ACK] Seq=20548 Ack=327889 Win=11836 Len=0"
"6.712361","172.19.0.3","5.9.29.183","TLSv1.2","599","Application Data"
"6.712548","5.9.29.183","172.19.0.3","TCP","56","9002 → 43520 [ACK] Seq=327889 Ack=21091 Win=65535 Len=0"
"6.727455","5.9.29.183","172.19.0.3","TLSv1.2","1379","Application Data"
"6.729587","5.9.29.183","172.19.0.3","TCP","1516","[TCP segment of a reassembled PDU]"
"6.729605","172.19.0.3","5.9.29.183","TCP","56","43520 → 9002 [ACK] Seq=21091 Ack=330672 Win=11911 Len=0"
"6.729637","5.9.29.183","172.19.0.3","TCP","1516","9002 → 43520 [PSH, ACK] Seq=330672 Ack=21091 Win=65535 Len=1460 [TCP segment of a reassembled PDU]"
"6.729664","5.9.29.183","172.19.0.3","TLSv1.2","1516","Application Data [TCP segment of a reassembled PDU]"
"6.729668","5.9.29.183","172.19.0.3","TCP","1516","9002 → 43520 [PSH, ACK] Seq=333592 Ack=21091 Win=65535 Len=1460 [TCP segment of a reassembled PDU]"
"6.729671","5.9.29.183","172.19.0.3","TCP","1516","9002 → 43520 [PSH, ACK] Seq=335052 Ack=21091 Win=65535 Len=1460 [TCP segment of a reassembled PDU]"
"6.729673","5.9.29.183","172.19.0.3","TLSv1.2","1516","Application Data [TCP segment of a reassembled PDU]"
"6.729675","5.9.29.183","172.19.0.3","TCP","1516","9002 → 43520 [PSH, ACK] Seq=337972 Ack=21091 Win=65535 Len=1460 [TCP segment of a reassembled PDU]"
"6.729676","5.9.29.183","172.19.0.3","TCP","1420","9002 → 43520 [PSH, ACK] Seq=339432 Ack=21091 Win=65535 Len=1364 [TCP segment of a reassembled PDU]"
"6.729807","172.19.0.3","5.9.29.183","TCP","56","43520 → 9002 [ACK] Seq=21091 Ack=340796 Win=11855 Len=0"
"6.729994","172.19.0.3","5.9.29.183","TLSv1.2","599","Application Data"
"6.730190","5.9.29.183","172.19.0.3","TCP","56","9002 → 43520 [ACK] Seq=340796 Ack=21634 Win=65535 Len=0"
"6.742454","5.9.29.183","172.19.0.3","TLSv1.2","381","Application Data"
"6.745497","5.9.29.183","172.19.0.3","TCP","1101","[TCP segment of a reassembled PDU]"
"6.745540","5.9.29.183","172.19.0.3","TCP","1516","9002 → 43520 [PSH, ACK] Seq=342166 Ack=21634 Win=65535 Len=1460 [TCP segment of a reassembled PDU]"
"6.745552","172.19.0.3","5.9.29.183","TCP","56","43520 → 9002 [ACK] Seq=21634 Ack=343626 Win=11901 Len=0"
"6.745554","5.9.29.183","172.19.0.3","TCP","447","9002 → 43520 [PSH, ACK] Seq=343626 Ack=21634 Win=65535 Len=391 [TCP segment of a reassembled PDU]"
"6.745858","5.9.29.183","172.19.0.3","TLSv1.2","1516","Application Data [TCP segment of a reassembled PDU]"
"6.745870","172.19.0.3","5.9.29.183","TCP","56","43520 → 9002 [ACK] Seq=21634 Ack=345477 Win=11911 Len=0"
"6.745901","5.9.29.183","172.19.0.3","TCP","1516","9002 → 43520 [PSH, ACK] Seq=345477 Ack=21634 Win=65535 Len=1460 [TCP segment of a reassembled PDU]"
"6.745908","5.9.29.183","172.19.0.3","TCP","1516","9002 → 43520 [PSH, ACK] Seq=346937 Ack=21634 Win=65535 Len=1460 [TCP segment of a reassembled PDU]"
"6.745913","5.9.29.183","172.19.0.3","TLSv1.2","1516","Application Data [TCP segment of a reassembled PDU]"
"6.745953","172.19.0.3","5.9.29.183","TCP","56","43520 → 9002 [ACK] Seq=21634 Ack=349857 Win=11887 Len=0"
"6.745981","5.9.29.183","172.19.0.3","TCP","1516","9002 → 43520 [PSH, ACK] Seq=349857 Ack=21634 Win=65535 Len=1460 [TCP segment of a reassembled PDU]"
"6.745985","5.9.29.183","172.19.0.3","TCP","1444","9002 → 43520 [PSH, ACK] Seq=351317 Ack=21634 Win=65535 Len=1388 [TCP segment of a reassembled PDU]"
"6.745987","5.9.29.183","172.19.0.3","TLSv1.2","1516","Application Data [TCP segment of a reassembled PDU]"
"6.745989","5.9.29.183","172.19.0.3","TCP","1516","9002 → 43520 [PSH, ACK] Seq=354165 Ack=21634 Win=65535 Len=1460 [TCP segment of a reassembled PDU]"
"6.745991","5.9.29.183","172.19.0.3","TCP","1480","9002 → 43520 [PSH, ACK] Seq=355625 Ack=21634 Win=65535 Len=1424 [TCP segment of a reassembled PDU]"
"6.746087","172.19.0.3","5.9.29.183","TCP","56","43520 → 9002 [ACK] Seq=21634 Ack=357049 Win=11847 Len=0"
"6.757825","5.9.29.183","172.19.0.3","TLSv1.2","1264","Application Data, Application Data, Application Data"
"6.758481","172.19.0.3","5.9.29.183","TLSv1.2","599","Application Data"
"6.758843","5.9.29.183","172.19.0.3","TCP","56","9002 → 43520 [ACK] Seq=358257 Ack=22177 Win=65535 Len=0"
"6.766800","172.19.0.3","5.9.29.183","TLSv1.2","599","Application Data"
"6.767101","5.9.29.183","172.19.0.3","TCP","56","9002 → 43520 [ACK] Seq=358257 Ack=22720 Win=65535 Len=0"
"7.075511","5.9.29.183","172.19.0.3","TLSv1.2","599","Application Data"
"7.076176","172.19.0.3","5.9.29.183","TLSv1.2","599","Application Data"
"7.076442","5.9.29.183","172.19.0.3","TCP","56","9002 → 43520 [ACK] Seq=358800 Ack=23263 Win=65535 Len=0"
"7.336334","5.9.29.183","172.19.0.3","TLSv1.2","599","Application Data"
"7.350522","5.9.29.183","172.19.0.3","TCP","1516","[TCP segment of a reassembled PDU]"
"7.350541","172.19.0.3","5.9.29.183","TCP","56","43520 → 9002 [ACK] Seq=23263 Ack=360803 Win=11911 Len=0"
"7.350578","5.9.29.183","172.19.0.3","TCP","1492","9002 → 43520 [PSH, ACK] Seq=360803 Ack=23263 Win=65535 Len=1436 [TCP segment of a reassembled PDU]"
"7.351122","5.9.29.183","172.19.0.3","TLSv1.2","787","Application Data"
"7.351132","172.19.0.3","5.9.29.183","TCP","56","43520 → 9002 [ACK] Seq=23263 Ack=362970 Win=11911 Len=0"
"7.362790","5.9.29.183","172.19.0.3","TCP","1516","[TCP segment of a reassembled PDU]"
"7.362846","5.9.29.183","172.19.0.3","TCP","1516","9002 → 43520 [PSH, ACK] Seq=364430 Ack=23263 Win=65535 Len=1460 [TCP segment of a reassembled PDU]"
"7.362854","5.9.29.183","172.19.0.3","TLSv1.2","1516","Application Data [TCP segment of a reassembled PDU]"
"7.362857","5.9.29.183","172.19.0.3","TCP","1468","9002 → 43520 [PSH, ACK] Seq=367350 Ack=23263 Win=65535 Len=1412 [TCP segment of a reassembled PDU]"
"7.362862","5.9.29.183","172.19.0.3","TCP","1516","9002 → 43520 [PSH, ACK] Seq=368762 Ack=23263 Win=65535 Len=1460 [TCP segment of a reassembled PDU]"
"7.362883","5.9.29.183","172.19.0.3","TLSv1.2","1516","Application Data [TCP segment of a reassembled PDU]"
"7.362887","5.9.29.183","172.19.0.3","TCP","1480","9002 → 43520 [PSH, ACK] Seq=371682 Ack=23263 Win=65535 Len=1424 [TCP segment of a reassembled PDU]"
"7.362981","172.19.0.3","5.9.29.183","TCP","56","43520 → 9002 [ACK] Seq=23263 Ack=373106 Win=11863 Len=0"
"7.366078","5.9.29.183","172.19.0.3","TCP","1516","9002 → 43520 [PSH, ACK] Seq=373106 Ack=23263 Win=65535 Len=1460 [TCP segment of a reassembled PDU]"
"7.366130","5.9.29.183","172.19.0.3","TLSv1.2","1492","Application Data [TCP segment of a reassembled PDU]"
"7.366144","172.19.0.3","5.9.29.183","TCP","56","43520 → 9002 [ACK] Seq=23263 Ack=376002 Win=11903 Len=0"
"7.366146","5.9.29.183","172.19.0.3","TCP","1516","9002 → 43520 [PSH, ACK] Seq=376002 Ack=23263 Win=65535 Len=1460 [TCP segment of a reassembled PDU]"
"7.366148","5.9.29.183","172.19.0.3","TCP","1492","9002 → 43520 [PSH, ACK] Seq=377462 Ack=23263 Win=65535 Len=1436 [TCP segment of a reassembled PDU]"
"7.366253","172.19.0.3","5.9.29.183","TCP","56","43520 → 9002 [ACK] Seq=23263 Ack=378898 Win=11885 Len=0"
"7.366579","5.9.29.183","172.19.0.3","TLSv1.2","721","Application Data, Application Data"
"7.366821","172.19.0.3","5.9.29.183","TLSv1.2","599","Application Data"
"7.367011","5.9.29.183","172.19.0.3","TCP","56","9002 → 43520 [ACK] Seq=379563 Ack=23806 Win=65535 Len=0"
"7.368174","5.9.29.183","172.19.0.3","TCP","1504","[TCP segment of a reassembled PDU]"
"7.377707","5.9.29.183","172.19.0.3","TCP","1504","9002 → 43520 [PSH, ACK] Seq=381011 Ack=23806 Win=65535 Len=1448 [TCP segment of a reassembled PDU]"
"7.377727","172.19.0.3","5.9.29.183","TCP","56","43520 → 9002 [ACK] Seq=23806 Ack=382459 Win=11911 Len=0"
"7.377841","5.9.29.183","172.19.0.3","TLSv1.2","1504","Application Data [TCP segment of a reassembled PDU]"
"7.377888","5.9.29.183","172.19.0.3","TCP","1504","9002 → 43520 [PSH, ACK] Seq=383907 Ack=23806 Win=65535 Len=1448 [TCP segment of a reassembled PDU]"
"7.378014","172.19.0.3","5.9.29.183","TCP","56","43520 → 9002 [ACK] Seq=23806 Ack=385355 Win=11895 Len=0"
"7.378241","5.9.29.183","172.19.0.3","TLSv1.2","1504","Application Data [TCP segment of a reassembled PDU]"
"7.378482","172.19.0.3","5.9.29.183","TLSv1.2","599","Application Data"
"7.378679","5.9.29.183","172.19.0.3","TCP","56","9002 → 43520 [ACK] Seq=386803 Ack=24349 Win=65535 Len=0"
"7.381915","5.9.29.183","172.19.0.3","TLSv1.2","613","Application Data"
"7.394356","5.9.29.183","172.19.0.3","TCP","1504","[TCP segment of a reassembled PDU]"
"7.394376","172.19.0.3","5.9.29.183","TCP","56","43520 → 9002 [ACK] Seq=24349 Ack=388808 Win=11911 Len=0"
"7.396885","5.9.29.183","172.19.0.3","TLSv1.2","179","Application Data"
"7.408236","5.9.29.183","172.19.0.3","TCP","1516","[TCP segment of a reassembled PDU]"
"7.408254","172.19.0.3","5.9.29.183","TCP","56","43520 → 9002 [ACK] Seq=24349 Ack=390391 Win=11911 Len=0"
"7.408408","5.9.29.183","172.19.0.3","TCP","1492","9002 → 43520 [PSH, ACK] Seq=390391 Ack=24349 Win=65535 Len=1436 [TCP segment of a reassembled PDU]"
"7.412118","5.9.29.183","172.19.0.3","TLSv1.2","787","Application Data"
"7.412126","172.19.0.3","5.9.29.183","TCP","56","43520 → 9002 [ACK] Seq=24349 Ack=392558 Win=11911 Len=0"
"7.427712","5.9.29.183","172.19.0.3","TLSv1.2","1113","Application Data"
"7.469131","172.19.0.3","5.9.29.183","TCP","56","43520 → 9002 [ACK] Seq=24349 Ack=393615 Win=11911 Len=0"
