_ws.col.Time,_ws.col.Source,_ws.col.Destination,_ws.col.Protocol,_ws.col.Length,_ws.col.Info
"0.000000","172.19.0.3","5.9.29.183","TLSv1.2","599","Application Data"
"0.000314","5.9.29.183","172.19.0.3","TCP","56","9002 → 43520 [ACK] Seq=1 Ack=544 Win=65535 Len=0"
"0.770704","5.9.29.183","172.19.0.3","TLSv1.2","599","Application Data"
"0.770772","172.19.0.3","5.9.29.183","TCP","56","43520 → 9002 [ACK] Seq=544 Ack=544 Win=8466 Len=0"
"0.771846","172.19.0.3","5.9.29.183","TLSv1.2","2141","Application Data"
"0.772181","5.9.29.183","172.19.0.3","TCP","56","9002 → 43520 [ACK] Seq=544 Ack=2629 Win=65535 Len=0"
"1.312439","5.9.29.183","172.19.0.3","TCP","1516","[TCP segment of a reassembled PDU]"
"1.312740","5.9.29.183","172.19.0.3","TLSv1.2","167","Application Data"
"1.312754","172.19.0.3","5.9.29.183","TCP","56","43520 → 9002 [ACK] Seq=2629 Ack=2115 Win=8466 Len=0"
"1.316739","172.19.0.3","5.9.29.183","TLSv1.2","599","Application Data"
"1.317000","5.9.29.183","172.19.0.3","TCP","56","9002 → 43520 [ACK] Seq=2115 Ack=3172 Win=65535 Len=0"
"1.631944","5.9.29.183","172.19.0.3","TLSv1.2","599","Application Data"
"1.632860","172.19.0.3","5.9.29.183","TLSv1.2","599","Application Data"
"1.633155","5.9.29.183","172.19.0.3","TCP","56","9002 → 43520 [ACK] Seq=2658 Ack=3715 Win=65535 Len=0"
"1.946798","5.9.29.183","172.19.0.3","TLSv1.2","599","Application Data"
"1.988255","172.19.0.3","5.9.29.183","TCP","56","43520 → 9002 [ACK] Seq=3715 Ack=3201 Win=8466 Len=0"
"1.996537","5.9.29.183","172.19.0.3","TCP","1516","[TCP segment of a reassembled PDU]"
"1.996560","172.19.0.3","5.9.29.183","TCP","56","43520 → 9002 [ACK] Seq=3715 Ack=4661 Win=8466 Len=0"
"1.996620","5.9.29.183","172.19.0.3","TCP","1492","9002 → 43520 [PSH, ACK] Seq=4661 Ack=3715 Win=65535 Len=1436 [TCP segment of a reassembled PDU]"
"1.996643","172.19.0.3","5.9.29.183","TCP","56","43520 → 9002 [ACK] Seq=3715 Ack=6097 Win=8458 Len=0"
"1.996645","5.9.29.183","172.19.0.3","TLSv1.2","787","Application Data"
"1.996650","172.19.0.3","5.9.29.183","TCP","56","43520 → 9002 [ACK] Seq=3715 Ack=6828 Win=8453 Len=0"
"2.009687","5.9.29.183","172.19.0.3","TCP","1516","[TCP segment of a reassembled PDU]"
"2.009707","172.19.0.3","5.9.29.183","TCP","56","43520 → 9002 [ACK] Seq=3715 Ack=8288 Win=8466 Len=0"
"2.009754","5.9.29.183","172.19.0.3","TCP","1516","9002 → 43520 [PSH, ACK] Seq=8288 Ack=3715 Win=65535 Len=1460 [TCP segment of a reassembled PDU]"
"2.009764","172.19.0.3","5.9.29.183","TCP","56","43520 → 9002 [ACK] Seq=3715 Ack=9748 Win=8458 Len=0"
"2.009766","5.9.29.183","172.19.0.3","TLSv1.2","1516","Application Data [TCP segment of a reassembled PDU]"
"2.009771","172.19.0.3","5.9.29.183","TCP","56","43520 → 9002 [ACK] Seq=3715 Ack=11208 Win=8450 Len=0"
"2.009772","5.9.29.183","172.19.0.3","TCP","1468","9002 → 43520 [PSH, ACK] Seq=11208 Ack=3715 Win=65535 Len=1412 [TCP segment of a reassembled PDU]"
"2.009779","172.19.0.3","5.9.29.183","TCP","56","43520 → 9002 [ACK] Seq=3715 Ack=12620 Win=8442 Len=0"
"2.011751","5.9.29.183","172.19.0.3","TCP","1504","9002 → 43520 [PSH, ACK] Seq=12620 Ack=3715 Win=65535 Len=1448 [TCP segment of a reassembled PDU]"
"2.011776","172.19.0.3","5.9.29.183","TCP","56","43520 → 9002 [ACK] Seq=3715 Ack=14068 Win=8466 Len=0"
"2.011812","5.9.29.183","172.19.0.3","TLSv1.2","584","Application Data"
"2.011840","172.19.0.3","5.9.29.183","TCP","56","43520 → 9002 [ACK] Seq=3715 Ack=14596 Win=8462 Len=0"
"2.012112","172.19.0.3","5.9.29.183","TLSv1.2","599","Application Data"
"2.012348","5.9.29.183","172.19.0.3","TCP","56","9002 → 43520 [ACK] Seq=14596 Ack=4258 Win=65535 Len=0"
"2.042598","5.9.29.183","172.19.0.3","TCP","1516","[TCP segment of a reassembled PDU]"
"2.042660","5.9.29.183","172.19.0.3","TCP","1516","9002 → 43520 [PSH, ACK] Seq=16056 Ack=4258 Win=65535 Len=1460 [TCP segment of a reassembled PDU]"
"2.042669","5.9.29.183","172.19.0.3","TLSv1.2","1516","Application Data [TCP segment of a reassembled PDU]"
"2.042672","5.9.29.183","172.19.0.3","TCP","1201","9002 → 43520 [PSH, ACK] Seq=18976 Ack=4258 Win=65535 Len=1145 [TCP segment of a reassembled PDU]"
"2.042807","172.19.0.3","5.9.29.183","TCP","56","43520 → 9002 [ACK] Seq=4258 Ack=20121 Win=8442 Len=0"
"2.057366","5.9.29.183","172.19.0.3","TLSv1.2","757","Application Data"
"2.073825","5.9.29.183","172.19.0.3","TCP","1516","[TCP segment of a reassembled PDU]"
"2.073849","172.19.0.3","5.9.29.183","TCP","56","43520 → 9002 [ACK] Seq=4258 Ack=22282 Win=8466 Len=0"
"2.073894","5.9.29.183","172.19.0.3","TCP","1492","9002 → 43520 [PSH, ACK] Seq=22282 Ack=4258 Win=65535 Len=1436 [TCP segment of a reassembled PDU]"
"2.073932","5.9.29.183","172.19.0.3","TLSv1.2","1516","Application Data [TCP segment of a reassembled PDU]"
"2.073939","5.9.29.183","172.19.0.3","TCP","1225","9002 → 43520 [PSH, ACK] Seq=25178 Ack=4258 Win=65535 Len=1169 [TCP segment of a reassembled PDU]"
"2.074050","172.19.0.3","5.9.29.183","TCP","56","43520 → 9002 [ACK] Seq=4258 Ack=26347 Win=8440 Len=0"
"2.089992","5.9.29.183","172.19.0.3","TLSv1.2","1271","Application Data"
"2.104782","5.9.29.183","172.19.0.3","TCP","1516","[TCP segment of a reassembled PDU]"
"2.104805","172.19.0.3","5.9.29.183","TCP","56","43520 → 9002 [ACK] Seq=4258 Ack=29022 Win=8466 Len=0"
"2.104863","5.9.29.183","172.19.0.3","TCP","1492","9002 → 43520 [PSH, ACK] Seq=29022 Ack=4258 Win=65535 Len=1436 [TCP segment of a reassembled PDU]"
"2.105078","5.9.29.183","172.19.0.3","TLSv1.2","1516","Application Data [TCP segment of a reassembled PDU]"
"2.105082","5.9.29.183","172.19.0.3","TCP","1516","9002 → 43520 [PSH, ACK] Seq=31918 Ack=4258 Win=65535 Len=1460 [TCP segment of a reassembled PDU]"
"2.105084","5.9.29.183","172.19.0.3","TCP","1516","9002 → 43520 [PSH, ACK] Seq=33378 Ack=4258 Win=65535 Len=1460 [TCP segment of a reassembled PDU]"
"2.105085","5.9.29.183","172.19.0.3","TCP","96","9002 → 43520 [PSH, ACK] Seq=34838 Ack=4258 Win=65535 Len=40 [TCP segment of a reassembled PDU]"
"2.105113","172.19.0.3","5.9.29.183","TCP","56","43520 → 9002 [ACK] Seq=4258 Ack=34878 Win=8432 Len=0"
"2.105189","5.9.29.183","172.19.0.3","TLSv1.2","508","Application Data"
"2.105454","172.19.0.3","5.9.29.183","TLSv1.2","599","Application Data"
"2.105658","5.9.29.183","172.19.0.3","TCP","56","9002 → 43520 [ACK] Seq=35330 Ack=4801 Win=65535 Len=0"
"2.136701","5.9.29.183","172.19.0.3","TCP","1516","[TCP segment of a reassembled PDU]"
"2.136781","5.9.29.183","172.19.0.3","TCP","1516","9002 → 43520 [PSH, ACK] Seq=36790 Ack=4801 Win=65535 Len=1460 [TCP segment of a reassembled PDU]"
"2.136806","172.19.0.3","5.9.29.183","TCP","56","43520 → 9002 [ACK] Seq=4801 Ack=38250 Win=8458 Len=0"
"2.136810","5.9.29.183","172.19.0.3","TLSv1.2","1516","Application Data [TCP segment of a reassembled PDU]"
"2.136816","5.9.29.183","172.19.0.3","TCP","1201","9002 → 43520 [PSH, ACK] Seq=39710 Ack=4801 Win=65535 Len=1145 [TCP segment of a reassembled PDU]"
"2.136950","172.19.0.3","5.9.29.183","TCP","56","43520 → 9002 [ACK] Seq=4801 Ack=40855 Win=8442 Len=0"
"2.151828","5.9.29.183","172.19.0.3","TLSv1.2","757","Application Data"
"2.157379","172.19.0.3","5.9.29.183","TLSv1.2","599","Application Data"
"2.157678","5.9.29.183","172.19.0.3","TCP","56","9002 → 43520 [ACK] Seq=41556 Ack=5344 Win=65535 Len=0"
"2.613462","5.9.29.183","172.19.0.3","TLSv1.2","599","Application Data"
"2.614183","172.19.0.3","5.9.29.183","TLSv1.2","599","Application Data"
"2.614422","5.9.29.183","172.19.0.3","TCP","56","9002 → 43520 [ACK] Seq=42099 Ack=5887 Win=65535 Len=0"
"2.954110","5.9.29.183","172.19.0.3","TCP","1504","[TCP segment of a reassembled PDU]"
"2.954208","5.9.29.183","172.19.0.3","TCP","1516","9002 → 43520 [PSH, ACK] Seq=43547 Ack=5887 Win=65535 Len=1460 [TCP segment of a reassembled PDU]"
"2.954218","5.9.29.183","172.19.0.3","TLSv1.2","1225","Application Data"
"2.954375","172.19.0.3","5.9.29.183","TCP","56","43520 → 9002 [ACK] Seq=5887 Ack=46176 Win=8450 Len=0"
"2.970240","5.9.29.183","172.19.0.3","TLSv1.2","149","Application Data"
"3.000146","5.9.29.183","172.19.0.3","TCP","1504","[TCP segment of a reassembled PDU]"
"3.000166","172.19.0.3","5.9.29.183","TCP","56","43520 → 9002 [ACK] Seq=5887 Ack=47717 Win=8466 Len=0"
"3.000218","5.9.29.183","172.19.0.3","TCP","1516","9002 → 43520 [PSH, ACK] Seq=47717 Ack=5887 Win=65535 Len=1460 [TCP segment of a reassembled PDU]"
"3.000228","5.9.29.183","172.19.0.3","TLSv1.2","775","Application Data"
"3.000361","172.19.0.3","5.9.29.183","TCP","56","43520 → 9002 [ACK] Seq=5887 Ack=49896 Win=8450 Len=0"
"3.030437","5.9.29.183","172.19.0.3","TCP","1504","[TCP segment of a reassembled PDU]"
"3.030491","5.9.29.183","172.19.0.3","TCP","1516","9002 → 43520 [PSH, ACK] Seq=51344 Ack=5887 Win=65535 Len=1460 [TCP segment of a reassembled PDU]"
"3.030505","172.19.0.3","5.9.29.183","TCP","56","43520 → 9002 [ACK] Seq=5887 Ack=52804 Win=8458 Len=0"
"3.030508","5.9.29.183","172.19.0.3","TLSv1.2","1225","Application Data"
"3.046082","5.9.29.183","172.19.0.3","TLSv1.2","1516","Application Data"
"3.046101","172.19.0.3","5.9.29.183","TCP","56","43520 → 9002 [ACK] Seq=5887 Ack=55433 Win=8466 Len=0"
"3.046139","5.9.29.183","172.19.0.3","TCP","1516","9002 → 43520 [PSH, ACK] Seq=55433 Ack=5887 Win=65535 Len=1460 [TCP segment of a reassembled PDU]"
"3.046147","5.9.29.183","172.19.0.3","TLSv1.2","1399","Application Data, Application Data"
"3.046368","172.19.0.3","5.9.29.183","TCP","56","43520 → 9002 [ACK] Seq=5887 Ack=58236 Win=8448 Len=0"
"3.057609","5.9.29.183","172.19.0.3","TCP","1516","[TCP segment of a reassembled PDU]"
"3.057662","5.9.29.183","172.19.0.3","TCP","1516","9002 → 43520 [PSH, ACK] Seq=59696 Ack=5887 Win=65535 Len=1460 [TCP segment of a reassembled PDU]"
"3.057676","172.19.0.3","5.9.29.183","TCP","56","43520 → 9002 [ACK] Seq=5887 Ack=61156 Win=8458 Len=0"
"3.057679","5.9.29.183","172.19.0.3","TLSv1.2","1480","Application Data [TCP segment of a reassembled PDU]"
"3.061305","5.9.29.183","172.19.0.3","TLSv1.2","396","Application Data"
"3.061322","172.19.0.3","5.9.29.183","TCP","56","43520 → 9002 [ACK] Seq=5887 Ack=62920 Win=8466 Len=0"
"3.077258","5.9.29.183","172.19.0.3","TCP","1516","[TCP segment of a reassembled PDU]"
"3.077332","5.9.29.183","172.19.0.3","TLSv1.2","681","Application Data"
"3.077571","172.19.0.3","5.9.29.183","TCP","56","43520 → 9002 [ACK] Seq=5887 Ack=65005 Win=8458 Len=0"
"3.081561","172.19.0.3","5.9.29.183","TLSv1.2","599","Application Data"
"3.081803","5.9.29.183","172.19.0.3","TCP","56","9002 → 43520 [ACK] Seq=65005 Ack=6430 Win=65535 Len=0"
"3.346988","5.9.29.183","172.19.0.3","TLSv1.2","599","Application Data"
"3.347834","172.19.0.3","5.9.29.183","TLSv1.2","599","Application Data"
"3.348244","5.9.29.183","172.19.0.3","TCP","56","9002 → 43520 [ACK] Seq=65548 Ack=6973 Win=65535 Len=0"
"3.687086","5.9.29.183","172.19.0.3","TCP","1516","[TCP segment of a reassembled PDU]"
"3.687162","5.9.29.183","172.19.0.3","TCP","1516","9002 → 43520 [PSH, ACK] Seq=67008 Ack=6973 Win=65535 Len=1460 [TCP segment of a reassembled PDU]"
"3.687169","5.9.29.183","172.19.0.3","TLSv1.2","763","Application Data"
"3.687300","172.19.0.3","5.9.29.183","TCP","56","43520 → 9002 [ACK] Seq=6973 Ack=69175 Win=8450 Len=0"
"3.687510","172.19.0.3","5.9.29.183","TLSv1.2","599","Application Data"
"3.687689","5.9.29.183","172.19.0.3","TCP","56","9002 → 43520 [ACK] Seq=69175 Ack=7516 Win=65535 Len=0"
"3.717946","5.9.29.183","172.19.0.3","TCP","1504","[TCP segment of a reassembled PDU]"
"3.717991","5.9.29.183","172.19.0.3","TCP","1504","9002 → 43520 [PSH, ACK] Seq=70623 Ack=7516 Win=65535 Len=1448 [TCP segment of a reassembled PDU]"
"3.717997","5.9.29.183","172.19.0.3","TLSv1.2","1516","Application Data [TCP segment of a reassembled PDU]"
"3.718090","172.19.0.3","5.9.29.183","TCP","56","43520 → 9002 [ACK] Seq=7516 Ack=73531 Win=8450 Len=0"
"3.718117","5.9.29.183","172.19.0.3","TCP","1225","9002 → 43520 [PSH, ACK] Seq=73531 Ack=7516 Win=65535 Len=1169 [TCP segment of a reassembled PDU]"
"3.718153","5.9.29.183","172.19.0.3","TCP","1504","9002 → 43520 [PSH, ACK] Seq=74700 Ack=7516 Win=65535 Len=1448 [TCP segment of a reassembled PDU]"
"3.718304","172.19.0.3","5.9.29.183","TCP","56","43520 → 9002 [ACK] Seq=7516 Ack=76148 Win=8434 Len=0"
"3.733756","5.9.29.183","172.19.0.3","TLSv1.2","851","Application Data"
"3.754272","5.9.29.183","172.19.0.3","TCP","1516","[TCP segment of a reassembled PDU]"
"3.754290","172.19.0.3","5.9.29.183","TCP","56","43520 → 9002 [ACK] Seq=7516 Ack=78403 Win=8466 Len=0"
"3.754338","5.9.29.183","172.19.0.3","TCP","1516","9002 → 43520 [PSH, ACK] Seq=78403 Ack=7516 Win=65535 Len=1460 [TCP segment of a reassembled PDU]"
"3.754348","5.9.29.183","172.19.0.3","TLSv1.2","1213","Application Data"
"3.754408","5.9.29.183","172.19.0.3","TCP","1516","[TCP segment of a reassembled PDU]"
"3.754414","5.9.29.183","172.19.0.3","TCP","1492","9002 → 43520 [PSH, ACK] Seq=82480 Ack=7516 Win=65535 Len=1436 [TCP segment of a reassembled PDU]"
"3.754470","172.19.0.3","5.9.29.183","TCP","56","43520 → 9002 [ACK] Seq=7516 Ack=83916 Win=8434 Len=0"
"3.769183","5.9.29.183","172.19.0.3","TLSv1.2","851","Application Data"
"3.777816","5.9.29.183","172.19.0.3","TCP","1504","[TCP segment of a reassembled PDU]"
"3.777838","172.19.0.3","5.9.29.183","TCP","56","43520 → 9002 [ACK] Seq=7516 Ack=86159 Win=8464 Len=0"
"3.777930","5.9.29.183","172.19.0.3","TCP","1504","9002 → 43520 [PSH, ACK] Seq=86159 Ack=7516 Win=65535 Len=1448 [TCP segment of a reassembled PDU]"
"3.784349","5.9.29.183","172.19.0.3","TLSv1.2","787","Application Data"
"3.784373","172.19.0.3","5.9.29.183","TCP","56","43520 → 9002 [ACK] Seq=7516 Ack=88338 Win=8466 Len=0"
"3.789761","5.9.29.183","172.19.0.3","TCP","1504","[TCP segment of a reassembled PDU]"
"3.789824","5.9.29.183","172.19.0.3","TCP","1516","9002 → 43520 [PSH, ACK] Seq=89786 Ack=7516 Win=65535 Len=1460 [TCP segment of a reassembled PDU]"
"3.789833","5.9.29.183","172.19.0.3","TLSv1.2","1516","Application Data [TCP segment of a reassembled PDU]"
"3.789837","5.9.29.183","172.19.0.3","TCP","1480","9002 → 43520 [PSH, ACK] Seq=92706 Ack=7516 Win=65535 Len=1424 [TCP segment of a reassembled PDU]"
"3.789973","172.19.0.3","5.9.29.183","TCP","56","43520 → 9002 [ACK] Seq=7516 Ack=94130 Win=8442 Len=0"
"3.790248","172.19.0.3","5.9.29.183","TLSv1.2","599","Application Data"
"3.790500","5.9.29.183","172.19.0.3","TCP","56","9002 → 43520 [ACK] Seq=94130 Ack=8059 Win=65535 Len=0"
"3.799655","5.9.29.183","172.19.0.3","TCP","1516","9002 → 43520 [PSH, ACK] Seq=94130 Ack=8059 Win=65535 Len=1460 [TCP segment of a reassembled PDU]"
"3.799794","5.9.29.183","172.19.0.3","TLSv1.2","572","Application Data"
"3.799817","172.19.0.3","5.9.29.183","TCP","56","43520 → 9002 [ACK] Seq=8059 Ack=96106 Win=8458 Len=0"
"3.806654","5.9.29.183","172.19.0.3","TCP","1516","[TCP segment of a reassembled PDU]"
"3.806726","5.9.29.183","172.19.0.3","TCP","1516","9002 → 43520 [PSH, ACK] Seq=97566 Ack=8059 Win=65535 Len=1460 [TCP segment of a reassembled PDU]"
"3.806743","172.19.0.3","5.9.29.183","TCP","56","43520 → 9002 [ACK] Seq=8059 Ack=99026 Win=8458 Len=0"
"3.806747","5.9.29.183","172.19.0.3","TLSv1.2","1444","Application Data [TCP segment of a reassembled PDU]"
"3.806751","5.9.29.183","172.19.0.3","TCP","1516","9002 → 43520 [PSH, ACK] Seq=100414 Ack=8059 Win=65535 Len=1460 [TCP segment of a reassembled PDU]"
"3.806754","5.9.29.183","172.19.0.3","TCP","80","9002 → 43520 [PSH, ACK] Seq=101874 Ack=8059 Win=65535 Len=24 [TCP segment of a reassembled PDU]"
"3.806879","172.19.0.3","5.9.29.183","TCP","56","43520 → 9002 [ACK] Seq=8059 Ack=101898 Win=8440 Len=0"
"3.814605","5.9.29.183","172.19.0.3","TLSv1.2","1004","Application Data"
"3.823457","5.9.29.183","172.19.0.3","TCP","1516","[TCP segment of a reassembled PDU]"
"3.823477","172.19.0.3","5.9.29.183","TCP","56","43520 → 9002 [ACK] Seq=8059 Ack=104306 Win=8466 Len=0"
"3.823516","5.9.29.183","172.19.0.3","TCP","1516","9002 → 43520 [PSH, ACK] Seq=104306 Ack=8059 Win=65535 Len=1460 [TCP segment of a reassembled PDU]"
"3.823551","5.9.29.183","172.19.0.3","TLSv1.2","1480","Application Data [TCP segment of a reassembled PDU]"
"3.823558","5.9.29.183","172.19.0.3","TCP","1516","9002 → 43520 [PSH, ACK] Seq=107190 Ack=8059 Win=65535 Len=1460 [TCP segment of a reassembled PDU]"
"3.823563","5.9.29.183","172.19.0.3","TCP","1492","9002 → 43520 [PSH, ACK] Seq=108650 Ack=8059 Win=65535 Len=1436 [TCP segment of a reassembled PDU]"
"3.823669","172.19.0.3","5.9.29.183","TCP","56","43520 → 9002 [ACK] Seq=8059 Ack=110086 Win=8434 Len=0"
"3.829511","5.9.29.183","172.19.0.3","TLSv1.2","70","Application Data"
"3.855988","5.9.29.183","172.19.0.3","TCP","1504","[TCP segment of a reassembled PDU]"
"3.856009","172.19.0.3","5.9.29.183","TCP","56","43520 → 9002 [ACK] Seq=8059 Ack=111548 Win=8466 Len=0"
"3.856099","5.9.29.183","172.19.0.3","TCP","1516","9002 → 43520 [PSH, ACK] Seq=111548 Ack=8059 Win=65535 Len=1460 [TCP segment of a reassembled PDU]"
"3.856111","5.9.29.183","172.19.0.3","TLSv1.2","1516","Application Data [TCP segment of a reassembled PDU]"
"3.856115","5.9.29.183","172.19.0.3","TCP","1516","9002 → 43520 [PSH, ACK] Seq=114468 Ack=8059 Win=65535 Len=1460 [TCP segment of a reassembled PDU]"
"3.856210","5.9.29.183","172.19.0.3","TCP","1516","9002 → 43520 [PSH, ACK] Seq=115928 Ack=8059 Win=65535 Len=1460 [TCP segment of a reassembled PDU]"
"3.856217","5.9.29.183","172.19.0.3","TLSv1.2","1189","Application Data [TCP segment of a reassembled PDU]"
"3.856234","172.19.0.3","5.9.29.183","TCP","56","43520 → 9002 [ACK] Seq=8059 Ack=115928 Win=8442 Len=0"
"3.856397","172.19.0.3","5.9.29.183","TCP","56","43520 → 9002 [ACK] Seq=8059 Ack=118521 Win=8426 Len=0"
"3.856860","172.19.0.3","5.9.29.183","TLSv1.2","1113","Application Data"
"3.857099","5.9.29.183","172.19.0.3","TCP","56","9002 → 43520 [ACK] Seq=118521 Ack=9116 Win=65535 Len=0"
"3.871469","5.9.29.183","172.19.0.3","TLSv1.2","974","Application Data"
"3.878011","5.9.29.183","172.19.0.3","TCP","1504","[TCP segment of a reassembled PDU]"
"3.878070","172.19.0.3","5.9.29.183","TCP","56","43520 → 9002 [ACK] Seq=9116 Ack=120887 Win=8466 Len=0"
"3.878105","5.9.29.183","172.19.0.3","TCP","1504","9002 → 43520 [PSH, ACK] Seq=120887 Ack=9116 Win=65535 Len=1448 [TCP segment of a reassembled PDU]"
"3.886081","5.9.29.183","172.19.0.3","TLSv1.2","787","Application Data"
"3.886091","172.19.0.3","5.9.29.183","TCP","56","43520 → 9002 [ACK] Seq=9116 Ack=123066 Win=8466 Len=0"
"3.890375","5.9.29.183","172.19.0.3","TCP","1516","[TCP segment of a reassembled PDU]"
"3.890429","5.9.29.183","172.19.0.3","TCP","1516","9002 → 43520 [PSH, ACK] Seq=124526 Ack=9116 Win=65535 Len=1460 [TCP segment of a reassembled PDU]"
"3.890436","5.9.29.183","172.19.0.3","TLSv1.2","1516","Application Data [TCP segment of a reassembled PDU]"
"3.890438","5.9.29.183","172.19.0.3","TCP","1468","9002 → 43520 [PSH, ACK] Seq=127446 Ack=9116 Win=65535 Len=1412 [TCP segment of a reassembled PDU]"
"3.890563","172.19.0.3","5.9.29.183","TCP","56","43520 → 9002 [ACK] Seq=9116 Ack=128858 Win=8442 Len=0"
"3.901621","5.9.29.183","172.19.0.3","TCP","1516","9002 → 43520 [PSH, ACK] Seq=128858 Ack=9116 Win=65535 Len=1460 [TCP segment of a reassembled PDU]"
"3.901683","5.9.29.183","172.19.0.3","TLSv1.2","1516","Application Data [TCP segment of a reassembled PDU]"
"3.901698","172.19.0.3","5.9.29.183","TCP","56","43520 → 9002 [ACK] Seq=9116 Ack=131778 Win=8458 Len=0"
"3.901700","5.9.29.183","172.19.0.3","TCP","1516","9002 → 43520 [PSH, ACK] Seq=131778 Ack=9116 Win=65535 Len=1460 [TCP segment of a reassembled PDU]"
"3.901704","5.9.29.183","172.19.0.3","TCP","1468","9002 → 43520 [PSH, ACK] Seq=133238 Ack=9116 Win=65535 Len=1412 [TCP segment of a reassembled PDU]"
"3.901808","172.19.0.3","5.9.29.183","TCP","56","43520 → 9002 [ACK] Seq=9116 Ack=134650 Win=8442 Len=0"
"3.916545","5.9.29.183","172.19.0.3","TLSv1.2","381","Application Data"
"3.948120","5.9.29.183","172.19.0.3","TCP","1516","[TCP segment of a reassembled PDU]"
"3.948142","172.19.0.3","5.9.29.183","TCP","56","43520 → 9002 [ACK] Seq=9116 Ack=136435 Win=8466 Len=0"
"3.948195","5.9.29.183","172.19.0.3","TLSv1.2","1195","Application Data"
"3.953514","172.19.0.3","5.9.29.183","TLSv1.2","599","Application Data"
"3.953761","5.9.29.183","172.19.0.3","TCP","56","9002 → 43520 [ACK] Seq=137574 Ack=9659 Win=65535 Len=0"
"4.237674","5.9.29.183","172.19.0.3","TLSv1.2","599","Application Data"
"4.238541","172.19.0.3","5.9.29.183","TLSv1.2","599","Application Data"
"4.238863","5.9.29.183","172.19.0.3","TCP","56","9002 → 43520 [ACK] Seq=138117 Ack=10202 Win=65535 Len=0"
"4.639534","5.9.29.183","172.19.0.3","TLSv1.2","599","Application Data"
"4.680315","172.19.0.3","5.9.29.183","TCP","56","43520 → 9002 [ACK] Seq=10202 Ack=138660 Win=8466 Len=0"
"4.706703","5.9.29.183","172.19.0.3","TCP","1504","[TCP segment of a reassembled PDU]"
"4.706740","172.19.0.3","5.9.29.183","TCP","56","43520 → 9002 [ACK] Seq=10202 Ack=140108 Win=8466 Len=0"
"4.706787","5.9.29.183","172.19.0.3","TCP","1516","9002 → 43520 [PSH, ACK] Seq=140108 Ack=10202 Win=65535 Len=1460 [TCP segment of a reassembled PDU]"
"4.706806","172.19.0.3","5.9.29.183","TCP","56","43520 → 9002 [ACK] Seq=10202 Ack=141568 Win=8458 Len=0"
"4.706808","5.9.29.183","172.19.0.3","TLSv1.2","775","Application Data"
"4.706816","172.19.0.3","5.9.29.183","TCP","56","43520 → 9002 [ACK] Seq=10202 Ack=142287 Win=8453 Len=0"
"4.711149","172.19.0.3","5.9.29.183","TLSv1.2","599","Application Data"
"4.711688","5.9.29.183","172.19.0.3","TCP","56","9002 → 43520 [ACK] Seq=142287 Ack=10745 Win=65535 Len=0"
"4.963492","5.9.29.183","172.19.0.3","TLSv1.2","599","Application Data"
"4.964118","172.19.0.3","5.9.29.183","TLSv1.2","599","Application Data"
"4.964394","5.9.29.183","172.19.0.3","TCP","56","9002 → 43520 [ACK] Seq=142830 Ack=11288 Win=65535 Len=0"
"5.405261","5.9.29.183","172.19.0.3","TCP","1516","[TCP segment of a reassembled PDU]"
"5.405349","5.9.29.183","172.19.0.3","TCP","1516","9002 → 43520 [PSH, ACK] Seq=144290 Ack=11288 Win=65535 Len=1460 [TCP segment of a reassembled PDU]"
"5.405362","5.9.29.183","172.19.0.3","TLSv1.2","1213","Application Data"
"5.405496","172.19.0.3","5.9.29.183","TCP","56","43520 → 9002 [ACK] Seq=11288 Ack=146907 Win=8450 Len=0"
"5.420925","5.9.29.183","172.19.0.3","TLSv1.2","149","Application Data"
"5.453109","5.9.29.183","172.19.0.3","TCP","1504","[TCP segment of a reassembled PDU]"
"5.453133","172.19.0.3","5.9.29.183","TCP","56","43520 → 9002 [ACK] Seq=11288 Ack=148448 Win=8466 Len=0"
"5.453184","5.9.29.183","172.19.0.3","TCP","1516","9002 → 43520 [PSH, ACK] Seq=148448 Ack=11288 Win=65535 Len=1460 [TCP segment of a reassembled PDU]"
"5.453196","5.9.29.183","172.19.0.3","TLSv1.2","775","Application Data"
"5.453358","172.19.0.3","5.9.29.183","TCP","56","43520 → 9002 [ACK] Seq=11288 Ack=150627 Win=8450 Len=0"
"5.469650","5.9.29.183","172.19.0.3","TCP","1516","[TCP segment of a reassembled PDU]"
"5.469720","5.9.29.183","172.19.0.3","TCP","1516","9002 → 43520 [PSH, ACK] Seq=152087 Ack=11288 Win=65535 Len=1460 [TCP segment of a reassembled PDU]"
"5.469742","172.19.0.3","5.9.29.183","TCP","56","43520 → 9002 [ACK] Seq=11288 Ack=153547 Win=8458 Len=0"
"5.469747","5.9.29.183","172.19.0.3","TLSv1.2","1213","Application Data"
"5.484976","5.9.29.183","172.19.0.3","TLSv1.2","149","Application Data"
"5.485181","172.19.0.3","5.9.29.183","TCP","56","43520 → 9002 [ACK] Seq=11288 Ack=154797 Win=8466 Len=0"
"5.499886","5.9.29.183","172.19.0.3","TCP","1516","[TCP segment of a reassembled PDU]"
"5.499968","5.9.29.183","172.19.0.3","TCP","1492","9002 → 43520 [PSH, ACK] Seq=156257 Ack=11288 Win=65535 Len=1436 [TCP segment of a reassembled PDU]"
"5.500171","172.19.0.3","5.9.29.183","TCP","56","43520 → 9002 [ACK] Seq=11288 Ack=157693 Win=8458 Len=0"
"5.500302","5.9.29.183","172.19.0.3","TLSv1.2","1330","Application Data, Application Data"
"5.504363","172.19.0.3","5.9.29.183","TLSv1.2","599","Application Data"
"5.504627","5.9.29.183","172.19.0.3","TCP","56","9002 → 43520 [ACK] Seq=158967 Ack=11831 Win=65535 Len=0"
"5.908546","5.9.29.183","172.19.0.3","TLSv1.2","599","Application Data"
"5.909091","172.19.0.3","5.9.29.183","TLSv1.2","599","Application Data"
"5.909311","5.9.29.183","172.19.0.3","TCP","56","9002 → 43520 [ACK] Seq=159510 Ack=12374 Win=65535 Len=0"
"6.193919","5.9.29.183","172.19.0.3","TCP","1516","[TCP segment of a reassembled PDU]"
"6.194019","5.9.29.183","172.19.0.3","TCP","1492","9002 → 43520 [PSH, ACK] Seq=160970 Ack=12374 Win=65535 Len=1436 [TCP segment of a reassembled PDU]"
"6.194031","5.9.29.183","172.19.0.3","TLSv1.2","787","Application Data"
"6.194168","172.19.0.3","5.9.29.183","TCP","56","43520 → 9002 [ACK] Seq=12374 Ack=163137 Win=8448 Len=0"
"6.241963","5.9.29.183","172.19.0.3","TCP","1516","[TCP segment of a reassembled PDU]"
"6.242059","5.9.29.183","172.19.0.3","TCP","1409","9002 → 43520 [PSH, ACK] Seq=164597 Ack=12374 Win=65535 Len=1353 [TCP segment of a reassembled PDU]"
"6.242081","172.19.0.3","5.9.29.183","TCP","56","43520 → 9002 [ACK] Seq=12374 Ack=165950 Win=8458 Len=0"
"6.242145","5.9.29.183","172.19.0.3","TLSv1.2","870","Application Data"
"6.260757","5.9.29.183","172.19.0.3","TCP","1516","[TCP segment of a reassembled PDU]"
"6.260780","172.19.0.3","5.9.29.183","TCP","56","43520 → 9002 [ACK] Seq=12374 Ack=168224 Win=8466 Len=0"
"6.260840","5.9.29.183","172.19.0.3","TCP","1516","9002 → 43520 [PSH, ACK] Seq=168224 Ack=12374 Win=65535 Len=1460 [TCP segment of a reassembled PDU]"
"6.260851","5.9.29.183","172.19.0.3","TLSv1.2","1213","Application Data"
"6.261007","172.19.0.3","5.9.29.183","TCP","56","43520 → 9002 [ACK] Seq=12374 Ack=170841 Win=8450 Len=0"
"6.275877","5.9.29.183","172.19.0.3","TLSv1.2","149","Application Data"
"6.287056","5.9.29.183","172.19.0.3","TCP","1504","[TCP segment of a reassembled PDU]"
"6.287082","172.19.0.3","5.9.29.183","TCP","56","43520 → 9002 [ACK] Seq=12374 Ack=172382 Win=8466 Len=0"
"6.287528","5.9.29.183","172.19.0.3","TCP","1516","9002 → 43520 [PSH, ACK] Seq=172382 Ack=12374 Win=65535 Len=1460 [TCP segment of a reassembled PDU]"
"6.287587","5.9.29.183","172.19.0.3","TLSv1.2","1492","Application Data [TCP segment of a reassembled PDU]"
"6.287618","5.9.29.183","172.19.0.3","TCP","1516","9002 → 43520 [PSH, ACK] Seq=175278 Ack=12374 Win=65535 Len=1460 [TCP segment of a reassembled PDU]"
"6.287623","5.9.29.183","172.19.0.3","TCP","1516","9002 → 43520 [PSH, ACK] Seq=176738 Ack=12374 Win=65535 Len=1460 [TCP segment of a reassembled PDU]"
"6.287676","172.19.0.3","5.9.29.183","TCP","56","43520 → 9002 [ACK] Seq=12374 Ack=178198 Win=8442 Len=0"
"6.287711","5.9.29.183","172.19.0.3","TLSv1.2","1480","Application Data [TCP segment of a reassembled PDU]"
"6.287940","172.19.0.3","5.9.29.183","TLSv1.2","599","Application Data"
"6.288200","5.9.29.183","172.19.0.3","TCP","56","9002 → 43520 [ACK] Seq=179622 Ack=12917 Win=65535 Len=0"
"6.291236","5.9.29.183","172.19.0.3","TLSv1.2","193","Application Data"
"6.325355","5.9.29.183","172.19.0.3","TCP","1516","[TCP segment of a reassembled PDU]"
"6.325373","172.19.0.3","5.9.29.183","TCP","56","43520 → 9002 [ACK] Seq=12917 Ack=181219 Win=8466 Len=0"
"6.325409","5.9.29.183","172.19.0.3","TLSv1.2","167","Application Data"
"6.355331","5.9.29.183","172.19.0.3","TCP","1516","[TCP segment of a reassembled PDU]"
"6.355348","172.19.0.3","5.9.29.183","TCP","56","43520 → 9002 [ACK] Seq=12917 Ack=182790 Win=8466 Len=0"
"6.355383","5.9.29.183","172.19.0.3","TCP","1516","9002 → 43520 [PSH, ACK] Seq=182790 Ack=12917 Win=65535 Len=1460 [TCP segment of a reassembled PDU]"
"6.355411","5.9.29.183","172.19.0.3","TLSv1.2","1516","Application Data [TCP segment of a reassembled PDU]"
"6.355415","5.9.29.183","172.19.0.3","TCP","1201","9002 → 43520 [PSH, ACK] Seq=185710 Ack=12917 Win=65535 Len=1145 [TCP segment of a reassembled PDU]"
"6.355417","5.9.29.183","172.19.0.3","TCP","1504","9002 → 43520 [PSH, ACK] Seq=186855 Ack=12917 Win=65535 Len=1448 [TCP segment of a reassembled PDU]"
"6.355542","172.19.0.3","5.9.29.183","TCP","56","43520 → 9002 [ACK] Seq=12917 Ack=188303 Win=8432 Len=0"
"6.392000","5.9.29.183","172.19.0.3","TLSv1.2","851","Application Data"
"6.392351","172.19.0.3","5.9.29.183","TLSv1.2","599","Application Data"
"6.392639","5.9.29.183","172.19.0.3","TCP","56","9002 → 43520 [ACK] Seq=189098 Ack=13460 Win=65535 Len=0"
"6.424829","5.9.29.183","172.19.0.3","TCP","1516","[TCP segment of a reassembled PDU]"
"6.424875","5.9.29.183","172.19.0.3","TCP","1516","9002 → 43520 [PSH, ACK] Seq=190558 Ack=13460 Win=65535 Len=1460 [TCP segment of a reassembled PDU]"
"6.424881","5.9.29.183","172.19.0.3","TLSv1.2","1480","Application Data [TCP segment of a reassembled PDU]"
"6.425003","172.19.0.3","5.9.29.183","TCP","56","43520 → 9002 [ACK] Seq=13460 Ack=193442 Win=8450 Len=0"
"6.428419","5.9.29.183","172.19.0.3","TLSv1.2","1516","Application Data [TCP segment of a reassembled PDU]"
"6.428449","5.9.29.183","172.19.0.3","TCP","1516","9002 → 43520 [PSH, ACK] Seq=194902 Ack=13460 Win=65535 Len=1460 [TCP segment of a reassembled PDU]"
"6.428457","172.19.0.3","5.9.29.183","TCP","56","43520 → 9002 [ACK] Seq=13460 Ack=196362 Win=8458 Len=0"
"6.428459","5.9.29.183","172.19.0.3","TLSv1.2","589","Application Data"
"6.428462","5.9.29.183","172.19.0.3","TCP","1504","[TCP segment of a reassembled PDU]"
"6.428507","172.19.0.3","5.9.29.183","TCP","56","43520 → 9002 [ACK] Seq=13460 Ack=198343 Win=8443 Len=0"
"6.431499","5.9.29.183","172.19.0.3","TLSv1.2","1504","Application Data [TCP segment of a reassembled PDU]"
"6.444596","5.9.29.183","172.19.0.3","TCP","1504","9002 → 43520 [PSH, ACK] Seq=199791 Ack=13460 Win=65535 Len=1448 [TCP segment of a reassembled PDU]"
"6.444620","172.19.0.3","5.9.29.183","TCP","56","43520 → 9002 [ACK] Seq=13460 Ack=201239 Win=8466 Len=0"
"6.445185","5.9.29.183","172.19.0.3","TCP","1516","9002 → 43520 [PSH, ACK] Seq=201239 Ack=13460 Win=65535 Len=1460 [TCP segment of a reassembled PDU]"
"6.445235","5.9.29.183","172.19.0.3","TLSv1.2","1492","Application Data [TCP segment of a reassembled PDU]"
"6.445353","172.19.0.3","5.9.29.183","TCP","56","43520 → 9002 [ACK] Seq=13460 Ack=204135 Win=8458 Len=0"
"6.445356","5.9.29.183","172.19.0.3","TCP","1516","9002 → 43520 [PSH, ACK] Seq=204135 Ack=13460 Win=65535 Len=1460 [TCP segment of a reassembled PDU]"
"6.445362","5.9.29.183","172.19.0.3","TCP","1516","9002 → 43520 [PSH, ACK] Seq=205595 Ack=13460 Win=65535 Len=1460 [TCP segment of a reassembled PDU]"
"6.445457","5.9.29.183","172.19.0.3","TLSv1.2","1320","Application Data, Application Data"
"6.445634","172.19.0.3","5.9.29.183","TCP","56","43520 → 9002 [ACK] Seq=13460 Ack=208319 Win=8434 Len=0"
"6.460542","5.9.29.183","172.19.0.3","TCP","1504","[TCP segment of a reassembled PDU]"
"6.460672","5.9.29.183","172.19.0.3","TCP","1516","9002 → 43520 [PSH, ACK] Seq=209767 Ack=13460 Win=65535 Len=1460 [TCP segment of a reassembled PDU]"
"6.460687","172.19.0.3","5.9.29.183","TCP","56","43520 → 9002 [ACK] Seq=13460 Ack=211227 Win=8456 Len=0"
"6.460806","5.9.29.183","172.19.0.3","TLSv1.2","1516","Application Data [TCP segment of a reassembled PDU]"
"6.460816","5.9.29.183","172.19.0.3","TLSv1.2","372","Application Data"
"6.460850","172.19.0.3","5.9.29.183","TCP","56","43520 → 9002 [ACK] Seq=13460 Ack=213003 Win=8458 Len=0"
"6.461189","172.19.0.3","5.9.29.183","TLSv1.2","599","Application Data"
"6.461551","5.9.29.183","172.19.0.3","TCP","56","9002 → 43520 [ACK] Seq=213003 Ack=14003 Win=65535 Len=0"
"6.482614","5.9.29.183","172.19.0.3","TCP","1516","[TCP segment of a reassembled PDU]"
"6.482666","5.9.29.183","172.19.0.3","TCP","1516","9002 → 43520 [PSH, ACK] Seq=214463 Ack=14003 Win=65535 Len=1460 [TCP segment of a reassembled PDU]"
"6.482678","172.19.0.3","5.9.29.183","TCP","56","43520 → 9002 [ACK] Seq=14003 Ack=215923 Win=8458 Len=0"
"6.482680","5.9.29.183","172.19.0.3","TLSv1.2","1516","Application Data [TCP segment of a reassembled PDU]"
"6.482682","5.9.29.183","172.19.0.3","TCP","1516","9002 → 43520 [PSH, ACK] Seq=217383 Ack=14003 Win=65535 Len=1460 [TCP segment of a reassembled PDU]"
"6.482684","5.9.29.183","172.19.0.3","TCP","1189","9002 → 43520 [PSH, ACK] Seq=218843 Ack=14003 Win=65535 Len=1133 [TCP segment of a reassembled PDU]"
"6.482833","172.19.0.3","5.9.29.183","TCP","56","43520 → 9002 [ACK] Seq=14003 Ack=219976 Win=8434 Len=0"
"6.497779","5.9.29.183","172.19.0.3","TLSv1.2","851","Application Data"
"6.502576","172.19.0.3","5.9.29.183","TLSv1.2","599","Application Data"
"6.502852","5.9.29.183","172.19.0.3","TCP","56","9002 → 43520 [ACK] Seq=220771 Ack=14546 Win=65535 Len=0"
"7.269013","5.9.29.183","172.19.0.3","TLSv1.2","599","Application Data"
"7.269625","172.19.0.3","5.9.29.183","TLSv1.2","599","Application Data"
"7.269911","5.9.29.183","172.19.0.3","TCP","56","9002 → 43520 [ACK] Seq=221314 Ack=15089 Win=65535 Len=0"
"7.646311","5.9.29.183","172.19.0.3","TLSv1.2","599","Application Data"
"7.674650","5.9.29.183","172.19.0.3","TCP","1516","[TCP segment of a reassembled PDU]"
"7.674667","172.19.0.3","5.9.29.183","TCP","56","43520 → 9002 [ACK] Seq=15089 Ack=223317 Win=8466 Len=0"
"7.674702","5.9.29.183","172.19.0.3","TCP","1516","9002 → 43520 [PSH, ACK] Seq=223317 Ack=15089 Win=65535 Len=1460 [TCP segment of a reassembled PDU]"
"7.674712","5.9.29.183","172.19.0.3","TLSv1.2","763","Application Data"
"7.674869","172.19.0.3","5.9.29.183","TCP","56","43520 → 9002 [ACK] Seq=15089 Ack=225484 Win=8450 Len=0"
"7.693562","5.9.29.183","172.19.0.3","TCP","1516","[TCP segment of a reassembled PDU]"
"7.693617","5.9.29.183","172.19.0.3","TCP","1492","9002 → 43520 [PSH, ACK] Seq=226944 Ack=15089 Win=65535 Len=1436 [TCP segment of a reassembled PDU]"
"7.693629","172.19.0.3","5.9.29.183","TCP","56","43520 → 9002 [ACK] Seq=15089 Ack=228380 Win=8458 Len=0"
"7.693631","5.9.29.183","172.19.0.3","TLSv1.2","787","Application Data"
"7.693902","172.19.0.3","5.9.29.183","TLSv1.2","599","Application Data"
"7.694267","5.9.29.183","172.19.0.3","TCP","56","9002 → 43520 [ACK] Seq=229111 Ack=15632 Win=65535 Len=0"
"7.724858","5.9.29.183","172.19.0.3","TCP","1516","[TCP segment of a reassembled PDU]"
"7.724916","5.9.29.183","172.19.0.3","TCP","971","9002 → 43520 [PSH, ACK] Seq=230571 Ack=15632 Win=65535 Len=915 [TCP segment of a reassembled PDU]"
"7.724923","5.9.29.183","172.19.0.3","TCP","1516","9002 → 43520 [PSH, ACK] Seq=231486 Ack=15632 Win=65535 Len=1460 [TCP segment of a reassembled PDU]"
"7.724925","5.9.29.183","172.19.0.3","TLSv1.2","1516","Application Data [TCP segment of a reassembled PDU]"
"7.724929","5.9.29.183","172.19.0.3","TCP","286","9002 → 43520 [PSH, ACK] Seq=234406 Ack=15632 Win=65535 Len=230 [TCP segment of a reassembled PDU]"
"7.725022","172.19.0.3","5.9.29.183","TCP","56","43520 → 9002 [ACK] Seq=15632 Ack=234636 Win=8434 Len=0"
"7.747200","5.9.29.183","172.19.0.3","TLSv1.2","1516","Application Data [TCP segment of a reassembled PDU]"
"7.747240","5.9.29.183","172.19.0.3","TCP","1516","9002 → 43520 [PSH, ACK] Seq=236096 Ack=15632 Win=65535 Len=1460 [TCP segment of a reassembled PDU]"
"7.747252","172.19.0.3","5.9.29.183","TCP","56","43520 → 9002 [ACK] Seq=15632 Ack=237556 Win=8456 Len=0"
"7.747254","5.9.29.183","172.19.0.3","TLSv1.2","436","Application Data"
"7.756657","5.9.29.183","172.19.0.3","TCP","1516","[TCP segment of a reassembled PDU]"
"7.756673","172.19.0.3","5.9.29.183","TCP","56","43520 → 9002 [ACK] Seq=15632 Ack=239396 Win=8466 Len=0"
"7.756716","5.9.29.183","172.19.0.3","TCP","1492","9002 → 43520 [PSH, ACK] Seq=239396 Ack=15632 Win=65535 Len=1436 [TCP segment of a reassembled PDU]"
"7.756752","5.9.29.183","172.19.0.3","TLSv1.2","1516","Application Data [TCP segment of a reassembled PDU]"
"7.756756","5.9.29.183","172.19.0.3","TCP","1492","9002 → 43520 [PSH, ACK] Seq=242292 Ack=15632 Win=65535 Len=1436 [TCP segment of a reassembled PDU]"
"7.756880","172.19.0.3","5.9.29.183","TCP","56","43520 → 9002 [ACK] Seq=15632 Ack=243728 Win=8442 Len=0"
"7.762122","5.9.29.183","172.19.0.3","TLSv1.2","490","Application Data"
"7.803369","172.19.0.3","5.9.29.183","TCP","56","43520 → 9002 [ACK] Seq=15632 Ack=244162 Win=8466 Len=0"
"7.804380","5.9.29.183","172.19.0.3","TCP","1516","[TCP segment of a reassembled PDU]"
"7.804394","172.19.0.3","5.9.29.183","TCP","56","43520 → 9002 [ACK] Seq=15632 Ack=245622 Win=8466 Len=0"
"7.804448","5.9.29.183","172.19.0.3","TCP","1492","9002 → 43520 [PSH, ACK] Seq=245622 Ack=15632 Win=65535 Len=1436 [TCP segment of a reassembled PDU]"
"7.804459","172.19.0.3","5.9.29.183","TCP","56","43520 → 9002 [ACK] Seq=15632 Ack=247058 Win=8458 Len=0"
"7.804502","5.9.29.183","172.19.0.3","TLSv1.2","787","Application Data"
"7.804507","172.19.0.3","5.9.29.183","TCP","56","43520 → 9002 [ACK] Seq=15632 Ack=247789 Win=8453 Len=0"
"7.804721","172.19.0.3","5.9.29.183","TLSv1.2","599","Application Data"
"7.804892","5.9.29.183","172.19.0.3","TCP","56","9002 → 43520 [ACK] Seq=247789 Ack=16175 Win=65535 Len=0"
"7.833155","5.9.29.183","172.19.0.3","TCP","1504","[TCP segment of a reassembled PDU]"
"7.833275","5.9.29.183","172.19.0.3","TCP","1504","9002 → 43520 [PSH, ACK] Seq=249237 Ack=16175 Win=65535 Len=1448 [TCP segment of a reassembled PDU]"
"7.833283","5.9.29.183","172.19.0.3","TLSv1.2","273","Application Data"
"7.833359","172.19.0.3","5.9.29.183","TCP","56","43520 → 9002 [ACK] Seq=16175 Ack=250902 Win=8450 Len=0"
"7.888187","5.9.29.183","172.19.0.3","TCP","1516","[TCP segment of a reassembled PDU]"
"7.888225","5.9.29.183","172.19.0.3","TCP","1492","9002 → 43520 [PSH, ACK] Seq=252362 Ack=16175 Win=65535 Len=1436 [TCP segment of a reassembled PDU]"
"7.888238","172.19.0.3","5.9.29.183","TCP","56","43520 → 9002 [ACK] Seq=16175 Ack=253798 Win=8458 Len=0"
"7.888239","5.9.29.183","172.19.0.3","TLSv1.2","787","Application Data"
"7.888673","172.19.0.3","5.9.29.183","TLSv1.2","599","Application Data"
"7.888812","5.9.29.183","172.19.0.3","TCP","56","9002 → 43520 [ACK] Seq=254529 Ack=16718 Win=65535 Len=0"
"7.898443","172.19.0.3","5.9.29.183","TLSv1.2","599","Application Data"
"7.898673","5.9.29.183","172.19.0.3","TCP","56","9002 → 43520 [ACK] Seq=254529 Ack=17261 Win=65535 Len=0"
"7.925057","5.9.29.183","172.19.0.3","TLSv1.2","599","Application Data"
"7.966761","172.19.0.3","5.9.29.183","TCP","56","43520 → 9002 [ACK] Seq=17261 Ack=255072 Win=8466 Len=0"
"8.318041","5.9.29.183","172.19.0.3","TLSv1.2","599","Application Data"
"8.318134","172.19.0.3","5.9.29.183","TCP","56","43520 → 9002 [ACK] Seq=17261 Ack=255615 Win=8466 Len=0"
"8.318618","172.19.0.3","5.9.29.183","TLSv1.2","599","Application Data"
"8.318791","5.9.29.183","172.19.0.3","TCP","56","9002 → 43520 [ACK] Seq=255615 Ack=17804 Win=65535 Len=0"
"8.631983","5.9.29.183","172.19.0.3","TLSv1.2","599","Application Data"
"8.665295","5.9.29.183","172.19.0.3","TCP","1504","[TCP segment of a reassembled PDU]"
"8.665312","172.19.0.3","5.9.29.183","TCP","56","43520 → 9002 [ACK] Seq=17804 Ack=257606 Win=8466 Len=0"
"8.665345","5.9.29.183","172.19.0.3","TCP","1516","9002 → 43520 [PSH, ACK] Seq=257606 Ack=17804 Win=65535 Len=1460 [TCP segment of a reassembled PDU]"
"8.665354","5.9.29.183","172.19.0.3","TLSv1.2","775","Application Data"
"8.665465","172.19.0.3","5.9.29.183","TCP","56","43520 → 9002 [ACK] Seq=17804 Ack=259785 Win=8450 Len=0"
"8.682904","5.9.29.183","172.19.0.3","TCP","1516","[TCP segment of a reassembled PDU]"
"8.682961","5.9.29.183","172.19.0.3","TCP","1516","9002 → 43520 [PSH, ACK] Seq=261245 Ack=17804 Win=65535 Len=1460 [TCP segment of a reassembled PDU]"
"8.682973","172.19.0.3","5.9.29.183","TCP","56","43520 → 9002 [ACK] Seq=17804 Ack=262705 Win=8458 Len=0"
"8.682975","5.9.29.183","172.19.0.3","TLSv1.2","249","Application Data"
"8.704797","5.9.29.183","172.19.0.3","TCP","1516","[TCP segment of a reassembled PDU]"
"8.704815","172.19.0.3","5.9.29.183","TCP","56","43520 → 9002 [ACK] Seq=17804 Ack=264358 Win=8466 Len=0"
"8.704849","5.9.29.183","172.19.0.3","TCP","1492","9002 → 43520 [PSH, ACK] Seq=264358 Ack=17804 Win=65535 Len=1436 [TCP segment of a reassembled PDU]"
"8.704877","5.9.29.183","172.19.0.3","TLSv1.2","787","Application Data"
"8.704974","172.19.0.3","5.9.29.183","TCP","56","43520 → 9002 [ACK] Seq=17804 Ack=266525 Win=8450 Len=0"
"8.722856","5.9.29.183","172.19.0.3","TCP","1504","[TCP segment of a reassembled PDU]"
"8.723171","5.9.29.183","172.19.0.3","TLSv1.2","693","Application Data"
"8.723182","172.19.0.3","5.9.29.183","TCP","56","43520 → 9002 [ACK] Seq=17804 Ack=268610 Win=8466 Len=0"
"8.730977","5.9.29.183","172.19.0.3","TCP","1516","[TCP segment of a reassembled PDU]"
"8.731032","5.9.29.183","172.19.0.3","TCP","1492","9002 → 43520 [PSH, ACK] Seq=270070 Ack=17804 Win=65535 Len=1436 [TCP segment of a reassembled PDU]"
"8.731038","5.9.29.183","172.19.0.3","TLSv1.2","1504","Application Data [TCP segment of a reassembled PDU]"
"8.731157","172.19.0.3","5.9.29.183","TCP","56","43520 → 9002 [ACK] Seq=17804 Ack=272954 Win=8450 Len=0"
"8.738179","5.9.29.183","172.19.0.3","TLSv1.2","910","Application Data"
"8.765215","5.9.29.183","172.19.0.3","TCP","1516","[TCP segment of a reassembled PDU]"
"8.765232","172.19.0.3","5.9.29.183","TCP","56","43520 → 9002 [ACK] Seq=17804 Ack=275268 Win=8466 Len=0"
"8.765266","5.9.29.183","172.19.0.3","TCP","1516","9002 → 43520 [PSH, ACK] Seq=275268 Ack=17804 Win=65535 Len=1460 [TCP segment of a reassembled PDU]"
"8.765295","5.9.29.183","172.19.0.3","TLSv1.2","1516","Application Data [TCP segment of a reassembled PDU]"
"8.765301","5.9.29.183","172.19.0.3","TCP","1516","9002 → 43520 [PSH, ACK] Seq=278188 Ack=17804 Win=65535 Len=1460 [TCP segment of a reassembled PDU]"
"8.765306","5.9.29.183","172.19.0.3","TCP","1189","9002 → 43520 [PSH, ACK] Seq=279648 Ack=17804 Win=65535 Len=1133 [TCP segment of a reassembled PDU]"
"8.765410","172.19.0.3","5.9.29.183","TCP","56","43520 → 9002 [ACK] Seq=17804 Ack=280781 Win=8434 Len=0"
"8.800155","5.9.29.183","172.19.0.3","TLSv1.2","851","Application Data"
"8.800240","5.9.29.183","172.19.0.3","TCP","1516","[TCP segment of a reassembled PDU]"
"8.800285","172.19.0.3","5.9.29.183","TCP","56","43520 → 9002 [ACK] Seq=17804 Ack=283036 Win=8456 Len=0"
"8.800288","5.9.29.183","172.19.0.3","TCP","1516","9002 → 43520 [PSH, ACK] Seq=283036 Ack=17804 Win=65535 Len=1460 [TCP segment of a reassembled PDU]"
"8.800292","5.9.29.183","172.19.0.3","TLSv1.2","1516","Application Data [TCP segment of a reassembled PDU]"
"8.800343","172.19.0.3","5.9.29.183","TCP","56","43520 → 9002 [ACK] Seq=17804 Ack=285956 Win=8440 Len=0"
"8.800350","5.9.29.183","172.19.0.3","TCP","1516","9002 → 43520 [PSH, ACK] Seq=285956 Ack=17804 Win=65535 Len=1460 [TCP segment of a reassembled PDU]"
"8.800352","5.9.29.183","172.19.0.3","TCP","1516","9002 → 43520 [PSH, ACK] Seq=287416 Ack=17804 Win=65535 Len=1460 [TCP segment of a reassembled PDU]"
"8.800354","5.9.29.183","172.19.0.3","TLSv1.2","1516","Application Data [TCP segment of a reassembled PDU]"
"8.800355","5.9.29.183","172.19.0.3","TCP","1432","9002 → 43520 [PSH, ACK] Seq=290336 Ack=17804 Win=65535 Len=1376 [TCP segment of a reassembled PDU]"
"8.800560","172.19.0.3","5.9.29.183","TLSv1.2","1113","Application Data"
"8.800695","5.9.29.183","172.19.0.3","TCP","56","9002 → 43520 [ACK] Seq=291712 Ack=18861 Win=65535 Len=0"
"8.827045","5.9.29.183","172.19.0.3","TLSv1.2","1315","Application Data"
"8.831862","5.9.29.183","172.19.0.3","TCP","1504","[TCP segment of a reassembled PDU]"
"8.831880","172.19.0.3","5.9.29.183","TCP","56","43520 → 9002 [ACK] Seq=18861 Ack=294419 Win=8466 Len=0"
"8.832126","5.9.29.183","172.19.0.3","TCP","1504","9002 → 43520 [PSH, ACK] Seq=294419 Ack=18861 Win=65535 Len=1448 [TCP segment of a reassembled PDU]"
"8.832524","5.9.29.183","172.19.0.3","TCP","1211","9002 → 43520 [PSH, ACK] Seq=295867 Ack=18861 Win=65535 Len=1155 [TCP segment of a reassembled PDU]"
"8.832533","172.19.0.3","5.9.29.183","TCP","56","43520 → 9002 [ACK] Seq=18861 Ack=297022 Win=8466 Len=0"
"8.832641","5.9.29.183","172.19.0.3","TLSv1.2","1516","Application Data [TCP segment of a reassembled PDU]"
"8.832648","5.9.29.183","172.19.0.3","TCP","337","9002 → 43520 [PSH, ACK] Seq=298482 Ack=18861 Win=65535 Len=281 [TCP segment of a reassembled PDU]"
"8.832652","5.9.29.183","172.19.0.3","TCP","1516","9002 → 43520 [PSH, ACK] Seq=298763 Ack=18861 Win=65535 Len=1460 [TCP segment of a reassembled PDU]"
"8.832700","172.19.0.3","5.9.29.183","TCP","56","43520 → 9002 [ACK] Seq=18861 Ack=300223 Win=8450 Len=0"
"8.832794","5.9.29.183","172.19.0.3","TLSv1.2","1492","Application Data [TCP segment of a reassembled PDU]"
"8.844941","5.9.29.183","172.19.0.3","TLSv1.2","193","Application Data"
"8.844968","172.19.0.3","5.9.29.183","TCP","56","43520 → 9002 [ACK] Seq=18861 Ack=301796 Win=8466 Len=0"
"8.876848","5.9.29.183","172.19.0.3","TCP","1504","[TCP segment of a reassembled PDU]"
"8.876895","5.9.29.183","172.19.0.3","TCP","1516","9002 → 43520 [PSH, ACK] Seq=303244 Ack=18861 Win=65535 Len=1460 [TCP segment of a reassembled PDU]"
"8.876903","5.9.29.183","172.19.0.3","TLSv1.2","775","Application Data"
"8.877122","172.19.0.3","5.9.29.183","TCP","56","43520 → 9002 [ACK] Seq=18861 Ack=305423 Win=8450 Len=0"
"8.909779","5.9.29.183","172.19.0.3","TCP","1516","[TCP segment of a reassembled PDU]"
"8.909828","5.9.29.183","172.19.0.3","TCP","1516","9002 → 43520 [PSH, ACK] Seq=306883 Ack=18861 Win=65535 Len=1460 [TCP segment of a reassembled PDU]"
"8.909840","172.19.0.3","5.9.29.183","TCP","56","43520 → 9002 [ACK] Seq=18861 Ack=308343 Win=8456 Len=0"
"8.909842","5.9.29.183","172.19.0.3","TLSv1.2","1213","Application Data"
"8.909845","5.9.29.183","172.19.0.3","TCP","1516","[TCP segment of a reassembled PDU]"
"8.909849","5.9.29.183","172.19.0.3","TCP","1492","9002 → 43520 [PSH, ACK] Seq=310960 Ack=18861 Win=65535 Len=1436 [TCP segment of a reassembled PDU]"
"8.909944","172.19.0.3","5.9.29.183","TCP","56","43520 → 9002 [ACK] Seq=18861 Ack=312396 Win=8432 Len=0"
"8.910203","172.19.0.3","5.9.29.183","TLSv1.2","599","Application Data"
"8.910352","5.9.29.183","172.19.0.3","TCP","56","9002 → 43520 [ACK] Seq=312396 Ack=19404 Win=65535 Len=0"
"8.921770","5.9.29.183","172.19.0.3","TLSv1.2","1504","Application Data, Application Data"
"8.921824","5.9.29.183","172.19.0.3","TCP","1516","9002 → 43520 [PSH, ACK] Seq=313844 Ack=19404 Win=65535 Len=1460 [TCP segment of a reassembled PDU]"
"8.921848","172.19.0.3","5.9.29.183","TCP","56","43520 → 9002 [ACK] Seq=19404 Ack=315304 Win=8458 Len=0"
"8.921858","5.9.29.183","172.19.0.3","TCP","1492","9002 → 43520 [PSH, ACK] Seq=315304 Ack=19404 Win=65535 Len=1436 [TCP segment of a reassembled PDU]"
"8.929259","5.9.29.183","172.19.0.3","TLSv1.2","1504","Application Data [TCP segment of a reassembled PDU]"
"8.929276","172.19.0.3","5.9.29.183","TCP","56","43520 → 9002 [ACK] Seq=19404 Ack=318188 Win=8466 Len=0"
"8.929320","5.9.29.183","172.19.0.3","TCP","1504","9002 → 43520 [PSH, ACK] Seq=318188 Ack=19404 Win=65535 Len=1448 [TCP segment of a reassembled PDU]"
"8.933816","5.9.29.183","172.19.0.3","TCP","1516","9002 → 43520 [PSH, ACK] Seq=319636 Ack=19404 Win=65535 Len=1460 [TCP segment of a reassembled PDU]"
"8.933833","172.19.0.3","5.9.29.183","TCP","56","43520 → 9002 [ACK] Seq=19404 Ack=321096 Win=8466 Len=0"
"8.933867","5.9.29.183","172.19.0.3","TLSv1.2","1516","Application Data [TCP segment of a reassembled PDU]"
"8.933874","5.9.29.183","172.19.0.3","TCP","1516","9002 → 43520 [PSH, ACK] Seq=322556 Ack=19404 Win=65535 Len=1460 [TCP segment of a reassembled PDU]"
"8.933876","5.9.29.183","172.19.0.3","TLSv1.2","141","Application Data"
"8.933967","172.19.0.3","5.9.29.183","TCP","56","43520 → 9002 [ACK] Seq=19404 Ack=324101 Win=8443 Len=0"
"8.957517","5.9.29.183","172.19.0.3","TLSv1.2","1113","Application Data"
"8.977101","5.9.29.183","172.19.0.3","TCP","1516","[TCP segment of a reassembled PDU]"
"8.977135","172.19.0.3","5.9.29.183","TCP","56","43520 → 9002 [ACK] Seq=19404 Ack=326618 Win=8466 Len=0"
"8.977166","5.9.29.183","172.19.0.3","TCP","1516","9002 → 43520 [PSH, ACK] Seq=326618 Ack=19404 Win=65535 Len=1460 [TCP segment of a reassembled PDU]"
"8.977173","5.9.29.183","172.19.0.3","TLSv1.2","1213","Application Data"
"8.977218","5.9.29.183","172.19.0.3","TCP","1516","[TCP segment of a reassembled PDU]"
"8.977302","172.19.0.3","5.9.29.183","TCP","56","43520 → 9002 [ACK] Seq=19404 Ack=330695 Win=8442 Len=0"
"8.977449","5.9.29.183","172.19.0.3","TCP","1516","9002 → 43520 [PSH, ACK] Seq=330695 Ack=19404 Win=65535 Len=1460 [TCP segment of a reassembled PDU]"
"8.977453","5.9.29.183","172.19.0.3","TLSv1.2","1480","Application Data [TCP segment of a reassembled PDU]"
"8.977457","172.19.0.3","5.9.29.183","TCP","56","43520 → 9002 [ACK] Seq=19404 Ack=333579 Win=8456 Len=0"
"8.977608","172.19.0.3","5.9.29.183","TLSv1.2","599","Application Data"
"8.977743","5.9.29.183","172.19.0.3","TCP","56","9002 → 43520 [ACK] Seq=333579 Ack=19947 Win=65535 Len=0"
"8.988793","5.9.29.183","172.19.0.3","TLSv1.2","1504","Application Data [TCP segment of a reassembled PDU]"
"8.989152","172.19.0.3","5.9.29.183","TLSv1.2","599","Application Data"
"8.989351","5.9.29.183","172.19.0.3","TCP","56","9002 → 43520 [ACK] Seq=335027 Ack=20490 Win=65535 Len=0"
"9.000059","5.9.29.183","172.19.0.3","TLSv1.2","1097","Application Data"
"9.003826","172.19.0.3","5.9.29.183","TLSv1.2","599","Application Data"
"9.004065","5.9.29.183","172.19.0.3","TCP","56","9002 → 43520 [ACK] Seq=336068 Ack=21033 Win=65535 Len=0"
"9.366215","5.9.29.183","172.19.0.3","TLSv1.2","599","Application Data"
"9.366898","172.19.0.3","5.9.29.183","TLSv1.2","599","Application Data"
"9.367124","5.9.29.183","172.19.0.3","TCP","56","9002 → 43520 [ACK] Seq=336611 Ack=21576 Win=65535 Len=0"
"9.725562","5.9.29.183","172.19.0.3","TLSv1.2","599","Application Data"
"9.736799","5.9.29.183","172.19.0.3","TCP","1516","[TCP segment of a reassembled PDU]"
"9.736822","172.19.0.3","5.9.29.183","TCP","56","43520 → 9002 [ACK] Seq=21576 Ack=338614 Win=8466 Len=0"
"9.736875","5.9.29.183","172.19.0.3","TCP","1492","9002 → 43520 [PSH, ACK] Seq=338614 Ack=21576 Win=65535 Len=1436 [TCP segment of a reassembled PDU]"
"9.748311","5.9.29.183","172.19.0.3","TLSv1.2","787","Application Data"
"9.748332","172.19.0.3","5.9.29.183","TCP","56","43520 → 9002 [ACK] Seq=21576 Ack=340781 Win=8466 Len=0"
"9.767969","5.9.29.183","172.19.0.3","TCP","1516","[TCP segment of a reassembled PDU]"
"9.768010","5.9.29.183","172.19.0.3","TCP","1516","9002 → 43520 [PSH, ACK] Seq=342241 Ack=21576 Win=65535 Len=1460 [TCP segment of a reassembled PDU]"
"9.768019","5.9.29.183","172.19.0.3","TLSv1.2","763","Application Data"
"9.768179","172.19.0.3","5.9.29.183","TCP","56","43520 → 9002 [ACK] Seq=21576 Ack=344408 Win=8450 Len=0"
"9.809602","5.9.29.183","172.19.0.3","TCP","1504","[TCP segment of a reassembled PDU]"
"9.809647","5.9.29.183","172.19.0.3","TCP","1504","9002 → 43520 [PSH, ACK] Seq=345856 Ack=21576 Win=65535 Len=1448 [TCP segment of a reassembled PDU]"
"9.809662","172.19.0.3","5.9.29.183","TCP","56","43520 → 9002 [ACK] Seq=21576 Ack=347304 Win=8458 Len=0"
"9.809663","5.9.29.183","172.19.0.3","TLSv1.2","273","Application Data"
"9.812417","172.19.0.3","5.9.29.183","TLSv1.2","599","Application Data"
"9.812592","5.9.29.183","172.19.0.3","TCP","56","9002 → 43520 [ACK] Seq=347521 Ack=22119 Win=65535 Len=0"
"10.113465","5.9.29.183","172.19.0.3","TLSv1.2","599","Application Data"
"10.114068","172.19.0.3","5.9.29.183","TLSv1.2","599","Application Data"
"10.114393","5.9.29.183","172.19.0.3","TCP","56","9002 → 43520 [ACK] Seq=348064 Ack=22662 Win=65535 Len=0"
"10.454815","5.9.29.183","172.19.0.3","TCP","1504","[TCP segment of a reassembled PDU]"
"10.454872","5.9.29.183","172.19.0.3","TCP","1504","9002 → 43520 [PSH, ACK] Seq=349512 Ack=22662 Win=65535 Len=1448 [TCP segment of a reassembled PDU]"
"10.454879","5.9.29.183","172.19.0.3","TLSv1.2","787","Application Data"
"10.454970","172.19.0.3","5.9.29.183","TCP","56","43520 → 9002 [ACK] Seq=22662 Ack=351691 Win=8450 Len=0"
"10.482564","5.9.29.183","172.19.0.3","TCP","1516","[TCP segment of a reassembled PDU]"
"10.482610","5.9.29.183","172.19.0.3","TCP","1516","9002 → 43520 [PSH, ACK] Seq=353151 Ack=22662 Win=65535 Len=1460 [TCP segment of a reassembled PDU]"
"10.482622","172.19.0.3","5.9.29.183","TCP","56","43520 → 9002 [ACK] Seq=22662 Ack=354611 Win=8458 Len=0"
"10.482624","5.9.29.183","172.19.0.3","TLSv1.2","1213","Application Data"
"10.503216","5.9.29.183","172.19.0.3","TLSv1.2","1516","Application Data"
"10.503232","172.19.0.3","5.9.29.183","TCP","56","43520 → 9002 [ACK] Seq=22662 Ack=357228 Win=8466 Len=0"
"10.503261","5.9.29.183","172.19.0.3","TCP","1492","9002 → 43520 [PSH, ACK] Seq=357228 Ack=22662 Win=65535 Len=1436 [TCP segment of a reassembled PDU]"
"10.515780","5.9.29.183","172.19.0.3","TLSv1.2","1394","Application Data"
"10.515798","172.19.0.3","5.9.29.183","TCP","56","43520 → 9002 [ACK] Seq=22662 Ack=360002 Win=8466 Len=0"
"10.539799","5.9.29.183","172.19.0.3","TCP","1516","[TCP segment of a reassembled PDU]"
"10.539849","5.9.29.183","172.19.0.3","TCP","1152","9002 → 43520 [PSH, ACK] Seq=361462 Ack=22662 Win=65535 Len=1096 [TCP segment of a reassembled PDU]"
"10.539855","5.9.29.183","172.19.0.3","TCP","1516","9002 → 43520 [PSH, ACK] Seq=362558 Ack=22662 Win=65535 Len=1460 [TCP segment of a reassembled PDU]"
"10.539858","5.9.29.183","172.19.0.3","TLSv1.2","210","Application Data, Application Data"
"10.539876","5.9.29.183","172.19.0.3","TCP","1504","[TCP segment of a reassembled PDU]"
"10.539879","5.9.29.183","172.19.0.3","TCP","1504","9002 → 43520 [PSH, ACK] Seq=365620 Ack=22662 Win=65535 Len=1448 [TCP segment of a reassembled PDU]"
"10.539993","172.19.0.3","5.9.29.183","TCP","56","43520 → 9002 [ACK] Seq=22662 Ack=367068 Win=8426 Len=0"
"10.551862","5.9.29.183","172.19.0.3","TLSv1.2","1516","Application Data, Application Data"
"10.551908","5.9.29.183","172.19.0.3","TCP","1516","9002 → 43520 [PSH, ACK] Seq=368528 Ack=22662 Win=65535 Len=1460 [TCP segment of a reassembled PDU]"
"10.551919","172.19.0.3","5.9.29.183","TCP","56","43520 → 9002 [ACK] Seq=22662 Ack=369988 Win=8456 Len=0"
"10.551921","5.9.29.183","172.19.0.3","TCP","1516","9002 → 43520 [PSH, ACK] Seq=369988 Ack=22662 Win=65535 Len=1460 [TCP segment of a reassembled PDU]"
"10.551924","5.9.29.183","172.19.0.3","TLSv1.2","1468","Application Data [TCP segment of a reassembled PDU]"
"10.551926","5.9.29.183","172.19.0.3","TCP","1504","9002 → 43520 [PSH, ACK] Seq=372860 Ack=22662 Win=65535 Len=1448 [TCP segment of a reassembled PDU]"
"10.552090","172.19.0.3","5.9.29.183","TCP","56","43520 → 9002 [ACK] Seq=22662 Ack=374308 Win=8432 Len=0"
"10.563381","5.9.29.183","172.19.0.3","TLSv1.2","1516","Application Data [TCP segment of a reassembled PDU]"
"10.563429","5.9.29.183","172.19.0.3","TCP","1516","9002 → 43520 [PSH, ACK] Seq=375768 Ack=22662 Win=65535 Len=1460 [TCP segment of a reassembled PDU]"
"10.563441","172.19.0.3","5.9.29.183","TCP","56","43520 → 9002 [ACK] Seq=22662 Ack=377228 Win=8458 Len=0"
"10.563443","5.9.29.183","172.19.0.3","TLSv1.2","509","Application Data"
"10.563711","172.19.0.3","5.9.29.183","TLSv1.2","599","Application Data"
"10.563876","5.9.29.183","172.19.0.3","TCP","56","9002 → 43520 [ACK] Seq=377681 Ack=23205 Win=65535 Len=0"
"10.580174","5.9.29.183","172.19.0.3","TCP","1516","[TCP segment of a reassembled PDU]"
"10.580220","5.9.29.183","172.19.0.3","TCP","1516","9002 → 43520 [PSH, ACK] Seq=379141 Ack=23205 Win=65535 Len=1460 [TCP segment of a reassembled PDU]"
"10.580232","172.19.0.3","5.9.29.183","TCP","56","43520 → 9002 [ACK] Seq=23205 Ack=380601 Win=8458 Len=0"
"10.580234","5.9.29.183","172.19.0.3","TLSv1.2","1516","Application Data [TCP segment of a reassembled PDU]"
"10.580237","5.9.29.183","172.19.0.3","TCP","1468","9002 → 43520 [PSH, ACK] Seq=382061 Ack=23205 Win=65535 Len=1412 [TCP segment of a reassembled PDU]"
"10.580343","172.19.0.3","5.9.29.183","TCP","56","43520 → 9002 [ACK] Seq=23205 Ack=383473 Win=8442 Len=0"
"10.595197","5.9.29.183","172.19.0.3","TLSv1.2","490","Application Data"
"10.595565","5.9.29.183","172.19.0.3","TCP","1504","[TCP segment of a reassembled PDU]"
"10.595600","172.19.0.3","5.9.29.183","TCP","56","43520 → 9002 [ACK] Seq=23205 Ack=385355 Win=8466 Len=0"
"10.595674","5.9.29.183","172.19.0.3","TCP","1504","9002 → 43520 [PSH, ACK] Seq=385355 Ack=23205 Win=65535 Len=1448 [TCP segment of a reassembled PDU]"
"10.610273","5.9.29.183","172.19.0.3","TLSv1.2","787","Application Data"
"10.610291","172.19.0.3","5.9.29.183","TCP","56","43520 → 9002 [ACK] Seq=23205 Ack=387534 Win=8466 Len=0"
"10.610622","172.19.0.3","5.9.29.183","TLSv1.2","599","Application Data"
"10.610787","5.9.29.183","172.19.0.3","TCP","56","9002 → 43520 [ACK] Seq=387534 Ack=23748 Win=65535 Len=0"
"10.622227","5.9.29.183","172.19.0.3","TCP","1504","[TCP segment of a reassembled PDU]"
"10.625512","5.9.29.183","172.19.0.3","TLSv1.2","693","Application Data"
"10.625531","172.19.0.3","5.9.29.183","TCP","56","43520 → 9002 [ACK] Seq=23748 Ack=389619 Win=8466 Len=0"
"10.637569","5.9.29.183","172.19.0.3","TCP","1516","[TCP segment of a reassembled PDU]"
"10.637616","5.9.29.183","172.19.0.3","TCP","1516","9002 → 43520 [PSH, ACK] Seq=391079 Ack=23748 Win=65535 Len=1460 [TCP segment of a reassembled PDU]"
"10.637632","5.9.29.183","172.19.0.3","TLSv1.2","1480","Application Data [TCP segment of a reassembled PDU]"
"10.637634","5.9.29.183","172.19.0.3","TCP","1516","9002 → 43520 [PSH, ACK] Seq=393963 Ack=23748 Win=65535 Len=1460 [TCP segment of a reassembled PDU]"
"10.637636","5.9.29.183","172.19.0.3","TCP","1492","9002 → 43520 [PSH, ACK] Seq=395423 Ack=23748 Win=65535 Len=1436 [TCP segment of a reassembled PDU]"
"10.637732","172.19.0.3","5.9.29.183","TCP","56","43520 → 9002 [ACK] Seq=23748 Ack=396859 Win=8432 Len=0"
"10.650573","5.9.29.183","172.19.0.3","TLSv1.2","584","Application Data"
"10.650711","5.9.29.183","172.19.0.3","TCP","1504","[TCP segment of a reassembled PDU]"
"10.650746","172.19.0.3","5.9.29.183","TCP","56","43520 → 9002 [ACK] Seq=23748 Ack=398835 Win=8458 Len=0"
"10.650835","5.9.29.183","172.19.0.3","TCP","1504","9002 → 43520 [PSH, ACK] Seq=398835 Ack=23748 Win=65535 Len=1448 [TCP segment of a reassembled PDU]"
"10.650840","5.9.29.183","172.19.0.3","TLSv1.2","1504","Application Data [TCP segment of a reassembled PDU]"
"10.650842","5.9.29.183","172.19.0.3","TCP","1504","9002 → 43520 [PSH, ACK] Seq=401731 Ack=23748 Win=65535 Len=1448 [TCP segment of a reassembled PDU]"
"10.650878","172.19.0.3","5.9.29.183","TCP","56","43520 → 9002 [ACK] Seq=23748 Ack=403179 Win=8434 Len=0"
"10.651077","172.19.0.3","5.9.29.183","TLSv1.2","599","Application Data"
"10.651276","5.9.29.183","172.19.0.3","TCP","56","9002 → 43520 [ACK] Seq=403179 Ack=24291 Win=65535 Len=0"
"10.667334","5.9.29.183","172.19.0.3","TCP","1516","9002 → 43520 [PSH, ACK] Seq=403179 Ack=24291 Win=65535 Len=1460 [TCP segment of a reassembled PDU]"
"10.667401","5.9.29.183","172.19.0.3","TLSv1.2","572","Application Data"
"10.667418","172.19.0.3","5.9.29.183","TCP","56","43520 → 9002 [ACK] Seq=24291 Ack=405155 Win=8458 Len=0"
"10.670950","5.9.29.183","172.19.0.3","TCP","1516","[TCP segment of a reassembled PDU]"
"10.671016","5.9.29.183","172.19.0.3","TCP","1516","9002 → 43520 [PSH, ACK] Seq=406615 Ack=24291 Win=65535 Len=1460 [TCP segment of a reassembled PDU]"
"10.671032","172.19.0.3","5.9.29.183","TCP","56","43520 → 9002 [ACK] Seq=24291 Ack=408075 Win=8458 Len=0"
"10.671036","5.9.29.183","172.19.0.3","TLSv1.2","1480","Application Data [TCP segment of a reassembled PDU]"
"10.671040","5.9.29.183","172.19.0.3","TCP","1504","9002 → 43520 [PSH, ACK] Seq=409499 Ack=24291 Win=65535 Len=1448 [TCP segment of a reassembled PDU]"
"10.671202","172.19.0.3","5.9.29.183","TCP","56","43520 → 9002 [ACK] Seq=24291 Ack=410947 Win=8442 Len=0"
"10.684217","5.9.29.183","172.19.0.3","TCP","1504","9002 → 43520 [PSH, ACK] Seq=410947 Ack=24291 Win=65535 Len=1448 [TCP segment of a reassembled PDU]"
"10.684272","5.9.29.183","172.19.0.3","TLSv1.2","70","Application Data"
"10.684286","172.19.0.3","5.9.29.183","TCP","56","43520 → 9002 [ACK] Seq=24291 Ack=412409 Win=8464 Len=0"
"10.688872","172.19.0.3","5.9.29.183","TLSv1.2","599","Application Data"
"10.689125","5.9.29.183","172.19.0.3","TCP","56","9002 → 43520 [ACK] Seq=412409 Ack=24834 Win=65535 Len=0"
"11.064585","5.9.29.183","172.19.0.3","TLSv1.2","599","Application Data"
"11.065239","172.19.0.3","5.9.29.183","TLSv1.2","599","Application Data"
"11.065429","5.9.29.183","172.19.0.3","TCP","56","9002 → 43520 [ACK] Seq=412952 Ack=25377 Win=65535 Len=0"
"11.392067","5.9.29.183","172.19.0.3","TCP","1516","[TCP segment of a reassembled PDU]"
"11.392136","5.9.29.183","172.19.0.3","TCP","1492","9002 → 43520 [PSH, ACK] Seq=414412 Ack=25377 Win=65535 Len=1436 [TCP segment of a reassembled PDU]"
"11.392144","5.9.29.183","172.19.0.3","TLSv1.2","1516","Application Data [TCP segment of a reassembled PDU]"
"11.392148","5.9.29.183","172.19.0.3","TCP","1516","9002 → 43520 [PSH, ACK] Seq=417308 Ack=25377 Win=65535 Len=1460 [TCP segment of a reassembled PDU]"
"11.392152","5.9.29.183","172.19.0.3","TCP","1213","9002 → 43520 [PSH, ACK] Seq=418768 Ack=25377 Win=65535 Len=1157 [TCP segment of a reassembled PDU]"
"11.392243","172.19.0.3","5.9.29.183","TCP","56","43520 → 9002 [ACK] Seq=25377 Ack=419925 Win=8432 Len=0"
"11.409086","5.9.29.183","172.19.0.3","TLSv1.2","1516","Application Data [TCP segment of a reassembled PDU]"
"11.409279","5.9.29.183","172.19.0.3","TCP","1492","9002 → 43520 [PSH, ACK] Seq=421385 Ack=25377 Win=65535 Len=1436 [TCP segment of a reassembled PDU]"
"11.409292","172.19.0.3","5.9.29.183","TCP","56","43520 → 9002 [ACK] Seq=25377 Ack=422821 Win=8458 Len=0"
"11.420659","5.9.29.183","172.19.0.3","TLSv1.2","1068","Application Data"
"11.446343","5.9.29.183","172.19.0.3","TLSv1.2","599","Application Data"
"11.446363","172.19.0.3","5.9.29.183","TCP","56","43520 → 9002 [ACK] Seq=25377 Ack=424376 Win=8466 Len=0"
"11.451360","5.9.29.183","172.19.0.3","TCP","1516","[TCP segment of a reassembled PDU]"
"11.451434","5.9.29.183","172.19.0.3","TCP","1516","9002 → 43520 [PSH, ACK] Seq=425836 Ack=25377 Win=65535 Len=1460 [TCP segment of a reassembled PDU]"
"11.451445","5.9.29.183","172.19.0.3","TCP","854","9002 → 43520 [PSH, ACK] Seq=427296 Ack=25377 Win=65535 Len=798 [TCP segment of a reassembled PDU]"
"11.451451","5.9.29.183","172.19.0.3","TLSv1.2","1516","Application Data [TCP segment of a reassembled PDU]"
"11.451455","5.9.29.183","172.19.0.3","TCP","1516","9002 → 43520 [PSH, ACK] Seq=429554 Ack=25377 Win=65535 Len=1460 [TCP segment of a reassembled PDU]"
"11.451460","5.9.29.183","172.19.0.3","TCP","1516","9002 → 43520 [PSH, ACK] Seq=431014 Ack=25377 Win=65535 Len=1460 [TCP segment of a reassembled PDU]"
"11.451466","5.9.29.183","172.19.0.3","TLSv1.2","1516","Application Data [TCP segment of a reassembled PDU]"
"11.451517","5.9.29.183","172.19.0.3","TCP","1516","9002 → 43520 [PSH, ACK] Seq=433934 Ack=25377 Win=65535 Len=1460 [TCP segment of a reassembled PDU]"
"11.451532","5.9.29.183","172.19.0.3","TCP","622","9002 → 43520 [PSH, ACK] Seq=435394 Ack=25377 Win=65535 Len=566 [TCP segment of a reassembled PDU]"
"11.451605","172.19.0.3","5.9.29.183","TCP","56","43520 → 9002 [ACK] Seq=25377 Ack=435960 Win=8402 Len=0"
"11.458357","5.9.29.183","172.19.0.3","TLSv1.2","1504","Application Data [TCP segment of a reassembled PDU]"
"11.461651","5.9.29.183","172.19.0.3","TCP","1516","9002 → 43520 [PSH, ACK] Seq=437408 Ack=25377 Win=65535 Len=1460 [TCP segment of a reassembled PDU]"
"11.461669","172.19.0.3","5.9.29.183","TCP","56","43520 → 9002 [ACK] Seq=25377 Ack=438868 Win=8466 Len=0"
"11.461703","5.9.29.183","172.19.0.3","TCP","1492","9002 → 43520 [PSH, ACK] Seq=438868 Ack=25377 Win=65535 Len=1436 [TCP segment of a reassembled PDU]"
"11.469970","5.9.29.183","172.19.0.3","TLSv1.2","1516","Application Data [TCP segment of a reassembled PDU]"
"11.469998","172.19.0.3","5.9.29.183","TCP","56","43520 → 9002 [ACK] Seq=25377 Ack=441764 Win=8466 Len=0"
"11.470032","5.9.29.183","172.19.0.3","TLSv1.2","289","Application Data"
"11.470294","172.19.0.3","5.9.29.183","TLSv1.2","1113","Application Data"
"11.470496","5.9.29.183","172.19.0.3","TCP","56","9002 → 43520 [ACK] Seq=441997 Ack=26434 Win=65535 Len=0"
"11.474285","5.9.29.183","172.19.0.3","TCP","1516","[TCP segment of a reassembled PDU]"
"11.474329","5.9.29.183","172.19.0.3","TCP","1492","9002 → 43520 [PSH, ACK] Seq=443457 Ack=26434 Win=65535 Len=1436 [TCP segment of a reassembled PDU]"
"11.474335","5.9.29.183","172.19.0.3","TLSv1.2","1516","Application Data [TCP segment of a reassembled PDU]"
"11.474337","5.9.29.183","172.19.0.3","TCP","1492","9002 → 43520 [PSH, ACK] Seq=446353 Ack=26434 Win=65535 Len=1436 [TCP segment of a reassembled PDU]"
"11.474339","5.9.29.183","172.19.0.3","TCP","1504","9002 → 43520 [PSH, ACK] Seq=447789 Ack=26434 Win=65535 Len=1448 [TCP segment of a reassembled PDU]"
"11.474466","172.19.0.3","5.9.29.183","TCP","56","43520 → 9002 [ACK] Seq=26434 Ack=449237 Win=8432 Len=0"
"11.486144","5.9.29.183","172.19.0.3","TLSv1.2","1516","Application Data [TCP segment of a reassembled PDU]"
"11.486187","5.9.29.183","172.19.0.3","TCP","1516","9002 → 43520 [PSH, ACK] Seq=450697 Ack=26434 Win=65535 Len=1460 [TCP segment of a reassembled PDU]"
"11.486199","172.19.0.3","5.9.29.183","TCP","56","43520 → 9002 [ACK] Seq=26434 Ack=452157 Win=8458 Len=0"
"11.486202","5.9.29.183","172.19.0.3","TLSv1.2","1291","Application Data"
"11.516681","5.9.29.183","172.19.0.3","TCP","1516","[TCP segment of a reassembled PDU]"
"11.516699","172.19.0.3","5.9.29.183","TCP","56","43520 → 9002 [ACK] Seq=26434 Ack=454852 Win=8466 Len=0"
"11.516743","5.9.29.183","172.19.0.3","TCP","1516","9002 → 43520 [PSH, ACK] Seq=454852 Ack=26434 Win=65535 Len=1460 [TCP segment of a reassembled PDU]"
"11.516775","5.9.29.183","172.19.0.3","TLSv1.2","1516","Application Data [TCP segment of a reassembled PDU]"
"11.516781","5.9.29.183","172.19.0.3","TCP","1516","9002 → 43520 [PSH, ACK] Seq=457772 Ack=26434 Win=65535 Len=1460 [TCP segment of a reassembled PDU]"
"11.516839","5.9.29.183","172.19.0.3","TCP","1189","9002 → 43520 [PSH, ACK] Seq=459232 Ack=26434 Win=65535 Len=1133 [TCP segment of a reassembled PDU]"
"11.516843","5.9.29.183","172.19.0.3","TLSv1.2","1516","Application Data [TCP segment of a reassembled PDU]"
"11.516845","5.9.29.183","172.19.0.3","TCP","1492","9002 → 43520 [PSH, ACK] Seq=461825 Ack=26434 Win=65535 Len=1436 [TCP segment of a reassembled PDU]"
"11.516866","172.19.0.3","5.9.29.183","TCP","56","43520 → 9002 [ACK] Seq=26434 Ack=463261 Win=8418 Len=0"
"11.533526","5.9.29.183","172.19.0.3","TLSv1.2","1516","Application Data [TCP segment of a reassembled PDU]"
"11.533569","5.9.29.183","172.19.0.3","TCP","1516","9002 → 43520 [PSH, ACK] Seq=464721 Ack=26434 Win=65535 Len=1460 [TCP segment of a reassembled PDU]"
"11.533581","172.19.0.3","5.9.29.183","TCP","56","43520 → 9002 [ACK] Seq=26434 Ack=466181 Win=8458 Len=0"
"11.533583","5.9.29.183","172.19.0.3","TCP","1516","9002 → 43520 [PSH, ACK] Seq=466181 Ack=26434 Win=65535 Len=1460 [TCP segment of a reassembled PDU]"
"11.533585","5.9.29.183","172.19.0.3","TLSv1.2","1516","Application Data [TCP segment of a reassembled PDU]"
"11.533587","5.9.29.183","172.19.0.3","TCP","1456","9002 → 43520 [PSH, ACK] Seq=469101 Ack=26434 Win=65535 Len=1400 [TCP segment of a reassembled PDU]"
"11.533589","5.9.29.183","172.19.0.3","TLSv1.2","1516","Application Data [TCP segment of a reassembled PDU]"
"11.533632","5.9.29.183","172.19.0.3","TCP","1492","9002 → 43520 [PSH, ACK] Seq=471961 Ack=26434 Win=65535 Len=1436 [TCP segment of a reassembled PDU]"
"11.533684","172.19.0.3","5.9.29.183","TCP","56","43520 → 9002 [ACK] Seq=26434 Ack=473397 Win=8418 Len=0"
"11.533992","172.19.0.3","5.9.29.183","TLSv1.2","599","Application Data"
"11.534171","5.9.29.183","172.19.0.3","TCP","56","9002 → 43520 [ACK] Seq=473397 Ack=26977 Win=65535 Len=0"
"11.538270","5.9.29.183","172.19.0.3","TLSv1.2","271","Application Data"
"11.550237","5.9.29.183","172.19.0.3","TCP","1516","[TCP segment of a reassembled PDU]"
"11.550266","172.19.0.3","5.9.29.183","TCP","56","43520 → 9002 [ACK] Seq=26977 Ack=475072 Win=8466 Len=0"
"11.550299","5.9.29.183","172.19.0.3","TCP","1516","9002 → 43520 [PSH, ACK] Seq=475072 Ack=26977 Win=65535 Len=1460 [TCP segment of a reassembled PDU]"
"11.550327","5.9.29.183","172.19.0.3","TLSv1.2","1516","Application Data [TCP segment of a reassembled PDU]"
"11.550333","5.9.29.183","172.19.0.3","TCP","1468","9002 → 43520 [PSH, ACK] Seq=477992 Ack=26977 Win=65535 Len=1412 [TCP segment of a reassembled PDU]"
"11.550336","5.9.29.183","172.19.0.3","TCP","1504","9002 → 43520 [PSH, ACK] Seq=479404 Ack=26977 Win=65535 Len=1448 [TCP segment of a reassembled PDU]"
"11.550431","172.19.0.3","5.9.29.183","TCP","56","43520 → 9002 [ACK] Seq=26977 Ack=480852 Win=8434 Len=0"
"11.554968","5.9.29.183","172.19.0.3","TLSv1.2","70","Application Data"
"11.592242","5.9.29.183","172.19.0.3","TLSv1.2","599","Application Data"
"11.592261","172.19.0.3","5.9.29.183","TCP","56","43520 → 9002 [ACK] Seq=26977 Ack=481409 Win=8466 Len=0"
"11.637499","5.9.29.183","172.19.0.3","TCP","1516","[TCP segment of a reassembled PDU]"
"11.637537","5.9.29.183","172.19.0.3","TCP","1492","9002 → 43520 [PSH, ACK] Seq=482869 Ack=26977 Win=65535 Len=1436 [TCP segment of a reassembled PDU]"
"11.637545","5.9.29.183","172.19.0.3","TLSv1.2","787","Application Data"
"11.637638","172.19.0.3","5.9.29.183","TCP","56","43520 → 9002 [ACK] Seq=26977 Ack=485036 Win=8450 Len=0"
"11.640972","172.19.0.3","5.9.29.183","TLSv1.2","599","Application Data"
"11.641208","5.9.29.183","172.19.0.3","TCP","56","9002 → 43520 [ACK] Seq=485036 Ack=27520 Win=65535 Len=0"
"11.931500","5.9.29.183","172.19.0.3","TLSv1.2","599","Application Data"
"11.932460","172.19.0.3","5.9.29.183","TLSv1.2","599","Application Data"
"11.932772","5.9.29.183","172.19.0.3","TCP","56","9002 → 43520 [ACK] Seq=485579 Ack=28063 Win=65535 Len=0"
"12.241364","5.9.29.183","172.19.0.3","TCP","1516","[TCP segment of a reassembled PDU]"
"12.241437","5.9.29.183","172.19.0.3","TCP","1516","9002 → 43520 [PSH, ACK] Seq=487039 Ack=28063 Win=65535 Len=1460 [TCP segment of a reassembled PDU]"
"12.241444","5.9.29.183","172.19.0.3","TLSv1.2","763","Application Data"
"12.241573","172.19.0.3","5.9.29.183","TCP","56","43520 → 9002 [ACK] Seq=28063 Ack=489206 Win=8450 Len=0"
"12.274980","5.9.29.183","172.19.0.3","TCP","1516","[TCP segment of a reassembled PDU]"
"12.275066","5.9.29.183","172.19.0.3","TCP","1516","9002 → 43520 [PSH, ACK] Seq=490666 Ack=28063 Win=65535 Len=1460 [TCP segment of a reassembled PDU]"
"12.275079","172.19.0.3","5.9.29.183","TCP","56","43520 → 9002 [ACK] Seq=28063 Ack=492126 Win=8458 Len=0"
"12.275082","5.9.29.183","172.19.0.3","TLSv1.2","1516","Application Data [TCP segment of a reassembled PDU]"
"12.275084","5.9.29.183","172.19.0.3","TCP","100","9002 → 43520 [PSH, ACK] Seq=493586 Ack=28063 Win=65535 Len=44 [TCP segment of a reassembled PDU]"
"12.275086","5.9.29.183","172.19.0.3","TCP","1516","9002 → 43520 [PSH, ACK] Seq=493630 Ack=28063 Win=65535 Len=1460 [TCP segment of a reassembled PDU]"
"12.275091","5.9.29.183","172.19.0.3","TCP","1516","9002 → 43520 [PSH, ACK] Seq=495090 Ack=28063 Win=65535 Len=1460 [TCP segment of a reassembled PDU]"
"12.275093","5.9.29.183","172.19.0.3","TLSv1.2","1516","Application Data [TCP segment of a reassembled PDU]"
"12.275095","5.9.29.183","172.19.0.3","TCP","1516","9002 → 43520 [PSH, ACK] Seq=498010 Ack=28063 Win=65535 Len=1460 [TCP segment of a reassembled PDU]"
"12.275097","5.9.29.183","172.19.0.3","TCP","1516","9002 → 43520 [PSH, ACK] Seq=499470 Ack=28063 Win=65535 Len=1460 [TCP segment of a reassembled PDU]"
"12.275147","5.9.29.183","172.19.0.3","TLSv1.2","1097","Application Data [TCP segment of a reassembled PDU]"
"12.275150","5.9.29.183","172.19.0.3","TCP","1504","9002 → 43520 [PSH, ACK] Seq=501971 Ack=28063 Win=65535 Len=1448 [TCP segment of a reassembled PDU]"
"12.275176","172.19.0.3","5.9.29.183","TCP","56","43520 → 9002 [ACK] Seq=28063 Ack=503419 Win=8389 Len=0"
"12.275370","172.19.0.3","5.9.29.183","TLSv1.2","599","Application Data"
"12.275511","5.9.29.183","172.19.0.3","TCP","56","9002 → 43520 [ACK] Seq=503419 Ack=28606 Win=65535 Len=0"
"12.298497","5.9.29.183","172.19.0.3","TCP","1504","9002 → 43520 [PSH, ACK] Seq=503419 Ack=28606 Win=65535 Len=1448 [TCP segment of a reassembled PDU]"
"12.298543","5.9.29.183","172.19.0.3","TLSv1.2","445","Application Data"
"12.298556","172.19.0.3","5.9.29.183","TCP","56","43520 → 9002 [ACK] Seq=28606 Ack=505256 Win=8458 Len=0"
"12.319206","5.9.29.183","172.19.0.3","TCP","1516","[TCP segment of a reassembled PDU]"
"12.319260","5.9.29.183","172.19.0.3","TCP","1492","9002 → 43520 [PSH, ACK] Seq=506716 Ack=28606 Win=65535 Len=1436 [TCP segment of a reassembled PDU]"
"12.319270","172.19.0.3","5.9.29.183","TCP","56","43520 → 9002 [ACK] Seq=28606 Ack=508152 Win=8458 Len=0"
"12.319272","5.9.29.183","172.19.0.3","TLSv1.2","1516","Application Data [TCP segment of a reassembled PDU]"
"12.319275","5.9.29.183","172.19.0.3","TCP","1516","9002 → 43520 [PSH, ACK] Seq=509612 Ack=28606 Win=65535 Len=1460 [TCP segment of a reassembled PDU]"
"12.319327","5.9.29.183","172.19.0.3","TCP","1213","9002 → 43520 [PSH, ACK] Seq=511072 Ack=28606 Win=65535 Len=1157 [TCP segment of a reassembled PDU]"
"12.319330","5.9.29.183","172.19.0.3","TLSv1.2","1516","Application Data [TCP segment of a reassembled PDU]"
"12.319332","5.9.29.183","172.19.0.3","TCP","1492","9002 → 43520 [PSH, ACK] Seq=513689 Ack=28606 Win=65535 Len=1436 [TCP segment of a reassembled PDU]"
"12.319349","172.19.0.3","5.9.29.183","TCP","56","43520 → 9002 [ACK] Seq=28606 Ack=515125 Win=8418 Len=0"
"12.319391","5.9.29.183","172.19.0.3","TCP","1504","9002 → 43520 [PSH, ACK] Seq=515125 Ack=28606 Win=65535 Len=1448 [TCP segment of a reassembled PDU]"
"12.319646","172.19.0.3","5.9.29.183","TLSv1.2","599","Application Data"
"12.319952","5.9.29.183","172.19.0.3","TCP","56","9002 → 43520 [ACK] Seq=516573 Ack=29149 Win=65535 Len=0"
"12.333851","5.9.29.183","172.19.0.3","TLSv1.2","1504","Application Data [TCP segment of a reassembled PDU]"
"12.333941","5.9.29.183","172.19.0.3","TCP","1516","9002 → 43520 [PSH, ACK] Seq=518021 Ack=29149 Win=65535 Len=1460 [TCP segment of a reassembled PDU]"
"12.333953","172.19.0.3","5.9.29.183","TCP","56","43520 → 9002 [ACK] Seq=29149 Ack=519481 Win=8458 Len=0"
"12.333956","5.9.29.183","172.19.0.3","TCP","1492","9002 → 43520 [PSH, ACK] Seq=519481 Ack=29149 Win=65535 Len=1436 [TCP segment of a reassembled PDU]"
"12.334006","5.9.29.183","172.19.0.3","TLSv1.2","1504","Application Data [TCP segment of a reassembled PDU]"
"12.334010","5.9.29.183","172.19.0.3","TCP","1504","9002 → 43520 [PSH, ACK] Seq=522365 Ack=29149 Win=65535 Len=1448 [TCP segment of a reassembled PDU]"
"12.334170","172.19.0.3","5.9.29.183","TCP","56","43520 → 9002 [ACK] Seq=29149 Ack=523813 Win=8432 Len=0"
"12.334344","5.9.29.183","172.19.0.3","TCP","1504","9002 → 43520 [PSH, ACK] Seq=523813 Ack=29149 Win=65535 Len=1448 [TCP segment of a reassembled PDU]"
"12.334540","5.9.29.183","172.19.0.3","TLSv1.2","1516","Application Data [TCP segment of a reassembled PDU]"
"12.334546","172.19.0.3","5.9.29.183","TCP","56","43520 → 9002 [ACK] Seq=29149 Ack=526721 Win=8466 Len=0"
"12.334570","5.9.29.183","172.19.0.3","TLSv1.2","353","Application Data"
"12.338363","5.9.29.183","172.19.0.3","TCP","1504","[TCP segment of a reassembled PDU]"
"12.338378","172.19.0.3","5.9.29.183","TCP","56","43520 → 9002 [ACK] Seq=29149 Ack=528466 Win=8466 Len=0"
"12.349776","5.9.29.183","172.19.0.3","TLSv1.2","179","Application Data"
"12.376582","5.9.29.183","172.19.0.3","TCP","1516","[TCP segment of a reassembled PDU]"
"12.376600","172.19.0.3","5.9.29.183","TCP","56","43520 → 9002 [ACK] Seq=29149 Ack=530049 Win=8466 Len=0"
"12.376692","5.9.29.183","172.19.0.3","TCP","1516","9002 → 43520 [PSH, ACK] Seq=530049 Ack=29149 Win=65535 Len=1460 [TCP segment of a reassembled PDU]"
"12.376729","5.9.29.183","172.19.0.3","TLSv1.2","1213","Application Data"
"12.376736","5.9.29.183","172.19.0.3","TCP","1516","[TCP segment of a reassembled PDU]"
"12.376740","5.9.29.183","172.19.0.3","TCP","1516","9002 → 43520 [PSH, ACK] Seq=534126 Ack=29149 Win=65535 Len=1460 [TCP segment of a reassembled PDU]"
"12.376838","5.9.29.183","172.19.0.3","TLSv1.2","1516","Application Data [TCP segment of a reassembled PDU]"
"12.376844","5.9.29.183","172.19.0.3","TCP","1516","9002 → 43520 [PSH, ACK] Seq=537046 Ack=29149 Win=65535 Len=1460 [TCP segment of a reassembled PDU]"
"12.376847","5.9.29.183","172.19.0.3","TCP","1456","9002 → 43520 [PSH, ACK] Seq=538506 Ack=29149 Win=65535 Len=1400 [TCP segment of a reassembled PDU]"
"12.376849","5.9.29.183","172.19.0.3","TLSv1.2","1516","Application Data [TCP segment of a reassembled PDU]"
"12.376851","5.9.29.183","172.19.0.3","TCP","1492","9002 → 43520 [PSH, ACK] Seq=541366 Ack=29149 Win=65535 Len=1436 [TCP segment of a reassembled PDU]"
"12.376879","172.19.0.3","5.9.29.183","TCP","56","43520 → 9002 [ACK] Seq=29149 Ack=542802 Win=8393 Len=0"
"12.377616","172.19.0.3","5.9.29.183","TLSv1.2","599","Application Data"
"12.377800","5.9.29.183","172.19.0.3","TCP","56","9002 → 43520 [ACK] Seq=542802 Ack=29692 Win=65535 Len=0"
"12.399545","5.9.29.183","172.19.0.3","TLSv1.2","1379","Application Data"
"12.399934","172.19.0.3","5.9.29.183","TLSv1.2","599","Application Data"
"12.400172","5.9.29.183","172.19.0.3","TCP","56","9002 → 43520 [ACK] Seq=544125 Ack=30235 Win=65535 Len=0"
"12.410959","5.9.29.183","172.19.0.3","TCP","1516","[TCP segment of a reassembled PDU]"
"12.411008","5.9.29.183","172.19.0.3","TCP","1516","9002 → 43520 [PSH, ACK] Seq=545585 Ack=30235 Win=65535 Len=1460 [TCP segment of a reassembled PDU]"
"12.411017","5.9.29.183","172.19.0.3","TLSv1.2","1516","Application Data [TCP segment of a reassembled PDU]"
"12.411022","5.9.29.183","172.19.0.3","TCP","1516","9002 → 43520 [PSH, ACK] Seq=548505 Ack=30235 Win=65535 Len=1460 [TCP segment of a reassembled PDU]"
"12.411027","5.9.29.183","172.19.0.3","TCP","1456","9002 → 43520 [PSH, ACK] Seq=549965 Ack=30235 Win=65535 Len=1400 [TCP segment of a reassembled PDU]"
"12.411190","172.19.0.3","5.9.29.183","TCP","56","43520 → 9002 [ACK] Seq=30235 Ack=551365 Win=8432 Len=0"
"12.411354","5.9.29.183","172.19.0.3","TLSv1.2","1516","Application Data [TCP segment of a reassembled PDU]"
"12.411360","5.9.29.183","172.19.0.3","TCP","1516","9002 → 43520 [PSH, ACK] Seq=552825 Ack=30235 Win=65535 Len=1460 [TCP segment of a reassembled PDU]"
"12.411362","5.9.29.183","172.19.0.3","TCP","1480","9002 → 43520 [PSH, ACK] Seq=554285 Ack=30235 Win=65535 Len=1424 [TCP segment of a reassembled PDU]"
"12.411426","172.19.0.3","5.9.29.183","TCP","56","43520 → 9002 [ACK] Seq=30235 Ack=555709 Win=8408 Len=0"
"12.429231","5.9.29.183","172.19.0.3","TLSv1.2","1438","Application Data, Application Data"
"12.457083","5.9.29.183","172.19.0.3","TLSv1.2","1113","Application Data"
"12.457100","172.19.0.3","5.9.29.183","TCP","56","43520 → 9002 [ACK] Seq=30235 Ack=558148 Win=8466 Len=0"
"12.520258","5.9.29.183","172.19.0.3","TCP","1074","[TCP segment of a reassembled PDU]"
"12.520273","5.9.29.183","172.19.0.3","TLSv1.2","95","Application Data"
"12.520382","172.19.0.3","5.9.29.183","TCP","56","43520 → 9002 [ACK] Seq=30235 Ack=559205 Win=8466 Len=0"
