_ws.col.Time,_ws.col.Source,_ws.col.Destination,_ws.col.Protocol,_ws.col.Length,_ws.col.Info
"0.000000","172.19.0.3","5.9.29.183","TLSv1.2","599","Application Data"
"0.000300","5.9.29.183","172.19.0.3","TCP","56","9002 → 43520 [ACK] Seq=1 Ack=544 Win=65535 Len=0"
"0.294209","5.9.29.183","172.19.0.3","TLSv1.2","599","Application Data"
"0.294246","172.19.0.3","5.9.29.183","TCP","56","43520 → 9002 [ACK] Seq=544 Ack=544 Win=11909 Len=0"
"0.295319","172.19.0.3","5.9.29.183","TLSv1.2","2141","Application Data"
"0.295597","5.9.29.183","172.19.0.3","TCP","56","9002 → 43520 [ACK] Seq=544 Ack=2004 Win=65535 Len=0"
"0.295680","5.9.29.183","172.19.0.3","TCP","56","9002 → 43520 [ACK] Seq=544 Ack=2629 Win=65535 Len=0"
"0.829881","5.9.29.183","172.19.0.3","TLSv1.2","599","Application Data"
"0.875270","172.19.0.3","5.9.29.183","TCP","56","43520 → 9002 [ACK] Seq=2629 Ack=1087 Win=11911 Len=0"
"0.901096","5.9.29.183","172.19.0.3","TLSv1.2","1113","Application Data"
"0.901121","172.19.0.3","5.9.29.183","TCP","56","43520 → 9002 [ACK] Seq=2629 Ack=2144 Win=11911 Len=0"
"0.905504","172.19.0.3","5.9.29.183","TLSv1.2","599","Application Data"
"0.905781","5.9.29.183","172.19.0.3","TCP","56","9002 → 43520 [ACK] Seq=2144 Ack=3172 Win=65535 Len=0"
"1.192765","5.9.29.183","172.19.0.3","TLSv1.2","599","Application Data"
"1.193498","172.19.0.3","5.9.29.183","TLSv1.2","599","Application Data"
"1.193798","5.9.29.183","172.19.0.3","TCP","56","9002 → 43520 [ACK] Seq=2687 Ack=3715 Win=65535 Len=0"
"1.536801","5.9.29.183","172.19.0.3","TCP","1516","[TCP segment of a reassembled PDU]"
"1.536836","5.9.29.183","172.19.0.3","TCP","1516","9002 → 43520 [PSH, ACK] Seq=4147 Ack=3715 Win=65535 Len=1460 [TCP segment of a reassembled PDU]"
"1.536846","5.9.29.183","172.19.0.3","TLSv1.2","763","Application Data"
"1.536984","172.19.0.3","5.9.29.183","TCP","56","43520 → 9002 [ACK] Seq=3715 Ack=6314 Win=11893 Len=0"
"1.559132","5.9.29.183","172.19.0.3","TLSv1.2","599","Application Data"
"1.572497","5.9.29.183","172.19.0.3","TCP","1504","[TCP segment of a reassembled PDU]"
"1.572527","172.19.0.3","5.9.29.183","TCP","56","43520 → 9002 [ACK] Seq=3715 Ack=8305 Win=11911 Len=0"
"1.572723","5.9.29.183","172.19.0.3","TCP","1504","9002 → 43520 [PSH, ACK] Seq=8305 Ack=3715 Win=65535 Len=1448 [TCP segment of a reassembled PDU]"
"1.575115","5.9.29.183","172.19.0.3","TLSv1.2","273","Application Data"
"1.575139","172.19.0.3","5.9.29.183","TCP","56","43520 → 9002 [ACK] Seq=3715 Ack=9970 Win=11911 Len=0"
"1.575641","172.19.0.3","5.9.29.183","TLSv1.2","599","Application Data"
"1.575900","5.9.29.183","172.19.0.3","TCP","56","9002 → 43520 [ACK] Seq=9970 Ack=4258 Win=65535 Len=0"
"1.585961","172.19.0.3","5.9.29.183","TLSv1.2","599","Application Data"
"1.586291","5.9.29.183","172.19.0.3","TCP","56","9002 → 43520 [ACK] Seq=9970 Ack=4801 Win=65535 Len=0"
"1.927314","5.9.29.183","172.19.0.3","TLSv1.2","599","Application Data"
"1.927806","172.19.0.3","5.9.29.183","TLSv1.2","599","Application Data"
"1.928093","5.9.29.183","172.19.0.3","TCP","56","9002 → 43520 [ACK] Seq=10513 Ack=5344 Win=65535 Len=0"
"2.259934","5.9.29.183","172.19.0.3","TCP","1516","[TCP segment of a reassembled PDU]"
"2.259959","5.9.29.183","172.19.0.3","TCP","1516","9002 → 43520 [PSH, ACK] Seq=11973 Ack=5344 Win=65535 Len=1460 [TCP segment of a reassembled PDU]"
"2.259965","5.9.29.183","172.19.0.3","TLSv1.2","763","Application Data"
"2.260113","172.19.0.3","5.9.29.183","TCP","56","43520 → 9002 [ACK] Seq=5344 Ack=14140 Win=11895 Len=0"
"2.296810","5.9.29.183","172.19.0.3","TCP","1516","[TCP segment of a reassembled PDU]"
"2.296891","5.9.29.183","172.19.0.3","TCP","1013","9002 → 43520 [PSH, ACK] Seq=15600 Ack=5344 Win=65535 Len=957 [TCP segment of a reassembled PDU]"
"2.296908","172.19.0.3","5.9.29.183","TCP","56","43520 → 9002 [ACK] Seq=5344 Ack=16557 Win=11901 Len=0"
"2.296912","5.9.29.183","172.19.0.3","TCP","1516","9002 → 43520 [PSH, ACK] Seq=16557 Ack=5344 Win=65535 Len=1460 [TCP segment of a reassembled PDU]"
"2.297039","5.9.29.183","172.19.0.3","TLSv1.2","256","Application Data"
"2.297120","172.19.0.3","5.9.29.183","TCP","56","43520 → 9002 [ACK] Seq=5344 Ack=18217 Win=11889 Len=0"
"2.312424","5.9.29.183","172.19.0.3","TLSv1.2","663","Application Data"
"2.316188","172.19.0.3","5.9.29.183","TLSv1.2","599","Application Data"
"2.316474","5.9.29.183","172.19.0.3","TCP","56","9002 → 43520 [ACK] Seq=18824 Ack=5887 Win=65535 Len=0"
"2.595884","5.9.29.183","172.19.0.3","TLSv1.2","599","Application Data"
"2.596694","172.19.0.3","5.9.29.183","TLSv1.2","599","Application Data"
"2.597128","5.9.29.183","172.19.0.3","TCP","56","9002 → 43520 [ACK] Seq=19367 Ack=6430 Win=65535 Len=0"
"2.907852","5.9.29.183","172.19.0.3","TCP","1516","[TCP segment of a reassembled PDU]"
"2.907882","5.9.29.183","172.19.0.3","TCP","1516","9002 → 43520 [PSH, ACK] Seq=20827 Ack=6430 Win=65535 Len=1460 [TCP segment of a reassembled PDU]"
"2.907889","5.9.29.183","172.19.0.3","TLSv1.2","763","Application Data"
"2.908101","172.19.0.3","5.9.29.183","TCP","56","43520 → 9002 [ACK] Seq=6430 Ack=22994 Win=11893 Len=0"
"2.922587","5.9.29.183","172.19.0.3","TCP","1516","[TCP segment of a reassembled PDU]"
"2.922618","5.9.29.183","172.19.0.3","TCP","1492","9002 → 43520 [PSH, ACK] Seq=24454 Ack=6430 Win=65535 Len=1436 [TCP segment of a reassembled PDU]"
"2.922632","172.19.0.3","5.9.29.183","TCP","56","43520 → 9002 [ACK] Seq=6430 Ack=25890 Win=11903 Len=0"
"2.923464","5.9.29.183","172.19.0.3","TLSv1.2","787","Application Data"
"2.944532","5.9.29.183","172.19.0.3","TCP","1516","[TCP segment of a reassembled PDU]"
"2.944555","172.19.0.3","5.9.29.183","TCP","56","43520 → 9002 [ACK] Seq=6430 Ack=28081 Win=11911 Len=0"
"2.944570","5.9.29.183","172.19.0.3","TCP","1516","9002 → 43520 [PSH, ACK] Seq=28081 Ack=6430 Win=65535 Len=1460 [TCP segment of a reassembled PDU]"
"2.944577","5.9.29.183","172.19.0.3","TLSv1.2","1213","Application Data"
"2.944580","5.9.29.183","172.19.0.3","TCP","1516","[TCP segment of a reassembled PDU]"
"2.944587","5.9.29.183","172.19.0.3","TCP","1516","9002 → 43520 [PSH, ACK] Seq=32158 Ack=6430 Win=65535 Len=1460 [TCP segment of a reassembled PDU]"
"2.944590","5.9.29.183","172.19.0.3","TLSv1.2","1516","Application Data [TCP segment of a reassembled PDU]"
"2.944723","5.9.29.183","172.19.0.3","TCP","1516","9002 → 43520 [PSH, ACK] Seq=35078 Ack=6430 Win=65535 Len=1460 [TCP segment of a reassembled PDU]"
"2.944732","5.9.29.183","172.19.0.3","TCP","1456","9002 → 43520 [PSH, ACK] Seq=36538 Ack=6430 Win=65535 Len=1400 [TCP segment of a reassembled PDU]"
"2.944812","172.19.0.3","5.9.29.183","TCP","56","43520 → 9002 [ACK] Seq=6430 Ack=37938 Win=11855 Len=0"
"2.958358","5.9.29.183","172.19.0.3","TLSv1.2","1516","Application Data [TCP segment of a reassembled PDU]"
"2.958391","5.9.29.183","172.19.0.3","TCP","1492","9002 → 43520 [PSH, ACK] Seq=39398 Ack=6430 Win=65535 Len=1436 [TCP segment of a reassembled PDU]"
"2.958408","172.19.0.3","5.9.29.183","TCP","56","43520 → 9002 [ACK] Seq=6430 Ack=40834 Win=11903 Len=0"
"2.959684","5.9.29.183","172.19.0.3","TCP","1516","9002 → 43520 [PSH, ACK] Seq=40834 Ack=6430 Win=65535 Len=1460 [TCP segment of a reassembled PDU]"
"2.959700","5.9.29.183","172.19.0.3","TLSv1.2","1492","Application Data [TCP segment of a reassembled PDU]"
"2.959709","172.19.0.3","5.9.29.183","TCP","56","43520 → 9002 [ACK] Seq=6430 Ack=43730 Win=11903 Len=0"
"2.959711","5.9.29.183","172.19.0.3","TCP","1516","9002 → 43520 [PSH, ACK] Seq=43730 Ack=6430 Win=65535 Len=1460 [TCP segment of a reassembled PDU]"
"2.959714","5.9.29.183","172.19.0.3","TCP","1492","9002 → 43520 [PSH, ACK] Seq=45190 Ack=6430 Win=65535 Len=1436 [TCP segment of a reassembled PDU]"
"2.959822","172.19.0.3","5.9.29.183","TCP","56","43520 → 9002 [ACK] Seq=6430 Ack=46626 Win=11887 Len=0"
"2.960128","5.9.29.183","172.19.0.3","TLSv1.2","271","Application Data, Application Data"
"2.960326","172.19.0.3","5.9.29.183","TLSv1.2","599","Application Data"
"2.960512","5.9.29.183","172.19.0.3","TCP","56","9002 → 43520 [ACK] Seq=46841 Ack=6973 Win=65535 Len=0"
"2.982496","5.9.29.183","172.19.0.3","TCP","1516","[TCP segment of a reassembled PDU]"
"2.982526","5.9.29.183","172.19.0.3","TCP","1516","9002 → 43520 [PSH, ACK] Seq=48301 Ack=6973 Win=65535 Len=1460 [TCP segment of a reassembled PDU]"
"2.982532","5.9.29.183","172.19.0.3","TLSv1.2","1516","Application Data [TCP segment of a reassembled PDU]"
"2.982535","5.9.29.183","172.19.0.3","TCP","1201","9002 → 43520 [PSH, ACK] Seq=51221 Ack=6973 Win=65535 Len=1145 [TCP segment of a reassembled PDU]"
"2.982538","5.9.29.183","172.19.0.3","TCP","1516","9002 → 43520 [PSH, ACK] Seq=52366 Ack=6973 Win=65535 Len=1460 [TCP segment of a reassembled PDU]"
"2.982622","5.9.29.183","172.19.0.3","TLSv1.2","1516","Application Data [TCP segment of a reassembled PDU]"
"2.982631","5.9.29.183","172.19.0.3","TCP","1516","9002 → 43520 [PSH, ACK] Seq=55286 Ack=6973 Win=65535 Len=1460 [TCP segment of a reassembled PDU]"
"2.982635","5.9.29.183","172.19.0.3","TCP","1468","9002 → 43520 [PSH, ACK] Seq=56746 Ack=6973 Win=65535 Len=1412 [TCP segment of a reassembled PDU]"
"2.982720","172.19.0.3","5.9.29.183","TCP","56","43520 → 9002 [ACK] Seq=6973 Ack=58158 Win=11853 Len=0"
"2.995464","5.9.29.183","172.19.0.3","TLSv1.2","1516","Application Data [TCP segment of a reassembled PDU]"
"2.995493","5.9.29.183","172.19.0.3","TCP","1516","9002 → 43520 [PSH, ACK] Seq=59618 Ack=6973 Win=65535 Len=1460 [TCP segment of a reassembled PDU]"
"2.995510","172.19.0.3","5.9.29.183","TCP","56","43520 → 9002 [ACK] Seq=6973 Ack=61078 Win=11903 Len=0"
"2.995513","5.9.29.183","172.19.0.3","TLSv1.2","1516","Application Data [TCP segment of a reassembled PDU]"
"2.995516","5.9.29.183","172.19.0.3","TCP","1516","9002 → 43520 [PSH, ACK] Seq=62538 Ack=6973 Win=65535 Len=1460 [TCP segment of a reassembled PDU]"
"2.995520","5.9.29.183","172.19.0.3","TCP","1456","9002 → 43520 [PSH, ACK] Seq=63998 Ack=6973 Win=65535 Len=1400 [TCP segment of a reassembled PDU]"
"2.995706","172.19.0.3","5.9.29.183","TCP","56","43520 → 9002 [ACK] Seq=6973 Ack=65398 Win=11879 Len=0"
"2.996250","172.19.0.3","5.9.29.183","TLSv1.2","599","Application Data"
"2.996524","5.9.29.183","172.19.0.3","TCP","56","9002 → 43520 [ACK] Seq=65398 Ack=7516 Win=65535 Len=0"
"2.997356","5.9.29.183","172.19.0.3","TLSv1.2","662","Application Data"
"3.007737","5.9.29.183","172.19.0.3","TCP","1504","[TCP segment of a reassembled PDU]"
"3.007756","172.19.0.3","5.9.29.183","TCP","56","43520 → 9002 [ACK] Seq=7516 Ack=67452 Win=11911 Len=0"
"3.012573","5.9.29.183","172.19.0.3","TLSv1.2","179","Application Data"
"3.016459","172.19.0.3","5.9.29.183","TLSv1.2","599","Application Data"
"3.016752","5.9.29.183","172.19.0.3","TCP","56","9002 → 43520 [ACK] Seq=67575 Ack=8059 Win=65535 Len=0"
"3.320852","5.9.29.183","172.19.0.3","TLSv1.2","599","Application Data"
"3.321520","172.19.0.3","5.9.29.183","TLSv1.2","599","Application Data"
"3.321833","5.9.29.183","172.19.0.3","TCP","56","9002 → 43520 [ACK] Seq=68118 Ack=8602 Win=65535 Len=0"
"3.631157","5.9.29.183","172.19.0.3","TCP","1504","[TCP segment of a reassembled PDU]"
"3.631414","5.9.29.183","172.19.0.3","TCP","1516","9002 → 43520 [PSH, ACK] Seq=69566 Ack=8602 Win=65535 Len=1460 [TCP segment of a reassembled PDU]"
"3.631432","172.19.0.3","5.9.29.183","TCP","56","43520 → 9002 [ACK] Seq=8602 Ack=71026 Win=11911 Len=0"
"3.631435","5.9.29.183","172.19.0.3","TLSv1.2","775","Application Data"
"3.641805","5.9.29.183","172.19.0.3","TCP","1516","[TCP segment of a reassembled PDU]"
"3.641826","5.9.29.183","172.19.0.3","TCP","1492","9002 → 43520 [PSH, ACK] Seq=73205 Ack=8602 Win=65535 Len=1436 [TCP segment of a reassembled PDU]"
"3.641943","172.19.0.3","5.9.29.183","TCP","56","43520 → 9002 [ACK] Seq=8602 Ack=74641 Win=11901 Len=0"
"3.647139","5.9.29.183","172.19.0.3","TLSv1.2","787","Application Data"
"3.663558","5.9.29.183","172.19.0.3","TCP","1516","[TCP segment of a reassembled PDU]"
"3.663581","172.19.0.3","5.9.29.183","TCP","56","43520 → 9002 [ACK] Seq=8602 Ack=76832 Win=11911 Len=0"
"3.663595","5.9.29.183","172.19.0.3","TCP","1516","9002 → 43520 [PSH, ACK] Seq=76832 Ack=8602 Win=65535 Len=1460 [TCP segment of a reassembled PDU]"
"3.663602","5.9.29.183","172.19.0.3","TLSv1.2","1213","Application Data"
"3.663606","5.9.29.183","172.19.0.3","TCP","1516","[TCP segment of a reassembled PDU]"
"3.663612","5.9.29.183","172.19.0.3","TCP","1240","9002 → 43520 [PSH, ACK] Seq=80909 Ack=8602 Win=65535 Len=1184 [TCP segment of a reassembled PDU]"
"3.663730","5.9.29.183","172.19.0.3","TCP","308","9002 → 43520 [PSH, ACK] Seq=82093 Ack=8602 Win=65535 Len=252 [TCP segment of a reassembled PDU]"
"3.663812","172.19.0.3","5.9.29.183","TCP","56","43520 → 9002 [ACK] Seq=8602 Ack=82345 Win=11871 Len=0"
"3.677925","5.9.29.183","172.19.0.3","TLSv1.2","1504","Application Data [TCP segment of a reassembled PDU]"
"3.678022","5.9.29.183","172.19.0.3","TCP","1516","9002 → 43520 [PSH, ACK] Seq=83793 Ack=8602 Win=65535 Len=1460 [TCP segment of a reassembled PDU]"
"3.678059","172.19.0.3","5.9.29.183","TCP","56","43520 → 9002 [ACK] Seq=8602 Ack=85253 Win=11903 Len=0"
"3.678064","5.9.29.183","172.19.0.3","TCP","1516","9002 → 43520 [PSH, ACK] Seq=85253 Ack=8602 Win=65535 Len=1460 [TCP segment of a reassembled PDU]"
"3.678070","5.9.29.183","172.19.0.3","TLSv1.2","1480","Application Data [TCP segment of a reassembled PDU]"
"3.678255","5.9.29.183","172.19.0.3","TCP","1504","9002 → 43520 [PSH, ACK] Seq=88137 Ack=8602 Win=65535 Len=1448 [TCP segment of a reassembled PDU]"
"3.678266","5.9.29.183","172.19.0.3","TCP","1504","9002 → 43520 [PSH, ACK] Seq=89585 Ack=8602 Win=65535 Len=1448 [TCP segment of a reassembled PDU]"
"3.678341","172.19.0.3","5.9.29.183","TCP","56","43520 → 9002 [ACK] Seq=8602 Ack=91033 Win=11871 Len=0"
"3.678594","5.9.29.183","172.19.0.3","TLSv1.2","1516","Application Data [TCP segment of a reassembled PDU]"
"3.678603","5.9.29.183","172.19.0.3","TCP","1516","9002 → 43520 [PSH, ACK] Seq=92493 Ack=8602 Win=65535 Len=1460 [TCP segment of a reassembled PDU]"
"3.678665","5.9.29.183","172.19.0.3","TLSv1.2","1480","Application Data [TCP segment of a reassembled PDU]"
"3.678670","5.9.29.183","172.19.0.3","TLSv1.2","271","Application Data"
"3.678730","172.19.0.3","5.9.29.183","TCP","56","43520 → 9002 [ACK] Seq=8602 Ack=95592 Win=11838 Len=0"
"3.679174","172.19.0.3","5.9.29.183","TLSv1.2","599","Application Data"
"3.679390","5.9.29.183","172.19.0.3","TCP","56","9002 → 43520 [ACK] Seq=95592 Ack=9145 Win=65535 Len=0"
"3.706831","5.9.29.183","172.19.0.3","TCP","1504","[TCP segment of a reassembled PDU]"
"3.706902","5.9.29.183","172.19.0.3","TCP","1516","9002 → 43520 [PSH, ACK] Seq=97040 Ack=9145 Win=65535 Len=1460 [TCP segment of a reassembled PDU]"
"3.706921","172.19.0.3","5.9.29.183","TCP","56","43520 → 9002 [ACK] Seq=9145 Ack=98500 Win=11901 Len=0"
"3.707099","5.9.29.183","172.19.0.3","TLSv1.2","1225","Application Data"
"3.707109","5.9.29.183","172.19.0.3","TCP","1516","[TCP segment of a reassembled PDU]"
"3.707112","5.9.29.183","172.19.0.3","TCP","1516","9002 → 43520 [PSH, ACK] Seq=101129 Ack=9145 Win=65535 Len=1460 [TCP segment of a reassembled PDU]"
"3.707114","5.9.29.183","172.19.0.3","TLSv1.2","1516","Application Data [TCP segment of a reassembled PDU]"
"3.707117","5.9.29.183","172.19.0.3","TCP","1516","9002 → 43520 [PSH, ACK] Seq=104049 Ack=9145 Win=65535 Len=1460 [TCP segment of a reassembled PDU]"
"3.707119","5.9.29.183","172.19.0.3","TCP","1456","9002 → 43520 [PSH, ACK] Seq=105509 Ack=9145 Win=65535 Len=1400 [TCP segment of a reassembled PDU]"
"3.707238","172.19.0.3","5.9.29.183","TCP","56","43520 → 9002 [ACK] Seq=9145 Ack=106909 Win=11853 Len=0"
"3.719057","5.9.29.183","172.19.0.3","TLSv1.2","1516","Application Data [TCP segment of a reassembled PDU]"
"3.719077","5.9.29.183","172.19.0.3","TCP","1516","9002 → 43520 [PSH, ACK] Seq=108369 Ack=9145 Win=65535 Len=1460 [TCP segment of a reassembled PDU]"
"3.719087","172.19.0.3","5.9.29.183","TCP","56","43520 → 9002 [ACK] Seq=9145 Ack=109829 Win=11903 Len=0"
"3.719089","5.9.29.183","172.19.0.3","TCP","1516","9002 → 43520 [PSH, ACK] Seq=109829 Ack=9145 Win=65535 Len=1460 [TCP segment of a reassembled PDU]"
"3.719091","5.9.29.183","172.19.0.3","TLSv1.2","1516","Application Data [TCP segment of a reassembled PDU]"
"3.719093","5.9.29.183","172.19.0.3","TCP","1516","9002 → 43520 [PSH, ACK] Seq=112749 Ack=9145 Win=65535 Len=1460 [TCP segment of a reassembled PDU]"
"3.719095","5.9.29.183","172.19.0.3","TCP","1444","9002 → 43520 [PSH, ACK] Seq=114209 Ack=9145 Win=65535 Len=1388 [TCP segment of a reassembled PDU]"
"3.719171","5.9.29.183","172.19.0.3","TLSv1.2","1516","Application Data [TCP segment of a reassembled PDU]"
"3.719176","5.9.29.183","172.19.0.3","TCP","1492","9002 → 43520 [PSH, ACK] Seq=117057 Ack=9145 Win=65535 Len=1436 [TCP segment of a reassembled PDU]"
"3.719229","172.19.0.3","5.9.29.183","TCP","56","43520 → 9002 [ACK] Seq=9145 Ack=118493 Win=11855 Len=0"
"3.719599","172.19.0.3","5.9.29.183","TLSv1.2","599","Application Data"
"3.719750","5.9.29.183","172.19.0.3","TCP","56","9002 → 43520 [ACK] Seq=118493 Ack=9688 Win=65535 Len=0"
"3.721896","5.9.29.183","172.19.0.3","TLSv1.2","459","Application Data"
"3.734171","5.9.29.183","172.19.0.3","TCP","1504","[TCP segment of a reassembled PDU]"
"3.734188","172.19.0.3","5.9.29.183","TCP","56","43520 → 9002 [ACK] Seq=9688 Ack=120344 Win=11911 Len=0"
"3.734200","5.9.29.183","172.19.0.3","TCP","1504","9002 → 43520 [PSH, ACK] Seq=120344 Ack=9688 Win=65535 Len=1448 [TCP segment of a reassembled PDU]"
"3.737080","5.9.29.183","172.19.0.3","TLSv1.2","1330","Application Data, Application Data"
"3.737088","172.19.0.3","5.9.29.183","TCP","56","43520 → 9002 [ACK] Seq=9688 Ack=123066 Win=11911 Len=0"
"3.737296","172.19.0.3","5.9.29.183","TLSv1.2","599","Application Data"
"3.737525","5.9.29.183","172.19.0.3","TCP","56","9002 → 43520 [ACK] Seq=123066 Ack=10231 Win=65535 Len=0"
"3.746162","5.9.29.183","172.19.0.3","TCP","1504","[TCP segment of a reassembled PDU]"
"3.746201","5.9.29.183","172.19.0.3","TCP","1504","9002 → 43520 [PSH, ACK] Seq=124514 Ack=10231 Win=65535 Len=1448 [TCP segment of a reassembled PDU]"
"3.746206","5.9.29.183","172.19.0.3","TLSv1.2","1504","Application Data [TCP segment of a reassembled PDU]"
"3.746277","5.9.29.183","172.19.0.3","TCP","1516","9002 → 43520 [PSH, ACK] Seq=127410 Ack=10231 Win=65535 Len=1460 [TCP segment of a reassembled PDU]"
"3.746289","5.9.29.183","172.19.0.3","TCP","1492","9002 → 43520 [PSH, ACK] Seq=128870 Ack=10231 Win=65535 Len=1436 [TCP segment of a reassembled PDU]"
"3.746293","5.9.29.183","172.19.0.3","TLSv1.2","1504","Application Data [TCP segment of a reassembled PDU]"
"3.746361","5.9.29.183","172.19.0.3","TCP","1504","9002 → 43520 [PSH, ACK] Seq=131754 Ack=10231 Win=65535 Len=1448 [TCP segment of a reassembled PDU]"
"3.746441","172.19.0.3","5.9.29.183","TCP","56","43520 → 9002 [ACK] Seq=10231 Ack=133202 Win=11861 Len=0"
"3.752557","5.9.29.183","172.19.0.3","TLSv1.2","287","Application Data"
"3.759786","5.9.29.183","172.19.0.3","TCP","1504","[TCP segment of a reassembled PDU]"
"3.759803","172.19.0.3","5.9.29.183","TCP","56","43520 → 9002 [ACK] Seq=10231 Ack=134881 Win=11911 Len=0"
"3.759815","5.9.29.183","172.19.0.3","TCP","1516","9002 → 43520 [PSH, ACK] Seq=134881 Ack=10231 Win=65535 Len=1460 [TCP segment of a reassembled PDU]"
"3.759820","5.9.29.183","172.19.0.3","TLSv1.2","1516","Application Data [TCP segment of a reassembled PDU]"
"3.759822","5.9.29.183","172.19.0.3","TCP","1516","9002 → 43520 [PSH, ACK] Seq=137801 Ack=10231 Win=65535 Len=1460 [TCP segment of a reassembled PDU]"
"3.759824","5.9.29.183","172.19.0.3","TCP","1468","9002 → 43520 [PSH, ACK] Seq=139261 Ack=10231 Win=65535 Len=1412 [TCP segment of a reassembled PDU]"
"3.759825","5.9.29.183","172.19.0.3","TLSv1.2","1504","Application Data [TCP segment of a reassembled PDU]"
"3.759939","172.19.0.3","5.9.29.183","TCP","56","43520 → 9002 [ACK] Seq=10231 Ack=142121 Win=11871 Len=0"
"3.767374","5.9.29.183","172.19.0.3","TLSv1.2","707","Application Data"
"3.771912","172.19.0.3","5.9.29.183","TLSv1.2","599","Application Data"
"3.772157","5.9.29.183","172.19.0.3","TCP","56","9002 → 43520 [ACK] Seq=142772 Ack=10774 Win=65535 Len=0"
"4.161634","5.9.29.183","172.19.0.3","TLSv1.2","599","Application Data"
"4.162278","172.19.0.3","5.9.29.183","TLSv1.2","599","Application Data"
"4.162532","5.9.29.183","172.19.0.3","TCP","56","9002 → 43520 [ACK] Seq=143315 Ack=11317 Win=65535 Len=0"
"4.460646","5.9.29.183","172.19.0.3","TLSv1.2","599","Application Data"
"4.492196","5.9.29.183","172.19.0.3","TCP","1504","[TCP segment of a reassembled PDU]"
"4.492219","172.19.0.3","5.9.29.183","TCP","56","43520 → 9002 [ACK] Seq=11317 Ack=145306 Win=11911 Len=0"
"4.492234","5.9.29.183","172.19.0.3","TCP","1516","9002 → 43520 [PSH, ACK] Seq=145306 Ack=11317 Win=65535 Len=1460 [TCP segment of a reassembled PDU]"
"4.492243","5.9.29.183","172.19.0.3","TLSv1.2","775","Application Data"
"4.492436","172.19.0.3","5.9.29.183","TCP","56","43520 → 9002 [ACK] Seq=11317 Ack=147485 Win=11895 Len=0"
"4.503404","5.9.29.183","172.19.0.3","TCP","200","[TCP segment of a reassembled PDU]"
"4.503420","5.9.29.183","172.19.0.3","TCP","1516","9002 → 43520 [PSH, ACK] Seq=147629 Ack=11317 Win=65535 Len=1460 [TCP segment of a reassembled PDU]"
"4.503428","172.19.0.3","5.9.29.183","TCP","56","43520 → 9002 [ACK] Seq=11317 Ack=149089 Win=11903 Len=0"
"4.503430","5.9.29.183","172.19.0.3","TCP","1516","9002 → 43520 [PSH, ACK] Seq=149089 Ack=11317 Win=65535 Len=1460 [TCP segment of a reassembled PDU]"
"4.503434","5.9.29.183","172.19.0.3","TLSv1.2","1516","Application Data [TCP segment of a reassembled PDU]"
"4.503439","5.9.29.183","172.19.0.3","TCP","1516","9002 → 43520 [PSH, ACK] Seq=152009 Ack=11317 Win=65535 Len=1460 [TCP segment of a reassembled PDU]"
"4.503442","5.9.29.183","172.19.0.3","TCP","1312","9002 → 43520 [PSH, ACK] Seq=153469 Ack=11317 Win=65535 Len=1256 [TCP segment of a reassembled PDU]"
"4.503630","172.19.0.3","5.9.29.183","TCP","56","43520 → 9002 [ACK] Seq=11317 Ack=154725 Win=11869 Len=0"
"4.507965","5.9.29.183","172.19.0.3","TLSv1.2","584","Application Data"
"4.519375","5.9.29.183","172.19.0.3","TCP","1516","[TCP segment of a reassembled PDU]"
"4.519398","172.19.0.3","5.9.29.183","TCP","56","43520 → 9002 [ACK] Seq=11317 Ack=156713 Win=11911 Len=0"
"4.519413","5.9.29.183","172.19.0.3","TCP","1516","9002 → 43520 [PSH, ACK] Seq=156713 Ack=11317 Win=65535 Len=1460 [TCP segment of a reassembled PDU]"
"4.519421","5.9.29.183","172.19.0.3","TLSv1.2","1516","Application Data [TCP segment of a reassembled PDU]"
"4.519425","5.9.29.183","172.19.0.3","TCP","1516","9002 → 43520 [PSH, ACK] Seq=159633 Ack=11317 Win=65535 Len=1460 [TCP segment of a reassembled PDU]"
"4.519429","5.9.29.183","172.19.0.3","TCP","1456","9002 → 43520 [PSH, ACK] Seq=161093 Ack=11317 Win=65535 Len=1400 [TCP segment of a reassembled PDU]"
"4.519628","172.19.0.3","5.9.29.183","TCP","56","43520 → 9002 [ACK] Seq=11317 Ack=162493 Win=11879 Len=0"
"4.523065","5.9.29.183","172.19.0.3","TLSv1.2","70","Application Data"
"4.533969","5.9.29.183","172.19.0.3","TCP","1504","[TCP segment of a reassembled PDU]"
"4.533991","172.19.0.3","5.9.29.183","TCP","56","43520 → 9002 [ACK] Seq=11317 Ack=163955 Win=11911 Len=0"
"4.534375","5.9.29.183","172.19.0.3","TCP","1504","9002 → 43520 [PSH, ACK] Seq=163955 Ack=11317 Win=65535 Len=1448 [TCP segment of a reassembled PDU]"
"4.534432","5.9.29.183","172.19.0.3","TLSv1.2","1516","Application Data [TCP segment of a reassembled PDU]"
"4.534520","5.9.29.183","172.19.0.3","TCP","1516","9002 → 43520 [PSH, ACK] Seq=166863 Ack=11317 Win=65535 Len=1460 [TCP segment of a reassembled PDU]"
"4.534526","5.9.29.183","172.19.0.3","TCP","1516","9002 → 43520 [PSH, ACK] Seq=168323 Ack=11317 Win=65535 Len=1460 [TCP segment of a reassembled PDU]"
"4.534530","5.9.29.183","172.19.0.3","TLSv1.2","1516","Application Data [TCP segment of a reassembled PDU]"
"4.534533","5.9.29.183","172.19.0.3","TCP","1516","9002 → 43520 [PSH, ACK] Seq=171243 Ack=11317 Win=65535 Len=1460 [TCP segment of a reassembled PDU]"
"4.534572","172.19.0.3","5.9.29.183","TCP","56","43520 → 9002 [ACK] Seq=11317 Ack=172703 Win=11871 Len=0"
"4.534707","5.9.29.183","172.19.0.3","TCP","1444","9002 → 43520 [PSH, ACK] Seq=172703 Ack=11317 Win=65535 Len=1388 [TCP segment of a reassembled PDU]"
"4.534768","5.9.29.183","172.19.0.3","TLSv1.2","1516","Application Data [TCP segment of a reassembled PDU]"
"4.534777","5.9.29.183","172.19.0.3","TCP","1516","9002 → 43520 [PSH, ACK] Seq=175551 Ack=11317 Win=65535 Len=1460 [TCP segment of a reassembled PDU]"
"4.534854","5.9.29.183","172.19.0.3","TCP","1480","9002 → 43520 [PSH, ACK] Seq=177011 Ack=11317 Win=65535 Len=1424 [TCP segment of a reassembled PDU]"
"4.534973","172.19.0.3","5.9.29.183","TCP","56","43520 → 9002 [ACK] Seq=11317 Ack=178435 Win=11838 Len=0"
"4.535368","172.19.0.3","5.9.29.183","TLSv1.2","1113","Application Data"
"4.535568","5.9.29.183","172.19.0.3","TCP","56","9002 → 43520 [ACK] Seq=178435 Ack=12374 Win=65535 Len=0"
"4.538260","5.9.29.183","172.19.0.3","TLSv1.2","721","Application Data, Application Data"
"4.564026","5.9.29.183","172.19.0.3","TCP","1516","[TCP segment of a reassembled PDU]"
"4.564118","172.19.0.3","5.9.29.183","TCP","56","43520 → 9002 [ACK] Seq=12374 Ack=180560 Win=11911 Len=0"
"4.564129","5.9.29.183","172.19.0.3","TCP","1516","9002 → 43520 [PSH, ACK] Seq=180560 Ack=12374 Win=65535 Len=1460 [TCP segment of a reassembled PDU]"
"4.564137","5.9.29.183","172.19.0.3","TLSv1.2","1516","Application Data [TCP segment of a reassembled PDU]"
"4.564140","5.9.29.183","172.19.0.3","TCP","1516","9002 → 43520 [PSH, ACK] Seq=183480 Ack=12374 Win=65535 Len=1460 [TCP segment of a reassembled PDU]"
"4.564306","5.9.29.183","172.19.0.3","TCP","1516","9002 → 43520 [PSH, ACK] Seq=184940 Ack=12374 Win=65535 Len=1460 [TCP segment of a reassembled PDU]"
"4.564313","5.9.29.183","172.19.0.3","TLSv1.2","1516","Application Data [TCP segment of a reassembled PDU]"
"4.564316","5.9.29.183","172.19.0.3","TCP","1516","9002 → 43520 [PSH, ACK] Seq=187860 Ack=12374 Win=65535 Len=1460 [TCP segment of a reassembled PDU]"
"4.564319","5.9.29.183","172.19.0.3","TCP","1153","9002 → 43520 [PSH, ACK] Seq=189320 Ack=12374 Win=65535 Len=1097 [TCP segment of a reassembled PDU]"
"4.564322","5.9.29.183","172.19.0.3","TLSv1.2","1516","Application Data [TCP segment of a reassembled PDU]"
"4.564326","5.9.29.183","172.19.0.3","TCP","1516","9002 → 43520 [PSH, ACK] Seq=191877 Ack=12374 Win=65535 Len=1460 [TCP segment of a reassembled PDU]"
"4.564328","5.9.29.183","172.19.0.3","TCP","1480","9002 → 43520 [PSH, ACK] Seq=193337 Ack=12374 Win=65535 Len=1424 [TCP segment of a reassembled PDU]"
"4.564407","172.19.0.3","5.9.29.183","TCP","56","43520 → 9002 [ACK] Seq=12374 Ack=194761 Win=11830 Len=0"
"4.570277","5.9.29.183","172.19.0.3","TLSv1.2","1516","Application Data, Application Data"
"4.570357","5.9.29.183","172.19.0.3","TCP","1492","9002 → 43520 [PSH, ACK] Seq=196221 Ack=12374 Win=65535 Len=1436 [TCP segment of a reassembled PDU]"
"4.570375","172.19.0.3","5.9.29.183","TCP","56","43520 → 9002 [ACK] Seq=12374 Ack=197657 Win=11903 Len=0"
"4.570489","5.9.29.183","172.19.0.3","TCP","1516","9002 → 43520 [PSH, ACK] Seq=197657 Ack=12374 Win=65535 Len=1460 [TCP segment of a reassembled PDU]"
"4.570501","5.9.29.183","172.19.0.3","TLSv1.2","1516","Application Data [TCP segment of a reassembled PDU]"
"4.570627","5.9.29.183","172.19.0.3","TCP","1516","9002 → 43520 [PSH, ACK] Seq=200577 Ack=12374 Win=65535 Len=1460 [TCP segment of a reassembled PDU]"
"4.570631","5.9.29.183","172.19.0.3","TCP","1516","9002 → 43520 [PSH, ACK] Seq=202037 Ack=12374 Win=65535 Len=1460 [TCP segment of a reassembled PDU]"
"4.570633","5.9.29.183","172.19.0.3","TLSv1.2","1456","Application Data [TCP segment of a reassembled PDU]"
"4.570649","172.19.0.3","5.9.29.183","TCP","56","43520 → 9002 [ACK] Seq=12374 Ack=200577 Win=11887 Len=0"
"4.571671","172.19.0.3","5.9.29.183","TLSv1.2","599","Application Data"
"4.571926","5.9.29.183","172.19.0.3","TCP","56","9002 → 43520 [ACK] Seq=204897 Ack=12917 Win=65535 Len=0"
"4.579235","5.9.29.183","172.19.0.3","TLSv1.2","1219","Application Data"
"4.611927","5.9.29.183","172.19.0.3","TCP","1516","[TCP segment of a reassembled PDU]"
"4.611950","172.19.0.3","5.9.29.183","TCP","56","43520 → 9002 [ACK] Seq=12917 Ack=207520 Win=11911 Len=0"
"4.612006","5.9.29.183","172.19.0.3","TLSv1.2","1195","Application Data"
"4.617173","172.19.0.3","5.9.29.183","TLSv1.2","599","Application Data"
"4.617724","5.9.29.183","172.19.0.3","TCP","56","9002 → 43520 [ACK] Seq=208659 Ack=13460 Win=65535 Len=0"
"4.912905","5.9.29.183","172.19.0.3","TLSv1.2","599","Application Data"
"4.913884","172.19.0.3","5.9.29.183","TLSv1.2","599","Application Data"
"4.914236","5.9.29.183","172.19.0.3","TCP","56","9002 → 43520 [ACK] Seq=209202 Ack=14003 Win=65535 Len=0"
"5.207492","5.9.29.183","172.19.0.3","TLSv1.2","599","Application Data"
"5.242009","5.9.29.183","172.19.0.3","TCP","1516","[TCP segment of a reassembled PDU]"
"5.242032","172.19.0.3","5.9.29.183","TCP","56","43520 → 9002 [ACK] Seq=14003 Ack=211205 Win=11909 Len=0"
"5.242083","5.9.29.183","172.19.0.3","TCP","1492","9002 → 43520 [PSH, ACK] Seq=211205 Ack=14003 Win=65535 Len=1436 [TCP segment of a reassembled PDU]"
"5.242162","5.9.29.183","172.19.0.3","TCP","580","9002 → 43520 [PSH, ACK] Seq=212641 Ack=14003 Win=65535 Len=524 [TCP segment of a reassembled PDU]"
"5.242256","5.9.29.183","172.19.0.3","TLSv1.2","1516","Application Data [TCP segment of a reassembled PDU]"
"5.242260","5.9.29.183","172.19.0.3","TCP","1516","9002 → 43520 [PSH, ACK] Seq=214625 Ack=14003 Win=65535 Len=1460 [TCP segment of a reassembled PDU]"
"5.242262","5.9.29.183","172.19.0.3","TCP","689","9002 → 43520 [PSH, ACK] Seq=216085 Ack=14003 Win=65535 Len=633 [TCP segment of a reassembled PDU]"
"5.242271","172.19.0.3","5.9.29.183","TCP","56","43520 → 9002 [ACK] Seq=14003 Ack=213165 Win=11894 Len=0"
"5.242345","172.19.0.3","5.9.29.183","TCP","56","43520 → 9002 [ACK] Seq=14003 Ack=216718 Win=11869 Len=0"
"5.257349","5.9.29.183","172.19.0.3","TLSv1.2","851","Application Data"
"5.275908","5.9.29.183","172.19.0.3","TCP","1504","[TCP segment of a reassembled PDU]"
"5.275930","172.19.0.3","5.9.29.183","TCP","56","43520 → 9002 [ACK] Seq=14003 Ack=218961 Win=11911 Len=0"
"5.276086","5.9.29.183","172.19.0.3","TCP","1504","9002 → 43520 [PSH, ACK] Seq=218961 Ack=14003 Win=65535 Len=1448 [TCP segment of a reassembled PDU]"
"5.276093","5.9.29.183","172.19.0.3","TLSv1.2","1516","Application Data [TCP segment of a reassembled PDU]"
"5.276095","5.9.29.183","172.19.0.3","TCP","1225","9002 → 43520 [PSH, ACK] Seq=221869 Ack=14003 Win=65535 Len=1169 [TCP segment of a reassembled PDU]"
"5.276097","5.9.29.183","172.19.0.3","TCP","1516","9002 → 43520 [PSH, ACK] Seq=223038 Ack=14003 Win=65535 Len=1460 [TCP segment of a reassembled PDU]"
"5.276149","5.9.29.183","172.19.0.3","TLSv1.2","1516","Application Data [TCP segment of a reassembled PDU]"
"5.276153","5.9.29.183","172.19.0.3","TCP","1516","9002 → 43520 [PSH, ACK] Seq=225958 Ack=14003 Win=65535 Len=1460 [TCP segment of a reassembled PDU]"
"5.276200","5.9.29.183","172.19.0.3","TCP","1468","9002 → 43520 [PSH, ACK] Seq=227418 Ack=14003 Win=65535 Len=1412 [TCP segment of a reassembled PDU]"
"5.276216","172.19.0.3","5.9.29.183","TCP","56","43520 → 9002 [ACK] Seq=14003 Ack=227418 Win=11863 Len=0"
"5.276413","172.19.0.3","5.9.29.183","TLSv1.2","599","Application Data"
"5.276716","5.9.29.183","172.19.0.3","TCP","56","9002 → 43520 [ACK] Seq=228830 Ack=14546 Win=65535 Len=0"
"5.291596","5.9.29.183","172.19.0.3","TLSv1.2","134","Application Data"
"5.302781","5.9.29.183","172.19.0.3","TCP","1504","[TCP segment of a reassembled PDU]"
"5.302798","172.19.0.3","5.9.29.183","TCP","56","43520 → 9002 [ACK] Seq=14546 Ack=230356 Win=11911 Len=0"
"5.302861","5.9.29.183","172.19.0.3","TCP","1504","9002 → 43520 [PSH, ACK] Seq=230356 Ack=14546 Win=65535 Len=1448 [TCP segment of a reassembled PDU]"
"5.307075","5.9.29.183","172.19.0.3","TLSv1.2","1330","Application Data, Application Data"
"5.307093","172.19.0.3","5.9.29.183","TCP","56","43520 → 9002 [ACK] Seq=14546 Ack=233078 Win=11911 Len=0"
"5.314559","5.9.29.183","172.19.0.3","TCP","1516","[TCP segment of a reassembled PDU]"
"5.314605","5.9.29.183","172.19.0.3","TCP","1492","9002 → 43520 [PSH, ACK] Seq=234538 Ack=14546 Win=65535 Len=1436 [TCP segment of a reassembled PDU]"
"5.314611","5.9.29.183","172.19.0.3","TLSv1.2","1516","Application Data [TCP segment of a reassembled PDU]"
"5.314622","5.9.29.183","172.19.0.3","TCP","1492","9002 → 43520 [PSH, ACK] Seq=237434 Ack=14546 Win=65535 Len=1436 [TCP segment of a reassembled PDU]"
"5.314707","5.9.29.183","172.19.0.3","TLSv1.2","1504","Application Data [TCP segment of a reassembled PDU]"
"5.314724","172.19.0.3","5.9.29.183","TCP","56","43520 → 9002 [ACK] Seq=14546 Ack=238870 Win=11885 Len=0"
"5.314852","5.9.29.183","172.19.0.3","TCP","1504","9002 → 43520 [PSH, ACK] Seq=240318 Ack=14546 Win=65535 Len=1448 [TCP segment of a reassembled PDU]"
"5.314953","172.19.0.3","5.9.29.183","TLSv1.2","599","Application Data"
"5.314968","5.9.29.183","172.19.0.3","TCP","1516","9002 → 43520 [PSH, ACK] Seq=241766 Ack=14546 Win=65535 Len=1460 [TCP segment of a reassembled PDU]"
"5.314970","5.9.29.183","172.19.0.3","TLSv1.2","1492","Application Data [TCP segment of a reassembled PDU]"
"5.315070","172.19.0.3","5.9.29.183","TCP","56","43520 → 9002 [ACK] Seq=15089 Ack=244662 Win=11853 Len=0"
"5.315113","5.9.29.183","172.19.0.3","TCP","56","9002 → 43520 [ACK] Seq=244662 Ack=15089 Win=65535 Len=0"
"5.322410","5.9.29.183","172.19.0.3","TLSv1.2","924","Application Data"
"5.355794","5.9.29.183","172.19.0.3","TLSv1.2","1113","Application Data"
"5.355819","172.19.0.3","5.9.29.183","TCP","56","43520 → 9002 [ACK] Seq=15089 Ack=246587 Win=11911 Len=0"
"5.360530","172.19.0.3","5.9.29.183","TLSv1.2","599","Application Data"
"5.360837","5.9.29.183","172.19.0.3","TCP","56","9002 → 43520 [ACK] Seq=246587 Ack=15632 Win=65535 Len=0"
"5.671269","5.9.29.183","172.19.0.3","TLSv1.2","599","Application Data"
"5.672131","172.19.0.3","5.9.29.183","TLSv1.2","599","Application Data"
"5.672438","5.9.29.183","172.19.0.3","TCP","56","9002 → 43520 [ACK] Seq=247130 Ack=16175 Win=65535 Len=0"
"6.025438","5.9.29.183","172.19.0.3","TLSv1.2","1516","Application Data"
"6.025511","5.9.29.183","172.19.0.3","TCP","1516","9002 → 43520 [PSH, ACK] Seq=248590 Ack=16175 Win=65535 Len=1460 [TCP segment of a reassembled PDU]"
"6.025520","5.9.29.183","172.19.0.3","TLSv1.2","1516","Application Data [TCP segment of a reassembled PDU]"
"6.025525","5.9.29.183","172.19.0.3","TCP","1516","9002 → 43520 [PSH, ACK] Seq=251510 Ack=16175 Win=65535 Len=1460 [TCP segment of a reassembled PDU]"
"6.025529","5.9.29.183","172.19.0.3","TCP","551","9002 → 43520 [PSH, ACK] Seq=252970 Ack=16175 Win=65535 Len=495 [TCP segment of a reassembled PDU]"
"6.025532","5.9.29.183","172.19.0.3","TCP","1516","9002 → 43520 [PSH, ACK] Seq=253465 Ack=16175 Win=65535 Len=1460 [TCP segment of a reassembled PDU]"
"6.025557","5.9.29.183","172.19.0.3","TLSv1.2","1516","Application Data, Application Data"
"6.025560","5.9.29.183","172.19.0.3","TCP","1516","9002 → 43520 [PSH, ACK] Seq=256385 Ack=16175 Win=65535 Len=1460 [TCP segment of a reassembled PDU]"
"6.025562","5.9.29.183","172.19.0.3","TCP","1468","9002 → 43520 [PSH, ACK] Seq=257845 Ack=16175 Win=65535 Len=1412 [TCP segment of a reassembled PDU]"
"6.025628","172.19.0.3","5.9.29.183","TCP","56","43520 → 9002 [ACK] Seq=16175 Ack=259257 Win=11847 Len=0"
"6.041131","5.9.29.183","172.19.0.3","TLSv1.2","1516","Application Data [TCP segment of a reassembled PDU]"
"6.041198","5.9.29.183","172.19.0.3","TCP","1516","9002 → 43520 [PSH, ACK] Seq=260717 Ack=16175 Win=65535 Len=1460 [TCP segment of a reassembled PDU]"
"6.041216","172.19.0.3","5.9.29.183","TCP","56","43520 → 9002 [ACK] Seq=16175 Ack=262177 Win=11903 Len=0"
"6.041219","5.9.29.183","172.19.0.3","TLSv1.2","1516","Application Data [TCP segment of a reassembled PDU]"
"6.041223","5.9.29.183","172.19.0.3","TCP","1516","9002 → 43520 [PSH, ACK] Seq=263637 Ack=16175 Win=65535 Len=1460 [TCP segment of a reassembled PDU]"
"6.041226","5.9.29.183","172.19.0.3","TCP","1516","9002 → 43520 [PSH, ACK] Seq=265097 Ack=16175 Win=65535 Len=1460 [TCP segment of a reassembled PDU]"
"6.041229","5.9.29.183","172.19.0.3","TLSv1.2","878","Application Data"
"6.041339","172.19.0.3","5.9.29.183","TCP","56","43520 → 9002 [ACK] Seq=16175 Ack=267379 Win=11871 Len=0"
"6.045557","5.9.29.183","172.19.0.3","TCP","1516","[TCP segment of a reassembled PDU]"
"6.045630","5.9.29.183","172.19.0.3","TCP","1492","9002 → 43520 [PSH, ACK] Seq=268839 Ack=16175 Win=65535 Len=1436 [TCP segment of a reassembled PDU]"
"6.045651","172.19.0.3","5.9.29.183","TCP","56","43520 → 9002 [ACK] Seq=16175 Ack=270275 Win=11903 Len=0"
"6.055978","5.9.29.183","172.19.0.3","TLSv1.2","1330","Application Data, Application Data"
"6.096144","172.19.0.3","5.9.29.183","TCP","56","43520 → 9002 [ACK] Seq=16175 Ack=271549 Win=11911 Len=0"
"6.105376","5.9.29.183","172.19.0.3","TCP","1516","[TCP segment of a reassembled PDU]"
"6.105393","172.19.0.3","5.9.29.183","TCP","56","43520 → 9002 [ACK] Seq=16175 Ack=273009 Win=11909 Len=0"
"6.105425","5.9.29.183","172.19.0.3","TLSv1.2","167","Application Data"
"6.105437","172.19.0.3","5.9.29.183","TCP","56","43520 → 9002 [ACK] Seq=16175 Ack=273120 Win=11909 Len=0"
"6.109358","172.19.0.3","5.9.29.183","TLSv1.2","599","Application Data"
"6.109611","5.9.29.183","172.19.0.3","TCP","56","9002 → 43520 [ACK] Seq=273120 Ack=16718 Win=65535 Len=0"
"6.591295","5.9.29.183","172.19.0.3","TLSv1.2","599","Application Data"
"6.592063","172.19.0.3","5.9.29.183","TLSv1.2","599","Application Data"
"6.592302","5.9.29.183","172.19.0.3","TCP","56","9002 → 43520 [ACK] Seq=273663 Ack=17261 Win=65535 Len=0"
"6.926366","5.9.29.183","172.19.0.3","TLSv1.2","599","Application Data"
"6.960727","5.9.29.183","172.19.0.3","TCP","1504","[TCP segment of a reassembled PDU]"
"6.960750","172.19.0.3","5.9.29.183","TCP","56","43520 → 9002 [ACK] Seq=17261 Ack=275654 Win=11911 Len=0"
"6.960877","5.9.29.183","172.19.0.3","TCP","1504","9002 → 43520 [PSH, ACK] Seq=275654 Ack=17261 Win=65535 Len=1448 [TCP segment of a reassembled PDU]"
"6.960936","5.9.29.183","172.19.0.3","TLSv1.2","787","Application Data"
"6.960963","172.19.0.3","5.9.29.183","TCP","56","43520 → 9002 [ACK] Seq=17261 Ack=277833 Win=11895 Len=0"
"6.961311","172.19.0.3","5.9.29.183","TLSv1.2","599","Application Data"
"6.961571","5.9.29.183","172.19.0.3","TCP","56","9002 → 43520 [ACK] Seq=277833 Ack=17804 Win=65535 Len=0"
"7.095370","5.9.29.183","172.19.0.3","TCP","924","[TCP segment of a reassembled PDU]"
"7.095416","5.9.29.183","172.19.0.3","TLSv1.2","759","Application Data"
"7.095513","172.19.0.3","5.9.29.183","TCP","56","43520 → 9002 [ACK] Seq=17804 Ack=279404 Win=11903 Len=0"
"7.098957","172.19.0.3","5.9.29.183","TLSv1.2","599","Application Data"
"7.099188","5.9.29.183","172.19.0.3","TCP","56","9002 → 43520 [ACK] Seq=279404 Ack=18347 Win=65535 Len=0"
"7.490940","5.9.29.183","172.19.0.3","TLSv1.2","599","Application Data"
"7.491683","172.19.0.3","5.9.29.183","TLSv1.2","599","Application Data"
"7.491905","5.9.29.183","172.19.0.3","TCP","56","9002 → 43520 [ACK] Seq=279947 Ack=18890 Win=65535 Len=0"
"7.827944","5.9.29.183","172.19.0.3","TCP","1516","[TCP segment of a reassembled PDU]"
"7.828021","5.9.29.183","172.19.0.3","TCP","1516","9002 → 43520 [PSH, ACK] Seq=281407 Ack=18890 Win=65535 Len=1460 [TCP segment of a reassembled PDU]"
"7.828079","5.9.29.183","172.19.0.3","TLSv1.2","763","Application Data"
"7.828181","172.19.0.3","5.9.29.183","TCP","56","43520 → 9002 [ACK] Seq=18890 Ack=283574 Win=11895 Len=0"
"7.839479","5.9.29.183","172.19.0.3","TCP","1504","[TCP segment of a reassembled PDU]"
"7.839531","5.9.29.183","172.19.0.3","TCP","1504","9002 → 43520 [PSH, ACK] Seq=285022 Ack=18890 Win=65535 Len=1448 [TCP segment of a reassembled PDU]"
"7.839546","172.19.0.3","5.9.29.183","TCP","56","43520 → 9002 [ACK] Seq=18890 Ack=286470 Win=11903 Len=0"
"7.843682","5.9.29.183","172.19.0.3","TLSv1.2","1330","Application Data, Application Data"
"7.855368","5.9.29.183","172.19.0.3","TCP","1516","[TCP segment of a reassembled PDU]"
"7.855394","172.19.0.3","5.9.29.183","TCP","56","43520 → 9002 [ACK] Seq=18890 Ack=289204 Win=11911 Len=0"
"7.855457","5.9.29.183","172.19.0.3","TCP","1492","9002 → 43520 [PSH, ACK] Seq=289204 Ack=18890 Win=65535 Len=1436 [TCP segment of a reassembled PDU]"
"7.859098","5.9.29.183","172.19.0.3","TLSv1.2","1330","Application Data, Application Data"
"7.859125","172.19.0.3","5.9.29.183","TCP","56","43520 → 9002 [ACK] Seq=18890 Ack=291914 Win=11911 Len=0"
"7.870450","5.9.29.183","172.19.0.3","TCP","1504","[TCP segment of a reassembled PDU]"
"7.870509","5.9.29.183","172.19.0.3","TCP","1504","9002 → 43520 [PSH, ACK] Seq=293362 Ack=18890 Win=65535 Len=1448 [TCP segment of a reassembled PDU]"
"7.870649","172.19.0.3","5.9.29.183","TCP","56","43520 → 9002 [ACK] Seq=18890 Ack=294810 Win=11903 Len=0"
"7.995841","5.9.29.183","172.19.0.3","TLSv1.2","787","Application Data"
"7.995911","5.9.29.183","172.19.0.3","TCP","1516","[TCP segment of a reassembled PDU]"
"7.995929","172.19.0.3","5.9.29.183","TCP","56","43520 → 9002 [ACK] Seq=18890 Ack=297001 Win=11903 Len=0"
"7.995931","5.9.29.183","172.19.0.3","TCP","1516","9002 → 43520 [PSH, ACK] Seq=297001 Ack=18890 Win=65535 Len=1460 [TCP segment of a reassembled PDU]"
"7.996015","5.9.29.183","172.19.0.3","TLSv1.2","1516","Application Data [TCP segment of a reassembled PDU]"
"7.996021","5.9.29.183","172.19.0.3","TCP","1516","9002 → 43520 [PSH, ACK] Seq=299921 Ack=18890 Win=65535 Len=1460 [TCP segment of a reassembled PDU]"
"7.996025","5.9.29.183","172.19.0.3","TCP","1456","9002 → 43520 [PSH, ACK] Seq=301381 Ack=18890 Win=65535 Len=1400 [TCP segment of a reassembled PDU]"
"7.996205","172.19.0.3","5.9.29.183","TCP","56","43520 → 9002 [ACK] Seq=18890 Ack=302781 Win=11871 Len=0"
"8.011157","5.9.29.183","172.19.0.3","TLSv1.2","1504","Application Data [TCP segment of a reassembled PDU]"
"8.011224","5.9.29.183","172.19.0.3","TCP","1516","9002 → 43520 [PSH, ACK] Seq=304229 Ack=18890 Win=65535 Len=1460 [TCP segment of a reassembled PDU]"
"8.011296","172.19.0.3","5.9.29.183","TCP","56","43520 → 9002 [ACK] Seq=18890 Ack=305689 Win=11903 Len=0"
"8.011300","5.9.29.183","172.19.0.3","TCP","1516","9002 → 43520 [PSH, ACK] Seq=305689 Ack=18890 Win=65535 Len=1460 [TCP segment of a reassembled PDU]"
"8.011304","5.9.29.183","172.19.0.3","TLSv1.2","1516","Application Data [TCP segment of a reassembled PDU]"
"8.011307","5.9.29.183","172.19.0.3","TCP","1468","9002 → 43520 [PSH, ACK] Seq=308609 Ack=18890 Win=65535 Len=1412 [TCP segment of a reassembled PDU]"
"8.011377","172.19.0.3","5.9.29.183","TCP","56","43520 → 9002 [ACK] Seq=18890 Ack=310021 Win=11879 Len=0"
"8.011396","5.9.29.183","172.19.0.3","TLSv1.2","1516","Application Data, Application Data"
"8.011400","5.9.29.183","172.19.0.3","TLSv1.2","1252","Application Data"
"8.011612","172.19.0.3","5.9.29.183","TCP","56","43520 → 9002 [ACK] Seq=18890 Ack=312677 Win=11863 Len=0"
"8.011965","172.19.0.3","5.9.29.183","TLSv1.2","599","Application Data"
"8.012463","5.9.29.183","172.19.0.3","TCP","56","9002 → 43520 [ACK] Seq=312677 Ack=19433 Win=65535 Len=0"
"8.012565","5.9.29.183","172.19.0.3","TCP","1504","[TCP segment of a reassembled PDU]"
"8.026949","5.9.29.183","172.19.0.3","TCP","1516","9002 → 43520 [PSH, ACK] Seq=314125 Ack=19433 Win=65535 Len=1460 [TCP segment of a reassembled PDU]"
"8.027047","172.19.0.3","5.9.29.183","TCP","56","43520 → 9002 [ACK] Seq=19433 Ack=315585 Win=11909 Len=0"
"8.027096","5.9.29.183","172.19.0.3","TLSv1.2","1492","Application Data [TCP segment of a reassembled PDU]"
"8.027143","5.9.29.183","172.19.0.3","TCP","1516","9002 → 43520 [PSH, ACK] Seq=317021 Ack=19433 Win=65535 Len=1460 [TCP segment of a reassembled PDU]"
"8.027152","5.9.29.183","172.19.0.3","TCP","1516","9002 → 43520 [PSH, ACK] Seq=318481 Ack=19433 Win=65535 Len=1460 [TCP segment of a reassembled PDU]"
"8.027242","5.9.29.183","172.19.0.3","TLSv1.2","1516","Application Data [TCP segment of a reassembled PDU]"
"8.027248","5.9.29.183","172.19.0.3","TCP","1516","9002 → 43520 [PSH, ACK] Seq=321401 Ack=19433 Win=65535 Len=1460 [TCP segment of a reassembled PDU]"
"8.027251","5.9.29.183","172.19.0.3","TCP","1456","9002 → 43520 [PSH, ACK] Seq=322861 Ack=19433 Win=65535 Len=1400 [TCP segment of a reassembled PDU]"
"8.027270","172.19.0.3","5.9.29.183","TCP","56","43520 → 9002 [ACK] Seq=19433 Ack=321401 Win=11877 Len=0"
"8.027535","172.19.0.3","5.9.29.183","TCP","56","43520 → 9002 [ACK] Seq=19433 Ack=324261 Win=11861 Len=0"
"8.164811","5.9.29.183","172.19.0.3","TLSv1.2","1516","Application Data, Application Data, Application Data"
"8.164953","5.9.29.183","172.19.0.3","TCP","1492","9002 → 43520 [PSH, ACK] Seq=325721 Ack=19433 Win=65535 Len=1436 [TCP segment of a reassembled PDU]"
"8.164975","172.19.0.3","5.9.29.183","TCP","56","43520 → 9002 [ACK] Seq=19433 Ack=327157 Win=11903 Len=0"
"8.164977","5.9.29.183","172.19.0.3","TCP","1516","9002 → 43520 [PSH, ACK] Seq=327157 Ack=19433 Win=65535 Len=1460 [TCP segment of a reassembled PDU]"
"8.164981","5.9.29.183","172.19.0.3","TLSv1.2","1516","Application Data [TCP segment of a reassembled PDU]"
"8.164985","5.9.29.183","172.19.0.3","TLSv1.2","1516","Application Data [TCP segment of a reassembled PDU]"
"8.165079","5.9.29.183","172.19.0.3","TLSv1.2","1474","Application Data"
"8.165130","172.19.0.3","5.9.29.183","TCP","56","43520 → 9002 [ACK] Seq=19433 Ack=332955 Win=11871 Len=0"
"8.165695","172.19.0.3","5.9.29.183","TLSv1.2","599","Application Data"
"8.165934","5.9.29.183","172.19.0.3","TCP","56","9002 → 43520 [ACK] Seq=332955 Ack=19976 Win=65535 Len=0"
"8.175108","172.19.0.3","5.9.29.183","TLSv1.2","1113","Application Data"
"8.175440","5.9.29.183","172.19.0.3","TCP","56","9002 → 43520 [ACK] Seq=332955 Ack=21033 Win=65535 Len=0"
"8.629018","5.9.29.183","172.19.0.3","TLSv1.2","599","Application Data"
"8.629828","172.19.0.3","5.9.29.183","TLSv1.2","599","Application Data"
"8.630111","5.9.29.183","172.19.0.3","TCP","56","9002 → 43520 [ACK] Seq=333498 Ack=21576 Win=65535 Len=0"
"8.925065","5.9.29.183","172.19.0.3","TLSv1.2","599","Application Data"
"8.938656","5.9.29.183","172.19.0.3","TCP","1504","[TCP segment of a reassembled PDU]"
"8.938679","172.19.0.3","5.9.29.183","TCP","56","43520 → 9002 [ACK] Seq=21576 Ack=335489 Win=11911 Len=0"
"8.938729","5.9.29.183","172.19.0.3","TCP","1516","9002 → 43520 [PSH, ACK] Seq=335489 Ack=21576 Win=65535 Len=1460 [TCP segment of a reassembled PDU]"
"8.938743","5.9.29.183","172.19.0.3","TLSv1.2","775","Application Data"
"8.938877","172.19.0.3","5.9.29.183","TCP","56","43520 → 9002 [ACK] Seq=21576 Ack=337668 Win=11895 Len=0"
"8.978907","5.9.29.183","172.19.0.3","TCP","1516","[TCP segment of a reassembled PDU]"
"8.978930","5.9.29.183","172.19.0.3","TCP","1516","9002 → 43520 [PSH, ACK] Seq=339128 Ack=21576 Win=65535 Len=1460 [TCP segment of a reassembled PDU]"
"8.978948","172.19.0.3","5.9.29.183","TCP","56","43520 → 9002 [ACK] Seq=21576 Ack=340588 Win=11903 Len=0"
"8.978949","5.9.29.183","172.19.0.3","TLSv1.2","249","Application Data"
"8.982990","172.19.0.3","5.9.29.183","TLSv1.2","599","Application Data"
"8.983217","5.9.29.183","172.19.0.3","TCP","56","9002 → 43520 [ACK] Seq=340781 Ack=22119 Win=65535 Len=0"
"9.267183","5.9.29.183","172.19.0.3","TLSv1.2","599","Application Data"
"9.268015","172.19.0.3","5.9.29.183","TLSv1.2","599","Application Data"
"9.268379","5.9.29.183","172.19.0.3","TCP","56","9002 → 43520 [ACK] Seq=341324 Ack=22662 Win=65535 Len=0"
"9.559542","5.9.29.183","172.19.0.3","TLSv1.2","599","Application Data"
"9.585651","5.9.29.183","172.19.0.3","TCP","1516","[TCP segment of a reassembled PDU]"
"9.585676","172.19.0.3","5.9.29.183","TCP","56","43520 → 9002 [ACK] Seq=22662 Ack=343327 Win=11911 Len=0"
"9.585733","5.9.29.183","172.19.0.3","TCP","966","9002 → 43520 [PSH, ACK] Seq=343327 Ack=22662 Win=65535 Len=910 [TCP segment of a reassembled PDU]"
"9.585748","5.9.29.183","172.19.0.3","TLSv1.2","1313","Application Data"
"9.585931","172.19.0.3","5.9.29.183","TCP","56","43520 → 9002 [ACK] Seq=22662 Ack=345494 Win=11895 Len=0"
"9.606043","5.9.29.183","172.19.0.3","TCP","1516","[TCP segment of a reassembled PDU]"
"9.606097","5.9.29.183","172.19.0.3","TCP","1516","9002 → 43520 [PSH, ACK] Seq=346954 Ack=22662 Win=65535 Len=1460 [TCP segment of a reassembled PDU]"
"9.606112","172.19.0.3","5.9.29.183","TCP","56","43520 → 9002 [ACK] Seq=22662 Ack=348414 Win=11903 Len=0"
"9.606115","5.9.29.183","172.19.0.3","TLSv1.2","1213","Application Data"
"9.606118","5.9.29.183","172.19.0.3","TCP","1516","[TCP segment of a reassembled PDU]"
"9.606123","5.9.29.183","172.19.0.3","TCP","1492","9002 → 43520 [PSH, ACK] Seq=351031 Ack=22662 Win=65535 Len=1436 [TCP segment of a reassembled PDU]"
"9.606293","172.19.0.3","5.9.29.183","TCP","56","43520 → 9002 [ACK] Seq=22662 Ack=352467 Win=11879 Len=0"
"9.619494","5.9.29.183","172.19.0.3","TLSv1.2","1516","Application Data [TCP segment of a reassembled PDU]"
"9.619558","5.9.29.183","172.19.0.3","TCP","1516","9002 → 43520 [PSH, ACK] Seq=353927 Ack=22662 Win=65535 Len=1460 [TCP segment of a reassembled PDU]"
"9.619580","172.19.0.3","5.9.29.183","TCP","56","43520 → 9002 [ACK] Seq=22662 Ack=355387 Win=11903 Len=0"
"9.619584","5.9.29.183","172.19.0.3","TCP","1480","9002 → 43520 [PSH, ACK] Seq=355387 Ack=22662 Win=65535 Len=1424 [TCP segment of a reassembled PDU]"
"9.621355","5.9.29.183","172.19.0.3","TLSv1.2","1516","Application Data [TCP segment of a reassembled PDU]"
"9.621365","172.19.0.3","5.9.29.183","TCP","56","43520 → 9002 [ACK] Seq=22662 Ack=358271 Win=11909 Len=0"
"9.621399","5.9.29.183","172.19.0.3","TCP","1492","9002 → 43520 [PSH, ACK] Seq=358271 Ack=22662 Win=65535 Len=1436 [TCP segment of a reassembled PDU]"
"9.621433","5.9.29.183","172.19.0.3","TLSv1.2","1408","Application Data, Application Data"
"9.621499","172.19.0.3","5.9.29.183","TCP","56","43520 → 9002 [ACK] Seq=22662 Ack=361059 Win=11893 Len=0"
"9.642921","5.9.29.183","172.19.0.3","TCP","1516","[TCP segment of a reassembled PDU]"
"9.642993","5.9.29.183","172.19.0.3","TCP","1516","9002 → 43520 [PSH, ACK] Seq=362519 Ack=22662 Win=65535 Len=1460 [TCP segment of a reassembled PDU]"
"9.643010","172.19.0.3","5.9.29.183","TCP","56","43520 → 9002 [ACK] Seq=22662 Ack=363979 Win=11903 Len=0"
"9.643014","5.9.29.183","172.19.0.3","TLSv1.2","1516","Application Data [TCP segment of a reassembled PDU]"
"9.643018","5.9.29.183","172.19.0.3","TCP","1201","9002 → 43520 [PSH, ACK] Seq=365439 Ack=22662 Win=65535 Len=1145 [TCP segment of a reassembled PDU]"
"9.643021","5.9.29.183","172.19.0.3","TCP","1504","9002 → 43520 [PSH, ACK] Seq=366584 Ack=22662 Win=65535 Len=1448 [TCP segment of a reassembled PDU]"
"9.643155","172.19.0.3","5.9.29.183","TCP","56","43520 → 9002 [ACK] Seq=22662 Ack=368032 Win=11879 Len=0"
"9.653697","5.9.29.183","172.19.0.3","TLSv1.2","1516","Application Data [TCP segment of a reassembled PDU]"
"9.653762","5.9.29.183","172.19.0.3","TCP","1516","9002 → 43520 [PSH, ACK] Seq=369492 Ack=22662 Win=65535 Len=1460 [TCP segment of a reassembled PDU]"
"9.653779","172.19.0.3","5.9.29.183","TCP","56","43520 → 9002 [ACK] Seq=22662 Ack=370952 Win=11903 Len=0"
"9.653783","5.9.29.183","172.19.0.3","TCP","1480","9002 → 43520 [PSH, ACK] Seq=370952 Ack=22662 Win=65535 Len=1424 [TCP segment of a reassembled PDU]"
"9.653969","5.9.29.183","172.19.0.3","TLSv1.2","1504","Application Data [TCP segment of a reassembled PDU]"
"9.654158","172.19.0.3","5.9.29.183","TLSv1.2","599","Application Data"
"9.654479","5.9.29.183","172.19.0.3","TCP","56","9002 → 43520 [ACK] Seq=373824 Ack=23205 Win=65535 Len=0"
"9.657895","5.9.29.183","172.19.0.3","TCP","1504","9002 → 43520 [PSH, ACK] Seq=373824 Ack=23205 Win=65535 Len=1448 [TCP segment of a reassembled PDU]"
"9.657961","5.9.29.183","172.19.0.3","TCP","1504","9002 → 43520 [PSH, ACK] Seq=375272 Ack=23205 Win=65535 Len=1448 [TCP segment of a reassembled PDU]"
"9.657983","172.19.0.3","5.9.29.183","TCP","56","43520 → 9002 [ACK] Seq=23205 Ack=376720 Win=11903 Len=0"
"9.658089","5.9.29.183","172.19.0.3","TLSv1.2","1504","Application Data [TCP segment of a reassembled PDU]"
"9.658264","5.9.29.183","172.19.0.3","TCP","1504","9002 → 43520 [PSH, ACK] Seq=378168 Ack=23205 Win=65535 Len=1448 [TCP segment of a reassembled PDU]"
"9.658318","172.19.0.3","5.9.29.183","TCP","56","43520 → 9002 [ACK] Seq=23205 Ack=379616 Win=11887 Len=0"
"9.669069","5.9.29.183","172.19.0.3","TLSv1.2","1516","Application Data [TCP segment of a reassembled PDU]"
"9.669188","5.9.29.183","172.19.0.3","TLSv1.2","773","Application Data"
"9.669206","172.19.0.3","5.9.29.183","TCP","56","43520 → 9002 [ACK] Seq=23205 Ack=381793 Win=11903 Len=0"
"9.669734","172.19.0.3","5.9.29.183","TLSv1.2","599","Application Data"
"9.670030","5.9.29.183","172.19.0.3","TCP","56","9002 → 43520 [ACK] Seq=381793 Ack=23748 Win=65535 Len=0"
"9.706746","5.9.29.183","172.19.0.3","TCP","1516","[TCP segment of a reassembled PDU]"
"9.706822","5.9.29.183","172.19.0.3","TLSv1.2","167","Application Data"
"9.706996","172.19.0.3","5.9.29.183","TCP","56","43520 → 9002 [ACK] Seq=23748 Ack=383364 Win=11901 Len=0"
"9.711286","172.19.0.3","5.9.29.183","TLSv1.2","599","Application Data"
"9.711533","5.9.29.183","172.19.0.3","TCP","56","9002 → 43520 [ACK] Seq=383364 Ack=24291 Win=65535 Len=0"
"10.011477","5.9.29.183","172.19.0.3","TLSv1.2","599","Application Data"
"10.012174","172.19.0.3","5.9.29.183","TLSv1.2","599","Application Data"
"10.012466","5.9.29.183","172.19.0.3","TCP","56","9002 → 43520 [ACK] Seq=383907 Ack=24834 Win=65535 Len=0"
"10.327754","5.9.29.183","172.19.0.3","TLSv1.2","599","Application Data"
"10.368110","172.19.0.3","5.9.29.183","TCP","56","43520 → 9002 [ACK] Seq=24834 Ack=384450 Win=11911 Len=0"
"10.383341","5.9.29.183","172.19.0.3","TCP","1516","[TCP segment of a reassembled PDU]"
"10.383367","172.19.0.3","5.9.29.183","TCP","56","43520 → 9002 [ACK] Seq=24834 Ack=385910 Win=11911 Len=0"
"10.383430","5.9.29.183","172.19.0.3","TCP","1516","9002 → 43520 [PSH, ACK] Seq=385910 Ack=24834 Win=65535 Len=1460 [TCP segment of a reassembled PDU]"
"10.383455","172.19.0.3","5.9.29.183","TCP","56","43520 → 9002 [ACK] Seq=24834 Ack=387370 Win=11901 Len=0"
"10.383458","5.9.29.183","172.19.0.3","TLSv1.2","763","Application Data"
"10.383464","172.19.0.3","5.9.29.183","TCP","56","43520 → 9002 [ACK] Seq=24834 Ack=388077 Win=11896 Len=0"
"10.395688","5.9.29.183","172.19.0.3","TCP","1504","[TCP segment of a reassembled PDU]"
"10.395709","172.19.0.3","5.9.29.183","TCP","56","43520 → 9002 [ACK] Seq=24834 Ack=389525 Win=11911 Len=0"
"10.395782","5.9.29.183","172.19.0.3","TCP","1516","9002 → 43520 [PSH, ACK] Seq=389525 Ack=24834 Win=65535 Len=1460 [TCP segment of a reassembled PDU]"
"10.395796","172.19.0.3","5.9.29.183","TCP","56","43520 → 9002 [ACK] Seq=24834 Ack=390985 Win=11903 Len=0"
"10.395800","5.9.29.183","172.19.0.3","TLSv1.2","1516","Application Data [TCP segment of a reassembled PDU]"
"10.395805","172.19.0.3","5.9.29.183","TCP","56","43520 → 9002 [ACK] Seq=24834 Ack=392445 Win=11895 Len=0"
"10.395807","5.9.29.183","172.19.0.3","TCP","1480","9002 → 43520 [PSH, ACK] Seq=392445 Ack=24834 Win=65535 Len=1424 [TCP segment of a reassembled PDU]"
"10.395814","172.19.0.3","5.9.29.183","TCP","56","43520 → 9002 [ACK] Seq=24834 Ack=393869 Win=11887 Len=0"
"10.395908","5.9.29.183","172.19.0.3","TCP","1516","9002 → 43520 [PSH, ACK] Seq=393869 Ack=24834 Win=65535 Len=1460 [TCP segment of a reassembled PDU]"
"10.395916","172.19.0.3","5.9.29.183","TCP","56","43520 → 9002 [ACK] Seq=24834 Ack=395329 Win=11879 Len=0"
"10.395918","5.9.29.183","172.19.0.3","TLSv1.2","1516","Application Data [TCP segment of a reassembled PDU]"
"10.395924","172.19.0.3","5.9.29.183","TCP","56","43520 → 9002 [ACK] Seq=24834 Ack=396789 Win=11871 Len=0"
"10.395924","5.9.29.183","172.19.0.3","TCP","1480","9002 → 43520 [PSH, ACK] Seq=396789 Ack=24834 Win=65535 Len=1424 [TCP segment of a reassembled PDU]"
"10.395928","172.19.0.3","5.9.29.183","TCP","56","43520 → 9002 [ACK] Seq=24834 Ack=398213 Win=11863 Len=0"
"10.399260","5.9.29.183","172.19.0.3","TCP","1516","9002 → 43520 [PSH, ACK] Seq=398213 Ack=24834 Win=65535 Len=1460 [TCP segment of a reassembled PDU]"
"10.399282","172.19.0.3","5.9.29.183","TCP","56","43520 → 9002 [ACK] Seq=24834 Ack=399673 Win=11911 Len=0"
"10.399337","5.9.29.183","172.19.0.3","TLSv1.2","369","Application Data"
"10.399355","172.19.0.3","5.9.29.183","TCP","56","43520 → 9002 [ACK] Seq=24834 Ack=399986 Win=11909 Len=0"
"10.412632","5.9.29.183","172.19.0.3","TCP","1504","[TCP segment of a reassembled PDU]"
"10.412651","172.19.0.3","5.9.29.183","TCP","56","43520 → 9002 [ACK] Seq=24834 Ack=401434 Win=11911 Len=0"
"10.413058","5.9.29.183","172.19.0.3","TCP","1516","9002 → 43520 [PSH, ACK] Seq=401434 Ack=24834 Win=65535 Len=1460 [TCP segment of a reassembled PDU]"
"10.413119","172.19.0.3","5.9.29.183","TCP","56","43520 → 9002 [ACK] Seq=24834 Ack=402894 Win=11911 Len=0"
"10.413233","5.9.29.183","172.19.0.3","TLSv1.2","1492","Application Data [TCP segment of a reassembled PDU]"
"10.413241","172.19.0.3","5.9.29.183","TCP","56","43520 → 9002 [ACK] Seq=24834 Ack=404330 Win=11911 Len=0"
"10.413269","5.9.29.183","172.19.0.3","TCP","1516","9002 → 43520 [PSH, ACK] Seq=404330 Ack=24834 Win=65535 Len=1460 [TCP segment of a reassembled PDU]"
"10.413301","5.9.29.183","172.19.0.3","TCP","1516","9002 → 43520 [PSH, ACK] Seq=405790 Ack=24834 Win=65535 Len=1460 [TCP segment of a reassembled PDU]"
"10.413308","5.9.29.183","172.19.0.3","TLSv1.2","1516","Application Data [TCP segment of a reassembled PDU]"
"10.413312","5.9.29.183","172.19.0.3","TCP","1119","9002 → 43520 [PSH, ACK] Seq=408710 Ack=24834 Win=65535 Len=1063 [TCP segment of a reassembled PDU]"
"10.413315","5.9.29.183","172.19.0.3","TCP","405","9002 → 43520 [PSH, ACK] Seq=409773 Ack=24834 Win=65535 Len=349 [TCP segment of a reassembled PDU]"
"10.413340","172.19.0.3","5.9.29.183","TCP","56","43520 → 9002 [ACK] Seq=24834 Ack=410122 Win=11871 Len=0"
"10.414249","5.9.29.183","172.19.0.3","TCP","1504","9002 → 43520 [PSH, ACK] Seq=410122 Ack=24834 Win=65535 Len=1448 [TCP segment of a reassembled PDU]"
"10.414280","5.9.29.183","172.19.0.3","TLSv1.2","381","Application Data"
"10.414288","172.19.0.3","5.9.29.183","TCP","56","43520 → 9002 [ACK] Seq=24834 Ack=411895 Win=11903 Len=0"
"10.414457","172.19.0.3","5.9.29.183","TLSv1.2","599","Application Data"
"10.414623","5.9.29.183","172.19.0.3","TCP","56","9002 → 43520 [ACK] Seq=411895 Ack=25377 Win=65535 Len=0"
"10.428836","5.9.29.183","172.19.0.3","TCP","1516","[TCP segment of a reassembled PDU]"
"10.428985","5.9.29.183","172.19.0.3","TCP","1492","9002 → 43520 [PSH, ACK] Seq=413355 Ack=25377 Win=65535 Len=1436 [TCP segment of a reassembled PDU]"
"10.429027","5.9.29.183","172.19.0.3","TLSv1.2","1516","Application Data [TCP segment of a reassembled PDU]"
"10.429031","5.9.29.183","172.19.0.3","TCP","1516","9002 → 43520 [PSH, ACK] Seq=416251 Ack=25377 Win=65535 Len=1460 [TCP segment of a reassembled PDU]"
"10.429034","5.9.29.183","172.19.0.3","TCP","1480","9002 → 43520 [PSH, ACK] Seq=417711 Ack=25377 Win=65535 Len=1424 [TCP segment of a reassembled PDU]"
"10.429071","172.19.0.3","5.9.29.183","TCP","56","43520 → 9002 [ACK] Seq=25377 Ack=419135 Win=11879 Len=0"
"10.429469","5.9.29.183","172.19.0.3","TLSv1.2","584","Application Data"
"10.445435","5.9.29.183","172.19.0.3","TCP","1504","[TCP segment of a reassembled PDU]"
"10.445493","172.19.0.3","5.9.29.183","TCP","56","43520 → 9002 [ACK] Seq=25377 Ack=421111 Win=11911 Len=0"
"10.445547","5.9.29.183","172.19.0.3","TCP","1516","9002 → 43520 [PSH, ACK] Seq=421111 Ack=25377 Win=65535 Len=1460 [TCP segment of a reassembled PDU]"
"10.445560","5.9.29.183","172.19.0.3","TLSv1.2","1516","Application Data [TCP segment of a reassembled PDU]"
"10.445692","5.9.29.183","172.19.0.3","TCP","1516","9002 → 43520 [PSH, ACK] Seq=424031 Ack=25377 Win=65535 Len=1460 [TCP segment of a reassembled PDU]"
"10.445695","172.19.0.3","5.9.29.183","TCP","56","43520 → 9002 [ACK] Seq=25377 Ack=424031 Win=11895 Len=0"
"10.445697","5.9.29.183","172.19.0.3","TCP","1516","9002 → 43520 [PSH, ACK] Seq=425491 Ack=25377 Win=65535 Len=1460 [TCP segment of a reassembled PDU]"
"10.445699","5.9.29.183","172.19.0.3","TLSv1.2","1189","Application Data [TCP segment of a reassembled PDU]"
"10.445701","5.9.29.183","172.19.0.3","TCP","1516","9002 → 43520 [PSH, ACK] Seq=428084 Ack=25377 Win=65535 Len=1460 [TCP segment of a reassembled PDU]"
"10.445703","5.9.29.183","172.19.0.3","TCP","1516","9002 → 43520 [PSH, ACK] Seq=429544 Ack=25377 Win=65535 Len=1460 [TCP segment of a reassembled PDU]"
"10.445829","5.9.29.183","172.19.0.3","TLSv1.2","1516","Application Data [TCP segment of a reassembled PDU]"
"10.445837","5.9.29.183","172.19.0.3","TCP","1516","9002 → 43520 [PSH, ACK] Seq=432464 Ack=25377 Win=65535 Len=1460 [TCP segment of a reassembled PDU]"
"10.445871","172.19.0.3","5.9.29.183","TCP","56","43520 → 9002 [ACK] Seq=25377 Ack=431004 Win=11855 Len=0"
"10.445897","5.9.29.183","172.19.0.3","TCP","1456","9002 → 43520 [PSH, ACK] Seq=433924 Ack=25377 Win=65535 Len=1400 [TCP segment of a reassembled PDU]"
"10.446094","172.19.0.3","5.9.29.183","TCP","56","43520 → 9002 [ACK] Seq=25377 Ack=435324 Win=11830 Len=0"
"10.461546","5.9.29.183","172.19.0.3","TLSv1.2","988","Application Data, Application Data"
"10.462138","172.19.0.3","5.9.29.183","TLSv1.2","1113","Application Data"
"10.462478","5.9.29.183","172.19.0.3","TCP","56","9002 → 43520 [ACK] Seq=436256 Ack=26434 Win=65535 Len=0"
"10.480758","5.9.29.183","172.19.0.3","TCP","1516","[TCP segment of a reassembled PDU]"
"10.480821","5.9.29.183","172.19.0.3","TLSv1.2","167","Application Data"
"10.481007","172.19.0.3","5.9.29.183","TCP","56","43520 → 9002 [ACK] Seq=26434 Ack=437827 Win=11901 Len=0"
"10.485510","172.19.0.3","5.9.29.183","TLSv1.2","599","Application Data"
"10.485789","5.9.29.183","172.19.0.3","TCP","56","9002 → 43520 [ACK] Seq=437827 Ack=26977 Win=65535 Len=0"
"10.788199","5.9.29.183","172.19.0.3","TLSv1.2","599","Application Data"
"10.789087","172.19.0.3","5.9.29.183","TLSv1.2","599","Application Data"
"10.789444","5.9.29.183","172.19.0.3","TCP","56","9002 → 43520 [ACK] Seq=438370 Ack=27520 Win=65535 Len=0"
"11.147958","5.9.29.183","172.19.0.3","TCP","1504","[TCP segment of a reassembled PDU]"
"11.148685","5.9.29.183","172.19.0.3","TCP","1504","9002 → 43520 [PSH, ACK] Seq=439818 Ack=27520 Win=65535 Len=1448 [TCP segment of a reassembled PDU]"
"11.148700","172.19.0.3","5.9.29.183","TCP","56","43520 → 9002 [ACK] Seq=27520 Ack=441266 Win=11911 Len=0"
"11.148744","5.9.29.183","172.19.0.3","TLSv1.2","787","Application Data"
"11.158914","5.9.29.183","172.19.0.3","TCP","1516","[TCP segment of a reassembled PDU]"
"11.158934","172.19.0.3","5.9.29.183","TCP","56","43520 → 9002 [ACK] Seq=27520 Ack=443457 Win=11911 Len=0"
"11.158978","5.9.29.183","172.19.0.3","TCP","1516","9002 → 43520 [PSH, ACK] Seq=443457 Ack=27520 Win=65535 Len=1460 [TCP segment of a reassembled PDU]"
"11.158987","5.9.29.183","172.19.0.3","TLSv1.2","1516","Application Data [TCP segment of a reassembled PDU]"
"11.158990","5.9.29.183","172.19.0.3","TCP","1468","9002 → 43520 [PSH, ACK] Seq=446377 Ack=27520 Win=65535 Len=1412 [TCP segment of a reassembled PDU]"
"11.158996","5.9.29.183","172.19.0.3","TCP","1504","9002 → 43520 [PSH, ACK] Seq=447789 Ack=27520 Win=65535 Len=1448 [TCP segment of a reassembled PDU]"
"11.159123","172.19.0.3","5.9.29.183","TCP","56","43520 → 9002 [ACK] Seq=27520 Ack=449237 Win=11877 Len=0"
"11.164426","5.9.29.183","172.19.0.3","TLSv1.2","584","Application Data"
"11.189427","5.9.29.183","172.19.0.3","TCP","1516","[TCP segment of a reassembled PDU]"
"11.189452","172.19.0.3","5.9.29.183","TCP","56","43520 → 9002 [ACK] Seq=27520 Ack=451225 Win=11911 Len=0"
"11.189511","5.9.29.183","172.19.0.3","TCP","1516","9002 → 43520 [PSH, ACK] Seq=451225 Ack=27520 Win=65535 Len=1460 [TCP segment of a reassembled PDU]"
"11.189528","5.9.29.183","172.19.0.3","TLSv1.2","1213","Application Data"
"11.189709","172.19.0.3","5.9.29.183","TCP","56","43520 → 9002 [ACK] Seq=27520 Ack=453842 Win=11895 Len=0"
"11.198135","5.9.29.183","172.19.0.3","TLSv1.2","1504","Application Data"
"11.198237","5.9.29.183","172.19.0.3","TCP","1516","9002 → 43520 [PSH, ACK] Seq=455290 Ack=27520 Win=65535 Len=1460 [TCP segment of a reassembled PDU]"
"11.198257","172.19.0.3","5.9.29.183","TCP","56","43520 → 9002 [ACK] Seq=27520 Ack=456750 Win=11903 Len=0"
"11.198261","5.9.29.183","172.19.0.3","TLSv1.2","1516","Application Data [TCP segment of a reassembled PDU]"
"11.198265","5.9.29.183","172.19.0.3","TCP","1516","9002 → 43520 [PSH, ACK] Seq=458210 Ack=27520 Win=65535 Len=1460 [TCP segment of a reassembled PDU]"
"11.198335","5.9.29.183","172.19.0.3","TCP","1468","9002 → 43520 [PSH, ACK] Seq=459670 Ack=27520 Win=65535 Len=1412 [TCP segment of a reassembled PDU]"
"11.198348","172.19.0.3","5.9.29.183","TCP","56","43520 → 9002 [ACK] Seq=27520 Ack=459670 Win=11887 Len=0"
"11.198539","5.9.29.183","172.19.0.3","TLSv1.2","1516","Application Data [TCP segment of a reassembled PDU]"
"11.198544","5.9.29.183","172.19.0.3","TCP","1492","9002 → 43520 [PSH, ACK] Seq=462542 Ack=27520 Win=65535 Len=1436 [TCP segment of a reassembled PDU]"
"11.198567","172.19.0.3","5.9.29.183","TCP","56","43520 → 9002 [ACK] Seq=27520 Ack=463978 Win=11863 Len=0"
"11.204638","5.9.29.183","172.19.0.3","TCP","1516","9002 → 43520 [PSH, ACK] Seq=463978 Ack=27520 Win=65535 Len=1460 [TCP segment of a reassembled PDU]"
"11.204703","5.9.29.183","172.19.0.3","TLSv1.2","462","Application Data"
"11.204722","172.19.0.3","5.9.29.183","TCP","56","43520 → 9002 [ACK] Seq=27520 Ack=465844 Win=11903 Len=0"
"11.205121","172.19.0.3","5.9.29.183","TLSv1.2","599","Application Data"
"11.205438","5.9.29.183","172.19.0.3","TCP","56","9002 → 43520 [ACK] Seq=465844 Ack=28063 Win=65535 Len=0"
"11.242570","5.9.29.183","172.19.0.3","TCP","1516","[TCP segment of a reassembled PDU]"
"11.242636","5.9.29.183","172.19.0.3","TLSv1.2","1195","Application Data"
"11.242893","172.19.0.3","5.9.29.183","TCP","56","43520 → 9002 [ACK] Seq=28063 Ack=468443 Win=11903 Len=0"
"11.247440","172.19.0.3","5.9.29.183","TLSv1.2","599","Application Data"
"11.247825","5.9.29.183","172.19.0.3","TCP","56","9002 → 43520 [ACK] Seq=468443 Ack=28606 Win=65535 Len=0"
"11.542204","5.9.29.183","172.19.0.3","TLSv1.2","599","Application Data"
"11.542788","172.19.0.3","5.9.29.183","TLSv1.2","599","Application Data"
"11.543155","5.9.29.183","172.19.0.3","TCP","56","9002 → 43520 [ACK] Seq=468986 Ack=29149 Win=65535 Len=0"
"11.821026","5.9.29.183","172.19.0.3","TLSv1.2","599","Application Data"
"11.842565","5.9.29.183","172.19.0.3","TCP","1516","[TCP segment of a reassembled PDU]"
"11.842587","172.19.0.3","5.9.29.183","TCP","56","43520 → 9002 [ACK] Seq=29149 Ack=470989 Win=11911 Len=0"
"11.842646","5.9.29.183","172.19.0.3","TCP","1516","9002 → 43520 [PSH, ACK] Seq=470989 Ack=29149 Win=65535 Len=1460 [TCP segment of a reassembled PDU]"
"11.842660","5.9.29.183","172.19.0.3","TLSv1.2","1213","Application Data"
"11.842664","5.9.29.183","172.19.0.3","TCP","1516","[TCP segment of a reassembled PDU]"
"11.842667","5.9.29.183","172.19.0.3","TCP","299","9002 → 43520 [PSH, ACK] Seq=475066 Ack=29149 Win=65535 Len=243 [TCP segment of a reassembled PDU]"
"11.842736","5.9.29.183","172.19.0.3","TCP","1249","9002 → 43520 [PSH, ACK] Seq=475309 Ack=29149 Win=65535 Len=1193 [TCP segment of a reassembled PDU]"
"11.842897","172.19.0.3","5.9.29.183","TCP","56","43520 → 9002 [ACK] Seq=29149 Ack=476502 Win=11869 Len=0"
"11.857974","5.9.29.183","172.19.0.3","TLSv1.2","337","Application Data"
"11.869171","5.9.29.183","172.19.0.3","TCP","1516","[TCP segment of a reassembled PDU]"
"11.869193","172.19.0.3","5.9.29.183","TCP","56","43520 → 9002 [ACK] Seq=29149 Ack=478243 Win=11911 Len=0"
"11.869245","5.9.29.183","172.19.0.3","TCP","1492","9002 → 43520 [PSH, ACK] Seq=478243 Ack=29149 Win=65535 Len=1436 [TCP segment of a reassembled PDU]"
"11.869390","5.9.29.183","172.19.0.3","TLSv1.2","1516","Application Data [TCP segment of a reassembled PDU]"
"11.869405","5.9.29.183","172.19.0.3","TCP","1516","9002 → 43520 [PSH, ACK] Seq=481139 Ack=29149 Win=65535 Len=1460 [TCP segment of a reassembled PDU]"
"11.869489","5.9.29.183","172.19.0.3","TCP","1480","9002 → 43520 [PSH, ACK] Seq=482599 Ack=29149 Win=65535 Len=1424 [TCP segment of a reassembled PDU]"
"11.869533","172.19.0.3","5.9.29.183","TCP","56","43520 → 9002 [ACK] Seq=29149 Ack=482599 Win=11887 Len=0"
"11.873292","5.9.29.183","172.19.0.3","TLSv1.2","584","Application Data"
"11.873318","172.19.0.3","5.9.29.183","TCP","56","43520 → 9002 [ACK] Seq=29149 Ack=484551 Win=11911 Len=0"
"11.883526","5.9.29.183","172.19.0.3","TCP","1516","[TCP segment of a reassembled PDU]"
"11.883605","5.9.29.183","172.19.0.3","TCP","1516","9002 → 43520 [PSH, ACK] Seq=486011 Ack=29149 Win=65535 Len=1460 [TCP segment of a reassembled PDU]"
"11.883616","5.9.29.183","172.19.0.3","TLSv1.2","1516","Application Data [TCP segment of a reassembled PDU]"
"11.883620","5.9.29.183","172.19.0.3","TCP","1468","9002 → 43520 [PSH, ACK] Seq=488931 Ack=29149 Win=65535 Len=1412 [TCP segment of a reassembled PDU]"
"11.883766","172.19.0.3","5.9.29.183","TCP","56","43520 → 9002 [ACK] Seq=29149 Ack=490343 Win=11887 Len=0"
"11.884508","5.9.29.183","172.19.0.3","TCP","1516","9002 → 43520 [PSH, ACK] Seq=490343 Ack=29149 Win=65535 Len=1460 [TCP segment of a reassembled PDU]"
"11.884557","5.9.29.183","172.19.0.3","TLSv1.2","1492","Application Data [TCP segment of a reassembled PDU]"
"11.884569","172.19.0.3","5.9.29.183","TCP","56","43520 → 9002 [ACK] Seq=29149 Ack=493239 Win=11903 Len=0"
"11.884572","5.9.29.183","172.19.0.3","TCP","1504","9002 → 43520 [PSH, ACK] Seq=493239 Ack=29149 Win=65535 Len=1448 [TCP segment of a reassembled PDU]"
"11.884898","172.19.0.3","5.9.29.183","TLSv1.2","599","Application Data"
"11.885164","5.9.29.183","172.19.0.3","TCP","56","9002 → 43520 [ACK] Seq=494687 Ack=29692 Win=65535 Len=0"
"11.888736","5.9.29.183","172.19.0.3","TLSv1.2","1315","Application Data"
"11.896220","172.19.0.3","5.9.29.183","TLSv1.2","599","Application Data"
"11.896718","5.9.29.183","172.19.0.3","TCP","56","9002 → 43520 [ACK] Seq=495946 Ack=30235 Win=65535 Len=0"
"11.900414","5.9.29.183","172.19.0.3","TCP","1516","[TCP segment of a reassembled PDU]"
"11.900482","5.9.29.183","172.19.0.3","TCP","1492","9002 → 43520 [PSH, ACK] Seq=497406 Ack=30235 Win=65535 Len=1436 [TCP segment of a reassembled PDU]"
"11.900606","172.19.0.3","5.9.29.183","TCP","56","43520 → 9002 [ACK] Seq=30235 Ack=498842 Win=11903 Len=0"
"11.903484","5.9.29.183","172.19.0.3","TLSv1.2","787","Application Data"
"11.912667","5.9.29.183","172.19.0.3","TCP","1504","[TCP segment of a reassembled PDU]"
"11.912690","172.19.0.3","5.9.29.183","TCP","56","43520 → 9002 [ACK] Seq=30235 Ack=501021 Win=11911 Len=0"
"11.912851","5.9.29.183","172.19.0.3","TCP","1516","9002 → 43520 [PSH, ACK] Seq=501021 Ack=30235 Win=65535 Len=1460 [TCP segment of a reassembled PDU]"
"11.912861","5.9.29.183","172.19.0.3","TLSv1.2","1492","Application Data [TCP segment of a reassembled PDU]"
"11.912900","172.19.0.3","5.9.29.183","TCP","56","43520 → 9002 [ACK] Seq=30235 Ack=503917 Win=11895 Len=0"
"11.912970","5.9.29.183","172.19.0.3","TCP","1516","9002 → 43520 [PSH, ACK] Seq=503917 Ack=30235 Win=65535 Len=1460 [TCP segment of a reassembled PDU]"
"11.913019","5.9.29.183","172.19.0.3","TCP","1516","9002 → 43520 [PSH, ACK] Seq=505377 Ack=30235 Win=65535 Len=1460 [TCP segment of a reassembled PDU]"
"11.913030","5.9.29.183","172.19.0.3","TLSv1.2","1516","Application Data [TCP segment of a reassembled PDU]"
"11.913069","5.9.29.183","172.19.0.3","TCP","1516","9002 → 43520 [PSH, ACK] Seq=508297 Ack=30235 Win=65535 Len=1460 [TCP segment of a reassembled PDU]"
"11.913075","5.9.29.183","172.19.0.3","TCP","1456","9002 → 43520 [PSH, ACK] Seq=509757 Ack=30235 Win=65535 Len=1400 [TCP segment of a reassembled PDU]"
"11.913134","172.19.0.3","5.9.29.183","TCP","56","43520 → 9002 [ACK] Seq=30235 Ack=511157 Win=11855 Len=0"
"11.918903","5.9.29.183","172.19.0.3","TLSv1.2","381","Application Data"
"11.925679","5.9.29.183","172.19.0.3","TCP","1516","[TCP segment of a reassembled PDU]"
"11.925700","172.19.0.3","5.9.29.183","TCP","56","43520 → 9002 [ACK] Seq=30235 Ack=512942 Win=11911 Len=0"
"11.925752","5.9.29.183","172.19.0.3","TCP","1492","9002 → 43520 [PSH, ACK] Seq=512942 Ack=30235 Win=65535 Len=1436 [TCP segment of a reassembled PDU]"
"11.933884","5.9.29.183","172.19.0.3","TLSv1.2","1330","Application Data, Application Data"
"11.933908","172.19.0.3","5.9.29.183","TCP","56","43520 → 9002 [ACK] Seq=30235 Ack=515652 Win=11911 Len=0"
"11.950108","5.9.29.183","172.19.0.3","TLSv1.2","1113","Application Data"
"11.961053","5.9.29.183","172.19.0.3","TCP","1504","[TCP segment of a reassembled PDU]"
"11.961080","172.19.0.3","5.9.29.183","TCP","56","43520 → 9002 [ACK] Seq=30235 Ack=518157 Win=11911 Len=0"
"11.966051","5.9.29.183","172.19.0.3","TLSv1.2","1207","Application Data"
"11.970452","172.19.0.3","5.9.29.183","TLSv1.2","599","Application Data"
"11.970753","5.9.29.183","172.19.0.3","TCP","56","9002 → 43520 [ACK] Seq=519308 Ack=30778 Win=65535 Len=0"
"12.290190","5.9.29.183","172.19.0.3","TLSv1.2","599","Application Data"
"12.291080","172.19.0.3","5.9.29.183","TLSv1.2","599","Application Data"
"12.291396","5.9.29.183","172.19.0.3","TCP","56","9002 → 43520 [ACK] Seq=519851 Ack=31321 Win=65535 Len=0"
"12.606886","5.9.29.183","172.19.0.3","TCP","1516","[TCP segment of a reassembled PDU]"
"12.606999","5.9.29.183","172.19.0.3","TCP","1516","9002 → 43520 [PSH, ACK] Seq=521311 Ack=31321 Win=65535 Len=1460 [TCP segment of a reassembled PDU]"
"12.607015","5.9.29.183","172.19.0.3","TLSv1.2","763","Application Data"
"12.607158","172.19.0.3","5.9.29.183","TCP","56","43520 → 9002 [ACK] Seq=31321 Ack=523478 Win=11895 Len=0"
"12.621378","5.9.29.183","172.19.0.3","TCP","1516","[TCP segment of a reassembled PDU]"
"12.621427","5.9.29.183","172.19.0.3","TCP","1492","9002 → 43520 [PSH, ACK] Seq=524938 Ack=31321 Win=65535 Len=1436 [TCP segment of a reassembled PDU]"
"12.621453","172.19.0.3","5.9.29.183","TCP","56","43520 → 9002 [ACK] Seq=31321 Ack=526374 Win=11903 Len=0"
"12.622218","5.9.29.183","172.19.0.3","TLSv1.2","787","Application Data"
"12.645918","5.9.29.183","172.19.0.3","TCP","1516","[TCP segment of a reassembled PDU]"
"12.645941","172.19.0.3","5.9.29.183","TCP","56","43520 → 9002 [ACK] Seq=31321 Ack=528565 Win=11911 Len=0"
"12.645996","5.9.29.183","172.19.0.3","TCP","1492","9002 → 43520 [PSH, ACK] Seq=528565 Ack=31321 Win=65535 Len=1436 [TCP segment of a reassembled PDU]"
"12.646092","5.9.29.183","172.19.0.3","TLSv1.2","1516","Application Data [TCP segment of a reassembled PDU]"
"12.646102","5.9.29.183","172.19.0.3","TCP","1516","9002 → 43520 [PSH, ACK] Seq=531461 Ack=31321 Win=65535 Len=1460 [TCP segment of a reassembled PDU]"
"12.646111","5.9.29.183","172.19.0.3","TCP","1213","9002 → 43520 [PSH, ACK] Seq=532921 Ack=31321 Win=65535 Len=1157 [TCP segment of a reassembled PDU]"
"12.646174","5.9.29.183","172.19.0.3","TLSv1.2","1516","Application Data [TCP segment of a reassembled PDU]"
"12.646204","172.19.0.3","5.9.29.183","TCP","56","43520 → 9002 [ACK] Seq=31321 Ack=534078 Win=11877 Len=0"
"12.646258","5.9.29.183","172.19.0.3","TCP","1516","9002 → 43520 [PSH, ACK] Seq=535538 Ack=31321 Win=65535 Len=1460 [TCP segment of a reassembled PDU]"
"12.646262","5.9.29.183","172.19.0.3","TCP","1480","9002 → 43520 [PSH, ACK] Seq=536998 Ack=31321 Win=65535 Len=1424 [TCP segment of a reassembled PDU]"
"12.646283","172.19.0.3","5.9.29.183","TCP","56","43520 → 9002 [ACK] Seq=31321 Ack=538422 Win=11853 Len=0"
"12.659422","5.9.29.183","172.19.0.3","TLSv1.2","1516","Application Data [TCP segment of a reassembled PDU]"
"12.659501","5.9.29.183","172.19.0.3","TCP","1019","9002 → 43520 [PSH, ACK] Seq=539882 Ack=31321 Win=65535 Len=963 [TCP segment of a reassembled PDU]"
"12.659517","172.19.0.3","5.9.29.183","TCP","56","43520 → 9002 [ACK] Seq=31321 Ack=540845 Win=11903 Len=0"
"12.659520","5.9.29.183","172.19.0.3","TCP","529","9002 → 43520 [PSH, ACK] Seq=540845 Ack=31321 Win=65535 Len=473 [TCP segment of a reassembled PDU]"
"12.661225","5.9.29.183","172.19.0.3","TCP","1516","9002 → 43520 [PSH, ACK] Seq=541318 Ack=31321 Win=65535 Len=1460 [TCP segment of a reassembled PDU]"
"12.661262","172.19.0.3","5.9.29.183","TCP","56","43520 → 9002 [ACK] Seq=31321 Ack=542778 Win=11911 Len=0"
"12.661305","5.9.29.183","172.19.0.3","TLSv1.2","1492","Application Data [TCP segment of a reassembled PDU]"
"12.661651","172.19.0.3","5.9.29.183","TLSv1.2","599","Application Data"
"12.661884","5.9.29.183","172.19.0.3","TCP","56","9002 → 43520 [ACK] Seq=544214 Ack=31864 Win=65535 Len=0"
"12.662881","5.9.29.183","172.19.0.3","TCP","1516","9002 → 43520 [PSH, ACK] Seq=544214 Ack=31864 Win=65535 Len=1460 [TCP segment of a reassembled PDU]"
"12.662968","5.9.29.183","172.19.0.3","TCP","1516","9002 → 43520 [PSH, ACK] Seq=545674 Ack=31864 Win=65535 Len=1460 [TCP segment of a reassembled PDU]"
"12.662976","172.19.0.3","5.9.29.183","TCP","56","43520 → 9002 [ACK] Seq=31864 Ack=547134 Win=11903 Len=0"
"12.662978","5.9.29.183","172.19.0.3","TLSv1.2","761","Application Data, Application Data"
"12.673776","172.19.0.3","5.9.29.183","TLSv1.2","599","Application Data"
"12.674292","5.9.29.183","172.19.0.3","TCP","56","9002 → 43520 [ACK] Seq=547839 Ack=32407 Win=65535 Len=0"
"12.685075","5.9.29.183","172.19.0.3","TCP","1516","[TCP segment of a reassembled PDU]"
"12.685145","5.9.29.183","172.19.0.3","TCP","1516","9002 → 43520 [PSH, ACK] Seq=549299 Ack=32407 Win=65535 Len=1460 [TCP segment of a reassembled PDU]"
"12.685186","5.9.29.183","172.19.0.3","TLSv1.2","1213","Application Data"
"12.685207","5.9.29.183","172.19.0.3","TCP","1516","[TCP segment of a reassembled PDU]"
"12.685301","172.19.0.3","5.9.29.183","TCP","56","43520 → 9002 [ACK] Seq=32407 Ack=553376 Win=11887 Len=0"
"12.685323","5.9.29.183","172.19.0.3","TCP","1516","9002 → 43520 [PSH, ACK] Seq=553376 Ack=32407 Win=65535 Len=1460 [TCP segment of a reassembled PDU]"
"12.685328","5.9.29.183","172.19.0.3","TLSv1.2","1516","Application Data [TCP segment of a reassembled PDU]"
"12.685398","5.9.29.183","172.19.0.3","TCP","1516","9002 → 43520 [PSH, ACK] Seq=556296 Ack=32407 Win=65535 Len=1460 [TCP segment of a reassembled PDU]"
"12.685402","5.9.29.183","172.19.0.3","TCP","1516","9002 → 43520 [PSH, ACK] Seq=557756 Ack=32407 Win=65535 Len=1460 [TCP segment of a reassembled PDU]"
"12.685412","172.19.0.3","5.9.29.183","TCP","56","43520 → 9002 [ACK] Seq=32407 Ack=556296 Win=11869 Len=0"
"12.685475","5.9.29.183","172.19.0.3","TLSv1.2","1516","Application Data [TCP segment of a reassembled PDU]"
"12.685482","5.9.29.183","172.19.0.3","TCP","1432","9002 → 43520 [PSH, ACK] Seq=560676 Ack=32407 Win=65535 Len=1376 [TCP segment of a reassembled PDU]"
"12.685611","172.19.0.3","5.9.29.183","TCP","56","43520 → 9002 [ACK] Seq=32407 Ack=562052 Win=11836 Len=0"
"12.695804","5.9.29.183","172.19.0.3","TLSv1.2","1516","Application Data [TCP segment of a reassembled PDU]"
"12.695883","5.9.29.183","172.19.0.3","TCP","1492","9002 → 43520 [PSH, ACK] Seq=563512 Ack=32407 Win=65535 Len=1436 [TCP segment of a reassembled PDU]"
"12.695908","172.19.0.3","5.9.29.183","TCP","56","43520 → 9002 [ACK] Seq=32407 Ack=564948 Win=11903 Len=0"
"12.700473","5.9.29.183","172.19.0.3","TCP","1516","9002 → 43520 [PSH, ACK] Seq=564948 Ack=32407 Win=65535 Len=1460 [TCP segment of a reassembled PDU]"
"12.700542","5.9.29.183","172.19.0.3","TLSv1.2","1492","Application Data [TCP segment of a reassembled PDU]"
"12.700559","172.19.0.3","5.9.29.183","TCP","56","43520 → 9002 [ACK] Seq=32407 Ack=567844 Win=11903 Len=0"
"12.700562","5.9.29.183","172.19.0.3","TCP","1516","9002 → 43520 [PSH, ACK] Seq=567844 Ack=32407 Win=65535 Len=1460 [TCP segment of a reassembled PDU]"
"12.700566","5.9.29.183","172.19.0.3","TLSv1.2","1381","Application Data"
"12.700684","172.19.0.3","5.9.29.183","TCP","56","43520 → 9002 [ACK] Seq=32407 Ack=570629 Win=11887 Len=0"
"12.719992","5.9.29.183","172.19.0.3","TCP","1516","[TCP segment of a reassembled PDU]"
"12.720100","5.9.29.183","172.19.0.3","TCP","1516","9002 → 43520 [PSH, ACK] Seq=572089 Ack=32407 Win=65535 Len=1460 [TCP segment of a reassembled PDU]"
"12.720119","172.19.0.3","5.9.29.183","TCP","56","43520 → 9002 [ACK] Seq=32407 Ack=573549 Win=11903 Len=0"
"12.720122","5.9.29.183","172.19.0.3","TLSv1.2","1213","Application Data"
"12.720126","5.9.29.183","172.19.0.3","TCP","1516","[TCP segment of a reassembled PDU]"
"12.720195","5.9.29.183","172.19.0.3","TCP","1492","9002 → 43520 [PSH, ACK] Seq=576166 Ack=32407 Win=65535 Len=1436 [TCP segment of a reassembled PDU]"
"12.720250","172.19.0.3","5.9.29.183","TCP","56","43520 → 9002 [ACK] Seq=32407 Ack=577602 Win=11879 Len=0"
"12.720518","172.19.0.3","5.9.29.183","TLSv1.2","599","Application Data"
"12.720773","5.9.29.183","172.19.0.3","TCP","56","9002 → 43520 [ACK] Seq=577602 Ack=32950 Win=65535 Len=0"
"12.735601","5.9.29.183","172.19.0.3","TLSv1.2","1394","Application Data, Application Data"
"12.776821","172.19.0.3","5.9.29.183","TCP","56","43520 → 9002 [ACK] Seq=32950 Ack=578940 Win=11911 Len=0"
