_ws.col.Time,_ws.col.Source,_ws.col.Destination,_ws.col.Protocol,_ws.col.Length,_ws.col.Info
"0.000000","172.18.0.2","54.38.73.16","TLSv1.2","611","Application Data"
"0.025623","54.38.73.16","172.18.0.2","TCP","68","21002 → 36876 [ACK] Seq=1 Ack=544 Win=1452 Len=0 TSval=2675926394 TSecr=1087108901"
"0.373062","54.38.73.16","172.18.0.2","TLSv1.2","611","Application Data"
"0.374282","172.18.0.2","54.38.73.16","TLSv1.2","2153","Application Data"
"0.398444","54.38.73.16","172.18.0.2","TCP","68","21002 → 36876 [ACK] Seq=544 Ack=2629 Win=1450 Len=0 TSval=2675926487 TSecr=1087109275"
"0.873513","54.38.73.16","172.18.0.2","TLSv1.2","191","[TCP Previous segment not captured] , Ignored Unknown Record"
"0.873584","172.18.0.2","54.38.73.16","TCP","80","[TCP Dup ACK 4#1] 36876 → 21002 [ACK] Seq=2629 Ack=544 Win=5612 Len=0 TSval=1087109775 TSecr=2675926487 SLE=1992 SRE=2115"
"0.873536","54.38.73.16","172.18.0.2","TCP","1639","[TCP Retransmission] 21002 → 36876 [PSH, ACK] Seq=544 Ack=2629 Win=1452 Len=1571 TSval=2675926565 TSecr=1087109275"
"0.873612","172.18.0.2","54.38.73.16","TCP","80","36876 → 21002 [ACK] Seq=2629 Ack=2115 Win=5600 Len=0 TSval=1087109775 TSecr=2675926565 SLE=1992 SRE=2115"
"0.881184","172.18.0.2","54.38.73.16","TLSv1.2","611","Application Data"
"0.905642","54.38.73.16","172.18.0.2","TCP","68","21002 → 36876 [ACK] Seq=2115 Ack=3172 Win=1452 Len=0 TSval=2675926614 TSecr=1087109782"
"1.281611","54.38.73.16","172.18.0.2","TLSv1.2","611","Application Data"
"1.282640","172.18.0.2","54.38.73.16","TLSv1.2","611","Application Data"
"1.307336","54.38.73.16","172.18.0.2","TCP","68","21002 → 36876 [ACK] Seq=2658 Ack=3715 Win=1452 Len=0 TSval=2675926714 TSecr=1087110184"
"1.513819","54.38.73.16","172.18.0.2","TLSv1.2","611","Application Data"
"1.523941","54.38.73.16","172.18.0.2","TCP","2964","[TCP segment of a reassembled PDU]"
"1.524091","172.18.0.2","54.38.73.16","TCP","68","36876 → 21002 [ACK] Seq=3715 Ack=6097 Win=5596 Len=0 TSval=1087110425 TSecr=2675926766"
"1.533668","54.38.73.16","172.18.0.2","TLSv1.2","2964","Application Data [TCP segment of a reassembled PDU]"
"1.533701","172.18.0.2","54.38.73.16","TCP","68","36876 → 21002 [ACK] Seq=3715 Ack=8993 Win=5596 Len=0 TSval=1087110435 TSecr=2675926771"
"1.549145","54.38.73.16","172.18.0.2","TLSv1.2","2073","Application Data, Application Data"
"1.549178","172.18.0.2","54.38.73.16","TCP","68","36876 → 21002 [ACK] Seq=3715 Ack=10998 Win=5599 Len=0 TSval=1087110450 TSecr=2675926774"
"1.574696","54.38.73.16","172.18.0.2","TLSv1.2","4145","Application Data"
"1.574702","54.38.73.16","172.18.0.2","TLSv1.2","4412","Application Data"
"1.574852","172.18.0.2","54.38.73.16","TCP","68","36876 → 21002 [ACK] Seq=3715 Ack=19419 Win=5567 Len=0 TSval=1087110476 TSecr=2675926781"
"1.601133","54.38.73.16","172.18.0.2","TLSv1.2","8269","Application Data, Application Data, Application Data, Application Data"
"1.601168","172.18.0.2","54.38.73.16","TCP","68","36876 → 21002 [ACK] Seq=3715 Ack=27620 Win=5568 Len=0 TSval=1087110502 TSecr=2675926787"
"1.625438","54.38.73.16","172.18.0.2","TLSv1.2","7322","Application Data, Application Data"
"1.625515","172.18.0.2","54.38.73.16","TCP","68","36876 → 21002 [ACK] Seq=3715 Ack=34874 Win=5571 Len=0 TSval=1087110527 TSecr=2675926794"
"1.626025","172.18.0.2","54.38.73.16","TLSv1.2","611","Application Data"
"1.651016","54.38.73.16","172.18.0.2","TCP","68","21002 → 36876 [ACK] Seq=34874 Ack=4258 Win=1452 Len=0 TSval=2675926800 TSecr=1087110527"
"1.651061","172.18.0.2","54.38.73.16","TLSv1.2","611","Application Data"
"1.675624","54.38.73.16","172.18.0.2","TCP","68","21002 → 36876 [ACK] Seq=34874 Ack=4801 Win=1452 Len=0 TSval=2675926806 TSecr=1087110552"
"1.998045","54.38.73.16","172.18.0.2","TLSv1.2","611","Application Data"
"1.999051","172.18.0.2","54.38.73.16","TLSv1.2","611","Application Data"
"2.022774","54.38.73.16","172.18.0.2","TCP","68","21002 → 36876 [ACK] Seq=35417 Ack=5344 Win=1452 Len=0 TSval=2675926893 TSecr=1087110900"
"2.343894","54.38.73.16","172.18.0.2","TLSv1.2","611","Application Data"
"2.352743","54.38.73.16","172.18.0.2","TLSv1.2","4412","Application Data"
"2.352893","172.18.0.2","54.38.73.16","TCP","68","36876 → 21002 [ACK] Seq=5344 Ack=40304 Win=5580 Len=0 TSval=1087111254 TSecr=2675926973"
"2.352998","54.38.73.16","172.18.0.2","TCP","2964","21002 → 36876 [ACK] Seq=40304 Ack=5344 Win=1452 Len=2896 TSval=2675926975 TSecr=1087110900 [TCP segment of a reassembled PDU]"
"2.353393","172.18.0.2","54.38.73.16","TLSv1.2","611","Application Data"
"2.377765","54.38.73.16","172.18.0.2","TCP","68","[TCP Previous segment not captured] 21002 → 36876 [ACK] Seq=46327 Ack=5887 Win=1452 Len=0 TSval=2675926982 TSecr=1087111254"
"2.377784","54.38.73.16","172.18.0.2","TCP","3195","[TCP Retransmission] 21002 → 36876 [PSH, ACK] Seq=43200 Ack=5344 Win=1452 Len=3127 TSval=2675926982 TSecr=1087111254"
"2.377827","172.18.0.2","54.38.73.16","TCP","68","36876 → 21002 [ACK] Seq=5887 Ack=46327 Win=5593 Len=0 TSval=1087111279 TSecr=2675926982"
"2.385804","54.38.73.16","172.18.0.2","TCP","1516","[TCP segment of a reassembled PDU]"
"2.398483","54.38.73.16","172.18.0.2","TLSv1.2","2964","Application Data [TCP segment of a reassembled PDU]"
"2.398515","172.18.0.2","54.38.73.16","TCP","68","36876 → 21002 [ACK] Seq=5887 Ack=50671 Win=5596 Len=0 TSval=1087111300 TSecr=2675926984"
"2.402647","54.38.73.16","172.18.0.2","TLSv1.2","2964","Application Data [TCP segment of a reassembled PDU]"
"2.402679","172.18.0.2","54.38.73.16","TCP","68","36876 → 21002 [ACK] Seq=5887 Ack=53567 Win=5596 Len=0 TSval=1087111304 TSecr=2675926988"
"2.413430","54.38.73.16","172.18.0.2","TCP","1516","21002 → 36876 [ACK] Seq=53567 Ack=5887 Win=1452 Len=1448 TSval=2675926991 TSecr=1087111279 [TCP segment of a reassembled PDU]"
"2.422940","54.38.73.16","172.18.0.2","TLSv1.2","4412","Application Data, Application Data"
"2.423084","172.18.0.2","54.38.73.16","TCP","68","36876 → 21002 [ACK] Seq=5887 Ack=59359 Win=5580 Len=0 TSval=1087111324 TSecr=2675926991"
"2.435725","54.38.73.16","172.18.0.2","TCP","2964","21002 → 36876 [ACK] Seq=59359 Ack=5887 Win=1452 Len=2896 TSval=2675926996 TSecr=1087111304 [TCP segment of a reassembled PDU]"
"2.435757","172.18.0.2","54.38.73.16","TCP","68","36876 → 21002 [ACK] Seq=5887 Ack=62255 Win=5596 Len=0 TSval=1087111337 TSecr=2675926996"
"2.448338","54.38.73.16","172.18.0.2","TLSv1.2","762","Application Data, Application Data"
"2.448793","172.18.0.2","54.38.73.16","TLSv1.2","611","Application Data"
"2.514234","54.38.73.16","172.18.0.2","TCP","68","21002 → 36876 [ACK] Seq=62949 Ack=6430 Win=1452 Len=0 TSval=2675927016 TSecr=1087111350"
"2.514277","172.18.0.2","54.38.73.16","TLSv1.2","611","Application Data"
"2.538735","54.38.73.16","172.18.0.2","TCP","68","21002 → 36876 [ACK] Seq=62949 Ack=6973 Win=1452 Len=0 TSval=2675927022 TSecr=1087111415"
"2.817290","54.38.73.16","172.18.0.2","TLSv1.2","611","Application Data"
"2.818349","172.18.0.2","54.38.73.16","TLSv1.2","611","Application Data"
"2.841890","54.38.73.16","172.18.0.2","TCP","68","21002 → 36876 [ACK] Seq=63492 Ack=7516 Win=1452 Len=0 TSval=2675927098 TSecr=1087111719"
"3.490741","54.38.73.16","172.18.0.2","TLSv1.2","4145","Application Data"
"3.490747","54.38.73.16","172.18.0.2","TLSv1.2","5860","Application Data"
"3.490909","172.18.0.2","54.38.73.16","TCP","68","36876 → 21002 [ACK] Seq=7516 Ack=73361 Win=5551 Len=0 TSval=1087112392 TSecr=2675927260"
"3.515496","54.38.73.16","172.18.0.2","TLSv1.2","4412","Application Data [TCP segment of a reassembled PDU]"
"3.515533","172.18.0.2","54.38.73.16","TCP","68","36876 → 21002 [ACK] Seq=7516 Ack=77705 Win=5580 Len=0 TSval=1087112417 TSecr=2675927266"
"3.515843","54.38.73.16","172.18.0.2","TLSv1.2","5018","Application Data, Application Data"
"3.515982","172.18.0.2","54.38.73.16","TCP","68","36876 → 21002 [ACK] Seq=7516 Ack=82655 Win=5553 Len=0 TSval=1087112417 TSecr=2675927266"
"3.540787","54.38.73.16","172.18.0.2","TLSv1.2","9950","Application Data, Application Data, Application Data, Application Data"
"3.540951","172.18.0.2","54.38.73.16","TCP","68","36876 → 21002 [ACK] Seq=7516 Ack=92537 Win=5550 Len=0 TSval=1087112442 TSecr=2675927272"
"3.541807","172.18.0.2","54.38.73.16","TLSv1.2","1125","Application Data"
"3.565802","54.38.73.16","172.18.0.2","TLSv1.2","9921","Application Data, Application Data, Application Data"
"3.565839","172.18.0.2","54.38.73.16","TCP","68","36876 → 21002 [ACK] Seq=8573 Ack=102390 Win=5550 Len=0 TSval=1087112467 TSecr=2675927279"
"3.566965","54.38.73.16","172.18.0.2","TCP","68","21002 → 36876 [ACK] Seq=102390 Ack=8573 Win=1452 Len=0 TSval=2675927279 TSecr=1087112443"
"3.591960","54.38.73.16","172.18.0.2","TLSv1.2","9921","Application Data, Application Data, Application Data"
"3.592020","172.18.0.2","54.38.73.16","TCP","68","36876 → 21002 [ACK] Seq=8573 Ack=112243 Win=5550 Len=0 TSval=1087112493 TSecr=2675927285"
"3.616822","54.38.73.16","172.18.0.2","TLSv1.2","9950","Application Data, Application Data, Application Data, Application Data"
"3.616860","172.18.0.2","54.38.73.16","TCP","68","36876 → 21002 [ACK] Seq=8573 Ack=122125 Win=5550 Len=0 TSval=1087112518 TSecr=2675927291"
"3.617310","172.18.0.2","54.38.73.16","TLSv1.2","611","Application Data"
"3.642989","54.38.73.16","172.18.0.2","TLSv1.2","2153","Application Data"
"3.643022","172.18.0.2","54.38.73.16","TCP","68","36876 → 21002 [ACK] Seq=9116 Ack=124210 Win=5599 Len=0 TSval=1087112544 TSecr=2675927298"
"3.667398","54.38.73.16","172.18.0.2","TLSv1.2","611","Application Data"
"3.667443","172.18.0.2","54.38.73.16","TLSv1.2","611","Application Data"
"3.729757","54.38.73.16","172.18.0.2","TCP","68","21002 → 36876 [ACK] Seq=124753 Ack=9659 Win=1452 Len=0 TSval=2675927320 TSecr=1087112568"
"3.729800","172.18.0.2","54.38.73.16","TLSv1.2","611","Application Data"
"3.793443","54.38.73.16","172.18.0.2","TCP","68","21002 → 36876 [ACK] Seq=124753 Ack=10202 Win=1452 Len=0 TSval=2675927336 TSecr=1087112631"
"4.003619","54.38.73.16","172.18.0.2","TLSv1.2","611","Application Data"
"4.004669","172.18.0.2","54.38.73.16","TLSv1.2","611","Application Data"
"4.028636","54.38.73.16","172.18.0.2","TCP","68","21002 → 36876 [ACK] Seq=125296 Ack=10745 Win=1452 Len=0 TSval=2675927395 TSecr=1087112906"
"4.410555","54.38.73.16","172.18.0.2","TLSv1.2","4145","Application Data"
"4.410718","172.18.0.2","54.38.73.16","TCP","68","36876 → 21002 [ACK] Seq=10745 Ack=129373 Win=5581 Len=0 TSval=1087113312 TSecr=2675927490"
"4.421708","54.38.73.16","172.18.0.2","TLSv1.2","2964","Application Data"
"4.421742","172.18.0.2","54.38.73.16","TCP","68","36876 → 21002 [ACK] Seq=10745 Ack=132269 Win=5596 Len=0 TSval=1087113323 TSecr=2675927493"
"4.432226","54.38.73.16","172.18.0.2","TLSv1.2","2964","Application Data [TCP segment of a reassembled PDU]"
"4.432259","172.18.0.2","54.38.73.16","TCP","68","36876 → 21002 [ACK] Seq=10745 Ack=135165 Win=5596 Len=0 TSval=1087113333 TSecr=2675927495"
"4.434940","54.38.73.16","172.18.0.2","TLSv1.2","1623","Application Data"
"4.434972","172.18.0.2","54.38.73.16","TCP","68","36876 → 21002 [ACK] Seq=10745 Ack=136720 Win=5601 Len=0 TSval=1087113336 TSecr=2675927496"
"4.459490","54.38.73.16","172.18.0.2","TLSv1.2","1125","Application Data"
"4.466017","54.38.73.16","172.18.0.2","TCP","2964","[TCP segment of a reassembled PDU]"
"4.466161","172.18.0.2","54.38.73.16","TCP","68","36876 → 21002 [ACK] Seq=10745 Ack=140673 Win=5596 Len=0 TSval=1087113367 TSecr=2675927502"
"4.487184","54.38.73.16","172.18.0.2","TLSv1.2","4412","Application Data [TCP segment of a reassembled PDU]"
"4.487248","172.18.0.2","54.38.73.16","TCP","68","36876 → 21002 [ACK] Seq=10745 Ack=145017 Win=5580 Len=0 TSval=1087113388 TSecr=2675927509"
"4.489628","54.38.73.16","172.18.0.2","TLSv1.2","625","Application Data, Application Data"
"4.489811","172.18.0.2","54.38.73.16","TLSv1.2","611","Application Data"
"4.498285","54.38.73.16","172.18.0.2","TLSv1.2","4412","Application Data"
"4.498361","172.18.0.2","54.38.73.16","TCP","68","36876 → 21002 [ACK] Seq=11288 Ack=149918 Win=5580 Len=0 TSval=1087113399 TSecr=2675927512"
"4.511334","54.38.73.16","172.18.0.2","TCP","2964","21002 → 36876 [ACK] Seq=149918 Ack=10745 Win=1452 Len=2896 TSval=2675927515 TSecr=1087113388 [TCP segment of a reassembled PDU]"
"4.511353","172.18.0.2","54.38.73.16","TCP","68","36876 → 21002 [ACK] Seq=11288 Ack=152814 Win=5596 Len=0 TSval=1087113412 TSecr=2675927515"
"4.515080","54.38.73.16","172.18.0.2","TLSv1.2","2964","Application Data [TCP segment of a reassembled PDU]"
"4.515103","172.18.0.2","54.38.73.16","TCP","68","36876 → 21002 [ACK] Seq=11288 Ack=155710 Win=5596 Len=0 TSval=1087113416 TSecr=2675927516"
"4.515397","172.18.0.2","54.38.73.16","TLSv1.2","611","Application Data"
"4.523683","54.38.73.16","172.18.0.2","TLSv1.2","2964","Application Data [TCP segment of a reassembled PDU]"
"4.523711","172.18.0.2","54.38.73.16","TCP","68","36876 → 21002 [ACK] Seq=11831 Ack=158606 Win=5596 Len=0 TSval=1087113425 TSecr=2675927518"
"4.533209","54.38.73.16","172.18.0.2","TLSv1.2","1516","Application Data, Application Data"
"4.535124","54.38.73.16","172.18.0.2","TCP","1516","21002 → 36876 [ACK] Seq=160054 Ack=11288 Win=1452 Len=1448 TSval=2675927521 TSecr=1087113412 [TCP segment of a reassembled PDU]"
"4.535269","172.18.0.2","54.38.73.16","TCP","68","36876 → 21002 [ACK] Seq=11831 Ack=161502 Win=5612 Len=0 TSval=1087113436 TSecr=2675927520"
"4.538937","54.38.73.16","172.18.0.2","TLSv1.2","5860","Application Data, Application Data"
"4.539082","172.18.0.2","54.38.73.16","TCP","68","36876 → 21002 [ACK] Seq=11831 Ack=167294 Win=5581 Len=0 TSval=1087113440 TSecr=2675927522"
"4.548034","54.38.73.16","172.18.0.2","TLSv1.2","2964","Application Data, Application Data"
"4.548073","172.18.0.2","54.38.73.16","TCP","68","36876 → 21002 [ACK] Seq=11831 Ack=170190 Win=5596 Len=0 TSval=1087113449 TSecr=2675927524"
"4.559534","54.38.73.16","172.18.0.2","TCP","2964","21002 → 36876 [ACK] Seq=170190 Ack=11831 Win=1452 Len=2896 TSval=2675927527 TSecr=1087113436 [TCP segment of a reassembled PDU]"
"4.559568","172.18.0.2","54.38.73.16","TCP","68","36876 → 21002 [ACK] Seq=11831 Ack=173086 Win=5596 Len=0 TSval=1087113461 TSecr=2675927527"
"4.563347","54.38.73.16","172.18.0.2","TLSv1.2","1145","Application Data, Application Data"
"4.572578","172.18.0.2","54.38.73.16","TLSv1.2","611","Application Data"
"4.632484","54.38.73.16","172.18.0.2","TCP","68","21002 → 36876 [ACK] Seq=174163 Ack=12374 Win=1452 Len=0 TSval=2675927546 TSecr=1087113474"
"4.800848","54.38.73.16","172.18.0.2","TLSv1.2","611","Application Data"
"4.801920","172.18.0.2","54.38.73.16","TLSv1.2","611","Application Data"
"4.826359","54.38.73.16","172.18.0.2","TCP","68","21002 → 36876 [ACK] Seq=174706 Ack=12917 Win=1452 Len=0 TSval=2675927594 TSecr=1087113703"
"5.173643","54.38.73.16","172.18.0.2","TCP","1516","[TCP segment of a reassembled PDU]"
"5.173861","54.38.73.16","172.18.0.2","TLSv1.2","2247","Application Data"
"5.173871","54.38.73.16","172.18.0.2","TLSv1.2","7308","Application Data"
"5.173972","172.18.0.2","54.38.73.16","TCP","68","36876 → 21002 [ACK] Seq=12917 Ack=185573 Win=5553 Len=0 TSval=1087114075 TSecr=2675927665"
"5.185636","54.38.73.16","172.18.0.2","TLSv1.2","1516","Application Data [TCP segment of a reassembled PDU]"
"5.198852","54.38.73.16","172.18.0.2","TLSv1.2","5860","Application Data [TCP segment of a reassembled PDU]"
"5.198888","172.18.0.2","54.38.73.16","TCP","68","36876 → 21002 [ACK] Seq=12917 Ack=192813 Win=5581 Len=0 TSval=1087114100 TSecr=2675927684"
"5.199128","54.38.73.16","172.18.0.2","TLSv1.2","4412","Application Data, Application Data, Application Data"
"5.199387","172.18.0.2","54.38.73.16","TCP","68","36876 → 21002 [ACK] Seq=12917 Ack=197157 Win=5550 Len=0 TSval=1087114100 TSecr=2675927687"
"5.200073","172.18.0.2","54.38.73.16","TLSv1.2","611","Application Data"
"5.223423","54.38.73.16","172.18.0.2","TLSv1.2","5149","Application Data, Application Data, Application Data"
"5.223458","172.18.0.2","54.38.73.16","TCP","68","36876 → 21002 [ACK] Seq=13460 Ack=202238 Win=5584 Len=0 TSval=1087114125 TSecr=2675927693"
"5.224046","54.38.73.16","172.18.0.2","TCP","68","21002 → 36876 [ACK] Seq=202238 Ack=13460 Win=1452 Len=0 TSval=2675927693 TSecr=1087114101"
"5.224171","172.18.0.2","54.38.73.16","TLSv1.2","611","Application Data"
"5.248119","54.38.73.16","172.18.0.2","TCP","68","21002 → 36876 [ACK] Seq=202238 Ack=14003 Win=1452 Len=0 TSval=2675927699 TSecr=1087114125"
"5.248135","172.18.0.2","54.38.73.16","TLSv1.2","611","Application Data"
"5.272613","54.38.73.16","172.18.0.2","TCP","68","21002 → 36876 [ACK] Seq=202238 Ack=14546 Win=1452 Len=0 TSval=2675927706 TSecr=1087114149"
"5.582065","54.38.73.16","172.18.0.2","TLSv1.2","611","Application Data"
"5.583115","172.18.0.2","54.38.73.16","TLSv1.2","611","Application Data"
"5.606968","54.38.73.16","172.18.0.2","TCP","68","21002 → 36876 [ACK] Seq=202781 Ack=15089 Win=1452 Len=0 TSval=2675927789 TSecr=1087114484"
"5.823416","54.38.73.16","172.18.0.2","TLSv1.2","4145","Application Data"
"5.823422","54.38.73.16","172.18.0.2","TCP","2964","[TCP segment of a reassembled PDU]"
"5.823585","172.18.0.2","54.38.73.16","TCP","68","36876 → 21002 [ACK] Seq=15089 Ack=209754 Win=5564 Len=0 TSval=1087114725 TSecr=2675927843"
"5.848727","54.38.73.16","172.18.0.2","TLSv1.2","892","Application Data, Application Data"
"5.857622","54.38.73.16","172.18.0.2","TCP","2964","[TCP segment of a reassembled PDU]"
"5.857655","172.18.0.2","54.38.73.16","TCP","68","36876 → 21002 [ACK] Seq=15089 Ack=213474 Win=5596 Len=0 TSval=1087114759 TSecr=2675927849"
"5.878111","54.38.73.16","172.18.0.2","TLSv1.2","4412","Application Data, Application Data"
"5.878256","172.18.0.2","54.38.73.16","TCP","68","36876 → 21002 [ACK] Seq=15089 Ack=217818 Win=5580 Len=0 TSval=1087114779 TSecr=2675927857"
"5.881875","54.38.73.16","172.18.0.2","TLSv1.2","1168","Application Data, Application Data"
"5.887658","54.38.73.16","172.18.0.2","TLSv1.2","4412","Application Data"
"5.887693","172.18.0.2","54.38.73.16","TCP","68","36876 → 21002 [ACK] Seq=15089 Ack=223262 Win=5580 Len=0 TSval=1087114789 TSecr=2675927858"
"5.887881","54.38.73.16","172.18.0.2","TCP","1516","21002 → 36876 [ACK] Seq=223262 Ack=15089 Win=1452 Len=1448 TSval=2675927859 TSecr=1087114759 [TCP segment of a reassembled PDU]"
"5.902121","54.38.73.16","172.18.0.2","TLSv1.2","2964","Application Data [TCP segment of a reassembled PDU]"
"5.902190","172.18.0.2","54.38.73.16","TCP","68","36876 → 21002 [ACK] Seq=15089 Ack=227606 Win=5596 Len=0 TSval=1087114803 TSecr=2675927859"
"5.913714","54.38.73.16","172.18.0.2","TLSv1.2","5374","Application Data, Application Data"
"5.913859","172.18.0.2","54.38.73.16","TCP","68","36876 → 21002 [ACK] Seq=15089 Ack=232912 Win=5583 Len=0 TSval=1087114815 TSecr=2675927865"
"5.914349","172.18.0.2","54.38.73.16","TLSv1.2","611","Application Data"
"5.931691","54.38.73.16","172.18.0.2","TCP","1516","[TCP segment of a reassembled PDU]"
"5.937782","54.38.73.16","172.18.0.2","TLSv1.2","191","Application Data"
"5.937828","172.18.0.2","54.38.73.16","TCP","68","36876 → 21002 [ACK] Seq=15632 Ack=234483 Win=5608 Len=0 TSval=1087114839 TSecr=2675927870"
"5.937792","54.38.73.16","172.18.0.2","TCP","68","21002 → 36876 [ACK] Seq=234483 Ack=15632 Win=1452 Len=0 TSval=2675927872 TSecr=1087114815"
"5.942145","54.38.73.16","172.18.0.2","TCP","2964","[TCP segment of a reassembled PDU]"
"5.942298","172.18.0.2","54.38.73.16","TCP","68","36876 → 21002 [ACK] Seq=15632 Ack=237379 Win=5596 Len=0 TSval=1087114843 TSecr=2675927873"
"5.961741","54.38.73.16","172.18.0.2","TLSv1.2","799","Application Data"
"5.970124","172.18.0.2","54.38.73.16","TLSv1.2","611","Application Data"
"6.032879","54.38.73.16","172.18.0.2","TCP","68","21002 → 36876 [ACK] Seq=238110 Ack=16175 Win=1452 Len=0 TSval=2675927896 TSecr=1087114871"
"6.215236","54.38.73.16","172.18.0.2","TLSv1.2","611","Application Data"
"6.216238","172.18.0.2","54.38.73.16","TLSv1.2","611","Application Data"
"6.240684","54.38.73.16","172.18.0.2","TCP","68","21002 → 36876 [ACK] Seq=238653 Ack=16718 Win=1452 Len=0 TSval=2675927947 TSecr=1087115117"
"6.471172","54.38.73.16","172.18.0.2","TLSv1.2","4145","Application Data"
"6.471179","54.38.73.16","172.18.0.2","TCP","2964","[TCP segment of a reassembled PDU]"
"6.471331","172.18.0.2","54.38.73.16","TCP","68","36876 → 21002 [ACK] Seq=16718 Ack=245626 Win=5566 Len=0 TSval=1087115372 TSecr=2675928005"
"6.494724","54.38.73.16","172.18.0.2","TLSv1.2","1406","Application Data, Application Data"
"6.502485","54.38.73.16","172.18.0.2","TCP","2964","[TCP segment of a reassembled PDU]"
"6.502519","172.18.0.2","54.38.73.16","TCP","68","36876 → 21002 [ACK] Seq=16718 Ack=249860 Win=5596 Len=0 TSval=1087115404 TSecr=2675928011"
"6.513748","54.38.73.16","172.18.0.2","TLSv1.2","4412","Application Data [TCP segment of a reassembled PDU]"
"6.513885","172.18.0.2","54.38.73.16","TCP","68","36876 → 21002 [ACK] Seq=16718 Ack=254204 Win=5580 Len=0 TSval=1087115415 TSecr=2675928016"
"6.514461","172.18.0.2","54.38.73.16","TLSv1.2","611","Application Data"
"6.524964","54.38.73.16","172.18.0.2","TLSv1.2","1516","Application Data [TCP segment of a reassembled PDU]"
"6.527088","54.38.73.16","172.18.0.2","TLSv1.2","205","Application Data"
"6.527127","172.18.0.2","54.38.73.16","TCP","68","36876 → 21002 [ACK] Seq=17261 Ack=255789 Win=5593 Len=0 TSval=1087115428 TSecr=2675928018"
"6.538934","54.38.73.16","172.18.0.2","TCP","68","21002 → 36876 [ACK] Seq=255789 Ack=17261 Win=1452 Len=0 TSval=2675928022 TSecr=1087115416"
"6.557000","54.38.73.16","172.18.0.2","TLSv1.2","3181","Application Data"
"6.557155","172.18.0.2","54.38.73.16","TCP","68","36876 → 21002 [ACK] Seq=17261 Ack=258902 Win=5580 Len=0 TSval=1087115458 TSecr=2675928026"
"6.564920","172.18.0.2","54.38.73.16","TLSv1.2","611","Application Data"
"6.628439","54.38.73.16","172.18.0.2","TCP","68","21002 → 36876 [ACK] Seq=258902 Ack=17804 Win=1452 Len=0 TSval=2675928045 TSecr=1087115466"
"6.817094","54.38.73.16","172.18.0.2","TLSv1.2","611","Application Data"
"6.818137","172.18.0.2","54.38.73.16","TLSv1.2","611","Application Data"
"6.842076","54.38.73.16","172.18.0.2","TCP","68","21002 → 36876 [ACK] Seq=259445 Ack=18347 Win=1452 Len=0 TSval=2675928098 TSecr=1087115719"
"7.188679","54.38.73.16","172.18.0.2","TLSv1.2","4145","Application Data"
"7.188841","172.18.0.2","54.38.73.16","TCP","68","36876 → 21002 [ACK] Seq=18347 Ack=263522 Win=5581 Len=0 TSval=1087116090 TSecr=2675928184"
"7.209358","54.38.73.16","172.18.0.2","TLSv1.2","2964","Application Data"
"7.209391","172.18.0.2","54.38.73.16","TCP","68","36876 → 21002 [ACK] Seq=18347 Ack=266418 Win=5596 Len=0 TSval=1087116110 TSecr=2675928190"
"7.215066","54.38.73.16","172.18.0.2","TLSv1.2","1435","Application Data, Application Data"
"7.257655","172.18.0.2","54.38.73.16","TCP","68","36876 → 21002 [ACK] Seq=18347 Ack=267785 Win=5612 Len=0 TSval=1087116159 TSecr=2675928191"
"7.274807","54.38.73.16","172.18.0.2","TCP","2964","[TCP segment of a reassembled PDU]"
"7.274840","172.18.0.2","54.38.73.16","TCP","68","36876 → 21002 [ACK] Seq=18347 Ack=270681 Win=5596 Len=0 TSval=1087116176 TSecr=2675928206"
"7.283693","54.38.73.16","172.18.0.2","TLSv1.2","799","Application Data"
"7.283749","172.18.0.2","54.38.73.16","TCP","68","36876 → 21002 [ACK] Seq=18347 Ack=271412 Win=5593 Len=0 TSval=1087116185 TSecr=2675928208"
"7.309105","54.38.73.16","172.18.0.2","TLSv1.2","611","Application Data"
"7.309145","172.18.0.2","54.38.73.16","TCP","68","36876 → 21002 [ACK] Seq=18347 Ack=271955 Win=5593 Len=0 TSval=1087116210 TSecr=2675928214"
"7.327916","54.38.73.16","172.18.0.2","TCP","2964","[TCP segment of a reassembled PDU]"
"7.327951","172.18.0.2","54.38.73.16","TCP","68","36876 → 21002 [ACK] Seq=18347 Ack=274851 Win=5596 Len=0 TSval=1087116229 TSecr=2675928219"
"7.334083","54.38.73.16","172.18.0.2","TLSv1.2","799","Application Data"
"7.334132","172.18.0.2","54.38.73.16","TCP","68","36876 → 21002 [ACK] Seq=18347 Ack=275582 Win=5593 Len=0 TSval=1087116235 TSecr=2675928221"
"7.360080","54.38.73.16","172.18.0.2","TLSv1.2","611","Application Data"
"7.360115","172.18.0.2","54.38.73.16","TCP","68","36876 → 21002 [ACK] Seq=18347 Ack=276125 Win=5593 Len=0 TSval=1087116261 TSecr=2675928227"
"7.385396","54.38.73.16","172.18.0.2","TLSv1.2","611","Application Data"
"7.385431","172.18.0.2","54.38.73.16","TCP","68","36876 → 21002 [ACK] Seq=18347 Ack=276668 Win=5593 Len=0 TSval=1087116286 TSecr=2675928233"
"7.400195","54.38.73.16","172.18.0.2","TCP","2964","[TCP segment of a reassembled PDU]"
"7.400229","172.18.0.2","54.38.73.16","TCP","68","36876 → 21002 [ACK] Seq=18347 Ack=279564 Win=5596 Len=0 TSval=1087116301 TSecr=2675928237"
"7.408888","54.38.73.16","172.18.0.2","TLSv1.2","799","Application Data"
"7.408924","172.18.0.2","54.38.73.16","TCP","68","36876 → 21002 [ACK] Seq=18347 Ack=280295 Win=5593 Len=0 TSval=1087116310 TSecr=2675928240"
"7.421262","54.38.73.16","172.18.0.2","TCP","2964","[TCP segment of a reassembled PDU]"
"7.421297","172.18.0.2","54.38.73.16","TCP","68","36876 → 21002 [ACK] Seq=18347 Ack=283191 Win=5596 Len=0 TSval=1087116322 TSecr=2675928243"
"7.434533","54.38.73.16","172.18.0.2","TLSv1.2","799","Application Data"
"7.434573","172.18.0.2","54.38.73.16","TCP","68","36876 → 21002 [ACK] Seq=18347 Ack=283922 Win=5593 Len=0 TSval=1087116336 TSecr=2675928246"
"7.635022","54.38.73.16","172.18.0.2","TCP","1516","[TCP segment of a reassembled PDU]"
"7.635054","172.18.0.2","54.38.73.16","TCP","68","36876 → 21002 [ACK] Seq=18347 Ack=285370 Win=5593 Len=0 TSval=1087116536 TSecr=2675928277"
"7.635365","54.38.73.16","172.18.0.2","TLSv1.2","2247","Application Data"
"7.635405","172.18.0.2","54.38.73.16","TCP","68","36876 → 21002 [ACK] Seq=18347 Ack=287549 Win=5599 Len=0 TSval=1087116536 TSecr=2675928277"
"7.635370","54.38.73.16","172.18.0.2","TLSv1.2","5860","Application Data"
"7.635376","54.38.73.16","172.18.0.2","TCP","1516","21002 → 36876 [ACK] Seq=293341 Ack=18347 Win=1452 Len=1448 TSval=2675928282 TSecr=1087116336 [TCP segment of a reassembled PDU]"
"7.635379","54.38.73.16","172.18.0.2","TLSv1.2","1516","Application Data [TCP segment of a reassembled PDU]"
"7.635498","172.18.0.2","54.38.73.16","TCP","68","36876 → 21002 [ACK] Seq=18347 Ack=296237 Win=5554 Len=0 TSval=1087116537 TSecr=2675928279"
"7.635935","172.18.0.2","54.38.73.16","TLSv1.2","611","Application Data"
"7.659222","54.38.73.16","172.18.0.2","TCP","1516","21002 → 36876 [ACK] Seq=296237 Ack=18347 Win=1452 Len=1448 TSval=2675928302 TSecr=1087116536 [TCP segment of a reassembled PDU]"
"7.660318","54.38.73.16","172.18.0.2","TCP","68","[TCP Previous segment not captured] 21002 → 36876 [ACK] Seq=304685 Ack=18890 Win=1452 Len=0 TSval=2675928302 TSecr=1087116537"
"7.660337","54.38.73.16","172.18.0.2","TCP","2964","[TCP Out-Of-Order] 21002 → 36876 [ACK] Seq=297685 Ack=18347 Win=1452 Len=2896 TSval=2675928302 TSecr=1087116536"
"7.660386","172.18.0.2","54.38.73.16","TCP","68","36876 → 21002 [ACK] Seq=18890 Ack=300581 Win=5596 Len=0 TSval=1087116561 TSecr=2675928302"
"7.660342","54.38.73.16","172.18.0.2","TCP","4172","[TCP Retransmission] 21002 → 36876 [PSH, ACK] Seq=300581 Ack=18347 Win=1452 Len=4104 TSval=2675928302 TSecr=1087116537"
"7.660518","172.18.0.2","54.38.73.16","TCP","68","36876 → 21002 [ACK] Seq=18890 Ack=304685 Win=5574 Len=0 TSval=1087116562 TSecr=2675928302"
"7.661634","172.18.0.2","54.38.73.16","TLSv1.2","611","Application Data"
"7.685927","54.38.73.16","172.18.0.2","TCP","68","21002 → 36876 [ACK] Seq=304685 Ack=19433 Win=1452 Len=0 TSval=2675928309 TSecr=1087116563"
"7.685948","172.18.0.2","54.38.73.16","TLSv1.2","611","Application Data"
"7.711194","54.38.73.16","172.18.0.2","TCP","68","21002 → 36876 [ACK] Seq=304685 Ack=19976 Win=1452 Len=0 TSval=2675928315 TSecr=1087116587"
"7.917517","54.38.73.16","172.18.0.2","TLSv1.2","611","Application Data"
"7.917597","172.18.0.2","54.38.73.16","TCP","68","36876 → 21002 [ACK] Seq=19976 Ack=305228 Win=5608 Len=0 TSval=1087116819 TSecr=2675928366"
"7.918559","172.18.0.2","54.38.73.16","TLSv1.2","611","Application Data"
"7.942598","54.38.73.16","172.18.0.2","TCP","68","21002 → 36876 [ACK] Seq=305228 Ack=20519 Win=1452 Len=0 TSval=2675928373 TSecr=1087116820"
"8.296878","54.38.73.16","172.18.0.2","TLSv1.2","3695","Application Data"
"8.297036","172.18.0.2","54.38.73.16","TCP","68","36876 → 21002 [ACK] Seq=20519 Ack=308855 Win=5584 Len=0 TSval=1087117198 TSecr=2675928461"
"8.315845","54.38.73.16","172.18.0.2","TLSv1.2","10204","Application Data, Application Data"
"8.316006","172.18.0.2","54.38.73.16","TCP","68","36876 → 21002 [ACK] Seq=20519 Ack=318991 Win=5550 Len=0 TSval=1087117217 TSecr=2675928466"
"8.321349","54.38.73.16","172.18.0.2","TLSv1.2","2384","Application Data, Application Data"
"8.321385","172.18.0.2","54.38.73.16","TCP","68","36876 → 21002 [ACK] Seq=20519 Ack=321307 Win=5598 Len=0 TSval=1087117222 TSecr=2675928468"
"8.336360","54.38.73.16","172.18.0.2","TCP","1516","[TCP segment of a reassembled PDU]"
"8.340036","54.38.73.16","172.18.0.2","TLSv1.2","4412","Application Data [TCP segment of a reassembled PDU]"
"8.340209","172.18.0.2","54.38.73.16","TCP","68","36876 → 21002 [ACK] Seq=20519 Ack=327099 Win=5580 Len=0 TSval=1087117241 TSecr=2675928471"
"8.340345","54.38.73.16","172.18.0.2","TLSv1.2","4412","Application Data [TCP segment of a reassembled PDU]"
"8.340570","172.18.0.2","54.38.73.16","TCP","68","36876 → 21002 [ACK] Seq=20519 Ack=331443 Win=5549 Len=0 TSval=1087117242 TSecr=2675928472"
"8.344925","54.38.73.16","172.18.0.2","TLSv1.2","1841","Application Data"
"8.344959","172.18.0.2","54.38.73.16","TCP","68","36876 → 21002 [ACK] Seq=20519 Ack=333216 Win=5600 Len=0 TSval=1087117246 TSecr=2675928474"
"8.345507","172.18.0.2","54.38.73.16","TLSv1.2","611","Application Data"
"8.370670","54.38.73.16","172.18.0.2","TCP","68","21002 → 36876 [ACK] Seq=333216 Ack=21062 Win=1452 Len=0 TSval=2675928480 TSecr=1087117247"
"8.378881","54.38.73.16","172.18.0.2","TLSv1.2","4145","Application Data"
"8.378888","54.38.73.16","172.18.0.2","TLSv1.2","7308","Application Data"
"8.379081","172.18.0.2","54.38.73.16","TCP","68","36876 → 21002 [ACK] Seq=21062 Ack=344533 Win=5552 Len=0 TSval=1087117280 TSecr=2675928482"
"8.391299","54.38.73.16","172.18.0.2","TLSv1.2","5860","Application Data, Application Data"
"8.391335","172.18.0.2","54.38.73.16","TCP","68","36876 → 21002 [ACK] Seq=21062 Ack=350325 Win=5581 Len=0 TSval=1087117292 TSecr=2675928485"
"8.402911","54.38.73.16","172.18.0.2","TLSv1.2","6806","Application Data, Application Data, Application Data"
"8.403061","172.18.0.2","54.38.73.16","TCP","68","36876 → 21002 [ACK] Seq=21062 Ack=357063 Win=5565 Len=0 TSval=1087117304 TSecr=2675928488"
"8.403859","172.18.0.2","54.38.73.16","TLSv1.2","611","Application Data"
"8.447292","54.38.73.16","172.18.0.2","TLSv1.2","1125","Application Data"
"8.447366","172.18.0.2","54.38.73.16","TLSv1.2","611","Application Data"
"8.509007","54.38.73.16","172.18.0.2","TCP","68","21002 → 36876 [ACK] Seq=358120 Ack=22148 Win=1452 Len=0 TSval=2675928515 TSecr=1087117348"
"8.509054","172.18.0.2","54.38.73.16","TLSv1.2","611","Application Data"
"8.549498","02:42:09:5f:bf:77","","ARP","44","Who has 172.18.0.2? Tell 172.18.0.1"
"8.549530","02:42:ac:12:00:02","","ARP","44","172.18.0.2 is at 02:42:ac:12:00:02"
"8.574022","54.38.73.16","172.18.0.2","TCP","68","21002 → 36876 [ACK] Seq=358120 Ack=22691 Win=1452 Len=0 TSval=2675928531 TSecr=1087117410"
"8.766259","54.38.73.16","172.18.0.2","TLSv1.2","611","Application Data"
"8.767395","172.18.0.2","54.38.73.16","TLSv1.2","611","Application Data"
"8.791835","54.38.73.16","172.18.0.2","TCP","68","21002 → 36876 [ACK] Seq=358663 Ack=23234 Win=1452 Len=0 TSval=2675928585 TSecr=1087117668"
