_ws.col.Time,_ws.col.Source,_ws.col.Destination,_ws.col.Protocol,_ws.col.Length,_ws.col.Info
"0.000000","172.18.0.2","54.38.73.16","TLSv1.2","611","Application Data"
"0.059937","54.38.73.16","172.18.0.2","TCP","68","21002 → 36876 [ACK] Seq=1 Ack=544 Win=1452 Len=0 TSval=2678343752 TSecr=1096778227"
"0.776833","54.38.73.16","172.18.0.2","TLSv1.2","611","Application Data"
"0.777907","172.18.0.2","54.38.73.16","TCP","1516","[TCP segment of a reassembled PDU]"
"0.777986","172.18.0.2","54.38.73.16","TLSv1.2","705","Application Data"
"0.801381","54.38.73.16","172.18.0.2","TCP","68","21002 → 36876 [ACK] Seq=544 Ack=2629 Win=1450 Len=0 TSval=2678343937 TSecr=1096779005"
"1.181380","54.38.73.16","172.18.0.2","TLSv1.2","611","Application Data"
"1.224042","172.18.0.2","54.38.73.16","TCP","68","36876 → 21002 [ACK] Seq=2629 Ack=1087 Win=5612 Len=0 TSval=1096779451 TSecr=2678344029"
"1.392009","54.38.73.16","172.18.0.2","TLSv1.2","1125","Application Data"
"1.392044","172.18.0.2","54.38.73.16","TCP","68","36876 → 21002 [ACK] Seq=2629 Ack=2144 Win=5604 Len=0 TSval=1096779619 TSecr=2678344070"
"1.398873","172.18.0.2","54.38.73.16","TLSv1.2","611","Application Data"
"1.423928","54.38.73.16","172.18.0.2","TCP","68","21002 → 36876 [ACK] Seq=2144 Ack=3172 Win=1452 Len=0 TSval=2678344092 TSecr=1096779626"
"1.761783","54.38.73.16","172.18.0.2","TLSv1.2","611","Application Data"
"1.761829","172.18.0.2","54.38.73.16","TCP","68","36876 → 21002 [ACK] Seq=3172 Ack=2687 Win=5608 Len=0 TSval=1096779988 TSecr=2678344177"
"1.762869","172.18.0.2","54.38.73.16","TLSv1.2","611","Application Data"
"1.786308","54.38.73.16","172.18.0.2","TCP","68","21002 → 36876 [ACK] Seq=2687 Ack=3715 Win=1452 Len=0 TSval=2678344183 TSecr=1096779989"
"2.307815","54.38.73.16","172.18.0.2","TCP","1516","[TCP segment of a reassembled PDU]"
"2.307850","172.18.0.2","54.38.73.16","TCP","68","36876 → 21002 [ACK] Seq=3715 Ack=4135 Win=5601 Len=0 TSval=1096780534 TSecr=2678344289"
"2.307999","54.38.73.16","172.18.0.2","TLSv1.2","2247","Application Data"
"2.308010","172.18.0.2","54.38.73.16","TCP","68","36876 → 21002 [ACK] Seq=3715 Ack=6314 Win=5599 Len=0 TSval=1096780535 TSecr=2678344289"
"2.308034","54.38.73.16","172.18.0.2","TCP","2964","[TCP segment of a reassembled PDU]"
"2.308065","172.18.0.2","54.38.73.16","TCP","68","36876 → 21002 [ACK] Seq=3715 Ack=9210 Win=5584 Len=0 TSval=1096780535 TSecr=2678344292"
"2.332085","54.38.73.16","172.18.0.2","TLSv1.2","1342","Application Data, Application Data"
"2.332123","172.18.0.2","54.38.73.16","TCP","68","36876 → 21002 [ACK] Seq=3715 Ack=10484 Win=5604 Len=0 TSval=1096780559 TSecr=2678344319"
"2.332138","54.38.73.16","172.18.0.2","TCP","2964","[TCP segment of a reassembled PDU]"
"2.332151","172.18.0.2","54.38.73.16","TCP","68","36876 → 21002 [ACK] Seq=3715 Ack=13380 Win=5582 Len=0 TSval=1096780559 TSecr=2678344319"
"2.343169","54.38.73.16","172.18.0.2","TLSv1.2","4412","Application Data, Application Data"
"2.343189","172.18.0.2","54.38.73.16","TCP","68","36876 → 21002 [ACK] Seq=3715 Ack=17724 Win=5580 Len=0 TSval=1096780570 TSecr=2678344322"
"2.353503","54.38.73.16","172.18.0.2","TLSv1.2","2964","Application Data [TCP segment of a reassembled PDU]"
"2.353526","172.18.0.2","54.38.73.16","TCP","68","36876 → 21002 [ACK] Seq=3715 Ack=20620 Win=5596 Len=0 TSval=1096780580 TSecr=2678344325"
"2.355801","54.38.73.16","172.18.0.2","TLSv1.2","842","Application Data"
"2.355816","172.18.0.2","54.38.73.16","TCP","68","36876 → 21002 [ACK] Seq=3715 Ack=21394 Win=5593 Len=0 TSval=1096780582 TSecr=2678344325"
"2.375651","54.38.73.16","172.18.0.2","TLSv1.2","2964","Application Data"
"2.375672","172.18.0.2","54.38.73.16","TCP","68","36876 → 21002 [ACK] Seq=3715 Ack=24290 Win=5596 Len=0 TSval=1096780602 TSecr=2678344330"
"2.379392","54.38.73.16","172.18.0.2","TLSv1.2","1342","Application Data"
"2.379406","172.18.0.2","54.38.73.16","TCP","68","36876 → 21002 [ACK] Seq=3715 Ack=25564 Win=5593 Len=0 TSval=1096780606 TSecr=2678344331"
"2.384894","54.38.73.16","172.18.0.2","TCP","1516","[TCP segment of a reassembled PDU]"
"2.384913","172.18.0.2","54.38.73.16","TCP","68","36876 → 21002 [ACK] Seq=3715 Ack=27012 Win=5593 Len=0 TSval=1096780612 TSecr=2678344333"
"2.385569","54.38.73.16","172.18.0.2","TLSv1.2","2964","Application Data [TCP segment of a reassembled PDU]"
"2.385586","172.18.0.2","54.38.73.16","TCP","68","36876 → 21002 [ACK] Seq=3715 Ack=29908 Win=5596 Len=0 TSval=1096780612 TSecr=2678344333"
"2.385932","172.18.0.2","54.38.73.16","TLSv1.2","611","Application Data"
"2.396839","54.38.73.16","172.18.0.2","TLSv1.2","2964","Application Data [TCP segment of a reassembled PDU]"
"2.396856","172.18.0.2","54.38.73.16","TCP","68","36876 → 21002 [ACK] Seq=4258 Ack=32804 Win=5596 Len=0 TSval=1096780624 TSecr=2678344335"
"2.400058","54.38.73.16","172.18.0.2","TLSv1.2","2964","Application Data [TCP segment of a reassembled PDU]"
"2.400075","172.18.0.2","54.38.73.16","TCP","68","36876 → 21002 [ACK] Seq=4258 Ack=35700 Win=5596 Len=0 TSval=1096780627 TSecr=2678344337"
"2.408954","54.38.73.16","172.18.0.2","TLSv1.2","5860","Application Data, Application Data"
"2.409052","172.18.0.2","54.38.73.16","TCP","68","36876 → 21002 [ACK] Seq=4258 Ack=41492 Win=5581 Len=0 TSval=1096780636 TSecr=2678344339"
"2.409492","54.38.73.16","172.18.0.2","TCP","68","21002 → 36876 [ACK] Seq=41492 Ack=4258 Win=1452 Len=0 TSval=2678344339 TSecr=1096780613"
"2.420706","54.38.73.16","172.18.0.2","TLSv1.2","2964","Application Data [TCP segment of a reassembled PDU]"
"2.420732","172.18.0.2","54.38.73.16","TCP","68","36876 → 21002 [ACK] Seq=4258 Ack=44388 Win=5596 Len=0 TSval=1096780647 TSecr=2678344342"
"2.424002","54.38.73.16","172.18.0.2","TLSv1.2","2007","Application Data"
"2.424017","172.18.0.2","54.38.73.16","TCP","68","36876 → 21002 [ACK] Seq=4258 Ack=46327 Win=5600 Len=0 TSval=1096780651 TSecr=2678344343"
"2.424360","172.18.0.2","54.38.73.16","TLSv1.2","611","Application Data"
"2.474297","54.38.73.16","172.18.0.2","TLSv1.2","3695","Application Data"
"2.474452","172.18.0.2","54.38.73.16","TCP","68","36876 → 21002 [ACK] Seq=4801 Ack=49954 Win=5584 Len=0 TSval=1096780701 TSecr=2678344355"
"2.485394","54.38.73.16","172.18.0.2","TCP","2964","[TCP segment of a reassembled PDU]"
"2.485414","172.18.0.2","54.38.73.16","TCP","68","36876 → 21002 [ACK] Seq=4801 Ack=52850 Win=5596 Len=0 TSval=1096780712 TSecr=2678344358"
"2.499222","54.38.73.16","172.18.0.2","TLSv1.2","799","Application Data"
"2.507350","54.38.73.16","172.18.0.2","TCP","2964","[TCP segment of a reassembled PDU]"
"2.507370","172.18.0.2","54.38.73.16","TCP","68","36876 → 21002 [ACK] Seq=4801 Ack=56477 Win=5596 Len=0 TSval=1096780734 TSecr=2678344361"
"2.528874","54.38.73.16","172.18.0.2","TLSv1.2","4412","Application Data [TCP segment of a reassembled PDU]"
"2.528990","172.18.0.2","54.38.73.16","TCP","68","36876 → 21002 [ACK] Seq=4801 Ack=60821 Win=5580 Len=0 TSval=1096780756 TSecr=2678344368"
"2.529390","172.18.0.2","54.38.73.16","TLSv1.2","611","Application Data"
"2.531154","54.38.73.16","172.18.0.2","TLSv1.2","82","Application Data"
"2.559204","54.38.73.16","172.18.0.2","TCP","2964","[TCP segment of a reassembled PDU]"
"2.559227","172.18.0.2","54.38.73.16","TCP","68","36876 → 21002 [ACK] Seq=5344 Ack=63731 Win=5596 Len=0 TSval=1096780786 TSecr=2678344369"
"2.562431","54.38.73.16","172.18.0.2","TLSv1.2","2964","Application Data [TCP segment of a reassembled PDU]"
"2.562451","172.18.0.2","54.38.73.16","TCP","68","36876 → 21002 [ACK] Seq=5344 Ack=66627 Win=5596 Len=0 TSval=1096780789 TSecr=2678344377"
"2.562605","54.38.73.16","172.18.0.2","TCP","1516","21002 → 36876 [ACK] Seq=66627 Ack=5344 Win=1452 Len=1448 TSval=2678344377 TSecr=1096780756 [TCP segment of a reassembled PDU]"
"2.584178","54.38.73.16","172.18.0.2","TLSv1.2","625","Application Data, Application Data"
"2.584318","172.18.0.2","54.38.73.16","TCP","68","36876 → 21002 [ACK] Seq=5344 Ack=68632 Win=5593 Len=0 TSval=1096780811 TSecr=2678344377"
"2.585285","54.38.73.16","172.18.0.2","TCP","1516","[TCP segment of a reassembled PDU]"
"2.597697","54.38.73.16","172.18.0.2","TLSv1.2","2964","Application Data [TCP segment of a reassembled PDU]"
"2.597714","172.18.0.2","54.38.73.16","TCP","68","36876 → 21002 [ACK] Seq=5344 Ack=72976 Win=5596 Len=0 TSval=1096780824 TSecr=2678344383"
"2.608405","54.38.73.16","172.18.0.2","TLSv1.2","1436","Application Data"
"2.629671","54.38.73.16","172.18.0.2","TCP","2964","[TCP segment of a reassembled PDU]"
"2.629691","172.18.0.2","54.38.73.16","TCP","68","36876 → 21002 [ACK] Seq=5344 Ack=77240 Win=5596 Len=0 TSval=1096780856 TSecr=2678344389"
"2.640446","54.38.73.16","172.18.0.2","TLSv1.2","1516","Application Data [TCP segment of a reassembled PDU]"
"2.653985","54.38.73.16","172.18.0.2","TLSv1.2","408","Application Data"
"2.654091","172.18.0.2","54.38.73.16","TCP","68","36876 → 21002 [ACK] Seq=5344 Ack=79028 Win=5612 Len=0 TSval=1096780881 TSecr=2678344396"
"5.385025","54.38.73.16","172.18.0.2","TLSv1.2","2153","Application Data"
"5.385171","172.18.0.2","54.38.73.16","TCP","68","36876 → 21002 [ACK] Seq=5344 Ack=81113 Win=5599 Len=0 TSval=1096783612 TSecr=2678345083"
"5.385681","172.18.0.2","54.38.73.16","TLSv1.2","611","Application Data"
"5.448593","54.38.73.16","172.18.0.2","TCP","68","21002 → 36876 [ACK] Seq=81113 Ack=5887 Win=1452 Len=0 TSval=2678345099 TSecr=1096783612"
"5.448629","172.18.0.2","54.38.73.16","TLSv1.2","611","Application Data"
"5.473731","54.38.73.16","172.18.0.2","TCP","68","21002 → 36876 [ACK] Seq=81113 Ack=6430 Win=1452 Len=0 TSval=2678345105 TSecr=1096783675"
"6.301317","54.38.73.16","172.18.0.2","TLSv1.2","611","Application Data"
"6.302310","172.18.0.2","54.38.73.16","TLSv1.2","611","Application Data"
"6.326369","54.38.73.16","172.18.0.2","TCP","68","21002 → 36876 [ACK] Seq=81656 Ack=6973 Win=1452 Len=0 TSval=2678345318 TSecr=1096784529"
"6.716198","54.38.73.16","172.18.0.2","TLSv1.2","611","Application Data"
"6.753838","54.38.73.16","172.18.0.2","TCP","2964","[TCP segment of a reassembled PDU]"
"6.753870","172.18.0.2","54.38.73.16","TCP","68","36876 → 21002 [ACK] Seq=6973 Ack=85095 Win=5596 Len=0 TSval=1096784981 TSecr=2678345415"
"6.767494","54.38.73.16","172.18.0.2","TLSv1.2","4412","Application Data [TCP segment of a reassembled PDU]"
"6.767645","172.18.0.2","54.38.73.16","TCP","68","36876 → 21002 [ACK] Seq=6973 Ack=89439 Win=5580 Len=0 TSval=1096784994 TSecr=2678345428"
"6.778293","54.38.73.16","172.18.0.2","TLSv1.2","82","Application Data"
"6.791720","54.38.73.16","172.18.0.2","TLSv1.2","2964","Application Data"
"6.791746","172.18.0.2","54.38.73.16","TCP","68","36876 → 21002 [ACK] Seq=6973 Ack=92349 Win=5596 Len=0 TSval=1096785018 TSecr=2678345431"
"6.803153","54.38.73.16","172.18.0.2","TLSv1.2","4412","Application Data [TCP segment of a reassembled PDU]"
"6.803294","172.18.0.2","54.38.73.16","TCP","68","36876 → 21002 [ACK] Seq=6973 Ack=96693 Win=5580 Len=0 TSval=1096785030 TSecr=2678345437"
"6.812804","54.38.73.16","172.18.0.2","TLSv1.2","1516","Application Data [TCP segment of a reassembled PDU]"
"6.815616","54.38.73.16","172.18.0.2","TLSv1.2","234","Application Data"
"6.815636","172.18.0.2","54.38.73.16","TCP","68","36876 → 21002 [ACK] Seq=6973 Ack=98307 Win=5593 Len=0 TSval=1096785042 TSecr=2678345440"
"6.824548","54.38.73.16","172.18.0.2","TCP","2964","[TCP segment of a reassembled PDU]"
"6.824570","172.18.0.2","54.38.73.16","TCP","68","36876 → 21002 [ACK] Seq=6973 Ack=101203 Win=5596 Len=0 TSval=1096785051 TSecr=2678345442"
"6.835275","54.38.73.16","172.18.0.2","TLSv1.2","4412","Application Data [TCP segment of a reassembled PDU]"
"6.835426","172.18.0.2","54.38.73.16","TCP","68","36876 → 21002 [ACK] Seq=6973 Ack=105547 Win=5580 Len=0 TSval=1096785062 TSecr=2678345445"
"6.835859","172.18.0.2","54.38.73.16","TLSv1.2","611","Application Data"
"6.839809","54.38.73.16","172.18.0.2","TLSv1.2","82","Application Data"
"6.845507","54.38.73.16","172.18.0.2","TCP","2964","[TCP segment of a reassembled PDU]"
"6.845529","172.18.0.2","54.38.73.16","TCP","68","36876 → 21002 [ACK] Seq=7516 Ack=108457 Win=5596 Len=0 TSval=1096785072 TSecr=2678345446"
"6.857144","54.38.73.16","172.18.0.2","TLSv1.2","2964","Application Data, Application Data"
"6.857167","172.18.0.2","54.38.73.16","TCP","68","36876 → 21002 [ACK] Seq=7516 Ack=111353 Win=5596 Len=0 TSval=1096785084 TSecr=2678345451"
"6.860728","54.38.73.16","172.18.0.2","TCP","68","21002 → 36876 [ACK] Seq=111353 Ack=7516 Win=1452 Len=0 TSval=2678345451 TSecr=1096785062"
"6.860753","172.18.0.2","54.38.73.16","TLSv1.2","611","Application Data"
"6.870134","54.38.73.16","172.18.0.2","TLSv1.2","531","Application Data"
"6.880537","54.38.73.16","172.18.0.2","TCP","2964","[TCP segment of a reassembled PDU]"
"6.880682","172.18.0.2","54.38.73.16","TCP","68","36876 → 21002 [ACK] Seq=8059 Ack=114712 Win=5596 Len=0 TSval=1096785107 TSecr=2678345454"
"6.902375","54.38.73.16","172.18.0.2","TLSv1.2","5860","Application Data, Application Data"
"6.902548","172.18.0.2","54.38.73.16","TCP","68","36876 → 21002 [ACK] Seq=8059 Ack=120504 Win=5581 Len=0 TSval=1096785129 TSecr=2678345462"
"6.904479","54.38.73.16","172.18.0.2","TLSv1.2","205","Application Data"
"6.923967","54.38.73.16","172.18.0.2","TCP","1516","[TCP segment of a reassembled PDU]"
"6.923989","172.18.0.2","54.38.73.16","TCP","68","36876 → 21002 [ACK] Seq=8059 Ack=122089 Win=5593 Len=0 TSval=1096785151 TSecr=2678345463"
"6.924678","54.38.73.16","172.18.0.2","TCP","1516","21002 → 36876 [ACK] Seq=122089 Ack=8059 Win=1452 Len=1448 TSval=2678345467 TSecr=1096785107 [TCP segment of a reassembled PDU]"
"6.945378","54.38.73.16","172.18.0.2","TLSv1.2","2964","Application Data, Application Data"
"6.945401","172.18.0.2","54.38.73.16","TCP","68","36876 → 21002 [ACK] Seq=8059 Ack=126433 Win=5596 Len=0 TSval=1096785172 TSecr=2678345467"
"6.947507","54.38.73.16","172.18.0.2","TLSv1.2","1045","Application Data"
"6.966788","54.38.73.16","172.18.0.2","TLSv1.2","5860","Application Data"
"6.966911","172.18.0.2","54.38.73.16","TCP","68","36876 → 21002 [ACK] Seq=8059 Ack=133202 Win=5581 Len=0 TSval=1096785194 TSecr=2678345473"
"6.969680","54.38.73.16","172.18.0.2","TCP","1516","21002 → 36876 [ACK] Seq=133202 Ack=8059 Win=1452 Len=1448 TSval=2678345479 TSecr=1096785172 [TCP segment of a reassembled PDU]"
"6.979037","54.38.73.16","172.18.0.2","TLSv1.2","2964","Application Data [TCP segment of a reassembled PDU]"
"6.979063","172.18.0.2","54.38.73.16","TCP","68","36876 → 21002 [ACK] Seq=8059 Ack=137546 Win=5596 Len=0 TSval=1096785206 TSecr=2678345479"
"6.979552","172.18.0.2","54.38.73.16","TLSv1.2","611","Application Data"
"6.990347","54.38.73.16","172.18.0.2","TLSv1.2","1516","Application Data [TCP segment of a reassembled PDU]"
"6.991429","54.38.73.16","172.18.0.2","TLSv1.2","4049","Application Data, Application Data"
"6.991574","172.18.0.2","54.38.73.16","TCP","68","36876 → 21002 [ACK] Seq=8602 Ack=142975 Win=5580 Len=0 TSval=1096785218 TSecr=2678345484"
"7.013421","54.38.73.16","172.18.0.2","TCP","1516","[TCP segment of a reassembled PDU]"
"7.015261","54.38.73.16","172.18.0.2","TLSv1.2","1219","Application Data"
"7.015285","172.18.0.2","54.38.73.16","TCP","68","36876 → 21002 [ACK] Seq=8602 Ack=145574 Win=5593 Len=0 TSval=1096785242 TSecr=2678345490"
"7.034557","54.38.73.16","172.18.0.2","TLSv1.2","4412","Application Data"
"7.034685","172.18.0.2","54.38.73.16","TCP","68","36876 → 21002 [ACK] Seq=8602 Ack=149918 Win=5580 Len=0 TSval=1096785261 TSecr=2678345495"
"7.038224","54.38.73.16","172.18.0.2","TLSv1.2","408","Application Data"
"7.044421","54.38.73.16","172.18.0.2","TCP","2964","[TCP segment of a reassembled PDU]"
"7.044448","172.18.0.2","54.38.73.16","TCP","68","36876 → 21002 [ACK] Seq=8602 Ack=153154 Win=5596 Len=0 TSval=1096785271 TSecr=2678345496"
"7.069422","54.38.73.16","172.18.0.2","TLSv1.2","799","Application Data"
"7.070179","172.18.0.2","54.38.73.16","TLSv1.2","611","Application Data"
"7.132903","54.38.73.16","172.18.0.2","TCP","68","21002 → 36876 [ACK] Seq=153885 Ack=9145 Win=1452 Len=0 TSval=2678345520 TSecr=1096785297"
"7.132937","172.18.0.2","54.38.73.16","TLSv1.2","611","Application Data"
"7.196415","54.38.73.16","172.18.0.2","TCP","68","21002 → 36876 [ACK] Seq=153885 Ack=9688 Win=1452 Len=0 TSval=2678345536 TSecr=1096785360"
"7.735052","54.38.73.16","172.18.0.2","TLSv1.2","611","Application Data"
"7.736157","172.18.0.2","54.38.73.16","TLSv1.2","611","Application Data"
"7.759362","54.38.73.16","172.18.0.2","TCP","68","21002 → 36876 [ACK] Seq=154428 Ack=10231 Win=1452 Len=0 TSval=2678345676 TSecr=1096785963"
"8.451790","54.38.73.16","172.18.0.2","TCP","1516","[TCP segment of a reassembled PDU]"
"8.452316","54.38.73.16","172.18.0.2","TLSv1.2","2247","Application Data"
"8.452340","54.38.73.16","172.18.0.2","TCP","2964","[TCP segment of a reassembled PDU]"
"8.452347","54.38.73.16","172.18.0.2","TLSv1.2","1516","Application Data [TCP segment of a reassembled PDU]"
"8.452355","54.38.73.16","172.18.0.2","TLSv1.2","2964","Application Data [TCP segment of a reassembled PDU]"
"8.452359","54.38.73.16","172.18.0.2","TLSv1.2","1516","Application Data [TCP segment of a reassembled PDU]"
"8.452364","54.38.73.16","172.18.0.2","TCP","1516","21002 → 36876 [ACK] Seq=166743 Ack=10231 Win=1452 Len=1448 TSval=2678345809 TSecr=1096785963 [TCP segment of a reassembled PDU]"
"8.452462","172.18.0.2","54.38.73.16","TCP","68","36876 → 21002 [ACK] Seq=10231 Ack=168191 Win=5538 Len=0 TSval=1096786679 TSecr=2678345779"
"8.477329","54.38.73.16","172.18.0.2","TLSv1.2","12838","Application Data, Application Data, Application Data, Application Data, Application Data, Application Data, Application Data"
"8.477514","172.18.0.2","54.38.73.16","TCP","68","36876 → 21002 [ACK] Seq=10231 Ack=180961 Win=5535 Len=0 TSval=1096786704 TSecr=2678345856"
"8.478891","172.18.0.2","54.38.73.16","TLSv1.2","611","Application Data"
"8.482825","54.38.73.16","172.18.0.2","TCP","1516","[TCP segment of a reassembled PDU]"
"8.501951","54.38.73.16","172.18.0.2","TLSv1.2","11652","Application Data, Application Data, Application Data"
"8.502115","172.18.0.2","54.38.73.16","TCP","68","36876 → 21002 [ACK] Seq=10774 Ack=193993 Win=5551 Len=0 TSval=1096786729 TSecr=2678345857"
"8.503225","54.38.73.16","172.18.0.2","TCP","68","[TCP Previous segment not captured] 21002 → 36876 [ACK] Seq=195441 Ack=10774 Win=1452 Len=0 TSval=2678345862 TSecr=1096786706"
"8.503239","54.38.73.16","172.18.0.2","TCP","1516","[TCP Retransmission] 21002 → 36876 [ACK] Seq=193993 Ack=10231 Win=1452 Len=1448 TSval=2678345862 TSecr=1096786704"
"8.527516","54.38.73.16","172.18.0.2","TCP","11006","21002 → 36876 [PSH, ACK] Seq=195441 Ack=10774 Win=1452 Len=10938 TSval=2678345868 TSecr=1096786729 [TCP segment of a reassembled PDU], Application Data, Application Data, Application Data, Application Data"
"8.527541","172.18.0.2","54.38.73.16","TCP","68","36876 → 21002 [ACK] Seq=10774 Ack=206379 Win=5553 Len=0 TSval=1096786754 TSecr=2678345862"
"8.528747","172.18.0.2","54.38.73.16","TLSv1.2","611","Application Data"
"8.592586","54.38.73.16","172.18.0.2","TCP","68","21002 → 36876 [ACK] Seq=206379 Ack=11317 Win=1452 Len=0 TSval=2678345885 TSecr=1096786755"
"8.592619","172.18.0.2","54.38.73.16","TLSv1.2","611","Application Data"
"8.616545","54.38.73.16","172.18.0.2","TCP","68","21002 → 36876 [ACK] Seq=206379 Ack=11860 Win=1452 Len=0 TSval=2678345891 TSecr=1096786819"
"9.066292","54.38.73.16","172.18.0.2","TLSv1.2","611","Application Data"
"9.067381","172.18.0.2","54.38.73.16","TLSv1.2","611","Application Data"
"9.091467","54.38.73.16","172.18.0.2","TCP","68","21002 → 36876 [ACK] Seq=206922 Ack=12403 Win=1452 Len=0 TSval=2678346009 TSecr=1096787294"
"9.476714","54.38.73.16","172.18.0.2","TLSv1.2","3695","Application Data"
"9.476752","54.38.73.16","172.18.0.2","TCP","2964","[TCP segment of a reassembled PDU]"
"9.476762","54.38.73.16","172.18.0.2","TLSv1.2","4412","Application Data [TCP segment of a reassembled PDU]"
"9.476901","172.18.0.2","54.38.73.16","TCP","68","36876 → 21002 [ACK] Seq=12403 Ack=217789 Win=5535 Len=0 TSval=1096787704 TSecr=2678346096"
"9.482989","54.38.73.16","172.18.0.2","TLSv1.2","2964","Application Data [TCP segment of a reassembled PDU]"
"9.483016","172.18.0.2","54.38.73.16","TCP","68","36876 → 21002 [ACK] Seq=12403 Ack=220685 Win=5596 Len=0 TSval=1096787710 TSecr=2678346107"
"9.500817","54.38.73.16","172.18.0.2","TLSv1.2","2384","Application Data, Application Data"
"9.500842","172.18.0.2","54.38.73.16","TCP","68","36876 → 21002 [ACK] Seq=12403 Ack=223001 Win=5598 Len=0 TSval=1096787727 TSecr=2678346112"
"9.517956","54.38.73.16","172.18.0.2","TCP","1516","[TCP segment of a reassembled PDU]"
"9.518177","54.38.73.16","172.18.0.2","TCP","1516","21002 → 36876 [ACK] Seq=224449 Ack=12403 Win=1452 Len=1448 TSval=2678346116 TSecr=1096787710 [TCP segment of a reassembled PDU]"
"9.518255","172.18.0.2","54.38.73.16","TCP","68","36876 → 21002 [ACK] Seq=12403 Ack=225897 Win=5612 Len=0 TSval=1096787745 TSecr=2678346116"
"9.525407","54.38.73.16","172.18.0.2","TLSv1.2","1342","Application Data, Application Data"
"9.530447","54.38.73.16","172.18.0.2","TCP","1516","[TCP segment of a reassembled PDU]"
"9.530604","172.18.0.2","54.38.73.16","TCP","68","36876 → 21002 [ACK] Seq=12403 Ack=228619 Win=5593 Len=0 TSval=1096787757 TSecr=2678346118"
"9.540520","54.38.73.16","172.18.0.2","TLSv1.2","1516","Application Data [TCP segment of a reassembled PDU]"
"9.555488","54.38.73.16","172.18.0.2","TLSv1.2","1342","Application Data"
"9.555517","172.18.0.2","54.38.73.16","TCP","68","36876 → 21002 [ACK] Seq=12403 Ack=231341 Win=5593 Len=0 TSval=1096787782 TSecr=2678346122"
"9.564291","172.18.0.2","54.38.73.16","TLSv1.2","611","Application Data"
"9.588332","54.38.73.16","172.18.0.2","TCP","68","21002 → 36876 [ACK] Seq=231341 Ack=12946 Win=1452 Len=0 TSval=2678346134 TSecr=1096787791"
"10.295092","54.38.73.16","172.18.0.2","TLSv1.2","611","Application Data"
"10.295128","54.38.73.16","172.18.0.2","TCP","611","[TCP Retransmission] 21002 → 36876 [PSH, ACK] Seq=231341 Ack=12946 Win=1452 Len=543 TSval=2678346299 TSecr=1096787791"
"10.295162","172.18.0.2","54.38.73.16","TCP","80","36876 → 21002 [ACK] Seq=12946 Ack=231884 Win=5608 Len=0 TSval=1096788522 TSecr=2678346299 SLE=231341 SRE=231884"
"10.296162","172.18.0.2","54.38.73.16","TLSv1.2","611","Application Data"
"10.320039","54.38.73.16","172.18.0.2","TCP","68","21002 → 36876 [ACK] Seq=231884 Ack=13489 Win=1452 Len=0 TSval=2678346316 TSecr=1096788523"
"10.391932","02:42:09:5f:bf:77","","ARP","44","Who has 172.18.0.2? Tell 172.18.0.1"
"10.391938","02:42:ac:12:00:02","","ARP","44","172.18.0.2 is at 02:42:ac:12:00:02"
"10.654680","54.38.73.16","172.18.0.2","TLSv1.2","611","Application Data"
"10.654725","172.18.0.2","54.38.73.16","TCP","68","36876 → 21002 [ACK] Seq=13489 Ack=232427 Win=5608 Len=0 TSval=1096788881 TSecr=2678346400"
"10.677505","54.38.73.16","172.18.0.2","TCP","2964","[TCP segment of a reassembled PDU]"
"10.677530","172.18.0.2","54.38.73.16","TCP","68","36876 → 21002 [ACK] Seq=13489 Ack=235323 Win=5596 Len=0 TSval=1096788904 TSecr=2678346406"
"10.679348","54.38.73.16","172.18.0.2","TLSv1.2","799","Application Data"
"10.679372","172.18.0.2","54.38.73.16","TCP","68","36876 → 21002 [ACK] Seq=13489 Ack=236054 Win=5593 Len=0 TSval=1096788906 TSecr=2678346406"
"10.699910","54.38.73.16","172.18.0.2","TCP","2964","[TCP segment of a reassembled PDU]"
"10.699935","172.18.0.2","54.38.73.16","TCP","68","36876 → 21002 [ACK] Seq=13489 Ack=238950 Win=5596 Len=0 TSval=1096788927 TSecr=2678346411"
"10.702859","54.38.73.16","172.18.0.2","TLSv1.2","799","Application Data"
"10.702884","172.18.0.2","54.38.73.16","TCP","68","36876 → 21002 [ACK] Seq=13489 Ack=239681 Win=5593 Len=0 TSval=1096788930 TSecr=2678346412"
"10.722484","54.38.73.16","172.18.0.2","TCP","2964","[TCP segment of a reassembled PDU]"
"10.722512","172.18.0.2","54.38.73.16","TCP","68","36876 → 21002 [ACK] Seq=13489 Ack=242577 Win=5596 Len=0 TSval=1096788949 TSecr=2678346417"
"10.727286","54.38.73.16","172.18.0.2","TLSv1.2","799","Application Data"
"10.727310","172.18.0.2","54.38.73.16","TCP","68","36876 → 21002 [ACK] Seq=13489 Ack=243308 Win=5593 Len=0 TSval=1096788954 TSecr=2678346418"
"10.751244","54.38.73.16","172.18.0.2","TLSv1.2","7308","Application Data"
"10.751289","172.18.0.2","54.38.73.16","TCP","68","36876 → 21002 [ACK] Seq=13489 Ack=250548 Win=5565 Len=0 TSval=1096788978 TSecr=2678346424"
"10.752347","54.38.73.16","172.18.0.2","TLSv1.2","1139","Application Data, Application Data"
"10.752371","172.18.0.2","54.38.73.16","TCP","68","36876 → 21002 [ACK] Seq=13489 Ack=251619 Win=5593 Len=0 TSval=1096788979 TSecr=2678346424"
"10.763029","54.38.73.16","172.18.0.2","TCP","2964","[TCP segment of a reassembled PDU]"
"10.763054","172.18.0.2","54.38.73.16","TCP","68","36876 → 21002 [ACK] Seq=13489 Ack=254515 Win=5596 Len=0 TSval=1096788990 TSecr=2678346427"
"10.777799","54.38.73.16","172.18.0.2","TLSv1.2","596","[TCP Previous segment not captured] , Ignored Unknown Record"
"10.777827","172.18.0.2","54.38.73.16","TCP","80","[TCP Window Update] 36876 → 21002 [ACK] Seq=13489 Ack=254515 Win=5607 Len=0 TSval=1096789004 TSecr=2678346427 SLE=258859 SRE=259387"
"10.777832","54.38.73.16","172.18.0.2","TCP","4412","[TCP Out-Of-Order] 21002 → 36876 [ACK] Seq=254515 Ack=13489 Win=1452 Len=4344 TSval=2678346431 TSecr=1096788978"
"10.777861","172.18.0.2","54.38.73.16","TCP","68","36876 → 21002 [ACK] Seq=13489 Ack=259387 Win=5584 Len=0 TSval=1096789004 TSecr=2678346431"
"10.777865","54.38.73.16","172.18.0.2","TCP","2964","[TCP segment of a reassembled PDU]"
"10.777874","172.18.0.2","54.38.73.16","TCP","68","36876 → 21002 [ACK] Seq=13489 Ack=262283 Win=5569 Len=0 TSval=1096789005 TSecr=2678346431"
"10.778824","172.18.0.2","54.38.73.16","TLSv1.2","1125","Application Data"
"10.788642","54.38.73.16","172.18.0.2","TLSv1.2","2964","Application Data [TCP segment of a reassembled PDU]"
"10.788667","172.18.0.2","54.38.73.16","TCP","68","36876 → 21002 [ACK] Seq=14546 Ack=265179 Win=5596 Len=0 TSval=1096789015 TSecr=2678346434"
"10.802840","54.38.73.16","172.18.0.2","TLSv1.2","2964","Application Data [TCP segment of a reassembled PDU]"
"10.802865","172.18.0.2","54.38.73.16","TCP","68","36876 → 21002 [ACK] Seq=14546 Ack=268075 Win=5596 Len=0 TSval=1096789030 TSecr=2678346437"
"10.803245","54.38.73.16","172.18.0.2","TCP","2964","21002 → 36876 [ACK] Seq=268075 Ack=13489 Win=1452 Len=2896 TSval=2678346437 TSecr=1096789004 [TCP segment of a reassembled PDU]"
"10.803267","54.38.73.16","172.18.0.2","TLSv1.2","2964","Application Data, Application Data"
"10.803325","172.18.0.2","54.38.73.16","TCP","68","36876 → 21002 [ACK] Seq=14546 Ack=270971 Win=5574 Len=0 TSval=1096789030 TSecr=2678346437"
"10.803414","172.18.0.2","54.38.73.16","TCP","68","36876 → 21002 [ACK] Seq=14546 Ack=273867 Win=5566 Len=0 TSval=1096789030 TSecr=2678346437"
"10.804301","54.38.73.16","172.18.0.2","TCP","68","21002 → 36876 [ACK] Seq=273867 Ack=14546 Win=1452 Len=0 TSval=2678346437 TSecr=1096789005"
"10.813286","54.38.73.16","172.18.0.2","TLSv1.2","2964","Application Data, Application Data"
"10.813310","172.18.0.2","54.38.73.16","TCP","68","36876 → 21002 [ACK] Seq=14546 Ack=276763 Win=5596 Len=0 TSval=1096789040 TSecr=2678346440"
"10.828222","54.38.73.16","172.18.0.2","TLSv1.2","5540","Application Data, Application Data"
"10.828362","172.18.0.2","54.38.73.16","TCP","68","36876 → 21002 [ACK] Seq=14546 Ack=282235 Win=5582 Len=0 TSval=1096789055 TSecr=2678346443"
"10.833644","54.38.73.16","172.18.0.2","TCP","2964","[TCP segment of a reassembled PDU]"
"10.833669","172.18.0.2","54.38.73.16","TCP","68","36876 → 21002 [ACK] Seq=14546 Ack=285131 Win=5596 Len=0 TSval=1096789060 TSecr=2678346445"
"10.844367","54.38.73.16","172.18.0.2","TLSv1.2","4412","Application Data [TCP segment of a reassembled PDU]"
"10.844535","172.18.0.2","54.38.73.16","TCP","68","36876 → 21002 [ACK] Seq=14546 Ack=289475 Win=5580 Len=0 TSval=1096789071 TSecr=2678346448"
"10.844973","172.18.0.2","54.38.73.16","TLSv1.2","611","Application Data"
"10.852362","54.38.73.16","172.18.0.2","TLSv1.2","4223","Application Data, Application Data"
"10.852386","172.18.0.2","54.38.73.16","TCP","68","36876 → 21002 [ACK] Seq=15089 Ack=293630 Win=5580 Len=0 TSval=1096789079 TSecr=2678346450"
"10.857949","54.38.73.16","172.18.0.2","TCP","1516","[TCP segment of a reassembled PDU]"
"10.866637","54.38.73.16","172.18.0.2","TLSv1.2","1516","Application Data [TCP segment of a reassembled PDU]"
"10.866661","172.18.0.2","54.38.73.16","TCP","68","36876 → 21002 [ACK] Seq=15089 Ack=296526 Win=5593 Len=0 TSval=1096789093 TSecr=2678346451"
"10.867563","54.38.73.16","172.18.0.2","TCP","1516","21002 → 36876 [ACK] Seq=296526 Ack=14546 Win=1452 Len=1448 TSval=2678346453 TSecr=1096789060 [TCP segment of a reassembled PDU]"
"10.876892","54.38.73.16","172.18.0.2","TLSv1.2","1465","Application Data, Application Data"
"10.876916","172.18.0.2","54.38.73.16","TCP","68","36876 → 21002 [ACK] Seq=15089 Ack=299371 Win=5593 Len=0 TSval=1096789104 TSecr=2678346453"
"11.084052","172.18.0.2","54.38.73.16","TLSv1.2","611","Application Data"
"11.110502","54.38.73.16","172.18.0.2","TCP","80","[TCP Dup ACK 238#1] 21002 → 36876 [ACK] Seq=299371 Ack=14546 Win=1452 Len=0 TSval=2678346514 TSecr=1096789071 SLE=15089 SRE=15632"
"11.110538","172.18.0.2","54.38.73.16","TCP","611","[TCP Retransmission] 36876 → 21002 [PSH, ACK] Seq=14546 Ack=299371 Win=5612 Len=543 TSval=1096789337 TSecr=2678346514"
"11.135052","54.38.73.16","172.18.0.2","TCP","68","21002 → 36876 [ACK] Seq=299371 Ack=15632 Win=1445 Len=0 TSval=2678346520 TSecr=1096789337"
"11.453268","54.38.73.16","172.18.0.2","TLSv1.2","611","Application Data"
"11.454173","172.18.0.2","54.38.73.16","TLSv1.2","611","Application Data"
"11.477771","54.38.73.16","172.18.0.2","TCP","68","21002 → 36876 [ACK] Seq=299914 Ack=16175 Win=1452 Len=0 TSval=2678346606 TSecr=1096789681"
"11.783647","54.38.73.16","172.18.0.2","TLSv1.2","3695","Application Data"
"11.783782","172.18.0.2","54.38.73.16","TCP","68","36876 → 21002 [ACK] Seq=16175 Ack=303541 Win=5584 Len=0 TSval=1096790010 TSecr=2678346682"
"11.807928","54.38.73.16","172.18.0.2","TLSv1.2","611","Application Data"
"11.819344","54.38.73.16","172.18.0.2","TCP","2964","[TCP segment of a reassembled PDU]"
"11.819366","172.18.0.2","54.38.73.16","TCP","68","36876 → 21002 [ACK] Seq=16175 Ack=306980 Win=5596 Len=0 TSval=1096790046 TSecr=2678346689"
"11.838970","54.38.73.16","172.18.0.2","TLSv1.2","4412","Application Data, Application Data"
"11.839125","172.18.0.2","54.38.73.16","TCP","68","36876 → 21002 [ACK] Seq=16175 Ack=311324 Win=5578 Len=0 TSval=1096790066 TSecr=2678346696"
"11.843583","54.38.73.16","172.18.0.2","TLSv1.2","625","Application Data"
"11.844064","172.18.0.2","54.38.73.16","TLSv1.2","611","Application Data"
"11.848376","54.38.73.16","172.18.0.2","TLSv1.2","7308","Application Data"
"11.848500","172.18.0.2","54.38.73.16","TCP","68","36876 → 21002 [ACK] Seq=16718 Ack=319121 Win=5565 Len=0 TSval=1096790075 TSecr=2678346698"
"11.864161","54.38.73.16","172.18.0.2","TLSv1.2","2964","Application Data [TCP segment of a reassembled PDU]"
"11.864184","172.18.0.2","54.38.73.16","TCP","68","36876 → 21002 [ACK] Seq=16718 Ack=322017 Win=5596 Len=0 TSval=1096790091 TSecr=2678346702"
"11.867730","54.38.73.16","172.18.0.2","TLSv1.2","2964","Application Data, Application Data"
"11.867762","172.18.0.2","54.38.73.16","TCP","68","36876 → 21002 [ACK] Seq=16718 Ack=324913 Win=5596 Len=0 TSval=1096790094 TSecr=2678346703"
"11.873885","54.38.73.16","172.18.0.2","TLSv1.2","6228","Application Data, Application Data"
"11.874052","172.18.0.2","54.38.73.16","TCP","68","36876 → 21002 [ACK] Seq=16718 Ack=331073 Win=5565 Len=0 TSval=1096790101 TSecr=2678346705"
"11.874508","172.18.0.2","54.38.73.16","TLSv1.2","611","Application Data"
"11.888853","54.38.73.16","172.18.0.2","TCP","2964","[TCP segment of a reassembled PDU]"
"11.888877","172.18.0.2","54.38.73.16","TCP","68","36876 → 21002 [ACK] Seq=17261 Ack=333969 Win=5596 Len=0 TSval=1096790116 TSecr=2678346709"
"11.893290","54.38.73.16","172.18.0.2","TLSv1.2","2964","Application Data [TCP segment of a reassembled PDU]"
"11.893316","172.18.0.2","54.38.73.16","TCP","68","36876 → 21002 [ACK] Seq=17261 Ack=336865 Win=5596 Len=0 TSval=1096790120 TSecr=2678346710"
"11.898632","54.38.73.16","172.18.0.2","TCP","1516","21002 → 36876 [ACK] Seq=336865 Ack=16718 Win=1452 Len=1448 TSval=2678346711 TSecr=1096790101 [TCP segment of a reassembled PDU]"
"11.898773","54.38.73.16","172.18.0.2","TLSv1.2","4412","Application Data [TCP segment of a reassembled PDU]"
"11.898827","172.18.0.2","54.38.73.16","TCP","68","36876 → 21002 [ACK] Seq=17261 Ack=342657 Win=5580 Len=0 TSval=1096790125 TSecr=2678346711"
"11.909344","54.38.73.16","172.18.0.2","TLSv1.2","1516","Application Data, Application Data"
"11.913293","54.38.73.16","172.18.0.2","TLSv1.2","4412","Application Data [TCP segment of a reassembled PDU]"
"11.913317","172.18.0.2","54.38.73.16","TCP","68","36876 → 21002 [ACK] Seq=17261 Ack=348449 Win=5580 Len=0 TSval=1096790140 TSecr=2678346713"
"11.916238","54.38.73.16","172.18.0.2","TLSv1.2","2941","Application Data, Application Data"
"11.916263","172.18.0.2","54.38.73.16","TCP","68","36876 → 21002 [ACK] Seq=17261 Ack=351322 Win=5596 Len=0 TSval=1096790143 TSecr=2678346716"
"11.922654","54.38.73.16","172.18.0.2","TCP","1516","[TCP segment of a reassembled PDU]"
"11.943787","54.38.73.16","172.18.0.2","TLSv1.2","705","Application Data"
"11.943816","54.38.73.16","172.18.0.2","TCP","1516","[TCP segment of a reassembled PDU]"
"11.943966","172.18.0.2","54.38.73.16","TCP","68","36876 → 21002 [ACK] Seq=17261 Ack=354855 Win=5577 Len=0 TSval=1096790171 TSecr=2678346717"
"11.944305","172.18.0.2","54.38.73.16","TLSv1.2","611","Application Data"
"11.954248","54.38.73.16","172.18.0.2","TLSv1.2","2964","Application Data [TCP segment of a reassembled PDU]"
"11.954273","172.18.0.2","54.38.73.16","TCP","68","36876 → 21002 [ACK] Seq=17804 Ack=357751 Win=5596 Len=0 TSval=1096790181 TSecr=2678346725"
"11.967737","54.38.73.16","172.18.0.2","TLSv1.2","922","Application Data"
"11.990863","54.38.73.16","172.18.0.2","TLSv1.2","10204","Application Data, Application Data"
"11.991043","172.18.0.2","54.38.73.16","TCP","68","36876 → 21002 [ACK] Seq=17804 Ack=368741 Win=5550 Len=0 TSval=1096790218 TSecr=2678346728"
"11.991702","172.18.0.2","54.38.73.16","TLSv1.2","611","Application Data"
"12.003626","54.38.73.16","172.18.0.2","TLSv1.2","2964","Application Data [TCP segment of a reassembled PDU]"
"12.003651","172.18.0.2","54.38.73.16","TCP","68","36876 → 21002 [ACK] Seq=18347 Ack=371637 Win=5596 Len=0 TSval=1096790230 TSecr=2678346737"
"12.014783","54.38.73.16","172.18.0.2","TLSv1.2","2601","Application Data, Application Data"
"12.014829","172.18.0.2","54.38.73.16","TCP","68","36876 → 21002 [ACK] Seq=18347 Ack=374170 Win=5597 Len=0 TSval=1096790241 TSecr=2678346740"
"12.014834","54.38.73.16","172.18.0.2","TCP","2964","[TCP segment of a reassembled PDU]"
"12.014953","172.18.0.2","54.38.73.16","TCP","68","36876 → 21002 [ACK] Seq=18347 Ack=377066 Win=5582 Len=0 TSval=1096790242 TSecr=2678346740"
"12.026258","54.38.73.16","172.18.0.2","TLSv1.2","1516","Application Data [TCP segment of a reassembled PDU]"
"12.026778","172.18.0.2","54.38.73.16","TLSv1.2","611","Application Data"
"12.038997","54.38.73.16","172.18.0.2","TLSv1.2","1436","Application Data"
"12.079912","172.18.0.2","54.38.73.16","TCP","68","36876 → 21002 [ACK] Seq=18890 Ack=379882 Win=5612 Len=0 TSval=1096790307 TSecr=2678346746"
"12.088893","54.38.73.16","172.18.0.2","TCP","68","21002 → 36876 [ACK] Seq=379882 Ack=18890 Win=1452 Len=0 TSval=2678346759 TSecr=1096790253"
"12.088926","172.18.0.2","54.38.73.16","TLSv1.2","611","Application Data"
"12.152709","54.38.73.16","172.18.0.2","TCP","68","21002 → 36876 [ACK] Seq=379882 Ack=19433 Win=1452 Len=0 TSval=2678346775 TSecr=1096790316"
"12.651197","54.38.73.16","172.18.0.2","TLSv1.2","611","Application Data"
"12.651239","172.18.0.2","54.38.73.16","TCP","68","36876 → 21002 [ACK] Seq=19433 Ack=380425 Win=5608 Len=0 TSval=1096790878 TSecr=2678346887"
"12.652475","172.18.0.2","54.38.73.16","TLSv1.2","611","Application Data"
"12.676805","54.38.73.16","172.18.0.2","TCP","68","21002 → 36876 [ACK] Seq=380425 Ack=19976 Win=1452 Len=0 TSval=2678346906 TSecr=1096790879"
"13.368839","54.38.73.16","172.18.0.2","TLSv1.2","611","Application Data"
"13.368878","172.18.0.2","54.38.73.16","TCP","68","36876 → 21002 [ACK] Seq=19976 Ack=380968 Win=5608 Len=0 TSval=1096791596 TSecr=2678347033"
"13.368882","54.38.73.16","172.18.0.2","TCP","2964","[TCP segment of a reassembled PDU]"
"13.368893","172.18.0.2","54.38.73.16","TCP","68","36876 → 21002 [ACK] Seq=19976 Ack=383864 Win=5586 Len=0 TSval=1096791596 TSecr=2678347039"
"13.368896","54.38.73.16","172.18.0.2","TLSv1.2","4412","Application Data [TCP segment of a reassembled PDU]"
"13.368903","172.18.0.2","54.38.73.16","TCP","68","36876 → 21002 [ACK] Seq=19976 Ack=388208 Win=5555 Len=0 TSval=1096791596 TSecr=2678347047"
"13.368905","54.38.73.16","172.18.0.2","TLSv1.2","4412","Application Data, Application Data"
"13.368912","172.18.0.2","54.38.73.16","TCP","68","36876 → 21002 [ACK] Seq=19976 Ack=392552 Win=5533 Len=0 TSval=1096791596 TSecr=2678347052"
"13.368914","54.38.73.16","172.18.0.2","TLSv1.2","1516","Application Data, Application Data"
"13.368923","172.18.0.2","54.38.73.16","TCP","68","36876 → 21002 [ACK] Seq=19976 Ack=394000 Win=5525 Len=0 TSval=1096791596 TSecr=2678347055"
"13.368925","54.38.73.16","172.18.0.2","TCP","1516","21002 → 36876 [ACK] Seq=394000 Ack=19976 Win=1452 Len=1448 TSval=2678347075 TSecr=1096790879 [TCP segment of a reassembled PDU]"
"13.368932","172.18.0.2","54.38.73.16","TCP","68","36876 → 21002 [ACK] Seq=19976 Ack=395448 Win=5518 Len=0 TSval=1096791596 TSecr=2678347075"
"13.396878","54.38.73.16","172.18.0.2","TLSv1.2","4412","Application Data [TCP segment of a reassembled PDU]"
"13.396899","172.18.0.2","54.38.73.16","TCP","68","36876 → 21002 [ACK] Seq=19976 Ack=399792 Win=5580 Len=0 TSval=1096791624 TSecr=2678347085"
"13.398294","54.38.73.16","172.18.0.2","TLSv1.2","9804","Application Data, Application Data, Application Data, Application Data"
"13.398320","172.18.0.2","54.38.73.16","TCP","68","36876 → 21002 [ACK] Seq=19976 Ack=409528 Win=5550 Len=0 TSval=1096791625 TSecr=2678347085"
"13.399321","172.18.0.2","54.38.73.16","TLSv1.2","611","Application Data"
"13.422780","54.38.73.16","172.18.0.2","TCP","2964","[TCP segment of a reassembled PDU]"
"13.422791","172.18.0.2","54.38.73.16","TCP","68","36876 → 21002 [ACK] Seq=20519 Ack=412424 Win=5596 Len=0 TSval=1096791649 TSecr=2678347092"
"13.423784","54.38.73.16","172.18.0.2","TLSv1.2","11166","Application Data, Application Data, Application Data, Application Data"
"13.423795","172.18.0.2","54.38.73.16","TCP","68","36876 → 21002 [ACK] Seq=20519 Ack=423522 Win=5553 Len=0 TSval=1096791650 TSecr=2678347092"
"13.436737","54.38.73.16","172.18.0.2","TCP","68","21002 → 36876 [ACK] Seq=423522 Ack=20519 Win=1452 Len=0 TSval=2678347096 TSecr=1096791626"
"13.436750","172.18.0.2","54.38.73.16","TLSv1.2","611","Application Data"
"13.448008","54.38.73.16","172.18.0.2","TCP","2964","[TCP segment of a reassembled PDU]"
"13.448112","172.18.0.2","54.38.73.16","TCP","68","36876 → 21002 [ACK] Seq=21062 Ack=426418 Win=5596 Len=0 TSval=1096791675 TSecr=2678347098"
"13.448820","54.38.73.16","172.18.0.2","TLSv1.2","11195","Application Data, Application Data, Application Data, Application Data, Application Data"
"13.448925","172.18.0.2","54.38.73.16","TCP","68","36876 → 21002 [ACK] Seq=21062 Ack=437545 Win=5553 Len=0 TSval=1096791676 TSecr=2678347099"
"13.471984","54.38.73.16","172.18.0.2","TCP","2964","[TCP segment of a reassembled PDU]"
"13.472014","172.18.0.2","54.38.73.16","TLSv1.2","611","Application Data"
"13.473939","54.38.73.16","172.18.0.2","TLSv1.2","5483","Application Data, Application Data, Application Data"
"13.474092","172.18.0.2","54.38.73.16","TCP","68","36876 → 21002 [ACK] Seq=21605 Ack=445856 Win=5582 Len=0 TSval=1096791701 TSecr=2678347105"
"13.544315","54.38.73.16","172.18.0.2","TCP","68","21002 → 36876 [ACK] Seq=445856 Ack=21605 Win=1452 Len=0 TSval=2678347123 TSecr=1096791699"
"13.544348","172.18.0.2","54.38.73.16","TLSv1.2","611","Application Data"
"13.604894","54.38.73.16","172.18.0.2","TCP","68","21002 → 36876 [ACK] Seq=445856 Ack=22148 Win=1452 Len=0 TSval=2678347138 TSecr=1096791771"
"14.291265","54.38.73.16","172.18.0.2","TLSv1.2","611","Application Data"
"14.291300","54.38.73.16","172.18.0.2","TCP","611","[TCP Retransmission] 21002 → 36876 [PSH, ACK] Seq=445856 Ack=22148 Win=1452 Len=543 TSval=2678347300 TSecr=1096791771"
"14.291328","172.18.0.2","54.38.73.16","TCP","80","36876 → 21002 [ACK] Seq=22148 Ack=446399 Win=5608 Len=0 TSval=1096792518 TSecr=2678347300 SLE=445856 SRE=446399"
"14.292371","172.18.0.2","54.38.73.16","TLSv1.2","611","Application Data"
"14.317056","54.38.73.16","172.18.0.2","TCP","68","21002 → 36876 [ACK] Seq=446399 Ack=22691 Win=1452 Len=0 TSval=2678347316 TSecr=1096792519"
"14.639814","54.38.73.16","172.18.0.2","TLSv1.2","3695","Application Data"
"14.639854","172.18.0.2","54.38.73.16","TCP","68","36876 → 21002 [ACK] Seq=22691 Ack=450026 Win=5584 Len=0 TSval=1096792866 TSecr=2678347396"
"14.664523","54.38.73.16","172.18.0.2","TLSv1.2","611","Application Data"
"14.664545","172.18.0.2","54.38.73.16","TCP","68","36876 → 21002 [ACK] Seq=22691 Ack=450569 Win=5593 Len=0 TSval=1096792891 TSecr=2678347403"
"14.681500","54.38.73.16","172.18.0.2","TCP","2964","[TCP segment of a reassembled PDU]"
"14.681522","172.18.0.2","54.38.73.16","TCP","68","36876 → 21002 [ACK] Seq=22691 Ack=453465 Win=5596 Len=0 TSval=1096792908 TSecr=2678347407"
"14.688865","54.38.73.16","172.18.0.2","TLSv1.2","799","Application Data"
"14.688887","172.18.0.2","54.38.73.16","TCP","68","36876 → 21002 [ACK] Seq=22691 Ack=454196 Win=5593 Len=0 TSval=1096792916 TSecr=2678347409"
"14.692516","54.38.73.16","172.18.0.2","TCP","2964","[TCP segment of a reassembled PDU]"
"14.692589","172.18.0.2","54.38.73.16","TCP","68","36876 → 21002 [ACK] Seq=22691 Ack=457092 Win=5577 Len=0 TSval=1096792919 TSecr=2678347409"
"14.701945","54.38.73.16","172.18.0.2","TLSv1.2","2964","Application Data [TCP segment of a reassembled PDU]"
"14.701970","172.18.0.2","54.38.73.16","TCP","68","36876 → 21002 [ACK] Seq=22691 Ack=459988 Win=5596 Len=0 TSval=1096792929 TSecr=2678347412"
"14.705706","54.38.73.16","172.18.0.2","TCP","1516","21002 → 36876 [ACK] Seq=459988 Ack=22691 Win=1452 Len=1448 TSval=2678347413 TSecr=1096792908 [TCP segment of a reassembled PDU]"
"14.705728","172.18.0.2","54.38.73.16","TCP","68","36876 → 21002 [ACK] Seq=22691 Ack=461436 Win=5593 Len=0 TSval=1096792932 TSecr=2678347413"
"14.714312","54.38.73.16","172.18.0.2","TLSv1.2","1139","Application Data, Application Data"
"14.714334","172.18.0.2","54.38.73.16","TCP","68","36876 → 21002 [ACK] Seq=22691 Ack=462507 Win=5593 Len=0 TSval=1096792941 TSecr=2678347415"
"14.714353","54.38.73.16","172.18.0.2","TCP","2964","[TCP segment of a reassembled PDU]"
"14.714361","172.18.0.2","54.38.73.16","TCP","68","36876 → 21002 [ACK] Seq=22691 Ack=465403 Win=5578 Len=0 TSval=1096792941 TSecr=2678347415"
"14.738355","54.38.73.16","172.18.0.2","TLSv1.2","799","Application Data"
"14.738378","172.18.0.2","54.38.73.16","TCP","68","36876 → 21002 [ACK] Seq=22691 Ack=466134 Win=5593 Len=0 TSval=1096792965 TSecr=2678347421"
"14.745095","172.18.0.2","54.38.73.16","TLSv1.2","611","Application Data"
"14.769221","54.38.73.16","172.18.0.2","TCP","68","21002 → 36876 [ACK] Seq=466134 Ack=23234 Win=1452 Len=0 TSval=2678347429 TSecr=1096792972"
"15.415515","54.38.73.16","172.18.0.2","TLSv1.2","611","Application Data"
"15.415557","172.18.0.2","54.38.73.16","TCP","68","36876 → 21002 [ACK] Seq=23234 Ack=466677 Win=5608 Len=0 TSval=1096793642 TSecr=2678347585"
"15.416687","172.18.0.2","54.38.73.16","TLSv1.2","611","Application Data"
"15.441291","54.38.73.16","172.18.0.2","TCP","68","21002 → 36876 [ACK] Seq=466677 Ack=23777 Win=1452 Len=0 TSval=2678347597 TSecr=1096793643"
"15.825761","54.38.73.16","172.18.0.2","TLSv1.2","611","Application Data"
"15.841222","54.38.73.16","172.18.0.2","TCP","2964","[TCP segment of a reassembled PDU]"
"15.841381","172.18.0.2","54.38.73.16","TCP","68","36876 → 21002 [ACK] Seq=23777 Ack=470116 Win=5596 Len=0 TSval=1096794068 TSecr=2678347681"
"15.867138","54.38.73.16","172.18.0.2","TLSv1.2","285","Application Data"
"15.874109","172.18.0.2","54.38.73.16","TLSv1.2","611","Application Data"
"15.899693","54.38.73.16","172.18.0.2","TCP","68","21002 → 36876 [ACK] Seq=470333 Ack=24320 Win=1452 Len=0 TSval=2678347711 TSecr=1096794101"
