_ws.col.Time,_ws.col.Source,_ws.col.Destination,_ws.col.Protocol,_ws.col.Length,_ws.col.Info
"0.000000","172.18.0.2","54.38.73.16","TLSv1.2","611","Application Data"
"0.061777","54.38.73.16","172.18.0.2","TCP","68","21002 → 36876 [ACK] Seq=1 Ack=544 Win=1452 Len=0 TSval=2674627320 TSecr=1081912606"
"0.520369","54.38.73.16","172.18.0.2","TLSv1.2","611","Application Data"
"0.521518","172.18.0.2","54.38.73.16","TCP","1516","[TCP segment of a reassembled PDU]"
"0.521656","172.18.0.2","54.38.73.16","TLSv1.2","705","Application Data"
"0.546555","54.38.73.16","172.18.0.2","TCP","68","21002 → 36876 [ACK] Seq=544 Ack=2629 Win=1448 Len=0 TSval=2674627441 TSecr=1081913127"
"1.134903","54.38.73.16","172.18.0.2","TLSv1.2","611","Application Data"
"1.180979","172.18.0.2","54.38.73.16","TCP","68","36876 → 21002 [ACK] Seq=2629 Ack=1087 Win=5612 Len=0 TSval=1081913787 TSecr=2674627559"
"1.205913","54.38.73.16","172.18.0.2","TLSv1.2","1125","Application Data"
"1.205969","172.18.0.2","54.38.73.16","TCP","68","36876 → 21002 [ACK] Seq=2629 Ack=2144 Win=5604 Len=0 TSval=1081913812 TSecr=2674627605"
"1.211975","172.18.0.2","54.38.73.16","TLSv1.2","611","Application Data"
"1.236181","54.38.73.16","172.18.0.2","TCP","68","21002 → 36876 [ACK] Seq=2144 Ack=3172 Win=1452 Len=0 TSval=2674627613 TSecr=1081913818"
"1.650588","54.38.73.16","172.18.0.2","TLSv1.2","611","Application Data"
"1.650641","172.18.0.2","54.38.73.16","TCP","68","36876 → 21002 [ACK] Seq=3172 Ack=2687 Win=5608 Len=0 TSval=1081914256 TSecr=2674627711"
"1.651557","172.18.0.2","54.38.73.16","TLSv1.2","611","Application Data"
"1.676406","54.38.73.16","172.18.0.2","TCP","68","21002 → 36876 [ACK] Seq=2687 Ack=3715 Win=1452 Len=0 TSval=2674627723 TSecr=1081914257"
"2.033518","54.38.73.16","172.18.0.2","TLSv1.2","4145","Application Data"
"2.033579","172.18.0.2","54.38.73.16","TCP","68","36876 → 21002 [ACK] Seq=3715 Ack=6764 Win=5581 Len=0 TSval=1081914639 TSecr=2674627812"
"2.058936","54.38.73.16","172.18.0.2","TLSv1.2","161","Application Data"
"2.058967","172.18.0.2","54.38.73.16","TCP","68","36876 → 21002 [ACK] Seq=3715 Ack=6857 Win=5609 Len=0 TSval=1081914665 TSecr=2674627819"
"2.065340","54.38.73.16","172.18.0.2","TCP","2964","[TCP segment of a reassembled PDU]"
"2.065360","172.18.0.2","54.38.73.16","TCP","68","36876 → 21002 [ACK] Seq=3715 Ack=9753 Win=5596 Len=0 TSval=1081914671 TSecr=2674627820"
"2.075566","54.38.73.16","172.18.0.2","TLSv1.2","2964","Application Data, Application Data"
"2.075593","172.18.0.2","54.38.73.16","TCP","68","36876 → 21002 [ACK] Seq=3715 Ack=12649 Win=5596 Len=0 TSval=1081914681 TSecr=2674627823"
"2.082559","54.38.73.16","172.18.0.2","TLSv1.2","2616","Application Data, Application Data"
"2.082579","172.18.0.2","54.38.73.16","TCP","68","36876 → 21002 [ACK] Seq=3715 Ack=15197 Win=5597 Len=0 TSval=1081914688 TSecr=2674627825"
"2.089145","54.38.73.16","172.18.0.2","TCP","2964","[TCP segment of a reassembled PDU]"
"2.089177","172.18.0.2","54.38.73.16","TCP","68","36876 → 21002 [ACK] Seq=3715 Ack=18093 Win=5596 Len=0 TSval=1081914695 TSecr=2674627826"
"2.100198","54.38.73.16","172.18.0.2","TLSv1.2","2964","Application Data [TCP segment of a reassembled PDU]"
"2.100218","172.18.0.2","54.38.73.16","TCP","68","36876 → 21002 [ACK] Seq=3715 Ack=20989 Win=5596 Len=0 TSval=1081914706 TSecr=2674627829"
"2.105651","54.38.73.16","172.18.0.2","TLSv1.2","2964","Application Data [TCP segment of a reassembled PDU]"
"2.105685","172.18.0.2","54.38.73.16","TCP","68","36876 → 21002 [ACK] Seq=3715 Ack=23885 Win=5596 Len=0 TSval=1081914711 TSecr=2674627831"
"2.113234","54.38.73.16","172.18.0.2","TLSv1.2","2964","Application Data [TCP segment of a reassembled PDU]"
"2.113256","172.18.0.2","54.38.73.16","TCP","68","36876 → 21002 [ACK] Seq=3715 Ack=26781 Win=5596 Len=0 TSval=1081914719 TSecr=2674627832"
"2.123771","54.38.73.16","172.18.0.2","TCP","2964","21002 → 36876 [ACK] Seq=26781 Ack=3715 Win=1452 Len=2896 TSval=2674627835 TSecr=1081914706 [TCP segment of a reassembled PDU]"
"2.123799","172.18.0.2","54.38.73.16","TCP","68","36876 → 21002 [ACK] Seq=3715 Ack=29677 Win=5596 Len=0 TSval=1081914730 TSecr=2674627835"
"2.129839","54.38.73.16","172.18.0.2","TLSv1.2","2964","Application Data, Application Data"
"2.129858","172.18.0.2","54.38.73.16","TCP","68","36876 → 21002 [ACK] Seq=3715 Ack=32573 Win=5596 Len=0 TSval=1081914736 TSecr=2674627837"
"2.130226","172.18.0.2","54.38.73.16","TLSv1.2","1125","Application Data"
"2.137711","54.38.73.16","172.18.0.2","TLSv1.2","2964","Application Data [TCP segment of a reassembled PDU]"
"2.137743","172.18.0.2","54.38.73.16","TCP","68","36876 → 21002 [ACK] Seq=4772 Ack=35469 Win=5596 Len=0 TSval=1081914743 TSecr=2674627838"
"2.148204","54.38.73.16","172.18.0.2","TLSv1.2","2615","Application Data"
"2.148226","172.18.0.2","54.38.73.16","TCP","68","36876 → 21002 [ACK] Seq=4772 Ack=38016 Win=5597 Len=0 TSval=1081914754 TSecr=2674627841"
"2.153565","54.38.73.16","172.18.0.2","TCP","68","21002 → 36876 [ACK] Seq=38016 Ack=4772 Win=1452 Len=0 TSval=2674627843 TSecr=1081914736"
"2.167461","54.38.73.16","172.18.0.2","TCP","2964","[TCP segment of a reassembled PDU]"
"2.167628","172.18.0.2","54.38.73.16","TCP","68","36876 → 21002 [ACK] Seq=4772 Ack=40912 Win=5596 Len=0 TSval=1081914773 TSecr=2674627846"
"2.167658","54.38.73.16","172.18.0.2","TLSv1.2","4412","Application Data [TCP segment of a reassembled PDU]"
"2.167729","172.18.0.2","54.38.73.16","TCP","68","36876 → 21002 [ACK] Seq=4772 Ack=45256 Win=5565 Len=0 TSval=1081914773 TSecr=2674627846"
"2.171736","54.38.73.16","172.18.0.2","TLSv1.2","2964","Application Data [TCP segment of a reassembled PDU]"
"2.171768","172.18.0.2","54.38.73.16","TCP","68","36876 → 21002 [ACK] Seq=4772 Ack=48152 Win=5596 Len=0 TSval=1081914777 TSecr=2674627847"
"2.191226","54.38.73.16","172.18.0.2","TCP","1516","21002 → 36876 [ACK] Seq=48152 Ack=4772 Win=1452 Len=1448 TSval=2674627852 TSecr=1081914773 [TCP segment of a reassembled PDU]"
"2.191902","54.38.73.16","172.18.0.2","TLSv1.2","5077","Application Data, Application Data, Application Data"
"2.192019","172.18.0.2","54.38.73.16","TCP","68","36876 → 21002 [ACK] Seq=4772 Ack=54609 Win=5584 Len=0 TSval=1081914798 TSecr=2674627852"
"2.192854","172.18.0.2","54.38.73.16","TLSv1.2","611","Application Data"
"2.196825","54.38.73.16","172.18.0.2","TCP","2964","[TCP segment of a reassembled PDU]"
"2.196951","172.18.0.2","54.38.73.16","TCP","68","36876 → 21002 [ACK] Seq=5315 Ack=57505 Win=5596 Len=0 TSval=1081914803 TSecr=2674627853"
"2.215956","54.38.73.16","172.18.0.2","TLSv1.2","5860","Application Data, Application Data"
"2.216125","172.18.0.2","54.38.73.16","TCP","68","36876 → 21002 [ACK] Seq=5315 Ack=63297 Win=5581 Len=0 TSval=1081914822 TSecr=2674627858"
"2.220903","54.38.73.16","172.18.0.2","TLSv1.2","2964","Application Data [TCP segment of a reassembled PDU]"
"2.220949","172.18.0.2","54.38.73.16","TCP","68","36876 → 21002 [ACK] Seq=5315 Ack=66193 Win=5596 Len=0 TSval=1081914827 TSecr=2674627859"
"2.228777","54.38.73.16","172.18.0.2","TLSv1.2","1516","Application Data [TCP segment of a reassembled PDU]"
"2.239625","54.38.73.16","172.18.0.2","TLSv1.2","4412","Application Data [TCP segment of a reassembled PDU]"
"2.239821","172.18.0.2","54.38.73.16","TCP","68","36876 → 21002 [ACK] Seq=5315 Ack=71985 Win=5580 Len=0 TSval=1081914846 TSecr=2674627861"
"2.245816","54.38.73.16","172.18.0.2","TLSv1.2","2427","Application Data, Application Data"
"2.245837","172.18.0.2","54.38.73.16","TCP","68","36876 → 21002 [ACK] Seq=5315 Ack=74344 Win=5598 Len=0 TSval=1081914852 TSecr=2674627865"
"2.270600","54.38.73.16","172.18.0.2","TLSv1.2","1125","Application Data"
"2.291028","54.38.73.16","172.18.0.2","TCP","1516","[TCP segment of a reassembled PDU]"
"2.291191","172.18.0.2","54.38.73.16","TCP","68","36876 → 21002 [ACK] Seq=5315 Ack=76849 Win=5593 Len=0 TSval=1081914897 TSecr=2674627872"
"2.314671","54.38.73.16","172.18.0.2","TLSv1.2","1219","Application Data"
"2.325789","172.18.0.2","54.38.73.16","TLSv1.2","611","Application Data"
"2.392064","54.38.73.16","172.18.0.2","TCP","68","21002 → 36876 [ACK] Seq=78000 Ack=5858 Win=1452 Len=0 TSval=2674627902 TSecr=1081914931"
"2.972283","54.38.73.16","172.18.0.2","TLSv1.2","611","Application Data"
"2.972393","54.38.73.16","172.18.0.2","TCP","611","[TCP Retransmission] 21002 → 36876 [PSH, ACK] Seq=78000 Ack=5858 Win=1452 Len=543 TSval=2674628039 TSecr=1081914931"
"2.972415","172.18.0.2","54.38.73.16","TCP","80","36876 → 21002 [ACK] Seq=5858 Ack=78543 Win=5608 Len=0 TSval=1081915578 TSecr=2674628039 SLE=78000 SRE=78543"
"2.973193","172.18.0.2","54.38.73.16","TLSv1.2","611","Application Data"
"2.996421","54.38.73.16","172.18.0.2","TCP","68","21002 → 36876 [ACK] Seq=78543 Ack=6401 Win=1452 Len=0 TSval=2674628053 TSecr=1081915579"
"3.382441","54.38.73.16","172.18.0.2","TLSv1.2","3695","Application Data"
"3.382483","172.18.0.2","54.38.73.16","TCP","68","36876 → 21002 [ACK] Seq=6401 Ack=82170 Win=5584 Len=0 TSval=1081915988 TSecr=2674628145"
"3.382892","172.18.0.2","54.38.73.16","TLSv1.2","611","Application Data"
"3.394387","54.38.73.16","172.18.0.2","TLSv1.2","5860","Application Data"
"3.394425","172.18.0.2","54.38.73.16","TCP","68","36876 → 21002 [ACK] Seq=6944 Ack=87962 Win=5581 Len=0 TSval=1081916000 TSecr=2674628153"
"3.407829","54.38.73.16","172.18.0.2","TCP","68","21002 → 36876 [ACK] Seq=87962 Ack=6944 Win=1452 Len=0 TSval=2674628156 TSecr=1081915989"
"3.418978","54.38.73.16","172.18.0.2","TLSv1.2","6185","Application Data, Application Data"
"3.418999","172.18.0.2","54.38.73.16","TCP","68","36876 → 21002 [ACK] Seq=6944 Ack=94079 Win=5565 Len=0 TSval=1081916025 TSecr=2674628159"
"3.444411","54.38.73.16","172.18.0.2","TLSv1.2","6294","Application Data, Application Data"
"3.444436","172.18.0.2","54.38.73.16","TCP","68","36876 → 21002 [ACK] Seq=6944 Ack=100305 Win=5565 Len=0 TSval=1081916050 TSecr=2674628165"
"3.451820","172.18.0.2","54.38.73.16","TLSv1.2","611","Application Data"
"3.514847","54.38.73.16","172.18.0.2","TCP","68","21002 → 36876 [ACK] Seq=100305 Ack=7487 Win=1452 Len=0 TSval=2674628183 TSecr=1081916058"
"4.098534","54.38.73.16","172.18.0.2","TLSv1.2","611","Application Data"
"4.099419","172.18.0.2","54.38.73.16","TLSv1.2","611","Application Data"
"4.122728","54.38.73.16","172.18.0.2","TCP","68","21002 → 36876 [ACK] Seq=100848 Ack=8030 Win=1452 Len=0 TSval=2674628335 TSecr=1081916705"
"4.513449","54.38.73.16","172.18.0.2","TLSv1.2","611","Application Data"
"4.556894","172.18.0.2","54.38.73.16","TCP","68","36876 → 21002 [ACK] Seq=8030 Ack=101391 Win=5612 Len=0 TSval=1081917163 TSecr=2674628426"
"4.714309","54.38.73.16","172.18.0.2","TLSv1.2","3695","Application Data"
"4.714360","172.18.0.2","54.38.73.16","TCP","68","36876 → 21002 [ACK] Seq=8030 Ack=105018 Win=5584 Len=0 TSval=1081917320 TSecr=2674628476"
"4.793852","54.38.73.16","172.18.0.2","TLSv1.2","3695","Application Data"
"4.793886","172.18.0.2","54.38.73.16","TCP","68","36876 → 21002 [ACK] Seq=8030 Ack=108645 Win=5580 Len=0 TSval=1081917400 TSecr=2674628502"
"4.876625","54.38.73.16","172.18.0.2","TLSv1.2","3181","Application Data"
"4.876659","172.18.0.2","54.38.73.16","TCP","68","36876 → 21002 [ACK] Seq=8030 Ack=111758 Win=5580 Len=0 TSval=1081917482 TSecr=2674628523"
"4.909875","54.38.73.16","172.18.0.2","TLSv1.2","1125","Application Data"
"4.909914","172.18.0.2","54.38.73.16","TCP","68","36876 → 21002 [ACK] Seq=8030 Ack=112815 Win=5593 Len=0 TSval=1081917516 TSecr=2674628531"
"4.935285","54.38.73.16","172.18.0.2","TLSv1.2","611","Application Data"
"4.935321","172.18.0.2","54.38.73.16","TCP","68","36876 → 21002 [ACK] Seq=8030 Ack=113358 Win=5593 Len=0 TSval=1081917541 TSecr=2674628538"
"4.959539","54.38.73.16","172.18.0.2","TLSv1.2","1639","Application Data"
"4.959574","172.18.0.2","54.38.73.16","TCP","68","36876 → 21002 [ACK] Seq=8030 Ack=114929 Win=5601 Len=0 TSval=1081917565 TSecr=2674628544"
"4.965061","172.18.0.2","54.38.73.16","TLSv1.2","611","Application Data"
"4.989383","54.38.73.16","172.18.0.2","TCP","68","21002 → 36876 [ACK] Seq=114929 Ack=8573 Win=1452 Len=0 TSval=2674628551 TSecr=1081917571"
"5.737184","54.38.73.16","172.18.0.2","TLSv1.2","611","Application Data"
"5.737239","172.18.0.2","54.38.73.16","TCP","68","36876 → 21002 [ACK] Seq=8573 Ack=115472 Win=5608 Len=0 TSval=1081918343 TSecr=2674628726"
"5.738275","172.18.0.2","54.38.73.16","TLSv1.2","611","Application Data"
"5.763042","54.38.73.16","172.18.0.2","TCP","68","21002 → 36876 [ACK] Seq=115472 Ack=9116 Win=1452 Len=0 TSval=2674628745 TSecr=1081918344"
"6.136677","54.38.73.16","172.18.0.2","TLSv1.2","4145","Application Data"
"6.136733","172.18.0.2","54.38.73.16","TCP","68","36876 → 21002 [ACK] Seq=9116 Ack=119549 Win=5589 Len=0 TSval=1081918742 TSecr=2674628838"
"6.136683","54.38.73.16","172.18.0.2","TCP","2964","[TCP segment of a reassembled PDU]"
"6.136753","172.18.0.2","54.38.73.16","TCP","68","36876 → 21002 [ACK] Seq=9116 Ack=122445 Win=5567 Len=0 TSval=1081918742 TSecr=2674628838"
"6.160378","54.38.73.16","172.18.0.2","TLSv1.2","2964","Application Data [TCP segment of a reassembled PDU]"
"6.160421","172.18.0.2","54.38.73.16","TCP","68","36876 → 21002 [ACK] Seq=9116 Ack=125341 Win=5596 Len=0 TSval=1081918766 TSecr=2674628844"
"6.161652","54.38.73.16","172.18.0.2","TLSv1.2","1594","Application Data"
"6.161690","172.18.0.2","54.38.73.16","TCP","68","36876 → 21002 [ACK] Seq=9116 Ack=126867 Win=5586 Len=0 TSval=1081918767 TSecr=2674628845"
"6.186354","54.38.73.16","172.18.0.2","TLSv1.2","1125","Application Data"
"6.186391","172.18.0.2","54.38.73.16","TCP","68","36876 → 21002 [ACK] Seq=9116 Ack=127924 Win=5593 Len=0 TSval=1081918792 TSecr=2674628851"
"6.188825","54.38.73.16","172.18.0.2","TCP","1516","[TCP segment of a reassembled PDU]"
"6.188869","172.18.0.2","54.38.73.16","TCP","68","36876 → 21002 [ACK] Seq=9116 Ack=129372 Win=5593 Len=0 TSval=1081918795 TSecr=2674628851"
"6.209900","54.38.73.16","172.18.0.2","TLSv1.2","191","Application Data"
"6.209936","172.18.0.2","54.38.73.16","TCP","68","36876 → 21002 [ACK] Seq=9116 Ack=129495 Win=5593 Len=0 TSval=1081918816 TSecr=2674628857"
"6.219963","54.38.73.16","172.18.0.2","TCP","1516","[TCP segment of a reassembled PDU]"
"6.219995","172.18.0.2","54.38.73.16","TCP","68","36876 → 21002 [ACK] Seq=9116 Ack=130943 Win=5593 Len=0 TSval=1081918826 TSecr=2674628859"
"6.233991","54.38.73.16","172.18.0.2","TLSv1.2","705","Application Data"
"6.234027","172.18.0.2","54.38.73.16","TCP","68","36876 → 21002 [ACK] Seq=9116 Ack=131580 Win=5593 Len=0 TSval=1081918840 TSecr=2674628863"
"6.241130","54.38.73.16","172.18.0.2","TCP","2964","[TCP segment of a reassembled PDU]"
"6.241162","172.18.0.2","54.38.73.16","TCP","68","36876 → 21002 [ACK] Seq=9116 Ack=134476 Win=5596 Len=0 TSval=1081918847 TSecr=2674628864"
"6.250198","54.38.73.16","172.18.0.2","TLSv1.2","2964","Application Data [TCP segment of a reassembled PDU]"
"6.250230","172.18.0.2","54.38.73.16","TCP","68","36876 → 21002 [ACK] Seq=9116 Ack=137372 Win=5596 Len=0 TSval=1081918856 TSecr=2674628867"
"6.250714","172.18.0.2","54.38.73.16","TLSv1.2","611","Application Data"
"6.264775","54.38.73.16","172.18.0.2","TLSv1.2","2964","Application Data [TCP segment of a reassembled PDU]"
"6.264824","172.18.0.2","54.38.73.16","TCP","68","36876 → 21002 [ACK] Seq=9659 Ack=140268 Win=5596 Len=0 TSval=1081918871 TSecr=2674628870"
"6.272115","54.38.73.16","172.18.0.2","TCP","1516","21002 → 36876 [ACK] Seq=140268 Ack=9116 Win=1452 Len=1448 TSval=2674628872 TSecr=1081918847 [TCP segment of a reassembled PDU]"
"6.273870","54.38.73.16","172.18.0.2","TLSv1.2","2964","Application Data [TCP segment of a reassembled PDU]"
"6.273904","172.18.0.2","54.38.73.16","TCP","68","36876 → 21002 [ACK] Seq=9659 Ack=144612 Win=5596 Len=0 TSval=1081918880 TSecr=2674628872"
"6.274437","54.38.73.16","172.18.0.2","TCP","68","21002 → 36876 [ACK] Seq=144612 Ack=9659 Win=1452 Len=0 TSval=2674628873 TSecr=1081918856"
"6.274487","172.18.0.2","54.38.73.16","TLSv1.2","611","Application Data"
"6.290264","54.38.73.16","172.18.0.2","TLSv1.2","2058","Application Data"
"6.290416","172.18.0.2","54.38.73.16","TCP","68","36876 → 21002 [ACK] Seq=10202 Ack=146602 Win=5612 Len=0 TSval=1081918896 TSecr=2674628876"
"6.304389","54.38.73.16","172.18.0.2","TCP","2964","[TCP segment of a reassembled PDU]"
"6.304545","172.18.0.2","54.38.73.16","TCP","68","36876 → 21002 [ACK] Seq=10202 Ack=149498 Win=5596 Len=0 TSval=1081918910 TSecr=2674628880"
"6.314722","54.38.73.16","172.18.0.2","TLSv1.2","799","Application Data"
"6.323031","172.18.0.2","54.38.73.16","TLSv1.2","611","Application Data"
"6.385790","54.38.73.16","172.18.0.2","TCP","68","21002 → 36876 [ACK] Seq=150229 Ack=10745 Win=1452 Len=0 TSval=2674628901 TSecr=1081918929"
"6.964920","54.38.73.16","172.18.0.2","TLSv1.2","611","Application Data"
"6.965047","54.38.73.16","172.18.0.2","TCP","611","[TCP Retransmission] 21002 → 36876 [PSH, ACK] Seq=150229 Ack=10745 Win=1452 Len=543 TSval=2674629032 TSecr=1081918929"
"6.965098","172.18.0.2","54.38.73.16","TCP","80","36876 → 21002 [ACK] Seq=10745 Ack=150772 Win=5608 Len=0 TSval=1081919571 TSecr=2674629032 SLE=150229 SRE=150772"
"6.966077","172.18.0.2","54.38.73.16","TLSv1.2","611","Application Data"
"6.989925","54.38.73.16","172.18.0.2","TCP","68","21002 → 36876 [ACK] Seq=150772 Ack=11288 Win=1452 Len=0 TSval=2674629052 TSecr=1081919572"
"7.376651","54.38.73.16","172.18.0.2","TLSv1.2","3695","Application Data"
"7.376717","172.18.0.2","54.38.73.16","TCP","68","36876 → 21002 [ACK] Seq=11288 Ack=154399 Win=5584 Len=0 TSval=1081919982 TSecr=2674629140"
"7.376657","54.38.73.16","172.18.0.2","TCP","2964","[TCP segment of a reassembled PDU]"
"7.376749","172.18.0.2","54.38.73.16","TCP","68","36876 → 21002 [ACK] Seq=11288 Ack=157295 Win=5566 Len=0 TSval=1081919982 TSecr=2674629145"
"7.401506","54.38.73.16","172.18.0.2","TLSv1.2","5860","Application Data, Application Data, Application Data"
"7.401542","172.18.0.2","54.38.73.16","TCP","68","36876 → 21002 [ACK] Seq=11288 Ack=163087 Win=5581 Len=0 TSval=1081920007 TSecr=2674629155"
"7.426925","54.38.73.16","172.18.0.2","TLSv1.2","5461","Application Data, Application Data, Application Data, Application Data"
"7.426965","172.18.0.2","54.38.73.16","TCP","68","36876 → 21002 [ACK] Seq=11288 Ack=168480 Win=5582 Len=0 TSval=1081920033 TSecr=2674629161"
"7.428292","172.18.0.2","54.38.73.16","TLSv1.2","611","Application Data"
"7.450845","54.38.73.16","172.18.0.2","TLSv1.2","611","Application Data"
"7.450881","172.18.0.2","54.38.73.16","TCP","68","36876 → 21002 [ACK] Seq=11831 Ack=169023 Win=5608 Len=0 TSval=1081920057 TSecr=2674629167"
"7.451980","54.38.73.16","172.18.0.2","TCP","68","21002 → 36876 [ACK] Seq=169023 Ack=11831 Win=1452 Len=0 TSval=2674629167 TSecr=1081920034"
"7.452022","172.18.0.2","54.38.73.16","TLSv1.2","611","Application Data"
"7.475808","54.38.73.16","172.18.0.2","TCP","68","21002 → 36876 [ACK] Seq=169023 Ack=12374 Win=1452 Len=0 TSval=2674629173 TSecr=1081920058"
"8.093685","54.38.73.16","172.18.0.2","TLSv1.2","611","Application Data"
"8.094708","172.18.0.2","54.38.73.16","TLSv1.2","611","Application Data"
"8.119095","54.38.73.16","172.18.0.2","TCP","68","21002 → 36876 [ACK] Seq=169566 Ack=12917 Win=1452 Len=0 TSval=2674629334 TSecr=1081920700"
"8.807795","54.38.73.16","172.18.0.2","TLSv1.2","611","Application Data"
"8.807933","54.38.73.16","172.18.0.2","TCP","2964","[TCP segment of a reassembled PDU]"
"8.807986","172.18.0.2","54.38.73.16","TCP","68","36876 → 21002 [ACK] Seq=12917 Ack=173005 Win=5586 Len=0 TSval=1081921414 TSecr=2674629487"
"8.815674","54.38.73.16","172.18.0.2","TLSv1.2","1516","Application Data [TCP segment of a reassembled PDU]"
"8.831931","54.38.73.16","172.18.0.2","TLSv1.2","3521","Application Data, Application Data"
"8.832100","172.18.0.2","54.38.73.16","TCP","68","36876 → 21002 [ACK] Seq=12917 Ack=177906 Win=5580 Len=0 TSval=1081921438 TSecr=2674629508"
"8.920916","54.38.73.16","172.18.0.2","TCP","2964","[TCP segment of a reassembled PDU]"
"8.920949","172.18.0.2","54.38.73.16","TCP","68","36876 → 21002 [ACK] Seq=12917 Ack=180802 Win=5596 Len=0 TSval=1081921527 TSecr=2674629534"
"8.921253","54.38.73.16","172.18.0.2","TLSv1.2","1249","Application Data"
"8.942710","54.38.73.16","172.18.0.2","TLSv1.2","1516","Application Data"
"8.942884","172.18.0.2","54.38.73.16","TCP","68","36876 → 21002 [ACK] Seq=12917 Ack=183431 Win=5593 Len=0 TSval=1081921549 TSecr=2674629534"
"8.944494","54.38.73.16","172.18.0.2","TLSv1.2","2964","Application Data [TCP segment of a reassembled PDU]"
"8.944523","172.18.0.2","54.38.73.16","TCP","68","36876 → 21002 [ACK] Seq=12917 Ack=186327 Win=5596 Len=0 TSval=1081921550 TSecr=2674629540"
"8.967698","54.38.73.16","172.18.0.2","TLSv1.2","2964","Application Data [TCP segment of a reassembled PDU]"
"8.967733","172.18.0.2","54.38.73.16","TCP","68","36876 → 21002 [ACK] Seq=12917 Ack=189223 Win=5596 Len=0 TSval=1081921573 TSecr=2674629546"
"8.967885","54.38.73.16","172.18.0.2","TLSv1.2","2803","Application Data, Application Data"
"8.968127","172.18.0.2","54.38.73.16","TCP","68","36876 → 21002 [ACK] Seq=12917 Ack=191958 Win=5581 Len=0 TSval=1081921574 TSecr=2674629546"
"8.968552","172.18.0.2","54.38.73.16","TLSv1.2","611","Application Data"
"8.991875","54.38.73.16","172.18.0.2","TCP","68","21002 → 36876 [ACK] Seq=191958 Ack=13460 Win=1452 Len=0 TSval=2674629552 TSecr=1081921574"
"9.001005","54.38.73.16","172.18.0.2","TCP","2964","[TCP segment of a reassembled PDU]"
"9.001018","172.18.0.2","54.38.73.16","TCP","68","36876 → 21002 [ACK] Seq=13460 Ack=194854 Win=5596 Len=0 TSval=1081921607 TSecr=2674629554"
"9.001142","54.38.73.16","172.18.0.2","TLSv1.2","1249","Application Data"
"9.001146","54.38.73.16","172.18.0.2","TCP","1516","[TCP segment of a reassembled PDU]"
"9.001157","172.18.0.2","54.38.73.16","TCP","68","36876 → 21002 [ACK] Seq=13460 Ack=197483 Win=5597 Len=0 TSval=1081921607 TSecr=2674629554"
"9.001254","172.18.0.2","54.38.73.16","TLSv1.2","611","Application Data"
"9.018174","54.38.73.16","172.18.0.2","TLSv1.2","1516","Application Data [TCP segment of a reassembled PDU]"
"9.024837","54.38.73.16","172.18.0.2","TCP","2964","21002 → 36876 [ACK] Seq=198931 Ack=13460 Win=1452 Len=2896 TSval=2674629560 TSecr=1081921607 [TCP segment of a reassembled PDU]"
"9.024933","172.18.0.2","54.38.73.16","TCP","68","36876 → 21002 [ACK] Seq=14003 Ack=201827 Win=5612 Len=0 TSval=1081921631 TSecr=2674629559"
"9.025513","54.38.73.16","172.18.0.2","TLSv1.2","595","Application Data, Application Data"
"9.039115","54.38.73.16","172.18.0.2","TCP","1516","[TCP segment of a reassembled PDU]"
"9.039234","172.18.0.2","54.38.73.16","TCP","68","36876 → 21002 [ACK] Seq=14003 Ack=203802 Win=5597 Len=0 TSval=1081921645 TSecr=2674629561"
"9.051101","54.38.73.16","172.18.0.2","TLSv1.2","2964","Application Data [TCP segment of a reassembled PDU]"
"9.051248","172.18.0.2","54.38.73.16","TCP","68","36876 → 21002 [ACK] Seq=14003 Ack=206698 Win=5596 Len=0 TSval=1081921657 TSecr=2674629566"
"9.062776","54.38.73.16","172.18.0.2","TLSv1.2","2464","Application Data"
"9.062809","172.18.0.2","54.38.73.16","TCP","68","36876 → 21002 [ACK] Seq=14003 Ack=209094 Win=5598 Len=0 TSval=1081921669 TSecr=2674629570"
"9.075098","54.38.73.16","172.18.0.2","TCP","1516","[TCP segment of a reassembled PDU]"
"9.087137","54.38.73.16","172.18.0.2","TLSv1.2","191","Application Data"
"9.087284","172.18.0.2","54.38.73.16","TCP","68","36876 → 21002 [ACK] Seq=14003 Ack=210665 Win=5612 Len=0 TSval=1081921693 TSecr=2674629573"
"9.096162","172.18.0.2","54.38.73.16","TLSv1.2","611","Application Data"
"9.157334","54.38.73.16","172.18.0.2","TCP","68","21002 → 36876 [ACK] Seq=210665 Ack=14546 Win=1452 Len=0 TSval=2674629594 TSecr=1081921702"
"9.733058","54.38.73.16","172.18.0.2","TLSv1.2","611","Application Data"
"9.733995","172.18.0.2","54.38.73.16","TLSv1.2","611","Application Data"
"9.757550","54.38.73.16","172.18.0.2","TCP","68","21002 → 36876 [ACK] Seq=211208 Ack=15089 Win=1452 Len=0 TSval=2674629744 TSecr=1081922340"
"10.080156","54.38.73.16","172.18.0.2","TLSv1.2","611","Application Data"
"10.120984","172.18.0.2","54.38.73.16","TCP","68","36876 → 21002 [ACK] Seq=15089 Ack=211751 Win=5612 Len=0 TSval=1081922727 TSecr=2674629824"
"10.133467","54.38.73.16","172.18.0.2","TCP","2964","[TCP segment of a reassembled PDU]"
"10.133496","172.18.0.2","54.38.73.16","TCP","68","36876 → 21002 [ACK] Seq=15089 Ack=214647 Win=5596 Len=0 TSval=1081922739 TSecr=2674629837"
"10.142500","54.38.73.16","172.18.0.2","TLSv1.2","2964","Application Data [TCP segment of a reassembled PDU]"
"10.142530","172.18.0.2","54.38.73.16","TCP","68","36876 → 21002 [ACK] Seq=15089 Ack=217543 Win=5596 Len=0 TSval=1081922748 TSecr=2674629840"
"10.158353","54.38.73.16","172.18.0.2","TCP","1516","21002 → 36876 [ACK] Seq=217543 Ack=15089 Win=1452 Len=1448 TSval=2674629844 TSecr=1081922739 [TCP segment of a reassembled PDU]"
"10.158403","172.18.0.2","54.38.73.16","TCP","68","36876 → 21002 [ACK] Seq=15089 Ack=218991 Win=5593 Len=0 TSval=1081922764 TSecr=2674629844"
"10.158583","54.38.73.16","172.18.0.2","TLSv1.2","1516","Application Data [TCP segment of a reassembled PDU]"
"10.158601","172.18.0.2","54.38.73.16","TCP","68","36876 → 21002 [ACK] Seq=15089 Ack=220439 Win=5593 Len=0 TSval=1081922764 TSecr=2674629844"
"10.166888","54.38.73.16","172.18.0.2","TLSv1.2","2964","Application Data [TCP segment of a reassembled PDU]"
"10.166918","172.18.0.2","54.38.73.16","TCP","68","36876 → 21002 [ACK] Seq=15089 Ack=223335 Win=5596 Len=0 TSval=1081922773 TSecr=2674629846"
"10.174412","54.38.73.16","172.18.0.2","TCP","1516","21002 → 36876 [ACK] Seq=223335 Ack=15089 Win=1452 Len=1448 TSval=2674629848 TSecr=1081922748 [TCP segment of a reassembled PDU]"
"10.174441","172.18.0.2","54.38.73.16","TCP","68","36876 → 21002 [ACK] Seq=15089 Ack=224783 Win=5593 Len=0 TSval=1081922780 TSecr=2674629848"
"10.181868","54.38.73.16","172.18.0.2","TLSv1.2","1516","Application Data [TCP segment of a reassembled PDU]"
"10.181899","172.18.0.2","54.38.73.16","TCP","68","36876 → 21002 [ACK] Seq=15089 Ack=226231 Win=5593 Len=0 TSval=1081922788 TSecr=2674629850"
"10.182555","54.38.73.16","172.18.0.2","TLSv1.2","2964","Application Data [TCP segment of a reassembled PDU]"
"10.182582","172.18.0.2","54.38.73.16","TCP","68","36876 → 21002 [ACK] Seq=15089 Ack=229127 Win=5596 Len=0 TSval=1081922788 TSecr=2674629850"
"10.191621","54.38.73.16","172.18.0.2","TLSv1.2","2398","Application Data"
"10.191649","172.18.0.2","54.38.73.16","TCP","68","36876 → 21002 [ACK] Seq=15089 Ack=231457 Win=5598 Len=0 TSval=1081922797 TSecr=2674629852"
"10.195364","54.38.73.16","172.18.0.2","TCP","1516","[TCP segment of a reassembled PDU]"
"10.195392","172.18.0.2","54.38.73.16","TCP","68","36876 → 21002 [ACK] Seq=15089 Ack=232905 Win=5593 Len=0 TSval=1081922801 TSecr=2674629853"
"10.205937","54.38.73.16","172.18.0.2","TCP","1516","21002 → 36876 [ACK] Seq=232905 Ack=15089 Win=1452 Len=1448 TSval=2674629856 TSecr=1081922788 [TCP segment of a reassembled PDU]"
"10.205966","172.18.0.2","54.38.73.16","TCP","68","36876 → 21002 [ACK] Seq=15089 Ack=234353 Win=5593 Len=0 TSval=1081922812 TSecr=2674629856"
"10.216920","54.38.73.16","172.18.0.2","TLSv1.2","799","Application Data"
"10.216951","172.18.0.2","54.38.73.16","TCP","68","36876 → 21002 [ACK] Seq=15089 Ack=235084 Win=5593 Len=0 TSval=1081922823 TSecr=2674629858"
"10.242136","54.38.73.16","172.18.0.2","TLSv1.2","1125","Application Data"
"10.242172","172.18.0.2","54.38.73.16","TCP","68","36876 → 21002 [ACK] Seq=15089 Ack=236141 Win=5593 Len=0 TSval=1081922848 TSecr=2674629865"
"10.256983","54.38.73.16","172.18.0.2","TCP","2964","[TCP segment of a reassembled PDU]"
"10.257012","172.18.0.2","54.38.73.16","TCP","68","36876 → 21002 [ACK] Seq=15089 Ack=239037 Win=5596 Len=0 TSval=1081922863 TSecr=2674629868"
"10.265988","54.38.73.16","172.18.0.2","TLSv1.2","799","Application Data"
"10.266030","172.18.0.2","54.38.73.16","TCP","68","36876 → 21002 [ACK] Seq=15089 Ack=239768 Win=5593 Len=0 TSval=1081922872 TSecr=2674629871"
"10.266471","172.18.0.2","54.38.73.16","TLSv1.2","611","Application Data"
"10.291156","54.38.73.16","172.18.0.2","TCP","68","21002 → 36876 [ACK] Seq=239768 Ack=15632 Win=1452 Len=0 TSval=2674629877 TSecr=1081922872"
"10.321494","54.38.73.16","172.18.0.2","TLSv1.2","3181","Application Data"
"10.321637","172.18.0.2","54.38.73.16","TCP","68","36876 → 21002 [ACK] Seq=15632 Ack=242881 Win=5588 Len=0 TSval=1081922927 TSecr=2674629884"
"10.322046","172.18.0.2","54.38.73.16","TLSv1.2","611","Application Data"
"10.362008","54.38.73.16","172.18.0.2","TLSv1.2","3695","Application Data"
"10.362155","172.18.0.2","54.38.73.16","TCP","68","36876 → 21002 [ACK] Seq=16175 Ack=246508 Win=5584 Len=0 TSval=1081922968 TSecr=2674629895"
"10.427579","54.38.73.16","172.18.0.2","TLSv1.2","4145","Application Data"
"10.427719","172.18.0.2","54.38.73.16","TCP","68","36876 → 21002 [ACK] Seq=16175 Ack=250585 Win=5580 Len=0 TSval=1081923033 TSecr=2674629911"
"10.452431","54.38.73.16","172.18.0.2","TLSv1.2","1218","Application Data, Application Data"
"10.452717","172.18.0.2","54.38.73.16","TCP","68","36876 → 21002 [ACK] Seq=16175 Ack=251735 Win=5612 Len=0 TSval=1081923058 TSecr=2674629917"
"10.500064","54.38.73.16","172.18.0.2","TLSv1.2","3695","Application Data"
"10.500213","172.18.0.2","54.38.73.16","TCP","68","36876 → 21002 [ACK] Seq=16175 Ack=255362 Win=5584 Len=0 TSval=1081923106 TSecr=2674629929"
"10.531378","54.38.73.16","172.18.0.2","TLSv1.2","1125","Application Data"
"10.531546","172.18.0.2","54.38.73.16","TCP","68","36876 → 21002 [ACK] Seq=16175 Ack=256419 Win=5612 Len=0 TSval=1081923137 TSecr=2674629937"
"10.537825","172.18.0.2","54.38.73.16","TLSv1.2","611","Application Data"
"10.601567","54.38.73.16","172.18.0.2","TCP","68","21002 → 36876 [ACK] Seq=256419 Ack=16718 Win=1452 Len=0 TSval=2674629955 TSecr=1081923144"
"10.858862","54.38.73.16","172.18.0.2","TLSv1.2","611","Application Data"
"10.859901","172.18.0.2","54.38.73.16","TLSv1.2","611","Application Data"
"10.884424","54.38.73.16","172.18.0.2","TCP","68","21002 → 36876 [ACK] Seq=256962 Ack=17261 Win=1452 Len=0 TSval=2674630025 TSecr=1081923466"
"11.232774","54.38.73.16","172.18.0.2","TLSv1.2","4145","Application Data"
"11.232925","172.18.0.2","54.38.73.16","TCP","68","36876 → 21002 [ACK] Seq=17261 Ack=261039 Win=5581 Len=0 TSval=1081923839 TSecr=2674630111"
"11.240603","54.38.73.16","172.18.0.2","TLSv1.2","2964","Application Data"
"11.240635","172.18.0.2","54.38.73.16","TCP","68","36876 → 21002 [ACK] Seq=17261 Ack=263935 Win=5596 Len=0 TSval=1081923846 TSecr=2674630114"
"11.256548","54.38.73.16","172.18.0.2","TLSv1.2","892","Application Data"
"11.260558","54.38.73.16","172.18.0.2","TCP","2964","[TCP segment of a reassembled PDU]"
"11.260590","172.18.0.2","54.38.73.16","TCP","68","36876 → 21002 [ACK] Seq=17261 Ack=267655 Win=5596 Len=0 TSval=1081923866 TSecr=2674630118"
"11.271592","54.38.73.16","172.18.0.2","TLSv1.2","1516","Application Data [TCP segment of a reassembled PDU]"
"11.282742","54.38.73.16","172.18.0.2","TLSv1.2","4412","Application Data [TCP segment of a reassembled PDU]"
"11.282865","172.18.0.2","54.38.73.16","TCP","68","36876 → 21002 [ACK] Seq=17261 Ack=273447 Win=5580 Len=0 TSval=1081923889 TSecr=2674630122"
"11.284525","54.38.73.16","172.18.0.2","TLSv1.2","1516","Application Data [TCP segment of a reassembled PDU]"
"11.284912","54.38.73.16","172.18.0.2","TLSv1.2","2384","Application Data"
"11.284954","172.18.0.2","54.38.73.16","TCP","68","36876 → 21002 [ACK] Seq=17261 Ack=277211 Win=5580 Len=0 TSval=1081923891 TSecr=2674630125"
"11.306897","54.38.73.16","172.18.0.2","TLSv1.2","5860","Application Data, Application Data"
"11.306933","172.18.0.2","54.38.73.16","TCP","68","36876 → 21002 [ACK] Seq=17261 Ack=283003 Win=5581 Len=0 TSval=1081923913 TSecr=2674630131"
"11.309002","54.38.73.16","172.18.0.2","TLSv1.2","3644","Application Data, Application Data"
"11.309145","172.18.0.2","54.38.73.16","TCP","68","36876 → 21002 [ACK] Seq=17261 Ack=286579 Win=5580 Len=0 TSval=1081923915 TSecr=2674630131"
"11.309581","172.18.0.2","54.38.73.16","TLSv1.2","611","Application Data"
"11.331065","54.38.73.16","172.18.0.2","TLSv1.2","4412","Application Data"
"11.331098","172.18.0.2","54.38.73.16","TCP","68","36876 → 21002 [ACK] Seq=17804 Ack=290923 Win=5580 Len=0 TSval=1081923937 TSecr=2674630137"
"11.336026","54.38.73.16","172.18.0.2","TLSv1.2","1436","Application Data"
"11.336040","54.38.73.16","172.18.0.2","TCP","68","21002 → 36876 [ACK] Seq=292291 Ack=17804 Win=1452 Len=0 TSval=2674630138 TSecr=1081923915"
"11.347954","54.38.73.16","172.18.0.2","TCP","2964","[TCP segment of a reassembled PDU]"
"11.347988","172.18.0.2","54.38.73.16","TCP","68","36876 → 21002 [ACK] Seq=17804 Ack=295187 Win=5596 Len=0 TSval=1081923954 TSecr=2674630137"
"11.371684","54.38.73.16","172.18.0.2","TLSv1.2","531","[TCP Previous segment not captured] , Ignored Unknown Record"
"11.371734","172.18.0.2","54.38.73.16","TCP","80","[TCP Dup ACK 289#1] 36876 → 21002 [ACK] Seq=17804 Ack=295187 Win=5596 Len=0 TSval=1081923977 TSecr=2674630137 SLE=298083 SRE=298546"
"11.371700","54.38.73.16","172.18.0.2","TCP","2964","[TCP Out-Of-Order] 21002 → 36876 [ACK] Seq=295187 Ack=17804 Win=1452 Len=2896 TSval=2674630147 TSecr=1081923937"
"11.371767","172.18.0.2","54.38.73.16","TCP","68","36876 → 21002 [ACK] Seq=17804 Ack=298546 Win=5580 Len=0 TSval=1081923977 TSecr=2674630147"
"11.372256","172.18.0.2","54.38.73.16","TLSv1.2","611","Application Data"
"11.434276","54.38.73.16","172.18.0.2","TCP","68","21002 → 36876 [ACK] Seq=298546 Ack=18347 Win=1452 Len=0 TSval=2674630163 TSecr=1081923978"
"11.434315","172.18.0.2","54.38.73.16","TLSv1.2","611","Application Data"
"11.457339","54.38.73.16","172.18.0.2","TCP","68","21002 → 36876 [ACK] Seq=298546 Ack=18890 Win=1452 Len=0 TSval=2674630169 TSecr=1081924040"
"11.779222","54.38.73.16","172.18.0.2","TLSv1.2","611","Application Data"
"11.780266","172.18.0.2","54.38.73.16","TLSv1.2","611","Application Data"
"11.803642","54.38.73.16","172.18.0.2","TCP","68","21002 → 36876 [ACK] Seq=299089 Ack=19433 Win=1452 Len=0 TSval=2674630255 TSecr=1081924386"
