_ws.col.Time,_ws.col.Source,_ws.col.Destination,_ws.col.Protocol,_ws.col.Length,_ws.col.Info
"0.000000","54.38.73.16","172.18.0.2","TCP","68","21002 → 36876 [ACK] Seq=1 Ack=1 Win=1452 Len=0 TSval=2674751969 TSecr=1082411197"
"0.083849","54.38.73.16","172.18.0.2","TLSv1.2","611","Application Data"
"0.083965","172.18.0.2","54.38.73.16","TCP","68","36876 → 21002 [ACK] Seq=1 Ack=544 Win=5612 Len=0 TSval=1082411344 TSecr=2674751989"
"0.130303","172.18.0.2","54.38.73.16","TLSv1.2","611","Application Data"
"0.191587","54.38.73.16","172.18.0.2","TCP","68","21002 → 36876 [ACK] Seq=544 Ack=544 Win=1452 Len=0 TSval=2674752017 TSecr=1082411391"
"0.655856","54.38.73.16","172.18.0.2","TLSv1.2","611","Application Data"
"0.655932","172.18.0.2","54.38.73.16","TCP","68","36876 → 21002 [ACK] Seq=544 Ack=1087 Win=5608 Len=0 TSval=1082411916 TSecr=2674752127"
"0.657052","172.18.0.2","54.38.73.16","TCP","1516","[TCP segment of a reassembled PDU]"
"0.657139","172.18.0.2","54.38.73.16","TLSv1.2","705","Application Data"
"0.681183","54.38.73.16","172.18.0.2","TCP","68","21002 → 36876 [ACK] Seq=1087 Ack=2629 Win=1450 Len=0 TSval=2674752139 TSecr=1082411918"
"1.373057","54.38.73.16","172.18.0.2","TLSv1.2","611","Application Data"
"1.414223","172.18.0.2","54.38.73.16","TCP","68","36876 → 21002 [ACK] Seq=2629 Ack=1630 Win=5612 Len=0 TSval=1082412675 TSecr=2674752289"
"1.445876","54.38.73.16","172.18.0.2","TLSv1.2","1125","Application Data"
"1.445933","172.18.0.2","54.38.73.16","TCP","68","36876 → 21002 [ACK] Seq=2629 Ack=2687 Win=5604 Len=0 TSval=1082412706 TSecr=2674752328"
"1.452430","172.18.0.2","54.38.73.16","TLSv1.2","611","Application Data"
"1.477340","54.38.73.16","172.18.0.2","TCP","68","21002 → 36876 [ACK] Seq=2687 Ack=3172 Win=1452 Len=0 TSval=2674752338 TSecr=1082412713"
"2.601171","54.38.73.16","172.18.0.2","TLSv1.2","611","Application Data"
"2.601221","172.18.0.2","54.38.73.16","TCP","68","36876 → 21002 [ACK] Seq=3172 Ack=3230 Win=5608 Len=0 TSval=1082413862 TSecr=2674752582"
"2.602200","172.18.0.2","54.38.73.16","TLSv1.2","611","Application Data"
"2.626005","54.38.73.16","172.18.0.2","TCP","68","21002 → 36876 [ACK] Seq=3230 Ack=3715 Win=1452 Len=0 TSval=2674752625 TSecr=1082413863"
"3.215759","54.38.73.16","172.18.0.2","TLSv1.2","611","Application Data"
"3.215805","172.18.0.2","54.38.73.16","TCP","68","36876 → 21002 [ACK] Seq=3715 Ack=3773 Win=5608 Len=0 TSval=1082414476 TSecr=2674752761"
"3.242368","54.38.73.16","172.18.0.2","TLSv1.2","3695","Application Data"
"3.242398","172.18.0.2","54.38.73.16","TCP","68","36876 → 21002 [ACK] Seq=3715 Ack=7400 Win=5580 Len=0 TSval=1082414503 TSecr=2674752779"
"3.253067","54.38.73.16","172.18.0.2","TCP","2964","[TCP segment of a reassembled PDU]"
"3.253095","172.18.0.2","54.38.73.16","TCP","68","36876 → 21002 [ACK] Seq=3715 Ack=10296 Win=5596 Len=0 TSval=1082414514 TSecr=2674752782"
"3.264820","54.38.73.16","172.18.0.2","TLSv1.2","4412","Application Data [TCP segment of a reassembled PDU]"
"3.264846","172.18.0.2","54.38.73.16","TCP","68","36876 → 21002 [ACK] Seq=3715 Ack=14640 Win=5580 Len=0 TSval=1082414525 TSecr=2674752785"
"3.266571","54.38.73.16","172.18.0.2","TLSv1.2","82","Application Data"
"3.266596","172.18.0.2","54.38.73.16","TCP","68","36876 → 21002 [ACK] Seq=3715 Ack=14654 Win=5609 Len=0 TSval=1082414527 TSecr=2674752785"
"3.275633","54.38.73.16","172.18.0.2","TCP","1516","[TCP segment of a reassembled PDU]"
"3.275654","172.18.0.2","54.38.73.16","TCP","68","36876 → 21002 [ACK] Seq=3715 Ack=16102 Win=5598 Len=0 TSval=1082414536 TSecr=2674752788"
"3.290781","54.38.73.16","172.18.0.2","TLSv1.2","705","Application Data"
"3.290806","172.18.0.2","54.38.73.16","TCP","68","36876 → 21002 [ACK] Seq=3715 Ack=16739 Win=5594 Len=0 TSval=1082414551 TSecr=2674752791"
"3.306919","54.38.73.16","172.18.0.2","TLSv1.2","4412","Application Data"
"3.306939","172.18.0.2","54.38.73.16","TCP","68","36876 → 21002 [ACK] Seq=3715 Ack=21083 Win=5580 Len=0 TSval=1082414567 TSecr=2674752795"
"3.307351","172.18.0.2","54.38.73.16","TLSv1.2","611","Application Data"
"3.315171","54.38.73.16","172.18.0.2","TLSv1.2","922","Application Data"
"3.332051","54.38.73.16","172.18.0.2","TCP","68","21002 → 36876 [ACK] Seq=21937 Ack=4258 Win=1452 Len=0 TSval=2674752802 TSecr=1082414568"
"3.358112","172.18.0.2","54.38.73.16","TCP","68","36876 → 21002 [ACK] Seq=4258 Ack=21937 Win=5612 Len=0 TSval=1082414619 TSecr=2674752797"
"3.362930","54.38.73.16","172.18.0.2","TCP","2964","[TCP segment of a reassembled PDU]"
"3.362950","172.18.0.2","54.38.73.16","TCP","68","36876 → 21002 [ACK] Seq=4258 Ack=24833 Win=5596 Len=0 TSval=1082414623 TSecr=2674752809"
"3.373511","54.38.73.16","172.18.0.2","TLSv1.2","4412","Application Data [TCP segment of a reassembled PDU]"
"3.373543","172.18.0.2","54.38.73.16","TCP","68","36876 → 21002 [ACK] Seq=4258 Ack=29177 Win=5580 Len=0 TSval=1082414634 TSecr=2674752812"
"3.382844","54.38.73.16","172.18.0.2","TLSv1.2","625","Application Data, Application Data"
"3.382866","172.18.0.2","54.38.73.16","TCP","68","36876 → 21002 [ACK] Seq=4258 Ack=29734 Win=5593 Len=0 TSval=1082414643 TSecr=2674752814"
"3.383197","172.18.0.2","54.38.73.16","TLSv1.2","611","Application Data"
"3.384644","54.38.73.16","172.18.0.2","TCP","2964","[TCP segment of a reassembled PDU]"
"3.384664","172.18.0.2","54.38.73.16","TCP","68","36876 → 21002 [ACK] Seq=4801 Ack=32630 Win=5596 Len=0 TSval=1082414645 TSecr=2674752815"
"3.406968","54.38.73.16","172.18.0.2","TLSv1.2","799","Application Data"
"3.406989","172.18.0.2","54.38.73.16","TCP","68","36876 → 21002 [ACK] Seq=4801 Ack=33361 Win=5593 Len=0 TSval=1082414667 TSecr=2674752821"
"3.416113","54.38.73.16","172.18.0.2","TCP","2964","[TCP segment of a reassembled PDU]"
"3.416140","172.18.0.2","54.38.73.16","TCP","68","36876 → 21002 [ACK] Seq=4801 Ack=36257 Win=5596 Len=0 TSval=1082414677 TSecr=2674752823"
"3.430502","54.38.73.16","172.18.0.2","TLSv1.2","285","Application Data"
"3.430632","172.18.0.2","54.38.73.16","TCP","68","36876 → 21002 [ACK] Seq=4801 Ack=36474 Win=5612 Len=0 TSval=1082414691 TSecr=2674752826"
"3.459323","54.38.73.16","172.18.0.2","TLSv1.2","3695","Application Data"
"3.459453","172.18.0.2","54.38.73.16","TCP","68","36876 → 21002 [ACK] Seq=4801 Ack=40101 Win=5584 Len=0 TSval=1082414720 TSecr=2674752833"
"3.471575","54.38.73.16","172.18.0.2","TCP","1516","[TCP segment of a reassembled PDU]"
"3.484284","54.38.73.16","172.18.0.2","TLSv1.2","922","[TCP Previous segment not captured] , Ignored Unknown Record"
"3.484307","172.18.0.2","54.38.73.16","TCP","80","36876 → 21002 [ACK] Seq=4801 Ack=41549 Win=5593 Len=0 TSval=1082414745 TSecr=2674752836 SLE=44445 SRE=45299"
"3.512811","54.38.73.16","172.18.0.2","TCP","2964","[TCP segment of a reassembled PDU]"
"3.512834","172.18.0.2","54.38.73.16","TCP","80","[TCP Dup ACK 60#1] 36876 → 21002 [ACK] Seq=4801 Ack=41549 Win=5593 Len=0 TSval=1082414773 TSecr=2674752836 SLE=44445 SRE=48195"
"3.537891","54.38.73.16","172.18.0.2","TCP","2964","[TCP Retransmission] 21002 → 36876 [ACK] Seq=41549 Ack=4801 Win=1452 Len=2896 TSval=2674752853 TSecr=1082414773"
"3.537924","172.18.0.2","54.38.73.16","TCP","68","36876 → 21002 [ACK] Seq=4801 Ack=48195 Win=5565 Len=0 TSval=1082414798 TSecr=2674752853"
"3.553295","54.38.73.16","172.18.0.2","TLSv1.2","1516","Application Data, Application Data"
"3.561442","54.38.73.16","172.18.0.2","TLSv1.2","2493","Application Data"
"3.561463","172.18.0.2","54.38.73.16","TCP","68","36876 → 21002 [ACK] Seq=4801 Ack=52068 Win=5598 Len=0 TSval=1082414822 TSecr=2674752857"
"3.586182","54.38.73.16","172.18.0.2","TLSv1.2","1125","Application Data"
"3.586315","172.18.0.2","54.38.73.16","TCP","68","36876 → 21002 [ACK] Seq=4801 Ack=53125 Win=5612 Len=0 TSval=1082414847 TSecr=2674752865"
"3.593889","54.38.73.16","172.18.0.2","TCP","2964","[TCP segment of a reassembled PDU]"
"3.594017","172.18.0.2","54.38.73.16","TCP","68","36876 → 21002 [ACK] Seq=4801 Ack=56021 Win=5596 Len=0 TSval=1082414854 TSecr=2674752867"
"3.604823","54.38.73.16","172.18.0.2","TLSv1.2","2964","Application Data [TCP segment of a reassembled PDU]"
"3.604842","172.18.0.2","54.38.73.16","TCP","68","36876 → 21002 [ACK] Seq=4801 Ack=58917 Win=5596 Len=0 TSval=1082414865 TSecr=2674752870"
"3.605184","172.18.0.2","54.38.73.16","TLSv1.2","611","Application Data"
"3.609301","54.38.73.16","172.18.0.2","TLSv1.2","2073","Application Data, Application Data"
"3.609320","172.18.0.2","54.38.73.16","TCP","68","36876 → 21002 [ACK] Seq=5344 Ack=60922 Win=5599 Len=0 TSval=1082414870 TSecr=2674752871"
"3.612775","54.38.73.16","172.18.0.2","TCP","1516","[TCP segment of a reassembled PDU]"
"3.617572","54.38.73.16","172.18.0.2","TLSv1.2","2964","Application Data [TCP segment of a reassembled PDU]"
"3.617693","172.18.0.2","54.38.73.16","TCP","68","36876 → 21002 [ACK] Seq=5344 Ack=65266 Win=5596 Len=0 TSval=1082414878 TSecr=2674752872"
"3.632381","54.38.73.16","172.18.0.2","TLSv1.2","922","Application Data"
"3.632514","172.18.0.2","54.38.73.16","TCP","68","36876 → 21002 [ACK] Seq=5344 Ack=66120 Win=5612 Len=0 TSval=1082414893 TSecr=2674752877"
"3.659232","54.38.73.16","172.18.0.2","TLSv1.2","3181","Application Data"
"3.659411","172.18.0.2","54.38.73.16","TCP","68","36876 → 21002 [ACK] Seq=5344 Ack=69233 Win=5588 Len=0 TSval=1082414920 TSecr=2674752883"
"3.722636","54.38.73.16","172.18.0.2","TLSv1.2","4145","Application Data"
"3.722681","172.18.0.2","54.38.73.16","TCP","68","36876 → 21002 [ACK] Seq=5344 Ack=73310 Win=5589 Len=0 TSval=1082414983 TSecr=2674752899"
"3.722643","54.38.73.16","172.18.0.2","TCP","1516","[TCP segment of a reassembled PDU]"
"3.723028","172.18.0.2","54.38.73.16","TLSv1.2","611","Application Data"
"3.746113","54.38.73.16","172.18.0.2","TLSv1.2","769","Application Data"
"3.783729","54.38.73.16","172.18.0.2","TCP","68","21002 → 36876 [ACK] Seq=75459 Ack=5887 Win=1452 Len=0 TSval=2674752915 TSecr=1082414984"
"3.783768","172.18.0.2","54.38.73.16","TLSv1.2","611","Application Data"
"3.847291","54.38.73.16","172.18.0.2","TCP","68","21002 → 36876 [ACK] Seq=75459 Ack=6430 Win=1452 Len=0 TSval=2674752931 TSecr=1082415044"
"4.449756","54.38.73.16","172.18.0.2","TLSv1.2","611","Application Data"
"4.450767","172.18.0.2","54.38.73.16","TLSv1.2","611","Application Data"
"4.476531","54.38.73.16","172.18.0.2","TCP","68","21002 → 36876 [ACK] Seq=76002 Ack=6973 Win=1452 Len=0 TSval=2674753087 TSecr=1082415711"
"5.059125","54.38.73.16","172.18.0.2","TLSv1.2","611","Application Data"
"5.102160","172.18.0.2","54.38.73.16","TCP","68","36876 → 21002 [ACK] Seq=6973 Ack=76545 Win=5612 Len=0 TSval=1082416363 TSecr=2674753217"
"5.107428","54.38.73.16","172.18.0.2","TCP","1516","[TCP segment of a reassembled PDU]"
"5.107480","172.18.0.2","54.38.73.16","TCP","68","36876 → 21002 [ACK] Seq=6973 Ack=77993 Win=5601 Len=0 TSval=1082416368 TSecr=2674753246"
"5.107792","54.38.73.16","172.18.0.2","TCP","1516","21002 → 36876 [ACK] Seq=77993 Ack=6973 Win=1452 Len=1448 TSval=2674753246 TSecr=1082415711 [TCP segment of a reassembled PDU]"
"5.107819","172.18.0.2","54.38.73.16","TCP","68","36876 → 21002 [ACK] Seq=6973 Ack=79441 Win=5593 Len=0 TSval=1082416368 TSecr=2674753246"
"5.125465","54.38.73.16","172.18.0.2","TLSv1.2","799","Application Data"
"5.125504","172.18.0.2","54.38.73.16","TCP","68","36876 → 21002 [ACK] Seq=6973 Ack=80172 Win=5593 Len=0 TSval=1082416386 TSecr=2674753250"
"5.264527","54.38.73.16","172.18.0.2","TLSv1.2","3695","Application Data"
"5.264564","172.18.0.2","54.38.73.16","TCP","68","36876 → 21002 [ACK] Seq=6973 Ack=83799 Win=5581 Len=0 TSval=1082416525 TSecr=2674753277"
"5.277054","54.38.73.16","172.18.0.2","TCP","2964","[TCP segment of a reassembled PDU]"
"5.277088","172.18.0.2","54.38.73.16","TCP","68","36876 → 21002 [ACK] Seq=6973 Ack=86695 Win=5596 Len=0 TSval=1082416538 TSecr=2674753288"
"5.286844","54.38.73.16","172.18.0.2","TLSv1.2","1516","Application Data [TCP segment of a reassembled PDU]"
"5.286876","172.18.0.2","54.38.73.16","TCP","68","36876 → 21002 [ACK] Seq=6973 Ack=88143 Win=5593 Len=0 TSval=1082416547 TSecr=2674753290"
"5.288465","54.38.73.16","172.18.0.2","TLSv1.2","408","Application Data"
"5.288501","172.18.0.2","54.38.73.16","TCP","68","36876 → 21002 [ACK] Seq=6973 Ack=88483 Win=5593 Len=0 TSval=1082416549 TSecr=2674753291"
"5.329552","54.38.73.16","172.18.0.2","TLSv1.2","4145","Application Data"
"5.329592","172.18.0.2","54.38.73.16","TCP","68","36876 → 21002 [ACK] Seq=6973 Ack=92560 Win=5589 Len=0 TSval=1082416590 TSecr=2674753301"
"5.329557","54.38.73.16","172.18.0.2","TCP","2964","[TCP segment of a reassembled PDU]"
"5.329625","172.18.0.2","54.38.73.16","TCP","68","36876 → 21002 [ACK] Seq=6973 Ack=95456 Win=5567 Len=0 TSval=1082416590 TSecr=2674753301"
"5.350863","54.38.73.16","172.18.0.2","TLSv1.2","1516","Application Data [TCP segment of a reassembled PDU]"
"5.350895","172.18.0.2","54.38.73.16","TCP","68","36876 → 21002 [ACK] Seq=6973 Ack=96904 Win=5593 Len=0 TSval=1082416611 TSecr=2674753306"
"5.353911","54.38.73.16","172.18.0.2","TLSv1.2","1500","Application Data"
"5.353964","172.18.0.2","54.38.73.16","TCP","68","36876 → 21002 [ACK] Seq=6973 Ack=98336 Win=5593 Len=0 TSval=1082416614 TSecr=2674753307"
"5.371703","54.38.73.16","172.18.0.2","TCP","2964","[TCP segment of a reassembled PDU]"
"5.371737","172.18.0.2","54.38.73.16","TCP","68","36876 → 21002 [ACK] Seq=6973 Ack=101232 Win=5596 Len=0 TSval=1082416632 TSecr=2674753311"
"5.379003","54.38.73.16","172.18.0.2","TLSv1.2","799","Application Data"
"5.379040","172.18.0.2","54.38.73.16","TCP","68","36876 → 21002 [ACK] Seq=6973 Ack=101963 Win=5593 Len=0 TSval=1082416640 TSecr=2674753313"
"5.379532","172.18.0.2","54.38.73.16","TLSv1.2","611","Application Data"
"5.403611","54.38.73.16","172.18.0.2","TCP","68","21002 → 36876 [ACK] Seq=101963 Ack=7516 Win=1452 Len=0 TSval=2674753320 TSecr=1082416640"
"5.412625","54.38.73.16","172.18.0.2","TLSv1.2","2153","Application Data"
"5.412658","172.18.0.2","54.38.73.16","TCP","68","36876 → 21002 [ACK] Seq=7516 Ack=104048 Win=5599 Len=0 TSval=1082416673 TSecr=2674753322"
"5.471623","54.38.73.16","172.18.0.2","TLSv1.2","3695","Application Data"
"5.471811","172.18.0.2","54.38.73.16","TCP","68","36876 → 21002 [ACK] Seq=7516 Ack=107675 Win=5580 Len=0 TSval=1082416732 TSecr=2674753335"
"5.480844","54.38.73.16","172.18.0.2","TLSv1.2","5860","Application Data, Application Data"
"5.480879","172.18.0.2","54.38.73.16","TCP","68","36876 → 21002 [ACK] Seq=7516 Ack=113467 Win=5581 Len=0 TSval=1082416741 TSecr=2674753337"
"5.500761","54.38.73.16","172.18.0.2","TCP","2964","21002 → 36876 [ACK] Seq=113467 Ack=7516 Win=1452 Len=2896 TSval=2674753343 TSecr=1082416732 [TCP segment of a reassembled PDU]"
"5.500794","172.18.0.2","54.38.73.16","TCP","68","36876 → 21002 [ACK] Seq=7516 Ack=116363 Win=5596 Len=0 TSval=1082416761 TSecr=2674753343"
"5.518706","54.38.73.16","172.18.0.2","TLSv1.2","1776","Application Data, Application Data"
"5.518740","172.18.0.2","54.38.73.16","TCP","68","36876 → 21002 [ACK] Seq=7516 Ack=118071 Win=5600 Len=0 TSval=1082416779 TSecr=2674753345"
"5.562975","54.38.73.16","172.18.0.2","TLSv1.2","3695","Application Data"
"5.563163","172.18.0.2","54.38.73.16","TCP","68","36876 → 21002 [ACK] Seq=7516 Ack=121698 Win=5580 Len=0 TSval=1082416824 TSecr=2674753359"
"5.626433","54.38.73.16","172.18.0.2","TLSv1.2","4145","Application Data"
"5.626486","172.18.0.2","54.38.73.16","TCP","68","36876 → 21002 [ACK] Seq=7516 Ack=125775 Win=5580 Len=0 TSval=1082416887 TSecr=2674753375"
"5.627016","172.18.0.2","54.38.73.16","TLSv1.2","611","Application Data"
"5.650665","54.38.73.16","172.18.0.2","TLSv1.2","161","Application Data"
"5.650858","172.18.0.2","54.38.73.16","TCP","68","36876 → 21002 [ACK] Seq=8059 Ack=125868 Win=5612 Len=0 TSval=1082416911 TSecr=2674753381"
"5.688052","54.38.73.16","172.18.0.2","TCP","68","21002 → 36876 [ACK] Seq=125868 Ack=8059 Win=1452 Len=0 TSval=2674753391 TSecr=1082416887"
"5.981747","54.38.73.16","172.18.0.2","TLSv1.2","1125","Application Data"
"5.981825","172.18.0.2","54.38.73.16","TCP","68","36876 → 21002 [ACK] Seq=8059 Ack=126925 Win=5604 Len=0 TSval=1082417242 TSecr=2674753450"
"5.991345","172.18.0.2","54.38.73.16","TLSv1.2","611","Application Data"
"6.016841","54.38.73.16","172.18.0.2","TCP","68","21002 → 36876 [ACK] Seq=126925 Ack=8602 Win=1452 Len=0 TSval=2674753473 TSecr=1082417252"
"6.492594","54.38.73.16","172.18.0.2","TLSv1.2","611","Application Data"
"6.493612","172.18.0.2","54.38.73.16","TLSv1.2","611","Application Data"
"6.517704","54.38.73.16","172.18.0.2","TCP","68","21002 → 36876 [ACK] Seq=127468 Ack=9145 Win=1452 Len=0 TSval=2674753598 TSecr=1082417754"
"6.542086","02:42:09:5f:bf:77","","ARP","44","Who has 172.18.0.2? Tell 172.18.0.1"
"6.542130","02:42:ac:12:00:02","","ARP","44","172.18.0.2 is at 02:42:ac:12:00:02"
"7.517428","54.38.73.16","172.18.0.2","TCP","1516","[TCP segment of a reassembled PDU]"
"7.517742","54.38.73.16","172.18.0.2","TLSv1.2","2247","Application Data"
"7.517747","54.38.73.16","172.18.0.2","TLSv1.2","5860","Application Data"
"7.517751","54.38.73.16","172.18.0.2","TCP","1516","21002 → 36876 [ACK] Seq=136887 Ack=9145 Win=1452 Len=1448 TSval=2674753832 TSecr=1082417754 [TCP segment of a reassembled PDU]"
"7.517851","172.18.0.2","54.38.73.16","TCP","68","36876 → 21002 [ACK] Seq=9145 Ack=138335 Win=5553 Len=0 TSval=1082418778 TSecr=2674753796"
"7.543859","54.38.73.16","172.18.0.2","TLSv1.2","9964","Application Data, Application Data, Application Data, Application Data, Application Data"
"7.543999","172.18.0.2","54.38.73.16","TCP","68","36876 → 21002 [ACK] Seq=9145 Ack=148231 Win=5550 Len=0 TSval=1082418804 TSecr=2674753854"
"7.568477","54.38.73.16","172.18.0.2","TLSv1.2","4752","Application Data, Application Data"
"7.568512","172.18.0.2","54.38.73.16","TCP","68","36876 → 21002 [ACK] Seq=9145 Ack=152915 Win=5585 Len=0 TSval=1082418829 TSecr=2674753861"
"7.722345","54.38.73.16","172.18.0.2","TLSv1.2","2667","Application Data"
"7.722507","172.18.0.2","54.38.73.16","TCP","68","36876 → 21002 [ACK] Seq=9145 Ack=155514 Win=5577 Len=0 TSval=1082418983 TSecr=2674753891"
"7.723143","172.18.0.2","54.38.73.16","TLSv1.2","611","Application Data"
"7.746687","54.38.73.16","172.18.0.2","TCP","68","21002 → 36876 [ACK] Seq=155514 Ack=9688 Win=1452 Len=0 TSval=2674753905 TSecr=1082418984"
"7.746732","172.18.0.2","54.38.73.16","TLSv1.2","611","Application Data"
"7.773935","54.38.73.16","172.18.0.2","TCP","68","21002 → 36876 [ACK] Seq=155514 Ack=10231 Win=1452 Len=0 TSval=2674753912 TSecr=1082419007"
"8.439670","54.38.73.16","172.18.0.2","TLSv1.2","611","Application Data"
"8.440812","172.18.0.2","54.38.73.16","TLSv1.2","611","Application Data"
"8.464283","54.38.73.16","172.18.0.2","TCP","68","21002 → 36876 [ACK] Seq=156057 Ack=10774 Win=1452 Len=0 TSval=2674754085 TSecr=1082419701"
"8.950282","54.38.73.16","172.18.0.2","TCP","1516","[TCP segment of a reassembled PDU]"
"8.950390","54.38.73.16","172.18.0.2","TLSv1.2","2247","Application Data"
"8.950493","172.18.0.2","54.38.73.16","TCP","68","36876 → 21002 [ACK] Seq=10774 Ack=159684 Win=5584 Len=0 TSval=1082420211 TSecr=2674754202"
"9.002447","54.38.73.16","172.18.0.2","TLSv1.2","4145","Application Data"
"9.002619","172.18.0.2","54.38.73.16","TCP","68","36876 → 21002 [ACK] Seq=10774 Ack=163761 Win=5580 Len=0 TSval=1082420263 TSecr=2674754219"
"9.026379","54.38.73.16","172.18.0.2","TLSv1.2","161","Application Data"
"9.057102","54.38.73.16","172.18.0.2","TCP","2964","[TCP segment of a reassembled PDU]"
"9.057134","172.18.0.2","54.38.73.16","TCP","68","36876 → 21002 [ACK] Seq=10774 Ack=166750 Win=5596 Len=0 TSval=1082420318 TSecr=2674754225"
"9.082141","54.38.73.16","172.18.0.2","TLSv1.2","799","Application Data"
"9.089118","172.18.0.2","54.38.73.16","TLSv1.2","611","Application Data"
"9.113155","54.38.73.16","172.18.0.2","TCP","68","21002 → 36876 [ACK] Seq=167481 Ack=11317 Win=1452 Len=0 TSval=2674754247 TSecr=1082420350"
"9.871917","54.38.73.16","172.18.0.2","TLSv1.2","611","Application Data"
"9.872943","172.18.0.2","54.38.73.16","TLSv1.2","611","Application Data"
"9.896607","54.38.73.16","172.18.0.2","TCP","68","21002 → 36876 [ACK] Seq=168024 Ack=11860 Win=1452 Len=0 TSval=2674754443 TSecr=1082421133"
"10.486444","54.38.73.16","172.18.0.2","TLSv1.2","3695","Application Data"
"10.486625","172.18.0.2","54.38.73.16","TCP","68","36876 → 21002 [ACK] Seq=11860 Ack=171651 Win=5584 Len=0 TSval=1082421747 TSecr=2674754588"
"10.512556","54.38.73.16","172.18.0.2","TLSv1.2","3695","Application Data"
"10.512720","172.18.0.2","54.38.73.16","TCP","68","36876 → 21002 [ACK] Seq=11860 Ack=175278 Win=5580 Len=0 TSval=1082421773 TSecr=2674754597"
"10.558960","54.38.73.16","172.18.0.2","TLSv1.2","1125","Application Data"
"10.580509","54.38.73.16","172.18.0.2","TCP","2964","[TCP segment of a reassembled PDU]"
"10.580539","172.18.0.2","54.38.73.16","TCP","68","36876 → 21002 [ACK] Seq=11860 Ack=179231 Win=5596 Len=0 TSval=1082421841 TSecr=2674754608"
"10.606509","54.38.73.16","172.18.0.2","TLSv1.2","799","Application Data"
"10.606973","172.18.0.2","54.38.73.16","TLSv1.2","611","Application Data"
"10.630389","54.38.73.16","172.18.0.2","TCP","68","21002 → 36876 [ACK] Seq=179962 Ack=12403 Win=1452 Len=0 TSval=2674754626 TSecr=1082421867"
"10.630425","172.18.0.2","54.38.73.16","TLSv1.2","1125","Application Data"
"10.655364","54.38.73.16","172.18.0.2","TCP","68","21002 → 36876 [ACK] Seq=179962 Ack=13460 Win=1452 Len=0 TSval=2674754632 TSecr=1082421891"
"10.704378","54.38.73.16","172.18.0.2","TLSv1.2","611","Application Data"
"10.746147","172.18.0.2","54.38.73.16","TCP","68","36876 → 21002 [ACK] Seq=13460 Ack=180505 Win=5612 Len=0 TSval=1082422007 TSecr=2674754644"
"11.510726","54.38.73.16","172.18.0.2","TLSv1.2","611","Application Data"
"11.510790","172.18.0.2","54.38.73.16","TCP","68","36876 → 21002 [ACK] Seq=13460 Ack=181048 Win=5608 Len=0 TSval=1082422771 TSecr=2674754771"
"11.510745","54.38.73.16","172.18.0.2","TLSv1.2","611","[TCP Spurious Retransmission] , Application Data"
"11.510804","172.18.0.2","54.38.73.16","TCP","80","[TCP Dup ACK 199#1] 36876 → 21002 [ACK] Seq=13460 Ack=181048 Win=5608 Len=0 TSval=1082422771 TSecr=2674754833 SLE=180505 SRE=181048"
"11.511658","172.18.0.2","54.38.73.16","TLSv1.2","611","Application Data"
"11.536927","54.38.73.16","172.18.0.2","TCP","68","21002 → 36876 [ACK] Seq=181048 Ack=14003 Win=1452 Len=0 TSval=2674754853 TSecr=1082422772"
"12.022422","54.38.73.16","172.18.0.2","TLSv1.2","611","Application Data"
"12.022490","172.18.0.2","54.38.73.16","TCP","68","36876 → 21002 [ACK] Seq=14003 Ack=181591 Win=5608 Len=0 TSval=1082423283 TSecr=2674754966"
"12.061304","54.38.73.16","172.18.0.2","TLSv1.2","3695","Application Data"
"12.061335","172.18.0.2","54.38.73.16","TCP","68","36876 → 21002 [ACK] Seq=14003 Ack=185218 Win=5580 Len=0 TSval=1082423322 TSecr=2674754983"
"12.070967","54.38.73.16","172.18.0.2","TLSv1.2","5860","Application Data"
"12.070998","172.18.0.2","54.38.73.16","TCP","68","36876 → 21002 [ACK] Seq=14003 Ack=191010 Win=5581 Len=0 TSval=1082423331 TSecr=2674754986"
"12.088952","54.38.73.16","172.18.0.2","TLSv1.2","1530","Application Data"
"12.088984","172.18.0.2","54.38.73.16","TCP","68","36876 → 21002 [ACK] Seq=14003 Ack=192472 Win=5601 Len=0 TSval=1082423349 TSecr=2674754990"
"12.115661","54.38.73.16","172.18.0.2","TLSv1.2","3695","Application Data"
"12.115693","172.18.0.2","54.38.73.16","TCP","68","36876 → 21002 [ACK] Seq=14003 Ack=196099 Win=5580 Len=0 TSval=1082423376 TSecr=2674754997"
"12.120530","172.18.0.2","54.38.73.16","TLSv1.2","611","Application Data"
"12.145143","54.38.73.16","172.18.0.2","TCP","68","21002 → 36876 [ACK] Seq=196099 Ack=14546 Win=1452 Len=0 TSval=2674755005 TSecr=1082423381"
"12.636735","54.38.73.16","172.18.0.2","TLSv1.2","611","Application Data"
"12.636788","172.18.0.2","54.38.73.16","TCP","68","36876 → 21002 [ACK] Seq=14546 Ack=196642 Win=5608 Len=0 TSval=1082423897 TSecr=2674755124"
"12.637799","172.18.0.2","54.38.73.16","TLSv1.2","611","Application Data"
"12.661687","54.38.73.16","172.18.0.2","TCP","68","21002 → 36876 [ACK] Seq=196642 Ack=15089 Win=1452 Len=0 TSval=2674755134 TSecr=1082423898"
"13.251838","54.38.73.16","172.18.0.2","TLSv1.2","611","Application Data"
"13.279959","54.38.73.16","172.18.0.2","TCP","2964","[TCP segment of a reassembled PDU]"
"13.280148","172.18.0.2","54.38.73.16","TCP","68","36876 → 21002 [ACK] Seq=15089 Ack=200081 Win=5596 Len=0 TSval=1082424541 TSecr=2674755277"
"13.300660","54.38.73.16","172.18.0.2","TLSv1.2","4412","Application Data [TCP segment of a reassembled PDU]"
"13.300833","172.18.0.2","54.38.73.16","TCP","68","36876 → 21002 [ACK] Seq=15089 Ack=204425 Win=5580 Len=0 TSval=1082424561 TSecr=2674755294"
"13.304872","54.38.73.16","172.18.0.2","TLSv1.2","625","Application Data, Application Data"
"13.335159","54.38.73.16","172.18.0.2","TCP","2964","[TCP segment of a reassembled PDU]"
"13.335193","172.18.0.2","54.38.73.16","TCP","68","36876 → 21002 [ACK] Seq=15089 Ack=207878 Win=5596 Len=0 TSval=1082424596 TSecr=2674755295"
"13.366635","54.38.73.16","172.18.0.2","TLSv1.2","625","[TCP Previous segment not captured] , Ignored Unknown Record"
"13.366684","172.18.0.2","54.38.73.16","TCP","80","[TCP Dup ACK 227#1] 36876 → 21002 [ACK] Seq=15089 Ack=207878 Win=5596 Len=0 TSval=1082424627 TSecr=2674755295 SLE=212222 SRE=212779"
"13.366651","54.38.73.16","172.18.0.2","TCP","4412","[TCP Out-Of-Order] 21002 → 36876 [ACK] Seq=207878 Ack=15089 Win=1452 Len=4344 TSval=2674755308 TSecr=1082424561"
"13.366719","172.18.0.2","54.38.73.16","TCP","68","36876 → 21002 [ACK] Seq=15089 Ack=212779 Win=5564 Len=0 TSval=1082424627 TSecr=2674755308"
"13.391438","54.38.73.16","172.18.0.2","TCP","2964","[TCP segment of a reassembled PDU]"
"13.391473","172.18.0.2","54.38.73.16","TCP","68","36876 → 21002 [ACK] Seq=15089 Ack=215675 Win=5596 Len=0 TSval=1082424652 TSecr=2674755316"
"13.397690","54.38.73.16","172.18.0.2","TLSv1.2","1856","Application Data, Application Data"
"13.397722","172.18.0.2","54.38.73.16","TCP","68","36876 → 21002 [ACK] Seq=15089 Ack=217463 Win=5600 Len=0 TSval=1082424658 TSecr=2674755317"
"13.405246","172.18.0.2","54.38.73.16","TLSv1.2","611","Application Data"
"13.429500","54.38.73.16","172.18.0.2","TCP","68","21002 → 36876 [ACK] Seq=217463 Ack=15632 Win=1452 Len=0 TSval=2674755326 TSecr=1082424666"
"14.275181","54.38.73.16","172.18.0.2","TLSv1.2","611","Application Data"
"14.276128","172.18.0.2","54.38.73.16","TLSv1.2","611","Application Data"
"14.301532","54.38.73.16","172.18.0.2","TCP","68","21002 → 36876 [ACK] Seq=218006 Ack=16175 Win=1452 Len=0 TSval=2674755544 TSecr=1082425537"
"14.895079","54.38.73.16","172.18.0.2","TCP","1516","[TCP segment of a reassembled PDU]"
"14.895243","54.38.73.16","172.18.0.2","TLSv1.2","2247","Application Data"
"14.895247","54.38.73.16","172.18.0.2","TCP","2964","[TCP segment of a reassembled PDU]"
"14.895252","54.38.73.16","172.18.0.2","TLSv1.2","1516","Application Data [TCP segment of a reassembled PDU]"
"14.895255","54.38.73.16","172.18.0.2","TLSv1.2","1516","Application Data [TCP segment of a reassembled PDU]"
"14.895308","172.18.0.2","54.38.73.16","TCP","68","36876 → 21002 [ACK] Seq=16175 Ack=224529 Win=5562 Len=0 TSval=1082426156 TSecr=2674755674"
"14.895409","172.18.0.2","54.38.73.16","TCP","68","36876 → 21002 [ACK] Seq=16175 Ack=227425 Win=5551 Len=0 TSval=1082426156 TSecr=2674755684"
"14.920499","54.38.73.16","172.18.0.2","TLSv1.2","3101","Application Data"
"14.920532","172.18.0.2","54.38.73.16","TCP","68","36876 → 21002 [ACK] Seq=16175 Ack=230458 Win=5580 Len=0 TSval=1082426181 TSecr=2674755699"
"14.937019","54.38.73.16","172.18.0.2","TLSv1.2","5860","Application Data"
"14.937054","172.18.0.2","54.38.73.16","TCP","68","36876 → 21002 [ACK] Seq=16175 Ack=236250 Win=5581 Len=0 TSval=1082426198 TSecr=2674755703"
"14.937565","172.18.0.2","54.38.73.16","TLSv1.2","611","Application Data"
"14.944825","54.38.73.16","172.18.0.2","TLSv1.2","2044","Application Data"
"14.944879","172.18.0.2","54.38.73.16","TCP","68","36876 → 21002 [ACK] Seq=16718 Ack=238226 Win=5599 Len=0 TSval=1082426205 TSecr=2674755705"
"14.962692","54.38.73.16","172.18.0.2","TCP","68","21002 → 36876 [ACK] Seq=238226 Ack=16718 Win=1452 Len=0 TSval=2674755709 TSecr=1082426198"
"14.968489","54.38.73.16","172.18.0.2","TCP","2964","[TCP segment of a reassembled PDU]"
"14.968676","172.18.0.2","54.38.73.16","TCP","68","36876 → 21002 [ACK] Seq=16718 Ack=241122 Win=5596 Len=0 TSval=1082426229 TSecr=2674755711"
"14.969049","54.38.73.16","172.18.0.2","TLSv1.2","2964","Application Data [TCP segment of a reassembled PDU]"
"14.969080","172.18.0.2","54.38.73.16","TCP","68","36876 → 21002 [ACK] Seq=16718 Ack=244018 Win=5596 Len=0 TSval=1082426230 TSecr=2674755711"
"14.969636","54.38.73.16","172.18.0.2","TLSv1.2","2587","Application Data, Application Data"
"14.969667","172.18.0.2","54.38.73.16","TCP","68","36876 → 21002 [ACK] Seq=16718 Ack=246537 Win=5597 Len=0 TSval=1082426230 TSecr=2674755711"
"14.970199","172.18.0.2","54.38.73.16","TLSv1.2","611","Application Data"
"14.978331","54.38.73.16","172.18.0.2","TCP","1516","[TCP segment of a reassembled PDU]"
"14.993752","54.38.73.16","172.18.0.2","TLSv1.2","2964","Application Data [TCP segment of a reassembled PDU]"
"14.993757","54.38.73.16","172.18.0.2","TLSv1.2","5860","Application Data [TCP segment of a reassembled PDU]"
"14.993940","172.18.0.2","54.38.73.16","TCP","68","36876 → 21002 [ACK] Seq=17261 Ack=256673 Win=5566 Len=0 TSval=1082426254 TSecr=2674755713"
"15.020071","54.38.73.16","172.18.0.2","TLSv1.2","813","Application Data"
"15.054352","54.38.73.16","172.18.0.2","TLSv1.2","8756","Application Data, Application Data"
"15.054388","172.18.0.2","54.38.73.16","TCP","68","36876 → 21002 [ACK] Seq=17261 Ack=266106 Win=5566 Len=0 TSval=1082426315 TSecr=2674755723"
"15.079697","54.38.73.16","172.18.0.2","TLSv1.2","2775","Application Data"
"15.079729","172.18.0.2","54.38.73.16","TCP","68","36876 → 21002 [ACK] Seq=17261 Ack=268813 Win=5597 Len=0 TSval=1082426340 TSecr=2674755738"
"15.086268","54.38.73.16","172.18.0.2","TLSv1.2","7308","Application Data"
"15.086449","172.18.0.2","54.38.73.16","TCP","68","36876 → 21002 [ACK] Seq=17261 Ack=276053 Win=5565 Len=0 TSval=1082426347 TSecr=2674755740"
"15.086900","172.18.0.2","54.38.73.16","TLSv1.2","611","Application Data"
"15.103722","54.38.73.16","172.18.0.2","TLSv1.2","2964","Application Data [TCP segment of a reassembled PDU]"
"15.103765","172.18.0.2","54.38.73.16","TCP","68","36876 → 21002 [ACK] Seq=17804 Ack=278949 Win=5596 Len=0 TSval=1082426364 TSecr=2674755745"
"15.111248","54.38.73.16","172.18.0.2","TLSv1.2","5860","Application Data, Application Data"
"15.111430","172.18.0.2","54.38.73.16","TCP","68","36876 → 21002 [ACK] Seq=17804 Ack=284741 Win=5581 Len=0 TSval=1082426372 TSecr=2674755746"
"15.117475","54.38.73.16","172.18.0.2","TLSv1.2","1516","Application Data, Application Data"
"15.117979","172.18.0.2","54.38.73.16","TLSv1.2","611","Application Data"
"15.130058","54.38.73.16","172.18.0.2","TLSv1.2","4412","Application Data [TCP segment of a reassembled PDU]"
"15.130241","172.18.0.2","54.38.73.16","TCP","68","36876 → 21002 [ACK] Seq=18347 Ack=290533 Win=5580 Len=0 TSval=1082426391 TSecr=2674755751"
"15.135801","54.38.73.16","172.18.0.2","TLSv1.2","3281","Application Data, Application Data"
"15.135836","172.18.0.2","54.38.73.16","TCP","68","36876 → 21002 [ACK] Seq=18347 Ack=293746 Win=5580 Len=0 TSval=1082426396 TSecr=2674755753"
"15.175031","54.38.73.16","172.18.0.2","TLSv1.2","3695","Application Data"
"15.175091","172.18.0.2","54.38.73.16","TCP","68","36876 → 21002 [ACK] Seq=18347 Ack=297373 Win=5580 Len=0 TSval=1082426436 TSecr=2674755762"
"15.175585","172.18.0.2","54.38.73.16","TLSv1.2","611","Application Data"
"15.240372","54.38.73.16","172.18.0.2","TLSv1.2","3695","Application Data"
"15.240550","172.18.0.2","54.38.73.16","TCP","68","36876 → 21002 [ACK] Seq=18890 Ack=301000 Win=5584 Len=0 TSval=1082426501 TSecr=2674755778"
"15.278392","54.38.73.16","172.18.0.2","TLSv1.2","1125","Application Data"
"15.288441","172.18.0.2","54.38.73.16","TLSv1.2","611","Application Data"
"15.352337","54.38.73.16","172.18.0.2","TCP","68","21002 → 36876 [ACK] Seq=302057 Ack=19433 Win=1452 Len=0 TSval=2674755807 TSecr=1082426549"
"15.811874","54.38.73.16","172.18.0.2","TLSv1.2","611","Application Data"
"15.812880","172.18.0.2","54.38.73.16","TLSv1.2","611","Application Data"
"15.836521","54.38.73.16","172.18.0.2","TCP","68","21002 → 36876 [ACK] Seq=302600 Ack=19976 Win=1452 Len=0 TSval=2674755928 TSecr=1082427073"
"16.630793","54.38.73.16","172.18.0.2","TLSv1.2","611","Application Data"
"16.674213","172.18.0.2","54.38.73.16","TCP","68","36876 → 21002 [ACK] Seq=19976 Ack=303143 Win=5612 Len=0 TSval=1082427935 TSecr=2674756124"
"16.704400","54.38.73.16","172.18.0.2","TLSv1.2","4145","Application Data"
"16.704454","172.18.0.2","54.38.73.16","TCP","68","36876 → 21002 [ACK] Seq=19976 Ack=307220 Win=5589 Len=0 TSval=1082427965 TSecr=2674756145"
"16.704405","54.38.73.16","172.18.0.2","TCP","2964","[TCP segment of a reassembled PDU]"
"16.704468","172.18.0.2","54.38.73.16","TCP","68","36876 → 21002 [ACK] Seq=19976 Ack=310116 Win=5567 Len=0 TSval=1082427965 TSecr=2674756145"
"16.728237","54.38.73.16","172.18.0.2","TLSv1.2","349","Application Data"
"16.728269","172.18.0.2","54.38.73.16","TCP","68","36876 → 21002 [ACK] Seq=19976 Ack=310397 Win=5593 Len=0 TSval=1082427989 TSecr=2674756151"
"16.738033","54.38.73.16","172.18.0.2","TCP","2964","[TCP segment of a reassembled PDU]"
"16.738076","172.18.0.2","54.38.73.16","TCP","68","36876 → 21002 [ACK] Seq=19976 Ack=313293 Win=5596 Len=0 TSval=1082427999 TSecr=2674756153"
"16.751403","54.38.73.16","172.18.0.2","TLSv1.2","1342","Application Data, Application Data"
"16.751439","172.18.0.2","54.38.73.16","TCP","68","36876 → 21002 [ACK] Seq=19976 Ack=314567 Win=5593 Len=0 TSval=1082428012 TSecr=2674756157"
"16.783491","54.38.73.16","172.18.0.2","TLSv1.2","4145","Application Data"
"16.783526","172.18.0.2","54.38.73.16","TCP","68","36876 → 21002 [ACK] Seq=19976 Ack=318644 Win=5580 Len=0 TSval=1082428044 TSecr=2674756164"
"16.807639","54.38.73.16","172.18.0.2","TLSv1.2","161","Application Data"
"16.807687","172.18.0.2","54.38.73.16","TCP","68","36876 → 21002 [ACK] Seq=19976 Ack=318737 Win=5609 Len=0 TSval=1082428068 TSecr=2674756171"
"16.846306","54.38.73.16","172.18.0.2","TLSv1.2","4145","Application Data"
"16.846343","172.18.0.2","54.38.73.16","TCP","68","36876 → 21002 [ACK] Seq=19976 Ack=322814 Win=5589 Len=0 TSval=1082428107 TSecr=2674756180"
"16.846311","54.38.73.16","172.18.0.2","TLSv1.2","4412","Application Data"
"16.846376","172.18.0.2","54.38.73.16","TCP","68","36876 → 21002 [ACK] Seq=19976 Ack=327158 Win=5567 Len=0 TSval=1082428107 TSecr=2674756180"
"16.856731","54.38.73.16","172.18.0.2","TLSv1.2","4412","Application Data [TCP segment of a reassembled PDU]"
"16.856764","172.18.0.2","54.38.73.16","TCP","68","36876 → 21002 [ACK] Seq=19976 Ack=331502 Win=5580 Len=0 TSval=1082428117 TSecr=2674756183"
"16.871776","54.38.73.16","172.18.0.2","TLSv1.2","1326","Application Data, Application Data"
"16.871815","172.18.0.2","54.38.73.16","TCP","68","36876 → 21002 [ACK] Seq=19976 Ack=332760 Win=5593 Len=0 TSval=1082428132 TSecr=2674756186"
"16.872357","172.18.0.2","54.38.73.16","TLSv1.2","611","Application Data"
"16.890740","54.38.73.16","172.18.0.2","TCP","2964","[TCP segment of a reassembled PDU]"
"16.890772","172.18.0.2","54.38.73.16","TCP","68","36876 → 21002 [ACK] Seq=20519 Ack=335656 Win=5596 Len=0 TSval=1082428151 TSecr=2674756191"
"16.895940","54.38.73.16","172.18.0.2","TLSv1.2","799","Application Data"
"16.895986","172.18.0.2","54.38.73.16","TCP","68","36876 → 21002 [ACK] Seq=20519 Ack=336387 Win=5593 Len=0 TSval=1082428156 TSecr=2674756193"
"16.897382","54.38.73.16","172.18.0.2","TCP","68","21002 → 36876 [ACK] Seq=336387 Ack=20519 Win=1452 Len=0 TSval=2674756193 TSecr=1082428133"
"16.933686","54.38.73.16","172.18.0.2","TLSv1.2","1639","Application Data"
"16.933718","172.18.0.2","54.38.73.16","TCP","68","36876 → 21002 [ACK] Seq=20519 Ack=337958 Win=5601 Len=0 TSval=1082428194 TSecr=2674756202"
"16.976845","54.38.73.16","172.18.0.2","TLSv1.2","4145","Application Data"
"16.977029","172.18.0.2","54.38.73.16","TCP","68","36876 → 21002 [ACK] Seq=20519 Ack=342035 Win=5580 Len=0 TSval=1082428237 TSecr=2674756213"
"16.977456","172.18.0.2","54.38.73.16","TLSv1.2","611","Application Data"
"17.001586","54.38.73.16","172.18.0.2","TLSv1.2","675","Application Data"
"17.001781","172.18.0.2","54.38.73.16","TCP","68","36876 → 21002 [ACK] Seq=21062 Ack=342642 Win=5612 Len=0 TSval=1082428262 TSecr=2674756219"
"17.040250","54.38.73.16","172.18.0.2","TCP","68","21002 → 36876 [ACK] Seq=342642 Ack=21062 Win=1452 Len=0 TSval=2674756229 TSecr=1082428238"
"17.040292","172.18.0.2","54.38.73.16","TLSv1.2","611","Application Data"
"17.066671","54.38.73.16","172.18.0.2","TCP","68","21002 → 36876 [ACK] Seq=342642 Ack=21605 Win=1452 Len=0 TSval=2674756235 TSecr=1082428301"
"17.552046","54.38.73.16","172.18.0.2","TLSv1.2","611","Application Data"
"17.553097","172.18.0.2","54.38.73.16","TLSv1.2","611","Application Data"
"17.577936","54.38.73.16","172.18.0.2","TCP","68","21002 → 36876 [ACK] Seq=343185 Ack=22148 Win=1452 Len=0 TSval=2674756363 TSecr=1082428814"
"18.269119","54.38.73.16","172.18.0.2","TLSv1.2","611","Application Data"
"18.310124","172.18.0.2","54.38.73.16","TCP","68","36876 → 21002 [ACK] Seq=22148 Ack=343728 Win=5612 Len=0 TSval=1082429571 TSecr=2674756519"
"18.327686","54.38.73.16","172.18.0.2","TLSv1.2","10204","Application Data, Application Data"
"18.327749","172.18.0.2","54.38.73.16","TCP","68","36876 → 21002 [ACK] Seq=22148 Ack=353864 Win=5550 Len=0 TSval=1082429588 TSecr=2674756550"
"18.334572","54.38.73.16","172.18.0.2","TLSv1.2","1327","Application Data"
"18.334608","172.18.0.2","54.38.73.16","TCP","68","36876 → 21002 [ACK] Seq=22148 Ack=355123 Win=5593 Len=0 TSval=1082429595 TSecr=2674756552"
"18.474431","54.38.73.16","172.18.0.2","TLSv1.2","4145","Application Data"
"18.474476","172.18.0.2","54.38.73.16","TCP","68","36876 → 21002 [ACK] Seq=22148 Ack=359200 Win=5579 Len=0 TSval=1082429735 TSecr=2674756585"
"18.474437","54.38.73.16","172.18.0.2","TLSv1.2","10204","Application Data, Application Data, Application Data"
"18.474528","172.18.0.2","54.38.73.16","TCP","68","36876 → 21002 [ACK] Seq=22148 Ack=369336 Win=5518 Len=0 TSval=1082429735 TSecr=2674756587"
"18.499534","54.38.73.16","172.18.0.2","TLSv1.2","14415","Application Data, Application Data, Application Data, Application Data, Application Data, Application Data"
"18.499577","172.18.0.2","54.38.73.16","TCP","68","36876 → 21002 [ACK] Seq=22148 Ack=383683 Win=5536 Len=0 TSval=1082429760 TSecr=2674756593"
"18.500039","172.18.0.2","54.38.73.16","TLSv1.2","611","Application Data"
"18.524987","54.38.73.16","172.18.0.2","TCP","68","21002 → 36876 [ACK] Seq=383683 Ack=22691 Win=1452 Len=0 TSval=2674756600 TSecr=1082429761"
"18.548805","54.38.73.16","172.18.0.2","TLSv1.2","4145","Application Data"
"18.548843","172.18.0.2","54.38.73.16","TCP","68","36876 → 21002 [ACK] Seq=22691 Ack=387760 Win=5589 Len=0 TSval=1082429809 TSecr=2674756606"
"18.548811","54.38.73.16","172.18.0.2","TCP","2964","[TCP segment of a reassembled PDU]"
"18.548886","172.18.0.2","54.38.73.16","TCP","68","36876 → 21002 [ACK] Seq=22691 Ack=390656 Win=5567 Len=0 TSval=1082429809 TSecr=2674756606"
"18.573566","54.38.73.16","172.18.0.2","TLSv1.2","1406","Application Data, Application Data"
"18.573602","172.18.0.2","54.38.73.16","TCP","68","36876 → 21002 [ACK] Seq=22691 Ack=391994 Win=5593 Len=0 TSval=1082429834 TSecr=2674756612"
"18.574185","172.18.0.2","54.38.73.16","TLSv1.2","611","Application Data"
"18.579358","54.38.73.16","172.18.0.2","TCP","1516","[TCP segment of a reassembled PDU]"
"18.579390","172.18.0.2","54.38.73.16","TCP","68","36876 → 21002 [ACK] Seq=23234 Ack=393442 Win=5593 Len=0 TSval=1082429840 TSecr=2674756614"
"18.597589","54.38.73.16","172.18.0.2","TLSv1.2","1219","Application Data"
"18.597628","172.18.0.2","54.38.73.16","TCP","68","36876 → 21002 [ACK] Seq=23234 Ack=394593 Win=5593 Len=0 TSval=1082429858 TSecr=2674756618"
"18.636398","54.38.73.16","172.18.0.2","TCP","68","21002 → 36876 [ACK] Seq=394593 Ack=23234 Win=1452 Len=0 TSval=2674756628 TSecr=1082429835"
"18.636442","172.18.0.2","54.38.73.16","TLSv1.2","611","Application Data"
"18.661250","54.38.73.16","172.18.0.2","TCP","68","21002 → 36876 [ACK] Seq=394593 Ack=23777 Win=1452 Len=0 TSval=2674756634 TSecr=1082429897"
"19.503273","54.38.73.16","172.18.0.2","TLSv1.2","611","Application Data"
"19.503342","172.18.0.2","54.38.73.16","TCP","68","36876 → 21002 [ACK] Seq=23777 Ack=395136 Win=5608 Len=0 TSval=1082430764 TSecr=2674756778"
"19.503287","54.38.73.16","172.18.0.2","TLSv1.2","611","[TCP Spurious Retransmission] , Application Data"
"19.503367","172.18.0.2","54.38.73.16","TCP","80","[TCP Dup ACK 368#1] 36876 → 21002 [ACK] Seq=23777 Ack=395136 Win=5608 Len=0 TSval=1082430764 TSecr=2674756836 SLE=394593 SRE=395136"
"19.504290","172.18.0.2","54.38.73.16","TLSv1.2","611","Application Data"
"19.531777","54.38.73.16","172.18.0.2","TCP","68","21002 → 36876 [ACK] Seq=395136 Ack=24320 Win=1452 Len=0 TSval=2674756851 TSecr=1082430765"
"20.005207","54.38.73.16","172.18.0.2","TLSv1.2","3695","Application Data"
"20.005260","172.18.0.2","54.38.73.16","TCP","68","36876 → 21002 [ACK] Seq=24320 Ack=398763 Win=5584 Len=0 TSval=1082431266 TSecr=2674756970"
"20.046216","54.38.73.16","172.18.0.2","TLSv1.2","4145","Application Data"
"20.046247","172.18.0.2","54.38.73.16","TCP","68","36876 → 21002 [ACK] Seq=24320 Ack=402840 Win=5580 Len=0 TSval=1082431307 TSecr=2674756980"
"20.057355","54.38.73.16","172.18.0.2","TLSv1.2","2964","Application Data"
"20.057383","172.18.0.2","54.38.73.16","TCP","68","36876 → 21002 [ACK] Seq=24320 Ack=405736 Win=5596 Len=0 TSval=1082431318 TSecr=2674756983"
"20.071062","54.38.73.16","172.18.0.2","TLSv1.2","1435","Application Data, Application Data"
"20.071095","172.18.0.2","54.38.73.16","TCP","68","36876 → 21002 [ACK] Seq=24320 Ack=407103 Win=5593 Len=0 TSval=1082431332 TSecr=2674756986"
"20.118441","54.38.73.16","172.18.0.2","TLSv1.2","4145","Application Data"
"20.118476","172.18.0.2","54.38.73.16","TCP","68","36876 → 21002 [ACK] Seq=24320 Ack=411180 Win=5589 Len=0 TSval=1082431379 TSecr=2674756998"
"20.118446","54.38.73.16","172.18.0.2","TCP","2964","[TCP segment of a reassembled PDU]"
"20.118514","172.18.0.2","54.38.73.16","TCP","68","36876 → 21002 [ACK] Seq=24320 Ack=414076 Win=5567 Len=0 TSval=1082431379 TSecr=2674756998"
"20.142623","54.38.73.16","172.18.0.2","TLSv1.2","349","Application Data"
"20.142656","172.18.0.2","54.38.73.16","TCP","68","36876 → 21002 [ACK] Seq=24320 Ack=414357 Win=5593 Len=0 TSval=1082431403 TSecr=2674757004"
"20.150124","54.38.73.16","172.18.0.2","TLSv1.2","8756","Application Data, Application Data"
"20.150159","172.18.0.2","54.38.73.16","TCP","68","36876 → 21002 [ACK] Seq=24320 Ack=423045 Win=5566 Len=0 TSval=1082431411 TSecr=2674757006"
"20.150914","172.18.0.2","54.38.73.16","TLSv1.2","611","Application Data"
"20.164284","54.38.73.16","172.18.0.2","TLSv1.2","4412","Application Data, Application Data"
"20.164315","172.18.0.2","54.38.73.16","TCP","68","36876 → 21002 [ACK] Seq=24863 Ack=427389 Win=5580 Len=0 TSval=1082431425 TSecr=2674757010"
"20.175303","54.38.73.16","172.18.0.2","TCP","68","[TCP Previous segment not captured] 21002 → 36876 [ACK] Seq=431493 Ack=24863 Win=1452 Len=0 TSval=2674757012 TSecr=1082431411"
"20.175320","54.38.73.16","172.18.0.2","TCP","4172","[TCP Retransmission] 21002 → 36876 [PSH, ACK] Seq=427389 Ack=24320 Win=1452 Len=4104 TSval=2674757012 TSecr=1082431411"
"20.175358","172.18.0.2","54.38.73.16","TCP","68","36876 → 21002 [ACK] Seq=24863 Ack=431493 Win=5589 Len=0 TSval=1082431436 TSecr=2674757012"
"20.175715","54.38.73.16","172.18.0.2","TCP","2964","[TCP segment of a reassembled PDU]"
"20.175744","172.18.0.2","54.38.73.16","TCP","68","36876 → 21002 [ACK] Seq=24863 Ack=434389 Win=5596 Len=0 TSval=1082431436 TSecr=2674757013"
"20.200043","54.38.73.16","172.18.0.2","TLSv1.2","1342","Application Data, Application Data"
"20.200087","172.18.0.2","54.38.73.16","TCP","68","36876 → 21002 [ACK] Seq=24863 Ack=435663 Win=5593 Len=0 TSval=1082431461 TSecr=2674757019"
"20.243625","54.38.73.16","172.18.0.2","TLSv1.2","4145","Application Data"
"20.243659","172.18.0.2","54.38.73.16","TCP","68","36876 → 21002 [ACK] Seq=24863 Ack=439740 Win=5589 Len=0 TSval=1082431504 TSecr=2674757029"
"20.243630","54.38.73.16","172.18.0.2","TLSv1.2","10204","Application Data, Application Data"
"20.243698","172.18.0.2","54.38.73.16","TCP","68","36876 → 21002 [ACK] Seq=24863 Ack=449876 Win=5537 Len=0 TSval=1082431504 TSecr=2674757029"
"20.244697","172.18.0.2","54.38.73.16","TLSv1.2","1125","Application Data"
"20.269164","54.38.73.16","172.18.0.2","TLSv1.2","9217","Application Data, Application Data, Application Data, Application Data, Application Data"
"20.269198","172.18.0.2","54.38.73.16","TCP","68","36876 → 21002 [ACK] Seq=25920 Ack=459025 Win=5550 Len=0 TSval=1082431530 TSecr=2674757036"
"20.309807","54.38.73.16","172.18.0.2","TCP","68","21002 → 36876 [ACK] Seq=459025 Ack=25920 Win=1452 Len=0 TSval=2674757046 TSecr=1082431505"
"20.332005","54.38.73.16","172.18.0.2","TLSv1.2","4145","Application Data"
"20.332043","172.18.0.2","54.38.73.16","TCP","68","36876 → 21002 [ACK] Seq=25920 Ack=463102 Win=5589 Len=0 TSval=1082431593 TSecr=2674757051"
"20.332011","54.38.73.16","172.18.0.2","TCP","2964","[TCP segment of a reassembled PDU]"
"20.332189","172.18.0.2","54.38.73.16","TCP","68","36876 → 21002 [ACK] Seq=25920 Ack=465998 Win=5567 Len=0 TSval=1082431593 TSecr=2674757051"
"20.355115","54.38.73.16","172.18.0.2","TLSv1.2","863","Application Data"
"20.364542","54.38.73.16","172.18.0.2","TLSv1.2","7308","Application Data"
"20.364693","172.18.0.2","54.38.73.16","TCP","68","36876 → 21002 [ACK] Seq=25920 Ack=474033 Win=5565 Len=0 TSval=1082431625 TSecr=2674757058"
"20.388456","54.38.73.16","172.18.0.2","TLSv1.2","1139","Application Data, Application Data"
"20.388906","172.18.0.2","54.38.73.16","TLSv1.2","611","Application Data"
"20.412184","54.38.73.16","172.18.0.2","TLSv1.2","1125","Application Data"
"20.454229","172.18.0.2","54.38.73.16","TCP","68","36876 → 21002 [ACK] Seq=26463 Ack=476161 Win=5612 Len=0 TSval=1082431715 TSecr=2674757072"
"20.510634","54.38.73.16","172.18.0.2","TLSv1.2","2667","Application Data"
"20.510785","172.18.0.2","54.38.73.16","TCP","68","36876 → 21002 [ACK] Seq=26463 Ack=478760 Win=5597 Len=0 TSval=1082431771 TSecr=2674757096"
"20.521492","172.18.0.2","54.38.73.16","TLSv1.2","611","Application Data"
"20.583916","54.38.73.16","172.18.0.2","TCP","68","21002 → 36876 [ACK] Seq=478760 Ack=27006 Win=1452 Len=0 TSval=2674757115 TSecr=1082431782"
"21.033981","54.38.73.16","172.18.0.2","TLSv1.2","611","Application Data"
"21.034055","172.18.0.2","54.38.73.16","TCP","68","36876 → 21002 [ACK] Seq=27006 Ack=479303 Win=5608 Len=0 TSval=1082432294 TSecr=2674757219"
"21.034967","172.18.0.2","54.38.73.16","TLSv1.2","611","Application Data"
"21.059444","54.38.73.16","172.18.0.2","TCP","68","21002 → 36876 [ACK] Seq=479303 Ack=27549 Win=1452 Len=0 TSval=2674757234 TSecr=1082432295"
"21.546328","54.38.73.16","172.18.0.2","TLSv1.2","611","Application Data"
"21.546387","172.18.0.2","54.38.73.16","TCP","68","36876 → 21002 [ACK] Seq=27549 Ack=479846 Win=5608 Len=0 TSval=1082432807 TSecr=2674757351"
"21.647027","54.38.73.16","172.18.0.2","TLSv1.2","4145","Application Data"
"21.647058","172.18.0.2","54.38.73.16","TCP","68","36876 → 21002 [ACK] Seq=27549 Ack=483923 Win=5580 Len=0 TSval=1082432908 TSecr=2674757380"
"21.649236","172.18.0.2","54.38.73.16","TLSv1.2","611","Application Data"
"21.670562","54.38.73.16","172.18.0.2","TLSv1.2","161","Application Data"
"21.673582","54.38.73.16","172.18.0.2","TCP","68","21002 → 36876 [ACK] Seq=484016 Ack=28092 Win=1452 Len=0 TSval=2674757387 TSecr=1082432910"
"21.673619","172.18.0.2","54.38.73.16","TLSv1.2","611","Application Data"
"21.699119","54.38.73.16","172.18.0.2","TCP","68","21002 → 36876 [ACK] Seq=484016 Ack=28635 Win=1452 Len=0 TSval=2674757393 TSecr=1082432934"
"22.568783","54.38.73.16","172.18.0.2","TLSv1.2","611","Application Data"
"22.568819","54.38.73.16","172.18.0.2","TCP","611","[TCP Retransmission] 21002 → 36876 [PSH, ACK] Seq=484016 Ack=28635 Win=1452 Len=543 TSval=2674757595 TSecr=1082432934"
"22.568893","172.18.0.2","54.38.73.16","TCP","80","36876 → 21002 [ACK] Seq=28635 Ack=484559 Win=5608 Len=0 TSval=1082433829 TSecr=2674757595 SLE=484016 SRE=484559"
"22.569900","172.18.0.2","54.38.73.16","TLSv1.2","611","Application Data"
"22.593922","54.38.73.16","172.18.0.2","TCP","68","21002 → 36876 [ACK] Seq=484559 Ack=29178 Win=1452 Len=0 TSval=2674757617 TSecr=1082433830"
"23.081899","54.38.73.16","172.18.0.2","TCP","1516","[TCP segment of a reassembled PDU]"
"23.081944","172.18.0.2","54.38.73.16","TCP","68","36876 → 21002 [ACK] Seq=29178 Ack=486007 Win=5601 Len=0 TSval=1082434342 TSecr=2674757729"
"23.082076","54.38.73.16","172.18.0.2","TLSv1.2","2247","Application Data"
"23.082126","172.18.0.2","54.38.73.16","TCP","68","36876 → 21002 [ACK] Seq=29178 Ack=488186 Win=5584 Len=0 TSval=1082434343 TSecr=2674757729"
"23.084094","54.38.73.16","172.18.0.2","TCP","2964","[TCP segment of a reassembled PDU]"
"23.084122","172.18.0.2","54.38.73.16","TCP","68","36876 → 21002 [ACK] Seq=29178 Ack=491082 Win=5596 Len=0 TSval=1082434345 TSecr=2674757740"
"23.111869","54.38.73.16","172.18.0.2","TLSv1.2","1342","Application Data, Application Data"
"23.111903","172.18.0.2","54.38.73.16","TCP","68","36876 → 21002 [ACK] Seq=29178 Ack=492356 Win=5593 Len=0 TSval=1082434372 TSecr=2674757745"
"23.165352","54.38.73.16","172.18.0.2","TLSv1.2","2153","Application Data"
"23.165385","172.18.0.2","54.38.73.16","TCP","68","36876 → 21002 [ACK] Seq=29178 Ack=494441 Win=5599 Len=0 TSval=1082434426 TSecr=2674757759"
"23.171557","172.18.0.2","54.38.73.16","TLSv1.2","611","Application Data"
"23.202997","54.38.73.16","172.18.0.2","TCP","68","21002 → 36876 [ACK] Seq=494441 Ack=29721 Win=1452 Len=0 TSval=2674757768 TSecr=1082434432"
"23.696489","54.38.73.16","172.18.0.2","TLSv1.2","611","Application Data"
"23.696533","172.18.0.2","54.38.73.16","TCP","68","36876 → 21002 [ACK] Seq=29721 Ack=494984 Win=5608 Len=0 TSval=1082434957 TSecr=2674757886"
"23.697286","172.18.0.2","54.38.73.16","TLSv1.2","611","Application Data"
"23.722861","54.38.73.16","172.18.0.2","TCP","68","21002 → 36876 [ACK] Seq=494984 Ack=30264 Win=1452 Len=0 TSval=2674757899 TSecr=1082434958"
"24.725227","54.38.73.16","172.18.0.2","TLSv1.2","611","Application Data"
"24.725550","54.38.73.16","172.18.0.2","TLSv1.2","10204","Application Data, Application Data"
"24.725681","172.18.0.2","54.38.73.16","TCP","68","36876 → 21002 [ACK] Seq=30264 Ack=505663 Win=5550 Len=0 TSval=1082435986 TSecr=2674758127"
"24.726481","172.18.0.2","54.38.73.16","TLSv1.2","611","Application Data"
"24.750156","54.38.73.16","172.18.0.2","TLSv1.2","1841","Application Data"
"24.750187","172.18.0.2","54.38.73.16","TCP","68","36876 → 21002 [ACK] Seq=30807 Ack=507436 Win=5600 Len=0 TSval=1082436011 TSecr=2674758156"
"24.750924","54.38.73.16","172.18.0.2","TCP","68","21002 → 36876 [ACK] Seq=507436 Ack=30807 Win=1452 Len=0 TSval=2674758156 TSecr=1082435987"
"24.752974","54.38.73.16","172.18.0.2","TCP","2964","[TCP segment of a reassembled PDU]"
"24.753134","172.18.0.2","54.38.73.16","TCP","68","36876 → 21002 [ACK] Seq=30807 Ack=510332 Win=5596 Len=0 TSval=1082436014 TSecr=2674758157"
"24.774302","54.38.73.16","172.18.0.2","TLSv1.2","799","Application Data"
"24.812117","54.38.73.16","172.18.0.2","TLSv1.2","10204","Application Data, Application Data"
"24.812149","172.18.0.2","54.38.73.16","TCP","68","36876 → 21002 [ACK] Seq=30807 Ack=521199 Win=5550 Len=0 TSval=1082436073 TSecr=2674758162"
"24.837459","54.38.73.16","172.18.0.2","TLSv1.2","11238","Application Data, Application Data, Application Data, Application Data, Application Data, Application Data"
"24.837514","172.18.0.2","54.38.73.16","TCP","68","36876 → 21002 [ACK] Seq=30807 Ack=532369 Win=5552 Len=0 TSval=1082436098 TSecr=2674758178"
"24.837935","172.18.0.2","54.38.73.16","TLSv1.2","611","Application Data"
"24.861877","54.38.73.16","172.18.0.2","TLSv1.2","2667","Application Data"
"24.861906","172.18.0.2","54.38.73.16","TCP","68","36876 → 21002 [ACK] Seq=31350 Ack=534968 Win=5597 Len=0 TSval=1082436122 TSecr=2674758184"
"24.878722","54.38.73.16","172.18.0.2","TCP","2964","[TCP segment of a reassembled PDU]"
"24.878898","172.18.0.2","54.38.73.16","TCP","68","36876 → 21002 [ACK] Seq=31350 Ack=537864 Win=5596 Len=0 TSval=1082436139 TSecr=2674758188"
"24.885384","54.38.73.16","172.18.0.2","TLSv1.2","1342","Application Data, Application Data"
"24.919813","54.38.73.16","172.18.0.2","TLSv1.2","10204","Application Data, Application Data"
"24.919855","172.18.0.2","54.38.73.16","TCP","68","36876 → 21002 [ACK] Seq=31350 Ack=549274 Win=5550 Len=0 TSval=1082436180 TSecr=2674758190"
"24.920662","172.18.0.2","54.38.73.16","TLSv1.2","611","Application Data"
"24.944743","54.38.73.16","172.18.0.2","TLSv1.2","11238","Application Data, Application Data, Application Data, Application Data, Application Data, Application Data"
"24.944795","172.18.0.2","54.38.73.16","TCP","68","36876 → 21002 [ACK] Seq=31893 Ack=560444 Win=5552 Len=0 TSval=1082436205 TSecr=2674758205"
"24.969980","54.38.73.16","172.18.0.2","TLSv1.2","11550","Application Data, Application Data, Application Data, Application Data, Application Data, Application Data"
"24.970022","172.18.0.2","54.38.73.16","TLSv1.2","611","Application Data"
"24.994628","54.38.73.16","172.18.0.2","TLSv1.2","3181","Application Data"
"24.994663","172.18.0.2","54.38.73.16","TCP","68","36876 → 21002 [ACK] Seq=32436 Ack=575039 Win=5580 Len=0 TSval=1082436255 TSecr=2674758217"
"24.995349","172.18.0.2","54.38.73.16","TLSv1.2","611","Application Data"
"25.059682","54.38.73.16","172.18.0.2","TCP","68","21002 → 36876 [ACK] Seq=575039 Ack=32979 Win=1452 Len=0 TSval=2674758234 TSecr=1082436256"
"25.059722","172.18.0.2","54.38.73.16","TLSv1.2","611","Application Data"
"25.124049","54.38.73.16","172.18.0.2","TCP","68","21002 → 36876 [ACK] Seq=575039 Ack=33522 Win=1452 Len=0 TSval=2674758250 TSecr=1082436320"
"26.568427","54.38.73.16","172.18.0.2","TLSv1.2","611","Application Data"
"26.569433","172.18.0.2","54.38.73.16","TLSv1.2","611","Application Data"
