_ws.col.Time,_ws.col.Source,_ws.col.Destination,_ws.col.Protocol,_ws.col.Length,_ws.col.Info
"0.000000","172.18.0.2","54.38.73.16","TLSv1.2","611","Application Data"
"0.060983","54.38.73.16","172.18.0.2","TCP","68","21002 → 36876 [ACK] Seq=1 Ack=544 Win=1452 Len=0 TSval=2673433286 TSecr=1077136504"
"0.422335","54.38.73.16","172.18.0.2","TLSv1.2","611","Application Data"
"0.422401","172.18.0.2","54.38.73.16","TCP","68","36876 → 21002 [ACK] Seq=544 Ack=544 Win=5608 Len=0 TSval=1077136927 TSecr=2673433354"
"0.423466","172.18.0.2","54.38.73.16","TCP","1516","[TCP segment of a reassembled PDU]"
"0.423552","172.18.0.2","54.38.73.16","TLSv1.2","705","Application Data"
"0.446953","54.38.73.16","172.18.0.2","TCP","68","21002 → 36876 [ACK] Seq=544 Ack=2629 Win=1450 Len=0 TSval=2673433382 TSecr=1077136928"
"0.787771","54.38.73.16","172.18.0.2","TLSv1.2","611","Application Data"
"0.787831","172.18.0.2","54.38.73.16","TCP","68","36876 → 21002 [ACK] Seq=2629 Ack=1087 Win=5608 Len=0 TSval=1077137292 TSecr=2673433467"
"0.815110","54.38.73.16","172.18.0.2","TLSv1.2","1125","Application Data"
"0.815160","172.18.0.2","54.38.73.16","TCP","68","36876 → 21002 [ACK] Seq=2629 Ack=2144 Win=5600 Len=0 TSval=1077137319 TSecr=2673433474"
"0.822560","172.18.0.2","54.38.73.16","TLSv1.2","611","Application Data"
"0.848995","54.38.73.16","172.18.0.2","TCP","68","21002 → 36876 [ACK] Seq=2144 Ack=3172 Win=1452 Len=0 TSval=2673433482 TSecr=1077137327"
"1.650896","54.38.73.16","172.18.0.2","TLSv1.2","611","Application Data"
"1.650950","172.18.0.2","54.38.73.16","TCP","68","36876 → 21002 [ACK] Seq=3172 Ack=2687 Win=5608 Len=0 TSval=1077138155 TSecr=2673433672"
"1.651848","172.18.0.2","54.38.73.16","TLSv1.2","611","Application Data"
"1.675351","54.38.73.16","172.18.0.2","TCP","68","21002 → 36876 [ACK] Seq=2687 Ack=3715 Win=1452 Len=0 TSval=2673433689 TSecr=1077138156"
"1.979645","54.38.73.16","172.18.0.2","TLSv1.2","611","Application Data"
"1.990092","54.38.73.16","172.18.0.2","TCP","2964","[TCP segment of a reassembled PDU]"
"1.990331","172.18.0.2","54.38.73.16","TCP","68","36876 → 21002 [ACK] Seq=3715 Ack=6126 Win=5595 Len=0 TSval=1077138495 TSecr=2673433765"
"2.014533","54.38.73.16","172.18.0.2","TLSv1.2","2964","Application Data [TCP segment of a reassembled PDU]"
"2.014567","172.18.0.2","54.38.73.16","TCP","68","36876 → 21002 [ACK] Seq=3715 Ack=9022 Win=5595 Len=0 TSval=1077138519 TSecr=2673433774"
"2.014791","54.38.73.16","172.18.0.2","TLSv1.2","1016","Application Data"
"2.045796","54.38.73.16","172.18.0.2","TCP","1516","[TCP segment of a reassembled PDU]"
"2.045969","172.18.0.2","54.38.73.16","TCP","68","36876 → 21002 [ACK] Seq=3715 Ack=11418 Win=5593 Len=0 TSval=1077138550 TSecr=2673433774"
"2.071209","54.38.73.16","172.18.0.2","TLSv1.2","191","Application Data"
"2.077250","172.18.0.2","54.38.73.16","TLSv1.2","611","Application Data"
"2.101689","54.38.73.16","172.18.0.2","TCP","68","21002 → 36876 [ACK] Seq=11541 Ack=4258 Win=1452 Len=0 TSval=2673433796 TSecr=1077138581"
"2.880129","54.38.73.16","172.18.0.2","TLSv1.2","611","Application Data"
"2.881101","172.18.0.2","54.38.73.16","TLSv1.2","611","Application Data"
"2.905306","54.38.73.16","172.18.0.2","TCP","68","21002 → 36876 [ACK] Seq=12084 Ack=4801 Win=1452 Len=0 TSval=2673433997 TSecr=1077139385"
"3.188054","54.38.73.16","172.18.0.2","TLSv1.2","4145","Application Data"
"3.188065","54.38.73.16","172.18.0.2","TLSv1.2","10204","Application Data, Application Data, Application Data"
"3.188243","172.18.0.2","54.38.73.16","TCP","68","36876 → 21002 [ACK] Seq=4801 Ack=26297 Win=5516 Len=0 TSval=1077139692 TSecr=2673434059"
"3.212474","54.38.73.16","172.18.0.2","TLSv1.2","14444","Application Data, Application Data, Application Data, Application Data, Application Data, Application Data, Application Data"
"3.212512","172.18.0.2","54.38.73.16","TCP","68","36876 → 21002 [ACK] Seq=4801 Ack=40673 Win=5536 Len=0 TSval=1077139717 TSecr=2673434073"
"3.213013","172.18.0.2","54.38.73.16","TLSv1.2","611","Application Data"
"3.237937","54.38.73.16","172.18.0.2","TCP","68","21002 → 36876 [ACK] Seq=40673 Ack=5344 Win=1452 Len=0 TSval=2673434080 TSecr=1077139717"
"3.237977","172.18.0.2","54.38.73.16","TLSv1.2","1125","Application Data"
"3.261886","54.38.73.16","172.18.0.2","TCP","68","21002 → 36876 [ACK] Seq=40673 Ack=6401 Win=1452 Len=0 TSval=2673434086 TSecr=1077139742"
"3.596734","54.38.73.16","172.18.0.2","TLSv1.2","611","Application Data"
"3.597780","172.18.0.2","54.38.73.16","TLSv1.2","611","Application Data"
"3.622327","54.38.73.16","172.18.0.2","TCP","68","21002 → 36876 [ACK] Seq=41216 Ack=6944 Win=1452 Len=0 TSval=2673434176 TSecr=1077140102"
"3.974778","54.38.73.16","172.18.0.2","TLSv1.2","4145","Application Data"
"3.974968","172.18.0.2","54.38.73.16","TCP","68","36876 → 21002 [ACK] Seq=6944 Ack=45293 Win=5581 Len=0 TSval=1077140479 TSecr=2673434264"
"3.995736","54.38.73.16","172.18.0.2","TLSv1.2","2964","Application Data"
"3.995772","172.18.0.2","54.38.73.16","TCP","68","36876 → 21002 [ACK] Seq=6944 Ack=48189 Win=5595 Len=0 TSval=1077140500 TSecr=2673434269"
"3.999930","54.38.73.16","172.18.0.2","TLSv1.2","1435","Application Data, Application Data"
"4.016640","54.38.73.16","172.18.0.2","TCP","2964","[TCP segment of a reassembled PDU]"
"4.016675","172.18.0.2","54.38.73.16","TCP","68","36876 → 21002 [ACK] Seq=6944 Ack=52452 Win=5595 Len=0 TSval=1077140521 TSecr=2673434270"
"4.037176","54.38.73.16","172.18.0.2","TLSv1.2","2964","Application Data, Application Data"
"4.037212","172.18.0.2","54.38.73.16","TCP","68","36876 → 21002 [ACK] Seq=6944 Ack=55348 Win=5595 Len=0 TSval=1077140541 TSecr=2673434279"
"4.037532","54.38.73.16","172.18.0.2","TLSv1.2","5860","Application Data [TCP segment of a reassembled PDU]"
"4.037705","172.18.0.2","54.38.73.16","TCP","68","36876 → 21002 [ACK] Seq=6944 Ack=61140 Win=5564 Len=0 TSval=1077140542 TSecr=2673434279"
"4.041126","54.38.73.16","172.18.0.2","TLSv1.2","1993","Application Data, Application Data"
"4.041161","172.18.0.2","54.38.73.16","TCP","68","36876 → 21002 [ACK] Seq=6944 Ack=63065 Win=5599 Len=0 TSval=1077140545 TSecr=2673434281"
"4.047218","54.38.73.16","172.18.0.2","TCP","2964","[TCP segment of a reassembled PDU]"
"4.047374","172.18.0.2","54.38.73.16","TCP","68","36876 → 21002 [ACK] Seq=6944 Ack=65961 Win=5595 Len=0 TSval=1077140552 TSecr=2673434282"
"4.057541","54.38.73.16","172.18.0.2","TLSv1.2","1516","Application Data [TCP segment of a reassembled PDU]"
"4.061087","54.38.73.16","172.18.0.2","TCP","1516","21002 → 36876 [ACK] Seq=67409 Ack=6944 Win=1452 Len=1448 TSval=2673434286 TSecr=1077140541 [TCP segment of a reassembled PDU]"
"4.061231","172.18.0.2","54.38.73.16","TCP","68","36876 → 21002 [ACK] Seq=6944 Ack=68857 Win=5612 Len=0 TSval=1077140565 TSecr=2673434285"
"4.065061","54.38.73.16","172.18.0.2","TLSv1.2","1016","Application Data"
"4.065532","172.18.0.2","54.38.73.16","TLSv1.2","611","Application Data"
"4.091877","54.38.73.16","172.18.0.2","TCP","68","21002 → 36876 [ACK] Seq=69805 Ack=7487 Win=1452 Len=0 TSval=2673434293 TSecr=1077140570"
"4.119914","54.38.73.16","172.18.0.2","TCP","2964","[TCP segment of a reassembled PDU]"
"4.120078","172.18.0.2","54.38.73.16","TCP","68","36876 → 21002 [ACK] Seq=7487 Ack=72701 Win=5595 Len=0 TSval=1077140624 TSecr=2673434300"
"4.120469","54.38.73.16","172.18.0.2","TLSv1.2","1249","Application Data"
"4.120519","54.38.73.16","172.18.0.2","TLSv1.2","10204","Application Data, Application Data"
"4.120624","172.18.0.2","54.38.73.16","TCP","68","36876 → 21002 [ACK] Seq=7487 Ack=84018 Win=5558 Len=0 TSval=1077140625 TSecr=2673434300"
"4.121534","172.18.0.2","54.38.73.16","TLSv1.2","611","Application Data"
"4.139652","54.38.73.16","172.18.0.2","TLSv1.2","1516","Application Data [TCP segment of a reassembled PDU]"
"4.146253","54.38.73.16","172.18.0.2","TCP","2964","21002 → 36876 [ACK] Seq=85466 Ack=7487 Win=1452 Len=2896 TSval=2673434307 TSecr=1077140624 [TCP segment of a reassembled PDU]"
"4.146276","172.18.0.2","54.38.73.16","TCP","68","36876 → 21002 [ACK] Seq=8030 Ack=88362 Win=5595 Len=0 TSval=1077140651 TSecr=2673434305"
"4.146257","54.38.73.16","172.18.0.2","TLSv1.2","6900","Application Data, Application Data, Application Data"
"4.146347","172.18.0.2","54.38.73.16","TCP","68","36876 → 21002 [ACK] Seq=8030 Ack=95194 Win=5564 Len=0 TSval=1077140651 TSecr=2673434307"
"4.184229","54.38.73.16","172.18.0.2","TCP","68","21002 → 36876 [ACK] Seq=95194 Ack=8030 Win=1452 Len=0 TSval=2673434317 TSecr=1077140626"
"4.184268","172.18.0.2","54.38.73.16","TLSv1.2","1154","Application Data, Application Data"
"4.248705","54.38.73.16","172.18.0.2","TCP","68","21002 → 36876 [ACK] Seq=95194 Ack=9116 Win=1452 Len=0 TSval=2673434333 TSecr=1077140688"
"4.518356","54.38.73.16","172.18.0.2","TLSv1.2","611","Application Data"
"4.519357","172.18.0.2","54.38.73.16","TLSv1.2","611","Application Data"
"4.543641","54.38.73.16","172.18.0.2","TCP","68","21002 → 36876 [ACK] Seq=95737 Ack=9659 Win=1452 Len=0 TSval=2673434406 TSecr=1077141024"
"4.905412","54.38.73.16","172.18.0.2","TLSv1.2","611","Application Data"
"4.915225","54.38.73.16","172.18.0.2","TLSv1.2","10204","Application Data, Application Data"
"4.915414","172.18.0.2","54.38.73.16","TCP","68","36876 → 21002 [ACK] Seq=9659 Ack=106416 Win=5549 Len=0 TSval=1077141420 TSecr=2673434497"
"4.939911","54.38.73.16","172.18.0.2","TLSv1.2","1327","Application Data"
"4.948577","54.38.73.16","172.18.0.2","TCP","2964","[TCP segment of a reassembled PDU]"
"4.948613","172.18.0.2","54.38.73.16","TCP","68","36876 → 21002 [ACK] Seq=9659 Ack=110571 Win=5595 Len=0 TSval=1077141453 TSecr=2673434505"
"4.969060","54.38.73.16","172.18.0.2","TLSv1.2","1516","Application Data [TCP segment of a reassembled PDU]"
"4.973891","54.38.73.16","172.18.0.2","TLSv1.2","408","Application Data"
"4.974047","172.18.0.2","54.38.73.16","TCP","68","36876 → 21002 [ACK] Seq=9659 Ack=112359 Win=5612 Len=0 TSval=1077141478 TSecr=2673434513"
"5.001944","54.38.73.16","172.18.0.2","TLSv1.2","611","Application Data"
"5.011869","54.38.73.16","172.18.0.2","TLSv1.2","4412","Application Data"
"5.012019","172.18.0.2","54.38.73.16","TCP","68","36876 → 21002 [ACK] Seq=9659 Ack=117246 Win=5579 Len=0 TSval=1077141516 TSecr=2673434521"
"5.022871","54.38.73.16","172.18.0.2","TLSv1.2","2964","Application Data [TCP segment of a reassembled PDU]"
"5.022908","172.18.0.2","54.38.73.16","TCP","68","36876 → 21002 [ACK] Seq=9659 Ack=120142 Win=5595 Len=0 TSval=1077141527 TSecr=2673434526"
"5.036664","54.38.73.16","172.18.0.2","TLSv1.2","111","Application Data"
"5.041691","54.38.73.16","172.18.0.2","TLSv1.2","4412","Application Data"
"5.041836","172.18.0.2","54.38.73.16","TCP","68","36876 → 21002 [ACK] Seq=9659 Ack=124529 Win=5579 Len=0 TSval=1077141546 TSecr=2673434530"
"5.041984","54.38.73.16","172.18.0.2","TCP","2964","21002 → 36876 [ACK] Seq=124529 Ack=9659 Win=1452 Len=2896 TSval=2673434531 TSecr=1077141516 [TCP segment of a reassembled PDU]"
"5.042363","172.18.0.2","54.38.73.16","TLSv1.2","611","Application Data"
"5.052311","54.38.73.16","172.18.0.2","TLSv1.2","2964","Application Data [TCP segment of a reassembled PDU]"
"5.052347","172.18.0.2","54.38.73.16","TCP","68","36876 → 21002 [ACK] Seq=10202 Ack=130321 Win=5595 Len=0 TSval=1077141557 TSecr=2673434533"
"5.062375","54.38.73.16","172.18.0.2","TLSv1.2","2964","Application Data [TCP segment of a reassembled PDU]"
"5.062413","172.18.0.2","54.38.73.16","TCP","68","36876 → 21002 [ACK] Seq=10202 Ack=133217 Win=5595 Len=0 TSval=1077141567 TSecr=2673434536"
"5.065069","54.38.73.16","172.18.0.2","TLSv1.2","1030","Application Data"
"5.065944","54.38.73.16","172.18.0.2","TCP","68","21002 → 36876 [ACK] Seq=134179 Ack=10202 Win=1452 Len=0 TSval=2673434537 TSecr=1077141547"
"5.065981","172.18.0.2","54.38.73.16","TLSv1.2","611","Application Data"
"5.090444","54.38.73.16","172.18.0.2","TCP","68","21002 → 36876 [ACK] Seq=134179 Ack=10745 Win=1452 Len=0 TSval=2673434543 TSecr=1077141570"
"5.135028","54.38.73.16","172.18.0.2","TLSv1.2","4145","Application Data"
"5.135188","172.18.0.2","54.38.73.16","TCP","68","36876 → 21002 [ACK] Seq=10745 Ack=138256 Win=5581 Len=0 TSval=1077141639 TSecr=2673434554"
"5.155949","54.38.73.16","172.18.0.2","TLSv1.2","2964","Application Data"
"5.155964","172.18.0.2","54.38.73.16","TCP","68","36876 → 21002 [ACK] Seq=10745 Ack=141152 Win=5595 Len=0 TSval=1077141660 TSecr=2673434559"
"5.159645","54.38.73.16","172.18.0.2","TLSv1.2","1435","Application Data, Application Data"
"5.162461","172.18.0.2","54.38.73.16","TLSv1.2","611","Application Data"
"5.186230","54.38.73.16","172.18.0.2","TCP","68","21002 → 36876 [ACK] Seq=142519 Ack=11288 Win=1452 Len=0 TSval=2673434567 TSecr=1077141667"
"5.747223","54.38.73.16","172.18.0.2","TLSv1.2","611","Application Data"
"5.747240","54.38.73.16","172.18.0.2","TCP","611","[TCP Retransmission] 21002 → 36876 [PSH, ACK] Seq=142519 Ack=11288 Win=1452 Len=543 TSval=2673434689 TSecr=1077141667"
"5.747308","172.18.0.2","54.38.73.16","TCP","80","36876 → 21002 [ACK] Seq=11288 Ack=143062 Win=5608 Len=0 TSval=1077142252 TSecr=2673434689 SLE=142519 SRE=143062"
"5.748219","172.18.0.2","54.38.73.16","TLSv1.2","611","Application Data"
"5.773037","54.38.73.16","172.18.0.2","TCP","68","21002 → 36876 [ACK] Seq=143062 Ack=11831 Win=1452 Len=0 TSval=2673434714 TSecr=1077142252"
"5.991531","54.38.73.16","172.18.0.2","TLSv1.2","611","Application Data"
"5.991593","172.18.0.2","54.38.73.16","TCP","68","36876 → 21002 [ACK] Seq=11831 Ack=143605 Win=5608 Len=0 TSval=1077142496 TSecr=2673434768"
"6.033742","54.38.73.16","172.18.0.2","TLSv1.2","3695","Application Data"
"6.033801","172.18.0.2","54.38.73.16","TCP","68","36876 → 21002 [ACK] Seq=11831 Ack=147232 Win=5580 Len=0 TSval=1077142538 TSecr=2673434778"
"6.035911","172.18.0.2","54.38.73.16","TLSv1.2","611","Application Data"
"6.057625","54.38.73.16","172.18.0.2","TLSv1.2","611","Application Data"
"6.057661","172.18.0.2","54.38.73.16","TCP","68","36876 → 21002 [ACK] Seq=12374 Ack=147775 Win=5608 Len=0 TSval=1077142562 TSecr=2673434785"
"6.059321","54.38.73.16","172.18.0.2","TCP","68","21002 → 36876 [ACK] Seq=147775 Ack=12374 Win=1452 Len=0 TSval=2673434785 TSecr=1077142540"
"6.059350","172.18.0.2","54.38.73.16","TLSv1.2","611","Application Data"
"6.083146","54.38.73.16","172.18.0.2","TCP","68","21002 → 36876 [ACK] Seq=147775 Ack=12917 Win=1452 Len=0 TSval=2673434791 TSecr=1077142564"
"6.669398","54.38.73.16","172.18.0.2","TLSv1.2","611","Application Data"
"6.669417","54.38.73.16","172.18.0.2","TCP","611","[TCP Retransmission] 21002 → 36876 [PSH, ACK] Seq=147775 Ack=12917 Win=1452 Len=543 TSval=2673434919 TSecr=1077142564"
"6.669477","172.18.0.2","54.38.73.16","TCP","80","36876 → 21002 [ACK] Seq=12917 Ack=148318 Win=5608 Len=0 TSval=1077143174 TSecr=2673434919 SLE=147775 SRE=148318"
"6.670497","172.18.0.2","54.38.73.16","TLSv1.2","611","Application Data"
"6.694454","54.38.73.16","172.18.0.2","TCP","68","21002 → 36876 [ACK] Seq=148318 Ack=13460 Win=1452 Len=0 TSval=2673434944 TSecr=1077143175"
"6.936701","54.38.73.16","172.18.0.2","TLSv1.2","4145","Application Data"
"6.936760","172.18.0.2","54.38.73.16","TCP","68","36876 → 21002 [ACK] Seq=13460 Ack=152395 Win=5589 Len=0 TSval=1077143441 TSecr=2673435004"
"6.936711","54.38.73.16","172.18.0.2","TCP","2964","[TCP segment of a reassembled PDU]"
"6.936774","172.18.0.2","54.38.73.16","TCP","68","36876 → 21002 [ACK] Seq=13460 Ack=155291 Win=5567 Len=0 TSval=1077143441 TSecr=2673435004"
"6.956660","54.38.73.16","172.18.0.2","TLSv1.2","2964","Application Data [TCP segment of a reassembled PDU]"
"6.956692","172.18.0.2","54.38.73.16","TCP","68","36876 → 21002 [ACK] Seq=13460 Ack=158187 Win=5595 Len=0 TSval=1077143461 TSecr=2673435009"
"6.960880","54.38.73.16","172.18.0.2","TLSv1.2","5860","Application Data, Application Data"
"6.960916","172.18.0.2","54.38.73.16","TCP","68","36876 → 21002 [ACK] Seq=13460 Ack=163979 Win=5580 Len=0 TSval=1077143465 TSecr=2673435011"
"6.980843","54.38.73.16","172.18.0.2","TLSv1.2","2964","Application Data [TCP segment of a reassembled PDU]"
"6.980875","172.18.0.2","54.38.73.16","TCP","68","36876 → 21002 [ACK] Seq=13460 Ack=166875 Win=5595 Len=0 TSval=1077143485 TSecr=2673435016"
"6.984735","54.38.73.16","172.18.0.2","TLSv1.2","5358","Application Data, Application Data"
"6.984772","172.18.0.2","54.38.73.16","TCP","68","36876 → 21002 [ACK] Seq=13460 Ack=172165 Win=5582 Len=0 TSval=1077143489 TSecr=2673435017"
"7.005471","54.38.73.16","172.18.0.2","TCP","2964","[TCP segment of a reassembled PDU]"
"7.005504","172.18.0.2","54.38.73.16","TCP","68","36876 → 21002 [ACK] Seq=13460 Ack=175061 Win=5595 Len=0 TSval=1077143510 TSecr=2673435022"
"7.008746","54.38.73.16","172.18.0.2","TLSv1.2","5483","Application Data, Application Data, Application Data"
"7.008779","172.18.0.2","54.38.73.16","TCP","68","36876 → 21002 [ACK] Seq=13460 Ack=180476 Win=5582 Len=0 TSval=1077143513 TSecr=2673435023"
"7.008932","54.38.73.16","172.18.0.2","TCP","1516","[TCP segment of a reassembled PDU]"
"7.008960","172.18.0.2","54.38.73.16","TCP","68","36876 → 21002 [ACK] Seq=13460 Ack=181924 Win=5571 Len=0 TSval=1077143513 TSecr=2673435023"
"7.009211","172.18.0.2","54.38.73.16","TLSv1.2","611","Application Data"
"7.029449","54.38.73.16","172.18.0.2","TLSv1.2","2964","Application Data [TCP segment of a reassembled PDU]"
"7.029482","172.18.0.2","54.38.73.16","TCP","68","36876 → 21002 [ACK] Seq=14003 Ack=184820 Win=5595 Len=0 TSval=1077143534 TSecr=2673435028"
"7.032485","54.38.73.16","172.18.0.2","TLSv1.2","7148","Application Data, Application Data, Application Data"
"7.032525","172.18.0.2","54.38.73.16","TCP","68","36876 → 21002 [ACK] Seq=14003 Ack=191900 Win=5564 Len=0 TSval=1077143537 TSecr=2673435028"
"7.033859","54.38.73.16","172.18.0.2","TCP","68","21002 → 36876 [ACK] Seq=191900 Ack=14003 Win=1452 Len=0 TSval=2673435029 TSecr=1077143513"
"7.033894","172.18.0.2","54.38.73.16","TLSv1.2","611","Application Data"
"7.054326","54.38.73.16","172.18.0.2","TCP","2964","[TCP segment of a reassembled PDU]"
"7.054511","172.18.0.2","54.38.73.16","TCP","68","36876 → 21002 [ACK] Seq=14546 Ack=194796 Win=5595 Len=0 TSval=1077143559 TSecr=2673435034"
"7.057715","54.38.73.16","172.18.0.2","TLSv1.2","7054","Application Data, Application Data, Application Data, Application Data"
"7.057887","172.18.0.2","54.38.73.16","TCP","68","36876 → 21002 [ACK] Seq=14546 Ack=201782 Win=5564 Len=0 TSval=1077143562 TSecr=2673435035"
"7.078345","54.38.73.16","172.18.0.2","TCP","2964","[TCP segment of a reassembled PDU]"
"7.078387","172.18.0.2","54.38.73.16","TLSv1.2","611","Application Data"
"7.081936","54.38.73.16","172.18.0.2","TLSv1.2","7054","Application Data, Application Data, Application Data, Application Data"
"7.082098","172.18.0.2","54.38.73.16","TCP","68","36876 → 21002 [ACK] Seq=15089 Ack=211664 Win=5564 Len=0 TSval=1077143586 TSecr=2673435041"
"7.103435","54.38.73.16","172.18.0.2","TCP","2964","[TCP segment of a reassembled PDU]"
"7.103475","172.18.0.2","54.38.73.16","TCP","68","36876 → 21002 [ACK] Seq=15089 Ack=214560 Win=5595 Len=0 TSval=1077143608 TSecr=2673435046"
"7.106074","54.38.73.16","172.18.0.2","TLSv1.2","1516","Application Data [TCP segment of a reassembled PDU]"
"7.107472","54.38.73.16","172.18.0.2","TLSv1.2","4549","Application Data, Application Data"
"7.107642","172.18.0.2","54.38.73.16","TCP","68","36876 → 21002 [ACK] Seq=15089 Ack=220489 Win=5585 Len=0 TSval=1077143612 TSecr=2673435047"
"7.117593","172.18.0.2","54.38.73.16","TLSv1.2","611","Application Data"
"7.180826","54.38.73.16","172.18.0.2","TCP","68","21002 → 36876 [ACK] Seq=220489 Ack=15632 Win=1452 Len=0 TSval=2673435066 TSecr=1077143622"
"7.355112","54.38.73.16","172.18.0.2","TLSv1.2","611","Application Data"
"7.356167","172.18.0.2","54.38.73.16","TLSv1.2","611","Application Data"
"7.380821","54.38.73.16","172.18.0.2","TCP","68","21002 → 36876 [ACK] Seq=221032 Ack=16175 Win=1452 Len=0 TSval=2673435116 TSecr=1077143860"
"7.743260","54.38.73.16","172.18.0.2","TLSv1.2","611","Application Data"
"7.775332","54.38.73.16","172.18.0.2","TLSv1.2","7308","Application Data"
"7.775390","172.18.0.2","54.38.73.16","TCP","68","36876 → 21002 [ACK] Seq=16175 Ack=228815 Win=5564 Len=0 TSval=1077144280 TSecr=2673435206"
"7.798188","54.38.73.16","172.18.0.2","TLSv1.2","1516","Application Data [TCP segment of a reassembled PDU]"
"7.800406","54.38.73.16","172.18.0.2","TLSv1.2","7973","Application Data, Application Data, Application Data"
"7.800450","172.18.0.2","54.38.73.16","TCP","68","36876 → 21002 [ACK] Seq=16175 Ack=238168 Win=5568 Len=0 TSval=1077144305 TSecr=2673435220"
"7.825104","54.38.73.16","172.18.0.2","TLSv1.2","9950","Application Data, Application Data, Application Data, Application Data"
"7.825292","172.18.0.2","54.38.73.16","TCP","68","36876 → 21002 [ACK] Seq=16175 Ack=248050 Win=5549 Len=0 TSval=1077144330 TSecr=2673435227"
"7.825713","172.18.0.2","54.38.73.16","TLSv1.2","611","Application Data"
"7.850986","54.38.73.16","172.18.0.2","TCP","68","[TCP Previous segment not captured] 21002 → 36876 [ACK] Seq=257932 Ack=16718 Win=1452 Len=0 TSval=2673435233 TSecr=1077144330"
"7.851054","172.18.0.2","54.38.73.16","TLSv1.2","611","Application Data"
"7.851012","54.38.73.16","172.18.0.2","TCP","9950","[TCP Retransmission] 21002 → 36876 [PSH, ACK] Seq=248050 Ack=16175 Win=1452 Len=9882 TSval=2673435233 TSecr=1077144330"
"7.851232","172.18.0.2","54.38.73.16","TCP","68","36876 → 21002 [ACK] Seq=17261 Ack=257932 Win=5559 Len=0 TSval=1077144355 TSecr=2673435233"
"7.876448","54.38.73.16","172.18.0.2","TCP","68","21002 → 36876 [ACK] Seq=257932 Ack=17261 Win=1452 Len=0 TSval=2673435239 TSecr=1077144355"
"7.876510","54.38.73.16","172.18.0.2","TLSv1.2","9950","Application Data, Application Data, Application Data, Application Data"
"7.876557","172.18.0.2","54.38.73.16","TCP","68","36876 → 21002 [ACK] Seq=17261 Ack=267814 Win=5559 Len=0 TSval=1077144381 TSecr=2673435239"
"7.902744","54.38.73.16","172.18.0.2","TLSv1.2","9950","Application Data, Application Data, Application Data, Application Data"
"7.902938","172.18.0.2","54.38.73.16","TCP","68","36876 → 21002 [ACK] Seq=17261 Ack=277696 Win=5549 Len=0 TSval=1077144407 TSecr=2673435246"
"7.903757","172.18.0.2","54.38.73.16","TLSv1.2","611","Application Data"
"7.928375","54.38.73.16","172.18.0.2","TLSv1.2","9950","Application Data, Application Data, Application Data, Application Data"
"7.928412","172.18.0.2","54.38.73.16","TCP","68","36876 → 21002 [ACK] Seq=17804 Ack=287578 Win=5549 Len=0 TSval=1077144433 TSecr=2673435252"
"7.952981","54.38.73.16","172.18.0.2","TLSv1.2","2667","Application Data"
"7.953041","172.18.0.2","54.38.73.16","TCP","68","36876 → 21002 [ACK] Seq=17804 Ack=290177 Win=5596 Len=0 TSval=1077144457 TSecr=2673435258"
"7.963781","172.18.0.2","54.38.73.16","TLSv1.2","611","Application Data"
"8.024104","54.38.73.16","172.18.0.2","TCP","68","21002 → 36876 [ACK] Seq=290177 Ack=18347 Win=1452 Len=0 TSval=2673435277 TSecr=1077144468"
"8.511804","54.38.73.16","172.18.0.2","TLSv1.2","611","Application Data"
"8.511828","54.38.73.16","172.18.0.2","TCP","611","[TCP Retransmission] 21002 → 36876 [PSH, ACK] Seq=290177 Ack=18347 Win=1452 Len=543 TSval=2673435377 TSecr=1077144468"
"8.511894","172.18.0.2","54.38.73.16","TCP","80","36876 → 21002 [ACK] Seq=18347 Ack=290720 Win=5608 Len=0 TSval=1077145016 TSecr=2673435377 SLE=290177 SRE=290720"
"8.512866","172.18.0.2","54.38.73.16","TLSv1.2","611","Application Data"
"8.536096","54.38.73.16","172.18.0.2","TCP","68","21002 → 36876 [ACK] Seq=290720 Ack=18890 Win=1452 Len=0 TSval=2673435405 TSecr=1077145017"
"8.779733","54.38.73.16","172.18.0.2","TLSv1.2","3695","Application Data"
"8.779788","172.18.0.2","54.38.73.16","TCP","68","36876 → 21002 [ACK] Seq=18890 Ack=294347 Win=5584 Len=0 TSval=1077145284 TSecr=2673435465"
"8.780304","172.18.0.2","54.38.73.16","TLSv1.2","611","Application Data"
"8.790369","54.38.73.16","172.18.0.2","TCP","2964","[TCP segment of a reassembled PDU]"
"8.790407","172.18.0.2","54.38.73.16","TCP","68","36876 → 21002 [ACK] Seq=19433 Ack=297243 Win=5595 Len=0 TSval=1077145295 TSecr=2673435468"
"8.801362","54.38.73.16","172.18.0.2","TLSv1.2","2964","Application Data [TCP segment of a reassembled PDU]"
"8.801400","172.18.0.2","54.38.73.16","TCP","68","36876 → 21002 [ACK] Seq=19433 Ack=300139 Win=5595 Len=0 TSval=1077145306 TSecr=2673435471"
"8.804064","54.38.73.16","172.18.0.2","TCP","68","21002 → 36876 [ACK] Seq=300139 Ack=19433 Win=1452 Len=0 TSval=2673435471 TSecr=1077145285"
"8.814899","54.38.73.16","172.18.0.2","TLSv1.2","2964","Application Data [TCP segment of a reassembled PDU]"
"8.814936","172.18.0.2","54.38.73.16","TCP","68","36876 → 21002 [ACK] Seq=19433 Ack=303035 Win=5595 Len=0 TSval=1077145319 TSecr=2673435474"
"8.835125","54.38.73.16","172.18.0.2","TCP","2964","21002 → 36876 [ACK] Seq=303035 Ack=19433 Win=1452 Len=2896 TSval=2673435477 TSecr=1077145306 [TCP segment of a reassembled PDU]"
"8.835164","172.18.0.2","54.38.73.16","TCP","68","36876 → 21002 [ACK] Seq=19433 Ack=305931 Win=5595 Len=0 TSval=1077145339 TSecr=2673435477"
"8.837332","54.38.73.16","172.18.0.2","TLSv1.2","1516","Application Data [TCP segment of a reassembled PDU]"
"8.837367","172.18.0.2","54.38.73.16","TCP","68","36876 → 21002 [ACK] Seq=19433 Ack=307379 Win=5593 Len=0 TSval=1077145342 TSecr=2673435480"
"8.839110","54.38.73.16","172.18.0.2","TCP","1516","21002 → 36876 [ACK] Seq=307379 Ack=19433 Win=1452 Len=1448 TSval=2673435480 TSecr=1077145319 [TCP segment of a reassembled PDU]"
"8.839145","172.18.0.2","54.38.73.16","TCP","68","36876 → 21002 [ACK] Seq=19433 Ack=308827 Win=5593 Len=0 TSval=1077145343 TSecr=2673435480"
"8.848772","54.38.73.16","172.18.0.2","TLSv1.2","1516","Application Data [TCP segment of a reassembled PDU]"
"8.848809","172.18.0.2","54.38.73.16","TCP","68","36876 → 21002 [ACK] Seq=19433 Ack=310275 Win=5593 Len=0 TSval=1077145353 TSecr=2673435483"
"8.859305","54.38.73.16","172.18.0.2","TLSv1.2","1516","Application Data [TCP segment of a reassembled PDU]"
"8.859340","172.18.0.2","54.38.73.16","TCP","68","36876 → 21002 [ACK] Seq=19433 Ack=311723 Win=5593 Len=0 TSval=1077145364 TSecr=2673435485"
"8.861481","54.38.73.16","172.18.0.2","TLSv1.2","2964","Application Data [TCP segment of a reassembled PDU]"
"8.861517","172.18.0.2","54.38.73.16","TCP","68","36876 → 21002 [ACK] Seq=19433 Ack=314619 Win=5595 Len=0 TSval=1077145366 TSecr=2673435486"
"8.870902","54.38.73.16","172.18.0.2","TCP","1516","21002 → 36876 [ACK] Seq=314619 Ack=19433 Win=1452 Len=1448 TSval=2673435488 TSecr=1077145343 [TCP segment of a reassembled PDU]"
"8.870939","172.18.0.2","54.38.73.16","TCP","68","36876 → 21002 [ACK] Seq=19433 Ack=316067 Win=5593 Len=0 TSval=1077145375 TSecr=2673435488"
"8.872754","54.38.73.16","172.18.0.2","TLSv1.2","1516","Application Data [TCP segment of a reassembled PDU]"
"8.872789","172.18.0.2","54.38.73.16","TCP","68","36876 → 21002 [ACK] Seq=19433 Ack=317515 Win=5593 Len=0 TSval=1077145377 TSecr=2673435488"
"8.873285","172.18.0.2","54.38.73.16","TLSv1.2","611","Application Data"
"8.885524","54.38.73.16","172.18.0.2","TCP","1516","21002 → 36876 [ACK] Seq=317515 Ack=19433 Win=1452 Len=1448 TSval=2673435491 TSecr=1077145364 [TCP segment of a reassembled PDU]"
"8.885539","54.38.73.16","172.18.0.2","TLSv1.2","2964","Application Data [TCP segment of a reassembled PDU]"
"8.885725","172.18.0.2","54.38.73.16","TCP","68","36876 → 21002 [ACK] Seq=19976 Ack=321859 Win=5595 Len=0 TSval=1077145390 TSecr=2673435491"
"8.895813","54.38.73.16","172.18.0.2","TLSv1.2","573","Application Data"
"8.936875","54.38.73.16","172.18.0.2","TCP","68","21002 → 36876 [ACK] Seq=322364 Ack=19976 Win=1452 Len=0 TSval=2673435505 TSecr=1077145377"
"8.936921","172.18.0.2","54.38.73.16","TLSv1.2","611","Application Data"
"9.002325","54.38.73.16","172.18.0.2","TCP","68","21002 → 36876 [ACK] Seq=322364 Ack=20519 Win=1452 Len=0 TSval=2673435521 TSecr=1077145441"
"9.156916","54.38.73.16","172.18.0.2","TLSv1.2","611","Application Data"
"9.158000","172.18.0.2","54.38.73.16","TLSv1.2","611","Application Data"
"9.221125","54.38.73.16","172.18.0.2","TCP","68","21002 → 36876 [ACK] Seq=322907 Ack=21062 Win=1452 Len=0 TSval=2673435576 TSecr=1077145662"
"9.396679","54.38.73.16","172.18.0.2","TLSv1.2","611","Application Data"
"9.417673","54.38.73.16","172.18.0.2","TCP","2964","[TCP segment of a reassembled PDU]"
"9.417859","172.18.0.2","54.38.73.16","TCP","68","36876 → 21002 [ACK] Seq=21062 Ack=326346 Win=5595 Len=0 TSval=1077145922 TSecr=2673435619"
"9.427643","54.38.73.16","172.18.0.2","TLSv1.2","4412","Application Data [TCP segment of a reassembled PDU]"
"9.427824","172.18.0.2","54.38.73.16","TCP","68","36876 → 21002 [ACK] Seq=21062 Ack=330690 Win=5579 Len=0 TSval=1077145932 TSecr=2673435627"
"9.441718","54.38.73.16","172.18.0.2","TLSv1.2","2964","Application Data [TCP segment of a reassembled PDU]"
"9.441757","172.18.0.2","54.38.73.16","TCP","68","36876 → 21002 [ACK] Seq=21062 Ack=333586 Win=5595 Len=0 TSval=1077145946 TSecr=2673435631"
"9.449669","54.38.73.16","172.18.0.2","TCP","1516","21002 → 36876 [ACK] Seq=333586 Ack=21062 Win=1452 Len=1448 TSval=2673435633 TSecr=1077145922 [TCP segment of a reassembled PDU]"
"9.451108","54.38.73.16","172.18.0.2","TLSv1.2","4412","Application Data, Application Data, Application Data"
"9.451289","172.18.0.2","54.38.73.16","TCP","68","36876 → 21002 [ACK] Seq=21062 Ack=339378 Win=5579 Len=0 TSval=1077145956 TSecr=2673435633"
"9.466162","54.38.73.16","172.18.0.2","TCP","2964","21002 → 36876 [ACK] Seq=339378 Ack=21062 Win=1452 Len=2896 TSval=2673435637 TSecr=1077145946 [TCP segment of a reassembled PDU]"
"9.466197","172.18.0.2","54.38.73.16","TCP","68","36876 → 21002 [ACK] Seq=21062 Ack=342274 Win=5595 Len=0 TSval=1077145970 TSecr=2673435637"
"9.476164","54.38.73.16","172.18.0.2","TLSv1.2","5860","Application Data, Application Data, Application Data, Application Data"
"9.476346","172.18.0.2","54.38.73.16","TCP","68","36876 → 21002 [ACK] Seq=21062 Ack=348066 Win=5580 Len=0 TSval=1077145981 TSecr=2673435639"
"9.477126","172.18.0.2","54.38.73.16","TLSv1.2","611","Application Data"
"9.490175","54.38.73.16","172.18.0.2","TLSv1.2","2964","Application Data [TCP segment of a reassembled PDU]"
"9.490210","172.18.0.2","54.38.73.16","TCP","68","36876 → 21002 [ACK] Seq=21605 Ack=350962 Win=5595 Len=0 TSval=1077145994 TSecr=2673435643"
"9.501662","54.38.73.16","172.18.0.2","TCP","68","[TCP Previous segment not captured] 21002 → 36876 [ACK] Seq=356754 Ack=21605 Win=1452 Len=0 TSval=2673435646 TSecr=1077145981"
"9.501767","172.18.0.2","54.38.73.16","TLSv1.2","611","Application Data"
"9.501687","54.38.73.16","172.18.0.2","TCP","5860","[TCP Retransmission] 21002 → 36876 [ACK] Seq=350962 Ack=21062 Win=1452 Len=5792 TSval=2673435646 TSecr=1077145981"
"9.501935","172.18.0.2","54.38.73.16","TCP","68","36876 → 21002 [ACK] Seq=22148 Ack=356754 Win=5580 Len=0 TSval=1077146006 TSecr=2673435646"
"9.516204","54.38.73.16","172.18.0.2","TLSv1.2","2964","Ignored Unknown Record"
"9.516239","172.18.0.2","54.38.73.16","TCP","68","36876 → 21002 [ACK] Seq=22148 Ack=359650 Win=5595 Len=0 TSval=1077146020 TSecr=2673435649"
"9.527246","54.38.73.16","172.18.0.2","TLSv1.2","3338","Ignored Unknown Record"
"9.527442","172.18.0.2","54.38.73.16","TCP","68","36876 → 21002 [ACK] Seq=22148 Ack=362920 Win=5612 Len=0 TSval=1077146032 TSecr=2673435652"
"9.535970","172.18.0.2","54.38.73.16","TLSv1.2","611","Application Data"
"9.596210","54.38.73.16","172.18.0.2","TCP","68","21002 → 36876 [ACK] Seq=362920 Ack=22691 Win=1452 Len=0 TSval=2673435670 TSecr=1077146040"
"9.843023","54.38.73.16","172.18.0.2","TLSv1.2","611","Application Data"
"9.844163","172.18.0.2","54.38.73.16","TLSv1.2","611","Application Data"
"9.868816","54.38.73.16","172.18.0.2","TCP","68","21002 → 36876 [ACK] Seq=363463 Ack=23234 Win=1452 Len=0 TSval=2673435738 TSecr=1077146348"
"10.060960","54.38.73.16","172.18.0.2","TLSv1.2","611","Application Data"
"10.102445","172.18.0.2","54.38.73.16","TCP","68","36876 → 21002 [ACK] Seq=23234 Ack=364006 Win=5612 Len=0 TSval=1077146607 TSecr=2673435785"
"10.133361","54.38.73.16","172.18.0.2","TLSv1.2","3695","Application Data"
"10.133416","172.18.0.2","54.38.73.16","TCP","68","36876 → 21002 [ACK] Seq=23234 Ack=367633 Win=5584 Len=0 TSval=1077146638 TSecr=2673435803"
"10.152519","54.38.73.16","172.18.0.2","TCP","2964","[TCP segment of a reassembled PDU]"
"10.152554","172.18.0.2","54.38.73.16","TCP","68","36876 → 21002 [ACK] Seq=23234 Ack=370529 Win=5595 Len=0 TSval=1077146657 TSecr=2673435808"
"10.157451","54.38.73.16","172.18.0.2","TLSv1.2","799","Application Data"
"10.157491","172.18.0.2","54.38.73.16","TCP","68","36876 → 21002 [ACK] Seq=23234 Ack=371260 Win=5593 Len=0 TSval=1077146662 TSecr=2673435810"
"10.172640","54.38.73.16","172.18.0.2","TLSv1.2","4412","Application Data"
"10.172678","172.18.0.2","54.38.73.16","TCP","68","36876 → 21002 [ACK] Seq=23234 Ack=375604 Win=5579 Len=0 TSval=1077146677 TSecr=2673435813"
"10.175969","54.38.73.16","172.18.0.2","TCP","1516","21002 → 36876 [ACK] Seq=375604 Ack=23234 Win=1452 Len=1448 TSval=2673435814 TSecr=1077146657 [TCP segment of a reassembled PDU]"
"10.176005","172.18.0.2","54.38.73.16","TCP","68","36876 → 21002 [ACK] Seq=23234 Ack=377052 Win=5593 Len=0 TSval=1077146680 TSecr=2673435814"
"10.181384","54.38.73.16","172.18.0.2","TLSv1.2","1016","Application Data"
"10.181434","172.18.0.2","54.38.73.16","TCP","68","36876 → 21002 [ACK] Seq=23234 Ack=378000 Win=5593 Len=0 TSval=1077146686 TSecr=2673435816"
"10.194270","54.38.73.16","172.18.0.2","TCP","1516","[TCP segment of a reassembled PDU]"
"10.194319","172.18.0.2","54.38.73.16","TCP","68","36876 → 21002 [ACK] Seq=23234 Ack=379448 Win=5593 Len=0 TSval=1077146699 TSecr=2673435819"
"10.197231","54.38.73.16","172.18.0.2","TLSv1.2","2964","Application Data [TCP segment of a reassembled PDU]"
"10.197268","172.18.0.2","54.38.73.16","TCP","68","36876 → 21002 [ACK] Seq=23234 Ack=382344 Win=5595 Len=0 TSval=1077146701 TSecr=2673435820"
"10.200584","54.38.73.16","172.18.0.2","TCP","2964","21002 → 36876 [ACK] Seq=382344 Ack=23234 Win=1452 Len=2896 TSval=2673435821 TSecr=1077146680 [TCP segment of a reassembled PDU]"
"10.200619","172.18.0.2","54.38.73.16","TCP","68","36876 → 21002 [ACK] Seq=23234 Ack=385240 Win=5595 Len=0 TSval=1077146705 TSecr=2673435821"
"10.214896","54.38.73.16","172.18.0.2","TLSv1.2","1516","Application Data [TCP segment of a reassembled PDU]"
"10.214931","172.18.0.2","54.38.73.16","TCP","68","36876 → 21002 [ACK] Seq=23234 Ack=386688 Win=5593 Len=0 TSval=1077146719 TSecr=2673435824"
"10.218705","54.38.73.16","172.18.0.2","TLSv1.2","1516","Application Data [TCP segment of a reassembled PDU]"
"10.218712","172.18.0.2","54.38.73.16","TCP","68","36876 → 21002 [ACK] Seq=23234 Ack=388136 Win=5593 Len=0 TSval=1077146723 TSecr=2673435825"
"10.221843","54.38.73.16","172.18.0.2","TCP","2964","21002 → 36876 [ACK] Seq=388136 Ack=23234 Win=1452 Len=2896 TSval=2673435826 TSecr=1077146701 [TCP segment of a reassembled PDU]"
"10.221850","172.18.0.2","54.38.73.16","TCP","68","36876 → 21002 [ACK] Seq=23234 Ack=391032 Win=5595 Len=0 TSval=1077146726 TSecr=2673435826"
"10.225340","54.38.73.16","172.18.0.2","TLSv1.2","2964","Application Data, Application Data"
"10.225356","172.18.0.2","54.38.73.16","TCP","68","36876 → 21002 [ACK] Seq=23234 Ack=393928 Win=5595 Len=0 TSval=1077146730 TSecr=2673435827"
"10.225557","172.18.0.2","54.38.73.16","TLSv1.2","611","Application Data"
"10.239709","54.38.73.16","172.18.0.2","TLSv1.2","2964","Application Data [TCP segment of a reassembled PDU]"
"10.239730","172.18.0.2","54.38.73.16","TCP","68","36876 → 21002 [ACK] Seq=23777 Ack=396824 Win=5595 Len=0 TSval=1077146744 TSecr=2673435830"
"10.246319","54.38.73.16","172.18.0.2","TLSv1.2","2964","Application Data, Application Data"
"10.246337","172.18.0.2","54.38.73.16","TCP","68","36876 → 21002 [ACK] Seq=23777 Ack=399720 Win=5595 Len=0 TSval=1077146751 TSecr=2673435832"
"10.250239","54.38.73.16","172.18.0.2","TLSv1.2","2964","Application Data [TCP segment of a reassembled PDU]"
"10.250258","172.18.0.2","54.38.73.16","TCP","68","36876 → 21002 [ACK] Seq=23777 Ack=402616 Win=5595 Len=0 TSval=1077146754 TSecr=2673435833"
"10.250509","54.38.73.16","172.18.0.2","TCP","68","21002 → 36876 [ACK] Seq=402616 Ack=23777 Win=1452 Len=0 TSval=2673435833 TSecr=1077146730"
"10.250534","172.18.0.2","54.38.73.16","TLSv1.2","611","Application Data"
"10.263302","54.38.73.16","172.18.0.2","TCP","2964","21002 → 36876 [ACK] Seq=402616 Ack=23777 Win=1452 Len=2896 TSval=2673435836 TSecr=1077146744 [TCP segment of a reassembled PDU]"
"10.263486","172.18.0.2","54.38.73.16","TCP","68","36876 → 21002 [ACK] Seq=24320 Ack=405512 Win=5612 Len=0 TSval=1077146768 TSecr=2673435836"
"10.271799","54.38.73.16","172.18.0.2","TLSv1.2","2964","Application Data, Application Data"
"10.271954","172.18.0.2","54.38.73.16","TCP","68","36876 → 21002 [ACK] Seq=24320 Ack=408408 Win=5595 Len=0 TSval=1077146776 TSecr=2673435838"
"10.274657","54.38.73.16","172.18.0.2","TCP","2964","21002 → 36876 [ACK] Seq=408408 Ack=23777 Win=1452 Len=2896 TSval=2673435839 TSecr=1077146754 [TCP segment of a reassembled PDU]"
"10.274695","172.18.0.2","54.38.73.16","TCP","68","36876 → 21002 [ACK] Seq=24320 Ack=411304 Win=5595 Len=0 TSval=1077146779 TSecr=2673435839"
"10.287298","54.38.73.16","172.18.0.2","TLSv1.2","2964","Application Data, Application Data"
"10.287341","172.18.0.2","54.38.73.16","TCP","68","36876 → 21002 [ACK] Seq=24320 Ack=414200 Win=5595 Len=0 TSval=1077146792 TSecr=2673435842"
"10.297147","54.38.73.16","172.18.0.2","TLSv1.2","2964","Application Data [TCP segment of a reassembled PDU]"
"10.297183","172.18.0.2","54.38.73.16","TCP","68","36876 → 21002 [ACK] Seq=24320 Ack=417096 Win=5595 Len=0 TSval=1077146801 TSecr=2673435845"
"10.297644","172.18.0.2","54.38.73.16","TLSv1.2","611","Application Data"
"10.299198","54.38.73.16","172.18.0.2","TCP","2964","21002 → 36876 [ACK] Seq=417096 Ack=24320 Win=1452 Len=2896 TSval=2673435845 TSecr=1077146779 [TCP segment of a reassembled PDU]"
"10.299238","172.18.0.2","54.38.73.16","TCP","68","36876 → 21002 [ACK] Seq=24863 Ack=419992 Win=5595 Len=0 TSval=1077146803 TSecr=2673435845"
"10.310087","54.38.73.16","172.18.0.2","TLSv1.2","1516","Application Data [TCP segment of a reassembled PDU]"
"10.311488","54.38.73.16","172.18.0.2","TLSv1.2","1516","Application Data [TCP segment of a reassembled PDU]"
"10.311661","172.18.0.2","54.38.73.16","TCP","68","36876 → 21002 [ACK] Seq=24863 Ack=422888 Win=5593 Len=0 TSval=1077146816 TSecr=2673435848"
"10.322150","54.38.73.16","172.18.0.2","TCP","1516","21002 → 36876 [ACK] Seq=422888 Ack=24320 Win=1452 Len=1448 TSval=2673435851 TSecr=1077146792 [TCP segment of a reassembled PDU]"
"10.323650","54.38.73.16","172.18.0.2","TLSv1.2","1516","Application Data [TCP segment of a reassembled PDU]"
"10.323685","172.18.0.2","54.38.73.16","TCP","68","36876 → 21002 [ACK] Seq=24863 Ack=425784 Win=5593 Len=0 TSval=1077146828 TSecr=2673435851"
"10.333964","54.38.73.16","172.18.0.2","TLSv1.2","2964","Application Data [TCP segment of a reassembled PDU]"
"10.334017","172.18.0.2","54.38.73.16","TCP","68","36876 → 21002 [ACK] Seq=24863 Ack=428680 Win=5595 Len=0 TSval=1077146838 TSecr=2673435851"
"10.333976","54.38.73.16","172.18.0.2","TCP","1516","21002 → 36876 [ACK] Seq=428680 Ack=24863 Win=1452 Len=1448 TSval=2673435853 TSecr=1077146802 [TCP segment of a reassembled PDU]"
"10.337194","54.38.73.16","172.18.0.2","TLSv1.2","1516","Application Data [TCP segment of a reassembled PDU]"
"10.337350","172.18.0.2","54.38.73.16","TCP","68","36876 → 21002 [ACK] Seq=24863 Ack=431576 Win=5593 Len=0 TSval=1077146842 TSecr=2673435853"
"10.353124","54.38.73.16","172.18.0.2","TLSv1.2","5697","Application Data, Application Data"
"10.353306","172.18.0.2","54.38.73.16","TCP","68","36876 → 21002 [ACK] Seq=24863 Ack=437205 Win=5581 Len=0 TSval=1077146858 TSecr=2673435858"
"10.363969","172.18.0.2","54.38.73.16","TLSv1.2","611","Application Data"
"10.428331","54.38.73.16","172.18.0.2","TCP","68","21002 → 36876 [ACK] Seq=437205 Ack=25406 Win=1452 Len=0 TSval=2673435878 TSecr=1077146868"
"10.764621","54.38.73.16","172.18.0.2","TLSv1.2","611","Application Data"
"10.765779","172.18.0.2","54.38.73.16","TLSv1.2","611","Application Data"
"10.789155","54.38.73.16","172.18.0.2","TCP","68","21002 → 36876 [ACK] Seq=437748 Ack=25949 Win=1452 Len=0 TSval=2673435968 TSecr=1077147270"
"11.136084","54.38.73.16","172.18.0.2","TLSv1.2","611","Application Data"
"11.156121","54.38.73.16","172.18.0.2","TLSv1.2","4412","Application Data"
"11.156323","172.18.0.2","54.38.73.16","TCP","68","36876 → 21002 [ACK] Seq=25949 Ack=442635 Win=5579 Len=0 TSval=1077147661 TSecr=2673436054"
"11.178163","54.38.73.16","172.18.0.2","TLSv1.2","5860","Application Data, Application Data"
"11.178202","172.18.0.2","54.38.73.16","TCP","68","36876 → 21002 [ACK] Seq=25949 Ack=448427 Win=5580 Len=0 TSval=1077147682 TSecr=2673436065"
"11.180664","54.38.73.16","172.18.0.2","TLSv1.2","5860","Application Data [TCP segment of a reassembled PDU]"
"11.180700","172.18.0.2","54.38.73.16","TCP","68","36876 → 21002 [ACK] Seq=25949 Ack=454219 Win=5580 Len=0 TSval=1077147685 TSecr=2673436066"
"11.181228","172.18.0.2","54.38.73.16","TLSv1.2","611","Application Data"
"11.205615","54.38.73.16","172.18.0.2","TLSv1.2","2964","Application Data [TCP segment of a reassembled PDU]"
"11.205650","172.18.0.2","54.38.73.16","TCP","68","36876 → 21002 [ACK] Seq=26492 Ack=457115 Win=5595 Len=0 TSval=1077147710 TSecr=2673436071"
"11.206009","54.38.73.16","172.18.0.2","TCP","68","[TCP Previous segment not captured] 21002 → 36876 [ACK] Seq=465280 Ack=26492 Win=1452 Len=0 TSval=2673436072 TSecr=1077147685"
"11.206031","54.38.73.16","172.18.0.2","TCP","2964","[TCP Out-Of-Order] 21002 → 36876 [ACK] Seq=457115 Ack=25949 Win=1452 Len=2896 TSval=2673436071 TSecr=1077147682"
"11.206040","54.38.73.16","172.18.0.2","TCP","5337","[TCP Retransmission] 21002 → 36876 [PSH, ACK] Seq=460011 Ack=25949 Win=1452 Len=5269 TSval=2673436072 TSecr=1077147685"
"11.206116","172.18.0.2","54.38.73.16","TCP","68","36876 → 21002 [ACK] Seq=26492 Ack=460011 Win=5573 Len=0 TSval=1077147710 TSecr=2673436071"
"11.206585","172.18.0.2","54.38.73.16","TCP","68","36876 → 21002 [ACK] Seq=26492 Ack=465280 Win=5566 Len=0 TSval=1077147711 TSecr=2673436072"
"11.207241","172.18.0.2","54.38.73.16","TLSv1.2","611","Application Data"
"11.229533","54.38.73.16","172.18.0.2","TCP","2964","[TCP segment of a reassembled PDU]"
"11.229683","172.18.0.2","54.38.73.16","TCP","68","36876 → 21002 [ACK] Seq=27035 Ack=468176 Win=5595 Len=0 TSval=1077147734 TSecr=2673436078"
"11.230472","54.38.73.16","172.18.0.2","TLSv1.2","2964","Application Data [TCP segment of a reassembled PDU]"
"11.230499","172.18.0.2","54.38.73.16","TCP","68","36876 → 21002 [ACK] Seq=27035 Ack=471072 Win=5595 Len=0 TSval=1077147735 TSecr=2673436078"
"11.231195","54.38.73.16","172.18.0.2","TLSv1.2","5700","Application Data, Application Data, Application Data"
"11.231284","172.18.0.2","54.38.73.16","TCP","68","36876 → 21002 [ACK] Seq=27035 Ack=476704 Win=5581 Len=0 TSval=1077147736 TSecr=2673436078"
"11.232795","54.38.73.16","172.18.0.2","TCP","1516","[TCP segment of a reassembled PDU]"
"11.254992","54.38.73.16","172.18.0.2","TLSv1.2","2964","Application Data [TCP segment of a reassembled PDU]"
"11.255041","172.18.0.2","54.38.73.16","TCP","68","36876 → 21002 [ACK] Seq=27035 Ack=481048 Win=5585 Len=0 TSval=1077147759 TSecr=2673436079"
"11.255005","54.38.73.16","172.18.0.2","TCP","1516","21002 → 36876 [ACK] Seq=481048 Ack=27035 Win=1452 Len=1448 TSval=2673436084 TSecr=1077147735 [TCP segment of a reassembled PDU]"
"11.255370","54.38.73.16","172.18.0.2","TLSv1.2","502","Application Data"
"11.255464","172.18.0.2","54.38.73.16","TCP","68","36876 → 21002 [ACK] Seq=27035 Ack=482930 Win=5571 Len=0 TSval=1077147760 TSecr=2673436084"
"11.264549","172.18.0.2","54.38.73.16","TLSv1.2","611","Application Data"
"11.332212","54.38.73.16","172.18.0.2","TCP","68","21002 → 36876 [ACK] Seq=482930 Ack=27578 Win=1452 Len=0 TSval=2673436103 TSecr=1077147769"
"11.583876","54.38.73.16","172.18.0.2","TLSv1.2","611","Application Data"
"11.584995","172.18.0.2","54.38.73.16","TLSv1.2","611","Application Data"
"11.609718","54.38.73.16","172.18.0.2","TCP","68","21002 → 36876 [ACK] Seq=483473 Ack=28121 Win=1452 Len=0 TSval=2673436173 TSecr=1077148089"
"11.936607","54.38.73.16","172.18.0.2","TLSv1.2","3695","Application Data"
"11.936773","172.18.0.2","54.38.73.16","TCP","68","36876 → 21002 [ACK] Seq=28121 Ack=487100 Win=5584 Len=0 TSval=1077148441 TSecr=2673436254"
"11.964913","54.38.73.16","172.18.0.2","TCP","1516","[TCP segment of a reassembled PDU]"
"11.965885","54.38.73.16","172.18.0.2","TLSv1.2","2697","Application Data"
"11.965930","172.18.0.2","54.38.73.16","TCP","68","36876 → 21002 [ACK] Seq=28121 Ack=491177 Win=5596 Len=0 TSval=1077148470 TSecr=2673436262"
"11.965896","54.38.73.16","172.18.0.2","TLSv1.2","7308","Application Data"
"11.966064","172.18.0.2","54.38.73.16","TCP","68","36876 → 21002 [ACK] Seq=28121 Ack=498417 Win=5564 Len=0 TSval=1077148470 TSecr=2673436262"
"11.987282","54.38.73.16","172.18.0.2","TLSv1.2","1516","Application Data [TCP segment of a reassembled PDU]"
"11.990901","54.38.73.16","172.18.0.2","TCP","2964","21002 → 36876 [ACK] Seq=499865 Ack=28121 Win=1452 Len=2896 TSval=2673436268 TSecr=1077148470 [TCP segment of a reassembled PDU]"
"11.990936","172.18.0.2","54.38.73.16","TCP","68","36876 → 21002 [ACK] Seq=28121 Ack=502761 Win=5595 Len=0 TSval=1077148495 TSecr=2673436267"
"11.991198","54.38.73.16","172.18.0.2","TLSv1.2","8756","Application Data, Application Data, Application Data"
"11.991297","172.18.0.2","54.38.73.16","TCP","68","36876 → 21002 [ACK] Seq=28121 Ack=511449 Win=5565 Len=0 TSval=1077148496 TSecr=2673436268"
"11.992072","172.18.0.2","54.38.73.16","TLSv1.2","611","Application Data"
"12.016140","54.38.73.16","172.18.0.2","TLSv1.2","2964","Application Data [TCP segment of a reassembled PDU]"
"12.016189","172.18.0.2","54.38.73.16","TCP","68","36876 → 21002 [ACK] Seq=28664 Ack=514345 Win=5595 Len=0 TSval=1077148520 TSecr=2673436274"
"12.016152","54.38.73.16","172.18.0.2","TLSv1.2","9636","Application Data, Application Data, Application Data, Application Data"
"12.016321","172.18.0.2","54.38.73.16","TCP","68","36876 → 21002 [ACK] Seq=28664 Ack=523913 Win=5533 Len=0 TSval=1077148521 TSecr=2673436274"
"12.016995","54.38.73.16","172.18.0.2","TCP","68","21002 → 36876 [ACK] Seq=523913 Ack=28664 Win=1452 Len=0 TSval=2673436275 TSecr=1077148496"
"12.017039","172.18.0.2","54.38.73.16","TLSv1.2","611","Application Data"
"12.020067","54.38.73.16","172.18.0.2","TCP","1516","[TCP segment of a reassembled PDU]"
"12.041355","54.38.73.16","172.18.0.2","TLSv1.2","2964","Application Data [TCP segment of a reassembled PDU]"
"12.041400","172.18.0.2","54.38.73.16","TCP","68","36876 → 21002 [ACK] Seq=29207 Ack=528257 Win=5595 Len=0 TSval=1077148546 TSecr=2673436275"
"12.041365","54.38.73.16","172.18.0.2","TLSv1.2","8756","Application Data, Application Data"
"12.041533","172.18.0.2","54.38.73.16","TCP","68","36876 → 21002 [ACK] Seq=29207 Ack=536945 Win=5549 Len=0 TSval=1077148546 TSecr=2673436280"
"12.041576","54.38.73.16","172.18.0.2","TCP","1516","21002 → 36876 [ACK] Seq=536945 Ack=29207 Win=1452 Len=1448 TSval=2673436281 TSecr=1077148521 [TCP segment of a reassembled PDU]"
"12.065602","54.38.73.16","172.18.0.2","TLSv1.2","9435","Application Data, Application Data, Application Data, Application Data"
"12.065645","172.18.0.2","54.38.73.16","TCP","68","36876 → 21002 [ACK] Seq=29207 Ack=547760 Win=5549 Len=0 TSval=1077148570 TSecr=2673436281"
"12.066177","172.18.0.2","54.38.73.16","TLSv1.2","611","Application Data"
"12.131175","54.38.73.16","172.18.0.2","TCP","68","21002 → 36876 [ACK] Seq=547760 Ack=29750 Win=1452 Len=0 TSval=2673436303 TSecr=1077148570"
"12.131216","172.18.0.2","54.38.73.16","TLSv1.2","1154","Application Data, Application Data"
"12.139166","54.38.73.16","172.18.0.2","TLSv1.2","611","Application Data"
"12.182389","172.18.0.2","54.38.73.16","TCP","68","36876 → 21002 [ACK] Seq=30836 Ack=548303 Win=5612 Len=0 TSval=1077148687 TSecr=2673436305"
"12.194072","54.38.73.16","172.18.0.2","TCP","68","21002 → 36876 [ACK] Seq=548303 Ack=30836 Win=1452 Len=0 TSval=2673436319 TSecr=1077148635"
"12.400992","54.38.73.16","172.18.0.2","TLSv1.2","611","Application Data"
"12.401065","172.18.0.2","54.38.73.16","TCP","68","36876 → 21002 [ACK] Seq=30836 Ack=548846 Win=5608 Len=0 TSval=1077148905 TSecr=2673436370"
"12.402152","172.18.0.2","54.38.73.16","TLSv1.2","611","Application Data"
"12.426410","54.38.73.16","172.18.0.2","TCP","68","21002 → 36876 [ACK] Seq=548846 Ack=31379 Win=1452 Len=0 TSval=2673436377 TSecr=1077148906"
"12.813881","54.38.73.16","172.18.0.2","TLSv1.2","1125","Application Data"
"12.814027","172.18.0.2","54.38.73.16","TCP","68","36876 → 21002 [ACK] Seq=31379 Ack=549903 Win=5604 Len=0 TSval=1077149318 TSecr=2673436460"
"12.813946","54.38.73.16","172.18.0.2","TCP","2964","[TCP segment of a reassembled PDU]"
"12.814059","172.18.0.2","54.38.73.16","TCP","68","36876 → 21002 [ACK] Seq=31379 Ack=552799 Win=5582 Len=0 TSval=1077149318 TSecr=2673436462"
"12.813955","54.38.73.16","172.18.0.2","TLSv1.2","2964","Application Data [TCP segment of a reassembled PDU]"
"12.814073","172.18.0.2","54.38.73.16","TCP","68","36876 → 21002 [ACK] Seq=31379 Ack=555695 Win=5560 Len=0 TSval=1077149318 TSecr=2673436465"
"12.813962","54.38.73.16","172.18.0.2","TLSv1.2","1516","Application Data [TCP segment of a reassembled PDU]"
"12.814092","172.18.0.2","54.38.73.16","TCP","68","36876 → 21002 [ACK] Seq=31379 Ack=557143 Win=5549 Len=0 TSval=1077149318 TSecr=2673436470"
"12.818886","54.38.73.16","172.18.0.2","TLSv1.2","2964","Application Data [TCP segment of a reassembled PDU]"
"12.818925","172.18.0.2","54.38.73.16","TCP","68","36876 → 21002 [ACK] Seq=31379 Ack=560039 Win=5595 Len=0 TSval=1077149323 TSecr=2673436475"
"12.819399","172.18.0.2","54.38.73.16","TLSv1.2","611","Application Data"
"12.837768","54.38.73.16","172.18.0.2","TLSv1.2","842","Application Data"
"12.837806","172.18.0.2","54.38.73.16","TCP","68","36876 → 21002 [ACK] Seq=31922 Ack=560813 Win=5593 Len=0 TSval=1077149342 TSecr=2673436480"
"12.842466","54.38.73.16","172.18.0.2","TCP","68","21002 → 36876 [ACK] Seq=560813 Ack=31922 Win=1452 Len=0 TSval=2673436481 TSecr=1077149324"
"12.844933","172.18.0.2","54.38.73.16","TLSv1.2","611","Application Data"
"12.868328","54.38.73.16","172.18.0.2","TCP","68","21002 → 36876 [ACK] Seq=560813 Ack=32465 Win=1452 Len=0 TSval=2673436487 TSecr=1077149349"
