_ws.col.Time,_ws.col.Source,_ws.col.Destination,_ws.col.Protocol,_ws.col.Length,_ws.col.Info
"0.000000","172.19.0.3","5.9.29.183","TLSv1.2","599","Application Data"
"0.000319","5.9.29.183","172.19.0.3","TCP","56","9002 → 43520 [ACK] Seq=1 Ack=544 Win=65535 Len=0"
"0.252308","5.9.29.183","172.19.0.3","TLSv1.2","599","Application Data"
"0.253131","172.19.0.3","5.9.29.183","TLSv1.2","2141","Application Data"
"0.253403","5.9.29.183","172.19.0.3","TCP","56","9002 → 43520 [ACK] Seq=544 Ack=2629 Win=65535 Len=0"
"0.693388","5.9.29.183","172.19.0.3","TCP","1516","[TCP segment of a reassembled PDU]"
"0.693477","5.9.29.183","172.19.0.3","TLSv1.2","167","Application Data"
"0.693605","172.19.0.3","5.9.29.183","TCP","56","43520 → 9002 [ACK] Seq=2629 Ack=2115 Win=11903 Len=0"
"0.697178","172.19.0.3","5.9.29.183","TLSv1.2","599","Application Data"
"0.697440","5.9.29.183","172.19.0.3","TCP","56","9002 → 43520 [ACK] Seq=2115 Ack=3172 Win=65535 Len=0"
"0.907207","5.9.29.183","172.19.0.3","TLSv1.2","599","Application Data"
"0.908294","172.19.0.3","5.9.29.183","TLSv1.2","599","Application Data"
"0.908699","5.9.29.183","172.19.0.3","TCP","56","9002 → 43520 [ACK] Seq=2658 Ack=3715 Win=65535 Len=0"
"1.127599","5.9.29.183","172.19.0.3","TCP","1504","[TCP segment of a reassembled PDU]"
"1.127648","5.9.29.183","172.19.0.3","TCP","1516","9002 → 43520 [PSH, ACK] Seq=4106 Ack=3715 Win=65535 Len=1460 [TCP segment of a reassembled PDU]"
"1.127656","5.9.29.183","172.19.0.3","TLSv1.2","1516","Application Data [TCP segment of a reassembled PDU]"
"1.127659","5.9.29.183","172.19.0.3","TCP","1213","9002 → 43520 [PSH, ACK] Seq=7026 Ack=3715 Win=65535 Len=1157 [TCP segment of a reassembled PDU]"
"1.127748","172.19.0.3","5.9.29.183","TCP","56","43520 → 9002 [ACK] Seq=3715 Ack=8183 Win=11887 Len=0"
"1.143512","5.9.29.183","172.19.0.3","TLSv1.2","1271","Application Data"
"1.147170","5.9.29.183","172.19.0.3","TCP","1504","[TCP segment of a reassembled PDU]"
"1.147180","172.19.0.3","5.9.29.183","TCP","56","43520 → 9002 [ACK] Seq=3715 Ack=10846 Win=11911 Len=0"
"1.159207","5.9.29.183","172.19.0.3","TLSv1.2","179","Application Data"
"1.159271","5.9.29.183","172.19.0.3","TCP","1516","[TCP segment of a reassembled PDU]"
"1.159280","5.9.29.183","172.19.0.3","TCP","1492","9002 → 43520 [PSH, ACK] Seq=12429 Ack=3715 Win=65535 Len=1436 [TCP segment of a reassembled PDU]"
"1.159327","5.9.29.183","172.19.0.3","TLSv1.2","1516","Application Data [TCP segment of a reassembled PDU]"
"1.159332","5.9.29.183","172.19.0.3","TCP","1516","9002 → 43520 [PSH, ACK] Seq=15325 Ack=3715 Win=65535 Len=1460 [TCP segment of a reassembled PDU]"
"1.159335","5.9.29.183","172.19.0.3","TCP","1516","9002 → 43520 [PSH, ACK] Seq=16785 Ack=3715 Win=65535 Len=1460 [TCP segment of a reassembled PDU]"
"1.159341","5.9.29.183","172.19.0.3","TLSv1.2","1516","Application Data [TCP segment of a reassembled PDU]"
"1.159344","5.9.29.183","172.19.0.3","TCP","1456","9002 → 43520 [PSH, ACK] Seq=19705 Ack=3715 Win=65535 Len=1400 [TCP segment of a reassembled PDU]"
"1.159414","172.19.0.3","5.9.29.183","TCP","56","43520 → 9002 [ACK] Seq=3715 Ack=21105 Win=11853 Len=0"
"1.174644","5.9.29.183","172.19.0.3","TCP","1516","9002 → 43520 [PSH, ACK] Seq=21105 Ack=3715 Win=65535 Len=1460 [TCP segment of a reassembled PDU]"
"1.174702","5.9.29.183","172.19.0.3","TLSv1.2","369","Application Data"
"1.174725","172.19.0.3","5.9.29.183","TCP","56","43520 → 9002 [ACK] Seq=3715 Ack=22878 Win=11903 Len=0"
"1.174934","5.9.29.183","172.19.0.3","TCP","1516","[TCP segment of a reassembled PDU]"
"1.174940","5.9.29.183","172.19.0.3","TCP","1516","9002 → 43520 [PSH, ACK] Seq=24338 Ack=3715 Win=65535 Len=1460 [TCP segment of a reassembled PDU]"
"1.174946","172.19.0.3","5.9.29.183","TCP","56","43520 → 9002 [ACK] Seq=3715 Ack=25798 Win=11903 Len=0"
"1.174948","5.9.29.183","172.19.0.3","TLSv1.2","1516","Application Data [TCP segment of a reassembled PDU]"
"1.175030","5.9.29.183","172.19.0.3","TLSv1.2","1516","Application Data [TCP segment of a reassembled PDU]"
"1.175037","5.9.29.183","172.19.0.3","TCP","1516","9002 → 43520 [PSH, ACK] Seq=28718 Ack=3715 Win=65535 Len=1460 [TCP segment of a reassembled PDU]"
"1.175042","5.9.29.183","172.19.0.3","TCP","1444","9002 → 43520 [PSH, ACK] Seq=30178 Ack=3715 Win=65535 Len=1388 [TCP segment of a reassembled PDU]"
"1.175077","172.19.0.3","5.9.29.183","TCP","56","43520 → 9002 [ACK] Seq=3715 Ack=31566 Win=11871 Len=0"
"1.179024","5.9.29.183","172.19.0.3","TLSv1.2","1504","Application Data, Application Data"
"1.179543","172.19.0.3","5.9.29.183","TLSv1.2","599","Application Data"
"1.179801","5.9.29.183","172.19.0.3","TCP","56","9002 → 43520 [ACK] Seq=33014 Ack=4258 Win=65535 Len=0"
"1.190166","5.9.29.183","172.19.0.3","TCP","1516","9002 → 43520 [PSH, ACK] Seq=33014 Ack=4258 Win=65535 Len=1460 [TCP segment of a reassembled PDU]"
"1.190233","5.9.29.183","172.19.0.3","TCP","1516","9002 → 43520 [PSH, ACK] Seq=34474 Ack=4258 Win=65535 Len=1460 [TCP segment of a reassembled PDU]"
"1.190245","5.9.29.183","172.19.0.3","TLSv1.2","538","Application Data, Application Data"
"1.190382","172.19.0.3","5.9.29.183","TCP","56","43520 → 9002 [ACK] Seq=4258 Ack=36416 Win=11895 Len=0"
"1.191182","5.9.29.183","172.19.0.3","TCP","1516","[TCP segment of a reassembled PDU]"
"1.191287","5.9.29.183","172.19.0.3","TCP","1492","9002 → 43520 [PSH, ACK] Seq=37876 Ack=4258 Win=65535 Len=1436 [TCP segment of a reassembled PDU]"
"1.191301","172.19.0.3","5.9.29.183","TCP","56","43520 → 9002 [ACK] Seq=4258 Ack=39312 Win=11903 Len=0"
"1.191305","5.9.29.183","172.19.0.3","TLSv1.2","1516","Application Data [TCP segment of a reassembled PDU]"
"1.191313","5.9.29.183","172.19.0.3","TCP","1007","9002 → 43520 [PSH, ACK] Seq=40772 Ack=4258 Win=65535 Len=951 [TCP segment of a reassembled PDU]"
"1.191334","172.19.0.3","5.9.29.183","TCP","56","43520 → 9002 [ACK] Seq=4258 Ack=41723 Win=11887 Len=0"
"1.191484","5.9.29.183","172.19.0.3","TCP","1516","9002 → 43520 [PSH, ACK] Seq=41723 Ack=4258 Win=65535 Len=1460 [TCP segment of a reassembled PDU]"
"1.191493","5.9.29.183","172.19.0.3","TLSv1.2","1516","Application Data [TCP segment of a reassembled PDU]"
"1.191530","172.19.0.3","5.9.29.183","TCP","56","43520 → 9002 [ACK] Seq=4258 Ack=44643 Win=11903 Len=0"
"1.191534","5.9.29.183","172.19.0.3","TCP","1516","9002 → 43520 [PSH, ACK] Seq=44643 Ack=4258 Win=65535 Len=1460 [TCP segment of a reassembled PDU]"
"1.191538","5.9.29.183","172.19.0.3","TCP","505","9002 → 43520 [PSH, ACK] Seq=46103 Ack=4258 Win=65535 Len=449 [TCP segment of a reassembled PDU]"
"1.191541","5.9.29.183","172.19.0.3","TCP","1516","9002 → 43520 [PSH, ACK] Seq=46552 Ack=4258 Win=65535 Len=1460 [TCP segment of a reassembled PDU]"
"1.191544","5.9.29.183","172.19.0.3","TLSv1.2","1516","Application Data [TCP segment of a reassembled PDU]"
"1.191546","5.9.29.183","172.19.0.3","TCP","1480","9002 → 43520 [PSH, ACK] Seq=49472 Ack=4258 Win=65535 Len=1424 [TCP segment of a reassembled PDU]"
"1.191561","172.19.0.3","5.9.29.183","TCP","56","43520 → 9002 [ACK] Seq=4258 Ack=50896 Win=11861 Len=0"
"1.191720","172.19.0.3","5.9.29.183","TLSv1.2","599","Application Data"
"1.191904","5.9.29.183","172.19.0.3","TCP","56","9002 → 43520 [ACK] Seq=50896 Ack=4801 Win=65535 Len=0"
"1.205268","5.9.29.183","172.19.0.3","TLSv1.2","1112","Application Data"
"1.209325","172.19.0.3","5.9.29.183","TLSv1.2","599","Application Data"
"1.209582","5.9.29.183","172.19.0.3","TCP","56","9002 → 43520 [ACK] Seq=51952 Ack=5344 Win=65535 Len=0"
"1.434571","5.9.29.183","172.19.0.3","TLSv1.2","599","Application Data"
"1.435645","172.19.0.3","5.9.29.183","TLSv1.2","599","Application Data"
"1.435942","5.9.29.183","172.19.0.3","TCP","56","9002 → 43520 [ACK] Seq=52495 Ack=5887 Win=65535 Len=0"
"1.654309","5.9.29.183","172.19.0.3","TLSv1.2","599","Application Data"
"1.662210","5.9.29.183","172.19.0.3","TCP","1516","[TCP segment of a reassembled PDU]"
"1.662281","172.19.0.3","5.9.29.183","TCP","56","43520 → 9002 [ACK] Seq=5887 Ack=54498 Win=11911 Len=0"
"1.662339","5.9.29.183","172.19.0.3","TCP","1516","9002 → 43520 [PSH, ACK] Seq=54498 Ack=5887 Win=65535 Len=1460 [TCP segment of a reassembled PDU]"
"1.662357","5.9.29.183","172.19.0.3","TLSv1.2","1516","Application Data [TCP segment of a reassembled PDU]"
"1.662362","5.9.29.183","172.19.0.3","TCP","1516","9002 → 43520 [PSH, ACK] Seq=57418 Ack=5887 Win=65535 Len=1460 [TCP segment of a reassembled PDU]"
"1.662365","5.9.29.183","172.19.0.3","TCP","1456","9002 → 43520 [PSH, ACK] Seq=58878 Ack=5887 Win=65535 Len=1400 [TCP segment of a reassembled PDU]"
"1.662444","5.9.29.183","172.19.0.3","TLSv1.2","1504","Application Data [TCP segment of a reassembled PDU]"
"1.662511","172.19.0.3","5.9.29.183","TCP","56","43520 → 9002 [ACK] Seq=5887 Ack=61726 Win=11871 Len=0"
"1.672986","5.9.29.183","172.19.0.3","TLSv1.2","1516","Application Data [TCP segment of a reassembled PDU]"
"1.673064","5.9.29.183","172.19.0.3","TCP","1492","9002 → 43520 [PSH, ACK] Seq=63186 Ack=5887 Win=65535 Len=1436 [TCP segment of a reassembled PDU]"
"1.673088","172.19.0.3","5.9.29.183","TCP","56","43520 → 9002 [ACK] Seq=5887 Ack=64622 Win=11903 Len=0"
"1.677949","5.9.29.183","172.19.0.3","TLSv1.2","410","Application Data"
"1.683911","5.9.29.183","172.19.0.3","TCP","1504","[TCP segment of a reassembled PDU]"
"1.683931","172.19.0.3","5.9.29.183","TCP","56","43520 → 9002 [ACK] Seq=5887 Ack=66424 Win=11911 Len=0"
"1.684096","5.9.29.183","172.19.0.3","TCP","1516","9002 → 43520 [PSH, ACK] Seq=66424 Ack=5887 Win=65535 Len=1460 [TCP segment of a reassembled PDU]"
"1.684104","5.9.29.183","172.19.0.3","TLSv1.2","1516","Application Data [TCP segment of a reassembled PDU]"
"1.684107","5.9.29.183","172.19.0.3","TCP","1516","9002 → 43520 [PSH, ACK] Seq=69344 Ack=5887 Win=65535 Len=1460 [TCP segment of a reassembled PDU]"
"1.684109","5.9.29.183","172.19.0.3","TCP","1516","9002 → 43520 [PSH, ACK] Seq=70804 Ack=5887 Win=65535 Len=1460 [TCP segment of a reassembled PDU]"
"1.684119","5.9.29.183","172.19.0.3","TLSv1.2","1516","Application Data [TCP segment of a reassembled PDU]"
"1.684139","172.19.0.3","5.9.29.183","TCP","56","43520 → 9002 [ACK] Seq=5887 Ack=73724 Win=11871 Len=0"
"1.684175","5.9.29.183","172.19.0.3","TCP","1516","9002 → 43520 [PSH, ACK] Seq=73724 Ack=5887 Win=65535 Len=1460 [TCP segment of a reassembled PDU]"
"1.684260","5.9.29.183","172.19.0.3","TCP","1432","9002 → 43520 [PSH, ACK] Seq=75184 Ack=5887 Win=65535 Len=1376 [TCP segment of a reassembled PDU]"
"1.684308","5.9.29.183","172.19.0.3","TLSv1.2","1504","Application Data [TCP segment of a reassembled PDU]"
"1.684349","172.19.0.3","5.9.29.183","TCP","56","43520 → 9002 [ACK] Seq=5887 Ack=78008 Win=11847 Len=0"
"1.692754","5.9.29.183","172.19.0.3","TLSv1.2","1018","Application Data"
"1.693093","172.19.0.3","5.9.29.183","TLSv1.2","599","Application Data"
"1.693327","5.9.29.183","172.19.0.3","TCP","56","9002 → 43520 [ACK] Seq=78970 Ack=6430 Win=65535 Len=0"
"1.697491","5.9.29.183","172.19.0.3","TCP","1504","[TCP segment of a reassembled PDU]"
"1.697543","5.9.29.183","172.19.0.3","TCP","1516","9002 → 43520 [PSH, ACK] Seq=80418 Ack=6430 Win=65535 Len=1460 [TCP segment of a reassembled PDU]"
"1.697550","5.9.29.183","172.19.0.3","TLSv1.2","1516","Application Data [TCP segment of a reassembled PDU]"
"1.697553","5.9.29.183","172.19.0.3","TLSv1.2","1516","Application Data [TCP segment of a reassembled PDU]"
"1.697556","5.9.29.183","172.19.0.3","TCP","1516","9002 → 43520 [PSH, ACK] Seq=84798 Ack=6430 Win=65535 Len=1460 [TCP segment of a reassembled PDU]"
"1.697558","5.9.29.183","172.19.0.3","TCP","1456","9002 → 43520 [PSH, ACK] Seq=86258 Ack=6430 Win=65535 Len=1400 [TCP segment of a reassembled PDU]"
"1.697697","172.19.0.3","5.9.29.183","TCP","56","43520 → 9002 [ACK] Seq=6430 Ack=87658 Win=11871 Len=0"
"1.700451","5.9.29.183","172.19.0.3","TLSv1.2","1504","Application Data, Application Data"
"1.708124","5.9.29.183","172.19.0.3","TLSv1.2","859","Application Data"
"1.708148","172.19.0.3","5.9.29.183","TCP","56","43520 → 9002 [ACK] Seq=6430 Ack=89909 Win=11911 Len=0"
"1.715610","5.9.29.183","172.19.0.3","TCP","1516","[TCP segment of a reassembled PDU]"
"1.715665","5.9.29.183","172.19.0.3","TCP","1492","9002 → 43520 [PSH, ACK] Seq=91369 Ack=6430 Win=65535 Len=1436 [TCP segment of a reassembled PDU]"
"1.715791","172.19.0.3","5.9.29.183","TCP","56","43520 → 9002 [ACK] Seq=6430 Ack=92805 Win=11903 Len=0"
"1.723336","5.9.29.183","172.19.0.3","TLSv1.2","787","Application Data"
"1.727437","172.19.0.3","5.9.29.183","TLSv1.2","599","Application Data"
"1.727718","5.9.29.183","172.19.0.3","TCP","56","9002 → 43520 [ACK] Seq=93536 Ack=6973 Win=65535 Len=0"
"1.936494","5.9.29.183","172.19.0.3","TLSv1.2","599","Application Data"
"1.937319","172.19.0.3","5.9.29.183","TLSv1.2","599","Application Data"
"1.937831","5.9.29.183","172.19.0.3","TCP","56","9002 → 43520 [ACK] Seq=94079 Ack=7516 Win=65535 Len=0"
"2.149345","5.9.29.183","172.19.0.3","TCP","1504","[TCP segment of a reassembled PDU]"
"2.149564","5.9.29.183","172.19.0.3","TCP","1504","9002 → 43520 [PSH, ACK] Seq=95527 Ack=7516 Win=65535 Len=1448 [TCP segment of a reassembled PDU]"
"2.149591","172.19.0.3","5.9.29.183","TCP","56","43520 → 9002 [ACK] Seq=7516 Ack=96975 Win=11911 Len=0"
"2.149687","5.9.29.183","172.19.0.3","TLSv1.2","1516","Application Data [TCP segment of a reassembled PDU]"
"2.149779","5.9.29.183","172.19.0.3","TCP","1516","9002 → 43520 [PSH, ACK] Seq=98435 Ack=7516 Win=65535 Len=1460 [TCP segment of a reassembled PDU]"
"2.149803","5.9.29.183","172.19.0.3","TCP","1213","9002 → 43520 [PSH, ACK] Seq=99895 Ack=7516 Win=65535 Len=1157 [TCP segment of a reassembled PDU]"
"2.149821","5.9.29.183","172.19.0.3","TLSv1.2","1516","Application Data [TCP segment of a reassembled PDU]"
"2.149825","5.9.29.183","172.19.0.3","TCP","1516","9002 → 43520 [PSH, ACK] Seq=102512 Ack=7516 Win=65535 Len=1460 [TCP segment of a reassembled PDU]"
"2.149872","5.9.29.183","172.19.0.3","TCP","1516","9002 → 43520 [PSH, ACK] Seq=103972 Ack=7516 Win=65535 Len=1460 [TCP segment of a reassembled PDU]"
"2.149893","5.9.29.183","172.19.0.3","TLSv1.2","1516","Application Data [TCP segment of a reassembled PDU]"
"2.149909","5.9.29.183","172.19.0.3","TCP","423","9002 → 43520 [PSH, ACK] Seq=106892 Ack=7516 Win=65535 Len=367 [TCP segment of a reassembled PDU]"
"2.149988","172.19.0.3","5.9.29.183","TLSv1.2","599","Application Data"
"2.149999","5.9.29.183","172.19.0.3","TCP","1516","9002 → 43520 [PSH, ACK] Seq=107259 Ack=7516 Win=65535 Len=1460 [TCP segment of a reassembled PDU]"
"2.150002","5.9.29.183","172.19.0.3","TCP","1077","9002 → 43520 [PSH, ACK] Seq=108719 Ack=7516 Win=65535 Len=1021 [TCP segment of a reassembled PDU]"
"2.150058","172.19.0.3","5.9.29.183","TCP","56","43520 → 9002 [ACK] Seq=8059 Ack=109740 Win=11836 Len=0"
"2.150170","5.9.29.183","172.19.0.3","TCP","56","9002 → 43520 [ACK] Seq=109740 Ack=8059 Win=65535 Len=0"
"2.157114","5.9.29.183","172.19.0.3","TLSv1.2","1504","Application Data, Application Data"
"2.157158","5.9.29.183","172.19.0.3","TCP","1504","9002 → 43520 [PSH, ACK] Seq=111188 Ack=8059 Win=65535 Len=1448 [TCP segment of a reassembled PDU]"
"2.157171","172.19.0.3","5.9.29.183","TCP","56","43520 → 9002 [ACK] Seq=8059 Ack=112636 Win=11903 Len=0"
"2.165720","5.9.29.183","172.19.0.3","TLSv1.2","1205","Application Data"
"2.166386","5.9.29.183","172.19.0.3","TCP","1504","[TCP segment of a reassembled PDU]"
"2.166401","172.19.0.3","5.9.29.183","TCP","56","43520 → 9002 [ACK] Seq=8059 Ack=115233 Win=11911 Len=0"
"2.166552","5.9.29.183","172.19.0.3","TCP","1516","9002 → 43520 [PSH, ACK] Seq=115233 Ack=8059 Win=65535 Len=1460 [TCP segment of a reassembled PDU]"
"2.166557","5.9.29.183","172.19.0.3","TLSv1.2","1492","Application Data [TCP segment of a reassembled PDU]"
"2.166584","172.19.0.3","5.9.29.183","TCP","56","43520 → 9002 [ACK] Seq=8059 Ack=118129 Win=11903 Len=0"
"2.166645","5.9.29.183","172.19.0.3","TCP","1516","9002 → 43520 [PSH, ACK] Seq=118129 Ack=8059 Win=65535 Len=1460 [TCP segment of a reassembled PDU]"
"2.166674","5.9.29.183","172.19.0.3","TCP","1516","9002 → 43520 [PSH, ACK] Seq=119589 Ack=8059 Win=65535 Len=1460 [TCP segment of a reassembled PDU]"
"2.166710","5.9.29.183","172.19.0.3","TLSv1.2","1516","Application Data [TCP segment of a reassembled PDU]"
"2.166716","5.9.29.183","172.19.0.3","TCP","1468","9002 → 43520 [PSH, ACK] Seq=122509 Ack=8059 Win=65535 Len=1412 [TCP segment of a reassembled PDU]"
"2.166727","172.19.0.3","5.9.29.183","TCP","56","43520 → 9002 [ACK] Seq=8059 Ack=123921 Win=11871 Len=0"
"2.166796","5.9.29.183","172.19.0.3","TCP","1516","9002 → 43520 [PSH, ACK] Seq=123921 Ack=8059 Win=65535 Len=1460 [TCP segment of a reassembled PDU]"
"2.166802","5.9.29.183","172.19.0.3","TLSv1.2","1516","Application Data [TCP segment of a reassembled PDU]"
"2.166904","5.9.29.183","172.19.0.3","TCP","1516","9002 → 43520 [PSH, ACK] Seq=126841 Ack=8059 Win=65535 Len=1460 [TCP segment of a reassembled PDU]"
"2.166911","5.9.29.183","172.19.0.3","TCP","1468","9002 → 43520 [PSH, ACK] Seq=128301 Ack=8059 Win=65535 Len=1412 [TCP segment of a reassembled PDU]"
"2.166978","172.19.0.3","5.9.29.183","TLSv1.2","599","Application Data"
"2.167325","5.9.29.183","172.19.0.3","TCP","56","9002 → 43520 [ACK] Seq=129713 Ack=8602 Win=65535 Len=0"
"2.181061","5.9.29.183","172.19.0.3","TLSv1.2","721","Application Data, Application Data"
"2.183310","5.9.29.183","172.19.0.3","TCP","1504","[TCP segment of a reassembled PDU]"
"2.183327","172.19.0.3","5.9.29.183","TCP","56","43520 → 9002 [ACK] Seq=8602 Ack=131826 Win=11911 Len=0"
"2.183381","5.9.29.183","172.19.0.3","TCP","1516","9002 → 43520 [PSH, ACK] Seq=131826 Ack=8602 Win=65535 Len=1460 [TCP segment of a reassembled PDU]"
"2.183430","5.9.29.183","172.19.0.3","TLSv1.2","1516","Application Data [TCP segment of a reassembled PDU]"
"2.183440","5.9.29.183","172.19.0.3","TLSv1.2","1516","Application Data [TCP segment of a reassembled PDU]"
"2.183445","5.9.29.183","172.19.0.3","TCP","1516","9002 → 43520 [PSH, ACK] Seq=136206 Ack=8602 Win=65535 Len=1460 [TCP segment of a reassembled PDU]"
"2.183451","5.9.29.183","172.19.0.3","TCP","1456","9002 → 43520 [PSH, ACK] Seq=137666 Ack=8602 Win=65535 Len=1400 [TCP segment of a reassembled PDU]"
"2.183456","5.9.29.183","172.19.0.3","TLSv1.2","1516","Application Data [TCP segment of a reassembled PDU]"
"2.183459","5.9.29.183","172.19.0.3","TCP","1516","9002 → 43520 [PSH, ACK] Seq=140526 Ack=8602 Win=65535 Len=1460 [TCP segment of a reassembled PDU]"
"2.183538","172.19.0.3","5.9.29.183","TCP","56","43520 → 9002 [ACK] Seq=8602 Ack=141986 Win=11855 Len=0"
"2.183550","5.9.29.183","172.19.0.3","TCP","1516","9002 → 43520 [PSH, ACK] Seq=141986 Ack=8602 Win=65535 Len=1460 [TCP segment of a reassembled PDU]"
"2.183554","5.9.29.183","172.19.0.3","TLSv1.2","1516","Application Data [TCP segment of a reassembled PDU]"
"2.183556","5.9.29.183","172.19.0.3","TCP","1516","9002 → 43520 [PSH, ACK] Seq=144906 Ack=8602 Win=65535 Len=1460 [TCP segment of a reassembled PDU]"
"2.183558","5.9.29.183","172.19.0.3","TLSv1.2","1516","Application Data [TCP segment of a reassembled PDU]"
"2.183628","172.19.0.3","5.9.29.183","TCP","56","43520 → 9002 [ACK] Seq=8602 Ack=147826 Win=11822 Len=0"
"2.183672","5.9.29.183","172.19.0.3","TCP","1432","9002 → 43520 [PSH, ACK] Seq=147826 Ack=8602 Win=65535 Len=1376 [TCP segment of a reassembled PDU]"
"2.184384","172.19.0.3","5.9.29.183","TLSv1.2","1113","Application Data"
"2.184687","5.9.29.183","172.19.0.3","TCP","56","9002 → 43520 [ACK] Seq=149202 Ack=9659 Win=65535 Len=0"
"2.196155","5.9.29.183","172.19.0.3","TLSv1.2","938","Application Data"
"2.199538","5.9.29.183","172.19.0.3","TCP","1516","[TCP segment of a reassembled PDU]"
"2.199548","172.19.0.3","5.9.29.183","TCP","56","43520 → 9002 [ACK] Seq=9659 Ack=151544 Win=11911 Len=0"
"2.199602","5.9.29.183","172.19.0.3","TCP","1516","9002 → 43520 [PSH, ACK] Seq=151544 Ack=9659 Win=65535 Len=1460 [TCP segment of a reassembled PDU]"
"2.199683","5.9.29.183","172.19.0.3","TLSv1.2","1516","Application Data [TCP segment of a reassembled PDU]"
"2.199694","172.19.0.3","5.9.29.183","TCP","56","43520 → 9002 [ACK] Seq=9659 Ack=154464 Win=11911 Len=0"
"2.199789","5.9.29.183","172.19.0.3","TCP","1516","9002 → 43520 [PSH, ACK] Seq=154464 Ack=9659 Win=65535 Len=1460 [TCP segment of a reassembled PDU]"
"2.199906","5.9.29.183","172.19.0.3","TCP","1516","9002 → 43520 [PSH, ACK] Seq=155924 Ack=9659 Win=65535 Len=1460 [TCP segment of a reassembled PDU]"
"2.199915","5.9.29.183","172.19.0.3","TLSv1.2","1444","Application Data [TCP segment of a reassembled PDU]"
"2.199919","5.9.29.183","172.19.0.3","TCP","1516","9002 → 43520 [PSH, ACK] Seq=158772 Ack=9659 Win=65535 Len=1460 [TCP segment of a reassembled PDU]"
"2.199922","5.9.29.183","172.19.0.3","TCP","1516","9002 → 43520 [PSH, ACK] Seq=160232 Ack=9659 Win=65535 Len=1460 [TCP segment of a reassembled PDU]"
"2.199925","172.19.0.3","5.9.29.183","TCP","56","43520 → 9002 [ACK] Seq=9659 Ack=157384 Win=11895 Len=0"
"2.199926","5.9.29.183","172.19.0.3","TLSv1.2","1516","Application Data [TCP segment of a reassembled PDU]"
"2.199929","5.9.29.183","172.19.0.3","TCP","1516","9002 → 43520 [PSH, ACK] Seq=163152 Ack=9659 Win=65535 Len=1460 [TCP segment of a reassembled PDU]"
"2.199943","5.9.29.183","172.19.0.3","TCP","1456","9002 → 43520 [PSH, ACK] Seq=164612 Ack=9659 Win=65535 Len=1400 [TCP segment of a reassembled PDU]"
"2.199980","172.19.0.3","5.9.29.183","TCP","56","43520 → 9002 [ACK] Seq=9659 Ack=166012 Win=11845 Len=0"
"2.205611","5.9.29.183","172.19.0.3","TLSv1.2","1504","Application Data, Application Data"
"2.205664","5.9.29.183","172.19.0.3","TCP","1516","9002 → 43520 [PSH, ACK] Seq=167460 Ack=9659 Win=65535 Len=1460 [TCP segment of a reassembled PDU]"
"2.205678","172.19.0.3","5.9.29.183","TCP","56","43520 → 9002 [ACK] Seq=9659 Ack=168920 Win=11903 Len=0"
"2.205681","5.9.29.183","172.19.0.3","TCP","1492","9002 → 43520 [PSH, ACK] Seq=168920 Ack=9659 Win=65535 Len=1436 [TCP segment of a reassembled PDU]"
"2.211571","5.9.29.183","172.19.0.3","TLSv1.2","547","Application Data, Application Data"
"2.211594","172.19.0.3","5.9.29.183","TCP","56","43520 → 9002 [ACK] Seq=9659 Ack=170847 Win=11911 Len=0"
"2.219120","5.9.29.183","172.19.0.3","TCP","1504","[TCP segment of a reassembled PDU]"
"2.226934","5.9.29.183","172.19.0.3","TCP","556","9002 → 43520 [PSH, ACK] Seq=172295 Ack=9659 Win=65535 Len=500 [TCP segment of a reassembled PDU]"
"2.226953","172.19.0.3","5.9.29.183","TCP","56","43520 → 9002 [ACK] Seq=9659 Ack=172795 Win=11911 Len=0"
"2.226990","5.9.29.183","172.19.0.3","TLSv1.2","707","Application Data"
"2.227477","172.19.0.3","5.9.29.183","TLSv1.2","599","Application Data"
"2.227667","5.9.29.183","172.19.0.3","TCP","56","9002 → 43520 [ACK] Seq=173446 Ack=10202 Win=65535 Len=0"
"2.237246","172.19.0.3","5.9.29.183","TLSv1.2","599","Application Data"
"2.237462","5.9.29.183","172.19.0.3","TCP","56","9002 → 43520 [ACK] Seq=173446 Ack=10745 Win=65535 Len=0"
"2.493667","5.9.29.183","172.19.0.3","TLSv1.2","599","Application Data"
"2.494467","172.19.0.3","5.9.29.183","TLSv1.2","599","Application Data"
"2.494706","5.9.29.183","172.19.0.3","TCP","56","9002 → 43520 [ACK] Seq=173989 Ack=11288 Win=65535 Len=0"
"2.721686","5.9.29.183","172.19.0.3","TLSv1.2","599","Application Data"
"2.753511","5.9.29.183","172.19.0.3","TCP","1504","[TCP segment of a reassembled PDU]"
"2.753533","172.19.0.3","5.9.29.183","TCP","56","43520 → 9002 [ACK] Seq=11288 Ack=175980 Win=11911 Len=0"
"2.753753","5.9.29.183","172.19.0.3","TCP","1504","9002 → 43520 [PSH, ACK] Seq=175980 Ack=11288 Win=65535 Len=1448 [TCP segment of a reassembled PDU]"
"2.753764","5.9.29.183","172.19.0.3","TLSv1.2","787","Application Data"
"2.753788","172.19.0.3","5.9.29.183","TCP","56","43520 → 9002 [ACK] Seq=11288 Ack=178159 Win=11911 Len=0"
"2.757747","172.19.0.3","5.9.29.183","TLSv1.2","599","Application Data"
"2.757966","5.9.29.183","172.19.0.3","TCP","56","9002 → 43520 [ACK] Seq=178159 Ack=11831 Win=65535 Len=0"
"2.972009","5.9.29.183","172.19.0.3","TLSv1.2","599","Application Data"
"2.972858","172.19.0.3","5.9.29.183","TLSv1.2","599","Application Data"
"2.973110","5.9.29.183","172.19.0.3","TCP","56","9002 → 43520 [ACK] Seq=178702 Ack=12374 Win=65535 Len=0"
"3.203316","5.9.29.183","172.19.0.3","TCP","1504","[TCP segment of a reassembled PDU]"
"3.203606","5.9.29.183","172.19.0.3","TCP","1516","9002 → 43520 [PSH, ACK] Seq=180150 Ack=12374 Win=65535 Len=1460 [TCP segment of a reassembled PDU]"
"3.203627","172.19.0.3","5.9.29.183","TCP","56","43520 → 9002 [ACK] Seq=12374 Ack=181610 Win=11911 Len=0"
"3.203697","5.9.29.183","172.19.0.3","TLSv1.2","1516","Application Data [TCP segment of a reassembled PDU]"
"3.203712","5.9.29.183","172.19.0.3","TCP","1213","9002 → 43520 [PSH, ACK] Seq=183070 Ack=12374 Win=65535 Len=1157 [TCP segment of a reassembled PDU]"
"3.203744","172.19.0.3","5.9.29.183","TCP","56","43520 → 9002 [ACK] Seq=12374 Ack=184227 Win=11893 Len=0"
"3.203837","5.9.29.183","172.19.0.3","TLSv1.2","1516","Application Data [TCP segment of a reassembled PDU]"
"3.203848","5.9.29.183","172.19.0.3","TCP","1516","9002 → 43520 [PSH, ACK] Seq=185687 Ack=12374 Win=65535 Len=1460 [TCP segment of a reassembled PDU]"
"3.203854","5.9.29.183","172.19.0.3","TCP","1516","9002 → 43520 [PSH, ACK] Seq=187147 Ack=12374 Win=65535 Len=1460 [TCP segment of a reassembled PDU]"
"3.203971","172.19.0.3","5.9.29.183","TCP","56","43520 → 9002 [ACK] Seq=12374 Ack=188607 Win=11869 Len=0"
"3.204183","5.9.29.183","172.19.0.3","TLSv1.2","1468","Application Data [TCP segment of a reassembled PDU]"
"3.219139","5.9.29.183","172.19.0.3","TLSv1.2","677","Application Data"
"3.219163","172.19.0.3","5.9.29.183","TCP","56","43520 → 9002 [ACK] Seq=12374 Ack=190640 Win=11911 Len=0"
"3.230549","5.9.29.183","172.19.0.3","TCP","1504","[TCP segment of a reassembled PDU]"
"3.230598","5.9.29.183","172.19.0.3","TCP","1504","9002 → 43520 [PSH, ACK] Seq=192088 Ack=12374 Win=65535 Len=1448 [TCP segment of a reassembled PDU]"
"3.230717","172.19.0.3","5.9.29.183","TCP","56","43520 → 9002 [ACK] Seq=12374 Ack=193536 Win=11903 Len=0"
"3.234397","5.9.29.183","172.19.0.3","TLSv1.2","1330","Application Data, Application Data"
"3.246823","172.19.0.3","5.9.29.183","TLSv1.2","599","Application Data"
"3.247284","5.9.29.183","172.19.0.3","TCP","56","9002 → 43520 [ACK] Seq=194810 Ack=12917 Win=65535 Len=0"
"3.256246","172.19.0.3","5.9.29.183","TLSv1.2","599","Application Data"
"3.256586","5.9.29.183","172.19.0.3","TCP","56","9002 → 43520 [ACK] Seq=194810 Ack=13460 Win=65535 Len=0"
"3.264607","5.9.29.183","172.19.0.3","TLSv1.2","599","Application Data"
"3.306571","172.19.0.3","5.9.29.183","TCP","56","43520 → 9002 [ACK] Seq=13460 Ack=195353 Win=11911 Len=0"
"3.449160","5.9.29.183","172.19.0.3","TLSv1.2","599","Application Data"
"3.449185","172.19.0.3","5.9.29.183","TCP","56","43520 → 9002 [ACK] Seq=13460 Ack=195896 Win=11911 Len=0"
"3.450126","172.19.0.3","5.9.29.183","TLSv1.2","599","Application Data"
"3.450431","5.9.29.183","172.19.0.3","TCP","56","9002 → 43520 [ACK] Seq=195896 Ack=14003 Win=65535 Len=0"
"3.673418","5.9.29.183","172.19.0.3","TLSv1.2","599","Application Data"
"3.688810","5.9.29.183","172.19.0.3","TCP","1504","[TCP segment of a reassembled PDU]"
"3.688831","172.19.0.3","5.9.29.183","TCP","56","43520 → 9002 [ACK] Seq=14003 Ack=197887 Win=11911 Len=0"
"3.688872","5.9.29.183","172.19.0.3","TCP","1516","9002 → 43520 [PSH, ACK] Seq=197887 Ack=14003 Win=65535 Len=1460 [TCP segment of a reassembled PDU]"
"3.688883","5.9.29.183","172.19.0.3","TLSv1.2","775","Application Data"
"3.688996","172.19.0.3","5.9.29.183","TCP","56","43520 → 9002 [ACK] Seq=14003 Ack=200066 Win=11895 Len=0"
"3.698549","5.9.29.183","172.19.0.3","TCP","1516","[TCP segment of a reassembled PDU]"
"3.698617","5.9.29.183","172.19.0.3","TCP","1516","9002 → 43520 [PSH, ACK] Seq=201526 Ack=14003 Win=65535 Len=1460 [TCP segment of a reassembled PDU]"
"3.698639","172.19.0.3","5.9.29.183","TCP","56","43520 → 9002 [ACK] Seq=14003 Ack=202986 Win=11903 Len=0"
"3.698882","5.9.29.183","172.19.0.3","TLSv1.2","1480","Application Data [TCP segment of a reassembled PDU]"
"3.698968","5.9.29.183","172.19.0.3","TCP","1516","9002 → 43520 [PSH, ACK] Seq=204410 Ack=14003 Win=65535 Len=1460 [TCP segment of a reassembled PDU]"
"3.698982","172.19.0.3","5.9.29.183","TCP","56","43520 → 9002 [ACK] Seq=14003 Ack=205870 Win=11903 Len=0"
"3.698985","5.9.29.183","172.19.0.3","TCP","1516","9002 → 43520 [PSH, ACK] Seq=205870 Ack=14003 Win=65535 Len=1460 [TCP segment of a reassembled PDU]"
"3.699062","5.9.29.183","172.19.0.3","TLSv1.2","1516","Application Data [TCP segment of a reassembled PDU]"
"3.699073","5.9.29.183","172.19.0.3","TCP","1468","9002 → 43520 [PSH, ACK] Seq=208790 Ack=14003 Win=65535 Len=1412 [TCP segment of a reassembled PDU]"
"3.699337","172.19.0.3","5.9.29.183","TLSv1.2","599","Application Data"
"3.699659","5.9.29.183","172.19.0.3","TCP","56","9002 → 43520 [ACK] Seq=210202 Ack=14546 Win=65535 Len=0"
"3.704200","5.9.29.183","172.19.0.3","TCP","1516","9002 → 43520 [PSH, ACK] Seq=210202 Ack=14546 Win=65535 Len=1460 [TCP segment of a reassembled PDU]"
"3.704294","5.9.29.183","172.19.0.3","TLSv1.2","1516","Application Data [TCP segment of a reassembled PDU]"
"3.704313","172.19.0.3","5.9.29.183","TCP","56","43520 → 9002 [ACK] Seq=14546 Ack=213122 Win=11903 Len=0"
"3.704316","5.9.29.183","172.19.0.3","TCP","1516","9002 → 43520 [PSH, ACK] Seq=213122 Ack=14546 Win=65535 Len=1460 [TCP segment of a reassembled PDU]"
"3.704391","5.9.29.183","172.19.0.3","TCP","1468","9002 → 43520 [PSH, ACK] Seq=214582 Ack=14546 Win=65535 Len=1412 [TCP segment of a reassembled PDU]"
"3.704397","5.9.29.183","172.19.0.3","TLSv1.2","178","Application Data"
"3.704450","172.19.0.3","5.9.29.183","TCP","56","43520 → 9002 [ACK] Seq=14546 Ack=216116 Win=11880 Len=0"
"3.712668","5.9.29.183","172.19.0.3","TCP","1504","[TCP segment of a reassembled PDU]"
"3.713407","5.9.29.183","172.19.0.3","TCP","1504","9002 → 43520 [PSH, ACK] Seq=217564 Ack=14546 Win=65535 Len=1448 [TCP segment of a reassembled PDU]"
"3.713451","172.19.0.3","5.9.29.183","TCP","56","43520 → 9002 [ACK] Seq=14546 Ack=219012 Win=11911 Len=0"
"3.713488","5.9.29.183","172.19.0.3","TLSv1.2","1516","Application Data [TCP segment of a reassembled PDU]"
"3.713499","5.9.29.183","172.19.0.3","TCP","1516","9002 → 43520 [PSH, ACK] Seq=220472 Ack=14546 Win=65535 Len=1460 [TCP segment of a reassembled PDU]"
"3.713576","5.9.29.183","172.19.0.3","TCP","1480","9002 → 43520 [PSH, ACK] Seq=221932 Ack=14546 Win=65535 Len=1424 [TCP segment of a reassembled PDU]"
"3.713623","172.19.0.3","5.9.29.183","TCP","56","43520 → 9002 [ACK] Seq=14546 Ack=223356 Win=11887 Len=0"
"3.713708","5.9.29.183","172.19.0.3","TLSv1.2","1516","Application Data [TCP segment of a reassembled PDU]"
"3.713714","5.9.29.183","172.19.0.3","TCP","1516","9002 → 43520 [PSH, ACK] Seq=224816 Ack=14546 Win=65535 Len=1460 [TCP segment of a reassembled PDU]"
"3.713777","5.9.29.183","172.19.0.3","TCP","1480","9002 → 43520 [PSH, ACK] Seq=226276 Ack=14546 Win=65535 Len=1424 [TCP segment of a reassembled PDU]"
"3.713796","172.19.0.3","5.9.29.183","TCP","56","43520 → 9002 [ACK] Seq=14546 Ack=227700 Win=11863 Len=0"
"3.713840","5.9.29.183","172.19.0.3","TLSv1.2","1516","Application Data [TCP segment of a reassembled PDU]"
"3.713847","5.9.29.183","172.19.0.3","TCP","1516","9002 → 43520 [PSH, ACK] Seq=229160 Ack=14546 Win=65535 Len=1460 [TCP segment of a reassembled PDU]"
"3.713893","5.9.29.183","172.19.0.3","TCP","1480","9002 → 43520 [PSH, ACK] Seq=230620 Ack=14546 Win=65535 Len=1424 [TCP segment of a reassembled PDU]"
"3.714084","172.19.0.3","5.9.29.183","TLSv1.2","599","Application Data"
"3.714307","5.9.29.183","172.19.0.3","TCP","56","9002 → 43520 [ACK] Seq=232044 Ack=15089 Win=65535 Len=0"
"3.717689","5.9.29.183","172.19.0.3","TLSv1.2","1504","Application Data, Application Data"
"3.717738","5.9.29.183","172.19.0.3","TCP","1504","9002 → 43520 [PSH, ACK] Seq=233492 Ack=15089 Win=65535 Len=1448 [TCP segment of a reassembled PDU]"
"3.717752","172.19.0.3","5.9.29.183","TCP","56","43520 → 9002 [ACK] Seq=15089 Ack=234940 Win=11901 Len=0"
"3.719843","5.9.29.183","172.19.0.3","TLSv1.2","424","Application Data"
"3.730601","5.9.29.183","172.19.0.3","TCP","1516","[TCP segment of a reassembled PDU]"
"3.730619","172.19.0.3","5.9.29.183","TCP","56","43520 → 9002 [ACK] Seq=15089 Ack=236768 Win=11911 Len=0"
"3.730655","5.9.29.183","172.19.0.3","TCP","1516","9002 → 43520 [PSH, ACK] Seq=236768 Ack=15089 Win=65535 Len=1460 [TCP segment of a reassembled PDU]"
"3.730731","5.9.29.183","172.19.0.3","TCP","159","9002 → 43520 [PSH, ACK] Seq=238228 Ack=15089 Win=65535 Len=103 [TCP segment of a reassembled PDU]"
"3.730809","172.19.0.3","5.9.29.183","TCP","56","43520 → 9002 [ACK] Seq=15089 Ack=238331 Win=11899 Len=0"
"3.730827","5.9.29.183","172.19.0.3","TLSv1.2","1516","Application Data [TCP segment of a reassembled PDU]"
"3.730830","5.9.29.183","172.19.0.3","TCP","1516","9002 → 43520 [PSH, ACK] Seq=239791 Ack=15089 Win=65535 Len=1460 [TCP segment of a reassembled PDU]"
"3.730831","5.9.29.183","172.19.0.3","TCP","1516","9002 → 43520 [PSH, ACK] Seq=241251 Ack=15089 Win=65535 Len=1460 [TCP segment of a reassembled PDU]"
"3.730872","5.9.29.183","172.19.0.3","TLSv1.2","1516","Application Data [TCP segment of a reassembled PDU]"
"3.730873","172.19.0.3","5.9.29.183","TCP","56","43520 → 9002 [ACK] Seq=15089 Ack=242711 Win=11871 Len=0"
"3.730875","5.9.29.183","172.19.0.3","TCP","1516","9002 → 43520 [PSH, ACK] Seq=244171 Ack=15089 Win=65535 Len=1460 [TCP segment of a reassembled PDU]"
"3.730916","5.9.29.183","172.19.0.3","TCP","1516","9002 → 43520 [PSH, ACK] Seq=245631 Ack=15089 Win=65535 Len=1460 [TCP segment of a reassembled PDU]"
"3.730921","5.9.29.183","172.19.0.3","TLSv1.2","1516","Application Data [TCP segment of a reassembled PDU]"
"3.731013","5.9.29.183","172.19.0.3","TCP","1516","9002 → 43520 [PSH, ACK] Seq=248551 Ack=15089 Win=65535 Len=1460 [TCP segment of a reassembled PDU]"
"3.731022","5.9.29.183","172.19.0.3","TCP","1516","9002 → 43520 [PSH, ACK] Seq=250011 Ack=15089 Win=65535 Len=1460 [TCP segment of a reassembled PDU]"
"3.731069","5.9.29.183","172.19.0.3","TLSv1.2","1516","Application Data, Application Data"
"3.731077","5.9.29.183","172.19.0.3","TCP","1516","9002 → 43520 [PSH, ACK] Seq=252931 Ack=15089 Win=65535 Len=1460 [TCP segment of a reassembled PDU]"
"3.731086","172.19.0.3","5.9.29.183","TCP","56","43520 → 9002 [ACK] Seq=15089 Ack=252931 Win=11814 Len=0"
"3.731096","5.9.29.183","172.19.0.3","TLSv1.2","1516","Application Data [TCP segment of a reassembled PDU]"
"3.731098","5.9.29.183","172.19.0.3","TCP","1233","9002 → 43520 [PSH, ACK] Seq=255851 Ack=15089 Win=65535 Len=1177 [TCP segment of a reassembled PDU]"
"3.731136","172.19.0.3","5.9.29.183","TCP","56","43520 → 9002 [ACK] Seq=15089 Ack=257028 Win=11790 Len=0"
"3.731540","172.19.0.3","5.9.29.183","TLSv1.2","599","Application Data"
"3.731692","5.9.29.183","172.19.0.3","TCP","56","9002 → 43520 [ACK] Seq=257028 Ack=15632 Win=65535 Len=0"
"3.731826","5.9.29.183","172.19.0.3","TLSv1.2","1516","Application Data [TCP segment of a reassembled PDU]"
"3.731885","5.9.29.183","172.19.0.3","TCP","1492","9002 → 43520 [PSH, ACK] Seq=258488 Ack=15632 Win=65535 Len=1436 [TCP segment of a reassembled PDU]"
"3.731894","172.19.0.3","5.9.29.183","TCP","56","43520 → 9002 [ACK] Seq=15632 Ack=259924 Win=11903 Len=0"
"3.731931","5.9.29.183","172.19.0.3","TCP","1504","9002 → 43520 [PSH, ACK] Seq=259924 Ack=15632 Win=65535 Len=1448 [TCP segment of a reassembled PDU]"
"3.738144","5.9.29.183","172.19.0.3","TLSv1.2","438","Application Data"
"3.738167","172.19.0.3","5.9.29.183","TCP","56","43520 → 9002 [ACK] Seq=15632 Ack=261754 Win=11911 Len=0"
"3.741389","172.19.0.3","5.9.29.183","TLSv1.2","599","Application Data"
"3.741692","5.9.29.183","172.19.0.3","TCP","56","9002 → 43520 [ACK] Seq=261754 Ack=16175 Win=65535 Len=0"
"3.745448","5.9.29.183","172.19.0.3","TCP","1516","[TCP segment of a reassembled PDU]"
"3.745504","5.9.29.183","172.19.0.3","TCP","1516","9002 → 43520 [PSH, ACK] Seq=263214 Ack=16175 Win=65535 Len=1460 [TCP segment of a reassembled PDU]"
"3.745515","5.9.29.183","172.19.0.3","TLSv1.2","1516","Application Data [TCP segment of a reassembled PDU]"
"3.745518","5.9.29.183","172.19.0.3","TCP","1516","9002 → 43520 [PSH, ACK] Seq=266134 Ack=16175 Win=65535 Len=1460 [TCP segment of a reassembled PDU]"
"3.745521","5.9.29.183","172.19.0.3","TCP","1516","9002 → 43520 [PSH, ACK] Seq=267594 Ack=16175 Win=65535 Len=1460 [TCP segment of a reassembled PDU]"
"3.745523","5.9.29.183","172.19.0.3","TLSv1.2","1516","Application Data [TCP segment of a reassembled PDU]"
"3.745544","5.9.29.183","172.19.0.3","TCP","1516","9002 → 43520 [PSH, ACK] Seq=270514 Ack=16175 Win=65535 Len=1460 [TCP segment of a reassembled PDU]"
"3.745547","5.9.29.183","172.19.0.3","TCP","1420","9002 → 43520 [PSH, ACK] Seq=271974 Ack=16175 Win=65535 Len=1364 [TCP segment of a reassembled PDU]"
"3.745658","172.19.0.3","5.9.29.183","TCP","56","43520 → 9002 [ACK] Seq=16175 Ack=273338 Win=11855 Len=0"
"3.753411","5.9.29.183","172.19.0.3","TLSv1.2","924","Application Data, Application Data"
"3.753764","172.19.0.3","5.9.29.183","TLSv1.2","599","Application Data"
"3.753998","5.9.29.183","172.19.0.3","TCP","56","9002 → 43520 [ACK] Seq=274206 Ack=16718 Win=65535 Len=0"
"3.770466","5.9.29.183","172.19.0.3","TCP","1516","[TCP segment of a reassembled PDU]"
"3.770534","5.9.29.183","172.19.0.3","TCP","1492","9002 → 43520 [PSH, ACK] Seq=275666 Ack=16718 Win=65535 Len=1436 [TCP segment of a reassembled PDU]"
"3.770676","172.19.0.3","5.9.29.183","TCP","56","43520 → 9002 [ACK] Seq=16718 Ack=277102 Win=11903 Len=0"
"3.773792","5.9.29.183","172.19.0.3","TLSv1.2","273","Application Data"
"3.777829","172.19.0.3","5.9.29.183","TLSv1.2","599","Application Data"
"3.778049","5.9.29.183","172.19.0.3","TCP","56","9002 → 43520 [ACK] Seq=277319 Ack=17261 Win=65535 Len=0"
"3.983780","5.9.29.183","172.19.0.3","TLSv1.2","599","Application Data"
"3.984565","172.19.0.3","5.9.29.183","TLSv1.2","599","Application Data"
"3.984827","5.9.29.183","172.19.0.3","TCP","56","9002 → 43520 [ACK] Seq=277862 Ack=17804 Win=65535 Len=0"
"4.176436","5.9.29.183","172.19.0.3","TCP","1504","[TCP segment of a reassembled PDU]"
"4.176482","5.9.29.183","172.19.0.3","TCP","1516","9002 → 43520 [PSH, ACK] Seq=279310 Ack=17804 Win=65535 Len=1460 [TCP segment of a reassembled PDU]"
"4.176492","5.9.29.183","172.19.0.3","TLSv1.2","775","Application Data"
"4.176674","172.19.0.3","5.9.29.183","TCP","56","43520 → 9002 [ACK] Seq=17804 Ack=281489 Win=11895 Len=0"
"4.185750","5.9.29.183","172.19.0.3","TCP","1516","[TCP segment of a reassembled PDU]"
"4.185797","5.9.29.183","172.19.0.3","TCP","1516","9002 → 43520 [PSH, ACK] Seq=282949 Ack=17804 Win=65535 Len=1460 [TCP segment of a reassembled PDU]"
"4.185809","172.19.0.3","5.9.29.183","TCP","56","43520 → 9002 [ACK] Seq=17804 Ack=284409 Win=11903 Len=0"
"4.185811","5.9.29.183","172.19.0.3","TLSv1.2","1516","Application Data [TCP segment of a reassembled PDU]"
"4.185814","5.9.29.183","172.19.0.3","TCP","1516","9002 → 43520 [PSH, ACK] Seq=285869 Ack=17804 Win=65535 Len=1460 [TCP segment of a reassembled PDU]"
"4.185818","5.9.29.183","172.19.0.3","TCP","1516","9002 → 43520 [PSH, ACK] Seq=287329 Ack=17804 Win=65535 Len=1460 [TCP segment of a reassembled PDU]"
"4.185820","5.9.29.183","172.19.0.3","TLSv1.2","1516","Application Data [TCP segment of a reassembled PDU]"
"4.185822","5.9.29.183","172.19.0.3","TCP","1516","9002 → 43520 [PSH, ACK] Seq=290249 Ack=17804 Win=65535 Len=1460 [TCP segment of a reassembled PDU]"
"4.185824","5.9.29.183","172.19.0.3","TCP","1420","9002 → 43520 [PSH, ACK] Seq=291709 Ack=17804 Win=65535 Len=1364 [TCP segment of a reassembled PDU]"
"4.185911","5.9.29.183","172.19.0.3","TLSv1.2","1516","Application Data [TCP segment of a reassembled PDU]"
"4.185917","5.9.29.183","172.19.0.3","TCP","1516","9002 → 43520 [PSH, ACK] Seq=294533 Ack=17804 Win=65535 Len=1460 [TCP segment of a reassembled PDU]"
"4.185922","5.9.29.183","172.19.0.3","TCP","1480","9002 → 43520 [PSH, ACK] Seq=295993 Ack=17804 Win=65535 Len=1424 [TCP segment of a reassembled PDU]"
"4.185951","172.19.0.3","5.9.29.183","TCP","56","43520 → 9002 [ACK] Seq=17804 Ack=297417 Win=11828 Len=0"
"4.192123","5.9.29.183","172.19.0.3","TLSv1.2","178","Application Data"
"4.199694","5.9.29.183","172.19.0.3","TCP","1516","[TCP segment of a reassembled PDU]"
"4.199715","172.19.0.3","5.9.29.183","TCP","56","43520 → 9002 [ACK] Seq=17804 Ack=298999 Win=11911 Len=0"
"4.199773","5.9.29.183","172.19.0.3","TCP","1516","9002 → 43520 [PSH, ACK] Seq=298999 Ack=17804 Win=65535 Len=1460 [TCP segment of a reassembled PDU]"
"4.199787","5.9.29.183","172.19.0.3","TLSv1.2","1516","Application Data [TCP segment of a reassembled PDU]"
"4.199791","5.9.29.183","172.19.0.3","TCP","1516","9002 → 43520 [PSH, ACK] Seq=301919 Ack=17804 Win=65535 Len=1460 [TCP segment of a reassembled PDU]"
"4.199795","5.9.29.183","172.19.0.3","TCP","544","9002 → 43520 [PSH, ACK] Seq=303379 Ack=17804 Win=65535 Len=488 [TCP segment of a reassembled PDU]"
"4.199905","5.9.29.183","172.19.0.3","TCP","1516","9002 → 43520 [PSH, ACK] Seq=303867 Ack=17804 Win=65535 Len=1460 [TCP segment of a reassembled PDU]"
"4.199911","5.9.29.183","172.19.0.3","TLSv1.2","1516","Application Data [TCP segment of a reassembled PDU]"
"4.199915","5.9.29.183","172.19.0.3","TCP","1516","9002 → 43520 [PSH, ACK] Seq=306787 Ack=17804 Win=65535 Len=1460 [TCP segment of a reassembled PDU]"
"4.199952","172.19.0.3","5.9.29.183","TCP","56","43520 → 9002 [ACK] Seq=17804 Ack=308247 Win=11855 Len=0"
"4.199989","5.9.29.183","172.19.0.3","TCP","1516","9002 → 43520 [PSH, ACK] Seq=308247 Ack=17804 Win=65535 Len=1460 [TCP segment of a reassembled PDU]"
"4.199995","5.9.29.183","172.19.0.3","TLSv1.2","1516","Application Data [TCP segment of a reassembled PDU]"
"4.200000","5.9.29.183","172.19.0.3","TCP","1516","9002 → 43520 [PSH, ACK] Seq=311167 Ack=17804 Win=65535 Len=1460 [TCP segment of a reassembled PDU]"
"4.200012","5.9.29.183","172.19.0.3","TCP","896","9002 → 43520 [PSH, ACK] Seq=312627 Ack=17804 Win=65535 Len=840 [TCP segment of a reassembled PDU]"
"4.200178","172.19.0.3","5.9.29.183","TCP","56","43520 → 9002 [ACK] Seq=17804 Ack=313467 Win=11820 Len=0"
"4.200411","172.19.0.3","5.9.29.183","TLSv1.2","599","Application Data"
"4.200566","5.9.29.183","172.19.0.3","TCP","56","9002 → 43520 [ACK] Seq=313467 Ack=18347 Win=65535 Len=0"
"4.203555","5.9.29.183","172.19.0.3","TLSv1.2","1504","Application Data, Application Data"
"4.203657","5.9.29.183","172.19.0.3","TCP","1504","9002 → 43520 [PSH, ACK] Seq=314915 Ack=18347 Win=65535 Len=1448 [TCP segment of a reassembled PDU]"
"4.203668","172.19.0.3","5.9.29.183","TCP","56","43520 → 9002 [ACK] Seq=18347 Ack=316363 Win=11903 Len=0"
"4.207176","5.9.29.183","172.19.0.3","TLSv1.2","424","Application Data"
"4.210422","172.19.0.3","5.9.29.183","TLSv1.2","599","Application Data"
"4.210833","5.9.29.183","172.19.0.3","TCP","56","9002 → 43520 [ACK] Seq=316731 Ack=18890 Win=65535 Len=0"
"4.222021","5.9.29.183","172.19.0.3","TCP","1516","[TCP segment of a reassembled PDU]"
"4.222087","5.9.29.183","172.19.0.3","TCP","1516","9002 → 43520 [PSH, ACK] Seq=318191 Ack=18890 Win=65535 Len=1460 [TCP segment of a reassembled PDU]"
"4.222096","5.9.29.183","172.19.0.3","TLSv1.2","1480","Application Data [TCP segment of a reassembled PDU]"
"4.222100","5.9.29.183","172.19.0.3","TCP","1516","9002 → 43520 [PSH, ACK] Seq=321075 Ack=18890 Win=65535 Len=1460 [TCP segment of a reassembled PDU]"
"4.222103","5.9.29.183","172.19.0.3","TCP","1516","9002 → 43520 [PSH, ACK] Seq=322535 Ack=18890 Win=65535 Len=1460 [TCP segment of a reassembled PDU]"
"4.222107","5.9.29.183","172.19.0.3","TLSv1.2","1516","Application Data [TCP segment of a reassembled PDU]"
"4.222146","5.9.29.183","172.19.0.3","TCP","1516","9002 → 43520 [PSH, ACK] Seq=325455 Ack=18890 Win=65535 Len=1460 [TCP segment of a reassembled PDU]"
"4.222151","5.9.29.183","172.19.0.3","TCP","1516","9002 → 43520 [PSH, ACK] Seq=326915 Ack=18890 Win=65535 Len=1460 [TCP segment of a reassembled PDU]"
"4.222154","5.9.29.183","172.19.0.3","TLSv1.2","1516","Application Data [TCP segment of a reassembled PDU]"
"4.222157","5.9.29.183","172.19.0.3","TLSv1.2","432","Application Data"
"4.222345","172.19.0.3","5.9.29.183","TCP","56","43520 → 9002 [ACK] Seq=18890 Ack=330211 Win=11838 Len=0"
"4.222921","172.19.0.3","5.9.29.183","TLSv1.2","599","Application Data"
"4.223149","5.9.29.183","172.19.0.3","TCP","56","9002 → 43520 [ACK] Seq=330211 Ack=19433 Win=65535 Len=0"
"4.234850","5.9.29.183","172.19.0.3","TCP","1516","[TCP segment of a reassembled PDU]"
"4.234902","5.9.29.183","172.19.0.3","TCP","1516","9002 → 43520 [PSH, ACK] Seq=331671 Ack=19433 Win=65535 Len=1460 [TCP segment of a reassembled PDU]"
"4.234909","5.9.29.183","172.19.0.3","TLSv1.2","1516","Application Data [TCP segment of a reassembled PDU]"
"4.234912","5.9.29.183","172.19.0.3","TCP","1516","9002 → 43520 [PSH, ACK] Seq=334591 Ack=19433 Win=65535 Len=1460 [TCP segment of a reassembled PDU]"
"4.234915","5.9.29.183","172.19.0.3","TCP","1456","9002 → 43520 [PSH, ACK] Seq=336051 Ack=19433 Win=65535 Len=1400 [TCP segment of a reassembled PDU]"
"4.234918","5.9.29.183","172.19.0.3","TLSv1.2","1516","Application Data [TCP segment of a reassembled PDU]"
"4.234937","5.9.29.183","172.19.0.3","TCP","1516","9002 → 43520 [PSH, ACK] Seq=338911 Ack=19433 Win=65535 Len=1460 [TCP segment of a reassembled PDU]"
"4.234941","5.9.29.183","172.19.0.3","TCP","1480","9002 → 43520 [PSH, ACK] Seq=340371 Ack=19433 Win=65535 Len=1424 [TCP segment of a reassembled PDU]"
"4.235024","172.19.0.3","5.9.29.183","TCP","56","43520 → 9002 [ACK] Seq=19433 Ack=341795 Win=11853 Len=0"
"4.237992","5.9.29.183","172.19.0.3","TLSv1.2","924","Application Data, Application Data"
"4.248752","5.9.29.183","172.19.0.3","TCP","1504","[TCP segment of a reassembled PDU]"
"4.248772","172.19.0.3","5.9.29.183","TCP","56","43520 → 9002 [ACK] Seq=19433 Ack=344111 Win=11911 Len=0"
"4.253614","5.9.29.183","172.19.0.3","TLSv1.2","179","Application Data"
"4.257733","172.19.0.3","5.9.29.183","TLSv1.2","599","Application Data"
"4.257996","5.9.29.183","172.19.0.3","TCP","56","9002 → 43520 [ACK] Seq=344234 Ack=19976 Win=65535 Len=0"
"4.461275","5.9.29.183","172.19.0.3","TLSv1.2","599","Application Data"
"4.462077","172.19.0.3","5.9.29.183","TLSv1.2","599","Application Data"
"4.462375","5.9.29.183","172.19.0.3","TCP","56","9002 → 43520 [ACK] Seq=344777 Ack=20519 Win=65535 Len=0"
"4.711355","5.9.29.183","172.19.0.3","TLSv1.2","599","Application Data"
"4.744018","5.9.29.183","172.19.0.3","TCP","1516","[TCP segment of a reassembled PDU]"
"4.744040","172.19.0.3","5.9.29.183","TCP","56","43520 → 9002 [ACK] Seq=20519 Ack=346780 Win=11909 Len=0"
"4.744087","5.9.29.183","172.19.0.3","TCP","1516","9002 → 43520 [PSH, ACK] Seq=346780 Ack=20519 Win=65535 Len=1460 [TCP segment of a reassembled PDU]"
"4.744163","5.9.29.183","172.19.0.3","TLSv1.2","1213","Application Data"
"4.744342","172.19.0.3","5.9.29.183","TCP","56","43520 → 9002 [ACK] Seq=20519 Ack=349397 Win=11893 Len=0"
"4.754075","172.19.0.3","5.9.29.183","TLSv1.2","599","Application Data"
"4.754592","5.9.29.183","172.19.0.3","TCP","56","9002 → 43520 [ACK] Seq=349397 Ack=21062 Win=65535 Len=0"
"4.762563","172.19.0.3","5.9.29.183","TLSv1.2","599","Application Data"
"4.762822","5.9.29.183","172.19.0.3","TCP","56","9002 → 43520 [ACK] Seq=349397 Ack=21605 Win=65535 Len=0"
"4.768027","5.9.29.183","172.19.0.3","TLSv1.2","149","Application Data"
"4.808747","172.19.0.3","5.9.29.183","TCP","56","43520 → 9002 [ACK] Seq=21605 Ack=349490 Win=11911 Len=0"
"4.983422","5.9.29.183","172.19.0.3","TLSv1.2","599","Application Data"
"4.983497","172.19.0.3","5.9.29.183","TCP","56","43520 → 9002 [ACK] Seq=21605 Ack=350033 Win=11911 Len=0"
"4.984176","172.19.0.3","5.9.29.183","TLSv1.2","599","Application Data"
"4.984447","5.9.29.183","172.19.0.3","TCP","56","9002 → 43520 [ACK] Seq=350033 Ack=22148 Win=65535 Len=0"
"5.210562","5.9.29.183","172.19.0.3","TCP","1504","[TCP segment of a reassembled PDU]"
"5.210629","5.9.29.183","172.19.0.3","TCP","1504","9002 → 43520 [PSH, ACK] Seq=351481 Ack=22148 Win=65535 Len=1448 [TCP segment of a reassembled PDU]"
"5.210638","5.9.29.183","172.19.0.3","TLSv1.2","1237","Application Data"
"5.210738","172.19.0.3","5.9.29.183","TCP","56","43520 → 9002 [ACK] Seq=22148 Ack=354110 Win=11895 Len=0"
"5.213534","5.9.29.183","172.19.0.3","TLSv1.2","1516","Application Data"
"5.213565","5.9.29.183","172.19.0.3","TCP","1492","9002 → 43520 [PSH, ACK] Seq=355570 Ack=22148 Win=65535 Len=1436 [TCP segment of a reassembled PDU]"
"5.213573","172.19.0.3","5.9.29.183","TCP","56","43520 → 9002 [ACK] Seq=22148 Ack=357006 Win=11903 Len=0"
"5.224913","5.9.29.183","172.19.0.3","TLSv1.2","1516","Application Data [TCP segment of a reassembled PDU]"
"5.225040","5.9.29.183","172.19.0.3","TCP","1492","9002 → 43520 [PSH, ACK] Seq=358466 Ack=22148 Win=65535 Len=1436 [TCP segment of a reassembled PDU]"
"5.225088","5.9.29.183","172.19.0.3","TCP","1516","9002 → 43520 [PSH, ACK] Seq=359902 Ack=22148 Win=65535 Len=1460 [TCP segment of a reassembled PDU]"
"5.225093","5.9.29.183","172.19.0.3","TLSv1.2","1516","Application Data [TCP segment of a reassembled PDU]"
"5.225098","5.9.29.183","172.19.0.3","TCP","1480","9002 → 43520 [PSH, ACK] Seq=362822 Ack=22148 Win=65535 Len=1424 [TCP segment of a reassembled PDU]"
"5.225114","172.19.0.3","5.9.29.183","TCP","56","43520 → 9002 [ACK] Seq=22148 Ack=362822 Win=11885 Len=0"
"5.225656","172.19.0.3","5.9.29.183","TLSv1.2","599","Application Data"
"5.225861","5.9.29.183","172.19.0.3","TCP","56","9002 → 43520 [ACK] Seq=364246 Ack=22691 Win=65535 Len=0"
"5.225869","5.9.29.183","172.19.0.3","TCP","1504","9002 → 43520 [PSH, ACK] Seq=364246 Ack=22691 Win=65535 Len=1448 [TCP segment of a reassembled PDU]"
"5.226017","5.9.29.183","172.19.0.3","TLSv1.2","1017","Application Data, Application Data"
"5.226024","172.19.0.3","5.9.29.183","TCP","56","43520 → 9002 [ACK] Seq=22691 Ack=366655 Win=11911 Len=0"
"5.235173","172.19.0.3","5.9.29.183","TLSv1.2","599","Application Data"
"5.235499","5.9.29.183","172.19.0.3","TCP","56","9002 → 43520 [ACK] Seq=366655 Ack=23234 Win=65535 Len=0"
"5.510650","5.9.29.183","172.19.0.3","TLSv1.2","599","Application Data"
"5.511522","172.19.0.3","5.9.29.183","TLSv1.2","599","Application Data"
"5.511823","5.9.29.183","172.19.0.3","TCP","56","9002 → 43520 [ACK] Seq=367198 Ack=23777 Win=65535 Len=0"
"5.740412","5.9.29.183","172.19.0.3","TLSv1.2","599","Application Data"
"5.783149","172.19.0.3","5.9.29.183","TCP","56","43520 → 9002 [ACK] Seq=23777 Ack=367741 Win=11911 Len=0"
"5.792807","5.9.29.183","172.19.0.3","TCP","1516","[TCP segment of a reassembled PDU]"
"5.792870","172.19.0.3","5.9.29.183","TCP","56","43520 → 9002 [ACK] Seq=23777 Ack=369201 Win=11911 Len=0"
"5.792928","5.9.29.183","172.19.0.3","TCP","258","9002 → 43520 [PSH, ACK] Seq=369201 Ack=23777 Win=65535 Len=202 [TCP segment of a reassembled PDU]"
"5.792951","172.19.0.3","5.9.29.183","TCP","56","43520 → 9002 [ACK] Seq=23777 Ack=369403 Win=11910 Len=0"
"5.792955","5.9.29.183","172.19.0.3","TCP","1516","9002 → 43520 [PSH, ACK] Seq=369403 Ack=23777 Win=65535 Len=1460 [TCP segment of a reassembled PDU]"
"5.792967","172.19.0.3","5.9.29.183","TCP","56","43520 → 9002 [ACK] Seq=23777 Ack=370863 Win=11899 Len=0"
"5.792971","5.9.29.183","172.19.0.3","TLSv1.2","1516","Application Data [TCP segment of a reassembled PDU]"
"5.792984","172.19.0.3","5.9.29.183","TCP","56","43520 → 9002 [ACK] Seq=23777 Ack=372323 Win=11888 Len=0"
"5.792986","5.9.29.183","172.19.0.3","TCP","1516","9002 → 43520 [PSH, ACK] Seq=372323 Ack=23777 Win=65535 Len=1460 [TCP segment of a reassembled PDU]"
"5.792997","172.19.0.3","5.9.29.183","TCP","56","43520 → 9002 [ACK] Seq=23777 Ack=373783 Win=11879 Len=0"
"5.793351","5.9.29.183","172.19.0.3","TCP","1516","9002 → 43520 [PSH, ACK] Seq=373783 Ack=23777 Win=65535 Len=1460 [TCP segment of a reassembled PDU]"
"5.793362","172.19.0.3","5.9.29.183","TCP","56","43520 → 9002 [ACK] Seq=23777 Ack=375243 Win=11911 Len=0"
"5.793365","5.9.29.183","172.19.0.3","TLSv1.2","1516","Application Data [TCP segment of a reassembled PDU]"
"5.793371","172.19.0.3","5.9.29.183","TCP","56","43520 → 9002 [ACK] Seq=23777 Ack=376703 Win=11903 Len=0"
"5.793373","5.9.29.183","172.19.0.3","TCP","1516","9002 → 43520 [PSH, ACK] Seq=376703 Ack=23777 Win=65535 Len=1460 [TCP segment of a reassembled PDU]"
"5.793378","172.19.0.3","5.9.29.183","TCP","56","43520 → 9002 [ACK] Seq=23777 Ack=378163 Win=11895 Len=0"
"5.793379","5.9.29.183","172.19.0.3","TCP","951","9002 → 43520 [PSH, ACK] Seq=378163 Ack=23777 Win=65535 Len=895 [TCP segment of a reassembled PDU]"
"5.793384","172.19.0.3","5.9.29.183","TCP","56","43520 → 9002 [ACK] Seq=23777 Ack=379058 Win=11889 Len=0"
"5.793385","5.9.29.183","172.19.0.3","TLSv1.2","1516","Application Data [TCP segment of a reassembled PDU]"
"5.793390","172.19.0.3","5.9.29.183","TCP","56","43520 → 9002 [ACK] Seq=23777 Ack=380518 Win=11879 Len=0"
"5.793391","5.9.29.183","172.19.0.3","TCP","1492","9002 → 43520 [PSH, ACK] Seq=380518 Ack=23777 Win=65535 Len=1436 [TCP segment of a reassembled PDU]"
"5.793398","172.19.0.3","5.9.29.183","TCP","56","43520 → 9002 [ACK] Seq=23777 Ack=381954 Win=11871 Len=0"
"5.811323","5.9.29.183","172.19.0.3","TLSv1.2","1516","Application Data [TCP segment of a reassembled PDU]"
"5.811402","172.19.0.3","5.9.29.183","TCP","56","43520 → 9002 [ACK] Seq=23777 Ack=383414 Win=11911 Len=0"
"5.811443","5.9.29.183","172.19.0.3","TCP","1516","9002 → 43520 [PSH, ACK] Seq=383414 Ack=23777 Win=65535 Len=1460 [TCP segment of a reassembled PDU]"
"5.811452","172.19.0.3","5.9.29.183","TCP","56","43520 → 9002 [ACK] Seq=23777 Ack=384874 Win=11903 Len=0"
"5.811454","5.9.29.183","172.19.0.3","TCP","1516","9002 → 43520 [PSH, ACK] Seq=384874 Ack=23777 Win=65535 Len=1460 [TCP segment of a reassembled PDU]"
"5.811459","172.19.0.3","5.9.29.183","TCP","56","43520 → 9002 [ACK] Seq=23777 Ack=386334 Win=11895 Len=0"
"5.811460","5.9.29.183","172.19.0.3","TLSv1.2","1516","Application Data [TCP segment of a reassembled PDU]"
"5.811465","172.19.0.3","5.9.29.183","TCP","56","43520 → 9002 [ACK] Seq=23777 Ack=387794 Win=11887 Len=0"
"5.811574","5.9.29.183","172.19.0.3","TCP","1516","9002 → 43520 [PSH, ACK] Seq=387794 Ack=23777 Win=65535 Len=1460 [TCP segment of a reassembled PDU]"
"5.811581","5.9.29.183","172.19.0.3","TLSv1.2","1333","Application Data"
"5.811688","172.19.0.3","5.9.29.183","TCP","56","43520 → 9002 [ACK] Seq=23777 Ack=390531 Win=11869 Len=0"
"5.833319","5.9.29.183","172.19.0.3","TCP","1504","[TCP segment of a reassembled PDU]"
"5.833632","172.19.0.3","5.9.29.183","TCP","56","43520 → 9002 [ACK] Seq=23777 Ack=391979 Win=11911 Len=0"
"5.833742","5.9.29.183","172.19.0.3","TCP","1516","9002 → 43520 [PSH, ACK] Seq=391979 Ack=23777 Win=65535 Len=1460 [TCP segment of a reassembled PDU]"
"5.833863","5.9.29.183","172.19.0.3","TLSv1.2","1225","Application Data"
"5.833879","172.19.0.3","5.9.29.183","TCP","56","43520 → 9002 [ACK] Seq=23777 Ack=394608 Win=11911 Len=0"
"5.833973","5.9.29.183","172.19.0.3","TCP","1516","[TCP segment of a reassembled PDU]"
"5.833979","5.9.29.183","172.19.0.3","TCP","1516","9002 → 43520 [PSH, ACK] Seq=396068 Ack=23777 Win=65535 Len=1460 [TCP segment of a reassembled PDU]"
"5.833982","5.9.29.183","172.19.0.3","TLSv1.2","1516","Application Data [TCP segment of a reassembled PDU]"
"5.833985","5.9.29.183","172.19.0.3","TCP","1468","9002 → 43520 [PSH, ACK] Seq=398988 Ack=23777 Win=65535 Len=1412 [TCP segment of a reassembled PDU]"
"5.834110","172.19.0.3","5.9.29.183","TLSv1.2","599","Application Data"
"5.834332","5.9.29.183","172.19.0.3","TCP","56","9002 → 43520 [ACK] Seq=400400 Ack=24320 Win=65535 Len=0"
"5.837154","5.9.29.183","172.19.0.3","TLSv1.2","1504","Application Data [TCP segment of a reassembled PDU]"
"5.848442","5.9.29.183","172.19.0.3","TLSv1.2","677","Application Data"
"5.848465","172.19.0.3","5.9.29.183","TCP","56","43520 → 9002 [ACK] Seq=24320 Ack=402469 Win=11911 Len=0"
"5.854470","5.9.29.183","172.19.0.3","TCP","1516","[TCP segment of a reassembled PDU]"
"5.854554","5.9.29.183","172.19.0.3","TCP","1516","9002 → 43520 [PSH, ACK] Seq=403929 Ack=24320 Win=65535 Len=1460 [TCP segment of a reassembled PDU]"
"5.854562","5.9.29.183","172.19.0.3","TLSv1.2","1516","Application Data [TCP segment of a reassembled PDU]"
"5.854565","5.9.29.183","172.19.0.3","TCP","1468","9002 → 43520 [PSH, ACK] Seq=406849 Ack=24320 Win=65535 Len=1412 [TCP segment of a reassembled PDU]"
"5.854585","5.9.29.183","172.19.0.3","TCP","1516","9002 → 43520 [PSH, ACK] Seq=408261 Ack=24320 Win=65535 Len=1460 [TCP segment of a reassembled PDU]"
"5.854676","5.9.29.183","172.19.0.3","TLSv1.2","1516","Application Data [TCP segment of a reassembled PDU]"
"5.854706","5.9.29.183","172.19.0.3","TCP","1516","9002 → 43520 [PSH, ACK] Seq=411181 Ack=24320 Win=65535 Len=1460 [TCP segment of a reassembled PDU]"
"5.854712","5.9.29.183","172.19.0.3","TCP","1516","9002 → 43520 [PSH, ACK] Seq=412641 Ack=24320 Win=65535 Len=1460 [TCP segment of a reassembled PDU]"
"5.854822","172.19.0.3","5.9.29.183","TCP","56","43520 → 9002 [ACK] Seq=24320 Ack=414101 Win=11855 Len=0"
"5.854887","5.9.29.183","172.19.0.3","TLSv1.2","1516","Application Data [TCP segment of a reassembled PDU]"
"5.854955","5.9.29.183","172.19.0.3","TCP","1516","9002 → 43520 [PSH, ACK] Seq=415561 Ack=24320 Win=65535 Len=1460 [TCP segment of a reassembled PDU]"
"5.854964","5.9.29.183","172.19.0.3","TCP","1432","9002 → 43520 [PSH, ACK] Seq=417021 Ack=24320 Win=65535 Len=1376 [TCP segment of a reassembled PDU]"
"5.855114","172.19.0.3","5.9.29.183","TCP","56","43520 → 9002 [ACK] Seq=24320 Ack=418397 Win=11828 Len=0"
"5.855710","172.19.0.3","5.9.29.183","TLSv1.2","599","Application Data"
"5.855935","5.9.29.183","172.19.0.3","TCP","56","9002 → 43520 [ACK] Seq=418397 Ack=24863 Win=65535 Len=0"
"5.863567","5.9.29.183","172.19.0.3","TLSv1.2","721","Application Data, Application Data"
"5.865503","172.19.0.3","5.9.29.183","TLSv1.2","599","Application Data"
"5.865812","5.9.29.183","172.19.0.3","TCP","56","9002 → 43520 [ACK] Seq=419062 Ack=25406 Win=65535 Len=0"
"5.885292","5.9.29.183","172.19.0.3","TCP","1516","[TCP segment of a reassembled PDU]"
"5.885337","5.9.29.183","172.19.0.3","TLSv1.2","681","Application Data"
"5.885456","172.19.0.3","5.9.29.183","TCP","56","43520 → 9002 [ACK] Seq=25406 Ack=421147 Win=11903 Len=0"
"5.888927","172.19.0.3","5.9.29.183","TLSv1.2","599","Application Data"
"5.889217","5.9.29.183","172.19.0.3","TCP","56","9002 → 43520 [ACK] Seq=421147 Ack=25949 Win=65535 Len=0"
"6.153304","5.9.29.183","172.19.0.3","TLSv1.2","599","Application Data"
"6.154208","172.19.0.3","5.9.29.183","TLSv1.2","599","Application Data"
"6.154500","5.9.29.183","172.19.0.3","TCP","56","9002 → 43520 [ACK] Seq=421690 Ack=26492 Win=65535 Len=0"
"6.415719","5.9.29.183","172.19.0.3","TCP","1504","[TCP segment of a reassembled PDU]"
"6.415817","5.9.29.183","172.19.0.3","TCP","1516","9002 → 43520 [PSH, ACK] Seq=423138 Ack=26492 Win=65535 Len=1460 [TCP segment of a reassembled PDU]"
"6.415830","5.9.29.183","172.19.0.3","TLSv1.2","775","Application Data"
"6.415969","172.19.0.3","5.9.29.183","TCP","56","43520 → 9002 [ACK] Seq=26492 Ack=425317 Win=11895 Len=0"
"6.427883","5.9.29.183","172.19.0.3","TCP","1516","[TCP segment of a reassembled PDU]"
"6.427938","5.9.29.183","172.19.0.3","TCP","1492","9002 → 43520 [PSH, ACK] Seq=426777 Ack=26492 Win=65535 Len=1436 [TCP segment of a reassembled PDU]"
"6.427952","172.19.0.3","5.9.29.183","TCP","56","43520 → 9002 [ACK] Seq=26492 Ack=428213 Win=11903 Len=0"
"6.427955","5.9.29.183","172.19.0.3","TLSv1.2","1516","Application Data [TCP segment of a reassembled PDU]"
"6.427958","5.9.29.183","172.19.0.3","TCP","1516","9002 → 43520 [PSH, ACK] Seq=429673 Ack=26492 Win=65535 Len=1460 [TCP segment of a reassembled PDU]"
"6.427963","5.9.29.183","172.19.0.3","TCP","1516","9002 → 43520 [PSH, ACK] Seq=431133 Ack=26492 Win=65535 Len=1460 [TCP segment of a reassembled PDU]"
"6.428028","5.9.29.183","172.19.0.3","TLSv1.2","1516","Application Data [TCP segment of a reassembled PDU]"
"6.428033","5.9.29.183","172.19.0.3","TCP","942","9002 → 43520 [PSH, ACK] Seq=434053 Ack=26492 Win=65535 Len=886 [TCP segment of a reassembled PDU]"
"6.428036","5.9.29.183","172.19.0.3","TCP","570","9002 → 43520 [PSH, ACK] Seq=434939 Ack=26492 Win=65535 Len=514 [TCP segment of a reassembled PDU]"
"6.428069","172.19.0.3","5.9.29.183","TCP","56","43520 → 9002 [ACK] Seq=26492 Ack=435453 Win=11855 Len=0"
"6.431544","5.9.29.183","172.19.0.3","TLSv1.2","1315","Application Data"
"6.457807","5.9.29.183","172.19.0.3","TCP","1504","[TCP segment of a reassembled PDU]"
"6.457864","172.19.0.3","5.9.29.183","TCP","56","43520 → 9002 [ACK] Seq=26492 Ack=438160 Win=11911 Len=0"
"6.458028","5.9.29.183","172.19.0.3","TCP","1516","9002 → 43520 [PSH, ACK] Seq=438160 Ack=26492 Win=65535 Len=1460 [TCP segment of a reassembled PDU]"
"6.458037","5.9.29.183","172.19.0.3","TLSv1.2","1225","Application Data"
"6.458039","5.9.29.183","172.19.0.3","TCP","1516","[TCP segment of a reassembled PDU]"
"6.458042","5.9.29.183","172.19.0.3","TCP","1492","9002 → 43520 [PSH, ACK] Seq=442249 Ack=26492 Win=65535 Len=1436 [TCP segment of a reassembled PDU]"
"6.458075","172.19.0.3","5.9.29.183","TCP","56","43520 → 9002 [ACK] Seq=26492 Ack=443685 Win=11877 Len=0"
"6.473145","5.9.29.183","172.19.0.3","TLSv1.2","1516","Application Data [TCP segment of a reassembled PDU]"
"6.473215","5.9.29.183","172.19.0.3","TCP","1516","9002 → 43520 [PSH, ACK] Seq=445145 Ack=26492 Win=65535 Len=1460 [TCP segment of a reassembled PDU]"
"6.473232","172.19.0.3","5.9.29.183","TCP","56","43520 → 9002 [ACK] Seq=26492 Ack=446605 Win=11903 Len=0"
"6.473235","5.9.29.183","172.19.0.3","TCP","1480","9002 → 43520 [PSH, ACK] Seq=446605 Ack=26492 Win=65535 Len=1424 [TCP segment of a reassembled PDU]"
"6.473717","5.9.29.183","172.19.0.3","TLSv1.2","1516","Application Data [TCP segment of a reassembled PDU]"
"6.473731","172.19.0.3","5.9.29.183","TCP","56","43520 → 9002 [ACK] Seq=26492 Ack=449489 Win=11911 Len=0"
"6.473899","5.9.29.183","172.19.0.3","TCP","1516","9002 → 43520 [PSH, ACK] Seq=449489 Ack=26492 Win=65535 Len=1460 [TCP segment of a reassembled PDU]"
"6.474012","5.9.29.183","172.19.0.3","TCP","1480","9002 → 43520 [PSH, ACK] Seq=450949 Ack=26492 Win=65535 Len=1424 [TCP segment of a reassembled PDU]"
"6.474019","5.9.29.183","172.19.0.3","TLSv1.2","1516","Application Data [TCP segment of a reassembled PDU]"
"6.474022","5.9.29.183","172.19.0.3","TCP","1516","9002 → 43520 [PSH, ACK] Seq=453833 Ack=26492 Win=65535 Len=1460 [TCP segment of a reassembled PDU]"
"6.474024","5.9.29.183","172.19.0.3","TLSv1.2","1516","Application Data [TCP segment of a reassembled PDU]"
"6.474026","5.9.29.183","172.19.0.3","TCP","1516","9002 → 43520 [PSH, ACK] Seq=456753 Ack=26492 Win=65535 Len=1460 [TCP segment of a reassembled PDU]"
"6.474155","172.19.0.3","5.9.29.183","TLSv1.2","599","Application Data"
"6.474162","5.9.29.183","172.19.0.3","TCP","1516","9002 → 43520 [PSH, ACK] Seq=458213 Ack=26492 Win=65535 Len=1460 [TCP segment of a reassembled PDU]"
"6.474166","5.9.29.183","172.19.0.3","TLSv1.2","1516","Application Data, Application Data"
"6.474168","5.9.29.183","172.19.0.3","TCP","1516","9002 → 43520 [PSH, ACK] Seq=461133 Ack=26492 Win=65535 Len=1460 [TCP segment of a reassembled PDU]"
"6.474267","5.9.29.183","172.19.0.3","TCP","1516","9002 → 43520 [PSH, ACK] Seq=462593 Ack=26492 Win=65535 Len=1460 [TCP segment of a reassembled PDU]"
"6.474277","5.9.29.183","172.19.0.3","TLSv1.2","1516","Application Data [TCP segment of a reassembled PDU]"
"6.474307","172.19.0.3","5.9.29.183","TCP","56","43520 → 9002 [ACK] Seq=27035 Ack=465513 Win=11822 Len=0"
"6.474367","5.9.29.183","172.19.0.3","TLSv1.2","300","Application Data"
"6.474775","5.9.29.183","172.19.0.3","TCP","56","9002 → 43520 [ACK] Seq=465757 Ack=27035 Win=65535 Len=0"
"6.488179","5.9.29.183","172.19.0.3","TLSv1.2","1504","Application Data"
"6.488200","172.19.0.3","5.9.29.183","TCP","56","43520 → 9002 [ACK] Seq=27035 Ack=467205 Win=11911 Len=0"
"6.488350","5.9.29.183","172.19.0.3","TCP","1516","9002 → 43520 [PSH, ACK] Seq=467205 Ack=27035 Win=65535 Len=1460 [TCP segment of a reassembled PDU]"
"6.488358","5.9.29.183","172.19.0.3","TCP","1516","9002 → 43520 [PSH, ACK] Seq=468665 Ack=27035 Win=65535 Len=1460 [TCP segment of a reassembled PDU]"
"6.488361","5.9.29.183","172.19.0.3","TLSv1.2","1516","Application Data [TCP segment of a reassembled PDU]"
"6.488363","5.9.29.183","172.19.0.3","TCP","1468","9002 → 43520 [PSH, ACK] Seq=471585 Ack=27035 Win=65535 Len=1412 [TCP segment of a reassembled PDU]"
"6.488380","172.19.0.3","5.9.29.183","TCP","56","43520 → 9002 [ACK] Seq=27035 Ack=472997 Win=11877 Len=0"
"6.488552","172.19.0.3","5.9.29.183","TLSv1.2","599","Application Data"
"6.488742","5.9.29.183","172.19.0.3","TCP","56","9002 → 43520 [ACK] Seq=472997 Ack=27578 Win=65535 Len=0"
"6.489872","5.9.29.183","172.19.0.3","TCP","1516","9002 → 43520 [PSH, ACK] Seq=472997 Ack=27578 Win=65535 Len=1460 [TCP segment of a reassembled PDU]"
"6.489970","5.9.29.183","172.19.0.3","TLSv1.2","1516","Application Data [TCP segment of a reassembled PDU]"
"6.489977","172.19.0.3","5.9.29.183","TCP","56","43520 → 9002 [ACK] Seq=27578 Ack=475917 Win=11903 Len=0"
"6.489979","5.9.29.183","172.19.0.3","TCP","1516","9002 → 43520 [PSH, ACK] Seq=475917 Ack=27578 Win=65535 Len=1460 [TCP segment of a reassembled PDU]"
"6.489981","5.9.29.183","172.19.0.3","TCP","1468","9002 → 43520 [PSH, ACK] Seq=477377 Ack=27578 Win=65535 Len=1412 [TCP segment of a reassembled PDU]"
"6.490020","172.19.0.3","5.9.29.183","TCP","56","43520 → 9002 [ACK] Seq=27578 Ack=478789 Win=11887 Len=0"
"6.490100","5.9.29.183","172.19.0.3","TLSv1.2","1516","Application Data [TCP segment of a reassembled PDU]"
"6.490104","5.9.29.183","172.19.0.3","TCP","1516","9002 → 43520 [PSH, ACK] Seq=480249 Ack=27578 Win=65535 Len=1460 [TCP segment of a reassembled PDU]"
"6.490107","5.9.29.183","172.19.0.3","TLSv1.2","1516","Application Data [TCP segment of a reassembled PDU]"
"6.490109","5.9.29.183","172.19.0.3","TLSv1.2","294","Application Data"
"6.490168","172.19.0.3","5.9.29.183","TCP","56","43520 → 9002 [ACK] Seq=27578 Ack=483407 Win=11855 Len=0"
"6.499015","172.19.0.3","5.9.29.183","TLSv1.2","599","Application Data"
"6.499383","5.9.29.183","172.19.0.3","TCP","56","9002 → 43520 [ACK] Seq=483407 Ack=28121 Win=65535 Len=0"
"6.505733","5.9.29.183","172.19.0.3","TLSv1.2","1113","Application Data"
"6.505847","5.9.29.183","172.19.0.3","TCP","1504","[TCP segment of a reassembled PDU]"
"6.505927","172.19.0.3","5.9.29.183","TCP","56","43520 → 9002 [ACK] Seq=28121 Ack=485912 Win=11903 Len=0"
"6.521536","5.9.29.183","172.19.0.3","TLSv1.2","179","Application Data"
"6.563201","172.19.0.3","5.9.29.183","TCP","56","43520 → 9002 [ACK] Seq=28121 Ack=486035 Win=11911 Len=0"
