_ws.col.Time,_ws.col.Source,_ws.col.Destination,_ws.col.Protocol,_ws.col.Length,_ws.col.Info
"0.000000","172.19.0.3","5.9.29.183","TLSv1.2","599","Application Data"
"0.000296","5.9.29.183","172.19.0.3","TCP","56","9002 → 43520 [ACK] Seq=1 Ack=544 Win=65535 Len=0"
"0.269322","5.9.29.183","172.19.0.3","TLSv1.2","599","Application Data"
"0.269352","172.19.0.3","5.9.29.183","TCP","56","43520 → 9002 [ACK] Seq=544 Ack=544 Win=11911 Len=0"
"0.270022","172.19.0.3","5.9.29.183","TLSv1.2","2141","Application Data"
"0.270347","5.9.29.183","172.19.0.3","TCP","56","9002 → 43520 [ACK] Seq=544 Ack=2629 Win=65535 Len=0"
"0.820622","5.9.29.183","172.19.0.3","TCP","1516","[TCP segment of a reassembled PDU]"
"0.820647","5.9.29.183","172.19.0.3","TLSv1.2","681","Application Data"
"0.820751","172.19.0.3","5.9.29.183","TCP","56","43520 → 9002 [ACK] Seq=2629 Ack=2629 Win=11903 Len=0"
"0.823834","172.19.0.3","5.9.29.183","TLSv1.2","599","Application Data"
"0.824084","5.9.29.183","172.19.0.3","TCP","56","9002 → 43520 [ACK] Seq=2629 Ack=3172 Win=65535 Len=0"
"1.109007","5.9.29.183","172.19.0.3","TLSv1.2","599","Application Data"
"1.109801","172.19.0.3","5.9.29.183","TLSv1.2","599","Application Data"
"1.110205","5.9.29.183","172.19.0.3","TCP","56","9002 → 43520 [ACK] Seq=3172 Ack=3715 Win=65535 Len=0"
"1.374756","5.9.29.183","172.19.0.3","TCP","1516","[TCP segment of a reassembled PDU]"
"1.374780","5.9.29.183","172.19.0.3","TCP","1516","9002 → 43520 [PSH, ACK] Seq=4632 Ack=3715 Win=65535 Len=1460 [TCP segment of a reassembled PDU]"
"1.374787","5.9.29.183","172.19.0.3","TLSv1.2","763","Application Data"
"1.374893","172.19.0.3","5.9.29.183","TCP","56","43520 → 9002 [ACK] Seq=3715 Ack=6799 Win=11895 Len=0"
"1.386341","5.9.29.183","172.19.0.3","TCP","1516","[TCP segment of a reassembled PDU]"
"1.386368","5.9.29.183","172.19.0.3","TCP","1492","9002 → 43520 [PSH, ACK] Seq=8259 Ack=3715 Win=65535 Len=1436 [TCP segment of a reassembled PDU]"
"1.386386","172.19.0.3","5.9.29.183","TCP","56","43520 → 9002 [ACK] Seq=3715 Ack=9695 Win=11901 Len=0"
"1.386390","5.9.29.183","172.19.0.3","TLSv1.2","1516","Application Data [TCP segment of a reassembled PDU]"
"1.386396","5.9.29.183","172.19.0.3","TCP","1516","9002 → 43520 [PSH, ACK] Seq=11155 Ack=3715 Win=65535 Len=1460 [TCP segment of a reassembled PDU]"
"1.386590","5.9.29.183","172.19.0.3","TCP","1516","9002 → 43520 [PSH, ACK] Seq=12615 Ack=3715 Win=65535 Len=1460 [TCP segment of a reassembled PDU]"
"1.386601","5.9.29.183","172.19.0.3","TLSv1.2","1468","Application Data [TCP segment of a reassembled PDU]"
"1.386624","5.9.29.183","172.19.0.3","TCP","1504","9002 → 43520 [PSH, ACK] Seq=15487 Ack=3715 Win=65535 Len=1448 [TCP segment of a reassembled PDU]"
"1.386734","172.19.0.3","5.9.29.183","TCP","56","43520 → 9002 [ACK] Seq=3715 Ack=16935 Win=11861 Len=0"
"1.390799","5.9.29.183","172.19.0.3","TCP","1516","9002 → 43520 [PSH, ACK] Seq=16935 Ack=3715 Win=65535 Len=1460 [TCP segment of a reassembled PDU]"
"1.390827","5.9.29.183","172.19.0.3","TLSv1.2","1516","Application Data [TCP segment of a reassembled PDU]"
"1.390838","172.19.0.3","5.9.29.183","TCP","56","43520 → 9002 [ACK] Seq=3715 Ack=19855 Win=11903 Len=0"
"1.390840","5.9.29.183","172.19.0.3","TCP","1480","9002 → 43520 [PSH, ACK] Seq=19855 Ack=3715 Win=65535 Len=1424 [TCP segment of a reassembled PDU]"
"1.393877","5.9.29.183","172.19.0.3","TLSv1.2","84","Application Data"
"1.394015","172.19.0.3","5.9.29.183","TCP","56","43520 → 9002 [ACK] Seq=3715 Ack=21307 Win=11911 Len=0"
"1.403155","5.9.29.183","172.19.0.3","TCP","1504","[TCP segment of a reassembled PDU]"
"1.403182","5.9.29.183","172.19.0.3","TCP","1516","9002 → 43520 [PSH, ACK] Seq=22755 Ack=3715 Win=65535 Len=1460 [TCP segment of a reassembled PDU]"
"1.403187","5.9.29.183","172.19.0.3","TLSv1.2","1516","Application Data [TCP segment of a reassembled PDU]"
"1.403190","5.9.29.183","172.19.0.3","TCP","1480","9002 → 43520 [PSH, ACK] Seq=25675 Ack=3715 Win=65535 Len=1424 [TCP segment of a reassembled PDU]"
"1.403239","5.9.29.183","172.19.0.3","TCP","1504","9002 → 43520 [PSH, ACK] Seq=27099 Ack=3715 Win=65535 Len=1448 [TCP segment of a reassembled PDU]"
"1.403316","172.19.0.3","5.9.29.183","TCP","56","43520 → 9002 [ACK] Seq=3715 Ack=28547 Win=11879 Len=0"
"1.409267","5.9.29.183","172.19.0.3","TLSv1.2","584","Application Data"
"1.409759","172.19.0.3","5.9.29.183","TLSv1.2","1113","Application Data"
"1.410078","5.9.29.183","172.19.0.3","TCP","56","9002 → 43520 [ACK] Seq=29075 Ack=4772 Win=65535 Len=0"
"1.420601","5.9.29.183","172.19.0.3","TCP","1504","[TCP segment of a reassembled PDU]"
"1.420625","5.9.29.183","172.19.0.3","TCP","1516","9002 → 43520 [PSH, ACK] Seq=30523 Ack=4772 Win=65535 Len=1460 [TCP segment of a reassembled PDU]"
"1.420629","5.9.29.183","172.19.0.3","TLSv1.2","1492","Application Data [TCP segment of a reassembled PDU]"
"1.420721","172.19.0.3","5.9.29.183","TCP","56","43520 → 9002 [ACK] Seq=4772 Ack=33419 Win=11895 Len=0"
"1.424931","5.9.29.183","172.19.0.3","TLSv1.2","910","Application Data"
"1.466211","172.19.0.3","5.9.29.183","TCP","56","43520 → 9002 [ACK] Seq=4772 Ack=34273 Win=11911 Len=0"
"1.468125","5.9.29.183","172.19.0.3","TCP","1504","[TCP segment of a reassembled PDU]"
"1.468180","172.19.0.3","5.9.29.183","TCP","56","43520 → 9002 [ACK] Seq=4772 Ack=35721 Win=11911 Len=0"
"1.468292","5.9.29.183","172.19.0.3","TCP","1516","9002 → 43520 [PSH, ACK] Seq=35721 Ack=4772 Win=65535 Len=1460 [TCP segment of a reassembled PDU]"
"1.468302","172.19.0.3","5.9.29.183","TCP","56","43520 → 9002 [ACK] Seq=4772 Ack=37181 Win=11903 Len=0"
"1.468303","5.9.29.183","172.19.0.3","TLSv1.2","1225","Application Data"
"1.468307","172.19.0.3","5.9.29.183","TCP","56","43520 → 9002 [ACK] Seq=4772 Ack=38350 Win=11895 Len=0"
"1.468308","5.9.29.183","172.19.0.3","TCP","1516","[TCP segment of a reassembled PDU]"
"1.468312","172.19.0.3","5.9.29.183","TCP","56","43520 → 9002 [ACK] Seq=4772 Ack=39810 Win=11887 Len=0"
"1.468312","5.9.29.183","172.19.0.3","TCP","1492","9002 → 43520 [PSH, ACK] Seq=39810 Ack=4772 Win=65535 Len=1436 [TCP segment of a reassembled PDU]"
"1.468315","172.19.0.3","5.9.29.183","TCP","56","43520 → 9002 [ACK] Seq=4772 Ack=41246 Win=11879 Len=0"
"1.483553","5.9.29.183","172.19.0.3","TLSv1.2","851","Application Data"
"1.483586","172.19.0.3","5.9.29.183","TCP","56","43520 → 9002 [ACK] Seq=4772 Ack=42041 Win=11911 Len=0"
"1.484349","5.9.29.183","172.19.0.3","TCP","1504","[TCP segment of a reassembled PDU]"
"1.484356","172.19.0.3","5.9.29.183","TCP","56","43520 → 9002 [ACK] Seq=4772 Ack=43489 Win=11911 Len=0"
"1.484385","5.9.29.183","172.19.0.3","TCP","1504","9002 → 43520 [PSH, ACK] Seq=43489 Ack=4772 Win=65535 Len=1448 [TCP segment of a reassembled PDU]"
"1.484461","5.9.29.183","172.19.0.3","TLSv1.2","1504","Application Data [TCP segment of a reassembled PDU]"
"1.484466","5.9.29.183","172.19.0.3","TCP","1504","9002 → 43520 [PSH, ACK] Seq=46385 Ack=4772 Win=65535 Len=1448 [TCP segment of a reassembled PDU]"
"1.484468","5.9.29.183","172.19.0.3","TCP","1504","9002 → 43520 [PSH, ACK] Seq=47833 Ack=4772 Win=65535 Len=1448 [TCP segment of a reassembled PDU]"
"1.484507","5.9.29.183","172.19.0.3","TLSv1.2","1504","Application Data [TCP segment of a reassembled PDU]"
"1.484532","172.19.0.3","5.9.29.183","TCP","56","43520 → 9002 [ACK] Seq=4772 Ack=50729 Win=11871 Len=0"
"1.484587","5.9.29.183","172.19.0.3","TCP","1516","9002 → 43520 [PSH, ACK] Seq=50729 Ack=4772 Win=65535 Len=1460 [TCP segment of a reassembled PDU]"
"1.484590","5.9.29.183","172.19.0.3","TCP","1492","9002 → 43520 [PSH, ACK] Seq=52189 Ack=4772 Win=65535 Len=1436 [TCP segment of a reassembled PDU]"
"1.484602","172.19.0.3","5.9.29.183","TCP","56","43520 → 9002 [ACK] Seq=4772 Ack=53625 Win=11855 Len=0"
"1.499212","5.9.29.183","172.19.0.3","TLSv1.2","381","Application Data"
"1.499358","172.19.0.3","5.9.29.183","TCP","56","43520 → 9002 [ACK] Seq=4772 Ack=53950 Win=11911 Len=0"
"1.500842","5.9.29.183","172.19.0.3","TCP","1516","[TCP segment of a reassembled PDU]"
"1.500852","5.9.29.183","172.19.0.3","TCP","1516","9002 → 43520 [PSH, ACK] Seq=55410 Ack=4772 Win=65535 Len=1460 [TCP segment of a reassembled PDU]"
"1.500856","5.9.29.183","172.19.0.3","TLSv1.2","1480","Application Data [TCP segment of a reassembled PDU]"
"1.500923","5.9.29.183","172.19.0.3","TCP","1516","9002 → 43520 [PSH, ACK] Seq=58294 Ack=4772 Win=65535 Len=1460 [TCP segment of a reassembled PDU]"
"1.500943","5.9.29.183","172.19.0.3","TCP","1386","9002 → 43520 [PSH, ACK] Seq=59754 Ack=4772 Win=65535 Len=1330 [TCP segment of a reassembled PDU]"
"1.500996","5.9.29.183","172.19.0.3","TCP","162","9002 → 43520 [PSH, ACK] Seq=61084 Ack=4772 Win=65535 Len=106 [TCP segment of a reassembled PDU]"
"1.501035","172.19.0.3","5.9.29.183","TCP","56","43520 → 9002 [ACK] Seq=4772 Ack=61190 Win=11869 Len=0"
"1.501204","172.19.0.3","5.9.29.183","TLSv1.2","599","Application Data"
"1.501567","5.9.29.183","172.19.0.3","TCP","56","9002 → 43520 [ACK] Seq=61190 Ack=5315 Win=65535 Len=0"
"1.517228","5.9.29.183","172.19.0.3","TLSv1.2","1127","Application Data, Application Data"
"1.517925","172.19.0.3","5.9.29.183","TLSv1.2","599","Application Data"
"1.518126","5.9.29.183","172.19.0.3","TCP","56","9002 → 43520 [ACK] Seq=62261 Ack=5858 Win=65535 Len=0"
"1.527532","172.19.0.3","5.9.29.183","TLSv1.2","599","Application Data"
"1.527881","5.9.29.183","172.19.0.3","TCP","56","9002 → 43520 [ACK] Seq=62261 Ack=6401 Win=65535 Len=0"
"1.555714","5.9.29.183","172.19.0.3","TLSv1.2","599","Application Data"
"1.596761","172.19.0.3","5.9.29.183","TCP","56","43520 → 9002 [ACK] Seq=6401 Ack=62804 Win=11911 Len=0"
"1.787873","5.9.29.183","172.19.0.3","TLSv1.2","599","Application Data"
"1.787904","172.19.0.3","5.9.29.183","TCP","56","43520 → 9002 [ACK] Seq=6401 Ack=63347 Win=11911 Len=0"
"1.788383","172.19.0.3","5.9.29.183","TLSv1.2","599","Application Data"
"1.788621","5.9.29.183","172.19.0.3","TCP","56","9002 → 43520 [ACK] Seq=63347 Ack=6944 Win=65535 Len=0"
"2.031206","5.9.29.183","172.19.0.3","TCP","1516","[TCP segment of a reassembled PDU]"
"2.031230","5.9.29.183","172.19.0.3","TCP","1492","9002 → 43520 [PSH, ACK] Seq=64807 Ack=6944 Win=65535 Len=1436 [TCP segment of a reassembled PDU]"
"2.031235","5.9.29.183","172.19.0.3","TLSv1.2","787","Application Data"
"2.031329","172.19.0.3","5.9.29.183","TCP","56","43520 → 9002 [ACK] Seq=6944 Ack=66974 Win=11895 Len=0"
"2.046098","5.9.29.183","172.19.0.3","TCP","1504","[TCP segment of a reassembled PDU]"
"2.046122","5.9.29.183","172.19.0.3","TCP","1504","9002 → 43520 [PSH, ACK] Seq=68422 Ack=6944 Win=65535 Len=1448 [TCP segment of a reassembled PDU]"
"2.046132","172.19.0.3","5.9.29.183","TCP","56","43520 → 9002 [ACK] Seq=6944 Ack=69870 Win=11903 Len=0"
"2.046871","5.9.29.183","172.19.0.3","TLSv1.2","787","Application Data"
"2.057950","5.9.29.183","172.19.0.3","TCP","1504","[TCP segment of a reassembled PDU]"
"2.057978","172.19.0.3","5.9.29.183","TCP","56","43520 → 9002 [ACK] Seq=6944 Ack=72049 Win=11911 Len=0"
"2.057993","5.9.29.183","172.19.0.3","TCP","1516","9002 → 43520 [PSH, ACK] Seq=72049 Ack=6944 Win=65535 Len=1460 [TCP segment of a reassembled PDU]"
"2.058006","5.9.29.183","172.19.0.3","TLSv1.2","1492","Application Data [TCP segment of a reassembled PDU]"
"2.058071","5.9.29.183","172.19.0.3","TCP","1516","9002 → 43520 [PSH, ACK] Seq=74945 Ack=6944 Win=65535 Len=1460 [TCP segment of a reassembled PDU]"
"2.058115","5.9.29.183","172.19.0.3","TCP","1492","9002 → 43520 [PSH, ACK] Seq=76405 Ack=6944 Win=65535 Len=1436 [TCP segment of a reassembled PDU]"
"2.058191","172.19.0.3","5.9.29.183","TCP","56","43520 → 9002 [ACK] Seq=6944 Ack=77841 Win=11879 Len=0"
"2.063048","5.9.29.183","172.19.0.3","TLSv1.2","1127","Application Data, Application Data"
"2.073479","5.9.29.183","172.19.0.3","TCP","1516","[TCP segment of a reassembled PDU]"
"2.073497","172.19.0.3","5.9.29.183","TCP","56","43520 → 9002 [ACK] Seq=6944 Ack=80372 Win=11911 Len=0"
"2.073509","5.9.29.183","172.19.0.3","TCP","1516","9002 → 43520 [PSH, ACK] Seq=80372 Ack=6944 Win=65535 Len=1460 [TCP segment of a reassembled PDU]"
"2.073514","5.9.29.183","172.19.0.3","TLSv1.2","1516","Application Data [TCP segment of a reassembled PDU]"
"2.073516","5.9.29.183","172.19.0.3","TCP","1468","9002 → 43520 [PSH, ACK] Seq=83292 Ack=6944 Win=65535 Len=1412 [TCP segment of a reassembled PDU]"
"2.073518","5.9.29.183","172.19.0.3","TCP","1516","9002 → 43520 [PSH, ACK] Seq=84704 Ack=6944 Win=65535 Len=1460 [TCP segment of a reassembled PDU]"
"2.073520","5.9.29.183","172.19.0.3","TLSv1.2","1516","Application Data [TCP segment of a reassembled PDU]"
"2.073524","5.9.29.183","172.19.0.3","TCP","1516","9002 → 43520 [PSH, ACK] Seq=87624 Ack=6944 Win=65535 Len=1460 [TCP segment of a reassembled PDU]"
"2.073526","5.9.29.183","172.19.0.3","TCP","1516","9002 → 43520 [PSH, ACK] Seq=89084 Ack=6944 Win=65535 Len=1460 [TCP segment of a reassembled PDU]"
"2.073611","5.9.29.183","172.19.0.3","TLSv1.2","1516","Application Data [TCP segment of a reassembled PDU]"
"2.073617","5.9.29.183","172.19.0.3","TCP","1444","9002 → 43520 [PSH, ACK] Seq=92004 Ack=6944 Win=65535 Len=1388 [TCP segment of a reassembled PDU]"
"2.073620","5.9.29.183","172.19.0.3","TCP","1504","9002 → 43520 [PSH, ACK] Seq=93392 Ack=6944 Win=65535 Len=1448 [TCP segment of a reassembled PDU]"
"2.073742","172.19.0.3","5.9.29.183","TCP","56","43520 → 9002 [ACK] Seq=6944 Ack=94840 Win=11828 Len=0"
"2.073929","172.19.0.3","5.9.29.183","TLSv1.2","599","Application Data"
"2.074068","5.9.29.183","172.19.0.3","TCP","56","9002 → 43520 [ACK] Seq=94840 Ack=7487 Win=65535 Len=0"
"2.078156","5.9.29.183","172.19.0.3","TLSv1.2","721","Application Data, Application Data"
"2.085131","172.19.0.3","5.9.29.183","TLSv1.2","599","Application Data"
"2.085680","5.9.29.183","172.19.0.3","TCP","56","9002 → 43520 [ACK] Seq=95505 Ack=8030 Win=65535 Len=0"
"2.110382","5.9.29.183","172.19.0.3","TCP","1516","[TCP segment of a reassembled PDU]"
"2.110449","5.9.29.183","172.19.0.3","TCP","1516","9002 → 43520 [PSH, ACK] Seq=96965 Ack=8030 Win=65535 Len=1460 [TCP segment of a reassembled PDU]"
"2.110518","5.9.29.183","172.19.0.3","TLSv1.2","763","Application Data"
"2.110606","172.19.0.3","5.9.29.183","TCP","56","43520 → 9002 [ACK] Seq=8030 Ack=99132 Win=11895 Len=0"
"2.202585","5.9.29.183","172.19.0.3","TCP","1504","[TCP segment of a reassembled PDU]"
"2.202609","5.9.29.183","172.19.0.3","TCP","1504","9002 → 43520 [PSH, ACK] Seq=100580 Ack=8030 Win=65535 Len=1448 [TCP segment of a reassembled PDU]"
"2.202622","172.19.0.3","5.9.29.183","TCP","56","43520 → 9002 [ACK] Seq=8030 Ack=102028 Win=11903 Len=0"
"2.202623","5.9.29.183","172.19.0.3","TLSv1.2","787","Application Data"
"2.220061","5.9.29.183","172.19.0.3","TCP","1516","[TCP segment of a reassembled PDU]"
"2.220082","172.19.0.3","5.9.29.183","TCP","56","43520 → 9002 [ACK] Seq=8030 Ack=104219 Win=11911 Len=0"
"2.220096","5.9.29.183","172.19.0.3","TCP","1516","9002 → 43520 [PSH, ACK] Seq=104219 Ack=8030 Win=65535 Len=1460 [TCP segment of a reassembled PDU]"
"2.220102","5.9.29.183","172.19.0.3","TLSv1.2","1213","Application Data"
"2.220106","5.9.29.183","172.19.0.3","TCP","1516","[TCP segment of a reassembled PDU]"
"2.220111","5.9.29.183","172.19.0.3","TCP","1516","9002 → 43520 [PSH, ACK] Seq=108296 Ack=8030 Win=65535 Len=1460 [TCP segment of a reassembled PDU]"
"2.220403","5.9.29.183","172.19.0.3","TLSv1.2","1516","Application Data [TCP segment of a reassembled PDU]"
"2.220419","5.9.29.183","172.19.0.3","TCP","1516","9002 → 43520 [PSH, ACK] Seq=111216 Ack=8030 Win=65535 Len=1460 [TCP segment of a reassembled PDU]"
"2.220425","5.9.29.183","172.19.0.3","TCP","1516","9002 → 43520 [PSH, ACK] Seq=112676 Ack=8030 Win=65535 Len=1460 [TCP segment of a reassembled PDU]"
"2.220459","5.9.29.183","172.19.0.3","TLSv1.2","1516","Application Data [TCP segment of a reassembled PDU]"
"2.220463","5.9.29.183","172.19.0.3","TCP","1516","9002 → 43520 [PSH, ACK] Seq=115596 Ack=8030 Win=65535 Len=1460 [TCP segment of a reassembled PDU]"
"2.220467","5.9.29.183","172.19.0.3","TCP","1420","9002 → 43520 [PSH, ACK] Seq=117056 Ack=8030 Win=65535 Len=1364 [TCP segment of a reassembled PDU]"
"2.220546","172.19.0.3","5.9.29.183","TCP","56","43520 → 9002 [ACK] Seq=8030 Ack=118420 Win=11828 Len=0"
"2.235691","5.9.29.183","172.19.0.3","TLSv1.2","445","Application Data"
"2.236065","172.19.0.3","5.9.29.183","TLSv1.2","599","Application Data"
"2.236401","5.9.29.183","172.19.0.3","TCP","56","9002 → 43520 [ACK] Seq=118809 Ack=8573 Win=65535 Len=0"
"2.238631","5.9.29.183","172.19.0.3","TCP","1516","[TCP segment of a reassembled PDU]"
"2.238657","5.9.29.183","172.19.0.3","TCP","1516","9002 → 43520 [PSH, ACK] Seq=120269 Ack=8573 Win=65535 Len=1460 [TCP segment of a reassembled PDU]"
"2.238662","5.9.29.183","172.19.0.3","TLSv1.2","1480","Application Data [TCP segment of a reassembled PDU]"
"2.238665","5.9.29.183","172.19.0.3","TCP","1516","9002 → 43520 [PSH, ACK] Seq=123153 Ack=8573 Win=65535 Len=1460 [TCP segment of a reassembled PDU]"
"2.238667","5.9.29.183","172.19.0.3","TCP","1516","9002 → 43520 [PSH, ACK] Seq=124613 Ack=8573 Win=65535 Len=1460 [TCP segment of a reassembled PDU]"
"2.238669","5.9.29.183","172.19.0.3","TCP","603","9002 → 43520 [PSH, ACK] Seq=126073 Ack=8573 Win=65535 Len=547 [TCP segment of a reassembled PDU]"
"2.238672","5.9.29.183","172.19.0.3","TLSv1.2","1516","Application Data [TCP segment of a reassembled PDU]"
"2.238728","5.9.29.183","172.19.0.3","TCP","1516","9002 → 43520 [PSH, ACK] Seq=128080 Ack=8573 Win=65535 Len=1460 [TCP segment of a reassembled PDU]"
"2.238745","5.9.29.183","172.19.0.3","TCP","909","9002 → 43520 [PSH, ACK] Seq=129540 Ack=8573 Win=65535 Len=853 [TCP segment of a reassembled PDU]"
"2.238818","172.19.0.3","5.9.29.183","TCP","56","43520 → 9002 [ACK] Seq=8573 Ack=130393 Win=11847 Len=0"
"2.250767","5.9.29.183","172.19.0.3","TLSv1.2","924","Application Data, Application Data"
"2.254702","5.9.29.183","172.19.0.3","TCP","1516","[TCP segment of a reassembled PDU]"
"2.254757","172.19.0.3","5.9.29.183","TCP","56","43520 → 9002 [ACK] Seq=8573 Ack=132721 Win=11909 Len=0"
"2.254776","5.9.29.183","172.19.0.3","TCP","1492","9002 → 43520 [PSH, ACK] Seq=132721 Ack=8573 Win=65535 Len=1436 [TCP segment of a reassembled PDU]"
"2.254785","5.9.29.183","172.19.0.3","TLSv1.2","1516","Application Data [TCP segment of a reassembled PDU]"
"2.254789","5.9.29.183","172.19.0.3","TCP","1516","9002 → 43520 [PSH, ACK] Seq=135617 Ack=8573 Win=65535 Len=1460 [TCP segment of a reassembled PDU]"
"2.254921","5.9.29.183","172.19.0.3","TCP","1516","9002 → 43520 [PSH, ACK] Seq=137077 Ack=8573 Win=65535 Len=1460 [TCP segment of a reassembled PDU]"
"2.254928","5.9.29.183","172.19.0.3","TLSv1.2","1516","Application Data [TCP segment of a reassembled PDU]"
"2.254931","5.9.29.183","172.19.0.3","TCP","1456","9002 → 43520 [PSH, ACK] Seq=139997 Ack=8573 Win=65535 Len=1400 [TCP segment of a reassembled PDU]"
"2.255006","172.19.0.3","5.9.29.183","TCP","56","43520 → 9002 [ACK] Seq=8573 Ack=141397 Win=11861 Len=0"
"2.255266","172.19.0.3","5.9.29.183","TLSv1.2","599","Application Data"
"2.255498","5.9.29.183","172.19.0.3","TCP","56","9002 → 43520 [ACK] Seq=141397 Ack=9116 Win=65535 Len=0"
"2.265909","5.9.29.183","172.19.0.3","TLSv1.2","1315","Application Data"
"2.266305","172.19.0.3","5.9.29.183","TLSv1.2","599","Application Data"
"2.266559","5.9.29.183","172.19.0.3","TCP","56","9002 → 43520 [ACK] Seq=142656 Ack=9659 Win=65535 Len=0"
"2.276140","172.19.0.3","5.9.29.183","TLSv1.2","599","Application Data"
"2.276416","5.9.29.183","172.19.0.3","TCP","56","9002 → 43520 [ACK] Seq=142656 Ack=10202 Win=65535 Len=0"
"2.665788","5.9.29.183","172.19.0.3","TLSv1.2","599","Application Data"
"2.666261","172.19.0.3","5.9.29.183","TLSv1.2","599","Application Data"
"2.666497","5.9.29.183","172.19.0.3","TCP","56","9002 → 43520 [ACK] Seq=143199 Ack=10745 Win=65535 Len=0"
"2.929462","5.9.29.183","172.19.0.3","TCP","1516","[TCP segment of a reassembled PDU]"
"2.929487","5.9.29.183","172.19.0.3","TCP","1516","9002 → 43520 [PSH, ACK] Seq=144659 Ack=10745 Win=65535 Len=1460 [TCP segment of a reassembled PDU]"
"2.929492","5.9.29.183","172.19.0.3","TLSv1.2","763","Application Data"
"2.929577","172.19.0.3","5.9.29.183","TCP","56","43520 → 9002 [ACK] Seq=10745 Ack=146826 Win=11895 Len=0"
"2.949970","5.9.29.183","172.19.0.3","TCP","1516","[TCP segment of a reassembled PDU]"
"2.950035","5.9.29.183","172.19.0.3","TCP","1492","9002 → 43520 [PSH, ACK] Seq=148286 Ack=10745 Win=65535 Len=1436 [TCP segment of a reassembled PDU]"
"2.950092","172.19.0.3","5.9.29.183","TCP","56","43520 → 9002 [ACK] Seq=10745 Ack=149722 Win=11903 Len=0"
"2.950322","5.9.29.183","172.19.0.3","TLSv1.2","1516","Application Data [TCP segment of a reassembled PDU]"
"2.950371","5.9.29.183","172.19.0.3","TCP","1516","9002 → 43520 [PSH, ACK] Seq=151182 Ack=10745 Win=65535 Len=1460 [TCP segment of a reassembled PDU]"
"2.950381","172.19.0.3","5.9.29.183","TCP","56","43520 → 9002 [ACK] Seq=10745 Ack=152642 Win=11903 Len=0"
"2.950446","5.9.29.183","172.19.0.3","TCP","1480","9002 → 43520 [PSH, ACK] Seq=152642 Ack=10745 Win=65535 Len=1424 [TCP segment of a reassembled PDU]"
"2.950509","5.9.29.183","172.19.0.3","TLSv1.2","1127","Application Data, Application Data"
"2.950638","172.19.0.3","5.9.29.183","TCP","56","43520 → 9002 [ACK] Seq=10745 Ack=155137 Win=11887 Len=0"
"2.961860","5.9.29.183","172.19.0.3","TCP","1504","[TCP segment of a reassembled PDU]"
"2.961883","5.9.29.183","172.19.0.3","TCP","1516","9002 → 43520 [PSH, ACK] Seq=156585 Ack=10745 Win=65535 Len=1460 [TCP segment of a reassembled PDU]"
"2.961893","172.19.0.3","5.9.29.183","TCP","56","43520 → 9002 [ACK] Seq=10745 Ack=158045 Win=11903 Len=0"
"2.961895","5.9.29.183","172.19.0.3","TLSv1.2","1492","Application Data [TCP segment of a reassembled PDU]"
"2.971975","5.9.29.183","172.19.0.3","TLSv1.2","910","Application Data"
"2.971993","172.19.0.3","5.9.29.183","TCP","56","43520 → 9002 [ACK] Seq=10745 Ack=160335 Win=11911 Len=0"
"2.980489","5.9.29.183","172.19.0.3","TCP","1504","[TCP segment of a reassembled PDU]"
"2.987981","5.9.29.183","172.19.0.3","TLSv1.2","1207","Application Data"
"2.987998","172.19.0.3","5.9.29.183","TCP","56","43520 → 9002 [ACK] Seq=10745 Ack=162934 Win=11911 Len=0"
"2.991043","172.19.0.3","5.9.29.183","TLSv1.2","599","Application Data"
"2.991217","5.9.29.183","172.19.0.3","TCP","56","9002 → 43520 [ACK] Seq=162934 Ack=11288 Win=65535 Len=0"
"3.263630","5.9.29.183","172.19.0.3","TLSv1.2","599","Application Data"
"3.264310","172.19.0.3","5.9.29.183","TLSv1.2","599","Application Data"
"3.264677","5.9.29.183","172.19.0.3","TCP","56","9002 → 43520 [ACK] Seq=163477 Ack=11831 Win=65535 Len=0"
"3.554454","5.9.29.183","172.19.0.3","TCP","1516","[TCP segment of a reassembled PDU]"
"3.554478","5.9.29.183","172.19.0.3","TCP","1492","9002 → 43520 [PSH, ACK] Seq=164937 Ack=11831 Win=65535 Len=1436 [TCP segment of a reassembled PDU]"
"3.554483","5.9.29.183","172.19.0.3","TLSv1.2","787","Application Data"
"3.554570","172.19.0.3","5.9.29.183","TCP","56","43520 → 9002 [ACK] Seq=11831 Ack=167104 Win=11895 Len=0"
"3.571814","5.9.29.183","172.19.0.3","TLSv1.2","599","Application Data"
"3.582190","5.9.29.183","172.19.0.3","TCP","1504","[TCP segment of a reassembled PDU]"
"3.582210","172.19.0.3","5.9.29.183","TCP","56","43520 → 9002 [ACK] Seq=11831 Ack=169095 Win=11911 Len=0"
"3.582217","5.9.29.183","172.19.0.3","TCP","1516","9002 → 43520 [PSH, ACK] Seq=169095 Ack=11831 Win=65535 Len=1460 [TCP segment of a reassembled PDU]"
"3.582323","5.9.29.183","172.19.0.3","TLSv1.2","1516","Application Data [TCP segment of a reassembled PDU]"
"3.582328","5.9.29.183","172.19.0.3","TCP","1516","9002 → 43520 [PSH, ACK] Seq=172015 Ack=11831 Win=65535 Len=1460 [TCP segment of a reassembled PDU]"
"3.582333","5.9.29.183","172.19.0.3","TCP","1516","9002 → 43520 [PSH, ACK] Seq=173475 Ack=11831 Win=65535 Len=1460 [TCP segment of a reassembled PDU]"
"3.582335","5.9.29.183","172.19.0.3","TLSv1.2","1456","Application Data [TCP segment of a reassembled PDU]"
"3.582337","5.9.29.183","172.19.0.3","TCP","1504","9002 → 43520 [PSH, ACK] Seq=176335 Ack=11831 Win=65535 Len=1448 [TCP segment of a reassembled PDU]"
"3.582396","172.19.0.3","5.9.29.183","TCP","56","43520 → 9002 [ACK] Seq=11831 Ack=177783 Win=11863 Len=0"
"3.587572","5.9.29.183","172.19.0.3","TLSv1.2","1315","Application Data"
"3.601380","5.9.29.183","172.19.0.3","TCP","1504","[TCP segment of a reassembled PDU]"
"3.601411","172.19.0.3","5.9.29.183","TCP","56","43520 → 9002 [ACK] Seq=11831 Ack=180490 Win=11911 Len=0"
"3.601429","5.9.29.183","172.19.0.3","TCP","1516","9002 → 43520 [PSH, ACK] Seq=180490 Ack=11831 Win=65535 Len=1460 [TCP segment of a reassembled PDU]"
"3.601519","5.9.29.183","172.19.0.3","TLSv1.2","1516","Application Data [TCP segment of a reassembled PDU]"
"3.601523","5.9.29.183","172.19.0.3","TCP","1480","9002 → 43520 [PSH, ACK] Seq=183410 Ack=11831 Win=65535 Len=1424 [TCP segment of a reassembled PDU]"
"3.601583","172.19.0.3","5.9.29.183","TCP","56","43520 → 9002 [ACK] Seq=11831 Ack=184834 Win=11885 Len=0"
"3.609300","5.9.29.183","172.19.0.3","TLSv1.2","1516","Application Data [TCP segment of a reassembled PDU]"
"3.609343","5.9.29.183","172.19.0.3","TCP","992","9002 → 43520 [PSH, ACK] Seq=186294 Ack=11831 Win=65535 Len=936 [TCP segment of a reassembled PDU]"
"3.609354","172.19.0.3","5.9.29.183","TCP","56","43520 → 9002 [ACK] Seq=11831 Ack=187230 Win=11903 Len=0"
"3.627991","5.9.29.183","172.19.0.3","TLSv1.2","1504","Application Data [TCP segment of a reassembled PDU]"
"3.628251","172.19.0.3","5.9.29.183","TLSv1.2","599","Application Data"
"3.628489","5.9.29.183","172.19.0.3","TCP","56","9002 → 43520 [ACK] Seq=188678 Ack=12374 Win=65535 Len=0"
"3.628866","5.9.29.183","172.19.0.3","TLSv1.2","816","Application Data"
"3.637756","172.19.0.3","5.9.29.183","TLSv1.2","599","Application Data"
"3.638063","5.9.29.183","172.19.0.3","TCP","56","9002 → 43520 [ACK] Seq=189438 Ack=12917 Win=65535 Len=0"
"3.912430","5.9.29.183","172.19.0.3","TLSv1.2","599","Application Data"
"3.913151","172.19.0.3","5.9.29.183","TLSv1.2","599","Application Data"
"3.913438","5.9.29.183","172.19.0.3","TCP","56","9002 → 43520 [ACK] Seq=189981 Ack=13460 Win=65535 Len=0"
"4.217523","5.9.29.183","172.19.0.3","TCP","1516","[TCP segment of a reassembled PDU]"
"4.217567","5.9.29.183","172.19.0.3","TCP","771","9002 → 43520 [PSH, ACK] Seq=191441 Ack=13460 Win=65535 Len=715 [TCP segment of a reassembled PDU]"
"4.217573","5.9.29.183","172.19.0.3","TCP","1516","9002 → 43520 [PSH, ACK] Seq=192156 Ack=13460 Win=65535 Len=1460 [TCP segment of a reassembled PDU]"
"4.217575","5.9.29.183","172.19.0.3","TLSv1.2","1516","Application Data [TCP segment of a reassembled PDU]"
"4.217577","5.9.29.183","172.19.0.3","TCP","1516","9002 → 43520 [PSH, ACK] Seq=195076 Ack=13460 Win=65535 Len=1460 [TCP segment of a reassembled PDU]"
"4.217694","5.9.29.183","172.19.0.3","TCP","474","9002 → 43520 [PSH, ACK] Seq=196536 Ack=13460 Win=65535 Len=418 [TCP segment of a reassembled PDU]"
"4.217761","172.19.0.3","5.9.29.183","TCP","56","43520 → 9002 [ACK] Seq=13460 Ack=196954 Win=11871 Len=0"
"4.239470","5.9.29.183","172.19.0.3","TLSv1.2","1516","Application Data [TCP segment of a reassembled PDU]"
"4.239493","5.9.29.183","172.19.0.3","TCP","1492","9002 → 43520 [PSH, ACK] Seq=198414 Ack=13460 Win=65535 Len=1436 [TCP segment of a reassembled PDU]"
"4.239503","172.19.0.3","5.9.29.183","TCP","56","43520 → 9002 [ACK] Seq=13460 Ack=199850 Win=11903 Len=0"
"4.239505","5.9.29.183","172.19.0.3","TCP","1516","9002 → 43520 [PSH, ACK] Seq=199850 Ack=13460 Win=65535 Len=1460 [TCP segment of a reassembled PDU]"
"4.239507","5.9.29.183","172.19.0.3","TLSv1.2","151","Application Data, Application Data"
"4.239681","172.19.0.3","5.9.29.183","TCP","56","43520 → 9002 [ACK] Seq=13460 Ack=201405 Win=11891 Len=0"
"4.251117","5.9.29.183","172.19.0.3","TCP","1516","[TCP segment of a reassembled PDU]"
"4.251140","5.9.29.183","172.19.0.3","TCP","1516","9002 → 43520 [PSH, ACK] Seq=202865 Ack=13460 Win=65535 Len=1460 [TCP segment of a reassembled PDU]"
"4.251149","172.19.0.3","5.9.29.183","TCP","56","43520 → 9002 [ACK] Seq=13460 Ack=204325 Win=11903 Len=0"
"4.251151","5.9.29.183","172.19.0.3","TLSv1.2","1516","Application Data [TCP segment of a reassembled PDU]"
"4.251153","5.9.29.183","172.19.0.3","TLSv1.2","1516","Application Data [TCP segment of a reassembled PDU]"
"4.251155","5.9.29.183","172.19.0.3","TCP","1516","9002 → 43520 [PSH, ACK] Seq=207245 Ack=13460 Win=65535 Len=1460 [TCP segment of a reassembled PDU]"
"4.251157","5.9.29.183","172.19.0.3","TCP","1516","9002 → 43520 [PSH, ACK] Seq=208705 Ack=13460 Win=65535 Len=1460 [TCP segment of a reassembled PDU]"
"4.251168","5.9.29.183","172.19.0.3","TLSv1.2","1432","Application Data [TCP segment of a reassembled PDU]"
"4.251254","5.9.29.183","172.19.0.3","TCP","1504","9002 → 43520 [PSH, ACK] Seq=211541 Ack=13460 Win=65535 Len=1448 [TCP segment of a reassembled PDU]"
"4.251320","172.19.0.3","5.9.29.183","TCP","56","43520 → 9002 [ACK] Seq=13460 Ack=212989 Win=11853 Len=0"
"4.258318","5.9.29.183","172.19.0.3","TLSv1.2","924","Application Data"
"4.268335","5.9.29.183","172.19.0.3","TCP","1516","[TCP segment of a reassembled PDU]"
"4.268352","172.19.0.3","5.9.29.183","TCP","56","43520 → 9002 [ACK] Seq=13460 Ack=215317 Win=11911 Len=0"
"4.268364","5.9.29.183","172.19.0.3","TCP","1516","9002 → 43520 [PSH, ACK] Seq=215317 Ack=13460 Win=65535 Len=1460 [TCP segment of a reassembled PDU]"
"4.268369","5.9.29.183","172.19.0.3","TLSv1.2","1480","Application Data [TCP segment of a reassembled PDU]"
"4.268371","5.9.29.183","172.19.0.3","TCP","1516","9002 → 43520 [PSH, ACK] Seq=218201 Ack=13460 Win=65535 Len=1460 [TCP segment of a reassembled PDU]"
"4.268373","5.9.29.183","172.19.0.3","TCP","1492","9002 → 43520 [PSH, ACK] Seq=219661 Ack=13460 Win=65535 Len=1436 [TCP segment of a reassembled PDU]"
"4.268495","172.19.0.3","5.9.29.183","TCP","56","43520 → 9002 [ACK] Seq=13460 Ack=221097 Win=11879 Len=0"
"4.268758","172.19.0.3","5.9.29.183","TLSv1.2","599","Application Data"
"4.268915","5.9.29.183","172.19.0.3","TCP","56","9002 → 43520 [ACK] Seq=221097 Ack=14003 Win=65535 Len=0"
"4.274051","5.9.29.183","172.19.0.3","TLSv1.2","584","Application Data"
"4.284586","5.9.29.183","172.19.0.3","TCP","1516","[TCP segment of a reassembled PDU]"
"4.284614","172.19.0.3","5.9.29.183","TCP","56","43520 → 9002 [ACK] Seq=14003 Ack=223085 Win=11911 Len=0"
"4.284626","5.9.29.183","172.19.0.3","TCP","1516","9002 → 43520 [PSH, ACK] Seq=223085 Ack=14003 Win=65535 Len=1460 [TCP segment of a reassembled PDU]"
"4.284631","5.9.29.183","172.19.0.3","TLSv1.2","1516","Application Data [TCP segment of a reassembled PDU]"
"4.284633","5.9.29.183","172.19.0.3","TCP","1468","9002 → 43520 [PSH, ACK] Seq=226005 Ack=14003 Win=65535 Len=1412 [TCP segment of a reassembled PDU]"
"4.284634","5.9.29.183","172.19.0.3","TCP","1504","9002 → 43520 [PSH, ACK] Seq=227417 Ack=14003 Win=65535 Len=1448 [TCP segment of a reassembled PDU]"
"4.284778","172.19.0.3","5.9.29.183","TCP","56","43520 → 9002 [ACK] Seq=14003 Ack=228865 Win=11879 Len=0"
"4.289029","5.9.29.183","172.19.0.3","TLSv1.2","584","Application Data"
"4.302130","5.9.29.183","172.19.0.3","TCP","1516","[TCP segment of a reassembled PDU]"
"4.302172","172.19.0.3","5.9.29.183","TCP","56","43520 → 9002 [ACK] Seq=14003 Ack=230853 Win=11911 Len=0"
"4.302189","5.9.29.183","172.19.0.3","TCP","1516","9002 → 43520 [PSH, ACK] Seq=230853 Ack=14003 Win=65535 Len=1460 [TCP segment of a reassembled PDU]"
"4.302199","5.9.29.183","172.19.0.3","TLSv1.2","1516","Application Data [TCP segment of a reassembled PDU]"
"4.302202","5.9.29.183","172.19.0.3","TCP","1516","9002 → 43520 [PSH, ACK] Seq=233773 Ack=14003 Win=65535 Len=1460 [TCP segment of a reassembled PDU]"
"4.302205","5.9.29.183","172.19.0.3","TCP","1456","9002 → 43520 [PSH, ACK] Seq=235233 Ack=14003 Win=65535 Len=1400 [TCP segment of a reassembled PDU]"
"4.302209","5.9.29.183","172.19.0.3","TLSv1.2","1516","Application Data [TCP segment of a reassembled PDU]"
"4.302212","5.9.29.183","172.19.0.3","TCP","1516","9002 → 43520 [PSH, ACK] Seq=238093 Ack=14003 Win=65535 Len=1460 [TCP segment of a reassembled PDU]"
"4.302215","5.9.29.183","172.19.0.3","TCP","1516","9002 → 43520 [PSH, ACK] Seq=239553 Ack=14003 Win=65535 Len=1460 [TCP segment of a reassembled PDU]"
"4.302344","5.9.29.183","172.19.0.3","TLSv1.2","1516","Application Data [TCP segment of a reassembled PDU]"
"4.302354","5.9.29.183","172.19.0.3","TCP","1516","9002 → 43520 [PSH, ACK] Seq=242473 Ack=14003 Win=65535 Len=1460 [TCP segment of a reassembled PDU]"
"4.302360","5.9.29.183","172.19.0.3","TCP","1444","9002 → 43520 [PSH, ACK] Seq=243933 Ack=14003 Win=65535 Len=1388 [TCP segment of a reassembled PDU]"
"4.302441","172.19.0.3","5.9.29.183","TCP","56","43520 → 9002 [ACK] Seq=14003 Ack=245321 Win=11828 Len=0"
"4.303098","172.19.0.3","5.9.29.183","TLSv1.2","599","Application Data"
"4.303305","5.9.29.183","172.19.0.3","TCP","56","9002 → 43520 [ACK] Seq=245321 Ack=14546 Win=65535 Len=0"
"4.304541","5.9.29.183","172.19.0.3","TLSv1.2","721","Application Data, Application Data"
"4.312567","172.19.0.3","5.9.29.183","TLSv1.2","599","Application Data"
"4.313034","5.9.29.183","172.19.0.3","TCP","56","9002 → 43520 [ACK] Seq=245986 Ack=15089 Win=65535 Len=0"
"4.320047","5.9.29.183","172.19.0.3","TLSv1.2","1504","Application Data"
"4.320073","5.9.29.183","172.19.0.3","TCP","1516","9002 → 43520 [PSH, ACK] Seq=247434 Ack=15089 Win=65535 Len=1460 [TCP segment of a reassembled PDU]"
"4.320078","5.9.29.183","172.19.0.3","TCP","1516","9002 → 43520 [PSH, ACK] Seq=248894 Ack=15089 Win=65535 Len=1460 [TCP segment of a reassembled PDU]"
"4.320080","5.9.29.183","172.19.0.3","TLSv1.2","372","Application Data"
"4.320185","172.19.0.3","5.9.29.183","TCP","56","43520 → 9002 [ACK] Seq=15089 Ack=250670 Win=11887 Len=0"
"4.368100","5.9.29.183","172.19.0.3","TCP","1516","[TCP segment of a reassembled PDU]"
"4.368125","5.9.29.183","172.19.0.3","TCP","1492","9002 → 43520 [PSH, ACK] Seq=252130 Ack=15089 Win=65535 Len=1436 [TCP segment of a reassembled PDU]"
"4.368137","172.19.0.3","5.9.29.183","TCP","56","43520 → 9002 [ACK] Seq=15089 Ack=253566 Win=11903 Len=0"
"4.368139","5.9.29.183","172.19.0.3","TLSv1.2","787","Application Data"
"4.385059","5.9.29.183","172.19.0.3","TCP","1516","[TCP segment of a reassembled PDU]"
"4.385078","172.19.0.3","5.9.29.183","TCP","56","43520 → 9002 [ACK] Seq=15089 Ack=255757 Win=11911 Len=0"
"4.385090","5.9.29.183","172.19.0.3","TCP","1492","9002 → 43520 [PSH, ACK] Seq=255757 Ack=15089 Win=65535 Len=1436 [TCP segment of a reassembled PDU]"
"4.386162","5.9.29.183","172.19.0.3","TCP","555","9002 → 43520 [PSH, ACK] Seq=257193 Ack=15089 Win=65535 Len=499 [TCP segment of a reassembled PDU]"
"4.386169","172.19.0.3","5.9.29.183","TCP","56","43520 → 9002 [ACK] Seq=15089 Ack=257692 Win=11911 Len=0"
"4.386173","5.9.29.183","172.19.0.3","TLSv1.2","831","Application Data, Application Data"
"4.401248","5.9.29.183","172.19.0.3","TCP","1504","[TCP segment of a reassembled PDU]"
"4.401265","172.19.0.3","5.9.29.183","TCP","56","43520 → 9002 [ACK] Seq=15089 Ack=259915 Win=11911 Len=0"
"4.401281","5.9.29.183","172.19.0.3","TCP","1504","9002 → 43520 [PSH, ACK] Seq=259915 Ack=15089 Win=65535 Len=1448 [TCP segment of a reassembled PDU]"
"4.404658","5.9.29.183","172.19.0.3","TLSv1.2","787","Application Data"
"4.404675","172.19.0.3","5.9.29.183","TCP","56","43520 → 9002 [ACK] Seq=15089 Ack=262094 Win=11911 Len=0"
"4.408230","172.19.0.3","5.9.29.183","TLSv1.2","599","Application Data"
"4.408433","5.9.29.183","172.19.0.3","TCP","56","9002 → 43520 [ACK] Seq=262094 Ack=15632 Win=65535 Len=0"
"4.728016","5.9.29.183","172.19.0.3","TLSv1.2","599","Application Data"
"4.728523","172.19.0.3","5.9.29.183","TLSv1.2","599","Application Data"
"4.728819","5.9.29.183","172.19.0.3","TCP","56","9002 → 43520 [ACK] Seq=262637 Ack=16175 Win=65535 Len=0"
"4.971282","5.9.29.183","172.19.0.3","TCP","1504","[TCP segment of a reassembled PDU]"
"4.971314","5.9.29.183","172.19.0.3","TCP","1516","9002 → 43520 [PSH, ACK] Seq=264085 Ack=16175 Win=65535 Len=1460 [TCP segment of a reassembled PDU]"
"4.971321","5.9.29.183","172.19.0.3","TLSv1.2","775","Application Data"
"4.971449","172.19.0.3","5.9.29.183","TCP","56","43520 → 9002 [ACK] Seq=16175 Ack=266264 Win=11895 Len=0"
"4.996782","5.9.29.183","172.19.0.3","TCP","1516","[TCP segment of a reassembled PDU]"
"4.996871","5.9.29.183","172.19.0.3","TCP","1492","9002 → 43520 [PSH, ACK] Seq=267724 Ack=16175 Win=65535 Len=1436 [TCP segment of a reassembled PDU]"
"4.996900","172.19.0.3","5.9.29.183","TCP","56","43520 → 9002 [ACK] Seq=16175 Ack=269160 Win=11901 Len=0"
"4.997447","5.9.29.183","172.19.0.3","TLSv1.2","787","Application Data"
"4.997524","5.9.29.183","172.19.0.3","TCP","1516","[TCP segment of a reassembled PDU]"
"4.997538","172.19.0.3","5.9.29.183","TCP","56","43520 → 9002 [ACK] Seq=16175 Ack=271351 Win=11903 Len=0"
"4.997542","5.9.29.183","172.19.0.3","TCP","1516","9002 → 43520 [PSH, ACK] Seq=271351 Ack=16175 Win=65535 Len=1460 [TCP segment of a reassembled PDU]"
"4.997546","5.9.29.183","172.19.0.3","TLSv1.2","1480","Application Data [TCP segment of a reassembled PDU]"
"4.997696","172.19.0.3","5.9.29.183","TCP","56","43520 → 9002 [ACK] Seq=16175 Ack=274235 Win=11887 Len=0"
"5.012101","5.9.29.183","172.19.0.3","TLSv1.2","1504","Application Data [TCP segment of a reassembled PDU]"
"5.012422","5.9.29.183","172.19.0.3","TCP","1516","9002 → 43520 [PSH, ACK] Seq=275683 Ack=16175 Win=65535 Len=1460 [TCP segment of a reassembled PDU]"
"5.012437","172.19.0.3","5.9.29.183","TCP","56","43520 → 9002 [ACK] Seq=16175 Ack=277143 Win=11903 Len=0"
"5.012440","5.9.29.183","172.19.0.3","TCP","1492","9002 → 43520 [PSH, ACK] Seq=277143 Ack=16175 Win=65535 Len=1436 [TCP segment of a reassembled PDU]"
"5.035751","5.9.29.183","172.19.0.3","TLSv1.2","1516","Application Data [TCP segment of a reassembled PDU]"
"5.035772","172.19.0.3","5.9.29.183","TCP","56","43520 → 9002 [ACK] Seq=16175 Ack=280039 Win=11911 Len=0"
"5.035785","5.9.29.183","172.19.0.3","TLSv1.2","1332","Application Data"
"5.039447","172.19.0.3","5.9.29.183","TLSv1.2","599","Application Data"
"5.039914","5.9.29.183","172.19.0.3","TCP","56","9002 → 43520 [ACK] Seq=281315 Ack=16718 Win=65535 Len=0"
"5.328171","5.9.29.183","172.19.0.3","TLSv1.2","599","Application Data"
"5.328842","172.19.0.3","5.9.29.183","TLSv1.2","599","Application Data"
"5.329092","5.9.29.183","172.19.0.3","TCP","56","9002 → 43520 [ACK] Seq=281858 Ack=17261 Win=65535 Len=0"
"5.680847","5.9.29.183","172.19.0.3","TLSv1.2","599","Application Data"
"5.691713","5.9.29.183","172.19.0.3","TCP","1516","[TCP segment of a reassembled PDU]"
"5.691737","172.19.0.3","5.9.29.183","TCP","56","43520 → 9002 [ACK] Seq=17261 Ack=283861 Win=11911 Len=0"
"5.691802","5.9.29.183","172.19.0.3","TCP","1492","9002 → 43520 [PSH, ACK] Seq=283861 Ack=17261 Win=65535 Len=1436 [TCP segment of a reassembled PDU]"
"5.691886","5.9.29.183","172.19.0.3","TLSv1.2","1516","Application Data [TCP segment of a reassembled PDU]"
"5.691891","5.9.29.183","172.19.0.3","TCP","1516","9002 → 43520 [PSH, ACK] Seq=286757 Ack=17261 Win=65535 Len=1460 [TCP segment of a reassembled PDU]"
"5.691894","5.9.29.183","172.19.0.3","TCP","1516","9002 → 43520 [PSH, ACK] Seq=288217 Ack=17261 Win=65535 Len=1460 [TCP segment of a reassembled PDU]"
"5.691897","5.9.29.183","172.19.0.3","TLSv1.2","1468","Application Data [TCP segment of a reassembled PDU]"
"5.691922","172.19.0.3","5.9.29.183","TCP","56","43520 → 9002 [ACK] Seq=17261 Ack=291089 Win=11871 Len=0"
"5.691964","5.9.29.183","172.19.0.3","TCP","1516","9002 → 43520 [PSH, ACK] Seq=291089 Ack=17261 Win=65535 Len=1460 [TCP segment of a reassembled PDU]"
"5.692249","5.9.29.183","172.19.0.3","TCP","1492","9002 → 43520 [PSH, ACK] Seq=292549 Ack=17261 Win=65535 Len=1436 [TCP segment of a reassembled PDU]"
"5.692259","172.19.0.3","5.9.29.183","TCP","56","43520 → 9002 [ACK] Seq=17261 Ack=293985 Win=11911 Len=0"
"5.700996","5.9.29.183","172.19.0.3","TLSv1.2","381","Application Data"
"5.701421","172.19.0.3","5.9.29.183","TLSv1.2","599","Application Data"
"5.701780","5.9.29.183","172.19.0.3","TCP","56","9002 → 43520 [ACK] Seq=294310 Ack=17804 Win=65535 Len=0"
"5.703520","5.9.29.183","172.19.0.3","TCP","1516","[TCP segment of a reassembled PDU]"
"5.703559","5.9.29.183","172.19.0.3","TCP","1492","9002 → 43520 [PSH, ACK] Seq=295770 Ack=17804 Win=65535 Len=1436 [TCP segment of a reassembled PDU]"
"5.703713","172.19.0.3","5.9.29.183","TCP","56","43520 → 9002 [ACK] Seq=17804 Ack=297206 Win=11903 Len=0"
"5.723201","5.9.29.183","172.19.0.3","TLSv1.2","787","Application Data"
"5.723241","5.9.29.183","172.19.0.3","TCP","1504","[TCP segment of a reassembled PDU]"
"5.723253","172.19.0.3","5.9.29.183","TCP","56","43520 → 9002 [ACK] Seq=17804 Ack=299385 Win=11903 Len=0"
"5.747589","5.9.29.183","172.19.0.3","TLSv1.2","693","Application Data"
"5.750537","172.19.0.3","5.9.29.183","TLSv1.2","599","Application Data"
"5.750771","5.9.29.183","172.19.0.3","TCP","56","9002 → 43520 [ACK] Seq=300022 Ack=18347 Win=65535 Len=0"
"6.001341","5.9.29.183","172.19.0.3","TLSv1.2","599","Application Data"
"6.002004","172.19.0.3","5.9.29.183","TLSv1.2","599","Application Data"
"6.002205","5.9.29.183","172.19.0.3","TCP","56","9002 → 43520 [ACK] Seq=300565 Ack=18890 Win=65535 Len=0"
"6.396783","5.9.29.183","172.19.0.3","TCP","1504","[TCP segment of a reassembled PDU]"
"6.396850","5.9.29.183","172.19.0.3","TCP","1516","9002 → 43520 [PSH, ACK] Seq=302013 Ack=18890 Win=65535 Len=1460 [TCP segment of a reassembled PDU]"
"6.396858","5.9.29.183","172.19.0.3","TLSv1.2","775","Application Data"
"6.396958","172.19.0.3","5.9.29.183","TCP","56","43520 → 9002 [ACK] Seq=18890 Ack=304192 Win=11895 Len=0"
"6.410475","5.9.29.183","172.19.0.3","TCP","1516","[TCP segment of a reassembled PDU]"
"6.410520","5.9.29.183","172.19.0.3","TCP","1492","9002 → 43520 [PSH, ACK] Seq=305652 Ack=18890 Win=65535 Len=1436 [TCP segment of a reassembled PDU]"
"6.410533","172.19.0.3","5.9.29.183","TCP","56","43520 → 9002 [ACK] Seq=18890 Ack=307088 Win=11903 Len=0"
"6.417070","5.9.29.183","172.19.0.3","TLSv1.2","787","Application Data"
"6.453238","5.9.29.183","172.19.0.3","TCP","1516","[TCP segment of a reassembled PDU]"
"6.453262","172.19.0.3","5.9.29.183","TCP","56","43520 → 9002 [ACK] Seq=18890 Ack=309279 Win=11911 Len=0"
"6.453326","5.9.29.183","172.19.0.3","TLSv1.2","167","Application Data"
"6.457460","172.19.0.3","5.9.29.183","TLSv1.2","599","Application Data"
"6.457748","5.9.29.183","172.19.0.3","TCP","56","9002 → 43520 [ACK] Seq=309390 Ack=19433 Win=65535 Len=0"
"6.761801","5.9.29.183","172.19.0.3","TLSv1.2","599","Application Data"
"6.762334","172.19.0.3","5.9.29.183","TLSv1.2","599","Application Data"
"6.762512","5.9.29.183","172.19.0.3","TCP","56","9002 → 43520 [ACK] Seq=309933 Ack=19976 Win=65535 Len=0"
"6.985438","5.9.29.183","172.19.0.3","TLSv1.2","599","Application Data"
"7.026245","172.19.0.3","5.9.29.183","TCP","56","43520 → 9002 [ACK] Seq=19976 Ack=310476 Win=11911 Len=0"
"7.056465","5.9.29.183","172.19.0.3","TCP","1516","[TCP segment of a reassembled PDU]"
"7.056521","172.19.0.3","5.9.29.183","TCP","56","43520 → 9002 [ACK] Seq=19976 Ack=311936 Win=11911 Len=0"
"7.056571","5.9.29.183","172.19.0.3","TCP","1492","9002 → 43520 [PSH, ACK] Seq=311936 Ack=19976 Win=65535 Len=1436 [TCP segment of a reassembled PDU]"
"7.056588","172.19.0.3","5.9.29.183","TCP","56","43520 → 9002 [ACK] Seq=19976 Ack=313372 Win=11903 Len=0"
"7.056590","5.9.29.183","172.19.0.3","TLSv1.2","1516","Application Data [TCP segment of a reassembled PDU]"
"7.056595","172.19.0.3","5.9.29.183","TCP","56","43520 → 9002 [ACK] Seq=19976 Ack=314832 Win=11895 Len=0"
"7.056597","5.9.29.183","172.19.0.3","TCP","1516","9002 → 43520 [PSH, ACK] Seq=314832 Ack=19976 Win=65535 Len=1460 [TCP segment of a reassembled PDU]"
"7.056603","172.19.0.3","5.9.29.183","TCP","56","43520 → 9002 [ACK] Seq=19976 Ack=316292 Win=11887 Len=0"
"7.056693","5.9.29.183","172.19.0.3","TCP","1213","9002 → 43520 [PSH, ACK] Seq=316292 Ack=19976 Win=65535 Len=1157 [TCP segment of a reassembled PDU]"
"7.056701","172.19.0.3","5.9.29.183","TCP","56","43520 → 9002 [ACK] Seq=19976 Ack=317449 Win=11879 Len=0"
"7.080254","5.9.29.183","172.19.0.3","TLSv1.2","337","Application Data"
"7.080275","172.19.0.3","5.9.29.183","TCP","56","43520 → 9002 [ACK] Seq=19976 Ack=317730 Win=11911 Len=0"
"7.081359","5.9.29.183","172.19.0.3","TCP","1516","[TCP segment of a reassembled PDU]"
"7.081367","172.19.0.3","5.9.29.183","TCP","56","43520 → 9002 [ACK] Seq=19976 Ack=319190 Win=11911 Len=0"
"7.081400","5.9.29.183","172.19.0.3","TCP","1492","9002 → 43520 [PSH, ACK] Seq=319190 Ack=19976 Win=65535 Len=1436 [TCP segment of a reassembled PDU]"
"7.081409","172.19.0.3","5.9.29.183","TCP","56","43520 → 9002 [ACK] Seq=19976 Ack=320626 Win=11903 Len=0"
"7.093771","5.9.29.183","172.19.0.3","TLSv1.2","1516","Application Data [TCP segment of a reassembled PDU]"
"7.093811","172.19.0.3","5.9.29.183","TCP","56","43520 → 9002 [ACK] Seq=19976 Ack=322086 Win=11911 Len=0"
"7.093841","5.9.29.183","172.19.0.3","TCP","1198","9002 → 43520 [PSH, ACK] Seq=322086 Ack=19976 Win=65535 Len=1142 [TCP segment of a reassembled PDU]"
"7.093850","172.19.0.3","5.9.29.183","TCP","56","43520 → 9002 [ACK] Seq=19976 Ack=323228 Win=11903 Len=0"
"7.093949","5.9.29.183","172.19.0.3","TCP","1516","9002 → 43520 [PSH, ACK] Seq=323228 Ack=19976 Win=65535 Len=1460 [TCP segment of a reassembled PDU]"
"7.093956","172.19.0.3","5.9.29.183","TCP","56","43520 → 9002 [ACK] Seq=19976 Ack=324688 Win=11893 Len=0"
"7.093958","5.9.29.183","172.19.0.3","TLSv1.2","1516","Application Data [TCP segment of a reassembled PDU]"
"7.093961","172.19.0.3","5.9.29.183","TCP","56","43520 → 9002 [ACK] Seq=19976 Ack=326148 Win=11885 Len=0"
"7.093962","5.9.29.183","172.19.0.3","TCP","1516","9002 → 43520 [PSH, ACK] Seq=326148 Ack=19976 Win=65535 Len=1460 [TCP segment of a reassembled PDU]"
"7.093965","172.19.0.3","5.9.29.183","TCP","56","43520 → 9002 [ACK] Seq=19976 Ack=327608 Win=11877 Len=0"
"7.093966","5.9.29.183","172.19.0.3","TCP","1516","9002 → 43520 [PSH, ACK] Seq=327608 Ack=19976 Win=65535 Len=1460 [TCP segment of a reassembled PDU]"
"7.093972","172.19.0.3","5.9.29.183","TCP","56","43520 → 9002 [ACK] Seq=19976 Ack=329068 Win=11869 Len=0"
"7.093973","5.9.29.183","172.19.0.3","TLSv1.2","1516","Application Data [TCP segment of a reassembled PDU]"
"7.093976","172.19.0.3","5.9.29.183","TCP","56","43520 → 9002 [ACK] Seq=19976 Ack=330528 Win=11861 Len=0"
"7.093977","5.9.29.183","172.19.0.3","TCP","290","9002 → 43520 [PSH, ACK] Seq=330528 Ack=19976 Win=65535 Len=234 [TCP segment of a reassembled PDU]"
"7.094327","172.19.0.3","5.9.29.183","TCP","56","43520 → 9002 [ACK] Seq=19976 Ack=330762 Win=11911 Len=0"
"7.103517","5.9.29.183","172.19.0.3","TCP","1516","9002 → 43520 [PSH, ACK] Seq=330762 Ack=19976 Win=65535 Len=1460 [TCP segment of a reassembled PDU]"
"7.103546","5.9.29.183","172.19.0.3","TLSv1.2","1492","Application Data [TCP segment of a reassembled PDU]"
"7.103551","5.9.29.183","172.19.0.3","TLSv1.2","207","Application Data"
"7.103592","172.19.0.3","5.9.29.183","TCP","56","43520 → 9002 [ACK] Seq=19976 Ack=333809 Win=11895 Len=0"
"7.117186","5.9.29.183","172.19.0.3","TCP","1516","[TCP segment of a reassembled PDU]"
"7.117229","5.9.29.183","172.19.0.3","TCP","1516","9002 → 43520 [PSH, ACK] Seq=335269 Ack=19976 Win=65535 Len=1460 [TCP segment of a reassembled PDU]"
"7.117240","172.19.0.3","5.9.29.183","TCP","56","43520 → 9002 [ACK] Seq=19976 Ack=336729 Win=11903 Len=0"
"7.117408","5.9.29.183","172.19.0.3","TLSv1.2","1516","Application Data [TCP segment of a reassembled PDU]"
"7.117458","5.9.29.183","172.19.0.3","TCP","1468","9002 → 43520 [PSH, ACK] Seq=338189 Ack=19976 Win=65535 Len=1412 [TCP segment of a reassembled PDU]"
"7.117467","172.19.0.3","5.9.29.183","TCP","56","43520 → 9002 [ACK] Seq=19976 Ack=339601 Win=11903 Len=0"
"7.117501","5.9.29.183","172.19.0.3","TCP","1504","9002 → 43520 [PSH, ACK] Seq=339601 Ack=19976 Win=65535 Len=1448 [TCP segment of a reassembled PDU]"
"7.117624","172.19.0.3","5.9.29.183","TLSv1.2","599","Application Data"
"7.117811","5.9.29.183","172.19.0.3","TCP","56","9002 → 43520 [ACK] Seq=341049 Ack=20519 Win=65535 Len=0"
"7.129550","5.9.29.183","172.19.0.3","TLSv1.2","1127","Application Data, Application Data"
"7.131141","5.9.29.183","172.19.0.3","TCP","1516","[TCP segment of a reassembled PDU]"
"7.131158","172.19.0.3","5.9.29.183","TCP","56","43520 → 9002 [ACK] Seq=20519 Ack=343580 Win=11911 Len=0"
"7.131191","5.9.29.183","172.19.0.3","TCP","1492","9002 → 43520 [PSH, ACK] Seq=343580 Ack=20519 Win=65535 Len=1436 [TCP segment of a reassembled PDU]"
"7.145555","5.9.29.183","172.19.0.3","TLSv1.2","1330","Application Data, Application Data"
"7.145573","172.19.0.3","5.9.29.183","TCP","56","43520 → 9002 [ACK] Seq=20519 Ack=346290 Win=11911 Len=0"
"7.206913","5.9.29.183","172.19.0.3","TCP","1516","[TCP segment of a reassembled PDU]"
"7.206957","5.9.29.183","172.19.0.3","TCP","1516","9002 → 43520 [PSH, ACK] Seq=347750 Ack=20519 Win=65535 Len=1460 [TCP segment of a reassembled PDU]"
"7.206965","5.9.29.183","172.19.0.3","TLSv1.2","1516","Application Data [TCP segment of a reassembled PDU]"
"7.206967","5.9.29.183","172.19.0.3","TCP","1201","9002 → 43520 [PSH, ACK] Seq=350670 Ack=20519 Win=65535 Len=1145 [TCP segment of a reassembled PDU]"
"7.206969","5.9.29.183","172.19.0.3","TCP","1504","9002 → 43520 [PSH, ACK] Seq=351815 Ack=20519 Win=65535 Len=1448 [TCP segment of a reassembled PDU]"
"7.207091","172.19.0.3","5.9.29.183","TCP","56","43520 → 9002 [ACK] Seq=20519 Ack=353263 Win=11879 Len=0"
"7.207296","172.19.0.3","5.9.29.183","TLSv1.2","599","Application Data"
"7.207456","5.9.29.183","172.19.0.3","TCP","56","9002 → 43520 [ACK] Seq=353263 Ack=21062 Win=65535 Len=0"
"7.231694","5.9.29.183","172.19.0.3","TLSv1.2","1516","Application Data, Application Data"
"7.231748","5.9.29.183","172.19.0.3","TCP","1516","9002 → 43520 [PSH, ACK] Seq=354723 Ack=21062 Win=65535 Len=1460 [TCP segment of a reassembled PDU]"
"7.231766","172.19.0.3","5.9.29.183","TCP","56","43520 → 9002 [ACK] Seq=21062 Ack=356183 Win=11903 Len=0"
"7.231769","5.9.29.183","172.19.0.3","TCP","1370","9002 → 43520 [PSH, ACK] Seq=356183 Ack=21062 Win=65535 Len=1314 [TCP segment of a reassembled PDU]"
"7.248631","5.9.29.183","172.19.0.3","TLSv1.2","1330","Application Data, Application Data"
"7.248654","172.19.0.3","5.9.29.183","TCP","56","43520 → 9002 [ACK] Seq=21062 Ack=358771 Win=11911 Len=0"
"7.252757","172.19.0.3","5.9.29.183","TLSv1.2","599","Application Data"
"7.253020","5.9.29.183","172.19.0.3","TCP","56","9002 → 43520 [ACK] Seq=358771 Ack=21605 Win=65535 Len=0"
"7.597465","5.9.29.183","172.19.0.3","TLSv1.2","599","Application Data"
"7.597999","172.19.0.3","5.9.29.183","TLSv1.2","599","Application Data"
"7.598205","5.9.29.183","172.19.0.3","TCP","56","9002 → 43520 [ACK] Seq=359314 Ack=22148 Win=65535 Len=0"
"7.868056","5.9.29.183","172.19.0.3","TCP","1504","[TCP segment of a reassembled PDU]"
"7.868163","5.9.29.183","172.19.0.3","TCP","1504","9002 → 43520 [PSH, ACK] Seq=360762 Ack=22148 Win=65535 Len=1448 [TCP segment of a reassembled PDU]"
"7.868174","5.9.29.183","172.19.0.3","TLSv1.2","1237","Application Data"
"7.868178","5.9.29.183","172.19.0.3","TCP","1504","[TCP segment of a reassembled PDU]"
"7.868181","5.9.29.183","172.19.0.3","TCP","1504","9002 → 43520 [PSH, ACK] Seq=364839 Ack=22148 Win=65535 Len=1448 [TCP segment of a reassembled PDU]"
"7.868206","5.9.29.183","172.19.0.3","TLSv1.2","1504","Application Data [TCP segment of a reassembled PDU]"
"7.868209","5.9.29.183","172.19.0.3","TCP","1504","9002 → 43520 [PSH, ACK] Seq=367735 Ack=22148 Win=65535 Len=1448 [TCP segment of a reassembled PDU]"
"7.868211","5.9.29.183","172.19.0.3","TCP","1504","9002 → 43520 [PSH, ACK] Seq=369183 Ack=22148 Win=65535 Len=1448 [TCP segment of a reassembled PDU]"
"7.868306","172.19.0.3","5.9.29.183","TCP","56","43520 → 9002 [ACK] Seq=22148 Ack=370631 Win=11855 Len=0"
"7.883977","5.9.29.183","172.19.0.3","TLSv1.2","648","Application Data"
"7.908547","5.9.29.183","172.19.0.3","TLSv1.2","599","Application Data"
"7.908702","172.19.0.3","5.9.29.183","TCP","56","43520 → 9002 [ACK] Seq=22148 Ack=371766 Win=11911 Len=0"
"7.944741","5.9.29.183","172.19.0.3","TCP","1516","[TCP segment of a reassembled PDU]"
"7.944784","5.9.29.183","172.19.0.3","TLSv1.2","681","Application Data"
"7.944891","172.19.0.3","5.9.29.183","TCP","56","43520 → 9002 [ACK] Seq=22148 Ack=373851 Win=11903 Len=0"
"7.948235","172.19.0.3","5.9.29.183","TLSv1.2","599","Application Data"
"7.948506","5.9.29.183","172.19.0.3","TCP","56","9002 → 43520 [ACK] Seq=373851 Ack=22691 Win=65535 Len=0"
"8.217369","5.9.29.183","172.19.0.3","TLSv1.2","599","Application Data"
"8.217886","172.19.0.3","5.9.29.183","TLSv1.2","599","Application Data"
"8.218075","5.9.29.183","172.19.0.3","TCP","56","9002 → 43520 [ACK] Seq=374394 Ack=23234 Win=65535 Len=0"
"8.569859","5.9.29.183","172.19.0.3","TCP","1516","[TCP segment of a reassembled PDU]"
"8.569938","5.9.29.183","172.19.0.3","TCP","1516","9002 → 43520 [PSH, ACK] Seq=375854 Ack=23234 Win=65535 Len=1460 [TCP segment of a reassembled PDU]"
"8.569946","5.9.29.183","172.19.0.3","TLSv1.2","763","Application Data"
"8.570068","172.19.0.3","5.9.29.183","TCP","56","43520 → 9002 [ACK] Seq=23234 Ack=378021 Win=11895 Len=0"
"8.588525","5.9.29.183","172.19.0.3","TCP","1516","[TCP segment of a reassembled PDU]"
"8.588570","5.9.29.183","172.19.0.3","TCP","1492","9002 → 43520 [PSH, ACK] Seq=379481 Ack=23234 Win=65535 Len=1436 [TCP segment of a reassembled PDU]"
"8.588583","172.19.0.3","5.9.29.183","TCP","56","43520 → 9002 [ACK] Seq=23234 Ack=380917 Win=11903 Len=0"
"8.597348","5.9.29.183","172.19.0.3","TLSv1.2","787","Application Data"
"8.598180","5.9.29.183","172.19.0.3","TCP","1504","[TCP segment of a reassembled PDU]"
"8.598188","172.19.0.3","5.9.29.183","TCP","56","43520 → 9002 [ACK] Seq=23234 Ack=383096 Win=11911 Len=0"
"8.616195","5.9.29.183","172.19.0.3","TLSv1.2","179","Application Data"
"8.656744","172.19.0.3","5.9.29.183","TCP","56","43520 → 9002 [ACK] Seq=23234 Ack=383219 Win=11911 Len=0"
