_ws.col.Time,_ws.col.Source,_ws.col.Destination,_ws.col.Protocol,_ws.col.Length,_ws.col.Info
"0.000000","172.19.0.3","5.9.29.183","TLSv1.2","599","Application Data"
"0.000320","5.9.29.183","172.19.0.3","TCP","56","9002 → 43520 [ACK] Seq=1 Ack=544 Win=65535 Len=0"
"0.315879","5.9.29.183","172.19.0.3","TLSv1.2","599","Application Data"
"0.316902","172.19.0.3","5.9.29.183","TLSv1.2","2141","Application Data"
"0.317305","5.9.29.183","172.19.0.3","TCP","56","9002 → 43520 [ACK] Seq=544 Ack=2629 Win=65535 Len=0"
"0.871410","5.9.29.183","172.19.0.3","TCP","1516","[TCP segment of a reassembled PDU]"
"0.871559","5.9.29.183","172.19.0.3","TLSv1.2","167","Application Data"
"0.871874","172.19.0.3","5.9.29.183","TCP","56","43520 → 9002 [ACK] Seq=2629 Ack=2115 Win=11903 Len=0"
"0.879007","172.19.0.3","5.9.29.183","TLSv1.2","599","Application Data"
"0.879484","5.9.29.183","172.19.0.3","TCP","56","9002 → 43520 [ACK] Seq=2115 Ack=3172 Win=65535 Len=0"
"1.184754","5.9.29.183","172.19.0.3","TLSv1.2","599","Application Data"
"1.185693","172.19.0.3","5.9.29.183","TLSv1.2","599","Application Data"
"1.186030","5.9.29.183","172.19.0.3","TCP","56","9002 → 43520 [ACK] Seq=2658 Ack=3715 Win=65535 Len=0"
"1.583416","5.9.29.183","172.19.0.3","TLSv1.2","599","Application Data"
"1.597180","5.9.29.183","172.19.0.3","TCP","1516","[TCP segment of a reassembled PDU]"
"1.597241","172.19.0.3","5.9.29.183","TCP","56","43520 → 9002 [ACK] Seq=3715 Ack=4661 Win=11911 Len=0"
"1.597304","5.9.29.183","172.19.0.3","TCP","1492","9002 → 43520 [PSH, ACK] Seq=4661 Ack=3715 Win=65535 Len=1436 [TCP segment of a reassembled PDU]"
"1.597335","5.9.29.183","172.19.0.3","TLSv1.2","1516","Application Data [TCP segment of a reassembled PDU]"
"1.597340","5.9.29.183","172.19.0.3","TCP","1516","9002 → 43520 [PSH, ACK] Seq=7557 Ack=3715 Win=65535 Len=1460 [TCP segment of a reassembled PDU]"
"1.597431","5.9.29.183","172.19.0.3","TCP","1480","9002 → 43520 [PSH, ACK] Seq=9017 Ack=3715 Win=65535 Len=1424 [TCP segment of a reassembled PDU]"
"1.597571","172.19.0.3","5.9.29.183","TCP","56","43520 → 9002 [ACK] Seq=3715 Ack=10441 Win=11879 Len=0"
"1.598465","5.9.29.183","172.19.0.3","TLSv1.2","70","Application Data"
"1.612948","5.9.29.183","172.19.0.3","TCP","1516","[TCP segment of a reassembled PDU]"
"1.612973","172.19.0.3","5.9.29.183","TCP","56","43520 → 9002 [ACK] Seq=3715 Ack=11915 Win=11911 Len=0"
"1.613023","5.9.29.183","172.19.0.3","TCP","1492","9002 → 43520 [PSH, ACK] Seq=11915 Ack=3715 Win=65535 Len=1436 [TCP segment of a reassembled PDU]"
"1.613034","5.9.29.183","172.19.0.3","TLSv1.2","1504","Application Data [TCP segment of a reassembled PDU]"
"1.613308","172.19.0.3","5.9.29.183","TCP","56","43520 → 9002 [ACK] Seq=3715 Ack=14799 Win=11893 Len=0"
"1.613533","5.9.29.183","172.19.0.3","TLSv1.2","396","Application Data"
"1.629365","5.9.29.183","172.19.0.3","TCP","1504","[TCP segment of a reassembled PDU]"
"1.629384","172.19.0.3","5.9.29.183","TCP","56","43520 → 9002 [ACK] Seq=3715 Ack=16587 Win=11911 Len=0"
"1.629568","5.9.29.183","172.19.0.3","TCP","1516","9002 → 43520 [PSH, ACK] Seq=16587 Ack=3715 Win=65535 Len=1460 [TCP segment of a reassembled PDU]"
"1.629574","5.9.29.183","172.19.0.3","TLSv1.2","1516","Application Data [TCP segment of a reassembled PDU]"
"1.629577","5.9.29.183","172.19.0.3","TCP","1516","9002 → 43520 [PSH, ACK] Seq=19507 Ack=3715 Win=65535 Len=1460 [TCP segment of a reassembled PDU]"
"1.629579","5.9.29.183","172.19.0.3","TCP","1201","9002 → 43520 [PSH, ACK] Seq=20967 Ack=3715 Win=65535 Len=1145 [TCP segment of a reassembled PDU]"
"1.629580","5.9.29.183","172.19.0.3","TLSv1.2","1516","Application Data [TCP segment of a reassembled PDU]"
"1.629582","5.9.29.183","172.19.0.3","TCP","1516","9002 → 43520 [PSH, ACK] Seq=23572 Ack=3715 Win=65535 Len=1460 [TCP segment of a reassembled PDU]"
"1.629589","5.9.29.183","172.19.0.3","TCP","1516","9002 → 43520 [PSH, ACK] Seq=25032 Ack=3715 Win=65535 Len=1460 [TCP segment of a reassembled PDU]"
"1.629590","172.19.0.3","5.9.29.183","TCP","56","43520 → 9002 [ACK] Seq=3715 Ack=19507 Win=11903 Len=0"
"1.629691","5.9.29.183","172.19.0.3","TLSv1.2","1516","Application Data [TCP segment of a reassembled PDU]"
"1.629697","5.9.29.183","172.19.0.3","TCP","1456","9002 → 43520 [PSH, ACK] Seq=27952 Ack=3715 Win=65535 Len=1400 [TCP segment of a reassembled PDU]"
"1.629773","172.19.0.3","5.9.29.183","TCP","56","43520 → 9002 [ACK] Seq=3715 Ack=29352 Win=11847 Len=0"
"1.644617","5.9.29.183","172.19.0.3","TLSv1.2","1379","Application Data"
"1.644930","172.19.0.3","5.9.29.183","TLSv1.2","1113","Application Data"
"1.645140","5.9.29.183","172.19.0.3","TCP","56","9002 → 43520 [ACK] Seq=30675 Ack=4772 Win=65535 Len=0"
"1.646552","5.9.29.183","172.19.0.3","TCP","1504","[TCP segment of a reassembled PDU]"
"1.646695","5.9.29.183","172.19.0.3","TCP","1504","9002 → 43520 [PSH, ACK] Seq=32123 Ack=4772 Win=65535 Len=1448 [TCP segment of a reassembled PDU]"
"1.646707","172.19.0.3","5.9.29.183","TCP","56","43520 → 9002 [ACK] Seq=4772 Ack=33571 Win=11911 Len=0"
"1.646791","5.9.29.183","172.19.0.3","TLSv1.2","1516","Application Data [TCP segment of a reassembled PDU]"
"1.646848","5.9.29.183","172.19.0.3","TCP","1492","9002 → 43520 [PSH, ACK] Seq=35031 Ack=4772 Win=65535 Len=1436 [TCP segment of a reassembled PDU]"
"1.646874","5.9.29.183","172.19.0.3","TCP","1516","9002 → 43520 [PSH, ACK] Seq=36467 Ack=4772 Win=65535 Len=1460 [TCP segment of a reassembled PDU]"
"1.646877","5.9.29.183","172.19.0.3","TLSv1.2","1516","Application Data [TCP segment of a reassembled PDU]"
"1.646879","5.9.29.183","172.19.0.3","TCP","1480","9002 → 43520 [PSH, ACK] Seq=39387 Ack=4772 Win=65535 Len=1424 [TCP segment of a reassembled PDU]"
"1.646889","172.19.0.3","5.9.29.183","TCP","56","43520 → 9002 [ACK] Seq=4772 Ack=39387 Win=11887 Len=0"
"1.659785","5.9.29.183","172.19.0.3","TLSv1.2","287","Application Data"
"1.659809","172.19.0.3","5.9.29.183","TCP","56","43520 → 9002 [ACK] Seq=4772 Ack=41042 Win=11909 Len=0"
"1.683374","5.9.29.183","172.19.0.3","TCP","1516","[TCP segment of a reassembled PDU]"
"1.683481","5.9.29.183","172.19.0.3","TCP","1516","9002 → 43520 [PSH, ACK] Seq=42502 Ack=4772 Win=65535 Len=1460 [TCP segment of a reassembled PDU]"
"1.683493","5.9.29.183","172.19.0.3","TLSv1.2","1213","Application Data"
"1.683499","5.9.29.183","172.19.0.3","TCP","1516","[TCP segment of a reassembled PDU]"
"1.683503","5.9.29.183","172.19.0.3","TCP","1516","9002 → 43520 [PSH, ACK] Seq=46579 Ack=4772 Win=65535 Len=1460 [TCP segment of a reassembled PDU]"
"1.683541","5.9.29.183","172.19.0.3","TLSv1.2","1516","Application Data [TCP segment of a reassembled PDU]"
"1.683546","5.9.29.183","172.19.0.3","TCP","1516","9002 → 43520 [PSH, ACK] Seq=49499 Ack=4772 Win=65535 Len=1460 [TCP segment of a reassembled PDU]"
"1.683549","5.9.29.183","172.19.0.3","TCP","1516","9002 → 43520 [PSH, ACK] Seq=50959 Ack=4772 Win=65535 Len=1460 [TCP segment of a reassembled PDU]"
"1.683697","5.9.29.183","172.19.0.3","TLSv1.2","1516","Application Data [TCP segment of a reassembled PDU]"
"1.683705","5.9.29.183","172.19.0.3","TCP","1516","9002 → 43520 [PSH, ACK] Seq=53879 Ack=4772 Win=65535 Len=1460 [TCP segment of a reassembled PDU]"
"1.683757","172.19.0.3","5.9.29.183","TCP","56","43520 → 9002 [ACK] Seq=4772 Ack=55339 Win=11838 Len=0"
"1.684095","5.9.29.183","172.19.0.3","TCP","1420","9002 → 43520 [PSH, ACK] Seq=55339 Ack=4772 Win=65535 Len=1364 [TCP segment of a reassembled PDU]"
"1.698262","5.9.29.183","172.19.0.3","TLSv1.2","445","Application Data"
"1.698287","172.19.0.3","5.9.29.183","TCP","56","43520 → 9002 [ACK] Seq=4772 Ack=57092 Win=11911 Len=0"
"1.698735","172.19.0.3","5.9.29.183","TLSv1.2","599","Application Data"
"1.699042","5.9.29.183","172.19.0.3","TCP","56","9002 → 43520 [ACK] Seq=57092 Ack=5315 Win=65535 Len=0"
"1.700176","5.9.29.183","172.19.0.3","TCP","1504","[TCP segment of a reassembled PDU]"
"1.700231","5.9.29.183","172.19.0.3","TCP","1416","9002 → 43520 [PSH, ACK] Seq=58540 Ack=5315 Win=65535 Len=1360 [TCP segment of a reassembled PDU]"
"1.700297","5.9.29.183","172.19.0.3","TLSv1.2","1516","Application Data [TCP segment of a reassembled PDU]"
"1.700302","5.9.29.183","172.19.0.3","TCP","1516","9002 → 43520 [PSH, ACK] Seq=61360 Ack=5315 Win=65535 Len=1460 [TCP segment of a reassembled PDU]"
"1.700393","172.19.0.3","5.9.29.183","TCP","56","43520 → 9002 [ACK] Seq=5315 Ack=62820 Win=11887 Len=0"
"1.700420","5.9.29.183","172.19.0.3","TCP","1516","9002 → 43520 [PSH, ACK] Seq=62820 Ack=5315 Win=65535 Len=1460 [TCP segment of a reassembled PDU]"
"1.700424","5.9.29.183","172.19.0.3","TCP","108","9002 → 43520 [PSH, ACK] Seq=64280 Ack=5315 Win=65535 Len=52 [TCP segment of a reassembled PDU]"
"1.700474","5.9.29.183","172.19.0.3","TLSv1.2","1504","Application Data [TCP segment of a reassembled PDU]"
"1.700479","172.19.0.3","5.9.29.183","TCP","56","43520 → 9002 [ACK] Seq=5315 Ack=64332 Win=11877 Len=0"
"1.713786","5.9.29.183","172.19.0.3","TLSv1.2","707","Application Data"
"1.713812","172.19.0.3","5.9.29.183","TCP","56","43520 → 9002 [ACK] Seq=5315 Ack=66431 Win=11909 Len=0"
"1.719778","172.19.0.3","5.9.29.183","TLSv1.2","599","Application Data"
"1.720255","5.9.29.183","172.19.0.3","TCP","56","9002 → 43520 [ACK] Seq=66431 Ack=5858 Win=65535 Len=0"
"2.143725","5.9.29.183","172.19.0.3","TLSv1.2","599","Application Data"
"2.144416","172.19.0.3","5.9.29.183","TLSv1.2","599","Application Data"
"2.144943","5.9.29.183","172.19.0.3","TCP","56","9002 → 43520 [ACK] Seq=66974 Ack=6401 Win=65535 Len=0"
"2.574208","5.9.29.183","172.19.0.3","TCP","1516","[TCP segment of a reassembled PDU]"
"2.574320","5.9.29.183","172.19.0.3","TCP","1492","9002 → 43520 [PSH, ACK] Seq=68434 Ack=6401 Win=65535 Len=1436 [TCP segment of a reassembled PDU]"
"2.574334","5.9.29.183","172.19.0.3","TLSv1.2","1516","Application Data [TCP segment of a reassembled PDU]"
"2.574340","5.9.29.183","172.19.0.3","TCP","1516","9002 → 43520 [PSH, ACK] Seq=71330 Ack=6401 Win=65535 Len=1460 [TCP segment of a reassembled PDU]"
"2.574343","5.9.29.183","172.19.0.3","TCP","1213","9002 → 43520 [PSH, ACK] Seq=72790 Ack=6401 Win=65535 Len=1157 [TCP segment of a reassembled PDU]"
"2.574518","172.19.0.3","5.9.29.183","TCP","56","43520 → 9002 [ACK] Seq=6401 Ack=73947 Win=11877 Len=0"
"2.589805","5.9.29.183","172.19.0.3","TLSv1.2","337","Application Data"
"2.590525","5.9.29.183","172.19.0.3","TCP","1516","[TCP segment of a reassembled PDU]"
"2.590538","172.19.0.3","5.9.29.183","TCP","56","43520 → 9002 [ACK] Seq=6401 Ack=75688 Win=11911 Len=0"
"2.590548","5.9.29.183","172.19.0.3","TCP","1492","9002 → 43520 [PSH, ACK] Seq=75688 Ack=6401 Win=65535 Len=1436 [TCP segment of a reassembled PDU]"
"2.590554","5.9.29.183","172.19.0.3","TLSv1.2","1516","Application Data [TCP segment of a reassembled PDU]"
"2.590557","5.9.29.183","172.19.0.3","TCP","1516","9002 → 43520 [PSH, ACK] Seq=78584 Ack=6401 Win=65535 Len=1460 [TCP segment of a reassembled PDU]"
"2.590762","5.9.29.183","172.19.0.3","TCP","1516","9002 → 43520 [PSH, ACK] Seq=80044 Ack=6401 Win=65535 Len=1460 [TCP segment of a reassembled PDU]"
"2.590774","5.9.29.183","172.19.0.3","TLSv1.2","1516","Application Data [TCP segment of a reassembled PDU]"
"2.590779","5.9.29.183","172.19.0.3","TCP","1516","9002 → 43520 [PSH, ACK] Seq=82964 Ack=6401 Win=65535 Len=1460 [TCP segment of a reassembled PDU]"
"2.590783","5.9.29.183","172.19.0.3","TCP","1444","9002 → 43520 [PSH, ACK] Seq=84424 Ack=6401 Win=65535 Len=1388 [TCP segment of a reassembled PDU]"
"2.590827","172.19.0.3","5.9.29.183","TCP","56","43520 → 9002 [ACK] Seq=6401 Ack=85812 Win=11855 Len=0"
"2.591255","172.19.0.3","5.9.29.183","TLSv1.2","599","Application Data"
"2.591475","5.9.29.183","172.19.0.3","TCP","56","9002 → 43520 [ACK] Seq=85812 Ack=6944 Win=65535 Len=0"
"2.604769","5.9.29.183","172.19.0.3","TLSv1.2","1438","Application Data, Application Data"
"2.624127","5.9.29.183","172.19.0.3","TCP","1504","[TCP segment of a reassembled PDU]"
"2.624145","172.19.0.3","5.9.29.183","TCP","56","43520 → 9002 [ACK] Seq=6944 Ack=88642 Win=11911 Len=0"
"2.624155","5.9.29.183","172.19.0.3","TCP","1516","9002 → 43520 [PSH, ACK] Seq=88642 Ack=6944 Win=65535 Len=1460 [TCP segment of a reassembled PDU]"
"2.624160","5.9.29.183","172.19.0.3","TLSv1.2","1225","Application Data"
"2.624284","172.19.0.3","5.9.29.183","TCP","56","43520 → 9002 [ACK] Seq=6944 Ack=91271 Win=11895 Len=0"
"2.624435","5.9.29.183","172.19.0.3","TCP","1516","[TCP segment of a reassembled PDU]"
"2.624439","5.9.29.183","172.19.0.3","TCP","1516","9002 → 43520 [PSH, ACK] Seq=92731 Ack=6944 Win=65535 Len=1460 [TCP segment of a reassembled PDU]"
"2.624443","172.19.0.3","5.9.29.183","TCP","56","43520 → 9002 [ACK] Seq=6944 Ack=94191 Win=11903 Len=0"
"2.624506","5.9.29.183","172.19.0.3","TLSv1.2","1516","Application Data [TCP segment of a reassembled PDU]"
"2.624510","5.9.29.183","172.19.0.3","TCP","1516","9002 → 43520 [PSH, ACK] Seq=95651 Ack=6944 Win=65535 Len=1460 [TCP segment of a reassembled PDU]"
"2.624512","5.9.29.183","172.19.0.3","TCP","1516","9002 → 43520 [PSH, ACK] Seq=97111 Ack=6944 Win=65535 Len=1460 [TCP segment of a reassembled PDU]"
"2.624564","5.9.29.183","172.19.0.3","TLSv1.2","1516","Application Data [TCP segment of a reassembled PDU]"
"2.624568","5.9.29.183","172.19.0.3","TCP","1432","9002 → 43520 [PSH, ACK] Seq=100031 Ack=6944 Win=65535 Len=1376 [TCP segment of a reassembled PDU]"
"2.624603","172.19.0.3","5.9.29.183","TCP","56","43520 → 9002 [ACK] Seq=6944 Ack=101407 Win=11861 Len=0"
"2.624755","172.19.0.3","5.9.29.183","TLSv1.2","599","Application Data"
"2.625087","5.9.29.183","172.19.0.3","TCP","56","9002 → 43520 [ACK] Seq=101407 Ack=7487 Win=65535 Len=0"
"2.639528","5.9.29.183","172.19.0.3","TLSv1.2","865","Application Data"
"2.666610","5.9.29.183","172.19.0.3","TCP","1516","[TCP segment of a reassembled PDU]"
"2.666636","172.19.0.3","5.9.29.183","TCP","56","43520 → 9002 [ACK] Seq=7487 Ack=103676 Win=11911 Len=0"
"2.666654","5.9.29.183","172.19.0.3","TLSv1.2","1195","Application Data"
"2.671226","172.19.0.3","5.9.29.183","TLSv1.2","599","Application Data"
"2.671489","5.9.29.183","172.19.0.3","TCP","56","9002 → 43520 [ACK] Seq=104815 Ack=8030 Win=65535 Len=0"
"3.006381","5.9.29.183","172.19.0.3","TLSv1.2","599","Application Data"
"3.006928","172.19.0.3","5.9.29.183","TLSv1.2","599","Application Data"
"3.007230","5.9.29.183","172.19.0.3","TCP","56","9002 → 43520 [ACK] Seq=105358 Ack=8573 Win=65535 Len=0"
"3.396360","5.9.29.183","172.19.0.3","TCP","1516","[TCP segment of a reassembled PDU]"
"3.396389","5.9.29.183","172.19.0.3","TCP","1492","9002 → 43520 [PSH, ACK] Seq=106818 Ack=8573 Win=65535 Len=1436 [TCP segment of a reassembled PDU]"
"3.396396","5.9.29.183","172.19.0.3","TLSv1.2","787","Application Data"
"3.396506","172.19.0.3","5.9.29.183","TCP","56","43520 → 9002 [ACK] Seq=8573 Ack=108985 Win=11895 Len=0"
"3.412211","5.9.29.183","172.19.0.3","TCP","1516","[TCP segment of a reassembled PDU]"
"3.412242","5.9.29.183","172.19.0.3","TCP","1492","9002 → 43520 [PSH, ACK] Seq=110445 Ack=8573 Win=65535 Len=1436 [TCP segment of a reassembled PDU]"
"3.412257","172.19.0.3","5.9.29.183","TCP","56","43520 → 9002 [ACK] Seq=8573 Ack=111881 Win=11903 Len=0"
"3.412260","5.9.29.183","172.19.0.3","TLSv1.2","787","Application Data"
"3.423969","5.9.29.183","172.19.0.3","TCP","1504","[TCP segment of a reassembled PDU]"
"3.423989","172.19.0.3","5.9.29.183","TCP","56","43520 → 9002 [ACK] Seq=8573 Ack=114060 Win=11911 Len=0"
"3.423996","5.9.29.183","172.19.0.3","TCP","1516","9002 → 43520 [PSH, ACK] Seq=114060 Ack=8573 Win=65535 Len=1460 [TCP segment of a reassembled PDU]"
"3.424001","5.9.29.183","172.19.0.3","TLSv1.2","1492","Application Data [TCP segment of a reassembled PDU]"
"3.424162","172.19.0.3","5.9.29.183","TCP","56","43520 → 9002 [ACK] Seq=8573 Ack=116956 Win=11895 Len=0"
"3.427352","5.9.29.183","172.19.0.3","TLSv1.2","396","Application Data"
"3.428297","5.9.29.183","172.19.0.3","TCP","1504","[TCP segment of a reassembled PDU]"
"3.428309","172.19.0.3","5.9.29.183","TCP","56","43520 → 9002 [ACK] Seq=8573 Ack=118744 Win=11911 Len=0"
"3.428316","5.9.29.183","172.19.0.3","TCP","1504","9002 → 43520 [PSH, ACK] Seq=118744 Ack=8573 Win=65535 Len=1448 [TCP segment of a reassembled PDU]"
"3.442654","5.9.29.183","172.19.0.3","TLSv1.2","787","Application Data"
"3.442679","172.19.0.3","5.9.29.183","TCP","56","43520 → 9002 [ACK] Seq=8573 Ack=120923 Win=11911 Len=0"
"3.455188","5.9.29.183","172.19.0.3","TCP","1504","[TCP segment of a reassembled PDU]"
"3.455287","5.9.29.183","172.19.0.3","TCP","1516","9002 → 43520 [PSH, ACK] Seq=122371 Ack=8573 Win=65535 Len=1460 [TCP segment of a reassembled PDU]"
"3.455317","5.9.29.183","172.19.0.3","TLSv1.2","1516","Application Data [TCP segment of a reassembled PDU]"
"3.455322","5.9.29.183","172.19.0.3","TCP","201","9002 → 43520 [PSH, ACK] Seq=125291 Ack=8573 Win=65535 Len=145 [TCP segment of a reassembled PDU]"
"3.455340","5.9.29.183","172.19.0.3","TCP","1516","9002 → 43520 [PSH, ACK] Seq=125436 Ack=8573 Win=65535 Len=1460 [TCP segment of a reassembled PDU]"
"3.455343","5.9.29.183","172.19.0.3","TCP","1516","9002 → 43520 [PSH, ACK] Seq=126896 Ack=8573 Win=65535 Len=1460 [TCP segment of a reassembled PDU]"
"3.455374","5.9.29.183","172.19.0.3","TLSv1.2","1516","Application Data [TCP segment of a reassembled PDU]"
"3.455406","5.9.29.183","172.19.0.3","TCP","1516","9002 → 43520 [PSH, ACK] Seq=129816 Ack=8573 Win=65535 Len=1460 [TCP segment of a reassembled PDU]"
"3.455438","5.9.29.183","172.19.0.3","TCP","1287","9002 → 43520 [PSH, ACK] Seq=131276 Ack=8573 Win=65535 Len=1231 [TCP segment of a reassembled PDU]"
"3.455497","172.19.0.3","5.9.29.183","TCP","56","43520 → 9002 [ACK] Seq=8573 Ack=132507 Win=11845 Len=0"
"3.457886","5.9.29.183","172.19.0.3","TLSv1.2","381","Application Data"
"3.458064","172.19.0.3","5.9.29.183","TLSv1.2","599","Application Data"
"3.458236","5.9.29.183","172.19.0.3","TCP","56","9002 → 43520 [ACK] Seq=132832 Ack=9116 Win=65535 Len=0"
"3.488190","5.9.29.183","172.19.0.3","TCP","1516","[TCP segment of a reassembled PDU]"
"3.488220","5.9.29.183","172.19.0.3","TCP","1516","9002 → 43520 [PSH, ACK] Seq=134292 Ack=9116 Win=65535 Len=1460 [TCP segment of a reassembled PDU]"
"3.488227","5.9.29.183","172.19.0.3","TLSv1.2","1213","Application Data"
"3.488367","172.19.0.3","5.9.29.183","TCP","56","43520 → 9002 [ACK] Seq=9116 Ack=136909 Win=11895 Len=0"
"3.488670","172.19.0.3","5.9.29.183","TLSv1.2","599","Application Data"
"3.489064","5.9.29.183","172.19.0.3","TCP","56","9002 → 43520 [ACK] Seq=136909 Ack=9659 Win=65535 Len=0"
"3.502942","5.9.29.183","172.19.0.3","TLSv1.2","663","Application Data"
"3.504060","5.9.29.183","172.19.0.3","TCP","1504","[TCP segment of a reassembled PDU]"
"3.504076","172.19.0.3","5.9.29.183","TCP","56","43520 → 9002 [ACK] Seq=9659 Ack=138964 Win=11911 Len=0"
"3.504289","5.9.29.183","172.19.0.3","TCP","1504","9002 → 43520 [PSH, ACK] Seq=138964 Ack=9659 Win=65535 Len=1448 [TCP segment of a reassembled PDU]"
"3.504297","5.9.29.183","172.19.0.3","TLSv1.2","1516","Application Data [TCP segment of a reassembled PDU]"
"3.504300","5.9.29.183","172.19.0.3","TCP","1516","9002 → 43520 [PSH, ACK] Seq=141872 Ack=9659 Win=65535 Len=1460 [TCP segment of a reassembled PDU]"
"3.504330","5.9.29.183","172.19.0.3","TCP","1480","9002 → 43520 [PSH, ACK] Seq=143332 Ack=9659 Win=65535 Len=1424 [TCP segment of a reassembled PDU]"
"3.504334","5.9.29.183","172.19.0.3","TLSv1.2","1516","Application Data [TCP segment of a reassembled PDU]"
"3.504354","5.9.29.183","172.19.0.3","TCP","1516","9002 → 43520 [PSH, ACK] Seq=146216 Ack=9659 Win=65535 Len=1460 [TCP segment of a reassembled PDU]"
"3.504358","5.9.29.183","172.19.0.3","TCP","1516","9002 → 43520 [PSH, ACK] Seq=147676 Ack=9659 Win=65535 Len=1460 [TCP segment of a reassembled PDU]"
"3.504411","5.9.29.183","172.19.0.3","TLSv1.2","1516","Application Data [TCP segment of a reassembled PDU]"
"3.504416","5.9.29.183","172.19.0.3","TCP","1516","9002 → 43520 [PSH, ACK] Seq=150596 Ack=9659 Win=65535 Len=1460 [TCP segment of a reassembled PDU]"
"3.504469","5.9.29.183","172.19.0.3","TCP","1444","9002 → 43520 [PSH, ACK] Seq=152056 Ack=9659 Win=65535 Len=1388 [TCP segment of a reassembled PDU]"
"3.504493","172.19.0.3","5.9.29.183","TCP","56","43520 → 9002 [ACK] Seq=9659 Ack=153444 Win=11828 Len=0"
"3.510725","5.9.29.183","172.19.0.3","TLSv1.2","1504","Application Data, Application Data"
"3.510748","5.9.29.183","172.19.0.3","TCP","1516","9002 → 43520 [PSH, ACK] Seq=154892 Ack=9659 Win=65535 Len=1460 [TCP segment of a reassembled PDU]"
"3.510757","172.19.0.3","5.9.29.183","TCP","56","43520 → 9002 [ACK] Seq=9659 Ack=156352 Win=11903 Len=0"
"3.510759","5.9.29.183","172.19.0.3","TCP","1516","9002 → 43520 [PSH, ACK] Seq=156352 Ack=9659 Win=65535 Len=1460 [TCP segment of a reassembled PDU]"
"3.510762","5.9.29.183","172.19.0.3","TLSv1.2","1516","Application Data [TCP segment of a reassembled PDU]"
"3.510764","5.9.29.183","172.19.0.3","TCP","1468","9002 → 43520 [PSH, ACK] Seq=159272 Ack=9659 Win=65535 Len=1412 [TCP segment of a reassembled PDU]"
"3.510946","172.19.0.3","5.9.29.183","TCP","56","43520 → 9002 [ACK] Seq=9659 Ack=160684 Win=11879 Len=0"
"3.511302","172.19.0.3","5.9.29.183","TLSv1.2","599","Application Data"
"3.511469","5.9.29.183","172.19.0.3","TCP","56","9002 → 43520 [ACK] Seq=160684 Ack=10202 Win=65535 Len=0"
"3.517923","5.9.29.183","172.19.0.3","TLSv1.2","1249","Application Data"
"3.520607","172.19.0.3","5.9.29.183","TLSv1.2","599","Application Data"
"3.520932","5.9.29.183","172.19.0.3","TCP","56","9002 → 43520 [ACK] Seq=161877 Ack=10745 Win=65535 Len=0"
"3.529358","172.19.0.3","5.9.29.183","TLSv1.2","599","Application Data"
"3.529591","5.9.29.183","172.19.0.3","TCP","56","9002 → 43520 [ACK] Seq=161877 Ack=11288 Win=65535 Len=0"
"3.532776","5.9.29.183","172.19.0.3","TLSv1.2","599","Application Data"
"3.574206","172.19.0.3","5.9.29.183","TCP","56","43520 → 9002 [ACK] Seq=11288 Ack=162420 Win=11911 Len=0"
"3.871810","5.9.29.183","172.19.0.3","TLSv1.2","599","Application Data"
"3.871854","172.19.0.3","5.9.29.183","TCP","56","43520 → 9002 [ACK] Seq=11288 Ack=162963 Win=11911 Len=0"
"3.872563","172.19.0.3","5.9.29.183","TLSv1.2","599","Application Data"
"3.872888","5.9.29.183","172.19.0.3","TCP","56","9002 → 43520 [ACK] Seq=162963 Ack=11831 Win=65535 Len=0"
"4.158300","5.9.29.183","172.19.0.3","TCP","1516","[TCP segment of a reassembled PDU]"
"4.158340","5.9.29.183","172.19.0.3","TCP","1492","9002 → 43520 [PSH, ACK] Seq=164423 Ack=11831 Win=65535 Len=1436 [TCP segment of a reassembled PDU]"
"4.158349","5.9.29.183","172.19.0.3","TLSv1.2","787","Application Data"
"4.158447","172.19.0.3","5.9.29.183","TCP","56","43520 → 9002 [ACK] Seq=11831 Ack=166590 Win=11895 Len=0"
"4.197082","5.9.29.183","172.19.0.3","TCP","1516","[TCP segment of a reassembled PDU]"
"4.197130","5.9.29.183","172.19.0.3","TCP","1516","9002 → 43520 [PSH, ACK] Seq=168050 Ack=11831 Win=65535 Len=1460 [TCP segment of a reassembled PDU]"
"4.197148","172.19.0.3","5.9.29.183","TCP","56","43520 → 9002 [ACK] Seq=11831 Ack=169510 Win=11903 Len=0"
"4.197151","5.9.29.183","172.19.0.3","TLSv1.2","1516","Application Data [TCP segment of a reassembled PDU]"
"4.197155","5.9.29.183","172.19.0.3","TCP","1516","9002 → 43520 [PSH, ACK] Seq=170970 Ack=11831 Win=65535 Len=1460 [TCP segment of a reassembled PDU]"
"4.197161","5.9.29.183","172.19.0.3","TCP","1189","9002 → 43520 [PSH, ACK] Seq=172430 Ack=11831 Win=65535 Len=1133 [TCP segment of a reassembled PDU]"
"4.197340","172.19.0.3","5.9.29.183","TCP","56","43520 → 9002 [ACK] Seq=11831 Ack=173563 Win=11877 Len=0"
"4.210831","5.9.29.183","172.19.0.3","TLSv1.2","1504","Application Data [TCP segment of a reassembled PDU]"
"4.210870","5.9.29.183","172.19.0.3","TCP","1516","9002 → 43520 [PSH, ACK] Seq=175011 Ack=11831 Win=65535 Len=1460 [TCP segment of a reassembled PDU]"
"4.210886","172.19.0.3","5.9.29.183","TCP","56","43520 → 9002 [ACK] Seq=11831 Ack=176471 Win=11903 Len=0"
"4.210890","5.9.29.183","172.19.0.3","TCP","1492","9002 → 43520 [PSH, ACK] Seq=176471 Ack=11831 Win=65535 Len=1436 [TCP segment of a reassembled PDU]"
"4.212202","5.9.29.183","172.19.0.3","TLSv1.2","677","Application Data, Application Data"
"4.212220","172.19.0.3","5.9.29.183","TCP","56","43520 → 9002 [ACK] Seq=11831 Ack=178528 Win=11911 Len=0"
"4.253155","5.9.29.183","172.19.0.3","TCP","1516","[TCP segment of a reassembled PDU]"
"4.253234","5.9.29.183","172.19.0.3","TCP","1516","9002 → 43520 [PSH, ACK] Seq=179988 Ack=11831 Win=65535 Len=1460 [TCP segment of a reassembled PDU]"
"4.253252","5.9.29.183","172.19.0.3","TLSv1.2","1213","Application Data"
"4.253320","5.9.29.183","172.19.0.3","TCP","1516","[TCP segment of a reassembled PDU]"
"4.253326","5.9.29.183","172.19.0.3","TCP","1492","9002 → 43520 [PSH, ACK] Seq=184065 Ack=11831 Win=65535 Len=1436 [TCP segment of a reassembled PDU]"
"4.253582","172.19.0.3","5.9.29.183","TCP","56","43520 → 9002 [ACK] Seq=11831 Ack=185501 Win=11879 Len=0"
"4.268855","5.9.29.183","172.19.0.3","TLSv1.2","1516","Application Data, Application Data"
"4.268886","5.9.29.183","172.19.0.3","TCP","1516","9002 → 43520 [PSH, ACK] Seq=186961 Ack=11831 Win=65535 Len=1460 [TCP segment of a reassembled PDU]"
"4.268897","172.19.0.3","5.9.29.183","TCP","56","43520 → 9002 [ACK] Seq=11831 Ack=188421 Win=11903 Len=0"
"4.268898","5.9.29.183","172.19.0.3","TCP","1480","9002 → 43520 [PSH, ACK] Seq=188421 Ack=11831 Win=65535 Len=1424 [TCP segment of a reassembled PDU]"
"4.269466","5.9.29.183","172.19.0.3","TLSv1.2","1183","Application Data [TCP segment of a reassembled PDU]"
"4.269499","5.9.29.183","172.19.0.3","TLSv1.2","93","Application Data"
"4.269643","172.19.0.3","5.9.29.183","TCP","56","43520 → 9002 [ACK] Seq=11831 Ack=191009 Win=11885 Len=0"
"4.269964","172.19.0.3","5.9.29.183","TLSv1.2","1113","Application Data"
"4.270282","5.9.29.183","172.19.0.3","TCP","56","9002 → 43520 [ACK] Seq=191009 Ack=12888 Win=65535 Len=0"
"4.279429","5.9.29.183","172.19.0.3","TCP","1516","[TCP segment of a reassembled PDU]"
"4.279462","5.9.29.183","172.19.0.3","TCP","1492","9002 → 43520 [PSH, ACK] Seq=192469 Ack=12888 Win=65535 Len=1436 [TCP segment of a reassembled PDU]"
"4.279473","172.19.0.3","5.9.29.183","TCP","56","43520 → 9002 [ACK] Seq=12888 Ack=193905 Win=11903 Len=0"
"4.279474","5.9.29.183","172.19.0.3","TLSv1.2","1516","Application Data [TCP segment of a reassembled PDU]"
"4.279594","5.9.29.183","172.19.0.3","TCP","1516","9002 → 43520 [PSH, ACK] Seq=195365 Ack=12888 Win=65535 Len=1460 [TCP segment of a reassembled PDU]"
"4.279600","5.9.29.183","172.19.0.3","TCP","1516","9002 → 43520 [PSH, ACK] Seq=196825 Ack=12888 Win=65535 Len=1460 [TCP segment of a reassembled PDU]"
"4.279602","5.9.29.183","172.19.0.3","TLSv1.2","1516","Application Data [TCP segment of a reassembled PDU]"
"4.279623","5.9.29.183","172.19.0.3","TCP","1516","9002 → 43520 [PSH, ACK] Seq=199745 Ack=12888 Win=65535 Len=1460 [TCP segment of a reassembled PDU]"
"4.279626","5.9.29.183","172.19.0.3","TCP","1516","9002 → 43520 [PSH, ACK] Seq=201205 Ack=12888 Win=65535 Len=1460 [TCP segment of a reassembled PDU]"
"4.279662","5.9.29.183","172.19.0.3","TLSv1.2","1432","Application Data [TCP segment of a reassembled PDU]"
"4.279717","5.9.29.183","172.19.0.3","TCP","1516","9002 → 43520 [PSH, ACK] Seq=204041 Ack=12888 Win=65535 Len=1460 [TCP segment of a reassembled PDU]"
"4.279759","5.9.29.183","172.19.0.3","TCP","1492","9002 → 43520 [PSH, ACK] Seq=205501 Ack=12888 Win=65535 Len=1436 [TCP segment of a reassembled PDU]"
"4.279801","172.19.0.3","5.9.29.183","TCP","56","43520 → 9002 [ACK] Seq=12888 Ack=206937 Win=11828 Len=0"
"4.285798","5.9.29.183","172.19.0.3","TLSv1.2","1516","Application Data, Application Data"
"4.285880","5.9.29.183","172.19.0.3","TCP","709","9002 → 43520 [PSH, ACK] Seq=208397 Ack=12888 Win=65535 Len=653 [TCP segment of a reassembled PDU]"
"4.285942","172.19.0.3","5.9.29.183","TCP","56","43520 → 9002 [ACK] Seq=12888 Ack=209050 Win=11903 Len=0"
"4.285947","5.9.29.183","172.19.0.3","TCP","1516","9002 → 43520 [PSH, ACK] Seq=209050 Ack=12888 Win=65535 Len=1460 [TCP segment of a reassembled PDU]"
"4.285954","5.9.29.183","172.19.0.3","TLSv1.2","1516","Application Data [TCP segment of a reassembled PDU]"
"4.285958","5.9.29.183","172.19.0.3","TCP","1516","9002 → 43520 [PSH, ACK] Seq=211970 Ack=12888 Win=65535 Len=1460 [TCP segment of a reassembled PDU]"
"4.285961","5.9.29.183","172.19.0.3","TCP","1516","9002 → 43520 [PSH, ACK] Seq=213430 Ack=12888 Win=65535 Len=1460 [TCP segment of a reassembled PDU]"
"4.286117","5.9.29.183","172.19.0.3","TLSv1.2","1516","Application Data [TCP segment of a reassembled PDU]"
"4.286123","5.9.29.183","172.19.0.3","TCP","1444","9002 → 43520 [PSH, ACK] Seq=216350 Ack=12888 Win=65535 Len=1388 [TCP segment of a reassembled PDU]"
"4.286208","172.19.0.3","5.9.29.183","TCP","56","43520 → 9002 [ACK] Seq=12888 Ack=217738 Win=11855 Len=0"
"4.286783","172.19.0.3","5.9.29.183","TLSv1.2","599","Application Data"
"4.287693","5.9.29.183","172.19.0.3","TCP","56","9002 → 43520 [ACK] Seq=217738 Ack=13431 Win=65535 Len=0"
"4.295308","5.9.29.183","172.19.0.3","TCP","1516","9002 → 43520 [PSH, ACK] Seq=217738 Ack=13431 Win=65535 Len=1460 [TCP segment of a reassembled PDU]"
"4.295362","5.9.29.183","172.19.0.3","TLSv1.2","1492","Application Data [TCP segment of a reassembled PDU]"
"4.295383","172.19.0.3","5.9.29.183","TCP","56","43520 → 9002 [ACK] Seq=13431 Ack=220634 Win=11903 Len=0"
"4.299502","5.9.29.183","172.19.0.3","TLSv1.2","1516","Application Data [TCP segment of a reassembled PDU]"
"4.299569","5.9.29.183","172.19.0.3","TCP","1492","9002 → 43520 [PSH, ACK] Seq=222094 Ack=13431 Win=65535 Len=1436 [TCP segment of a reassembled PDU]"
"4.299593","172.19.0.3","5.9.29.183","TCP","56","43520 → 9002 [ACK] Seq=13431 Ack=223530 Win=11903 Len=0"
"4.300767","5.9.29.183","172.19.0.3","TLSv1.2","1235","Application Data"
"4.345502","172.19.0.3","5.9.29.183","TCP","56","43520 → 9002 [ACK] Seq=13431 Ack=224709 Win=11911 Len=0"
"4.345846","5.9.29.183","172.19.0.3","TCP","1516","[TCP segment of a reassembled PDU]"
"4.345885","5.9.29.183","172.19.0.3","TCP","1516","9002 → 43520 [PSH, ACK] Seq=226169 Ack=13431 Win=65535 Len=1460 [TCP segment of a reassembled PDU]"
"4.345903","5.9.29.183","172.19.0.3","TLSv1.2","1213","Application Data"
"4.346055","172.19.0.3","5.9.29.183","TCP","56","43520 → 9002 [ACK] Seq=13431 Ack=228786 Win=11893 Len=0"
"4.347515","172.19.0.3","5.9.29.183","TLSv1.2","599","Application Data"
"4.348198","5.9.29.183","172.19.0.3","TCP","56","9002 → 43520 [ACK] Seq=228786 Ack=13974 Win=65535 Len=0"
"4.356390","172.19.0.3","5.9.29.183","TLSv1.2","599","Application Data"
"4.357020","5.9.29.183","172.19.0.3","TCP","56","9002 → 43520 [ACK] Seq=228786 Ack=14517 Win=65535 Len=0"
"4.360969","5.9.29.183","172.19.0.3","TLSv1.2","149","Application Data"
"4.401578","172.19.0.3","5.9.29.183","TCP","56","43520 → 9002 [ACK] Seq=14517 Ack=228879 Win=11911 Len=0"
"4.857550","5.9.29.183","172.19.0.3","TLSv1.2","599","Application Data"
"4.857656","172.19.0.3","5.9.29.183","TCP","56","43520 → 9002 [ACK] Seq=14517 Ack=229422 Win=11911 Len=0"
"4.859015","172.19.0.3","5.9.29.183","TLSv1.2","599","Application Data"
"4.859247","5.9.29.183","172.19.0.3","TCP","56","9002 → 43520 [ACK] Seq=229422 Ack=15060 Win=65535 Len=0"
"5.181812","5.9.29.183","172.19.0.3","TCP","1504","[TCP segment of a reassembled PDU]"
"5.181893","5.9.29.183","172.19.0.3","TCP","1516","9002 → 43520 [PSH, ACK] Seq=230870 Ack=15060 Win=65535 Len=1460 [TCP segment of a reassembled PDU]"
"5.181902","5.9.29.183","172.19.0.3","TLSv1.2","775","Application Data"
"5.182036","172.19.0.3","5.9.29.183","TCP","56","43520 → 9002 [ACK] Seq=15060 Ack=233049 Win=11895 Len=0"
"5.221289","5.9.29.183","172.19.0.3","TCP","1516","[TCP segment of a reassembled PDU]"
"5.221422","5.9.29.183","172.19.0.3","TCP","1492","9002 → 43520 [PSH, ACK] Seq=234509 Ack=15060 Win=65535 Len=1436 [TCP segment of a reassembled PDU]"
"5.221473","172.19.0.3","5.9.29.183","TCP","56","43520 → 9002 [ACK] Seq=15060 Ack=235945 Win=11901 Len=0"
"5.221484","5.9.29.183","172.19.0.3","TLSv1.2","1237","Application Data"
"5.236579","5.9.29.183","172.19.0.3","TLSv1.2","149","Application Data"
"5.236809","172.19.0.3","5.9.29.183","TCP","56","43520 → 9002 [ACK] Seq=15060 Ack=237219 Win=11911 Len=0"
"5.252279","5.9.29.183","172.19.0.3","TCP","1516","[TCP segment of a reassembled PDU]"
"5.252377","5.9.29.183","172.19.0.3","TCP","1516","9002 → 43520 [PSH, ACK] Seq=238679 Ack=15060 Win=65535 Len=1460 [TCP segment of a reassembled PDU]"
"5.252398","5.9.29.183","172.19.0.3","TLSv1.2","763","Application Data"
"5.252764","172.19.0.3","5.9.29.183","TCP","56","43520 → 9002 [ACK] Seq=15060 Ack=240846 Win=11895 Len=0"
"5.259638","172.19.0.3","5.9.29.183","TLSv1.2","599","Application Data"
"5.260144","5.9.29.183","172.19.0.3","TCP","56","9002 → 43520 [ACK] Seq=240846 Ack=15603 Win=65535 Len=0"
"5.578734","5.9.29.183","172.19.0.3","TLSv1.2","599","Application Data"
"5.579252","172.19.0.3","5.9.29.183","TLSv1.2","599","Application Data"
"5.579507","5.9.29.183","172.19.0.3","TCP","56","9002 → 43520 [ACK] Seq=241389 Ack=16146 Win=65535 Len=0"
"5.970097","5.9.29.183","172.19.0.3","TCP","1504","[TCP segment of a reassembled PDU]"
"5.970151","5.9.29.183","172.19.0.3","TCP","1516","9002 → 43520 [PSH, ACK] Seq=242837 Ack=16146 Win=65535 Len=1460 [TCP segment of a reassembled PDU]"
"5.970161","5.9.29.183","172.19.0.3","TLSv1.2","1516","Application Data [TCP segment of a reassembled PDU]"
"5.970220","5.9.29.183","172.19.0.3","TCP","1516","9002 → 43520 [PSH, ACK] Seq=245757 Ack=16146 Win=65535 Len=1460 [TCP segment of a reassembled PDU]"
"5.970227","5.9.29.183","172.19.0.3","TCP","1516","9002 → 43520 [PSH, ACK] Seq=247217 Ack=16146 Win=65535 Len=1460 [TCP segment of a reassembled PDU]"
"5.970231","5.9.29.183","172.19.0.3","TLSv1.2","1189","Application Data [TCP segment of a reassembled PDU]"
"5.970319","5.9.29.183","172.19.0.3","TCP","1516","9002 → 43520 [PSH, ACK] Seq=249810 Ack=16146 Win=65535 Len=1460 [TCP segment of a reassembled PDU]"
"5.970349","5.9.29.183","172.19.0.3","TCP","1492","9002 → 43520 [PSH, ACK] Seq=251270 Ack=16146 Win=65535 Len=1436 [TCP segment of a reassembled PDU]"
"5.970452","172.19.0.3","5.9.29.183","TCP","56","43520 → 9002 [ACK] Seq=16146 Ack=252706 Win=11855 Len=0"
"5.970736","172.19.0.3","5.9.29.183","TLSv1.2","599","Application Data"
"5.970976","5.9.29.183","172.19.0.3","TCP","56","9002 → 43520 [ACK] Seq=252706 Ack=16689 Win=65535 Len=0"
"5.986116","5.9.29.183","172.19.0.3","TLSv1.2","648","Application Data"
"5.999247","5.9.29.183","172.19.0.3","TCP","1516","[TCP segment of a reassembled PDU]"
"5.999293","172.19.0.3","5.9.29.183","TCP","56","43520 → 9002 [ACK] Seq=16689 Ack=254758 Win=11911 Len=0"
"5.999328","5.9.29.183","172.19.0.3","TCP","1516","9002 → 43520 [PSH, ACK] Seq=254758 Ack=16689 Win=65535 Len=1460 [TCP segment of a reassembled PDU]"
"5.999339","5.9.29.183","172.19.0.3","TCP","346","9002 → 43520 [PSH, ACK] Seq=256218 Ack=16689 Win=65535 Len=290 [TCP segment of a reassembled PDU]"
"5.999341","5.9.29.183","172.19.0.3","TLSv1.2","1516","Application Data [TCP segment of a reassembled PDU]"
"5.999344","5.9.29.183","172.19.0.3","TCP","1516","9002 → 43520 [PSH, ACK] Seq=257968 Ack=16689 Win=65535 Len=1460 [TCP segment of a reassembled PDU]"
"5.999347","5.9.29.183","172.19.0.3","TCP","1516","9002 → 43520 [PSH, ACK] Seq=259428 Ack=16689 Win=65535 Len=1460 [TCP segment of a reassembled PDU]"
"5.999539","5.9.29.183","172.19.0.3","TLSv1.2","1516","Application Data [TCP segment of a reassembled PDU]"
"5.999548","5.9.29.183","172.19.0.3","TCP","1516","9002 → 43520 [PSH, ACK] Seq=262348 Ack=16689 Win=65535 Len=1460 [TCP segment of a reassembled PDU]"
"5.999550","5.9.29.183","172.19.0.3","TCP","1516","9002 → 43520 [PSH, ACK] Seq=263808 Ack=16689 Win=65535 Len=1460 [TCP segment of a reassembled PDU]"
"5.999571","5.9.29.183","172.19.0.3","TLSv1.2","1516","Application Data [TCP segment of a reassembled PDU]"
"5.999582","5.9.29.183","172.19.0.3","TCP","1516","9002 → 43520 [PSH, ACK] Seq=266728 Ack=16689 Win=65535 Len=1460 [TCP segment of a reassembled PDU]"
"5.999652","5.9.29.183","172.19.0.3","TCP","1094","9002 → 43520 [PSH, ACK] Seq=268188 Ack=16689 Win=65535 Len=1038 [TCP segment of a reassembled PDU]"
"5.999751","172.19.0.3","5.9.29.183","TCP","56","43520 → 9002 [ACK] Seq=16689 Ack=269226 Win=11820 Len=0"
"6.001698","5.9.29.183","172.19.0.3","TLSv1.2","721","Application Data, Application Data"
"6.002427","172.19.0.3","5.9.29.183","TLSv1.2","599","Application Data"
"6.003181","5.9.29.183","172.19.0.3","TCP","56","9002 → 43520 [ACK] Seq=269891 Ack=17232 Win=65535 Len=0"
"6.003246","5.9.29.183","172.19.0.3","TCP","1516","[TCP segment of a reassembled PDU]"
"6.003339","5.9.29.183","172.19.0.3","TCP","1492","9002 → 43520 [PSH, ACK] Seq=271351 Ack=17232 Win=65535 Len=1436 [TCP segment of a reassembled PDU]"
"6.003378","172.19.0.3","5.9.29.183","TCP","56","43520 → 9002 [ACK] Seq=17232 Ack=272787 Win=11903 Len=0"
"6.012916","5.9.29.183","172.19.0.3","TLSv1.2","1516","Application Data [TCP segment of a reassembled PDU]"
"6.012939","5.9.29.183","172.19.0.3","TCP","1492","9002 → 43520 [PSH, ACK] Seq=274247 Ack=17232 Win=65535 Len=1436 [TCP segment of a reassembled PDU]"
"6.012951","172.19.0.3","5.9.29.183","TCP","56","43520 → 9002 [ACK] Seq=17232 Ack=275683 Win=11903 Len=0"
"6.014206","5.9.29.183","172.19.0.3","TLSv1.2","1504","Application Data [TCP segment of a reassembled PDU]"
"6.014250","5.9.29.183","172.19.0.3","TCP","1516","9002 → 43520 [PSH, ACK] Seq=277131 Ack=17232 Win=65535 Len=1460 [TCP segment of a reassembled PDU]"
"6.014265","172.19.0.3","5.9.29.183","TCP","56","43520 → 9002 [ACK] Seq=17232 Ack=278591 Win=11903 Len=0"
"6.014269","5.9.29.183","172.19.0.3","TCP","1516","9002 → 43520 [PSH, ACK] Seq=278591 Ack=17232 Win=65535 Len=1460 [TCP segment of a reassembled PDU]"
"6.014407","5.9.29.183","172.19.0.3","TLSv1.2","1516","Application Data [TCP segment of a reassembled PDU]"
"6.014414","5.9.29.183","172.19.0.3","TCP","1516","9002 → 43520 [PSH, ACK] Seq=281511 Ack=17232 Win=65535 Len=1460 [TCP segment of a reassembled PDU]"
"6.014416","5.9.29.183","172.19.0.3","TLSv1.2","1456","Application Data [TCP segment of a reassembled PDU]"
"6.014501","5.9.29.183","172.19.0.3","TCP","1516","9002 → 43520 [PSH, ACK] Seq=284371 Ack=17232 Win=65535 Len=1460 [TCP segment of a reassembled PDU]"
"6.014512","172.19.0.3","5.9.29.183","TCP","56","43520 → 9002 [ACK] Seq=17232 Ack=284371 Win=11871 Len=0"
"6.014558","5.9.29.183","172.19.0.3","TCP","1492","9002 → 43520 [PSH, ACK] Seq=285831 Ack=17232 Win=65535 Len=1436 [TCP segment of a reassembled PDU]"
"6.014754","172.19.0.3","5.9.29.183","TCP","56","43520 → 9002 [ACK] Seq=17232 Ack=287267 Win=11855 Len=0"
"6.016238","5.9.29.183","172.19.0.3","TLSv1.2","1358","Application Data, Application Data"
"6.029238","5.9.29.183","172.19.0.3","TCP","1504","[TCP segment of a reassembled PDU]"
"6.029328","172.19.0.3","5.9.29.183","TCP","56","43520 → 9002 [ACK] Seq=17232 Ack=290017 Win=11909 Len=0"
"6.029378","5.9.29.183","172.19.0.3","TCP","1516","9002 → 43520 [PSH, ACK] Seq=290017 Ack=17232 Win=65535 Len=1460 [TCP segment of a reassembled PDU]"
"6.029400","5.9.29.183","172.19.0.3","TLSv1.2","1516","Application Data [TCP segment of a reassembled PDU]"
"6.029408","5.9.29.183","172.19.0.3","TLSv1.2","1516","Application Data [TCP segment of a reassembled PDU]"
"6.029416","5.9.29.183","172.19.0.3","TCP","1516","9002 → 43520 [PSH, ACK] Seq=294397 Ack=17232 Win=65535 Len=1460 [TCP segment of a reassembled PDU]"
"6.029818","5.9.29.183","172.19.0.3","TCP","1516","9002 → 43520 [PSH, ACK] Seq=295857 Ack=17232 Win=65535 Len=1460 [TCP segment of a reassembled PDU]"
"6.029826","5.9.29.183","172.19.0.3","TLSv1.2","1516","Application Data, Application Data"
"6.029829","5.9.29.183","172.19.0.3","TCP","1516","9002 → 43520 [PSH, ACK] Seq=298777 Ack=17232 Win=65535 Len=1460 [TCP segment of a reassembled PDU]"
"6.029836","5.9.29.183","172.19.0.3","TCP","1516","9002 → 43520 [PSH, ACK] Seq=300237 Ack=17232 Win=65535 Len=1460 [TCP segment of a reassembled PDU]"
"6.029842","5.9.29.183","172.19.0.3","TLSv1.2","1408","Application Data, Application Data"
"6.029917","5.9.29.183","172.19.0.3","TCP","1516","9002 → 43520 [PSH, ACK] Seq=303049 Ack=17232 Win=65535 Len=1460 [TCP segment of a reassembled PDU]"
"6.030066","5.9.29.183","172.19.0.3","TCP","1492","9002 → 43520 [PSH, ACK] Seq=304509 Ack=17232 Win=65535 Len=1436 [TCP segment of a reassembled PDU]"
"6.030310","172.19.0.3","5.9.29.183","TCP","56","43520 → 9002 [ACK] Seq=17232 Ack=305945 Win=11820 Len=0"
"6.030794","172.19.0.3","5.9.29.183","TLSv1.2","599","Application Data"
"6.031131","5.9.29.183","172.19.0.3","TCP","56","9002 → 43520 [ACK] Seq=305945 Ack=17775 Win=65535 Len=0"
"6.031507","5.9.29.183","172.19.0.3","TLSv1.2","1416","Application Data, Application Data"
"6.040615","172.19.0.3","5.9.29.183","TLSv1.2","599","Application Data"
"6.041478","5.9.29.183","172.19.0.3","TCP","56","9002 → 43520 [ACK] Seq=307305 Ack=18318 Win=65535 Len=0"
"6.056621","5.9.29.183","172.19.0.3","TCP","1516","[TCP segment of a reassembled PDU]"
"6.056685","5.9.29.183","172.19.0.3","TCP","1516","9002 → 43520 [PSH, ACK] Seq=308765 Ack=18318 Win=65535 Len=1460 [TCP segment of a reassembled PDU]"
"6.056693","5.9.29.183","172.19.0.3","TLSv1.2","249","Application Data"
"6.056858","172.19.0.3","5.9.29.183","TCP","56","43520 → 9002 [ACK] Seq=18318 Ack=310418 Win=11895 Len=0"
"6.063410","172.19.0.3","5.9.29.183","TLSv1.2","599","Application Data"
"6.064073","5.9.29.183","172.19.0.3","TCP","56","9002 → 43520 [ACK] Seq=310418 Ack=18861 Win=65535 Len=0"
"6.550310","5.9.29.183","172.19.0.3","TLSv1.2","599","Application Data"
"6.551354","172.19.0.3","5.9.29.183","TLSv1.2","599","Application Data"
"6.551987","5.9.29.183","172.19.0.3","TCP","56","9002 → 43520 [ACK] Seq=310961 Ack=19404 Win=65535 Len=0"
"6.897966","5.9.29.183","172.19.0.3","TCP","1504","[TCP segment of a reassembled PDU]"
"6.897990","5.9.29.183","172.19.0.3","TCP","1516","9002 → 43520 [PSH, ACK] Seq=312409 Ack=19404 Win=65535 Len=1460 [TCP segment of a reassembled PDU]"
"6.897996","5.9.29.183","172.19.0.3","TLSv1.2","775","Application Data"
"6.898169","172.19.0.3","5.9.29.183","TCP","56","43520 → 9002 [ACK] Seq=19404 Ack=314588 Win=11895 Len=0"
"6.908204","5.9.29.183","172.19.0.3","TCP","1504","[TCP segment of a reassembled PDU]"
"6.908222","5.9.29.183","172.19.0.3","TCP","1504","9002 → 43520 [PSH, ACK] Seq=316036 Ack=19404 Win=65535 Len=1448 [TCP segment of a reassembled PDU]"
"6.908232","172.19.0.3","5.9.29.183","TCP","56","43520 → 9002 [ACK] Seq=19404 Ack=317484 Win=11903 Len=0"
"6.912752","5.9.29.183","172.19.0.3","TLSv1.2","787","Application Data"
"6.921927","5.9.29.183","172.19.0.3","TCP","1504","[TCP segment of a reassembled PDU]"
"6.921952","172.19.0.3","5.9.29.183","TCP","56","43520 → 9002 [ACK] Seq=19404 Ack=319663 Win=11911 Len=0"
"6.921962","5.9.29.183","172.19.0.3","TCP","1504","9002 → 43520 [PSH, ACK] Seq=319663 Ack=19404 Win=65535 Len=1448 [TCP segment of a reassembled PDU]"
"6.927585","5.9.29.183","172.19.0.3","TLSv1.2","787","Application Data"
"6.927599","172.19.0.3","5.9.29.183","TCP","56","43520 → 9002 [ACK] Seq=19404 Ack=321842 Win=11911 Len=0"
"6.961607","5.9.29.183","172.19.0.3","TCP","258","[TCP segment of a reassembled PDU]"
"6.961673","5.9.29.183","172.19.0.3","TLSv1.2","1425","Application Data"
"6.961874","172.19.0.3","5.9.29.183","TCP","56","43520 → 9002 [ACK] Seq=19404 Ack=323413 Win=11903 Len=0"
"6.968370","172.19.0.3","5.9.29.183","TLSv1.2","599","Application Data"
"6.968840","5.9.29.183","172.19.0.3","TCP","56","9002 → 43520 [ACK] Seq=323413 Ack=19947 Win=65535 Len=0"
"7.303189","5.9.29.183","172.19.0.3","TLSv1.2","599","Application Data"
"7.303762","172.19.0.3","5.9.29.183","TLSv1.2","599","Application Data"
"7.304111","5.9.29.183","172.19.0.3","TCP","56","9002 → 43520 [ACK] Seq=323956 Ack=20490 Win=65535 Len=0"
"7.675162","5.9.29.183","172.19.0.3","TCP","1516","[TCP segment of a reassembled PDU]"
"7.675226","5.9.29.183","172.19.0.3","TCP","1492","9002 → 43520 [PSH, ACK] Seq=325416 Ack=20490 Win=65535 Len=1436 [TCP segment of a reassembled PDU]"
"7.675362","172.19.0.3","5.9.29.183","TCP","56","43520 → 9002 [ACK] Seq=20490 Ack=326852 Win=11903 Len=0"
"7.675491","5.9.29.183","172.19.0.3","TLSv1.2","1516","Application Data [TCP segment of a reassembled PDU]"
"7.675504","5.9.29.183","172.19.0.3","TCP","1516","9002 → 43520 [PSH, ACK] Seq=328312 Ack=20490 Win=65535 Len=1460 [TCP segment of a reassembled PDU]"
"7.675513","172.19.0.3","5.9.29.183","TCP","56","43520 → 9002 [ACK] Seq=20490 Ack=329772 Win=11903 Len=0"
"7.675515","5.9.29.183","172.19.0.3","TCP","1213","9002 → 43520 [PSH, ACK] Seq=329772 Ack=20490 Win=65535 Len=1157 [TCP segment of a reassembled PDU]"
"7.690628","5.9.29.183","172.19.0.3","TLSv1.2","1516","Application Data [TCP segment of a reassembled PDU]"
"7.690665","172.19.0.3","5.9.29.183","TCP","56","43520 → 9002 [ACK] Seq=20490 Ack=332389 Win=11911 Len=0"
"7.690681","5.9.29.183","172.19.0.3","TCP","1516","9002 → 43520 [PSH, ACK] Seq=332389 Ack=20490 Win=65535 Len=1460 [TCP segment of a reassembled PDU]"
"7.690689","5.9.29.183","172.19.0.3","TLSv1.2","1516","Application Data [TCP segment of a reassembled PDU]"
"7.690693","5.9.29.183","172.19.0.3","TCP","1468","9002 → 43520 [PSH, ACK] Seq=335309 Ack=20490 Win=65535 Len=1412 [TCP segment of a reassembled PDU]"
"7.690827","5.9.29.183","172.19.0.3","TCP","1516","9002 → 43520 [PSH, ACK] Seq=336721 Ack=20490 Win=65535 Len=1460 [TCP segment of a reassembled PDU]"
"7.690836","5.9.29.183","172.19.0.3","TLSv1.2","1516","Application Data [TCP segment of a reassembled PDU]"
"7.690841","5.9.29.183","172.19.0.3","TLSv1.2","450","Application Data"
"7.690910","172.19.0.3","5.9.29.183","TCP","56","43520 → 9002 [ACK] Seq=20490 Ack=340035 Win=11861 Len=0"
"7.706234","5.9.29.183","172.19.0.3","TCP","1504","[TCP segment of a reassembled PDU]"
"7.706260","5.9.29.183","172.19.0.3","TCP","1516","9002 → 43520 [PSH, ACK] Seq=341483 Ack=20490 Win=65535 Len=1460 [TCP segment of a reassembled PDU]"
"7.706272","172.19.0.3","5.9.29.183","TCP","56","43520 → 9002 [ACK] Seq=20490 Ack=342943 Win=11903 Len=0"
"7.706274","5.9.29.183","172.19.0.3","TLSv1.2","775","Application Data"
"7.747143","172.19.0.3","5.9.29.183","TCP","56","43520 → 9002 [ACK] Seq=20490 Ack=343662 Win=11911 Len=0"
"7.756873","5.9.29.183","172.19.0.3","TCP","1504","[TCP segment of a reassembled PDU]"
"7.756902","172.19.0.3","5.9.29.183","TCP","56","43520 → 9002 [ACK] Seq=20490 Ack=345110 Win=11911 Len=0"
"7.756914","5.9.29.183","172.19.0.3","TCP","1516","9002 → 43520 [PSH, ACK] Seq=345110 Ack=20490 Win=65535 Len=1460 [TCP segment of a reassembled PDU]"
"7.756930","172.19.0.3","5.9.29.183","TCP","56","43520 → 9002 [ACK] Seq=20490 Ack=346570 Win=11903 Len=0"
"7.756933","5.9.29.183","172.19.0.3","TLSv1.2","261","Application Data"
"7.756959","172.19.0.3","5.9.29.183","TCP","56","43520 → 9002 [ACK] Seq=20490 Ack=346775 Win=11902 Len=0"
"7.762337","172.19.0.3","5.9.29.183","TLSv1.2","599","Application Data"
"7.762733","5.9.29.183","172.19.0.3","TCP","56","9002 → 43520 [ACK] Seq=346775 Ack=21033 Win=65535 Len=0"
"8.100547","5.9.29.183","172.19.0.3","TLSv1.2","599","Application Data"
"8.101226","172.19.0.3","5.9.29.183","TLSv1.2","599","Application Data"
"8.101516","5.9.29.183","172.19.0.3","TCP","56","9002 → 43520 [ACK] Seq=347318 Ack=21576 Win=65535 Len=0"
"8.505236","5.9.29.183","172.19.0.3","TCP","1504","[TCP segment of a reassembled PDU]"
"8.505279","5.9.29.183","172.19.0.3","TCP","1516","9002 → 43520 [PSH, ACK] Seq=348766 Ack=21576 Win=65535 Len=1460 [TCP segment of a reassembled PDU]"
"8.505322","5.9.29.183","172.19.0.3","TLSv1.2","1516","Application Data [TCP segment of a reassembled PDU]"
"8.505328","5.9.29.183","172.19.0.3","TCP","1516","9002 → 43520 [PSH, ACK] Seq=351686 Ack=21576 Win=65535 Len=1460 [TCP segment of a reassembled PDU]"
"8.505536","172.19.0.3","5.9.29.183","TCP","56","43520 → 9002 [ACK] Seq=21576 Ack=353146 Win=11887 Len=0"
"8.505944","172.19.0.3","5.9.29.183","TLSv1.2","599","Application Data"
"8.506503","5.9.29.183","172.19.0.3","TCP","1201","9002 → 43520 [PSH, ACK] Seq=353146 Ack=21576 Win=65535 Len=1145 [TCP segment of a reassembled PDU]"
"8.506515","5.9.29.183","172.19.0.3","TLSv1.2","1516","Application Data [TCP segment of a reassembled PDU]"
"8.506530","172.19.0.3","5.9.29.183","TCP","56","43520 → 9002 [ACK] Seq=22119 Ack=355751 Win=11903 Len=0"
"8.506536","5.9.29.183","172.19.0.3","TCP","1516","9002 → 43520 [PSH, ACK] Seq=355751 Ack=21576 Win=65535 Len=1460 [TCP segment of a reassembled PDU]"
"8.506541","5.9.29.183","172.19.0.3","TCP","1516","9002 → 43520 [PSH, ACK] Seq=357211 Ack=21576 Win=65535 Len=1460 [TCP segment of a reassembled PDU]"
"8.506546","5.9.29.183","172.19.0.3","TLSv1.2","1516","Application Data [TCP segment of a reassembled PDU]"
"8.506554","5.9.29.183","172.19.0.3","TCP","1456","9002 → 43520 [PSH, ACK] Seq=360131 Ack=21576 Win=65535 Len=1400 [TCP segment of a reassembled PDU]"
"8.506721","172.19.0.3","5.9.29.183","TCP","56","43520 → 9002 [ACK] Seq=22119 Ack=361531 Win=11871 Len=0"
"8.506834","5.9.29.183","172.19.0.3","TCP","56","9002 → 43520 [ACK] Seq=361531 Ack=22119 Win=65535 Len=0"
"8.520451","5.9.29.183","172.19.0.3","TCP","1504","9002 → 43520 [PSH, ACK] Seq=361531 Ack=22119 Win=65535 Len=1448 [TCP segment of a reassembled PDU]"
"8.520480","5.9.29.183","172.19.0.3","TLSv1.2","1516","Application Data, Application Data"
"8.520495","172.19.0.3","5.9.29.183","TCP","56","43520 → 9002 [ACK] Seq=22119 Ack=364439 Win=11903 Len=0"
"8.520499","5.9.29.183","172.19.0.3","TCP","1516","9002 → 43520 [PSH, ACK] Seq=364439 Ack=22119 Win=65535 Len=1460 [TCP segment of a reassembled PDU]"
"8.520504","5.9.29.183","172.19.0.3","TCP","1480","9002 → 43520 [PSH, ACK] Seq=365899 Ack=22119 Win=65535 Len=1424 [TCP segment of a reassembled PDU]"
"8.520509","5.9.29.183","172.19.0.3","TLSv1.2","1504","Application Data [TCP segment of a reassembled PDU]"
"8.520631","5.9.29.183","172.19.0.3","TCP","1516","9002 → 43520 [PSH, ACK] Seq=368771 Ack=22119 Win=65535 Len=1460 [TCP segment of a reassembled PDU]"
"8.520653","5.9.29.183","172.19.0.3","TCP","1492","9002 → 43520 [PSH, ACK] Seq=370231 Ack=22119 Win=65535 Len=1436 [TCP segment of a reassembled PDU]"
"8.520656","5.9.29.183","172.19.0.3","TLSv1.2","1516","Application Data [TCP segment of a reassembled PDU]"
"8.520690","5.9.29.183","172.19.0.3","TCP","1516","9002 → 43520 [PSH, ACK] Seq=373127 Ack=22119 Win=65535 Len=1460 [TCP segment of a reassembled PDU]"
"8.520723","5.9.29.183","172.19.0.3","TLSv1.2","261","Application Data"
"8.520780","172.19.0.3","5.9.29.183","TCP","56","43520 → 9002 [ACK] Seq=22119 Ack=374792 Win=11836 Len=0"
"8.521250","172.19.0.3","5.9.29.183","TLSv1.2","599","Application Data"
"8.521387","5.9.29.183","172.19.0.3","TCP","56","9002 → 43520 [ACK] Seq=374792 Ack=22662 Win=65535 Len=0"
"8.583707","5.9.29.183","172.19.0.3","TCP","1516","[TCP segment of a reassembled PDU]"
"8.583835","5.9.29.183","172.19.0.3","TCP","1516","9002 → 43520 [PSH, ACK] Seq=376252 Ack=22662 Win=65535 Len=1460 [TCP segment of a reassembled PDU]"
"8.583847","5.9.29.183","172.19.0.3","TLSv1.2","1516","Application Data [TCP segment of a reassembled PDU]"
"8.583851","5.9.29.183","172.19.0.3","TCP","1516","9002 → 43520 [PSH, ACK] Seq=379172 Ack=22662 Win=65535 Len=1460 [TCP segment of a reassembled PDU]"
"8.583855","5.9.29.183","172.19.0.3","TCP","1516","9002 → 43520 [PSH, ACK] Seq=380632 Ack=22662 Win=65535 Len=1460 [TCP segment of a reassembled PDU]"
"8.583858","5.9.29.183","172.19.0.3","TLSv1.2","1177","Application Data [TCP segment of a reassembled PDU]"
"8.583920","5.9.29.183","172.19.0.3","TCP","1516","9002 → 43520 [PSH, ACK] Seq=383213 Ack=22662 Win=65535 Len=1460 [TCP segment of a reassembled PDU]"
"8.583926","5.9.29.183","172.19.0.3","TCP","1492","9002 → 43520 [PSH, ACK] Seq=384673 Ack=22662 Win=65535 Len=1436 [TCP segment of a reassembled PDU]"
"8.584055","172.19.0.3","5.9.29.183","TCP","56","43520 → 9002 [ACK] Seq=22662 Ack=386109 Win=11855 Len=0"
"8.598652","5.9.29.183","172.19.0.3","TLSv1.2","1516","Application Data [TCP segment of a reassembled PDU]"
"8.598731","5.9.29.183","172.19.0.3","TCP","67","9002 → 43520 [PSH, ACK] Seq=387569 Ack=22662 Win=65535 Len=11 [TCP segment of a reassembled PDU]"
"8.598749","172.19.0.3","5.9.29.183","TCP","56","43520 → 9002 [ACK] Seq=22662 Ack=387580 Win=11909 Len=0"
"8.598752","5.9.29.183","172.19.0.3","TCP","1516","9002 → 43520 [PSH, ACK] Seq=387580 Ack=22662 Win=65535 Len=1460 [TCP segment of a reassembled PDU]"
"8.599049","5.9.29.183","172.19.0.3","TCP","1516","9002 → 43520 [PSH, ACK] Seq=389040 Ack=22662 Win=65535 Len=1460 [TCP segment of a reassembled PDU]"
"8.599059","5.9.29.183","172.19.0.3","TLSv1.2","1516","Application Data [TCP segment of a reassembled PDU]"
"8.599062","5.9.29.183","172.19.0.3","TCP","1516","9002 → 43520 [PSH, ACK] Seq=391960 Ack=22662 Win=65535 Len=1460 [TCP segment of a reassembled PDU]"
"8.599065","5.9.29.183","172.19.0.3","TLSv1.2","1516","Application Data [TCP segment of a reassembled PDU]"
"8.599069","5.9.29.183","172.19.0.3","TCP","1516","9002 → 43520 [PSH, ACK] Seq=394880 Ack=22662 Win=65535 Len=1460 [TCP segment of a reassembled PDU]"
"8.599072","5.9.29.183","172.19.0.3","TCP","553","9002 → 43520 [PSH, ACK] Seq=396340 Ack=22662 Win=65535 Len=497 [TCP segment of a reassembled PDU]"
"8.599075","5.9.29.183","172.19.0.3","TCP","1516","9002 → 43520 [PSH, ACK] Seq=396837 Ack=22662 Win=65535 Len=1460 [TCP segment of a reassembled PDU]"
"8.599124","5.9.29.183","172.19.0.3","TLSv1.2","1516","Application Data [TCP segment of a reassembled PDU]"
"8.599131","5.9.29.183","172.19.0.3","TCP","1516","9002 → 43520 [PSH, ACK] Seq=399757 Ack=22662 Win=65535 Len=1460 [TCP segment of a reassembled PDU]"
"8.599134","5.9.29.183","172.19.0.3","TCP","1468","9002 → 43520 [PSH, ACK] Seq=401217 Ack=22662 Win=65535 Len=1412 [TCP segment of a reassembled PDU]"
"8.599203","172.19.0.3","5.9.29.183","TCP","56","43520 → 9002 [ACK] Seq=22662 Ack=402629 Win=11818 Len=0"
"8.605763","5.9.29.183","172.19.0.3","TLSv1.2","1504","Application Data, Application Data"
"8.606169","172.19.0.3","5.9.29.183","TLSv1.2","1113","Application Data"
"8.606427","5.9.29.183","172.19.0.3","TCP","56","9002 → 43520 [ACK] Seq=404077 Ack=23719 Win=65535 Len=0"
"8.613895","5.9.29.183","172.19.0.3","TLSv1.2","330","Application Data"
"8.614872","5.9.29.183","172.19.0.3","TCP","1504","[TCP segment of a reassembled PDU]"
"8.614882","172.19.0.3","5.9.29.183","TCP","56","43520 → 9002 [ACK] Seq=23719 Ack=405799 Win=11911 Len=0"
"8.615092","5.9.29.183","172.19.0.3","TCP","1504","9002 → 43520 [PSH, ACK] Seq=405799 Ack=23719 Win=65535 Len=1448 [TCP segment of a reassembled PDU]"
"8.615149","5.9.29.183","172.19.0.3","TLSv1.2","1516","Application Data [TCP segment of a reassembled PDU]"
"8.615243","172.19.0.3","5.9.29.183","TCP","56","43520 → 9002 [ACK] Seq=23719 Ack=408707 Win=11895 Len=0"
"8.615279","5.9.29.183","172.19.0.3","TCP","1492","9002 → 43520 [PSH, ACK] Seq=408707 Ack=23719 Win=65535 Len=1436 [TCP segment of a reassembled PDU]"
"8.615357","5.9.29.183","172.19.0.3","TCP","1516","9002 → 43520 [PSH, ACK] Seq=410143 Ack=23719 Win=65535 Len=1460 [TCP segment of a reassembled PDU]"
"8.615361","5.9.29.183","172.19.0.3","TLSv1.2","1516","Application Data [TCP segment of a reassembled PDU]"
"8.615399","5.9.29.183","172.19.0.3","TCP","1516","9002 → 43520 [PSH, ACK] Seq=413063 Ack=23719 Win=65535 Len=1460 [TCP segment of a reassembled PDU]"
"8.615476","5.9.29.183","172.19.0.3","TCP","1516","9002 → 43520 [PSH, ACK] Seq=414523 Ack=23719 Win=65535 Len=1460 [TCP segment of a reassembled PDU]"
"8.615480","5.9.29.183","172.19.0.3","TLSv1.2","1516","Application Data [TCP segment of a reassembled PDU]"
"8.615489","5.9.29.183","172.19.0.3","TCP","1516","9002 → 43520 [PSH, ACK] Seq=417443 Ack=23719 Win=65535 Len=1460 [TCP segment of a reassembled PDU]"
"8.615550","172.19.0.3","5.9.29.183","TCP","56","43520 → 9002 [ACK] Seq=23719 Ack=418903 Win=11838 Len=0"
"8.615789","5.9.29.183","172.19.0.3","TCP","1432","9002 → 43520 [PSH, ACK] Seq=418903 Ack=23719 Win=65535 Len=1376 [TCP segment of a reassembled PDU]"
"8.621815","5.9.29.183","172.19.0.3","TLSv1.2","1504","Application Data, Application Data"
"8.621831","172.19.0.3","5.9.29.183","TCP","56","43520 → 9002 [ACK] Seq=23719 Ack=421727 Win=11909 Len=0"
"8.629137","5.9.29.183","172.19.0.3","TLSv1.2","1358","Application Data"
"8.670267","172.19.0.3","5.9.29.183","TCP","56","43520 → 9002 [ACK] Seq=23719 Ack=423029 Win=11911 Len=0"
