_ws.col.Time,_ws.col.Source,_ws.col.Destination,_ws.col.Protocol,_ws.col.Length,_ws.col.Info
"0.000000","172.18.0.2","54.38.73.16","TLSv1.2","611","Application Data"
"0.024794","54.38.73.16","172.18.0.2","TCP","68","21002 → 36876 [ACK] Seq=1 Ack=544 Win=1452 Len=0 TSval=2676491613 TSecr=1089369762"
"0.206424","54.38.73.16","172.18.0.2","TLSv1.2","611","Application Data"
"0.206481","172.18.0.2","54.38.73.16","TCP","68","36876 → 21002 [ACK] Seq=544 Ack=544 Win=5608 Len=0 TSval=1089369969 TSecr=2676491658"
"0.207637","172.18.0.2","54.38.73.16","TLSv1.2","2153","Application Data"
"0.232791","54.38.73.16","172.18.0.2","TCP","68","21002 → 36876 [ACK] Seq=544 Ack=2629 Win=1450 Len=0 TSval=2676491665 TSecr=1089369970"
"0.438449","54.38.73.16","172.18.0.2","TLSv1.2","611","Application Data"
"0.438504","172.18.0.2","54.38.73.16","TCP","68","36876 → 21002 [ACK] Seq=2629 Ack=1087 Win=5608 Len=0 TSval=1089370201 TSecr=2676491716"
"0.471315","54.38.73.16","172.18.0.2","TLSv1.2","1125","Application Data"
"0.471351","172.18.0.2","54.38.73.16","TCP","68","36876 → 21002 [ACK] Seq=2629 Ack=2144 Win=5600 Len=0 TSval=1089370234 TSecr=2676491725"
"0.477952","172.18.0.2","54.38.73.16","TLSv1.2","611","Application Data"
"0.503440","54.38.73.16","172.18.0.2","TCP","68","21002 → 36876 [ACK] Seq=2144 Ack=3172 Win=1452 Len=0 TSval=2676491733 TSecr=1089370240"
"0.714879","54.38.73.16","172.18.0.2","TLSv1.2","611","Application Data"
"0.714915","172.18.0.2","54.38.73.16","TCP","68","36876 → 21002 [ACK] Seq=3172 Ack=2687 Win=5608 Len=0 TSval=1089370477 TSecr=2676491785"
"0.715939","172.18.0.2","54.38.73.16","TLSv1.2","611","Application Data"
"0.739967","54.38.73.16","172.18.0.2","TCP","68","21002 → 36876 [ACK] Seq=2687 Ack=3715 Win=1452 Len=0 TSval=2676491792 TSecr=1089370478"
"1.065014","54.38.73.16","172.18.0.2","TLSv1.2","3695","Application Data"
"1.065206","172.18.0.2","54.38.73.16","TCP","68","36876 → 21002 [ACK] Seq=3715 Ack=6314 Win=5584 Len=0 TSval=1089370828 TSecr=2676491873"
"1.077814","54.38.73.16","172.18.0.2","TCP","2964","[TCP segment of a reassembled PDU]"
"1.077847","172.18.0.2","54.38.73.16","TCP","68","36876 → 21002 [ACK] Seq=3715 Ack=9210 Win=5596 Len=0 TSval=1089370840 TSecr=2676491876"
"1.088030","54.38.73.16","172.18.0.2","TLSv1.2","1516","Application Data [TCP segment of a reassembled PDU]"
"1.088648","54.38.73.16","172.18.0.2","TLSv1.2","5860","Application Data [TCP segment of a reassembled PDU]"
"1.088809","172.18.0.2","54.38.73.16","TCP","68","36876 → 21002 [ACK] Seq=3715 Ack=16450 Win=5581 Len=0 TSval=1089370851 TSecr=2676491879"
"1.090682","54.38.73.16","172.18.0.2","TLSv1.2","1870","Application Data, Application Data"
"1.090719","172.18.0.2","54.38.73.16","TCP","68","36876 → 21002 [ACK] Seq=3715 Ack=18252 Win=5600 Len=0 TSval=1089370853 TSecr=2676491879"
"1.101146","54.38.73.16","172.18.0.2","TCP","2964","[TCP segment of a reassembled PDU]"
"1.101328","172.18.0.2","54.38.73.16","TCP","68","36876 → 21002 [ACK] Seq=3715 Ack=21148 Win=5596 Len=0 TSval=1089370864 TSecr=2676491882"
"1.103163","54.38.73.16","172.18.0.2","TLSv1.2","2964","Application Data [TCP segment of a reassembled PDU]"
"1.103197","172.18.0.2","54.38.73.16","TCP","68","36876 → 21002 [ACK] Seq=3715 Ack=24044 Win=5596 Len=0 TSval=1089370866 TSecr=2676491883"
"1.113852","54.38.73.16","172.18.0.2","TLSv1.2","5860","Application Data [TCP segment of a reassembled PDU]"
"1.114029","172.18.0.2","54.38.73.16","TCP","68","36876 → 21002 [ACK] Seq=3715 Ack=29836 Win=5581 Len=0 TSval=1089370876 TSecr=2676491885"
"1.117111","54.38.73.16","172.18.0.2","TLSv1.2","2964","Application Data [TCP segment of a reassembled PDU]"
"1.117143","172.18.0.2","54.38.73.16","TCP","68","36876 → 21002 [ACK] Seq=3715 Ack=32732 Win=5596 Len=0 TSval=1089370879 TSecr=2676491886"
"1.117633","172.18.0.2","54.38.73.16","TLSv1.2","611","Application Data"
"1.126842","54.38.73.16","172.18.0.2","TLSv1.2","2964","Application Data, Application Data"
"1.126876","172.18.0.2","54.38.73.16","TCP","68","36876 → 21002 [ACK] Seq=4258 Ack=35628 Win=5596 Len=0 TSval=1089370889 TSecr=2676491888"
"1.128880","54.38.73.16","172.18.0.2","TLSv1.2","5860","Application Data, Application Data"
"1.129064","172.18.0.2","54.38.73.16","TCP","68","36876 → 21002 [ACK] Seq=4258 Ack=41420 Win=5581 Len=0 TSval=1089370891 TSecr=2676491889"
"1.139341","54.38.73.16","172.18.0.2","TLSv1.2","5860","Application Data [TCP segment of a reassembled PDU]"
"1.139374","172.18.0.2","54.38.73.16","TCP","68","36876 → 21002 [ACK] Seq=4258 Ack=47212 Win=5581 Len=0 TSval=1089370902 TSecr=2676491892"
"1.142283","54.38.73.16","172.18.0.2","TCP","68","[TCP Previous segment not captured] 21002 → 36876 [ACK] Seq=50108 Ack=4258 Win=1452 Len=0 TSval=2676491892 TSecr=1089370880"
"1.142338","172.18.0.2","54.38.73.16","TLSv1.2","611","Application Data"
"1.142301","54.38.73.16","172.18.0.2","TCP","2964","[TCP Retransmission] 21002 → 36876 [ACK] Seq=47212 Ack=3715 Win=1452 Len=2896 TSval=2676491892 TSecr=1089370879"
"1.142498","172.18.0.2","54.38.73.16","TCP","68","36876 → 21002 [ACK] Seq=4801 Ack=50108 Win=5596 Len=0 TSval=1089370905 TSecr=2676491892"
"1.151925","54.38.73.16","172.18.0.2","TLSv1.2","2964","Ignored Unknown Record"
"1.151958","172.18.0.2","54.38.73.16","TCP","68","36876 → 21002 [ACK] Seq=4801 Ack=53004 Win=5596 Len=0 TSval=1089370914 TSecr=2676491895"
"1.154580","54.38.73.16","172.18.0.2","TLSv1.2","8756","Ignored Unknown Record"
"1.154763","172.18.0.2","54.38.73.16","TCP","68","36876 → 21002 [ACK] Seq=4801 Ack=61692 Win=5566 Len=0 TSval=1089370917 TSecr=2676491895"
"1.162915","54.38.73.16","172.18.0.2","TLSv1.2","5860","Ignored Unknown Record"
"1.162951","172.18.0.2","54.38.73.16","TCP","68","36876 → 21002 [ACK] Seq=4801 Ack=67484 Win=5581 Len=0 TSval=1089370925 TSecr=2676491898"
"1.166306","54.38.73.16","172.18.0.2","TLSv1.2","2964","Ignored Unknown Record"
"1.166346","172.18.0.2","54.38.73.16","TLSv1.2","611","Application Data"
"1.177179","54.38.73.16","172.18.0.2","TLSv1.2","2964","Ignored Unknown Record"
"1.177212","172.18.0.2","54.38.73.16","TCP","68","36876 → 21002 [ACK] Seq=5344 Ack=73276 Win=5596 Len=0 TSval=1089370940 TSecr=2676491901"
"1.179993","54.38.73.16","172.18.0.2","TLSv1.2","6247","Ignored Unknown Record"
"1.180166","172.18.0.2","54.38.73.16","TCP","68","36876 → 21002 [ACK] Seq=5344 Ack=79455 Win=5565 Len=0 TSval=1089370942 TSecr=2676491902"
"1.227072","54.38.73.16","172.18.0.2","TCP","68","21002 → 36876 [ACK] Seq=79455 Ack=5344 Win=1452 Len=0 TSval=2676491914 TSecr=1089370929"
"1.227117","172.18.0.2","54.38.73.16","TLSv1.2","611","Application Data"
"1.291107","54.38.73.16","172.18.0.2","TCP","68","21002 → 36876 [ACK] Seq=79455 Ack=5887 Win=1452 Len=0 TSval=2676491930 TSecr=1089370989"
"1.450259","54.38.73.16","172.18.0.2","TLSv1.2","611","Application Data"
"1.451346","172.18.0.2","54.38.73.16","TLSv1.2","611","Application Data"
"1.515533","54.38.73.16","172.18.0.2","TCP","68","21002 → 36876 [ACK] Seq=79998 Ack=6430 Win=1452 Len=0 TSval=2676491986 TSecr=1089371214"
"1.687905","54.38.73.16","172.18.0.2","TLSv1.2","611","Application Data"
"1.720710","54.38.73.16","172.18.0.2","TCP","1516","[TCP segment of a reassembled PDU]"
"1.720761","172.18.0.2","54.38.73.16","TCP","68","36876 → 21002 [ACK] Seq=6430 Ack=81989 Win=5597 Len=0 TSval=1089371483 TSecr=2676492028"
"1.736642","54.38.73.16","172.18.0.2","TLSv1.2","2964","Application Data [TCP segment of a reassembled PDU]"
"1.736787","54.38.73.16","172.18.0.2","TCP","1516","21002 → 36876 [ACK] Seq=84885 Ack=6430 Win=1452 Len=1448 TSval=2676492039 TSecr=1089371214 [TCP segment of a reassembled PDU]"
"1.736834","172.18.0.2","54.38.73.16","TCP","68","36876 → 21002 [ACK] Seq=6430 Ack=84885 Win=5577 Len=0 TSval=1089371499 TSecr=2676492039"
"1.753038","54.38.73.16","172.18.0.2","TLSv1.2","1030","[TCP Previous segment not captured] , Ignored Unknown Record"
"1.753087","172.18.0.2","54.38.73.16","TCP","80","36876 → 21002 [ACK] Seq=6430 Ack=86333 Win=5605 Len=0 TSval=1089371515 TSecr=2676492039 SLE=93573 SRE=94535"
"1.753055","54.38.73.16","172.18.0.2","TCP","7308","[TCP Out-Of-Order] 21002 → 36876 [ACK] Seq=86333 Ack=6430 Win=1452 Len=7240 TSval=2676492044 TSecr=1089371214"
"1.753122","172.18.0.2","54.38.73.16","TCP","68","36876 → 21002 [ACK] Seq=6430 Ack=94535 Win=5568 Len=0 TSval=1089371515 TSecr=2676492044"
"1.773817","54.38.73.16","172.18.0.2","TLSv1.2","7308","Application Data, Application Data"
"1.774012","172.18.0.2","54.38.73.16","TCP","68","36876 → 21002 [ACK] Seq=6430 Ack=101775 Win=5565 Len=0 TSval=1089371536 TSecr=2676492050"
"1.774371","172.18.0.2","54.38.73.16","TLSv1.2","611","Application Data"
"1.787229","54.38.73.16","172.18.0.2","TLSv1.2","2710","Application Data, Application Data"
"1.787266","172.18.0.2","54.38.73.16","TCP","68","36876 → 21002 [ACK] Seq=6973 Ack=104417 Win=5597 Len=0 TSval=1089371550 TSecr=2676492052"
"1.790687","54.38.73.16","172.18.0.2","TCP","2964","[TCP segment of a reassembled PDU]"
"1.790832","172.18.0.2","54.38.73.16","TCP","68","36876 → 21002 [ACK] Seq=6973 Ack=107313 Win=5596 Len=0 TSval=1089371553 TSecr=2676492053"
"1.799009","54.38.73.16","172.18.0.2","TLSv1.2","4412","Application Data [TCP segment of a reassembled PDU]"
"1.799193","172.18.0.2","54.38.73.16","TCP","68","36876 → 21002 [ACK] Seq=6973 Ack=111657 Win=5580 Len=0 TSval=1089371562 TSecr=2676492056"
"1.803386","54.38.73.16","172.18.0.2","TCP","68","21002 → 36876 [ACK] Seq=111657 Ack=6973 Win=1452 Len=0 TSval=2676492058 TSecr=1089371537"
"1.803429","172.18.0.2","54.38.73.16","TLSv1.2","611","Application Data"
"1.809585","54.38.73.16","172.18.0.2","TLSv1.2","2964","Application Data, Application Data"
"1.809760","172.18.0.2","54.38.73.16","TCP","68","36876 → 21002 [ACK] Seq=7516 Ack=114553 Win=5596 Len=0 TSval=1089371572 TSecr=2676492059"
"1.811384","54.38.73.16","172.18.0.2","TLSv1.2","328","Application Data"
"1.818694","54.38.73.16","172.18.0.2","TLSv1.2","7308","Application Data"
"1.818882","172.18.0.2","54.38.73.16","TCP","68","36876 → 21002 [ACK] Seq=7516 Ack=122053 Win=5565 Len=0 TSval=1089371581 TSecr=2676492060"
"1.830881","54.38.73.16","172.18.0.2","TLSv1.2","7308","Application Data, Application Data"
"1.830922","172.18.0.2","54.38.73.16","TCP","68","36876 → 21002 [ACK] Seq=7516 Ack=129293 Win=5565 Len=0 TSval=1089371593 TSecr=2676492064"
"1.834506","54.38.73.16","172.18.0.2","TLSv1.2","2964","Application Data [TCP segment of a reassembled PDU]"
"1.834538","172.18.0.2","54.38.73.16","TCP","68","36876 → 21002 [ACK] Seq=7516 Ack=132189 Win=5596 Len=0 TSval=1089371597 TSecr=2676492065"
"1.844340","54.38.73.16","172.18.0.2","TLSv1.2","8756","Application Data, Application Data, Application Data"
"1.844523","172.18.0.2","54.38.73.16","TCP","68","36876 → 21002 [ACK] Seq=7516 Ack=140877 Win=5549 Len=0 TSval=1089371607 TSecr=2676492068"
"1.844982","172.18.0.2","54.38.73.16","TLSv1.2","611","Application Data"
"1.856825","54.38.73.16","172.18.0.2","TLSv1.2","5860","Application Data [TCP segment of a reassembled PDU]"
"1.856861","172.18.0.2","54.38.73.16","TCP","68","36876 → 21002 [ACK] Seq=8059 Ack=146669 Win=5581 Len=0 TSval=1089371619 TSecr=2676492071"
"1.860324","54.38.73.16","172.18.0.2","TLSv1.2","2964","Application Data, Application Data"
"1.860356","172.18.0.2","54.38.73.16","TCP","68","36876 → 21002 [ACK] Seq=8059 Ack=149565 Win=5596 Len=0 TSval=1089371623 TSecr=2676492072"
"1.871946","54.38.73.16","172.18.0.2","TLSv1.2","2672","Application Data, Application Data"
"1.871983","172.18.0.2","54.38.73.16","TCP","68","36876 → 21002 [ACK] Seq=8059 Ack=152169 Win=5597 Len=0 TSval=1089371634 TSecr=2676492074"
"1.871951","54.38.73.16","172.18.0.2","TCP","2964","[TCP segment of a reassembled PDU]"
"1.872022","172.18.0.2","54.38.73.16","TLSv1.2","611","Application Data"
"1.884451","54.38.73.16","172.18.0.2","TLSv1.2","1516","Application Data [TCP segment of a reassembled PDU]"
"1.897495","54.38.73.16","172.18.0.2","TLSv1.2","408","Application Data"
"1.897571","172.18.0.2","54.38.73.16","TCP","68","36876 → 21002 [ACK] Seq=8602 Ack=156853 Win=5608 Len=0 TSval=1089371660 TSecr=2676492077"
"1.922757","54.38.73.16","172.18.0.2","TLSv1.2","1125","Application Data"
"1.933582","172.18.0.2","54.38.73.16","TLSv1.2","611","Application Data"
"1.994817","54.38.73.16","172.18.0.2","TCP","68","21002 → 36876 [ACK] Seq=157910 Ack=9145 Win=1452 Len=0 TSval=2676492106 TSecr=1089371696"
"2.175933","54.38.73.16","172.18.0.2","TLSv1.2","611","Application Data"
"2.177022","172.18.0.2","54.38.73.16","TLSv1.2","611","Application Data"
"2.203814","54.38.73.16","172.18.0.2","TCP","68","21002 → 36876 [ACK] Seq=158453 Ack=9688 Win=1452 Len=0 TSval=2676492158 TSecr=1089371939"
"2.393180","54.38.73.16","172.18.0.2","TLSv1.2","611","Application Data"
"2.436370","172.18.0.2","54.38.73.16","TCP","68","36876 → 21002 [ACK] Seq=9688 Ack=158996 Win=5612 Len=0 TSval=1089372199 TSecr=2676492205"
"2.437390","54.38.73.16","172.18.0.2","TCP","2964","[TCP segment of a reassembled PDU]"
"2.437442","172.18.0.2","54.38.73.16","TCP","68","36876 → 21002 [ACK] Seq=9688 Ack=161892 Win=5596 Len=0 TSval=1089372200 TSecr=2676492216"
"2.461750","54.38.73.16","172.18.0.2","TLSv1.2","1342","Application Data, Application Data"
"2.461825","172.18.0.2","54.38.73.16","TCP","68","36876 → 21002 [ACK] Seq=9688 Ack=163166 Win=5593 Len=0 TSval=1089372224 TSecr=2676492222"
"2.468545","172.18.0.2","54.38.73.16","TLSv1.2","611","Application Data"
"2.492128","54.38.73.16","172.18.0.2","TCP","68","21002 → 36876 [ACK] Seq=163166 Ack=10231 Win=1452 Len=0 TSval=2676492230 TSecr=1089372231"
"2.769687","54.38.73.16","172.18.0.2","TLSv1.2","611","Application Data"
"2.769741","172.18.0.2","54.38.73.16","TCP","68","36876 → 21002 [ACK] Seq=10231 Ack=163709 Win=5608 Len=0 TSval=1089372532 TSecr=2676492278"
"2.770741","172.18.0.2","54.38.73.16","TLSv1.2","611","Application Data"
"2.795161","54.38.73.16","172.18.0.2","TCP","68","21002 → 36876 [ACK] Seq=163709 Ack=10774 Win=1452 Len=0 TSval=2676492306 TSecr=1089372533"
"3.096475","54.38.73.16","172.18.0.2","TLSv1.2","611","Application Data"
"3.096530","172.18.0.2","54.38.73.16","TCP","68","36876 → 21002 [ACK] Seq=10774 Ack=164252 Win=5608 Len=0 TSval=1089372859 TSecr=2676492380"
"3.104612","54.38.73.16","172.18.0.2","TLSv1.2","7308","Application Data"
"3.104666","172.18.0.2","54.38.73.16","TCP","68","36876 → 21002 [ACK] Seq=10774 Ack=171492 Win=5565 Len=0 TSval=1089372867 TSecr=2676492383"
"3.117365","54.38.73.16","172.18.0.2","TLSv1.2","4412","Application Data [TCP segment of a reassembled PDU]"
"3.117400","172.18.0.2","54.38.73.16","TCP","68","36876 → 21002 [ACK] Seq=10774 Ack=175836 Win=5580 Len=0 TSval=1089372880 TSecr=2676492386"
"3.121025","54.38.73.16","172.18.0.2","TLSv1.2","422","Application Data, Application Data"
"3.121061","172.18.0.2","54.38.73.16","TCP","68","36876 → 21002 [ACK] Seq=10774 Ack=176190 Win=5593 Len=0 TSval=1089372883 TSecr=2676492387"
"3.125790","54.38.73.16","172.18.0.2","TCP","2964","[TCP segment of a reassembled PDU]"
"3.125826","172.18.0.2","54.38.73.16","TCP","68","36876 → 21002 [ACK] Seq=10774 Ack=179086 Win=5596 Len=0 TSval=1089372888 TSecr=2676492388"
"3.128863","54.38.73.16","172.18.0.2","TLSv1.2","8756","Application Data, Application Data"
"3.128898","172.18.0.2","54.38.73.16","TCP","68","36876 → 21002 [ACK] Seq=10774 Ack=187774 Win=5566 Len=0 TSval=1089372891 TSecr=2676492389"
"3.136495","54.38.73.16","172.18.0.2","TLSv1.2","1516","Application Data [TCP segment of a reassembled PDU]"
"3.136526","172.18.0.2","54.38.73.16","TCP","68","36876 → 21002 [ACK] Seq=10774 Ack=189222 Win=5593 Len=0 TSval=1089372899 TSecr=2676492391"
"3.142300","54.38.73.16","172.18.0.2","TCP","2964","21002 → 36876 [ACK] Seq=189222 Ack=10774 Win=1452 Len=2896 TSval=2676492392 TSecr=1089372880 [TCP segment of a reassembled PDU]"
"3.142333","172.18.0.2","54.38.73.16","TCP","68","36876 → 21002 [ACK] Seq=10774 Ack=192118 Win=5596 Len=0 TSval=1089372905 TSecr=2676492392"
"3.146692","54.38.73.16","172.18.0.2","TLSv1.2","2964","Application Data [TCP segment of a reassembled PDU]"
"3.146727","172.18.0.2","54.38.73.16","TCP","68","36876 → 21002 [ACK] Seq=10774 Ack=195014 Win=5596 Len=0 TSval=1089372909 TSecr=2676492393"
"3.147258","172.18.0.2","54.38.73.16","TLSv1.2","611","Application Data"
"3.151333","54.38.73.16","172.18.0.2","TLSv1.2","2964","Application Data [TCP segment of a reassembled PDU]"
"3.151365","172.18.0.2","54.38.73.16","TCP","68","36876 → 21002 [ACK] Seq=11317 Ack=197910 Win=5596 Len=0 TSval=1089372914 TSecr=2676492395"
"3.153971","54.38.73.16","172.18.0.2","TLSv1.2","8756","Application Data, Application Data"
"3.154145","172.18.0.2","54.38.73.16","TCP","68","36876 → 21002 [ACK] Seq=11317 Ack=206598 Win=5566 Len=0 TSval=1089372916 TSecr=2676492395"
"3.167375","54.38.73.16","172.18.0.2","TLSv1.2","2964","Application Data [TCP segment of a reassembled PDU]"
"3.167409","172.18.0.2","54.38.73.16","TCP","68","36876 → 21002 [ACK] Seq=11317 Ack=209494 Win=5596 Len=0 TSval=1089372930 TSecr=2676492399"
"3.172870","54.38.73.16","172.18.0.2","TLSv1.2","5860","Application Data, Application Data"
"3.173043","172.18.0.2","54.38.73.16","TCP","68","36876 → 21002 [ACK] Seq=11317 Ack=215286 Win=5581 Len=0 TSval=1089372935 TSecr=2676492400"
"3.175421","54.38.73.16","172.18.0.2","TCP","68","21002 → 36876 [ACK] Seq=215286 Ack=11317 Win=1452 Len=0 TSval=2676492400 TSecr=1089372910"
"3.175462","172.18.0.2","54.38.73.16","TLSv1.2","611","Application Data"
"3.176610","54.38.73.16","172.18.0.2","TLSv1.2","1383","Application Data"
"3.180342","54.38.73.16","172.18.0.2","TCP","2964","[TCP segment of a reassembled PDU]"
"3.180496","54.38.73.16","172.18.0.2","TLSv1.2","7308","Application Data, Application Data"
"3.180523","172.18.0.2","54.38.73.16","TCP","68","36876 → 21002 [ACK] Seq=11860 Ack=219497 Win=5596 Len=0 TSval=1089372943 TSecr=2676492401"
"3.180621","172.18.0.2","54.38.73.16","TCP","68","36876 → 21002 [ACK] Seq=11860 Ack=226737 Win=5550 Len=0 TSval=1089372943 TSecr=2676492402"
"3.192710","54.38.73.16","172.18.0.2","TCP","1516","21002 → 36876 [ACK] Seq=226737 Ack=11317 Win=1452 Len=1448 TSval=2676492405 TSecr=1089372930 [TCP segment of a reassembled PDU]"
"3.209395","54.38.73.16","172.18.0.2","TLSv1.2","936","Application Data, Application Data"
"3.209441","172.18.0.2","54.38.73.16","TLSv1.2","611","Application Data"
"3.274882","54.38.73.16","172.18.0.2","TCP","68","21002 → 36876 [ACK] Seq=229053 Ack=12403 Win=1452 Len=0 TSval=2676492426 TSecr=1089372972"
"3.274951","172.18.0.2","54.38.73.16","TLSv1.2","611","Application Data"
"3.298805","54.38.73.16","172.18.0.2","TCP","68","21002 → 36876 [ACK] Seq=229053 Ack=12946 Win=1452 Len=0 TSval=2676492431 TSecr=1089373037"
"3.587967","54.38.73.16","172.18.0.2","TLSv1.2","611","Application Data"
"3.589066","172.18.0.2","54.38.73.16","TLSv1.2","611","Application Data"
"3.613812","54.38.73.16","172.18.0.2","TCP","68","21002 → 36876 [ACK] Seq=229596 Ack=13489 Win=1452 Len=0 TSval=2676492510 TSecr=1089373351"
"3.829431","54.38.73.16","172.18.0.2","TLSv1.2","3695","Application Data"
"3.829635","172.18.0.2","54.38.73.16","TCP","68","36876 → 21002 [ACK] Seq=13489 Ack=233223 Win=5584 Len=0 TSval=1089373592 TSecr=2676492564"
"3.852358","54.38.73.16","172.18.0.2","TLSv1.2","7308","Application Data, Application Data"
"3.852542","172.18.0.2","54.38.73.16","TCP","68","36876 → 21002 [ACK] Seq=13489 Ack=240463 Win=5565 Len=0 TSval=1089373615 TSecr=2676492570"
"3.855690","54.38.73.16","172.18.0.2","TLSv1.2","1139","Application Data"
"3.863722","54.38.73.16","172.18.0.2","TLSv1.2","7308","Application Data"
"3.863759","172.18.0.2","54.38.73.16","TCP","68","36876 → 21002 [ACK] Seq=13489 Ack=248774 Win=5565 Len=0 TSval=1089373626 TSecr=2676492570"
"3.889567","54.38.73.16","172.18.0.2","TLSv1.2","422","[TCP Previous segment not captured] , Ignored Unknown Record"
"3.889618","172.18.0.2","54.38.73.16","TCP","80","[TCP Window Update] 36876 → 21002 [ACK] Seq=13489 Ack=248774 Win=5593 Len=0 TSval=1089373652 TSecr=2676492570 SLE=253118 SRE=253472"
"3.889586","54.38.73.16","172.18.0.2","TCP","4412","[TCP Out-Of-Order] 21002 → 36876 [ACK] Seq=248774 Ack=13489 Win=1452 Len=4344 TSval=2676492579 TSecr=1089373615"
"3.889651","172.18.0.2","54.38.73.16","TCP","68","36876 → 21002 [ACK] Seq=13489 Ack=253472 Win=5564 Len=0 TSval=1089373652 TSecr=2676492579"
"3.914732","54.38.73.16","172.18.0.2","TLSv1.2","1125","Application Data"
"3.915342","172.18.0.2","54.38.73.16","TLSv1.2","611","Application Data"
"3.940972","54.38.73.16","172.18.0.2","TCP","68","21002 → 36876 [ACK] Seq=254529 Ack=14032 Win=1452 Len=0 TSval=2676492592 TSecr=1089373678"
"3.941016","172.18.0.2","54.38.73.16","TLSv1.2","611","Application Data"
"3.967242","54.38.73.16","172.18.0.2","TCP","68","21002 → 36876 [ACK] Seq=254529 Ack=14575 Win=1452 Len=0 TSval=2676492598 TSecr=1089373703"
"4.511727","54.38.73.16","172.18.0.2","TLSv1.2","611","Application Data"
"4.512828","172.18.0.2","54.38.73.16","TLSv1.2","611","Application Data"
"4.539859","54.38.73.16","172.18.0.2","TCP","68","21002 → 36876 [ACK] Seq=255072 Ack=15118 Win=1452 Len=0 TSval=2676492741 TSecr=1089374275"
"4.837910","54.38.73.16","172.18.0.2","TLSv1.2","3695","Application Data"
"4.838101","172.18.0.2","54.38.73.16","TCP","68","36876 → 21002 [ACK] Seq=15118 Ack=258699 Win=5584 Len=0 TSval=1089374600 TSecr=2676492816"
"4.849779","54.38.73.16","172.18.0.2","TCP","2964","[TCP segment of a reassembled PDU]"
"4.849812","172.18.0.2","54.38.73.16","TCP","68","36876 → 21002 [ACK] Seq=15118 Ack=261595 Win=5596 Len=0 TSval=1089374612 TSecr=2676492819"
"4.860134","54.38.73.16","172.18.0.2","TLSv1.2","2964","Application Data [TCP segment of a reassembled PDU]"
"4.860167","172.18.0.2","54.38.73.16","TCP","68","36876 → 21002 [ACK] Seq=15118 Ack=264491 Win=5596 Len=0 TSval=1089374622 TSecr=2676492822"
"4.863009","54.38.73.16","172.18.0.2","TLSv1.2","1016","Application Data"
"4.869876","172.18.0.2","54.38.73.16","TLSv1.2","611","Application Data"
"4.894724","54.38.73.16","172.18.0.2","TCP","68","21002 → 36876 [ACK] Seq=265439 Ack=15661 Win=1452 Len=0 TSval=2676492830 TSecr=1089374632"
"5.429919","54.38.73.16","172.18.0.2","TLSv1.2","611","Application Data"
"5.430949","172.18.0.2","54.38.73.16","TLSv1.2","611","Application Data"
"5.455703","54.38.73.16","172.18.0.2","TCP","68","21002 → 36876 [ACK] Seq=265982 Ack=16204 Win=1452 Len=0 TSval=2676492971 TSecr=1089375193"
"6.072430","54.38.73.16","172.18.0.2","TLSv1.2","3695","Application Data"
"6.072611","172.18.0.2","54.38.73.16","TCP","68","36876 → 21002 [ACK] Seq=16204 Ack=269609 Win=5584 Len=0 TSval=1089375835 TSecr=2676493125"
"6.083205","54.38.73.16","172.18.0.2","TCP","2964","[TCP segment of a reassembled PDU]"
"6.083238","172.18.0.2","54.38.73.16","TCP","68","36876 → 21002 [ACK] Seq=16204 Ack=272505 Win=5596 Len=0 TSval=1089375846 TSecr=2676493127"
"6.097760","54.38.73.16","172.18.0.2","TLSv1.2","799","Application Data"
"6.102170","54.38.73.16","172.18.0.2","TCP","2964","[TCP segment of a reassembled PDU]"
"6.102203","172.18.0.2","54.38.73.16","TCP","68","36876 → 21002 [ACK] Seq=16204 Ack=276132 Win=5596 Len=0 TSval=1089375865 TSecr=2676493131"
"6.112826","54.38.73.16","172.18.0.2","TLSv1.2","4412","Application Data [TCP segment of a reassembled PDU]"
"6.113007","172.18.0.2","54.38.73.16","TCP","68","36876 → 21002 [ACK] Seq=16204 Ack=280476 Win=5580 Len=0 TSval=1089375875 TSecr=2676493135"
"6.124954","54.38.73.16","172.18.0.2","TLSv1.2","1516","Application Data, Application Data"
"6.127081","54.38.73.16","172.18.0.2","TLSv1.2","748","Application Data"
"6.127117","172.18.0.2","54.38.73.16","TCP","68","36876 → 21002 [ACK] Seq=16204 Ack=282604 Win=5593 Len=0 TSval=1089375889 TSecr=2676493138"
"6.135226","172.18.0.2","54.38.73.16","TLSv1.2","611","Application Data"
"6.159582","54.38.73.16","172.18.0.2","TCP","68","21002 → 36876 [ACK] Seq=282604 Ack=16747 Win=1452 Len=0 TSval=2676493147 TSecr=1089375898"
"6.454538","54.38.73.16","172.18.0.2","TLSv1.2","611","Application Data"
"6.455600","172.18.0.2","54.38.73.16","TLSv1.2","611","Application Data"
"6.482963","54.38.73.16","172.18.0.2","TCP","68","21002 → 36876 [ACK] Seq=283147 Ack=17290 Win=1452 Len=0 TSval=2676493227 TSecr=1089376218"
"6.682545","54.38.73.16","172.18.0.2","TLSv1.2","3695","Application Data"
"6.682746","172.18.0.2","54.38.73.16","TCP","68","36876 → 21002 [ACK] Seq=17290 Ack=286774 Win=5584 Len=0 TSval=1089376445 TSecr=2676493277"
"6.692549","54.38.73.16","172.18.0.2","TCP","2964","[TCP segment of a reassembled PDU]"
"6.692603","172.18.0.2","54.38.73.16","TCP","68","36876 → 21002 [ACK] Seq=17290 Ack=289670 Win=5596 Len=0 TSval=1089376455 TSecr=2676493280"
"6.702551","54.38.73.16","172.18.0.2","TLSv1.2","4412","Application Data, Application Data"
"6.702731","172.18.0.2","54.38.73.16","TCP","68","36876 → 21002 [ACK] Seq=17290 Ack=294014 Win=5580 Len=0 TSval=1089376465 TSecr=2676493282"
"6.708102","54.38.73.16","172.18.0.2","TLSv1.2","625","Application Data"
"6.712342","54.38.73.16","172.18.0.2","TLSv1.2","4412","Application Data"
"6.712374","172.18.0.2","54.38.73.16","TCP","68","36876 → 21002 [ACK] Seq=17290 Ack=298915 Win=5580 Len=0 TSval=1089376475 TSecr=2676493284"
"6.723809","54.38.73.16","172.18.0.2","TLSv1.2","8756","Application Data, Application Data, Application Data"
"6.723993","172.18.0.2","54.38.73.16","TCP","68","36876 → 21002 [ACK] Seq=17290 Ack=307603 Win=5566 Len=0 TSval=1089376486 TSecr=2676493288"
"6.729236","54.38.73.16","172.18.0.2","TCP","2964","21002 → 36876 [ACK] Seq=307603 Ack=17290 Win=1452 Len=2896 TSval=2676493289 TSecr=1089376465 [TCP segment of a reassembled PDU]"
"6.729269","172.18.0.2","54.38.73.16","TCP","68","36876 → 21002 [ACK] Seq=17290 Ack=310499 Win=5596 Len=0 TSval=1089376492 TSecr=2676493289"
"6.735435","54.38.73.16","172.18.0.2","TLSv1.2","1516","Application Data [TCP segment of a reassembled PDU]"
"6.735985","172.18.0.2","54.38.73.16","TLSv1.2","1125","Application Data"
"6.737634","54.38.73.16","172.18.0.2","TLSv1.2","5860","Application Data [TCP segment of a reassembled PDU]"
"6.737778","172.18.0.2","54.38.73.16","TCP","68","36876 → 21002 [ACK] Seq=18347 Ack=317739 Win=5581 Len=0 TSval=1089376500 TSecr=2676493291"
"6.749689","54.38.73.16","172.18.0.2","TLSv1.2","5945","Application Data, Application Data, Application Data"
"6.749833","172.18.0.2","54.38.73.16","TCP","68","36876 → 21002 [ACK] Seq=18347 Ack=323616 Win=5578 Len=0 TSval=1089376512 TSecr=2676493294"
"6.757569","54.38.73.16","172.18.0.2","TCP","2964","[TCP segment of a reassembled PDU]"
"6.757601","172.18.0.2","54.38.73.16","TCP","68","36876 → 21002 [ACK] Seq=18347 Ack=326512 Win=5596 Len=0 TSval=1089376520 TSecr=2676493296"
"6.760226","54.38.73.16","172.18.0.2","TCP","68","21002 → 36876 [ACK] Seq=326512 Ack=18347 Win=1452 Len=0 TSval=2676493297 TSecr=1089376498"
"6.773329","54.38.73.16","172.18.0.2","TLSv1.2","285","Application Data"
"6.780005","172.18.0.2","54.38.73.16","TLSv1.2","611","Application Data"
"6.842610","54.38.73.16","172.18.0.2","TCP","68","21002 → 36876 [ACK] Seq=326729 Ack=18890 Win=1452 Len=0 TSval=2676493318 TSecr=1089376542"
"7.070458","54.38.73.16","172.18.0.2","TLSv1.2","611","Application Data"
"7.071559","172.18.0.2","54.38.73.16","TLSv1.2","611","Application Data"
"7.096933","54.38.73.16","172.18.0.2","TCP","68","21002 → 36876 [ACK] Seq=327272 Ack=19433 Win=1452 Len=0 TSval=2676493381 TSecr=1089376834"
"7.323580","54.38.73.16","172.18.0.2","TLSv1.2","611","Application Data"
"7.364306","172.18.0.2","54.38.73.16","TCP","68","36876 → 21002 [ACK] Seq=19433 Ack=327815 Win=5612 Len=0 TSval=1089377127 TSecr=2676493438"
"7.372402","54.38.73.16","172.18.0.2","TCP","2964","[TCP segment of a reassembled PDU]"
"7.372440","172.18.0.2","54.38.73.16","TCP","68","36876 → 21002 [ACK] Seq=19433 Ack=330711 Win=5596 Len=0 TSval=1089377135 TSecr=2676493450"
"7.384386","54.38.73.16","172.18.0.2","TLSv1.2","4412","Application Data [TCP segment of a reassembled PDU]"
"7.384437","172.18.0.2","54.38.73.16","TCP","68","36876 → 21002 [ACK] Seq=19433 Ack=335055 Win=5580 Len=0 TSval=1089377147 TSecr=2676493452"
"7.388530","54.38.73.16","172.18.0.2","TLSv1.2","82","Application Data"
"7.388566","172.18.0.2","54.38.73.16","TCP","68","36876 → 21002 [ACK] Seq=19433 Ack=335069 Win=5609 Len=0 TSval=1089377151 TSecr=2676493454"
"7.392395","54.38.73.16","172.18.0.2","TLSv1.2","7308","Application Data"
"7.392429","172.18.0.2","54.38.73.16","TCP","68","36876 → 21002 [ACK] Seq=19433 Ack=342309 Win=5565 Len=0 TSval=1089377155 TSecr=2676493455"
"7.397680","54.38.73.16","172.18.0.2","TLSv1.2","2964","Application Data [TCP segment of a reassembled PDU]"
"7.397714","172.18.0.2","54.38.73.16","TCP","68","36876 → 21002 [ACK] Seq=19433 Ack=345205 Win=5596 Len=0 TSval=1089377160 TSecr=2676493456"
"7.398004","54.38.73.16","172.18.0.2","TCP","1516","21002 → 36876 [ACK] Seq=345205 Ack=19433 Win=1452 Len=1448 TSval=2676493456 TSecr=1089377135 [TCP segment of a reassembled PDU]"
"7.398034","172.18.0.2","54.38.73.16","TCP","68","36876 → 21002 [ACK] Seq=19433 Ack=346653 Win=5585 Len=0 TSval=1089377160 TSecr=2676493456"
"7.403455","54.38.73.16","172.18.0.2","TLSv1.2","1516","Application Data [TCP segment of a reassembled PDU]"
"7.403489","172.18.0.2","54.38.73.16","TCP","68","36876 → 21002 [ACK] Seq=19433 Ack=348101 Win=5593 Len=0 TSval=1089377166 TSecr=2676493458"
"7.409058","54.38.73.16","172.18.0.2","TCP","2964","21002 → 36876 [ACK] Seq=348101 Ack=19433 Win=1452 Len=2896 TSval=2676493459 TSecr=1089377147 [TCP segment of a reassembled PDU]"
"7.409091","172.18.0.2","54.38.73.16","TCP","68","36876 → 21002 [ACK] Seq=19433 Ack=350997 Win=5596 Len=0 TSval=1089377171 TSecr=2676493459"
"7.413853","54.38.73.16","172.18.0.2","TLSv1.2","2964","Application Data [TCP segment of a reassembled PDU]"
"7.413887","172.18.0.2","54.38.73.16","TCP","68","36876 → 21002 [ACK] Seq=19433 Ack=353893 Win=5596 Len=0 TSval=1089377176 TSecr=2676493460"
"7.416793","54.38.73.16","172.18.0.2","TLSv1.2","2964","Application Data [TCP segment of a reassembled PDU]"
"7.416829","172.18.0.2","54.38.73.16","TCP","68","36876 → 21002 [ACK] Seq=19433 Ack=356789 Win=5596 Len=0 TSval=1089377179 TSecr=2676493461"
"7.417264","54.38.73.16","172.18.0.2","TLSv1.2","2964","Application Data, Application Data"
"7.417296","172.18.0.2","54.38.73.16","TCP","68","36876 → 21002 [ACK] Seq=19433 Ack=359685 Win=5581 Len=0 TSval=1089377180 TSecr=2676493461"
"7.417415","172.18.0.2","54.38.73.16","TLSv1.2","611","Application Data"
"7.423161","54.38.73.16","172.18.0.2","TLSv1.2","5860","Application Data [TCP segment of a reassembled PDU]"
"7.423197","172.18.0.2","54.38.73.16","TCP","68","36876 → 21002 [ACK] Seq=19976 Ack=365477 Win=5581 Len=0 TSval=1089377186 TSecr=2676493462"
"7.433786","54.38.73.16","172.18.0.2","TCP","1516","21002 → 36876 [ACK] Seq=365477 Ack=19433 Win=1452 Len=1448 TSval=2676493465 TSecr=1089377171 [TCP segment of a reassembled PDU]"
"7.433819","172.18.0.2","54.38.73.16","TCP","68","36876 → 21002 [ACK] Seq=19976 Ack=366925 Win=5593 Len=0 TSval=1089377196 TSecr=2676493465"
"7.434516","54.38.73.16","172.18.0.2","TLSv1.2","1516","Application Data [TCP segment of a reassembled PDU]"
"7.434555","172.18.0.2","54.38.73.16","TCP","68","36876 → 21002 [ACK] Seq=19976 Ack=368373 Win=5593 Len=0 TSval=1089377197 TSecr=2676493465"
"7.438706","54.38.73.16","172.18.0.2","TCP","1516","21002 → 36876 [ACK] Seq=368373 Ack=19433 Win=1452 Len=1448 TSval=2676493466 TSecr=1089377176 [TCP segment of a reassembled PDU]"
"7.439594","54.38.73.16","172.18.0.2","TLSv1.2","4412","Application Data [TCP segment of a reassembled PDU]"
"7.439773","172.18.0.2","54.38.73.16","TCP","68","36876 → 21002 [ACK] Seq=19976 Ack=374165 Win=5580 Len=0 TSval=1089377202 TSecr=2676493466"
"7.441999","54.38.73.16","172.18.0.2","TCP","68","[TCP Previous segment not captured] 21002 → 36876 [ACK] Seq=379957 Ack=19976 Win=1452 Len=0 TSval=2676493467 TSecr=1089377180"
"7.442059","172.18.0.2","54.38.73.16","TLSv1.2","611","Application Data"
"7.442018","54.38.73.16","172.18.0.2","TCP","2964","[TCP Out-Of-Order] 21002 → 36876 [ACK] Seq=374165 Ack=19433 Win=1452 Len=2896 TSval=2676493467 TSecr=1089377179"
"7.442022","54.38.73.16","172.18.0.2","TCP","2964","[TCP Retransmission] 21002 → 36876 [ACK] Seq=377061 Ack=19433 Win=1452 Len=2896 TSval=2676493467 TSecr=1089377180"
"7.442230","172.18.0.2","54.38.73.16","TCP","68","36876 → 21002 [ACK] Seq=20519 Ack=379957 Win=5581 Len=0 TSval=1089377205 TSecr=2676493467"
"7.447461","54.38.73.16","172.18.0.2","TLSv1.2","5860","Ignored Unknown Record"
"7.447495","172.18.0.2","54.38.73.16","TCP","68","36876 → 21002 [ACK] Seq=20519 Ack=385749 Win=5581 Len=0 TSval=1089377210 TSecr=2676493469"
"7.448161","54.38.73.16","172.18.0.2","TLSv1.2","1516","Ignored Unknown Record"
"7.458499","54.38.73.16","172.18.0.2","TLSv1.2","1516","Ignored Unknown Record"
"7.458535","172.18.0.2","54.38.73.16","TCP","68","36876 → 21002 [ACK] Seq=20519 Ack=388645 Win=5603 Len=0 TSval=1089377221 TSecr=2676493469"
"7.458504","54.38.73.16","172.18.0.2","TLSv1.2","1516","Ignored Unknown Record"
"7.463970","54.38.73.16","172.18.0.2","TLSv1.2","2964","Ignored Unknown Record"
"7.464144","172.18.0.2","54.38.73.16","TCP","68","36876 → 21002 [ACK] Seq=20519 Ack=392989 Win=5596 Len=0 TSval=1089377226 TSecr=2676493471"
"7.464216","54.38.73.16","172.18.0.2","TLSv1.2","2964","Ignored Unknown Record"
"7.464590","172.18.0.2","54.38.73.16","TCP","68","36876 → 21002 [ACK] Seq=20519 Ack=395885 Win=5581 Len=0 TSval=1089377227 TSecr=2676493473"
"7.467068","54.38.73.16","172.18.0.2","TLSv1.2","5860","Ignored Unknown Record"
"7.467112","172.18.0.2","54.38.73.16","TLSv1.2","611","Application Data"
"7.474684","54.38.73.16","172.18.0.2","TCP","5860","21002 → 36876 [ACK] Seq=401677 Ack=20519 Win=1452 Len=5792 TSval=2676493475 TSecr=1089377210"
"7.474724","172.18.0.2","54.38.73.16","TCP","68","36876 → 21002 [ACK] Seq=21062 Ack=407469 Win=5581 Len=0 TSval=1089377237 TSecr=2676493475"
"7.483965","54.38.73.16","172.18.0.2","TLSv1.2","1808","Ignored Unknown Record"
"7.483998","172.18.0.2","54.38.73.16","TCP","68","36876 → 21002 [ACK] Seq=21062 Ack=409209 Win=5600 Len=0 TSval=1089377246 TSecr=2676493478"
"7.531951","54.38.73.16","172.18.0.2","TCP","68","21002 → 36876 [ACK] Seq=409209 Ack=21062 Win=1452 Len=0 TSval=2676493490 TSecr=1089377229"
"7.532050","172.18.0.2","54.38.73.16","TLSv1.2","1154","Application Data, Application Data"
"7.596389","54.38.73.16","172.18.0.2","TCP","68","21002 → 36876 [ACK] Seq=409209 Ack=22148 Win=1452 Len=0 TSval=2676493506 TSecr=1089377294"
"7.888717","54.38.73.16","172.18.0.2","TLSv1.2","611","Application Data"
"7.889782","172.18.0.2","54.38.73.16","TLSv1.2","611","Application Data"
"7.915983","54.38.73.16","172.18.0.2","TCP","68","21002 → 36876 [ACK] Seq=409752 Ack=22691 Win=1452 Len=0 TSval=2676493586 TSecr=1089377652"
"8.296489","54.38.73.16","172.18.0.2","TLSv1.2","611","Application Data"
"8.328859","54.38.73.16","172.18.0.2","TCP","2964","[TCP segment of a reassembled PDU]"
"8.328889","172.18.0.2","54.38.73.16","TCP","68","36876 → 21002 [ACK] Seq=22691 Ack=413191 Win=5596 Len=0 TSval=1089378091 TSecr=2676493681"
"8.353385","54.38.73.16","172.18.0.2","TLSv1.2","799","Application Data"
"8.385905","54.38.73.16","172.18.0.2","TCP","2964","[TCP segment of a reassembled PDU]"
"8.385937","172.18.0.2","54.38.73.16","TCP","68","36876 → 21002 [ACK] Seq=22691 Ack=416818 Win=5596 Len=0 TSval=1089378148 TSecr=2676493695"
"8.396340","54.38.73.16","172.18.0.2","TLSv1.2","7308","Application Data, Application Data"
"8.396524","172.18.0.2","54.38.73.16","TCP","68","36876 → 21002 [ACK] Seq=22691 Ack=424058 Win=5565 Len=0 TSval=1089378159 TSecr=2676493706"
"8.396985","172.18.0.2","54.38.73.16","TLSv1.2","611","Application Data"
"8.406977","54.38.73.16","172.18.0.2","TLSv1.2","2964","Application Data [TCP segment of a reassembled PDU]"
"8.407011","172.18.0.2","54.38.73.16","TCP","68","36876 → 21002 [ACK] Seq=23234 Ack=426954 Win=5596 Len=0 TSval=1089378169 TSecr=2676493708"
"8.413044","54.38.73.16","172.18.0.2","TLSv1.2","8756","Application Data, Application Data"
"8.413222","172.18.0.2","54.38.73.16","TCP","68","36876 → 21002 [ACK] Seq=23234 Ack=435642 Win=5566 Len=0 TSval=1089378176 TSecr=2676493710"
"8.425599","54.38.73.16","172.18.0.2","TCP","68","[TCP Previous segment not captured] 21002 → 36876 [ACK] Seq=444330 Ack=23234 Win=1452 Len=0 TSval=2676493712 TSecr=1089378159"
"8.425615","54.38.73.16","172.18.0.2","TCP","8756","[TCP Retransmission] 21002 → 36876 [ACK] Seq=435642 Ack=22691 Win=1452 Len=8688 TSval=2676493712 TSecr=1089378159"
"8.425661","172.18.0.2","54.38.73.16","TCP","68","36876 → 21002 [ACK] Seq=23234 Ack=444330 Win=5566 Len=0 TSval=1089378188 TSecr=2676493712"
"8.426139","172.18.0.2","54.38.73.16","TLSv1.2","611","Application Data"
"8.432913","54.38.73.16","172.18.0.2","TCP","2964","[TCP segment of a reassembled PDU]"
"8.432945","172.18.0.2","54.38.73.16","TCP","68","36876 → 21002 [ACK] Seq=23777 Ack=447226 Win=5596 Len=0 TSval=1089378195 TSecr=2676493715"
"8.458805","54.38.73.16","172.18.0.2","TLSv1.2","8746","Change Cipher Spec, Ignored Unknown Record"
"8.458991","172.18.0.2","54.38.73.16","TCP","68","36876 → 21002 [ACK] Seq=23777 Ack=455904 Win=5566 Len=0 TSval=1089378221 TSecr=2676493721"
"8.494271","54.38.73.16","172.18.0.2","TCP","68","21002 → 36876 [ACK] Seq=455904 Ack=23777 Win=1452 Len=0 TSval=2676493731 TSecr=1089378188"
"8.494336","172.18.0.2","54.38.73.16","TLSv1.2","611","Application Data"
"8.525327","54.38.73.16","172.18.0.2","TCP","68","21002 → 36876 [ACK] Seq=455904 Ack=24320 Win=1452 Len=0 TSval=2676493738 TSecr=1089378257"
"8.811138","54.38.73.16","172.18.0.2","TLSv1.2","611","Application Data"
"8.812253","172.18.0.2","54.38.73.16","TLSv1.2","611","Application Data"
"8.835875","54.38.73.16","172.18.0.2","TCP","68","21002 → 36876 [ACK] Seq=456447 Ack=24863 Win=1452 Len=0 TSval=2676493816 TSecr=1089378575"
