_ws.col.Time,_ws.col.Source,_ws.col.Destination,_ws.col.Protocol,_ws.col.Length,_ws.col.Info
"0.000000","172.19.0.3","5.9.29.183","TLSv1.2","599","Application Data"
"0.000349","5.9.29.183","172.19.0.3","TCP","56","9002 → 43520 [ACK] Seq=1 Ack=544 Win=65535 Len=0"
"0.254443","5.9.29.183","172.19.0.3","TLSv1.2","599","Application Data"
"0.254548","172.19.0.3","5.9.29.183","TCP","56","43520 → 9002 [ACK] Seq=544 Ack=544 Win=11911 Len=0"
"0.255410","172.19.0.3","5.9.29.183","TLSv1.2","2141","Application Data"
"0.255865","5.9.29.183","172.19.0.3","TCP","56","9002 → 43520 [ACK] Seq=544 Ack=2629 Win=65535 Len=0"
"0.706229","5.9.29.183","172.19.0.3","TLSv1.2","599","Application Data"
"0.747431","172.19.0.3","5.9.29.183","TCP","56","43520 → 9002 [ACK] Seq=2629 Ack=1087 Win=11911 Len=0"
"0.769997","5.9.29.183","172.19.0.3","TCP","1516","[TCP segment of a reassembled PDU]"
"0.770015","172.19.0.3","5.9.29.183","TCP","56","43520 → 9002 [ACK] Seq=2629 Ack=2547 Win=11911 Len=0"
"0.770044","5.9.29.183","172.19.0.3","TLSv1.2","167","Application Data"
"0.770056","172.19.0.3","5.9.29.183","TCP","56","43520 → 9002 [ACK] Seq=2629 Ack=2658 Win=11911 Len=0"
"0.773663","172.19.0.3","5.9.29.183","TLSv1.2","599","Application Data"
"0.773915","5.9.29.183","172.19.0.3","TCP","56","9002 → 43520 [ACK] Seq=2658 Ack=3172 Win=65535 Len=0"
"1.083342","5.9.29.183","172.19.0.3","TLSv1.2","599","Application Data"
"1.084071","172.19.0.3","5.9.29.183","TLSv1.2","599","Application Data"
"1.084478","5.9.29.183","172.19.0.3","TCP","56","9002 → 43520 [ACK] Seq=3201 Ack=3715 Win=65535 Len=0"
"1.345232","5.9.29.183","172.19.0.3","TLSv1.2","599","Application Data"
"1.356956","5.9.29.183","172.19.0.3","TCP","1516","[TCP segment of a reassembled PDU]"
"1.357055","5.9.29.183","172.19.0.3","TCP","1492","9002 → 43520 [PSH, ACK] Seq=5204 Ack=3715 Win=65535 Len=1436 [TCP segment of a reassembled PDU]"
"1.357071","5.9.29.183","172.19.0.3","TLSv1.2","1516","Application Data [TCP segment of a reassembled PDU]"
"1.357076","5.9.29.183","172.19.0.3","TCP","1516","9002 → 43520 [PSH, ACK] Seq=8100 Ack=3715 Win=65535 Len=1460 [TCP segment of a reassembled PDU]"
"1.357098","5.9.29.183","172.19.0.3","TCP","1480","9002 → 43520 [PSH, ACK] Seq=9560 Ack=3715 Win=65535 Len=1424 [TCP segment of a reassembled PDU]"
"1.357175","172.19.0.3","5.9.29.183","TCP","56","43520 → 9002 [ACK] Seq=3715 Ack=10984 Win=11877 Len=0"
"1.360761","5.9.29.183","172.19.0.3","TLSv1.2","70","Application Data"
"1.361073","172.19.0.3","5.9.29.183","TLSv1.2","599","Application Data"
"1.361388","5.9.29.183","172.19.0.3","TCP","56","9002 → 43520 [ACK] Seq=10998 Ack=4258 Win=65535 Len=0"
"1.372936","5.9.29.183","172.19.0.3","TCP","1516","[TCP segment of a reassembled PDU]"
"1.372993","5.9.29.183","172.19.0.3","TCP","1492","9002 → 43520 [PSH, ACK] Seq=12458 Ack=4258 Win=65535 Len=1436 [TCP segment of a reassembled PDU]"
"1.373001","5.9.29.183","172.19.0.3","TLSv1.2","1516","Application Data [TCP segment of a reassembled PDU]"
"1.373004","5.9.29.183","172.19.0.3","TCP","1516","9002 → 43520 [PSH, ACK] Seq=15354 Ack=4258 Win=65535 Len=1460 [TCP segment of a reassembled PDU]"
"1.373006","5.9.29.183","172.19.0.3","TCP","1516","9002 → 43520 [PSH, ACK] Seq=16814 Ack=4258 Win=65535 Len=1460 [TCP segment of a reassembled PDU]"
"1.373033","5.9.29.183","172.19.0.3","TLSv1.2","1468","Application Data [TCP segment of a reassembled PDU]"
"1.373039","5.9.29.183","172.19.0.3","TCP","1516","9002 → 43520 [PSH, ACK] Seq=19686 Ack=4258 Win=65535 Len=1460 [TCP segment of a reassembled PDU]"
"1.373042","5.9.29.183","172.19.0.3","TCP","1492","9002 → 43520 [PSH, ACK] Seq=21146 Ack=4258 Win=65535 Len=1436 [TCP segment of a reassembled PDU]"
"1.373219","172.19.0.3","5.9.29.183","TCP","56","43520 → 9002 [ACK] Seq=4258 Ack=22582 Win=11855 Len=0"
"1.376276","5.9.29.183","172.19.0.3","TLSv1.2","924","Application Data, Application Data"
"1.389179","5.9.29.183","172.19.0.3","TCP","1516","[TCP segment of a reassembled PDU]"
"1.389198","172.19.0.3","5.9.29.183","TCP","56","43520 → 9002 [ACK] Seq=4258 Ack=24910 Win=11911 Len=0"
"1.389293","5.9.29.183","172.19.0.3","TCP","1516","9002 → 43520 [PSH, ACK] Seq=24910 Ack=4258 Win=65535 Len=1460 [TCP segment of a reassembled PDU]"
"1.389304","5.9.29.183","172.19.0.3","TLSv1.2","1516","Application Data [TCP segment of a reassembled PDU]"
"1.389308","5.9.29.183","172.19.0.3","TCP","1516","9002 → 43520 [PSH, ACK] Seq=27830 Ack=4258 Win=65535 Len=1460 [TCP segment of a reassembled PDU]"
"1.389311","5.9.29.183","172.19.0.3","TCP","1516","9002 → 43520 [PSH, ACK] Seq=29290 Ack=4258 Win=65535 Len=1460 [TCP segment of a reassembled PDU]"
"1.389361","172.19.0.3","5.9.29.183","TCP","56","43520 → 9002 [ACK] Seq=4258 Ack=30750 Win=11879 Len=0"
"1.389379","5.9.29.183","172.19.0.3","TLSv1.2","1444","Application Data [TCP segment of a reassembled PDU]"
"1.389800","172.19.0.3","5.9.29.183","TLSv1.2","599","Application Data"
"1.390083","5.9.29.183","172.19.0.3","TCP","56","9002 → 43520 [ACK] Seq=32138 Ack=4801 Win=65535 Len=0"
"1.391879","5.9.29.183","172.19.0.3","TLSv1.2","193","Application Data"
"1.411155","5.9.29.183","172.19.0.3","TCP","1504","[TCP segment of a reassembled PDU]"
"1.411176","172.19.0.3","5.9.29.183","TCP","56","43520 → 9002 [ACK] Seq=4801 Ack=33723 Win=11911 Len=0"
"1.411225","5.9.29.183","172.19.0.3","TCP","1516","9002 → 43520 [PSH, ACK] Seq=33723 Ack=4801 Win=65535 Len=1460 [TCP segment of a reassembled PDU]"
"1.411277","5.9.29.183","172.19.0.3","TLSv1.2","261","Application Data"
"1.411457","172.19.0.3","5.9.29.183","TCP","56","43520 → 9002 [ACK] Seq=4801 Ack=35388 Win=11898 Len=0"
"1.428778","5.9.29.183","172.19.0.3","TCP","1516","[TCP segment of a reassembled PDU]"
"1.428844","5.9.29.183","172.19.0.3","TCP","1516","9002 → 43520 [PSH, ACK] Seq=36848 Ack=4801 Win=65535 Len=1460 [TCP segment of a reassembled PDU]"
"1.428862","172.19.0.3","5.9.29.183","TCP","56","43520 → 9002 [ACK] Seq=4801 Ack=38308 Win=11903 Len=0"
"1.428865","5.9.29.183","172.19.0.3","TLSv1.2","763","Application Data"
"1.462892","5.9.29.183","172.19.0.3","TCP","1504","[TCP segment of a reassembled PDU]"
"1.462913","172.19.0.3","5.9.29.183","TCP","56","43520 → 9002 [ACK] Seq=4801 Ack=40463 Win=11911 Len=0"
"1.462961","5.9.29.183","172.19.0.3","TLSv1.2","693","Application Data"
"1.467822","172.19.0.3","5.9.29.183","TLSv1.2","599","Application Data"
"1.468118","5.9.29.183","172.19.0.3","TCP","56","9002 → 43520 [ACK] Seq=41100 Ack=5344 Win=65535 Len=0"
"1.679515","02:42:7b:11:31:3d","","ARP","44","Who has 172.19.0.3? Tell 172.19.0.1"
"1.679530","02:42:ac:13:00:03","","ARP","44","172.19.0.3 is at 02:42:ac:13:00:03"
"1.726569","5.9.29.183","172.19.0.3","TLSv1.2","599","Application Data"
"1.727716","172.19.0.3","5.9.29.183","TLSv1.2","599","Application Data"
"1.728114","5.9.29.183","172.19.0.3","TCP","56","9002 → 43520 [ACK] Seq=41643 Ack=5887 Win=65535 Len=0"
"1.998661","5.9.29.183","172.19.0.3","TLSv1.2","599","Application Data"
"2.039562","172.19.0.3","5.9.29.183","TCP","56","43520 → 9002 [ACK] Seq=5887 Ack=42186 Win=11911 Len=0"
"2.043692","5.9.29.183","172.19.0.3","TCP","1516","[TCP segment of a reassembled PDU]"
"2.043713","172.19.0.3","5.9.29.183","TCP","56","43520 → 9002 [ACK] Seq=5887 Ack=43646 Win=11911 Len=0"
"2.043763","5.9.29.183","172.19.0.3","TCP","246","9002 → 43520 [PSH, ACK] Seq=43646 Ack=5887 Win=65535 Len=190 [TCP segment of a reassembled PDU]"
"2.043779","172.19.0.3","5.9.29.183","TCP","56","43520 → 9002 [ACK] Seq=5887 Ack=43836 Win=11910 Len=0"
"2.044087","5.9.29.183","172.19.0.3","TCP","1516","9002 → 43520 [PSH, ACK] Seq=43836 Ack=5887 Win=65535 Len=1460 [TCP segment of a reassembled PDU]"
"2.044099","172.19.0.3","5.9.29.183","TCP","56","43520 → 9002 [ACK] Seq=5887 Ack=45296 Win=11911 Len=0"
"2.044139","5.9.29.183","172.19.0.3","TLSv1.2","1516","Application Data [TCP segment of a reassembled PDU]"
"2.044154","172.19.0.3","5.9.29.183","TCP","56","43520 → 9002 [ACK] Seq=5887 Ack=46756 Win=11903 Len=0"
"2.044158","5.9.29.183","172.19.0.3","TCP","1516","9002 → 43520 [PSH, ACK] Seq=46756 Ack=5887 Win=65535 Len=1460 [TCP segment of a reassembled PDU]"
"2.044167","172.19.0.3","5.9.29.183","TCP","56","43520 → 9002 [ACK] Seq=5887 Ack=48216 Win=11895 Len=0"
"2.044170","5.9.29.183","172.19.0.3","TCP","999","9002 → 43520 [PSH, ACK] Seq=48216 Ack=5887 Win=65535 Len=943 [TCP segment of a reassembled PDU]"
"2.044177","172.19.0.3","5.9.29.183","TCP","56","43520 → 9002 [ACK] Seq=5887 Ack=49159 Win=11888 Len=0"
"2.059399","5.9.29.183","172.19.0.3","TLSv1.2","1516","Application Data [TCP segment of a reassembled PDU]"
"2.059421","172.19.0.3","5.9.29.183","TCP","56","43520 → 9002 [ACK] Seq=5887 Ack=50619 Win=11911 Len=0"
"2.059472","5.9.29.183","172.19.0.3","TCP","1516","9002 → 43520 [PSH, ACK] Seq=50619 Ack=5887 Win=65535 Len=1460 [TCP segment of a reassembled PDU]"
"2.059484","172.19.0.3","5.9.29.183","TCP","56","43520 → 9002 [ACK] Seq=5887 Ack=52079 Win=11903 Len=0"
"2.059487","5.9.29.183","172.19.0.3","TCP","827","9002 → 43520 [PSH, ACK] Seq=52079 Ack=5887 Win=65535 Len=771 [TCP segment of a reassembled PDU]"
"2.059493","172.19.0.3","5.9.29.183","TCP","56","43520 → 9002 [ACK] Seq=5887 Ack=52850 Win=11897 Len=0"
"2.059494","5.9.29.183","172.19.0.3","TLSv1.2","1516","Application Data [TCP segment of a reassembled PDU]"
"2.059499","172.19.0.3","5.9.29.183","TCP","56","43520 → 9002 [ACK] Seq=5887 Ack=54310 Win=11887 Len=0"
"2.059731","5.9.29.183","172.19.0.3","TCP","1516","9002 → 43520 [PSH, ACK] Seq=54310 Ack=5887 Win=65535 Len=1460 [TCP segment of a reassembled PDU]"
"2.059740","172.19.0.3","5.9.29.183","TCP","56","43520 → 9002 [ACK] Seq=5887 Ack=55770 Win=11879 Len=0"
"2.059742","5.9.29.183","172.19.0.3","TCP","1516","9002 → 43520 [PSH, ACK] Seq=55770 Ack=5887 Win=65535 Len=1460 [TCP segment of a reassembled PDU]"
"2.059751","172.19.0.3","5.9.29.183","TCP","56","43520 → 9002 [ACK] Seq=5887 Ack=57230 Win=11871 Len=0"
"2.059752","5.9.29.183","172.19.0.3","TLSv1.2","1516","Application Data [TCP segment of a reassembled PDU]"
"2.059757","172.19.0.3","5.9.29.183","TCP","56","43520 → 9002 [ACK] Seq=5887 Ack=58690 Win=11861 Len=0"
"2.059758","5.9.29.183","172.19.0.3","TCP","1516","9002 → 43520 [PSH, ACK] Seq=58690 Ack=5887 Win=65535 Len=1460 [TCP segment of a reassembled PDU]"
"2.059764","172.19.0.3","5.9.29.183","TCP","56","43520 → 9002 [ACK] Seq=5887 Ack=60150 Win=11853 Len=0"
"2.059765","5.9.29.183","172.19.0.3","TCP","1444","9002 → 43520 [PSH, ACK] Seq=60150 Ack=5887 Win=65535 Len=1388 [TCP segment of a reassembled PDU]"
"2.059770","172.19.0.3","5.9.29.183","TCP","56","43520 → 9002 [ACK] Seq=5887 Ack=61538 Win=11845 Len=0"
"2.074195","5.9.29.183","172.19.0.3","TLSv1.2","381","Application Data"
"2.074416","172.19.0.3","5.9.29.183","TCP","56","43520 → 9002 [ACK] Seq=5887 Ack=61863 Win=11911 Len=0"
"2.074708","172.19.0.3","5.9.29.183","TLSv1.2","599","Application Data"
"2.074928","5.9.29.183","172.19.0.3","TCP","56","9002 → 43520 [ACK] Seq=61863 Ack=6430 Win=65535 Len=0"
"2.076806","5.9.29.183","172.19.0.3","TCP","1504","[TCP segment of a reassembled PDU]"
"2.076978","5.9.29.183","172.19.0.3","TCP","1516","9002 → 43520 [PSH, ACK] Seq=63311 Ack=6430 Win=65535 Len=1460 [TCP segment of a reassembled PDU]"
"2.076989","172.19.0.3","5.9.29.183","TCP","56","43520 → 9002 [ACK] Seq=6430 Ack=64771 Win=11911 Len=0"
"2.076991","5.9.29.183","172.19.0.3","TLSv1.2","1516","Application Data [TCP segment of a reassembled PDU]"
"2.076994","5.9.29.183","172.19.0.3","TCP","1480","9002 → 43520 [PSH, ACK] Seq=66231 Ack=6430 Win=65535 Len=1424 [TCP segment of a reassembled PDU]"
"2.077049","5.9.29.183","172.19.0.3","TCP","1504","9002 → 43520 [PSH, ACK] Seq=67655 Ack=6430 Win=65535 Len=1448 [TCP segment of a reassembled PDU]"
"2.077211","172.19.0.3","5.9.29.183","TCP","56","43520 → 9002 [ACK] Seq=6430 Ack=69103 Win=11895 Len=0"
"2.089979","5.9.29.183","172.19.0.3","TLSv1.2","1504","Application Data [TCP segment of a reassembled PDU]"
"2.090034","5.9.29.183","172.19.0.3","TCP","1516","9002 → 43520 [PSH, ACK] Seq=70551 Ack=6430 Win=65535 Len=1460 [TCP segment of a reassembled PDU]"
"2.090049","172.19.0.3","5.9.29.183","TCP","56","43520 → 9002 [ACK] Seq=6430 Ack=72011 Win=11903 Len=0"
"2.090051","5.9.29.183","172.19.0.3","TCP","1516","9002 → 43520 [PSH, ACK] Seq=72011 Ack=6430 Win=65535 Len=1460 [TCP segment of a reassembled PDU]"
"2.090054","5.9.29.183","172.19.0.3","TLSv1.2","1516","Application Data [TCP segment of a reassembled PDU]"
"2.090057","5.9.29.183","172.19.0.3","TCP","1468","9002 → 43520 [PSH, ACK] Seq=74931 Ack=6430 Win=65535 Len=1412 [TCP segment of a reassembled PDU]"
"2.090111","5.9.29.183","172.19.0.3","TLSv1.2","84","Application Data"
"2.090167","172.19.0.3","5.9.29.183","TCP","56","43520 → 9002 [ACK] Seq=6430 Ack=76371 Win=11877 Len=0"
"2.090418","172.19.0.3","5.9.29.183","TLSv1.2","599","Application Data"
"2.090596","5.9.29.183","172.19.0.3","TCP","56","9002 → 43520 [ACK] Seq=76371 Ack=6973 Win=65535 Len=0"
"2.093335","5.9.29.183","172.19.0.3","TCP","1504","[TCP segment of a reassembled PDU]"
"2.093499","5.9.29.183","172.19.0.3","TCP","1504","9002 → 43520 [PSH, ACK] Seq=77819 Ack=6973 Win=65535 Len=1448 [TCP segment of a reassembled PDU]"
"2.093511","172.19.0.3","5.9.29.183","TCP","56","43520 → 9002 [ACK] Seq=6973 Ack=79267 Win=11911 Len=0"
"2.093712","5.9.29.183","172.19.0.3","TLSv1.2","1516","Application Data [TCP segment of a reassembled PDU]"
"2.093772","5.9.29.183","172.19.0.3","TCP","1492","9002 → 43520 [PSH, ACK] Seq=80727 Ack=6973 Win=65535 Len=1436 [TCP segment of a reassembled PDU]"
"2.093799","5.9.29.183","172.19.0.3","TCP","1516","9002 → 43520 [PSH, ACK] Seq=82163 Ack=6973 Win=65535 Len=1460 [TCP segment of a reassembled PDU]"
"2.093806","5.9.29.183","172.19.0.3","TLSv1.2","1516","Application Data [TCP segment of a reassembled PDU]"
"2.093847","172.19.0.3","5.9.29.183","TCP","56","43520 → 9002 [ACK] Seq=6973 Ack=85083 Win=11885 Len=0"
"2.093859","5.9.29.183","172.19.0.3","TCP","1516","9002 → 43520 [PSH, ACK] Seq=85083 Ack=6973 Win=65535 Len=1460 [TCP segment of a reassembled PDU]"
"2.093862","5.9.29.183","172.19.0.3","TCP","1516","9002 → 43520 [PSH, ACK] Seq=86543 Ack=6973 Win=65535 Len=1460 [TCP segment of a reassembled PDU]"
"2.093951","5.9.29.183","172.19.0.3","TLSv1.2","1456","Application Data [TCP segment of a reassembled PDU]"
"2.094004","172.19.0.3","5.9.29.183","TCP","56","43520 → 9002 [ACK] Seq=6973 Ack=89403 Win=11861 Len=0"
"2.106253","5.9.29.183","172.19.0.3","TCP","1516","9002 → 43520 [PSH, ACK] Seq=89403 Ack=6973 Win=65535 Len=1460 [TCP segment of a reassembled PDU]"
"2.106329","5.9.29.183","172.19.0.3","TCP","1516","9002 → 43520 [PSH, ACK] Seq=90863 Ack=6973 Win=65535 Len=1460 [TCP segment of a reassembled PDU]"
"2.106353","172.19.0.3","5.9.29.183","TCP","56","43520 → 9002 [ACK] Seq=6973 Ack=92323 Win=11903 Len=0"
"2.106357","5.9.29.183","172.19.0.3","TLSv1.2","1240","Application Data, Application Data, Application Data"
"2.112548","172.19.0.3","5.9.29.183","TLSv1.2","599","Application Data"
"2.112866","5.9.29.183","172.19.0.3","TCP","56","9002 → 43520 [ACK] Seq=93507 Ack=7516 Win=65535 Len=0"
"2.437344","5.9.29.183","172.19.0.3","TLSv1.2","599","Application Data"
"2.438274","172.19.0.3","5.9.29.183","TLSv1.2","599","Application Data"
"2.438637","5.9.29.183","172.19.0.3","TCP","56","9002 → 43520 [ACK] Seq=94050 Ack=8059 Win=65535 Len=0"
"2.708852","5.9.29.183","172.19.0.3","TCP","1504","[TCP segment of a reassembled PDU]"
"2.708934","5.9.29.183","172.19.0.3","TCP","1516","9002 → 43520 [PSH, ACK] Seq=95498 Ack=8059 Win=65535 Len=1460 [TCP segment of a reassembled PDU]"
"2.708945","5.9.29.183","172.19.0.3","TLSv1.2","1516","Application Data [TCP segment of a reassembled PDU]"
"2.708950","5.9.29.183","172.19.0.3","TCP","1516","9002 → 43520 [PSH, ACK] Seq=98418 Ack=8059 Win=65535 Len=1460 [TCP segment of a reassembled PDU]"
"2.708955","5.9.29.183","172.19.0.3","TCP","1201","9002 → 43520 [PSH, ACK] Seq=99878 Ack=8059 Win=65535 Len=1145 [TCP segment of a reassembled PDU]"
"2.708997","5.9.29.183","172.19.0.3","TLSv1.2","1516","Application Data [TCP segment of a reassembled PDU]"
"2.709003","5.9.29.183","172.19.0.3","TCP","1516","9002 → 43520 [PSH, ACK] Seq=102483 Ack=8059 Win=65535 Len=1460 [TCP segment of a reassembled PDU]"
"2.709006","5.9.29.183","172.19.0.3","TCP","1480","9002 → 43520 [PSH, ACK] Seq=103943 Ack=8059 Win=65535 Len=1424 [TCP segment of a reassembled PDU]"
"2.709053","172.19.0.3","5.9.29.183","TCP","56","43520 → 9002 [ACK] Seq=8059 Ack=105367 Win=11853 Len=0"
"2.724324","5.9.29.183","172.19.0.3","TLSv1.2","1516","Application Data [TCP segment of a reassembled PDU]"
"2.724420","5.9.29.183","172.19.0.3","TCP","122","9002 → 43520 [PSH, ACK] Seq=106827 Ack=8059 Win=65535 Len=66 [TCP segment of a reassembled PDU]"
"2.724436","172.19.0.3","5.9.29.183","TCP","56","43520 → 9002 [ACK] Seq=8059 Ack=106893 Win=11909 Len=0"
"2.724536","5.9.29.183","172.19.0.3","TCP","1516","9002 → 43520 [PSH, ACK] Seq=106893 Ack=8059 Win=65535 Len=1460 [TCP segment of a reassembled PDU]"
"2.724542","5.9.29.183","172.19.0.3","TCP","1075","9002 → 43520 [PSH, ACK] Seq=108353 Ack=8059 Win=65535 Len=1019 [TCP segment of a reassembled PDU]"
"2.724544","5.9.29.183","172.19.0.3","TLSv1.2","1516","Application Data [TCP segment of a reassembled PDU]"
"2.724547","5.9.29.183","172.19.0.3","TCP","1516","9002 → 43520 [PSH, ACK] Seq=110832 Ack=8059 Win=65535 Len=1460 [TCP segment of a reassembled PDU]"
"2.724549","5.9.29.183","172.19.0.3","TCP","449","9002 → 43520 [PSH, ACK] Seq=112292 Ack=8059 Win=65535 Len=393 [TCP segment of a reassembled PDU]"
"2.724662","172.19.0.3","5.9.29.183","TCP","56","43520 → 9002 [ACK] Seq=8059 Ack=112685 Win=11869 Len=0"
"2.740146","5.9.29.183","172.19.0.3","TLSv1.2","584","Application Data"
"2.744185","5.9.29.183","172.19.0.3","TCP","1504","[TCP segment of a reassembled PDU]"
"2.744193","172.19.0.3","5.9.29.183","TCP","56","43520 → 9002 [ACK] Seq=8059 Ack=114661 Win=11911 Len=0"
"2.755497","5.9.29.183","172.19.0.3","TLSv1.2","1207","Application Data"
"2.755859","172.19.0.3","5.9.29.183","TLSv1.2","599","Application Data"
"2.756053","5.9.29.183","172.19.0.3","TCP","56","9002 → 43520 [ACK] Seq=115812 Ack=8602 Win=65535 Len=0"
"2.765833","172.19.0.3","5.9.29.183","TLSv1.2","599","Application Data"
"2.766180","5.9.29.183","172.19.0.3","TCP","56","9002 → 43520 [ACK] Seq=115812 Ack=9145 Win=65535 Len=0"
"3.067045","5.9.29.183","172.19.0.3","TLSv1.2","599","Application Data"
"3.067783","172.19.0.3","5.9.29.183","TLSv1.2","599","Application Data"
"3.068197","5.9.29.183","172.19.0.3","TCP","56","9002 → 43520 [ACK] Seq=116355 Ack=9688 Win=65535 Len=0"
"3.309454","5.9.29.183","172.19.0.3","TCP","1516","[TCP segment of a reassembled PDU]"
"3.309520","5.9.29.183","172.19.0.3","TCP","1492","9002 → 43520 [PSH, ACK] Seq=117815 Ack=9688 Win=65535 Len=1436 [TCP segment of a reassembled PDU]"
"3.309527","5.9.29.183","172.19.0.3","TLSv1.2","787","Application Data"
"3.309638","172.19.0.3","5.9.29.183","TCP","56","43520 → 9002 [ACK] Seq=9688 Ack=119982 Win=11895 Len=0"
"3.321636","5.9.29.183","172.19.0.3","TCP","1516","[TCP segment of a reassembled PDU]"
"3.321687","5.9.29.183","172.19.0.3","TCP","1516","9002 → 43520 [PSH, ACK] Seq=121442 Ack=9688 Win=65535 Len=1460 [TCP segment of a reassembled PDU]"
"3.321702","172.19.0.3","5.9.29.183","TCP","56","43520 → 9002 [ACK] Seq=9688 Ack=122902 Win=11903 Len=0"
"3.321704","5.9.29.183","172.19.0.3","TLSv1.2","1480","Application Data [TCP segment of a reassembled PDU]"
"3.326255","5.9.29.183","172.19.0.3","TLSv1.2","396","Application Data"
"3.326274","172.19.0.3","5.9.29.183","TCP","56","43520 → 9002 [ACK] Seq=9688 Ack=124666 Win=11911 Len=0"
"3.341288","5.9.29.183","172.19.0.3","TCP","1516","[TCP segment of a reassembled PDU]"
"3.341339","5.9.29.183","172.19.0.3","TCP","1492","9002 → 43520 [PSH, ACK] Seq=126126 Ack=9688 Win=65535 Len=1436 [TCP segment of a reassembled PDU]"
"3.341503","172.19.0.3","5.9.29.183","TCP","56","43520 → 9002 [ACK] Seq=9688 Ack=127562 Win=11901 Len=0"
"3.342135","5.9.29.183","172.19.0.3","TLSv1.2","787","Application Data"
"3.353850","5.9.29.183","172.19.0.3","TCP","1516","[TCP segment of a reassembled PDU]"
"3.353867","172.19.0.3","5.9.29.183","TCP","56","43520 → 9002 [ACK] Seq=9688 Ack=129753 Win=11911 Len=0"
"3.353899","5.9.29.183","172.19.0.3","TCP","1516","9002 → 43520 [PSH, ACK] Seq=129753 Ack=9688 Win=65535 Len=1460 [TCP segment of a reassembled PDU]"
"3.353906","5.9.29.183","172.19.0.3","TLSv1.2","1516","Application Data [TCP segment of a reassembled PDU]"
"3.353909","5.9.29.183","172.19.0.3","TCP","1468","9002 → 43520 [PSH, ACK] Seq=132673 Ack=9688 Win=65535 Len=1412 [TCP segment of a reassembled PDU]"
"3.353913","5.9.29.183","172.19.0.3","TCP","1516","9002 → 43520 [PSH, ACK] Seq=134085 Ack=9688 Win=65535 Len=1460 [TCP segment of a reassembled PDU]"
"3.353915","5.9.29.183","172.19.0.3","TLSv1.2","1516","Application Data [TCP segment of a reassembled PDU]"
"3.353918","5.9.29.183","172.19.0.3","TCP","1516","9002 → 43520 [PSH, ACK] Seq=137005 Ack=9688 Win=65535 Len=1460 [TCP segment of a reassembled PDU]"
"3.353920","5.9.29.183","172.19.0.3","TCP","1516","9002 → 43520 [PSH, ACK] Seq=138465 Ack=9688 Win=65535 Len=1460 [TCP segment of a reassembled PDU]"
"3.353964","5.9.29.183","172.19.0.3","TLSv1.2","1456","Application Data [TCP segment of a reassembled PDU]"
"3.354012","172.19.0.3","5.9.29.183","TCP","56","43520 → 9002 [ACK] Seq=9688 Ack=141325 Win=11847 Len=0"
"3.356919","5.9.29.183","172.19.0.3","TCP","1516","9002 → 43520 [PSH, ACK] Seq=141325 Ack=9688 Win=65535 Len=1460 [TCP segment of a reassembled PDU]"
"3.356973","5.9.29.183","172.19.0.3","TCP","1492","9002 → 43520 [PSH, ACK] Seq=142785 Ack=9688 Win=65535 Len=1436 [TCP segment of a reassembled PDU]"
"3.356988","172.19.0.3","5.9.29.183","TCP","56","43520 → 9002 [ACK] Seq=9688 Ack=144221 Win=11903 Len=0"
"3.358961","5.9.29.183","172.19.0.3","TLSv1.2","178","Application Data"
"3.359352","172.19.0.3","5.9.29.183","TLSv1.2","599","Application Data"
"3.359656","5.9.29.183","172.19.0.3","TCP","56","9002 → 43520 [ACK] Seq=144343 Ack=10231 Win=65535 Len=0"
"3.371372","5.9.29.183","172.19.0.3","TCP","1516","[TCP segment of a reassembled PDU]"
"3.371416","5.9.29.183","172.19.0.3","TCP","1516","9002 → 43520 [PSH, ACK] Seq=145803 Ack=10231 Win=65535 Len=1460 [TCP segment of a reassembled PDU]"
"3.371422","5.9.29.183","172.19.0.3","TLSv1.2","1516","Application Data [TCP segment of a reassembled PDU]"
"3.371424","5.9.29.183","172.19.0.3","TCP","1468","9002 → 43520 [PSH, ACK] Seq=148723 Ack=10231 Win=65535 Len=1412 [TCP segment of a reassembled PDU]"
"3.371426","5.9.29.183","172.19.0.3","TCP","1504","9002 → 43520 [PSH, ACK] Seq=150135 Ack=10231 Win=65535 Len=1448 [TCP segment of a reassembled PDU]"
"3.371525","172.19.0.3","5.9.29.183","TCP","56","43520 → 9002 [ACK] Seq=10231 Ack=151583 Win=11879 Len=0"
"3.374725","5.9.29.183","172.19.0.3","TLSv1.2","584","Application Data"
"3.388970","5.9.29.183","172.19.0.3","TCP","1516","[TCP segment of a reassembled PDU]"
"3.388993","172.19.0.3","5.9.29.183","TCP","56","43520 → 9002 [ACK] Seq=10231 Ack=153571 Win=11909 Len=0"
"3.389052","5.9.29.183","172.19.0.3","TCP","1516","9002 → 43520 [PSH, ACK] Seq=153571 Ack=10231 Win=65535 Len=1460 [TCP segment of a reassembled PDU]"
"3.389067","5.9.29.183","172.19.0.3","TLSv1.2","1516","Application Data [TCP segment of a reassembled PDU]"
"3.389073","5.9.29.183","172.19.0.3","TCP","1468","9002 → 43520 [PSH, ACK] Seq=156491 Ack=10231 Win=65535 Len=1412 [TCP segment of a reassembled PDU]"
"3.389224","172.19.0.3","5.9.29.183","TCP","56","43520 → 9002 [ACK] Seq=10231 Ack=157903 Win=11885 Len=0"
"3.390277","5.9.29.183","172.19.0.3","TLSv1.2","490","Application Data"
"3.394863","172.19.0.3","5.9.29.183","TLSv1.2","599","Application Data"
"3.395485","5.9.29.183","172.19.0.3","TCP","56","9002 → 43520 [ACK] Seq=158337 Ack=10774 Win=65535 Len=0"
"3.475874","185.21.216.198","172.19.0.3","TLSv1.2","599","Application Data"
"3.475899","172.19.0.3","185.21.216.198","TCP","56","37034 → 41389 [ACK] Seq=1 Ack=544 Win=1452 Len=0"
"3.635325","5.9.29.183","172.19.0.3","TLSv1.2","599","Application Data"
"3.636033","172.19.0.3","5.9.29.183","TLSv1.2","599","Application Data"
"3.636363","5.9.29.183","172.19.0.3","TCP","56","9002 → 43520 [ACK] Seq=158880 Ack=11317 Win=65535 Len=0"
"3.888597","5.9.29.183","172.19.0.3","TLSv1.2","599","Application Data"
"3.900259","5.9.29.183","172.19.0.3","TCP","1516","[TCP segment of a reassembled PDU]"
"3.900283","172.19.0.3","5.9.29.183","TCP","56","43520 → 9002 [ACK] Seq=11317 Ack=160883 Win=11911 Len=0"
"3.900377","5.9.29.183","172.19.0.3","TCP","1492","9002 → 43520 [PSH, ACK] Seq=160883 Ack=11317 Win=65535 Len=1436 [TCP segment of a reassembled PDU]"
"3.900392","5.9.29.183","172.19.0.3","TLSv1.2","1516","Application Data [TCP segment of a reassembled PDU]"
"3.900473","5.9.29.183","172.19.0.3","TCP","1516","9002 → 43520 [PSH, ACK] Seq=163779 Ack=11317 Win=65535 Len=1460 [TCP segment of a reassembled PDU]"
"3.900480","5.9.29.183","172.19.0.3","TCP","1480","9002 → 43520 [PSH, ACK] Seq=165239 Ack=11317 Win=65535 Len=1424 [TCP segment of a reassembled PDU]"
"3.900501","172.19.0.3","5.9.29.183","TCP","56","43520 → 9002 [ACK] Seq=11317 Ack=165239 Win=11885 Len=0"
"3.904190","5.9.29.183","172.19.0.3","TLSv1.2","584","Application Data"
"3.904214","172.19.0.3","5.9.29.183","TCP","56","43520 → 9002 [ACK] Seq=11317 Ack=167191 Win=11911 Len=0"
"3.942800","5.9.29.183","172.19.0.3","TCP","1516","[TCP segment of a reassembled PDU]"
"3.942903","5.9.29.183","172.19.0.3","TCP","1492","9002 → 43520 [PSH, ACK] Seq=168651 Ack=11317 Win=65535 Len=1436 [TCP segment of a reassembled PDU]"
"3.942916","5.9.29.183","172.19.0.3","TLSv1.2","1516","Application Data [TCP segment of a reassembled PDU]"
"3.942920","5.9.29.183","172.19.0.3","TCP","1516","9002 → 43520 [PSH, ACK] Seq=171547 Ack=11317 Win=65535 Len=1460 [TCP segment of a reassembled PDU]"
"3.942941","5.9.29.183","172.19.0.3","TCP","1213","9002 → 43520 [PSH, ACK] Seq=173007 Ack=11317 Win=65535 Len=1157 [TCP segment of a reassembled PDU]"
"3.943034","172.19.0.3","5.9.29.183","TCP","56","43520 → 9002 [ACK] Seq=11317 Ack=174164 Win=11879 Len=0"
"3.943445","172.19.0.3","5.9.29.183","TLSv1.2","599","Application Data"
"3.943709","5.9.29.183","172.19.0.3","TCP","56","9002 → 43520 [ACK] Seq=174164 Ack=11860 Win=65535 Len=0"
"3.958259","5.9.29.183","172.19.0.3","TCP","800","9002 → 43520 [PSH, ACK] Seq=174164 Ack=11860 Win=65535 Len=744 [TCP segment of a reassembled PDU]"
"3.958323","5.9.29.183","172.19.0.3","TLSv1.2","107","Application Data"
"3.958488","172.19.0.3","5.9.29.183","TCP","56","43520 → 9002 [ACK] Seq=11860 Ack=174959 Win=11911 Len=0"
"3.964207","5.9.29.183","172.19.0.3","TCP","1516","[TCP segment of a reassembled PDU]"
"3.964260","5.9.29.183","172.19.0.3","TCP","1492","9002 → 43520 [PSH, ACK] Seq=176419 Ack=11860 Win=65535 Len=1436 [TCP segment of a reassembled PDU]"
"3.964420","172.19.0.3","5.9.29.183","TCP","56","43520 → 9002 [ACK] Seq=11860 Ack=177855 Win=11903 Len=0"
"3.973148","5.9.29.183","172.19.0.3","TLSv1.2","273","Application Data"
"3.976771","172.19.0.3","5.9.29.183","TLSv1.2","599","Application Data"
"3.977016","5.9.29.183","172.19.0.3","TCP","56","9002 → 43520 [ACK] Seq=178072 Ack=12403 Win=65535 Len=0"
"4.225140","5.9.29.183","172.19.0.3","TLSv1.2","599","Application Data"
"4.225877","172.19.0.3","5.9.29.183","TLSv1.2","599","Application Data"
"4.226223","5.9.29.183","172.19.0.3","TCP","56","9002 → 43520 [ACK] Seq=178615 Ack=12946 Win=65535 Len=0"
"4.476898","5.9.29.183","172.19.0.3","TCP","1516","[TCP segment of a reassembled PDU]"
"4.476975","5.9.29.183","172.19.0.3","TCP","1516","9002 → 43520 [PSH, ACK] Seq=180075 Ack=12946 Win=65535 Len=1460 [TCP segment of a reassembled PDU]"
"4.476985","5.9.29.183","172.19.0.3","TLSv1.2","763","Application Data"
"4.477204","172.19.0.3","5.9.29.183","TCP","56","43520 → 9002 [ACK] Seq=12946 Ack=182242 Win=11895 Len=0"
"4.493929","5.9.29.183","172.19.0.3","TCP","1516","[TCP segment of a reassembled PDU]"
"4.494001","5.9.29.183","172.19.0.3","TCP","1516","9002 → 43520 [PSH, ACK] Seq=183702 Ack=12946 Win=65535 Len=1460 [TCP segment of a reassembled PDU]"
"4.494021","172.19.0.3","5.9.29.183","TCP","56","43520 → 9002 [ACK] Seq=12946 Ack=185162 Win=11903 Len=0"
"4.494026","5.9.29.183","172.19.0.3","TLSv1.2","763","Application Data"
"4.505565","5.9.29.183","172.19.0.3","TCP","1504","[TCP segment of a reassembled PDU]"
"4.505587","172.19.0.3","5.9.29.183","TCP","56","43520 → 9002 [ACK] Seq=12946 Ack=187317 Win=11911 Len=0"
"4.505738","5.9.29.183","172.19.0.3","TCP","1504","9002 → 43520 [PSH, ACK] Seq=187317 Ack=12946 Win=65535 Len=1448 [TCP segment of a reassembled PDU]"
"4.505769","5.9.29.183","172.19.0.3","TLSv1.2","1516","Application Data [TCP segment of a reassembled PDU]"
"4.505800","172.19.0.3","5.9.29.183","TCP","56","43520 → 9002 [ACK] Seq=12946 Ack=190225 Win=11895 Len=0"
"4.505912","5.9.29.183","172.19.0.3","TCP","1516","9002 → 43520 [PSH, ACK] Seq=190225 Ack=12946 Win=65535 Len=1460 [TCP segment of a reassembled PDU]"
"4.505930","5.9.29.183","172.19.0.3","TCP","1480","9002 → 43520 [PSH, ACK] Seq=191685 Ack=12946 Win=65535 Len=1424 [TCP segment of a reassembled PDU]"
"4.506176","172.19.0.3","5.9.29.183","TCP","56","43520 → 9002 [ACK] Seq=12946 Ack=193109 Win=11879 Len=0"
"4.509291","5.9.29.183","172.19.0.3","TLSv1.2","70","Application Data"
"4.522736","5.9.29.183","172.19.0.3","TCP","1516","[TCP segment of a reassembled PDU]"
"4.522758","172.19.0.3","5.9.29.183","TCP","56","43520 → 9002 [ACK] Seq=12946 Ack=194583 Win=11911 Len=0"
"4.522806","5.9.29.183","172.19.0.3","TCP","1516","9002 → 43520 [PSH, ACK] Seq=194583 Ack=12946 Win=65535 Len=1460 [TCP segment of a reassembled PDU]"
"4.522819","5.9.29.183","172.19.0.3","TLSv1.2","1480","Application Data [TCP segment of a reassembled PDU]"
"4.522985","172.19.0.3","5.9.29.183","TCP","56","43520 → 9002 [ACK] Seq=12946 Ack=197467 Win=11893 Len=0"
"4.524606","5.9.29.183","172.19.0.3","TLSv1.2","1424","Application Data"
"4.544374","5.9.29.183","172.19.0.3","TCP","1504","[TCP segment of a reassembled PDU]"
"4.544435","172.19.0.3","5.9.29.183","TCP","56","43520 → 9002 [ACK] Seq=12946 Ack=200283 Win=11911 Len=0"
"4.544485","5.9.29.183","172.19.0.3","TCP","1516","9002 → 43520 [PSH, ACK] Seq=200283 Ack=12946 Win=65535 Len=1460 [TCP segment of a reassembled PDU]"
"4.544561","5.9.29.183","172.19.0.3","TLSv1.2","775","Application Data"
"4.544646","172.19.0.3","5.9.29.183","TCP","56","43520 → 9002 [ACK] Seq=12946 Ack=202462 Win=11895 Len=0"
"4.562083","5.9.29.183","172.19.0.3","TCP","1516","[TCP segment of a reassembled PDU]"
"4.562143","5.9.29.183","172.19.0.3","TCP","1516","9002 → 43520 [PSH, ACK] Seq=203922 Ack=12946 Win=65535 Len=1460 [TCP segment of a reassembled PDU]"
"4.562162","172.19.0.3","5.9.29.183","TCP","56","43520 → 9002 [ACK] Seq=12946 Ack=205382 Win=11903 Len=0"
"4.562165","5.9.29.183","172.19.0.3","TLSv1.2","249","Application Data"
"4.562474","172.19.0.3","5.9.29.183","TLSv1.2","599","Application Data"
"4.562715","5.9.29.183","172.19.0.3","TCP","56","9002 → 43520 [ACK] Seq=205575 Ack=13489 Win=65535 Len=0"
"4.580349","5.9.29.183","172.19.0.3","TCP","1516","[TCP segment of a reassembled PDU]"
"4.580399","5.9.29.183","172.19.0.3","TLSv1.2","167","Application Data"
"4.580560","172.19.0.3","5.9.29.183","TCP","56","43520 → 9002 [ACK] Seq=13489 Ack=207146 Win=11903 Len=0"
"4.583663","172.19.0.3","5.9.29.183","TLSv1.2","599","Application Data"
"4.583865","5.9.29.183","172.19.0.3","TCP","56","9002 → 43520 [ACK] Seq=207146 Ack=14032 Win=65535 Len=0"
"4.824838","5.9.29.183","172.19.0.3","TLSv1.2","599","Application Data"
"4.825579","172.19.0.3","5.9.29.183","TLSv1.2","599","Application Data"
"4.825842","5.9.29.183","172.19.0.3","TCP","56","9002 → 43520 [ACK] Seq=207689 Ack=14575 Win=65535 Len=0"
"5.083380","5.9.29.183","172.19.0.3","TLSv1.2","599","Application Data"
"5.095021","5.9.29.183","172.19.0.3","TCP","1504","[TCP segment of a reassembled PDU]"
"5.095114","172.19.0.3","5.9.29.183","TCP","56","43520 → 9002 [ACK] Seq=14575 Ack=209680 Win=11911 Len=0"
"5.095146","5.9.29.183","172.19.0.3","TCP","1516","9002 → 43520 [PSH, ACK] Seq=209680 Ack=14575 Win=65535 Len=1460 [TCP segment of a reassembled PDU]"
"5.095179","5.9.29.183","172.19.0.3","TLSv1.2","1516","Application Data [TCP segment of a reassembled PDU]"
"5.095244","172.19.0.3","5.9.29.183","TCP","56","43520 → 9002 [ACK] Seq=14575 Ack=212600 Win=11895 Len=0"
"5.095269","5.9.29.183","172.19.0.3","TCP","1516","9002 → 43520 [PSH, ACK] Seq=212600 Ack=14575 Win=65535 Len=1460 [TCP segment of a reassembled PDU]"
"5.095274","5.9.29.183","172.19.0.3","TCP","1468","9002 → 43520 [PSH, ACK] Seq=214060 Ack=14575 Win=65535 Len=1412 [TCP segment of a reassembled PDU]"
"5.095330","172.19.0.3","5.9.29.183","TCP","56","43520 → 9002 [ACK] Seq=14575 Ack=215472 Win=11879 Len=0"
"5.099266","5.9.29.183","172.19.0.3","TLSv1.2","70","Application Data"
"5.111334","5.9.29.183","172.19.0.3","TCP","1504","[TCP segment of a reassembled PDU]"
"5.111352","172.19.0.3","5.9.29.183","TCP","56","43520 → 9002 [ACK] Seq=14575 Ack=216934 Win=11911 Len=0"
"5.111387","5.9.29.183","172.19.0.3","TCP","1504","9002 → 43520 [PSH, ACK] Seq=216934 Ack=14575 Win=65535 Len=1448 [TCP segment of a reassembled PDU]"
"5.111394","5.9.29.183","172.19.0.3","TLSv1.2","1516","Application Data [TCP segment of a reassembled PDU]"
"5.111397","5.9.29.183","172.19.0.3","TCP","1492","9002 → 43520 [PSH, ACK] Seq=219842 Ack=14575 Win=65535 Len=1436 [TCP segment of a reassembled PDU]"
"5.111449","5.9.29.183","172.19.0.3","TCP","1516","9002 → 43520 [PSH, ACK] Seq=221278 Ack=14575 Win=65535 Len=1460 [TCP segment of a reassembled PDU]"
"5.111453","5.9.29.183","172.19.0.3","TLSv1.2","1492","Application Data [TCP segment of a reassembled PDU]"
"5.111457","5.9.29.183","172.19.0.3","TCP","1516","9002 → 43520 [PSH, ACK] Seq=224174 Ack=14575 Win=65535 Len=1460 [TCP segment of a reassembled PDU]"
"5.111495","172.19.0.3","5.9.29.183","TCP","56","43520 → 9002 [ACK] Seq=14575 Ack=225634 Win=11861 Len=0"
"5.111619","5.9.29.183","172.19.0.3","TCP","1516","9002 → 43520 [PSH, ACK] Seq=225634 Ack=14575 Win=65535 Len=1460 [TCP segment of a reassembled PDU]"
"5.111624","5.9.29.183","172.19.0.3","TLSv1.2","1480","Application Data [TCP segment of a reassembled PDU]"
"5.111640","172.19.0.3","5.9.29.183","TCP","56","43520 → 9002 [ACK] Seq=14575 Ack=228518 Win=11845 Len=0"
"5.111804","172.19.0.3","5.9.29.183","TLSv1.2","599","Application Data"
"5.111834","5.9.29.183","172.19.0.3","TCP","1504","9002 → 43520 [PSH, ACK] Seq=228518 Ack=14575 Win=65535 Len=1448 [TCP segment of a reassembled PDU]"
"5.111953","5.9.29.183","172.19.0.3","TCP","56","9002 → 43520 [ACK] Seq=229966 Ack=15118 Win=65535 Len=0"
"5.111959","5.9.29.183","172.19.0.3","TCP","1504","9002 → 43520 [PSH, ACK] Seq=229966 Ack=15118 Win=65535 Len=1448 [TCP segment of a reassembled PDU]"
"5.111963","172.19.0.3","5.9.29.183","TCP","56","43520 → 9002 [ACK] Seq=15118 Ack=231414 Win=11911 Len=0"
"5.114610","5.9.29.183","172.19.0.3","TLSv1.2","178","Application Data"
"5.130007","5.9.29.183","172.19.0.3","TCP","1516","[TCP segment of a reassembled PDU]"
"5.130024","172.19.0.3","5.9.29.183","TCP","56","43520 → 9002 [ACK] Seq=15118 Ack=232996 Win=11911 Len=0"
"5.130058","5.9.29.183","172.19.0.3","TCP","1516","9002 → 43520 [PSH, ACK] Seq=232996 Ack=15118 Win=65535 Len=1460 [TCP segment of a reassembled PDU]"
"5.130066","5.9.29.183","172.19.0.3","TLSv1.2","1480","Application Data [TCP segment of a reassembled PDU]"
"5.130069","5.9.29.183","172.19.0.3","TCP","1516","9002 → 43520 [PSH, ACK] Seq=235880 Ack=15118 Win=65535 Len=1460 [TCP segment of a reassembled PDU]"
"5.130143","5.9.29.183","172.19.0.3","TCP","1516","9002 → 43520 [PSH, ACK] Seq=237340 Ack=15118 Win=65535 Len=1460 [TCP segment of a reassembled PDU]"
"5.130149","5.9.29.183","172.19.0.3","TLSv1.2","1516","Application Data [TCP segment of a reassembled PDU]"
"5.130152","5.9.29.183","172.19.0.3","TCP","240","9002 → 43520 [PSH, ACK] Seq=240260 Ack=15118 Win=65535 Len=184 [TCP segment of a reassembled PDU]"
"5.130154","5.9.29.183","172.19.0.3","TLSv1.2","1001","Application Data"
"5.130169","172.19.0.3","5.9.29.183","TCP","56","43520 → 9002 [ACK] Seq=15118 Ack=240444 Win=11863 Len=0"
"5.130388","172.19.0.3","5.9.29.183","TLSv1.2","599","Application Data"
"5.130537","5.9.29.183","172.19.0.3","TCP","56","9002 → 43520 [ACK] Seq=241389 Ack=15661 Win=65535 Len=0"
"5.148449","5.9.29.183","172.19.0.3","TCP","1516","[TCP segment of a reassembled PDU]"
"5.148498","5.9.29.183","172.19.0.3","TCP","1516","9002 → 43520 [PSH, ACK] Seq=242849 Ack=15661 Win=65535 Len=1460 [TCP segment of a reassembled PDU]"
"5.148511","172.19.0.3","5.9.29.183","TCP","56","43520 → 9002 [ACK] Seq=15661 Ack=244309 Win=11903 Len=0"
"5.148514","5.9.29.183","172.19.0.3","TLSv1.2","1516","Application Data [TCP segment of a reassembled PDU]"
"5.148516","5.9.29.183","172.19.0.3","TCP","1201","9002 → 43520 [PSH, ACK] Seq=245769 Ack=15661 Win=65535 Len=1145 [TCP segment of a reassembled PDU]"
"5.148518","5.9.29.183","172.19.0.3","TCP","1516","9002 → 43520 [PSH, ACK] Seq=246914 Ack=15661 Win=65535 Len=1460 [TCP segment of a reassembled PDU]"
"5.148520","5.9.29.183","172.19.0.3","TLSv1.2","1516","Application Data [TCP segment of a reassembled PDU]"
"5.148522","5.9.29.183","172.19.0.3","TCP","1516","9002 → 43520 [PSH, ACK] Seq=249834 Ack=15661 Win=65535 Len=1460 [TCP segment of a reassembled PDU]"
"5.148524","5.9.29.183","172.19.0.3","TCP","1516","9002 → 43520 [PSH, ACK] Seq=251294 Ack=15661 Win=65535 Len=1460 [TCP segment of a reassembled PDU]"
"5.148526","5.9.29.183","172.19.0.3","TLSv1.2","1516","Application Data [TCP segment of a reassembled PDU]"
"5.148527","5.9.29.183","172.19.0.3","TCP","1444","9002 → 43520 [PSH, ACK] Seq=254214 Ack=15661 Win=65535 Len=1388 [TCP segment of a reassembled PDU]"
"5.148574","5.9.29.183","172.19.0.3","TCP","1504","9002 → 43520 [PSH, ACK] Seq=255602 Ack=15661 Win=65535 Len=1448 [TCP segment of a reassembled PDU]"
"5.148609","172.19.0.3","5.9.29.183","TCP","56","43520 → 9002 [ACK] Seq=15661 Ack=257050 Win=11828 Len=0"
"5.162070","5.9.29.183","172.19.0.3","TLSv1.2","1504","Application Data [TCP segment of a reassembled PDU]"
"5.162114","5.9.29.183","172.19.0.3","TCP","1516","9002 → 43520 [PSH, ACK] Seq=258498 Ack=15661 Win=65535 Len=1460 [TCP segment of a reassembled PDU]"
"5.162136","172.19.0.3","5.9.29.183","TCP","56","43520 → 9002 [ACK] Seq=15661 Ack=259958 Win=11903 Len=0"
"5.162190","5.9.29.183","172.19.0.3","TCP","1492","9002 → 43520 [PSH, ACK] Seq=259958 Ack=15661 Win=65535 Len=1436 [TCP segment of a reassembled PDU]"
"5.162195","5.9.29.183","172.19.0.3","TLSv1.2","1516","Application Data [TCP segment of a reassembled PDU]"
"5.162197","5.9.29.183","172.19.0.3","TCP","1516","9002 → 43520 [PSH, ACK] Seq=262854 Ack=15661 Win=65535 Len=1460 [TCP segment of a reassembled PDU]"
"5.162242","172.19.0.3","5.9.29.183","TCP","56","43520 → 9002 [ACK] Seq=15661 Ack=264314 Win=11879 Len=0"
"5.162267","5.9.29.183","172.19.0.3","TLSv1.2","1516","Application Data [TCP segment of a reassembled PDU]"
"5.162270","5.9.29.183","172.19.0.3","TCP","1468","9002 → 43520 [PSH, ACK] Seq=265774 Ack=15661 Win=65535 Len=1412 [TCP segment of a reassembled PDU]"
"5.162401","172.19.0.3","5.9.29.183","TCP","56","43520 → 9002 [ACK] Seq=15661 Ack=267186 Win=11863 Len=0"
"5.162595","172.19.0.3","5.9.29.183","TLSv1.2","599","Application Data"
"5.162750","5.9.29.183","172.19.0.3","TCP","56","9002 → 43520 [ACK] Seq=267186 Ack=16204 Win=65535 Len=0"
"5.165237","5.9.29.183","172.19.0.3","TLSv1.2","676","Application Data"
"5.172043","172.19.0.3","5.9.29.183","TLSv1.2","1113","Application Data"
"5.172280","5.9.29.183","172.19.0.3","TCP","56","9002 → 43520 [ACK] Seq=267806 Ack=17261 Win=65535 Len=0"
"5.185213","5.9.29.183","172.19.0.3","TLSv1.2","599","Application Data"
"5.229402","172.19.0.3","5.9.29.183","TCP","56","43520 → 9002 [ACK] Seq=17261 Ack=268349 Win=11911 Len=0"
"5.460131","5.9.29.183","172.19.0.3","TLSv1.2","599","Application Data"
"5.460185","172.19.0.3","5.9.29.183","TCP","56","43520 → 9002 [ACK] Seq=17261 Ack=268892 Win=11909 Len=0"
"5.460645","172.19.0.3","5.9.29.183","TLSv1.2","599","Application Data"
"5.460878","5.9.29.183","172.19.0.3","TCP","56","9002 → 43520 [ACK] Seq=268892 Ack=17804 Win=65535 Len=0"
"5.711213","5.9.29.183","172.19.0.3","TCP","1516","[TCP segment of a reassembled PDU]"
"5.711333","5.9.29.183","172.19.0.3","TCP","1492","9002 → 43520 [PSH, ACK] Seq=270352 Ack=17804 Win=65535 Len=1436 [TCP segment of a reassembled PDU]"
"5.711343","5.9.29.183","172.19.0.3","TLSv1.2","1516","Application Data [TCP segment of a reassembled PDU]"
"5.711346","5.9.29.183","172.19.0.3","TCP","1516","9002 → 43520 [PSH, ACK] Seq=273248 Ack=17804 Win=65535 Len=1460 [TCP segment of a reassembled PDU]"
"5.711391","5.9.29.183","172.19.0.3","TCP","1213","9002 → 43520 [PSH, ACK] Seq=274708 Ack=17804 Win=65535 Len=1157 [TCP segment of a reassembled PDU]"
"5.711471","172.19.0.3","5.9.29.183","TCP","56","43520 → 9002 [ACK] Seq=17804 Ack=275865 Win=11879 Len=0"
"5.726556","5.9.29.183","172.19.0.3","TLSv1.2","1394","Application Data, Application Data"
"5.726860","172.19.0.3","5.9.29.183","TLSv1.2","599","Application Data"
"5.727069","5.9.29.183","172.19.0.3","TCP","56","9002 → 43520 [ACK] Seq=277203 Ack=18347 Win=65535 Len=0"
"5.732118","5.9.29.183","172.19.0.3","TCP","1516","[TCP segment of a reassembled PDU]"
"5.732172","5.9.29.183","172.19.0.3","TCP","1492","9002 → 43520 [PSH, ACK] Seq=278663 Ack=18347 Win=65535 Len=1436 [TCP segment of a reassembled PDU]"
"5.732306","172.19.0.3","5.9.29.183","TCP","56","43520 → 9002 [ACK] Seq=18347 Ack=280099 Win=11903 Len=0"
"5.741647","5.9.29.183","172.19.0.3","TLSv1.2","1330","Application Data, Application Data"
"5.749133","5.9.29.183","172.19.0.3","TCP","1504","[TCP segment of a reassembled PDU]"
"5.749145","172.19.0.3","5.9.29.183","TCP","56","43520 → 9002 [ACK] Seq=18347 Ack=282821 Win=11911 Len=0"
"5.749184","5.9.29.183","172.19.0.3","TCP","1504","9002 → 43520 [PSH, ACK] Seq=282821 Ack=18347 Win=65535 Len=1448 [TCP segment of a reassembled PDU]"
"5.757733","5.9.29.183","172.19.0.3","TLSv1.2","787","Application Data"
"5.757973","172.19.0.3","5.9.29.183","TCP","56","43520 → 9002 [ACK] Seq=18347 Ack=285000 Win=11911 Len=0"
"5.765751","5.9.29.183","172.19.0.3","TCP","1504","[TCP segment of a reassembled PDU]"
"5.765826","5.9.29.183","172.19.0.3","TCP","1504","9002 → 43520 [PSH, ACK] Seq=286448 Ack=18347 Win=65535 Len=1448 [TCP segment of a reassembled PDU]"
"5.765941","172.19.0.3","5.9.29.183","TCP","56","43520 → 9002 [ACK] Seq=18347 Ack=287896 Win=11903 Len=0"
"5.773042","5.9.29.183","172.19.0.3","TLSv1.2","787","Application Data"
"5.777609","5.9.29.183","172.19.0.3","TCP","1516","[TCP segment of a reassembled PDU]"
"5.777626","172.19.0.3","5.9.29.183","TCP","56","43520 → 9002 [ACK] Seq=18347 Ack=290087 Win=11911 Len=0"
"5.777656","5.9.29.183","172.19.0.3","TCP","1492","9002 → 43520 [PSH, ACK] Seq=290087 Ack=18347 Win=65535 Len=1436 [TCP segment of a reassembled PDU]"
"5.777663","5.9.29.183","172.19.0.3","TLSv1.2","1504","Application Data [TCP segment of a reassembled PDU]"
"5.777758","172.19.0.3","5.9.29.183","TCP","56","43520 → 9002 [ACK] Seq=18347 Ack=292971 Win=11895 Len=0"
"5.788377","5.9.29.183","172.19.0.3","TLSv1.2","396","Application Data"
"5.791510","172.19.0.3","5.9.29.183","TLSv1.2","599","Application Data"
"5.791722","5.9.29.183","172.19.0.3","TCP","56","9002 → 43520 [ACK] Seq=293311 Ack=18890 Win=65535 Len=0"
"6.074377","5.9.29.183","172.19.0.3","TLSv1.2","599","Application Data"
"6.074991","172.19.0.3","5.9.29.183","TLSv1.2","599","Application Data"
"6.075253","5.9.29.183","172.19.0.3","TCP","56","9002 → 43520 [ACK] Seq=293854 Ack=19433 Win=65535 Len=0"
"6.356486","5.9.29.183","172.19.0.3","TLSv1.2","599","Application Data"
"6.374578","5.9.29.183","172.19.0.3","TCP","1516","[TCP segment of a reassembled PDU]"
"6.374595","172.19.0.3","5.9.29.183","TCP","56","43520 → 9002 [ACK] Seq=19433 Ack=295857 Win=11911 Len=0"
"6.374628","5.9.29.183","172.19.0.3","TCP","1492","9002 → 43520 [PSH, ACK] Seq=295857 Ack=19433 Win=65535 Len=1436 [TCP segment of a reassembled PDU]"
"6.374638","5.9.29.183","172.19.0.3","TLSv1.2","787","Application Data"
"6.374744","172.19.0.3","5.9.29.183","TCP","56","43520 → 9002 [ACK] Seq=19433 Ack=298024 Win=11895 Len=0"
"6.377712","172.19.0.3","5.9.29.183","TLSv1.2","599","Application Data"
"6.377897","5.9.29.183","172.19.0.3","TCP","56","9002 → 43520 [ACK] Seq=298024 Ack=19976 Win=65535 Len=0"
"6.640163","5.9.29.183","172.19.0.3","TLSv1.2","599","Application Data"
"6.640796","172.19.0.3","5.9.29.183","TLSv1.2","599","Application Data"
"6.641150","5.9.29.183","172.19.0.3","TCP","56","9002 → 43520 [ACK] Seq=298567 Ack=20519 Win=65535 Len=0"
"6.921838","5.9.29.183","172.19.0.3","TCP","1504","[TCP segment of a reassembled PDU]"
"6.921936","5.9.29.183","172.19.0.3","TCP","1516","9002 → 43520 [PSH, ACK] Seq=300015 Ack=20519 Win=65535 Len=1460 [TCP segment of a reassembled PDU]"
"6.921949","5.9.29.183","172.19.0.3","TLSv1.2","775","Application Data"
"6.922173","172.19.0.3","5.9.29.183","TCP","56","43520 → 9002 [ACK] Seq=20519 Ack=302194 Win=11895 Len=0"
"6.965545","5.9.29.183","172.19.0.3","TCP","1504","[TCP segment of a reassembled PDU]"
"6.965760","5.9.29.183","172.19.0.3","TCP","1516","9002 → 43520 [PSH, ACK] Seq=303642 Ack=20519 Win=65535 Len=1460 [TCP segment of a reassembled PDU]"
"6.965766","5.9.29.183","172.19.0.3","TLSv1.2","775","Application Data"
"6.965790","172.19.0.3","5.9.29.183","TCP","56","43520 → 9002 [ACK] Seq=20519 Ack=305102 Win=11903 Len=0"
"6.969987","172.19.0.3","5.9.29.183","TLSv1.2","599","Application Data"
"6.970262","5.9.29.183","172.19.0.3","TCP","56","9002 → 43520 [ACK] Seq=305821 Ack=21062 Win=65535 Len=0"
"7.234105","5.9.29.183","172.19.0.3","TCP","215","[TCP segment of a reassembled PDU]"
"7.234194","5.9.29.183","172.19.0.3","TLSv1.2","440","Application Data"
"7.234328","172.19.0.3","5.9.29.183","TCP","56","43520 → 9002 [ACK] Seq=21062 Ack=306364 Win=11911 Len=0"
"7.234795","172.19.0.3","5.9.29.183","TLSv1.2","599","Application Data"
"7.235029","5.9.29.183","172.19.0.3","TCP","56","9002 → 43520 [ACK] Seq=306364 Ack=21605 Win=65535 Len=0"
"7.522374","5.9.29.183","172.19.0.3","TCP","1516","[TCP segment of a reassembled PDU]"
"7.522517","5.9.29.183","172.19.0.3","TCP","1492","9002 → 43520 [PSH, ACK] Seq=307824 Ack=21605 Win=65535 Len=1436 [TCP segment of a reassembled PDU]"
"7.522529","5.9.29.183","172.19.0.3","TLSv1.2","1516","Application Data [TCP segment of a reassembled PDU]"
"7.522533","5.9.29.183","172.19.0.3","TCP","1516","9002 → 43520 [PSH, ACK] Seq=310720 Ack=21605 Win=65535 Len=1460 [TCP segment of a reassembled PDU]"
"7.522553","5.9.29.183","172.19.0.3","TCP","1213","9002 → 43520 [PSH, ACK] Seq=312180 Ack=21605 Win=65535 Len=1157 [TCP segment of a reassembled PDU]"
"7.522637","172.19.0.3","5.9.29.183","TCP","56","43520 → 9002 [ACK] Seq=21605 Ack=313337 Win=11879 Len=0"
"7.538058","5.9.29.183","172.19.0.3","TLSv1.2","1394","Application Data, Application Data"
"7.557562","5.9.29.183","172.19.0.3","TCP","1516","[TCP segment of a reassembled PDU]"
"7.557585","172.19.0.3","5.9.29.183","TCP","56","43520 → 9002 [ACK] Seq=21605 Ack=316135 Win=11911 Len=0"
"7.557649","5.9.29.183","172.19.0.3","TLSv1.2","167","Application Data"
"7.561305","172.19.0.3","5.9.29.183","TLSv1.2","599","Application Data"
"7.561534","5.9.29.183","172.19.0.3","TCP","56","9002 → 43520 [ACK] Seq=316246 Ack=22148 Win=65535 Len=0"
"7.805888","5.9.29.183","172.19.0.3","TLSv1.2","599","Application Data"
"7.806587","172.19.0.3","5.9.29.183","TLSv1.2","599","Application Data"
"7.806836","5.9.29.183","172.19.0.3","TCP","56","9002 → 43520 [ACK] Seq=316789 Ack=22691 Win=65535 Len=0"
"8.075329","5.9.29.183","172.19.0.3","TCP","1516","[TCP segment of a reassembled PDU]"
"8.075446","5.9.29.183","172.19.0.3","TCP","1516","9002 → 43520 [PSH, ACK] Seq=318249 Ack=22691 Win=65535 Len=1460 [TCP segment of a reassembled PDU]"
"8.075466","5.9.29.183","172.19.0.3","TLSv1.2","763","Application Data"
"8.075614","172.19.0.3","5.9.29.183","TCP","56","43520 → 9002 [ACK] Seq=22691 Ack=320416 Win=11895 Len=0"
"8.092311","5.9.29.183","172.19.0.3","TCP","1516","[TCP segment of a reassembled PDU]"
"8.092366","5.9.29.183","172.19.0.3","TCP","1492","9002 → 43520 [PSH, ACK] Seq=321876 Ack=22691 Win=65535 Len=1436 [TCP segment of a reassembled PDU]"
"8.092381","172.19.0.3","5.9.29.183","TCP","56","43520 → 9002 [ACK] Seq=22691 Ack=323312 Win=11903 Len=0"
"8.092383","5.9.29.183","172.19.0.3","TLSv1.2","787","Application Data"
"8.103724","5.9.29.183","172.19.0.3","TCP","1516","[TCP segment of a reassembled PDU]"
"8.103743","172.19.0.3","5.9.29.183","TCP","56","43520 → 9002 [ACK] Seq=22691 Ack=325503 Win=11911 Len=0"
"8.103794","5.9.29.183","172.19.0.3","TCP","1516","9002 → 43520 [PSH, ACK] Seq=325503 Ack=22691 Win=65535 Len=1460 [TCP segment of a reassembled PDU]"
"8.103803","5.9.29.183","172.19.0.3","TLSv1.2","1480","Application Data [TCP segment of a reassembled PDU]"
"8.103806","5.9.29.183","172.19.0.3","TCP","1504","9002 → 43520 [PSH, ACK] Seq=328387 Ack=22691 Win=65535 Len=1448 [TCP segment of a reassembled PDU]"
"8.103920","172.19.0.3","5.9.29.183","TCP","56","43520 → 9002 [ACK] Seq=22691 Ack=329835 Win=11887 Len=0"
"8.108549","5.9.29.183","172.19.0.3","TLSv1.2","490","Application Data"
"8.123970","5.9.29.183","172.19.0.3","TLSv1.2","1113","Application Data"
"8.123992","172.19.0.3","5.9.29.183","TCP","56","43520 → 9002 [ACK] Seq=22691 Ack=331326 Win=11911 Len=0"
"8.124427","172.19.0.3","5.9.29.183","TLSv1.2","599","Application Data"
"8.124700","5.9.29.183","172.19.0.3","TCP","56","9002 → 43520 [ACK] Seq=331326 Ack=23234 Win=65535 Len=0"
"8.124719","5.9.29.183","172.19.0.3","TCP","1504","[TCP segment of a reassembled PDU]"
"8.138941","5.9.29.183","172.19.0.3","TLSv1.2","1207","Application Data"
"8.138955","172.19.0.3","5.9.29.183","TCP","56","43520 → 9002 [ACK] Seq=23234 Ack=333925 Win=11911 Len=0"
"8.142498","172.19.0.3","5.9.29.183","TLSv1.2","599","Application Data"
"8.142713","5.9.29.183","172.19.0.3","TCP","56","9002 → 43520 [ACK] Seq=333925 Ack=23777 Win=65535 Len=0"
"8.505996","5.9.29.183","172.19.0.3","TLSv1.2","599","Application Data"
"8.506663","172.19.0.3","5.9.29.183","TLSv1.2","599","Application Data"
"8.506901","5.9.29.183","172.19.0.3","TCP","56","9002 → 43520 [ACK] Seq=334468 Ack=24320 Win=65535 Len=0"
"8.556300","172.19.0.3","185.21.216.198","TLSv1.2","599","Application Data"
"8.556711","185.21.216.198","172.19.0.3","TCP","56","41389 → 37034 [ACK] Seq=544 Ack=544 Win=65535 Len=0"
"8.786073","5.9.29.183","172.19.0.3","TCP","1504","[TCP segment of a reassembled PDU]"
"8.786140","5.9.29.183","172.19.0.3","TCP","1516","9002 → 43520 [PSH, ACK] Seq=335916 Ack=24320 Win=65535 Len=1460 [TCP segment of a reassembled PDU]"
"8.786150","5.9.29.183","172.19.0.3","TLSv1.2","775","Application Data"
"8.786286","172.19.0.3","5.9.29.183","TCP","56","43520 → 9002 [ACK] Seq=24320 Ack=338095 Win=11895 Len=0"
"8.802734","5.9.29.183","172.19.0.3","TCP","1504","[TCP segment of a reassembled PDU]"
"8.802795","5.9.29.183","172.19.0.3","TCP","1516","9002 → 43520 [PSH, ACK] Seq=339543 Ack=24320 Win=65535 Len=1460 [TCP segment of a reassembled PDU]"
"8.802811","172.19.0.3","5.9.29.183","TCP","56","43520 → 9002 [ACK] Seq=24320 Ack=341003 Win=11903 Len=0"
"8.802893","5.9.29.183","172.19.0.3","TLSv1.2","775","Application Data"
"8.816142","5.9.29.183","172.19.0.3","TCP","1516","[TCP segment of a reassembled PDU]"
"8.816193","172.19.0.3","5.9.29.183","TCP","56","43520 → 9002 [ACK] Seq=24320 Ack=343182 Win=11911 Len=0"
"8.816241","5.9.29.183","172.19.0.3","TCP","1516","9002 → 43520 [PSH, ACK] Seq=343182 Ack=24320 Win=65535 Len=1460 [TCP segment of a reassembled PDU]"
"8.816315","5.9.29.183","172.19.0.3","TLSv1.2","1516","Application Data [TCP segment of a reassembled PDU]"
"8.816320","5.9.29.183","172.19.0.3","TCP","1516","9002 → 43520 [PSH, ACK] Seq=346102 Ack=24320 Win=65535 Len=1460 [TCP segment of a reassembled PDU]"
"8.816325","5.9.29.183","172.19.0.3","TCP","1456","9002 → 43520 [PSH, ACK] Seq=347562 Ack=24320 Win=65535 Len=1400 [TCP segment of a reassembled PDU]"
"8.816377","172.19.0.3","5.9.29.183","TCP","56","43520 → 9002 [ACK] Seq=24320 Ack=348962 Win=11879 Len=0"
"8.818732","5.9.29.183","172.19.0.3","TLSv1.2","584","Application Data"
"8.832788","5.9.29.183","172.19.0.3","TCP","1516","[TCP segment of a reassembled PDU]"
"8.832810","172.19.0.3","5.9.29.183","TCP","56","43520 → 9002 [ACK] Seq=24320 Ack=350950 Win=11911 Len=0"
"8.832862","5.9.29.183","172.19.0.3","TCP","1516","9002 → 43520 [PSH, ACK] Seq=350950 Ack=24320 Win=65535 Len=1460 [TCP segment of a reassembled PDU]"
"8.832873","5.9.29.183","172.19.0.3","TLSv1.2","1516","Application Data [TCP segment of a reassembled PDU]"
"8.832877","5.9.29.183","172.19.0.3","TCP","1516","9002 → 43520 [PSH, ACK] Seq=353870 Ack=24320 Win=65535 Len=1460 [TCP segment of a reassembled PDU]"
"8.832880","5.9.29.183","172.19.0.3","TCP","1456","9002 → 43520 [PSH, ACK] Seq=355330 Ack=24320 Win=65535 Len=1400 [TCP segment of a reassembled PDU]"
"8.833013","172.19.0.3","5.9.29.183","TCP","56","43520 → 9002 [ACK] Seq=24320 Ack=356730 Win=11879 Len=0"
"8.833168","5.9.29.183","172.19.0.3","TLSv1.2","1516","Application Data [TCP segment of a reassembled PDU]"
"8.833180","5.9.29.183","172.19.0.3","TCP","1516","9002 → 43520 [PSH, ACK] Seq=358190 Ack=24320 Win=65535 Len=1460 [TCP segment of a reassembled PDU]"
"8.833184","5.9.29.183","172.19.0.3","TCP","1480","9002 → 43520 [PSH, ACK] Seq=359650 Ack=24320 Win=65535 Len=1424 [TCP segment of a reassembled PDU]"
"8.833302","172.19.0.3","5.9.29.183","TCP","56","43520 → 9002 [ACK] Seq=24320 Ack=361074 Win=11855 Len=0"
"8.833783","5.9.29.183","172.19.0.3","TLSv1.2","924","Application Data, Application Data"
"8.834137","172.19.0.3","5.9.29.183","TLSv1.2","599","Application Data"
"8.834393","5.9.29.183","172.19.0.3","TCP","56","9002 → 43520 [ACK] Seq=361942 Ack=24863 Win=65535 Len=0"
"8.848529","5.9.29.183","172.19.0.3","TCP","1516","[TCP segment of a reassembled PDU]"
"8.848579","5.9.29.183","172.19.0.3","TCP","1516","9002 → 43520 [PSH, ACK] Seq=363402 Ack=24863 Win=65535 Len=1460 [TCP segment of a reassembled PDU]"
"8.848594","5.9.29.183","172.19.0.3","TLSv1.2","1516","Application Data [TCP segment of a reassembled PDU]"
"8.848599","5.9.29.183","172.19.0.3","TCP","1516","9002 → 43520 [PSH, ACK] Seq=366322 Ack=24863 Win=65535 Len=1460 [TCP segment of a reassembled PDU]"
"8.848602","5.9.29.183","172.19.0.3","TCP","1456","9002 → 43520 [PSH, ACK] Seq=367782 Ack=24863 Win=65535 Len=1400 [TCP segment of a reassembled PDU]"
"8.848694","5.9.29.183","172.19.0.3","TLSv1.2","584","Application Data"
"8.848711","172.19.0.3","5.9.29.183","TCP","56","43520 → 9002 [ACK] Seq=24863 Ack=369182 Win=11877 Len=0"
"8.868805","5.9.29.183","172.19.0.3","TLSv1.2","599","Application Data"
"8.869060","172.19.0.3","5.9.29.183","TCP","56","43520 → 9002 [ACK] Seq=24863 Ack=370253 Win=11911 Len=0"
"8.885129","5.9.29.183","172.19.0.3","TCP","1319","[TCP segment of a reassembled PDU]"
"8.885187","5.9.29.183","172.19.0.3","TCP","1516","9002 → 43520 [PSH, ACK] Seq=371516 Ack=24863 Win=65535 Len=1460 [TCP segment of a reassembled PDU]"
"8.885196","5.9.29.183","172.19.0.3","TLSv1.2","960","Application Data"
"8.885297","172.19.0.3","5.9.29.183","TCP","56","43520 → 9002 [ACK] Seq=24863 Ack=373880 Win=11895 Len=0"
"8.900124","5.9.29.183","172.19.0.3","TCP","1504","[TCP segment of a reassembled PDU]"
"8.900185","5.9.29.183","172.19.0.3","TLSv1.2","1207","Application Data"
"8.900213","172.19.0.3","5.9.29.183","TCP","56","43520 → 9002 [ACK] Seq=24863 Ack=376479 Win=11903 Len=0"
